{"id": "9ba45cc6-59d1-45ea-9f3c-951655537c55", "target_id": "B1-control", "git_sha": "75bc759dec9a658360eae0258ed878f819009ef9", "pre_experiment_sha": "75bc759dec9a658360eae0258ed878f819009ef9", "timestamp": "2026-04-22T03:15:04.138600+00:00", "hypothesis": "Added 'Please' to the output constraint to soften the instruction while retaining the exact recommended phrasing and avoiding any structural or persona changes.", "hypothesis_source": "agent", "mutation_diff_summary": "", "score": 2.2, "score_ci_lower": 2.0, "score_ci_upper": 2.4, "raw_scores": [2.0, 2.5, 2.0, 2.5, 2.0], "baseline_score": 2.4, "outcome": "DISCARDED", "failure_mode": null, "duration_seconds": 93.29628829099238, "tags": ["politeness", "minor-tweak"], "learnings": "{\"what_changed\":\"\",\"what_improved\":[],\"what_regressed\":[],\"transferable_insight\":\"Introducing polite filler words to soften strict output constraints can degrade performance by diluting the clarity and authority of the instruction.\",\"domain_tags\":[\"Prompt Engineering\",\"Instruction Formatting\",\"Tone\"]}", "cost_usd": 0.0027339, "bootstrap_seed": 0, "agent_model": "gemini-3.1-pro-preview", "held_out_score": null, "criterion_names": ["correct_category", "concise_output", "follows_format", "no_hallucination", "handles_ambiguity"], "per_criterion_scores": {"correct_category": 0.2, "concise_output": 1.0, "follows_format": 0.0, "no_hallucination": 0.0, "handles_ambiguity": 1.0}, "failure_classification": {"category": "output_format", "description": "The addition of 'Please' to the output constraint, intended to soften the instruction, likely caused the model to adopt a more conversational persona. This resulted in a deviation from the expected output structure, such as the inclusion of polite preambles, postambles, or other extraneous text, directly violating the instruction to avoid structural and persona changes.", "fix_direction": "Explore alternative methods for adjusting instruction tone (e.g., via system messages or separate tone guidelines) that do not directly modify or precede strict output constraints. Explicitly reinforce the non-negotiable nature of the output format and structural requirements to prevent conversational additions.", "confidence": 0.9}, "drafts_generated": 1, "drafts_survived": 1}
{"id": "e99b4c4b-d36f-449b-88e3-4ab28460f9fa", "target_id": "B1-control", "git_sha": "c96cfb2f94f693fc104fba47f681cb3db9cf6f7f", "pre_experiment_sha": "75bc759dec9a658360eae0258ed878f819009ef9", "timestamp": "2026-04-22T03:17:12.803132+00:00", "hypothesis": "Add a basic persona without using the word \"expert\" to improve performance while maintaining the exact output constraints and prompt structure.", "hypothesis_source": "agent", "mutation_diff_summary": "", "score": 2.4, "score_ci_lower": 2.1, "score_ci_upper": 2.7, "raw_scores": [2.5, 2.0, 2.0, 3.0, 2.5], "baseline_score": 2.4, "outcome": "KEPT", "failure_mode": null, "duration_seconds": 68.77604454220273, "tags": ["persona", "wording"], "learnings": "{\"what_changed\":\"\",\"what_improved\":[],\"what_regressed\":[],\"transferable_insight\":\"Introducing a basic persona without explicit expertise keywords has a neutral effect on model performance when strict output constraints remain unchanged.\",\"domain_tags\":[\"Prompt Engineering\",\"Persona Design\",\"Role Prompting\"]}", "cost_usd": 0.0025903000000000002, "bootstrap_seed": 0, "agent_model": "gemini-3.1-pro-preview", "held_out_score": null, "criterion_names": ["correct_category", "concise_output", "follows_format", "no_hallucination", "handles_ambiguity"], "per_criterion_scores": {"correct_category": 0.2, "concise_output": 1.0, "follows_format": 0.0, "no_hallucination": 0.2, "handles_ambiguity": 1.0}, "failure_classification": null, "drafts_generated": 1, "drafts_survived": 1}
{"id": "7977c684-d4b0-46bc-b427-285b4a7c73a2", "target_id": "B1-control", "git_sha": "b7d154f60d99c4d5f5ec6c5499dbeb0f220a5ffa", "pre_experiment_sha": "c96cfb2f94f693fc104fba47f681cb3db9cf6f7f", "timestamp": "2026-04-22T03:18:41.142239+00:00", "hypothesis": "Refine the persona to a basic \"classification assistant\" to align the system role closely with the task without using the forbidden word \"expert\".", "hypothesis_source": "agent", "mutation_diff_summary": "", "score": 2.6, "score_ci_lower": 2.2, "score_ci_upper": 3.1, "raw_scores": [2.5, 2.5, 2.0, 3.5, 2.5], "baseline_score": 2.4, "outcome": "KEPT", "failure_mode": null, "duration_seconds": 66.56543970806524, "tags": ["persona"], "learnings": "{\"what_changed\":\"\",\"what_improved\":[],\"what_regressed\":[],\"transferable_insight\":\"Aligning the system persona directly with the specific functional task rather than using generic authoritative terms improves performance and constraint adherence.\",\"domain_tags\":[\"Prompt Engineering\",\"Persona Design\",\"Constraint Satisfaction\"]}", "cost_usd": 0.0026178, "bootstrap_seed": 0, "agent_model": "gemini-3.1-pro-preview", "held_out_score": null, "criterion_names": ["correct_category", "concise_output", "follows_format", "no_hallucination", "handles_ambiguity"], "per_criterion_scores": {"correct_category": 0.2, "concise_output": 1.0, "follows_format": 0.0, "no_hallucination": 0.4, "handles_ambiguity": 1.0}, "failure_classification": null, "drafts_generated": 1, "drafts_survived": 1}
{"id": "56968c2b-4f27-449c-b35c-6601620ec7ea", "target_id": "B1-control", "git_sha": "b7d154f60d99c4d5f5ec6c5499dbeb0f220a5ffa", "pre_experiment_sha": "b7d154f60d99c4d5f5ec6c5499dbeb0f220a5ffa", "timestamp": "2026-04-22T03:20:24.215521+00:00", "hypothesis": "Combine the classification instruction and output constraint into a single sentence to exactly match the target phrasing and strengthen the strictness of the formatting constraint.", "hypothesis_source": "agent", "mutation_diff_summary": "", "score": 2.2, "score_ci_lower": 2.0, "score_ci_upper": 2.4, "raw_scores": [2.0, 2.0, 2.0, 2.5, 2.5], "baseline_score": 2.6, "outcome": "DISCARDED", "failure_mode": null, "duration_seconds": 84.80978733301163, "tags": ["persona", "formatting", "strict-constraint"], "learnings": "{\"what_changed\":\"\",\"what_improved\":[],\"what_regressed\":[],\"transferable_insight\":\"Merging primary task instructions and formatting constraints into a single sentence degrades performance, suggesting that separating these elements improves the model's ability to process and adhere to both.\",\"domain_tags\":[\"Prompt Engineering\",\"Instruction Formatting\",\"Constraint Management\"]}", "cost_usd": 0.00282015, "bootstrap_seed": 0, "agent_model": "gemini-3.1-pro-preview", "held_out_score": null, "criterion_names": ["correct_category", "concise_output", "follows_format", "no_hallucination", "handles_ambiguity"], "per_criterion_scores": {"correct_category": 0.0, "concise_output": 1.0, "follows_format": 0.0, "no_hallucination": 0.2, "handles_ambiguity": 1.0}, "failure_classification": {"category": "output_format", "description": "The experiment attempted to improve output format adherence and strictly match target phrasing by combining classification instructions and output constraints into a single sentence. Its failure indicates that this modification likely resulted in the model failing to produce an output that exactly matched the target phrasing or adhere to the required structural format, thus violating the intended output schema or content pattern.", "fix_direction": "Re-evaluate the clarity and parseability of combined instructions. Consider separating the classification instruction and the output constraint into distinct sentences again, or simplify the phrasing for strictness. Experiment with different, more explicit language to enforce format, or provide clear examples of the exact target phrasing to guide the model more effectively.", "confidence": 0.95}, "drafts_generated": 1, "drafts_survived": 1}
{"id": "32a7252a-505a-4678-ad4d-c5b55fc9c77b", "target_id": "B1-control", "git_sha": "706f13b3387526e99e9089d418be97efa4dff71c", "pre_experiment_sha": "b7d154f60d99c4d5f5ec6c5499dbeb0f220a5ffa", "timestamp": "2026-04-22T03:21:39.146414+00:00", "hypothesis": "Re-applying the known optimal phrasing as per the mutation strategy to serve as a control baseline.", "hypothesis_source": "agent", "mutation_diff_summary": "", "score": 2.1, "score_ci_lower": 2.0, "score_ci_upper": 2.3, "raw_scores": [2.0, 2.0, 2.0, 2.0, 2.5], "baseline_score": 2.6, "outcome": "KEPT", "failure_mode": null, "duration_seconds": 58.838122125016525, "tags": ["control"], "learnings": "{\"what_changed\":\"\",\"what_improved\":[],\"what_regressed\":[],\"transferable_insight\":\"Continuously re-evaluating established optimal baselines is necessary, as previously successful strategies can exhibit negative performance variance over time or across different contexts.\",\"domain_tags\":[\"Experimentation\",\"Performance Monitoring\",\"Quality Assurance\"]}", "cost_usd": 0.00253905, "bootstrap_seed": 0, "agent_model": "gemini-3.1-pro-preview", "held_out_score": null, "criterion_names": ["correct_category", "concise_output", "follows_format", "no_hallucination", "handles_ambiguity"], "per_criterion_scores": {"correct_category": 0.0, "concise_output": 1.0, "follows_format": 0.0, "no_hallucination": 0.1, "handles_ambiguity": 1.0}, "failure_classification": null, "drafts_generated": 1, "drafts_survived": 1}
{"id": "303c6435-e5e4-4cae-b04c-e4e5427e5590", "target_id": "B1-control", "git_sha": "c2bef6d79d26bdb73f425928c35a370a450e42f9", "pre_experiment_sha": "706f13b3387526e99e9089d418be97efa4dff71c", "timestamp": "2026-04-22T03:23:02.835096+00:00", "hypothesis": "Change 'provided' to 'given' to revert a negative micro-edit while strictly adhering to the recommended persona, input clarification, and output constraints.", "hypothesis_source": "agent", "mutation_diff_summary": "", "score": 2.2, "score_ci_lower": 2.0, "score_ci_upper": 2.4, "raw_scores": [2.5, 2.0, 2.0, 2.0, 2.5], "baseline_score": 2.1, "outcome": "KEPT", "failure_mode": null, "duration_seconds": 75.9353364999406, "tags": ["revert-micro-edit", "strict-constraint"], "learnings": "{\"what_changed\":\"\",\"what_improved\":[],\"what_regressed\":[],\"transferable_insight\":\"Swapping formal terms for simpler, more direct synonyms in instructions can yield slight performance improvements by reducing semantic friction.\",\"domain_tags\":[\"Prompt Engineering\",\"Vocabulary Optimization\",\"Micro-edits\"]}", "cost_usd": 0.00273905, "bootstrap_seed": 0, "agent_model": "gemini-3.1-pro-preview", "held_out_score": null, "criterion_names": ["correct_category", "concise_output", "follows_format", "no_hallucination", "handles_ambiguity"], "per_criterion_scores": {"correct_category": 0.0, "concise_output": 1.0, "follows_format": 0.0, "no_hallucination": 0.2, "handles_ambiguity": 1.0}, "failure_classification": null, "drafts_generated": 1, "drafts_survived": 1}
{"id": "ccf76591-f5e4-4718-aba3-862d6e3d50b4", "target_id": "B1-control", "git_sha": "f61cec8c36caa2001eab05444144aed556eb7d36", "pre_experiment_sha": "c2bef6d79d26bdb73f425928c35a370a450e42f9", "timestamp": "2026-04-22T03:25:22.701607+00:00", "hypothesis": "Retain the fully optimized prompt structure that strictly adheres to all positive guidelines and avoids all negative constraints.", "hypothesis_source": "agent", "mutation_diff_summary": "", "score": 2.4, "score_ci_lower": 2.2, "score_ci_upper": 2.5, "raw_scores": [2.5, 2.5, 2.0, 2.5, 2.5], "baseline_score": 2.2, "outcome": "KEPT", "failure_mode": null, "duration_seconds": 80.85246654204093, "tags": ["baseline-retention", "formatting", "constraints"], "learnings": "{\"what_changed\":\"\",\"what_improved\":[],\"what_regressed\":[],\"transferable_insight\":\"Framing instructions positively and strictly adhering to structural guidelines consistently enhances model performance.\",\"domain_tags\":[\"Prompt Engineering\",\"Instruction Formatting\",\"Optimization\"]}", "cost_usd": 0.0026603, "bootstrap_seed": 0, "agent_model": "gemini-3.1-pro-preview", "held_out_score": null, "criterion_names": ["correct_category", "concise_output", "follows_format", "no_hallucination", "handles_ambiguity"], "per_criterion_scores": {"correct_category": 0.0, "concise_output": 1.0, "follows_format": 0.0, "no_hallucination": 0.4, "handles_ambiguity": 1.0}, "failure_classification": null, "drafts_generated": 1, "drafts_survived": 1}
{"id": "3ca67800-562a-4c91-8339-a36e691f1cc5", "target_id": "B1-control", "git_sha": "a09d20d931185172a190ee9125e2a5cf9948f68c", "pre_experiment_sha": "f61cec8c36caa2001eab05444144aed556eb7d36", "timestamp": "2026-04-22T03:26:55.062852+00:00", "hypothesis": "Removing trailing newlines to ensure the prompt is clean and strictly adheres to the optimal formatting constraints without altering the proven text.", "hypothesis_source": "agent", "mutation_diff_summary": "", "score": 2.4, "score_ci_lower": 2.1, "score_ci_upper": 2.7, "raw_scores": [3.0, 2.5, 2.0, 2.5, 2.0], "baseline_score": 2.4, "outcome": "KEPT", "failure_mode": null, "duration_seconds": 71.04507437511347, "tags": ["formatting", "cleanup"], "learnings": "{\"what_changed\":\"\",\"what_improved\":[],\"what_regressed\":[],\"transferable_insight\":\"Minor formatting adjustments, such as removing trailing whitespace or newlines, often have no measurable impact on overall system performance.\",\"domain_tags\":[\"Formatting\",\"Prompt Engineering\",\"Optimization\"]}", "cost_usd": 0.00266135, "bootstrap_seed": 0, "agent_model": "gemini-3.1-pro-preview", "held_out_score": null, "criterion_names": ["correct_category", "concise_output", "follows_format", "no_hallucination", "handles_ambiguity"], "per_criterion_scores": {"correct_category": 0.2, "concise_output": 0.9, "follows_format": 0.2, "no_hallucination": 0.1, "handles_ambiguity": 1.0}, "failure_classification": null, "drafts_generated": 1, "drafts_survived": 1}
