{"id": "b6124738-95c7-4b0d-9015-416998cbaf94", "target_id": "B1-control", "git_sha": "5a88ba87bed9443588051624c99466be61ab1958", "pre_experiment_sha": "68d96c185fbe6e19a4b0d379f77244ff8b5e62d6", "timestamp": "2026-04-19T01:20:06.853379+00:00", "hypothesis": "Forcing a single-label-only output with strict decision rules will improve binary classification scoring.", "hypothesis_source": "agent", "mutation_diff_summary": "", "score": 3.3, "score_ci_lower": 2.7, "score_ci_upper": 3.9, "raw_scores": [4.0, 2.5, 4.0, 2.5, 3.5], "baseline_score": 0.0, "outcome": "KEPT", "failure_mode": null, "duration_seconds": 12.717516332981177, "tags": ["classification", "constrained-output", "binary"], "learnings": "{\"what_changed\":\"\",\"what_improved\":[],\"what_regressed\":[],\"transferable_insight\":\"When a task requires a binary decision, constraining the output format and enforcing explicit decision rules can improve scoring by reducing ambiguity and inconsistent responses.\",\"domain_tags\":[\"classification\",\"decision-making\",\"output-constraints\"]}", "cost_usd": 0.00785975, "bootstrap_seed": 0, "agent_model": "gpt-5.4", "held_out_score": null, "criterion_names": ["correct_category", "concise_output", "follows_format", "no_hallucination", "handles_ambiguity"], "per_criterion_scores": {"correct_category": 0.6, "concise_output": 1.0, "follows_format": 0.0, "no_hallucination": 0.7, "handles_ambiguity": 1.0}, "failure_classification": null, "drafts_generated": 1, "drafts_survived": 1}
{"id": "eaf100e4-b5c6-41ce-a70b-f47295cd85a5", "target_id": "B1-control", "git_sha": "5a88ba87bed9443588051624c99466be61ab1958", "pre_experiment_sha": "5a88ba87bed9443588051624c99466be61ab1958", "timestamp": "2026-04-19T01:20:25.095189+00:00", "hypothesis": "Adding sharper tie-breakers and strict normalization/output rules will improve single-label accuracy and reduce formatting errors.", "hypothesis_source": "agent", "mutation_diff_summary": "", "score": 2.5, "score_ci_lower": 2.1, "score_ci_upper": 2.9, "raw_scores": [3.0, 2.0, 3.0, 2.5, 2.0], "baseline_score": 3.3, "outcome": "DISCARDED", "failure_mode": null, "duration_seconds": 17.11504133301787, "tags": ["classification", "prompt-hardening", "tie-breakers", "output-constraints"], "learnings": "{\"what_changed\":\"\",\"what_improved\":[],\"what_regressed\":[],\"transferable_insight\":\"Adding stricter rules and more precise tie-breakers can backfire if they constrain the system without improving its underlying decision quality or robustness.\",\"domain_tags\":[\"evaluation\",\"decision-making\",\"process-design\"]}", "cost_usd": 0.01093215, "bootstrap_seed": 0, "agent_model": "gpt-5.4", "held_out_score": null, "criterion_names": ["correct_category", "concise_output", "follows_format", "no_hallucination", "handles_ambiguity"], "per_criterion_scores": {"correct_category": 0.3, "concise_output": 1.0, "follows_format": 0.0, "no_hallucination": 0.3, "handles_ambiguity": 0.9}, "failure_classification": {"category": "output_format", "description": "The experiment failed due to formatting/structure issues rather than core logic; output did not meet the required single-label schema or normalization/output rules.", "fix_direction": "Tighten output generation to exactly match the expected schema (single label, no extra fields/variants), enforce strict normalization before scoring, and add automated validation checks for format compliance.", "confidence": 0.62}, "drafts_generated": 1, "drafts_survived": 1}
{"id": "717765ff-c5b2-4843-86a4-09b0c4626aa3", "target_id": "B1-control", "git_sha": "5a88ba87bed9443588051624c99466be61ab1958", "pre_experiment_sha": "5a88ba87bed9443588051624c99466be61ab1958", "timestamp": "2026-04-19T01:20:45.755086+00:00", "hypothesis": "Adding stronger tie-breaking and label-copying rules will improve exact single-label compliance under stochastic evaluation.", "hypothesis_source": "agent", "mutation_diff_summary": "", "score": 3.2, "score_ci_lower": 2.6, "score_ci_upper": 3.7, "raw_scores": [3.5, 2.0, 3.0, 3.5, 4.0], "baseline_score": 3.3, "outcome": "DISCARDED", "failure_mode": null, "duration_seconds": 18.088946084026247, "tags": ["classification", "exact-match", "tie-breaking", "output-format"], "learnings": "{\"what_changed\":\"\",\"what_improved\":[],\"what_regressed\":[],\"transferable_insight\":\"Adding more deterministic decision rules can fail to improve compliance when the underlying stochastic process still dominates outcomes, so rule complexity should be validated against actual measured behavior rather than assumed control.\",\"domain_tags\":[\"decision-making\",\"stochastic-systems\",\"evaluation\"]}", "cost_usd": 0.011103950000000001, "bootstrap_seed": 0, "agent_model": "gpt-5.4", "held_out_score": null, "criterion_names": ["correct_category", "concise_output", "follows_format", "no_hallucination", "handles_ambiguity"], "per_criterion_scores": {"correct_category": 0.6, "concise_output": 1.0, "follows_format": 0.0, "no_hallucination": 0.6, "handles_ambiguity": 1.0}, "failure_classification": {"category": "logic_error", "description": "The provided information (hypothesis, score, and failure mode marked as unknown) does not specify what kind of failure occurred\u2014e.g., whether there was a formatting/schema issue, logic error, regression, or semantic meaning mismatch.", "fix_direction": "Instrument and inspect the failure: capture exact outputs for a failing set of stochastic trials and compare against expected single-label constraints; then categorize by checking (1) output format validity, (2) label selection logic, and (3) whether changes altered meaning or compliance rules rather than only tie-breaking.", "confidence": 0.15}, "drafts_generated": 1, "drafts_survived": 1}
{"id": "9d452051-b17e-416d-9175-d93424188b37", "target_id": "B1-control", "git_sha": "5a88ba87bed9443588051624c99466be61ab1958", "pre_experiment_sha": "5a88ba87bed9443588051624c99466be61ab1958", "timestamp": "2026-04-19T01:21:04.546456+00:00", "hypothesis": "Tightening the prompt with deterministic tie-breaking and stronger output constraints will improve single-label compliance and consistency.", "hypothesis_source": "agent", "mutation_diff_summary": "", "score": 3.6, "score_ci_lower": 3.3, "score_ci_upper": 3.9, "raw_scores": [3.5, 3.0, 4.0, 4.0, 3.5], "baseline_score": 3.3, "outcome": "DISCARDED", "failure_mode": null, "duration_seconds": 13.982493874966167, "tags": ["single-label", "deterministic", "output-format", "tie-break"], "learnings": "{\"what_changed\":\"\",\"what_improved\":[],\"what_regressed\":[],\"transferable_insight\":\"When an intervention shows no measurable gains or regressions, the most transferable lesson is that added constraints may increase structure without necessarily improving the target outcome, so validate impact with direct metrics rather than assuming tighter control helps.\",\"domain_tags\":[\"experimentation\",\"prompting\",\"evaluation\"]}", "cost_usd": 0.010001150000000002, "bootstrap_seed": 0, "agent_model": "gpt-5.4", "held_out_score": null, "criterion_names": ["correct_category", "concise_output", "follows_format", "no_hallucination", "handles_ambiguity"], "per_criterion_scores": {"correct_category": 0.8, "concise_output": 1.0, "follows_format": 0.0, "no_hallucination": 0.8, "handles_ambiguity": 1.0}, "failure_classification": {"category": "output_format", "description": "The experiment failed despite tighter prompting, suggesting the model still produced outputs that did not meet the expected single-label/output structure requirements (format/schema compliance).", "fix_direction": "Further enforce the required output schema via stricter constraints (e.g., mandatory JSON with exact keys, no extra text), add explicit regex/validator checks, and apply deterministic label selection rules to ensure only the allowed label appears.", "confidence": 0.42}, "drafts_generated": 1, "drafts_survived": 1}
{"id": "29a6695a-6f28-4abd-ae53-19b4c134f8c1", "target_id": "B1-control", "git_sha": "5a88ba87bed9443588051624c99466be61ab1958", "pre_experiment_sha": "5a88ba87bed9443588051624c99466be61ab1958", "timestamp": "2026-04-19T01:21:21.588742+00:00", "hypothesis": "Make the prompt more rigid and deterministic by emphasizing strongest-evidence selection and exact one-label output.", "hypothesis_source": "agent", "mutation_diff_summary": "", "score": 3.3, "score_ci_lower": 2.8, "score_ci_upper": 3.7, "raw_scores": [4.0, 2.5, 3.0, 3.5, 3.5], "baseline_score": 3.3, "outcome": "DISCARDED", "failure_mode": null, "duration_seconds": 14.899705874966457, "tags": ["single-label", "deterministic", "parsing", "tie-break"], "learnings": "{\"what_changed\":\"\",\"what_improved\":[],\"what_regressed\":[],\"transferable_insight\":\"Increasing rigidity and forcing a single exact output does not necessarily improve performance when the underlying task lacks enough signal or the added constraints do not change the model\u2019s decision quality.\",\"domain_tags\":[\"prompting\",\"decision-making\",\"evaluation\"]}", "cost_usd": 0.00976955, "bootstrap_seed": 0, "agent_model": "gpt-5.4", "held_out_score": null, "criterion_names": ["correct_category", "concise_output", "follows_format", "no_hallucination", "handles_ambiguity"], "per_criterion_scores": {"correct_category": 0.7, "concise_output": 1.0, "follows_format": 0.0, "no_hallucination": 0.6, "handles_ambiguity": 1.0}, "failure_classification": {"category": "output_format", "description": "The experiment aimed to force a deterministic, exact one-label output, but the result scored poorly, indicating the model likely did not adhere to the required output structure/schema for label-only classification (e.g., extra text, multiple labels, or missing the exact one-label format).", "fix_direction": "Tighten the prompt and add explicit, testable output constraints (e.g., JSON or single token label only), plus a verification step that rejects non-conforming outputs and forces re-generation in the correct schema.", "confidence": 0.48}, "drafts_generated": 1, "drafts_survived": 1}
{"id": "ef2781b8-ae88-4a05-b793-a1d2d2a18209", "target_id": "B1-control", "git_sha": "5a88ba87bed9443588051624c99466be61ab1958", "pre_experiment_sha": "5a88ba87bed9443588051624c99466be61ab1958", "timestamp": "2026-04-19T01:21:44.447232+00:00", "hypothesis": "Tightening the prompt with deterministic tie-breaking and stricter output constraints will improve single-label compliance and parsing stability.", "hypothesis_source": "agent", "mutation_diff_summary": "", "score": 3.3, "score_ci_lower": 2.5, "score_ci_upper": 4.0, "raw_scores": [4.0, 2.5, 4.0, 4.0, 2.0], "baseline_score": 3.3, "outcome": "DISCARDED", "failure_mode": null, "duration_seconds": 20.63496837497223, "tags": ["single-label", "deterministic", "formatting", "tie-break"], "learnings": "{\"what_changed\":\"\",\"what_improved\":[],\"what_regressed\":[],\"transferable_insight\":\"Adding stricter constraints and deterministic tie-breaking does not guarantee better compliance or parsing stability when the underlying task behavior is already unchanged.\",\"domain_tags\":[\"prompting\",\"evaluation\",\"reliability\"]}", "cost_usd": 0.01079355, "bootstrap_seed": 0, "agent_model": "gpt-5.4", "held_out_score": null, "criterion_names": ["correct_category", "concise_output", "follows_format", "no_hallucination", "handles_ambiguity"], "per_criterion_scores": {"correct_category": 0.6, "concise_output": 1.0, "follows_format": 0.0, "no_hallucination": 0.7, "handles_ambiguity": 1.0}, "failure_classification": {"category": "output_format", "description": "The experiment failed under stricter prompting/constraints but still ended up with an unknown failure mode, consistent with the model producing responses that were not reliably parseable or did not fully match the required single-label/output schema under deterministic settings.", "fix_direction": "Further tighten and validate the output schema: enforce exact field order/labels, add explicit examples, and implement post-generation validation with a constrained decoder or retry-on-parse-failure to guarantee parseable, single-label output.", "confidence": 0.42}, "drafts_generated": 1, "drafts_survived": 1}
{"id": "2f505021-46f1-4733-b1f3-b93ec9e1785c", "target_id": "B1-control", "git_sha": "5a88ba87bed9443588051624c99466be61ab1958", "pre_experiment_sha": "5a88ba87bed9443588051624c99466be61ab1958", "timestamp": "2026-04-19T01:22:07.562401+00:00", "hypothesis": "Tightening the prompt to enforce immediate single-label output with simple deterministic tie-breaking will improve one-label compliance and parsing stability.", "hypothesis_source": "agent", "mutation_diff_summary": "", "score": 2.4, "score_ci_lower": 1.9, "score_ci_upper": 2.9, "raw_scores": [3.0, 2.0, 2.5, 3.0, 1.5], "baseline_score": 3.3, "outcome": "DISCARDED", "failure_mode": null, "duration_seconds": 17.69879050005693, "tags": ["single-label", "deterministic", "format-strict", "minimal"], "learnings": "{\"what_changed\":\"\",\"what_improved\":[],\"what_regressed\":[],\"transferable_insight\":\"When a task requires a strict output format, adding explicit constraints and deterministic fallback rules can improve reliability, but only if the model can consistently follow them under all cases.\",\"domain_tags\":[\"prompt-engineering\",\"reliability\",\"output-formatting\"]}", "cost_usd": 0.010053750000000002, "bootstrap_seed": 0, "agent_model": "gpt-5.4", "held_out_score": null, "criterion_names": ["correct_category", "concise_output", "follows_format", "no_hallucination", "handles_ambiguity"], "per_criterion_scores": {"correct_category": 0.5, "concise_output": 0.8, "follows_format": 0.0, "no_hallucination": 0.3, "handles_ambiguity": 0.8}, "failure_classification": {"category": "output_format", "description": "The experiment failed with an unknown failure mode and a low score, indicating the model likely did not reliably adhere to the required single-label deterministic output structure/schema (leading to parsing instability).", "fix_direction": "Strengthen the output contract: explicitly require exactly one label token with no extra text, add deterministic tie-breaking rules, and include strict schema/format validation before returning.", "confidence": 0.42}, "drafts_generated": 1, "drafts_survived": 1}
{"id": "216f9063-b23a-4eff-a812-c96abfebe9af", "target_id": "B1-control", "git_sha": "5a88ba87bed9443588051624c99466be61ab1958", "pre_experiment_sha": "5a88ba87bed9443588051624c99466be61ab1958", "timestamp": "2026-04-19T01:22:23.940113+00:00", "hypothesis": "Tightening the prompt to enforce immediate single-label output with deterministic tie-breaking will improve parse compliance and binary scoring.", "hypothesis_source": "agent", "mutation_diff_summary": "", "score": 2.8, "score_ci_lower": 2.3, "score_ci_upper": 3.2, "raw_scores": [3.0, 2.0, 3.0, 2.5, 3.5], "baseline_score": 3.3, "outcome": "DISCARDED", "failure_mode": null, "duration_seconds": 14.19158625009004, "tags": ["single-label", "deterministic", "strict-format", "tie-break"], "learnings": "{\"what_changed\":\"\",\"what_improved\":[],\"what_regressed\":[],\"transferable_insight\":\"When a task requires machine-readable output, stricter formatting rules and explicit tie-breaking can improve reliability, but only if they align with the underlying decision quality rather than just the surface syntax.\",\"domain_tags\":[\"prompt-engineering\",\"evaluation\",\"reliability\"]}", "cost_usd": 0.010332950000000002, "bootstrap_seed": 0, "agent_model": "gpt-5.4", "held_out_score": null, "criterion_names": ["correct_category", "concise_output", "follows_format", "no_hallucination", "handles_ambiguity"], "per_criterion_scores": {"correct_category": 0.5, "concise_output": 1.0, "follows_format": 0.0, "no_hallucination": 0.5, "handles_ambiguity": 0.8}, "failure_classification": {"category": "logic_error", "description": "The provided details do not specify the actual observable failure (e.g., formatting/schema mismatch, parsing error, incorrect reasoning, or other behavioral deviation). 'Failure Mode: unknown' prevents identifying the concrete cause behind the failed experiment.", "fix_direction": "Re-run with detailed failure logging (captured model output, parser error messages, and the exact point of evaluation/binary scoring failure) to determine whether the issue is output formatting, parsing/syntax, semantic correctness, or a regression relative to a baseline.", "confidence": 0.05}, "drafts_generated": 1, "drafts_survived": 1}
{"id": "79696e9c-9b26-4b54-bc3d-e374e9a7eea9", "target_id": "B1-control", "git_sha": "5a88ba87bed9443588051624c99466be61ab1958", "pre_experiment_sha": "5a88ba87bed9443588051624c99466be61ab1958", "timestamp": "2026-04-19T01:22:43.825309+00:00", "hypothesis": "Tightening the prompt to enforce an immediate single-label output with deterministic tie-breaking will improve binary compliance.", "hypothesis_source": "agent", "mutation_diff_summary": "", "score": 3.0, "score_ci_lower": 2.6, "score_ci_upper": 3.4, "raw_scores": [3.0, 2.5, 3.5, 3.5, 2.5], "baseline_score": 3.3, "outcome": "DISCARDED", "failure_mode": null, "duration_seconds": 12.451140166958794, "tags": ["single-label", "deterministic", "formatting", "compliance"], "learnings": "{\"what_changed\":\"\",\"what_improved\":[],\"what_regressed\":[],\"transferable_insight\":\"When a task requires strict binary compliance, adding explicit output constraints and deterministic tie-breaking can reduce ambiguity and improve consistency.\",\"domain_tags\":[\"prompting\",\"classification\",\"decision-making\"]}", "cost_usd": 0.01019895, "bootstrap_seed": 0, "agent_model": "gpt-5.4", "held_out_score": null, "criterion_names": ["correct_category", "concise_output", "follows_format", "no_hallucination", "handles_ambiguity"], "per_criterion_scores": {"correct_category": 0.4, "concise_output": 1.0, "follows_format": 0.0, "no_hallucination": 0.7, "handles_ambiguity": 0.9}, "failure_classification": {"category": "output_format", "description": "The experiment failed to meet the required output structure/schema for the expected immediate single-label, despite the intent to tighten prompt constraints and enforce deterministic tie-breaking.", "fix_direction": "Make the output schema explicit and strictly machine-validated (e.g., enforce exact JSON-only response with a single label field), add stronger constraints for no extra keys/whitespace, and ensure tie-breaking rules are reflected in the output template.", "confidence": 0.34}, "drafts_generated": 1, "drafts_survived": 1}
{"id": "30744177-7457-48da-87dc-1f8ad8668fad", "target_id": "B1-control", "git_sha": "5a88ba87bed9443588051624c99466be61ab1958", "pre_experiment_sha": "5a88ba87bed9443588051624c99466be61ab1958", "timestamp": "2026-04-19T01:23:00.735709+00:00", "hypothesis": "Tightening the prompt to enforce an immediate single-label decision with deterministic tie-breaking will improve strict one-label compliance.", "hypothesis_source": "agent", "mutation_diff_summary": "", "score": 3.1, "score_ci_lower": 2.5, "score_ci_upper": 3.6, "raw_scores": [3.0, 2.0, 4.0, 3.5, 3.0], "baseline_score": 3.3, "outcome": "DISCARDED", "failure_mode": null, "duration_seconds": 12.544956958037801, "tags": ["single-label", "deterministic", "format-control", "tie-breaking"], "learnings": "{\"what_changed\":\"\",\"what_improved\":[],\"what_regressed\":[],\"transferable_insight\":\"When a task requires exactly one output, making the decision rule explicit and deterministic reduces ambiguity and improves compliance with the required format.\",\"domain_tags\":[\"prompt-design\",\"classification\",\"output-formatting\"]}", "cost_usd": 0.010170550000000002, "bootstrap_seed": 0, "agent_model": "gpt-5.4", "held_out_score": null, "criterion_names": ["correct_category", "concise_output", "follows_format", "no_hallucination", "handles_ambiguity"], "per_criterion_scores": {"correct_category": 0.4, "concise_output": 1.0, "follows_format": 0.0, "no_hallucination": 0.7, "handles_ambiguity": 1.0}, "failure_classification": {"category": "semantic_drift", "description": "The experiment intended to improve strict one-label compliance by tightening prompt rules, but the result failed (score 3.1) without clear output-format or syntax issues. This suggests the model\u2019s behavior likely drifted in meaning/decision-making (e.g., not consistently producing the intended single label despite prompt constraints) rather than a pure formatting or parsing failure.", "fix_direction": "Focus on enforcing and validating the single-label decision end-to-end: add explicit constraint-checking, deterministic tie-breaking instructions tied directly to label selection, and (if applicable) post-generation validation to reject multi-label/ambiguous outputs and re-prompt or map to a single label deterministically.", "confidence": 0.44}, "drafts_generated": 1, "drafts_survived": 1}
