{"id": "6ebf7733-101a-4175-8f21-296ebc34cc13", "target_id": "B1-control", "git_sha": "83ea04997fae53912ce5a95b65433aaff39c7141", "pre_experiment_sha": "67f25cfe30aff12c32ca50034b9ab4ddc24c99f7", "timestamp": "2026-04-24T00:16:35.668907+00:00", "hypothesis": "Simplify the phrasing for selecting the most specific category to make the instruction more direct, while maintaining strict formatting and category distinction rules.", "hypothesis_source": "agent", "mutation_diff_summary": "", "score": 2.3, "score_ci_lower": 2.1, "score_ci_upper": 2.5, "raw_scores": [2.0, 2.0, 2.5, 2.5, 2.5], "baseline_score": 2.4, "outcome": "KEPT", "failure_mode": null, "duration_seconds": 68.41125141596422, "tags": ["clarity", "simplification"], "learnings": "{\"what_changed\":\"\",\"what_improved\":[],\"what_regressed\":[],\"transferable_insight\":\"Simplifying instructional phrasing for directness while preserving strict constraints maintains effective performance in classification tasks.\",\"domain_tags\":[\"Prompt Engineering\",\"Instruction Simplification\",\"Classification\"]}", "cost_usd": 0.0030528000000000005, "bootstrap_seed": 0, "agent_model": "gemini-3.1-pro-preview", "held_out_score": null, "criterion_names": ["correct_category", "concise_output", "follows_format", "no_hallucination", "handles_ambiguity"], "per_criterion_scores": {"correct_category": 0.1, "concise_output": 1.0, "follows_format": 0.0, "no_hallucination": 0.2, "handles_ambiguity": 1.0}, "failure_classification": null, "drafts_generated": 1, "drafts_survived": 1}
{"id": "e3d7f3c7-fedb-4487-9944-afac0f629bee", "target_id": "B1-control", "git_sha": "e86b3d6c89fb13f670a0aab993ac865f47e79ded", "pre_experiment_sha": "83ea04997fae53912ce5a95b65433aaff39c7141", "timestamp": "2026-04-24T00:18:11.475538+00:00", "hypothesis": "Simplify the phrasing for selecting the most specific category to make the instruction more direct while preserving all formatting constraints.", "hypothesis_source": "agent", "mutation_diff_summary": "", "score": 2.3, "score_ci_lower": 2.0, "score_ci_upper": 2.7, "raw_scores": [2.5, 3.0, 2.0, 2.0, 2.0], "baseline_score": 2.3, "outcome": "KEPT", "failure_mode": null, "duration_seconds": 74.60184391587973, "tags": ["clarity", "simplification"], "learnings": "{\"what_changed\":\"\",\"what_improved\":[],\"what_regressed\":[],\"transferable_insight\":\"Simplifying instructional phrasing to be more direct, while maintaining the same underlying constraints, may not significantly impact overall performance.\",\"domain_tags\":[\"Prompt Engineering\",\"Instruction Design\"]}", "cost_usd": 0.0030178, "bootstrap_seed": 0, "agent_model": "gemini-3.1-pro-preview", "held_out_score": null, "criterion_names": ["correct_category", "concise_output", "follows_format", "no_hallucination", "handles_ambiguity"], "per_criterion_scores": {"correct_category": 0.0, "concise_output": 1.0, "follows_format": 0.1, "no_hallucination": 0.2, "handles_ambiguity": 1.0}, "failure_classification": null, "drafts_generated": 1, "drafts_survived": 1}
{"id": "15d57e2d-6f82-4c1b-8e7f-54b0407c7823", "target_id": "B1-control", "git_sha": "0a4aebd79b84d488a12ee3736588f1f84688e8e8", "pre_experiment_sha": "e86b3d6c89fb13f670a0aab993ac865f47e79ded", "timestamp": "2026-04-24T00:19:18.744822+00:00", "hypothesis": "Simplify the phrasing for selecting the most specific category and explicitly instruct the model to treat provided categories and their definitions as strictly distinct and mutually exclusive.", "hypothesis_source": "agent", "mutation_diff_summary": "", "score": 2.4, "score_ci_lower": 2.0, "score_ci_upper": 3.0, "raw_scores": [3.5, 2.0, 2.0, 2.5, 2.0], "baseline_score": 2.3, "outcome": "KEPT", "failure_mode": null, "duration_seconds": 63.31338237505406, "tags": ["clarity", "simplicity"], "learnings": "{\"what_changed\":\"\",\"what_improved\":[],\"what_regressed\":[],\"transferable_insight\":\"Explicitly instructing models to treat categories as mutually exclusive while simplifying the criteria for specificity enhances classification performance.\",\"domain_tags\":[\"Classification\",\"Prompt Engineering\"]}", "cost_usd": 0.0031178000000000004, "bootstrap_seed": 0, "agent_model": "gemini-3.1-pro-preview", "held_out_score": null, "criterion_names": ["correct_category", "concise_output", "follows_format", "no_hallucination", "handles_ambiguity"], "per_criterion_scores": {"correct_category": 0.2, "concise_output": 1.0, "follows_format": 0.0, "no_hallucination": 0.2, "handles_ambiguity": 1.0}, "failure_classification": null, "drafts_generated": 1, "drafts_survived": 1}
{"id": "e805da71-29e8-498a-b1cb-ca30adc6f665", "target_id": "B1-control", "git_sha": "983d6535bf50bbd5c546a82aece3269cd50c4d80", "pre_experiment_sha": "0a4aebd79b84d488a12ee3736588f1f84688e8e8", "timestamp": "2026-04-24T00:20:36.270358+00:00", "hypothesis": "Simplify the phrasing for selecting the most specific category to make the instruction more direct while explicitly maintaining the strict distinctness of the categories.", "hypothesis_source": "agent", "mutation_diff_summary": "", "score": 2.2, "score_ci_lower": 2.0, "score_ci_upper": 2.4, "raw_scores": [2.0, 2.0, 2.5, 2.0, 2.5], "baseline_score": 2.4, "outcome": "KEPT", "failure_mode": null, "duration_seconds": 70.9783242919948, "tags": ["clarity", "simplification", "direct-instruction"], "learnings": "{\"what_changed\":\"\",\"what_improved\":[],\"what_regressed\":[],\"transferable_insight\":\"Simplifying instructions for selecting specific and distinct categories can reduce accuracy, indicating that complex categorization tasks benefit from more detailed, nuanced guidance.\",\"domain_tags\":[\"Prompt Engineering\",\"Categorization\",\"Instruction Design\"]}", "cost_usd": 0.0031515500000000004, "bootstrap_seed": 0, "agent_model": "gemini-3.1-pro-preview", "held_out_score": null, "criterion_names": ["correct_category", "concise_output", "follows_format", "no_hallucination", "handles_ambiguity"], "per_criterion_scores": {"correct_category": 0.0, "concise_output": 1.0, "follows_format": 0.0, "no_hallucination": 0.2, "handles_ambiguity": 1.0}, "failure_classification": null, "drafts_generated": 1, "drafts_survived": 1}
{"id": "e237c75e-d3b4-43bf-b008-2539f398081c", "target_id": "B1-control", "git_sha": "4131d771edc3a3b64341fb7607700e7054bf6c95", "pre_experiment_sha": "983d6535bf50bbd5c546a82aece3269cd50c4d80", "timestamp": "2026-04-24T00:22:09.481685+00:00", "hypothesis": "Simplify the instruction for selecting the most specific category to be more direct, while strictly preserving all formatting constraints and the requirement for mutual exclusivity.", "hypothesis_source": "agent", "mutation_diff_summary": "", "score": 2.3, "score_ci_lower": 2.0, "score_ci_upper": 2.7, "raw_scores": [2.0, 2.5, 2.0, 3.0, 2.0], "baseline_score": 2.2, "outcome": "KEPT", "failure_mode": null, "duration_seconds": 73.13031525001861, "tags": ["simplification", "direct-instruction"], "learnings": "{\"what_changed\":\"\",\"what_improved\":[],\"what_regressed\":[],\"transferable_insight\":\"Simplifying task instructions to be more direct, while strictly maintaining structural and logical constraints, improves model comprehension and accuracy.\",\"domain_tags\":[\"Prompt Engineering\",\"Instruction Simplification\",\"Classification\"]}", "cost_usd": 0.0031403000000000004, "bootstrap_seed": 0, "agent_model": "gemini-3.1-pro-preview", "held_out_score": null, "criterion_names": ["correct_category", "concise_output", "follows_format", "no_hallucination", "handles_ambiguity"], "per_criterion_scores": {"correct_category": 0.1, "concise_output": 1.0, "follows_format": 0.1, "no_hallucination": 0.1, "handles_ambiguity": 1.0}, "failure_classification": null, "drafts_generated": 1, "drafts_survived": 1}
{"id": "caac4d7a-13cd-488d-bed5-180e318f6a70", "target_id": "B1-control", "git_sha": "fedff7eeb14eec72225a6a88353bba7fc6872ae9", "pre_experiment_sha": "4131d771edc3a3b64341fb7607700e7054bf6c95", "timestamp": "2026-04-24T00:23:19.029398+00:00", "hypothesis": "Simplifying the selection phrasing to be more direct and explicitly instructing the model to treat categories as strictly distinct will improve classification accuracy while maintaining all critical formatting constraints.", "hypothesis_source": "agent", "mutation_diff_summary": "", "score": 2.3, "score_ci_lower": 2.1, "score_ci_upper": 2.5, "raw_scores": [2.5, 2.5, 2.0, 2.5, 2.0], "baseline_score": 2.3, "outcome": "KEPT", "failure_mode": null, "duration_seconds": 64.51984683307819, "tags": ["simplicity", "direct-instruction"], "learnings": "{\"what_changed\":\"\",\"what_improved\":[],\"what_regressed\":[],\"transferable_insight\":\"Simplifying instructions and explicitly enforcing strict boundaries between categories maintains system performance while improving overall clarity.\",\"domain_tags\":[\"Prompt Engineering\",\"Classification\",\"Instruction Clarity\"]}", "cost_usd": 0.00317905, "bootstrap_seed": 0, "agent_model": "gemini-3.1-pro-preview", "held_out_score": null, "criterion_names": ["correct_category", "concise_output", "follows_format", "no_hallucination", "handles_ambiguity"], "per_criterion_scores": {"correct_category": 0.1, "concise_output": 1.0, "follows_format": 0.0, "no_hallucination": 0.2, "handles_ambiguity": 1.0}, "failure_classification": null, "drafts_generated": 1, "drafts_survived": 1}
{"id": "b109d984-dd29-4313-b51e-8809f646a7c7", "target_id": "B1-control", "git_sha": "01b8b3ee93ec64a2c301a99d35639cb4fad49236", "pre_experiment_sha": "fedff7eeb14eec72225a6a88353bba7fc6872ae9", "timestamp": "2026-04-24T00:24:25.615013+00:00", "hypothesis": "Simplify the phrasing for selecting the most specific category to be more direct, while explicitly instructing the model to treat categories as strictly distinct and maintaining all formatting instructions.", "hypothesis_source": "agent", "mutation_diff_summary": "", "score": 2.4, "score_ci_lower": 2.0, "score_ci_upper": 2.8, "raw_scores": [3.0, 2.0, 2.0, 3.0, 2.0], "baseline_score": 2.3, "outcome": "KEPT", "failure_mode": null, "duration_seconds": 61.18916195794009, "tags": ["clarity", "simplification", "constraints"], "learnings": "{\"what_changed\":\"\",\"what_improved\":[],\"what_regressed\":[],\"transferable_insight\":\"Simplifying task instructions to be more direct while explicitly enforcing mutual exclusivity between categories improves classification accuracy.\",\"domain_tags\":[\"Prompt Engineering\",\"Classification\",\"Instruction Clarity\"]}", "cost_usd": 0.00313905, "bootstrap_seed": 0, "agent_model": "gemini-3.1-pro-preview", "held_out_score": null, "criterion_names": ["correct_category", "concise_output", "follows_format", "no_hallucination", "handles_ambiguity"], "per_criterion_scores": {"correct_category": 0.2, "concise_output": 1.0, "follows_format": 0.0, "no_hallucination": 0.2, "handles_ambiguity": 1.0}, "failure_classification": null, "drafts_generated": 1, "drafts_survived": 1}
{"id": "639dfcbf-b016-4bdb-be8a-769d6581ddcc", "target_id": "B1-control", "git_sha": "8a8d7a2c9969d52730d3080fd07e7d48efd39bc7", "pre_experiment_sha": "01b8b3ee93ec64a2c301a99d35639cb4fad49236", "timestamp": "2026-04-24T00:26:04.349066+00:00", "hypothesis": "Making the classification command more direct and explicitly stating that categories are \"mutually exclusive\" will improve precision while strictly adhering to all formatting and negative constraints.", "hypothesis_source": "agent", "mutation_diff_summary": "", "score": 2.8, "score_ci_lower": 2.5, "score_ci_upper": 3.2, "raw_scores": [2.5, 3.5, 3.0, 2.5, 2.5], "baseline_score": 2.4, "outcome": "KEPT", "failure_mode": null, "duration_seconds": 78.62574570812285, "tags": ["clarity", "conciseness", "mutually-exclusive"], "learnings": "{\"what_changed\":\"\",\"what_improved\":[],\"what_regressed\":[],\"transferable_insight\":\"Explicitly stating that categories are mutually exclusive and using direct instructional language improves precision in classification tasks.\",\"domain_tags\":[\"Classification\",\"Prompt Engineering\"]}", "cost_usd": 0.0031576, "bootstrap_seed": 0, "agent_model": "gemini-3.1-pro-preview", "held_out_score": null, "criterion_names": ["correct_category", "concise_output", "follows_format", "no_hallucination", "handles_ambiguity"], "per_criterion_scores": {"correct_category": 0.2, "concise_output": 1.0, "follows_format": 0.1, "no_hallucination": 0.5, "handles_ambiguity": 1.0}, "failure_classification": null, "drafts_generated": 1, "drafts_survived": 1}
{"id": "2cbe8b64-e2cb-4131-aede-31a86986c087", "target_id": "B1-control", "git_sha": "8a8d7a2c9969d52730d3080fd07e7d48efd39bc7", "pre_experiment_sha": "8a8d7a2c9969d52730d3080fd07e7d48efd39bc7", "timestamp": "2026-04-24T00:27:21.873665+00:00", "hypothesis": "Simplify the category selection instruction to be more direct by removing redundant wording while maintaining the exact required formatting constraints.", "hypothesis_source": "agent", "mutation_diff_summary": "", "score": 2.3, "score_ci_lower": 2.1, "score_ci_upper": 2.5, "raw_scores": [2.0, 2.0, 2.5, 2.5, 2.5], "baseline_score": 2.8, "outcome": "DISCARDED", "failure_mode": null, "duration_seconds": 72.55823491699994, "tags": ["conciseness", "clarity", "strict-formatting"], "learnings": "{\"what_changed\":\"\",\"what_improved\":[],\"what_regressed\":[],\"transferable_insight\":\"Streamlining instructions by removing seemingly redundant wording can degrade performance, as the extra context or repetition often helps reinforce complex task requirements.\",\"domain_tags\":[\"Prompt Engineering\",\"Instruction Design\",\"Context Optimization\"]}", "cost_usd": 0.0031384500000000005, "bootstrap_seed": 0, "agent_model": "gemini-3.1-pro-preview", "held_out_score": null, "criterion_names": ["correct_category", "concise_output", "follows_format", "no_hallucination", "handles_ambiguity"], "per_criterion_scores": {"correct_category": 0.0, "concise_output": 1.0, "follows_format": 0.0, "no_hallucination": 0.3, "handles_ambiguity": 1.0}, "failure_classification": {"category": "output_format", "description": "The simplification of the category selection instruction, despite the intention to maintain exact formatting, likely led to outputs that violated the required structure or schema. The removed 'redundant wording' might have contained critical implicit or explicit cues for proper formatting that the system then failed to reproduce.", "fix_direction": "Re-evaluate the simplified instructions to ensure they still explicitly or implicitly guide the user/model to produce outputs in the exact required format. Consider adding a clear example of the expected output format directly to the instruction, even if the descriptive text is minimal. Implement stricter output validation.", "confidence": 0.9}, "drafts_generated": 1, "drafts_survived": 1}
{"id": "927c77cb-3475-4bb0-a1e3-017c618a1cb9", "target_id": "B1-control", "git_sha": "4d7b5be512502e9aecca5b2e75d3aa5d6d1f54c0", "pre_experiment_sha": "8a8d7a2c9969d52730d3080fd07e7d48efd39bc7", "timestamp": "2026-04-24T00:29:04.703564+00:00", "hypothesis": "Refine the prompt to explicitly instruct the model to treat the category definitions themselves as strictly distinct and mutually exclusive, improving classification precision.", "hypothesis_source": "agent", "mutation_diff_summary": "", "score": 2.2, "score_ci_lower": 2.0, "score_ci_upper": 2.4, "raw_scores": [2.0, 2.5, 2.0, 2.5, 2.0], "baseline_score": 2.8, "outcome": "KEPT", "failure_mode": null, "duration_seconds": 77.61035591713153, "tags": ["clarity", "precision", "strict-definitions"], "learnings": "{\"what_changed\":\"\",\"what_improved\":[],\"what_regressed\":[],\"transferable_insight\":\"Explicitly instructing the model to treat category definitions as strictly distinct and mutually exclusive reduces ambiguity and improves classification precision.\",\"domain_tags\":[\"Prompt Engineering\",\"Classification\",\"Taxonomy\"]}", "cost_usd": 0.00311905, "bootstrap_seed": 0, "agent_model": "gemini-3.1-pro-preview", "held_out_score": null, "criterion_names": ["correct_category", "concise_output", "follows_format", "no_hallucination", "handles_ambiguity"], "per_criterion_scores": {"correct_category": 0.1, "concise_output": 1.0, "follows_format": 0.0, "no_hallucination": 0.1, "handles_ambiguity": 1.0}, "failure_classification": null, "drafts_generated": 1, "drafts_survived": 1}
{"id": "ae3287fb-4965-48c6-96f0-fc145a3ed97a", "target_id": "B1-control", "git_sha": "80efa7dfbea70c1f33ceec7d990618a98addaa1c", "pre_experiment_sha": "4d7b5be512502e9aecca5b2e75d3aa5d6d1f54c0", "timestamp": "2026-04-24T00:30:22.221010+00:00", "hypothesis": "Simplify the statement about mutual exclusivity to be more direct and concise while preserving all critical formatting instructions.", "hypothesis_source": "agent", "mutation_diff_summary": "", "score": 2.4, "score_ci_lower": 2.1, "score_ci_upper": 2.7, "raw_scores": [2.5, 2.0, 2.5, 3.0, 2.0], "baseline_score": 2.2, "outcome": "KEPT", "failure_mode": null, "duration_seconds": 60.836038333131, "tags": ["conciseness", "directness", "mutual-exclusivity"], "learnings": "{\"what_changed\":\"\",\"what_improved\":[],\"what_regressed\":[],\"transferable_insight\":\"Simplifying complex rules into direct, concise statements while strictly preserving critical constraints improves execution accuracy.\",\"domain_tags\":[\"Instruction Design\",\"Prompt Engineering\",\"Communication\"]}", "cost_usd": 0.00307155, "bootstrap_seed": 0, "agent_model": "gemini-3.1-pro-preview", "held_out_score": null, "criterion_names": ["correct_category", "concise_output", "follows_format", "no_hallucination", "handles_ambiguity"], "per_criterion_scores": {"correct_category": 0.0, "concise_output": 1.0, "follows_format": 0.0, "no_hallucination": 0.4, "handles_ambiguity": 1.0}, "failure_classification": null, "drafts_generated": 1, "drafts_survived": 1}
{"id": "abfef531-cd99-4494-ab19-c55242c4fac9", "target_id": "B1-control", "git_sha": "c26acffdae0320646b223548ce7728dcb396559c", "pre_experiment_sha": "80efa7dfbea70c1f33ceec7d990618a98addaa1c", "timestamp": "2026-04-24T00:31:50.132755+00:00", "hypothesis": "Make the classification command more precise by specifying the selection of the \"single\" most specific category while maintaining exact formatting constraints.", "hypothesis_source": "agent", "mutation_diff_summary": "", "score": 2.5, "score_ci_lower": 2.2, "score_ci_upper": 2.8, "raw_scores": [2.5, 2.5, 2.0, 2.5, 3.0], "baseline_score": 2.4, "outcome": "KEPT", "failure_mode": null, "duration_seconds": 82.56199283408932, "tags": ["direct-command", "strict-formatting"], "learnings": "{\"what_changed\":\"\",\"what_improved\":[],\"what_regressed\":[],\"transferable_insight\":\"Explicitly instructing the model to select the 'single most specific' option enhances precision in categorization tasks while preserving strict formatting constraints.\",\"domain_tags\":[\"Classification\",\"Prompt Engineering\",\"Formatting Constraints\"]}", "cost_usd": 0.00309115, "bootstrap_seed": 0, "agent_model": "gemini-3.1-pro-preview", "held_out_score": null, "criterion_names": ["correct_category", "concise_output", "follows_format", "no_hallucination", "handles_ambiguity"], "per_criterion_scores": {"correct_category": 0.1, "concise_output": 0.8, "follows_format": 0.0, "no_hallucination": 0.6, "handles_ambiguity": 1.0}, "failure_classification": null, "drafts_generated": 1, "drafts_survived": 1}
{"id": "6a717b84-6be6-4deb-bd58-c1ef24484377", "target_id": "B1-control", "git_sha": "72a86c6c2a3f80ef2cc0c9e5c9431b1a49176162", "pre_experiment_sha": "c26acffdae0320646b223548ce7728dcb396559c", "timestamp": "2026-04-24T00:33:09.737087+00:00", "hypothesis": "Reordering the middle paragraph to state the mutual exclusivity rule before the direct selection command improves logical flow and reinforces the final formatting constraints.", "hypothesis_source": "agent", "mutation_diff_summary": "", "score": 2.2, "score_ci_lower": 2.0, "score_ci_upper": 2.4, "raw_scores": [2.0, 2.0, 2.5, 2.0, 2.5], "baseline_score": 2.5, "outcome": "KEPT", "failure_mode": null, "duration_seconds": 74.09079016721807, "tags": ["logical-flow", "direct-command", "mutual-exclusivity"], "learnings": "{\"what_changed\":\"\",\"what_improved\":[],\"what_regressed\":[\"no_hallucination: FAIL (was PASS)\"],\"transferable_insight\":\"Placing abstract constraints before the primary action command can disrupt the model's focus and increase the likelihood of hallucinations.\",\"domain_tags\":[\"Prompt Engineering\",\"Instruction Ordering\",\"Hallucination Mitigation\"]}", "cost_usd": 0.005879050000000001, "bootstrap_seed": 0, "agent_model": "gemini-3.1-pro-preview", "held_out_score": null, "criterion_names": ["correct_category", "concise_output", "follows_format", "no_hallucination", "handles_ambiguity"], "per_criterion_scores": {"correct_category": 0.1, "concise_output": 1.0, "follows_format": 0.0, "no_hallucination": 0.1, "handles_ambiguity": 1.0}, "failure_classification": null, "drafts_generated": 1, "drafts_survived": 1}
