{"id": "9ce6db81-0bcb-472c-a94e-7b9be7d1b651", "target_id": "B1-control", "git_sha": "a82e1099a84b1753eb9d59a0ab5bc98d47efd4ef", "pre_experiment_sha": "06e5d37b24879a15b892f3d8a97244ff3ce1ad91", "timestamp": "2026-04-05T21:06:12.089280+00:00", "hypothesis": "No hypothesis provided", "hypothesis_source": "synthesized", "mutation_diff_summary": "", "score": 3.4, "score_ci_lower": 2.8, "score_ci_upper": 4.0, "raw_scores": [4.0, 4.0, 2.5, 2.5, 4.0], "baseline_score": 3.7, "outcome": "KEPT", "failure_mode": null, "duration_seconds": 54.17729158396833, "tags": [], "learnings": "{\"what_changed\":\"\",\"what_improved\":[],\"what_regressed\":[],\"transferable_insight\":\"No hypothesis provided\",\"domain_tags\":[]}", "cost_usd": 0.14457285, "bootstrap_seed": 0, "agent_model": "claude-sonnet-4-6", "held_out_score": null, "criterion_names": ["correct_category", "concise_output", "follows_format", "no_hallucination", "handles_ambiguity"], "per_criterion_scores": {"correct_category": 1.0, "concise_output": 1.0, "follows_format": 0.0, "no_hallucination": 0.7, "handles_ambiguity": 0.7}, "failure_classification": null, "drafts_generated": 1, "drafts_survived": 1}
{"id": "2903750e-5490-4b42-8e41-3220193ad5bd", "target_id": "B1-control", "git_sha": "381927feb33f5a735f2927a1456e0ff265d8b80c", "pre_experiment_sha": "a82e1099a84b1753eb9d59a0ab5bc98d47efd4ef", "timestamp": "2026-04-05T21:07:26.865082+00:00", "hypothesis": "No hypothesis provided", "hypothesis_source": "synthesized", "mutation_diff_summary": "", "score": 3.6, "score_ci_lower": 3.2, "score_ci_upper": 4.0, "raw_scores": [4.0, 4.0, 3.0, 3.0, 4.0], "baseline_score": 3.4, "outcome": "KEPT", "failure_mode": null, "duration_seconds": 74.3280420829542, "tags": [], "learnings": "{\"what_changed\":\"\",\"what_improved\":[],\"what_regressed\":[],\"transferable_insight\":\"No hypothesis provided\",\"domain_tags\":[]}", "cost_usd": 0.1831314, "bootstrap_seed": 0, "agent_model": "claude-sonnet-4-6", "held_out_score": null, "criterion_names": ["correct_category", "concise_output", "follows_format", "no_hallucination", "handles_ambiguity"], "per_criterion_scores": {"correct_category": 1.0, "concise_output": 1.0, "follows_format": 0.0, "no_hallucination": 0.8, "handles_ambiguity": 0.8}, "failure_classification": null, "drafts_generated": 1, "drafts_survived": 1}
{"id": "39fa65b7-d4b5-4853-aec6-118238315534", "target_id": "B1-control", "git_sha": "381927feb33f5a735f2927a1456e0ff265d8b80c", "pre_experiment_sha": "381927feb33f5a735f2927a1456e0ff265d8b80c", "timestamp": "2026-04-05T21:08:31.703475+00:00", "hypothesis": "No hypothesis provided", "hypothesis_source": "synthesized", "mutation_diff_summary": "", "score": 3.4, "score_ci_lower": 3.1, "score_ci_upper": 3.7, "raw_scores": [4.0, 3.5, 3.0, 3.0, 3.5], "baseline_score": 3.6, "outcome": "DISCARDED", "failure_mode": null, "duration_seconds": 64.42892362503335, "tags": [], "learnings": "{\"what_changed\":\"\",\"what_improved\":[],\"what_regressed\":[],\"transferable_insight\":\"No hypothesis provided\",\"domain_tags\":[]}", "cost_usd": 0.15512385, "bootstrap_seed": 0, "agent_model": "claude-sonnet-4-6", "held_out_score": null, "criterion_names": ["correct_category", "concise_output", "follows_format", "no_hallucination", "handles_ambiguity"], "per_criterion_scores": {"correct_category": 1.0, "concise_output": 1.0, "follows_format": 0.0, "no_hallucination": 0.8, "handles_ambiguity": 0.6}, "failure_classification": {"category": "output_format", "description": "The experiment failed due to an output structure/schema violation, as indicated by the lack of a hypothesis and an undefined failure mode, which suggests that required information was missing or the output did not conform to the expected schema.", "fix_direction": "Ensure all required fields and structures are provided and validated before submission.", "confidence": 0.9}, "drafts_generated": 1, "drafts_survived": 1}
{"id": "e90b9a91-2da1-4e28-9073-d629f41f235f", "target_id": "B1-control", "git_sha": "f62023fd5bc72d12af0b0c959b0fd222f0ea388e", "pre_experiment_sha": "381927feb33f5a735f2927a1456e0ff265d8b80c", "timestamp": "2026-04-05T21:10:09.633648+00:00", "hypothesis": "No hypothesis provided", "hypothesis_source": "synthesized", "mutation_diff_summary": "", "score": 3.7, "score_ci_lower": 3.3, "score_ci_upper": 4.0, "raw_scores": [4.0, 4.0, 3.0, 3.5, 4.0], "baseline_score": 3.6, "outcome": "KEPT", "failure_mode": null, "duration_seconds": 96.19175025005825, "tags": [], "learnings": "{\"what_changed\":\"\",\"what_improved\":[],\"what_regressed\":[],\"transferable_insight\":\"No hypothesis provided\",\"domain_tags\":[]}", "cost_usd": 0.18305459999999998, "bootstrap_seed": 0, "agent_model": "claude-sonnet-4-6", "held_out_score": null, "criterion_names": ["correct_category", "concise_output", "follows_format", "no_hallucination", "handles_ambiguity"], "per_criterion_scores": {"correct_category": 1.0, "concise_output": 1.0, "follows_format": 0.0, "no_hallucination": 0.9, "handles_ambiguity": 0.8}, "failure_classification": null, "drafts_generated": 1, "drafts_survived": 1}
{"id": "d00f70ed-04bf-49d0-af38-bdc7670a26da", "target_id": "B1-control", "git_sha": "ee84ea048e3b5ef6e5376b127270d570b882e093", "pre_experiment_sha": "f62023fd5bc72d12af0b0c959b0fd222f0ea388e", "timestamp": "2026-04-05T21:11:02.541275+00:00", "hypothesis": "No hypothesis provided", "hypothesis_source": "synthesized", "mutation_diff_summary": "", "score": 3.3, "score_ci_lower": 2.6, "score_ci_upper": 3.9, "raw_scores": [4.0, 4.0, 2.0, 3.0, 3.5], "baseline_score": 3.7, "outcome": "KEPT", "failure_mode": null, "duration_seconds": 52.49013083311729, "tags": [], "learnings": "{\"what_changed\":\"\",\"what_improved\":[],\"what_regressed\":[],\"transferable_insight\":\"No hypothesis provided\",\"domain_tags\":[]}", "cost_usd": 0.19829924999999998, "bootstrap_seed": 0, "agent_model": "claude-sonnet-4-6", "held_out_score": null, "criterion_names": ["correct_category", "concise_output", "follows_format", "no_hallucination", "handles_ambiguity"], "per_criterion_scores": {"correct_category": 1.0, "concise_output": 1.0, "follows_format": 0.0, "no_hallucination": 0.6, "handles_ambiguity": 0.7}, "failure_classification": null, "drafts_generated": 1, "drafts_survived": 1}
{"id": "b7394bb2-28ef-42ba-aa63-c53e28b11110", "target_id": "B1-control", "git_sha": "336e26c90efd51e53ef1b95cdd5d048b8d23fb12", "pre_experiment_sha": "ee84ea048e3b5ef6e5376b127270d570b882e093", "timestamp": "2026-04-05T21:12:28.237339+00:00", "hypothesis": "No hypothesis provided", "hypothesis_source": "synthesized", "mutation_diff_summary": "", "score": 3.4, "score_ci_lower": 3.1, "score_ci_upper": 3.7, "raw_scores": [4.0, 3.5, 3.0, 3.0, 3.5], "baseline_score": 3.3, "outcome": "KEPT", "failure_mode": null, "duration_seconds": 85.24123754212633, "tags": [], "learnings": "{\"what_changed\":\"\",\"what_improved\":[],\"what_regressed\":[],\"transferable_insight\":\"No hypothesis provided\",\"domain_tags\":[]}", "cost_usd": 0.18642794999999998, "bootstrap_seed": 0, "agent_model": "claude-sonnet-4-6", "held_out_score": null, "criterion_names": ["correct_category", "concise_output", "follows_format", "no_hallucination", "handles_ambiguity"], "per_criterion_scores": {"correct_category": 1.0, "concise_output": 1.0, "follows_format": 0.0, "no_hallucination": 0.8, "handles_ambiguity": 0.6}, "failure_classification": null, "drafts_generated": 1, "drafts_survived": 1}
{"id": "8f94b68f-92cd-4be1-8559-5254257e20df", "target_id": "B1-control", "git_sha": "336e26c90efd51e53ef1b95cdd5d048b8d23fb12", "pre_experiment_sha": "336e26c90efd51e53ef1b95cdd5d048b8d23fb12", "timestamp": "2026-04-05T21:13:47.505006+00:00", "hypothesis": "No hypothesis provided", "hypothesis_source": "synthesized", "mutation_diff_summary": "", "score": 3.1, "score_ci_lower": 2.4, "score_ci_upper": 3.7, "raw_scores": [4.0, 3.5, 2.5, 2.0, 3.5], "baseline_score": 3.4, "outcome": "DISCARDED", "failure_mode": null, "duration_seconds": 78.79867404187098, "tags": [], "learnings": "{\"what_changed\":\"\",\"what_improved\":[],\"what_regressed\":[\"handles_ambiguity: FAIL (was PASS)\"],\"transferable_insight\":\"No hypothesis provided\",\"domain_tags\":[]}", "cost_usd": 0.22905804999999999, "bootstrap_seed": 0, "agent_model": "claude-sonnet-4-6", "held_out_score": null, "criterion_names": ["correct_category", "concise_output", "follows_format", "no_hallucination", "handles_ambiguity"], "per_criterion_scores": {"correct_category": 1.0, "concise_output": 1.0, "follows_format": 0.0, "no_hallucination": 0.7, "handles_ambiguity": 0.4}, "failure_classification": {"category": "output_format", "description": "The experiment failed due to an output structure or schema violation. The provided information suggests that the experiment did not adhere to a required output format, leading to its failure.", "fix_direction": "Ensure output strictly follows the required structure or schema in future attempts.", "confidence": 0.8}, "drafts_generated": 1, "drafts_survived": 1}
{"id": "33a7889a-9607-4ed1-965d-c3260e184c31", "target_id": "B1-control", "git_sha": "dc897f1a9ff89930d64278fe9a6ee49148ba8586", "pre_experiment_sha": "336e26c90efd51e53ef1b95cdd5d048b8d23fb12", "timestamp": "2026-04-05T21:15:12.178465+00:00", "hypothesis": "No hypothesis provided", "hypothesis_source": "synthesized", "mutation_diff_summary": "", "score": 3.6, "score_ci_lower": 3.2, "score_ci_upper": 4.0, "raw_scores": [4.0, 4.0, 3.0, 3.0, 4.0], "baseline_score": 3.4, "outcome": "KEPT", "failure_mode": null, "duration_seconds": 82.81777616706677, "tags": [], "learnings": "{\"what_changed\":\"\",\"what_improved\":[\"handles_ambiguity: PASS (was FAIL)\"],\"what_regressed\":[],\"transferable_insight\":\"No hypothesis provided\",\"domain_tags\":[]}", "cost_usd": 0.23846610000000001, "bootstrap_seed": 0, "agent_model": "claude-sonnet-4-6", "held_out_score": null, "criterion_names": ["correct_category", "concise_output", "follows_format", "no_hallucination", "handles_ambiguity"], "per_criterion_scores": {"correct_category": 1.0, "concise_output": 1.0, "follows_format": 0.0, "no_hallucination": 0.8, "handles_ambiguity": 0.8}, "failure_classification": null, "drafts_generated": 1, "drafts_survived": 1}
{"id": "3d6edafe-ed45-475e-b68b-76a5ec7a0f29", "target_id": "B1-control", "git_sha": "994ae1580d6b4ca42717872df2f63b624975981f", "pre_experiment_sha": "dc897f1a9ff89930d64278fe9a6ee49148ba8586", "timestamp": "2026-04-05T21:16:25.887388+00:00", "hypothesis": "No hypothesis provided", "hypothesis_source": "synthesized", "mutation_diff_summary": "", "score": 3.4, "score_ci_lower": 3.0, "score_ci_upper": 3.8, "raw_scores": [4.0, 4.0, 3.0, 3.0, 3.0], "baseline_score": 3.6, "outcome": "KEPT", "failure_mode": null, "duration_seconds": 73.28271016711369, "tags": [], "learnings": "{\"what_changed\":\"\",\"what_improved\":[],\"what_regressed\":[],\"transferable_insight\":\"No hypothesis provided\",\"domain_tags\":[]}", "cost_usd": 0.17547975, "bootstrap_seed": 0, "agent_model": "claude-sonnet-4-6", "held_out_score": null, "criterion_names": ["correct_category", "concise_output", "follows_format", "no_hallucination", "handles_ambiguity"], "per_criterion_scores": {"correct_category": 1.0, "concise_output": 1.0, "follows_format": 0.0, "no_hallucination": 0.6, "handles_ambiguity": 0.8}, "failure_classification": null, "drafts_generated": 1, "drafts_survived": 1}
{"id": "fc013993-e153-44d0-abb1-622b14ef46b1", "target_id": "B1-control", "git_sha": "b89eb3bd656946c789cf8bd166f8f91acaa06351", "pre_experiment_sha": "994ae1580d6b4ca42717872df2f63b624975981f", "timestamp": "2026-04-05T21:19:38.639361+00:00", "hypothesis": "No hypothesis provided", "hypothesis_source": "synthesized", "mutation_diff_summary": "", "score": 3.7, "score_ci_lower": 3.3, "score_ci_upper": 4.0, "raw_scores": [4.0, 4.0, 3.0, 3.5, 4.0], "baseline_score": 3.4, "outcome": "KEPT", "failure_mode": null, "duration_seconds": 192.3580634999089, "tags": [], "learnings": "{\"what_changed\":\"\",\"what_improved\":[],\"what_regressed\":[],\"transferable_insight\":\"No hypothesis provided\",\"domain_tags\":[]}", "cost_usd": 0.33164925, "bootstrap_seed": 0, "agent_model": "claude-sonnet-4-6", "held_out_score": null, "criterion_names": ["correct_category", "concise_output", "follows_format", "no_hallucination", "handles_ambiguity"], "per_criterion_scores": {"correct_category": 1.0, "concise_output": 1.0, "follows_format": 0.0, "no_hallucination": 0.9, "handles_ambiguity": 0.8}, "failure_classification": null, "drafts_generated": 1, "drafts_survived": 1}
{"id": "f062fa17-8128-4e53-9878-8719fc5c7534", "target_id": "B1-control", "git_sha": "de1f687425fa6ba32869f0eba8c8d592b32646ce", "pre_experiment_sha": "b89eb3bd656946c789cf8bd166f8f91acaa06351", "timestamp": "2026-04-05T21:22:14.123933+00:00", "hypothesis": "No hypothesis provided", "hypothesis_source": "synthesized", "mutation_diff_summary": "", "score": 3.5, "score_ci_lower": 3.1, "score_ci_upper": 3.9, "raw_scores": [4.0, 3.5, 3.0, 3.0, 4.0], "baseline_score": 3.7, "outcome": "KEPT", "failure_mode": null, "duration_seconds": 154.9756425418891, "tags": [], "learnings": "{\"what_changed\":\"\",\"what_improved\":[],\"what_regressed\":[],\"transferable_insight\":\"No hypothesis provided\",\"domain_tags\":[]}", "cost_usd": 0.27881715, "bootstrap_seed": 0, "agent_model": "claude-sonnet-4-6", "held_out_score": null, "criterion_names": ["correct_category", "concise_output", "follows_format", "no_hallucination", "handles_ambiguity"], "per_criterion_scores": {"correct_category": 1.0, "concise_output": 1.0, "follows_format": 0.0, "no_hallucination": 0.8, "handles_ambiguity": 0.7}, "failure_classification": null, "drafts_generated": 1, "drafts_survived": 1}
{"id": "ea3c1e90-ce95-4d2b-824e-654d6e250f85", "target_id": "B1-control", "git_sha": "1de7c3d6943d13f0beae48ae46892eb42aa50cc9", "pre_experiment_sha": "de1f687425fa6ba32869f0eba8c8d592b32646ce", "timestamp": "2026-04-05T21:24:44.066304+00:00", "hypothesis": "No hypothesis provided", "hypothesis_source": "synthesized", "mutation_diff_summary": "", "score": 3.5, "score_ci_lower": 3.1, "score_ci_upper": 3.9, "raw_scores": [4.0, 3.5, 3.0, 3.0, 4.0], "baseline_score": 3.5, "outcome": "KEPT", "failure_mode": null, "duration_seconds": 149.52661070786417, "tags": [], "learnings": "{\"what_changed\":\"\",\"what_improved\":[],\"what_regressed\":[],\"transferable_insight\":\"No hypothesis provided\",\"domain_tags\":[]}", "cost_usd": 0.2630637, "bootstrap_seed": 0, "agent_model": "claude-sonnet-4-6", "held_out_score": null, "criterion_names": ["correct_category", "concise_output", "follows_format", "no_hallucination", "handles_ambiguity"], "per_criterion_scores": {"correct_category": 1.0, "concise_output": 1.0, "follows_format": 0.0, "no_hallucination": 0.8, "handles_ambiguity": 0.7}, "failure_classification": null, "drafts_generated": 1, "drafts_survived": 1}
{"id": "ae74efff-2b33-41c4-b2c5-547015716f16", "target_id": "B1-control", "git_sha": "7cb586bae2f8348e97366d76386e9a0adb0970f3", "pre_experiment_sha": "1de7c3d6943d13f0beae48ae46892eb42aa50cc9", "timestamp": "2026-04-05T21:28:28.151388+00:00", "hypothesis": "No hypothesis provided", "hypothesis_source": "synthesized", "mutation_diff_summary": "", "score": 3.5, "score_ci_lower": 3.1, "score_ci_upper": 3.9, "raw_scores": [4.0, 4.0, 3.0, 3.0, 3.5], "baseline_score": 3.5, "outcome": "KEPT", "failure_mode": null, "duration_seconds": 223.50973529112525, "tags": [], "learnings": "{\"what_changed\":\"\",\"what_improved\":[],\"what_regressed\":[],\"transferable_insight\":\"No hypothesis provided\",\"domain_tags\":[]}", "cost_usd": 0.38229599999999997, "bootstrap_seed": 0, "agent_model": "claude-sonnet-4-6", "held_out_score": null, "criterion_names": ["correct_category", "concise_output", "follows_format", "no_hallucination", "handles_ambiguity"], "per_criterion_scores": {"correct_category": 1.0, "concise_output": 1.0, "follows_format": 0.0, "no_hallucination": 0.8, "handles_ambiguity": 0.7}, "failure_classification": null, "drafts_generated": 1, "drafts_survived": 1}
{"id": "f9bf21b5-e610-4cea-aa77-8b1732da42e3", "target_id": "B1-control", "git_sha": "7cb586bae2f8348e97366d76386e9a0adb0970f3", "pre_experiment_sha": "7cb586bae2f8348e97366d76386e9a0adb0970f3", "timestamp": "2026-04-05T21:30:41.881082+00:00", "hypothesis": "No hypothesis provided", "hypothesis_source": "synthesized", "mutation_diff_summary": "", "score": 3.4, "score_ci_lower": 2.9, "score_ci_upper": 3.9, "raw_scores": [4.0, 3.5, 3.0, 2.5, 4.0], "baseline_score": 3.5, "outcome": "DISCARDED", "failure_mode": null, "duration_seconds": 133.19733004178852, "tags": [], "learnings": "{\"what_changed\":\"\",\"what_improved\":[],\"what_regressed\":[],\"transferable_insight\":\"No hypothesis provided\",\"domain_tags\":[]}", "cost_usd": 0.24687655, "bootstrap_seed": 0, "agent_model": "claude-sonnet-4-6", "held_out_score": null, "criterion_names": ["correct_category", "concise_output", "follows_format", "no_hallucination", "handles_ambiguity"], "per_criterion_scores": {"correct_category": 1.0, "concise_output": 1.0, "follows_format": 0.0, "no_hallucination": 0.8, "handles_ambiguity": 0.6}, "failure_classification": {"category": "output_format", "description": "The experiment failed due to a violation of the required output structure or schema.", "fix_direction": "Ensure that the output strictly follows the specified format or schema requirements.", "confidence": 0.85}, "drafts_generated": 1, "drafts_survived": 1}
{"id": "8e5df087-1b4f-4fc2-b13e-20de4d0e2cf4", "target_id": "B1-control", "git_sha": "80f2cf3c47c793c20491785fde9da06df531c2f8", "pre_experiment_sha": "7cb586bae2f8348e97366d76386e9a0adb0970f3", "timestamp": "2026-04-05T21:33:04.747701+00:00", "hypothesis": "No hypothesis provided", "hypothesis_source": "synthesized", "mutation_diff_summary": "", "score": 3.6, "score_ci_lower": 3.3, "score_ci_upper": 3.9, "raw_scores": [3.5, 4.0, 3.0, 3.5, 4.0], "baseline_score": 3.5, "outcome": "KEPT", "failure_mode": null, "duration_seconds": 141.37935545807704, "tags": [], "learnings": "{\"what_changed\":\"\",\"what_improved\":[],\"what_regressed\":[],\"transferable_insight\":\"No hypothesis provided\",\"domain_tags\":[]}", "cost_usd": 0.24544184999999996, "bootstrap_seed": 0, "agent_model": "claude-sonnet-4-6", "held_out_score": null, "criterion_names": ["correct_category", "concise_output", "follows_format", "no_hallucination", "handles_ambiguity"], "per_criterion_scores": {"correct_category": 1.0, "concise_output": 1.0, "follows_format": 0.0, "no_hallucination": 0.8, "handles_ambiguity": 0.8}, "failure_classification": null, "drafts_generated": 1, "drafts_survived": 1}
{"id": "2ce17f65-5565-40cc-a56d-639a86baa24b", "target_id": "B1-control", "git_sha": "80f2cf3c47c793c20491785fde9da06df531c2f8", "pre_experiment_sha": "80f2cf3c47c793c20491785fde9da06df531c2f8", "timestamp": "2026-04-05T21:37:42.553063+00:00", "hypothesis": "No hypothesis provided", "hypothesis_source": "synthesized", "mutation_diff_summary": "", "score": 3.5, "score_ci_lower": 3.1, "score_ci_upper": 3.9, "raw_scores": [3.5, 4.0, 3.0, 3.0, 4.0], "baseline_score": 3.6, "outcome": "DISCARDED", "failure_mode": null, "duration_seconds": 277.2595060830936, "tags": [], "learnings": "{\"what_changed\":\"\",\"what_improved\":[],\"what_regressed\":[],\"transferable_insight\":\"No hypothesis provided\",\"domain_tags\":[]}", "cost_usd": 0.44830475, "bootstrap_seed": 0, "agent_model": "claude-sonnet-4-6", "held_out_score": null, "criterion_names": ["correct_category", "concise_output", "follows_format", "no_hallucination", "handles_ambiguity"], "per_criterion_scores": {"correct_category": 1.0, "concise_output": 1.0, "follows_format": 0.0, "no_hallucination": 0.7, "handles_ambiguity": 0.8}, "failure_classification": {"category": "output_format", "description": "The experiment failed due to a violation of the required output structure or schema.", "fix_direction": "Review and adhere strictly to the expected output format or schema in future attempts.", "confidence": 0.8}, "drafts_generated": 1, "drafts_survived": 1}
