{"id": "3ea4339a-9c47-4d28-acde-2c6a41f2d503", "target_id": "B1-control", "git_sha": "5c60b24232a6a72dbdbe7109cd35356fbe992dd6", "pre_experiment_sha": "98720ed81b388f89159675b9a957acbab5e8f23e", "timestamp": "2026-04-23T23:47:45.516152+00:00", "hypothesis": "Removing the request for an explanation and instructing the model to output only the exact category name will fix parsing errors and improve the binary criteria score.", "hypothesis_source": "agent", "mutation_diff_summary": "", "score": 2.4, "score_ci_lower": 2.1, "score_ci_upper": 2.7, "raw_scores": [2.5, 2.5, 2.0, 3.0, 2.0], "baseline_score": 0.0, "outcome": "KEPT", "failure_mode": null, "duration_seconds": 58.15413716691546, "tags": ["classification", "strict-formatting", "zero-shot"], "learnings": "{\"what_changed\":\"\",\"what_improved\":[],\"what_regressed\":[],\"transferable_insight\":\"Constraining the model to output only the exact target value without an accompanying explanation significantly reduces parsing errors and improves strict evaluation scores.\",\"domain_tags\":[\"Prompt Engineering\",\"Output Formatting\",\"Evaluation\"]}", "cost_usd": 0.0032728, "bootstrap_seed": 0, "agent_model": "gemini-3.1-pro-preview", "held_out_score": null, "criterion_names": ["correct_category", "concise_output", "follows_format", "no_hallucination", "handles_ambiguity"], "per_criterion_scores": {"correct_category": 0.1, "concise_output": 1.0, "follows_format": 0.0, "no_hallucination": 0.3, "handles_ambiguity": 1.0}, "failure_classification": null, "drafts_generated": 1, "drafts_survived": 1}
{"id": "72213c22-6b13-4821-a304-d1d1b2d4bfd6", "target_id": "B1-control", "git_sha": "5c60b24232a6a72dbdbe7109cd35356fbe992dd6", "pre_experiment_sha": "5c60b24232a6a72dbdbe7109cd35356fbe992dd6", "timestamp": "2026-04-23T23:48:58.368237+00:00", "hypothesis": "Add structured step-by-step instructions and stricter formatting rules to explicitly prevent markdown formatting, quotation marks, and conversational filler, ensuring exact string matching.", "hypothesis_source": "agent", "mutation_diff_summary": "", "score": 2.4, "score_ci_lower": 1.8, "score_ci_upper": 3.0, "raw_scores": [2.5, 1.5, 3.5, 2.5, 2.0], "baseline_score": 2.4, "outcome": "DISCARDED", "failure_mode": null, "duration_seconds": 67.34684029198252, "tags": ["structured", "strict-formatting"], "learnings": "{\"what_changed\":\"\",\"what_improved\":[],\"what_regressed\":[],\"transferable_insight\":\"Adding highly structured, step-by-step negative constraints to enforce exact formatting rules does not inherently improve output accuracy or compliance.\",\"domain_tags\":[\"Prompt Engineering\",\"Formatting Constraints\",\"Instruction Following\"]}", "cost_usd": 0.0037773000000000004, "bootstrap_seed": 0, "agent_model": "gemini-3.1-pro-preview", "held_out_score": null, "criterion_names": ["correct_category", "concise_output", "follows_format", "no_hallucination", "handles_ambiguity"], "per_criterion_scores": {"correct_category": 0.1, "concise_output": 1.0, "follows_format": 0.1, "no_hallucination": 0.3, "handles_ambiguity": 0.9}, "failure_classification": {"category": "output_format", "description": "The experiment aimed to enforce a very strict output format by explicitly preventing markdown, quotation marks, and conversational filler to ensure exact string matching. The low score (2.4) indicates that these formatting rules were violated, and the output likely contained the forbidden elements or deviated from the exact string requirement, thus failing to adhere to the desired output structure/schema.", "fix_direction": "Refine and strengthen the negative constraints within the instructions (e.g., 'DO NOT use markdown', 'DO NOT include quotes'). Consider providing specific examples of both desired and undesired output to clarify expectations. Explore using more robust mechanisms for format enforcement like JSON schema if applicable, or stricter token-level control.", "confidence": 0.95}, "drafts_generated": 1, "drafts_survived": 1}
{"id": "a7de5f09-2901-4202-8518-1b6980859644", "target_id": "B1-control", "git_sha": "5c60b24232a6a72dbdbe7109cd35356fbe992dd6", "pre_experiment_sha": "5c60b24232a6a72dbdbe7109cd35356fbe992dd6", "timestamp": "2026-04-23T23:50:26.021732+00:00", "hypothesis": "Adding a structured internal workflow for systematic analysis and reinforcing output constraints with stricter negative rules will improve classification accuracy and formatting consistency.", "hypothesis_source": "agent", "mutation_diff_summary": "", "score": 2.6, "score_ci_lower": 2.1, "score_ci_upper": 3.1, "raw_scores": [2.5, 2.0, 2.0, 3.0, 3.5], "baseline_score": 2.4, "outcome": "DISCARDED", "failure_mode": null, "duration_seconds": 73.49243679107167, "tags": ["prompt-engineering", "classification", "strict-output"], "learnings": "{\"what_changed\":\"\",\"what_improved\":[],\"what_regressed\":[],\"transferable_insight\":\"While adding structured internal workflows and strict negative constraints can yield slight performance gains, the improvement is often insufficient to justify the added system complexity.\",\"domain_tags\":[\"Prompt Engineering\",\"Workflow Optimization\",\"Constraint Management\"]}", "cost_usd": 0.0038035, "bootstrap_seed": 0, "agent_model": "gemini-3.1-pro-preview", "held_out_score": null, "criterion_names": ["correct_category", "concise_output", "follows_format", "no_hallucination", "handles_ambiguity"], "per_criterion_scores": {"correct_category": 0.2, "concise_output": 1.0, "follows_format": 0.0, "no_hallucination": 0.4, "handles_ambiguity": 1.0}, "failure_classification": {"category": "logic_error", "description": "The introduction of a 'structured internal workflow for systematic analysis' and 'stricter negative rules' likely introduced flaws in the model's reasoning or decision-making process. Despite the intent to improve analysis, these changes caused the model to make incorrect inferences or apply faulty logic, leading to a significant degradation in classification accuracy (indicated by the low score of 2.6). The negative rules might have inadvertently constrained valid reasoning paths.", "fix_direction": "Refine the 'structured internal workflow' to ensure its analytical steps are robust and correctly guide reasoning. Systematically evaluate the 'stricter negative rules' to identify if they are overly restrictive or introduce biases that lead to incorrect logical conclusions. Focus on simplifying the reasoning paths or correcting specific logical flaws introduced by the new structures.", "confidence": 0.85}, "drafts_generated": 1, "drafts_survived": 1}
{"id": "763d7b5a-5e2f-4156-bde4-6b91af3b0ef5", "target_id": "B1-control", "git_sha": "5c60b24232a6a72dbdbe7109cd35356fbe992dd6", "pre_experiment_sha": "5c60b24232a6a72dbdbe7109cd35356fbe992dd6", "timestamp": "2026-04-23T23:52:09.450495+00:00", "hypothesis": "Simplify the prompt by removing verbose negative formatting constraints and focusing the classification logic on evaluating the meaning and scope of each category against the text's core message.", "hypothesis_source": "agent", "mutation_diff_summary": "", "score": 2.4, "score_ci_lower": 2.1, "score_ci_upper": 2.7, "raw_scores": [2.0, 2.0, 2.5, 3.0, 2.5], "baseline_score": 2.4, "outcome": "DISCARDED", "failure_mode": null, "duration_seconds": 68.55417104088701, "tags": ["prompt-simplification", "clarity", "strict-output"], "learnings": "{\"what_changed\":\"\",\"what_improved\":[],\"what_regressed\":[],\"transferable_insight\":\"Removing verbose negative constraints to focus purely on core evaluation logic may have a neutral impact on model performance.\",\"domain_tags\":[\"Prompt Engineering\",\"Classification\",\"Prompt Optimization\"]}", "cost_usd": 0.0030656, "bootstrap_seed": 0, "agent_model": "gemini-3.1-pro-preview", "held_out_score": null, "criterion_names": ["correct_category", "concise_output", "follows_format", "no_hallucination", "handles_ambiguity"], "per_criterion_scores": {"correct_category": 0.1, "concise_output": 1.0, "follows_format": 0.0, "no_hallucination": 0.3, "handles_ambiguity": 1.0}, "failure_classification": {"category": "output_format", "description": "The experiment aimed to simplify the prompt by removing verbose negative formatting constraints. This likely resulted in the model failing to adhere to the required JSON output structure, making the output unparseable or improperly formatted, which led to the low score.", "fix_direction": "Reintroduce clear, concise, and positive formatting instructions. Consider using few-shot examples for the desired JSON structure. Evaluate if some negative constraints were indeed critical for maintaining structural integrity.", "confidence": 0.9}, "drafts_generated": 1, "drafts_survived": 1}
{"id": "55aa36f7-cc1d-4419-a9d1-3143545ee9c5", "target_id": "B1-control", "git_sha": "5c60b24232a6a72dbdbe7109cd35356fbe992dd6", "pre_experiment_sha": "5c60b24232a6a72dbdbe7109cd35356fbe992dd6", "timestamp": "2026-04-23T23:53:30.760648+00:00", "hypothesis": "Simplify the prompt to remove verbose negative formatting constraints and focus directly on accurately matching the text's primary intent to the most specific category, while explicitly instructing the model to output only the exact category name without explanations or filler.", "hypothesis_source": "agent", "mutation_diff_summary": "", "score": 2.3, "score_ci_lower": 2.1, "score_ci_upper": 2.5, "raw_scores": [2.0, 2.5, 2.0, 2.5, 2.5], "baseline_score": 2.4, "outcome": "DISCARDED", "failure_mode": null, "duration_seconds": 60.092760500032455, "tags": ["simplification", "direct-instruction", "output-formatting"], "learnings": "{\"what_changed\":\"\",\"what_improved\":[],\"what_regressed\":[],\"transferable_insight\":\"Simplifying prompts by removing detailed negative constraints can degrade performance, demonstrating that models often require explicit, verbose boundaries to consistently suppress unwanted outputs and adhere to strict formatting.\",\"domain_tags\":[\"Prompt Engineering\",\"Formatting Constraints\",\"Classification\"]}", "cost_usd": 0.00310235, "bootstrap_seed": 0, "agent_model": "gemini-3.1-pro-preview", "held_out_score": null, "criterion_names": ["correct_category", "concise_output", "follows_format", "no_hallucination", "handles_ambiguity"], "per_criterion_scores": {"correct_category": 0.0, "concise_output": 1.0, "follows_format": 0.1, "no_hallucination": 0.2, "handles_ambiguity": 1.0}, "failure_classification": {"category": "output_format", "description": "The hypothesis aimed to simplify formatting constraints to ensure the model outputted only the exact category name. The low score (2.3) strongly suggests that the model failed to adhere to this strict output format. This likely means the model's output included additional text, explanations, or an incorrect structure, making it unparseable or unmatched by an evaluation system expecting only the category name.", "fix_direction": "Re-evaluate the prompt's simplification. While removing verbose negative constraints, ensure the positive instruction for the desired output format ('output only the exact category name') is robust and unambiguous enough to be consistently followed. Consider adding a single, clear few-shot example that demonstrates the exact expected output format without any filler.", "confidence": 0.95}, "drafts_generated": 1, "drafts_survived": 1}
{"id": "82675015-4c86-4a2b-ad92-47b568ed85a3", "target_id": "B1-control", "git_sha": "5c60b24232a6a72dbdbe7109cd35356fbe992dd6", "pre_experiment_sha": "5c60b24232a6a72dbdbe7109cd35356fbe992dd6", "timestamp": "2026-04-23T23:54:54.111235+00:00", "hypothesis": "Simplify negative constraints to the exact requested phrasing and instruct the model to carefully evaluate the meaning and scope of each category to improve classification accuracy.", "hypothesis_source": "agent", "mutation_diff_summary": "", "score": 2.2, "score_ci_lower": 2.0, "score_ci_upper": 2.6, "raw_scores": [2.0, 3.0, 2.0, 2.0, 2.0], "baseline_score": 2.4, "outcome": "DISCARDED", "failure_mode": null, "duration_seconds": 66.88493945915252, "tags": ["simplification", "formatting", "classification"], "learnings": "{\"what_changed\":\"\",\"what_improved\":[],\"what_regressed\":[],\"transferable_insight\":\"Replacing detailed negative constraints with overly simplified phrasing and vague instructions to 'carefully evaluate' degrades performance, highlighting the necessity of explicit boundary definitions.\",\"domain_tags\":[\"Prompt Engineering\",\"Classification\",\"Constraint Management\"]}", "cost_usd": 0.0031338, "bootstrap_seed": 0, "agent_model": "gemini-3.1-pro-preview", "held_out_score": null, "criterion_names": ["correct_category", "concise_output", "follows_format", "no_hallucination", "handles_ambiguity"], "per_criterion_scores": {"correct_category": 0.1, "concise_output": 1.0, "follows_format": 0.0, "no_hallucination": 0.1, "handles_ambiguity": 1.0}, "failure_classification": {"category": "semantic_drift", "description": "The experiment aimed to improve classification accuracy by clarifying category meaning and scope through specific instructions. The low score (2.2000) suggests that despite these efforts, the model failed to correctly understand and apply the categories, leading to classifications that were likely formatted correctly but semantically incorrect (i.e., assigning the wrong category).", "fix_direction": "Focus on enhancing the model's conceptual understanding of each category. This could involve providing more explicit examples of what belongs and doesn't belong to each category, using a few-shot approach, or implementing chain-of-thought prompting to force the model to justify its classification decision before outputting the final category.", "confidence": 0.9}, "drafts_generated": 1, "drafts_survived": 1}
{"id": "d612802c-d986-46e4-a5f9-8cf123d5832c", "target_id": "B1-control", "git_sha": "5c60b24232a6a72dbdbe7109cd35356fbe992dd6", "pre_experiment_sha": "5c60b24232a6a72dbdbe7109cd35356fbe992dd6", "timestamp": "2026-04-23T23:56:39.790592+00:00", "hypothesis": "Removing verbose negative constraints and explicitly stating that the categories are mutually exclusive will reduce formatting errors and improve classification precision.", "hypothesis_source": "agent", "mutation_diff_summary": "", "score": 2.6, "score_ci_lower": 2.3, "score_ci_upper": 2.9, "raw_scores": [3.0, 2.0, 3.0, 2.5, 2.5], "baseline_score": 2.4, "outcome": "DISCARDED", "failure_mode": null, "duration_seconds": 75.83658487489447, "tags": ["format-simplification", "constraint-reduction", "mutual-exclusivity"], "learnings": "{\"what_changed\":\"\",\"what_improved\":[],\"what_regressed\":[],\"transferable_insight\":\"Replacing specific negative constraints with a broad mutual exclusivity rule does not reliably improve categorization accuracy or output formatting.\",\"domain_tags\":[\"Prompt Engineering\",\"Classification\",\"Instruction Tuning\"]}", "cost_usd": 0.0034059000000000003, "bootstrap_seed": 0, "agent_model": "gemini-3.1-pro-preview", "held_out_score": null, "criterion_names": ["correct_category", "concise_output", "follows_format", "no_hallucination", "handles_ambiguity"], "per_criterion_scores": {"correct_category": 0.4, "concise_output": 1.0, "follows_format": 0.0, "no_hallucination": 0.2, "handles_ambiguity": 1.0}, "failure_classification": {"category": "logic_error", "description": "The experiment aimed to improve classification precision by clarifying category constraints and explicitly stating mutual exclusivity. Its failure indicates that the model's underlying reasoning or decision-making process for assigning categories remained flawed, or the new instructions inadvertently led to incorrect logical application, despite attempts to simplify and clarify.", "fix_direction": "Analyze specific misclassification patterns to identify how the 'mutually exclusive' constraint was misinterpreted or ignored. Consider providing few-shot examples that demonstrate correct application of the constraint and classification logic. Also, verify that removing 'verbose negative constraints' did not inadvertently remove crucial information the model needed for accurate reasoning.", "confidence": 0.85}, "drafts_generated": 1, "drafts_survived": 1}
{"id": "381659e7-7281-49cb-9a4f-023045e30f68", "target_id": "B1-control", "git_sha": "94ca7523108db85555927c3ca8eea1d8d9f44905", "pre_experiment_sha": "5c60b24232a6a72dbdbe7109cd35356fbe992dd6", "timestamp": "2026-04-23T23:58:34.275404+00:00", "hypothesis": "Refine the prompt to emphasize mutual exclusivity and precision in category selection while strictly adhering to the formatting constraints to prevent output failures.", "hypothesis_source": "agent", "mutation_diff_summary": "", "score": 2.8, "score_ci_lower": 2.5, "score_ci_upper": 3.2, "raw_scores": [2.5, 2.5, 3.5, 3.0, 2.5], "baseline_score": 2.4, "outcome": "KEPT", "failure_mode": null, "duration_seconds": 86.29438787489198, "tags": ["clarity", "precision", "formatting"], "learnings": "{\"what_changed\":\"\",\"what_improved\":[],\"what_regressed\":[],\"transferable_insight\":\"Explicitly defining categories as mutually exclusive and enforcing strict formatting constraints improves classification accuracy and reduces output errors.\",\"domain_tags\":[\"Prompt Engineering\",\"Categorization\",\"Output Formatting\"]}", "cost_usd": 0.00322155, "bootstrap_seed": 0, "agent_model": "gemini-3.1-pro-preview", "held_out_score": null, "criterion_names": ["correct_category", "concise_output", "follows_format", "no_hallucination", "handles_ambiguity"], "per_criterion_scores": {"correct_category": 0.4, "concise_output": 1.0, "follows_format": 0.0, "no_hallucination": 0.4, "handles_ambiguity": 1.0}, "failure_classification": null, "drafts_generated": 1, "drafts_survived": 1}
{"id": "e1ba11dc-77a4-4040-aa40-5cff96fcdf6c", "target_id": "B1-control", "git_sha": "94ca7523108db85555927c3ca8eea1d8d9f44905", "pre_experiment_sha": "94ca7523108db85555927c3ca8eea1d8d9f44905", "timestamp": "2026-04-23T23:59:55.013148+00:00", "hypothesis": "Refining the instructions to focus on the core subject and explicitly disregard passing mentions will improve classification precision and mutual exclusivity without adding complex reasoning steps.", "hypothesis_source": "agent", "mutation_diff_summary": "", "score": 2.4, "score_ci_lower": 2.1, "score_ci_upper": 2.7, "raw_scores": [2.0, 2.0, 2.5, 2.5, 3.0], "baseline_score": 2.8, "outcome": "DISCARDED", "failure_mode": null, "duration_seconds": 74.24088995810598, "tags": ["prompt-engineering", "clarity", "precision"], "learnings": "{\"what_changed\":\"\",\"what_improved\":[],\"what_regressed\":[],\"transferable_insight\":\"Explicitly instructing a model to ignore tangential information without providing a structured reasoning mechanism can degrade classification accuracy.\",\"domain_tags\":[\"Prompt Engineering\",\"Classification\",\"Natural Language Processing\"]}", "cost_usd": 0.0035960000000000002, "bootstrap_seed": 0, "agent_model": "gemini-3.1-pro-preview", "held_out_score": null, "criterion_names": ["correct_category", "concise_output", "follows_format", "no_hallucination", "handles_ambiguity"], "per_criterion_scores": {"correct_category": 0.0, "concise_output": 1.0, "follows_format": 0.0, "no_hallucination": 0.4, "handles_ambiguity": 1.0}, "failure_classification": {"category": "semantic_drift", "description": "The experiment failed to improve classification precision and mutual exclusivity, despite attempts to refine instructions to focus on the core subject and disregard passing mentions. This suggests that the model's output classifications, while potentially in the correct format, still conveyed an incorrect or ambiguous meaning (e.g., misidentifying the core subject, including tangential information, or assigning multiple non-mutually exclusive labels), indicating a drift from the intended semantic interpretation.", "fix_direction": "Further refine instructions by providing more explicit definitions, positive and negative examples, or clear edge cases for what constitutes a 'core subject' and a 'passing mention'. Investigate if the instructions inadvertently introduced new ambiguities or required more complex reasoning than intended, or if the model simply failed to correctly interpret the existing instructions.", "confidence": 0.95}, "drafts_generated": 1, "drafts_survived": 1}
