{"id": "3cc46675-a123-48d4-aded-ecb4bc4dee28", "target_id": "B1-control", "git_sha": "c36039f1b592833b2697e465de5a15df1ec2eab4", "pre_experiment_sha": "b9295e2c2cd90d8dba5ddf5be5a80c713266ee04", "timestamp": "2026-04-05T20:28:44.898258+00:00", "hypothesis": "No hypothesis provided", "hypothesis_source": "synthesized", "mutation_diff_summary": "", "score": 3.6, "score_ci_lower": 3.2, "score_ci_upper": 4.0, "raw_scores": [4.0, 4.0, 3.0, 3.0, 4.0], "baseline_score": 0.0, "outcome": "KEPT", "failure_mode": null, "duration_seconds": 133.95505904196762, "tags": [], "learnings": "{\"what_changed\":\"\",\"what_improved\":[],\"what_regressed\":[],\"transferable_insight\":\"No hypothesis provided\",\"domain_tags\":[]}", "cost_usd": 0.3231961000000001, "bootstrap_seed": 0, "agent_model": "claude-sonnet-4-6", "held_out_score": null, "criterion_names": ["correct_category", "concise_output", "follows_format", "no_hallucination", "handles_ambiguity"], "per_criterion_scores": {"correct_category": 1.0, "concise_output": 1.0, "follows_format": 0.0, "no_hallucination": 0.8, "handles_ambiguity": 0.8}, "failure_classification": null, "drafts_generated": 1, "drafts_survived": 1}
{"id": "57f6323c-f246-44c0-8c08-3312c731c152", "target_id": "B1-control", "git_sha": "c36039f1b592833b2697e465de5a15df1ec2eab4", "pre_experiment_sha": "c36039f1b592833b2697e465de5a15df1ec2eab4", "timestamp": "2026-04-05T20:29:38.018984+00:00", "hypothesis": "No hypothesis provided", "hypothesis_source": "synthesized", "mutation_diff_summary": "", "score": 3.3, "score_ci_lower": 2.9, "score_ci_upper": 3.7, "raw_scores": [3.5, 4.0, 2.5, 3.0, 3.5], "baseline_score": 3.6, "outcome": "DISCARDED", "failure_mode": null, "duration_seconds": 52.68322204099968, "tags": [], "learnings": "{\"what_changed\":\"\",\"what_improved\":[],\"what_regressed\":[],\"transferable_insight\":\"No hypothesis provided\",\"domain_tags\":[]}", "cost_usd": 0.14660865, "bootstrap_seed": 0, "agent_model": "claude-sonnet-4-6", "held_out_score": null, "criterion_names": ["correct_category", "concise_output", "follows_format", "no_hallucination", "handles_ambiguity"], "per_criterion_scores": {"correct_category": 1.0, "concise_output": 1.0, "follows_format": 0.0, "no_hallucination": 0.7, "handles_ambiguity": 0.6}, "failure_classification": {"category": "output_format", "description": "The failure mode indicates an 'Output structure/schema violation', which typically means the experiment's output did not conform to the expected schema.", "fix_direction": "Ensure that the output matches the expected format and schema specifications.", "confidence": 0.9}, "drafts_generated": 1, "drafts_survived": 1}
{"id": "e911c677-a699-4e9a-8b16-aa7b07958a6b", "target_id": "B1-control", "git_sha": "c36039f1b592833b2697e465de5a15df1ec2eab4", "pre_experiment_sha": "c36039f1b592833b2697e465de5a15df1ec2eab4", "timestamp": "2026-04-05T20:30:14.364019+00:00", "hypothesis": "No hypothesis provided", "hypothesis_source": "synthesized", "mutation_diff_summary": "", "score": 3.6, "score_ci_lower": 3.3, "score_ci_upper": 3.9, "raw_scores": [4.0, 4.0, 3.0, 3.5, 3.5], "baseline_score": 3.6, "outcome": "DISCARDED", "failure_mode": null, "duration_seconds": 34.95957670896314, "tags": [], "learnings": "{\"what_changed\":\"\",\"what_improved\":[],\"what_regressed\":[],\"transferable_insight\":\"No hypothesis provided\",\"domain_tags\":[]}", "cost_usd": 0.11360405000000001, "bootstrap_seed": 0, "agent_model": "claude-sonnet-4-6", "held_out_score": null, "criterion_names": ["correct_category", "concise_output", "follows_format", "no_hallucination", "handles_ambiguity"], "per_criterion_scores": {"correct_category": 1.0, "concise_output": 1.0, "follows_format": 0.0, "no_hallucination": 0.9, "handles_ambiguity": 0.7}, "failure_classification": {"category": "output_format", "description": "The experiment failed due to a violation of the expected output structure or schema.", "fix_direction": "Ensure outputs match the required schema or format strictly before submission.", "confidence": 0.9}, "drafts_generated": 1, "drafts_survived": 1}
{"id": "ea1015fe-1828-40d4-8ec5-9bf981ffd985", "target_id": "B1-control", "git_sha": "c36039f1b592833b2697e465de5a15df1ec2eab4", "pre_experiment_sha": "c36039f1b592833b2697e465de5a15df1ec2eab4", "timestamp": "2026-04-05T20:30:55.075901+00:00", "hypothesis": "No hypothesis provided", "hypothesis_source": "synthesized", "mutation_diff_summary": "", "score": 3.6, "score_ci_lower": 3.3, "score_ci_upper": 3.9, "raw_scores": [3.5, 4.0, 3.0, 3.5, 4.0], "baseline_score": 3.6, "outcome": "DISCARDED", "failure_mode": null, "duration_seconds": 39.42599904211238, "tags": [], "learnings": "{\"what_changed\":\"\",\"what_improved\":[],\"what_regressed\":[],\"transferable_insight\":\"No hypothesis provided\",\"domain_tags\":[]}", "cost_usd": 0.12943005, "bootstrap_seed": 0, "agent_model": "claude-sonnet-4-6", "held_out_score": null, "criterion_names": ["correct_category", "concise_output", "follows_format", "no_hallucination", "handles_ambiguity"], "per_criterion_scores": {"correct_category": 1.0, "concise_output": 1.0, "follows_format": 0.0, "no_hallucination": 0.8, "handles_ambiguity": 0.8}, "failure_classification": {"category": "output_format", "description": "The experiment failed due to violation of the required output structure or schema, as indicated by 'output_format' in the categories.", "fix_direction": "Ensure the output strictly adheres to the specified structure/schema requirements.", "confidence": 0.85}, "drafts_generated": 1, "drafts_survived": 1}
{"id": "110b7b47-19ff-4909-8d85-158a187282e0", "target_id": "B1-control", "git_sha": "c36039f1b592833b2697e465de5a15df1ec2eab4", "pre_experiment_sha": "c36039f1b592833b2697e465de5a15df1ec2eab4", "timestamp": "2026-04-05T20:31:50.023997+00:00", "hypothesis": "No hypothesis provided", "hypothesis_source": "synthesized", "mutation_diff_summary": "", "score": 3.5, "score_ci_lower": 3.2, "score_ci_upper": 3.8, "raw_scores": [4.0, 3.5, 3.0, 3.5, 3.5], "baseline_score": 3.6, "outcome": "DISCARDED", "failure_mode": null, "duration_seconds": 53.59789033420384, "tags": [], "learnings": "{\"what_changed\":\"\",\"what_improved\":[],\"what_regressed\":[],\"transferable_insight\":\"No hypothesis provided\",\"domain_tags\":[]}", "cost_usd": 0.1515824, "bootstrap_seed": 0, "agent_model": "claude-sonnet-4-6", "held_out_score": null, "criterion_names": ["correct_category", "concise_output", "follows_format", "no_hallucination", "handles_ambiguity"], "per_criterion_scores": {"correct_category": 1.0, "concise_output": 1.0, "follows_format": 0.0, "no_hallucination": 0.8, "handles_ambiguity": 0.7}, "failure_classification": {"category": "output_format", "description": "The experiment lacks a provided hypothesis and the failure mode is marked as unknown, suggesting a violation of expected output structure or required schema.", "fix_direction": "Ensure all required fields, such as hypothesis and failure mode, are properly populated according to the experiment reporting schema.", "confidence": 0.9}, "drafts_generated": 1, "drafts_survived": 1}
{"id": "b79c3b59-4d29-4f73-b948-a04aff34573d", "target_id": "B1-control", "git_sha": "c36039f1b592833b2697e465de5a15df1ec2eab4", "pre_experiment_sha": "c36039f1b592833b2697e465de5a15df1ec2eab4", "timestamp": "2026-04-05T20:32:30.007722+00:00", "hypothesis": "No hypothesis provided", "hypothesis_source": "synthesized", "mutation_diff_summary": "", "score": 3.4, "score_ci_lower": 3.0, "score_ci_upper": 3.8, "raw_scores": [4.0, 4.0, 3.0, 3.0, 3.0], "baseline_score": 3.6, "outcome": "DISCARDED", "failure_mode": null, "duration_seconds": 38.60929008410312, "tags": [], "learnings": "{\"what_changed\":\"\",\"what_improved\":[],\"what_regressed\":[],\"transferable_insight\":\"No hypothesis provided\",\"domain_tags\":[]}", "cost_usd": 0.11657820000000002, "bootstrap_seed": 0, "agent_model": "claude-sonnet-4-6", "held_out_score": null, "criterion_names": ["correct_category", "concise_output", "follows_format", "no_hallucination", "handles_ambiguity"], "per_criterion_scores": {"correct_category": 1.0, "concise_output": 1.0, "follows_format": 0.0, "no_hallucination": 0.7, "handles_ambiguity": 0.7}, "failure_classification": {"category": "output_format", "description": "The experiment lacks a stated hypothesis, which is a required component of the output schema. This violates the expected output structure.", "fix_direction": "Ensure all required schema fields, such as the hypothesis, are provided in future outputs.", "confidence": 0.95}, "drafts_generated": 1, "drafts_survived": 1}
{"id": "26e8a6ad-cc52-47ca-bd62-49f6b359cb91", "target_id": "B1-control", "git_sha": "c36039f1b592833b2697e465de5a15df1ec2eab4", "pre_experiment_sha": "c36039f1b592833b2697e465de5a15df1ec2eab4", "timestamp": "2026-04-05T20:33:14.498950+00:00", "hypothesis": "No hypothesis provided", "hypothesis_source": "synthesized", "mutation_diff_summary": "", "score": 3.6, "score_ci_lower": 3.2, "score_ci_upper": 4.0, "raw_scores": [4.0, 4.0, 3.0, 3.0, 4.0], "baseline_score": 3.6, "outcome": "DISCARDED", "failure_mode": null, "duration_seconds": 43.19837487488985, "tags": [], "learnings": "{\"what_changed\":\"\",\"what_improved\":[],\"what_regressed\":[],\"transferable_insight\":\"No hypothesis provided\",\"domain_tags\":[]}", "cost_usd": 0.11633614999999999, "bootstrap_seed": 0, "agent_model": "claude-sonnet-4-6", "held_out_score": null, "criterion_names": ["correct_category", "concise_output", "follows_format", "no_hallucination", "handles_ambiguity"], "per_criterion_scores": {"correct_category": 1.0, "concise_output": 1.0, "follows_format": 0.0, "no_hallucination": 0.8, "handles_ambiguity": 0.8}, "failure_classification": {"category": "output_format", "description": "The experiment failed due to a violation of the required output structure or schema, as indicated by the absence of a hypothesis and unknown failure mode.", "fix_direction": "Ensure outputs consistently conform to the prescribed structure, including all mandatory fields.", "confidence": 0.85}, "drafts_generated": 1, "drafts_survived": 1}
{"id": "f45309d5-5dbe-4990-9155-ea8c33d659c7", "target_id": "B1-control", "git_sha": "c36039f1b592833b2697e465de5a15df1ec2eab4", "pre_experiment_sha": "c36039f1b592833b2697e465de5a15df1ec2eab4", "timestamp": "2026-04-05T20:34:05.094436+00:00", "hypothesis": "No hypothesis provided", "hypothesis_source": "synthesized", "mutation_diff_summary": "", "score": 3.5, "score_ci_lower": 3.1, "score_ci_upper": 3.9, "raw_scores": [4.0, 4.0, 3.0, 3.0, 3.5], "baseline_score": 3.6, "outcome": "DISCARDED", "failure_mode": null, "duration_seconds": 49.17861700011417, "tags": [], "learnings": "{\"what_changed\":\"\",\"what_improved\":[],\"what_regressed\":[],\"transferable_insight\":\"No hypothesis provided\",\"domain_tags\":[]}", "cost_usd": 0.2134612, "bootstrap_seed": 0, "agent_model": "claude-sonnet-4-6", "held_out_score": null, "criterion_names": ["correct_category", "concise_output", "follows_format", "no_hallucination", "handles_ambiguity"], "per_criterion_scores": {"correct_category": 1.0, "concise_output": 1.0, "follows_format": 0.0, "no_hallucination": 0.7, "handles_ambiguity": 0.8}, "failure_classification": {"category": "output_format", "description": "The experiment failed due to a violation of the expected output structure or schema.", "fix_direction": "Ensure output strictly adheres to the required format and schema specifications.", "confidence": 0.8}, "drafts_generated": 1, "drafts_survived": 1}
{"id": "bd808fe4-96b2-4bc1-8044-5e13aecbacda", "target_id": "B1-control", "git_sha": "c36039f1b592833b2697e465de5a15df1ec2eab4", "pre_experiment_sha": "c36039f1b592833b2697e465de5a15df1ec2eab4", "timestamp": "2026-04-05T20:34:43.893688+00:00", "hypothesis": "No hypothesis provided", "hypothesis_source": "synthesized", "mutation_diff_summary": "", "score": 3.6, "score_ci_lower": 3.2, "score_ci_upper": 4.0, "raw_scores": [4.0, 4.0, 3.0, 3.0, 4.0], "baseline_score": 3.6, "outcome": "DISCARDED", "failure_mode": null, "duration_seconds": 37.321664167102426, "tags": [], "learnings": "{\"what_changed\":\"\",\"what_improved\":[],\"what_regressed\":[],\"transferable_insight\":\"No hypothesis provided\",\"domain_tags\":[]}", "cost_usd": 0.11641195000000001, "bootstrap_seed": 0, "agent_model": "claude-sonnet-4-6", "held_out_score": null, "criterion_names": ["correct_category", "concise_output", "follows_format", "no_hallucination", "handles_ambiguity"], "per_criterion_scores": {"correct_category": 1.0, "concise_output": 1.0, "follows_format": 0.0, "no_hallucination": 0.8, "handles_ambiguity": 0.8}, "failure_classification": {"category": "output_format", "description": "The experiment lacks a provided hypothesis and failure mode, which are required components according to the expected schema. This constitutes a violation of the required output structure.", "fix_direction": "Ensure all required fields (such as hypothesis and failure mode) are supplied in future experiments to comply with the expected output schema.", "confidence": 0.95}, "drafts_generated": 1, "drafts_survived": 1}
{"id": "5998c801-822e-421e-b8e3-ca16e848c19f", "target_id": "B1-control", "git_sha": "c36039f1b592833b2697e465de5a15df1ec2eab4", "pre_experiment_sha": "c36039f1b592833b2697e465de5a15df1ec2eab4", "timestamp": "2026-04-05T20:35:22.585500+00:00", "hypothesis": "No hypothesis provided", "hypothesis_source": "synthesized", "mutation_diff_summary": "", "score": 3.6, "score_ci_lower": 3.3, "score_ci_upper": 3.9, "raw_scores": [4.0, 4.0, 3.0, 3.5, 3.5], "baseline_score": 3.6, "outcome": "DISCARDED", "failure_mode": null, "duration_seconds": 37.01843049982563, "tags": [], "learnings": "{\"what_changed\":\"\",\"what_improved\":[],\"what_regressed\":[],\"transferable_insight\":\"No hypothesis provided\",\"domain_tags\":[]}", "cost_usd": 0.11495385000000001, "bootstrap_seed": 0, "agent_model": "claude-sonnet-4-6", "held_out_score": null, "criterion_names": ["correct_category", "concise_output", "follows_format", "no_hallucination", "handles_ambiguity"], "per_criterion_scores": {"correct_category": 1.0, "concise_output": 1.0, "follows_format": 0.0, "no_hallucination": 0.9, "handles_ambiguity": 0.7}, "failure_classification": {"category": "output_format", "description": "The experiment failed due to a violation of the required output structure or schema.", "fix_direction": "Ensure outputs strictly adhere to the specified format or schema in future attempts.", "confidence": 0.8}, "drafts_generated": 1, "drafts_survived": 1}
{"id": "e0168ead-3ec2-423f-8332-b979385a4840", "target_id": "B1-control", "git_sha": "c36039f1b592833b2697e465de5a15df1ec2eab4", "pre_experiment_sha": "c36039f1b592833b2697e465de5a15df1ec2eab4", "timestamp": "2026-04-05T20:37:59.130536+00:00", "hypothesis": "No hypothesis provided", "hypothesis_source": "synthesized", "mutation_diff_summary": "", "score": 3.6, "score_ci_lower": 3.2, "score_ci_upper": 4.0, "raw_scores": [4.0, 4.0, 3.0, 3.0, 4.0], "baseline_score": 3.6, "outcome": "DISCARDED", "failure_mode": null, "duration_seconds": 155.23547712503932, "tags": [], "learnings": "{\"what_changed\":\"\",\"what_improved\":[],\"what_regressed\":[],\"transferable_insight\":\"No hypothesis provided\",\"domain_tags\":[]}", "cost_usd": 0.3836687500000001, "bootstrap_seed": 0, "agent_model": "claude-sonnet-4-6", "held_out_score": null, "criterion_names": ["correct_category", "concise_output", "follows_format", "no_hallucination", "handles_ambiguity"], "per_criterion_scores": {"correct_category": 1.0, "concise_output": 1.0, "follows_format": 0.0, "no_hallucination": 0.8, "handles_ambiguity": 0.8}, "failure_classification": {"category": "output_format", "description": "The experiment failed due to a violation of the required output structure or schema, as indicated by the absence of a hypothesis and unknown failure mode.", "fix_direction": "Ensure all required fields (such as hypothesis and failure mode) are present and conform to the specified schema before finalizing output.", "confidence": 0.85}, "drafts_generated": 1, "drafts_survived": 1}
{"id": "18a3a5c6-18b3-41eb-9e34-14941a3abe86", "target_id": "B1-control", "git_sha": "4514d257495c5f1f4644196daaa11034ba4c8f7e", "pre_experiment_sha": "c36039f1b592833b2697e465de5a15df1ec2eab4", "timestamp": "2026-04-05T20:38:33.796029+00:00", "hypothesis": "No hypothesis provided", "hypothesis_source": "synthesized", "mutation_diff_summary": "", "score": 3.6, "score_ci_lower": 3.2, "score_ci_upper": 4.0, "raw_scores": [4.0, 4.0, 3.0, 3.0, 4.0], "baseline_score": 3.6, "outcome": "KEPT", "failure_mode": null, "duration_seconds": 33.14837162499316, "tags": [], "learnings": "{\"what_changed\":\"\",\"what_improved\":[],\"what_regressed\":[],\"transferable_insight\":\"No hypothesis provided\",\"domain_tags\":[]}", "cost_usd": 0.11319855000000001, "bootstrap_seed": 0, "agent_model": "claude-sonnet-4-6", "held_out_score": null, "criterion_names": ["correct_category", "concise_output", "follows_format", "no_hallucination", "handles_ambiguity"], "per_criterion_scores": {"correct_category": 1.0, "concise_output": 1.0, "follows_format": 0.0, "no_hallucination": 0.8, "handles_ambiguity": 0.8}, "failure_classification": null, "drafts_generated": 1, "drafts_survived": 1}
{"id": "2a70af22-cefe-4c4c-a5f8-071e023d79da", "target_id": "B1-control", "git_sha": "e27f93988c0fff8465a1350a25e31e34cde74803", "pre_experiment_sha": "4514d257495c5f1f4644196daaa11034ba4c8f7e", "timestamp": "2026-04-05T20:39:13.622557+00:00", "hypothesis": "No hypothesis provided", "hypothesis_source": "synthesized", "mutation_diff_summary": "", "score": 3.5, "score_ci_lower": 3.1, "score_ci_upper": 3.9, "raw_scores": [4.0, 4.0, 3.0, 3.0, 3.5], "baseline_score": 3.6, "outcome": "KEPT", "failure_mode": null, "duration_seconds": 39.36609070794657, "tags": [], "learnings": "{\"what_changed\":\"\",\"what_improved\":[],\"what_regressed\":[],\"transferable_insight\":\"No hypothesis provided\",\"domain_tags\":[]}", "cost_usd": 0.1195224, "bootstrap_seed": 0, "agent_model": "claude-sonnet-4-6", "held_out_score": null, "criterion_names": ["correct_category", "concise_output", "follows_format", "no_hallucination", "handles_ambiguity"], "per_criterion_scores": {"correct_category": 1.0, "concise_output": 1.0, "follows_format": 0.0, "no_hallucination": 0.7, "handles_ambiguity": 0.8}, "failure_classification": null, "drafts_generated": 1, "drafts_survived": 1}
{"id": "cebc2dad-d401-44b1-bc4b-541e745e3efb", "target_id": "B1-control", "git_sha": "4085990c2bcb45098b25f006d25569d03ea52fbf", "pre_experiment_sha": "e27f93988c0fff8465a1350a25e31e34cde74803", "timestamp": "2026-04-05T20:39:51.645797+00:00", "hypothesis": "No hypothesis provided", "hypothesis_source": "synthesized", "mutation_diff_summary": "", "score": 3.5, "score_ci_lower": 3.1, "score_ci_upper": 3.9, "raw_scores": [3.5, 4.0, 3.0, 3.0, 4.0], "baseline_score": 3.5, "outcome": "KEPT", "failure_mode": null, "duration_seconds": 37.60643933294341, "tags": [], "learnings": "{\"what_changed\":\"\",\"what_improved\":[],\"what_regressed\":[],\"transferable_insight\":\"No hypothesis provided\",\"domain_tags\":[]}", "cost_usd": 0.1731678, "bootstrap_seed": 0, "agent_model": "claude-sonnet-4-6", "held_out_score": null, "criterion_names": ["correct_category", "concise_output", "follows_format", "no_hallucination", "handles_ambiguity"], "per_criterion_scores": {"correct_category": 1.0, "concise_output": 1.0, "follows_format": 0.0, "no_hallucination": 0.7, "handles_ambiguity": 0.8}, "failure_classification": null, "drafts_generated": 1, "drafts_survived": 1}
{"id": "d5bbd2d6-432f-4e1a-a136-826e44924e47", "target_id": "B1-control", "git_sha": "a2647666f0d16f04e7dba2de7134706da04506cf", "pre_experiment_sha": "4085990c2bcb45098b25f006d25569d03ea52fbf", "timestamp": "2026-04-05T20:41:02.712803+00:00", "hypothesis": "No hypothesis provided", "hypothesis_source": "synthesized", "mutation_diff_summary": "", "score": 3.4, "score_ci_lower": 3.0, "score_ci_upper": 3.8, "raw_scores": [3.0, 4.0, 3.0, 3.0, 4.0], "baseline_score": 3.5, "outcome": "KEPT", "failure_mode": null, "duration_seconds": 70.59144066716544, "tags": [], "learnings": "{\"what_changed\":\"\",\"what_improved\":[],\"what_regressed\":[],\"transferable_insight\":\"No hypothesis provided\",\"domain_tags\":[]}", "cost_usd": 0.16185465, "bootstrap_seed": 0, "agent_model": "claude-sonnet-4-6", "held_out_score": null, "criterion_names": ["correct_category", "concise_output", "follows_format", "no_hallucination", "handles_ambiguity"], "per_criterion_scores": {"correct_category": 1.0, "concise_output": 1.0, "follows_format": 0.0, "no_hallucination": 0.6, "handles_ambiguity": 0.8}, "failure_classification": null, "drafts_generated": 1, "drafts_survived": 1}
{"id": "e06b8e18-f253-4581-b3b8-f05ac8b1962e", "target_id": "B1-control", "git_sha": "81d2d3f80ead9874d51d74e09fc73938b364e1e6", "pre_experiment_sha": "a2647666f0d16f04e7dba2de7134706da04506cf", "timestamp": "2026-04-05T20:41:58.795690+00:00", "hypothesis": "No hypothesis provided", "hypothesis_source": "synthesized", "mutation_diff_summary": "", "score": 3.5, "score_ci_lower": 3.1, "score_ci_upper": 3.9, "raw_scores": [4.0, 4.0, 3.0, 3.5, 3.0], "baseline_score": 3.4, "outcome": "KEPT", "failure_mode": null, "duration_seconds": 55.63618579204194, "tags": [], "learnings": "{\"what_changed\":\"\",\"what_improved\":[],\"what_regressed\":[],\"transferable_insight\":\"No hypothesis provided\",\"domain_tags\":[]}", "cost_usd": 0.13551495, "bootstrap_seed": 0, "agent_model": "claude-sonnet-4-6", "held_out_score": null, "criterion_names": ["correct_category", "concise_output", "follows_format", "no_hallucination", "handles_ambiguity"], "per_criterion_scores": {"correct_category": 0.8, "concise_output": 1.0, "follows_format": 0.0, "no_hallucination": 0.9, "handles_ambiguity": 0.8}, "failure_classification": null, "drafts_generated": 1, "drafts_survived": 1}
