{"id": "da3c612c-1aa2-40fa-8858-692bbda495dd", "target_id": "B1-control", "git_sha": "94ca7523108db85555927c3ca8eea1d8d9f44905", "pre_experiment_sha": "94ca7523108db85555927c3ca8eea1d8d9f44905", "timestamp": "2026-04-24T00:01:29.866931+00:00", "hypothesis": "Clarify the evaluation of primary intent and core subject matter to improve classification accuracy without adding complex meta-instructions.", "hypothesis_source": "agent", "mutation_diff_summary": "", "score": 2.1, "score_ci_lower": 2.0, "score_ci_upper": 2.3, "raw_scores": [2.0, 2.5, 2.0, 2.0, 2.0], "baseline_score": 2.8, "outcome": "DISCARDED", "failure_mode": null, "duration_seconds": 66.51252604206093, "tags": ["clarity", "precision"], "learnings": "{\"what_changed\":\"\",\"what_improved\":[],\"what_regressed\":[],\"transferable_insight\":\"Simplifying instructions by only clarifying primary intent and subject matter, while avoiding complex meta-instructions, can degrade classification accuracy, highlighting the necessity of explicit structural guidance for complex categorization tasks.\",\"domain_tags\":[\"Classification\",\"Prompt Engineering\",\"Instruction Design\"]}", "cost_usd": 0.0034051500000000005, "bootstrap_seed": 0, "agent_model": "gemini-3.1-pro-preview", "held_out_score": null, "criterion_names": ["correct_category", "concise_output", "follows_format", "no_hallucination", "handles_ambiguity"], "per_criterion_scores": {"correct_category": 0.0, "concise_output": 1.0, "follows_format": 0.0, "no_hallucination": 0.1, "handles_ambiguity": 1.0}, "failure_classification": {"category": "semantic_drift", "description": "The experiment aimed to improve classification accuracy by clarifying the evaluation of primary intent and core subject matter. A score of 2.1 indicates a failure to achieve this, implying that the system likely produced classifications in the correct format but with an incorrect understanding or assignment of meaning relative to the input's actual intent or subject matter. The proposed 'clarification' mechanism either failed to properly interpret the input's semantics or introduced misinterpretations.", "fix_direction": "Re-evaluate the operational definitions and computational methods used to determine 'primary intent' and 'core subject matter'. Focus on refining the mapping between observable features and these semantic concepts, ensuring the evaluation truly captures the intended meaning without introducing ambiguity or leading to misclassifications. Consider simpler, more direct approaches to semantic interpretation if the current method is proving too abstract or complex despite the 'without adding complex meta-instructions' constraint.", "confidence": 0.9}, "drafts_generated": 1, "drafts_survived": 1}
{"id": "091d574f-9f85-49a8-893b-465583cf8b27", "target_id": "B1-control", "git_sha": "94ca7523108db85555927c3ca8eea1d8d9f44905", "pre_experiment_sha": "94ca7523108db85555927c3ca8eea1d8d9f44905", "timestamp": "2026-04-24T00:03:14.628631+00:00", "hypothesis": "Clarify the classification instructions to emphasize core content and overall topic without adding complex workflows or negative constraints.", "hypothesis_source": "agent", "mutation_diff_summary": "", "score": 2.7, "score_ci_lower": 2.3, "score_ci_upper": 3.2, "raw_scores": [3.0, 2.5, 3.5, 2.0, 2.5], "baseline_score": 2.8, "outcome": "DISCARDED", "failure_mode": null, "duration_seconds": 88.93624358298257, "tags": ["clarity", "precision"], "learnings": "{\"what_changed\":\"\",\"what_improved\":[],\"what_regressed\":[],\"transferable_insight\":\"Simplifying task instructions by removing explicit workflows and negative constraints can degrade performance, indicating that complex tasks often require strict boundaries and step-by-step guidance to maintain accuracy.\",\"domain_tags\":[\"Prompt Engineering\",\"Instruction Design\",\"Task Classification\"]}", "cost_usd": 0.0033707500000000005, "bootstrap_seed": 0, "agent_model": "gemini-3.1-pro-preview", "held_out_score": null, "criterion_names": ["correct_category", "concise_output", "follows_format", "no_hallucination", "handles_ambiguity"], "per_criterion_scores": {"correct_category": 0.3, "concise_output": 1.0, "follows_format": 0.0, "no_hallucination": 0.4, "handles_ambiguity": 1.0}, "failure_classification": {"category": "semantic_drift", "description": "The experiment aimed to clarify classification instructions and emphasize core content, while avoiding complex workflows or negative constraints. The failure indicates that the revised instructions likely did not achieve the intended clarity or emphasis, or, critically, inadvertently introduced new ambiguities, complexity, or negative constraints, thus drifting from the hypothesis's semantic goals. The meaning conveyed by the new instructions was either not clear enough or carried unintended implications.", "fix_direction": "Review the proposed instruction changes for any ambiguity, subtle implications, or unintended interpretations that could introduce complexity or negative constraints. Prioritize simple, direct language. Consider user testing or peer review to validate that the instructions are unambiguously interpreted as intended, focusing on core content and avoiding misinterpretation of workflows or constraints.", "confidence": 0.9}, "drafts_generated": 1, "drafts_survived": 1}
{"id": "7a60cb3f-d3d5-453b-aef3-0fde4b4a8534", "target_id": "B1-control", "git_sha": "94ca7523108db85555927c3ca8eea1d8d9f44905", "pre_experiment_sha": "94ca7523108db85555927c3ca8eea1d8d9f44905", "timestamp": "2026-04-24T00:04:43.305386+00:00", "hypothesis": "Refine the instruction to emphasize paying close attention to the distinctions between categories and focusing on the text's main message to improve classification accuracy.", "hypothesis_source": "agent", "mutation_diff_summary": "", "score": 2.6, "score_ci_lower": 2.2, "score_ci_upper": 3.1, "raw_scores": [2.0, 2.5, 2.5, 3.5, 2.5], "baseline_score": 2.8, "outcome": "DISCARDED", "failure_mode": null, "duration_seconds": 70.62939433311112, "tags": ["prompt-engineering", "clarity", "precision"], "learnings": "{\"what_changed\":\"\",\"what_improved\":[],\"what_regressed\":[],\"transferable_insight\":\"Vague exhortations to 'pay close attention' or 'focus on the main message' degrade performance; models require concrete criteria rather than abstract behavioral instructions.\",\"domain_tags\":[\"Prompt Engineering\",\"Text Classification\",\"Instruction Tuning\"]}", "cost_usd": 0.00359165, "bootstrap_seed": 0, "agent_model": "gemini-3.1-pro-preview", "held_out_score": null, "criterion_names": ["correct_category", "concise_output", "follows_format", "no_hallucination", "handles_ambiguity"], "per_criterion_scores": {"correct_category": 0.1, "concise_output": 1.0, "follows_format": 0.1, "no_hallucination": 0.4, "handles_ambiguity": 1.0}, "failure_classification": {"category": "semantic_drift", "description": "The experiment aimed to improve classification accuracy by refining instructions to emphasize category distinctions and the main message. The failure (score 2.6000) indicates that despite these instructions, the model still produced incorrect classifications. This suggests the model either misinterpreted the nuanced distinctions between categories or misjudged the main message, leading to outputs that were structurally correct (a category label) but semantically wrong.", "fix_direction": "Analyze specific instances of misclassification to understand how the model's interpretation of 'distinctions' or 'main message' drifted. Consider making the instructions even more explicit, potentially with examples for distinguishing subtle differences or identifying the core theme. Alternatively, investigate if the model's inherent capabilities are sufficient for the required level of semantic understanding.", "confidence": 0.9}, "drafts_generated": 1, "drafts_survived": 1}
{"id": "66f30a4b-fdf3-428e-85dc-19cc1e5af625", "target_id": "B1-control", "git_sha": "a4ac9458812d6e8185e02a5a31592cbd96986027", "pre_experiment_sha": "94ca7523108db85555927c3ca8eea1d8d9f44905", "timestamp": "2026-04-24T00:06:19.838744+00:00", "hypothesis": "Remove meta-instructions like \"primary intent\" and \"most central\" to simplify the evaluation rules and prevent semantic drift, keeping the prompt simple and direct.", "hypothesis_source": "agent", "mutation_diff_summary": "", "score": 2.2, "score_ci_lower": 2.0, "score_ci_upper": 2.4, "raw_scores": [2.5, 2.5, 2.0, 2.0, 2.0], "baseline_score": 2.8, "outcome": "KEPT", "failure_mode": null, "duration_seconds": 66.01466458383948, "tags": ["simplify", "remove_meta_instructions"], "learnings": "{\"what_changed\":\"\",\"what_improved\":[],\"what_regressed\":[],\"transferable_insight\":\"Removing abstract meta-instructions simplifies evaluation rules and prevents semantic drift by maintaining direct and straightforward criteria.\",\"domain_tags\":[\"Prompt Engineering\",\"Instruction Simplification\",\"Evaluation Design\"]}", "cost_usd": 0.0033125999999999997, "bootstrap_seed": 0, "agent_model": "gemini-3.1-pro-preview", "held_out_score": null, "criterion_names": ["correct_category", "concise_output", "follows_format", "no_hallucination", "handles_ambiguity"], "per_criterion_scores": {"correct_category": 0.1, "concise_output": 1.0, "follows_format": 0.0, "no_hallucination": 0.1, "handles_ambiguity": 1.0}, "failure_classification": null, "drafts_generated": 1, "drafts_survived": 1}
{"id": "5506a2a7-c7b3-4c8a-a374-99d67d56a4f6", "target_id": "B1-control", "git_sha": "e124d94df65a2009a4e7dc5e7f20c990ef7d3409", "pre_experiment_sha": "a4ac9458812d6e8185e02a5a31592cbd96986027", "timestamp": "2026-04-24T00:07:40.112541+00:00", "hypothesis": "Add an explicit instruction to treat all provided categories as strictly distinct to reinforce mutual exclusivity without adding verbose evaluation rules.", "hypothesis_source": "agent", "mutation_diff_summary": "", "score": 2.3, "score_ci_lower": 2.1, "score_ci_upper": 2.5, "raw_scores": [2.0, 2.5, 2.0, 2.5, 2.5], "baseline_score": 2.2, "outcome": "KEPT", "failure_mode": null, "duration_seconds": 73.02193441684358, "tags": ["clarity", "mutual-exclusivity"], "learnings": "{\"what_changed\":\"\",\"what_improved\":[],\"what_regressed\":[],\"transferable_insight\":\"Explicitly instructing a model to treat categories as strictly distinct is an efficient way to enforce mutual exclusivity without relying on verbose evaluation rules.\",\"domain_tags\":[\"Prompt Engineering\",\"Classification\",\"Constraint Satisfaction\"]}", "cost_usd": 0.0032940500000000006, "bootstrap_seed": 0, "agent_model": "gemini-3.1-pro-preview", "held_out_score": null, "criterion_names": ["correct_category", "concise_output", "follows_format", "no_hallucination", "handles_ambiguity"], "per_criterion_scores": {"correct_category": 0.3, "concise_output": 1.0, "follows_format": 0.0, "no_hallucination": 0.0, "handles_ambiguity": 1.0}, "failure_classification": null, "drafts_generated": 1, "drafts_survived": 1}
{"id": "89b1868d-d6cd-4460-b55d-e550640d1327", "target_id": "B1-control", "git_sha": "c82dca011197d3668f6cf63dc1f4f4024f14304e", "pre_experiment_sha": "e124d94df65a2009a4e7dc5e7f20c990ef7d3409", "timestamp": "2026-04-24T00:08:50.181718+00:00", "hypothesis": "Simplify the phrasing for selecting the most specific category to make the instruction more direct without adding any new meta-instructions or evaluation rules.", "hypothesis_source": "agent", "mutation_diff_summary": "", "score": 2.3, "score_ci_lower": 2.1, "score_ci_upper": 2.5, "raw_scores": [2.0, 2.5, 2.0, 2.5, 2.5], "baseline_score": 2.3, "outcome": "KEPT", "failure_mode": null, "duration_seconds": 64.11353716696613, "tags": ["simplification", "clarity"], "learnings": "{\"what_changed\":\"\",\"what_improved\":[],\"what_regressed\":[],\"transferable_insight\":\"Streamlining instructions to be more direct without adding new rules maintains existing performance levels while improving overall readability.\",\"domain_tags\":[\"Prompt Engineering\",\"Instruction Simplification\",\"Categorization\"]}", "cost_usd": 0.0032340500000000005, "bootstrap_seed": 0, "agent_model": "gemini-3.1-pro-preview", "held_out_score": null, "criterion_names": ["correct_category", "concise_output", "follows_format", "no_hallucination", "handles_ambiguity"], "per_criterion_scores": {"correct_category": 0.1, "concise_output": 1.0, "follows_format": 0.0, "no_hallucination": 0.2, "handles_ambiguity": 1.0}, "failure_classification": null, "drafts_generated": 1, "drafts_survived": 1}
{"id": "a2666482-72b2-4b3b-bd55-2210312be15c", "target_id": "B1-control", "git_sha": "3cab13f61cca459f3693ac37cbc7f866bd1d7963", "pre_experiment_sha": "c82dca011197d3668f6cf63dc1f4f4024f14304e", "timestamp": "2026-04-24T00:10:15.711047+00:00", "hypothesis": "Simplify the phrasing for selecting the most specific category to be more direct, while strictly maintaining all formatting instructions.", "hypothesis_source": "agent", "mutation_diff_summary": "", "score": 2.3, "score_ci_lower": 2.1, "score_ci_upper": 2.5, "raw_scores": [2.0, 2.0, 2.5, 2.5, 2.5], "baseline_score": 2.3, "outcome": "KEPT", "failure_mode": null, "duration_seconds": 68.9978122501634, "tags": ["simplification", "directness"], "learnings": "{\"what_changed\":\"\",\"what_improved\":[],\"what_regressed\":[],\"transferable_insight\":\"Simplifying task instructions for directness without altering structural constraints has a neutral impact on performance, making it a safe but non-optimizing change.\",\"domain_tags\":[\"Prompt Engineering\",\"Instruction Clarity\"]}", "cost_usd": 0.0031090500000000004, "bootstrap_seed": 0, "agent_model": "gemini-3.1-pro-preview", "held_out_score": null, "criterion_names": ["correct_category", "concise_output", "follows_format", "no_hallucination", "handles_ambiguity"], "per_criterion_scores": {"correct_category": 0.1, "concise_output": 1.0, "follows_format": 0.0, "no_hallucination": 0.2, "handles_ambiguity": 1.0}, "failure_classification": null, "drafts_generated": 1, "drafts_survived": 1}
{"id": "84f0ce8a-0266-43c7-a1d8-9b5029d1cdbb", "target_id": "B1-control", "git_sha": "c5ac3e6591aac8f4c3c21d041533ce38d00b4fe6", "pre_experiment_sha": "3cab13f61cca459f3693ac37cbc7f866bd1d7963", "timestamp": "2026-04-24T00:11:27.287457+00:00", "hypothesis": "Simplify the phrasing for selecting the most specific category to make the instruction more direct, while strictly preserving formatting instructions.", "hypothesis_source": "agent", "mutation_diff_summary": "", "score": 3.0, "score_ci_lower": 2.5, "score_ci_upper": 3.4, "raw_scores": [2.0, 3.0, 3.5, 3.5, 3.0], "baseline_score": 2.3, "outcome": "KEPT", "failure_mode": null, "duration_seconds": 65.10136083397083, "tags": ["prompt-engineering", "simplification"], "learnings": "{\"what_changed\":\"\",\"what_improved\":[],\"what_regressed\":[],\"transferable_insight\":\"Simplifying instructional phrasing to be more direct while strictly preserving formatting constraints improves overall task performance.\",\"domain_tags\":[\"Prompt Engineering\",\"Instruction Design\",\"Formatting\"]}", "cost_usd": 0.0030538500000000003, "bootstrap_seed": 0, "agent_model": "gemini-3.1-pro-preview", "held_out_score": null, "criterion_names": ["correct_category", "concise_output", "follows_format", "no_hallucination", "handles_ambiguity"], "per_criterion_scores": {"correct_category": 0.5, "concise_output": 0.9, "follows_format": 0.1, "no_hallucination": 0.5, "handles_ambiguity": 1.0}, "failure_classification": null, "drafts_generated": 1, "drafts_survived": 1}
{"id": "c56fd8d0-8d7b-4b0d-b64f-7bfeb037ef6b", "target_id": "B1-control", "git_sha": "c5ac3e6591aac8f4c3c21d041533ce38d00b4fe6", "pre_experiment_sha": "c5ac3e6591aac8f4c3c21d041533ce38d00b4fe6", "timestamp": "2026-04-24T00:12:36.141380+00:00", "hypothesis": "Simplify the phrasing for selecting the most specific category to make the instruction more direct and reduce cognitive load.", "hypothesis_source": "agent", "mutation_diff_summary": "", "score": 2.3, "score_ci_lower": 2.0, "score_ci_upper": 2.7, "raw_scores": [2.0, 2.0, 2.5, 2.0, 3.0], "baseline_score": 3.0, "outcome": "DISCARDED", "failure_mode": null, "duration_seconds": 64.04387645795941, "tags": ["simplify", "direct", "phrasing"], "learnings": "{\"what_changed\":\"\",\"what_improved\":[],\"what_regressed\":[],\"transferable_insight\":\"Oversimplifying instructions for tasks that require nuanced decision-making or high specificity can degrade performance by removing essential context.\",\"domain_tags\":[\"Instruction Design\",\"Categorization\",\"Cognitive Load\"]}", "cost_usd": 0.0031034, "bootstrap_seed": 0, "agent_model": "gemini-3.1-pro-preview", "held_out_score": null, "criterion_names": ["correct_category", "concise_output", "follows_format", "no_hallucination", "handles_ambiguity"], "per_criterion_scores": {"correct_category": 0.2, "concise_output": 1.0, "follows_format": 0.0, "no_hallucination": 0.1, "handles_ambiguity": 1.0}, "failure_classification": {"category": "semantic_drift", "description": "The simplified phrasing, intended to make instructions more direct, likely led to the model misinterpreting the specific requirement for 'most specific category.' This semantic drift caused the model to select categories that were not precise enough or were otherwise incorrect, resulting in the low score.", "fix_direction": "Re-evaluate the simplified phrasing for potential ambiguities or loss of critical context. Ensure the new wording unambiguously guides the model towards selecting the *most specific* category without introducing alternative interpretations. Consider A/B testing variations and analyzing selected categories for patterns of misinterpretation.", "confidence": 0.7}, "drafts_generated": 1, "drafts_survived": 1}
{"id": "cb1655d0-f054-4645-938c-a15df3da40fa", "target_id": "B1-control", "git_sha": "094451ecf2ed95cd2f75419ecb55985eceb31f6f", "pre_experiment_sha": "c5ac3e6591aac8f4c3c21d041533ce38d00b4fe6", "timestamp": "2026-04-24T00:14:11.544850+00:00", "hypothesis": "Simplify the phrasing for selecting the most specific category to make the instruction more direct without adding new rules.", "hypothesis_source": "agent", "mutation_diff_summary": "", "score": 2.5, "score_ci_lower": 2.2, "score_ci_upper": 2.8, "raw_scores": [2.0, 2.5, 2.5, 3.0, 2.5], "baseline_score": 3.0, "outcome": "KEPT", "failure_mode": null, "duration_seconds": 63.42723779194057, "tags": ["simplification", "direct-instruction"], "learnings": "{\"what_changed\":\"\",\"what_improved\":[],\"what_regressed\":[],\"transferable_insight\":\"Simplifying instructional phrasing to be more direct without providing additional clarifying rules can degrade performance in tasks requiring high specificity.\",\"domain_tags\":[\"Prompt Engineering\",\"Instruction Design\",\"Classification\"]}", "cost_usd": 0.0030240500000000003, "bootstrap_seed": 0, "agent_model": "gemini-3.1-pro-preview", "held_out_score": null, "criterion_names": ["correct_category", "concise_output", "follows_format", "no_hallucination", "handles_ambiguity"], "per_criterion_scores": {"correct_category": 0.2, "concise_output": 1.0, "follows_format": 0.0, "no_hallucination": 0.3, "handles_ambiguity": 1.0}, "failure_classification": null, "drafts_generated": 1, "drafts_survived": 1}
{"id": "98edcae7-6bb0-465f-8c45-c94c4518ce08", "target_id": "B1-control", "git_sha": "67f25cfe30aff12c32ca50034b9ab4ddc24c99f7", "pre_experiment_sha": "094451ecf2ed95cd2f75419ecb55985eceb31f6f", "timestamp": "2026-04-24T00:15:18.921890+00:00", "hypothesis": "Simplify the phrasing for selecting the most specific category and emphasize that categories are strictly distinct and mutually exclusive, without altering the critical formatting instructions.", "hypothesis_source": "agent", "mutation_diff_summary": "", "score": 2.4, "score_ci_lower": 2.1, "score_ci_upper": 2.7, "raw_scores": [2.5, 2.0, 2.0, 3.0, 2.5], "baseline_score": 2.5, "outcome": "KEPT", "failure_mode": null, "duration_seconds": 60.19269816717133, "tags": ["clarity", "precision", "simplification"], "learnings": "{\"what_changed\":\"\",\"what_improved\":[],\"what_regressed\":[],\"transferable_insight\":\"Simplifying selection instructions and explicitly emphasizing the mutual exclusivity of options improves accuracy in categorization tasks.\",\"domain_tags\":[\"Instruction Design\",\"Categorization\",\"Prompt Engineering\"]}", "cost_usd": 0.0031103, "bootstrap_seed": 0, "agent_model": "gemini-3.1-pro-preview", "held_out_score": null, "criterion_names": ["correct_category", "concise_output", "follows_format", "no_hallucination", "handles_ambiguity"], "per_criterion_scores": {"correct_category": 0.1, "concise_output": 1.0, "follows_format": 0.1, "no_hallucination": 0.2, "handles_ambiguity": 1.0}, "failure_classification": null, "drafts_generated": 1, "drafts_survived": 1}
