{"id": "9261fbe9-724b-4e34-a3a7-4c0341f172ca", "target_id": "B1-control", "git_sha": "167a0c567f052f72925aec833b78311ec778b25b", "pre_experiment_sha": "167a0c567f052f72925aec833b78311ec778b25b", "timestamp": "2026-04-19T01:33:05.317517+00:00", "hypothesis": "A sharper imperative using \u201conly\u201d and \u201csingle best-matching\u201d will reduce logic errors while preserving strict label-only output.", "hypothesis_source": "agent", "mutation_diff_summary": "", "score": 3.0, "score_ci_lower": 2.4, "score_ci_upper": 3.6, "raw_scores": [4.0, 3.0, 2.0, 3.0, 3.0], "baseline_score": 3.3, "outcome": "DISCARDED", "failure_mode": null, "duration_seconds": 10.769454208086245, "tags": ["imperative", "minimalism", "tie-break", "single-label", "logic-error"], "learnings": "{\"what_changed\":\"\",\"what_improved\":[],\"what_regressed\":[\"correct_category: FAIL (was PASS)\"],\"transferable_insight\":\"Adding stronger constraints can backfire if they narrow interpretation too much, causing the system to miss the intended category even when output format remains correct.\",\"domain_tags\":[\"prompt-design\",\"classification\",\"instruction-following\"]}", "cost_usd": 0.015867950000000002, "bootstrap_seed": 0, "agent_model": "gpt-5.4", "held_out_score": null, "criterion_names": ["correct_category", "concise_output", "follows_format", "no_hallucination", "handles_ambiguity"], "per_criterion_scores": {"correct_category": 0.4, "concise_output": 1.0, "follows_format": 0.0, "no_hallucination": 0.7, "handles_ambiguity": 0.9}, "failure_classification": {"category": "incomplete_edit", "description": "The failure mode is unspecified (labeled 'unknown') and the score provides no clear signal of a specific logic, formatting, or syntax issue. This suggests the experiment likely produced an inconsistent or partially updated state rather than a fully correct implementation.", "fix_direction": "Identify which acceptance criteria were violated (format vs reasoning vs interpretation), then ensure the full intended change is applied consistently across both prompt and any evaluation/label handling logic.", "confidence": 0.35}, "drafts_generated": 1, "drafts_survived": 1}
