{"id": "1d2711d4-5842-43e4-9daf-99aa696da2cb", "target_id": "B1-control", "git_sha": "55ddfadd30a5e013e865b99fd82e6c1964fd94cf", "pre_experiment_sha": "512822fff536ed7e02ca5c7b6f86849d9b55d32b", "timestamp": "2026-04-19T01:26:38.899190+00:00", "hypothesis": "Tightening the instruction hierarchy and adding explicit fallback and tie-break rules will improve single-label compliance.", "hypothesis_source": "agent", "mutation_diff_summary": "", "score": 2.8, "score_ci_lower": 2.6, "score_ci_upper": 3.0, "raw_scores": [2.5, 3.0, 3.0, 3.0, 2.5], "baseline_score": 3.1, "outcome": "KEPT", "failure_mode": null, "duration_seconds": 16.59346745791845, "tags": ["single-label", "strict-output", "tie-break", "fallback"], "learnings": "{\"what_changed\":\"\",\"what_improved\":[],\"what_regressed\":[],\"transferable_insight\":\"When instructions are made more explicit about priority, fallback behavior, and tie-breaking, compliance can improve by reducing ambiguity even if no specific subcomponent changes are individually measurable.\",\"domain_tags\":[\"instruction-design\",\"decision-making\",\"ambiguity-reduction\"]}", "cost_usd": 0.00900255, "bootstrap_seed": 0, "agent_model": "gpt-5.4", "held_out_score": null, "criterion_names": ["correct_category", "concise_output", "follows_format", "no_hallucination", "handles_ambiguity"], "per_criterion_scores": {"correct_category": 0.5, "concise_output": 1.0, "follows_format": 0.0, "no_hallucination": 0.4, "handles_ambiguity": 0.9}, "failure_classification": null, "drafts_generated": 1, "drafts_survived": 1}
{"id": "3651e467-cdd5-4c60-8212-2b76e8ffed8d", "target_id": "B1-control", "git_sha": "9570679c858d7b98a2f87206e9f67869abcdb9b1", "pre_experiment_sha": "55ddfadd30a5e013e865b99fd82e6c1964fd94cf", "timestamp": "2026-04-19T01:26:56.618170+00:00", "hypothesis": "Sharper output and tie-breaking rules will improve single-label compliance and deterministic category selection.", "hypothesis_source": "agent", "mutation_diff_summary": "", "score": 2.9, "score_ci_lower": 2.6, "score_ci_upper": 3.2, "raw_scores": [3.5, 3.0, 2.5, 2.5, 3.0], "baseline_score": 2.8, "outcome": "KEPT", "failure_mode": null, "duration_seconds": 15.586978750070557, "tags": ["classification", "single-label", "determinism", "output-constraint"], "learnings": "{\"what_changed\":\"\",\"what_improved\":[],\"what_regressed\":[],\"transferable_insight\":\"When outputs must choose exactly one option, making the selection criteria and tie-breaking rules explicit improves consistency and reduces ambiguity.\",\"domain_tags\":[\"decision-making\",\"classification\",\"prompt-design\"]}", "cost_usd": 0.00916255, "bootstrap_seed": 0, "agent_model": "gpt-5.4", "held_out_score": null, "criterion_names": ["correct_category", "concise_output", "follows_format", "no_hallucination", "handles_ambiguity"], "per_criterion_scores": {"correct_category": 0.5, "concise_output": 1.0, "follows_format": 0.0, "no_hallucination": 0.6, "handles_ambiguity": 0.8}, "failure_classification": null, "drafts_generated": 1, "drafts_survived": 1}
{"id": "7700b736-9346-4cb5-97d9-fac269451524", "target_id": "B1-control", "git_sha": "bbb372abe3b9fdf97757dee5768f4fd0ea666d35", "pre_experiment_sha": "9570679c858d7b98a2f87206e9f67869abcdb9b1", "timestamp": "2026-04-19T01:27:10.622431+00:00", "hypothesis": "Tightening the prompt to a concise imperative with explicit tie-breaking and no-meta-output rules will improve single-label compliance.", "hypothesis_source": "agent", "mutation_diff_summary": "", "score": 3.3, "score_ci_lower": 3.1, "score_ci_upper": 3.5, "raw_scores": [3.5, 3.0, 3.5, 3.5, 3.0], "baseline_score": 2.9, "outcome": "KEPT", "failure_mode": null, "duration_seconds": 12.93262775009498, "tags": ["concise", "single-label", "deterministic", "format-control"], "learnings": "{\"what_changed\":\"\",\"what_improved\":[],\"what_regressed\":[],\"transferable_insight\":\"Clear, concise instructions with explicit conflict resolution and output constraints improve adherence to a single required format or choice.\",\"domain_tags\":[\"prompt-engineering\",\"instruction-following\",\"output-formatting\"]}", "cost_usd": 0.00873755, "bootstrap_seed": 0, "agent_model": "gpt-5.4", "held_out_score": null, "criterion_names": ["correct_category", "concise_output", "follows_format", "no_hallucination", "handles_ambiguity"], "per_criterion_scores": {"correct_category": 0.6, "concise_output": 1.0, "follows_format": 0.0, "no_hallucination": 0.7, "handles_ambiguity": 1.0}, "failure_classification": null, "drafts_generated": 1, "drafts_survived": 1}
{"id": "6b277346-4f6d-44bb-b229-0a2c96428c7b", "target_id": "B1-control", "git_sha": "32c53904da8a44de91d45d4f5795d5322f58d0f3", "pre_experiment_sha": "bbb372abe3b9fdf97757dee5768f4fd0ea666d35", "timestamp": "2026-04-19T01:27:25.514790+00:00", "hypothesis": "Stricter, simpler output rules and explicit tie-breaking will improve single-label compliance.", "hypothesis_source": "agent", "mutation_diff_summary": "", "score": 2.8, "score_ci_lower": 2.4, "score_ci_upper": 3.0, "raw_scores": [3.0, 2.0, 3.0, 3.0, 3.0], "baseline_score": 3.3, "outcome": "KEPT", "failure_mode": null, "duration_seconds": 13.795372249907814, "tags": ["classification", "format-control", "concise"], "learnings": "{\"what_changed\":\"\",\"what_improved\":[],\"what_regressed\":[],\"transferable_insight\":\"When outputs must satisfy a single clear constraint, simplifying the rules and specifying how to resolve ambiguities can improve compliance even if no other metrics change.\",\"domain_tags\":[\"decision-making\",\"instruction-design\",\"quality-control\"]}", "cost_usd": 0.008592550000000001, "bootstrap_seed": 0, "agent_model": "gpt-5.4", "held_out_score": null, "criterion_names": ["correct_category", "concise_output", "follows_format", "no_hallucination", "handles_ambiguity"], "per_criterion_scores": {"correct_category": 0.4, "concise_output": 1.0, "follows_format": 0.0, "no_hallucination": 0.5, "handles_ambiguity": 0.9}, "failure_classification": null, "drafts_generated": 1, "drafts_survived": 1}
{"id": "3f921090-b9ac-41e8-b270-908644679259", "target_id": "B1-control", "git_sha": "0893964b33baa5656b1f0d57f3ad2230142565c1", "pre_experiment_sha": "32c53904da8a44de91d45d4f5795d5322f58d0f3", "timestamp": "2026-04-19T01:27:43.765677+00:00", "hypothesis": "Make the classifier stricter and more deterministic by emphasizing exact single-label output, tie-breaking, and fallback behavior.", "hypothesis_source": "agent", "mutation_diff_summary": "", "score": 3.0, "score_ci_lower": 2.7, "score_ci_upper": 3.3, "raw_scores": [2.5, 3.0, 3.0, 3.5, 3.0], "baseline_score": 2.8, "outcome": "KEPT", "failure_mode": null, "duration_seconds": 16.08698312495835, "tags": ["single-label", "determinism", "formatting", "fallback"], "learnings": "{\"what_changed\":\"\",\"what_improved\":[],\"what_regressed\":[],\"transferable_insight\":\"When a decision system must choose one outcome, explicitly enforcing a single output with deterministic tie-breaking and a clear fallback can improve consistency and reliability.\",\"domain_tags\":[\"decision-systems\",\"classification\",\"determinism\"]}", "cost_usd": 0.010412550000000001, "bootstrap_seed": 0, "agent_model": "gpt-5.4", "held_out_score": null, "criterion_names": ["correct_category", "concise_output", "follows_format", "no_hallucination", "handles_ambiguity"], "per_criterion_scores": {"correct_category": 0.4, "concise_output": 1.0, "follows_format": 0.0, "no_hallucination": 0.7, "handles_ambiguity": 0.9}, "failure_classification": null, "drafts_generated": 1, "drafts_survived": 1}
{"id": "77d6bb98-a890-45e6-a708-c30e9fce8944", "target_id": "B1-control", "git_sha": "7f3fa66490f65b689701b59191e33c5f1d018cfb", "pre_experiment_sha": "0893964b33baa5656b1f0d57f3ad2230142565c1", "timestamp": "2026-04-19T01:28:02.491169+00:00", "hypothesis": "Stronger priority rules and stricter failure-mode handling will improve exact single-label compliance.", "hypothesis_source": "agent", "mutation_diff_summary": "", "score": 2.9, "score_ci_lower": 2.4, "score_ci_upper": 3.4, "raw_scores": [3.5, 2.0, 3.5, 2.5, 3.0], "baseline_score": 3.0, "outcome": "KEPT", "failure_mode": null, "duration_seconds": 17.649059749906883, "tags": ["classification", "strict-output", "tie-breaking"], "learnings": "{\"what_changed\":\"\",\"what_improved\":[],\"what_regressed\":[],\"transferable_insight\":\"Tightening decision priorities and failure handling can improve consistency, but if the baseline is already stable, the main effect may be negligible rather than clearly positive.\",\"domain_tags\":[\"decision-making\",\"reliability\",\"process-control\"]}", "cost_usd": 0.01149755, "bootstrap_seed": 0, "agent_model": "gpt-5.4", "held_out_score": null, "criterion_names": ["correct_category", "concise_output", "follows_format", "no_hallucination", "handles_ambiguity"], "per_criterion_scores": {"correct_category": 0.3, "concise_output": 1.0, "follows_format": 0.0, "no_hallucination": 0.7, "handles_ambiguity": 0.9}, "failure_classification": null, "drafts_generated": 1, "drafts_survived": 1}
{"id": "a5a3630f-6155-4943-a352-d6c0bb88c8a7", "target_id": "B1-control", "git_sha": "4c0a02a24022911a8f1ecd214ad54ccb23b1973c", "pre_experiment_sha": "7f3fa66490f65b689701b59191e33c5f1d018cfb", "timestamp": "2026-04-19T01:28:20.808065+00:00", "hypothesis": "Strengthening tie-breaking and input-priority instructions will improve single-label compliance.", "hypothesis_source": "agent", "mutation_diff_summary": "", "score": 3.3, "score_ci_lower": 3.1, "score_ci_upper": 3.5, "raw_scores": [3.5, 3.0, 3.5, 3.5, 3.0], "baseline_score": 2.9, "outcome": "KEPT", "failure_mode": null, "duration_seconds": 17.073798166005872, "tags": ["classification", "strict-output", "tie-breaking"], "learnings": "{\"what_changed\":\"\",\"what_improved\":[],\"what_regressed\":[],\"transferable_insight\":\"When a task has a single required output, explicitly prioritizing tie-breakers and input-order rules can improve compliance by reducing ambiguity in the decision process.\",\"domain_tags\":[\"instruction-following\",\"decision-making\",\"prompt-design\"]}", "cost_usd": 0.012907550000000002, "bootstrap_seed": 0, "agent_model": "gpt-5.4", "held_out_score": null, "criterion_names": ["correct_category", "concise_output", "follows_format", "no_hallucination", "handles_ambiguity"], "per_criterion_scores": {"correct_category": 0.7, "concise_output": 1.0, "follows_format": 0.0, "no_hallucination": 0.6, "handles_ambiguity": 1.0}, "failure_classification": null, "drafts_generated": 1, "drafts_survived": 1}
{"id": "03463da5-5551-4d2e-a4ad-ef8cc217a879", "target_id": "B1-control", "git_sha": "78d45e5c64c338959c654ee66b4270b5b4196126", "pre_experiment_sha": "4c0a02a24022911a8f1ecd214ad54ccb23b1973c", "timestamp": "2026-04-19T01:28:42.629497+00:00", "hypothesis": "Strengthen determinism and adversarial resistance by adding an explicit internal procedure and failure-mode guards while preserving one-label-only output.", "hypothesis_source": "agent", "mutation_diff_summary": "", "score": 3.1, "score_ci_lower": 2.8, "score_ci_upper": 3.4, "raw_scores": [3.5, 3.0, 3.0, 2.5, 3.5], "baseline_score": 3.3, "outcome": "KEPT", "failure_mode": null, "duration_seconds": 19.60415983304847, "tags": ["determinism", "strictness", "tie-break", "injection-resistance"], "learnings": "{\"what_changed\":\"\",\"what_improved\":[],\"what_regressed\":[],\"transferable_insight\":\"Adding explicit internal procedures and guardrails can improve robustness and determinism without changing the external output contract.\",\"domain_tags\":[\"robustness\",\"reliability\",\"process-design\"]}", "cost_usd": 0.01566255, "bootstrap_seed": 0, "agent_model": "gpt-5.4", "held_out_score": null, "criterion_names": ["correct_category", "concise_output", "follows_format", "no_hallucination", "handles_ambiguity"], "per_criterion_scores": {"correct_category": 0.4, "concise_output": 1.0, "follows_format": 0.0, "no_hallucination": 0.7, "handles_ambiguity": 1.0}, "failure_classification": null, "drafts_generated": 1, "drafts_survived": 1}
{"id": "e8355af6-8467-4a20-abb6-8d677bed2b68", "target_id": "B1-control", "git_sha": "44fa78b1f06a99278b743e7cd6e1a6bbed04049c", "pre_experiment_sha": "78d45e5c64c338959c654ee66b4270b5b4196126", "timestamp": "2026-04-19T01:28:59.854530+00:00", "hypothesis": "Make the prompt ultra-minimal and imperative so the model emits only a single allowed label with no formatting errors.", "hypothesis_source": "agent", "mutation_diff_summary": "", "score": 2.9, "score_ci_lower": 2.7, "score_ci_upper": 3.0, "raw_scores": [3.0, 3.0, 2.5, 3.0, 3.0], "baseline_score": 3.1, "outcome": "KEPT", "failure_mode": null, "duration_seconds": 16.28819474996999, "tags": ["format-control", "minimalism", "single-label"], "learnings": "{\"what_changed\":\"\",\"what_improved\":[],\"what_regressed\":[],\"transferable_insight\":\"When the desired output is a constrained label, reducing instructions to a minimal imperative form can improve compliance by limiting opportunities for formatting drift.\",\"domain_tags\":[\"prompt-engineering\",\"instruction-following\",\"output-formatting\"]}", "cost_usd": 0.018707550000000003, "bootstrap_seed": 0, "agent_model": "gpt-5.4", "held_out_score": null, "criterion_names": ["correct_category", "concise_output", "follows_format", "no_hallucination", "handles_ambiguity"], "per_criterion_scores": {"correct_category": 0.3, "concise_output": 1.0, "follows_format": 0.0, "no_hallucination": 0.6, "handles_ambiguity": 1.0}, "failure_classification": null, "drafts_generated": 1, "drafts_survived": 1}
{"id": "cd62b4d3-70df-4fde-af9c-2b6e89b59fd3", "target_id": "B1-control", "git_sha": "f7832c5f6eaa4200ee7cd877480b2a0d13df0d79", "pre_experiment_sha": "44fa78b1f06a99278b743e7cd6e1a6bbed04049c", "timestamp": "2026-04-19T01:29:14.290402+00:00", "hypothesis": "Add a stronger end-condition and deterministic decision rule to improve exact label-only compliance without sacrificing classification accuracy.", "hypothesis_source": "agent", "mutation_diff_summary": "", "score": 2.8, "score_ci_lower": 2.3, "score_ci_upper": 3.2, "raw_scores": [3.5, 2.5, 2.0, 3.0, 3.0], "baseline_score": 2.9, "outcome": "KEPT", "failure_mode": null, "duration_seconds": 13.366707667009905, "tags": ["single-label", "determinism", "tie-break", "output-constraint"], "learnings": "{\"what_changed\":\"\",\"what_improved\":[],\"what_regressed\":[],\"transferable_insight\":\"When optimizing for strict output compliance, adding a clear stopping criterion and deterministic decision rule can improve adherence without necessarily changing task accuracy.\",\"domain_tags\":[\"control-systems\",\"decision-making\",\"evaluation\"]}", "cost_usd": 0.018128350000000005, "bootstrap_seed": 0, "agent_model": "gpt-5.4", "held_out_score": null, "criterion_names": ["correct_category", "concise_output", "follows_format", "no_hallucination", "handles_ambiguity"], "per_criterion_scores": {"correct_category": 0.4, "concise_output": 0.8, "follows_format": 0.0, "no_hallucination": 0.7, "handles_ambiguity": 0.9}, "failure_classification": null, "drafts_generated": 1, "drafts_survived": 1}
{"id": "a23b91e6-88b7-4d38-896b-74d0686ff66c", "target_id": "B1-control", "git_sha": "90ac1d56f329bdad6910c221b3a1424355d78918", "pre_experiment_sha": "f7832c5f6eaa4200ee7cd877480b2a0d13df0d79", "timestamp": "2026-04-19T01:29:29.676213+00:00", "hypothesis": "A shorter imperative prompt with a single deterministic tie-break rule will improve exact one-label output.", "hypothesis_source": "agent", "mutation_diff_summary": "", "score": 3.0, "score_ci_lower": 2.6, "score_ci_upper": 3.4, "raw_scores": [3.0, 2.5, 3.5, 3.5, 2.5], "baseline_score": 2.8, "outcome": "KEPT", "failure_mode": null, "duration_seconds": 12.27195004094392, "tags": ["minimalism", "classification", "tie-break", "format-control"], "learnings": "{\"what_changed\":\"\",\"what_improved\":[],\"what_regressed\":[],\"transferable_insight\":\"When a task requires a single exact output, concise instructions paired with one explicit tie-break rule can reduce ambiguity and improve compliance.\",\"domain_tags\":[\"prompting\",\"decision-making\",\"instruction-design\"]}", "cost_usd": 0.01581255, "bootstrap_seed": 0, "agent_model": "gpt-5.4", "held_out_score": null, "criterion_names": ["correct_category", "concise_output", "follows_format", "no_hallucination", "handles_ambiguity"], "per_criterion_scores": {"correct_category": 0.4, "concise_output": 1.0, "follows_format": 0.0, "no_hallucination": 0.6, "handles_ambiguity": 1.0}, "failure_classification": null, "drafts_generated": 1, "drafts_survived": 1}
{"id": "36c75e05-04b0-4e34-be6d-244c26e55088", "target_id": "B1-control", "git_sha": "d1c1f0c4486589d3ba098d6158a1c53624fa1631", "pre_experiment_sha": "90ac1d56f329bdad6910c221b3a1424355d78918", "timestamp": "2026-04-19T01:29:43.134440+00:00", "hypothesis": "A shorter, stricter prompt that forbids any non-label output and preserves a deterministic tie-break will improve exact format compliance.", "hypothesis_source": "agent", "mutation_diff_summary": "", "score": 2.9, "score_ci_lower": 2.7, "score_ci_upper": 3.0, "raw_scores": [3.0, 2.5, 3.0, 3.0, 3.0], "baseline_score": 3.0, "outcome": "KEPT", "failure_mode": null, "duration_seconds": 12.458867292036302, "tags": ["minimalism", "strict-output", "tie-break"], "learnings": "{\"what_changed\":\"\",\"what_improved\":[],\"what_regressed\":[],\"transferable_insight\":\"When the task requires a rigid output format, reducing prompt ambiguity and explicitly constraining all nonessential output can improve compliance even if the measured quality change is small.\",\"domain_tags\":[\"prompt-engineering\",\"format-compliance\",\"experimental-design\"]}", "cost_usd": 0.015082550000000002, "bootstrap_seed": 0, "agent_model": "gpt-5.4", "held_out_score": null, "criterion_names": ["correct_category", "concise_output", "follows_format", "no_hallucination", "handles_ambiguity"], "per_criterion_scores": {"correct_category": 0.4, "concise_output": 1.0, "follows_format": 0.0, "no_hallucination": 0.5, "handles_ambiguity": 1.0}, "failure_classification": null, "drafts_generated": 1, "drafts_survived": 1}
{"id": "f6e6d2eb-8903-431b-9835-f10fd5f47a4b", "target_id": "B1-control", "git_sha": "d1c1f0c4486589d3ba098d6158a1c53624fa1631", "pre_experiment_sha": "d1c1f0c4486589d3ba098d6158a1c53624fa1631", "timestamp": "2026-04-19T01:29:56.189733+00:00", "hypothesis": "A single imperative sentence emphasizing exact one-label output and deterministic tie-breaking will improve format compliance.", "hypothesis_source": "agent", "mutation_diff_summary": "", "score": 2.5, "score_ci_lower": 2.2, "score_ci_upper": 2.8, "raw_scores": [2.5, 2.5, 2.0, 2.5, 3.0], "baseline_score": 2.9, "outcome": "DISCARDED", "failure_mode": null, "duration_seconds": 11.740138499997556, "tags": ["minimalism", "format-control", "tie-break"], "learnings": "{\"what_changed\":\"\",\"what_improved\":[\"correct_category: PASS (was FAIL)\"],\"what_regressed\":[\"no_hallucination: FAIL (was PASS)\"],\"transferable_insight\":\"Making output constraints more explicit can improve adherence to the requested format, but overly rigid instructions may also increase the risk of unsupported additions or hallucinations.\",\"domain_tags\":[\"prompting\",\"instruction-following\",\"output-formatting\"]}", "cost_usd": 0.014895750000000001, "bootstrap_seed": 0, "agent_model": "gpt-5.4", "held_out_score": null, "criterion_names": ["correct_category", "concise_output", "follows_format", "no_hallucination", "handles_ambiguity"], "per_criterion_scores": {"correct_category": 0.5, "concise_output": 0.9, "follows_format": 0.0, "no_hallucination": 0.3, "handles_ambiguity": 0.8}, "failure_classification": {"category": "logic_error", "description": "Failure mode is unspecified ('unknown'), and no concrete format/syntax/logic/semantic/regression details are provided\u2014only a low score (2.5).", "fix_direction": "Re-run with captured error traces or validation feedback (e.g., schema checks, parsing errors, or diff of expected vs actual output) to identify whether the issue is format compliance, incorrect meaning, or unintended edits; then constrain the generation to a single, exact output schema with deterministic tie-breaking if applicable.", "confidence": 0.12}, "drafts_generated": 1, "drafts_survived": 1}
