{"id": "a6d25ec9-523f-4667-842c-0a1991f1db59", "target_id": "B1-control", "git_sha": "ddcfbef2e7da6e96561200fd6437772b5d7d54eb", "pre_experiment_sha": "81d2d3f80ead9874d51d74e09fc73938b364e1e6", "timestamp": "2026-04-05T20:43:32.125221+00:00", "hypothesis": "No hypothesis provided", "hypothesis_source": "synthesized", "mutation_diff_summary": "", "score": 3.6, "score_ci_lower": 3.3, "score_ci_upper": 3.9, "raw_scores": [3.5, 4.0, 3.0, 3.5, 4.0], "baseline_score": 3.5, "outcome": "KEPT", "failure_mode": null, "duration_seconds": 92.7492747080978, "tags": [], "learnings": "{\"what_changed\":\"\",\"what_improved\":[],\"what_regressed\":[],\"transferable_insight\":\"No hypothesis provided\",\"domain_tags\":[]}", "cost_usd": 0.2288934, "bootstrap_seed": 0, "agent_model": "claude-sonnet-4-6", "held_out_score": null, "criterion_names": ["correct_category", "concise_output", "follows_format", "no_hallucination", "handles_ambiguity"], "per_criterion_scores": {"correct_category": 1.0, "concise_output": 1.0, "follows_format": 0.0, "no_hallucination": 0.8, "handles_ambiguity": 0.8}, "failure_classification": null, "drafts_generated": 1, "drafts_survived": 1}
{"id": "50e4d7c0-96d3-4740-afc5-02770fb069fa", "target_id": "B1-control", "git_sha": "2e5b88852d88202c3daeb08d96c34b82bbbe67e0", "pre_experiment_sha": "ddcfbef2e7da6e96561200fd6437772b5d7d54eb", "timestamp": "2026-04-05T20:44:48.097286+00:00", "hypothesis": "No hypothesis provided", "hypothesis_source": "synthesized", "mutation_diff_summary": "", "score": 3.6, "score_ci_lower": 3.0, "score_ci_upper": 4.0, "raw_scores": [3.5, 4.0, 4.0, 2.5, 4.0], "baseline_score": 3.6, "outcome": "KEPT", "failure_mode": null, "duration_seconds": 75.55228487495333, "tags": [], "learnings": "{\"what_changed\":\"\",\"what_improved\":[],\"what_regressed\":[],\"transferable_insight\":\"No hypothesis provided\",\"domain_tags\":[]}", "cost_usd": 0.18012075000000002, "bootstrap_seed": 0, "agent_model": "claude-sonnet-4-6", "held_out_score": null, "criterion_names": ["correct_category", "concise_output", "follows_format", "no_hallucination", "handles_ambiguity"], "per_criterion_scores": {"correct_category": 1.0, "concise_output": 1.0, "follows_format": 0.0, "no_hallucination": 0.7, "handles_ambiguity": 0.9}, "failure_classification": null, "drafts_generated": 1, "drafts_survived": 1}
{"id": "c3bd239d-15a6-4d0f-8735-816363cd7099", "target_id": "B1-control", "git_sha": "2b4d9f6e046a62ed9507a0c95567815e68766e07", "pre_experiment_sha": "2e5b88852d88202c3daeb08d96c34b82bbbe67e0", "timestamp": "2026-04-05T20:46:14.477069+00:00", "hypothesis": "No hypothesis provided", "hypothesis_source": "synthesized", "mutation_diff_summary": "", "score": 3.6, "score_ci_lower": 3.2, "score_ci_upper": 4.0, "raw_scores": [4.0, 4.0, 3.0, 3.0, 4.0], "baseline_score": 3.6, "outcome": "KEPT", "failure_mode": null, "duration_seconds": 85.94207866699435, "tags": [], "learnings": "{\"what_changed\":\"\",\"what_improved\":[],\"what_regressed\":[],\"transferable_insight\":\"No hypothesis provided\",\"domain_tags\":[]}", "cost_usd": 0.1800288, "bootstrap_seed": 0, "agent_model": "claude-sonnet-4-6", "held_out_score": null, "criterion_names": ["correct_category", "concise_output", "follows_format", "no_hallucination", "handles_ambiguity"], "per_criterion_scores": {"correct_category": 1.0, "concise_output": 1.0, "follows_format": 0.0, "no_hallucination": 0.8, "handles_ambiguity": 0.8}, "failure_classification": null, "drafts_generated": 1, "drafts_survived": 1}
{"id": "593c4c18-975e-4394-82c5-7d81f5e9f79b", "target_id": "B1-control", "git_sha": "fcb44a9656b6688f1964e5027c95ba6231fb9257", "pre_experiment_sha": "2b4d9f6e046a62ed9507a0c95567815e68766e07", "timestamp": "2026-04-05T20:47:39.780883+00:00", "hypothesis": "No hypothesis provided", "hypothesis_source": "synthesized", "mutation_diff_summary": "", "score": 3.4, "score_ci_lower": 3.0, "score_ci_upper": 3.8, "raw_scores": [4.0, 4.0, 3.0, 3.0, 3.0], "baseline_score": 3.6, "outcome": "KEPT", "failure_mode": null, "duration_seconds": 84.8269037080463, "tags": [], "learnings": "{\"what_changed\":\"\",\"what_improved\":[],\"what_regressed\":[],\"transferable_insight\":\"No hypothesis provided\",\"domain_tags\":[]}", "cost_usd": 0.19219664999999997, "bootstrap_seed": 0, "agent_model": "claude-sonnet-4-6", "held_out_score": null, "criterion_names": ["correct_category", "concise_output", "follows_format", "no_hallucination", "handles_ambiguity"], "per_criterion_scores": {"correct_category": 1.0, "concise_output": 1.0, "follows_format": 0.0, "no_hallucination": 0.7, "handles_ambiguity": 0.7}, "failure_classification": null, "drafts_generated": 1, "drafts_survived": 1}
{"id": "26300bc2-f07e-4290-8c12-cf5f90a0cc38", "target_id": "B1-control", "git_sha": "6943bf557af22da7a288ca6581e1a8a93b4ef6dd", "pre_experiment_sha": "fcb44a9656b6688f1964e5027c95ba6231fb9257", "timestamp": "2026-04-05T20:48:37.024515+00:00", "hypothesis": "No hypothesis provided", "hypothesis_source": "synthesized", "mutation_diff_summary": "", "score": 3.3, "score_ci_lower": 2.9, "score_ci_upper": 3.7, "raw_scores": [3.5, 4.0, 2.5, 3.0, 3.5], "baseline_score": 3.4, "outcome": "KEPT", "failure_mode": null, "duration_seconds": 56.71978645818308, "tags": [], "learnings": "{\"what_changed\":\"\",\"what_improved\":[],\"what_regressed\":[],\"transferable_insight\":\"No hypothesis provided\",\"domain_tags\":[]}", "cost_usd": 0.14551619999999998, "bootstrap_seed": 0, "agent_model": "claude-sonnet-4-6", "held_out_score": null, "criterion_names": ["correct_category", "concise_output", "follows_format", "no_hallucination", "handles_ambiguity"], "per_criterion_scores": {"correct_category": 1.0, "concise_output": 1.0, "follows_format": 0.0, "no_hallucination": 0.7, "handles_ambiguity": 0.6}, "failure_classification": null, "drafts_generated": 1, "drafts_survived": 1}
{"id": "c55ec4d9-a5f6-40ae-987d-0767abcaf2e8", "target_id": "B1-control", "git_sha": "ca67fc9a58714ca712642c561a212ddbcedf7c1f", "pre_experiment_sha": "6943bf557af22da7a288ca6581e1a8a93b4ef6dd", "timestamp": "2026-04-05T20:50:15.737103+00:00", "hypothesis": "No hypothesis provided", "hypothesis_source": "synthesized", "mutation_diff_summary": "", "score": 3.6, "score_ci_lower": 3.0, "score_ci_upper": 4.0, "raw_scores": [4.0, 4.0, 2.5, 3.5, 4.0], "baseline_score": 3.3, "outcome": "KEPT", "failure_mode": null, "duration_seconds": 98.29272283311002, "tags": [], "learnings": "{\"what_changed\":\"\",\"what_improved\":[],\"what_regressed\":[],\"transferable_insight\":\"No hypothesis provided\",\"domain_tags\":[]}", "cost_usd": 0.23513654999999997, "bootstrap_seed": 0, "agent_model": "claude-sonnet-4-6", "held_out_score": null, "criterion_names": ["correct_category", "concise_output", "follows_format", "no_hallucination", "handles_ambiguity"], "per_criterion_scores": {"correct_category": 1.0, "concise_output": 1.0, "follows_format": 0.0, "no_hallucination": 0.8, "handles_ambiguity": 0.8}, "failure_classification": null, "drafts_generated": 1, "drafts_survived": 1}
{"id": "57e52205-be02-412d-81e1-50bd17a6db39", "target_id": "B1-control", "git_sha": "b6ff928fe09ccc52907bfd6797b0cbbf3a0d7a0b", "pre_experiment_sha": "ca67fc9a58714ca712642c561a212ddbcedf7c1f", "timestamp": "2026-04-05T20:51:04.461117+00:00", "hypothesis": "No hypothesis provided", "hypothesis_source": "synthesized", "mutation_diff_summary": "", "score": 3.6, "score_ci_lower": 3.2, "score_ci_upper": 4.0, "raw_scores": [4.0, 4.0, 3.0, 3.0, 4.0], "baseline_score": 3.6, "outcome": "KEPT", "failure_mode": null, "duration_seconds": 48.28639970906079, "tags": [], "learnings": "{\"what_changed\":\"\",\"what_improved\":[],\"what_regressed\":[],\"transferable_insight\":\"No hypothesis provided\",\"domain_tags\":[]}", "cost_usd": 0.12473519999999999, "bootstrap_seed": 0, "agent_model": "claude-sonnet-4-6", "held_out_score": null, "criterion_names": ["correct_category", "concise_output", "follows_format", "no_hallucination", "handles_ambiguity"], "per_criterion_scores": {"correct_category": 1.0, "concise_output": 1.0, "follows_format": 0.0, "no_hallucination": 0.8, "handles_ambiguity": 0.8}, "failure_classification": null, "drafts_generated": 1, "drafts_survived": 1}
{"id": "2c608fd5-db9f-4402-a7a8-0bc804cc49fc", "target_id": "B1-control", "git_sha": "40e7bb2de78817ee0d664a03ad52fd7db579137d", "pre_experiment_sha": "b6ff928fe09ccc52907bfd6797b0cbbf3a0d7a0b", "timestamp": "2026-04-05T20:52:23.355068+00:00", "hypothesis": "No hypothesis provided", "hypothesis_source": "synthesized", "mutation_diff_summary": "", "score": 3.3, "score_ci_lower": 3.0, "score_ci_upper": 3.7, "raw_scores": [3.5, 4.0, 3.0, 3.0, 3.0], "baseline_score": 3.6, "outcome": "KEPT", "failure_mode": null, "duration_seconds": 78.44558104220778, "tags": [], "learnings": "{\"what_changed\":\"\",\"what_improved\":[],\"what_regressed\":[],\"transferable_insight\":\"No hypothesis provided\",\"domain_tags\":[]}", "cost_usd": 0.1828812, "bootstrap_seed": 0, "agent_model": "claude-sonnet-4-6", "held_out_score": null, "criterion_names": ["correct_category", "concise_output", "follows_format", "no_hallucination", "handles_ambiguity"], "per_criterion_scores": {"correct_category": 1.0, "concise_output": 1.0, "follows_format": 0.0, "no_hallucination": 0.8, "handles_ambiguity": 0.5}, "failure_classification": null, "drafts_generated": 1, "drafts_survived": 1}
{"id": "1371632e-47ac-4087-8e96-9332ed5c6457", "target_id": "B1-control", "git_sha": "37ca3ce60249303d04e73e8ccfccda55516c67fd", "pre_experiment_sha": "40e7bb2de78817ee0d664a03ad52fd7db579137d", "timestamp": "2026-04-05T20:54:07.899849+00:00", "hypothesis": "No hypothesis provided", "hypothesis_source": "synthesized", "mutation_diff_summary": "", "score": 3.6, "score_ci_lower": 3.3, "score_ci_upper": 3.9, "raw_scores": [4.0, 4.0, 3.0, 3.5, 3.5], "baseline_score": 3.3, "outcome": "KEPT", "failure_mode": null, "duration_seconds": 104.14117708383128, "tags": [], "learnings": "{\"what_changed\":\"\",\"what_improved\":[],\"what_regressed\":[],\"transferable_insight\":\"No hypothesis provided\",\"domain_tags\":[]}", "cost_usd": 0.218565, "bootstrap_seed": 0, "agent_model": "claude-sonnet-4-6", "held_out_score": null, "criterion_names": ["correct_category", "concise_output", "follows_format", "no_hallucination", "handles_ambiguity"], "per_criterion_scores": {"correct_category": 1.0, "concise_output": 1.0, "follows_format": 0.0, "no_hallucination": 0.9, "handles_ambiguity": 0.7}, "failure_classification": null, "drafts_generated": 1, "drafts_survived": 1}
{"id": "992ad2e7-62bf-4b4c-b0c1-91b974e498bd", "target_id": "B1-control", "git_sha": "ad8b18f788198885f553c374ca327de0a6f883bb", "pre_experiment_sha": "37ca3ce60249303d04e73e8ccfccda55516c67fd", "timestamp": "2026-04-05T20:55:12.855975+00:00", "hypothesis": "No hypothesis provided", "hypothesis_source": "synthesized", "mutation_diff_summary": "", "score": 3.3, "score_ci_lower": 2.8, "score_ci_upper": 3.7, "raw_scores": [3.5, 3.5, 3.0, 2.5, 4.0], "baseline_score": 3.6, "outcome": "KEPT", "failure_mode": null, "duration_seconds": 64.49746258393861, "tags": [], "learnings": "{\"what_changed\":\"\",\"what_improved\":[],\"what_regressed\":[],\"transferable_insight\":\"No hypothesis provided\",\"domain_tags\":[]}", "cost_usd": 0.15000795, "bootstrap_seed": 0, "agent_model": "claude-sonnet-4-6", "held_out_score": null, "criterion_names": ["correct_category", "concise_output", "follows_format", "no_hallucination", "handles_ambiguity"], "per_criterion_scores": {"correct_category": 1.0, "concise_output": 1.0, "follows_format": 0.0, "no_hallucination": 0.8, "handles_ambiguity": 0.5}, "failure_classification": null, "drafts_generated": 1, "drafts_survived": 1}
{"id": "5a50b976-d9b7-4918-af6c-c252f30e5e62", "target_id": "B1-control", "git_sha": "b0da75ea1851a94cba1ca3ca93d0871dedee46e2", "pre_experiment_sha": "ad8b18f788198885f553c374ca327de0a6f883bb", "timestamp": "2026-04-05T20:57:02.731529+00:00", "hypothesis": "No hypothesis provided", "hypothesis_source": "synthesized", "mutation_diff_summary": "", "score": 3.4, "score_ci_lower": 3.1, "score_ci_upper": 3.7, "raw_scores": [3.5, 4.0, 3.0, 3.0, 3.5], "baseline_score": 3.3, "outcome": "KEPT", "failure_mode": null, "duration_seconds": 109.18752645794302, "tags": [], "learnings": "{\"what_changed\":\"\",\"what_improved\":[],\"what_regressed\":[],\"transferable_insight\":\"No hypothesis provided\",\"domain_tags\":[]}", "cost_usd": 0.22011509999999995, "bootstrap_seed": 0, "agent_model": "claude-sonnet-4-6", "held_out_score": null, "criterion_names": ["correct_category", "concise_output", "follows_format", "no_hallucination", "handles_ambiguity"], "per_criterion_scores": {"correct_category": 1.0, "concise_output": 1.0, "follows_format": 0.0, "no_hallucination": 0.6, "handles_ambiguity": 0.8}, "failure_classification": null, "drafts_generated": 1, "drafts_survived": 1}
{"id": "cf126a60-a6af-43c3-aa42-202e517c7e9b", "target_id": "B1-control", "git_sha": "97ea06e8cae5c2cf84e3243a32373aa3d26f3573", "pre_experiment_sha": "b0da75ea1851a94cba1ca3ca93d0871dedee46e2", "timestamp": "2026-04-05T20:58:10.666033+00:00", "hypothesis": "No hypothesis provided", "hypothesis_source": "synthesized", "mutation_diff_summary": "", "score": 3.5, "score_ci_lower": 3.1, "score_ci_upper": 3.9, "raw_scores": [4.0, 4.0, 3.0, 3.0, 3.5], "baseline_score": 3.4, "outcome": "KEPT", "failure_mode": null, "duration_seconds": 67.19181362516247, "tags": [], "learnings": "{\"what_changed\":\"\",\"what_improved\":[],\"what_regressed\":[],\"transferable_insight\":\"No hypothesis provided\",\"domain_tags\":[]}", "cost_usd": 0.15307545, "bootstrap_seed": 0, "agent_model": "claude-sonnet-4-6", "held_out_score": null, "criterion_names": ["correct_category", "concise_output", "follows_format", "no_hallucination", "handles_ambiguity"], "per_criterion_scores": {"correct_category": 1.0, "concise_output": 1.0, "follows_format": 0.0, "no_hallucination": 0.7, "handles_ambiguity": 0.8}, "failure_classification": null, "drafts_generated": 1, "drafts_survived": 1}
{"id": "13176f52-3a14-4588-9fc0-e269c7daa2da", "target_id": "B1-control", "git_sha": "f1aad1c8ae8b163eca15acc881f50b340d49235b", "pre_experiment_sha": "97ea06e8cae5c2cf84e3243a32373aa3d26f3573", "timestamp": "2026-04-05T20:59:28.132613+00:00", "hypothesis": "No hypothesis provided", "hypothesis_source": "synthesized", "mutation_diff_summary": "", "score": 3.5, "score_ci_lower": 2.9, "score_ci_upper": 4.0, "raw_scores": [4.0, 4.0, 3.0, 2.5, 4.0], "baseline_score": 3.5, "outcome": "KEPT", "failure_mode": null, "duration_seconds": 76.98834100016393, "tags": [], "learnings": "{\"what_changed\":\"\",\"what_improved\":[],\"what_regressed\":[],\"transferable_insight\":\"No hypothesis provided\",\"domain_tags\":[]}", "cost_usd": 0.1726428, "bootstrap_seed": 0, "agent_model": "claude-sonnet-4-6", "held_out_score": null, "criterion_names": ["correct_category", "concise_output", "follows_format", "no_hallucination", "handles_ambiguity"], "per_criterion_scores": {"correct_category": 1.0, "concise_output": 1.0, "follows_format": 0.0, "no_hallucination": 0.8, "handles_ambiguity": 0.7}, "failure_classification": null, "drafts_generated": 1, "drafts_survived": 1}
{"id": "45f7c63a-4b2a-4a94-b1bc-3cd7c0dac172", "target_id": "B1-control", "git_sha": "f1aad1c8ae8b163eca15acc881f50b340d49235b", "pre_experiment_sha": "f1aad1c8ae8b163eca15acc881f50b340d49235b", "timestamp": "2026-04-05T21:00:34.079948+00:00", "hypothesis": "No hypothesis provided", "hypothesis_source": "synthesized", "mutation_diff_summary": "", "score": 3.2, "score_ci_lower": 2.8, "score_ci_upper": 3.7, "raw_scores": [3.5, 4.0, 2.5, 3.0, 3.0], "baseline_score": 3.5, "outcome": "DISCARDED", "failure_mode": null, "duration_seconds": 65.40865475009196, "tags": [], "learnings": "{\"what_changed\":\"\",\"what_improved\":[],\"what_regressed\":[],\"transferable_insight\":\"No hypothesis provided\",\"domain_tags\":[]}", "cost_usd": 0.16068524999999997, "bootstrap_seed": 0, "agent_model": "claude-sonnet-4-6", "held_out_score": null, "criterion_names": ["correct_category", "concise_output", "follows_format", "no_hallucination", "handles_ambiguity"], "per_criterion_scores": {"correct_category": 1.0, "concise_output": 1.0, "follows_format": 0.0, "no_hallucination": 0.6, "handles_ambiguity": 0.6}, "failure_classification": {"category": "output_format", "description": "The experiment failed due to a violation of the expected output structure or schema.", "fix_direction": "Ensure that generated outputs strictly adhere to the required output schema and structure.", "confidence": 0.85}, "drafts_generated": 1, "drafts_survived": 1}
{"id": "a0f64907-f8cf-46e1-831e-03b92404fb96", "target_id": "B1-control", "git_sha": "d04adb08de540d86c2fa477858e58fe240baaf15", "pre_experiment_sha": "f1aad1c8ae8b163eca15acc881f50b340d49235b", "timestamp": "2026-04-05T21:01:41.775909+00:00", "hypothesis": "No hypothesis provided", "hypothesis_source": "synthesized", "mutation_diff_summary": "", "score": 3.4, "score_ci_lower": 3.2, "score_ci_upper": 3.5, "raw_scores": [3.5, 3.5, 3.0, 3.5, 3.5], "baseline_score": 3.5, "outcome": "KEPT", "failure_mode": null, "duration_seconds": 65.86878645815887, "tags": [], "learnings": "{\"what_changed\":\"\",\"what_improved\":[],\"what_regressed\":[],\"transferable_insight\":\"No hypothesis provided\",\"domain_tags\":[]}", "cost_usd": 0.16731239999999997, "bootstrap_seed": 0, "agent_model": "claude-sonnet-4-6", "held_out_score": null, "criterion_names": ["correct_category", "concise_output", "follows_format", "no_hallucination", "handles_ambiguity"], "per_criterion_scores": {"correct_category": 1.0, "concise_output": 1.0, "follows_format": 0.0, "no_hallucination": 0.7, "handles_ambiguity": 0.7}, "failure_classification": null, "drafts_generated": 1, "drafts_survived": 1}
{"id": "6773b31c-f7e9-470b-8dc4-31d97a7af561", "target_id": "B1-control", "git_sha": "e648ab673be6abb80ab437e37dee73e294c74462", "pre_experiment_sha": "d04adb08de540d86c2fa477858e58fe240baaf15", "timestamp": "2026-04-05T21:02:50.019154+00:00", "hypothesis": "No hypothesis provided", "hypothesis_source": "synthesized", "mutation_diff_summary": "", "score": 3.5, "score_ci_lower": 2.9, "score_ci_upper": 4.0, "raw_scores": [4.0, 4.0, 2.5, 3.0, 4.0], "baseline_score": 3.4, "outcome": "KEPT", "failure_mode": null, "duration_seconds": 67.8272727089934, "tags": [], "learnings": "{\"what_changed\":\"\",\"what_improved\":[],\"what_regressed\":[],\"transferable_insight\":\"No hypothesis provided\",\"domain_tags\":[]}", "cost_usd": 0.15911339999999996, "bootstrap_seed": 0, "agent_model": "claude-sonnet-4-6", "held_out_score": null, "criterion_names": ["correct_category", "concise_output", "follows_format", "no_hallucination", "handles_ambiguity"], "per_criterion_scores": {"correct_category": 1.0, "concise_output": 1.0, "follows_format": 0.0, "no_hallucination": 0.7, "handles_ambiguity": 0.8}, "failure_classification": null, "drafts_generated": 1, "drafts_survived": 1}
{"id": "1e94bab6-e404-45be-8563-4d156975b59c", "target_id": "B1-control", "git_sha": "06e5d37b24879a15b892f3d8a97244ff3ce1ad91", "pre_experiment_sha": "e648ab673be6abb80ab437e37dee73e294c74462", "timestamp": "2026-04-05T21:04:20.953793+00:00", "hypothesis": "No hypothesis provided", "hypothesis_source": "synthesized", "mutation_diff_summary": "", "score": 3.7, "score_ci_lower": 3.3, "score_ci_upper": 4.0, "raw_scores": [4.0, 4.0, 3.0, 3.5, 4.0], "baseline_score": 3.5, "outcome": "KEPT", "failure_mode": null, "duration_seconds": 90.44483308307827, "tags": [], "learnings": "{\"what_changed\":\"\",\"what_improved\":[],\"what_regressed\":[],\"transferable_insight\":\"No hypothesis provided\",\"domain_tags\":[]}", "cost_usd": 0.1883667, "bootstrap_seed": 0, "agent_model": "claude-sonnet-4-6", "held_out_score": null, "criterion_names": ["correct_category", "concise_output", "follows_format", "no_hallucination", "handles_ambiguity"], "per_criterion_scores": {"correct_category": 1.0, "concise_output": 1.0, "follows_format": 0.0, "no_hallucination": 0.9, "handles_ambiguity": 0.8}, "failure_classification": null, "drafts_generated": 1, "drafts_survived": 1}
{"id": "e33c03b6-f557-459d-a490-5d2c43913b46", "target_id": "B1-control", "git_sha": "06e5d37b24879a15b892f3d8a97244ff3ce1ad91", "pre_experiment_sha": "06e5d37b24879a15b892f3d8a97244ff3ce1ad91", "timestamp": "2026-04-05T21:05:16.093720+00:00", "hypothesis": "No hypothesis provided", "hypothesis_source": "synthesized", "mutation_diff_summary": "", "score": 3.3, "score_ci_lower": 3.0, "score_ci_upper": 3.7, "raw_scores": [4.0, 3.0, 3.0, 3.0, 3.5], "baseline_score": 3.7, "outcome": "DISCARDED", "failure_mode": null, "duration_seconds": 54.760432000039145, "tags": [], "learnings": "{\"what_changed\":\"\",\"what_improved\":[],\"what_regressed\":[],\"transferable_insight\":\"No hypothesis provided\",\"domain_tags\":[]}", "cost_usd": 0.14654585, "bootstrap_seed": 0, "agent_model": "claude-sonnet-4-6", "held_out_score": null, "criterion_names": ["correct_category", "concise_output", "follows_format", "no_hallucination", "handles_ambiguity"], "per_criterion_scores": {"correct_category": 1.0, "concise_output": 1.0, "follows_format": 0.0, "no_hallucination": 0.6, "handles_ambiguity": 0.7}, "failure_classification": {"category": "output_format", "description": "The absence of a hypothesis and unknown failure mode indicate a likely violation of expected output structure or schema.", "fix_direction": "Ensure all required fields (e.g., hypothesis, failure mode) are present and filled in the experiment record.", "confidence": 0.85}, "drafts_generated": 1, "drafts_survived": 1}
