{"id": "689199b1-aa17-4672-8384-e14439212610", "target_id": "B1-control", "git_sha": "f04e6967cb673ffca2a411e2d3ac23557cfb7209", "pre_experiment_sha": "72a86c6c2a3f80ef2cc0c9e5c9431b1a49176162", "timestamp": "2026-04-24T00:34:58.382647+00:00", "hypothesis": "Remove verbose wording about categories being strictly distinct and restore the selection command to the first paragraph to improve directness and reduce hallucination.", "hypothesis_source": "agent", "mutation_diff_summary": "", "score": 2.6, "score_ci_lower": 2.2, "score_ci_upper": 3.1, "raw_scores": [2.5, 3.5, 2.5, 2.5, 2.0], "baseline_score": 2.2, "outcome": "KEPT", "failure_mode": null, "duration_seconds": 83.11609395802952, "tags": ["directness", "conciseness", "formatting"], "learnings": "{\"what_changed\":\"\",\"what_improved\":[],\"what_regressed\":[],\"transferable_insight\":\"Front-loading primary commands and removing verbose constraints improves instruction adherence and reduces model hallucinations.\",\"domain_tags\":[\"Prompt Engineering\",\"Instruction Formatting\",\"Hallucination Reduction\"]}", "cost_usd": 0.005897800000000001, "bootstrap_seed": 0, "agent_model": "gemini-3.1-pro-preview", "held_out_score": null, "criterion_names": ["correct_category", "concise_output", "follows_format", "no_hallucination", "handles_ambiguity"], "per_criterion_scores": {"correct_category": 0.2, "concise_output": 1.0, "follows_format": 0.1, "no_hallucination": 0.3, "handles_ambiguity": 1.0}, "failure_classification": null, "drafts_generated": 1, "drafts_survived": 1}
{"id": "3bc4c2da-dda1-434a-90c8-0339a2a4ed71", "target_id": "B1-control", "git_sha": "88c6b8906342339841823894580cbe3b28c52683", "pre_experiment_sha": "f04e6967cb673ffca2a411e2d3ac23557cfb7209", "timestamp": "2026-04-24T00:36:36.183205+00:00", "hypothesis": "Refine the classification command by changing \"given text\" to \"input text\" to improve precision while strictly preserving all formatting constraints and structural flow to prevent output format errors.", "hypothesis_source": "agent", "mutation_diff_summary": "", "score": 2.7, "score_ci_lower": 2.3, "score_ci_upper": 3.2, "raw_scores": [2.5, 2.0, 2.5, 3.0, 3.5], "baseline_score": 2.6, "outcome": "KEPT", "failure_mode": null, "duration_seconds": 91.6426378749311, "tags": ["precision", "direct-command", "strict-formatting"], "learnings": "{\"what_changed\":\"\",\"what_improved\":[],\"what_regressed\":[],\"transferable_insight\":\"Replacing ambiguous references with standard technical terminology, such as using 'input' instead of 'given', improves model comprehension and task precision.\",\"domain_tags\":[\"Prompt Engineering\",\"Instruction Clarity\",\"Lexical Optimization\"]}", "cost_usd": 0.005980300000000001, "bootstrap_seed": 0, "agent_model": "gemini-3.1-pro-preview", "held_out_score": null, "criterion_names": ["correct_category", "concise_output", "follows_format", "no_hallucination", "handles_ambiguity"], "per_criterion_scores": {"correct_category": 0.3, "concise_output": 1.0, "follows_format": 0.1, "no_hallucination": 0.3, "handles_ambiguity": 1.0}, "failure_classification": null, "drafts_generated": 1, "drafts_survived": 1}
{"id": "7928f989-28e0-4535-a759-7c745db2cad2", "target_id": "B1-control", "git_sha": "88c6b8906342339841823894580cbe3b28c52683", "pre_experiment_sha": "88c6b8906342339841823894580cbe3b28c52683", "timestamp": "2026-04-24T00:38:18.637572+00:00", "hypothesis": "Changing \"exactly one of the provided categories\" to \"exactly one category from the provided list\" creates a direct lexical link to the output formatting constraint, reinforcing list adherence and reducing hallucination.", "hypothesis_source": "agent", "mutation_diff_summary": "", "score": 2.4, "score_ci_lower": 2.1, "score_ci_upper": 2.7, "raw_scores": [2.5, 2.0, 2.5, 3.0, 2.0], "baseline_score": 2.7, "outcome": "DISCARDED", "failure_mode": null, "duration_seconds": 95.44784141681157, "tags": ["lexical-link", "hallucination-reduction", "direct-command"], "learnings": "{\"what_changed\":\"\",\"what_improved\":[],\"what_regressed\":[],\"transferable_insight\":\"Attempting to enforce constraint adherence through minor lexical matching rather than semantic clarity does not reliably improve performance and may cause regressions.\",\"domain_tags\":[\"Prompt Engineering\",\"Constraint Adherence\",\"Lexical Tuning\"]}", "cost_usd": 0.0062545000000000005, "bootstrap_seed": 0, "agent_model": "gemini-3.1-pro-preview", "held_out_score": null, "criterion_names": ["correct_category", "concise_output", "follows_format", "no_hallucination", "handles_ambiguity"], "per_criterion_scores": {"correct_category": 0.2, "concise_output": 1.0, "follows_format": 0.0, "no_hallucination": 0.2, "handles_ambiguity": 1.0}, "failure_classification": {"category": "output_format", "description": "The experiment aimed to improve the model's adherence to a specific output format constraint (choosing exactly one category from a provided list). The low score (2.4) indicates that the prompt modification failed to reduce violations of this output structure or schema. This suggests the model likely continued to struggle with providing the response in the requested format, possibly by generating multiple categories, categories not on the list, or incorrectly structured output.", "fix_direction": "Implement stronger structural constraints for output format, such as providing an explicit JSON schema template, using XML tags, or including clear few-shot examples that demonstrate the desired output structure precisely. Consider reinforcing negative constraints ('DO NOT provide more than one category') or exploring fine-tuning for specific instruction adherence.", "confidence": 0.9}, "drafts_generated": 1, "drafts_survived": 1}
{"id": "2f94e26f-9e64-43aa-9ff2-804c44640b8e", "target_id": "B1-control", "git_sha": "88c6b8906342339841823894580cbe3b28c52683", "pre_experiment_sha": "88c6b8906342339841823894580cbe3b28c52683", "timestamp": "2026-04-24T00:40:18.399666+00:00", "hypothesis": "Replacing the persona of \"assistant\" with \"system\" reinforces a non-conversational, automated role, reducing the likelihood of conversational filler and mitigating output formatting errors.", "hypothesis_source": "agent", "mutation_diff_summary": "", "score": 2.3, "score_ci_lower": 2.0, "score_ci_upper": 2.7, "raw_scores": [3.0, 2.0, 2.0, 2.0, 2.5], "baseline_score": 2.7, "outcome": "DISCARDED", "failure_mode": null, "duration_seconds": 81.65983345801942, "tags": ["persona", "strict-formatting", "hallucination-reduction"], "learnings": "{\"what_changed\":\"\",\"what_improved\":[],\"what_regressed\":[],\"transferable_insight\":\"Assigning a strictly automated or non-conversational persona to an agent does not inherently improve its adherence to strict formatting constraints and may actually degrade overall performance.\",\"domain_tags\":[\"Prompt Engineering\",\"Persona Design\",\"Behavioral Alignment\"]}", "cost_usd": 0.006357150000000001, "bootstrap_seed": 0, "agent_model": "gemini-3.1-pro-preview", "held_out_score": null, "criterion_names": ["correct_category", "concise_output", "follows_format", "no_hallucination", "handles_ambiguity"], "per_criterion_scores": {"correct_category": 0.1, "concise_output": 1.0, "follows_format": 0.0, "no_hallucination": 0.2, "handles_ambiguity": 1.0}, "failure_classification": {"category": "semantic_drift", "description": "The experiment failed likely because the change from 'assistant' to 'system' persona caused the model to misinterpret its role. While intended to reinforce a non-conversational, automated role and improve formatting, the 'system' persona might have led the model to produce outputs that were overly terse, lacked necessary context, or misinterpreted the *meaning* of desired structured output (e.g., providing raw data or a less helpful structure instead of a well-formatted and useful one), thus drifting from the intended output quality and utility.", "fix_direction": "Re-evaluate the implicit connotations of the 'system' persona and consider alternative non-conversational roles that explicitly convey expectations of both style and structured output quality. Supplement persona changes with more explicit and robust instructions regarding desired output format, level of detail, and task objectives to minimize misinterpretation. Conduct qualitative analysis to understand how different personas influence the model's interpretation of its role.", "confidence": 0.85}, "drafts_generated": 1, "drafts_survived": 1}
{"id": "d36337d4-1998-4dae-9d09-d55d6fbae231", "target_id": "B1-control", "git_sha": "88c6b8906342339841823894580cbe3b28c52683", "pre_experiment_sha": "88c6b8906342339841823894580cbe3b28c52683", "timestamp": "2026-04-24T00:42:11.037440+00:00", "hypothesis": "Changing \"The provided categories\" to \"All provided categories\" in the mutual exclusivity statement improves precision by explicitly universally quantifying the constraint without adding verbosity.", "hypothesis_source": "agent", "mutation_diff_summary": "", "score": 2.4, "score_ci_lower": 2.1, "score_ci_upper": 2.7, "raw_scores": [2.5, 2.0, 2.0, 2.5, 3.0], "baseline_score": 2.7, "outcome": "DISCARDED", "failure_mode": null, "duration_seconds": 76.46260366705246, "tags": ["precision", "mutual-exclusivity", "concise"], "learnings": "{\"what_changed\":\"\",\"what_improved\":[],\"what_regressed\":[],\"transferable_insight\":\"Adding explicit universal quantifiers to constraints that are already implicitly understood as universal can degrade performance rather than improve precision.\",\"domain_tags\":[\"Prompt Engineering\",\"Constraint Formulation\",\"Semantics\"]}", "cost_usd": 0.00635155, "bootstrap_seed": 0, "agent_model": "gemini-3.1-pro-preview", "held_out_score": null, "criterion_names": ["correct_category", "concise_output", "follows_format", "no_hallucination", "handles_ambiguity"], "per_criterion_scores": {"correct_category": 0.1, "concise_output": 1.0, "follows_format": 0.0, "no_hallucination": 0.3, "handles_ambiguity": 1.0}, "failure_classification": {"category": "semantic_drift", "description": "The experiment hypothesized that a specific textual change would improve the semantic precision of a statement by more explicitly quantifying a constraint. A failure indicates that this change either did not achieve the intended semantic improvement, did not actually increase precision as measured, or potentially introduced an unintended meaning or ambiguity, resulting in a low score.", "fix_direction": "Re-evaluate the proposed linguistic change for its actual semantic impact on precision and universal quantification. Consider alternative phrasings that might more effectively achieve the goal without ambiguity. Also, review the evaluation methodology for 'precision' to ensure it accurately reflects the intended semantic improvement.", "confidence": 0.9}, "drafts_generated": 1, "drafts_survived": 1}
{"id": "81f1f599-d7e1-42fb-a15d-7962d26cb687", "target_id": "B1-control", "git_sha": "f8eb857ba80b6f8180a6d97a2a2cb068ae6a6622", "pre_experiment_sha": "88c6b8906342339841823894580cbe3b28c52683", "timestamp": "2026-04-24T00:46:10.941912+00:00", "hypothesis": "Replacing the broad persona trait \"expert\" with the targeted trait \"precise\" aligns the model's persona directly with the strict exactness required to reduce output formatting errors and semantic drift.", "hypothesis_source": "agent", "mutation_diff_summary": "", "score": 2.5, "score_ci_lower": 2.2, "score_ci_upper": 2.8, "raw_scores": [2.0, 2.5, 2.5, 3.0, 2.5], "baseline_score": 2.7, "outcome": "KEPT", "failure_mode": null, "duration_seconds": 226.30392233282328, "tags": ["persona-tuning", "precision", "strict-formatting\n\n```markdown\nYou are a precise text classification assistant. Classify the input text into exactly one of the provided categories. Select the single most specific category.\n\nThe provided categories are mutually exclusive.\n\nCRITICAL INSTRUCTION:\nYou must output ONLY the exact category name without any explanations or conversational filler. Output the category name exactly as it appears in the provided list.\n```"], "learnings": "{\"what_changed\":\"\",\"what_improved\":[],\"what_regressed\":[],\"transferable_insight\":\"Replacing broad persona descriptors with targeted, specific traits improves a system's adherence to strict formatting constraints and reduces semantic drift.\",\"domain_tags\":[\"Prompt Engineering\",\"Persona Tuning\",\"Output Formatting\"]}", "cost_usd": 0.00604655, "bootstrap_seed": 0, "agent_model": "gemini-3.1-pro-preview", "held_out_score": null, "criterion_names": ["correct_category", "concise_output", "follows_format", "no_hallucination", "handles_ambiguity"], "per_criterion_scores": {"correct_category": 0.1, "concise_output": 1.0, "follows_format": 0.0, "no_hallucination": 0.4, "handles_ambiguity": 1.0}, "failure_classification": null, "drafts_generated": 1, "drafts_survived": 1}
{"id": "57d8047b-9330-4fe5-a47f-f773f7b8cfb0", "target_id": "B1-control", "git_sha": "37a1811830ff6481a73cf29fab8cfd66d6bd2981", "pre_experiment_sha": "f8eb857ba80b6f8180a6d97a2a2cb068ae6a6622", "timestamp": "2026-04-24T00:47:48.949110+00:00", "hypothesis": "Reverting the persona trait from \"precise\" back to \"expert\" resolves a known cause of semantic drift and aligns with the explicit rule to maintain the established expert persona.", "hypothesis_source": "agent", "mutation_diff_summary": "", "score": 2.5, "score_ci_lower": 2.1, "score_ci_upper": 2.9, "raw_scores": [3.0, 2.0, 2.5, 3.0, 2.0], "baseline_score": 2.5, "outcome": "KEPT", "failure_mode": null, "duration_seconds": 70.1849858330097, "tags": ["persona", "semantic-drift-reduction"], "learnings": "{\"what_changed\":\"\",\"what_improved\":[],\"what_regressed\":[],\"transferable_insight\":\"Reverting to established behavioral constraints can correct drift and ensure compliance with explicit rules without degrading overall performance.\",\"domain_tags\":[\"Prompt Engineering\",\"Persona Management\",\"System Alignment\"]}", "cost_usd": 0.00653905, "bootstrap_seed": 0, "agent_model": "gemini-3.1-pro-preview", "held_out_score": null, "criterion_names": ["correct_category", "concise_output", "follows_format", "no_hallucination", "handles_ambiguity"], "per_criterion_scores": {"correct_category": 0.1, "concise_output": 1.0, "follows_format": 0.0, "no_hallucination": 0.4, "handles_ambiguity": 1.0}, "failure_classification": null, "drafts_generated": 1, "drafts_survived": 1}
{"id": "d80d3a0f-dc73-4bc1-a7f8-d9163e75c937", "target_id": "B1-control", "git_sha": "37a1811830ff6481a73cf29fab8cfd66d6bd2981", "pre_experiment_sha": "37a1811830ff6481a73cf29fab8cfd66d6bd2981", "timestamp": "2026-04-24T00:49:49.284448+00:00", "hypothesis": "Combining the classification command and specificity requirement into a single sentence tightly couples the task with its primary constraint, improving conciseness and reducing semantic drift without adding complex workflows.", "hypothesis_source": "agent", "mutation_diff_summary": "", "score": 2.2, "score_ci_lower": 2.0, "score_ci_upper": 2.6, "raw_scores": [3.0, 2.0, 2.0, 2.0, 2.0], "baseline_score": 2.5, "outcome": "DISCARDED", "failure_mode": null, "duration_seconds": 112.63961850013584, "tags": ["conciseness", "semantic-drift-reduction", "direct-command"], "learnings": "{\"what_changed\":\"\",\"what_improved\":[],\"what_regressed\":[],\"transferable_insight\":\"Condensing a primary task command and its specific constraints into a single sentence degrades performance, suggesting that separating actions from constraints improves adherence.\",\"domain_tags\":[\"Prompt Engineering\",\"Instruction Formatting\",\"Constraint Management\"]}", "cost_usd": 0.006706600000000001, "bootstrap_seed": 0, "agent_model": "gemini-3.1-pro-preview", "held_out_score": null, "criterion_names": ["correct_category", "concise_output", "follows_format", "no_hallucination", "handles_ambiguity"], "per_criterion_scores": {"correct_category": 0.1, "concise_output": 1.0, "follows_format": 0.0, "no_hallucination": 0.1, "handles_ambiguity": 1.0}, "failure_classification": {"category": "semantic_drift", "description": "The attempt to combine classification and specificity into a single, tightly coupled sentence, while aiming for conciseness, likely introduced ambiguity or overloaded the meaning, causing the model to misinterpret the full scope of the task or the precise requirements for specificity, leading to outputs that failed to meet the intended meaning despite potentially adhering to a superficial interpretation.", "fix_direction": "Re-evaluate the balance between conciseness and clarity. The tight coupling might have obscured distinct instructions. Consider alternative structures that maintain efficiency but explicitly separate or highlight the classification command from the specificity requirement to ensure both are fully understood without creating conflicting interpretations. Focus on testing specific instances where the meaning was lost or misinterpreted.", "confidence": 0.9}, "drafts_generated": 1, "drafts_survived": 1}
{"id": "d0eb0327-536b-4b89-ab0f-b5a789ef2435", "target_id": "B1-control", "git_sha": "e2607031a38578ef9e36e69af73bea26a589e042", "pre_experiment_sha": "37a1811830ff6481a73cf29fab8cfd66d6bd2981", "timestamp": "2026-04-24T00:52:43.908086+00:00", "hypothesis": "Correcting \"explanations\" to the singular \"explanation\" to match the singular \"conversational filler\" provides a grammatically tighter constraint without altering the established formatting rules, triggering a re-evaluation to recover stochastic score drops.", "hypothesis_source": "agent", "mutation_diff_summary": "", "score": 2.5, "score_ci_lower": 2.2, "score_ci_upper": 2.8, "raw_scores": [2.5, 2.0, 2.5, 3.0, 2.5], "baseline_score": 2.5, "outcome": "KEPT", "failure_mode": null, "duration_seconds": 158.25890066591091, "tags": ["grammar", "strict-formatting"], "learnings": "{\"what_changed\":\"\",\"what_improved\":[],\"what_regressed\":[],\"transferable_insight\":\"Correcting minor grammatical inconsistencies, such as aligning singular and plural nouns in instructions, generally produces neutral performance outcomes while maintaining stylistic consistency.\",\"domain_tags\":[\"Prompt Engineering\",\"Grammar\",\"Instruction Tuning\"]}", "cost_usd": 0.006612800000000001, "bootstrap_seed": 0, "agent_model": "gemini-3.1-pro-preview", "held_out_score": null, "criterion_names": ["correct_category", "concise_output", "follows_format", "no_hallucination", "handles_ambiguity"], "per_criterion_scores": {"correct_category": 0.2, "concise_output": 1.0, "follows_format": 0.0, "no_hallucination": 0.3, "handles_ambiguity": 1.0}, "failure_classification": null, "drafts_generated": 1, "drafts_survived": 1}
{"id": "7f1d9845-092a-4416-a8db-a641ed456a28", "target_id": "B1-control", "git_sha": "16a5d7069b1b27b9a083ff5b570d11fde84e28c0", "pre_experiment_sha": "e2607031a38578ef9e36e69af73bea26a589e042", "timestamp": "2026-04-24T00:54:11.724472+00:00", "hypothesis": "Reverting \"explanation\" back to the plural \"explanations\" strictly adheres to the critical formatting rules, restoring the exact phrasing proven to yield the highest scores and prevent output format failures.", "hypothesis_source": "agent", "mutation_diff_summary": "", "score": 2.5, "score_ci_lower": 2.5, "score_ci_upper": 2.5, "raw_scores": [2.5, 2.5, 2.5, 2.5, 2.5], "baseline_score": 2.5, "outcome": "KEPT", "failure_mode": null, "duration_seconds": 65.17601091600955, "tags": ["strict-formatting", "rule-adherence", "output-format"], "learnings": "{\"what_changed\":\"\",\"what_improved\":[],\"what_regressed\":[],\"transferable_insight\":\"Strictly matching expected schema terminology, including exact pluralization, prevents formatting failures and ensures system stability even when it yields no measurable performance gain.\",\"domain_tags\":[\"Prompt Engineering\",\"Schema Matching\",\"System Stability\"]}", "cost_usd": 0.006649050000000001, "bootstrap_seed": 0, "agent_model": "gemini-3.1-pro-preview", "held_out_score": null, "criterion_names": ["correct_category", "concise_output", "follows_format", "no_hallucination", "handles_ambiguity"], "per_criterion_scores": {"correct_category": 0.1, "concise_output": 1.0, "follows_format": 0.1, "no_hallucination": 0.3, "handles_ambiguity": 1.0}, "failure_classification": null, "drafts_generated": 1, "drafts_survived": 1}
