{"id": "06923069-0dac-47f7-b038-30f053ecd02a", "target_id": "B1-control", "git_sha": "28187a4c4a8545bc88c632c932d6e289111d78f0", "pre_experiment_sha": "d1c1f0c4486589d3ba098d6158a1c53624fa1631", "timestamp": "2026-04-19T01:30:12.147828+00:00", "hypothesis": "Restore a slightly richer deterministic prompt to reduce logic errors while preserving label-only output.", "hypothesis_source": "agent", "mutation_diff_summary": "", "score": 2.8, "score_ci_lower": 2.3, "score_ci_upper": 3.2, "raw_scores": [3.0, 2.0, 3.5, 3.0, 2.5], "baseline_score": 2.9, "outcome": "KEPT", "failure_mode": null, "duration_seconds": 12.293487875023857, "tags": ["determinism", "logic-error", "classification", "single-label"], "learnings": "{\"what_changed\":\"\",\"what_improved\":[\"no_hallucination: PASS (was FAIL)\"],\"what_regressed\":[\"correct_category: FAIL (was PASS)\"],\"transferable_insight\":\"Adding more deterministic context can reduce unsupported outputs, but it may also shift the model away from the correct decision boundary, so improvements should be validated against the primary target rather than assumed to generalize.\",\"domain_tags\":[\"prompting\",\"evaluation\",\"classification\"]}", "cost_usd": 0.015442550000000001, "bootstrap_seed": 0, "agent_model": "gpt-5.4", "held_out_score": null, "criterion_names": ["correct_category", "concise_output", "follows_format", "no_hallucination", "handles_ambiguity"], "per_criterion_scores": {"correct_category": 0.4, "concise_output": 1.0, "follows_format": 0.0, "no_hallucination": 0.5, "handles_ambiguity": 0.9}, "failure_classification": null, "drafts_generated": 1, "drafts_survived": 1}
{"id": "b275f288-35a1-4484-9228-65d51dab3a30", "target_id": "B1-control", "git_sha": "5564c98ffd256201163a47fc0905fc770290f03c", "pre_experiment_sha": "28187a4c4a8545bc88c632c932d6e289111d78f0", "timestamp": "2026-04-19T01:30:26.509301+00:00", "hypothesis": "Use a single ultra-direct instruction that emphasizes best-match selection plus deterministic tie-breaking to reduce logic errors.", "hypothesis_source": "agent", "mutation_diff_summary": "", "score": 3.3, "score_ci_lower": 2.9, "score_ci_upper": 3.7, "raw_scores": [4.0, 2.5, 3.5, 3.0, 3.5], "baseline_score": 2.8, "outcome": "KEPT", "failure_mode": null, "duration_seconds": 12.725366791943088, "tags": ["minimalism", "logic-error", "tie-break", "single-label"], "learnings": "{\"what_changed\":\"\",\"what_improved\":[\"correct_category: PASS (was FAIL)\"],\"what_regressed\":[],\"transferable_insight\":\"When a task requires choosing among alternatives, a single explicit instruction to select the best match and apply deterministic tie-breaking can reduce reasoning errors and improve consistency.\",\"domain_tags\":[\"decision-making\",\"prompt-design\",\"error-reduction\"]}", "cost_usd": 0.015342550000000002, "bootstrap_seed": 0, "agent_model": "gpt-5.4", "held_out_score": null, "criterion_names": ["correct_category", "concise_output", "follows_format", "no_hallucination", "handles_ambiguity"], "per_criterion_scores": {"correct_category": 0.7, "concise_output": 1.0, "follows_format": 0.0, "no_hallucination": 0.7, "handles_ambiguity": 0.9}, "failure_classification": null, "drafts_generated": 1, "drafts_survived": 1}
{"id": "ffbf6aa0-bb21-42a6-aeda-101bf99247f5", "target_id": "B1-control", "git_sha": "2df9b2ceaed94ec67072e9d15bf9e091307630d9", "pre_experiment_sha": "5564c98ffd256201163a47fc0905fc770290f03c", "timestamp": "2026-04-19T01:30:38.825328+00:00", "hypothesis": "Clarifying that the choice must come from the allowed list may reduce logic errors while preserving deterministic single-label output.", "hypothesis_source": "agent", "mutation_diff_summary": "", "score": 3.2, "score_ci_lower": 2.8, "score_ci_upper": 3.7, "raw_scores": [3.5, 4.0, 2.5, 3.0, 3.0], "baseline_score": 3.3, "outcome": "KEPT", "failure_mode": null, "duration_seconds": 11.31577104202006, "tags": ["minimalism", "allowed-list", "tie-break", "logic-error"], "learnings": "{\"what_changed\":\"\",\"what_improved\":[],\"what_regressed\":[],\"transferable_insight\":\"Explicitly constraining choices to a predefined allowed set can reduce reasoning errors while preserving deterministic single-output behavior.\",\"domain_tags\":[\"decision-making\",\"prompt-design\",\"classification\"]}", "cost_usd": 0.015342550000000002, "bootstrap_seed": 0, "agent_model": "gpt-5.4", "held_out_score": null, "criterion_names": ["correct_category", "concise_output", "follows_format", "no_hallucination", "handles_ambiguity"], "per_criterion_scores": {"correct_category": 0.8, "concise_output": 1.0, "follows_format": 0.0, "no_hallucination": 0.5, "handles_ambiguity": 0.9}, "failure_classification": null, "drafts_generated": 1, "drafts_survived": 1}
{"id": "3fabf134-9c6f-4c0e-acfd-5b71741f36da", "target_id": "B1-control", "git_sha": "3de589c5f546cd8f3e7c9052c831f066c61668d3", "pre_experiment_sha": "2df9b2ceaed94ec67072e9d15bf9e091307630d9", "timestamp": "2026-04-19T01:30:56.178701+00:00", "hypothesis": "A more direct best-match instruction with deterministic tie-breaking will reduce logic errors while preserving label-only output.", "hypothesis_source": "agent", "mutation_diff_summary": "", "score": 2.9, "score_ci_lower": 2.6, "score_ci_upper": 3.2, "raw_scores": [3.0, 2.5, 3.5, 3.0, 2.5], "baseline_score": 3.2, "outcome": "KEPT", "failure_mode": null, "duration_seconds": 15.370444042026065, "tags": ["minimalism", "logic-error", "tie-break", "single-label"], "learnings": "{\"what_changed\":\"\",\"what_improved\":[],\"what_regressed\":[\"correct_category: FAIL (was PASS)\"],\"transferable_insight\":\"Making selection criteria more explicit and adding deterministic tie-breaking can improve consistency, but it may also shift errors into the primary decision rule if the underlying matching logic is not sufficiently robust.\",\"domain_tags\":[\"decision-making\",\"prompt-design\",\"evaluation\"]}", "cost_usd": 0.01530255, "bootstrap_seed": 0, "agent_model": "gpt-5.4", "held_out_score": null, "criterion_names": ["correct_category", "concise_output", "follows_format", "no_hallucination", "handles_ambiguity"], "per_criterion_scores": {"correct_category": 0.4, "concise_output": 1.0, "follows_format": 0.0, "no_hallucination": 0.5, "handles_ambiguity": 1.0}, "failure_classification": null, "drafts_generated": 1, "drafts_survived": 1}
{"id": "efa53456-169b-48c2-b6b1-93cff9d8f3d8", "target_id": "B1-control", "git_sha": "e1da3dd9605e6d3709519d5ca2beb95b7c6073ba", "pre_experiment_sha": "3de589c5f546cd8f3e7c9052c831f066c61668d3", "timestamp": "2026-04-19T01:31:08.904645+00:00", "hypothesis": "A shorter imperative that prioritizes best-match selection and deterministic tie-breaking will reduce logic errors.", "hypothesis_source": "agent", "mutation_diff_summary": "", "score": 3.3, "score_ci_lower": 2.9, "score_ci_upper": 3.7, "raw_scores": [3.5, 2.5, 3.0, 4.0, 3.5], "baseline_score": 2.9, "outcome": "KEPT", "failure_mode": null, "duration_seconds": 11.504773291060701, "tags": ["minimalism", "logic-error", "tie-break", "single-label"], "learnings": "{\"what_changed\":\"\",\"what_improved\":[\"correct_category: PASS (was FAIL)\"],\"what_regressed\":[],\"transferable_insight\":\"When a task requires choosing among alternatives, using a concise directive that emphasizes the best match and explicit tie-breaking rules improves correctness by reducing ambiguity and logic errors.\",\"domain_tags\":[\"decision-making\",\"prompt-design\",\"error-reduction\"]}", "cost_usd": 0.015217550000000002, "bootstrap_seed": 0, "agent_model": "gpt-5.4", "held_out_score": null, "criterion_names": ["correct_category", "concise_output", "follows_format", "no_hallucination", "handles_ambiguity"], "per_criterion_scores": {"correct_category": 0.7, "concise_output": 1.0, "follows_format": 0.0, "no_hallucination": 0.6, "handles_ambiguity": 1.0}, "failure_classification": null, "drafts_generated": 1, "drafts_survived": 1}
{"id": "2e347580-03e1-46ca-b65b-e71a474b8905", "target_id": "B1-control", "git_sha": "50d92957fdab4d92b52082ecffb1b0efbd9cc4eb", "pre_experiment_sha": "e1da3dd9605e6d3709519d5ca2beb95b7c6073ba", "timestamp": "2026-04-19T01:31:21.346320+00:00", "hypothesis": "Make the instruction more imperative and exclusive to improve format adherence without hurting best-match selection.", "hypothesis_source": "agent", "mutation_diff_summary": "", "score": 3.3, "score_ci_lower": 3.1, "score_ci_upper": 3.5, "raw_scores": [3.5, 3.0, 3.5, 3.0, 3.5], "baseline_score": 3.3, "outcome": "KEPT", "failure_mode": null, "duration_seconds": 11.037427708040923, "tags": ["minimalism", "imperative", "format", "single-label"], "learnings": "{\"what_changed\":\"\",\"what_improved\":[],\"what_regressed\":[],\"transferable_insight\":\"When a change increases directive clarity and exclusivity without altering the underlying decision criteria, it can improve compliance while preserving selection quality.\",\"domain_tags\":[\"instruction-design\",\"decision-making\",\"evaluation\"]}", "cost_usd": 0.01502755, "bootstrap_seed": 0, "agent_model": "gpt-5.4", "held_out_score": null, "criterion_names": ["correct_category", "concise_output", "follows_format", "no_hallucination", "handles_ambiguity"], "per_criterion_scores": {"correct_category": 0.7, "concise_output": 1.0, "follows_format": 0.0, "no_hallucination": 0.6, "handles_ambiguity": 1.0}, "failure_classification": null, "drafts_generated": 1, "drafts_survived": 1}
{"id": "81917410-4dde-42dc-9deb-80082ca939aa", "target_id": "B1-control", "git_sha": "e914cfe4700253992dea3e29e3119581e84109f3", "pre_experiment_sha": "50d92957fdab4d92b52082ecffb1b0efbd9cc4eb", "timestamp": "2026-04-19T01:31:34.183019+00:00", "hypothesis": "Adding a stronger exclusivity rule with explicit no-extra-text wording will improve format adherence while preserving best-match accuracy.", "hypothesis_source": "agent", "mutation_diff_summary": "", "score": 3.3, "score_ci_lower": 2.8, "score_ci_upper": 3.7, "raw_scores": [3.5, 2.5, 4.0, 3.0, 3.5], "baseline_score": 3.3, "outcome": "KEPT", "failure_mode": null, "duration_seconds": 10.472320874920115, "tags": ["minimalism", "format", "exclusivity", "single-label"], "learnings": "{\"what_changed\":\"\",\"what_improved\":[],\"what_regressed\":[\"correct_category: FAIL (was PASS)\"],\"transferable_insight\":\"Strengthening format constraints can improve compliance only if it does not displace the model\u2019s ability to choose the correct underlying content, so enforce structure without overconstraining decision quality.\",\"domain_tags\":[\"prompt-engineering\",\"classification\",\"format-adherence\"]}", "cost_usd": 0.014737550000000002, "bootstrap_seed": 0, "agent_model": "gpt-5.4", "held_out_score": null, "criterion_names": ["correct_category", "concise_output", "follows_format", "no_hallucination", "handles_ambiguity"], "per_criterion_scores": {"correct_category": 0.4, "concise_output": 1.0, "follows_format": 0.0, "no_hallucination": 0.9, "handles_ambiguity": 1.0}, "failure_classification": null, "drafts_generated": 1, "drafts_survived": 1}
{"id": "10562c81-5f8d-47c9-a725-69348c890de8", "target_id": "B1-control", "git_sha": "0e88fd7c58c1a4d9497b6b3fb296f8414c53999d", "pre_experiment_sha": "e914cfe4700253992dea3e29e3119581e84109f3", "timestamp": "2026-04-19T01:31:49.079486+00:00", "hypothesis": "A simpler imperative that prioritizes exact one-label output and first-listed tie-breaking will reduce logic errors.", "hypothesis_source": "agent", "mutation_diff_summary": "", "score": 3.0, "score_ci_lower": 2.5, "score_ci_upper": 3.4, "raw_scores": [3.0, 2.0, 3.5, 3.5, 3.0], "baseline_score": 3.3, "outcome": "KEPT", "failure_mode": null, "duration_seconds": 13.6804642919451, "tags": ["minimalism", "logic-error", "format", "tie-break"], "learnings": "{\"what_changed\":\"\",\"what_improved\":[\"correct_category: PASS (was FAIL)\"],\"what_regressed\":[],\"transferable_insight\":\"When a task requires selecting one item from multiple possibilities, explicitly stating the output format and a deterministic tie-break rule reduces reasoning errors and improves consistency.\",\"domain_tags\":[\"instruction_design\",\"decision_making\",\"classification\"]}", "cost_usd": 0.014832550000000002, "bootstrap_seed": 0, "agent_model": "gpt-5.4", "held_out_score": null, "criterion_names": ["correct_category", "concise_output", "follows_format", "no_hallucination", "handles_ambiguity"], "per_criterion_scores": {"correct_category": 0.5, "concise_output": 1.0, "follows_format": 0.0, "no_hallucination": 0.5, "handles_ambiguity": 1.0}, "failure_classification": null, "drafts_generated": 1, "drafts_survived": 1}
{"id": "e779154a-ce55-4492-9fd9-8a3d6a166485", "target_id": "B1-control", "git_sha": "0e88fd7c58c1a4d9497b6b3fb296f8414c53999d", "pre_experiment_sha": "0e88fd7c58c1a4d9497b6b3fb296f8414c53999d", "timestamp": "2026-04-19T01:32:02.511718+00:00", "hypothesis": "Emphasizing single best-fit classification with deterministic first-listed tie-breaking will reduce logic errors.", "hypothesis_source": "agent", "mutation_diff_summary": "", "score": 2.6, "score_ci_lower": 2.3, "score_ci_upper": 2.9, "raw_scores": [3.0, 2.0, 2.5, 3.0, 2.5], "baseline_score": 3.0, "outcome": "DISCARDED", "failure_mode": null, "duration_seconds": 12.33104004105553, "tags": ["logic-error", "tie-break", "single-label", "minimalism"], "learnings": "{\"what_changed\":\"\",\"what_improved\":[],\"what_regressed\":[\"correct_category: FAIL (was PASS)\"],\"transferable_insight\":\"When a task can plausibly fit multiple categories, forcing a single deterministic choice can reduce ambiguity but also increase misclassification risk if the tie-break rule is not aligned with the true decision criteria.\",\"domain_tags\":[\"classification\",\"decision-making\",\"tie-breaking\"]}", "cost_usd": 0.01526915, "bootstrap_seed": 0, "agent_model": "gpt-5.4", "held_out_score": null, "criterion_names": ["correct_category", "concise_output", "follows_format", "no_hallucination", "handles_ambiguity"], "per_criterion_scores": {"correct_category": 0.3, "concise_output": 1.0, "follows_format": 0.0, "no_hallucination": 0.5, "handles_ambiguity": 0.8}, "failure_classification": {"category": "logic_error", "description": "The experiment failed due to incorrect reasoning/classification logic rather than output structure or code syntax. The hypothesis about single best-fit deterministic tie-breaking suggests the intended behavior wasn\u2019t consistently applied, leading to wrong logical outcomes.", "fix_direction": "Tighten the tie-breaking logic: ensure deterministic selection among equal scores, add/verify tests covering tie scenarios, and confirm the classifier\u2019s decision policy is applied uniformly across all inputs.", "confidence": 0.62}, "drafts_generated": 1, "drafts_survived": 1}
{"id": "8314cdc4-ad30-4972-a35a-46ca2c95ef99", "target_id": "B1-control", "git_sha": "04beb2f283620baafc5ce40b95b93c2b134fce66", "pre_experiment_sha": "0e88fd7c58c1a4d9497b6b3fb296f8414c53999d", "timestamp": "2026-04-19T01:32:16.103814+00:00", "hypothesis": "Using a single ultra-direct imperative with explicit exactness and tie-breaking will reduce logic errors while preserving label-only output.", "hypothesis_source": "agent", "mutation_diff_summary": "", "score": 3.1, "score_ci_lower": 2.8, "score_ci_upper": 3.4, "raw_scores": [3.0, 3.0, 3.5, 2.5, 3.5], "baseline_score": 3.0, "outcome": "KEPT", "failure_mode": null, "duration_seconds": 10.290292332996614, "tags": ["minimalism", "imperative", "tie-break", "logic-error", "single-label"], "learnings": "{\"what_changed\":\"\",\"what_improved\":[\"correct_category: PASS (was FAIL)\"],\"what_regressed\":[],\"transferable_insight\":\"A single, highly specific instruction that states exact criteria and tie-breaking can reduce ambiguity and improve correctness without changing the required output format.\",\"domain_tags\":[\"prompting\",\"instruction-design\",\"classification\"]}", "cost_usd": 0.01523755, "bootstrap_seed": 0, "agent_model": "gpt-5.4", "held_out_score": null, "criterion_names": ["correct_category", "concise_output", "follows_format", "no_hallucination", "handles_ambiguity"], "per_criterion_scores": {"correct_category": 0.5, "concise_output": 1.0, "follows_format": 0.0, "no_hallucination": 0.6, "handles_ambiguity": 1.0}, "failure_classification": null, "drafts_generated": 1, "drafts_survived": 1}
{"id": "b4669564-90e1-40a1-8a0a-fffda49d4eb1", "target_id": "B1-control", "git_sha": "3f2ceffdf9dc33d76f5df8cd867435c37ff2b349", "pre_experiment_sha": "04beb2f283620baafc5ce40b95b93c2b134fce66", "timestamp": "2026-04-19T01:32:27.497355+00:00", "hypothesis": "A more forceful but still minimal imperative will reduce logic errors while preserving strict single-label output.", "hypothesis_source": "agent", "mutation_diff_summary": "", "score": 3.1, "score_ci_lower": 2.8, "score_ci_upper": 3.4, "raw_scores": [3.5, 3.0, 2.5, 3.5, 3.0], "baseline_score": 3.1, "outcome": "KEPT", "failure_mode": null, "duration_seconds": 10.360895708901808, "tags": ["minimalism", "imperative", "logic-error", "tie-break", "single-label"], "learnings": "{\"what_changed\":\"\",\"what_improved\":[],\"what_regressed\":[],\"transferable_insight\":\"Making instructions more forceful without adding extra detail can preserve compliance with a strict output format, but it may not by itself improve correctness.\",\"domain_tags\":[\"prompting\",\"instruction-design\",\"output-formatting\"]}", "cost_usd": 0.01515255, "bootstrap_seed": 0, "agent_model": "gpt-5.4", "held_out_score": null, "criterion_names": ["correct_category", "concise_output", "follows_format", "no_hallucination", "handles_ambiguity"], "per_criterion_scores": {"correct_category": 0.6, "concise_output": 1.0, "follows_format": 0.0, "no_hallucination": 0.7, "handles_ambiguity": 0.8}, "failure_classification": null, "drafts_generated": 1, "drafts_survived": 1}
{"id": "6b351e01-e853-4e11-9f44-03bffa3ab1a5", "target_id": "B1-control", "git_sha": "3f2ceffdf9dc33d76f5df8cd867435c37ff2b349", "pre_experiment_sha": "3f2ceffdf9dc33d76f5df8cd867435c37ff2b349", "timestamp": "2026-04-19T01:32:39.669869+00:00", "hypothesis": "Using the exact ultra-direct imperative from the strategy will reduce logic errors while preserving strict single-label output.", "hypothesis_source": "agent", "mutation_diff_summary": "", "score": 3.0, "score_ci_lower": 2.6, "score_ci_upper": 3.4, "raw_scores": [3.0, 2.5, 2.5, 3.5, 3.5], "baseline_score": 3.1, "outcome": "DISCARDED", "failure_mode": null, "duration_seconds": 11.024364541983232, "tags": ["minimalism", "imperative", "tie-break", "single-label", "logic-error"], "learnings": "{\"what_changed\":\"\",\"what_improved\":[],\"what_regressed\":[\"no_hallucination: FAIL (was PASS)\"],\"transferable_insight\":\"Making instructions more direct can improve compliance, but if it narrows interpretation too much it may increase hallucinations and reduce overall reliability.\",\"domain_tags\":[\"instruction-following\",\"reliability\",\"prompt-design\"]}", "cost_usd": 0.015361350000000001, "bootstrap_seed": 0, "agent_model": "gpt-5.4", "held_out_score": null, "criterion_names": ["correct_category", "concise_output", "follows_format", "no_hallucination", "handles_ambiguity"], "per_criterion_scores": {"correct_category": 0.6, "concise_output": 1.0, "follows_format": 0.0, "no_hallucination": 0.4, "handles_ambiguity": 1.0}, "failure_classification": {"category": "logic_error", "description": "The experiment output failed but no failure mode details were provided, so it\u2019s not possible to determine whether the issue was a format/schema violation, logic error, regression, scope/syntax/semantic problems, or incomplete edits.", "fix_direction": "Provide the actual failed output and error logs (or diff from the prior attempt) to identify whether the failure was due to output structure, incorrect reasoning, prohibited edits, parsing errors, meaning drift, or partial/inconsistent changes.", "confidence": 0.05}, "drafts_generated": 1, "drafts_survived": 1}
{"id": "bf9e7387-7471-4e1f-aaf5-9f92f8098fca", "target_id": "B1-control", "git_sha": "167a0c567f052f72925aec833b78311ec778b25b", "pre_experiment_sha": "3f2ceffdf9dc33d76f5df8cd867435c37ff2b349", "timestamp": "2026-04-19T01:32:53.404890+00:00", "hypothesis": "Adding an explicit no-extra-text clause to the forceful one-label imperative will improve format adherence without weakening deterministic selection.", "hypothesis_source": "agent", "mutation_diff_summary": "", "score": 3.3, "score_ci_lower": 2.9, "score_ci_upper": 3.5, "raw_scores": [3.5, 2.5, 3.5, 3.5, 3.5], "baseline_score": 3.1, "outcome": "KEPT", "failure_mode": null, "duration_seconds": 10.183648124919273, "tags": ["imperative", "format", "tie-break", "single-label", "minimalism"], "learnings": "{\"what_changed\":\"\",\"what_improved\":[\"no_hallucination: PASS (was FAIL)\"],\"what_regressed\":[],\"transferable_insight\":\"Adding an explicit prohibition against extra output can improve adherence to a required format without reducing decisiveness in the primary choice.\",\"domain_tags\":[\"prompting\",\"format-adherence\",\"instruction-design\"]}", "cost_usd": 0.015567550000000001, "bootstrap_seed": 0, "agent_model": "gpt-5.4", "held_out_score": null, "criterion_names": ["correct_category", "concise_output", "follows_format", "no_hallucination", "handles_ambiguity"], "per_criterion_scores": {"correct_category": 0.5, "concise_output": 1.0, "follows_format": 0.0, "no_hallucination": 0.8, "handles_ambiguity": 1.0}, "failure_classification": null, "drafts_generated": 1, "drafts_survived": 1}
