{"id": "f83329e9-bdca-4e43-8563-a0f41f78a3c5", "target_id": "B1-control", "git_sha": "f299b7d601319f0b1a7d749b45530710fb9828f6", "pre_experiment_sha": "16a5d7069b1b27b9a083ff5b570d11fde84e28c0", "timestamp": "2026-04-24T00:56:53.215720+00:00", "hypothesis": "Adding the strict modal \"must\" to the specificity requirement creates a parallel mandate with the formatting rules, anchoring the model's focus to reduce semantic drift and improve category selection accuracy.", "hypothesis_source": "agent", "mutation_diff_summary": "", "score": 2.3, "score_ci_lower": 2.1, "score_ci_upper": 2.5, "raw_scores": [2.0, 2.0, 2.5, 2.5, 2.5], "baseline_score": 2.5, "outcome": "KEPT", "failure_mode": null, "duration_seconds": 153.73106641694903, "tags": ["strict-mandate", "semantic-drift-reduction", "precision"], "learnings": "{\"what_changed\":\"\",\"what_improved\":[],\"what_regressed\":[],\"transferable_insight\":\"Using strict modal verbs like 'must' to enforce constraints creates a strong mandate that anchors attention, reduces semantic drift, and improves task accuracy.\",\"domain_tags\":[\"Prompt Engineering\",\"Linguistics\",\"Instruction Tuning\"]}", "cost_usd": 0.006698500000000001, "bootstrap_seed": 0, "agent_model": "gemini-3.1-pro-preview", "held_out_score": null, "criterion_names": ["correct_category", "concise_output", "follows_format", "no_hallucination", "handles_ambiguity"], "per_criterion_scores": {"correct_category": 0.1, "concise_output": 1.0, "follows_format": 0.0, "no_hallucination": 0.2, "handles_ambiguity": 1.0}, "failure_classification": null, "drafts_generated": 1, "drafts_survived": 1}
{"id": "8a5c71f9-7c6c-47e7-9679-b58671e6f210", "target_id": "B1-control", "git_sha": "1410dbeb68f39f1071d8ffd6e15b98b00a528608", "pre_experiment_sha": "f299b7d601319f0b1a7d749b45530710fb9828f6", "timestamp": "2026-04-24T00:58:12.733970+00:00", "hypothesis": "Reverting the specificity requirement to \"Select the single most specific category\" removes the redundant modal verb, making the command more direct and concise to recover previous high scores and reduce semantic drift.", "hypothesis_source": "agent", "mutation_diff_summary": "", "score": 2.7, "score_ci_lower": 2.3, "score_ci_upper": 3.0, "raw_scores": [2.0, 3.0, 3.0, 2.5, 3.0], "baseline_score": 2.3, "outcome": "KEPT", "failure_mode": null, "duration_seconds": 72.62106570787728, "tags": ["conciseness", "semantic-drift-reduction", "direct-command"], "learnings": "{\"what_changed\":\"\",\"what_improved\":[],\"what_regressed\":[],\"transferable_insight\":\"Removing redundant modal verbs in favor of direct, imperative commands improves instruction clarity and reduces semantic drift.\",\"domain_tags\":[\"Prompt Engineering\",\"Instruction Design\",\"Linguistics\"]}", "cost_usd": 0.0065178000000000015, "bootstrap_seed": 0, "agent_model": "gemini-3.1-pro-preview", "held_out_score": null, "criterion_names": ["correct_category", "concise_output", "follows_format", "no_hallucination", "handles_ambiguity"], "per_criterion_scores": {"correct_category": 0.2, "concise_output": 1.0, "follows_format": 0.1, "no_hallucination": 0.4, "handles_ambiguity": 1.0}, "failure_classification": null, "drafts_generated": 1, "drafts_survived": 1}
{"id": "f32ba8ca-087b-42f8-9ac1-9b23c9264e6c", "target_id": "B1-control", "git_sha": "897cfcac5a37078f5156cdb5a7d17de15aa5b5f5", "pre_experiment_sha": "1410dbeb68f39f1071d8ffd6e15b98b00a528608", "timestamp": "2026-04-24T00:59:49.322928+00:00", "hypothesis": "Changing the formatting header from singular \"CRITICAL INSTRUCTION:\" to plural \"CRITICAL INSTRUCTIONS:\" accurately reflects the multiple formatting mandates that follow, triggering a stochastic re-evaluation while strictly preserving the proven constraints.", "hypothesis_source": "agent", "mutation_diff_summary": "", "score": 2.7, "score_ci_lower": 2.3, "score_ci_upper": 3.0, "raw_scores": [3.0, 2.5, 3.0, 2.0, 3.0], "baseline_score": 2.7, "outcome": "KEPT", "failure_mode": null, "duration_seconds": 75.92479616682976, "tags": ["grammar", "stochastic-retry", "strict-formatting"], "learnings": "{\"what_changed\":\"\",\"what_improved\":[\"no_hallucination: PASS (was FAIL)\"],\"what_regressed\":[],\"transferable_insight\":\"Aligning the plurality of a section header with the actual quantity of the items it introduces improves system comprehension and reduces processing errors.\",\"domain_tags\":[\"Prompt Engineering\",\"Linguistics\",\"Instruction Formatting\"]}", "cost_usd": 0.006582800000000001, "bootstrap_seed": 0, "agent_model": "gemini-3.1-pro-preview", "held_out_score": null, "criterion_names": ["correct_category", "concise_output", "follows_format", "no_hallucination", "handles_ambiguity"], "per_criterion_scores": {"correct_category": 0.1, "concise_output": 1.0, "follows_format": 0.0, "no_hallucination": 0.6, "handles_ambiguity": 1.0}, "failure_classification": null, "drafts_generated": 1, "drafts_survived": 1}
{"id": "1f601938-1260-411e-9b22-fc3e7869e925", "target_id": "B1-control", "git_sha": "42e06ef994692ee57be4234194add7ae9614e5fd", "pre_experiment_sha": "897cfcac5a37078f5156cdb5a7d17de15aa5b5f5", "timestamp": "2026-04-24T01:01:26.009421+00:00", "hypothesis": "Replacing \"exactly\" with \"strictly\" in the final sentence avoids word repetition and reinforces the exact-match constraint for the category name, aiming to reduce semantic drift and improve formatting adherence.", "hypothesis_source": "agent", "mutation_diff_summary": "", "score": 2.6, "score_ci_lower": 2.3, "score_ci_upper": 2.9, "raw_scores": [2.5, 2.5, 2.0, 3.0, 3.0], "baseline_score": 2.7, "outcome": "KEPT", "failure_mode": null, "duration_seconds": 89.5385787920095, "tags": ["strict-formatting", "semantic-drift-reduction", "lexical-variety"], "learnings": "{\"what_changed\":\"\",\"what_improved\":[],\"what_regressed\":[\"no_hallucination: FAIL (was PASS)\"],\"transferable_insight\":\"Prioritizing stylistic variation over precise instructional keywords by swapping 'exactly' for synonyms like 'strictly' can degrade an LLM's adherence to literal-match constraints and trigger hallucinations.\",\"domain_tags\":[\"Prompt Engineering\",\"Constraint Enforcement\",\"Hallucination Mitigation\"]}", "cost_usd": 0.006576550000000001, "bootstrap_seed": 0, "agent_model": "gemini-3.1-pro-preview", "held_out_score": null, "criterion_names": ["correct_category", "concise_output", "follows_format", "no_hallucination", "handles_ambiguity"], "per_criterion_scores": {"correct_category": 0.3, "concise_output": 1.0, "follows_format": 0.2, "no_hallucination": 0.1, "handles_ambiguity": 1.0}, "failure_classification": null, "drafts_generated": 1, "drafts_survived": 1}
{"id": "bcc99580-1328-4c92-9798-0d5f3dcfd663", "target_id": "B1-control", "git_sha": "42e06ef994692ee57be4234194add7ae9614e5fd", "pre_experiment_sha": "42e06ef994692ee57be4234194add7ae9614e5fd", "timestamp": "2026-04-24T01:02:34.131787+00:00", "hypothesis": "Reverting \"strictly\" back to \"exactly\" in the final instruction restores the precise instructional keyword proven to enforce literal-match constraints and reduce hallucinations.", "hypothesis_source": "agent", "mutation_diff_summary": "", "score": 2.2, "score_ci_lower": 2.0, "score_ci_upper": 2.4, "raw_scores": [2.0, 2.0, 2.0, 2.5, 2.5], "baseline_score": 2.6, "outcome": "DISCARDED", "failure_mode": null, "duration_seconds": 61.688518167007715, "tags": ["revert", "constraint-enforcement", "exact-match"], "learnings": "{\"what_changed\":\"\",\"what_improved\":[],\"what_regressed\":[],\"transferable_insight\":\"Using 'strictly' rather than 'exactly' as a constraint modifier is more effective for enforcing precise adherence and reducing deviations.\",\"domain_tags\":[\"Prompt Engineering\",\"Constraint Satisfaction\",\"Keyword Optimization\"]}", "cost_usd": 0.006733650000000001, "bootstrap_seed": 0, "agent_model": "gemini-3.1-pro-preview", "held_out_score": null, "criterion_names": ["correct_category", "concise_output", "follows_format", "no_hallucination", "handles_ambiguity"], "per_criterion_scores": {"correct_category": 0.0, "concise_output": 1.0, "follows_format": 0.0, "no_hallucination": 0.2, "handles_ambiguity": 1.0}, "failure_classification": {"category": "semantic_drift", "description": "The experiment aimed to restore the precise enforcement of literal-match constraints and reduced hallucinations by reverting to the 'exactly' keyword. The failure indicates that the model did not interpret 'exactly' with the desired level of precision or strength, resulting in outputs that still failed to meet the literal-match constraints or contained hallucinations. The semantic intent of the keyword was not effectively translated into the desired model behavior, leading to a drift from the expected meaning.", "fix_direction": "1. **Strengthen Instruction Clarity:** Experiment with more explicit and unambiguous phrasing beyond single keywords to ensure strict adherence, e.g., 'Respond verbatim, precisely as requested, with no deviations or additions.' 2. **Provide Few-Shot Examples:** Illustrate the desired literal-match behavior with concrete input-output examples to guide the model's interpretation. 3. **Evaluate Alternative Constraint Keywords/Methods:** Explore other instruction methodologies or keywords that might be more robust in enforcing strict output constraints for the specific model, potentially involving negative constraints ('Do not generate anything else').", "confidence": 0.9}, "drafts_generated": 1, "drafts_survived": 1}
{"id": "00008f71-f436-4c82-9792-82a35ed26230", "target_id": "B1-control", "git_sha": "42e06ef994692ee57be4234194add7ae9614e5fd", "pre_experiment_sha": "42e06ef994692ee57be4234194add7ae9614e5fd", "timestamp": "2026-04-24T01:04:43.248268+00:00", "hypothesis": "Reverting to the singular \"CRITICAL INSTRUCTION:\" and restoring the keyword \"exactly\" in the final sentence complies with literal-match constraints to reduce hallucinations and trigger a stochastic retry.", "hypothesis_source": "agent", "mutation_diff_summary": "", "score": 2.5, "score_ci_lower": 2.2, "score_ci_upper": 2.8, "raw_scores": [3.0, 2.0, 2.5, 2.5, 2.5], "baseline_score": 2.6, "outcome": "DISCARDED", "failure_mode": null, "duration_seconds": 87.064003250096, "tags": ["constraint-enforcement", "exact-match", "stochastic-retry"], "learnings": "{\"what_changed\":\"\",\"what_improved\":[\"no_hallucination: PASS (was FAIL)\"],\"what_regressed\":[],\"transferable_insight\":\"While enforcing strict literal-match constraints and singular imperative directives effectively reduces hallucinations, it can degrade overall system performance by over-constraining the output.\",\"domain_tags\":[\"Prompt Engineering\",\"Constraint Satisfaction\",\"Hallucination Mitigation\"]}", "cost_usd": 0.006826150000000001, "bootstrap_seed": 0, "agent_model": "gemini-3.1-pro-preview", "held_out_score": null, "criterion_names": ["correct_category", "concise_output", "follows_format", "no_hallucination", "handles_ambiguity"], "per_criterion_scores": {"correct_category": 0.1, "concise_output": 1.0, "follows_format": 0.0, "no_hallucination": 0.5, "handles_ambiguity": 0.9}, "failure_classification": {"category": "semantic_drift", "description": "The experiment aimed to improve semantic adherence by making instructions more emphatic ('CRITICAL INSTRUCTION:') and precise ('exactly') to reduce hallucinations and ensure literal matches. The low score of 2.5 indicates that these changes did not effectively achieve their goal. The model's output likely still suffered from semantic inaccuracies (hallucinations) or failed to adhere to the specific meaning and literal requirements of the instructions, suggesting a failure to instill the desired semantic control.", "fix_direction": "Instead of relying solely on emphatic phrasing and keywords, explore alternative methods to guide the model's semantic understanding and adherence. This could include providing more explicit examples (few-shot learning), breaking down complex constraints into simpler steps, or using more structured output formats to inherently limit semantic ambiguity. Also, investigate whether the prompt structure or choice of keywords might be inadvertently causing misinterpretation or leading to unintended semantic deviations.", "confidence": 0.9}, "drafts_generated": 1, "drafts_survived": 1}
{"id": "bdf71a34-4b8e-4fc6-903a-571eef923b7f", "target_id": "B1-control", "git_sha": "225772ef08b18827f170309d873430a20889d71b", "pre_experiment_sha": "42e06ef994692ee57be4234194add7ae9614e5fd", "timestamp": "2026-04-24T01:06:24.960601+00:00", "hypothesis": "Restoring the precise keyword 'exactly' in the final output instruction complies strictly with the negative constraints, reinforcing literal-match requirements to reduce semantic drift and improve formatting adherence.", "hypothesis_source": "agent", "mutation_diff_summary": "", "score": 2.5, "score_ci_lower": 2.2, "score_ci_upper": 2.8, "raw_scores": [2.5, 2.5, 2.5, 3.0, 2.0], "baseline_score": 2.6, "outcome": "KEPT", "failure_mode": null, "duration_seconds": 82.12374333385378, "tags": ["constraint-enforcement", "exact-match", "semantic-drift-reduction"], "learnings": "{\"what_changed\":\"\",\"what_improved\":[],\"what_regressed\":[\"no_hallucination: FAIL (was PASS)\"],\"transferable_insight\":\"Over-constraining output instructions with absolute terms like 'exactly' to enforce literal matching can inadvertently increase hallucinations, as the system may prioritize rigid structural compliance over factual accuracy.\",\"domain_tags\":[\"Prompt Engineering\",\"Constraint Satisfaction\",\"Hallucination Mitigation\"]}", "cost_usd": 0.00669655, "bootstrap_seed": 0, "agent_model": "gemini-3.1-pro-preview", "held_out_score": null, "criterion_names": ["correct_category", "concise_output", "follows_format", "no_hallucination", "handles_ambiguity"], "per_criterion_scores": {"correct_category": 0.1, "concise_output": 1.0, "follows_format": 0.0, "no_hallucination": 0.4, "handles_ambiguity": 1.0}, "failure_classification": null, "drafts_generated": 1, "drafts_survived": 1}
