{"id": "dab2eb43-90bc-4b43-b1a4-4bfbcb375f73", "target_id": "B1-control", "git_sha": "b46f1e2cb007f81b9943c117cd01e60aa3dbda85", "pre_experiment_sha": "5dfe45eb4ac0661a092592261f260a8e9a09be3f", "timestamp": "2026-04-22T02:42:55.116063+00:00", "hypothesis": "Instructing the model to output exactly and only the chosen category name without any explanations or extra text will align the output with strict exact-match evaluation criteria.", "hypothesis_source": "agent", "mutation_diff_summary": "", "score": 2.5, "score_ci_lower": 2.5, "score_ci_upper": 2.5, "raw_scores": [2.5, 2.5, 2.5, 2.5, 2.5], "baseline_score": 0.0, "outcome": "KEPT", "failure_mode": null, "duration_seconds": 84.08889712509699, "tags": ["prompt-engineering", "strict-formatting", "exact-match"], "learnings": "{\"what_changed\":\"\",\"what_improved\":[],\"what_regressed\":[],\"transferable_insight\":\"Constraining model outputs to exact target values by explicitly forbidding explanations or extra text significantly improves performance on strict exact-match evaluations.\",\"domain_tags\":[\"Prompt Engineering\",\"Output Formatting\",\"Evaluation Alignment\"]}", "cost_usd": 0.0036628, "bootstrap_seed": 0, "agent_model": "gemini-3.1-pro-preview", "held_out_score": null, "criterion_names": ["correct_category", "concise_output", "follows_format", "no_hallucination", "handles_ambiguity"], "per_criterion_scores": {"correct_category": 0.3, "concise_output": 1.0, "follows_format": 0.0, "no_hallucination": 0.2, "handles_ambiguity": 1.0}, "failure_classification": null, "drafts_generated": 1, "drafts_survived": 1}
{"id": "1a0df6d4-3cf0-439e-b6f3-ab181e8f7f1c", "target_id": "B1-control", "git_sha": "b46f1e2cb007f81b9943c117cd01e60aa3dbda85", "pre_experiment_sha": "b46f1e2cb007f81b9943c117cd01e60aa3dbda85", "timestamp": "2026-04-22T02:44:19.577739+00:00", "hypothesis": "Structuring the prompt with clear headings and explicit output rules to prevent markdown formatting and conversational filler will improve classification accuracy and exact-match parsing.", "hypothesis_source": "agent", "mutation_diff_summary": "", "score": 2.6, "score_ci_lower": 2.1, "score_ci_upper": 3.1, "raw_scores": [2.0, 2.0, 3.5, 3.0, 2.5], "baseline_score": 2.5, "outcome": "DISCARDED", "failure_mode": null, "duration_seconds": 77.61706245900132, "tags": ["prompt-engineering", "structure", "formatting-rules"], "learnings": "{\"what_changed\":\"\",\"what_improved\":[],\"what_regressed\":[],\"transferable_insight\":\"Structuring prompts with clear headings and explicit negative constraints against formatting filler provides insufficient performance gains to justify the added complexity.\",\"domain_tags\":[\"Prompt Engineering\",\"Output Formatting\",\"Constraint Satisfaction\"]}", "cost_usd": 0.0038024000000000005, "bootstrap_seed": 0, "agent_model": "gemini-3.1-pro-preview", "held_out_score": null, "criterion_names": ["correct_category", "concise_output", "follows_format", "no_hallucination", "handles_ambiguity"], "per_criterion_scores": {"correct_category": 0.1, "concise_output": 1.0, "follows_format": 0.0, "no_hallucination": 0.5, "handles_ambiguity": 1.0}, "failure_classification": {"category": "output_format", "description": "The prompt structuring intended to prevent markdown formatting and conversational filler, and enforce explicit output rules, failed. This suggests the model likely still produced unwanted formatting or conversational text, leading to poor exact-match parsing and classification accuracy.", "fix_direction": "Refine and strengthen explicit output rules, potentially using negative constraints, few-shot examples of the desired format, or different phrasing to strictly enforce output structure and content. Consider multi-turn prompting or validation steps.", "confidence": 0.95}, "drafts_generated": 1, "drafts_survived": 1}
{"id": "6ce4024c-45bd-4c21-b92c-538e8a031ba2", "target_id": "B1-control", "git_sha": "b46f1e2cb007f81b9943c117cd01e60aa3dbda85", "pre_experiment_sha": "b46f1e2cb007f81b9943c117cd01e60aa3dbda85", "timestamp": "2026-04-22T02:45:43.993582+00:00", "hypothesis": "Structure the prompt with clear steps and add stricter output constraints to prevent the inclusion of quotes, punctuation, or reasoning, ensuring an exact string match.", "hypothesis_source": "agent", "mutation_diff_summary": "", "score": 2.3, "score_ci_lower": 2.1, "score_ci_upper": 2.5, "raw_scores": [2.5, 2.0, 2.5, 2.5, 2.0], "baseline_score": 2.5, "outcome": "DISCARDED", "failure_mode": null, "duration_seconds": 65.69083245797083, "tags": ["structured", "strict-formatting", "step-by-step"], "learnings": "{\"what_changed\":\"\",\"what_improved\":[],\"what_regressed\":[],\"transferable_insight\":\"Enforcing overly strict output constraints, such as prohibiting reasoning or punctuation to achieve exact string matches, can negatively impact model performance.\",\"domain_tags\":[\"Prompt Engineering\",\"Output Formatting\",\"Constraint Management\"]}", "cost_usd": 0.0035813000000000004, "bootstrap_seed": 0, "agent_model": "gemini-3.1-pro-preview", "held_out_score": null, "criterion_names": ["correct_category", "concise_output", "follows_format", "no_hallucination", "handles_ambiguity"], "per_criterion_scores": {"correct_category": 0.1, "concise_output": 1.0, "follows_format": 0.0, "no_hallucination": 0.2, "handles_ambiguity": 1.0}, "failure_classification": {"category": "output_format", "description": "The experiment failed to enforce the strict output constraints specified in the hypothesis, resulting in the inclusion of quotes, punctuation, or reasoning, which prevented an exact string match.", "fix_direction": "Further refine the prompt's output constraints using clearer directives, stronger negative constraints, or possibly a different prompt engineering technique to ensure absolute adherence to the desired exact string format.", "confidence": 0.95}, "drafts_generated": 1, "drafts_survived": 1}
{"id": "9ab1cd9b-809c-499d-834e-d36f517319d3", "target_id": "B1-control", "git_sha": "b46f1e2cb007f81b9943c117cd01e60aa3dbda85", "pre_experiment_sha": "b46f1e2cb007f81b9943c117cd01e60aa3dbda85", "timestamp": "2026-04-22T02:47:12.942220+00:00", "hypothesis": "Simplify the prompt to a single paragraph with direct instructions, removing complex headings and overly detailed negative constraints.", "hypothesis_source": "agent", "mutation_diff_summary": "", "score": 2.3, "score_ci_lower": 2.0, "score_ci_upper": 2.7, "raw_scores": [2.0, 2.0, 2.5, 3.0, 2.0], "baseline_score": 2.5, "outcome": "DISCARDED", "failure_mode": null, "duration_seconds": 65.11786812497303, "tags": ["simplification", "direct-instruction"], "learnings": "{\"what_changed\":\"\",\"what_improved\":[],\"what_regressed\":[],\"transferable_insight\":\"Removing structural formatting and detailed negative constraints in favor of a single condensed paragraph degrades performance, highlighting the importance of explicit boundaries and organized instructions for complex tasks.\",\"domain_tags\":[\"Prompt Engineering\",\"Instruction Formatting\",\"Constraint Management\"]}", "cost_usd": 0.0026325000000000003, "bootstrap_seed": 0, "agent_model": "gemini-3.1-pro-preview", "held_out_score": null, "criterion_names": ["correct_category", "concise_output", "follows_format", "no_hallucination", "handles_ambiguity"], "per_criterion_scores": {"correct_category": 0.0, "concise_output": 1.0, "follows_format": 0.0, "no_hallucination": 0.3, "handles_ambiguity": 1.0}, "failure_classification": {"category": "semantic_drift", "description": "Simplifying the prompt by removing complex headings and detailed negative constraints likely led to a loss of crucial context or specific guidance. This caused the model to misinterpret the full scope or precise requirements of the task, resulting in output that did not align with the intended meaning or desired quality, despite potentially following a basic instruction.", "fix_direction": "Re-evaluate which 'complex headings' or 'overly detailed negative constraints' were actually critical for guiding the model's understanding and precise execution. Reintroduce necessary structural cues and specific, non-redundant constraints in a clear and concise manner to restore semantic alignment without adding unnecessary verbosity. Aim for a balance between simplicity and essential instructional clarity.", "confidence": 0.9}, "drafts_generated": 1, "drafts_survived": 1}
{"id": "a646e56f-2301-4c53-8343-2660f3f2dda5", "target_id": "B1-control", "git_sha": "b46f1e2cb007f81b9943c117cd01e60aa3dbda85", "pre_experiment_sha": "b46f1e2cb007f81b9943c117cd01e60aa3dbda85", "timestamp": "2026-04-22T02:48:38.141177+00:00", "hypothesis": "Simplify the prompt to use extremely direct instructions without headings, markdown formatting, or overly detailed negative constraints to ensure strict exact-match outputs.", "hypothesis_source": "agent", "mutation_diff_summary": "", "score": 2.3, "score_ci_lower": 2.1, "score_ci_upper": 2.5, "raw_scores": [2.5, 2.0, 2.5, 2.5, 2.0], "baseline_score": 2.5, "outcome": "DISCARDED", "failure_mode": null, "duration_seconds": 68.1877056658268, "tags": ["simplification", "direct-instructions", "formatting-removal"], "learnings": "{\"what_changed\":\"\",\"what_improved\":[],\"what_regressed\":[],\"transferable_insight\":\"Stripping structural formatting and detailed negative constraints from instructions degrades rather than improves a system's ability to produce strict, exact-match outputs.\",\"domain_tags\":[\"Prompt Engineering\",\"Instruction Design\",\"Output Formatting\"]}", "cost_usd": 0.0027510000000000004, "bootstrap_seed": 0, "agent_model": "gemini-3.1-pro-preview", "held_out_score": null, "criterion_names": ["correct_category", "concise_output", "follows_format", "no_hallucination", "handles_ambiguity"], "per_criterion_scores": {"correct_category": 0.2, "concise_output": 1.0, "follows_format": 0.0, "no_hallucination": 0.1, "handles_ambiguity": 1.0}, "failure_classification": {"category": "semantic_drift", "description": "The experiment's attempt to simplify the prompt by removing formatting, headings, and detailed negative constraints inadvertently stripped away crucial contextual cues and constraints. This caused the model to misinterpret or deprioritize the strictness required for 'exact-match outputs', leading to generated content that was semantically related but not literally identical to the target, thus failing the exact-match criterion (score 2.3).", "fix_direction": "Reintroduce elements that explicitly and unambiguously reinforce the 'strict exact-match' requirement. This could involve using specific delimiters, concrete examples of the desired exact output, or carefully crafted negative constraints that guide the model towards literal adherence rather than general understanding, ensuring the prompt's structure supports the exactness intent.", "confidence": 0.9}, "drafts_generated": 1, "drafts_survived": 1}
{"id": "cfb85df3-f4a9-4df1-8312-008b9712c92e", "target_id": "B1-control", "git_sha": "a8ec4b16b75961d75473476ebcedcabf3d8ae064", "pre_experiment_sha": "b46f1e2cb007f81b9943c117cd01e60aa3dbda85", "timestamp": "2026-04-22T02:50:08.495364+00:00", "hypothesis": "Simplify the prompt to use straightforward, unformatted instructions and remove conversational filler to ensure strict exact-match output.", "hypothesis_source": "agent", "mutation_diff_summary": "", "score": 2.7, "score_ci_lower": 2.5, "score_ci_upper": 2.9, "raw_scores": [2.5, 2.5, 3.0, 3.0, 2.5], "baseline_score": 2.5, "outcome": "KEPT", "failure_mode": null, "duration_seconds": 65.42463516700082, "tags": ["simplification", "formatting", "direct-instruction"], "learnings": "{\"what_changed\":\"\",\"what_improved\":[],\"what_regressed\":[],\"transferable_insight\":\"Eliminating conversational filler and complex formatting in favor of straightforward instructions significantly improves adherence to strict, exact-match output constraints.\",\"domain_tags\":[\"Prompt Engineering\",\"Instruction Following\",\"Output Formatting\"]}", "cost_usd": 0.0025803, "bootstrap_seed": 0, "agent_model": "gemini-3.1-pro-preview", "held_out_score": null, "criterion_names": ["correct_category", "concise_output", "follows_format", "no_hallucination", "handles_ambiguity"], "per_criterion_scores": {"correct_category": 0.2, "concise_output": 1.0, "follows_format": 0.2, "no_hallucination": 0.3, "handles_ambiguity": 1.0}, "failure_classification": null, "drafts_generated": 1, "drafts_survived": 1}
{"id": "5c015549-3f53-41b0-8c36-1a6032eca6ee", "target_id": "B1-control", "git_sha": "a8ec4b16b75961d75473476ebcedcabf3d8ae064", "pre_experiment_sha": "a8ec4b16b75961d75473476ebcedcabf3d8ae064", "timestamp": "2026-04-22T02:51:40.514326+00:00", "hypothesis": "Expand the prompt into two paragraphs to provide adequate task context while maintaining the exact, unformatted output constraint, avoiding the over-simplification that causes semantic drift.", "hypothesis_source": "agent", "mutation_diff_summary": "", "score": 2.6, "score_ci_lower": 2.5, "score_ci_upper": 2.8, "raw_scores": [2.5, 2.5, 2.5, 2.5, 3.0], "baseline_score": 2.7, "outcome": "DISCARDED", "failure_mode": null, "duration_seconds": 70.85247633280233, "tags": ["context-expansion", "output-constraint"], "learnings": "{\"what_changed\":\"\",\"what_improved\":[],\"what_regressed\":[],\"transferable_insight\":\"Increasing instruction length to provide additional context can negatively impact performance, particularly when strict output constraints must be maintained.\",\"domain_tags\":[\"Prompt Engineering\",\"Context Management\",\"Instruction Tuning\"]}", "cost_usd": 0.0029563000000000002, "bootstrap_seed": 0, "agent_model": "gemini-3.1-pro-preview", "held_out_score": null, "criterion_names": ["correct_category", "concise_output", "follows_format", "no_hallucination", "handles_ambiguity"], "per_criterion_scores": {"correct_category": 0.3, "concise_output": 1.0, "follows_format": 0.0, "no_hallucination": 0.3, "handles_ambiguity": 1.0}, "failure_classification": {"category": "semantic_drift", "description": "The experiment aimed to expand the prompt to provide adequate context and prevent semantic drift caused by over-simplification. However, despite the expansion, the model's output still suffered from incorrect meaning or misinterpretation of the task, indicating that the added context was either insufficient, misleading, or ineffective in preventing the underlying semantic drift.", "fix_direction": "Refine the additional context to be more precise, unambiguous, and directly relevant to preventing specific types of semantic drift. Consider using more structured language, negative constraints, or few-shot examples within the expanded prompt to guide the model's understanding more effectively, ensuring it accurately grasps the task's nuances without over-simplifying or misinterpreting.", "confidence": 0.9}, "drafts_generated": 1, "drafts_survived": 1}
{"id": "b1c37c7c-27ba-4d9b-b231-f7bdeefae658", "target_id": "B1-control", "git_sha": "a8ec4b16b75961d75473476ebcedcabf3d8ae064", "pre_experiment_sha": "a8ec4b16b75961d75473476ebcedcabf3d8ae064", "timestamp": "2026-04-22T02:53:19.729610+00:00", "hypothesis": "Expand the prompt into multiple paragraphs to provide adequate task context and prevent semantic drift, while maintaining the exact output constraint without complex formatting.", "hypothesis_source": "agent", "mutation_diff_summary": "", "score": 2.4, "score_ci_lower": 2.2, "score_ci_upper": 2.5, "raw_scores": [2.5, 2.5, 2.0, 2.5, 2.5], "baseline_score": 2.7, "outcome": "DISCARDED", "failure_mode": null, "duration_seconds": 75.44449883303605, "tags": ["context-expansion", "multi-paragraph", "unformatted-output-constraint"], "learnings": "{\"what_changed\":\"\",\"what_improved\":[],\"what_regressed\":[],\"transferable_insight\":\"Expanding instructions into multiple paragraphs to provide additional context can inadvertently dilute focus and degrade adherence to strict output constraints.\",\"domain_tags\":[\"Prompt Engineering\",\"Instruction Formatting\",\"Context Management\"]}", "cost_usd": 0.0031522, "bootstrap_seed": 0, "agent_model": "gemini-3.1-pro-preview", "held_out_score": null, "criterion_names": ["correct_category", "concise_output", "follows_format", "no_hallucination", "handles_ambiguity"], "per_criterion_scores": {"correct_category": 0.1, "concise_output": 1.0, "follows_format": 0.0, "no_hallucination": 0.3, "handles_ambiguity": 1.0}, "failure_classification": {"category": "semantic_drift", "description": "The experiment's primary goal was to prevent semantic drift by expanding the prompt with more context. The low score suggests that this attempt was unsuccessful; the expanded prompt likely failed to adequately clarify the task context or inadvertently introduced new ambiguities, resulting in output that may have adhered to format constraints but conveyed an incorrect meaning or interpretation of the task.", "fix_direction": "Refine the additional paragraphs to ensure utmost clarity and conciseness, explicitly guiding the model's understanding of the task without introducing conflicting information or overwhelming it. Consider how the expanded context interacts with existing instructions, especially output constraints.", "confidence": 0.85}, "drafts_generated": 1, "drafts_survived": 1}
{"id": "57ca1c38-f350-4fbc-898c-97b5ffd32c7c", "target_id": "B1-control", "git_sha": "a8ec4b16b75961d75473476ebcedcabf3d8ae064", "pre_experiment_sha": "a8ec4b16b75961d75473476ebcedcabf3d8ae064", "timestamp": "2026-04-22T02:54:57.218910+00:00", "hypothesis": "Expand the system prompt into multiple paragraphs to provide adequate task context and classification guidelines without using complex formatting, while keeping the output constraint exact and unformatted.", "hypothesis_source": "agent", "mutation_diff_summary": "", "score": 2.4, "score_ci_lower": 2.2, "score_ci_upper": 2.5, "raw_scores": [2.5, 2.5, 2.0, 2.5, 2.5], "baseline_score": 2.7, "outcome": "DISCARDED", "failure_mode": null, "duration_seconds": 69.50944916694425, "tags": ["b1", "classification", "context-expansion"], "learnings": "{\"what_changed\":\"\",\"what_improved\":[],\"what_regressed\":[],\"transferable_insight\":\"Removing structural formatting in favor of dense, multi-paragraph text degrades instruction adherence, as models process structured guidelines more effectively than continuous prose.\",\"domain_tags\":[\"Prompt Engineering\",\"Instruction Formatting\",\"LLM Optimization\"]}", "cost_usd": 0.0030494000000000003, "bootstrap_seed": 0, "agent_model": "gemini-3.1-pro-preview", "held_out_score": null, "criterion_names": ["correct_category", "concise_output", "follows_format", "no_hallucination", "handles_ambiguity"], "per_criterion_scores": {"correct_category": 0.0, "concise_output": 1.0, "follows_format": 0.0, "no_hallucination": 0.4, "handles_ambiguity": 1.0}, "failure_classification": {"category": "output_format", "description": "The expansion of the system prompt, despite being unformatted itself, likely caused the model to deviate from its required 'exact and unformatted' output constraint. The additional paragraphs may have inadvertently diluted the clarity or prominence of the output format instruction, leading the model to add unexpected formatting (e.g., markdown, extra lines, or structure) to its response.", "fix_direction": "Reinforce the output format instruction within the expanded prompt. Consider reiterating the exact output constraint in a clear, distinct section (e.g., at the very end or beginning) or using specific delimiters to emphasize it, ensuring it stands out amidst the expanded context.", "confidence": 0.9}, "drafts_generated": 1, "drafts_survived": 1}
