{"id": "8e97cad6-51c5-4f0d-9296-5bb02b7617f0", "target_id": "B1-control", "git_sha": "a8ec4b16b75961d75473476ebcedcabf3d8ae064", "pre_experiment_sha": "a8ec4b16b75961d75473476ebcedcabf3d8ae064", "timestamp": "2026-04-22T02:56:41.367999+00:00", "hypothesis": "Adding the word \"expert\" to the persona enhances the model's accuracy while strictly maintaining the unformatted structure and exact output constraints recommended.", "hypothesis_source": "agent", "mutation_diff_summary": "", "score": 2.4, "score_ci_lower": 2.1, "score_ci_upper": 2.7, "raw_scores": [2.5, 3.0, 2.0, 2.0, 2.5], "baseline_score": 2.7, "outcome": "DISCARDED", "failure_mode": null, "duration_seconds": 72.47682400001213, "tags": ["prompt-engineering", "persona-tuning"], "learnings": "{\"what_changed\":\"\",\"what_improved\":[],\"what_regressed\":[],\"transferable_insight\":\"Explicitly labeling a persona as an 'expert' does not inherently improve accuracy and can negatively impact performance when strict adherence to formatting constraints is required.\",\"domain_tags\":[\"Prompt Engineering\",\"Persona Design\",\"Constraint Satisfaction\"]}", "cost_usd": 0.0027319, "bootstrap_seed": 0, "agent_model": "gemini-3.1-pro-preview", "held_out_score": null, "criterion_names": ["correct_category", "concise_output", "follows_format", "no_hallucination", "handles_ambiguity"], "per_criterion_scores": {"correct_category": 0.2, "concise_output": 1.0, "follows_format": 0.0, "no_hallucination": 0.2, "handles_ambiguity": 1.0}, "failure_classification": {"category": "output_format", "description": "The addition of 'expert' to the persona, while intended to improve accuracy, likely caused the model to violate the 'strictly maintaining the unformatted structure and exact output constraints' requirement. The very low score (2.4) strongly suggests that the evaluation system failed to parse the output due to format/structure deviations, rather than just a drop in content accuracy. The model might have interpreted 'expert' as a directive to add conversational filler, explanations, or adopt a different stylistic output that broke the specified constraints.", "fix_direction": "Reinforce strict output formatting instructions, potentially at a higher precedence than the persona modifications. Experiment with phrasing the 'expert' persona to focus on content quality and reasoning without affecting the output structure (e.g., 'respond as an expert, ensuring the output is always unformatted and adheres strictly to X, Y, Z constraints'). If possible, analyze samples of the failed outputs to confirm the exact nature of the format violation.", "confidence": 0.9}, "drafts_generated": 1, "drafts_survived": 1}
{"id": "306639c4-f91b-45ed-9b6c-551eeb611e17", "target_id": "B1-control", "git_sha": "a8ec4b16b75961d75473476ebcedcabf3d8ae064", "pre_experiment_sha": "a8ec4b16b75961d75473476ebcedcabf3d8ae064", "timestamp": "2026-04-22T02:58:09.238576+00:00", "hypothesis": "Adding \"expert\" to the persona to encourage more accurate classification while maintaining the exact recommended output constraint.", "hypothesis_source": "agent", "mutation_diff_summary": "", "score": 2.3, "score_ci_lower": 2.1, "score_ci_upper": 2.5, "raw_scores": [2.0, 2.0, 2.5, 2.5, 2.5], "baseline_score": 2.7, "outcome": "DISCARDED", "failure_mode": null, "duration_seconds": 71.98542941710912, "tags": ["persona", "minor-tweak"], "learnings": "{\"what_changed\":\"\",\"what_improved\":[],\"what_regressed\":[],\"transferable_insight\":\"Assigning an 'expert' persona does not inherently improve accuracy and can actually degrade performance, particularly when strict output formatting constraints are already enforced.\",\"domain_tags\":[\"Prompt Engineering\",\"Persona Prompting\",\"Output Constraints\"]}", "cost_usd": 0.0025935000000000003, "bootstrap_seed": 0, "agent_model": "gemini-3.1-pro-preview", "held_out_score": null, "criterion_names": ["correct_category", "concise_output", "follows_format", "no_hallucination", "handles_ambiguity"], "per_criterion_scores": {"correct_category": 0.2, "concise_output": 1.0, "follows_format": 0.0, "no_hallucination": 0.1, "handles_ambiguity": 1.0}, "failure_classification": {"category": "semantic_drift", "description": "The experiment aimed to improve classification accuracy by adding an 'expert' persona, while maintaining output format. The low score indicates that the model produced classifications with incorrect meaning or content, failing to achieve the desired accuracy despite the persona attempt. It suggests the 'expert' guidance did not lead to better semantic understanding for the classification task.", "fix_direction": "Explore more robust methods to integrate expert knowledge or reasoning into the model beyond a simple persona keyword. This could involve providing more detailed instructions, specific examples of 'expert' decision-making, or even fine-tuning on expert-labeled data. Also, verify if the output format constraint was indeed fully met.", "confidence": 0.9}, "drafts_generated": 1, "drafts_survived": 1}
{"id": "706e28b7-775b-405a-ad3e-ac7299b991e0", "target_id": "B1-control", "git_sha": "9af422403b4d6ee7263fefdf5f79343bed99dc35", "pre_experiment_sha": "a8ec4b16b75961d75473476ebcedcabf3d8ae064", "timestamp": "2026-04-22T02:59:34.511943+00:00", "hypothesis": "Added \"expert\" to the role description to encourage higher accuracy while strictly maintaining the recommended straightforward output constraint and natural structure.", "hypothesis_source": "agent", "mutation_diff_summary": "", "score": 2.7, "score_ci_lower": 2.5, "score_ci_upper": 3.1, "raw_scores": [2.5, 3.5, 2.5, 2.5, 2.5], "baseline_score": 2.7, "outcome": "KEPT", "failure_mode": null, "duration_seconds": 67.86127941706218, "tags": ["role-prompting", "minimal-change"], "learnings": "{\"what_changed\":\"\",\"what_improved\":[],\"what_regressed\":[],\"transferable_insight\":\"Explicitly assigning an 'expert' persona to a prompt maintains baseline performance without negatively impacting strict output constraints.\",\"domain_tags\":[\"Prompt Engineering\",\"Persona Assignment\",\"Role Prompting\"]}", "cost_usd": 0.00252405, "bootstrap_seed": 0, "agent_model": "gemini-3.1-pro-preview", "held_out_score": null, "criterion_names": ["correct_category", "concise_output", "follows_format", "no_hallucination", "handles_ambiguity"], "per_criterion_scores": {"correct_category": 0.4, "concise_output": 1.0, "follows_format": 0.1, "no_hallucination": 0.2, "handles_ambiguity": 1.0}, "failure_classification": null, "drafts_generated": 1, "drafts_survived": 1}
{"id": "7b7b9a10-3222-4671-9ed8-04c2b037110a", "target_id": "B1-control", "git_sha": "886310bbacb1829d48c75b4eca76594776ff3e57", "pre_experiment_sha": "9af422403b4d6ee7263fefdf5f79343bed99dc35", "timestamp": "2026-04-22T03:00:57.013363+00:00", "hypothesis": "Remove the \"expert\" persona to simplify the prompt and reduce any potential semantic drift while keeping the strict output constraint unchanged.", "hypothesis_source": "agent", "mutation_diff_summary": "", "score": 2.3, "score_ci_lower": 2.0, "score_ci_upper": 2.7, "raw_scores": [3.0, 2.5, 2.0, 2.0, 2.0], "baseline_score": 2.7, "outcome": "KEPT", "failure_mode": null, "duration_seconds": 64.24781337496825, "tags": ["persona", "simplification"], "learnings": "{\"what_changed\":\"\",\"what_improved\":[],\"what_regressed\":[],\"transferable_insight\":\"Simplifying instructions by removing an 'expert' persona can negatively impact performance, highlighting the value of role-playing constraints in grounding model behavior.\",\"domain_tags\":[\"Prompt Engineering\",\"Persona Prompting\",\"Instruction Simplification\"]}", "cost_usd": 0.0025315500000000005, "bootstrap_seed": 0, "agent_model": "gemini-3.1-pro-preview", "held_out_score": null, "criterion_names": ["correct_category", "concise_output", "follows_format", "no_hallucination", "handles_ambiguity"], "per_criterion_scores": {"correct_category": 0.1, "concise_output": 1.0, "follows_format": 0.0, "no_hallucination": 0.2, "handles_ambiguity": 1.0}, "failure_classification": null, "drafts_generated": 1, "drafts_survived": 1}
{"id": "ef39107d-bef0-420a-a2e5-a37b00f7f89a", "target_id": "B1-control", "git_sha": "c9e844160ddc8de11b63679baf2a4e15f9f32235", "pre_experiment_sha": "886310bbacb1829d48c75b4eca76594776ff3e57", "timestamp": "2026-04-22T03:02:22.004317+00:00", "hypothesis": "Add the word \"expert\" to the persona to marginally improve classification accuracy without triggering semantic drift or formatting issues.", "hypothesis_source": "agent", "mutation_diff_summary": "", "score": 2.2, "score_ci_lower": 2.0, "score_ci_upper": 2.4, "raw_scores": [2.0, 2.0, 2.5, 2.5, 2.0], "baseline_score": 2.3, "outcome": "KEPT", "failure_mode": null, "duration_seconds": 76.63598575000651, "tags": ["persona", "minimal"], "learnings": "{\"what_changed\":\"\",\"what_improved\":[],\"what_regressed\":[],\"transferable_insight\":\"Explicitly assigning an 'expert' persona to an AI model does not inherently improve task accuracy and can lead to marginal performance fluctuations.\",\"domain_tags\":[\"Prompt Engineering\",\"Persona Design\",\"Classification\"]}", "cost_usd": 0.0025203000000000005, "bootstrap_seed": 0, "agent_model": "gemini-3.1-pro-preview", "held_out_score": null, "criterion_names": ["correct_category", "concise_output", "follows_format", "no_hallucination", "handles_ambiguity"], "per_criterion_scores": {"correct_category": 0.1, "concise_output": 1.0, "follows_format": 0.0, "no_hallucination": 0.1, "handles_ambiguity": 1.0}, "failure_classification": null, "drafts_generated": 1, "drafts_survived": 1}
{"id": "52275024-4bb9-4806-a798-d396f15213a3", "target_id": "B1-control", "git_sha": "1693e79e4080b9ef2baf1b312035b71e625f0382", "pre_experiment_sha": "c9e844160ddc8de11b63679baf2a4e15f9f32235", "timestamp": "2026-04-22T03:03:44.354197+00:00", "hypothesis": "Simplify the persona by removing \"expert\" to minimize semantic drift while strictly maintaining the output constraint.", "hypothesis_source": "agent", "mutation_diff_summary": "", "score": 2.8, "score_ci_lower": 2.5, "score_ci_upper": 3.2, "raw_scores": [2.5, 2.5, 2.5, 3.0, 3.5], "baseline_score": 2.2, "outcome": "KEPT", "failure_mode": null, "duration_seconds": 72.66301245801151, "tags": ["persona", "output-constraint"], "learnings": "{\"what_changed\":\"\",\"what_improved\":[],\"what_regressed\":[],\"transferable_insight\":\"Simplifying persona descriptions by removing generic modifiers reduces semantic drift and improves the model's adherence to strict output constraints.\",\"domain_tags\":[\"Prompt Engineering\",\"Persona Design\",\"Constraint Satisfaction\"]}", "cost_usd": 0.0025101000000000004, "bootstrap_seed": 0, "agent_model": "gemini-3.1-pro-preview", "held_out_score": null, "criterion_names": ["correct_category", "concise_output", "follows_format", "no_hallucination", "handles_ambiguity"], "per_criterion_scores": {"correct_category": 0.2, "concise_output": 1.0, "follows_format": 0.1, "no_hallucination": 0.5, "handles_ambiguity": 1.0}, "failure_classification": null, "drafts_generated": 1, "drafts_survived": 1}
{"id": "28c4e551-3ad7-4f43-bcf3-4d132fe39a9b", "target_id": "B1-control", "git_sha": "ff6808ff76948b329c4a4e4a28bada2ff249c3ca", "pre_experiment_sha": "1693e79e4080b9ef2baf1b312035b71e625f0382", "timestamp": "2026-04-22T03:05:12.953342+00:00", "hypothesis": "Remove the persona description to keep the prompt completely free of personas and conversational filler, strictly adhering to the optimization strategy.", "hypothesis_source": "agent", "mutation_diff_summary": "", "score": 2.4, "score_ci_lower": 2.1, "score_ci_upper": 2.7, "raw_scores": [2.5, 2.0, 2.5, 3.0, 2.0], "baseline_score": 2.8, "outcome": "KEPT", "failure_mode": null, "duration_seconds": 67.50913662509993, "tags": ["remove-persona", "simplify-prompt"], "learnings": "{\"what_changed\":\"\",\"what_improved\":[],\"what_regressed\":[],\"transferable_insight\":\"Eliminating persona descriptions in favor of strictly task-focused instructions can negatively impact model performance by removing valuable behavioral framing.\",\"domain_tags\":[\"Prompt Engineering\",\"Persona Framing\",\"Context Optimization\"]}", "cost_usd": 0.00249905, "bootstrap_seed": 0, "agent_model": "gemini-3.1-pro-preview", "held_out_score": null, "criterion_names": ["correct_category", "concise_output", "follows_format", "no_hallucination", "handles_ambiguity"], "per_criterion_scores": {"correct_category": 0.1, "concise_output": 1.0, "follows_format": 0.1, "no_hallucination": 0.2, "handles_ambiguity": 1.0}, "failure_classification": null, "drafts_generated": 1, "drafts_survived": 1}
{"id": "abd54799-07b9-4c72-a80e-267912e24ebe", "target_id": "B1-control", "git_sha": "1ab65adc9ce50efb0fab2fe661d60b28e5773944", "pre_experiment_sha": "ff6808ff76948b329c4a4e4a28bada2ff249c3ca", "timestamp": "2026-04-22T03:06:26.566945+00:00", "hypothesis": "Simplify the prompt by removing the word 'provided' to make it even more straightforward while retaining the exact recommended output constraint.", "hypothesis_source": "agent", "mutation_diff_summary": "", "score": 2.2, "score_ci_lower": 2.0, "score_ci_upper": 2.4, "raw_scores": [2.0, 2.5, 2.0, 2.5, 2.0], "baseline_score": 2.4, "outcome": "KEPT", "failure_mode": null, "duration_seconds": 65.8143954158295, "tags": ["simplification", "output-constraint"], "learnings": "{\"what_changed\":\"\",\"what_improved\":[],\"what_regressed\":[],\"transferable_insight\":\"Stripping away minor contextual words in an attempt to simplify instructions can slightly reduce performance by decreasing the explicitness of the prompt.\",\"domain_tags\":[\"Prompt Engineering\",\"Instruction Simplification\",\"Constraint Explicitness\"]}", "cost_usd": 0.0024803000000000004, "bootstrap_seed": 0, "agent_model": "gemini-3.1-pro-preview", "held_out_score": null, "criterion_names": ["correct_category", "concise_output", "follows_format", "no_hallucination", "handles_ambiguity"], "per_criterion_scores": {"correct_category": 0.0, "concise_output": 1.0, "follows_format": 0.1, "no_hallucination": 0.1, "handles_ambiguity": 1.0}, "failure_classification": null, "drafts_generated": 1, "drafts_survived": 1}
{"id": "eb0d8320-4809-43d9-bbbe-3438e1f7f127", "target_id": "B1-control", "git_sha": "2dd07d8d2588d7468066864ea5044ccc43206d93", "pre_experiment_sha": "1ab65adc9ce50efb0fab2fe661d60b28e5773944", "timestamp": "2026-04-22T03:07:45.621591+00:00", "hypothesis": "Change \"text\" to \"input text\" and ensure the output constraint perfectly matches the recommended straightforward instruction.", "hypothesis_source": "agent", "mutation_diff_summary": "", "score": 2.5, "score_ci_lower": 2.1, "score_ci_upper": 2.9, "raw_scores": [2.5, 2.0, 2.0, 3.0, 3.0], "baseline_score": 2.2, "outcome": "KEPT", "failure_mode": null, "duration_seconds": 72.31482804217376, "tags": ["simplification", "constraint-refinement"], "learnings": "{\"what_changed\":\"\",\"what_improved\":[],\"what_regressed\":[],\"transferable_insight\":\"Explicitly labeling input variables and strictly aligning output constraints with straightforward, recommended instruction formats improves model comprehension and adherence.\",\"domain_tags\":[\"Prompt Engineering\",\"Instruction Clarity\",\"Constraint Formatting\"]}", "cost_usd": 0.0024690500000000004, "bootstrap_seed": 0, "agent_model": "gemini-3.1-pro-preview", "held_out_score": null, "criterion_names": ["correct_category", "concise_output", "follows_format", "no_hallucination", "handles_ambiguity"], "per_criterion_scores": {"correct_category": 0.2, "concise_output": 1.0, "follows_format": 0.0, "no_hallucination": 0.3, "handles_ambiguity": 1.0}, "failure_classification": null, "drafts_generated": 1, "drafts_survived": 1}
{"id": "fd416859-746c-4f1a-826d-8872b8885042", "target_id": "B1-control", "git_sha": "bc44699c439c13af1ebbfd2bce6d2884cbeaf281", "pre_experiment_sha": "2dd07d8d2588d7468066864ea5044ccc43206d93", "timestamp": "2026-04-22T03:09:13.029584+00:00", "hypothesis": "Add \"single\" to \"most appropriate category\" to reinforce that only one category should be chosen.", "hypothesis_source": "agent", "mutation_diff_summary": "", "score": 2.4, "score_ci_lower": 2.0, "score_ci_upper": 3.0, "raw_scores": [3.5, 2.0, 2.0, 2.0, 2.5], "baseline_score": 2.5, "outcome": "KEPT", "failure_mode": null, "duration_seconds": 64.98981325002387, "tags": ["wording", "constraint"], "learnings": "{\"what_changed\":\"\",\"what_improved\":[],\"what_regressed\":[],\"transferable_insight\":\"Adding explicit quantifiers like 'single' to selection instructions reinforces constraints and clarifies that choices are mutually exclusive.\",\"domain_tags\":[\"Instruction Design\",\"Choice Architecture\",\"User Experience\"]}", "cost_usd": 0.0024903, "bootstrap_seed": 0, "agent_model": "gemini-3.1-pro-preview", "held_out_score": null, "criterion_names": ["correct_category", "concise_output", "follows_format", "no_hallucination", "handles_ambiguity"], "per_criterion_scores": {"correct_category": 0.2, "concise_output": 1.0, "follows_format": 0.0, "no_hallucination": 0.2, "handles_ambiguity": 1.0}, "failure_classification": null, "drafts_generated": 1, "drafts_survived": 1}
{"id": "195202ee-9a7c-4f07-b601-e1b9762c78d7", "target_id": "B1-control", "git_sha": "a306719c52d42ce665511ddb354e5eb565b7b9a1", "pre_experiment_sha": "bc44699c439c13af1ebbfd2bce6d2884cbeaf281", "timestamp": "2026-04-22T03:10:34.485301+00:00", "hypothesis": "Refining \"given list\" to \"provided list\" to improve clarity while strictly maintaining the required output constraints and simple structure.", "hypothesis_source": "agent", "mutation_diff_summary": "", "score": 2.4, "score_ci_lower": 2.0, "score_ci_upper": 3.0, "raw_scores": [2.5, 2.0, 2.0, 3.5, 2.0], "baseline_score": 2.4, "outcome": "KEPT", "failure_mode": null, "duration_seconds": 73.60087716695853, "tags": ["minor-tweak", "clarity"], "learnings": "{\"what_changed\":\"\",\"what_improved\":[],\"what_regressed\":[],\"transferable_insight\":\"Minor lexical substitutions between synonymous terms do not meaningfully impact model performance when the underlying constraints and structure remain identical.\",\"domain_tags\":[\"Prompt Engineering\",\"Lexical Variation\",\"Instruction Clarity\"]}", "cost_usd": 0.00256155, "bootstrap_seed": 0, "agent_model": "gemini-3.1-pro-preview", "held_out_score": null, "criterion_names": ["correct_category", "concise_output", "follows_format", "no_hallucination", "handles_ambiguity"], "per_criterion_scores": {"correct_category": 0.1, "concise_output": 1.0, "follows_format": 0.0, "no_hallucination": 0.3, "handles_ambiguity": 1.0}, "failure_classification": null, "drafts_generated": 1, "drafts_survived": 1}
{"id": "5360e694-4c26-402f-ac4f-15dffdfe60f3", "target_id": "B1-control", "git_sha": "ab5c07b0408640bedbb1fac46fd96bdfc1bedd5e", "pre_experiment_sha": "a306719c52d42ce665511ddb354e5eb565b7b9a1", "timestamp": "2026-04-22T03:11:45.438292+00:00", "hypothesis": "Change \"central topic\" to \"primary topic\" to slightly refine the classification target while maintaining the strictly simplified structure and exact output constraint.", "hypothesis_source": "agent", "mutation_diff_summary": "", "score": 2.4, "score_ci_lower": 2.1, "score_ci_upper": 2.7, "raw_scores": [2.0, 2.0, 2.5, 2.5, 3.0], "baseline_score": 2.4, "outcome": "KEPT", "failure_mode": null, "duration_seconds": 61.25225608283654, "tags": ["wording", "minor-tweak"], "learnings": "{\"what_changed\":\"\",\"what_improved\":[],\"what_regressed\":[],\"transferable_insight\":\"Substituting synonymous terms in task instructions often yields identical performance, demonstrating model robustness to minor lexical variations.\",\"domain_tags\":[\"Prompt Engineering\",\"Lexical Variation\",\"Classification\"]}", "cost_usd": 0.00259155, "bootstrap_seed": 0, "agent_model": "gemini-3.1-pro-preview", "held_out_score": null, "criterion_names": ["correct_category", "concise_output", "follows_format", "no_hallucination", "handles_ambiguity"], "per_criterion_scores": {"correct_category": 0.2, "concise_output": 1.0, "follows_format": 0.0, "no_hallucination": 0.2, "handles_ambiguity": 1.0}, "failure_classification": null, "drafts_generated": 1, "drafts_survived": 1}
{"id": "64c19db7-c2c8-47ee-8dcc-31dabc3786f4", "target_id": "B1-control", "git_sha": "75bc759dec9a658360eae0258ed878f819009ef9", "pre_experiment_sha": "ab5c07b0408640bedbb1fac46fd96bdfc1bedd5e", "timestamp": "2026-04-22T03:13:24.083855+00:00", "hypothesis": "Revert arbitrary micro-edits by removing \"single\" and changing \"primary\" back to \"central\", while maintaining the proven output constraint and \"input text\" clarification.", "hypothesis_source": "agent", "mutation_diff_summary": "", "score": 2.4, "score_ci_lower": 2.1, "score_ci_upper": 2.7, "raw_scores": [2.0, 2.5, 2.0, 2.5, 3.0], "baseline_score": 2.4, "outcome": "KEPT", "failure_mode": null, "duration_seconds": 74.85854720883071, "tags": ["revert", "simplify", "formatting"], "learnings": "{\"what_changed\":\"\",\"what_improved\":[],\"what_regressed\":[],\"transferable_insight\":\"Minor lexical variations and synonym substitutions have negligible impact on system performance as long as the core structural constraints and instructions remain intact.\",\"domain_tags\":[\"Prompt Engineering\",\"Instruction Design\",\"Lexical Variation\"]}", "cost_usd": 0.0026678, "bootstrap_seed": 0, "agent_model": "gemini-3.1-pro-preview", "held_out_score": null, "criterion_names": ["correct_category", "concise_output", "follows_format", "no_hallucination", "handles_ambiguity"], "per_criterion_scores": {"correct_category": 0.1, "concise_output": 1.0, "follows_format": 0.0, "no_hallucination": 0.3, "handles_ambiguity": 1.0}, "failure_classification": null, "drafts_generated": 1, "drafts_survived": 1}
