{"id": "0f48486b-9161-40b8-b713-6e5e9abb4371", "target_id": "B1-control", "git_sha": "5a88ba87bed9443588051624c99466be61ab1958", "pre_experiment_sha": "5a88ba87bed9443588051624c99466be61ab1958", "timestamp": "2026-04-19T01:23:16.626578+00:00", "hypothesis": "Tightening the prompt to enforce immediate single-label output with deterministic tie-breaking will improve parseability and binary compliance.", "hypothesis_source": "agent", "mutation_diff_summary": "", "score": 3.0, "score_ci_lower": 2.4, "score_ci_upper": 3.6, "raw_scores": [3.5, 2.0, 3.0, 2.5, 4.0], "baseline_score": 3.3, "outcome": "DISCARDED", "failure_mode": null, "duration_seconds": 13.159370417008176, "tags": ["single-label", "deterministic", "formatting", "minimal"], "learnings": "{\"what_changed\":\"\",\"what_improved\":[],\"what_regressed\":[],\"transferable_insight\":\"When a task requires machine-readable decisions, stricter output constraints and explicit tie-breaking can improve consistency, but they should be validated against actual downstream parseability rather than assumed.\",\"domain_tags\":[\"prompt-engineering\",\"reliability\",\"evaluation\"]}", "cost_usd": 0.01009775, "bootstrap_seed": 0, "agent_model": "gpt-5.4", "held_out_score": null, "criterion_names": ["correct_category", "concise_output", "follows_format", "no_hallucination", "handles_ambiguity"], "per_criterion_scores": {"correct_category": 0.5, "concise_output": 1.0, "follows_format": 0.0, "no_hallucination": 0.5, "handles_ambiguity": 1.0}, "failure_classification": {"category": "output_format", "description": "The experiment failed because the resulting output did not meet the required single-label/format constraints for deterministic, immediate classification parsing (parseability/binary compliance was not achieved).", "fix_direction": "Further constrain the generation to always emit exactly one label from the allowed set with deterministic tie-breaking, and validate the output against the expected schema before submission.", "confidence": 0.55}, "drafts_generated": 1, "drafts_survived": 1}
{"id": "5f25e34c-416b-4a65-a094-ded4910cb044", "target_id": "B1-control", "git_sha": "33ce704f268b683402e56ce75ea606fabc1463ec", "pre_experiment_sha": "5a88ba87bed9443588051624c99466be61ab1958", "timestamp": "2026-04-19T01:23:32.696672+00:00", "hypothesis": "Tightening the prompt to enforce deterministic single-label output and simple tie-breaking will improve parse compliance and binary scoring.", "hypothesis_source": "agent", "mutation_diff_summary": "", "score": 2.9, "score_ci_lower": 2.6, "score_ci_upper": 3.2, "raw_scores": [3.0, 2.5, 2.5, 3.0, 3.5], "baseline_score": 3.3, "outcome": "KEPT", "failure_mode": null, "duration_seconds": 12.865910916938446, "tags": ["single-label", "deterministic", "strict-format", "tie-break"], "learnings": "{\"what_changed\":\"\",\"what_improved\":[],\"what_regressed\":[],\"transferable_insight\":\"When outputs must be machine-parsed, explicitly constraining the format and tie-breaking rules can improve reliability even if it does not change the underlying decision quality.\",\"domain_tags\":[\"prompt-engineering\",\"structured-output\",\"evaluation\"]}", "cost_usd": 0.010112550000000001, "bootstrap_seed": 0, "agent_model": "gpt-5.4", "held_out_score": null, "criterion_names": ["correct_category", "concise_output", "follows_format", "no_hallucination", "handles_ambiguity"], "per_criterion_scores": {"correct_category": 0.5, "concise_output": 1.0, "follows_format": 0.0, "no_hallucination": 0.5, "handles_ambiguity": 0.9}, "failure_classification": null, "drafts_generated": 1, "drafts_survived": 1}
{"id": "cd715e9a-fb46-4ca6-9bf1-2c1dfd47acba", "target_id": "B1-control", "git_sha": "b8ff8d0c269eb0cf0c4519c06c04663dbc7515db", "pre_experiment_sha": "33ce704f268b683402e56ce75ea606fabc1463ec", "timestamp": "2026-04-19T01:23:57.004603+00:00", "hypothesis": "A shorter, more decisive prompt will improve single-label compliance while preserving correct best-match selection.", "hypothesis_source": "agent", "mutation_diff_summary": "", "score": 3.0, "score_ci_lower": 2.5, "score_ci_upper": 3.4, "raw_scores": [3.0, 2.0, 3.5, 3.0, 3.5], "baseline_score": 2.9, "outcome": "KEPT", "failure_mode": null, "duration_seconds": 21.36007441696711, "tags": ["minimal", "single-label", "deterministic", "classification"], "learnings": "{\"what_changed\":\"\",\"what_improved\":[],\"what_regressed\":[],\"transferable_insight\":\"Reducing prompt length and ambiguity can improve adherence to a single required output format without sacrificing the quality of the chosen answer.\",\"domain_tags\":[\"prompt-engineering\",\"instruction-following\",\"classification\"]}", "cost_usd": 0.007657550000000001, "bootstrap_seed": 0, "agent_model": "gpt-5.4", "held_out_score": null, "criterion_names": ["correct_category", "concise_output", "follows_format", "no_hallucination", "handles_ambiguity"], "per_criterion_scores": {"correct_category": 0.4, "concise_output": 1.0, "follows_format": 0.0, "no_hallucination": 0.6, "handles_ambiguity": 1.0}, "failure_classification": null, "drafts_generated": 1, "drafts_survived": 1}
{"id": "fca88af3-a277-4fe7-92b0-d3d6968233dd", "target_id": "B1-control", "git_sha": "f0a125c9bea1440ae21e6e10056ce3cc86fc7f74", "pre_experiment_sha": "b8ff8d0c269eb0cf0c4519c06c04663dbc7515db", "timestamp": "2026-04-19T01:24:08.537783+00:00", "hypothesis": "A shorter, more decisive single-label instruction will improve one-label compliance without adding brittle formatting constraints.", "hypothesis_source": "agent", "mutation_diff_summary": "", "score": 3.0, "score_ci_lower": 2.7, "score_ci_upper": 3.3, "raw_scores": [3.0, 2.5, 3.0, 3.0, 3.5], "baseline_score": 3.0, "outcome": "KEPT", "failure_mode": null, "duration_seconds": 10.51444445794914, "tags": ["single-label", "concise", "deterministic"], "learnings": "{\"what_changed\":\"\",\"what_improved\":[],\"what_regressed\":[],\"transferable_insight\":\"When a change produces no measurable improvement or regression, the safest transferable lesson is that simplifying instructions alone may not be sufficient to alter compliance behavior.\",\"domain_tags\":[\"instruction-design\",\"evaluation\",\"behavior-change\"]}", "cost_usd": 0.0065575500000000005, "bootstrap_seed": 0, "agent_model": "gpt-5.4", "held_out_score": null, "criterion_names": ["correct_category", "concise_output", "follows_format", "no_hallucination", "handles_ambiguity"], "per_criterion_scores": {"correct_category": 0.5, "concise_output": 1.0, "follows_format": 0.0, "no_hallucination": 0.5, "handles_ambiguity": 1.0}, "failure_classification": null, "drafts_generated": 1, "drafts_survived": 1}
{"id": "bdc14e8f-c575-4035-ab69-98257d750475", "target_id": "B1-control", "git_sha": "23bb3fedf5408773ac101abf697b940c0ec236a0", "pre_experiment_sha": "f0a125c9bea1440ae21e6e10056ce3cc86fc7f74", "timestamp": "2026-04-19T01:24:20.220071+00:00", "hypothesis": "A slightly more decisive one-label instruction will improve compliance without adding brittle formatting constraints.", "hypothesis_source": "agent", "mutation_diff_summary": "", "score": 2.9, "score_ci_lower": 2.5, "score_ci_upper": 3.5, "raw_scores": [4.0, 2.5, 3.0, 2.5, 2.5], "baseline_score": 3.0, "outcome": "KEPT", "failure_mode": null, "duration_seconds": 10.63780091702938, "tags": ["single-label", "concise", "deterministic"], "learnings": "{\"what_changed\":\"\",\"what_improved\":[],\"what_regressed\":[],\"transferable_insight\":\"Making instructions more decisive can improve adherence without necessarily requiring stricter formatting rules, but small wording changes may have negligible or negative impact.\",\"domain_tags\":[\"instruction-design\",\"behavior-change\",\"communication\"]}", "cost_usd": 0.00653255, "bootstrap_seed": 0, "agent_model": "gpt-5.4", "held_out_score": null, "criterion_names": ["correct_category", "concise_output", "follows_format", "no_hallucination", "handles_ambiguity"], "per_criterion_scores": {"correct_category": 0.6, "concise_output": 1.0, "follows_format": 0.0, "no_hallucination": 0.5, "handles_ambiguity": 0.8}, "failure_classification": null, "drafts_generated": 1, "drafts_survived": 1}
{"id": "ca28f002-7d4e-4b80-a0da-eb528367268f", "target_id": "B1-control", "git_sha": "b74b714631ceb8876d512b297170b3308cfac716", "pre_experiment_sha": "23bb3fedf5408773ac101abf697b940c0ec236a0", "timestamp": "2026-04-19T01:24:36.606114+00:00", "hypothesis": "A more explicit single-label-only instruction will reduce extra text and improve strict category selection.", "hypothesis_source": "agent", "mutation_diff_summary": "", "score": 2.9, "score_ci_lower": 2.5, "score_ci_upper": 3.3, "raw_scores": [2.5, 2.5, 3.5, 3.5, 2.5], "baseline_score": 2.9, "outcome": "KEPT", "failure_mode": null, "duration_seconds": 14.219258916913532, "tags": ["single-label", "concise", "output-constraint", "stability"], "learnings": "{\"what_changed\":\"\",\"what_improved\":[],\"what_regressed\":[],\"transferable_insight\":\"Making constraints more explicit can reduce ambiguity, but if the task is already well-posed it may not change outcomes or behavior.\",\"domain_tags\":[\"instruction-design\",\"classification\",\"prompting\"]}", "cost_usd": 0.005727550000000001, "bootstrap_seed": 0, "agent_model": "gpt-5.4", "held_out_score": null, "criterion_names": ["correct_category", "concise_output", "follows_format", "no_hallucination", "handles_ambiguity"], "per_criterion_scores": {"correct_category": 0.5, "concise_output": 1.0, "follows_format": 0.0, "no_hallucination": 0.4, "handles_ambiguity": 1.0}, "failure_classification": null, "drafts_generated": 1, "drafts_survived": 1}
{"id": "e4a5d03d-9c1c-429d-94b1-d87c67463cfe", "target_id": "B1-control", "git_sha": "b1865c1b208a6865af63111b3aa9404ab3ddd422", "pre_experiment_sha": "b74b714631ceb8876d512b297170b3308cfac716", "timestamp": "2026-04-19T01:24:49.369468+00:00", "hypothesis": "A more direct, imperative prompt emphasizing one valid label only will reduce extra text and improve single-label compliance.", "hypothesis_source": "agent", "mutation_diff_summary": "", "score": 3.2, "score_ci_lower": 2.8, "score_ci_upper": 3.6, "raw_scores": [3.0, 2.5, 3.0, 3.5, 4.0], "baseline_score": 2.9, "outcome": "KEPT", "failure_mode": null, "duration_seconds": 11.690579749993049, "tags": ["classification", "single-label", "strict-output"], "learnings": "{\"what_changed\":\"\",\"what_improved\":[],\"what_regressed\":[],\"transferable_insight\":\"Clear, imperative instructions that constrain the output to one valid choice can reduce verbosity and improve compliance with single-answer tasks.\",\"domain_tags\":[\"prompting\",\"instruction-following\",\"classification\"]}", "cost_usd": 0.005749550000000001, "bootstrap_seed": 0, "agent_model": "gpt-5.4", "held_out_score": null, "criterion_names": ["correct_category", "concise_output", "follows_format", "no_hallucination", "handles_ambiguity"], "per_criterion_scores": {"correct_category": 0.6, "concise_output": 1.0, "follows_format": 0.0, "no_hallucination": 0.6, "handles_ambiguity": 1.0}, "failure_classification": null, "drafts_generated": 1, "drafts_survived": 1}
{"id": "06a32b86-82ee-4f91-a027-c70048358cee", "target_id": "B1-control", "git_sha": "d31012d52159eb5a3b8aeb592e43ef08462e7454", "pre_experiment_sha": "b1865c1b208a6865af63111b3aa9404ab3ddd422", "timestamp": "2026-04-19T01:25:01.078902+00:00", "hypothesis": "Make the instruction more explicit that the output must be only one label from the provided allowed categories, with no extra text.", "hypothesis_source": "agent", "mutation_diff_summary": "", "score": 2.8, "score_ci_lower": 2.3, "score_ci_upper": 3.3, "raw_scores": [2.5, 2.5, 3.5, 2.0, 3.5], "baseline_score": 3.2, "outcome": "KEPT", "failure_mode": null, "duration_seconds": 10.727530000032857, "tags": ["concise", "output-constraint", "single-label"], "learnings": "{\"what_changed\":\"\",\"what_improved\":[],\"what_regressed\":[],\"transferable_insight\":\"When a task requires a constrained categorical response, explicitly stating that only one allowed label may be output with no extra text can reduce ambiguity and improve compliance.\",\"domain_tags\":[\"prompting\",\"classification\",\"instruction-design\"]}", "cost_usd": 0.005902550000000001, "bootstrap_seed": 0, "agent_model": "gpt-5.4", "held_out_score": null, "criterion_names": ["correct_category", "concise_output", "follows_format", "no_hallucination", "handles_ambiguity"], "per_criterion_scores": {"correct_category": 0.3, "concise_output": 1.0, "follows_format": 0.0, "no_hallucination": 0.6, "handles_ambiguity": 0.9}, "failure_classification": null, "drafts_generated": 1, "drafts_survived": 1}
{"id": "fe55cf62-b0ad-49b8-894b-741e05d23524", "target_id": "B1-control", "git_sha": "ebb9a9e8def1fbbafb878b6117c1287aae20f4bf", "pre_experiment_sha": "d31012d52159eb5a3b8aeb592e43ef08462e7454", "timestamp": "2026-04-19T01:25:15.595400+00:00", "hypothesis": "Stricter output and tie-breaking instructions will improve single-label compliance and matching accuracy.", "hypothesis_source": "agent", "mutation_diff_summary": "", "score": 3.4, "score_ci_lower": 3.0, "score_ci_upper": 3.8, "raw_scores": [4.0, 3.0, 3.0, 3.0, 4.0], "baseline_score": 2.8, "outcome": "KEPT", "failure_mode": null, "duration_seconds": 12.245639709057286, "tags": ["classification", "single-label", "constraint-tightening"], "learnings": "{\"what_changed\":\"\",\"what_improved\":[],\"what_regressed\":[],\"transferable_insight\":\"Clearer constraints and explicit tie-breaking rules can improve decision consistency even when no specific feature changes are involved.\",\"domain_tags\":[\"instruction-design\",\"decision-making\",\"evaluation\"]}", "cost_usd": 0.006837550000000001, "bootstrap_seed": 0, "agent_model": "gpt-5.4", "held_out_score": null, "criterion_names": ["correct_category", "concise_output", "follows_format", "no_hallucination", "handles_ambiguity"], "per_criterion_scores": {"correct_category": 0.7, "concise_output": 1.0, "follows_format": 0.0, "no_hallucination": 0.7, "handles_ambiguity": 1.0}, "failure_classification": null, "drafts_generated": 1, "drafts_survived": 1}
{"id": "c5022c7b-3a60-4d2d-94d8-9126e6d09e5b", "target_id": "B1-control", "git_sha": "4ebdb2f5b25e92c200e311de5a1cffa5c6008d8c", "pre_experiment_sha": "ebb9a9e8def1fbbafb878b6117c1287aae20f4bf", "timestamp": "2026-04-19T01:25:28.165812+00:00", "hypothesis": "Tightening the instruction to enforce a single exact allowed label with simple fallback tie-breaking will improve label-only compliance.", "hypothesis_source": "agent", "mutation_diff_summary": "", "score": 3.2, "score_ci_lower": 2.8, "score_ci_upper": 3.6, "raw_scores": [3.0, 2.5, 4.0, 3.5, 3.0], "baseline_score": 3.4, "outcome": "KEPT", "failure_mode": null, "duration_seconds": 11.54753800004255, "tags": ["classification", "constraint-tightening", "label-only"], "learnings": "{\"what_changed\":\"\",\"what_improved\":[],\"what_regressed\":[],\"transferable_insight\":\"When a task requires a single discrete output, explicitly constraining the allowed label set and specifying a simple fallback rule can improve compliance by reducing ambiguity.\",\"domain_tags\":[\"instruction-following\",\"classification\",\"prompt-design\"]}", "cost_usd": 0.0071975500000000005, "bootstrap_seed": 0, "agent_model": "gpt-5.4", "held_out_score": null, "criterion_names": ["correct_category", "concise_output", "follows_format", "no_hallucination", "handles_ambiguity"], "per_criterion_scores": {"correct_category": 0.7, "concise_output": 1.0, "follows_format": 0.0, "no_hallucination": 0.6, "handles_ambiguity": 0.9}, "failure_classification": null, "drafts_generated": 1, "drafts_survived": 1}
{"id": "9f6e80fd-8519-467b-a64b-5aef863022e0", "target_id": "B1-control", "git_sha": "0edbf90596247212aaa9856c9f6c70a6ed4c271f", "pre_experiment_sha": "4ebdb2f5b25e92c200e311de5a1cffa5c6008d8c", "timestamp": "2026-04-19T01:25:44.235362+00:00", "hypothesis": "Stricter output-only instructions with explicit tie-breaking and no-formatting constraints will improve single-label compliance.", "hypothesis_source": "agent", "mutation_diff_summary": "", "score": 3.4, "score_ci_lower": 3.1, "score_ci_upper": 3.7, "raw_scores": [4.0, 3.0, 3.5, 3.0, 3.5], "baseline_score": 3.2, "outcome": "KEPT", "failure_mode": null, "duration_seconds": 14.912754459073767, "tags": ["classification", "single-label", "strict-output", "tie-breaking"], "learnings": "{\"what_changed\":\"\",\"what_improved\":[],\"what_regressed\":[],\"transferable_insight\":\"Clearer output constraints with explicit tie-breaking rules can improve compliance even when the task format is otherwise unchanged.\",\"domain_tags\":[\"instruction-following\",\"output-formatting\",\"decision-rules\"]}", "cost_usd": 0.007522550000000001, "bootstrap_seed": 0, "agent_model": "gpt-5.4", "held_out_score": null, "criterion_names": ["correct_category", "concise_output", "follows_format", "no_hallucination", "handles_ambiguity"], "per_criterion_scores": {"correct_category": 0.7, "concise_output": 1.0, "follows_format": 0.0, "no_hallucination": 0.7, "handles_ambiguity": 1.0}, "failure_classification": null, "drafts_generated": 1, "drafts_survived": 1}
{"id": "a86be2b9-60ed-430a-99ff-dc3593480a8f", "target_id": "B1-control", "git_sha": "0edbf90596247212aaa9856c9f6c70a6ed4c271f", "pre_experiment_sha": "0edbf90596247212aaa9856c9f6c70a6ed4c271f", "timestamp": "2026-04-19T01:26:06.512711+00:00", "hypothesis": "Tightening the instruction to enforce a single exact label with deterministic tie-breaking will improve label-only compliance.", "hypothesis_source": "agent", "mutation_diff_summary": "", "score": 2.8, "score_ci_lower": 2.6, "score_ci_upper": 3.0, "raw_scores": [3.0, 2.5, 3.0, 2.5, 3.0], "baseline_score": 3.4, "outcome": "DISCARDED", "failure_mode": null, "duration_seconds": 19.94749466702342, "tags": ["classification", "strict-output", "tie-breaking"], "learnings": "{\"what_changed\":\"\",\"what_improved\":[],\"what_regressed\":[],\"transferable_insight\":\"When a stricter instruction changes the output format without improving compliance, the added constraint is likely too brittle to generalize and may not affect the underlying behavior.\",\"domain_tags\":[\"instruction-design\",\"evaluation\",\"robustness\"]}", "cost_usd": 0.008517150000000001, "bootstrap_seed": 0, "agent_model": "gpt-5.4", "held_out_score": null, "criterion_names": ["correct_category", "concise_output", "follows_format", "no_hallucination", "handles_ambiguity"], "per_criterion_scores": {"correct_category": 0.2, "concise_output": 1.0, "follows_format": 0.0, "no_hallucination": 0.7, "handles_ambiguity": 0.9}, "failure_classification": {"category": "output_format", "description": "The experiment failed to meet the required output structure/schema: label-only compliance changes did not result in properly formatted outputs, leading to a parsing/structure failure rather than purely semantic issues.", "fix_direction": "Re-focus on strict adherence to the expected output schema (exact keys/order, deterministic formatting, and label-only response) and validate with a schema/regex check before scoring.", "confidence": 0.46}, "drafts_generated": 1, "drafts_survived": 1}
{"id": "3ad857db-16fc-463a-898c-520eacb40f2d", "target_id": "B1-control", "git_sha": "512822fff536ed7e02ca5c7b6f86849d9b55d32b", "pre_experiment_sha": "0edbf90596247212aaa9856c9f6c70a6ed4c271f", "timestamp": "2026-04-19T01:26:21.415939+00:00", "hypothesis": "Stricter single-label output instructions with clear tie-breaking will reduce invalid or verbose classifications.", "hypothesis_source": "agent", "mutation_diff_summary": "", "score": 3.1, "score_ci_lower": 2.8, "score_ci_upper": 3.4, "raw_scores": [3.5, 2.5, 3.0, 3.5, 3.0], "baseline_score": 3.4, "outcome": "KEPT", "failure_mode": null, "duration_seconds": 12.526443250011653, "tags": ["single-label", "strict-output", "tie-break"], "learnings": "{\"what_changed\":\"\",\"what_improved\":[],\"what_regressed\":[],\"transferable_insight\":\"Clearer output constraints and explicit tie-breaking rules tend to reduce invalid or overly verbose responses by narrowing the model\u2019s degrees of freedom.\",\"domain_tags\":[\"prompting\",\"classification\",\"output-formatting\"]}", "cost_usd": 0.00812755, "bootstrap_seed": 0, "agent_model": "gpt-5.4", "held_out_score": null, "criterion_names": ["correct_category", "concise_output", "follows_format", "no_hallucination", "handles_ambiguity"], "per_criterion_scores": {"correct_category": 0.5, "concise_output": 1.0, "follows_format": 0.0, "no_hallucination": 0.6, "handles_ambiguity": 1.0}, "failure_classification": null, "drafts_generated": 1, "drafts_survived": 1}
