{"id": "dd23c230-9804-4fe1-95a3-3919e58399c3", "target_id": "B1-greedy", "git_sha": "1a998caeb919b4330bbf473131aecb60e21ca5f6", "pre_experiment_sha": "1a998caeb919b4330bbf473131aecb60e21ca5f6", "timestamp": "2026-04-19T16:46:16.210387+00:00", "hypothesis": "Make the prompt more explicit that the output must be exactly one verbatim label from the provided set and nothing else.", "hypothesis_source": "agent", "mutation_diff_summary": "", "score": 3.1, "score_ci_lower": 2.5, "score_ci_upper": 3.5, "raw_scores": [3.5, 2.0, 3.5, 3.0, 3.5], "baseline_score": 3.0, "outcome": "DISCARDED", "failure_mode": null, "duration_seconds": 12.599745707935654, "tags": ["format-compliance", "single-label", "exact-match"], "learnings": "{\"what_changed\":\"\",\"what_improved\":[],\"what_regressed\":[],\"transferable_insight\":\"When a task requires a constrained categorical output, explicitly stating that the response must be exactly one allowed label and nothing else can reduce ambiguity and improve compliance.\",\"domain_tags\":[\"prompting\",\"classification\",\"output-formatting\"]}", "cost_usd": 0.01014635, "bootstrap_seed": 0, "agent_model": "gpt-5.4", "held_out_score": null, "criterion_names": ["correct_category", "concise_output", "follows_format", "no_hallucination", "handles_ambiguity"], "per_criterion_scores": {"correct_category": 0.5, "concise_output": 1.0, "follows_format": 0.0, "no_hallucination": 0.6, "handles_ambiguity": 1.0}, "failure_classification": {"category": "output_format", "description": "The experiment failed because the prompt changes were intended to enforce an exact, verbatim single-label output, but the model did not reliably follow the required output constraint, indicating an output structure/schema violation (extra text, wrong label formatting, or not restricting output to exactly one label).", "fix_direction": "Strengthen and test output constraints: explicitly require 'exactly one token/label from the set' with no punctuation or additional text, add an explicit refusal example, and use stricter formatting instructions (e.g., 'return only <label>').", "confidence": 0.62}, "drafts_generated": 1, "drafts_survived": 1}
{"id": "6e3b7a1c-6d9f-4a7a-8a3b-7820c18feeed", "target_id": "B1-greedy", "git_sha": "1a998caeb919b4330bbf473131aecb60e21ca5f6", "pre_experiment_sha": "1a998caeb919b4330bbf473131aecb60e21ca5f6", "timestamp": "2026-04-19T16:46:32.030209+00:00", "hypothesis": "Make the prompt more explicit that the output must be exactly one verbatim allowed label and nothing else.", "hypothesis_source": "agent", "mutation_diff_summary": "", "score": 3.0, "score_ci_lower": 2.6, "score_ci_upper": 3.5, "raw_scores": [3.0, 2.5, 4.0, 3.0, 2.5], "baseline_score": 3.0, "outcome": "DISCARDED", "failure_mode": null, "duration_seconds": 13.056092291953973, "tags": ["format", "single-label", "exact-match"], "learnings": "{\"what_changed\":\"\",\"what_improved\":[],\"what_regressed\":[],\"transferable_insight\":\"When a task requires a constrained categorical output, making the format stricter does not necessarily improve performance if the underlying model already understands the constraint.\",\"domain_tags\":[\"prompt-engineering\",\"classification\",\"evaluation\"]}", "cost_usd": 0.010157750000000002, "bootstrap_seed": 0, "agent_model": "gpt-5.4", "held_out_score": null, "criterion_names": ["correct_category", "concise_output", "follows_format", "no_hallucination", "handles_ambiguity"], "per_criterion_scores": {"correct_category": 0.5, "concise_output": 1.0, "follows_format": 0.0, "no_hallucination": 0.5, "handles_ambiguity": 1.0}, "failure_classification": {"category": "output_format", "description": "The experiment appears to have produced output that did not comply with the required strict format: the prompt needed to force the model to output exactly one verbatim allowed label and nothing else, suggesting the failure was due to the model emitting additional text or not matching the exact allowed-label-only requirement.", "fix_direction": "Tighten output constraints using explicit instructions and add verification/validation in evaluation (e.g., require a single-token/line match to an allowed-label set, reject any extra characters/text).", "confidence": 0.62}, "drafts_generated": 1, "drafts_survived": 1}
{"id": "ae693e50-47dc-4f93-b45e-151feaffced3", "target_id": "B1-greedy", "git_sha": "1a998caeb919b4330bbf473131aecb60e21ca5f6", "pre_experiment_sha": "1a998caeb919b4330bbf473131aecb60e21ca5f6", "timestamp": "2026-04-19T16:46:53.145070+00:00", "hypothesis": "Making the single-label exact-match output requirement more explicit will improve compliance and binary scoring.", "hypothesis_source": "agent", "mutation_diff_summary": "", "score": 3.0, "score_ci_lower": 2.5, "score_ci_upper": 3.4, "raw_scores": [3.0, 2.0, 3.5, 3.5, 3.0], "baseline_score": 3.0, "outcome": "DISCARDED", "failure_mode": null, "duration_seconds": 16.28349729103502, "tags": ["format-compliance", "exact-match", "minimal"], "learnings": "{\"what_changed\":\"\",\"what_improved\":[],\"what_regressed\":[],\"transferable_insight\":\"Making a requirement more explicit does not necessarily improve compliance when the underlying task and evaluation already leave little room for ambiguity.\",\"domain_tags\":[\"instruction-following\",\"evaluation\",\"prompt-design\"]}", "cost_usd": 0.01002515, "bootstrap_seed": 0, "agent_model": "gpt-5.4", "held_out_score": null, "criterion_names": ["correct_category", "concise_output", "follows_format", "no_hallucination", "handles_ambiguity"], "per_criterion_scores": {"correct_category": 0.3, "concise_output": 1.0, "follows_format": 0.0, "no_hallucination": 0.7, "handles_ambiguity": 1.0}, "failure_classification": {"category": "output_format", "description": "The experiment failed to comply with the required single-label exact-match output structure/schema, resulting in binary scoring despite the intended clarity change.", "fix_direction": "Ensure the model\u2019s final output strictly matches the required single-label exact-match format (no extra text, correct label choice, and exact schema compliance).", "confidence": 0.42}, "drafts_generated": 1, "drafts_survived": 1}
{"id": "c3e8d723-4073-4d9d-93d3-8972d1c1fa68", "target_id": "B1-greedy", "git_sha": "1a998caeb919b4330bbf473131aecb60e21ca5f6", "pre_experiment_sha": "1a998caeb919b4330bbf473131aecb60e21ca5f6", "timestamp": "2026-04-19T16:47:10.420430+00:00", "hypothesis": "Make the output constraint stricter by requiring one verbatim label from the provided set and absolutely nothing else.", "hypothesis_source": "agent", "mutation_diff_summary": "", "score": 3.0, "score_ci_lower": 2.6, "score_ci_upper": 3.4, "raw_scores": [3.5, 2.5, 3.0, 3.5, 2.5], "baseline_score": 3.0, "outcome": "DISCARDED", "failure_mode": null, "duration_seconds": 14.863119791960344, "tags": ["format-control", "exact-match", "single-label"], "learnings": "{\"what_changed\":\"\",\"what_improved\":[],\"what_regressed\":[],\"transferable_insight\":\"When tightening output constraints, adding an overly rigid requirement can eliminate useful variation without improving results, so constraint changes should be tested for actual benefit before adoption.\",\"domain_tags\":[\"experimentation\",\"prompt-design\",\"evaluation\"]}", "cost_usd": 0.01011235, "bootstrap_seed": 0, "agent_model": "gpt-5.4", "held_out_score": null, "criterion_names": ["correct_category", "concise_output", "follows_format", "no_hallucination", "handles_ambiguity"], "per_criterion_scores": {"correct_category": 0.3, "concise_output": 1.0, "follows_format": 0.0, "no_hallucination": 0.7, "handles_ambiguity": 1.0}, "failure_classification": {"category": "logic_error", "description": "The provided hypothesis indicates an output-format constraint tightening, but the failure mode and details of the actual incorrect output are missing, so it\u2019s not possible to determine whether the issue is a formatting/schema violation, logic error, or other failure type.", "fix_direction": "Capture the actual model output and the required label set, then compare output structure against the constraint (verbatim label only) to identify whether it violated schema/extra text vs. produced a semantically wrong label.", "confidence": 0.1}, "drafts_generated": 1, "drafts_survived": 1}
{"id": "28d2be17-bd8d-4796-b6b6-00bbc1648fd8", "target_id": "B1-greedy", "git_sha": "1a998caeb919b4330bbf473131aecb60e21ca5f6", "pre_experiment_sha": "1a998caeb919b4330bbf473131aecb60e21ca5f6", "timestamp": "2026-04-19T16:47:25.834392+00:00", "hypothesis": "Make the output constraint stricter by requiring exactly one verbatim label from the provided set and nothing else.", "hypothesis_source": "agent", "mutation_diff_summary": "", "score": 2.7, "score_ci_lower": 2.3, "score_ci_upper": 3.2, "raw_scores": [2.5, 2.0, 3.0, 2.5, 3.5], "baseline_score": 3.0, "outcome": "DISCARDED", "failure_mode": null, "duration_seconds": 12.974547041929327, "tags": ["format-control", "exact-match", "single-label"], "learnings": "{\"what_changed\":\"\",\"what_improved\":[],\"what_regressed\":[],\"transferable_insight\":\"Adding stricter output-format constraints can reduce robustness and hurt performance when the task benefits from flexibility or when the model struggles to satisfy exact formatting requirements.\",\"domain_tags\":[\"prompt-engineering\",\"evaluation\",\"output-formatting\"]}", "cost_usd": 0.01013875, "bootstrap_seed": 0, "agent_model": "gpt-5.4", "held_out_score": null, "criterion_names": ["correct_category", "concise_output", "follows_format", "no_hallucination", "handles_ambiguity"], "per_criterion_scores": {"correct_category": 0.5, "concise_output": 1.0, "follows_format": 0.0, "no_hallucination": 0.3, "handles_ambiguity": 0.9}, "failure_classification": {"category": "output_format", "description": "The experiment hypothesis indicates the constraint should require exactly one verbatim label and nothing else, but the result is classified as an output-constraint failure (failed experiment) rather than a logic/semantic issue, suggesting the produced output did not match the required strict label-only structure/schema.", "fix_direction": "Ensure the output is generated as a single verbatim label from the provided set with no extra tokens (no surrounding text, punctuation, whitespace beyond what is permitted), and validate against the exact expected schema before submission.", "confidence": 0.74}, "drafts_generated": 1, "drafts_survived": 1}
{"id": "5163c0d6-6e05-44b6-900b-163508b79839", "target_id": "B1-greedy", "git_sha": "1a998caeb919b4330bbf473131aecb60e21ca5f6", "pre_experiment_sha": "1a998caeb919b4330bbf473131aecb60e21ca5f6", "timestamp": "2026-04-19T16:47:43.397824+00:00", "hypothesis": "Make the prompt stricter and more explicit that the output must be exactly one verbatim label from the allowed set with nothing else.", "hypothesis_source": "agent", "mutation_diff_summary": "", "score": 3.1, "score_ci_lower": 2.8, "score_ci_upper": 3.4, "raw_scores": [2.5, 3.0, 3.5, 3.5, 3.0], "baseline_score": 3.0, "outcome": "DISCARDED", "failure_mode": null, "duration_seconds": 12.950266208034009, "tags": ["format-compliance", "exact-match", "brevity"], "learnings": "{\"what_changed\":\"\",\"what_improved\":[],\"what_regressed\":[],\"transferable_insight\":\"When a task requires a constrained categorical output, explicitly state the allowed set and forbid any extra text to reduce format drift.\",\"domain_tags\":[\"prompt-engineering\",\"classification\",\"output-formatting\"]}", "cost_usd": 0.00970795, "bootstrap_seed": 0, "agent_model": "gpt-5.4", "held_out_score": null, "criterion_names": ["correct_category", "concise_output", "follows_format", "no_hallucination", "handles_ambiguity"], "per_criterion_scores": {"correct_category": 0.6, "concise_output": 1.0, "follows_format": 0.0, "no_hallucination": 0.7, "handles_ambiguity": 0.8}, "failure_classification": {"category": "output_format", "description": "The attempt did not reliably produce the output as exactly one verbatim label from the allowed set with nothing else, indicating a structure/formatting violation rather than a reasoning or logic problem.", "fix_direction": "Tighten the generation constraints (e.g., enforce exact-match/whitelist output), and add post-generation validation that rejects any output containing extra characters, whitespace, or non-matching text.", "confidence": 0.72}, "drafts_generated": 1, "drafts_survived": 1}
{"id": "c7b0176b-515d-4d8a-9d6b-8ab1cf52416e", "target_id": "B1-greedy", "git_sha": "8846b3cbb734a05091414359465050afa82eef7c", "pre_experiment_sha": "1a998caeb919b4330bbf473131aecb60e21ca5f6", "timestamp": "2026-04-19T16:47:59.792932+00:00", "hypothesis": "Make the output constraint stricter by requiring a verbatim copy of exactly one allowed label and nothing else.", "hypothesis_source": "agent", "mutation_diff_summary": "", "score": 3.3, "score_ci_lower": 2.9, "score_ci_upper": 3.7, "raw_scores": [3.5, 2.5, 3.5, 3.0, 4.0], "baseline_score": 3.0, "outcome": "KEPT", "failure_mode": null, "duration_seconds": 13.912731332937256, "tags": ["format-compliance", "exact-match", "single-label"], "learnings": "{\"what_changed\":\"\",\"what_improved\":[],\"what_regressed\":[],\"transferable_insight\":\"When outputs must match a single allowed token exactly, stricter formatting constraints can improve reliability by reducing ambiguity and extraneous variation.\",\"domain_tags\":[\"prompting\",\"output-formatting\",\"reliability\"]}", "cost_usd": 0.01017255, "bootstrap_seed": 0, "agent_model": "gpt-5.4", "held_out_score": null, "criterion_names": ["correct_category", "concise_output", "follows_format", "no_hallucination", "handles_ambiguity"], "per_criterion_scores": {"correct_category": 0.7, "concise_output": 1.0, "follows_format": 0.0, "no_hallucination": 0.6, "handles_ambiguity": 1.0}, "failure_classification": null, "drafts_generated": 1, "drafts_survived": 1}
{"id": "a243cedf-3d48-493b-be7f-d9e9c366eb1e", "target_id": "B1-greedy", "git_sha": "8846b3cbb734a05091414359465050afa82eef7c", "pre_experiment_sha": "8846b3cbb734a05091414359465050afa82eef7c", "timestamp": "2026-04-19T16:48:16.252009+00:00", "hypothesis": "Tightening the output-only constraint and simplifying the instruction will improve exact-label compliance.", "hypothesis_source": "agent", "mutation_diff_summary": "", "score": 2.9, "score_ci_lower": 2.4, "score_ci_upper": 3.3, "raw_scores": [3.0, 2.0, 3.0, 3.5, 3.0], "baseline_score": 3.3, "outcome": "DISCARDED", "failure_mode": null, "duration_seconds": 14.971180667052977, "tags": ["exact-match", "output-constraint", "classification"], "learnings": "{\"what_changed\":\"\",\"what_improved\":[],\"what_regressed\":[],\"transferable_insight\":\"Making instructions shorter or more restrictive does not necessarily improve compliance if the task constraints are already clear and the change adds no meaningful guidance.\",\"domain_tags\":[\"instruction-following\",\"prompt-design\",\"evaluation\"]}", "cost_usd": 0.00980255, "bootstrap_seed": 0, "agent_model": "gpt-5.4", "held_out_score": null, "criterion_names": ["correct_category", "concise_output", "follows_format", "no_hallucination", "handles_ambiguity"], "per_criterion_scores": {"correct_category": 0.4, "concise_output": 1.0, "follows_format": 0.0, "no_hallucination": 0.5, "handles_ambiguity": 1.0}, "failure_classification": {"category": "output_format", "description": "The experiment did not achieve the required exact-label compliance even after tightening the output-only constraint and simplifying the instruction, indicating the model likely produced outputs that did not match the expected label/format/schema exactly.", "fix_direction": "Focus on enforcing strict output schema/labels (e.g., single-token/whitelisted label outputs), add formatting guardrails (no extra text, exact label strings), and validate outputs against a parser/regex before scoring.", "confidence": 0.56}, "drafts_generated": 1, "drafts_survived": 1}
{"id": "790d66b4-10b4-40e4-9587-5d77f7b04648", "target_id": "B1-greedy", "git_sha": "8846b3cbb734a05091414359465050afa82eef7c", "pre_experiment_sha": "8846b3cbb734a05091414359465050afa82eef7c", "timestamp": "2026-04-19T16:48:37.754905+00:00", "hypothesis": "Make the output constraint maximally explicit so the model returns exactly one allowed label and nothing else.", "hypothesis_source": "agent", "mutation_diff_summary": "", "score": 3.3, "score_ci_lower": 2.6, "score_ci_upper": 3.9, "raw_scores": [4.0, 2.0, 3.5, 4.0, 3.0], "baseline_score": 3.3, "outcome": "DISCARDED", "failure_mode": null, "duration_seconds": 16.469785124994814, "tags": ["format-control", "exact-match", "brevity"], "learnings": "{\"what_changed\":\"\",\"what_improved\":[],\"what_regressed\":[],\"transferable_insight\":\"When a task requires a strictly bounded response, making the allowed output format explicit can help enforce compliance, but it may still fail if the model does not reliably prioritize the constraint over other generation tendencies.\",\"domain_tags\":[\"prompting\",\"output-formatting\",\"constraint-satisfaction\"]}", "cost_usd": 0.01034535, "bootstrap_seed": 0, "agent_model": "gpt-5.4", "held_out_score": null, "criterion_names": ["correct_category", "concise_output", "follows_format", "no_hallucination", "handles_ambiguity"], "per_criterion_scores": {"correct_category": 0.7, "concise_output": 1.0, "follows_format": 0.0, "no_hallucination": 0.7, "handles_ambiguity": 0.9}, "failure_classification": {"category": "output_format", "description": "The experiment failed due to not meeting the required output constraint: the model did not return exactly one allowed label with no extra text (i.e., output structure/schema was violated).", "fix_direction": "Tighten prompting and post-processing to enforce strict single-label output (e.g., constrain to one-token/one-class response, use explicit formatting like JSON with a single field, and add deterministic output validation to reject/reprompt on any deviation).", "confidence": 0.62}, "drafts_generated": 1, "drafts_survived": 1}
{"id": "f44d52af-7f79-4ffa-96f8-4185086f805c", "target_id": "B1-greedy", "git_sha": "8846b3cbb734a05091414359465050afa82eef7c", "pre_experiment_sha": "8846b3cbb734a05091414359465050afa82eef7c", "timestamp": "2026-04-19T16:48:53.567814+00:00", "hypothesis": "Make the prompt shorter and stricter so the model outputs exactly one verbatim label with nothing else.", "hypothesis_source": "agent", "mutation_diff_summary": "", "score": 2.9, "score_ci_lower": 2.4, "score_ci_upper": 3.4, "raw_scores": [3.5, 3.0, 2.0, 2.5, 3.5], "baseline_score": 3.3, "outcome": "DISCARDED", "failure_mode": null, "duration_seconds": 12.582415084005333, "tags": ["format-control", "exact-match", "brevity"], "learnings": "{\"what_changed\":\"\",\"what_improved\":[],\"what_regressed\":[],\"transferable_insight\":\"Making instructions shorter and stricter does not reliably improve exact-format compliance, because overly constrained prompts can still fail to produce the desired output.\",\"domain_tags\":[\"prompt-engineering\",\"instruction-following\",\"output-formatting\"]}", "cost_usd": 0.00886955, "bootstrap_seed": 0, "agent_model": "gpt-5.4", "held_out_score": null, "criterion_names": ["correct_category", "concise_output", "follows_format", "no_hallucination", "handles_ambiguity"], "per_criterion_scores": {"correct_category": 0.6, "concise_output": 1.0, "follows_format": 0.0, "no_hallucination": 0.5, "handles_ambiguity": 0.8}, "failure_classification": {"category": "output_format", "description": "The prompt/behavior did not reliably enforce the requirement that the model output exactly one verbatim label with nothing else, leading to an unexpected or nonconforming output format.", "fix_direction": "Tighten and validate output formatting constraints (e.g., stronger instructions, use of exact-match templates, and/or post-generation checks that reject any extra text).", "confidence": 0.62}, "drafts_generated": 1, "drafts_survived": 1}
{"id": "bc87f4c2-d935-43c8-9f15-f8f4efa2050e", "target_id": "B1-greedy", "git_sha": "8846b3cbb734a05091414359465050afa82eef7c", "pre_experiment_sha": "8846b3cbb734a05091414359465050afa82eef7c", "timestamp": "2026-04-19T16:49:18.425018+00:00", "hypothesis": "Make the instruction shorter and stricter so the model outputs exactly one verbatim label and nothing else.", "hypothesis_source": "agent", "mutation_diff_summary": "", "score": 3.1, "score_ci_lower": 2.6, "score_ci_upper": 3.6, "raw_scores": [3.0, 4.0, 3.5, 2.5, 2.5], "baseline_score": 3.3, "outcome": "DISCARDED", "failure_mode": null, "duration_seconds": 21.564518583007157, "tags": ["format-compliance", "exact-match", "brevity"], "learnings": "{\"what_changed\":\"\",\"what_improved\":[],\"what_regressed\":[],\"transferable_insight\":\"When a task requires a single exact output, tightening the instruction alone may not improve compliance and can even reduce performance if it removes useful guidance or context.\",\"domain_tags\":[\"prompting\",\"instruction-design\",\"output-control\"]}", "cost_usd": 0.00920955, "bootstrap_seed": 0, "agent_model": "gpt-5.4", "held_out_score": null, "criterion_names": ["correct_category", "concise_output", "follows_format", "no_hallucination", "handles_ambiguity"], "per_criterion_scores": {"correct_category": 0.6, "concise_output": 1.0, "follows_format": 0.0, "no_hallucination": 0.6, "handles_ambiguity": 0.9}, "failure_classification": {"category": "output_format", "description": "The attempt did not reliably produce exactly one verbatim label and nothing else, indicating an output structure/schema violation relative to the required strict formatting.", "fix_direction": "Tighten the prompt/instructions to enforce a single-label-only response (e.g., constrain output with explicit formatting rules, remove all other allowed text, and add examples/negative constraints).", "confidence": 0.72}, "drafts_generated": 1, "drafts_survived": 1}
