{"id": "0625287c-ab37-40ae-a27f-5ecd585601d5", "target_id": "B1-greedy", "git_sha": "57016d115e7079ea3bf7d1b288b11ccc0ce1f47a", "pre_experiment_sha": "68d96c185fbe6e19a4b0d379f77244ff8b5e62d6", "timestamp": "2026-04-19T01:04:15.335234+00:00", "hypothesis": "Making the prompt require a single-label output with no explanation will better satisfy binary grading criteria.", "hypothesis_source": "agent", "mutation_diff_summary": "", "score": 2.8, "score_ci_lower": 2.3, "score_ci_upper": 3.2, "raw_scores": [3.5, 2.5, 2.0, 3.0, 3.0], "baseline_score": 0.0, "outcome": "KEPT", "failure_mode": null, "duration_seconds": 13.061838458059356, "tags": ["classification", "strict-output", "concise"], "learnings": "{\"what_changed\":\"\",\"what_improved\":[],\"what_regressed\":[],\"transferable_insight\":\"Constraining outputs to a single label with no explanation can improve alignment with binary evaluation criteria by reducing ambiguity and extraneous content.\",\"domain_tags\":[\"prompting\",\"evaluation\",\"classification\"]}", "cost_usd": 0.0070133500000000015, "bootstrap_seed": 0, "agent_model": "gpt-5.4", "held_out_score": null, "criterion_names": ["correct_category", "concise_output", "follows_format", "no_hallucination", "handles_ambiguity"], "per_criterion_scores": {"correct_category": 0.4, "concise_output": 0.9, "follows_format": 0.0, "no_hallucination": 0.5, "handles_ambiguity": 1.0}, "failure_classification": null, "drafts_generated": 1, "drafts_survived": 1}
{"id": "d73faf54-9a51-4226-83b3-7af6be26b853", "target_id": "B1-greedy", "git_sha": "6b1967af2c2e9d5ea1e28e68bd6053199d7dd725", "pre_experiment_sha": "57016d115e7079ea3bf7d1b288b11ccc0ce1f47a", "timestamp": "2026-04-19T01:04:28.991208+00:00", "hypothesis": "Adding stronger decision rules for ambiguity, specificity, and output purity will improve single-label classification consistency.", "hypothesis_source": "agent", "mutation_diff_summary": "", "score": 3.3, "score_ci_lower": 3.1, "score_ci_upper": 3.5, "raw_scores": [3.5, 3.0, 3.5, 3.0, 3.5], "baseline_score": 2.8, "outcome": "KEPT", "failure_mode": null, "duration_seconds": 12.640495832893066, "tags": ["classification", "prompt-optimization", "determinism", "ambiguity-handling"], "learnings": "{\"what_changed\":\"\",\"what_improved\":[],\"what_regressed\":[],\"transferable_insight\":\"When a task has ambiguous inputs and a single required output, explicitly tightening decision criteria and output constraints can improve consistency without changing the underlying content.\",\"domain_tags\":[\"decision-making\",\"classification\",\"output-quality\"]}", "cost_usd": 0.00877755, "bootstrap_seed": 0, "agent_model": "gpt-5.4", "held_out_score": null, "criterion_names": ["correct_category", "concise_output", "follows_format", "no_hallucination", "handles_ambiguity"], "per_criterion_scores": {"correct_category": 0.6, "concise_output": 1.0, "follows_format": 0.0, "no_hallucination": 0.7, "handles_ambiguity": 1.0}, "failure_classification": null, "drafts_generated": 1, "drafts_survived": 1}
{"id": "cb1d072d-f489-4e87-9908-ba94cd7b3b83", "target_id": "B1-greedy", "git_sha": "6b1967af2c2e9d5ea1e28e68bd6053199d7dd725", "pre_experiment_sha": "6b1967af2c2e9d5ea1e28e68bd6053199d7dd725", "timestamp": "2026-04-19T01:04:49.286498+00:00", "hypothesis": "Adding tighter tie-breaking and output-discipline rules will improve single-label selection accuracy.", "hypothesis_source": "agent", "mutation_diff_summary": "", "score": 2.7, "score_ci_lower": 2.3, "score_ci_upper": 3.0, "raw_scores": [3.0, 2.5, 3.0, 3.0, 2.0], "baseline_score": 3.3, "outcome": "DISCARDED", "failure_mode": null, "duration_seconds": 19.354063333943486, "tags": ["classification", "single-label", "output-format", "tie-breaking"], "learnings": "{\"what_changed\":\"\",\"what_improved\":[],\"what_regressed\":[],\"transferable_insight\":\"Adding stricter decision rules can reduce flexibility without improving accuracy, so constraints should be validated against measurable gains before adoption.\",\"domain_tags\":[\"decision-making\",\"evaluation\",\"optimization\"]}", "cost_usd": 0.012258950000000001, "bootstrap_seed": 0, "agent_model": "gpt-5.4", "held_out_score": null, "criterion_names": ["correct_category", "concise_output", "follows_format", "no_hallucination", "handles_ambiguity"], "per_criterion_scores": {"correct_category": 0.3, "concise_output": 1.0, "follows_format": 0.0, "no_hallucination": 0.5, "handles_ambiguity": 0.9}, "failure_classification": {"category": "logic_error", "description": "The attempt failed despite adding tie-breaking and output-discipline rules, but the resulting behavior did not meet the intended single-label selection accuracy objective, indicating reasoning/selection logic did not correctly implement the desired tie-break outcomes.", "fix_direction": "Re-check tie-breaking decision rules end-to-end (including edge cases), verify the selection criteria match the hypothesis, and add targeted tests for ties and output formatting constraints to ensure the implemented logic aligns with the expected meaning.", "confidence": 0.45}, "drafts_generated": 1, "drafts_survived": 1}
{"id": "6419a5a1-7378-4a1a-bdd9-61c5fe06ecea", "target_id": "B1-greedy", "git_sha": "6b1967af2c2e9d5ea1e28e68bd6053199d7dd725", "pre_experiment_sha": "6b1967af2c2e9d5ea1e28e68bd6053199d7dd725", "timestamp": "2026-04-19T01:05:09.271699+00:00", "hypothesis": "Tightening deterministic ambiguity resolution and output purity rules will improve single-label compliance and grading consistency.", "hypothesis_source": "agent", "mutation_diff_summary": "", "score": 2.9, "score_ci_lower": 2.3, "score_ci_upper": 3.5, "raw_scores": [2.0, 2.5, 4.0, 3.0, 3.0], "baseline_score": 3.3, "outcome": "DISCARDED", "failure_mode": null, "duration_seconds": 14.91400845895987, "tags": ["single-label", "deterministic", "output-format", "ambiguity-resolution"], "learnings": "{\"what_changed\":\"\",\"what_improved\":[],\"what_regressed\":[],\"transferable_insight\":\"When a task requires a single unambiguous output, stricter formatting and decision rules can improve consistency only if they do not add enough rigidity to suppress valid responses or increase failure modes.\",\"domain_tags\":[\"evaluation\",\"process-design\",\"quality-control\"]}", "cost_usd": 0.01117095, "bootstrap_seed": 0, "agent_model": "gpt-5.4", "held_out_score": null, "criterion_names": ["correct_category", "concise_output", "follows_format", "no_hallucination", "handles_ambiguity"], "per_criterion_scores": {"correct_category": 0.3, "concise_output": 1.0, "follows_format": 0.0, "no_hallucination": 0.8, "handles_ambiguity": 0.8}, "failure_classification": {"category": "semantic_drift", "description": "Experiment aimed to improve single-label compliance via stricter ambiguity resolution/output purity, but the result scored poorly, indicating the outputs likely remained logically correct in format yet failed the intended semantic/label-selection behavior (i.e., the meaning/label choice did not match the grader\u2019s expectations).", "fix_direction": "Focus on aligning the disambiguation and label-selection logic with the grader\u2019s exact interpretation rules (treating ambiguity deterministically), and validate against edge cases where multiple labels could be plausible; add targeted tests for label purity/compliance rather than only formatting constraints.", "confidence": 0.46}, "drafts_generated": 1, "drafts_survived": 1}
{"id": "fd8deab3-6bf2-4665-8dfb-c158b708a590", "target_id": "B1-greedy", "git_sha": "6b1967af2c2e9d5ea1e28e68bd6053199d7dd725", "pre_experiment_sha": "6b1967af2c2e9d5ea1e28e68bd6053199d7dd725", "timestamp": "2026-04-19T01:05:26.922267+00:00", "hypothesis": "Tightening deterministic ambiguity resolution and output purity rules will improve single-label compliance and grading.", "hypothesis_source": "agent", "mutation_diff_summary": "", "score": 2.9, "score_ci_lower": 2.2, "score_ci_upper": 3.6, "raw_scores": [3.5, 2.0, 2.0, 3.0, 4.0], "baseline_score": 3.3, "outcome": "DISCARDED", "failure_mode": null, "duration_seconds": 14.909504792070948, "tags": ["classification", "single-label", "deterministic", "output-format"], "learnings": "{\"what_changed\":\"\",\"what_improved\":[],\"what_regressed\":[],\"transferable_insight\":\"Stricter constraints can improve consistency only when they reduce ambiguity without suppressing necessary flexibility, so rule changes should be validated against both compliance and overall task quality.\",\"domain_tags\":[\"evaluation\",\"decision-making\",\"quality-control\"]}", "cost_usd": 0.011848350000000002, "bootstrap_seed": 0, "agent_model": "gpt-5.4", "held_out_score": null, "criterion_names": ["correct_category", "concise_output", "follows_format", "no_hallucination", "handles_ambiguity"], "per_criterion_scores": {"correct_category": 0.4, "concise_output": 1.0, "follows_format": 0.0, "no_hallucination": 0.5, "handles_ambiguity": 1.0}, "failure_classification": {"category": "semantic_drift", "description": "The attempt appears to have produced a result that scored low and likely failed to meet the intended meaning/decision criteria (even if the output format may have remained structurally valid). The low score suggests the changes did not preserve the correct underlying resolution/selection behavior.", "fix_direction": "Tighten the ambiguity-resolution logic and verify single-label selection behavior against known test cases; add rule-based checks to ensure the chosen label matches the intended semantics rather than only improving surface compliance.", "confidence": 0.42}, "drafts_generated": 1, "drafts_survived": 1}
{"id": "e083a9ea-3b1b-4dc4-91b1-349627eb23f1", "target_id": "B1-greedy", "git_sha": "6b1967af2c2e9d5ea1e28e68bd6053199d7dd725", "pre_experiment_sha": "6b1967af2c2e9d5ea1e28e68bd6053199d7dd725", "timestamp": "2026-04-19T01:05:57.208550+00:00", "hypothesis": "Tightening deterministic tie-breaking and ambiguity resolution will improve single-label purity and scoring consistency.", "hypothesis_source": "agent", "mutation_diff_summary": "", "score": 2.9, "score_ci_lower": 2.5, "score_ci_upper": 3.5, "raw_scores": [2.5, 2.5, 3.0, 2.5, 4.0], "baseline_score": 3.3, "outcome": "DISCARDED", "failure_mode": null, "duration_seconds": 28.14346437493805, "tags": ["single-label", "deterministic", "ambiguity-handling", "output-purity"], "learnings": "{\"what_changed\":\"\",\"what_improved\":[],\"what_regressed\":[],\"transferable_insight\":\"Adding stricter deterministic tie-breaking and ambiguity resolution can reduce consistency and purity if it over-constrains cases that benefit from flexible handling.\",\"domain_tags\":[\"decision-making\",\"optimization\",\"evaluation\"]}", "cost_usd": 0.01260595, "bootstrap_seed": 0, "agent_model": "gpt-5.4", "held_out_score": null, "criterion_names": ["correct_category", "concise_output", "follows_format", "no_hallucination", "handles_ambiguity"], "per_criterion_scores": {"correct_category": 0.5, "concise_output": 1.0, "follows_format": 0.0, "no_hallucination": 0.5, "handles_ambiguity": 0.9}, "failure_classification": {"category": "logic_error", "description": "The provided information includes only a generic failure mode ('unknown') and a score of 2.9000 without any indication of what criterion broke (format, logic, regression, scope, syntax, semantics, or optimization). No additional error details are given to map the failure to a specific category.", "fix_direction": "Capture the concrete failure signal (e.g., diff of expected vs actual output, parser/runtime error logs, or which evaluation sub-metric dropped) and compare against prior passing runs to determine whether the issue is format/parse, reasoning, semantic mismatch, or an unintended regression.", "confidence": 0.1}, "drafts_generated": 1, "drafts_survived": 1}
{"id": "2d124a4e-a95d-4e1e-8c79-9cc9b941a7bf", "target_id": "B1-greedy", "git_sha": "6b1967af2c2e9d5ea1e28e68bd6053199d7dd725", "pre_experiment_sha": "6b1967af2c2e9d5ea1e28e68bd6053199d7dd725", "timestamp": "2026-04-19T01:06:22.042424+00:00", "hypothesis": "Tightening the output contract and ambiguity rule will improve single-label purity and deterministic grading.", "hypothesis_source": "agent", "mutation_diff_summary": "", "score": 2.9, "score_ci_lower": 2.4, "score_ci_upper": 3.4, "raw_scores": [2.5, 2.0, 3.5, 3.0, 3.5], "baseline_score": 3.3, "outcome": "DISCARDED", "failure_mode": null, "duration_seconds": 20.148336166981608, "tags": ["format-control", "single-label", "ambiguity-handling", "deterministic"], "learnings": "{\"what_changed\":\"\",\"what_improved\":[],\"what_regressed\":[],\"transferable_insight\":\"Stricter output constraints only help when they reduce ambiguity without overconstraining the task; otherwise they can fail to improve consistency or quality.\",\"domain_tags\":[\"evaluation\",\"prompting\",\"quality-control\"]}", "cost_usd": 0.00987755, "bootstrap_seed": 0, "agent_model": "gpt-5.4", "held_out_score": null, "criterion_names": ["correct_category", "concise_output", "follows_format", "no_hallucination", "handles_ambiguity"], "per_criterion_scores": {"correct_category": 0.5, "concise_output": 1.0, "follows_format": 0.0, "no_hallucination": 0.5, "handles_ambiguity": 0.9}, "failure_classification": {"category": "semantic_drift", "description": "The change to tighten the output contract and ambiguity rule did not preserve the intended grading meaning, resulting in lower-than-expected single-label purity/deterministic behavior despite still attempting to follow the contract.", "fix_direction": "Verify the updated ambiguity rule and label-selection logic match the grader\u2019s exact expected semantics; add unit tests covering edge cases to ensure the same input yields the same single label and correct purity.", "confidence": 0.42}, "drafts_generated": 1, "drafts_survived": 1}
{"id": "7b18a3f4-6da6-4215-bc0a-709fce400ac0", "target_id": "B1-greedy", "git_sha": "6b1967af2c2e9d5ea1e28e68bd6053199d7dd725", "pre_experiment_sha": "6b1967af2c2e9d5ea1e28e68bd6053199d7dd725", "timestamp": "2026-04-19T01:06:51.632269+00:00", "hypothesis": "Tightening the prompt around exact-output purity and forced best-supported single-label selection will improve deterministic single-label grading.", "hypothesis_source": "agent", "mutation_diff_summary": "", "score": 3.4, "score_ci_lower": 2.9, "score_ci_upper": 3.9, "raw_scores": [4.0, 2.5, 3.5, 3.0, 4.0], "baseline_score": 3.3, "outcome": "DISCARDED", "failure_mode": null, "duration_seconds": 27.15600479207933, "tags": ["single-label", "output-purity", "ambiguity-handling", "deterministic"], "learnings": "{\"what_changed\":\"\",\"what_improved\":[],\"what_regressed\":[],\"transferable_insight\":\"When a stricter instruction changes neither measurable improvements nor regressions, the added constraint likely has little practical effect on the target outcome and should be deprioritized.\",\"domain_tags\":[\"prompt-engineering\",\"evaluation\",\"decision-making\"]}", "cost_usd": 0.01018655, "bootstrap_seed": 0, "agent_model": "gpt-5.4", "held_out_score": null, "criterion_names": ["correct_category", "concise_output", "follows_format", "no_hallucination", "handles_ambiguity"], "per_criterion_scores": {"correct_category": 0.7, "concise_output": 1.0, "follows_format": 0.0, "no_hallucination": 0.7, "handles_ambiguity": 1.0}, "failure_classification": {"category": "semantic_drift", "description": "The experiment intended to improve deterministic single-label grading by tightening prompt constraints, but the result scored lower (3.4) and the failure mode is listed as unknown, indicating the change likely altered the model\u2019s behavior/meaning rather than producing the desired deterministic, pure single-label outputs.", "fix_direction": "Tighten and validate instructions without changing task semantics: add explicit single-label selection rules, require identical label formatting, include a constrained output example, and add automated checks that measure single-label purity and label correctness separately.", "confidence": 0.42}, "drafts_generated": 1, "drafts_survived": 1}
{"id": "8f5dc2ed-41ca-4c6e-bdc2-c749bc3d89a8", "target_id": "B1-greedy", "git_sha": "6b1967af2c2e9d5ea1e28e68bd6053199d7dd725", "pre_experiment_sha": "6b1967af2c2e9d5ea1e28e68bd6053199d7dd725", "timestamp": "2026-04-19T01:07:10.332910+00:00", "hypothesis": "Tightening the prompt around exact-output purity and forced best-supported single-label choice will improve deterministic single-label grading.", "hypothesis_source": "agent", "mutation_diff_summary": "", "score": 3.0, "score_ci_lower": 2.6, "score_ci_upper": 3.4, "raw_scores": [3.5, 2.5, 2.5, 3.0, 3.5], "baseline_score": 3.3, "outcome": "DISCARDED", "failure_mode": null, "duration_seconds": 15.761491374927573, "tags": ["single-label", "output-format", "strictness", "ambiguity-handling"], "learnings": "{\"what_changed\":\"\",\"what_improved\":[],\"what_regressed\":[],\"transferable_insight\":\"When a change is discarded with no observed improvements or regressions, it likely adds complexity without measurable benefit, so prefer simpler defaults unless evidence shows a clear gain.\",\"domain_tags\":[\"decision-making\",\"experimentation\",\"optimization\"]}", "cost_usd": 0.01043215, "bootstrap_seed": 0, "agent_model": "gpt-5.4", "held_out_score": null, "criterion_names": ["correct_category", "concise_output", "follows_format", "no_hallucination", "handles_ambiguity"], "per_criterion_scores": {"correct_category": 0.5, "concise_output": 1.0, "follows_format": 0.0, "no_hallucination": 0.6, "handles_ambiguity": 0.9}, "failure_classification": {"category": "logic_error", "description": "The provided information is insufficient to determine what specifically failed. The hypothesis and score are given, but there are no logs, grader feedback, or evidence of a format/logic/regression issue.", "fix_direction": "Include the exact failure signal (e.g., grader error message, diff from expected output, or examples of incorrect outputs) and verify whether the problem is output structure, reasoning meaning, prior criterion degradation, or potential evaluation gaming.", "confidence": 0.15}, "drafts_generated": 1, "drafts_survived": 1}
{"id": "1f1de55d-3025-42de-bb23-7aed9c849e17", "target_id": "B1-greedy", "git_sha": "6b1967af2c2e9d5ea1e28e68bd6053199d7dd725", "pre_experiment_sha": "6b1967af2c2e9d5ea1e28e68bd6053199d7dd725", "timestamp": "2026-04-19T01:07:28.106103+00:00", "hypothesis": "Tightening the prompt to an absolute one-label-only contract with a minimal best-supported-choice rule will improve binary grading consistency.", "hypothesis_source": "agent", "mutation_diff_summary": "", "score": 2.9, "score_ci_lower": 2.7, "score_ci_upper": 3.0, "raw_scores": [3.0, 3.0, 2.5, 3.0, 3.0], "baseline_score": 3.3, "outcome": "DISCARDED", "failure_mode": null, "duration_seconds": 13.845454249996692, "tags": ["single-label", "deterministic-output", "strict-format", "minimal-rule"], "learnings": "{\"what_changed\":\"\",\"what_improved\":[],\"what_regressed\":[],\"transferable_insight\":\"Making an instruction more restrictive does not necessarily improve consistency if the task still requires judgment under ambiguity; the decision rule must also reduce uncertainty and clarify tie-breaking criteria.\",\"domain_tags\":[\"prompt-design\",\"decision-making\",\"evaluation\"]}", "cost_usd": 0.009545950000000001, "bootstrap_seed": 0, "agent_model": "gpt-5.4", "held_out_score": null, "criterion_names": ["correct_category", "concise_output", "follows_format", "no_hallucination", "handles_ambiguity"], "per_criterion_scores": {"correct_category": 0.5, "concise_output": 1.0, "follows_format": 0.0, "no_hallucination": 0.5, "handles_ambiguity": 0.9}, "failure_classification": {"category": "logic_error", "description": "The attempt did not achieve the intended effect on binary grading consistency; the experiment\u2019s outcome (low score and stated failure mode unknown) suggests the change to enforce a one-label-only minimal best-supported-choice rule did not correctly address the underlying reason for grading inconsistency.", "fix_direction": "Re-evaluate the assumptions behind the hypothesis and test alternative prompt constraints or decision procedures (e.g., clearer tie-breaking rules, calibration across labels, explicit grader instructions) while validating against a representative set of examples to ensure the rule maps consistently to the grader\u2019s expectations.", "confidence": 0.46}, "drafts_generated": 1, "drafts_survived": 1}
