{"id": "1cde2c21-59bd-4837-ac2c-7e1917ba256e", "target_id": "B1-greedy", "git_sha": "8846b3cbb734a05091414359465050afa82eef7c", "pre_experiment_sha": "8846b3cbb734a05091414359465050afa82eef7c", "timestamp": "2026-04-19T16:53:01.745114+00:00", "hypothesis": "Make the prompt more explicit about exact single-label output and remove distracting wording.", "hypothesis_source": "agent", "mutation_diff_summary": "", "score": 2.7, "score_ci_lower": 2.3, "score_ci_upper": 3.1, "raw_scores": [2.0, 3.0, 2.5, 2.5, 3.5], "baseline_score": 3.3, "outcome": "DISCARDED", "failure_mode": null, "duration_seconds": 12.64565116702579, "tags": ["exact-match", "single-label", "concise"], "learnings": "{\"what_changed\":\"\",\"what_improved\":[],\"what_regressed\":[],\"transferable_insight\":\"Making instructions more explicit and removing distractions does not necessarily improve performance; changes should be validated empirically rather than assumed beneficial.\",\"domain_tags\":[\"prompting\",\"evaluation\",\"instruction-design\"]}", "cost_usd": 0.00846715, "bootstrap_seed": 0, "agent_model": "gpt-5.4", "held_out_score": null, "criterion_names": ["correct_category", "concise_output", "follows_format", "no_hallucination", "handles_ambiguity"], "per_criterion_scores": {"correct_category": 0.3, "concise_output": 1.0, "follows_format": 0.0, "no_hallucination": 0.6, "handles_ambiguity": 0.8}, "failure_classification": {"category": "output_format", "description": "The change to make the prompt more explicit about a single-label output did not consistently enforce the required output structure/schema, leading to an output format mismatch.", "fix_direction": "Tighten the prompt with a strict output schema (e.g., require JSON with a single key/value), add explicit formatting constraints (no extra text), and verify with examples of valid/invalid outputs.", "confidence": 0.62}, "drafts_generated": 1, "drafts_survived": 1}
{"id": "da978294-d253-4a09-a513-e35e70e067a5", "target_id": "B1-greedy", "git_sha": "8846b3cbb734a05091414359465050afa82eef7c", "pre_experiment_sha": "8846b3cbb734a05091414359465050afa82eef7c", "timestamp": "2026-04-19T16:53:18.041773+00:00", "hypothesis": "Make the prompt more explicit about exact single-label output and remove extra guidance that could distract from verbatim matching.", "hypothesis_source": "agent", "mutation_diff_summary": "", "score": 2.8, "score_ci_lower": 2.5, "score_ci_upper": 3.2, "raw_scores": [2.5, 2.5, 2.5, 3.0, 3.5], "baseline_score": 3.3, "outcome": "DISCARDED", "failure_mode": null, "duration_seconds": 13.304101833025925, "tags": ["exact-match", "single-label", "concise"], "learnings": "{\"what_changed\":\"\",\"what_improved\":[],\"what_regressed\":[],\"transferable_insight\":\"When exact matching is required, simplifying instructions to emphasize a single unambiguous output format can reduce errors caused by competing guidance.\",\"domain_tags\":[\"prompt-design\",\"instruction-following\",\"output-formatting\"]}", "cost_usd": 0.008530949999999999, "bootstrap_seed": 0, "agent_model": "gpt-5.4", "held_out_score": null, "criterion_names": ["correct_category", "concise_output", "follows_format", "no_hallucination", "handles_ambiguity"], "per_criterion_scores": {"correct_category": 0.5, "concise_output": 1.0, "follows_format": 0.0, "no_hallucination": 0.4, "handles_ambiguity": 0.9}, "failure_classification": {"category": "output_format", "description": "The prompt edit did not reliably enforce an exact single-label, verbatim output; the result likely deviated from the expected output structure/schema despite remaining relevant to the instruction changes.", "fix_direction": "Tighten output constraints (e.g., explicit required label list, exact token/JSON-only response, no extra text) and reduce or remove any guidance that could cause formatting or verbosity variance; add an explicit 'respond with exactly: <LABEL>' requirement.", "confidence": 0.62}, "drafts_generated": 1, "drafts_survived": 1}
{"id": "397e5965-cb3c-4d3d-8657-6afb8402789b", "target_id": "B1-greedy", "git_sha": "8846b3cbb734a05091414359465050afa82eef7c", "pre_experiment_sha": "8846b3cbb734a05091414359465050afa82eef7c", "timestamp": "2026-04-19T16:53:35.804747+00:00", "hypothesis": "A shorter exact-output instruction will reduce format errors and improve binary criteria compliance.", "hypothesis_source": "agent", "mutation_diff_summary": "", "score": 3.1, "score_ci_lower": 2.4, "score_ci_upper": 3.7, "raw_scores": [3.5, 2.5, 4.0, 3.5, 2.0], "baseline_score": 3.3, "outcome": "DISCARDED", "failure_mode": null, "duration_seconds": 13.076391458977014, "tags": ["format-strict", "exact-match", "concise"], "learnings": "{\"what_changed\":\"\",\"what_improved\":[],\"what_regressed\":[],\"transferable_insight\":\"Shortening an instruction does not necessarily improve compliance or output quality, so changes should be validated empirically rather than assumed to help.\",\"domain_tags\":[\"prompt-design\",\"experimentation\",\"quality-control\"]}", "cost_usd": 0.007959950000000002, "bootstrap_seed": 0, "agent_model": "gpt-5.4", "held_out_score": null, "criterion_names": ["correct_category", "concise_output", "follows_format", "no_hallucination", "handles_ambiguity"], "per_criterion_scores": {"correct_category": 0.6, "concise_output": 0.8, "follows_format": 0.0, "no_hallucination": 0.8, "handles_ambiguity": 0.9}, "failure_classification": {"category": "logic_error", "description": "The failure mode is not specified and the provided score alone (3.1000) is insufficient to determine whether the issue was output formatting, logic, regression, scope, syntax, semantic meaning, evaluation gaming, or an incomplete/inconsistent edit.", "fix_direction": "Capture and analyze the specific error signal (e.g., schema/format mismatch vs. wrong reasoning), include the failing output and exact evaluation message, then iterate on the instruction length/content accordingly.", "confidence": 0.05}, "drafts_generated": 1, "drafts_survived": 1}
{"id": "441506af-2db1-4b37-99bd-692ea23fa5df", "target_id": "B1-greedy", "git_sha": "8846b3cbb734a05091414359465050afa82eef7c", "pre_experiment_sha": "8846b3cbb734a05091414359465050afa82eef7c", "timestamp": "2026-04-19T16:53:51.657670+00:00", "hypothesis": "A shorter exact-output instruction will reduce format errors by forcing one verbatim label and nothing else.", "hypothesis_source": "agent", "mutation_diff_summary": "", "score": 3.1, "score_ci_lower": 2.8, "score_ci_upper": 3.4, "raw_scores": [2.5, 3.0, 3.5, 3.0, 3.5], "baseline_score": 3.3, "outcome": "DISCARDED", "failure_mode": null, "duration_seconds": 12.37959570903331, "tags": ["exact-match", "output-format", "concise"], "learnings": "{\"what_changed\":\"\",\"what_improved\":[],\"what_regressed\":[],\"transferable_insight\":\"When a task requires strict formatting, brevity alone does not guarantee compliance; the instruction must also remove ambiguity and explicitly constrain all allowed output.\",\"domain_tags\":[\"prompt-design\",\"instruction-following\",\"formatting\"]}", "cost_usd": 0.00813235, "bootstrap_seed": 0, "agent_model": "gpt-5.4", "held_out_score": null, "criterion_names": ["correct_category", "concise_output", "follows_format", "no_hallucination", "handles_ambiguity"], "per_criterion_scores": {"correct_category": 0.4, "concise_output": 1.0, "follows_format": 0.0, "no_hallucination": 0.7, "handles_ambiguity": 1.0}, "failure_classification": {"category": "output_format", "description": "The experiment\u2019s output format did not match the required schema/structure, indicating that the exact-output instruction was insufficiently enforced, leading to format errors (rather than a logic/semantic failure).", "fix_direction": "Tighten the output schema constraints: require a single verbatim label with no extra tokens, add explicit JSON-only formatting requirements, and enforce validation/stop conditions to prevent any additional text.", "confidence": 0.62}, "drafts_generated": 1, "drafts_survived": 1}
{"id": "e75757e3-0b3c-489d-978c-524aeb7cad5f", "target_id": "B1-greedy", "git_sha": "8846b3cbb734a05091414359465050afa82eef7c", "pre_experiment_sha": "8846b3cbb734a05091414359465050afa82eef7c", "timestamp": "2026-04-19T16:54:09.041490+00:00", "hypothesis": "A shorter exact-output instruction will reduce format errors and improve binary criteria score.", "hypothesis_source": "agent", "mutation_diff_summary": "", "score": 2.9, "score_ci_lower": 2.6, "score_ci_upper": 3.2, "raw_scores": [2.5, 2.5, 3.5, 3.0, 3.0], "baseline_score": 3.3, "outcome": "DISCARDED", "failure_mode": null, "duration_seconds": 14.522424833965488, "tags": ["format-strict", "exact-match", "concise"], "learnings": "{\"what_changed\":\"\",\"what_improved\":[],\"what_regressed\":[],\"transferable_insight\":\"Shortening instructions does not reliably improve compliance or quality, so changes to brevity should be validated empirically rather than assumed beneficial.\",\"domain_tags\":[\"prompt-design\",\"evaluation\",\"experimentation\"]}", "cost_usd": 0.00818595, "bootstrap_seed": 0, "agent_model": "gpt-5.4", "held_out_score": null, "criterion_names": ["correct_category", "concise_output", "follows_format", "no_hallucination", "handles_ambiguity"], "per_criterion_scores": {"correct_category": 0.5, "concise_output": 1.0, "follows_format": 0.0, "no_hallucination": 0.6, "handles_ambiguity": 0.8}, "failure_classification": {"category": "output_format", "description": "The experiment is classified as a format-related failure: despite the hypothesis about shortening the instruction, the run failed to meet the required output structure/schema, producing format errors that lowered the binary criteria score.", "fix_direction": "Keep the output schema strictly specified (required keys/order/JSON validity), and validate the model\u2019s output against the schema before scoring; if shortening, preserve all formatting constraints and add an explicit 'output only' template.", "confidence": 0.42}, "drafts_generated": 1, "drafts_survived": 1}
{"id": "05e60fa1-9bff-4ffc-b13c-3a140d6f2376", "target_id": "B1-greedy", "git_sha": "8846b3cbb734a05091414359465050afa82eef7c", "pre_experiment_sha": "8846b3cbb734a05091414359465050afa82eef7c", "timestamp": "2026-04-19T16:54:24.599576+00:00", "hypothesis": "A shorter exact-output instruction will reduce format errors and improve one-label-only compliance.", "hypothesis_source": "agent", "mutation_diff_summary": "", "score": 3.0, "score_ci_lower": 2.6, "score_ci_upper": 3.5, "raw_scores": [2.5, 2.5, 4.0, 3.0, 3.0], "baseline_score": 3.3, "outcome": "DISCARDED", "failure_mode": null, "duration_seconds": 11.65592116699554, "tags": ["format-control", "exact-match", "concise"], "learnings": "{\"what_changed\":\"\",\"what_improved\":[],\"what_regressed\":[],\"transferable_insight\":\"Concise instructions do not necessarily improve compliance; if the required format is critical, explicit constraints and examples may be more effective than brevity alone.\",\"domain_tags\":[\"instruction-design\",\"compliance\",\"communication\"]}", "cost_usd": 0.008274150000000001, "bootstrap_seed": 0, "agent_model": "gpt-5.4", "held_out_score": null, "criterion_names": ["correct_category", "concise_output", "follows_format", "no_hallucination", "handles_ambiguity"], "per_criterion_scores": {"correct_category": 0.5, "concise_output": 1.0, "follows_format": 0.0, "no_hallucination": 0.7, "handles_ambiguity": 0.8}, "failure_classification": {"category": "output_format", "description": "The experiment failed to comply with the required exact output structure/schema (format errors), indicating the model did not reliably follow the one-label-only and/or formatting constraints.", "fix_direction": "Use a stricter, explicit output template in the prompt (including an example), reinforce the exact required fields and label-only constraint, and validate outputs post-generation against the schema.", "confidence": 0.45}, "drafts_generated": 1, "drafts_survived": 1}
{"id": "a8bc9e1c-c16a-44dc-b333-d0f9d7bce782", "target_id": "B1-greedy", "git_sha": "8846b3cbb734a05091414359465050afa82eef7c", "pre_experiment_sha": "8846b3cbb734a05091414359465050afa82eef7c", "timestamp": "2026-04-19T16:54:42.597977+00:00", "hypothesis": "A shorter, exact-output-only prompt will reduce formatting errors and improve single-label compliance.", "hypothesis_source": "agent", "mutation_diff_summary": "", "score": 2.5, "score_ci_lower": 2.0, "score_ci_upper": 2.9, "raw_scores": [3.0, 1.5, 2.5, 3.0, 2.5], "baseline_score": 3.3, "outcome": "DISCARDED", "failure_mode": null, "duration_seconds": 15.307845167000778, "tags": ["format-control", "exact-match", "classification"], "learnings": "{\"what_changed\":\"\",\"what_improved\":[],\"what_regressed\":[],\"transferable_insight\":\"When a stricter instruction changes neither the task content nor the evaluation target, it may not improve compliance and can even reduce performance by constraining useful flexibility.\",\"domain_tags\":[\"prompting\",\"instruction-following\",\"evaluation\"]}", "cost_usd": 0.00820155, "bootstrap_seed": 0, "agent_model": "gpt-5.4", "held_out_score": null, "criterion_names": ["correct_category", "concise_output", "follows_format", "no_hallucination", "handles_ambiguity"], "per_criterion_scores": {"correct_category": 0.4, "concise_output": 1.0, "follows_format": 0.0, "no_hallucination": 0.5, "handles_ambiguity": 0.6}, "failure_classification": {"category": "output_format", "description": "The experiment did not meet the required output structure/schema for a single-label classification task, leading to formatting/compliance errors rather than clear logical mistakes.", "fix_direction": "Tighten the prompt to strictly enforce the exact required JSON/output schema (e.g., single label only, no extra text), and validate outputs against a schema before scoring.", "confidence": 0.62}, "drafts_generated": 1, "drafts_survived": 1}
{"id": "b687235e-da8f-4625-887b-0bcb99faf4ac", "target_id": "B1-greedy", "git_sha": "8846b3cbb734a05091414359465050afa82eef7c", "pre_experiment_sha": "8846b3cbb734a05091414359465050afa82eef7c", "timestamp": "2026-04-19T16:54:59.406838+00:00", "hypothesis": "Tightening the prompt to a minimal exact-output instruction will reduce format errors and improve binary label compliance.", "hypothesis_source": "agent", "mutation_diff_summary": "", "score": 2.9, "score_ci_lower": 2.4, "score_ci_upper": 3.4, "raw_scores": [3.5, 2.0, 2.5, 3.5, 3.0], "baseline_score": 3.3, "outcome": "DISCARDED", "failure_mode": null, "duration_seconds": 14.30781929101795, "tags": ["format-control", "exact-match", "concise"], "learnings": "{\"what_changed\":\"\",\"what_improved\":[],\"what_regressed\":[],\"transferable_insight\":\"When a task requires strict structured output, reducing prompt ambiguity and specifying the exact response format can improve compliance, but overly minimal instructions may not be sufficient on their own.\",\"domain_tags\":[\"prompt-engineering\",\"structured-output\",\"classification\"]}", "cost_usd": 0.008727950000000002, "bootstrap_seed": 0, "agent_model": "gpt-5.4", "held_out_score": null, "criterion_names": ["correct_category", "concise_output", "follows_format", "no_hallucination", "handles_ambiguity"], "per_criterion_scores": {"correct_category": 0.5, "concise_output": 1.0, "follows_format": 0.0, "no_hallucination": 0.4, "handles_ambiguity": 1.0}, "failure_classification": {"category": "output_format", "description": "The experiment indicates format errors despite tightening the instruction, suggesting the model still produced outputs that deviated from the required exact structure for the binary-label task.", "fix_direction": "Enforce stricter output constraints (e.g., exact JSON schema / token pattern), add explicit examples of valid outputs, and validate with a post-check that rejects/reprompts on any schema mismatch.", "confidence": 0.56}, "drafts_generated": 1, "drafts_survived": 1}
{"id": "689f2628-a6f3-4d3c-8930-b57ddb4e259e", "target_id": "B1-greedy", "git_sha": "8846b3cbb734a05091414359465050afa82eef7c", "pre_experiment_sha": "8846b3cbb734a05091414359465050afa82eef7c", "timestamp": "2026-04-19T16:55:29.721457+00:00", "hypothesis": "Make the prompt more exact and format-focused so the model outputs one verbatim label only.", "hypothesis_source": "agent", "mutation_diff_summary": "", "score": 3.0, "score_ci_lower": 2.3, "score_ci_upper": 3.7, "raw_scores": [4.0, 3.5, 2.0, 3.5, 2.0], "baseline_score": 3.3, "outcome": "DISCARDED", "failure_mode": null, "duration_seconds": 26.184394666925073, "tags": ["exact-match", "format-control", "binary-classification", "concise"], "learnings": "{\"what_changed\":\"\",\"what_improved\":[],\"what_regressed\":[],\"transferable_insight\":\"Making instructions more exact and format-focused does not guarantee better compliance and can still degrade performance if it overconstrains the task.\",\"domain_tags\":[\"prompt-engineering\",\"instruction-following\",\"evaluation\"]}", "cost_usd": 0.009097750000000002, "bootstrap_seed": 0, "agent_model": "gpt-5.4", "held_out_score": null, "criterion_names": ["correct_category", "concise_output", "follows_format", "no_hallucination", "handles_ambiguity"], "per_criterion_scores": {"correct_category": 0.5, "concise_output": 1.0, "follows_format": 0.0, "no_hallucination": 0.7, "handles_ambiguity": 0.8}, "failure_classification": {"category": "output_format", "description": "The experiment appears to have failed because the model did not reliably follow the requested instruction to output a single verbatim label only, indicating an output structure/schema adherence problem rather than reasoning or code issues.", "fix_direction": "Tighten the output contract by enforcing exact-match instructions (e.g., single-token/label-only response), adding explicit \u201cno other text\u201d constraints, and validating/truncating model output to the allowed labels before scoring.", "confidence": 0.72}, "drafts_generated": 1, "drafts_survived": 1}
{"id": "307383b6-57c6-46cb-8e59-b5a0d1e4539d", "target_id": "B1-greedy", "git_sha": "8846b3cbb734a05091414359465050afa82eef7c", "pre_experiment_sha": "8846b3cbb734a05091414359465050afa82eef7c", "timestamp": "2026-04-19T16:55:46.407766+00:00", "hypothesis": "Tightening the prompt to a concise exact-one-label-only instruction will reduce format errors and improve binary scoring.", "hypothesis_source": "agent", "mutation_diff_summary": "", "score": 2.9, "score_ci_lower": 2.6, "score_ci_upper": 3.2, "raw_scores": [3.0, 3.0, 3.5, 2.5, 2.5], "baseline_score": 3.3, "outcome": "DISCARDED", "failure_mode": null, "duration_seconds": 14.03761179104913, "tags": ["format-control", "exact-match", "concise"], "learnings": "{\"what_changed\":\"\",\"what_improved\":[],\"what_regressed\":[],\"transferable_insight\":\"Making instructions more concise and strictly constrained does not necessarily improve output quality; if the task or model already lacks alignment, tighter formatting alone may have no measurable benefit.\",\"domain_tags\":[\"prompting\",\"evaluation\",\"instruction-design\"]}", "cost_usd": 0.009468949999999999, "bootstrap_seed": 0, "agent_model": "gpt-5.4", "held_out_score": null, "criterion_names": ["correct_category", "concise_output", "follows_format", "no_hallucination", "handles_ambiguity"], "per_criterion_scores": {"correct_category": 0.3, "concise_output": 1.0, "follows_format": 0.0, "no_hallucination": 0.6, "handles_ambiguity": 1.0}, "failure_classification": {"category": "output_format", "description": "The experiment intended to tighten the prompt format to reduce format errors, but the result still indicates a failure consistent with output not matching the required structure/schema for binary scoring.", "fix_direction": "Further constrain and enforce output structure (e.g., provide a strict template, single-label-only formatting rules, and add explicit 'do not output anything else' plus examples); validate outputs before scoring.", "confidence": 0.62}, "drafts_generated": 1, "drafts_survived": 1}
