{"id": "261e70d5-c69f-45a0-ad13-0e27f2edab62", "target_id": "B1-greedy", "git_sha": "6e9c9f3f1a3233cd35cb09734fd485f5a500187b", "pre_experiment_sha": "6e9c9f3f1a3233cd35cb09734fd485f5a500187b", "timestamp": "2026-04-23T22:39:16.963373+00:00", "hypothesis": "Refactor the prompt to remove negative constraints, add a 1-shot example demonstrating the bare category name output, and end with the \"Classification:\" indicator to guide the model's structure.", "hypothesis_source": "agent", "mutation_diff_summary": "", "score": 2.5, "score_ci_lower": 2.2, "score_ci_upper": 2.8, "raw_scores": [3.0, 2.0, 2.5, 2.5, 2.5], "baseline_score": 2.5, "outcome": "DISCARDED", "failure_mode": null, "duration_seconds": 70.59578358312137, "tags": ["structural-prompting", "1-shot", "output-indicator", "remove-negative-constraints"], "learnings": "{\"what_changed\":\"\",\"what_improved\":[],\"what_regressed\":[],\"transferable_insight\":\"Combining multiple structural prompt modifications, such as removing negative constraints and adding few-shot examples with output indicators, may yield strictly neutral results, indicating that these techniques do not inherently guarantee performance gains.\",\"domain_tags\":[\"Prompt Engineering\",\"Few-Shot Prompting\",\"Output Formatting\"]}", "cost_usd": 0.00338165, "bootstrap_seed": 0, "agent_model": "gemini-3.1-pro-preview", "held_out_score": null, "criterion_names": ["correct_category", "concise_output", "follows_format", "no_hallucination", "handles_ambiguity"], "per_criterion_scores": {"correct_category": 0.2, "concise_output": 1.0, "follows_format": 0.1, "no_hallucination": 0.2, "handles_ambiguity": 1.0}, "failure_classification": {"category": "output_format", "description": "The prompt refactoring aimed to constrain the model's output to a specific bare category name structure, guided by a 1-shot example and an indicator. The low score suggests the model failed to consistently produce the desired output format, possibly due to the removal of negative constraints or insufficient guidance leading to extraneous text or incorrect adherence to the specified structure.", "fix_direction": "Refine the prompt with stronger explicit instructions for the desired output format. This could include adding more robust few-shot examples, re-evaluating the impact of removing negative constraints, or using clearer delimiters/indicators to guide the model's structure. Consider if a more structured output (e.g., JSON) would be beneficial for parsing.", "confidence": 0.9}, "drafts_generated": 1, "drafts_survived": 1}
{"id": "7cd3b964-e778-4758-82a3-da5b04258a45", "target_id": "B1-greedy", "git_sha": "6e9c9f3f1a3233cd35cb09734fd485f5a500187b", "pre_experiment_sha": "6e9c9f3f1a3233cd35cb09734fd485f5a500187b", "timestamp": "2026-04-23T22:40:50.946653+00:00", "hypothesis": "Simplify the prompt to the bare minimum by removing explicit negative constraints and complex personas, relying solely on a direct instruction to output exactly and only the category name.", "hypothesis_source": "agent", "mutation_diff_summary": "", "score": 2.5, "score_ci_lower": 2.2, "score_ci_upper": 2.8, "raw_scores": [2.5, 2.0, 2.5, 3.0, 2.5], "baseline_score": 2.5, "outcome": "DISCARDED", "failure_mode": null, "duration_seconds": 65.58702383399941, "tags": ["prompt-simplification", "minimal-instruction", "no-negative-constraints"], "learnings": "{\"what_changed\":\"\",\"what_improved\":[],\"what_regressed\":[],\"transferable_insight\":\"Extreme simplification of instructions by removing explicit negative constraints and contextual roles yields no performance improvement, suggesting that a bare-minimum approach is not inherently superior for enforcing strict compliance.\",\"domain_tags\":[\"Prompt Engineering\",\"Instruction Optimization\",\"Constraint Management\"]}", "cost_usd": 0.00272645, "bootstrap_seed": 0, "agent_model": "gemini-3.1-pro-preview", "held_out_score": null, "criterion_names": ["correct_category", "concise_output", "follows_format", "no_hallucination", "handles_ambiguity"], "per_criterion_scores": {"correct_category": 0.1, "concise_output": 1.0, "follows_format": 0.0, "no_hallucination": 0.4, "handles_ambiguity": 1.0}, "failure_classification": {"category": "output_format", "description": "The hypothesis aimed to simplify the prompt to produce 'exactly and only the category name.' Given a low score and an 'unknown' failure mode, it's highly probable that the model failed to adhere to this strict output format. Removing explicit constraints likely led to deviations from the desired output structure (e.g., adding extra text, formatting, or providing an incomplete response) rather than just the category name.", "fix_direction": "Re-evaluate the level of simplification. If the goal is a strict output format, even minimal prompts might need very clear and unambiguous instructions, potentially with a single, clear example of the desired output, or a slightly stronger negative constraint on additional text/formatting. The balance between 'bare minimum' and 'sufficient constraint' needs adjustment.", "confidence": 0.9}, "drafts_generated": 1, "drafts_survived": 1}
{"id": "7ebe6405-ebd4-435a-93dc-db98617f4e9a", "target_id": "B1-greedy", "git_sha": "6e9c9f3f1a3233cd35cb09734fd485f5a500187b", "pre_experiment_sha": "6e9c9f3f1a3233cd35cb09734fd485f5a500187b", "timestamp": "2026-04-23T22:42:11.643572+00:00", "hypothesis": "Simplify the prompt to a minimal direct instruction, removing negative constraints and complex personas to prevent formatting errors and semantic drift.", "hypothesis_source": "agent", "mutation_diff_summary": "", "score": 2.2, "score_ci_lower": 2.0, "score_ci_upper": 2.4, "raw_scores": [2.0, 2.0, 2.5, 2.5, 2.0], "baseline_score": 2.5, "outcome": "DISCARDED", "failure_mode": null, "duration_seconds": 63.587220875080675, "tags": ["simplification", "direct-instruction", "formatting"], "learnings": "{\"what_changed\":\"\",\"what_improved\":[],\"what_regressed\":[],\"transferable_insight\":\"Over-simplifying instructions by removing explicit negative constraints and contextual framing degrades performance, indicating that detailed boundaries are necessary to maintain output quality and structure.\",\"domain_tags\":[\"Prompt Engineering\",\"Constraint Management\",\"Instruction Design\"]}", "cost_usd": 0.0026270499999999997, "bootstrap_seed": 0, "agent_model": "gemini-3.1-pro-preview", "held_out_score": null, "criterion_names": ["correct_category", "concise_output", "follows_format", "no_hallucination", "handles_ambiguity"], "per_criterion_scores": {"correct_category": 0.0, "concise_output": 1.0, "follows_format": 0.0, "no_hallucination": 0.2, "handles_ambiguity": 1.0}, "failure_classification": {"category": "semantic_drift", "description": "The attempt to simplify the prompt by removing negative constraints and complex personas, which aimed to prevent semantic drift, likely backfired. By making the instruction too minimal or direct, crucial context or specific guidance necessary for the model to correctly interpret the task's meaning was removed. This led to the model misunderstanding the core intent and producing output that was semantically incorrect or irrelevant, resulting in the very low score.", "fix_direction": "Reintroduce essential contextual information or positive constraints to guide the model's understanding without resorting to overly complex language or negative instructions. The goal should be to achieve clarity and specificity of intent, ensuring the model grasps the desired meaning, rather than just minimizing word count. Consider using examples or explicit positive instructions to define the scope and purpose of the task.", "confidence": 0.9}, "drafts_generated": 1, "drafts_survived": 1}
{"id": "7240c5eb-6648-41ef-9833-8ab2ffc4b779", "target_id": "B1-greedy", "git_sha": "6e9c9f3f1a3233cd35cb09734fd485f5a500187b", "pre_experiment_sha": "6e9c9f3f1a3233cd35cb09734fd485f5a500187b", "timestamp": "2026-04-23T22:43:27.131119+00:00", "hypothesis": "Simplify the prompt to an extremely minimal and direct instruction to output only the category name, removing negative constraints and personas.", "hypothesis_source": "agent", "mutation_diff_summary": "", "score": 2.1, "score_ci_lower": 2.0, "score_ci_upper": 2.3, "raw_scores": [2.0, 2.0, 2.0, 2.5, 2.0], "baseline_score": 2.5, "outcome": "DISCARDED", "failure_mode": null, "duration_seconds": 59.119324249913916, "tags": ["minimal", "direct", "zero-shot"], "learnings": "{\"what_changed\":\"\",\"what_improved\":[],\"what_regressed\":[],\"transferable_insight\":\"Over-simplifying prompts by removing negative constraints and persona context degrades performance, demonstrating that models rely on these elements for proper boundary setting and task grounding.\",\"domain_tags\":[\"Prompt Engineering\",\"Constraint Formatting\",\"Persona Design\"]}", "cost_usd": 0.00270805, "bootstrap_seed": 0, "agent_model": "gemini-3.1-pro-preview", "held_out_score": null, "criterion_names": ["correct_category", "concise_output", "follows_format", "no_hallucination", "handles_ambiguity"], "per_criterion_scores": {"correct_category": 0.0, "concise_output": 1.0, "follows_format": 0.0, "no_hallucination": 0.1, "handles_ambiguity": 1.0}, "failure_classification": {"category": "output_format", "description": "The experiment's hypothesis explicitly focused on achieving a specific output format: 'output only the category name.' An 'unknown' failure mode with a high error score (2.1) strongly suggests that the model did not adhere to this critical format constraint, producing output that was not simply the category name, or was otherwise malformed relative to the instruction. The simplification and removal of constraints likely led to the model 'drifting' from the intended format.", "fix_direction": "First, retrieve and analyze the actual output from the failed experiment to pinpoint the exact nature of the format violation. If the model produced extraneous text or an incorrect structure, consider reintroducing minimal positive constraints or explicit examples of the desired output. If the 'minimal' prompt proved ambiguous or insufficient, re-evaluate the directness and clarity of the instruction to ensure it unambiguously guides the model to produce *only* the category name, without leading to a reintroduction of unnecessary complexity.", "confidence": 0.95}, "drafts_generated": 1, "drafts_survived": 1}
{"id": "c3d2ab78-52f4-44af-ba9a-2069334873a8", "target_id": "B1-greedy", "git_sha": "6e9c9f3f1a3233cd35cb09734fd485f5a500187b", "pre_experiment_sha": "6e9c9f3f1a3233cd35cb09734fd485f5a500187b", "timestamp": "2026-04-23T22:45:10.658449+00:00", "hypothesis": "Framing the prompt as a strict data labeling task with strong, positive constraints and removing negative constraints will prevent conversational filler and formatting errors.", "hypothesis_source": "agent", "mutation_diff_summary": "", "score": 2.6, "score_ci_lower": 2.3, "score_ci_upper": 2.9, "raw_scores": [2.5, 2.0, 3.0, 3.0, 2.5], "baseline_score": 2.5, "outcome": "DISCARDED", "failure_mode": null, "duration_seconds": 68.5607355418615, "tags": ["positive-constraints", "data-labeling", "formatting"], "learnings": "{\"what_changed\":\"\",\"what_improved\":[],\"what_regressed\":[],\"transferable_insight\":\"Replacing negative constraints with strong positive framing is not an effective strategy for reliably eliminating conversational filler and formatting errors in strict output tasks.\",\"domain_tags\":[\"Prompt Engineering\",\"Constraint Management\",\"Output Formatting\"]}", "cost_usd": 0.00321985, "bootstrap_seed": 0, "agent_model": "gemini-3.1-pro-preview", "held_out_score": null, "criterion_names": ["correct_category", "concise_output", "follows_format", "no_hallucination", "handles_ambiguity"], "per_criterion_scores": {"correct_category": 0.2, "concise_output": 1.0, "follows_format": 0.1, "no_hallucination": 0.3, "handles_ambiguity": 1.0}, "failure_classification": {"category": "output_format", "description": "The experiment failed to prevent conversational filler and formatting errors. Despite strong positive constraints, the model likely still produced superfluous text (preambles, postscripts) or did not adhere to the specified output structure/schema required by the strict data labeling task.", "fix_direction": "Re-evaluate the effectiveness of positive-only constraints for strict output. Consider reintroducing explicit negative constraints (e.g., 'DO NOT include conversational filler') or providing specific examples of undesired outputs. Alternatively, explore different prompting strategies or model-level adjustments to enforce strict adherence to the output format and prevent extraneous text.", "confidence": 0.9}, "drafts_generated": 1, "drafts_survived": 1}
{"id": "f4340fef-7648-46e0-a038-563b417a1940", "target_id": "B1-greedy", "git_sha": "6e9c9f3f1a3233cd35cb09734fd485f5a500187b", "pre_experiment_sha": "6e9c9f3f1a3233cd35cb09734fd485f5a500187b", "timestamp": "2026-04-23T22:46:33.882144+00:00", "hypothesis": "Reframing the prompt as a strict data labeling task and replacing negative constraints with a single, strong positive constraint at the end will eliminate formatting errors and improve the classification score.", "hypothesis_source": "agent", "mutation_diff_summary": "", "score": 2.3, "score_ci_lower": 2.1, "score_ci_upper": 2.5, "raw_scores": [2.0, 2.5, 2.5, 2.5, 2.0], "baseline_score": 2.5, "outcome": "DISCARDED", "failure_mode": null, "duration_seconds": 67.85651620803401, "tags": ["positive-constraints", "role-prompting", "data-labeling"], "learnings": "{\"what_changed\":\"\",\"what_improved\":[],\"what_regressed\":[],\"transferable_insight\":\"Removing explicit negative constraints in favor of a single positive constraint degrades performance, demonstrating that explicitly stating what to avoid is necessary for strict compliance.\",\"domain_tags\":[\"Prompt Engineering\",\"Constraint Management\",\"Instruction Following\"]}", "cost_usd": 0.0033050500000000003, "bootstrap_seed": 0, "agent_model": "gemini-3.1-pro-preview", "held_out_score": null, "criterion_names": ["correct_category", "concise_output", "follows_format", "no_hallucination", "handles_ambiguity"], "per_criterion_scores": {"correct_category": 0.0, "concise_output": 1.0, "follows_format": 0.0, "no_hallucination": 0.3, "handles_ambiguity": 1.0}, "failure_classification": {"category": "semantic_drift", "description": "The experiment's hypothesis focused on reframing the prompt for a 'strict data labeling task' and using positive constraints to eliminate formatting errors. If the prompt was successful in eliminating formatting errors (or at least making outputs parseable enough to score), the failure to improve the classification score (resulting in 2.3) suggests that the model misinterpreted the underlying classification criteria or the meaning of the task, leading to semantically incorrect labels despite potentially correct output format.", "fix_direction": "While maintaining structural constraints, explicitly clarify the semantic requirements of the classification task within the prompt. This could involve providing more detailed examples of correct classifications for various inputs, refining category definitions, or adding specific instructions that guide the model's reasoning towards accurate semantic understanding, rather than just focusing on output structure.", "confidence": 0.85}, "drafts_generated": 1, "drafts_survived": 1}
{"id": "a7c18c47-ff55-48fc-a0e1-9390cc25d13d", "target_id": "B1-greedy", "git_sha": "6e9c9f3f1a3233cd35cb09734fd485f5a500187b", "pre_experiment_sha": "6e9c9f3f1a3233cd35cb09734fd485f5a500187b", "timestamp": "2026-04-23T22:48:09.292727+00:00", "hypothesis": "Reframing the prompt as a strict data labeling task with only positive constraints and a definitive final instruction to eliminate formatting errors.", "hypothesis_source": "agent", "mutation_diff_summary": "", "score": 2.3, "score_ci_lower": 2.0, "score_ci_upper": 2.7, "raw_scores": [2.0, 2.5, 3.0, 2.0, 2.0], "baseline_score": 2.5, "outcome": "DISCARDED", "failure_mode": null, "duration_seconds": 68.62367579201236, "tags": ["positive-constraints", "strict-formatting", "data-labeling"], "learnings": "{\"what_changed\":\"\",\"what_improved\":[],\"what_regressed\":[],\"transferable_insight\":\"Relying exclusively on positive constraints and rigid task framing to enforce compliance can degrade performance, suggesting that explicit negative constraints are often necessary to prevent errors.\",\"domain_tags\":[\"Prompt Engineering\",\"Task Framing\",\"Constraint Design\"]}", "cost_usd": 0.0030176499999999998, "bootstrap_seed": 0, "agent_model": "gemini-3.1-pro-preview", "held_out_score": null, "criterion_names": ["correct_category", "concise_output", "follows_format", "no_hallucination", "handles_ambiguity"], "per_criterion_scores": {"correct_category": 0.1, "concise_output": 0.9, "follows_format": 0.0, "no_hallucination": 0.3, "handles_ambiguity": 1.0}, "failure_classification": {"category": "output_format", "description": "The experiment hypothesized that reframing the prompt with positive constraints and a definitive final instruction would eliminate formatting errors. The failure indicates that the output likely still suffered from structural or schema violations, meaning the prompt strategy was insufficient to achieve the desired output format.", "fix_direction": "Provide explicit few-shot examples demonstrating the precise desired output format. Alternatively, break down complex formatting requirements into simpler, verifiable steps, or implement a meta-prompting instruction for the model to self-verify its output against the format rules.", "confidence": 0.95}, "drafts_generated": 1, "drafts_survived": 1}
{"id": "5cc3bcc8-dece-47e3-b768-cc953f64c07c", "target_id": "B1-greedy", "git_sha": "6e9c9f3f1a3233cd35cb09734fd485f5a500187b", "pre_experiment_sha": "6e9c9f3f1a3233cd35cb09734fd485f5a500187b", "timestamp": "2026-04-23T22:50:15.269231+00:00", "hypothesis": "Adopt a strict Machine-to-Machine (M2M) API endpoint framing with a single positive constraint at the end to eliminate formatting errors without using negative constraints.", "hypothesis_source": "agent", "mutation_diff_summary": "", "score": 2.2, "score_ci_lower": 2.0, "score_ci_upper": 2.4, "raw_scores": [2.0, 2.5, 2.0, 2.5, 2.0], "baseline_score": 2.5, "outcome": "DISCARDED", "failure_mode": null, "duration_seconds": 86.50350045808591, "tags": ["m2m-framing", "positive-constraint"], "learnings": "{\"what_changed\":\"\",\"what_improved\":[],\"what_regressed\":[],\"transferable_insight\":\"Relying exclusively on positive constraints is insufficient to guarantee strict output compliance, demonstrating that explicit negative constraints are necessary to prevent formatting errors.\",\"domain_tags\":[\"Prompt Engineering\",\"Output Formatting\",\"Constraint Management\"]}", "cost_usd": 0.00345665, "bootstrap_seed": 0, "agent_model": "gemini-3.1-pro-preview", "held_out_score": null, "criterion_names": ["correct_category", "concise_output", "follows_format", "no_hallucination", "handles_ambiguity"], "per_criterion_scores": {"correct_category": 0.1, "concise_output": 1.0, "follows_format": 0.0, "no_hallucination": 0.1, "handles_ambiguity": 1.0}, "failure_classification": {"category": "output_format", "description": "The experiment hypothesized that a strict Machine-to-Machine (M2M) API framing with a single positive constraint would eliminate formatting errors. The failure (score 2.2) indicates that this approach was unsuccessful, suggesting that output structure or schema violations persisted or were introduced despite the intended design, directly contradicting the hypothesis's goal to prevent such errors.", "fix_direction": "Analyze the types of formatting errors that still occurred. Re-evaluate the coverage and specificity of the 'single positive constraint' to determine if it was too broad, too narrow, or incorrectly applied. Consider whether a single positive constraint is inherently insufficient for comprehensive error prevention in this context, potentially exploring a combination of positive constraints or the necessity of targeted negative constraints if the goal of eliminating all formatting errors is paramount.", "confidence": 0.9}, "drafts_generated": 1, "drafts_survived": 1}
