{"id": "dbeb58a3-6b54-4d06-8a27-9b5ec6cb5a34", "target_id": "B1-greedy", "git_sha": "1a998caeb919b4330bbf473131aecb60e21ca5f6", "pre_experiment_sha": "3b452d4d4a3bc0f302632065ef61cb2ba6a6552a", "timestamp": "2026-04-19T16:43:12.464586+00:00", "hypothesis": "Constrain outputs to a single label with decisive selection rules to improve exact-match classification.", "hypothesis_source": "agent", "mutation_diff_summary": "", "score": 3.0, "score_ci_lower": 2.7, "score_ci_upper": 3.3, "raw_scores": [3.0, 2.5, 3.5, 3.0, 3.0], "baseline_score": 0.0, "outcome": "KEPT", "failure_mode": null, "duration_seconds": 26.854860250023194, "tags": ["classification", "exact-match", "concise-output"], "learnings": "{\"what_changed\":\"\",\"what_improved\":[],\"what_regressed\":[],\"transferable_insight\":\"When a task requires exact matching, reducing output ambiguity by enforcing a single decisive choice can improve correctness and consistency.\",\"domain_tags\":[\"classification\",\"output-formatting\",\"decision-making\"]}", "cost_usd": 0.00830255, "bootstrap_seed": 0, "agent_model": "gpt-5.4", "held_out_score": null, "criterion_names": ["correct_category", "concise_output", "follows_format", "no_hallucination", "handles_ambiguity"], "per_criterion_scores": {"correct_category": 0.5, "concise_output": 1.0, "follows_format": 0.0, "no_hallucination": 0.6, "handles_ambiguity": 0.9}, "failure_classification": null, "drafts_generated": 1, "drafts_survived": 1}
{"id": "d2cfba71-a570-4d94-9a65-4ccff32d68b0", "target_id": "B1-greedy", "git_sha": "1a998caeb919b4330bbf473131aecb60e21ca5f6", "pre_experiment_sha": "1a998caeb919b4330bbf473131aecb60e21ca5f6", "timestamp": "2026-04-19T16:43:32.655355+00:00", "hypothesis": "Tightening the selection procedure and enforcing exact label copying will improve single-label classification reliability.", "hypothesis_source": "agent", "mutation_diff_summary": "", "score": 2.9, "score_ci_lower": 2.4, "score_ci_upper": 3.3, "raw_scores": [3.0, 2.0, 3.5, 3.0, 3.0], "baseline_score": 3.0, "outcome": "DISCARDED", "failure_mode": null, "duration_seconds": 18.68421733402647, "tags": ["classification", "strict-output", "decision-rules"], "learnings": "{\"what_changed\":\"\",\"what_improved\":[],\"what_regressed\":[],\"transferable_insight\":\"Adding stricter selection rules and forcing exact replication of labels can reduce flexibility without improving reliability, so tighter constraints should be validated before adoption.\",\"domain_tags\":[\"process-design\",\"quality-control\",\"evaluation\"]}", "cost_usd": 0.01038995, "bootstrap_seed": 0, "agent_model": "gpt-5.4", "held_out_score": null, "criterion_names": ["correct_category", "concise_output", "follows_format", "no_hallucination", "handles_ambiguity"], "per_criterion_scores": {"correct_category": 0.6, "concise_output": 1.0, "follows_format": 0.0, "no_hallucination": 0.4, "handles_ambiguity": 0.9}, "failure_classification": {"category": "semantic_drift", "description": "The experiment did not achieve the intended increase in single-label classification reliability despite the tightening/label-copying hypothesis; the outcome indicates the change likely altered behavior or assumptions in a way that did not actually improve the underlying classification reliability (i.e., meaning/behavior drift rather than a formatting or parsing issue).", "fix_direction": "Verify the enforced label-copying constraints are applied to the correct labels/classes and at the correct stage of the pipeline; add targeted tests/ablation to confirm the selection tightening changes only the intended decision criteria and does not introduce mismatches or misalignments between predicted and copied labels.", "confidence": 0.62}, "drafts_generated": 1, "drafts_survived": 1}
{"id": "e199b961-d657-4f8c-afc0-285a8b75b3d7", "target_id": "B1-greedy", "git_sha": "1a998caeb919b4330bbf473131aecb60e21ca5f6", "pre_experiment_sha": "1a998caeb919b4330bbf473131aecb60e21ca5f6", "timestamp": "2026-04-19T16:43:53.433701+00:00", "hypothesis": "Tightening the instruction hierarchy and adding stronger tie-breaking guidance will improve single-label compliance and accuracy.", "hypothesis_source": "agent", "mutation_diff_summary": "", "score": 2.8, "score_ci_lower": 2.5, "score_ci_upper": 3.2, "raw_scores": [3.0, 2.5, 2.5, 2.5, 3.5], "baseline_score": 3.0, "outcome": "DISCARDED", "failure_mode": null, "duration_seconds": 17.804393708938733, "tags": ["classification", "strict-format", "tie-breaking"], "learnings": "{\"what_changed\":\"\",\"what_improved\":[],\"what_regressed\":[],\"transferable_insight\":\"Adding more rules or stricter tie-breaking does not necessarily improve outcomes; if the change is discarded with no measured gains, the safest lesson is to validate that added complexity actually changes behavior before adopting it.\",\"domain_tags\":[\"decision-making\",\"process-design\",\"evaluation\"]}", "cost_usd": 0.009722350000000001, "bootstrap_seed": 0, "agent_model": "gpt-5.4", "held_out_score": null, "criterion_names": ["correct_category", "concise_output", "follows_format", "no_hallucination", "handles_ambiguity"], "per_criterion_scores": {"correct_category": 0.2, "concise_output": 1.0, "follows_format": 0.0, "no_hallucination": 0.7, "handles_ambiguity": 0.9}, "failure_classification": {"category": "incomplete_edit", "description": "The experiment is reported as a failure with an unknown failure mode and a low score, suggesting the intended instruction/decision hierarchy changes were not fully or consistently applied, leaving the model behavior partially updated or internally inconsistent.", "fix_direction": "Ensure the instruction hierarchy and tie-breaking rules are applied end-to-end (including all relevant decision steps), verify consistency across prompt sections, and add/validate explicit single-label selection constraints against typical edge cases.", "confidence": 0.38}, "drafts_generated": 1, "drafts_survived": 1}
{"id": "bcf8dfff-724a-4687-820c-27b68ff3e327", "target_id": "B1-greedy", "git_sha": "1a998caeb919b4330bbf473131aecb60e21ca5f6", "pre_experiment_sha": "1a998caeb919b4330bbf473131aecb60e21ca5f6", "timestamp": "2026-04-19T16:44:10.313323+00:00", "hypothesis": "Tightening the output and tie-break rules will improve exact single-label classification compliance.", "hypothesis_source": "agent", "mutation_diff_summary": "", "score": 3.1, "score_ci_lower": 2.6, "score_ci_upper": 3.6, "raw_scores": [3.0, 2.5, 4.0, 2.5, 3.5], "baseline_score": 3.0, "outcome": "DISCARDED", "failure_mode": null, "duration_seconds": 12.169787666993216, "tags": ["format", "exact-match", "single-label", "tie-break"], "learnings": "{\"what_changed\":\"\",\"what_improved\":[],\"what_regressed\":[],\"transferable_insight\":\"When a change produces no measurable gains or regressions, tightening rules alone is unlikely to improve compliance without addressing the underlying decision process.\",\"domain_tags\":[\"evaluation\",\"process-control\",\"optimization\"]}", "cost_usd": 0.010078950000000001, "bootstrap_seed": 0, "agent_model": "gpt-5.4", "held_out_score": null, "criterion_names": ["correct_category", "concise_output", "follows_format", "no_hallucination", "handles_ambiguity"], "per_criterion_scores": {"correct_category": 0.5, "concise_output": 1.0, "follows_format": 0.0, "no_hallucination": 0.7, "handles_ambiguity": 0.9}, "failure_classification": {"category": "logic_error", "description": "Failure mode is unspecified ('unknown') and no additional details are provided to determine whether the issue is format/schema, logic, regression, scope, syntax, semantic meaning, optimization gaming, or an incomplete/partial edit.", "fix_direction": "Provide the actual failing output (or diff), the exact evaluation error/score breakdown, and where it violates the expected schema or rubric so the failure can be attributed to the correct category.", "confidence": 0.05}, "drafts_generated": 1, "drafts_survived": 1}
{"id": "4b143650-52cb-40e1-b8dd-807eb2305e01", "target_id": "B1-greedy", "git_sha": "1a998caeb919b4330bbf473131aecb60e21ca5f6", "pre_experiment_sha": "1a998caeb919b4330bbf473131aecb60e21ca5f6", "timestamp": "2026-04-19T16:44:27.228104+00:00", "hypothesis": "Tightening the single-label requirement and exact-copy rule will improve exact-match classification consistency.", "hypothesis_source": "agent", "mutation_diff_summary": "", "score": 2.8, "score_ci_lower": 2.3, "score_ci_upper": 3.3, "raw_scores": [3.5, 2.0, 2.5, 2.5, 3.5], "baseline_score": 3.0, "outcome": "DISCARDED", "failure_mode": null, "duration_seconds": 14.10932829102967, "tags": ["format-control", "exact-match", "single-label"], "learnings": "{\"what_changed\":\"\",\"what_improved\":[],\"what_regressed\":[],\"transferable_insight\":\"When a stricter rule change yields no measurable gains and is discarded, it suggests the added constraint increased rigidity without improving consistency, so simpler criteria may be more robust.\",\"domain_tags\":[\"evaluation\",\"decision-making\",\"optimization\"]}", "cost_usd": 0.01021195, "bootstrap_seed": 0, "agent_model": "gpt-5.4", "held_out_score": null, "criterion_names": ["correct_category", "concise_output", "follows_format", "no_hallucination", "handles_ambiguity"], "per_criterion_scores": {"correct_category": 0.4, "concise_output": 1.0, "follows_format": 0.0, "no_hallucination": 0.4, "handles_ambiguity": 1.0}, "failure_classification": {"category": "logic_error", "description": "Failure mode is labeled as unknown and the score (2.8) provides no clear indication of which specific error type occurred. No evidence is given about format/schema compliance, parsing, logical correctness, or semantic alignment.", "fix_direction": "Instrument the run to capture the exact failure signal (diff of expected vs actual output, parser/validator errors, or semantic mismatch checks) so the failure can be mapped to a specific category; then tighten the single-label and exact-copy constraints based on the observed discrepancy.", "confidence": 0.1}, "drafts_generated": 1, "drafts_survived": 1}
{"id": "5d608218-d043-49e6-b788-8842d7238810", "target_id": "B1-greedy", "git_sha": "1a998caeb919b4330bbf473131aecb60e21ca5f6", "pre_experiment_sha": "1a998caeb919b4330bbf473131aecb60e21ca5f6", "timestamp": "2026-04-19T16:44:42.434209+00:00", "hypothesis": "Tightening the prompt to require an exact copied label and a single decisive choice will improve exact-match classification output.", "hypothesis_source": "agent", "mutation_diff_summary": "", "score": 2.9, "score_ci_lower": 2.6, "score_ci_upper": 3.2, "raw_scores": [3.5, 2.5, 2.5, 3.0, 3.0], "baseline_score": 3.0, "outcome": "DISCARDED", "failure_mode": null, "duration_seconds": 12.405217084102333, "tags": ["format-control", "exact-match", "single-label"], "learnings": "{\"what_changed\":\"\",\"what_improved\":[],\"what_regressed\":[],\"transferable_insight\":\"Adding stricter output constraints can fail to improve exact-match performance if the task already lacks a clear signal or the model cannot reliably follow the added precision.\",\"domain_tags\":[\"prompt-engineering\",\"classification\",\"evaluation\"]}", "cost_usd": 0.00987775, "bootstrap_seed": 0, "agent_model": "gpt-5.4", "held_out_score": null, "criterion_names": ["correct_category", "concise_output", "follows_format", "no_hallucination", "handles_ambiguity"], "per_criterion_scores": {"correct_category": 0.4, "concise_output": 1.0, "follows_format": 0.0, "no_hallucination": 0.5, "handles_ambiguity": 1.0}, "failure_classification": {"category": "semantic_drift", "description": "The experiment attempted to tighten prompt constraints (exact label and single choice), but the resulting output still did not achieve reliable exact-match classification. This suggests the change did not preserve the intended meaning/label mapping for the evaluation, even if the output may have remained structurally acceptable.", "fix_direction": "Verify that the label space/mapping used in the prompt exactly matches the evaluation labels; add an explicit instruction to select from the provided categories only and to mirror the label text verbatim as required by the scorer; test with targeted examples to ensure the chosen label corresponds to the correct failure mode.", "confidence": 0.42}, "drafts_generated": 1, "drafts_survived": 1}
{"id": "b29e98be-c4a6-43a7-a4a1-956c7c134b84", "target_id": "B1-greedy", "git_sha": "1a998caeb919b4330bbf473131aecb60e21ca5f6", "pre_experiment_sha": "1a998caeb919b4330bbf473131aecb60e21ca5f6", "timestamp": "2026-04-19T16:44:59.654891+00:00", "hypothesis": "Make the prompt more rigid about exact single-label output and copying only from the allowed label set.", "hypothesis_source": "agent", "mutation_diff_summary": "", "score": 2.9, "score_ci_lower": 2.6, "score_ci_upper": 3.2, "raw_scores": [3.0, 2.5, 2.5, 3.0, 3.5], "baseline_score": 3.0, "outcome": "DISCARDED", "failure_mode": null, "duration_seconds": 12.707816916983575, "tags": ["format-control", "single-label", "exact-match"], "learnings": "{\"what_changed\":\"\",\"what_improved\":[],\"what_regressed\":[],\"transferable_insight\":\"When a task requires selecting one label from a fixed set, making the instructions stricter about exact output format alone may not improve results if the underlying decision quality is unchanged.\",\"domain_tags\":[\"prompt-engineering\",\"classification\",\"evaluation\"]}", "cost_usd": 0.01016855, "bootstrap_seed": 0, "agent_model": "gpt-5.4", "held_out_score": null, "criterion_names": ["correct_category", "concise_output", "follows_format", "no_hallucination", "handles_ambiguity"], "per_criterion_scores": {"correct_category": 0.3, "concise_output": 1.0, "follows_format": 0.0, "no_hallucination": 0.7, "handles_ambiguity": 0.9}, "failure_classification": {"category": "output_format", "description": "The experiment appears to have failed because the model\u2019s output did not adhere to the required exact single-label/strict schema constraints, producing an output that the evaluator likely could not reliably map to the allowed label set.", "fix_direction": "Make the prompt and (if applicable) decoding constraints stricter: explicitly require a single label token with no extra text, add a hard output example, and enforce validation/correction post-generation to guarantee the output is exactly one of the allowed labels.", "confidence": 0.62}, "drafts_generated": 1, "drafts_survived": 1}
{"id": "06b0806c-3639-4718-a496-a330d917510d", "target_id": "B1-greedy", "git_sha": "1a998caeb919b4330bbf473131aecb60e21ca5f6", "pre_experiment_sha": "1a998caeb919b4330bbf473131aecb60e21ca5f6", "timestamp": "2026-04-19T16:45:13.925252+00:00", "hypothesis": "Make the prompt stricter about exact single-label output and copying a label exactly from the allowed set.", "hypothesis_source": "agent", "mutation_diff_summary": "", "score": 3.1, "score_ci_lower": 2.8, "score_ci_upper": 3.4, "raw_scores": [3.0, 2.5, 3.5, 3.5, 3.0], "baseline_score": 3.0, "outcome": "DISCARDED", "failure_mode": null, "duration_seconds": 11.755938249989413, "tags": ["format-tightening", "single-label", "exact-match"], "learnings": "{\"what_changed\":\"\",\"what_improved\":[],\"what_regressed\":[],\"transferable_insight\":\"When a task requires choosing from a fixed set, explicitly enforce exact one-item output and verbatim copying from the allowed options to reduce format drift.\",\"domain_tags\":[\"prompt-engineering\",\"classification\",\"output-formatting\"]}", "cost_usd": 0.01018715, "bootstrap_seed": 0, "agent_model": "gpt-5.4", "held_out_score": null, "criterion_names": ["correct_category", "concise_output", "follows_format", "no_hallucination", "handles_ambiguity"], "per_criterion_scores": {"correct_category": 0.5, "concise_output": 1.0, "follows_format": 0.0, "no_hallucination": 0.6, "handles_ambiguity": 1.0}, "failure_classification": {"category": "output_format", "description": "The experiment indicates the prompt change did not reliably enforce the model\u2019s exact single-label output. The resulting response likely deviated from the required output structure/schema or failed to output a label exactly copied from the allowed set, triggering an output-format-related failure rather than a reasoning/logic issue.", "fix_direction": "Tighten output constraints further (e.g., require a single token/field JSON with an exact-match enum, disallow any extra text/whitespace, and add a post-check/validator that rejects non-exact label strings), and include explicit examples of valid/invalid outputs.", "confidence": 0.62}, "drafts_generated": 1, "drafts_survived": 1}
{"id": "9121cc97-2e40-45eb-9711-daade480de71", "target_id": "B1-greedy", "git_sha": "1a998caeb919b4330bbf473131aecb60e21ca5f6", "pre_experiment_sha": "1a998caeb919b4330bbf473131aecb60e21ca5f6", "timestamp": "2026-04-19T16:45:32.868595+00:00", "hypothesis": "Make the prompt more explicit that the output must be exactly one copied label from the allowed set with no extra text.", "hypothesis_source": "agent", "mutation_diff_summary": "", "score": 2.9, "score_ci_lower": 2.4, "score_ci_upper": 3.4, "raw_scores": [3.5, 2.5, 3.5, 3.0, 2.0], "baseline_score": 3.0, "outcome": "DISCARDED", "failure_mode": null, "duration_seconds": 16.23292187496554, "tags": ["format-tightening", "single-label", "exact-match"], "learnings": "{\"what_changed\":\"\",\"what_improved\":[],\"what_regressed\":[],\"transferable_insight\":\"When a task requires selecting from a fixed set, making the output format strictly constrained can reduce ambiguity but may still fail if the underlying model or task setup does not reliably enforce exact-copy behavior.\",\"domain_tags\":[\"prompt-engineering\",\"classification\",\"output-formatting\"]}", "cost_usd": 0.01010015, "bootstrap_seed": 0, "agent_model": "gpt-5.4", "held_out_score": null, "criterion_names": ["correct_category", "concise_output", "follows_format", "no_hallucination", "handles_ambiguity"], "per_criterion_scores": {"correct_category": 0.6, "concise_output": 0.8, "follows_format": 0.0, "no_hallucination": 0.5, "handles_ambiguity": 1.0}, "failure_classification": {"category": "output_format", "description": "The change request focused on enforcing an exact copied label output, but the experiment failed due to the model not reliably producing output that matches the required output structure/schema (i.e., not exactly one label from the allowed set with no extra text).", "fix_direction": "Tighten output constraints further via explicit instruction and add strict formatting checks (e.g., require a single token/line, forbid punctuation/whitespace beyond the label, and validate against the allowed set).", "confidence": 0.72}, "drafts_generated": 1, "drafts_survived": 1}
{"id": "a3188d74-a59f-4def-946c-0bc6baa7c866", "target_id": "B1-greedy", "git_sha": "1a998caeb919b4330bbf473131aecb60e21ca5f6", "pre_experiment_sha": "1a998caeb919b4330bbf473131aecb60e21ca5f6", "timestamp": "2026-04-19T16:46:01.230382+00:00", "hypothesis": "Make the prompt stricter and more minimal so the model outputs exactly one allowed label with nothing else.", "hypothesis_source": "agent", "mutation_diff_summary": "", "score": 2.7, "score_ci_lower": 2.3, "score_ci_upper": 3.2, "raw_scores": [2.5, 2.0, 2.5, 3.0, 3.5], "baseline_score": 3.0, "outcome": "DISCARDED", "failure_mode": null, "duration_seconds": 24.0927105830051, "tags": ["format-control", "single-label", "exact-match"], "learnings": "{\"what_changed\":\"\",\"what_improved\":[],\"what_regressed\":[],\"transferable_insight\":\"When a task requires a constrained output format, making the instructions stricter and more minimal can still fail to improve compliance if the model needs explicit format enforcement or examples.\",\"domain_tags\":[\"prompt-engineering\",\"output-formatting\",\"instruction-following\"]}", "cost_usd": 0.008637750000000001, "bootstrap_seed": 0, "agent_model": "gpt-5.4", "held_out_score": null, "criterion_names": ["correct_category", "concise_output", "follows_format", "no_hallucination", "handles_ambiguity"], "per_criterion_scores": {"correct_category": 0.5, "concise_output": 1.0, "follows_format": 0.0, "no_hallucination": 0.4, "handles_ambiguity": 0.8}, "failure_classification": {"category": "output_format", "description": "The experiment appears to have failed because the model did not reliably produce an output that matches the required format\u2014specifically, it likely returned additional text or failed to constrain the response to exactly one allowed label.", "fix_direction": "Tighten the prompting/decoding constraints further (e.g., enforce exact-label-only responses via strict formatting instructions and/or constrained decoding) and add post-processing/validation to reject anything outside the label set.", "confidence": 0.72}, "drafts_generated": 1, "drafts_survived": 1}
