{"id": "71cbd402-dc4d-4796-83a0-6ed6657b7305", "target_id": "B1-greedy", "git_sha": "6e9c9f3f1a3233cd35cb09734fd485f5a500187b", "pre_experiment_sha": "98720ed81b388f89159675b9a957acbab5e8f23e", "timestamp": "2026-04-23T22:27:56.410463+00:00", "hypothesis": "Removing the request for an explanation and instructing the model to output exactly and only the category name will improve parsing and exact-match accuracy for the binary criteria score.", "hypothesis_source": "agent", "mutation_diff_summary": "", "score": 2.5, "score_ci_lower": 2.2, "score_ci_upper": 2.8, "raw_scores": [2.5, 2.5, 2.5, 3.0, 2.0], "baseline_score": 0.0, "outcome": "KEPT", "failure_mode": null, "duration_seconds": 66.3577979998663, "tags": ["formatting", "strict-output", "classification"], "learnings": "{\"what_changed\":\"\",\"what_improved\":[],\"what_regressed\":[],\"transferable_insight\":\"Enforcing strict output constraints by removing explanation requests and demanding exact-match responses improves parsing reliability and accuracy in automated classification tasks.\",\"domain_tags\":[\"Prompt Engineering\",\"Output Formatting\",\"Classification\"]}", "cost_usd": 0.0031028, "bootstrap_seed": 0, "agent_model": "gemini-3.1-pro-preview", "held_out_score": null, "criterion_names": ["correct_category", "concise_output", "follows_format", "no_hallucination", "handles_ambiguity"], "per_criterion_scores": {"correct_category": 0.1, "concise_output": 1.0, "follows_format": 0.0, "no_hallucination": 0.4, "handles_ambiguity": 1.0}, "failure_classification": null, "drafts_generated": 1, "drafts_survived": 1}
{"id": "087c4d6b-3589-4f87-89c2-339294db022f", "target_id": "B1-greedy", "git_sha": "6e9c9f3f1a3233cd35cb09734fd485f5a500187b", "pre_experiment_sha": "6e9c9f3f1a3233cd35cb09734fd485f5a500187b", "timestamp": "2026-04-23T22:28:53.221772+00:00", "hypothesis": "Adding explicit constraints against quotes, periods, and markdown formatting will reduce punctuation errors and improve the exact match classification score.", "hypothesis_source": "agent", "mutation_diff_summary": "", "score": 2.5, "score_ci_lower": 2.1, "score_ci_upper": 3.0, "raw_scores": [2.0, 3.5, 2.5, 2.0, 2.5], "baseline_score": 2.5, "outcome": "DISCARDED", "failure_mode": null, "duration_seconds": 51.459178667049855, "tags": ["prompt-engineering", "strict-formatting", "zero-shot"], "learnings": "{\"what_changed\":\"\",\"what_improved\":[],\"what_regressed\":[],\"transferable_insight\":\"Adding explicit negative constraints against specific formatting or punctuation does not guarantee a reduction in formatting errors or an improvement in exact match scores.\",\"domain_tags\":[\"Prompt Engineering\",\"Negative Constraints\",\"Output Formatting\"]}", "cost_usd": 0.0032353000000000004, "bootstrap_seed": 0, "agent_model": "gemini-3.1-pro-preview", "held_out_score": null, "criterion_names": ["correct_category", "concise_output", "follows_format", "no_hallucination", "handles_ambiguity"], "per_criterion_scores": {"correct_category": 0.1, "concise_output": 1.0, "follows_format": 0.0, "no_hallucination": 0.4, "handles_ambiguity": 1.0}, "failure_classification": {"category": "output_format", "description": "The explicit constraints aimed at removing quotes, periods, and markdown formatting either failed to be enforced effectively, leading to continued punctuation errors, or their application inadvertently distorted the output in a way that negatively impacted the exact match classification score. The low score suggests the desired output format improvement was not achieved, or worse, introduced new issues making the output incompatible with the evaluation criteria for exact match.", "fix_direction": "Verify if the constraints were actually applied as intended and if the output format visibly changed. If the format changed but the score decreased, analyze whether the new format (without quotes/periods/markdown) is incompatible with the 'exact match' evaluation (e.g., ground truth still expects them). Consider normalizing the ground truth data to match the desired output format, or re-evaluate which specific formatting elements are genuinely problematic versus those that might be necessary for correct classification or exact matching.", "confidence": 0.9}, "drafts_generated": 1, "drafts_survived": 1}
{"id": "f6a361ed-d547-4f45-bae3-5f15e74cc4ae", "target_id": "B1-greedy", "git_sha": "6e9c9f3f1a3233cd35cb09734fd485f5a500187b", "pre_experiment_sha": "6e9c9f3f1a3233cd35cb09734fd485f5a500187b", "timestamp": "2026-04-23T22:30:15.211004+00:00", "hypothesis": "Changing the persona to a highly precise automated system and adding explicit, numbered negative constraints against markdown and punctuation will reduce formatting errors and improve classification accuracy.", "hypothesis_source": "agent", "mutation_diff_summary": "", "score": 2.4, "score_ci_lower": 2.2, "score_ci_upper": 2.5, "raw_scores": [2.0, 2.5, 2.5, 2.5, 2.5], "baseline_score": 2.5, "outcome": "DISCARDED", "failure_mode": null, "duration_seconds": 64.95197304198518, "tags": ["prompt-engineering", "system-prompt", "strict-formatting"], "learnings": "{\"what_changed\":\"\",\"what_improved\":[],\"what_regressed\":[],\"transferable_insight\":\"Framing instructions with an overly rigid, machine-like persona and strict, numbered negative constraints can degrade rather than improve task accuracy and compliance.\",\"domain_tags\":[\"Prompt Engineering\",\"Persona Design\",\"Negative Constraints\"]}", "cost_usd": 0.0036662000000000005, "bootstrap_seed": 0, "agent_model": "gemini-3.1-pro-preview", "held_out_score": null, "criterion_names": ["correct_category", "concise_output", "follows_format", "no_hallucination", "handles_ambiguity"], "per_criterion_scores": {"correct_category": 0.0, "concise_output": 1.0, "follows_format": 0.1, "no_hallucination": 0.3, "handles_ambiguity": 1.0}, "failure_classification": {"category": "output_format", "description": "The experiment's attempt to use explicit, numbered negative constraints against markdown and punctuation, potentially combined with the 'highly precise automated system' persona, likely led to the model producing output that was severely malformed, unparseable, or garbled. This could happen either by failing to adhere to the constraints (continuing to have formatting errors), or by over-adhering to them to the point where essential structure or clarity was lost (e.g., stripping all punctuation made the text unreadable). The very low score (2.4000) suggests a catastrophic breakdown in output quality, rendering it unusable for accurate classification.", "fix_direction": "Instead of relying solely on explicit negative constraints, consider providing clear positive examples of the desired output format (without markdown/punctuation). Evaluate if the 'highly precise automated system' persona might be too rigid and inadvertently cause over-correction or misinterpretation of constraints. It's crucial to understand if some level of punctuation or subtle formatting is actually necessary for semantic accuracy, and if completely removing it hinders the classification task itself. Test with gradual reductions rather than absolute prohibitions.", "confidence": 0.95}, "drafts_generated": 1, "drafts_survived": 1}
{"id": "673eeabc-08c7-4a86-b834-69a05f145652", "target_id": "B1-greedy", "git_sha": "6e9c9f3f1a3233cd35cb09734fd485f5a500187b", "pre_experiment_sha": "6e9c9f3f1a3233cd35cb09734fd485f5a500187b", "timestamp": "2026-04-23T22:31:49.903632+00:00", "hypothesis": "Simplify the prompt by removing explicit negative constraints about formatting and instructing the model directly to output exactly and only the target category name.", "hypothesis_source": "agent", "mutation_diff_summary": "", "score": 2.5, "score_ci_lower": 2.2, "score_ci_upper": 2.8, "raw_scores": [2.5, 3.0, 2.5, 2.5, 2.0], "baseline_score": 2.5, "outcome": "DISCARDED", "failure_mode": null, "duration_seconds": 64.92202691594139, "tags": ["simplicity", "exact-match", "positive-framing"], "learnings": "{\"what_changed\":\"\",\"what_improved\":[],\"what_regressed\":[],\"transferable_insight\":\"Replacing explicit negative constraints with strictly positive instructions does not necessarily improve adherence to strict formatting requirements.\",\"domain_tags\":[\"Prompt Engineering\",\"Formatting Constraints\"]}", "cost_usd": 0.0029384499999999996, "bootstrap_seed": 0, "agent_model": "gemini-3.1-pro-preview", "held_out_score": null, "criterion_names": ["correct_category", "concise_output", "follows_format", "no_hallucination", "handles_ambiguity"], "per_criterion_scores": {"correct_category": 0.1, "concise_output": 1.0, "follows_format": 0.0, "no_hallucination": 0.4, "handles_ambiguity": 1.0}, "failure_classification": {"category": "output_format", "description": "The experiment hypothesized that removing negative constraints and directly instructing for 'exactly and only' the target category name would simplify prompt engineering and improve format adherence. The very low score (2.5000) strongly suggests this approach failed, indicating the model did not adhere to the specified output format, likely producing text beyond just the category name, or failing to produce the category name in the desired isolated manner.", "fix_direction": "Explore alternative prompt engineering techniques for strict output formatting, such as reintroducing specific negative constraints, providing few-shot examples of the desired output, or using structured output formats like JSON with explicit schemas. The current direct instruction was insufficient for achieving the desired adherence.", "confidence": 0.95}, "drafts_generated": 1, "drafts_survived": 1}
{"id": "6a53ccb8-0e6f-4b1b-97a7-a40fcb4de4f3", "target_id": "B1-greedy", "git_sha": "6e9c9f3f1a3233cd35cb09734fd485f5a500187b", "pre_experiment_sha": "6e9c9f3f1a3233cd35cb09734fd485f5a500187b", "timestamp": "2026-04-23T22:33:10.132222+00:00", "hypothesis": "Simplify the prompt to be extremely direct, removing negative constraints and explicitly instructing the model to output exactly and only the target category name.", "hypothesis_source": "agent", "mutation_diff_summary": "", "score": 2.7, "score_ci_lower": 2.2, "score_ci_upper": 3.2, "raw_scores": [3.0, 3.0, 2.0, 3.5, 2.0], "baseline_score": 2.5, "outcome": "DISCARDED", "failure_mode": null, "duration_seconds": 68.41092958301306, "tags": ["simplification", "direct-instruction", "positive-constraints"], "learnings": "{\"what_changed\":\"\",\"what_improved\":[],\"what_regressed\":[],\"transferable_insight\":\"Replacing negative constraints with extremely direct, positive instructions for exact output formatting may yield only marginal improvements that do not justify adopting the simplified prompt.\",\"domain_tags\":[\"Prompt Engineering\",\"Instruction Formatting\",\"Negative Constraints\"]}", "cost_usd": 0.0025688, "bootstrap_seed": 0, "agent_model": "gemini-3.1-pro-preview", "held_out_score": null, "criterion_names": ["correct_category", "concise_output", "follows_format", "no_hallucination", "handles_ambiguity"], "per_criterion_scores": {"correct_category": 0.3, "concise_output": 1.0, "follows_format": 0.0, "no_hallucination": 0.4, "handles_ambiguity": 1.0}, "failure_classification": {"category": "output_format", "description": "The experiment explicitly instructed the model to output 'exactly and only the target category name'. The low score indicates the model failed to adhere to this strict output format constraint, likely producing additional text, an incorrect structure, or not just the category name.", "fix_direction": "Analyze the actual model outputs to understand the specific deviations from the 'exactly and only' constraint. Consider if the simplified prompt removed subtle cues that previously helped, or if the instruction needs even more emphasis or specific examples of desired vs. undesired output formats.", "confidence": 0.95}, "drafts_generated": 1, "drafts_survived": 1}
{"id": "ba4dab63-bfd5-48f0-b75b-63d0824c9e3d", "target_id": "B1-greedy", "git_sha": "6e9c9f3f1a3233cd35cb09734fd485f5a500187b", "pre_experiment_sha": "6e9c9f3f1a3233cd35cb09734fd485f5a500187b", "timestamp": "2026-04-23T22:34:29.179084+00:00", "hypothesis": "Simplify the prompt to remove explicit negative constraints and keep the instruction direct, asking the model to output exactly and only the target category name.", "hypothesis_source": "agent", "mutation_diff_summary": "", "score": 2.1, "score_ci_lower": 2.0, "score_ci_upper": 2.3, "raw_scores": [2.0, 2.0, 2.0, 2.0, 2.5], "baseline_score": 2.5, "outcome": "DISCARDED", "failure_mode": null, "duration_seconds": 62.851183583028615, "tags": ["simplification", "direct-instruction"], "learnings": "{\"what_changed\":\"\",\"what_improved\":[],\"what_regressed\":[],\"transferable_insight\":\"Removing explicit negative constraints in favor of simple positive instructions degrades performance, demonstrating that models often require explicit boundaries to strictly adhere to formatting or content restrictions.\",\"domain_tags\":[\"Prompt Engineering\",\"Constraint Formatting\"]}", "cost_usd": 0.00289885, "bootstrap_seed": 0, "agent_model": "gemini-3.1-pro-preview", "held_out_score": null, "criterion_names": ["correct_category", "concise_output", "follows_format", "no_hallucination", "handles_ambiguity"], "per_criterion_scores": {"correct_category": 0.0, "concise_output": 1.0, "follows_format": 0.0, "no_hallucination": 0.1, "handles_ambiguity": 1.0}, "failure_classification": {"category": "output_format", "description": "The experiment's hypothesis focused on simplifying the prompt to achieve an output consisting of 'exactly and only the target category name'. The failure indicates the model did not adhere to this strict output format, producing extra text, incorrect structure, or otherwise deviating from the 'exactly and only' instruction.", "fix_direction": "Investigate alternative prompt engineering techniques to enforce strict output formats, such as providing few-shot examples of the desired output, using specific delimiters, or re-evaluating whether simplified prompts without negative constraints are always sufficient for precise formatting requirements.", "confidence": 0.95}, "drafts_generated": 1, "drafts_survived": 1}
{"id": "d269aac0-5d9a-482d-b8e7-0f53ac4b8fa1", "target_id": "B1-greedy", "git_sha": "6e9c9f3f1a3233cd35cb09734fd485f5a500187b", "pre_experiment_sha": "6e9c9f3f1a3233cd35cb09734fd485f5a500187b", "timestamp": "2026-04-23T22:36:10.336824+00:00", "hypothesis": "Remove explicit negative constraints, add a 1-shot example, and end the prompt with a clear output indicator to strictly enforce the output format.", "hypothesis_source": "agent", "mutation_diff_summary": "", "score": 2.6, "score_ci_lower": 2.3, "score_ci_upper": 2.9, "raw_scores": [3.0, 3.0, 2.5, 2.5, 2.0], "baseline_score": 2.5, "outcome": "DISCARDED", "failure_mode": null, "duration_seconds": 72.52639670902863, "tags": ["prompt-engineering", "output-formatting", "few-shot"], "learnings": "{\"what_changed\":\"\",\"what_improved\":[],\"what_regressed\":[],\"transferable_insight\":\"Replacing explicit negative constraints with a combination of a 1-shot example and a clear output indicator yields only marginal improvements in strict format compliance, suggesting the added prompt complexity may not be justified.\",\"domain_tags\":[\"Prompt Engineering\",\"Formatting Constraints\",\"Few-Shot Prompting\"]}", "cost_usd": 0.00321295, "bootstrap_seed": 0, "agent_model": "gemini-3.1-pro-preview", "held_out_score": null, "criterion_names": ["correct_category", "concise_output", "follows_format", "no_hallucination", "handles_ambiguity"], "per_criterion_scores": {"correct_category": 0.2, "concise_output": 1.0, "follows_format": 0.0, "no_hallucination": 0.4, "handles_ambiguity": 1.0}, "failure_classification": {"category": "semantic_drift", "description": "The experiment's hypothesis included removing explicit negative constraints. This change, while potentially simplifying the prompt, likely allowed the model to generate content that deviated from the intended meaning or was contextually irrelevant, leading to a low score. The 'unknown' failure mode suggests that basic output format might have been maintained (due to efforts in the hypothesis), but the core *semantic content* of the output was incorrect or unhelpful, which often requires deeper analysis to classify beyond simple format errors.", "fix_direction": "Re-evaluate the impact of removing negative constraints. It's crucial to understand what those constraints were preventing. Consider reintroducing specific guardrails or clearer positive constraints to guide the model towards the desired semantic output, while still leveraging the 1-shot example and clear output indicators for format control. The 1-shot example should also be meticulously checked for any unintended biases that could contribute to semantic drift.", "confidence": 0.8}, "drafts_generated": 1, "drafts_survived": 1}
{"id": "98c3bda1-008a-433a-a8a0-7147e3187233", "target_id": "B1-greedy", "git_sha": "6e9c9f3f1a3233cd35cb09734fd485f5a500187b", "pre_experiment_sha": "6e9c9f3f1a3233cd35cb09734fd485f5a500187b", "timestamp": "2026-04-23T22:37:50.074360+00:00", "hypothesis": "Remove negative constraints, add a 1-shot example, and end the prompt with an explicit output indicator to guide the model to output only the category name.", "hypothesis_source": "agent", "mutation_diff_summary": "", "score": 2.4, "score_ci_lower": 2.1, "score_ci_upper": 2.7, "raw_scores": [2.5, 2.5, 2.0, 3.0, 2.0], "baseline_score": 2.5, "outcome": "DISCARDED", "failure_mode": null, "duration_seconds": 68.90465091611259, "tags": ["prompt-engineering", "few-shot", "formatting"], "learnings": "{\"what_changed\":\"\",\"what_improved\":[],\"what_regressed\":[],\"transferable_insight\":\"Replacing explicit negative constraints with a single-shot example and an output indicator can degrade performance, indicating that negative constraints are often necessary for bounding model behavior.\",\"domain_tags\":[\"Prompt Engineering\",\"Few-Shot Learning\",\"Constraint Management\"]}", "cost_usd": 0.0035192000000000005, "bootstrap_seed": 0, "agent_model": "gemini-3.1-pro-preview", "held_out_score": null, "criterion_names": ["correct_category", "concise_output", "follows_format", "no_hallucination", "handles_ambiguity"], "per_criterion_scores": {"correct_category": 0.0, "concise_output": 1.0, "follows_format": 0.0, "no_hallucination": 0.4, "handles_ambiguity": 1.0}, "failure_classification": {"category": "output_format", "description": "The experiment's hypothesis focused on guiding the model to output *only* the category name. The 'unknown' failure mode and low score (2.4) strongly suggest that the model's output did not conform to this desired format (e.g., it included additional text, did not output a category, or produced an unparseable response), leading to an inability for the evaluation system to properly extract or classify the intended output.", "fix_direction": "Strengthen the output constraints and indicators. This could involve providing more explicit negative constraints against extraneous text, using more diverse few-shot examples to reinforce the 'only category name' format, or exploring structured output methods (like JSON) that enforce a strict schema, making the output more robustly parseable. Also, consider refining the evaluation's parsing logic to better diagnose format violations versus semantic errors.", "confidence": 0.95}, "drafts_generated": 1, "drafts_survived": 1}
