{"id": "d52e01eb-e9ea-4bf4-be54-4ab6d46b0fde", "target_id": "B1-greedy", "git_sha": "6b1967af2c2e9d5ea1e28e68bd6053199d7dd725", "pre_experiment_sha": "6b1967af2c2e9d5ea1e28e68bd6053199d7dd725", "timestamp": "2026-04-19T01:13:45.593294+00:00", "hypothesis": "Tightening the prompt to a pure one-label output contract with a direct literal-support rule will improve binary_criteria_score.", "hypothesis_source": "agent", "mutation_diff_summary": "", "score": 3.1, "score_ci_lower": 2.7, "score_ci_upper": 3.6, "raw_scores": [3.0, 2.5, 3.0, 4.0, 3.0], "baseline_score": 3.3, "outcome": "DISCARDED", "failure_mode": null, "duration_seconds": 20.338509374996647, "tags": ["single-label", "output-purity", "literal-match", "minimal-rule"], "learnings": "{\"what_changed\":\"\",\"what_improved\":[],\"what_regressed\":[],\"transferable_insight\":\"Adding stricter output constraints does not guarantee better performance unless they align with the model\u2019s actual decision-making and the task\u2019s evaluation criteria.\",\"domain_tags\":[\"prompt-engineering\",\"evaluation\",\"optimization\"]}", "cost_usd": 0.010015350000000001, "bootstrap_seed": 0, "agent_model": "gpt-5.4", "held_out_score": null, "criterion_names": ["correct_category", "concise_output", "follows_format", "no_hallucination", "handles_ambiguity"], "per_criterion_scores": {"correct_category": 0.6, "concise_output": 1.0, "follows_format": 0.0, "no_hallucination": 0.6, "handles_ambiguity": 0.9}, "failure_classification": {"category": "logic_error", "description": "The provided information does not include details about what failed (only 'Failure Mode: unknown' and a score). Without knowing whether there was a format/schema issue, reasoning error, regression, scope/syntax problems, or semantic mismatch, the failure mode cannot be reliably classified.", "fix_direction": "Re-run with instrumentation: capture the model\u2019s raw output, compare it against the one-label contract, and log whether failures stem from formatting, reasoning/label correctness, or evaluation-rule gaming. Then adjust prompt/constraints accordingly.", "confidence": 0.05}, "drafts_generated": 1, "drafts_survived": 1}
{"id": "775d13e2-edf5-4574-b3a9-819e72fe6bdc", "target_id": "B1-greedy", "git_sha": "6b1967af2c2e9d5ea1e28e68bd6053199d7dd725", "pre_experiment_sha": "6b1967af2c2e9d5ea1e28e68bd6053199d7dd725", "timestamp": "2026-04-19T01:14:00.719801+00:00", "hypothesis": "Tightening the prompt to only require one exact label chosen by direct explicit support will improve output purity and binary scoring.", "hypothesis_source": "agent", "mutation_diff_summary": "", "score": 3.2, "score_ci_lower": 2.8, "score_ci_upper": 3.5, "raw_scores": [3.5, 2.5, 3.5, 3.0, 3.5], "baseline_score": 3.3, "outcome": "DISCARDED", "failure_mode": null, "duration_seconds": 12.024108499987051, "tags": ["single-label", "output-purity", "direct-evidence"], "learnings": "{\"what_changed\":\"\",\"what_improved\":[],\"what_regressed\":[],\"transferable_insight\":\"Over-constraining a response format can reduce useful signal without improving correctness, so stricter instructions should be validated against actual output quality rather than assumed to help.\",\"domain_tags\":[\"prompt-engineering\",\"evaluation\",\"instruction-design\"]}", "cost_usd": 0.00978875, "bootstrap_seed": 0, "agent_model": "gpt-5.4", "held_out_score": null, "criterion_names": ["correct_category", "concise_output", "follows_format", "no_hallucination", "handles_ambiguity"], "per_criterion_scores": {"correct_category": 0.5, "concise_output": 1.0, "follows_format": 0.0, "no_hallucination": 0.7, "handles_ambiguity": 1.0}, "failure_classification": {"category": "semantic_drift", "description": "Tightening the prompt did not yield the intended effect on output purity/binary scoring; the experiment appears to have produced outputs that still did not align with the desired labeling constraint, indicating the change affected meaning/label selection rather than only formatting or evaluation mechanics.", "fix_direction": "Further constrain label selection with explicit decision rules and verification steps (e.g., require stating exactly one allowed label and verifying it matches explicit supported evidence), and add an instruction to avoid synonyms/partial matches; then re-test against the binary scoring criteria.", "confidence": 0.46}, "drafts_generated": 1, "drafts_survived": 1}
{"id": "5a3c99bb-0573-41f4-be1a-0955326ef94c", "target_id": "B1-greedy", "git_sha": "6b1967af2c2e9d5ea1e28e68bd6053199d7dd725", "pre_experiment_sha": "6b1967af2c2e9d5ea1e28e68bd6053199d7dd725", "timestamp": "2026-04-19T01:14:17.655279+00:00", "hypothesis": "Tightening the prompt to a pure one-label-only contract with a literal direct-support rule will improve binary criteria adherence.", "hypothesis_source": "agent", "mutation_diff_summary": "", "score": 2.8, "score_ci_lower": 2.3, "score_ci_upper": 3.2, "raw_scores": [3.0, 2.0, 3.0, 3.5, 2.5], "baseline_score": 3.3, "outcome": "DISCARDED", "failure_mode": null, "duration_seconds": 14.59436395810917, "tags": ["single-label", "output-purity", "literal-match", "minimal-rule"], "learnings": "{\"what_changed\":\"\",\"what_improved\":[],\"what_regressed\":[],\"transferable_insight\":\"When a task requires strict binary decisions, making the output contract explicit and minimal can improve adherence by reducing ambiguity and room for interpretation.\",\"domain_tags\":[\"prompt-design\",\"classification\",\"instruction-following\"]}", "cost_usd": 0.00970155, "bootstrap_seed": 0, "agent_model": "gpt-5.4", "held_out_score": null, "criterion_names": ["correct_category", "concise_output", "follows_format", "no_hallucination", "handles_ambiguity"], "per_criterion_scores": {"correct_category": 0.3, "concise_output": 1.0, "follows_format": 0.0, "no_hallucination": 0.5, "handles_ambiguity": 1.0}, "failure_classification": {"category": "semantic_drift", "description": "The experiment intended to enforce a stricter one-label direct-support rule, but the resulting output likely stayed within the required overall structure while failing to consistently follow the intended meaning/labeling logic, leading to poor adherence (low score).", "fix_direction": "Focus on aligning the label-selection logic with the literal one-label-only constraint; add explicit decision criteria and verification steps to ensure the chosen label directly supports the specific claim being evaluated rather than following a looser or mismatched interpretation.", "confidence": 0.42}, "drafts_generated": 1, "drafts_survived": 1}
{"id": "888a4317-fe20-47a7-b17c-9e6775577e9f", "target_id": "B1-greedy", "git_sha": "6b1967af2c2e9d5ea1e28e68bd6053199d7dd725", "pre_experiment_sha": "6b1967af2c2e9d5ea1e28e68bd6053199d7dd725", "timestamp": "2026-04-19T01:14:50.810709+00:00", "hypothesis": "Tightening the prompt to a literal-match-only single-label rule will improve output purity and binary compliance.", "hypothesis_source": "agent", "mutation_diff_summary": "", "score": 2.9, "score_ci_lower": 2.4, "score_ci_upper": 3.4, "raw_scores": [3.5, 2.0, 2.5, 3.5, 3.0], "baseline_score": 3.3, "outcome": "DISCARDED", "failure_mode": null, "duration_seconds": 29.052026582998224, "tags": ["single-label", "literal-match", "output-purity", "greedy"], "learnings": "{\"what_changed\":\"\",\"what_improved\":[],\"what_regressed\":[],\"transferable_insight\":\"Overly restrictive instructions can reduce flexibility without improving compliance, so tighter constraints should be validated against actual output quality rather than assumed to help.\",\"domain_tags\":[\"prompting\",\"evaluation\"]}", "cost_usd": 0.01010075, "bootstrap_seed": 0, "agent_model": "gpt-5.4", "held_out_score": null, "criterion_names": ["correct_category", "concise_output", "follows_format", "no_hallucination", "handles_ambiguity"], "per_criterion_scores": {"correct_category": 0.4, "concise_output": 1.0, "follows_format": 0.0, "no_hallucination": 0.5, "handles_ambiguity": 1.0}, "failure_classification": {"category": "semantic_drift", "description": "The experiment intended to improve binary compliance/purity via stricter literal-match prompting, but the result is classified as a failed experiment without an explicit formatting or syntax issue, suggesting the outputs likely remained structurally valid while failing the intended literal-match meaning/compliance requirement.", "fix_direction": "Tighten the prompting with explicit literal-match examples and add negative examples; verify compliance with automated tests that check exact-match constraints rather than approximate or semantically equivalent responses.", "confidence": 0.34}, "drafts_generated": 1, "drafts_survived": 1}
{"id": "16e3b74e-7fec-417a-833f-892ccc6246ec", "target_id": "B1-greedy", "git_sha": "6b1967af2c2e9d5ea1e28e68bd6053199d7dd725", "pre_experiment_sha": "6b1967af2c2e9d5ea1e28e68bd6053199d7dd725", "timestamp": "2026-04-19T01:15:16.227145+00:00", "hypothesis": "Tightening the prompt to a pure one-label literal-match rule will improve output conformity and binary scoring.", "hypothesis_source": "agent", "mutation_diff_summary": "", "score": 2.9, "score_ci_lower": 2.4, "score_ci_upper": 3.3, "raw_scores": [3.0, 2.0, 3.5, 3.0, 3.0], "baseline_score": 3.3, "outcome": "DISCARDED", "failure_mode": null, "duration_seconds": 21.033473415998742, "tags": ["single-label", "literal-match", "output-purity", "greedy"], "learnings": "{\"what_changed\":\"\",\"what_improved\":[],\"what_regressed\":[],\"transferable_insight\":\"Overly strict literal-matching constraints can reduce practical output quality without yielding measurable gains in binary conformity.\",\"domain_tags\":[\"prompt-engineering\",\"evaluation\",\"optimization\"]}", "cost_usd": 0.00931035, "bootstrap_seed": 0, "agent_model": "gpt-5.4", "held_out_score": null, "criterion_names": ["correct_category", "concise_output", "follows_format", "no_hallucination", "handles_ambiguity"], "per_criterion_scores": {"correct_category": 0.5, "concise_output": 1.0, "follows_format": 0.0, "no_hallucination": 0.4, "handles_ambiguity": 1.0}, "failure_classification": {"category": "semantic_drift", "description": "The change in the prompt rules (switching to a tighter one-label literal-match) did not reliably translate into higher binary-scoring conformity. Although the intended behavior was to improve exact matching, the outputs likely shifted in meaning/label selection so that the evaluation still treated them as non-conforming (score remained non-ideal at 2.9).", "fix_direction": "Test strict literal-match prompting without altering the underlying labeling logic; add explicit examples of expected exact strings, verify mapping from model output to the evaluator\u2019s label set, and confirm the model is not omitting/altering labels due to instruction over-constraining.", "confidence": 0.62}, "drafts_generated": 1, "drafts_survived": 1}
{"id": "ccc62349-d09d-433a-ae6c-a665e2a3b8c8", "target_id": "B1-greedy", "git_sha": "6b1967af2c2e9d5ea1e28e68bd6053199d7dd725", "pre_experiment_sha": "6b1967af2c2e9d5ea1e28e68bd6053199d7dd725", "timestamp": "2026-04-19T01:15:31.492902+00:00", "hypothesis": "Tightening the prompt to a literal-match-only single-label rule will improve output purity and binary scoring.", "hypothesis_source": "agent", "mutation_diff_summary": "", "score": 3.0, "score_ci_lower": 2.6, "score_ci_upper": 3.5, "raw_scores": [3.0, 2.5, 3.0, 4.0, 2.5], "baseline_score": 3.3, "outcome": "DISCARDED", "failure_mode": null, "duration_seconds": 12.680568541982211, "tags": ["single-label", "literal-match", "output-constraint"], "learnings": "{\"what_changed\":\"\",\"what_improved\":[],\"what_regressed\":[],\"transferable_insight\":\"Making instructions more rigid does not guarantee better results; if the task framing is too narrow or unnatural, performance can stay flat or worsen despite added specificity.\",\"domain_tags\":[\"prompt-design\",\"evaluation\",\"optimization\"]}", "cost_usd": 0.01036955, "bootstrap_seed": 0, "agent_model": "gpt-5.4", "held_out_score": null, "criterion_names": ["correct_category", "concise_output", "follows_format", "no_hallucination", "handles_ambiguity"], "per_criterion_scores": {"correct_category": 0.6, "concise_output": 1.0, "follows_format": 0.0, "no_hallucination": 0.5, "handles_ambiguity": 0.9}, "failure_classification": {"category": "incomplete_edit", "description": "The hypothesis suggests a constrained literal-match single-label rule would improve output purity, but the experiment failed without a specified failure mode (\u201cunknown\u201d) while the score remained high (3.0). This indicates the change may be incomplete or not consistently applied end-to-end, leaving an inconsistent state between the intended stricter rule and the actual evaluation/output behavior.", "fix_direction": "Ensure the literal-match-only single-label constraint is enforced uniformly in prompt construction, decoding/post-processing, and evaluation; add explicit validation to guarantee exactly one label is produced and that it matches only allowed literals.", "confidence": 0.45}, "drafts_generated": 1, "drafts_survived": 1}
{"id": "6e644659-4550-4ca9-baeb-3a13bd7c27fa", "target_id": "B1-greedy", "git_sha": "6b1967af2c2e9d5ea1e28e68bd6053199d7dd725", "pre_experiment_sha": "6b1967af2c2e9d5ea1e28e68bd6053199d7dd725", "timestamp": "2026-04-19T01:15:49.885870+00:00", "hypothesis": "Tightening the prompt to a literal-match-only single-label rule will improve output purity and binary criteria adherence.", "hypothesis_source": "agent", "mutation_diff_summary": "", "score": 3.2, "score_ci_lower": 3.0, "score_ci_upper": 3.4, "raw_scores": [3.0, 3.0, 3.5, 3.5, 3.0], "baseline_score": 3.3, "outcome": "DISCARDED", "failure_mode": null, "duration_seconds": 14.339953833026811, "tags": ["single-label", "output-purity", "literal-match"], "learnings": "{\"what_changed\":\"\",\"what_improved\":[],\"what_regressed\":[],\"transferable_insight\":\"Overly rigid instructions can reduce flexibility without necessarily improving adherence, so constraint tightening should be validated against actual output quality rather than assumed to help.\",\"domain_tags\":[\"prompting\",\"evaluation\",\"optimization\"]}", "cost_usd": 0.00958575, "bootstrap_seed": 0, "agent_model": "gpt-5.4", "held_out_score": null, "criterion_names": ["correct_category", "concise_output", "follows_format", "no_hallucination", "handles_ambiguity"], "per_criterion_scores": {"correct_category": 0.6, "concise_output": 1.0, "follows_format": 0.0, "no_hallucination": 0.6, "handles_ambiguity": 1.0}, "failure_classification": {"category": "logic_error", "description": "The provided information is insufficient to determine which failure mode matches the listed categories. No details about the actual observed output failure (format/logic/semantic/scope/syntax/regression/etc.) are included beyond a score of 3.2.", "fix_direction": "Provide the concrete failure symptom (e.g., schema/format issues, incorrect reasoning, meaning drift, syntax/code errors, or evidence of regression/partial edits) and, if available, the before/after outputs and expected criteria.", "confidence": 0.05}, "drafts_generated": 1, "drafts_survived": 1}
{"id": "cbb390ff-30bc-496a-9074-0552074a02a9", "target_id": "B1-greedy", "git_sha": "6b1967af2c2e9d5ea1e28e68bd6053199d7dd725", "pre_experiment_sha": "6b1967af2c2e9d5ea1e28e68bd6053199d7dd725", "timestamp": "2026-04-19T01:16:04.808816+00:00", "hypothesis": "Tightening the prompt to only allow one literal-match label with no reasoning will improve single-label purity.", "hypothesis_source": "agent", "mutation_diff_summary": "", "score": 3.1, "score_ci_lower": 2.5, "score_ci_upper": 3.6, "raw_scores": [3.0, 2.0, 3.5, 4.0, 3.0], "baseline_score": 3.3, "outcome": "DISCARDED", "failure_mode": null, "duration_seconds": 12.737913416000083, "tags": ["single-label", "literal-match", "output-purity"], "learnings": "{\"what_changed\":\"\",\"what_improved\":[],\"what_regressed\":[],\"transferable_insight\":\"Constraining an output format more tightly does not necessarily improve quality and can reduce performance when the task benefits from flexibility.\",\"domain_tags\":[\"prompting\",\"classification\",\"evaluation\"]}", "cost_usd": 0.01028315, "bootstrap_seed": 0, "agent_model": "gpt-5.4", "held_out_score": null, "criterion_names": ["correct_category", "concise_output", "follows_format", "no_hallucination", "handles_ambiguity"], "per_criterion_scores": {"correct_category": 0.5, "concise_output": 1.0, "follows_format": 0.0, "no_hallucination": 0.6, "handles_ambiguity": 1.0}, "failure_classification": {"category": "logic_error", "description": "The provided information does not include any concrete failure details (what exactly failed, how it failed, or what changed). The hypothesis suggests a format/prompt-tightening attempt, but without observed discrepancies in output structure, reasoning logic, or evaluation behavior, the failure mode cannot be reliably mapped to a given category.", "fix_direction": "Collect the actual model output and compare it against the required schema/constraints, including any parse/format errors, reasoning content violations, or changes in behavior; then rerun with controlled prompt variations to isolate whether the failure is output formatting, reasoning/meaning, or evaluation gaming.", "confidence": 0.05}, "drafts_generated": 1, "drafts_survived": 1}
{"id": "2e29c1b6-df0a-46f5-943f-d9ca1f07fe63", "target_id": "B1-greedy", "git_sha": "6b1967af2c2e9d5ea1e28e68bd6053199d7dd725", "pre_experiment_sha": "6b1967af2c2e9d5ea1e28e68bd6053199d7dd725", "timestamp": "2026-04-19T01:16:19.565487+00:00", "hypothesis": "Tightening the prompt to a literal direct-match single-label rule will improve output purity and binary scoring.", "hypothesis_source": "agent", "mutation_diff_summary": "", "score": 2.9, "score_ci_lower": 2.4, "score_ci_upper": 3.3, "raw_scores": [3.5, 2.0, 3.0, 3.0, 3.0], "baseline_score": 3.3, "outcome": "DISCARDED", "failure_mode": null, "duration_seconds": 12.149230207898654, "tags": ["single-label", "literal-match", "output-purity"], "learnings": "{\"what_changed\":\"\",\"what_improved\":[],\"what_regressed\":[],\"transferable_insight\":\"Making a rule more literal and restrictive does not necessarily improve quality or scoring, because over-constraining the system can fail to address the underlying source of ambiguity or error.\",\"domain_tags\":[\"prompt-engineering\",\"evaluation\",\"optimization\"]}", "cost_usd": 0.01038635, "bootstrap_seed": 0, "agent_model": "gpt-5.4", "held_out_score": null, "criterion_names": ["correct_category", "concise_output", "follows_format", "no_hallucination", "handles_ambiguity"], "per_criterion_scores": {"correct_category": 0.4, "concise_output": 1.0, "follows_format": 0.0, "no_hallucination": 0.6, "handles_ambiguity": 0.9}, "failure_classification": {"category": "semantic_drift", "description": "The change intended to enforce a stricter literal single-label rule did not reliably preserve the intended meaning/purity target\u2014output quality did not improve as expected and scoring remained subpar (score 2.9000), suggesting the stricter prompting altered interpretation rather than the output structure.", "fix_direction": "Tighten the labeling constraint while keeping semantic intent constant\u2014use explicit label definitions/examples and add checks that verify the chosen label matches the underlying concept, not just the literal phrasing.", "confidence": 0.42}, "drafts_generated": 1, "drafts_survived": 1}
{"id": "8e48dccd-6450-4350-a5a8-403a892bd823", "target_id": "B1-greedy", "git_sha": "6b1967af2c2e9d5ea1e28e68bd6053199d7dd725", "pre_experiment_sha": "6b1967af2c2e9d5ea1e28e68bd6053199d7dd725", "timestamp": "2026-04-19T01:16:35.994781+00:00", "hypothesis": "Tightening the prompt to only direct literal matching and pure single-label output will improve binary_criteria_score.", "hypothesis_source": "agent", "mutation_diff_summary": "", "score": 2.5, "score_ci_lower": 2.0, "score_ci_upper": 2.9, "raw_scores": [3.0, 1.5, 2.5, 3.0, 2.5], "baseline_score": 3.3, "outcome": "DISCARDED", "failure_mode": null, "duration_seconds": 12.89112595806364, "tags": ["single-label", "literal-match", "output-purity"], "learnings": "{\"what_changed\":\"\",\"what_improved\":[],\"what_regressed\":[],\"transferable_insight\":\"Over-constraining an output format or matching strategy can reduce performance by stripping away useful flexibility without adding signal.\",\"domain_tags\":[\"prompt-engineering\",\"evaluation\",\"optimization\"]}", "cost_usd": 0.00970575, "bootstrap_seed": 0, "agent_model": "gpt-5.4", "held_out_score": null, "criterion_names": ["correct_category", "concise_output", "follows_format", "no_hallucination", "handles_ambiguity"], "per_criterion_scores": {"correct_category": 0.3, "concise_output": 1.0, "follows_format": 0.0, "no_hallucination": 0.5, "handles_ambiguity": 0.7}, "failure_classification": {"category": "incomplete_edit", "description": "The prompt tightened toward literal matching and single-label output, but the experiment still failed to improve the target binary_criteria_score (score 2.5000 with Failure Mode listed as unknown). This suggests the change was not fully or consistently applied (e.g., partially constraining output without ensuring the model reliably follows the exact required schema/labels), leaving an inconsistent state between the intended prompt constraints and the actual output behavior.", "fix_direction": "Ensure the prompt enforces the full required output schema/labels consistently (including explicit label set, exact formatting rules, and verification-friendly constraints). Add strict instructions/examples and confirm the model always produces exactly one of the allowed labels with the correct structure, then re-evaluate binary_criteria_score.", "confidence": 0.46}, "drafts_generated": 1, "drafts_survived": 1}
