{"id": "fbd37df6-a148-4dc0-83f6-d25307fdcfb5", "target_id": "B1-greedy", "git_sha": "8846b3cbb734a05091414359465050afa82eef7c", "pre_experiment_sha": "8846b3cbb734a05091414359465050afa82eef7c", "timestamp": "2026-04-19T16:56:01.691674+00:00", "hypothesis": "Tightening the prompt to a shorter exact-output instruction will reduce format errors and improve single-label compliance.", "hypothesis_source": "agent", "mutation_diff_summary": "", "score": 3.1, "score_ci_lower": 2.5, "score_ci_upper": 3.5, "raw_scores": [3.5, 2.0, 3.5, 3.0, 3.5], "baseline_score": 3.3, "outcome": "DISCARDED", "failure_mode": null, "duration_seconds": 12.88102183304727, "tags": ["format-control", "exact-match", "concise"], "learnings": "{\"what_changed\":\"\",\"what_improved\":[],\"what_regressed\":[],\"transferable_insight\":\"Making instructions shorter and more exact does not necessarily improve compliance or reduce errors, so prompt simplification should be validated rather than assumed to help.\",\"domain_tags\":[\"prompt-engineering\",\"instruction-following\",\"evaluation\"]}", "cost_usd": 0.008763950000000001, "bootstrap_seed": 0, "agent_model": "gpt-5.4", "held_out_score": null, "criterion_names": ["correct_category", "concise_output", "follows_format", "no_hallucination", "handles_ambiguity"], "per_criterion_scores": {"correct_category": 0.6, "concise_output": 1.0, "follows_format": 0.0, "no_hallucination": 0.6, "handles_ambiguity": 0.9}, "failure_classification": {"category": "output_format", "description": "The experiment is described as having a 'failed' outcome with format errors likely caused by the model not adhering to the required exact output structure/schema. The hypothesis targets tighter instruction to reduce format errors, indicating the failure manifested as a schema/format compliance problem rather than logic or meaning.", "fix_direction": "Further constrain and template the required output (explicit JSON/schema, fixed keys/order, strict no-extra-text), and add validation-friendly instructions (e.g., 'output only JSON' plus an example) to enforce structure and single-label output.", "confidence": 0.62}, "drafts_generated": 1, "drafts_survived": 1}
{"id": "b6e0a6b3-389e-406a-b21d-1640b13167c3", "target_id": "B1-greedy", "git_sha": "8846b3cbb734a05091414359465050afa82eef7c", "pre_experiment_sha": "8846b3cbb734a05091414359465050afa82eef7c", "timestamp": "2026-04-19T16:56:31.655663+00:00", "hypothesis": "Make the prompt more rigid about exact verbatim single-label output to reduce format errors.", "hypothesis_source": "agent", "mutation_diff_summary": "", "score": 2.8, "score_ci_lower": 2.5, "score_ci_upper": 3.2, "raw_scores": [2.5, 2.5, 2.5, 3.5, 3.0], "baseline_score": 3.3, "outcome": "DISCARDED", "failure_mode": null, "duration_seconds": 25.65541941707488, "tags": ["format-enforcement", "exact-match", "single-label"], "learnings": "{\"what_changed\":\"\",\"what_improved\":[],\"what_regressed\":[],\"transferable_insight\":\"Increasing rigidity around exact output formatting can reduce ambiguity, but if the task is already clear it may add friction without improving results.\",\"domain_tags\":[\"prompting\",\"formatting\",\"evaluation\"]}", "cost_usd": 0.00994455, "bootstrap_seed": 0, "agent_model": "gpt-5.4", "held_out_score": null, "criterion_names": ["correct_category", "concise_output", "follows_format", "no_hallucination", "handles_ambiguity"], "per_criterion_scores": {"correct_category": 0.3, "concise_output": 1.0, "follows_format": 0.0, "no_hallucination": 0.5, "handles_ambiguity": 1.0}, "failure_classification": {"category": "output_format", "description": "The attempt likely failed due to the model not strictly adhering to the required output structure for single-label verbatim formatting, causing format/structure errors despite the intended rigidity change.", "fix_direction": "Enforce a stricter output contract (e.g., constrained decoding, explicit template like a single JSON field or single token label), add strong negative instructions against extra text, and include validation feedback loops.", "confidence": 0.62}, "drafts_generated": 1, "drafts_survived": 1}
{"id": "a6a49fbc-99ed-488b-9a4d-a5d0339a5af7", "target_id": "B1-greedy", "git_sha": "8846b3cbb734a05091414359465050afa82eef7c", "pre_experiment_sha": "8846b3cbb734a05091414359465050afa82eef7c", "timestamp": "2026-04-19T16:56:46.299377+00:00", "hypothesis": "Tightening the prompt to a single exact-label output rule will reduce formatting errors and improve binary criteria scoring.", "hypothesis_source": "agent", "mutation_diff_summary": "", "score": 2.9, "score_ci_lower": 2.5, "score_ci_upper": 3.3, "raw_scores": [3.5, 2.5, 2.5, 3.5, 2.5], "baseline_score": 3.3, "outcome": "DISCARDED", "failure_mode": null, "duration_seconds": 11.897304874961264, "tags": ["format-control", "exact-match", "single-label"], "learnings": "{\"what_changed\":\"\",\"what_improved\":[],\"what_regressed\":[],\"transferable_insight\":\"When a stricter output constraint does not change the underlying task quality, it may reduce flexibility without improving measurable performance.\",\"domain_tags\":[\"prompting\",\"evaluation\",\"optimization\"]}", "cost_usd": 0.01035515, "bootstrap_seed": 0, "agent_model": "gpt-5.4", "held_out_score": null, "criterion_names": ["correct_category", "concise_output", "follows_format", "no_hallucination", "handles_ambiguity"], "per_criterion_scores": {"correct_category": 0.3, "concise_output": 1.0, "follows_format": 0.0, "no_hallucination": 0.8, "handles_ambiguity": 0.8}, "failure_classification": {"category": "output_format", "description": "The experiment claims improving formatting via stricter single-label output, but the result still scored low (2.9) indicating the model likely continued to produce outputs that violated the required output structure/schema rather than purely improving label correctness.", "fix_direction": "Constrain generation with hard output validation: enforce exact label-only output (e.g., no extra text), add post-generation regex/JSON schema checking, and implement retry-on-failure to guarantee schema compliance.", "confidence": 0.62}, "drafts_generated": 1, "drafts_survived": 1}
{"id": "1c6c1f7c-3103-47be-a4fe-16fd4609e842", "target_id": "B1-greedy", "git_sha": "8846b3cbb734a05091414359465050afa82eef7c", "pre_experiment_sha": "8846b3cbb734a05091414359465050afa82eef7c", "timestamp": "2026-04-19T16:57:05.187261+00:00", "hypothesis": "Make the prompt more explicit that the assistant must output exactly one verbatim allowed label and nothing else.", "hypothesis_source": "agent", "mutation_diff_summary": "", "score": 2.5, "score_ci_lower": 2.1, "score_ci_upper": 2.9, "raw_scores": [2.5, 2.0, 3.0, 3.0, 2.0], "baseline_score": 3.3, "outcome": "DISCARDED", "failure_mode": null, "duration_seconds": 16.428640042082407, "tags": ["format-control", "exact-match", "single-label"], "learnings": "{\"what_changed\":\"\",\"what_improved\":[],\"what_regressed\":[],\"transferable_insight\":\"Adding stricter output-format instructions can fail to improve results if the underlying task ambiguity or model behavior is not addressed, so clarity alone is not always an effective fix.\",\"domain_tags\":[\"prompt-engineering\",\"instruction-following\",\"evaluation\"]}", "cost_usd": 0.010400350000000001, "bootstrap_seed": 0, "agent_model": "gpt-5.4", "held_out_score": null, "criterion_names": ["correct_category", "concise_output", "follows_format", "no_hallucination", "handles_ambiguity"], "per_criterion_scores": {"correct_category": 0.3, "concise_output": 1.0, "follows_format": 0.0, "no_hallucination": 0.4, "handles_ambiguity": 0.8}, "failure_classification": {"category": "output_format", "description": "The experiment did not reliably enforce the requirement that the assistant output exactly one verbatim allowed label and nothing else, leading to an output format/schema violation.", "fix_direction": "Tighten the prompt and add explicit constraints (e.g., strong system instruction, explicit 'no extra text' requirement, and validation) to guarantee the response is exactly one allowed label.", "confidence": 0.62}, "drafts_generated": 1, "drafts_survived": 1}
{"id": "c2c29e0c-81bf-4d52-9e25-69438c84eae9", "target_id": "B1-greedy", "git_sha": "8846b3cbb734a05091414359465050afa82eef7c", "pre_experiment_sha": "8846b3cbb734a05091414359465050afa82eef7c", "timestamp": "2026-04-19T16:57:25.928845+00:00", "hypothesis": "Make the prompt enforce an unambiguous exact-match single-label output rule to reduce format mistakes.", "hypothesis_source": "agent", "mutation_diff_summary": "", "score": 3.2, "score_ci_lower": 2.8, "score_ci_upper": 3.7, "raw_scores": [4.0, 2.5, 3.0, 3.0, 3.5], "baseline_score": 3.3, "outcome": "DISCARDED", "failure_mode": null, "duration_seconds": 16.95632370794192, "tags": ["format-control", "exact-match", "single-label"], "learnings": "{\"what_changed\":\"\",\"what_improved\":[],\"what_regressed\":[],\"transferable_insight\":\"Adding stricter output-format constraints can reduce ambiguity, but if the task is already clear it may not improve results and can add unnecessary rigidity.\",\"domain_tags\":[\"prompt-engineering\",\"evaluation\",\"instruction-design\"]}", "cost_usd": 0.008934550000000001, "bootstrap_seed": 0, "agent_model": "gpt-5.4", "held_out_score": null, "criterion_names": ["correct_category", "concise_output", "follows_format", "no_hallucination", "handles_ambiguity"], "per_criterion_scores": {"correct_category": 0.5, "concise_output": 1.0, "follows_format": 0.0, "no_hallucination": 0.7, "handles_ambiguity": 1.0}, "failure_classification": {"category": "output_format", "description": "The experiment failed to reliably enforce an unambiguous exact-match single-label output rule, leading to output formatting/structure inconsistencies rather than correct semantics or reasoning.", "fix_direction": "Tighten the output constraint by using a strict schema (e.g., single token/label only), add explicit formatting instructions (no extra text), and optionally validate/repair outputs post-generation before evaluation.", "confidence": 0.62}, "drafts_generated": 1, "drafts_survived": 1}
{"id": "31b2f568-49b4-4c91-b419-26bf14c226a1", "target_id": "B1-greedy", "git_sha": "8846b3cbb734a05091414359465050afa82eef7c", "pre_experiment_sha": "8846b3cbb734a05091414359465050afa82eef7c", "timestamp": "2026-04-19T16:57:41.977644+00:00", "hypothesis": "Make the single-label verbatim output requirement more explicit and strict to reduce formatting errors.", "hypothesis_source": "agent", "mutation_diff_summary": "", "score": 3.0, "score_ci_lower": 2.6, "score_ci_upper": 3.4, "raw_scores": [3.5, 2.5, 3.5, 2.5, 3.0], "baseline_score": 3.3, "outcome": "DISCARDED", "failure_mode": null, "duration_seconds": 13.533929875004105, "tags": ["format-control", "exact-match", "single-label"], "learnings": "{\"what_changed\":\"\",\"what_improved\":[],\"what_regressed\":[],\"transferable_insight\":\"Making an already implied constraint more explicit and strict can still fail to improve compliance if the underlying task or model behavior does not change.\",\"domain_tags\":[\"instruction-following\",\"prompt-design\",\"evaluation\"]}", "cost_usd": 0.01095255, "bootstrap_seed": 0, "agent_model": "gpt-5.4", "held_out_score": null, "criterion_names": ["correct_category", "concise_output", "follows_format", "no_hallucination", "handles_ambiguity"], "per_criterion_scores": {"correct_category": 0.2, "concise_output": 1.0, "follows_format": 0.0, "no_hallucination": 0.8, "handles_ambiguity": 1.0}, "failure_classification": {"category": "output_format", "description": "The attempt likely did not follow the required verbatim single-label output structure/schema closely enough, resulting in a formatting-related failure.", "fix_direction": "Make the output strictly adhere to the exact required schema (single label only, no extra text), and add checks to ensure the response matches the expected format character-for-character.", "confidence": 0.62}, "drafts_generated": 1, "drafts_survived": 1}
{"id": "e855d2dc-eb02-4f05-b9bb-5efb0846670c", "target_id": "B1-greedy", "git_sha": "8846b3cbb734a05091414359465050afa82eef7c", "pre_experiment_sha": "8846b3cbb734a05091414359465050afa82eef7c", "timestamp": "2026-04-19T16:57:57.643892+00:00", "hypothesis": "Make the output constraint more explicit and exact-match-only to reduce format errors.", "hypothesis_source": "agent", "mutation_diff_summary": "", "score": 3.2, "score_ci_lower": 2.8, "score_ci_upper": 3.7, "raw_scores": [3.5, 2.5, 3.0, 4.0, 3.0], "baseline_score": 3.3, "outcome": "DISCARDED", "failure_mode": null, "duration_seconds": 13.221890834043734, "tags": ["formatting", "exact-match", "single-label"], "learnings": "{\"what_changed\":\"\",\"what_improved\":[],\"what_regressed\":[],\"transferable_insight\":\"Making a constraint more explicit does not necessarily improve compliance if the underlying task or model behavior is not aligned with exact-match requirements.\",\"domain_tags\":[\"prompting\",\"format-compliance\",\"evaluation\"]}", "cost_usd": 0.010844150000000002, "bootstrap_seed": 0, "agent_model": "gpt-5.4", "held_out_score": null, "criterion_names": ["correct_category", "concise_output", "follows_format", "no_hallucination", "handles_ambiguity"], "per_criterion_scores": {"correct_category": 0.5, "concise_output": 1.0, "follows_format": 0.0, "no_hallucination": 0.7, "handles_ambiguity": 1.0}, "failure_classification": {"category": "incomplete_edit", "description": "The attempt appears to implement the requested clarification/exact-match constraint, but the failure mode is listed as unknown and the score is low/moderate (3.2), suggesting the change was partial or did not consistently enforce the output constraint end-to-end, leaving an inconsistent or insufficiently applied formatting requirement.", "fix_direction": "Ensure the output constraint is applied comprehensively and deterministically (e.g., strict schema validation, exact-match enforcement, and tests for all required fields) so no residual formatting ambiguity remains.", "confidence": 0.45}, "drafts_generated": 1, "drafts_survived": 1}
{"id": "7e69fd58-a3e7-444f-96b2-ebfa1078ffd7", "target_id": "B1-greedy", "git_sha": "8846b3cbb734a05091414359465050afa82eef7c", "pre_experiment_sha": "8846b3cbb734a05091414359465050afa82eef7c", "timestamp": "2026-04-19T16:58:14.510234+00:00", "hypothesis": "Tightening the prompt to a shorter exact-output-only instruction will reduce formatting errors and improve binary criteria score.", "hypothesis_source": "agent", "mutation_diff_summary": "", "score": 3.1, "score_ci_lower": 2.5, "score_ci_upper": 3.7, "raw_scores": [3.5, 2.0, 3.0, 4.0, 3.0], "baseline_score": 3.3, "outcome": "DISCARDED", "failure_mode": null, "duration_seconds": 12.596495958976448, "tags": ["minimal", "strict-output", "format-enforcement"], "learnings": "{\"what_changed\":\"\",\"what_improved\":[],\"what_regressed\":[],\"transferable_insight\":\"When an intervention is discarded with no observed improvements or regressions, the safest conclusion is that the change did not produce a measurable effect under the tested conditions.\",\"domain_tags\":[\"experimentation\",\"evaluation\",\"decision-making\"]}", "cost_usd": 0.008302150000000001, "bootstrap_seed": 0, "agent_model": "gpt-5.4", "held_out_score": null, "criterion_names": ["correct_category", "concise_output", "follows_format", "no_hallucination", "handles_ambiguity"], "per_criterion_scores": {"correct_category": 0.6, "concise_output": 1.0, "follows_format": 0.0, "no_hallucination": 0.5, "handles_ambiguity": 1.0}, "failure_classification": {"category": "logic_error", "description": "The provided information does not indicate any specific failure mechanism (e.g., formatting/schema violation, syntax issues, logical errors, regression, or scope problems). Only a score (3.1) is given, but no output or error details to map to a category.", "fix_direction": "Include the model\u2019s actual output (or error logs) and a brief note of what constraint was violated (format, schema, reasoning, or code parsing) so the failure can be categorized; then tighten and validate against the exact required output format.", "confidence": 0.12}, "drafts_generated": 1, "drafts_survived": 1}
{"id": "a7cd9801-b919-4524-9767-4c2b1866d41c", "target_id": "B1-greedy", "git_sha": "8846b3cbb734a05091414359465050afa82eef7c", "pre_experiment_sha": "8846b3cbb734a05091414359465050afa82eef7c", "timestamp": "2026-04-19T16:58:29.665532+00:00", "hypothesis": "Make the prompt shorter and stricter to maximize exact single-label outputs with no format deviations.", "hypothesis_source": "agent", "mutation_diff_summary": "", "score": 2.8, "score_ci_lower": 2.3, "score_ci_upper": 3.4, "raw_scores": [3.0, 2.5, 2.0, 4.0, 2.5], "baseline_score": 3.3, "outcome": "DISCARDED", "failure_mode": null, "duration_seconds": 12.176102790981531, "tags": ["minimal", "strict-output", "exact-match", "binary-classification"], "learnings": "{\"what_changed\":\"\",\"what_improved\":[],\"what_regressed\":[],\"transferable_insight\":\"Making instructions shorter and stricter does not necessarily improve compliance; overly constrained prompts can reduce output quality without changing behavior in the desired way.\",\"domain_tags\":[\"prompt-engineering\",\"instruction-following\",\"evaluation\"]}", "cost_usd": 0.008547350000000002, "bootstrap_seed": 0, "agent_model": "gpt-5.4", "held_out_score": null, "criterion_names": ["correct_category", "concise_output", "follows_format", "no_hallucination", "handles_ambiguity"], "per_criterion_scores": {"correct_category": 0.4, "concise_output": 0.9, "follows_format": 0.0, "no_hallucination": 0.6, "handles_ambiguity": 0.9}, "failure_classification": {"category": "logic_error", "description": "The prompt adjustments were intended to improve strictness for single-label outputs, but the experiment still failed (low score and labeled failure mode unknown), indicating the underlying reasoning/selection criteria did not reliably produce the correct label rather than failing due to syntax or explicit format/schema issues.", "fix_direction": "Tighten and validate the decision criteria for label selection (e.g., explicit rules and edge cases) and add targeted checks/examples to ensure the model consistently maps inputs to exactly one category without ambiguous interpretation.", "confidence": 0.42}, "drafts_generated": 1, "drafts_survived": 1}
