{"id": "1bab3c8e-ddc1-43bb-90cf-610178807eb9", "target_id": "B1-greedy", "git_sha": "6b1967af2c2e9d5ea1e28e68bd6053199d7dd725", "pre_experiment_sha": "6b1967af2c2e9d5ea1e28e68bd6053199d7dd725", "timestamp": "2026-04-19T01:10:38.366715+00:00", "hypothesis": "Tightening the prompt around exact one-label-only output and a single simple selection rule will improve binary criteria compliance.", "hypothesis_source": "agent", "mutation_diff_summary": "", "score": 3.3, "score_ci_lower": 2.8, "score_ci_upper": 3.7, "raw_scores": [3.0, 2.5, 4.0, 3.5, 3.5], "baseline_score": 3.3, "outcome": "DISCARDED", "failure_mode": null, "duration_seconds": 17.5187305000145, "tags": ["single-label", "output-purity", "minimal-rule"], "learnings": "{\"what_changed\":\"\",\"what_improved\":[],\"what_regressed\":[],\"transferable_insight\":\"When a change adds stricter output constraints but produces no measurable improvement, the safest conclusion is that the added specificity did not address the underlying failure mode.\",\"domain_tags\":[\"prompting\",\"evaluation\",\"optimization\"]}", "cost_usd": 0.009466150000000001, "bootstrap_seed": 0, "agent_model": "gpt-5.4", "held_out_score": null, "criterion_names": ["correct_category", "concise_output", "follows_format", "no_hallucination", "handles_ambiguity"], "per_criterion_scores": {"correct_category": 0.4, "concise_output": 1.0, "follows_format": 0.0, "no_hallucination": 0.9, "handles_ambiguity": 1.0}, "failure_classification": {"category": "output_format", "description": "The experiment failed to produce output that met the required format constraint (binary criteria compliance depends on a strict one-label-only/simple selection output). The model\u2019s response did not conform tightly enough to the expected schema, despite the intent to enforce it.", "fix_direction": "Strengthen and validate the output schema enforcement (e.g., constrain to a single allowed label token with no extra text/formatting) and add post-generation checks to reject nonconforming outputs.", "confidence": 0.35}, "drafts_generated": 1, "drafts_survived": 1}
{"id": "5115b467-7111-4b89-ad8e-2767b7171200", "target_id": "B1-greedy", "git_sha": "6b1967af2c2e9d5ea1e28e68bd6053199d7dd725", "pre_experiment_sha": "6b1967af2c2e9d5ea1e28e68bd6053199d7dd725", "timestamp": "2026-04-19T01:11:01.098521+00:00", "hypothesis": "Tightening the prompt around exact one-label-only output and a single simple best-supported selection rule will improve binary grading consistency.", "hypothesis_source": "agent", "mutation_diff_summary": "", "score": 3.0, "score_ci_lower": 2.6, "score_ci_upper": 3.4, "raw_scores": [3.0, 2.5, 2.5, 3.5, 3.5], "baseline_score": 3.3, "outcome": "DISCARDED", "failure_mode": null, "duration_seconds": 19.216371625079773, "tags": ["single-label", "output-contract", "strict-format", "minimal-rule"], "learnings": "{\"what_changed\":\"\",\"what_improved\":[],\"what_regressed\":[],\"transferable_insight\":\"Adding stricter output constraints and a simpler decision rule does not necessarily improve consistency unless the underlying task ambiguity is also reduced.\",\"domain_tags\":[\"prompting\",\"decision-making\",\"evaluation\"]}", "cost_usd": 0.01018575, "bootstrap_seed": 0, "agent_model": "gpt-5.4", "held_out_score": null, "criterion_names": ["correct_category", "concise_output", "follows_format", "no_hallucination", "handles_ambiguity"], "per_criterion_scores": {"correct_category": 0.5, "concise_output": 1.0, "follows_format": 0.0, "no_hallucination": 0.6, "handles_ambiguity": 0.9}, "failure_classification": {"category": "semantic_drift", "description": "The change did not yield consistent binary grading, indicating the intended 'single best-supported selection rule' or interpretation of the task was not reliably applied, leading to meaning-level inconsistency rather than a pure output-format issue.", "fix_direction": "Tighten and explicitly define the selection rule and decision criteria (including tie-breaking), then validate that the model follows the same meaning/rationale under all cases; add targeted tests to ensure identical interpretation across instances.", "confidence": 0.42}, "drafts_generated": 1, "drafts_survived": 1}
{"id": "cd5eabf7-e1c4-4205-af22-a8284807283c", "target_id": "B1-greedy", "git_sha": "6b1967af2c2e9d5ea1e28e68bd6053199d7dd725", "pre_experiment_sha": "6b1967af2c2e9d5ea1e28e68bd6053199d7dd725", "timestamp": "2026-04-19T01:11:19.570131+00:00", "hypothesis": "Tightening the prompt around exact one-label-only output and a single minimal tie-break rule will improve binary scoring.", "hypothesis_source": "agent", "mutation_diff_summary": "", "score": 2.9, "score_ci_lower": 2.6, "score_ci_upper": 3.2, "raw_scores": [3.5, 2.5, 3.0, 3.0, 2.5], "baseline_score": 3.3, "outcome": "DISCARDED", "failure_mode": null, "duration_seconds": 15.712630208930932, "tags": ["single-label", "output-contract", "minimal-rule"], "learnings": "{\"what_changed\":\"\",\"what_improved\":[],\"what_regressed\":[],\"transferable_insight\":\"Adding stricter output constraints and a simple tie-break rule does not necessarily improve performance if the underlying task or evaluation remains unchanged.\",\"domain_tags\":[\"prompting\",\"evaluation\",\"optimization\"]}", "cost_usd": 0.010565350000000001, "bootstrap_seed": 0, "agent_model": "gpt-5.4", "held_out_score": null, "criterion_names": ["correct_category", "concise_output", "follows_format", "no_hallucination", "handles_ambiguity"], "per_criterion_scores": {"correct_category": 0.8, "concise_output": 1.0, "follows_format": 0.0, "no_hallucination": 0.3, "handles_ambiguity": 0.8}, "failure_classification": {"category": "output_format", "description": "The attempt to improve binary scoring by tightening the prompt likely caused an output structure/schema mismatch (e.g., more than one label, missing required fields, or not following the exact one-label-only requirement), leading to a failed experiment despite higher score.", "fix_direction": "Ensure the model strictly follows the required output schema: enforce a single-label-only response, validate JSON/label formatting deterministically, and add explicit post-checking/validation for schema compliance.", "confidence": 0.62}, "drafts_generated": 1, "drafts_survived": 1}
{"id": "060c83e0-f0b9-47bb-941c-b7c672e4fe9e", "target_id": "B1-greedy", "git_sha": "6b1967af2c2e9d5ea1e28e68bd6053199d7dd725", "pre_experiment_sha": "6b1967af2c2e9d5ea1e28e68bd6053199d7dd725", "timestamp": "2026-04-19T01:11:35.766957+00:00", "hypothesis": "Tightening the prompt around exact one-label-only output and a single simple ambiguity rule will improve binary grading consistency.", "hypothesis_source": "agent", "mutation_diff_summary": "", "score": 3.3, "score_ci_lower": 2.6, "score_ci_upper": 3.8, "raw_scores": [4.0, 2.0, 3.5, 3.5, 3.5], "baseline_score": 3.3, "outcome": "DISCARDED", "failure_mode": null, "duration_seconds": 13.660996457911097, "tags": ["single-label", "output-constraint", "ambiguity-minimization"], "learnings": "{\"what_changed\":\"\",\"what_improved\":[],\"what_regressed\":[],\"transferable_insight\":\"When a task already has low ambiguity, adding stricter output constraints and a single disambiguation rule may not improve consistency, so prompt changes should be validated empirically rather than assumed beneficial.\",\"domain_tags\":[\"prompt-engineering\",\"evaluation\",\"decision-making\"]}", "cost_usd": 0.01063735, "bootstrap_seed": 0, "agent_model": "gpt-5.4", "held_out_score": null, "criterion_names": ["correct_category", "concise_output", "follows_format", "no_hallucination", "handles_ambiguity"], "per_criterion_scores": {"correct_category": 0.7, "concise_output": 1.0, "follows_format": 0.0, "no_hallucination": 0.8, "handles_ambiguity": 0.8}, "failure_classification": {"category": "semantic_drift", "description": "The experiment targeted output-format/ambiguity constraints to improve grading consistency, but the result shows degraded or inconsistent grading (score 3.3) without any clear evidence of syntax/parse failure or structural violation. This suggests the changes likely altered the model\u2019s interpretation/behavior rather than only enforcing formatting, leading to meaning/labeling drift under the grader\u2019s binary rubric.", "fix_direction": "Keep the hypothesis changes strictly confined to output schema enforcement (e.g., deterministic one-label-only instructions) while using unambiguous, grader-aligned examples; verify that the model\u2019s decision logic for selecting the label remains identical and only the output serialization changes.", "confidence": 0.56}, "drafts_generated": 1, "drafts_survived": 1}
{"id": "f55776ab-63a9-48f6-9b90-bb317bcf8774", "target_id": "B1-greedy", "git_sha": "6b1967af2c2e9d5ea1e28e68bd6053199d7dd725", "pre_experiment_sha": "6b1967af2c2e9d5ea1e28e68bd6053199d7dd725", "timestamp": "2026-04-19T01:11:51.635697+00:00", "hypothesis": "Tightening the prompt around exact one-label-only output and a minimal direct-evidence selection rule will improve binary grading consistency.", "hypothesis_source": "agent", "mutation_diff_summary": "", "score": 3.0, "score_ci_lower": 2.6, "score_ci_upper": 3.5, "raw_scores": [3.0, 2.5, 2.5, 4.0, 3.0], "baseline_score": 3.3, "outcome": "DISCARDED", "failure_mode": null, "duration_seconds": 12.031939124921337, "tags": ["single-label", "output-constraint", "direct-match", "minimal-rule"], "learnings": "{\"what_changed\":\"\",\"what_improved\":[],\"what_regressed\":[],\"transferable_insight\":\"When a stricter instruction changes the output format but not the underlying decision criteria, consistency may not improve because the core ambiguity remains unresolved.\",\"domain_tags\":[\"prompt-design\",\"decision-making\",\"evaluation\"]}", "cost_usd": 0.009998550000000002, "bootstrap_seed": 0, "agent_model": "gpt-5.4", "held_out_score": null, "criterion_names": ["correct_category", "concise_output", "follows_format", "no_hallucination", "handles_ambiguity"], "per_criterion_scores": {"correct_category": 0.6, "concise_output": 1.0, "follows_format": 0.0, "no_hallucination": 0.5, "handles_ambiguity": 0.9}, "failure_classification": {"category": "incomplete_edit", "description": "The experiment was intended to improve binary grading consistency by tightening the prompt/output rules, but the run still failed in an unspecified way (Failure Mode: unknown) while only a minimal score (3.0) was achieved. This suggests the prompt or evaluation instructions were not fully or consistently enforced (e.g., lingering ambiguity, incomplete constraint application, or incomplete alignment between the required selection rule and the grader\u2019s expected behavior).", "fix_direction": "Further tighten and verify end-to-end constraints: enforce a strict schema (single label only), add an explicit decision rule that directly maps evidence to the label, and ensure the grader/evaluator expects the exact same label set and formatting (including whitespace/casing). Then validate by running a small suite of controlled test cases to confirm consistent outputs.", "confidence": 0.43}, "drafts_generated": 1, "drafts_survived": 1}
{"id": "64be5f65-0c28-44cd-8f1b-d2591513a564", "target_id": "B1-greedy", "git_sha": "6b1967af2c2e9d5ea1e28e68bd6053199d7dd725", "pre_experiment_sha": "6b1967af2c2e9d5ea1e28e68bd6053199d7dd725", "timestamp": "2026-04-19T01:12:14.981421+00:00", "hypothesis": "Tightening the prompt to require an exact one-label-only response and a single minimal direct-support selection rule will improve binary grading.", "hypothesis_source": "agent", "mutation_diff_summary": "", "score": 3.3, "score_ci_lower": 2.8, "score_ci_upper": 3.7, "raw_scores": [3.0, 2.5, 4.0, 3.5, 3.5], "baseline_score": 3.3, "outcome": "DISCARDED", "failure_mode": null, "duration_seconds": 20.37286837492138, "tags": ["single-label", "output-format", "direct-match", "strictness"], "learnings": "{\"what_changed\":\"\",\"what_improved\":[],\"what_regressed\":[],\"transferable_insight\":\"Adding stricter output constraints does not necessarily improve grading performance unless the constraints align with the evaluator\u2019s decision process and signal quality.\",\"domain_tags\":[\"evaluation\",\"prompting\",\"classification\"]}", "cost_usd": 0.00963315, "bootstrap_seed": 0, "agent_model": "gpt-5.4", "held_out_score": null, "criterion_names": ["correct_category", "concise_output", "follows_format", "no_hallucination", "handles_ambiguity"], "per_criterion_scores": {"correct_category": 0.4, "concise_output": 1.0, "follows_format": 0.0, "no_hallucination": 0.9, "handles_ambiguity": 1.0}, "failure_classification": {"category": "output_format", "description": "The experiment failed despite claiming the hypothesis about tighter prompting; the failure mode is listed as unknown and the score indicates grading did not improve, suggesting the model likely still produced outputs that didn\u2019t satisfy the required one-label-only, minimal direct-support selection rule (i.e., schema/format requirements weren\u2019t met).", "fix_direction": "Further enforce output constraints with explicit JSON/label-only templates, add hard stop/regex-like constraints in the prompt, and validate responses against a strict schema before scoring.", "confidence": 0.38}, "drafts_generated": 1, "drafts_survived": 1}
{"id": "abecab8a-4721-41d2-9470-b91de7b1c62d", "target_id": "B1-greedy", "git_sha": "6b1967af2c2e9d5ea1e28e68bd6053199d7dd725", "pre_experiment_sha": "6b1967af2c2e9d5ea1e28e68bd6053199d7dd725", "timestamp": "2026-04-19T01:12:33.827129+00:00", "hypothesis": "Tightening the prompt to enforce exact one-label-only output with a minimal direct explicit-support rule will improve binary grading consistency.", "hypothesis_source": "agent", "mutation_diff_summary": "", "score": 2.9, "score_ci_lower": 2.6, "score_ci_upper": 3.2, "raw_scores": [3.5, 2.5, 3.0, 3.0, 2.5], "baseline_score": 3.3, "outcome": "DISCARDED", "failure_mode": null, "duration_seconds": 16.16715783404652, "tags": ["single-label", "output-constraint", "direct-match", "minimality"], "learnings": "{\"what_changed\":\"\",\"what_improved\":[],\"what_regressed\":[],\"transferable_insight\":\"Adding stricter output constraints can improve consistency only when they reduce ambiguity without obscuring the underlying decision rule.\",\"domain_tags\":[\"prompt-design\",\"classification\",\"evaluation\"]}", "cost_usd": 0.01004095, "bootstrap_seed": 0, "agent_model": "gpt-5.4", "held_out_score": null, "criterion_names": ["correct_category", "concise_output", "follows_format", "no_hallucination", "handles_ambiguity"], "per_criterion_scores": {"correct_category": 0.3, "concise_output": 1.0, "follows_format": 0.0, "no_hallucination": 0.6, "handles_ambiguity": 1.0}, "failure_classification": {"category": "output_format", "description": "The attempt failed likely because the output did not satisfy the required one-label-only/exact minimal explicit-support response format, leading to inconsistent binary grading despite the underlying idea being reasonable.", "fix_direction": "Tighten and enforce the output schema/contract (e.g., strict single-label JSON-only output), validate with a parser/regex before submission, and ensure the response contains exactly one allowed category label with no extra text.", "confidence": 0.62}, "drafts_generated": 1, "drafts_survived": 1}
{"id": "44e8eb4a-145b-4e85-9683-46835bc90843", "target_id": "B1-greedy", "git_sha": "6b1967af2c2e9d5ea1e28e68bd6053199d7dd725", "pre_experiment_sha": "6b1967af2c2e9d5ea1e28e68bd6053199d7dd725", "timestamp": "2026-04-19T01:12:50.814720+00:00", "hypothesis": "Tighten the prompt to enforce exact one-label-only output and a minimal direct explicit support selection rule.", "hypothesis_source": "agent", "mutation_diff_summary": "", "score": 3.2, "score_ci_lower": 2.8, "score_ci_upper": 3.7, "raw_scores": [3.0, 3.0, 4.0, 3.5, 2.5], "baseline_score": 3.3, "outcome": "DISCARDED", "failure_mode": null, "duration_seconds": 12.408313291962259, "tags": ["output-contract", "single-label", "minimal-rule"], "learnings": "{\"what_changed\":\"\",\"what_improved\":[],\"what_regressed\":[],\"transferable_insight\":\"When a stricter output constraint does not improve results, the limiting factor is likely the underlying decision quality rather than the formatting of the response.\",\"domain_tags\":[\"prompting\",\"evaluation\",\"decision-making\"]}", "cost_usd": 0.010091550000000001, "bootstrap_seed": 0, "agent_model": "gpt-5.4", "held_out_score": null, "criterion_names": ["correct_category", "concise_output", "follows_format", "no_hallucination", "handles_ambiguity"], "per_criterion_scores": {"correct_category": 0.7, "concise_output": 0.8, "follows_format": 0.0, "no_hallucination": 0.8, "handles_ambiguity": 0.9}, "failure_classification": {"category": "output_format", "description": "The experiment failed with category labeled as 'unknown', and the hypothesis explicitly targets enforcing exact one-label-only output with a minimal direct explicit support selection rule, indicating the failure likely stemmed from output formatting/constraint adherence rather than core logic.", "fix_direction": "Focus on strict output schema compliance: constrain the model to emit exactly one allowed label only (no extra text), and implement a deterministic selection rule for the support label to prevent ambiguous/multi-part outputs.", "confidence": 0.56}, "drafts_generated": 1, "drafts_survived": 1}
{"id": "a551fe57-84e9-49b1-850d-68671116e783", "target_id": "B1-greedy", "git_sha": "6b1967af2c2e9d5ea1e28e68bd6053199d7dd725", "pre_experiment_sha": "6b1967af2c2e9d5ea1e28e68bd6053199d7dd725", "timestamp": "2026-04-19T01:13:05.747100+00:00", "hypothesis": "Tightening the prompt around exact one-label-only output and a minimal direct-support selection rule will improve binary scoring.", "hypothesis_source": "agent", "mutation_diff_summary": "", "score": 3.0, "score_ci_lower": 2.4, "score_ci_upper": 3.6, "raw_scores": [4.0, 2.0, 3.5, 3.0, 2.5], "baseline_score": 3.3, "outcome": "DISCARDED", "failure_mode": null, "duration_seconds": 12.66604925005231, "tags": ["output-contract", "single-label", "minimal-rule"], "learnings": "{\"what_changed\":\"\",\"what_improved\":[],\"what_regressed\":[],\"transferable_insight\":\"When a stricter output format and selection rule fail to improve results, the bottleneck is likely the underlying decision quality rather than prompt compliance.\",\"domain_tags\":[\"prompt-engineering\",\"evaluation\",\"decision-making\"]}", "cost_usd": 0.00987955, "bootstrap_seed": 0, "agent_model": "gpt-5.4", "held_out_score": null, "criterion_names": ["correct_category", "concise_output", "follows_format", "no_hallucination", "handles_ambiguity"], "per_criterion_scores": {"correct_category": 0.5, "concise_output": 1.0, "follows_format": 0.0, "no_hallucination": 0.5, "handles_ambiguity": 1.0}, "failure_classification": {"category": "logic_error", "description": "The provided metadata does not include an actual failure mode, error details, or evidence of format/schema, logic, syntax, scope, semantic meaning, regression, or over-optimization. With only a hypothesis and a score of 3.0, it\u2019s not possible to determine what specifically caused the experiment to fail.", "fix_direction": "Capture concrete failure signals (e.g., evaluator error messages, diff/changes applied, example I/O that failed, which category-specific constraint was violated) and rerun with targeted checks for output format vs. reasoning correctness vs. policy scope.", "confidence": 0.12}, "drafts_generated": 1, "drafts_survived": 1}
{"id": "75527ea7-c30b-4eba-9318-d4790850ec30", "target_id": "B1-greedy", "git_sha": "6b1967af2c2e9d5ea1e28e68bd6053199d7dd725", "pre_experiment_sha": "6b1967af2c2e9d5ea1e28e68bd6053199d7dd725", "timestamp": "2026-04-19T01:13:21.032297+00:00", "hypothesis": "Tighten the prompt to require a single verbatim label only and simplify selection to the most directly explicit match.", "hypothesis_source": "agent", "mutation_diff_summary": "", "score": 3.2, "score_ci_lower": 2.8, "score_ci_upper": 3.7, "raw_scores": [4.0, 3.0, 2.5, 3.5, 3.0], "baseline_score": 3.3, "outcome": "DISCARDED", "failure_mode": null, "duration_seconds": 12.651815416989848, "tags": ["single-label", "output-purity", "direct-match"], "learnings": "{\"what_changed\":\"\",\"what_improved\":[],\"what_regressed\":[],\"transferable_insight\":\"When a task depends on nuanced interpretation, over-constraining the response format and forcing the most explicit match can reduce useful flexibility without improving accuracy.\",\"domain_tags\":[\"prompt-design\",\"decision-making\",\"evaluation\"]}", "cost_usd": 0.009996350000000001, "bootstrap_seed": 0, "agent_model": "gpt-5.4", "held_out_score": null, "criterion_names": ["correct_category", "concise_output", "follows_format", "no_hallucination", "handles_ambiguity"], "per_criterion_scores": {"correct_category": 0.4, "concise_output": 1.0, "follows_format": 0.0, "no_hallucination": 0.8, "handles_ambiguity": 1.0}, "failure_classification": {"category": "output_format", "description": "The attempt appears to have not followed the tightened output requirement (single verbatim label only), leading to an evaluation mismatch despite the intent to simplify selection to the explicit label.", "fix_direction": "Enforce strict output schema/formatting constraints: return exactly one label string with no extra text, whitespace variations, or explanations; validate against the expected pattern before submission.", "confidence": 0.62}, "drafts_generated": 1, "drafts_survived": 1}
