{"id": "13d315a4-7fa6-4cb0-bc31-f6c7a03b4e87", "target_id": "B1-greedy", "git_sha": "4b23d5cb88c809cafabd60c2183be57c8fcc226a", "pre_experiment_sha": "4b23d5cb88c809cafabd60c2183be57c8fcc226a", "timestamp": "2026-04-23T23:44:39.500044+00:00", "hypothesis": "Introduce an Expert Linguistic Analyst persona, a silent mental decision tree for establishing contrastive boundaries, and strict XML-delimited exact-match output constraints to prevent semantic drift and formatting errors.", "hypothesis_source": "agent", "mutation_diff_summary": "", "score": 2.6, "score_ci_lower": 2.5, "score_ci_upper": 2.8, "raw_scores": [2.5, 2.5, 3.0, 2.5, 2.5], "baseline_score": 2.9, "outcome": "DISCARDED", "failure_mode": null, "duration_seconds": 65.10607016598806, "tags": ["persona", "analogy", "decision-tree", "constraints", "exact-match"], "learnings": "{\"what_changed\":\"\",\"what_improved\":[],\"what_regressed\":[],\"transferable_insight\":\"Combining highly specialized personas with complex hidden reasoning structures and rigid formatting constraints simultaneously degrades performance due to instruction overload.\",\"domain_tags\":[\"Prompt Engineering\",\"Instruction Complexity\",\"Persona Design\"]}", "cost_usd": 0.005461850000000001, "bootstrap_seed": 0, "agent_model": "gemini-3.1-pro-preview", "held_out_score": null, "criterion_names": ["correct_category", "concise_output", "follows_format", "no_hallucination", "handles_ambiguity"], "per_criterion_scores": {"correct_category": 0.3, "concise_output": 1.0, "follows_format": 0.0, "no_hallucination": 0.3, "handles_ambiguity": 1.0}, "failure_classification": {"category": "output_format", "description": "The hypothesis introduced 'strict XML-delimited exact-match output constraints' specifically to prevent formatting errors and semantic drift. A low score of 2.6000, despite these strict constraints, suggests that the model likely failed to consistently adhere to the required XML structure or schema. This could involve malformed XML, missing or incorrect tags, or other structural violations that prevented downstream processing or accurate evaluation of the 'exact-match' criteria. The failure to maintain the strict output format would make it difficult to properly assess the semantic content.", "fix_direction": "Simplify the required XML structure if possible, provide clearer and more explicit examples of the desired XML output structure in the prompt, and emphasize the XML formatting rules more strongly. Consider using techniques like XML schema validation in the evaluation pipeline to provide specific feedback on formatting errors. Additionally, ensure the model understands that the 'exact-match' aspect applies to the entire XML output, including tags and content, not just the semantic meaning.", "confidence": 0.85}, "drafts_generated": 1, "drafts_survived": 1}
{"id": "262946d1-1373-4c4d-be34-1463695b52e9", "target_id": "B1-greedy", "git_sha": "4b23d5cb88c809cafabd60c2183be57c8fcc226a", "pre_experiment_sha": "4b23d5cb88c809cafabd60c2183be57c8fcc226a", "timestamp": "2026-04-23T23:46:18.253064+00:00", "hypothesis": "Reintroducing an expert persona and a standardized test analogy, alongside explicit instructions for silent internal evaluation using contrastive boundaries, will improve classification accuracy and output formatting.", "hypothesis_source": "agent", "mutation_diff_summary": "", "score": 2.2, "score_ci_lower": 2.0, "score_ci_upper": 2.4, "raw_scores": [2.0, 2.5, 2.0, 2.0, 2.5], "baseline_score": 2.9, "outcome": "DISCARDED", "failure_mode": null, "duration_seconds": 70.72656204202212, "tags": ["persona", "analogy", "internal-reasoning", "exact-match"], "learnings": "{\"what_changed\":\"\",\"what_improved\":[],\"what_regressed\":[],\"transferable_insight\":\"Stacking multiple complex instructional frameworks, such as personas, analogies, and internal evaluation constraints, often degrades performance by overcomplicating the system's processing.\",\"domain_tags\":[\"Prompt Engineering\",\"Prompt Complexity\",\"Cognitive Load\"]}", "cost_usd": 0.0051585500000000005, "bootstrap_seed": 0, "agent_model": "gemini-3.1-pro-preview", "held_out_score": null, "criterion_names": ["correct_category", "concise_output", "follows_format", "no_hallucination", "handles_ambiguity"], "per_criterion_scores": {"correct_category": 0.0, "concise_output": 1.0, "follows_format": 0.0, "no_hallucination": 0.2, "handles_ambiguity": 1.0}, "failure_classification": {"category": "semantic_drift", "description": "The experiment aimed to improve classification accuracy by introducing an expert persona, standardized test analogy, and explicit instructions for silent internal evaluation. The failure indicates that despite these sophisticated prompting techniques, the model produced classifications that were semantically incorrect or did not achieve the desired accuracy. The output format might have been acceptable, but the core meaning (the classification itself) was wrong, suggesting the new instructions failed to enhance or perhaps even confused the model's understanding and reasoning.", "fix_direction": "Re-evaluate the clarity and effectiveness of the prompt instructions. Investigate whether the expert persona or test analogy were misinterpreted by the model, or if the 'silent internal evaluation' mechanism did not lead to improved reasoning for classification. Consider simplifying the instructions, breaking down complex concepts, or testing the impact of each prompt component in isolation. Focus on providing clearer examples or demonstrations of correct classification logic, especially regarding the 'contrastive boundaries', to ensure the model aligns its output meaning with the desired target.", "confidence": 0.9}, "drafts_generated": 1, "drafts_survived": 1}
