{"id": "c836faa6-0c5d-4b96-8acc-31aafa7b2148", "target_id": "B1-greedy", "git_sha": "6b1967af2c2e9d5ea1e28e68bd6053199d7dd725", "pre_experiment_sha": "6b1967af2c2e9d5ea1e28e68bd6053199d7dd725", "timestamp": "2026-04-19T01:07:41.810732+00:00", "hypothesis": "Tightening the prompt to an absolute one-label-only output contract with a minimal best-supported-choice rule will improve binary scoring.", "hypothesis_source": "agent", "mutation_diff_summary": "", "score": 2.9, "score_ci_lower": 2.6, "score_ci_upper": 3.2, "raw_scores": [3.5, 3.0, 2.5, 2.5, 3.0], "baseline_score": 3.3, "outcome": "DISCARDED", "failure_mode": null, "duration_seconds": 11.38286304101348, "tags": ["single-label", "strict-format", "deterministic", "output-purity"], "learnings": "{\"what_changed\":\"\",\"what_improved\":[],\"what_regressed\":[],\"transferable_insight\":\"Making an output contract stricter does not guarantee better performance if the task still lacks enough signal to support confident selection.\",\"domain_tags\":[\"prompting\",\"decision-making\",\"evaluation\"]}", "cost_usd": 0.00914995, "bootstrap_seed": 0, "agent_model": "gpt-5.4", "held_out_score": null, "criterion_names": ["correct_category", "concise_output", "follows_format", "no_hallucination", "handles_ambiguity"], "per_criterion_scores": {"correct_category": 0.4, "concise_output": 1.0, "follows_format": 0.0, "no_hallucination": 0.5, "handles_ambiguity": 1.0}, "failure_classification": {"category": "output_format", "description": "The experiment failed to comply with the required strict output contract (one-label-only with minimal best-supported-choice). The resulting output likely violated the expected schema/format, causing binary scoring issues.", "fix_direction": "Enforce a hard output constraint in the generation step (single label token only, no extra text, no reasoning), and add post-generation validation/repair to guarantee schema compliance.", "confidence": 0.62}, "drafts_generated": 1, "drafts_survived": 1}
{"id": "3afdb0df-b6b2-4c72-87c3-f7236a663364", "target_id": "B1-greedy", "git_sha": "6b1967af2c2e9d5ea1e28e68bd6053199d7dd725", "pre_experiment_sha": "6b1967af2c2e9d5ea1e28e68bd6053199d7dd725", "timestamp": "2026-04-19T01:07:56.192619+00:00", "hypothesis": "Tightening the prompt to a pure one-label-only contract with a minimal best-supported choice rule will improve deterministic binary grading.", "hypothesis_source": "agent", "mutation_diff_summary": "", "score": 2.9, "score_ci_lower": 2.7, "score_ci_upper": 3.0, "raw_scores": [3.0, 2.5, 3.0, 3.0, 3.0], "baseline_score": 3.3, "outcome": "DISCARDED", "failure_mode": null, "duration_seconds": 12.05041575001087, "tags": ["single-label", "strict-format", "deterministic", "no-explanation"], "learnings": "{\"what_changed\":\"\",\"what_improved\":[],\"what_regressed\":[],\"transferable_insight\":\"Making an instruction more restrictive does not necessarily improve consistency if the task still leaves room for ambiguity or weak evidence, so evaluation rules should be explicit and well-supported rather than merely minimal.\",\"domain_tags\":[\"prompting\",\"evaluation\",\"decision-making\"]}", "cost_usd": 0.00957315, "bootstrap_seed": 0, "agent_model": "gpt-5.4", "held_out_score": null, "criterion_names": ["correct_category", "concise_output", "follows_format", "no_hallucination", "handles_ambiguity"], "per_criterion_scores": {"correct_category": 0.4, "concise_output": 1.0, "follows_format": 0.0, "no_hallucination": 0.5, "handles_ambiguity": 1.0}, "failure_classification": {"category": "semantic_drift", "description": "The tightened one-label-only prompting did not achieve the intended improvement in deterministic binary grading; the resulting behavior likely changed the meaning/decision criteria of the model rather than consistently following the intended minimal best-supported choice rule.", "fix_direction": "Constrain the decision rule more explicitly in-system (e.g., require explicit comparison logic and consistent tie-breaking), and validate grading consistency on a held-out set; ensure the prompt\u2019s instructions map directly to the grader\u2019s expected meaning.", "confidence": 0.56}, "drafts_generated": 1, "drafts_survived": 1}
{"id": "ba01b5ed-b8b8-488b-9334-df2d067ed73f", "target_id": "B1-greedy", "git_sha": "6b1967af2c2e9d5ea1e28e68bd6053199d7dd725", "pre_experiment_sha": "6b1967af2c2e9d5ea1e28e68bd6053199d7dd725", "timestamp": "2026-04-19T01:08:13.024218+00:00", "hypothesis": "Tightening the prompt around exact one-label-only output and a single simple best-supported selection rule will improve binary grading consistency.", "hypothesis_source": "agent", "mutation_diff_summary": "", "score": 3.0, "score_ci_lower": 2.7, "score_ci_upper": 3.3, "raw_scores": [3.0, 2.5, 3.0, 3.5, 3.0], "baseline_score": 3.3, "outcome": "DISCARDED", "failure_mode": null, "duration_seconds": 12.726302499999292, "tags": ["single-label", "output-format", "deterministic", "classification"], "learnings": "{\"what_changed\":\"\",\"what_improved\":[],\"what_regressed\":[],\"transferable_insight\":\"Adding stricter output constraints and a simpler decision rule does not necessarily improve consistency unless the underlying task ambiguity is also reduced.\",\"domain_tags\":[\"prompting\",\"decision-making\",\"evaluation\"]}", "cost_usd": 0.00954935, "bootstrap_seed": 0, "agent_model": "gpt-5.4", "held_out_score": null, "criterion_names": ["correct_category", "concise_output", "follows_format", "no_hallucination", "handles_ambiguity"], "per_criterion_scores": {"correct_category": 0.5, "concise_output": 1.0, "follows_format": 0.0, "no_hallucination": 0.6, "handles_ambiguity": 0.9}, "failure_classification": {"category": "logic_error", "description": "The provided metadata is insufficient to determine why the experiment failed. Hypothesis concerns tightening output constraints, but no concrete failure signal, mismatch type, or error details are given (Failure Mode is explicitly 'unknown', and no observed grading discrepancy or parsing/logical error is described).", "fix_direction": "Provide specific failure evidence (e.g., evaluator error message, example inputs/outputs, whether failures were format vs meaning vs grading inconsistency) and then adjust along the corresponding axis (output schema enforcement, selection-rule logic, or evaluation alignment).", "confidence": 0.05}, "drafts_generated": 1, "drafts_survived": 1}
{"id": "14bdd68c-8448-4ca1-b972-021a51a09ccf", "target_id": "B1-greedy", "git_sha": "6b1967af2c2e9d5ea1e28e68bd6053199d7dd725", "pre_experiment_sha": "6b1967af2c2e9d5ea1e28e68bd6053199d7dd725", "timestamp": "2026-04-19T01:08:33.058721+00:00", "hypothesis": "Tightening the prompt around an exact one-label-only contract with a minimal best-supported selection rule will improve binary grading consistency.", "hypothesis_source": "agent", "mutation_diff_summary": "", "score": 3.1, "score_ci_lower": 2.6, "score_ci_upper": 3.6, "raw_scores": [3.5, 2.5, 4.0, 3.0, 2.5], "baseline_score": 3.3, "outcome": "DISCARDED", "failure_mode": null, "duration_seconds": 17.83810400008224, "tags": ["single-label", "strict-format", "deterministic", "output-purity"], "learnings": "{\"what_changed\":\"\",\"what_improved\":[],\"what_regressed\":[],\"transferable_insight\":\"When a task requires a single categorical choice, explicitly enforcing a one-answer contract and a minimal evidence-based selection rule can reduce ambiguity and improve consistency.\",\"domain_tags\":[\"prompt-design\",\"decision-making\",\"evaluation\"]}", "cost_usd": 0.00931975, "bootstrap_seed": 0, "agent_model": "gpt-5.4", "held_out_score": null, "criterion_names": ["correct_category", "concise_output", "follows_format", "no_hallucination", "handles_ambiguity"], "per_criterion_scores": {"correct_category": 0.4, "concise_output": 1.0, "follows_format": 0.0, "no_hallucination": 0.7, "handles_ambiguity": 1.0}, "failure_classification": {"category": "incomplete_edit", "description": "Failure mode is unspecified (\u201cunknown\u201d) and the result score is relatively low (3.1000), suggesting the experiment did not fully implement or validate the intended tightened one-label-only contract and selection rule, leaving an inconsistent or partially applied change.", "fix_direction": "Clarify and instrument the exact one-label-only output contract, add a deterministic minimal best-supported selection rule, and verify end-to-end that grading is binary and consistent across representative cases; ensure no partial updates remain.", "confidence": 0.38}, "drafts_generated": 1, "drafts_survived": 1}
{"id": "53d92701-32c3-4c53-90b1-a4ec7f9a80a5", "target_id": "B1-greedy", "git_sha": "6b1967af2c2e9d5ea1e28e68bd6053199d7dd725", "pre_experiment_sha": "6b1967af2c2e9d5ea1e28e68bd6053199d7dd725", "timestamp": "2026-04-19T01:08:48.625485+00:00", "hypothesis": "Tightening the prompt around exact one-label-only output and a single minimal best-supported-label rule will improve binary scoring.", "hypothesis_source": "agent", "mutation_diff_summary": "", "score": 3.0, "score_ci_lower": 2.5, "score_ci_upper": 3.4, "raw_scores": [3.5, 3.0, 3.0, 3.5, 2.0], "baseline_score": 3.3, "outcome": "DISCARDED", "failure_mode": null, "duration_seconds": 13.08251066703815, "tags": ["single-label", "output-purity", "deterministic", "greedy"], "learnings": "{\"what_changed\":\"\",\"what_improved\":[],\"what_regressed\":[],\"transferable_insight\":\"When a stricter output constraint reduces flexibility without adding clearer evidence criteria, performance can worsen rather than improve.\",\"domain_tags\":[\"prompt-design\",\"evaluation\",\"optimization\"]}", "cost_usd": 0.010598750000000002, "bootstrap_seed": 0, "agent_model": "gpt-5.4", "held_out_score": null, "criterion_names": ["correct_category", "concise_output", "follows_format", "no_hallucination", "handles_ambiguity"], "per_criterion_scores": {"correct_category": 0.6, "concise_output": 1.0, "follows_format": 0.0, "no_hallucination": 0.5, "handles_ambiguity": 0.9}, "failure_classification": {"category": "logic_error", "description": "The experiment failed without a specified failure mode, yet the hypothesis targets prompt tightening to change decision behavior for binary scoring. Given no parsing/schema issues are indicated and the result is not clearly improved, the most likely failure is that the revised instruction did not produce the intended label-selection logic (i.e., meaning/decision boundaries remained incorrect).", "fix_direction": "Focus on aligning the label-selection decision rule with the scoring definition (clarify tie-breaking, confidence thresholds, and what constitutes the \u201cbest-supported\u201d label), and verify via examples that the model\u2019s chosen label matches the expected binary scoring outcome.", "confidence": 0.38}, "drafts_generated": 1, "drafts_survived": 1}
{"id": "8e925b4b-c464-434a-a213-2e154e68c919", "target_id": "B1-greedy", "git_sha": "6b1967af2c2e9d5ea1e28e68bd6053199d7dd725", "pre_experiment_sha": "6b1967af2c2e9d5ea1e28e68bd6053199d7dd725", "timestamp": "2026-04-19T01:09:09.944262+00:00", "hypothesis": "Tightening the prompt around exact output purity and a single minimal tie-break rule will improve binary scoring.", "hypothesis_source": "agent", "mutation_diff_summary": "", "score": 3.2, "score_ci_lower": 2.8, "score_ci_upper": 3.5, "raw_scores": [2.5, 3.0, 3.5, 3.5, 3.5], "baseline_score": 3.3, "outcome": "DISCARDED", "failure_mode": null, "duration_seconds": 16.881741292076185, "tags": ["single-label", "output-format", "strictness", "ambiguity-handling"], "learnings": "{\"what_changed\":\"\",\"what_improved\":[],\"what_regressed\":[],\"transferable_insight\":\"When a stricter rule does not change the underlying decision signal, adding precision constraints alone is unlikely to improve binary outcomes.\",\"domain_tags\":[\"prompt-design\",\"decision-making\"]}", "cost_usd": 0.010480950000000001, "bootstrap_seed": 0, "agent_model": "gpt-5.4", "held_out_score": null, "criterion_names": ["correct_category", "concise_output", "follows_format", "no_hallucination", "handles_ambiguity"], "per_criterion_scores": {"correct_category": 0.7, "concise_output": 1.0, "follows_format": 0.0, "no_hallucination": 0.6, "handles_ambiguity": 0.9}, "failure_classification": {"category": "logic_error", "description": "Failure mode is unspecified (\u201cunknown\u201d), so the exact reason for the failed experiment can\u2019t be inferred from the provided fields (only the hypothesis and an intermediate score are given).", "fix_direction": "Identify the concrete failure signal (e.g., output schema mismatch, wrong decision logic, or evaluation gaming) by capturing logs/evaluation diff, then tighten the corresponding aspect (format validation, tie-break logic, or guardrails) accordingly.", "confidence": 0.1}, "drafts_generated": 1, "drafts_survived": 1}
{"id": "090cd16e-f2a5-4efc-83de-e44022c42c59", "target_id": "B1-greedy", "git_sha": "6b1967af2c2e9d5ea1e28e68bd6053199d7dd725", "pre_experiment_sha": "6b1967af2c2e9d5ea1e28e68bd6053199d7dd725", "timestamp": "2026-04-19T01:09:26.014637+00:00", "hypothesis": "Tightening the prompt around exact one-label-only output and a single minimal selection rule will improve binary grading consistency.", "hypothesis_source": "agent", "mutation_diff_summary": "", "score": 3.1, "score_ci_lower": 2.5, "score_ci_upper": 3.5, "raw_scores": [3.0, 2.0, 3.5, 3.5, 3.5], "baseline_score": 3.3, "outcome": "DISCARDED", "failure_mode": null, "duration_seconds": 13.497999249957502, "tags": ["single-label", "output-format", "strictness", "minimal-rule"], "learnings": "{\"what_changed\":\"\",\"what_improved\":[],\"what_regressed\":[],\"transferable_insight\":\"When a stricter instruction does not change the underlying decision rule or ambiguity, it is unlikely to improve consistency and may have no measurable effect.\",\"domain_tags\":[\"prompting\",\"evaluation\",\"decision-making\"]}", "cost_usd": 0.010473350000000001, "bootstrap_seed": 0, "agent_model": "gpt-5.4", "held_out_score": null, "criterion_names": ["correct_category", "concise_output", "follows_format", "no_hallucination", "handles_ambiguity"], "per_criterion_scores": {"correct_category": 0.7, "concise_output": 1.0, "follows_format": 0.0, "no_hallucination": 0.4, "handles_ambiguity": 1.0}, "failure_classification": {"category": "semantic_drift", "description": "The experiment aimed to improve grading consistency by tightening the output requirements, but the resulting behavior did not reliably match the intended binary grading meaning/selection rule (despite a relatively high score), suggesting the model\u2019s interpretation or application of the rule drifted rather than purely failing formatting or syntax.", "fix_direction": "Further constrain and explicitly specify the decision rule used for selection/grading (including edge cases), and validate with targeted test cases to ensure the intended semantics are preserved under the stricter output constraints.", "confidence": 0.62}, "drafts_generated": 1, "drafts_survived": 1}
{"id": "097ab886-1928-4ccb-8582-ab65a5af16a3", "target_id": "B1-greedy", "git_sha": "6b1967af2c2e9d5ea1e28e68bd6053199d7dd725", "pre_experiment_sha": "6b1967af2c2e9d5ea1e28e68bd6053199d7dd725", "timestamp": "2026-04-19T01:09:45.023115+00:00", "hypothesis": "Tightening the prompt around exact one-label-only output and a single minimal tie-break rule will improve binary grading consistency.", "hypothesis_source": "agent", "mutation_diff_summary": "", "score": 3.1, "score_ci_lower": 2.6, "score_ci_upper": 3.6, "raw_scores": [3.5, 2.5, 4.0, 3.0, 2.5], "baseline_score": 3.3, "outcome": "DISCARDED", "failure_mode": null, "duration_seconds": 16.75643662502989, "tags": ["single-label", "output-constraint", "minimal-tiebreak"], "learnings": "{\"what_changed\":\"\",\"what_improved\":[],\"what_regressed\":[],\"transferable_insight\":\"When a task requires a single categorical decision, explicitly constraining the output format and defining one simple tie-break rule can reduce ambiguity and improve consistency.\",\"domain_tags\":[\"prompt-design\",\"decision-making\",\"evaluation\"]}", "cost_usd": 0.010787950000000001, "bootstrap_seed": 0, "agent_model": "gpt-5.4", "held_out_score": null, "criterion_names": ["correct_category", "concise_output", "follows_format", "no_hallucination", "handles_ambiguity"], "per_criterion_scores": {"correct_category": 0.4, "concise_output": 1.0, "follows_format": 0.0, "no_hallucination": 0.8, "handles_ambiguity": 0.9}, "failure_classification": {"category": "semantic_drift", "description": "The experiment aimed to improve binary grading consistency by tightening output constraints, but the result did not reliably produce the intended meaning/behavior for the grader (despite the likely presence of an output restriction). The observed score (3.1000) suggests the changes did not preserve the correct interpretation needed for correct binary decisions.", "fix_direction": "Focus on aligning the tightened prompt\u2019s constraints with the grader\u2019s expected semantics (tie-break handling, label mapping, and decision criteria), and validate against a representative set of examples to ensure the model\u2019s meaning\u2014not just formatting\u2014matches what the grader evaluates.", "confidence": 0.48}, "drafts_generated": 1, "drafts_survived": 1}
{"id": "29228a14-71bb-440f-a07e-794ad739a353", "target_id": "B1-greedy", "git_sha": "6b1967af2c2e9d5ea1e28e68bd6053199d7dd725", "pre_experiment_sha": "6b1967af2c2e9d5ea1e28e68bd6053199d7dd725", "timestamp": "2026-04-19T01:10:02.272623+00:00", "hypothesis": "Tightening the prompt around exact one-label-only output with a single simple selection rule will improve binary grading consistency.", "hypothesis_source": "agent", "mutation_diff_summary": "", "score": 3.1, "score_ci_lower": 2.8, "score_ci_upper": 3.4, "raw_scores": [3.0, 2.5, 3.0, 3.5, 3.5], "baseline_score": 3.3, "outcome": "DISCARDED", "failure_mode": null, "duration_seconds": 13.65588666696567, "tags": ["single-label", "output-purity", "classification"], "learnings": "{\"what_changed\":\"\",\"what_improved\":[],\"what_regressed\":[],\"transferable_insight\":\"When a task requires a single categorical decision, constraining the output format and decision rule can reduce ambiguity and improve consistency.\",\"domain_tags\":[\"prompting\",\"classification\",\"evaluation\"]}", "cost_usd": 0.00959655, "bootstrap_seed": 0, "agent_model": "gpt-5.4", "held_out_score": null, "criterion_names": ["correct_category", "concise_output", "follows_format", "no_hallucination", "handles_ambiguity"], "per_criterion_scores": {"correct_category": 0.4, "concise_output": 1.0, "follows_format": 0.0, "no_hallucination": 0.7, "handles_ambiguity": 1.0}, "failure_classification": {"category": "output_format", "description": "The run was intended to enforce a strict one-label-only output, but the result did not meet the expected output structure/schema for binary grading consistency, leading to inconsistent or invalid interpretation by the grader.", "fix_direction": "Strengthen output constraints further (e.g., enforce exact label token formatting and reject any extra text), and validate against the grader\u2019s parsing rules using strict schema/regex before scoring.", "confidence": 0.62}, "drafts_generated": 1, "drafts_survived": 1}
{"id": "ba00754b-3abb-4521-aea4-15a93ac2a3c8", "target_id": "B1-greedy", "git_sha": "6b1967af2c2e9d5ea1e28e68bd6053199d7dd725", "pre_experiment_sha": "6b1967af2c2e9d5ea1e28e68bd6053199d7dd725", "timestamp": "2026-04-19T01:10:18.554280+00:00", "hypothesis": "Tightening the prompt around exact one-label-only output and a single minimal tie-break rule will improve binary scoring.", "hypothesis_source": "agent", "mutation_diff_summary": "", "score": 3.3, "score_ci_lower": 3.0, "score_ci_upper": 3.7, "raw_scores": [3.0, 3.0, 3.0, 3.5, 4.0], "baseline_score": 3.3, "outcome": "DISCARDED", "failure_mode": null, "duration_seconds": 13.81187749991659, "tags": ["single-label", "output-constraint", "minimal-rule", "classification"], "learnings": "{\"what_changed\":\"\",\"what_improved\":[],\"what_regressed\":[],\"transferable_insight\":\"Adding stricter output constraints and a simple deterministic tie-break rule does not necessarily improve performance when the underlying task signal is unchanged.\",\"domain_tags\":[\"prompt-design\",\"evaluation\",\"decision-rules\"]}", "cost_usd": 0.01035815, "bootstrap_seed": 0, "agent_model": "gpt-5.4", "held_out_score": null, "criterion_names": ["correct_category", "concise_output", "follows_format", "no_hallucination", "handles_ambiguity"], "per_criterion_scores": {"correct_category": 0.7, "concise_output": 1.0, "follows_format": 0.0, "no_hallucination": 0.7, "handles_ambiguity": 0.9}, "failure_classification": {"category": "semantic_drift", "description": "Likely produced outputs that technically fit the intended structure but applied an incorrect or inconsistent interpretation of the scoring/tie-break logic, resulting in a failed experiment despite the hypothesis about tightening the prompt.", "fix_direction": "Keep the output schema strict while also verifying the tie-break and binary decision rules match the evaluator\u2019s intended semantics; add explicit examples and tests covering edge cases where ties/uncertainty occur.", "confidence": 0.46}, "drafts_generated": 1, "drafts_survived": 1}
