{"id": "20383947-2d36-498a-8571-5cfde810fbb0", "target_id": "B1-greedy", "git_sha": "8846b3cbb734a05091414359465050afa82eef7c", "pre_experiment_sha": "8846b3cbb734a05091414359465050afa82eef7c", "timestamp": "2026-04-19T16:49:35.286888+00:00", "hypothesis": "Make exact-match output constraints more explicit and absolute to improve single-label compliance.", "hypothesis_source": "agent", "mutation_diff_summary": "", "score": 3.3, "score_ci_lower": 2.7, "score_ci_upper": 3.9, "raw_scores": [3.5, 2.5, 4.0, 2.5, 4.0], "baseline_score": 3.3, "outcome": "DISCARDED", "failure_mode": null, "duration_seconds": 12.900218917056918, "tags": ["exact-match", "output-constraint", "classification"], "learnings": "{\"what_changed\":\"\",\"what_improved\":[],\"what_regressed\":[],\"transferable_insight\":\"Making a requirement more explicit and absolute does not necessarily improve compliance if the underlying task framing or model behavior is unchanged.\",\"domain_tags\":[\"instruction-following\",\"evaluation\",\"prompting\"]}", "cost_usd": 0.010913550000000001, "bootstrap_seed": 0, "agent_model": "gpt-5.4", "held_out_score": null, "criterion_names": ["correct_category", "concise_output", "follows_format", "no_hallucination", "handles_ambiguity"], "per_criterion_scores": {"correct_category": 0.7, "concise_output": 1.0, "follows_format": 0.0, "no_hallucination": 0.7, "handles_ambiguity": 0.9}, "failure_classification": {"category": "output_format", "description": "The experiment appears to have failed to meet the required exact-match output constraints/structure, resulting in single-label non-compliance despite the intended focus on making those constraints explicit.", "fix_direction": "Ensure the output matches the required schema exactly (format, ordering, punctuation, labels) and add strict post-check/validation to enforce exact-match compliance before returning results.", "confidence": 0.62}, "drafts_generated": 1, "drafts_survived": 1}
{"id": "0c0209c8-e6e0-4af3-b0e5-73fdbc7a3f96", "target_id": "B1-greedy", "git_sha": "8846b3cbb734a05091414359465050afa82eef7c", "pre_experiment_sha": "8846b3cbb734a05091414359465050afa82eef7c", "timestamp": "2026-04-19T16:49:58.360703+00:00", "hypothesis": "Make exact-match output constraints more explicit and absolute to improve single-label compliance.", "hypothesis_source": "agent", "mutation_diff_summary": "", "score": 2.7, "score_ci_lower": 2.3, "score_ci_upper": 3.2, "raw_scores": [3.0, 2.5, 3.5, 2.5, 2.0], "baseline_score": 3.3, "outcome": "DISCARDED", "failure_mode": null, "duration_seconds": 20.55342458304949, "tags": ["exact-match", "output-constraint", "brevity"], "learnings": "{\"what_changed\":\"\",\"what_improved\":[],\"what_regressed\":[],\"transferable_insight\":\"Making a constraint more explicit and absolute does not necessarily improve compliance, so constraint wording should be validated empirically rather than assumed to help.\",\"domain_tags\":[\"instruction-design\",\"evaluation\",\"behavioral-compliance\"]}", "cost_usd": 0.011060750000000001, "bootstrap_seed": 0, "agent_model": "gpt-5.4", "held_out_score": null, "criterion_names": ["correct_category", "concise_output", "follows_format", "no_hallucination", "handles_ambiguity"], "per_criterion_scores": {"correct_category": 0.4, "concise_output": 1.0, "follows_format": 0.0, "no_hallucination": 0.3, "handles_ambiguity": 1.0}, "failure_classification": {"category": "output_format", "description": "The experiment failed due to not meeting the expected exact-match output constraints/structure, resulting in a structure/schema mismatch rather than a reasoning or logic error.", "fix_direction": "Make the response schema strictly enforced (fixed field order, required keys only, exact formatting, and no extra text) and validate outputs against the target template before submission.", "confidence": 0.62}, "drafts_generated": 1, "drafts_survived": 1}
{"id": "8b5bf5be-a45f-4311-a598-7680cc72e1f5", "target_id": "B1-greedy", "git_sha": "8846b3cbb734a05091414359465050afa82eef7c", "pre_experiment_sha": "8846b3cbb734a05091414359465050afa82eef7c", "timestamp": "2026-04-19T16:50:27.099089+00:00", "hypothesis": "Make exact-match output constraints stricter and more explicit so the model returns only one allowed label and nothing else.", "hypothesis_source": "agent", "mutation_diff_summary": "", "score": 3.2, "score_ci_lower": 3.0, "score_ci_upper": 3.4, "raw_scores": [3.5, 3.0, 3.0, 3.5, 3.0], "baseline_score": 3.3, "outcome": "DISCARDED", "failure_mode": null, "duration_seconds": 26.347393707954325, "tags": ["exact-match", "output-format", "constraint-tightening"], "learnings": "{\"what_changed\":\"\",\"what_improved\":[],\"what_regressed\":[],\"transferable_insight\":\"Making output constraints more explicit does not necessarily improve compliance when the underlying task or model behavior is unchanged, so stricter wording alone may add complexity without benefit.\",\"domain_tags\":[\"prompting\",\"evaluation\",\"constraint-satisfaction\"]}", "cost_usd": 0.010703750000000001, "bootstrap_seed": 0, "agent_model": "gpt-5.4", "held_out_score": null, "criterion_names": ["correct_category", "concise_output", "follows_format", "no_hallucination", "handles_ambiguity"], "per_criterion_scores": {"correct_category": 0.6, "concise_output": 1.0, "follows_format": 0.0, "no_hallucination": 0.6, "handles_ambiguity": 1.0}, "failure_classification": {"category": "output_format", "description": "The model did not satisfy the required exact-match output constraints (it returned something other than a single allowed label with no extra content), indicating an output structure/schema violation.", "fix_direction": "Tighten decoding/evaluation to enforce exact label-only output (e.g., constrained decoding, strict post-check with reroll/retry, and robust schema validation) and ensure the prompt/instructions explicitly forbid any additional text.", "confidence": 0.72}, "drafts_generated": 1, "drafts_survived": 1}
{"id": "e5f65509-861f-4e67-8aef-ebae39d53e69", "target_id": "B1-greedy", "git_sha": "8846b3cbb734a05091414359465050afa82eef7c", "pre_experiment_sha": "8846b3cbb734a05091414359465050afa82eef7c", "timestamp": "2026-04-19T16:50:58.528706+00:00", "hypothesis": "Make exact-match output compliance stricter by requiring the final answer to be only one verbatim allowed label with nothing else.", "hypothesis_source": "agent", "mutation_diff_summary": "", "score": 2.9, "score_ci_lower": 2.6, "score_ci_upper": 3.2, "raw_scores": [3.0, 2.5, 3.0, 3.5, 2.5], "baseline_score": 3.3, "outcome": "DISCARDED", "failure_mode": null, "duration_seconds": 26.40807775000576, "tags": ["exact-match", "output-constraint", "brevity"], "learnings": "{\"what_changed\":\"\",\"what_improved\":[],\"what_regressed\":[],\"transferable_insight\":\"When a task requires exact-match outputs, adding stricter formatting constraints can reduce compliance if they increase the chance of accidental deviation from the allowed response set.\",\"domain_tags\":[\"evaluation\",\"prompting\",\"formatting\"]}", "cost_usd": 0.01074975, "bootstrap_seed": 0, "agent_model": "gpt-5.4", "held_out_score": null, "criterion_names": ["correct_category", "concise_output", "follows_format", "no_hallucination", "handles_ambiguity"], "per_criterion_scores": {"correct_category": 0.5, "concise_output": 1.0, "follows_format": 0.0, "no_hallucination": 0.5, "handles_ambiguity": 0.9}, "failure_classification": {"category": "output_format", "description": "The experiment appears to fail the strict exact-match requirement for the final answer label (i.e., the output was not only a single verbatim allowed label with nothing else). This is consistent with an output structure/schema violation rather than a logic or semantic issue.", "fix_direction": "Ensure the final response is exactly one of the allowed labels and nothing else\u2014no extra text, punctuation, formatting, or JSON wrapper if not explicitly required by the evaluator.", "confidence": 0.74}, "drafts_generated": 1, "drafts_survived": 1}
{"id": "9e618aab-dbaa-41e3-a161-1cbc10387c34", "target_id": "B1-greedy", "git_sha": "8846b3cbb734a05091414359465050afa82eef7c", "pre_experiment_sha": "8846b3cbb734a05091414359465050afa82eef7c", "timestamp": "2026-04-19T16:51:14.681009+00:00", "hypothesis": "Tightening the output constraint to a single verbatim label with nothing else will improve exact-match compliance.", "hypothesis_source": "agent", "mutation_diff_summary": "", "score": 2.9, "score_ci_lower": 2.6, "score_ci_upper": 3.2, "raw_scores": [3.0, 2.5, 3.5, 3.0, 2.5], "baseline_score": 3.3, "outcome": "DISCARDED", "failure_mode": null, "duration_seconds": 13.305483833071776, "tags": ["exact-match", "format-constraint", "brevity"], "learnings": "{\"what_changed\":\"\",\"what_improved\":[],\"what_regressed\":[],\"transferable_insight\":\"When a stricter output format does not change measurable improvements, the constraint may be too narrow or misaligned with the task\u2019s failure mode to affect compliance.\",\"domain_tags\":[\"evaluation\",\"prompting\",\"formatting\"]}", "cost_usd": 0.01023395, "bootstrap_seed": 0, "agent_model": "gpt-5.4", "held_out_score": null, "criterion_names": ["correct_category", "concise_output", "follows_format", "no_hallucination", "handles_ambiguity"], "per_criterion_scores": {"correct_category": 0.4, "concise_output": 1.0, "follows_format": 0.0, "no_hallucination": 0.6, "handles_ambiguity": 0.9}, "failure_classification": {"category": "output_format", "description": "The experiment intended to tighten the output to a single verbatim label, but exact-match compliance did not improve as expected, indicating the produced output likely still included additional text/whitespace/punctuation or otherwise deviated from the strict schema the evaluator expects.", "fix_direction": "Ensure the output is exactly one token/label with no surrounding text, formatting, quotes, whitespace, or newlines; add a post-processing step to strip/normalize to the allowed label set before returning.", "confidence": 0.62}, "drafts_generated": 1, "drafts_survived": 1}
{"id": "55cbe02e-1167-4f99-addb-b6114b59cef5", "target_id": "B1-greedy", "git_sha": "8846b3cbb734a05091414359465050afa82eef7c", "pre_experiment_sha": "8846b3cbb734a05091414359465050afa82eef7c", "timestamp": "2026-04-19T16:51:32.283122+00:00", "hypothesis": "Make the output constraint maximally explicit so the model returns exactly one allowed label and nothing else.", "hypothesis_source": "agent", "mutation_diff_summary": "", "score": 3.1, "score_ci_lower": 2.7, "score_ci_upper": 3.5, "raw_scores": [3.5, 2.5, 3.5, 2.5, 3.5], "baseline_score": 3.3, "outcome": "DISCARDED", "failure_mode": null, "duration_seconds": 14.472000249894336, "tags": ["exact-match", "output-constraint", "classification"], "learnings": "{\"what_changed\":\"\",\"what_improved\":[],\"what_regressed\":[],\"transferable_insight\":\"Overly rigid output constraints can reduce compliance by making the task brittle rather than clarifying the desired behavior.\",\"domain_tags\":[\"prompt-engineering\",\"instruction-following\",\"model-behavior\"]}", "cost_usd": 0.009057550000000001, "bootstrap_seed": 0, "agent_model": "gpt-5.4", "held_out_score": null, "criterion_names": ["correct_category", "concise_output", "follows_format", "no_hallucination", "handles_ambiguity"], "per_criterion_scores": {"correct_category": 0.4, "concise_output": 1.0, "follows_format": 0.0, "no_hallucination": 0.7, "handles_ambiguity": 1.0}, "failure_classification": {"category": "output_format", "description": "The experiment failed because the model did not reliably follow the requirement to emit exactly one allowed label and nothing else, resulting in an unknown/invalid output format.", "fix_direction": "Further tighten and explicitly enforce the output schema: require a single-token/one-line response, add hard constraints (e.g., regex/JSON schema), and validate/strip any extra text before scoring.", "confidence": 0.62}, "drafts_generated": 1, "drafts_survived": 1}
{"id": "08026064-efee-4742-86a4-47f9e88276d7", "target_id": "B1-greedy", "git_sha": "8846b3cbb734a05091414359465050afa82eef7c", "pre_experiment_sha": "8846b3cbb734a05091414359465050afa82eef7c", "timestamp": "2026-04-19T16:51:54.779313+00:00", "hypothesis": "Tightening the prompt with stronger exact-match constraints and explicit refusal of any non-label output will improve single-label compliance.", "hypothesis_source": "agent", "mutation_diff_summary": "", "score": 3.1, "score_ci_lower": 2.4, "score_ci_upper": 3.7, "raw_scores": [3.5, 2.0, 3.5, 2.5, 4.0], "baseline_score": 3.3, "outcome": "DISCARDED", "failure_mode": null, "duration_seconds": 17.995184291969053, "tags": ["format-control", "exact-match", "classification"], "learnings": "{\"what_changed\":\"\",\"what_improved\":[],\"what_regressed\":[],\"transferable_insight\":\"Adding stricter exact-match constraints and explicit refusal rules does not necessarily improve compliance, so prompt tightening should be validated empirically rather than assumed to help.\",\"domain_tags\":[\"prompt-engineering\",\"evaluation\",\"behavioral-control\"]}", "cost_usd": 0.010629550000000001, "bootstrap_seed": 0, "agent_model": "gpt-5.4", "held_out_score": null, "criterion_names": ["correct_category", "concise_output", "follows_format", "no_hallucination", "handles_ambiguity"], "per_criterion_scores": {"correct_category": 0.5, "concise_output": 1.0, "follows_format": 0.0, "no_hallucination": 0.7, "handles_ambiguity": 0.9}, "failure_classification": {"category": "output_format", "description": "The experiment likely failed due to the model producing output that did not meet the required single-label exact structure (e.g., extra text, multiple labels, or format deviations), indicating a schema/format compliance issue rather than reasoning.", "fix_direction": "Enforce a strict output schema via constrained decoding/format validation, require exactly one label token, and add post-generation checks that reject anything outside the allowed label set.", "confidence": 0.46}, "drafts_generated": 1, "drafts_survived": 1}
{"id": "0b9af269-351a-41bc-b7c1-41326668477a", "target_id": "B1-greedy", "git_sha": "8846b3cbb734a05091414359465050afa82eef7c", "pre_experiment_sha": "8846b3cbb734a05091414359465050afa82eef7c", "timestamp": "2026-04-19T16:52:12.323974+00:00", "hypothesis": "Tighten the system prompt to enforce exact single-label output with stronger prohibitions against any extra text or formatting.", "hypothesis_source": "agent", "mutation_diff_summary": "", "score": 2.9, "score_ci_lower": 2.2, "score_ci_upper": 3.6, "raw_scores": [4.0, 2.0, 2.0, 3.0, 3.5], "baseline_score": 3.3, "outcome": "DISCARDED", "failure_mode": null, "duration_seconds": 15.113504707929678, "tags": ["exact-match", "strict-output", "classification"], "learnings": "{\"what_changed\":\"\",\"what_improved\":[],\"what_regressed\":[],\"transferable_insight\":\"When a task requires a strict output format, adding more prohibitions alone may not improve compliance and can still fail to change behavior.\",\"domain_tags\":[\"prompt-engineering\",\"output-formatting\",\"instruction-following\"]}", "cost_usd": 0.01136615, "bootstrap_seed": 0, "agent_model": "gpt-5.4", "held_out_score": null, "criterion_names": ["correct_category", "concise_output", "follows_format", "no_hallucination", "handles_ambiguity"], "per_criterion_scores": {"correct_category": 0.5, "concise_output": 1.0, "follows_format": 0.0, "no_hallucination": 0.5, "handles_ambiguity": 0.9}, "failure_classification": {"category": "output_format", "description": "The experiment aimed to enforce strict single-label output, but the result is classified as failed with an unknown failure mode\u2014consistent with the model still producing extra text, formatting, or multiple labels rather than the exact required schema.", "fix_direction": "Strengthen prompt constraints with explicit output-only instructions, add a hard example of a valid/invalid response, and consider using constrained decoding/validators (or post-processing) to guarantee exactly one label with no additional characters.", "confidence": 0.42}, "drafts_generated": 1, "drafts_survived": 1}
{"id": "41b64ed3-6258-49d2-929f-236c621215e7", "target_id": "B1-greedy", "git_sha": "8846b3cbb734a05091414359465050afa82eef7c", "pre_experiment_sha": "8846b3cbb734a05091414359465050afa82eef7c", "timestamp": "2026-04-19T16:52:30.142118+00:00", "hypothesis": "Strengthen output constraints and decision rules to force exact-match single-label classification with no extraneous text.", "hypothesis_source": "agent", "mutation_diff_summary": "", "score": 2.8, "score_ci_lower": 2.5, "score_ci_upper": 3.2, "raw_scores": [3.5, 2.5, 2.5, 3.0, 2.5], "baseline_score": 3.3, "outcome": "DISCARDED", "failure_mode": null, "duration_seconds": 15.091441249940544, "tags": ["format-control", "exact-match", "classification"], "learnings": "{\"what_changed\":\"\",\"what_improved\":[],\"what_regressed\":[],\"transferable_insight\":\"Tightening output constraints alone does not guarantee better performance if the underlying decision rule or model calibration is unchanged.\",\"domain_tags\":[\"evaluation\",\"prompting\",\"classification\"]}", "cost_usd": 0.01161435, "bootstrap_seed": 0, "agent_model": "gpt-5.4", "held_out_score": null, "criterion_names": ["correct_category", "concise_output", "follows_format", "no_hallucination", "handles_ambiguity"], "per_criterion_scores": {"correct_category": 0.4, "concise_output": 1.0, "follows_format": 0.0, "no_hallucination": 0.4, "handles_ambiguity": 1.0}, "failure_classification": {"category": "output_format", "description": "The experiment failed to meet the required output constraints for exact-match single-label classification with no extraneous text, indicating an output format/schema compliance problem rather than a reasoning or logic issue.", "fix_direction": "Tighten the generation pipeline to strictly emit only the single allowed label (no additional words/whitespace), and add automatic validation to reject any output that is not an exact match.", "confidence": 0.78}, "drafts_generated": 1, "drafts_survived": 1}
{"id": "d81a38ad-a20c-4837-8cc4-8d3f7644e9ac", "target_id": "B1-greedy", "git_sha": "8846b3cbb734a05091414359465050afa82eef7c", "pre_experiment_sha": "8846b3cbb734a05091414359465050afa82eef7c", "timestamp": "2026-04-19T16:52:46.034073+00:00", "hypothesis": "A shorter prompt that repeatedly enforces exact single-label verbatim output will improve exact-match classification behavior.", "hypothesis_source": "agent", "mutation_diff_summary": "", "score": 3.0, "score_ci_lower": 2.7, "score_ci_upper": 3.3, "raw_scores": [3.0, 2.5, 3.0, 3.5, 3.0], "baseline_score": 3.3, "outcome": "DISCARDED", "failure_mode": null, "duration_seconds": 11.297969708917663, "tags": ["concise", "exact-match", "output-format", "single-label"], "learnings": "{\"what_changed\":\"\",\"what_improved\":[],\"what_regressed\":[],\"transferable_insight\":\"Repeatedly constraining an output format can fail to improve exact-match performance if the underlying task alignment is not already strong, so brevity alone is not a reliable substitute for better task specification.\",\"domain_tags\":[\"prompt-engineering\",\"classification\",\"evaluation\"]}", "cost_usd": 0.00818975, "bootstrap_seed": 0, "agent_model": "gpt-5.4", "held_out_score": null, "criterion_names": ["correct_category", "concise_output", "follows_format", "no_hallucination", "handles_ambiguity"], "per_criterion_scores": {"correct_category": 0.3, "concise_output": 1.0, "follows_format": 0.0, "no_hallucination": 0.8, "handles_ambiguity": 0.9}, "failure_classification": {"category": "logic_error", "description": "The experiment metadata does not include an observable failure signature beyond a low score (3.0) and an unspecified failure mode. No evidence is provided of format/schema violation, reasoning error, regression, scope edits, syntax issues, semantic mismatch, over-optimization, or incomplete/partial edits.", "fix_direction": "Instrument and identify the exact failing symptom (e.g., compare outputs vs required schema/label, run an exact-match diff, and capture whether the model violates formatting vs produces wrong labels). Then target the corresponding axis (format enforcement, reasoning, or evaluation gaming prevention).", "confidence": 0.12}, "drafts_generated": 1, "drafts_survived": 1}
