{"id": "eb53eaa8-02e6-46be-a628-72d7f508d83f", "target_id": "B1-greedy", "git_sha": "6b1967af2c2e9d5ea1e28e68bd6053199d7dd725", "pre_experiment_sha": "6b1967af2c2e9d5ea1e28e68bd6053199d7dd725", "timestamp": "2026-04-19T01:16:51.429990+00:00", "hypothesis": "Tightening the prompt around literal text matching and output purity will improve single-label compliance.", "hypothesis_source": "agent", "mutation_diff_summary": "", "score": 3.0, "score_ci_lower": 2.6, "score_ci_upper": 3.5, "raw_scores": [2.5, 2.5, 4.0, 3.0, 3.0], "baseline_score": 3.3, "outcome": "DISCARDED", "failure_mode": null, "duration_seconds": 12.853940291912295, "tags": ["single-label", "literal-match", "output-format"], "learnings": "{\"what_changed\":\"\",\"what_improved\":[],\"what_regressed\":[],\"transferable_insight\":\"Adding stricter instructions can reduce compliance if they increase cognitive load or conflict with the model\u2019s default response patterns, so prompt constraints should be tested for net effect rather than assumed beneficial.\",\"domain_tags\":[\"prompt-engineering\",\"instruction-following\",\"evaluation\"]}", "cost_usd": 0.00965535, "bootstrap_seed": 0, "agent_model": "gpt-5.4", "held_out_score": null, "criterion_names": ["correct_category", "concise_output", "follows_format", "no_hallucination", "handles_ambiguity"], "per_criterion_scores": {"correct_category": 0.6, "concise_output": 1.0, "follows_format": 0.0, "no_hallucination": 0.4, "handles_ambiguity": 1.0}, "failure_classification": {"category": "incomplete_edit", "description": "The experiment intended to improve single-label compliance by tightening literal text matching and output purity, but the reported failure mode is 'unknown' and the score remains low/unchanged, suggesting only a partial or inconsistent modification rather than a complete end-to-end enforcement of the targeted constraints.", "fix_direction": "Ensure the full pipeline is updated coherently: tighten both the matching logic (exact string/whitelisting) and enforce a strict single-label output post-check that rejects or regenerates on any deviation; add validation tests to confirm compliance across edge cases.", "confidence": 0.32}, "drafts_generated": 1, "drafts_survived": 1}
{"id": "0e199ead-3826-47e4-b0fd-4e68dc998aa2", "target_id": "B1-greedy", "git_sha": "6b1967af2c2e9d5ea1e28e68bd6053199d7dd725", "pre_experiment_sha": "6b1967af2c2e9d5ea1e28e68bd6053199d7dd725", "timestamp": "2026-04-19T01:17:09.180148+00:00", "hypothesis": "Tightening the prompt to a pure one-label literal-match rule will improve output purity and binary scoring.", "hypothesis_source": "agent", "mutation_diff_summary": "", "score": 2.7, "score_ci_lower": 2.3, "score_ci_upper": 3.1, "raw_scores": [3.5, 2.5, 2.5, 3.0, 2.0], "baseline_score": 3.3, "outcome": "DISCARDED", "failure_mode": null, "duration_seconds": 15.091131250024773, "tags": ["single-label", "literal-match", "output-constraint"], "learnings": "{\"what_changed\":\"\",\"what_improved\":[],\"what_regressed\":[],\"transferable_insight\":\"Making instructions more rigid does not necessarily improve quality when the task depends on nuanced interpretation rather than exact matching.\",\"domain_tags\":[\"prompting\",\"evaluation\"]}", "cost_usd": 0.010267950000000001, "bootstrap_seed": 0, "agent_model": "gpt-5.4", "held_out_score": null, "criterion_names": ["correct_category", "concise_output", "follows_format", "no_hallucination", "handles_ambiguity"], "per_criterion_scores": {"correct_category": 0.5, "concise_output": 1.0, "follows_format": 0.0, "no_hallucination": 0.5, "handles_ambiguity": 0.7}, "failure_classification": {"category": "logic_error", "description": "The provided details do not indicate what specific aspect of the experiment failed (e.g., format/schema, reasoning, regression vs prior behavior, scope, syntax, or semantic meaning). Only the hypothesis and a score (2.7) are given, with 'unknown' as the failure mode.", "fix_direction": "Collect concrete failure evidence (e.g., example prompts/outputs, evaluator responses, and the exact criterion that lowered purity/binary scoring). Then adjust toward the axis that matches the observed symptom (format validation, reasoning constraints, or evaluation-gaming protections).", "confidence": 0.12}, "drafts_generated": 1, "drafts_survived": 1}
{"id": "06b2a06e-48ac-438c-bc28-7578f65e8b5d", "target_id": "B1-greedy", "git_sha": "6b1967af2c2e9d5ea1e28e68bd6053199d7dd725", "pre_experiment_sha": "6b1967af2c2e9d5ea1e28e68bd6053199d7dd725", "timestamp": "2026-04-19T01:17:39.594271+00:00", "hypothesis": "Tightening the prompt to only require one verbatim label chosen by closest direct literal match will improve single-label purity.", "hypothesis_source": "agent", "mutation_diff_summary": "", "score": 2.8, "score_ci_lower": 2.1, "score_ci_upper": 3.5, "raw_scores": [2.5, 3.0, 3.0, 4.0, 1.5], "baseline_score": 3.3, "outcome": "DISCARDED", "failure_mode": null, "duration_seconds": 26.06601116596721, "tags": ["single-label", "direct-match", "output-purity"], "learnings": "{\"what_changed\":\"\",\"what_improved\":[],\"what_regressed\":[],\"transferable_insight\":\"Over-constraining a selection rule can fail to improve purity when the added strictness does not align with the underlying matching behavior or data ambiguity.\",\"domain_tags\":[\"prompt-design\",\"classification\",\"evaluation\"]}", "cost_usd": 0.01036215, "bootstrap_seed": 0, "agent_model": "gpt-5.4", "held_out_score": null, "criterion_names": ["correct_category", "concise_output", "follows_format", "no_hallucination", "handles_ambiguity"], "per_criterion_scores": {"correct_category": 0.4, "concise_output": 1.0, "follows_format": 0.0, "no_hallucination": 0.5, "handles_ambiguity": 0.9}, "failure_classification": {"category": "incomplete_edit", "description": "The experiment result indicates the tighter one-label constraint did not reliably achieve the intended single-label purity; the failure mode is marked as unknown, suggesting the change may have been partial or did not consistently enforce the stricter literal-match requirement across the full output/selection pipeline.", "fix_direction": "Ensure the single-label selection logic is fully enforced end-to-end (from candidate generation to final label emission), with explicit fallback behavior when no exact literal match exists, and verify that evaluation checks single-label purity directly against the produced label.", "confidence": 0.42}, "drafts_generated": 1, "drafts_survived": 1}
{"id": "5a86120d-68ea-40ae-a18a-7d490112d5af", "target_id": "B1-greedy", "git_sha": "6b1967af2c2e9d5ea1e28e68bd6053199d7dd725", "pre_experiment_sha": "6b1967af2c2e9d5ea1e28e68bd6053199d7dd725", "timestamp": "2026-04-19T01:17:55.872174+00:00", "hypothesis": "Tightening the prompt to a pure single-label and direct literal-match rule will improve output purity and binary compliance.", "hypothesis_source": "agent", "mutation_diff_summary": "", "score": 3.0, "score_ci_lower": 2.6, "score_ci_upper": 3.4, "raw_scores": [2.5, 2.5, 3.5, 3.5, 3.0], "baseline_score": 3.3, "outcome": "DISCARDED", "failure_mode": null, "duration_seconds": 13.602282541920431, "tags": ["single-label", "output-purity", "literal-match"], "learnings": "{\"what_changed\":\"\",\"what_improved\":[],\"what_regressed\":[],\"transferable_insight\":\"Overly strict constraints can reduce flexibility without improving compliance, so rule changes should be validated against actual output quality rather than assumed to help.\",\"domain_tags\":[\"prompt-engineering\",\"evaluation\",\"optimization\"]}", "cost_usd": 0.00974675, "bootstrap_seed": 0, "agent_model": "gpt-5.4", "held_out_score": null, "criterion_names": ["correct_category", "concise_output", "follows_format", "no_hallucination", "handles_ambiguity"], "per_criterion_scores": {"correct_category": 0.5, "concise_output": 1.0, "follows_format": 0.0, "no_hallucination": 0.6, "handles_ambiguity": 0.9}, "failure_classification": {"category": "semantic_drift", "description": "The attempt to tighten the prompt to a strict single-label literal-match rule did not yield the expected binary compliance/output purity, indicating the model behavior/meaning diverged from the intended literal-match constraint (i.e., formatting may be acceptable but the decision logic did not follow the rule).", "fix_direction": "Refine the constraint enforcement by adding explicit step-by-step selection criteria and test cases that cover edge conditions; validate that the label choice strictly follows literal matching with no interpretive mapping.", "confidence": 0.62}, "drafts_generated": 1, "drafts_survived": 1}
{"id": "df6a9383-4754-45e5-99f1-e37df0d0b8e3", "target_id": "B1-greedy", "git_sha": "6b1967af2c2e9d5ea1e28e68bd6053199d7dd725", "pre_experiment_sha": "6b1967af2c2e9d5ea1e28e68bd6053199d7dd725", "timestamp": "2026-04-19T01:18:10.550792+00:00", "hypothesis": "Tightening the prompt to a pure one-label, literal-match-only contract will improve binary_criteria_score.", "hypothesis_source": "agent", "mutation_diff_summary": "", "score": 2.5, "score_ci_lower": 2.1, "score_ci_upper": 2.9, "raw_scores": [3.0, 2.0, 2.5, 3.0, 2.0], "baseline_score": 3.3, "outcome": "DISCARDED", "failure_mode": null, "duration_seconds": 12.472377208061516, "tags": ["single-label", "output-purity", "literal-match"], "learnings": "{\"what_changed\":\"\",\"what_improved\":[],\"what_regressed\":[],\"transferable_insight\":\"When a stricter instruction change yields no measurable gains and no identifiable sub-metrics move, the safest conclusion is to discard the change rather than assume hidden benefit.\",\"domain_tags\":[\"evaluation\",\"prompting\",\"experimentation\"]}", "cost_usd": 0.00990335, "bootstrap_seed": 0, "agent_model": "gpt-5.4", "held_out_score": null, "criterion_names": ["correct_category", "concise_output", "follows_format", "no_hallucination", "handles_ambiguity"], "per_criterion_scores": {"correct_category": 0.3, "concise_output": 1.0, "follows_format": 0.0, "no_hallucination": 0.3, "handles_ambiguity": 0.9}, "failure_classification": {"category": "incomplete_edit", "description": "The change aimed to tighten the prompt contract, but the result still performed poorly (binary_criteria_score remained low). This suggests the edit did not fully enforce the intended one-label, literal-match-only constraint across the whole prompt or evaluation path, leaving an inconsistent or partially applied instruction.", "fix_direction": "Ensure the one-label, exact literal-match-only requirement is consistently specified and unambiguous in every relevant section of the prompt; add explicit disallow/allowed output examples and strengthen instructions to prevent extra text or near-matches.", "confidence": 0.46}, "drafts_generated": 1, "drafts_survived": 1}
{"id": "7801a391-df3f-4477-9fa4-a242def7866b", "target_id": "B1-greedy", "git_sha": "6b1967af2c2e9d5ea1e28e68bd6053199d7dd725", "pre_experiment_sha": "6b1967af2c2e9d5ea1e28e68bd6053199d7dd725", "timestamp": "2026-04-19T01:18:40.330540+00:00", "hypothesis": "Tightening the prompt to enforce a literal-match-only single-label output will improve strict format adherence and reduce reasoning drift.", "hypothesis_source": "agent", "mutation_diff_summary": "", "score": 2.8, "score_ci_lower": 2.3, "score_ci_upper": 3.2, "raw_scores": [3.0, 2.0, 2.5, 3.5, 3.0], "baseline_score": 3.3, "outcome": "DISCARDED", "failure_mode": null, "duration_seconds": 25.5896628749324, "tags": ["single-label", "output-format", "literal-match", "strictness"], "learnings": "{\"what_changed\":\"\",\"what_improved\":[],\"what_regressed\":[],\"transferable_insight\":\"When a stricter output constraint is added, it can improve consistency only if the task and model are already well-aligned; otherwise, the added rigidity may not yield measurable gains.\",\"domain_tags\":[\"prompting\",\"evaluation\",\"format-adherence\"]}", "cost_usd": 0.00993495, "bootstrap_seed": 0, "agent_model": "gpt-5.4", "held_out_score": null, "criterion_names": ["correct_category", "concise_output", "follows_format", "no_hallucination", "handles_ambiguity"], "per_criterion_scores": {"correct_category": 0.4, "concise_output": 1.0, "follows_format": 0.0, "no_hallucination": 0.4, "handles_ambiguity": 1.0}, "failure_classification": {"category": "output_format", "description": "The experiment intended to enforce a strict literal-match single-label output, but the result indicates a failure to adhere to the required output structure/schema (failure mode was 'unknown', suggesting the primary issue was format/label compliance rather than content correctness).", "fix_direction": "Harden the output contract: enforce schema validation at runtime, add deterministic post-processing to coerce/strip extra text, and use constrained decoding or strict single-token/label matching to guarantee exactly one allowed label.", "confidence": 0.42}, "drafts_generated": 1, "drafts_survived": 1}
{"id": "55d55477-b400-4309-b57c-37ce3bbf39c4", "target_id": "B1-greedy", "git_sha": "6b1967af2c2e9d5ea1e28e68bd6053199d7dd725", "pre_experiment_sha": "6b1967af2c2e9d5ea1e28e68bd6053199d7dd725", "timestamp": "2026-04-19T01:18:57.109221+00:00", "hypothesis": "Tightening the prompt to only require one literal-match label with pure output will improve single-label compliance.", "hypothesis_source": "agent", "mutation_diff_summary": "", "score": 2.9, "score_ci_lower": 2.7, "score_ci_upper": 3.0, "raw_scores": [3.0, 3.0, 3.0, 2.5, 3.0], "baseline_score": 3.3, "outcome": "DISCARDED", "failure_mode": null, "duration_seconds": 14.292724999948405, "tags": ["single-label", "output-purity", "literal-match"], "learnings": "{\"what_changed\":\"\",\"what_improved\":[],\"what_regressed\":[],\"transferable_insight\":\"Making instructions stricter does not necessarily improve compliance when the task already has a narrow output format, and can fail to produce measurable gains.\",\"domain_tags\":[\"prompting\",\"evaluation\",\"instruction-following\"]}", "cost_usd": 0.00981595, "bootstrap_seed": 0, "agent_model": "gpt-5.4", "held_out_score": null, "criterion_names": ["correct_category", "concise_output", "follows_format", "no_hallucination", "handles_ambiguity"], "per_criterion_scores": {"correct_category": 0.4, "concise_output": 1.0, "follows_format": 0.0, "no_hallucination": 0.6, "handles_ambiguity": 0.9}, "failure_classification": {"category": "output_format", "description": "The experiment\u2019s result did not meet the expected single-label/pure-output structure. Despite tightening the prompt, the output still failed to conform to the required schema/format for a compliant single literal-match response.", "fix_direction": "Further constrain and validate the output format (e.g., enforce exact JSON/raw label-only output, add explicit formatting examples, and/or implement post-generation validation/repair) to ensure pure single-label compliance.", "confidence": 0.62}, "drafts_generated": 1, "drafts_survived": 1}
{"id": "be94db9d-f27b-4751-a166-6a7d92480572", "target_id": "B1-greedy", "git_sha": "6b1967af2c2e9d5ea1e28e68bd6053199d7dd725", "pre_experiment_sha": "6b1967af2c2e9d5ea1e28e68bd6053199d7dd725", "timestamp": "2026-04-19T01:19:12.604806+00:00", "hypothesis": "Tightening the prompt around exact one-label output and direct literal matching will improve binary criteria compliance.", "hypothesis_source": "agent", "mutation_diff_summary": "", "score": 2.9, "score_ci_lower": 2.7, "score_ci_upper": 3.0, "raw_scores": [3.0, 3.0, 2.5, 3.0, 3.0], "baseline_score": 3.3, "outcome": "DISCARDED", "failure_mode": null, "duration_seconds": 12.642823957954533, "tags": ["single-label", "output-purity", "literal-match"], "learnings": "{\"what_changed\":\"\",\"what_improved\":[],\"what_regressed\":[],\"transferable_insight\":\"Adding stricter output constraints can fail to improve compliance if the underlying task ambiguity or model behavior is not addressed.\",\"domain_tags\":[\"prompt-engineering\",\"evaluation\",\"classification\"]}", "cost_usd": 0.00980855, "bootstrap_seed": 0, "agent_model": "gpt-5.4", "held_out_score": null, "criterion_names": ["correct_category", "concise_output", "follows_format", "no_hallucination", "handles_ambiguity"], "per_criterion_scores": {"correct_category": 0.5, "concise_output": 1.0, "follows_format": 0.0, "no_hallucination": 0.5, "handles_ambiguity": 0.9}, "failure_classification": {"category": "output_format", "description": "The experiment failed likely due to the model not adhering strictly to the required exact one-label, literal output format (binary criteria compliance depends on exact matching). The low score suggests formatting/output formatting constraints were not consistently met despite tightening the prompt.", "fix_direction": "Enforce and validate exact output schema: use stricter formatting instructions, add explicit examples, and implement post-generation parsing/validation that rejects any output not matching the single allowed label exactly.", "confidence": 0.68}, "drafts_generated": 1, "drafts_survived": 1}
{"id": "52144877-8ed0-42e8-a91d-2e0e23a69512", "target_id": "B1-greedy", "git_sha": "6b1967af2c2e9d5ea1e28e68bd6053199d7dd725", "pre_experiment_sha": "6b1967af2c2e9d5ea1e28e68bd6053199d7dd725", "timestamp": "2026-04-19T01:19:33.866341+00:00", "hypothesis": "Tightening the prompt to a literal-match-only single-label rule will improve output purity and reduce reasoning-induced errors.", "hypothesis_source": "agent", "mutation_diff_summary": "", "score": 3.0, "score_ci_lower": 2.4, "score_ci_upper": 3.6, "raw_scores": [4.0, 2.0, 3.0, 3.0, 3.0], "baseline_score": 3.3, "outcome": "DISCARDED", "failure_mode": null, "duration_seconds": 17.611715208971873, "tags": ["single-label", "output-purity", "literal-match"], "learnings": "{\"what_changed\":\"\",\"what_improved\":[],\"what_regressed\":[],\"transferable_insight\":\"Overly restrictive instructions can reduce flexibility without improving accuracy, so prompt constraints should be validated against actual error reduction rather than assumed purity gains.\",\"domain_tags\":[\"prompt-engineering\",\"evaluation\",\"instruction-design\"]}", "cost_usd": 0.00918015, "bootstrap_seed": 0, "agent_model": "gpt-5.4", "held_out_score": null, "criterion_names": ["correct_category", "concise_output", "follows_format", "no_hallucination", "handles_ambiguity"], "per_criterion_scores": {"correct_category": 0.5, "concise_output": 1.0, "follows_format": 0.0, "no_hallucination": 0.5, "handles_ambiguity": 1.0}, "failure_classification": {"category": "logic_error", "description": "The experiment\u2019s declared hypothesis (tighter literal-match single-label prompting) and the provided fields do not include any concrete failure observation, output, or error evidence. With only 'Failure Mode: unknown' and a score of 3.0000, the specific reason for failure cannot be determined among the available categories.", "fix_direction": "Re-run with detailed logging of the model\u2019s output and the exact failure symptom (e.g., schema issues, incorrect reasoning, wrong meaning, unintended edits). Then map the symptom to one of the listed categories (output_format, logic_error, semantic_drift, etc.).", "confidence": 0.12}, "drafts_generated": 1, "drafts_survived": 1}
{"id": "dcdab5bb-0bd3-4a91-b068-16e79e0710ba", "target_id": "B1-greedy", "git_sha": "6b1967af2c2e9d5ea1e28e68bd6053199d7dd725", "pre_experiment_sha": "6b1967af2c2e9d5ea1e28e68bd6053199d7dd725", "timestamp": "2026-04-19T01:19:49.163012+00:00", "hypothesis": "Tightening the prompt to a literal-match single-label rule with stricter output purity will improve binary criteria adherence.", "hypothesis_source": "agent", "mutation_diff_summary": "", "score": 3.1, "score_ci_lower": 2.7, "score_ci_upper": 3.6, "raw_scores": [4.0, 3.0, 3.0, 2.5, 3.0], "baseline_score": 3.3, "outcome": "DISCARDED", "failure_mode": null, "duration_seconds": 12.934873500023969, "tags": ["single-label", "output-format", "literal-match", "strictness"], "learnings": "{\"what_changed\":\"\",\"what_improved\":[],\"what_regressed\":[],\"transferable_insight\":\"When a stricter rule does not change the underlying decision process, tightening the format alone may fail to improve adherence and can even reduce performance.\",\"domain_tags\":[\"prompting\",\"evaluation\",\"classification\"]}", "cost_usd": 0.00990175, "bootstrap_seed": 0, "agent_model": "gpt-5.4", "held_out_score": null, "criterion_names": ["correct_category", "concise_output", "follows_format", "no_hallucination", "handles_ambiguity"], "per_criterion_scores": {"correct_category": 0.5, "concise_output": 1.0, "follows_format": 0.0, "no_hallucination": 0.6, "handles_ambiguity": 1.0}, "failure_classification": {"category": "logic_error", "description": "The experiment failed, but the provided metadata does not specify the observed failure mode or what criterion was missed (only that the score is low and the failure mode is listed as 'unknown'). Without evidence of format issues, reasoning mistakes, scope changes, syntax problems, semantic errors, regressions, gaming, or partial edits, the correct category cannot be determined.", "fix_direction": "Capture the concrete failure signal (e.g., which criterion/binary check failed, whether output violated schema vs. meaning vs. parsing) and compare against a passing baseline to pinpoint whether the issue is structural, semantic, or due to evaluation gaming.", "confidence": 0.12}, "drafts_generated": 1, "drafts_survived": 1}
