{"id": "a3049a8b-2e4c-4924-8109-c96c2343b52f", "target_id": "B1-greedy", "git_sha": "4b23d5cb88c809cafabd60c2183be57c8fcc226a", "pre_experiment_sha": "4b23d5cb88c809cafabd60c2183be57c8fcc226a", "timestamp": "2026-04-23T23:30:58.647596+00:00", "hypothesis": "Adopt a highly structured, programmatic format with strict positive and negative constraints and 3 few-shot examples to enforce exact output formatting and eliminate semantic drift.", "hypothesis_source": "agent", "mutation_diff_summary": "", "score": 2.1, "score_ci_lower": 2.0, "score_ci_upper": 2.3, "raw_scores": [2.0, 2.0, 2.5, 2.0, 2.0], "baseline_score": 2.9, "outcome": "DISCARDED", "failure_mode": null, "duration_seconds": 76.97076233290136, "tags": ["formatting", "few-shot", "negative-constraints"], "learnings": "{\"what_changed\":\"\",\"what_improved\":[],\"what_regressed\":[],\"transferable_insight\":\"Over-constraining instructions with highly rigid programmatic formats and excessive negative constraints can degrade performance by restricting natural processing capabilities.\",\"domain_tags\":[\"Prompt Engineering\",\"Few-Shot Learning\",\"Constraint Management\"]}", "cost_usd": 0.0039021500000000005, "bootstrap_seed": 0, "agent_model": "gemini-3.1-pro-preview", "held_out_score": null, "criterion_names": ["correct_category", "concise_output", "follows_format", "no_hallucination", "handles_ambiguity"], "per_criterion_scores": {"correct_category": 0.0, "concise_output": 1.0, "follows_format": 0.0, "no_hallucination": 0.1, "handles_ambiguity": 1.0}, "failure_classification": {"category": "output_format", "description": "Despite implementing a highly structured, programmatic format with strict positive and negative constraints and few-shot examples, the experiment likely failed to consistently enforce the exact output formatting or schema, leading to deviations from the intended structure.", "fix_direction": "Refine the structural constraints and few-shot examples, focusing on simplifying the required output format or providing more explicit guidance and negative examples to prevent structural inconsistencies. Ensure the parser can gracefully handle minor deviations or provide clearer error signals for format violations.", "confidence": 0.8}, "drafts_generated": 1, "drafts_survived": 1}
{"id": "87f445f6-0344-4896-89e7-5f69c02b52cc", "target_id": "B1-greedy", "git_sha": "4b23d5cb88c809cafabd60c2183be57c8fcc226a", "pre_experiment_sha": "4b23d5cb88c809cafabd60c2183be57c8fcc226a", "timestamp": "2026-04-23T23:32:46.893657+00:00", "hypothesis": "Replace abstract instructions and personas with a programmatic format, 3 strictly formatted few-shot examples, strict positive/negative constraints, and a trailing output indicator to improve boundary recognition and eliminate format drift.", "hypothesis_source": "agent", "mutation_diff_summary": "", "score": 2.3, "score_ci_lower": 2.1, "score_ci_upper": 2.5, "raw_scores": [2.0, 2.5, 2.5, 2.5, 2.0], "baseline_score": 2.9, "outcome": "DISCARDED", "failure_mode": null, "duration_seconds": 84.86355183389969, "tags": ["programmatic_format", "few_shot_examples", "strict_constraints", "trailing_indicator"], "learnings": "{\"what_changed\":\"\",\"what_improved\":[],\"what_regressed\":[],\"transferable_insight\":\"Replacing natural language instructions with overly rigid programmatic formats and strict constraints can degrade performance by over-constraining the system.\",\"domain_tags\":[\"Prompt Engineering\",\"Instruction Formatting\",\"Constraint Design\"]}", "cost_usd": 0.0041869, "bootstrap_seed": 0, "agent_model": "gemini-3.1-pro-preview", "held_out_score": null, "criterion_names": ["correct_category", "concise_output", "follows_format", "no_hallucination", "handles_ambiguity"], "per_criterion_scores": {"correct_category": 0.1, "concise_output": 1.0, "follows_format": 0.0, "no_hallucination": 0.2, "handles_ambiguity": 1.0}, "failure_classification": {"category": "output_format", "description": "The experiment aimed to strictly control output format and improve boundary recognition using programmatic instructions, few-shot examples, and explicit constraints. The low score (2.3) suggests that these measures were ineffective in preventing format drift, leading to continued violations of the desired output structure or schema.", "fix_direction": "Refine the programmatic format for clarity and robustness, provide more diverse or complex few-shot examples to cover edge cases, and ensure the strict positive/negative constraints are unambiguous and consistently enforced. Consider adding a post-processing validation step for the output to identify and flag format violations more clearly, or explore fine-tuning if the base model struggles with strict instruction adherence.", "confidence": 0.9}, "drafts_generated": 1, "drafts_survived": 1}
{"id": "224a32e6-d513-49e3-8206-0e6e1454f6ef", "target_id": "B1-greedy", "git_sha": "4b23d5cb88c809cafabd60c2183be57c8fcc226a", "pre_experiment_sha": "4b23d5cb88c809cafabd60c2183be57c8fcc226a", "timestamp": "2026-04-23T23:34:36.015099+00:00", "hypothesis": "Removing the persona and subjective analysis instructions while pairing strict positive and negative formatting constraints will eliminate semantic drift and output format errors.", "hypothesis_source": "agent", "mutation_diff_summary": "", "score": 2.6, "score_ci_lower": 2.5, "score_ci_upper": 2.8, "raw_scores": [2.5, 3.0, 2.5, 2.5, 2.5], "baseline_score": 2.9, "outcome": "DISCARDED", "failure_mode": null, "duration_seconds": 64.76387254195288, "tags": ["zero-shot", "strict-formatting", "negative-constraints"], "learnings": "{\"what_changed\":\"\",\"what_improved\":[],\"what_regressed\":[],\"transferable_insight\":\"Replacing contextual framing and subjective guidelines with strictly rigid formatting constraints degrades performance, highlighting the importance of contextual grounding for maintaining output quality.\",\"domain_tags\":[\"Prompt Engineering\",\"Constraint Formatting\",\"Contextual Grounding\"]}", "cost_usd": 0.0034711500000000005, "bootstrap_seed": 0, "agent_model": "gemini-3.1-pro-preview", "held_out_score": null, "criterion_names": ["correct_category", "concise_output", "follows_format", "no_hallucination", "handles_ambiguity"], "per_criterion_scores": {"correct_category": 0.1, "concise_output": 1.0, "follows_format": 0.1, "no_hallucination": 0.4, "handles_ambiguity": 1.0}, "failure_classification": {"category": "semantic_drift", "description": "The experiment aimed to eliminate semantic drift by removing persona and subjective analysis instructions, but the low score indicates this was unsuccessful. This suggests that simply removing these contextual elements and relying solely on formatting constraints was insufficient to prevent the model from misinterpreting the task or generating outputs with incorrect meaning.", "fix_direction": "Instead of merely removing subjective instructions, focus on refining the core task definition with explicit, objective criteria and clear examples of desired output meaning. Explore alternative ways to ground the model's understanding and intent, perhaps by providing more robust objective context or a different type of constraint that guides semantic accuracy without introducing subjectivity.", "confidence": 0.85}, "drafts_generated": 1, "drafts_survived": 1}
{"id": "2a260980-649f-4aec-ba16-3836414c8dbf", "target_id": "B1-greedy", "git_sha": "4b23d5cb88c809cafabd60c2183be57c8fcc226a", "pre_experiment_sha": "4b23d5cb88c809cafabd60c2183be57c8fcc226a", "timestamp": "2026-04-23T23:36:00.240375+00:00", "hypothesis": "Frame the prompt as a strict data labeling operation with paired positive and exhaustive negative output constraints, removing personas, analogies, and analysis instructions to prevent semantic drift and format errors.", "hypothesis_source": "agent", "mutation_diff_summary": "", "score": 2.4, "score_ci_lower": 2.1, "score_ci_upper": 2.7, "raw_scores": [2.0, 2.0, 2.5, 2.5, 3.0], "baseline_score": 2.9, "outcome": "DISCARDED", "failure_mode": null, "duration_seconds": 64.09134112508036, "tags": ["0-shot", "strict-formatting", "negative-constraints", "no-persona"], "learnings": "{\"what_changed\":\"\",\"what_improved\":[],\"what_regressed\":[],\"transferable_insight\":\"Stripping away contextual framing and reasoning steps in favor of rigid, exhaustive constraints degrades performance, indicating that models rely on contextual cues for accurate processing.\",\"domain_tags\":[\"Prompt Engineering\",\"Constraint Formatting\",\"Contextual Framing\"]}", "cost_usd": 0.0037402500000000005, "bootstrap_seed": 0, "agent_model": "gemini-3.1-pro-preview", "held_out_score": null, "criterion_names": ["correct_category", "concise_output", "follows_format", "no_hallucination", "handles_ambiguity"], "per_criterion_scores": {"correct_category": 0.1, "concise_output": 1.0, "follows_format": 0.1, "no_hallucination": 0.2, "handles_ambiguity": 1.0}, "failure_classification": {"category": "semantic_drift", "description": "The hypothesis aimed to prevent semantic drift by strictly framing the prompt and removing elements like personas and analogies. The low score (2.4) indicates that the model likely still misinterpreted the core task of 'strict data labeling operation with paired positive and exhaustive negative output constraints,' leading to output with incorrect meaning or misapplied constraints. While format errors might have been a symptom, the primary failure appears to be the model's fundamental misunderstanding of the task's intent despite efforts to clarify the prompt.", "fix_direction": "Re-evaluate the clarity and robustness of the 'strict data labeling operation' and the definition of 'paired positive and exhaustive negative output constraints.' Beyond just removing ambiguous elements, consider incorporating explicit examples or more detailed specifications for how these constraints should be interpreted and applied in the output, ensuring the model fully grasps the expected semantic content.", "confidence": 0.9}, "drafts_generated": 1, "drafts_survived": 1}
{"id": "ae41a56f-758b-40a7-b4b6-877306e9efaa", "target_id": "B1-greedy", "git_sha": "4b23d5cb88c809cafabd60c2183be57c8fcc226a", "pre_experiment_sha": "4b23d5cb88c809cafabd60c2183be57c8fcc226a", "timestamp": "2026-04-23T23:37:44.158101+00:00", "hypothesis": "Convert to a strict, objective data labeling operation with zero-shot formatting, eliminating personas, analysis instructions, and adding exhaustive negative constraints for output formatting.", "hypothesis_source": "agent", "mutation_diff_summary": "", "score": 2.6, "score_ci_lower": 2.2, "score_ci_upper": 3.1, "raw_scores": [2.5, 2.5, 3.5, 2.0, 2.5], "baseline_score": 2.9, "outcome": "DISCARDED", "failure_mode": null, "duration_seconds": 71.40080737508833, "tags": ["0-shot", "negative-constraints", "strict-formatting", "no-persona"], "learnings": "{\"what_changed\":\"\",\"what_improved\":[],\"what_regressed\":[],\"transferable_insight\":\"Eliminating contextual framing and reasoning instructions while relying heavily on exhaustive negative constraints significantly degrades model performance.\",\"domain_tags\":[\"Prompt Engineering\",\"Constraint Management\",\"Zero-shot Prompting\"]}", "cost_usd": 0.0033910000000000004, "bootstrap_seed": 0, "agent_model": "gemini-3.1-pro-preview", "held_out_score": null, "criterion_names": ["correct_category", "concise_output", "follows_format", "no_hallucination", "handles_ambiguity"], "per_criterion_scores": {"correct_category": 0.2, "concise_output": 0.9, "follows_format": 0.3, "no_hallucination": 0.2, "handles_ambiguity": 1.0}, "failure_classification": {"category": "output_format", "description": "The experiment's hypothesis focused heavily on achieving zero-shot formatting with exhaustive negative constraints and removing traditional guidance (personas, analysis instructions). The low score suggests that, despite these efforts, the model failed to consistently adhere to the required output structure or schema. This could be due to the negative constraints being too complex, ambiguous, or contradictory, or because the removal of all positive formatting examples/guidance made it impossible for the model to correctly infer the desired output format.", "fix_direction": "Re-evaluate the clarity, comprehensiveness, and non-contradictory nature of the negative formatting constraints. Consider reintroducing minimal, objective *positive* examples or structural guidelines specifically for output formatting, ensuring they do not introduce subjective personas or analysis instructions that conflict with the goal of objectivity.", "confidence": 0.85}, "drafts_generated": 1, "drafts_survived": 1}
{"id": "c3d5d9c0-4a29-442e-8c37-11117294c693", "target_id": "B1-greedy", "git_sha": "4b23d5cb88c809cafabd60c2183be57c8fcc226a", "pre_experiment_sha": "4b23d5cb88c809cafabd60c2183be57c8fcc226a", "timestamp": "2026-04-23T23:39:38.647535+00:00", "hypothesis": "Reframing the prompt as a strict data labeling operation with exhaustive positive and negative formatting constraints, while removing personas, analogies, and abstract analysis instructions to prevent semantic drift and output format errors.", "hypothesis_source": "agent", "mutation_diff_summary": "", "score": 2.4, "score_ci_lower": 2.1, "score_ci_upper": 2.7, "raw_scores": [2.5, 2.0, 3.0, 2.5, 2.0], "baseline_score": 2.9, "outcome": "DISCARDED", "failure_mode": null, "duration_seconds": 72.9806523330044, "tags": ["0-shot", "strict-formatting", "negative-constraints", "objective-labeling", "no-persona"], "learnings": "{\"what_changed\":\"\",\"what_improved\":[],\"what_regressed\":[],\"transferable_insight\":\"Stripping away contextual framing and abstract reasoning in favor of exhaustive formatting constraints degrades performance, demonstrating that AI models require semantic context to execute complex tasks effectively.\",\"domain_tags\":[\"Prompt Engineering\",\"Contextual Framing\",\"Instruction Design\"]}", "cost_usd": 0.0037964, "bootstrap_seed": 0, "agent_model": "gemini-3.1-pro-preview", "held_out_score": null, "criterion_names": ["correct_category", "concise_output", "follows_format", "no_hallucination", "handles_ambiguity"], "per_criterion_scores": {"correct_category": 0.1, "concise_output": 1.0, "follows_format": 0.0, "no_hallucination": 0.3, "handles_ambiguity": 1.0}, "failure_classification": {"category": "semantic_drift", "description": "The experiment aimed to prevent semantic drift by reframing the prompt and removing abstract elements. However, the very low score (2.4) indicates that the model likely still misinterpreted the core intent or meaning of the 'strict data labeling operation,' leading to semantically incorrect outputs, even if some formatting was present. This suggests a fundamental misunderstanding of the task's purpose or the criteria for labeling, despite efforts to constrain the prompt.", "fix_direction": "Instead of focusing solely on removing abstract elements and strict formatting constraints, prioritize explicit clarification of the *meaning* and *criteria* for the data labeling task. Provide highly specific, contextually relevant examples that illustrate the *semantic* boundaries and definitions of the labels. Consider simplifying the conceptual complexity of the labeling task itself to reduce ambiguity, and ensure that the core objective of the 'data labeling operation' is conveyed with utmost clarity, focusing on 'what' to label and 'why' rather than just 'how' to format.", "confidence": 0.9}, "drafts_generated": 1, "drafts_survived": 1}
{"id": "ad0209fe-e2b9-43b5-9b3f-2edfeb4817b9", "target_id": "B1-greedy", "git_sha": "4b23d5cb88c809cafabd60c2183be57c8fcc226a", "pre_experiment_sha": "4b23d5cb88c809cafabd60c2183be57c8fcc226a", "timestamp": "2026-04-23T23:41:25.798746+00:00", "hypothesis": "Remove personas, analogies, and analysis instructions to prevent semantic drift, and enforce strict positive and exhaustive negative constraints to ensure exact match output.", "hypothesis_source": "agent", "mutation_diff_summary": "", "score": 2.4, "score_ci_lower": 2.1, "score_ci_upper": 2.7, "raw_scores": [2.5, 2.0, 2.5, 2.0, 3.0], "baseline_score": 2.9, "outcome": "DISCARDED", "failure_mode": null, "duration_seconds": 79.09854487492703, "tags": ["0-shot", "objective-labeling", "strict-formatting", "negative-constraints"], "learnings": "{\"what_changed\":\"\",\"what_improved\":[],\"what_regressed\":[],\"transferable_insight\":\"Removing contextual scaffolding and reasoning instructions in favor of purely rigid constraints degrades performance, indicating that AI models require analytical pathways to successfully execute tasks.\",\"domain_tags\":[\"Prompt Engineering\",\"Constraint Formatting\",\"Cognitive Scaffolding\"]}", "cost_usd": 0.0036093500000000008, "bootstrap_seed": 0, "agent_model": "gemini-3.1-pro-preview", "held_out_score": null, "criterion_names": ["correct_category", "concise_output", "follows_format", "no_hallucination", "handles_ambiguity"], "per_criterion_scores": {"correct_category": 0.2, "concise_output": 1.0, "follows_format": 0.0, "no_hallucination": 0.2, "handles_ambiguity": 1.0}, "failure_classification": {"category": "semantic_drift", "description": "The experiment's hypothesis explicitly aimed to prevent semantic drift and ensure exact match output. The low score (2.4) strongly suggests that the experiment failed to achieve this goal, meaning the outputs likely had incorrect or imprecise meaning despite potentially adhering to some structural aspects. Removing personas and analogies, combined with strict constraints, might have inadvertently made it harder for the model to understand the required semantics, leading to more, rather than less, semantic drift or simply incorrect semantic interpretations.", "fix_direction": "Re-evaluate the premise that removing all contextual aids (personas, analogies, analysis instructions) automatically leads to less semantic drift. It's possible these elements, when well-designed, actually help ground the model's understanding of the desired semantics. Explore how strict positive/negative constraints interact with the model's ability to interpret intent without richer context. Consider reintroducing carefully crafted, non-leading contextual elements that clarify meaning without introducing undesirable variability.", "confidence": 0.9}, "drafts_generated": 1, "drafts_survived": 1}
{"id": "4c48660e-7e12-4d33-9734-724a32871846", "target_id": "B1-greedy", "git_sha": "4b23d5cb88c809cafabd60c2183be57c8fcc226a", "pre_experiment_sha": "4b23d5cb88c809cafabd60c2183be57c8fcc226a", "timestamp": "2026-04-23T23:42:51.451039+00:00", "hypothesis": "Reframe the task as a strict, objective data labeling operation with paired positive and negative output constraints, removing personas, analogies, and analysis instructions.", "hypothesis_source": "agent", "mutation_diff_summary": "", "score": 2.5, "score_ci_lower": 2.2, "score_ci_upper": 2.8, "raw_scores": [3.0, 2.5, 2.5, 2.0, 2.5], "baseline_score": 2.9, "outcome": "DISCARDED", "failure_mode": null, "duration_seconds": 69.34391404199414, "tags": ["zero-shot", "strict-formatting", "negative-constraints"], "learnings": "{\"what_changed\":\"\",\"what_improved\":[],\"what_regressed\":[],\"transferable_insight\":\"Replacing contextual framing, personas, and explicit analysis instructions with strict, objective constraints degrades performance, highlighting the model's reliance on qualitative context and reasoning pathways.\",\"domain_tags\":[\"Prompt Engineering\",\"Contextual Framing\",\"Instruction Design\"]}", "cost_usd": 0.0034022500000000003, "bootstrap_seed": 0, "agent_model": "gemini-3.1-pro-preview", "held_out_score": null, "criterion_names": ["correct_category", "concise_output", "follows_format", "no_hallucination", "handles_ambiguity"], "per_criterion_scores": {"correct_category": 0.3, "concise_output": 1.0, "follows_format": 0.0, "no_hallucination": 0.2, "handles_ambiguity": 1.0}, "failure_classification": {"category": "semantic_drift", "description": "The experiment aimed to make the task a 'strict, objective data labeling operation' by removing subjective elements like personas, analogies, and analysis. The low score suggests that despite the reframing, the model's output likely still exhibited subjective interpretations, included forbidden elements, or failed to consistently deliver the 'objective' meaning intended by the new task definition, thus drifting from the desired semantic interpretation and content style.", "fix_direction": "Refine the prompt by providing clearer definitions of 'objective' and 'strict,' explicitly stating negative constraints (e.g., 'do NOT use analogies,' 'do NOT provide analysis'), and potentially including concrete examples of both desired objective output and undesired subjective/analytical output. Consider adding meta-instructions to reinforce a 'machine-like' persona for data labeling.", "confidence": 0.85}, "drafts_generated": 1, "drafts_survived": 1}
