{"id": "1690570c-1558-4c00-b844-2780d3993c95", "target_id": "B1-greedy", "git_sha": "4b23d5cb88c809cafabd60c2183be57c8fcc226a", "pre_experiment_sha": "4b23d5cb88c809cafabd60c2183be57c8fcc226a", "timestamp": "2026-04-23T23:04:16.881878+00:00", "hypothesis": "Refining the prompt to strictly use the \"Standardized Multiple-Choice Test\" framing while removing \"expert text classifier\" and \"carefully analyze\" will prevent overthinking and semantic drift, thereby improving the score.", "hypothesis_source": "agent", "mutation_diff_summary": "", "score": 2.6, "score_ci_lower": 2.5, "score_ci_upper": 2.8, "raw_scores": [2.5, 2.5, 2.5, 3.0, 2.5], "baseline_score": 2.9, "outcome": "DISCARDED", "failure_mode": null, "duration_seconds": 76.55500037502497, "tags": ["framing", "positive-constraint"], "learnings": "{\"what_changed\":\"\",\"what_improved\":[],\"what_regressed\":[],\"transferable_insight\":\"Removing expert personas and explicit analytical instructions in favor of rigid formatting constraints degrades performance, highlighting the value of role-playing and reasoning cues for complex tasks.\",\"domain_tags\":[\"Prompt Engineering\",\"Persona Prompting\",\"Reasoning Optimization\"]}", "cost_usd": 0.00363585, "bootstrap_seed": 0, "agent_model": "gemini-3.1-pro-preview", "held_out_score": null, "criterion_names": ["correct_category", "concise_output", "follows_format", "no_hallucination", "handles_ambiguity"], "per_criterion_scores": {"correct_category": 0.2, "concise_output": 1.0, "follows_format": 0.0, "no_hallucination": 0.4, "handles_ambiguity": 1.0}, "failure_classification": {"category": "semantic_drift", "description": "The hypothesis aimed to prevent semantic drift by simplifying the prompt and removing specific cues. The low score of 2.6000 suggests that these prompt modifications either failed to prevent semantic drift, or inadvertently stripped away crucial context, leading the model to misinterpret the task's true intent or nuances. The output likely adhered to a format but conveyed 'wrong meaning' relative to the desired classification, indicating that the model drifted from the intended interpretation.", "fix_direction": "Re-evaluate the prompt for potential ambiguities introduced by simplification. Consider what specific guidance or context phrases like 'expert text classifier' or 'carefully analyze' provided that was lost. The fix should focus on reintroducing precise, concise instructions or contextual anchors that guide the model back to the intended meaning without causing 'overthinking', perhaps by explicitly stating the classification criteria or the desired level of analysis.", "confidence": 0.95}, "drafts_generated": 1, "drafts_survived": 1}
{"id": "00a0939c-8f46-4434-82e9-1ce0398debaa", "target_id": "B1-greedy", "git_sha": "4b23d5cb88c809cafabd60c2183be57c8fcc226a", "pre_experiment_sha": "4b23d5cb88c809cafabd60c2183be57c8fcc226a", "timestamp": "2026-04-23T23:05:59.751647+00:00", "hypothesis": "Reframing strictly as a standardized multiple-choice test, removing \"expert\" and \"careful analysis\" phrasing to reduce overthinking, and relying on a single strong constraint at the end.", "hypothesis_source": "agent", "mutation_diff_summary": "", "score": 2.3, "score_ci_lower": 2.0, "score_ci_upper": 2.7, "raw_scores": [3.0, 2.0, 2.0, 2.5, 2.0], "baseline_score": 2.9, "outcome": "DISCARDED", "failure_mode": null, "duration_seconds": 85.0518751249183, "tags": ["standardized-test", "strict-formatting", "positive-constraint"], "learnings": "{\"what_changed\":\"\",\"what_improved\":[],\"what_regressed\":[],\"transferable_insight\":\"Removing explicit prompts for expertise and careful analysis in an attempt to reduce overthinking degrades performance, demonstrating that complex tasks require explicit reasoning cues to maintain quality.\",\"domain_tags\":[\"Prompt Engineering\",\"Persona Prompting\",\"Reasoning Elicitation\"]}", "cost_usd": 0.0034674500000000004, "bootstrap_seed": 0, "agent_model": "gemini-3.1-pro-preview", "held_out_score": null, "criterion_names": ["correct_category", "concise_output", "follows_format", "no_hallucination", "handles_ambiguity"], "per_criterion_scores": {"correct_category": 0.1, "concise_output": 1.0, "follows_format": 0.0, "no_hallucination": 0.2, "handles_ambiguity": 1.0}, "failure_classification": {"category": "semantic_drift", "description": "The experiment's attempt to reduce 'overthinking' by removing 'expert' and 'careful analysis' phrasing and reframing as a basic multiple-choice test likely stripped too much semantic context. This caused the model to misunderstand the intended depth or complexity of the task, leading to answers that fit the format but were semantically incorrect or superficial, as indicated by the low score.", "fix_direction": "Reintroduce subtle semantic cues or context within the prompt that implicitly guide the model towards the necessary depth of analysis or specific problem-solving approach, without explicitly using trigger words like 'expert' or 'careful analysis'. Focus on encoding the expectation of a thorough, nuanced answer through the structure of the problem or the nature of the choices, rather than relying solely on format or a single final constraint.", "confidence": 0.9}, "drafts_generated": 1, "drafts_survived": 1}
{"id": "b4d40b87-2972-4231-8349-87881b4733d5", "target_id": "B1-greedy", "git_sha": "4b23d5cb88c809cafabd60c2183be57c8fcc226a", "pre_experiment_sha": "4b23d5cb88c809cafabd60c2183be57c8fcc226a", "timestamp": "2026-04-23T23:07:21.701007+00:00", "hypothesis": "Removing \"expert text classifier\" and \"carefully analyze\" to strictly frame as a standardized multiple-choice test without over-prompting the analysis.", "hypothesis_source": "agent", "mutation_diff_summary": "", "score": 2.4, "score_ci_lower": 2.1, "score_ci_upper": 2.7, "raw_scores": [3.0, 2.5, 2.0, 2.0, 2.5], "baseline_score": 2.9, "outcome": "DISCARDED", "failure_mode": null, "duration_seconds": 67.22041658312082, "tags": ["framing", "simplicity", "constraints"], "learnings": "{\"what_changed\":\"\",\"what_improved\":[],\"what_regressed\":[],\"transferable_insight\":\"Stripping expert personas and explicit analytical instructions from a prompt in favor of a bare-bones testing format significantly degrades performance, highlighting the model's reliance on role-playing and explicit reasoning cues to perform well.\",\"domain_tags\":[\"Prompt Engineering\",\"Persona Prompting\",\"Reasoning Cues\"]}", "cost_usd": 0.0033407000000000003, "bootstrap_seed": 0, "agent_model": "gemini-3.1-pro-preview", "held_out_score": null, "criterion_names": ["correct_category", "concise_output", "follows_format", "no_hallucination", "handles_ambiguity"], "per_criterion_scores": {"correct_category": 0.1, "concise_output": 1.0, "follows_format": 0.0, "no_hallucination": 0.3, "handles_ambiguity": 1.0}, "failure_classification": {"category": "semantic_drift", "description": "The removal of explicit guiding phrases such as \"expert text classifier\" and \"carefully analyze\", while intended to standardize the prompt, likely stripped away critical semantic context. This caused the model to misinterpret the desired depth, rigor, or specific nature of the classification task, leading to outputs that are conceptually incorrect or misaligned with the intended meaning, as evidenced by the low score of 2.4000.", "fix_direction": "Reintroduce key semantic cues in a concise and impactful way. Experiment with alternative phrasing that implicitly conveys the need for expert-level analysis or careful consideration without being overly verbose. Focus on ensuring the prompt provides just enough context to anchor the model's understanding to the desired quality of classification, perhaps through strong framing or examples.", "confidence": 0.9}, "drafts_generated": 1, "drafts_survived": 1}
{"id": "f3e72c80-6075-478e-8cd0-ab9a0d650b63", "target_id": "B1-greedy", "git_sha": "4b23d5cb88c809cafabd60c2183be57c8fcc226a", "pre_experiment_sha": "4b23d5cb88c809cafabd60c2183be57c8fcc226a", "timestamp": "2026-04-23T23:09:33.749261+00:00", "hypothesis": "Reframing the prompt strictly as a standardized multiple-choice test, removing meta-instructions and the \"expert classifier\" role, and enforcing a single positive constraint at the end.", "hypothesis_source": "agent", "mutation_diff_summary": "", "score": 2.6, "score_ci_lower": 2.1, "score_ci_upper": 3.1, "raw_scores": [2.0, 3.0, 2.5, 3.5, 2.0], "baseline_score": 2.9, "outcome": "DISCARDED", "failure_mode": null, "duration_seconds": 82.92865162505768, "tags": ["standardized-test", "structural-markers", "positive-constraint"], "learnings": "{\"what_changed\":\"\",\"what_improved\":[],\"what_regressed\":[],\"transferable_insight\":\"Removing expert personas and detailed meta-instructions in favor of a rigid, standardized format degrades performance, indicating that models rely on contextual framing for complex tasks.\",\"domain_tags\":[\"Prompt Engineering\",\"Persona Prompting\",\"Instruction Formatting\"]}", "cost_usd": 0.0033579500000000006, "bootstrap_seed": 0, "agent_model": "gemini-3.1-pro-preview", "held_out_score": null, "criterion_names": ["correct_category", "concise_output", "follows_format", "no_hallucination", "handles_ambiguity"], "per_criterion_scores": {"correct_category": 0.1, "concise_output": 1.0, "follows_format": 0.0, "no_hallucination": 0.5, "handles_ambiguity": 1.0}, "failure_classification": {"category": "output_format", "description": "The experiment aimed to strictly control the output format by reframing the prompt as a multiple-choice test and enforcing a single positive constraint. The low score suggests the model failed to adhere to these strict format requirements, likely producing additional text, an incorrect structure, or deviating from the specified single positive constraint (e.g., not outputting just the chosen option or the required single positive response).", "fix_direction": "Strengthen negative constraints (e.g., 'DO NOT explain', 'NO extra text') to prevent extraneous output. Provide few-shot examples that *exactly* demonstrate the desired minimalist output format. Consider explicit instructions for the 'single positive constraint' to ensure it's interpreted as an absolute format requirement.", "confidence": 0.95}, "drafts_generated": 1, "drafts_survived": 1}
{"id": "3eecee40-2d56-4a43-b3fa-19a7601eb65e", "target_id": "B1-greedy", "git_sha": "4b23d5cb88c809cafabd60c2183be57c8fcc226a", "pre_experiment_sha": "4b23d5cb88c809cafabd60c2183be57c8fcc226a", "timestamp": "2026-04-23T23:11:08.335254+00:00", "hypothesis": "Reframed strictly as a standardized multiple-choice test by removing the expert classifier persona and analysis meta-instructions, leaving only the task description and final formatting constraint.", "hypothesis_source": "agent", "mutation_diff_summary": "", "score": 2.5, "score_ci_lower": 2.1, "score_ci_upper": 2.9, "raw_scores": [3.0, 2.0, 2.0, 3.0, 2.5], "baseline_score": 2.9, "outcome": "DISCARDED", "failure_mode": null, "duration_seconds": 76.19344774982892, "tags": ["prompt-engineering", "formatting-constraint", "persona-removal"], "learnings": "{\"what_changed\":\"\",\"what_improved\":[],\"what_regressed\":[],\"transferable_insight\":\"Retaining expert personas and explicit reasoning instructions yields better performance than reducing a prompt to a bare-bones, standardized question format.\",\"domain_tags\":[\"Prompt Engineering\",\"Persona Prompting\",\"Reasoning\"]}", "cost_usd": 0.00325315, "bootstrap_seed": 0, "agent_model": "gemini-3.1-pro-preview", "held_out_score": null, "criterion_names": ["correct_category", "concise_output", "follows_format", "no_hallucination", "handles_ambiguity"], "per_criterion_scores": {"correct_category": 0.0, "concise_output": 1.0, "follows_format": 0.0, "no_hallucination": 0.5, "handles_ambiguity": 1.0}, "failure_classification": {"category": "semantic_drift", "description": "The experiment aimed to simplify the prompt by removing the 'expert classifier persona' and 'analysis meta-instructions,' leaving only the task description and formatting constraint. This removal likely deprived the model of crucial context, reasoning guidance, or implied knowledge, leading it to generate classifications that were structurally correct (adhering to the final formatting constraint) but semantically inaccurate or nonsensical, resulting in a low score of 2.5000. The model failed to grasp the intended meaning of the task or categories without the removed directives.", "fix_direction": "Re-evaluate the necessity of the removed persona and meta-instructions. Instead of a complete removal, try to distill the most critical aspects of that guidance into concise, explicit instructions within the task description itself. The goal should be to provide just enough context for accurate classification without reintroducing the 'expert persona' or verbose analysis steps, finding a balance between conciseness and clarity for the model.", "confidence": 0.95}, "drafts_generated": 1, "drafts_survived": 1}
{"id": "500171de-9417-4bda-b878-8a1efb907369", "target_id": "B1-greedy", "git_sha": "4b23d5cb88c809cafabd60c2183be57c8fcc226a", "pre_experiment_sha": "4b23d5cb88c809cafabd60c2183be57c8fcc226a", "timestamp": "2026-04-23T23:12:48.634687+00:00", "hypothesis": "Reframing the prompt as a standardized multiple-choice test with XML tags for the input text and a strict final positive constraint, while removing meta-instructions and the \"expert classifier\" persona to prevent semantic drift.", "hypothesis_source": "agent", "mutation_diff_summary": "", "score": 2.2, "score_ci_lower": 2.0, "score_ci_upper": 2.4, "raw_scores": [2.0, 2.5, 2.0, 2.0, 2.5], "baseline_score": 2.9, "outcome": "DISCARDED", "failure_mode": null, "duration_seconds": 83.07997433305718, "tags": ["formatting", "persona", "constraints"], "learnings": "{\"what_changed\":\"\",\"what_improved\":[],\"what_regressed\":[],\"transferable_insight\":\"Removing expert personas and detailed meta-instructions in favor of a rigid, standardized format can degrade performance, indicating that role-playing and nuanced guidance are often necessary for maintaining high-quality outputs.\",\"domain_tags\":[\"Prompt Engineering\",\"Persona Prompting\",\"Instruction Formatting\"]}", "cost_usd": 0.0034948000000000006, "bootstrap_seed": 0, "agent_model": "gemini-3.1-pro-preview", "held_out_score": null, "criterion_names": ["correct_category", "concise_output", "follows_format", "no_hallucination", "handles_ambiguity"], "per_criterion_scores": {"correct_category": 0.1, "concise_output": 1.0, "follows_format": 0.0, "no_hallucination": 0.1, "handles_ambiguity": 1.0}, "failure_classification": {"category": "semantic_drift", "description": "The experiment aimed to prevent semantic drift by significantly reframing the prompt's structure, introducing XML tags, and adding strict output constraints, while removing meta-instructions. The low score (2.2000) strongly suggests that these changes either failed to prevent semantic drift, or worse, introduced new forms of misinterpretation where the model failed to grasp the intended meaning of the task or the input, leading to incorrect responses despite potentially adhering to some structural aspects.", "fix_direction": "Analyze the model's outputs under the new prompt structure to pinpoint exactly where the semantic misunderstanding occurred. Investigate if the new 'standardized multiple-choice test' format, the XML tagging, or the strict output constraint introduced ambiguity or were misinterpreted. Re-evaluate if removing meta-instructions and the 'expert classifier' persona deprived the model of necessary context or guidance, potentially requiring a more concise but clear form of instruction to guide semantic understanding without causing drift.", "confidence": 0.9}, "drafts_generated": 1, "drafts_survived": 1}
{"id": "ef2ff084-dba6-4156-9862-90a3d40ef864", "target_id": "B1-greedy", "git_sha": "4b23d5cb88c809cafabd60c2183be57c8fcc226a", "pre_experiment_sha": "4b23d5cb88c809cafabd60c2183be57c8fcc226a", "timestamp": "2026-04-23T23:14:55.462344+00:00", "hypothesis": "Replacing the multiple-choice framing with an \"Expert Text Classifier\" persona and explicit analysis instructions will improve accuracy and reduce semantic drift.", "hypothesis_source": "agent", "mutation_diff_summary": "", "score": 2.3, "score_ci_lower": 2.1, "score_ci_upper": 2.5, "raw_scores": [2.5, 2.0, 2.0, 2.5, 2.5], "baseline_score": 2.9, "outcome": "DISCARDED", "failure_mode": null, "duration_seconds": 76.16824245802127, "tags": ["framing", "persona", "positive-constraint"], "learnings": "{\"what_changed\":\"\",\"what_improved\":[],\"what_regressed\":[],\"transferable_insight\":\"Overcomplicating a classification task with an expert persona and explicit analysis instructions can degrade performance compared to a simple, constrained multiple-choice format.\",\"domain_tags\":[\"Prompt Engineering\",\"Persona Prompting\",\"Task Framing\"]}", "cost_usd": 0.0033952999999999995, "bootstrap_seed": 0, "agent_model": "gemini-3.1-pro-preview", "held_out_score": null, "criterion_names": ["correct_category", "concise_output", "follows_format", "no_hallucination", "handles_ambiguity"], "per_criterion_scores": {"correct_category": 0.1, "concise_output": 0.9, "follows_format": 0.0, "no_hallucination": 0.3, "handles_ambiguity": 1.0}, "failure_classification": {"category": "semantic_drift", "description": "The experiment aimed to reduce semantic drift by replacing multiple-choice framing with an 'Expert Text Classifier' persona and explicit analysis instructions. The failure, indicated by a very low score of 2.3000 (assuming a positive performance metric like accuracy), suggests the model still exhibits incorrect reasoning or misunderstanding of the input, failing to grasp the intended meaning despite the new guidance.", "fix_direction": "Refine the 'Expert Text Classifier' persona and explicit instructions to be more precise and unambiguous. Provide clear examples of correct classifications and edge cases. Consider simplifying the analytical instructions or breaking the classification task into sub-steps to guide the model more effectively towards the correct semantic interpretation.", "confidence": 0.9}, "drafts_generated": 1, "drafts_survived": 1}
{"id": "103744d4-a57e-4df6-a1f4-39360152541e", "target_id": "B1-greedy", "git_sha": "4b23d5cb88c809cafabd60c2183be57c8fcc226a", "pre_experiment_sha": "4b23d5cb88c809cafabd60c2183be57c8fcc226a", "timestamp": "2026-04-23T23:16:22.168377+00:00", "hypothesis": "Reframing the prompt as a precise text classification task and explicitly instructing the model to analyze the text's core intent against category definitions will improve accuracy and reduce semantic drift.", "hypothesis_source": "agent", "mutation_diff_summary": "", "score": 2.3, "score_ci_lower": 2.0, "score_ci_upper": 2.7, "raw_scores": [2.0, 3.0, 2.0, 2.5, 2.0], "baseline_score": 2.9, "outcome": "DISCARDED", "failure_mode": null, "duration_seconds": 62.63580200006254, "tags": ["framing", "analysis-instructions", "positive-constraints"], "learnings": "{\"what_changed\":\"\",\"what_improved\":[],\"what_regressed\":[],\"transferable_insight\":\"Over-constraining a prompt with rigid classification framing and explicit intent-matching instructions can degrade rather than improve model accuracy.\",\"domain_tags\":[\"Prompt Engineering\",\"Text Classification\",\"Constraint Management\"]}", "cost_usd": 0.0036475, "bootstrap_seed": 0, "agent_model": "gemini-3.1-pro-preview", "held_out_score": null, "criterion_names": ["correct_category", "concise_output", "follows_format", "no_hallucination", "handles_ambiguity"], "per_criterion_scores": {"correct_category": 0.1, "concise_output": 1.0, "follows_format": 0.0, "no_hallucination": 0.2, "handles_ambiguity": 1.0}, "failure_classification": {"category": "semantic_drift", "description": "The experiment's hypothesis explicitly targeted reducing 'semantic drift' and improving accuracy by reframing the prompt and instructing the model to analyze core intent. The failure of this experiment (indicated by a low score) suggests that despite these efforts, the model still misinterpreted or incorrectly classified the text's meaning against the category definitions, indicating that semantic drift was not adequately mitigated or even worsened.", "fix_direction": "Further refine prompt engineering by providing more precise and granular instructions for semantic analysis and classification. Experiment with different linguistic structures, few-shot examples that clearly differentiate between close categories, and meta-instructions to ensure the model correctly maps text intent to category definitions, avoiding misinterpretation.", "confidence": 0.9}, "drafts_generated": 1, "drafts_survived": 1}
