{"id": "0d71883a-905e-4819-b36f-a95e12c9185f", "target_id": "B1-greedy", "git_sha": "6e9c9f3f1a3233cd35cb09734fd485f5a500187b", "pre_experiment_sha": "6e9c9f3f1a3233cd35cb09734fd485f5a500187b", "timestamp": "2026-04-23T22:51:25.447893+00:00", "hypothesis": "Adopting a strict M2M API endpoint framing with a positive terminal constraint and removing all negative constraints will prevent formatting errors and improve exact-match accuracy.", "hypothesis_source": "agent", "mutation_diff_summary": "", "score": 2.3, "score_ci_lower": 2.1, "score_ci_upper": 2.5, "raw_scores": [2.0, 2.5, 2.5, 2.5, 2.0], "baseline_score": 2.5, "outcome": "DISCARDED", "failure_mode": null, "duration_seconds": 55.272261125035584, "tags": ["m2m", "positive-constraint", "api-framing"], "learnings": "{\"what_changed\":\"\",\"what_improved\":[],\"what_regressed\":[],\"transferable_insight\":\"Eliminating negative constraints in favor of purely positive instructions degrades performance, demonstrating that explicitly defining what to avoid is crucial for strict formatting compliance.\",\"domain_tags\":[\"Prompt Engineering\",\"Constraint Management\",\"Output Formatting\"]}", "cost_usd": 0.00333555, "bootstrap_seed": 0, "agent_model": "gemini-3.1-pro-preview", "held_out_score": null, "criterion_names": ["correct_category", "concise_output", "follows_format", "no_hallucination", "handles_ambiguity"], "per_criterion_scores": {"correct_category": 0.1, "concise_output": 1.0, "follows_format": 0.0, "no_hallucination": 0.2, "handles_ambiguity": 1.0}, "failure_classification": {"category": "output_format", "description": "The experiment aimed to prevent formatting errors and impose a strict M2M API output structure. The very low score (2.3) strongly indicates that the output failed to adhere to the intended framing, producing significant structural or formatting violations despite the application of positive terminal constraints and removal of negative constraints.", "fix_direction": "Re-evaluate the definition and implementation of the 'strict M2M API endpoint framing' and the 'positive terminal constraint'. The removal of 'negative constraints' might have inadvertently allowed too much flexibility, leading to malformed output. Future attempts should focus on making the positive constraints more robust and comprehensive, or reintroduce targeted negative constraints to precisely guide the output into the desired format.", "confidence": 0.9}, "drafts_generated": 1, "drafts_survived": 1}
{"id": "24e48f48-b4e4-4126-8b78-4279f1fe4b8b", "target_id": "B1-greedy", "git_sha": "6e9c9f3f1a3233cd35cb09734fd485f5a500187b", "pre_experiment_sha": "6e9c9f3f1a3233cd35cb09734fd485f5a500187b", "timestamp": "2026-04-23T22:52:40.504871+00:00", "hypothesis": "Adopt a strict Machine-to-Machine (M2M) API endpoint framing with a positive constraint to prevent formatting errors and enforce exact string matching.", "hypothesis_source": "agent", "mutation_diff_summary": "", "score": 2.2, "score_ci_lower": 2.0, "score_ci_upper": 2.4, "raw_scores": [2.5, 2.0, 2.5, 2.0, 2.0], "baseline_score": 2.5, "outcome": "DISCARDED", "failure_mode": null, "duration_seconds": 58.15488287503831, "tags": ["m2m", "positive-constraint", "formatting"], "learnings": "{\"what_changed\":\"\",\"what_improved\":[],\"what_regressed\":[],\"transferable_insight\":\"Framing an AI model strictly as a machine-to-machine API endpoint to enforce exact formatting constraints often degrades overall performance.\",\"domain_tags\":[\"Prompt Engineering\",\"Persona Framing\",\"Formatting Constraints\"]}", "cost_usd": 0.0034116, "bootstrap_seed": 0, "agent_model": "gemini-3.1-pro-preview", "held_out_score": null, "criterion_names": ["correct_category", "concise_output", "follows_format", "no_hallucination", "handles_ambiguity"], "per_criterion_scores": {"correct_category": 0.0, "concise_output": 1.0, "follows_format": 0.0, "no_hallucination": 0.2, "handles_ambiguity": 1.0}, "failure_classification": {"category": "output_format", "description": "The experiment aimed to prevent formatting errors and enforce exact string matching through strict M2M API framing and positive constraints. Its failure indicates that despite these measures, the API's output (or potentially input, but output is more commonly 'formatted') did not adhere to the specified structure, schema, or exact string requirements.", "fix_direction": "Strengthen schema validation for both API inputs and outputs. Enhance the implementation of positive constraints to ensure strict adherence to the defined M2M framing and exact string matching rules. Investigate the serialization/deserialization logic for any discrepancies.", "confidence": 0.95}, "drafts_generated": 1, "drafts_survived": 1}
{"id": "69894b27-7aa7-4ba7-a29d-7383e8879587", "target_id": "B1-greedy", "git_sha": "4b23d5cb88c809cafabd60c2183be57c8fcc226a", "pre_experiment_sha": "6e9c9f3f1a3233cd35cb09734fd485f5a500187b", "timestamp": "2026-04-23T22:54:26.061178+00:00", "hypothesis": "Adopt a Standardized Multiple-Choice Test framing with a strong, positive final constraint to improve accuracy and eliminate formatting errors.", "hypothesis_source": "agent", "mutation_diff_summary": "", "score": 2.9, "score_ci_lower": 2.6, "score_ci_upper": 3.2, "raw_scores": [3.0, 2.5, 3.5, 3.0, 2.5], "baseline_score": 2.5, "outcome": "KEPT", "failure_mode": null, "duration_seconds": 64.6873263749294, "tags": ["standardized-test", "positive-constraint", "expert-classifier"], "learnings": "{\"what_changed\":\"\",\"what_improved\":[],\"what_regressed\":[],\"transferable_insight\":\"Framing tasks as standardized multiple-choice tests and concluding with strong, positive constraints improves both accuracy and strict adherence to formatting requirements.\",\"domain_tags\":[\"Prompt Engineering\",\"Task Framing\",\"Formatting Constraints\"]}", "cost_usd": 0.00336135, "bootstrap_seed": 0, "agent_model": "gemini-3.1-pro-preview", "held_out_score": null, "criterion_names": ["correct_category", "concise_output", "follows_format", "no_hallucination", "handles_ambiguity"], "per_criterion_scores": {"correct_category": 0.4, "concise_output": 0.9, "follows_format": 0.1, "no_hallucination": 0.5, "handles_ambiguity": 1.0}, "failure_classification": null, "drafts_generated": 1, "drafts_survived": 1}
{"id": "f043d07d-c345-48f2-af8a-56b6ff29e2b3", "target_id": "B1-greedy", "git_sha": "4b23d5cb88c809cafabd60c2183be57c8fcc226a", "pre_experiment_sha": "4b23d5cb88c809cafabd60c2183be57c8fcc226a", "timestamp": "2026-04-23T22:56:01.072137+00:00", "hypothesis": "Refine the system prompt to emphasize careful analysis of category context to prevent semantic drift, while maintaining a strong, positive formatting constraint at the very end.", "hypothesis_source": "agent", "mutation_diff_summary": "", "score": 2.5, "score_ci_lower": 2.1, "score_ci_upper": 3.0, "raw_scores": [2.5, 2.0, 2.5, 3.5, 2.0], "baseline_score": 2.9, "outcome": "DISCARDED", "failure_mode": null, "duration_seconds": 89.09946629102342, "tags": ["formatting", "context", "positive-constraint"], "learnings": "{\"what_changed\":\"\",\"what_improved\":[],\"what_regressed\":[],\"transferable_insight\":\"Overloading instructions with both complex analytical constraints and strict formatting rules can degrade system performance rather than improving accuracy.\",\"domain_tags\":[\"Prompt Engineering\",\"Instruction Tuning\",\"Context Management\"]}", "cost_usd": 0.0036693000000000003, "bootstrap_seed": 0, "agent_model": "gemini-3.1-pro-preview", "held_out_score": null, "criterion_names": ["correct_category", "concise_output", "follows_format", "no_hallucination", "handles_ambiguity"], "per_criterion_scores": {"correct_category": 0.2, "concise_output": 1.0, "follows_format": 0.2, "no_hallucination": 0.2, "handles_ambiguity": 0.9}, "failure_classification": {"category": "semantic_drift", "description": "The experiment's explicit goal was to 'prevent semantic drift' by refining the system prompt to emphasize careful analysis of category context. Since the experiment failed (indicated by the low score and 'unknown' failure mode), it strongly suggests that the model continued to produce outputs that were correct in format but incorrect in meaning, or that the attempt to mitigate semantic drift was unsuccessful.", "fix_direction": "Further refine the system prompt with more robust or explicit instructions for contextual analysis and category selection. This could involve providing more specific examples, negative constraints, or a multi-step reasoning process to guide the model in truly understanding and applying the category context, rather than just superficial matching.", "confidence": 0.9}, "drafts_generated": 1, "drafts_survived": 1}
{"id": "c6020b43-1a40-4106-b8dd-0b9de69cfe7b", "target_id": "B1-greedy", "git_sha": "4b23d5cb88c809cafabd60c2183be57c8fcc226a", "pre_experiment_sha": "4b23d5cb88c809cafabd60c2183be57c8fcc226a", "timestamp": "2026-04-23T22:57:26.366544+00:00", "hypothesis": "Enhance the expert classifier framing by explicitly instructing the model to rely on provided definitions to prevent semantic drift, and applying the exact recommended positive constraint at the very end.", "hypothesis_source": "agent", "mutation_diff_summary": "", "score": 2.4, "score_ci_lower": 2.0, "score_ci_upper": 3.0, "raw_scores": [2.0, 2.5, 2.0, 3.5, 2.0], "baseline_score": 2.9, "outcome": "DISCARDED", "failure_mode": null, "duration_seconds": 69.6808937501628, "tags": ["expert-classifier", "positive-constraint", "standardized-test"], "learnings": "{\"what_changed\":\"\",\"what_improved\":[],\"what_regressed\":[],\"transferable_insight\":\"Explicitly instructing a model to strictly adhere to definitions to prevent semantic drift, combined with rigid end-of-prompt constraints, can degrade performance by over-constraining its natural reasoning process.\",\"domain_tags\":[\"Prompt Engineering\",\"Constraint Management\"]}", "cost_usd": 0.0036925499999999997, "bootstrap_seed": 0, "agent_model": "gemini-3.1-pro-preview", "held_out_score": null, "criterion_names": ["correct_category", "concise_output", "follows_format", "no_hallucination", "handles_ambiguity"], "per_criterion_scores": {"correct_category": 0.1, "concise_output": 1.0, "follows_format": 0.0, "no_hallucination": 0.3, "handles_ambiguity": 1.0}, "failure_classification": {"category": "semantic_drift", "description": "The experiment explicitly aimed to prevent semantic drift by instructing the model to rely on provided definitions. The very low score (2.4) indicates that this attempt failed, and the model likely still misinterpreted or misused terms, causing its output to deviate from the intended meaning despite the applied instructions and constraints.", "fix_direction": "Re-evaluate the clarity, specificity, and enforcement mechanism of the instructions and constraints designed to anchor the model to definitions. Investigate if the 'recommended positive constraint' interfered or if the model simply failed to process the definitional instructions effectively. Consider alternative or stronger anchoring techniques for definitions.", "confidence": 0.95}, "drafts_generated": 1, "drafts_survived": 1}
{"id": "2d2932f8-1761-42ae-b7be-b8b718f433e2", "target_id": "B1-greedy", "git_sha": "4b23d5cb88c809cafabd60c2183be57c8fcc226a", "pre_experiment_sha": "4b23d5cb88c809cafabd60c2183be57c8fcc226a", "timestamp": "2026-04-23T22:59:21.548939+00:00", "hypothesis": "Reframing strictly as a \"Standardized Multiple-Choice Test\" without \"Expert Text Classifier\" or \"careful analysis\" language, while retaining a strong, positive final constraint to prevent formatting and semantic drift errors.", "hypothesis_source": "agent", "mutation_diff_summary": "", "score": 2.6, "score_ci_lower": 2.3, "score_ci_upper": 2.9, "raw_scores": [2.5, 2.0, 3.0, 3.0, 2.5], "baseline_score": 2.9, "outcome": "DISCARDED", "failure_mode": null, "duration_seconds": 88.15952541609295, "tags": ["multiple-choice", "formatting", "strict-constraint"], "learnings": "{\"what_changed\":\"\",\"what_improved\":[],\"what_regressed\":[],\"transferable_insight\":\"Removing expert personas and explicit instructions for careful analysis in favor of a simplified testing format significantly degrades performance, demonstrating that analytical framing is crucial for maintaining reasoning depth.\",\"domain_tags\":[\"Prompt Engineering\",\"Persona Framing\",\"Reasoning Optimization\"]}", "cost_usd": 0.0035416, "bootstrap_seed": 0, "agent_model": "gemini-3.1-pro-preview", "held_out_score": null, "criterion_names": ["correct_category", "concise_output", "follows_format", "no_hallucination", "handles_ambiguity"], "per_criterion_scores": {"correct_category": 0.2, "concise_output": 1.0, "follows_format": 0.0, "no_hallucination": 0.4, "handles_ambiguity": 1.0}, "failure_classification": {"category": "semantic_drift", "description": "The experiment aimed to simplify the prompt by removing nuanced guidance ('Expert Text Classifier', 'careful analysis') and reframing it as a 'Standardized Multiple-Choice Test'. While a strong constraint was retained to prevent both formatting and semantic drift errors, the low score (2.6000) indicates that the simplification likely led to a loss of contextual understanding or reasoning ability, resulting in outputs that, even if structurally correct, were incorrect in meaning or classification. The constraint was insufficient to prevent this degradation in semantic accuracy.", "fix_direction": "Re-evaluate the level of guidance required for the task. If simplifying the prompt leads to a loss of meaning, consider reintroducing elements that encourage deeper reasoning or provide clearer criteria for classification, potentially through refined examples or more explicit definitions, rather than relying solely on a simple multiple-choice format and a general final constraint. Focus on how to guide the model towards the *correct meaning* for complex classifications, even if the output format is streamlined.", "confidence": 0.9}, "drafts_generated": 1, "drafts_survived": 1}
{"id": "3428fb06-ce5f-4854-9a46-f9f480e70feb", "target_id": "B1-greedy", "git_sha": "4b23d5cb88c809cafabd60c2183be57c8fcc226a", "pre_experiment_sha": "4b23d5cb88c809cafabd60c2183be57c8fcc226a", "timestamp": "2026-04-23T23:00:55.628031+00:00", "hypothesis": "Remove the \"expert text classifier\" persona and \"careful analysis\" instructions to strictly follow the \"Standardized Multiple-Choice Test\" framing and eliminate semantic drift.", "hypothesis_source": "agent", "mutation_diff_summary": "", "score": 2.3, "score_ci_lower": 2.0, "score_ci_upper": 2.7, "raw_scores": [2.5, 2.0, 2.0, 3.0, 2.0], "baseline_score": 2.9, "outcome": "DISCARDED", "failure_mode": null, "duration_seconds": 72.4514874999877, "tags": ["multiple-choice", "strict-formatting", "positive-constraint"], "learnings": "{\"what_changed\":\"\",\"what_improved\":[],\"what_regressed\":[],\"transferable_insight\":\"Removing expert personas and explicit analytical instructions in favor of a rigid, simplified framing degrades performance, demonstrating that models rely on cognitive scaffolding to maintain accuracy.\",\"domain_tags\":[\"Prompt Engineering\",\"Persona Prompting\",\"Cognitive Scaffolding\"]}", "cost_usd": 0.00325995, "bootstrap_seed": 0, "agent_model": "gemini-3.1-pro-preview", "held_out_score": null, "criterion_names": ["correct_category", "concise_output", "follows_format", "no_hallucination", "handles_ambiguity"], "per_criterion_scores": {"correct_category": 0.0, "concise_output": 1.0, "follows_format": 0.0, "no_hallucination": 0.3, "handles_ambiguity": 1.0}, "failure_classification": {"category": "semantic_drift", "description": "The experiment aimed to eliminate semantic drift by removing an 'expert text classifier' persona and 'careful analysis' instructions, opting for a 'Standardized Multiple-Choice Test' framing. The very low score (2.3000) strongly indicates that this simplification either failed to eliminate semantic drift or, more likely, introduced new forms of misunderstanding by stripping away critical context or guidance the model previously relied upon for accurate classification. The model misinterpreted the task's true requirements under the new, simplified instructions.", "fix_direction": "Re-evaluate what critical information was conveyed by the 'expert text classifier' persona and 'careful analysis' instructions. Instead of a direct reintroduction, find ways to explicitly embed that necessary task context, logical steps, or reasoning guidance directly within the 'Standardized Multiple-Choice Test' framing using clearer, more specific instructions or few-shot examples, rather than relying on an implicit persona or broad analysis instructions. The goal is to provide sufficient clarity without ambiguity.", "confidence": 0.9}, "drafts_generated": 1, "drafts_survived": 1}
{"id": "2b06c49d-010a-45c1-ad59-f5432ffc18f7", "target_id": "B1-greedy", "git_sha": "4b23d5cb88c809cafabd60c2183be57c8fcc226a", "pre_experiment_sha": "4b23d5cb88c809cafabd60c2183be57c8fcc226a", "timestamp": "2026-04-23T23:02:24.966429+00:00", "hypothesis": "Removing the \"expert\" persona and \"careful analysis\" instructions while strictly applying the \"standardized multiple-choice test\" framing with structural `<text>` tags will reduce semantic drift and formatting errors.", "hypothesis_source": "agent", "mutation_diff_summary": "", "score": 2.6, "score_ci_lower": 2.5, "score_ci_upper": 2.8, "raw_scores": [2.5, 3.0, 2.5, 2.5, 2.5], "baseline_score": 2.9, "outcome": "DISCARDED", "failure_mode": null, "duration_seconds": 73.30574208404869, "tags": ["framing", "positive-constraint", "formatting"], "learnings": "{\"what_changed\":\"\",\"what_improved\":[],\"what_regressed\":[],\"transferable_insight\":\"Replacing explicit cognitive instructions and persona framing with purely structural constraints degrades performance, demonstrating that formatting rules cannot substitute for explicit reasoning directives.\",\"domain_tags\":[\"Prompt Engineering\",\"Instruction Design\",\"Persona Framing\"]}", "cost_usd": 0.0034342000000000005, "bootstrap_seed": 0, "agent_model": "gemini-3.1-pro-preview", "held_out_score": null, "criterion_names": ["correct_category", "concise_output", "follows_format", "no_hallucination", "handles_ambiguity"], "per_criterion_scores": {"correct_category": 0.0, "concise_output": 1.0, "follows_format": 0.1, "no_hallucination": 0.5, "handles_ambiguity": 1.0}, "failure_classification": {"category": "semantic_drift", "description": "The experiment's hypothesis focused on reducing semantic drift by removing 'expert persona' and 'careful analysis' instructions while enforcing structural tags. A low score (2.6) indicates failure. It's highly probable that by removing the instructions encouraging careful analysis and an expert perspective, the model lost crucial guidance for generating contextually accurate and meaningful content. While structural tags might have helped with format, the core meaning of the output likely suffered, resulting in 'correct format but wrong meaning'.", "fix_direction": "Future attempts should explore reintroducing concise guidance for semantic accuracy and contextual understanding, potentially through more specific constraints or examples, rather than relying solely on structural framing. The 'expert persona' and 'careful analysis' instructions, while perhaps verbose, likely provided essential semantic guardrails. A balanced approach is needed, combining structural integrity with sufficient semantic steering.", "confidence": 0.9}, "drafts_generated": 1, "drafts_survived": 1}
