{"id": "1652b799-ca5b-426d-a6d1-c1b7bea71c46", "target_id": "B1-greedy", "git_sha": "4b23d5cb88c809cafabd60c2183be57c8fcc226a", "pre_experiment_sha": "4b23d5cb88c809cafabd60c2183be57c8fcc226a", "timestamp": "2026-04-23T23:18:00.503753+00:00", "hypothesis": "Reframing as a \"Precise Text Classification Task\" with explicit analysis instructions, a strictly formatted 1-shot example, and a single positive constraint at the end will improve classification accuracy and eliminate format drift.", "hypothesis_source": "agent", "mutation_diff_summary": "", "score": 2.3, "score_ci_lower": 2.0, "score_ci_upper": 2.7, "raw_scores": [2.5, 3.0, 2.0, 2.0, 2.0], "baseline_score": 2.9, "outcome": "DISCARDED", "failure_mode": null, "duration_seconds": 86.61597137502395, "tags": ["prompt-engineering", "persona-shift", "few-shot", "formatting-constraint"], "learnings": "{\"what_changed\":\"\",\"what_improved\":[],\"what_regressed\":[],\"transferable_insight\":\"Highly rigid prompt structures that combine explicit analysis steps with strict formatting constraints can degrade performance by over-constraining the model.\",\"domain_tags\":[\"Prompt Engineering\",\"Constraint Management\",\"Few-Shot Prompting\"]}", "cost_usd": 0.0042735, "bootstrap_seed": 0, "agent_model": "gemini-3.1-pro-preview", "held_out_score": null, "criterion_names": ["correct_category", "concise_output", "follows_format", "no_hallucination", "handles_ambiguity"], "per_criterion_scores": {"correct_category": 0.2, "concise_output": 1.0, "follows_format": 0.0, "no_hallucination": 0.1, "handles_ambiguity": 1.0}, "failure_classification": {"category": "output_format", "description": "The hypothesis specifically aimed to \"eliminate format drift\" through strict prompt engineering techniques (explicit analysis instructions, strictly formatted 1-shot example, single positive constraint). The failure of the experiment, indicated by a low score of 2.3000, suggests that these techniques were insufficient, and the model's output likely continued to violate the desired output structure or schema. While classification accuracy was also a goal (related to `semantic_drift`), persistent format issues often prevent proper evaluation of semantic content and are a foundational failure when format elimination is a stated objective.", "fix_direction": "Strengthen the output format instructions and constraints. This could involve more detailed schema definitions, multiple 1-shot examples demonstrating both correct and common incorrect formatting, using XML/JSON schema definitions within the prompt, or employing a two-pass generation approach where the model first generates the content and then explicitly re-formats it. Consider adding specific negative constraints regarding common format violations.", "confidence": 0.85}, "drafts_generated": 1, "drafts_survived": 1}
{"id": "00a15c5d-4506-41e3-a059-8a6a21164714", "target_id": "B1-greedy", "git_sha": "4b23d5cb88c809cafabd60c2183be57c8fcc226a", "pre_experiment_sha": "4b23d5cb88c809cafabd60c2183be57c8fcc226a", "timestamp": "2026-04-23T23:19:43.183413+00:00", "hypothesis": "Simplify the prompt to a direct, objective task description without personas or meta-instructions, relying on a single strict formatting constraint at the end.", "hypothesis_source": "agent", "mutation_diff_summary": "", "score": 2.3, "score_ci_lower": 2.1, "score_ci_upper": 2.5, "raw_scores": [2.0, 2.5, 2.5, 2.5, 2.0], "baseline_score": 2.9, "outcome": "DISCARDED", "failure_mode": null, "duration_seconds": 53.91577870910987, "tags": ["direct-instruction", "zero-shot", "positive-constraint"], "learnings": "{\"what_changed\":\"\",\"what_improved\":[],\"what_regressed\":[],\"transferable_insight\":\"Stripping instructions of contextual framing and role-based guidance in favor of overly simplified, bare-bones directives significantly degrades performance.\",\"domain_tags\":[\"Prompt Engineering\",\"Instruction Design\",\"Context Optimization\"]}", "cost_usd": 0.0029338, "bootstrap_seed": 0, "agent_model": "gemini-3.1-pro-preview", "held_out_score": null, "criterion_names": ["correct_category", "concise_output", "follows_format", "no_hallucination", "handles_ambiguity"], "per_criterion_scores": {"correct_category": 0.0, "concise_output": 1.0, "follows_format": 0.1, "no_hallucination": 0.2, "handles_ambiguity": 1.0}, "failure_classification": {"category": "output_format", "description": "The experiment aimed to simplify the prompt by removing personas and meta-instructions, while still relying on a strict formatting constraint. The low score (2.3) strongly suggests that this simplification removed critical contextual cues or emphasis necessary for the model to correctly interpret and adhere to the specified 'single strict formatting constraint'. The model likely failed to produce output in the required structure, indicating that the 'strict formatting constraint' was either ignored or misunderstood due to the overly simplified prompt.", "fix_direction": "Reintroduce minimal, targeted meta-instructions or emphasis specifically related to the 'strict formatting constraint'. The goal should be to ensure the formatting requirement is clearly understood and prioritized by the model, even within a simplified prompt structure, without reverting to verbose or complex prompts. Experiment with stronger keywords, distinct placement, or a brief reinforcing statement for the constraint.", "confidence": 0.9}, "drafts_generated": 1, "drafts_survived": 1}
{"id": "f72ff0ea-2a41-4bc7-9506-ddc5d29ce390", "target_id": "B1-greedy", "git_sha": "4b23d5cb88c809cafabd60c2183be57c8fcc226a", "pre_experiment_sha": "4b23d5cb88c809cafabd60c2183be57c8fcc226a", "timestamp": "2026-04-23T23:20:55.716774+00:00", "hypothesis": "Remove personas, multiple-choice analogies, and meta-instructions to provide a direct, neutral classification task with a single strong formatting constraint.", "hypothesis_source": "agent", "mutation_diff_summary": "", "score": 2.2, "score_ci_lower": 2.0, "score_ci_upper": 2.4, "raw_scores": [2.5, 2.0, 2.5, 2.0, 2.0], "baseline_score": 2.9, "outcome": "DISCARDED", "failure_mode": null, "duration_seconds": 59.17994458298199, "tags": ["direct-instruction", "formatting-constraint", "zero-shot"], "learnings": "{\"what_changed\":\"\",\"what_improved\":[],\"what_regressed\":[],\"transferable_insight\":\"Stripping away contextual framing, such as personas and analogies, in favor of a strictly neutral and direct prompt can significantly degrade performance by removing the structural guidance models rely on for complex tasks.\",\"domain_tags\":[\"Prompt Engineering\",\"Contextual Framing\",\"Instruction Design\"]}", "cost_usd": 0.00291405, "bootstrap_seed": 0, "agent_model": "gemini-3.1-pro-preview", "held_out_score": null, "criterion_names": ["correct_category", "concise_output", "follows_format", "no_hallucination", "handles_ambiguity"], "per_criterion_scores": {"correct_category": 0.2, "concise_output": 1.0, "follows_format": 0.0, "no_hallucination": 0.0, "handles_ambiguity": 1.0}, "failure_classification": {"category": "semantic_drift", "description": "The experiment's hypothesis focused on removing elements (personas, analogies, meta-instructions) that typically provide crucial semantic context and guidance. The extremely low score (2.2000) indicates that without these elements, the model failed to correctly understand the meaning or intent of the direct classification task, leading to consistently incorrect classifications despite potentially adhering to the formatting constraint. The 'neutral' approach stripped too much necessary information.", "fix_direction": "Instead of complete removal, identify the minimal set of contextual elements or explicit instructions required for the model to accurately grasp the semantic meaning of the classification task. This could involve highly concise category definitions, illustrative examples, or carefully structured input prompts that implicitly convey context without 'meta-instructions' or 'personas'.", "confidence": 0.9}, "drafts_generated": 1, "drafts_survived": 1}
{"id": "1651ed1b-ef85-4ae6-bdd0-cbad59a7fe37", "target_id": "B1-greedy", "git_sha": "4b23d5cb88c809cafabd60c2183be57c8fcc226a", "pre_experiment_sha": "4b23d5cb88c809cafabd60c2183be57c8fcc226a", "timestamp": "2026-04-23T23:22:14.242027+00:00", "hypothesis": "Remove personas, analogies, and meta-instructions, using a direct and objective classification task description with a single strong formatting constraint at the end.", "hypothesis_source": "agent", "mutation_diff_summary": "", "score": 2.2, "score_ci_lower": 2.0, "score_ci_upper": 2.4, "raw_scores": [2.5, 2.0, 2.0, 2.0, 2.5], "baseline_score": 2.9, "outcome": "DISCARDED", "failure_mode": null, "duration_seconds": 65.06320299999788, "tags": ["direct", "zero-shot", "objective"], "learnings": "{\"what_changed\":\"\",\"what_improved\":[],\"what_regressed\":[],\"transferable_insight\":\"Stripping prompts of contextual framing elements like personas and analogies in favor of purely objective descriptions can significantly degrade performance, highlighting their value in guiding model behavior.\",\"domain_tags\":[\"Prompt Engineering\",\"Contextual Framing\",\"Instruction Design\"]}", "cost_usd": 0.0028764000000000007, "bootstrap_seed": 0, "agent_model": "gemini-3.1-pro-preview", "held_out_score": null, "criterion_names": ["correct_category", "concise_output", "follows_format", "no_hallucination", "handles_ambiguity"], "per_criterion_scores": {"correct_category": 0.1, "concise_output": 1.0, "follows_format": 0.0, "no_hallucination": 0.1, "handles_ambiguity": 1.0}, "failure_classification": {"category": "semantic_drift", "description": "Removing personas, analogies, and meta-instructions likely stripped away critical contextual information and guidance, causing the model to misinterpret the core objective or specific criteria of the classification task. While the output might have adhered to the single formatting constraint, the actual classifications generated were consistently incorrect, indicating a significant divergence from the intended meaning of the task.", "fix_direction": "Reintroduce essential contextual elements or clear examples that directly clarify the *meaning* and *criteria* for the classification. Focus on ensuring the model robustly understands *what* it is classifying and *why*, rather than just the mechanics of the task. Experiment with concise, impactful instructions that provide sufficient context without being overly verbose.", "confidence": 0.95}, "drafts_generated": 1, "drafts_survived": 1}
{"id": "a4b3513e-8c27-43e1-a855-dfe2c8a23735", "target_id": "B1-greedy", "git_sha": "4b23d5cb88c809cafabd60c2183be57c8fcc226a", "pre_experiment_sha": "4b23d5cb88c809cafabd60c2183be57c8fcc226a", "timestamp": "2026-04-23T23:24:20.383884+00:00", "hypothesis": "Replaced the multiple-choice analogy and expert persona with explicit negative formatting constraints, instructions to focus on primary intent to reduce semantic drift, and a trailing output indicator.", "hypothesis_source": "agent", "mutation_diff_summary": "", "score": 2.6, "score_ci_lower": 2.5, "score_ci_upper": 2.8, "raw_scores": [2.5, 3.0, 2.5, 2.5, 2.5], "baseline_score": 2.9, "outcome": "DISCARDED", "failure_mode": null, "duration_seconds": 81.8280383751262, "tags": ["prompt-engineering", "negative-constraints", "trailing-indicator", "semantic-drift-mitigation"], "learnings": "{\"what_changed\":\"\",\"what_improved\":[],\"what_regressed\":[],\"transferable_insight\":\"Replacing positive framing techniques, such as expert personas and analogies, with explicit negative constraints and rigid structural rules can degrade model performance.\",\"domain_tags\":[\"Prompt Engineering\",\"Negative Constraints\",\"Persona Prompting\"]}", "cost_usd": 0.0033315000000000003, "bootstrap_seed": 0, "agent_model": "gemini-3.1-pro-preview", "held_out_score": null, "criterion_names": ["correct_category", "concise_output", "follows_format", "no_hallucination", "handles_ambiguity"], "per_criterion_scores": {"correct_category": 0.2, "concise_output": 1.0, "follows_format": 0.0, "no_hallucination": 0.4, "handles_ambiguity": 1.0}, "failure_classification": {"category": "semantic_drift", "description": "The experiment introduced instructions specifically to reduce semantic drift and focus on primary intent. The very low score (2.6) strongly indicates that these new instructions were ineffective, or even counterproductive, leading the model's output to deviate significantly from the intended meaning or content, despite potentially adhering to some formatting elements. The removal of the multiple-choice analogy and expert persona likely exacerbated this by removing previously effective guidance.", "fix_direction": "Re-evaluate the necessity and effectiveness of the removed components (analogy, expert persona) in preventing semantic drift. Refine the 'instructions to focus on primary intent' to be clearer and more robust. Test the 'explicit negative formatting constraints' in isolation to ensure they do not inadvertently confuse the model or conflict with semantic accuracy. Consider a balanced approach of both positive and negative constraints.", "confidence": 0.9}, "drafts_generated": 1, "drafts_survived": 1}
{"id": "2eff61fe-b46f-4c46-b1e0-5b0efca9082f", "target_id": "B1-greedy", "git_sha": "4b23d5cb88c809cafabd60c2183be57c8fcc226a", "pre_experiment_sha": "4b23d5cb88c809cafabd60c2183be57c8fcc226a", "timestamp": "2026-04-23T23:25:52.013145+00:00", "hypothesis": "Implement strict negative constraints, explicit focus on primary intent, and a trailing indicator while removing personas and reasoning instructions to prevent formatting errors and semantic drift.", "hypothesis_source": "agent", "mutation_diff_summary": "", "score": 2.4, "score_ci_lower": 2.2, "score_ci_upper": 2.5, "raw_scores": [2.0, 2.5, 2.5, 2.5, 2.5], "baseline_score": 2.9, "outcome": "DISCARDED", "failure_mode": null, "duration_seconds": 75.37967779207975, "tags": ["b1-greedy", "classification", "constraints", "formatting"], "learnings": "{\"what_changed\":\"\",\"what_improved\":[],\"what_regressed\":[],\"transferable_insight\":\"Removing reasoning instructions and role-playing elements in favor of strict negative constraints degrades performance by depriving the system of necessary processing scaffolding.\",\"domain_tags\":[\"Prompt Engineering\",\"Constraint Management\",\"LLM Behavior\"]}", "cost_usd": 0.0031773000000000005, "bootstrap_seed": 0, "agent_model": "gemini-3.1-pro-preview", "held_out_score": null, "criterion_names": ["correct_category", "concise_output", "follows_format", "no_hallucination", "handles_ambiguity"], "per_criterion_scores": {"correct_category": 0.0, "concise_output": 1.0, "follows_format": 0.0, "no_hallucination": 0.4, "handles_ambiguity": 1.0}, "failure_classification": {"category": "semantic_drift", "description": "The experiment aimed to prevent semantic drift by removing personas and reasoning instructions, but this likely stripped the model of necessary context or guidance. Despite strict constraints and focus on primary intent, the model produced outputs that were superficially correct in format but failed to grasp the true meaning or intent of the task, leading to a very low score. The absence of 'how to think' instructions likely led to misinterpretation of the task's core meaning.", "fix_direction": "Reintroduce concise contextual guidance or minimal reasoning instructions. Focus on providing just enough context for the model to understand the nuance of the primary intent without introducing 'noise'. Alternatively, refine the 'explicit focus on primary intent' to be more robust and unambiguous in the absence of broader context, possibly by leveraging more specific few-shot examples.", "confidence": 0.9}, "drafts_generated": 1, "drafts_survived": 1}
{"id": "fd76a3d6-6312-4a80-90bd-ec3a07296c39", "target_id": "B1-greedy", "git_sha": "4b23d5cb88c809cafabd60c2183be57c8fcc226a", "pre_experiment_sha": "4b23d5cb88c809cafabd60c2183be57c8fcc226a", "timestamp": "2026-04-23T23:27:31.626631+00:00", "hypothesis": "Replacing the multiple-choice test analogy with explicit negative constraints, a focus on primary intent, and a trailing indicator to prevent formatting errors and semantic drift.", "hypothesis_source": "agent", "mutation_diff_summary": "", "score": 2.6, "score_ci_lower": 2.3, "score_ci_upper": 2.9, "raw_scores": [2.0, 2.5, 3.0, 3.0, 2.5], "baseline_score": 2.9, "outcome": "DISCARDED", "failure_mode": null, "duration_seconds": 71.88634554110467, "tags": ["formatting", "negative-constraints", "trailing-indicator"], "learnings": "{\"what_changed\":\"\",\"what_improved\":[],\"what_regressed\":[],\"transferable_insight\":\"Substituting a relatable, holistic analogy with a complex set of explicit constraints and structural rules can degrade performance by overcomplicating the task framework.\",\"domain_tags\":[\"Prompt Engineering\",\"Instruction Design\",\"Constraint Management\"]}", "cost_usd": 0.0031754500000000002, "bootstrap_seed": 0, "agent_model": "gemini-3.1-pro-preview", "held_out_score": null, "criterion_names": ["correct_category", "concise_output", "follows_format", "no_hallucination", "handles_ambiguity"], "per_criterion_scores": {"correct_category": 0.3, "concise_output": 1.0, "follows_format": 0.0, "no_hallucination": 0.3, "handles_ambiguity": 1.0}, "failure_classification": {"category": "semantic_drift", "description": "The experiment aimed to prevent semantic drift through new methods (explicit negative constraints, primary intent focus, trailing indicator) but failed. This suggests the proposed mechanisms either did not effectively mitigate semantic drift or inadvertently introduced new ways for the output's meaning to become incorrect, ambiguous, or misaligned with the primary intent, resulting in a low score.", "fix_direction": "Refine the explicit negative constraints and the 'focus on primary intent' mechanisms to be more robust and unambiguous. This could involve more rigorous testing against edge cases where semantic drift is likely, improving clarity in constraint definitions, and enhancing the model's ability to consistently interpret and adhere to the 'primary intent' under varied conditions.", "confidence": 0.9}, "drafts_generated": 1, "drafts_survived": 1}
{"id": "62660ab1-f9ac-4333-96e3-ee37e35b543a", "target_id": "B1-greedy", "git_sha": "4b23d5cb88c809cafabd60c2183be57c8fcc226a", "pre_experiment_sha": "4b23d5cb88c809cafabd60c2183be57c8fcc226a", "timestamp": "2026-04-23T23:29:24.870434+00:00", "hypothesis": "Adopting a highly structured format with strict positive and negative constraints, removing abstract instructions and personas, and providing strictly formatted few-shot examples will improve category boundary recognition and eliminate semantic drift.", "hypothesis_source": "agent", "mutation_diff_summary": "", "score": 2.4, "score_ci_lower": 2.2, "score_ci_upper": 2.5, "raw_scores": [2.5, 2.5, 2.0, 2.5, 2.5], "baseline_score": 2.9, "outcome": "DISCARDED", "failure_mode": null, "duration_seconds": 71.889530666871, "tags": ["structural", "few-shot", "negative-constraints"], "learnings": "{\"what_changed\":\"\",\"what_improved\":[],\"what_regressed\":[],\"transferable_insight\":\"Replacing abstract contextual instructions and personas with overly rigid constraints degrades performance, indicating that AI models rely on broad contextual cues for accurate semantic categorization.\",\"domain_tags\":[\"Prompt Engineering\",\"Context Management\",\"Semantic Categorization\"]}", "cost_usd": 0.0038342000000000007, "bootstrap_seed": 0, "agent_model": "gemini-3.1-pro-preview", "held_out_score": null, "criterion_names": ["correct_category", "concise_output", "follows_format", "no_hallucination", "handles_ambiguity"], "per_criterion_scores": {"correct_category": 0.2, "concise_output": 1.0, "follows_format": 0.0, "no_hallucination": 0.2, "handles_ambiguity": 1.0}, "failure_classification": {"category": "semantic_drift", "description": "The experiment aimed to eliminate semantic drift and improve category boundary recognition by implementing a highly structured format and strict constraints. The low score of 2.4000 indicates that despite these efforts, the model failed to correctly interpret meanings or recognize category boundaries, suggesting that the output might have adhered to the specified format but conveyed incorrect or shifted meaning.", "fix_direction": "Refine the strict positive and negative constraints, or the content of the few-shot examples, to more explicitly encode the desired semantic distinctions and prevent misinterpretations, even within the defined structure. Consider adding explicit semantic rules or examples targeting specific edge cases where drift was observed.", "confidence": 0.95}, "drafts_generated": 1, "drafts_survived": 1}
