{"id": "9b704830-031e-46fd-b580-22a5bca50051", "target_id": "B1-treatment", "git_sha": "f997bfcd1d97f712b82da9c9990e8887bf86b994", "pre_experiment_sha": "00eba67563b4214a22eceffa6bb1d11e10d7f036", "timestamp": "2026-04-05T22:27:23.221293+00:00", "hypothesis": "No hypothesis provided", "hypothesis_source": "synthesized", "mutation_diff_summary": "", "score": 3.5, "score_ci_lower": 2.9, "score_ci_upper": 4.0, "raw_scores": [4.0, 4.0, 3.0, 2.5, 4.0], "baseline_score": 3.6, "outcome": "KEPT", "failure_mode": null, "duration_seconds": 51.94959179102443, "tags": [], "learnings": "{\"what_changed\":\"\",\"what_improved\":[],\"what_regressed\":[],\"transferable_insight\":\"No hypothesis provided\",\"domain_tags\":[]}", "cost_usd": 0.14028179999999998, "bootstrap_seed": 0, "agent_model": "claude-sonnet-4-6", "held_out_score": null, "criterion_names": ["correct_category", "concise_output", "follows_format", "no_hallucination", "handles_ambiguity"], "per_criterion_scores": {"correct_category": 1.0, "concise_output": 1.0, "follows_format": 0.0, "no_hallucination": 0.8, "handles_ambiguity": 0.7}, "failure_classification": null, "drafts_generated": 1, "drafts_survived": 1}
{"id": "df4a11c9-3aa9-4193-b100-29d95431eff2", "target_id": "B1-treatment", "git_sha": "9f341ad4cce1e427f26899779f586d97da731ef0", "pre_experiment_sha": "f997bfcd1d97f712b82da9c9990e8887bf86b994", "timestamp": "2026-04-05T22:29:11.108684+00:00", "hypothesis": "No hypothesis provided", "hypothesis_source": "synthesized", "mutation_diff_summary": "", "score": 3.3, "score_ci_lower": 3.0, "score_ci_upper": 3.7, "raw_scores": [3.0, 4.0, 3.0, 3.0, 3.5], "baseline_score": 3.5, "outcome": "KEPT", "failure_mode": null, "duration_seconds": 107.49885970796458, "tags": [], "learnings": "{\"what_changed\":\"\",\"what_improved\":[],\"what_regressed\":[],\"transferable_insight\":\"No hypothesis provided\",\"domain_tags\":[]}", "cost_usd": 0.20256780000000002, "bootstrap_seed": 0, "agent_model": "claude-sonnet-4-6", "held_out_score": null, "criterion_names": ["correct_category", "concise_output", "follows_format", "no_hallucination", "handles_ambiguity"], "per_criterion_scores": {"correct_category": 1.0, "concise_output": 1.0, "follows_format": 0.0, "no_hallucination": 0.5, "handles_ambiguity": 0.8}, "failure_classification": null, "drafts_generated": 1, "drafts_survived": 1}
{"id": "65a86167-d282-4be5-afaa-ed9cbc9fe554", "target_id": "B1-treatment", "git_sha": "74b97ac9030c685de1f24e10c0d6f340f544b1b4", "pre_experiment_sha": "9f341ad4cce1e427f26899779f586d97da731ef0", "timestamp": "2026-04-05T22:30:55.007837+00:00", "hypothesis": "No hypothesis provided", "hypothesis_source": "synthesized", "mutation_diff_summary": "", "score": 3.5, "score_ci_lower": 3.1, "score_ci_upper": 3.9, "raw_scores": [3.5, 4.0, 3.0, 3.0, 4.0], "baseline_score": 3.3, "outcome": "KEPT", "failure_mode": null, "duration_seconds": 103.37541733379476, "tags": [], "learnings": "{\"what_changed\":\"\",\"what_improved\":[],\"what_regressed\":[],\"transferable_insight\":\"No hypothesis provided\",\"domain_tags\":[]}", "cost_usd": 0.22140795, "bootstrap_seed": 0, "agent_model": "claude-sonnet-4-6", "held_out_score": null, "criterion_names": ["correct_category", "concise_output", "follows_format", "no_hallucination", "handles_ambiguity"], "per_criterion_scores": {"correct_category": 1.0, "concise_output": 1.0, "follows_format": 0.0, "no_hallucination": 0.7, "handles_ambiguity": 0.8}, "failure_classification": null, "drafts_generated": 1, "drafts_survived": 1}
{"id": "ec36dd10-5ddd-404f-862f-aab9ded11ea5", "target_id": "B1-treatment", "git_sha": "61475fa95885f4099076edeac6b3a868387c0d38", "pre_experiment_sha": "74b97ac9030c685de1f24e10c0d6f340f544b1b4", "timestamp": "2026-04-05T22:32:50.756233+00:00", "hypothesis": "No hypothesis provided", "hypothesis_source": "synthesized", "mutation_diff_summary": "", "score": 3.6, "score_ci_lower": 3.2, "score_ci_upper": 4.0, "raw_scores": [4.0, 4.0, 3.0, 3.0, 4.0], "baseline_score": 3.5, "outcome": "KEPT", "failure_mode": null, "duration_seconds": 115.30556141608395, "tags": [], "learnings": "{\"what_changed\":\"\",\"what_improved\":[],\"what_regressed\":[],\"transferable_insight\":\"No hypothesis provided\",\"domain_tags\":[]}", "cost_usd": 0.23847944999999998, "bootstrap_seed": 0, "agent_model": "claude-sonnet-4-6", "held_out_score": null, "criterion_names": ["correct_category", "concise_output", "follows_format", "no_hallucination", "handles_ambiguity"], "per_criterion_scores": {"correct_category": 1.0, "concise_output": 1.0, "follows_format": 0.0, "no_hallucination": 0.8, "handles_ambiguity": 0.8}, "failure_classification": null, "drafts_generated": 1, "drafts_survived": 1}
{"id": "b0afba50-2af7-4f9b-9304-ea1a0eb1b635", "target_id": "B1-treatment", "git_sha": "490b7a899de53c0ced5210a5f1c4501a75c74ac2", "pre_experiment_sha": "61475fa95885f4099076edeac6b3a868387c0d38", "timestamp": "2026-04-05T22:35:52.224410+00:00", "hypothesis": "No hypothesis provided", "hypothesis_source": "synthesized", "mutation_diff_summary": "", "score": 3.5, "score_ci_lower": 3.1, "score_ci_upper": 3.9, "raw_scores": [3.5, 4.0, 3.0, 3.0, 4.0], "baseline_score": 3.6, "outcome": "KEPT", "failure_mode": null, "duration_seconds": 181.06814250000753, "tags": [], "learnings": "{\"what_changed\":\"\",\"what_improved\":[],\"what_regressed\":[],\"transferable_insight\":\"No hypothesis provided\",\"domain_tags\":[]}", "cost_usd": 0.27626235, "bootstrap_seed": 0, "agent_model": "claude-sonnet-4-6", "held_out_score": null, "criterion_names": ["correct_category", "concise_output", "follows_format", "no_hallucination", "handles_ambiguity"], "per_criterion_scores": {"correct_category": 1.0, "concise_output": 1.0, "follows_format": 0.0, "no_hallucination": 0.8, "handles_ambiguity": 0.7}, "failure_classification": null, "drafts_generated": 1, "drafts_survived": 1}
{"id": "0f271502-50c5-49a1-8f59-8fa625f3779b", "target_id": "B1-treatment", "git_sha": "1a319fb6b1802db73b2a74472cf52042106ecc58", "pre_experiment_sha": "490b7a899de53c0ced5210a5f1c4501a75c74ac2", "timestamp": "2026-04-05T22:38:19.480648+00:00", "hypothesis": "No hypothesis provided", "hypothesis_source": "synthesized", "mutation_diff_summary": "", "score": 3.6, "score_ci_lower": 3.3, "score_ci_upper": 3.9, "raw_scores": [4.0, 4.0, 3.0, 3.5, 3.5], "baseline_score": 3.5, "outcome": "KEPT", "failure_mode": null, "duration_seconds": 146.8946922090836, "tags": [], "learnings": "{\"what_changed\":\"\",\"what_improved\":[],\"what_regressed\":[],\"transferable_insight\":\"No hypothesis provided\",\"domain_tags\":[]}", "cost_usd": 0.3129951, "bootstrap_seed": 0, "agent_model": "claude-sonnet-4-6", "held_out_score": null, "criterion_names": ["correct_category", "concise_output", "follows_format", "no_hallucination", "handles_ambiguity"], "per_criterion_scores": {"correct_category": 1.0, "concise_output": 1.0, "follows_format": 0.0, "no_hallucination": 0.9, "handles_ambiguity": 0.7}, "failure_classification": null, "drafts_generated": 1, "drafts_survived": 1}
{"id": "88b18319-e49c-4124-8202-314529ce569c", "target_id": "B1-treatment", "git_sha": "15fc78d4adc4d20e4f4b18a4747b0963211876d7", "pre_experiment_sha": "1a319fb6b1802db73b2a74472cf52042106ecc58", "timestamp": "2026-04-05T22:41:11.397185+00:00", "hypothesis": "No hypothesis provided", "hypothesis_source": "synthesized", "mutation_diff_summary": "", "score": 3.6, "score_ci_lower": 3.3, "score_ci_upper": 3.9, "raw_scores": [4.0, 4.0, 3.0, 3.5, 3.5], "baseline_score": 3.6, "outcome": "KEPT", "failure_mode": null, "duration_seconds": 171.48439366696402, "tags": [], "learnings": "{\"what_changed\":\"\",\"what_improved\":[],\"what_regressed\":[],\"transferable_insight\":\"No hypothesis provided\",\"domain_tags\":[]}", "cost_usd": 0.28815375, "bootstrap_seed": 0, "agent_model": "claude-sonnet-4-6", "held_out_score": null, "criterion_names": ["correct_category", "concise_output", "follows_format", "no_hallucination", "handles_ambiguity"], "per_criterion_scores": {"correct_category": 1.0, "concise_output": 1.0, "follows_format": 0.0, "no_hallucination": 0.8, "handles_ambiguity": 0.8}, "failure_classification": null, "drafts_generated": 1, "drafts_survived": 1}
{"id": "574ef78d-1667-4d65-805b-00e87c513b38", "target_id": "B1-treatment", "git_sha": "2b99072af900416a903c3a60e1928b176a54148e", "pre_experiment_sha": "15fc78d4adc4d20e4f4b18a4747b0963211876d7", "timestamp": "2026-04-05T22:44:19.597437+00:00", "hypothesis": "No hypothesis provided", "hypothesis_source": "synthesized", "mutation_diff_summary": "", "score": 3.5, "score_ci_lower": 3.1, "score_ci_upper": 3.9, "raw_scores": [3.5, 4.0, 3.0, 3.0, 4.0], "baseline_score": 3.6, "outcome": "KEPT", "failure_mode": null, "duration_seconds": 187.803878583014, "tags": [], "learnings": "{\"what_changed\":\"\",\"what_improved\":[],\"what_regressed\":[],\"transferable_insight\":\"No hypothesis provided\",\"domain_tags\":[]}", "cost_usd": 0.35104755, "bootstrap_seed": 0, "agent_model": "claude-sonnet-4-6", "held_out_score": null, "criterion_names": ["correct_category", "concise_output", "follows_format", "no_hallucination", "handles_ambiguity"], "per_criterion_scores": {"correct_category": 1.0, "concise_output": 1.0, "follows_format": 0.0, "no_hallucination": 0.7, "handles_ambiguity": 0.8}, "failure_classification": null, "drafts_generated": 1, "drafts_survived": 1}
{"id": "3b9a7edd-eefc-4038-afdb-87d6a7a3e970", "target_id": "B1-treatment", "git_sha": "47a8c24b0b97c00b9e762d738632ace304265a8c", "pre_experiment_sha": "2b99072af900416a903c3a60e1928b176a54148e", "timestamp": "2026-04-05T22:47:18.080587+00:00", "hypothesis": "No hypothesis provided", "hypothesis_source": "synthesized", "mutation_diff_summary": "", "score": 3.5, "score_ci_lower": 2.9, "score_ci_upper": 4.0, "raw_scores": [4.0, 4.0, 2.5, 3.0, 4.0], "baseline_score": 3.5, "outcome": "KEPT", "failure_mode": null, "duration_seconds": 177.9378629999701, "tags": [], "learnings": "{\"what_changed\":\"\",\"what_improved\":[],\"what_regressed\":[],\"transferable_insight\":\"No hypothesis provided\",\"domain_tags\":[]}", "cost_usd": 0.3074949, "bootstrap_seed": 0, "agent_model": "claude-sonnet-4-6", "held_out_score": null, "criterion_names": ["correct_category", "concise_output", "follows_format", "no_hallucination", "handles_ambiguity"], "per_criterion_scores": {"correct_category": 1.0, "concise_output": 1.0, "follows_format": 0.0, "no_hallucination": 0.7, "handles_ambiguity": 0.8}, "failure_classification": null, "drafts_generated": 1, "drafts_survived": 1}
{"id": "1d1400c9-1a7a-4c7e-b00b-e330089b8bbf", "target_id": "B1-treatment", "git_sha": "12ae69fc2c38c0ecef12a81884dc2efbf788b118", "pre_experiment_sha": "47a8c24b0b97c00b9e762d738632ace304265a8c", "timestamp": "2026-04-05T22:51:40.502875+00:00", "hypothesis": "No hypothesis provided", "hypothesis_source": "synthesized", "mutation_diff_summary": "", "score": 3.6, "score_ci_lower": 3.2, "score_ci_upper": 4.0, "raw_scores": [4.0, 4.0, 3.0, 3.0, 4.0], "baseline_score": 3.5, "outcome": "KEPT", "failure_mode": null, "duration_seconds": 261.9648418750148, "tags": [], "learnings": "{\"what_changed\":\"\",\"what_improved\":[],\"what_regressed\":[],\"transferable_insight\":\"No hypothesis provided\",\"domain_tags\":[]}", "cost_usd": 0.4642420499999999, "bootstrap_seed": 0, "agent_model": "claude-sonnet-4-6", "held_out_score": null, "criterion_names": ["correct_category", "concise_output", "follows_format", "no_hallucination", "handles_ambiguity"], "per_criterion_scores": {"correct_category": 1.0, "concise_output": 1.0, "follows_format": 0.0, "no_hallucination": 0.8, "handles_ambiguity": 0.8}, "failure_classification": null, "drafts_generated": 1, "drafts_survived": 1}
{"id": "4c423750-1f49-46fe-98de-bdf4699bf19b", "target_id": "B1-treatment", "git_sha": "fc6de89360a48c6ce23ce57cecb749c3e68f6f44", "pre_experiment_sha": "12ae69fc2c38c0ecef12a81884dc2efbf788b118", "timestamp": "2026-04-05T22:54:38.577795+00:00", "hypothesis": "No hypothesis provided", "hypothesis_source": "synthesized", "mutation_diff_summary": "", "score": 3.6, "score_ci_lower": 3.2, "score_ci_upper": 4.0, "raw_scores": [4.0, 4.0, 3.0, 3.0, 4.0], "baseline_score": 3.6, "outcome": "KEPT", "failure_mode": null, "duration_seconds": 177.630620875163, "tags": [], "learnings": "{\"what_changed\":\"\",\"what_improved\":[],\"what_regressed\":[],\"transferable_insight\":\"No hypothesis provided\",\"domain_tags\":[]}", "cost_usd": 0.29799765, "bootstrap_seed": 0, "agent_model": "claude-sonnet-4-6", "held_out_score": null, "criterion_names": ["correct_category", "concise_output", "follows_format", "no_hallucination", "handles_ambiguity"], "per_criterion_scores": {"correct_category": 1.0, "concise_output": 1.0, "follows_format": 0.0, "no_hallucination": 0.8, "handles_ambiguity": 0.8}, "failure_classification": null, "drafts_generated": 1, "drafts_survived": 1}
{"id": "734091ff-3988-4a7d-b897-8472a2d3b01f", "target_id": "B1-treatment", "git_sha": "fc559bdc3c43a8a99b1facd9c2036a7c7ecbbcd3", "pre_experiment_sha": "fc6de89360a48c6ce23ce57cecb749c3e68f6f44", "timestamp": "2026-04-05T22:56:15.127265+00:00", "hypothesis": "No hypothesis provided", "hypothesis_source": "synthesized", "mutation_diff_summary": "", "score": 3.3, "score_ci_lower": 2.9, "score_ci_upper": 3.7, "raw_scores": [3.5, 4.0, 2.5, 3.0, 3.5], "baseline_score": 3.6, "outcome": "KEPT", "failure_mode": null, "duration_seconds": 95.9686955420766, "tags": [], "learnings": "{\"what_changed\":\"\",\"what_improved\":[],\"what_regressed\":[],\"transferable_insight\":\"No hypothesis provided\",\"domain_tags\":[]}", "cost_usd": 0.29066355, "bootstrap_seed": 0, "agent_model": "claude-sonnet-4-6", "held_out_score": null, "criterion_names": ["correct_category", "concise_output", "follows_format", "no_hallucination", "handles_ambiguity"], "per_criterion_scores": {"correct_category": 1.0, "concise_output": 1.0, "follows_format": 0.0, "no_hallucination": 0.5, "handles_ambiguity": 0.8}, "failure_classification": null, "drafts_generated": 1, "drafts_survived": 1}
{"id": "39c56678-b130-4bd2-bb14-b779cfec8c56", "target_id": "B1-treatment", "git_sha": "169018ab3b12c40918cf38a4e5e4b79f376bbe62", "pre_experiment_sha": "fc559bdc3c43a8a99b1facd9c2036a7c7ecbbcd3", "timestamp": "2026-04-05T22:58:19.301630+00:00", "hypothesis": "No hypothesis provided", "hypothesis_source": "synthesized", "mutation_diff_summary": "", "score": 3.4, "score_ci_lower": 2.9, "score_ci_upper": 3.9, "raw_scores": [3.0, 4.0, 2.5, 3.5, 4.0], "baseline_score": 3.3, "outcome": "KEPT", "failure_mode": null, "duration_seconds": 123.74156424985267, "tags": [], "learnings": "{\"what_changed\":\"\",\"what_improved\":[],\"what_regressed\":[],\"transferable_insight\":\"No hypothesis provided\",\"domain_tags\":[]}", "cost_usd": 0.3038475, "bootstrap_seed": 0, "agent_model": "claude-sonnet-4-6", "held_out_score": null, "criterion_names": ["correct_category", "concise_output", "follows_format", "no_hallucination", "handles_ambiguity"], "per_criterion_scores": {"correct_category": 1.0, "concise_output": 1.0, "follows_format": 0.0, "no_hallucination": 0.7, "handles_ambiguity": 0.7}, "failure_classification": null, "drafts_generated": 1, "drafts_survived": 1}
{"id": "ca386b80-6430-47d2-88ae-6cb7626c4f48", "target_id": "B1-treatment", "git_sha": "f52cb83365766b68a5faa66db3188a1c45009ce2", "pre_experiment_sha": "169018ab3b12c40918cf38a4e5e4b79f376bbe62", "timestamp": "2026-04-05T23:02:02.952891+00:00", "hypothesis": "No hypothesis provided", "hypothesis_source": "synthesized", "mutation_diff_summary": "", "score": 3.7, "score_ci_lower": 3.3, "score_ci_upper": 4.0, "raw_scores": [4.0, 4.0, 3.0, 3.5, 4.0], "baseline_score": 3.4, "outcome": "KEPT", "failure_mode": null, "duration_seconds": 223.07120487489738, "tags": [], "learnings": "{\"what_changed\":\"\",\"what_improved\":[],\"what_regressed\":[],\"transferable_insight\":\"No hypothesis provided\",\"domain_tags\":[]}", "cost_usd": 0.4433604, "bootstrap_seed": 0, "agent_model": "claude-sonnet-4-6", "held_out_score": null, "criterion_names": ["correct_category", "concise_output", "follows_format", "no_hallucination", "handles_ambiguity"], "per_criterion_scores": {"correct_category": 1.0, "concise_output": 1.0, "follows_format": 0.0, "no_hallucination": 0.9, "handles_ambiguity": 0.8}, "failure_classification": null, "drafts_generated": 1, "drafts_survived": 1}
{"id": "4be35304-7a1f-4a4b-8672-82263566e653", "target_id": "B1-treatment", "git_sha": "f52cb83365766b68a5faa66db3188a1c45009ce2", "pre_experiment_sha": "f52cb83365766b68a5faa66db3188a1c45009ce2", "timestamp": "2026-04-05T23:05:31.511757+00:00", "hypothesis": "No hypothesis provided", "hypothesis_source": "synthesized", "mutation_diff_summary": "", "score": 3.4, "score_ci_lower": 3.1, "score_ci_upper": 3.7, "raw_scores": [3.5, 4.0, 3.0, 3.0, 3.5], "baseline_score": 3.7, "outcome": "DISCARDED", "failure_mode": null, "duration_seconds": 208.14857954205945, "tags": [], "learnings": "{\"what_changed\":\"\",\"what_improved\":[],\"what_regressed\":[],\"transferable_insight\":\"No hypothesis provided\",\"domain_tags\":[]}", "cost_usd": 0.43755405, "bootstrap_seed": 0, "agent_model": "claude-sonnet-4-6", "held_out_score": null, "criterion_names": ["correct_category", "concise_output", "follows_format", "no_hallucination", "handles_ambiguity"], "per_criterion_scores": {"correct_category": 1.0, "concise_output": 1.0, "follows_format": 0.0, "no_hallucination": 0.8, "handles_ambiguity": 0.6}, "failure_classification": {"category": "output_format", "description": "The experiment lacks a provided hypothesis and failure mode, which violates expected output structure or schema requirements.", "fix_direction": "Ensure future experiments include all required sections such as hypothesis and failure mode to conform to output specifications.", "confidence": 0.9}, "drafts_generated": 1, "drafts_survived": 1}
{"id": "d1b173be-65d5-4353-9afd-5ee1a06be34e", "target_id": "B1-treatment", "git_sha": "8759ed32d8d711e73dc50a44d19edafe8b60fe5a", "pre_experiment_sha": "f52cb83365766b68a5faa66db3188a1c45009ce2", "timestamp": "2026-04-05T23:09:29.985565+00:00", "hypothesis": "No hypothesis provided", "hypothesis_source": "synthesized", "mutation_diff_summary": "", "score": 3.5, "score_ci_lower": 2.9, "score_ci_upper": 4.0, "raw_scores": [4.0, 4.0, 3.0, 2.5, 4.0], "baseline_score": 3.7, "outcome": "KEPT", "failure_mode": null, "duration_seconds": 236.9037415420171, "tags": [], "learnings": "{\"what_changed\":\"\",\"what_improved\":[],\"what_regressed\":[],\"transferable_insight\":\"No hypothesis provided\",\"domain_tags\":[]}", "cost_usd": 0.4898032499999999, "bootstrap_seed": 0, "agent_model": "claude-sonnet-4-6", "held_out_score": null, "criterion_names": ["correct_category", "concise_output", "follows_format", "no_hallucination", "handles_ambiguity"], "per_criterion_scores": {"correct_category": 1.0, "concise_output": 1.0, "follows_format": 0.0, "no_hallucination": 0.8, "handles_ambiguity": 0.7}, "failure_classification": null, "drafts_generated": 1, "drafts_survived": 1}
{"id": "1e17d1b1-3af6-411d-af74-bd4787f43b20", "target_id": "B1-treatment", "git_sha": "8ccd59dc3c882958a5cfd36dbbe70f4b33727924", "pre_experiment_sha": "8759ed32d8d711e73dc50a44d19edafe8b60fe5a", "timestamp": "2026-04-05T23:11:54.541560+00:00", "hypothesis": "No hypothesis provided", "hypothesis_source": "synthesized", "mutation_diff_summary": "", "score": 3.6, "score_ci_lower": 3.3, "score_ci_upper": 3.9, "raw_scores": [4.0, 3.5, 3.0, 3.5, 4.0], "baseline_score": 3.5, "outcome": "KEPT", "failure_mode": null, "duration_seconds": 92.87301595904864, "tags": [], "learnings": "{\"what_changed\":\"\",\"what_improved\":[],\"what_regressed\":[],\"transferable_insight\":\"No hypothesis provided\",\"domain_tags\":[]}", "cost_usd": 0.22311075, "bootstrap_seed": 0, "agent_model": "claude-sonnet-4-6", "held_out_score": null, "criterion_names": ["correct_category", "concise_output", "follows_format", "no_hallucination", "handles_ambiguity"], "per_criterion_scores": {"correct_category": 1.0, "concise_output": 1.0, "follows_format": 0.0, "no_hallucination": 0.9, "handles_ambiguity": 0.7}, "failure_classification": null, "drafts_generated": 1, "drafts_survived": 1}
{"id": "3524e59a-2522-4210-8489-f7477ca5921d", "target_id": "B1-treatment", "git_sha": "8ccd59dc3c882958a5cfd36dbbe70f4b33727924", "pre_experiment_sha": "8ccd59dc3c882958a5cfd36dbbe70f4b33727924", "timestamp": "2026-04-05T23:14:31.727834+00:00", "hypothesis": "No hypothesis provided", "hypothesis_source": "synthesized", "mutation_diff_summary": "", "score": 3.4, "score_ci_lower": 3.1, "score_ci_upper": 3.7, "raw_scores": [3.5, 4.0, 3.0, 3.0, 3.5], "baseline_score": 3.6, "outcome": "DISCARDED", "failure_mode": null, "duration_seconds": 156.72390137496404, "tags": [], "learnings": "{\"what_changed\":\"\",\"what_improved\":[],\"what_regressed\":[],\"transferable_insight\":\"No hypothesis provided\",\"domain_tags\":[]}", "cost_usd": 0.28380475, "bootstrap_seed": 0, "agent_model": "claude-sonnet-4-6", "held_out_score": null, "criterion_names": ["correct_category", "concise_output", "follows_format", "no_hallucination", "handles_ambiguity"], "per_criterion_scores": {"correct_category": 1.0, "concise_output": 1.0, "follows_format": 0.0, "no_hallucination": 0.6, "handles_ambiguity": 0.8}, "failure_classification": {"category": "output_format", "description": "The experiment failed due to a violation of the required output structure or schema, resulting in an output that did not conform to expectations.", "fix_direction": "Ensure outputs strictly match the specified schema or structure requirements in future attempts.", "confidence": 0.85}, "drafts_generated": 1, "drafts_survived": 1}
