{"id": "c19e1a99-4a55-42b8-9d64-384e47b0ded0", "target_id": "B1-treatment", "git_sha": "5e42e84399f4e2d06c2b2bd82205a86f8a1a4d8f", "pre_experiment_sha": "68d96c185fbe6e19a4b0d379f77244ff8b5e62d6", "timestamp": "2026-04-19T01:33:23.382426+00:00", "hypothesis": "Constraining the classifier to output only a single label from the provided options will improve binary criteria scoring.", "hypothesis_source": "agent", "mutation_diff_summary": "", "score": 2.7, "score_ci_lower": 2.3, "score_ci_upper": 3.0, "raw_scores": [3.0, 2.0, 3.0, 2.5, 3.0], "baseline_score": 0.0, "outcome": "KEPT", "failure_mode": null, "duration_seconds": 13.427771583083086, "tags": ["classification", "strict-output", "label-only"], "learnings": "{\"what_changed\":\"\",\"what_improved\":[],\"what_regressed\":[],\"transferable_insight\":\"Restricting a model\u2019s outputs to a fixed set of valid choices can improve scoring by reducing ambiguity and forcing more consistent decisions.\",\"domain_tags\":[\"classification\",\"output-constraints\",\"decision-making\"]}", "cost_usd": 0.00703255, "bootstrap_seed": 0, "agent_model": "gpt-5.4", "held_out_score": null, "criterion_names": ["correct_category", "concise_output", "follows_format", "no_hallucination", "handles_ambiguity"], "per_criterion_scores": {"correct_category": 0.4, "concise_output": 1.0, "follows_format": 0.0, "no_hallucination": 0.5, "handles_ambiguity": 0.8}, "failure_classification": null, "drafts_generated": 1, "drafts_survived": 1}
{"id": "68a1c21f-63f4-40bc-bb28-00497a5d3db0", "target_id": "B1-treatment", "git_sha": "8aadc5911358b4430d2358d408f89d1fe98df3cf", "pre_experiment_sha": "5e42e84399f4e2d06c2b2bd82205a86f8a1a4d8f", "timestamp": "2026-04-19T01:33:36.692952+00:00", "hypothesis": "Adding stricter decision rules and ambiguity handling will improve single-label accuracy and format compliance.", "hypothesis_source": "agent", "mutation_diff_summary": "", "score": 3.3, "score_ci_lower": 2.9, "score_ci_upper": 3.5, "raw_scores": [3.5, 2.5, 3.5, 3.5, 3.5], "baseline_score": 2.7, "outcome": "KEPT", "failure_mode": null, "duration_seconds": 12.218738790950738, "tags": ["classification", "prompt-engineering", "format-control", "ambiguity-resolution"], "learnings": "{\"what_changed\":\"\",\"what_improved\":[],\"what_regressed\":[],\"transferable_insight\":\"When outputs must follow a strict single-choice format, adding explicit rules for resolving ambiguity can improve both correctness and compliance without introducing tradeoffs.\",\"domain_tags\":[\"decision-making\",\"format-compliance\",\"ambiguity-handling\"]}", "cost_usd": 0.00890255, "bootstrap_seed": 0, "agent_model": "gpt-5.4", "held_out_score": null, "criterion_names": ["correct_category", "concise_output", "follows_format", "no_hallucination", "handles_ambiguity"], "per_criterion_scores": {"correct_category": 0.5, "concise_output": 1.0, "follows_format": 0.0, "no_hallucination": 0.8, "handles_ambiguity": 1.0}, "failure_classification": null, "drafts_generated": 1, "drafts_survived": 1}
{"id": "d61c2ed7-f2c8-4cba-9447-ad035692bbdb", "target_id": "B1-treatment", "git_sha": "8aadc5911358b4430d2358d408f89d1fe98df3cf", "pre_experiment_sha": "8aadc5911358b4430d2358d408f89d1fe98df3cf", "timestamp": "2026-04-19T01:33:52.451108+00:00", "hypothesis": "Tightening decision rules with explicit tie-breaking and output constraints will improve single-label accuracy and reduce formatting errors.", "hypothesis_source": "agent", "mutation_diff_summary": "", "score": 3.3, "score_ci_lower": 3.1, "score_ci_upper": 3.5, "raw_scores": [3.0, 3.5, 3.0, 3.5, 3.5], "baseline_score": 3.3, "outcome": "DISCARDED", "failure_mode": null, "duration_seconds": 14.674813458928838, "tags": ["classification", "single-label", "output-constraint", "tie-breaking"], "learnings": "{\"what_changed\":\"\",\"what_improved\":[],\"what_regressed\":[],\"transferable_insight\":\"Adding explicit decision rules and output constraints can improve consistency only when they reduce ambiguity without overconstraining the task, so their value must be validated rather than assumed.\",\"domain_tags\":[\"decision-making\",\"evaluation\",\"process-design\"]}", "cost_usd": 0.01212895, "bootstrap_seed": 0, "agent_model": "gpt-5.4", "held_out_score": null, "criterion_names": ["correct_category", "concise_output", "follows_format", "no_hallucination", "handles_ambiguity"], "per_criterion_scores": {"correct_category": 0.6, "concise_output": 1.0, "follows_format": 0.0, "no_hallucination": 0.7, "handles_ambiguity": 1.0}, "failure_classification": {"category": "logic_error", "description": "No specific failure details were provided (Failure Mode is listed as 'unknown'), so the exact type of error cannot be determined from the given information.", "fix_direction": "Re-run with logging/diagnostics to capture the precise failure mode (e.g., formatting mismatch, parsing error, logical inconsistency, or metric gaming) and include the observed failing output or error trace for categorization.", "confidence": 0.05}, "drafts_generated": 1, "drafts_survived": 1}
{"id": "6c5b73ae-381e-4614-899a-46f3a8127533", "target_id": "B1-treatment", "git_sha": "8aadc5911358b4430d2358d408f89d1fe98df3cf", "pre_experiment_sha": "8aadc5911358b4430d2358d408f89d1fe98df3cf", "timestamp": "2026-04-19T01:34:18.220667+00:00", "hypothesis": "Tightening the output contract and adding deterministic tie-break rules will improve single-label compliance and reduce ambiguous responses.", "hypothesis_source": "agent", "mutation_diff_summary": "", "score": 3.0, "score_ci_lower": 2.7, "score_ci_upper": 3.3, "raw_scores": [3.0, 2.5, 3.0, 3.5, 3.0], "baseline_score": 3.3, "outcome": "DISCARDED", "failure_mode": null, "duration_seconds": 22.23665916698519, "tags": ["format-compliance", "single-label", "deterministic", "tie-break"], "learnings": "{\"what_changed\":\"\",\"what_improved\":[],\"what_regressed\":[],\"transferable_insight\":\"When a task requires a single unambiguous output, stricter formatting alone may not help unless the decision rules also eliminate remaining ambiguity in the underlying choice process.\",\"domain_tags\":[\"evaluation\",\"decision-making\",\"prompt-design\"]}", "cost_usd": 0.01096815, "bootstrap_seed": 0, "agent_model": "gpt-5.4", "held_out_score": null, "criterion_names": ["correct_category", "concise_output", "follows_format", "no_hallucination", "handles_ambiguity"], "per_criterion_scores": {"correct_category": 0.2, "concise_output": 1.0, "follows_format": 0.0, "no_hallucination": 0.8, "handles_ambiguity": 1.0}, "failure_classification": {"category": "logic_error", "description": "The provided metadata does not specify any observable failure mode (it is listed as 'unknown'), so it\u2019s unclear whether the issue was output formatting, logic/meaning, regressions, scope, syntax, or other failure types.", "fix_direction": "Identify the concrete failing symptom (e.g., schema/format mismatch, incorrect reasoning, ambiguous multi-label output, regression vs prior runs), then tighten the corresponding constraint (output schema, deterministic tie-break rules, or logic/calc checks) and re-evaluate.", "confidence": 0.12}, "drafts_generated": 1, "drafts_survived": 1}
{"id": "80a97991-4971-4135-bdba-0028ace087fc", "target_id": "B1-treatment", "git_sha": "8aadc5911358b4430d2358d408f89d1fe98df3cf", "pre_experiment_sha": "8aadc5911358b4430d2358d408f89d1fe98df3cf", "timestamp": "2026-04-19T01:34:34.936792+00:00", "hypothesis": "Tightening the output contract and adding deterministic tie-break rules will improve single-label compliance and reduce ambiguous responses.", "hypothesis_source": "agent", "mutation_diff_summary": "", "score": 3.4, "score_ci_lower": 3.1, "score_ci_upper": 3.7, "raw_scores": [3.5, 3.0, 3.0, 3.5, 4.0], "baseline_score": 3.3, "outcome": "DISCARDED", "failure_mode": null, "duration_seconds": 13.746255207923241, "tags": ["format-compliance", "single-label", "deterministic", "tie-breaker"], "learnings": "{\"what_changed\":\"\",\"what_improved\":[],\"what_regressed\":[],\"transferable_insight\":\"When a task requires a single unambiguous output, explicitly constraining the format and adding deterministic tie-break rules can reduce ambiguity and improve compliance.\",\"domain_tags\":[\"instruction-design\",\"decision-making\",\"output-formatting\"]}", "cost_usd": 0.01062415, "bootstrap_seed": 0, "agent_model": "gpt-5.4", "held_out_score": null, "criterion_names": ["correct_category", "concise_output", "follows_format", "no_hallucination", "handles_ambiguity"], "per_criterion_scores": {"correct_category": 0.7, "concise_output": 1.0, "follows_format": 0.0, "no_hallucination": 0.7, "handles_ambiguity": 1.0}, "failure_classification": {"category": "logic_error", "description": "The provided information does not include a specific failure symptom (e.g., format/schema mismatch, incorrect reasoning, regression, or semantic misunderstanding). Only the hypothesis, failure mode label as 'unknown', and a score are given.", "fix_direction": "Capture the concrete error signal from the evaluation run (exact error message, response snippet, and which criterion failed) to determine whether the issue is format, logic, regression, scope, syntax, or semantic meaning; then tighten the corresponding constraint (schema validation, reasoning checks, or tie-break logic).", "confidence": 0.05}, "drafts_generated": 1, "drafts_survived": 1}
{"id": "4893c70b-acf8-4260-9433-d3d70d854fc0", "target_id": "B1-treatment", "git_sha": "8aadc5911358b4430d2358d408f89d1fe98df3cf", "pre_experiment_sha": "8aadc5911358b4430d2358d408f89d1fe98df3cf", "timestamp": "2026-04-19T01:34:51.683312+00:00", "hypothesis": "Tightening the output contract and adding simple deterministic tie-break rules will improve single-label compliance and reduce ambiguous responses.", "hypothesis_source": "agent", "mutation_diff_summary": "", "score": 3.1, "score_ci_lower": 3.0, "score_ci_upper": 3.3, "raw_scores": [3.5, 3.0, 3.0, 3.0, 3.0], "baseline_score": 3.3, "outcome": "DISCARDED", "failure_mode": null, "duration_seconds": 14.011543791973963, "tags": ["format-compliance", "single-label", "deterministic", "tie-break"], "learnings": "{\"what_changed\":\"\",\"what_improved\":[],\"what_regressed\":[],\"transferable_insight\":\"When a task requires a single unambiguous output, stricter formatting rules alone may not improve compliance unless the underlying decision process is also made more decisive.\",\"domain_tags\":[\"process-design\",\"decision-making\",\"output-formatting\"]}", "cost_usd": 0.011989550000000002, "bootstrap_seed": 0, "agent_model": "gpt-5.4", "held_out_score": null, "criterion_names": ["correct_category", "concise_output", "follows_format", "no_hallucination", "handles_ambiguity"], "per_criterion_scores": {"correct_category": 0.3, "concise_output": 0.9, "follows_format": 0.0, "no_hallucination": 1.0, "handles_ambiguity": 0.9}, "failure_classification": {"category": "incomplete_edit", "description": "The failure mode is unspecified ('unknown') and the score is only moderate, suggesting the change to tighten the output contract and add tie-break rules was not fully or consistently implemented, leaving some responses still ambiguous or inconsistently formatted.", "fix_direction": "Ensure the output schema/structure is enforced end-to-end (validation at generation time), and make deterministic tie-break logic complete and consistently applied across all branches before producing the final single-label output.", "confidence": 0.42}, "drafts_generated": 1, "drafts_survived": 1}
{"id": "adcd5c72-6f4e-4c59-bd62-35693740146d", "target_id": "B1-treatment", "git_sha": "8aadc5911358b4430d2358d408f89d1fe98df3cf", "pre_experiment_sha": "8aadc5911358b4430d2358d408f89d1fe98df3cf", "timestamp": "2026-04-19T01:35:11.429987+00:00", "hypothesis": "Tightening the prompt around exact one-label output and direct evidence will improve binary criteria compliance.", "hypothesis_source": "agent", "mutation_diff_summary": "", "score": 2.6, "score_ci_lower": 2.5, "score_ci_upper": 2.8, "raw_scores": [2.5, 2.5, 3.0, 2.5, 2.5], "baseline_score": 3.3, "outcome": "DISCARDED", "failure_mode": null, "duration_seconds": 15.900497708003968, "tags": ["format-compliance", "single-label", "deterministic"], "learnings": "{\"what_changed\":\"\",\"what_improved\":[],\"what_regressed\":[],\"transferable_insight\":\"Adding stricter output constraints and requiring direct evidence does not necessarily improve compliance, so prompt precision should be validated empirically rather than assumed to help.\",\"domain_tags\":[\"prompt-engineering\",\"evaluation\",\"instruction-following\"]}", "cost_usd": 0.008680150000000001, "bootstrap_seed": 0, "agent_model": "gpt-5.4", "held_out_score": null, "criterion_names": ["correct_category", "concise_output", "follows_format", "no_hallucination", "handles_ambiguity"], "per_criterion_scores": {"correct_category": 0.2, "concise_output": 1.0, "follows_format": 0.0, "no_hallucination": 0.5, "handles_ambiguity": 0.9}, "failure_classification": {"category": "output_format", "description": "The experiment\u2019s outcome suggests the model did not reliably satisfy the required output structure/schema\u2014likely producing content that violates the enforced one-label/direct-evidence constraints, leading to low compliance despite the prompt changes.", "fix_direction": "Further constrain and validate output formatting (strict schema, explicit JSON-only/one-token label requirements) and add post-checks or self-correction to ensure the final response conforms exactly to the expected format.", "confidence": 0.62}, "drafts_generated": 1, "drafts_survived": 1}
{"id": "c608ff97-a61f-4071-86de-f289ad64dc1b", "target_id": "B1-treatment", "git_sha": "8aadc5911358b4430d2358d408f89d1fe98df3cf", "pre_experiment_sha": "8aadc5911358b4430d2358d408f89d1fe98df3cf", "timestamp": "2026-04-19T01:35:25.042872+00:00", "hypothesis": "Tightening the output contract and simplifying the selection rule will improve exact single-label compliance.", "hypothesis_source": "agent", "mutation_diff_summary": "", "score": 2.8, "score_ci_lower": 2.3, "score_ci_upper": 3.3, "raw_scores": [2.5, 2.0, 3.5, 2.5, 3.5], "baseline_score": 3.3, "outcome": "DISCARDED", "failure_mode": null, "duration_seconds": 11.435324375052005, "tags": ["format-compliance", "single-label", "deterministic"], "learnings": "{\"what_changed\":\"\",\"what_improved\":[],\"what_regressed\":[],\"transferable_insight\":\"Reducing flexibility in a decision rule does not necessarily improve exact compliance unless the underlying ambiguity and edge cases are also addressed.\",\"domain_tags\":[\"decision-making\",\"process-design\",\"quality-control\"]}", "cost_usd": 0.00885595, "bootstrap_seed": 0, "agent_model": "gpt-5.4", "held_out_score": null, "criterion_names": ["correct_category", "concise_output", "follows_format", "no_hallucination", "handles_ambiguity"], "per_criterion_scores": {"correct_category": 0.5, "concise_output": 1.0, "follows_format": 0.0, "no_hallucination": 0.4, "handles_ambiguity": 0.9}, "failure_classification": {"category": "semantic_drift", "description": "The experiment appears to have produced output that still roughly follows the expected structure, but the change did not achieve the intended improvement in exact single-label compliance\u2014suggesting the revised selection rule/contract tightened constraints without preserving the correct label decision semantics.", "fix_direction": "Re-check the selection logic against the intended rule set; add targeted test cases to validate that each input maps to the correct single label under the tightened contract, not just that the output format matches.", "confidence": 0.42}, "drafts_generated": 1, "drafts_survived": 1}
{"id": "408f1da1-f061-4691-acaf-73d123491180", "target_id": "B1-treatment", "git_sha": "8aadc5911358b4430d2358d408f89d1fe98df3cf", "pre_experiment_sha": "8aadc5911358b4430d2358d408f89d1fe98df3cf", "timestamp": "2026-04-19T01:35:52.818748+00:00", "hypothesis": "Tightening the format and fallback rules will improve exact single-label compliance and reduce invalid outputs.", "hypothesis_source": "agent", "mutation_diff_summary": "", "score": 2.7, "score_ci_lower": 2.2, "score_ci_upper": 3.4, "raw_scores": [4.0, 2.5, 2.0, 2.5, 2.5], "baseline_score": 3.3, "outcome": "DISCARDED", "failure_mode": null, "duration_seconds": 25.24596895801369, "tags": ["format-compliance", "single-label", "deterministic", "minimal"], "learnings": "{\"what_changed\":\"\",\"what_improved\":[],\"what_regressed\":[],\"transferable_insight\":\"When a change is discarded with no measurable improvements or regressions, it suggests the added constraints did not meaningfully alter behavior and may have introduced unnecessary rigidity without benefit.\",\"domain_tags\":[\"process-optimization\",\"evaluation\",\"robustness\"]}", "cost_usd": 0.00932355, "bootstrap_seed": 0, "agent_model": "gpt-5.4", "held_out_score": null, "criterion_names": ["correct_category", "concise_output", "follows_format", "no_hallucination", "handles_ambiguity"], "per_criterion_scores": {"correct_category": 0.5, "concise_output": 1.0, "follows_format": 0.0, "no_hallucination": 0.5, "handles_ambiguity": 0.7}, "failure_classification": {"category": "output_format", "description": "Experiment appears to fail due to output structure/schema non-compliance (invalid output not conforming to the expected single-label/exact format rules), despite the attempt to tighten fallback behavior.", "fix_direction": "Further constrain the output to the exact required schema (strict single-label selection, deterministic formatting, and explicit fallback that still adheres to the schema) and validate outputs with a parser/checker before scoring.", "confidence": 0.62}, "drafts_generated": 1, "drafts_survived": 1}
{"id": "598a85f6-d9d2-4f23-aad3-32cb4966536b", "target_id": "B1-treatment", "git_sha": "8aadc5911358b4430d2358d408f89d1fe98df3cf", "pre_experiment_sha": "8aadc5911358b4430d2358d408f89d1fe98df3cf", "timestamp": "2026-04-19T01:36:07.828635+00:00", "hypothesis": "Tightening the prompt to a minimal exact-output rule will improve single-label compliance and reduce formatting errors.", "hypothesis_source": "agent", "mutation_diff_summary": "", "score": 3.1, "score_ci_lower": 2.6, "score_ci_upper": 3.6, "raw_scores": [2.5, 2.5, 3.5, 4.0, 3.0], "baseline_score": 3.3, "outcome": "DISCARDED", "failure_mode": null, "duration_seconds": 11.00694399990607, "tags": ["format-compliance", "single-label", "minimal", "deterministic"], "learnings": "{\"what_changed\":\"\",\"what_improved\":[],\"what_regressed\":[],\"transferable_insight\":\"Making instructions more exact can improve consistency only when the task leaves room for interpretation; if the output is already constrained, further tightening may add little value and can be discarded.\",\"domain_tags\":[\"prompt-design\",\"evaluation\",\"process-optimization\"]}", "cost_usd": 0.007866950000000001, "bootstrap_seed": 0, "agent_model": "gpt-5.4", "held_out_score": null, "criterion_names": ["correct_category", "concise_output", "follows_format", "no_hallucination", "handles_ambiguity"], "per_criterion_scores": {"correct_category": 0.6, "concise_output": 1.0, "follows_format": 0.0, "no_hallucination": 0.5, "handles_ambiguity": 1.0}, "failure_classification": {"category": "output_format", "description": "The experiment failed due to formatting/structure not meeting the expected exact-output schema/rules, leading to formatting errors despite the intent to tighten the prompt.", "fix_direction": "Further constrain and reinforce the required output schema (e.g., strict JSON-only or exact field ordering), and add explicit negative constraints/examples to prevent extra text or deviations.", "confidence": 0.52}, "drafts_generated": 1, "drafts_survived": 1}
{"id": "22fb6170-b601-447b-9b2f-abe923443b23", "target_id": "B1-treatment", "git_sha": "8aadc5911358b4430d2358d408f89d1fe98df3cf", "pre_experiment_sha": "8aadc5911358b4430d2358d408f89d1fe98df3cf", "timestamp": "2026-04-19T01:36:22.863304+00:00", "hypothesis": "Tightening the prompt to a minimal exact-output rule will improve single-label format compliance.", "hypothesis_source": "agent", "mutation_diff_summary": "", "score": 3.2, "score_ci_lower": 2.8, "score_ci_upper": 3.5, "raw_scores": [3.5, 3.0, 3.5, 2.5, 3.5], "baseline_score": 3.3, "outcome": "DISCARDED", "failure_mode": null, "duration_seconds": 12.264183082967065, "tags": ["format-compliance", "single-label", "deterministic", "minimal"], "learnings": "{\"what_changed\":\"\",\"what_improved\":[],\"what_regressed\":[],\"transferable_insight\":\"When a stricter instruction changes nothing in the measured outcomes, the added constraint likely reduced flexibility without improving the target behavior, so prefer simpler guidance unless there is evidence of benefit.\",\"domain_tags\":[\"prompt-design\",\"optimization\",\"evaluation\"]}", "cost_usd": 0.00819915, "bootstrap_seed": 0, "agent_model": "gpt-5.4", "held_out_score": null, "criterion_names": ["correct_category", "concise_output", "follows_format", "no_hallucination", "handles_ambiguity"], "per_criterion_scores": {"correct_category": 0.6, "concise_output": 1.0, "follows_format": 0.0, "no_hallucination": 0.7, "handles_ambiguity": 0.9}, "failure_classification": {"category": "output_format", "description": "The attempt did not meet the expected single-label exact-output format/schema requirements, indicating the response structure/formatting still deviated despite tightening the prompt.", "fix_direction": "Further constrain and validate the output schema (e.g., exact label-only response, no extra text), and add explicit negative constraints plus a lightweight post-check/validator to enforce strict formatting.", "confidence": 0.62}, "drafts_generated": 1, "drafts_survived": 1}
