{"id": "067fd899-eb5d-4545-8113-278e4350526a", "target_id": "B1-treatment", "git_sha": "66e0449460dedf694313b7e3ad301fe93073bcad", "pre_experiment_sha": "66e0449460dedf694313b7e3ad301fe93073bcad", "timestamp": "2026-04-19T17:22:12.927709+00:00", "hypothesis": "Use a cleaner literal exact-match contract that preserves best-label selection while stating the full reply requirement in one line.", "hypothesis_source": "agent", "mutation_diff_summary": "", "score": 3.1, "score_ci_lower": 2.6, "score_ci_upper": 3.6, "raw_scores": [4.0, 2.5, 2.5, 3.0, 3.5], "baseline_score": 3.6, "outcome": "DISCARDED", "failure_mode": null, "duration_seconds": 10.379248792072758, "tags": ["minimal", "exact-output", "single-line", "format-compliance"], "learnings": "{\"what_changed\":\"\",\"what_improved\":[],\"what_regressed\":[],\"transferable_insight\":\"When tightening a specification, preserve the original selection logic while making the required output format explicit and complete in a single unambiguous statement.\",\"domain_tags\":[\"specification\",\"prompt-design\",\"quality-control\"]}", "cost_usd": 0.01814995, "bootstrap_seed": 0, "agent_model": "gpt-5.4", "held_out_score": null, "criterion_names": ["correct_category", "concise_output", "follows_format", "no_hallucination", "handles_ambiguity"], "per_criterion_scores": {"correct_category": 0.4, "concise_output": 1.0, "follows_format": 0.0, "no_hallucination": 0.7, "handles_ambiguity": 1.0}, "failure_classification": {"category": "incomplete_edit", "description": "The experiment failed without a clear single, consistent change: the hypothesis mentions consolidating the contract into a one-line literal exact-match requirement, but the reported failure mode is 'unknown' and the low score suggests the edit likely did not fully or coherently apply the full reply requirement while preserving best-label selection, leaving an inconsistent or partial contract.", "fix_direction": "Ensure the contract update is complete and consistent: use an exact-match literal requirement for best-label selection while stating the full reply requirement unambiguously on a single line, and verify the output structure/constraints fully reflect the intended one-line constraint.", "confidence": 0.42}, "drafts_generated": 1, "drafts_survived": 1}
{"id": "55115bd3-14bd-40d0-ba73-e9cb2b4e87ac", "target_id": "B1-treatment", "git_sha": "439fc3994ba18c7619e8ec575e52b18096c7cd19", "pre_experiment_sha": "66e0449460dedf694313b7e3ad301fe93073bcad", "timestamp": "2026-04-19T17:22:30.079093+00:00", "hypothesis": "Slightly simplify the exact-match contract while keeping best-label selection explicit and literal.", "hypothesis_source": "agent", "mutation_diff_summary": "", "score": 3.0, "score_ci_lower": 2.5, "score_ci_upper": 3.4, "raw_scores": [3.0, 2.0, 3.5, 3.5, 3.0], "baseline_score": 3.6, "outcome": "KEPT", "failure_mode": null, "duration_seconds": 13.447000041953288, "tags": ["minimal", "exact-output", "single-line", "label-only"], "learnings": "{\"what_changed\":\"\",\"what_improved\":[],\"what_regressed\":[],\"transferable_insight\":\"When a task depends on exact matching, modestly simplifying the contract can preserve performance if the key selection rule remains explicit and unambiguous.\",\"domain_tags\":[\"specification\",\"decision-making\",\"optimization\"]}", "cost_usd": 0.01737255, "bootstrap_seed": 0, "agent_model": "gpt-5.4", "held_out_score": null, "criterion_names": ["correct_category", "concise_output", "follows_format", "no_hallucination", "handles_ambiguity"], "per_criterion_scores": {"correct_category": 0.4, "concise_output": 1.0, "follows_format": 0.0, "no_hallucination": 0.6, "handles_ambiguity": 1.0}, "failure_classification": null, "drafts_generated": 1, "drafts_survived": 1}
{"id": "a5dc3af7-a05e-42eb-b055-81d32b52b0d9", "target_id": "B1-treatment", "git_sha": "547208a4c8191a04e4e928a146c24f6324167d87", "pre_experiment_sha": "439fc3994ba18c7619e8ec575e52b18096c7cd19", "timestamp": "2026-04-19T17:22:42.002187+00:00", "hypothesis": "Reintroduce the stronger exact-match wording while keeping the one-line label-only contract explicit and literal.", "hypothesis_source": "agent", "mutation_diff_summary": "", "score": 3.1, "score_ci_lower": 2.8, "score_ci_upper": 3.4, "raw_scores": [3.5, 3.0, 3.5, 3.0, 2.5], "baseline_score": 3.0, "outcome": "KEPT", "failure_mode": null, "duration_seconds": 10.782173124956898, "tags": ["exact-output", "single-line", "label-only", "format-compliance"], "learnings": "{\"what_changed\":\"\",\"what_improved\":[],\"what_regressed\":[],\"transferable_insight\":\"When a task has a strict output contract, using precise exact-match wording can improve compliance as long as the contract is stated explicitly and literally.\",\"domain_tags\":[\"prompting\",\"specification\",\"instruction-following\"]}", "cost_usd": 0.017082550000000002, "bootstrap_seed": 0, "agent_model": "gpt-5.4", "held_out_score": null, "criterion_names": ["correct_category", "concise_output", "follows_format", "no_hallucination", "handles_ambiguity"], "per_criterion_scores": {"correct_category": 0.3, "concise_output": 1.0, "follows_format": 0.0, "no_hallucination": 0.8, "handles_ambiguity": 1.0}, "failure_classification": null, "drafts_generated": 1, "drafts_survived": 1}
