{"id": "bda4899d-0d66-4cdd-8b8d-857d520ceb99", "target_id": "B1-treatment", "git_sha": "14ee414f2b5f75d522270ecdb485996c1dfc25fd", "pre_experiment_sha": "14ee414f2b5f75d522270ecdb485996c1dfc25fd", "timestamp": "2026-04-19T17:13:16.477369+00:00", "hypothesis": "Tightening the prompt to emphasize a mandatory single final label with no alternatives or explanation will improve binary criteria adherence.", "hypothesis_source": "agent", "mutation_diff_summary": "", "score": 2.8, "score_ci_lower": 2.6, "score_ci_upper": 3.0, "raw_scores": [3.0, 2.5, 3.0, 2.5, 3.0], "baseline_score": 3.3, "outcome": "DISCARDED", "failure_mode": null, "duration_seconds": 14.99141266697552, "tags": ["single-label", "strict-output", "no-abstain"], "learnings": "{\"what_changed\":\"\",\"what_improved\":[],\"what_regressed\":[],\"transferable_insight\":\"Making the required output format more explicit and constrained can improve compliance, but overly rigid instructions may still fail to produce measurable gains if they do not address the underlying task difficulty.\",\"domain_tags\":[\"prompt-engineering\",\"evaluation\",\"instruction-following\"]}", "cost_usd": 0.00938515, "bootstrap_seed": 0, "agent_model": "gpt-5.4", "held_out_score": null, "criterion_names": ["correct_category", "concise_output", "follows_format", "no_hallucination", "handles_ambiguity"], "per_criterion_scores": {"correct_category": 0.5, "concise_output": 1.0, "follows_format": 0.0, "no_hallucination": 0.5, "handles_ambiguity": 0.8}, "failure_classification": {"category": "output_format", "description": "The experiment did not reliably produce the required single, mandatory final label with the expected output structure, indicating an output formatting/schema adherence failure rather than purely reasoning issues.", "fix_direction": "Further constrain the model\u2019s response schema (strictly enforce a fixed field/label-only output) and add validation-focused prompting so the model cannot emit extra text or alternative labels.", "confidence": 0.62}, "drafts_generated": 1, "drafts_survived": 1}
{"id": "17e5d781-bd39-449e-847a-1af6acc80315", "target_id": "B1-treatment", "git_sha": "14ee414f2b5f75d522270ecdb485996c1dfc25fd", "pre_experiment_sha": "14ee414f2b5f75d522270ecdb485996c1dfc25fd", "timestamp": "2026-04-19T17:13:35.135898+00:00", "hypothesis": "Make the prompt more imperative and repetition-focused so the model always emits exactly one provided label with no extra text.", "hypothesis_source": "agent", "mutation_diff_summary": "", "score": 2.5, "score_ci_lower": 2.0, "score_ci_upper": 3.1, "raw_scores": [3.5, 2.0, 2.0, 2.0, 3.0], "baseline_score": 3.3, "outcome": "DISCARDED", "failure_mode": null, "duration_seconds": 14.957568041048944, "tags": ["single-label", "strict-output", "deterministic"], "learnings": "{\"what_changed\":\"\",\"what_improved\":[],\"what_regressed\":[],\"transferable_insight\":\"Making instructions more forceful and repetitive does not necessarily improve compliance with a strict output format, and can even degrade performance when the task requires precise constrained generation.\",\"domain_tags\":[\"prompt-engineering\",\"instruction-following\",\"output-formatting\"]}", "cost_usd": 0.009988150000000001, "bootstrap_seed": 0, "agent_model": "gpt-5.4", "held_out_score": null, "criterion_names": ["correct_category", "concise_output", "follows_format", "no_hallucination", "handles_ambiguity"], "per_criterion_scores": {"correct_category": 0.2, "concise_output": 1.0, "follows_format": 0.0, "no_hallucination": 0.3, "handles_ambiguity": 1.0}, "failure_classification": {"category": "output_format", "description": "The experiment targeted prompt/output formatting constraints (force exactly one provided label with no extra text), indicating the failure was due to the model not adhering to the required output structure/schema.", "fix_direction": "Make the output constraint more explicit in the prompt (e.g., strict one-line response, forbid any other tokens), and add decoding/post-processing validation to enforce exact label-only output.", "confidence": 0.78}, "drafts_generated": 1, "drafts_survived": 1}
{"id": "88059123-a03b-42d2-90b8-39747e2d37c7", "target_id": "B1-treatment", "git_sha": "d1f4c08e88ddd394e11f509cf62cde98931575c4", "pre_experiment_sha": "14ee414f2b5f75d522270ecdb485996c1dfc25fd", "timestamp": "2026-04-19T17:13:52.491593+00:00", "hypothesis": "Tightening the prompt to a repeated single-label-only mandate will improve deterministic one-label outputs.", "hypothesis_source": "agent", "mutation_diff_summary": "", "score": 2.8, "score_ci_lower": 2.4, "score_ci_upper": 3.2, "raw_scores": [3.0, 2.0, 2.5, 3.0, 3.5], "baseline_score": 3.3, "outcome": "KEPT", "failure_mode": null, "duration_seconds": 14.731787875061855, "tags": ["single-label", "deterministic", "strict-output"], "learnings": "{\"what_changed\":\"\",\"what_improved\":[],\"what_regressed\":[],\"transferable_insight\":\"When a task requires a single discrete output, explicitly constraining the format to one label can improve consistency by reducing ambiguity and output variance.\",\"domain_tags\":[\"prompt-engineering\",\"classification\",\"output-formatting\"]}", "cost_usd": 0.00987755, "bootstrap_seed": 0, "agent_model": "gpt-5.4", "held_out_score": null, "criterion_names": ["correct_category", "concise_output", "follows_format", "no_hallucination", "handles_ambiguity"], "per_criterion_scores": {"correct_category": 0.3, "concise_output": 1.0, "follows_format": 0.0, "no_hallucination": 0.6, "handles_ambiguity": 0.9}, "failure_classification": null, "drafts_generated": 1, "drafts_survived": 1}
{"id": "bc5b892d-f517-4be6-af7e-c58eb8e27511", "target_id": "B1-treatment", "git_sha": "454be9ee78706350b1b4fed47a49095f90d45384", "pre_experiment_sha": "d1f4c08e88ddd394e11f509cf62cde98931575c4", "timestamp": "2026-04-19T17:14:07.840312+00:00", "hypothesis": "Tightening the prompt to repeatedly enforce a single exact label with no extra text will improve deterministic one-label outputs.", "hypothesis_source": "agent", "mutation_diff_summary": "", "score": 2.2, "score_ci_lower": 1.6, "score_ci_upper": 2.7, "raw_scores": [1.0, 2.0, 2.5, 3.0, 2.5], "baseline_score": 2.8, "outcome": "KEPT", "failure_mode": null, "duration_seconds": 14.179211125010625, "tags": ["single-label", "strict-output", "determinism"], "learnings": "{\"what_changed\":\"\",\"what_improved\":[],\"what_regressed\":[],\"transferable_insight\":\"When a task requires a single discrete output, explicitly constraining the format to one exact label with no additional text can improve consistency and determinism.\",\"domain_tags\":[\"prompt-engineering\",\"classification\",\"output-formatting\"]}", "cost_usd": 0.01069255, "bootstrap_seed": 0, "agent_model": "gpt-5.4", "held_out_score": null, "criterion_names": ["correct_category", "concise_output", "follows_format", "no_hallucination", "handles_ambiguity"], "per_criterion_scores": {"correct_category": 0.2, "concise_output": 1.0, "follows_format": 0.0, "no_hallucination": 0.3, "handles_ambiguity": 0.7}, "failure_classification": null, "drafts_generated": 1, "drafts_survived": 1}
{"id": "879fd9b4-9051-4dc8-b48c-dd55aaec3f95", "target_id": "B1-treatment", "git_sha": "ec4d48369ecb3c3507aa2b08be0e578e420370a7", "pre_experiment_sha": "454be9ee78706350b1b4fed47a49095f90d45384", "timestamp": "2026-04-19T17:14:24.419974+00:00", "hypothesis": "Tightening the prompt to emphasize decisive single-label output and strict copying from the allowed set will improve binary criteria compliance.", "hypothesis_source": "agent", "mutation_diff_summary": "", "score": 3.1, "score_ci_lower": 2.6, "score_ci_upper": 3.6, "raw_scores": [2.5, 4.0, 2.5, 3.5, 3.0], "baseline_score": 2.2, "outcome": "KEPT", "failure_mode": null, "duration_seconds": 14.108173958025873, "tags": ["single-label", "strict-format", "decisiveness", "compliance"], "learnings": "{\"what_changed\":\"\",\"what_improved\":[],\"what_regressed\":[],\"transferable_insight\":\"When a task requires choosing from a fixed set, explicitly constraining the output format and insisting on exact label copying can improve compliance and reduce ambiguity.\",\"domain_tags\":[\"prompt-engineering\",\"classification\",\"output-formatting\"]}", "cost_usd": 0.01021255, "bootstrap_seed": 0, "agent_model": "gpt-5.4", "held_out_score": null, "criterion_names": ["correct_category", "concise_output", "follows_format", "no_hallucination", "handles_ambiguity"], "per_criterion_scores": {"correct_category": 0.5, "concise_output": 1.0, "follows_format": 0.0, "no_hallucination": 0.6, "handles_ambiguity": 1.0}, "failure_classification": null, "drafts_generated": 1, "drafts_survived": 1}
{"id": "9d700deb-df91-476b-9baf-56fd251a652c", "target_id": "B1-treatment", "git_sha": "0d50b463067704a12eaddc1b91ec84f1f0b81ded", "pre_experiment_sha": "ec4d48369ecb3c3507aa2b08be0e578e420370a7", "timestamp": "2026-04-19T17:14:38.933245+00:00", "hypothesis": "Tightening the prompt with explicit priority rules and strict output validation will improve single-label compliance.", "hypothesis_source": "agent", "mutation_diff_summary": "", "score": 2.8, "score_ci_lower": 2.3, "score_ci_upper": 3.2, "raw_scores": [3.0, 2.0, 3.0, 2.5, 3.5], "baseline_score": 3.1, "outcome": "KEPT", "failure_mode": null, "duration_seconds": 13.59702574997209, "tags": ["classification", "strict-output", "single-label"], "learnings": "{\"what_changed\":\"\",\"what_improved\":[],\"what_regressed\":[],\"transferable_insight\":\"When a task requires a single unambiguous choice, adding explicit priority rules and strict output validation can improve compliance by reducing ambiguity in the response format.\",\"domain_tags\":[\"prompting\",\"output-validation\",\"decision-rules\"]}", "cost_usd": 0.01136755, "bootstrap_seed": 0, "agent_model": "gpt-5.4", "held_out_score": null, "criterion_names": ["correct_category", "concise_output", "follows_format", "no_hallucination", "handles_ambiguity"], "per_criterion_scores": {"correct_category": 0.5, "concise_output": 1.0, "follows_format": 0.0, "no_hallucination": 0.4, "handles_ambiguity": 0.9}, "failure_classification": null, "drafts_generated": 1, "drafts_survived": 1}
{"id": "55fa50ec-bee3-4e6e-b698-8828a059aa55", "target_id": "B1-treatment", "git_sha": "cd8a4eba6e68a0100444a6ab7f524774e58a4d37", "pre_experiment_sha": "0d50b463067704a12eaddc1b91ec84f1f0b81ded", "timestamp": "2026-04-19T17:14:55.182902+00:00", "hypothesis": "Tightening the prompt with stronger priority and failure-mode constraints will improve single-label-only compliance.", "hypothesis_source": "agent", "mutation_diff_summary": "", "score": 3.0, "score_ci_lower": 2.7, "score_ci_upper": 3.3, "raw_scores": [2.5, 3.0, 3.5, 3.0, 3.0], "baseline_score": 2.8, "outcome": "KEPT", "failure_mode": null, "duration_seconds": 14.798099666950293, "tags": ["single-label", "strict-format", "priority-rules"], "learnings": "{\"what_changed\":\"\",\"what_improved\":[],\"what_regressed\":[],\"transferable_insight\":\"Making the primary objective and explicit failure conditions more prominent can improve adherence to a single required output format.\",\"domain_tags\":[\"prompt-engineering\",\"instruction-following\",\"output-formatting\"]}", "cost_usd": 0.01179755, "bootstrap_seed": 0, "agent_model": "gpt-5.4", "held_out_score": null, "criterion_names": ["correct_category", "concise_output", "follows_format", "no_hallucination", "handles_ambiguity"], "per_criterion_scores": {"correct_category": 0.3, "concise_output": 1.0, "follows_format": 0.0, "no_hallucination": 0.8, "handles_ambiguity": 0.9}, "failure_classification": null, "drafts_generated": 1, "drafts_survived": 1}
{"id": "eb54c20e-c17f-41af-a0c0-58f96d19054e", "target_id": "B1-treatment", "git_sha": "e99240af9c0f65f3f0c85d43d79306740f16e169", "pre_experiment_sha": "cd8a4eba6e68a0100444a6ab7f524774e58a4d37", "timestamp": "2026-04-19T17:15:13.721340+00:00", "hypothesis": "Tightening the prompt around decisive single-label output and instruction hierarchy will improve binary criteria compliance.", "hypothesis_source": "agent", "mutation_diff_summary": "", "score": 2.7, "score_ci_lower": 2.3, "score_ci_upper": 3.2, "raw_scores": [3.5, 2.5, 3.0, 2.5, 2.0], "baseline_score": 3.0, "outcome": "KEPT", "failure_mode": null, "duration_seconds": 15.768292041961104, "tags": ["single-label", "strict-format", "ambiguity-handling", "instruction-priority"], "learnings": "{\"what_changed\":\"\",\"what_improved\":[],\"what_regressed\":[],\"transferable_insight\":\"Clearer instruction hierarchy and forcing a single decisive output can improve compliance with binary decision tasks by reducing ambiguity.\",\"domain_tags\":[\"prompting\",\"instruction-following\",\"classification\"]}", "cost_usd": 0.012517550000000002, "bootstrap_seed": 0, "agent_model": "gpt-5.4", "held_out_score": null, "criterion_names": ["correct_category", "concise_output", "follows_format", "no_hallucination", "handles_ambiguity"], "per_criterion_scores": {"correct_category": 0.3, "concise_output": 1.0, "follows_format": 0.0, "no_hallucination": 0.4, "handles_ambiguity": 1.0}, "failure_classification": null, "drafts_generated": 1, "drafts_survived": 1}
{"id": "2c25d63b-e1ec-4963-b65c-b49e70fdd23a", "target_id": "B1-treatment", "git_sha": "71e116ba4a0c312d2c408c4436086476aaf240a5", "pre_experiment_sha": "e99240af9c0f65f3f0c85d43d79306740f16e169", "timestamp": "2026-04-19T17:15:29.470476+00:00", "hypothesis": "Tightening the prompt around single-label exclusivity and exact copying will improve binary criteria adherence.", "hypothesis_source": "agent", "mutation_diff_summary": "", "score": 3.0, "score_ci_lower": 2.4, "score_ci_upper": 3.5, "raw_scores": [2.5, 2.0, 3.5, 3.5, 3.5], "baseline_score": 2.7, "outcome": "KEPT", "failure_mode": null, "duration_seconds": 13.672239916049875, "tags": ["single-label", "exact-match", "output-constraint"], "learnings": "{\"what_changed\":\"\",\"what_improved\":[],\"what_regressed\":[],\"transferable_insight\":\"Explicitly stating mutually exclusive labels and requiring exact copying can improve adherence to binary decision criteria without changing the underlying task.\",\"domain_tags\":[\"prompting\",\"classification\",\"instruction-following\"]}", "cost_usd": 0.011992550000000001, "bootstrap_seed": 0, "agent_model": "gpt-5.4", "held_out_score": null, "criterion_names": ["correct_category", "concise_output", "follows_format", "no_hallucination", "handles_ambiguity"], "per_criterion_scores": {"correct_category": 0.5, "concise_output": 1.0, "follows_format": 0.0, "no_hallucination": 0.5, "handles_ambiguity": 1.0}, "failure_classification": null, "drafts_generated": 1, "drafts_survived": 1}
{"id": "a56e4e86-0837-4b19-b75d-b7355036a48a", "target_id": "B1-treatment", "git_sha": "aed009c824767d0580259d3a66ec4dbfea7c69de", "pre_experiment_sha": "71e116ba4a0c312d2c408c4436086476aaf240a5", "timestamp": "2026-04-19T17:15:45.773356+00:00", "hypothesis": "Tighten the prompt to prioritize single-label output and forbid any non-label tokens under all ambiguity conditions.", "hypothesis_source": "agent", "mutation_diff_summary": "", "score": 3.0, "score_ci_lower": 2.6, "score_ci_upper": 3.4, "raw_scores": [3.5, 2.5, 3.0, 2.5, 3.5], "baseline_score": 3.0, "outcome": "KEPT", "failure_mode": null, "duration_seconds": 14.863047958933748, "tags": ["single-label", "strict-format", "decisive"], "learnings": "{\"what_changed\":\"\",\"what_improved\":[],\"what_regressed\":[],\"transferable_insight\":\"When the desired output is a single categorical choice, explicitly constrain the format to one label only and prohibit any extra tokens to reduce ambiguity-driven drift.\",\"domain_tags\":[\"prompt-engineering\",\"classification\",\"output-formatting\"]}", "cost_usd": 0.01319255, "bootstrap_seed": 0, "agent_model": "gpt-5.4", "held_out_score": null, "criterion_names": ["correct_category", "concise_output", "follows_format", "no_hallucination", "handles_ambiguity"], "per_criterion_scores": {"correct_category": 0.6, "concise_output": 1.0, "follows_format": 0.0, "no_hallucination": 0.5, "handles_ambiguity": 0.9}, "failure_classification": null, "drafts_generated": 1, "drafts_survived": 1}
{"id": "f9bc4aeb-2d84-4982-b8aa-b8c79a0a7ee2", "target_id": "B1-treatment", "git_sha": "489954bdfec50425a30bc7fbd8deff472afe5e0c", "pre_experiment_sha": "aed009c824767d0580259d3a66ec4dbfea7c69de", "timestamp": "2026-04-19T17:16:01.975364+00:00", "hypothesis": "Tighten the prompt into a shorter, higher-priority one-label contract with explicit prohibition of any non-label token.", "hypothesis_source": "agent", "mutation_diff_summary": "", "score": 3.0, "score_ci_lower": 2.6, "score_ci_upper": 3.5, "raw_scores": [4.0, 2.5, 2.5, 3.0, 3.0], "baseline_score": 3.0, "outcome": "KEPT", "failure_mode": null, "duration_seconds": 13.359057041932829, "tags": ["concise", "strict-output", "classification"], "learnings": "{\"what_changed\":\"\",\"what_improved\":[],\"what_regressed\":[],\"transferable_insight\":\"When the desired output is highly constrained, making the instruction shorter, more explicit, and strictly exclusive can improve compliance by reducing ambiguity and competing directives.\",\"domain_tags\":[\"prompt-engineering\",\"instruction-design\",\"output-control\"]}", "cost_usd": 0.01179255, "bootstrap_seed": 0, "agent_model": "gpt-5.4", "held_out_score": null, "criterion_names": ["correct_category", "concise_output", "follows_format", "no_hallucination", "handles_ambiguity"], "per_criterion_scores": {"correct_category": 0.4, "concise_output": 1.0, "follows_format": 0.0, "no_hallucination": 0.6, "handles_ambiguity": 1.0}, "failure_classification": null, "drafts_generated": 1, "drafts_survived": 1}
{"id": "0a165047-64b6-4c96-a543-288f22075073", "target_id": "B1-treatment", "git_sha": "bffd2770bfbd1265c4273b16fb3a90864110a722", "pre_experiment_sha": "489954bdfec50425a30bc7fbd8deff472afe5e0c", "timestamp": "2026-04-19T17:16:17.190659+00:00", "hypothesis": "Make the prompt shorter and more forceful so it strongly enforces one exact allowed label with no extra output.", "hypothesis_source": "agent", "mutation_diff_summary": "", "score": 3.4, "score_ci_lower": 3.1, "score_ci_upper": 3.7, "raw_scores": [3.0, 3.0, 3.5, 3.5, 4.0], "baseline_score": 3.0, "outcome": "KEPT", "failure_mode": null, "duration_seconds": 13.887405124958605, "tags": ["concise", "constraint-tightening", "single-label"], "learnings": "{\"what_changed\":\"\",\"what_improved\":[],\"what_regressed\":[],\"transferable_insight\":\"When the desired output must be exact and constrained, shorter and more forceful instructions can improve compliance by reducing ambiguity and discouraging extra text.\",\"domain_tags\":[\"prompt-engineering\",\"instruction-following\",\"output-formatting\"]}", "cost_usd": 0.01095755, "bootstrap_seed": 0, "agent_model": "gpt-5.4", "held_out_score": null, "criterion_names": ["correct_category", "concise_output", "follows_format", "no_hallucination", "handles_ambiguity"], "per_criterion_scores": {"correct_category": 0.6, "concise_output": 1.0, "follows_format": 0.0, "no_hallucination": 0.8, "handles_ambiguity": 1.0}, "failure_classification": null, "drafts_generated": 1, "drafts_survived": 1}
{"id": "7411c7ca-d31f-4c76-890d-a0110adf9576", "target_id": "B1-treatment", "git_sha": "bffd2770bfbd1265c4273b16fb3a90864110a722", "pre_experiment_sha": "bffd2770bfbd1265c4273b16fb3a90864110a722", "timestamp": "2026-04-19T17:16:33.785049+00:00", "hypothesis": "Strengthen the prompt by making the one-label-only requirement more redundant, explicit, and failure-intolerant.", "hypothesis_source": "agent", "mutation_diff_summary": "", "score": 3.0, "score_ci_lower": 2.4, "score_ci_upper": 3.5, "raw_scores": [3.5, 2.0, 3.5, 3.5, 2.5], "baseline_score": 3.4, "outcome": "DISCARDED", "failure_mode": null, "duration_seconds": 15.414772541960701, "tags": ["single-label", "strict-format", "redundancy"], "learnings": "{\"what_changed\":\"\",\"what_improved\":[],\"what_regressed\":[],\"transferable_insight\":\"Making a constraint more repetitive and explicit does not necessarily improve outcomes if the underlying task framing or signal quality is unchanged; clarity must add new information or enforcement, not just redundancy.\",\"domain_tags\":[\"prompt-engineering\",\"instruction-design\",\"evaluation\"]}", "cost_usd": 0.013312550000000001, "bootstrap_seed": 0, "agent_model": "gpt-5.4", "held_out_score": null, "criterion_names": ["correct_category", "concise_output", "follows_format", "no_hallucination", "handles_ambiguity"], "per_criterion_scores": {"correct_category": 0.4, "concise_output": 1.0, "follows_format": 0.0, "no_hallucination": 0.7, "handles_ambiguity": 0.9}, "failure_classification": {"category": "semantic_drift", "description": "The prompt was strengthened as requested, but the change appears to have altered meaning/behavior in an unintended way (or failed to enforce the intended constraint), indicating the output still met the format while violating the intended one-label-only requirement implicitly.", "fix_direction": "Rephrase the constraint more redundantly and explicitly (e.g., repeat the rule verbatim, add negative examples and explicit rejection criteria), and verify the model always produces exactly one label with no additional text.", "confidence": 0.42}, "drafts_generated": 1, "drafts_survived": 1}
