{"id": "f7b37013-4951-40ee-a7c7-763530fbe6a9", "target_id": "B1-treatment", "git_sha": "e449812a5764bef2ba53158dd706684fa5251732", "pre_experiment_sha": "6e966074725e6c07a8f0c340d3d219dc3d1305fc", "timestamp": "2026-04-19T01:43:01.287368+00:00", "hypothesis": "A single-line command that explicitly restricts output to one provided label may reduce output-format errors without harming classification.", "hypothesis_source": "agent", "mutation_diff_summary": "", "score": 3.1, "score_ci_lower": 2.7, "score_ci_upper": 3.5, "raw_scores": [3.5, 2.5, 3.5, 3.5, 2.5], "baseline_score": 3.4, "outcome": "KEPT", "failure_mode": null, "duration_seconds": 10.104779292014427, "tags": ["minimal", "exact-output", "single-choice", "format-compliance"], "learnings": "{\"what_changed\":\"\",\"what_improved\":[],\"what_regressed\":[],\"transferable_insight\":\"Explicitly constraining the allowed output to a single predefined label can improve format compliance without necessarily changing the underlying decision quality.\",\"domain_tags\":[\"prompting\",\"output-formatting\",\"classification\"]}", "cost_usd": 0.014717550000000001, "bootstrap_seed": 0, "agent_model": "gpt-5.4", "held_out_score": null, "criterion_names": ["correct_category", "concise_output", "follows_format", "no_hallucination", "handles_ambiguity"], "per_criterion_scores": {"correct_category": 0.5, "concise_output": 1.0, "follows_format": 0.0, "no_hallucination": 0.6, "handles_ambiguity": 1.0}, "failure_classification": null, "drafts_generated": 1, "drafts_survived": 1}
{"id": "803151bf-2d46-4855-ad6a-b2908a01cacf", "target_id": "B1-treatment", "git_sha": "6abb333e29e07b1fd8f87cebe22820d00a284ace", "pre_experiment_sha": "e449812a5764bef2ba53158dd706684fa5251732", "timestamp": "2026-04-19T01:43:13.720856+00:00", "hypothesis": "A slightly stricter one-line exact-match contract may reduce output-format errors without hurting label selection.", "hypothesis_source": "agent", "mutation_diff_summary": "", "score": 3.3, "score_ci_lower": 3.0, "score_ci_upper": 3.7, "raw_scores": [3.0, 3.0, 3.0, 3.5, 4.0], "baseline_score": 3.1, "outcome": "KEPT", "failure_mode": null, "duration_seconds": 9.828110791975632, "tags": ["minimal", "exact-output", "deterministic", "single-choice", "format-compliance"], "learnings": "{\"what_changed\":\"\",\"what_improved\":[],\"what_regressed\":[],\"transferable_insight\":\"Tightening output-format constraints can improve compliance without necessarily changing the underlying decision quality.\",\"domain_tags\":[\"prompting\",\"output-formatting\",\"evaluation\"]}", "cost_usd": 0.014632550000000001, "bootstrap_seed": 0, "agent_model": "gpt-5.4", "held_out_score": null, "criterion_names": ["correct_category", "concise_output", "follows_format", "no_hallucination", "handles_ambiguity"], "per_criterion_scores": {"correct_category": 0.5, "concise_output": 1.0, "follows_format": 0.0, "no_hallucination": 0.8, "handles_ambiguity": 1.0}, "failure_classification": null, "drafts_generated": 1, "drafts_survived": 1}
{"id": "25290478-0f6b-4f06-a11e-3fe7fb1662f8", "target_id": "B1-treatment", "git_sha": "4337690c83f8fc7a44439a16dd57c18d07c58a75", "pre_experiment_sha": "6abb333e29e07b1fd8f87cebe22820d00a284ace", "timestamp": "2026-04-19T01:43:24.800117+00:00", "hypothesis": "A shorter imperative using \u201cReturn\u201d may improve exact single-label format compliance.", "hypothesis_source": "agent", "mutation_diff_summary": "", "score": 3.1, "score_ci_lower": 2.5, "score_ci_upper": 3.6, "raw_scores": [3.0, 3.0, 3.5, 4.0, 2.0], "baseline_score": 3.3, "outcome": "KEPT", "failure_mode": null, "duration_seconds": 9.991343125002459, "tags": ["minimal", "exact-output", "deterministic", "format-compliance"], "learnings": "{\"what_changed\":\"\",\"what_improved\":[],\"what_regressed\":[],\"transferable_insight\":\"Using a shorter, more direct imperative can improve adherence to a required output format even when the content itself does not change.\",\"domain_tags\":[\"prompting\",\"format-compliance\",\"instruction-design\"]}", "cost_usd": 0.014317550000000002, "bootstrap_seed": 0, "agent_model": "gpt-5.4", "held_out_score": null, "criterion_names": ["correct_category", "concise_output", "follows_format", "no_hallucination", "handles_ambiguity"], "per_criterion_scores": {"correct_category": 0.5, "concise_output": 1.0, "follows_format": 0.0, "no_hallucination": 0.7, "handles_ambiguity": 0.9}, "failure_classification": null, "drafts_generated": 1, "drafts_survived": 1}
{"id": "face275d-90cd-4df3-8bdd-32c6bfeff2e3", "target_id": "B1-treatment", "git_sha": "c3fa3c55254e145bcf059fd4e43d685fa5835d1f", "pre_experiment_sha": "4337690c83f8fc7a44439a16dd57c18d07c58a75", "timestamp": "2026-04-19T01:43:36.120943+00:00", "hypothesis": "A shorter exact-label constraint using \u201cOutput\u201d may improve one-label format compliance.", "hypothesis_source": "agent", "mutation_diff_summary": "", "score": 3.2, "score_ci_lower": 2.8, "score_ci_upper": 3.6, "raw_scores": [4.0, 2.5, 3.0, 3.5, 3.0], "baseline_score": 3.1, "outcome": "KEPT", "failure_mode": null, "duration_seconds": 10.153472583042458, "tags": ["minimal", "exact-output", "single-choice", "format-compliance"], "learnings": "{\"what_changed\":\"\",\"what_improved\":[],\"what_regressed\":[],\"transferable_insight\":\"Using a shorter, more direct label constraint can improve compliance with a required output format without changing the underlying task.\",\"domain_tags\":[\"prompting\",\"format-compliance\",\"instruction-design\"]}", "cost_usd": 0.014207550000000001, "bootstrap_seed": 0, "agent_model": "gpt-5.4", "held_out_score": null, "criterion_names": ["correct_category", "concise_output", "follows_format", "no_hallucination", "handles_ambiguity"], "per_criterion_scores": {"correct_category": 0.5, "concise_output": 1.0, "follows_format": 0.0, "no_hallucination": 0.7, "handles_ambiguity": 1.0}, "failure_classification": null, "drafts_generated": 1, "drafts_survived": 1}
{"id": "e03ec8fe-f4fd-4313-b6e2-8b0a8ea22b02", "target_id": "B1-treatment", "git_sha": "c3fa3c55254e145bcf059fd4e43d685fa5835d1f", "pre_experiment_sha": "c3fa3c55254e145bcf059fd4e43d685fa5835d1f", "timestamp": "2026-04-19T01:43:49.031471+00:00", "hypothesis": "An ultra-direct exact-output rule that forbids any non-label text may reduce output_format errors.", "hypothesis_source": "agent", "mutation_diff_summary": "", "score": 2.8, "score_ci_lower": 2.4, "score_ci_upper": 3.2, "raw_scores": [2.0, 2.5, 3.0, 3.5, 3.0], "baseline_score": 3.2, "outcome": "DISCARDED", "failure_mode": null, "duration_seconds": 10.799503082991578, "tags": ["minimal", "exact-output", "deterministic", "format-compliance"], "learnings": "{\"what_changed\":\"\",\"what_improved\":[],\"what_regressed\":[\"correct_category: FAIL (was PASS)\"],\"transferable_insight\":\"Making instructions overly restrictive can reduce one kind of error while introducing worse errors, so optimize for the target metric rather than maximal constraint.\",\"domain_tags\":[\"prompt-design\",\"evaluation\",\"robustness\"]}", "cost_usd": 0.014122550000000001, "bootstrap_seed": 0, "agent_model": "gpt-5.4", "held_out_score": null, "criterion_names": ["correct_category", "concise_output", "follows_format", "no_hallucination", "handles_ambiguity"], "per_criterion_scores": {"correct_category": 0.4, "concise_output": 1.0, "follows_format": 0.0, "no_hallucination": 0.5, "handles_ambiguity": 0.9}, "failure_classification": {"category": "output_format", "description": "The attempt did not reliably produce the exact required output structure (likely inserted non-label text or violated the strict formatting constraints), leading to continued output_format errors.", "fix_direction": "Tighten the generation to output only the allowed label text (no prefixes/suffixes/extra whitespace beyond what the schema permits) and add explicit formatting checks/post-processing to ensure strict schema compliance.", "confidence": 0.74}, "drafts_generated": 1, "drafts_survived": 1}
{"id": "67acaefd-83e3-4414-9fe4-bce13c16675e", "target_id": "B1-treatment", "git_sha": "4389c8c49e97bce389c7ac49143eebfa01b56304", "pre_experiment_sha": "c3fa3c55254e145bcf059fd4e43d685fa5835d1f", "timestamp": "2026-04-19T01:44:02.309614+00:00", "hypothesis": "A more explicit one-line exact-output contract may improve format compliance while preserving label accuracy.", "hypothesis_source": "agent", "mutation_diff_summary": "", "score": 2.9, "score_ci_lower": 2.6, "score_ci_upper": 3.2, "raw_scores": [3.0, 2.5, 3.5, 2.5, 3.0], "baseline_score": 3.2, "outcome": "KEPT", "failure_mode": null, "duration_seconds": 10.633685000007972, "tags": ["minimal", "exact-output", "deterministic", "single-choice", "format-compliance"], "learnings": "{\"what_changed\":\"\",\"what_improved\":[],\"what_regressed\":[],\"transferable_insight\":\"Making the required output format more explicit and exact can improve compliance without necessarily changing the underlying correctness of the content.\",\"domain_tags\":[\"prompting\",\"format-compliance\",\"instruction-design\"]}", "cost_usd": 0.014112550000000001, "bootstrap_seed": 0, "agent_model": "gpt-5.4", "held_out_score": null, "criterion_names": ["correct_category", "concise_output", "follows_format", "no_hallucination", "handles_ambiguity"], "per_criterion_scores": {"correct_category": 0.4, "concise_output": 1.0, "follows_format": 0.0, "no_hallucination": 0.6, "handles_ambiguity": 0.9}, "failure_classification": null, "drafts_generated": 1, "drafts_survived": 1}
{"id": "409d4243-f1fa-4215-8584-487298f2e9d7", "target_id": "B1-treatment", "git_sha": "5d3a45821d17c170ebd681b1b3bb8cb32629c6e9", "pre_experiment_sha": "4389c8c49e97bce389c7ac49143eebfa01b56304", "timestamp": "2026-04-19T01:44:18.418319+00:00", "hypothesis": "A terser exact-label instruction using \u201cOutput\u201d and \u201conly\u201d may improve strict format compliance.", "hypothesis_source": "agent", "mutation_diff_summary": "", "score": 2.9, "score_ci_lower": 2.6, "score_ci_upper": 3.2, "raw_scores": [3.0, 2.5, 2.5, 3.0, 3.5], "baseline_score": 2.9, "outcome": "KEPT", "failure_mode": null, "duration_seconds": 14.966017749975435, "tags": ["minimal", "exact-output", "deterministic", "format-compliance"], "learnings": "{\"what_changed\":\"\",\"what_improved\":[],\"what_regressed\":[],\"transferable_insight\":\"Using a concise, explicit instruction that names the required output and restricts responses to only that format can improve compliance with strict formatting constraints.\",\"domain_tags\":[\"prompting\",\"instruction-following\",\"format-compliance\"]}", "cost_usd": 0.01401255, "bootstrap_seed": 0, "agent_model": "gpt-5.4", "held_out_score": null, "criterion_names": ["correct_category", "concise_output", "follows_format", "no_hallucination", "handles_ambiguity"], "per_criterion_scores": {"correct_category": 0.3, "concise_output": 1.0, "follows_format": 0.0, "no_hallucination": 0.6, "handles_ambiguity": 1.0}, "failure_classification": null, "drafts_generated": 1, "drafts_survived": 1}
{"id": "32647e5f-784e-40cc-b59a-19c6153cfbf2", "target_id": "B1-treatment", "git_sha": "ba1025858836441de4ad175f5a4c7e391b07be5d", "pre_experiment_sha": "5d3a45821d17c170ebd681b1b3bb8cb32629c6e9", "timestamp": "2026-04-19T01:44:38.027313+00:00", "hypothesis": "A single-line imperative that requires exactly one allowed label and nothing else may improve format compliance.", "hypothesis_source": "agent", "mutation_diff_summary": "", "score": 3.2, "score_ci_lower": 2.8, "score_ci_upper": 3.6, "raw_scores": [3.5, 3.0, 2.5, 4.0, 3.0], "baseline_score": 2.9, "outcome": "KEPT", "failure_mode": null, "duration_seconds": 17.196044416050427, "tags": ["minimal", "exact-output", "deterministic", "format-compliance"], "learnings": "{\"what_changed\":\"\",\"what_improved\":[\"correct_category: PASS (was FAIL)\"],\"what_regressed\":[],\"transferable_insight\":\"When a task is constrained to a single explicit action with no extra content, compliance with the required format tends to improve.\",\"domain_tags\":[\"instruction-following\",\"format-compliance\",\"prompt-design\"]}", "cost_usd": 0.014067550000000002, "bootstrap_seed": 0, "agent_model": "gpt-5.4", "held_out_score": null, "criterion_names": ["correct_category", "concise_output", "follows_format", "no_hallucination", "handles_ambiguity"], "per_criterion_scores": {"correct_category": 0.6, "concise_output": 1.0, "follows_format": 0.0, "no_hallucination": 0.7, "handles_ambiguity": 0.9}, "failure_classification": null, "drafts_generated": 1, "drafts_survived": 1}
{"id": "2856d674-5a20-4003-b8ca-bd5acf05e4fd", "target_id": "B1-treatment", "git_sha": "ba1025858836441de4ad175f5a4c7e391b07be5d", "pre_experiment_sha": "ba1025858836441de4ad175f5a4c7e391b07be5d", "timestamp": "2026-04-19T01:44:58.728053+00:00", "hypothesis": "A stricter single-line command emphasizing one allowed label and nothing else may reduce output_format errors.", "hypothesis_source": "agent", "mutation_diff_summary": "", "score": 2.8, "score_ci_lower": 2.4, "score_ci_upper": 3.2, "raw_scores": [2.0, 3.0, 3.0, 3.5, 2.5], "baseline_score": 3.2, "outcome": "DISCARDED", "failure_mode": null, "duration_seconds": 19.54540904192254, "tags": ["minimal", "exact-output", "deterministic", "format-compliance"], "learnings": "{\"what_changed\":\"\",\"what_improved\":[],\"what_regressed\":[\"correct_category: FAIL (was PASS)\"],\"transferable_insight\":\"Overly restrictive instructions can backfire by reducing the model\u2019s ability to choose the correct label, even when they aim to improve format compliance.\",\"domain_tags\":[\"prompt-engineering\",\"classification\",\"output-formatting\"]}", "cost_usd": 0.014366150000000001, "bootstrap_seed": 0, "agent_model": "gpt-5.4", "held_out_score": null, "criterion_names": ["correct_category", "concise_output", "follows_format", "no_hallucination", "handles_ambiguity"], "per_criterion_scores": {"correct_category": 0.3, "concise_output": 1.0, "follows_format": 0.0, "no_hallucination": 0.7, "handles_ambiguity": 0.8}, "failure_classification": {"category": "output_format", "description": "The experiment appears to have failed due to the produced output not matching the required output structure/schema (i.e., an output_format error). Despite attempting stricter single-line formatting, the response still likely violated the expected schema/fields or formatting constraints.", "fix_direction": "Lock the output to the exact required schema (field names, ordering, required vs optional fields), validate against the expected JSON/format at generation time, and remove any extra text beyond the schema.", "confidence": 0.62}, "drafts_generated": 1, "drafts_survived": 1}
{"id": "af4ab29c-c657-44be-b670-41fc52b4810a", "target_id": "B1-treatment", "git_sha": "ba1025858836441de4ad175f5a4c7e391b07be5d", "pre_experiment_sha": "ba1025858836441de4ad175f5a4c7e391b07be5d", "timestamp": "2026-04-19T01:45:16.315295+00:00", "hypothesis": "A slightly more explicit exact-output command may reduce output_format errors without hurting label selection.", "hypothesis_source": "agent", "mutation_diff_summary": "", "score": 2.9, "score_ci_lower": 2.1, "score_ci_upper": 3.6, "raw_scores": [4.0, 1.5, 3.0, 3.5, 2.5], "baseline_score": 3.2, "outcome": "DISCARDED", "failure_mode": null, "duration_seconds": 14.501393874990754, "tags": ["minimal", "exact-output", "deterministic", "format-compliance"], "learnings": "{\"what_changed\":\"\",\"what_improved\":[\"correct_category: PASS (was FAIL)\"],\"what_regressed\":[\"no_hallucination: FAIL (was PASS)\"],\"transferable_insight\":\"Making instructions more explicit can improve compliance with the requested classification, but it may also increase the risk of introducing unsupported details, so precision gains should be balanced against hallucination risk.\",\"domain_tags\":[\"instruction-following\",\"classification\",\"hallucination-risk\"]}", "cost_usd": 0.01450095, "bootstrap_seed": 0, "agent_model": "gpt-5.4", "held_out_score": null, "criterion_names": ["correct_category", "concise_output", "follows_format", "no_hallucination", "handles_ambiguity"], "per_criterion_scores": {"correct_category": 0.6, "concise_output": 1.0, "follows_format": 0.0, "no_hallucination": 0.4, "handles_ambiguity": 0.9}, "failure_classification": {"category": "output_format", "description": "The run failed due to output_format errors, indicating the model\u2019s response did not conform to the required exact output structure/schema, despite the hypothesis aiming to make the command more explicit.", "fix_direction": "Increase strictness of the formatting instructions (e.g., explicit JSON/field order, required keys, and exact quoting), and add a post-check step or self-verification to ensure the response matches the schema exactly before finalizing.", "confidence": 0.42}, "drafts_generated": 1, "drafts_survived": 1}
{"id": "4bbd77d5-4a7e-4ab6-b264-a9334291a7bf", "target_id": "B1-treatment", "git_sha": "ba1025858836441de4ad175f5a4c7e391b07be5d", "pre_experiment_sha": "ba1025858836441de4ad175f5a4c7e391b07be5d", "timestamp": "2026-04-19T01:45:30.696367+00:00", "hypothesis": "A terser exact-output command with \u201cnothing else\u201d may improve strict format compliance.", "hypothesis_source": "agent", "mutation_diff_summary": "", "score": 3.1, "score_ci_lower": 2.5, "score_ci_upper": 3.7, "raw_scores": [3.0, 2.0, 3.0, 3.5, 4.0], "baseline_score": 3.2, "outcome": "DISCARDED", "failure_mode": null, "duration_seconds": 10.165575374965556, "tags": ["minimal", "exact-output", "deterministic", "format-compliance"], "learnings": "{\"what_changed\":\"\",\"what_improved\":[\"no_hallucination: PASS (was FAIL)\"],\"what_regressed\":[],\"transferable_insight\":\"When a task requires strict output formatting, minimizing instructions to the exact required content can reduce extraneous generation and improve compliance.\",\"domain_tags\":[\"prompting\",\"format-compliance\",\"instruction-design\"]}", "cost_usd": 0.01459055, "bootstrap_seed": 0, "agent_model": "gpt-5.4", "held_out_score": null, "criterion_names": ["correct_category", "concise_output", "follows_format", "no_hallucination", "handles_ambiguity"], "per_criterion_scores": {"correct_category": 0.6, "concise_output": 1.0, "follows_format": 0.0, "no_hallucination": 0.6, "handles_ambiguity": 0.9}, "failure_classification": {"category": "output_format", "description": "The experiment aimed to improve strict format compliance with a terser exact-output command, but the attempt still resulted in a failed strict-format requirement (schema/structure not met).", "fix_direction": "Tighten and verify the exact output schema/fields (including required keys, ordering if applicable, and exact formatting), and add validation against the expected structure before returning.", "confidence": 0.74}, "drafts_generated": 1, "drafts_survived": 1}
{"id": "a1f7fddf-1557-4bdc-8a28-fc9799fd38c4", "target_id": "B1-treatment", "git_sha": "4f7e37ac36eac09e66c915d5c357ca941eb0d793", "pre_experiment_sha": "ba1025858836441de4ad175f5a4c7e391b07be5d", "timestamp": "2026-04-19T01:45:43.000465+00:00", "hypothesis": "A shorter imperative that explicitly restricts output to one allowed label may improve strict format compliance without hurting classification.", "hypothesis_source": "agent", "mutation_diff_summary": "", "score": 3.5, "score_ci_lower": 3.2, "score_ci_upper": 3.8, "raw_scores": [4.0, 3.5, 3.5, 3.0, 3.5], "baseline_score": 3.2, "outcome": "KEPT", "failure_mode": null, "duration_seconds": 9.75471800006926, "tags": ["minimal", "exact-output", "deterministic", "format-compliance"], "learnings": "{\"what_changed\":\"\",\"what_improved\":[],\"what_regressed\":[],\"transferable_insight\":\"When the task has a fixed set of valid outputs, making the instruction shorter and explicitly constraining the response to one allowed label can improve format adherence without reducing task quality.\",\"domain_tags\":[\"prompting\",\"classification\",\"format-compliance\"]}", "cost_usd": 0.014637550000000003, "bootstrap_seed": 0, "agent_model": "gpt-5.4", "held_out_score": null, "criterion_names": ["correct_category", "concise_output", "follows_format", "no_hallucination", "handles_ambiguity"], "per_criterion_scores": {"correct_category": 0.8, "concise_output": 1.0, "follows_format": 0.0, "no_hallucination": 0.7, "handles_ambiguity": 1.0}, "failure_classification": null, "drafts_generated": 1, "drafts_survived": 1}
