{"id": "076a54d4-7e43-4608-ab82-208172529d41", "target_id": "B1-treatment", "git_sha": "b8fdc96a01421b5eee037cb7cf337d4d212dd8e2", "pre_experiment_sha": "b8fdc96a01421b5eee037cb7cf337d4d212dd8e2", "timestamp": "2026-04-19T01:40:18.840755+00:00", "hypothesis": "A stricter exact-output contract will reduce format violations and improve single-label compliance.", "hypothesis_source": "agent", "mutation_diff_summary": "", "score": 2.8, "score_ci_lower": 2.5, "score_ci_upper": 3.2, "raw_scores": [3.0, 2.5, 2.5, 2.5, 3.5], "baseline_score": 3.1, "outcome": "DISCARDED", "failure_mode": null, "duration_seconds": 10.58354150003288, "tags": ["minimal", "exact-output", "deterministic"], "learnings": "{\"what_changed\":\"\",\"what_improved\":[],\"what_regressed\":[],\"transferable_insight\":\"Tightening output constraints does not guarantee better compliance when the task or evaluation setup does not align with the model\u2019s ability to reliably follow the stricter format.\",\"domain_tags\":[\"evaluation\",\"instruction-following\",\"output-formatting\"]}", "cost_usd": 0.00524495, "bootstrap_seed": 0, "agent_model": "gpt-5.4", "held_out_score": null, "criterion_names": ["correct_category", "concise_output", "follows_format", "no_hallucination", "handles_ambiguity"], "per_criterion_scores": {"correct_category": 0.5, "concise_output": 1.0, "follows_format": 0.0, "no_hallucination": 0.5, "handles_ambiguity": 0.8}, "failure_classification": {"category": "output_format", "description": "The experiment failed due to format-related violations\u2014suggesting the stricter exact-output contract did not successfully enforce the required output structure/schema, leading to malformed or nonconforming responses.", "fix_direction": "Tighten and validate output schema enforcement (e.g., strict JSON/field presence checks), add formatting-focused tests/validators, and ensure the model is instructed to always emit the exact required structure without extra/missing fields.", "confidence": 0.72}, "drafts_generated": 1, "drafts_survived": 1}
{"id": "40407e0a-b4cd-4970-ad56-abfc53a7d624", "target_id": "B1-treatment", "git_sha": "8f93e0701a70eead39934966b04316ece5c616f9", "pre_experiment_sha": "b8fdc96a01421b5eee037cb7cf337d4d212dd8e2", "timestamp": "2026-04-19T01:40:32.016013+00:00", "hypothesis": "A stricter exact-output contract will reduce extraneous text and improve single-label compliance.", "hypothesis_source": "agent", "mutation_diff_summary": "", "score": 3.0, "score_ci_lower": 2.2, "score_ci_upper": 3.6, "raw_scores": [3.0, 1.5, 4.0, 3.5, 3.0], "baseline_score": 3.1, "outcome": "KEPT", "failure_mode": null, "duration_seconds": 10.57507770799566, "tags": ["minimal", "exact-output", "deterministic"], "learnings": "{\"what_changed\":\"\",\"what_improved\":[],\"what_regressed\":[],\"transferable_insight\":\"Tightening output constraints can reduce extraneous content and improve adherence to a required format, even when overall quality metrics do not change noticeably.\",\"domain_tags\":[\"prompting\",\"output-formatting\",\"evaluation\"]}", "cost_usd": 0.005254750000000001, "bootstrap_seed": 0, "agent_model": "gpt-5.4", "held_out_score": null, "criterion_names": ["correct_category", "concise_output", "follows_format", "no_hallucination", "handles_ambiguity"], "per_criterion_scores": {"correct_category": 0.4, "concise_output": 1.0, "follows_format": 0.0, "no_hallucination": 0.7, "handles_ambiguity": 0.9}, "failure_classification": null, "drafts_generated": 1, "drafts_survived": 1}
{"id": "c611e7de-317e-486a-9d4c-cde85f7b42d1", "target_id": "B1-treatment", "git_sha": "d513aab0398ec417c0794f4b7d5d8ff7ae5cd9bd", "pre_experiment_sha": "8f93e0701a70eead39934966b04316ece5c616f9", "timestamp": "2026-04-19T01:40:46.408856+00:00", "hypothesis": "A shorter exact-output contract will reduce stochastic formatting errors and improve single-label compliance.", "hypothesis_source": "agent", "mutation_diff_summary": "", "score": 3.0, "score_ci_lower": 2.5, "score_ci_upper": 3.4, "raw_scores": [3.5, 2.0, 3.5, 3.0, 3.0], "baseline_score": 3.0, "outcome": "KEPT", "failure_mode": null, "duration_seconds": 12.018985499977134, "tags": ["minimal", "exact-output", "deterministic", "single-label"], "learnings": "{\"what_changed\":\"\",\"what_improved\":[],\"what_regressed\":[],\"transferable_insight\":\"Tightening output constraints can reduce formatting variance and improve adherence to a single required response format.\",\"domain_tags\":[\"prompting\",\"output-formatting\",\"reliability\"]}", "cost_usd": 0.004552550000000001, "bootstrap_seed": 0, "agent_model": "gpt-5.4", "held_out_score": null, "criterion_names": ["correct_category", "concise_output", "follows_format", "no_hallucination", "handles_ambiguity"], "per_criterion_scores": {"correct_category": 0.4, "concise_output": 1.0, "follows_format": 0.0, "no_hallucination": 0.6, "handles_ambiguity": 1.0}, "failure_classification": null, "drafts_generated": 1, "drafts_survived": 1}
{"id": "d37fba7c-ed3c-42c4-bffb-c9ad2a7d0687", "target_id": "B1-treatment", "git_sha": "50d0082f8765299669ac3bd73be9f706e55519bd", "pre_experiment_sha": "d513aab0398ec417c0794f4b7d5d8ff7ae5cd9bd", "timestamp": "2026-04-19T01:40:57.843571+00:00", "hypothesis": "Make the prompt a stricter exact-output contract requiring a single label only.", "hypothesis_source": "agent", "mutation_diff_summary": "", "score": 2.8, "score_ci_lower": 2.6, "score_ci_upper": 3.0, "raw_scores": [3.0, 2.5, 3.0, 3.0, 2.5], "baseline_score": 3.0, "outcome": "KEPT", "failure_mode": null, "duration_seconds": 10.477976875030436, "tags": ["minimal", "exact-output", "deterministic"], "learnings": "{\"what_changed\":\"\",\"what_improved\":[],\"what_regressed\":[],\"transferable_insight\":\"When a task requires a precise categorical decision, tightening the output format into a strict single-label contract can reduce ambiguity and improve consistency even if no immediate metric gains are observed.\",\"domain_tags\":[\"prompt-engineering\",\"classification\",\"output-formatting\"]}", "cost_usd": 0.004332550000000001, "bootstrap_seed": 0, "agent_model": "gpt-5.4", "held_out_score": null, "criterion_names": ["correct_category", "concise_output", "follows_format", "no_hallucination", "handles_ambiguity"], "per_criterion_scores": {"correct_category": 0.3, "concise_output": 1.0, "follows_format": 0.0, "no_hallucination": 0.5, "handles_ambiguity": 1.0}, "failure_classification": null, "drafts_generated": 1, "drafts_survived": 1}
{"id": "27f2bf77-47c7-4857-a53a-d25c3f4d75a3", "target_id": "B1-treatment", "git_sha": "25059b2df81fc081382ee8f22fdf15b38cf161b2", "pre_experiment_sha": "50d0082f8765299669ac3bd73be9f706e55519bd", "timestamp": "2026-04-19T01:41:10.157821+00:00", "hypothesis": "A shorter stricter contract emphasizing single-label-only output will improve exact-match compliance.", "hypothesis_source": "agent", "mutation_diff_summary": "", "score": 2.9, "score_ci_lower": 2.6, "score_ci_upper": 3.2, "raw_scores": [3.0, 2.5, 2.5, 3.5, 3.0], "baseline_score": 2.8, "outcome": "KEPT", "failure_mode": null, "duration_seconds": 11.042800874914974, "tags": ["minimal", "exact-output", "deterministic"], "learnings": "{\"what_changed\":\"\",\"what_improved\":[],\"what_regressed\":[],\"transferable_insight\":\"When the task requires an exact format, reducing ambiguity by making the output contract shorter and stricter can improve compliance even without changing the underlying content.\",\"domain_tags\":[\"prompt-design\",\"instruction-following\",\"format-compliance\"]}", "cost_usd": 0.00426755, "bootstrap_seed": 0, "agent_model": "gpt-5.4", "held_out_score": null, "criterion_names": ["correct_category", "concise_output", "follows_format", "no_hallucination", "handles_ambiguity"], "per_criterion_scores": {"correct_category": 0.4, "concise_output": 1.0, "follows_format": 0.0, "no_hallucination": 0.6, "handles_ambiguity": 0.9}, "failure_classification": null, "drafts_generated": 1, "drafts_survived": 1}
{"id": "589c5364-5031-4c5b-98ae-f693b2c0a7e0", "target_id": "B1-treatment", "git_sha": "62a3dd18b42cb9aee04dcbb79f1fcbdb2fdae9b2", "pre_experiment_sha": "25059b2df81fc081382ee8f22fdf15b38cf161b2", "timestamp": "2026-04-19T01:41:22.590739+00:00", "hypothesis": "A stricter exact-output contract that explicitly requires a single label from the provided options will improve binary criteria compliance.", "hypothesis_source": "agent", "mutation_diff_summary": "", "score": 3.0, "score_ci_lower": 2.5, "score_ci_upper": 3.4, "raw_scores": [3.0, 2.0, 3.5, 3.5, 3.0], "baseline_score": 2.9, "outcome": "KEPT", "failure_mode": null, "duration_seconds": 10.070943042053841, "tags": ["minimal", "exact-output", "deterministic"], "learnings": "{\"what_changed\":\"\",\"what_improved\":[],\"what_regressed\":[],\"transferable_insight\":\"Explicitly constraining outputs to a single allowed choice can improve compliance with binary decision tasks by reducing ambiguity and response variability.\",\"domain_tags\":[\"instruction-following\",\"output-formatting\",\"decision-making\"]}", "cost_usd": 0.004552550000000001, "bootstrap_seed": 0, "agent_model": "gpt-5.4", "held_out_score": null, "criterion_names": ["correct_category", "concise_output", "follows_format", "no_hallucination", "handles_ambiguity"], "per_criterion_scores": {"correct_category": 0.5, "concise_output": 1.0, "follows_format": 0.0, "no_hallucination": 0.7, "handles_ambiguity": 0.8}, "failure_classification": null, "drafts_generated": 1, "drafts_survived": 1}
{"id": "f00dd354-63f8-4a70-969f-0130a3da106d", "target_id": "B1-treatment", "git_sha": "eb601ed7549d52d2a248d793d5f5d209d553f01a", "pre_experiment_sha": "62a3dd18b42cb9aee04dcbb79f1fcbdb2fdae9b2", "timestamp": "2026-04-19T01:41:33.758440+00:00", "hypothesis": "A shorter imperative exact-output contract will improve single-label compliance.", "hypothesis_source": "agent", "mutation_diff_summary": "", "score": 3.0, "score_ci_lower": 2.6, "score_ci_upper": 3.4, "raw_scores": [3.5, 2.5, 3.0, 3.5, 2.5], "baseline_score": 3.0, "outcome": "KEPT", "failure_mode": null, "duration_seconds": 10.055397500051185, "tags": ["minimal", "exact-output", "deterministic"], "learnings": "{\"what_changed\":\"\",\"what_improved\":[],\"what_regressed\":[],\"transferable_insight\":\"Concise, unambiguous instructions can improve exact-format compliance by reducing room for interpretation.\",\"domain_tags\":[\"instruction-design\",\"communication\",\"compliance\"]}", "cost_usd": 0.00435755, "bootstrap_seed": 0, "agent_model": "gpt-5.4", "held_out_score": null, "criterion_names": ["correct_category", "concise_output", "follows_format", "no_hallucination", "handles_ambiguity"], "per_criterion_scores": {"correct_category": 0.4, "concise_output": 1.0, "follows_format": 0.0, "no_hallucination": 0.6, "handles_ambiguity": 1.0}, "failure_classification": null, "drafts_generated": 1, "drafts_survived": 1}
{"id": "bd300d78-fb39-45ab-ac79-ce01003cd2bd", "target_id": "B1-treatment", "git_sha": "d822cc89abaf2cd1ea78c44502d2a8f8132799e4", "pre_experiment_sha": "eb601ed7549d52d2a248d793d5f5d209d553f01a", "timestamp": "2026-04-19T01:41:44.874250+00:00", "hypothesis": "A more explicit one-line exact-output contract will reduce output-format failures.", "hypothesis_source": "agent", "mutation_diff_summary": "", "score": 2.8, "score_ci_lower": 2.4, "score_ci_upper": 3.0, "raw_scores": [2.0, 3.0, 3.0, 3.0, 3.0], "baseline_score": 3.0, "outcome": "KEPT", "failure_mode": null, "duration_seconds": 10.11238329205662, "tags": ["minimal", "exact-output", "deterministic", "format-compliance"], "learnings": "{\"what_changed\":\"\",\"what_improved\":[],\"what_regressed\":[],\"transferable_insight\":\"Making the required output format explicit and exact in a single line can reduce formatting errors by narrowing ambiguity and constraining responses.\",\"domain_tags\":[\"prompt-engineering\",\"output-formatting\",\"instruction-design\"]}", "cost_usd": 0.013677550000000002, "bootstrap_seed": 0, "agent_model": "gpt-5.4", "held_out_score": null, "criterion_names": ["correct_category", "concise_output", "follows_format", "no_hallucination", "handles_ambiguity"], "per_criterion_scores": {"correct_category": 0.3, "concise_output": 1.0, "follows_format": 0.0, "no_hallucination": 0.5, "handles_ambiguity": 1.0}, "failure_classification": null, "drafts_generated": 1, "drafts_survived": 1}
{"id": "8b318165-cf12-43a1-8938-f639fd76f905", "target_id": "B1-treatment", "git_sha": "7d0e9eaf88338faa7064d21a55f486bda506b2a6", "pre_experiment_sha": "d822cc89abaf2cd1ea78c44502d2a8f8132799e4", "timestamp": "2026-04-19T01:41:57.667009+00:00", "hypothesis": "Use the shortest stricter one-line contract that demands exactly one allowed label and nothing else.", "hypothesis_source": "agent", "mutation_diff_summary": "", "score": 3.2, "score_ci_lower": 2.8, "score_ci_upper": 3.6, "raw_scores": [3.0, 2.5, 3.0, 3.5, 4.0], "baseline_score": 2.8, "outcome": "KEPT", "failure_mode": null, "duration_seconds": 10.54109187494032, "tags": ["minimal", "exact-output", "deterministic", "format-compliance"], "learnings": "{\"what_changed\":\"\",\"what_improved\":[\"correct_category: PASS (was FAIL)\"],\"what_regressed\":[],\"transferable_insight\":\"When a task requires a single exact label, making the instruction as short and strictly exclusive as possible can improve classification correctness by reducing ambiguity and extra output.\",\"domain_tags\":[\"instruction-design\",\"classification\",\"prompting\"]}", "cost_usd": 0.01386475, "bootstrap_seed": 0, "agent_model": "gpt-5.4", "held_out_score": null, "criterion_names": ["correct_category", "concise_output", "follows_format", "no_hallucination", "handles_ambiguity"], "per_criterion_scores": {"correct_category": 0.6, "concise_output": 1.0, "follows_format": 0.0, "no_hallucination": 0.6, "handles_ambiguity": 1.0}, "failure_classification": null, "drafts_generated": 1, "drafts_survived": 1}
{"id": "095a2e34-3f83-4b89-8f44-cf0d594073d7", "target_id": "B1-treatment", "git_sha": "7d0e9eaf88338faa7064d21a55f486bda506b2a6", "pre_experiment_sha": "7d0e9eaf88338faa7064d21a55f486bda506b2a6", "timestamp": "2026-04-19T01:42:08.937277+00:00", "hypothesis": "An even shorter exact-label contract may reduce output-format errors.", "hypothesis_source": "agent", "mutation_diff_summary": "", "score": 2.7, "score_ci_lower": 2.3, "score_ci_upper": 3.0, "raw_scores": [2.5, 2.0, 3.0, 3.0, 3.0], "baseline_score": 3.2, "outcome": "DISCARDED", "failure_mode": null, "duration_seconds": 10.174877458950505, "tags": ["minimal", "exact-output", "deterministic", "format-compliance"], "learnings": "{\"what_changed\":\"\",\"what_improved\":[],\"what_regressed\":[\"no_hallucination: FAIL (was PASS)\"],\"transferable_insight\":\"Making a contract shorter can weaken constraints and increase errors, so brevity should not come at the expense of preserving essential requirements.\",\"domain_tags\":[\"prompt_design\",\"quality_control\",\"constraint_management\"]}", "cost_usd": 0.01377295, "bootstrap_seed": 0, "agent_model": "gpt-5.4", "held_out_score": null, "criterion_names": ["correct_category", "concise_output", "follows_format", "no_hallucination", "handles_ambiguity"], "per_criterion_scores": {"correct_category": 0.6, "concise_output": 1.0, "follows_format": 0.0, "no_hallucination": 0.4, "handles_ambiguity": 0.7}, "failure_classification": {"category": "output_format", "description": "The experiment failed due to output-format/structure errors. Despite attempting a shorter exact-label contract, the model still produced outputs that did not conform to the required schema.", "fix_direction": "Iterate on the contract text to explicitly enforce the exact output schema (field names, ordering, required/optional keys) and add strict formatting constraints/examples to prevent deviations.", "confidence": 0.72}, "drafts_generated": 1, "drafts_survived": 1}
{"id": "5c895716-a374-4599-b5b8-ffcdfc596033", "target_id": "B1-treatment", "git_sha": "6e966074725e6c07a8f0c340d3d219dc3d1305fc", "pre_experiment_sha": "7d0e9eaf88338faa7064d21a55f486bda506b2a6", "timestamp": "2026-04-19T01:42:23.385229+00:00", "hypothesis": "A terser exact-match contract using only \"return\" and \"only\" may improve strict format compliance.", "hypothesis_source": "agent", "mutation_diff_summary": "", "score": 3.4, "score_ci_lower": 2.9, "score_ci_upper": 3.9, "raw_scores": [4.0, 2.5, 3.0, 3.5, 4.0], "baseline_score": 3.2, "outcome": "KEPT", "failure_mode": null, "duration_seconds": 10.269134458038025, "tags": ["minimal", "exact-output", "deterministic", "format-compliance"], "learnings": "{\"what_changed\":\"\",\"what_improved\":[\"no_hallucination: PASS (was FAIL)\"],\"what_regressed\":[],\"transferable_insight\":\"Reducing instructions to a minimal exact-match constraint can improve compliance by limiting opportunities for unsupported additions or deviations.\",\"domain_tags\":[\"prompting\",\"instruction-following\",\"format-compliance\"]}", "cost_usd": 0.01397755, "bootstrap_seed": 0, "agent_model": "gpt-5.4", "held_out_score": null, "criterion_names": ["correct_category", "concise_output", "follows_format", "no_hallucination", "handles_ambiguity"], "per_criterion_scores": {"correct_category": 0.7, "concise_output": 1.0, "follows_format": 0.0, "no_hallucination": 0.7, "handles_ambiguity": 1.0}, "failure_classification": null, "drafts_generated": 1, "drafts_survived": 1}
{"id": "796d6a5d-1863-48f5-bc56-4c269da50d3f", "target_id": "B1-treatment", "git_sha": "6e966074725e6c07a8f0c340d3d219dc3d1305fc", "pre_experiment_sha": "6e966074725e6c07a8f0c340d3d219dc3d1305fc", "timestamp": "2026-04-19T01:42:35.644521+00:00", "hypothesis": "Adding \u201cexactly\u201d and \u201cnothing else\u201d in one line will improve strict single-label format compliance.", "hypothesis_source": "agent", "mutation_diff_summary": "", "score": 2.9, "score_ci_lower": 2.6, "score_ci_upper": 3.2, "raw_scores": [3.0, 2.5, 3.5, 3.0, 2.5], "baseline_score": 3.4, "outcome": "DISCARDED", "failure_mode": null, "duration_seconds": 10.125501916976646, "tags": ["minimal", "exact-output", "deterministic", "format-compliance"], "learnings": "{\"what_changed\":\"\",\"what_improved\":[],\"what_regressed\":[\"correct_category: FAIL (was PASS)\"],\"transferable_insight\":\"Adding restrictive wording can backfire by making outputs less compliant when the task already requires a precise format, so constraints should be introduced sparingly and tested for unintended side effects.\",\"domain_tags\":[\"prompt-engineering\",\"instruction-design\",\"evaluation\"]}", "cost_usd": 0.01424375, "bootstrap_seed": 0, "agent_model": "gpt-5.4", "held_out_score": null, "criterion_names": ["correct_category", "concise_output", "follows_format", "no_hallucination", "handles_ambiguity"], "per_criterion_scores": {"correct_category": 0.4, "concise_output": 1.0, "follows_format": 0.0, "no_hallucination": 0.6, "handles_ambiguity": 0.9}, "failure_classification": {"category": "output_format", "description": "The experiment did not achieve the intended strict single-label output formatting compliance. While the hypothesis targets formatting, the observed result indicates the output still violated the required schema/label constraints rather than reflecting a reasoning or semantic issue.", "fix_direction": "Iterate toward stricter, unambiguous label-only output generation (e.g., enforce exact allowed label strings, remove any extra text/newlines, and add a validation step to guarantee schema compliance).", "confidence": 0.62}, "drafts_generated": 1, "drafts_survived": 1}
{"id": "ae5e1bd5-e456-4da8-b665-926e9eb9ebc6", "target_id": "B1-treatment", "git_sha": "6e966074725e6c07a8f0c340d3d219dc3d1305fc", "pre_experiment_sha": "6e966074725e6c07a8f0c340d3d219dc3d1305fc", "timestamp": "2026-04-19T01:42:48.473054+00:00", "hypothesis": "A shortest possible one-line single-label contract may improve strict format compliance without hurting classification.", "hypothesis_source": "agent", "mutation_diff_summary": "", "score": 3.2, "score_ci_lower": 2.8, "score_ci_upper": 3.7, "raw_scores": [4.0, 2.5, 3.0, 3.0, 3.5], "baseline_score": 3.4, "outcome": "DISCARDED", "failure_mode": null, "duration_seconds": 10.118853082996793, "tags": ["minimal", "exact-output", "single-choice", "format-compliance"], "learnings": "{\"what_changed\":\"\",\"what_improved\":[\"correct_category: PASS (was FAIL)\"],\"what_regressed\":[],\"transferable_insight\":\"Reducing output to the simplest valid form can improve adherence to required structure without necessarily changing the underlying decision quality.\",\"domain_tags\":[\"prompting\",\"format-compliance\",\"classification\"]}", "cost_usd": 0.014504350000000001, "bootstrap_seed": 0, "agent_model": "gpt-5.4", "held_out_score": null, "criterion_names": ["correct_category", "concise_output", "follows_format", "no_hallucination", "handles_ambiguity"], "per_criterion_scores": {"correct_category": 0.6, "concise_output": 1.0, "follows_format": 0.0, "no_hallucination": 0.6, "handles_ambiguity": 1.0}, "failure_classification": {"category": "logic_error", "description": "The provided information (hypothesis, failure mode=unknown, and score) is insufficient to determine what kind of failure occurred, such as format/schema violation, logic error, regression, scope issue, syntax/parsing failure, semantic drift, over-optimization, or incomplete edit.", "fix_direction": "Run the experiment again with captured failure evidence (error logs, diff of expected vs actual output, parsing/validation results) so the failure can be mapped to the correct category; then adjust along the corresponding axis (format, logic, scope, etc.).", "confidence": 0.05}, "drafts_generated": 1, "drafts_survived": 1}
