{"id": "10e1749f-15d3-43fc-9b1e-9607fd1151b7", "target_id": "B1-treatment", "git_sha": "3ea5969a56a7d96ab48e5f9d21e09f06f01df31a", "pre_experiment_sha": "3ea5969a56a7d96ab48e5f9d21e09f06f01df31a", "timestamp": "2026-04-19T17:19:51.992866+00:00", "hypothesis": "Reduce format errors by making the contract even shorter and more literal with a pure one-label-only instruction.", "hypothesis_source": "agent", "mutation_diff_summary": "", "score": 2.9, "score_ci_lower": 2.6, "score_ci_upper": 3.2, "raw_scores": [3.0, 2.5, 3.0, 2.5, 3.5], "baseline_score": 3.1, "outcome": "DISCARDED", "failure_mode": null, "duration_seconds": 11.038511291961186, "tags": ["ultra-compact", "exact-output", "label-only", "format-compliance"], "learnings": "{\"what_changed\":\"\",\"what_improved\":[],\"what_regressed\":[\"correct_category: FAIL (was PASS)\"],\"transferable_insight\":\"Over-simplifying instructions can reduce clarity and cause performance regressions, so brevity should not come at the expense of enough structure to preserve the required behavior.\",\"domain_tags\":[\"instruction_design\",\"communication\",\"optimization\"]}", "cost_usd": 0.01790455, "bootstrap_seed": 0, "agent_model": "gpt-5.4", "held_out_score": null, "criterion_names": ["correct_category", "concise_output", "follows_format", "no_hallucination", "handles_ambiguity"], "per_criterion_scores": {"correct_category": 0.4, "concise_output": 0.9, "follows_format": 0.0, "no_hallucination": 0.7, "handles_ambiguity": 0.9}, "failure_classification": {"category": "output_format", "description": "The attempt to shorten and literalize the instruction did not resolve the intended formatting issue; the failure mode is labeled as unknown, but the hypothesis directly targets output-format consistency, implying the output still violated the required structure/schema.", "fix_direction": "Try minimal prompt changes that preserve the output schema requirements (e.g., explicitly reiterate the exact JSON/field structure, add constraints like valid keys only, and include an example of the expected format) rather than relying on extreme shortening.", "confidence": 0.42}, "drafts_generated": 1, "drafts_survived": 1}
{"id": "4b83366c-4d38-46e4-92bb-9432443b0574", "target_id": "B1-treatment", "git_sha": "66e0449460dedf694313b7e3ad301fe93073bcad", "pre_experiment_sha": "3ea5969a56a7d96ab48e5f9d21e09f06f01df31a", "timestamp": "2026-04-19T17:20:08.282104+00:00", "hypothesis": "Use a tighter single-line exact-match contract that explicitly makes the entire reply only the chosen allowed label.", "hypothesis_source": "agent", "mutation_diff_summary": "", "score": 3.6, "score_ci_lower": 3.3, "score_ci_upper": 3.9, "raw_scores": [4.0, 3.5, 4.0, 3.5, 3.0], "baseline_score": 3.1, "outcome": "KEPT", "failure_mode": null, "duration_seconds": 10.300459000049159, "tags": ["exact-output", "single-line", "exact-match", "format-hardening"], "learnings": "{\"what_changed\":\"\",\"what_improved\":[\"correct_category: PASS (was FAIL)\"],\"what_regressed\":[],\"transferable_insight\":\"When a task requires selecting from a fixed set of labels, making the output contract strictly exact-match and single-line reduces ambiguity and improves classification correctness.\",\"domain_tags\":[\"prompting\",\"classification\",\"output-formatting\"]}", "cost_usd": 0.018252550000000003, "bootstrap_seed": 0, "agent_model": "gpt-5.4", "held_out_score": null, "criterion_names": ["correct_category", "concise_output", "follows_format", "no_hallucination", "handles_ambiguity"], "per_criterion_scores": {"correct_category": 0.8, "concise_output": 1.0, "follows_format": 0.0, "no_hallucination": 0.8, "handles_ambiguity": 1.0}, "failure_classification": null, "drafts_generated": 1, "drafts_survived": 1}
{"id": "a1eb685c-2b34-4ced-9ae3-1e05a1712e4d", "target_id": "B1-treatment", "git_sha": "66e0449460dedf694313b7e3ad301fe93073bcad", "pre_experiment_sha": "66e0449460dedf694313b7e3ad301fe93073bcad", "timestamp": "2026-04-19T17:20:21.403529+00:00", "hypothesis": "Make the contract more machine-literal by requiring the response body to be one exact allowed label with zero surrounding characters.", "hypothesis_source": "agent", "mutation_diff_summary": "", "score": 2.9, "score_ci_lower": 2.4, "score_ci_upper": 3.3, "raw_scores": [3.0, 2.0, 3.5, 3.0, 3.0], "baseline_score": 3.6, "outcome": "DISCARDED", "failure_mode": null, "duration_seconds": 10.766012292006053, "tags": ["exact-output", "exact-match", "format-hardening", "single-label", "literal"], "learnings": "{\"what_changed\":\"\",\"what_improved\":[],\"what_regressed\":[\"correct_category: FAIL (was PASS)\"],\"transferable_insight\":\"When tightening a specification to be machine-literal, overly strict exact-match constraints can reduce robustness and cause valid outputs to be rejected, so balance precision with tolerance for harmless formatting variation.\",\"domain_tags\":[\"specification-design\",\"validation\",\"robustness\"]}", "cost_usd": 0.018699550000000002, "bootstrap_seed": 0, "agent_model": "gpt-5.4", "held_out_score": null, "criterion_names": ["correct_category", "concise_output", "follows_format", "no_hallucination", "handles_ambiguity"], "per_criterion_scores": {"correct_category": 0.4, "concise_output": 1.0, "follows_format": 0.0, "no_hallucination": 0.6, "handles_ambiguity": 0.9}, "failure_classification": {"category": "output_format", "description": "The experiment failed because the model did not satisfy the strict output formatting requirement: the response body must be exactly one allowed label with no surrounding characters. This indicates an output structure/schema violation rather than a logic or syntax issue.", "fix_direction": "Enforce exact-match output constraints by generating only the single allowed label token (no whitespace, punctuation, JSON keys, or explanations), and add a post-processing/validation step that rejects anything with extra characters.", "confidence": 0.78}, "drafts_generated": 1, "drafts_survived": 1}
{"id": "218f8828-aec9-4ba5-8bf0-c7e7a4491acd", "target_id": "B1-treatment", "git_sha": "66e0449460dedf694313b7e3ad301fe93073bcad", "pre_experiment_sha": "66e0449460dedf694313b7e3ad301fe93073bcad", "timestamp": "2026-04-19T17:20:33.961015+00:00", "hypothesis": "Slightly simplify the exact-match contract while keeping the one-label-only requirement explicit.", "hypothesis_source": "agent", "mutation_diff_summary": "", "score": 3.0, "score_ci_lower": 2.7, "score_ci_upper": 3.3, "raw_scores": [3.5, 3.0, 3.0, 2.5, 3.0], "baseline_score": 3.6, "outcome": "DISCARDED", "failure_mode": null, "duration_seconds": 10.299402915989049, "tags": ["exact-output", "single-line", "minimal", "format-compliance"], "learnings": "{\"what_changed\":\"\",\"what_improved\":[],\"what_regressed\":[],\"transferable_insight\":\"When a strict requirement is central to correctness, simplifying the wording without preserving that constraint explicitly can reduce reliability rather than improve it.\",\"domain_tags\":[\"requirements\",\"communication\",\"quality\"]}", "cost_usd": 0.01827015, "bootstrap_seed": 0, "agent_model": "gpt-5.4", "held_out_score": null, "criterion_names": ["correct_category", "concise_output", "follows_format", "no_hallucination", "handles_ambiguity"], "per_criterion_scores": {"correct_category": 0.4, "concise_output": 1.0, "follows_format": 0.0, "no_hallucination": 0.6, "handles_ambiguity": 1.0}, "failure_classification": {"category": "incomplete_edit", "description": "The attempted change appears to have only partially implemented the requested simplification while keeping the one-label-only requirement explicit. The result did not achieve the intended contract behavior consistently, suggesting the edit left an incomplete or inconsistent constraint state.", "fix_direction": "Ensure the one-label-only requirement is explicitly and fully enforced in the exact-match contract (not merely implied), and re-check that all relevant conditions are updated together rather than partially revised.", "confidence": 0.46}, "drafts_generated": 1, "drafts_survived": 1}
{"id": "c0b5f66c-964f-4c4a-a58f-d18e00fc0c10", "target_id": "B1-treatment", "git_sha": "66e0449460dedf694313b7e3ad301fe93073bcad", "pre_experiment_sha": "66e0449460dedf694313b7e3ad301fe93073bcad", "timestamp": "2026-04-19T17:20:47.256820+00:00", "hypothesis": "Add a stronger priority rule that the label-only output requirement overrides everything else.", "hypothesis_source": "agent", "mutation_diff_summary": "", "score": 2.9, "score_ci_lower": 2.6, "score_ci_upper": 3.2, "raw_scores": [3.0, 2.5, 2.5, 3.0, 3.5], "baseline_score": 3.6, "outcome": "DISCARDED", "failure_mode": null, "duration_seconds": 10.77511358296033, "tags": ["exact-output", "single-line", "priority", "format-hardening"], "learnings": "{\"what_changed\":\"\",\"what_improved\":[\"correct_category: PASS (was FAIL)\"],\"what_regressed\":[\"no_hallucination: FAIL (was PASS)\"],\"transferable_insight\":\"When tightening a rule to satisfy one constraint, ensure it does not override other critical constraints, because improving compliance in one area can introduce regressions elsewhere.\",\"domain_tags\":[\"decision-making\",\"constraint-satisfaction\",\"quality-control\"]}", "cost_usd": 0.01822155, "bootstrap_seed": 0, "agent_model": "gpt-5.4", "held_out_score": null, "criterion_names": ["correct_category", "concise_output", "follows_format", "no_hallucination", "handles_ambiguity"], "per_criterion_scores": {"correct_category": 0.6, "concise_output": 1.0, "follows_format": 0.0, "no_hallucination": 0.4, "handles_ambiguity": 0.9}, "failure_classification": {"category": "logic_error", "description": "The provided information does not specify what the experiment actually did or why it failed. The hypothesis about prioritizing label-only output is unclear relative to the observed failure mode, and no error details are given.", "fix_direction": "Capture the concrete failure signal (error message, diff of expected vs actual output, and which specific constraint was violated) and verify the implementation enforces the label-only priority consistently across all branches.", "confidence": 0.05}, "drafts_generated": 1, "drafts_survived": 1}
{"id": "1a636e6d-2428-4683-bb41-cbc2c6284ec1", "target_id": "B1-treatment", "git_sha": "66e0449460dedf694313b7e3ad301fe93073bcad", "pre_experiment_sha": "66e0449460dedf694313b7e3ad301fe93073bcad", "timestamp": "2026-04-19T17:21:04.930484+00:00", "hypothesis": "Make the exact-match contract more explicit by forbidding any surrounding characters before or after the selected allowed label.", "hypothesis_source": "agent", "mutation_diff_summary": "", "score": 3.0, "score_ci_lower": 2.5, "score_ci_upper": 3.4, "raw_scores": [3.0, 2.0, 3.0, 3.5, 3.5], "baseline_score": 3.6, "outcome": "DISCARDED", "failure_mode": null, "duration_seconds": 14.128454499994405, "tags": ["exact-output", "single-line", "exact-match", "format-hardening"], "learnings": "{\"what_changed\":\"\",\"what_improved\":[\"no_hallucination: PASS (was FAIL)\"],\"what_regressed\":[],\"transferable_insight\":\"Making a selection rule explicitly exclusive\u2014by forbidding any extra surrounding content\u2014can reduce hallucinated outputs even when it does not improve other metrics.\",\"domain_tags\":[\"validation\",\"classification\",\"prompting\"]}", "cost_usd": 0.01845895, "bootstrap_seed": 0, "agent_model": "gpt-5.4", "held_out_score": null, "criterion_names": ["correct_category", "concise_output", "follows_format", "no_hallucination", "handles_ambiguity"], "per_criterion_scores": {"correct_category": 0.5, "concise_output": 1.0, "follows_format": 0.0, "no_hallucination": 0.7, "handles_ambiguity": 0.8}, "failure_classification": {"category": "semantic_drift", "description": "The attempt to make the exact-match contract more explicit likely did not actually enforce the intended constraint on surrounding characters, leading to outputs that still allowed unexpected prefix/suffix content rather than strictly matching only the selected label.", "fix_direction": "Strengthen the matching rule to explicitly anchor the allowed label (e.g., use strict start/end boundaries) and verify tests include cases with surrounding characters to ensure they are rejected.", "confidence": 0.62}, "drafts_generated": 1, "drafts_survived": 1}
{"id": "5325a947-6165-4ed6-810e-35436eed8489", "target_id": "B1-treatment", "git_sha": "66e0449460dedf694313b7e3ad301fe93073bcad", "pre_experiment_sha": "66e0449460dedf694313b7e3ad301fe93073bcad", "timestamp": "2026-04-19T17:21:18.702858+00:00", "hypothesis": "Use a maximally literal one-line contract that says the whole response must be exactly one allowed label verbatim with no extra characters.", "hypothesis_source": "agent", "mutation_diff_summary": "", "score": 3.0, "score_ci_lower": 2.6, "score_ci_upper": 3.4, "raw_scores": [3.5, 2.5, 3.0, 2.5, 3.5], "baseline_score": 3.6, "outcome": "DISCARDED", "failure_mode": null, "duration_seconds": 11.322951833019033, "tags": ["exact-output", "single-line", "exact-match", "format-hardening", "literal"], "learnings": "{\"what_changed\":\"\",\"what_improved\":[],\"what_regressed\":[\"correct_category: FAIL (was PASS)\"],\"transferable_insight\":\"When a task requires a strict output format, making the instruction overly literal can still fail if it does not robustly constrain the model\u2019s interpretation and compliance behavior.\",\"domain_tags\":[\"prompt-engineering\",\"format-compliance\",\"evaluation\"]}", "cost_usd": 0.01860555, "bootstrap_seed": 0, "agent_model": "gpt-5.4", "held_out_score": null, "criterion_names": ["correct_category", "concise_output", "follows_format", "no_hallucination", "handles_ambiguity"], "per_criterion_scores": {"correct_category": 0.4, "concise_output": 1.0, "follows_format": 0.0, "no_hallucination": 0.6, "handles_ambiguity": 1.0}, "failure_classification": {"category": "output_format", "description": "The experiment failed the required maximally literal one-line contract (output did not match the allowed label verbatim with no extra characters), indicating an output structure/formatting violation rather than a logic or semantic issue.", "fix_direction": "Ensure the response is exactly one allowed label with no additional whitespace, punctuation, JSON, or explanatory text; validate against the required strict string-matching contract.", "confidence": 0.74}, "drafts_generated": 1, "drafts_survived": 1}
{"id": "8b5f2eb2-5e00-49ae-bb8d-69cca8f0cdcb", "target_id": "B1-treatment", "git_sha": "66e0449460dedf694313b7e3ad301fe93073bcad", "pre_experiment_sha": "66e0449460dedf694313b7e3ad301fe93073bcad", "timestamp": "2026-04-19T17:21:31.801891+00:00", "hypothesis": "Use an even more literal single-line contract centered on the final answer being one allowed label only.", "hypothesis_source": "agent", "mutation_diff_summary": "", "score": 3.2, "score_ci_lower": 2.8, "score_ci_upper": 3.6, "raw_scores": [3.0, 2.5, 3.0, 3.5, 4.0], "baseline_score": 3.6, "outcome": "DISCARDED", "failure_mode": null, "duration_seconds": 10.569292458007112, "tags": ["exact-output", "single-line", "minimal", "format-compliance", "deterministic"], "learnings": "{\"what_changed\":\"\",\"what_improved\":[\"correct_category: PASS (was FAIL)\"],\"what_regressed\":[],\"transferable_insight\":\"When the target output is a constrained label, making the instruction explicitly single-purpose and literal can improve category correctness by reducing ambiguity.\",\"domain_tags\":[\"instruction-design\",\"classification\",\"output-formatting\"]}", "cost_usd": 0.01779035, "bootstrap_seed": 0, "agent_model": "gpt-5.4", "held_out_score": null, "criterion_names": ["correct_category", "concise_output", "follows_format", "no_hallucination", "handles_ambiguity"], "per_criterion_scores": {"correct_category": 0.6, "concise_output": 1.0, "follows_format": 0.0, "no_hallucination": 0.6, "handles_ambiguity": 1.0}, "failure_classification": {"category": "logic_error", "description": "The experiment appears to have produced an invalid or incorrect result for the intended classification output, indicating the underlying reasoning/label selection logic did not correctly follow the prompt requirements, even if the output was close enough to receive a non-zero score.", "fix_direction": "Re-check the mapping from the failed run\u2019s signals to the correct label and enforce the rule that the final answer must be exactly one allowed label with no extra text; validate with additional edge-case tests.", "confidence": 0.42}, "drafts_generated": 1, "drafts_survived": 1}
{"id": "e11c866d-b6a6-4b87-9b44-577f042da9dc", "target_id": "B1-treatment", "git_sha": "66e0449460dedf694313b7e3ad301fe93073bcad", "pre_experiment_sha": "66e0449460dedf694313b7e3ad301fe93073bcad", "timestamp": "2026-04-19T17:21:46.421350+00:00", "hypothesis": "Use a shorter literal exact-match contract that keeps label selection and no-extra-output requirements explicit.", "hypothesis_source": "agent", "mutation_diff_summary": "", "score": 3.0, "score_ci_lower": 2.7, "score_ci_upper": 3.3, "raw_scores": [3.0, 3.0, 3.5, 3.0, 2.5], "baseline_score": 3.6, "outcome": "DISCARDED", "failure_mode": null, "duration_seconds": 10.238410417106934, "tags": ["exact-output", "single-line", "minimal", "format-compliance"], "learnings": "{\"what_changed\":\"\",\"what_improved\":[],\"what_regressed\":[\"correct_category: FAIL (was PASS)\"],\"transferable_insight\":\"When tightening a specification, preserving explicit constraints on the target choice and output format is critical, because shortening the contract can inadvertently weaken correctness on the primary decision criterion.\",\"domain_tags\":[\"specification\",\"quality-control\",\"prompt-design\"]}", "cost_usd": 0.01809475, "bootstrap_seed": 0, "agent_model": "gpt-5.4", "held_out_score": null, "criterion_names": ["correct_category", "concise_output", "follows_format", "no_hallucination", "handles_ambiguity"], "per_criterion_scores": {"correct_category": 0.4, "concise_output": 1.0, "follows_format": 0.0, "no_hallucination": 0.7, "handles_ambiguity": 0.9}, "failure_classification": {"category": "incomplete_edit", "description": "The failure mode is unspecified (\u201cunknown\u201d) and the score is low (3.0), suggesting the change did not fully or consistently implement the intended shorter exact-match contract or left requirements (label selection / no-extra-output) only partially enforced.", "fix_direction": "Validate the full prompt/contract text: ensure the contract is shorter while explicitly stating both (1) exact label selection with no ambiguity and (2) a strict no-extra-output response rule, and run a formatting/constraint regression test across multiple cases.", "confidence": 0.42}, "drafts_generated": 1, "drafts_survived": 1}
{"id": "a2dcaa46-6736-4e92-a54a-5fe0b55b07ba", "target_id": "B1-treatment", "git_sha": "66e0449460dedf694313b7e3ad301fe93073bcad", "pre_experiment_sha": "66e0449460dedf694313b7e3ad301fe93073bcad", "timestamp": "2026-04-19T17:22:00.321762+00:00", "hypothesis": "Use a simpler exact-match contract that preserves best-label selection while tightening the no-extra-output rule.", "hypothesis_source": "agent", "mutation_diff_summary": "", "score": 2.5, "score_ci_lower": 2.2, "score_ci_upper": 2.8, "raw_scores": [2.5, 3.0, 2.5, 2.5, 2.0], "baseline_score": 3.6, "outcome": "DISCARDED", "failure_mode": null, "duration_seconds": 11.2399797081016, "tags": ["minimal", "exact-output", "format-compliance", "deterministic"], "learnings": "{\"what_changed\":\"\",\"what_improved\":[],\"what_regressed\":[],\"transferable_insight\":\"When simplifying a specification, preserve the core selection criterion exactly while making the output constraints stricter to avoid unintended extra behavior.\",\"domain_tags\":[\"specification\",\"optimization\",\"quality-control\"]}", "cost_usd": 0.018299350000000002, "bootstrap_seed": 0, "agent_model": "gpt-5.4", "held_out_score": null, "criterion_names": ["correct_category", "concise_output", "follows_format", "no_hallucination", "handles_ambiguity"], "per_criterion_scores": {"correct_category": 0.2, "concise_output": 1.0, "follows_format": 0.0, "no_hallucination": 0.6, "handles_ambiguity": 0.7}, "failure_classification": {"category": "incomplete_edit", "description": "The experiment appears to have partially implemented the intended change (switching to a simpler exact-match contract and tightening the no-extra-output rule) but the result still fails, suggesting an inconsistent or incomplete update rather than a single clear logical/format issue.", "fix_direction": "Rework the edit end-to-end: update both the contract and any surrounding prompt/constraints consistently, and verify that the model\u2019s output always conforms exactly to the required schema with no additional fields or trailing text.", "confidence": 0.42}, "drafts_generated": 1, "drafts_survived": 1}
