{"id": "53d96094-2467-4af9-81b7-fd515f7198d2", "target_id": "B1-treatment", "git_sha": "e529463e76d1d2eae9f16b68369e49a84388d784", "pre_experiment_sha": "b9295e2c2cd90d8dba5ddf5be5a80c713266ee04", "timestamp": "2026-04-05T22:04:52.661780+00:00", "hypothesis": "No hypothesis provided", "hypothesis_source": "synthesized", "mutation_diff_summary": "", "score": 3.6, "score_ci_lower": 3.3, "score_ci_upper": 3.9, "raw_scores": [3.5, 4.0, 3.0, 3.5, 4.0], "baseline_score": 0.0, "outcome": "KEPT", "failure_mode": null, "duration_seconds": 40.537007624981925, "tags": [], "learnings": "{\"what_changed\":\"\",\"what_improved\":[],\"what_regressed\":[],\"transferable_insight\":\"No hypothesis provided\",\"domain_tags\":[]}", "cost_usd": 0.1502028, "bootstrap_seed": 0, "agent_model": "claude-sonnet-4-6", "held_out_score": null, "criterion_names": ["correct_category", "concise_output", "follows_format", "no_hallucination", "handles_ambiguity"], "per_criterion_scores": {"correct_category": 1.0, "concise_output": 1.0, "follows_format": 0.0, "no_hallucination": 0.9, "handles_ambiguity": 0.7}, "failure_classification": null, "drafts_generated": 1, "drafts_survived": 1}
{"id": "4e452119-75c0-4521-8031-67e58b8c3efe", "target_id": "B1-treatment", "git_sha": "e529463e76d1d2eae9f16b68369e49a84388d784", "pre_experiment_sha": "e529463e76d1d2eae9f16b68369e49a84388d784", "timestamp": "2026-04-05T22:10:37.842111+00:00", "hypothesis": "No hypothesis provided", "hypothesis_source": "synthesized", "mutation_diff_summary": "", "score": 3.3, "score_ci_lower": 2.9, "score_ci_upper": 3.7, "raw_scores": [3.5, 4.0, 2.5, 3.0, 3.5], "baseline_score": 3.6, "outcome": "DISCARDED", "failure_mode": null, "duration_seconds": 43.82283116597682, "tags": [], "learnings": "{\"what_changed\":\"\",\"what_improved\":[],\"what_regressed\":[],\"transferable_insight\":\"No hypothesis provided\",\"domain_tags\":[]}", "cost_usd": 0.12496429999999997, "bootstrap_seed": 0, "agent_model": "claude-sonnet-4-6", "held_out_score": null, "criterion_names": ["correct_category", "concise_output", "follows_format", "no_hallucination", "handles_ambiguity"], "per_criterion_scores": {"correct_category": 1.0, "concise_output": 1.0, "follows_format": 0.0, "no_hallucination": 0.7, "handles_ambiguity": 0.6}, "failure_classification": {"category": "output_format", "description": "The experiment failed due to an output structure or schema violation. There was no hypothesis provided, failure mode was marked unknown, and other fields may have missed required information or formatting.", "fix_direction": "Ensure the output strictly follows the required structure/schema and all mandatory fields are present and correctly formatted.", "confidence": 0.85}, "drafts_generated": 1, "drafts_survived": 1}
{"id": "21d15073-857a-42f9-bf5b-b225ce329461", "target_id": "B1-treatment", "git_sha": "e529463e76d1d2eae9f16b68369e49a84388d784", "pre_experiment_sha": "e529463e76d1d2eae9f16b68369e49a84388d784", "timestamp": "2026-04-05T22:12:48.470041+00:00", "hypothesis": "No hypothesis provided", "hypothesis_source": "synthesized", "mutation_diff_summary": "", "score": 3.4, "score_ci_lower": 3.1, "score_ci_upper": 3.7, "raw_scores": [4.0, 3.5, 3.0, 3.0, 3.5], "baseline_score": 3.6, "outcome": "DISCARDED", "failure_mode": null, "duration_seconds": 129.13619420817122, "tags": [], "learnings": "{\"what_changed\":\"\",\"what_improved\":[],\"what_regressed\":[],\"transferable_insight\":\"No hypothesis provided\",\"domain_tags\":[]}", "cost_usd": 0.4012782, "bootstrap_seed": 0, "agent_model": "claude-sonnet-4-6", "held_out_score": null, "criterion_names": ["correct_category", "concise_output", "follows_format", "no_hallucination", "handles_ambiguity"], "per_criterion_scores": {"correct_category": 1.0, "concise_output": 1.0, "follows_format": 0.0, "no_hallucination": 0.8, "handles_ambiguity": 0.6}, "failure_classification": {"category": "output_format", "description": "The experiment is missing a hypothesis, which violates the expected output structure/schema that requires a hypothesis to be provided.", "fix_direction": "Ensure all required output fields, such as the hypothesis, are included and correctly formatted in future attempts.", "confidence": 0.9}, "drafts_generated": 1, "drafts_survived": 1}
{"id": "a16358c8-9a96-40eb-9036-26048fb21cb9", "target_id": "B1-treatment", "git_sha": "e529463e76d1d2eae9f16b68369e49a84388d784", "pre_experiment_sha": "e529463e76d1d2eae9f16b68369e49a84388d784", "timestamp": "2026-04-05T22:13:39.390974+00:00", "hypothesis": "No hypothesis provided", "hypothesis_source": "synthesized", "mutation_diff_summary": "", "score": 3.5, "score_ci_lower": 3.1, "score_ci_upper": 3.9, "raw_scores": [3.5, 4.0, 3.0, 3.0, 4.0], "baseline_score": 3.6, "outcome": "DISCARDED", "failure_mode": null, "duration_seconds": 49.613679042086005, "tags": [], "learnings": "{\"what_changed\":\"\",\"what_improved\":[],\"what_regressed\":[],\"transferable_insight\":\"No hypothesis provided\",\"domain_tags\":[]}", "cost_usd": 0.12906135, "bootstrap_seed": 0, "agent_model": "claude-sonnet-4-6", "held_out_score": null, "criterion_names": ["correct_category", "concise_output", "follows_format", "no_hallucination", "handles_ambiguity"], "per_criterion_scores": {"correct_category": 1.0, "concise_output": 1.0, "follows_format": 0.0, "no_hallucination": 0.7, "handles_ambiguity": 0.8}, "failure_classification": {"category": "output_format", "description": "The experiment result indicates an output structure or schema violation, likely due to no hypothesis being provided and unspecified failure mode, which suggests missing required fields or improper format.", "fix_direction": "Ensure all required fields are present and conform strictly to the expected output schema.", "confidence": 0.85}, "drafts_generated": 1, "drafts_survived": 1}
{"id": "497b419a-d465-4aef-8b59-c50017675c68", "target_id": "B1-treatment", "git_sha": "e529463e76d1d2eae9f16b68369e49a84388d784", "pre_experiment_sha": "e529463e76d1d2eae9f16b68369e49a84388d784", "timestamp": "2026-04-05T22:14:44.819532+00:00", "hypothesis": "No hypothesis provided", "hypothesis_source": "synthesized", "mutation_diff_summary": "", "score": 3.5, "score_ci_lower": 3.1, "score_ci_upper": 3.9, "raw_scores": [4.0, 3.5, 3.0, 3.0, 4.0], "baseline_score": 3.6, "outcome": "DISCARDED", "failure_mode": null, "duration_seconds": 63.601741374935955, "tags": [], "learnings": "{\"what_changed\":\"\",\"what_improved\":[],\"what_regressed\":[],\"transferable_insight\":\"No hypothesis provided\",\"domain_tags\":[]}", "cost_usd": 0.15116675000000002, "bootstrap_seed": 0, "agent_model": "claude-sonnet-4-6", "held_out_score": null, "criterion_names": ["correct_category", "concise_output", "follows_format", "no_hallucination", "handles_ambiguity"], "per_criterion_scores": {"correct_category": 1.0, "concise_output": 1.0, "follows_format": 0.0, "no_hallucination": 0.8, "handles_ambiguity": 0.7}, "failure_classification": {"category": "output_format", "description": "The experiment failed due to a violation of the required output structure or schema, as no hypothesis was provided where one appears to be expected.", "fix_direction": "Ensure the hypothesis is supplied according to the required schema; validate input completeness before experiment execution.", "confidence": 0.85}, "drafts_generated": 1, "drafts_survived": 1}
{"id": "439764ac-e100-4454-b05d-31f070683800", "target_id": "B1-treatment", "git_sha": "e529463e76d1d2eae9f16b68369e49a84388d784", "pre_experiment_sha": "e529463e76d1d2eae9f16b68369e49a84388d784", "timestamp": "2026-04-05T22:15:40.836909+00:00", "hypothesis": "No hypothesis provided", "hypothesis_source": "synthesized", "mutation_diff_summary": "", "score": 3.5, "score_ci_lower": 3.0, "score_ci_upper": 3.9, "raw_scores": [3.5, 4.0, 2.5, 3.5, 4.0], "baseline_score": 3.6, "outcome": "DISCARDED", "failure_mode": null, "duration_seconds": 54.45251258392818, "tags": [], "learnings": "{\"what_changed\":\"\",\"what_improved\":[],\"what_regressed\":[],\"transferable_insight\":\"No hypothesis provided\",\"domain_tags\":[]}", "cost_usd": 0.13078649999999997, "bootstrap_seed": 0, "agent_model": "claude-sonnet-4-6", "held_out_score": null, "criterion_names": ["correct_category", "concise_output", "follows_format", "no_hallucination", "handles_ambiguity"], "per_criterion_scores": {"correct_category": 1.0, "concise_output": 1.0, "follows_format": 0.0, "no_hallucination": 0.7, "handles_ambiguity": 0.8}, "failure_classification": {"category": "output_format", "description": "The experiment lacks a stated hypothesis, which violates the expected output structure/schema.", "fix_direction": "Ensure the output includes all required sections, including a clearly stated hypothesis.", "confidence": 0.95}, "drafts_generated": 1, "drafts_survived": 1}
{"id": "e2078a8a-0e24-420f-a046-73f9191891cb", "target_id": "B1-treatment", "git_sha": "e529463e76d1d2eae9f16b68369e49a84388d784", "pre_experiment_sha": "e529463e76d1d2eae9f16b68369e49a84388d784", "timestamp": "2026-04-05T22:16:30.299717+00:00", "hypothesis": "No hypothesis provided", "hypothesis_source": "synthesized", "mutation_diff_summary": "", "score": 3.6, "score_ci_lower": 3.2, "score_ci_upper": 4.0, "raw_scores": [4.0, 4.0, 3.0, 3.0, 4.0], "baseline_score": 3.6, "outcome": "DISCARDED", "failure_mode": null, "duration_seconds": 47.98422250011936, "tags": [], "learnings": "{\"what_changed\":\"\",\"what_improved\":[],\"what_regressed\":[],\"transferable_insight\":\"No hypothesis provided\",\"domain_tags\":[]}", "cost_usd": 0.1303602, "bootstrap_seed": 0, "agent_model": "claude-sonnet-4-6", "held_out_score": null, "criterion_names": ["correct_category", "concise_output", "follows_format", "no_hallucination", "handles_ambiguity"], "per_criterion_scores": {"correct_category": 1.0, "concise_output": 1.0, "follows_format": 0.0, "no_hallucination": 0.8, "handles_ambiguity": 0.8}, "failure_classification": {"category": "output_format", "description": "The experiment failed due to an output structure or schema violation, as indicated by the score pattern and absence of semantic or syntactic errors.", "fix_direction": "Ensure output strictly matches the expected structure and adheres to required schema.", "confidence": 0.8}, "drafts_generated": 1, "drafts_survived": 1}
{"id": "88cba257-45c5-4ea1-aa21-65c689d81d6b", "target_id": "B1-treatment", "git_sha": "e529463e76d1d2eae9f16b68369e49a84388d784", "pre_experiment_sha": "e529463e76d1d2eae9f16b68369e49a84388d784", "timestamp": "2026-04-05T22:17:22.981683+00:00", "hypothesis": "No hypothesis provided", "hypothesis_source": "synthesized", "mutation_diff_summary": "", "score": 3.6, "score_ci_lower": 3.2, "score_ci_upper": 4.0, "raw_scores": [4.0, 4.0, 3.0, 3.0, 4.0], "baseline_score": 3.6, "outcome": "DISCARDED", "failure_mode": null, "duration_seconds": 51.09237650013529, "tags": [], "learnings": "{\"what_changed\":\"\",\"what_improved\":[],\"what_regressed\":[],\"transferable_insight\":\"No hypothesis provided\",\"domain_tags\":[]}", "cost_usd": 0.15082595, "bootstrap_seed": 0, "agent_model": "claude-sonnet-4-6", "held_out_score": null, "criterion_names": ["correct_category", "concise_output", "follows_format", "no_hallucination", "handles_ambiguity"], "per_criterion_scores": {"correct_category": 1.0, "concise_output": 1.0, "follows_format": 0.0, "no_hallucination": 0.8, "handles_ambiguity": 0.8}, "failure_classification": {"category": "output_format", "description": "The experiment failed due to an output structure or schema violation. This is indicated by the classification tags and the absence of a hypothesis or specific failure details, suggesting a formatting or structural error.", "fix_direction": "Ensure the output strictly matches the required schema and structure for future attempts.", "confidence": 0.8}, "drafts_generated": 1, "drafts_survived": 1}
{"id": "932dee5d-8fb0-404e-a44a-0e640b854936", "target_id": "B1-treatment", "git_sha": "e529463e76d1d2eae9f16b68369e49a84388d784", "pre_experiment_sha": "e529463e76d1d2eae9f16b68369e49a84388d784", "timestamp": "2026-04-05T22:18:27.758799+00:00", "hypothesis": "No hypothesis provided", "hypothesis_source": "synthesized", "mutation_diff_summary": "", "score": 3.3, "score_ci_lower": 3.0, "score_ci_upper": 3.7, "raw_scores": [4.0, 3.5, 3.0, 3.0, 3.0], "baseline_score": 3.6, "outcome": "DISCARDED", "failure_mode": null, "duration_seconds": 62.874567416962236, "tags": [], "learnings": "{\"what_changed\":\"\",\"what_improved\":[],\"what_regressed\":[],\"transferable_insight\":\"No hypothesis provided\",\"domain_tags\":[]}", "cost_usd": 0.17577874999999998, "bootstrap_seed": 0, "agent_model": "claude-sonnet-4-6", "held_out_score": null, "criterion_names": ["correct_category", "concise_output", "follows_format", "no_hallucination", "handles_ambiguity"], "per_criterion_scores": {"correct_category": 1.0, "concise_output": 1.0, "follows_format": 0.0, "no_hallucination": 0.7, "handles_ambiguity": 0.6}, "failure_classification": {"category": "output_format", "description": "The experiment did not provide a hypothesis or a clear failure mode, which violates the expected output structure/schema.", "fix_direction": "Ensure all required fields, especially 'Hypothesis' and 'Failure Mode', are filled in per the specified output schema.", "confidence": 0.9}, "drafts_generated": 1, "drafts_survived": 1}
{"id": "5a59386d-884b-4e50-a7a1-231c11e0d224", "target_id": "B1-treatment", "git_sha": "e529463e76d1d2eae9f16b68369e49a84388d784", "pre_experiment_sha": "e529463e76d1d2eae9f16b68369e49a84388d784", "timestamp": "2026-04-05T22:20:37.003204+00:00", "hypothesis": "No hypothesis provided", "hypothesis_source": "synthesized", "mutation_diff_summary": "", "score": 3.6, "score_ci_lower": 3.3, "score_ci_upper": 3.9, "raw_scores": [3.5, 4.0, 3.0, 3.5, 4.0], "baseline_score": 3.6, "outcome": "DISCARDED", "failure_mode": null, "duration_seconds": 127.30309012485668, "tags": [], "learnings": "{\"what_changed\":\"\",\"what_improved\":[],\"what_regressed\":[],\"transferable_insight\":\"No hypothesis provided\",\"domain_tags\":[]}", "cost_usd": 0.39248295000000005, "bootstrap_seed": 0, "agent_model": "claude-sonnet-4-6", "held_out_score": null, "criterion_names": ["correct_category", "concise_output", "follows_format", "no_hallucination", "handles_ambiguity"], "per_criterion_scores": {"correct_category": 1.0, "concise_output": 1.0, "follows_format": 0.0, "no_hallucination": 0.8, "handles_ambiguity": 0.8}, "failure_classification": {"category": "output_format", "description": "The failure mode is 'unknown' and there is no hypothesis, which points to a lack of required information or structure, possibly violating expected output schema or format.", "fix_direction": "Ensure all required fields are present and conform to the expected output structure/schema.", "confidence": 0.85}, "drafts_generated": 1, "drafts_survived": 1}
{"id": "9fb7b63b-9f8a-40fd-9be6-3d6b835b7aaf", "target_id": "B1-treatment", "git_sha": "e529463e76d1d2eae9f16b68369e49a84388d784", "pre_experiment_sha": "e529463e76d1d2eae9f16b68369e49a84388d784", "timestamp": "2026-04-05T22:21:35.195393+00:00", "hypothesis": "No hypothesis provided", "hypothesis_source": "synthesized", "mutation_diff_summary": "", "score": 3.5, "score_ci_lower": 3.1, "score_ci_upper": 3.9, "raw_scores": [3.5, 4.0, 3.0, 3.0, 4.0], "baseline_score": 3.6, "outcome": "DISCARDED", "failure_mode": null, "duration_seconds": 56.84828841709532, "tags": [], "learnings": "{\"what_changed\":\"\",\"what_improved\":[],\"what_regressed\":[],\"transferable_insight\":\"No hypothesis provided\",\"domain_tags\":[]}", "cost_usd": 0.1586488, "bootstrap_seed": 0, "agent_model": "claude-sonnet-4-6", "held_out_score": null, "criterion_names": ["correct_category", "concise_output", "follows_format", "no_hallucination", "handles_ambiguity"], "per_criterion_scores": {"correct_category": 1.0, "concise_output": 1.0, "follows_format": 0.0, "no_hallucination": 0.7, "handles_ambiguity": 0.8}, "failure_classification": {"category": "output_format", "description": "The experiment failed due to an output structure or schema violation, indicated by a score that suggests partial rather than total failure and absence of more detailed failure information.", "fix_direction": "Ensure that outputs conform strictly to the required structure or schema; review serialization and formatting steps.", "confidence": 0.8}, "drafts_generated": 1, "drafts_survived": 1}
{"id": "7ecea867-92d2-4b35-ac33-b8cf3a7f60d0", "target_id": "B1-treatment", "git_sha": "cf90e3a8d79091b30bd0aa60e765535595eb47d4", "pre_experiment_sha": "e529463e76d1d2eae9f16b68369e49a84388d784", "timestamp": "2026-04-05T22:23:22.209892+00:00", "hypothesis": "No hypothesis provided", "hypothesis_source": "synthesized", "mutation_diff_summary": "", "score": 3.6, "score_ci_lower": 3.2, "score_ci_upper": 4.0, "raw_scores": [4.0, 4.0, 3.0, 3.0, 4.0], "baseline_score": 3.6, "outcome": "KEPT", "failure_mode": null, "duration_seconds": 105.58396491711028, "tags": [], "learnings": "{\"what_changed\":\"\",\"what_improved\":[],\"what_regressed\":[],\"transferable_insight\":\"No hypothesis provided\",\"domain_tags\":[]}", "cost_usd": 0.28356225, "bootstrap_seed": 0, "agent_model": "claude-sonnet-4-6", "held_out_score": null, "criterion_names": ["correct_category", "concise_output", "follows_format", "no_hallucination", "handles_ambiguity"], "per_criterion_scores": {"correct_category": 1.0, "concise_output": 1.0, "follows_format": 0.0, "no_hallucination": 0.8, "handles_ambiguity": 0.8}, "failure_classification": null, "drafts_generated": 1, "drafts_survived": 1}
{"id": "ee043971-ae37-47a4-9aa7-08397b50a6f5", "target_id": "B1-treatment", "git_sha": "6755d74388867eb5608e36ee021bfe340f56d9a6", "pre_experiment_sha": "cf90e3a8d79091b30bd0aa60e765535595eb47d4", "timestamp": "2026-04-05T22:24:19.506754+00:00", "hypothesis": "No hypothesis provided", "hypothesis_source": "synthesized", "mutation_diff_summary": "", "score": 3.6, "score_ci_lower": 3.3, "score_ci_upper": 3.9, "raw_scores": [4.0, 4.0, 3.0, 3.5, 3.5], "baseline_score": 3.6, "outcome": "KEPT", "failure_mode": null, "duration_seconds": 56.855978958075866, "tags": [], "learnings": "{\"what_changed\":\"\",\"what_improved\":[],\"what_regressed\":[],\"transferable_insight\":\"No hypothesis provided\",\"domain_tags\":[]}", "cost_usd": 0.150636, "bootstrap_seed": 0, "agent_model": "claude-sonnet-4-6", "held_out_score": null, "criterion_names": ["correct_category", "concise_output", "follows_format", "no_hallucination", "handles_ambiguity"], "per_criterion_scores": {"correct_category": 1.0, "concise_output": 1.0, "follows_format": 0.0, "no_hallucination": 0.8, "handles_ambiguity": 0.8}, "failure_classification": null, "drafts_generated": 1, "drafts_survived": 1}
{"id": "94c42de6-abad-4924-a713-607b814aee43", "target_id": "B1-treatment", "git_sha": "2fa27870f101f09d25a0be953e17a72377c31e86", "pre_experiment_sha": "6755d74388867eb5608e36ee021bfe340f56d9a6", "timestamp": "2026-04-05T22:25:08.570085+00:00", "hypothesis": "No hypothesis provided", "hypothesis_source": "synthesized", "mutation_diff_summary": "", "score": 3.6, "score_ci_lower": 3.2, "score_ci_upper": 4.0, "raw_scores": [4.0, 4.0, 3.0, 3.0, 4.0], "baseline_score": 3.6, "outcome": "KEPT", "failure_mode": null, "duration_seconds": 48.629464583005756, "tags": [], "learnings": "{\"what_changed\":\"\",\"what_improved\":[],\"what_regressed\":[],\"transferable_insight\":\"No hypothesis provided\",\"domain_tags\":[]}", "cost_usd": 0.13011794999999998, "bootstrap_seed": 0, "agent_model": "claude-sonnet-4-6", "held_out_score": null, "criterion_names": ["correct_category", "concise_output", "follows_format", "no_hallucination", "handles_ambiguity"], "per_criterion_scores": {"correct_category": 1.0, "concise_output": 1.0, "follows_format": 0.0, "no_hallucination": 0.8, "handles_ambiguity": 0.8}, "failure_classification": null, "drafts_generated": 1, "drafts_survived": 1}
{"id": "147edf51-c46f-4aa9-b356-d88a69a80eeb", "target_id": "B1-treatment", "git_sha": "00eba67563b4214a22eceffa6bb1d11e10d7f036", "pre_experiment_sha": "2fa27870f101f09d25a0be953e17a72377c31e86", "timestamp": "2026-04-05T22:26:30.835315+00:00", "hypothesis": "No hypothesis provided", "hypothesis_source": "synthesized", "mutation_diff_summary": "", "score": 3.6, "score_ci_lower": 3.0, "score_ci_upper": 4.0, "raw_scores": [4.0, 4.0, 2.5, 3.5, 4.0], "baseline_score": 3.6, "outcome": "KEPT", "failure_mode": null, "duration_seconds": 81.81998725002632, "tags": [], "learnings": "{\"what_changed\":\"\",\"what_improved\":[],\"what_regressed\":[],\"transferable_insight\":\"No hypothesis provided\",\"domain_tags\":[]}", "cost_usd": 0.17903835, "bootstrap_seed": 0, "agent_model": "claude-sonnet-4-6", "held_out_score": null, "criterion_names": ["correct_category", "concise_output", "follows_format", "no_hallucination", "handles_ambiguity"], "per_criterion_scores": {"correct_category": 1.0, "concise_output": 1.0, "follows_format": 0.0, "no_hallucination": 0.8, "handles_ambiguity": 0.8}, "failure_classification": null, "drafts_generated": 1, "drafts_survived": 1}
