{"id": "6b9287c0-4644-4ca9-b6c8-660da8af31b7", "target_id": "B1-treatment", "git_sha": "64c12b7d4570c1078d5925efb49814d1ae31ea57", "pre_experiment_sha": "8aadc5911358b4430d2358d408f89d1fe98df3cf", "timestamp": "2026-04-19T01:36:39.191060+00:00", "hypothesis": "Tightening the prompt to a minimal exact-output rule will improve single-label format compliance and binary criteria scoring.", "hypothesis_source": "agent", "mutation_diff_summary": "", "score": 3.3, "score_ci_lower": 2.8, "score_ci_upper": 3.7, "raw_scores": [3.5, 2.5, 3.5, 4.0, 3.0], "baseline_score": 3.3, "outcome": "KEPT", "failure_mode": null, "duration_seconds": 13.685214833007194, "tags": ["format-control", "single-label", "deterministic", "minimal"], "learnings": "{\"what_changed\":\"\",\"what_improved\":[],\"what_regressed\":[],\"transferable_insight\":\"When a stricter instruction produces no measurable change, the most transferable lesson is that added precision alone does not guarantee better compliance or quality without addressing the underlying task difficulty or model behavior.\",\"domain_tags\":[\"prompt-engineering\",\"evaluation\",\"model-behavior\"]}", "cost_usd": 0.00787255, "bootstrap_seed": 0, "agent_model": "gpt-5.4", "held_out_score": null, "criterion_names": ["correct_category", "concise_output", "follows_format", "no_hallucination", "handles_ambiguity"], "per_criterion_scores": {"correct_category": 0.7, "concise_output": 1.0, "follows_format": 0.0, "no_hallucination": 0.8, "handles_ambiguity": 0.8}, "failure_classification": null, "drafts_generated": 1, "drafts_survived": 1}
{"id": "94d0f681-bd50-4725-afbc-d09780574b4a", "target_id": "B1-treatment", "git_sha": "6316a0eda4cfdb985c0a88c1c779ad79b624d4f4", "pre_experiment_sha": "64c12b7d4570c1078d5925efb49814d1ae31ea57", "timestamp": "2026-04-19T01:36:57.187650+00:00", "hypothesis": "Tightening the wording into a shorter exact-output contract will improve single-label format compliance.", "hypothesis_source": "agent", "mutation_diff_summary": "", "score": 2.9, "score_ci_lower": 2.3, "score_ci_upper": 3.5, "raw_scores": [4.0, 2.5, 3.0, 2.0, 3.0], "baseline_score": 3.3, "outcome": "KEPT", "failure_mode": null, "duration_seconds": 15.09003058297094, "tags": ["format-control", "deterministic", "minimal"], "learnings": "{\"what_changed\":\"\",\"what_improved\":[],\"what_regressed\":[],\"transferable_insight\":\"Making the required output format shorter and more explicit can improve adherence to a single-label response contract.\",\"domain_tags\":[\"prompt-engineering\",\"format-compliance\",\"instruction-design\"]}", "cost_usd": 0.0066675499999999995, "bootstrap_seed": 0, "agent_model": "gpt-5.4", "held_out_score": null, "criterion_names": ["correct_category", "concise_output", "follows_format", "no_hallucination", "handles_ambiguity"], "per_criterion_scores": {"correct_category": 0.6, "concise_output": 1.0, "follows_format": 0.0, "no_hallucination": 0.5, "handles_ambiguity": 0.8}, "failure_classification": null, "drafts_generated": 1, "drafts_survived": 1}
{"id": "4484f0a7-1962-4cbe-a887-88afad6d5ebe", "target_id": "B1-treatment", "git_sha": "52ca0f26fe956ce8fa376aa2134e53d7146f30f5", "pre_experiment_sha": "6316a0eda4cfdb985c0a88c1c779ad79b624d4f4", "timestamp": "2026-04-19T01:37:21.134853+00:00", "hypothesis": "Make the output contract more rigid and concise so the model emits exactly one provided label with no extra text.", "hypothesis_source": "agent", "mutation_diff_summary": "", "score": 2.9, "score_ci_lower": 2.6, "score_ci_upper": 3.2, "raw_scores": [3.0, 2.5, 3.0, 2.5, 3.5], "baseline_score": 2.9, "outcome": "KEPT", "failure_mode": null, "duration_seconds": 22.975335500086658, "tags": ["format-enforcement", "minimal", "deterministic"], "learnings": "{\"what_changed\":\"\",\"what_improved\":[],\"what_regressed\":[],\"transferable_insight\":\"When the desired output is a fixed label, tightening the response format can preserve correctness while reducing unnecessary variation.\",\"domain_tags\":[\"prompting\",\"output-formatting\",\"evaluation\"]}", "cost_usd": 0.00678755, "bootstrap_seed": 0, "agent_model": "gpt-5.4", "held_out_score": null, "criterion_names": ["correct_category", "concise_output", "follows_format", "no_hallucination", "handles_ambiguity"], "per_criterion_scores": {"correct_category": 0.5, "concise_output": 1.0, "follows_format": 0.0, "no_hallucination": 0.5, "handles_ambiguity": 0.9}, "failure_classification": null, "drafts_generated": 1, "drafts_survived": 1}
{"id": "f7d9686c-9dc1-49ea-b0cb-c971efed6895", "target_id": "B1-treatment", "git_sha": "1a78d7d512db6d7a88f55b770cfc5176a4e8df01", "pre_experiment_sha": "52ca0f26fe956ce8fa376aa2134e53d7146f30f5", "timestamp": "2026-04-19T01:37:46.695371+00:00", "hypothesis": "Make the output contract more explicit and deterministic by reducing the prompt to strict single-label selection and exact-only output.", "hypothesis_source": "agent", "mutation_diff_summary": "", "score": 3.1, "score_ci_lower": 2.5, "score_ci_upper": 3.5, "raw_scores": [3.0, 2.0, 3.5, 3.5, 3.5], "baseline_score": 2.9, "outcome": "KEPT", "failure_mode": null, "duration_seconds": 24.654439624981023, "tags": ["format", "determinism", "exact-match", "minimalism"], "learnings": "{\"what_changed\":\"\",\"what_improved\":[],\"what_regressed\":[],\"transferable_insight\":\"When a task requires a categorical decision, constraining the response format to a single exact label can improve consistency and reduce ambiguity.\",\"domain_tags\":[\"prompt-engineering\",\"classification\",\"output-formatting\"]}", "cost_usd": 0.00673255, "bootstrap_seed": 0, "agent_model": "gpt-5.4", "held_out_score": null, "criterion_names": ["correct_category", "concise_output", "follows_format", "no_hallucination", "handles_ambiguity"], "per_criterion_scores": {"correct_category": 0.5, "concise_output": 1.0, "follows_format": 0.0, "no_hallucination": 0.6, "handles_ambiguity": 1.0}, "failure_classification": null, "drafts_generated": 1, "drafts_survived": 1}
{"id": "0e8175f2-89d4-4b63-adce-937b1a7b76fb", "target_id": "B1-treatment", "git_sha": "39b68c02f0d74de027d4d7aa5fe573fccaf4be22", "pre_experiment_sha": "1a78d7d512db6d7a88f55b770cfc5176a4e8df01", "timestamp": "2026-04-19T01:37:59.494915+00:00", "hypothesis": "Tightening the prompt into a minimal exact-output contract will improve single-label compliance.", "hypothesis_source": "agent", "mutation_diff_summary": "", "score": 2.8, "score_ci_lower": 2.5, "score_ci_upper": 3.2, "raw_scores": [3.5, 2.5, 3.0, 2.5, 2.5], "baseline_score": 3.1, "outcome": "KEPT", "failure_mode": null, "duration_seconds": 10.42126245808322, "tags": ["strict-output", "deterministic", "minimal"], "learnings": "{\"what_changed\":\"\",\"what_improved\":[],\"what_regressed\":[],\"transferable_insight\":\"When a task requires a single exact output, reducing prompt ambiguity and constraining the response format can improve compliance even if no other measurable quality changes are observed.\",\"domain_tags\":[\"prompt-engineering\",\"instruction-following\",\"output-formatting\"]}", "cost_usd": 0.006202550000000001, "bootstrap_seed": 0, "agent_model": "gpt-5.4", "held_out_score": null, "criterion_names": ["correct_category", "concise_output", "follows_format", "no_hallucination", "handles_ambiguity"], "per_criterion_scores": {"correct_category": 0.4, "concise_output": 1.0, "follows_format": 0.0, "no_hallucination": 0.4, "handles_ambiguity": 1.0}, "failure_classification": null, "drafts_generated": 1, "drafts_survived": 1}
{"id": "1cac3bf5-3aeb-4cde-9b67-4b4142779597", "target_id": "B1-treatment", "git_sha": "602feadaa37c7cb8d5eb01b3216bbba508aa7b1f", "pre_experiment_sha": "39b68c02f0d74de027d4d7aa5fe573fccaf4be22", "timestamp": "2026-04-19T01:38:11.942218+00:00", "hypothesis": "Make the output contract even more explicit and deterministic by compressing it to a strict one-label-only instruction.", "hypothesis_source": "agent", "mutation_diff_summary": "", "score": 3.0, "score_ci_lower": 2.6, "score_ci_upper": 3.4, "raw_scores": [2.5, 2.5, 3.0, 3.5, 3.5], "baseline_score": 2.8, "outcome": "KEPT", "failure_mode": null, "duration_seconds": 11.350957958959043, "tags": ["strict-output", "deterministic", "concise"], "learnings": "{\"what_changed\":\"\",\"what_improved\":[],\"what_regressed\":[],\"transferable_insight\":\"When the desired output format is made stricter and more explicit, the system tends to produce more consistent and deterministic results.\",\"domain_tags\":[\"prompting\",\"output-formatting\",\"reliability\"]}", "cost_usd": 0.006127550000000001, "bootstrap_seed": 0, "agent_model": "gpt-5.4", "held_out_score": null, "criterion_names": ["correct_category", "concise_output", "follows_format", "no_hallucination", "handles_ambiguity"], "per_criterion_scores": {"correct_category": 0.5, "concise_output": 1.0, "follows_format": 0.0, "no_hallucination": 0.5, "handles_ambiguity": 1.0}, "failure_classification": null, "drafts_generated": 1, "drafts_survived": 1}
{"id": "f88d8274-17b8-49d0-9998-8fbb745d5f50", "target_id": "B1-treatment", "git_sha": "de198217c8e2494c8ecfc6c4b317ce6dfd223464", "pre_experiment_sha": "602feadaa37c7cb8d5eb01b3216bbba508aa7b1f", "timestamp": "2026-04-19T01:38:23.565269+00:00", "hypothesis": "Make the exact-output contract even shorter and more deterministic to reduce any chance of extra text.", "hypothesis_source": "agent", "mutation_diff_summary": "", "score": 3.1, "score_ci_lower": 3.0, "score_ci_upper": 3.3, "raw_scores": [3.0, 3.0, 3.0, 3.5, 3.0], "baseline_score": 3.0, "outcome": "KEPT", "failure_mode": null, "duration_seconds": 10.530751792015508, "tags": ["strict-output", "deterministic", "concise"], "learnings": "{\"what_changed\":\"\",\"what_improved\":[],\"what_regressed\":[],\"transferable_insight\":\"When a task requires exact output, tightening the specification to be shorter and more deterministic reduces the likelihood of unintended extra content.\",\"domain_tags\":[\"prompt-engineering\",\"reliability\",\"specification\"]}", "cost_usd": 0.005827550000000001, "bootstrap_seed": 0, "agent_model": "gpt-5.4", "held_out_score": null, "criterion_names": ["correct_category", "concise_output", "follows_format", "no_hallucination", "handles_ambiguity"], "per_criterion_scores": {"correct_category": 0.6, "concise_output": 1.0, "follows_format": 0.0, "no_hallucination": 0.7, "handles_ambiguity": 0.8}, "failure_classification": null, "drafts_generated": 1, "drafts_survived": 1}
{"id": "27f087f8-95f1-42da-8064-cff71793e771", "target_id": "B1-treatment", "git_sha": "34f0b1d6108460f9a7f5de16526bd2ac7eb8f934", "pre_experiment_sha": "de198217c8e2494c8ecfc6c4b317ce6dfd223464", "timestamp": "2026-04-19T01:38:36.929864+00:00", "hypothesis": "Make the output contract more explicit and deterministic by emphasizing a single exact label with no extra text under any uncertainty.", "hypothesis_source": "agent", "mutation_diff_summary": "", "score": 3.0, "score_ci_lower": 2.4, "score_ci_upper": 3.5, "raw_scores": [3.5, 2.0, 3.5, 2.5, 3.5], "baseline_score": 3.1, "outcome": "KEPT", "failure_mode": null, "duration_seconds": 11.049721791991033, "tags": ["exact-output", "deterministic", "binary-criteria", "concise"], "learnings": "{\"what_changed\":\"\",\"what_improved\":[],\"what_regressed\":[],\"transferable_insight\":\"When precision matters, specifying one exact allowed output with no extra text reduces ambiguity and improves consistency under uncertainty.\",\"domain_tags\":[\"prompting\",\"output-formatting\",\"reliability\"]}", "cost_usd": 0.00618755, "bootstrap_seed": 0, "agent_model": "gpt-5.4", "held_out_score": null, "criterion_names": ["correct_category", "concise_output", "follows_format", "no_hallucination", "handles_ambiguity"], "per_criterion_scores": {"correct_category": 0.6, "concise_output": 1.0, "follows_format": 0.0, "no_hallucination": 0.6, "handles_ambiguity": 0.8}, "failure_classification": null, "drafts_generated": 1, "drafts_survived": 1}
{"id": "48671934-40eb-4023-b3ab-0d2a0c8f4841", "target_id": "B1-treatment", "git_sha": "7dec985bab5a83d9cde3ae965d691190cb58c83a", "pre_experiment_sha": "34f0b1d6108460f9a7f5de16526bd2ac7eb8f934", "timestamp": "2026-04-19T01:38:48.756141+00:00", "hypothesis": "Make the prompt even shorter and more rigid to maximize exact single-label output compliance.", "hypothesis_source": "agent", "mutation_diff_summary": "", "score": 3.3, "score_ci_lower": 3.1, "score_ci_upper": 3.5, "raw_scores": [3.5, 3.0, 3.5, 3.5, 3.0], "baseline_score": 3.0, "outcome": "KEPT", "failure_mode": null, "duration_seconds": 10.731943874969147, "tags": ["strict-output", "concise", "deterministic"], "learnings": "{\"what_changed\":\"\",\"what_improved\":[],\"what_regressed\":[],\"transferable_insight\":\"Reducing ambiguity and constraining the response format more tightly can improve exact compliance with a required output structure.\",\"domain_tags\":[\"prompt-engineering\",\"instruction-following\",\"output-formatting\"]}", "cost_usd": 0.00605755, "bootstrap_seed": 0, "agent_model": "gpt-5.4", "held_out_score": null, "criterion_names": ["correct_category", "concise_output", "follows_format", "no_hallucination", "handles_ambiguity"], "per_criterion_scores": {"correct_category": 0.6, "concise_output": 1.0, "follows_format": 0.0, "no_hallucination": 0.8, "handles_ambiguity": 0.9}, "failure_classification": null, "drafts_generated": 1, "drafts_survived": 1}
{"id": "592bd13f-356a-4889-930a-073a6c86c2ee", "target_id": "B1-treatment", "git_sha": "b9880cdba6781a6e1f5633a593a8e46c1a790b51", "pre_experiment_sha": "7dec985bab5a83d9cde3ae965d691190cb58c83a", "timestamp": "2026-04-19T01:39:02.699157+00:00", "hypothesis": "Make the exact-output contract even more rigid and concise to reduce any chance of extra text.", "hypothesis_source": "agent", "mutation_diff_summary": "", "score": 3.0, "score_ci_lower": 2.3, "score_ci_upper": 3.7, "raw_scores": [2.0, 2.0, 4.0, 3.5, 3.5], "baseline_score": 3.3, "outcome": "KEPT", "failure_mode": null, "duration_seconds": 12.808559083961882, "tags": ["exact-output", "single-label", "deterministic", "concise"], "learnings": "{\"what_changed\":\"\",\"what_improved\":[],\"what_regressed\":[],\"transferable_insight\":\"When a task requires exact output, tightening the format contract can reduce the risk of unintended extra content.\",\"domain_tags\":[\"prompting\",\"output-formatting\",\"quality-control\"]}", "cost_usd": 0.00613755, "bootstrap_seed": 0, "agent_model": "gpt-5.4", "held_out_score": null, "criterion_names": ["correct_category", "concise_output", "follows_format", "no_hallucination", "handles_ambiguity"], "per_criterion_scores": {"correct_category": 0.4, "concise_output": 1.0, "follows_format": 0.0, "no_hallucination": 0.7, "handles_ambiguity": 0.9}, "failure_classification": null, "drafts_generated": 1, "drafts_survived": 1}
{"id": "e554c91c-79a9-4a21-86f7-0594d79d1ac3", "target_id": "B1-treatment", "git_sha": "28a1595a7c1144d5fa161083866f6d1ff93740aa", "pre_experiment_sha": "b9880cdba6781a6e1f5633a593a8e46c1a790b51", "timestamp": "2026-04-19T01:39:17.861026+00:00", "hypothesis": "Make the prompt shorter and more rigid by enforcing a one-label-only exact-output contract.", "hypothesis_source": "agent", "mutation_diff_summary": "", "score": 2.7, "score_ci_lower": 2.1, "score_ci_upper": 3.3, "raw_scores": [2.0, 2.5, 2.0, 3.5, 3.5], "baseline_score": 3.0, "outcome": "KEPT", "failure_mode": null, "duration_seconds": 12.992372250068001, "tags": ["concise", "strict-output", "deterministic", "binary-criteria"], "learnings": "{\"what_changed\":\"\",\"what_improved\":[],\"what_regressed\":[],\"transferable_insight\":\"When the task requires a fixed-format response, stricter output constraints can improve consistency by reducing ambiguity and variation.\",\"domain_tags\":[\"prompt-engineering\",\"output-formatting\",\"evaluation\"]}", "cost_usd": 0.00526835, "bootstrap_seed": 0, "agent_model": "gpt-5.4", "held_out_score": null, "criterion_names": ["correct_category", "concise_output", "follows_format", "no_hallucination", "handles_ambiguity"], "per_criterion_scores": {"correct_category": 0.4, "concise_output": 0.8, "follows_format": 0.0, "no_hallucination": 0.5, "handles_ambiguity": 1.0}, "failure_classification": null, "drafts_generated": 1, "drafts_survived": 1}
{"id": "8b28515a-0102-4d29-9436-3dc7369f40ab", "target_id": "B1-treatment", "git_sha": "b8fdc96a01421b5eee037cb7cf337d4d212dd8e2", "pre_experiment_sha": "28a1595a7c1144d5fa161083866f6d1ff93740aa", "timestamp": "2026-04-19T01:39:37.726652+00:00", "hypothesis": "A stricter exact-output contract with deterministic wording will improve binary_criteria_score.", "hypothesis_source": "agent", "mutation_diff_summary": "", "score": 3.1, "score_ci_lower": 2.5, "score_ci_upper": 3.7, "raw_scores": [4.0, 2.0, 3.5, 3.0, 3.0], "baseline_score": 2.7, "outcome": "KEPT", "failure_mode": null, "duration_seconds": 18.832066916977055, "tags": ["concise", "exact-output", "deterministic", "single-label"], "learnings": "{\"what_changed\":\"\",\"what_improved\":[],\"what_regressed\":[],\"transferable_insight\":\"When success is judged by a binary criterion, reducing ambiguity through stricter, deterministic output requirements can improve compliance and evaluation outcomes.\",\"domain_tags\":[\"prompting\",\"evaluation\",\"specification\"]}", "cost_usd": 0.005042550000000001, "bootstrap_seed": 0, "agent_model": "gpt-5.4", "held_out_score": null, "criterion_names": ["correct_category", "concise_output", "follows_format", "no_hallucination", "handles_ambiguity"], "per_criterion_scores": {"correct_category": 0.5, "concise_output": 1.0, "follows_format": 0.0, "no_hallucination": 0.6, "handles_ambiguity": 1.0}, "failure_classification": null, "drafts_generated": 1, "drafts_survived": 1}
{"id": "484f04b8-8686-4fc2-a4f6-136d5b326789", "target_id": "B1-treatment", "git_sha": "b8fdc96a01421b5eee037cb7cf337d4d212dd8e2", "pre_experiment_sha": "b8fdc96a01421b5eee037cb7cf337d4d212dd8e2", "timestamp": "2026-04-19T01:39:49.459059+00:00", "hypothesis": "Make the prompt even shorter and more rigid to maximize exact single-label outputs.", "hypothesis_source": "agent", "mutation_diff_summary": "", "score": 2.7, "score_ci_lower": 2.5, "score_ci_upper": 2.9, "raw_scores": [2.5, 2.5, 2.5, 3.0, 3.0], "baseline_score": 3.1, "outcome": "DISCARDED", "failure_mode": null, "duration_seconds": 10.737045499961823, "tags": ["concise", "strict-output", "deterministic"], "learnings": "{\"what_changed\":\"\",\"what_improved\":[],\"what_regressed\":[],\"transferable_insight\":\"Over-constraining a prompt can reduce output flexibility without improving exactness, so tighter formatting alone is not a reliable path to better single-label performance.\",\"domain_tags\":[\"prompt-engineering\",\"classification\",\"evaluation\"]}", "cost_usd": 0.005102550000000001, "bootstrap_seed": 0, "agent_model": "gpt-5.4", "held_out_score": null, "criterion_names": ["correct_category", "concise_output", "follows_format", "no_hallucination", "handles_ambiguity"], "per_criterion_scores": {"correct_category": 0.4, "concise_output": 1.0, "follows_format": 0.0, "no_hallucination": 0.4, "handles_ambiguity": 0.9}, "failure_classification": {"category": "semantic_drift", "description": "The hypothesis focuses on shortening and rigidifying the prompt to maximize exact outputs, but the experiment failed without a clear output-format issue or syntax/parsing issue. Given the low score and unspecified failure mode, the likely problem is the prompt changes altered the intended meaning/behavior rather than only controlling formatting or evaluation.", "fix_direction": "Test prompt-shortening separately from behavioral constraints: keep semantics constant while only tightening explicit output schema/instructions; add targeted checks for meaning preservation and compare with a previously passing baseline.", "confidence": 0.38}, "drafts_generated": 1, "drafts_survived": 1}
{"id": "5d1b782a-f4d4-4836-bcae-8afd44c2e18f", "target_id": "B1-treatment", "git_sha": "b8fdc96a01421b5eee037cb7cf337d4d212dd8e2", "pre_experiment_sha": "b8fdc96a01421b5eee037cb7cf337d4d212dd8e2", "timestamp": "2026-04-19T01:40:05.879966+00:00", "hypothesis": "A stricter exact-output contract will reduce format drift and improve single-label compliance.", "hypothesis_source": "agent", "mutation_diff_summary": "", "score": 2.9, "score_ci_lower": 2.6, "score_ci_upper": 3.2, "raw_scores": [3.0, 2.5, 3.0, 3.5, 2.5], "baseline_score": 3.1, "outcome": "DISCARDED", "failure_mode": null, "duration_seconds": 12.807679624995217, "tags": ["strict-output", "minimal", "deterministic"], "learnings": "{\"what_changed\":\"\",\"what_improved\":[],\"what_regressed\":[],\"transferable_insight\":\"Tightening output constraints can fail to improve compliance if the added rigidity does not address the underlying source of variability or ambiguity.\",\"domain_tags\":[\"evaluation\",\"process-design\",\"quality-control\"]}", "cost_usd": 0.005286550000000001, "bootstrap_seed": 0, "agent_model": "gpt-5.4", "held_out_score": null, "criterion_names": ["correct_category", "concise_output", "follows_format", "no_hallucination", "handles_ambiguity"], "per_criterion_scores": {"correct_category": 0.5, "concise_output": 1.0, "follows_format": 0.0, "no_hallucination": 0.5, "handles_ambiguity": 0.9}, "failure_classification": {"category": "output_format", "description": "The experiment failed to adhere to the required exact-output structure/schema, leading to format drift or incorrect single-label formatting.", "fix_direction": "Tighten output generation to strictly follow the schema (e.g., enforce a fixed template/JSON structure and single-label constraint, add validation/parsing checks before scoring).", "confidence": 0.42}, "drafts_generated": 1, "drafts_survived": 1}
