{"id": "7e6589f4-55a7-4f91-9c88-71bbf88cebba", "target_id": "B1-treatment", "git_sha": "bffd2770bfbd1265c4273b16fb3a90864110a722", "pre_experiment_sha": "bffd2770bfbd1265c4273b16fb3a90864110a722", "timestamp": "2026-04-19T17:16:50.029067+00:00", "hypothesis": "A shorter, higher-priority prompt will better enforce emitting exactly one copied allowed label with no extra text.", "hypothesis_source": "agent", "mutation_diff_summary": "", "score": 2.8, "score_ci_lower": 2.3, "score_ci_upper": 3.2, "raw_scores": [2.0, 3.0, 3.0, 2.5, 3.5], "baseline_score": 3.4, "outcome": "DISCARDED", "failure_mode": null, "duration_seconds": 12.20776391599793, "tags": ["concise", "strict-output", "single-label"], "learnings": "{\"what_changed\":\"\",\"what_improved\":[],\"what_regressed\":[],\"transferable_insight\":\"Concise, high-priority instructions do not necessarily improve strict output compliance when the task requires exact formatting and no extra text.\",\"domain_tags\":[\"prompt-engineering\",\"instruction-following\",\"output-formatting\"]}", "cost_usd": 0.00853415, "bootstrap_seed": 0, "agent_model": "gpt-5.4", "held_out_score": null, "criterion_names": ["correct_category", "concise_output", "follows_format", "no_hallucination", "handles_ambiguity"], "per_criterion_scores": {"correct_category": 0.4, "concise_output": 1.0, "follows_format": 0.0, "no_hallucination": 0.6, "handles_ambiguity": 0.8}, "failure_classification": {"category": "output_format", "description": "The experiment failed the requirement to emit exactly one copied allowed label with no extra text; the output format likely violated the expected strict structure/schema.", "fix_direction": "Constrain decoding/output strictly to a single allowed label (no surrounding whitespace, punctuation, or explanatory text) and validate the final output against the allowed-label set.", "confidence": 0.72}, "drafts_generated": 1, "drafts_survived": 1}
{"id": "8b149438-0f81-4718-a3cb-727c5c9f4a18", "target_id": "B1-treatment", "git_sha": "8a66606d37ac89d331e5d5bada7281ddfd1f748d", "pre_experiment_sha": "bffd2770bfbd1265c4273b16fb3a90864110a722", "timestamp": "2026-04-19T17:17:04.796363+00:00", "hypothesis": "Compress the prompt into a higher-priority single-label contract that enforces exact copying of one allowed label with no extra text.", "hypothesis_source": "agent", "mutation_diff_summary": "", "score": 3.1, "score_ci_lower": 2.6, "score_ci_upper": 3.6, "raw_scores": [3.5, 2.5, 2.5, 3.0, 4.0], "baseline_score": 3.4, "outcome": "KEPT", "failure_mode": null, "duration_seconds": 12.247969749965705, "tags": ["concise", "strict-format", "single-label", "decisive"], "learnings": "{\"what_changed\":\"\",\"what_improved\":[],\"what_regressed\":[],\"transferable_insight\":\"When the task requires strict format compliance, reducing the instruction to one unambiguous allowed output and explicitly forbidding any extra text improves adherence to the contract.\",\"domain_tags\":[\"prompt-engineering\",\"format-control\",\"instruction-design\"]}", "cost_usd": 0.00866335, "bootstrap_seed": 0, "agent_model": "gpt-5.4", "held_out_score": null, "criterion_names": ["correct_category", "concise_output", "follows_format", "no_hallucination", "handles_ambiguity"], "per_criterion_scores": {"correct_category": 0.7, "concise_output": 0.9, "follows_format": 0.0, "no_hallucination": 0.6, "handles_ambiguity": 0.9}, "failure_classification": null, "drafts_generated": 1, "drafts_survived": 1}
{"id": "d78b6d55-8c85-49f3-b178-07ee25e3f94f", "target_id": "B1-treatment", "git_sha": "8a66606d37ac89d331e5d5bada7281ddfd1f748d", "pre_experiment_sha": "8a66606d37ac89d331e5d5bada7281ddfd1f748d", "timestamp": "2026-04-19T17:17:16.771785+00:00", "hypothesis": "A shorter, stricter prompt will improve exact single-label compliance and reduce extra-text failures.", "hypothesis_source": "agent", "mutation_diff_summary": "", "score": 3.0, "score_ci_lower": 2.6, "score_ci_upper": 3.5, "raw_scores": [4.0, 2.5, 3.0, 3.0, 2.5], "baseline_score": 3.1, "outcome": "DISCARDED", "failure_mode": null, "duration_seconds": 10.625615041004494, "tags": ["concise", "strict-output", "single-label"], "learnings": "{\"what_changed\":\"\",\"what_improved\":[],\"what_regressed\":[],\"transferable_insight\":\"When an intervention shows no measurable gains and no clear regressions, the safest conclusion is that the change was too weak or misaligned to affect the target behavior.\",\"domain_tags\":[\"evaluation\",\"optimization\",\"experimental-design\"]}", "cost_usd": 0.00716435, "bootstrap_seed": 0, "agent_model": "gpt-5.4", "held_out_score": null, "criterion_names": ["correct_category", "concise_output", "follows_format", "no_hallucination", "handles_ambiguity"], "per_criterion_scores": {"correct_category": 0.5, "concise_output": 1.0, "follows_format": 0.0, "no_hallucination": 0.5, "handles_ambiguity": 1.0}, "failure_classification": {"category": "output_format", "description": "The experiment achieved a low compliance score, indicating the output did not adhere to the required single-label/output structure, likely producing extra text or not matching the expected schema even if the core content was present.", "fix_direction": "Tighten the prompting to require strict JSON-only (or exact schema) output with explicit prohibitions on extra text; add constraints like 'respond with ONLY the requested JSON object' and 'no additional fields' plus validation examples.", "confidence": 0.42}, "drafts_generated": 1, "drafts_survived": 1}
{"id": "e0ebffcf-af2a-4eb0-ba03-ca134b8411a7", "target_id": "B1-treatment", "git_sha": "8a66606d37ac89d331e5d5bada7281ddfd1f748d", "pre_experiment_sha": "8a66606d37ac89d331e5d5bada7281ddfd1f748d", "timestamp": "2026-04-19T17:17:32.457102+00:00", "hypothesis": "A shorter, stricter one-label contract will reduce format drift and increase exact-match label outputs.", "hypothesis_source": "agent", "mutation_diff_summary": "", "score": 2.8, "score_ci_lower": 2.3, "score_ci_upper": 3.4, "raw_scores": [4.0, 2.5, 3.0, 2.0, 2.5], "baseline_score": 3.1, "outcome": "DISCARDED", "failure_mode": null, "duration_seconds": 11.036569957970642, "tags": ["format-hardening", "concise", "single-label"], "learnings": "{\"what_changed\":\"\",\"what_improved\":[],\"what_regressed\":[],\"transferable_insight\":\"Tightening output constraints can improve consistency only when the task and model behavior are already well-aligned; otherwise, stricter formatting alone may not change results.\",\"domain_tags\":[\"evaluation\",\"prompting\",\"reliability\"]}", "cost_usd": 0.00797135, "bootstrap_seed": 0, "agent_model": "gpt-5.4", "held_out_score": null, "criterion_names": ["correct_category", "concise_output", "follows_format", "no_hallucination", "handles_ambiguity"], "per_criterion_scores": {"correct_category": 0.5, "concise_output": 1.0, "follows_format": 0.0, "no_hallucination": 0.4, "handles_ambiguity": 0.9}, "failure_classification": {"category": "output_format", "description": "The experiment likely produced outputs that did not conform to the expected one-label contract/output schema, indicating format drift persisted despite the stricter constraint.", "fix_direction": "Tighten and enforce the exact output schema at generation time (e.g., strict single-token/label-only constraints, post-generation validation with automatic retries), and verify that the model cannot emit additional text.", "confidence": 0.6}, "drafts_generated": 1, "drafts_survived": 1}
{"id": "f7505cc4-edd6-492b-8621-f550534b002a", "target_id": "B1-treatment", "git_sha": "7e13f5e5abd59dc22160d2301b114c644f3ab9f7", "pre_experiment_sha": "8a66606d37ac89d331e5d5bada7281ddfd1f748d", "timestamp": "2026-04-19T17:17:48.108009+00:00", "hypothesis": "A shorter, stricter one-label contract will improve exact-format compliance and decisive single-label outputs.", "hypothesis_source": "agent", "mutation_diff_summary": "", "score": 2.7, "score_ci_lower": 2.3, "score_ci_upper": 3.0, "raw_scores": [3.0, 2.0, 3.0, 3.0, 2.5], "baseline_score": 3.1, "outcome": "KEPT", "failure_mode": null, "duration_seconds": 11.14333070802968, "tags": ["format-hardening", "concise", "single-label"], "learnings": "{\"what_changed\":\"\",\"what_improved\":[],\"what_regressed\":[],\"transferable_insight\":\"Tightening output constraints can improve format adherence and decisiveness by reducing ambiguity in the response space.\",\"domain_tags\":[\"prompt-design\",\"output-formatting\",\"decision-making\"]}", "cost_usd": 0.00751255, "bootstrap_seed": 0, "agent_model": "gpt-5.4", "held_out_score": null, "criterion_names": ["correct_category", "concise_output", "follows_format", "no_hallucination", "handles_ambiguity"], "per_criterion_scores": {"correct_category": 0.3, "concise_output": 1.0, "follows_format": 0.0, "no_hallucination": 0.4, "handles_ambiguity": 1.0}, "failure_classification": null, "drafts_generated": 1, "drafts_survived": 1}
{"id": "8700c90d-ac54-43c5-81b8-2d7d8672a6c2", "target_id": "B1-treatment", "git_sha": "4c4a11c09dad177b4f2385299e0bebd3a4fd9dde", "pre_experiment_sha": "7e13f5e5abd59dc22160d2301b114c644f3ab9f7", "timestamp": "2026-04-19T17:18:00.716038+00:00", "hypothesis": "Make the prompt even shorter and stricter so the model prioritizes emitting one exact allowed label with no extra tokens.", "hypothesis_source": "agent", "mutation_diff_summary": "", "score": 3.3, "score_ci_lower": 2.9, "score_ci_upper": 3.7, "raw_scores": [3.5, 2.5, 3.0, 4.0, 3.5], "baseline_score": 2.7, "outcome": "KEPT", "failure_mode": null, "duration_seconds": 11.46042545803357, "tags": ["format-hardening", "single-label", "concise"], "learnings": "{\"what_changed\":\"\",\"what_improved\":[],\"what_regressed\":[],\"transferable_insight\":\"When the desired output is a constrained label, reducing prompt verbosity and tightening instructions can improve compliance by minimizing opportunities for extraneous generation.\",\"domain_tags\":[\"prompt-engineering\",\"output-control\",\"instruction-following\"]}", "cost_usd": 0.006537550000000001, "bootstrap_seed": 0, "agent_model": "gpt-5.4", "held_out_score": null, "criterion_names": ["correct_category", "concise_output", "follows_format", "no_hallucination", "handles_ambiguity"], "per_criterion_scores": {"correct_category": 0.9, "concise_output": 1.0, "follows_format": 0.0, "no_hallucination": 0.5, "handles_ambiguity": 0.9}, "failure_classification": null, "drafts_generated": 1, "drafts_survived": 1}
{"id": "4100c8bd-bb8e-4924-8d8e-de418451fa30", "target_id": "B1-treatment", "git_sha": "87cfa0da98f30c43c9ae4c17a66835be8e43d324", "pre_experiment_sha": "4c4a11c09dad177b4f2385299e0bebd3a4fd9dde", "timestamp": "2026-04-19T17:18:15.523072+00:00", "hypothesis": "A tighter single-label-only contract will reduce format violations and improve exact-label compliance.", "hypothesis_source": "agent", "mutation_diff_summary": "", "score": 3.1, "score_ci_lower": 2.5, "score_ci_upper": 3.5, "raw_scores": [3.5, 2.0, 3.0, 3.5, 3.5], "baseline_score": 3.3, "outcome": "KEPT", "failure_mode": null, "duration_seconds": 11.992432832950726, "tags": ["format-constraint", "brevity", "exact-match"], "learnings": "{\"what_changed\":\"\",\"what_improved\":[],\"what_regressed\":[],\"transferable_insight\":\"Stricter output constraints can improve adherence to a required format even when they do not change the underlying task outcome.\",\"domain_tags\":[\"prompting\",\"format-compliance\",\"evaluation\"]}", "cost_usd": 0.005917550000000001, "bootstrap_seed": 0, "agent_model": "gpt-5.4", "held_out_score": null, "criterion_names": ["correct_category", "concise_output", "follows_format", "no_hallucination", "handles_ambiguity"], "per_criterion_scores": {"correct_category": 0.8, "concise_output": 1.0, "follows_format": 0.0, "no_hallucination": 0.3, "handles_ambiguity": 1.0}, "failure_classification": null, "drafts_generated": 1, "drafts_survived": 1}
{"id": "0edbc1be-ed7c-4224-817c-66559f6f9cab", "target_id": "B1-treatment", "git_sha": "66402060013d273a259e59b97fa0124182ff3357", "pre_experiment_sha": "87cfa0da98f30c43c9ae4c17a66835be8e43d324", "timestamp": "2026-04-19T17:18:27.520140+00:00", "hypothesis": "A shorter, stricter exact-output contract will increase single-label compliance.", "hypothesis_source": "agent", "mutation_diff_summary": "", "score": 3.0, "score_ci_lower": 2.5, "score_ci_upper": 3.4, "raw_scores": [3.5, 2.0, 3.5, 3.0, 3.0], "baseline_score": 3.1, "outcome": "KEPT", "failure_mode": null, "duration_seconds": 10.953927833936177, "tags": ["format-control", "exact-match", "compact"], "learnings": "{\"what_changed\":\"\",\"what_improved\":[],\"what_regressed\":[],\"transferable_insight\":\"Tightening output constraints can improve adherence to a single required format, but it may not change measured quality when the task is already well-bounded.\",\"domain_tags\":[\"prompting\",\"instruction-following\",\"evaluation\"]}", "cost_usd": 0.00571755, "bootstrap_seed": 0, "agent_model": "gpt-5.4", "held_out_score": null, "criterion_names": ["correct_category", "concise_output", "follows_format", "no_hallucination", "handles_ambiguity"], "per_criterion_scores": {"correct_category": 0.4, "concise_output": 1.0, "follows_format": 0.0, "no_hallucination": 0.6, "handles_ambiguity": 1.0}, "failure_classification": null, "drafts_generated": 1, "drafts_survived": 1}
{"id": "2bd3f5c3-a4ac-4077-b023-68d8b3f8ab9f", "target_id": "B1-treatment", "git_sha": "208a9672eb86d63653128da08ed05d7453d2d7ef", "pre_experiment_sha": "66402060013d273a259e59b97fa0124182ff3357", "timestamp": "2026-04-19T17:18:39.523140+00:00", "hypothesis": "Make the prompt even more compact and absolute so the model prioritizes exact one-label output with no extras.", "hypothesis_source": "agent", "mutation_diff_summary": "", "score": 2.9, "score_ci_lower": 2.4, "score_ci_upper": 3.5, "raw_scores": [3.0, 2.0, 3.0, 4.0, 2.5], "baseline_score": 3.0, "outcome": "KEPT", "failure_mode": null, "duration_seconds": 10.677918125060387, "tags": ["format-constraint", "exact-match", "compact"], "learnings": "{\"what_changed\":\"\",\"what_improved\":[],\"what_regressed\":[],\"transferable_insight\":\"When the task requires a single exact label, making the instruction more concise and unambiguous can improve compliance by reducing opportunities for extra output.\",\"domain_tags\":[\"prompt-engineering\",\"instruction-following\",\"output-formatting\"]}", "cost_usd": 0.0056225500000000005, "bootstrap_seed": 0, "agent_model": "gpt-5.4", "held_out_score": null, "criterion_names": ["correct_category", "concise_output", "follows_format", "no_hallucination", "handles_ambiguity"], "per_criterion_scores": {"correct_category": 0.6, "concise_output": 1.0, "follows_format": 0.0, "no_hallucination": 0.3, "handles_ambiguity": 1.0}, "failure_classification": null, "drafts_generated": 1, "drafts_survived": 1}
{"id": "16cbd527-9bea-42f0-97f2-ef51733f5e7b", "target_id": "B1-treatment", "git_sha": "ed97d6bec6754484e0b5791fff330310a7023984", "pre_experiment_sha": "208a9672eb86d63653128da08ed05d7453d2d7ef", "timestamp": "2026-04-19T17:18:53.544185+00:00", "hypothesis": "A more compact, priority-ordered exact-output contract will increase single-label compliance.", "hypothesis_source": "agent", "mutation_diff_summary": "", "score": 3.1, "score_ci_lower": 2.5, "score_ci_upper": 3.7, "raw_scores": [3.5, 2.0, 3.0, 4.0, 3.0], "baseline_score": 2.9, "outcome": "KEPT", "failure_mode": null, "duration_seconds": 11.636095999972895, "tags": ["compact", "exact-output", "single-label", "constraint-tightening"], "learnings": "{\"what_changed\":\"\",\"what_improved\":[],\"what_regressed\":[],\"transferable_insight\":\"When exact outputs are required, making the contract more compact and explicitly prioritizing requirements can improve compliance by reducing ambiguity and cognitive load.\",\"domain_tags\":[\"instruction-design\",\"communication\",\"process-optimization\"]}", "cost_usd": 0.00549755, "bootstrap_seed": 0, "agent_model": "gpt-5.4", "held_out_score": null, "criterion_names": ["correct_category", "concise_output", "follows_format", "no_hallucination", "handles_ambiguity"], "per_criterion_scores": {"correct_category": 0.6, "concise_output": 1.0, "follows_format": 0.0, "no_hallucination": 0.5, "handles_ambiguity": 1.0}, "failure_classification": null, "drafts_generated": 1, "drafts_survived": 1}
{"id": "86b12bdc-61c6-4ad0-b487-4a87ddd42884", "target_id": "B1-treatment", "git_sha": "6d4c5f0bc3f8f68155803e664c2535aa0db672c8", "pre_experiment_sha": "ed97d6bec6754484e0b5791fff330310a7023984", "timestamp": "2026-04-19T17:19:05.584813+00:00", "hypothesis": "Use a single-line priority contract that demands one verbatim allowed label and explicitly forbids any additional tokens.", "hypothesis_source": "agent", "mutation_diff_summary": "", "score": 3.0, "score_ci_lower": 3.0, "score_ci_upper": 3.0, "raw_scores": [3.0, 3.0, 3.0, 3.0, 3.0], "baseline_score": 3.1, "outcome": "KEPT", "failure_mode": null, "duration_seconds": 10.79509299993515, "tags": ["format-hardening", "exact-output", "minimal", "single-label"], "learnings": "{\"what_changed\":\"\",\"what_improved\":[],\"what_regressed\":[\"no_hallucination: FAIL (was PASS)\"],\"transferable_insight\":\"When a task requires an exact constrained output, adding an explicit prohibition on extra tokens can still increase the risk of unintended additions if the instruction is not robustly enforced.\",\"domain_tags\":[\"prompting\",\"output-control\",\"reliability\"]}", "cost_usd": 0.016892550000000003, "bootstrap_seed": 0, "agent_model": "gpt-5.4", "held_out_score": null, "criterion_names": ["correct_category", "concise_output", "follows_format", "no_hallucination", "handles_ambiguity"], "per_criterion_scores": {"correct_category": 0.6, "concise_output": 1.0, "follows_format": 0.0, "no_hallucination": 0.4, "handles_ambiguity": 1.0}, "failure_classification": null, "drafts_generated": 1, "drafts_survived": 1}
{"id": "38cc3ece-6e88-470c-8820-7ce327eefd13", "target_id": "B1-treatment", "git_sha": "4a25f375e99ca9818ce04348d0b3ea9917114c1f", "pre_experiment_sha": "6d4c5f0bc3f8f68155803e664c2535aa0db672c8", "timestamp": "2026-04-19T17:19:25.082683+00:00", "hypothesis": "A more literal exact-output contract that bans any text beyond the chosen allowed label may improve format compliance.", "hypothesis_source": "agent", "mutation_diff_summary": "", "score": 3.0, "score_ci_lower": 2.7, "score_ci_upper": 3.3, "raw_scores": [3.5, 3.0, 3.0, 2.5, 3.0], "baseline_score": 3.0, "outcome": "KEPT", "failure_mode": null, "duration_seconds": 18.267577000078745, "tags": ["exact-output", "format-compliance", "minimal", "single-label"], "learnings": "{\"what_changed\":\"\",\"what_improved\":[\"no_hallucination: PASS (was FAIL)\"],\"what_regressed\":[\"correct_category: FAIL (was PASS)\"],\"transferable_insight\":\"Tightening an output contract can reduce extraneous content, but it may also shift errors from verbosity to incorrect label selection, so stricter formatting alone does not guarantee better task accuracy.\",\"domain_tags\":[\"output-formatting\",\"classification\",\"reliability\"]}", "cost_usd": 0.01696755, "bootstrap_seed": 0, "agent_model": "gpt-5.4", "held_out_score": null, "criterion_names": ["correct_category", "concise_output", "follows_format", "no_hallucination", "handles_ambiguity"], "per_criterion_scores": {"correct_category": 0.4, "concise_output": 1.0, "follows_format": 0.0, "no_hallucination": 0.6, "handles_ambiguity": 1.0}, "failure_classification": null, "drafts_generated": 1, "drafts_survived": 1}
{"id": "980ad811-d33b-4189-99a9-91cacbe16d66", "target_id": "B1-treatment", "git_sha": "3ea5969a56a7d96ab48e5f9d21e09f06f01df31a", "pre_experiment_sha": "4a25f375e99ca9818ce04348d0b3ea9917114c1f", "timestamp": "2026-04-19T17:19:39.817335+00:00", "hypothesis": "Make the contract maximally literal by specifying a single-token final answer copied verbatim from the allowed labels only.", "hypothesis_source": "agent", "mutation_diff_summary": "", "score": 3.1, "score_ci_lower": 2.6, "score_ci_upper": 3.6, "raw_scores": [3.0, 2.5, 3.5, 4.0, 2.5], "baseline_score": 3.0, "outcome": "KEPT", "failure_mode": null, "duration_seconds": 11.751509667024948, "tags": ["exact-output", "single-label", "format-hardening", "ultra-compact"], "learnings": "{\"what_changed\":\"\",\"what_improved\":[\"correct_category: PASS (was FAIL)\"],\"what_regressed\":[],\"transferable_insight\":\"When the task has a constrained label set, making the required output format maximally explicit and limiting the answer to one verbatim token from that set can improve compliance and correctness.\",\"domain_tags\":[\"instruction-following\",\"output-formatting\",\"classification\"]}", "cost_usd": 0.01789255, "bootstrap_seed": 0, "agent_model": "gpt-5.4", "held_out_score": null, "criterion_names": ["correct_category", "concise_output", "follows_format", "no_hallucination", "handles_ambiguity"], "per_criterion_scores": {"correct_category": 0.5, "concise_output": 1.0, "follows_format": 0.0, "no_hallucination": 0.6, "handles_ambiguity": 1.0}, "failure_classification": null, "drafts_generated": 1, "drafts_survived": 1}
