{"id": "69c7377a-707b-4dc1-9d10-d761133d0ec6", "target_id": "B1-treatment", "git_sha": "50b861aa54a1e95161335c0b3e27550fb991c717", "pre_experiment_sha": "8ccd59dc3c882958a5cfd36dbbe70f4b33727924", "timestamp": "2026-04-05T23:16:16.198418+00:00", "hypothesis": "No hypothesis provided", "hypothesis_source": "synthesized", "mutation_diff_summary": "", "score": 3.6, "score_ci_lower": 3.3, "score_ci_upper": 3.9, "raw_scores": [4.0, 4.0, 3.0, 3.5, 3.5], "baseline_score": 3.6, "outcome": "KEPT", "failure_mode": null, "duration_seconds": 103.0470612088684, "tags": [], "learnings": "{\"what_changed\":\"\",\"what_improved\":[],\"what_regressed\":[],\"transferable_insight\":\"No hypothesis provided\",\"domain_tags\":[]}", "cost_usd": 0.2971518, "bootstrap_seed": 0, "agent_model": "claude-sonnet-4-6", "held_out_score": null, "criterion_names": ["correct_category", "concise_output", "follows_format", "no_hallucination", "handles_ambiguity"], "per_criterion_scores": {"correct_category": 1.0, "concise_output": 1.0, "follows_format": 0.0, "no_hallucination": 0.8, "handles_ambiguity": 0.8}, "failure_classification": null, "drafts_generated": 1, "drafts_survived": 1}
{"id": "86c259e8-8776-4180-9215-1395e985a814", "target_id": "B1-treatment", "git_sha": "50b861aa54a1e95161335c0b3e27550fb991c717", "pre_experiment_sha": "50b861aa54a1e95161335c0b3e27550fb991c717", "timestamp": "2026-04-05T23:17:31.933889+00:00", "hypothesis": "No hypothesis provided", "hypothesis_source": "synthesized", "mutation_diff_summary": "", "score": 3.3, "score_ci_lower": 2.8, "score_ci_upper": 3.7, "raw_scores": [3.5, 4.0, 3.0, 2.5, 3.5], "baseline_score": 3.6, "outcome": "DISCARDED", "failure_mode": null, "duration_seconds": 75.33149200002663, "tags": [], "learnings": "{\"what_changed\":\"\",\"what_improved\":[],\"what_regressed\":[],\"transferable_insight\":\"No hypothesis provided\",\"domain_tags\":[]}", "cost_usd": 0.19322185, "bootstrap_seed": 0, "agent_model": "claude-sonnet-4-6", "held_out_score": null, "criterion_names": ["correct_category", "concise_output", "follows_format", "no_hallucination", "handles_ambiguity"], "per_criterion_scores": {"correct_category": 1.0, "concise_output": 1.0, "follows_format": 0.0, "no_hallucination": 0.8, "handles_ambiguity": 0.5}, "failure_classification": {"category": "output_format", "description": "The experiment lacks a provided hypothesis, and the failure mode is listed as unknown. This suggests some required fields or structure are missing or violated, implying a failure in adhering to the expected output schema.", "fix_direction": "Ensure all required sections are included and conform to the expected schema or output format in future attempts.", "confidence": 0.85}, "drafts_generated": 1, "drafts_survived": 1}
{"id": "a3f9c3f8-e57b-4a41-b930-d0cfdd465803", "target_id": "B1-treatment", "git_sha": "ee21a28f7c96a2a26a2e579c2806edfc6483c052", "pre_experiment_sha": "50b861aa54a1e95161335c0b3e27550fb991c717", "timestamp": "2026-04-05T23:18:17.505338+00:00", "hypothesis": "No hypothesis provided", "hypothesis_source": "synthesized", "mutation_diff_summary": "", "score": 3.5, "score_ci_lower": 3.1, "score_ci_upper": 3.9, "raw_scores": [4.0, 4.0, 3.0, 3.0, 3.5], "baseline_score": 3.6, "outcome": "KEPT", "failure_mode": null, "duration_seconds": 43.922839916776866, "tags": [], "learnings": "{\"what_changed\":\"\",\"what_improved\":[],\"what_regressed\":[],\"transferable_insight\":\"No hypothesis provided\",\"domain_tags\":[]}", "cost_usd": 0.1536267, "bootstrap_seed": 0, "agent_model": "claude-sonnet-4-6", "held_out_score": null, "criterion_names": ["correct_category", "concise_output", "follows_format", "no_hallucination", "handles_ambiguity"], "per_criterion_scores": {"correct_category": 1.0, "concise_output": 1.0, "follows_format": 0.0, "no_hallucination": 0.7, "handles_ambiguity": 0.8}, "failure_classification": null, "drafts_generated": 1, "drafts_survived": 1}
{"id": "759e29bb-0633-4fd2-bd6c-dbfcb40a0a07", "target_id": "B1-treatment", "git_sha": "f7920764a7bd9cf7cb1f20d854edae65ec7135cd", "pre_experiment_sha": "ee21a28f7c96a2a26a2e579c2806edfc6483c052", "timestamp": "2026-04-05T23:19:44.624790+00:00", "hypothesis": "No hypothesis provided", "hypothesis_source": "synthesized", "mutation_diff_summary": "", "score": 3.4, "score_ci_lower": 3.0, "score_ci_upper": 3.8, "raw_scores": [3.0, 4.0, 3.0, 3.0, 4.0], "baseline_score": 3.5, "outcome": "KEPT", "failure_mode": null, "duration_seconds": 86.62326283403672, "tags": [], "learnings": "{\"what_changed\":\"\",\"what_improved\":[],\"what_regressed\":[],\"transferable_insight\":\"No hypothesis provided\",\"domain_tags\":[]}", "cost_usd": 0.19570545, "bootstrap_seed": 0, "agent_model": "claude-sonnet-4-6", "held_out_score": null, "criterion_names": ["correct_category", "concise_output", "follows_format", "no_hallucination", "handles_ambiguity"], "per_criterion_scores": {"correct_category": 1.0, "concise_output": 1.0, "follows_format": 0.0, "no_hallucination": 0.7, "handles_ambiguity": 0.7}, "failure_classification": null, "drafts_generated": 1, "drafts_survived": 1}
{"id": "f0940a1e-6859-4598-b94c-d738dc2c64cd", "target_id": "B1-treatment", "git_sha": "3b6f929850177ec6b0143fd0f5f12883641dbcfb", "pre_experiment_sha": "f7920764a7bd9cf7cb1f20d854edae65ec7135cd", "timestamp": "2026-04-05T23:21:40.504612+00:00", "hypothesis": "No hypothesis provided", "hypothesis_source": "synthesized", "mutation_diff_summary": "", "score": 3.6, "score_ci_lower": 3.3, "score_ci_upper": 3.9, "raw_scores": [4.0, 4.0, 3.0, 3.5, 3.5], "baseline_score": 3.4, "outcome": "KEPT", "failure_mode": null, "duration_seconds": 115.48560966621153, "tags": [], "learnings": "{\"what_changed\":\"\",\"what_improved\":[],\"what_regressed\":[],\"transferable_insight\":\"No hypothesis provided\",\"domain_tags\":[]}", "cost_usd": 0.29336039999999997, "bootstrap_seed": 0, "agent_model": "claude-sonnet-4-6", "held_out_score": null, "criterion_names": ["correct_category", "concise_output", "follows_format", "no_hallucination", "handles_ambiguity"], "per_criterion_scores": {"correct_category": 1.0, "concise_output": 1.0, "follows_format": 0.0, "no_hallucination": 0.8, "handles_ambiguity": 0.8}, "failure_classification": null, "drafts_generated": 1, "drafts_survived": 1}
{"id": "86d38183-2690-4b95-a4c5-388448852cdf", "target_id": "B1-treatment", "git_sha": "82a37f5ca839bd435b08d1f50b896e12a561b838", "pre_experiment_sha": "3b6f929850177ec6b0143fd0f5f12883641dbcfb", "timestamp": "2026-04-05T23:23:37.955614+00:00", "hypothesis": "No hypothesis provided", "hypothesis_source": "synthesized", "mutation_diff_summary": "", "score": 3.5, "score_ci_lower": 3.1, "score_ci_upper": 3.9, "raw_scores": [3.0, 4.0, 3.0, 3.5, 4.0], "baseline_score": 3.6, "outcome": "KEPT", "failure_mode": null, "duration_seconds": 117.01066045789048, "tags": [], "learnings": "{\"what_changed\":\"\",\"what_improved\":[],\"what_regressed\":[],\"transferable_insight\":\"No hypothesis provided\",\"domain_tags\":[]}", "cost_usd": 0.28366709999999995, "bootstrap_seed": 0, "agent_model": "claude-sonnet-4-6", "held_out_score": null, "criterion_names": ["correct_category", "concise_output", "follows_format", "no_hallucination", "handles_ambiguity"], "per_criterion_scores": {"correct_category": 1.0, "concise_output": 1.0, "follows_format": 0.0, "no_hallucination": 0.8, "handles_ambiguity": 0.7}, "failure_classification": null, "drafts_generated": 1, "drafts_survived": 1}
{"id": "8afb9527-b24e-45e0-91ec-29eab3ec6df6", "target_id": "B1-treatment", "git_sha": "054ec321b73e4e02283babc03f0d2d85647fe0e9", "pre_experiment_sha": "82a37f5ca839bd435b08d1f50b896e12a561b838", "timestamp": "2026-04-05T23:24:48.998598+00:00", "hypothesis": "No hypothesis provided", "hypothesis_source": "synthesized", "mutation_diff_summary": "", "score": 3.6, "score_ci_lower": 3.2, "score_ci_upper": 4.0, "raw_scores": [4.0, 4.0, 3.0, 3.0, 4.0], "baseline_score": 3.5, "outcome": "KEPT", "failure_mode": null, "duration_seconds": 70.61048395792022, "tags": [], "learnings": "{\"what_changed\":\"\",\"what_improved\":[],\"what_regressed\":[],\"transferable_insight\":\"No hypothesis provided\",\"domain_tags\":[]}", "cost_usd": 0.20449065, "bootstrap_seed": 0, "agent_model": "claude-sonnet-4-6", "held_out_score": null, "criterion_names": ["correct_category", "concise_output", "follows_format", "no_hallucination", "handles_ambiguity"], "per_criterion_scores": {"correct_category": 1.0, "concise_output": 1.0, "follows_format": 0.0, "no_hallucination": 0.8, "handles_ambiguity": 0.8}, "failure_classification": null, "drafts_generated": 1, "drafts_survived": 1}
{"id": "6e8f38d0-0267-415f-8e3b-b9df31ea2f99", "target_id": "B1-treatment", "git_sha": "054ec321b73e4e02283babc03f0d2d85647fe0e9", "pre_experiment_sha": "054ec321b73e4e02283babc03f0d2d85647fe0e9", "timestamp": "2026-04-05T23:27:37.382842+00:00", "hypothesis": "No hypothesis provided", "hypothesis_source": "synthesized", "mutation_diff_summary": "", "score": 3.5, "score_ci_lower": 3.1, "score_ci_upper": 3.9, "raw_scores": [4.0, 4.0, 3.0, 3.0, 3.5], "baseline_score": 3.6, "outcome": "DISCARDED", "failure_mode": null, "duration_seconds": 167.97680129203945, "tags": [], "learnings": "{\"what_changed\":\"\",\"what_improved\":[],\"what_regressed\":[],\"transferable_insight\":\"No hypothesis provided\",\"domain_tags\":[]}", "cost_usd": 0.35517204999999996, "bootstrap_seed": 0, "agent_model": "claude-sonnet-4-6", "held_out_score": null, "criterion_names": ["correct_category", "concise_output", "follows_format", "no_hallucination", "handles_ambiguity"], "per_criterion_scores": {"correct_category": 1.0, "concise_output": 1.0, "follows_format": 0.0, "no_hallucination": 0.8, "handles_ambiguity": 0.7}, "failure_classification": {"category": "output_format", "description": "The experiment lacks a provided hypothesis, indicating an output structure or schema violation.", "fix_direction": "Ensure all required fields, such as hypothesis, are included and correctly populated in the output structure.", "confidence": 0.9}, "drafts_generated": 1, "drafts_survived": 1}
{"id": "bcacd023-dba8-4714-b1a1-f69965f93816", "target_id": "B1-treatment", "git_sha": "054ec321b73e4e02283babc03f0d2d85647fe0e9", "pre_experiment_sha": "054ec321b73e4e02283babc03f0d2d85647fe0e9", "timestamp": "2026-04-05T23:29:01.096413+00:00", "hypothesis": "No hypothesis provided", "hypothesis_source": "synthesized", "mutation_diff_summary": "", "score": 3.4, "score_ci_lower": 2.9, "score_ci_upper": 3.9, "raw_scores": [3.5, 4.0, 2.5, 3.0, 4.0], "baseline_score": 3.6, "outcome": "DISCARDED", "failure_mode": null, "duration_seconds": 82.007675166009, "tags": [], "learnings": "{\"what_changed\":\"\",\"what_improved\":[],\"what_regressed\":[],\"transferable_insight\":\"No hypothesis provided\",\"domain_tags\":[]}", "cost_usd": 0.18640924999999997, "bootstrap_seed": 0, "agent_model": "claude-sonnet-4-6", "held_out_score": null, "criterion_names": ["correct_category", "concise_output", "follows_format", "no_hallucination", "handles_ambiguity"], "per_criterion_scores": {"correct_category": 1.0, "concise_output": 1.0, "follows_format": 0.0, "no_hallucination": 0.6, "handles_ambiguity": 0.8}, "failure_classification": {"category": "output_format", "description": "The experiment lacks a provided hypothesis, which suggests a violation of the required output structure or schema.", "fix_direction": "Ensure that all required fields, including the hypothesis, are provided and adhere to the expected output format.", "confidence": 0.85}, "drafts_generated": 1, "drafts_survived": 1}
{"id": "7115afda-04b6-4755-924c-b5245c0fbcb5", "target_id": "B1-treatment", "git_sha": "054ec321b73e4e02283babc03f0d2d85647fe0e9", "pre_experiment_sha": "054ec321b73e4e02283babc03f0d2d85647fe0e9", "timestamp": "2026-04-05T23:30:26.855490+00:00", "hypothesis": "No hypothesis provided", "hypothesis_source": "synthesized", "mutation_diff_summary": "", "score": 3.5, "score_ci_lower": 3.1, "score_ci_upper": 3.9, "raw_scores": [3.5, 4.0, 3.0, 3.0, 4.0], "baseline_score": 3.6, "outcome": "DISCARDED", "failure_mode": null, "duration_seconds": 84.17193362512626, "tags": [], "learnings": "{\"what_changed\":\"\",\"what_improved\":[],\"what_regressed\":[],\"transferable_insight\":\"No hypothesis provided\",\"domain_tags\":[]}", "cost_usd": 0.25755315, "bootstrap_seed": 0, "agent_model": "claude-sonnet-4-6", "held_out_score": null, "criterion_names": ["correct_category", "concise_output", "follows_format", "no_hallucination", "handles_ambiguity"], "per_criterion_scores": {"correct_category": 1.0, "concise_output": 1.0, "follows_format": 0.0, "no_hallucination": 0.7, "handles_ambiguity": 0.8}, "failure_classification": {"category": "output_format", "description": "The experiment lacks a provided hypothesis and specifies an unknown failure mode, which may indicate a structural or schema violation in the expected output format.", "fix_direction": "Ensure all required fields (such as hypothesis and specified failure mode) are present and populated according to the output schema.", "confidence": 0.8}, "drafts_generated": 1, "drafts_survived": 1}
{"id": "d1a9b8a8-4db1-4dc3-85b6-d2f34abf504b", "target_id": "B1-treatment", "git_sha": "27e17189ce6c8669389343f83a9d36d2f43bd17d", "pre_experiment_sha": "054ec321b73e4e02283babc03f0d2d85647fe0e9", "timestamp": "2026-04-05T23:33:44.172483+00:00", "hypothesis": "No hypothesis provided", "hypothesis_source": "synthesized", "mutation_diff_summary": "", "score": 3.7, "score_ci_lower": 3.3, "score_ci_upper": 4.0, "raw_scores": [4.0, 4.0, 3.0, 3.5, 4.0], "baseline_score": 3.6, "outcome": "KEPT", "failure_mode": null, "duration_seconds": 195.617601291975, "tags": [], "learnings": "{\"what_changed\":\"\",\"what_improved\":[],\"what_regressed\":[],\"transferable_insight\":\"No hypothesis provided\",\"domain_tags\":[]}", "cost_usd": 0.33153029999999994, "bootstrap_seed": 0, "agent_model": "claude-sonnet-4-6", "held_out_score": null, "criterion_names": ["correct_category", "concise_output", "follows_format", "no_hallucination", "handles_ambiguity"], "per_criterion_scores": {"correct_category": 1.0, "concise_output": 1.0, "follows_format": 0.0, "no_hallucination": 0.9, "handles_ambiguity": 0.8}, "failure_classification": null, "drafts_generated": 1, "drafts_survived": 1}
{"id": "cd85a975-0157-41e0-89f0-e85ece89f83f", "target_id": "B1-treatment", "git_sha": "27e17189ce6c8669389343f83a9d36d2f43bd17d", "pre_experiment_sha": "27e17189ce6c8669389343f83a9d36d2f43bd17d", "timestamp": "2026-04-05T23:35:23.299787+00:00", "hypothesis": "No hypothesis provided", "hypothesis_source": "synthesized", "mutation_diff_summary": "", "score": 3.4, "score_ci_lower": 3.1, "score_ci_upper": 3.7, "raw_scores": [3.5, 4.0, 3.0, 3.0, 3.5], "baseline_score": 3.7, "outcome": "DISCARDED", "failure_mode": null, "duration_seconds": 98.64129250007682, "tags": [], "learnings": "{\"what_changed\":\"\",\"what_improved\":[],\"what_regressed\":[],\"transferable_insight\":\"No hypothesis provided\",\"domain_tags\":[]}", "cost_usd": 0.24018979999999998, "bootstrap_seed": 0, "agent_model": "claude-sonnet-4-6", "held_out_score": null, "criterion_names": ["correct_category", "concise_output", "follows_format", "no_hallucination", "handles_ambiguity"], "per_criterion_scores": {"correct_category": 1.0, "concise_output": 1.0, "follows_format": 0.0, "no_hallucination": 0.7, "handles_ambiguity": 0.7}, "failure_classification": {"category": "output_format", "description": "The experiment was classified as a structure/schema violation, likely due to missing or improperly structured fields (e.g., 'No hypothesis provided' and 'unknown' failure mode), which violates expected output format.", "fix_direction": "Ensure all required fields are present and correctly structured according to the schema.", "confidence": 0.85}, "drafts_generated": 1, "drafts_survived": 1}
{"id": "0233d397-0cd6-4265-bc74-87159f51cc60", "target_id": "B1-treatment", "git_sha": "27e17189ce6c8669389343f83a9d36d2f43bd17d", "pre_experiment_sha": "27e17189ce6c8669389343f83a9d36d2f43bd17d", "timestamp": "2026-04-05T23:36:33.299396+00:00", "hypothesis": "No hypothesis provided", "hypothesis_source": "synthesized", "mutation_diff_summary": "", "score": 3.6, "score_ci_lower": 3.2, "score_ci_upper": 4.0, "raw_scores": [4.0, 4.0, 3.0, 3.0, 4.0], "baseline_score": 3.7, "outcome": "DISCARDED", "failure_mode": null, "duration_seconds": 68.50443970784545, "tags": [], "learnings": "{\"what_changed\":\"\",\"what_improved\":[],\"what_regressed\":[],\"transferable_insight\":\"No hypothesis provided\",\"domain_tags\":[]}", "cost_usd": 0.17454619999999998, "bootstrap_seed": 0, "agent_model": "claude-sonnet-4-6", "held_out_score": null, "criterion_names": ["correct_category", "concise_output", "follows_format", "no_hallucination", "handles_ambiguity"], "per_criterion_scores": {"correct_category": 1.0, "concise_output": 1.0, "follows_format": 0.0, "no_hallucination": 0.8, "handles_ambiguity": 0.8}, "failure_classification": {"category": "output_format", "description": "The experiment failed due to a violation of the required output structure or schema.", "fix_direction": "Ensure that the output strictly adheres to the expected schema and format requirements.", "confidence": 0.9}, "drafts_generated": 1, "drafts_survived": 1}
{"id": "8d42841f-9fb1-44ab-8990-7506cd978bbf", "target_id": "B1-treatment", "git_sha": "fdb4f25ed28847b6ea1f59510c50747bcdeaa9d9", "pre_experiment_sha": "27e17189ce6c8669389343f83a9d36d2f43bd17d", "timestamp": "2026-04-05T23:39:17.711756+00:00", "hypothesis": "No hypothesis provided", "hypothesis_source": "synthesized", "mutation_diff_summary": "", "score": 3.6, "score_ci_lower": 3.3, "score_ci_upper": 3.9, "raw_scores": [3.5, 4.0, 3.0, 3.5, 4.0], "baseline_score": 3.7, "outcome": "KEPT", "failure_mode": null, "duration_seconds": 163.12607487500645, "tags": [], "learnings": "{\"what_changed\":\"\",\"what_improved\":[],\"what_regressed\":[],\"transferable_insight\":\"No hypothesis provided\",\"domain_tags\":[]}", "cost_usd": 0.30834389999999995, "bootstrap_seed": 0, "agent_model": "claude-sonnet-4-6", "held_out_score": null, "criterion_names": ["correct_category", "concise_output", "follows_format", "no_hallucination", "handles_ambiguity"], "per_criterion_scores": {"correct_category": 1.0, "concise_output": 1.0, "follows_format": 0.0, "no_hallucination": 0.8, "handles_ambiguity": 0.8}, "failure_classification": null, "drafts_generated": 1, "drafts_survived": 1}
{"id": "90614690-864c-47e5-bf36-7160dbcc50f6", "target_id": "B1-treatment", "git_sha": "d3d4a1e85580785290fd7700578f4bceeacdb615", "pre_experiment_sha": "fdb4f25ed28847b6ea1f59510c50747bcdeaa9d9", "timestamp": "2026-04-05T23:40:56.460849+00:00", "hypothesis": "No hypothesis provided", "hypothesis_source": "synthesized", "mutation_diff_summary": "", "score": 3.6, "score_ci_lower": 3.3, "score_ci_upper": 3.9, "raw_scores": [4.0, 4.0, 3.0, 3.5, 3.5], "baseline_score": 3.6, "outcome": "KEPT", "failure_mode": null, "duration_seconds": 98.34239874989726, "tags": [], "learnings": "{\"what_changed\":\"\",\"what_improved\":[],\"what_regressed\":[],\"transferable_insight\":\"No hypothesis provided\",\"domain_tags\":[]}", "cost_usd": 0.22468485, "bootstrap_seed": 0, "agent_model": "claude-sonnet-4-6", "held_out_score": null, "criterion_names": ["correct_category", "concise_output", "follows_format", "no_hallucination", "handles_ambiguity"], "per_criterion_scores": {"correct_category": 1.0, "concise_output": 1.0, "follows_format": 0.0, "no_hallucination": 0.8, "handles_ambiguity": 0.8}, "failure_classification": null, "drafts_generated": 1, "drafts_survived": 1}
