{"id": "698de92b-bb45-4e29-b990-4dae7ffb56c7", "target_id": "B1-treatment", "git_sha": "80d8262dad46ad7981b19d13786160925e44279f", "pre_experiment_sha": "3b452d4d4a3bc0f302632065ef61cb2ba6a6552a", "timestamp": "2026-04-19T17:09:49.622974+00:00", "hypothesis": "Forcing a single-label-only output with no explanation will improve strict binary criteria scoring.", "hypothesis_source": "agent", "mutation_diff_summary": "", "score": 2.5, "score_ci_lower": 2.2, "score_ci_upper": 2.8, "raw_scores": [2.5, 2.5, 2.0, 2.5, 3.0], "baseline_score": 0.0, "outcome": "KEPT", "failure_mode": null, "duration_seconds": 13.863485375070013, "tags": ["format", "classification", "concise", "deterministic"], "learnings": "{\"what_changed\":\"\",\"what_improved\":[],\"what_regressed\":[],\"transferable_insight\":\"Constraining an output to a single, unambiguous label can improve evaluation performance when the scoring criterion is strict and binary.\",\"domain_tags\":[\"evaluation\",\"output-formatting\",\"classification\"]}", "cost_usd": 0.007532550000000001, "bootstrap_seed": 0, "agent_model": "gpt-5.4", "held_out_score": null, "criterion_names": ["correct_category", "concise_output", "follows_format", "no_hallucination", "handles_ambiguity"], "per_criterion_scores": {"correct_category": 0.2, "concise_output": 1.0, "follows_format": 0.0, "no_hallucination": 0.4, "handles_ambiguity": 0.9}, "failure_classification": null, "drafts_generated": 1, "drafts_survived": 1}
{"id": "979b3c7f-2b87-4d65-930d-30f5bd6b1f35", "target_id": "B1-treatment", "git_sha": "01159f4d879bce0a7d24189423b2af1be0322242", "pre_experiment_sha": "80d8262dad46ad7981b19d13786160925e44279f", "timestamp": "2026-04-19T17:10:04.790253+00:00", "hypothesis": "Stricter decision and output rules with explicit handling of ambiguity will improve single-label compliance.", "hypothesis_source": "agent", "mutation_diff_summary": "", "score": 2.9, "score_ci_lower": 2.7, "score_ci_upper": 3.0, "raw_scores": [3.0, 3.0, 3.0, 2.5, 3.0], "baseline_score": 2.5, "outcome": "KEPT", "failure_mode": null, "duration_seconds": 14.070412457920611, "tags": ["classification", "single-label", "output-format", "ambiguity-handling"], "learnings": "{\"what_changed\":\"\",\"what_improved\":[],\"what_regressed\":[],\"transferable_insight\":\"Explicitly defining decision criteria and how to handle ambiguity can improve adherence to a required single-choice output format.\",\"domain_tags\":[\"decision-making\",\"output-formatting\",\"ambiguity-handling\"]}", "cost_usd": 0.00974755, "bootstrap_seed": 0, "agent_model": "gpt-5.4", "held_out_score": null, "criterion_names": ["correct_category", "concise_output", "follows_format", "no_hallucination", "handles_ambiguity"], "per_criterion_scores": {"correct_category": 0.4, "concise_output": 1.0, "follows_format": 0.0, "no_hallucination": 0.6, "handles_ambiguity": 0.9}, "failure_classification": null, "drafts_generated": 1, "drafts_survived": 1}
{"id": "802eec8d-8c4c-44b3-ad5e-ff754a02e863", "target_id": "B1-treatment", "git_sha": "01159f4d879bce0a7d24189423b2af1be0322242", "pre_experiment_sha": "01159f4d879bce0a7d24189423b2af1be0322242", "timestamp": "2026-04-19T17:10:20.465329+00:00", "hypothesis": "Tightening tie-breaking and abstaining-from-explanation rules will improve exact single-label compliance.", "hypothesis_source": "agent", "mutation_diff_summary": "", "score": 2.5, "score_ci_lower": 1.9, "score_ci_upper": 3.1, "raw_scores": [2.5, 2.5, 1.5, 2.5, 3.5], "baseline_score": 2.9, "outcome": "DISCARDED", "failure_mode": null, "duration_seconds": 14.264930499950424, "tags": ["classification", "single-label", "output-format", "tie-breaking"], "learnings": "{\"what_changed\":\"\",\"what_improved\":[],\"what_regressed\":[],\"transferable_insight\":\"Adding stricter decision and explanation constraints can reduce compliance when the task benefits from flexibility or when the constraints do not address the underlying source of errors.\",\"domain_tags\":[\"decision-making\",\"evaluation\",\"prompting\"]}", "cost_usd": 0.01220615, "bootstrap_seed": 0, "agent_model": "gpt-5.4", "held_out_score": null, "criterion_names": ["correct_category", "concise_output", "follows_format", "no_hallucination", "handles_ambiguity"], "per_criterion_scores": {"correct_category": 0.2, "concise_output": 0.8, "follows_format": 0.0, "no_hallucination": 0.5, "handles_ambiguity": 1.0}, "failure_classification": {"category": "semantic_drift", "description": "The experiment failed to improve exact single-label compliance despite the intended tightening of tie-breaking and abstention behavior, indicating the changes likely altered or failed to enforce the intended decision semantics (e.g., still producing incorrect or non-compliant labels rather than merely improving formatting/rules).", "fix_direction": "Focus on aligning the decision procedure with the evaluation definition of \u201cexact single-label compliance\u201d: explicitly implement deterministic tie-breaking, ensure the abstain behavior is triggered under the exact uncertainty conditions expected by the scorer, and add tests to confirm label selection matches ground-truth formatting/label constraints.", "confidence": 0.62}, "drafts_generated": 1, "drafts_survived": 1}
{"id": "1a3e9870-590c-42bf-8707-5443ab9396ce", "target_id": "B1-treatment", "git_sha": "01159f4d879bce0a7d24189423b2af1be0322242", "pre_experiment_sha": "01159f4d879bce0a7d24189423b2af1be0322242", "timestamp": "2026-04-19T17:10:44.722074+00:00", "hypothesis": "Tightening the prompt to require a forced single-label choice even under ambiguity will improve binary criteria compliance.", "hypothesis_source": "agent", "mutation_diff_summary": "", "score": 3.1, "score_ci_lower": 2.6, "score_ci_upper": 3.6, "raw_scores": [4.0, 2.5, 2.5, 3.5, 3.0], "baseline_score": 2.9, "outcome": "DISCARDED", "failure_mode": null, "duration_seconds": 20.197088917018846, "tags": ["single-label", "deterministic", "strict-output", "ambiguity-handling"], "learnings": "{\"what_changed\":\"\",\"what_improved\":[],\"what_regressed\":[],\"transferable_insight\":\"When a task requires a binary decision, explicitly forcing a single choice can improve compliance by reducing ambiguity in the response format.\",\"domain_tags\":[\"prompt-design\",\"decision-making\",\"evaluation\"]}", "cost_usd": 0.011226149999999999, "bootstrap_seed": 0, "agent_model": "gpt-5.4", "held_out_score": null, "criterion_names": ["correct_category", "concise_output", "follows_format", "no_hallucination", "handles_ambiguity"], "per_criterion_scores": {"correct_category": 0.6, "concise_output": 1.0, "follows_format": 0.0, "no_hallucination": 0.5, "handles_ambiguity": 1.0}, "failure_classification": {"category": "logic_error", "description": "Failure mode is unspecified (\u201cunknown\u201d), and the provided score (3.1000) does not map to any concrete, described error such as formatting/schema violation, logic, regression, syntax, semantic meaning, gaming, or incomplete edits.", "fix_direction": "Identify the specific failure behavior (e.g., observe whether output formatting, reasoning, or label constraints were violated) and then tighten prompts/decoding rules along the axis that matches the observed deviation (format enforcement, label disambiguation instructions, or evaluation-resistant constraints).", "confidence": 0.12}, "drafts_generated": 1, "drafts_survived": 1}
{"id": "0c0255fe-72c6-4eaf-a67d-ddd9831d931b", "target_id": "B1-treatment", "git_sha": "01159f4d879bce0a7d24189423b2af1be0322242", "pre_experiment_sha": "01159f4d879bce0a7d24189423b2af1be0322242", "timestamp": "2026-04-19T17:11:05.361976+00:00", "hypothesis": "Tightening the prompt to require a forced deterministic single-label choice in all ambiguous cases will improve binary criteria compliance.", "hypothesis_source": "agent", "mutation_diff_summary": "", "score": 2.8, "score_ci_lower": 2.5, "score_ci_upper": 3.2, "raw_scores": [3.0, 2.5, 3.5, 2.5, 2.5], "baseline_score": 2.9, "outcome": "DISCARDED", "failure_mode": null, "duration_seconds": 17.825460041989572, "tags": ["single-label", "deterministic", "strict-output", "ambiguity-handling"], "learnings": "{\"what_changed\":\"\",\"what_improved\":[],\"what_regressed\":[],\"transferable_insight\":\"Forcing a single deterministic choice in ambiguous cases can reduce compliance when the task benefits from preserving uncertainty or nuanced judgment.\",\"domain_tags\":[\"decision-making\",\"prompt-design\",\"evaluation\"]}", "cost_usd": 0.01090495, "bootstrap_seed": 0, "agent_model": "gpt-5.4", "held_out_score": null, "criterion_names": ["correct_category", "concise_output", "follows_format", "no_hallucination", "handles_ambiguity"], "per_criterion_scores": {"correct_category": 0.4, "concise_output": 0.9, "follows_format": 0.0, "no_hallucination": 0.5, "handles_ambiguity": 1.0}, "failure_classification": {"category": "logic_error", "description": "The provided details don\u2019t specify how the experiment failed\u2014only that the Failure Mode is listed as 'unknown' and there\u2019s a score. Without evidence of format, logic, scope, syntax, semantics, or gaming, the failure category cannot be determined from the given information.", "fix_direction": "Collect the concrete failure evidence (e.g., example input/output, which criterion failed, whether the output violated schema, reasoning/label choice errors, or signs of evaluation gaming) and then map it to the closest category.", "confidence": 0.12}, "drafts_generated": 1, "drafts_survived": 1}
{"id": "7aec492b-9583-4771-a626-af02e90473f9", "target_id": "B1-treatment", "git_sha": "01159f4d879bce0a7d24189423b2af1be0322242", "pre_experiment_sha": "01159f4d879bce0a7d24189423b2af1be0322242", "timestamp": "2026-04-19T17:11:29.033617+00:00", "hypothesis": "Make the prompt more rigid and deterministic by explicitly requiring exactly one provided label even under ambiguity.", "hypothesis_source": "agent", "mutation_diff_summary": "", "score": 2.9, "score_ci_lower": 2.4, "score_ci_upper": 3.5, "raw_scores": [2.5, 2.0, 3.0, 3.0, 4.0], "baseline_score": 2.9, "outcome": "DISCARDED", "failure_mode": null, "duration_seconds": 20.55335962504614, "tags": ["single-label", "deterministic", "no-explanation", "strict-output"], "learnings": "{\"what_changed\":\"\",\"what_improved\":[],\"what_regressed\":[],\"transferable_insight\":\"Adding rigid constraints that force a single choice under ambiguity can reduce flexibility without improving outcomes, so determinism should be introduced only when it aligns with the task\u2019s true uncertainty structure.\",\"domain_tags\":[\"prompt-design\",\"decision-making\",\"robustness\"]}", "cost_usd": 0.01062075, "bootstrap_seed": 0, "agent_model": "gpt-5.4", "held_out_score": null, "criterion_names": ["correct_category", "concise_output", "follows_format", "no_hallucination", "handles_ambiguity"], "per_criterion_scores": {"correct_category": 0.5, "concise_output": 1.0, "follows_format": 0.0, "no_hallucination": 0.5, "handles_ambiguity": 0.9}, "failure_classification": {"category": "semantic_drift", "description": "The attempt to make the prompt more rigid/deterministic (requiring exactly one label under ambiguity) did not achieve the intended single-label behavior. Instead, the response quality/meaning shifted away from the desired semantics, leading to a failed experiment (score 2.9000) despite presumably still producing a valid-looking response.", "fix_direction": "Tighten the decision rules in the label-selection logic (e.g., explicit tie-breaking priority, confidence thresholds, and fallback label definition) and verify that the model always follows these rules under ambiguous inputs; add targeted tests for ambiguity cases to ensure meaning remains aligned.", "confidence": 0.62}, "drafts_generated": 1, "drafts_survived": 1}
{"id": "be009fe3-5895-409c-ac3c-c258bab6284c", "target_id": "B1-treatment", "git_sha": "01159f4d879bce0a7d24189423b2af1be0322242", "pre_experiment_sha": "01159f4d879bce0a7d24189423b2af1be0322242", "timestamp": "2026-04-19T17:11:53.714020+00:00", "hypothesis": "Strengthen determinism by explicitly requiring a forced single-label choice even under ambiguity or weak evidence.", "hypothesis_source": "agent", "mutation_diff_summary": "", "score": 3.0, "score_ci_lower": 2.5, "score_ci_upper": 3.4, "raw_scores": [3.0, 2.0, 3.0, 3.5, 3.5], "baseline_score": 2.9, "outcome": "DISCARDED", "failure_mode": null, "duration_seconds": 20.496505166986026, "tags": ["determinism", "single-label", "ambiguity-resolution"], "learnings": "{\"what_changed\":\"\",\"what_improved\":[],\"what_regressed\":[],\"transferable_insight\":\"Forcing a single decision under ambiguity can increase determinism, but it may not improve outcomes when the evidence is weak or the task is inherently uncertain.\",\"domain_tags\":[\"decision-making\",\"uncertainty\",\"classification\"]}", "cost_usd": 0.012199950000000001, "bootstrap_seed": 0, "agent_model": "gpt-5.4", "held_out_score": null, "criterion_names": ["correct_category", "concise_output", "follows_format", "no_hallucination", "handles_ambiguity"], "per_criterion_scores": {"correct_category": 0.4, "concise_output": 1.0, "follows_format": 0.0, "no_hallucination": 0.6, "handles_ambiguity": 1.0}, "failure_classification": {"category": "logic_error", "description": "The provided information does not include enough detail about what actually failed (e.g., the incorrect output/content, parsing/runtime issues, or any rubric/behavior mismatch). Only the hypothesis, an unspecified failure mode marked as 'unknown', and a score are given, which is insufficient to map to a specific failure category.", "fix_direction": "Include the failing output and the expected format/rubric criteria (or error logs), then check for one of: schema/format mismatches, reasoning/calculation errors, regressions vs prior pass, out-of-scope edits, syntax/parse failures, meaning/label confusion, or metric gaming/inconsistency.", "confidence": 0.1}, "drafts_generated": 1, "drafts_survived": 1}
{"id": "ba8a7551-bdb5-443f-9227-dd41933bee42", "target_id": "B1-treatment", "git_sha": "01159f4d879bce0a7d24189423b2af1be0322242", "pre_experiment_sha": "01159f4d879bce0a7d24189423b2af1be0322242", "timestamp": "2026-04-19T17:12:09.980952+00:00", "hypothesis": "Tightening the prompt to force a deterministic single-label choice under ambiguity will improve binary criteria compliance.", "hypothesis_source": "agent", "mutation_diff_summary": "", "score": 2.9, "score_ci_lower": 2.3, "score_ci_upper": 3.6, "raw_scores": [4.0, 2.5, 2.5, 3.5, 2.0], "baseline_score": 2.9, "outcome": "DISCARDED", "failure_mode": null, "duration_seconds": 13.683900875039399, "tags": ["determinism", "single-label", "format-control", "ambiguity-resolution"], "learnings": "{\"what_changed\":\"\",\"what_improved\":[],\"what_regressed\":[],\"transferable_insight\":\"When a task is inherently ambiguous, forcing a single deterministic choice in the prompt may not improve compliance and can leave performance unchanged.\",\"domain_tags\":[\"prompt-engineering\",\"decision-making\",\"evaluation\"]}", "cost_usd": 0.012005350000000001, "bootstrap_seed": 0, "agent_model": "gpt-5.4", "held_out_score": null, "criterion_names": ["correct_category", "concise_output", "follows_format", "no_hallucination", "handles_ambiguity"], "per_criterion_scores": {"correct_category": 0.5, "concise_output": 0.8, "follows_format": 0.0, "no_hallucination": 0.6, "handles_ambiguity": 1.0}, "failure_classification": {"category": "logic_error", "description": "Failure mode is unspecified (\u201cunknown\u201d) and no concrete error characteristics were provided. Although the hypothesis concerns tightening prompts for deterministic single-label choices, there\u2019s no evidence here of a specific failure mechanism (e.g., format/schema violation, semantic mismatch, regression, etc.).", "fix_direction": "Capture and report the concrete observed failure (error message, which criterion failed, and an example of the model output), then map it to the closest category (format vs logic vs semantic vs regression).", "confidence": 0.1}, "drafts_generated": 1, "drafts_survived": 1}
{"id": "f31665c2-ceb9-4c47-86a1-74cb52dd582c", "target_id": "B1-treatment", "git_sha": "01159f4d879bce0a7d24189423b2af1be0322242", "pre_experiment_sha": "01159f4d879bce0a7d24189423b2af1be0322242", "timestamp": "2026-04-19T17:12:26.684335+00:00", "hypothesis": "Tightening deterministic single-label selection rules and ambiguity resolution will improve binary criteria compliance.", "hypothesis_source": "agent", "mutation_diff_summary": "", "score": 3.2, "score_ci_lower": 2.8, "score_ci_upper": 3.6, "raw_scores": [3.0, 2.5, 3.5, 4.0, 3.0], "baseline_score": 2.9, "outcome": "DISCARDED", "failure_mode": null, "duration_seconds": 14.02394175005611, "tags": ["deterministic", "single-label", "format-compliance", "ambiguity-resolution"], "learnings": "{\"what_changed\":\"\",\"what_improved\":[],\"what_regressed\":[],\"transferable_insight\":\"When a task depends on strict binary decisions, making selection rules and tie-breaking explicit can improve consistency and compliance.\",\"domain_tags\":[\"decision-making\",\"rule-design\",\"quality-control\"]}", "cost_usd": 0.01095955, "bootstrap_seed": 0, "agent_model": "gpt-5.4", "held_out_score": null, "criterion_names": ["correct_category", "concise_output", "follows_format", "no_hallucination", "handles_ambiguity"], "per_criterion_scores": {"correct_category": 0.7, "concise_output": 1.0, "follows_format": 0.0, "no_hallucination": 0.6, "handles_ambiguity": 0.9}, "failure_classification": {"category": "incomplete_edit", "description": "The failure mode is listed as unknown, but the low/unspecified success (score 3.2000) suggests the attempted change may have been partial\u2014e.g., tightened selection/ambiguity rules without fully and consistently applying them across all required cases\u2014leaving an inconsistent or incomplete behavior relative to the intended compliance criteria.", "fix_direction": "Ensure the deterministic single-label selection and ambiguity resolution logic is fully implemented end-to-end (all branches, edge cases, and tie/uncertainty handling), with consistent outputs that satisfy the binary criteria for every input scenario.", "confidence": 0.35}, "drafts_generated": 1, "drafts_survived": 1}
{"id": "95a7afd1-071c-4a03-a4d0-3434457cdc6c", "target_id": "B1-treatment", "git_sha": "01159f4d879bce0a7d24189423b2af1be0322242", "pre_experiment_sha": "01159f4d879bce0a7d24189423b2af1be0322242", "timestamp": "2026-04-19T17:12:44.304783+00:00", "hypothesis": "Tightening the prompt to mandate one forced label with no abstention or explanation will improve single-label compliance.", "hypothesis_source": "agent", "mutation_diff_summary": "", "score": 2.8, "score_ci_lower": 2.3, "score_ci_upper": 3.4, "raw_scores": [2.5, 2.0, 3.0, 2.5, 4.0], "baseline_score": 2.9, "outcome": "DISCARDED", "failure_mode": null, "duration_seconds": 13.56461370899342, "tags": ["single-label", "deterministic", "no-abstain", "concise"], "learnings": "{\"what_changed\":\"\",\"what_improved\":[],\"what_regressed\":[],\"transferable_insight\":\"Forcing a single definitive output can reduce ambiguity in form but may not improve actual compliance if the task or model still lacks sufficient certainty or calibration.\",\"domain_tags\":[\"prompting\",\"classification\",\"evaluation\"]}", "cost_usd": 0.01076495, "bootstrap_seed": 0, "agent_model": "gpt-5.4", "held_out_score": null, "criterion_names": ["correct_category", "concise_output", "follows_format", "no_hallucination", "handles_ambiguity"], "per_criterion_scores": {"correct_category": 0.6, "concise_output": 1.0, "follows_format": 0.0, "no_hallucination": 0.4, "handles_ambiguity": 0.8}, "failure_classification": {"category": "output_format", "description": "The experiment failed due to output not conforming to the required single forced-label format (i.e., the model did not reliably produce a valid, compliant label-only response without abstention or explanation).", "fix_direction": "Strengthen and enforce the response schema/format at the decoding/output-validation layer (e.g., constrain output to an exact allowed-label set, add strict post-generation validation and retry on violations).", "confidence": 0.62}, "drafts_generated": 1, "drafts_survived": 1}
{"id": "a8ad4b42-4cc0-4ce8-8616-c11d7f7a06a6", "target_id": "B1-treatment", "git_sha": "14ee414f2b5f75d522270ecdb485996c1dfc25fd", "pre_experiment_sha": "01159f4d879bce0a7d24189423b2af1be0322242", "timestamp": "2026-04-19T17:13:00.388381+00:00", "hypothesis": "Tightening the prompt to force a single decisive label with no abstention or extra text will improve binary criteria adherence.", "hypothesis_source": "agent", "mutation_diff_summary": "", "score": 3.3, "score_ci_lower": 2.9, "score_ci_upper": 3.7, "raw_scores": [3.0, 2.5, 3.5, 3.5, 4.0], "baseline_score": 2.9, "outcome": "KEPT", "failure_mode": null, "duration_seconds": 13.419977082987316, "tags": ["single-label", "determinism", "strict-output"], "learnings": "{\"what_changed\":\"\",\"what_improved\":[],\"what_regressed\":[],\"transferable_insight\":\"When a task requires a binary decision, constraining the response format to one explicit label can improve adherence by reducing ambiguity and eliminating noncommittal outputs.\",\"domain_tags\":[\"prompt-engineering\",\"classification\",\"evaluation\"]}", "cost_usd": 0.01005755, "bootstrap_seed": 0, "agent_model": "gpt-5.4", "held_out_score": null, "criterion_names": ["correct_category", "concise_output", "follows_format", "no_hallucination", "handles_ambiguity"], "per_criterion_scores": {"correct_category": 0.7, "concise_output": 1.0, "follows_format": 0.0, "no_hallucination": 0.8, "handles_ambiguity": 0.8}, "failure_classification": null, "drafts_generated": 1, "drafts_survived": 1}
