{"id": "5abdaf2a-948d-4686-b211-706113b7ce81", "target_id": "B2-control", "git_sha": "387fac762daf72b048bb6e185489eaa95eeb4217", "pre_experiment_sha": "387fac762daf72b048bb6e185489eaa95eeb4217", "timestamp": "2026-04-24T04:22:30.215603+00:00", "hypothesis": "Enhance the task description to explicitly mandate deep cognitive processing, careful reading, and thorough analysis of the input text to improve summary quality.", "hypothesis_source": "agent", "mutation_diff_summary": "", "score": 3.2, "score_ci_lower": 2.6, "score_ci_upper": 3.8, "raw_scores": [2.0, 3.0, 4.0, 3.0, 4.0], "baseline_score": 3.5, "outcome": "DISCARDED", "failure_mode": null, "duration_seconds": 52.462962583173066, "tags": ["task-description", "deep-processing", "cognitive-processing"], "learnings": "{\"what_changed\":\"\",\"what_improved\":[],\"what_regressed\":[],\"transferable_insight\":\"Explicitly commanding a model to engage in abstract human cognitive processes, such as 'deep thinking' or 'careful reading,' degrades performance because models require concrete, actionable frameworks rather than vague behavioral directives.\",\"domain_tags\":[\"Prompt Engineering\",\"Instruction Design\",\"Model Behavior\"]}", "cost_usd": 0.012441750000000001, "bootstrap_seed": 0, "agent_model": "gemini-3.1-pro-preview", "held_out_score": null, "criterion_names": ["key_points_captured", "conciseness", "faithful_to_source", "few_shot_format"], "per_criterion_scores": {"key_points_captured": 1.0, "conciseness": 1.0, "faithful_to_source": 0.8, "few_shot_format": 0.4}, "failure_classification": {"category": "semantic_drift", "description": "The experiment aimed to improve summary quality by explicitly mandating deep cognitive processing. A low score suggests that this approach failed, likely because the explicit instructions caused the model to misinterpret the source text, over-analyze, or focus on irrelevant details. This would result in summaries that might be well-formatted but deviate significantly from the original meaning, key facts, or intent of the input text, leading to a 'wrong meaning' despite attempts at deeper processing.", "fix_direction": "Refine the task description to guide the model towards the desired *outcome* of deep processing (e.g., accurate synthesis of main points, elimination of bias, identification of core arguments) rather than just the *act* of processing. Provide clearer examples of what constitutes a high-quality summary in terms of meaning fidelity and conciseness. Experiment with simplifying instructions or focusing on content requirements instead of cognitive steps.", "confidence": 0.9}, "drafts_generated": 1, "drafts_survived": 1}
{"id": "005e113d-cd39-421b-b1a2-8726861f3c21", "target_id": "B2-control", "git_sha": "f4d3f080d13c9ac45575b98b58b41d7afe62f2b4", "pre_experiment_sha": "387fac762daf72b048bb6e185489eaa95eeb4217", "timestamp": "2026-04-24T04:23:46.144140+00:00", "hypothesis": "Append a concise, neutral instruction about utilizing deep cognitive processing to systematically evaluate the text.", "hypothesis_source": "agent", "mutation_diff_summary": "", "score": 3.2, "score_ci_lower": 2.4, "score_ci_upper": 4.0, "raw_scores": [2.0, 4.0, 4.0, 2.0, 4.0], "baseline_score": 3.5, "outcome": "KEPT", "failure_mode": null, "duration_seconds": 43.25465029198676, "tags": ["deep-processing", "task-description"], "learnings": "{\"what_changed\":\"\",\"what_improved\":[],\"what_regressed\":[],\"transferable_insight\":\"Explicitly instructing a system to engage in deep cognitive processing encourages systematic and thorough evaluation of inputs.\",\"domain_tags\":[\"Prompt Engineering\",\"Meta-cognition\",\"Analytical Reasoning\"]}", "cost_usd": 0.0127507, "bootstrap_seed": 0, "agent_model": "gemini-3.1-pro-preview", "held_out_score": null, "criterion_names": ["key_points_captured", "conciseness", "faithful_to_source", "few_shot_format"], "per_criterion_scores": {"key_points_captured": 1.0, "conciseness": 1.0, "faithful_to_source": 0.6, "few_shot_format": 0.6}, "failure_classification": null, "drafts_generated": 1, "drafts_survived": 1}
{"id": "7f0915ab-d32a-47e7-8348-04a7dd6a492b", "target_id": "B2-control", "git_sha": "5e3bec8422f7b232dd64a7444cc73e544372c8e2", "pre_experiment_sha": "f4d3f080d13c9ac45575b98b58b41d7afe62f2b4", "timestamp": "2026-04-24T04:24:47.936300+00:00", "hypothesis": "Insert a concise, neutral instruction encouraging careful reading and deep cognitive processing without modifying any existing text or constraints.", "hypothesis_source": "agent", "mutation_diff_summary": "", "score": 2.9, "score_ci_lower": 2.4, "score_ci_upper": 3.4, "raw_scores": [2.0, 2.5, 3.5, 3.5, 3.0], "baseline_score": 3.2, "outcome": "KEPT", "failure_mode": null, "duration_seconds": 54.03091770783067, "tags": ["neutral_instruction", "deep_processing"], "learnings": "{\"what_changed\":\"\",\"what_improved\":[],\"what_regressed\":[],\"transferable_insight\":\"Inserting generic, neutral instructions to encourage deep cognitive processing without adding concrete constraints can negatively impact task performance.\",\"domain_tags\":[\"Prompt Engineering\",\"Instruction Tuning\"]}", "cost_usd": 0.0122196, "bootstrap_seed": 0, "agent_model": "gemini-3.1-pro-preview", "held_out_score": null, "criterion_names": ["key_points_captured", "conciseness", "faithful_to_source", "few_shot_format"], "per_criterion_scores": {"key_points_captured": 1.0, "conciseness": 1.0, "faithful_to_source": 0.6, "few_shot_format": 0.3}, "failure_classification": null, "drafts_generated": 1, "drafts_survived": 1}
{"id": "4c6bf6f0-1c6e-4235-97b7-e6cfb1fcd0f0", "target_id": "B2-control", "git_sha": "5e3bec8422f7b232dd64a7444cc73e544372c8e2", "pre_experiment_sha": "5e3bec8422f7b232dd64a7444cc73e544372c8e2", "timestamp": "2026-04-24T04:25:58.834258+00:00", "hypothesis": "Insert a concise, neutral instruction encouraging the model to thoroughly analyze the input text, engage in careful reading, and use deep cognitive processing.", "hypothesis_source": "agent", "mutation_diff_summary": "", "score": 2.5, "score_ci_lower": 2.0, "score_ci_upper": 3.1, "raw_scores": [2.0, 2.0, 2.0, 3.5, 3.0], "baseline_score": 2.9, "outcome": "DISCARDED", "failure_mode": null, "duration_seconds": 64.27002966706641, "tags": ["deep-processing", "careful-reading", "neutral-instruction"], "learnings": "{\"what_changed\":\"\",\"what_improved\":[],\"what_regressed\":[],\"transferable_insight\":\"Generic meta-instructions encouraging deep cognitive processing or careful reading degrade performance, indicating that actionable, specific constraints are preferable to vague encouragement.\",\"domain_tags\":[\"Prompt Engineering\",\"Meta-instructions\"]}", "cost_usd": 0.01210415, "bootstrap_seed": 0, "agent_model": "gemini-3.1-pro-preview", "held_out_score": null, "criterion_names": ["key_points_captured", "conciseness", "faithful_to_source", "few_shot_format"], "per_criterion_scores": {"key_points_captured": 1.0, "conciseness": 1.0, "faithful_to_source": 0.4, "few_shot_format": 0.1}, "failure_classification": {"category": "semantic_drift", "description": "The model likely misinterpreted the content of the 'Hypothesis' field as its primary instruction or task. The 'Hypothesis' text itself ('Insert a concise, neutral instruction...') reads like a meta-instruction intended for prompt design or internal model processing, rather than a description of the experiment's goal or a user-facing task. The failure suggests the model either attempted to fulfill this meta-instruction literally or became confused about the actual task, leading to an output that, while potentially syntactically correct, completely missed the semantic intent of the experiment.", "fix_direction": "Ensure clear separation between system-level/meta-instructions (e.g., for model behavior or cognitive processing) and the actual user-level task instructions. Verify that the 'Hypothesis' field accurately describes the experiment's objective or the specific change being tested, rather than containing instructions intended for the model to execute or process internally. The actual task instruction should be presented distinctly from any meta-guidance.", "confidence": 0.9}, "drafts_generated": 1, "drafts_survived": 1}
{"id": "256121e5-0e51-4eae-afbe-5b8ca2167321", "target_id": "B2-control", "git_sha": "6c19c688a89119c3557e2ffe6d6dcaadde352adb", "pre_experiment_sha": "5e3bec8422f7b232dd64a7444cc73e544372c8e2", "timestamp": "2026-04-24T04:27:35.038407+00:00", "hypothesis": "Append a simple, natural instruction to thoroughly analyze the article without modifying existing text or overloading the instruction.", "hypothesis_source": "agent", "mutation_diff_summary": "", "score": 2.9, "score_ci_lower": 2.1, "score_ci_upper": 3.6, "raw_scores": [3.0, 2.5, 3.5, 4.0, 1.5], "baseline_score": 2.9, "outcome": "KEPT", "failure_mode": null, "duration_seconds": 58.83482979098335, "tags": ["insertion", "analysis-instruction"], "learnings": "{\"what_changed\":\"\",\"what_improved\":[],\"what_regressed\":[],\"transferable_insight\":\"Appending a simple, natural-language instruction to thoroughly analyze the input is a safe but neutral prompt modification that does not significantly alter performance.\",\"domain_tags\":[\"Prompt Engineering\",\"Instruction Tuning\"]}", "cost_usd": 0.012531450000000001, "bootstrap_seed": 0, "agent_model": "gemini-3.1-pro-preview", "held_out_score": null, "criterion_names": ["key_points_captured", "conciseness", "faithful_to_source", "few_shot_format"], "per_criterion_scores": {"key_points_captured": 0.9, "conciseness": 1.0, "faithful_to_source": 0.7, "few_shot_format": 0.3}, "failure_classification": null, "drafts_generated": 1, "drafts_survived": 1}
{"id": "ea99a025-ceab-4f6d-bed2-a6b6b806d8ec", "target_id": "B2-control", "git_sha": "06e38378698291d51c1496da3ce99df4f23f618a", "pre_experiment_sha": "6c19c688a89119c3557e2ffe6d6dcaadde352adb", "timestamp": "2026-04-24T04:29:00.729743+00:00", "hypothesis": "Append a simple, natural instruction to thoroughly analyze the article to improve summary quality, leaving existing text untouched to avoid scope violations.", "hypothesis_source": "agent", "mutation_diff_summary": "", "score": 2.6, "score_ci_lower": 2.0, "score_ci_upper": 3.4, "raw_scores": [2.0, 3.0, 2.0, 4.0, 2.0], "baseline_score": 2.9, "outcome": "KEPT", "failure_mode": null, "duration_seconds": 78.31823850004002, "tags": ["analysis", "instruction"], "learnings": "{\"what_changed\":\"\",\"what_improved\":[],\"what_regressed\":[],\"transferable_insight\":\"Appending a simple directive for thorough analysis to existing instructions encourages deeper processing without risking scope violations from altering the original constraints.\",\"domain_tags\":[\"Prompt Engineering\",\"Instruction Tuning\"]}", "cost_usd": 0.01163455, "bootstrap_seed": 0, "agent_model": "gemini-3.1-pro-preview", "held_out_score": null, "criterion_names": ["key_points_captured", "conciseness", "faithful_to_source", "few_shot_format"], "per_criterion_scores": {"key_points_captured": 1.0, "conciseness": 1.0, "faithful_to_source": 0.4, "few_shot_format": 0.2}, "failure_classification": null, "drafts_generated": 1, "drafts_survived": 1}
{"id": "7b7814cb-0648-4904-99c3-371bf3f16e48", "target_id": "B2-control", "git_sha": "a69e9123a9a29d9d27dfb5d46847bbe6719e242b", "pre_experiment_sha": "06e38378698291d51c1496da3ce99df4f23f618a", "timestamp": "2026-04-24T04:30:12.363411+00:00", "hypothesis": "Remove overloaded jargon and append a single, simple analysis instruction to improve summary quality without causing semantic drift.", "hypothesis_source": "agent", "mutation_diff_summary": "", "score": 2.8, "score_ci_lower": 2.2, "score_ci_upper": 3.4, "raw_scores": [2.0, 3.0, 3.0, 2.0, 4.0], "baseline_score": 2.6, "outcome": "KEPT", "failure_mode": null, "duration_seconds": 63.59948791703209, "tags": ["analysis-instruction", "cleanup", "simplify"], "learnings": "{\"what_changed\":\"\",\"what_improved\":[],\"what_regressed\":[],\"transferable_insight\":\"Replacing complex jargon with a single, clear instruction enhances output quality and maintains focus.\",\"domain_tags\":[\"Prompt Engineering\",\"Instruction Clarity\",\"Output Quality\"]}", "cost_usd": 0.01207105, "bootstrap_seed": 0, "agent_model": "gemini-3.1-pro-preview", "held_out_score": null, "criterion_names": ["key_points_captured", "conciseness", "faithful_to_source", "few_shot_format"], "per_criterion_scores": {"key_points_captured": 1.0, "conciseness": 1.0, "faithful_to_source": 0.6, "few_shot_format": 0.2}, "failure_classification": null, "drafts_generated": 1, "drafts_survived": 1}
{"id": "20e2fe0d-50d3-4427-a79c-8af7a4d9f977", "target_id": "B2-control", "git_sha": "585c6e5c5aa8bcb95a351dba0d24038454e542bd", "pre_experiment_sha": "a69e9123a9a29d9d27dfb5d46847bbe6719e242b", "timestamp": "2026-04-24T04:31:22.898467+00:00", "hypothesis": "Append a concise, neutral sentence encouraging deep cognitive processing, careful reading, and thorough analysis to the Task section.", "hypothesis_source": "agent", "mutation_diff_summary": "", "score": 3.2, "score_ci_lower": 2.5, "score_ci_upper": 3.7, "raw_scores": [3.5, 4.0, 3.5, 2.0, 3.0], "baseline_score": 2.8, "outcome": "KEPT", "failure_mode": null, "duration_seconds": 41.30606537498534, "tags": ["prompt-engineering", "neutral-instruction", "append-only"], "learnings": "{\"what_changed\":\"\",\"what_improved\":[],\"what_regressed\":[],\"transferable_insight\":\"Appending a concise, neutral instruction that explicitly encourages deep cognitive processing and thorough analysis improves overall task performance.\",\"domain_tags\":[\"Prompt Engineering\",\"Instruction Design\",\"Reasoning\"]}", "cost_usd": 0.0130609, "bootstrap_seed": 0, "agent_model": "gemini-3.1-pro-preview", "held_out_score": null, "criterion_names": ["key_points_captured", "conciseness", "faithful_to_source", "few_shot_format"], "per_criterion_scores": {"key_points_captured": 1.0, "conciseness": 1.0, "faithful_to_source": 0.8, "few_shot_format": 0.4}, "failure_classification": null, "drafts_generated": 1, "drafts_survived": 1}
{"id": "6be5e50a-e848-4b00-b545-7ee12671f557", "target_id": "B2-control", "git_sha": "585c6e5c5aa8bcb95a351dba0d24038454e542bd", "pre_experiment_sha": "585c6e5c5aa8bcb95a351dba0d24038454e542bd", "timestamp": "2026-04-24T04:32:24.070391+00:00", "hypothesis": "Appending a concise, neutral sentence encouraging careful reading to the Task section to gently reinforce deep cognitive processing without causing semantic drift.", "hypothesis_source": "agent", "mutation_diff_summary": "", "score": 2.5, "score_ci_lower": 2.1, "score_ci_upper": 2.9, "raw_scores": [3.0, 2.0, 2.5, 2.0, 3.0], "baseline_score": 3.2, "outcome": "DISCARDED", "failure_mode": null, "duration_seconds": 55.09370745788328, "tags": ["neutral instruction", "text analysis", "prompt engineering\n\n```markdown\n# Role\nYou are an expert summarization assistant.\n\n# Task\nCarefully analyze the provided article to produce a clear", "concise summary that captures the essential main points. Do not include any external information", "opinions", "or facts not present in the original text. Thoroughly analyze the article to improve summary quality. Deep cognitive processing", "careful reading", "and thorough analysis are encouraged. A careful reading of the text is appreciated.\n\n# Examples\nHere are some examples of how to summarize articles:\n\n---\n\nArticle: OpenAI released GPT-4 in March 2023", "a large multimodal model capable of accepting image and text inputs and producing text outputs. The model was trained using reinforcement learning from human feedback and showed improved performance on a range of academic benchmarks. OpenAI offered GPT-4 access through ChatGPT Plus and the API. The model demonstrated the ability to pass simulated versions of professional exams with scores placing it around the top percentiles of human test-takers.\n\nSummary:\nOpenAI launched GPT-4 in March 2023 as a large multimodal model accepting both image and text input. The model was trained with RLHF methodology and performed strongly across academic benchmarks. It became available through ChatGPT Plus and the OpenAI API. The model achieved high scores on simulated professional exams", "placing it near the top percentile of human test-takers.\n\n---\n\nArticle: The James Webb Space Telescope captured the deepest infrared image of the universe ever taken", "showing galaxy cluster SMACS 0723 as it appeared 4.6 billion years ago. The image", "released by NASA in July 2022", "covers a patch of sky approximately the size of a grain of sand held at arm's length. Thousands of galaxies are visible in the image", "including some of the faintest objects ever observed. The telescope uses gravitational lensing from the galaxy cluster to magnify distant background galaxies.\n\nSummary:\nIn July 2022", "NASA released the James Webb Space Telescope's deepest infrared image of the universe. The image shows galaxy cluster SMACS 0723 as it appeared 4.6 billion years ago and covers a tiny patch of sky. Using gravitational lensing to magnify distant background galaxies", "the image reveals thousands of galaxies", "including some of the faintest objects ever observed.\n\n---\n\nArticle: Researchers at MIT published findings showing that urban trees reduce surface temperatures by an average of 2.5 degrees Celsius in densely populated neighborhoods. The study analyzed satellite thermal data from 47 cities across North America over a 10-year period. Neighborhoods with tree canopy coverage above 30% consistently showed lower heat island effects compared to areas with sparse vegetation. The researchers noted that the cooling effect was most pronounced during peak summer heat events", "suggesting urban forestry as a cost-effective climate adaptation strategy. Funding came from the National Science Foundation.\n\nSummary:\nA decade-long MIT study found urban trees lower surface temperatures by 2.5C on average in dense neighborhoods. Analyzing satellite data across 47 North American cities", "the research showed areas with over 30% canopy coverage had measurably reduced heat island effects. The cooling benefit was strongest during summer heat events. The study", "funded by NSF", "supports urban forestry as a viable climate adaptation strategy.\n\n---\n\nNow summarize the following article:\n\n\n\n\n\n\n\n\n\n\n\n\n\n\n```"], "learnings": "{\"what_changed\":\"\",\"what_improved\":[],\"what_regressed\":[],\"transferable_insight\":\"Appending generic meta-instructions that encourage careful reading degrades performance, likely by introducing noise that distracts from the core task constraints.\",\"domain_tags\":[\"Prompt Engineering\",\"Meta-instructions\",\"Task Optimization\"]}", "cost_usd": 0.0111534, "bootstrap_seed": 0, "agent_model": "gemini-3.1-pro-preview", "held_out_score": null, "criterion_names": ["key_points_captured", "conciseness", "faithful_to_source", "few_shot_format"], "per_criterion_scores": {"key_points_captured": 1.0, "conciseness": 1.0, "faithful_to_source": 0.4, "few_shot_format": 0.1}, "failure_classification": {"category": "semantic_drift", "description": "Despite the hypothesis aiming to avoid it, the added sentence, intended to encourage careful reading, likely subtly altered the model's interpretation of the task. This caused a shift in the meaning or focus of the model's responses, leading to the experiment's failure.", "fix_direction": "Carefully analyze model outputs for subtle shifts in interpretation or emphasis. Test the neutrality and impact of the added sentence more rigorously, possibly by A/B testing variations or by introducing specific evaluation metrics designed to detect semantic drift. Consider alternative ways to encourage 'deep cognitive processing' that are less prone to influencing task interpretation.", "confidence": 0.9}, "drafts_generated": 1, "drafts_survived": 1}
