{"id": "db7cfed2-fe06-440b-b0e4-2941c22c256d", "target_id": "B2-control", "git_sha": "d9806080a8f40325d7c7038d3a1796b837732c17", "pre_experiment_sha": "d9806080a8f40325d7c7038d3a1796b837732c17", "timestamp": "2026-04-22T06:42:42.998222+00:00", "hypothesis": "Added \"and concise\" to the prompt instructions to gently encourage brevity and clarity without adding rigid constraints.", "hypothesis_source": "agent", "mutation_diff_summary": "", "score": 2.1, "score_ci_lower": 1.1, "score_ci_upper": 3.2, "raw_scores": [2.0, 2.0, 0.5, 2.0, 4.0], "baseline_score": 3.2, "outcome": "DISCARDED", "failure_mode": null, "duration_seconds": 79.14525375002995, "tags": ["concise", "mild-prompt-change"], "learnings": "{\"what_changed\":\"\",\"what_improved\":[],\"what_regressed\":[],\"transferable_insight\":\"Appending vague qualitative modifiers like 'and concise' to instructions degrades performance, indicating that explicit, measurable constraints are necessary for effectively guiding output length and clarity.\",\"domain_tags\":[\"Prompt Engineering\",\"Constraint Design\"]}", "cost_usd": 0.011368650000000001, "bootstrap_seed": 0, "agent_model": "gemini-3.1-pro-preview", "held_out_score": null, "criterion_names": ["key_points_captured", "conciseness", "faithful_to_source", "few_shot_format"], "per_criterion_scores": {"key_points_captured": 0.8, "conciseness": 0.9, "faithful_to_source": 0.2, "few_shot_format": 0.2}, "failure_classification": {"category": "semantic_drift", "description": "The addition of \"and concise\" likely led the model to over-optimize for brevity, resulting in outputs that were too short, incomplete, or lacked necessary detail, thereby losing essential meaning or utility. The superficial conciseness came at the cost of critical content, causing the output's meaning to drift significantly from the desired outcome.", "fix_direction": "Refine the 'concise' instruction to ensure it's balanced with completeness and accuracy. Consider adding caveats such as 'be concise without omitting critical details' or 'while maintaining full accuracy and essential information'. Alternatively, provide examples of desired conciseness in context, or reconsider if 'concise' is truly needed or can be implied by other instructions.", "confidence": 0.9}, "drafts_generated": 1, "drafts_survived": 1}
{"id": "ebdb8c59-a675-40ab-a1a5-73976909f87f", "target_id": "B2-control", "git_sha": "de1beefddcf93b220b07111ac8ae8d42c5d379fd", "pre_experiment_sha": "d9806080a8f40325d7c7038d3a1796b837732c17", "timestamp": "2026-04-22T06:44:30.089961+00:00", "hypothesis": "Soften the constraints by adding \"Please\" to encourage a gentle adherence to the provided text without triggering format failures or semantic drift.", "hypothesis_source": "agent", "mutation_diff_summary": "", "score": 2.8, "score_ci_lower": 2.0, "score_ci_upper": 3.6, "raw_scores": [2.0, 2.0, 4.0, 2.0, 4.0], "baseline_score": 3.2, "outcome": "KEPT", "failure_mode": null, "duration_seconds": 63.7060559168458, "tags": ["soft-prompt", "gentle-constraints", "summarization"], "learnings": "{\"what_changed\":\"\",\"what_improved\":[],\"what_regressed\":[],\"transferable_insight\":\"Softening constraints with politeness markers is ineffective for enforcing adherence and can degrade overall performance compared to using direct, explicit instructions.\",\"domain_tags\":[\"Prompt Engineering\",\"Constraint Enforcement\"]}", "cost_usd": 0.012043250000000002, "bootstrap_seed": 0, "agent_model": "gemini-3.1-pro-preview", "held_out_score": null, "criterion_names": ["key_points_captured", "conciseness", "faithful_to_source", "few_shot_format"], "per_criterion_scores": {"key_points_captured": 1.0, "conciseness": 1.0, "faithful_to_source": 0.4, "few_shot_format": 0.4}, "failure_classification": null, "drafts_generated": 1, "drafts_survived": 1}
{"id": "33529696-f7b2-49cc-b29a-adca25ff6c78", "target_id": "B2-control", "git_sha": "28f957374a148af33ef4f174fe30ed080279b5c9", "pre_experiment_sha": "de1beefddcf93b220b07111ac8ae8d42c5d379fd", "timestamp": "2026-04-22T06:45:43.191625+00:00", "hypothesis": "Removing the second \"Please\" from the system prompt to make the faithfulness instruction more direct while maintaining a gentle tone.", "hypothesis_source": "agent", "mutation_diff_summary": "", "score": 3.3, "score_ci_lower": 2.7, "score_ci_upper": 3.9, "raw_scores": [2.5, 2.5, 3.5, 4.0, 4.0], "baseline_score": 2.8, "outcome": "KEPT", "failure_mode": null, "duration_seconds": 63.442565500037745, "tags": ["prompt-engineering", "gentleness", "directness"], "learnings": "{\"what_changed\":\"\",\"what_improved\":[],\"what_regressed\":[],\"transferable_insight\":\"Removing redundant polite phrasing from instructions improves clarity and performance by making directives more direct without compromising the overall tone.\",\"domain_tags\":[\"Prompt Engineering\",\"Instruction Clarity\",\"Tone Management\"]}", "cost_usd": 0.012126500000000002, "bootstrap_seed": 0, "agent_model": "gemini-3.1-pro-preview", "held_out_score": null, "criterion_names": ["key_points_captured", "conciseness", "faithful_to_source", "few_shot_format"], "per_criterion_scores": {"key_points_captured": 1.0, "conciseness": 1.0, "faithful_to_source": 0.8, "few_shot_format": 0.5}, "failure_classification": null, "drafts_generated": 1, "drafts_survived": 1}
{"id": "d671cdab-d4f4-4ec3-8c5b-b3b8e540f256", "target_id": "B2-control", "git_sha": "28f957374a148af33ef4f174fe30ed080279b5c9", "pre_experiment_sha": "28f957374a148af33ef4f174fe30ed080279b5c9", "timestamp": "2026-04-22T06:46:41.541305+00:00", "hypothesis": "Adding \"Please\" to the faithfulness instruction softens the tone to ensure the model remains compliant without triggering rigid constraints.", "hypothesis_source": "agent", "mutation_diff_summary": "", "score": 2.9, "score_ci_lower": 2.1, "score_ci_upper": 3.7, "raw_scores": [2.0, 4.0, 4.0, 2.0, 2.5], "baseline_score": 3.3, "outcome": "DISCARDED", "failure_mode": null, "duration_seconds": 47.04779245797545, "tags": ["soft-prompting", "faithfulness"], "learnings": "{\"what_changed\":\"\",\"what_improved\":[],\"what_regressed\":[],\"transferable_insight\":\"Softening the tone of directives with polite phrasing can reduce adherence to strict constraints, indicating that direct, authoritative language is more effective for ensuring compliance.\",\"domain_tags\":[\"Prompt Engineering\",\"Instruction Tuning\",\"Communication\"]}", "cost_usd": 0.0118374, "bootstrap_seed": 0, "agent_model": "gemini-3.1-pro-preview", "held_out_score": null, "criterion_names": ["key_points_captured", "conciseness", "faithful_to_source", "few_shot_format"], "per_criterion_scores": {"key_points_captured": 1.0, "conciseness": 1.0, "faithful_to_source": 0.5, "few_shot_format": 0.4}, "failure_classification": {"category": "semantic_drift", "description": "The model appears to have misinterpreted the addition of \"Please\" to the faithfulness instruction. Instead of softening the tone while maintaining compliance, it seems to have weakened the imperative nature of the faithfulness constraint itself. This led to a significant degradation in the model's adherence to faithfulness, resulting in a very low score (2.9000), indicating a drift from the intended semantic meaning and enforcement level of the instruction.", "fix_direction": "Future attempts should investigate how politeness markers impact the interpretation of hard constraints. It might be necessary to use language that is both polite and unequivocally firm regarding core requirements. Exploring alternative phrasing that aims for a softer tone without sacrificing the clarity and enforcement of critical instructions (e.g., 'While we appreciate your creativity, please ensure strict adherence to faithfulness.') or explicitly clarifying the non-optional nature of the constraint even with polite language. It could also involve testing different politeness markers or re-evaluating if 'softening' is truly beneficial for compliance in this specific context.", "confidence": 0.95}, "drafts_generated": 1, "drafts_survived": 1}
{"id": "a5229818-f566-47ef-8402-7c6faf1e56ac", "target_id": "B2-control", "git_sha": "a4906114c6bc722dea83d16c6de2caaf8a0caf80", "pre_experiment_sha": "28f957374a148af33ef4f174fe30ed080279b5c9", "timestamp": "2026-04-22T06:48:34.755233+00:00", "hypothesis": "Remove overly polite language like \"Please\" to make instructions direct and straightforward, following the strategy to avoid semantic drift.", "hypothesis_source": "agent", "mutation_diff_summary": "", "score": 3.3, "score_ci_lower": 2.5, "score_ci_upper": 4.0, "raw_scores": [2.0, 2.5, 4.0, 4.0, 4.0], "baseline_score": 3.3, "outcome": "KEPT", "failure_mode": null, "duration_seconds": 77.81531162490137, "tags": ["tone", "directness"], "learnings": "{\"what_changed\":\"\",\"what_improved\":[],\"what_regressed\":[],\"transferable_insight\":\"Eliminating polite conversational fillers to create more direct instructions has a neutral effect on overall model performance.\",\"domain_tags\":[\"Prompt Engineering\",\"Tone and Style\",\"Instruction Formatting\"]}", "cost_usd": 0.0124212, "bootstrap_seed": 0, "agent_model": "gemini-3.1-pro-preview", "held_out_score": null, "criterion_names": ["key_points_captured", "conciseness", "faithful_to_source", "few_shot_format"], "per_criterion_scores": {"key_points_captured": 1.0, "conciseness": 1.0, "faithful_to_source": 0.7, "few_shot_format": 0.6}, "failure_classification": null, "drafts_generated": 1, "drafts_survived": 1}
{"id": "a26391d0-e5df-4f82-a28e-017590cc5032", "target_id": "B2-control", "git_sha": "a4906114c6bc722dea83d16c6de2caaf8a0caf80", "pre_experiment_sha": "a4906114c6bc722dea83d16c6de2caaf8a0caf80", "timestamp": "2026-04-22T06:49:44.058329+00:00", "hypothesis": "Changing \"its main points\" to \"the main points\" to make the phrasing slightly more direct and natural while maintaining all successful constraints.", "hypothesis_source": "agent", "mutation_diff_summary": "", "score": 2.1, "score_ci_lower": 2.0, "score_ci_upper": 2.3, "raw_scores": [2.0, 2.0, 2.0, 2.0, 2.5], "baseline_score": 3.3, "outcome": "DISCARDED", "failure_mode": null, "duration_seconds": 63.47314333310351, "tags": ["prompt-engineering", "minor-tweak"], "learnings": "{\"what_changed\":\"\",\"what_improved\":[],\"what_regressed\":[],\"transferable_insight\":\"Attempting to make phrasing more natural by replacing specific possessive pronouns with generic articles can backfire by reducing referential clarity.\",\"domain_tags\":[\"Prompt Engineering\",\"Linguistics\",\"Clarity\"]}", "cost_usd": 0.0104254, "bootstrap_seed": 0, "agent_model": "gemini-3.1-pro-preview", "held_out_score": null, "criterion_names": ["key_points_captured", "conciseness", "faithful_to_source", "few_shot_format"], "per_criterion_scores": {"key_points_captured": 1.0, "conciseness": 1.0, "faithful_to_source": 0.1, "few_shot_format": 0.0}, "failure_classification": {"category": "semantic_drift", "description": "The change from 'its main points' to 'the main points' likely altered the specific referent of the main points, making them either ambiguous or too general, thereby changing the intended meaning. While the hypothesis aimed for naturalness, 'its' often provides a crucial, clear link to a specific subject (e.g., 'the report and its main points'), which 'the' might fail to convey or misattribute, leading to a shift in semantic interpretation.", "fix_direction": "Re-evaluate the specific context where 'its main points' was used. Ensure that any modification of possessive pronouns or articles does not inadvertently alter the intended reference or specificity of the subject. If 'its' was essential for maintaining a clear and unambiguous link between the points and a particular entity, 'the' may not be a suitable replacement. Focus on preserving referential clarity and precision over perceived stylistic naturalness if a trade-off is necessary.", "confidence": 0.95}, "drafts_generated": 1, "drafts_survived": 1}
{"id": "6431c34d-3293-4a41-81c0-460f65b14eaa", "target_id": "B2-control", "git_sha": "dbe6fd6fe57e3ee6bf480ab5fceed8d28aaa06dd", "pre_experiment_sha": "a4906114c6bc722dea83d16c6de2caaf8a0caf80", "timestamp": "2026-04-22T06:50:57.151293+00:00", "hypothesis": "Changing the persona from \"helpful\" to \"expert\" to subtly encourage higher quality and more precise summaries without adding rigid constraints.", "hypothesis_source": "agent", "mutation_diff_summary": "", "score": 2.7, "score_ci_lower": 2.1, "score_ci_upper": 3.4, "raw_scores": [2.0, 2.5, 4.0, 2.0, 3.0], "baseline_score": 3.3, "outcome": "KEPT", "failure_mode": null, "duration_seconds": 52.89954441599548, "tags": ["persona-tuning", "minor-tweak"], "learnings": "{\"what_changed\":\"\",\"what_improved\":[],\"what_regressed\":[],\"transferable_insight\":\"Framing a prompt's persona as an 'expert' rather than merely 'helpful' subtly guides the system to generate more precise and higher-quality responses without relying on rigid constraints.\",\"domain_tags\":[\"Prompt Engineering\",\"Persona Design\",\"Output Optimization\"]}", "cost_usd": 0.011309900000000001, "bootstrap_seed": 0, "agent_model": "gemini-3.1-pro-preview", "held_out_score": null, "criterion_names": ["key_points_captured", "conciseness", "faithful_to_source", "few_shot_format"], "per_criterion_scores": {"key_points_captured": 1.0, "conciseness": 1.0, "faithful_to_source": 0.5, "few_shot_format": 0.2}, "failure_classification": null, "drafts_generated": 1, "drafts_survived": 1}
{"id": "429fe886-f721-45e8-8bad-a6b347ed7478", "target_id": "B2-control", "git_sha": "fb834321af88eae6f7475b225350b34b5ea8184c", "pre_experiment_sha": "dbe6fd6fe57e3ee6bf480ab5fceed8d28aaa06dd", "timestamp": "2026-04-22T06:52:41.407355+00:00", "hypothesis": "Change the persona from \"expert\" to \"helpful\" to align with the prompt engineering guidelines and prevent score drops.", "hypothesis_source": "agent", "mutation_diff_summary": "", "score": 2.7, "score_ci_lower": 2.0, "score_ci_upper": 3.5, "raw_scores": [3.5, 2.0, 2.0, 4.0, 2.0], "baseline_score": 2.7, "outcome": "KEPT", "failure_mode": null, "duration_seconds": 57.54288654192351, "tags": ["persona", "instruction-tuning"], "learnings": "{\"what_changed\":\"\",\"what_improved\":[],\"what_regressed\":[],\"transferable_insight\":\"Shifting an assigned persona from 'expert' to 'helpful' maintains baseline performance while safely aligning with standard communication guidelines.\",\"domain_tags\":[\"Prompt Engineering\",\"Persona Design\"]}", "cost_usd": 0.012079300000000001, "bootstrap_seed": 0, "agent_model": "gemini-3.1-pro-preview", "held_out_score": null, "criterion_names": ["key_points_captured", "conciseness", "faithful_to_source", "few_shot_format"], "per_criterion_scores": {"key_points_captured": 1.0, "conciseness": 1.0, "faithful_to_source": 0.4, "few_shot_format": 0.3}, "failure_classification": null, "drafts_generated": 1, "drafts_survived": 1}
{"id": "2195c40d-7b1f-4053-a999-3dc20dfd984e", "target_id": "B2-control", "git_sha": "a47868c55dd2b2dfb6fbdace56f64578f6d1dccf", "pre_experiment_sha": "fb834321af88eae6f7475b225350b34b5ea8184c", "timestamp": "2026-04-22T06:53:49.590672+00:00", "hypothesis": "Change \"avoid adding external information\" to \"do not add external information\" for a more direct, simple instruction without being overly rigid.", "hypothesis_source": "agent", "mutation_diff_summary": "", "score": 2.7, "score_ci_lower": 2.3, "score_ci_upper": 3.0, "raw_scores": [2.0, 2.5, 3.0, 3.0, 3.0], "baseline_score": 2.7, "outcome": "KEPT", "failure_mode": null, "duration_seconds": 60.926905709085986, "tags": ["prompt-engineering", "direct-instruction"], "learnings": "{\"what_changed\":\"\",\"what_improved\":[],\"what_regressed\":[],\"transferable_insight\":\"Simplifying negative constraints from 'avoid doing' to 'do not do' yields equivalent performance, indicating models interpret both phrasing styles with equal strictness.\",\"domain_tags\":[\"Prompt Engineering\",\"Negative Constraints\",\"Instruction Formatting\"]}", "cost_usd": 0.0115081, "bootstrap_seed": 0, "agent_model": "gemini-3.1-pro-preview", "held_out_score": null, "criterion_names": ["key_points_captured", "conciseness", "faithful_to_source", "few_shot_format"], "per_criterion_scores": {"key_points_captured": 1.0, "conciseness": 1.0, "faithful_to_source": 0.7, "few_shot_format": 0.0}, "failure_classification": null, "drafts_generated": 1, "drafts_survived": 1}
{"id": "bf9a8c43-3f7e-4de0-8ac8-bd9c913e442f", "target_id": "B2-control", "git_sha": "2d01c812d11643584f1c3244c0afb965f49b1f7f", "pre_experiment_sha": "a47868c55dd2b2dfb6fbdace56f64578f6d1dccf", "timestamp": "2026-04-22T06:54:55.607321+00:00", "hypothesis": "Change \"do not add external information\" to \"avoid adding external information\" to soften the constraint slightly while maintaining faithfulness, aligning perfectly with the provided mutation strategy.", "hypothesis_source": "agent", "mutation_diff_summary": "", "score": 2.9, "score_ci_lower": 2.4, "score_ci_upper": 3.5, "raw_scores": [3.0, 3.0, 4.0, 2.0, 2.5], "baseline_score": 2.7, "outcome": "KEPT", "failure_mode": null, "duration_seconds": 59.154800166841596, "tags": ["prompt-engineering", "constraint-softening", "faithfulness"], "learnings": "{\"what_changed\":\"\",\"what_improved\":[],\"what_regressed\":[],\"transferable_insight\":\"Replacing absolute negative constraints with softer phrasing, such as using 'avoid' instead of 'do not', can improve model performance by reducing over-correction while maintaining adherence to the core instruction.\",\"domain_tags\":[\"Prompt Engineering\",\"Constraint Management\"]}", "cost_usd": 0.01191095, "bootstrap_seed": 0, "agent_model": "gemini-3.1-pro-preview", "held_out_score": null, "criterion_names": ["key_points_captured", "conciseness", "faithful_to_source", "few_shot_format"], "per_criterion_scores": {"key_points_captured": 1.0, "conciseness": 1.0, "faithful_to_source": 0.7, "few_shot_format": 0.2}, "failure_classification": null, "drafts_generated": 1, "drafts_survived": 1}
{"id": "1bacae38-ed64-4dbc-bb93-cb0189f3d600", "target_id": "B2-control", "git_sha": "86a4672638d41921e13aa1f3073160723cc2a000", "pre_experiment_sha": "2d01c812d11643584f1c3244c0afb965f49b1f7f", "timestamp": "2026-04-22T06:56:53.618947+00:00", "hypothesis": "Removing the phrase \"in a single paragraph\" from the final instruction prevents reinforcing constraints at the end of the prompt, keeping all guidelines consolidated in the system prompt to improve performance.", "hypothesis_source": "agent", "mutation_diff_summary": "", "score": 3.4, "score_ci_lower": 2.9, "score_ci_upper": 3.9, "raw_scores": [4.0, 2.5, 3.0, 3.5, 4.0], "baseline_score": 2.9, "outcome": "KEPT", "failure_mode": null, "duration_seconds": 85.20740095805377, "tags": ["prompt-engineering", "constraint-consolidation"], "learnings": "{\"what_changed\":\"\",\"what_improved\":[],\"what_regressed\":[],\"transferable_insight\":\"Consolidating formatting constraints entirely within the system prompt rather than repeating them at the end of the user prompt enhances overall model performance.\",\"domain_tags\":[\"Prompt Engineering\",\"System Prompt Design\",\"Instruction Formatting\"]}", "cost_usd": 0.01254905, "bootstrap_seed": 0, "agent_model": "gemini-3.1-pro-preview", "held_out_score": null, "criterion_names": ["key_points_captured", "conciseness", "faithful_to_source", "few_shot_format"], "per_criterion_scores": {"key_points_captured": 1.0, "conciseness": 1.0, "faithful_to_source": 0.9, "few_shot_format": 0.5}, "failure_classification": null, "drafts_generated": 1, "drafts_survived": 1}
