{"id": "82ab9e97-002c-43f0-b182-8cc59ba10a21", "target_id": "B2-control", "git_sha": "1b76bb74cef7d63eef3f7f58a9c6877fd39b41a1", "pre_experiment_sha": "98720ed81b388f89159675b9a957acbab5e8f23e", "timestamp": "2026-04-24T03:55:59.398260+00:00", "hypothesis": "Remove hallucinated information from the few-shot examples and explicitly instruct the model not to include external information, as the previous examples taught the model to hallucinate.", "hypothesis_source": "agent", "mutation_diff_summary": "", "score": 3.4, "score_ci_lower": 2.6, "score_ci_upper": 4.0, "raw_scores": [3.0, 4.0, 4.0, 2.0, 4.0], "baseline_score": 0.0, "outcome": "KEPT", "failure_mode": null, "duration_seconds": 51.423720916034654, "tags": ["hallucination", "few-shot", "formatting", "summarization"], "learnings": "{\"what_changed\":\"\",\"what_improved\":[],\"what_regressed\":[],\"transferable_insight\":\"To prevent hallucinations, ensure that few-shot examples strictly rely only on provided context and pair them with explicit instructions forbidding the use of external information.\",\"domain_tags\":[\"Prompt Engineering\",\"Few-Shot Prompting\",\"Hallucination Mitigation\"]}", "cost_usd": 0.0123911, "bootstrap_seed": 0, "agent_model": "gemini-3.1-pro-preview", "held_out_score": null, "criterion_names": ["key_points_captured", "conciseness", "faithful_to_source", "few_shot_format"], "per_criterion_scores": {"key_points_captured": 1.0, "conciseness": 1.0, "faithful_to_source": 0.8, "few_shot_format": 0.6}, "failure_classification": null, "drafts_generated": 1, "drafts_survived": 1}
{"id": "6da00d06-757d-4187-8a0e-5a6d342e2f08", "target_id": "B2-control", "git_sha": "1b76bb74cef7d63eef3f7f58a9c6877fd39b41a1", "pre_experiment_sha": "1b76bb74cef7d63eef3f7f58a9c6877fd39b41a1", "timestamp": "2026-04-24T03:56:58.900538+00:00", "hypothesis": "Adding strict rules against hallucinations, external commentary, and introductory filler phrases will improve the summary quality and adherence to strict evaluation criteria.", "hypothesis_source": "agent", "mutation_diff_summary": "", "score": 2.9, "score_ci_lower": 2.3, "score_ci_upper": 3.5, "raw_scores": [2.0, 4.0, 3.0, 3.0, 2.5], "baseline_score": 3.4, "outcome": "DISCARDED", "failure_mode": null, "duration_seconds": 52.289172125048935, "tags": ["prompt-engineering", "summarization", "strict-rules", "formatting"], "learnings": "{\"what_changed\":\"\",\"what_improved\":[],\"what_regressed\":[],\"transferable_insight\":\"Implementing overly strict negative constraints to prevent specific errors can inadvertently degrade overall performance and output quality.\",\"domain_tags\":[\"Prompt Engineering\",\"Negative Constraints\",\"Instruction Design\"]}", "cost_usd": 0.01196545, "bootstrap_seed": 0, "agent_model": "gemini-3.1-pro-preview", "held_out_score": null, "criterion_names": ["key_points_captured", "conciseness", "faithful_to_source", "few_shot_format"], "per_criterion_scores": {"key_points_captured": 1.0, "conciseness": 1.0, "faithful_to_source": 0.7, "few_shot_format": 0.2}, "failure_classification": {"category": "semantic_drift", "description": "The strict rules against hallucinations, external commentary, and introductory filler likely caused the summaries to become overly conservative, sparse, or lose essential context and coherence. While potentially successful at avoiding the specified negative traits, the outputs may have sacrificed overall informativeness, readability, or completeness, leading to a degraded overall quality score (semantic drift in meaning/utility).", "fix_direction": "Rebalance constraints to allow for necessary nuance in summarization, ensuring that strict adherence to negative rules does not inadvertently compromise overall summary quality, informativeness, and coherence. Future iterations should refine rule definitions, provide positive examples, and emphasize a balance between constraint adherence and meaningful content generation.", "confidence": 0.9}, "drafts_generated": 1, "drafts_survived": 1}
{"id": "7fe957d5-2c88-48d7-92b9-351fa4fad5d9", "target_id": "B2-control", "git_sha": "1b76bb74cef7d63eef3f7f58a9c6877fd39b41a1", "pre_experiment_sha": "1b76bb74cef7d63eef3f7f58a9c6877fd39b41a1", "timestamp": "2026-04-24T03:58:30.350620+00:00", "hypothesis": "Adding explicit, enumerated constraints for formatting, conciseness, and hallucination prevention will guide the model to strictly adhere to the evaluation criteria and improve the binary criteria score.", "hypothesis_source": "agent", "mutation_diff_summary": "", "score": 2.8, "score_ci_lower": 2.0, "score_ci_upper": 3.6, "raw_scores": [2.0, 2.0, 4.0, 2.0, 4.0], "baseline_score": 3.4, "outcome": "DISCARDED", "failure_mode": null, "duration_seconds": 73.83869083295576, "tags": ["prompt-engineering", "constraint-clarification", "formatting"], "learnings": "{\"what_changed\":\"\",\"what_improved\":[],\"what_regressed\":[],\"transferable_insight\":\"Overloading prompts with explicit, enumerated constraints can degrade rather than improve a model's ability to adhere to specific evaluation criteria.\",\"domain_tags\":[\"Prompt Engineering\",\"Constraint Satisfaction\"]}", "cost_usd": 0.0123262, "bootstrap_seed": 0, "agent_model": "gemini-3.1-pro-preview", "held_out_score": null, "criterion_names": ["key_points_captured", "conciseness", "faithful_to_source", "few_shot_format"], "per_criterion_scores": {"key_points_captured": 1.0, "conciseness": 1.0, "faithful_to_source": 0.4, "few_shot_format": 0.4}, "failure_classification": {"category": "semantic_drift", "description": "The experiment hypothesized that explicit constraints for formatting, conciseness, and hallucination prevention would improve adherence and the binary criteria score. However, the low score (2.8000) suggests that despite these constraints, the model failed to produce output with the intended correct meaning or relevance. This indicates the model likely still generated incorrect information, hallucinated, or produced content that was superficially compliant (e.g., concise or correctly formatted) but semantically unsound, incomplete, or misleading.", "fix_direction": "Focus on enhancing the model's ability to grasp and apply semantic correctness and factual accuracy. This could involve refining the constraints to be more specific about content validity, incorporating explicit grounding mechanisms, using more robust negative examples for hallucination, or employing prompt engineering strategies that prioritize truthfulness and relevance over mere structural adherence or brevity.", "confidence": 0.9}, "drafts_generated": 1, "drafts_survived": 1}
{"id": "7d41e3fe-d498-4163-bd35-5ea085fdd6f8", "target_id": "B2-control", "git_sha": "1b76bb74cef7d63eef3f7f58a9c6877fd39b41a1", "pre_experiment_sha": "1b76bb74cef7d63eef3f7f58a9c6877fd39b41a1", "timestamp": "2026-04-24T03:59:57.289480+00:00", "hypothesis": "Removing implicit external knowledge (like the acronyms \"RLHF\" and \"NSF\") from the few-shot summaries will teach the model strict faithfulness to the source text and reduce hallucinations.", "hypothesis_source": "agent", "mutation_diff_summary": "", "score": 3.1, "score_ci_lower": 2.5, "score_ci_upper": 3.7, "raw_scores": [3.5, 4.0, 3.0, 2.0, 3.0], "baseline_score": 3.4, "outcome": "DISCARDED", "failure_mode": null, "duration_seconds": 57.915182458935305, "tags": ["few-shot", "hallucination", "cleanup"], "learnings": "{\"what_changed\":\"\",\"what_improved\":[],\"what_regressed\":[],\"transferable_insight\":\"Over-constraining few-shot examples by removing universally understood implicit knowledge degrades performance rather than improving strict faithfulness.\",\"domain_tags\":[\"Few-Shot Prompting\",\"Hallucination Mitigation\",\"Prompt Engineering\"]}", "cost_usd": 0.01255085, "bootstrap_seed": 0, "agent_model": "gemini-3.1-pro-preview", "held_out_score": null, "criterion_names": ["key_points_captured", "conciseness", "faithful_to_source", "few_shot_format"], "per_criterion_scores": {"key_points_captured": 1.0, "conciseness": 1.0, "faithful_to_source": 0.8, "few_shot_format": 0.3}, "failure_classification": {"category": "semantic_drift", "description": "The experiment aimed to reduce hallucinations and improve strict faithfulness by removing implicit external knowledge (like acronyms) from few-shot summaries. The failure, indicated by a score of 3.1000, suggests that the model's output continued to exhibit semantic drift, meaning it was not strictly faithful to the source text or still generated hallucinatory content despite the intervention.", "fix_direction": "Investigate the specific nature and sources of the remaining hallucinations and unfaithful generations. This could involve analyzing whether the base model's pre-trained knowledge is a more dominant factor than few-shot examples, if the definition of 'external knowledge' was too narrow, or if the removal of context (like acronyms) inadvertently hindered the model's overall comprehension or coherence, leading to different forms of semantic drift.", "confidence": 0.9}, "drafts_generated": 1, "drafts_survived": 1}
{"id": "d57e2d9a-a70e-4fc4-b5c8-79d38e5f7e87", "target_id": "B2-control", "git_sha": "1b76bb74cef7d63eef3f7f58a9c6877fd39b41a1", "pre_experiment_sha": "1b76bb74cef7d63eef3f7f58a9c6877fd39b41a1", "timestamp": "2026-04-24T04:01:27.124518+00:00", "hypothesis": "Clean up the few-shot examples to remove external acronyms (RLHF, NSF) and abbreviations (2.5C) not present in the source articles, ensuring the model learns to rely strictly on the provided text.", "hypothesis_source": "agent", "mutation_diff_summary": "", "score": 2.8, "score_ci_lower": 2.2, "score_ci_upper": 3.4, "raw_scores": [4.0, 3.0, 2.0, 2.0, 3.0], "baseline_score": 3.4, "outcome": "DISCARDED", "failure_mode": null, "duration_seconds": 71.68165558297187, "tags": ["few-shot", "hallucination-removal"], "learnings": "{\"what_changed\":\"\",\"what_improved\":[],\"what_regressed\":[],\"transferable_insight\":\"Overly sanitizing few-shot examples to strictly exclude external acronyms or abbreviations degrades performance, indicating that allowing models to leverage pre-trained knowledge for common terms is more effective than enforcing rigid source-text adherence.\",\"domain_tags\":[\"Few-Shot Prompting\",\"Prompt Engineering\",\"Model Grounding\"]}", "cost_usd": 0.0117979, "bootstrap_seed": 0, "agent_model": "gemini-3.1-pro-preview", "held_out_score": null, "criterion_names": ["key_points_captured", "conciseness", "faithful_to_source", "few_shot_format"], "per_criterion_scores": {"key_points_captured": 1.0, "conciseness": 1.0, "faithful_to_source": 0.6, "few_shot_format": 0.2}, "failure_classification": {"category": "semantic_drift", "description": "The experiment aimed to force the model to strictly rely on provided text by removing external acronyms/abbreviations from few-shot examples. The low score (2.8) indicates failure in this goal, suggesting the model continued to incorporate or infer meaning and facts from its pre-training knowledge, leading to outputs that were semantically incorrect or not strictly grounded in the given articles, despite the input cleanup.", "fix_direction": "Analyze specific examples of the model's output to identify the precise nature of the semantic drift (e.g., still using removed acronyms, introducing unrelated external facts, misinterpreting cleaned context). Explore more robust grounding techniques, such as explicit negative prompting ('do not use any external knowledge', 'only use information provided in the article'), or consider fine-tuning with a dataset explicitly designed to penalize non-grounded generations.", "confidence": 0.9}, "drafts_generated": 1, "drafts_survived": 1}
{"id": "83340f71-c1a1-413a-815b-2a31a9e8ef64", "target_id": "B2-control", "git_sha": "1b76bb74cef7d63eef3f7f58a9c6877fd39b41a1", "pre_experiment_sha": "1b76bb74cef7d63eef3f7f58a9c6877fd39b41a1", "timestamp": "2026-04-24T04:02:43.975174+00:00", "hypothesis": "Clean the few-shot examples by removing unmentioned acronyms (like RLHF, NSF) and external synonyms to strictly demonstrate perfect fidelity to the original text.", "hypothesis_source": "agent", "mutation_diff_summary": "", "score": 2.7, "score_ci_lower": 2.0, "score_ci_upper": 3.5, "raw_scores": [2.0, 2.0, 2.0, 4.0, 3.5], "baseline_score": 3.4, "outcome": "DISCARDED", "failure_mode": null, "duration_seconds": 57.746203292161226, "tags": ["few-shot", "hallucination", "formatting"], "learnings": "{\"what_changed\":\"\",\"what_improved\":[],\"what_regressed\":[],\"transferable_insight\":\"Over-constraining few-shot examples to strictly match source text by removing common acronyms and synonyms degrades performance, as it prevents the model from utilizing natural abstraction and summarization capabilities.\",\"domain_tags\":[\"Prompt Engineering\",\"Few-Shot Learning\",\"Data Curation\"]}", "cost_usd": 0.012051550000000001, "bootstrap_seed": 0, "agent_model": "gemini-3.1-pro-preview", "held_out_score": null, "criterion_names": ["key_points_captured", "conciseness", "faithful_to_source", "few_shot_format"], "per_criterion_scores": {"key_points_captured": 1.0, "conciseness": 1.0, "faithful_to_source": 0.4, "few_shot_format": 0.3}, "failure_classification": {"category": "semantic_drift", "description": "The experiment aimed to achieve 'perfect fidelity' by removing unmentioned acronyms and external synonyms. However, this cleaning process likely led to a loss of crucial semantic context or altered the effective meaning of the few-shot examples, resulting in a degraded score (2.7) rather than improved fidelity. The simplification inadvertently changed the informational content in a way that negatively impacted the experiment's goal.", "fix_direction": "Re-evaluate the definition of 'perfect fidelity' in the context of few-shot examples. Instead of strictly removing elements based on a narrow interpretation, consider the functional and contextual utility of acronyms and synonyms. A more nuanced approach that preserves essential semantic information, even if 'external' or 'unmentioned' in a literal sense, might be necessary.", "confidence": 0.9}, "drafts_generated": 1, "drafts_survived": 1}
{"id": "e18699c1-8dd7-40fe-aa63-1453ba719133", "target_id": "B2-control", "git_sha": "1b76bb74cef7d63eef3f7f58a9c6877fd39b41a1", "pre_experiment_sha": "1b76bb74cef7d63eef3f7f58a9c6877fd39b41a1", "timestamp": "2026-04-24T04:04:25.170746+00:00", "hypothesis": "Refine the instruction to be more explicitly restrictive against external facts and clean up minor hallucinated terms in the examples without over-scrutinizing acronyms or synonyms.", "hypothesis_source": "agent", "mutation_diff_summary": "", "score": 3.3, "score_ci_lower": 2.8, "score_ci_upper": 3.8, "raw_scores": [4.0, 2.5, 3.0, 4.0, 3.0], "baseline_score": 3.4, "outcome": "DISCARDED", "failure_mode": null, "duration_seconds": 69.06963954097591, "tags": ["prompt-engineering", "instruction-tuning", "few-shot-cleanup"], "learnings": "{\"what_changed\":\"\",\"what_improved\":[],\"what_regressed\":[],\"transferable_insight\":\"Introducing complex, multi-part constraints that attempt to balance strict restrictions with nuanced exceptions often degrades system performance.\",\"domain_tags\":[\"Prompt Engineering\",\"Constraint Management\",\"Instruction Tuning\"]}", "cost_usd": 0.0124493, "bootstrap_seed": 0, "agent_model": "gemini-3.1-pro-preview", "held_out_score": null, "criterion_names": ["key_points_captured", "conciseness", "faithful_to_source", "few_shot_format"], "per_criterion_scores": {"key_points_captured": 1.0, "conciseness": 1.0, "faithful_to_source": 0.9, "few_shot_format": 0.4}, "failure_classification": {"category": "semantic_drift", "description": "The experiment aimed to make instructions more restrictive against external facts and clean up hallucinations in examples. The low score indicates that the model's output likely still incorporated external knowledge or hallucinated terms, meaning its content drifted from the intended, constrained semantic scope despite the instructional changes.", "fix_direction": "Further refine instructional language to be unequivocally explicit in forbidding the use of external information and fabrication. Provide clear negative constraints (e.g., 'DO NOT mention X', 'Only use information present in the prompt'). Review the cleaned examples again to ensure they do not subtly encourage hallucination or reliance on external facts, and potentially add examples demonstrating the desired restrictive behavior.", "confidence": 0.9}, "drafts_generated": 1, "drafts_survived": 1}
{"id": "3b79e868-124f-41df-a714-4fdba018eca0", "target_id": "B2-control", "git_sha": "1b76bb74cef7d63eef3f7f58a9c6877fd39b41a1", "pre_experiment_sha": "1b76bb74cef7d63eef3f7f58a9c6877fd39b41a1", "timestamp": "2026-04-24T04:05:52.733366+00:00", "hypothesis": "Add a direct instruction to rely strictly on the provided text and remove a minor external hallucination (\"OpenAI API\") from the examples to prevent hallucination without over-scrutinizing acronyms.", "hypothesis_source": "agent", "mutation_diff_summary": "", "score": 2.9, "score_ci_lower": 2.3, "score_ci_upper": 3.6, "raw_scores": [2.0, 2.5, 4.0, 2.5, 3.5], "baseline_score": 3.4, "outcome": "DISCARDED", "failure_mode": null, "duration_seconds": 64.37586562498473, "tags": ["prompt-engineering", "hallucination-reduction"], "learnings": "{\"what_changed\":\"\",\"what_improved\":[],\"what_regressed\":[],\"transferable_insight\":\"Imposing strict constraints to rely solely on provided context to prevent hallucinations can degrade performance, likely by making the model overly conservative and hindering its ability to process implicit information.\",\"domain_tags\":[\"Prompt Engineering\",\"Hallucination Mitigation\",\"Constraint Tuning\"]}", "cost_usd": 0.011881200000000001, "bootstrap_seed": 0, "agent_model": "gemini-3.1-pro-preview", "held_out_score": null, "criterion_names": ["key_points_captured", "conciseness", "faithful_to_source", "few_shot_format"], "per_criterion_scores": {"key_points_captured": 1.0, "conciseness": 1.0, "faithful_to_source": 0.6, "few_shot_format": 0.3}, "failure_classification": {"category": "semantic_drift", "description": "The experiment aimed to prevent hallucination by adding a direct instruction for strict text reliance and removing specific hallucinatory examples. However, the low score of 2.9 indicates a failure to prevent outputs with incorrect meanings (hallucinations persisted or new forms emerged). The instruction might have been ineffective, misinterpreted, or led to unintended side effects, such as over-constraining the model or misidentifying valid inferences, thus causing a drift from the desired accurate meaning.", "fix_direction": "Analyze the specific types of semantic errors in the failed outputs to understand *how* hallucination is still occurring or why the new instruction is problematic. Refine the 'rely strictly' instruction to ensure it promotes grounding without stifling necessary inference or becoming overly restrictive (e.g., regarding common acronyms). Experiment with alternative grounding mechanisms, more targeted negative examples, or a softer approach to 'strict reliance' that balances accuracy with utility.", "confidence": 0.9}, "drafts_generated": 1, "drafts_survived": 1}
{"id": "759e05b5-66ba-4f0e-adbc-8605910d378e", "target_id": "B2-control", "git_sha": "1b76bb74cef7d63eef3f7f58a9c6877fd39b41a1", "pre_experiment_sha": "1b76bb74cef7d63eef3f7f58a9c6877fd39b41a1", "timestamp": "2026-04-24T04:07:41.171065+00:00", "hypothesis": "Adding a direct instruction to strictly rely on the provided text and removing the external information \"OpenAI API\" from the first few-shot example will improve the binary criteria score by reducing hallucinations without causing semantic drift.", "hypothesis_source": "agent", "mutation_diff_summary": "", "score": 2.8, "score_ci_lower": 2.0, "score_ci_upper": 3.6, "raw_scores": [2.0, 4.0, 2.0, 4.0, 2.0], "baseline_score": 3.4, "outcome": "DISCARDED", "failure_mode": null, "duration_seconds": 85.61896912497468, "tags": ["prompt-engineering", "few-shot-examples", "hallucination-reduction"], "learnings": "{\"what_changed\":\"\",\"what_improved\":[],\"what_regressed\":[],\"transferable_insight\":\"Overly constraining a model with strict adherence instructions and stripping external context from few-shot examples can significantly degrade performance rather than reducing hallucinations.\",\"domain_tags\":[\"Prompt Engineering\",\"Few-Shot Prompting\",\"Hallucination Mitigation\"]}", "cost_usd": 0.01199245, "bootstrap_seed": 0, "agent_model": "gemini-3.1-pro-preview", "held_out_score": null, "criterion_names": ["key_points_captured", "conciseness", "faithful_to_source", "few_shot_format"], "per_criterion_scores": {"key_points_captured": 1.0, "conciseness": 1.0, "faithful_to_source": 0.4, "few_shot_format": 0.4}, "failure_classification": {"category": "semantic_drift", "description": "The experiment aimed to reduce hallucinations (a form of semantic error) without causing semantic drift. The low score of 2.8000 suggests that either the hallucinations were not effectively reduced, or new semantic inaccuracies were introduced, leading to a divergence from the intended meaning of the output. This fulfills the explicit condition in the hypothesis to avoid semantic drift.", "fix_direction": "Analyze the nature of the semantic errors contributing to the low score. Determine if the direct instruction was misinterpreted, leading to overly literal but incorrect interpretations, or if removing 'OpenAI API' from the few-shot example had unintended semantic consequences for other parts of the output. Consider refining the instruction wording for clarity and nuance, or re-evaluating the impact of the few-shot example change on the model's understanding of the task's semantic boundaries.", "confidence": 0.9}, "drafts_generated": 1, "drafts_survived": 1}
