{"id": "4d395326-dcf1-46f4-aed7-db7b60461a6f", "target_id": "B2-control", "git_sha": "4a45d2bb2dc1733f8364c1d2df1f85e142fbf641", "pre_experiment_sha": "4a45d2bb2dc1733f8364c1d2df1f85e142fbf641", "timestamp": "2026-04-19T17:45:23.543064+00:00", "hypothesis": "A single fixed two-sentence template with strict no-invention and compression rules will improve consistency and faithfulness.", "hypothesis_source": "agent", "mutation_diff_summary": "", "score": 2.2, "score_ci_lower": 1.6, "score_ci_upper": 2.9, "raw_scores": [2.5, 1.5, 1.5, 2.0, 3.5], "baseline_score": 2.3, "outcome": "DISCARDED", "failure_mode": null, "duration_seconds": 14.666656624991447, "tags": ["format-lock", "faithfulness", "compression", "summarization"], "learnings": "{\"what_changed\":\"\",\"what_improved\":[],\"what_regressed\":[],\"transferable_insight\":\"Rigidly standardizing output format can reduce variability, but if the template is too restrictive it may suppress useful content and fail to improve overall quality.\",\"domain_tags\":[\"process-design\",\"quality-control\",\"prompting\"]}", "cost_usd": 0.014600950000000001, "bootstrap_seed": 0, "agent_model": "gpt-5.4", "held_out_score": null, "criterion_names": ["key_points_captured", "conciseness", "faithful_to_source", "few_shot_format"], "per_criterion_scores": {"key_points_captured": 1.0, "conciseness": 0.3, "faithful_to_source": 0.5, "few_shot_format": 0.4}, "failure_classification": {"category": "incomplete_edit", "description": "The experiment appears to be an unfinished or partially applied change: it failed without clear evidence of a full, consistent application of the intended two-sentence template and compression rules, leaving the output in an inconsistent state relative to the required constraints.", "fix_direction": "Ensure the template is applied end-to-end to every instance with strict adherence to the no-invention/compression rules; validate outputs against a schema/format check before scoring.", "confidence": 0.46}, "drafts_generated": 1, "drafts_survived": 1}
{"id": "330297b1-22e3-4f52-93ee-cb6f36ae73aa", "target_id": "B2-control", "git_sha": "8eac82a614bc33c7b2c2f3aa7ef90548078dd844", "pre_experiment_sha": "4a45d2bb2dc1733f8364c1d2df1f85e142fbf641", "timestamp": "2026-04-19T17:45:43.118200+00:00", "hypothesis": "A single fixed two-sentence template with stricter faithfulness and compression rules will improve consistency and binary criteria adherence.", "hypothesis_source": "agent", "mutation_diff_summary": "", "score": 2.0, "score_ci_lower": 1.4, "score_ci_upper": 2.8, "raw_scores": [1.0, 2.0, 1.5, 2.0, 3.5], "baseline_score": 2.3, "outcome": "KEPT", "failure_mode": null, "duration_seconds": 17.008770124986768, "tags": ["format-lock", "faithfulness", "compression", "simplicity"], "learnings": "{\"what_changed\":\"\",\"what_improved\":[],\"what_regressed\":[],\"transferable_insight\":\"Tightening a prompt with fixed structure and explicit constraints can improve consistency and rule adherence even when it does not produce measurable gains in other quality dimensions.\",\"domain_tags\":[\"prompt-engineering\",\"evaluation\",\"process-design\"]}", "cost_usd": 0.02346855, "bootstrap_seed": 0, "agent_model": "gpt-5.4", "held_out_score": null, "criterion_names": ["key_points_captured", "conciseness", "faithful_to_source", "few_shot_format"], "per_criterion_scores": {"key_points_captured": 0.8, "conciseness": 0.6, "faithful_to_source": 0.4, "few_shot_format": 0.2}, "failure_classification": null, "drafts_generated": 1, "drafts_survived": 1}
{"id": "7be82bff-65f1-41e5-a30e-21571eefd070", "target_id": "B2-control", "git_sha": "8c4349c80f74f63658be470fc228aa9f7c3580d1", "pre_experiment_sha": "8eac82a614bc33c7b2c2f3aa7ef90548078dd844", "timestamp": "2026-04-19T17:46:06.791565+00:00", "hypothesis": "A stricter single two-sentence template with tighter faithfulness and compression rules will improve consistency and scoring.", "hypothesis_source": "agent", "mutation_diff_summary": "", "score": 1.5, "score_ci_lower": 1.2, "score_ci_upper": 1.8, "raw_scores": [1.0, 1.5, 2.0, 1.5, 1.5], "baseline_score": 2.0, "outcome": "KEPT", "failure_mode": null, "duration_seconds": 19.414694875013083, "tags": ["format-locking", "faithfulness", "compression", "summarization"], "learnings": "{\"what_changed\":\"\",\"what_improved\":[],\"what_regressed\":[],\"transferable_insight\":\"Tightening output constraints can improve consistency, but if the constraints are too restrictive they may reduce overall quality even when no specific sub-aspects visibly change.\",\"domain_tags\":[\"prompt-engineering\",\"evaluation\",\"optimization\"]}", "cost_usd": 0.02534015, "bootstrap_seed": 0, "agent_model": "gpt-5.4", "held_out_score": null, "criterion_names": ["key_points_captured", "conciseness", "faithful_to_source", "few_shot_format"], "per_criterion_scores": {"key_points_captured": 1.0, "conciseness": 0.2, "faithful_to_source": 0.3, "few_shot_format": 0.0}, "failure_classification": null, "drafts_generated": 1, "drafts_survived": 1}
{"id": "17c8cfb7-f95e-4b51-a4e9-7f4f02856f5c", "target_id": "B2-control", "git_sha": "807b9f56afc83d35850a3164a4a2d169cc9b872f", "pre_experiment_sha": "8c4349c80f74f63658be470fc228aa9f7c3580d1", "timestamp": "2026-04-19T17:46:28.687613+00:00", "hypothesis": "A stricter single-template prompt with concise faithfulness rules will improve summary consistency and binary criteria compliance.", "hypothesis_source": "agent", "mutation_diff_summary": "", "score": 1.5, "score_ci_lower": 1.1, "score_ci_upper": 1.9, "raw_scores": [1.0, 2.0, 1.5, 2.0, 1.0], "baseline_score": 1.5, "outcome": "KEPT", "failure_mode": null, "duration_seconds": 20.200146208982915, "tags": ["format-lock", "faithfulness", "compression", "summarization"], "learnings": "{\"what_changed\":\"\",\"what_improved\":[],\"what_regressed\":[],\"transferable_insight\":\"When a change produces no measurable improvement or regression, the most transferable lesson is that added structure alone may be insufficient to shift outcomes without addressing the underlying task signal or evaluation sensitivity.\",\"domain_tags\":[\"prompt-design\",\"evaluation\",\"experimental-methods\"]}", "cost_usd": 0.02341335, "bootstrap_seed": 0, "agent_model": "gpt-5.4", "held_out_score": null, "criterion_names": ["key_points_captured", "conciseness", "faithful_to_source", "few_shot_format"], "per_criterion_scores": {"key_points_captured": 0.8, "conciseness": 0.7, "faithful_to_source": 0.0, "few_shot_format": 0.0}, "failure_classification": null, "drafts_generated": 1, "drafts_survived": 1}
{"id": "3e10f14a-ddef-420f-ad62-5fe01080b899", "target_id": "B2-control", "git_sha": "5aed3c219a3d1738689d6a776cc30eeedab5bc22", "pre_experiment_sha": "807b9f56afc83d35850a3164a4a2d169cc9b872f", "timestamp": "2026-04-19T17:46:50.116679+00:00", "hypothesis": "Tightening to one fixed two-sentence template with stricter faithfulness and compression rules will improve consistency and binary criteria performance.", "hypothesis_source": "agent", "mutation_diff_summary": "", "score": 2.7, "score_ci_lower": 2.1, "score_ci_upper": 3.4, "raw_scores": [2.0, 3.0, 2.0, 4.0, 2.5], "baseline_score": 1.5, "outcome": "KEPT", "failure_mode": null, "duration_seconds": 19.66102349990979, "tags": ["format-locking", "faithfulness", "compression", "summarization"], "learnings": "{\"what_changed\":\"\",\"what_improved\":[],\"what_regressed\":[],\"transferable_insight\":\"Constraining outputs to a fixed, compact template with explicit fidelity rules can improve consistency and make binary evaluation easier to satisfy.\",\"domain_tags\":[\"prompting\",\"evaluation\",\"consistency\"]}", "cost_usd": 0.027121150000000004, "bootstrap_seed": 0, "agent_model": "gpt-5.4", "held_out_score": null, "criterion_names": ["key_points_captured", "conciseness", "faithful_to_source", "few_shot_format"], "per_criterion_scores": {"key_points_captured": 0.9, "conciseness": 0.6, "faithful_to_source": 0.9, "few_shot_format": 0.3}, "failure_classification": null, "drafts_generated": 1, "drafts_survived": 1}
{"id": "4a8f99fe-2b6a-4ef3-ac6b-ac00ebdfbd46", "target_id": "B2-control", "git_sha": "5aed3c219a3d1738689d6a776cc30eeedab5bc22", "pre_experiment_sha": "5aed3c219a3d1738689d6a776cc30eeedab5bc22", "timestamp": "2026-04-19T17:47:06.945643+00:00", "hypothesis": "Replacing the few-shot examples with a stricter two-sentence contract will improve format consistency and faithfulness.", "hypothesis_source": "agent", "mutation_diff_summary": "", "score": 1.6, "score_ci_lower": 1.3, "score_ci_upper": 1.9, "raw_scores": [1.5, 1.0, 2.0, 1.5, 2.0], "baseline_score": 2.7, "outcome": "DISCARDED", "failure_mode": null, "duration_seconds": 13.99457900004927, "tags": ["format-lock", "faithfulness", "compression", "remove-fewshot"], "learnings": "{\"what_changed\":\"\",\"what_improved\":[],\"what_regressed\":[],\"transferable_insight\":\"When a prompt change is discarded with no observed gains or regressions, it suggests the new constraint was too weak or misaligned to affect behavior meaningfully, so stronger or more targeted guidance is needed.\",\"domain_tags\":[\"prompt-engineering\",\"evaluation\",\"experimentation\"]}", "cost_usd": 0.01500595, "bootstrap_seed": 0, "agent_model": "gpt-5.4", "held_out_score": null, "criterion_names": ["key_points_captured", "conciseness", "faithful_to_source", "few_shot_format"], "per_criterion_scores": {"key_points_captured": 1.0, "conciseness": 0.2, "faithful_to_source": 0.4, "few_shot_format": 0.0}, "failure_classification": {"category": "output_format", "description": "The change to a stricter two-sentence contract did not achieve the intended format consistency; the resulting output appears to violate the expected structure/schema, leading to a low score.", "fix_direction": "Focus on making the contract enforceable for the model (e.g., explicit field-by-field formatting requirements, consistent ordering, and stronger template examples) and validate outputs against the schema before scoring.", "confidence": 0.62}, "drafts_generated": 1, "drafts_survived": 1}
{"id": "0fdfc96c-e78f-4abb-a056-80da0d415407", "target_id": "B2-control", "git_sha": "66c7613532ac4b9b5c9ad816c32745c0f626dd14", "pre_experiment_sha": "5aed3c219a3d1738689d6a776cc30eeedab5bc22", "timestamp": "2026-04-19T17:47:22.596721+00:00", "hypothesis": "Replace the few-shot-heavy prompt with a single fixed two-sentence contract and stricter faithfulness/compression rules.", "hypothesis_source": "agent", "mutation_diff_summary": "", "score": 1.7, "score_ci_lower": 1.3, "score_ci_upper": 2.2, "raw_scores": [1.5, 1.5, 2.5, 2.0, 1.0], "baseline_score": 2.7, "outcome": "KEPT", "failure_mode": null, "duration_seconds": 13.079564542043954, "tags": ["format-tightening", "faithfulness", "compression", "remove-fewshot"], "learnings": "{\"what_changed\":\"\",\"what_improved\":[],\"what_regressed\":[],\"transferable_insight\":\"When a task is already well-specified, replacing verbose examples with a concise fixed contract and tighter constraints can preserve behavior while reducing prompt complexity.\",\"domain_tags\":[\"prompt-engineering\",\"optimization\",\"instruction-design\"]}", "cost_usd": 0.013565550000000001, "bootstrap_seed": 0, "agent_model": "gpt-5.4", "held_out_score": null, "criterion_names": ["key_points_captured", "conciseness", "faithful_to_source", "few_shot_format"], "per_criterion_scores": {"key_points_captured": 0.8, "conciseness": 0.7, "faithful_to_source": 0.1, "few_shot_format": 0.1}, "failure_classification": null, "drafts_generated": 1, "drafts_survived": 1}
{"id": "076d5683-8916-49cd-83fa-9002635131ec", "target_id": "B2-control", "git_sha": "7b0c56d139b52811e9c32444e66557b48e3d30c3", "pre_experiment_sha": "66c7613532ac4b9b5c9ad816c32745c0f626dd14", "timestamp": "2026-04-19T17:47:38.133110+00:00", "hypothesis": "A stricter two-sentence template with a single fixed pattern and tighter faithfulness/compression rules will improve consistent scoring.", "hypothesis_source": "agent", "mutation_diff_summary": "", "score": 2.5, "score_ci_lower": 1.8975000000000222, "score_ci_upper": 3.3, "raw_scores": [1.5, 2.5, 4.0, 2.5, 2.0], "baseline_score": 1.7, "outcome": "KEPT", "failure_mode": null, "duration_seconds": 14.28684895799961, "tags": ["format-lock", "two-sentence", "faithfulness", "compression"], "learnings": "{\"what_changed\":\"\",\"what_improved\":[],\"what_regressed\":[],\"transferable_insight\":\"Constraining outputs to a single fixed structure with explicit fidelity and brevity rules can improve consistency in evaluation outcomes.\",\"domain_tags\":[\"evaluation\",\"prompt-design\",\"consistency\"]}", "cost_usd": 0.011732550000000001, "bootstrap_seed": 0, "agent_model": "gpt-5.4", "held_out_score": null, "criterion_names": ["key_points_captured", "conciseness", "faithful_to_source", "few_shot_format"], "per_criterion_scores": {"key_points_captured": 1.0, "conciseness": 0.6, "faithful_to_source": 0.5, "few_shot_format": 0.4}, "failure_classification": null, "drafts_generated": 1, "drafts_survived": 1}
{"id": "fca3e768-eab5-4a0a-bd7c-589f3ad9b271", "target_id": "B2-control", "git_sha": "e0d942b26461f30cdf9ad86467539c3c02ccea63", "pre_experiment_sha": "7b0c56d139b52811e9c32444e66557b48e3d30c3", "timestamp": "2026-04-19T17:47:56.841227+00:00", "hypothesis": "A stricter single two-sentence template with explicit faithfulness and no-extras rules will improve consistency and binary criteria compliance.", "hypothesis_source": "agent", "mutation_diff_summary": "", "score": 1.4, "score_ci_lower": 1.0, "score_ci_upper": 2.0, "raw_scores": [1.0, 1.0, 1.0, 1.5, 2.5], "baseline_score": 2.5, "outcome": "KEPT", "failure_mode": null, "duration_seconds": 15.800441749976017, "tags": ["format-lock", "two-sentence", "faithfulness", "compression"], "learnings": "{\"what_changed\":\"\",\"what_improved\":[],\"what_regressed\":[],\"transferable_insight\":\"Tightening output instructions into a single explicit template with clear inclusion and exclusion rules can improve consistency even when no specific quality gains are observed.\",\"domain_tags\":[\"prompt-design\",\"instruction-following\",\"evaluation\"]}", "cost_usd": 0.01204635, "bootstrap_seed": 0, "agent_model": "gpt-5.4", "held_out_score": null, "criterion_names": ["key_points_captured", "conciseness", "faithful_to_source", "few_shot_format"], "per_criterion_scores": {"key_points_captured": 0.8, "conciseness": 0.4, "faithful_to_source": 0.2, "few_shot_format": 0.0}, "failure_classification": null, "drafts_generated": 1, "drafts_survived": 1}
{"id": "0ad8f3ff-57a6-4720-91bc-bb75d1cee42b", "target_id": "B2-control", "git_sha": "8de297768537c7583a0947f84b3d35ec19a1acde", "pre_experiment_sha": "e0d942b26461f30cdf9ad86467539c3c02ccea63", "timestamp": "2026-04-19T17:48:13.831340+00:00", "hypothesis": "A stricter single two-sentence template with tighter length and faithfulness constraints will improve consistency and reduce drift.", "hypothesis_source": "agent", "mutation_diff_summary": "", "score": 1.3, "score_ci_lower": 1.0, "score_ci_upper": 1.7, "raw_scores": [2.0, 1.0, 1.0, 1.5, 1.0], "baseline_score": 1.4, "outcome": "KEPT", "failure_mode": null, "duration_seconds": 15.428789207944646, "tags": ["fixed-format", "two-sentence", "faithfulness", "compression"], "learnings": "{\"what_changed\":\"\",\"what_improved\":[],\"what_regressed\":[],\"transferable_insight\":\"Tighter structural and fidelity constraints can improve consistency even when they do not produce an immediate measurable score gain.\",\"domain_tags\":[\"prompt-design\",\"quality-control\",\"evaluation\"]}", "cost_usd": 0.012402350000000001, "bootstrap_seed": 0, "agent_model": "gpt-5.4", "held_out_score": null, "criterion_names": ["key_points_captured", "conciseness", "faithful_to_source", "few_shot_format"], "per_criterion_scores": {"key_points_captured": 0.9, "conciseness": 0.2, "faithful_to_source": 0.2, "few_shot_format": 0.0}, "failure_classification": null, "drafts_generated": 1, "drafts_survived": 1}
{"id": "dc71783f-f9e2-463b-bb72-b3aec0a8d4ea", "target_id": "B2-control", "git_sha": "0693eded48d8fec8b6c0cbf8160b4dd00a1bd22d", "pre_experiment_sha": "8de297768537c7583a0947f84b3d35ec19a1acde", "timestamp": "2026-04-19T17:48:33.972415+00:00", "hypothesis": "A stricter two-sentence template with explicit sentence roles and tighter brevity/faithfulness rules will improve consistency and binary criteria adherence.", "hypothesis_source": "agent", "mutation_diff_summary": "", "score": 2.0, "score_ci_lower": 1.6, "score_ci_upper": 2.4, "raw_scores": [1.5, 2.5, 2.0, 1.5, 2.5], "baseline_score": 1.3, "outcome": "KEPT", "failure_mode": null, "duration_seconds": 19.033237750059925, "tags": ["format-tightening", "faithfulness", "compression", "fixed-template"], "learnings": "{\"what_changed\":\"\",\"what_improved\":[],\"what_regressed\":[],\"transferable_insight\":\"Clear role-based structure combined with tighter constraints on length and fidelity tends to improve consistency and rule adherence in outputs.\",\"domain_tags\":[\"prompt-design\",\"instruction-following\",\"quality-control\"]}", "cost_usd": 0.01240755, "bootstrap_seed": 0, "agent_model": "gpt-5.4", "held_out_score": null, "criterion_names": ["key_points_captured", "conciseness", "faithful_to_source", "few_shot_format"], "per_criterion_scores": {"key_points_captured": 1.0, "conciseness": 0.5, "faithful_to_source": 0.4, "few_shot_format": 0.1}, "failure_classification": null, "drafts_generated": 1, "drafts_survived": 1}
{"id": "d40cb7d7-8b0d-40dd-a850-ece3307d8020", "target_id": "B2-control", "git_sha": "9be508abf955589d4767c5144521e5b103cec3cb", "pre_experiment_sha": "0693eded48d8fec8b6c0cbf8160b4dd00a1bd22d", "timestamp": "2026-04-19T17:48:52.054502+00:00", "hypothesis": "A stricter two-sentence template with fixed roles and tighter faithfulness/compression rules will improve consistency and binary scoring.", "hypothesis_source": "agent", "mutation_diff_summary": "", "score": 2.0, "score_ci_lower": 1.6, "score_ci_upper": 2.5, "raw_scores": [2.0, 1.5, 3.0, 2.0, 1.5], "baseline_score": 2.0, "outcome": "KEPT", "failure_mode": null, "duration_seconds": 14.082509416970424, "tags": ["template", "faithfulness", "compression", "two-sentence", "format-stability"], "learnings": "{\"what_changed\":\"\",\"what_improved\":[],\"what_regressed\":[],\"transferable_insight\":\"When a task already performs at ceiling, tightening structure and constraints may preserve consistency without producing measurable gains, so evaluate whether the intervention addresses a real bottleneck before adopting it.\",\"domain_tags\":[\"evaluation\",\"prompt-design\",\"optimization\"]}", "cost_usd": 0.012322950000000003, "bootstrap_seed": 0, "agent_model": "gpt-5.4", "held_out_score": null, "criterion_names": ["key_points_captured", "conciseness", "faithful_to_source", "few_shot_format"], "per_criterion_scores": {"key_points_captured": 0.9, "conciseness": 0.6, "faithful_to_source": 0.3, "few_shot_format": 0.2}, "failure_classification": null, "drafts_generated": 1, "drafts_survived": 1}
{"id": "9cb6b664-e92a-498f-8c59-1493cd3e3b0c", "target_id": "B2-control", "git_sha": "9a70d878cfde387a9361f0e78195d4bc7880c924", "pre_experiment_sha": "9be508abf955589d4767c5144521e5b103cec3cb", "timestamp": "2026-04-19T17:49:08.930231+00:00", "hypothesis": "Tightening the prompt to one rigid two-sentence contract with stricter faithfulness and compression rules will improve consistency and binary scoring.", "hypothesis_source": "agent", "mutation_diff_summary": "", "score": 1.9, "score_ci_lower": 1.4, "score_ci_upper": 2.3, "raw_scores": [2.0, 1.0, 2.0, 2.0, 2.5], "baseline_score": 2.0, "outcome": "KEPT", "failure_mode": null, "duration_seconds": 15.579693499952555, "tags": ["two-sentence-template", "strict-format", "faithfulness", "compression"], "learnings": "{\"what_changed\":\"\",\"what_improved\":[],\"what_regressed\":[],\"transferable_insight\":\"Making an instruction more rigid and compressed can improve consistency only when the task benefits from reduced ambiguity, but it may also fail to change outcomes if the underlying behavior is already stable.\",\"domain_tags\":[\"prompt-design\",\"evaluation\",\"optimization\"]}", "cost_usd": 0.013347150000000002, "bootstrap_seed": 0, "agent_model": "gpt-5.4", "held_out_score": null, "criterion_names": ["key_points_captured", "conciseness", "faithful_to_source", "few_shot_format"], "per_criterion_scores": {"key_points_captured": 0.9, "conciseness": 0.5, "faithful_to_source": 0.3, "few_shot_format": 0.2}, "failure_classification": null, "drafts_generated": 1, "drafts_survived": 1}
