{"id": "b3c01598-0dca-4b3d-a5ff-443f4ff29cb5", "target_id": "B2-control", "git_sha": "c42180d0f5ffaecf0bb745d7995ab0d788a069c0", "pre_experiment_sha": "9a70d878cfde387a9361f0e78195d4bc7880c924", "timestamp": "2026-04-19T17:49:24.793065+00:00", "hypothesis": "A stricter single two-sentence template with fixed roles and tighter compression/faithfulness rules will improve consistency and scoring.", "hypothesis_source": "agent", "mutation_diff_summary": "", "score": 1.8, "score_ci_lower": 1.5, "score_ci_upper": 2.2, "raw_scores": [1.5, 1.5, 2.5, 2.0, 1.5], "baseline_score": 1.9, "outcome": "KEPT", "failure_mode": null, "duration_seconds": 14.24245116696693, "tags": ["format-contract", "two-sentence", "faithfulness", "compression"], "learnings": "{\"what_changed\":\"\",\"what_improved\":[],\"what_regressed\":[],\"transferable_insight\":\"Tightening format constraints can improve consistency only when the added structure does not reduce the model\u2019s ability to preserve meaning under compression.\",\"domain_tags\":[\"prompt-engineering\",\"evaluation\",\"information-compression\"]}", "cost_usd": 0.01346135, "bootstrap_seed": 0, "agent_model": "gpt-5.4", "held_out_score": null, "criterion_names": ["key_points_captured", "conciseness", "faithful_to_source", "few_shot_format"], "per_criterion_scores": {"key_points_captured": 1.0, "conciseness": 0.4, "faithful_to_source": 0.3, "few_shot_format": 0.1}, "failure_classification": null, "drafts_generated": 1, "drafts_survived": 1}
{"id": "80a947b0-85ea-412f-9cfb-2d80ac31b62c", "target_id": "B2-control", "git_sha": "4c60e733c2ab557779ae0165e74f0dbf5f518d43", "pre_experiment_sha": "c42180d0f5ffaecf0bb745d7995ab0d788a069c0", "timestamp": "2026-04-19T17:49:45.149612+00:00", "hypothesis": "A more rigid two-sentence fill-in pattern with tighter compression and faithfulness rules will improve format adherence and summary precision.", "hypothesis_source": "agent", "mutation_diff_summary": "", "score": 1.4, "score_ci_lower": 0.8, "score_ci_upper": 2.1, "raw_scores": [0.5, 2.0, 1.0, 2.5, 1.0], "baseline_score": 1.8, "outcome": "KEPT", "failure_mode": null, "duration_seconds": 16.73501900001429, "tags": ["format-locking", "two-sentence-template", "faithfulness", "compression"], "learnings": "{\"what_changed\":\"\",\"what_improved\":[],\"what_regressed\":[],\"transferable_insight\":\"Stricter structural constraints can improve consistency in output format even when they do not measurably improve content quality.\",\"domain_tags\":[\"prompt-design\",\"evaluation\",\"information-extraction\"]}", "cost_usd": 0.01451555, "bootstrap_seed": 0, "agent_model": "gpt-5.4", "held_out_score": null, "criterion_names": ["key_points_captured", "conciseness", "faithful_to_source", "few_shot_format"], "per_criterion_scores": {"key_points_captured": 0.5, "conciseness": 0.4, "faithful_to_source": 0.4, "few_shot_format": 0.1}, "failure_classification": null, "drafts_generated": 1, "drafts_survived": 1}
{"id": "15d93d4b-d511-4abb-b3a5-8294f0794588", "target_id": "B2-control", "git_sha": "a4994b60cad5f84cdbf692598f7d8e178d9c2c06", "pre_experiment_sha": "4c60e733c2ab557779ae0165e74f0dbf5f518d43", "timestamp": "2026-04-19T17:50:03.646851+00:00", "hypothesis": "A stricter fixed two-sentence pattern with tighter compression and faithfulness constraints will improve binary criteria adherence.", "hypothesis_source": "agent", "mutation_diff_summary": "", "score": 1.4, "score_ci_lower": 0.9, "score_ci_upper": 1.9, "raw_scores": [1.0, 1.5, 0.5, 2.0, 2.0], "baseline_score": 1.4, "outcome": "KEPT", "failure_mode": null, "duration_seconds": 17.224870042060502, "tags": ["two-sentence-template", "rigid-format", "faithfulness", "compression"], "learnings": "{\"what_changed\":\"\",\"what_improved\":[],\"what_regressed\":[],\"transferable_insight\":\"When a task already meets its target, adding stricter formatting and compression constraints may not produce measurable gains unless it changes the underlying decision process.\",\"domain_tags\":[\"optimization\",\"evaluation\",\"prompting\"]}", "cost_usd": 0.014310550000000002, "bootstrap_seed": 0, "agent_model": "gpt-5.4", "held_out_score": null, "criterion_names": ["key_points_captured", "conciseness", "faithful_to_source", "few_shot_format"], "per_criterion_scores": {"key_points_captured": 0.8, "conciseness": 0.3, "faithful_to_source": 0.1, "few_shot_format": 0.2}, "failure_classification": null, "drafts_generated": 1, "drafts_survived": 1}
{"id": "2fda8adf-625c-41c6-9556-3c3f4cf9b2cd", "target_id": "B2-control", "git_sha": "34eb38e4c43698d5b32baef897ffc6cf345b2b5f", "pre_experiment_sha": "a4994b60cad5f84cdbf692598f7d8e178d9c2c06", "timestamp": "2026-04-19T17:50:30.299622+00:00", "hypothesis": "A stricter two-sentence contract with explicit sentence roles and tighter length/faithfulness constraints will improve consistency and binary criteria adherence.", "hypothesis_source": "agent", "mutation_diff_summary": "", "score": 1.9, "score_ci_lower": 1.4, "score_ci_upper": 2.5, "raw_scores": [2.0, 1.0, 3.0, 1.5, 2.0], "baseline_score": 1.4, "outcome": "KEPT", "failure_mode": null, "duration_seconds": 25.372773041948676, "tags": ["two-sentence-template", "rigid-format", "faithfulness", "compression"], "learnings": "{\"what_changed\":\"\",\"what_improved\":[],\"what_regressed\":[],\"transferable_insight\":\"Making output structure explicit and constraining each part\u2019s role, length, and fidelity can improve consistency with binary evaluation criteria.\",\"domain_tags\":[\"prompt-engineering\",\"evaluation\",\"instruction-following\"]}", "cost_usd": 0.013400350000000002, "bootstrap_seed": 0, "agent_model": "gpt-5.4", "held_out_score": null, "criterion_names": ["key_points_captured", "conciseness", "faithful_to_source", "few_shot_format"], "per_criterion_scores": {"key_points_captured": 1.0, "conciseness": 0.4, "faithful_to_source": 0.4, "few_shot_format": 0.1}, "failure_classification": null, "drafts_generated": 1, "drafts_survived": 1}
{"id": "cc142795-bb6a-46b3-8979-74f7583d7e2b", "target_id": "B2-control", "git_sha": "34eb38e4c43698d5b32baef897ffc6cf345b2b5f", "pre_experiment_sha": "34eb38e4c43698d5b32baef897ffc6cf345b2b5f", "timestamp": "2026-04-19T17:50:49.031780+00:00", "hypothesis": "A stricter single two-sentence contract with tighter faithfulness and compression rules will improve consistency and binary criteria scoring.", "hypothesis_source": "agent", "mutation_diff_summary": "", "score": 1.4, "score_ci_lower": 1.1, "score_ci_upper": 1.7, "raw_scores": [2.0, 1.5, 1.0, 1.5, 1.0], "baseline_score": 1.9, "outcome": "DISCARDED", "failure_mode": null, "duration_seconds": 15.31688691698946, "tags": ["summarization", "format-control", "faithfulness", "compression"], "learnings": "{\"what_changed\":\"\",\"what_improved\":[],\"what_regressed\":[],\"transferable_insight\":\"Tightening a protocol can reduce variability only if the added constraints preserve enough flexibility to satisfy the underlying task requirements.\",\"domain_tags\":[\"process-design\",\"quality-control\",\"evaluation\"]}", "cost_usd": 0.01491715, "bootstrap_seed": 0, "agent_model": "gpt-5.4", "held_out_score": null, "criterion_names": ["key_points_captured", "conciseness", "faithful_to_source", "few_shot_format"], "per_criterion_scores": {"key_points_captured": 0.7, "conciseness": 0.4, "faithful_to_source": 0.3, "few_shot_format": 0.0}, "failure_classification": {"category": "semantic_drift", "description": "The change appears to have produced an output that still followed the general form but did not satisfy the intended meaning/criteria consistently, leading to a low overall score (1.4000). No explicit structural/parsing or rules violation is indicated, suggesting the model complied with the request shape while failing the intended faithfulness/compression goals.", "fix_direction": "Tighten and validate the contract against the actual evaluation rubric by explicitly constraining what must be preserved vs. compressed; add consistency checks to ensure key factual/criterion-relevant content is not altered or omitted.", "confidence": 0.48}, "drafts_generated": 1, "drafts_survived": 1}
{"id": "b2af0626-ad09-4c4b-8c82-1588e9883000", "target_id": "B2-control", "git_sha": "34eb38e4c43698d5b32baef897ffc6cf345b2b5f", "pre_experiment_sha": "34eb38e4c43698d5b32baef897ffc6cf345b2b5f", "timestamp": "2026-04-19T17:51:07.332608+00:00", "hypothesis": "A stricter single two-sentence contract with explicit compression and faithfulness rules will improve consistency and binary criteria adherence.", "hypothesis_source": "agent", "mutation_diff_summary": "", "score": 1.6, "score_ci_lower": 1.3, "score_ci_upper": 1.9, "raw_scores": [1.0, 2.0, 1.5, 1.5, 2.0], "baseline_score": 1.9, "outcome": "DISCARDED", "failure_mode": null, "duration_seconds": 15.537152542034164, "tags": ["format-contract", "two-sentence", "faithfulness", "compression"], "learnings": "{\"what_changed\":\"\",\"what_improved\":[],\"what_regressed\":[],\"transferable_insight\":\"Adding stricter constraints only helps when they reduce ambiguity without overconstraining the task; otherwise, they may fail to improve consistency or adherence to binary criteria.\",\"domain_tags\":[\"prompt-design\",\"evaluation\",\"process-control\"]}", "cost_usd": 0.01346775, "bootstrap_seed": 0, "agent_model": "gpt-5.4", "held_out_score": null, "criterion_names": ["key_points_captured", "conciseness", "faithful_to_source", "few_shot_format"], "per_criterion_scores": {"key_points_captured": 0.9, "conciseness": 0.4, "faithful_to_source": 0.2, "few_shot_format": 0.1}, "failure_classification": {"category": "semantic_drift", "description": "The experiment appears to have failed despite a low score, and the most likely issue is that the output changed the meaning or failed to remain faithful to the intended two-sentence contract/compression rules, leading to inconsistent or incorrect binary criteria adherence.", "fix_direction": "Tighten and explicitly enforce faithfulness/compression constraints in the prompt (and/or add automated checks) to prevent meaning drift; verify that outputs remain strictly within two sentences and preserve required facts before evaluating criteria.", "confidence": 0.46}, "drafts_generated": 1, "drafts_survived": 1}
{"id": "b181aa4c-ce9e-4587-8dd1-fc488399909b", "target_id": "B2-control", "git_sha": "34eb38e4c43698d5b32baef897ffc6cf345b2b5f", "pre_experiment_sha": "34eb38e4c43698d5b32baef897ffc6cf345b2b5f", "timestamp": "2026-04-19T17:51:28.417425+00:00", "hypothesis": "A stricter fixed two-sentence contract with tighter compression and faithfulness rules will improve consistent binary criteria matching.", "hypothesis_source": "agent", "mutation_diff_summary": "", "score": 1.8, "score_ci_lower": 1.3, "score_ci_upper": 2.2, "raw_scores": [1.5, 1.0, 2.0, 2.0, 2.5], "baseline_score": 1.9, "outcome": "DISCARDED", "failure_mode": null, "duration_seconds": 18.44366333296057, "tags": ["format-contract", "two-sentence", "faithfulness", "compression"], "learnings": "{\"what_changed\":\"\",\"what_improved\":[],\"what_regressed\":[],\"transferable_insight\":\"Tightening format constraints can reduce flexibility without improving consistency when the task depends on faithful, criterion-specific judgment.\",\"domain_tags\":[\"evaluation\",\"prompting\",\"quality-control\"]}", "cost_usd": 0.012399950000000002, "bootstrap_seed": 0, "agent_model": "gpt-5.4", "held_out_score": null, "criterion_names": ["key_points_captured", "conciseness", "faithful_to_source", "few_shot_format"], "per_criterion_scores": {"key_points_captured": 1.0, "conciseness": 0.6, "faithful_to_source": 0.2, "few_shot_format": 0.0}, "failure_classification": {"category": "logic_error", "description": "The provided information includes an overall low score (1.8000) and an unspecified failure mode, but no details about what specifically went wrong (e.g., format/schema, reasoning, regressions, scope, syntax, semantic meaning, or partial/incomplete edits).", "fix_direction": "Collect or inspect the actual failure artifact/logs (format vs content vs parsing vs scoring) to identify whether the issue is schema/output structure, reasoning/criteria mismatch, evaluation gaming, scope violations, syntax/parsing errors, or incomplete edits.", "confidence": 0.18}, "drafts_generated": 1, "drafts_survived": 1}
{"id": "2d6d3d67-dd69-4aa8-adee-1c81d1cd1616", "target_id": "B2-control", "git_sha": "c8535bd066a6178efc199982b6a39c042d6fe4ab", "pre_experiment_sha": "34eb38e4c43698d5b32baef897ffc6cf345b2b5f", "timestamp": "2026-04-19T17:51:48.588247+00:00", "hypothesis": "Tightening the contract to one literal two-sentence pattern with stricter length and faithfulness rules will improve consistency and binary criteria adherence.", "hypothesis_source": "agent", "mutation_diff_summary": "", "score": 2.2, "score_ci_lower": 1.7, "score_ci_upper": 2.7, "raw_scores": [2.5, 1.5, 2.5, 1.5, 3.0], "baseline_score": 1.9, "outcome": "KEPT", "failure_mode": null, "duration_seconds": 15.307914625038393, "tags": ["summarization", "format-control", "faithfulness", "compression"], "learnings": "{\"what_changed\":\"\",\"what_improved\":[],\"what_regressed\":[],\"transferable_insight\":\"Reducing ambiguity by enforcing a single precise output pattern with explicit constraints tends to improve consistency and rule adherence.\",\"domain_tags\":[\"prompt-design\",\"quality-control\",\"instruction-following\"]}", "cost_usd": 0.01303435, "bootstrap_seed": 0, "agent_model": "gpt-5.4", "held_out_score": null, "criterion_names": ["key_points_captured", "conciseness", "faithful_to_source", "few_shot_format"], "per_criterion_scores": {"key_points_captured": 1.0, "conciseness": 0.4, "faithful_to_source": 0.6, "few_shot_format": 0.2}, "failure_classification": null, "drafts_generated": 1, "drafts_survived": 1}
{"id": "efc854cd-9e05-4fa4-984c-a9ba2aefd839", "target_id": "B2-control", "git_sha": "c8535bd066a6178efc199982b6a39c042d6fe4ab", "pre_experiment_sha": "c8535bd066a6178efc199982b6a39c042d6fe4ab", "timestamp": "2026-04-19T17:52:04.439038+00:00", "hypothesis": "A stricter, shorter two-sentence contract with an explicit fill-in template and tighter faithfulness rules will improve consistency.", "hypothesis_source": "agent", "mutation_diff_summary": "", "score": 2.0, "score_ci_lower": 1.6, "score_ci_upper": 2.5, "raw_scores": [1.5, 3.0, 1.5, 2.0, 2.0], "baseline_score": 2.2, "outcome": "DISCARDED", "failure_mode": null, "duration_seconds": 14.730207209009677, "tags": ["template", "format-control", "faithfulness", "compression"], "learnings": "{\"what_changed\":\"\",\"what_improved\":[],\"what_regressed\":[],\"transferable_insight\":\"Adding stricter constraints can reduce consistency when the task benefits from flexibility, so contract changes should be validated against actual performance rather than assumed to help.\",\"domain_tags\":[\"evaluation\",\"prompt-design\",\"process-control\"]}", "cost_usd": 0.014850750000000001, "bootstrap_seed": 0, "agent_model": "gpt-5.4", "held_out_score": null, "criterion_names": ["key_points_captured", "conciseness", "faithful_to_source", "few_shot_format"], "per_criterion_scores": {"key_points_captured": 1.0, "conciseness": 0.3, "faithful_to_source": 0.6, "few_shot_format": 0.1}, "failure_classification": {"category": "logic_error", "description": "Failure mode not specified; provided information (hypothesis, failure mode labeled unknown, score 2.0) is insufficient to infer the specific type of error among the listed categories.", "fix_direction": "Instrument and record the exact failure signal (e.g., format/schema errors, semantic mismatch, out-of-scope edits, parse/runtime issues, or regression vs prior runs) so the failure can be mapped to a concrete category; then adjust along the corresponding axis (format constraints, reasoning/logic checks, scope enforcement, or diff completeness).", "confidence": 0.05}, "drafts_generated": 1, "drafts_survived": 1}
{"id": "40d726b3-d486-49a0-b998-2d2a3ca100e8", "target_id": "B2-control", "git_sha": "be4ede90e453d4dcf1858b9634d6727d98f1987c", "pre_experiment_sha": "c8535bd066a6178efc199982b6a39c042d6fe4ab", "timestamp": "2026-04-19T17:52:25.758703+00:00", "hypothesis": "A more rigid two-sentence contract with explicit sentence roles and tighter faithfulness/compression wording will improve consistency.", "hypothesis_source": "agent", "mutation_diff_summary": "", "score": 1.7, "score_ci_lower": 1.5, "score_ci_upper": 2.1, "raw_scores": [1.5, 1.5, 1.5, 1.5, 2.5], "baseline_score": 2.2, "outcome": "KEPT", "failure_mode": null, "duration_seconds": 18.8415629590163, "tags": ["format-rigidity", "faithfulness", "compression", "two-sentence-template"], "learnings": "{\"what_changed\":\"\",\"what_improved\":[],\"what_regressed\":[],\"transferable_insight\":\"Clearer structural constraints and explicit role definitions can improve consistency even when they do not change the final outcome.\",\"domain_tags\":[\"prompt-design\",\"instruction-following\",\"evaluation\"]}", "cost_usd": 0.012757550000000001, "bootstrap_seed": 0, "agent_model": "gpt-5.4", "held_out_score": null, "criterion_names": ["key_points_captured", "conciseness", "faithful_to_source", "few_shot_format"], "per_criterion_scores": {"key_points_captured": 1.0, "conciseness": 0.5, "faithful_to_source": 0.2, "few_shot_format": 0.0}, "failure_classification": null, "drafts_generated": 1, "drafts_survived": 1}
{"id": "6c044fcc-e4b9-448e-b812-9630bdc9d48c", "target_id": "B2-control", "git_sha": "d5a57ab07db9bfe3d24ea459afe7286f86036e3c", "pre_experiment_sha": "be4ede90e453d4dcf1858b9634d6727d98f1987c", "timestamp": "2026-04-19T17:52:43.520609+00:00", "hypothesis": "A stricter literal two-sentence contract with fewer competing constraints will improve consistent binary criteria adherence.", "hypothesis_source": "agent", "mutation_diff_summary": "", "score": 1.9, "score_ci_lower": 1.6, "score_ci_upper": 2.2, "raw_scores": [1.5, 1.5, 2.0, 2.0, 2.5], "baseline_score": 1.7, "outcome": "KEPT", "failure_mode": null, "duration_seconds": 14.296396666904911, "tags": ["format-lock", "two-sentence", "faithfulness", "simplification"], "learnings": "{\"what_changed\":\"\",\"what_improved\":[],\"what_regressed\":[],\"transferable_insight\":\"Reducing ambiguity by enforcing a stricter, simpler contract can improve consistent adherence to binary criteria.\",\"domain_tags\":[\"process-design\",\"instruction-following\",\"decision-making\"]}", "cost_usd": 0.013960550000000002, "bootstrap_seed": 0, "agent_model": "gpt-5.4", "held_out_score": null, "criterion_names": ["key_points_captured", "conciseness", "faithful_to_source", "few_shot_format"], "per_criterion_scores": {"key_points_captured": 1.0, "conciseness": 0.4, "faithful_to_source": 0.2, "few_shot_format": 0.3}, "failure_classification": null, "drafts_generated": 1, "drafts_survived": 1}
{"id": "e2417a48-5978-468b-9165-2e4cf01142b3", "target_id": "B2-control", "git_sha": "dc69e0f487d0d7e6a06b092fce3321ea303b6420", "pre_experiment_sha": "d5a57ab07db9bfe3d24ea459afe7286f86036e3c", "timestamp": "2026-04-19T17:52:58.367719+00:00", "hypothesis": "Tightening the prompt to one rigid two-sentence contract with minimal redundant rules will improve consistency and faithfulness.", "hypothesis_source": "agent", "mutation_diff_summary": "", "score": 2.4, "score_ci_lower": 1.8, "score_ci_upper": 3.1, "raw_scores": [2.0, 3.0, 3.5, 2.0, 1.5], "baseline_score": 1.9, "outcome": "KEPT", "failure_mode": null, "duration_seconds": 13.703758249990642, "tags": ["format-contract", "two-sentence", "faithfulness", "concise"], "learnings": "{\"what_changed\":\"\",\"what_improved\":[],\"what_regressed\":[],\"transferable_insight\":\"Reducing instructions to a single, rigid contract can improve consistency and faithfulness by minimizing ambiguity and redundant constraints.\",\"domain_tags\":[\"prompt-engineering\",\"instruction-design\",\"model-behavior\"]}", "cost_usd": 0.01276095, "bootstrap_seed": 0, "agent_model": "gpt-5.4", "held_out_score": null, "criterion_names": ["key_points_captured", "conciseness", "faithful_to_source", "few_shot_format"], "per_criterion_scores": {"key_points_captured": 0.9, "conciseness": 0.6, "faithful_to_source": 0.6, "few_shot_format": 0.3}, "failure_classification": null, "drafts_generated": 1, "drafts_survived": 1}
