{"id": "9ce1b2a2-ab52-4198-999b-7a55233506c8", "target_id": "B2-control", "git_sha": "6856280a8277cacd22174829b2a5fffe25bc0667", "pre_experiment_sha": "6856280a8277cacd22174829b2a5fffe25bc0667", "timestamp": "2026-04-24T04:48:01.147820+00:00", "hypothesis": "Remove redundant adjective 'provided' from the Task section and trim excessive trailing newlines at the end of the file.", "hypothesis_source": "agent", "mutation_diff_summary": "", "score": 2.8, "score_ci_lower": 2.1, "score_ci_upper": 3.5, "raw_scores": [2.0, 2.5, 3.5, 2.0, 4.0], "baseline_score": 3.1, "outcome": "DISCARDED", "failure_mode": null, "duration_seconds": 52.37000387487933, "tags": ["redundancy-removal", "trim-newlines"], "learnings": "{\"what_changed\":\"\",\"what_improved\":[],\"what_regressed\":[],\"transferable_insight\":\"Removing seemingly redundant adjectives and structural whitespace to streamline instructions can unexpectedly degrade performance by reducing the explicitness and framing of the constraints.\",\"domain_tags\":[\"Prompt Engineering\",\"Instruction Clarity\",\"Formatting\"]}", "cost_usd": 0.01328295, "bootstrap_seed": 0, "agent_model": "gemini-3.1-pro-preview", "held_out_score": null, "criterion_names": ["key_points_captured", "conciseness", "faithful_to_source", "few_shot_format"], "per_criterion_scores": {"key_points_captured": 1.0, "conciseness": 1.0, "faithful_to_source": 0.5, "few_shot_format": 0.3}, "failure_classification": {"category": "semantic_drift", "description": "The experiment aimed to remove the adjective 'provided' due to perceived redundancy. However, the failure suggests that 'provided' might have been critical for maintaining the precise meaning, context, or nuance of the 'Task section'. Its removal likely led to a loss of clarity or altered the intended meaning, causing the negative score.", "fix_direction": "Carefully re-evaluate the necessity of the adjective 'provided' in its original context. Conduct a thorough semantic analysis or user testing to confirm if its removal truly maintains the exact intended meaning and clarity for evaluators or downstream systems. Ensure that attempts to improve conciseness do not inadvertently change the core message.", "confidence": 0.85}, "drafts_generated": 1, "drafts_survived": 1}
{"id": "f684332b-894b-4225-b9b8-a18980566cc6", "target_id": "B2-control", "git_sha": "6856280a8277cacd22174829b2a5fffe25bc0667", "pre_experiment_sha": "6856280a8277cacd22174829b2a5fffe25bc0667", "timestamp": "2026-04-24T04:52:21.108830+00:00", "hypothesis": "Remove the effort-related adjective \"expert\" from the Role section and trim the trailing newline to reduce redundancy while retaining the exact cognitive processing phrase.", "hypothesis_source": "agent", "mutation_diff_summary": "", "score": 2.7, "score_ci_lower": 2.2, "score_ci_upper": 3.2, "raw_scores": [2.0, 3.0, 3.5, 2.0, 3.0], "baseline_score": 3.1, "outcome": "DISCARDED", "failure_mode": null, "duration_seconds": 112.898981125094, "tags": ["redundancy-reduction", "effort-adjective-removal", "trailing-newline-trim"], "learnings": "{\"what_changed\":\"\",\"what_improved\":[],\"what_regressed\":[],\"transferable_insight\":\"Removing explicit role-defining adjectives to reduce redundancy degrades performance, indicating that strong persona cues are necessary to anchor high-quality outputs.\",\"domain_tags\":[\"Prompt Engineering\",\"Role Prompting\",\"Persona Design\"]}", "cost_usd": 0.011901550000000002, "bootstrap_seed": 0, "agent_model": "gemini-3.1-pro-preview", "held_out_score": null, "criterion_names": ["key_points_captured", "conciseness", "faithful_to_source", "few_shot_format"], "per_criterion_scores": {"key_points_captured": 1.0, "conciseness": 1.0, "faithful_to_source": 0.6, "few_shot_format": 0.1}, "failure_classification": {"category": "semantic_drift", "description": "The experiment aimed to reduce redundancy by removing the adjective 'expert' from the Role section. While the explicit 'cognitive processing phrase' was retained, the removal of 'expert' likely caused a subtle shift in the model's interpretation of the expected quality, depth, or style of response, leading to performance degradation (score 2.7). The trim of the trailing newline is less likely to be the primary cause of such a significant functional failure.", "fix_direction": "Re-evaluate the impact of seemingly redundant adjectives on implicit model expectations. Although 'expert' might seem verbose, it could be setting an implicit quality bar or specific persona that the model relies on. Future attempts should either test alternative, less verbose ways to convey the desired persona/quality, or more thoroughly measure the semantic impact of such removals on model behavior, perhaps using qualitative analysis or targeted semantic evaluation metrics in addition to the overall score.", "confidence": 0.9}, "drafts_generated": 1, "drafts_survived": 1}
{"id": "3b7d3787-1d99-4599-9410-347c41be806e", "target_id": "B2-control", "git_sha": "6856280a8277cacd22174829b2a5fffe25bc0667", "pre_experiment_sha": "6856280a8277cacd22174829b2a5fffe25bc0667", "timestamp": "2026-04-24T04:53:42.515742+00:00", "hypothesis": "Remove the effort-related adjective \"expert\" from the Role section to rely entirely on the appended cognitive processing instruction, and trim the trailing newline.", "hypothesis_source": "agent", "mutation_diff_summary": "", "score": 3.0, "score_ci_lower": 2.4, "score_ci_upper": 3.6, "raw_scores": [4.0, 3.5, 3.0, 2.0, 2.5], "baseline_score": 3.1, "outcome": "DISCARDED", "failure_mode": null, "duration_seconds": 66.2742019589059, "tags": ["redundancy-reduction", "prompt-trimming"], "learnings": "{\"what_changed\":\"\",\"what_improved\":[],\"what_regressed\":[],\"transferable_insight\":\"Removing explicit expertise markers from role definitions degrades performance, indicating that cognitive processing instructions cannot fully replace the contextual framing provided by a defined expert persona.\",\"domain_tags\":[\"Prompt Engineering\",\"Role Prompting\",\"Persona Design\"]}", "cost_usd": 0.01292735, "bootstrap_seed": 0, "agent_model": "gemini-3.1-pro-preview", "held_out_score": null, "criterion_names": ["key_points_captured", "conciseness", "faithful_to_source", "few_shot_format"], "per_criterion_scores": {"key_points_captured": 1.0, "conciseness": 1.0, "faithful_to_source": 0.7, "few_shot_format": 0.3}, "failure_classification": {"category": "semantic_drift", "description": "The experiment aimed to modify the model's understanding of its role by removing the explicit 'expert' adjective, intending for it to rely solely on the appended cognitive processing instruction. The resulting low score (3.0000) indicates that this semantic change caused the model to misinterpret its role, lose crucial context regarding the expected quality or depth of its output, or drift from the desired persona/instruction adherence. The model's interpretation of its task likely became less effective or aligned with the goal.", "fix_direction": "Re-evaluate the specific semantic contribution of the 'expert' adjective. It might be implicitly providing critical context or setting a baseline for output quality that the 'cognitive processing instruction' alone cannot adequately replace. Consider explicitly strengthening or expanding the cognitive processing instruction to encompass the aspects implicitly conveyed by 'expert,' or experimenting with alternative phrasing that clearly communicates the desired level of proficiency without using 'expert.' Incremental testing of prompt changes is recommended.", "confidence": 0.9}, "drafts_generated": 1, "drafts_survived": 1}
{"id": "22a31138-980c-45f9-92b3-5ce476e79f60", "target_id": "B2-control", "git_sha": "3e1eea72fa3d3dbc775ef80096df521e9ac9cee4", "pre_experiment_sha": "6856280a8277cacd22174829b2a5fffe25bc0667", "timestamp": "2026-04-24T04:55:27.365994+00:00", "hypothesis": "Remove the effort-related adjective \"expert\" from the Role section to eliminate redundancy with the appended cognitive processing phrase, and trim trailing newlines.", "hypothesis_source": "agent", "mutation_diff_summary": "", "score": 3.1, "score_ci_lower": 2.3, "score_ci_upper": 3.9, "raw_scores": [2.0, 3.5, 4.0, 2.0, 4.0], "baseline_score": 3.1, "outcome": "KEPT", "failure_mode": null, "duration_seconds": 87.54231379088014, "tags": ["redundancy-reduction", "prompt-trimming"], "learnings": "{\"what_changed\":\"\",\"what_improved\":[],\"what_regressed\":[],\"transferable_insight\":\"Removing redundant adjectives and trailing whitespace from role definitions maintains performance while streamlining the prompt.\",\"domain_tags\":[\"Prompt Engineering\",\"Role Prompting\",\"Prompt Optimization\"]}", "cost_usd": 0.01280735, "bootstrap_seed": 0, "agent_model": "gemini-3.1-pro-preview", "held_out_score": null, "criterion_names": ["key_points_captured", "conciseness", "faithful_to_source", "few_shot_format"], "per_criterion_scores": {"key_points_captured": 1.0, "conciseness": 1.0, "faithful_to_source": 0.6, "few_shot_format": 0.5}, "failure_classification": null, "drafts_generated": 1, "drafts_survived": 1}
{"id": "734b505a-03c8-4513-8483-9db4002751c0", "target_id": "B2-control", "git_sha": "52173c08caed9fe6553c2979c1e62c8bfb6c13e0", "pre_experiment_sha": "3e1eea72fa3d3dbc775ef80096df521e9ac9cee4", "timestamp": "2026-04-24T04:57:06.869586+00:00", "hypothesis": "Restore the explicit persona adjective 'expert' to the Role section to reverse semantic drift and re-anchor high-quality output generation, as removing it in previous iterations degraded the score.", "hypothesis_source": "agent", "mutation_diff_summary": "", "score": 3.1, "score_ci_lower": 2.4, "score_ci_upper": 3.8, "raw_scores": [2.0, 3.0, 4.0, 4.0, 2.5], "baseline_score": 3.1, "outcome": "KEPT", "failure_mode": null, "duration_seconds": 75.00199087499641, "tags": ["role-restoration", "persona-anchoring", "semantic-drift-reversal"], "learnings": "{\"what_changed\":\"\",\"what_improved\":[],\"what_regressed\":[],\"transferable_insight\":\"Explicitly assigning a high-competence persona in the role definition helps anchor output quality and prevent semantic drift over successive iterations.\",\"domain_tags\":[\"Prompt Engineering\",\"Persona Design\",\"System Instructions\"]}", "cost_usd": 0.014839050000000001, "bootstrap_seed": 0, "agent_model": "gemini-3.1-pro-preview", "held_out_score": null, "criterion_names": ["key_points_captured", "conciseness", "faithful_to_source", "few_shot_format"], "per_criterion_scores": {"key_points_captured": 1.0, "conciseness": 1.0, "faithful_to_source": 0.6, "few_shot_format": 0.5}, "failure_classification": null, "drafts_generated": 1, "drafts_survived": 1}
{"id": "63c9d2ac-beaf-4ab9-9b03-da4f81bdf25f", "target_id": "B2-control", "git_sha": "766c0053864bee56aab6a7cf13d056a4320de290", "pre_experiment_sha": "52173c08caed9fe6553c2979c1e62c8bfb6c13e0", "timestamp": "2026-04-24T04:58:10.694321+00:00", "hypothesis": "Remove the redundant adjective \"clear, \" from the Task section to further eliminate overlap with the appended cognitive processing instructions, and trim excess trailing newlines.", "hypothesis_source": "agent", "mutation_diff_summary": "", "score": 3.3, "score_ci_lower": 3.0, "score_ci_upper": 3.7, "raw_scores": [3.0, 3.0, 4.0, 3.5, 3.0], "baseline_score": 3.1, "outcome": "KEPT", "failure_mode": null, "duration_seconds": 56.732783125014976, "tags": ["redundancy-reduction", "adjective-removal", "trailing-newline-trim"], "learnings": "{\"what_changed\":\"\",\"what_improved\":[],\"what_regressed\":[],\"transferable_insight\":\"Eliminating redundant adjectives and excess whitespace from task descriptions streamlines instructions and prevents overlap with broader system directives, improving overall performance.\",\"domain_tags\":[\"Prompt Engineering\",\"Instruction Optimization\",\"Formatting\"]}", "cost_usd": 0.01584595, "bootstrap_seed": 0, "agent_model": "gemini-3.1-pro-preview", "held_out_score": null, "criterion_names": ["key_points_captured", "conciseness", "faithful_to_source", "few_shot_format"], "per_criterion_scores": {"key_points_captured": 0.8, "conciseness": 1.0, "faithful_to_source": 1.0, "few_shot_format": 0.5}, "failure_classification": null, "drafts_generated": 1, "drafts_survived": 1}
