{"id": "e9dd4206-fee2-4a28-a16f-719b32eb6af8", "target_id": "B2-control", "git_sha": "585c6e5c5aa8bcb95a351dba0d24038454e542bd", "pre_experiment_sha": "585c6e5c5aa8bcb95a351dba0d24038454e542bd", "timestamp": "2026-04-24T04:33:28.988937+00:00", "hypothesis": "Append a concise, neutral sentence encouraging thoughtful review to the Task section to promote careful reading without semantic drift.", "hypothesis_source": "agent", "mutation_diff_summary": "", "score": 2.9, "score_ci_lower": 2.4, "score_ci_upper": 3.5, "raw_scores": [3.0, 2.5, 3.0, 2.0, 4.0], "baseline_score": 3.2, "outcome": "DISCARDED", "failure_mode": null, "duration_seconds": 52.84459716686979, "tags": ["neutral-instruction", "prompt-engineering", "append-only"], "learnings": "{\"what_changed\":\"\",\"what_improved\":[],\"what_regressed\":[],\"transferable_insight\":\"Appending generic, neutral encouragements for careful review to task instructions degrades performance rather than improving attention or accuracy.\",\"domain_tags\":[\"Prompt Engineering\",\"Instruction Design\",\"Attention Management\"]}", "cost_usd": 0.01244915, "bootstrap_seed": 0, "agent_model": "gemini-3.1-pro-preview", "held_out_score": null, "criterion_names": ["key_points_captured", "conciseness", "faithful_to_source", "few_shot_format"], "per_criterion_scores": {"key_points_captured": 1.0, "conciseness": 1.0, "faithful_to_source": 0.7, "few_shot_format": 0.2}, "failure_classification": {"category": "semantic_drift", "description": "The experiment hypothesized adding a sentence to promote careful reading 'without semantic drift'. The failure, indicated by a very low score, suggests that the addition either inadvertently caused semantic drift (the task or the added sentence was misinterpreted), or it failed to effectively prevent semantic drift, leading to misinterpretation of the task's meaning. The added content likely did not clarify but rather obscured or complicated understanding.", "fix_direction": "Re-evaluate the nature of the 'semantic drift' problem. Instead of adding a meta-instruction, consider rephrasing the core task instructions for clarity and conciseness. If an advisory sentence is still deemed necessary, test alternative, unambiguous phrasings and placements to ensure it truly aids comprehension without introducing new ambiguities or being perceived as patronizing.", "confidence": 0.9}, "drafts_generated": 1, "drafts_survived": 1}
{"id": "513d66ce-7d6b-4f56-9591-ca629da1553c", "target_id": "B2-control", "git_sha": "399b3a894a7df0aef121eb6a88bf40bc6e6561c6", "pre_experiment_sha": "585c6e5c5aa8bcb95a351dba0d24038454e542bd", "timestamp": "2026-04-24T04:35:03.232349+00:00", "hypothesis": "Appending a neutral, standalone sentence encouraging deep cognitive processing, careful reading, and thorough analysis, while removing the problematic \"to improve summary quality\" clause, will improve the score without triggering semantic drift or scope violations.", "hypothesis_source": "agent", "mutation_diff_summary": "", "score": 3.3, "score_ci_lower": 2.6, "score_ci_upper": 3.9, "raw_scores": [3.0, 2.0, 4.0, 3.5, 4.0], "baseline_score": 3.2, "outcome": "KEPT", "failure_mode": null, "duration_seconds": 61.479487583972514, "tags": ["prompt-engineering", "neutral-verbs", "cognitive-processing"], "learnings": "{\"what_changed\":\"\",\"what_improved\":[],\"what_regressed\":[],\"transferable_insight\":\"Framing instructions for deep cognitive processing as neutral, standalone directives rather than attaching them to specific outcome goals prevents over-optimization and maintains task scope.\",\"domain_tags\":[\"Prompt Engineering\",\"Instruction Framing\",\"Cognitive Processing\"]}", "cost_usd": 0.013018749999999999, "bootstrap_seed": 0, "agent_model": "gemini-3.1-pro-preview", "held_out_score": null, "criterion_names": ["key_points_captured", "conciseness", "faithful_to_source", "few_shot_format"], "per_criterion_scores": {"key_points_captured": 0.9, "conciseness": 1.0, "faithful_to_source": 0.8, "few_shot_format": 0.6}, "failure_classification": null, "drafts_generated": 1, "drafts_survived": 1}
{"id": "f35c08a8-a14a-4c17-855c-0c730c2b8763", "target_id": "B2-control", "git_sha": "399b3a894a7df0aef121eb6a88bf40bc6e6561c6", "pre_experiment_sha": "399b3a894a7df0aef121eb6a88bf40bc6e6561c6", "timestamp": "2026-04-24T04:36:13.082066+00:00", "hypothesis": "Update the appended sentence to use \"appreciated\" instead of \"encouraged\" to maintain a gentle, neutral tone while encouraging deep cognitive processing, careful reading, and thorough analysis.", "hypothesis_source": "agent", "mutation_diff_summary": "", "score": 2.4, "score_ci_lower": 2.1, "score_ci_upper": 2.7, "raw_scores": [2.0, 3.0, 2.0, 2.5, 2.5], "baseline_score": 3.3, "outcome": "DISCARDED", "failure_mode": null, "duration_seconds": 62.6689204168506, "tags": ["task-instruction", "cognitive-processing"], "learnings": "{\"what_changed\":\"\",\"what_improved\":[],\"what_regressed\":[],\"transferable_insight\":\"Replacing clear, active directives with overly polite or passive language diminishes performance when prompting for deep cognitive processing and thorough analysis.\",\"domain_tags\":[\"Prompt Engineering\",\"Tone Optimization\",\"Cognitive Processing\"]}", "cost_usd": 0.011778150000000001, "bootstrap_seed": 0, "agent_model": "gemini-3.1-pro-preview", "held_out_score": null, "criterion_names": ["key_points_captured", "conciseness", "faithful_to_source", "few_shot_format"], "per_criterion_scores": {"key_points_captured": 1.0, "conciseness": 1.0, "faithful_to_source": 0.3, "few_shot_format": 0.1}, "failure_classification": {"category": "semantic_drift", "description": "The experiment likely failed to correctly implement the word replacement (\"appreciated\" for \"encouraged\") in a way that maintained the specified gentle, neutral tone or encouraged deep cognitive processing, careful reading, and thorough analysis. The resulting modification, or an incorrect attempt at it, caused the meaning or pragmatic effect of the appended sentence to drift significantly from the hypothesis's intent, leading to a very low score.", "fix_direction": "Improve the model's ability to understand and apply nuanced semantic requirements, including contextual tone, implied meaning, and desired cognitive effects of specific word choices. Enhance the model's capacity to evaluate the holistic impact of textual changes beyond simple substitutions, ensuring alignment with complex stylistic and reader engagement goals.", "confidence": 0.85}, "drafts_generated": 1, "drafts_survived": 1}
{"id": "950bc0fd-3958-4ea4-b838-71fa1ed6511e", "target_id": "B2-control", "git_sha": "399b3a894a7df0aef121eb6a88bf40bc6e6561c6", "pre_experiment_sha": "399b3a894a7df0aef121eb6a88bf40bc6e6561c6", "timestamp": "2026-04-24T04:37:39.770312+00:00", "hypothesis": "Slightly emphasize the appended instruction by adding \"highly\" to reinforce the gentle, neutral request for deep cognitive processing without altering the core concepts.", "hypothesis_source": "agent", "mutation_diff_summary": "", "score": 2.3, "score_ci_lower": 2.0, "score_ci_upper": 2.9, "raw_scores": [2.0, 2.0, 3.5, 2.0, 2.0], "baseline_score": 3.3, "outcome": "DISCARDED", "failure_mode": null, "duration_seconds": 54.81038850010373, "tags": ["task-modification", "emphasis"], "learnings": "{\"what_changed\":\"\",\"what_improved\":[],\"what_regressed\":[],\"transferable_insight\":\"Adding superficial intensifiers to reinforce instructions without altering the core concepts is ineffective and can degrade overall performance.\",\"domain_tags\":[\"Prompt Engineering\",\"Instruction Tuning\",\"Communication\"]}", "cost_usd": 0.01137365, "bootstrap_seed": 0, "agent_model": "gemini-3.1-pro-preview", "held_out_score": null, "criterion_names": ["key_points_captured", "conciseness", "faithful_to_source", "few_shot_format"], "per_criterion_scores": {"key_points_captured": 1.0, "conciseness": 1.0, "faithful_to_source": 0.2, "few_shot_format": 0.1}, "failure_classification": {"category": "semantic_drift", "description": "The chosen intensifier 'highly' fundamentally altered the semantic meaning and tone of the instruction. While intending a 'slight emphasis' and 'reinforcing a gentle, neutral request,' the addition of 'highly' made the instruction overly strong, potentially contradictory ('highly gentle' or 'highly neutral'), or confusing to the model, leading it to misinterpret the true intent of the prompt.", "fix_direction": "Re-evaluate the method for emphasis. Instead of using a strong intensifier that changes the core semantic nuance, explore more subtle linguistic cues or structural adjustments that genuinely convey a 'slight emphasis' while preserving the 'gentle' and 'neutral' tone.", "confidence": 0.95}, "drafts_generated": 1, "drafts_survived": 1}
{"id": "ea2d875b-3bb6-489c-b3f3-c826fc300f0c", "target_id": "B2-control", "git_sha": "399b3a894a7df0aef121eb6a88bf40bc6e6561c6", "pre_experiment_sha": "399b3a894a7df0aef121eb6a88bf40bc6e6561c6", "timestamp": "2026-04-24T04:39:16.404324+00:00", "hypothesis": "Maintain the proven optimal phrase exactly as instructed to avoid semantic drift and scope violations, as the current baseline already perfectly matches the strict criteria.", "hypothesis_source": "agent", "mutation_diff_summary": "", "score": 2.3, "score_ci_lower": 2.0, "score_ci_upper": 2.7, "raw_scores": [2.0, 3.0, 2.0, 2.0, 2.5], "baseline_score": 3.3, "outcome": "DISCARDED", "failure_mode": null, "duration_seconds": 67.0084175420925, "tags": ["maintain", "control"], "learnings": "{\"what_changed\":\"\",\"what_improved\":[],\"what_regressed\":[],\"transferable_insight\":\"Rigidly freezing a supposedly optimal baseline to prevent drift can actually degrade performance by preventing necessary contextual adaptation.\",\"domain_tags\":[\"Optimization\",\"System Tuning\",\"Adaptability\"]}", "cost_usd": 0.010955800000000002, "bootstrap_seed": 0, "agent_model": "gemini-3.1-pro-preview", "held_out_score": null, "criterion_names": ["key_points_captured", "conciseness", "faithful_to_source", "few_shot_format"], "per_criterion_scores": {"key_points_captured": 1.0, "conciseness": 1.0, "faithful_to_source": 0.3, "few_shot_format": 0.0}, "failure_classification": {"category": "semantic_drift", "description": "The experiment failed to maintain the exact wording and meaning of the 'proven optimal phrase' as instructed. Despite the hypothesis aiming to prevent semantic drift, the resulting output deviated significantly in meaning, leading to a low score (2.3000) from a baseline that was 'perfectly matching strict criteria'. This indicates the content's meaning shifted away from its original optimal intent.", "fix_direction": "Implement stricter controls and validation mechanisms to ensure the exact reproduction or precise semantic equivalence of the optimal phrase. This could involve direct string matching for critical phrases, embedding similarity checks for minor variations, or human-in-the-loop review for nuanced language. Focus on identifying and penalizing subtle changes in meaning or implication.", "confidence": 0.85}, "drafts_generated": 1, "drafts_survived": 1}
{"id": "6b820a79-ca81-47e7-bb37-a222177dc481", "target_id": "B2-control", "git_sha": "399b3a894a7df0aef121eb6a88bf40bc6e6561c6", "pre_experiment_sha": "399b3a894a7df0aef121eb6a88bf40bc6e6561c6", "timestamp": "2026-04-24T04:40:44.152654+00:00", "hypothesis": "Maintain the optimal baseline prompt which already includes the proven phrase for deep cognitive processing, adding only a trailing newline to register the mutation.", "hypothesis_source": "agent", "mutation_diff_summary": "", "score": 2.2, "score_ci_lower": 2.0, "score_ci_upper": 2.6, "raw_scores": [2.0, 2.0, 3.0, 2.0, 2.0], "baseline_score": 3.3, "outcome": "DISCARDED", "failure_mode": null, "duration_seconds": 63.029015250038356, "tags": ["formatting", "preservation"], "learnings": "{\"what_changed\":\"\",\"what_improved\":[],\"what_regressed\":[],\"transferable_insight\":\"Introducing trivial formatting changes, such as trailing whitespace, to an already optimized baseline can cause unexpected performance regressions.\",\"domain_tags\":[\"Prompt Engineering\",\"Optimization\",\"Formatting\"]}", "cost_usd": 0.01091025, "bootstrap_seed": 0, "agent_model": "gemini-3.1-pro-preview", "held_out_score": null, "criterion_names": ["key_points_captured", "conciseness", "faithful_to_source", "few_shot_format"], "per_criterion_scores": {"key_points_captured": 1.0, "conciseness": 1.0, "faithful_to_source": 0.2, "few_shot_format": 0.0}, "failure_classification": {"category": "regression", "description": "A seemingly innocuous change (adding only a trailing newline) to a previously optimal baseline prompt led to a measurable degradation in performance (score 2.2000). This indicates that the model is highly sensitive to subtle modifications, even those not explicitly altering the semantic content, causing a regression from a stable or higher-performing state.", "fix_direction": "Systematically investigate the model's sensitivity to whitespace and non-content-bearing characters, especially at the end of prompts. Test various forms of prompt termination (e.g., no trailing space, single space, single newline, multiple newlines) to understand their impact on the 'deep cognitive processing' phrase and overall performance. Consider if the model interprets trailing newlines as a signal for continuation or a lack of definitive instruction termination, leading to suboptimal processing.", "confidence": 0.95}, "drafts_generated": 1, "drafts_survived": 1}
{"id": "d65f5bba-a729-4be7-83cb-d91e7011b4ae", "target_id": "B2-control", "git_sha": "0b1f126f74877e7e19ec2cd03a067afb6e63d9b3", "pre_experiment_sha": "399b3a894a7df0aef121eb6a88bf40bc6e6561c6", "timestamp": "2026-04-24T04:41:47.109152+00:00", "hypothesis": "The artifact already perfectly incorporates the proven phrase, so maintaining it exactly as is will preserve the optimal score without violating constraints.", "hypothesis_source": "agent", "mutation_diff_summary": "", "score": 2.9, "score_ci_lower": 2.1, "score_ci_upper": 3.7, "raw_scores": [4.0, 2.5, 2.0, 4.0, 2.0], "baseline_score": 3.3, "outcome": "KEPT", "failure_mode": null, "duration_seconds": 48.215852124849334, "tags": ["control", "baseline"], "learnings": "{\"what_changed\":\"\",\"what_improved\":[],\"what_regressed\":[],\"transferable_insight\":\"Assuming a previously optimal element will maintain its performance without modification can lead to degradation, highlighting the need for continuous adaptation to the current context.\",\"domain_tags\":[\"Optimization\",\"Continuous Improvement\",\"Adaptation\"]}", "cost_usd": 0.0122167, "bootstrap_seed": 0, "agent_model": "gemini-3.1-pro-preview", "held_out_score": null, "criterion_names": ["key_points_captured", "conciseness", "faithful_to_source", "few_shot_format"], "per_criterion_scores": {"key_points_captured": 1.0, "conciseness": 1.0, "faithful_to_source": 0.5, "few_shot_format": 0.4}, "failure_classification": null, "drafts_generated": 1, "drafts_survived": 1}
{"id": "0de3847c-58e8-412c-bd60-1e29c54d53fe", "target_id": "B2-control", "git_sha": "855c68ff34ac283f354c60bf901efa70a7abdfc6", "pre_experiment_sha": "0b1f126f74877e7e19ec2cd03a067afb6e63d9b3", "timestamp": "2026-04-24T04:43:19.601320+00:00", "hypothesis": "Remove excessive trailing newlines at the end of the file to prevent formatting regressions, while ensuring the exact requested phrase is perfectly maintained without extraneous clauses.", "hypothesis_source": "agent", "mutation_diff_summary": "", "score": 2.8, "score_ci_lower": 2.0, "score_ci_upper": 3.6, "raw_scores": [2.0, 4.0, 2.0, 2.0, 4.0], "baseline_score": 2.9, "outcome": "KEPT", "failure_mode": null, "duration_seconds": 61.09936195798218, "tags": ["formatting", "clean-up"], "learnings": "{\"what_changed\":\"\",\"what_improved\":[],\"what_regressed\":[],\"transferable_insight\":\"Eliminating unnecessary formatting artifacts while strictly maintaining requested phrasing ensures precise compliance with output specifications.\",\"domain_tags\":[\"Formatting\",\"Constraint Satisfaction\",\"Output Precision\"]}", "cost_usd": 0.01265225, "bootstrap_seed": 0, "agent_model": "gemini-3.1-pro-preview", "held_out_score": null, "criterion_names": ["key_points_captured", "conciseness", "faithful_to_source", "few_shot_format"], "per_criterion_scores": {"key_points_captured": 1.0, "conciseness": 1.0, "faithful_to_source": 0.4, "few_shot_format": 0.4}, "failure_classification": null, "drafts_generated": 1, "drafts_survived": 1}
{"id": "c41e5341-db62-41b3-9adc-ec7f30a17b90", "target_id": "B2-control", "git_sha": "debce27c1299fe4b4d318f92e88f57d0bba761ee", "pre_experiment_sha": "855c68ff34ac283f354c60bf901efa70a7abdfc6", "timestamp": "2026-04-24T04:44:38.313519+00:00", "hypothesis": "Remove the redundant word \"essential\" from the task description and trim the trailing newline to clean up extraneous elements while maintaining the exact cognitive processing phrase.", "hypothesis_source": "agent", "mutation_diff_summary": "", "score": 2.9, "score_ci_lower": 2.2, "score_ci_upper": 3.6, "raw_scores": [2.0, 3.0, 4.0, 2.0, 3.5], "baseline_score": 2.8, "outcome": "KEPT", "failure_mode": null, "duration_seconds": 71.10391599987634, "tags": ["redundancy-removal", "formatting-cleanup"], "learnings": "{\"what_changed\":\"\",\"what_improved\":[],\"what_regressed\":[],\"transferable_insight\":\"Streamlining instructions by removing redundant modifiers and extraneous whitespace improves processing efficiency and task performance.\",\"domain_tags\":[\"Prompt Engineering\",\"Instruction Clarity\",\"Formatting\"]}", "cost_usd": 0.012540250000000001, "bootstrap_seed": 0, "agent_model": "gemini-3.1-pro-preview", "held_out_score": null, "criterion_names": ["key_points_captured", "conciseness", "faithful_to_source", "few_shot_format"], "per_criterion_scores": {"key_points_captured": 1.0, "conciseness": 1.0, "faithful_to_source": 0.6, "few_shot_format": 0.3}, "failure_classification": null, "drafts_generated": 1, "drafts_survived": 1}
{"id": "08d55773-e36c-4e4d-a93a-35c484096962", "target_id": "B2-control", "git_sha": "b312ed503a0f3da2ecfb9b26dc1d3fa38ce8fd20", "pre_experiment_sha": "debce27c1299fe4b4d318f92e88f57d0bba761ee", "timestamp": "2026-04-24T04:45:42.608844+00:00", "hypothesis": "Remove the redundant adverb \"Carefully\" from the Task section to eliminate extraneous jargon and rely solely on the appended phrase for deep processing instructions.", "hypothesis_source": "agent", "mutation_diff_summary": "", "score": 3.4, "score_ci_lower": 2.6, "score_ci_upper": 4.0, "raw_scores": [4.0, 4.0, 4.0, 3.0, 2.0], "baseline_score": 2.9, "outcome": "KEPT", "failure_mode": null, "duration_seconds": 57.68404925009236, "tags": ["B2-control", "summarization", "remove-jargon"], "learnings": "{\"what_changed\":\"\",\"what_improved\":[],\"what_regressed\":[],\"transferable_insight\":\"Removing redundant adverbs from task instructions improves clarity and performance by reducing extraneous filler and allowing the model to focus on specific processing directives.\",\"domain_tags\":[\"Prompt Engineering\",\"Instruction Clarity\",\"Optimization\"]}", "cost_usd": 0.013869000000000001, "bootstrap_seed": 0, "agent_model": "gemini-3.1-pro-preview", "held_out_score": null, "criterion_names": ["key_points_captured", "conciseness", "faithful_to_source", "few_shot_format"], "per_criterion_scores": {"key_points_captured": 1.0, "conciseness": 1.0, "faithful_to_source": 0.8, "few_shot_format": 0.6}, "failure_classification": null, "drafts_generated": 1, "drafts_survived": 1}
{"id": "74f30745-0740-4d30-a620-b6de0496327c", "target_id": "B2-control", "git_sha": "6856280a8277cacd22174829b2a5fffe25bc0667", "pre_experiment_sha": "b312ed503a0f3da2ecfb9b26dc1d3fa38ce8fd20", "timestamp": "2026-04-24T04:47:02.207217+00:00", "hypothesis": "Trim trailing newlines at the end of the file to prevent regressions and improve the score.", "hypothesis_source": "agent", "mutation_diff_summary": "", "score": 3.1, "score_ci_lower": 2.5, "score_ci_upper": 3.7, "raw_scores": [2.0, 3.0, 3.5, 4.0, 3.0], "baseline_score": 3.4, "outcome": "KEPT", "failure_mode": null, "duration_seconds": 54.35880845808424, "tags": ["formatting", "trailing-newlines"], "learnings": "{\"what_changed\":\"\",\"what_improved\":[],\"what_regressed\":[],\"transferable_insight\":\"Standardizing input formats by removing extraneous trailing characters prevents processing regressions and improves overall system performance.\",\"domain_tags\":[\"Data Preprocessing\",\"Formatting\",\"Software Engineering\"]}", "cost_usd": 0.012302450000000001, "bootstrap_seed": 0, "agent_model": "gemini-3.1-pro-preview", "held_out_score": null, "criterion_names": ["key_points_captured", "conciseness", "faithful_to_source", "few_shot_format"], "per_criterion_scores": {"key_points_captured": 1.0, "conciseness": 1.0, "faithful_to_source": 0.7, "few_shot_format": 0.4}, "failure_classification": null, "drafts_generated": 1, "drafts_survived": 1}
