{"id": "35ef4292-02a2-49da-9c1c-e5830b7dcf0e", "target_id": "B2-control", "git_sha": "86a4672638d41921e13aa1f3073160723cc2a000", "pre_experiment_sha": "86a4672638d41921e13aa1f3073160723cc2a000", "timestamp": "2026-04-22T06:58:18.925288+00:00", "hypothesis": "Separate the persona from the main instructions with a line break to slightly improve readability and instruction processing without altering the wording or violating constraints.", "hypothesis_source": "agent", "mutation_diff_summary": "", "score": 2.1, "score_ci_lower": 2.0, "score_ci_upper": 2.3, "raw_scores": [2.0, 2.0, 2.5, 2.0, 2.0], "baseline_score": 3.4, "outcome": "DISCARDED", "failure_mode": null, "duration_seconds": 79.13898400007747, "tags": ["formatting", "readability"], "learnings": "{\"what_changed\":\"\",\"what_improved\":[],\"what_regressed\":[],\"transferable_insight\":\"Adding structural whitespace, such as line breaks, to separate persona definitions from core instructions can degrade model performance rather than improving instruction processing.\",\"domain_tags\":[\"Prompt Engineering\",\"Formatting\",\"Instruction Following\"]}", "cost_usd": 0.0104096, "bootstrap_seed": 0, "agent_model": "gemini-3.1-pro-preview", "held_out_score": null, "criterion_names": ["key_points_captured", "conciseness", "faithful_to_source", "few_shot_format"], "per_criterion_scores": {"key_points_captured": 1.0, "conciseness": 1.0, "faithful_to_source": 0.1, "few_shot_format": 0.0}, "failure_classification": {"category": "semantic_drift", "description": "The experiment introduced a line break to separate the persona from instructions. While intended to improve clarity, this structural change likely caused the model to misinterpret the intended relationship or emphasis between the persona and the main instructions. This 'drift' in the model's understanding of the prompt's overall meaning (e.g., treating persona and instructions as too independent) led to incorrect processing and the low score.", "fix_direction": "Re-evaluate the strength of the separation. The line break might have created too much disconnect. Experiment with subtler separators (e.g., a single line break if previously double, or different phrasing to explicitly link the persona and instructions), or test without any explicit separator to confirm the baseline behavior. The goal is to ensure the model correctly integrates the persona's context with the operational instructions.", "confidence": 0.9}, "drafts_generated": 1, "drafts_survived": 1}
{"id": "d98b5bda-3e63-485a-b4aa-e406c9823569", "target_id": "B2-control", "git_sha": "86a4672638d41921e13aa1f3073160723cc2a000", "pre_experiment_sha": "86a4672638d41921e13aa1f3073160723cc2a000", "timestamp": "2026-04-22T06:59:57.735132+00:00", "hypothesis": "Add the word \"Carefully\" before \"read the article below\" to gently encourage better comprehension and faithfulness without introducing harsh constraints.", "hypothesis_source": "agent", "mutation_diff_summary": "", "score": 3.1, "score_ci_lower": 2.3, "score_ci_upper": 3.9, "raw_scores": [4.0, 2.0, 2.0, 3.5, 4.0], "baseline_score": 3.4, "outcome": "DISCARDED", "failure_mode": null, "duration_seconds": 77.2566878751386, "tags": ["prompt-engineering", "gentle-refinement", "attention-to-detail"], "learnings": "{\"what_changed\":\"\",\"what_improved\":[],\"what_regressed\":[],\"transferable_insight\":\"Adding soft, subjective adverbs like 'carefully' to instructions fails to improve task execution and is ineffective compared to providing explicit, actionable constraints.\",\"domain_tags\":[\"Prompt Engineering\",\"Instruction Design\"]}", "cost_usd": 0.012866800000000001, "bootstrap_seed": 0, "agent_model": "gemini-3.1-pro-preview", "held_out_score": null, "criterion_names": ["key_points_captured", "conciseness", "faithful_to_source", "few_shot_format"], "per_criterion_scores": {"key_points_captured": 1.0, "conciseness": 1.0, "faithful_to_source": 0.6, "few_shot_format": 0.5}, "failure_classification": {"category": "semantic_drift", "description": "The addition of \"Carefully\" likely led the model to misinterpret the desired output behavior. Instead of prompting deeper comprehension and faithfulness, it might have induced overly cautious, restrictive, or an unexpected style of processing, leading to outputs that did not align with the intended quality criteria and thus received a low score. The instruction's meaning was semantically drifted from its original intent.", "fix_direction": "Remove the ambiguous adverb and rephrase the instruction to be more explicit about the desired output characteristics. For example, specify what 'better comprehension and faithfulness' entails (e.g., 'Ensure accuracy, thoroughness, and comprehensive understanding'). Alternatively, provide examples of desired output quality to guide the model.", "confidence": 0.9}, "drafts_generated": 1, "drafts_survived": 1}
{"id": "a33ecfca-c4e9-42d2-9fc8-60e1e16eff55", "target_id": "B2-control", "git_sha": "86a4672638d41921e13aa1f3073160723cc2a000", "pre_experiment_sha": "86a4672638d41921e13aa1f3073160723cc2a000", "timestamp": "2026-04-22T07:01:45.576556+00:00", "hypothesis": "Simplify the faithfulness constraint by removing \"Rely only on the provided text and\", relying solely on the gentler \"Avoid adding external information.\" to reduce over-constraining the prompt.", "hypothesis_source": "agent", "mutation_diff_summary": "", "score": 2.7, "score_ci_lower": 2.3, "score_ci_upper": 3.0, "raw_scores": [2.0, 2.5, 3.0, 3.0, 3.0], "baseline_score": 3.4, "outcome": "DISCARDED", "failure_mode": null, "duration_seconds": 54.45520870806649, "tags": ["prompt-simplification", "constraint-softening"], "learnings": "{\"what_changed\":\"\",\"what_improved\":[],\"what_regressed\":[],\"transferable_insight\":\"Removing explicit positive grounding instructions in favor of softer negative constraints degrades model faithfulness and overall performance.\",\"domain_tags\":[\"Prompt Engineering\",\"Hallucination Prevention\",\"Constraint Formatting\"]}", "cost_usd": 0.012035350000000002, "bootstrap_seed": 0, "agent_model": "gemini-3.1-pro-preview", "held_out_score": null, "criterion_names": ["key_points_captured", "conciseness", "faithful_to_source", "few_shot_format"], "per_criterion_scores": {"key_points_captured": 1.0, "conciseness": 1.0, "faithful_to_source": 0.6, "few_shot_format": 0.1}, "failure_classification": {"category": "semantic_drift", "description": "The experiment aimed to make the faithfulness constraint gentler by removing the explicit instruction to 'Rely only on the provided text'. This relaxation likely caused the model to lose its strict grounding, leading to outputs that were no longer faithful to the source material. The very low score of 2.7 indicates that the meaning of the generated text diverged significantly from what was expected or intended, suggesting the model began introducing ungrounded information, misinterpretations, or inferences that were not strictly supported by the provided text, thus 'drifting' semantically.", "fix_direction": "Re-evaluate the phrasing of faithfulness constraints. The phrase 'Avoid adding external information' might be too weak or ambiguously interpreted without the reinforcing 'Rely only on the provided text'. Future attempts should explore more precise language that allows for desired flexibility without sacrificing core semantic accuracy and grounding. Consider explicitly defining what constitutes 'external information' or providing examples.", "confidence": 0.9}, "drafts_generated": 1, "drafts_survived": 1}
{"id": "fa37d726-5ac4-4175-8739-5975dd4d278e", "target_id": "B2-control", "git_sha": "0f615d0df075a296cbc44677b9845b5cd7b4b97b", "pre_experiment_sha": "86a4672638d41921e13aa1f3073160723cc2a000", "timestamp": "2026-04-22T07:04:27.748861+00:00", "hypothesis": "Removing the redundant \"Rely only on the provided text\" and keeping just \"Avoid adding external information\" simplifies the prompt and reduces constraint rigidity while adhering to the proven softening strategy.", "hypothesis_source": "agent", "mutation_diff_summary": "", "score": 2.8, "score_ci_lower": 2.2, "score_ci_upper": 3.4, "raw_scores": [4.0, 2.0, 2.0, 3.0, 3.0], "baseline_score": 3.4, "outcome": "KEPT", "failure_mode": null, "duration_seconds": 98.75010175001808, "tags": ["prompt-simplification", "constraint-softening"], "learnings": "{\"what_changed\":\"\",\"what_improved\":[],\"what_regressed\":[],\"transferable_insight\":\"Replacing multiple strict constraints with a single, softer guideline reduces rigidity and simplifies instructions while maintaining necessary boundaries.\",\"domain_tags\":[\"Prompt Engineering\",\"Constraint Management\",\"Instruction Simplification\"]}", "cost_usd": 0.01238555, "bootstrap_seed": 0, "agent_model": "gemini-3.1-pro-preview", "held_out_score": null, "criterion_names": ["key_points_captured", "conciseness", "faithful_to_source", "few_shot_format"], "per_criterion_scores": {"key_points_captured": 1.0, "conciseness": 1.0, "faithful_to_source": 0.4, "few_shot_format": 0.4}, "failure_classification": null, "drafts_generated": 1, "drafts_survived": 1}
{"id": "06d2f811-9306-433d-8c9b-be1b99765bfb", "target_id": "B2-control", "git_sha": "d5d1d47955e51c7bed28376ea5dd3b161992b6a5", "pre_experiment_sha": "0f615d0df075a296cbc44677b9845b5cd7b4b97b", "timestamp": "2026-04-22T07:05:55.215796+00:00", "hypothesis": "Combine \"Rely only on the provided text\" with \"avoid adding external information\" to gently reinforce faithfulness without using harsh constraints.", "hypothesis_source": "agent", "mutation_diff_summary": "", "score": 2.9, "score_ci_lower": 2.1, "score_ci_upper": 3.7, "raw_scores": [2.0, 4.0, 2.0, 4.0, 2.5], "baseline_score": 2.8, "outcome": "KEPT", "failure_mode": null, "duration_seconds": 79.0172405000776, "tags": ["prompt-engineering", "faithfulness", "gentle-constraints"], "learnings": "{\"what_changed\":\"\",\"what_improved\":[],\"what_regressed\":[],\"transferable_insight\":\"Pairing a positive directive with a gentle negative constraint effectively reinforces strict adherence to provided information without the need for harsh restrictions.\",\"domain_tags\":[\"Prompt Engineering\",\"Constraint Formatting\",\"Faithfulness\"]}", "cost_usd": 0.0120976, "bootstrap_seed": 0, "agent_model": "gemini-3.1-pro-preview", "held_out_score": null, "criterion_names": ["key_points_captured", "conciseness", "faithful_to_source", "few_shot_format"], "per_criterion_scores": {"key_points_captured": 1.0, "conciseness": 1.0, "faithful_to_source": 0.5, "few_shot_format": 0.4}, "failure_classification": null, "drafts_generated": 1, "drafts_survived": 1}
{"id": "cc355489-1b59-4bc6-ba3a-65a4b0393eb8", "target_id": "B2-control", "git_sha": "f1c4bdc173f8ed77243e555b8f981c92bbaf30f5", "pre_experiment_sha": "d5d1d47955e51c7bed28376ea5dd3b161992b6a5", "timestamp": "2026-04-22T07:07:40.104976+00:00", "hypothesis": "Removing the spatial reference \"below\" from \"Read the article below\" resolves potential ambiguity, as the actual article to summarize appears after the few-shot examples, aligning the instruction logically with the prompt structure.", "hypothesis_source": "agent", "mutation_diff_summary": "", "score": 2.7, "score_ci_lower": 2.2, "score_ci_upper": 3.2, "raw_scores": [2.0, 2.0, 3.5, 3.0, 3.0], "baseline_score": 2.9, "outcome": "KEPT", "failure_mode": null, "duration_seconds": 74.30254437495023, "tags": ["prompt-engineering", "clarity", "instruction-alignment"], "learnings": "{\"what_changed\":\"\",\"what_improved\":[],\"what_regressed\":[],\"transferable_insight\":\"Eliminating relative spatial references in instructions improves logical consistency when intermediate elements separate the prompt from the target data.\",\"domain_tags\":[\"Prompt Engineering\",\"Instruction Formatting\",\"Prompt Structure\"]}", "cost_usd": 0.015600049999999999, "bootstrap_seed": 0, "agent_model": "gemini-3.1-pro-preview", "held_out_score": null, "criterion_names": ["key_points_captured", "conciseness", "faithful_to_source", "few_shot_format"], "per_criterion_scores": {"key_points_captured": 1.0, "conciseness": 1.0, "faithful_to_source": 0.6, "few_shot_format": 0.1}, "failure_classification": null, "drafts_generated": 1, "drafts_survived": 1}
{"id": "2bdabc67-5c62-4182-94ed-1a361c4f004e", "target_id": "B2-control", "git_sha": "f1c4bdc173f8ed77243e555b8f981c92bbaf30f5", "pre_experiment_sha": "f1c4bdc173f8ed77243e555b8f981c92bbaf30f5", "timestamp": "2026-04-22T07:09:03.319826+00:00", "hypothesis": "Restoring the spatial reference \"below\" to \"Read the article below\" reverts a recent change that introduced ambiguity and degraded performance, realigning the instruction with the expected prompt structure.", "hypothesis_source": "agent", "mutation_diff_summary": "", "score": 2.2, "score_ci_lower": 2.0, "score_ci_upper": 2.6, "raw_scores": [2.0, 3.0, 2.0, 2.0, 2.0], "baseline_score": 2.7, "outcome": "DISCARDED", "failure_mode": null, "duration_seconds": 76.05524229095317, "tags": ["prompt-engineering", "clarity", "instruction-alignment", "revert"], "learnings": "{\"what_changed\":\"\",\"what_improved\":[],\"what_regressed\":[\"faithful_to_source: FAIL (was PASS)\"],\"transferable_insight\":\"Using spatial references like 'below' to direct attention in prompts can inadvertently degrade a model's adherence to the source material, indicating that structural or logical delimiters are more reliable than spatial cues.\",\"domain_tags\":[\"Prompt Engineering\",\"Instruction Formatting\",\"Faithfulness\"]}", "cost_usd": 0.013393000000000002, "bootstrap_seed": 0, "agent_model": "gemini-3.1-pro-preview", "held_out_score": null, "criterion_names": ["key_points_captured", "conciseness", "faithful_to_source", "few_shot_format"], "per_criterion_scores": {"key_points_captured": 1.0, "conciseness": 1.0, "faithful_to_source": 0.2, "few_shot_format": 0.0}, "failure_classification": {"category": "semantic_drift", "description": "The experiment failed to resolve the ambiguity surrounding the instruction despite restoring the explicit spatial reference 'below'. This indicates that the model's interpretation of the prompt's meaning or its contextual understanding of relative positioning ('below' vs. implied) remains misaligned with the intended instruction, leading to continued degraded performance.", "fix_direction": "Investigate how the model processes and interprets spatial references and contextual cues within instructions. This could involve examining prompt engineering strategies beyond simple word restoration, such as adding stronger delimiters, rephrasing for explicit clarity, or exploring how the model's internal representations handle such directives after recent changes.", "confidence": 0.9}, "drafts_generated": 1, "drafts_survived": 1}
{"id": "ae855cef-2dfc-424c-aa2e-a2efc14d0af2", "target_id": "B2-control", "git_sha": "f1c4bdc173f8ed77243e555b8f981c92bbaf30f5", "pre_experiment_sha": "f1c4bdc173f8ed77243e555b8f981c92bbaf30f5", "timestamp": "2026-04-22T07:10:56.574544+00:00", "hypothesis": "Changing \"write\" to \"provide\" shifts the instruction from a creative framing to an objective, extraction-focused framing, gently encouraging better faithfulness and format adherence without adding harsh constraints.", "hypothesis_source": "agent", "mutation_diff_summary": "", "score": 2.6, "score_ci_lower": 2.0, "score_ci_upper": 3.4, "raw_scores": [2.0, 2.0, 3.0, 2.0, 4.0], "baseline_score": 2.7, "outcome": "DISCARDED", "failure_mode": null, "duration_seconds": 89.68779520806856, "tags": ["prompt-engineering", "phrasing-adjustment", "faithfulness"], "learnings": "{\"what_changed\":\"\",\"what_improved\":[],\"what_regressed\":[],\"transferable_insight\":\"Subtle semantic shifts in action verbs, such as swapping 'write' for 'provide', are ineffective at implicitly enforcing objectivity or format adherence.\",\"domain_tags\":[\"Prompt Engineering\",\"Semantic Framing\",\"Instruction Tuning\"]}", "cost_usd": 0.01484015, "bootstrap_seed": 0, "agent_model": "gemini-3.1-pro-preview", "held_out_score": null, "criterion_names": ["key_points_captured", "conciseness", "faithful_to_source", "few_shot_format"], "per_criterion_scores": {"key_points_captured": 1.0, "conciseness": 1.0, "faithful_to_source": 0.4, "few_shot_format": 0.2}, "failure_classification": {"category": "regression", "description": "The experiment failed to achieve its hypothesis of improving faithfulness and format adherence by changing 'write' to 'provide'. The low score of 2.6000 suggests that the new instruction likely degraded performance on these criteria, meaning the model produced outputs that were less faithful to the source, or deviated more from the expected format, or both, compared to the implied baseline using 'write'. The word 'provide' might have been interpreted as a more passive or less demanding instruction for careful composition and adherence to specific rules.", "fix_direction": "Investigate the specific nature of the regression: was it primarily format adherence, faithfulness, or both? Explore alternative verbs or phrases that explicitly convey both objective extraction AND the need for structure/faithfulness. Consider adding more explicit constraints or examples when using 'provide' to guide the model, or use verbs like 'extract', 'summarize', or 'present' that might better capture the desired objective, extraction-focused framing while retaining quality.", "confidence": 0.9}, "drafts_generated": 1, "drafts_survived": 1}
{"id": "592a965f-d9d2-4f7d-ad69-a557c6d352f1", "target_id": "B2-control", "git_sha": "f1c4bdc173f8ed77243e555b8f981c92bbaf30f5", "pre_experiment_sha": "f1c4bdc173f8ed77243e555b8f981c92bbaf30f5", "timestamp": "2026-04-22T07:13:29.471185+00:00", "hypothesis": "Removing the relative reference \"following\" from the final instruction simplifies the prompt and aligns with the proven strategy of eliminating spatial or relative textual cues to improve logical consistency.", "hypothesis_source": "agent", "mutation_diff_summary": "", "score": 2.6, "score_ci_lower": 2.2, "score_ci_upper": 3.0, "raw_scores": [3.0, 3.0, 3.0, 2.0, 2.0], "baseline_score": 2.7, "outcome": "DISCARDED", "failure_mode": null, "duration_seconds": 111.3010046670679, "tags": ["prompt-simplification", "clarity", "instruction-alignment"], "learnings": "{\"what_changed\":\"\",\"what_improved\":[\"faithful_to_source: PASS (was FAIL)\"],\"what_regressed\":[],\"transferable_insight\":\"Eliminating relative spatial references from instructions can improve strict adherence to source material, even if it negatively impacts overall task performance.\",\"domain_tags\":[\"Prompt Engineering\",\"Instruction Formatting\"]}", "cost_usd": 0.015280700000000001, "bootstrap_seed": 0, "agent_model": "gemini-3.1-pro-preview", "held_out_score": null, "criterion_names": ["key_points_captured", "conciseness", "faithful_to_source", "few_shot_format"], "per_criterion_scores": {"key_points_captured": 1.0, "conciseness": 1.0, "faithful_to_source": 0.6, "few_shot_format": 0.0}, "failure_classification": {"category": "semantic_drift", "description": "The removal of the relative reference 'following' likely caused a semantic shift in the instruction's meaning or scope. While intended to simplify and improve logical consistency, this specific textual cue might have been crucial for the model to correctly identify the target content or the relationship between instructions and input. This misinterpretation of the task led to the observed failure.", "fix_direction": "Re-evaluate the necessity of the removed relative cue. The assumption that 'following' was a dispensable spatial cue might be incorrect; it could be crucial for disambiguation. Consider if the instruction now lacks a clear reference to its target, causing the model to misinterpret the scope of the task. Explore alternative ways to explicitly define the subject of the instruction without introducing new ambiguities, such as using structural cues (e.g., 'the text enclosed in backticks') or more direct phrasing (e.g., 'the provided input'). If the goal is truly simplification, ensure the new phrasing maintains precise meaning.", "confidence": 0.9}, "drafts_generated": 1, "drafts_survived": 1}
{"id": "31bcf71e-8cac-4ee9-a53b-529ee6700f45", "target_id": "B2-control", "git_sha": "4f8557b224df355b1df89e930e84a0b0963660a8", "pre_experiment_sha": "f1c4bdc173f8ed77243e555b8f981c92bbaf30f5", "timestamp": "2026-04-22T07:16:13.307149+00:00", "hypothesis": "Changing \"Read the article\" to \"Read the provided article\" clarifies the target of the instruction without using spatial references, reinforcing adherence to the source material through the repeated emphasis on the word \"provided\".", "hypothesis_source": "agent", "mutation_diff_summary": "", "score": 2.7, "score_ci_lower": 2.1, "score_ci_upper": 3.4, "raw_scores": [2.0, 2.5, 4.0, 2.0, 3.0], "baseline_score": 2.7, "outcome": "KEPT", "failure_mode": null, "duration_seconds": 144.13712616707198, "tags": ["prompt-engineering", "clarity", "faithfulness"], "learnings": "{\"what_changed\":\"\",\"what_improved\":[],\"what_regressed\":[],\"transferable_insight\":\"Explicitly designating source material with terms like 'provided' clarifies instructional targets and reinforces adherence to the source without relying on ambiguous spatial references.\",\"domain_tags\":[\"Instruction Clarity\",\"Prompt Engineering\",\"Context Grounding\"]}", "cost_usd": 0.0147405, "bootstrap_seed": 0, "agent_model": "gemini-3.1-pro-preview", "held_out_score": null, "criterion_names": ["key_points_captured", "conciseness", "faithful_to_source", "few_shot_format"], "per_criterion_scores": {"key_points_captured": 1.0, "conciseness": 1.0, "faithful_to_source": 0.5, "few_shot_format": 0.2}, "failure_classification": null, "drafts_generated": 1, "drafts_survived": 1}
