{"id": "2be0a06b-106d-47c7-8185-c936411a23d2", "target_id": "B2-control", "git_sha": "257dda5aa6fbff0d4882f693d5881a0ca9d0b98c", "pre_experiment_sha": "4f8557b224df355b1df89e930e84a0b0963660a8", "timestamp": "2026-04-22T07:19:07.988867+00:00", "hypothesis": "Adding a comma to \"clear, single-paragraph summary\" improves grammatical parsing of coordinate adjectives, and removing the conversational filler \"some\" from the transition makes the prompt slightly more direct and professional without adding harsh constraints.", "hypothesis_source": "agent", "mutation_diff_summary": "", "score": 3.0, "score_ci_lower": 2.5, "score_ci_upper": 3.4, "raw_scores": [3.0, 3.0, 3.5, 2.0, 3.5], "baseline_score": 2.7, "outcome": "KEPT", "failure_mode": null, "duration_seconds": 117.11443249997683, "tags": ["prompt-engineering", "grammar-correction", "tone-adjustment"], "learnings": "{\"what_changed\":\"\",\"what_improved\":[],\"what_regressed\":[],\"transferable_insight\":\"Eliminating conversational fillers and applying precise grammatical punctuation enhances the clarity, professionalism, and accurate parsing of instructional text.\",\"domain_tags\":[\"Prompt Engineering\",\"Grammar\",\"Professional Writing\"]}", "cost_usd": 0.015211350000000002, "bootstrap_seed": 0, "agent_model": "gemini-3.1-pro-preview", "held_out_score": null, "criterion_names": ["key_points_captured", "conciseness", "faithful_to_source", "few_shot_format"], "per_criterion_scores": {"key_points_captured": 1.0, "conciseness": 1.0, "faithful_to_source": 0.7, "few_shot_format": 0.3}, "failure_classification": null, "drafts_generated": 1, "drafts_survived": 1}
{"id": "6ab023f8-99dc-4abe-bd11-f4138492e987", "target_id": "B2-control", "git_sha": "257dda5aa6fbff0d4882f693d5881a0ca9d0b98c", "pre_experiment_sha": "257dda5aa6fbff0d4882f693d5881a0ca9d0b98c", "timestamp": "2026-04-22T07:21:21.437579+00:00", "hypothesis": "Replacing \"how to summarize articles\" with \"how to write clear, single-paragraph summaries\" in the transition gently reinforces the desired output structure by mirroring the exact phrasing of the main instruction, implicitly improving format adherence without adding new constraints.", "hypothesis_source": "agent", "mutation_diff_summary": "", "score": 2.6, "score_ci_lower": 2.2, "score_ci_upper": 3.0, "raw_scores": [3.0, 3.0, 2.0, 2.0, 3.0], "baseline_score": 3.0, "outcome": "DISCARDED", "failure_mode": null, "duration_seconds": 104.95845004194416, "tags": ["prompt-engineering", "instruction-alignment", "format-adherence"], "learnings": "{\"what_changed\":\"\",\"what_improved\":[],\"what_regressed\":[],\"transferable_insight\":\"Repeating specific structural constraints within transitional phrases, rather than using natural generalized language, can degrade performance rather than reinforcing the desired output.\",\"domain_tags\":[\"Prompt Engineering\",\"Instruction Formatting\",\"Linguistics\"]}", "cost_usd": 0.0148003, "bootstrap_seed": 0, "agent_model": "gemini-3.1-pro-preview", "held_out_score": null, "criterion_names": ["key_points_captured", "conciseness", "faithful_to_source", "few_shot_format"], "per_criterion_scores": {"key_points_captured": 1.0, "conciseness": 1.0, "faithful_to_source": 0.6, "few_shot_format": 0.0}, "failure_classification": {"category": "output_format", "description": "The experiment aimed to implicitly improve adherence to a 'single-paragraph summary' format by mirroring prompt phrasing. The failure (score 2.6000) indicates that the desired output structure was still not consistently achieved or may have even degraded, despite the targeted wording change. The prompt modification was insufficient to reliably enforce the desired single-paragraph format.", "fix_direction": "Introduce more explicit and forceful constraints on the output structure (e.g., 'The summary MUST be a single paragraph. Do not use line breaks or bullet points.') or provide clear few-shot examples demonstrating the exact desired single-paragraph format to guide the model more effectively.", "confidence": 0.9}, "drafts_generated": 1, "drafts_survived": 1}
{"id": "6cc91e5b-3375-4484-ba95-1f45bd4bb409", "target_id": "B2-control", "git_sha": "fb565e00531542ca8b046b8bfc34942e2b909b82", "pre_experiment_sha": "257dda5aa6fbff0d4882f693d5881a0ca9d0b98c", "timestamp": "2026-04-22T07:24:20.317313+00:00", "hypothesis": "Removing the conversational transition \"Now, \" from the final instruction makes the prompt more direct and professional, aligning with the strategy of eliminating unnecessary conversational fillers.", "hypothesis_source": "agent", "mutation_diff_summary": "", "score": 2.8, "score_ci_lower": 2.2, "score_ci_upper": 3.4, "raw_scores": [3.5, 3.0, 2.0, 3.5, 2.0], "baseline_score": 3.0, "outcome": "KEPT", "failure_mode": null, "duration_seconds": 98.99632670800202, "tags": ["prompt-simplification", "tone-adjustment", "instruction-alignment"], "learnings": "{\"what_changed\":\"\",\"what_improved\":[],\"what_regressed\":[],\"transferable_insight\":\"Eliminating conversational transitions to increase directness can slightly degrade performance, suggesting that mild conversational framing may serve as a useful structural cue for the model.\",\"domain_tags\":[\"Prompt Engineering\",\"Tone and Style\",\"Instruction Formatting\"]}", "cost_usd": 0.014975050000000002, "bootstrap_seed": 0, "agent_model": "gemini-3.1-pro-preview", "held_out_score": null, "criterion_names": ["key_points_captured", "conciseness", "faithful_to_source", "few_shot_format"], "per_criterion_scores": {"key_points_captured": 1.0, "conciseness": 1.0, "faithful_to_source": 0.6, "few_shot_format": 0.2}, "failure_classification": null, "drafts_generated": 1, "drafts_survived": 1}
{"id": "14e1649e-878f-485f-b720-ec0c223fb635", "target_id": "B2-control", "git_sha": "342fde372926bd2cb845f92c7fe715bb5fbee5f5", "pre_experiment_sha": "fb565e00531542ca8b046b8bfc34942e2b909b82", "timestamp": "2026-04-22T07:26:10.926420+00:00", "hypothesis": "Restoring the mild conversational transition \"Now, \" to the final instruction provides a useful structural cue for the model, reversing a previous minor regression and improving overall format adherence.", "hypothesis_source": "agent", "mutation_diff_summary": "", "score": 3.2, "score_ci_lower": 2.5, "score_ci_upper": 3.9, "raw_scores": [2.0, 2.5, 4.0, 3.5, 4.0], "baseline_score": 2.8, "outcome": "KEPT", "failure_mode": null, "duration_seconds": 74.04329420789145, "tags": ["structural-cue", "format-adherence", "tone-adjustment"], "learnings": "{\"what_changed\":\"\",\"what_improved\":[\"few_shot_format: PASS (was FAIL)\"],\"what_regressed\":[],\"transferable_insight\":\"Incorporating a mild conversational transition before a final instruction serves as an effective structural cue that enhances a model's adherence to formatting constraints.\",\"domain_tags\":[\"Prompt Engineering\",\"Instruction Formatting\",\"Structural Cues\"]}", "cost_usd": 0.016151699999999998, "bootstrap_seed": 0, "agent_model": "gemini-3.1-pro-preview", "held_out_score": null, "criterion_names": ["key_points_captured", "conciseness", "faithful_to_source", "few_shot_format"], "per_criterion_scores": {"key_points_captured": 1.0, "conciseness": 0.9, "faithful_to_source": 0.7, "few_shot_format": 0.6}, "failure_classification": null, "drafts_generated": 1, "drafts_survived": 1}
{"id": "b3855807-ed95-4482-9a51-81498b5e2480", "target_id": "B2-control", "git_sha": "9a5c092a2b7cbdab7170ffc10887ff4975e779e3", "pre_experiment_sha": "342fde372926bd2cb845f92c7fe715bb5fbee5f5", "timestamp": "2026-04-22T07:28:29.760607+00:00", "hypothesis": "Removing excessive trailing blank lines after the final instruction ensures the appended article is directly adjacent to the prompt, preventing artificial gaps that can cause semantic drift or context disconnect.", "hypothesis_source": "agent", "mutation_diff_summary": "", "score": 3.4, "score_ci_lower": 3.0, "score_ci_upper": 3.8, "raw_scores": [3.0, 4.0, 3.0, 4.0, 3.0], "baseline_score": 3.2, "outcome": "KEPT", "failure_mode": null, "duration_seconds": 85.381905333139, "tags": ["prompt-engineering", "formatting-cleanup", "context-grounding"], "learnings": "{\"what_changed\":\"\",\"what_improved\":[],\"what_regressed\":[\"few_shot_format: FAIL (was PASS)\"],\"transferable_insight\":\"Eliminating artificial whitespace between instructions and target data enhances overall semantic cohesion but risks disrupting structural formatting boundaries required for specific tasks.\",\"domain_tags\":[\"Prompt Engineering\",\"Whitespace Management\",\"Context Optimization\"]}", "cost_usd": 0.0166936, "bootstrap_seed": 0, "agent_model": "gemini-3.1-pro-preview", "held_out_score": null, "criterion_names": ["key_points_captured", "conciseness", "faithful_to_source", "few_shot_format"], "per_criterion_scores": {"key_points_captured": 1.0, "conciseness": 1.0, "faithful_to_source": 1.0, "few_shot_format": 0.4}, "failure_classification": null, "drafts_generated": 1, "drafts_survived": 1}
{"id": "c1af6529-9f92-4321-b07a-c8e164e65f42", "target_id": "B2-control", "git_sha": "9a5c092a2b7cbdab7170ffc10887ff4975e779e3", "pre_experiment_sha": "9a5c092a2b7cbdab7170ffc10887ff4975e779e3", "timestamp": "2026-04-22T07:32:52.009911+00:00", "hypothesis": "Adding commas to separate the compound predicates in the main instructions (\"Read..., and write...\" / \"Rely..., and avoid...\") establishes a parallel syntactic structure that improves parsing and pacing, reducing semantic drift.", "hypothesis_source": "agent", "mutation_diff_summary": "", "score": 2.6, "score_ci_lower": 2.0, "score_ci_upper": 3.4, "raw_scores": [2.0, 3.0, 2.0, 4.0, 2.0], "baseline_score": 3.4, "outcome": "DISCARDED", "failure_mode": null, "duration_seconds": 219.93214804213494, "tags": ["prompt-engineering", "grammar-correction", "syntax-parsing"], "learnings": "{\"what_changed\":\"\",\"what_improved\":[],\"what_regressed\":[],\"transferable_insight\":\"Inserting commas to force parallel syntactic structure in compound predicates can degrade rather than improve the parsing and execution of instructions.\",\"domain_tags\":[\"Prompt Engineering\",\"Syntax and Grammar\",\"Instruction Formatting\"]}", "cost_usd": 0.015324300000000003, "bootstrap_seed": 0, "agent_model": "gemini-3.1-pro-preview", "held_out_score": null, "criterion_names": ["key_points_captured", "conciseness", "faithful_to_source", "few_shot_format"], "per_criterion_scores": {"key_points_captured": 0.9, "conciseness": 1.0, "faithful_to_source": 0.5, "few_shot_format": 0.2}, "failure_classification": {"category": "semantic_drift", "description": "The experiment aimed to reduce semantic drift by clarifying syntactic structure with commas. However, the failure (indicated by the score of 2.6000) suggests that the instruction's meaning was still misunderstood or misinterpreted, or perhaps even worsened, despite the structural change. The intended parallel parsing did not effectively reduce ambiguity or guide the correct interpretation.", "fix_direction": "Instead of focusing solely on punctuation, re-evaluate the overall clarity, conciseness, and explicitness of the instructions. Consider simplifying complex sentences, breaking them into smaller parts, or using more direct phrasing to explicitly convey the desired meaning and prevent misinterpretation, rather than relying on syntactic cues alone.", "confidence": 0.95}, "drafts_generated": 1, "drafts_survived": 1}
{"id": "8bb76c63-88fc-4e77-94bd-eeb8507ff1bb", "target_id": "B2-control", "git_sha": "9a5c092a2b7cbdab7170ffc10887ff4975e779e3", "pre_experiment_sha": "9a5c092a2b7cbdab7170ffc10887ff4975e779e3", "timestamp": "2026-04-22T07:36:20.897012+00:00", "hypothesis": "Changing the persona from \"helpful summarization assistant\" to the standard \"helpful assistant\" aligns maximally with the model's base RLHF training, reducing semantic drift while the subsequent instructions clearly define the task domain.", "hypothesis_source": "agent", "mutation_diff_summary": "", "score": 3.0, "score_ci_lower": 2.3, "score_ci_upper": 3.7, "raw_scores": [2.0, 3.5, 3.5, 4.0, 2.0], "baseline_score": 3.4, "outcome": "DISCARDED", "failure_mode": null, "duration_seconds": 170.36271400004625, "tags": ["prompt-simplification", "persona-adjustment", "semantic-drift-reduction"], "learnings": "{\"what_changed\":\"\",\"what_improved\":[],\"what_regressed\":[],\"transferable_insight\":\"Replacing a task-specific persona with a generic one degrades performance, demonstrating that specialized personas provide critical context that outweighs the theoretical benefits of aligning with a model's base training.\",\"domain_tags\":[\"Prompt Engineering\",\"Persona Design\"]}", "cost_usd": 0.016850250000000004, "bootstrap_seed": 0, "agent_model": "gemini-3.1-pro-preview", "held_out_score": null, "criterion_names": ["key_points_captured", "conciseness", "faithful_to_source", "few_shot_format"], "per_criterion_scores": {"key_points_captured": 1.0, "conciseness": 1.0, "faithful_to_source": 0.6, "few_shot_format": 0.4}, "failure_classification": {"category": "semantic_drift", "description": "The experiment's hypothesis explicitly aimed at reducing semantic drift by changing the persona. Given the experiment failed (score 3.0), it strongly implies that the intended reduction in semantic drift was not achieved, or potentially worsened, leading the model to misinterpret or deviate from the correct meaning or intent despite subsequent instructions.", "fix_direction": "Re-evaluate the interaction between the chosen 'standard helpful assistant' persona and the subsequent task instructions. It's possible the generic persona is either insufficient to ground the model for specific tasks or that the base RLHF training for this persona has subtle biases that still lead to semantic drift. Consider either a more finely-tuned generic persona, stronger initial guardrails in the prompt to define the domain, or a re-evaluation of how 'semantic drift' is measured in this context.", "confidence": 0.9}, "drafts_generated": 1, "drafts_survived": 1}
