{"id": "4b37d684-9028-443e-a7dc-6a50861ef51d", "target_id": "B2-control", "git_sha": "9a0acd3ba3487d967db1f6ef693ec48c4da35f56", "pre_experiment_sha": "9a0acd3ba3487d967db1f6ef693ec48c4da35f56", "timestamp": "2026-04-22T06:25:19.139402+00:00", "hypothesis": "Standardize output to a single paragraph, gently instruct the model to rely only on the provided text, and clean up few-shot examples to remove minor hallucinations like acronyms not present in the source text.", "hypothesis_source": "agent", "mutation_diff_summary": "", "score": 3.0, "score_ci_lower": 2.2, "score_ci_upper": 3.8, "raw_scores": [4.0, 3.0, 2.0, 2.0, 4.0], "baseline_score": 2.7, "outcome": "DISCARDED", "failure_mode": null, "duration_seconds": 67.88312545791268, "tags": ["prompt-engineering", "few-shot-cleanup", "gentle-constraints", "formatting"], "learnings": "{\"what_changed\":\"\",\"what_improved\":[],\"what_regressed\":[],\"transferable_insight\":\"Refining few-shot examples to eliminate minor hallucinations and adding gentle grounding instructions does not guarantee a practically significant improvement in task performance.\",\"domain_tags\":[\"Prompt Engineering\",\"Few-Shot Prompting\",\"Hallucination Mitigation\"]}", "cost_usd": 0.012581150000000001, "bootstrap_seed": 0, "agent_model": "gemini-3.1-pro-preview", "held_out_score": null, "criterion_names": ["key_points_captured", "conciseness", "faithful_to_source", "few_shot_format"], "per_criterion_scores": {"key_points_captured": 1.0, "conciseness": 1.0, "faithful_to_source": 0.6, "few_shot_format": 0.4}, "failure_classification": {"category": "semantic_drift", "description": "The experiment aimed to improve the model's grounding by instructing it to rely only on provided text and by cleaning few-shot examples to remove minor hallucinations. A score of 3.0 suggests that, despite these efforts, the model's output likely continued to exhibit incorrect meaning, potentially through persistent hallucinations or a failure to strictly adhere to the source material, thus drifting semantically from the intended output.", "fix_direction": "Strengthen the grounding instructions in the prompt, moving beyond 'gentle' guidance to more assertive directives. Consider using negative few-shot examples to explicitly demonstrate what not to do (e.g., 'Do not invent acronyms'). Enhance the cleaning process for few-shot examples to ensure absolute fidelity. Evaluate if a more robust mechanism, such as Retrieval-Augmented Generation (RAG), is needed to enforce strict adherence to provided text. Also, review the evaluation criteria to ensure they accurately capture semantic fidelity and penalize hallucination.", "confidence": 0.9}, "drafts_generated": 1, "drafts_survived": 1}
{"id": "4fcba718-9858-4adf-8756-86a7308f3d3a", "target_id": "B2-control", "git_sha": "9a0acd3ba3487d967db1f6ef693ec48c4da35f56", "pre_experiment_sha": "9a0acd3ba3487d967db1f6ef693ec48c4da35f56", "timestamp": "2026-04-22T06:27:02.455691+00:00", "hypothesis": "Simplify the prompt to use straightforward language for avoiding external information and explicitly request a consistent single-paragraph summary format.", "hypothesis_source": "agent", "mutation_diff_summary": "", "score": 3.2, "score_ci_lower": 2.8, "score_ci_upper": 3.6, "raw_scores": [4.0, 2.5, 3.0, 3.5, 3.0], "baseline_score": 2.7, "outcome": "DISCARDED", "failure_mode": null, "duration_seconds": 66.14439212507568, "tags": ["prompt-engineering", "formatting", "simplification"], "learnings": "{\"what_changed\":\"\",\"what_improved\":[],\"what_regressed\":[],\"transferable_insight\":\"Explicitly constraining output structure and simplifying instructions to prevent the inclusion of external information does not guarantee a viable solution.\",\"domain_tags\":[\"Prompt Engineering\",\"Constraint Satisfaction\",\"Output Formatting\"]}", "cost_usd": 0.0129027, "bootstrap_seed": 0, "agent_model": "gemini-3.1-pro-preview", "held_out_score": null, "criterion_names": ["key_points_captured", "conciseness", "faithful_to_source", "few_shot_format"], "per_criterion_scores": {"key_points_captured": 1.0, "conciseness": 1.0, "faithful_to_source": 0.7, "few_shot_format": 0.5}, "failure_classification": {"category": "output_format", "description": "The experiment's hypothesis aimed to enforce a consistent single-paragraph summary format. The failure indicates that the model did not adhere to this requested output structure, possibly producing multi-paragraph summaries or inconsistent formatting, or not avoiding external information as intended by the simplified prompt.", "fix_direction": "Refine prompt instructions to more rigorously define and enforce the desired single-paragraph summary format. This could involve adding specific examples, clearer delimiters, or even negative constraints to prevent unwanted structures. Also, review if the 'straightforward language' inadvertently allowed for the inclusion of external information.", "confidence": 0.9}, "drafts_generated": 1, "drafts_survived": 1}
{"id": "c4294880-87ac-4ad9-8af2-281f95a058c9", "target_id": "B2-control", "git_sha": "9a0acd3ba3487d967db1f6ef693ec48c4da35f56", "pre_experiment_sha": "9a0acd3ba3487d967db1f6ef693ec48c4da35f56", "timestamp": "2026-04-22T06:28:45.602719+00:00", "hypothesis": "Refine the system prompt to use simpler, less rigid language to avoid external information and explicitly enforce a single-paragraph format, while leaving the few-shot examples intact as they do not contain obvious hallucinated sentences.", "hypothesis_source": "agent", "mutation_diff_summary": "", "score": 3.1, "score_ci_lower": 2.4, "score_ci_upper": 3.8, "raw_scores": [2.0, 2.5, 4.0, 4.0, 3.0], "baseline_score": 2.7, "outcome": "DISCARDED", "failure_mode": null, "duration_seconds": 77.02066220901906, "tags": ["prompt-engineering", "constraint-relaxation", "formatting"], "learnings": "{\"what_changed\":\"\",\"what_improved\":[],\"what_regressed\":[],\"transferable_insight\":\"Simplifying instructional language to be less rigid can undermine compliance with strict content boundaries, indicating that preventing the inclusion of external information requires firm, explicit constraints.\",\"domain_tags\":[\"Prompt Engineering\",\"Constraint Enforcement\",\"Instruction Tuning\"]}", "cost_usd": 0.012678249999999999, "bootstrap_seed": 0, "agent_model": "gemini-3.1-pro-preview", "held_out_score": null, "criterion_names": ["key_points_captured", "conciseness", "faithful_to_source", "few_shot_format"], "per_criterion_scores": {"key_points_captured": 1.0, "conciseness": 1.0, "faithful_to_source": 0.7, "few_shot_format": 0.4}, "failure_classification": {"category": "semantic_drift", "description": "The attempt to use simpler, less rigid language likely led to a loss of precision in the prompt, causing the model to misinterpret the core task or generate content that includes external information, deviating from the intended meaning. The low score (3.1) suggests a fundamental problem with the quality and relevance of the generated content, rather than solely a structural issue.", "fix_direction": "Re-evaluate the balance between simplicity and clarity. While less rigid language is desired, ensure critical constraints (like avoiding external information) are explicitly and unambiguously communicated. Test prompts with varying degrees of rigidity to find the sweet spot that prevents semantic drift without introducing unwanted external information or rigid language. Also, review the few-shot examples to see if they implicitly contradict the desired outcome with simpler language.", "confidence": 0.8}, "drafts_generated": 1, "drafts_survived": 1}
{"id": "c2695a9e-5bbb-41cc-9520-634bb86702ee", "target_id": "B2-control", "git_sha": "940f637b5ddd918629f2c9506e3728afba11f357", "pre_experiment_sha": "9a0acd3ba3487d967db1f6ef693ec48c4da35f56", "timestamp": "2026-04-22T06:30:38.507550+00:00", "hypothesis": "Refine the prompt to request a single-paragraph summary and use gentle, direct language to instruct the model to avoid external information.", "hypothesis_source": "agent", "mutation_diff_summary": "", "score": 2.8, "score_ci_lower": 2.3, "score_ci_upper": 3.4, "raw_scores": [3.0, 2.5, 4.0, 2.5, 2.0], "baseline_score": 2.7, "outcome": "KEPT", "failure_mode": null, "duration_seconds": 58.81595916580409, "tags": ["prompt-engineering", "gentle-constraints", "formatting"], "learnings": "{\"what_changed\":\"\",\"what_improved\":[],\"what_regressed\":[],\"transferable_insight\":\"Combining specific formatting constraints with gentle, direct instructions to avoid external information improves model adherence and reduces hallucinations.\",\"domain_tags\":[\"Prompt Engineering\",\"Hallucination Mitigation\",\"Output Formatting\"]}", "cost_usd": 0.012240750000000002, "bootstrap_seed": 0, "agent_model": "gemini-3.1-pro-preview", "held_out_score": null, "criterion_names": ["key_points_captured", "conciseness", "faithful_to_source", "few_shot_format"], "per_criterion_scores": {"key_points_captured": 1.0, "conciseness": 1.0, "faithful_to_source": 0.5, "few_shot_format": 0.3}, "failure_classification": null, "drafts_generated": 1, "drafts_survived": 1}
{"id": "315edfd9-eb93-4a8b-aaff-e2ee49459908", "target_id": "B2-control", "git_sha": "24b2dd9f794ea55fdeeb332fc4ce2cd076cdd7ed", "pre_experiment_sha": "940f637b5ddd918629f2c9506e3728afba11f357", "timestamp": "2026-04-22T06:31:53.467253+00:00", "hypothesis": "Gently rephrase the system prompt to use direct and straightforward language instructing the model to rely only on the provided text and write a single-paragraph summary, without modifying the few-shot examples.", "hypothesis_source": "agent", "mutation_diff_summary": "", "score": 3.2, "score_ci_lower": 2.6, "score_ci_upper": 3.8, "raw_scores": [3.0, 3.0, 4.0, 2.0, 4.0], "baseline_score": 2.8, "outcome": "KEPT", "failure_mode": null, "duration_seconds": 53.02387624979019, "tags": ["prompt-engineering", "gentle-instructions", "formatting"], "learnings": "{\"what_changed\":\"\",\"what_improved\":[],\"what_regressed\":[],\"transferable_insight\":\"Explicitly stating constraints and output formats using direct, straightforward language in the system prompt enhances model adherence and overall performance.\",\"domain_tags\":[\"Prompt Engineering\",\"Instruction Clarity\",\"Constraint Setting\"]}", "cost_usd": 0.01222775, "bootstrap_seed": 0, "agent_model": "gemini-3.1-pro-preview", "held_out_score": null, "criterion_names": ["key_points_captured", "conciseness", "faithful_to_source", "few_shot_format"], "per_criterion_scores": {"key_points_captured": 1.0, "conciseness": 1.0, "faithful_to_source": 0.8, "few_shot_format": 0.4}, "failure_classification": null, "drafts_generated": 1, "drafts_survived": 1}
{"id": "cbfe88b4-d878-4ef1-9b20-6452b8f082ce", "target_id": "B2-control", "git_sha": "6c3d0c3db47344cb2154fe35ce508d1db2178222", "pre_experiment_sha": "24b2dd9f794ea55fdeeb332fc4ce2cd076cdd7ed", "timestamp": "2026-04-22T06:32:55.362537+00:00", "hypothesis": "Gently reinforce the single-paragraph constraint at the end of the prompt to improve formatting consistency without using rigid language.", "hypothesis_source": "agent", "mutation_diff_summary": "", "score": 2.7, "score_ci_lower": 2.1, "score_ci_upper": 3.4, "raw_scores": [2.0, 3.0, 4.0, 2.0, 2.5], "baseline_score": 3.2, "outcome": "KEPT", "failure_mode": null, "duration_seconds": 54.49864166602492, "tags": ["gentle-reinforcement", "single-paragraph"], "learnings": "{\"what_changed\":\"\",\"what_improved\":[],\"what_regressed\":[],\"transferable_insight\":\"Placing a gentle reminder of structural constraints at the end of a prompt improves formatting consistency without relying on overly rigid instructions.\",\"domain_tags\":[\"Prompt Engineering\",\"Output Formatting\",\"Instruction Placement\"]}", "cost_usd": 0.0110613, "bootstrap_seed": 0, "agent_model": "gemini-3.1-pro-preview", "held_out_score": null, "criterion_names": ["key_points_captured", "conciseness", "faithful_to_source", "few_shot_format"], "per_criterion_scores": {"key_points_captured": 1.0, "conciseness": 1.0, "faithful_to_source": 0.5, "few_shot_format": 0.2}, "failure_classification": null, "drafts_generated": 1, "drafts_survived": 1}
{"id": "78d0e63d-c816-4c52-92ea-396b6caab60b", "target_id": "B2-control", "git_sha": "1a39fe4ff48075129a1deb2470ca85b11e449bb3", "pre_experiment_sha": "6c3d0c3db47344cb2154fe35ce508d1db2178222", "timestamp": "2026-04-22T06:33:59.754156+00:00", "hypothesis": "Gently refine the system prompt to request a single-paragraph summary while strictly avoiding external information, without modifying any few-shot examples.", "hypothesis_source": "agent", "mutation_diff_summary": "", "score": 2.5, "score_ci_lower": 2.0, "score_ci_upper": 3.3, "raw_scores": [2.0, 4.0, 2.0, 2.0, 2.5], "baseline_score": 2.7, "outcome": "KEPT", "failure_mode": null, "duration_seconds": 57.04601487494074, "tags": ["prompt-engineering", "gentle-refinement"], "learnings": "{\"what_changed\":\"\",\"what_improved\":[],\"what_regressed\":[],\"transferable_insight\":\"Enforcing strict output constraints in the system prompt without aligning the few-shot examples to demonstrate those constraints can lead to degraded performance.\",\"domain_tags\":[\"Prompt Engineering\",\"Few-Shot Prompting\",\"Constraint Satisfaction\"]}", "cost_usd": 0.010966449999999999, "bootstrap_seed": 0, "agent_model": "gemini-3.1-pro-preview", "held_out_score": null, "criterion_names": ["key_points_captured", "conciseness", "faithful_to_source", "few_shot_format"], "per_criterion_scores": {"key_points_captured": 1.0, "conciseness": 1.0, "faithful_to_source": 0.3, "few_shot_format": 0.2}, "failure_classification": null, "drafts_generated": 1, "drafts_survived": 1}
{"id": "a013cda2-dd42-4d4b-b539-56213503ea53", "target_id": "B2-control", "git_sha": "9d2f7bf9050dbfc84afb495cfdf5487e562b28e9", "pre_experiment_sha": "1a39fe4ff48075129a1deb2470ca85b11e449bb3", "timestamp": "2026-04-22T06:35:22.751438+00:00", "hypothesis": "Gently refine the system prompt to ask for key points and politely request relying only on the provided text, without altering the few-shot examples.", "hypothesis_source": "agent", "mutation_diff_summary": "", "score": 2.5, "score_ci_lower": 2.1, "score_ci_upper": 3.0, "raw_scores": [2.0, 2.5, 2.5, 2.0, 3.5], "baseline_score": 2.5, "outcome": "KEPT", "failure_mode": null, "duration_seconds": 53.95979050011374, "tags": ["prompt-engineering", "gentle-instructions", "summarization"], "learnings": "{\"what_changed\":\"\",\"what_improved\":[],\"what_regressed\":[],\"transferable_insight\":\"Adding polite constraints to prompt instructions without updating the accompanying few-shot examples often results in neutral performance changes.\",\"domain_tags\":[\"Prompt Engineering\",\"Few-Shot Learning\"]}", "cost_usd": 0.011187550000000001, "bootstrap_seed": 0, "agent_model": "gemini-3.1-pro-preview", "held_out_score": null, "criterion_names": ["key_points_captured", "conciseness", "faithful_to_source", "few_shot_format"], "per_criterion_scores": {"key_points_captured": 1.0, "conciseness": 1.0, "faithful_to_source": 0.4, "few_shot_format": 0.1}, "failure_classification": null, "drafts_generated": 1, "drafts_survived": 1}
{"id": "6689043c-3ae1-49de-9150-d4fc00efea82", "target_id": "B2-control", "git_sha": "41d7a24e4782382bffca14877ecbbeaee67b0188", "pre_experiment_sha": "9d2f7bf9050dbfc84afb495cfdf5487e562b28e9", "timestamp": "2026-04-22T06:36:57.220182+00:00", "hypothesis": "Gently refine the system instructions to request a clear single-paragraph summary and avoid external information without using rigid language or altering the few-shot examples.", "hypothesis_source": "agent", "mutation_diff_summary": "", "score": 3.0, "score_ci_lower": 2.2, "score_ci_upper": 3.8, "raw_scores": [2.0, 4.0, 4.0, 2.0, 3.0], "baseline_score": 2.5, "outcome": "KEPT", "failure_mode": null, "duration_seconds": 46.91461562504992, "tags": ["prompt-engineering", "gentle-refinement", "summarization"], "learnings": "{\"what_changed\":\"\",\"what_improved\":[],\"what_regressed\":[],\"transferable_insight\":\"Using gentle, non-rigid language in system instructions to enforce constraints and formatting can effectively guide model behavior while preserving existing few-shot examples.\",\"domain_tags\":[\"Prompt Engineering\",\"Instruction Tuning\",\"Constraint Satisfaction\"]}", "cost_usd": 0.011962450000000001, "bootstrap_seed": 0, "agent_model": "gemini-3.1-pro-preview", "held_out_score": null, "criterion_names": ["key_points_captured", "conciseness", "faithful_to_source", "few_shot_format"], "per_criterion_scores": {"key_points_captured": 1.0, "conciseness": 1.0, "faithful_to_source": 0.6, "few_shot_format": 0.4}, "failure_classification": null, "drafts_generated": 1, "drafts_survived": 1}
{"id": "7b93a175-d2dc-4829-838c-e1b681379e34", "target_id": "B2-control", "git_sha": "2e2504ae47facdd2dbfa0a43ea27daa2e27f9ae0", "pre_experiment_sha": "41d7a24e4782382bffca14877ecbbeaee67b0188", "timestamp": "2026-04-22T06:38:15.499582+00:00", "hypothesis": "Added the word \"clear\" to the prompt to gently encourage readability while keeping instructions straightforward and maintaining the exact few-shot examples.", "hypothesis_source": "agent", "mutation_diff_summary": "", "score": 3.0, "score_ci_lower": 2.3, "score_ci_upper": 3.7, "raw_scores": [2.0, 3.5, 2.0, 3.5, 4.0], "baseline_score": 3.0, "outcome": "KEPT", "failure_mode": null, "duration_seconds": 70.35359908314422, "tags": ["prompt-engineering", "gentle-refinement"], "learnings": "{\"what_changed\":\"\",\"what_improved\":[],\"what_regressed\":[],\"transferable_insight\":\"Adding minor qualitative adjectives to instructions often yields neutral results without impacting measurable performance.\",\"domain_tags\":[\"Prompt Engineering\",\"Instruction Tuning\"]}", "cost_usd": 0.01183685, "bootstrap_seed": 0, "agent_model": "gemini-3.1-pro-preview", "held_out_score": null, "criterion_names": ["key_points_captured", "conciseness", "faithful_to_source", "few_shot_format"], "per_criterion_scores": {"key_points_captured": 1.0, "conciseness": 1.0, "faithful_to_source": 0.6, "few_shot_format": 0.4}, "failure_classification": null, "drafts_generated": 1, "drafts_survived": 1}
{"id": "2ad9666d-0604-417c-b0a1-37efc4886f89", "target_id": "B2-control", "git_sha": "74d063611b9fee0878fc11e964ffa7cb65385942", "pre_experiment_sha": "2e2504ae47facdd2dbfa0a43ea27daa2e27f9ae0", "timestamp": "2026-04-22T06:39:46.027236+00:00", "hypothesis": "Refining the prompt to gently and directly request a \"clear single-paragraph summary\" and instruct the model to \"avoid external information\" without rigid rules or modifying few-shot examples.", "hypothesis_source": "agent", "mutation_diff_summary": "", "score": 2.9, "score_ci_lower": 2.1, "score_ci_upper": 3.7, "raw_scores": [2.0, 2.5, 4.0, 2.0, 4.0], "baseline_score": 3.0, "outcome": "KEPT", "failure_mode": null, "duration_seconds": 48.51315804081969, "tags": ["prompt-tuning", "gentle-instructions", "simplification"], "learnings": "{\"what_changed\":\"\",\"what_improved\":[],\"what_regressed\":[],\"transferable_insight\":\"Replacing rigid constraints with gentle, direct instructions can maintain acceptable performance while simplifying system design.\",\"domain_tags\":[\"Prompt Engineering\",\"Constraint Management\"]}", "cost_usd": 0.012005, "bootstrap_seed": 0, "agent_model": "gemini-3.1-pro-preview", "held_out_score": null, "criterion_names": ["key_points_captured", "conciseness", "faithful_to_source", "few_shot_format"], "per_criterion_scores": {"key_points_captured": 1.0, "conciseness": 1.0, "faithful_to_source": 0.5, "few_shot_format": 0.4}, "failure_classification": null, "drafts_generated": 1, "drafts_survived": 1}
{"id": "8bc69e9f-5687-4072-97e1-9cdff0b29f3d", "target_id": "B2-control", "git_sha": "d9806080a8f40325d7c7038d3a1796b837732c17", "pre_experiment_sha": "74d063611b9fee0878fc11e964ffa7cb65385942", "timestamp": "2026-04-22T06:41:17.259421+00:00", "hypothesis": "Gently refine the system prompt by asking the model to \"avoid adding external information\" to maintain faithfulness while keeping the instructions soft and simple.", "hypothesis_source": "agent", "mutation_diff_summary": "", "score": 3.2, "score_ci_lower": 2.4, "score_ci_upper": 4.0, "raw_scores": [2.0, 4.0, 4.0, 2.0, 4.0], "baseline_score": 2.9, "outcome": "KEPT", "failure_mode": null, "duration_seconds": 63.75784224993549, "tags": ["prompt-tuning", "gentle-instructions"], "learnings": "{\"what_changed\":\"\",\"what_improved\":[],\"what_regressed\":[],\"transferable_insight\":\"Soft, explicit constraints against including external information can effectively improve output faithfulness while maintaining prompt simplicity.\",\"domain_tags\":[\"Prompt Engineering\",\"Faithfulness\",\"Hallucination Reduction\"]}", "cost_usd": 0.012540750000000002, "bootstrap_seed": 0, "agent_model": "gemini-3.1-pro-preview", "held_out_score": null, "criterion_names": ["key_points_captured", "conciseness", "faithful_to_source", "few_shot_format"], "per_criterion_scores": {"key_points_captured": 1.0, "conciseness": 1.0, "faithful_to_source": 0.6, "few_shot_format": 0.6}, "failure_classification": null, "drafts_generated": 1, "drafts_survived": 1}
