{"id": "18a0fab5-4a8e-4491-a63a-f107604469e3", "target_id": "B2-control", "git_sha": "1b76bb74cef7d63eef3f7f58a9c6877fd39b41a1", "pre_experiment_sha": "1b76bb74cef7d63eef3f7f58a9c6877fd39b41a1", "timestamp": "2026-04-24T04:09:02.887218+00:00", "hypothesis": "Replacing the strict negative constraint with a gentle, positive framing will reduce semantic drift and improve the binary criteria score.", "hypothesis_source": "agent", "mutation_diff_summary": "", "score": 2.7, "score_ci_lower": 2.1, "score_ci_upper": 3.3, "raw_scores": [3.5, 2.5, 2.0, 2.0, 3.5], "baseline_score": 3.4, "outcome": "DISCARDED", "failure_mode": null, "duration_seconds": 46.28719349997118, "tags": ["gentle-framing", "positive-constraint"], "learnings": "{\"what_changed\":\"\",\"what_improved\":[],\"what_regressed\":[],\"transferable_insight\":\"Replacing strict negative constraints with gentle, positive framing degrades performance, demonstrating that explicit negative boundaries are more effective for enforcing strict adherence to criteria.\",\"domain_tags\":[\"Prompt Engineering\",\"Constraint Satisfaction\",\"Instruction Framing\"]}", "cost_usd": 0.011748800000000002, "bootstrap_seed": 0, "agent_model": "gemini-3.1-pro-preview", "held_out_score": null, "criterion_names": ["key_points_captured", "conciseness", "faithful_to_source", "few_shot_format"], "per_criterion_scores": {"key_points_captured": 1.0, "conciseness": 0.9, "faithful_to_source": 0.5, "few_shot_format": 0.3}, "failure_classification": {"category": "semantic_drift", "description": "The experiment hypothesized that a gentle, positive framing would reduce semantic drift and improve scores. The low score (2.7000) indicates that the new framing failed to achieve this, suggesting it either did not effectively resolve existing semantic ambiguities or inadvertently introduced new misinterpretations, leading to a divergence from the intended meaning.", "fix_direction": "Analyze the specific outputs or interpretations generated by the 'gentle, positive framing' to pinpoint where the semantic meaning diverged. Refine the positive phrasing to be more explicit, provide clarifying examples, or consider integrating guardrails that prevent misinterpretation while maintaining a positive tone. Evaluate if the 'gentle' aspect might have sacrificed necessary specificity.", "confidence": 0.95}, "drafts_generated": 1, "drafts_survived": 1}
{"id": "a81a57a3-518d-40ef-87be-0640b4d50216", "target_id": "B2-control", "git_sha": "1b76bb74cef7d63eef3f7f58a9c6877fd39b41a1", "pre_experiment_sha": "1b76bb74cef7d63eef3f7f58a9c6877fd39b41a1", "timestamp": "2026-04-24T04:10:15.805823+00:00", "hypothesis": "Replace the strict negative constraint with a gentle, positively framed instruction to avoid semantic drift and over-optimization.", "hypothesis_source": "agent", "mutation_diff_summary": "", "score": 3.0, "score_ci_lower": 2.4, "score_ci_upper": 3.6, "raw_scores": [3.0, 3.0, 4.0, 3.0, 2.0], "baseline_score": 3.4, "outcome": "DISCARDED", "failure_mode": null, "duration_seconds": 56.30655604088679, "tags": ["gentle-framing", "positive-constraints"], "learnings": "{\"what_changed\":\"\",\"what_improved\":[],\"what_regressed\":[],\"transferable_insight\":\"Replacing strict negative constraints with gentle, positive framing degrades performance, demonstrating that explicit negative boundaries are often necessary to prevent semantic drift.\",\"domain_tags\":[\"Prompt Engineering\",\"Constraint Satisfaction\"]}", "cost_usd": 0.012078250000000002, "bootstrap_seed": 0, "agent_model": "gemini-3.1-pro-preview", "held_out_score": null, "criterion_names": ["key_points_captured", "conciseness", "faithful_to_source", "few_shot_format"], "per_criterion_scores": {"key_points_captured": 0.9, "conciseness": 1.0, "faithful_to_source": 0.9, "few_shot_format": 0.2}, "failure_classification": {"category": "semantic_drift", "description": "The 'gentle, positively framed instruction,' while intended to guide, likely lacked the necessary specificity or robustness to adequately constrain the model's interpretation. This resulted in the model deviating from the intended semantic meaning of the desired output, even if it technically followed the positive framing. The new instruction might have been too broad, allowing for unintended interpretations that led to results no longer aligned with the original intent.", "fix_direction": "Future attempts should focus on making the positively framed instructions more precise and unambiguous, potentially through clearer definitions, illustrative examples, or subtle, context-specific guardrails. The goal is to ensure the positive guidance is strong enough to prevent semantic deviation without resorting to overly strict negative constraints.", "confidence": 0.9}, "drafts_generated": 1, "drafts_survived": 1}
{"id": "3781c081-3625-4557-91d8-40359e157dfb", "target_id": "B2-control", "git_sha": "1b76bb74cef7d63eef3f7f58a9c6877fd39b41a1", "pre_experiment_sha": "1b76bb74cef7d63eef3f7f58a9c6877fd39b41a1", "timestamp": "2026-04-24T04:11:41.245312+00:00", "hypothesis": "Replace the strict negative constraint with a gentle, positive framing to prevent hallucinations without causing semantic drift.", "hypothesis_source": "agent", "mutation_diff_summary": "", "score": 2.4, "score_ci_lower": 2.0, "score_ci_upper": 2.8, "raw_scores": [2.0, 2.0, 3.0, 2.0, 3.0], "baseline_score": 3.4, "outcome": "DISCARDED", "failure_mode": null, "duration_seconds": 59.249607417033985, "tags": ["positive-framing", "minimal-change"], "learnings": "{\"what_changed\":\"\",\"what_improved\":[],\"what_regressed\":[],\"transferable_insight\":\"Replacing explicit negative constraints with gentle positive framing degrades performance when attempting to strictly prevent hallucinations or enforce hard boundaries.\",\"domain_tags\":[\"Prompt Engineering\",\"Hallucination Mitigation\",\"Constraint Enforcement\"]}", "cost_usd": 0.010629750000000002, "bootstrap_seed": 0, "agent_model": "gemini-3.1-pro-preview", "held_out_score": null, "criterion_names": ["key_points_captured", "conciseness", "faithful_to_source", "few_shot_format"], "per_criterion_scores": {"key_points_captured": 1.0, "conciseness": 1.0, "faithful_to_source": 0.4, "few_shot_format": 0.0}, "failure_classification": {"category": "semantic_drift", "description": "The experiment aimed to prevent hallucinations without causing semantic drift. The low score (2.4) indicates that while the new 'gentle, positive framing' might have reduced hallucinations, it likely led to a degradation in the factual accuracy or intended meaning of the output, thus failing the critical condition of 'without causing semantic drift'. The model's interpretation under the new framing deviated from the desired semantic intent.", "fix_direction": "Refine the 'gentle, positive framing' to be more precise and less prone to misinterpretation by the model. Explore methods to explicitly ground the model's output in factual information or specific domains, even with positive framing. Consider a hybrid approach that combines positive framing with stricter semantic checks or targeted negative constraints to prevent meaning degradation.", "confidence": 0.95}, "drafts_generated": 1, "drafts_survived": 1}
{"id": "9e3de68d-8bed-494f-a9b0-49bacf8dbd7c", "target_id": "B2-control", "git_sha": "1b76bb74cef7d63eef3f7f58a9c6877fd39b41a1", "pre_experiment_sha": "1b76bb74cef7d63eef3f7f58a9c6877fd39b41a1", "timestamp": "2026-04-24T04:13:07.575963+00:00", "hypothesis": "Enhancing the persona by adding the word \"expert\" to the system prompt to improve output quality without altering constraints or rules.", "hypothesis_source": "agent", "mutation_diff_summary": "", "score": 2.4, "score_ci_lower": 2.1, "score_ci_upper": 2.7, "raw_scores": [3.0, 2.5, 2.0, 2.0, 2.5], "baseline_score": 3.4, "outcome": "DISCARDED", "failure_mode": null, "duration_seconds": 51.39069833396934, "tags": ["persona"], "learnings": "{\"what_changed\":\"\",\"what_improved\":[],\"what_regressed\":[],\"transferable_insight\":\"Simply appending authoritative labels like 'expert' to a persona without adding substantive instructions or constraints fails to improve output quality and may negatively impact performance.\",\"domain_tags\":[\"Prompt Engineering\",\"Persona Design\"]}", "cost_usd": 0.010671250000000002, "bootstrap_seed": 0, "agent_model": "gemini-3.1-pro-preview", "held_out_score": null, "criterion_names": ["key_points_captured", "conciseness", "faithful_to_source", "few_shot_format"], "per_criterion_scores": {"key_points_captured": 1.0, "conciseness": 1.0, "faithful_to_source": 0.4, "few_shot_format": 0.0}, "failure_classification": {"category": "semantic_drift", "description": "The 'expert' persona likely caused the model's output to drift in meaning, tone, or relevance from what constitutes 'quality' for the given task. While factually potentially correct, the output may have become overly verbose, condescending, technical, or misaligned with the intended audience or purpose, leading to a significantly low quality score.", "fix_direction": "Refine the persona description to be more specific about the desired characteristics of an 'expert' (e.g., 'concise expert,' 'empathetic expert,' 'expert for beginners'). Provide explicit instructions on desired tone, level of detail, and target audience. Consider adding negative constraints (e.g., 'do not be verbose') or examples of desired 'high quality' output.", "confidence": 0.9}, "drafts_generated": 1, "drafts_survived": 1}
{"id": "0f454602-9002-42ea-883e-1a0fff9a0d3f", "target_id": "B2-control", "git_sha": "50b527dbb5d5b051df6ff2a4164af03566e17cde", "pre_experiment_sha": "1b76bb74cef7d63eef3f7f58a9c6877fd39b41a1", "timestamp": "2026-04-24T04:14:16.404487+00:00", "hypothesis": "Add \"expert\" to the persona to improve the model's baseline performance without altering any rules or examples.", "hypothesis_source": "agent", "mutation_diff_summary": "", "score": 2.7, "score_ci_lower": 2.1, "score_ci_upper": 3.4, "raw_scores": [2.0, 3.0, 2.0, 4.0, 2.5], "baseline_score": 3.4, "outcome": "KEPT", "failure_mode": null, "duration_seconds": 48.16952700004913, "tags": ["persona", "minimal-change"], "learnings": "{\"what_changed\":\"\",\"what_improved\":[],\"what_regressed\":[],\"transferable_insight\":\"Simply assigning an 'expert' persona to a prompt without providing specific supporting rules or examples may degrade rather than improve quantitative baseline performance.\",\"domain_tags\":[\"Prompt Engineering\",\"Persona Design\"]}", "cost_usd": 0.01121045, "bootstrap_seed": 0, "agent_model": "gemini-3.1-pro-preview", "held_out_score": null, "criterion_names": ["key_points_captured", "conciseness", "faithful_to_source", "few_shot_format"], "per_criterion_scores": {"key_points_captured": 1.0, "conciseness": 1.0, "faithful_to_source": 0.5, "few_shot_format": 0.2}, "failure_classification": null, "drafts_generated": 1, "drafts_survived": 1}
{"id": "ab0f00ef-bb9f-4a67-bc47-12a331a8b866", "target_id": "B2-control", "git_sha": "d417b2acba04f140db955ce6ad036fb85c49648c", "pre_experiment_sha": "50b527dbb5d5b051df6ff2a4164af03566e17cde", "timestamp": "2026-04-24T04:15:33.412056+00:00", "hypothesis": "Adding Markdown headers to separate the role, task, and examples improves structural clarity and task framing without altering any constraints or few-shot examples.", "hypothesis_source": "agent", "mutation_diff_summary": "", "score": 2.3, "score_ci_lower": 2.0, "score_ci_upper": 2.9, "raw_scores": [2.0, 2.0, 2.0, 2.0, 3.5], "baseline_score": 2.7, "outcome": "KEPT", "failure_mode": null, "duration_seconds": 65.66882649995387, "tags": ["formatting", "headers", "structural-clarity"], "learnings": "{\"what_changed\":\"\",\"what_improved\":[],\"what_regressed\":[],\"transferable_insight\":\"Organizing prompt components with explicit structural markers like Markdown headers improves clarity and task framing without altering core constraints.\",\"domain_tags\":[\"Prompt Engineering\",\"Formatting\",\"Instruction Design\"]}", "cost_usd": 0.010751300000000002, "bootstrap_seed": 0, "agent_model": "gemini-3.1-pro-preview", "held_out_score": null, "criterion_names": ["key_points_captured", "conciseness", "faithful_to_source", "few_shot_format"], "per_criterion_scores": {"key_points_captured": 1.0, "conciseness": 1.0, "faithful_to_source": 0.2, "few_shot_format": 0.1}, "failure_classification": null, "drafts_generated": 1, "drafts_survived": 1}
{"id": "60c21bb5-2d11-4fa5-9fe8-0d31773ea6ac", "target_id": "B2-control", "git_sha": "05f477a56fd50aab50eedbc6dac61a811b192292", "pre_experiment_sha": "d417b2acba04f140db955ce6ad036fb85c49648c", "timestamp": "2026-04-24T04:16:46.661205+00:00", "hypothesis": "Refine the task objective by encouraging careful reading and analysis to improve processing without altering any hallucination constraints or few-shot examples.", "hypothesis_source": "agent", "mutation_diff_summary": "", "score": 2.3, "score_ci_lower": 2.0, "score_ci_upper": 2.7, "raw_scores": [2.0, 3.0, 2.5, 2.0, 2.0], "baseline_score": 2.3, "outcome": "KEPT", "failure_mode": null, "duration_seconds": 48.621254957979545, "tags": ["clarity", "minimal-mutation"], "learnings": "{\"what_changed\":\"\",\"what_improved\":[],\"what_regressed\":[],\"transferable_insight\":\"Adding generic instructions to encourage careful reading and analysis, without altering underlying constraints or examples, is unlikely to yield measurable performance improvements.\",\"domain_tags\":[\"Prompt Engineering\",\"Task Framing\"]}", "cost_usd": 0.0114771, "bootstrap_seed": 0, "agent_model": "gemini-3.1-pro-preview", "held_out_score": null, "criterion_names": ["key_points_captured", "conciseness", "faithful_to_source", "few_shot_format"], "per_criterion_scores": {"key_points_captured": 0.8, "conciseness": 1.0, "faithful_to_source": 0.4, "few_shot_format": 0.1}, "failure_classification": null, "drafts_generated": 1, "drafts_survived": 1}
{"id": "308f7199-cd78-4fd8-a575-06805938f1d1", "target_id": "B2-control", "git_sha": "0c597f0f8e36c68048b3c108a7598003fe1633d4", "pre_experiment_sha": "05f477a56fd50aab50eedbc6dac61a811b192292", "timestamp": "2026-04-24T04:17:47.577085+00:00", "hypothesis": "Encourage deeper processing by instructing the model to \"thoroughly analyze\" the article, aiming to improve summary quality without altering core constraints or examples.", "hypothesis_source": "agent", "mutation_diff_summary": "", "score": 3.1, "score_ci_lower": 2.4, "score_ci_upper": 3.8, "raw_scores": [4.0, 2.5, 4.0, 3.0, 2.0], "baseline_score": 2.3, "outcome": "KEPT", "failure_mode": null, "duration_seconds": 54.591654000105336, "tags": ["task-clarity", "minimal-mutation"], "learnings": "{\"what_changed\":\"\",\"what_improved\":[],\"what_regressed\":[],\"transferable_insight\":\"Explicitly instructing a model to thoroughly analyze the source material before generating its response encourages deeper processing and significantly improves output quality.\",\"domain_tags\":[\"Prompt Engineering\",\"Reasoning\",\"Task Instruction\"]}", "cost_usd": 0.0123873, "bootstrap_seed": 0, "agent_model": "gemini-3.1-pro-preview", "held_out_score": null, "criterion_names": ["key_points_captured", "conciseness", "faithful_to_source", "few_shot_format"], "per_criterion_scores": {"key_points_captured": 1.0, "conciseness": 1.0, "faithful_to_source": 0.7, "few_shot_format": 0.4}, "failure_classification": null, "drafts_generated": 1, "drafts_survived": 1}
{"id": "6559065b-33ed-4bae-9dcc-5a5a16ae9f3f", "target_id": "B2-control", "git_sha": "c922735c9eb6b83c1463f515e5e456d8f4d77132", "pre_experiment_sha": "0c597f0f8e36c68048b3c108a7598003fe1633d4", "timestamp": "2026-04-24T04:18:39.807150+00:00", "hypothesis": "Refine the task description for clarity and flow, encouraging careful analysis and a clear, concise summary without altering the core constraints or few-shot examples.", "hypothesis_source": "agent", "mutation_diff_summary": "", "score": 3.0, "score_ci_lower": 2.2, "score_ci_upper": 3.8, "raw_scores": [2.0, 3.0, 4.0, 2.0, 4.0], "baseline_score": 3.1, "outcome": "KEPT", "failure_mode": null, "duration_seconds": 46.510929625015706, "tags": ["task clarity", "prompt engineering"], "learnings": "{\"what_changed\":\"\",\"what_improved\":[],\"what_regressed\":[],\"transferable_insight\":\"Improving the clarity and flow of task instructions while explicitly encouraging concise analysis can enhance performance without requiring changes to underlying constraints or examples.\",\"domain_tags\":[\"Prompt Engineering\",\"Instruction Clarity\",\"Task Design\"]}", "cost_usd": 0.012274550000000002, "bootstrap_seed": 0, "agent_model": "gemini-3.1-pro-preview", "held_out_score": null, "criterion_names": ["key_points_captured", "conciseness", "faithful_to_source", "few_shot_format"], "per_criterion_scores": {"key_points_captured": 1.0, "conciseness": 1.0, "faithful_to_source": 0.6, "few_shot_format": 0.4}, "failure_classification": null, "drafts_generated": 1, "drafts_survived": 1}
{"id": "6e267be0-251f-4569-88e0-16aa81474fda", "target_id": "B2-control", "git_sha": "c922735c9eb6b83c1463f515e5e456d8f4d77132", "pre_experiment_sha": "c922735c9eb6b83c1463f515e5e456d8f4d77132", "timestamp": "2026-04-24T04:20:03.469802+00:00", "hypothesis": "Modify the Task section to explicitly encourage thorough analysis and careful reading without altering existing constraints or formatting.", "hypothesis_source": "agent", "mutation_diff_summary": "", "score": 2.4, "score_ci_lower": 2.0, "score_ci_upper": 3.2, "raw_scores": [2.0, 4.0, 2.0, 2.0, 2.0], "baseline_score": 3.0, "outcome": "DISCARDED", "failure_mode": null, "duration_seconds": 63.17941966699436, "tags": ["deep-processing", "thorough-analysis", "careful-reading"], "learnings": "{\"what_changed\":\"\",\"what_improved\":[],\"what_regressed\":[],\"transferable_insight\":\"Adding generic exhortations for thoroughness or careful reading to a prompt often degrades performance by diluting actionable constraints.\",\"domain_tags\":[\"Prompt Engineering\",\"Instruction Design\"]}", "cost_usd": 0.01098595, "bootstrap_seed": 0, "agent_model": "gemini-3.1-pro-preview", "held_out_score": null, "criterion_names": ["key_points_captured", "conciseness", "faithful_to_source", "few_shot_format"], "per_criterion_scores": {"key_points_captured": 1.0, "conciseness": 1.0, "faithful_to_source": 0.2, "few_shot_format": 0.2}, "failure_classification": {"category": "scope_violation", "description": "The experiment's hypothesis explicitly stated that the modification should be made \"without altering existing constraints or formatting.\" The low score suggests that the attempted modification likely violated these negative constraints by inadvertently changing some existing constraints or altering the formatting of the Task section, thus going beyond the permitted scope of edits.", "fix_direction": "Future attempts should prioritize strict adherence to the negative constraints. Implement robust validation mechanisms to ensure no changes are made to the existing constraints or formatting. The focus should be purely on additive or rephrasing edits that encourage analysis without structural or rule-based alterations.", "confidence": 0.85}, "drafts_generated": 1, "drafts_survived": 1}
{"id": "53b31087-0cf2-4ca6-9940-51d9e3c2c997", "target_id": "B2-control", "git_sha": "387fac762daf72b048bb6e185489eaa95eeb4217", "pre_experiment_sha": "c922735c9eb6b83c1463f515e5e456d8f4d77132", "timestamp": "2026-04-24T04:21:31.686920+00:00", "hypothesis": "Insert a concise, neutral instruction in the Task section to encourage deep cognitive processing, careful reading, and thorough analysis without modifying existing constraints.", "hypothesis_source": "agent", "mutation_diff_summary": "", "score": 3.5, "score_ci_lower": 2.9, "score_ci_upper": 4.0, "raw_scores": [3.0, 2.5, 4.0, 4.0, 4.0], "baseline_score": 3.0, "outcome": "KEPT", "failure_mode": null, "duration_seconds": 64.72928233281709, "tags": ["deep-processing", "task-instruction"], "learnings": "{\"what_changed\":\"\",\"what_improved\":[],\"what_regressed\":[],\"transferable_insight\":\"Adding a concise, neutral instruction that explicitly encourages deep cognitive processing and careful analysis improves performance without altering existing task constraints.\",\"domain_tags\":[\"Prompt Engineering\",\"Instruction Design\",\"Cognitive Processing\"]}", "cost_usd": 0.01458745, "bootstrap_seed": 0, "agent_model": "gemini-3.1-pro-preview", "held_out_score": null, "criterion_names": ["key_points_captured", "conciseness", "faithful_to_source", "few_shot_format"], "per_criterion_scores": {"key_points_captured": 0.9, "conciseness": 1.0, "faithful_to_source": 0.9, "few_shot_format": 0.7}, "failure_classification": null, "drafts_generated": 1, "drafts_survived": 1}
