{"id": "e5430414-20e6-46b2-a9dd-956d3335ebe8", "target_id": "B2-control", "git_sha": "dc69e0f487d0d7e6a06b092fce3321ea303b6420", "pre_experiment_sha": "dc69e0f487d0d7e6a06b092fce3321ea303b6420", "timestamp": "2026-04-19T17:53:13.425031+00:00", "hypothesis": "Rephrase the prompt into a single rigid two-sentence contract with stronger source-grounding and compression cues to reduce drift while preserving key facts.", "hypothesis_source": "agent", "mutation_diff_summary": "", "score": 2.2, "score_ci_lower": 1.3, "score_ci_upper": 3.1, "raw_scores": [2.5, 1.0, 4.0, 1.0, 2.5], "baseline_score": 2.4, "outcome": "DISCARDED", "failure_mode": null, "duration_seconds": 13.923013292020187, "tags": ["summarization", "format-control", "faithfulness", "concise", "source-grounded"], "learnings": "{\"what_changed\":\"\",\"what_improved\":[],\"what_regressed\":[\"conciseness: FAIL (was PASS)\"],\"transferable_insight\":\"Adding stricter formatting and grounding constraints can reduce drift, but over-constraining the prompt may hurt conciseness and overall quality.\",\"domain_tags\":[\"prompt-engineering\",\"instruction-design\"]}", "cost_usd": 0.024998950000000002, "bootstrap_seed": 0, "agent_model": "gpt-5.4", "held_out_score": null, "criterion_names": ["key_points_captured", "conciseness", "faithful_to_source", "few_shot_format"], "per_criterion_scores": {"key_points_captured": 0.9, "conciseness": 0.4, "faithful_to_source": 0.6, "few_shot_format": 0.3}, "failure_classification": {"category": "semantic_drift", "description": "The edit likely preserved the requested structure but introduced meaning changes (drift) relative to the original prompt content, suggesting the new compressed contract did not remain strictly source-grounded.", "fix_direction": "Tighten source-grounding by explicitly anchoring each retained fact to the original text, use a checklist of required entities/constraints to prevent paraphrase-induced changes, and verify meaning equivalence after compression.", "confidence": 0.62}, "drafts_generated": 1, "drafts_survived": 1}
{"id": "84c130c4-4202-45ff-9a7f-9b21b7481d70", "target_id": "B2-control", "git_sha": "dc69e0f487d0d7e6a06b092fce3321ea303b6420", "pre_experiment_sha": "dc69e0f487d0d7e6a06b092fce3321ea303b6420", "timestamp": "2026-04-19T17:53:36.061984+00:00", "hypothesis": "Compress the prompt into a single exact two-sentence contract that directly states both sentence roles and faithfulness constraints.", "hypothesis_source": "agent", "mutation_diff_summary": "", "score": 2.1, "score_ci_lower": 1.7, "score_ci_upper": 2.6, "raw_scores": [2.0, 3.0, 2.0, 2.0, 1.5], "baseline_score": 2.4, "outcome": "DISCARDED", "failure_mode": null, "duration_seconds": 17.791717042098753, "tags": ["two-sentence", "format-contract", "faithfulness", "concise"], "learnings": "{\"what_changed\":\"\",\"what_improved\":[\"conciseness: PASS (was FAIL)\"],\"what_regressed\":[\"faithful_to_source: FAIL (was PASS)\"],\"transferable_insight\":\"Making instructions more concise can improve brevity, but if the compression removes or weakens explicit fidelity constraints, performance can degrade even when the format is cleaner.\",\"domain_tags\":[\"prompt-design\",\"instruction-following\",\"evaluation\"]}", "cost_usd": 0.02222835, "bootstrap_seed": 0, "agent_model": "gpt-5.4", "held_out_score": null, "criterion_names": ["key_points_captured", "conciseness", "faithful_to_source", "few_shot_format"], "per_criterion_scores": {"key_points_captured": 0.9, "conciseness": 0.5, "faithful_to_source": 0.4, "few_shot_format": 0.3}, "failure_classification": {"category": "output_format", "description": "The requested task was to compress the prompt into a single exact two-sentence contract with explicit roles and faithfulness constraints, but the result did not satisfy the required strict output structure (exactly two sentences and/or contract-like specification).", "fix_direction": "Enforce the formatting constraints explicitly: generate exactly two sentences, ensure each sentence clearly states its role, and include unambiguous faithfulness constraints within those two sentences only (no extra sentences, no missing/partial constraints).", "confidence": 0.72}, "drafts_generated": 1, "drafts_survived": 1}
{"id": "bb6a04e9-c5a6-4e5a-828e-1ba2ab15da04", "target_id": "B2-control", "git_sha": "dc69e0f487d0d7e6a06b092fce3321ea303b6420", "pre_experiment_sha": "dc69e0f487d0d7e6a06b092fce3321ea303b6420", "timestamp": "2026-04-19T17:53:51.126309+00:00", "hypothesis": "Make the prompt a single exact two-sentence instruction plus article cue to improve stable format adherence without adding extra constraints.", "hypothesis_source": "agent", "mutation_diff_summary": "", "score": 1.7, "score_ci_lower": 1.1, "score_ci_upper": 2.4, "raw_scores": [1.5, 1.0, 1.0, 2.0, 3.0], "baseline_score": 2.4, "outcome": "DISCARDED", "failure_mode": null, "duration_seconds": 12.280175250023603, "tags": ["two-sentence", "format-contract", "faithfulness", "concise"], "learnings": "{\"what_changed\":\"\",\"what_improved\":[],\"what_regressed\":[],\"transferable_insight\":\"Simplifying an instruction into a rigidly bounded format does not necessarily improve compliance if it removes useful guidance without adding clarity or enforcement.\",\"domain_tags\":[\"prompting\",\"instruction-design\",\"format-adherence\"]}", "cost_usd": 0.02164335, "bootstrap_seed": 0, "agent_model": "gpt-5.4", "held_out_score": null, "criterion_names": ["key_points_captured", "conciseness", "faithful_to_source", "few_shot_format"], "per_criterion_scores": {"key_points_captured": 1.0, "conciseness": 0.5, "faithful_to_source": 0.2, "few_shot_format": 0.0}, "failure_classification": {"category": "output_format", "description": "The attempt appears to fail primarily due to not achieving the required stable output format/schema adherence; the score is low and the failure mode is unspecified, suggesting a formatting/structure mismatch rather than reasoning or syntax issues.", "fix_direction": "Focus on enforcing the exact required two-sentence instruction structure with the article cue, and verify the final response strictly matches the expected schema (section order, required fields, and formatting).", "confidence": 0.48}, "drafts_generated": 1, "drafts_survived": 1}
{"id": "80395e52-3ca6-4839-89b8-d2e4dda532a9", "target_id": "B2-control", "git_sha": "dfbf15d8a429ec41168b751572962346702bb4c4", "pre_experiment_sha": "dc69e0f487d0d7e6a06b092fce3321ea303b6420", "timestamp": "2026-04-19T17:54:06.937639+00:00", "hypothesis": "Make the prompt a single exact two-sentence instruction plus article cue to strengthen rigid format adherence while preserving faithfulness.", "hypothesis_source": "agent", "mutation_diff_summary": "", "score": 2.2, "score_ci_lower": 1.6, "score_ci_upper": 2.9, "raw_scores": [2.0, 1.5, 3.5, 2.5, 1.5], "baseline_score": 2.4, "outcome": "KEPT", "failure_mode": null, "duration_seconds": 13.368368500028737, "tags": ["two-sentence", "format-contract", "faithfulness", "concise"], "learnings": "{\"what_changed\":\"\",\"what_improved\":[\"faithful_to_source: PASS (was FAIL)\"],\"what_regressed\":[\"conciseness: FAIL (was PASS)\"],\"transferable_insight\":\"When exact format compliance is critical, constraining the instruction to a minimal, rigid structure can improve fidelity to the source even if it slightly reduces conciseness.\",\"domain_tags\":[\"prompt-engineering\",\"instruction-following\",\"format-control\"]}", "cost_usd": 0.02375115, "bootstrap_seed": 0, "agent_model": "gpt-5.4", "held_out_score": null, "criterion_names": ["key_points_captured", "conciseness", "faithful_to_source", "few_shot_format"], "per_criterion_scores": {"key_points_captured": 0.9, "conciseness": 0.3, "faithful_to_source": 0.6, "few_shot_format": 0.4}, "failure_classification": null, "drafts_generated": 1, "drafts_survived": 1}
{"id": "fcc963ee-1942-443b-b4b8-8a748b1f8ffa", "target_id": "B2-control", "git_sha": "dfbf15d8a429ec41168b751572962346702bb4c4", "pre_experiment_sha": "dfbf15d8a429ec41168b751572962346702bb4c4", "timestamp": "2026-04-19T17:54:23.920159+00:00", "hypothesis": "Make the prompt a minimal literal two-sentence contract while keeping the article cue outside the contract.", "hypothesis_source": "agent", "mutation_diff_summary": "", "score": 1.6, "score_ci_lower": 1.2, "score_ci_upper": 2.0, "raw_scores": [2.0, 1.0, 2.0, 2.0, 1.0], "baseline_score": 2.2, "outcome": "DISCARDED", "failure_mode": null, "duration_seconds": 14.14461008401122, "tags": ["two-sentence", "format-contract", "faithfulness", "concise"], "learnings": "{\"what_changed\":\"\",\"what_improved\":[\"conciseness: PASS (was FAIL)\"],\"what_regressed\":[\"faithful_to_source: FAIL (was PASS)\"],\"transferable_insight\":\"Reducing instructions to a minimal contract can improve conciseness, but moving essential context outside that contract can weaken fidelity to the source.\",\"domain_tags\":[\"prompt-design\",\"information-fidelity\",\"conciseness\"]}", "cost_usd": 0.021553550000000005, "bootstrap_seed": 0, "agent_model": "gpt-5.4", "held_out_score": null, "criterion_names": ["key_points_captured", "conciseness", "faithful_to_source", "few_shot_format"], "per_criterion_scores": {"key_points_captured": 0.8, "conciseness": 0.6, "faithful_to_source": 0.1, "few_shot_format": 0.1}, "failure_classification": {"category": "logic_error", "description": "The provided metadata (Hypothesis, Failure Mode: unknown, Score: 1.6000) does not indicate a concrete type of failure (e.g., format/schema violation, logic/meaning error, scope breach, syntax issue, or incomplete edit). Without the actual failed output or error details, the failure mode cannot be confidently mapped to one of the listed categories.", "fix_direction": "Provide the model\u2019s failed output (or diff) and any validation/error messages so the failure can be classified by whether it violates output structure, meaning, scope, syntax/parsing, or partial/inconsistent editing.", "confidence": 0.12}, "drafts_generated": 1, "drafts_survived": 1}
{"id": "5c846d9b-10ab-49fe-a946-be08b37d6aa5", "target_id": "B2-control", "git_sha": "dfbf15d8a429ec41168b751572962346702bb4c4", "pre_experiment_sha": "dfbf15d8a429ec41168b751572962346702bb4c4", "timestamp": "2026-04-19T17:54:40.453289+00:00", "hypothesis": "Compress the prompt into one exact two-sentence contract that keeps explicit sentence roles and strict source-only faithfulness while minimizing extra wording.", "hypothesis_source": "agent", "mutation_diff_summary": "", "score": 2.1, "score_ci_lower": 1.4, "score_ci_upper": 2.7, "raw_scores": [2.5, 3.0, 1.0, 1.5, 2.5], "baseline_score": 2.2, "outcome": "DISCARDED", "failure_mode": null, "duration_seconds": 13.460871958057396, "tags": ["two-sentence", "format-contract", "faithfulness", "concise"], "learnings": "{\"what_changed\":\"\",\"what_improved\":[\"faithful_to_source: PASS (was FAIL)\"],\"what_regressed\":[\"conciseness: FAIL (was PASS)\"],\"transferable_insight\":\"When tightening a specification, preserving explicit role structure and source fidelity can improve correctness even if it adds enough wording to hurt conciseness.\",\"domain_tags\":[\"prompt-design\",\"specification\",\"information-compression\"]}", "cost_usd": 0.024660550000000003, "bootstrap_seed": 0, "agent_model": "gpt-5.4", "held_out_score": null, "criterion_names": ["key_points_captured", "conciseness", "faithful_to_source", "few_shot_format"], "per_criterion_scores": {"key_points_captured": 0.9, "conciseness": 0.2, "faithful_to_source": 0.7, "few_shot_format": 0.3}, "failure_classification": {"category": "incomplete_edit", "description": "The experiment\u2019s contents are not a valid attempt at performing the requested transformation; the provided result includes meta-fields (e.g., Hypothesis/Failure Mode/Score/Categories) rather than outputting the required single two-sentence contract. This indicates a partial or improperly completed edit, leaving the response in an inconsistent/noncompliant state relative to the target task.", "fix_direction": "Ensure the final output is exactly one precise two-sentence contract, preserving explicit sentence roles and strict source-only faithfulness, with minimal extra wording, and avoid including task/extraneous metadata in the final response.", "confidence": 0.78}, "drafts_generated": 1, "drafts_survived": 1}
{"id": "a78b0db4-29c2-47b9-a96b-47ac9bf47a3d", "target_id": "B2-control", "git_sha": "a167278fcaa8c465095d17bf5420b6c132229bf1", "pre_experiment_sha": "dfbf15d8a429ec41168b751572962346702bb4c4", "timestamp": "2026-04-19T17:55:04.010745+00:00", "hypothesis": "Use a shorter exact two-sentence contract that keeps explicit sentence roles and strict source-only limits while preserving the article cue.", "hypothesis_source": "agent", "mutation_diff_summary": "", "score": 2.3, "score_ci_lower": 2.0, "score_ci_upper": 2.9, "raw_scores": [3.5, 2.0, 2.0, 2.0, 2.0], "baseline_score": 2.2, "outcome": "KEPT", "failure_mode": null, "duration_seconds": 20.275544083095156, "tags": ["two-sentence", "format-contract", "faithfulness", "concise"], "learnings": "{\"what_changed\":\"\",\"what_improved\":[\"conciseness: PASS (was FAIL)\"],\"what_regressed\":[],\"transferable_insight\":\"When a task has strict source-only constraints, compressing the instruction into fewer exact sentences while preserving explicit role cues can improve compliance without sacrificing clarity.\",\"domain_tags\":[\"prompt-engineering\",\"instruction-design\",\"constraint-satisfaction\"]}", "cost_usd": 0.02328455, "bootstrap_seed": 0, "agent_model": "gpt-5.4", "held_out_score": null, "criterion_names": ["key_points_captured", "conciseness", "faithful_to_source", "few_shot_format"], "per_criterion_scores": {"key_points_captured": 0.9, "conciseness": 0.5, "faithful_to_source": 0.6, "few_shot_format": 0.3}, "failure_classification": null, "drafts_generated": 1, "drafts_survived": 1}
{"id": "23894eb0-9930-4a2b-af8f-a546051ad772", "target_id": "B2-control", "git_sha": "a167278fcaa8c465095d17bf5420b6c132229bf1", "pre_experiment_sha": "a167278fcaa8c465095d17bf5420b6c132229bf1", "timestamp": "2026-04-19T17:55:22.757228+00:00", "hypothesis": "Tighten the two-sentence contract further by using simpler fixed role wording and stricter source-only language to improve format adherence.", "hypothesis_source": "agent", "mutation_diff_summary": "", "score": 1.4, "score_ci_lower": 0.6, "score_ci_upper": 2.4, "raw_scores": [1.0, 1.0, 0.0, 2.0, 3.0], "baseline_score": 2.3, "outcome": "DISCARDED", "failure_mode": null, "duration_seconds": 15.097195583977737, "tags": ["two-sentence", "format-contract", "faithfulness", "concise"], "learnings": "{\"what_changed\":\"\",\"what_improved\":[],\"what_regressed\":[\"conciseness: FAIL (was PASS)\",\"faithful_to_source: FAIL (was PASS)\"],\"transferable_insight\":\"Making instructions more rigid can reduce adherence if it adds wording that is longer or less aligned with the source, so simplification should preserve brevity and fidelity together.\",\"domain_tags\":[\"instruction-design\",\"evaluation\",\"communication\"]}", "cost_usd": 0.02255135, "bootstrap_seed": 0, "agent_model": "gpt-5.4", "held_out_score": null, "criterion_names": ["key_points_captured", "conciseness", "faithful_to_source", "few_shot_format"], "per_criterion_scores": {"key_points_captured": 0.8, "conciseness": 0.4, "faithful_to_source": 0.2, "few_shot_format": 0.0}, "failure_classification": {"category": "output_format", "description": "The attempt was intended to tighten wording/constraints, but the result did not meet the required output structure/schema, indicating a format adherence failure rather than a pure logic or meaning error.", "fix_direction": "Focus on matching the exact required output schema/field structure (including required sections, ordering, and any fixed strings), then apply wording simplifications only within those constraints.", "confidence": 0.62}, "drafts_generated": 1, "drafts_survived": 1}
{"id": "2b8c8abc-5dc4-43f5-91f9-99d8037d0ede", "target_id": "B2-control", "git_sha": "0e35eb303af27f90d18245940e60c280360aee59", "pre_experiment_sha": "a167278fcaa8c465095d17bf5420b6c132229bf1", "timestamp": "2026-04-19T17:55:39.013821+00:00", "hypothesis": "Shorten the contract further while keeping explicit sentence roles and strict source-only wording to improve format adherence without losing faithfulness.", "hypothesis_source": "agent", "mutation_diff_summary": "", "score": 2.2, "score_ci_lower": 1.6, "score_ci_upper": 2.9, "raw_scores": [1.5, 1.5, 3.5, 2.5, 2.0], "baseline_score": 2.3, "outcome": "KEPT", "failure_mode": null, "duration_seconds": 13.796962291002274, "tags": ["two-sentence", "format-contract", "faithfulness", "concise"], "learnings": "{\"what_changed\":\"\",\"what_improved\":[\"conciseness: PASS (was FAIL)\",\"faithful_to_source: PASS (was FAIL)\"],\"what_regressed\":[],\"transferable_insight\":\"Reducing wording while preserving explicit role labels and strict source-only constraints can improve adherence and faithfulness at the same time.\",\"domain_tags\":[\"prompt-design\",\"format-adherence\",\"faithfulness\"]}", "cost_usd": 0.022494950000000003, "bootstrap_seed": 0, "agent_model": "gpt-5.4", "held_out_score": null, "criterion_names": ["key_points_captured", "conciseness", "faithful_to_source", "few_shot_format"], "per_criterion_scores": {"key_points_captured": 1.0, "conciseness": 0.5, "faithful_to_source": 0.5, "few_shot_format": 0.2}, "failure_classification": null, "drafts_generated": 1, "drafts_survived": 1}
{"id": "baaddc13-3833-42e8-9208-9fbec6a8dbe2", "target_id": "B2-control", "git_sha": "081598921945cdf515ed0ee910fa300232ae73ac", "pre_experiment_sha": "0e35eb303af27f90d18245940e60c280360aee59", "timestamp": "2026-04-19T17:55:53.494859+00:00", "hypothesis": "Use the shortest stable two-sentence contract that explicitly fixes both sentence roles and source-only faithfulness while preserving the article cue.", "hypothesis_source": "agent", "mutation_diff_summary": "", "score": 2.1, "score_ci_lower": 1.1, "score_ci_upper": 3.2, "raw_scores": [1.5, 1.0, 4.0, 1.0, 3.0], "baseline_score": 2.2, "outcome": "KEPT", "failure_mode": null, "duration_seconds": 13.426024958025664, "tags": ["two-sentence", "format-contract", "faithfulness", "concise"], "learnings": "{\"what_changed\":\"\",\"what_improved\":[],\"what_regressed\":[\"conciseness: FAIL (was PASS)\",\"faithful_to_source: FAIL (was PASS)\"],\"transferable_insight\":\"When tightening a contract, preserve the minimal cues that anchor role assignment and source fidelity, because over-compression can break both clarity and faithfulness.\",\"domain_tags\":[\"prompt-design\",\"information-preservation\",\"conciseness\"]}", "cost_usd": 0.02282035, "bootstrap_seed": 0, "agent_model": "gpt-5.4", "held_out_score": null, "criterion_names": ["key_points_captured", "conciseness", "faithful_to_source", "few_shot_format"], "per_criterion_scores": {"key_points_captured": 1.0, "conciseness": 0.4, "faithful_to_source": 0.4, "few_shot_format": 0.3}, "failure_classification": null, "drafts_generated": 1, "drafts_survived": 1}
{"id": "09daee4d-26c6-400a-af97-4471873223c0", "target_id": "B2-control", "git_sha": "081598921945cdf515ed0ee910fa300232ae73ac", "pre_experiment_sha": "081598921945cdf515ed0ee910fa300232ae73ac", "timestamp": "2026-04-19T17:56:09.023257+00:00", "hypothesis": "Use a shorter, stricter two-sentence contract that fixes sentence roles and source-only limits while preserving the article cue.", "hypothesis_source": "agent", "mutation_diff_summary": "", "score": 1.7, "score_ci_lower": 1.1, "score_ci_upper": 2.4, "raw_scores": [2.0, 3.0, 1.5, 1.0, 1.0], "baseline_score": 2.1, "outcome": "DISCARDED", "failure_mode": null, "duration_seconds": 12.573766999994405, "tags": ["two-sentence", "format-contract", "faithfulness", "concise"], "learnings": "{\"what_changed\":\"\",\"what_improved\":[\"conciseness: PASS (was FAIL)\"],\"what_regressed\":[],\"transferable_insight\":\"When tightening a specification, reducing verbosity can help, but only if the remaining constraints still preserve the essential cues and role distinctions needed for correct interpretation.\",\"domain_tags\":[\"prompt-design\",\"specification\",\"communication\"]}", "cost_usd": 0.021363550000000005, "bootstrap_seed": 0, "agent_model": "gpt-5.4", "held_out_score": null, "criterion_names": ["key_points_captured", "conciseness", "faithful_to_source", "few_shot_format"], "per_criterion_scores": {"key_points_captured": 0.8, "conciseness": 0.7, "faithful_to_source": 0.2, "few_shot_format": 0.0}, "failure_classification": {"category": "incomplete_edit", "description": "The attempt appears to only partially implement the intended contract constraints (two-sentence, stricter role fixing, and source-only limits), leaving an inconsistent or incomplete application of the required structure/constraints.", "fix_direction": "Tighten the edit to fully enforce all specified constraints at once: exactly two sentences, explicit role assignments for each sentence, and a strict source-only constraint while keeping the required article cue intact.", "confidence": 0.55}, "drafts_generated": 1, "drafts_survived": 1}
