{"id": "ea4e7c67-608e-43ac-8cec-0ffd4a15cecf", "target_id": "B2-control", "git_sha": "4a45d2bb2dc1733f8364c1d2df1f85e142fbf641", "pre_experiment_sha": "3b452d4d4a3bc0f302632065ef61cb2ba6a6552a", "timestamp": "2026-04-19T17:41:46.014146+00:00", "hypothesis": "Make the prompt specify a single consistent output format and stricter faithfulness/compression rules to improve summary scoring.", "hypothesis_source": "agent", "mutation_diff_summary": "", "score": 2.3, "score_ci_lower": 1.6, "score_ci_upper": 3.0, "raw_scores": [2.0, 3.0, 1.5, 1.5, 3.5], "baseline_score": 0.0, "outcome": "KEPT", "failure_mode": null, "duration_seconds": 19.432754209032282, "tags": ["summarization", "few-shot", "format-control", "faithfulness"], "learnings": "{\"what_changed\":\"\",\"what_improved\":[],\"what_regressed\":[],\"transferable_insight\":\"When a task requires summarization or transformation, explicitly enforcing one stable output format and tighter fidelity/compression constraints can improve quality by reducing ambiguity and omission.\",\"domain_tags\":[\"prompt-engineering\",\"summarization\",\"information-extraction\"]}", "cost_usd": 0.02371955, "bootstrap_seed": 0, "agent_model": "gpt-5.4", "held_out_score": null, "criterion_names": ["key_points_captured", "conciseness", "faithful_to_source", "few_shot_format"], "per_criterion_scores": {"key_points_captured": 0.9, "conciseness": 0.4, "faithful_to_source": 0.8, "few_shot_format": 0.2}, "failure_classification": null, "drafts_generated": 1, "drafts_survived": 1}
{"id": "578dfde7-35e0-4236-a6c0-6577e47903d3", "target_id": "B2-control", "git_sha": "4a45d2bb2dc1733f8364c1d2df1f85e142fbf641", "pre_experiment_sha": "4a45d2bb2dc1733f8364c1d2df1f85e142fbf641", "timestamp": "2026-04-19T17:42:09.605500+00:00", "hypothesis": "Tightening the output schema with explicit sentence-count, neutrality, and failure-avoidance rules plus stronger few-shot style consistency will improve binary criteria adherence.", "hypothesis_source": "agent", "mutation_diff_summary": "", "score": 2.2, "score_ci_lower": 1.6, "score_ci_upper": 2.9, "raw_scores": [2.5, 2.0, 3.5, 1.5, 1.5], "baseline_score": 2.3, "outcome": "DISCARDED", "failure_mode": null, "duration_seconds": 22.44867433293257, "tags": ["format-control", "constraints", "few-shot", "summarization"], "learnings": "{\"what_changed\":\"\",\"what_improved\":[],\"what_regressed\":[],\"transferable_insight\":\"Adding more explicit constraints and examples does not guarantee better compliance when the underlying task framing or model behavior is already misaligned, so schema tightening should be validated empirically rather than assumed to help.\",\"domain_tags\":[\"prompt-engineering\",\"evaluation\",\"instruction-following\"]}", "cost_usd": 0.028698950000000004, "bootstrap_seed": 0, "agent_model": "gpt-5.4", "held_out_score": null, "criterion_names": ["key_points_captured", "conciseness", "faithful_to_source", "few_shot_format"], "per_criterion_scores": {"key_points_captured": 0.9, "conciseness": 0.4, "faithful_to_source": 0.7, "few_shot_format": 0.2}, "failure_classification": {"category": "output_format", "description": "The experiment was intended to tighten schema adherence, but it resulted in a low/failed score (2.2) with an unknown failure mode, strongly suggesting the model did not follow the required output structure/rules reliably (e.g., missing/incorrect formatting constraints).", "fix_direction": "Increase enforcement of output structure via constrained generation (strict JSON/field checks), add explicit validator-style instructions, and use few-shot examples that exactly match the required schema including edge cases.", "confidence": 0.56}, "drafts_generated": 1, "drafts_survived": 1}
{"id": "63810cb0-dd90-4549-9d43-f5c59a64bcca", "target_id": "B2-control", "git_sha": "4a45d2bb2dc1733f8364c1d2df1f85e142fbf641", "pre_experiment_sha": "4a45d2bb2dc1733f8364c1d2df1f85e142fbf641", "timestamp": "2026-04-19T17:42:31.327986+00:00", "hypothesis": "Tightening the output contract with explicit failure-avoidance rules and a stronger summary template will improve compliance and factual compression.", "hypothesis_source": "agent", "mutation_diff_summary": "", "score": 1.9, "score_ci_lower": 1.3, "score_ci_upper": 2.7, "raw_scores": [1.5, 2.0, 3.5, 1.5, 1.0], "baseline_score": 2.3, "outcome": "DISCARDED", "failure_mode": null, "duration_seconds": 19.09864604100585, "tags": ["summarization", "format-control", "few-shot", "constraint-clarity"], "learnings": "{\"what_changed\":\"\",\"what_improved\":[],\"what_regressed\":[],\"transferable_insight\":\"Adding stricter formatting constraints can reduce flexibility without improving accuracy or concision, so contract tightening should be validated rather than assumed beneficial.\",\"domain_tags\":[\"prompt-design\",\"quality-control\",\"evaluation\"]}", "cost_usd": 0.024810150000000003, "bootstrap_seed": 0, "agent_model": "gpt-5.4", "held_out_score": null, "criterion_names": ["key_points_captured", "conciseness", "faithful_to_source", "few_shot_format"], "per_criterion_scores": {"key_points_captured": 0.8, "conciseness": 0.6, "faithful_to_source": 0.3, "few_shot_format": 0.2}, "failure_classification": {"category": "output_format", "description": "The experiment\u2019s result appears to have failed compliance with the required output structure/schema (low score with failure mode marked as unknown suggests formatting/nonconformance rather than a clear logic issue).", "fix_direction": "Strengthen adherence to the required output schema: enforce a rigid template, validate required fields/types before returning, and add explicit guardrails to prevent missing/extra keys or malformed structure.", "confidence": 0.42}, "drafts_generated": 1, "drafts_survived": 1}
{"id": "aebd16cb-250d-4b74-ad0f-f3720cba8a80", "target_id": "B2-control", "git_sha": "4a45d2bb2dc1733f8364c1d2df1f85e142fbf641", "pre_experiment_sha": "4a45d2bb2dc1733f8364c1d2df1f85e142fbf641", "timestamp": "2026-04-19T17:42:57.068738+00:00", "hypothesis": "A single rigid two-sentence template with explicit faithfulness and compression rules will improve format compliance and factual summaries.", "hypothesis_source": "agent", "mutation_diff_summary": "", "score": 2.5, "score_ci_lower": 2.0, "score_ci_upper": 3.1, "raw_scores": [2.0, 2.0, 3.5, 2.0, 3.0], "baseline_score": 2.3, "outcome": "DISCARDED", "failure_mode": null, "duration_seconds": 21.181294209090993, "tags": ["format", "faithfulness", "compression", "schema"], "learnings": "{\"what_changed\":\"\",\"what_improved\":[],\"what_regressed\":[],\"transferable_insight\":\"Explicitly constraining both content fidelity and brevity in a fixed response template can improve adherence to the desired output format, even when the overall experiment does not yield a strong outcome.\",\"domain_tags\":[\"prompt-design\",\"information-compression\",\"format-compliance\"]}", "cost_usd": 0.024628350000000004, "bootstrap_seed": 0, "agent_model": "gpt-5.4", "held_out_score": null, "criterion_names": ["key_points_captured", "conciseness", "faithful_to_source", "few_shot_format"], "per_criterion_scores": {"key_points_captured": 1.0, "conciseness": 0.8, "faithful_to_source": 0.5, "few_shot_format": 0.2}, "failure_classification": {"category": "output_format", "description": "The experiment failed to meet the required output structure/schema for the formatted response (format compliance was not achieved).", "fix_direction": "Ensure the response strictly follows the required template/JSON/schema structure, validate against the expected fields/order, and add explicit formatting checks before scoring.", "confidence": 0.42}, "drafts_generated": 1, "drafts_survived": 1}
{"id": "f8bc27c8-6a46-4c16-bea9-58bf71118bba", "target_id": "B2-control", "git_sha": "4a45d2bb2dc1733f8364c1d2df1f85e142fbf641", "pre_experiment_sha": "4a45d2bb2dc1733f8364c1d2df1f85e142fbf641", "timestamp": "2026-04-19T17:43:19.113012+00:00", "hypothesis": "A single rigid two-sentence schema with explicit sentence roles and stricter faithfulness/compression rules will improve consistency and binary criteria adherence.", "hypothesis_source": "agent", "mutation_diff_summary": "", "score": 2.1, "score_ci_lower": 1.4, "score_ci_upper": 2.8, "raw_scores": [3.0, 1.5, 3.0, 2.0, 1.0], "baseline_score": 2.3, "outcome": "DISCARDED", "failure_mode": null, "duration_seconds": 19.15214812499471, "tags": ["format-lock", "faithfulness", "compression", "schema"], "learnings": "{\"what_changed\":\"\",\"what_improved\":[],\"what_regressed\":[],\"transferable_insight\":\"Adding rigid structure and explicit role constraints can improve consistency, but if the schema is too restrictive it may fail to produce measurable gains and should be validated against the target criteria.\",\"domain_tags\":[\"prompt-design\",\"evaluation\",\"process-design\"]}", "cost_usd": 0.024716350000000005, "bootstrap_seed": 0, "agent_model": "gpt-5.4", "held_out_score": null, "criterion_names": ["key_points_captured", "conciseness", "faithful_to_source", "few_shot_format"], "per_criterion_scores": {"key_points_captured": 0.8, "conciseness": 0.6, "faithful_to_source": 0.4, "few_shot_format": 0.3}, "failure_classification": {"category": "logic_error", "description": "The provided information (hypothesis, unknown failure mode, and a score of 2.1) does not include any details about what specifically failed\u2014e.g., whether the output violated the required structure, produced incorrect reasoning, regressed a criterion, edited outside scope, had syntax issues, drifted semantically, or left an incomplete/inconsistent change.", "fix_direction": "Run the experiment again with instrumentation: capture the exact failing symptom (format errors, criterion check results, diffs vs expected output, and any parse/validation errors) so the failure can be mapped to one of the listed categories, then tighten the corresponding constraint (format/schema, logic, scope, syntax, semantics, or atomicity).", "confidence": 0.05}, "drafts_generated": 1, "drafts_survived": 1}
{"id": "fa8f0a75-7f21-4381-a19f-2cca1d1b8387", "target_id": "B2-control", "git_sha": "4a45d2bb2dc1733f8364c1d2df1f85e142fbf641", "pre_experiment_sha": "4a45d2bb2dc1733f8364c1d2df1f85e142fbf641", "timestamp": "2026-04-19T17:43:42.427620+00:00", "hypothesis": "A single explicit two-sentence template with strict faithfulness and compression rules will improve consistency and binary criteria adherence.", "hypothesis_source": "agent", "mutation_diff_summary": "", "score": 1.2, "score_ci_lower": 0.6, "score_ci_upper": 1.7, "raw_scores": [2.0, 0.0, 1.0, 1.5, 1.5], "baseline_score": 2.3, "outcome": "DISCARDED", "failure_mode": null, "duration_seconds": 20.445491250022314, "tags": ["format-contract", "faithfulness", "compression", "summarization"], "learnings": "{\"what_changed\":\"\",\"what_improved\":[],\"what_regressed\":[],\"transferable_insight\":\"When a rule set adds strict constraints without improving clarity or task fit, it may reduce consistency rather than increase it.\",\"domain_tags\":[\"prompt_design\",\"evaluation\",\"process_control\"]}", "cost_usd": 0.025990350000000002, "bootstrap_seed": 0, "agent_model": "gpt-5.4", "held_out_score": null, "criterion_names": ["key_points_captured", "conciseness", "faithful_to_source", "few_shot_format"], "per_criterion_scores": {"key_points_captured": 0.7, "conciseness": 0.1, "faithful_to_source": 0.4, "few_shot_format": 0.0}, "failure_classification": {"category": "logic_error", "description": "The provided information (hypothesis, unknown failure mode, score 1.2, and the set of categories) does not specify what actually failed\u2014e.g., whether there was a format/schema violation, logic error, or scope/syntax issue. With no observed output or error description, the failure cannot be reliably mapped to a category.", "fix_direction": "Capture the actual failed output (or error logs) and the evaluator feedback (which criteria failed: format, schema, parsing, logic, meaning, or scope). Then align the fix attempt with the specific failing signal.", "confidence": 0.05}, "drafts_generated": 1, "drafts_survived": 1}
{"id": "461945e2-f434-4da5-9658-803a52e0f0ba", "target_id": "B2-control", "git_sha": "4a45d2bb2dc1733f8364c1d2df1f85e142fbf641", "pre_experiment_sha": "4a45d2bb2dc1733f8364c1d2df1f85e142fbf641", "timestamp": "2026-04-19T17:44:05.086009+00:00", "hypothesis": "A single rigid two-line output contract with stricter faithfulness and compression rules will improve consistency and binary criteria adherence.", "hypothesis_source": "agent", "mutation_diff_summary": "", "score": 2.0, "score_ci_lower": 1.6, "score_ci_upper": 2.5, "raw_scores": [1.5, 2.0, 2.0, 3.0, 1.5], "baseline_score": 2.3, "outcome": "DISCARDED", "failure_mode": null, "duration_seconds": 18.067765666986816, "tags": ["format-lock", "faithfulness", "compression", "summarization"], "learnings": "{\"what_changed\":\"\",\"what_improved\":[],\"what_regressed\":[],\"transferable_insight\":\"When a stricter output format adds rigidity without improving underlying task alignment, it can reduce consistency rather than increase it.\",\"domain_tags\":[\"evaluation\",\"prompt-design\",\"quality-control\"]}", "cost_usd": 0.023023150000000003, "bootstrap_seed": 0, "agent_model": "gpt-5.4", "held_out_score": null, "criterion_names": ["key_points_captured", "conciseness", "faithful_to_source", "few_shot_format"], "per_criterion_scores": {"key_points_captured": 1.0, "conciseness": 0.4, "faithful_to_source": 0.4, "few_shot_format": 0.2}, "failure_classification": {"category": "logic_error", "description": "The failure mode is not specified (\u201cunknown\u201d), and only a score of 2.0000 is provided, which is insufficient to determine whether the issue was formatting, logic, regression, or semantic drift.", "fix_direction": "Capture the exact failure evidence (e.g., expected vs actual output, comparison against each criterion, and any error messages) and then map it to a concrete category (format/schema vs reasoning vs out-of-scope changes).", "confidence": 0.05}, "drafts_generated": 1, "drafts_survived": 1}
{"id": "be0cffbc-e964-4885-bfec-6d8375d9ec3a", "target_id": "B2-control", "git_sha": "4a45d2bb2dc1733f8364c1d2df1f85e142fbf641", "pre_experiment_sha": "4a45d2bb2dc1733f8364c1d2df1f85e142fbf641", "timestamp": "2026-04-19T17:44:25.570382+00:00", "hypothesis": "A single rigid output contract with stricter faithfulness and compression rules will improve consistent binary-criteria compliance.", "hypothesis_source": "agent", "mutation_diff_summary": "", "score": 1.2, "score_ci_lower": 1.0, "score_ci_upper": 1.4, "raw_scores": [1.0, 1.5, 1.5, 1.0, 1.0], "baseline_score": 2.3, "outcome": "DISCARDED", "failure_mode": null, "duration_seconds": 17.972139792051166, "tags": ["format-lock", "faithfulness", "compression", "summarization"], "learnings": "{\"what_changed\":\"\",\"what_improved\":[],\"what_regressed\":[],\"transferable_insight\":\"When a stricter format or rule set is introduced without changing the underlying task quality, it may fail to improve outcomes and can even reduce performance by adding rigidity without adding useful guidance.\",\"domain_tags\":[\"process-design\",\"quality-control\",\"instruction-following\"]}", "cost_usd": 0.02251515, "bootstrap_seed": 0, "agent_model": "gpt-5.4", "held_out_score": null, "criterion_names": ["key_points_captured", "conciseness", "faithful_to_source", "few_shot_format"], "per_criterion_scores": {"key_points_captured": 0.8, "conciseness": 0.4, "faithful_to_source": 0.0, "few_shot_format": 0.0}, "failure_classification": {"category": "semantic_drift", "description": "A low compliance score (1.2000) despite the intended constraint-based output contract suggests the output may have followed the required format only superficially while failing the binary-criteria meaning/intent (i.e., correct structure but wrong substance).", "fix_direction": "Tighten the mapping between each criterion and explicit content checks (add per-criterion validation rules), and enforce that the contract explicitly covers required meanings beyond formatting (e.g., add explicit invariants, example-based constraints, and post-generation semantic verification).", "confidence": 0.42}, "drafts_generated": 1, "drafts_survived": 1}
{"id": "6ecb6dc0-96bb-4f85-9388-c343bc95e7df", "target_id": "B2-control", "git_sha": "4a45d2bb2dc1733f8364c1d2df1f85e142fbf641", "pre_experiment_sha": "4a45d2bb2dc1733f8364c1d2df1f85e142fbf641", "timestamp": "2026-04-19T17:44:47.626374+00:00", "hypothesis": "A single rigid two-line template with strict source-only compression will improve consistency and faithfulness.", "hypothesis_source": "agent", "mutation_diff_summary": "", "score": 2.1, "score_ci_lower": 1.6, "score_ci_upper": 2.8, "raw_scores": [2.0, 1.5, 3.5, 1.5, 2.0], "baseline_score": 2.3, "outcome": "DISCARDED", "failure_mode": null, "duration_seconds": 19.343327249982394, "tags": ["format-lock", "faithfulness", "compression", "summarization"], "learnings": "{\"what_changed\":\"\",\"what_improved\":[],\"what_regressed\":[],\"transferable_insight\":\"Overly rigid constraints can reduce consistency gains by suppressing useful adaptation, so compression rules should preserve enough flexibility to maintain fidelity.\",\"domain_tags\":[\"process-design\",\"communication\",\"optimization\"]}", "cost_usd": 0.02258655, "bootstrap_seed": 0, "agent_model": "gpt-5.4", "held_out_score": null, "criterion_names": ["key_points_captured", "conciseness", "faithful_to_source", "few_shot_format"], "per_criterion_scores": {"key_points_captured": 0.9, "conciseness": 0.7, "faithful_to_source": 0.4, "few_shot_format": 0.1}, "failure_classification": {"category": "output_format", "description": "The experiment appears to have failed due to producing output that did not match the expected schema/structure for the two-line template with strict source-only compression, indicating an output-format compliance issue rather than purely logical or semantic failure.", "fix_direction": "Ensure the response strictly follows the required two-line template and emits only source-derived compressed content with no extra fields, prefixes, or formatting differences.", "confidence": 0.34}, "drafts_generated": 1, "drafts_survived": 1}
{"id": "6f877174-1e93-4b02-8f0d-49f81babf5a6", "target_id": "B2-control", "git_sha": "4a45d2bb2dc1733f8364c1d2df1f85e142fbf641", "pre_experiment_sha": "4a45d2bb2dc1733f8364c1d2df1f85e142fbf641", "timestamp": "2026-04-19T17:45:06.405071+00:00", "hypothesis": "A single fixed two-sentence template with stricter faithfulness and compression rules will improve consistency and binary criteria adherence.", "hypothesis_source": "agent", "mutation_diff_summary": "", "score": 2.2, "score_ci_lower": 1.6, "score_ci_upper": 2.8, "raw_scores": [3.0, 1.0, 2.0, 3.0, 2.0], "baseline_score": 2.3, "outcome": "DISCARDED", "failure_mode": null, "duration_seconds": 13.814869125024416, "tags": ["format-lock", "faithfulness", "compression", "summarization"], "learnings": "{\"what_changed\":\"\",\"what_improved\":[],\"what_regressed\":[],\"transferable_insight\":\"Tightening a prompt with a fixed template and stricter constraints does not reliably improve outcomes unless the constraints align with the task and are validated against the target criteria.\",\"domain_tags\":[\"prompt-design\",\"evaluation\",\"process-control\"]}", "cost_usd": 0.01323215, "bootstrap_seed": 0, "agent_model": "gpt-5.4", "held_out_score": null, "criterion_names": ["key_points_captured", "conciseness", "faithful_to_source", "few_shot_format"], "per_criterion_scores": {"key_points_captured": 1.0, "conciseness": 0.7, "faithful_to_source": 0.4, "few_shot_format": 0.1}, "failure_classification": {"category": "incomplete_edit", "description": "The experiment did not succeed, and the failure mode is listed as unknown, suggesting the intended stricter template/faithfulness/compression change likely wasn\u2019t applied consistently across the full output flow or left parts of the output in an inconsistent state relative to the criteria.", "fix_direction": "Ensure the two-sentence template and the stricter faithfulness/compression constraints are enforced end-to-end (input-to-output), with validation checks that every response fully conforms to the binary criteria and remains internally consistent.", "confidence": 0.32}, "drafts_generated": 1, "drafts_survived": 1}
