{"id": "deb71c73-b0a7-43b8-b668-a0c998bd563d", "target_id": "B2-control", "git_sha": "081598921945cdf515ed0ee910fa300232ae73ac", "pre_experiment_sha": "081598921945cdf515ed0ee910fa300232ae73ac", "timestamp": "2026-04-19T17:56:27.610632+00:00", "hypothesis": "Restore the stronger two-sentence contract wording while keeping the article cue separate to improve format and faithfulness.", "hypothesis_source": "agent", "mutation_diff_summary": "", "score": 1.6, "score_ci_lower": 1.0, "score_ci_upper": 2.2, "raw_scores": [1.5, 1.5, 2.5, 2.0, 0.5], "baseline_score": 2.1, "outcome": "DISCARDED", "failure_mode": null, "duration_seconds": 15.716789291938767, "tags": ["two-sentence", "format-contract", "faithfulness", "concise"], "learnings": "{\"what_changed\":\"\",\"what_improved\":[],\"what_regressed\":[],\"transferable_insight\":\"When a formatting cue is separated from the core instruction, preserving a concise, explicit contract can improve adherence without conflating structure and content.\",\"domain_tags\":[\"prompt-design\",\"instruction-following\",\"formatting\"]}", "cost_usd": 0.021984749999999997, "bootstrap_seed": 0, "agent_model": "gpt-5.4", "held_out_score": null, "criterion_names": ["key_points_captured", "conciseness", "faithful_to_source", "few_shot_format"], "per_criterion_scores": {"key_points_captured": 0.8, "conciseness": 0.5, "faithful_to_source": 0.2, "few_shot_format": 0.1}, "failure_classification": {"category": "incomplete_edit", "description": "The attempt appears to be only partially aligned with the hypothesis: while it targeted restoring stronger two-sentence contract wording, it did not consistently maintain the intended separation of the article cue, leaving the output in an inconsistent or incomplete state relative to the required format/faithfulness.", "fix_direction": "Ensure the two-sentence contract wording is fully restored exactly as specified while keeping the article cue in a distinct, separate section/placement; verify the final output matches both formatting and faithfulness constraints end-to-end.", "confidence": 0.62}, "drafts_generated": 1, "drafts_survived": 1}
{"id": "d7df47e2-0562-46d6-9225-26a3887c1a0f", "target_id": "B2-control", "git_sha": "081598921945cdf515ed0ee910fa300232ae73ac", "pre_experiment_sha": "081598921945cdf515ed0ee910fa300232ae73ac", "timestamp": "2026-04-19T17:56:41.414822+00:00", "hypothesis": "Rephrase the contract to be shorter and more literal while preserving explicit sentence roles and strict source-only limits.", "hypothesis_source": "agent", "mutation_diff_summary": "", "score": 1.9, "score_ci_lower": 1.2, "score_ci_upper": 2.6, "raw_scores": [1.0, 2.5, 1.0, 2.0, 3.0], "baseline_score": 2.1, "outcome": "DISCARDED", "failure_mode": null, "duration_seconds": 11.331062957993709, "tags": ["two-sentence", "format-contract", "faithfulness", "concise"], "learnings": "{\"what_changed\":\"\",\"what_improved\":[],\"what_regressed\":[],\"transferable_insight\":\"When a rewrite must preserve meaning under strict source-only constraints, shortening and literalness can still fail if they reduce clarity without improving the underlying structure or role explicitness.\",\"domain_tags\":[\"prompt-engineering\",\"text-rewriting\",\"evaluation\"]}", "cost_usd": 0.021634150000000005, "bootstrap_seed": 0, "agent_model": "gpt-5.4", "held_out_score": null, "criterion_names": ["key_points_captured", "conciseness", "faithful_to_source", "few_shot_format"], "per_criterion_scores": {"key_points_captured": 0.8, "conciseness": 0.7, "faithful_to_source": 0.4, "few_shot_format": 0.0}, "failure_classification": {"category": "logic_error", "description": "The provided information (hypothesis, failure mode unknown, and low score) does not specify what concrete rule was violated (format, logic, scope, syntax, semantic meaning, optimization gaming, or partial/inconsistent edits). Without the actual failed output or observed error, the failure mode cannot be reliably classified.", "fix_direction": "Include the original contract, the model\u2019s produced rephrase, and the evaluator\u2019s specific failure signal (error message or rubric outcome) so the failure can be mapped to output_format/logic/scope/semantic issues.", "confidence": 0.12}, "drafts_generated": 1, "drafts_survived": 1}
{"id": "bf5b7363-bcf5-42e6-8081-dab1a0bafcfc", "target_id": "B2-control", "git_sha": "1e65479728aa8d68f03097b94680e893b9ece128", "pre_experiment_sha": "081598921945cdf515ed0ee910fa300232ae73ac", "timestamp": "2026-04-19T17:56:59.724164+00:00", "hypothesis": "Use a slightly fuller but still rigid two-sentence contract to restore clarity for sentence roles and source-only faithfulness.", "hypothesis_source": "agent", "mutation_diff_summary": "", "score": 2.2, "score_ci_lower": 1.6, "score_ci_upper": 2.7, "raw_scores": [2.5, 2.5, 2.0, 3.0, 1.0], "baseline_score": 2.1, "outcome": "KEPT", "failure_mode": null, "duration_seconds": 13.114961457904428, "tags": ["two-sentence", "format-contract", "faithfulness", "concise"], "learnings": "{\"what_changed\":\"\",\"what_improved\":[\"faithful_to_source: PASS (was FAIL)\"],\"what_regressed\":[],\"transferable_insight\":\"Adding a small amount of explicit structure can improve clarity and fidelity without sacrificing rigidity.\",\"domain_tags\":[\"prompt-design\",\"information-extraction\",\"quality-control\"]}", "cost_usd": 0.02259015, "bootstrap_seed": 0, "agent_model": "gpt-5.4", "held_out_score": null, "criterion_names": ["key_points_captured", "conciseness", "faithful_to_source", "few_shot_format"], "per_criterion_scores": {"key_points_captured": 0.8, "conciseness": 0.6, "faithful_to_source": 0.8, "few_shot_format": 0.0}, "failure_classification": null, "drafts_generated": 1, "drafts_survived": 1}
{"id": "45894477-0ead-4da1-928e-25fa717620c7", "target_id": "B2-control", "git_sha": "1e65479728aa8d68f03097b94680e893b9ece128", "pre_experiment_sha": "1e65479728aa8d68f03097b94680e893b9ece128", "timestamp": "2026-04-19T17:57:12.997766+00:00", "hypothesis": "Use one exact two-sentence instruction where the second sentence includes the article cue while preserving explicit role order and strict source-only limits.", "hypothesis_source": "agent", "mutation_diff_summary": "", "score": 1.9, "score_ci_lower": 1.4, "score_ci_upper": 2.3, "raw_scores": [2.0, 1.0, 2.0, 2.0, 2.5], "baseline_score": 2.2, "outcome": "DISCARDED", "failure_mode": null, "duration_seconds": 12.133241459028795, "tags": ["two-sentence", "format-contract", "faithfulness", "concise"], "learnings": "{\"what_changed\":\"\",\"what_improved\":[],\"what_regressed\":[\"conciseness: FAIL (was PASS)\",\"faithful_to_source: FAIL (was PASS)\"],\"transferable_insight\":\"When a prompt adds structural constraints, keep them minimal and avoid extra wording that can reduce conciseness or drift from the source.\",\"domain_tags\":[\"prompt-engineering\",\"instruction-design\",\"evaluation\"]}", "cost_usd": 0.022047550000000003, "bootstrap_seed": 0, "agent_model": "gpt-5.4", "held_out_score": null, "criterion_names": ["key_points_captured", "conciseness", "faithful_to_source", "few_shot_format"], "per_criterion_scores": {"key_points_captured": 1.0, "conciseness": 0.4, "faithful_to_source": 0.3, "few_shot_format": 0.2}, "failure_classification": {"category": "logic_error", "description": "The provided information (hypothesis, failure mode labeled 'unknown', and a low score) does not contain any concrete output, error message, or observable deviation from the allowed instruction schema. Without the actual failed attempt or its discrepancy, the failure cannot be reliably mapped to one of the listed categories.", "fix_direction": "Provide the model\u2019s actual output (or the evaluation diff) and the specific error/constraint that failed (e.g., sentence count, exact two-sentence requirement, article cue presence, role order, or source-only limitation) so the failure can be classified accurately.", "confidence": 0.12}, "drafts_generated": 1, "drafts_survived": 1}
