{"id": "10f2bc3a-b1ee-4667-8f01-1f62876abc30", "target_id": "B2-control", "git_sha": "9a0acd3ba3487d967db1f6ef693ec48c4da35f56", "pre_experiment_sha": "5dfe45eb4ac0661a092592261f260a8e9a09be3f", "timestamp": "2026-04-22T06:13:19.074858+00:00", "hypothesis": "Remove hallucinated sentences from the few-shot examples, standardize the summary format to a consistent paragraph instead of mixing with bullet points, and explicitly instruct the model to avoid external information.", "hypothesis_source": "agent", "mutation_diff_summary": "", "score": 2.7, "score_ci_lower": 2.0, "score_ci_upper": 3.5, "raw_scores": [2.0, 2.0, 3.5, 2.0, 4.0], "baseline_score": 0.0, "outcome": "KEPT", "failure_mode": null, "duration_seconds": 98.34275329089724, "tags": ["hallucination", "formatting", "few-shot", "consistency"], "learnings": "{\"what_changed\":\"\",\"what_improved\":[],\"what_regressed\":[],\"transferable_insight\":\"Ensuring few-shot examples are strictly accurate and uniformly formatted, combined with explicit negative constraints against using external knowledge, significantly improves model reliability and adherence to instructions.\",\"domain_tags\":[\"Prompt Engineering\",\"Few-Shot Prompting\",\"Hallucination Mitigation\"]}", "cost_usd": 0.011109500000000001, "bootstrap_seed": 0, "agent_model": "gemini-3.1-pro-preview", "held_out_score": null, "criterion_names": ["key_points_captured", "conciseness", "faithful_to_source", "few_shot_format"], "per_criterion_scores": {"key_points_captured": 1.0, "conciseness": 1.0, "faithful_to_source": 0.4, "few_shot_format": 0.3}, "failure_classification": null, "drafts_generated": 1, "drafts_survived": 1}
{"id": "e8c62828-9a83-4e6a-a617-28db63951560", "target_id": "B2-control", "git_sha": "9a0acd3ba3487d967db1f6ef693ec48c4da35f56", "pre_experiment_sha": "9a0acd3ba3487d967db1f6ef693ec48c4da35f56", "timestamp": "2026-04-22T06:14:36.368039+00:00", "hypothesis": "Adding explicit, numbered rules for conciseness, comprehensiveness, and avoiding hallucinations will improve the model's adherence to the summarization criteria.", "hypothesis_source": "agent", "mutation_diff_summary": "", "score": 2.3, "score_ci_lower": 1.7, "score_ci_upper": 3.2, "raw_scores": [2.0, 2.0, 4.0, 2.0, 1.5], "baseline_score": 2.7, "outcome": "DISCARDED", "failure_mode": null, "duration_seconds": 61.31974320788868, "tags": ["prompt-engineering", "rule-based", "few-shot"], "learnings": "{\"what_changed\":\"\",\"what_improved\":[],\"what_regressed\":[],\"transferable_insight\":\"Imposing explicit, numbered rules for multiple competing qualitative objectives can degrade overall performance rather than improving adherence.\",\"domain_tags\":[\"Prompt Engineering\",\"Instruction Formatting\",\"Constraint Management\"]}", "cost_usd": 0.011917100000000002, "bootstrap_seed": 0, "agent_model": "gemini-3.1-pro-preview", "held_out_score": null, "criterion_names": ["key_points_captured", "conciseness", "faithful_to_source", "few_shot_format"], "per_criterion_scores": {"key_points_captured": 0.9, "conciseness": 1.0, "faithful_to_source": 0.2, "few_shot_format": 0.2}, "failure_classification": {"category": "semantic_drift", "description": "The explicit, numbered rules designed to guide the model towards conciseness, comprehensiveness, and hallucination avoidance failed to improve adherence to summarization criteria. The low score indicates that the model's output did not meet the desired semantic quality, suggesting a misinterpretation or inability to effectively apply these rules, leading to summaries with incorrect or poor meaning relative to the stated goals.", "fix_direction": "Investigate the clarity and potential conflicting nature of the rules themselves. Consider simplifying rule language, providing positive and negative examples of summarization, or integrating the criteria into a more holistic persona or instruction rather than as discrete, numbered directives. Evaluate if the rules created unintended side effects that degraded summary quality.", "confidence": 0.9}, "drafts_generated": 1, "drafts_survived": 1}
{"id": "9e0a6eee-bc57-4ffa-abdf-4e1e955a7fb4", "target_id": "B2-control", "git_sha": "9a0acd3ba3487d967db1f6ef693ec48c4da35f56", "pre_experiment_sha": "9a0acd3ba3487d967db1f6ef693ec48c4da35f56", "timestamp": "2026-04-22T06:15:58.800715+00:00", "hypothesis": "Add explicit, bulleted critical rules to the system instructions to enforce conciseness, comprehensiveness, and faithfulness, which should improve the binary criteria satisfaction score.", "hypothesis_source": "agent", "mutation_diff_summary": "", "score": 2.4, "score_ci_lower": 2.0, "score_ci_upper": 3.0, "raw_scores": [2.0, 2.5, 3.5, 2.0, 2.0], "baseline_score": 2.7, "outcome": "DISCARDED", "failure_mode": null, "duration_seconds": 63.88199087488465, "tags": ["summarization", "few-shot", "instructions-formatting"], "learnings": "{\"what_changed\":\"\",\"what_improved\":[],\"what_regressed\":[],\"transferable_insight\":\"Adding explicit, bulleted rules to enforce abstract qualities like conciseness and faithfulness can degrade performance, likely by over-constraining the model or creating conflicting objectives.\",\"domain_tags\":[\"Prompt Engineering\",\"Constraint Management\",\"System Instructions\"]}", "cost_usd": 0.011492150000000001, "bootstrap_seed": 0, "agent_model": "gemini-3.1-pro-preview", "held_out_score": null, "criterion_names": ["key_points_captured", "conciseness", "faithful_to_source", "few_shot_format"], "per_criterion_scores": {"key_points_captured": 1.0, "conciseness": 1.0, "faithful_to_source": 0.3, "few_shot_format": 0.1}, "failure_classification": {"category": "semantic_drift", "description": "The explicit, bulleted critical rules intended to enforce conciseness, comprehensiveness, and faithfulness likely led to a misinterpretation or conflicting application of these qualities by the model. This resulted in outputs that, despite potentially adhering to some superficial aspect of the rules, failed to capture the intended balance or meaning of these criteria, leading to a very low satisfaction score. For example, an overemphasis on conciseness might have sacrificed comprehensiveness or faithfulness, or vice versa, causing the output's meaning to deviate significantly from the desired intent.", "fix_direction": "Refine the system instructions to clarify the precise definition, priority, and interaction of conciseness, comprehensiveness, and faithfulness. Consider providing explicit examples of desired and undesired output behavior, or breaking down complex rules into simpler, non-conflicting directives. Evaluate the impact of each rule incrementally rather than adding all at once.", "confidence": 0.9}, "drafts_generated": 1, "drafts_survived": 1}
{"id": "09f80880-d4a4-406f-8ef0-3ba1606fe77d", "target_id": "B2-control", "git_sha": "9a0acd3ba3487d967db1f6ef693ec48c4da35f56", "pre_experiment_sha": "9a0acd3ba3487d967db1f6ef693ec48c4da35f56", "timestamp": "2026-04-22T06:17:44.113784+00:00", "hypothesis": "Standardize output to a single paragraph, explicitly prohibit bullet points, strictly forbid external knowledge, and clean few-shot examples of all acronym/abbreviation hallucinations to ensure perfect faithfulness.", "hypothesis_source": "agent", "mutation_diff_summary": "", "score": 2.6, "score_ci_lower": 2.0, "score_ci_upper": 3.2, "raw_scores": [3.5, 3.5, 2.0, 2.0, 2.0], "baseline_score": 2.7, "outcome": "DISCARDED", "failure_mode": null, "duration_seconds": 68.27559325005859, "tags": ["prompt-engineering", "few-shot-refinement", "formatting-constraints", "hallucination-prevention"], "learnings": "{\"what_changed\":\"\",\"what_improved\":[],\"what_regressed\":[],\"transferable_insight\":\"Over-constraining output formatting by prohibiting structured elements like bullet points can degrade overall performance, even when accompanied by cleaner examples and strict faithfulness constraints.\",\"domain_tags\":[\"Prompt Engineering\",\"Output Formatting\",\"Constraint Satisfaction\"]}", "cost_usd": 0.012077800000000001, "bootstrap_seed": 0, "agent_model": "gemini-3.1-pro-preview", "held_out_score": null, "criterion_names": ["key_points_captured", "conciseness", "faithful_to_source", "few_shot_format"], "per_criterion_scores": {"key_points_captured": 1.0, "conciseness": 1.0, "faithful_to_source": 0.4, "few_shot_format": 0.2}, "failure_classification": {"category": "semantic_drift", "description": "The experiment aimed for strict control over both output format (single paragraph, no bullet points) and content (strictly forbid external knowledge, no acronym/abbreviation hallucinations, perfect faithfulness). The low score (2.6) suggests a significant failure, most likely because the model was unable to fully adhere to the content constraints regarding knowledge source and accuracy. This means the output, despite potential adherence to format, still included external information or fabricated details, thus failing on the 'perfect faithfulness' aspect.", "fix_direction": "Focus on improving the model's grounding capabilities to strictly adhere to the provided context and prevent the introduction of external knowledge or hallucinations. This could involve more rigorous negative prompting, implementing a Retrieval-Augmented Generation (RAG) system to strictly manage knowledge sources, or fine-tuning the model with a strong emphasis on factuality and in-context reasoning. Additionally, a post-processing step could be introduced to identify and remove any detected external knowledge or ungrounded abbreviations/acronyms.", "confidence": 0.85}, "drafts_generated": 1, "drafts_survived": 1}
{"id": "44930d5b-326d-4a19-ad8d-63ed869e0bc7", "target_id": "B2-control", "git_sha": "9a0acd3ba3487d967db1f6ef693ec48c4da35f56", "pre_experiment_sha": "9a0acd3ba3487d967db1f6ef693ec48c4da35f56", "timestamp": "2026-04-22T06:19:08.555021+00:00", "hypothesis": "Enforcing a single paragraph output without bullet points, explicitly prohibiting external knowledge, and removing hallucinated abbreviations (e.g., RLHF, NSF) from the few-shot examples will improve the binary criteria score.", "hypothesis_source": "agent", "mutation_diff_summary": "", "score": 3.0, "score_ci_lower": 2.4, "score_ci_upper": 3.6, "raw_scores": [3.0, 3.5, 4.0, 2.0, 2.5], "baseline_score": 2.7, "outcome": "DISCARDED", "failure_mode": null, "duration_seconds": 61.37130391714163, "tags": ["prompt-engineering", "constraint-enforcement", "few-shot-refinement"], "learnings": "{\"what_changed\":\"\",\"what_improved\":[],\"what_regressed\":[],\"transferable_insight\":\"Simultaneously enforcing strict formatting constraints, prohibiting external knowledge, and removing hallucinated elements from few-shot examples does not guarantee an adoptable improvement despite minor metric gains.\",\"domain_tags\":[\"Prompt Engineering\",\"Few-Shot Prompting\",\"Hallucination Mitigation\"]}", "cost_usd": 0.012967450000000002, "bootstrap_seed": 0, "agent_model": "gemini-3.1-pro-preview", "held_out_score": null, "criterion_names": ["key_points_captured", "conciseness", "faithful_to_source", "few_shot_format"], "per_criterion_scores": {"key_points_captured": 1.0, "conciseness": 1.0, "faithful_to_source": 0.7, "few_shot_format": 0.3}, "failure_classification": {"category": "semantic_drift", "description": "The experiment aimed to improve the score by imposing strict constraints on output format (single paragraph, no bullet points) and content (prohibiting external knowledge, removing hallucinated abbreviations). The low score of 3.0, despite the 'unknown' failure mode, suggests that these interventions either failed to prevent undesirable output characteristics or inadvertently made the output less relevant, complete, or accurate. This implies that the 'meaning' or utility of the output drifted negatively, leading to a poor score, even if some format constraints were met. For example, prohibiting external knowledge might have resulted in overly generic or incomplete answers, or the single-paragraph format might have reduced clarity, ultimately making the output less effective.", "fix_direction": "Investigate if the constraints were overly restrictive. Specifically, re-evaluate the impact of 'prohibiting external knowledge' \u2013 did it strip away essential context or information needed for a good score? Similarly, assess if the 'single paragraph output' constraint negatively impacted readability or the ability to convey complex information clearly. Analyze the outputs to determine if hallucinations still occurred despite the few-shot example changes, or if new forms of undesirable semantic output emerged. Consider a more balanced approach that allows for necessary context or structured presentation without compromising output quality.", "confidence": 0.9}, "drafts_generated": 1, "drafts_survived": 1}
{"id": "c0a150bd-e568-4b80-854f-4badcf95886e", "target_id": "B2-control", "git_sha": "9a0acd3ba3487d967db1f6ef693ec48c4da35f56", "pre_experiment_sha": "9a0acd3ba3487d967db1f6ef693ec48c4da35f56", "timestamp": "2026-04-22T06:20:49.910351+00:00", "hypothesis": "Update the prompt to request a single, consistent paragraph without bullet points and meticulously clean the few-shot examples to remove any hallucinated acronyms or phrasing not present in the source texts.", "hypothesis_source": "agent", "mutation_diff_summary": "", "score": 2.4, "score_ci_lower": 2.1, "score_ci_upper": 2.7, "raw_scores": [2.0, 2.5, 2.0, 3.0, 2.5], "baseline_score": 2.7, "outcome": "DISCARDED", "failure_mode": null, "duration_seconds": 73.74871279206127, "tags": ["prompt-engineering", "few-shot-optimization", "formatting", "hallucination-removal"], "learnings": "{\"what_changed\":\"\",\"what_improved\":[],\"what_regressed\":[],\"transferable_insight\":\"Forcing dense, unformatted text and overly sanitizing reference examples of abstracted phrasing can degrade performance by removing structural clarity and useful generalizations.\",\"domain_tags\":[\"Prompt Engineering\",\"Few-Shot Prompting\",\"Output Formatting\"]}", "cost_usd": 0.01126995, "bootstrap_seed": 0, "agent_model": "gemini-3.1-pro-preview", "held_out_score": null, "criterion_names": ["key_points_captured", "conciseness", "faithful_to_source", "few_shot_format"], "per_criterion_scores": {"key_points_captured": 1.0, "conciseness": 1.0, "faithful_to_source": 0.4, "few_shot_format": 0.0}, "failure_classification": {"category": "output_format", "description": "The experiment's hypothesis explicitly aimed to enforce a specific output format (single, consistent paragraph without bullet points). The extremely low score (2.4) strongly suggests that the model failed to adhere to this requested format, or that attempting to force this format resulted in an unusable or severely degraded output, impacting overall quality significantly. While the hypothesis also aimed to clean few-shot examples, a fundamental failure in output structure is often a primary cause for such a low score.", "fix_direction": "Re-evaluate the feasibility and clarity of the requested output format in the prompt. Test the model's ability to consistently generate a single, coherent paragraph without bullet points. Consider if the desired output is achievable given the input complexity, and if enforcing a strict single-paragraph format might be too restrictive, leading to loss of information or coherence. Also, verify that cleaning few-shot examples effectively guides the model without introducing new issues.", "confidence": 0.9}, "drafts_generated": 1, "drafts_survived": 1}
{"id": "0a6aa3e3-73fd-4a00-b06d-6ab38dbf4b00", "target_id": "B2-control", "git_sha": "9a0acd3ba3487d967db1f6ef693ec48c4da35f56", "pre_experiment_sha": "9a0acd3ba3487d967db1f6ef693ec48c4da35f56", "timestamp": "2026-04-22T06:22:23.773264+00:00", "hypothesis": "Gently request a single-paragraph summary, instruct the model to rely only on the provided text, and clean up the few-shot examples to match the source text exactly without introducing unmentioned acronyms.", "hypothesis_source": "agent", "mutation_diff_summary": "", "score": 3.0, "score_ci_lower": 2.2, "score_ci_upper": 3.8, "raw_scores": [2.0, 3.0, 4.0, 4.0, 2.0], "baseline_score": 2.7, "outcome": "DISCARDED", "failure_mode": null, "duration_seconds": 49.502620542189106, "tags": ["prompt-engineering", "few-shot-cleanup", "formatting"], "learnings": "{\"what_changed\":\"\",\"what_improved\":[],\"what_regressed\":[],\"transferable_insight\":\"While aligning few-shot examples perfectly with source constraints and enforcing strict grounding can slightly improve performance, the marginal gains may not always justify the effort of maintaining highly rigid prompts.\",\"domain_tags\":[\"Prompt Engineering\",\"Few-Shot Prompting\",\"Grounding\"]}", "cost_usd": 0.011900550000000001, "bootstrap_seed": 0, "agent_model": "gemini-3.1-pro-preview", "held_out_score": null, "criterion_names": ["key_points_captured", "conciseness", "faithful_to_source", "few_shot_format"], "per_criterion_scores": {"key_points_captured": 1.0, "conciseness": 1.0, "faithful_to_source": 0.6, "few_shot_format": 0.4}, "failure_classification": {"category": "scope_violation", "description": "The model likely failed to strictly \"rely only on the provided text\" as instructed. This could manifest as introducing external information, facts, or acronyms not present in the source material, or synthesizing information in a way that goes beyond the provided text's scope, despite the careful cleanup of few-shot examples designed to prevent this.", "fix_direction": "Reinforce strict adherence to source material via more explicit negative constraints in the prompt (e.g., \"DO NOT introduce external information,\" \"ONLY use terms and facts from the provided text\"). Consider fine-tuning the model on datasets that heavily penalize hallucination or out-of-scope content, or implementing a post-generation check to filter for out-of-scope elements.", "confidence": 0.85}, "drafts_generated": 1, "drafts_survived": 1}
{"id": "b89bd424-a75f-464d-8f22-67dbb90820bf", "target_id": "B2-control", "git_sha": "9a0acd3ba3487d967db1f6ef693ec48c4da35f56", "pre_experiment_sha": "9a0acd3ba3487d967db1f6ef693ec48c4da35f56", "timestamp": "2026-04-22T06:23:46.569613+00:00", "hypothesis": "Gently request a single-paragraph summary and clean up minor inconsistencies in the few-shot examples to better align with the source text without relying on rigid constraints.", "hypothesis_source": "agent", "mutation_diff_summary": "", "score": 2.3, "score_ci_lower": 2.0, "score_ci_upper": 2.9, "raw_scores": [2.0, 2.0, 2.0, 2.0, 3.5], "baseline_score": 2.7, "outcome": "DISCARDED", "failure_mode": null, "duration_seconds": 57.951135999988765, "tags": ["prompt-engineering", "few-shot-cleanup", "gentle-constraints"], "learnings": "{\"what_changed\":\"\",\"what_improved\":[],\"what_regressed\":[],\"transferable_insight\":\"Relying on gentle requests rather than explicit, rigid constraints degrades performance when enforcing specific structural or formatting requirements.\",\"domain_tags\":[\"Prompt Engineering\",\"Constraint Enforcement\",\"Few-Shot Prompting\"]}", "cost_usd": 0.011219200000000002, "bootstrap_seed": 0, "agent_model": "gemini-3.1-pro-preview", "held_out_score": null, "criterion_names": ["key_points_captured", "conciseness", "faithful_to_source", "few_shot_format"], "per_criterion_scores": {"key_points_captured": 1.0, "conciseness": 1.0, "faithful_to_source": 0.2, "few_shot_format": 0.1}, "failure_classification": {"category": "semantic_drift", "description": "The experiment aimed to improve summary accuracy and alignment with the source text by cleaning few-shot examples and requesting a single-paragraph format. The very low score (2.3) strongly indicates that the primary failure was semantic, meaning the generated summaries likely contained incorrect information, significantly drifted from the source's intended meaning, or failed to accurately capture the main points, despite any format attempts. The core objective of 'better align with the source text' was not achieved.", "fix_direction": "Future attempts should intensely focus on improving the semantic faithfulness and factual accuracy of the generated summaries. This could involve more rigorous few-shot design that emphasizes precise semantic alignment and consistency, incorporating stronger prompt instructions that explicitly penalize factual deviations, or exploring additional techniques to ensure information fidelity and non-contradiction with the source material.", "confidence": 0.9}, "drafts_generated": 1, "drafts_survived": 1}
