{"id": "a4fc328e-4b4b-4c19-ab50-eb1daf7f3489", "target_id": "B2-greedy", "git_sha": "6a3c657efc4722ea0d66c503b7ca8c0e2b55a018", "pre_experiment_sha": "3b452d4d4a3bc0f302632065ef61cb2ba6a6552a", "timestamp": "2026-04-19T07:38:54.188445+00:00", "hypothesis": "Tightening the instructions and examples around concise, factual 2\u20134 sentence summaries will improve summarization scoring consistency.", "hypothesis_source": "agent", "mutation_diff_summary": "", "score": 1.8, "score_ci_lower": 1.3, "score_ci_upper": 2.4, "raw_scores": [3.0, 1.5, 2.0, 1.5, 1.0], "baseline_score": 0.0, "outcome": "KEPT", "failure_mode": null, "duration_seconds": 24.20367704203818, "tags": ["summarization", "few-shot", "instruction-tuning", "format-constraint"], "learnings": "{\"what_changed\":\"\",\"what_improved\":[],\"what_regressed\":[],\"transferable_insight\":\"Clearer, more constrained instructions and examples tend to make outputs more consistent by reducing ambiguity in how the task should be performed.\",\"domain_tags\":[\"instruction-design\",\"evaluation\",\"consistency\"]}", "cost_usd": 0.023112350000000004, "bootstrap_seed": 0, "agent_model": "gpt-5.4", "held_out_score": null, "criterion_names": ["key_points_captured", "conciseness", "faithful_to_source", "few_shot_format"], "per_criterion_scores": {"key_points_captured": 0.8, "conciseness": 0.5, "faithful_to_source": 0.3, "few_shot_format": 0.2}, "failure_classification": null, "drafts_generated": 1, "drafts_survived": 1}
{"id": "1475ee3c-12ca-47d4-a437-f2efb27082c6", "target_id": "B2-greedy", "git_sha": "6a3c657efc4722ea0d66c503b7ca8c0e2b55a018", "pre_experiment_sha": "6a3c657efc4722ea0d66c503b7ca8c0e2b55a018", "timestamp": "2026-04-19T07:39:15.997573+00:00", "hypothesis": "Adding a clearer summary recipe and edge-case guidance will improve faithfulness and concise extraction of main points.", "hypothesis_source": "agent", "mutation_diff_summary": "", "score": 1.8, "score_ci_lower": 1.3, "score_ci_upper": 2.2, "raw_scores": [2.0, 1.5, 2.0, 2.5, 1.0], "baseline_score": 1.8, "outcome": "DISCARDED", "failure_mode": null, "duration_seconds": 20.797972916043364, "tags": ["instruction-clarity", "format-control", "faithfulness", "few-shot"], "learnings": "{\"what_changed\":\"\",\"what_improved\":[],\"what_regressed\":[],\"transferable_insight\":\"Adding more explicit guidance only helps when it resolves a real ambiguity or failure mode; otherwise it may produce no measurable change in quality.\",\"domain_tags\":[\"evaluation\",\"instruction-design\",\"experimentation\"]}", "cost_usd": 0.02452595, "bootstrap_seed": 0, "agent_model": "gpt-5.4", "held_out_score": null, "criterion_names": ["key_points_captured", "conciseness", "faithful_to_source", "few_shot_format"], "per_criterion_scores": {"key_points_captured": 1.0, "conciseness": 0.5, "faithful_to_source": 0.2, "few_shot_format": 0.1}, "failure_classification": {"category": "semantic_drift", "description": "The experiment was intended to improve faithfulness and concise extraction, but the result appears not to reflect the intended main-point extraction reliably. With a low score and an unknown failure mode, this most strongly suggests the output preserved the expected structure while drifting in meaning or emphasis rather than failing due to formatting/syntax.", "fix_direction": "Tighten content-faithfulness checks by adding explicit edge-case handling and verification that extracted points are entailed by the source text; constrain summarization steps to only use supported claims and add tests for tricky inputs.", "confidence": 0.45}, "drafts_generated": 1, "drafts_survived": 1}
{"id": "e721f919-43a4-4242-82ec-492e70ed9717", "target_id": "B2-greedy", "git_sha": "6a3c657efc4722ea0d66c503b7ca8c0e2b55a018", "pre_experiment_sha": "6a3c657efc4722ea0d66c503b7ca8c0e2b55a018", "timestamp": "2026-04-19T07:39:45.774403+00:00", "hypothesis": "Adding sharper extraction rules and edge-case guidance will improve faithful, concise summaries.", "hypothesis_source": "agent", "mutation_diff_summary": "", "score": 2.1, "score_ci_lower": 1.6, "score_ci_upper": 2.6, "raw_scores": [1.5, 2.5, 2.0, 1.5, 3.0], "baseline_score": 1.8, "outcome": "DISCARDED", "failure_mode": null, "duration_seconds": 26.94775012496393, "tags": ["summarization", "few-shot", "instruction-clarity", "faithfulness", "formatting"], "learnings": "{\"what_changed\":\"\",\"what_improved\":[],\"what_regressed\":[],\"transferable_insight\":\"Adding more precise rules and explicit edge-case guidance can improve the reliability of concise outputs, but only when those additions materially change behavior rather than merely increasing complexity.\",\"domain_tags\":[\"process-design\",\"quality-control\",\"instruction-design\"]}", "cost_usd": 0.02777535, "bootstrap_seed": 0, "agent_model": "gpt-5.4", "held_out_score": null, "criterion_names": ["key_points_captured", "conciseness", "faithful_to_source", "few_shot_format"], "per_criterion_scores": {"key_points_captured": 1.0, "conciseness": 0.6, "faithful_to_source": 0.4, "few_shot_format": 0.1}, "failure_classification": {"category": "incomplete_edit", "description": "The experiment does not specify a clear, successful change to the output; the failure mode is listed as unknown, and the low score suggests the intended extraction/rules and edge-case guidance were not fully applied or resulted in an inconsistent partial improvement.", "fix_direction": "Clarify and enumerate edge-case rules, then enforce them end-to-end in the summarization pipeline (including output checks) to ensure the full intended behavior is applied consistently.", "confidence": 0.42}, "drafts_generated": 1, "drafts_survived": 1}
{"id": "15a54379-bfaa-45bc-bd19-1d52197ed89e", "target_id": "B2-greedy", "git_sha": "6a3c657efc4722ea0d66c503b7ca8c0e2b55a018", "pre_experiment_sha": "6a3c657efc4722ea0d66c503b7ca8c0e2b55a018", "timestamp": "2026-04-19T07:40:09.410697+00:00", "hypothesis": "Tightening the summary rules with an explicit lead-with-main-point instruction will improve concise, faithful extraction.", "hypothesis_source": "agent", "mutation_diff_summary": "", "score": 2.0, "score_ci_lower": 1.3, "score_ci_upper": 3.0, "raw_scores": [1.5, 4.0, 1.5, 1.0, 2.0], "baseline_score": 1.8, "outcome": "DISCARDED", "failure_mode": null, "duration_seconds": 19.23264391697012, "tags": ["summarization", "brevity", "faithfulness", "few-shot"], "learnings": "{\"what_changed\":\"\",\"what_improved\":[],\"what_regressed\":[],\"transferable_insight\":\"Adding an explicit instruction to state the main point first can improve concise, faithful summarization, but the effect may be too small or inconsistent to justify adoption without stronger evidence.\",\"domain_tags\":[\"summarization\",\"prompt-design\",\"information-extraction\"]}", "cost_usd": 0.025299750000000003, "bootstrap_seed": 0, "agent_model": "gpt-5.4", "held_out_score": null, "criterion_names": ["key_points_captured", "conciseness", "faithful_to_source", "few_shot_format"], "per_criterion_scores": {"key_points_captured": 0.9, "conciseness": 0.3, "faithful_to_source": 0.5, "few_shot_format": 0.3}, "failure_classification": {"category": "incomplete_edit", "description": "The experiment is marked as a failure with an unspecified/unknown failure mode, suggesting the intended change to \u201ctighten the summary rules with an explicit lead-with-main-point instruction\u201d was not fully or consistently implemented, leaving the update incomplete or inconsistent with the expected extraction behavior.", "fix_direction": "Ensure the lead-with-main-point instruction is explicitly and consistently applied in the summary rules (including any prompt templates/guardrails), then verify output constraints are satisfied end-to-end before re-evaluating.", "confidence": 0.35}, "drafts_generated": 1, "drafts_survived": 1}
{"id": "6bf7d866-0a9b-485b-aeeb-de9a9623bae2", "target_id": "B2-greedy", "git_sha": "6a3c657efc4722ea0d66c503b7ca8c0e2b55a018", "pre_experiment_sha": "6a3c657efc4722ea0d66c503b7ca8c0e2b55a018", "timestamp": "2026-04-19T07:40:35.819269+00:00", "hypothesis": "Tightening the summary rules to emphasize the lead fact, omission of minor details, and compression should improve faithful 2\u20134 sentence outputs.", "hypothesis_source": "agent", "mutation_diff_summary": "", "score": 1.6, "score_ci_lower": 0.6, "score_ci_upper": 2.7, "raw_scores": [1.0, 0.0, 3.5, 1.5, 2.0], "baseline_score": 1.8, "outcome": "DISCARDED", "failure_mode": null, "duration_seconds": 23.68368391599506, "tags": ["summarization", "conciseness", "faithfulness", "few-shot"], "learnings": "{\"what_changed\":\"\",\"what_improved\":[],\"what_regressed\":[],\"transferable_insight\":\"When a change is discarded despite no clearly identified regressions, it suggests the evaluation criteria may be too coarse or misaligned to capture the intended quality gains.\",\"domain_tags\":[\"evaluation\",\"experimentation\",\"quality-assessment\"]}", "cost_usd": 0.024464350000000003, "bootstrap_seed": 0, "agent_model": "gpt-5.4", "held_out_score": null, "criterion_names": ["key_points_captured", "conciseness", "faithful_to_source", "few_shot_format"], "per_criterion_scores": {"key_points_captured": 0.6, "conciseness": 0.4, "faithful_to_source": 0.4, "few_shot_format": 0.2}, "failure_classification": {"category": "semantic_drift", "description": "The tightened summary rules did not result in faithful 2\u20134 sentence outputs; the low score suggests the edits likely altered meaning or omitted key qualifying details in a way that changed the intended content rather than merely compressing it.", "fix_direction": "Keep the lead fact priority while enforcing semantic preservation: add constraints/checks for entity/claim consistency, require retention of all required facts for correctness, and validate that compression removes only explicitly 'minor' details not affecting meaning.", "confidence": 0.45}, "drafts_generated": 1, "drafts_survived": 1}
{"id": "73140904-92b5-49cf-a11e-bd4373dd314e", "target_id": "B2-greedy", "git_sha": "6a3c657efc4722ea0d66c503b7ca8c0e2b55a018", "pre_experiment_sha": "6a3c657efc4722ea0d66c503b7ca8c0e2b55a018", "timestamp": "2026-04-19T07:40:58.493967+00:00", "hypothesis": "Clarifying that summaries should prioritize the single central development and omit minor details will improve concise factual extraction.", "hypothesis_source": "agent", "mutation_diff_summary": "", "score": 1.3, "score_ci_lower": 0.9, "score_ci_upper": 1.7, "raw_scores": [1.0, 1.5, 0.5, 2.0, 1.5], "baseline_score": 1.8, "outcome": "DISCARDED", "failure_mode": null, "duration_seconds": 20.20286199997645, "tags": ["summarization", "brevity", "faithfulness", "few-shot"], "learnings": "{\"what_changed\":\"\",\"what_improved\":[],\"what_regressed\":[],\"transferable_insight\":\"Explicitly directing attention to the single most central change and excluding minor details can improve concise factual extraction.\",\"domain_tags\":[\"instruction-design\",\"information-extraction\",\"summarization\"]}", "cost_usd": 0.02509355, "bootstrap_seed": 0, "agent_model": "gpt-5.4", "held_out_score": null, "criterion_names": ["key_points_captured", "conciseness", "faithful_to_source", "few_shot_format"], "per_criterion_scores": {"key_points_captured": 0.8, "conciseness": 0.2, "faithful_to_source": 0.2, "few_shot_format": 0.1}, "failure_classification": {"category": "semantic_drift", "description": "The attempt did not produce the intended behavior (prioritizing the single central development and omitting minor details) and instead generated output that was not meaningfully aligned with the hypothesis, despite appearing structurally acceptable.", "fix_direction": "Adjust prompting/selection rules so extraction focuses on the main development only, explicitly filter out minor/background details, and verify the summary\u2019s central claim matches the source\u2019s primary development.", "confidence": 0.62}, "drafts_generated": 1, "drafts_survived": 1}
{"id": "e6f878f7-c773-4e34-93a4-7a336290f741", "target_id": "B2-greedy", "git_sha": "6a3c657efc4722ea0d66c503b7ca8c0e2b55a018", "pre_experiment_sha": "6a3c657efc4722ea0d66c503b7ca8c0e2b55a018", "timestamp": "2026-04-19T07:41:20.241562+00:00", "hypothesis": "Clarify the summary should be brief, factual, and limited to major points while explicitly excluding minor details and speculation.", "hypothesis_source": "agent", "mutation_diff_summary": "", "score": 1.6, "score_ci_lower": 1.1, "score_ci_upper": 2.3, "raw_scores": [1.5, 1.5, 1.0, 3.0, 1.0], "baseline_score": 1.8, "outcome": "DISCARDED", "failure_mode": null, "duration_seconds": 18.02983087510802, "tags": ["clarity", "conciseness", "fidelity"], "learnings": "{\"what_changed\":\"\",\"what_improved\":[],\"what_regressed\":[],\"transferable_insight\":\"When a summary is intended to be brief and factual, explicitly constrain it to major points and exclude minor details and speculation to better align the output with the goal.\",\"domain_tags\":[\"communication\",\"summarization\",\"instruction-design\"]}", "cost_usd": 0.023741349999999998, "bootstrap_seed": 0, "agent_model": "gpt-5.4", "held_out_score": null, "criterion_names": ["key_points_captured", "conciseness", "faithful_to_source", "few_shot_format"], "per_criterion_scores": {"key_points_captured": 0.7, "conciseness": 0.5, "faithful_to_source": 0.2, "few_shot_format": 0.2}, "failure_classification": {"category": "logic_error", "description": "Failure mode and specific issue details are not provided, so the cause cannot be confidently mapped to a known category.", "fix_direction": "Provide the concrete failure evidence (error message, diff, or what the output looked like versus expected) to determine whether the issue is format/schema, logic, scope, syntax, meaning, or edit completeness.", "confidence": 0.12}, "drafts_generated": 1, "drafts_survived": 1}
{"id": "b6671d18-06a8-4abb-8ec0-2afacf964484", "target_id": "B2-greedy", "git_sha": "6a3c657efc4722ea0d66c503b7ca8c0e2b55a018", "pre_experiment_sha": "6a3c657efc4722ea0d66c503b7ca8c0e2b55a018", "timestamp": "2026-04-19T07:41:41.076373+00:00", "hypothesis": "Clarifying brevity, factuality, and omission of minor details will improve faithful 2\u20134 sentence summaries.", "hypothesis_source": "agent", "mutation_diff_summary": "", "score": 1.9, "score_ci_lower": 1.2, "score_ci_upper": 2.7, "raw_scores": [1.0, 2.0, 2.0, 3.5, 1.0], "baseline_score": 1.8, "outcome": "DISCARDED", "failure_mode": null, "duration_seconds": 18.530704000033438, "tags": ["clarity", "conciseness", "faithfulness"], "learnings": "{\"what_changed\":\"\",\"what_improved\":[],\"what_regressed\":[],\"transferable_insight\":\"Explicitly constraining style and scope can improve summary fidelity by reducing unnecessary elaboration and unsupported details.\",\"domain_tags\":[\"summarization\",\"prompting\",\"information-retrieval\"]}", "cost_usd": 0.023845949999999998, "bootstrap_seed": 0, "agent_model": "gpt-5.4", "held_out_score": null, "criterion_names": ["key_points_captured", "conciseness", "faithful_to_source", "few_shot_format"], "per_criterion_scores": {"key_points_captured": 0.9, "conciseness": 0.4, "faithful_to_source": 0.4, "few_shot_format": 0.2}, "failure_classification": {"category": "semantic_drift", "description": "The output likely preserved the target format superficially but did not maintain the intended meaning/content fidelity, indicating that the summary became factually inconsistent or omitted/altered key information beyond just minor details.", "fix_direction": "Prioritize factual alignment with the source: extract key facts first, then write a 2\u20134 sentence summary that preserves all major entities, quantities, and claims; verify each sentence maps to evidence from the original text and avoid rephrasing that changes meaning.", "confidence": 0.42}, "drafts_generated": 1, "drafts_survived": 1}
{"id": "092da9a0-f904-4dbb-b39a-ca8c783c9ddd", "target_id": "B2-greedy", "git_sha": "6a3c657efc4722ea0d66c503b7ca8c0e2b55a018", "pre_experiment_sha": "6a3c657efc4722ea0d66c503b7ca8c0e2b55a018", "timestamp": "2026-04-19T07:42:00.748204+00:00", "hypothesis": "Clarify brevity and faithfulness requirements while explicitly telling the model to omit minor details and speculation.", "hypothesis_source": "agent", "mutation_diff_summary": "", "score": 1.6, "score_ci_lower": 0.6, "score_ci_upper": 2.6, "raw_scores": [2.5, 3.0, 0.0, 0.5, 2.0], "baseline_score": 1.8, "outcome": "DISCARDED", "failure_mode": null, "duration_seconds": 17.247220249962993, "tags": ["clarity", "conciseness", "faithfulness"], "learnings": "{\"what_changed\":\"\",\"what_improved\":[],\"what_regressed\":[],\"transferable_insight\":\"Instructions that emphasize brevity and faithfulness while explicitly discouraging minor details and speculation can reduce useful content and hurt performance if they over-constrain the response.\",\"domain_tags\":[\"prompt-engineering\",\"instruction-design\",\"model-behavior\"]}", "cost_usd": 0.023506350000000002, "bootstrap_seed": 0, "agent_model": "gpt-5.4", "held_out_score": null, "criterion_names": ["key_points_captured", "conciseness", "faithful_to_source", "few_shot_format"], "per_criterion_scores": {"key_points_captured": 0.6, "conciseness": 0.2, "faithful_to_source": 0.6, "few_shot_format": 0.2}, "failure_classification": {"category": "semantic_drift", "description": "The prompt/hypothesis asks for clarified brevity and faithfulness with explicit omission of minor details and speculation, but the experiment result appears not to follow the intended meaning requirements. The low score (1.6) suggests the output likely adhered to some surface form while violating the intended semantic constraints (faithfulness/omission of speculation).", "fix_direction": "Focus on enforcing faithfulness and explicit \u201comit minor details/speculation\u201d instructions; add concrete compliance checks or rubric terms tied to faithfulness and brevity to prevent meaning drift.", "confidence": 0.42}, "drafts_generated": 1, "drafts_survived": 1}
{"id": "7669cb1d-0176-4de9-9f98-3de7b4d8d918", "target_id": "B2-greedy", "git_sha": "6a3c657efc4722ea0d66c503b7ca8c0e2b55a018", "pre_experiment_sha": "6a3c657efc4722ea0d66c503b7ca8c0e2b55a018", "timestamp": "2026-04-19T07:42:22.561400+00:00", "hypothesis": "Clarify that summaries must be brief, factual, and limited to major points while explicitly excluding minor details and speculation.", "hypothesis_source": "agent", "mutation_diff_summary": "", "score": 2.0, "score_ci_lower": 1.3, "score_ci_upper": 2.7, "raw_scores": [1.0, 2.5, 2.5, 3.0, 1.0], "baseline_score": 1.8, "outcome": "DISCARDED", "failure_mode": null, "duration_seconds": 17.782579749939032, "tags": ["clarity", "conciseness", "faithfulness"], "learnings": "{\"what_changed\":\"\",\"what_improved\":[],\"what_regressed\":[],\"transferable_insight\":\"When defining a summary requirement, explicitly constrain it to brief, factual coverage of only major points and exclude minor details and speculation to reduce ambiguity.\",\"domain_tags\":[\"communication\",\"requirements\",\"summarization\"]}", "cost_usd": 0.022602550000000003, "bootstrap_seed": 0, "agent_model": "gpt-5.4", "held_out_score": null, "criterion_names": ["key_points_captured", "conciseness", "faithful_to_source", "few_shot_format"], "per_criterion_scores": {"key_points_captured": 0.8, "conciseness": 0.6, "faithful_to_source": 0.4, "few_shot_format": 0.2}, "failure_classification": {"category": "semantic_drift", "description": "The experiment appears to have failed by not adhering to the intended meaning of the hypothesis: summaries should be brief, factual, limited to major points, and explicitly exclude minor details and speculation. The low score suggests the output likely drifted away from these constraints even if the structure was acceptable.", "fix_direction": "Ensure future outputs strictly follow the summary rules: brevity, factuality, major points only, and no speculation or minor details; verify compliance with all explicit inclusion/exclusion requirements before returning.", "confidence": 0.42}, "drafts_generated": 1, "drafts_survived": 1}
