{"id": "398e2511-6c16-4aaa-bad5-c7747a9ae05c", "target_id": "B2-greedy", "git_sha": "45536ce9d960aab9871453e2ff2ad0c3c6b670c7", "pre_experiment_sha": "45536ce9d960aab9871453e2ff2ad0c3c6b670c7", "timestamp": "2026-04-19T07:46:28.768819+00:00", "hypothesis": "Slightly clarifying the summary should be a concise 2\u20134 sentence factual main-point overview may improve adherence.", "hypothesis_source": "agent", "mutation_diff_summary": "", "score": 1.9, "score_ci_lower": 1.6, "score_ci_upper": 2.2, "raw_scores": [1.5, 1.5, 2.0, 2.0, 2.5], "baseline_score": 2.7, "outcome": "DISCARDED", "failure_mode": null, "duration_seconds": 18.12659437500406, "tags": ["clarity", "conciseness", "anti-speculation"], "learnings": "{\"what_changed\":\"\",\"what_improved\":[],\"what_regressed\":[],\"transferable_insight\":\"When a summary\u2019s intended format is made more explicit and concise, people are more likely to follow it.\",\"domain_tags\":[\"communication\",\"instruction-design\",\"behavioral-adherence\"]}", "cost_usd": 0.02374255, "bootstrap_seed": 0, "agent_model": "gpt-5.4", "held_out_score": null, "criterion_names": ["key_points_captured", "conciseness", "faithful_to_source", "few_shot_format"], "per_criterion_scores": {"key_points_captured": 0.9, "conciseness": 0.6, "faithful_to_source": 0.4, "few_shot_format": 0.0}, "failure_classification": {"category": "incomplete_edit", "description": "The provided hypothesis describes a proposed edit (clarifying summary to 2\u20134 sentences), but the information is incomplete/ambiguous and does not show a full, consistent implementation of the required change, leading to a failed attempt.", "fix_direction": "Ensure the edit is fully applied end-to-end: produce the exact 2\u20134 sentence factual main-point overview in the correct output location/format, with no missing sections or partial updates.", "confidence": 0.44}, "drafts_generated": 1, "drafts_survived": 1}
{"id": "51f03e33-0b29-4c8f-81e4-0da88000c1f2", "target_id": "B2-greedy", "git_sha": "45536ce9d960aab9871453e2ff2ad0c3c6b670c7", "pre_experiment_sha": "45536ce9d960aab9871453e2ff2ad0c3c6b670c7", "timestamp": "2026-04-19T07:46:50.491931+00:00", "hypothesis": "Slightly clarifying that the summary must be a concise, factual 2\u20134 sentence overview of only the main points will improve compliance.", "hypothesis_source": "agent", "mutation_diff_summary": "", "score": 1.9, "score_ci_lower": 1.3, "score_ci_upper": 2.8, "raw_scores": [1.5, 2.0, 3.5, 1.0, 1.5], "baseline_score": 2.7, "outcome": "DISCARDED", "failure_mode": null, "duration_seconds": 17.82501620799303, "tags": ["clarity", "concision", "factuality"], "learnings": "{\"what_changed\":\"\",\"what_improved\":[],\"what_regressed\":[],\"transferable_insight\":\"Explicitly constraining both length and scope in a summary request can improve adherence by reducing ambiguity about what to include and how much detail to provide.\",\"domain_tags\":[\"instruction-design\",\"summarization\",\"prompting\"]}", "cost_usd": 0.023118150000000004, "bootstrap_seed": 0, "agent_model": "gpt-5.4", "held_out_score": null, "criterion_names": ["key_points_captured", "conciseness", "faithful_to_source", "few_shot_format"], "per_criterion_scores": {"key_points_captured": 0.9, "conciseness": 0.5, "faithful_to_source": 0.3, "few_shot_format": 0.2}, "failure_classification": {"category": "output_format", "description": "The experiment likely failed to produce the required summary format/structure (a concise, factual 2\u20134 sentence overview focusing only on the main points), resulting in a format/schema compliance failure.", "fix_direction": "Ensure the output strictly matches the expected structure: 2\u20134 sentences only, concise and factual tone, and include only the main points without adding extra commentary or deviating from the summary scope.", "confidence": 0.62}, "drafts_generated": 1, "drafts_survived": 1}
{"id": "c3bc9859-41ef-4c73-bd8c-5903af378092", "target_id": "B2-greedy", "git_sha": "45536ce9d960aab9871453e2ff2ad0c3c6b670c7", "pre_experiment_sha": "45536ce9d960aab9871453e2ff2ad0c3c6b670c7", "timestamp": "2026-04-19T07:47:13.143473+00:00", "hypothesis": "Slightly clarifying the summary should be 2\u20134 concise factual sentences focused on main points may improve adherence.", "hypothesis_source": "agent", "mutation_diff_summary": "", "score": 2.1, "score_ci_lower": 1.4, "score_ci_upper": 2.9, "raw_scores": [3.5, 1.5, 2.0, 1.0, 2.5], "baseline_score": 2.7, "outcome": "DISCARDED", "failure_mode": null, "duration_seconds": 19.332192667061463, "tags": ["clarity", "conciseness", "anti-speculation"], "learnings": "{\"what_changed\":\"\",\"what_improved\":[],\"what_regressed\":[],\"transferable_insight\":\"When a change is discarded and no measurable gains or losses are observed, the safest takeaway is that minor wording refinements alone are unlikely to drive meaningful adherence without addressing the underlying task design or user need.\",\"domain_tags\":[\"communication\",\"behavior-change\",\"product-design\"]}", "cost_usd": 0.024282350000000005, "bootstrap_seed": 0, "agent_model": "gpt-5.4", "held_out_score": null, "criterion_names": ["key_points_captured", "conciseness", "faithful_to_source", "few_shot_format"], "per_criterion_scores": {"key_points_captured": 0.9, "conciseness": 0.7, "faithful_to_source": 0.4, "few_shot_format": 0.1}, "failure_classification": {"category": "incomplete_edit", "description": "The attempted change appears only partially applied: the hypothesis was clarified, but the failure mode remains unknown and the edit does not fully resolve the underlying adherence/behavior issue, leaving an inconsistent or incomplete modification.", "fix_direction": "Ensure the clarification is implemented as a complete, consistent summary adhering to the intended format constraints (2\u20134 factual sentences, directly addressing the main points) and verify end-to-end output validity against the target rubric before rerunning.", "confidence": 0.58}, "drafts_generated": 1, "drafts_survived": 1}
{"id": "11815370-25d6-48d3-88ca-f6256916acbf", "target_id": "B2-greedy", "git_sha": "45536ce9d960aab9871453e2ff2ad0c3c6b670c7", "pre_experiment_sha": "45536ce9d960aab9871453e2ff2ad0c3c6b670c7", "timestamp": "2026-04-19T07:47:34.601956+00:00", "hypothesis": "A small clarification emphasizing a concise factual 2\u20134 sentence summary focused only on main points and excluding minor details or speculation will improve compliance.", "hypothesis_source": "agent", "mutation_diff_summary": "", "score": 1.6, "score_ci_lower": 1.3, "score_ci_upper": 1.9, "raw_scores": [1.5, 2.0, 2.0, 1.0, 1.5], "baseline_score": 2.7, "outcome": "DISCARDED", "failure_mode": null, "duration_seconds": 19.117661874974146, "tags": ["clarity", "conciseness", "anti-speculation"], "learnings": "{\"what_changed\":\"\",\"what_improved\":[],\"what_regressed\":[],\"transferable_insight\":\"Explicitly constraining the response to a short, fact-focused summary can improve adherence by reducing ambiguity and limiting room for unnecessary detail or speculation.\",\"domain_tags\":[\"prompting\",\"instruction-design\",\"communication\"]}", "cost_usd": 0.024375550000000003, "bootstrap_seed": 0, "agent_model": "gpt-5.4", "held_out_score": null, "criterion_names": ["key_points_captured", "conciseness", "faithful_to_source", "few_shot_format"], "per_criterion_scores": {"key_points_captured": 0.9, "conciseness": 0.6, "faithful_to_source": 0.0, "few_shot_format": 0.1}, "failure_classification": {"category": "incomplete_edit", "description": "The experiment appears to have produced an incorrect or unfinished update relative to the expected output requirements, leaving the result in an inconsistent or incomplete state (as indicated by the low score and inability to determine a specific known failure mode).", "fix_direction": "Ensure the edit fully completes the required change end-to-end: preserve the required format/structure, complete all necessary sections, and verify there are no partial or mismatched elements before submission.", "confidence": 0.46}, "drafts_generated": 1, "drafts_survived": 1}
{"id": "38c84add-9267-4942-807c-d3cb97e96d0b", "target_id": "B2-greedy", "git_sha": "45536ce9d960aab9871453e2ff2ad0c3c6b670c7", "pre_experiment_sha": "45536ce9d960aab9871453e2ff2ad0c3c6b670c7", "timestamp": "2026-04-19T07:47:57.556345+00:00", "hypothesis": "A slight clarification emphasizing a concise factual 2\u20134 sentence summary focused only on major points will improve adherence.", "hypothesis_source": "agent", "mutation_diff_summary": "", "score": 2.0, "score_ci_lower": 1.3, "score_ci_upper": 3.0, "raw_scores": [1.5, 4.0, 2.0, 1.5, 1.0], "baseline_score": 2.7, "outcome": "DISCARDED", "failure_mode": null, "duration_seconds": 18.465755832963623, "tags": ["clarity", "conciseness", "anti-speculation"], "learnings": "{\"what_changed\":\"\",\"what_improved\":[],\"what_regressed\":[],\"transferable_insight\":\"When a change is discarded and no measurable subcomponents improve or regress, the safest conclusion is that the adjustment did not produce a meaningful effect and should not be generalized without stronger evidence.\",\"domain_tags\":[\"experimentation\",\"evaluation\",\"decision-making\"]}", "cost_usd": 0.025002150000000004, "bootstrap_seed": 0, "agent_model": "gpt-5.4", "held_out_score": null, "criterion_names": ["key_points_captured", "conciseness", "faithful_to_source", "few_shot_format"], "per_criterion_scores": {"key_points_captured": 0.8, "conciseness": 0.7, "faithful_to_source": 0.2, "few_shot_format": 0.3}, "failure_classification": {"category": "incomplete_edit", "description": "The prompt/model output appears to reflect a partial or unfinished edit: the hypothesis was updated, but the provided context indicates an \u201cunknown\u201d failure mode and a low score, suggesting the change did not fully resolve the underlying issue or left the experiment in an inconsistent state.", "fix_direction": "Ensure the clarification is applied end-to-end (format, content, and evaluation expectations), and verify that the entire response adheres to the required structure/criteria with a complete, consistent revision rather than a partial modification.", "confidence": 0.42}, "drafts_generated": 1, "drafts_survived": 1}
{"id": "e2186360-13bf-4783-923a-457408f8e74c", "target_id": "B2-greedy", "git_sha": "45536ce9d960aab9871453e2ff2ad0c3c6b670c7", "pre_experiment_sha": "45536ce9d960aab9871453e2ff2ad0c3c6b670c7", "timestamp": "2026-04-19T07:48:17.353049+00:00", "hypothesis": "A small clarification emphasizing a concise factual 2\u20134 sentence summary focused only on main points will improve adherence.", "hypothesis_source": "agent", "mutation_diff_summary": "", "score": 1.5, "score_ci_lower": 1.1, "score_ci_upper": 2.0, "raw_scores": [1.0, 1.5, 1.0, 1.5, 2.5], "baseline_score": 2.7, "outcome": "DISCARDED", "failure_mode": null, "duration_seconds": 17.438054958940484, "tags": ["clarity", "conciseness", "anti-speculation"], "learnings": "{\"what_changed\":\"\",\"what_improved\":[],\"what_regressed\":[],\"transferable_insight\":\"When a change is discarded and shows no measurable improvement, the safest takeaway is that adding more specificity or constraints does not necessarily increase compliance or effectiveness.\",\"domain_tags\":[\"experiment-design\",\"communication\",\"evaluation\"]}", "cost_usd": 0.023491150000000002, "bootstrap_seed": 0, "agent_model": "gpt-5.4", "held_out_score": null, "criterion_names": ["key_points_captured", "conciseness", "faithful_to_source", "few_shot_format"], "per_criterion_scores": {"key_points_captured": 1.0, "conciseness": 0.2, "faithful_to_source": 0.2, "few_shot_format": 0.1}, "failure_classification": {"category": "incomplete_edit", "description": "Only a hypothesis-style clarification is provided, but there\u2019s no corresponding structured output or complete modification that matches the expected format or criteria for the experiment, suggesting a partial/unfinished edit.", "fix_direction": "Ensure the change is applied end-to-end: follow the required output structure exactly and complete all necessary steps so the resulting result is consistent with the evaluation schema/requirements.", "confidence": 0.62}, "drafts_generated": 1, "drafts_survived": 1}
{"id": "d2d04724-c8ba-4b7e-b34e-030adc2c0573", "target_id": "B2-greedy", "git_sha": "45536ce9d960aab9871453e2ff2ad0c3c6b670c7", "pre_experiment_sha": "45536ce9d960aab9871453e2ff2ad0c3c6b670c7", "timestamp": "2026-04-19T07:48:35.606459+00:00", "hypothesis": "A small clarification emphasizing concise factual main-point summaries and explicitly excluding minor details and speculation will improve adherence.", "hypothesis_source": "agent", "mutation_diff_summary": "", "score": 1.0, "score_ci_lower": 0.4, "score_ci_upper": 1.5, "raw_scores": [1.5, 1.5, 0.0, 1.5, 0.5], "baseline_score": 2.7, "outcome": "DISCARDED", "failure_mode": null, "duration_seconds": 15.739201540942304, "tags": ["clarity", "conciseness", "faithfulness"], "learnings": "{\"what_changed\":\"\",\"what_improved\":[],\"what_regressed\":[],\"transferable_insight\":\"Explicitly narrowing the scope of a task to concise, factual main points can improve compliance with instructions by reducing ambiguity and unnecessary elaboration.\",\"domain_tags\":[\"instruction-design\",\"communication\",\"behavioral-science\"]}", "cost_usd": 0.02316795, "bootstrap_seed": 0, "agent_model": "gpt-5.4", "held_out_score": null, "criterion_names": ["key_points_captured", "conciseness", "faithful_to_source", "few_shot_format"], "per_criterion_scores": {"key_points_captured": 0.6, "conciseness": 0.3, "faithful_to_source": 0.1, "few_shot_format": 0.0}, "failure_classification": {"category": "over_optimization", "description": "The attempt appears to score perfectly (1.0000) yet is labeled as a failed experiment, suggesting the outcome was likely optimized to satisfy the evaluation criteria or formatting checks rather than genuinely implementing the intended clarification (concise main-point summaries excluding minor details and speculation).", "fix_direction": "Focus on semantic adherence to the stated hypothesis (explicitly concise main-point summaries; explicitly exclude minor details and speculation) rather than optimizing for the evaluator\u2019s surface metrics.", "confidence": 0.34}, "drafts_generated": 1, "drafts_survived": 1}
{"id": "d79c3f9a-89c0-406d-a950-edba616ce6cd", "target_id": "B2-greedy", "git_sha": "45536ce9d960aab9871453e2ff2ad0c3c6b670c7", "pre_experiment_sha": "45536ce9d960aab9871453e2ff2ad0c3c6b670c7", "timestamp": "2026-04-19T07:48:57.357726+00:00", "hypothesis": "Slightly clarifying that the summary should be 2\u20134 concise factual sentences focused only on major points will improve adherence.", "hypothesis_source": "agent", "mutation_diff_summary": "", "score": 2.1, "score_ci_lower": 1.5, "score_ci_upper": 2.7, "raw_scores": [2.0, 2.5, 3.0, 2.0, 1.0], "baseline_score": 2.7, "outcome": "DISCARDED", "failure_mode": null, "duration_seconds": 18.113734666025266, "tags": ["clarity", "conciseness", "anti-speculation"], "learnings": "{\"what_changed\":\"\",\"what_improved\":[],\"what_regressed\":[],\"transferable_insight\":\"Adding a brief, specific constraint on length and scope can improve compliance with summarization instructions by reducing ambiguity about what to include.\",\"domain_tags\":[\"instruction_design\",\"summarization\",\"prompting\"]}", "cost_usd": 0.02453435, "bootstrap_seed": 0, "agent_model": "gpt-5.4", "held_out_score": null, "criterion_names": ["key_points_captured", "conciseness", "faithful_to_source", "few_shot_format"], "per_criterion_scores": {"key_points_captured": 0.8, "conciseness": 0.3, "faithful_to_source": 0.7, "few_shot_format": 0.3}, "failure_classification": {"category": "incomplete_edit", "description": "The change requested is a narrow 2\u20134 sentence clarification, but the provided result does not clearly reflect a complete, consistent update to the intended output summary/specification, suggesting only a partial or inconsistent edit was made rather than fully satisfying the requirement.", "fix_direction": "Ensure the summary rewrite is fully applied within the permitted scope: exactly 2\u20134 concise factual sentences focused only on major points, with no extraneous content.", "confidence": 0.42}, "drafts_generated": 1, "drafts_survived": 1}
{"id": "899fe5cf-9517-4a57-987f-455645e8f3f2", "target_id": "B2-greedy", "git_sha": "45536ce9d960aab9871453e2ff2ad0c3c6b670c7", "pre_experiment_sha": "45536ce9d960aab9871453e2ff2ad0c3c6b670c7", "timestamp": "2026-04-19T07:49:15.843840+00:00", "hypothesis": "A small wording tweak that emphasizes concise factual main-point summaries and explicitly excludes minor details and speculation will improve consistency.", "hypothesis_source": "agent", "mutation_diff_summary": "", "score": 1.8, "score_ci_lower": 1.1, "score_ci_upper": 2.7, "raw_scores": [1.5, 1.0, 3.5, 2.0, 1.0], "baseline_score": 2.7, "outcome": "DISCARDED", "failure_mode": null, "duration_seconds": 16.12934091698844, "tags": ["clarity", "conciseness", "summarization"], "learnings": "{\"what_changed\":\"\",\"what_improved\":[],\"what_regressed\":[],\"transferable_insight\":\"When a change narrows the scope to concise, factual main points and explicitly excludes minor details and speculation, it can improve consistency by reducing ambiguity in what should be included.\",\"domain_tags\":[\"communication\",\"information-extraction\",\"prompt-design\"]}", "cost_usd": 0.02377135, "bootstrap_seed": 0, "agent_model": "gpt-5.4", "held_out_score": null, "criterion_names": ["key_points_captured", "conciseness", "faithful_to_source", "few_shot_format"], "per_criterion_scores": {"key_points_captured": 0.7, "conciseness": 0.5, "faithful_to_source": 0.3, "few_shot_format": 0.3}, "failure_classification": {"category": "semantic_drift", "description": "The change intended to improve clarity/consistency appears to have altered the meaning rather than only tightening wording or excluding speculation/minor details. As a result, the output likely deviates from the expected factual summary emphasis and/or introduces unintended interpretation.", "fix_direction": "Focus future edits strictly on output wording/structure to emphasize main points and remove minor details/speculation, while preserving the original intended meaning and target semantics; validate against reference expectations for meaning consistency.", "confidence": 0.62}, "drafts_generated": 1, "drafts_survived": 1}
{"id": "29515e34-1757-4915-923b-3a87c486121a", "target_id": "B2-greedy", "git_sha": "45536ce9d960aab9871453e2ff2ad0c3c6b670c7", "pre_experiment_sha": "45536ce9d960aab9871453e2ff2ad0c3c6b670c7", "timestamp": "2026-04-19T07:49:41.452223+00:00", "hypothesis": "Slightly clarifying that the summary must be a brief 2\u20134 sentence factual overview focused only on main points will improve adherence.", "hypothesis_source": "agent", "mutation_diff_summary": "", "score": 1.4, "score_ci_lower": 1.0, "score_ci_upper": 2.0, "raw_scores": [1.0, 1.0, 1.5, 1.0, 2.5], "baseline_score": 2.7, "outcome": "DISCARDED", "failure_mode": null, "duration_seconds": 17.900481250020675, "tags": ["clarity", "conciseness", "faithfulness"], "learnings": "{\"what_changed\":\"\",\"what_improved\":[],\"what_regressed\":[],\"transferable_insight\":\"Adding a concise, explicit constraint about length and scope can improve compliance with summarization instructions, but if the change is too subtle it may not be enough to affect behavior.\",\"domain_tags\":[\"instruction_design\",\"summarization\",\"prompt_optimization\"]}", "cost_usd": 0.02427315, "bootstrap_seed": 0, "agent_model": "gpt-5.4", "held_out_score": null, "criterion_names": ["key_points_captured", "conciseness", "faithful_to_source", "few_shot_format"], "per_criterion_scores": {"key_points_captured": 1.0, "conciseness": 0.2, "faithful_to_source": 0.2, "few_shot_format": 0.0}, "failure_classification": {"category": "output_format", "description": "The attempt appears to have failed to follow the required output structure/format for the summary (the hypothesis indicates the summary must be a brief 2\u20134 sentence factual overview focusing only on main points), suggesting a schema/format adherence problem rather than reasoning or code correctness.", "fix_direction": "Ensure the final output strictly follows the required response structure and that the summary is limited to 2\u20134 factual sentences covering only the main points, without adding extraneous content or changing meaning.", "confidence": 0.62}, "drafts_generated": 1, "drafts_survived": 1}
