{"id": "19340d0b-60ca-412f-8e6e-4a62328dcf1e", "target_id": "B2-greedy", "git_sha": "5d4229bb06a1f4b50b7e74de7532c2064266b5b5", "pre_experiment_sha": "5d4229bb06a1f4b50b7e74de7532c2064266b5b5", "timestamp": "2026-04-22T05:33:00.776241+00:00", "hypothesis": "Change the period in the first sentence to a semicolon to subtly alter the flow and increase density without modifying the vocabulary.", "hypothesis_source": "agent", "mutation_diff_summary": "", "score": 2.5, "score_ci_lower": 2.1, "score_ci_upper": 3.0, "raw_scores": [3.5, 2.5, 2.0, 2.0, 2.5], "baseline_score": 3.6, "outcome": "DISCARDED", "failure_mode": null, "duration_seconds": 66.8538082910236, "tags": ["punctuation", "minimal-change"], "learnings": "{\"what_changed\":\"\",\"what_improved\":[],\"what_regressed\":[],\"transferable_insight\":\"Replacing terminal punctuation with semicolons to artificially increase sentence density degrades content effectiveness and readability.\",\"domain_tags\":[\"Copywriting\",\"Readability\",\"Content Design\"]}", "cost_usd": 0.01164975, "bootstrap_seed": 0, "agent_model": "gemini-3.1-pro-preview", "held_out_score": null, "criterion_names": ["key_points_captured", "conciseness", "faithful_to_source", "few_shot_format"], "per_criterion_scores": {"key_points_captured": 1.0, "conciseness": 1.0, "faithful_to_source": 0.4, "few_shot_format": 0.1}, "failure_classification": {"category": "incomplete_edit", "description": "The model failed to fully and accurately execute the primary instruction to replace the period in the first sentence with a semicolon. This could manifest as not performing the edit at all, performing it partially (e.g., removing the period but not adding a semicolon), or performing it incorrectly (e.g., using a different punctuation mark, or inserting the semicolon in a grammatically unsound way that did not achieve the desired subtle alteration of flow and density).", "fix_direction": "Focus on improving the model's ability for precise and constrained text manipulation. This includes: accurately identifying the target element (the period), correctly performing the specified replacement (with a semicolon), and ensuring the resulting text remains grammatically correct and adheres to all explicit and implicit constraints (such as not modifying vocabulary or introducing ungrammatical structures).", "confidence": 0.9}, "drafts_generated": 1, "drafts_survived": 1}
{"id": "a06e058c-c401-4332-a834-830109036757", "target_id": "B2-greedy", "git_sha": "5d4229bb06a1f4b50b7e74de7532c2064266b5b5", "pre_experiment_sha": "5d4229bb06a1f4b50b7e74de7532c2064266b5b5", "timestamp": "2026-04-22T05:34:42.053253+00:00", "hypothesis": "Change the period to a semicolon in the opening instruction to create a tighter connection between the assistant persona and the summarization task without altering any vocabulary.", "hypothesis_source": "agent", "mutation_diff_summary": "", "score": 3.2, "score_ci_lower": 2.6, "score_ci_upper": 3.8, "raw_scores": [3.0, 2.5, 4.0, 4.0, 2.5], "baseline_score": 3.6, "outcome": "DISCARDED", "failure_mode": null, "duration_seconds": 61.83682887488976, "tags": ["punctuation", "minimal-change"], "learnings": "{\"what_changed\":\"\",\"what_improved\":[],\"what_regressed\":[],\"transferable_insight\":\"Replacing periods with semicolons to logically link related instructions can degrade performance, indicating that models generally process distinct, separate sentences more reliably than complex punctuation.\",\"domain_tags\":[\"Prompt Engineering\",\"Syntax\",\"Instruction Clarity\"]}", "cost_usd": 0.012815850000000002, "bootstrap_seed": 0, "agent_model": "gemini-3.1-pro-preview", "held_out_score": null, "criterion_names": ["key_points_captured", "conciseness", "faithful_to_source", "few_shot_format"], "per_criterion_scores": {"key_points_captured": 1.0, "conciseness": 1.0, "faithful_to_source": 0.8, "few_shot_format": 0.4}, "failure_classification": {"category": "semantic_drift", "description": "The subtle change from a period to a semicolon in the opening instruction was intended to create a tighter semantic connection between the persona and task. However, this punctuation alteration likely caused the model to misinterpret the instruction's nuance, leading to an unintended or less effective meaning (semantic drift) that resulted in significantly degraded performance (score 3.2).", "fix_direction": "Investigate how the model interprets different punctuation in instructions and test alternative phrasing or structures to unambiguously convey the desired 'tighter connection'. Consider A/B testing with different punctuation or wording to ensure the intended semantic effect is achieved, or revert to the original punctuation if it performs better.", "confidence": 0.95}, "drafts_generated": 1, "drafts_survived": 1}
{"id": "97068b6f-8b72-493b-83c5-8064d909a5ff", "target_id": "B2-greedy", "git_sha": "5d4229bb06a1f4b50b7e74de7532c2064266b5b5", "pre_experiment_sha": "5d4229bb06a1f4b50b7e74de7532c2064266b5b5", "timestamp": "2026-04-22T05:36:00.313944+00:00", "hypothesis": "Replace the period after \"assistant\" with a semicolon to subtly improve instruction cohesion without altering the vocabulary.", "hypothesis_source": "agent", "mutation_diff_summary": "", "score": 2.6, "score_ci_lower": 2.2, "score_ci_upper": 3.0, "raw_scores": [2.0, 3.0, 3.0, 2.0, 3.0], "baseline_score": 3.6, "outcome": "DISCARDED", "failure_mode": null, "duration_seconds": 55.81876162486151, "tags": ["punctuation", "minimal-change"], "learnings": "{\"what_changed\":\"\",\"what_improved\":[],\"what_regressed\":[],\"transferable_insight\":\"Replacing definitive structural boundaries with softer connectors, such as semicolons, to improve cohesion can actually degrade overall performance by complicating parsing.\",\"domain_tags\":[\"Prompt Engineering\",\"Syntax\",\"Instruction Formatting\"]}", "cost_usd": 0.0114429, "bootstrap_seed": 0, "agent_model": "gemini-3.1-pro-preview", "held_out_score": null, "criterion_names": ["key_points_captured", "conciseness", "faithful_to_source", "few_shot_format"], "per_criterion_scores": {"key_points_captured": 1.0, "conciseness": 1.0, "faithful_to_source": 0.3, "few_shot_format": 0.3}, "failure_classification": {"category": "semantic_drift", "description": "The experiment's objective was to subtly improve instruction cohesion through a punctuation change. While replacing a period with a semicolon is a grammatically valid change (correct format), the low score suggests it failed to achieve the desired semantic effect of improved cohesion. It likely either made the instruction less clear, altered its intended emphasis, or simply did not contribute positively to the flow, indicating the meaning or readability drifted from the intended improvement.", "fix_direction": "Re-evaluate the specific grammatical and rhetorical implications of the semicolon in this context. Consider that while a semicolon implies a closer relationship than a period, it may not always translate to 'improved cohesion' for instructions, especially if it creates ambiguity or changes the natural pause and flow. Explore alternative methods for improving cohesion, such as rephrasing, using stronger connectives, or restructuring the sentence entirely, rather than relying solely on punctuation.", "confidence": 0.95}, "drafts_generated": 1, "drafts_survived": 1}
{"id": "0015631d-b9ff-43b3-bb02-3f66cb4b708a", "target_id": "B2-greedy", "git_sha": "5d4229bb06a1f4b50b7e74de7532c2064266b5b5", "pre_experiment_sha": "5d4229bb06a1f4b50b7e74de7532c2064266b5b5", "timestamp": "2026-04-22T05:37:50.870184+00:00", "hypothesis": "Remove the filler word \"any\" from the \"No Outside Info\" rule to slightly alter the prompt without triggering drift.", "hypothesis_source": "agent", "mutation_diff_summary": "", "score": 2.6, "score_ci_lower": 2.0, "score_ci_upper": 3.4, "raw_scores": [3.0, 2.0, 2.0, 2.0, 4.0], "baseline_score": 3.6, "outcome": "DISCARDED", "failure_mode": null, "duration_seconds": 70.10241316608153, "tags": ["minimal-deletion"], "learnings": "{\"what_changed\":\"\",\"what_improved\":[],\"what_regressed\":[],\"transferable_insight\":\"Removing emphasizing words like 'any' from negative constraints can inadvertently weaken the model's adherence to those rules and degrade overall performance.\",\"domain_tags\":[\"Prompt Engineering\",\"Constraint Adherence\",\"Prompt Stability\"]}", "cost_usd": 0.0124039, "bootstrap_seed": 0, "agent_model": "gemini-3.1-pro-preview", "held_out_score": null, "criterion_names": ["key_points_captured", "conciseness", "faithful_to_source", "few_shot_format"], "per_criterion_scores": {"key_points_captured": 1.0, "conciseness": 1.0, "faithful_to_source": 0.4, "few_shot_format": 0.2}, "failure_classification": {"category": "semantic_drift", "description": "The experiment aimed to remove a filler word ('any') from a rule without causing semantic drift. The observed failure (score 2.6000) indicates that despite the minimal syntactic change, the removal of 'any' subtly altered the model's interpretation or emphasis of the 'No Outside Info' rule, leading to a shift in its understanding or behavior regarding outside information. This constitutes a semantic shift, meaning the intended meaning or stringency of the rule was not preserved.", "fix_direction": "Future attempts to subtly alter prompts should incorporate more rigorous testing for semantic equivalence. This could involve targeted evaluation metrics specifically designed to detect shifts in rule adherence or interpretation, A/B testing with human evaluators to assess perceived meaning, or developing specific 'adversarial' test cases that probe the boundaries of the rule's application to detect subtle changes in model behavior.", "confidence": 0.95}, "drafts_generated": 1, "drafts_survived": 1}
{"id": "d19acb2b-a6ef-4bc3-b8f5-e4387be92483", "target_id": "B2-greedy", "git_sha": "5d4229bb06a1f4b50b7e74de7532c2064266b5b5", "pre_experiment_sha": "5d4229bb06a1f4b50b7e74de7532c2064266b5b5", "timestamp": "2026-04-22T05:39:03.913632+00:00", "hypothesis": "Removing the redundant word \"some\" from the transition sentence to slightly alter the prompt and improve the score without triggering semantic drift.", "hypothesis_source": "agent", "mutation_diff_summary": "", "score": 2.6, "score_ci_lower": 2.2, "score_ci_upper": 3.0, "raw_scores": [2.0, 3.0, 3.0, 2.0, 3.0], "baseline_score": 3.6, "outcome": "DISCARDED", "failure_mode": null, "duration_seconds": 53.869081374956295, "tags": ["minimal-deletion"], "learnings": "{\"what_changed\":\"\",\"what_improved\":[],\"what_regressed\":[],\"transferable_insight\":\"Removing seemingly redundant filler words to streamline instructions can unexpectedly degrade performance, suggesting that minor stylistic elements often provide necessary contextual framing.\",\"domain_tags\":[\"Prompt Engineering\",\"Syntax Optimization\",\"Context Framing\"]}", "cost_usd": 0.011272850000000001, "bootstrap_seed": 0, "agent_model": "gemini-3.1-pro-preview", "held_out_score": null, "criterion_names": ["key_points_captured", "conciseness", "faithful_to_source", "few_shot_format"], "per_criterion_scores": {"key_points_captured": 1.0, "conciseness": 1.0, "faithful_to_source": 0.6, "few_shot_format": 0.0}, "failure_classification": {"category": "semantic_drift", "description": "The removal of the word 'some', while intended to eliminate redundancy, subtly altered the prompt's meaning or scope for the model. This shift in interpretation (semantic drift) led to a degraded output quality, resulting in the lower score of 2.6000, indicating that the assumption of 'some' being truly redundant was incorrect in this context.", "fix_direction": "Re-evaluate the original purpose and nuance conveyed by the word 'some' in the transition sentence. It may have provided crucial context or subtly guided the model's understanding. Consider reintroducing it, or exploring alternative phrasing that maintains the intended meaning and guides the model effectively without the perceived redundancy, to prevent unintended shifts in prompt interpretation.", "confidence": 0.9}, "drafts_generated": 1, "drafts_survived": 1}
{"id": "f7566d91-33df-4416-b74f-54872b9826db", "target_id": "B2-greedy", "git_sha": "5d4229bb06a1f4b50b7e74de7532c2064266b5b5", "pre_experiment_sha": "5d4229bb06a1f4b50b7e74de7532c2064266b5b5", "timestamp": "2026-04-22T05:40:22.363648+00:00", "hypothesis": "Remove the redundant filler word \"some\" and a trailing space to slightly perturb the prompt without triggering semantic drift.", "hypothesis_source": "agent", "mutation_diff_summary": "", "score": 2.3, "score_ci_lower": 2.0, "score_ci_upper": 2.7, "raw_scores": [2.0, 3.0, 2.0, 2.0, 2.5], "baseline_score": 3.6, "outcome": "DISCARDED", "failure_mode": null, "duration_seconds": 57.37634633295238, "tags": ["minimal-deletion", "whitespace-modification"], "learnings": "{\"what_changed\":\"\",\"what_improved\":[],\"what_regressed\":[],\"transferable_insight\":\"Removing seemingly redundant filler words and whitespace can unexpectedly degrade performance, demonstrating that models are highly sensitive to minor lexical and tokenization perturbations even when the core semantic meaning is preserved.\",\"domain_tags\":[\"Prompt Engineering\",\"Lexical Perturbation\",\"Tokenization\"]}", "cost_usd": 0.011068399999999999, "bootstrap_seed": 0, "agent_model": "gemini-3.1-pro-preview", "held_out_score": null, "criterion_names": ["key_points_captured", "conciseness", "faithful_to_source", "few_shot_format"], "per_criterion_scores": {"key_points_captured": 1.0, "conciseness": 1.0, "faithful_to_source": 0.2, "few_shot_format": 0.1}, "failure_classification": {"category": "semantic_drift", "description": "The experiment aimed to remove a supposedly redundant filler word (\"some\") and a trailing space without altering the prompt's meaning. The low score indicates that this perturbation, despite being minor, led to a change in the model's interpretation or output meaning, effectively triggering semantic drift, contrary to the hypothesis.", "fix_direction": "Re-evaluate the assumption that human-perceived 'redundant' words are also redundant to the model. Future attempts should focus on understanding the model's sensitivity to subtle linguistic cues and how 'filler words' might contribute implicitly to semantic context. Consider A/B testing various phrasings rather than direct removal for brevity, or conducting more rigorous pre-tests to confirm actual redundancy for the specific model.", "confidence": 0.95}, "drafts_generated": 1, "drafts_survived": 1}
{"id": "26715f9c-6e27-4961-907a-fb46b7a2ef3c", "target_id": "B2-greedy", "git_sha": "5d4229bb06a1f4b50b7e74de7532c2064266b5b5", "pre_experiment_sha": "5d4229bb06a1f4b50b7e74de7532c2064266b5b5", "timestamp": "2026-04-22T05:41:41.892826+00:00", "hypothesis": "Adding a single invisible space at the end of the \"Strict Rules for Summarization:\" line to safely mutate the prompt without triggering semantic drift or scope violation.", "hypothesis_source": "agent", "mutation_diff_summary": "", "score": 2.8, "score_ci_lower": 2.2, "score_ci_upper": 3.4, "raw_scores": [2.0, 3.0, 3.0, 2.0, 4.0], "baseline_score": 3.6, "outcome": "DISCARDED", "failure_mode": null, "duration_seconds": 42.79623620817438, "tags": ["whitespace", "formatting"], "learnings": "{\"what_changed\":\"\",\"what_improved\":[],\"what_regressed\":[],\"transferable_insight\":\"Seemingly benign, invisible formatting changes intended to safely mutate inputs without altering semantics can unexpectedly degrade overall system performance.\",\"domain_tags\":[\"Prompt Engineering\",\"System Robustness\",\"Input Formatting\"]}", "cost_usd": 0.01273305, "bootstrap_seed": 0, "agent_model": "gemini-3.1-pro-preview", "held_out_score": null, "criterion_names": ["key_points_captured", "conciseness", "faithful_to_source", "few_shot_format"], "per_criterion_scores": {"key_points_captured": 1.0, "conciseness": 1.0, "faithful_to_source": 0.6, "few_shot_format": 0.2}, "failure_classification": {"category": "semantic_drift", "description": "The invisible space, despite its apparent benign nature, likely altered the prompt's tokenization or internal representation for the language model. This change caused the model to misinterpret or shift its understanding of the 'Strict Rules for Summarization' instruction, leading to outputs that no longer adhered to the intended meaning of the prompt and thus resulted in a significantly degraded score (2.8).", "fix_direction": "Avoid using invisible or non-printing characters for prompt mutations, as they can lead to unpredictable changes in model interpretation and tokenization. Instead, consider explicit and visible prompt engineering techniques, or analyze the tokenization of the prompt before and after any change to ensure it aligns with expectations. Focus on mutations that are demonstrably inert or have a clear, controlled impact.", "confidence": 0.95}, "drafts_generated": 1, "drafts_survived": 1}
{"id": "7e262d60-c066-4238-b343-bc5de803c40a", "target_id": "B2-greedy", "git_sha": "5d4229bb06a1f4b50b7e74de7532c2064266b5b5", "pre_experiment_sha": "5d4229bb06a1f4b50b7e74de7532c2064266b5b5", "timestamp": "2026-04-22T05:42:55.413113+00:00", "hypothesis": "Adding a single invisible whitespace character (an extra space between two sentences in the opening paragraph) to subtly perturb the prompt without triggering semantic drift or scope violation.", "hypothesis_source": "agent", "mutation_diff_summary": "", "score": 3.0, "score_ci_lower": 2.2, "score_ci_upper": 3.8, "raw_scores": [2.0, 2.0, 4.0, 3.0, 4.0], "baseline_score": 3.6, "outcome": "DISCARDED", "failure_mode": null, "duration_seconds": 50.55302924988791, "tags": ["whitespace-only"], "learnings": "{\"what_changed\":\"\",\"what_improved\":[],\"what_regressed\":[],\"transferable_insight\":\"Introducing non-semantic formatting perturbations, such as extra whitespace, degrades model performance rather than acting as a harmless variation.\",\"domain_tags\":[\"Prompt Engineering\",\"Tokenization\",\"Robustness Testing\"]}", "cost_usd": 0.012355449999999999, "bootstrap_seed": 0, "agent_model": "gemini-3.1-pro-preview", "held_out_score": null, "criterion_names": ["key_points_captured", "conciseness", "faithful_to_source", "few_shot_format"], "per_criterion_scores": {"key_points_captured": 1.0, "conciseness": 1.0, "faithful_to_source": 0.6, "few_shot_format": 0.4}, "failure_classification": {"category": "scope_violation", "description": "The experiment introduced a single invisible whitespace character into the prompt, intending a subtle perturbation. However, despite the subtlety, this modification likely violated an implicit or explicit constraint that prompts must remain unaltered, or that only specific types of alterations are permitted. The 'unknown' failure mode suggests the system detected an unauthorized modification of the prompt string, leading to a low score, without diagnosing a specific semantic issue or output format error.", "fix_direction": "Thoroughly understand and strictly adhere to the rules governing prompt immutability or allowed modifications. If any alteration, no matter how minor, is considered out of scope by the evaluation system, then such experiments should be avoided or explicitly allowed under specific conditions.", "confidence": 0.85}, "drafts_generated": 1, "drafts_survived": 1}
{"id": "3620649f-f9cf-496e-a582-0bb0cbe03ce4", "target_id": "B2-greedy", "git_sha": "5d4229bb06a1f4b50b7e74de7532c2064266b5b5", "pre_experiment_sha": "5d4229bb06a1f4b50b7e74de7532c2064266b5b5", "timestamp": "2026-04-22T05:44:27.858611+00:00", "hypothesis": "Added an extra space after the first sentence to slightly alter tokenization without changing semantics or triggering strict evaluation failures.", "hypothesis_source": "agent", "mutation_diff_summary": "", "score": 2.6, "score_ci_lower": 2.2, "score_ci_upper": 3.0, "raw_scores": [3.0, 3.0, 2.0, 3.0, 2.0], "baseline_score": 3.6, "outcome": "DISCARDED", "failure_mode": null, "duration_seconds": 63.626348291989416, "tags": ["whitespace", "tokenization"], "learnings": "{\"what_changed\":\"\",\"what_improved\":[],\"what_regressed\":[],\"transferable_insight\":\"Minor formatting perturbations, such as adding extra whitespace to manipulate tokenization, can negatively impact system performance despite preserving semantic meaning.\",\"domain_tags\":[\"Prompt Engineering\",\"Tokenization\",\"Model Robustness\"]}", "cost_usd": 0.0112367, "bootstrap_seed": 0, "agent_model": "gemini-3.1-pro-preview", "held_out_score": null, "criterion_names": ["key_points_captured", "conciseness", "faithful_to_source", "few_shot_format"], "per_criterion_scores": {"key_points_captured": 1.0, "conciseness": 1.0, "faithful_to_source": 0.5, "few_shot_format": 0.1}, "failure_classification": {"category": "over_optimization", "description": "The experiment attempted to subtly manipulate tokenization by adding an extra space, without intending to change semantics. This constitutes an attempt to 'game' the evaluation system or find a minor technical advantage (over-optimization). The resulting lower score indicates this attempt failed or backfired, implying the evaluation system penalizes such deviations, even if semantically neutral from a human perspective.", "fix_direction": "Revert the whitespace change and avoid attempts to exploit tokenization quirks. Instead, focus on generating natural, semantically accurate, and conventionally formatted text. Investigate how the evaluation system handles whitespace and tokenization if such subtle changes have a significant impact.", "confidence": 0.9}, "drafts_generated": 1, "drafts_survived": 1}
