{"id": "e6525387-c025-4b44-bb63-e79ac5e36c81", "target_id": "B2-greedy", "git_sha": "5d4229bb06a1f4b50b7e74de7532c2064266b5b5", "pre_experiment_sha": "5d4229bb06a1f4b50b7e74de7532c2064266b5b5", "timestamp": "2026-04-22T05:21:25.466661+00:00", "hypothesis": "Convert the strict bulleted constraints into a natural, conversational paragraph that emphasizes factual accuracy, faithfulness, and flexible paraphrasing of the core meaning to improve binary criteria score and prevent semantic drift.", "hypothesis_source": "agent", "mutation_diff_summary": "", "score": 2.9, "score_ci_lower": 2.1, "score_ci_upper": 3.7, "raw_scores": [2.0, 2.5, 4.0, 2.0, 4.0], "baseline_score": 3.6, "outcome": "DISCARDED", "failure_mode": null, "duration_seconds": 68.53410795796663, "tags": ["prompt-engineering", "conversational-tone", "factual-accuracy", "remove-bulleted-constraints"], "learnings": "{\"what_changed\":\"\",\"what_improved\":[],\"what_regressed\":[],\"transferable_insight\":\"Replacing structured, bulleted constraints with conversational paragraphs degrades adherence to rules, indicating that strict formatting is more effective for enforcing precise criteria.\",\"domain_tags\":[\"Prompt Engineering\",\"Instruction Formatting\",\"Constraint Satisfaction\"]}", "cost_usd": 0.011968900000000001, "bootstrap_seed": 0, "agent_model": "gemini-3.1-pro-preview", "held_out_score": null, "criterion_names": ["key_points_captured", "conciseness", "faithful_to_source", "few_shot_format"], "per_criterion_scores": {"key_points_captured": 1.0, "conciseness": 1.0, "faithful_to_source": 0.5, "few_shot_format": 0.4}, "failure_classification": {"category": "semantic_drift", "description": "The experiment aimed to transform strict bulleted constraints into a natural, conversational paragraph while preserving factual accuracy and preventing semantic drift. The low score (2.9) indicates that despite potentially achieving the desired conversational format, the transformation likely resulted in a loss of core meaning, factual inaccuracies, or unfaithful paraphrasing, causing a deviation from the original intent of the constraints.", "fix_direction": "Implement stricter controls or evaluation mechanisms to ensure semantic fidelity during the paraphrasing process. Focus on maintaining critical keywords, factual assertions, and logical relationships from the original constraints. Consider incorporating semantic similarity metrics or human evaluation for accuracy alongside the binary criteria score. Prioritize faithful representation over pure conversational fluency when dealing with critical constraints.", "confidence": 0.9}, "drafts_generated": 1, "drafts_survived": 1}
{"id": "a67d897d-de3e-4f82-b35c-0abbbe80fde1", "target_id": "B2-greedy", "git_sha": "5d4229bb06a1f4b50b7e74de7532c2064266b5b5", "pre_experiment_sha": "5d4229bb06a1f4b50b7e74de7532c2064266b5b5", "timestamp": "2026-04-22T05:22:58.058779+00:00", "hypothesis": "Add a natural-language sentence to the system prompt emphasizing factual accuracy, faithfulness, and the flexibility to paraphrase naturally, without altering the existing structure or few-shot examples.", "hypothesis_source": "agent", "mutation_diff_summary": "", "score": 2.5, "score_ci_lower": 1.8, "score_ci_upper": 3.4, "raw_scores": [2.0, 3.0, 2.0, 4.0, 1.5], "baseline_score": 3.6, "outcome": "DISCARDED", "failure_mode": null, "duration_seconds": 76.99694345798343, "tags": ["prompt-engineering", "natural-language-instructions", "factual-accuracy"], "learnings": "{\"what_changed\":\"\",\"what_improved\":[],\"what_regressed\":[],\"transferable_insight\":\"Adding broad natural-language directives to a prompt that already relies on specific structures and few-shot examples can dilute the established constraints and degrade performance.\",\"domain_tags\":[\"Prompt Engineering\",\"System Prompt Design\",\"Few-Shot Prompting\"]}", "cost_usd": 0.011969650000000002, "bootstrap_seed": 0, "agent_model": "gemini-3.1-pro-preview", "held_out_score": null, "criterion_names": ["key_points_captured", "conciseness", "faithful_to_source", "few_shot_format"], "per_criterion_scores": {"key_points_captured": 0.9, "conciseness": 1.0, "faithful_to_source": 0.4, "few_shot_format": 0.2}, "failure_classification": {"category": "semantic_drift", "description": "The natural language sentence added to the system prompt, intended to emphasize factual accuracy, faithfulness, and natural paraphrasing, likely led to a misinterpretation by the model. This resulted in output content that semantically drifted from the desired quality or intent, manifesting as decreased accuracy, less faithful representations, or paraphrasing that was not aligned with the overall goal, thus leading to the low score.", "fix_direction": "Refine the natural language instruction to be more explicit, concise, and less ambiguous regarding what 'factual accuracy,' 'faithfulness,' and 'flexibility to paraphrase naturally' specifically mean in the context of the expected output. Investigate if the new instruction created conflicts with existing implicit or explicit instructions within the system prompt or few-shot examples, potentially by testing individual components of the instruction separately.", "confidence": 0.85}, "drafts_generated": 1, "drafts_survived": 1}
{"id": "fef0031f-fe6a-4442-8ada-202c7b88dfd5", "target_id": "B2-greedy", "git_sha": "5d4229bb06a1f4b50b7e74de7532c2064266b5b5", "pre_experiment_sha": "5d4229bb06a1f4b50b7e74de7532c2064266b5b5", "timestamp": "2026-04-22T05:24:29.071723+00:00", "hypothesis": "Insert the word \"accurately\" into the initial instruction to subtly reinforce faithfulness without altering structure or adding new sentences.", "hypothesis_source": "agent", "mutation_diff_summary": "", "score": 2.8, "score_ci_lower": 2.0, "score_ci_upper": 3.6, "raw_scores": [2.0, 3.0, 4.0, 3.5, 1.5], "baseline_score": 3.6, "outcome": "DISCARDED", "failure_mode": null, "duration_seconds": 52.5118447910063, "tags": ["microscopic-edit", "accuracy-focus"], "learnings": "{\"what_changed\":\"\",\"what_improved\":[],\"what_regressed\":[],\"transferable_insight\":\"Relying on subtle, single-word modifiers to enforce critical constraints is ineffective and can degrade overall performance compared to using explicit instructions.\",\"domain_tags\":[\"Prompt Engineering\",\"Constraint Enforcement\",\"Instruction Tuning\"]}", "cost_usd": 0.012731049999999999, "bootstrap_seed": 0, "agent_model": "gemini-3.1-pro-preview", "held_out_score": null, "criterion_names": ["key_points_captured", "conciseness", "faithful_to_source", "few_shot_format"], "per_criterion_scores": {"key_points_captured": 0.9, "conciseness": 1.0, "faithful_to_source": 0.6, "few_shot_format": 0.3}, "failure_classification": {"category": "semantic_drift", "description": "The hypothesis aimed to subtly reinforce 'faithfulness' by inserting the word 'accurately'. The low score (2.8) indicates that this modification did not convey the intended semantic meaning to the model, or the model interpreted 'accurately' in a way that did not lead to improved faithfulness (e.g., prioritizing factual correctness over strict adherence to source), resulting in a drift from the desired behavioral outcome. The instruction was grammatically correct, but its intended semantic effect was lost or misinterpreted.", "fix_direction": "Re-evaluate the choice of word to reinforce faithfulness. Consider alternative, potentially more explicit, phrasing that directly addresses adherence to the source or input. Analyze if 'accurately' might be misinterpreted by the model in a way that conflicts with 'faithfulness' in this specific context (e.g., factual accuracy vs. adherence to potentially flawed source).", "confidence": 0.9}, "drafts_generated": 1, "drafts_survived": 1}
{"id": "e3f96390-7258-45ff-83f3-81a8adf1c3ea", "target_id": "B2-greedy", "git_sha": "5d4229bb06a1f4b50b7e74de7532c2064266b5b5", "pre_experiment_sha": "5d4229bb06a1f4b50b7e74de7532c2064266b5b5", "timestamp": "2026-04-22T05:25:45.106813+00:00", "hypothesis": "Insert the word \"accurately\" into the opening instruction to emphasize factual precision without altering the prompt's structure or length.", "hypothesis_source": "agent", "mutation_diff_summary": "", "score": 2.8, "score_ci_lower": 2.0, "score_ci_upper": 3.6, "raw_scores": [2.0, 2.0, 4.0, 4.0, 2.0], "baseline_score": 3.6, "outcome": "DISCARDED", "failure_mode": null, "duration_seconds": 52.658898041117936, "tags": ["single-word-addition", "accuracy-emphasis"], "learnings": "{\"what_changed\":\"\",\"what_improved\":[],\"what_regressed\":[],\"transferable_insight\":\"Relying on a single adverb to enforce factual precision is ineffective and can degrade performance compared to providing explicit, criteria-based instructions.\",\"domain_tags\":[\"Prompt Engineering\",\"Instruction Design\",\"Factual Accuracy\"]}", "cost_usd": 0.01211095, "bootstrap_seed": 0, "agent_model": "gemini-3.1-pro-preview", "held_out_score": null, "criterion_names": ["key_points_captured", "conciseness", "faithful_to_source", "few_shot_format"], "per_criterion_scores": {"key_points_captured": 0.9, "conciseness": 1.0, "faithful_to_source": 0.5, "few_shot_format": 0.4}, "failure_classification": {"category": "scope_violation", "description": "The experiment failed because the attempt to insert the word 'accurately' likely resulted in an alteration of the prompt's structure or length. The hypothesis explicitly stated that the insertion must occur 'without altering the prompt's structure or length,' defining the strict scope of the permitted edit. Violating these conditions constitutes a scope violation.", "fix_direction": "Future attempts should prioritize methods that can insert the desired word while strictly adhering to the length and structure constraints. This might involve replacing an existing word of equivalent length, using abbreviations, or exploring more sophisticated text manipulation techniques to maintain the specified boundaries.", "confidence": 0.9}, "drafts_generated": 1, "drafts_survived": 1}
{"id": "693075d7-9a60-4166-8906-ea513a98104e", "target_id": "B2-greedy", "git_sha": "5d4229bb06a1f4b50b7e74de7532c2064266b5b5", "pre_experiment_sha": "5d4229bb06a1f4b50b7e74de7532c2064266b5b5", "timestamp": "2026-04-22T05:27:00.846285+00:00", "hypothesis": "Add the words \"accurately\" and \"original\" to the system instructions to slightly reinforce precision and faithfulness without altering the structure or adding new sentences.", "hypothesis_source": "agent", "mutation_diff_summary": "", "score": 2.6, "score_ci_lower": 2.0, "score_ci_upper": 3.4, "raw_scores": [2.0, 3.0, 4.0, 2.0, 2.0], "baseline_score": 3.6, "outcome": "DISCARDED", "failure_mode": null, "duration_seconds": 56.52362958295271, "tags": ["micro-optimization", "single-word-addition", "faithfulness"], "learnings": "{\"what_changed\":\"\",\"what_improved\":[],\"what_regressed\":[],\"transferable_insight\":\"Adding generic qualitative modifiers to instructions without providing specific structural guidance is ineffective for improving precision and can negatively impact performance.\",\"domain_tags\":[\"Prompt Engineering\",\"Instruction Design\",\"LLM Behavior\"]}", "cost_usd": 0.0120891, "bootstrap_seed": 0, "agent_model": "gemini-3.1-pro-preview", "held_out_score": null, "criterion_names": ["key_points_captured", "conciseness", "faithful_to_source", "few_shot_format"], "per_criterion_scores": {"key_points_captured": 1.0, "conciseness": 1.0, "faithful_to_source": 0.4, "few_shot_format": 0.2}, "failure_classification": {"category": "semantic_drift", "description": "The addition of seemingly innocuous words ('accurately', 'original') to the system instructions, intended to reinforce positive traits, likely caused the model to misinterpret its core task or to over-prioritize these concepts in a way that led to a significant degradation in performance. The model's internal understanding of 'accuracy' or 'originality' might have semantically drifted from the desired output, resulting in outputs that were either overly cautious, excessively novel (and thus incorrect/irrelevant), or otherwise misaligned with the task's true objective, leading to the extremely low score.", "fix_direction": "Investigate how the model interprets specific keywords, especially abstract ones. If 'precision' and 'faithfulness' are critical, explore more explicit or structured ways to convey these requirements, such as through examples, defining what 'original' means in context, or by breaking down complex instructions, rather than relying solely on single word additions which can have unforeseen semantic implications for the model.", "confidence": 0.9}, "drafts_generated": 1, "drafts_survived": 1}
{"id": "4c864ac9-2891-4011-9927-130e3d3fd160", "target_id": "B2-greedy", "git_sha": "5d4229bb06a1f4b50b7e74de7532c2064266b5b5", "pre_experiment_sha": "5d4229bb06a1f4b50b7e74de7532c2064266b5b5", "timestamp": "2026-04-22T05:28:29.317966+00:00", "hypothesis": "Change \"assistant\" to \"summarizer\", \"produce\" to \"generate\", and capitalize key constraints (\"STRICTLY FAITHFUL\", \"DO NOT\") to subtly strengthen adherence to instructions without triggering semantic drift.", "hypothesis_source": "agent", "mutation_diff_summary": "", "score": 2.3, "score_ci_lower": 2.0, "score_ci_upper": 2.7, "raw_scores": [3.0, 2.5, 2.0, 2.0, 2.0], "baseline_score": 3.6, "outcome": "DISCARDED", "failure_mode": null, "duration_seconds": 55.62265020911582, "tags": ["synonym_replacement", "capitalization"], "learnings": "{\"what_changed\":\"\",\"what_improved\":[],\"what_regressed\":[],\"transferable_insight\":\"Relying on typographic emphasis and subtle synonym swaps to enforce constraints is ineffective and can degrade overall performance.\",\"domain_tags\":[\"Prompt Engineering\",\"Instruction Following\",\"Typography\"]}", "cost_usd": 0.01209705, "bootstrap_seed": 0, "agent_model": "gemini-3.1-pro-preview", "held_out_score": null, "criterion_names": ["key_points_captured", "conciseness", "faithful_to_source", "few_shot_format"], "per_criterion_scores": {"key_points_captured": 1.0, "conciseness": 1.0, "faithful_to_source": 0.3, "few_shot_format": 0.0}, "failure_classification": {"category": "semantic_drift", "description": "The subtle changes in terminology ('assistant' to 'summarizer', 'produce' to 'generate') and capitalization of key constraints were intended to strengthen adherence but likely caused the model to misinterpret or misprioritize the instructions, leading to a significantly degraded output quality (indicated by the very low score of 2.3). This suggests the model's understanding of the prompt's meaning drifted from the intended interpretation.", "fix_direction": "Analyze the specific nature of the degraded output to pinpoint *how* the model's interpretation shifted (e.g., did 'summarizer' make it too brief, did capitalization lead to over-emphasis on one constraint at the expense of others?). Consider using more explicit instructions or clearer examples instead of relying on subtle linguistic nudges. Test individual changes rather than all at once to isolate which specific modification caused the negative impact.", "confidence": 0.95}, "drafts_generated": 1, "drafts_survived": 1}
{"id": "757783b7-ddfc-499c-a6fa-b3c5315a1d12", "target_id": "B2-greedy", "git_sha": "5d4229bb06a1f4b50b7e74de7532c2064266b5b5", "pre_experiment_sha": "5d4229bb06a1f4b50b7e74de7532c2064266b5b5", "timestamp": "2026-04-22T05:29:48.836185+00:00", "hypothesis": "Capitalizing the imperative verbs in the strict rules and substituting \"summarization assistant\" with \"summarizer\" to emphasize constraints without altering the prompt's length or semantic structure.", "hypothesis_source": "agent", "mutation_diff_summary": "", "score": 3.1, "score_ci_lower": 2.5, "score_ci_upper": 3.6, "raw_scores": [2.0, 3.5, 3.0, 3.0, 4.0], "baseline_score": 3.6, "outcome": "DISCARDED", "failure_mode": null, "duration_seconds": 60.96951854112558, "tags": ["capitalization", "synonym-replacement", "formatting"], "learnings": "{\"what_changed\":\"\",\"what_improved\":[],\"what_regressed\":[],\"transferable_insight\":\"Relying on typographic emphasis, such as capitalizing imperative verbs, and minor role renaming to enforce strict constraints is ineffective and can degrade overall performance.\",\"domain_tags\":[\"Prompt Engineering\",\"Constraint Formatting\",\"Persona Design\"]}", "cost_usd": 0.01296305, "bootstrap_seed": 0, "agent_model": "gemini-3.1-pro-preview", "held_out_score": null, "criterion_names": ["key_points_captured", "conciseness", "faithful_to_source", "few_shot_format"], "per_criterion_scores": {"key_points_captured": 1.0, "conciseness": 1.0, "faithful_to_source": 0.8, "few_shot_format": 0.3}, "failure_classification": {"category": "semantic_drift", "description": "The linguistic changes (capitalizing imperative verbs, substituting 'summarization assistant' with 'summarizer') intended to emphasize constraints likely altered the prompt's subtle meaning or tone, causing the language model to misinterpret the task or its boundaries, leading to a significant degradation in performance (score 3.1). The model might have become overly literal, lost nuance, or adopted an undesirable persona due to these changes.", "fix_direction": "Avoid relying solely on stylistic changes like capitalization for emphasis, as they can have unpredictable semantic effects on LLMs. Instead, try making constraints more explicit, rephrasing instructions for greater clarity, or using structural elements (e.g., bullet points, clear headings for rules) to emphasize importance without altering core meaning. Test each change incrementally to isolate its impact.", "confidence": 0.9}, "drafts_generated": 1, "drafts_survived": 1}
{"id": "d149d197-0643-4963-8876-4eea7a107d8e", "target_id": "B2-greedy", "git_sha": "5d4229bb06a1f4b50b7e74de7532c2064266b5b5", "pre_experiment_sha": "5d4229bb06a1f4b50b7e74de7532c2064266b5b5", "timestamp": "2026-04-22T05:31:03.314033+00:00", "hypothesis": "Capitalize \"DO NOT\" to emphasize the negative constraint and change \"produce\" to \"generate\" for slightly stronger task framing without altering length or meaning.", "hypothesis_source": "agent", "mutation_diff_summary": "", "score": 2.6, "score_ci_lower": 2.0, "score_ci_upper": 3.4, "raw_scores": [2.0, 2.0, 3.0, 2.0, 4.0], "baseline_score": 3.6, "outcome": "DISCARDED", "failure_mode": null, "duration_seconds": 53.72813820792362, "tags": ["capitalization", "synonym-replacement", "negative-constraint"], "learnings": "{\"what_changed\":\"\",\"what_improved\":[],\"what_regressed\":[],\"transferable_insight\":\"Emphasizing negative constraints through capitalization or making minor vocabulary substitutions for stronger framing can degrade rather than improve task performance.\",\"domain_tags\":[\"Prompt Engineering\",\"Instruction Formatting\",\"Negative Constraints\"]}", "cost_usd": 0.01185545, "bootstrap_seed": 0, "agent_model": "gemini-3.1-pro-preview", "held_out_score": null, "criterion_names": ["key_points_captured", "conciseness", "faithful_to_source", "few_shot_format"], "per_criterion_scores": {"key_points_captured": 1.0, "conciseness": 1.0, "faithful_to_source": 0.4, "few_shot_format": 0.2}, "failure_classification": {"category": "semantic_drift", "description": "The hypothesis aimed for stylistic and lexical changes ('DO NOT' capitalization, 'produce' to 'generate') intended not to alter meaning but to strengthen framing. However, the significant drop in score to 2.6000 suggests that these changes were misinterpreted by the model, leading to outputs with unintended or degraded meaning, despite adhering to the literal modifications.", "fix_direction": "Investigate how the model interpreted the emphasis ('DO NOT') and the lexical substitution ('generate'). It's possible the 'stronger framing' was over-applied, or 'generate' triggered different, less desirable internal representations. Future attempts should include more robust semantic evaluations to ensure linguistic changes do not inadvertently alter the model's core understanding or output quality. Consider testing the changes individually or with alternative phrasings.", "confidence": 0.95}, "drafts_generated": 1, "drafts_survived": 1}
