{"id": "3e184601-6060-462e-9aa3-fa6920d5765f", "target_id": "B2-greedy", "git_sha": "45536ce9d960aab9871453e2ff2ad0c3c6b670c7", "pre_experiment_sha": "45536ce9d960aab9871453e2ff2ad0c3c6b670c7", "timestamp": "2026-04-19T07:50:02.787060+00:00", "hypothesis": "A small clarification emphasizing 2\u20134 sentence factual summaries focused only on main points and excluding minor details or speculation will improve compliance.", "hypothesis_source": "agent", "mutation_diff_summary": "", "score": 1.6, "score_ci_lower": 1.3, "score_ci_upper": 1.9, "raw_scores": [2.0, 1.5, 1.0, 2.0, 1.5], "baseline_score": 2.7, "outcome": "DISCARDED", "failure_mode": null, "duration_seconds": 17.191070250002667, "tags": ["clarity", "conciseness", "faithfulness", "few-shot"], "learnings": "{\"what_changed\":\"\",\"what_improved\":[],\"what_regressed\":[],\"transferable_insight\":\"Adding restrictive formatting or brevity constraints can reduce compliance when they make the task feel less flexible or harder to satisfy, even if the intent is to simplify the response.\",\"domain_tags\":[\"instruction_design\",\"communication\",\"behavior_change\"]}", "cost_usd": 0.025675750000000004, "bootstrap_seed": 0, "agent_model": "gpt-5.4", "held_out_score": null, "criterion_names": ["key_points_captured", "conciseness", "faithful_to_source", "few_shot_format"], "per_criterion_scores": {"key_points_captured": 0.8, "conciseness": 0.3, "faithful_to_source": 0.5, "few_shot_format": 0.0}, "failure_classification": {"category": "output_format", "description": "The experiment failed despite a low score and an unspecified failure mode, suggesting the produced output likely did not follow the required structure/schema (rather than a reasoning/logic or semantic issue).", "fix_direction": "Ensure the response strictly adheres to the required output structure and formatting rules, with no extra/missing fields and correct schema compliance.", "confidence": 0.42}, "drafts_generated": 1, "drafts_survived": 1}
{"id": "db22e388-c54f-46fd-b810-ddf31a9c9cb4", "target_id": "B2-greedy", "git_sha": "45536ce9d960aab9871453e2ff2ad0c3c6b670c7", "pre_experiment_sha": "45536ce9d960aab9871453e2ff2ad0c3c6b670c7", "timestamp": "2026-04-19T07:50:23.127884+00:00", "hypothesis": "Slightly clarifying that the summary must be a concise, factual 2\u20134 sentence account of only the main points will improve adherence.", "hypothesis_source": "agent", "mutation_diff_summary": "", "score": 2.0, "score_ci_lower": 1.6, "score_ci_upper": 2.4, "raw_scores": [2.0, 2.5, 1.5, 1.5, 2.5], "baseline_score": 2.7, "outcome": "DISCARDED", "failure_mode": null, "duration_seconds": 17.998459583031945, "tags": ["clarity", "summarization", "concise"], "learnings": "{\"what_changed\":\"\",\"what_improved\":[],\"what_regressed\":[],\"transferable_insight\":\"Adding a brief, explicit constraint about length and scope can improve compliance with summarization instructions by reducing ambiguity.\",\"domain_tags\":[\"instruction-design\",\"summarization\",\"prompting\"]}", "cost_usd": 0.02490115, "bootstrap_seed": 0, "agent_model": "gpt-5.4", "held_out_score": null, "criterion_names": ["key_points_captured", "conciseness", "faithful_to_source", "few_shot_format"], "per_criterion_scores": {"key_points_captured": 1.0, "conciseness": 0.3, "faithful_to_source": 0.5, "few_shot_format": 0.2}, "failure_classification": {"category": "semantic_drift", "description": "The provided failed experiment appears to require a specific constraint (a concise, factual 2\u20134 sentence summary with only main points), but the failure classification is not identified and the outcome is likely incorrect meaning/constraint adherence rather than a parsing/format issue. This suggests the content may have followed the general structure while violating the intended summary scope (e.g., added irrelevant details or changed emphasis).", "fix_direction": "Ensure summaries are strictly 2\u20134 sentences, factual, and limited to the main points only; avoid adding auxiliary context or rephrasing that introduces new/secondary claims.", "confidence": 0.42}, "drafts_generated": 1, "drafts_survived": 1}
{"id": "95b52d36-35c0-44fc-bcb8-66c85802d94b", "target_id": "B2-greedy", "git_sha": "45536ce9d960aab9871453e2ff2ad0c3c6b670c7", "pre_experiment_sha": "45536ce9d960aab9871453e2ff2ad0c3c6b670c7", "timestamp": "2026-04-19T07:50:44.080020+00:00", "hypothesis": "A slight clarification emphasizing a concise, factual 2\u20134 sentence summary of only the main points will improve adherence.", "hypothesis_source": "agent", "mutation_diff_summary": "", "score": 1.3, "score_ci_lower": 1.1, "score_ci_upper": 1.5, "raw_scores": [1.5, 1.5, 1.5, 1.0, 1.0], "baseline_score": 2.7, "outcome": "DISCARDED", "failure_mode": null, "duration_seconds": 18.18614125007298, "tags": ["clarity", "concision", "factuality"], "learnings": "{\"what_changed\":\"\",\"what_improved\":[],\"what_regressed\":[],\"transferable_insight\":\"When a request is already constrained, adding extra emphasis on brevity and factuality may not improve compliance if it does not change the underlying task structure or incentives.\",\"domain_tags\":[\"communication\",\"prompt-design\",\"behavioral-design\"]}", "cost_usd": 0.02419315, "bootstrap_seed": 0, "agent_model": "gpt-5.4", "held_out_score": null, "criterion_names": ["key_points_captured", "conciseness", "faithful_to_source", "few_shot_format"], "per_criterion_scores": {"key_points_captured": 0.8, "conciseness": 0.3, "faithful_to_source": 0.2, "few_shot_format": 0.0}, "failure_classification": {"category": "logic_error", "description": "The provided hypothesis and failure information are too generic/undefined to support the intended improvement, suggesting the failure stems from incorrect or unsupported reasoning rather than formatting or syntax issues.", "fix_direction": "Make the hypothesis explicitly testable and tied to a specific, measurable evaluation criterion (e.g., define what 'adherence' means, how it is measured, and what change is expected to affect it).", "confidence": 0.34}, "drafts_generated": 1, "drafts_survived": 1}
{"id": "6c4c1001-6ee7-4f21-8923-a53afe52a4d5", "target_id": "B2-greedy", "git_sha": "45536ce9d960aab9871453e2ff2ad0c3c6b670c7", "pre_experiment_sha": "45536ce9d960aab9871453e2ff2ad0c3c6b670c7", "timestamp": "2026-04-19T07:51:06.557343+00:00", "hypothesis": "Slightly clarifying the summary should be 2\u20134 concise factual sentences focused only on main points may improve adherence.", "hypothesis_source": "agent", "mutation_diff_summary": "", "score": 1.7, "score_ci_lower": 1.1, "score_ci_upper": 2.6, "raw_scores": [3.5, 1.0, 1.5, 1.5, 1.0], "baseline_score": 2.7, "outcome": "DISCARDED", "failure_mode": null, "duration_seconds": 18.943244249909185, "tags": ["clarity", "concision", "instruction-tuning"], "learnings": "{\"what_changed\":\"\",\"what_improved\":[],\"what_regressed\":[],\"transferable_insight\":\"When a change is discarded and shows no measurable improvement or regression, it suggests the adjustment was too minor or insufficiently targeted to affect the outcome.\",\"domain_tags\":[\"evaluation\",\"iteration\",\"communication\"]}", "cost_usd": 0.022683150000000003, "bootstrap_seed": 0, "agent_model": "gpt-5.4", "held_out_score": null, "criterion_names": ["key_points_captured", "conciseness", "faithful_to_source", "few_shot_format"], "per_criterion_scores": {"key_points_captured": 0.8, "conciseness": 0.5, "faithful_to_source": 0.2, "few_shot_format": 0.2}, "failure_classification": {"category": "incomplete_edit", "description": "The attempt likely applied the requested clarification but did not fully complete a consistent, fully compliant edit (e.g., missing required elements or leaving an inconsistent partial change), resulting in a low overall score.", "fix_direction": "Verify that the summary is replaced end-to-end with 2\u20134 concise factual sentences covering only the main points, ensuring no leftover text or formatting inconsistencies from the prior version.", "confidence": 0.42}, "drafts_generated": 1, "drafts_survived": 1}
{"id": "8913a86d-7f32-428d-97e0-f4b4d62187a6", "target_id": "B2-greedy", "git_sha": "45536ce9d960aab9871453e2ff2ad0c3c6b670c7", "pre_experiment_sha": "45536ce9d960aab9871453e2ff2ad0c3c6b670c7", "timestamp": "2026-04-19T07:51:27.848580+00:00", "hypothesis": "Slightly clarifying that summaries must be concise, factual 2\u20134 sentence main-point overviews and explicitly excluding minor details and speculation will improve compliance.", "hypothesis_source": "agent", "mutation_diff_summary": "", "score": 2.4, "score_ci_lower": 1.9, "score_ci_upper": 2.9, "raw_scores": [1.5, 2.0, 3.0, 2.5, 3.0], "baseline_score": 2.7, "outcome": "DISCARDED", "failure_mode": null, "duration_seconds": 19.11688354203943, "tags": ["clarity", "concise", "factual", "constraint-tightening"], "learnings": "{\"what_changed\":\"\",\"what_improved\":[],\"what_regressed\":[],\"transferable_insight\":\"Explicitly stating both the desired level of detail and what to omit can improve adherence to a summarization task, but overly narrow wording may still fail if the instruction is not sufficiently actionable.\",\"domain_tags\":[\"instruction-design\",\"summarization\",\"prompting\"]}", "cost_usd": 0.024244750000000002, "bootstrap_seed": 0, "agent_model": "gpt-5.4", "held_out_score": null, "criterion_names": ["key_points_captured", "conciseness", "faithful_to_source", "few_shot_format"], "per_criterion_scores": {"key_points_captured": 1.0, "conciseness": 0.5, "faithful_to_source": 0.7, "few_shot_format": 0.2}, "failure_classification": {"category": "output_format", "description": "The experiment appears to have failed compliance with the required summary constraints (2\u20134 sentence concise, factual main-point only, with minor details/speculation explicitly excluded), indicating an output-format/nonconformance issue rather than reasoning or calculation.", "fix_direction": "Ensure summaries strictly follow the prescribed structure: exactly 2\u20134 sentences, only main factual points, and explicitly omit minor details and any speculation; add explicit wording constraints/checks in the generation template.", "confidence": 0.62}, "drafts_generated": 1, "drafts_survived": 1}
{"id": "43c96680-45c2-407d-9f10-64c9fd2955ed", "target_id": "B2-greedy", "git_sha": "45536ce9d960aab9871453e2ff2ad0c3c6b670c7", "pre_experiment_sha": "45536ce9d960aab9871453e2ff2ad0c3c6b670c7", "timestamp": "2026-04-19T07:51:48.971115+00:00", "hypothesis": "A tiny wording tweak emphasizing a concise, factual 2\u20134 sentence summary of only main points will improve adherence.", "hypothesis_source": "agent", "mutation_diff_summary": "", "score": 2.0, "score_ci_lower": 1.2, "score_ci_upper": 2.8, "raw_scores": [1.0, 2.5, 2.0, 1.0, 3.5], "baseline_score": 2.7, "outcome": "DISCARDED", "failure_mode": null, "duration_seconds": 18.095489208004437, "tags": ["clarity", "concision", "factuality"], "learnings": "{\"what_changed\":\"\",\"what_improved\":[],\"what_regressed\":[],\"transferable_insight\":\"Explicitly constraining the desired output format and scope can improve compliance, but if the constraint is too subtle or underspecified it may have no measurable effect.\",\"domain_tags\":[\"prompt_design\",\"behavior_change\"]}", "cost_usd": 0.023607350000000003, "bootstrap_seed": 0, "agent_model": "gpt-5.4", "held_out_score": null, "criterion_names": ["key_points_captured", "conciseness", "faithful_to_source", "few_shot_format"], "per_criterion_scores": {"key_points_captured": 1.0, "conciseness": 0.5, "faithful_to_source": 0.4, "few_shot_format": 0.1}, "failure_classification": {"category": "output_format", "description": "The experiment intended only a concise 2\u20134 sentence summary with main points, but the result appears to have failed the required output structure/schema or did not conform to the expected formatting constraints, leading to a low score despite meeting some intent.", "fix_direction": "Focus on producing output that exactly matches the required structure/schema and preserves the strict 2\u20134 sentence constraint; validate formatting programmatically if applicable before evaluating.", "confidence": 0.48}, "drafts_generated": 1, "drafts_survived": 1}
{"id": "ac453603-af2a-410d-a107-c3fa71b62261", "target_id": "B2-greedy", "git_sha": "45536ce9d960aab9871453e2ff2ad0c3c6b670c7", "pre_experiment_sha": "45536ce9d960aab9871453e2ff2ad0c3c6b670c7", "timestamp": "2026-04-19T07:52:13.117921+00:00", "hypothesis": "A tiny clarification emphasizing a concise factual 2\u20134 sentence summary of only main points, plus an explicit no-minor-details/no-speculation rule, will improve compliance.", "hypothesis_source": "agent", "mutation_diff_summary": "", "score": 2.0, "score_ci_lower": 1.4, "score_ci_upper": 2.6, "raw_scores": [2.5, 1.0, 1.5, 3.0, 2.0], "baseline_score": 2.7, "outcome": "DISCARDED", "failure_mode": null, "duration_seconds": 20.40399833302945, "tags": ["clarity", "conciseness", "small-edit", "few-shot"], "learnings": "{\"what_changed\":\"\",\"what_improved\":[],\"what_regressed\":[],\"transferable_insight\":\"Adding a brief, explicit constraint that narrows the response to only the main facts can improve compliance by reducing ambiguity and scope creep.\",\"domain_tags\":[\"instruction-design\",\"prompting\",\"communication\"]}", "cost_usd": 0.023729350000000003, "bootstrap_seed": 0, "agent_model": "gpt-5.4", "held_out_score": null, "criterion_names": ["key_points_captured", "conciseness", "faithful_to_source", "few_shot_format"], "per_criterion_scores": {"key_points_captured": 1.0, "conciseness": 0.4, "faithful_to_source": 0.4, "few_shot_format": 0.2}, "failure_classification": {"category": "incomplete_edit", "description": "The experiment failed with failure mode listed as unknown and a low score, and the provided content appears to be only a high-level hypothesis without demonstrating a complete, consistent implementation or verified compliance change. This suggests an incomplete or partial edit rather than a clear logic, format, or syntax issue.", "fix_direction": "Ensure the proposed clarification is fully applied end-to-end, producing a complete output that can be validated against the intended compliance criteria; verify that no extra edits remain inconsistent and that success criteria are explicitly satisfied.", "confidence": 0.42}, "drafts_generated": 1, "drafts_survived": 1}
{"id": "24a4b925-83db-41f1-9266-ce89aa686b2f", "target_id": "B2-greedy", "git_sha": "45536ce9d960aab9871453e2ff2ad0c3c6b670c7", "pre_experiment_sha": "45536ce9d960aab9871453e2ff2ad0c3c6b670c7", "timestamp": "2026-04-19T07:52:32.904661+00:00", "hypothesis": "A tiny wording tweak emphasizing a concise, factual 2\u20134 sentence summary of only main points and explicitly excluding minor details and speculation will improve adherence.", "hypothesis_source": "agent", "mutation_diff_summary": "", "score": 1.9, "score_ci_lower": 1.4, "score_ci_upper": 2.5, "raw_scores": [2.0, 1.0, 2.0, 3.0, 1.5], "baseline_score": 2.7, "outcome": "DISCARDED", "failure_mode": null, "duration_seconds": 16.758527499972843, "tags": ["clarity", "conciseness", "main-points"], "learnings": "{\"what_changed\":\"\",\"what_improved\":[],\"what_regressed\":[],\"transferable_insight\":\"Making instructions more explicit about scope and exclusions can improve compliance, but overly narrow or redundant wording changes may have no measurable benefit and can be discarded.\",\"domain_tags\":[\"instruction-design\",\"behavioral-experimentation\"]}", "cost_usd": 0.022627350000000004, "bootstrap_seed": 0, "agent_model": "gpt-5.4", "held_out_score": null, "criterion_names": ["key_points_captured", "conciseness", "faithful_to_source", "few_shot_format"], "per_criterion_scores": {"key_points_captured": 0.9, "conciseness": 0.6, "faithful_to_source": 0.2, "few_shot_format": 0.2}, "failure_classification": {"category": "semantic_drift", "description": "The experiment attempted to enforce concise, factual summaries, but the result likely drifted in meaning\u2014either by adding/removing content, implicitly reintroducing minor details/speculation, or failing to preserve the intended \u201cmain points only\u201d semantics despite meeting the intended length/wording goal.", "fix_direction": "Constrain generation to an explicit template: only 2\u20134 sentences, each mapped to one main point from the source, with a hard negative check to prevent minor details and speculation; add a verification step that compares extracted main points vs. produced sentences.", "confidence": 0.42}, "drafts_generated": 1, "drafts_survived": 1}
{"id": "cd3b3eeb-cd2c-480f-83d2-83bfd45a0bc4", "target_id": "B2-greedy", "git_sha": "45536ce9d960aab9871453e2ff2ad0c3c6b670c7", "pre_experiment_sha": "45536ce9d960aab9871453e2ff2ad0c3c6b670c7", "timestamp": "2026-04-19T07:52:51.872816+00:00", "hypothesis": "A tiny clarification emphasizing a concise, factual 2\u20134 sentence summary of only main points will improve compliance.", "hypothesis_source": "agent", "mutation_diff_summary": "", "score": 2.1, "score_ci_lower": 1.5, "score_ci_upper": 2.9, "raw_scores": [1.5, 2.5, 3.5, 1.5, 1.5], "baseline_score": 2.7, "outcome": "DISCARDED", "failure_mode": null, "duration_seconds": 16.020198665908538, "tags": ["clarity", "conciseness", "main-points"], "learnings": "{\"what_changed\":\"\",\"what_improved\":[],\"what_regressed\":[],\"transferable_insight\":\"When a directive is too vague, adding a brief, explicit constraint about scope and format can improve adherence by reducing ambiguity.\",\"domain_tags\":[\"communication\",\"instruction-design\",\"behavioral-science\"]}", "cost_usd": 0.023249950000000002, "bootstrap_seed": 0, "agent_model": "gpt-5.4", "held_out_score": null, "criterion_names": ["key_points_captured", "conciseness", "faithful_to_source", "few_shot_format"], "per_criterion_scores": {"key_points_captured": 1.0, "conciseness": 0.6, "faithful_to_source": 0.4, "few_shot_format": 0.1}, "failure_classification": {"category": "incomplete_edit", "description": "The attempt did not clearly implement the requested change/clarification in a complete, consistent way, resulting in a failed experiment despite a plausible direction. The outcome appears partially applied rather than fully aligned with the stated hypothesis.", "fix_direction": "Ensure the final output includes a complete 2\u20134 sentence concise factual summary that emphasizes only the main points, with no missing sections or partially applied edits; verify consistency end-to-end against the expected format.", "confidence": 0.42}, "drafts_generated": 1, "drafts_survived": 1}
{"id": "eea52fdd-c094-4222-8bcd-4a752f3494be", "target_id": "B2-greedy", "git_sha": "45536ce9d960aab9871453e2ff2ad0c3c6b670c7", "pre_experiment_sha": "45536ce9d960aab9871453e2ff2ad0c3c6b670c7", "timestamp": "2026-04-19T07:53:12.323581+00:00", "hypothesis": "A tiny wording change that explicitly emphasizes concise, factual 2\u20134 sentence summaries focused only on main points will improve compliance.", "hypothesis_source": "agent", "mutation_diff_summary": "", "score": 1.3, "score_ci_lower": 0.8, "score_ci_upper": 1.9, "raw_scores": [1.5, 1.0, 2.5, 0.5, 1.0], "baseline_score": 2.7, "outcome": "DISCARDED", "failure_mode": null, "duration_seconds": 16.906670917058364, "tags": ["clarity", "summarization", "constraint-tightening"], "learnings": "{\"what_changed\":\"\",\"what_improved\":[],\"what_regressed\":[],\"transferable_insight\":\"Explicitly constraining output length and scope can improve compliance by reducing ambiguity about what matters most.\",\"domain_tags\":[\"prompting\",\"instruction-design\",\"communication\"]}", "cost_usd": 0.023620550000000004, "bootstrap_seed": 0, "agent_model": "gpt-5.4", "held_out_score": null, "criterion_names": ["key_points_captured", "conciseness", "faithful_to_source", "few_shot_format"], "per_criterion_scores": {"key_points_captured": 0.8, "conciseness": 0.2, "faithful_to_source": 0.3, "few_shot_format": 0.0}, "failure_classification": {"category": "semantic_drift", "description": "A small wording tweak meant to improve compliance likely resulted in meanings or emphasis shifting away from the intended concise, factual 2\u20134 sentence main-point summaries, causing noncompliance despite the correct overall direction.", "fix_direction": "Reword with stricter adherence to meaning: keep content strictly limited to the main points, enforce factual/neutral tone, and validate that every sentence contributes only to the summary (no added rationale, framing, or extra details).", "confidence": 0.33}, "drafts_generated": 1, "drafts_survived": 1}
