{"id": "def40d34-fe26-4fd6-827a-254ba308858d", "target_id": "B2-greedy", "git_sha": "4aa393dc8fd3b4f08fcc9eb825917f26c9f26904", "pre_experiment_sha": "4aa393dc8fd3b4f08fcc9eb825917f26c9f26904", "timestamp": "2026-04-24T02:41:29.605599+00:00", "hypothesis": "Gently reinforce strict entailment in the instructions and incrementally increase conciseness in the few-shot examples without altering their core structure.", "hypothesis_source": "agent", "mutation_diff_summary": "", "score": 3.0, "score_ci_lower": 2.4, "score_ci_upper": 3.6, "raw_scores": [4.0, 2.5, 3.5, 2.0, 3.0], "baseline_score": 3.7, "outcome": "DISCARDED", "failure_mode": null, "duration_seconds": 59.4456970829051, "tags": ["prompt-engineering", "entailment", "conciseness", "few-shot"], "learnings": "{\"what_changed\":\"\",\"what_improved\":[],\"what_regressed\":[],\"transferable_insight\":\"Simultaneously enforcing strict rule adherence in instructions while reducing the detail of supporting examples degrades performance by depriving the system of necessary context.\",\"domain_tags\":[\"Prompt Engineering\",\"Few-Shot Learning\",\"Rule Adherence\"]}", "cost_usd": 0.0106733, "bootstrap_seed": 0, "agent_model": "gemini-3.1-pro-preview", "held_out_score": null, "criterion_names": ["key_points_captured", "conciseness", "faithful_to_source", "few_shot_format"], "per_criterion_scores": {"key_points_captured": 1.0, "conciseness": 1.0, "faithful_to_source": 0.7, "few_shot_format": 0.3}, "failure_classification": {"category": "semantic_drift", "description": "The experiment aimed to reinforce strict entailment and increase conciseness. A score of 3.0 suggests a partial failure, likely because the 'gentle reinforcement' combined with 'incremental conciseness' inadvertently caused the model's understanding of 'strict entailment' to drift. Instead of a precise logical relationship, the model might have interpreted entailment as a looser association or failed to grasp its strict boundaries, even if the output format itself was maintained. This misinterpretation of the core concept's meaning would lead to incorrect entailment judgments.", "fix_direction": "Re-evaluate the definition and emphasis of 'strict entailment' in the instructions; consider a less 'gentle' or more explicit reinforcement to ensure unambiguous understanding. Analyze if the increased conciseness in few-shot examples removed crucial semantic details necessary for the model to correctly infer and apply strict entailment. Experiment with varying levels of explicitness and detail in examples to ensure the intended meaning is consistently conveyed.", "confidence": 0.85}, "drafts_generated": 1, "drafts_survived": 1}
{"id": "a07da5fd-2bd4-4df5-b74c-11f22a885131", "target_id": "B2-greedy", "git_sha": "4aa393dc8fd3b4f08fcc9eb825917f26c9f26904", "pre_experiment_sha": "4aa393dc8fd3b4f08fcc9eb825917f26c9f26904", "timestamp": "2026-04-24T02:43:28.078382+00:00", "hypothesis": "Reframe the system instructions using positive constraints to improve accuracy and coherence without over-constraining the model or inadvertently causing semantic drift.", "hypothesis_source": "agent", "mutation_diff_summary": "", "score": 3.1, "score_ci_lower": 2.7, "score_ci_upper": 3.6, "raw_scores": [3.0, 2.5, 4.0, 3.0, 3.0], "baseline_score": 3.7, "outcome": "DISCARDED", "failure_mode": null, "duration_seconds": 74.31857795803808, "tags": ["positive-framing", "system-instruction-only"], "learnings": "{\"what_changed\":\"\",\"what_improved\":[],\"what_regressed\":[],\"transferable_insight\":\"Relying exclusively on positive constraints rather than explicit negative boundaries can degrade system performance by failing to adequately restrict unwanted behaviors.\",\"domain_tags\":[\"Prompt Engineering\",\"System Instructions\",\"Constraint Optimization\"]}", "cost_usd": 0.0116763, "bootstrap_seed": 0, "agent_model": "gemini-3.1-pro-preview", "held_out_score": null, "criterion_names": ["key_points_captured", "conciseness", "faithful_to_source", "few_shot_format"], "per_criterion_scores": {"key_points_captured": 1.0, "conciseness": 1.0, "faithful_to_source": 0.9, "few_shot_format": 0.2}, "failure_classification": {"category": "semantic_drift", "description": "The attempt to reframe system instructions using positive constraints, while aiming for improved accuracy and coherence, likely inadvertently caused the model to misinterpret or shift its understanding of the task requirements. This resulted in outputs that may have adhered to a surface-level interpretation but lacked the intended meaning or accuracy, aligning with the failure mode the hypothesis sought to avoid: 'inadvertently causing semantic drift'.", "fix_direction": "Carefully review the positive constraints introduced. Analyze specific examples where the model's output deviated from the expected meaning. Consider A/B testing variations of the positive constraints to isolate the problematic elements. Ensure the new instructions do not introduce ambiguity or subtly redefine key terms or objectives. Perhaps prompt the model to 'explain these instructions in its own words' to detect misinterpretations before evaluating task performance.", "confidence": 0.9}, "drafts_generated": 1, "drafts_survived": 1}
{"id": "63ff9fef-27f4-43b8-80f2-787508a65b30", "target_id": "B2-greedy", "git_sha": "4aa393dc8fd3b4f08fcc9eb825917f26c9f26904", "pre_experiment_sha": "4aa393dc8fd3b4f08fcc9eb825917f26c9f26904", "timestamp": "2026-04-24T02:44:31.011501+00:00", "hypothesis": "Replace negative constraints in the system instructions with positive framing to encourage accurate and objective summarization without over-constraining the model.", "hypothesis_source": "agent", "mutation_diff_summary": "", "score": 3.2, "score_ci_lower": 2.6, "score_ci_upper": 3.8, "raw_scores": [3.0, 2.0, 4.0, 3.0, 4.0], "baseline_score": 3.7, "outcome": "DISCARDED", "failure_mode": null, "duration_seconds": 46.82362825004384, "tags": ["instruction_modification", "positive_framing"], "learnings": "{\"what_changed\":\"\",\"what_improved\":[],\"what_regressed\":[],\"transferable_insight\":\"Replacing explicit negative constraints with positive framing can degrade performance, suggesting that clearly defining what not to do is essential for preventing unwanted behaviors and maintaining accuracy.\",\"domain_tags\":[\"Prompt Engineering\",\"Constraint Management\"]}", "cost_usd": 0.011886150000000002, "bootstrap_seed": 0, "agent_model": "gemini-3.1-pro-preview", "held_out_score": null, "criterion_names": ["key_points_captured", "conciseness", "faithful_to_source", "few_shot_format"], "per_criterion_scores": {"key_points_captured": 1.0, "conciseness": 1.0, "faithful_to_source": 0.8, "few_shot_format": 0.4}, "failure_classification": {"category": "semantic_drift", "description": "The attempt to replace negative constraints with positive framing, aimed at improving accurate and objective summarization, failed to achieve its goal. The model likely produced summaries that, despite possibly adhering to a general 'summary' format, drifted from the desired semantic quality by being inaccurate, biased, or misinterpreting the source material, indicating a failure in content meaning rather than structure.", "fix_direction": "1. **Analyze specific semantic shortcomings:** Pinpoint exactly where the summaries failed (e.g., factual inaccuracies, subjective language, omission of key points, misinterpretation). 2. **Refine positive framing:** Make the positive instructions more explicit about what constitutes 'accuracy' and 'objectivity' using concrete examples or more granular guidance. 3. **Iterative testing:** Test variations of positive framing, potentially combining it with very specific, targeted negative constraints if the model struggles with certain semantic pitfalls. 4. **Evaluate metrics beyond overall score:** Introduce more granular evaluation criteria focused on factuality, neutrality, and completeness to better diagnose semantic issues.", "confidence": 0.85}, "drafts_generated": 1, "drafts_survived": 1}
{"id": "d865a959-b9e4-48df-aefd-f80c47b54588", "target_id": "B2-greedy", "git_sha": "4aa393dc8fd3b4f08fcc9eb825917f26c9f26904", "pre_experiment_sha": "4aa393dc8fd3b4f08fcc9eb825917f26c9f26904", "timestamp": "2026-04-24T02:45:29.858697+00:00", "hypothesis": "Replacing negative constraints with positive framing in the system instructions to improve summarization accuracy without over-constraining the model.", "hypothesis_source": "agent", "mutation_diff_summary": "", "score": 2.9, "score_ci_lower": 2.4, "score_ci_upper": 3.5, "raw_scores": [3.0, 2.5, 3.0, 2.0, 4.0], "baseline_score": 3.7, "outcome": "DISCARDED", "failure_mode": null, "duration_seconds": 41.41946958308108, "tags": ["positive-framing", "instruction-modification"], "learnings": "{\"what_changed\":\"\",\"what_improved\":[],\"what_regressed\":[],\"transferable_insight\":\"Removing explicit negative constraints in favor of positive framing can degrade system performance, suggesting that explicitly stating what not to do is often necessary for accurate task execution.\",\"domain_tags\":[\"Prompt Engineering\",\"Instruction Design\",\"Constraint Management\"]}", "cost_usd": 0.011197450000000001, "bootstrap_seed": 0, "agent_model": "gemini-3.1-pro-preview", "held_out_score": null, "criterion_names": ["key_points_captured", "conciseness", "faithful_to_source", "few_shot_format"], "per_criterion_scores": {"key_points_captured": 1.0, "conciseness": 1.0, "faithful_to_source": 0.7, "few_shot_format": 0.2}, "failure_classification": {"category": "semantic_drift", "description": "The positive framing in the system instructions, while intended to improve summarization accuracy without over-constraining, likely led to summaries that were formally structured but diverged in meaning or factual content from the source material. This could manifest as hallucinations, misinterpretations, or missing key information, resulting in low accuracy.", "fix_direction": "Investigate the specific nature of the semantic drift by analyzing generated summaries for common errors (e.g., hallucination rate, factual inaccuracies, critical information omission). Experiment with hybrid instruction approaches that combine positive framing with targeted negative constraints or more explicit guidelines on desired summarization aspects to ensure content accuracy without excessive rigidity. Consider using few-shot examples that clearly demonstrate accurate summarization under the new framing.", "confidence": 0.9}, "drafts_generated": 1, "drafts_survived": 1}
{"id": "da8d8f37-9a25-453c-acd9-16fcf14c1798", "target_id": "B2-greedy", "git_sha": "4aa393dc8fd3b4f08fcc9eb825917f26c9f26904", "pre_experiment_sha": "4aa393dc8fd3b4f08fcc9eb825917f26c9f26904", "timestamp": "2026-04-24T02:46:59.945337+00:00", "hypothesis": "Refining the vocabulary and phrasing of the few-shot summaries to be more professional and coherent, while strictly preserving their original length, detail, and formatting, will improve the model's output quality without causing semantic drift.", "hypothesis_source": "agent", "mutation_diff_summary": "", "score": 3.0, "score_ci_lower": 2.4, "score_ci_upper": 3.6, "raw_scores": [2.0, 2.5, 3.0, 3.5, 4.0], "baseline_score": 3.7, "outcome": "DISCARDED", "failure_mode": null, "duration_seconds": 54.88445741706528, "tags": ["few-shot-tuning", "vocabulary-enhancement", "formatting-preservation"], "learnings": "{\"what_changed\":\"\",\"what_improved\":[],\"what_regressed\":[],\"transferable_insight\":\"Artificially elevating the vocabulary and tone of few-shot examples to be highly polished can degrade performance, indicating that models often align better with natural, representative phrasing.\",\"domain_tags\":[\"Prompt Engineering\",\"Few-Shot Learning\",\"Stylistic Alignment\"]}", "cost_usd": 0.011962150000000001, "bootstrap_seed": 0, "agent_model": "gemini-3.1-pro-preview", "held_out_score": null, "criterion_names": ["key_points_captured", "conciseness", "faithful_to_source", "few_shot_format"], "per_criterion_scores": {"key_points_captured": 1.0, "conciseness": 1.0, "faithful_to_source": 0.7, "few_shot_format": 0.3}, "failure_classification": {"category": "semantic_drift", "description": "The attempt to refine vocabulary and phrasing for professionalism and coherence inadvertently altered the original meaning or nuance of the few-shot summaries. This semantic drift likely undermined the intended improvement in output quality and violated the explicit constraint against causing semantic drift, despite potentially preserving length, detail, and formatting.", "fix_direction": "Implement a rigorous semantic equivalence check during the vocabulary refinement process. This could involve human evaluation to compare the original and refined summaries for meaning preservation, or leveraging automated semantic similarity metrics. Prioritize semantic fidelity over purely stylistic changes, ensuring that any rephphrasing maintains the exact original meaning.", "confidence": 0.9}, "drafts_generated": 1, "drafts_survived": 1}
{"id": "cdad3115-43eb-4c7a-97cc-2af65c191d23", "target_id": "B2-greedy", "git_sha": "4aa393dc8fd3b4f08fcc9eb825917f26c9f26904", "pre_experiment_sha": "4aa393dc8fd3b4f08fcc9eb825917f26c9f26904", "timestamp": "2026-04-24T02:48:17.566887+00:00", "hypothesis": "Enhance the vocabulary and logical flow of the few-shot examples to improve output coherence while strictly maintaining the exact summary length and leaving the system instructions untouched.", "hypothesis_source": "agent", "mutation_diff_summary": "", "score": 3.0, "score_ci_lower": 2.1, "score_ci_upper": 3.9, "raw_scores": [4.0, 4.0, 2.0, 3.5, 1.5], "baseline_score": 3.7, "outcome": "DISCARDED", "failure_mode": null, "duration_seconds": 58.49408550001681, "tags": ["few-shot", "refinement", "vocabulary"], "learnings": "{\"what_changed\":\"\",\"what_improved\":[],\"what_regressed\":[],\"transferable_insight\":\"Artificially elevating the complexity and vocabulary of few-shot examples without correspondingly updating the system instructions can create a stylistic mismatch that degrades performance.\",\"domain_tags\":[\"Prompt Engineering\",\"Few-Shot Prompting\",\"Prompt Alignment\"]}", "cost_usd": 0.0122266, "bootstrap_seed": 0, "agent_model": "gemini-3.1-pro-preview", "held_out_score": null, "criterion_names": ["key_points_captured", "conciseness", "faithful_to_source", "few_shot_format"], "per_criterion_scores": {"key_points_captured": 0.9, "conciseness": 1.0, "faithful_to_source": 0.6, "few_shot_format": 0.5}, "failure_classification": {"category": "semantic_drift", "description": "The experiment aimed to improve output coherence by enhancing the vocabulary and logical flow of few-shot examples. The failure, indicated by a low score (3.0000), suggests that despite potentially maintaining format constraints (summary length, untouched system instructions), the modifications to the examples did not lead to improved output meaning or quality. The model might have misinterpreted the 'enhanced' examples, resulting in summaries that were syntactically plausible and of the correct length, but lacked the desired coherence or conveyed an unintended meaning.", "fix_direction": "Re-evaluate the nature and impact of the 'enhanced' vocabulary and logical flow in the few-shot examples. It's possible the changes introduced unwanted complexity, ambiguity, or a stylistic bias that the model struggled to adapt to effectively, leading to a degradation in semantic quality. Future attempts should focus on simpler, clearer, and more direct enhancements that demonstrably guide the model towards genuinely improved coherence. Consider testing different styles of 'enhancement' and incorporating more robust human evaluation for semantic quality and coherence, rather than relying solely on automated metrics.", "confidence": 0.9}, "drafts_generated": 1, "drafts_survived": 1}
{"id": "cd9d08b9-1c7f-4be0-be79-3b36acb2d693", "target_id": "B2-greedy", "git_sha": "4aa393dc8fd3b4f08fcc9eb825917f26c9f26904", "pre_experiment_sha": "4aa393dc8fd3b4f08fcc9eb825917f26c9f26904", "timestamp": "2026-04-24T02:49:43.172599+00:00", "hypothesis": "Refine the vocabulary and phrasing of the few-shot summaries to improve professionalism and logical flow while strictly maintaining their exact length, structure, and original system instructions.", "hypothesis_source": "agent", "mutation_diff_summary": "", "score": 2.2, "score_ci_lower": 1.0, "score_ci_upper": 3.3, "raw_scores": [2.5, 0.0, 4.0, 2.0, 2.5], "baseline_score": 3.7, "outcome": "DISCARDED", "failure_mode": null, "duration_seconds": 61.101644083159044, "tags": ["few-shot", "refinement", "phrasing", "vocabulary"], "learnings": "{\"what_changed\":\"\",\"what_improved\":[],\"what_regressed\":[],\"transferable_insight\":\"Attempting to refine the vocabulary and style of few-shot examples while strictly enforcing exact length and structural constraints can degrade model performance, likely by introducing unnatural phrasing or conflicting optimization goals.\",\"domain_tags\":[\"Prompt Engineering\",\"Few-Shot Learning\",\"Text Generation\"]}", "cost_usd": 0.01144175, "bootstrap_seed": 0, "agent_model": "gemini-3.1-pro-preview", "held_out_score": null, "criterion_names": ["key_points_captured", "conciseness", "faithful_to_source", "few_shot_format"], "per_criterion_scores": {"key_points_captured": 0.8, "conciseness": 0.8, "faithful_to_source": 0.4, "few_shot_format": 0.2}, "failure_classification": {"category": "scope_violation", "description": "The experiment's attempt to refine vocabulary and phrasing inadvertently led to changes in aspects explicitly stated to be strictly maintained, such as the exact length, structure, or original system instructions of the summaries. The low score indicates a significant failure to adhere to these critical constraints.", "fix_direction": "Reinforce the strictness of the constraints within the prompt (e.g., 'ABSOLUTELY NO ALTERATIONS to length or structure'). Implement automated validation steps or evaluation metrics that specifically check for adherence to length, structure, and system instruction consistency. Consider few-shot examples that demonstrate adhering to the constraints while making stylistic edits.", "confidence": 0.9}, "drafts_generated": 1, "drafts_survived": 1}
{"id": "3ba8d335-4883-4b9c-a52d-f145d482858e", "target_id": "B2-greedy", "git_sha": "4aa393dc8fd3b4f08fcc9eb825917f26c9f26904", "pre_experiment_sha": "4aa393dc8fd3b4f08fcc9eb825917f26c9f26904", "timestamp": "2026-04-24T02:51:26.674360+00:00", "hypothesis": "Format the existing system instructions into clear bullet points with bolded key verbs to improve readability and parsing without altering the exact meaning or the few-shot examples.", "hypothesis_source": "agent", "mutation_diff_summary": "", "score": 3.2, "score_ci_lower": 2.5, "score_ci_upper": 3.9, "raw_scores": [4.0, 2.5, 4.0, 2.0, 3.5], "baseline_score": 3.7, "outcome": "DISCARDED", "failure_mode": null, "duration_seconds": 56.46025820891373, "tags": ["formatting", "readability", "bullet-points"], "learnings": "{\"what_changed\":\"\",\"what_improved\":[],\"what_regressed\":[],\"transferable_insight\":\"Applying human-centric readability formatting, such as bolding key verbs and using bullet points, can degrade model performance rather than improving instruction adherence.\",\"domain_tags\":[\"Prompt Engineering\",\"Instruction Formatting\",\"Markdown\"]}", "cost_usd": 0.0123602, "bootstrap_seed": 0, "agent_model": "gemini-3.1-pro-preview", "held_out_score": null, "criterion_names": ["key_points_captured", "conciseness", "faithful_to_source", "few_shot_format"], "per_criterion_scores": {"key_points_captured": 1.0, "conciseness": 1.0, "faithful_to_source": 0.7, "few_shot_format": 0.5}, "failure_classification": {"category": "semantic_drift", "description": "The experiment aimed to reformat system instructions without altering their exact meaning. A low score of 3.2 suggests that despite potential adherence to the new format (bullet points, bolded verbs), the underlying meaning of the instructions was likely changed or lost during the rephrasing process. This failure violates a core constraint of the hypothesis.", "fix_direction": "Implement stricter semantic equivalence checks after reformatting, perhaps using paraphrase detection models or human evaluation focusing specifically on meaning preservation. Consider techniques like 'constrained rephrasing' where key terms or phrases are protected from alteration. Evaluate the semantic impact before and after formatting using a more robust metric than just parsing or readability scores.", "confidence": 0.85}, "drafts_generated": 1, "drafts_survived": 1}
