{"id": "933e924a-cf40-4cc6-a5e2-21e119516fb3", "target_id": "B2-greedy", "git_sha": "4aa393dc8fd3b4f08fcc9eb825917f26c9f26904", "pre_experiment_sha": "4aa393dc8fd3b4f08fcc9eb825917f26c9f26904", "timestamp": "2026-04-24T03:05:11.339918+00:00", "hypothesis": "Adding a single invisible space at the end of the first line of the system instructions to trigger a zero-impact mutation while preserving all semantics, structure, and trailing newlines.", "hypothesis_source": "agent", "mutation_diff_summary": "", "score": 3.5, "score_ci_lower": 3.1, "score_ci_upper": 3.9, "raw_scores": [4.0, 3.5, 3.0, 4.0, 3.0], "baseline_score": 3.7, "outcome": "DISCARDED", "failure_mode": null, "duration_seconds": 43.611762791872025, "tags": ["zero-impact", "whitespace"], "learnings": "{\"what_changed\":\"\",\"what_improved\":[],\"what_regressed\":[],\"transferable_insight\":\"Introducing invisible structural mutations, such as trailing whitespace, can unexpectedly degrade system performance despite preserving core semantics.\",\"domain_tags\":[\"Prompt Engineering\",\"Formatting\",\"System Robustness\"]}", "cost_usd": 0.01280785, "bootstrap_seed": 0, "agent_model": "gemini-3.1-pro-preview", "held_out_score": null, "criterion_names": ["key_points_captured", "conciseness", "faithful_to_source", "few_shot_format"], "per_criterion_scores": {"key_points_captured": 1.0, "conciseness": 1.0, "faithful_to_source": 1.0, "few_shot_format": 0.5}, "failure_classification": {"category": "semantic_drift", "description": "The addition of a single 'invisible space,' despite its intended zero-impact, subtly altered the system's interpretation or processing of the system instructions. This led to a shift in the model's understanding or behavior (semantic drift), rather than preserving all semantics as hypothesized, resulting in a degraded score.", "fix_direction": "Investigate the system's sensitivity to subtle whitespace characters and their impact on tokenization and semantic parsing. Future attempts at 'zero-impact mutations' should rigorously validate true inertness across various internal representations and output evaluations, rather than assuming it based on human invisibility. Consider analyzing the model's internal representations (e.g., embeddings) for changes.", "confidence": 0.95}, "drafts_generated": 1, "drafts_survived": 1}
{"id": "8f2c39cd-9b55-45e4-b829-43170e338192", "target_id": "B2-greedy", "git_sha": "4aa393dc8fd3b4f08fcc9eb825917f26c9f26904", "pre_experiment_sha": "4aa393dc8fd3b4f08fcc9eb825917f26c9f26904", "timestamp": "2026-04-24T03:06:13.197926+00:00", "hypothesis": "Add a single invisible space at the end of the first line to trigger a new evaluation while making absolutely zero semantic, syntactic, or structural changes.", "hypothesis_source": "agent", "mutation_diff_summary": "", "score": 2.7, "score_ci_lower": 2.2, "score_ci_upper": 3.2, "raw_scores": [2.0, 3.0, 3.5, 2.0, 3.0], "baseline_score": 3.7, "outcome": "DISCARDED", "failure_mode": null, "duration_seconds": 42.37348687509075, "tags": ["invisible-change", "zero-impact"], "learnings": "{\"what_changed\":\"\",\"what_improved\":[],\"what_regressed\":[],\"transferable_insight\":\"Attempting to manipulate system evaluations through invisible, non-semantic formatting changes can negatively impact performance scores.\",\"domain_tags\":[\"System Evaluation\",\"Formatting\",\"Optimization\"]}", "cost_usd": 0.011808150000000002, "bootstrap_seed": 0, "agent_model": "gemini-3.1-pro-preview", "held_out_score": null, "criterion_names": ["key_points_captured", "conciseness", "faithful_to_source", "few_shot_format"], "per_criterion_scores": {"key_points_captured": 1.0, "conciseness": 1.0, "faithful_to_source": 0.6, "few_shot_format": 0.1}, "failure_classification": {"category": "semantic_drift", "description": "The hypothesis assumed that adding an invisible space would cause absolutely zero semantic changes from the perspective of the evaluation system. However, the failure (indicated by the score of 2.7000) suggests that the system likely interpreted the trailing whitespace as a meaningful semantic difference (e.g., a change in the line's content hash, a formatting violation, or a specific input pattern that triggered an undesirable evaluation outcome). The intended 'zero semantic change' drifted into a 'problematic semantic change' for the system.", "fix_direction": "Thoroughly investigate the evaluation system's sensitivity to whitespace and 'invisible' characters. If the goal is to trigger a new evaluation without affecting the intended meaning or structure, focus on mechanisms explicitly designed for re-evaluation triggers (e.g., metadata updates, version bumps, explicit re-run commands) rather than relying on seemingly trivial textual modifications that might be semantically interpreted by the system.", "confidence": 0.9}, "drafts_generated": 1, "drafts_survived": 1}
{"id": "0147b681-83ab-4c9f-92e1-070caabfc435", "target_id": "B2-greedy", "git_sha": "4aa393dc8fd3b4f08fcc9eb825917f26c9f26904", "pre_experiment_sha": "4aa393dc8fd3b4f08fcc9eb825917f26c9f26904", "timestamp": "2026-04-24T03:07:57.751988+00:00", "hypothesis": "Change \"Do not\" to \"Never\" in the system instructions to gently shift tokenization while perfectly preserving the original constraints and meaning.", "hypothesis_source": "agent", "mutation_diff_summary": "", "score": 3.2, "score_ci_lower": 2.4, "score_ci_upper": 4.0, "raw_scores": [2.0, 4.0, 4.0, 2.0, 4.0], "baseline_score": 3.7, "outcome": "DISCARDED", "failure_mode": null, "duration_seconds": 53.94171979208477, "tags": ["word-substitution", "system-prompt"], "learnings": "{\"what_changed\":\"\",\"what_improved\":[],\"what_regressed\":[],\"transferable_insight\":\"Substituting absolute terms like 'Never' for 'Do not' to alter tokenization can unexpectedly degrade performance, demonstrating that seemingly synonymous negative constraints are not strictly interchangeable.\",\"domain_tags\":[\"Prompt Engineering\",\"Tokenization\",\"Constraint Adherence\"]}", "cost_usd": 0.012362600000000001, "bootstrap_seed": 0, "agent_model": "gemini-3.1-pro-preview", "held_out_score": null, "criterion_names": ["key_points_captured", "conciseness", "faithful_to_source", "few_shot_format"], "per_criterion_scores": {"key_points_captured": 1.0, "conciseness": 1.0, "faithful_to_source": 0.6, "few_shot_format": 0.6}, "failure_classification": {"category": "semantic_drift", "description": "The experiment's hypothesis explicitly aimed to 'perfectly preserving the original constraints and meaning' while making a subtle linguistic change ('Do not' to 'Never'). The low score (3.2) strongly suggests that this change inadvertently altered the model's interpretation of the system instructions, leading to a deviation from the original intended meaning or constraint enforcement, despite the superficial similarity of the phrases. The meaning of the instructions likely 'drifted' from the original intent.", "fix_direction": "To prevent future semantic drift, thoroughly investigate the subtle linguistic nuances between proposed changes. Specifically, analyze how the model's tokenizer and internal representations are affected, and conduct targeted evaluations to ensure perfect preservation of meaning and constraint adherence. Consider if the tokenization benefit outweighs the risk of semantic shift, or explore alternative phrasing with guaranteed semantic equivalence.", "confidence": 0.95}, "drafts_generated": 1, "drafts_survived": 1}
{"id": "887160ca-b8fc-4e47-ba5d-52e551148041", "target_id": "B2-greedy", "git_sha": "4aa393dc8fd3b4f08fcc9eb825917f26c9f26904", "pre_experiment_sha": "4aa393dc8fd3b4f08fcc9eb825917f26c9f26904", "timestamp": "2026-04-24T03:09:21.031862+00:00", "hypothesis": "Swap the order of the first two few-shot examples (moving James Webb Space Telescope before OpenAI GPT-4) to refresh the context window and gently alter tokenization without changing vocabulary or constraints.", "hypothesis_source": "agent", "mutation_diff_summary": "", "score": 2.5, "score_ci_lower": 2.1, "score_ci_upper": 2.9, "raw_scores": [2.0, 2.5, 3.0, 2.0, 3.0], "baseline_score": 3.7, "outcome": "DISCARDED", "failure_mode": null, "duration_seconds": 59.89483024994843, "tags": ["few-shot-reordering", "context-refresh"], "learnings": "{\"what_changed\":\"\",\"what_improved\":[],\"what_regressed\":[],\"transferable_insight\":\"Arbitrarily reordering few-shot examples can disrupt the model's pattern recognition and degrade overall performance.\",\"domain_tags\":[\"Prompt Engineering\",\"Few-Shot Learning\",\"In-Context Learning\"]}", "cost_usd": 0.010479, "bootstrap_seed": 0, "agent_model": "gemini-3.1-pro-preview", "held_out_score": null, "criterion_names": ["key_points_captured", "conciseness", "faithful_to_source", "few_shot_format"], "per_criterion_scores": {"key_points_captured": 1.0, "conciseness": 1.0, "faithful_to_source": 0.5, "few_shot_format": 0.0}, "failure_classification": {"category": "semantic_drift", "description": "The experiment's subtle change to few-shot example order, intended to refresh context and alter tokenization, likely caused the model's interpretation or generation of meaning to shift negatively. This resulted in a low score (2.5000), suggesting the outputs were semantically incorrect or off-topic, even if their format was acceptable. The exact nature of this semantic shift remains unknown.", "fix_direction": "To address this, investigate the specific qualitative differences in the model's output between the original and modified example orders. Analyze sample outputs to pinpoint *how* the meaning drifted (e.g., misinterpretations, incorrect facts, changed tone/style). Consider testing a wider range of few-shot examples, different ordering permutations, or explicitly reinforcing the desired meaning/constraints in the prompt to re-anchor the model's understanding.", "confidence": 0.85}, "drafts_generated": 1, "drafts_survived": 1}
{"id": "5a32bbdb-a628-49f4-bf79-d3b58ea3252a", "target_id": "B2-greedy", "git_sha": "4aa393dc8fd3b4f08fcc9eb825917f26c9f26904", "pre_experiment_sha": "4aa393dc8fd3b4f08fcc9eb825917f26c9f26904", "timestamp": "2026-04-24T03:10:42.217846+00:00", "hypothesis": "Swap the order of the second and third few-shot examples to refresh the context window tokenization while preserving all vocabulary and formatting constraints perfectly.", "hypothesis_source": "agent", "mutation_diff_summary": "", "score": 2.3, "score_ci_lower": 1.8, "score_ci_upper": 2.8, "raw_scores": [2.0, 3.0, 2.0, 1.5, 3.0], "baseline_score": 3.7, "outcome": "DISCARDED", "failure_mode": null, "duration_seconds": 55.61477808305062, "tags": ["few-shot", "reordering", "formatting-preservation"], "learnings": "{\"what_changed\":\"\",\"what_improved\":[],\"what_regressed\":[],\"transferable_insight\":\"Arbitrarily changing the order of few-shot examples can significantly degrade performance, demonstrating that the sequence itself carries important implicit context for the model.\",\"domain_tags\":[\"Prompt Engineering\",\"Few-Shot Learning\",\"Context Management\"]}", "cost_usd": 0.010156350000000001, "bootstrap_seed": 0, "agent_model": "gemini-3.1-pro-preview", "held_out_score": null, "criterion_names": ["key_points_captured", "conciseness", "faithful_to_source", "few_shot_format"], "per_criterion_scores": {"key_points_captured": 1.0, "conciseness": 0.9, "faithful_to_source": 0.3, "few_shot_format": 0.1}, "failure_classification": {"category": "regression", "description": "The experiment involved a subtle change (swapping few-shot example order) intended to refresh context tokenization. The resulting low score of 2.3000 indicates a degradation in performance compared to a baseline or expected outcome, signifying that the modification negatively impacted the system's efficacy.", "fix_direction": "Revert the change to the few-shot example order. Before attempting similar interventions, further research is needed into how context window tokenization is affected by example order and its impact on model performance. Consider isolating the effect of reordering from other variables or testing with a more robust evaluation suite.", "confidence": 0.9}, "drafts_generated": 1, "drafts_survived": 1}
{"id": "0b56ea38-242e-433f-9106-8e09a73ddda5", "target_id": "B2-greedy", "git_sha": "4aa393dc8fd3b4f08fcc9eb825917f26c9f26904", "pre_experiment_sha": "4aa393dc8fd3b4f08fcc9eb825917f26c9f26904", "timestamp": "2026-04-24T03:12:08.353955+00:00", "hypothesis": "Introduce a double space after the first period in the system instructions to alter tokenization without modifying any words, punctuation, or semantics.", "hypothesis_source": "agent", "mutation_diff_summary": "", "score": 3.0, "score_ci_lower": 2.4, "score_ci_upper": 3.6, "raw_scores": [3.5, 2.5, 3.0, 2.0, 4.0], "baseline_score": 3.7, "outcome": "DISCARDED", "failure_mode": null, "duration_seconds": 42.920441875001416, "tags": ["double space", "tokenization", "minimal adjustment"], "learnings": "{\"what_changed\":\"\",\"what_improved\":[],\"what_regressed\":[],\"transferable_insight\":\"Attempting to manipulate underlying data processing through non-semantic formatting changes, such as adding extra whitespace, can unexpectedly degrade overall system performance.\",\"domain_tags\":[\"Prompt Engineering\",\"Data Formatting\",\"System Optimization\"]}", "cost_usd": 0.011797400000000001, "bootstrap_seed": 0, "agent_model": "gemini-3.1-pro-preview", "held_out_score": null, "criterion_names": ["key_points_captured", "conciseness", "faithful_to_source", "few_shot_format"], "per_criterion_scores": {"key_points_captured": 1.0, "conciseness": 1.0, "faithful_to_source": 0.7, "few_shot_format": 0.3}, "failure_classification": {"category": "semantic_drift", "description": "The experiment aimed to alter tokenization without changing semantics. The 'unknown' failure mode and a score of 3.0 suggest that while the textual content and punctuation remained unchanged, the subtle modification (double space) likely altered the tokenization in a way that caused an unintended shift in the model's internal interpretation or processing of the instructions. This led to a degraded outcome (score 3.0) where the instructions were effectively 'misunderstood' or processed suboptimally, even if no explicit semantic change was intended by the user.", "fix_direction": "Analyze the exact tokenization differences caused by the double space and investigate how these differences correlate with the observed decline in performance. Focus on understanding how subtle changes in token boundaries or token identities can lead to shifts in the model's internal representation and subsequent behavior. If the goal is to alter tokenization, explore methods that have more predictable or verifiable impacts on semantic understanding rather than relying on subtle, potentially unpredictable, changes.", "confidence": 0.8}, "drafts_generated": 1, "drafts_survived": 1}
{"id": "ce57b4e6-2db5-4198-838f-9f2b175bb691", "target_id": "B2-greedy", "git_sha": "4aa393dc8fd3b4f08fcc9eb825917f26c9f26904", "pre_experiment_sha": "4aa393dc8fd3b4f08fcc9eb825917f26c9f26904", "timestamp": "2026-04-24T03:13:34.756802+00:00", "hypothesis": "Introduce a double space after the first sentence in the system instructions to alter tokenization without changing any words, meaning, or constraints.", "hypothesis_source": "agent", "mutation_diff_summary": "", "score": 2.2, "score_ci_lower": 2.0, "score_ci_upper": 2.6, "raw_scores": [2.0, 3.0, 2.0, 2.0, 2.0], "baseline_score": 3.7, "outcome": "DISCARDED", "failure_mode": null, "duration_seconds": 60.31997379194945, "tags": ["double-space", "token-variation", "minimal-change"], "learnings": "{\"what_changed\":\"\",\"what_improved\":[],\"what_regressed\":[],\"transferable_insight\":\"Introducing arbitrary whitespace to alter tokenization without changing semantic meaning negatively impacts system performance.\",\"domain_tags\":[\"Prompt Engineering\",\"Tokenization\",\"Formatting\"]}", "cost_usd": 0.010623, "bootstrap_seed": 0, "agent_model": "gemini-3.1-pro-preview", "held_out_score": null, "criterion_names": ["key_points_captured", "conciseness", "faithful_to_source", "few_shot_format"], "per_criterion_scores": {"key_points_captured": 1.0, "conciseness": 1.0, "faithful_to_source": 0.2, "few_shot_format": 0.0}, "failure_classification": {"category": "semantic_drift", "description": "The experiment aimed to alter tokenization by introducing a double space without changing the meaning of the system instructions. The low score (2.2000) indicates that, despite no change in human-readable words, the subtle alteration in tokenization likely led to a shift in the language model's internal interpretation or understanding of the instructions, causing a drift in its semantic processing and resulting in degraded performance.", "fix_direction": "Future attempts should investigate the specific impact of whitespace changes on LLM tokenization and subsequent semantic interpretation. If the goal is to influence tokenization without unintended semantic drift, alternative methods (e.g., direct manipulation of token IDs if accessible, or model-level configuration for tokenization) might be necessary, or the assumption that such textual changes are semantically neutral for LLMs needs to be re-evaluated.", "confidence": 0.9}, "drafts_generated": 1, "drafts_survived": 1}
{"id": "5f4c0764-65ff-49e2-948c-424822fe15ea", "target_id": "B2-greedy", "git_sha": "4aa393dc8fd3b4f08fcc9eb825917f26c9f26904", "pre_experiment_sha": "4aa393dc8fd3b4f08fcc9eb825917f26c9f26904", "timestamp": "2026-04-24T03:15:03.011876+00:00", "hypothesis": "Substitute \"Here are\" with \"Below are\" in the example intro sentence to alter tokenization with minimal semantic impact.", "hypothesis_source": "agent", "mutation_diff_summary": "", "score": 2.5, "score_ci_lower": 2.1, "score_ci_upper": 2.9, "raw_scores": [2.0, 3.0, 3.0, 2.5, 2.0], "baseline_score": 3.7, "outcome": "DISCARDED", "failure_mode": null, "duration_seconds": 64.89117745799012, "tags": ["synonym_substitution", "low_impact"], "learnings": "{\"what_changed\":\"\",\"what_improved\":[],\"what_regressed\":[],\"transferable_insight\":\"Minor lexical substitutions intended solely to manipulate tokenization can negatively impact overall performance despite preserving the original semantic meaning.\",\"domain_tags\":[\"Prompt Engineering\",\"Tokenization\",\"Lexical Semantics\"]}", "cost_usd": 0.0100613, "bootstrap_seed": 0, "agent_model": "gemini-3.1-pro-preview", "held_out_score": null, "criterion_names": ["key_points_captured", "conciseness", "faithful_to_source", "few_shot_format"], "per_criterion_scores": {"key_points_captured": 1.0, "conciseness": 1.0, "faithful_to_source": 0.3, "few_shot_format": 0.2}, "failure_classification": {"category": "semantic_drift", "description": "The substitution of 'Here are' with 'Below are' likely introduced a semantic difference or awkwardness in the specific context that was greater than the intended 'minimal semantic impact,' leading to a degraded score (2.5000). While the tokenization might have changed, the meaning or appropriateness of the sentence drifted negatively.", "fix_direction": "Future attempts should involve more rigorous pre-analysis of semantic equivalence for proposed text substitutions, potentially using contextual embeddings or human evaluation to ensure the change is truly semantically neutral before experimentation. Focus on finding true synonyms or functionally identical phrases within the specific sentence structure.", "confidence": 0.9}, "drafts_generated": 1, "drafts_survived": 1}
