{"id": "7a9fce25-39b0-4bc2-8905-6aa56506521f", "target_id": "B2-greedy", "git_sha": "433d155f0ed75a9a6bc3b64e51e7a8ff34ada050", "pre_experiment_sha": "5dfe45eb4ac0661a092592261f260a8e9a09be3f", "timestamp": "2026-04-22T04:56:06.379585+00:00", "hypothesis": "Remove hallucinated information from the few-shot examples to prevent the model from learning to hallucinate, and add an instruction to be strictly faithful to the source text.", "hypothesis_source": "agent", "mutation_diff_summary": "", "score": 2.9, "score_ci_lower": 2.1, "score_ci_upper": 3.7, "raw_scores": [2.0, 2.5, 4.0, 2.0, 4.0], "baseline_score": 0.0, "outcome": "KEPT", "failure_mode": null, "duration_seconds": 81.72486808290705, "tags": ["summarization", "few-shot", "hallucination", "factual-consistency"], "learnings": "{\"what_changed\":\"\",\"what_improved\":[],\"what_regressed\":[],\"transferable_insight\":\"Eliminating ungrounded information from few-shot examples and explicitly instructing the model to remain faithful to the source text prevents learned hallucination behaviors.\",\"domain_tags\":[\"Prompt Engineering\",\"Hallucination Mitigation\",\"Few-Shot Learning\"]}", "cost_usd": 0.010872300000000001, "bootstrap_seed": 0, "agent_model": "gemini-3.1-pro-preview", "held_out_score": null, "criterion_names": ["key_points_captured", "conciseness", "faithful_to_source", "few_shot_format"], "per_criterion_scores": {"key_points_captured": 1.0, "conciseness": 1.0, "faithful_to_source": 0.5, "few_shot_format": 0.4}, "failure_classification": null, "drafts_generated": 1, "drafts_survived": 1}
{"id": "1b3d9de2-f591-49e5-a711-d6f435b3885a", "target_id": "B2-greedy", "git_sha": "5d4229bb06a1f4b50b7e74de7532c2064266b5b5", "pre_experiment_sha": "433d155f0ed75a9a6bc3b64e51e7a8ff34ada050", "timestamp": "2026-04-22T04:57:06.239007+00:00", "hypothesis": "Adding explicit bulleted rules for faithfulness, no outside info, conciseness, and objectivity, alongside a more concise first few-shot example, will improve the strictness and quality of the generated summaries.", "hypothesis_source": "agent", "mutation_diff_summary": "", "score": 3.6, "score_ci_lower": 3.2, "score_ci_upper": 4.0, "raw_scores": [4.0, 3.0, 4.0, 3.0, 4.0], "baseline_score": 2.9, "outcome": "KEPT", "failure_mode": null, "duration_seconds": 51.90708770812489, "tags": ["prompt-engineering", "few-shot-refinement", "formatting", "constraints"], "learnings": "{\"what_changed\":\"\",\"what_improved\":[],\"what_regressed\":[],\"transferable_insight\":\"Structuring constraints as explicit bulleted lists and pairing them with concise few-shot examples significantly improves a model's adherence to strict output guidelines.\",\"domain_tags\":[\"Prompt Engineering\",\"Few-Shot Prompting\",\"Constraint Satisfaction\"]}", "cost_usd": 0.01251845, "bootstrap_seed": 0, "agent_model": "gemini-3.1-pro-preview", "held_out_score": null, "criterion_names": ["key_points_captured", "conciseness", "faithful_to_source", "few_shot_format"], "per_criterion_scores": {"key_points_captured": 1.0, "conciseness": 1.0, "faithful_to_source": 1.0, "few_shot_format": 0.6}, "failure_classification": null, "drafts_generated": 1, "drafts_survived": 1}
{"id": "38d2fc06-a70e-46f1-a2aa-cb41f525986e", "target_id": "B2-greedy", "git_sha": "5d4229bb06a1f4b50b7e74de7532c2064266b5b5", "pre_experiment_sha": "5d4229bb06a1f4b50b7e74de7532c2064266b5b5", "timestamp": "2026-04-22T04:58:36.208662+00:00", "hypothesis": "Enhance the strictness of the summarization rules to prevent hallucinations and conversational filler, and explicitly format the end of the prompt with \"Article: \" to perfectly match the few-shot examples and guide the model's output structure.", "hypothesis_source": "agent", "mutation_diff_summary": "", "score": 3.1, "score_ci_lower": 2.3, "score_ci_upper": 3.9, "raw_scores": [4.0, 3.5, 4.0, 2.0, 2.0], "baseline_score": 3.6, "outcome": "DISCARDED", "failure_mode": null, "duration_seconds": 83.03447983413935, "tags": ["summarization", "few-shot", "prompt-engineering", "formatting"], "learnings": "{\"what_changed\":\"\",\"what_improved\":[],\"what_regressed\":[],\"transferable_insight\":\"Overly constraining instructions and rigidly forcing trailing structural markers to match few-shot examples can unexpectedly degrade performance rather than improving output quality.\",\"domain_tags\":[\"Prompt Engineering\",\"Few-Shot Prompting\"]}", "cost_usd": 0.013204, "bootstrap_seed": 0, "agent_model": "gemini-3.1-pro-preview", "held_out_score": null, "criterion_names": ["key_points_captured", "conciseness", "faithful_to_source", "few_shot_format"], "per_criterion_scores": {"key_points_captured": 0.9, "conciseness": 1.0, "faithful_to_source": 0.7, "few_shot_format": 0.5}, "failure_classification": {"category": "output_format", "description": "The explicit input formatting change ('Article: ') intended to align with few-shot examples and guide output structure, combined with enhanced summarization rules, likely confused the model. This confusion led to a severe violation of the expected output structure or schema, resulting in an extremely low score. The model might have failed to produce a coherent summary format, making the output unparseable or irrelevant.", "fix_direction": "Carefully re-evaluate the impact of the 'Article: ' input format. Verify that it genuinely matches the few-shot examples' *input* structure and doesn't conflict with existing instructions for output structure. Test simpler or more gradual changes to prompt formatting. Consider isolating the effect of prompt formatting from summarization rule strictness to debug.", "confidence": 0.9}, "drafts_generated": 1, "drafts_survived": 1}
{"id": "449d37cb-916e-49ea-b5df-acfbe434af00", "target_id": "B2-greedy", "git_sha": "5d4229bb06a1f4b50b7e74de7532c2064266b5b5", "pre_experiment_sha": "5d4229bb06a1f4b50b7e74de7532c2064266b5b5", "timestamp": "2026-04-22T05:00:44.301186+00:00", "hypothesis": "Refine few-shot summaries for extreme conciseness and strict faithfulness while removing trailing structural markers to prevent output formatting errors.", "hypothesis_source": "agent", "mutation_diff_summary": "", "score": 2.4, "score_ci_lower": 2.1, "score_ci_upper": 2.7, "raw_scores": [2.0, 3.0, 2.5, 2.0, 2.5], "baseline_score": 3.6, "outcome": "DISCARDED", "failure_mode": null, "duration_seconds": 80.82437225012109, "tags": ["conciseness", "strict-faithfulness", "formatting-fix"], "learnings": "{\"what_changed\":\"\",\"what_improved\":[],\"what_regressed\":[],\"transferable_insight\":\"Removing structural markers and enforcing extreme conciseness in few-shot examples degrades performance, indicating that models rely on explicit structural cues to learn desired output formats.\",\"domain_tags\":[\"Prompt Engineering\",\"Few-Shot Learning\",\"Output Formatting\"]}", "cost_usd": 0.010607600000000002, "bootstrap_seed": 0, "agent_model": "gemini-3.1-pro-preview", "held_out_score": null, "criterion_names": ["key_points_captured", "conciseness", "faithful_to_source", "few_shot_format"], "per_criterion_scores": {"key_points_captured": 1.0, "conciseness": 1.0, "faithful_to_source": 0.4, "few_shot_format": 0.0}, "failure_classification": {"category": "output_format", "description": "The experiment failed to achieve its goal of preventing output formatting errors, likely due to the persistence of trailing structural markers or the introduction of other structural inconsistencies. The low score suggests that the output was not correctly formatted, making it potentially unusable or unparsable.", "fix_direction": "Improve the robustness of marker removal, potentially by explicitly demonstrating correct output termination in few-shot examples or implementing a post-processing step to sanitize outputs. Focus on clear instructions to the model regarding output structure and termination criteria.", "confidence": 0.9}, "drafts_generated": 1, "drafts_survived": 1}
{"id": "513b31f8-efd4-4882-a480-71392fe8968e", "target_id": "B2-greedy", "git_sha": "5d4229bb06a1f4b50b7e74de7532c2064266b5b5", "pre_experiment_sha": "5d4229bb06a1f4b50b7e74de7532c2064266b5b5", "timestamp": "2026-04-22T05:02:03.266964+00:00", "hypothesis": "Refining constraints for strict faithfulness and conciseness, and shortening few-shot examples to be strictly factual and brief, will improve the binary criteria score.", "hypothesis_source": "agent", "mutation_diff_summary": "", "score": 2.7, "score_ci_lower": 2.1, "score_ci_upper": 3.4, "raw_scores": [2.0, 2.0, 3.0, 4.0, 2.5], "baseline_score": 3.6, "outcome": "DISCARDED", "failure_mode": null, "duration_seconds": 60.617760457796976, "tags": ["prompt-engineering", "few-shot-refinement", "conciseness", "faithfulness"], "learnings": "{\"what_changed\":\"\",\"what_improved\":[],\"what_regressed\":[],\"transferable_insight\":\"Over-optimizing prompts and few-shot examples for strict brevity and factuality can degrade performance by stripping away the necessary context or reasoning patterns required for complex tasks.\",\"domain_tags\":[\"Prompt Engineering\",\"Few-Shot Prompting\",\"Constraint Optimization\"]}", "cost_usd": 0.011109100000000002, "bootstrap_seed": 0, "agent_model": "gemini-3.1-pro-preview", "held_out_score": null, "criterion_names": ["key_points_captured", "conciseness", "faithful_to_source", "few_shot_format"], "per_criterion_scores": {"key_points_captured": 1.0, "conciseness": 1.0, "faithful_to_source": 0.5, "few_shot_format": 0.2}, "failure_classification": {"category": "semantic_drift", "description": "The experiment aimed to improve semantic qualities (faithfulness, conciseness) and factuality by refining constraints and shortening few-shot examples. However, the failure suggests that these changes either confused the model's understanding of the desired output meaning or removed crucial context from the examples, causing the generated output to drift semantically from the target despite potentially maintaining correct format.", "fix_direction": "Re-evaluate the balance between brevity and necessary context in few-shot examples. It's possible that shortening examples too much removed vital information the model needed. Consider clearer, more explicit instructions for faithfulness and conciseness, or provide examples that are brief but still rich in the critical information and style desired, rather than strictly minimal.", "confidence": 0.9}, "drafts_generated": 1, "drafts_survived": 1}
{"id": "b76eda20-0b5e-42e5-9eab-4535d186d9f5", "target_id": "B2-greedy", "git_sha": "5d4229bb06a1f4b50b7e74de7532c2064266b5b5", "pre_experiment_sha": "5d4229bb06a1f4b50b7e74de7532c2064266b5b5", "timestamp": "2026-04-22T05:03:29.196935+00:00", "hypothesis": "Refine the system prompt to use an explicit bulleted list of strict constraints (faithfulness, no outside info, objectivity, conciseness), make few-shot examples shorter and highly factual, and remove trailing structural markers that interfere with the evaluation pipeline.", "hypothesis_source": "agent", "mutation_diff_summary": "", "score": 3.8, "score_ci_lower": 3.4, "score_ci_upper": 4.0, "raw_scores": [4.0, 4.0, 3.0, 4.0, 4.0], "baseline_score": 3.6, "outcome": "DISCARDED", "failure_mode": null, "duration_seconds": 68.82289312500507, "tags": ["prompt-engineering", "few-shot-optimization", "formatting"], "learnings": "{\"what_changed\":\"\",\"what_improved\":[],\"what_regressed\":[],\"transferable_insight\":\"Implementing stricter formatting constraints and condensing reference examples can yield minor performance gains, but removing established structural markers risks breaking downstream evaluation pipelines.\",\"domain_tags\":[\"Prompt Engineering\",\"Evaluation Pipelines\",\"Formatting Constraints\"]}", "cost_usd": 0.013724100000000001, "bootstrap_seed": 0, "agent_model": "gemini-3.1-pro-preview", "held_out_score": null, "criterion_names": ["key_points_captured", "conciseness", "faithful_to_source", "few_shot_format"], "per_criterion_scores": {"key_points_captured": 1.0, "conciseness": 1.0, "faithful_to_source": 0.9, "few_shot_format": 0.9}, "failure_classification": {"category": "output_format", "description": "The experiment's hypothesis included removing \"trailing structural markers that interfere with the evaluation pipeline.\" The very low score of 3.8 strongly suggests that the model's output, following these prompt changes (especially regarding structural markers and strict constraints), no longer conformed to the expected format or schema required by the evaluation system. This would lead to outputs being unparsable or incorrectly structured, causing a significant failure in evaluation.", "fix_direction": "Carefully inspect the actual output generated by the model with the new prompt. Compare it against the exact format expected by the evaluation pipeline. The prompt needs to either explicitly reinforce the desired output structure or be adjusted so that the 'strict constraints' and 'few-shot examples' guide the model to produce output that is both semantically correct and structurally compliant with the evaluation system. Alternatively, if the new format is intended, the evaluation pipeline may need to be updated.", "confidence": 0.9}, "drafts_generated": 1, "drafts_survived": 1}
{"id": "1765804b-16d5-4d77-98d2-f7061748dd3c", "target_id": "B2-greedy", "git_sha": "5d4229bb06a1f4b50b7e74de7532c2064266b5b5", "pre_experiment_sha": "5d4229bb06a1f4b50b7e74de7532c2064266b5b5", "timestamp": "2026-04-22T05:05:06.124800+00:00", "hypothesis": "Refining the few-shot examples to eliminate unstated acronyms (e.g., RLHF, NSF) and explicitly expanding the strict faithfulness constraints will improve factual cleanliness and the binary criteria score.", "hypothesis_source": "agent", "mutation_diff_summary": "", "score": 2.9, "score_ci_lower": 2.1, "score_ci_upper": 3.7, "raw_scores": [2.0, 2.5, 2.0, 4.0, 4.0], "baseline_score": 3.6, "outcome": "DISCARDED", "failure_mode": null, "duration_seconds": 59.77577066607773, "tags": ["summarization", "few-shot", "faithfulness", "constraints"], "learnings": "{\"what_changed\":\"\",\"what_improved\":[],\"what_regressed\":[],\"transferable_insight\":\"Over-sanitizing few-shot examples by removing common abbreviations and excessively expanding strict constraints can degrade performance, likely by making the examples less representative of realistic inputs.\",\"domain_tags\":[\"Prompt Engineering\",\"Few-Shot Learning\",\"Constraint Satisfaction\"]}", "cost_usd": 0.012905550000000002, "bootstrap_seed": 0, "agent_model": "gemini-3.1-pro-preview", "held_out_score": null, "criterion_names": ["key_points_captured", "conciseness", "faithful_to_source", "few_shot_format"], "per_criterion_scores": {"key_points_captured": 1.0, "conciseness": 1.0, "faithful_to_source": 0.5, "few_shot_format": 0.4}, "failure_classification": {"category": "semantic_drift", "description": "The model likely misinterpreted the intent of the refined few-shot examples or the expanded faithfulness constraints. For instance, removing acronyms might have inadvertently stripped crucial context for the model, leading to reduced factual cleanliness. Similarly, the 'expanded' constraints might have been interpreted as overly restrictive, causing the model to become too conservative or evasive, thus lowering the binary criteria score. The inputs were syntactically correct, but their semantic impact on the model's performance was detrimental, diverging from the intended improvement.", "fix_direction": "Investigate the model's specific outputs and internal reasoning (if possible) to understand how it processed the modified examples and constraints. Analyze whether the model lost necessary context due to acronym removal or became excessively cautious due to expanded constraints. Test specific aspects of the refined examples/constraints independently to pinpoint which change caused the negative semantic impact. Experiment with alternative ways to provide context (e.g., full terms followed by acronyms, or explicit definitions) and softer/more nuanced faithfulness guidance.", "confidence": 0.9}, "drafts_generated": 1, "drafts_survived": 1}
{"id": "50da8a53-bee8-40bb-b377-215b918e14af", "target_id": "B2-greedy", "git_sha": "5d4229bb06a1f4b50b7e74de7532c2064266b5b5", "pre_experiment_sha": "5d4229bb06a1f4b50b7e74de7532c2064266b5b5", "timestamp": "2026-04-22T05:06:30.379854+00:00", "hypothesis": "Refine the few-shot examples to strictly use terminology from the source text (e.g., spelling out acronyms not in the source) and strengthen the bulleted constraints to explicitly mandate that every claim must be directly supported by the text, improving factual cleanliness and faithfulness.", "hypothesis_source": "agent", "mutation_diff_summary": "", "score": 2.2, "score_ci_lower": 2.0, "score_ci_upper": 2.6, "raw_scores": [2.0, 2.0, 2.0, 2.0, 3.0], "baseline_score": 3.6, "outcome": "DISCARDED", "failure_mode": null, "duration_seconds": 62.20638941600919, "tags": ["few-shot", "constraints", "faithfulness"], "learnings": "{\"what_changed\":\"\",\"what_improved\":[],\"what_regressed\":[],\"transferable_insight\":\"Imposing overly strict constraints on exact terminology matching and direct textual support can degrade performance by restricting the model's natural ability to synthesize and abstract information.\",\"domain_tags\":[\"Prompt Engineering\",\"Few-Shot Prompting\",\"Constraint Optimization\"]}", "cost_usd": 0.0114366, "bootstrap_seed": 0, "agent_model": "gemini-3.1-pro-preview", "held_out_score": null, "criterion_names": ["key_points_captured", "conciseness", "faithful_to_source", "few_shot_format"], "per_criterion_scores": {"key_points_captured": 1.0, "conciseness": 1.0, "faithful_to_source": 0.2, "few_shot_format": 0.0}, "failure_classification": {"category": "semantic_drift", "description": "The experiment's attempt to impose stricter terminology and explicitly mandate direct support, while aiming for improved factual cleanliness and faithfulness, likely led to outputs that were semantically incorrect, incomplete, or unfaithful to the source text. The model may have become overly cautious, misinterpreted the strict constraints, or struggled to generate natural language while adhering rigidly to the specified terminology and direct support, resulting in a significant degradation of meaning and factual accuracy.", "fix_direction": "Re-evaluate the strictness of the terminology and direct support mandates. Experiment with allowing for a balance between fidelity to the source and natural language generation. Consider if the examples or constraints inadvertently pushed the model to omit crucial information or misinterpret context due to excessive rigidity. It might be beneficial to loosen constraints slightly or provide examples that demonstrate how to maintain faithfulness without being overly literal or verbose, potentially by using a few-shot example that demonstrates a faithful paraphrase or summary.", "confidence": 0.9}, "drafts_generated": 1, "drafts_survived": 1}
{"id": "7e81720c-c759-4ea0-8f6f-74d7cc42f89e", "target_id": "B2-greedy", "git_sha": "5d4229bb06a1f4b50b7e74de7532c2064266b5b5", "pre_experiment_sha": "5d4229bb06a1f4b50b7e74de7532c2064266b5b5", "timestamp": "2026-04-22T05:08:03.894019+00:00", "hypothesis": "Refine the system instructions and few-shot examples to strictly prevent hallucinated acronyms (like RLHF or NSF) and paraphrased extrapolations, ensuring the examples model 100% factual faithfulness to the source text.", "hypothesis_source": "agent", "mutation_diff_summary": "", "score": 2.3, "score_ci_lower": 2.0, "score_ci_upper": 2.7, "raw_scores": [2.0, 3.0, 2.5, 2.0, 2.0], "baseline_score": 3.6, "outcome": "DISCARDED", "failure_mode": null, "duration_seconds": 71.60703674983233, "tags": ["factual-cleanliness", "strict-faithfulness", "no-hallucination"], "learnings": "{\"what_changed\":\"\",\"what_improved\":[],\"what_regressed\":[],\"transferable_insight\":\"Imposing overly rigid constraints against paraphrasing and extrapolation in instructions can degrade overall performance by stifling the system's ability to naturally synthesize information.\",\"domain_tags\":[\"Prompt Engineering\",\"Hallucination Mitigation\",\"Few-Shot Learning\"]}", "cost_usd": 0.011648850000000002, "bootstrap_seed": 0, "agent_model": "gemini-3.1-pro-preview", "held_out_score": null, "criterion_names": ["key_points_captured", "conciseness", "faithful_to_source", "few_shot_format"], "per_criterion_scores": {"key_points_captured": 1.0, "conciseness": 1.0, "faithful_to_source": 0.3, "few_shot_format": 0.0}, "failure_classification": {"category": "semantic_drift", "description": "The experiment aimed to prevent the generation of hallucinated acronyms and paraphrased extrapolations, thereby ensuring 100% factual faithfulness. The low score (2.3000) indicates that the system continued to produce content whose meaning diverged from the factual source, which is a clear instance of semantic drift where the content is factually incorrect or unfaithful despite potentially correct formatting.", "fix_direction": "Strengthen system instructions with clearer, more explicit negative constraints against hallucination and extrapolation. Rework few-shot examples to unequivocally model 100% factual faithfulness, potentially including examples that highlight what *not* to do, and ensure the model understands and strictly adheres to these guidelines.", "confidence": 0.95}, "drafts_generated": 1, "drafts_survived": 1}
