{"id": "41ec85aa-0399-4e49-9978-eb9b72e27876", "target_id": "B2-greedy", "git_sha": "5d4229bb06a1f4b50b7e74de7532c2064266b5b5", "pre_experiment_sha": "5d4229bb06a1f4b50b7e74de7532c2064266b5b5", "timestamp": "2026-04-22T05:46:22.570318+00:00", "hypothesis": "Swap the order of the 'Conciseness' and 'Objectivity' rules to alter the prompt structure and tokenization without changing semantics.", "hypothesis_source": "agent", "mutation_diff_summary": "", "score": 2.8, "score_ci_lower": 2.0, "score_ci_upper": 3.6, "raw_scores": [4.0, 2.0, 2.0, 2.0, 4.0], "baseline_score": 3.6, "outcome": "DISCARDED", "failure_mode": null, "duration_seconds": 66.34615229209885, "tags": ["reorder_rules"], "learnings": "{\"what_changed\":\"\",\"what_improved\":[],\"what_regressed\":[],\"transferable_insight\":\"Reordering instructions within a prompt can degrade performance even when the overall semantic meaning remains unchanged, highlighting the sensitivity of language models to the sequence of rules.\",\"domain_tags\":[\"Prompt Engineering\",\"Instruction Ordering\",\"Tokenization\"]}", "cost_usd": 0.01265125, "bootstrap_seed": 0, "agent_model": "gemini-3.1-pro-preview", "held_out_score": null, "criterion_names": ["key_points_captured", "conciseness", "faithful_to_source", "few_shot_format"], "per_criterion_scores": {"key_points_captured": 1.0, "conciseness": 1.0, "faithful_to_source": 0.4, "few_shot_format": 0.4}, "failure_classification": {"category": "semantic_drift", "description": "The experiment aimed to alter prompt structure and tokenization 'without changing semantics'. However, the significantly degraded score (2.8) strongly indicates that the reordering of 'Conciseness' and 'Objectivity' rules, despite intending to be semantically neutral, inadvertently shifted the model's interpretation or weighting of these instructions. This resulted in outputs that, while potentially following output format, failed to meet the intended meaning or quality criteria.", "fix_direction": "Investigate how the relative positioning of rules influences the model's understanding and prioritization of instructions. Analyze the tokenization differences between the original and modified prompts to identify specific tokens or sequences that might be causing the semantic shift. Consider if the original rule order implicitly conveyed a critical relationship or precedence that was lost in the swap, and explore ways to make such relationships explicit if necessary.", "confidence": 0.9}, "drafts_generated": 1, "drafts_survived": 1}
{"id": "e8f0d6d4-ab6e-45e3-bc6c-1eb6831820fa", "target_id": "B2-greedy", "git_sha": "5d4229bb06a1f4b50b7e74de7532c2064266b5b5", "pre_experiment_sha": "5d4229bb06a1f4b50b7e74de7532c2064266b5b5", "timestamp": "2026-04-22T05:47:43.572335+00:00", "hypothesis": "Swap the order of the 'Conciseness' and 'Objectivity' rules to alter tokenization without causing semantic drift.", "hypothesis_source": "agent", "mutation_diff_summary": "", "score": 3.1, "score_ci_lower": 2.7, "score_ci_upper": 3.6, "raw_scores": [3.0, 2.5, 3.0, 3.0, 4.0], "baseline_score": 3.6, "outcome": "DISCARDED", "failure_mode": null, "duration_seconds": 61.01545820804313, "tags": ["swap-rules", "tokenization"], "learnings": "{\"what_changed\":\"\",\"what_improved\":[],\"what_regressed\":[],\"transferable_insight\":\"Reordering independent system constraints to exploit underlying processing mechanics can inadvertently degrade overall performance.\",\"domain_tags\":[\"Prompt Engineering\",\"Constraint Prioritization\",\"System Optimization\"]}", "cost_usd": 0.012513600000000001, "bootstrap_seed": 0, "agent_model": "gemini-3.1-pro-preview", "held_out_score": null, "criterion_names": ["key_points_captured", "conciseness", "faithful_to_source", "few_shot_format"], "per_criterion_scores": {"key_points_captured": 1.0, "conciseness": 1.0, "faithful_to_source": 0.8, "few_shot_format": 0.3}, "failure_classification": {"category": "semantic_drift", "description": "The experiment aimed to alter tokenization by swapping rule order without causing semantic drift, but the failure indicates that the reordering of 'Conciseness' and 'Objectivity' rules inadvertently introduced changes in the meaning or interpretation of the output.", "fix_direction": "Conduct a comparative analysis of outputs before and after the rule reordering, focusing on semantic differences rather than just tokenization. Identify specific examples where meaning has shifted and analyze how the new interaction order of 'Conciseness' and 'Objectivity' rules led to this drift. Consider if these rules are truly independent or if their interaction requires a specific sequence to maintain semantic integrity.", "confidence": 0.9}, "drafts_generated": 1, "drafts_survived": 1}
{"id": "11daa41e-bbf5-404a-97b5-19667362c9b0", "target_id": "B2-greedy", "git_sha": "5d4229bb06a1f4b50b7e74de7532c2064266b5b5", "pre_experiment_sha": "5d4229bb06a1f4b50b7e74de7532c2064266b5b5", "timestamp": "2026-04-22T05:48:57.304918+00:00", "hypothesis": "Swap the order of the Objectivity and Conciseness rules to alter the prompt structure without changing semantics or triggering over-optimization penalties.", "hypothesis_source": "agent", "mutation_diff_summary": "", "score": 2.9, "score_ci_lower": 2.2, "score_ci_upper": 3.6, "raw_scores": [4.0, 3.5, 3.0, 2.0, 2.0], "baseline_score": 3.6, "outcome": "DISCARDED", "failure_mode": null, "duration_seconds": 49.765355749987066, "tags": ["structural_change", "swap_rules"], "learnings": "{\"what_changed\":\"\",\"what_improved\":[],\"what_regressed\":[],\"transferable_insight\":\"Altering the sequence of constraints or rules, even without changing their underlying semantics, can significantly degrade performance due to the system's sensitivity to instruction order.\",\"domain_tags\":[\"Prompt Engineering\",\"Instruction Ordering\",\"LLM Behavior\"]}", "cost_usd": 0.012552299999999999, "bootstrap_seed": 0, "agent_model": "gemini-3.1-pro-preview", "held_out_score": null, "criterion_names": ["key_points_captured", "conciseness", "faithful_to_source", "few_shot_format"], "per_criterion_scores": {"key_points_captured": 0.9, "conciseness": 1.0, "faithful_to_source": 0.7, "few_shot_format": 0.3}, "failure_classification": {"category": "semantic_drift", "description": "The experiment failed because, although the rule reordering was intended to be semantically neutral, the model's interpretation or prioritization of the instructions likely changed, leading to a significant degradation in output quality as indicated by the low score. The model's effective 'meaning' derived from the prompt drifted from the intended one.", "fix_direction": "Investigate the model's sensitivity to the order of instructions. Explore methods to ensure semantic consistency when altering prompt structure, such as explicit prioritization cues, adding meta-instructions about rule weighting, or using different prompt templating strategies that are less sensitive to rule order.", "confidence": 0.9}, "drafts_generated": 1, "drafts_survived": 1}
{"id": "0c46ae07-aa4e-4db7-bca8-ea669462555c", "target_id": "B2-greedy", "git_sha": "5d4229bb06a1f4b50b7e74de7532c2064266b5b5", "pre_experiment_sha": "5d4229bb06a1f4b50b7e74de7532c2064266b5b5", "timestamp": "2026-04-22T05:50:44.316376+00:00", "hypothesis": "Replace the single space between the first two sentences with a newline character to subtly alter tokenization without changing the text order or adding/removing words.", "hypothesis_source": "agent", "mutation_diff_summary": "", "score": 2.6, "score_ci_lower": 2.0, "score_ci_upper": 3.4, "raw_scores": [2.0, 4.0, 2.0, 3.0, 2.0], "baseline_score": 3.6, "outcome": "DISCARDED", "failure_mode": null, "duration_seconds": 70.0435168328695, "tags": ["formatting", "tokenization"], "learnings": "{\"what_changed\":\"\",\"what_improved\":[],\"what_regressed\":[],\"transferable_insight\":\"Introducing unnatural formatting breaks, such as replacing spaces with newlines to manipulate underlying processing, degrades performance by disrupting the natural flow of information.\",\"domain_tags\":[\"Prompt Engineering\",\"Tokenization\",\"Formatting\"]}", "cost_usd": 0.011789750000000002, "bootstrap_seed": 0, "agent_model": "gemini-3.1-pro-preview", "held_out_score": null, "criterion_names": ["key_points_captured", "conciseness", "faithful_to_source", "few_shot_format"], "per_criterion_scores": {"key_points_captured": 1.0, "conciseness": 1.0, "faithful_to_source": 0.4, "few_shot_format": 0.2}, "failure_classification": {"category": "semantic_drift", "description": "The replacement of a single space with a newline character, while aiming to subtly alter tokenization, likely introduced a significant structural change. This change caused the underlying model to misinterpret the relationship or continuity between the two sentences (e.g., treating them as distinct paragraphs), leading to a degradation of its semantic understanding and a lower score.", "fix_direction": "Investigate how the specific model's tokenizer and subsequent processing pipeline handle newline characters versus spaces. Future experiments should explore more genuinely 'subtle' tokenization alterations that do not introduce strong structural cues, or focus on how to maintain consistent semantic interpretation despite tokenization changes.", "confidence": 0.95}, "drafts_generated": 1, "drafts_survived": 1}
{"id": "7bda9c1f-9084-4402-939e-65790ef3c715", "target_id": "B2-greedy", "git_sha": "5d4229bb06a1f4b50b7e74de7532c2064266b5b5", "pre_experiment_sha": "5d4229bb06a1f4b50b7e74de7532c2064266b5b5", "timestamp": "2026-04-22T05:52:24.045677+00:00", "hypothesis": "Replace the space between the first two sentences with a newline character to alter tokenization without changing semantics.", "hypothesis_source": "agent", "mutation_diff_summary": "", "score": 2.4, "score_ci_lower": 2.0, "score_ci_upper": 3.2, "raw_scores": [2.0, 4.0, 2.0, 2.0, 2.0], "baseline_score": 3.6, "outcome": "DISCARDED", "failure_mode": null, "duration_seconds": 68.08334858296439, "tags": ["formatting", "whitespace", "minimal-change"], "learnings": "{\"what_changed\":\"\",\"what_improved\":[],\"what_regressed\":[],\"transferable_insight\":\"Altering natural text formatting to manipulate tokenization, such as replacing spaces with newlines, often degrades model performance despite preserving semantic meaning.\",\"domain_tags\":[\"Prompt Engineering\",\"Tokenization\",\"Formatting\"]}", "cost_usd": 0.011705, "bootstrap_seed": 0, "agent_model": "gemini-3.1-pro-preview", "held_out_score": null, "criterion_names": ["key_points_captured", "conciseness", "faithful_to_source", "few_shot_format"], "per_criterion_scores": {"key_points_captured": 1.0, "conciseness": 1.0, "faithful_to_source": 0.2, "few_shot_format": 0.2}, "failure_classification": {"category": "semantic_drift", "description": "The experiment aimed to alter tokenization without changing semantics by introducing a newline. The low score indicates that, contrary to the hypothesis, the newline character likely caused the model or evaluation to interpret the text with a subtle, unintended change in meaning or discourse structure, resulting in a semantic drift.", "fix_direction": "Investigate how the target model/tokenizer interprets newline characters and their impact on semantic understanding. Explore alternative methods for tokenization manipulation that are truly semantically neutral, or refine the evaluation to be less sensitive to minor structural changes if they are indeed semantically irrelevant to the desired outcome.", "confidence": 0.9}, "drafts_generated": 1, "drafts_survived": 1}
{"id": "d4b66887-6b61-4af4-95af-2166955bbeb7", "target_id": "B2-greedy", "git_sha": "5d4229bb06a1f4b50b7e74de7532c2064266b5b5", "pre_experiment_sha": "5d4229bb06a1f4b50b7e74de7532c2064266b5b5", "timestamp": "2026-04-22T05:53:40.295413+00:00", "hypothesis": "Replace the space between the first two sentences with a newline character to alter tokenization without changing wording or text order.", "hypothesis_source": "agent", "mutation_diff_summary": "", "score": 2.9, "score_ci_lower": 2.3, "score_ci_upper": 3.6, "raw_scores": [4.0, 2.5, 2.0, 2.5, 3.5], "baseline_score": 3.6, "outcome": "DISCARDED", "failure_mode": null, "duration_seconds": 58.52091820794158, "tags": ["formatting", "minimal-change"], "learnings": "{\"what_changed\":\"\",\"what_improved\":[],\"what_regressed\":[],\"transferable_insight\":\"Manipulating whitespace to alter tokenization without changing the actual text disrupts the model's contextual flow and significantly degrades performance.\",\"domain_tags\":[\"Prompt Engineering\",\"Tokenization\",\"Formatting\"]}", "cost_usd": 0.01314005, "bootstrap_seed": 0, "agent_model": "gemini-3.1-pro-preview", "held_out_score": null, "criterion_names": ["key_points_captured", "conciseness", "faithful_to_source", "few_shot_format"], "per_criterion_scores": {"key_points_captured": 0.9, "conciseness": 1.0, "faithful_to_source": 0.4, "few_shot_format": 0.6}, "failure_classification": {"category": "semantic_drift", "description": "The experiment aimed to alter tokenization without changing \"wording.\" However, replacing a space with a newline character, while not changing the visible lexical content or text order, likely introduced a strong semantic or structural boundary between the two sentences. This change in structural formatting can significantly alter a language model's interpretation of the relationship between the sentences or their overall meaning, causing the model to misunderstand the original intent, leading to a degraded score.", "fix_direction": "Re-evaluate the definition of \"wording\" to acknowledge that whitespace and structural elements (like newlines) carry significant semantic weight for language models. Future attempts to manipulate tokenization without altering meaning should explore methods that do not introduce strong semantic signals, or explicitly account for and mitigate the semantic impact of any structural changes.", "confidence": 0.95}, "drafts_generated": 1, "drafts_survived": 1}
{"id": "7f9b5bc1-0bff-4799-9f58-ff79674a1b41", "target_id": "B2-greedy", "git_sha": "5d4229bb06a1f4b50b7e74de7532c2064266b5b5", "pre_experiment_sha": "5d4229bb06a1f4b50b7e74de7532c2064266b5b5", "timestamp": "2026-04-22T05:55:14.958580+00:00", "hypothesis": "Remove a single trailing newline at the very end of the prompt to slightly optimize whitespace without altering semantics.", "hypothesis_source": "agent", "mutation_diff_summary": "", "score": 2.5, "score_ci_lower": 2.0, "score_ci_upper": 3.3, "raw_scores": [2.0, 2.5, 2.0, 2.0, 4.0], "baseline_score": 3.6, "outcome": "DISCARDED", "failure_mode": null, "duration_seconds": 55.650790832936764, "tags": ["whitespace"], "learnings": "{\"what_changed\":\"\",\"what_improved\":[],\"what_regressed\":[],\"transferable_insight\":\"Stripping terminal whitespace, such as trailing newlines, can degrade performance, indicating that models may rely on these characters as structural or end-of-input cues.\",\"domain_tags\":[\"Prompt Engineering\",\"Whitespace Optimization\",\"Formatting\"]}", "cost_usd": 0.011607850000000001, "bootstrap_seed": 0, "agent_model": "gemini-3.1-pro-preview", "held_out_score": null, "criterion_names": ["key_points_captured", "conciseness", "faithful_to_source", "few_shot_format"], "per_criterion_scores": {"key_points_captured": 1.0, "conciseness": 1.0, "faithful_to_source": 0.3, "few_shot_format": 0.2}, "failure_classification": {"category": "semantic_drift", "description": "The removal of a single trailing newline, despite being intended as a minor whitespace optimization, likely altered the model's internal interpretation of the prompt's completion or its overall context. This subtle change in the input signal caused the model to generate output with a different meaning, quality, or content distribution than the baseline, indicating that the newline carried implicit semantic weight for the model, thus contradicting the hypothesis.", "fix_direction": "Re-evaluate the assumption that trailing newlines are semantically neutral for this specific model or task. Instead of simply removing the newline, investigate why the model is sensitive to it (e.g., training data bias, tokenization effects) or consider using explicit end-of-prompt tokens if strict whitespace optimization is necessary and maintaining semantic consistency is critical.", "confidence": 0.9}, "drafts_generated": 1, "drafts_survived": 1}
{"id": "1eb675e7-9ed3-415c-bc00-aa107683dbe8", "target_id": "B2-greedy", "git_sha": "5d4229bb06a1f4b50b7e74de7532c2064266b5b5", "pre_experiment_sha": "5d4229bb06a1f4b50b7e74de7532c2064266b5b5", "timestamp": "2026-04-22T05:56:42.966742+00:00", "hypothesis": "Change a double newline to a single newline between the first paragraph and the strict rules to slightly condense the prompt.", "hypothesis_source": "agent", "mutation_diff_summary": "", "score": 3.5, "score_ci_lower": 2.9, "score_ci_upper": 4.0, "raw_scores": [3.0, 2.5, 4.0, 4.0, 4.0], "baseline_score": 3.6, "outcome": "DISCARDED", "failure_mode": null, "duration_seconds": 65.879479666939, "tags": ["whitespace", "formatting"], "learnings": "{\"what_changed\":\"\",\"what_improved\":[],\"what_regressed\":[],\"transferable_insight\":\"Maintaining clear visual separation, such as double spacing, before critical constraints or rules is essential to preserve their salience and ensure strict compliance.\",\"domain_tags\":[\"Text Formatting\",\"Instruction Salience\",\"Prompt Engineering\"]}", "cost_usd": 0.01347315, "bootstrap_seed": 0, "agent_model": "gemini-3.1-pro-preview", "held_out_score": null, "criterion_names": ["key_points_captured", "conciseness", "faithful_to_source", "few_shot_format"], "per_criterion_scores": {"key_points_captured": 1.0, "conciseness": 1.0, "faithful_to_source": 0.9, "few_shot_format": 0.6}, "failure_classification": {"category": "semantic_drift", "description": "Reducing the double newline to a single newline between the introductory paragraph and the 'strict rules' likely reduced the model's perceived importance or distinctness of the rules. The model may have interpreted the rules as less separate or less 'strict' due to the decreased visual separation, leading to a misinterpretation of the prompt's intent and a lower performance score.", "fix_direction": "Reinstate sufficient visual separation (e.g., double newline) between critically distinct sections of the prompt, especially when one section contains 'strict rules' or important instructions. The model relies on such formatting cues to correctly parse and prioritize different parts of the input.", "confidence": 0.9}, "drafts_generated": 1, "drafts_survived": 1}
{"id": "e6e2754a-3c8b-4fa6-82c3-6c926a7f8f92", "target_id": "B2-greedy", "git_sha": "5d4229bb06a1f4b50b7e74de7532c2064266b5b5", "pre_experiment_sha": "5d4229bb06a1f4b50b7e74de7532c2064266b5b5", "timestamp": "2026-04-22T05:58:10.320884+00:00", "hypothesis": "Remove trailing newlines at the end of the prompt to slightly optimize tokenization without altering semantics.", "hypothesis_source": "agent", "mutation_diff_summary": "", "score": 2.3, "score_ci_lower": 2.0, "score_ci_upper": 2.7, "raw_scores": [2.0, 2.5, 3.0, 2.0, 2.0], "baseline_score": 3.6, "outcome": "DISCARDED", "failure_mode": null, "duration_seconds": 68.75723229092546, "tags": ["whitespace", "trailing-newline"], "learnings": "{\"what_changed\":\"\",\"what_improved\":[],\"what_regressed\":[],\"transferable_insight\":\"Attempting to optimize processing efficiency by removing seemingly superficial formatting elements can unexpectedly degrade performance by disrupting structural cues the system relies on.\",\"domain_tags\":[\"Prompt Engineering\",\"Token Optimization\",\"Formatting\"]}", "cost_usd": 0.0109451, "bootstrap_seed": 0, "agent_model": "gemini-3.1-pro-preview", "held_out_score": null, "criterion_names": ["key_points_captured", "conciseness", "faithful_to_source", "few_shot_format"], "per_criterion_scores": {"key_points_captured": 1.0, "conciseness": 1.0, "faithful_to_source": 0.3, "few_shot_format": 0.0}, "failure_classification": {"category": "semantic_drift", "description": "The experiment aimed to remove trailing newlines to optimize tokenization without altering the prompt's semantics. The reported failure (score 2.3000) strongly suggests that this seemingly minor change inadvertently altered the model's interpretation or meaning of the prompt, leading to a degradation in performance.", "fix_direction": "Investigate the specific model's sensitivity to trailing newlines. This could involve understanding how its tokenizer handles final whitespace characters, or if the model's pre-training or fine-tuning datasets contain implicit semantic meaning tied to the presence or absence of trailing newlines (e.g., indicating prompt completeness or a specific formatting expectation). Future attempts should rigorously test for semantic equivalence beyond simple human inspection.", "confidence": 0.9}, "drafts_generated": 1, "drafts_survived": 1}
