{"id": "6a83ab11-056a-4a59-abf6-0ed78176ee26", "target_id": "B2-greedy", "git_sha": "5d4229bb06a1f4b50b7e74de7532c2064266b5b5", "pre_experiment_sha": "5d4229bb06a1f4b50b7e74de7532c2064266b5b5", "timestamp": "2026-04-22T05:09:35.755026+00:00", "hypothesis": "Refining the few-shot examples to exact factual alignment with their source articles (e.g., matching \"improved performance\" instead of \"strong performance\") will improve the model's factual cleanliness and strict faithfulness without altering the structural format.", "hypothesis_source": "agent", "mutation_diff_summary": "", "score": 2.9, "score_ci_lower": 2.2, "score_ci_upper": 3.6, "raw_scores": [2.0, 4.0, 3.5, 2.0, 3.0], "baseline_score": 3.6, "outcome": "DISCARDED", "failure_mode": null, "duration_seconds": 62.04069120902568, "tags": ["factual-cleanliness", "few-shot-refinement", "strict-faithfulness"], "learnings": "{\"what_changed\":\"\",\"what_improved\":[],\"what_regressed\":[],\"transferable_insight\":\"Constraining reference examples to exact lexical matches rather than allowing natural semantic variations degrades overall performance by making the system overly rigid.\",\"domain_tags\":[\"Prompt Engineering\",\"Few-Shot Learning\",\"Model Faithfulness\"]}", "cost_usd": 0.012658250000000001, "bootstrap_seed": 0, "agent_model": "gemini-3.1-pro-preview", "held_out_score": null, "criterion_names": ["key_points_captured", "conciseness", "faithful_to_source", "few_shot_format"], "per_criterion_scores": {"key_points_captured": 1.0, "conciseness": 1.0, "faithful_to_source": 0.6, "few_shot_format": 0.3}, "failure_classification": {"category": "semantic_drift", "description": "The refinement of few-shot examples, intended to improve factual cleanliness and strict faithfulness, inadvertently caused the model's output to severely degrade in factual alignment and faithfulness, resulting in a low score of 2.9. This indicates a significant semantic drift where the output's meaning became less accurate or faithful to the source, despite the structural format remaining unchanged.", "fix_direction": "Analyze how the model processed the overly specific few-shot examples. Investigate if the strictness led to over-constraining the model, hindering its ability to generalize or rephrase accurately while maintaining facts, or if it inadvertently introduced new biases. Explore a less rigid approach to example refinement that balances factual precision with the model's ability to generate fluent and robust output, or consider alternative methods for enforcing faithfulness.", "confidence": 0.95}, "drafts_generated": 1, "drafts_survived": 1}
{"id": "1aaa5423-9f9f-4508-a853-b1e7aae51368", "target_id": "B2-greedy", "git_sha": "5d4229bb06a1f4b50b7e74de7532c2064266b5b5", "pre_experiment_sha": "5d4229bb06a1f4b50b7e74de7532c2064266b5b5", "timestamp": "2026-04-22T05:11:05.095347+00:00", "hypothesis": "Refine the few-shot examples to eliminate implicit acronyms (like RLHF and NSF) and minor semantic deviations, ensuring 100% factual cleanliness without adding over-constraining rules to the prompt.", "hypothesis_source": "agent", "mutation_diff_summary": "", "score": 3.1, "score_ci_lower": 2.3, "score_ci_upper": 3.9, "raw_scores": [4.0, 3.5, 2.0, 2.0, 4.0], "baseline_score": 3.6, "outcome": "DISCARDED", "failure_mode": null, "duration_seconds": 63.27301179198548, "tags": ["factual-cleanliness", "few-shot-refinement"], "learnings": "{\"what_changed\":\"\",\"what_improved\":[],\"what_regressed\":[],\"transferable_insight\":\"Over-sanitizing reference examples to eliminate common abbreviations and minor natural variations can degrade performance by making the data less representative of real-world inputs.\",\"domain_tags\":[\"Prompt Engineering\",\"Few-Shot Learning\",\"Data Curation\"]}", "cost_usd": 0.0142649, "bootstrap_seed": 0, "agent_model": "gemini-3.1-pro-preview", "held_out_score": null, "criterion_names": ["key_points_captured", "conciseness", "faithful_to_source", "few_shot_format"], "per_criterion_scores": {"key_points_captured": 1.0, "conciseness": 1.0, "faithful_to_source": 0.6, "few_shot_format": 0.5}, "failure_classification": {"category": "semantic_drift", "description": "The hypothesis aimed to refine few-shot examples to achieve 100% factual cleanliness and eliminate semantic deviations (like implicit acronyms). The low score (3.1) indicates that these refinement efforts failed significantly. This suggests that the few-shot examples either still contained ambiguities, unexpanded acronyms, or factual inaccuracies, or that the attempts at refinement inadvertently altered the intended meaning. As a result, the model likely misinterpreted the examples' true intent, causing its behavior to drift from the desired semantic outcome.", "fix_direction": "1. **Systematic Review & Validation:** Implement a multi-stage review process for few-shot examples, including human review and potentially automated checks for acronym expansion, factual consistency, and semantic clarity. This could involve cross-referencing against a 'gold standard' knowledge base. 2. **Clearer Guidelines & Definitions:** Provide explicit, objective criteria for what constitutes a 'semantic deviation' and 'factual cleanliness' to those performing the refinements, possibly with negative examples. 3. **Incremental Refinement & Targeted Testing:** Instead of a holistic approach, focus on addressing one type of semantic issue at a time (e.g., first eliminate all acronyms, then address minor semantic deviations) and test the impact of each change incrementally. 4. **Intermediate Evaluation Metrics:** Develop metrics specifically to evaluate the quality and clarity of the few-shot examples themselves (e.g., perplexity on known good examples, semantic similarity scores) rather than solely relying on the final model performance.", "confidence": 0.9}, "drafts_generated": 1, "drafts_survived": 1}
{"id": "0c04e425-9881-4049-8799-2529c5ab38cf", "target_id": "B2-greedy", "git_sha": "5d4229bb06a1f4b50b7e74de7532c2064266b5b5", "pre_experiment_sha": "5d4229bb06a1f4b50b7e74de7532c2064266b5b5", "timestamp": "2026-04-22T05:12:48.678222+00:00", "hypothesis": "Refine the few-shot examples to remove hallucinated acronyms (e.g., RLHF, NSF) and slight paraphrasing distortions, ensuring they are perfectly faithful to the source texts while maintaining explicit constraints for strict faithfulness and no outside information.", "hypothesis_source": "agent", "mutation_diff_summary": "", "score": 2.6, "score_ci_lower": 2.0, "score_ci_upper": 3.4, "raw_scores": [2.0, 2.0, 3.0, 2.0, 4.0], "baseline_score": 3.6, "outcome": "DISCARDED", "failure_mode": null, "duration_seconds": 78.93246949999593, "tags": ["few-shot", "factual-cleanliness", "strict-faithfulness"], "learnings": "{\"what_changed\":\"\",\"what_improved\":[],\"what_regressed\":[],\"transferable_insight\":\"Removing minor variations and slight paraphrasing from few-shot examples to enforce strict adherence to source material can actually degrade performance by limiting the model's ability to generalize.\",\"domain_tags\":[\"Prompt Engineering\",\"Few-Shot Learning\",\"Model Generalization\"]}", "cost_usd": 0.012296750000000002, "bootstrap_seed": 0, "agent_model": "gemini-3.1-pro-preview", "held_out_score": null, "criterion_names": ["key_points_captured", "conciseness", "faithful_to_source", "few_shot_format"], "per_criterion_scores": {"key_points_captured": 1.0, "conciseness": 1.0, "faithful_to_source": 0.4, "few_shot_format": 0.2}, "failure_classification": {"category": "semantic_drift", "description": "The experiment failed to achieve its primary objective: eliminating semantic inaccuracies like hallucinated acronyms and paraphrasing distortions in the few-shot examples. This means the refined examples still contained content that was not perfectly faithful to the source texts, despite the explicit goal of ensuring strict faithfulness and no outside information. The low score of 2.6 indicates a significant failure in maintaining semantic integrity.", "fix_direction": "Implement robust automated and/or human validation steps to rigorously compare refined few-shot examples against their source texts, specifically flagging and correcting any introduced acronyms, altered phrasing, or information not present in the original source, prioritizing verbatim accuracy where required.", "confidence": 0.95}, "drafts_generated": 1, "drafts_survived": 1}
{"id": "6571a885-5bef-4779-9042-48843d3b630b", "target_id": "B2-greedy", "git_sha": "5d4229bb06a1f4b50b7e74de7532c2064266b5b5", "pre_experiment_sha": "5d4229bb06a1f4b50b7e74de7532c2064266b5b5", "timestamp": "2026-04-22T05:14:32.008929+00:00", "hypothesis": "Refine the system prompt to be strictly rule-based, using a bulleted list and removing conversational filler, while leaving few-shot examples and structural markers completely untouched.", "hypothesis_source": "agent", "mutation_diff_summary": "", "score": 3.0, "score_ci_lower": 2.4, "score_ci_upper": 3.6, "raw_scores": [3.0, 2.5, 3.5, 2.0, 4.0], "baseline_score": 3.6, "outcome": "DISCARDED", "failure_mode": null, "duration_seconds": 66.2515439579729, "tags": ["prompt-engineering", "constraint-formatting", "zero-shot-to-few-shot"], "learnings": "{\"what_changed\":\"\",\"what_improved\":[],\"what_regressed\":[],\"transferable_insight\":\"Removing conversational filler to make instructions strictly rule-based can degrade performance, suggesting that natural language framing helps models better contextualize and apply the rules.\",\"domain_tags\":[\"Prompt Engineering\",\"Instruction Formatting\",\"System Prompts\"]}", "cost_usd": 0.012427250000000003, "bootstrap_seed": 0, "agent_model": "gemini-3.1-pro-preview", "held_out_score": null, "criterion_names": ["key_points_captured", "conciseness", "faithful_to_source", "few_shot_format"], "per_criterion_scores": {"key_points_captured": 1.0, "conciseness": 1.0, "faithful_to_source": 0.7, "few_shot_format": 0.3}, "failure_classification": {"category": "semantic_drift", "description": "The attempt to refine the system prompt by making it 'strictly rule-based' and removing 'conversational filler' likely stripped away crucial implicit context, nuance, or helpful guidance that the model previously used. While structural markers and few-shot examples were left untouched (suggesting output format might have been preserved), the model's interpretation of the task, its ability to generate high-quality meaning, or its overall accuracy degraded, leading to a lower score (semantic drift). The output might be formatted correctly but its content is less useful, accurate, or complete.", "fix_direction": "Explore reintroducing elements of implicit context, tone, or subtle task framing that guide the model's understanding without resorting to excessive 'conversational filler'. This could involve clearer intent statements, carefully selected keywords, or more descriptive phrasing for rules. Consider a hybrid approach that balances strict rules with sufficient contextual cues to ensure the model understands the desired meaning and quality of output.", "confidence": 0.9}, "drafts_generated": 1, "drafts_survived": 1}
{"id": "6f89cd69-48fc-4c68-bfbc-aeb25d4afbb1", "target_id": "B2-greedy", "git_sha": "5d4229bb06a1f4b50b7e74de7532c2064266b5b5", "pre_experiment_sha": "5d4229bb06a1f4b50b7e74de7532c2064266b5b5", "timestamp": "2026-04-22T05:16:05.478632+00:00", "hypothesis": "Removed conversational filler from the system prompt and restructured constraints into a direct, strictly rule-based bulleted list emphasizing strict faithfulness, no outside information, objectivity, and conciseness, while preserving all examples and structural markers.", "hypothesis_source": "agent", "mutation_diff_summary": "", "score": 2.5, "score_ci_lower": 2.0, "score_ci_upper": 3.3, "raw_scores": [2.0, 2.5, 2.0, 4.0, 2.0], "baseline_score": 3.6, "outcome": "DISCARDED", "failure_mode": null, "duration_seconds": 64.79750904091634, "tags": ["system_prompt", "formatting", "constraints"], "learnings": "{\"what_changed\":\"\",\"what_improved\":[],\"what_regressed\":[],\"transferable_insight\":\"Stripping conversational framing to create overly rigid, rule-based constraints can degrade performance, indicating that natural language context helps models balance strict rules with effective task execution.\",\"domain_tags\":[\"Prompt Engineering\",\"Instruction Formatting\",\"Constraint Management\"]}", "cost_usd": 0.011537950000000002, "bootstrap_seed": 0, "agent_model": "gemini-3.1-pro-preview", "held_out_score": null, "criterion_names": ["key_points_captured", "conciseness", "faithful_to_source", "few_shot_format"], "per_criterion_scores": {"key_points_captured": 1.0, "conciseness": 1.0, "faithful_to_source": 0.3, "few_shot_format": 0.2}, "failure_classification": {"category": "semantic_drift", "description": "The removal of conversational filler and the rigid restructuring of constraints likely stripped away crucial context, nuance, or implicit guidance that previously helped the model interpret the *spirit* of the instructions. While the model might be adhering to a literal interpretation of the new 'strictly rule-based' rules, its understanding of what constitutes 'strict faithfulness, no outside information, objectivity, and conciseness' has drifted from the intended meaning, leading to outputs that are functionally incorrect or unhelpful despite potentially adhering to basic format.", "fix_direction": "Re-evaluate the balance between strict rule-based instructions and contextual guidance. Experiment with reintroducing elements that provide clearer examples or explain the *intent* behind the rules, rather than just stating the rules. Consider if the new strict rules are too restrictive, mutually exclusive, or lead to overly literal interpretations that hinder overall quality. Test reintroducing a more conversational or pedagogical tone in specific sections to guide understanding without sacrificing conciseness.", "confidence": 0.85}, "drafts_generated": 1, "drafts_survived": 1}
{"id": "dcf72497-e2c3-40c9-90da-5146433419ad", "target_id": "B2-greedy", "git_sha": "5d4229bb06a1f4b50b7e74de7532c2064266b5b5", "pre_experiment_sha": "5d4229bb06a1f4b50b7e74de7532c2064266b5b5", "timestamp": "2026-04-22T05:17:36.319365+00:00", "hypothesis": "Refining the system prompt to be more direct and strictly rule-based, using bullet points for the explicitly mandated constraints (strict faithfulness, no outside information, objectivity, conciseness), while leaving the few-shot examples and structural ending completely untouched.", "hypothesis_source": "agent", "mutation_diff_summary": "", "score": 3.0, "score_ci_lower": 2.2, "score_ci_upper": 3.8, "raw_scores": [4.0, 2.0, 2.0, 4.0, 3.0], "baseline_score": 3.6, "outcome": "DISCARDED", "failure_mode": null, "duration_seconds": 67.99252004199661, "tags": ["prompt-engineering", "constraint-formatting", "zero-shot-refinement"], "learnings": "{\"what_changed\":\"\",\"what_improved\":[],\"what_regressed\":[],\"transferable_insight\":\"Transitioning to strictly rule-based, bulleted constraints without simultaneously aligning the few-shot examples can degrade model performance by creating friction between the rigid instructions and the demonstrated behavior.\",\"domain_tags\":[\"Prompt Engineering\",\"Instruction Formatting\",\"Few-Shot Learning\"]}", "cost_usd": 0.012372649999999999, "bootstrap_seed": 0, "agent_model": "gemini-3.1-pro-preview", "held_out_score": null, "criterion_names": ["key_points_captured", "conciseness", "faithful_to_source", "few_shot_format"], "per_criterion_scores": {"key_points_captured": 1.0, "conciseness": 1.0, "faithful_to_source": 0.6, "few_shot_format": 0.4}, "failure_classification": {"category": "semantic_drift", "description": "The experiment's attempt to make the system prompt more direct and strictly rule-based for semantic constraints (faithfulness, objectivity, conciseness) likely led to an unintended shift in the model's interpretation of these rules. While the output may have maintained its structural format, the meaning, quality, or tone of the content drifted from the desired outcome, becoming less faithful, objective, or concise in practice, despite the explicit instructions. The 'unknown' failure mode suggests that the *why* behind this degradation in semantic quality was not immediately apparent.", "fix_direction": "Investigate how the model interpreted the 'strictly rule-based' and 'direct' phrasing for semantic attributes. Consider softening the language slightly, providing clearer contextual examples for each constraint, or exploring alternative ways to enforce these rules without leading to overly literal or unintended interpretations. It might also be beneficial to analyze outputs for specific types of semantic misinterpretations (e.g., being too generic instead of objective, or omitting details to be concise, leading to incompleteness) to refine the prompt more precisely.", "confidence": 0.9}, "drafts_generated": 1, "drafts_survived": 1}
{"id": "1bef8216-2c55-48a3-a4b5-8fcd42d901c1", "target_id": "B2-greedy", "git_sha": "5d4229bb06a1f4b50b7e74de7532c2064266b5b5", "pre_experiment_sha": "5d4229bb06a1f4b50b7e74de7532c2064266b5b5", "timestamp": "2026-04-22T05:19:58.851006+00:00", "hypothesis": "Add a natural-language sentence emphasizing factual accuracy and faithfulness, encourage natural paraphrasing to capture core meaning, and soften \"Strict Rules\" to \"Guidelines\" to avoid over-constraining the model.", "hypothesis_source": "agent", "mutation_diff_summary": "", "score": 3.4, "score_ci_lower": 3.0, "score_ci_upper": 3.8, "raw_scores": [3.0, 3.0, 4.0, 3.0, 4.0], "baseline_score": 3.6, "outcome": "DISCARDED", "failure_mode": null, "duration_seconds": 99.63351308298297, "tags": ["prompt-engineering", "factual-accuracy", "natural-paraphrasing", "soft-constraints"], "learnings": "{\"what_changed\":\"\",\"what_improved\":[],\"what_regressed\":[],\"transferable_insight\":\"Softening explicit constraints into general guidelines and encouraging paraphrasing degrades performance, demonstrating that models rely on rigid boundaries rather than soft suggestions to maintain strict accuracy and adherence.\",\"domain_tags\":[\"Prompt Engineering\",\"Constraint Formatting\",\"Factual Accuracy\"]}", "cost_usd": 0.013205550000000002, "bootstrap_seed": 0, "agent_model": "gemini-3.1-pro-preview", "held_out_score": null, "criterion_names": ["key_points_captured", "conciseness", "faithful_to_source", "few_shot_format"], "per_criterion_scores": {"key_points_captured": 1.0, "conciseness": 1.0, "faithful_to_source": 1.0, "few_shot_format": 0.4}, "failure_classification": {"category": "semantic_drift", "description": "The prompt modifications, intended to emphasize factual accuracy, encourage paraphrasing, and soften 'Strict Rules' to 'Guidelines', likely led the model to misinterpret the new instructions. This resulted in outputs with incorrect or undesired meaning (e.g., decreased factual accuracy, poor paraphrasing, or misapplication of guidelines), despite potentially adhering to output formats, leading to the low score.", "fix_direction": "Refine the prompt to ensure unambiguous semantic understanding of the new guidelines. Clearly communicate the interplay between flexibility (paraphrasing, guidelines) and strict adherence to factual accuracy and faithfulness, ensuring the model prioritizes accuracy while leveraging flexibility appropriately. Test different wordings and explicit examples.", "confidence": 0.9}, "drafts_generated": 1, "drafts_survived": 1}
