{"id": "da53f32f-7365-4e71-b5cf-c4b9f47b91a2", "target_id": "B2-greedy", "git_sha": "4aa393dc8fd3b4f08fcc9eb825917f26c9f26904", "pre_experiment_sha": "4aa393dc8fd3b4f08fcc9eb825917f26c9f26904", "timestamp": "2026-04-24T03:16:35.455299+00:00", "hypothesis": "Capitalize the word \"assistant\" to \"Assistant\" in the first sentence to slightly elevate the persona's perceived authority without altering semantic meaning or structure.", "hypothesis_source": "agent", "mutation_diff_summary": "", "score": 2.8, "score_ci_lower": 2.2, "score_ci_upper": 3.4, "raw_scores": [4.0, 3.0, 2.0, 2.0, 3.0], "baseline_score": 3.7, "outcome": "DISCARDED", "failure_mode": null, "duration_seconds": 59.03652983298525, "tags": ["capitalization", "persona"], "learnings": "{\"what_changed\":\"\",\"what_improved\":[],\"what_regressed\":[],\"transferable_insight\":\"Attempting to elevate a persona's perceived authority through the arbitrary capitalization of role descriptors is ineffective and degrades performance.\",\"domain_tags\":[\"Persona Design\",\"Tone and Voice\",\"Formatting\"]}", "cost_usd": 0.011541600000000003, "bootstrap_seed": 0, "agent_model": "gemini-3.1-pro-preview", "held_out_score": null, "criterion_names": ["key_points_captured", "conciseness", "faithful_to_source", "few_shot_format"], "per_criterion_scores": {"key_points_captured": 1.0, "conciseness": 1.0, "faithful_to_source": 0.6, "few_shot_format": 0.2}, "failure_classification": {"category": "semantic_drift", "description": "The capitalization of 'assistant' to 'Assistant' subtly altered the semantic meaning or implication of the word, violating the hypothesis's constraint of 'without altering semantic meaning or structure'. While intended to elevate authority, this change likely shifted the perception of the word from a common noun describing a role to a proper noun, title, or specific entity, which may have led to an unintended and less authoritative persona, reflected in the low score.", "fix_direction": "Re-evaluate the specific contextual impact of capitalization. If the goal is to elevate authority, explore alternative linguistic strategies (e.g., stronger verbs, more formal phrasing, or explicit statements of capability) that achieve the desired effect without inadvertently changing the fundamental meaning or naturalness of the persona's language. If capitalization is still pursued, ensure the surrounding context clearly supports it as a legitimate title or proper noun if that is the intended semantic shift.", "confidence": 0.85}, "drafts_generated": 1, "drafts_survived": 1}
{"id": "0e99a90e-9b24-4db1-bbae-09b75d66d36f", "target_id": "B2-greedy", "git_sha": "4aa393dc8fd3b4f08fcc9eb825917f26c9f26904", "pre_experiment_sha": "4aa393dc8fd3b4f08fcc9eb825917f26c9f26904", "timestamp": "2026-04-24T03:17:48.185484+00:00", "hypothesis": "Change the capitalization of the non-critical word \"assistant\" to \"Assistant\" to subtly alter prompt tokenization while strictly preserving semantic constraints.", "hypothesis_source": "agent", "mutation_diff_summary": "", "score": 2.2, "score_ci_lower": 2.0, "score_ci_upper": 2.6, "raw_scores": [2.0, 3.0, 2.0, 2.0, 2.0], "baseline_score": 3.7, "outcome": "DISCARDED", "failure_mode": null, "duration_seconds": 53.90480845887214, "tags": ["capitalization", "minimal-change"], "learnings": "{\"what_changed\":\"\",\"what_improved\":[],\"what_regressed\":[],\"transferable_insight\":\"Arbitrary capitalization changes aimed at manipulating underlying tokenization without altering semantics can degrade overall system performance.\",\"domain_tags\":[\"Prompt Engineering\",\"Tokenization\",\"Natural Language Processing\"]}", "cost_usd": 0.010130950000000001, "bootstrap_seed": 0, "agent_model": "gemini-3.1-pro-preview", "held_out_score": null, "criterion_names": ["key_points_captured", "conciseness", "faithful_to_source", "few_shot_format"], "per_criterion_scores": {"key_points_captured": 1.0, "conciseness": 1.0, "faithful_to_source": 0.2, "few_shot_format": 0.0}, "failure_classification": {"category": "semantic_drift", "description": "The subtle capitalization change, intended to only alter tokenization, likely caused the language model to interpret the prompt's meaning differently than intended, leading to the observed performance degradation despite the stated goal of strictly preserving semantic constraints.", "fix_direction": "Rigorously validate the semantic neutrality of proposed text changes, beyond just analyzing tokenization. This could involve human evaluation of perceived meaning shifts, or analysis of internal model representations (e.g., embeddings, attention patterns) to understand how the subtle change affects the model's interpretation.", "confidence": 0.85}, "drafts_generated": 1, "drafts_survived": 1}
{"id": "3a36f6c5-91b5-4540-8db0-676dd79cbcb3", "target_id": "B2-greedy", "git_sha": "4aa393dc8fd3b4f08fcc9eb825917f26c9f26904", "pre_experiment_sha": "4aa393dc8fd3b4f08fcc9eb825917f26c9f26904", "timestamp": "2026-04-24T03:18:56.598856+00:00", "hypothesis": "Capitalize 'Assistant' in the system prompt to subtly alter attention without changing semantics or constraints.", "hypothesis_source": "agent", "mutation_diff_summary": "", "score": 2.9, "score_ci_lower": 2.2, "score_ci_upper": 3.6, "raw_scores": [3.5, 3.0, 4.0, 2.0, 2.0], "baseline_score": 3.7, "outcome": "DISCARDED", "failure_mode": null, "duration_seconds": 51.130422834074125, "tags": ["capitalization", "minimal-change"], "learnings": "{\"what_changed\":\"\",\"what_improved\":[],\"what_regressed\":[],\"transferable_insight\":\"Subtle typographic modifications, such as capitalizing specific words to shift attention without altering underlying semantics, are ineffective and can negatively impact performance.\",\"domain_tags\":[\"Prompt Engineering\",\"Formatting\",\"Attention Manipulation\"]}", "cost_usd": 0.011867200000000001, "bootstrap_seed": 0, "agent_model": "gemini-3.1-pro-preview", "held_out_score": null, "criterion_names": ["key_points_captured", "conciseness", "faithful_to_source", "few_shot_format"], "per_criterion_scores": {"key_points_captured": 1.0, "conciseness": 1.0, "faithful_to_source": 0.6, "few_shot_format": 0.3}, "failure_classification": {"category": "semantic_drift", "description": "The experiment aimed to subtly alter model attention via capitalization without changing explicit semantics. The low score indicates that this minor formatting change unexpectedly led to a negative shift in the model's interpretation or processing, effectively causing a semantic drift that degraded performance rather than achieving the intended subtle attention shift or maintaining neutrality. The model likely over-indexed on the capitalized word in a counterproductive way.", "fix_direction": "Investigate why capitalization of a common role word had a detrimental effect on performance. Future attempts to influence model attention should consider more explicit prompt engineering techniques, contextual framing, or parameter tuning, rather than relying on subtle formatting changes that can lead to unpredictable or negative semantic shifts. Rigorously test any changes for unintended side effects on meaning or behavior.", "confidence": 0.9}, "drafts_generated": 1, "drafts_survived": 1}
{"id": "e0e1651d-c9fc-44a8-81eb-df76ef3ffd0f", "target_id": "B2-greedy", "git_sha": "4aa393dc8fd3b4f08fcc9eb825917f26c9f26904", "pre_experiment_sha": "4aa393dc8fd3b4f08fcc9eb825917f26c9f26904", "timestamp": "2026-04-24T03:20:22.054470+00:00", "hypothesis": "Contract \"You are\" to \"You're\" in the system instruction to slightly alter tokenization while preserving all semantics and constraints.", "hypothesis_source": "agent", "mutation_diff_summary": "", "score": 2.9, "score_ci_lower": 2.4, "score_ci_upper": 3.5, "raw_scores": [4.0, 2.5, 3.0, 3.0, 2.0], "baseline_score": 3.7, "outcome": "DISCARDED", "failure_mode": null, "duration_seconds": 55.335727541008964, "tags": ["contraction", "minimal-change"], "learnings": "{\"what_changed\":\"\",\"what_improved\":[],\"what_regressed\":[],\"transferable_insight\":\"Replacing explicit phrasing with contractions in system instructions can degrade model performance, indicating that uncontracted forms are preferable for optimal tokenization and instruction adherence.\",\"domain_tags\":[\"Prompt Engineering\",\"Tokenization\",\"System Prompts\"]}", "cost_usd": 0.011051200000000002, "bootstrap_seed": 0, "agent_model": "gemini-3.1-pro-preview", "held_out_score": null, "criterion_names": ["key_points_captured", "conciseness", "faithful_to_source", "few_shot_format"], "per_criterion_scores": {"key_points_captured": 1.0, "conciseness": 1.0, "faithful_to_source": 0.7, "few_shot_format": 0.2}, "failure_classification": {"category": "semantic_drift", "description": "The hypothesis aimed to alter tokenization while preserving all semantics. The low score (2.9000) strongly indicates that the subtle linguistic change from 'You are' to 'You're', while seemingly semantically equivalent to a human, introduced an unintended semantic shift in how the model interpreted the system instruction. This shift in the model's understanding or 'meaning' of the instruction led to a degradation in performance, even if the instruction itself remained syntactically valid.", "fix_direction": "Future attempts should focus on rigorously validating semantic equivalence when making linguistic changes, especially those intended to affect tokenization. This includes comprehensive testing to detect subtle shifts in model behavior and understanding, potentially using explicit tokens or structural changes known to be semantically neutral for the target model, rather than relying solely on perceived natural language equivalence.", "confidence": 0.95}, "drafts_generated": 1, "drafts_survived": 1}
{"id": "0fbea14b-f28d-437e-997f-c59fe3ba2872", "target_id": "B2-greedy", "git_sha": "4aa393dc8fd3b4f08fcc9eb825917f26c9f26904", "pre_experiment_sha": "4aa393dc8fd3b4f08fcc9eb825917f26c9f26904", "timestamp": "2026-04-24T03:21:38.795666+00:00", "hypothesis": "Contract \"You are\" to \"You're\" to slightly alter the prompt's tokenization without changing the semantic constraints.", "hypothesis_source": "agent", "mutation_diff_summary": "", "score": 2.5, "score_ci_lower": 2.1, "score_ci_upper": 2.9, "raw_scores": [3.0, 2.5, 3.0, 2.0, 2.0], "baseline_score": 3.7, "outcome": "DISCARDED", "failure_mode": null, "duration_seconds": 59.54326629196294, "tags": ["contraction", "minimal-change"], "learnings": "{\"what_changed\":\"\",\"what_improved\":[],\"what_regressed\":[],\"transferable_insight\":\"Minor syntactic contractions intended to optimize tokenization can unexpectedly degrade model performance, suggesting that explicit, uncontracted phrasing is generally more reliable.\",\"domain_tags\":[\"Prompt Engineering\",\"Tokenization\",\"Syntax\"]}", "cost_usd": 0.010415649999999999, "bootstrap_seed": 0, "agent_model": "gemini-3.1-pro-preview", "held_out_score": null, "criterion_names": ["key_points_captured", "conciseness", "faithful_to_source", "few_shot_format"], "per_criterion_scores": {"key_points_captured": 1.0, "conciseness": 1.0, "faithful_to_source": 0.5, "few_shot_format": 0.0}, "failure_classification": {"category": "semantic_drift", "description": "The experiment hypothesized that contracting 'You are' to 'You're' would alter tokenization without changing semantic constraints. However, the significantly low score (2.5000) suggests that this subtle linguistic change, despite being semantically equivalent to a human, caused the model to interpret the prompt differently or less effectively, leading to a drift in meaning that negatively impacted performance.", "fix_direction": "Investigate the specific impact of tokenization changes on the model's internal representation for 'You are' vs. 'You're'. Analyze model outputs to pinpoint where the understanding deviates. Consider exploring alternative tokenization strategies that are demonstrably robust to subtle phrasing variations, or revert to the original phrasing if the performance benefit of changed tokenization is not critical.", "confidence": 0.9}, "drafts_generated": 1, "drafts_survived": 1}
{"id": "b57f71f0-9c60-4655-816a-a71a23b6cb8a", "target_id": "B2-greedy", "git_sha": "4aa393dc8fd3b4f08fcc9eb825917f26c9f26904", "pre_experiment_sha": "4aa393dc8fd3b4f08fcc9eb825917f26c9f26904", "timestamp": "2026-04-24T03:22:56.590403+00:00", "hypothesis": "Contract \"You are\" to \"You're\" in the opening sentence to test if a slight adjustment in the introductory persona impacts the metric while preserving all constraints and semantic meaning.", "hypothesis_source": "agent", "mutation_diff_summary": "", "score": 2.9, "score_ci_lower": 2.2, "score_ci_upper": 3.6, "raw_scores": [2.0, 3.5, 4.0, 2.0, 3.0], "baseline_score": 3.7, "outcome": "DISCARDED", "failure_mode": null, "duration_seconds": 61.99394537508488, "tags": ["contraction", "minimal-mutation"], "learnings": "{\"what_changed\":\"\",\"what_improved\":[],\"what_regressed\":[],\"transferable_insight\":\"Replacing formal phrasing with informal contractions in introductory instructions degrades overall performance.\",\"domain_tags\":[\"Prompt Engineering\",\"Tone and Style\",\"Persona Assignment\"]}", "cost_usd": 0.01160975, "bootstrap_seed": 0, "agent_model": "gemini-3.1-pro-preview", "held_out_score": null, "criterion_names": ["key_points_captured", "conciseness", "faithful_to_source", "few_shot_format"], "per_criterion_scores": {"key_points_captured": 1.0, "conciseness": 1.0, "faithful_to_source": 0.6, "few_shot_format": 0.3}, "failure_classification": {"category": "semantic_drift", "description": "Although the contraction 'You're' preserves the literal meaning of 'You are' and is grammatically correct, it likely caused an unintended shift in the introductory persona or tone. This subtle change in implied meaning or user perception (semantic drift) led to the observed negative impact on the metric, failing the experiment's goal to preserve all constraints and semantic meaning while testing persona.", "fix_direction": "Re-evaluate the specific nuances of the introductory persona desired. If 'You are' conveyed a more appropriate level of formality or directness, revert to it. Consider qualitative feedback to understand how users perceive the difference between 'You are' and 'You're' in this specific context. Explore other linguistic variations that explicitly target the desired persona without causing negative semantic shifts.", "confidence": 0.9}, "drafts_generated": 1, "drafts_survived": 1}
{"id": "a66ace38-9776-4073-b3c2-770864c8b47a", "target_id": "B2-greedy", "git_sha": "4aa393dc8fd3b4f08fcc9eb825917f26c9f26904", "pre_experiment_sha": "4aa393dc8fd3b4f08fcc9eb825917f26c9f26904", "timestamp": "2026-04-24T03:24:31.140347+00:00", "hypothesis": "Change 'produce' to 'generate' to slightly alter the vocabulary without changing the meaning or structural constraints.", "hypothesis_source": "agent", "mutation_diff_summary": "", "score": 3.1, "score_ci_lower": 2.5, "score_ci_upper": 3.7, "raw_scores": [3.0, 2.0, 3.0, 3.5, 4.0], "baseline_score": 3.7, "outcome": "DISCARDED", "failure_mode": null, "duration_seconds": 65.00854691700079, "tags": ["vocabulary", "minimal-change"], "learnings": "{\"what_changed\":\"\",\"what_improved\":[],\"what_regressed\":[],\"transferable_insight\":\"Replacing established vocabulary with synonyms purely for variation can negatively impact performance, suggesting that seemingly equivalent words carry subtle semantic differences or prompt associations.\",\"domain_tags\":[\"Prompt Engineering\",\"Semantics\",\"Linguistics\"]}", "cost_usd": 0.01127185, "bootstrap_seed": 0, "agent_model": "gemini-3.1-pro-preview", "held_out_score": null, "criterion_names": ["key_points_captured", "conciseness", "faithful_to_source", "few_shot_format"], "per_criterion_scores": {"key_points_captured": 1.0, "conciseness": 1.0, "faithful_to_source": 0.6, "few_shot_format": 0.5}, "failure_classification": {"category": "semantic_drift", "description": "The experiment aimed to replace 'produce' with 'generate' without altering the meaning. The failure suggests that the semantic nuance or contextual appropriateness was not maintained, causing the meaning to shift, even if subtly, from the original intent.", "fix_direction": "Future attempts should involve a more rigorous semantic check for synonym replacements, potentially using contextual embeddings or human evaluation to ensure the replacement word ('generate') maintains the exact meaning and naturalness in the given context where 'produce' was originally used.", "confidence": 0.9}, "drafts_generated": 1, "drafts_survived": 1}
{"id": "9c3104df-7c72-46fb-aa70-8c83f1c5d52c", "target_id": "B2-greedy", "git_sha": "4aa393dc8fd3b4f08fcc9eb825917f26c9f26904", "pre_experiment_sha": "4aa393dc8fd3b4f08fcc9eb825917f26c9f26904", "timestamp": "2026-04-24T03:26:02.715950+00:00", "hypothesis": "Remove the word \"below\" after \"Read the article\" to eliminate spatial ambiguity, since the target article to be summarized actually appears after the few-shot examples.", "hypothesis_source": "agent", "mutation_diff_summary": "", "score": 2.3, "score_ci_lower": 2.0, "score_ci_upper": 2.7, "raw_scores": [2.0, 2.5, 3.0, 2.0, 2.0], "baseline_score": 3.7, "outcome": "DISCARDED", "failure_mode": null, "duration_seconds": 77.83262274996378, "tags": ["spatial-ambiguity", "minimal-change", "lexical-tweak"], "learnings": "{\"what_changed\":\"\",\"what_improved\":[],\"what_regressed\":[],\"transferable_insight\":\"Explicit directional cues like 'below' help models locate target information within the context window, and removing them to fix perceived spatial inaccuracies caused by intervening text can actually degrade performance.\",\"domain_tags\":[\"Prompt Engineering\",\"Instruction Design\",\"Context Management\"]}", "cost_usd": 0.01097905, "bootstrap_seed": 0, "agent_model": "gemini-3.1-pro-preview", "held_out_score": null, "criterion_names": ["key_points_captured", "conciseness", "faithful_to_source", "few_shot_format"], "per_criterion_scores": {"key_points_captured": 1.0, "conciseness": 1.0, "faithful_to_source": 0.3, "few_shot_format": 0.0}, "failure_classification": {"category": "semantic_drift", "description": "The experiment hypothesized that removing the spatially inaccurate word \"below\" would improve clarity. However, the resulting lower score suggests that \"below,\" despite its literal inaccuracy, might have served as a critical implicit cue or anchor for the model to correctly locate and process the target article (which appeared after few-shot examples). Its removal likely caused a semantic shift in the instruction's effective meaning for the model, leading to misinterpretation or failure to identify the correct content to summarize.", "fix_direction": "Future attempts should re-evaluate the role of seemingly 'incorrect' words in prompts, as they might serve as crucial heuristics for the model. Instead of simply removing the problematic word, experiment with alternative, more accurate phrasing that preserves or enhances the model's ability to locate the content, such as \"Read the following article,\" \"Read the article provided after these examples,\" or by adding explicit start/end markers around the article itself.", "confidence": 0.95}, "drafts_generated": 1, "drafts_survived": 1}
{"id": "556cb581-1925-46ea-8db4-dbd8b4950ed0", "target_id": "B2-greedy", "git_sha": "4aa393dc8fd3b4f08fcc9eb825917f26c9f26904", "pre_experiment_sha": "4aa393dc8fd3b4f08fcc9eb825917f26c9f26904", "timestamp": "2026-04-24T03:27:34.172599+00:00", "hypothesis": "Removing the redundant word \"essential\" from \"essential main points\" to improve prompt conciseness and clarity without altering the strict constraints.", "hypothesis_source": "agent", "mutation_diff_summary": "", "score": 2.8, "score_ci_lower": 2.3, "score_ci_upper": 3.4, "raw_scores": [2.5, 3.0, 4.0, 2.0, 2.5], "baseline_score": 3.7, "outcome": "DISCARDED", "failure_mode": null, "duration_seconds": 67.72033766680397, "tags": ["conciseness", "phrasing"], "learnings": "{\"what_changed\":\"\",\"what_improved\":[],\"what_regressed\":[],\"transferable_insight\":\"Eliminating seemingly redundant emphasis words to improve conciseness can negatively impact performance, as AI models often rely on these semantic intensifiers to accurately prioritize and filter information.\",\"domain_tags\":[\"Prompt Engineering\",\"Semantic Emphasis\",\"Conciseness\"]}", "cost_usd": 0.011068350000000003, "bootstrap_seed": 0, "agent_model": "gemini-3.1-pro-preview", "held_out_score": null, "criterion_names": ["key_points_captured", "conciseness", "faithful_to_source", "few_shot_format"], "per_criterion_scores": {"key_points_captured": 1.0, "conciseness": 1.0, "faithful_to_source": 0.5, "few_shot_format": 0.3}, "failure_classification": {"category": "semantic_drift", "description": "The word \"essential,\" although perceived as redundant from a human perspective, likely conveyed a specific semantic constraint to the model. Its removal caused the model to broaden its interpretation of \"main points,\" leading to outputs that no longer strictly adhered to the original, more constrained meaning, hence the lower score.", "fix_direction": "When attempting to reduce prompt verbosity, carefully test whether seemingly redundant qualifiers actually carry specific semantic weight for the model. Avoid removing terms that might implicitly define the scope, criticality, or strictness of the requested information. If conciseness is crucial, explore alternative phrasing that maintains semantic precision with fewer words, or explicitly reinforce the strictness in other parts of the prompt.", "confidence": 0.9}, "drafts_generated": 1, "drafts_survived": 1}
