{"id": "ade23bf0-7cf0-4ece-bb9e-d55ec9df84b4", "target_id": "B2-greedy", "git_sha": "56760fa73bbc7c83a7d29b48aca3305e6c0cc84f", "pre_experiment_sha": "98720ed81b388f89159675b9a957acbab5e8f23e", "timestamp": "2026-04-24T02:30:52.788611+00:00", "hypothesis": "Remove hallucinated extrapolations from the few-shot examples and explicitly instruct the model not to include external information to ensure summaries strictly entail the source articles.", "hypothesis_source": "agent", "mutation_diff_summary": "", "score": 2.7, "score_ci_lower": 2.1, "score_ci_upper": 3.4, "raw_scores": [3.0, 2.5, 2.0, 2.0, 4.0], "baseline_score": 0.0, "outcome": "KEPT", "failure_mode": null, "duration_seconds": 70.60982012492605, "tags": ["prompt-engineering", "few-shot-correction", "hallucination-prevention"], "learnings": "{\"what_changed\":\"\",\"what_improved\":[],\"what_regressed\":[],\"transferable_insight\":\"Eliminating ungrounded extrapolations from few-shot examples and adding explicit negative constraints against using external information effectively prevents hallucinations and ensures strict adherence to the provided context.\",\"domain_tags\":[\"Prompt Engineering\",\"Few-Shot Prompting\",\"Hallucination Mitigation\"]}", "cost_usd": 0.0108111, "bootstrap_seed": 0, "agent_model": "gemini-3.1-pro-preview", "held_out_score": null, "criterion_names": ["key_points_captured", "conciseness", "faithful_to_source", "few_shot_format"], "per_criterion_scores": {"key_points_captured": 1.0, "conciseness": 1.0, "faithful_to_source": 0.5, "few_shot_format": 0.2}, "failure_classification": null, "drafts_generated": 1, "drafts_survived": 1}
{"id": "361e5d40-693a-4f99-95d5-3387f3c53625", "target_id": "B2-greedy", "git_sha": "4aa393dc8fd3b4f08fcc9eb825917f26c9f26904", "pre_experiment_sha": "56760fa73bbc7c83a7d29b48aca3305e6c0cc84f", "timestamp": "2026-04-24T02:31:50.714774+00:00", "hypothesis": "Make the few-shot examples significantly more concise to teach the model to generate shorter, punchier summaries that capture all main points without merely rephrasing the entire article.", "hypothesis_source": "agent", "mutation_diff_summary": "", "score": 3.7, "score_ci_lower": 3.3, "score_ci_upper": 4.0, "raw_scores": [4.0, 3.0, 4.0, 4.0, 3.5], "baseline_score": 2.7, "outcome": "KEPT", "failure_mode": null, "duration_seconds": 49.96403358387761, "tags": ["few-shot", "conciseness", "summarization"], "learnings": "{\"what_changed\":\"\",\"what_improved\":[],\"what_regressed\":[],\"transferable_insight\":\"Providing concise few-shot examples effectively conditions the model to generate shorter, more impactful outputs that distill key information without unnecessary verbosity.\",\"domain_tags\":[\"Few-Shot Prompting\",\"Output Formatting\",\"Summarization\"]}", "cost_usd": 0.0119267, "bootstrap_seed": 0, "agent_model": "gemini-3.1-pro-preview", "held_out_score": null, "criterion_names": ["key_points_captured", "conciseness", "faithful_to_source", "few_shot_format"], "per_criterion_scores": {"key_points_captured": 1.0, "conciseness": 1.0, "faithful_to_source": 1.0, "few_shot_format": 0.7}, "failure_classification": null, "drafts_generated": 1, "drafts_survived": 1}
{"id": "19e53c57-2715-435d-8690-bc80d9424a44", "target_id": "B2-greedy", "git_sha": "4aa393dc8fd3b4f08fcc9eb825917f26c9f26904", "pre_experiment_sha": "4aa393dc8fd3b4f08fcc9eb825917f26c9f26904", "timestamp": "2026-04-24T02:32:56.456612+00:00", "hypothesis": "Adding explicit bulleted constraints and structuring the final prompt to clearly label the appended input as \"Article:\" will improve adherence to summarization criteria.", "hypothesis_source": "agent", "mutation_diff_summary": "", "score": 2.8, "score_ci_lower": 2.2, "score_ci_upper": 3.4, "raw_scores": [3.0, 3.0, 2.0, 2.0, 4.0], "baseline_score": 3.7, "outcome": "DISCARDED", "failure_mode": null, "duration_seconds": 59.501631583087146, "tags": ["prompt-engineering", "constraints", "formatting"], "learnings": "{\"what_changed\":\"\",\"what_improved\":[],\"what_regressed\":[],\"transferable_insight\":\"Adding rigid structural labels and explicitly bulleted constraints to a prompt does not inherently improve adherence to instructions and may actually degrade overall performance.\",\"domain_tags\":[\"Prompt Engineering\",\"Instruction Following\",\"Formatting\"]}", "cost_usd": 0.01094865, "bootstrap_seed": 0, "agent_model": "gemini-3.1-pro-preview", "held_out_score": null, "criterion_names": ["key_points_captured", "conciseness", "faithful_to_source", "few_shot_format"], "per_criterion_scores": {"key_points_captured": 1.0, "conciseness": 1.0, "faithful_to_source": 0.6, "few_shot_format": 0.2}, "failure_classification": {"category": "semantic_drift", "description": "The explicit bulleted constraints and structured prompt (labeling input as 'Article:') failed to improve the model's adherence to summarization criteria. The very low score (2.8) indicates that the generated summaries likely exhibited significant issues with content quality, meaning, factual accuracy, conciseness, or completeness, despite the format potentially being acceptable. The provided guidance either confused the model, was ignored, or was counterproductive, leading to outputs that drifted significantly from the desired summary meaning.", "fix_direction": "Future attempts should focus on refining the clarity, specificity, and non-contradictory nature of the bulleted constraints. Experiment with different phrasings for instructions and consider incrementally introducing constraints to identify problematic ones. Analyze the generated summaries to pinpoint specific types of semantic errors (e.g., hallucination, missing key information, over-summarization) to tailor prompt improvements.", "confidence": 0.95}, "drafts_generated": 1, "drafts_survived": 1}
{"id": "ce6be44e-d393-4eb6-94c5-ed4e1b42d253", "target_id": "B2-greedy", "git_sha": "4aa393dc8fd3b4f08fcc9eb825917f26c9f26904", "pre_experiment_sha": "4aa393dc8fd3b4f08fcc9eb825917f26c9f26904", "timestamp": "2026-04-24T02:34:19.675711+00:00", "hypothesis": "Make the few-shot examples extremely concise and punchy while explicitly instructing the model to strictly entail the source text and forbid hallucinations without using heavy bullet points.", "hypothesis_source": "agent", "mutation_diff_summary": "", "score": 3.0, "score_ci_lower": 2.2, "score_ci_upper": 3.8, "raw_scores": [2.0, 3.0, 2.0, 4.0, 4.0], "baseline_score": 3.7, "outcome": "DISCARDED", "failure_mode": null, "duration_seconds": 53.283367374911904, "tags": ["conciseness", "prompt-engineering", "few-shot", "strict-entailment"], "learnings": "{\"what_changed\":\"\",\"what_improved\":[],\"what_regressed\":[],\"transferable_insight\":\"Over-simplifying few-shot examples and removing structural formatting degrades performance by depriving the model of necessary contextual and structural cues.\",\"domain_tags\":[\"Prompt Engineering\",\"Few-Shot Prompting\",\"Formatting\"]}", "cost_usd": 0.011000100000000002, "bootstrap_seed": 0, "agent_model": "gemini-3.1-pro-preview", "held_out_score": null, "criterion_names": ["key_points_captured", "conciseness", "faithful_to_source", "few_shot_format"], "per_criterion_scores": {"key_points_captured": 1.0, "conciseness": 1.0, "faithful_to_source": 0.5, "few_shot_format": 0.5}, "failure_classification": {"category": "semantic_drift", "description": "The experiment aimed to make the model strictly entail the source text and avoid hallucinations using concise few-shot examples and explicit instructions. The low score (3.0) indicates that the model likely failed to meet these core semantic requirements, generating output that contained incorrect or unsubstantiated information (hallucinations) or did not strictly adhere to the source meaning. This means the output's meaning drifted from the desired correct and entailed meaning, even if it might have followed the 'concise and punchy' stylistic instruction to some extent.", "fix_direction": "Re-evaluate the content and structure of the few-shot examples. While conciseness was a goal, ensure the examples clearly and unequivocally demonstrate the *principle* of strict entailment and non-hallucination. Consider if the 'concise and punchy' style inadvertently reduced the clarity required for semantic accuracy, or if a stronger emphasis on *demonstrating* strict entailment (perhaps with slightly more illustrative examples of source-to-target mapping) is needed, rather than solely relying on explicit negative instructions or brevity.", "confidence": 0.9}, "drafts_generated": 1, "drafts_survived": 1}
{"id": "fe81ecd7-b1f5-470c-a7c0-edb02940a26d", "target_id": "B2-greedy", "git_sha": "4aa393dc8fd3b4f08fcc9eb825917f26c9f26904", "pre_experiment_sha": "4aa393dc8fd3b4f08fcc9eb825917f26c9f26904", "timestamp": "2026-04-24T02:35:42.461595+00:00", "hypothesis": "Refine the few-shot examples to be significantly shorter and punchier, and explicitly instruct the model to strictly entail the source text while absolutely forbidding hallucinated extrapolations.", "hypothesis_source": "agent", "mutation_diff_summary": "", "score": 2.7, "score_ci_lower": 2.1, "score_ci_upper": 3.4, "raw_scores": [3.0, 2.0, 4.0, 2.5, 2.0], "baseline_score": 3.7, "outcome": "DISCARDED", "failure_mode": null, "duration_seconds": 62.47296820906922, "tags": ["prompt-engineering", "few-shot-optimization", "strict-entailment", "conciseness"], "learnings": "{\"what_changed\":\"\",\"what_improved\":[],\"what_regressed\":[],\"transferable_insight\":\"Overly compressing reference examples while simultaneously enforcing strict negative constraints degrades performance by depriving the system of the context needed to properly apply those constraints.\",\"domain_tags\":[\"Prompt Engineering\",\"Few-Shot Learning\",\"Constraint Satisfaction\"]}", "cost_usd": 0.01073875, "bootstrap_seed": 0, "agent_model": "gemini-3.1-pro-preview", "held_out_score": null, "criterion_names": ["key_points_captured", "conciseness", "faithful_to_source", "few_shot_format"], "per_criterion_scores": {"key_points_captured": 1.0, "conciseness": 1.0, "faithful_to_source": 0.4, "few_shot_format": 0.3}, "failure_classification": {"category": "semantic_drift", "description": "The experiment aimed to prevent hallucination and enforce strict entailment by refining few-shot examples and adding explicit instructions. The low score (2.7) strongly indicates that despite these efforts, the model still failed to produce output that strictly entailed the source text, likely generating content with incorrect meaning or unwarranted extrapolations (hallucinations). The meaning of the output 'drifted' from the intended accurate representation of the source.", "fix_direction": "Instead of merely shortening examples and explicitly forbidding undesired behavior, focus on making the semantic boundaries extremely clear. This could involve providing a mix of positive examples (demonstrating strict entailment) and negative examples (showing what constitutes hallucination or extrapolation) with explicit explanations for both. Experiment with different phrasing for the instructions to emphasize fidelity and verify if the chosen model is capable of such nuanced semantic control.", "confidence": 0.9}, "drafts_generated": 1, "drafts_survived": 1}
{"id": "d0e4e4f6-759f-4182-89fc-491ea7ac1c44", "target_id": "B2-greedy", "git_sha": "4aa393dc8fd3b4f08fcc9eb825917f26c9f26904", "pre_experiment_sha": "4aa393dc8fd3b4f08fcc9eb825917f26c9f26904", "timestamp": "2026-04-24T02:37:08.479844+00:00", "hypothesis": "Make the system instructions forbid hallucinations and mandate strict entailment, and shorten the few-shot examples to be extremely concise and punchy without altering the final appended structure.", "hypothesis_source": "agent", "mutation_diff_summary": "", "score": 1.9, "score_ci_lower": 1.7, "score_ci_upper": 2.0, "raw_scores": [2.0, 2.0, 2.0, 2.0, 1.5], "baseline_score": 3.7, "outcome": "DISCARDED", "failure_mode": null, "duration_seconds": 66.83915891707875, "tags": ["entailment", "conciseness", "few-shot-refinement"], "learnings": "{\"what_changed\":\"\",\"what_improved\":[],\"what_regressed\":[],\"transferable_insight\":\"Pairing strict operational constraints with overly concise examples degrades performance, as complex rules often require detailed demonstrations to be executed correctly.\",\"domain_tags\":[\"Prompt Engineering\",\"Few-Shot Prompting\",\"Constraint Satisfaction\"]}", "cost_usd": 0.009317, "bootstrap_seed": 0, "agent_model": "gemini-3.1-pro-preview", "held_out_score": null, "criterion_names": ["key_points_captured", "conciseness", "faithful_to_source", "few_shot_format"], "per_criterion_scores": {"key_points_captured": 0.9, "conciseness": 1.0, "faithful_to_source": 0.0, "few_shot_format": 0.0}, "failure_classification": {"category": "output_format", "description": "The drastic shortening of few-shot examples, even with the intent to preserve the final appended structure, likely removed crucial implicit or explicit guidance the model needed to consistently produce outputs in the correct format. This would result in structural violations, making many outputs unparseable or incorrectly structured, thus leading to the extremely low score. While the instructions for strict entailment and forbidding hallucinations aim for content quality, a foundational breakdown in output format is a more direct explanation for such a severe score drop.", "fix_direction": "Reintroduce more detail or specific examples that strongly emphasize the required output structure within the few-shot examples. It may be necessary to find a balance between conciseness and clarity regarding the output format. Consider explicitly calling out or formatting the structural elements in the examples to guide the model more effectively.", "confidence": 0.9}, "drafts_generated": 1, "drafts_survived": 1}
{"id": "1edc48b9-e82d-40e0-b116-aca9e8c7080c", "target_id": "B2-greedy", "git_sha": "4aa393dc8fd3b4f08fcc9eb825917f26c9f26904", "pre_experiment_sha": "4aa393dc8fd3b4f08fcc9eb825917f26c9f26904", "timestamp": "2026-04-24T02:38:41.663442+00:00", "hypothesis": "Gently reinforce strict factual accuracy in the instructions and slightly streamline the few-shot summaries for better conciseness without drastically altering their structure.", "hypothesis_source": "agent", "mutation_diff_summary": "", "score": 2.6, "score_ci_lower": 2.0, "score_ci_upper": 3.4, "raw_scores": [2.0, 3.0, 4.0, 2.0, 2.0], "baseline_score": 3.7, "outcome": "DISCARDED", "failure_mode": null, "duration_seconds": 58.447419540956616, "tags": ["conciseness", "strict-entailment", "minor-edits"], "learnings": "{\"what_changed\":\"\",\"what_improved\":[],\"what_regressed\":[],\"transferable_insight\":\"Simultaneously enforcing strict factual accuracy and streamlining few-shot examples for conciseness can degrade performance by creating conflicting constraints or removing necessary contextual cues.\",\"domain_tags\":[\"Prompt Engineering\",\"Few-Shot Prompting\",\"Constraint Management\"]}", "cost_usd": 0.01086285, "bootstrap_seed": 0, "agent_model": "gemini-3.1-pro-preview", "held_out_score": null, "criterion_names": ["key_points_captured", "conciseness", "faithful_to_source", "few_shot_format"], "per_criterion_scores": {"key_points_captured": 1.0, "conciseness": 1.0, "faithful_to_source": 0.4, "few_shot_format": 0.2}, "failure_classification": {"category": "semantic_drift", "description": "The experiment's hypothesis focused on improving factual accuracy and conciseness. A score of 2.6 suggests a significant negative impact. This implies that while the output format might have been maintained, the meaning was compromised. This could manifest as the summaries becoming factually incorrect despite the 'reinforcement' attempt, or the streamlining leading to a loss of critical information, misinterpretation, or a shift to an unintended meaning, thus degrading the overall quality and usefulness of the output.", "fix_direction": "1. **Strengthen Factual Accuracy Enforcement**: Re-evaluate the 'gentle' aspect of reinforcement. The current method might be insufficient to prevent factual errors or misinterpretations. Consider more explicit constraints, stricter examples, or negative examples that highlight common inaccuracies. 2. **Refine Conciseness Balance**: The streamlining might have been too aggressive, leading to the removal of essential context or key facts, which in turn causes semantic drift. Test different levels of conciseness, perhaps prioritizing key entity extraction and factual statements over general brevity. 3. **Isolate or Prioritize Goals**: It's possible the two goals (accuracy and conciseness) conflicted. Experiment with prioritizing factual accuracy first, then iterating on conciseness, or vice versa, to understand which aspect primarily caused the drift.", "confidence": 0.95}, "drafts_generated": 1, "drafts_survived": 1}
{"id": "f859750c-9d56-4a2f-8580-d49be137a97d", "target_id": "B2-greedy", "git_sha": "4aa393dc8fd3b4f08fcc9eb825917f26c9f26904", "pre_experiment_sha": "4aa393dc8fd3b4f08fcc9eb825917f26c9f26904", "timestamp": "2026-04-24T02:40:04.109015+00:00", "hypothesis": "Gently reinforce strict entailment in the system prompt and make subtle, incremental improvements to the conciseness of the few-shot examples to boost the binary criteria score.", "hypothesis_source": "agent", "mutation_diff_summary": "", "score": 3.2, "score_ci_lower": 2.6, "score_ci_upper": 3.8, "raw_scores": [3.0, 3.0, 2.0, 4.0, 4.0], "baseline_score": 3.7, "outcome": "DISCARDED", "failure_mode": null, "duration_seconds": 64.82057954207994, "tags": ["conciseness", "entailment", "few-shot"], "learnings": "{\"what_changed\":\"\",\"what_improved\":[],\"what_regressed\":[],\"transferable_insight\":\"Making subtle, incremental reductions to the detail of examples while enforcing strict logical constraints can degrade performance, indicating that strict criteria require fully articulated context rather than overly concise demonstrations.\",\"domain_tags\":[\"Prompt Engineering\",\"Few-Shot Prompting\",\"Constraint Enforcement\"]}", "cost_usd": 0.01190995, "bootstrap_seed": 0, "agent_model": "gemini-3.1-pro-preview", "held_out_score": null, "criterion_names": ["key_points_captured", "conciseness", "faithful_to_source", "few_shot_format"], "per_criterion_scores": {"key_points_captured": 1.0, "conciseness": 1.0, "faithful_to_source": 0.8, "few_shot_format": 0.4}, "failure_classification": {"category": "semantic_drift", "description": "The experiment aimed to improve the model's adherence to strict entailment and clarify few-shot examples. However, the significantly low score (3.2000) indicates that these efforts were ineffective, or even detrimental. The model's outputs, while potentially syntactically correct, frequently made incorrect judgments on the binary criteria, suggesting a fundamental misinterpretation or 'drift' from the intended meaning of entailment and the task's objectives. The 'gentle' reinforcement may have been too subtle, or the increased conciseness in few-shot examples inadvertently removed critical context needed for correct semantic understanding.", "fix_direction": "Instead of 'gentle' reinforcement, make the strict entailment instructions in the system prompt much more explicit and forceful. Consider providing a wider range of few-shot examples, including clear negative examples or 'non-entailment' cases. Evaluate the conciseness of examples not just for brevity, but for absolute clarity and non-ambiguity. Experiment with Chain-of-Thought (CoT) or other reasoning prompting techniques to guide the model's semantic interpretation and ensure it explicitly processes the entailment logic before making a binary decision.", "confidence": 0.9}, "drafts_generated": 1, "drafts_survived": 1}
