{"id": "5a0341f3-6eb3-4dad-b1f1-15fdd37a04bf", "target_id": "B2-greedy", "git_sha": "45536ce9d960aab9871453e2ff2ad0c3c6b670c7", "pre_experiment_sha": "45536ce9d960aab9871453e2ff2ad0c3c6b670c7", "timestamp": "2026-04-19T07:53:32.969493+00:00", "hypothesis": "A tiny wording change emphasizing concise, factual 2\u20134 sentence summaries focused only on main points will improve compliance.", "hypothesis_source": "agent", "mutation_diff_summary": "", "score": 1.8, "score_ci_lower": 1.2, "score_ci_upper": 2.7, "raw_scores": [1.5, 1.0, 1.5, 1.5, 3.5], "baseline_score": 2.7, "outcome": "DISCARDED", "failure_mode": null, "duration_seconds": 18.13207362499088, "tags": ["clarity", "conciseness", "factuality"], "learnings": "{\"what_changed\":\"\",\"what_improved\":[],\"what_regressed\":[],\"transferable_insight\":\"Clear, narrowly scoped instructions that specify both the desired length and the exact content focus can materially improve compliance, even when the wording change is small.\",\"domain_tags\":[\"instruction_design\",\"communication\",\"behavioral_experiment\"]}", "cost_usd": 0.02336515, "bootstrap_seed": 0, "agent_model": "gpt-5.4", "held_out_score": null, "criterion_names": ["key_points_captured", "conciseness", "faithful_to_source", "few_shot_format"], "per_criterion_scores": {"key_points_captured": 1.0, "conciseness": 0.4, "faithful_to_source": 0.3, "few_shot_format": 0.1}, "failure_classification": {"category": "semantic_drift", "description": "The experiment attempted a wording change intended to improve concise factual summaries, but the low score suggests the output likely retained the required format while shifting meaning or failing to emphasize only the main points, resulting in incorrect or less compliant content.", "fix_direction": "Test tighter 2\u20134 sentence summaries that explicitly remove secondary details, ensure factual claims remain accurate, and verify that the edited wording does not alter the underlying meaning or add/remove constraints outside the hypothesis intent.", "confidence": 0.62}, "drafts_generated": 1, "drafts_survived": 1}
{"id": "75e1f35c-f551-4581-a5bf-ba56614fb067", "target_id": "B2-greedy", "git_sha": "45536ce9d960aab9871453e2ff2ad0c3c6b670c7", "pre_experiment_sha": "45536ce9d960aab9871453e2ff2ad0c3c6b670c7", "timestamp": "2026-04-19T07:53:54.767509+00:00", "hypothesis": "A tiny wording tweak emphasizing a concise, factual 2\u20134 sentence summary and explicitly excluding minor details and speculation will improve adherence.", "hypothesis_source": "agent", "mutation_diff_summary": "", "score": 1.6, "score_ci_lower": 1.2, "score_ci_upper": 2.1, "raw_scores": [1.5, 1.5, 2.5, 1.5, 1.0], "baseline_score": 2.7, "outcome": "DISCARDED", "failure_mode": null, "duration_seconds": 18.731523958966136, "tags": ["clarity", "conciseness", "summarization"], "learnings": "{\"what_changed\":\"\",\"what_improved\":[],\"what_regressed\":[],\"transferable_insight\":\"Explicitly constraining the desired output to a short, factual summary while excluding minor details and speculation can improve compliance with the requested format.\",\"domain_tags\":[\"prompting\",\"instruction-design\",\"communication\"]}", "cost_usd": 0.024153149999999998, "bootstrap_seed": 0, "agent_model": "gpt-5.4", "held_out_score": null, "criterion_names": ["key_points_captured", "conciseness", "faithful_to_source", "few_shot_format"], "per_criterion_scores": {"key_points_captured": 0.8, "conciseness": 0.5, "faithful_to_source": 0.3, "few_shot_format": 0.0}, "failure_classification": {"category": "semantic_drift", "description": "The experiment\u2019s intent was a concise, factual 2\u20134 sentence summary with an explicit exclusion of minor details and speculation, but the result scored very low (1.6), indicating the output likely did not preserve the required meaning/constraints and instead included disallowed details or softened the factual/exclusion emphasis.", "fix_direction": "Re-center the output on a strict 2\u20134 sentence factual summary and add an explicit constraint like \u201cNo minor details or speculation.\u201d Ensure any omitted context is not reintroduced implicitly.", "confidence": 0.36}, "drafts_generated": 1, "drafts_survived": 1}
{"id": "4e224b47-0f36-455b-85d3-f86b2d6b9a8a", "target_id": "B2-greedy", "git_sha": "45536ce9d960aab9871453e2ff2ad0c3c6b670c7", "pre_experiment_sha": "45536ce9d960aab9871453e2ff2ad0c3c6b670c7", "timestamp": "2026-04-19T07:54:18.794931+00:00", "hypothesis": "A tiny wording change emphasizing a concise, factual 2\u20134 sentence summary of only the main points and explicitly excluding minor details and speculation will improve adherence.", "hypothesis_source": "agent", "mutation_diff_summary": "", "score": 1.7, "score_ci_lower": 1.0, "score_ci_upper": 2.9, "raw_scores": [1.0, 1.5, 4.0, 1.0, 1.0], "baseline_score": 2.7, "outcome": "DISCARDED", "failure_mode": null, "duration_seconds": 19.297103250049986, "tags": ["clarity", "conciseness", "anti-speculation"], "learnings": "{\"what_changed\":\"\",\"what_improved\":[],\"what_regressed\":[],\"transferable_insight\":\"Making instructions more explicit about scope, brevity, and what to exclude can improve compliance with the desired output format, but overly narrow wording may also reduce usefulness or be discarded if it conflicts with user intent.\",\"domain_tags\":[\"instruction-design\",\"communication\",\"evaluation\"]}", "cost_usd": 0.022537750000000002, "bootstrap_seed": 0, "agent_model": "gpt-5.4", "held_out_score": null, "criterion_names": ["key_points_captured", "conciseness", "faithful_to_source", "few_shot_format"], "per_criterion_scores": {"key_points_captured": 0.7, "conciseness": 0.6, "faithful_to_source": 0.2, "few_shot_format": 0.2}, "failure_classification": {"category": "semantic_drift", "description": "A tiny wording change was intended to improve adherence by making the output more concise and factual, but the result likely changed meaning or introduced/retained minor details or speculation\u2014i.e., the output still didn\u2019t match the intended \u201conly main points, explicitly excluding minor details and speculation\u201d constraint.", "fix_direction": "Focus on enforcing the exact content policy in the 2\u20134 sentence summary: include only main points, remove all minor details, and explicitly avoid any speculation or interpretive language; verify against the target constraints rather than only phrasing brevity.", "confidence": 0.42}, "drafts_generated": 1, "drafts_survived": 1}
{"id": "8e4e0ee7-27e7-4e3c-9e85-33ade72690a0", "target_id": "B2-greedy", "git_sha": "45536ce9d960aab9871453e2ff2ad0c3c6b670c7", "pre_experiment_sha": "45536ce9d960aab9871453e2ff2ad0c3c6b670c7", "timestamp": "2026-04-19T07:54:40.135429+00:00", "hypothesis": "A tiny wording tweak emphasizing concise, factual 2\u20134 sentence main-point summaries and explicitly excluding minor details and speculation will improve adherence.", "hypothesis_source": "agent", "mutation_diff_summary": "", "score": 1.6, "score_ci_lower": 1.1, "score_ci_upper": 2.1, "raw_scores": [2.5, 1.0, 2.0, 1.0, 1.5], "baseline_score": 2.7, "outcome": "DISCARDED", "failure_mode": null, "duration_seconds": 18.182852334110066, "tags": ["clarity", "conciseness", "format-preserving"], "learnings": "{\"what_changed\":\"\",\"what_improved\":[],\"what_regressed\":[],\"transferable_insight\":\"Making instructions more specific about the desired level of detail and explicitly excluding low-value content can improve compliance, but overly narrow wording changes may still fail if they do not align with how people naturally interpret the task.\",\"domain_tags\":[\"instruction_design\",\"communication\",\"behavior_change\"]}", "cost_usd": 0.02463715, "bootstrap_seed": 0, "agent_model": "gpt-5.4", "held_out_score": null, "criterion_names": ["key_points_captured", "conciseness", "faithful_to_source", "few_shot_format"], "per_criterion_scores": {"key_points_captured": 0.8, "conciseness": 0.3, "faithful_to_source": 0.3, "few_shot_format": 0.2}, "failure_classification": {"category": "semantic_drift", "description": "The change likely resulted in summaries that were still structured correctly but no longer matched the intended meaning of the hypothesis\u2014i.e., the wording tweak emphasized brevity and exclusion of minor details/speculation, yet the produced output deviated in intent or content from what was required.", "fix_direction": "Keep the wording constraint strictly tied to the hypothesis (2\u20134 sentences, factual main point only) and explicitly remove/avoid any qualifiers, minor details, and speculation that could alter meaning; validate the semantic alignment against the original requirements.", "confidence": 0.46}, "drafts_generated": 1, "drafts_survived": 1}
{"id": "164bd0db-f6d7-4a7b-aad0-0c8eeab6af99", "target_id": "B2-greedy", "git_sha": "45536ce9d960aab9871453e2ff2ad0c3c6b670c7", "pre_experiment_sha": "45536ce9d960aab9871453e2ff2ad0c3c6b670c7", "timestamp": "2026-04-19T07:54:59.012299+00:00", "hypothesis": "A tiny wording change emphasizing a concise, factual 2\u20134 sentence summary of only the main points and explicitly omitting minor details/speculation will improve compliance.", "hypothesis_source": "agent", "mutation_diff_summary": "", "score": 2.1, "score_ci_lower": 1.6, "score_ci_upper": 2.6, "raw_scores": [1.5, 1.5, 2.0, 2.5, 3.0], "baseline_score": 2.7, "outcome": "DISCARDED", "failure_mode": null, "duration_seconds": 16.434147124993615, "tags": ["clarity", "concision", "constraint"], "learnings": "{\"what_changed\":\"\",\"what_improved\":[],\"what_regressed\":[],\"transferable_insight\":\"Explicitly constraining the response to a short, factual summary of only the main points can improve compliance by reducing ambiguity and discouraging unnecessary detail or speculation.\",\"domain_tags\":[\"prompting\",\"instruction-design\",\"communication\"]}", "cost_usd": 0.02355495, "bootstrap_seed": 0, "agent_model": "gpt-5.4", "held_out_score": null, "criterion_names": ["key_points_captured", "conciseness", "faithful_to_source", "few_shot_format"], "per_criterion_scores": {"key_points_captured": 1.0, "conciseness": 0.7, "faithful_to_source": 0.3, "few_shot_format": 0.1}, "failure_classification": {"category": "semantic_drift", "description": "The attempt likely followed the requested emphasis on brevity/factual summary but ended up changing the meaning\u2014either by including minor/speculative details, omitting an important main point, or not accurately representing the original content despite maintaining a similar format.", "fix_direction": "Keep the edit strictly within wording: only condense to 2\u20134 factual sentences covering the same main points, explicitly exclude minor details/speculation, and verify that the key claims remain unchanged relative to the source.", "confidence": 0.62}, "drafts_generated": 1, "drafts_survived": 1}
{"id": "75f8d41f-9c8a-4ecd-8708-7eaa47d19863", "target_id": "B2-greedy", "git_sha": "45536ce9d960aab9871453e2ff2ad0c3c6b670c7", "pre_experiment_sha": "45536ce9d960aab9871453e2ff2ad0c3c6b670c7", "timestamp": "2026-04-19T07:55:20.429813+00:00", "hypothesis": "A tiny wording change emphasizing a concise, factual 2\u20134 sentence summary of only main points and explicitly excluding minor details and speculation will improve adherence.", "hypothesis_source": "agent", "mutation_diff_summary": "", "score": 2.0, "score_ci_lower": 1.3, "score_ci_upper": 2.7, "raw_scores": [1.0, 3.0, 1.5, 1.5, 3.0], "baseline_score": 2.7, "outcome": "DISCARDED", "failure_mode": null, "duration_seconds": 17.04795854189433, "tags": ["clarity", "conciseness", "faithfulness"], "learnings": "{\"what_changed\":\"\",\"what_improved\":[],\"what_regressed\":[],\"transferable_insight\":\"Making instructions more explicit and narrowly scoped does not guarantee better compliance if the added constraints reduce flexibility without clarifying the core task enough to change behavior.\",\"domain_tags\":[\"instruction-design\",\"behavioral-compliance\",\"experimentation\"]}", "cost_usd": 0.023015550000000003, "bootstrap_seed": 0, "agent_model": "gpt-5.4", "held_out_score": null, "criterion_names": ["key_points_captured", "conciseness", "faithful_to_source", "few_shot_format"], "per_criterion_scores": {"key_points_captured": 1.0, "conciseness": 0.4, "faithful_to_source": 0.4, "few_shot_format": 0.2}, "failure_classification": {"category": "incomplete_edit", "description": "The experiment\u2019s stated goal is a very specific wording/format constraint (a concise, factual 2\u20134 sentence summary excluding minor details and speculation), but the result score indicates the change was not fully realized or left the output in an inconsistent state relative to that requirement.", "fix_direction": "Ensure the revised wording fully enforces exactly 2\u20134 sentences focused only on main points, with explicit suppression of minor details/speculation, and verify the final output adheres to the expected format end-to-end.", "confidence": 0.42}, "drafts_generated": 1, "drafts_survived": 1}
{"id": "22831a78-b3e3-4039-94c9-0cab7c48bce1", "target_id": "B2-greedy", "git_sha": "45536ce9d960aab9871453e2ff2ad0c3c6b670c7", "pre_experiment_sha": "45536ce9d960aab9871453e2ff2ad0c3c6b670c7", "timestamp": "2026-04-19T07:55:43.690634+00:00", "hypothesis": "A tiny wording change emphasizing a concise, factual 2\u20134 sentence summary of only main points and explicitly omitting minor details and speculation will improve compliance.", "hypothesis_source": "agent", "mutation_diff_summary": "", "score": 2.2, "score_ci_lower": 2.0, "score_ci_upper": 2.4, "raw_scores": [2.0, 2.5, 2.0, 2.0, 2.5], "baseline_score": 2.7, "outcome": "DISCARDED", "failure_mode": null, "duration_seconds": 20.421678000013344, "tags": ["clarity", "conciseness", "factuality"], "learnings": "{\"what_changed\":\"\",\"what_improved\":[],\"what_regressed\":[],\"transferable_insight\":\"Explicitly constraining the desired output to a short, factual summary of only the main points can improve compliance by reducing ambiguity and discouraging unnecessary detail or speculation.\",\"domain_tags\":[\"prompting\",\"instruction-design\",\"communication\"]}", "cost_usd": 0.02403375, "bootstrap_seed": 0, "agent_model": "gpt-5.4", "held_out_score": null, "criterion_names": ["key_points_captured", "conciseness", "faithful_to_source", "few_shot_format"], "per_criterion_scores": {"key_points_captured": 1.0, "conciseness": 0.6, "faithful_to_source": 0.6, "few_shot_format": 0.0}, "failure_classification": {"category": "semantic_drift", "description": "The attempt did not achieve the intended effect of a concise, factual 2\u20134 sentence summary that excludes minor details and speculation; instead, the output likely retained incorrect emphasis or introduced/kept content that contradicted the meaning of the hypothesis (e.g., including extra details, ambiguity, or speculative language).", "fix_direction": "Ensure the revision strictly constrains content to only the main points in 2\u20134 sentences, removes minor details, and eliminates speculation; then verify the output matches the intended wording and meaning rather than only format.", "confidence": 0.42}, "drafts_generated": 1, "drafts_survived": 1}
{"id": "1647bd7b-48d3-41ab-8899-940dcd8d756e", "target_id": "B2-greedy", "git_sha": "45536ce9d960aab9871453e2ff2ad0c3c6b670c7", "pre_experiment_sha": "45536ce9d960aab9871453e2ff2ad0c3c6b670c7", "timestamp": "2026-04-19T07:56:02.880807+00:00", "hypothesis": "A tiny wording tweak emphasizing a concise, factual 2\u20134 sentence summary focused only on main points and excluding minor details or speculation will improve adherence.", "hypothesis_source": "agent", "mutation_diff_summary": "", "score": 1.7, "score_ci_lower": 1.1, "score_ci_upper": 2.4, "raw_scores": [1.0, 1.0, 3.0, 1.5, 2.0], "baseline_score": 2.7, "outcome": "DISCARDED", "failure_mode": null, "duration_seconds": 16.716973458998837, "tags": ["clarity", "conciseness", "anti-speculation"], "learnings": "{\"what_changed\":\"\",\"what_improved\":[],\"what_regressed\":[],\"transferable_insight\":\"Explicitly narrowing the scope and format of a task can improve compliance, but if the instruction is too restrictive or redundant it may be ignored or fail to change behavior.\",\"domain_tags\":[\"instruction-design\",\"behavior-change\"]}", "cost_usd": 0.023614549999999998, "bootstrap_seed": 0, "agent_model": "gpt-5.4", "held_out_score": null, "criterion_names": ["key_points_captured", "conciseness", "faithful_to_source", "few_shot_format"], "per_criterion_scores": {"key_points_captured": 0.9, "conciseness": 0.5, "faithful_to_source": 0.3, "few_shot_format": 0.0}, "failure_classification": {"category": "incomplete_edit", "description": "The attempted change did not fully/consistently realize the intended wording tweak (2\u20134 sentence concise factual summary) and the result likely left an incomplete or partially implemented update, leading to failure.", "fix_direction": "Ensure the edit is fully applied across the output: constrain to exactly 2\u20134 sentences, keep only main factual points, and remove minor details/speculation; verify no leftover earlier wording or structure remnants remain.", "confidence": 0.38}, "drafts_generated": 1, "drafts_survived": 1}
{"id": "defbf770-7050-4a46-9742-0366dac81cce", "target_id": "B2-greedy", "git_sha": "45536ce9d960aab9871453e2ff2ad0c3c6b670c7", "pre_experiment_sha": "45536ce9d960aab9871453e2ff2ad0c3c6b670c7", "timestamp": "2026-04-19T07:56:26.455359+00:00", "hypothesis": "A tiny wording tweak emphasizing a concise, factual 2\u20134 sentence summary of only the main points, with an explicit rule to omit minor details and speculation, will improve adherence.", "hypothesis_source": "agent", "mutation_diff_summary": "", "score": 1.7, "score_ci_lower": 1.3, "score_ci_upper": 2.0, "raw_scores": [1.0, 2.0, 1.5, 2.0, 2.0], "baseline_score": 2.7, "outcome": "DISCARDED", "failure_mode": null, "duration_seconds": 19.417351917014457, "tags": ["clarity", "concise", "factual", "constraints"], "learnings": "{\"what_changed\":\"\",\"what_improved\":[],\"what_regressed\":[],\"transferable_insight\":\"Making brevity and exclusion criteria explicit can improve compliance with summary instructions by reducing ambiguity about what to include.\",\"domain_tags\":[\"instruction-design\",\"communication\",\"behavioral-design\"]}", "cost_usd": 0.024416950000000003, "bootstrap_seed": 0, "agent_model": "gpt-5.4", "held_out_score": null, "criterion_names": ["key_points_captured", "conciseness", "faithful_to_source", "few_shot_format"], "per_criterion_scores": {"key_points_captured": 1.0, "conciseness": 0.3, "faithful_to_source": 0.4, "few_shot_format": 0.0}, "failure_classification": {"category": "incomplete_edit", "description": "The change intended to enforce a concise 2\u20134 sentence main-points-only summary did not fully propagate through the response, leaving inconsistent or incomplete adherence to the intended omission rule (minor details/speculation were not consistently excluded).", "fix_direction": "Ensure the output-writing step has a single, explicit constraint that forces exactly 2\u20134 sentences covering only main points, with an explicit negative rule to exclude minor details and speculation, and add a final self-check against these constraints before returning.", "confidence": 0.62}, "drafts_generated": 1, "drafts_survived": 1}
{"id": "5c71cb2d-de74-4521-9b54-3cf3edebf995", "target_id": "B2-greedy", "git_sha": "45536ce9d960aab9871453e2ff2ad0c3c6b670c7", "pre_experiment_sha": "45536ce9d960aab9871453e2ff2ad0c3c6b670c7", "timestamp": "2026-04-19T07:56:48.619871+00:00", "hypothesis": "A tiny wording tweak emphasizing concise, factual 2\u20134 sentence summaries focused only on main points will improve adherence.", "hypothesis_source": "agent", "mutation_diff_summary": "", "score": 2.5, "score_ci_lower": 2.1, "score_ci_upper": 2.9, "raw_scores": [2.0, 2.0, 3.0, 2.5, 3.0], "baseline_score": 2.7, "outcome": "DISCARDED", "failure_mode": null, "duration_seconds": 19.694500124896877, "tags": ["clarity", "conciseness", "anti-speculation"], "learnings": "{\"what_changed\":\"\",\"what_improved\":[],\"what_regressed\":[],\"transferable_insight\":\"Clear, narrowly scoped instructions that specify both length and content focus can improve compliance, but if they are too subtle or redundant they may have no measurable effect.\",\"domain_tags\":[\"instruction-design\",\"communication\",\"behavior-change\"]}", "cost_usd": 0.025300950000000003, "bootstrap_seed": 0, "agent_model": "gpt-5.4", "held_out_score": null, "criterion_names": ["key_points_captured", "conciseness", "faithful_to_source", "few_shot_format"], "per_criterion_scores": {"key_points_captured": 0.9, "conciseness": 0.5, "faithful_to_source": 0.8, "few_shot_format": 0.3}, "failure_classification": {"category": "incomplete_edit", "description": "The attempted change appears to have been partially applied: the experiment failed with an unknown failure mode and a middling score (2.5), suggesting the output may not have been consistently updated (e.g., not fully converted to the targeted concise 2\u20134 sentence factual summary format) or left an inconsistent state relative to the expected structure/constraints.", "fix_direction": "Ensure the entire response follows the intended concise 2\u20134 sentence factual summary wording everywhere (no partial sections), and verify adherence to any required schema/format before evaluation.", "confidence": 0.42}, "drafts_generated": 1, "drafts_survived": 1}
