{"id": "54e6cb8d-5780-4663-8af3-f0259ce26321", "target_id": "B2-greedy", "git_sha": "4aa393dc8fd3b4f08fcc9eb825917f26c9f26904", "pre_experiment_sha": "4aa393dc8fd3b4f08fcc9eb825917f26c9f26904", "timestamp": "2026-04-24T03:31:16.070332+00:00", "hypothesis": "Change the hyphenated noun \"test-takers\" to the standard open compound \"test takers\" to correct orthography without altering vocabulary or meaning.", "hypothesis_source": "agent", "mutation_diff_summary": "", "score": 2.8, "score_ci_lower": 2.2, "score_ci_upper": 3.4, "raw_scores": [3.5, 3.0, 2.0, 2.0, 3.5], "baseline_score": 3.7, "outcome": "DISCARDED", "failure_mode": null, "duration_seconds": 190.93892304203473, "tags": ["orthography", "minimal-change"], "learnings": "{\"what_changed\":\"\",\"what_improved\":[],\"what_regressed\":[],\"transferable_insight\":\"Removing hyphens from established compound nouns to create open compounds can degrade performance by disrupting tokenization or exact phrase matching.\",\"domain_tags\":[\"Orthography\",\"Tokenization\",\"Text Normalization\"]}", "cost_usd": 0.011799800000000003, "bootstrap_seed": 0, "agent_model": "gemini-3.1-pro-preview", "held_out_score": null, "criterion_names": ["key_points_captured", "conciseness", "faithful_to_source", "few_shot_format"], "per_criterion_scores": {"key_points_captured": 1.0, "conciseness": 1.0, "faithful_to_source": 0.6, "few_shot_format": 0.2}, "failure_classification": {"category": "semantic_drift", "description": "The experiment aimed to correct orthography by changing 'test-takers' to 'test takers' without altering meaning. However, hyphenation in compound words can carry subtle semantic distinctions or clarify grammatical grouping, especially when used attributively (e.g., 'test-taker scores' vs. 'test taker scores'). It's highly probable that removing the hyphen, while seemingly a minor orthographic change, introduced ambiguity or altered the intended semantic grouping or clarity in specific contexts, leading to a degraded score (2.8000). The 'standard open compound' might not have been appropriate for all instances where 'test-takers' was used, causing an unintended change in meaning or interpretation.", "fix_direction": "Refine the orthography correction logic to consider the *context* and *grammatical role* of compound nouns and adjectives. Implement a more nuanced understanding of hyphenation rules based on established style guides (e.g., AP, Chicago) and the specific function of the compound in a sentence. Prioritize semantic preservation and clarity, ensuring that orthographic changes do not introduce ambiguity or alter the intended meaning or grouping of words.", "confidence": 0.9}, "drafts_generated": 1, "drafts_survived": 1}
{"id": "eb051c23-15fc-4d51-b076-67f5b4204b5c", "target_id": "B2-greedy", "git_sha": "4aa393dc8fd3b4f08fcc9eb825917f26c9f26904", "pre_experiment_sha": "4aa393dc8fd3b4f08fcc9eb825917f26c9f26904", "timestamp": "2026-04-24T03:33:09.062168+00:00", "hypothesis": "Expanding \"2.5\u00b0C\" to \"2.5 degrees Celsius\" in the third example summary aligns the unit formatting exactly with the source article, encouraging the model to be more extractive and faithful to the source text.", "hypothesis_source": "agent", "mutation_diff_summary": "", "score": 2.9, "score_ci_lower": 2.2, "score_ci_upper": 3.6, "raw_scores": [2.0, 3.0, 3.5, 2.0, 4.0], "baseline_score": 3.7, "outcome": "DISCARDED", "failure_mode": null, "duration_seconds": 83.51168566709384, "tags": ["few-shot-modification", "formatting", "alignment"], "learnings": "{\"what_changed\":\"\",\"what_improved\":[],\"what_regressed\":[],\"transferable_insight\":\"Aligning minor formatting details, such as expanding unit abbreviations to exactly match the source text in few-shot examples, can degrade performance rather than improving extractiveness.\",\"domain_tags\":[\"Prompt Engineering\",\"Few-Shot Learning\",\"Formatting\"]}", "cost_usd": 0.01218865, "bootstrap_seed": 0, "agent_model": "gemini-3.1-pro-preview", "held_out_score": null, "criterion_names": ["key_points_captured", "conciseness", "faithful_to_source", "few_shot_format"], "per_criterion_scores": {"key_points_captured": 1.0, "conciseness": 1.0, "faithful_to_source": 0.6, "few_shot_format": 0.3}, "failure_classification": {"category": "output_format", "description": "The experiment failed to align the model's output unit formatting with the source article, despite modifying a few-shot example. The intention was to expand '2.5\u00b0C' to '2.5 degrees Celsius' to encourage exact formatting and improve extractiveness/faithfulness. The low score (2.9000) suggests the model either ignored the example's formatting or continued to produce unit formats inconsistent with the target, failing to achieve the desired output presentation.", "fix_direction": "1. **Explicit Prompting:** Add clear, direct instructions in the prompt specifying the desired unit formatting (e.g., 'Always write temperatures as 'X degrees Celsius').\n2. **Multiple, Consistent Examples:** Provide more diverse few-shot examples that consistently demonstrate the target unit formatting, reinforcing the pattern across different contexts.\n3. **Identify Model's Default Behavior:** Analyze current model outputs to understand what unit formats it defaults to and why it deviates from the target.\n4. **Consider Fine-tuning:** If prompt engineering proves insufficient, explore fine-tuning the model on data with consistent unit formatting to embed the behavior more deeply.", "confidence": 0.95}, "drafts_generated": 1, "drafts_survived": 1}
{"id": "6793ffee-f118-4ec9-85b2-0494b9637627", "target_id": "B2-greedy", "git_sha": "4aa393dc8fd3b4f08fcc9eb825917f26c9f26904", "pre_experiment_sha": "4aa393dc8fd3b4f08fcc9eb825917f26c9f26904", "timestamp": "2026-04-24T03:35:36.729157+00:00", "hypothesis": "Adding the definite article 'the' before 'API' in the first few-shot example improves grammatical correctness, aligning the summary with the source text and encouraging higher-quality model outputs.", "hypothesis_source": "agent", "mutation_diff_summary": "", "score": 2.2, "score_ci_lower": 2.0, "score_ci_upper": 2.6, "raw_scores": [3.0, 2.0, 2.0, 2.0, 2.0], "baseline_score": 3.7, "outcome": "DISCARDED", "failure_mode": null, "duration_seconds": 126.19075408298522, "tags": ["grammar", "few-shot-modification"], "learnings": "{\"what_changed\":\"\",\"what_improved\":[],\"what_regressed\":[],\"transferable_insight\":\"Making minor grammatical corrections, such as adding definite articles, to few-shot examples does not reliably improve overall model performance and may even degrade output quality.\",\"domain_tags\":[\"Prompt Engineering\",\"Few-Shot Prompting\",\"Grammar and Syntax\"]}", "cost_usd": 0.01050505, "bootstrap_seed": 0, "agent_model": "gemini-3.1-pro-preview", "held_out_score": null, "criterion_names": ["key_points_captured", "conciseness", "faithful_to_source", "few_shot_format"], "per_criterion_scores": {"key_points_captured": 1.0, "conciseness": 1.0, "faithful_to_source": 0.2, "few_shot_format": 0.0}, "failure_classification": {"category": "semantic_drift", "description": "The subtle grammatical change of adding 'the' before 'API' in the few-shot example, rather than improving grammatical correctness, appears to have inadvertently caused the model to misinterpret the intended meaning, scope, or specific reference of 'API'. This likely led to summaries that, while potentially having some correct grammatical structures, conveyed a different or inaccurate meaning compared to the source text, thus failing to align and resulting in a very low quality score.", "fix_direction": "Investigate if the definite article created an unintended specificity or generalisation for 'API' in the model's understanding. Future attempts should consider providing a wider variety of few-shot examples for articles or focusing on clarifying the entity's context and scope directly, rather than relying solely on a single article change.", "confidence": 0.85}, "drafts_generated": 1, "drafts_survived": 1}
{"id": "416504cb-e222-40ea-bb5d-fe407f3ba08f", "target_id": "B2-greedy", "git_sha": "4aa393dc8fd3b4f08fcc9eb825917f26c9f26904", "pre_experiment_sha": "4aa393dc8fd3b4f08fcc9eb825917f26c9f26904", "timestamp": "2026-04-24T03:37:55.981422+00:00", "hypothesis": "Abbreviate \"2.5 degrees Celsius\" to \"2.5\u00b0C\" in the third few-shot article to align with the summary text, avoiding the known failure of expanding units while improving consistency.", "hypothesis_source": "agent", "mutation_diff_summary": "", "score": 2.6, "score_ci_lower": 2.1, "score_ci_upper": 3.1, "raw_scores": [3.0, 2.0, 2.0, 3.5, 2.5], "baseline_score": 3.7, "outcome": "DISCARDED", "failure_mode": null, "duration_seconds": 97.07752654096112, "tags": ["abbreviation", "consistency", "formatting"], "learnings": "{\"what_changed\":\"\",\"what_improved\":[],\"what_regressed\":[],\"transferable_insight\":\"Artificially modifying few-shot input examples to match the desired output format can degrade performance by removing the very transformations the model needs to learn.\",\"domain_tags\":[\"Prompt Engineering\",\"Few-Shot Learning\",\"Data Formatting\"]}", "cost_usd": 0.0113632, "bootstrap_seed": 0, "agent_model": "gemini-3.1-pro-preview", "held_out_score": null, "criterion_names": ["key_points_captured", "conciseness", "faithful_to_source", "few_shot_format"], "per_criterion_scores": {"key_points_captured": 1.0, "conciseness": 1.0, "faithful_to_source": 0.5, "few_shot_format": 0.1}, "failure_classification": {"category": "logic_error", "description": "The model failed to correctly apply the specific abbreviation instruction, converting '2.5 degrees Celsius' to '2.5\u00b0C'. Given the hypothesis explicitly mentioned 'avoiding the known failure of expanding units,' it's highly probable the model either failed to make the requested abbreviation, made an incorrect transformation, or even regressed by expanding the unit, demonstrating a failure in adhering to specific transformation logic and constraints.", "fix_direction": "Improve the model's precision in executing specific content transformation rules and adhering to negative constraints (e.g., 'avoiding known failures'). Ensure explicit instructions regarding unit formatting and abbreviation override general tendencies or prior failure modes.", "confidence": 0.9}, "drafts_generated": 1, "drafts_survived": 1}
{"id": "b03386e8-a231-4c14-9c83-7ce0d2371e22", "target_id": "B2-greedy", "git_sha": "4aa393dc8fd3b4f08fcc9eb825917f26c9f26904", "pre_experiment_sha": "4aa393dc8fd3b4f08fcc9eb825917f26c9f26904", "timestamp": "2026-04-24T03:40:43.836153+00:00", "hypothesis": "Replacing the vague determiner \"some\" with the precise numeral \"three\" specifies the exact number of few-shot examples, which can help ground the model's structural expectations without violating any vocabulary, punctuation, or formatting constraints.", "hypothesis_source": "agent", "mutation_diff_summary": "", "score": 3.4, "score_ci_lower": 2.6, "score_ci_upper": 4.0, "raw_scores": [2.0, 4.0, 4.0, 3.0, 4.0], "baseline_score": 3.7, "outcome": "DISCARDED", "failure_mode": null, "duration_seconds": 141.31987066590227, "tags": ["determiner-substitution", "precision-enhancement"], "learnings": "{\"what_changed\":\"\",\"what_improved\":[],\"what_regressed\":[],\"transferable_insight\":\"Replacing vague determiners with precise numerals to quantify the exact number of provided examples can degrade performance, suggesting that overly rigid structural framing interferes with the model's pattern recognition.\",\"domain_tags\":[\"Prompt Engineering\",\"Few-Shot Learning\"]}", "cost_usd": 0.013184650000000001, "bootstrap_seed": 0, "agent_model": "gemini-3.1-pro-preview", "held_out_score": null, "criterion_names": ["key_points_captured", "conciseness", "faithful_to_source", "few_shot_format"], "per_criterion_scores": {"key_points_captured": 1.0, "conciseness": 1.0, "faithful_to_source": 0.8, "few_shot_format": 0.6}, "failure_classification": {"category": "semantic_drift", "description": "The experiment aimed to use a precise numeral ('three') to better ground the model's structural expectations. However, the significantly low score (3.4) suggests that this semantic change had an unintended negative impact. While syntactically correct, the model's interpretation of this strict numerical constraint likely deviated from the desired effect. This could be due to a mismatch between the explicit 'three' and the actual number of examples provided, or because the specificity over-constrained the model, removing a beneficial flexibility that the vague 'some' previously offered, leading to a poorer understanding or execution of the task's structural requirements.", "fix_direction": "Investigate the actual number of few-shot examples provided to the model during the experiment; ensure it precisely matches the numeral 'three' if that is the intent. If it already matches, consider reverting to a vague determiner like 'some' to re-evaluate if the model benefits from greater flexibility. Alternatively, explore different strategies for grounding structural expectations that do not rely on strict numerical counts, or test varying numerical values to find an optimal balance between specificity and flexibility for the model.", "confidence": 0.9}, "drafts_generated": 1, "drafts_survived": 1}
{"id": "62c9bae2-a839-4a0e-a429-b11e4ba98298", "target_id": "B2-greedy", "git_sha": "4aa393dc8fd3b4f08fcc9eb825917f26c9f26904", "pre_experiment_sha": "4aa393dc8fd3b4f08fcc9eb825917f26c9f26904", "timestamp": "2026-04-24T03:45:09.565490+00:00", "hypothesis": "Expanding the reduced relative clause \"facts not present\" to \"facts that are not present\" clarifies the syntactic structure for the model without altering the vocabulary, constraints, or formatting, potentially improving instruction adherence.", "hypothesis_source": "agent", "mutation_diff_summary": "", "score": 2.6, "score_ci_lower": 2.1, "score_ci_upper": 3.1, "raw_scores": [2.0, 3.0, 3.5, 2.0, 2.5], "baseline_score": 3.7, "outcome": "DISCARDED", "failure_mode": null, "duration_seconds": 237.16461883392185, "tags": ["clarity", "grammar", "minimal-mutation"], "learnings": "{\"what_changed\":\"\",\"what_improved\":[],\"what_regressed\":[],\"transferable_insight\":\"Expanding concise phrasing into fully explicit syntactic structures can degrade model performance, indicating that AI models often process reduced, direct instructions more effectively than grammatically expanded equivalents.\",\"domain_tags\":[\"Prompt Engineering\",\"Syntax\",\"Instruction Clarity\"]}", "cost_usd": 0.01085675, "bootstrap_seed": 0, "agent_model": "gemini-3.1-pro-preview", "held_out_score": null, "criterion_names": ["key_points_captured", "conciseness", "faithful_to_source", "few_shot_format"], "per_criterion_scores": {"key_points_captured": 1.0, "conciseness": 1.0, "faithful_to_source": 0.5, "few_shot_format": 0.1}, "failure_classification": {"category": "scope_violation", "description": "The experiment's method of clarifying syntactic structure by expanding \"facts not present\" to \"facts that are not present\" introduced new words (\"that,\" \"are\"). This directly contradicts the hypothesis's stated constraint of \"without altering the vocabulary,\" indicating a violation of the defined scope for the experiment.", "fix_direction": "Future experiments must strictly adhere to all stated constraints, particularly regarding vocabulary. If syntactic clarification is needed, explore methods that genuinely maintain the exact same vocabulary, or explicitly redefine the constraints to allow for specific types of functional word additions.", "confidence": 0.9}, "drafts_generated": 1, "drafts_survived": 1}
{"id": "01ef9405-83e3-453c-87a3-25b54ae83a5c", "target_id": "B2-greedy", "git_sha": "4aa393dc8fd3b4f08fcc9eb825917f26c9f26904", "pre_experiment_sha": "4aa393dc8fd3b4f08fcc9eb825917f26c9f26904", "timestamp": "2026-04-24T03:49:46.483381+00:00", "hypothesis": "Adding single quotation marks around 'external information' emphasizes the negative constraint against hallucinations without violating any vocabulary, structural, or punctuation rules.", "hypothesis_source": "agent", "mutation_diff_summary": "", "score": 3.5, "score_ci_lower": 2.9, "score_ci_upper": 4.0, "raw_scores": [2.5, 3.0, 4.0, 4.0, 4.0], "baseline_score": 3.7, "outcome": "DISCARDED", "failure_mode": null, "duration_seconds": 225.9931401249487, "tags": ["punctuation", "negative-constraint", "minimal-mutation"], "learnings": "{\"what_changed\":\"\",\"what_improved\":[],\"what_regressed\":[],\"transferable_insight\":\"Highlighting specific terms within negative constraints using punctuation like single quotation marks can degrade performance rather than reinforcing the intended restriction.\",\"domain_tags\":[\"Prompt Engineering\",\"Negative Constraints\",\"Formatting\"]}", "cost_usd": 0.01273845, "bootstrap_seed": 0, "agent_model": "gemini-3.1-pro-preview", "held_out_score": null, "criterion_names": ["key_points_captured", "conciseness", "faithful_to_source", "few_shot_format"], "per_criterion_scores": {"key_points_captured": 1.0, "conciseness": 1.0, "faithful_to_source": 0.7, "few_shot_format": 0.8}, "failure_classification": {"category": "semantic_drift", "description": "The experiment's hypothesis proposed that adding single quotation marks would semantically emphasize a negative constraint against hallucinations. However, the resulting score of 3.5 suggests that while the modification did not violate any explicit rules (as per the hypothesis), it failed to convey the intended semantic emphasis or led to an unintended interpretation. The quotes likely conveyed a different meaning (e.g., literal quotation, a placeholder, or ironic distance) rather than the desired 'negative constraint against hallucination', thus failing to achieve the semantic goal despite correct formatting.", "fix_direction": "Future attempts should re-evaluate the linguistic and psychological impact of specific formatting choices (like single quotes) on semantic interpretation. Consider alternative methods for emphasizing negative constraints, such as explicit instructional phrasing, distinct structural elements, or other typographic cues (e.g., bolding, italics) that are more universally understood to convey emphasis or prohibition in the target context. Conduct targeted user studies or controlled A/B tests to measure actual human interpretation of different emphasis strategies.", "confidence": 0.9}, "drafts_generated": 1, "drafts_survived": 1}
