{"id": "7f321a0c-7940-4f15-a4d5-bcd477e92dab", "target_id": "B2-greedy", "git_sha": "6a3c657efc4722ea0d66c503b7ca8c0e2b55a018", "pre_experiment_sha": "6a3c657efc4722ea0d66c503b7ca8c0e2b55a018", "timestamp": "2026-04-19T07:42:48.432507+00:00", "hypothesis": "Clarify brevity and factuality while explicitly telling the model to omit minor details and unsupported speculation.", "hypothesis_source": "agent", "mutation_diff_summary": "", "score": 1.8, "score_ci_lower": 1.3, "score_ci_upper": 2.3, "raw_scores": [1.5, 1.5, 2.5, 2.5, 1.0], "baseline_score": 1.8, "outcome": "DISCARDED", "failure_mode": null, "duration_seconds": 23.31181283306796, "tags": ["clarity", "conciseness", "factuality"], "learnings": "{\"what_changed\":\"\",\"what_improved\":[],\"what_regressed\":[],\"transferable_insight\":\"Instructions that merely ask for brevity and factuality, while also telling the model to omit minor details and avoid unsupported speculation, may not change performance unless they add concrete decision rules or examples.\",\"domain_tags\":[\"prompt-engineering\",\"evaluation\",\"instruction-design\"]}", "cost_usd": 0.023103550000000004, "bootstrap_seed": 0, "agent_model": "gpt-5.4", "held_out_score": null, "criterion_names": ["key_points_captured", "conciseness", "faithful_to_source", "few_shot_format"], "per_criterion_scores": {"key_points_captured": 0.8, "conciseness": 0.4, "faithful_to_source": 0.4, "few_shot_format": 0.2}, "failure_classification": {"category": "incomplete_edit", "description": "The experiment content is only meta-level instructions and classification fields, with no clear indication of a completed output, reasoning, or test result that could match the requested hypothesis/failure mode rubric. This suggests an incomplete or inconsistent edit/state rather than a parse/format/syntax issue or a specific logical error.", "fix_direction": "Ensure the edit produces a complete, self-contained output that directly implements the hypothesis changes (clear brevity/factuality and explicit omission constraints), and verify consistency across all required sections before scoring.", "confidence": 0.62}, "drafts_generated": 1, "drafts_survived": 1}
{"id": "f30616cc-23a4-4558-8502-ae98cd53f533", "target_id": "B2-greedy", "git_sha": "6a3c657efc4722ea0d66c503b7ca8c0e2b55a018", "pre_experiment_sha": "6a3c657efc4722ea0d66c503b7ca8c0e2b55a018", "timestamp": "2026-04-19T07:43:07.969170+00:00", "hypothesis": "Clarifying faithfulness and explicitly excluding minor details will improve concise main-point summaries.", "hypothesis_source": "agent", "mutation_diff_summary": "", "score": 2.1, "score_ci_lower": 1.2, "score_ci_upper": 3.0, "raw_scores": [1.5, 3.0, 3.5, 2.0, 0.5], "baseline_score": 1.8, "outcome": "DISCARDED", "failure_mode": null, "duration_seconds": 16.856304915971123, "tags": ["clarity", "conciseness", "faithfulness"], "learnings": "{\"what_changed\":\"\",\"what_improved\":[],\"what_regressed\":[],\"transferable_insight\":\"Explicitly defining the core objective and excluding low-priority details can improve the clarity and concision of summaries.\",\"domain_tags\":[\"communication\",\"summarization\"]}", "cost_usd": 0.022827950000000007, "bootstrap_seed": 0, "agent_model": "gpt-5.4", "held_out_score": null, "criterion_names": ["key_points_captured", "conciseness", "faithful_to_source", "few_shot_format"], "per_criterion_scores": {"key_points_captured": 0.8, "conciseness": 0.6, "faithful_to_source": 0.5, "few_shot_format": 0.2}, "failure_classification": {"category": "logic_error", "description": "The provided information does not describe the observed failure mode or what specifically went wrong (e.g., format, logic, scope, syntax, or meaning). Only a hypothesis, an 'unknown' failure mode, and a numeric score are given, which is insufficient to map to a concrete category.", "fix_direction": "Capture and compare the expected vs. actual output (format/schema, meaning, constraints/scope), and identify whether the failure was structural, logical, semantic, or due to missing/partial edits.", "confidence": 0.1}, "drafts_generated": 1, "drafts_survived": 1}
{"id": "95852e48-03e1-4729-9105-fd915febb4d3", "target_id": "B2-greedy", "git_sha": "6a3c657efc4722ea0d66c503b7ca8c0e2b55a018", "pre_experiment_sha": "6a3c657efc4722ea0d66c503b7ca8c0e2b55a018", "timestamp": "2026-04-19T07:43:33.098896+00:00", "hypothesis": "Clarify that the summary should be brief, factual, and limited to major points while explicitly excluding minor details and speculation.", "hypothesis_source": "agent", "mutation_diff_summary": "", "score": 1.4, "score_ci_lower": 0.8, "score_ci_upper": 2.0, "raw_scores": [1.5, 1.5, 2.5, 0.5, 1.0], "baseline_score": 1.8, "outcome": "DISCARDED", "failure_mode": null, "duration_seconds": 20.662787416018546, "tags": ["clarity", "conciseness", "factuality"], "learnings": "{\"what_changed\":\"\",\"what_improved\":[],\"what_regressed\":[],\"transferable_insight\":\"When a summary is intended to be brief and factual, explicitly state that it should focus only on major points and exclude minor details and speculation to reduce ambiguity.\",\"domain_tags\":[\"communication\",\"summarization\",\"instruction-design\"]}", "cost_usd": 0.022323750000000003, "bootstrap_seed": 0, "agent_model": "gpt-5.4", "held_out_score": null, "criterion_names": ["key_points_captured", "conciseness", "faithful_to_source", "few_shot_format"], "per_criterion_scores": {"key_points_captured": 0.7, "conciseness": 0.5, "faithful_to_source": 0.2, "few_shot_format": 0.0}, "failure_classification": {"category": "logic_error", "description": "The provided information does not include the actual failed output, error details, or what aspect of the experiment failed. With only a low score (1.4) and no comparison target, the failure mode cannot be mapped to a specific category.", "fix_direction": "Provide the failing experiment\u2019s output, expected output/spec, and any error messages or diffs so the failure can be categorized (e.g., format vs logic vs scope).", "confidence": 0.05}, "drafts_generated": 1, "drafts_survived": 1}
{"id": "f811f4cb-0630-4ec9-a92b-3a9d94829960", "target_id": "B2-greedy", "git_sha": "6a3c657efc4722ea0d66c503b7ca8c0e2b55a018", "pre_experiment_sha": "6a3c657efc4722ea0d66c503b7ca8c0e2b55a018", "timestamp": "2026-04-19T07:43:53.080506+00:00", "hypothesis": "Clarify that the summary should be a brief factual 2\u20134 sentence overview focused on main points while explicitly excluding minor details and speculation.", "hypothesis_source": "agent", "mutation_diff_summary": "", "score": 2.1, "score_ci_lower": 1.4, "score_ci_upper": 3.1, "raw_scores": [1.5, 1.0, 2.0, 2.0, 4.0], "baseline_score": 1.8, "outcome": "DISCARDED", "failure_mode": null, "duration_seconds": 16.132205750094727, "tags": ["clarity", "conciseness", "summarization"], "learnings": "{\"what_changed\":\"\",\"what_improved\":[],\"what_regressed\":[],\"transferable_insight\":\"When defining a summary, explicitly state the desired length, scope, and exclusions so the output stays focused on the main facts and avoids minor details or speculation.\",\"domain_tags\":[\"communication\",\"prompt-design\",\"information-summarization\"]}", "cost_usd": 0.021986150000000003, "bootstrap_seed": 0, "agent_model": "gpt-5.4", "held_out_score": null, "criterion_names": ["key_points_captured", "conciseness", "faithful_to_source", "few_shot_format"], "per_criterion_scores": {"key_points_captured": 1.0, "conciseness": 0.7, "faithful_to_source": 0.2, "few_shot_format": 0.2}, "failure_classification": {"category": "incomplete_edit", "description": "The experiment appears to reference a formatting requirement (2\u20134 sentence factual overview excluding minor details and speculation) but the provided content is insufficient/unclear to confirm the final output meets that structure, suggesting a partial or inconsistent edit rather than a specific logic/syntax issue.", "fix_direction": "Ensure the final summary output strictly follows the required 2\u20134 sentence structure, focuses only on main factual points, and explicitly avoids minor details and speculation; verify completeness and consistency end-to-end.", "confidence": 0.42}, "drafts_generated": 1, "drafts_survived": 1}
{"id": "2f23fdbe-c44e-4934-8a02-fffe6913fa0b", "target_id": "B2-greedy", "git_sha": "6a3c657efc4722ea0d66c503b7ca8c0e2b55a018", "pre_experiment_sha": "6a3c657efc4722ea0d66c503b7ca8c0e2b55a018", "timestamp": "2026-04-19T07:44:13.948394+00:00", "hypothesis": "Clarify that summaries should be brief, factual 2\u20134 sentence overviews focused on main points only, explicitly excluding minor details and speculation.", "hypothesis_source": "agent", "mutation_diff_summary": "", "score": 2.1, "score_ci_lower": 1.3, "score_ci_upper": 3.1, "raw_scores": [2.5, 1.5, 4.0, 1.5, 1.0], "baseline_score": 1.8, "outcome": "DISCARDED", "failure_mode": null, "duration_seconds": 18.323699790984392, "tags": ["clarity", "conciseness", "faithfulness"], "learnings": "{\"what_changed\":\"\",\"what_improved\":[],\"what_regressed\":[],\"transferable_insight\":\"When defining a summary, explicitly constrain it to a brief, factual overview of the main points and exclude minor details and speculation to improve consistency.\",\"domain_tags\":[\"communication\",\"summarization\",\"instruction-design\"]}", "cost_usd": 0.02363855, "bootstrap_seed": 0, "agent_model": "gpt-5.4", "held_out_score": null, "criterion_names": ["key_points_captured", "conciseness", "faithful_to_source", "few_shot_format"], "per_criterion_scores": {"key_points_captured": 0.8, "conciseness": 0.6, "faithful_to_source": 0.4, "few_shot_format": 0.3}, "failure_classification": {"category": "semantic_drift", "description": "The produced summary failed to adhere to the intended meaning of the hypothesis (brief, factual 2\u20134 sentences focusing only on main points), instead including minor details and/or speculation beyond the specified constraints.", "fix_direction": "Ensure summaries are strictly limited to 2\u20134 sentences, grounded in facts, and exclude minor details and any speculation; review meaning against the hypothesis before finalizing.", "confidence": 0.62}, "drafts_generated": 1, "drafts_survived": 1}
{"id": "d623fdcc-5a0e-46a7-8db0-9152e6aaea6d", "target_id": "B2-greedy", "git_sha": "6a3c657efc4722ea0d66c503b7ca8c0e2b55a018", "pre_experiment_sha": "6a3c657efc4722ea0d66c503b7ca8c0e2b55a018", "timestamp": "2026-04-19T07:44:36.375634+00:00", "hypothesis": "Slightly clarifying that summaries should be concise, factual, and limited to main points while explicitly omitting minor details and speculation will improve adherence.", "hypothesis_source": "agent", "mutation_diff_summary": "", "score": 1.8, "score_ci_lower": 1.1, "score_ci_upper": 2.5, "raw_scores": [1.5, 1.5, 2.5, 3.0, 0.5], "baseline_score": 1.8, "outcome": "DISCARDED", "failure_mode": null, "duration_seconds": 18.825275458046235, "tags": ["clarity", "conciseness", "factuality"], "learnings": "{\"what_changed\":\"\",\"what_improved\":[],\"what_regressed\":[],\"transferable_insight\":\"Explicitly stating concise scope and exclusion criteria can improve compliance with summarization instructions by reducing ambiguity about what to include.\",\"domain_tags\":[\"instruction-design\",\"communication\",\"summarization\"]}", "cost_usd": 0.02309055, "bootstrap_seed": 0, "agent_model": "gpt-5.4", "held_out_score": null, "criterion_names": ["key_points_captured", "conciseness", "faithful_to_source", "few_shot_format"], "per_criterion_scores": {"key_points_captured": 0.8, "conciseness": 0.7, "faithful_to_source": 0.3, "few_shot_format": 0.0}, "failure_classification": {"category": "semantic_drift", "description": "The hypothesis targets a specific content-quality change (more concise, factual summaries with explicit omission of minor details and speculation), but the experiment is considered failed and scored low without clear format issues. This suggests the output likely remained well-formed while the meaning/constraints around concision and omission of minor/speculative details were not properly enforced, i.e., it drifted semantically from the intended behavior.", "fix_direction": "Ensure the summary-generation instructions explicitly constrain length/content (e.g., bullet limits, required factual-only phrasing, and an explicit rule to exclude minor details and speculation), and validate that the produced summaries follow these content constraints rather than just updating wording.", "confidence": 0.46}, "drafts_generated": 1, "drafts_survived": 1}
{"id": "14515558-e46e-4cdf-a794-b0711abacfd6", "target_id": "B2-greedy", "git_sha": "6a3c657efc4722ea0d66c503b7ca8c0e2b55a018", "pre_experiment_sha": "6a3c657efc4722ea0d66c503b7ca8c0e2b55a018", "timestamp": "2026-04-19T07:44:57.755386+00:00", "hypothesis": "Clarify that summaries should be brief, factual, and limited to main points while explicitly excluding minor details and speculation.", "hypothesis_source": "agent", "mutation_diff_summary": "", "score": 2.2, "score_ci_lower": 1.4, "score_ci_upper": 2.9, "raw_scores": [1.5, 2.5, 3.5, 2.5, 1.0], "baseline_score": 1.8, "outcome": "DISCARDED", "failure_mode": null, "duration_seconds": 17.666420249966905, "tags": ["clarity", "conciseness", "summarization"], "learnings": "{\"what_changed\":\"\",\"what_improved\":[],\"what_regressed\":[],\"transferable_insight\":\"When defining a summarization task, explicitly constrain the output to brief, factual main points and exclude minor details and speculation to improve consistency.\",\"domain_tags\":[\"communication\",\"summarization\",\"instruction-design\"]}", "cost_usd": 0.023805549999999998, "bootstrap_seed": 0, "agent_model": "gpt-5.4", "held_out_score": null, "criterion_names": ["key_points_captured", "conciseness", "faithful_to_source", "few_shot_format"], "per_criterion_scores": {"key_points_captured": 1.0, "conciseness": 0.5, "faithful_to_source": 0.6, "few_shot_format": 0.1}, "failure_classification": {"category": "incomplete_edit", "description": "The prompt describes a specific hypothesis and provides an output score, but the actual failed experiment content/details are missing/undefined (\u201cFailure Mode: unknown\u201d). This indicates the change may have been only partially applied or left inconsistent, since there isn\u2019t enough information to confirm the required brief, factual, main-points-only constraint was fully implemented.", "fix_direction": "Ensure the experiment explicitly enforces the summarization constraints (brief, factual, main points only; exclude minor details and speculation) and verify the full edit is consistently applied to all relevant sections/outputs.", "confidence": 0.35}, "drafts_generated": 1, "drafts_survived": 1}
{"id": "367e5f85-4ba1-4358-aa6d-73f0f765094a", "target_id": "B2-greedy", "git_sha": "6a3c657efc4722ea0d66c503b7ca8c0e2b55a018", "pre_experiment_sha": "6a3c657efc4722ea0d66c503b7ca8c0e2b55a018", "timestamp": "2026-04-19T07:45:21.103323+00:00", "hypothesis": "Clarify that the summary must be a concise, factual 2\u20134 sentence overview and explicitly exclude minor details and speculation.", "hypothesis_source": "agent", "mutation_diff_summary": "", "score": 2.2, "score_ci_lower": 1.6, "score_ci_upper": 2.8, "raw_scores": [3.0, 2.0, 1.0, 2.0, 3.0], "baseline_score": 1.8, "outcome": "DISCARDED", "failure_mode": null, "duration_seconds": 20.587641749996692, "tags": ["clarity", "conciseness", "summarization"], "learnings": "{\"what_changed\":\"\",\"what_improved\":[],\"what_regressed\":[],\"transferable_insight\":\"When refining a summary instruction, explicitly state the desired length, factuality, and what to omit so the output stays concise and avoids unsupported detail.\",\"domain_tags\":[\"prompt-engineering\",\"summarization\",\"instruction-design\"]}", "cost_usd": 0.02612095, "bootstrap_seed": 0, "agent_model": "gpt-5.4", "held_out_score": null, "criterion_names": ["key_points_captured", "conciseness", "faithful_to_source", "few_shot_format"], "per_criterion_scores": {"key_points_captured": 0.8, "conciseness": 0.3, "faithful_to_source": 0.7, "few_shot_format": 0.4}, "failure_classification": {"category": "output_format", "description": "The hypothesis requires a concise, factual 2\u20134 sentence summary that explicitly excludes minor details and speculation, but the failed experiment did not meet the required summary constraints, indicating an output structure/format compliance issue.", "fix_direction": "Ensure the output is exactly a 2\u20134 sentence, factual overview and remove any minor details or speculative language to match the required summary specification.", "confidence": 0.63}, "drafts_generated": 1, "drafts_survived": 1}
{"id": "5c4d6149-0dff-4f53-9273-a1d788461ac2", "target_id": "B2-greedy", "git_sha": "45536ce9d960aab9871453e2ff2ad0c3c6b670c7", "pre_experiment_sha": "6a3c657efc4722ea0d66c503b7ca8c0e2b55a018", "timestamp": "2026-04-19T07:45:45.711576+00:00", "hypothesis": "A small clarification emphasizing concise factual main points and explicitly omitting minor details should improve summary precision.", "hypothesis_source": "agent", "mutation_diff_summary": "", "score": 2.7, "score_ci_lower": 2.2, "score_ci_upper": 3.2, "raw_scores": [2.0, 3.0, 2.0, 3.5, 3.0], "baseline_score": 1.8, "outcome": "KEPT", "failure_mode": null, "duration_seconds": 21.26195650000591, "tags": ["clarity", "conciseness", "anti-speculation"], "learnings": "{\"what_changed\":\"\",\"what_improved\":[],\"what_regressed\":[],\"transferable_insight\":\"Explicitly stating that only concise, factual main points should be included while minor details are omitted can improve the precision of a summary.\",\"domain_tags\":[\"communication\",\"summarization\",\"instruction-design\"]}", "cost_usd": 0.022453350000000004, "bootstrap_seed": 0, "agent_model": "gpt-5.4", "held_out_score": null, "criterion_names": ["key_points_captured", "conciseness", "faithful_to_source", "few_shot_format"], "per_criterion_scores": {"key_points_captured": 1.0, "conciseness": 1.0, "faithful_to_source": 0.6, "few_shot_format": 0.1}, "failure_classification": null, "drafts_generated": 1, "drafts_survived": 1}
{"id": "20c1a874-c10e-4632-be0f-8d701138a38f", "target_id": "B2-greedy", "git_sha": "45536ce9d960aab9871453e2ff2ad0c3c6b670c7", "pre_experiment_sha": "45536ce9d960aab9871453e2ff2ad0c3c6b670c7", "timestamp": "2026-04-19T07:46:08.204040+00:00", "hypothesis": "Slightly clarifying the summary should be concise, factual, and limited to core points will improve adherence.", "hypothesis_source": "agent", "mutation_diff_summary": "", "score": 1.2, "score_ci_lower": 0.8, "score_ci_upper": 1.7, "raw_scores": [1.0, 0.5, 2.0, 1.5, 1.0], "baseline_score": 2.7, "outcome": "DISCARDED", "failure_mode": null, "duration_seconds": 21.081179916043766, "tags": ["clarity", "concision", "anti-speculation"], "learnings": "{\"what_changed\":\"\",\"what_improved\":[],\"what_regressed\":[],\"transferable_insight\":\"When a change is discarded and no measurable improvements or regressions are observed, the safest conclusion is that the added specificity did not meaningfully affect adherence.\",\"domain_tags\":[\"evaluation\",\"communication\",\"experimentation\"]}", "cost_usd": 0.02202935, "bootstrap_seed": 0, "agent_model": "gpt-5.4", "held_out_score": null, "criterion_names": ["key_points_captured", "conciseness", "faithful_to_source", "few_shot_format"], "per_criterion_scores": {"key_points_captured": 0.6, "conciseness": 0.5, "faithful_to_source": 0.1, "few_shot_format": 0.0}, "failure_classification": {"category": "incomplete_edit", "description": "The attempt appears to involve a partial/insufficient modification: the score is low and the failure mode is unspecified, suggesting the intended clarification was not carried through consistently to achieve the required concise, core-point summary.", "fix_direction": "Ensure the edit is complete and consistent: remove extraneous wording, keep the summary strictly concise and factual, and verify that the final output fully reflects the hypothesis without leaving leftover or conflicting text.", "confidence": 0.45}, "drafts_generated": 1, "drafts_survived": 1}
