{"id": "794714c7-2fe7-46b6-9d15-4563c6e660bb", "target_id": "B2-greedy", "git_sha": "4aa393dc8fd3b4f08fcc9eb825917f26c9f26904", "pre_experiment_sha": "4aa393dc8fd3b4f08fcc9eb825917f26c9f26904", "timestamp": "2026-04-24T02:52:39.991255+00:00", "hypothesis": "Format the existing system instructions using bolding for key verbs and bullet points for the negative constraints to improve readability without altering the meaning or few-shot examples.", "hypothesis_source": "agent", "mutation_diff_summary": "", "score": 2.6, "score_ci_lower": 2.0, "score_ci_upper": 3.4, "raw_scores": [2.0, 3.0, 2.0, 4.0, 2.0], "baseline_score": 3.7, "outcome": "DISCARDED", "failure_mode": null, "duration_seconds": 53.29011537483893, "tags": ["formatting", "bullet-points", "readability"], "learnings": "{\"what_changed\":\"\",\"what_improved\":[],\"what_regressed\":[],\"transferable_insight\":\"Applying cosmetic formatting changes like bolding and bullet points to improve human readability can inadvertently degrade model performance.\",\"domain_tags\":[\"Prompt Engineering\",\"Formatting\"]}", "cost_usd": 0.011331000000000003, "bootstrap_seed": 0, "agent_model": "gemini-3.1-pro-preview", "held_out_score": null, "criterion_names": ["key_points_captured", "conciseness", "faithful_to_source", "few_shot_format"], "per_criterion_scores": {"key_points_captured": 1.0, "conciseness": 1.0, "faithful_to_source": 0.4, "few_shot_format": 0.2}, "failure_classification": {"category": "semantic_drift", "description": "The reformatting of system instructions (bolding key verbs and bulleting negative constraints), while intended to improve readability, likely inadvertently altered the perceived meaning or emphasis for the instructed model. This 'semantic drift' led to a misinterpretation of the instructions and the significantly degraded performance indicated by the low score (2.6).", "fix_direction": "Isolate the formatting changes (e.g., test bolding only, then bullet points only) to pinpoint which specific modification caused the semantic drift. Implement more granular evaluation metrics that specifically test for adherence to the original intent and meaning of the instructions, rather than just overall performance. Consider A/B testing instructions on a subset of tasks to detect subtle shifts in model behavior.", "confidence": 0.9}, "drafts_generated": 1, "drafts_survived": 1}
{"id": "8a0c70e7-9ac7-48c6-a424-6c556ceae7e6", "target_id": "B2-greedy", "git_sha": "4aa393dc8fd3b4f08fcc9eb825917f26c9f26904", "pre_experiment_sha": "4aa393dc8fd3b4f08fcc9eb825917f26c9f26904", "timestamp": "2026-04-24T02:53:54.509533+00:00", "hypothesis": "Format the system instructions with bolding on key verbs and convert the comma-separated constraints into a bulleted list to improve readability and parsing without altering the semantic meaning or few-shot examples.", "hypothesis_source": "agent", "mutation_diff_summary": "", "score": 2.8, "score_ci_lower": 2.4, "score_ci_upper": 3.2, "raw_scores": [2.0, 2.5, 3.5, 3.0, 3.0], "baseline_score": 3.7, "outcome": "DISCARDED", "failure_mode": null, "duration_seconds": 55.01585262501612, "tags": ["formatting", "bullet-points", "bolding", "readability"], "learnings": "{\"what_changed\":\"\",\"what_improved\":[],\"what_regressed\":[],\"transferable_insight\":\"Purely cosmetic formatting adjustments, such as bolding keywords and converting inline lists to bullet points, can degrade system performance rather than improving comprehension.\",\"domain_tags\":[\"Prompt Engineering\",\"Formatting\",\"Instruction Design\"]}", "cost_usd": 0.011471050000000002, "bootstrap_seed": 0, "agent_model": "gemini-3.1-pro-preview", "held_out_score": null, "criterion_names": ["key_points_captured", "conciseness", "faithful_to_source", "few_shot_format"], "per_criterion_scores": {"key_points_captured": 1.0, "conciseness": 1.0, "faithful_to_source": 0.7, "few_shot_format": 0.1}, "failure_classification": {"category": "semantic_drift", "description": "The experiment's attempt to format system instructions by bolding verbs and converting constraints to bullet points, while aiming for improved readability, likely inadvertently altered the semantic interpretation of the instructions by the model. This deviation from the original meaning, explicitly forbidden by the hypothesis ('without altering the semantic meaning'), led to the degraded performance and the low score. The model's understanding 'drifted' due to the formatting changes.", "fix_direction": "Future attempts should focus on validating that formatting changes do not introduce unintended semantic shifts. This can involve: 1. A/B testing subtle variations in formatting. 2. Developing specific test cases to evaluate how the model interprets key instructions or constraints after formatting changes. 3. Exploring alternative methods for improving readability (e.g., rephrasing for clarity, adding examples) that have less potential for semantic interference. 4. Isolating the impact of bolding vs. bullet points by testing them independently.", "confidence": 0.9}, "drafts_generated": 1, "drafts_survived": 1}
{"id": "7708ea2f-46d9-402b-8e24-194108c2c93c", "target_id": "B2-greedy", "git_sha": "4aa393dc8fd3b4f08fcc9eb825917f26c9f26904", "pre_experiment_sha": "4aa393dc8fd3b4f08fcc9eb825917f26c9f26904", "timestamp": "2026-04-24T02:55:23.146923+00:00", "hypothesis": "Standardize whitespace and line breaks by removing excessive trailing newlines to ensure a clean and consistent separation between instructions and examples.", "hypothesis_source": "agent", "mutation_diff_summary": "", "score": 3.0, "score_ci_lower": 2.3, "score_ci_upper": 3.7, "raw_scores": [4.0, 2.5, 4.0, 2.0, 2.5], "baseline_score": 3.7, "outcome": "DISCARDED", "failure_mode": null, "duration_seconds": 49.76020720903762, "tags": ["whitespace-standardization", "formatting"], "learnings": "{\"what_changed\":\"\",\"what_improved\":[],\"what_regressed\":[],\"transferable_insight\":\"Removing pronounced whitespace or line breaks to 'clean up' formatting can degrade performance by eliminating the implicit structural boundaries that systems rely on to separate distinct sections of context.\",\"domain_tags\":[\"Prompt Formatting\",\"Whitespace Management\",\"Structural Delimiters\"]}", "cost_usd": 0.01146195, "bootstrap_seed": 0, "agent_model": "gemini-3.1-pro-preview", "held_out_score": null, "criterion_names": ["key_points_captured", "conciseness", "faithful_to_source", "few_shot_format"], "per_criterion_scores": {"key_points_captured": 1.0, "conciseness": 1.0, "faithful_to_source": 0.6, "few_shot_format": 0.4}, "failure_classification": {"category": "output_format", "description": "The experiment failed to standardize whitespace and line breaks. It likely either did not successfully remove excessive trailing newlines, or it removed them inconsistently, or perhaps even removed too many, thus failing to achieve the desired clean and consistent separation between instructions and examples in the output format.", "fix_direction": "Refine the logic (e.g., regular expressions or parsing rules) used to identify and normalize whitespace and line breaks. Clearly define what constitutes 'excessive' versus appropriate newlines for consistent separation. Implement robust validation to specifically check for the count and consistency of trailing newlines.", "confidence": 0.95}, "drafts_generated": 1, "drafts_survived": 1}
{"id": "89b4073f-617a-4011-a6d7-39d45baa2074", "target_id": "B2-greedy", "git_sha": "4aa393dc8fd3b4f08fcc9eb825917f26c9f26904", "pre_experiment_sha": "4aa393dc8fd3b4f08fcc9eb825917f26c9f26904", "timestamp": "2026-04-24T02:56:46.605419+00:00", "hypothesis": "Standardize trailing whitespace by removing extra blank lines at the end of the prompt to ensure clean separation when the input is appended.", "hypothesis_source": "agent", "mutation_diff_summary": "", "score": 3.0, "score_ci_lower": 2.6, "score_ci_upper": 3.5, "raw_scores": [4.0, 2.5, 2.5, 3.0, 3.0], "baseline_score": 3.7, "outcome": "DISCARDED", "failure_mode": null, "duration_seconds": 64.99689025012776, "tags": ["whitespace", "formatting"], "learnings": "{\"what_changed\":\"\",\"what_improved\":[],\"what_regressed\":[],\"transferable_insight\":\"Removing trailing blank lines at the end of instructions can degrade performance by eliminating the structural separation needed by the model to clearly distinguish between the prompt and appended input data.\",\"domain_tags\":[\"Prompt Formatting\",\"Structural Delimiters\",\"Prompt Engineering\"]}", "cost_usd": 0.0119011, "bootstrap_seed": 0, "agent_model": "gemini-3.1-pro-preview", "held_out_score": null, "criterion_names": ["key_points_captured", "conciseness", "faithful_to_source", "few_shot_format"], "per_criterion_scores": {"key_points_captured": 0.9, "conciseness": 1.0, "faithful_to_source": 0.7, "few_shot_format": 0.4}, "failure_classification": {"category": "logic_error", "description": "The hypothesis assumed that removing 'extra' blank lines at the end of the prompt would improve or ensure clean separation when input is appended. However, this assumption proved incorrect, leading to a degraded outcome. It's likely that the model implicitly relied on those blank lines for proper content separation or contextual understanding, and their removal disrupted its processing.", "fix_direction": "Re-evaluate the implicit role of whitespace in prompt processing. Instead of simply removing whitespace, investigate how the model interprets different prompt structures, particularly concerning delimiters or context switches. Consider using explicit delimiters (e.g., `---`, `[INPUT]`) instead of relying on implicit whitespace for separation, or test different whitespace patterns to find one that consistently aids the model.", "confidence": 0.9}, "drafts_generated": 1, "drafts_survived": 1}
{"id": "b4d798a3-1d2e-49bb-b57a-6b3fcc283423", "target_id": "B2-greedy", "git_sha": "4aa393dc8fd3b4f08fcc9eb825917f26c9f26904", "pre_experiment_sha": "4aa393dc8fd3b4f08fcc9eb825917f26c9f26904", "timestamp": "2026-04-24T02:58:06.381235+00:00", "hypothesis": "Standardize the layout by placing the summary text on the same line as the \"Summary:\" label to match the \"Article:\" format, ensuring consistent spacing without altering any text.", "hypothesis_source": "agent", "mutation_diff_summary": "", "score": 2.8, "score_ci_lower": 2.4, "score_ci_upper": 3.2, "raw_scores": [2.0, 2.5, 3.5, 3.0, 3.0], "baseline_score": 3.7, "outcome": "DISCARDED", "failure_mode": null, "duration_seconds": 56.84402525005862, "tags": ["whitespace", "formatting"], "learnings": "{\"what_changed\":\"\",\"what_improved\":[],\"what_regressed\":[],\"transferable_insight\":\"Removing line breaks between labels and their corresponding content to standardize layout can degrade performance by blurring the structural boundary between metadata and core text.\",\"domain_tags\":[\"Prompt Engineering\",\"Formatting\",\"Data Structuring\"]}", "cost_usd": 0.011093, "bootstrap_seed": 0, "agent_model": "gemini-3.1-pro-preview", "held_out_score": null, "criterion_names": ["key_points_captured", "conciseness", "faithful_to_source", "few_shot_format"], "per_criterion_scores": {"key_points_captured": 1.0, "conciseness": 1.0, "faithful_to_source": 0.7, "few_shot_format": 0.1}, "failure_classification": {"category": "scope_violation", "description": "The experiment aimed to standardize the layout by moving the summary text onto the same line as the 'Summary:' label, with the explicit constraint of 'without altering any text'. The low score suggests that in attempting to achieve the desired layout, the system inadvertently modified or altered the actual text content, thereby violating this critical negative constraint on its editing scope.", "fix_direction": "Implement stricter controls and validation mechanisms to prevent any alteration of text content when performing layout adjustments. Prioritize content integrity over formatting attempts, ensuring that the 'without altering any text' constraint is strictly enforced before and after any layout transformations.", "confidence": 0.9}, "drafts_generated": 1, "drafts_survived": 1}
{"id": "136f6bcc-da41-4e08-aa03-0d10b34d469b", "target_id": "B2-greedy", "git_sha": "4aa393dc8fd3b4f08fcc9eb825917f26c9f26904", "pre_experiment_sha": "4aa393dc8fd3b4f08fcc9eb825917f26c9f26904", "timestamp": "2026-04-24T02:59:45.846048+00:00", "hypothesis": "Remove the Oxford comma in the system instructions to make a minimal, safe typographical adjustment while strictly preserving the wording, formatting, and few-shot examples.", "hypothesis_source": "agent", "mutation_diff_summary": "", "score": 2.6, "score_ci_lower": 2.0, "score_ci_upper": 3.4, "raw_scores": [2.0, 2.0, 4.0, 2.0, 3.0], "baseline_score": 3.7, "outcome": "DISCARDED", "failure_mode": null, "duration_seconds": 63.60536541696638, "tags": ["minor-correction", "punctuation"], "learnings": "{\"what_changed\":\"\",\"what_improved\":[],\"what_regressed\":[],\"transferable_insight\":\"Minor typographical adjustments, such as altering punctuation, can unexpectedly degrade performance, demonstrating that systems can be highly sensitive to subtle formatting changes.\",\"domain_tags\":[\"Prompt Engineering\",\"Formatting\",\"Punctuation\"]}", "cost_usd": 0.0108553, "bootstrap_seed": 0, "agent_model": "gemini-3.1-pro-preview", "held_out_score": null, "criterion_names": ["key_points_captured", "conciseness", "faithful_to_source", "few_shot_format"], "per_criterion_scores": {"key_points_captured": 1.0, "conciseness": 1.0, "faithful_to_source": 0.4, "few_shot_format": 0.2}, "failure_classification": {"category": "semantic_drift", "description": "Removing the Oxford comma, though intended as a minor typographical adjustment, likely altered the semantic interpretation of a list within the system instructions. This ambiguity or shift in meaning caused the model to misinterpret its task or constraints, leading to a degraded performance score despite no explicit syntax or format errors.", "fix_direction": "Revert the change by reintroducing the Oxford comma, or rephrase the affected instruction lists to be unambiguously clear without the Oxford comma. Implement targeted evaluations to specifically test for correct interpretation of list items in instructions.", "confidence": 0.9}, "drafts_generated": 1, "drafts_survived": 1}
{"id": "96b6cc15-3bc6-4b7a-9487-83acb872e866", "target_id": "B2-greedy", "git_sha": "4aa393dc8fd3b4f08fcc9eb825917f26c9f26904", "pre_experiment_sha": "4aa393dc8fd3b4f08fcc9eb825917f26c9f26904", "timestamp": "2026-04-24T03:01:07.420913+00:00", "hypothesis": "Add a comma after \"Now\" for improved grammatical correctness while strictly preserving all formatting, wording, and trailing whitespace.", "hypothesis_source": "agent", "mutation_diff_summary": "", "score": 2.8, "score_ci_lower": 2.2, "score_ci_upper": 3.4, "raw_scores": [2.0, 2.0, 3.5, 3.0, 3.5], "baseline_score": 3.7, "outcome": "DISCARDED", "failure_mode": null, "duration_seconds": 66.44001887505874, "tags": ["minor-punctuation", "formatting-preserved"], "learnings": "{\"what_changed\":\"\",\"what_improved\":[],\"what_regressed\":[],\"transferable_insight\":\"Minor punctuation adjustments intended to enforce strict grammatical correctness can unexpectedly degrade performance, likely by altering the expected conversational tone or parsing structure.\",\"domain_tags\":[\"Punctuation\",\"Grammar\",\"Prompt Engineering\"]}", "cost_usd": 0.01178405, "bootstrap_seed": 0, "agent_model": "gemini-3.1-pro-preview", "held_out_score": null, "criterion_names": ["key_points_captured", "conciseness", "faithful_to_source", "few_shot_format"], "per_criterion_scores": {"key_points_captured": 1.0, "conciseness": 1.0, "faithful_to_source": 0.6, "few_shot_format": 0.2}, "failure_classification": {"category": "scope_violation", "description": "The model likely added the comma as instructed, but failed to strictly preserve all formatting, other wording, or trailing whitespace as mandated by the hypothesis. Any alteration beyond the single comma insertion constitutes an edit outside the extremely narrow permitted scope.", "fix_direction": "Improve the model's ability to perform highly precise, atomic edits while rigorously adhering to negative constraints, such as preserving non-semantic elements (e.g., whitespace, line endings, case) and only making the explicitly requested change. Focus on methods that can diff the output against the input to identify unintended changes.", "confidence": 0.9}, "drafts_generated": 1, "drafts_survived": 1}
{"id": "4e7deb83-75da-472d-9087-59c00d0b4007", "target_id": "B2-greedy", "git_sha": "4aa393dc8fd3b4f08fcc9eb825917f26c9f26904", "pre_experiment_sha": "4aa393dc8fd3b4f08fcc9eb825917f26c9f26904", "timestamp": "2026-04-24T03:02:31.324241+00:00", "hypothesis": "Make a minimal typographical correction by removing the Oxford comma in the system instructions to maintain perfect semantic fidelity while strictly preserving all trailing newlines and formatting.", "hypothesis_source": "agent", "mutation_diff_summary": "", "score": 2.9, "score_ci_lower": 2.1, "score_ci_upper": 3.7, "raw_scores": [2.0, 2.5, 4.0, 2.0, 4.0], "baseline_score": 3.7, "outcome": "DISCARDED", "failure_mode": null, "duration_seconds": 63.46242333389819, "tags": ["minor-typographical-correction", "preserve-newlines"], "learnings": "{\"what_changed\":\"\",\"what_improved\":[],\"what_regressed\":[],\"transferable_insight\":\"Minor typographical adjustments to instructions, such as removing an Oxford comma, can unexpectedly degrade model performance, demonstrating high sensitivity to exact punctuation.\",\"domain_tags\":[\"Prompt Engineering\",\"Punctuation\",\"System Instructions\"]}", "cost_usd": 0.011812550000000002, "bootstrap_seed": 0, "agent_model": "gemini-3.1-pro-preview", "held_out_score": null, "criterion_names": ["key_points_captured", "conciseness", "faithful_to_source", "few_shot_format"], "per_criterion_scores": {"key_points_captured": 1.0, "conciseness": 1.0, "faithful_to_source": 0.5, "few_shot_format": 0.4}, "failure_classification": {"category": "semantic_drift", "description": "The system attempted to remove the Oxford comma as instructed, but its removal inadvertently altered the meaning or introduced ambiguity in the system instructions, failing to maintain perfect semantic fidelity. This suggests the system did not fully comprehend the contextual semantic implications of the punctuation change.", "fix_direction": "Enhance the model's ability to perform deep semantic analysis when making textual modifications, especially for punctuation changes that can impact meaning. Train it to recognize when an Oxford comma is critical for clarity versus merely a style choice, and prioritize semantic preservation above strict adherence to typographical rules when there's a conflict.", "confidence": 0.85}, "drafts_generated": 1, "drafts_survived": 1}
{"id": "d9b04500-5e0b-4c73-a2a9-f5606f87d2c3", "target_id": "B2-greedy", "git_sha": "4aa393dc8fd3b4f08fcc9eb825917f26c9f26904", "pre_experiment_sha": "4aa393dc8fd3b4f08fcc9eb825917f26c9f26904", "timestamp": "2026-04-24T03:04:04.371160+00:00", "hypothesis": "Add a single invisible space at the end of the first paragraph to create a zero-impact mutation while perfectly preserving all semantic, syntactic, and structural elements of the prompt.", "hypothesis_source": "agent", "mutation_diff_summary": "", "score": 2.7, "score_ci_lower": 2.1, "score_ci_upper": 3.4, "raw_scores": [2.0, 2.5, 3.0, 2.0, 4.0], "baseline_score": 3.7, "outcome": "DISCARDED", "failure_mode": null, "duration_seconds": 52.92155629186891, "tags": ["zero-impact", "whitespace"], "learnings": "{\"what_changed\":\"\",\"what_improved\":[],\"what_regressed\":[],\"transferable_insight\":\"Introducing invisible characters or trailing whitespace intended as zero-impact mutations can unexpectedly degrade system performance by altering underlying tokenization or parsing.\",\"domain_tags\":[\"Prompt Engineering\",\"Tokenization\",\"Mutation Testing\"]}", "cost_usd": 0.0117543, "bootstrap_seed": 0, "agent_model": "gemini-3.1-pro-preview", "held_out_score": null, "criterion_names": ["key_points_captured", "conciseness", "faithful_to_source", "few_shot_format"], "per_criterion_scores": {"key_points_captured": 1.0, "conciseness": 1.0, "faithful_to_source": 0.5, "few_shot_format": 0.2}, "failure_classification": {"category": "semantic_drift", "description": "The hypothesis aimed for a zero-impact mutation by adding an invisible space, explicitly stating the preservation of all semantic, syntactic, and structural elements. The resulting score of 2.7000 indicates that the change was not zero-impact and that the evaluation system detected a significant alteration. While the change was structurally minimal and visually imperceptible, its impact on the score implies that the 'meaning' or 'effect' of the prompt, as interpreted by the evaluation system, drifted from the original state.", "fix_direction": "Investigate the evaluation system's sensitivity to whitespace, particularly invisible or non-standard characters. Determine if the scoring mechanism treats subtle structural changes (like character count differences or non-standard characters) as semantically significant, or if the 'invisible space' caused a different downstream processing behavior that led to the semantic drift.", "confidence": 0.9}, "drafts_generated": 1, "drafts_survived": 1}
