{"id": "286056fb-4f88-4d2e-bbaf-60b74c433aea", "target_id": "B2-greedy", "git_sha": "5d4229bb06a1f4b50b7e74de7532c2064266b5b5", "pre_experiment_sha": "5d4229bb06a1f4b50b7e74de7532c2064266b5b5", "timestamp": "2026-04-22T06:00:02.179329+00:00", "hypothesis": "Contract \"Do not\" to \"Don't\" in rule 2 to alter tokenization without changing semantics.", "hypothesis_source": "agent", "mutation_diff_summary": "", "score": 2.5, "score_ci_lower": 2.0, "score_ci_upper": 3.1, "raw_scores": [2.0, 2.0, 3.5, 2.0, 3.0], "baseline_score": 3.6, "outcome": "DISCARDED", "failure_mode": null, "duration_seconds": 63.376942249946296, "tags": ["contraction", "minor_edit"], "learnings": "{\"what_changed\":\"\",\"what_improved\":[],\"what_regressed\":[],\"transferable_insight\":\"Explicitly phrasing negative constraints rather than using contractions ensures stronger semantic signals and better adherence to rules.\",\"domain_tags\":[\"Prompt Engineering\",\"Tokenization\",\"Constraint Formatting\"]}", "cost_usd": 0.01202485, "bootstrap_seed": 0, "agent_model": "gemini-3.1-pro-preview", "held_out_score": null, "criterion_names": ["key_points_captured", "conciseness", "faithful_to_source", "few_shot_format"], "per_criterion_scores": {"key_points_captured": 1.0, "conciseness": 1.0, "faithful_to_source": 0.4, "few_shot_format": 0.1}, "failure_classification": {"category": "semantic_drift", "description": "The experiment aimed to change 'Do not' to 'Don't' to alter tokenization while explicitly maintaining semantics. The failure indicates that, despite the intention, the semantic meaning or behavior of the rule changed, suggesting that the system interpreted 'Don't' differently than 'Do not'. This could be due to unexpected parsing of contractions, changes in how negation is handled, or other subtle linguistic processing differences.", "fix_direction": "Investigate how the system's tokenization and parsing mechanisms handle contractions versus separate words. Specifically, verify if the contracted form 'Don't' preserves the exact same logical or functional meaning and scope as 'Do not' within the context of rule 2. Consider explicit tests for semantic equivalence rather than just assuming it for common contractions.", "confidence": 0.9}, "drafts_generated": 1, "drafts_survived": 1}
{"id": "4af0252f-8331-47f8-9aa3-807e6ad91748", "target_id": "B2-greedy", "git_sha": "5d4229bb06a1f4b50b7e74de7532c2064266b5b5", "pre_experiment_sha": "5d4229bb06a1f4b50b7e74de7532c2064266b5b5", "timestamp": "2026-04-22T06:01:15.046680+00:00", "hypothesis": "Contract \"Do not\" to \"Don't\" in the strict rules to alter tokenization while perfectly preserving semantics.", "hypothesis_source": "agent", "mutation_diff_summary": "", "score": 3.6, "score_ci_lower": 2.8, "score_ci_upper": 4.0, "raw_scores": [4.0, 4.0, 4.0, 4.0, 2.0], "baseline_score": 3.6, "outcome": "DISCARDED", "failure_mode": null, "duration_seconds": 54.585469250101596, "tags": ["contraction", "tokenization"], "learnings": "{\"what_changed\":\"\",\"what_improved\":[],\"what_regressed\":[],\"transferable_insight\":\"Minor syntactic contractions that preserve exact semantics but alter tokenization do not yield measurable performance changes in instruction processing.\",\"domain_tags\":[\"Prompt Engineering\",\"Tokenization\",\"Optimization\"]}", "cost_usd": 0.0136506, "bootstrap_seed": 0, "agent_model": "gemini-3.1-pro-preview", "held_out_score": null, "criterion_names": ["key_points_captured", "conciseness", "faithful_to_source", "few_shot_format"], "per_criterion_scores": {"key_points_captured": 1.0, "conciseness": 1.0, "faithful_to_source": 0.8, "few_shot_format": 0.8}, "failure_classification": {"category": "semantic_drift", "description": "The experiment's attempt to contract \"Do not\" to \"Don't\" for tokenization purposes failed to perfectly preserve semantics as hypothesized. The low score suggests that this linguistic alteration introduced an unintended shift in meaning or interpretation for the system, despite the superficial equivalence of the phrases.", "fix_direction": "Analyze specific contexts where the semantic meaning diverged between 'Do not' and 'Don't'. Investigate how the new single token 'Don't' is processed by the underlying models compared to the two tokens 'Do' and 'not'. This may require custom embeddings for 'Don't', specific rule adjustments for negation handling, or fine-tuning of the model to ensure true semantic equivalence and prevent unintended changes in meaning or emphasis.", "confidence": 0.9}, "drafts_generated": 1, "drafts_survived": 1}
{"id": "6ec473e4-275d-4f8d-b6f9-c71054154c92", "target_id": "B2-greedy", "git_sha": "5d4229bb06a1f4b50b7e74de7532c2064266b5b5", "pre_experiment_sha": "5d4229bb06a1f4b50b7e74de7532c2064266b5b5", "timestamp": "2026-04-22T06:02:46.140904+00:00", "hypothesis": "Contract \"Do not\" to \"Don't\" in rule 2 to alter tokenization without changing semantics or triggering semantic drift.", "hypothesis_source": "agent", "mutation_diff_summary": "", "score": 2.6, "score_ci_lower": 2.0, "score_ci_upper": 3.4, "raw_scores": [2.0, 3.0, 2.0, 4.0, 2.0], "baseline_score": 3.6, "outcome": "DISCARDED", "failure_mode": null, "duration_seconds": 68.5092626248952, "tags": ["contraction"], "learnings": "{\"what_changed\":\"\",\"what_improved\":[],\"what_regressed\":[],\"transferable_insight\":\"Replacing explicit negative constraints with contractions to optimize processing can degrade performance, as the expanded forms often carry stronger instructional weight.\",\"domain_tags\":[\"Prompt Engineering\",\"Tokenization\",\"Instruction Formatting\"]}", "cost_usd": 0.01145725, "bootstrap_seed": 0, "agent_model": "gemini-3.1-pro-preview", "held_out_score": null, "criterion_names": ["key_points_captured", "conciseness", "faithful_to_source", "few_shot_format"], "per_criterion_scores": {"key_points_captured": 1.0, "conciseness": 1.0, "faithful_to_source": 0.4, "few_shot_format": 0.2}, "failure_classification": {"category": "semantic_drift", "description": "The contraction of 'Do not' to 'Don't' likely altered the tokenization in a way that, despite being semantically equivalent to a human, caused downstream rules or models to misinterpret the input or trigger different processing paths than intended. The experiment aimed to avoid semantic drift, but the low score suggests it failed to do so from the system's perspective, leading to an effective change in meaning or behavior.", "fix_direction": "Analyze how the system's tokenizer and subsequent processing steps (e.g., parsers, dependency trees, rule matching) handle 'Do not' as separate tokens versus 'Don't' as a single or different set of tokens. Identify which specific system components were sensitive to this tokenization change and why it led to a degradation in performance, implying an unintended shift in perceived meaning or operational behavior.", "confidence": 0.9}, "drafts_generated": 1, "drafts_survived": 1}
{"id": "3735d68a-974c-42a0-aec3-6a9cc49e022f", "target_id": "B2-greedy", "git_sha": "5d4229bb06a1f4b50b7e74de7532c2064266b5b5", "pre_experiment_sha": "5d4229bb06a1f4b50b7e74de7532c2064266b5b5", "timestamp": "2026-04-22T06:04:32.237396+00:00", "hypothesis": "Expand the abbreviation \"Info\" to \"Information\" in the strict rules section to improve clarity without altering semantics.", "hypothesis_source": "agent", "mutation_diff_summary": "", "score": 3.0, "score_ci_lower": 2.4, "score_ci_upper": 3.6, "raw_scores": [2.0, 3.5, 2.5, 4.0, 3.0], "baseline_score": 3.6, "outcome": "DISCARDED", "failure_mode": null, "duration_seconds": 63.71373708406463, "tags": ["abbreviation-expansion"], "learnings": "{\"what_changed\":\"\",\"what_improved\":[],\"what_regressed\":[],\"transferable_insight\":\"Expanding universally recognized abbreviations into their full words in instructional text can degrade performance without providing any practical clarity benefits.\",\"domain_tags\":[\"Prompt Engineering\",\"Text Optimization\",\"Instruction Clarity\"]}", "cost_usd": 0.013529450000000002, "bootstrap_seed": 0, "agent_model": "gemini-3.1-pro-preview", "held_out_score": null, "criterion_names": ["key_points_captured", "conciseness", "faithful_to_source", "few_shot_format"], "per_criterion_scores": {"key_points_captured": 0.9, "conciseness": 1.0, "faithful_to_source": 0.8, "few_shot_format": 0.3}, "failure_classification": {"category": "semantic_drift", "description": "Although the expansion from 'Info' to 'Information' appears to be a direct replacement for clarity, the experiment failed because this change, while grammatically correct, likely introduced a subtle shift in meaning, scope, or connotation within the specific context of the 'strict rules section'. This violates the explicit goal of the hypothesis to improve clarity 'without altering semantics'. The 'unknown' failure mode suggests the system detected an undesirable qualitative change that wasn't a structural or syntactic error.", "fix_direction": "Carefully re-evaluate the specific context and historical usage of 'Info' within the 'strict rules section'. Investigate if 'Information' carries any additional, unintended connotations, or if 'Info' was deliberately concise or a specific technical term. Consider alternative phrasing that aims for clarity without expanding, or assess if the original 'Info' truly lacked clarity for the target audience. If expansion is critical, ensure the new phrasing is meticulously reviewed for any unintended semantic shifts.", "confidence": 0.9}, "drafts_generated": 1, "drafts_survived": 1}
{"id": "d319ad0b-bc9d-4344-8d00-c230a79c63f5", "target_id": "B2-greedy", "git_sha": "5d4229bb06a1f4b50b7e74de7532c2064266b5b5", "pre_experiment_sha": "5d4229bb06a1f4b50b7e74de7532c2064266b5b5", "timestamp": "2026-04-22T06:06:02.575779+00:00", "hypothesis": "Replace the abbreviation \"Info\" with its full form \"Information\" in the strict rules section to improve formality without altering semantics.", "hypothesis_source": "agent", "mutation_diff_summary": "", "score": 2.5, "score_ci_lower": 2.2, "score_ci_upper": 2.8, "raw_scores": [2.0, 3.0, 2.5, 2.5, 2.5], "baseline_score": 3.6, "outcome": "DISCARDED", "failure_mode": null, "duration_seconds": 63.58647283306345, "tags": ["abbreviation-expansion"], "learnings": "{\"what_changed\":\"\",\"what_improved\":[],\"what_regressed\":[],\"transferable_insight\":\"Expanding universally understood abbreviations into their full forms solely to increase formality can degrade system performance without providing semantic benefits.\",\"domain_tags\":[\"Prompt Engineering\",\"Linguistics\",\"Communication Style\"]}", "cost_usd": 0.0111989, "bootstrap_seed": 0, "agent_model": "gemini-3.1-pro-preview", "held_out_score": null, "criterion_names": ["key_points_captured", "conciseness", "faithful_to_source", "few_shot_format"], "per_criterion_scores": {"key_points_captured": 1.0, "conciseness": 1.0, "faithful_to_source": 0.4, "few_shot_format": 0.1}, "failure_classification": {"category": "semantic_drift", "description": "The experiment aimed to improve formality by replacing 'Info' with 'Information' without altering semantics. The low score, despite an 'unknown' failure mode, strongly suggests that the intended meaning was subtly changed or misunderstood in context during the replacement, leading to a drift in the original semantics of the 'strict rules section'.", "fix_direction": "Carefully review the specific context and historical usage of 'Info' within the 'strict rules section'. Investigate if 'Info' carried a nuanced, technical, or domain-specific meaning that 'Information' does not fully convey. Consider alternative phrasings or contextual clarifications, or revert the change if 'Info' is essential for precise meaning.", "confidence": 0.9}, "drafts_generated": 1, "drafts_survived": 1}
{"id": "abc846a9-2286-48a7-a7f9-0d259920f462", "target_id": "B2-greedy", "git_sha": "5d4229bb06a1f4b50b7e74de7532c2064266b5b5", "pre_experiment_sha": "5d4229bb06a1f4b50b7e74de7532c2064266b5b5", "timestamp": "2026-04-22T06:07:20.889795+00:00", "hypothesis": "Replace the abbreviation \"Info\" with its full form \"Information\" to slightly elevate the formal tone without altering semantics or triggering drift.", "hypothesis_source": "agent", "mutation_diff_summary": "", "score": 2.7, "score_ci_lower": 2.1, "score_ci_upper": 3.4, "raw_scores": [3.0, 2.5, 2.0, 2.0, 4.0], "baseline_score": 3.6, "outcome": "DISCARDED", "failure_mode": null, "duration_seconds": 62.90999950002879, "tags": ["abbreviation-expansion", "formatting"], "learnings": "{\"what_changed\":\"\",\"what_improved\":[],\"what_regressed\":[],\"transferable_insight\":\"Expanding widely understood abbreviations into their full forms to elevate formality can degrade performance by making the text feel unnecessarily stiff or verbose.\",\"domain_tags\":[\"Copywriting\",\"Tone and Voice\",\"UX Writing\"]}", "cost_usd": 0.012923050000000002, "bootstrap_seed": 0, "agent_model": "gemini-3.1-pro-preview", "held_out_score": null, "criterion_names": ["key_points_captured", "conciseness", "faithful_to_source", "few_shot_format"], "per_criterion_scores": {"key_points_captured": 1.0, "conciseness": 1.0, "faithful_to_source": 0.4, "few_shot_format": 0.3}, "failure_classification": {"category": "semantic_drift", "description": "The experiment aimed to replace 'Info' with 'Information' to elevate tone without altering semantics or triggering drift. The very low score (2.7) strongly indicates that the replacement likely introduced changes in meaning, nuance, or appropriateness within the context, thereby failing the crucial 'without altering semantics or triggering drift' criterion. This suggests the replacement was not sufficiently context-aware.", "fix_direction": "Improve context awareness for the replacement. Implement more sophisticated logic to determine when 'Info' truly functions as a general abbreviation for 'Information' and when its replacement would be semantically or tonally inappropriate (e.g., proper nouns, technical terms where 'Info' has a specific meaning, idiomatic expressions, or contexts where brevity is preferred). Consider using NLP techniques to analyze surrounding words, part-of-speech tagging, or entity recognition to refine replacement decisions.", "confidence": 0.9}, "drafts_generated": 1, "drafts_survived": 1}
{"id": "04d3b620-c06d-43b1-b397-fb784040319c", "target_id": "B2-greedy", "git_sha": "5d4229bb06a1f4b50b7e74de7532c2064266b5b5", "pre_experiment_sha": "5d4229bb06a1f4b50b7e74de7532c2064266b5b5", "timestamp": "2026-04-22T06:09:14.689501+00:00", "hypothesis": "Change the numbered list of strict rules to a bulleted list using dashes to slightly alter formatting without changing any semantic content or whitespace.", "hypothesis_source": "agent", "mutation_diff_summary": "", "score": 3.0, "score_ci_lower": 2.5, "score_ci_upper": 3.4, "raw_scores": [3.0, 3.0, 3.5, 2.0, 3.5], "baseline_score": 3.6, "outcome": "DISCARDED", "failure_mode": null, "duration_seconds": 62.717692374950275, "tags": ["formatting", "bullet-points"], "learnings": "{\"what_changed\":\"\",\"what_improved\":[],\"what_regressed\":[],\"transferable_insight\":\"Replacing numbered lists with bullet points for strict rules degrades performance, indicating that sequential numbering provides stronger structural cues for constraint adherence.\",\"domain_tags\":[\"Prompt Formatting\",\"Instruction Following\"]}", "cost_usd": 0.013243400000000002, "bootstrap_seed": 0, "agent_model": "gemini-3.1-pro-preview", "held_out_score": null, "criterion_names": ["key_points_captured", "conciseness", "faithful_to_source", "few_shot_format"], "per_criterion_scores": {"key_points_captured": 0.9, "conciseness": 1.0, "faithful_to_source": 0.8, "few_shot_format": 0.3}, "failure_classification": {"category": "semantic_drift", "description": "The experiment likely succeeded (or partially succeeded) in changing the list formatting, but failed to preserve the exact meaning of the 'strict rules'. Even subtle alterations in wording or phrasing during the transformation can change the semantic content, directly violating the explicit constraint 'without changing any semantic content'. The score of 3.0 suggests partial success on the formatting but a critical failure on content integrity.", "fix_direction": "Implement more rigorous semantic comparison checks between the original and transformed content. Ensure the transformation mechanism only alters syntax/formatting and does not rephrase or interpret text. Utilize tools that can highlight semantic differences, not just character-level changes, to ensure the meaning of the 'strict rules' remains perfectly intact.", "confidence": 0.9}, "drafts_generated": 1, "drafts_survived": 1}
{"id": "def0ed00-e1af-4213-bf27-24194d83e563", "target_id": "B2-greedy", "git_sha": "5d4229bb06a1f4b50b7e74de7532c2064266b5b5", "pre_experiment_sha": "5d4229bb06a1f4b50b7e74de7532c2064266b5b5", "timestamp": "2026-04-22T06:11:14.026211+00:00", "hypothesis": "Change the markdown bold syntax from asterisks to underscores to maintain identical semantics while providing a slight structural variation.", "hypothesis_source": "agent", "mutation_diff_summary": "", "score": 3.0, "score_ci_lower": 2.2, "score_ci_upper": 3.8, "raw_scores": [4.0, 3.0, 4.0, 2.0, 2.0], "baseline_score": 3.6, "outcome": "DISCARDED", "failure_mode": null, "duration_seconds": 91.92929012514651, "tags": ["markdown-syntax", "formatting"], "learnings": "{\"what_changed\":\"\",\"what_improved\":[],\"what_regressed\":[],\"transferable_insight\":\"Replacing widely adopted structural conventions with less common alternatives, even when semantically equivalent, often degrades performance.\",\"domain_tags\":[\"Syntax Optimization\",\"Formatting Conventions\",\"Prompt Engineering\"]}", "cost_usd": 0.01290185, "bootstrap_seed": 0, "agent_model": "gemini-3.1-pro-preview", "held_out_score": null, "criterion_names": ["key_points_captured", "conciseness", "faithful_to_source", "few_shot_format"], "per_criterion_scores": {"key_points_captured": 1.0, "conciseness": 1.0, "faithful_to_source": 0.6, "few_shot_format": 0.4}, "failure_classification": {"category": "semantic_drift", "description": "The experiment aimed to change the markdown bold syntax from asterisks (**) to underscores (__) while maintaining identical semantics (rendering as bold). The failure indicates that the new underscore syntax was not correctly interpreted as bold by the system's markdown parser/renderer, resulting in a loss or alteration of the intended meaning. For instance, text enclosed in double underscores might have rendered as plain text or italics instead of bold.", "fix_direction": "Investigate the behavior of the markdown parser/renderer used in the system. Verify if it fully supports '__' for bolding according to standard Markdown or CommonMark specifications, or if there are conflicting rules (e.g., for italics using single underscores). Ensure the parser is configured correctly to interpret '__text__' as bold. If the current parser does not support this syntax, consider enabling a relevant extension or choosing an alternative parser that does.", "confidence": 0.95}, "drafts_generated": 1, "drafts_survived": 1}
