{"id": "6fb750d9-d2f1-4726-aed5-6a0438ddb78c", "target_id": "B2-treatment", "git_sha": "e2d8a666992ba37892ddcef1bdb9ad460086d08d", "pre_experiment_sha": "e2d8a666992ba37892ddcef1bdb9ad460086d08d", "timestamp": "2026-04-24T06:07:29.627078+00:00", "hypothesis": "Refine the system prompt to explicitly emphasize factual accuracy, base its summary entirely on the provided text, and synthesize the information clearly, maintaining a simple, single-paragraph format.", "hypothesis_source": "agent", "mutation_diff_summary": "", "score": 2.6, "score_ci_lower": 2.2, "score_ci_upper": 3.0, "raw_scores": [2.0, 3.0, 3.0, 2.0, 3.0], "baseline_score": 3.1, "outcome": "DISCARDED", "failure_mode": null, "duration_seconds": 61.31380658294074, "tags": ["prompt-engineering", "positive-framing", "accuracy", "synthesis", "single-paragraph"], "learnings": "{\"what_changed\":\"\",\"what_improved\":[],\"what_regressed\":[],\"transferable_insight\":\"Imposing overly strict constraints on both absolute source adherence and rigid formatting simultaneously can degrade model performance by creating conflicting generation goals.\",\"domain_tags\":[\"Prompt Engineering\",\"Constraint Management\"]}", "cost_usd": 0.0154415, "bootstrap_seed": 0, "agent_model": "gemini-3.1-pro-preview", "held_out_score": null, "criterion_names": ["key_points_captured", "conciseness", "faithful_to_source", "few_shot_format"], "per_criterion_scores": {"key_points_captured": 1.0, "conciseness": 1.0, "faithful_to_source": 0.5, "few_shot_format": 0.1}, "failure_classification": {"category": "semantic_drift", "description": "The system likely produced an output that, despite possibly adhering to the specified single-paragraph format, significantly failed on the core semantic requirements of the hypothesis. This includes factual inaccuracies, hallucination (information not based on the provided text), or a poorly synthesized summary that misrepresented the original content, leading to a largely incorrect or misleading meaning.", "fix_direction": "Future attempts should focus on strengthening the prompt's emphasis on content grounding and factual correctness. This could involve more explicit instructions to quote or reference source text, negative constraints against hallucination, or leveraging techniques like chain-of-thought to improve the model's ability to synthesize information accurately and logically from the provided context.", "confidence": 0.9}, "drafts_generated": 1, "drafts_survived": 1}
{"id": "72d3020d-8fcb-4c1b-bea0-5c5f6fdbb325", "target_id": "B2-treatment", "git_sha": "311e0d4fb5ef0246471494d5d29671e4bbc2fec5", "pre_experiment_sha": "e2d8a666992ba37892ddcef1bdb9ad460086d08d", "timestamp": "2026-04-24T06:08:50.220418+00:00", "hypothesis": "Refine the system prompt to explicitly emphasize factual accuracy, base its summary entirely on the provided text, and synthesize the information clearly, maintaining a simple, single-paragraph format.", "hypothesis_source": "agent", "mutation_diff_summary": "", "score": 3.5, "score_ci_lower": 2.7, "score_ci_upper": 4.0, "raw_scores": [4.0, 2.0, 4.0, 4.0, 3.5], "baseline_score": 3.1, "outcome": "KEPT", "failure_mode": null, "duration_seconds": 60.44459179090336, "tags": ["prompt-engineering", "positive-framing", "accuracy", "synthesis", "single-paragraph"], "learnings": "{\"what_changed\":\"\",\"what_improved\":[\"few_shot_format: PASS (was FAIL)\"],\"what_regressed\":[],\"transferable_insight\":\"Explicitly instructing a model to ground its output entirely in the provided text while specifying a strict structural format improves both factual accuracy and format adherence.\",\"domain_tags\":[\"Prompt Engineering\",\"Summarization\",\"Formatting\"]}", "cost_usd": 0.01812365, "bootstrap_seed": 0, "agent_model": "gemini-3.1-pro-preview", "held_out_score": null, "criterion_names": ["key_points_captured", "conciseness", "faithful_to_source", "few_shot_format"], "per_criterion_scores": {"key_points_captured": 1.0, "conciseness": 1.0, "faithful_to_source": 0.8, "few_shot_format": 0.7}, "failure_classification": null, "drafts_generated": 1, "drafts_survived": 1}
