{"id": "6f6a815f-4231-49b9-b94d-c67dbbd0cd34", "target_id": "B2-treatment", "git_sha": "d2ff19b15ca9c2f314ad14360a2f0db267bfa777", "pre_experiment_sha": "d2ff19b15ca9c2f314ad14360a2f0db267bfa777", "timestamp": "2026-04-24T05:11:22.266470+00:00", "hypothesis": "Clean up few-shot examples to remove ungrounded acronyms and extrapolations, ensuring strict faithfulness without adding complex rules to the system prompt.", "hypothesis_source": "agent", "mutation_diff_summary": "", "score": 2.9, "score_ci_lower": 2.1, "score_ci_upper": 3.7, "raw_scores": [2.0, 2.0, 4.0, 2.5, 4.0], "baseline_score": 3.3, "outcome": "DISCARDED", "failure_mode": null, "duration_seconds": 49.840484167216346, "tags": ["few-shot-cleanup", "faithfulness"], "learnings": "{\"what_changed\":\"\",\"what_improved\":[],\"what_regressed\":[],\"transferable_insight\":\"Over-sanitizing few-shot examples to enforce strict faithfulness can degrade performance, as models often rely on the implicit reasoning or contextual leaps present in richer, less rigid examples.\",\"domain_tags\":[\"Few-Shot Prompting\",\"Prompt Engineering\",\"Faithfulness\"]}", "cost_usd": 0.012384850000000001, "bootstrap_seed": 0, "agent_model": "gemini-3.1-pro-preview", "held_out_score": null, "criterion_names": ["key_points_captured", "conciseness", "faithful_to_source", "few_shot_format"], "per_criterion_scores": {"key_points_captured": 1.0, "conciseness": 1.0, "faithful_to_source": 0.5, "few_shot_format": 0.4}, "failure_classification": {"category": "semantic_drift", "description": "The experiment aimed to improve strict faithfulness by cleaning few-shot examples to eliminate ungrounded acronyms and extrapolations. However, the significantly low score of 2.9 indicates that the cleanup failed to address (or potentially exacerbated) the problem of semantic drift, where the model continues to generate outputs that are unfaithful to the source, contain incorrect meanings, or make unwarranted extrapolations.", "fix_direction": "Carefully review the 'cleaned' few-shot examples. It's possible the cleanup inadvertently removed essential context or cues that were preventing semantic drift in the original examples, or introduced new subtle biases. Focus on ensuring each example rigorously demonstrates strict faithfulness and provides clear negative examples or explicit instructions on avoiding ungrounded information, without relying on complex system prompt rules as per the initial hypothesis. Consider iterative, small changes to isolate the impact of each modification.", "confidence": 0.9}, "drafts_generated": 1, "drafts_survived": 1}
{"id": "b0875ba6-c5cd-4469-bc98-cd97963ac57d", "target_id": "B2-treatment", "git_sha": "d2ff19b15ca9c2f314ad14360a2f0db267bfa777", "pre_experiment_sha": "d2ff19b15ca9c2f314ad14360a2f0db267bfa777", "timestamp": "2026-04-24T05:13:00.992353+00:00", "hypothesis": "Remove hallucinated extrapolations from the few-shot examples to encourage strictly faithful summaries formatted as a single concise paragraph.", "hypothesis_source": "agent", "mutation_diff_summary": "", "score": 2.8, "score_ci_lower": 2.1, "score_ci_upper": 3.5, "raw_scores": [2.0, 2.5, 3.5, 2.0, 4.0], "baseline_score": 3.3, "outcome": "DISCARDED", "failure_mode": null, "duration_seconds": 56.82602395815775, "tags": ["few-shot", "hallucination-removal", "formatting"], "learnings": "{\"what_changed\":\"\",\"what_improved\":[],\"what_regressed\":[],\"transferable_insight\":\"Stripping few-shot examples of inferential or extrapolative content to enforce strict literal faithfulness can significantly degrade performance, suggesting that models rely on these richer abstractions to generate coherent outputs.\",\"domain_tags\":[\"Few-Shot Prompting\",\"Summarization\",\"Faithfulness\"]}", "cost_usd": 0.01117225, "bootstrap_seed": 0, "agent_model": "gemini-3.1-pro-preview", "held_out_score": null, "criterion_names": ["key_points_captured", "conciseness", "faithful_to_source", "few_shot_format"], "per_criterion_scores": {"key_points_captured": 1.0, "conciseness": 1.0, "faithful_to_source": 0.5, "few_shot_format": 0.3}, "failure_classification": {"category": "semantic_drift", "description": "Despite the attempt to remove hallucinated extrapolations from few-shot examples, the model failed to produce 'strictly faithful summaries'. The low score indicates that the generated summaries likely still contained 'wrong meaning' through continued hallucinations or inaccuracies, failing to achieve the desired semantic correctness, even if the 'single concise paragraph' format was somewhat adhered to.", "fix_direction": "Focus future efforts on more robust methods to prevent hallucination and ensure factual consistency. This could involve exploring different prompt engineering techniques (e.g., explicit negative constraints, chain-of-thought for fact-checking), using more diverse and carefully curated few-shot examples that highlight faithfulness, or investigating fine-tuning strategies that heavily penalize unfaithful content.", "confidence": 0.85}, "drafts_generated": 1, "drafts_survived": 1}
{"id": "d1eb1e78-8eee-4d16-9019-5480f4b2c019", "target_id": "B2-treatment", "git_sha": "d2ff19b15ca9c2f314ad14360a2f0db267bfa777", "pre_experiment_sha": "d2ff19b15ca9c2f314ad14360a2f0db267bfa777", "timestamp": "2026-04-24T05:14:25.407210+00:00", "hypothesis": "Remove hallucinated extrapolations from the few-shot examples to ensure strict faithfulness and standardize the output format to a single concise paragraph.", "hypothesis_source": "agent", "mutation_diff_summary": "", "score": 3.0, "score_ci_lower": 2.2, "score_ci_upper": 3.8, "raw_scores": [2.0, 3.0, 4.0, 2.0, 4.0], "baseline_score": 3.3, "outcome": "DISCARDED", "failure_mode": null, "duration_seconds": 62.39400862506591, "tags": ["few-shot", "faithfulness", "formatting"], "learnings": "{\"what_changed\":\"\",\"what_improved\":[],\"what_regressed\":[],\"transferable_insight\":\"Over-constraining few-shot examples to enforce strict faithfulness and concise formatting can degrade performance by limiting the model's ability to make useful inferences and adequately structure complex information.\",\"domain_tags\":[\"Few-Shot Prompting\",\"Faithfulness\",\"Output Formatting\"]}", "cost_usd": 0.0122937, "bootstrap_seed": 0, "agent_model": "gemini-3.1-pro-preview", "held_out_score": null, "criterion_names": ["key_points_captured", "conciseness", "faithful_to_source", "few_shot_format"], "per_criterion_scores": {"key_points_captured": 1.0, "conciseness": 1.0, "faithful_to_source": 0.6, "few_shot_format": 0.4}, "failure_classification": {"category": "output_format", "description": "The experiment aimed to standardize the output format to a 'single concise paragraph'. A score of 3.0000 suggests a significant failure, likely indicating that the model struggled to consistently adhere to this strict formatting requirement, producing outputs that were not a single paragraph, not concise, or violated other structural expectations. This formatting failure might have been compounded by or even contributed to issues with content faithfulness (e.g., truncated faithful content or expanded unfaithful content to fit a perceived 'paragraph').", "fix_direction": "Re-evaluate the prompt instructions and few-shot examples to reinforce the 'single concise paragraph' format more explicitly. Provide diverse examples of both successful and unsuccessful attempts at formatting if possible. Consider if the 'concise' requirement conflicts with the 'strict faithfulness' requirement, leading to a trade-off where one goal is sacrificed for the other. It might be beneficial to test the formatting constraint in isolation first, or to simplify the content requirements while focusing on format adherence, then gradually reintroduce faithfulness objectives.", "confidence": 0.9}, "drafts_generated": 1, "drafts_survived": 1}
{"id": "a60cdd39-e4d0-4d8f-8c92-9fbd5321d2ad", "target_id": "B2-treatment", "git_sha": "d2ff19b15ca9c2f314ad14360a2f0db267bfa777", "pre_experiment_sha": "d2ff19b15ca9c2f314ad14360a2f0db267bfa777", "timestamp": "2026-04-24T05:15:55.062502+00:00", "hypothesis": "Remove hallucinated extrapolations from the few-shot examples to model strict faithfulness and maintain a single concise paragraph format.", "hypothesis_source": "agent", "mutation_diff_summary": "", "score": 2.4, "score_ci_lower": 2.1, "score_ci_upper": 2.7, "raw_scores": [2.0, 3.0, 2.5, 2.0, 2.5], "baseline_score": 3.3, "outcome": "DISCARDED", "failure_mode": null, "duration_seconds": 59.477480499772355, "tags": ["few-shot", "format", "faithfulness"], "learnings": "{\"what_changed\":\"\",\"what_improved\":[],\"what_regressed\":[],\"transferable_insight\":\"Stripping inferential extrapolations from few-shot examples to enforce strict faithfulness can severely degrade performance, suggesting that models often rely on these creative expansions to generate the expected output.\",\"domain_tags\":[\"Prompt Engineering\",\"Few-Shot Learning\",\"Model Faithfulness\"]}", "cost_usd": 0.01151865, "bootstrap_seed": 0, "agent_model": "gemini-3.1-pro-preview", "held_out_score": null, "criterion_names": ["key_points_captured", "conciseness", "faithful_to_source", "few_shot_format"], "per_criterion_scores": {"key_points_captured": 1.0, "conciseness": 1.0, "faithful_to_source": 0.4, "few_shot_format": 0.0}, "failure_classification": {"category": "logic_error", "description": "The experiment aimed to model strict faithfulness by removing hallucinated extrapolations from few-shot examples. The low score suggests this intervention failed to prevent the model from exhibiting incorrect reasoning, leading to the generation of ungrounded or fabricated information (hallucinations), thereby failing to achieve the desired strict faithfulness.", "fix_direction": "Re-evaluate the few-shot examples to ensure they effectively guide the model towards strictly faithful reasoning, potentially by including diverse examples demonstrating both faithful generation and examples highlighting what *not* to do. Consider augmenting few-shot examples with explicit instructions, chain-of-thought prompting, or external knowledge grounding mechanisms to robustly mitigate hallucination.", "confidence": 0.8}, "drafts_generated": 1, "drafts_survived": 1}
{"id": "f7e008cc-5988-4e54-bc1d-94db0620e860", "target_id": "B2-treatment", "git_sha": "611b2371313f7172eec6e7e809d44f1735b9e841", "pre_experiment_sha": "d2ff19b15ca9c2f314ad14360a2f0db267bfa777", "timestamp": "2026-04-24T05:17:32.119317+00:00", "hypothesis": "Replaced negative constraints with positive instructions to capture the core message accurately, simplified the formatting requirement to a single paragraph, and removed specific acronyms from the examples to prevent semantic drift.", "hypothesis_source": "agent", "mutation_diff_summary": "", "score": 2.7, "score_ci_lower": 2.1, "score_ci_upper": 3.4, "raw_scores": [3.0, 2.5, 2.0, 4.0, 2.0], "baseline_score": 3.3, "outcome": "KEPT", "failure_mode": null, "duration_seconds": 54.1973652089946, "tags": ["prompt-engineering", "positive-framing", "acronym-removal", "formatting-simplification"], "learnings": "{\"what_changed\":\"\",\"what_improved\":[],\"what_regressed\":[],\"transferable_insight\":\"Framing constraints as positive instructions and generalizing examples by removing overly specific terms helps prevent semantic drift and improves overall task accuracy.\",\"domain_tags\":[\"Prompt Engineering\",\"Instruction Design\"]}", "cost_usd": 0.01111955, "bootstrap_seed": 0, "agent_model": "gemini-3.1-pro-preview", "held_out_score": null, "criterion_names": ["key_points_captured", "conciseness", "faithful_to_source", "few_shot_format"], "per_criterion_scores": {"key_points_captured": 1.0, "conciseness": 1.0, "faithful_to_source": 0.4, "few_shot_format": 0.3}, "failure_classification": null, "drafts_generated": 1, "drafts_survived": 1}
{"id": "c047ce1f-5a11-4efd-8ff9-5a1111fe2811", "target_id": "B2-treatment", "git_sha": "345c63fab032cac2c29e91639b66ce8e26bb844c", "pre_experiment_sha": "611b2371313f7172eec6e7e809d44f1735b9e841", "timestamp": "2026-04-24T05:18:41.456645+00:00", "hypothesis": "Refining the system prompt to emphasize positive inclusion and a single, well-written paragraph format without using negative constraints.", "hypothesis_source": "agent", "mutation_diff_summary": "", "score": 2.5, "score_ci_lower": 1.8, "score_ci_upper": 3.4, "raw_scores": [4.0, 3.0, 2.0, 2.0, 1.5], "baseline_score": 2.7, "outcome": "KEPT", "failure_mode": null, "duration_seconds": 60.557279834058136, "tags": ["prompt-engineering", "positive-inclusion", "formatting"], "learnings": "{\"what_changed\":\"\",\"what_improved\":[],\"what_regressed\":[],\"transferable_insight\":\"Framing instructions around positive inclusion and specific structural requirements, rather than relying on negative constraints, improves overall compliance and output quality.\",\"domain_tags\":[\"Prompt Engineering\",\"Instruction Design\",\"Behavioral Framing\"]}", "cost_usd": 0.011312000000000001, "bootstrap_seed": 0, "agent_model": "gemini-3.1-pro-preview", "held_out_score": null, "criterion_names": ["key_points_captured", "conciseness", "faithful_to_source", "few_shot_format"], "per_criterion_scores": {"key_points_captured": 0.9, "conciseness": 1.0, "faithful_to_source": 0.4, "few_shot_format": 0.2}, "failure_classification": null, "drafts_generated": 1, "drafts_survived": 1}
{"id": "48d3fd6d-5ee9-4180-8b0e-24a5d58e3ee2", "target_id": "B2-treatment", "git_sha": "885047b818608cb854dd5405b693a13e43a06821", "pre_experiment_sha": "345c63fab032cac2c29e91639b66ce8e26bb844c", "timestamp": "2026-04-24T05:19:57.950855+00:00", "hypothesis": "Refining the few-shot examples to demonstrate better synthesis rather than sentence-by-sentence rewrites, and streamlining the system prompt to use purely positive instructions for accuracy and clarity.", "hypothesis_source": "agent", "mutation_diff_summary": "", "score": 2.7, "score_ci_lower": 2.1, "score_ci_upper": 3.4, "raw_scores": [2.0, 2.0, 4.0, 3.0, 2.5], "baseline_score": 2.5, "outcome": "KEPT", "failure_mode": null, "duration_seconds": 69.69774020905606, "tags": ["positive-constraints", "synthesis", "few-shot-refinement"], "learnings": "{\"what_changed\":\"\",\"what_improved\":[],\"what_regressed\":[],\"transferable_insight\":\"Guiding models with purely positive instructions and few-shot examples that demonstrate holistic synthesis rather than piecemeal rewriting significantly enhances output quality and clarity.\",\"domain_tags\":[\"Prompt Engineering\",\"Few-Shot Prompting\",\"Instruction Design\"]}", "cost_usd": 0.0113568, "bootstrap_seed": 0, "agent_model": "gemini-3.1-pro-preview", "held_out_score": null, "criterion_names": ["key_points_captured", "conciseness", "faithful_to_source", "few_shot_format"], "per_criterion_scores": {"key_points_captured": 1.0, "conciseness": 1.0, "faithful_to_source": 0.5, "few_shot_format": 0.2}, "failure_classification": null, "drafts_generated": 1, "drafts_survived": 1}
{"id": "07df270d-cd4b-4d90-b186-de35e11c9164", "target_id": "B2-treatment", "git_sha": "d783c2d542ee57718c9ef34fabbdf6b9bc2f21a1", "pre_experiment_sha": "885047b818608cb854dd5405b693a13e43a06821", "timestamp": "2026-04-24T05:21:24.088999+00:00", "hypothesis": "Refine few-shot examples to demonstrate fluid synthesis and add positive instructions to synthesize the information, keeping the prompt streamlined and avoiding negative constraints.", "hypothesis_source": "agent", "mutation_diff_summary": "", "score": 3.0, "score_ci_lower": 2.2, "score_ci_upper": 3.8, "raw_scores": [2.0, 4.0, 2.0, 4.0, 3.0], "baseline_score": 2.7, "outcome": "KEPT", "failure_mode": null, "duration_seconds": 68.44968133396469, "tags": ["few-shot", "positive-instructions", "synthesis", "formatting"], "learnings": "{\"what_changed\":\"\",\"what_improved\":[],\"what_regressed\":[],\"transferable_insight\":\"Guiding models with positive instructions and high-quality few-shot examples demonstrating fluid synthesis is more effective than relying on negative constraints and overly complex prompts.\",\"domain_tags\":[\"Prompt Engineering\",\"Few-Shot Learning\"]}", "cost_usd": 0.012678600000000002, "bootstrap_seed": 0, "agent_model": "gemini-3.1-pro-preview", "held_out_score": null, "criterion_names": ["key_points_captured", "conciseness", "faithful_to_source", "few_shot_format"], "per_criterion_scores": {"key_points_captured": 1.0, "conciseness": 1.0, "faithful_to_source": 0.6, "few_shot_format": 0.4}, "failure_classification": null, "drafts_generated": 1, "drafts_survived": 1}
{"id": "693bc6f7-f4b9-4bbe-bc09-7c0c4048aa9f", "target_id": "B2-treatment", "git_sha": "de43de8ae3cd0e16f963541996b123c350a6b7b5", "pre_experiment_sha": "d783c2d542ee57718c9ef34fabbdf6b9bc2f21a1", "timestamp": "2026-04-24T05:22:31.883718+00:00", "hypothesis": "Refine the few-shot examples to demonstrate more fluid synthesis and accurate core message capture while maintaining a purely positive, streamlined system prompt.", "hypothesis_source": "agent", "mutation_diff_summary": "", "score": 3.2, "score_ci_lower": 2.5, "score_ci_upper": 3.9, "raw_scores": [4.0, 2.5, 2.0, 3.5, 4.0], "baseline_score": 3.0, "outcome": "KEPT", "failure_mode": null, "duration_seconds": 61.02686258289032, "tags": ["few-shot", "synthesis", "positive-instructions"], "learnings": "{\"what_changed\":\"\",\"what_improved\":[],\"what_regressed\":[],\"transferable_insight\":\"Upgrading few-shot examples to model fluid synthesis and accurate core message extraction, paired with a concise and positively-framed system prompt, significantly improves output quality.\",\"domain_tags\":[\"Few-Shot Prompting\",\"Prompt Engineering\",\"System Prompt Optimization\"]}", "cost_usd": 0.012719250000000001, "bootstrap_seed": 0, "agent_model": "gemini-3.1-pro-preview", "held_out_score": null, "criterion_names": ["key_points_captured", "conciseness", "faithful_to_source", "few_shot_format"], "per_criterion_scores": {"key_points_captured": 1.0, "conciseness": 1.0, "faithful_to_source": 0.7, "few_shot_format": 0.5}, "failure_classification": null, "drafts_generated": 1, "drafts_survived": 1}
{"id": "cfe361bf-382f-4bfb-9bda-cf42a1eabec5", "target_id": "B2-treatment", "git_sha": "a6d69cc3acf181da5fdc7300680b61cb046df95e", "pre_experiment_sha": "de43de8ae3cd0e16f963541996b123c350a6b7b5", "timestamp": "2026-04-24T05:23:35.655519+00:00", "hypothesis": "Refine the few-shot examples to demonstrate more fluid synthesis and accurate core message capture without relying on sentence-by-sentence rewrites, while keeping the system prompt purely positive and streamlined.", "hypothesis_source": "agent", "mutation_diff_summary": "", "score": 2.9, "score_ci_lower": 2.4, "score_ci_upper": 3.5, "raw_scores": [3.0, 3.0, 4.0, 2.0, 2.5], "baseline_score": 3.2, "outcome": "KEPT", "failure_mode": null, "duration_seconds": 57.34496354078874, "tags": ["few-shot-refinement", "positive-instructions", "fluid-synthesis"], "learnings": "{\"what_changed\":\"\",\"what_improved\":[],\"what_regressed\":[],\"transferable_insight\":\"Providing few-shot examples that model fluid synthesis alongside purely positive system instructions effectively guides models to capture core messages without resorting to rigid, literal rewrites.\",\"domain_tags\":[\"Prompt Engineering\",\"Few-Shot Learning\"]}", "cost_usd": 0.01208195, "bootstrap_seed": 0, "agent_model": "gemini-3.1-pro-preview", "held_out_score": null, "criterion_names": ["key_points_captured", "conciseness", "faithful_to_source", "few_shot_format"], "per_criterion_scores": {"key_points_captured": 1.0, "conciseness": 1.0, "faithful_to_source": 0.7, "few_shot_format": 0.2}, "failure_classification": null, "drafts_generated": 1, "drafts_survived": 1}
{"id": "39780d6a-8476-44e0-aab7-629a910a69e0", "target_id": "B2-treatment", "git_sha": "b4e85770d78729cf86475c790414b56441406f48", "pre_experiment_sha": "a6d69cc3acf181da5fdc7300680b61cb046df95e", "timestamp": "2026-04-24T05:24:58.393558+00:00", "hypothesis": "Refine the few-shot examples for more fluid synthesis and simplify the system prompt to use purely positive instructions.", "hypothesis_source": "agent", "mutation_diff_summary": "", "score": 2.6, "score_ci_lower": 2.2, "score_ci_upper": 3.0, "raw_scores": [3.0, 3.0, 2.0, 3.0, 2.0], "baseline_score": 2.9, "outcome": "KEPT", "failure_mode": null, "duration_seconds": 63.55869804089889, "tags": ["positive-instructions", "fluid-synthesis", "formatting", "prompt-simplification"], "learnings": "{\"what_changed\":\"\",\"what_improved\":[],\"what_regressed\":[],\"transferable_insight\":\"Framing instructions positively to focus on desired behaviors, combined with high-quality examples, enhances the fluidity and effectiveness of generated outputs.\",\"domain_tags\":[\"Prompt Engineering\",\"Few-Shot Learning\",\"System Prompts\"]}", "cost_usd": 0.0118919, "bootstrap_seed": 0, "agent_model": "gemini-3.1-pro-preview", "held_out_score": null, "criterion_names": ["key_points_captured", "conciseness", "faithful_to_source", "few_shot_format"], "per_criterion_scores": {"key_points_captured": 1.0, "conciseness": 1.0, "faithful_to_source": 0.4, "few_shot_format": 0.2}, "failure_classification": null, "drafts_generated": 1, "drafts_survived": 1}
