{"id": "186fb15b-c5f1-4eca-9d3b-9043e03a0761", "target_id": "B2-treatment", "git_sha": "d2ff19b15ca9c2f314ad14360a2f0db267bfa777", "pre_experiment_sha": "98720ed81b388f89159675b9a957acbab5e8f23e", "timestamp": "2026-04-24T04:59:17.152431+00:00", "hypothesis": "Remove hallucinated extrapolations from the few-shot examples and standardize the output format to a single concise paragraph to teach the model to generate strictly faithful and consistently formatted summaries.", "hypothesis_source": "agent", "mutation_diff_summary": "", "score": 3.3, "score_ci_lower": 2.6, "score_ci_upper": 3.8, "raw_scores": [3.5, 3.5, 3.5, 2.0, 4.0], "baseline_score": 0.0, "outcome": "KEPT", "failure_mode": null, "duration_seconds": 57.5242205420509, "tags": ["prompt-engineering", "hallucination-prevention", "few-shot-correction", "format-consistency"], "learnings": "{\"what_changed\":\"\",\"what_improved\":[],\"what_regressed\":[],\"transferable_insight\":\"Removing ungrounded extrapolations and standardizing the format of few-shot examples teaches the model to generate strictly faithful and consistently structured outputs.\",\"domain_tags\":[\"Few-Shot Prompting\",\"Hallucination Mitigation\",\"Output Formatting\"]}", "cost_usd": 0.013117100000000001, "bootstrap_seed": 0, "agent_model": "gemini-3.1-pro-preview", "held_out_score": null, "criterion_names": ["key_points_captured", "conciseness", "faithful_to_source", "few_shot_format"], "per_criterion_scores": {"key_points_captured": 1.0, "conciseness": 1.0, "faithful_to_source": 0.8, "few_shot_format": 0.5}, "failure_classification": null, "drafts_generated": 1, "drafts_survived": 1}
{"id": "d5bfbc67-5c85-42e0-b94a-cb04df963b1a", "target_id": "B2-treatment", "git_sha": "d2ff19b15ca9c2f314ad14360a2f0db267bfa777", "pre_experiment_sha": "d2ff19b15ca9c2f314ad14360a2f0db267bfa777", "timestamp": "2026-04-24T05:00:23.874591+00:00", "hypothesis": "Restructure the prompt to explicitly highlight constraints using bullet points and refine the few-shot examples to be more synthesized and concise rather than sentence-by-sentence rewrites.", "hypothesis_source": "agent", "mutation_diff_summary": "", "score": 3.1, "score_ci_lower": 2.5, "score_ci_upper": 3.6, "raw_scores": [4.0, 3.5, 3.0, 2.0, 3.0], "baseline_score": 3.3, "outcome": "DISCARDED", "failure_mode": null, "duration_seconds": 60.228090291144326, "tags": ["prompt-engineering", "constraint-highlighting", "few-shot-refinement"], "learnings": "{\"what_changed\":\"\",\"what_improved\":[],\"what_regressed\":[],\"transferable_insight\":\"Over-synthesizing few-shot examples at the expense of detailed, step-by-step demonstrations can degrade model performance, even when task constraints are explicitly formatted.\",\"domain_tags\":[\"Prompt Engineering\",\"Few-Shot Learning\",\"Instruction Formatting\"]}", "cost_usd": 0.013016500000000002, "bootstrap_seed": 0, "agent_model": "gemini-3.1-pro-preview", "held_out_score": null, "criterion_names": ["key_points_captured", "conciseness", "faithful_to_source", "few_shot_format"], "per_criterion_scores": {"key_points_captured": 0.9, "conciseness": 1.0, "faithful_to_source": 0.8, "few_shot_format": 0.4}, "failure_classification": {"category": "semantic_drift", "description": "The experiment's attempt to improve prompt clarity by explicitly highlighting constraints with bullet points and refining few-shot examples to be more synthesized and concise inadvertently misled the model. The new structure or examples likely caused the model to misinterpret the core requirements or the desired semantic content, leading to outputs that, while potentially structurally valid, significantly diverged in meaning or intent from the expected outcome, resulting in a very low score (3.1). The conciseness of examples may have stripped away crucial contextual nuances.", "fix_direction": "Thoroughly analyze the outputs generated post-change to identify specific semantic misinterpretations. Re-evaluate the few-shot examples: test if they became *too* concise, losing vital context, or if the synthesis introduced unintended patterns. Isolate the impact of the bullet-point constraints to ensure they are interpreted as intended and do not introduce new ambiguities or misdirections. Consider a gradual approach to example refinement, ensuring critical semantic information is preserved.", "confidence": 0.9}, "drafts_generated": 1, "drafts_survived": 1}
{"id": "2550481a-7776-4c35-b205-31f27ec50820", "target_id": "B2-treatment", "git_sha": "d2ff19b15ca9c2f314ad14360a2f0db267bfa777", "pre_experiment_sha": "d2ff19b15ca9c2f314ad14360a2f0db267bfa777", "timestamp": "2026-04-24T05:01:53.574994+00:00", "hypothesis": "Enhance the system prompt with explicit critical rules and rewrite the few-shot examples to be significantly more concise, ensuring the model outputs a single, dense paragraph that captures only the essential points without hallucination.", "hypothesis_source": "agent", "mutation_diff_summary": "", "score": 2.7, "score_ci_lower": 2.0, "score_ci_upper": 3.5, "raw_scores": [2.0, 3.5, 4.0, 2.0, 2.0], "baseline_score": 3.3, "outcome": "DISCARDED", "failure_mode": null, "duration_seconds": 61.29894187487662, "tags": ["prompt-engineering", "few-shot-optimization", "conciseness"], "learnings": "{\"what_changed\":\"\",\"what_improved\":[],\"what_regressed\":[],\"transferable_insight\":\"Over-compressing few-shot examples to force highly dense outputs can degrade performance, indicating that models require sufficient structural context to effectively apply complex rules.\",\"domain_tags\":[\"Prompt Engineering\",\"Few-Shot Prompting\",\"Output Formatting\"]}", "cost_usd": 0.01146155, "bootstrap_seed": 0, "agent_model": "gemini-3.1-pro-preview", "held_out_score": null, "criterion_names": ["key_points_captured", "conciseness", "faithful_to_source", "few_shot_format"], "per_criterion_scores": {"key_points_captured": 1.0, "conciseness": 1.0, "faithful_to_source": 0.4, "few_shot_format": 0.3}, "failure_classification": {"category": "output_format", "description": "The experiment explicitly aimed to ensure the model outputs 'a single, dense paragraph.' The low score suggests a failure to consistently adhere to this structural requirement, meaning the model likely produced outputs that were not a single paragraph, not dense, or included elements like bullet points or multiple distinct sections, thereby violating the intended output format.", "fix_direction": "Refine the system prompt to provide even more explicit and unambiguous instructions for the desired single-paragraph, dense format. Consider adding negative constraints (e.g., 'DO NOT use bullet points,' 'DO NOT create new paragraphs') and significantly enhance the few-shot examples to perfectly model the exact structure and density required. If parsing is involved, ensure the output consistently adheres to a parsable single paragraph.", "confidence": 0.9}, "drafts_generated": 1, "drafts_survived": 1}
{"id": "a2110200-1b78-4139-97ff-d2ff62ed7e06", "target_id": "B2-treatment", "git_sha": "d2ff19b15ca9c2f314ad14360a2f0db267bfa777", "pre_experiment_sha": "d2ff19b15ca9c2f314ad14360a2f0db267bfa777", "timestamp": "2026-04-24T05:03:53.133098+00:00", "hypothesis": "Refining the few-shot examples to use strict sentence-by-sentence rewrites without over-synthesizing or introducing ungrounded acronyms like RLHF or NSF to improve strict faithfulness and semantic alignment.", "hypothesis_source": "agent", "mutation_diff_summary": "", "score": 3.3, "score_ci_lower": 2.6, "score_ci_upper": 3.9, "raw_scores": [2.0, 3.0, 3.5, 4.0, 4.0], "baseline_score": 3.3, "outcome": "DISCARDED", "failure_mode": null, "duration_seconds": 84.22781733283773, "tags": ["summarization", "few-shot", "faithfulness", "formatting"], "learnings": "{\"what_changed\":\"\",\"what_improved\":[],\"what_regressed\":[],\"transferable_insight\":\"Restricting few-shot demonstrations to strict, sentence-by-sentence mappings to prevent hallucinated terminology does not necessarily yield measurable improvements in output faithfulness.\",\"domain_tags\":[\"Prompt Engineering\",\"Few-Shot Learning\",\"Faithfulness\"]}", "cost_usd": 0.0131725, "bootstrap_seed": 0, "agent_model": "gemini-3.1-pro-preview", "held_out_score": null, "criterion_names": ["key_points_captured", "conciseness", "faithful_to_source", "few_shot_format"], "per_criterion_scores": {"key_points_captured": 1.0, "conciseness": 1.0, "faithful_to_source": 0.8, "few_shot_format": 0.5}, "failure_classification": {"category": "semantic_drift", "description": "The experiment aimed to improve strict faithfulness and semantic alignment by refining few-shot examples to use strict sentence-by-sentence rewrites and avoid over-synthesizing or introducing ungrounded information. A failure (score 3.3) indicates that despite these efforts, the model's outputs likely still deviated in meaning or accuracy from the source, failing to achieve the desired level of semantic alignment, or perhaps introducing new forms of unfaithfulness due to the rigid rewriting approach.", "fix_direction": "Re-evaluate the balance between strict fidelity and natural language generation. While aiming for faithfulness, ensure the rewrites don't inadvertently strip away crucial context or nuance that leads to semantic degradation. Consider methodologies that prioritize semantic preservation over strictly syntactic rewriting, or explore how to guide the model towards accurate synthesis rather than just strict one-to-one transformation, especially when dealing with complex information or potential acronym usage. It might also be beneficial to analyze specific failure cases to understand if the 'strictness' itself caused new forms of semantic drift.", "confidence": 0.9}, "drafts_generated": 1, "drafts_survived": 1}
{"id": "28535060-a1d1-4329-9f1d-b3435f517005", "target_id": "B2-treatment", "git_sha": "d2ff19b15ca9c2f314ad14360a2f0db267bfa777", "pre_experiment_sha": "d2ff19b15ca9c2f314ad14360a2f0db267bfa777", "timestamp": "2026-04-24T05:05:20.588040+00:00", "hypothesis": "Clean up few-shot examples to strictly follow sentence-by-sentence rewrites, removing ungrounded acronyms like RLHF and NSF to teach strict faithfulness and avoid semantic drift.", "hypothesis_source": "agent", "mutation_diff_summary": "", "score": 3.1, "score_ci_lower": 2.4, "score_ci_upper": 3.8, "raw_scores": [2.0, 4.0, 4.0, 2.5, 3.0], "baseline_score": 3.3, "outcome": "DISCARDED", "failure_mode": null, "duration_seconds": 71.08785587502643, "tags": ["summarization", "few-shot", "faithfulness", "alignment"], "learnings": "{\"what_changed\":\"\",\"what_improved\":[],\"what_regressed\":[],\"transferable_insight\":\"Over-constraining few-shot examples to strict sentence-by-sentence alignments and removing common implicit terms can degrade performance, indicating that models benefit from structural flexibility rather than rigid literalness.\",\"domain_tags\":[\"Prompt Engineering\",\"Few-Shot Learning\",\"Text Generation\"]}", "cost_usd": 0.013497600000000004, "bootstrap_seed": 0, "agent_model": "gemini-3.1-pro-preview", "held_out_score": null, "criterion_names": ["key_points_captured", "conciseness", "faithful_to_source", "few_shot_format"], "per_criterion_scores": {"key_points_captured": 1.0, "conciseness": 1.0, "faithful_to_source": 0.7, "few_shot_format": 0.4}, "failure_classification": {"category": "semantic_drift", "description": "The experiment explicitly aimed to 'teach strict faithfulness and avoid semantic drift' by cleaning few-shot examples. A failure, indicated by a low score of 3.1, strongly suggests that despite these efforts, the model still produced outputs with incorrect meaning or deviated semantically from the source, failing to achieve the intended faithfulness.", "fix_direction": "Investigate the specific nature of the semantic drift. Are the cleaned examples insufficient, or is the model still misinterpreting context or core concepts? Consider introducing more explicit negative constraints or examples that demonstrate what *not* to do, or explore alternative methods to reinforce faithfulness beyond just example cleanup, such as fine-tuning with a specific loss function for semantic similarity.", "confidence": 0.95}, "drafts_generated": 1, "drafts_survived": 1}
{"id": "f09eee88-3548-47f7-a797-8b563d467090", "target_id": "B2-treatment", "git_sha": "d2ff19b15ca9c2f314ad14360a2f0db267bfa777", "pre_experiment_sha": "d2ff19b15ca9c2f314ad14360a2f0db267bfa777", "timestamp": "2026-04-24T05:07:07.390214+00:00", "hypothesis": "Refine few-shot examples to be strict sentence-by-sentence rewrites of the source text, removing all hallucinated extrapolations and over-synthesized details, while simplifying the output format instruction to a \"single concise paragraph\".", "hypothesis_source": "agent", "mutation_diff_summary": "", "score": 2.4, "score_ci_lower": 2.0, "score_ci_upper": 3.2, "raw_scores": [2.0, 2.0, 2.0, 2.0, 4.0], "baseline_score": 3.3, "outcome": "DISCARDED", "failure_mode": null, "duration_seconds": 91.20405154209584, "tags": ["few-shot-optimization", "strict-faithfulness", "format-simplification"], "learnings": "{\"what_changed\":\"\",\"what_improved\":[],\"what_regressed\":[],\"transferable_insight\":\"Restricting models to strict sentence-by-sentence rewrites rather than allowing them to synthesize and restructure information significantly degrades the quality of concise outputs.\",\"domain_tags\":[\"Prompt Engineering\",\"Few-Shot Learning\",\"Text Summarization\"]}", "cost_usd": 0.011808700000000002, "bootstrap_seed": 0, "agent_model": "gemini-3.1-pro-preview", "held_out_score": null, "criterion_names": ["key_points_captured", "conciseness", "faithful_to_source", "few_shot_format"], "per_criterion_scores": {"key_points_captured": 1.0, "conciseness": 1.0, "faithful_to_source": 0.2, "few_shot_format": 0.2}, "failure_classification": {"category": "semantic_drift", "description": "The experiment aimed to improve semantic fidelity by making outputs strict sentence-by-sentence rewrites and eliminating hallucinations. However, simplifying the output format instruction to a 'single concise paragraph' likely introduced a conflict with these strict content constraints. The low score suggests the model may have prioritized conciseness over accuracy or completeness, resulting in outputs that distorted the original meaning, contained new inaccuracies (despite the goal to remove them), or over-synthesized information to fit the single-paragraph format, leading to a significant loss of semantic fidelity.", "fix_direction": "Investigate the inherent tension between the goal of 'strict sentence-by-sentence rewrites' (which implies retaining detail and accuracy) and the 'single concise paragraph' format (which implies brevity and synthesis). If these goals are in conflict for the given task or source text complexity, either relax the conciseness requirement, or provide more granular few-shot examples demonstrating how to achieve both fidelity and conciseness without compromising meaning. Consider a two-step process: first, ensure a strict, accurate rewrite, then second, condense that into a concise paragraph.", "confidence": 0.95}, "drafts_generated": 1, "drafts_survived": 1}
{"id": "e6bf7804-3bdb-4415-a84f-8ef690f1dcd6", "target_id": "B2-treatment", "git_sha": "d2ff19b15ca9c2f314ad14360a2f0db267bfa777", "pre_experiment_sha": "d2ff19b15ca9c2f314ad14360a2f0db267bfa777", "timestamp": "2026-04-24T05:08:49.684370+00:00", "hypothesis": "Remove ungrounded acronyms and details from few-shot examples to teach strict faithfulness, and simplify the formatting instruction to \"single concise paragraph\".", "hypothesis_source": "agent", "mutation_diff_summary": "", "score": 2.8, "score_ci_lower": 2.0, "score_ci_upper": 3.6, "raw_scores": [2.0, 4.0, 4.0, 2.0, 2.0], "baseline_score": 3.3, "outcome": "DISCARDED", "failure_mode": null, "duration_seconds": 63.77133912499994, "tags": ["few-shot-cleanup", "faithfulness", "formatting-simplification"], "learnings": "{\"what_changed\":\"\",\"what_improved\":[],\"what_regressed\":[],\"transferable_insight\":\"Stripping few-shot examples of nuanced details to enforce strict faithfulness and over-simplifying formatting instructions can degrade performance by depriving the model of necessary structural and contextual cues.\",\"domain_tags\":[\"Prompt Engineering\",\"Few-Shot Learning\",\"Instruction Tuning\"]}", "cost_usd": 0.012370850000000001, "bootstrap_seed": 0, "agent_model": "gemini-3.1-pro-preview", "held_out_score": null, "criterion_names": ["key_points_captured", "conciseness", "faithful_to_source", "few_shot_format"], "per_criterion_scores": {"key_points_captured": 1.0, "conciseness": 1.0, "faithful_to_source": 0.4, "few_shot_format": 0.4}, "failure_classification": {"category": "semantic_drift", "description": "The experiment aimed to teach strict faithfulness by removing ungrounded acronyms and details from few-shot examples. A low score suggests that despite these changes, the model likely continued to generate ungrounded, inaccurate, or non-faithful information. This indicates a failure to align the output's meaning with the input's constraints, even if the simplified output format instruction ('single concise paragraph') might have been partially followed.", "fix_direction": "Further refine few-shot examples with a stronger emphasis on negative examples that explicitly demonstrate what constitutes 'ungrounded' information. Consider a multi-shot approach to specifically address grounding and faithfulness. Strengthen the system prompt with explicit instructions to only use provided information and avoid external knowledge or assumptions. Evaluate if the 'single concise paragraph' constraint inadvertently leads to information loss or difficulty in fully grounding details, and adjust accordingly.", "confidence": 0.8}, "drafts_generated": 1, "drafts_survived": 1}
{"id": "84ccf19b-8304-4c36-95b1-d3100a6de572", "target_id": "B2-treatment", "git_sha": "d2ff19b15ca9c2f314ad14360a2f0db267bfa777", "pre_experiment_sha": "d2ff19b15ca9c2f314ad14360a2f0db267bfa777", "timestamp": "2026-04-24T05:10:14.848594+00:00", "hypothesis": "Clean up the few-shot examples to remove ungrounded acronyms and extrapolations (e.g., replacing RLHF and NSF with their full terms from the text) to implicitly teach strict faithfulness without adding complex constraints.", "hypothesis_source": "agent", "mutation_diff_summary": "", "score": 3.1, "score_ci_lower": 2.4, "score_ci_upper": 3.8, "raw_scores": [2.0, 4.0, 3.0, 2.5, 4.0], "baseline_score": 3.3, "outcome": "DISCARDED", "failure_mode": null, "duration_seconds": 56.84682120801881, "tags": ["few-shot", "faithfulness", "simplification"], "learnings": "{\"what_changed\":\"\",\"what_improved\":[],\"what_regressed\":[],\"transferable_insight\":\"Removing common acronyms and minor extrapolations from few-shot examples to implicitly enforce strict faithfulness can degrade performance, suggesting that overly rigid examples may restrict the model's natural generation capabilities.\",\"domain_tags\":[\"Few-Shot Prompting\",\"Faithfulness\",\"Prompt Engineering\"]}", "cost_usd": 0.01327725, "bootstrap_seed": 0, "agent_model": "gemini-3.1-pro-preview", "held_out_score": null, "criterion_names": ["key_points_captured", "conciseness", "faithful_to_source", "few_shot_format"], "per_criterion_scores": {"key_points_captured": 1.0, "conciseness": 1.0, "faithful_to_source": 0.6, "few_shot_format": 0.5}, "failure_classification": {"category": "semantic_drift", "description": "The experiment aimed to improve 'strict faithfulness' by cleaning up few-shot examples (replacing acronyms with full terms). The very low score (3.1) indicates a significant failure, suggesting that the model's output diverged substantially in meaning or accuracy from the desired faithful generation. Instead of becoming more faithful, the outputs likely became less precise, less relevant, or simply incorrect in their semantic content, despite potentially maintaining correct syntax.", "fix_direction": "Re-evaluate the implicit assumption that expanding acronyms and extrapolations automatically improves faithfulness. It's possible the model was leveraging acronyms as condensed semantic tokens, and their expansion disrupted this understanding. Future attempts could explore: 1) providing both the acronym and its definition, 2) selectively cleaning only *truly ungrounded* terms while retaining commonly understood or contextually defined acronyms, or 3) using explicit faithfulness constraints rather than relying solely on implicit teaching through text manipulation.", "confidence": 0.9}, "drafts_generated": 1, "drafts_survived": 1}
