{"id": "47d1b574-c69c-481d-a512-abf9b53ca918", "target_id": "B2-treatment", "git_sha": "bc806fa72adb1600afb44062f15ea3dc30a58739", "pre_experiment_sha": "bc806fa72adb1600afb44062f15ea3dc30a58739", "timestamp": "2026-04-19T18:00:58.874955+00:00", "hypothesis": "Make the instruction more explicit that the summary must be a short, factual 2\u20134 sentence output containing only the most relevant facts.", "hypothesis_source": "agent", "mutation_diff_summary": "", "score": 1.7, "score_ci_lower": 1.0, "score_ci_upper": 2.4, "raw_scores": [3.0, 1.5, 1.5, 0.5, 2.0], "baseline_score": 2.3, "outcome": "DISCARDED", "failure_mode": null, "duration_seconds": 18.36928025004454, "tags": ["summarization", "brevity", "factuality", "format-control"], "learnings": "{\"what_changed\":\"\",\"what_improved\":[],\"what_regressed\":[],\"transferable_insight\":\"Making a requirement more explicit does not guarantee better results if the added constraint is not aligned with the task or model behavior.\",\"domain_tags\":[\"prompt-engineering\",\"evaluation\",\"instruction-design\"]}", "cost_usd": 0.018026149999999998, "bootstrap_seed": 0, "agent_model": "gpt-5.4", "held_out_score": null, "criterion_names": ["key_points_captured", "conciseness", "faithful_to_source", "few_shot_format"], "per_criterion_scores": {"key_points_captured": 0.8, "conciseness": 0.5, "faithful_to_source": 0.2, "few_shot_format": 0.2}, "failure_classification": {"category": "output_format", "description": "The experiment score is very low (1.7), and the hypothesis focuses on making the summary instruction more explicit about producing a short, factual 2\u20134 sentence output containing only relevant facts. This strongly suggests the failure was that the output did not follow the required structure/length or included disallowed/extra content rather than a reasoning/semantic issue.", "fix_direction": "Tighten and enforce the output schema/constraints: explicitly require exactly 2\u20134 sentences, a factual tone, and prohibition of additional commentary; add an explicit checklist and/or validation step to reject outputs that violate length or include non-factual or irrelevant details.", "confidence": 0.72}, "drafts_generated": 1, "drafts_survived": 1}
{"id": "12ccfd91-5c44-49c5-8ed0-bde29a438ad3", "target_id": "B2-treatment", "git_sha": "bc806fa72adb1600afb44062f15ea3dc30a58739", "pre_experiment_sha": "bc806fa72adb1600afb44062f15ea3dc30a58739", "timestamp": "2026-04-19T18:01:19.166320+00:00", "hypothesis": "Tightening the instruction to exactly 2\u20134 factual sentences focused only on the main topic, key event/result, and essential specifics will improve binary-criteria adherence.", "hypothesis_source": "agent", "mutation_diff_summary": "", "score": 1.5, "score_ci_lower": 1.1, "score_ci_upper": 1.9, "raw_scores": [2.0, 2.0, 1.0, 1.5, 1.0], "baseline_score": 2.3, "outcome": "DISCARDED", "failure_mode": null, "duration_seconds": 17.231878750026226, "tags": ["summarization", "concise", "format-control", "factuality"], "learnings": "{\"what_changed\":\"\",\"what_improved\":[],\"what_regressed\":[],\"transferable_insight\":\"When a task is governed by binary criteria, making the instruction narrowly specific and constraining the output format can improve compliance by reducing ambiguity and extraneous content.\",\"domain_tags\":[\"instruction-design\",\"evaluation\",\"communication\"]}", "cost_usd": 0.01707295, "bootstrap_seed": 0, "agent_model": "gpt-5.4", "held_out_score": null, "criterion_names": ["key_points_captured", "conciseness", "faithful_to_source", "few_shot_format"], "per_criterion_scores": {"key_points_captured": 0.8, "conciseness": 0.6, "faithful_to_source": 0.1, "few_shot_format": 0.0}, "failure_classification": {"category": "output_format", "description": "The experiment failed binary-criteria adherence with a low score (1.5), indicating the produced output likely did not meet the required structure\u2014specifically the constraint of exactly 2\u20134 factual sentences focused tightly on the main topic and essential specifics. This suggests a format/count adherence issue rather than a reasoning/calculation or meaning-specific error.", "fix_direction": "Enforce the output template programmatically: generate exactly 2\u20134 sentences, keep them factual and on-topic, avoid extra context or additional claims, and verify sentence count and topical focus before finalizing.", "confidence": 0.63}, "drafts_generated": 1, "drafts_survived": 1}
{"id": "63e66eb5-d49b-4309-8dd7-c22dc83a8c4d", "target_id": "B2-treatment", "git_sha": "bc806fa72adb1600afb44062f15ea3dc30a58739", "pre_experiment_sha": "bc806fa72adb1600afb44062f15ea3dc30a58739", "timestamp": "2026-04-19T18:01:41.145340+00:00", "hypothesis": "Make the requirement for an exactly 2\u20134 sentence, short factual summary more direct and explicit while preserving the same task and output format.", "hypothesis_source": "agent", "mutation_diff_summary": "", "score": 1.8, "score_ci_lower": 1.5, "score_ci_upper": 2.2, "raw_scores": [2.0, 1.5, 1.5, 1.5, 2.5], "baseline_score": 2.3, "outcome": "DISCARDED", "failure_mode": null, "duration_seconds": 17.370296625071205, "tags": ["clarity", "minimal-edit", "summarization", "constraints"], "learnings": "{\"what_changed\":\"\",\"what_improved\":[],\"what_regressed\":[],\"transferable_insight\":\"Making an instruction more explicit does not necessarily improve results if it adds little new information or fails to change the underlying task constraints in a meaningful way.\",\"domain_tags\":[\"prompt-engineering\",\"instruction-design\",\"evaluation\"]}", "cost_usd": 0.01870315, "bootstrap_seed": 0, "agent_model": "gpt-5.4", "held_out_score": null, "criterion_names": ["key_points_captured", "conciseness", "faithful_to_source", "few_shot_format"], "per_criterion_scores": {"key_points_captured": 1.0, "conciseness": 0.6, "faithful_to_source": 0.2, "few_shot_format": 0.0}, "failure_classification": {"category": "incomplete_edit", "description": "The hypothesis requests a specific edit (make the 2\u20134 sentence summary more direct and explicit) and preserve the same task/output format, but the experiment is marked as failed without indicating a clear format/schema or logic change. This suggests the change was only partially applied or left inconsistencies relative to the required summary constraints (length/structure/preservation of format).", "fix_direction": "Verify the summary is exactly 2\u20134 sentences, factual and more explicit, and that the original required output structure/format is fully preserved end-to-end (no partial edits or missing required fields).", "confidence": 0.52}, "drafts_generated": 1, "drafts_survived": 1}
{"id": "438600d0-3d7f-4084-9885-e41677b2f833", "target_id": "B2-treatment", "git_sha": "bc806fa72adb1600afb44062f15ea3dc30a58739", "pre_experiment_sha": "bc806fa72adb1600afb44062f15ea3dc30a58739", "timestamp": "2026-04-19T18:02:00.789855+00:00", "hypothesis": "Make the core requirement explicit with a minimal rewrite emphasizing an exact 2\u20134 sentence factual summary containing only the most relevant facts.", "hypothesis_source": "agent", "mutation_diff_summary": "", "score": 1.7, "score_ci_lower": 1.3, "score_ci_upper": 2.2, "raw_scores": [1.5, 1.0, 1.5, 2.5, 2.0], "baseline_score": 2.3, "outcome": "DISCARDED", "failure_mode": null, "duration_seconds": 17.274879665928893, "tags": ["clarity", "minimal-edit", "summarization"], "learnings": "{\"what_changed\":\"\",\"what_improved\":[],\"what_regressed\":[],\"transferable_insight\":\"When a task demands a concise factual summary, making the length and content constraints explicit can still fail if the rewrite does not sufficiently prioritize relevance and exclusion of nonessential details.\",\"domain_tags\":[\"prompt-engineering\",\"summarization\",\"instruction-design\"]}", "cost_usd": 0.01777295, "bootstrap_seed": 0, "agent_model": "gpt-5.4", "held_out_score": null, "criterion_names": ["key_points_captured", "conciseness", "faithful_to_source", "few_shot_format"], "per_criterion_scores": {"key_points_captured": 0.9, "conciseness": 0.4, "faithful_to_source": 0.4, "few_shot_format": 0.0}, "failure_classification": {"category": "logic_error", "description": "The provided information (hypothesis and score) does not include the actual failed output, error details, or any comparison against expected criteria, so the failure mode cannot be determined from the prompt alone.", "fix_direction": "Provide the expected vs. actual output (or the relevant diff/log), along with which criterion failed and any parsing/validation error messages, so the failure can be mapped to one of the listed categories.", "confidence": 0.05}, "drafts_generated": 1, "drafts_survived": 1}
{"id": "e3dc6498-e082-4781-9ae9-57aa3bd3276e", "target_id": "B2-treatment", "git_sha": "3e248b5d25a8592c426b81c99656e885a53c8c13", "pre_experiment_sha": "bc806fa72adb1600afb44062f15ea3dc30a58739", "timestamp": "2026-04-19T18:02:19.644023+00:00", "hypothesis": "Make the required behavior explicit by directly stating that the output must be a short factual summary in exactly 2\u20134 sentences with only the most relevant facts.", "hypothesis_source": "agent", "mutation_diff_summary": "", "score": 1.8, "score_ci_lower": 1.2, "score_ci_upper": 2.4, "raw_scores": [2.0, 2.0, 3.0, 1.0, 1.0], "baseline_score": 2.3, "outcome": "KEPT", "failure_mode": null, "duration_seconds": 15.566250166972168, "tags": ["clarity", "minimal-edit", "constraint-emphasis"], "learnings": "{\"what_changed\":\"\",\"what_improved\":[],\"what_regressed\":[],\"transferable_insight\":\"Explicitly constraining the desired format and length can improve compliance by reducing ambiguity about what counts as a correct response.\",\"domain_tags\":[\"prompting\",\"instruction-design\",\"evaluation\"]}", "cost_usd": 0.016528550000000003, "bootstrap_seed": 0, "agent_model": "gpt-5.4", "held_out_score": null, "criterion_names": ["key_points_captured", "conciseness", "faithful_to_source", "few_shot_format"], "per_criterion_scores": {"key_points_captured": 0.8, "conciseness": 0.7, "faithful_to_source": 0.3, "few_shot_format": 0.0}, "failure_classification": null, "drafts_generated": 1, "drafts_survived": 1}
{"id": "bec8acfb-3b28-4854-adee-940687feb34f", "target_id": "B2-treatment", "git_sha": "4db71a18e06a37326c83ed05b5c61b04f5aeca25", "pre_experiment_sha": "3e248b5d25a8592c426b81c99656e885a53c8c13", "timestamp": "2026-04-19T18:02:40.696691+00:00", "hypothesis": "Make the task instruction a single concise directive that explicitly requires a short factual 2\u20134 sentence summary with only the most relevant facts.", "hypothesis_source": "agent", "mutation_diff_summary": "", "score": 1.8, "score_ci_lower": 1.3, "score_ci_upper": 2.4, "raw_scores": [1.5, 2.0, 3.0, 1.5, 1.0], "baseline_score": 1.8, "outcome": "KEPT", "failure_mode": null, "duration_seconds": 18.713839749922045, "tags": ["prompt-simplification", "explicit-criteria", "summarization"], "learnings": "{\"what_changed\":\"\",\"what_improved\":[],\"what_regressed\":[],\"transferable_insight\":\"Making instructions shorter and more explicit about the desired output can preserve performance by reducing ambiguity without changing the underlying task.\",\"domain_tags\":[\"prompt-design\",\"instruction-following\",\"summarization\"]}", "cost_usd": 0.01641935, "bootstrap_seed": 0, "agent_model": "gpt-5.4", "held_out_score": null, "criterion_names": ["key_points_captured", "conciseness", "faithful_to_source", "few_shot_format"], "per_criterion_scores": {"key_points_captured": 0.8, "conciseness": 0.6, "faithful_to_source": 0.4, "few_shot_format": 0.0}, "failure_classification": null, "drafts_generated": 1, "drafts_survived": 1}
{"id": "3f744568-c728-45a4-af42-0262698702b0", "target_id": "B2-treatment", "git_sha": "ee380278660d4b16bbfc101a93513ffda2f175e8", "pre_experiment_sha": "4db71a18e06a37326c83ed05b5c61b04f5aeca25", "timestamp": "2026-04-19T18:02:57.339201+00:00", "hypothesis": "A simpler single instruction that directly states the 2\u20134 sentence factual-summary criteria will improve binary compliance.", "hypothesis_source": "agent", "mutation_diff_summary": "", "score": 1.9, "score_ci_lower": 1.6, "score_ci_upper": 2.2, "raw_scores": [2.5, 1.5, 2.0, 2.0, 1.5], "baseline_score": 1.8, "outcome": "KEPT", "failure_mode": null, "duration_seconds": 15.274741542059928, "tags": ["minimal-edit", "clarity", "summarization"], "learnings": "{\"what_changed\":\"\",\"what_improved\":[],\"what_regressed\":[],\"transferable_insight\":\"Directly stating concise, explicit criteria in a single instruction can improve compliance by reducing ambiguity and cognitive load.\",\"domain_tags\":[\"prompting\",\"instruction-design\",\"compliance\"]}", "cost_usd": 0.01719795, "bootstrap_seed": 0, "agent_model": "gpt-5.4", "held_out_score": null, "criterion_names": ["key_points_captured", "conciseness", "faithful_to_source", "few_shot_format"], "per_criterion_scores": {"key_points_captured": 0.8, "conciseness": 0.5, "faithful_to_source": 0.5, "few_shot_format": 0.1}, "failure_classification": null, "drafts_generated": 1, "drafts_survived": 1}
{"id": "e1051c68-5078-4504-8d9d-f94e5d66c75a", "target_id": "B2-treatment", "git_sha": "afe2dcf6cce78caf4063c3474fdb46bf05cdbd29", "pre_experiment_sha": "ee380278660d4b16bbfc101a93513ffda2f175e8", "timestamp": "2026-04-19T18:03:14.098977+00:00", "hypothesis": "Make the instruction more explicit and concise while preserving the task and output format.", "hypothesis_source": "agent", "mutation_diff_summary": "", "score": 1.6, "score_ci_lower": 0.7, "score_ci_upper": 2.4, "raw_scores": [1.5, 1.5, 2.0, 0.0, 3.0], "baseline_score": 1.9, "outcome": "KEPT", "failure_mode": null, "duration_seconds": 15.726633665966801, "tags": ["prompt-clarity", "minimal-edit", "summarization"], "learnings": "{\"what_changed\":\"\",\"what_improved\":[],\"what_regressed\":[],\"transferable_insight\":\"When a task already has a clear structure, making instructions more explicit and concise may preserve performance but not necessarily improve it, so changes should be validated rather than assumed beneficial.\",\"domain_tags\":[\"prompting\",\"instruction-design\",\"evaluation\"]}", "cost_usd": 0.016419950000000003, "bootstrap_seed": 0, "agent_model": "gpt-5.4", "held_out_score": null, "criterion_names": ["key_points_captured", "conciseness", "faithful_to_source", "few_shot_format"], "per_criterion_scores": {"key_points_captured": 0.7, "conciseness": 0.5, "faithful_to_source": 0.3, "few_shot_format": 0.1}, "failure_classification": null, "drafts_generated": 1, "drafts_survived": 1}
{"id": "55f6357f-a969-4062-b841-4ca815896352", "target_id": "B2-treatment", "git_sha": "10f8db54db3e7e1fd8c314f451948805cacdd817", "pre_experiment_sha": "afe2dcf6cce78caf4063c3474fdb46bf05cdbd29", "timestamp": "2026-04-19T18:03:30.631763+00:00", "hypothesis": "A single direct instruction that tightly specifies 2\u20134 factual sentences and no extra content will improve binary-criteria compliance.", "hypothesis_source": "agent", "mutation_diff_summary": "", "score": 2.4, "score_ci_lower": 1.9, "score_ci_upper": 2.8, "raw_scores": [2.5, 2.5, 3.0, 2.5, 1.5], "baseline_score": 1.6, "outcome": "KEPT", "failure_mode": null, "duration_seconds": 13.81620150001254, "tags": ["concise", "single-directive", "format-tightening", "factuality"], "learnings": "{\"what_changed\":\"\",\"what_improved\":[],\"what_regressed\":[],\"transferable_insight\":\"A tightly constrained instruction that explicitly limits both content scope and output length can improve compliance with binary evaluation criteria.\",\"domain_tags\":[\"prompt-engineering\",\"instruction-design\",\"evaluation\"]}", "cost_usd": 0.009554950000000001, "bootstrap_seed": 0, "agent_model": "gpt-5.4", "held_out_score": null, "criterion_names": ["key_points_captured", "conciseness", "faithful_to_source", "few_shot_format"], "per_criterion_scores": {"key_points_captured": 0.9, "conciseness": 0.6, "faithful_to_source": 0.8, "few_shot_format": 0.1}, "failure_classification": null, "drafts_generated": 1, "drafts_survived": 1}
{"id": "be88396c-1313-41a5-830b-5b6e9c4d22bf", "target_id": "B2-treatment", "git_sha": "10f8db54db3e7e1fd8c314f451948805cacdd817", "pre_experiment_sha": "10f8db54db3e7e1fd8c314f451948805cacdd817", "timestamp": "2026-04-19T18:03:47.922153+00:00", "hypothesis": "A tighter single-sentence directive emphasizing exact length, relevance, and factuality will improve binary criteria adherence.", "hypothesis_source": "agent", "mutation_diff_summary": "", "score": 1.7, "score_ci_lower": 0.9, "score_ci_upper": 2.5, "raw_scores": [2.5, 3.0, 0.5, 1.5, 1.0], "baseline_score": 2.4, "outcome": "DISCARDED", "failure_mode": null, "duration_seconds": 16.094051250023767, "tags": ["concise", "directive", "format", "factuality"], "learnings": "{\"what_changed\":\"\",\"what_improved\":[],\"what_regressed\":[],\"transferable_insight\":\"Overly strict instructions can fail to improve compliance when they add precision without changing the underlying task behavior.\",\"domain_tags\":[\"instruction-design\",\"evaluation\",\"behavioral-compliance\"]}", "cost_usd": 0.010536750000000003, "bootstrap_seed": 0, "agent_model": "gpt-5.4", "held_out_score": null, "criterion_names": ["key_points_captured", "conciseness", "faithful_to_source", "few_shot_format"], "per_criterion_scores": {"key_points_captured": 0.6, "conciseness": 0.4, "faithful_to_source": 0.5, "few_shot_format": 0.2}, "failure_classification": {"category": "semantic_drift", "description": "The attempt did not improve the underlying adherence to the intended binary criteria; despite the hypothesis focusing on tighter instruction, the resulting output likely deviated in meaning or intent rather than merely failing format. The low score (1.7000) suggests criteria compliance was not achieved due to incorrect interpretation or relevance/factuality, not a parsing or structural error.", "fix_direction": "Make the directive unambiguous about what counts as \u201cbinary criteria adherence,\u201d explicitly define required facts/constraints, and add a minimal self-check step to ensure the output matches the intended meaning and relevance.", "confidence": 0.55}, "drafts_generated": 1, "drafts_survived": 1}
{"id": "6323c4ae-7ff1-4991-a66c-e0b3b675888d", "target_id": "B2-treatment", "git_sha": "e7e53cc71d4272061921d331affcf977b976ce50", "pre_experiment_sha": "10f8db54db3e7e1fd8c314f451948805cacdd817", "timestamp": "2026-04-19T18:04:04.119588+00:00", "hypothesis": "Make the instruction even more singular and explicit about exact sentence count, relevance, factuality, and no extra text.", "hypothesis_source": "agent", "mutation_diff_summary": "", "score": 1.6, "score_ci_lower": 1.1, "score_ci_upper": 2.1, "raw_scores": [2.0, 2.5, 1.5, 1.0, 1.0], "baseline_score": 2.4, "outcome": "KEPT", "failure_mode": null, "duration_seconds": 13.754987749969587, "tags": ["concise", "directness", "constraint-clarity"], "learnings": "{\"what_changed\":\"\",\"what_improved\":[],\"what_regressed\":[],\"transferable_insight\":\"When a task requires a tightly constrained output, making the format and content limits more explicit can improve compliance, but overly rigid instructions may not yield measurable gains if the baseline is already sufficient.\",\"domain_tags\":[\"prompt-engineering\",\"instruction-following\",\"evaluation\"]}", "cost_usd": 0.00978575, "bootstrap_seed": 0, "agent_model": "gpt-5.4", "held_out_score": null, "criterion_names": ["key_points_captured", "conciseness", "faithful_to_source", "few_shot_format"], "per_criterion_scores": {"key_points_captured": 0.8, "conciseness": 0.4, "faithful_to_source": 0.3, "few_shot_format": 0.1}, "failure_classification": null, "drafts_generated": 1, "drafts_survived": 1}
{"id": "5cea13e4-23cf-4d14-8a71-b7889b076f84", "target_id": "B2-treatment", "git_sha": "f8e48364887e6c04cd89f6e31d355df657d59561", "pre_experiment_sha": "e7e53cc71d4272061921d331affcf977b976ce50", "timestamp": "2026-04-19T18:04:22.317283+00:00", "hypothesis": "Make the prompt a single tighter directive that explicitly enforces 2\u20134 factual sentences and only core facts.", "hypothesis_source": "agent", "mutation_diff_summary": "", "score": 1.3, "score_ci_lower": 1.1, "score_ci_upper": 1.5, "raw_scores": [1.0, 1.5, 1.5, 1.5, 1.0], "baseline_score": 1.6, "outcome": "KEPT", "failure_mode": null, "duration_seconds": 15.577052707900293, "tags": ["concise", "single-directive", "format-constraint", "factuality"], "learnings": "{\"what_changed\":\"\",\"what_improved\":[],\"what_regressed\":[],\"transferable_insight\":\"Tightening instructions to constrain both length and content scope can preserve performance while reducing unnecessary verbosity, even when no explicit gains are observed.\",\"domain_tags\":[\"prompt-engineering\",\"instruction-design\",\"evaluation\"]}", "cost_usd": 0.00774355, "bootstrap_seed": 0, "agent_model": "gpt-5.4", "held_out_score": null, "criterion_names": ["key_points_captured", "conciseness", "faithful_to_source", "few_shot_format"], "per_criterion_scores": {"key_points_captured": 0.8, "conciseness": 0.5, "faithful_to_source": 0.0, "few_shot_format": 0.0}, "failure_classification": null, "drafts_generated": 1, "drafts_survived": 1}
