{"id": "1e74685e-6c3f-4a07-83bb-89c1c4d25484", "target_id": "B2-treatment", "git_sha": "8ab045c3ccab7f7479bf23dec64cd7409f6795bf", "pre_experiment_sha": "3b452d4d4a3bc0f302632065ef61cb2ba6a6552a", "timestamp": "2026-04-19T17:57:36.153794+00:00", "hypothesis": "Tightening the instruction format and examples to enforce a short, factual 2\u20134 sentence summary will improve binary criteria scoring.", "hypothesis_source": "agent", "mutation_diff_summary": "", "score": 1.7, "score_ci_lower": 1.3, "score_ci_upper": 2.2, "raw_scores": [1.0, 2.5, 2.0, 1.5, 1.5], "baseline_score": 0.0, "outcome": "KEPT", "failure_mode": null, "duration_seconds": 18.4449698330136, "tags": ["summarization", "few-shot", "format-control", "conciseness"], "learnings": "{\"what_changed\":\"\",\"what_improved\":[],\"what_regressed\":[],\"transferable_insight\":\"Constraining output format and length with explicit examples can improve consistency with binary evaluation criteria by reducing ambiguity in responses.\",\"domain_tags\":[\"prompt-engineering\",\"evaluation\",\"instruction-design\"]}", "cost_usd": 0.02249255, "bootstrap_seed": 0, "agent_model": "gpt-5.4", "held_out_score": null, "criterion_names": ["key_points_captured", "conciseness", "faithful_to_source", "few_shot_format"], "per_criterion_scores": {"key_points_captured": 1.0, "conciseness": 0.4, "faithful_to_source": 0.3, "few_shot_format": 0.0}, "failure_classification": null, "drafts_generated": 1, "drafts_survived": 1}
{"id": "3844b6ba-24ab-4c57-ba7f-fc3b737fc16b", "target_id": "B2-treatment", "git_sha": "8ab045c3ccab7f7479bf23dec64cd7409f6795bf", "pre_experiment_sha": "8ab045c3ccab7f7479bf23dec64cd7409f6795bf", "timestamp": "2026-04-19T17:58:01.911261+00:00", "hypothesis": "Add stricter instructions for factual compression and broader few-shot coverage to improve concise, criteria-aligned summaries.", "hypothesis_source": "agent", "mutation_diff_summary": "", "score": 1.9, "score_ci_lower": 1.4, "score_ci_upper": 2.3, "raw_scores": [2.0, 1.0, 2.0, 2.0, 2.5], "baseline_score": 1.7, "outcome": "DISCARDED", "failure_mode": null, "duration_seconds": 24.646332999924198, "tags": ["prompting", "few-shot", "format-constraints", "summarization"], "learnings": "{\"what_changed\":\"\",\"what_improved\":[],\"what_regressed\":[],\"transferable_insight\":\"When a change yields no measurable gains or losses, it suggests the added complexity did not materially affect performance and should be avoided unless it clearly improves the target criteria.\",\"domain_tags\":[\"evaluation\",\"prompt-design\",\"optimization\"]}", "cost_usd": 0.029450950000000004, "bootstrap_seed": 0, "agent_model": "gpt-5.4", "held_out_score": null, "criterion_names": ["key_points_captured", "conciseness", "faithful_to_source", "few_shot_format"], "per_criterion_scores": {"key_points_captured": 1.0, "conciseness": 0.6, "faithful_to_source": 0.3, "few_shot_format": 0.0}, "failure_classification": {"category": "incomplete_edit", "description": "The experiment\u2019s output did not meet the expected criterion alignment/coverage sufficiently, indicating only a partial or inconsistent application of the intended changes (stricter compression instructions and broader few-shot coverage). The overall result is low (score 1.9), suggesting the modification was not fully realized end-to-end.", "fix_direction": "Ensure both components are applied together and consistently across all generations: (1) add and enforce explicit formatting/compression rules that map directly to the evaluation criteria, and (2) expand few-shot examples to cover the full range of target cases without leaving gaps or conflicts with the compression requirements.", "confidence": 0.34}, "drafts_generated": 1, "drafts_survived": 1}
{"id": "57488226-afc2-4b36-b5dd-22d5a40fb994", "target_id": "B2-treatment", "git_sha": "8ab045c3ccab7f7479bf23dec64cd7409f6795bf", "pre_experiment_sha": "8ab045c3ccab7f7479bf23dec64cd7409f6795bf", "timestamp": "2026-04-19T17:58:25.386092+00:00", "hypothesis": "Tightening the instruction hierarchy and adding edge-case guidance with stronger few-shot patterns will improve concise, fact-faithful summaries.", "hypothesis_source": "agent", "mutation_diff_summary": "", "score": 2.1, "score_ci_lower": 1.6, "score_ci_upper": 2.6, "raw_scores": [1.5, 1.5, 3.0, 2.0, 2.5], "baseline_score": 1.7, "outcome": "DISCARDED", "failure_mode": null, "duration_seconds": 20.885492749977857, "tags": ["instruction-clarity", "few-shot", "format-control", "faithfulness"], "learnings": "{\"what_changed\":\"\",\"what_improved\":[],\"what_regressed\":[],\"transferable_insight\":\"Adding more explicit constraints and examples does not guarantee better outputs; improvements must be validated against measurable gains rather than assumed from increased specificity.\",\"domain_tags\":[\"prompt-engineering\",\"evaluation\",\"instruction-design\"]}", "cost_usd": 0.02546215, "bootstrap_seed": 0, "agent_model": "gpt-5.4", "held_out_score": null, "criterion_names": ["key_points_captured", "conciseness", "faithful_to_source", "few_shot_format"], "per_criterion_scores": {"key_points_captured": 0.9, "conciseness": 0.8, "faithful_to_source": 0.4, "few_shot_format": 0.0}, "failure_classification": {"category": "logic_error", "description": "Insufficient information about the actual failure (no details on what the model output did wrong, whether it violated the schema, changed meaning, or deviated in logic). The score is provided but not correlated to a specific observed failure mode.", "fix_direction": "Provide the failing example output, evaluation notes, and the specific criterion that was not met (e.g., format/schema checks, factuality, length/conciseness constraints). Then map the observed symptom to one of the listed categories.", "confidence": 0.05}, "drafts_generated": 1, "drafts_survived": 1}
{"id": "fc4abdd2-1bde-4475-83aa-13462b7554cb", "target_id": "B2-treatment", "git_sha": "bc806fa72adb1600afb44062f15ea3dc30a58739", "pre_experiment_sha": "8ab045c3ccab7f7479bf23dec64cd7409f6795bf", "timestamp": "2026-04-19T17:58:46.272923+00:00", "hypothesis": "Simplify the prompt and examples to strongly enforce short, factual 2\u20134 sentence summaries focused only on the article\u2019s main points.", "hypothesis_source": "agent", "mutation_diff_summary": "", "score": 2.3, "score_ci_lower": 1.8, "score_ci_upper": 2.8, "raw_scores": [2.0, 1.5, 3.0, 2.0, 3.0], "baseline_score": 1.7, "outcome": "KEPT", "failure_mode": null, "duration_seconds": 16.722984583000652, "tags": ["summarization", "few-shot", "concise", "factual"], "learnings": "{\"what_changed\":\"\",\"what_improved\":[],\"what_regressed\":[],\"transferable_insight\":\"Reducing prompt complexity and tightly constraining the output format can improve consistency by steering responses toward concise, high-signal summaries that stay focused on the core task.\",\"domain_tags\":[\"prompt-engineering\",\"summarization\",\"instruction-design\"]}", "cost_usd": 0.01900235, "bootstrap_seed": 0, "agent_model": "gpt-5.4", "held_out_score": null, "criterion_names": ["key_points_captured", "conciseness", "faithful_to_source", "few_shot_format"], "per_criterion_scores": {"key_points_captured": 0.9, "conciseness": 0.5, "faithful_to_source": 0.8, "few_shot_format": 0.1}, "failure_classification": null, "drafts_generated": 1, "drafts_survived": 1}
{"id": "f60f662a-ff65-4124-87df-2e376c800426", "target_id": "B2-treatment", "git_sha": "bc806fa72adb1600afb44062f15ea3dc30a58739", "pre_experiment_sha": "bc806fa72adb1600afb44062f15ea3dc30a58739", "timestamp": "2026-04-19T17:59:04.540938+00:00", "hypothesis": "Tighten the prompt to enforce a concise 2\u20134 sentence factual summary focused only on the article\u2019s main event, outcome, and essential specifics.", "hypothesis_source": "agent", "mutation_diff_summary": "", "score": 1.3, "score_ci_lower": 1.1, "score_ci_upper": 1.5, "raw_scores": [1.5, 1.5, 1.5, 1.0, 1.0], "baseline_score": 2.3, "outcome": "DISCARDED", "failure_mode": null, "duration_seconds": 17.188696500030346, "tags": ["summarization", "few-shot", "concise", "factual"], "learnings": "{\"what_changed\":\"\",\"what_improved\":[],\"what_regressed\":[],\"transferable_insight\":\"When a task requires a concise factual summary, over-constraining brevity can reduce performance if it strips away needed context or flexibility for capturing the core event accurately.\",\"domain_tags\":[\"prompt-engineering\",\"summarization\",\"evaluation\"]}", "cost_usd": 0.01680355, "bootstrap_seed": 0, "agent_model": "gpt-5.4", "held_out_score": null, "criterion_names": ["key_points_captured", "conciseness", "faithful_to_source", "few_shot_format"], "per_criterion_scores": {"key_points_captured": 0.8, "conciseness": 0.4, "faithful_to_source": 0.1, "few_shot_format": 0.0}, "failure_classification": {"category": "output_format", "description": "The attempt did not satisfy the required output structure/schema (e.g., the prompt constraints for a concise 2\u20134 sentence factual summary or the expected formatting of the response were not correctly enforced).", "fix_direction": "Tighten and explicitly specify the required response schema/format and enforce constraints (exact sentence count, factual-only content, no extra fields), then validate against the expected structure before finalizing.", "confidence": 0.62}, "drafts_generated": 1, "drafts_survived": 1}
{"id": "8957746a-e415-4095-aef6-49dbfd551032", "target_id": "B2-treatment", "git_sha": "bc806fa72adb1600afb44062f15ea3dc30a58739", "pre_experiment_sha": "bc806fa72adb1600afb44062f15ea3dc30a58739", "timestamp": "2026-04-19T17:59:22.581572+00:00", "hypothesis": "Simplify and tighten the summarization prompt so outputs stay strictly factual, brief, and aligned to key binary criteria.", "hypothesis_source": "agent", "mutation_diff_summary": "", "score": 1.2, "score_ci_lower": 1.0, "score_ci_upper": 1.4, "raw_scores": [1.5, 1.5, 1.0, 1.0, 1.0], "baseline_score": 2.3, "outcome": "DISCARDED", "failure_mode": null, "duration_seconds": 15.08573512500152, "tags": ["prompt-simplification", "few-shot", "summarization", "criteria-alignment"], "learnings": "{\"what_changed\":\"\",\"what_improved\":[],\"what_regressed\":[],\"transferable_insight\":\"Over-constraining a prompt can reduce useful signal without improving factuality or alignment, so brevity and strictness should be balanced against preserving enough context for the task.\",\"domain_tags\":[\"prompt-engineering\",\"evaluation\",\"summarization\"]}", "cost_usd": 0.01571795, "bootstrap_seed": 0, "agent_model": "gpt-5.4", "held_out_score": null, "criterion_names": ["key_points_captured", "conciseness", "faithful_to_source", "few_shot_format"], "per_criterion_scores": {"key_points_captured": 0.7, "conciseness": 0.5, "faithful_to_source": 0.0, "few_shot_format": 0.0}, "failure_classification": {"category": "semantic_drift", "description": "The attempt appears to keep some aspects of the requested structure/briefness but the output did not remain strictly factual and aligned to the intended binary criteria, indicating a meaning/requirement mismatch rather than a pure formatting or syntax problem.", "fix_direction": "Tighten the prompt further with explicit binary decision rules (e.g., allowed labels, exact conditions), add hard constraints like 'no conjecture/justifications', and enforce a strict mapping from the criteria to the final output fields to prevent semantic drift.", "confidence": 0.42}, "drafts_generated": 1, "drafts_survived": 1}
{"id": "e16ff8ca-952e-49c3-8612-cf09b1c86765", "target_id": "B2-treatment", "git_sha": "bc806fa72adb1600afb44062f15ea3dc30a58739", "pre_experiment_sha": "bc806fa72adb1600afb44062f15ea3dc30a58739", "timestamp": "2026-04-19T17:59:41.751043+00:00", "hypothesis": "Make the prompt more direct about producing exactly 2\u20134 factual sentences with only the most relevant facts.", "hypothesis_source": "agent", "mutation_diff_summary": "", "score": 2.2, "score_ci_lower": 1.4, "score_ci_upper": 2.9, "raw_scores": [2.5, 1.0, 2.5, 1.5, 3.5], "baseline_score": 2.3, "outcome": "DISCARDED", "failure_mode": null, "duration_seconds": 14.663594582933001, "tags": ["summarization", "concise", "factual", "few-shot"], "learnings": "{\"what_changed\":\"\",\"what_improved\":[],\"what_regressed\":[],\"transferable_insight\":\"Making instructions more explicit and constrained does not necessarily improve results if the added specificity does not align with what the task actually needs.\",\"domain_tags\":[\"prompt-engineering\",\"instruction-design\",\"evaluation\"]}", "cost_usd": 0.013840150000000002, "bootstrap_seed": 0, "agent_model": "gpt-5.4", "held_out_score": null, "criterion_names": ["key_points_captured", "conciseness", "faithful_to_source", "few_shot_format"], "per_criterion_scores": {"key_points_captured": 1.0, "conciseness": 0.4, "faithful_to_source": 0.6, "few_shot_format": 0.2}, "failure_classification": {"category": "incomplete_edit", "description": "The prompt refinement intended to enforce exactly 2\u20134 factual sentences with only the most relevant facts, but the resulting output still did not meet the tightened requirement, indicating only a partial or inconsistent application of the new constraints.", "fix_direction": "Ensure the prompt explicitly and unambiguously constrains sentence count (2\u20134) and factuality, and add a clear instruction to exclude extra details; verify the output against these constraints before concluding success.", "confidence": 0.38}, "drafts_generated": 1, "drafts_survived": 1}
{"id": "9c47fbfe-b6d2-40ad-8225-4c9ea5353dbc", "target_id": "B2-treatment", "git_sha": "bc806fa72adb1600afb44062f15ea3dc30a58739", "pre_experiment_sha": "bc806fa72adb1600afb44062f15ea3dc30a58739", "timestamp": "2026-04-19T17:59:57.000138+00:00", "hypothesis": "Make the prompt more direct and criteria-aligned by emphasizing exactly 2\u20134 factual sentences with only the most relevant facts.", "hypothesis_source": "agent", "mutation_diff_summary": "", "score": 1.6, "score_ci_lower": 1.0, "score_ci_upper": 2.2, "raw_scores": [1.0, 2.5, 1.0, 2.5, 1.0], "baseline_score": 2.3, "outcome": "DISCARDED", "failure_mode": null, "duration_seconds": 12.597081665997393, "tags": ["summarization", "concise", "factual", "few-shot"], "learnings": "{\"what_changed\":\"\",\"what_improved\":[],\"what_regressed\":[],\"transferable_insight\":\"When a prompt is made more restrictive without adding clearer task-specific guidance, it can reduce performance by suppressing useful context rather than improving focus.\",\"domain_tags\":[\"prompt-engineering\",\"instruction-design\",\"evaluation\"]}", "cost_usd": 0.014242950000000002, "bootstrap_seed": 0, "agent_model": "gpt-5.4", "held_out_score": null, "criterion_names": ["key_points_captured", "conciseness", "faithful_to_source", "few_shot_format"], "per_criterion_scores": {"key_points_captured": 0.8, "conciseness": 0.4, "faithful_to_source": 0.4, "few_shot_format": 0.0}, "failure_classification": {"category": "semantic_drift", "description": "The attempt to improve the prompt appears to have not achieved the intended meaning of the hypothesis (it likely altered emphasis/criteria rather than producing the exact intended structure of 2\u20134 factual sentences with only the most relevant facts), resulting in a low evaluation score despite no explicit format/coding errors being indicated.", "fix_direction": "Constrain the rewrite to exactly 2\u20134 factual sentences, include only the most relevant facts, and explicitly remove any extra instructions, rationale, or contextual sentences that could change meaning.", "confidence": 0.42}, "drafts_generated": 1, "drafts_survived": 1}
{"id": "73a31203-7624-4b4f-8df7-59b7edbe9a2f", "target_id": "B2-treatment", "git_sha": "bc806fa72adb1600afb44062f15ea3dc30a58739", "pre_experiment_sha": "bc806fa72adb1600afb44062f15ea3dc30a58739", "timestamp": "2026-04-19T18:00:14.516036+00:00", "hypothesis": "Make the prompt more explicit and minimal so it consistently produces a factual 2\u20134 sentence summary with only the most relevant facts.", "hypothesis_source": "agent", "mutation_diff_summary": "", "score": 1.8, "score_ci_lower": 1.3, "score_ci_upper": 2.2, "raw_scores": [1.5, 1.0, 2.0, 2.5, 2.0], "baseline_score": 2.3, "outcome": "DISCARDED", "failure_mode": null, "duration_seconds": 15.043037958908826, "tags": ["summarization", "concise", "factual", "few-shot"], "learnings": "{\"what_changed\":\"\",\"what_improved\":[],\"what_regressed\":[],\"transferable_insight\":\"Making instructions more explicit and minimal does not necessarily improve output quality; if the task constraints are already underspecified or misaligned, simplification alone may have no effect or even degrade results.\",\"domain_tags\":[\"prompt-engineering\",\"evaluation\",\"instruction-design\"]}", "cost_usd": 0.016703150000000003, "bootstrap_seed": 0, "agent_model": "gpt-5.4", "held_out_score": null, "criterion_names": ["key_points_captured", "conciseness", "faithful_to_source", "few_shot_format"], "per_criterion_scores": {"key_points_captured": 0.8, "conciseness": 0.2, "faithful_to_source": 0.5, "few_shot_format": 0.3}, "failure_classification": {"category": "output_format", "description": "The experiment failed to reliably produce the expected output structure: the prompt change did not consistently yield the required concise 2\u20134 sentence factual summary with only the most relevant facts, indicating a formatting/structural control issue rather than a purely logical or semantic error.", "fix_direction": "Constrain the output with an explicit required template (e.g., exact sentence count, ordering, and content selection rules) and add explicit formatting constraints to prevent extraneous or variable-length outputs.", "confidence": 0.62}, "drafts_generated": 1, "drafts_survived": 1}
{"id": "5279f849-63f5-4c40-9e35-372f5cf1e851", "target_id": "B2-treatment", "git_sha": "bc806fa72adb1600afb44062f15ea3dc30a58739", "pre_experiment_sha": "bc806fa72adb1600afb44062f15ea3dc30a58739", "timestamp": "2026-04-19T18:00:37.687497+00:00", "hypothesis": "Tightening the instructions to explicitly require exactly 2\u20134 factual sentences focused only on the main topic, key event/result, and most relevant specifics will improve binary criteria adherence.", "hypothesis_source": "agent", "mutation_diff_summary": "", "score": 2.1, "score_ci_lower": 1.3, "score_ci_upper": 3.1, "raw_scores": [1.5, 2.5, 4.0, 1.5, 1.0], "baseline_score": 2.3, "outcome": "DISCARDED", "failure_mode": null, "duration_seconds": 19.231906667002477, "tags": ["summarization", "constraint-tightening", "factuality", "length-control"], "learnings": "{\"what_changed\":\"\",\"what_improved\":[],\"what_regressed\":[],\"transferable_insight\":\"Making instructions more specific can still fail to improve compliance if the added constraints do not address the underlying source of variation or ambiguity in responses.\",\"domain_tags\":[\"instruction-design\",\"evaluation\",\"behavior-change\"]}", "cost_usd": 0.01799235, "bootstrap_seed": 0, "agent_model": "gpt-5.4", "held_out_score": null, "criterion_names": ["key_points_captured", "conciseness", "faithful_to_source", "few_shot_format"], "per_criterion_scores": {"key_points_captured": 0.7, "conciseness": 0.8, "faithful_to_source": 0.4, "few_shot_format": 0.2}, "failure_classification": {"category": "logic_error", "description": "The provided information does not include a concrete failure mode (only 'unknown') or any evidence of format/logic/scope/syntax issues. With only a hypothesis, score (2.1), and no actual error details, the root cause cannot be reliably mapped to one of the listed categories.", "fix_direction": "Provide the exact failing output and the observed evaluation error (e.g., expected vs received structure, which criteria failed, and what changed), then classify accordingly and adjust instruction constraints within the allowed scope.", "confidence": 0.15}, "drafts_generated": 1, "drafts_survived": 1}
