{"id": "24318f40-a8f3-4245-8ee9-fa2d93000647", "target_id": "B2-treatment", "git_sha": "63b472f2c5fb2fedc049a9d75cb0b820eb947d5b", "pre_experiment_sha": "63b472f2c5fb2fedc049a9d75cb0b820eb947d5b", "timestamp": "2026-04-19T18:11:43.538231+00:00", "hypothesis": "A slightly tighter single-sentence directive that explicitly says sentence-only output and source-supported key facts may improve few-shot format compliance without reintroducing drift.", "hypothesis_source": "agent", "mutation_diff_summary": "", "score": 1.5, "score_ci_lower": 1.2, "score_ci_upper": 1.8, "raw_scores": [2.0, 1.5, 1.5, 1.5, 1.0], "baseline_score": 2.8, "outcome": "DISCARDED", "failure_mode": null, "duration_seconds": 12.5624352080049, "tags": ["concise", "single-directive", "faithfulness", "strict-format", "format-clarity"], "learnings": "{\"what_changed\":\"\",\"what_improved\":[],\"what_regressed\":[\"faithful_to_source: FAIL (was PASS)\"],\"transferable_insight\":\"Adding tighter formatting constraints can reduce compliance drift only if they do not crowd out source-grounded content, since over-constraining the instruction may harm factual fidelity.\",\"domain_tags\":[\"prompt-engineering\",\"instruction-following\",\"information-retrieval\"]}", "cost_usd": 0.020795150000000005, "bootstrap_seed": 0, "agent_model": "gpt-5.4", "held_out_score": null, "criterion_names": ["key_points_captured", "conciseness", "faithful_to_source", "few_shot_format"], "per_criterion_scores": {"key_points_captured": 0.8, "conciseness": 0.6, "faithful_to_source": 0.1, "few_shot_format": 0.0}, "failure_classification": {"category": "output_format", "description": "The experiment failed to maintain the required output format/schema for few-shot compliance, indicating a structure/output constraint was violated rather than reasoning or meaning.", "fix_direction": "Use a stricter, sentence-only output instruction and explicitly constrain the response format (e.g., prohibit additional sections/tokens), ensuring the model adheres to the exact expected schema in all cases.", "confidence": 0.62}, "drafts_generated": 1, "drafts_survived": 1}
{"id": "9a39fc29-7883-466c-a9e4-641461e37d24", "target_id": "B2-treatment", "git_sha": "63b472f2c5fb2fedc049a9d75cb0b820eb947d5b", "pre_experiment_sha": "63b472f2c5fb2fedc049a9d75cb0b820eb947d5b", "timestamp": "2026-04-19T18:11:59.226306+00:00", "hypothesis": "A slightly shorter directive that keeps all required constraints while foregrounding source-supported facts and exact sentence-only output may preserve faithfulness and improve format compliance.", "hypothesis_source": "agent", "mutation_diff_summary": "", "score": 1.4, "score_ci_lower": 0.8, "score_ci_upper": 2.0, "raw_scores": [2.5, 1.5, 1.5, 1.0, 0.5], "baseline_score": 2.8, "outcome": "DISCARDED", "failure_mode": null, "duration_seconds": 11.790661207982339, "tags": ["concise", "single-directive", "faithfulness", "strict-format", "anti-drift"], "learnings": "{\"what_changed\":\"\",\"what_improved\":[],\"what_regressed\":[],\"transferable_insight\":\"When tightening instructions, preserve every hard constraint while prioritizing explicit format requirements and evidence-backed content to improve compliance without sacrificing fidelity.\",\"domain_tags\":[\"prompt-engineering\",\"instruction-design\",\"format-compliance\"]}", "cost_usd": 0.02120675, "bootstrap_seed": 0, "agent_model": "gpt-5.4", "held_out_score": null, "criterion_names": ["key_points_captured", "conciseness", "faithful_to_source", "few_shot_format"], "per_criterion_scores": {"key_points_captured": 0.8, "conciseness": 0.5, "faithful_to_source": 0.1, "few_shot_format": 0.0}, "failure_classification": {"category": "output_format", "description": "The experiment failed format compliance: the output did not meet the required structure/schema (e.g., missing/incorrectly formatted sections or not producing the required exact sentence-only output).", "fix_direction": "Tighten adherence to the specified output schema and enforce exact formatting constraints (single-sentence output, required fields/sections, no extra text). Add automated validation/checks for the expected structure before returning.", "confidence": 0.62}, "drafts_generated": 1, "drafts_survived": 1}
{"id": "382d9e90-ab3b-4408-919e-fbeea549984c", "target_id": "B2-treatment", "git_sha": "63b472f2c5fb2fedc049a9d75cb0b820eb947d5b", "pre_experiment_sha": "63b472f2c5fb2fedc049a9d75cb0b820eb947d5b", "timestamp": "2026-04-19T18:12:18.050602+00:00", "hypothesis": "A slightly cleaner single-line directive that prioritizes exact sentence-only output and source-supported key facts may improve format compliance without hurting fidelity.", "hypothesis_source": "agent", "mutation_diff_summary": "", "score": 2.5, "score_ci_lower": 1.9, "score_ci_upper": 3.1, "raw_scores": [1.5, 3.0, 3.5, 2.5, 2.0], "baseline_score": 2.8, "outcome": "DISCARDED", "failure_mode": null, "duration_seconds": 15.64504900004249, "tags": ["concise", "single-directive", "strict-format", "faithfulness", "output-format"], "learnings": "{\"what_changed\":\"\",\"what_improved\":[\"faithful_to_source: PASS (was FAIL)\"],\"what_regressed\":[],\"transferable_insight\":\"A small wording change that makes output constraints more explicit and prioritizes source-grounded facts can improve adherence to the requested format without reducing factual fidelity.\",\"domain_tags\":[\"prompting\",\"format-compliance\",\"factuality\"]}", "cost_usd": 0.023566150000000004, "bootstrap_seed": 0, "agent_model": "gpt-5.4", "held_out_score": null, "criterion_names": ["key_points_captured", "conciseness", "faithful_to_source", "few_shot_format"], "per_criterion_scores": {"key_points_captured": 0.9, "conciseness": 0.5, "faithful_to_source": 0.8, "few_shot_format": 0.3}, "failure_classification": {"category": "output_format", "description": "The experiment appears to have failed on format compliance: the hypothesis targets stricter single-line, sentence-only output and source-supported key facts, suggesting the prior attempt likely violated the required output structure/schema (rather than making a clear logical/meaning error).", "fix_direction": "Tighten the output to the required schema: enforce exact single-line structure, ensure the response contains only complete sentences (no extra tokens/sections), and include only source-supported key facts while matching any required fields/ordering.", "confidence": 0.42}, "drafts_generated": 1, "drafts_survived": 1}
