{"id": "91e2a6a8-3838-4f8e-b5e9-e88e052b9ae2", "target_id": "B2-treatment", "git_sha": "175a02635573524abb0250ca6eae5d9b463eca92", "pre_experiment_sha": "3b452d4d4a3bc0f302632065ef61cb2ba6a6552a", "timestamp": "2026-04-19T08:13:40.549986+00:00", "hypothesis": "Tighter instructions plus balanced few-shot examples will improve article-summary adherence and concise output quality.", "hypothesis_source": "agent", "mutation_diff_summary": "", "score": 1.7, "score_ci_lower": 1.0, "score_ci_upper": 2.9, "raw_scores": [1.0, 1.5, 1.0, 4.0, 1.0], "baseline_score": 0.0, "outcome": "KEPT", "failure_mode": null, "duration_seconds": 17.027105916989967, "tags": ["few-shot", "summarization", "formatting", "instruction-clarity"], "learnings": "{\"what_changed\":\"\",\"what_improved\":[],\"what_regressed\":[],\"transferable_insight\":\"Combining clearer constraints with a balanced set of examples can improve adherence to the desired format and produce more concise, consistent outputs.\",\"domain_tags\":[\"prompt-engineering\",\"instruction-following\",\"few-shot-learning\"]}", "cost_usd": 0.02089875, "bootstrap_seed": 0, "agent_model": "gpt-5.4", "held_out_score": null, "criterion_names": ["key_points_captured", "conciseness", "faithful_to_source", "few_shot_format"], "per_criterion_scores": {"key_points_captured": 0.8, "conciseness": 0.5, "faithful_to_source": 0.2, "few_shot_format": 0.2}, "failure_classification": null, "drafts_generated": 1, "drafts_survived": 1}
{"id": "b41bc1b8-c5c6-4a56-85a5-4764a4838620", "target_id": "B2-treatment", "git_sha": "175a02635573524abb0250ca6eae5d9b463eca92", "pre_experiment_sha": "175a02635573524abb0250ca6eae5d9b463eca92", "timestamp": "2026-04-19T08:14:02.737765+00:00", "hypothesis": "Adding sharper inclusion/exclusion rules and a compact output style guide will improve summary faithfulness and consistency.", "hypothesis_source": "agent", "mutation_diff_summary": "", "score": 1.4, "score_ci_lower": 1.1, "score_ci_upper": 1.7, "raw_scores": [1.0, 1.5, 2.0, 1.5, 1.0], "baseline_score": 1.7, "outcome": "DISCARDED", "failure_mode": null, "duration_seconds": 20.872811374953017, "tags": ["summarization", "few-shot", "instruction-clarity", "faithfulness"], "learnings": "{\"what_changed\":\"\",\"what_improved\":[],\"what_regressed\":[],\"transferable_insight\":\"When a change is discarded with no observed improvements or regressions, it suggests the added constraints and formatting may have increased complexity without producing measurable benefit.\",\"domain_tags\":[\"evaluation\",\"process-design\",\"quality-control\"]}", "cost_usd": 0.025627150000000005, "bootstrap_seed": 0, "agent_model": "gpt-5.4", "held_out_score": null, "criterion_names": ["key_points_captured", "conciseness", "faithful_to_source", "few_shot_format"], "per_criterion_scores": {"key_points_captured": 0.8, "conciseness": 0.4, "faithful_to_source": 0.2, "few_shot_format": 0.0}, "failure_classification": {"category": "output_format", "description": "The experiment is classified as failing due to output structure/schema not meeting the required format. Despite the stated hypothesis about improving faithfulness with inclusion/exclusion rules and a style guide, the resulting output did not conform to the expected structured requirements, leading to a low score.", "fix_direction": "Prioritize strict schema/format compliance: validate the output structure against the required template before evaluating content, add automated checks for required sections/fields/order, and ensure the style guide changes do not alter the structural contract.", "confidence": 0.62}, "drafts_generated": 1, "drafts_survived": 1}
{"id": "5566f497-3709-4a1d-a74f-61c8ddac9fb7", "target_id": "B2-treatment", "git_sha": "175a02635573524abb0250ca6eae5d9b463eca92", "pre_experiment_sha": "175a02635573524abb0250ca6eae5d9b463eca92", "timestamp": "2026-04-19T08:14:33.731743+00:00", "hypothesis": "Add sharper constraints and more diverse few-shot examples to improve faithful, concise article summaries.", "hypothesis_source": "agent", "mutation_diff_summary": "", "score": 1.9, "score_ci_lower": 1.2, "score_ci_upper": 2.6, "raw_scores": [1.0, 1.0, 2.5, 3.0, 2.0], "baseline_score": 1.7, "outcome": "DISCARDED", "failure_mode": null, "duration_seconds": 28.365256707998924, "tags": ["few-shot", "summarization", "instruction-tuning", "fidelity", "concision"], "learnings": "{\"what_changed\":\"\",\"what_improved\":[],\"what_regressed\":[],\"transferable_insight\":\"When a change shows no measurable gains or losses, it may be better to discard it rather than assume added complexity will improve performance.\",\"domain_tags\":[\"experimentation\",\"decision-making\",\"optimization\"]}", "cost_usd": 0.03352535, "bootstrap_seed": 0, "agent_model": "gpt-5.4", "held_out_score": null, "criterion_names": ["key_points_captured", "conciseness", "faithful_to_source", "few_shot_format"], "per_criterion_scores": {"key_points_captured": 0.8, "conciseness": 0.3, "faithful_to_source": 0.5, "few_shot_format": 0.3}, "failure_classification": {"category": "logic_error", "description": "The provided information does not include the actual failed output or evidence of a specific failure mode (format, logic, regression, scope, syntax, semantics, optimization gaming, or incomplete edit). The score (1.9) suggests poor performance, but the cause is not identifiable from the given fields.", "fix_direction": "Collect the model\u2019s actual response and any evaluator feedback, then compare against the expected output schema and intended summary semantics to pinpoint whether the failure is formatting, reasoning/meaning, or partial/incomplete edits; add targeted constraints/few-shot examples accordingly.", "confidence": 0.12}, "drafts_generated": 1, "drafts_survived": 1}
{"id": "e2ae902b-30bc-4b4f-a9ec-160785229128", "target_id": "B2-treatment", "git_sha": "175a02635573524abb0250ca6eae5d9b463eca92", "pre_experiment_sha": "175a02635573524abb0250ca6eae5d9b463eca92", "timestamp": "2026-04-19T08:14:58.718569+00:00", "hypothesis": "Make the prompt shorter and more explicit about extracting only core facts in a fixed 2\u20133 sentence prose summary.", "hypothesis_source": "agent", "mutation_diff_summary": "", "score": 2.1, "score_ci_lower": 1.4, "score_ci_upper": 3.1, "raw_scores": [1.5, 2.0, 4.0, 2.0, 1.0], "baseline_score": 1.7, "outcome": "DISCARDED", "failure_mode": null, "duration_seconds": 20.498529665987007, "tags": ["concise", "stricter-rules", "fixed-format", "balanced-few-shot"], "learnings": "{\"what_changed\":\"\",\"what_improved\":[],\"what_regressed\":[],\"transferable_insight\":\"When a task requires concise factual synthesis, explicitly constraining both the length and the scope of the output can improve consistency, but only if the constraint aligns with the evaluator\u2019s notion of completeness and usefulness.\",\"domain_tags\":[\"prompt-engineering\",\"evaluation\",\"summarization\"]}", "cost_usd": 0.02183295, "bootstrap_seed": 0, "agent_model": "gpt-5.4", "held_out_score": null, "criterion_names": ["key_points_captured", "conciseness", "faithful_to_source", "few_shot_format"], "per_criterion_scores": {"key_points_captured": 0.8, "conciseness": 0.8, "faithful_to_source": 0.3, "few_shot_format": 0.2}, "failure_classification": {"category": "incomplete_edit", "description": "The experiment failed to fully realize the intended change (shorter, more explicit 2\u20133 sentence factual summary). The low score suggests the prompt edit was only partially applied or left an inconsistent/insufficiently specific instruction, so the output did not reliably match the targeted behavior.", "fix_direction": "Make the prompt edit complete and unambiguous: explicitly instruct a fixed 2\u20133 sentence summary focused only on core facts, and ensure there are no leftover or conflicting instructions. Then verify adherence to the sentence limit and fact-only constraint.", "confidence": 0.63}, "drafts_generated": 1, "drafts_survived": 1}
{"id": "9d33cbd2-14d2-432d-87da-fa9e518c245f", "target_id": "B2-treatment", "git_sha": "175a02635573524abb0250ca6eae5d9b463eca92", "pre_experiment_sha": "175a02635573524abb0250ca6eae5d9b463eca92", "timestamp": "2026-04-19T08:15:22.163442+00:00", "hypothesis": "Make the prompt shorter and more rule-based with exact output constraints and balanced examples to improve consistent binary judgment behavior.", "hypothesis_source": "agent", "mutation_diff_summary": "", "score": 1.9, "score_ci_lower": 1.3, "score_ci_upper": 2.5, "raw_scores": [2.0, 2.0, 1.0, 3.0, 1.5], "baseline_score": 1.7, "outcome": "DISCARDED", "failure_mode": null, "duration_seconds": 20.921838958980516, "tags": ["concise", "stricter-rules", "fixed-format", "balanced-few-shot"], "learnings": "{\"what_changed\":\"\",\"what_improved\":[],\"what_regressed\":[],\"transferable_insight\":\"Shorter, rule-based instructions with explicit output constraints and balanced examples can improve consistency in binary decision tasks, but only if they materially clarify the decision boundary rather than merely simplifying the prompt.\",\"domain_tags\":[\"prompt-engineering\",\"decision-making\",\"evaluation\"]}", "cost_usd": 0.024606750000000004, "bootstrap_seed": 0, "agent_model": "gpt-5.4", "held_out_score": null, "criterion_names": ["key_points_captured", "conciseness", "faithful_to_source", "few_shot_format"], "per_criterion_scores": {"key_points_captured": 0.9, "conciseness": 0.6, "faithful_to_source": 0.2, "few_shot_format": 0.2}, "failure_classification": {"category": "output_format", "description": "The experiment appears to have failed due to the model not reliably following the required prompt/output constraints needed for consistent binary judgment, resulting in outputs that deviate from the expected structure or schema.", "fix_direction": "Tighten the output specification (exact schema/field order, required/optional fields), and add explicit constraints and validation-oriented examples to ensure the model always returns the same well-formed binary output.", "confidence": 0.62}, "drafts_generated": 1, "drafts_survived": 1}
{"id": "0e96aef8-6e37-445a-afd3-fffb980bb789", "target_id": "B2-treatment", "git_sha": "175a02635573524abb0250ca6eae5d9b463eca92", "pre_experiment_sha": "175a02635573524abb0250ca6eae5d9b463eca92", "timestamp": "2026-04-19T08:15:44.654264+00:00", "hypothesis": "Make the prompt shorter and enforce a fixed summary format with explicit faithfulness and inclusion rules.", "hypothesis_source": "agent", "mutation_diff_summary": "", "score": 1.7, "score_ci_lower": 1.3, "score_ci_upper": 2.2, "raw_scores": [1.0, 2.5, 2.0, 1.5, 1.5], "baseline_score": 1.7, "outcome": "DISCARDED", "failure_mode": null, "duration_seconds": 19.694202709011734, "tags": ["concise", "strict-format", "binary-rules", "few-shot", "faithfulness"], "learnings": "{\"what_changed\":\"\",\"what_improved\":[],\"what_regressed\":[],\"transferable_insight\":\"When a change adds constraints without increasing useful information, it may simplify output format but fail to improve results.\",\"domain_tags\":[\"prompting\",\"evaluation\",\"optimization\"]}", "cost_usd": 0.021387350000000003, "bootstrap_seed": 0, "agent_model": "gpt-5.4", "held_out_score": null, "criterion_names": ["key_points_captured", "conciseness", "faithful_to_source", "few_shot_format"], "per_criterion_scores": {"key_points_captured": 0.8, "conciseness": 0.5, "faithful_to_source": 0.2, "few_shot_format": 0.2}, "failure_classification": {"category": "incomplete_edit", "description": "The experiment is described as enforcing a fixed summary format with explicit rules, but the failure mode is unknown and the very low score (1.7) suggests the requested edit was not applied consistently or fully, leaving an inconsistent prompt/behavior relative to the intended schema requirements.", "fix_direction": "Ensure the prompt changes fully cover all instances where the summary format, faithfulness rule, and inclusion/exclusion constraints are specified; verify outputs conform to the exact fixed structure in multiple test cases.", "confidence": 0.42}, "drafts_generated": 1, "drafts_survived": 1}
{"id": "119bbb7f-1740-4ebf-a7c8-46eaece369e0", "target_id": "B2-treatment", "git_sha": "175a02635573524abb0250ca6eae5d9b463eca92", "pre_experiment_sha": "175a02635573524abb0250ca6eae5d9b463eca92", "timestamp": "2026-04-19T08:16:14.426320+00:00", "hypothesis": "Rewrite the prompt to require a strict binary yes/no judgment on whether a text is a summary, with exact one-word output and balanced examples.", "hypothesis_source": "agent", "mutation_diff_summary": "", "score": 1.6, "score_ci_lower": 0.7, "score_ci_upper": 2.2, "raw_scores": [1.5, 0.0, 2.0, 2.5, 2.0], "baseline_score": 1.7, "outcome": "DISCARDED", "failure_mode": null, "duration_seconds": 25.673290374921635, "tags": ["binary", "classification", "shorter", "strict-output", "few-shot"], "learnings": "{\"what_changed\":\"\",\"what_improved\":[],\"what_regressed\":[],\"transferable_insight\":\"When a task demands a strict binary decision, the prompt should explicitly constrain the output format and provide balanced examples to reduce ambiguity and bias.\",\"domain_tags\":[\"prompt-engineering\",\"classification\",\"evaluation\"]}", "cost_usd": 0.03307235, "bootstrap_seed": 0, "agent_model": "gpt-5.4", "held_out_score": null, "criterion_names": ["key_points_captured", "conciseness", "faithful_to_source", "few_shot_format"], "per_criterion_scores": {"key_points_captured": 0.8, "conciseness": 0.3, "faithful_to_source": 0.4, "few_shot_format": 0.1}, "failure_classification": {"category": "output_format", "description": "The attempt appears to fail the required output structure: the prompt rewrite did not enforce (or successfully produce) a strict, exact one-word binary yes/no output format with balanced examples, leading to schema/output compliance failure.", "fix_direction": "Strengthen the prompt instructions to explicitly require only one word ('yes' or 'no'), add explicit formatting constraints (no punctuation/extra text), and include clearly labeled balanced positive/negative examples to ensure consistent binary classification behavior.", "confidence": 0.62}, "drafts_generated": 1, "drafts_survived": 1}
{"id": "3c40b1a3-b5cc-4873-9931-6bb592210307", "target_id": "B2-treatment", "git_sha": "175a02635573524abb0250ca6eae5d9b463eca92", "pre_experiment_sha": "175a02635573524abb0250ca6eae5d9b463eca92", "timestamp": "2026-04-19T08:16:34.382682+00:00", "hypothesis": "Replace the open-ended summarization prompt with a strict binary decision rule and exact two-label output.", "hypothesis_source": "agent", "mutation_diff_summary": "", "score": 2.0, "score_ci_lower": 1.4, "score_ci_upper": 2.6, "raw_scores": [2.0, 2.0, 3.0, 2.0, 1.0], "baseline_score": 1.7, "outcome": "DISCARDED", "failure_mode": null, "duration_seconds": 17.675222957972437, "tags": ["binary-classification", "stricter-output", "few-shot", "concise"], "learnings": "{\"what_changed\":\"\",\"what_improved\":[],\"what_regressed\":[],\"transferable_insight\":\"When a task requires consistent downstream use, replacing open-ended generation with a constrained decision format can improve reliability by reducing ambiguity and output variance.\",\"domain_tags\":[\"prompt-design\",\"decision-making\",\"output-formatting\"]}", "cost_usd": 0.01894235, "bootstrap_seed": 0, "agent_model": "gpt-5.4", "held_out_score": null, "criterion_names": ["key_points_captured", "conciseness", "faithful_to_source", "few_shot_format"], "per_criterion_scores": {"key_points_captured": 0.8, "conciseness": 0.7, "faithful_to_source": 0.4, "few_shot_format": 0.1}, "failure_classification": {"category": "output_format", "description": "The experiment aimed to enforce a strict two-label binary output, but the result failed the expected output structure/schema for that requirement (despite having a perfect score). This indicates the content likely followed the rule only partially or did not exactly match the required exact two-label output format.", "fix_direction": "Ensure the prompt and post-processing force an exact, schema-compliant response (e.g., only one of two allowed tokens/strings, no extra text, strict JSON/label formatting if required). Add validation that rejects any output deviating from the two allowed labels.", "confidence": 0.62}, "drafts_generated": 1, "drafts_survived": 1}
{"id": "e918fdbe-80f6-40b9-bbde-061f8724dcb8", "target_id": "B2-treatment", "git_sha": "175a02635573524abb0250ca6eae5d9b463eca92", "pre_experiment_sha": "175a02635573524abb0250ca6eae5d9b463eca92", "timestamp": "2026-04-19T08:16:54.839357+00:00", "hypothesis": "Rewrite the prompt to require a single concise summary sentence block with stricter fidelity and clearer examples.", "hypothesis_source": "agent", "mutation_diff_summary": "", "score": 2.2, "score_ci_lower": 1.6, "score_ci_upper": 3.1, "raw_scores": [1.5, 1.5, 2.0, 2.0, 4.0], "baseline_score": 1.7, "outcome": "DISCARDED", "failure_mode": null, "duration_seconds": 17.90513654204551, "tags": ["shorter", "stricter", "explicit-output", "few-shot", "summarization"], "learnings": "{\"what_changed\":\"\",\"what_improved\":[],\"what_regressed\":[],\"transferable_insight\":\"When a prompt change is discarded despite a positive score delta, the most transferable lesson is that measurable gains must be paired with clearer task alignment and user-visible value before the change is worth keeping.\",\"domain_tags\":[\"prompt-engineering\",\"evaluation\",\"product-design\"]}", "cost_usd": 0.02217015, "bootstrap_seed": 0, "agent_model": "gpt-5.4", "held_out_score": null, "criterion_names": ["key_points_captured", "conciseness", "faithful_to_source", "few_shot_format"], "per_criterion_scores": {"key_points_captured": 1.0, "conciseness": 0.5, "faithful_to_source": 0.4, "few_shot_format": 0.3}, "failure_classification": {"category": "output_format", "description": "The experiment appears to fail due to not meeting the required output structure/schema: the hypothesis calls for a specific stricter, single-sentence summary block, suggesting the actual output likely did not conform to that exact format despite some partial success (low score).", "fix_direction": "Ensure the response matches the required structure exactly (e.g., exactly one concise summary sentence block), and verify adherence to any explicit schema/formatting constraints before finalizing.", "confidence": 0.42}, "drafts_generated": 1, "drafts_survived": 1}
{"id": "095c3e57-80bb-4f82-afa0-a85b0141356f", "target_id": "B2-treatment", "git_sha": "175a02635573524abb0250ca6eae5d9b463eca92", "pre_experiment_sha": "175a02635573524abb0250ca6eae5d9b463eca92", "timestamp": "2026-04-19T08:17:19.385025+00:00", "hypothesis": "Replace the summarization prompt with a strict yes/no decision rule and balanced label-only examples.", "hypothesis_source": "agent", "mutation_diff_summary": "", "score": 2.1, "score_ci_lower": 1.5, "score_ci_upper": 2.6, "raw_scores": [1.0, 3.0, 2.5, 2.0, 2.0], "baseline_score": 1.7, "outcome": "DISCARDED", "failure_mode": null, "duration_seconds": 19.62963795894757, "tags": ["binary-classification", "stricter-rule", "few-shot", "label-only"], "learnings": "{\"what_changed\":\"\",\"what_improved\":[],\"what_regressed\":[],\"transferable_insight\":\"When a task requires nuanced synthesis, replacing it with an overly rigid binary rule can preserve apparent performance while failing to improve the underlying capability.\",\"domain_tags\":[\"evaluation\",\"prompt-design\",\"classification\"]}", "cost_usd": 0.01556235, "bootstrap_seed": 0, "agent_model": "gpt-5.4", "held_out_score": null, "criterion_names": ["key_points_captured", "conciseness", "faithful_to_source", "few_shot_format"], "per_criterion_scores": {"key_points_captured": 0.9, "conciseness": 0.5, "faithful_to_source": 0.5, "few_shot_format": 0.2}, "failure_classification": {"category": "semantic_drift", "description": "The change likely caused the model to follow a strict yes/no decision rule, but it did not preserve the intended summarization meaning. Even though the attempt scored moderately (2.1000), the output appears to have drifted semantically rather than failing purely on formatting or syntax.", "fix_direction": "Focus on maintaining the original semantic intent while adding the yes/no constraint\u2014validate that the decision rule maps to the same underlying criteria as before, and use balanced label-only examples that reflect the exact target semantics.", "confidence": 0.42}, "drafts_generated": 1, "drafts_survived": 1}
