{"id": "b37c4c8f-e9d3-4dfc-9b9b-fb40124df84f", "target_id": "B2-treatment", "git_sha": "175a02635573524abb0250ca6eae5d9b463eca92", "pre_experiment_sha": "175a02635573524abb0250ca6eae5d9b463eca92", "timestamp": "2026-04-19T08:17:38.482304+00:00", "hypothesis": "Replace the summarization prompt with a minimal binary labeling rule and balanced examples that force exact YES/NO outputs.", "hypothesis_source": "agent", "mutation_diff_summary": "", "score": 1.5, "score_ci_lower": 0.9, "score_ci_upper": 2.1, "raw_scores": [1.5, 2.0, 2.5, 0.5, 1.0], "baseline_score": 1.7, "outcome": "DISCARDED", "failure_mode": null, "duration_seconds": 15.756270917016082, "tags": ["binary-classification", "strict-output", "few-shot", "simplification"], "learnings": "{\"what_changed\":\"\",\"what_improved\":[],\"what_regressed\":[],\"transferable_insight\":\"When a task requires nuanced judgment, replacing a richer prompt with an overly rigid binary format can reduce performance by oversimplifying the decision boundary.\",\"domain_tags\":[\"prompt-design\",\"classification\",\"evaluation\"]}", "cost_usd": 0.01520055, "bootstrap_seed": 0, "agent_model": "gpt-5.4", "held_out_score": null, "criterion_names": ["key_points_captured", "conciseness", "faithful_to_source", "few_shot_format"], "per_criterion_scores": {"key_points_captured": 0.7, "conciseness": 0.5, "faithful_to_source": 0.3, "few_shot_format": 0.0}, "failure_classification": {"category": "output_format", "description": "The experiment intended to force exact YES/NO outputs via a simplified labeling prompt, but the run failed in a way consistent with output formatting/structure not matching the required schema or exact output constraints, leading to low score.", "fix_direction": "Tighten the prompt and decoding constraints to strictly enforce the required output schema (exactly 'YES' or 'NO', no extra tokens/fields), and validate against an automated checker before evaluation.", "confidence": 0.55}, "drafts_generated": 1, "drafts_survived": 1}
{"id": "f1860ddd-3eef-4647-9a71-a19d6b9f07ad", "target_id": "B2-treatment", "git_sha": "1d06bec19d62d20e1720fea792a2126bcc6de39a", "pre_experiment_sha": "175a02635573524abb0250ca6eae5d9b463eca92", "timestamp": "2026-04-19T08:17:59.596089+00:00", "hypothesis": "Replace the summarization prompt with a minimal binary relevance rule and balanced label-only few-shot examples.", "hypothesis_source": "agent", "mutation_diff_summary": "", "score": 2.3, "score_ci_lower": 1.8, "score_ci_upper": 2.9, "raw_scores": [1.5, 2.0, 2.5, 2.0, 3.5], "baseline_score": 1.7, "outcome": "KEPT", "failure_mode": null, "duration_seconds": 18.807979958015494, "tags": ["binary-classification", "strict-output", "few-shot", "simplification"], "learnings": "{\"what_changed\":\"\",\"what_improved\":[],\"what_regressed\":[],\"transferable_insight\":\"When a task is fundamentally a binary decision, simplifying the prompt to an explicit rule with balanced label-only examples can improve consistency and performance by reducing ambiguity and extraneous reasoning.\",\"domain_tags\":[\"prompt-engineering\",\"classification\",\"few-shot-learning\"]}", "cost_usd": 0.02084055, "bootstrap_seed": 0, "agent_model": "gpt-5.4", "held_out_score": null, "criterion_names": ["key_points_captured", "conciseness", "faithful_to_source", "few_shot_format"], "per_criterion_scores": {"key_points_captured": 1.0, "conciseness": 0.7, "faithful_to_source": 0.5, "few_shot_format": 0.1}, "failure_classification": null, "drafts_generated": 1, "drafts_survived": 1}
{"id": "9c6542b6-3fb7-4c55-bfd3-c0e7ad4982b3", "target_id": "B2-treatment", "git_sha": "e38fba56bdbfce3e7ab35fdf8e01f0e80ef2a123", "pre_experiment_sha": "1d06bec19d62d20e1720fea792a2126bcc6de39a", "timestamp": "2026-04-19T08:18:23.453963+00:00", "hypothesis": "A shorter rule with exact label-only behavior and balanced minimal examples will improve binary consistency.", "hypothesis_source": "agent", "mutation_diff_summary": "", "score": 1.4, "score_ci_lower": 1.1, "score_ci_upper": 1.7, "raw_scores": [1.5, 1.5, 2.0, 1.0, 1.0], "baseline_score": 2.3, "outcome": "KEPT", "failure_mode": null, "duration_seconds": 20.94775558297988, "tags": ["binary-classification", "minimal", "label-only", "few-shot"], "learnings": "{\"what_changed\":\"\",\"what_improved\":[],\"what_regressed\":[],\"transferable_insight\":\"When a task is constrained to exact label-only outputs, using the shortest sufficient rule set with balanced minimal examples can improve consistency without introducing regressions.\",\"domain_tags\":[\"instruction-following\",\"classification\",\"prompt-design\"]}", "cost_usd": 0.014970750000000001, "bootstrap_seed": 0, "agent_model": "gpt-5.4", "held_out_score": null, "criterion_names": ["key_points_captured", "conciseness", "faithful_to_source", "few_shot_format"], "per_criterion_scores": {"key_points_captured": 0.8, "conciseness": 0.4, "faithful_to_source": 0.1, "few_shot_format": 0.1}, "failure_classification": null, "drafts_generated": 1, "drafts_survived": 1}
{"id": "a9d1d1b6-40c7-415c-8985-5d4eca8e03b5", "target_id": "B2-treatment", "git_sha": "0f31d3a71ec60cdaa9cbd61ee428e6f45729e73e", "pre_experiment_sha": "e38fba56bdbfce3e7ab35fdf8e01f0e80ef2a123", "timestamp": "2026-04-19T08:18:42.867823+00:00", "hypothesis": "A shorter label-only prompt with a single explicit sufficiency rule and balanced examples will improve binary consistency.", "hypothesis_source": "agent", "mutation_diff_summary": "", "score": 1.5, "score_ci_lower": 1.1, "score_ci_upper": 1.9, "raw_scores": [1.0, 1.5, 2.0, 2.0, 1.0], "baseline_score": 1.4, "outcome": "KEPT", "failure_mode": null, "duration_seconds": 18.256089666043408, "tags": ["binary-classification", "minimal", "label-only", "few-shot"], "learnings": "{\"what_changed\":\"\",\"what_improved\":[],\"what_regressed\":[],\"transferable_insight\":\"When a task is binary, making the decision rule explicit and keeping the prompt concise can improve consistency without needing additional examples or explanation.\",\"domain_tags\":[\"prompt-engineering\",\"decision-making\",\"classification\"]}", "cost_usd": 0.01266335, "bootstrap_seed": 0, "agent_model": "gpt-5.4", "held_out_score": null, "criterion_names": ["key_points_captured", "conciseness", "faithful_to_source", "few_shot_format"], "per_criterion_scores": {"key_points_captured": 0.8, "conciseness": 0.6, "faithful_to_source": 0.1, "few_shot_format": 0.0}, "failure_classification": null, "drafts_generated": 1, "drafts_survived": 1}
{"id": "5c6c7b93-71fa-421d-9a6b-7b39a9f8b85a", "target_id": "B2-treatment", "git_sha": "281e625859e77550ba21c5add00f1c6fc8a36f4c", "pre_experiment_sha": "0f31d3a71ec60cdaa9cbd61ee428e6f45729e73e", "timestamp": "2026-04-19T08:19:05.054810+00:00", "hypothesis": "A shorter source-only binary rule with exact repeated labels and balanced examples will improve consistent YES/NO classification.", "hypothesis_source": "agent", "mutation_diff_summary": "", "score": 1.5, "score_ci_lower": 0.6, "score_ci_upper": 2.5, "raw_scores": [3.0, 1.0, 0.0, 2.5, 1.0], "baseline_score": 1.5, "outcome": "KEPT", "failure_mode": null, "duration_seconds": 21.149656582972966, "tags": ["binary-classification", "minimal", "source-only", "few-shot"], "learnings": "{\"what_changed\":\"\",\"what_improved\":[],\"what_regressed\":[],\"transferable_insight\":\"When a task uses a simple source-only rule with exact label repetition and balanced examples, consistency can improve even if overall measured performance does not change.\",\"domain_tags\":[\"classification\",\"experimental-design\",\"data-balancing\"]}", "cost_usd": 0.013953150000000001, "bootstrap_seed": 0, "agent_model": "gpt-5.4", "held_out_score": null, "criterion_names": ["key_points_captured", "conciseness", "faithful_to_source", "few_shot_format"], "per_criterion_scores": {"key_points_captured": 0.7, "conciseness": 0.2, "faithful_to_source": 0.4, "few_shot_format": 0.2}, "failure_classification": null, "drafts_generated": 1, "drafts_survived": 1}
{"id": "3c588592-91be-40ee-85ff-51121bb0fbca", "target_id": "B2-treatment", "git_sha": "e4f09c863b59ae8f0d6e532d19ae00d91ac07c24", "pre_experiment_sha": "281e625859e77550ba21c5add00f1c6fc8a36f4c", "timestamp": "2026-04-19T08:19:22.680445+00:00", "hypothesis": "A stricter label-only prompt with a simple source-text sufficiency rule and balanced examples will improve binary consistency.", "hypothesis_source": "agent", "mutation_diff_summary": "", "score": 2.3, "score_ci_lower": 1.6, "score_ci_upper": 3.1, "raw_scores": [2.0, 1.0, 2.0, 3.5, 3.0], "baseline_score": 1.5, "outcome": "KEPT", "failure_mode": null, "duration_seconds": 13.92585695895832, "tags": ["binary-classification", "label-only", "few-shot", "minimal"], "learnings": "{\"what_changed\":\"\",\"what_improved\":[],\"what_regressed\":[],\"transferable_insight\":\"Constraining outputs to a narrow label set with a clear sufficiency rule and balanced examples can improve binary decision consistency without changing the underlying task.\",\"domain_tags\":[\"prompt-design\",\"classification\",\"evaluation\"]}", "cost_usd": 0.01311235, "bootstrap_seed": 0, "agent_model": "gpt-5.4", "held_out_score": null, "criterion_names": ["key_points_captured", "conciseness", "faithful_to_source", "few_shot_format"], "per_criterion_scores": {"key_points_captured": 1.0, "conciseness": 0.4, "faithful_to_source": 0.5, "few_shot_format": 0.4}, "failure_classification": null, "drafts_generated": 1, "drafts_survived": 1}
{"id": "e06ecb70-30fe-4816-8617-b1d3fa438e7d", "target_id": "B2-treatment", "git_sha": "167a0dfa74f4d1c80df7ea98b2578e2c0863e10e", "pre_experiment_sha": "e4f09c863b59ae8f0d6e532d19ae00d91ac07c24", "timestamp": "2026-04-19T08:19:43.286322+00:00", "hypothesis": "A tighter label-only prompt with a simple sufficiency rule and balanced examples will improve binary consistency.", "hypothesis_source": "agent", "mutation_diff_summary": "", "score": 1.9, "score_ci_lower": 1.1, "score_ci_upper": 2.8, "raw_scores": [1.5, 2.5, 3.5, 1.0, 1.0], "baseline_score": 2.3, "outcome": "KEPT", "failure_mode": null, "duration_seconds": 19.25356904102955, "tags": ["binary-classification", "minimal", "label-only", "few-shot"], "learnings": "{\"what_changed\":\"\",\"what_improved\":[],\"what_regressed\":[],\"transferable_insight\":\"Constraining outputs to a minimal label-only format with an explicit decision rule and balanced examples can improve binary consistency by reducing ambiguity and response drift.\",\"domain_tags\":[\"prompt-design\",\"classification\",\"evaluation\"]}", "cost_usd": 0.015184350000000001, "bootstrap_seed": 0, "agent_model": "gpt-5.4", "held_out_score": null, "criterion_names": ["key_points_captured", "conciseness", "faithful_to_source", "few_shot_format"], "per_criterion_scores": {"key_points_captured": 0.8, "conciseness": 0.5, "faithful_to_source": 0.4, "few_shot_format": 0.2}, "failure_classification": null, "drafts_generated": 1, "drafts_survived": 1}
{"id": "73edacb1-3822-4287-9778-0823f421fcbd", "target_id": "B2-treatment", "git_sha": "e6ae307c2c2755f1b9e8c6f9d52efc82aee9258f", "pre_experiment_sha": "167a0dfa74f4d1c80df7ea98b2578e2c0863e10e", "timestamp": "2026-04-19T08:19:59.896641+00:00", "hypothesis": "A shorter, stricter label-only prompt with a concrete sufficiency rule and balanced examples will improve binary consistency.", "hypothesis_source": "agent", "mutation_diff_summary": "", "score": 1.6, "score_ci_lower": 1.2, "score_ci_upper": 2.1, "raw_scores": [1.0, 1.5, 1.5, 1.5, 2.5], "baseline_score": 1.9, "outcome": "KEPT", "failure_mode": null, "duration_seconds": 15.59421866608318, "tags": ["binary-classification", "minimal", "label-only", "few-shot"], "learnings": "{\"what_changed\":\"\",\"what_improved\":[],\"what_regressed\":[],\"transferable_insight\":\"A concise, rule-driven prompt with clear decision criteria and balanced examples can improve binary consistency by reducing ambiguity and overfitting to wording.\",\"domain_tags\":[\"prompt-engineering\",\"classification\",\"decision-making\"]}", "cost_usd": 0.01468635, "bootstrap_seed": 0, "agent_model": "gpt-5.4", "held_out_score": null, "criterion_names": ["key_points_captured", "conciseness", "faithful_to_source", "few_shot_format"], "per_criterion_scores": {"key_points_captured": 0.9, "conciseness": 0.4, "faithful_to_source": 0.2, "few_shot_format": 0.1}, "failure_classification": null, "drafts_generated": 1, "drafts_survived": 1}
{"id": "4cf77c62-4c7f-4302-b8e0-35048b4bddf7", "target_id": "B2-treatment", "git_sha": "0c100a56a1be3d05ab812a2767f0e69c543ca8f5", "pre_experiment_sha": "e6ae307c2c2755f1b9e8c6f9d52efc82aee9258f", "timestamp": "2026-04-19T08:20:19.657252+00:00", "hypothesis": "A shorter rule with strict label-only output and balanced examples will improve binary classification consistency.", "hypothesis_source": "agent", "mutation_diff_summary": "", "score": 1.4, "score_ci_lower": 0.9, "score_ci_upper": 1.9, "raw_scores": [1.0, 2.0, 2.0, 1.5, 0.5], "baseline_score": 1.6, "outcome": "KEPT", "failure_mode": null, "duration_seconds": 16.16194016695954, "tags": ["binary-classification", "minimal", "few-shot", "label-only"], "learnings": "{\"what_changed\":\"\",\"what_improved\":[],\"what_regressed\":[],\"transferable_insight\":\"When a task requires binary decisions, concise instructions that enforce a fixed output format and include balanced examples can improve consistency by reducing ambiguity.\",\"domain_tags\":[\"prompt-design\",\"classification\",\"evaluation\"]}", "cost_usd": 0.01292475, "bootstrap_seed": 0, "agent_model": "gpt-5.4", "held_out_score": null, "criterion_names": ["key_points_captured", "conciseness", "faithful_to_source", "few_shot_format"], "per_criterion_scores": {"key_points_captured": 0.8, "conciseness": 0.6, "faithful_to_source": 0.0, "few_shot_format": 0.0}, "failure_classification": null, "drafts_generated": 1, "drafts_survived": 1}
{"id": "000443c9-3078-480c-8ab3-bbd0208664af", "target_id": "B2-treatment", "git_sha": "274cab67796483548e48ccd7cb49d6f1b057c594", "pre_experiment_sha": "0c100a56a1be3d05ab812a2767f0e69c543ca8f5", "timestamp": "2026-04-19T08:20:34.620375+00:00", "hypothesis": "A shorter, stricter binary prompt with balanced examples will improve exact label-only classification.", "hypothesis_source": "agent", "mutation_diff_summary": "", "score": 2.4, "score_ci_lower": 1.8, "score_ci_upper": 3.1, "raw_scores": [3.0, 2.0, 2.0, 1.5, 3.5], "baseline_score": 1.4, "outcome": "KEPT", "failure_mode": null, "duration_seconds": 13.87133533298038, "tags": ["binary-classification", "minimal", "exact-output", "few-shot"], "learnings": "{\"what_changed\":\"\",\"what_improved\":[],\"what_regressed\":[],\"transferable_insight\":\"When the task requires exact categorical output, reducing prompt ambiguity and enforcing a strict binary format can improve consistency and accuracy.\",\"domain_tags\":[\"prompt-engineering\",\"classification\",\"evaluation\"]}", "cost_usd": 0.015070950000000001, "bootstrap_seed": 0, "agent_model": "gpt-5.4", "held_out_score": null, "criterion_names": ["key_points_captured", "conciseness", "faithful_to_source", "few_shot_format"], "per_criterion_scores": {"key_points_captured": 1.0, "conciseness": 0.4, "faithful_to_source": 0.6, "few_shot_format": 0.4}, "failure_classification": null, "drafts_generated": 1, "drafts_survived": 1}
{"id": "ec3b039c-9f8f-425b-a459-3e8c1b5e9e6d", "target_id": "B2-treatment", "git_sha": "274cab67796483548e48ccd7cb49d6f1b057c594", "pre_experiment_sha": "274cab67796483548e48ccd7cb49d6f1b057c594", "timestamp": "2026-04-19T08:20:53.807934+00:00", "hypothesis": "Simplifying to a strict label-only binary rule with balanced examples will improve consistent YES/NO classification.", "hypothesis_source": "agent", "mutation_diff_summary": "", "score": 1.6, "score_ci_lower": 1.2, "score_ci_upper": 2.1, "raw_scores": [1.0, 1.5, 1.5, 1.5, 2.5], "baseline_score": 2.4, "outcome": "DISCARDED", "failure_mode": null, "duration_seconds": 17.935658333008178, "tags": ["binary-classification", "minimal", "label-only", "few-shot"], "learnings": "{\"what_changed\":\"\",\"what_improved\":[],\"what_regressed\":[],\"transferable_insight\":\"When a simplification yields no measurable gains, avoid assuming reduced rule complexity or balanced examples will improve consistency without evidence from the target task.\",\"domain_tags\":[\"evaluation\",\"classification\",\"experimental-design\"]}", "cost_usd": 0.013996750000000002, "bootstrap_seed": 0, "agent_model": "gpt-5.4", "held_out_score": null, "criterion_names": ["key_points_captured", "conciseness", "faithful_to_source", "few_shot_format"], "per_criterion_scores": {"key_points_captured": 1.0, "conciseness": 0.2, "faithful_to_source": 0.3, "few_shot_format": 0.1}, "failure_classification": {"category": "semantic_drift", "description": "The experiment likely produced outputs that fit the intended format but did not preserve the intended meaning/label semantics of the strict balanced YES/NO rule. The low score (1.6) suggests the rule may have been applied inconsistently or with incorrect decision boundaries, leading to systematically wrong classifications rather than a structural or syntax failure.", "fix_direction": "Refine the labeling/decision logic to ensure the binary rule exactly matches the intended YES/NO criteria (calibrate thresholds, verify mapping of features to labels, and add sanity checks on balanced examples).", "confidence": 0.62}, "drafts_generated": 1, "drafts_survived": 1}
{"id": "30f094ba-aafa-4cb3-bcd1-6a85b46098a7", "target_id": "B2-treatment", "git_sha": "274cab67796483548e48ccd7cb49d6f1b057c594", "pre_experiment_sha": "274cab67796483548e48ccd7cb49d6f1b057c594", "timestamp": "2026-04-19T08:21:13.883643+00:00", "hypothesis": "A shorter prompt with a single binary rule and tightly matched label-only examples will improve exact binary classification.", "hypothesis_source": "agent", "mutation_diff_summary": "", "score": 1.4, "score_ci_lower": 1.1, "score_ci_upper": 1.7, "raw_scores": [1.0, 1.5, 2.0, 1.0, 1.5], "baseline_score": 2.4, "outcome": "DISCARDED", "failure_mode": null, "duration_seconds": 15.2634426249424, "tags": ["binary-classification", "minimal", "few-shot", "label-only"], "learnings": "{\"what_changed\":\"\",\"what_improved\":[],\"what_regressed\":[],\"transferable_insight\":\"Simplifying instructions and examples does not reliably improve binary classification unless the prompt also preserves enough task-specific context to disambiguate edge cases.\",\"domain_tags\":[\"prompt-engineering\",\"classification\",\"evaluation\"]}", "cost_usd": 0.01403215, "bootstrap_seed": 0, "agent_model": "gpt-5.4", "held_out_score": null, "criterion_names": ["key_points_captured", "conciseness", "faithful_to_source", "few_shot_format"], "per_criterion_scores": {"key_points_captured": 1.0, "conciseness": 0.1, "faithful_to_source": 0.3, "few_shot_format": 0.0}, "failure_classification": {"category": "semantic_drift", "description": "The experiment does not appear to fail due to formatting/parsing; instead it likely produced outputs that follow the required structure but do not match the intended label logic, leading to a low score (1.4000) under the hypothesis.", "fix_direction": "Tighten the mapping between the single binary rule and the label-only examples (ensure the prompt encodes the exact decision boundary), and validate on a small hand-checked set to confirm the rule truly drives the correct label rather than drifting semantically.", "confidence": 0.62}, "drafts_generated": 1, "drafts_survived": 1}
{"id": "ff46c264-4545-4f90-8fb9-0c35fbc67cd6", "target_id": "B2-treatment", "git_sha": "274cab67796483548e48ccd7cb49d6f1b057c594", "pre_experiment_sha": "274cab67796483548e48ccd7cb49d6f1b057c594", "timestamp": "2026-04-19T08:21:33.749876+00:00", "hypothesis": "A shorter, stricter binary prompt with exact label-only examples will improve consistent YES/NO classification.", "hypothesis_source": "agent", "mutation_diff_summary": "", "score": 1.1, "score_ci_lower": 0.8, "score_ci_upper": 1.4, "raw_scores": [1.0, 1.0, 0.5, 1.5, 1.5], "baseline_score": 2.4, "outcome": "DISCARDED", "failure_mode": null, "duration_seconds": 17.09564820898231, "tags": ["binary-classification", "minimal", "exact-output", "few-shot"], "learnings": "{\"what_changed\":\"\",\"what_improved\":[],\"what_regressed\":[],\"transferable_insight\":\"Making instructions shorter and stricter does not necessarily improve consistency; if the task is already ambiguous or under-specified, reducing guidance can fail to change outcomes or even hurt performance.\",\"domain_tags\":[\"prompt-design\",\"classification\",\"evaluation\"]}", "cost_usd": 0.01474975, "bootstrap_seed": 0, "agent_model": "gpt-5.4", "held_out_score": null, "criterion_names": ["key_points_captured", "conciseness", "faithful_to_source", "few_shot_format"], "per_criterion_scores": {"key_points_captured": 0.6, "conciseness": 0.1, "faithful_to_source": 0.3, "few_shot_format": 0.1}, "failure_classification": {"category": "output_format", "description": "The experiment failed to produce output in the expected strict YES/NO label-only format (or otherwise violated the required output structure/schema), leading to a failure despite the score being high.", "fix_direction": "Tighten the prompt to enforce label-only output (e.g., single token YES/NO), add explicit formatting constraints, and include exact label-only few-shot examples that match the required schema exactly.", "confidence": 0.62}, "drafts_generated": 1, "drafts_survived": 1}
