{"id": "09f142fe-af39-478d-93a5-e5fbceacfa2d", "target_id": "B2-treatment", "git_sha": "274cab67796483548e48ccd7cb49d6f1b057c594", "pre_experiment_sha": "274cab67796483548e48ccd7cb49d6f1b057c594", "timestamp": "2026-04-19T08:21:51.134213+00:00", "hypothesis": "A shorter, stricter binary prompt with symmetric YES/NO examples will improve exact label-only classification.", "hypothesis_source": "agent", "mutation_diff_summary": "", "score": 1.7, "score_ci_lower": 1.1, "score_ci_upper": 2.4, "raw_scores": [2.0, 1.5, 1.0, 3.0, 1.0], "baseline_score": 2.4, "outcome": "DISCARDED", "failure_mode": null, "duration_seconds": 14.920061332988553, "tags": ["binary-classification", "minimal", "exact-output", "few-shot"], "learnings": "{\"what_changed\":\"\",\"what_improved\":[],\"what_regressed\":[],\"transferable_insight\":\"When a prompt change is discarded with no measured gains or regressions, the safest takeaway is that brevity and symmetry alone are not reliable substitutes for task-specific calibration.\",\"domain_tags\":[\"prompt-engineering\",\"evaluation\",\"classification\"]}", "cost_usd": 0.014356950000000002, "bootstrap_seed": 0, "agent_model": "gpt-5.4", "held_out_score": null, "criterion_names": ["key_points_captured", "conciseness", "faithful_to_source", "few_shot_format"], "per_criterion_scores": {"key_points_captured": 0.7, "conciseness": 0.5, "faithful_to_source": 0.4, "few_shot_format": 0.1}, "failure_classification": {"category": "semantic_drift", "description": "The experiment aimed to improve classification accuracy via prompt formatting, but it appears to have produced an output that did not align with the intended meaning of the labels (i.e., classification behavior changed incorrectly rather than merely formatting).", "fix_direction": "Keep the prompt format change minimal and add a small set of balanced, label-consistent examples; verify the model still maps YES/NO (or other signals) strictly to the intended classes, and test against a fixed evaluation set to ensure meaning is preserved.", "confidence": 0.62}, "drafts_generated": 1, "drafts_survived": 1}
{"id": "e014e3cb-f41a-488c-8e68-6cd7c9ba848b", "target_id": "B2-treatment", "git_sha": "61fd404e9aba5593d03a43dce4e54b03854f188b", "pre_experiment_sha": "274cab67796483548e48ccd7cb49d6f1b057c594", "timestamp": "2026-04-19T08:22:10.484026+00:00", "hypothesis": "Make the prompt shorter and more strictly binary by centering one simple sufficiency rule and label-only examples.", "hypothesis_source": "agent", "mutation_diff_summary": "", "score": 1.9, "score_ci_lower": 1.5, "score_ci_upper": 2.5, "raw_scores": [2.0, 1.5, 1.5, 1.5, 3.0], "baseline_score": 2.4, "outcome": "KEPT", "failure_mode": null, "duration_seconds": 15.228986875037663, "tags": ["binary-classification", "minimal", "few-shot", "label-consistency"], "learnings": "{\"what_changed\":\"\",\"what_improved\":[],\"what_regressed\":[],\"transferable_insight\":\"When a task depends on a yes/no judgment, a single explicit sufficiency rule plus label-only examples can reduce ambiguity and make decisions more consistent.\",\"domain_tags\":[\"prompt-engineering\",\"classification\",\"decision-making\"]}", "cost_usd": 0.013063150000000003, "bootstrap_seed": 0, "agent_model": "gpt-5.4", "held_out_score": null, "criterion_names": ["key_points_captured", "conciseness", "faithful_to_source", "few_shot_format"], "per_criterion_scores": {"key_points_captured": 1.0, "conciseness": 0.7, "faithful_to_source": 0.2, "few_shot_format": 0.0}, "failure_classification": null, "drafts_generated": 1, "drafts_survived": 1}
{"id": "0d2c9fdf-f650-46b8-9e8d-d7a394501780", "target_id": "B2-treatment", "git_sha": "de3546553dc0a4b7fd7d331b269b4f7f71b2fd05", "pre_experiment_sha": "61fd404e9aba5593d03a43dce4e54b03854f188b", "timestamp": "2026-04-19T08:22:29.650634+00:00", "hypothesis": "Make the prompt a stricter binary classifier with shorter rule wording and balanced label-only examples.", "hypothesis_source": "agent", "mutation_diff_summary": "", "score": 1.7, "score_ci_lower": 1.2, "score_ci_upper": 2.2, "raw_scores": [2.0, 2.5, 1.0, 1.0, 2.0], "baseline_score": 1.9, "outcome": "KEPT", "failure_mode": null, "duration_seconds": 18.061829291982576, "tags": ["binary-classification", "minimal", "few-shot", "label-only"], "learnings": "{\"what_changed\":\"\",\"what_improved\":[],\"what_regressed\":[],\"transferable_insight\":\"When a task requires categorical decisions, simplifying the rules and balancing examples around the exact labels can improve consistency without changing the underlying criteria.\",\"domain_tags\":[\"classification\",\"prompt-design\",\"evaluation\"]}", "cost_usd": 0.014995750000000002, "bootstrap_seed": 0, "agent_model": "gpt-5.4", "held_out_score": null, "criterion_names": ["key_points_captured", "conciseness", "faithful_to_source", "few_shot_format"], "per_criterion_scores": {"key_points_captured": 1.0, "conciseness": 0.3, "faithful_to_source": 0.4, "few_shot_format": 0.0}, "failure_classification": null, "drafts_generated": 1, "drafts_survived": 1}
{"id": "a6c7b825-cb0f-4f08-9720-2e350ccc3d95", "target_id": "B2-treatment", "git_sha": "0820b925226922f75238b3b13ef96444ab165d9a", "pre_experiment_sha": "de3546553dc0a4b7fd7d331b269b4f7f71b2fd05", "timestamp": "2026-04-19T08:22:46.713180+00:00", "hypothesis": "Make the prompt a tighter binary sufficiency check with simpler rule wording and balanced label-only examples.", "hypothesis_source": "agent", "mutation_diff_summary": "", "score": 1.5, "score_ci_lower": 1.2, "score_ci_upper": 1.8, "raw_scores": [1.5, 1.5, 2.0, 1.5, 1.0], "baseline_score": 1.7, "outcome": "KEPT", "failure_mode": null, "duration_seconds": 16.01735283306334, "tags": ["binary-classification", "minimal", "label-consistency", "few-shot"], "learnings": "{\"what_changed\":\"\",\"what_improved\":[],\"what_regressed\":[],\"transferable_insight\":\"When a task is a binary decision, simplifying the rule language and balancing examples around the labels can improve consistency without needing additional complexity.\",\"domain_tags\":[\"prompt-design\",\"classification\",\"evaluation\"]}", "cost_usd": 0.014766550000000003, "bootstrap_seed": 0, "agent_model": "gpt-5.4", "held_out_score": null, "criterion_names": ["key_points_captured", "conciseness", "faithful_to_source", "few_shot_format"], "per_criterion_scores": {"key_points_captured": 0.9, "conciseness": 0.4, "faithful_to_source": 0.2, "few_shot_format": 0.0}, "failure_classification": null, "drafts_generated": 1, "drafts_survived": 1}
{"id": "05455a6e-19af-4414-be11-f1f90c47383e", "target_id": "B2-treatment", "git_sha": "eddaa688bfdd9f468040ffc1ed154af3ae612952", "pre_experiment_sha": "0820b925226922f75238b3b13ef96444ab165d9a", "timestamp": "2026-04-19T08:23:05.863595+00:00", "hypothesis": "A shorter prompt with one explicit sufficiency rule and balanced label-only examples will improve binary consistency.", "hypothesis_source": "agent", "mutation_diff_summary": "", "score": 1.8, "score_ci_lower": 1.3, "score_ci_upper": 2.3, "raw_scores": [1.0, 1.5, 2.5, 1.5, 2.5], "baseline_score": 1.5, "outcome": "KEPT", "failure_mode": null, "duration_seconds": 16.37503499991726, "tags": ["binary-classification", "simplification", "few-shot", "label-consistency"], "learnings": "{\"what_changed\":\"\",\"what_improved\":[],\"what_regressed\":[],\"transferable_insight\":\"A concise instruction set with one clear decision rule and balanced examples can improve binary consistency without needing additional elaboration.\",\"domain_tags\":[\"prompt-design\",\"classification\",\"decision-making\"]}", "cost_usd": 0.014733350000000001, "bootstrap_seed": 0, "agent_model": "gpt-5.4", "held_out_score": null, "criterion_names": ["key_points_captured", "conciseness", "faithful_to_source", "few_shot_format"], "per_criterion_scores": {"key_points_captured": 1.0, "conciseness": 0.2, "faithful_to_source": 0.5, "few_shot_format": 0.1}, "failure_classification": null, "drafts_generated": 1, "drafts_survived": 1}
{"id": "c5935a27-0acd-4e83-901d-0f98249216b3", "target_id": "B2-treatment", "git_sha": "0135d4eae8fc6163df452171233bcf86ac8d9e5b", "pre_experiment_sha": "eddaa688bfdd9f468040ffc1ed154af3ae612952", "timestamp": "2026-04-19T08:23:23.056169+00:00", "hypothesis": "A stricter, shorter prompt with a single sufficiency rule and balanced label-only examples will improve binary label consistency.", "hypothesis_source": "agent", "mutation_diff_summary": "", "score": 2.4, "score_ci_lower": 1.1, "score_ci_upper": 3.4, "raw_scores": [3.0, 0.0, 3.5, 3.5, 2.0], "baseline_score": 1.8, "outcome": "KEPT", "failure_mode": null, "duration_seconds": 16.058614625013433, "tags": ["binary-classification", "short-prompt", "few-shot", "label-consistency"], "learnings": "{\"what_changed\":\"\",\"what_improved\":[],\"what_regressed\":[],\"transferable_insight\":\"Reducing instructions to one clear sufficiency criterion and using balanced label-only examples can improve consistency in binary decisions.\",\"domain_tags\":[\"prompt-design\",\"classification\",\"decision-making\"]}", "cost_usd": 0.013636350000000002, "bootstrap_seed": 0, "agent_model": "gpt-5.4", "held_out_score": null, "criterion_names": ["key_points_captured", "conciseness", "faithful_to_source", "few_shot_format"], "per_criterion_scores": {"key_points_captured": 0.7, "conciseness": 0.6, "faithful_to_source": 0.8, "few_shot_format": 0.3}, "failure_classification": null, "drafts_generated": 1, "drafts_survived": 1}
{"id": "15d9260c-a778-42a5-bd52-2f627ca322e6", "target_id": "B2-treatment", "git_sha": "0135d4eae8fc6163df452171233bcf86ac8d9e5b", "pre_experiment_sha": "0135d4eae8fc6163df452171233bcf86ac8d9e5b", "timestamp": "2026-04-19T08:23:39.184251+00:00", "hypothesis": "Make the prompt a stricter binary sufficiency classifier with a single concrete rule and balanced label-only examples.", "hypothesis_source": "agent", "mutation_diff_summary": "", "score": 1.8, "score_ci_lower": 1.3, "score_ci_upper": 2.2, "raw_scores": [1.5, 2.0, 2.5, 2.0, 1.0], "baseline_score": 2.4, "outcome": "DISCARDED", "failure_mode": null, "duration_seconds": 15.080640041967854, "tags": ["binary-classification", "strict-format", "few-shot", "concise"], "learnings": "{\"what_changed\":\"\",\"what_improved\":[],\"what_regressed\":[],\"transferable_insight\":\"When a task requires consistent binary judgments, a single concrete decision rule with balanced label-only examples can improve clarity, but if it is too strict or underspecified it may fail to add useful signal.\",\"domain_tags\":[\"prompt-design\",\"classification\",\"evaluation\"]}", "cost_usd": 0.01594835, "bootstrap_seed": 0, "agent_model": "gpt-5.4", "held_out_score": null, "criterion_names": ["key_points_captured", "conciseness", "faithful_to_source", "few_shot_format"], "per_criterion_scores": {"key_points_captured": 0.7, "conciseness": 0.5, "faithful_to_source": 0.5, "few_shot_format": 0.1}, "failure_classification": {"category": "semantic_drift", "description": "The attempt appears to have changed the intended behavior of the prompt classifier (making it a stricter binary sufficiency classifier with a single concrete rule and balanced label-only examples), but it did not achieve the correct underlying meaning. Despite being guided by the hypothesis, the resulting output likely did not correspond to the required decision logic for sufficiency, leading to a low score.", "fix_direction": "Re-anchor the behavior to the original sufficiency definition: specify an unambiguous single rule, verify label-only example balance, and test that the classifier\u2019s decisions match the intended semantics rather than only the output form.", "confidence": 0.62}, "drafts_generated": 1, "drafts_survived": 1}
{"id": "6607fa72-4bf0-4a31-bf79-9d67dd41d1b9", "target_id": "B2-treatment", "git_sha": "23885e196d7954691ed4a2ceed7278343f7516d4", "pre_experiment_sha": "0135d4eae8fc6163df452171233bcf86ac8d9e5b", "timestamp": "2026-04-19T08:23:59.664011+00:00", "hypothesis": "Shortening the prompt into a strict binary sufficiency test with balanced examples will improve label consistency.", "hypothesis_source": "agent", "mutation_diff_summary": "", "score": 1.7, "score_ci_lower": 1.3, "score_ci_upper": 2.2, "raw_scores": [1.5, 1.5, 2.0, 2.5, 1.0], "baseline_score": 2.4, "outcome": "KEPT", "failure_mode": null, "duration_seconds": 15.894747500075027, "tags": ["binary-classifier", "concise", "balanced-few-shot"], "learnings": "{\"what_changed\":\"\",\"what_improved\":[],\"what_regressed\":[],\"transferable_insight\":\"When a prompt is reduced to a clear binary decision with balanced examples, it can improve consistency by minimizing ambiguity and forcing a more uniform judgment criterion.\",\"domain_tags\":[\"prompt-engineering\",\"classification\",\"evaluation\"]}", "cost_usd": 0.01348975, "bootstrap_seed": 0, "agent_model": "gpt-5.4", "held_out_score": null, "criterion_names": ["key_points_captured", "conciseness", "faithful_to_source", "few_shot_format"], "per_criterion_scores": {"key_points_captured": 0.8, "conciseness": 0.6, "faithful_to_source": 0.3, "few_shot_format": 0.0}, "failure_classification": null, "drafts_generated": 1, "drafts_survived": 1}
{"id": "a3de2927-a439-47ee-b850-1059ffaedb85", "target_id": "B2-treatment", "git_sha": "25b94eff649e60f0473ad1aeaa85f115073ea179", "pre_experiment_sha": "23885e196d7954691ed4a2ceed7278343f7516d4", "timestamp": "2026-04-19T08:24:17.984115+00:00", "hypothesis": "Shortening the prompt into a strict binary sufficiency test with balanced examples will improve label consistency.", "hypothesis_source": "agent", "mutation_diff_summary": "", "score": 3.4, "score_ci_lower": 3.2, "score_ci_upper": 3.5, "raw_scores": [3.5, 3.0, 3.5, 3.5, 3.5], "baseline_score": 1.7, "outcome": "KEPT", "failure_mode": null, "duration_seconds": 17.193600958096795, "tags": ["binary-classification", "few-shot", "concise", "label-consistency"], "learnings": "{\"what_changed\":\"\",\"what_improved\":[],\"what_regressed\":[],\"transferable_insight\":\"When a decision task is reduced to a strict binary criterion and illustrated with balanced examples, judgments tend to become more consistent.\",\"domain_tags\":[\"decision-making\",\"prompt-design\",\"classification\"]}", "cost_usd": 0.015308750000000001, "bootstrap_seed": 0, "agent_model": "gpt-5.4", "held_out_score": null, "criterion_names": ["key_points_captured", "conciseness", "faithful_to_source", "few_shot_format"], "per_criterion_scores": {"key_points_captured": 1.0, "conciseness": 0.7, "faithful_to_source": 1.0, "few_shot_format": 0.7}, "failure_classification": null, "drafts_generated": 1, "drafts_survived": 1}
{"id": "4cb3221f-518f-4609-8401-e7ffa301a6f4", "target_id": "B2-treatment", "git_sha": "25b94eff649e60f0473ad1aeaa85f115073ea179", "pre_experiment_sha": "25b94eff649e60f0473ad1aeaa85f115073ea179", "timestamp": "2026-04-19T08:24:34.910847+00:00", "hypothesis": "A shorter prompt with one explicit sufficiency rule and balanced label-only examples will improve binary consistency.", "hypothesis_source": "agent", "mutation_diff_summary": "", "score": 2.1, "score_ci_lower": 1.6, "score_ci_upper": 2.6, "raw_scores": [1.5, 3.0, 1.5, 2.5, 2.0], "baseline_score": 3.4, "outcome": "DISCARDED", "failure_mode": null, "duration_seconds": 15.91281149990391, "tags": ["binary-classification", "short-prompt", "strict-output", "balanced-few-shot"], "learnings": "{\"what_changed\":\"\",\"what_improved\":[],\"what_regressed\":[],\"transferable_insight\":\"When a prompt change yields no measurable gains, the safest conclusion is that the added constraint or simplification did not materially affect decision consistency and should not be adopted without stronger evidence.\",\"domain_tags\":[\"prompt-engineering\",\"evaluation\",\"decision-making\"]}", "cost_usd": 0.014726550000000003, "bootstrap_seed": 0, "agent_model": "gpt-5.4", "held_out_score": null, "criterion_names": ["key_points_captured", "conciseness", "faithful_to_source", "few_shot_format"], "per_criterion_scores": {"key_points_captured": 0.9, "conciseness": 0.5, "faithful_to_source": 0.5, "few_shot_format": 0.2}, "failure_classification": {"category": "logic_error", "description": "The provided information does not indicate what specific aspect of the experiment failed (format, logic, scope, parse, semantics, optimization, or completeness). The only numeric signal is a low-ish score (2.1000), but no failure-mode details are given.", "fix_direction": "Run the experiment with logging of the model output and evaluation traces to identify whether the failure was due to output schema/format, incorrect reasoning/meaning, disallowed edits, parse errors, or partial/inconsistent changes; then adjust the prompt along that identified axis (e.g., enforce strict JSON schema, verify rule application, or rebalance examples).", "confidence": 0.06}, "drafts_generated": 1, "drafts_survived": 1}
{"id": "81b0460f-63ee-4d58-8a50-6a7f4393d595", "target_id": "B2-treatment", "git_sha": "25b94eff649e60f0473ad1aeaa85f115073ea179", "pre_experiment_sha": "25b94eff649e60f0473ad1aeaa85f115073ea179", "timestamp": "2026-04-19T08:24:55.210096+00:00", "hypothesis": "Shortening to a stricter single-rule binary prompt with exact label-only examples will improve binary criteria adherence.", "hypothesis_source": "agent", "mutation_diff_summary": "", "score": 1.4, "score_ci_lower": 0.8, "score_ci_upper": 2.2, "raw_scores": [1.0, 1.0, 0.5, 1.5, 3.0], "baseline_score": 3.4, "outcome": "DISCARDED", "failure_mode": null, "duration_seconds": 14.805331708979793, "tags": ["binary-classification", "strict-format", "few-shot", "simplification"], "learnings": "{\"what_changed\":\"\",\"what_improved\":[],\"what_regressed\":[],\"transferable_insight\":\"When a stricter format change is discarded without measurable gains, the safest takeaway is that simplifying instructions alone does not guarantee better rule adherence and should be validated against the target behavior.\",\"domain_tags\":[\"prompt-design\",\"evaluation\",\"experimentation\"]}", "cost_usd": 0.01296575, "bootstrap_seed": 0, "agent_model": "gpt-5.4", "held_out_score": null, "criterion_names": ["key_points_captured", "conciseness", "faithful_to_source", "few_shot_format"], "per_criterion_scores": {"key_points_captured": 0.8, "conciseness": 0.3, "faithful_to_source": 0.3, "few_shot_format": 0.0}, "failure_classification": {"category": "semantic_drift", "description": "Despite the attempt to control output format with a stricter binary prompt and label-only examples, the model still failed to adhere to the intended binary criteria\u2014indicating the content/meaning did not reliably match the exact label definitions (format may be correct, but decision logic/thresholding drifted).", "fix_direction": "Tighten the label definitions and incorporate explicit positive/negative decision rules or minimal counterexamples for edge cases; add calibration prompts that force the model to map features to labels consistently rather than only restricting phrasing/format.", "confidence": 0.62}, "drafts_generated": 1, "drafts_survived": 1}
{"id": "14da8c37-7ce3-47ea-85d3-ab8f589d8a55", "target_id": "B2-treatment", "git_sha": "25b94eff649e60f0473ad1aeaa85f115073ea179", "pre_experiment_sha": "25b94eff649e60f0473ad1aeaa85f115073ea179", "timestamp": "2026-04-19T08:25:12.664660+00:00", "hypothesis": "Shortening the prompt to a single concrete sufficiency rule with balanced label-only examples will improve binary consistency.", "hypothesis_source": "agent", "mutation_diff_summary": "", "score": 2.2, "score_ci_lower": 1.4, "score_ci_upper": 3.0, "raw_scores": [1.5, 3.5, 2.0, 3.0, 1.0], "baseline_score": 3.4, "outcome": "DISCARDED", "failure_mode": null, "duration_seconds": 14.058558749966323, "tags": ["binary-classification", "concise", "rule-based", "few-shot"], "learnings": "{\"what_changed\":\"\",\"what_improved\":[],\"what_regressed\":[],\"transferable_insight\":\"Reducing instructions to a single clear rule does not guarantee better consistency if the examples and task framing fail to add enough discriminative guidance.\",\"domain_tags\":[\"prompt-design\",\"classification\",\"evaluation\"]}", "cost_usd": 0.012490550000000001, "bootstrap_seed": 0, "agent_model": "gpt-5.4", "held_out_score": null, "criterion_names": ["key_points_captured", "conciseness", "faithful_to_source", "few_shot_format"], "per_criterion_scores": {"key_points_captured": 0.8, "conciseness": 0.9, "faithful_to_source": 0.4, "few_shot_format": 0.1}, "failure_classification": {"category": "incomplete_edit", "description": "The experiment failed but there is no specific indication of a logic error, formatting violation, drift in meaning, or parsing issue; this suggests the change was not fully and consistently applied (e.g., partially updated prompt/labels or criteria), leaving the result unstable or incomplete despite the moderate score.", "fix_direction": "Ensure the prompt change is applied end-to-end: update the full template, include the full set of balanced label-only examples, and verify binary consistency across all evaluation cases (add a checklist/test to confirm completeness).", "confidence": 0.34}, "drafts_generated": 1, "drafts_survived": 1}
