{"id": "790998e2-85d6-40b3-9d28-60f652ba5ab0", "target_id": "B2-treatment", "git_sha": "fb93e180bf73cfa57c0cd479902d3d0787fc356b", "pre_experiment_sha": "79a1ed4e4e8464d7dc4c1be1d181266a8d037060", "timestamp": "2026-04-19T08:28:55.124604+00:00", "hypothesis": "Make the prompt more faithful to the original task wording while keeping a single strict sufficiency rule and balanced label-only examples.", "hypothesis_source": "agent", "mutation_diff_summary": "", "score": 1.3, "score_ci_lower": 1.0, "score_ci_upper": 1.7, "raw_scores": [2.0, 1.0, 1.5, 1.0, 1.0], "baseline_score": 1.9, "outcome": "KEPT", "failure_mode": null, "duration_seconds": 15.235005000024103, "tags": ["faithful", "concise", "binary-classification", "few-shot"], "learnings": "{\"what_changed\":\"\",\"what_improved\":[],\"what_regressed\":[],\"transferable_insight\":\"When a prompt is made closer to the original task wording, preserving one clear sufficiency criterion and balanced label-only examples can maintain consistency even if no explicit quality gains are observed.\",\"domain_tags\":[\"prompt-design\",\"evaluation\",\"instruction-following\"]}", "cost_usd": 0.019767150000000004, "bootstrap_seed": 0, "agent_model": "gpt-5.4", "held_out_score": null, "criterion_names": ["key_points_captured", "conciseness", "faithful_to_source", "few_shot_format"], "per_criterion_scores": {"key_points_captured": 0.8, "conciseness": 0.5, "faithful_to_source": 0.0, "few_shot_format": 0.0}, "failure_classification": null, "drafts_generated": 1, "drafts_survived": 1}
{"id": "a2fa13bb-e1f5-413b-9155-871f09bd975a", "target_id": "B2-treatment", "git_sha": "2662f0b37b84aa73a4b14b919f576c2c1989e34c", "pre_experiment_sha": "fb93e180bf73cfa57c0cd479902d3d0787fc356b", "timestamp": "2026-04-19T08:29:11.503703+00:00", "hypothesis": "Use the shortest faithful binary prompt with exact labels, one source-only sufficiency rule, and two tiny balanced label-only examples.", "hypothesis_source": "agent", "mutation_diff_summary": "", "score": 1.5, "score_ci_lower": 1.0, "score_ci_upper": 2.1, "raw_scores": [2.5, 1.0, 2.0, 1.0, 1.0], "baseline_score": 1.3, "outcome": "KEPT", "failure_mode": null, "duration_seconds": 15.317585916956887, "tags": ["binary-classification", "concise", "faithful", "few-shot"], "learnings": "{\"what_changed\":\"\",\"what_improved\":[],\"what_regressed\":[],\"transferable_insight\":\"When a task is constrained by exact labels, the shortest prompt that preserves all necessary rules and includes a couple of balanced examples can improve reliability without adding complexity.\",\"domain_tags\":[\"prompt-engineering\",\"classification\",\"evaluation\"]}", "cost_usd": 0.01990995, "bootstrap_seed": 0, "agent_model": "gpt-5.4", "held_out_score": null, "criterion_names": ["key_points_captured", "conciseness", "faithful_to_source", "few_shot_format"], "per_criterion_scores": {"key_points_captured": 0.6, "conciseness": 0.5, "faithful_to_source": 0.4, "few_shot_format": 0.0}, "failure_classification": null, "drafts_generated": 1, "drafts_survived": 1}
{"id": "616b4ca9-66c8-4c7b-b80a-da596cfd9565", "target_id": "B2-treatment", "git_sha": "b15398e3c2e0a755f2439cdc8a97ab0b22a7f40f", "pre_experiment_sha": "2662f0b37b84aa73a4b14b919f576c2c1989e34c", "timestamp": "2026-04-19T08:29:30.289360+00:00", "hypothesis": "Use the original wording more directly and make the rule and examples strictly label-only.", "hypothesis_source": "agent", "mutation_diff_summary": "", "score": 2.1, "score_ci_lower": 1.4, "score_ci_upper": 2.8, "raw_scores": [2.0, 3.0, 3.0, 1.5, 1.0], "baseline_score": 1.5, "outcome": "KEPT", "failure_mode": null, "duration_seconds": 15.839849625015631, "tags": ["faithful", "concise", "binary-classification", "few-shot"], "learnings": "{\"what_changed\":\"\",\"what_improved\":[],\"what_regressed\":[],\"transferable_insight\":\"When a task depends on classification, preserving the original wording and restricting outputs to labels only can improve consistency and reduce ambiguity.\",\"domain_tags\":[\"classification\",\"prompt-design\",\"evaluation\"]}", "cost_usd": 0.019736350000000003, "bootstrap_seed": 0, "agent_model": "gpt-5.4", "held_out_score": null, "criterion_names": ["key_points_captured", "conciseness", "faithful_to_source", "few_shot_format"], "per_criterion_scores": {"key_points_captured": 0.8, "conciseness": 0.6, "faithful_to_source": 0.4, "few_shot_format": 0.3}, "failure_classification": null, "drafts_generated": 1, "drafts_survived": 1}
{"id": "82c133ca-0c68-4f05-86a3-e76f2e997790", "target_id": "B2-treatment", "git_sha": "3f16d05dad1f347bb38ef03f9709f63799e39197", "pre_experiment_sha": "b15398e3c2e0a755f2439cdc8a97ab0b22a7f40f", "timestamp": "2026-04-19T08:29:45.963802+00:00", "hypothesis": "Use the original task wording almost verbatim with one minimal sufficiency rule and two tiny balanced label-only examples.", "hypothesis_source": "agent", "mutation_diff_summary": "", "score": 2.2, "score_ci_lower": 1.1, "score_ci_upper": 3.3, "raw_scores": [1.5, 1.0, 3.5, 4.0, 1.0], "baseline_score": 2.1, "outcome": "KEPT", "failure_mode": null, "duration_seconds": 14.592723082983866, "tags": ["faithful", "concise", "binary-classification", "few-shot"], "learnings": "{\"what_changed\":\"\",\"what_improved\":[],\"what_regressed\":[],\"transferable_insight\":\"When a task is already well-specified, preserving the original wording and adding only the minimum necessary constraints plus a couple of balanced examples can improve performance without introducing noise.\",\"domain_tags\":[\"prompt-design\",\"instruction-following\",\"few-shot-learning\"]}", "cost_usd": 0.019817750000000002, "bootstrap_seed": 0, "agent_model": "gpt-5.4", "held_out_score": null, "criterion_names": ["key_points_captured", "conciseness", "faithful_to_source", "few_shot_format"], "per_criterion_scores": {"key_points_captured": 0.8, "conciseness": 0.7, "faithful_to_source": 0.4, "few_shot_format": 0.3}, "failure_classification": null, "drafts_generated": 1, "drafts_survived": 1}
