{"id": "ce0cbeb1-a6c5-46c3-acfb-5e63e8d3ef79", "target_id": "B2-treatment", "git_sha": "fe8dda5fc1f74b59679334900eb48917d1225f30", "pre_experiment_sha": "fe8dda5fc1f74b59679334900eb48917d1225f30", "timestamp": "2026-04-06T22:04:53.739177+00:00", "hypothesis": "No hypothesis provided", "hypothesis_source": "synthesized", "mutation_diff_summary": "", "score": 2.6, "score_ci_lower": 2.2, "score_ci_upper": 3.0, "raw_scores": [2.0, 3.0, 3.0, 2.0, 3.0], "baseline_score": 2.8, "outcome": "DISCARDED", "failure_mode": null, "duration_seconds": 168.81174104101956, "tags": [], "learnings": "{\"what_changed\":\"\",\"what_improved\":[],\"what_regressed\":[],\"transferable_insight\":\"No hypothesis provided\",\"domain_tags\":[]}", "cost_usd": 0.5613546500000001, "bootstrap_seed": 0, "agent_model": "claude-sonnet-4-6", "held_out_score": null, "criterion_names": ["key_points_captured", "conciseness", "faithful_to_source", "few_shot_format"], "per_criterion_scores": {"key_points_captured": 1.0, "conciseness": 1.0, "faithful_to_source": 0.6, "few_shot_format": 0.0}, "failure_classification": {"category": "output_format", "description": "The experiment failed due to a violation of the required output structure or schema, as indicated by the lack of a hypothesis and unknown failure mode.", "fix_direction": "Ensure that all required fields are provided and conform to the expected schema in future attempts.", "confidence": 0.85}, "drafts_generated": 1, "drafts_survived": 1}
{"id": "90f2b338-9805-4c06-8cd1-bd8076a42716", "target_id": "B2-treatment", "git_sha": "fe8dda5fc1f74b59679334900eb48917d1225f30", "pre_experiment_sha": "fe8dda5fc1f74b59679334900eb48917d1225f30", "timestamp": "2026-04-06T22:06:35.928473+00:00", "hypothesis": "No hypothesis provided", "hypothesis_source": "synthesized", "mutation_diff_summary": "", "score": 2.2, "score_ci_lower": 2.0, "score_ci_upper": 2.6, "raw_scores": [2.0, 2.0, 3.0, 2.0, 2.0], "baseline_score": 2.8, "outcome": "DISCARDED", "failure_mode": null, "duration_seconds": 100.32626166706905, "tags": [], "learnings": "{\"what_changed\":\"\",\"what_improved\":[],\"what_regressed\":[\"faithful_to_source: FAIL (was PASS)\"],\"transferable_insight\":\"No hypothesis provided\",\"domain_tags\":[]}", "cost_usd": 0.2274268, "bootstrap_seed": 0, "agent_model": "claude-sonnet-4-6", "held_out_score": null, "criterion_names": ["key_points_captured", "conciseness", "faithful_to_source", "few_shot_format"], "per_criterion_scores": {"key_points_captured": 0.8, "conciseness": 1.0, "faithful_to_source": 0.4, "few_shot_format": 0.0}, "failure_classification": {"category": "output_format", "description": "The experiment failed due to a violation of the expected output structure or data schema, as indicated by the low score and lack of explicit hypothesis or failure detail.", "fix_direction": "Review and ensure strict adherence to the required output format/schema in both input and output handling.", "confidence": 0.8}, "drafts_generated": 1, "drafts_survived": 1}
{"id": "ed32a3d7-3e56-4bf2-bd0d-08e8d97dd037", "target_id": "B2-treatment", "git_sha": "fe8dda5fc1f74b59679334900eb48917d1225f30", "pre_experiment_sha": "fe8dda5fc1f74b59679334900eb48917d1225f30", "timestamp": "2026-04-06T22:07:41.815026+00:00", "hypothesis": "No hypothesis provided", "hypothesis_source": "synthesized", "mutation_diff_summary": "", "score": 2.0, "score_ci_lower": 2.0, "score_ci_upper": 2.0, "raw_scores": [2.0, 2.0, 2.0, 2.0, 2.0], "baseline_score": 2.8, "outcome": "DISCARDED", "failure_mode": null, "duration_seconds": 64.21841258392669, "tags": [], "learnings": "{\"what_changed\":\"\",\"what_improved\":[],\"what_regressed\":[],\"transferable_insight\":\"No hypothesis provided\",\"domain_tags\":[]}", "cost_usd": 0.18052265, "bootstrap_seed": 0, "agent_model": "claude-sonnet-4-6", "held_out_score": null, "criterion_names": ["key_points_captured", "conciseness", "faithful_to_source", "few_shot_format"], "per_criterion_scores": {"key_points_captured": 0.8, "conciseness": 1.0, "faithful_to_source": 0.2, "few_shot_format": 0.0}, "failure_classification": {"category": "output_format", "description": "The experiment lacks a provided hypothesis and the failure mode is marked as unknown, indicating a violation of the expected output structure/schema.", "fix_direction": "Ensure all required fields, such as hypothesis and failure mode, are filled according to the output schema.", "confidence": 0.93}, "drafts_generated": 1, "drafts_survived": 1}
{"id": "a4cb0484-a5f4-4c62-b441-bb84e8da0f13", "target_id": "B2-treatment", "git_sha": "fe8dda5fc1f74b59679334900eb48917d1225f30", "pre_experiment_sha": "fe8dda5fc1f74b59679334900eb48917d1225f30", "timestamp": "2026-04-06T22:09:25.974227+00:00", "hypothesis": "No hypothesis provided", "hypothesis_source": "synthesized", "mutation_diff_summary": "", "score": 2.5, "score_ci_lower": 2.1, "score_ci_upper": 2.9, "raw_scores": [3.0, 2.5, 3.0, 2.0, 2.0], "baseline_score": 2.8, "outcome": "DISCARDED", "failure_mode": null, "duration_seconds": 102.27886720793322, "tags": [], "learnings": "{\"what_changed\":\"\",\"what_improved\":[\"faithful_to_source: PASS (was FAIL)\"],\"what_regressed\":[],\"transferable_insight\":\"No hypothesis provided\",\"domain_tags\":[]}", "cost_usd": 0.21041035, "bootstrap_seed": 0, "agent_model": "claude-sonnet-4-6", "held_out_score": null, "criterion_names": ["key_points_captured", "conciseness", "faithful_to_source", "few_shot_format"], "per_criterion_scores": {"key_points_captured": 0.8, "conciseness": 1.0, "faithful_to_source": 0.7, "few_shot_format": 0.0}, "failure_classification": {"category": "output_format", "description": "The experiment failed due to an output structure/schema violation, as there was no hypothesis provided and the failure mode was unknown, indicating that required fields or formats were not properly followed.", "fix_direction": "Ensure that all required output schema elements are present and conform to the expected structure, including providing a hypothesis and specifying the failure mode.", "confidence": 0.9}, "drafts_generated": 1, "drafts_survived": 1}
{"id": "2b3020a5-0a07-4b77-930c-b25d1503a722", "target_id": "B2-treatment", "git_sha": "fe8dda5fc1f74b59679334900eb48917d1225f30", "pre_experiment_sha": "fe8dda5fc1f74b59679334900eb48917d1225f30", "timestamp": "2026-04-06T22:10:32.919809+00:00", "hypothesis": "No hypothesis provided", "hypothesis_source": "synthesized", "mutation_diff_summary": "", "score": 2.4, "score_ci_lower": 2.0, "score_ci_upper": 2.8, "raw_scores": [3.0, 2.0, 2.0, 3.0, 2.0], "baseline_score": 2.8, "outcome": "DISCARDED", "failure_mode": null, "duration_seconds": 64.979333124822, "tags": [], "learnings": "{\"what_changed\":\"\",\"what_improved\":[],\"what_regressed\":[],\"transferable_insight\":\"No hypothesis provided\",\"domain_tags\":[]}", "cost_usd": 0.18426769999999998, "bootstrap_seed": 0, "agent_model": "claude-sonnet-4-6", "held_out_score": null, "criterion_names": ["key_points_captured", "conciseness", "faithful_to_source", "few_shot_format"], "per_criterion_scores": {"key_points_captured": 0.8, "conciseness": 1.0, "faithful_to_source": 0.6, "few_shot_format": 0.0}, "failure_classification": {"category": "output_format", "description": "The experiment lacks a provided hypothesis, which is a required element of the output structure/schema.", "fix_direction": "Ensure the output includes all mandatory fields, especially the hypothesis.", "confidence": 0.9}, "drafts_generated": 1, "drafts_survived": 1}
{"id": "90fc0098-69be-446f-916f-5b535c6c63a2", "target_id": "B2-treatment", "git_sha": "fe8dda5fc1f74b59679334900eb48917d1225f30", "pre_experiment_sha": "fe8dda5fc1f74b59679334900eb48917d1225f30", "timestamp": "2026-04-06T22:12:13.344421+00:00", "hypothesis": "No hypothesis provided", "hypothesis_source": "synthesized", "mutation_diff_summary": "", "score": 2.4, "score_ci_lower": 2.0, "score_ci_upper": 2.8, "raw_scores": [2.0, 2.0, 2.0, 3.0, 3.0], "baseline_score": 2.8, "outcome": "DISCARDED", "failure_mode": null, "duration_seconds": 98.94823816698045, "tags": [], "learnings": "{\"what_changed\":\"\",\"what_improved\":[],\"what_regressed\":[],\"transferable_insight\":\"No hypothesis provided\",\"domain_tags\":[]}", "cost_usd": 0.23352975, "bootstrap_seed": 0, "agent_model": "claude-sonnet-4-6", "held_out_score": null, "criterion_names": ["key_points_captured", "conciseness", "faithful_to_source", "few_shot_format"], "per_criterion_scores": {"key_points_captured": 1.0, "conciseness": 0.8, "faithful_to_source": 0.6, "few_shot_format": 0.0}, "failure_classification": {"category": "output_format", "description": "The experiment lacks a provided hypothesis and does not specify the failure mode, indicating a violation of the output structure or schema.", "fix_direction": "Ensure all required fields (hypothesis, failure mode) are defined according to the expected output format.", "confidence": 0.9}, "drafts_generated": 1, "drafts_survived": 1}
{"id": "6c9864b3-0d87-42cc-aa6f-eaa2f2af893e", "target_id": "B2-treatment", "git_sha": "fe626da2c63a906af80d3a9056d44bbbc513a39c", "pre_experiment_sha": "fe8dda5fc1f74b59679334900eb48917d1225f30", "timestamp": "2026-04-06T22:13:21.322966+00:00", "hypothesis": "No hypothesis provided", "hypothesis_source": "synthesized", "mutation_diff_summary": "", "score": 3.0, "score_ci_lower": 2.2, "score_ci_upper": 3.8, "raw_scores": [2.0, 3.0, 4.0, 2.0, 4.0], "baseline_score": 2.8, "outcome": "KEPT", "failure_mode": null, "duration_seconds": 66.4164265000727, "tags": [], "learnings": "{\"what_changed\":\"\",\"what_improved\":[],\"what_regressed\":[],\"transferable_insight\":\"No hypothesis provided\",\"domain_tags\":[]}", "cost_usd": 0.17555294999999999, "bootstrap_seed": 0, "agent_model": "claude-sonnet-4-6", "held_out_score": null, "criterion_names": ["key_points_captured", "conciseness", "faithful_to_source", "few_shot_format"], "per_criterion_scores": {"key_points_captured": 1.0, "conciseness": 1.0, "faithful_to_source": 0.6, "few_shot_format": 0.4}, "failure_classification": null, "drafts_generated": 1, "drafts_survived": 1}
{"id": "04e9db59-e05b-4f1f-8124-36c42f297fd1", "target_id": "B2-treatment", "git_sha": "fe626da2c63a906af80d3a9056d44bbbc513a39c", "pre_experiment_sha": "fe626da2c63a906af80d3a9056d44bbbc513a39c", "timestamp": "2026-04-06T22:15:17.919410+00:00", "hypothesis": "No hypothesis provided", "hypothesis_source": "synthesized", "mutation_diff_summary": "", "score": 2.6, "score_ci_lower": 2.0, "score_ci_upper": 3.4, "raw_scores": [2.0, 2.0, 2.0, 3.0, 4.0], "baseline_score": 3.0, "outcome": "DISCARDED", "failure_mode": null, "duration_seconds": 116.19582845782861, "tags": [], "learnings": "{\"what_changed\":\"\",\"what_improved\":[],\"what_regressed\":[],\"transferable_insight\":\"No hypothesis provided\",\"domain_tags\":[]}", "cost_usd": 0.2551928, "bootstrap_seed": 0, "agent_model": "claude-sonnet-4-6", "held_out_score": null, "criterion_names": ["key_points_captured", "conciseness", "faithful_to_source", "few_shot_format"], "per_criterion_scores": {"key_points_captured": 1.0, "conciseness": 0.8, "faithful_to_source": 0.6, "few_shot_format": 0.2}, "failure_classification": {"category": "output_format", "description": "The experiment failed due to a violation of the required output structure or schema, indicating that the output did not conform to the expected format.", "fix_direction": "Ensure strict adherence to the required output schema and validate output formatting before submission.", "confidence": 0.8}, "drafts_generated": 1, "drafts_survived": 1}
{"id": "965686c6-9257-4fb0-b345-5d83e1d9c752", "target_id": "B2-treatment", "git_sha": "fe626da2c63a906af80d3a9056d44bbbc513a39c", "pre_experiment_sha": "fe626da2c63a906af80d3a9056d44bbbc513a39c", "timestamp": "2026-04-06T22:16:53.528561+00:00", "hypothesis": "No hypothesis provided", "hypothesis_source": "synthesized", "mutation_diff_summary": "", "score": 2.2, "score_ci_lower": 2.0, "score_ci_upper": 2.6, "raw_scores": [2.0, 2.0, 2.0, 2.0, 3.0], "baseline_score": 3.0, "outcome": "DISCARDED", "failure_mode": null, "duration_seconds": 93.93964566709474, "tags": [], "learnings": "{\"what_changed\":\"\",\"what_improved\":[],\"what_regressed\":[\"faithful_to_source: FAIL (was PASS)\"],\"transferable_insight\":\"No hypothesis provided\",\"domain_tags\":[]}", "cost_usd": 0.2878639, "bootstrap_seed": 0, "agent_model": "claude-sonnet-4-6", "held_out_score": null, "criterion_names": ["key_points_captured", "conciseness", "faithful_to_source", "few_shot_format"], "per_criterion_scores": {"key_points_captured": 1.0, "conciseness": 1.0, "faithful_to_source": 0.2, "few_shot_format": 0.0}, "failure_classification": {"category": "output_format", "description": "The experiment failed due to a violation of the required output structure or schema.", "fix_direction": "Ensure that the output strictly adheres to the prescribed format/schema in future attempts.", "confidence": 0.9}, "drafts_generated": 1, "drafts_survived": 1}
{"id": "1795c856-bb29-47b4-a5f1-5f89a6f8a8c7", "target_id": "B2-treatment", "git_sha": "fe626da2c63a906af80d3a9056d44bbbc513a39c", "pre_experiment_sha": "fe626da2c63a906af80d3a9056d44bbbc513a39c", "timestamp": "2026-04-06T22:18:21.031221+00:00", "hypothesis": "No hypothesis provided", "hypothesis_source": "synthesized", "mutation_diff_summary": "", "score": 2.6, "score_ci_lower": 2.2, "score_ci_upper": 3.0, "raw_scores": [2.0, 2.0, 3.0, 3.0, 3.0], "baseline_score": 3.0, "outcome": "DISCARDED", "failure_mode": null, "duration_seconds": 85.64810420805588, "tags": [], "learnings": "{\"what_changed\":\"\",\"what_improved\":[\"faithful_to_source: PASS (was FAIL)\"],\"what_regressed\":[],\"transferable_insight\":\"No hypothesis provided\",\"domain_tags\":[]}", "cost_usd": 0.2052526, "bootstrap_seed": 0, "agent_model": "claude-sonnet-4-6", "held_out_score": null, "criterion_names": ["key_points_captured", "conciseness", "faithful_to_source", "few_shot_format"], "per_criterion_scores": {"key_points_captured": 1.0, "conciseness": 1.0, "faithful_to_source": 0.6, "few_shot_format": 0.0}, "failure_classification": {"category": "output_format", "description": "The experiment failed due to a violation of the required output structure or schema, resulting in a format that does not conform to the expected standards.", "fix_direction": "Ensure output strictly matches the expected structure/schema; validate against schema before submission.", "confidence": 0.85}, "drafts_generated": 1, "drafts_survived": 1}
{"id": "dcf30981-05ec-47d5-a24f-4de9a9a20310", "target_id": "B2-treatment", "git_sha": "fe626da2c63a906af80d3a9056d44bbbc513a39c", "pre_experiment_sha": "fe626da2c63a906af80d3a9056d44bbbc513a39c", "timestamp": "2026-04-06T22:19:26.700409+00:00", "hypothesis": "No hypothesis provided", "hypothesis_source": "synthesized", "mutation_diff_summary": "", "score": 2.2, "score_ci_lower": 2.0, "score_ci_upper": 2.6, "raw_scores": [2.0, 2.0, 2.0, 2.0, 3.0], "baseline_score": 3.0, "outcome": "DISCARDED", "failure_mode": null, "duration_seconds": 63.76311208400875, "tags": [], "learnings": "{\"what_changed\":\"\",\"what_improved\":[],\"what_regressed\":[\"faithful_to_source: FAIL (was PASS)\"],\"transferable_insight\":\"No hypothesis provided\",\"domain_tags\":[]}", "cost_usd": 0.18637895, "bootstrap_seed": 0, "agent_model": "claude-sonnet-4-6", "held_out_score": null, "criterion_names": ["key_points_captured", "conciseness", "faithful_to_source", "few_shot_format"], "per_criterion_scores": {"key_points_captured": 1.0, "conciseness": 1.0, "faithful_to_source": 0.2, "few_shot_format": 0.0}, "failure_classification": {"category": "output_format", "description": "The output lacks a provided hypothesis, which likely violates the required structure/schema for experiment documentation.", "fix_direction": "Ensure all required fields, especially the hypothesis, are completed and adhere to the expected schema.", "confidence": 0.85}, "drafts_generated": 1, "drafts_survived": 1}
{"id": "1fe99eb5-6482-43c4-9b3f-20148a5d459e", "target_id": "B2-treatment", "git_sha": "dfe78e51631b43bdcbdb5bad8a5883fa9b144e13", "pre_experiment_sha": "fe626da2c63a906af80d3a9056d44bbbc513a39c", "timestamp": "2026-04-06T22:20:52.947395+00:00", "hypothesis": "No hypothesis provided", "hypothesis_source": "synthesized", "mutation_diff_summary": "", "score": 2.8, "score_ci_lower": 2.0, "score_ci_upper": 3.6, "raw_scores": [2.0, 2.0, 4.0, 4.0, 2.0], "baseline_score": 3.0, "outcome": "KEPT", "failure_mode": null, "duration_seconds": 84.16822233307175, "tags": [], "learnings": "{\"what_changed\":\"\",\"what_improved\":[\"faithful_to_source: PASS (was FAIL)\"],\"what_regressed\":[],\"transferable_insight\":\"No hypothesis provided\",\"domain_tags\":[]}", "cost_usd": 0.18922155, "bootstrap_seed": 0, "agent_model": "claude-sonnet-4-6", "held_out_score": null, "criterion_names": ["key_points_captured", "conciseness", "faithful_to_source", "few_shot_format"], "per_criterion_scores": {"key_points_captured": 0.8, "conciseness": 1.0, "faithful_to_source": 0.6, "few_shot_format": 0.4}, "failure_classification": null, "drafts_generated": 1, "drafts_survived": 1}
{"id": "7db8b403-ec0b-456b-9337-319e957b6e87", "target_id": "B2-treatment", "git_sha": "a2175d52732e0962b700793967d49c6047a81e39", "pre_experiment_sha": "dfe78e51631b43bdcbdb5bad8a5883fa9b144e13", "timestamp": "2026-04-06T22:22:20.911792+00:00", "hypothesis": "No hypothesis provided", "hypothesis_source": "synthesized", "mutation_diff_summary": "", "score": 2.6, "score_ci_lower": 2.2, "score_ci_upper": 3.0, "raw_scores": [2.0, 3.0, 2.0, 3.0, 3.0], "baseline_score": 2.8, "outcome": "KEPT", "failure_mode": null, "duration_seconds": 87.07612175005488, "tags": [], "learnings": "{\"what_changed\":\"\",\"what_improved\":[],\"what_regressed\":[],\"transferable_insight\":\"No hypothesis provided\",\"domain_tags\":[]}", "cost_usd": 0.20001855000000002, "bootstrap_seed": 0, "agent_model": "claude-sonnet-4-6", "held_out_score": null, "criterion_names": ["key_points_captured", "conciseness", "faithful_to_source", "few_shot_format"], "per_criterion_scores": {"key_points_captured": 1.0, "conciseness": 1.0, "faithful_to_source": 0.6, "few_shot_format": 0.0}, "failure_classification": null, "drafts_generated": 1, "drafts_survived": 1}
{"id": "fd38edc6-3bad-4917-9e57-0b482f4aede4", "target_id": "B2-treatment", "git_sha": "178137c773624f61c8ebc6303eae0412df76f200", "pre_experiment_sha": "a2175d52732e0962b700793967d49c6047a81e39", "timestamp": "2026-04-06T22:25:24.608543+00:00", "hypothesis": "No hypothesis provided", "hypothesis_source": "synthesized", "mutation_diff_summary": "", "score": 2.4, "score_ci_lower": 2.0, "score_ci_upper": 2.8, "raw_scores": [3.0, 2.0, 3.0, 2.0, 2.0], "baseline_score": 2.6, "outcome": "KEPT", "failure_mode": null, "duration_seconds": 183.1888342918828, "tags": [], "learnings": "{\"what_changed\":\"\",\"what_improved\":[],\"what_regressed\":[],\"transferable_insight\":\"No hypothesis provided\",\"domain_tags\":[]}", "cost_usd": 0.2837487, "bootstrap_seed": 0, "agent_model": "claude-sonnet-4-6", "held_out_score": null, "criterion_names": ["key_points_captured", "conciseness", "faithful_to_source", "few_shot_format"], "per_criterion_scores": {"key_points_captured": 0.8, "conciseness": 1.0, "faithful_to_source": 0.6, "few_shot_format": 0.0}, "failure_classification": null, "drafts_generated": 1, "drafts_survived": 1}
{"id": "33f9dfa7-74c3-4524-b850-fb534442cfe7", "target_id": "B2-treatment", "git_sha": "d86e89a5094cb92b8e03f11d3da42e3454031723", "pre_experiment_sha": "178137c773624f61c8ebc6303eae0412df76f200", "timestamp": "2026-04-06T22:27:22.763591+00:00", "hypothesis": "No hypothesis provided", "hypothesis_source": "synthesized", "mutation_diff_summary": "", "score": 2.4, "score_ci_lower": 2.0, "score_ci_upper": 2.8, "raw_scores": [2.0, 3.0, 2.0, 3.0, 2.0], "baseline_score": 2.4, "outcome": "KEPT", "failure_mode": null, "duration_seconds": 117.78928949986584, "tags": [], "learnings": "{\"what_changed\":\"\",\"what_improved\":[],\"what_regressed\":[],\"transferable_insight\":\"No hypothesis provided\",\"domain_tags\":[]}", "cost_usd": 0.28529025, "bootstrap_seed": 0, "agent_model": "claude-sonnet-4-6", "held_out_score": null, "criterion_names": ["key_points_captured", "conciseness", "faithful_to_source", "few_shot_format"], "per_criterion_scores": {"key_points_captured": 0.8, "conciseness": 1.0, "faithful_to_source": 0.6, "few_shot_format": 0.0}, "failure_classification": null, "drafts_generated": 1, "drafts_survived": 1}
{"id": "806771c2-e99e-400f-a2bb-c7ba91183e97", "target_id": "B2-treatment", "git_sha": "073d47004dd958b1151b5e29b69bc31a2bd5c6aa", "pre_experiment_sha": "d86e89a5094cb92b8e03f11d3da42e3454031723", "timestamp": "2026-04-06T22:29:37.928465+00:00", "hypothesis": "No hypothesis provided", "hypothesis_source": "synthesized", "mutation_diff_summary": "", "score": 2.8, "score_ci_lower": 2.4, "score_ci_upper": 3.0, "raw_scores": [2.0, 3.0, 3.0, 3.0, 3.0], "baseline_score": 2.4, "outcome": "KEPT", "failure_mode": null, "duration_seconds": 134.73029012489133, "tags": [], "learnings": "{\"what_changed\":\"\",\"what_improved\":[],\"what_regressed\":[],\"transferable_insight\":\"No hypothesis provided\",\"domain_tags\":[]}", "cost_usd": 0.28015334999999997, "bootstrap_seed": 0, "agent_model": "claude-sonnet-4-6", "held_out_score": null, "criterion_names": ["key_points_captured", "conciseness", "faithful_to_source", "few_shot_format"], "per_criterion_scores": {"key_points_captured": 1.0, "conciseness": 1.0, "faithful_to_source": 0.8, "few_shot_format": 0.0}, "failure_classification": null, "drafts_generated": 1, "drafts_survived": 1}
