{"id": "af4421a4-bf8f-4ce1-91ce-2f4ca467221b", "target_id": "B2-treatment", "git_sha": "381200f685c9246e957eb27369ac191f8bbeffdf", "pre_experiment_sha": "381200f685c9246e957eb27369ac191f8bbeffdf", "timestamp": "2026-04-06T21:35:45.937016+00:00", "hypothesis": "No hypothesis provided", "hypothesis_source": "synthesized", "mutation_diff_summary": "", "score": 2.3, "score_ci_lower": 1.8, "score_ci_upper": 2.8, "raw_scores": [2.0, 2.0, 3.0, 1.5, 3.0], "baseline_score": 2.4, "outcome": "DISCARDED", "failure_mode": null, "duration_seconds": 72.34016895806417, "tags": [], "learnings": "{\"what_changed\":\"\",\"what_improved\":[],\"what_regressed\":[],\"transferable_insight\":\"No hypothesis provided\",\"domain_tags\":[]}", "cost_usd": 0.17003334999999997, "bootstrap_seed": 0, "agent_model": "claude-sonnet-4-6", "held_out_score": null, "criterion_names": ["key_points_captured", "conciseness", "faithful_to_source", "few_shot_format"], "per_criterion_scores": {"key_points_captured": 1.0, "conciseness": 0.8, "faithful_to_source": 0.5, "few_shot_format": 0.0}, "failure_classification": {"category": "output_format", "description": "The experiment failed due to an output structure/schema violation, as indicated by the absence of a hypothesis and unknown failure mode, which suggests insufficient or malformed output data.", "fix_direction": "Ensure outputs strictly conform to the required schema, including all mandatory sections.", "confidence": 0.85}, "drafts_generated": 1, "drafts_survived": 1}
{"id": "d89bcdbb-77cc-4583-9d6e-08e9a7ca2186", "target_id": "B2-treatment", "git_sha": "221760789ce9b7b6cea8689253f8b636220292dd", "pre_experiment_sha": "381200f685c9246e957eb27369ac191f8bbeffdf", "timestamp": "2026-04-06T21:37:07.270490+00:00", "hypothesis": "No hypothesis provided", "hypothesis_source": "synthesized", "mutation_diff_summary": "", "score": 2.8, "score_ci_lower": 2.4, "score_ci_upper": 3.0, "raw_scores": [2.0, 3.0, 3.0, 3.0, 3.0], "baseline_score": 2.4, "outcome": "KEPT", "failure_mode": null, "duration_seconds": 79.55416966695338, "tags": [], "learnings": "{\"what_changed\":\"\",\"what_improved\":[],\"what_regressed\":[],\"transferable_insight\":\"No hypothesis provided\",\"domain_tags\":[]}", "cost_usd": 0.25502625, "bootstrap_seed": 0, "agent_model": "claude-sonnet-4-6", "held_out_score": null, "criterion_names": ["key_points_captured", "conciseness", "faithful_to_source", "few_shot_format"], "per_criterion_scores": {"key_points_captured": 1.0, "conciseness": 1.0, "faithful_to_source": 0.8, "few_shot_format": 0.0}, "failure_classification": null, "drafts_generated": 1, "drafts_survived": 1}
{"id": "44213d21-3b9b-42d5-9bb1-0aaf04bcb367", "target_id": "B2-treatment", "git_sha": "eff2eeaa79e0e4c191e6abf2c8bcd8e207c3f823", "pre_experiment_sha": "221760789ce9b7b6cea8689253f8b636220292dd", "timestamp": "2026-04-06T21:38:43.419114+00:00", "hypothesis": "No hypothesis provided", "hypothesis_source": "synthesized", "mutation_diff_summary": "", "score": 2.8, "score_ci_lower": 2.2, "score_ci_upper": 3.4, "raw_scores": [2.0, 3.0, 4.0, 2.0, 3.0], "baseline_score": 2.8, "outcome": "KEPT", "failure_mode": null, "duration_seconds": 95.7593642079737, "tags": [], "learnings": "{\"what_changed\":\"\",\"what_improved\":[],\"what_regressed\":[],\"transferable_insight\":\"No hypothesis provided\",\"domain_tags\":[]}", "cost_usd": 0.21752129999999997, "bootstrap_seed": 0, "agent_model": "claude-sonnet-4-6", "held_out_score": null, "criterion_names": ["key_points_captured", "conciseness", "faithful_to_source", "few_shot_format"], "per_criterion_scores": {"key_points_captured": 1.0, "conciseness": 1.0, "faithful_to_source": 0.6, "few_shot_format": 0.2}, "failure_classification": null, "drafts_generated": 1, "drafts_survived": 1}
{"id": "e982d8ed-69f3-4c0c-a8d1-165c9a717f74", "target_id": "B2-treatment", "git_sha": "4c59f8e5f92e6ff13ecb36d2f46bd8b74e852a11", "pre_experiment_sha": "eff2eeaa79e0e4c191e6abf2c8bcd8e207c3f823", "timestamp": "2026-04-06T21:40:20.158190+00:00", "hypothesis": "No hypothesis provided", "hypothesis_source": "synthesized", "mutation_diff_summary": "", "score": 3.0, "score_ci_lower": 2.4, "score_ci_upper": 3.6, "raw_scores": [3.0, 4.0, 3.0, 2.0, 3.0], "baseline_score": 2.8, "outcome": "KEPT", "failure_mode": null, "duration_seconds": 96.3630144589115, "tags": [], "learnings": "{\"what_changed\":\"\",\"what_improved\":[],\"what_regressed\":[],\"transferable_insight\":\"No hypothesis provided\",\"domain_tags\":[]}", "cost_usd": 0.2240016, "bootstrap_seed": 0, "agent_model": "claude-sonnet-4-6", "held_out_score": null, "criterion_names": ["key_points_captured", "conciseness", "faithful_to_source", "few_shot_format"], "per_criterion_scores": {"key_points_captured": 1.0, "conciseness": 1.0, "faithful_to_source": 0.8, "few_shot_format": 0.2}, "failure_classification": null, "drafts_generated": 1, "drafts_survived": 1}
{"id": "0b6ef0e0-5ec8-485a-9d9f-0a1faf123954", "target_id": "B2-treatment", "git_sha": "d85676c11978edfc1128f5a569295dc71cb44cf8", "pre_experiment_sha": "4c59f8e5f92e6ff13ecb36d2f46bd8b74e852a11", "timestamp": "2026-04-06T21:41:48.224996+00:00", "hypothesis": "No hypothesis provided", "hypothesis_source": "synthesized", "mutation_diff_summary": "", "score": 2.8, "score_ci_lower": 2.2, "score_ci_upper": 3.4, "raw_scores": [4.0, 3.0, 2.0, 2.0, 3.0], "baseline_score": 3.0, "outcome": "KEPT", "failure_mode": null, "duration_seconds": 87.63281820900738, "tags": [], "learnings": "{\"what_changed\":\"\",\"what_improved\":[],\"what_regressed\":[],\"transferable_insight\":\"No hypothesis provided\",\"domain_tags\":[]}", "cost_usd": 0.21394844999999998, "bootstrap_seed": 0, "agent_model": "claude-sonnet-4-6", "held_out_score": null, "criterion_names": ["key_points_captured", "conciseness", "faithful_to_source", "few_shot_format"], "per_criterion_scores": {"key_points_captured": 1.0, "conciseness": 1.0, "faithful_to_source": 0.6, "few_shot_format": 0.2}, "failure_classification": null, "drafts_generated": 1, "drafts_survived": 1}
{"id": "de50d984-1f7b-4d74-b4e1-f37c1be55be1", "target_id": "B2-treatment", "git_sha": "68899aa74179b028bd0ed57552dda41a6aaf8de0", "pre_experiment_sha": "d85676c11978edfc1128f5a569295dc71cb44cf8", "timestamp": "2026-04-06T21:42:52.196138+00:00", "hypothesis": "No hypothesis provided", "hypothesis_source": "synthesized", "mutation_diff_summary": "", "score": 2.2, "score_ci_lower": 1.6, "score_ci_upper": 2.8, "raw_scores": [2.0, 3.0, 1.0, 2.0, 3.0], "baseline_score": 2.8, "outcome": "KEPT", "failure_mode": null, "duration_seconds": 63.56196629209444, "tags": [], "learnings": "{\"what_changed\":\"\",\"what_improved\":[],\"what_regressed\":[],\"transferable_insight\":\"No hypothesis provided\",\"domain_tags\":[]}", "cost_usd": 0.18792029999999998, "bootstrap_seed": 0, "agent_model": "claude-sonnet-4-6", "held_out_score": null, "criterion_names": ["key_points_captured", "conciseness", "faithful_to_source", "few_shot_format"], "per_criterion_scores": {"key_points_captured": 1.0, "conciseness": 0.8, "faithful_to_source": 0.4, "few_shot_format": 0.0}, "failure_classification": null, "drafts_generated": 1, "drafts_survived": 1}
{"id": "187a680d-ad24-46e4-a077-6cf45295b2a1", "target_id": "B2-treatment", "git_sha": "34fde5368438ba82982041b7930a26280817ff05", "pre_experiment_sha": "68899aa74179b028bd0ed57552dda41a6aaf8de0", "timestamp": "2026-04-06T21:45:06.640933+00:00", "hypothesis": "No hypothesis provided", "hypothesis_source": "synthesized", "mutation_diff_summary": "", "score": 2.2, "score_ci_lower": 2.0, "score_ci_upper": 2.6, "raw_scores": [2.0, 2.0, 3.0, 2.0, 2.0], "baseline_score": 2.2, "outcome": "KEPT", "failure_mode": null, "duration_seconds": 134.05704220803455, "tags": [], "learnings": "{\"what_changed\":\"\",\"what_improved\":[],\"what_regressed\":[],\"transferable_insight\":\"No hypothesis provided\",\"domain_tags\":[]}", "cost_usd": 0.2503311, "bootstrap_seed": 0, "agent_model": "claude-sonnet-4-6", "held_out_score": null, "criterion_names": ["key_points_captured", "conciseness", "faithful_to_source", "few_shot_format"], "per_criterion_scores": {"key_points_captured": 0.8, "conciseness": 1.0, "faithful_to_source": 0.4, "few_shot_format": 0.0}, "failure_classification": null, "drafts_generated": 1, "drafts_survived": 1}
{"id": "ddc3a5a0-8824-4527-91ff-1652fdb86a70", "target_id": "B2-treatment", "git_sha": "c96eba8723e91123fba5bb81055d43032a45ce2a", "pre_experiment_sha": "34fde5368438ba82982041b7930a26280817ff05", "timestamp": "2026-04-06T21:46:30.522795+00:00", "hypothesis": "No hypothesis provided", "hypothesis_source": "synthesized", "mutation_diff_summary": "", "score": 2.4, "score_ci_lower": 2.0, "score_ci_upper": 2.8, "raw_scores": [2.0, 2.0, 3.0, 2.0, 3.0], "baseline_score": 2.2, "outcome": "KEPT", "failure_mode": null, "duration_seconds": 83.4702320417855, "tags": [], "learnings": "{\"what_changed\":\"\",\"what_improved\":[],\"what_regressed\":[],\"transferable_insight\":\"No hypothesis provided\",\"domain_tags\":[]}", "cost_usd": 0.20633085, "bootstrap_seed": 0, "agent_model": "claude-sonnet-4-6", "held_out_score": null, "criterion_names": ["key_points_captured", "conciseness", "faithful_to_source", "few_shot_format"], "per_criterion_scores": {"key_points_captured": 1.0, "conciseness": 0.8, "faithful_to_source": 0.6, "few_shot_format": 0.0}, "failure_classification": null, "drafts_generated": 1, "drafts_survived": 1}
{"id": "a861109f-6f22-4aac-8db6-8c306aa34f88", "target_id": "B2-treatment", "git_sha": "c3bdb1eb48c3cec4d6a9e5987455c16f28c92013", "pre_experiment_sha": "c96eba8723e91123fba5bb81055d43032a45ce2a", "timestamp": "2026-04-06T21:48:03.676280+00:00", "hypothesis": "No hypothesis provided", "hypothesis_source": "synthesized", "mutation_diff_summary": "", "score": 2.6, "score_ci_lower": 2.0, "score_ci_upper": 3.4, "raw_scores": [2.0, 3.0, 4.0, 2.0, 2.0], "baseline_score": 2.4, "outcome": "KEPT", "failure_mode": null, "duration_seconds": 92.7135607090313, "tags": [], "learnings": "{\"what_changed\":\"\",\"what_improved\":[],\"what_regressed\":[],\"transferable_insight\":\"No hypothesis provided\",\"domain_tags\":[]}", "cost_usd": 0.25785885, "bootstrap_seed": 0, "agent_model": "claude-sonnet-4-6", "held_out_score": null, "criterion_names": ["key_points_captured", "conciseness", "faithful_to_source", "few_shot_format"], "per_criterion_scores": {"key_points_captured": 0.8, "conciseness": 1.0, "faithful_to_source": 0.6, "few_shot_format": 0.2}, "failure_classification": null, "drafts_generated": 1, "drafts_survived": 1}
{"id": "f9d0af8f-2ba8-4270-b9f2-8d9e1d45e6e8", "target_id": "B2-treatment", "git_sha": "c3bdb1eb48c3cec4d6a9e5987455c16f28c92013", "pre_experiment_sha": "c3bdb1eb48c3cec4d6a9e5987455c16f28c92013", "timestamp": "2026-04-06T21:49:54.637244+00:00", "hypothesis": "No hypothesis provided", "hypothesis_source": "synthesized", "mutation_diff_summary": "", "score": 2.5, "score_ci_lower": 2.1, "score_ci_upper": 2.9, "raw_scores": [2.0, 2.0, 3.0, 2.5, 3.0], "baseline_score": 2.6, "outcome": "DISCARDED", "failure_mode": null, "duration_seconds": 110.48589962511323, "tags": [], "learnings": "{\"what_changed\":\"\",\"what_improved\":[],\"what_regressed\":[],\"transferable_insight\":\"No hypothesis provided\",\"domain_tags\":[]}", "cost_usd": 0.22693710000000003, "bootstrap_seed": 0, "agent_model": "claude-sonnet-4-6", "held_out_score": null, "criterion_names": ["key_points_captured", "conciseness", "faithful_to_source", "few_shot_format"], "per_criterion_scores": {"key_points_captured": 1.0, "conciseness": 1.0, "faithful_to_source": 0.5, "few_shot_format": 0.0}, "failure_classification": {"category": "output_format", "description": "The experiment failed due to a violation of the required output structure or schema.", "fix_direction": "Ensure outputs strictly adhere to the specified output format/schema.", "confidence": 0.8}, "drafts_generated": 1, "drafts_survived": 1}
{"id": "af5a7336-9c01-4a8a-b52a-65a7ae3e909b", "target_id": "B2-treatment", "git_sha": "d7bc2d31ec51083a868b69b1b6379a1611e46c00", "pre_experiment_sha": "c3bdb1eb48c3cec4d6a9e5987455c16f28c92013", "timestamp": "2026-04-06T21:51:43.222914+00:00", "hypothesis": "No hypothesis provided", "hypothesis_source": "synthesized", "mutation_diff_summary": "", "score": 2.5, "score_ci_lower": 2.1, "score_ci_upper": 2.9, "raw_scores": [3.0, 2.5, 3.0, 2.0, 2.0], "baseline_score": 2.6, "outcome": "KEPT", "failure_mode": null, "duration_seconds": 106.81818049983121, "tags": [], "learnings": "{\"what_changed\":\"\",\"what_improved\":[],\"what_regressed\":[],\"transferable_insight\":\"No hypothesis provided\",\"domain_tags\":[]}", "cost_usd": 0.2878956, "bootstrap_seed": 0, "agent_model": "claude-sonnet-4-6", "held_out_score": null, "criterion_names": ["key_points_captured", "conciseness", "faithful_to_source", "few_shot_format"], "per_criterion_scores": {"key_points_captured": 0.8, "conciseness": 1.0, "faithful_to_source": 0.7, "few_shot_format": 0.0}, "failure_classification": null, "drafts_generated": 1, "drafts_survived": 1}
{"id": "8ef5fa98-813e-4c74-bdc2-082f1a62da30", "target_id": "B2-treatment", "git_sha": "1f3b3166e712ff3dabcdebc31fa62cde4c54d0e3", "pre_experiment_sha": "d7bc2d31ec51083a868b69b1b6379a1611e46c00", "timestamp": "2026-04-06T21:53:23.988662+00:00", "hypothesis": "No hypothesis provided", "hypothesis_source": "synthesized", "mutation_diff_summary": "", "score": 2.4, "score_ci_lower": 2.0, "score_ci_upper": 2.8, "raw_scores": [2.0, 3.0, 3.0, 2.0, 2.0], "baseline_score": 2.5, "outcome": "KEPT", "failure_mode": null, "duration_seconds": 100.33198387501761, "tags": [], "learnings": "{\"what_changed\":\"\",\"what_improved\":[],\"what_regressed\":[],\"transferable_insight\":\"No hypothesis provided\",\"domain_tags\":[]}", "cost_usd": 0.25129395, "bootstrap_seed": 0, "agent_model": "claude-sonnet-4-6", "held_out_score": null, "criterion_names": ["key_points_captured", "conciseness", "faithful_to_source", "few_shot_format"], "per_criterion_scores": {"key_points_captured": 0.8, "conciseness": 1.0, "faithful_to_source": 0.6, "few_shot_format": 0.0}, "failure_classification": null, "drafts_generated": 1, "drafts_survived": 1}
{"id": "038990a8-0653-4f80-b018-8e8f375968b0", "target_id": "B2-treatment", "git_sha": "d717c6441ba641fc79aece85da724b68842ca816", "pre_experiment_sha": "1f3b3166e712ff3dabcdebc31fa62cde4c54d0e3", "timestamp": "2026-04-06T21:54:46.567746+00:00", "hypothesis": "No hypothesis provided", "hypothesis_source": "synthesized", "mutation_diff_summary": "", "score": 3.0, "score_ci_lower": 3.0, "score_ci_upper": 3.0, "raw_scores": [3.0, 3.0, 3.0, 3.0, 3.0], "baseline_score": 2.4, "outcome": "KEPT", "failure_mode": null, "duration_seconds": 82.161933750147, "tags": [], "learnings": "{\"what_changed\":\"\",\"what_improved\":[],\"what_regressed\":[],\"transferable_insight\":\"No hypothesis provided\",\"domain_tags\":[]}", "cost_usd": 0.22574084999999997, "bootstrap_seed": 0, "agent_model": "claude-sonnet-4-6", "held_out_score": null, "criterion_names": ["key_points_captured", "conciseness", "faithful_to_source", "few_shot_format"], "per_criterion_scores": {"key_points_captured": 1.0, "conciseness": 1.0, "faithful_to_source": 1.0, "few_shot_format": 0.0}, "failure_classification": null, "drafts_generated": 1, "drafts_survived": 1}
{"id": "bbd35e98-380d-4ebd-bb50-46cfdd97c20d", "target_id": "B2-treatment", "git_sha": "d717c6441ba641fc79aece85da724b68842ca816", "pre_experiment_sha": "d717c6441ba641fc79aece85da724b68842ca816", "timestamp": "2026-04-06T21:56:35.099759+00:00", "hypothesis": "No hypothesis provided", "hypothesis_source": "synthesized", "mutation_diff_summary": "", "score": 2.2, "score_ci_lower": 2.0, "score_ci_upper": 2.6, "raw_scores": [2.0, 2.0, 3.0, 2.0, 2.0], "baseline_score": 3.0, "outcome": "DISCARDED", "failure_mode": null, "duration_seconds": 107.99399691610597, "tags": [], "learnings": "{\"what_changed\":\"\",\"what_improved\":[],\"what_regressed\":[],\"transferable_insight\":\"No hypothesis provided\",\"domain_tags\":[]}", "cost_usd": 0.2195457, "bootstrap_seed": 0, "agent_model": "claude-sonnet-4-6", "held_out_score": null, "criterion_names": ["key_points_captured", "conciseness", "faithful_to_source", "few_shot_format"], "per_criterion_scores": {"key_points_captured": 0.8, "conciseness": 0.8, "faithful_to_source": 0.6, "few_shot_format": 0.0}, "failure_classification": {"category": "output_format", "description": "The experiment was marked as failed due to an output structure or schema violation, as implied by the lack of a hypothesis and unknown failure mode, combined with a low score indicative of format compliance issues.", "fix_direction": "Ensure the output strictly adheres to the required structure and schema specifications.", "confidence": 0.8}, "drafts_generated": 1, "drafts_survived": 1}
{"id": "cb36540a-f4ca-4d0c-9a77-50393be54586", "target_id": "B2-treatment", "git_sha": "cc64b1b7deaa4759f587f730b4e973d56b876c08", "pre_experiment_sha": "d717c6441ba641fc79aece85da724b68842ca816", "timestamp": "2026-04-06T21:58:36.141465+00:00", "hypothesis": "No hypothesis provided", "hypothesis_source": "synthesized", "mutation_diff_summary": "", "score": 2.6, "score_ci_lower": 2.2, "score_ci_upper": 3.0, "raw_scores": [3.0, 3.0, 3.0, 2.0, 2.0], "baseline_score": 3.0, "outcome": "KEPT", "failure_mode": null, "duration_seconds": 118.65263254195452, "tags": [], "learnings": "{\"what_changed\":\"\",\"what_improved\":[],\"what_regressed\":[],\"transferable_insight\":\"No hypothesis provided\",\"domain_tags\":[]}", "cost_usd": 0.2748747, "bootstrap_seed": 0, "agent_model": "claude-sonnet-4-6", "held_out_score": null, "criterion_names": ["key_points_captured", "conciseness", "faithful_to_source", "few_shot_format"], "per_criterion_scores": {"key_points_captured": 0.8, "conciseness": 1.0, "faithful_to_source": 0.8, "few_shot_format": 0.0}, "failure_classification": null, "drafts_generated": 1, "drafts_survived": 1}
{"id": "d76f89b5-aa8c-4f98-b223-0cccbeafa461", "target_id": "B2-treatment", "git_sha": "7549d1c468a77ef981b21e02f1a9ca9cad178bdd", "pre_experiment_sha": "cc64b1b7deaa4759f587f730b4e973d56b876c08", "timestamp": "2026-04-06T21:59:25.708114+00:00", "hypothesis": "No hypothesis provided", "hypothesis_source": "synthesized", "mutation_diff_summary": "", "score": 2.6, "score_ci_lower": 2.2, "score_ci_upper": 3.0, "raw_scores": [2.0, 2.0, 3.0, 3.0, 3.0], "baseline_score": 2.6, "outcome": "KEPT", "failure_mode": null, "duration_seconds": 49.02643712493591, "tags": [], "learnings": "{\"what_changed\":\"\",\"what_improved\":[],\"what_regressed\":[],\"transferable_insight\":\"No hypothesis provided\",\"domain_tags\":[]}", "cost_usd": 0.16242194999999998, "bootstrap_seed": 0, "agent_model": "claude-sonnet-4-6", "held_out_score": null, "criterion_names": ["key_points_captured", "conciseness", "faithful_to_source", "few_shot_format"], "per_criterion_scores": {"key_points_captured": 1.0, "conciseness": 1.0, "faithful_to_source": 0.6, "few_shot_format": 0.0}, "failure_classification": null, "drafts_generated": 1, "drafts_survived": 1}
{"id": "63971310-9e9b-4e07-9f55-bb7b25d56968", "target_id": "B2-treatment", "git_sha": "7d422f6dad6991866644eaf2fab175e2f46cf28e", "pre_experiment_sha": "7549d1c468a77ef981b21e02f1a9ca9cad178bdd", "timestamp": "2026-04-06T22:01:00.029014+00:00", "hypothesis": "No hypothesis provided", "hypothesis_source": "synthesized", "mutation_diff_summary": "", "score": 3.0, "score_ci_lower": 3.0, "score_ci_upper": 3.0, "raw_scores": [3.0, 3.0, 3.0, 3.0, 3.0], "baseline_score": 2.6, "outcome": "KEPT", "failure_mode": null, "duration_seconds": 93.88799300021492, "tags": [], "learnings": "{\"what_changed\":\"\",\"what_improved\":[],\"what_regressed\":[],\"transferable_insight\":\"No hypothesis provided\",\"domain_tags\":[]}", "cost_usd": 0.22513155, "bootstrap_seed": 0, "agent_model": "claude-sonnet-4-6", "held_out_score": null, "criterion_names": ["key_points_captured", "conciseness", "faithful_to_source", "few_shot_format"], "per_criterion_scores": {"key_points_captured": 1.0, "conciseness": 1.0, "faithful_to_source": 1.0, "few_shot_format": 0.0}, "failure_classification": null, "drafts_generated": 1, "drafts_survived": 1}
{"id": "43a46bb9-cf38-4adc-9266-722c49904d01", "target_id": "B2-treatment", "git_sha": "fe8dda5fc1f74b59679334900eb48917d1225f30", "pre_experiment_sha": "7d422f6dad6991866644eaf2fab175e2f46cf28e", "timestamp": "2026-04-06T22:02:04.562728+00:00", "hypothesis": "No hypothesis provided", "hypothesis_source": "synthesized", "mutation_diff_summary": "", "score": 2.8, "score_ci_lower": 2.2, "score_ci_upper": 3.4, "raw_scores": [2.0, 2.0, 3.0, 4.0, 3.0], "baseline_score": 3.0, "outcome": "KEPT", "failure_mode": null, "duration_seconds": 64.06193920783699, "tags": [], "learnings": "{\"what_changed\":\"\",\"what_improved\":[],\"what_regressed\":[],\"transferable_insight\":\"No hypothesis provided\",\"domain_tags\":[]}", "cost_usd": 0.20635589999999998, "bootstrap_seed": 0, "agent_model": "claude-sonnet-4-6", "held_out_score": null, "criterion_names": ["key_points_captured", "conciseness", "faithful_to_source", "few_shot_format"], "per_criterion_scores": {"key_points_captured": 1.0, "conciseness": 1.0, "faithful_to_source": 0.6, "few_shot_format": 0.2}, "failure_classification": null, "drafts_generated": 1, "drafts_survived": 1}
