{"id": "2aef915a-5841-470c-94ce-922d3d5915cf", "target_id": "B2-treatment", "git_sha": "43a8a7c4728eb2488e426282306927d4d727b200", "pre_experiment_sha": "f8e48364887e6c04cd89f6e31d355df657d59561", "timestamp": "2026-04-19T18:04:36.693541+00:00", "hypothesis": "Make the instruction even more direct and singular so the model consistently returns a terse 2\u20134 sentence factual summary with only core facts.", "hypothesis_source": "agent", "mutation_diff_summary": "", "score": 2.1, "score_ci_lower": 1.3, "score_ci_upper": 3.0, "raw_scores": [3.0, 1.0, 3.5, 1.5, 1.5], "baseline_score": 1.3, "outcome": "KEPT", "failure_mode": null, "duration_seconds": 13.190229041967541, "tags": ["concise", "directive", "summarization"], "learnings": "{\"what_changed\":\"\",\"what_improved\":[],\"what_regressed\":[],\"transferable_insight\":\"When a task\u2019s desired output is made more explicit, singular, and constrained, the model is more likely to produce consistently concise responses that stay focused on the core facts.\",\"domain_tags\":[\"prompt-engineering\",\"instruction-design\",\"output-control\"]}", "cost_usd": 0.007427950000000001, "bootstrap_seed": 0, "agent_model": "gpt-5.4", "held_out_score": null, "criterion_names": ["key_points_captured", "conciseness", "faithful_to_source", "few_shot_format"], "per_criterion_scores": {"key_points_captured": 0.8, "conciseness": 0.7, "faithful_to_source": 0.5, "few_shot_format": 0.1}, "failure_classification": null, "drafts_generated": 1, "drafts_survived": 1}
{"id": "5185a8f1-ea46-4ae2-9e31-ef1b6048f36e", "target_id": "B2-treatment", "git_sha": "43a8a7c4728eb2488e426282306927d4d727b200", "pre_experiment_sha": "43a8a7c4728eb2488e426282306927d4d727b200", "timestamp": "2026-04-19T18:04:50.311432+00:00", "hypothesis": "Make the prompt a single tighter directive emphasizing exactly 2\u20134 factual sentences with only the most relevant facts and no extras.", "hypothesis_source": "agent", "mutation_diff_summary": "", "score": 1.9, "score_ci_lower": 1.6, "score_ci_upper": 2.2, "raw_scores": [2.0, 1.5, 2.0, 1.5, 2.5], "baseline_score": 2.1, "outcome": "DISCARDED", "failure_mode": null, "duration_seconds": 12.26740858296398, "tags": ["concise", "single-directive", "summarization", "format-control"], "learnings": "{\"what_changed\":\"\",\"what_improved\":[],\"what_regressed\":[],\"transferable_insight\":\"Constraints that are too narrow can reduce output quality by suppressing useful context without improving relevance.\",\"domain_tags\":[\"prompt-engineering\",\"evaluation\",\"communication\"]}", "cost_usd": 0.007264550000000001, "bootstrap_seed": 0, "agent_model": "gpt-5.4", "held_out_score": null, "criterion_names": ["key_points_captured", "conciseness", "faithful_to_source", "few_shot_format"], "per_criterion_scores": {"key_points_captured": 0.9, "conciseness": 0.6, "faithful_to_source": 0.4, "few_shot_format": 0.0}, "failure_classification": {"category": "output_format", "description": "The experiment is marked as failed with an extremely low score, and the provided metadata (hypothesis, failure mode, score, categories) suggests the output likely did not conform to the required response format or structure/schema expected by the evaluator.", "fix_direction": "Re-check the required output schema exactly (valid JSON, correct keys, proper quoting, no extra text), and ensure the response is strictly limited to the JSON object with the specified fields.", "confidence": 0.62}, "drafts_generated": 1, "drafts_survived": 1}
{"id": "96616273-2365-4a48-88fe-ece693fb2e9e", "target_id": "B2-treatment", "git_sha": "0f382a159491520357b2dc69122f76daf544906c", "pre_experiment_sha": "43a8a7c4728eb2488e426282306927d4d727b200", "timestamp": "2026-04-19T18:05:14.593676+00:00", "hypothesis": "Make the instruction even more explicit and singular so the model reliably returns only a 2\u20134 sentence factual summary focused on binary-criteria essentials.", "hypothesis_source": "agent", "mutation_diff_summary": "", "score": 2.0, "score_ci_lower": 1.5, "score_ci_upper": 2.8, "raw_scores": [3.5, 2.0, 1.5, 1.5, 1.5], "baseline_score": 2.1, "outcome": "KEPT", "failure_mode": null, "duration_seconds": 20.439209416974336, "tags": ["concise", "format-control", "summarization", "binary-criteria"], "learnings": "{\"what_changed\":\"\",\"what_improved\":[],\"what_regressed\":[],\"transferable_insight\":\"When a task has a narrow success criterion, making the instruction more explicit and singular can improve consistency by reducing ambiguity and constraining the output to the essential facts.\",\"domain_tags\":[\"prompt-engineering\",\"instruction-design\",\"evaluation\"]}", "cost_usd": 0.00887135, "bootstrap_seed": 0, "agent_model": "gpt-5.4", "held_out_score": null, "criterion_names": ["key_points_captured", "conciseness", "faithful_to_source", "few_shot_format"], "per_criterion_scores": {"key_points_captured": 0.7, "conciseness": 0.5, "faithful_to_source": 0.5, "few_shot_format": 0.3}, "failure_classification": null, "drafts_generated": 1, "drafts_survived": 1}
{"id": "ede26edc-d891-47c4-ad64-1942533a93eb", "target_id": "B2-treatment", "git_sha": "3b130c1840970a78e49c1a8d77e808074bb4ba24", "pre_experiment_sha": "0f382a159491520357b2dc69122f76daf544906c", "timestamp": "2026-04-19T18:05:32.137288+00:00", "hypothesis": "Make the instruction even more singular and explicit about exact sentence count, relevance, and output-only compliance.", "hypothesis_source": "agent", "mutation_diff_summary": "", "score": 1.9, "score_ci_lower": 1.3, "score_ci_upper": 2.7, "raw_scores": [1.0, 3.5, 1.5, 1.5, 2.0], "baseline_score": 2.0, "outcome": "KEPT", "failure_mode": null, "duration_seconds": 16.359919291106053, "tags": ["concise", "directive-tightening", "format-constraint"], "learnings": "{\"what_changed\":\"\",\"what_improved\":[],\"what_regressed\":[],\"transferable_insight\":\"When a task requires strict format compliance, making the instruction more singular, explicit, and narrowly scoped can preserve adherence without introducing tradeoffs.\",\"domain_tags\":[\"prompt-engineering\",\"instruction-design\",\"format-compliance\"]}", "cost_usd": 0.007489550000000001, "bootstrap_seed": 0, "agent_model": "gpt-5.4", "held_out_score": null, "criterion_names": ["key_points_captured", "conciseness", "faithful_to_source", "few_shot_format"], "per_criterion_scores": {"key_points_captured": 0.9, "conciseness": 0.7, "faithful_to_source": 0.1, "few_shot_format": 0.2}, "failure_classification": null, "drafts_generated": 1, "drafts_survived": 1}
{"id": "48fe4312-f257-4235-8669-393d2b0c8c35", "target_id": "B2-treatment", "git_sha": "9560a277ba4ab31cdbf477a0fecc960e2724b615", "pre_experiment_sha": "3b130c1840970a78e49c1a8d77e808074bb4ba24", "timestamp": "2026-04-19T18:05:48.573503+00:00", "hypothesis": "A tighter single-sentence directive emphasizing exact length, factual relevance, and no extras will improve binary criteria compliance.", "hypothesis_source": "agent", "mutation_diff_summary": "", "score": 1.7, "score_ci_lower": 1.3, "score_ci_upper": 2.1, "raw_scores": [1.5, 2.0, 1.5, 1.0, 2.5], "baseline_score": 1.9, "outcome": "KEPT", "failure_mode": null, "duration_seconds": 15.162189416005276, "tags": ["concise", "format-control", "summarization", "binary-criteria"], "learnings": "{\"what_changed\":\"\",\"what_improved\":[],\"what_regressed\":[],\"transferable_insight\":\"When a task has strict output constraints, making the instruction explicitly narrow and unambiguous can improve compliance by reducing room for interpretation.\",\"domain_tags\":[\"instruction-design\",\"constraint-following\",\"prompting\"]}", "cost_usd": 0.00748855, "bootstrap_seed": 0, "agent_model": "gpt-5.4", "held_out_score": null, "criterion_names": ["key_points_captured", "conciseness", "faithful_to_source", "few_shot_format"], "per_criterion_scores": {"key_points_captured": 1.0, "conciseness": 0.5, "faithful_to_source": 0.2, "few_shot_format": 0.0}, "failure_classification": null, "drafts_generated": 1, "drafts_survived": 1}
{"id": "c131cdf9-5f3c-4472-9add-b8e2add6f841", "target_id": "B2-treatment", "git_sha": "a682f203ae47197316ccab9571da009030365308", "pre_experiment_sha": "9560a277ba4ab31cdbf477a0fecc960e2724b615", "timestamp": "2026-04-19T18:06:03.823058+00:00", "hypothesis": "Make the instruction a single tighter directive emphasizing exactly 2\u20134 short factual sentences with only the most relevant facts and no extras.", "hypothesis_source": "agent", "mutation_diff_summary": "", "score": 2.0, "score_ci_lower": 1.5, "score_ci_upper": 2.6, "raw_scores": [1.5, 1.5, 1.5, 3.0, 2.5], "baseline_score": 1.7, "outcome": "KEPT", "failure_mode": null, "duration_seconds": 12.94898041698616, "tags": ["concise", "single-directive", "format-tightening"], "learnings": "{\"what_changed\":\"\",\"what_improved\":[],\"what_regressed\":[],\"transferable_insight\":\"Tightening an instruction to explicitly constrain length and content scope can preserve performance while reducing unnecessary detail.\",\"domain_tags\":[\"prompting\",\"instruction-design\",\"conciseness\"]}", "cost_usd": 0.00802855, "bootstrap_seed": 0, "agent_model": "gpt-5.4", "held_out_score": null, "criterion_names": ["key_points_captured", "conciseness", "faithful_to_source", "few_shot_format"], "per_criterion_scores": {"key_points_captured": 1.0, "conciseness": 0.6, "faithful_to_source": 0.3, "few_shot_format": 0.1}, "failure_classification": null, "drafts_generated": 1, "drafts_survived": 1}
{"id": "2362aa71-7d93-4ae4-8a42-6834f7c803e5", "target_id": "B2-treatment", "git_sha": "a682f203ae47197316ccab9571da009030365308", "pre_experiment_sha": "a682f203ae47197316ccab9571da009030365308", "timestamp": "2026-04-19T18:06:20.013527+00:00", "hypothesis": "Make the prompt a single tighter directive emphasizing exact output constraints and factual brevity.", "hypothesis_source": "agent", "mutation_diff_summary": "", "score": 1.8, "score_ci_lower": 1.1, "score_ci_upper": 2.5, "raw_scores": [1.0, 1.5, 2.5, 1.0, 3.0], "baseline_score": 2.0, "outcome": "DISCARDED", "failure_mode": null, "duration_seconds": 15.025508249993436, "tags": ["concise", "single-directive", "output-constraint"], "learnings": "{\"what_changed\":\"\",\"what_improved\":[],\"what_regressed\":[],\"transferable_insight\":\"When a change is discarded and shows no measurable gains or regressions, tightening instructions alone is unlikely to improve outcomes without addressing the underlying task structure or signal quality.\",\"domain_tags\":[\"prompt-design\",\"evaluation\",\"optimization\"]}", "cost_usd": 0.009486950000000001, "bootstrap_seed": 0, "agent_model": "gpt-5.4", "held_out_score": null, "criterion_names": ["key_points_captured", "conciseness", "faithful_to_source", "few_shot_format"], "per_criterion_scores": {"key_points_captured": 0.8, "conciseness": 0.2, "faithful_to_source": 0.5, "few_shot_format": 0.3}, "failure_classification": {"category": "output_format", "description": "The attempt appears to have failed to satisfy strict output constraints for the prompt (e.g., exact formatting/structure and brevity requirements), leading to a low score despite the general intent of the hypothesis.", "fix_direction": "Constrain the response to a single, explicit output schema (including field order, required keys/formatting, and exact brevity), and validate against the expected formatter before returning.", "confidence": 0.42}, "drafts_generated": 1, "drafts_survived": 1}
{"id": "59e4323c-8a23-494a-a805-e8e189f102bb", "target_id": "B2-treatment", "git_sha": "821e575e2f360467b4d0e7c96bd37ba7dfe2b398", "pre_experiment_sha": "a682f203ae47197316ccab9571da009030365308", "timestamp": "2026-04-19T18:06:35.139433+00:00", "hypothesis": "A stricter single-sentence directive emphasizing only the most relevant facts and exact output constraints will improve binary criteria compliance.", "hypothesis_source": "agent", "mutation_diff_summary": "", "score": 1.7, "score_ci_lower": 1.2, "score_ci_upper": 2.4, "raw_scores": [1.5, 1.5, 3.0, 1.5, 1.0], "baseline_score": 2.0, "outcome": "KEPT", "failure_mode": null, "duration_seconds": 12.108241625013761, "tags": ["concise", "constraint-tightening", "summarization"], "learnings": "{\"what_changed\":\"\",\"what_improved\":[],\"what_regressed\":[],\"transferable_insight\":\"When a task has strict output requirements, a concise directive that foregrounds only the most relevant facts and exact constraints can improve compliance with binary criteria.\",\"domain_tags\":[\"prompting\",\"instruction-following\",\"evaluation\"]}", "cost_usd": 0.007456750000000002, "bootstrap_seed": 0, "agent_model": "gpt-5.4", "held_out_score": null, "criterion_names": ["key_points_captured", "conciseness", "faithful_to_source", "few_shot_format"], "per_criterion_scores": {"key_points_captured": 0.8, "conciseness": 0.6, "faithful_to_source": 0.2, "few_shot_format": 0.1}, "failure_classification": null, "drafts_generated": 1, "drafts_survived": 1}
{"id": "a33f0111-358c-4ebf-bb16-90ad7f392cf1", "target_id": "B2-treatment", "git_sha": "9e0c8198cbb1f272b0de7362ffb94340ce25e4a7", "pre_experiment_sha": "821e575e2f360467b4d0e7c96bd37ba7dfe2b398", "timestamp": "2026-04-19T18:06:51.691132+00:00", "hypothesis": "Make the prompt a single tighter directive that explicitly enforces exactly 2\u20134 short factual sentences and only the facts needed for binary criteria.", "hypothesis_source": "agent", "mutation_diff_summary": "", "score": 2.0, "score_ci_lower": 1.1, "score_ci_upper": 2.9, "raw_scores": [2.5, 3.5, 2.0, 1.5, 0.5], "baseline_score": 1.7, "outcome": "KEPT", "failure_mode": null, "duration_seconds": 14.376553916023113, "tags": ["concise", "single-directive", "format-constraint"], "learnings": "{\"what_changed\":\"\",\"what_improved\":[],\"what_regressed\":[],\"transferable_insight\":\"Tightening a prompt to explicitly constrain length, structure, and relevance can improve consistency by reducing room for unnecessary detail and ambiguity.\",\"domain_tags\":[\"prompt-engineering\",\"instruction-design\",\"information-retrieval\"]}", "cost_usd": 0.008410750000000002, "bootstrap_seed": 0, "agent_model": "gpt-5.4", "held_out_score": null, "criterion_names": ["key_points_captured", "conciseness", "faithful_to_source", "few_shot_format"], "per_criterion_scores": {"key_points_captured": 0.8, "conciseness": 0.5, "faithful_to_source": 0.4, "few_shot_format": 0.3}, "failure_classification": null, "drafts_generated": 1, "drafts_survived": 1}
{"id": "b73fb17c-8f27-42b8-a104-625b557e0198", "target_id": "B2-treatment", "git_sha": "357a37424b7732268f3d0920fc186eb0a9787752", "pre_experiment_sha": "9e0c8198cbb1f272b0de7362ffb94340ce25e4a7", "timestamp": "2026-04-19T18:07:10.638599+00:00", "hypothesis": "Tightening the directive to emphasize strict sentence count, factuality, and no extra output may improve binary criteria compliance.", "hypothesis_source": "agent", "mutation_diff_summary": "", "score": 1.4, "score_ci_lower": 1.0, "score_ci_upper": 1.8, "raw_scores": [1.0, 1.0, 2.0, 2.0, 1.0], "baseline_score": 2.0, "outcome": "KEPT", "failure_mode": null, "duration_seconds": 17.69317912508268, "tags": ["concise", "strict-format", "summarization"], "learnings": "{\"what_changed\":\"\",\"what_improved\":[],\"what_regressed\":[],\"transferable_insight\":\"When a task has rigid output constraints, explicitly prioritizing exact format and factual accuracy can improve compliance by reducing ambiguity and extraneous content.\",\"domain_tags\":[\"prompting\",\"instruction-following\",\"output-formatting\"]}", "cost_usd": 0.007710350000000001, "bootstrap_seed": 0, "agent_model": "gpt-5.4", "held_out_score": null, "criterion_names": ["key_points_captured", "conciseness", "faithful_to_source", "few_shot_format"], "per_criterion_scores": {"key_points_captured": 0.7, "conciseness": 0.1, "faithful_to_source": 0.4, "few_shot_format": 0.2}, "failure_classification": null, "drafts_generated": 1, "drafts_survived": 1}
{"id": "e5ab5e76-7355-4770-9b94-d9632a93b5c3", "target_id": "B2-treatment", "git_sha": "f2dc28cd34a3a7e04fa5a4db472137b50fe02510", "pre_experiment_sha": "357a37424b7732268f3d0920fc186eb0a9787752", "timestamp": "2026-04-19T18:07:26.079946+00:00", "hypothesis": "A stricter single-sentence directive emphasizing only essential binary-criteria facts and no extras will improve compliance.", "hypothesis_source": "agent", "mutation_diff_summary": "", "score": 1.9, "score_ci_lower": 1.4, "score_ci_upper": 2.3, "raw_scores": [2.0, 1.0, 2.5, 2.0, 2.0], "baseline_score": 1.4, "outcome": "KEPT", "failure_mode": null, "duration_seconds": 14.324297042097896, "tags": ["concise", "single-directive", "format-control"], "learnings": "{\"what_changed\":\"\",\"what_improved\":[],\"what_regressed\":[],\"transferable_insight\":\"When a task is constrained to a single, highly specific sentence that states only the essential binary criteria and excludes extra detail, compliance tends to improve.\",\"domain_tags\":[\"instruction-design\",\"prompting\",\"evaluation\"]}", "cost_usd": 0.00823155, "bootstrap_seed": 0, "agent_model": "gpt-5.4", "held_out_score": null, "criterion_names": ["key_points_captured", "conciseness", "faithful_to_source", "few_shot_format"], "per_criterion_scores": {"key_points_captured": 0.9, "conciseness": 0.5, "faithful_to_source": 0.2, "few_shot_format": 0.3}, "failure_classification": null, "drafts_generated": 1, "drafts_survived": 1}
{"id": "4ba724fd-fee8-4096-a5f0-16b099826264", "target_id": "B2-treatment", "git_sha": "bc3884b7b3e71815280339b69e13e22e1d35af19", "pre_experiment_sha": "f2dc28cd34a3a7e04fa5a4db472137b50fe02510", "timestamp": "2026-04-19T18:07:43.810023+00:00", "hypothesis": "A tighter single-sentence directive emphasizing binary-criteria facts and strict output-only formatting will improve compliance.", "hypothesis_source": "agent", "mutation_diff_summary": "", "score": 2.1, "score_ci_lower": 1.4, "score_ci_upper": 2.9, "raw_scores": [1.0, 2.5, 1.5, 2.0, 3.5], "baseline_score": 1.9, "outcome": "KEPT", "failure_mode": null, "duration_seconds": 15.54685679206159, "tags": ["concise", "format-control", "binary-criteria"], "learnings": "{\"what_changed\":\"\",\"what_improved\":[],\"what_regressed\":[],\"transferable_insight\":\"Clear, tightly constrained instructions with explicit binary criteria and output-only formatting tend to improve rule-following compliance.\",\"domain_tags\":[\"instruction-following\",\"prompt-design\",\"output-formatting\"]}", "cost_usd": 0.00788315, "bootstrap_seed": 0, "agent_model": "gpt-5.4", "held_out_score": null, "criterion_names": ["key_points_captured", "conciseness", "faithful_to_source", "few_shot_format"], "per_criterion_scores": {"key_points_captured": 0.9, "conciseness": 0.6, "faithful_to_source": 0.4, "few_shot_format": 0.2}, "failure_classification": null, "drafts_generated": 1, "drafts_survived": 1}
{"id": "f1a0bffc-dd42-46bb-bd7f-c5eeb6addc6b", "target_id": "B2-treatment", "git_sha": "bc3884b7b3e71815280339b69e13e22e1d35af19", "pre_experiment_sha": "bc3884b7b3e71815280339b69e13e22e1d35af19", "timestamp": "2026-04-19T18:08:01.377335+00:00", "hypothesis": "Make the prompt a single stricter directive that emphasizes exact length, factuality, and no extra content.", "hypothesis_source": "agent", "mutation_diff_summary": "", "score": 1.8, "score_ci_lower": 1.3, "score_ci_upper": 2.4, "raw_scores": [3.0, 2.0, 1.0, 1.5, 1.5], "baseline_score": 2.1, "outcome": "DISCARDED", "failure_mode": null, "duration_seconds": 16.41890108399093, "tags": ["concise", "single-directive", "format-tightening"], "learnings": "{\"what_changed\":\"\",\"what_improved\":[],\"what_regressed\":[],\"transferable_insight\":\"Making instructions stricter and more constrained does not necessarily improve outcomes if it reduces flexibility without adding useful guidance or signal.\",\"domain_tags\":[\"prompt-engineering\",\"instruction-design\",\"evaluation\"]}", "cost_usd": 0.007059150000000001, "bootstrap_seed": 0, "agent_model": "gpt-5.4", "held_out_score": null, "criterion_names": ["key_points_captured", "conciseness", "faithful_to_source", "few_shot_format"], "per_criterion_scores": {"key_points_captured": 1.0, "conciseness": 0.5, "faithful_to_source": 0.2, "few_shot_format": 0.1}, "failure_classification": {"category": "incomplete_edit", "description": "A strict prompt-edit hypothesis was proposed, but the resulting attempt failed without clear evidence of a consistent, complete change\u2014suggesting the modification was only partially applied or left the prompt in an inconsistent state.", "fix_direction": "Apply the directive changes end-to-end: enforce exact length constraints explicitly, restrict output to factual content only, and remove any additional or implicit instructions; verify the final prompt is internally consistent and fully specifies all constraints.", "confidence": 0.44}, "drafts_generated": 1, "drafts_survived": 1}
