{"id": "71580d3a-3a90-44a6-a49e-d58e69eff7fd", "target_id": "B2-treatment", "git_sha": "c2398274493f7f8e89eb7bc1359a3640a8181b68", "pre_experiment_sha": "1134fbbbafc1b79c1784ba81169a6b04a044f973", "timestamp": "2026-04-24T05:41:07.475367+00:00", "hypothesis": "Refine few-shot examples for natural phrasing and fluidity by breaking up overly long sentences, while maintaining purely positive instructions and a single-paragraph format.", "hypothesis_source": "agent", "mutation_diff_summary": "", "score": 2.7, "score_ci_lower": 2.1, "score_ci_upper": 3.4, "raw_scores": [3.0, 2.0, 4.0, 2.0, 2.5], "baseline_score": 2.8, "outcome": "KEPT", "failure_mode": null, "duration_seconds": 55.03156204218976, "tags": ["summarization", "few-shot", "formatting"], "learnings": "{\"what_changed\":\"\",\"what_improved\":[],\"what_regressed\":[],\"transferable_insight\":\"Refining few-shot examples with shorter sentences and purely positive framing improves natural fluidity and readability while maintaining a concise structure.\",\"domain_tags\":[\"Prompt Engineering\",\"Few-Shot Prompting\",\"Readability\"]}", "cost_usd": 0.0116877, "bootstrap_seed": 0, "agent_model": "gemini-3.1-pro-preview", "held_out_score": null, "criterion_names": ["key_points_captured", "conciseness", "faithful_to_source", "few_shot_format"], "per_criterion_scores": {"key_points_captured": 1.0, "conciseness": 1.0, "faithful_to_source": 0.5, "few_shot_format": 0.2}, "failure_classification": null, "drafts_generated": 1, "drafts_survived": 1}
{"id": "be69e5ab-b750-4796-af10-a452b269dc40", "target_id": "B2-treatment", "git_sha": "e3d170e3f948ba12a03254e0d3efca6aec77832a", "pre_experiment_sha": "c2398274493f7f8e89eb7bc1359a3640a8181b68", "timestamp": "2026-04-24T05:42:16.538415+00:00", "hypothesis": "Refine few-shot examples to improve readability and fluidity with cohesive phrasing, while maintaining purely positive instructions and a single-paragraph format.", "hypothesis_source": "agent", "mutation_diff_summary": "", "score": 2.7, "score_ci_lower": 2.3, "score_ci_upper": 3.2, "raw_scores": [2.0, 2.5, 3.5, 2.5, 3.0], "baseline_score": 2.7, "outcome": "KEPT", "failure_mode": null, "duration_seconds": 60.59091716585681, "tags": ["prompt-engineering", "fluency-optimization", "few-shot-refinement"], "learnings": "{\"what_changed\":\"\",\"what_improved\":[],\"what_regressed\":[],\"transferable_insight\":\"Enhancing few-shot examples with cohesive phrasing and purely positive instructions maintains baseline performance while standardizing output formatting.\",\"domain_tags\":[\"Few-Shot Prompting\",\"Prompt Engineering\",\"Instruction Formatting\"]}", "cost_usd": 0.012368050000000002, "bootstrap_seed": 0, "agent_model": "gemini-3.1-pro-preview", "held_out_score": null, "criterion_names": ["key_points_captured", "conciseness", "faithful_to_source", "few_shot_format"], "per_criterion_scores": {"key_points_captured": 1.0, "conciseness": 1.0, "faithful_to_source": 0.6, "few_shot_format": 0.1}, "failure_classification": null, "drafts_generated": 1, "drafts_survived": 1}
{"id": "79cf7b16-1a94-48d5-9e4d-06f661300c2b", "target_id": "B2-treatment", "git_sha": "e3d170e3f948ba12a03254e0d3efca6aec77832a", "pre_experiment_sha": "e3d170e3f948ba12a03254e0d3efca6aec77832a", "timestamp": "2026-04-24T05:43:22.404444+00:00", "hypothesis": "Refine few-shot examples for natural phrasing and fluidity by breaking up overly long sentences, while maintaining purely positive instructions and a single-paragraph format.", "hypothesis_source": "agent", "mutation_diff_summary": "", "score": 2.4, "score_ci_lower": 2.0, "score_ci_upper": 2.8, "raw_scores": [2.0, 3.0, 2.0, 2.0, 3.0], "baseline_score": 2.7, "outcome": "DISCARDED", "failure_mode": null, "duration_seconds": 59.47693166695535, "tags": ["prompt-engineering", "few-shot-optimization", "positive-framing"], "learnings": "{\"what_changed\":\"\",\"what_improved\":[],\"what_regressed\":[],\"transferable_insight\":\"Prioritizing human-like fluidity by breaking up long sentences in few-shot examples can degrade performance, suggesting that models may rely on the structural density or specific syntactic cues of longer sentences.\",\"domain_tags\":[\"Few-Shot Prompting\",\"Prompt Engineering\",\"Example Formatting\"]}", "cost_usd": 0.011697850000000001, "bootstrap_seed": 0, "agent_model": "gemini-3.1-pro-preview", "held_out_score": null, "criterion_names": ["key_points_captured", "conciseness", "faithful_to_source", "few_shot_format"], "per_criterion_scores": {"key_points_captured": 1.0, "conciseness": 1.0, "faithful_to_source": 0.4, "few_shot_format": 0.0}, "failure_classification": {"category": "semantic_drift", "description": "The attempt to refine few-shot examples for natural phrasing and fluidity by breaking up overly long sentences likely led to an unintended alteration of the original meaning, intent, or critical information within the examples. While the text might have become stylistically 'more fluid' or 'natural' on a superficial level, it lost its semantic fidelity, rendering the examples ineffective or misleading, which resulted in the very low score.", "fix_direction": "Implement stricter guardrails and evaluation metrics for semantic preservation. Introduce specific instructions to the model to prioritize the original meaning and factual content over stylistic changes. Consider using embedding similarity checks or human review for semantic equivalence between the original and refined examples. Explicitly test for loss of key information or introduction of ambiguity.", "confidence": 0.85}, "drafts_generated": 1, "drafts_survived": 1}
{"id": "a714d1aa-bf70-42f3-b540-98bfb41a1540", "target_id": "B2-treatment", "git_sha": "e748291b6a060bedb71f1a7fcd6c03a4c6dd78a0", "pre_experiment_sha": "e3d170e3f948ba12a03254e0d3efca6aec77832a", "timestamp": "2026-04-24T05:45:03.919210+00:00", "hypothesis": "Refining few-shot examples by replacing rigid, choppy sentences with more natural phrasing, maintaining purely positive instructions and a simple, single-paragraph format.", "hypothesis_source": "agent", "mutation_diff_summary": "", "score": 2.5, "score_ci_lower": 2.1, "score_ci_upper": 2.9, "raw_scores": [2.0, 3.0, 3.0, 2.0, 2.5], "baseline_score": 2.7, "outcome": "KEPT", "failure_mode": null, "duration_seconds": 60.4424705831334, "tags": ["fluidity", "positive-instructions", "simple-formatting"], "learnings": "{\"what_changed\":\"\",\"what_improved\":[],\"what_regressed\":[],\"transferable_insight\":\"Refining few-shot examples to use natural phrasing and purely positive instructions enhances the effectiveness of in-context learning compared to rigid sentence structures.\",\"domain_tags\":[\"Prompt Engineering\",\"Few-Shot Learning\"]}", "cost_usd": 0.0110903, "bootstrap_seed": 0, "agent_model": "gemini-3.1-pro-preview", "held_out_score": null, "criterion_names": ["key_points_captured", "conciseness", "faithful_to_source", "few_shot_format"], "per_criterion_scores": {"key_points_captured": 1.0, "conciseness": 1.0, "faithful_to_source": 0.5, "few_shot_format": 0.0}, "failure_classification": null, "drafts_generated": 1, "drafts_survived": 1}
{"id": "3e8f08ea-c143-4e0e-8388-90ea053965b2", "target_id": "B2-treatment", "git_sha": "840a79fec62fc2df323de3483ff95b3e36b74cc2", "pre_experiment_sha": "e748291b6a060bedb71f1a7fcd6c03a4c6dd78a0", "timestamp": "2026-04-24T05:46:06.736029+00:00", "hypothesis": "Refine few-shot examples by breaking up overly long sentences into more natural, fluid phrasing, maintaining purely positive instructions, and enforcing a simple, single-paragraph format.", "hypothesis_source": "agent", "mutation_diff_summary": "", "score": 2.5, "score_ci_lower": 1.8, "score_ci_upper": 3.3, "raw_scores": [2.0, 3.0, 4.0, 2.0, 1.5], "baseline_score": 2.5, "outcome": "KEPT", "failure_mode": null, "duration_seconds": 55.70643500005826, "tags": ["summarization", "few-shot", "fluidity", "natural-phrasing"], "learnings": "{\"what_changed\":\"\",\"what_improved\":[],\"what_regressed\":[],\"transferable_insight\":\"Simplifying few-shot examples by breaking up long sentences, using purely positive instructions, and enforcing a single-paragraph format maintains model performance while encouraging more natural, fluid outputs.\",\"domain_tags\":[\"Prompt Engineering\",\"Few-Shot Prompting\",\"Formatting\"]}", "cost_usd": 0.011530549999999999, "bootstrap_seed": 0, "agent_model": "gemini-3.1-pro-preview", "held_out_score": null, "criterion_names": ["key_points_captured", "conciseness", "faithful_to_source", "few_shot_format"], "per_criterion_scores": {"key_points_captured": 0.9, "conciseness": 1.0, "faithful_to_source": 0.4, "few_shot_format": 0.2}, "failure_classification": null, "drafts_generated": 1, "drafts_survived": 1}
{"id": "bf826a0f-9820-4383-84f9-7e17a2df5f07", "target_id": "B2-treatment", "git_sha": "3817c696f3f624f11b56986947c22361d6f11a3c", "pre_experiment_sha": "840a79fec62fc2df323de3483ff95b3e36b74cc2", "timestamp": "2026-04-24T05:47:22.579688+00:00", "hypothesis": "Refining few-shot examples by replacing rigid, choppy sentences with more natural phrasing, while adhering strictly to positive instructions and maintaining a simple, single-paragraph format.", "hypothesis_source": "agent", "mutation_diff_summary": "", "score": 2.9, "score_ci_lower": 2.4, "score_ci_upper": 3.5, "raw_scores": [2.0, 3.0, 4.0, 3.0, 2.5], "baseline_score": 2.5, "outcome": "KEPT", "failure_mode": null, "duration_seconds": 68.07256508409046, "tags": ["formatting", "few-shot", "phrasing"], "learnings": "{\"what_changed\":\"\",\"what_improved\":[],\"what_regressed\":[],\"transferable_insight\":\"Enhancing few-shot examples with natural phrasing, positive constraints, and simple formatting improves overall model performance.\",\"domain_tags\":[\"Few-Shot Prompting\",\"Prompt Engineering\",\"Formatting\"]}", "cost_usd": 0.01236715, "bootstrap_seed": 0, "agent_model": "gemini-3.1-pro-preview", "held_out_score": null, "criterion_names": ["key_points_captured", "conciseness", "faithful_to_source", "few_shot_format"], "per_criterion_scores": {"key_points_captured": 1.0, "conciseness": 1.0, "faithful_to_source": 0.6, "few_shot_format": 0.3}, "failure_classification": null, "drafts_generated": 1, "drafts_survived": 1}
{"id": "bfbc77a2-3019-481e-8b1f-0327b18f1708", "target_id": "B2-treatment", "git_sha": "4a35ec7f7d4fa1f5125225e465fc22017ee97279", "pre_experiment_sha": "3817c696f3f624f11b56986947c22361d6f11a3c", "timestamp": "2026-04-24T05:49:04.812014+00:00", "hypothesis": "Refining few-shot examples by replacing rigid, choppy sentences with more natural phrasing, while adhering strictly to positive instructions and maintaining a simple, single-paragraph format.", "hypothesis_source": "agent", "mutation_diff_summary": "", "score": 3.2, "score_ci_lower": 2.5, "score_ci_upper": 3.9, "raw_scores": [3.5, 2.5, 4.0, 4.0, 2.0], "baseline_score": 2.9, "outcome": "KEPT", "failure_mode": null, "duration_seconds": 73.28331687487662, "tags": ["prompt-engineering", "few-shot-optimization", "positive-framing", "natural-phrasing"], "learnings": "{\"what_changed\":\"\",\"what_improved\":[\"few_shot_format: PASS (was FAIL)\"],\"what_regressed\":[],\"transferable_insight\":\"Enhancing few-shot examples with natural phrasing, positive instructions, and a simple single-paragraph structure significantly improves the model's adherence to formatting constraints.\",\"domain_tags\":[\"Few-Shot Prompting\",\"Formatting\",\"Instruction Framing\"]}", "cost_usd": 0.01687735, "bootstrap_seed": 0, "agent_model": "gemini-3.1-pro-preview", "held_out_score": null, "criterion_names": ["key_points_captured", "conciseness", "faithful_to_source", "few_shot_format"], "per_criterion_scores": {"key_points_captured": 1.0, "conciseness": 1.0, "faithful_to_source": 0.7, "few_shot_format": 0.5}, "failure_classification": null, "drafts_generated": 1, "drafts_survived": 1}
{"id": "d020b3e3-f056-4d5c-97d7-a769c0209b4d", "target_id": "B2-treatment", "git_sha": "4a35ec7f7d4fa1f5125225e465fc22017ee97279", "pre_experiment_sha": "4a35ec7f7d4fa1f5125225e465fc22017ee97279", "timestamp": "2026-04-24T05:50:21.009968+00:00", "hypothesis": "Refining few-shot examples by replacing rigid, choppy sentences with more natural phrasing, while adhering strictly to positive instructions and maintaining a simple, single-paragraph format.", "hypothesis_source": "agent", "mutation_diff_summary": "", "score": 2.7, "score_ci_lower": 2.3, "score_ci_upper": 3.0, "raw_scores": [3.0, 2.5, 3.0, 2.0, 3.0], "baseline_score": 3.2, "outcome": "DISCARDED", "failure_mode": null, "duration_seconds": 68.17054225015454, "tags": ["prompt-engineering", "few-shot-optimization", "positive-framing", "natural-phrasing"], "learnings": "{\"what_changed\":\"\",\"what_improved\":[],\"what_regressed\":[\"few_shot_format: FAIL (was PASS)\"],\"transferable_insight\":\"Prioritizing natural phrasing over rigid, structured sentences in few-shot examples can degrade a model's adherence to strict output formats.\",\"domain_tags\":[\"Few-Shot Prompting\",\"Output Formatting\",\"Prompt Engineering\"]}", "cost_usd": 0.01661745, "bootstrap_seed": 0, "agent_model": "gemini-3.1-pro-preview", "held_out_score": null, "criterion_names": ["key_points_captured", "conciseness", "faithful_to_source", "few_shot_format"], "per_criterion_scores": {"key_points_captured": 1.0, "conciseness": 1.0, "faithful_to_source": 0.7, "few_shot_format": 0.0}, "failure_classification": {"category": "semantic_drift", "description": "The attempt to make few-shot examples more \"natural\" by replacing rigid phrasing likely introduced ambiguity or subtly altered the core meaning and specific cues the model relies on. While the format might have been maintained, the semantic shift led the model to misinterpret the task, resulting in a significantly lower performance score.", "fix_direction": "Prioritize clarity, precision, and unambiguous instruction over colloquial naturalness in few-shot examples. Carefully compare the semantic content of the 'natural' phrasing against the original 'rigid' phrasing to ensure no critical information or instruction has been lost or misinterpreted. Conduct A/B tests on specific example changes, focusing on how the model's *semantic understanding* of the task changes, rather than just its readability.", "confidence": 0.9}, "drafts_generated": 1, "drafts_survived": 1}
{"id": "89319b1b-324d-4d04-8848-e26d8c889ca8", "target_id": "B2-treatment", "git_sha": "4a35ec7f7d4fa1f5125225e465fc22017ee97279", "pre_experiment_sha": "4a35ec7f7d4fa1f5125225e465fc22017ee97279", "timestamp": "2026-04-24T05:51:38.131894+00:00", "hypothesis": "Refining few-shot examples by replacing rigid, choppy sentences with more natural phrasing, while adhering strictly to positive instructions and maintaining a simple, single-paragraph format.", "hypothesis_source": "agent", "mutation_diff_summary": "", "score": 3.1, "score_ci_lower": 2.3, "score_ci_upper": 3.9, "raw_scores": [4.0, 2.0, 4.0, 3.5, 2.0], "baseline_score": 3.2, "outcome": "DISCARDED", "failure_mode": null, "duration_seconds": 56.70537604088895, "tags": ["prompt-engineering", "few-shot-optimization", "positive-framing", "natural-phrasing"], "learnings": "{\"what_changed\":\"\",\"what_improved\":[\"few_shot_format: PASS (was FAIL)\"],\"what_regressed\":[],\"transferable_insight\":\"Prioritizing natural phrasing over rigid, explicit sentence structures in few-shot examples can degrade performance by obscuring the clear, unambiguous patterns the model needs to learn.\",\"domain_tags\":[\"Few-Shot Prompting\",\"Prompt Engineering\",\"Example Formatting\"]}", "cost_usd": 0.01707345, "bootstrap_seed": 0, "agent_model": "gemini-3.1-pro-preview", "held_out_score": null, "criterion_names": ["key_points_captured", "conciseness", "faithful_to_source", "few_shot_format"], "per_criterion_scores": {"key_points_captured": 1.0, "conciseness": 1.0, "faithful_to_source": 0.6, "few_shot_format": 0.5}, "failure_classification": {"category": "semantic_drift", "description": "The attempt to make few-shot examples more 'natural' and strictly adhere to 'positive instructions' likely introduced ambiguity, reduced clarity, or altered the specific semantic cues the model relied upon for effective learning. While the phrasing might have been aesthetically pleasing or 'natural' to a human, it inadvertently conveyed a different or less precise meaning to the model, leading to its poor performance (score 3.1). The meaning of the instructions 'drifted' away from what was originally effective.", "fix_direction": "Re-evaluate the definition of 'natural phrasing' in the context of machine understanding, prioritizing clarity, conciseness, and explicit instruction over human-like conversational style. Experiment with specific linguistic structures that are demonstrably more effective for the model. Test the impact of positive instructions by comparing them with explicit constraints or a balanced mix of instruction types to ensure meaning is not lost or misinterpreted.", "confidence": 0.9}, "drafts_generated": 1, "drafts_survived": 1}
{"id": "e1fd2d2f-7863-48e6-8cd3-bc72073b66aa", "target_id": "B2-treatment", "git_sha": "4a35ec7f7d4fa1f5125225e465fc22017ee97279", "pre_experiment_sha": "4a35ec7f7d4fa1f5125225e465fc22017ee97279", "timestamp": "2026-04-24T05:53:40.456885+00:00", "hypothesis": "Refine few-shot examples to improve readability and fluidity with cohesive phrasing, while maintaining purely positive instructions and a simple, single-paragraph format.", "hypothesis_source": "agent", "mutation_diff_summary": "", "score": 2.6, "score_ci_lower": 2.0, "score_ci_upper": 3.4, "raw_scores": [2.0, 3.0, 2.0, 2.0, 4.0], "baseline_score": 3.2, "outcome": "DISCARDED", "failure_mode": null, "duration_seconds": 77.6707842501346, "tags": ["prompt-engineering", "few-shot-optimization", "positive-framing", "natural-phrasing"], "learnings": "{\"what_changed\":\"\",\"what_improved\":[],\"what_regressed\":[\"faithful_to_source: FAIL (was PASS)\",\"few_shot_format: FAIL (was PASS)\"],\"transferable_insight\":\"Enhancing few-shot examples with cohesive, fluid phrasing can inadvertently encourage models to prioritize narrative flow over strict formatting and source faithfulness.\",\"domain_tags\":[\"few-shot_prompting\",\"prompt_engineering\",\"hallucination_prevention\"]}", "cost_usd": 0.0163407, "bootstrap_seed": 0, "agent_model": "gemini-3.1-pro-preview", "held_out_score": null, "criterion_names": ["key_points_captured", "conciseness", "faithful_to_source", "few_shot_format"], "per_criterion_scores": {"key_points_captured": 1.0, "conciseness": 1.0, "faithful_to_source": 0.4, "few_shot_format": 0.2}, "failure_classification": {"category": "semantic_drift", "description": "The refinement of few-shot examples, aimed at improving readability and fluidity, likely introduced a subtle shift in the semantic meaning or task interpretation for the model. While the examples might have appeared 'better' or 'more cohesive' to a human, they inadvertently diluted the specific instructions or relevant cues for the model. This caused the model's understanding of the task to drift from the intended goal, resulting in outputs that were incorrect in meaning or relevance, leading to the very low score.", "fix_direction": "Re-evaluate the refined few-shot examples for clarity and directness from the model's perspective, rather than solely human readability. Focus on ensuring the examples clearly convey the exact task semantics without introducing ambiguity or overly abstract language. Test iterations to find a balance between natural language processing and explicit instruction, ensuring that 'cohesive phrasing' does not obscure critical signals for the model.", "confidence": 0.9}, "drafts_generated": 1, "drafts_survived": 1}
