{"id": "d44d2400-db9a-47d6-8d35-525ef609907b", "target_id": "B2-treatment", "git_sha": "82eac2d28b69ddd741debf7fdba84159a07c3766", "pre_experiment_sha": "bc3884b7b3e71815280339b69e13e22e1d35af19", "timestamp": "2026-04-19T18:08:21.105528+00:00", "hypothesis": "A stricter single-line directive that emphasizes exact output constraints and bans any extra wording will improve binary criteria adherence.", "hypothesis_source": "agent", "mutation_diff_summary": "", "score": 2.1, "score_ci_lower": 1.4, "score_ci_upper": 2.7, "raw_scores": [2.5, 1.0, 2.5, 1.5, 3.0], "baseline_score": 2.1, "outcome": "KEPT", "failure_mode": null, "duration_seconds": 17.093696750001982, "tags": ["concise", "single-directive", "format-constraint", "anti-elaboration"], "learnings": "{\"what_changed\":\"\",\"what_improved\":[],\"what_regressed\":[],\"transferable_insight\":\"When the desired output is highly constrained, making the format and prohibition of extra text explicit can improve compliance with binary requirements.\",\"domain_tags\":[\"prompting\",\"instruction-following\",\"output-formatting\"]}", "cost_usd": 0.008876350000000002, "bootstrap_seed": 0, "agent_model": "gpt-5.4", "held_out_score": null, "criterion_names": ["key_points_captured", "conciseness", "faithful_to_source", "few_shot_format"], "per_criterion_scores": {"key_points_captured": 1.0, "conciseness": 0.4, "faithful_to_source": 0.6, "few_shot_format": 0.1}, "failure_classification": null, "drafts_generated": 1, "drafts_survived": 1}
{"id": "8a7a3a6f-9680-4034-b9d0-83fd9df8e7ea", "target_id": "B2-treatment", "git_sha": "26a9498936cb632212bd60c7571a73d43e782364", "pre_experiment_sha": "82eac2d28b69ddd741debf7fdba84159a07c3766", "timestamp": "2026-04-19T18:08:38.832233+00:00", "hypothesis": "A slightly clearer single-line directive that foregrounds source faithfulness and exact sentence-only output will improve binary criteria compliance.", "hypothesis_source": "agent", "mutation_diff_summary": "", "score": 2.3, "score_ci_lower": 1.5, "score_ci_upper": 3.1, "raw_scores": [1.5, 3.0, 1.0, 2.5, 3.5], "baseline_score": 2.1, "outcome": "KEPT", "failure_mode": null, "duration_seconds": 15.030010625021532, "tags": ["concise", "single-directive", "faithfulness", "strict-format"], "learnings": "{\"what_changed\":\"\",\"what_improved\":[\"conciseness: PASS (was FAIL)\"],\"what_regressed\":[\"faithful_to_source: FAIL (was PASS)\"],\"transferable_insight\":\"Making instructions more concise can improve format compliance, but tightening them may also reduce fidelity to the source if the task constraints are not explicitly preserved.\",\"domain_tags\":[\"prompting\",\"instruction-design\",\"evaluation\"]}", "cost_usd": 0.022401750000000005, "bootstrap_seed": 0, "agent_model": "gpt-5.4", "held_out_score": null, "criterion_names": ["key_points_captured", "conciseness", "faithful_to_source", "few_shot_format"], "per_criterion_scores": {"key_points_captured": 0.9, "conciseness": 0.7, "faithful_to_source": 0.4, "few_shot_format": 0.3}, "failure_classification": null, "drafts_generated": 1, "drafts_survived": 1}
{"id": "c7c2c026-6518-4ec7-9542-12b27f4af87e", "target_id": "B2-treatment", "git_sha": "26a9498936cb632212bd60c7571a73d43e782364", "pre_experiment_sha": "26a9498936cb632212bd60c7571a73d43e782364", "timestamp": "2026-04-19T18:08:53.468730+00:00", "hypothesis": "A slightly clearer single-line directive that explicitly ties relevance to source-supported facts and required summary elements will improve binary-criteria compliance.", "hypothesis_source": "agent", "mutation_diff_summary": "", "score": 1.9, "score_ci_lower": 1.3, "score_ci_upper": 2.7, "raw_scores": [1.0, 1.5, 2.0, 1.5, 3.5], "baseline_score": 2.3, "outcome": "DISCARDED", "failure_mode": null, "duration_seconds": 13.500903667067178, "tags": ["concise", "single-directive", "faithfulness", "strict-format"], "learnings": "{\"what_changed\":\"\",\"what_improved\":[],\"what_regressed\":[\"conciseness: FAIL (was PASS)\"],\"transferable_insight\":\"Adding explicit constraints can improve compliance with required content, but if the directive becomes too verbose it may reduce conciseness and hurt overall performance.\",\"domain_tags\":[\"prompt-design\",\"instruction-following\",\"evaluation\"]}", "cost_usd": 0.022318150000000002, "bootstrap_seed": 0, "agent_model": "gpt-5.4", "held_out_score": null, "criterion_names": ["key_points_captured", "conciseness", "faithful_to_source", "few_shot_format"], "per_criterion_scores": {"key_points_captured": 1.0, "conciseness": 0.2, "faithful_to_source": 0.4, "few_shot_format": 0.3}, "failure_classification": {"category": "semantic_drift", "description": "The experiment appears to have not improved the intended binary criteria compliance; despite aiming for a clearer directive tied to source-supported facts, the resulting behavior likely shifted meaning or relevance handling in a way that still failed the criteria (low score indicates continued non-compliance rather than a format/parsing issue).", "fix_direction": "Make the instruction explicitly and unambiguously constrain the summary: require only source-supported claims, specify exact required summary elements, and add explicit refusals for unsupported or extra content; validate that the model adheres to these constraints rather than rephrasing or adding ungrounded relevance.", "confidence": 0.46}, "drafts_generated": 1, "drafts_survived": 1}
{"id": "6fd5e8ac-ba5a-48f2-8a02-ab2f2ec22751", "target_id": "B2-treatment", "git_sha": "3727628a5e4ee319c3b0a798b5b37fc6aecf0b97", "pre_experiment_sha": "26a9498936cb632212bd60c7571a73d43e782364", "timestamp": "2026-04-19T18:09:09.626379+00:00", "hypothesis": "A slightly simpler single-line directive that prioritizes source faithfulness and exact sentence-only output will improve binary-criteria compliance.", "hypothesis_source": "agent", "mutation_diff_summary": "", "score": 1.7, "score_ci_lower": 1.3, "score_ci_upper": 2.2, "raw_scores": [1.0, 2.5, 1.5, 2.0, 1.5], "baseline_score": 2.3, "outcome": "KEPT", "failure_mode": null, "duration_seconds": 13.297402082942426, "tags": ["concise", "single-directive", "faithfulness", "strict-format"], "learnings": "{\"what_changed\":\"\",\"what_improved\":[\"conciseness: PASS (was FAIL)\"],\"what_regressed\":[],\"transferable_insight\":\"When a task has strict output constraints, a shorter directive that emphasizes the highest-priority requirement can improve compliance by reducing ambiguity and cognitive load.\",\"domain_tags\":[\"prompt-design\",\"instruction-following\",\"evaluation\"]}", "cost_usd": 0.020185750000000002, "bootstrap_seed": 0, "agent_model": "gpt-5.4", "held_out_score": null, "criterion_names": ["key_points_captured", "conciseness", "faithful_to_source", "few_shot_format"], "per_criterion_scores": {"key_points_captured": 0.9, "conciseness": 0.5, "faithful_to_source": 0.3, "few_shot_format": 0.0}, "failure_classification": null, "drafts_generated": 1, "drafts_survived": 1}
{"id": "10d4ca4f-64f3-4647-9dec-1aab3247ca15", "target_id": "B2-treatment", "git_sha": "ca2effc5280b3226e0cffb0aaf06aa6e364d6a5f", "pre_experiment_sha": "3727628a5e4ee319c3b0a798b5b37fc6aecf0b97", "timestamp": "2026-04-19T18:09:28.361517+00:00", "hypothesis": "A slightly clearer single-line directive that explicitly preserves source support, required content, and exact sentence-only output may improve binary-criteria adherence.", "hypothesis_source": "agent", "mutation_diff_summary": "", "score": 2.3, "score_ci_lower": 1.6, "score_ci_upper": 3.0, "raw_scores": [3.5, 1.5, 1.5, 2.0, 3.0], "baseline_score": 1.7, "outcome": "KEPT", "failure_mode": null, "duration_seconds": 16.512306833057664, "tags": ["concise", "single-directive", "faithfulness", "strict-format"], "learnings": "{\"what_changed\":\"\",\"what_improved\":[\"faithful_to_source: PASS (was FAIL)\"],\"what_regressed\":[],\"transferable_insight\":\"Making the output constraint explicit in a single, unambiguous directive can improve adherence to source-faithfulness requirements without harming other criteria.\",\"domain_tags\":[\"instruction-following\",\"prompt-design\",\"evaluation\"]}", "cost_usd": 0.02293815, "bootstrap_seed": 0, "agent_model": "gpt-5.4", "held_out_score": null, "criterion_names": ["key_points_captured", "conciseness", "faithful_to_source", "few_shot_format"], "per_criterion_scores": {"key_points_captured": 1.0, "conciseness": 0.7, "faithful_to_source": 0.5, "few_shot_format": 0.1}, "failure_classification": null, "drafts_generated": 1, "drafts_survived": 1}
{"id": "f4af964d-8466-4cc1-9bb5-6fb05e6df828", "target_id": "B2-treatment", "git_sha": "3424ccc9ae97fbd11dc2fcf25f6b4f35661aa77a", "pre_experiment_sha": "ca2effc5280b3226e0cffb0aaf06aa6e364d6a5f", "timestamp": "2026-04-19T18:09:46.740235+00:00", "hypothesis": "A slightly tighter single-line directive that explicitly prioritizes source support and the exact 2\u20134 sentence output may improve faithfulness without hurting conciseness.", "hypothesis_source": "agent", "mutation_diff_summary": "", "score": 2.0, "score_ci_lower": 1.6, "score_ci_upper": 2.4, "raw_scores": [2.0, 1.5, 1.5, 2.5, 2.5], "baseline_score": 2.3, "outcome": "KEPT", "failure_mode": null, "duration_seconds": 17.290909750037827, "tags": ["concise", "single-directive", "faithfulness", "strict-format"], "learnings": "{\"what_changed\":\"\",\"what_improved\":[],\"what_regressed\":[\"faithful_to_source: FAIL (was PASS)\"],\"transferable_insight\":\"Adding tighter formatting constraints can reduce conciseness drift, but if they are not paired with explicit source-grounding safeguards, they may still worsen faithfulness to the original evidence.\",\"domain_tags\":[\"prompt-engineering\",\"evaluation\",\"information-retrieval\"]}", "cost_usd": 0.02197715, "bootstrap_seed": 0, "agent_model": "gpt-5.4", "held_out_score": null, "criterion_names": ["key_points_captured", "conciseness", "faithful_to_source", "few_shot_format"], "per_criterion_scores": {"key_points_captured": 1.0, "conciseness": 0.6, "faithful_to_source": 0.4, "few_shot_format": 0.0}, "failure_classification": null, "drafts_generated": 1, "drafts_survived": 1}
{"id": "e05b43fd-ebba-4c2e-8faa-b2cbe738cdd2", "target_id": "B2-treatment", "git_sha": "3424ccc9ae97fbd11dc2fcf25f6b4f35661aa77a", "pre_experiment_sha": "3424ccc9ae97fbd11dc2fcf25f6b4f35661aa77a", "timestamp": "2026-04-19T18:10:01.049098+00:00", "hypothesis": "A single directive that explicitly anchors every sentence to source-supported facts while preserving the exact 2\u20134 sentence-only format will improve binary criteria compliance.", "hypothesis_source": "agent", "mutation_diff_summary": "", "score": 1.9, "score_ci_lower": 1.5, "score_ci_upper": 2.5, "raw_scores": [1.5, 1.5, 3.0, 1.5, 2.0], "baseline_score": 2.0, "outcome": "DISCARDED", "failure_mode": null, "duration_seconds": 13.135807667043991, "tags": ["concise", "single-directive", "faithfulness", "strict-format"], "learnings": "{\"what_changed\":\"\",\"what_improved\":[],\"what_regressed\":[],\"transferable_insight\":\"Explicitly constraining both content grounding and output structure can improve compliance with binary evaluation criteria, but only if the constraint is simple enough to follow consistently.\",\"domain_tags\":[\"prompt-engineering\",\"evaluation\",\"instruction-following\"]}", "cost_usd": 0.02185275, "bootstrap_seed": 0, "agent_model": "gpt-5.4", "held_out_score": null, "criterion_names": ["key_points_captured", "conciseness", "faithful_to_source", "few_shot_format"], "per_criterion_scores": {"key_points_captured": 1.0, "conciseness": 0.5, "faithful_to_source": 0.2, "few_shot_format": 0.2}, "failure_classification": {"category": "output_format", "description": "The experiment failed binary criterion compliance related to enforcing an explicit anchoring directive and/or maintaining the strict 2\u20134 sentence-only format, indicating a structure/schema violation rather than reasoning or code issues.", "fix_direction": "Re-assert and test the exact output constraint (strict 2\u20134 sentences) and ensure each sentence is explicitly anchored to source-supported facts via a consistent directive, verifying compliance before evaluating.", "confidence": 0.62}, "drafts_generated": 1, "drafts_survived": 1}
{"id": "9f67022b-6774-49ae-9ee5-5fc739d1e06e", "target_id": "B2-treatment", "git_sha": "7b1c2c4a889664e4e12b9e007904413b89c5d399", "pre_experiment_sha": "3424ccc9ae97fbd11dc2fcf25f6b4f35661aa77a", "timestamp": "2026-04-19T18:10:17.491794+00:00", "hypothesis": "A slightly shorter single-line directive that keeps all required constraints while foregrounding exact sentence count and source-supported relevance will improve compliance.", "hypothesis_source": "agent", "mutation_diff_summary": "", "score": 1.9, "score_ci_lower": 1.1, "score_ci_upper": 2.8, "raw_scores": [1.0, 1.0, 1.5, 3.5, 2.5], "baseline_score": 2.0, "outcome": "KEPT", "failure_mode": null, "duration_seconds": 13.020007875049487, "tags": ["concise", "single-directive", "faithfulness", "strict-format"], "learnings": "{\"what_changed\":\"\",\"what_improved\":[],\"what_regressed\":[],\"transferable_insight\":\"Making the most critical constraints explicit and prominent in a concise directive can improve adherence without needing additional detail.\",\"domain_tags\":[\"instruction-design\",\"communication\",\"compliance\"]}", "cost_usd": 0.021452350000000002, "bootstrap_seed": 0, "agent_model": "gpt-5.4", "held_out_score": null, "criterion_names": ["key_points_captured", "conciseness", "faithful_to_source", "few_shot_format"], "per_criterion_scores": {"key_points_captured": 0.9, "conciseness": 0.5, "faithful_to_source": 0.3, "few_shot_format": 0.2}, "failure_classification": null, "drafts_generated": 1, "drafts_survived": 1}
{"id": "d8862420-cf73-4fb6-b668-c26fd78b609d", "target_id": "B2-treatment", "git_sha": "63b472f2c5fb2fedc049a9d75cb0b820eb947d5b", "pre_experiment_sha": "7b1c2c4a889664e4e12b9e007904413b89c5d399", "timestamp": "2026-04-19T18:10:34.566786+00:00", "hypothesis": "A slightly cleaner single-sentence directive that foregrounds source-supported relevance and exact sentence-only output will improve binary-criteria compliance.", "hypothesis_source": "agent", "mutation_diff_summary": "", "score": 2.8, "score_ci_lower": 2.0, "score_ci_upper": 3.6, "raw_scores": [2.0, 1.5, 3.0, 4.0, 3.5], "baseline_score": 1.9, "outcome": "KEPT", "failure_mode": null, "duration_seconds": 15.820680083008483, "tags": ["concise", "single-directive", "faithfulness", "strict-format"], "learnings": "{\"what_changed\":\"\",\"what_improved\":[\"faithful_to_source: PASS (was FAIL)\"],\"what_regressed\":[],\"transferable_insight\":\"When a task explicitly prioritizes source-grounded relevance and constrains the response format, compliance with binary evaluation criteria improves.\",\"domain_tags\":[\"instruction_design\",\"evaluation\",\"prompting\"]}", "cost_usd": 0.02307535, "bootstrap_seed": 0, "agent_model": "gpt-5.4", "held_out_score": null, "criterion_names": ["key_points_captured", "conciseness", "faithful_to_source", "few_shot_format"], "per_criterion_scores": {"key_points_captured": 1.0, "conciseness": 0.6, "faithful_to_source": 0.8, "few_shot_format": 0.4}, "failure_classification": null, "drafts_generated": 1, "drafts_survived": 1}
{"id": "9aeff342-0493-4852-8356-4b3ab7cf7fb3", "target_id": "B2-treatment", "git_sha": "63b472f2c5fb2fedc049a9d75cb0b820eb947d5b", "pre_experiment_sha": "63b472f2c5fb2fedc049a9d75cb0b820eb947d5b", "timestamp": "2026-04-19T18:10:50.016900+00:00", "hypothesis": "A slightly more literal single-line directive that emphasizes exact sentence count, source support, and sentence-only output may improve binary-criteria adherence.", "hypothesis_source": "agent", "mutation_diff_summary": "", "score": 2.0, "score_ci_lower": 1.5, "score_ci_upper": 2.6, "raw_scores": [1.5, 1.5, 1.5, 2.5, 3.0], "baseline_score": 2.8, "outcome": "DISCARDED", "failure_mode": null, "duration_seconds": 14.316041041980498, "tags": ["concise", "single-directive", "faithfulness", "strict-format"], "learnings": "{\"what_changed\":\"\",\"what_improved\":[],\"what_regressed\":[\"conciseness: FAIL (was PASS)\"],\"transferable_insight\":\"Adding stricter wording can reduce compliance if it increases verbosity or introduces competing constraints, so directives should be as simple and unambiguous as possible.\",\"domain_tags\":[\"instruction-design\",\"communication\",\"evaluation\"]}", "cost_usd": 0.02262155, "bootstrap_seed": 0, "agent_model": "gpt-5.4", "held_out_score": null, "criterion_names": ["key_points_captured", "conciseness", "faithful_to_source", "few_shot_format"], "per_criterion_scores": {"key_points_captured": 1.0, "conciseness": 0.4, "faithful_to_source": 0.5, "few_shot_format": 0.1}, "failure_classification": {"category": "semantic_drift", "description": "The attempt did not fail due to parsing/structure, but instead indicates incorrect fulfillment of the intended evaluation criteria (binary-criteria adherence). The hypothesis was about emphasizing exact sentence count and sentence-only output, suggesting the response likely met the format superficially while not matching the required meaning/constraints precisely.", "fix_direction": "Tighten instruction interpretation by explicitly enforcing both constraints simultaneously (exact sentence count and strictly sentence-only output), then verify against the evaluation criteria before finalizing.", "confidence": 0.45}, "drafts_generated": 1, "drafts_survived": 1}
{"id": "9bd942aa-f327-4342-a0f0-01c991c17552", "target_id": "B2-treatment", "git_sha": "63b472f2c5fb2fedc049a9d75cb0b820eb947d5b", "pre_experiment_sha": "63b472f2c5fb2fedc049a9d75cb0b820eb947d5b", "timestamp": "2026-04-19T18:11:11.829707+00:00", "hypothesis": "A slightly simpler directive that foregrounds source-supported relevance and exact sentence-only output may reduce semantic drift while preserving all required constraints.", "hypothesis_source": "agent", "mutation_diff_summary": "", "score": 2.0, "score_ci_lower": 1.4, "score_ci_upper": 2.6, "raw_scores": [2.5, 1.5, 2.0, 3.0, 1.0], "baseline_score": 2.8, "outcome": "DISCARDED", "failure_mode": null, "duration_seconds": 17.80048595799599, "tags": ["concise", "single-directive", "faithfulness", "strict-format", "semantic-drift"], "learnings": "{\"what_changed\":\"\",\"what_improved\":[\"conciseness: PASS (was FAIL)\"],\"what_regressed\":[\"faithful_to_source: FAIL (was PASS)\"],\"transferable_insight\":\"Making instructions more concise can improve brevity, but if it weakens source-grounded constraints it may increase semantic drift and reduce fidelity.\",\"domain_tags\":[\"prompt-design\",\"instruction-following\",\"evaluation\"]}", "cost_usd": 0.02090775, "bootstrap_seed": 0, "agent_model": "gpt-5.4", "held_out_score": null, "criterion_names": ["key_points_captured", "conciseness", "faithful_to_source", "few_shot_format"], "per_criterion_scores": {"key_points_captured": 0.8, "conciseness": 0.7, "faithful_to_source": 0.4, "few_shot_format": 0.1}, "failure_classification": {"category": "semantic_drift", "description": "The experiment likely followed the required output constraints but produced meaning that diverged from the intended, source-supported directive, indicating semantic drift rather than a hard format or syntax failure.", "fix_direction": "Tighten semantic alignment to the source by requiring direct, sentence-only quoting/derivation and adding explicit checks that each sentence\u2019s meaning is supported by the provided material.", "confidence": 0.62}, "drafts_generated": 1, "drafts_survived": 1}
{"id": "6d9ee6fa-7636-41fb-9ed5-00b0db52cd8b", "target_id": "B2-treatment", "git_sha": "63b472f2c5fb2fedc049a9d75cb0b820eb947d5b", "pre_experiment_sha": "63b472f2c5fb2fedc049a9d75cb0b820eb947d5b", "timestamp": "2026-04-19T18:11:28.572729+00:00", "hypothesis": "A simpler single directive that foregrounds exact sentence count, source-supported facts, and sentence-only output will reduce drift while preserving required content.", "hypothesis_source": "agent", "mutation_diff_summary": "", "score": 2.2, "score_ci_lower": 1.5, "score_ci_upper": 2.9, "raw_scores": [2.5, 1.0, 3.5, 2.0, 2.0], "baseline_score": 2.8, "outcome": "DISCARDED", "failure_mode": null, "duration_seconds": 14.19574412505608, "tags": ["concise", "single-directive", "faithfulness", "strict-format", "semantic-drift"], "learnings": "{\"what_changed\":\"\",\"what_improved\":[\"faithful_to_source: PASS (was FAIL)\"],\"what_regressed\":[],\"transferable_insight\":\"Making output constraints explicit and minimal can improve fidelity to the source by reducing opportunities for the model to drift from required content.\",\"domain_tags\":[\"prompting\",\"instruction-following\",\"output-formatting\"]}", "cost_usd": 0.023135750000000004, "bootstrap_seed": 0, "agent_model": "gpt-5.4", "held_out_score": null, "criterion_names": ["key_points_captured", "conciseness", "faithful_to_source", "few_shot_format"], "per_criterion_scores": {"key_points_captured": 0.9, "conciseness": 0.7, "faithful_to_source": 0.5, "few_shot_format": 0.1}, "failure_classification": {"category": "semantic_drift", "description": "The experiment appears to have met the general formatting constraints enough to be evaluated, but it likely deviated in meaning/content from the requirements (drift), producing incorrect or unsupported factual/sentence content despite the intended simplifying directive.", "fix_direction": "Re-anchor generation to source-supported, sentence-only content and enforce exact sentence count with direct checks; add post-generation validation that verifies both sentence count and required fact inclusion.", "confidence": 0.58}, "drafts_generated": 1, "drafts_survived": 1}
