{"id": "b8c6bb11-5dee-4589-ab31-5a2c07534509", "target_id": "B2-treatment", "git_sha": "344f4129d4334116aa782f3814eb05105210e4a5", "pre_experiment_sha": "b4e85770d78729cf86475c790414b56441406f48", "timestamp": "2026-04-24T05:26:12.728404+00:00", "hypothesis": "Refine the system prompt to use purely positive, fluid instructions and combine sentences in the few-shot examples to demonstrate better synthesis and natural flow.", "hypothesis_source": "agent", "mutation_diff_summary": "", "score": 2.5, "score_ci_lower": 2.0, "score_ci_upper": 3.3, "raw_scores": [2.0, 2.5, 2.0, 2.0, 4.0], "baseline_score": 2.6, "outcome": "KEPT", "failure_mode": null, "duration_seconds": 67.3312899582088, "tags": ["positive-instructions", "fluid-synthesis", "formatting"], "learnings": "{\"what_changed\":\"\",\"what_improved\":[],\"what_regressed\":[],\"transferable_insight\":\"Framing instructions positively and demonstrating synthesized, fluid sentence structures in few-shot examples encourages more natural and cohesive model outputs.\",\"domain_tags\":[\"Prompt Engineering\",\"Few-Shot Prompting\",\"Output Style\"]}", "cost_usd": 0.0120632, "bootstrap_seed": 0, "agent_model": "gemini-3.1-pro-preview", "held_out_score": null, "criterion_names": ["key_points_captured", "conciseness", "faithful_to_source", "few_shot_format"], "per_criterion_scores": {"key_points_captured": 0.9, "conciseness": 0.9, "faithful_to_source": 0.4, "few_shot_format": 0.3}, "failure_classification": null, "drafts_generated": 1, "drafts_survived": 1}
{"id": "160d7cee-4925-4e79-b5f9-d7c5642aee97", "target_id": "B2-treatment", "git_sha": "5daf0b02c2d7d2efe19e2ecb052f55d3f2ca361b", "pre_experiment_sha": "344f4129d4334116aa782f3814eb05105210e4a5", "timestamp": "2026-04-24T05:27:14.976191+00:00", "hypothesis": "Refine the few-shot examples to improve fluid synthesis and readability by breaking up overly long sentences into more natural, cohesive phrasing while maintaining purely positive instructions for a single-paragraph output.", "hypothesis_source": "agent", "mutation_diff_summary": "", "score": 2.8, "score_ci_lower": 2.1, "score_ci_upper": 3.5, "raw_scores": [2.0, 2.5, 4.0, 2.0, 3.5], "baseline_score": 2.5, "outcome": "KEPT", "failure_mode": null, "duration_seconds": 57.173015708103776, "tags": ["few-shot", "positive-instruction", "formatting", "fluid-synthesis"], "learnings": "{\"what_changed\":\"\",\"what_improved\":[],\"what_regressed\":[],\"transferable_insight\":\"Refining few-shot examples to feature shorter, cohesive sentences alongside purely positive instructions significantly improves the readability and natural flow of the model's generated text.\",\"domain_tags\":[\"Few-Shot Prompting\",\"Text Generation\",\"Prompt Engineering\"]}", "cost_usd": 0.01152445, "bootstrap_seed": 0, "agent_model": "gemini-3.1-pro-preview", "held_out_score": null, "criterion_names": ["key_points_captured", "conciseness", "faithful_to_source", "few_shot_format"], "per_criterion_scores": {"key_points_captured": 1.0, "conciseness": 1.0, "faithful_to_source": 0.5, "few_shot_format": 0.3}, "failure_classification": null, "drafts_generated": 1, "drafts_survived": 1}
{"id": "76649e31-19c2-4ae3-a06a-54d8f2b5192b", "target_id": "B2-treatment", "git_sha": "ffc60f0c9259e872cff2d7e596ff9525c2ebf3ad", "pre_experiment_sha": "5daf0b02c2d7d2efe19e2ecb052f55d3f2ca361b", "timestamp": "2026-04-24T05:28:37.428299+00:00", "hypothesis": "Refine the few-shot examples to break up overly long sentences into more natural, cohesive phrasing, enhancing readability and demonstrating fluid synthesis without adding negative constraints or dense formatting requirements.", "hypothesis_source": "agent", "mutation_diff_summary": "", "score": 2.6, "score_ci_lower": 2.3, "score_ci_upper": 2.9, "raw_scores": [3.0, 2.5, 2.5, 2.0, 3.0], "baseline_score": 2.8, "outcome": "KEPT", "failure_mode": null, "duration_seconds": 64.20856141694821, "tags": ["readability", "few-shot-refinement", "positive-instructions"], "learnings": "{\"what_changed\":\"\",\"what_improved\":[],\"what_regressed\":[],\"transferable_insight\":\"Optimizing few-shot examples for natural phrasing and shorter sentence structures enhances the readability and fluidity of the model's generated outputs.\",\"domain_tags\":[\"Few-Shot Prompting\",\"Readability\",\"Text Generation\"]}", "cost_usd": 0.01110405, "bootstrap_seed": 0, "agent_model": "gemini-3.1-pro-preview", "held_out_score": null, "criterion_names": ["key_points_captured", "conciseness", "faithful_to_source", "few_shot_format"], "per_criterion_scores": {"key_points_captured": 1.0, "conciseness": 1.0, "faithful_to_source": 0.6, "few_shot_format": 0.0}, "failure_classification": null, "drafts_generated": 1, "drafts_survived": 1}
{"id": "234d6c62-898d-4501-8e1d-f19fbbf57867", "target_id": "B2-treatment", "git_sha": "c271e228ac183232d9e80b95303c74c66b17856b", "pre_experiment_sha": "ffc60f0c9259e872cff2d7e596ff9525c2ebf3ad", "timestamp": "2026-04-24T05:29:56.183798+00:00", "hypothesis": "Refine the few-shot examples to improve readability and fluid synthesis by breaking up overly dense sentences, and streamline the system prompt to use purely positive instructions.", "hypothesis_source": "agent", "mutation_diff_summary": "", "score": 2.9, "score_ci_lower": 2.1, "score_ci_upper": 3.7, "raw_scores": [4.0, 2.5, 2.0, 2.0, 4.0], "baseline_score": 2.6, "outcome": "KEPT", "failure_mode": null, "duration_seconds": 71.81774604110979, "tags": ["readability", "fluid-synthesis", "positive-instructions", "formatting"], "learnings": "{\"what_changed\":\"\",\"what_improved\":[],\"what_regressed\":[],\"transferable_insight\":\"Simplifying few-shot examples by breaking up dense sentences and framing system instructions purely positively enhances the model's ability to generate fluid and readable outputs.\",\"domain_tags\":[\"Prompt Engineering\",\"Few-Shot Prompting\",\"Instruction Framing\"]}", "cost_usd": 0.013179449999999999, "bootstrap_seed": 0, "agent_model": "gemini-3.1-pro-preview", "held_out_score": null, "criterion_names": ["key_points_captured", "conciseness", "faithful_to_source", "few_shot_format"], "per_criterion_scores": {"key_points_captured": 1.0, "conciseness": 1.0, "faithful_to_source": 0.5, "few_shot_format": 0.4}, "failure_classification": null, "drafts_generated": 1, "drafts_survived": 1}
{"id": "38ee4eac-00a6-4f74-92da-178d3d6a5578", "target_id": "B2-treatment", "git_sha": "8d4639681873fc1b5c936c8497cb08d79fd0b9bd", "pre_experiment_sha": "c271e228ac183232d9e80b95303c74c66b17856b", "timestamp": "2026-04-24T05:30:51.401096+00:00", "hypothesis": "Refine few-shot examples to improve readability by breaking up overly long sentences into more natural, fluid phrasing, while maintaining the purely positive instruction set and simple formatting constraints.", "hypothesis_source": "agent", "mutation_diff_summary": "", "score": 3.1, "score_ci_lower": 2.5, "score_ci_upper": 3.7, "raw_scores": [2.0, 3.5, 4.0, 3.0, 3.0], "baseline_score": 2.9, "outcome": "KEPT", "failure_mode": null, "duration_seconds": 49.03915574983694, "tags": ["readability", "fluid-synthesis", "positive-instructions"], "learnings": "{\"what_changed\":\"\",\"what_improved\":[],\"what_regressed\":[],\"transferable_insight\":\"Enhancing the readability of few-shot examples by breaking overly long sentences into more natural, fluid phrasing improves model performance.\",\"domain_tags\":[\"Few-Shot Prompting\",\"Readability\",\"Prompt Engineering\"]}", "cost_usd": 0.012510400000000001, "bootstrap_seed": 0, "agent_model": "gemini-3.1-pro-preview", "held_out_score": null, "criterion_names": ["key_points_captured", "conciseness", "faithful_to_source", "few_shot_format"], "per_criterion_scores": {"key_points_captured": 1.0, "conciseness": 1.0, "faithful_to_source": 0.8, "few_shot_format": 0.3}, "failure_classification": null, "drafts_generated": 1, "drafts_survived": 1}
{"id": "841a0758-03df-414c-8a6a-e8040764211b", "target_id": "B2-treatment", "git_sha": "6cd56dcb17097cce24ec727aaedb68ac8907c8d3", "pre_experiment_sha": "8d4639681873fc1b5c936c8497cb08d79fd0b9bd", "timestamp": "2026-04-24T05:32:15.693376+00:00", "hypothesis": "Refine the few-shot examples to improve readability and fluidity by replacing rigid, choppy sentences with more natural phrasing, while adhering strictly to positive instructions and a simple, single-paragraph format.", "hypothesis_source": "agent", "mutation_diff_summary": "", "score": 3.3, "score_ci_lower": 2.8, "score_ci_upper": 3.8, "raw_scores": [3.0, 3.0, 4.0, 2.5, 4.0], "baseline_score": 3.1, "outcome": "KEPT", "failure_mode": null, "duration_seconds": 69.47235458297655, "tags": ["few-shot", "examples", "readability", "positive-instructions"], "learnings": "{\"what_changed\":\"\",\"what_improved\":[],\"what_regressed\":[],\"transferable_insight\":\"Enhancing the natural phrasing and fluidity of few-shot examples, while strictly maintaining structural constraints like single-paragraph formats and positive instructions, improves the overall quality and readability of the model's output.\",\"domain_tags\":[\"few-shot prompting\",\"readability\",\"output formatting\"]}", "cost_usd": 0.01286685, "bootstrap_seed": 0, "agent_model": "gemini-3.1-pro-preview", "held_out_score": null, "criterion_names": ["key_points_captured", "conciseness", "faithful_to_source", "few_shot_format"], "per_criterion_scores": {"key_points_captured": 1.0, "conciseness": 1.0, "faithful_to_source": 0.8, "few_shot_format": 0.5}, "failure_classification": null, "drafts_generated": 1, "drafts_survived": 1}
{"id": "ec94313d-3d06-49d1-8738-b45689526b75", "target_id": "B2-treatment", "git_sha": "6cd56dcb17097cce24ec727aaedb68ac8907c8d3", "pre_experiment_sha": "6cd56dcb17097cce24ec727aaedb68ac8907c8d3", "timestamp": "2026-04-24T05:33:48.346957+00:00", "hypothesis": "Refine the few-shot examples to improve readability by breaking up dense participial phrases into natural, cohesive, and fluid sentences, while maintaining purely positive instructions and a safe, single-paragraph format.", "hypothesis_source": "agent", "mutation_diff_summary": "", "score": 2.5, "score_ci_lower": 2.0, "score_ci_upper": 3.1, "raw_scores": [2.0, 3.0, 3.5, 2.0, 2.0], "baseline_score": 3.3, "outcome": "DISCARDED", "failure_mode": null, "duration_seconds": 86.48103766702116, "tags": ["readability", "fluid-synthesis", "positive-framing", "formatting"], "learnings": "{\"what_changed\":\"\",\"what_improved\":[],\"what_regressed\":[],\"transferable_insight\":\"Prioritizing natural readability by breaking up dense sentence structures in few-shot examples can degrade performance, indicating that models often rely on the specific structural density of examples to infer the target output style.\",\"domain_tags\":[\"Few-Shot Prompting\",\"Prompt Engineering\",\"Text Formatting\"]}", "cost_usd": 0.01173355, "bootstrap_seed": 0, "agent_model": "gemini-3.1-pro-preview", "held_out_score": null, "criterion_names": ["key_points_captured", "conciseness", "faithful_to_source", "few_shot_format"], "per_criterion_scores": {"key_points_captured": 1.0, "conciseness": 0.9, "faithful_to_source": 0.4, "few_shot_format": 0.2}, "failure_classification": {"category": "semantic_drift", "description": "The experiment failed to maintain the original meaning or intent of the few-shot examples and their instructions during the refinement process. While attempting to break up participial phrases, the resulting sentences may have become unnatural, less cohesive, or lost fluidity, and critically, the instructions might have deviated from being 'purely positive,' leading to a significant degradation in the quality and effectiveness of the examples, hence the low score.", "fix_direction": "Focus on robust semantic preservation during rephrasing. Implement strict checks for meaning equivalence before and after refinement. For 'purely positive instructions,' include explicit examples of desired positive phrasing and undesirable negative phrasing, potentially utilizing constraint-based decoding or negative prompting to prevent tone shifts. Prioritize maintaining the core message and tone even over stylistic changes if necessary.", "confidence": 0.85}, "drafts_generated": 1, "drafts_survived": 1}
{"id": "f0bbf7ac-8f06-4e2c-9f53-e5a5e359c0a3", "target_id": "B2-treatment", "git_sha": "6cd56dcb17097cce24ec727aaedb68ac8907c8d3", "pre_experiment_sha": "6cd56dcb17097cce24ec727aaedb68ac8907c8d3", "timestamp": "2026-04-24T05:35:30.129964+00:00", "hypothesis": "Refine the few-shot examples and prompt to emphasize fluid synthesis and natural phrasing, avoiding overly dense sentences while maintaining purely positive instructions for clear, accurate core message capture.", "hypothesis_source": "agent", "mutation_diff_summary": "", "score": 2.6, "score_ci_lower": 2.2, "score_ci_upper": 3.0, "raw_scores": [3.0, 3.0, 2.0, 3.0, 2.0], "baseline_score": 3.3, "outcome": "DISCARDED", "failure_mode": null, "duration_seconds": 74.52468258305453, "tags": ["prompt-engineering", "few-shot-examples", "positive-framing", "readability-improvement"], "learnings": "{\"what_changed\":\"\",\"what_improved\":[],\"what_regressed\":[],\"transferable_insight\":\"Restricting guidelines to purely positive instructions can degrade performance when trying to prevent specific undesirable behaviors, indicating that explicit negative constraints are often necessary for precise output control.\",\"domain_tags\":[\"Prompt Engineering\",\"Instruction Design\",\"Few-Shot Learning\"]}", "cost_usd": 0.012495649999999999, "bootstrap_seed": 0, "agent_model": "gemini-3.1-pro-preview", "held_out_score": null, "criterion_names": ["key_points_captured", "conciseness", "faithful_to_source", "few_shot_format"], "per_criterion_scores": {"key_points_captured": 1.0, "conciseness": 1.0, "faithful_to_source": 0.4, "few_shot_format": 0.2}, "failure_classification": {"category": "semantic_drift", "description": "The experiment aimed to improve phrasing and fluidity for clearer message capture. The very low score suggests that while attempting to refine style (fluid synthesis, natural phrasing, avoiding dense sentences), the core message was either inaccurately captured, misinterpreted, or lost precision, leading to a significant drift from the intended meaning.", "fix_direction": "Re-evaluate the prompt and few-shot examples to prioritize core message accuracy and semantic faithfulness *alongside* stylistic improvements. Introduce clearer constraints or examples that demonstrate how to achieve fluid phrasing without compromising the precise meaning or introducing ambiguity. Consider explicitly instructing the model to maintain all critical information while rephrasing for clarity.", "confidence": 0.9}, "drafts_generated": 1, "drafts_survived": 1}
{"id": "064a1535-a289-4a7f-9828-9c391ab4efa4", "target_id": "B2-treatment", "git_sha": "6cd56dcb17097cce24ec727aaedb68ac8907c8d3", "pre_experiment_sha": "6cd56dcb17097cce24ec727aaedb68ac8907c8d3", "timestamp": "2026-04-24T05:37:09.750549+00:00", "hypothesis": "Refine the few-shot examples to replace rigid, choppy sentences with more natural, cohesive phrasing, improving readability and fluidity without introducing negative constraints.", "hypothesis_source": "agent", "mutation_diff_summary": "", "score": 2.3, "score_ci_lower": 2.0, "score_ci_upper": 2.9, "raw_scores": [3.5, 2.0, 2.0, 2.0, 2.0], "baseline_score": 3.3, "outcome": "DISCARDED", "failure_mode": null, "duration_seconds": 67.55880287499167, "tags": ["fluidity", "natural-phrasing", "positive-instructions"], "learnings": "{\"what_changed\":\"\",\"what_improved\":[],\"what_regressed\":[],\"transferable_insight\":\"Prioritizing natural, fluid phrasing over rigid, structured sentences in few-shot examples can degrade performance, as models often rely on explicit, predictable patterns rather than conversational cohesion.\",\"domain_tags\":[\"Prompt Engineering\",\"Few-Shot Prompting\",\"In-Context Learning\"]}", "cost_usd": 0.011425200000000002, "bootstrap_seed": 0, "agent_model": "gemini-3.1-pro-preview", "held_out_score": null, "criterion_names": ["key_points_captured", "conciseness", "faithful_to_source", "few_shot_format"], "per_criterion_scores": {"key_points_captured": 1.0, "conciseness": 1.0, "faithful_to_source": 0.2, "few_shot_format": 0.1}, "failure_classification": {"category": "semantic_drift", "description": "The attempt to make few-shot examples more natural and cohesive, while aiming for improved readability, likely resulted in unintended changes to the original meaning, introduced ambiguity, or lost critical information. The severe low score (2.3) suggests that the new phrasing failed to accurately preserve the intended semantics, negatively impacting the content's quality and utility.", "fix_direction": "Implement stricter checks for meaning preservation when refining phrasing. This could involve side-by-side human evaluation for semantic equivalence, or employing specific metrics/tests to ensure the core information and intent are not altered. Focus on incremental changes with explicit semantic guardrails rather than broad stylistic overhauls. Emphasize that 'naturalness' must not compromise precision or accuracy.", "confidence": 0.9}, "drafts_generated": 1, "drafts_survived": 1}
{"id": "e41de674-0f50-45fc-b64f-33a7ad23a93b", "target_id": "B2-treatment", "git_sha": "1134fbbbafc1b79c1784ba81169a6b04a044f973", "pre_experiment_sha": "6cd56dcb17097cce24ec727aaedb68ac8907c8d3", "timestamp": "2026-04-24T05:38:20.754155+00:00", "hypothesis": "Refine the few-shot examples to improve readability and fluidity by replacing rigid, choppy sentences with more natural, cohesive phrasing, while maintaining purely positive instructions and a simple, streamlined prompt.", "hypothesis_source": "agent", "mutation_diff_summary": "", "score": 2.8, "score_ci_lower": 2.3, "score_ci_upper": 3.2, "raw_scores": [3.0, 2.5, 3.5, 2.0, 3.0], "baseline_score": 3.3, "outcome": "KEPT", "failure_mode": null, "duration_seconds": 51.718762916047126, "tags": ["few-shot-examples", "fluidity", "positive-framing", "natural-phrasing"], "learnings": "{\"what_changed\":\"\",\"what_improved\":[],\"what_regressed\":[],\"transferable_insight\":\"Providing natural, cohesive examples and framing instructions in a purely positive manner improves the quality and fluidity of the desired output.\",\"domain_tags\":[\"Few-Shot Prompting\",\"Prompt Engineering\",\"Instruction Framing\"]}", "cost_usd": 0.0117924, "bootstrap_seed": 0, "agent_model": "gemini-3.1-pro-preview", "held_out_score": null, "criterion_names": ["key_points_captured", "conciseness", "faithful_to_source", "few_shot_format"], "per_criterion_scores": {"key_points_captured": 1.0, "conciseness": 1.0, "faithful_to_source": 0.7, "few_shot_format": 0.1}, "failure_classification": null, "drafts_generated": 1, "drafts_survived": 1}
{"id": "6b8a15a1-0842-46ce-a555-f3e0edc4dfd8", "target_id": "B2-treatment", "git_sha": "1134fbbbafc1b79c1784ba81169a6b04a044f973", "pre_experiment_sha": "1134fbbbafc1b79c1784ba81169a6b04a044f973", "timestamp": "2026-04-24T05:39:35.800978+00:00", "hypothesis": "Refine the few-shot examples by breaking up overly long sentences into natural, fluid phrasing to improve readability and cohesiveness.", "hypothesis_source": "agent", "mutation_diff_summary": "", "score": 2.4, "score_ci_lower": 2.1, "score_ci_upper": 2.7, "raw_scores": [2.0, 2.5, 3.0, 2.0, 2.5], "baseline_score": 2.8, "outcome": "DISCARDED", "failure_mode": null, "duration_seconds": 66.85909624979831, "tags": ["natural_phrasing", "fluidity", "positive_instructions"], "learnings": "{\"what_changed\":\"\",\"what_improved\":[],\"what_regressed\":[],\"transferable_insight\":\"Prioritizing human readability by artificially breaking up long sentences in few-shot examples can degrade model performance, suggesting that models may rely on the original structural complexity to accurately infer task patterns.\",\"domain_tags\":[\"Prompt Engineering\",\"Few-Shot Learning\",\"Text Formatting\"]}", "cost_usd": 0.0109, "bootstrap_seed": 0, "agent_model": "gemini-3.1-pro-preview", "held_out_score": null, "criterion_names": ["key_points_captured", "conciseness", "faithful_to_source", "few_shot_format"], "per_criterion_scores": {"key_points_captured": 1.0, "conciseness": 1.0, "faithful_to_source": 0.3, "few_shot_format": 0.1}, "failure_classification": {"category": "semantic_drift", "description": "The refinement of few-shot examples by breaking up sentences, while intended to improve human readability and cohesiveness, likely altered the semantic information or instructional value for the language model. The new phrasing may have inadvertently removed crucial context, changed subtle relationships between parts of the sentence, or made the examples less representative of the desired input/output patterns, leading to a significant drop in model performance (score 2.4). The examples maintained a 'correct format' (sentences) but conveyed an 'incorrect meaning' or utility to the model.", "fix_direction": "Re-evaluate the impact of 'readability' changes on the model's interpretation of few-shot examples. Instead of solely focusing on human-centric readability, analyze what semantic units or contextual information might have been lost when sentences were broken up. Experiment with strategies that preserve information density or the original semantic relationships while still aiming for clarity. Consider using tools to measure semantic similarity or information content between original and refined examples to avoid inadvertently changing their instructional value for the model.", "confidence": 0.9}, "drafts_generated": 1, "drafts_survived": 1}
