{"id": "4179578a-88f9-4f8d-a68b-ad537a682abe", "target_id": "B2-treatment", "git_sha": "25b94eff649e60f0473ad1aeaa85f115073ea179", "pre_experiment_sha": "25b94eff649e60f0473ad1aeaa85f115073ea179", "timestamp": "2026-04-19T08:25:30.155887+00:00", "hypothesis": "Simplifying to the original binary labels with one concrete-detail sufficiency rule will improve consistency.", "hypothesis_source": "agent", "mutation_diff_summary": "", "score": 1.8, "score_ci_lower": 1.1, "score_ci_upper": 2.5, "raw_scores": [1.0, 2.5, 1.0, 1.5, 3.0], "baseline_score": 3.4, "outcome": "DISCARDED", "failure_mode": null, "duration_seconds": 15.0960719169816, "tags": ["binary-classification", "short-prompt", "strict-format", "few-shot"], "learnings": "{\"what_changed\":\"\",\"what_improved\":[],\"what_regressed\":[],\"transferable_insight\":\"Reducing a task to simpler labels or rules does not improve consistency unless the simplification preserves enough discriminative detail to support reliable decisions.\",\"domain_tags\":[\"decision-making\",\"classification\",\"process-design\"]}", "cost_usd": 0.014067350000000003, "bootstrap_seed": 0, "agent_model": "gpt-5.4", "held_out_score": null, "criterion_names": ["key_points_captured", "conciseness", "faithful_to_source", "few_shot_format"], "per_criterion_scores": {"key_points_captured": 1.0, "conciseness": 0.3, "faithful_to_source": 0.4, "few_shot_format": 0.1}, "failure_classification": {"category": "incomplete_edit", "description": "The run failed despite an intended simplification, suggesting the change was only partially applied or left the system in an inconsistent state relative to the expected binary-label-with-rule formulation. The very low score (1.8) aligns with an unfinished or internally inconsistent edit rather than a pure reasoning error.", "fix_direction": "Ensure the simplification is applied end-to-end: update both the label mapping and the concrete-detail sufficiency rule consistently across all relevant steps, outputs, and templates (no partial rewrites).", "confidence": 0.55}, "drafts_generated": 1, "drafts_survived": 1}
{"id": "a6728c16-9445-463f-a2b1-b0189bc5fa4e", "target_id": "B2-treatment", "git_sha": "25b94eff649e60f0473ad1aeaa85f115073ea179", "pre_experiment_sha": "25b94eff649e60f0473ad1aeaa85f115073ea179", "timestamp": "2026-04-19T08:25:56.531907+00:00", "hypothesis": "Shortening the prompt to a single explicit sufficiency rule with balanced label-only examples will improve binary consistency.", "hypothesis_source": "agent", "mutation_diff_summary": "", "score": 1.6, "score_ci_lower": 0.7, "score_ci_upper": 2.7, "raw_scores": [1.0, 1.5, 0.0, 2.0, 3.5], "baseline_score": 3.4, "outcome": "DISCARDED", "failure_mode": null, "duration_seconds": 21.827564875013195, "tags": ["binary-classification", "short-prompt", "few-shot", "label-only"], "learnings": "{\"what_changed\":\"\",\"what_improved\":[],\"what_regressed\":[],\"transferable_insight\":\"A simpler rule can still fail to improve consistency if it removes too much contextual guidance, so brevity should be balanced against the need for enough structure to anchor decisions.\",\"domain_tags\":[\"prompt-design\",\"decision-making\",\"evaluation\"]}", "cost_usd": 0.01508255, "bootstrap_seed": 0, "agent_model": "gpt-5.4", "held_out_score": null, "criterion_names": ["key_points_captured", "conciseness", "faithful_to_source", "few_shot_format"], "per_criterion_scores": {"key_points_captured": 0.8, "conciseness": 0.1, "faithful_to_source": 0.5, "few_shot_format": 0.2}, "failure_classification": {"category": "semantic_drift", "description": "The attempt to shorten the prompt and use balanced label-only examples did not achieve the intended binary consistency; the low score suggests the guidance did not preserve the original meaning/decision criterion reliably, leading to incorrect outputs despite maintaining the general intent.", "fix_direction": "Iterate on prompt wording to preserve the exact sufficiency rule semantics (e.g., tighten definitions, add a minimal but explicit decision procedure), and validate with a targeted confusion-matrix style check for both label directions to ensure consistent interpretation.", "confidence": 0.42}, "drafts_generated": 1, "drafts_survived": 1}
{"id": "7d50ab1d-5240-4abc-a63d-dcf9b570eb8d", "target_id": "B2-treatment", "git_sha": "25b94eff649e60f0473ad1aeaa85f115073ea179", "pre_experiment_sha": "25b94eff649e60f0473ad1aeaa85f115073ea179", "timestamp": "2026-04-19T08:26:14.324708+00:00", "hypothesis": "Shortening the prompt to a single concrete sufficiency rule with balanced label-only examples will improve binary label consistency.", "hypothesis_source": "agent", "mutation_diff_summary": "", "score": 1.5, "score_ci_lower": 1.2, "score_ci_upper": 1.8, "raw_scores": [1.5, 2.0, 1.5, 1.5, 1.0], "baseline_score": 3.4, "outcome": "DISCARDED", "failure_mode": null, "duration_seconds": 15.33081037492957, "tags": ["binary-classification", "concise", "label-only", "few-shot"], "learnings": "{\"what_changed\":\"\",\"what_improved\":[],\"what_regressed\":[],\"transferable_insight\":\"Reducing instructions to one concrete rule can improve consistency only when the rule fully captures the decision boundary; otherwise, oversimplification may fail to change outcomes.\",\"domain_tags\":[\"prompt-design\",\"classification\",\"evaluation\"]}", "cost_usd": 0.01482695, "bootstrap_seed": 0, "agent_model": "gpt-5.4", "held_out_score": null, "criterion_names": ["key_points_captured", "conciseness", "faithful_to_source", "few_shot_format"], "per_criterion_scores": {"key_points_captured": 0.7, "conciseness": 0.4, "faithful_to_source": 0.2, "few_shot_format": 0.2}, "failure_classification": {"category": "incomplete_edit", "description": "The experiment appears to have failed without a specified failure mode, suggesting the change to the prompt/rule may have been partially applied\u2014e.g., the prompt was shortened but not consistently updated to ensure balanced, label-only examples or fully enforced binary label consistency across the evaluation. The low score (1.5) with no clear parse/format issue points to an incomplete or inconsistent edit rather than a direct syntax/format error.", "fix_direction": "Ensure the prompt update is fully and consistently applied end-to-end: shorten to a single concrete sufficiency rule, provide balanced label-only examples for both labels, and verify the evaluation pipeline receives the new prompt without missing sections or partial substitutions.", "confidence": 0.42}, "drafts_generated": 1, "drafts_survived": 1}
{"id": "f9fd8c35-74b7-4b5f-9338-77b1b9090f19", "target_id": "B2-treatment", "git_sha": "25b94eff649e60f0473ad1aeaa85f115073ea179", "pre_experiment_sha": "25b94eff649e60f0473ad1aeaa85f115073ea179", "timestamp": "2026-04-19T08:26:33.486147+00:00", "hypothesis": "A shorter prompt with one explicit sufficiency rule and balanced label-only examples will improve binary consistency.", "hypothesis_source": "agent", "mutation_diff_summary": "", "score": 1.4, "score_ci_lower": 0.9, "score_ci_upper": 1.8, "raw_scores": [1.5, 2.0, 1.5, 1.5, 0.5], "baseline_score": 3.4, "outcome": "DISCARDED", "failure_mode": null, "duration_seconds": 16.59324979200028, "tags": ["binary-classifier", "short-prompt", "balanced-few-shot"], "learnings": "{\"what_changed\":\"\",\"what_improved\":[],\"what_regressed\":[],\"transferable_insight\":\"When a simplification changes both the decision rule and the example balance, it can reduce consistency rather than improve it, so isolate one variable at a time.\",\"domain_tags\":[\"prompt-design\",\"experimental-methods\",\"decision-making\"]}", "cost_usd": 0.01378575, "bootstrap_seed": 0, "agent_model": "gpt-5.4", "held_out_score": null, "criterion_names": ["key_points_captured", "conciseness", "faithful_to_source", "few_shot_format"], "per_criterion_scores": {"key_points_captured": 0.7, "conciseness": 0.3, "faithful_to_source": 0.4, "few_shot_format": 0.0}, "failure_classification": {"category": "semantic_drift", "description": "The experiment was intended to improve binary consistency, but the result score is low and the failure mode is unknown, suggesting the output likely matched the expected structure while not achieving the intended meaning/behavior (i.e., consistency/guideline adherence did not improve or regressed in substance).", "fix_direction": "Focus on verifying that the prompt\u2019s sufficiency rule and label-only examples directly drive the intended decision policy; add explicit checks/fixtures for the expected label selection behavior across edge cases rather than relying on superficial prompt shortening.", "confidence": 0.42}, "drafts_generated": 1, "drafts_survived": 1}
{"id": "5a77d94d-e6ef-47c4-9d39-112095f35932", "target_id": "B2-treatment", "git_sha": "25b94eff649e60f0473ad1aeaa85f115073ea179", "pre_experiment_sha": "25b94eff649e60f0473ad1aeaa85f115073ea179", "timestamp": "2026-04-19T08:26:52.971706+00:00", "hypothesis": "A shorter prompt with one explicit sufficiency rule and balanced label-only examples will improve binary consistency.", "hypothesis_source": "agent", "mutation_diff_summary": "", "score": 1.8, "score_ci_lower": 1.2, "score_ci_upper": 2.4, "raw_scores": [1.0, 2.0, 3.0, 2.0, 1.0], "baseline_score": 3.4, "outcome": "DISCARDED", "failure_mode": null, "duration_seconds": 14.850699083996005, "tags": ["binary-classification", "short-prompt", "few-shot"], "learnings": "{\"what_changed\":\"\",\"what_improved\":[],\"what_regressed\":[],\"transferable_insight\":\"When a prompt change does not improve outcomes, prefer preserving the existing instruction structure rather than simplifying it further, since brevity alone does not guarantee more consistent decisions.\",\"domain_tags\":[\"prompt-engineering\",\"decision-making\",\"evaluation\"]}", "cost_usd": 0.014100350000000001, "bootstrap_seed": 0, "agent_model": "gpt-5.4", "held_out_score": null, "criterion_names": ["key_points_captured", "conciseness", "faithful_to_source", "few_shot_format"], "per_criterion_scores": {"key_points_captured": 0.9, "conciseness": 0.6, "faithful_to_source": 0.3, "few_shot_format": 0.0}, "failure_classification": {"category": "semantic_drift", "description": "The prompt changes did not achieve the intended improvement in binary consistency; the failure suggests the model\u2019s behavior drifted from the desired rule-following effect rather than causing formatting/syntax issues.", "fix_direction": "Keep the prompt short but ensure the single sufficiency rule is unambiguous and consistently enforced; verify label-only examples are balanced and explicitly map to the rule to prevent meaning drift.", "confidence": 0.62}, "drafts_generated": 1, "drafts_survived": 1}
{"id": "6030e9fe-fda8-4d7e-a5e9-dd4b41e84011", "target_id": "B2-treatment", "git_sha": "25b94eff649e60f0473ad1aeaa85f115073ea179", "pre_experiment_sha": "25b94eff649e60f0473ad1aeaa85f115073ea179", "timestamp": "2026-04-19T08:27:10.996977+00:00", "hypothesis": "A shorter prompt with one explicit sufficiency rule and minimal balanced examples will improve consistent binary labeling.", "hypothesis_source": "agent", "mutation_diff_summary": "", "score": 1.3, "score_ci_lower": 1.1, "score_ci_upper": 1.5, "raw_scores": [1.0, 1.0, 1.5, 1.5, 1.5], "baseline_score": 3.4, "outcome": "DISCARDED", "failure_mode": null, "duration_seconds": 14.587020709062926, "tags": ["binary-classification", "concise", "rule-based", "few-shot"], "learnings": "{\"what_changed\":\"\",\"what_improved\":[],\"what_regressed\":[],\"transferable_insight\":\"When a task requires consistent binary decisions, overly terse instructions can reduce reliability unless the decision rule is made unambiguous and sufficiently grounded by examples.\",\"domain_tags\":[\"prompt-design\",\"decision-making\",\"classification\"]}", "cost_usd": 0.010928750000000001, "bootstrap_seed": 0, "agent_model": "gpt-5.4", "held_out_score": null, "criterion_names": ["key_points_captured", "conciseness", "faithful_to_source", "few_shot_format"], "per_criterion_scores": {"key_points_captured": 1.0, "conciseness": 0.3, "faithful_to_source": 0.0, "few_shot_format": 0.0}, "failure_classification": {"category": "semantic_drift", "description": "The experiment did not achieve the intended effect of improved consistent binary labeling; despite changes to the prompt structure, the model\u2019s behavior likely shifted away from the intended meaning/rules for labeling rather than merely formatting or syntax issues.", "fix_direction": "Refine the explicit sufficiency rule language and ensure the balanced examples directly reinforce the exact decision boundary; then validate with a targeted test set focused on the previously inconsistent cases.", "confidence": 0.62}, "drafts_generated": 1, "drafts_survived": 1}
{"id": "9cc252ad-163a-471d-a129-feedd173a7fa", "target_id": "B2-treatment", "git_sha": "25b94eff649e60f0473ad1aeaa85f115073ea179", "pre_experiment_sha": "25b94eff649e60f0473ad1aeaa85f115073ea179", "timestamp": "2026-04-19T08:27:28.634907+00:00", "hypothesis": "A shorter prompt with a single concrete sufficiency rule and label-only outputs will improve binary consistency.", "hypothesis_source": "agent", "mutation_diff_summary": "", "score": 1.4, "score_ci_lower": 1.1, "score_ci_upper": 1.7, "raw_scores": [2.0, 1.0, 1.5, 1.5, 1.0], "baseline_score": 3.4, "outcome": "DISCARDED", "failure_mode": null, "duration_seconds": 14.010696375044063, "tags": ["short", "binary-classification", "strict-format"], "learnings": "{\"what_changed\":\"\",\"what_improved\":[],\"what_regressed\":[],\"transferable_insight\":\"When a simplification yields no measurable gains, keep the original guidance rather than assuming brevity alone improves consistency.\",\"domain_tags\":[\"prompt-design\",\"evaluation\",\"decision-making\"]}", "cost_usd": 0.013362550000000003, "bootstrap_seed": 0, "agent_model": "gpt-5.4", "held_out_score": null, "criterion_names": ["key_points_captured", "conciseness", "faithful_to_source", "few_shot_format"], "per_criterion_scores": {"key_points_captured": 0.8, "conciseness": 0.3, "faithful_to_source": 0.3, "few_shot_format": 0.0}, "failure_classification": {"category": "semantic_drift", "description": "The attempt did not improve binary consistency as intended, and the outcome indicates the model likely produced outputs that remained in the correct overall structure but did not follow the intended single concrete sufficiency rule, resulting in inconsistent or mismatched label behavior.", "fix_direction": "Strengthen the prompt so the single sufficiency rule is unambiguous and consistently applied; add explicit decision criteria and tighten label-only instruction handling to ensure the rule\u2014not a broader/changed interpretation\u2014drives the output.", "confidence": 0.62}, "drafts_generated": 1, "drafts_survived": 1}
{"id": "f27be266-acd0-48f8-b919-4267cc0978da", "target_id": "B2-treatment", "git_sha": "0ba3c6cf08b372695112fb89e607fa1a8a04b23e", "pre_experiment_sha": "25b94eff649e60f0473ad1aeaa85f115073ea179", "timestamp": "2026-04-19T08:27:49.531096+00:00", "hypothesis": "Shortening the prompt to a minimal binary rule with tiny balanced examples will improve label consistency.", "hypothesis_source": "agent", "mutation_diff_summary": "", "score": 2.3, "score_ci_lower": 1.8, "score_ci_upper": 2.8, "raw_scores": [3.0, 1.5, 2.0, 3.0, 2.0], "baseline_score": 3.4, "outcome": "KEPT", "failure_mode": null, "duration_seconds": 15.751835624920204, "tags": ["brevity", "binary-classification", "few-shot"], "learnings": "{\"what_changed\":\"\",\"what_improved\":[],\"what_regressed\":[],\"transferable_insight\":\"When a task is reduced to a simple binary rule with a few balanced examples, consistency may still fail to improve, so brevity alone is not sufficient to stabilize decisions.\",\"domain_tags\":[\"prompt-design\",\"classification\",\"decision-consistency\"]}", "cost_usd": 0.012904350000000002, "bootstrap_seed": 0, "agent_model": "gpt-5.4", "held_out_score": null, "criterion_names": ["key_points_captured", "conciseness", "faithful_to_source", "few_shot_format"], "per_criterion_scores": {"key_points_captured": 0.8, "conciseness": 0.7, "faithful_to_source": 0.8, "few_shot_format": 0.0}, "failure_classification": null, "drafts_generated": 1, "drafts_survived": 1}
{"id": "2b66ef88-1e8d-4629-a9c5-7b16a5d530e4", "target_id": "B2-treatment", "git_sha": "25bf6740036a6d5d5fb2be9cad434a7d1bbb793b", "pre_experiment_sha": "0ba3c6cf08b372695112fb89e607fa1a8a04b23e", "timestamp": "2026-04-19T08:28:07.993079+00:00", "hypothesis": "Make the prompt even shorter and stricter around a single sufficiency rule while preserving the exact labels and label-only outputs.", "hypothesis_source": "agent", "mutation_diff_summary": "", "score": 2.4, "score_ci_lower": 2.0, "score_ci_upper": 2.8, "raw_scores": [2.0, 2.0, 3.0, 2.0, 3.0], "baseline_score": 2.3, "outcome": "KEPT", "failure_mode": null, "duration_seconds": 17.334831041982397, "tags": ["binary-classification", "short-prompt", "sufficiency-rule"], "learnings": "{\"what_changed\":\"\",\"what_improved\":[],\"what_regressed\":[],\"transferable_insight\":\"A shorter, stricter instruction set can improve consistency when the task is governed by one clear sufficiency criterion and fixed output labels.\",\"domain_tags\":[\"prompt-engineering\",\"instruction-design\",\"classification\"]}", "cost_usd": 0.012156950000000001, "bootstrap_seed": 0, "agent_model": "gpt-5.4", "held_out_score": null, "criterion_names": ["key_points_captured", "conciseness", "faithful_to_source", "few_shot_format"], "per_criterion_scores": {"key_points_captured": 1.0, "conciseness": 0.4, "faithful_to_source": 0.6, "few_shot_format": 0.4}, "failure_classification": null, "drafts_generated": 1, "drafts_survived": 1}
{"id": "15f62637-eb2a-4cf0-8715-e9843085abbc", "target_id": "B2-treatment", "git_sha": "7eed01a756af87b51edbe1c66c727eb514aa40b1", "pre_experiment_sha": "25bf6740036a6d5d5fb2be9cad434a7d1bbb793b", "timestamp": "2026-04-19T08:28:23.237087+00:00", "hypothesis": "Shortening the prompt to a minimal binary rule with tiny balanced examples will improve consistency on the binary criterion.", "hypothesis_source": "agent", "mutation_diff_summary": "", "score": 1.5, "score_ci_lower": 1.1, "score_ci_upper": 2.0, "raw_scores": [2.5, 1.0, 1.5, 1.0, 1.5], "baseline_score": 2.4, "outcome": "KEPT", "failure_mode": null, "duration_seconds": 14.253628375008702, "tags": ["minimal", "binary-classifier", "few-shot", "rule-based"], "learnings": "{\"what_changed\":\"\",\"what_improved\":[],\"what_regressed\":[],\"transferable_insight\":\"When a task depends on a binary criterion, reducing instructions to a minimal rule with a few balanced examples can improve consistency by lowering ambiguity and decision noise.\",\"domain_tags\":[\"prompt-design\",\"decision-making\",\"classification\"]}", "cost_usd": 0.00989315, "bootstrap_seed": 0, "agent_model": "gpt-5.4", "held_out_score": null, "criterion_names": ["key_points_captured", "conciseness", "faithful_to_source", "few_shot_format"], "per_criterion_scores": {"key_points_captured": 0.9, "conciseness": 0.3, "faithful_to_source": 0.3, "few_shot_format": 0.0}, "failure_classification": null, "drafts_generated": 1, "drafts_survived": 1}
{"id": "6974169a-26e2-4381-8345-8dd6da7d5eef", "target_id": "B2-treatment", "git_sha": "79a1ed4e4e8464d7dc4c1be1d181266a8d037060", "pre_experiment_sha": "7eed01a756af87b51edbe1c66c727eb514aa40b1", "timestamp": "2026-04-19T08:28:38.417141+00:00", "hypothesis": "Restore a brief but faithful binary prompt with exact labels, one concrete sufficiency rule, and balanced label-only examples.", "hypothesis_source": "agent", "mutation_diff_summary": "", "score": 1.9, "score_ci_lower": 1.6, "score_ci_upper": 2.2, "raw_scores": [1.5, 2.0, 2.5, 2.0, 1.5], "baseline_score": 1.5, "outcome": "KEPT", "failure_mode": null, "duration_seconds": 11.63509424997028, "tags": ["binary-classification", "faithful", "concise", "few-shot"], "learnings": "{\"what_changed\":\"\",\"what_improved\":[\"conciseness: PASS (was FAIL)\"],\"what_regressed\":[],\"transferable_insight\":\"When a task requires binary judgment, using exact labels, one clear sufficiency rule, and balanced label-only examples can improve conciseness without sacrificing fidelity.\",\"domain_tags\":[\"prompt-design\",\"classification\",\"evaluation\"]}", "cost_usd": 0.019794950000000006, "bootstrap_seed": 0, "agent_model": "gpt-5.4", "held_out_score": null, "criterion_names": ["key_points_captured", "conciseness", "faithful_to_source", "few_shot_format"], "per_criterion_scores": {"key_points_captured": 1.0, "conciseness": 0.6, "faithful_to_source": 0.2, "few_shot_format": 0.1}, "failure_classification": null, "drafts_generated": 1, "drafts_survived": 1}
