{"id": "762c2779-13f3-445e-b134-bb87edc332dc", "target_id": "B2-treatment", "git_sha": "4a35ec7f7d4fa1f5125225e465fc22017ee97279", "pre_experiment_sha": "4a35ec7f7d4fa1f5125225e465fc22017ee97279", "timestamp": "2026-04-24T05:55:05.991718+00:00", "hypothesis": "Refine few-shot examples to improve readability and fluidity with cohesive phrasing, while maintaining purely positive instructions and a simple, single-paragraph format.", "hypothesis_source": "agent", "mutation_diff_summary": "", "score": 2.5, "score_ci_lower": 2.1, "score_ci_upper": 2.9, "raw_scores": [3.0, 2.5, 3.0, 2.0, 2.0], "baseline_score": 3.2, "outcome": "DISCARDED", "failure_mode": null, "duration_seconds": 60.4879782081116, "tags": ["prompt-engineering", "few-shot-optimization", "positive-framing", "natural-phrasing"], "learnings": "{\"what_changed\":\"\",\"what_improved\":[\"faithful_to_source: PASS (was FAIL)\"],\"what_regressed\":[],\"transferable_insight\":\"While refining few-shot examples for stylistic fluidity and cohesive phrasing can improve faithfulness to the source material, it can severely degrade overall performance by potentially diluting the clarity of core task constraints.\",\"domain_tags\":[\"Few-Shot Prompting\",\"Prompt Engineering\",\"Stylistic Formatting\"]}", "cost_usd": 0.015405150000000001, "bootstrap_seed": 0, "agent_model": "gemini-3.1-pro-preview", "held_out_score": null, "criterion_names": ["key_points_captured", "conciseness", "faithful_to_source", "few_shot_format"], "per_criterion_scores": {"key_points_captured": 1.0, "conciseness": 1.0, "faithful_to_source": 0.5, "few_shot_format": 0.0}, "failure_classification": {"category": "semantic_drift", "description": "The attempt to refine few-shot examples for readability and fluidity, while maintaining positive instructions and a single-paragraph format, likely resulted in the examples conveying an unintended or ambiguous meaning. Despite adherence to superficial formatting rules, the core semantic intent of the instructions or task guidance became unclear, leading the model to misinterpret the desired behavior and achieve a low score.", "fix_direction": "Prioritize clarity and unambiguous meaning above all else. Conduct explicit human evaluation or targeted automated tests to verify that the *meaning* conveyed by the refined examples aligns perfectly with the intended instruction. Focus on ensuring 'purely positive' instructions are not just syntactically positive but also semantically unambiguous, avoiding any phrasing that could be misconstrued or lead to drift from the core task definition.", "confidence": 0.9}, "drafts_generated": 1, "drafts_survived": 1}
{"id": "b18dbb00-30ef-40f2-a58e-73b6741ddcae", "target_id": "B2-treatment", "git_sha": "4a35ec7f7d4fa1f5125225e465fc22017ee97279", "pre_experiment_sha": "4a35ec7f7d4fa1f5125225e465fc22017ee97279", "timestamp": "2026-04-24T05:56:40.183300+00:00", "hypothesis": "Refine few-shot examples to improve readability and fluidity with cohesive phrasing, while maintaining purely positive instructions and a single-paragraph format.", "hypothesis_source": "agent", "mutation_diff_summary": "", "score": 2.5, "score_ci_lower": 2.0, "score_ci_upper": 3.1, "raw_scores": [2.0, 2.0, 2.0, 3.5, 3.0], "baseline_score": 3.2, "outcome": "DISCARDED", "failure_mode": null, "duration_seconds": 73.98854362498969, "tags": ["prompt-engineering", "few-shot-optimization", "positive-framing", "natural-phrasing", "readability"], "learnings": "{\"what_changed\":\"\",\"what_improved\":[],\"what_regressed\":[\"faithful_to_source: FAIL (was PASS)\"],\"transferable_insight\":\"Over-optimizing few-shot examples for stylistic fluidity and cohesive phrasing can inadvertently train the model to prioritize narrative flow over strict factual adherence to the source material.\",\"domain_tags\":[\"Few-Shot Prompting\",\"Faithfulness\",\"Prompt Engineering\"]}", "cost_usd": 0.016001849999999998, "bootstrap_seed": 0, "agent_model": "gemini-3.1-pro-preview", "held_out_score": null, "criterion_names": ["key_points_captured", "conciseness", "faithful_to_source", "few_shot_format"], "per_criterion_scores": {"key_points_captured": 1.0, "conciseness": 1.0, "faithful_to_source": 0.3, "few_shot_format": 0.2}, "failure_classification": {"category": "semantic_drift", "description": "The attempt to refine few-shot examples for readability, fluidity, and cohesive/positive phrasing inadvertently altered or obscured the original meaning and instructional intent. While stylistic improvements or format adherence may have been attempted, the core message of the examples was compromised, leading to less effective or incorrect guidance.", "fix_direction": "Prioritize meaning preservation and semantic accuracy during the refinement process. Implement stricter content verification alongside stylistic improvements, ensuring that changes for readability or tone do not compromise the original instructional purpose. Employ methods like back-translation or human-in-the-loop review to validate that the refined examples maintain their precise meaning.", "confidence": 0.9}, "drafts_generated": 1, "drafts_survived": 1}
{"id": "96a81978-3388-4520-8282-9d8ef9bb63c8", "target_id": "B2-treatment", "git_sha": "4a35ec7f7d4fa1f5125225e465fc22017ee97279", "pre_experiment_sha": "4a35ec7f7d4fa1f5125225e465fc22017ee97279", "timestamp": "2026-04-24T05:58:24.237080+00:00", "hypothesis": "Refining few-shot examples by replacing rigid, choppy sentences with more natural phrasing, while adhering strictly to positive instructions and maintaining a simple, single-paragraph format.", "hypothesis_source": "agent", "mutation_diff_summary": "", "score": 2.3, "score_ci_lower": 2.0, "score_ci_upper": 2.7, "raw_scores": [2.0, 3.0, 2.0, 2.0, 2.5], "baseline_score": 3.2, "outcome": "DISCARDED", "failure_mode": null, "duration_seconds": 66.63828333304264, "tags": ["prompt-engineering", "few-shot-optimization", "positive-framing", "natural-phrasing"], "learnings": "{\"what_changed\":\"\",\"what_improved\":[],\"what_regressed\":[],\"transferable_insight\":\"Prioritizing natural phrasing over rigid, structured sentences in few-shot examples can degrade performance, as models often rely on explicit, highly structured patterns to accurately learn and execute tasks.\",\"domain_tags\":[\"Few-Shot Prompting\",\"Prompt Engineering\",\"Example Formatting\"]}", "cost_usd": 0.0150735, "bootstrap_seed": 0, "agent_model": "gemini-3.1-pro-preview", "held_out_score": null, "criterion_names": ["key_points_captured", "conciseness", "faithful_to_source", "few_shot_format"], "per_criterion_scores": {"key_points_captured": 1.0, "conciseness": 1.0, "faithful_to_source": 0.3, "few_shot_format": 0.0}, "failure_classification": {"category": "semantic_drift", "description": "The attempt to refine few-shot examples by making sentences more 'natural' likely introduced ambiguity or subtly altered the precise meaning or instructional intent of the examples. While the phrasing might have appeared improved to a human, the model misinterpreted the underlying task or context, leading to a significant drop in performance (low score).", "fix_direction": "Re-evaluate the 'natural phrasing' for clarity and precision, ensuring that the semantic meaning and specific instructions for the model remain unambiguous. Prioritize directness and exactness over purely natural language if there's a trade-off. Consider A/B testing different degrees of 'naturalness' against explicit clarity to find an optimal balance.", "confidence": 0.9}, "drafts_generated": 1, "drafts_survived": 1}
{"id": "7cf1b7a4-d5c8-47cf-af27-178f5ec90b5b", "target_id": "B2-treatment", "git_sha": "4a35ec7f7d4fa1f5125225e465fc22017ee97279", "pre_experiment_sha": "4a35ec7f7d4fa1f5125225e465fc22017ee97279", "timestamp": "2026-04-24T05:59:36.228195+00:00", "hypothesis": "Refining few-shot examples by replacing rigid, choppy sentences with more natural phrasing, while adhering strictly to positive instructions and maintaining a simple, single-paragraph format.", "hypothesis_source": "agent", "mutation_diff_summary": "", "score": 2.8, "score_ci_lower": 2.2, "score_ci_upper": 3.4, "raw_scores": [2.0, 3.0, 3.0, 2.0, 4.0], "baseline_score": 3.2, "outcome": "DISCARDED", "failure_mode": null, "duration_seconds": 52.20670195785351, "tags": ["prompt-engineering", "few-shot-optimization", "positive-framing", "natural-phrasing"], "learnings": "{\"what_changed\":\"\",\"what_improved\":[\"faithful_to_source: PASS (was FAIL)\"],\"what_regressed\":[],\"transferable_insight\":\"Replacing rigid, highly structured few-shot examples with more natural phrasing can degrade overall performance by diluting explicit task constraints, even if it marginally improves source faithfulness.\",\"domain_tags\":[\"Prompt Engineering\",\"Few-Shot Prompting\",\"Task Constraints\"]}", "cost_usd": 0.01601105, "bootstrap_seed": 0, "agent_model": "gemini-3.1-pro-preview", "held_out_score": null, "criterion_names": ["key_points_captured", "conciseness", "faithful_to_source", "few_shot_format"], "per_criterion_scores": {"key_points_captured": 1.0, "conciseness": 1.0, "faithful_to_source": 0.6, "few_shot_format": 0.2}, "failure_classification": {"category": "semantic_drift", "description": "The refinement of few-shot examples by introducing 'more natural phrasing' and strictly adhering to 'positive instructions' likely led to a subtle but critical shift in the intended meaning or precision of the instructions. While seemingly improving readability for humans, these changes may have inadvertently diluted crucial information, introduced ambiguity, or altered the core task definition for the model, causing it to misinterpret the desired behavior and leading to degraded performance.", "fix_direction": "Future attempts should prioritize instructional clarity and fidelity over purely stylistic 'naturalness'. Rigorously evaluate how the model interprets the rewritten examples, focusing on whether the precise meaning and constraints are fully preserved. Consider A/B testing different levels of naturalness against baseline examples, and explicitly test for unintended semantic changes or loss of specificity when converting negative constraints to positive ones. Focus on what makes instructions effective for the *model's* understanding, not just human aesthetic preference.", "confidence": 0.9}, "drafts_generated": 1, "drafts_survived": 1}
{"id": "e3a2dbdc-37f9-42bf-bdde-609482630ac7", "target_id": "B2-treatment", "git_sha": "4a35ec7f7d4fa1f5125225e465fc22017ee97279", "pre_experiment_sha": "4a35ec7f7d4fa1f5125225e465fc22017ee97279", "timestamp": "2026-04-24T06:01:17.496774+00:00", "hypothesis": "Refining few-shot examples by replacing rigid, choppy sentences with more natural phrasing, while adhering strictly to positive instructions and maintaining a simple, single-paragraph format.", "hypothesis_source": "agent", "mutation_diff_summary": "", "score": 2.6, "score_ci_lower": 2.1, "score_ci_upper": 3.1, "raw_scores": [2.5, 2.0, 3.5, 2.0, 3.0], "baseline_score": 3.2, "outcome": "DISCARDED", "failure_mode": null, "duration_seconds": 81.18540337495506, "tags": ["prompt-engineering", "few-shot-optimization", "positive-framing", "natural-phrasing"], "learnings": "{\"what_changed\":\"\",\"what_improved\":[],\"what_regressed\":[\"faithful_to_source: FAIL (was PASS)\"],\"transferable_insight\":\"Prioritizing natural phrasing over rigid, literal structures in few-shot examples can inadvertently encourage the model to take creative liberties, reducing its strict adherence to the source material.\",\"domain_tags\":[\"Few-Shot Prompting\",\"Faithfulness\",\"Prompt Engineering\"]}", "cost_usd": 0.01723, "bootstrap_seed": 0, "agent_model": "gemini-3.1-pro-preview", "held_out_score": null, "criterion_names": ["key_points_captured", "conciseness", "faithful_to_source", "few_shot_format"], "per_criterion_scores": {"key_points_captured": 0.9, "conciseness": 1.0, "faithful_to_source": 0.4, "few_shot_format": 0.3}, "failure_classification": {"category": "semantic_drift", "description": "The experiment aimed to improve semantic understanding and instruction adherence through more natural phrasing and positive instructions in few-shot examples. However, the low score of 2.6000 suggests that despite these refinements, the model's output still failed to accurately capture or maintain the intended meaning, or it did not strictly follow the positive instructions in terms of content. The semantic quality of the generated responses likely drifted from the desired outcome.", "fix_direction": "Investigate specific instances where the model's output diverged from the intended meaning. Analyze whether the 'natural phrasing' introduced new ambiguities or if the positive instructions, while strictly adhered to, were insufficient to constrain the semantic scope. Consider re-evaluating the desired level of explicitness in the instructions, potentially combining natural phrasing with more direct or specific constraints, or providing more varied few-shot examples to reinforce the target meaning.", "confidence": 0.9}, "drafts_generated": 1, "drafts_survived": 1}
{"id": "a1dbabd3-54f6-411c-9f68-821774c68889", "target_id": "B2-treatment", "git_sha": "4a35ec7f7d4fa1f5125225e465fc22017ee97279", "pre_experiment_sha": "4a35ec7f7d4fa1f5125225e465fc22017ee97279", "timestamp": "2026-04-24T06:02:56.527009+00:00", "hypothesis": "Refine the system prompt to prioritize meaning preservation by instructing the model to capture the core message accurately and synthesize the information clearly, maintaining a simple, single-paragraph format.", "hypothesis_source": "agent", "mutation_diff_summary": "", "score": 2.9, "score_ci_lower": 2.4, "score_ci_upper": 3.3, "raw_scores": [3.5, 3.0, 2.0, 3.0, 3.0], "baseline_score": 3.2, "outcome": "DISCARDED", "failure_mode": null, "duration_seconds": 62.34366870811209, "tags": ["prompt-engineering", "positive-framing", "accuracy", "synthesis", "single-paragraph"], "learnings": "{\"what_changed\":\"\",\"what_improved\":[\"faithful_to_source: PASS (was FAIL)\"],\"what_regressed\":[],\"transferable_insight\":\"Instructing a model to strictly prioritize meaning preservation within a rigid structural constraint successfully improves source faithfulness but can severely degrade overall output quality.\",\"domain_tags\":[\"Prompt Engineering\",\"Constraint Balancing\",\"Summarization\"]}", "cost_usd": 0.016063100000000004, "bootstrap_seed": 0, "agent_model": "gemini-3.1-pro-preview", "held_out_score": null, "criterion_names": ["key_points_captured", "conciseness", "faithful_to_source", "few_shot_format"], "per_criterion_scores": {"key_points_captured": 1.0, "conciseness": 1.0, "faithful_to_source": 0.7, "few_shot_format": 0.2}, "failure_classification": {"category": "semantic_drift", "description": "The experiment aimed to prioritize meaning preservation and clear synthesis, but the low score indicates a failure in capturing the core message accurately. The model's output likely drifted from the intended meaning, failing to synthesize information correctly, despite the prompt's instructions.", "fix_direction": "Refine the prompt to provide more specific instructions on 'what' constitutes accurate meaning preservation and 'how' to synthesize information clearly. Consider adding examples of desired output that accurately reflects meaning while maintaining simplicity, or explicitly detailing what kind of 'drift' to avoid. Evaluate if the prompt's current language is sufficiently unambiguous for the model to interpret 'core message' and 'synthesis' as intended.", "confidence": 0.9}, "drafts_generated": 1, "drafts_survived": 1}
{"id": "fd6f6a6f-a297-4ab6-b4be-ee5d61060872", "target_id": "B2-treatment", "git_sha": "4a35ec7f7d4fa1f5125225e465fc22017ee97279", "pre_experiment_sha": "4a35ec7f7d4fa1f5125225e465fc22017ee97279", "timestamp": "2026-04-24T06:04:31.470084+00:00", "hypothesis": "Refine the few-shot examples to prioritize factual adherence over flowery language, instructing the model to capture the core message accurately and synthesize the information clearly, maintaining a simple, single-paragraph format.", "hypothesis_source": "agent", "mutation_diff_summary": "", "score": 3.1, "score_ci_lower": 2.3, "score_ci_upper": 3.9, "raw_scores": [2.0, 4.0, 2.0, 3.5, 4.0], "baseline_score": 3.2, "outcome": "DISCARDED", "failure_mode": null, "duration_seconds": 77.59330745809712, "tags": ["prompt-engineering", "positive-framing", "accuracy", "synthesis", "single-paragraph", "few-shot-optimization"], "learnings": "{\"what_changed\":\"\",\"what_improved\":[\"few_shot_format: PASS (was FAIL)\"],\"what_regressed\":[],\"transferable_insight\":\"While simplifying few-shot examples to focus strictly on factual synthesis improves format adherence, it can negatively impact overall performance by stripping away necessary stylistic nuance.\",\"domain_tags\":[\"Prompt Engineering\",\"Few-Shot Prompting\",\"Style vs. Factuality\"]}", "cost_usd": 0.01776715, "bootstrap_seed": 0, "agent_model": "gemini-3.1-pro-preview", "held_out_score": null, "criterion_names": ["key_points_captured", "conciseness", "faithful_to_source", "few_shot_format"], "per_criterion_scores": {"key_points_captured": 1.0, "conciseness": 1.0, "faithful_to_source": 0.5, "few_shot_format": 0.6}, "failure_classification": {"category": "semantic_drift", "description": "The experiment aimed to prioritize factual adherence and accurate synthesis of information. A score of 3.1 strongly suggests that the model failed to capture the core message accurately, produced factually incorrect information, or synthesized it unclearly, resulting in output with the wrong meaning, even if the format was partially or fully adhered to.", "fix_direction": "Refine few-shot examples to provide clearer demonstrations of factual adherence and core message identification. Include examples that explicitly show the difference between 'flowery language' and 'clear, synthesized information.' Consider adding explicit instructions for fact-checking or reasoning steps within the prompt to guide the model towards accurate content generation.", "confidence": 0.9}, "drafts_generated": 1, "drafts_survived": 1}
{"id": "cd7b8703-1ae9-4b52-8b0e-514dec560588", "target_id": "B2-treatment", "git_sha": "e2d8a666992ba37892ddcef1bdb9ad460086d08d", "pre_experiment_sha": "4a35ec7f7d4fa1f5125225e465fc22017ee97279", "timestamp": "2026-04-24T06:06:08.768969+00:00", "hypothesis": "Refine the system prompt to emphasize factual accuracy by instructing the model to base its summary entirely on the provided text and synthesize the information clearly, maintaining a simple, single-paragraph format.", "hypothesis_source": "agent", "mutation_diff_summary": "", "score": 3.1, "score_ci_lower": 2.6, "score_ci_upper": 3.6, "raw_scores": [2.5, 2.5, 3.5, 4.0, 3.0], "baseline_score": 3.2, "outcome": "KEPT", "failure_mode": null, "duration_seconds": 79.16222145804204, "tags": ["prompt-engineering", "positive-framing", "accuracy", "synthesis", "single-paragraph"], "learnings": "{\"what_changed\":\"\",\"what_improved\":[],\"what_regressed\":[\"few_shot_format: FAIL (was PASS)\"],\"transferable_insight\":\"Introducing explicit structural or synthesis constraints in a system prompt can inadvertently override the output patterns established by few-shot examples.\",\"domain_tags\":[\"Prompt Engineering\",\"Few-Shot Learning\",\"Formatting\"]}", "cost_usd": 0.01683205, "bootstrap_seed": 0, "agent_model": "gemini-3.1-pro-preview", "held_out_score": null, "criterion_names": ["key_points_captured", "conciseness", "faithful_to_source", "few_shot_format"], "per_criterion_scores": {"key_points_captured": 1.0, "conciseness": 1.0, "faithful_to_source": 0.8, "few_shot_format": 0.3}, "failure_classification": null, "drafts_generated": 1, "drafts_survived": 1}
