{"id": "a4e04201-33e5-43da-81b4-29be48a3009e", "target_id": "B2-treatment", "git_sha": "42bf01bdc2131cff1409b181e9409a33508bcc73", "pre_experiment_sha": "b9295e2c2cd90d8dba5ddf5be5a80c713266ee04", "timestamp": "2026-04-06T21:15:08.440368+00:00", "hypothesis": "No hypothesis provided", "hypothesis_source": "synthesized", "mutation_diff_summary": "", "score": 2.4, "score_ci_lower": 2.0, "score_ci_upper": 2.8, "raw_scores": [2.0, 2.0, 3.0, 2.0, 3.0], "baseline_score": 0.0, "outcome": "KEPT", "failure_mode": null, "duration_seconds": 160.31852329196408, "tags": [], "learnings": "{\"what_changed\":\"\",\"what_improved\":[],\"what_regressed\":[],\"transferable_insight\":\"No hypothesis provided\",\"domain_tags\":[]}", "cost_usd": 0.4585177, "bootstrap_seed": 0, "agent_model": "claude-sonnet-4-6", "held_out_score": null, "criterion_names": ["key_points_captured", "conciseness", "faithful_to_source", "few_shot_format"], "per_criterion_scores": {"key_points_captured": 1.0, "conciseness": 1.0, "faithful_to_source": 0.4, "few_shot_format": 0.0}, "failure_classification": null, "drafts_generated": 1, "drafts_survived": 1}
{"id": "99a2a6b1-2d41-4c4f-9db0-a7c193d711be", "target_id": "B2-treatment", "git_sha": "2a2d3fb868dff2a2a4b0dc2d42681a4b04390581", "pre_experiment_sha": "42bf01bdc2131cff1409b181e9409a33508bcc73", "timestamp": "2026-04-06T21:16:56.582575+00:00", "hypothesis": "No hypothesis provided", "hypothesis_source": "synthesized", "mutation_diff_summary": "", "score": 3.0, "score_ci_lower": 2.4, "score_ci_upper": 3.6, "raw_scores": [2.0, 3.0, 4.0, 3.0, 3.0], "baseline_score": 2.4, "outcome": "KEPT", "failure_mode": null, "duration_seconds": 107.71917820814997, "tags": [], "learnings": "{\"what_changed\":\"\",\"what_improved\":[],\"what_regressed\":[],\"transferable_insight\":\"No hypothesis provided\",\"domain_tags\":[]}", "cost_usd": 0.18865545000000003, "bootstrap_seed": 0, "agent_model": "claude-sonnet-4-6", "held_out_score": null, "criterion_names": ["key_points_captured", "conciseness", "faithful_to_source", "few_shot_format"], "per_criterion_scores": {"key_points_captured": 1.0, "conciseness": 1.0, "faithful_to_source": 0.8, "few_shot_format": 0.2}, "failure_classification": null, "drafts_generated": 1, "drafts_survived": 1}
{"id": "6f430568-4b94-4259-a9e3-642e3f8a437f", "target_id": "B2-treatment", "git_sha": "2a2d3fb868dff2a2a4b0dc2d42681a4b04390581", "pre_experiment_sha": "2a2d3fb868dff2a2a4b0dc2d42681a4b04390581", "timestamp": "2026-04-06T21:18:12.944836+00:00", "hypothesis": "No hypothesis provided", "hypothesis_source": "synthesized", "mutation_diff_summary": "", "score": 2.4, "score_ci_lower": 2.0, "score_ci_upper": 2.8, "raw_scores": [2.0, 3.0, 2.0, 2.0, 3.0], "baseline_score": 3.0, "outcome": "DISCARDED", "failure_mode": null, "duration_seconds": 75.9772149999626, "tags": [], "learnings": "{\"what_changed\":\"\",\"what_improved\":[],\"what_regressed\":[],\"transferable_insight\":\"No hypothesis provided\",\"domain_tags\":[]}", "cost_usd": 0.17314465, "bootstrap_seed": 0, "agent_model": "claude-sonnet-4-6", "held_out_score": null, "criterion_names": ["key_points_captured", "conciseness", "faithful_to_source", "few_shot_format"], "per_criterion_scores": {"key_points_captured": 1.0, "conciseness": 1.0, "faithful_to_source": 0.4, "few_shot_format": 0.0}, "failure_classification": {"category": "output_format", "description": "A required hypothesis was not provided, violating the expected output structure or schema.", "fix_direction": "Ensure all required sections, especially the hypothesis, are included in future submissions to match schema expectations.", "confidence": 0.95}, "drafts_generated": 1, "drafts_survived": 1}
{"id": "21ec50c2-8c53-4c23-b278-5e53a2c7be59", "target_id": "B2-treatment", "git_sha": "2a2d3fb868dff2a2a4b0dc2d42681a4b04390581", "pre_experiment_sha": "2a2d3fb868dff2a2a4b0dc2d42681a4b04390581", "timestamp": "2026-04-06T21:19:38.852120+00:00", "hypothesis": "No hypothesis provided", "hypothesis_source": "synthesized", "mutation_diff_summary": "", "score": 2.0, "score_ci_lower": 2.0, "score_ci_upper": 2.0, "raw_scores": [2.0, 2.0, 2.0, 2.0, 2.0], "baseline_score": 3.0, "outcome": "DISCARDED", "failure_mode": null, "duration_seconds": 84.22452704189345, "tags": [], "learnings": "{\"what_changed\":\"\",\"what_improved\":[],\"what_regressed\":[],\"transferable_insight\":\"No hypothesis provided\",\"domain_tags\":[]}", "cost_usd": 0.21243484999999995, "bootstrap_seed": 0, "agent_model": "claude-sonnet-4-6", "held_out_score": null, "criterion_names": ["key_points_captured", "conciseness", "faithful_to_source", "few_shot_format"], "per_criterion_scores": {"key_points_captured": 0.8, "conciseness": 1.0, "faithful_to_source": 0.2, "few_shot_format": 0.0}, "failure_classification": {"category": "output_format", "description": "The output does not include a hypothesis, which violates the required output structure or schema.", "fix_direction": "Ensure the output includes all required fields, especially the hypothesis section.", "confidence": 0.95}, "drafts_generated": 1, "drafts_survived": 1}
{"id": "03877c66-8751-476a-a2a7-a0d2b9b0153f", "target_id": "B2-treatment", "git_sha": "2a2d3fb868dff2a2a4b0dc2d42681a4b04390581", "pre_experiment_sha": "2a2d3fb868dff2a2a4b0dc2d42681a4b04390581", "timestamp": "2026-04-06T21:20:55.989069+00:00", "hypothesis": "No hypothesis provided", "hypothesis_source": "synthesized", "mutation_diff_summary": "", "score": 2.0, "score_ci_lower": 2.0, "score_ci_upper": 2.0, "raw_scores": [2.0, 2.0, 2.0, 2.0, 2.0], "baseline_score": 3.0, "outcome": "DISCARDED", "failure_mode": null, "duration_seconds": 75.44110958417878, "tags": [], "learnings": "{\"what_changed\":\"\",\"what_improved\":[],\"what_regressed\":[],\"transferable_insight\":\"No hypothesis provided\",\"domain_tags\":[]}", "cost_usd": 0.18753440000000002, "bootstrap_seed": 0, "agent_model": "claude-sonnet-4-6", "held_out_score": null, "criterion_names": ["key_points_captured", "conciseness", "faithful_to_source", "few_shot_format"], "per_criterion_scores": {"key_points_captured": 0.8, "conciseness": 0.8, "faithful_to_source": 0.4, "few_shot_format": 0.0}, "failure_classification": {"category": "output_format", "description": "The experiment failed due to an output structure or schema violation, indicated by the score and the unspecified hypothesis and failure mode.", "fix_direction": "Ensure outputs adhere strictly to the required structure/schema; validate output format programmatically before submission.", "confidence": 0.85}, "drafts_generated": 1, "drafts_survived": 1}
{"id": "07c17023-d293-47be-86ba-7ded5976371b", "target_id": "B2-treatment", "git_sha": "2a2d3fb868dff2a2a4b0dc2d42681a4b04390581", "pre_experiment_sha": "2a2d3fb868dff2a2a4b0dc2d42681a4b04390581", "timestamp": "2026-04-06T21:22:19.242135+00:00", "hypothesis": "No hypothesis provided", "hypothesis_source": "synthesized", "mutation_diff_summary": "", "score": 2.4, "score_ci_lower": 2.0, "score_ci_upper": 2.8, "raw_scores": [2.0, 3.0, 2.0, 2.0, 3.0], "baseline_score": 3.0, "outcome": "DISCARDED", "failure_mode": null, "duration_seconds": 81.33797074994072, "tags": [], "learnings": "{\"what_changed\":\"\",\"what_improved\":[],\"what_regressed\":[],\"transferable_insight\":\"No hypothesis provided\",\"domain_tags\":[]}", "cost_usd": 0.18925465, "bootstrap_seed": 0, "agent_model": "claude-sonnet-4-6", "held_out_score": null, "criterion_names": ["key_points_captured", "conciseness", "faithful_to_source", "few_shot_format"], "per_criterion_scores": {"key_points_captured": 1.0, "conciseness": 1.0, "faithful_to_source": 0.4, "few_shot_format": 0.0}, "failure_classification": {"category": "output_format", "description": "The experiment failed to provide a hypothesis, which is a required part of the output structure or schema.", "fix_direction": "Ensure all required output fields, especially 'hypothesis', are present and correctly formatted.", "confidence": 0.95}, "drafts_generated": 1, "drafts_survived": 1}
{"id": "1cb24aaa-518e-4eb9-bee4-2d41edd48b1b", "target_id": "B2-treatment", "git_sha": "2a2d3fb868dff2a2a4b0dc2d42681a4b04390581", "pre_experiment_sha": "2a2d3fb868dff2a2a4b0dc2d42681a4b04390581", "timestamp": "2026-04-06T21:23:27.404619+00:00", "hypothesis": "No hypothesis provided", "hypothesis_source": "synthesized", "mutation_diff_summary": "", "score": 2.2, "score_ci_lower": 2.0, "score_ci_upper": 2.6, "raw_scores": [2.0, 2.0, 3.0, 2.0, 2.0], "baseline_score": 3.0, "outcome": "DISCARDED", "failure_mode": null, "duration_seconds": 66.13277724990621, "tags": [], "learnings": "{\"what_changed\":\"\",\"what_improved\":[],\"what_regressed\":[],\"transferable_insight\":\"No hypothesis provided\",\"domain_tags\":[]}", "cost_usd": 0.17419055, "bootstrap_seed": 0, "agent_model": "claude-sonnet-4-6", "held_out_score": null, "criterion_names": ["key_points_captured", "conciseness", "faithful_to_source", "few_shot_format"], "per_criterion_scores": {"key_points_captured": 0.8, "conciseness": 1.0, "faithful_to_source": 0.4, "few_shot_format": 0.0}, "failure_classification": {"category": "output_format", "description": "The experiment violated the expected output structure or schema, as indicated by the score and categorization. No hypothesis or clear failure mode was provided, which may suggest a structural or format issue.", "fix_direction": "Ensure that all required output fields are present, properly formatted, and adhere strictly to the expected schema.", "confidence": 0.8}, "drafts_generated": 1, "drafts_survived": 1}
{"id": "0fc156e7-55fc-4e25-bc09-ed55b5d1d282", "target_id": "B2-treatment", "git_sha": "2a2d3fb868dff2a2a4b0dc2d42681a4b04390581", "pre_experiment_sha": "2a2d3fb868dff2a2a4b0dc2d42681a4b04390581", "timestamp": "2026-04-06T21:24:45.760627+00:00", "hypothesis": "No hypothesis provided", "hypothesis_source": "synthesized", "mutation_diff_summary": "", "score": 2.6, "score_ci_lower": 2.2, "score_ci_upper": 3.0, "raw_scores": [2.0, 3.0, 3.0, 3.0, 2.0], "baseline_score": 3.0, "outcome": "DISCARDED", "failure_mode": null, "duration_seconds": 76.7474466250278, "tags": [], "learnings": "{\"what_changed\":\"\",\"what_improved\":[],\"what_regressed\":[],\"transferable_insight\":\"No hypothesis provided\",\"domain_tags\":[]}", "cost_usd": 0.25138375, "bootstrap_seed": 0, "agent_model": "claude-sonnet-4-6", "held_out_score": null, "criterion_names": ["key_points_captured", "conciseness", "faithful_to_source", "few_shot_format"], "per_criterion_scores": {"key_points_captured": 0.8, "conciseness": 1.0, "faithful_to_source": 0.8, "few_shot_format": 0.0}, "failure_classification": {"category": "output_format", "description": "The experiment failed due to a violation of the required output structure or schema, as indicated by the lack of a provided hypothesis and unknown failure mode.", "fix_direction": "Ensure all required schema fields are present and correctly structured in future submissions.", "confidence": 0.9}, "drafts_generated": 1, "drafts_survived": 1}
{"id": "f0799918-2b8d-4b09-85ff-e03cecdb3929", "target_id": "B2-treatment", "git_sha": "2a2d3fb868dff2a2a4b0dc2d42681a4b04390581", "pre_experiment_sha": "2a2d3fb868dff2a2a4b0dc2d42681a4b04390581", "timestamp": "2026-04-06T21:26:05.603952+00:00", "hypothesis": "No hypothesis provided", "hypothesis_source": "synthesized", "mutation_diff_summary": "", "score": 2.6, "score_ci_lower": 2.2, "score_ci_upper": 3.0, "raw_scores": [3.0, 3.0, 2.0, 2.0, 3.0], "baseline_score": 3.0, "outcome": "DISCARDED", "failure_mode": null, "duration_seconds": 78.28772804210894, "tags": [], "learnings": "{\"what_changed\":\"\",\"what_improved\":[],\"what_regressed\":[],\"transferable_insight\":\"No hypothesis provided\",\"domain_tags\":[]}", "cost_usd": 0.19876065, "bootstrap_seed": 0, "agent_model": "claude-sonnet-4-6", "held_out_score": null, "criterion_names": ["key_points_captured", "conciseness", "faithful_to_source", "few_shot_format"], "per_criterion_scores": {"key_points_captured": 1.0, "conciseness": 1.0, "faithful_to_source": 0.6, "few_shot_format": 0.0}, "failure_classification": {"category": "output_format", "description": "The experiment failed due to a violation of the required output structure or schema.", "fix_direction": "Ensure the output strictly follows the specified format/schema requirements.", "confidence": 0.85}, "drafts_generated": 1, "drafts_survived": 1}
{"id": "6fc1aac1-0a2c-43d9-9224-b129bbfafeb2", "target_id": "B2-treatment", "git_sha": "2a2d3fb868dff2a2a4b0dc2d42681a4b04390581", "pre_experiment_sha": "2a2d3fb868dff2a2a4b0dc2d42681a4b04390581", "timestamp": "2026-04-06T21:27:13.513520+00:00", "hypothesis": "No hypothesis provided", "hypothesis_source": "synthesized", "mutation_diff_summary": "", "score": 2.4, "score_ci_lower": 1.6, "score_ci_upper": 3.0, "raw_scores": [2.0, 3.0, 3.0, 3.0, 1.0], "baseline_score": 3.0, "outcome": "DISCARDED", "failure_mode": null, "duration_seconds": 66.30752187501639, "tags": [], "learnings": "{\"what_changed\":\"\",\"what_improved\":[],\"what_regressed\":[],\"transferable_insight\":\"No hypothesis provided\",\"domain_tags\":[]}", "cost_usd": 0.23596824999999996, "bootstrap_seed": 0, "agent_model": "claude-sonnet-4-6", "held_out_score": null, "criterion_names": ["key_points_captured", "conciseness", "faithful_to_source", "few_shot_format"], "per_criterion_scores": {"key_points_captured": 0.8, "conciseness": 0.8, "faithful_to_source": 0.8, "few_shot_format": 0.0}, "failure_classification": {"category": "output_format", "description": "The experiment failed due to a violation of the required output structure or schema, as indicated by the 'output_format' option and absence of details suggesting other errors.", "fix_direction": "Ensure outputs strictly adhere to the specified structure or schema in future attempts.", "confidence": 0.85}, "drafts_generated": 1, "drafts_survived": 1}
{"id": "0615de49-576a-4722-a564-222fec58e797", "target_id": "B2-treatment", "git_sha": "2a2d3fb868dff2a2a4b0dc2d42681a4b04390581", "pre_experiment_sha": "2a2d3fb868dff2a2a4b0dc2d42681a4b04390581", "timestamp": "2026-04-06T21:28:16.578791+00:00", "hypothesis": "No hypothesis provided", "hypothesis_source": "synthesized", "mutation_diff_summary": "", "score": 2.4, "score_ci_lower": 2.0, "score_ci_upper": 2.8, "raw_scores": [2.0, 3.0, 3.0, 2.0, 2.0], "baseline_score": 3.0, "outcome": "DISCARDED", "failure_mode": null, "duration_seconds": 61.40995004191063, "tags": [], "learnings": "{\"what_changed\":\"\",\"what_improved\":[],\"what_regressed\":[],\"transferable_insight\":\"No hypothesis provided\",\"domain_tags\":[]}", "cost_usd": 0.16575645, "bootstrap_seed": 0, "agent_model": "claude-sonnet-4-6", "held_out_score": null, "criterion_names": ["key_points_captured", "conciseness", "faithful_to_source", "few_shot_format"], "per_criterion_scores": {"key_points_captured": 0.8, "conciseness": 1.0, "faithful_to_source": 0.6, "few_shot_format": 0.0}, "failure_classification": {"category": "output_format", "description": "The experiment failed due to violating the expected output structure or schema; the result did not conform to a required format.", "fix_direction": "Check and enforce adherence to the expected output schema or structure for all outputs.", "confidence": 0.9}, "drafts_generated": 1, "drafts_survived": 1}
{"id": "791c0773-0aaf-49b6-8e13-e08cf6e6c965", "target_id": "B2-treatment", "git_sha": "096d5d0edc5758a0e16c76895e3ae754367c7a59", "pre_experiment_sha": "2a2d3fb868dff2a2a4b0dc2d42681a4b04390581", "timestamp": "2026-04-06T21:29:26.978732+00:00", "hypothesis": "No hypothesis provided", "hypothesis_source": "synthesized", "mutation_diff_summary": "", "score": 2.5, "score_ci_lower": 2.1, "score_ci_upper": 2.9, "raw_scores": [2.0, 2.5, 3.0, 2.0, 3.0], "baseline_score": 3.0, "outcome": "KEPT", "failure_mode": null, "duration_seconds": 68.92834483389743, "tags": [], "learnings": "{\"what_changed\":\"\",\"what_improved\":[],\"what_regressed\":[],\"transferable_insight\":\"No hypothesis provided\",\"domain_tags\":[]}", "cost_usd": 0.17547854999999998, "bootstrap_seed": 0, "agent_model": "claude-sonnet-4-6", "held_out_score": null, "criterion_names": ["key_points_captured", "conciseness", "faithful_to_source", "few_shot_format"], "per_criterion_scores": {"key_points_captured": 1.0, "conciseness": 0.9, "faithful_to_source": 0.6, "few_shot_format": 0.0}, "failure_classification": null, "drafts_generated": 1, "drafts_survived": 1}
{"id": "56345dce-8b88-4f95-8ca2-cff8c2a321a3", "target_id": "B2-treatment", "git_sha": "7f3ea5efb1d6448bc9743cd47024d1547b7ed730", "pre_experiment_sha": "096d5d0edc5758a0e16c76895e3ae754367c7a59", "timestamp": "2026-04-06T21:30:27.016757+00:00", "hypothesis": "No hypothesis provided", "hypothesis_source": "synthesized", "mutation_diff_summary": "", "score": 2.4, "score_ci_lower": 2.0, "score_ci_upper": 2.8, "raw_scores": [2.0, 2.0, 3.0, 3.0, 2.0], "baseline_score": 2.5, "outcome": "KEPT", "failure_mode": null, "duration_seconds": 59.65257045812905, "tags": [], "learnings": "{\"what_changed\":\"\",\"what_improved\":[],\"what_regressed\":[],\"transferable_insight\":\"No hypothesis provided\",\"domain_tags\":[]}", "cost_usd": 0.1725672, "bootstrap_seed": 0, "agent_model": "claude-sonnet-4-6", "held_out_score": null, "criterion_names": ["key_points_captured", "conciseness", "faithful_to_source", "few_shot_format"], "per_criterion_scores": {"key_points_captured": 0.8, "conciseness": 1.0, "faithful_to_source": 0.6, "few_shot_format": 0.0}, "failure_classification": null, "drafts_generated": 1, "drafts_survived": 1}
{"id": "22d36341-8319-44d7-80a0-2389d14d7f59", "target_id": "B2-treatment", "git_sha": "39ffd6313192a620057f6e8c18d278350aaba737", "pre_experiment_sha": "7f3ea5efb1d6448bc9743cd47024d1547b7ed730", "timestamp": "2026-04-06T21:31:39.254386+00:00", "hypothesis": "No hypothesis provided", "hypothesis_source": "synthesized", "mutation_diff_summary": "", "score": 2.5, "score_ci_lower": 2.1, "score_ci_upper": 2.9, "raw_scores": [2.0, 2.5, 3.0, 3.0, 2.0], "baseline_score": 2.4, "outcome": "KEPT", "failure_mode": null, "duration_seconds": 71.82732458296232, "tags": [], "learnings": "{\"what_changed\":\"\",\"what_improved\":[],\"what_regressed\":[],\"transferable_insight\":\"No hypothesis provided\",\"domain_tags\":[]}", "cost_usd": 0.17789399999999997, "bootstrap_seed": 0, "agent_model": "claude-sonnet-4-6", "held_out_score": null, "criterion_names": ["key_points_captured", "conciseness", "faithful_to_source", "few_shot_format"], "per_criterion_scores": {"key_points_captured": 0.8, "conciseness": 1.0, "faithful_to_source": 0.7, "few_shot_format": 0.0}, "failure_classification": null, "drafts_generated": 1, "drafts_survived": 1}
{"id": "9bdc5362-1fb4-4951-be0f-ec8bddd0f243", "target_id": "B2-treatment", "git_sha": "c5987b80e854f4592c38f207411efda40d216138", "pre_experiment_sha": "39ffd6313192a620057f6e8c18d278350aaba737", "timestamp": "2026-04-06T21:33:17.596947+00:00", "hypothesis": "No hypothesis provided", "hypothesis_source": "synthesized", "mutation_diff_summary": "", "score": 2.3, "score_ci_lower": 2.0, "score_ci_upper": 2.7, "raw_scores": [2.0, 2.5, 3.0, 2.0, 2.0], "baseline_score": 2.5, "outcome": "KEPT", "failure_mode": null, "duration_seconds": 97.93359341705218, "tags": [], "learnings": "{\"what_changed\":\"\",\"what_improved\":[],\"what_regressed\":[],\"transferable_insight\":\"No hypothesis provided\",\"domain_tags\":[]}", "cost_usd": 0.20664135000000003, "bootstrap_seed": 0, "agent_model": "claude-sonnet-4-6", "held_out_score": null, "criterion_names": ["key_points_captured", "conciseness", "faithful_to_source", "few_shot_format"], "per_criterion_scores": {"key_points_captured": 0.8, "conciseness": 1.0, "faithful_to_source": 0.5, "few_shot_format": 0.0}, "failure_classification": null, "drafts_generated": 1, "drafts_survived": 1}
{"id": "62fed407-ca1c-4008-813e-9656e92a4c3a", "target_id": "B2-treatment", "git_sha": "381200f685c9246e957eb27369ac191f8bbeffdf", "pre_experiment_sha": "c5987b80e854f4592c38f207411efda40d216138", "timestamp": "2026-04-06T21:34:33.200248+00:00", "hypothesis": "No hypothesis provided", "hypothesis_source": "synthesized", "mutation_diff_summary": "", "score": 2.4, "score_ci_lower": 2.0, "score_ci_upper": 2.8, "raw_scores": [2.0, 3.0, 2.0, 3.0, 2.0], "baseline_score": 2.3, "outcome": "KEPT", "failure_mode": null, "duration_seconds": 75.17840362503193, "tags": [], "learnings": "{\"what_changed\":\"\",\"what_improved\":[],\"what_regressed\":[],\"transferable_insight\":\"No hypothesis provided\",\"domain_tags\":[]}", "cost_usd": 0.1797201, "bootstrap_seed": 0, "agent_model": "claude-sonnet-4-6", "held_out_score": null, "criterion_names": ["key_points_captured", "conciseness", "faithful_to_source", "few_shot_format"], "per_criterion_scores": {"key_points_captured": 0.8, "conciseness": 1.0, "faithful_to_source": 0.6, "few_shot_format": 0.0}, "failure_classification": null, "drafts_generated": 1, "drafts_survived": 1}
