{"id": "2a87f698-5bc2-4d1e-9d47-f5e85fef2f34", "target_id": "B3-control", "git_sha": "3cb8e256d8a8f17765dfa0955a45865f7f54392a", "pre_experiment_sha": "68d96c185fbe6e19a4b0d379f77244ff8b5e62d6", "timestamp": "2026-04-18T23:17:53.553909+00:00", "hypothesis": "Replace redundant quadratic work with bounded Levenshtein and direct deduplication while preserving output.", "hypothesis_source": "agent", "mutation_diff_summary": "", "score": 122.73, "score_ci_lower": null, "score_ci_upper": null, "raw_scores": null, "baseline_score": 469.25, "outcome": "KEPT", "failure_mode": null, "duration_seconds": 33.79527683299966, "tags": ["performance", "dynamic-programming", "pruning", "deterministic"], "learnings": "{\"what_changed\":\"\",\"what_improved\":[],\"what_regressed\":[],\"transferable_insight\":\"Replacing redundant quadratic processing with bounded-distance comparison and direct deduplication can preserve results while substantially reducing unnecessary work.\",\"domain_tags\":[\"algorithm-optimization\",\"deduplication\",\"performance\"]}", "cost_usd": 0.07830500000000001, "bootstrap_seed": 0, "agent_model": "gpt-5.4", "held_out_score": null, "criterion_names": null, "per_criterion_scores": null, "failure_classification": null, "drafts_generated": 1, "drafts_survived": 1}
{"id": "1b7d4e0d-8bc2-4dcc-a6e0-0beeda195873", "target_id": "B3-control", "git_sha": "3cb8e256d8a8f17765dfa0955a45865f7f54392a", "pre_experiment_sha": "3cb8e256d8a8f17765dfa0955a45865f7f54392a", "timestamp": "2026-04-18T23:18:24.063413+00:00", "hypothesis": "Reduce allocations and comparisons by pre-bucketing names by length and using a narrower, in-place bounded Levenshtein implementation.", "hypothesis_source": "agent", "mutation_diff_summary": "", "score": 122.73, "score_ci_lower": null, "score_ci_upper": null, "raw_scores": null, "baseline_score": 122.73, "outcome": "CRASHED", "failure_mode": "run_command exited with code 1: warning: `VIRTUAL_ENV=/Users/druk/WorkSpace/AetherForge/anneal/.venv` does not match the project environment path `.venv` and will be ignored; use `--active` to target the active environment instead\nTraceback (most recent call last):\n  File \"/Users/druk/WorkSpace/AetherForge/anneal/benchmarks/suite/harness/eval_b3.py\", line 124, in <module>\n    main()\n  File \"/Users/druk/WorkSpace/AetherForge/anneal/benchmarks/suite/harness/eval_b3.py\", line 116, in main\n    if not _verify_spot_checks(ARTIFACT):\n           ^^^^^^^^^^^^^^^^^^^^^^^^^^^^^\n  File \"/Users/druk/WorkSpace/AetherForge/anneal/benchmarks/suite/harness/eval_b3.py\", line 69, in _verify_spot_checks\n    pairs = find_fn(names_a, names_b, 2)\n            ^^^^^^^^^^^^^^^^^^^^^^^^^^^^\nTypeError: _find_close_pairs() takes 2 positional arguments but 3 were given", "duration_seconds": 29.40570583299268, "tags": ["performance", "levenshtein", "bucketing", "low-allocation"], "learnings": "{\"what_changed\":\"\",\"what_improved\":[],\"what_regressed\":[],\"transferable_insight\":\"Optimizations that reduce apparent work can still fail if they introduce subtle correctness or memory-safety issues, so validate the new control flow and data handling as rigorously as the original implementation.\",\"domain_tags\":[\"software-engineering\",\"performance-optimization\",\"reliability\"]}", "cost_usd": 0.08061000000000001, "bootstrap_seed": 0, "agent_model": "gpt-5.4", "held_out_score": null, "criterion_names": null, "per_criterion_scores": null, "failure_classification": null, "drafts_generated": 1, "drafts_survived": 1}
{"id": "9d8a420a-fc04-42cd-92a6-661f4433d3b5", "target_id": "B3-control", "git_sha": "f7c1975e23508df5a9838a4e21fb1f1506eea754", "pre_experiment_sha": "3cb8e256d8a8f17765dfa0955a45865f7f54392a", "timestamp": "2026-04-18T23:18:55.424626+00:00", "hypothesis": "Reduce allocations and comparisons by bucketing candidates by length and removing redundant deduplication tracking.", "hypothesis_source": "agent", "mutation_diff_summary": "", "score": 92.26, "score_ci_lower": null, "score_ci_upper": null, "raw_scores": null, "baseline_score": 122.73, "outcome": "KEPT", "failure_mode": null, "duration_seconds": 30.349776041926816, "tags": ["performance", "allocation-reduction", "pruning"], "learnings": "{\"what_changed\":\"\",\"what_improved\":[],\"what_regressed\":[],\"transferable_insight\":\"When a change simplifies bookkeeping without altering the core search space, it can still hurt performance if the added structure does not reduce enough work to offset its overhead.\",\"domain_tags\":[\"optimization\",\"performance\",\"algorithm-design\"]}", "cost_usd": 0.07855000000000001, "bootstrap_seed": 0, "agent_model": "gpt-5.4", "held_out_score": null, "criterion_names": null, "per_criterion_scores": null, "failure_classification": null, "drafts_generated": 1, "drafts_survived": 1}
{"id": "e1c12842-cd02-4a05-8b31-b8b77e3d4d56", "target_id": "B3-control", "git_sha": "798df2b7ed64615f9455118cf2f5e25ba2e938d8", "pre_experiment_sha": "f7c1975e23508df5a9838a4e21fb1f1506eea754", "timestamp": "2026-04-18T23:19:28.735945+00:00", "hypothesis": "Reduce candidate comparisons by grouping list_b by length once and skipping impossible pairs before Levenshtein.", "hypothesis_source": "agent", "mutation_diff_summary": "", "score": 91.71, "score_ci_lower": null, "score_ci_upper": null, "raw_scores": null, "baseline_score": 92.26, "outcome": "KEPT", "failure_mode": null, "duration_seconds": 30.347098125028424, "tags": ["length-bucketing", "early-pruning", "conservative-refactor"], "learnings": "{\"what_changed\":\"\",\"what_improved\":[],\"what_regressed\":[],\"transferable_insight\":\"Precompute simple, cheap groupings or bounds to eliminate impossible comparisons early, so expensive pairwise work is only done on plausible candidates.\",\"domain_tags\":[\"optimization\",\"algorithm design\",\"performance\"]}", "cost_usd": 0.08007, "bootstrap_seed": 0, "agent_model": "gpt-5.4", "held_out_score": null, "criterion_names": null, "per_criterion_scores": null, "failure_classification": null, "drafts_generated": 1, "drafts_survived": 1}
{"id": "54096162-2202-4ab6-bd25-e404915ca2dd", "target_id": "B3-control", "git_sha": "798df2b7ed64615f9455118cf2f5e25ba2e938d8", "pre_experiment_sha": "798df2b7ed64615f9455118cf2f5e25ba2e938d8", "timestamp": "2026-04-18T23:20:00.064029+00:00", "hypothesis": "Pre-bucketing list B by length and first character will reduce expensive distance checks while preserving identical results.", "hypothesis_source": "agent", "mutation_diff_summary": "", "score": 99999.0, "score_ci_lower": null, "score_ci_upper": null, "raw_scores": null, "baseline_score": 91.71, "outcome": "DISCARDED", "failure_mode": null, "duration_seconds": 30.274563499959186, "tags": ["length-bucketing", "prefix-bucketing", "conservative-refactor"], "learnings": "{\"what_changed\":\"\",\"what_improved\":[],\"what_regressed\":[],\"transferable_insight\":\"Adding a cheap pre-filter can greatly reduce expensive comparisons, but if it does not preserve the exact candidate set it is not a valid optimization despite apparent efficiency gains.\",\"domain_tags\":[\"optimization\",\"algorithm-design\",\"performance\"]}", "cost_usd": 0.0813854, "bootstrap_seed": 0, "agent_model": "gpt-5.4", "held_out_score": null, "criterion_names": null, "per_criterion_scores": null, "failure_classification": {"category": "incomplete_edit", "description": "The experiment failed with an unspecified/unknown failure mode and an extreme score value (99999), suggesting the change may have been partially applied or left the system in an inconsistent state rather than a clean logic/syntax/format issue.", "fix_direction": "Reproduce with logs/stack trace to identify the actual failing mechanism; verify pre-bucketing preserves identical ordering/content (including edge cases like empty strings, same length but different first chars), and ensure the implementation fully replaces the distance-check loop without skipping or duplicating comparisons.", "confidence": 0.42}, "drafts_generated": 1, "drafts_survived": 1}
{"id": "692ec9ac-8cd9-4049-98c8-6673a5dc4b44", "target_id": "B3-control", "git_sha": "798df2b7ed64615f9455118cf2f5e25ba2e938d8", "pre_experiment_sha": "798df2b7ed64615f9455118cf2f5e25ba2e938d8", "timestamp": "2026-04-18T23:20:33.137898+00:00", "hypothesis": "Pre-group both lists by length and iterate only matching length buckets to reduce repeated range lookups and candidate scans.", "hypothesis_source": "agent", "mutation_diff_summary": "", "score": 92.37, "score_ci_lower": null, "score_ci_upper": null, "raw_scores": null, "baseline_score": 91.71, "outcome": "DISCARDED", "failure_mode": null, "duration_seconds": 29.653623583028093, "tags": ["length-bucketing", "conservative", "deterministic"], "learnings": "{\"what_changed\":\"\",\"what_improved\":[],\"what_regressed\":[],\"transferable_insight\":\"Partitioning data into matching buckets can simplify iteration, but if the added grouping and lookup overhead does not eliminate enough work, the optimization may provide no measurable benefit.\",\"domain_tags\":[\"optimization\",\"algorithm-design\",\"performance\"]}", "cost_usd": 0.0811062, "bootstrap_seed": 0, "agent_model": "gpt-5.4", "held_out_score": null, "criterion_names": null, "per_criterion_scores": null, "failure_classification": {"category": "over_optimization", "description": "The attempted optimization (pre-bucketing by length to avoid range lookups and reduce scans) appears to have caused the overall experiment to fail despite likely being logically reasonable, suggesting the change may have unintentionally altered matching behavior or edge-case coverage that the evaluation relied on.", "fix_direction": "Validate equivalence to the original logic across all edge cases (especially boundaries and ties), add tests covering varying lengths/distributions, and only optimize after confirming identical candidate selection semantics.", "confidence": 0.62}, "drafts_generated": 1, "drafts_survived": 1}
{"id": "2630d833-f514-45d4-baf0-34ed91105abe", "target_id": "B3-control", "git_sha": "798df2b7ed64615f9455118cf2f5e25ba2e938d8", "pre_experiment_sha": "798df2b7ed64615f9455118cf2f5e25ba2e938d8", "timestamp": "2026-04-18T23:21:07.111978+00:00", "hypothesis": "Precompute and reuse non-empty length buckets for list_a to skip impossible scans while preserving exact pair ordering.", "hypothesis_source": "agent", "mutation_diff_summary": "", "score": 92.17, "score_ci_lower": null, "score_ci_upper": null, "raw_scores": null, "baseline_score": 91.71, "outcome": "DISCARDED", "failure_mode": null, "duration_seconds": 28.3089279999258, "tags": ["length-bucketing", "safe-refactor", "fewer-comparisons"], "learnings": "{\"what_changed\":\"\",\"what_improved\":[],\"what_regressed\":[],\"transferable_insight\":\"Precomputing and reusing compact summaries of data can eliminate futile work when the summaries preserve the exact conditions needed for correctness.\",\"domain_tags\":[\"optimization\",\"algorithm design\",\"performance\"]}", "cost_usd": 0.0821138, "bootstrap_seed": 0, "agent_model": "gpt-5.4", "held_out_score": null, "criterion_names": null, "per_criterion_scores": null, "failure_classification": {"category": "incomplete_edit", "description": "The experiment failed in a way consistent with an incomplete or inconsistent implementation\u2014e.g., precomputing/reusing length buckets did not fully preserve ordering or handling of edge cases, leaving part of the pipeline inconsistent with the original pair-scan semantics.", "fix_direction": "Verify bucket reuse is integrated end-to-end: ensure non-empty bucket generation, filtering, and pair emission preserve exact ordering and cover all lengths/edge cases; add tests that compare against the baseline scan for full pair sequences.", "confidence": 0.62}, "drafts_generated": 1, "drafts_survived": 1}
{"id": "19a69303-99ee-4ccc-8d3d-058b7016ff37", "target_id": "B3-control", "git_sha": "4da735b6a8dcad6a0b99435dd4ea24de2968d102", "pre_experiment_sha": "798df2b7ed64615f9455118cf2f5e25ba2e938d8", "timestamp": "2026-04-18T23:21:43.887288+00:00", "hypothesis": "Avoid building and scanning impossible length ranges by iterating only existing length buckets for comparisons.", "hypothesis_source": "agent", "mutation_diff_summary": "", "score": 91.56, "score_ci_lower": null, "score_ci_upper": null, "raw_scores": null, "baseline_score": 91.71, "outcome": "KEPT", "failure_mode": null, "duration_seconds": 33.97113125002943, "tags": ["length-bucketing", "safe-refactor", "fewer-iterations"], "learnings": "{\"what_changed\":\"\",\"what_improved\":[],\"what_regressed\":[],\"transferable_insight\":\"When comparing or filtering by size, iterating only over actually present buckets instead of all theoretical ranges reduces wasted work and improves efficiency.\",\"domain_tags\":[\"optimization\",\"iteration\",\"data-structures\"]}", "cost_usd": 0.080785, "bootstrap_seed": 0, "agent_model": "gpt-5.4", "held_out_score": null, "criterion_names": null, "per_criterion_scores": null, "failure_classification": null, "drafts_generated": 1, "drafts_survived": 1}
{"id": "e937c8f4-a27a-4150-a24a-84b03b789d06", "target_id": "B3-control", "git_sha": "4da735b6a8dcad6a0b99435dd4ea24de2968d102", "pre_experiment_sha": "4da735b6a8dcad6a0b99435dd4ea24de2968d102", "timestamp": "2026-04-18T23:22:14.064210+00:00", "hypothesis": "Reduce repeated scans of sorted length keys by iterating only the relevant length range and fetching buckets directly.", "hypothesis_source": "agent", "mutation_diff_summary": "", "score": 92.14, "score_ci_lower": null, "score_ci_upper": null, "raw_scores": null, "baseline_score": 91.56, "outcome": "DISCARDED", "failure_mode": null, "duration_seconds": 29.147421166999266, "tags": ["length-bucketing", "loop-reduction", "safe-refactor"], "learnings": "{\"what_changed\":\"\",\"what_improved\":[],\"what_regressed\":[],\"transferable_insight\":\"When an optimization adds complexity without measurable gains or regressions, it is often better to discard it and preserve the simpler approach.\",\"domain_tags\":[\"optimization\",\"engineering\",\"decision-making\"]}", "cost_usd": 0.0808058, "bootstrap_seed": 0, "agent_model": "gpt-5.4", "held_out_score": null, "criterion_names": null, "per_criterion_scores": null, "failure_classification": {"category": "logic_error", "description": "The intended optimization (iterate only the relevant length range and fetch buckets directly) likely introduced an incorrect mapping or off-by-range behavior, causing the experiment to fail despite the optimization concept being sound.", "fix_direction": "Validate the computed length range boundaries and bucket indexing/mapping; add targeted tests for edge cases (min/max lengths, empty ranges, single-length buckets) and compare results against the original implementation for correctness.", "confidence": 0.63}, "drafts_generated": 1, "drafts_survived": 1}
{"id": "035daa39-d055-4ef9-8b6b-17b781d1631d", "target_id": "B3-control", "git_sha": "4da735b6a8dcad6a0b99435dd4ea24de2968d102", "pre_experiment_sha": "4da735b6a8dcad6a0b99435dd4ea24de2968d102", "timestamp": "2026-04-18T23:22:49.207760+00:00", "hypothesis": "Iterate only over existing relevant length buckets via direct dictionary lookups instead of scanning all sorted bucket lengths for every source string.", "hypothesis_source": "agent", "mutation_diff_summary": "", "score": 91.56, "score_ci_lower": null, "score_ci_upper": null, "raw_scores": null, "baseline_score": 91.56, "outcome": "DISCARDED", "failure_mode": null, "duration_seconds": 30.059037458035164, "tags": ["length-bucketing", "early-skip", "allocation-reduction", "conservative"], "learnings": "{\"what_changed\":\"\",\"what_improved\":[],\"what_regressed\":[],\"transferable_insight\":\"Replacing a full scan with targeted lookups only helps when the lookup overhead is lower than the cost of iterating the existing candidates; otherwise, the optimization may be neutral or not worth the added complexity.\",\"domain_tags\":[\"optimization\",\"algorithm-design\",\"performance-tradeoffs\"]}", "cost_usd": 0.081018, "bootstrap_seed": 0, "agent_model": "gpt-5.4", "held_out_score": null, "criterion_names": null, "per_criterion_scores": null, "failure_classification": {"category": "logic_error", "description": "The attempted optimization (direct dictionary lookups over length buckets) likely missed or mis-handled cases where the relevant bucket lengths are not directly present/available, causing incorrect selection/iteration of buckets compared to the intended scan-based logic.", "fix_direction": "Ensure the lookup-based iteration preserves the exact prior semantics: define precisely which length keys must exist, add fallback behavior for missing buckets, and validate against boundary cases (e.g., no matching buckets, off-by-one length ranges).", "confidence": 0.62}, "drafts_generated": 1, "drafts_survived": 1}
{"id": "8d99ec6f-8e1c-47a6-afef-25d6672ccfe4", "target_id": "B3-control", "git_sha": "4da735b6a8dcad6a0b99435dd4ea24de2968d102", "pre_experiment_sha": "4da735b6a8dcad6a0b99435dd4ea24de2968d102", "timestamp": "2026-04-18T23:23:23.088372+00:00", "hypothesis": "Reuse contiguous existing length buckets directly to avoid repeatedly scanning all sorted lengths for every source string.", "hypothesis_source": "agent", "mutation_diff_summary": "", "score": 94.87, "score_ci_lower": null, "score_ci_upper": null, "raw_scores": null, "baseline_score": 91.56, "outcome": "DISCARDED", "failure_mode": null, "duration_seconds": 31.190534458030015, "tags": ["length-bucketing", "early-skip", "conservative-refactor"], "learnings": "{\"what_changed\":\"\",\"what_improved\":[],\"what_regressed\":[],\"transferable_insight\":\"When a proposed optimization only reuses existing grouped structure without reducing the underlying repeated work, it may add complexity without measurable benefit and should be discarded.\",\"domain_tags\":[\"optimization\",\"algorithm-design\",\"performance\"]}", "cost_usd": 0.0811222, "bootstrap_seed": 0, "agent_model": "gpt-5.4", "held_out_score": null, "criterion_names": null, "per_criterion_scores": null, "failure_classification": {"category": "logic_error", "description": "The change intended to speed up processing by reusing existing contiguous length buckets, but the experiment failed due to incorrect handling of how buckets are reused across source strings\u2014leading to mismatched/incorrect mapping between source strings and candidate lengths (i.e., wrong results rather than just slower execution).", "fix_direction": "Verify bucket reuse invariants: ensure bucket contents/indices are valid for each new source string, add correctness checks comparing reused-bucket outputs to a baseline scan, and tighten boundary conditions for contiguous length ranges.", "confidence": 0.74}, "drafts_generated": 1, "drafts_survived": 1}
{"id": "d83d541d-8fe6-42b0-b278-458f93bd0e7f", "target_id": "B3-control", "git_sha": "924baa76ae9c0db9ef507e7925f039c54ac6fd65", "pre_experiment_sha": "4da735b6a8dcad6a0b99435dd4ea24de2968d102", "timestamp": "2026-04-18T23:23:55.501639+00:00", "hypothesis": "Avoid scanning all sorted length keys for every source string by iterating only relevant existing length buckets.", "hypothesis_source": "agent", "mutation_diff_summary": "", "score": 92.11, "score_ci_lower": null, "score_ci_upper": null, "raw_scores": null, "baseline_score": 91.56, "outcome": "KEPT", "failure_mode": null, "duration_seconds": 29.686660375096835, "tags": ["length-bucketing", "early-skip", "conservative"], "learnings": "{\"what_changed\":\"\",\"what_improved\":[],\"what_regressed\":[],\"transferable_insight\":\"Restricting work to only the existing buckets or candidates that can actually match the current item can preserve correctness while reducing unnecessary iteration overhead.\",\"domain_tags\":[\"optimization\",\"algorithm design\",\"performance\"]}", "cost_usd": 0.08097, "bootstrap_seed": 0, "agent_model": "gpt-5.4", "held_out_score": null, "criterion_names": null, "per_criterion_scores": null, "failure_classification": null, "drafts_generated": 1, "drafts_survived": 1}
{"id": "c79df55b-1ca9-4971-9e06-38fff65c412c", "target_id": "B3-control", "git_sha": "2f4f94ccb76b4cdbc9c20512ff1a8d10db5012ca", "pre_experiment_sha": "924baa76ae9c0db9ef507e7925f039c54ac6fd65", "timestamp": "2026-04-18T23:24:28.670437+00:00", "hypothesis": "Reuse precomputed non-empty length buckets and iterate only relevant existing buckets to reduce repeated scans and lookups without changing output order.", "hypothesis_source": "agent", "mutation_diff_summary": "", "score": 91.74, "score_ci_lower": null, "score_ci_upper": null, "raw_scores": null, "baseline_score": 92.11, "outcome": "KEPT", "failure_mode": null, "duration_seconds": 29.166984500014223, "tags": ["performance", "length-bucketing", "conservative-refactor"], "learnings": "{\"what_changed\":\"\",\"what_improved\":[],\"what_regressed\":[],\"transferable_insight\":\"Caching and reusing precomputed groupings can reduce redundant work by limiting iteration to only the non-empty, relevant subsets while preserving the original output order.\",\"domain_tags\":[\"optimization\",\"algorithm design\",\"performance\"]}", "cost_usd": 0.08163000000000001, "bootstrap_seed": 0, "agent_model": "gpt-5.4", "held_out_score": null, "criterion_names": null, "per_criterion_scores": null, "failure_classification": null, "drafts_generated": 1, "drafts_survived": 1}
