{"id": "03d82864-b6a6-42d5-9496-c49daffb9f36", "target_id": "B3-control", "git_sha": "ac2142a6b58b40dc0fb0291ab5a667030ba48998", "pre_experiment_sha": "ac2142a6b58b40dc0fb0291ab5a667030ba48998", "timestamp": "2026-04-18T23:31:57.353832+00:00", "hypothesis": "Reuse the precomputed non-empty length buckets directly in the main loop while avoiding redundant per-comparison length checks.", "hypothesis_source": "agent", "mutation_diff_summary": "", "score": 93.26, "score_ci_lower": null, "score_ci_upper": null, "raw_scores": null, "baseline_score": 91.68, "outcome": "DISCARDED", "failure_mode": null, "duration_seconds": 29.84151162498165, "tags": ["performance", "conservative", "bucket-reuse", "deterministic"], "learnings": "{\"what_changed\":\"\",\"what_improved\":[],\"what_regressed\":[],\"transferable_insight\":\"Precomputing and reusing filtered groups can simplify the main loop, but it only helps when the extra bookkeeping actually removes meaningful repeated work.\",\"domain_tags\":[\"optimization\",\"performance\",\"algorithm-design\"]}", "cost_usd": 0.08492340000000001, "bootstrap_seed": 0, "agent_model": "gpt-5.4", "held_out_score": null, "criterion_names": null, "per_criterion_scores": null, "failure_classification": {"category": "logic_error", "description": "The provided information does not specify what failed in the experiment\u2014only the hypothesis, an unspecified failure mode (\u201cunknown\u201d), and a high score. Without details on the actual incorrect output, code error, or behavior change, the failure cannot be reliably classified.", "fix_direction": "Provide the observed failing behavior (error logs, diff, failing test cases, or which metric/criterion failed) so the issue can be mapped to output/logic/regression/syntax/etc.", "confidence": 0.12}, "drafts_generated": 1, "drafts_survived": 1}
{"id": "61de8b53-93ef-4446-968e-887c1d71f463", "target_id": "B3-control", "git_sha": "ac2142a6b58b40dc0fb0291ab5a667030ba48998", "pre_experiment_sha": "ac2142a6b58b40dc0fb0291ab5a667030ba48998", "timestamp": "2026-04-18T23:32:29.351759+00:00", "hypothesis": "Reuse precomputed non-empty target buckets directly and avoid rebuilding candidate bucket tuples per source length.", "hypothesis_source": "agent", "mutation_diff_summary": "", "score": 94.2, "score_ci_lower": null, "score_ci_upper": null, "raw_scores": null, "baseline_score": 91.68, "outcome": "DISCARDED", "failure_mode": null, "duration_seconds": 29.573652125080116, "tags": ["performance", "deterministic", "bucket-reuse", "minimal-refactor"], "learnings": "{\"what_changed\":\"\",\"what_improved\":[],\"what_regressed\":[],\"transferable_insight\":\"When an optimization only reuses precomputed structures without reducing the core work, it may add complexity without measurable benefit and should be discarded unless it changes the dominant cost.\",\"domain_tags\":[\"optimization\",\"performance-engineering\"]}", "cost_usd": 0.08290180000000001, "bootstrap_seed": 0, "agent_model": "gpt-5.4", "held_out_score": null, "criterion_names": null, "per_criterion_scores": null, "failure_classification": {"category": "over_optimization", "description": "The attempt achieved a high score while asserting reuse of precomputed non-empty target buckets and avoiding rebuilding candidate bucket tuples. This strongly suggests the change may have improved the evaluation metric by exploiting assumptions/edge handling in the evaluator rather than reliably preserving the intended logic across all cases, leading to a failure labeled with unknown mode.", "fix_direction": "Verify correctness across comprehensive test cases (including edge cases for empty/non-empty buckets and varying source lengths), and ensure candidate bucket tuples are reused only when their validity is guaranteed for the current source length and matching semantics\u2014not just for metric behavior.", "confidence": 0.62}, "drafts_generated": 1, "drafts_survived": 1}
{"id": "c8d77730-32da-481f-bace-86174f971027", "target_id": "B3-control", "git_sha": "ac2142a6b58b40dc0fb0291ab5a667030ba48998", "pre_experiment_sha": "ac2142a6b58b40dc0fb0291ab5a667030ba48998", "timestamp": "2026-04-18T23:33:05.667582+00:00", "hypothesis": "Reuse the one-time non-empty length buckets directly and avoid rebuilding per-length candidate bucket tuples.", "hypothesis_source": "agent", "mutation_diff_summary": "", "score": 95.08, "score_ci_lower": null, "score_ci_upper": null, "raw_scores": null, "baseline_score": 91.68, "outcome": "DISCARDED", "failure_mode": null, "duration_seconds": 30.888935624971054, "tags": ["performance", "deterministic", "buckets", "conservative-refactor"], "learnings": "{\"what_changed\":\"\",\"what_improved\":[],\"what_regressed\":[],\"transferable_insight\":\"When a proposed optimization only reuses existing intermediate groupings without changing the underlying work, it is unlikely to yield meaningful gains and should be discarded unless it reduces actual computation or memory traffic.\",\"domain_tags\":[\"optimization\",\"performance\",\"software-engineering\"]}", "cost_usd": 0.0831398, "bootstrap_seed": 0, "agent_model": "gpt-5.4", "held_out_score": null, "criterion_names": null, "per_criterion_scores": null, "failure_classification": {"category": "incomplete_edit", "description": "The hypothesis suggests reusing precomputed non-empty length buckets, but the experiment failed with an 'unknown' failure mode, implying the change was only partially applied\u2014likely leaving an inconsistent state such as some code paths still rebuilding per-length candidate tuples or not fully integrating the reused buckets.", "fix_direction": "Ensure all candidate-bucket construction paths consistently use the reused one-time non-empty length buckets; verify end-to-end data flow and remove any remaining per-length tuple rebuilding so the system is internally consistent.", "confidence": 0.62}, "drafts_generated": 1, "drafts_survived": 1}
{"id": "d636b76b-ed5c-4a52-acb2-24d0ae00e346", "target_id": "B3-control", "git_sha": "33bd2d9652490843f1939b791c108ad5f2341079", "pre_experiment_sha": "ac2142a6b58b40dc0fb0291ab5a667030ba48998", "timestamp": "2026-04-18T23:33:37.442583+00:00", "hypothesis": "Reuse precomputed non-empty length buckets directly and avoid rebuilding unique source-length scans.", "hypothesis_source": "agent", "mutation_diff_summary": "", "score": 92.35, "score_ci_lower": null, "score_ci_upper": null, "raw_scores": null, "baseline_score": 91.68, "outcome": "KEPT", "failure_mode": null, "duration_seconds": 29.270729959011078, "tags": ["performance", "buckets", "deterministic-safe", "conservative"], "learnings": "{\"what_changed\":\"\",\"what_improved\":[],\"what_regressed\":[],\"transferable_insight\":\"Reusing precomputed grouped summaries instead of recomputing them from raw data can improve efficiency without changing results.\",\"domain_tags\":[\"optimization\",\"data-processing\",\"caching\"]}", "cost_usd": 0.08415, "bootstrap_seed": 0, "agent_model": "gpt-5.4", "held_out_score": null, "criterion_names": null, "per_criterion_scores": null, "failure_classification": null, "drafts_generated": 1, "drafts_survived": 1}
{"id": "46b94c1d-c7f3-4f96-8a57-87cf5d2f585e", "target_id": "B3-control", "git_sha": "33bd2d9652490843f1939b791c108ad5f2341079", "pre_experiment_sha": "33bd2d9652490843f1939b791c108ad5f2341079", "timestamp": "2026-04-18T23:34:08.297217+00:00", "hypothesis": "Reuse precomputed non-empty length buckets via indexed bounds to avoid per-item bucket rescans while preserving comparison order.", "hypothesis_source": "agent", "mutation_diff_summary": "", "score": 93.7, "score_ci_lower": null, "score_ci_upper": null, "raw_scores": null, "baseline_score": 92.35, "outcome": "DISCARDED", "failure_mode": null, "duration_seconds": 29.90826170798391, "tags": ["performance", "deterministic", "bucket-reuse", "conservative"], "learnings": "{\"what_changed\":\"\",\"what_improved\":[],\"what_regressed\":[],\"transferable_insight\":\"When an optimization adds indexing or caching to skip repeated scans, it only helps if the lookup cost is lower than the saved work and the original ordering or correctness constraints are still preserved.\",\"domain_tags\":[\"optimization\",\"algorithm-design\",\"performance\"]}", "cost_usd": 0.08565320000000001, "bootstrap_seed": 0, "agent_model": "gpt-5.4", "held_out_score": null, "criterion_names": null, "per_criterion_scores": null, "failure_classification": {"category": "logic_error", "description": "Failure mode is unspecified (\"unknown\"), so the nature of the failure cannot be determined from the provided information.", "fix_direction": "Investigate the actual failing behavior (logs/diffs/tests) to determine whether order/comparison semantics were preserved, whether bucket bounds were reused correctly, and whether any invariants were violated; then adjust the indexed-bound reuse logic accordingly.", "confidence": 0.05}, "drafts_generated": 1, "drafts_survived": 1}
{"id": "7ebdb841-1220-4790-9798-d332839b5115", "target_id": "B3-control", "git_sha": "33bd2d9652490843f1939b791c108ad5f2341079", "pre_experiment_sha": "33bd2d9652490843f1939b791c108ad5f2341079", "timestamp": "2026-04-18T23:34:42.914983+00:00", "hypothesis": "Precompute and reuse the exact non-empty relevant length buckets for list A lengths to avoid repeated per-item bucket filtering while preserving comparison order.", "hypothesis_source": "agent", "mutation_diff_summary": "", "score": 93.61, "score_ci_lower": null, "score_ci_upper": null, "raw_scores": null, "baseline_score": 92.35, "outcome": "DISCARDED", "failure_mode": null, "duration_seconds": 29.6708106250735, "tags": ["performance", "deterministic", "conservative", "bucket-reuse"], "learnings": "{\"what_changed\":\"\",\"what_improved\":[],\"what_regressed\":[],\"transferable_insight\":\"Precomputing and reusing exact grouping boundaries can reduce repeated filtering work without changing ordering, but only if the grouping logic is stable and the overhead of maintaining the cache is justified.\",\"domain_tags\":[\"optimization\",\"caching\",\"algorithm-design\"]}", "cost_usd": 0.0846766, "bootstrap_seed": 0, "agent_model": "gpt-5.4", "held_out_score": null, "criterion_names": null, "per_criterion_scores": null, "failure_classification": {"category": "incomplete_edit", "description": "The experiment is described as a optimization to precompute and reuse length buckets, but the failure mode is marked as unknown and no clear evidence is provided that all necessary bucket filtering and ordering semantics were fully preserved. This suggests the change may be partial/inconsistent (e.g., reusing buckets in some cases but still re-filtering or missing edge cases for empty or boundary lengths), leading to a correctness failure despite a high score.", "fix_direction": "Ensure the precomputed non-empty length buckets fully cover all relevant cases and preserve the exact ordering semantics of the original per-item bucket filtering; add targeted tests for boundary lengths and verify equivalence against the original implementation for all list-length distributions.", "confidence": 0.46}, "drafts_generated": 1, "drafts_survived": 1}
{"id": "aa1e4d4c-8e65-4c21-bb8e-442c74798910", "target_id": "B3-control", "git_sha": "25f52f667269f477f26fd8a53023d7d24d00d924", "pre_experiment_sha": "33bd2d9652490843f1939b791c108ad5f2341079", "timestamp": "2026-04-18T23:35:14.959695+00:00", "hypothesis": "Precompute and reuse the non-empty relevant length buckets once per source-length to avoid repeated bucket filtering while preserving comparison order.", "hypothesis_source": "agent", "mutation_diff_summary": "", "score": 91.66, "score_ci_lower": null, "score_ci_upper": null, "raw_scores": null, "baseline_score": 92.35, "outcome": "KEPT", "failure_mode": null, "duration_seconds": 29.18972916691564, "tags": ["performance", "deterministic", "conservative", "bucket-reuse"], "learnings": "{\"what_changed\":\"\",\"what_improved\":[],\"what_regressed\":[],\"transferable_insight\":\"When the same filtered grouping is needed repeatedly for a fixed input, precomputing and reusing it can reduce redundant work without changing the order of comparisons.\",\"domain_tags\":[\"optimization\",\"caching\",\"algorithm-design\"]}", "cost_usd": 0.084425, "bootstrap_seed": 0, "agent_model": "gpt-5.4", "held_out_score": null, "criterion_names": null, "per_criterion_scores": null, "failure_classification": null, "drafts_generated": 1, "drafts_survived": 1}
{"id": "c8e0d3ae-fe77-41e7-a9fd-2ebae22e6c6a", "target_id": "B3-control", "git_sha": "25f52f667269f477f26fd8a53023d7d24d00d924", "pre_experiment_sha": "25f52f667269f477f26fd8a53023d7d24d00d924", "timestamp": "2026-04-18T23:35:44.188331+00:00", "hypothesis": "Reuse precomputed relevant non-empty buckets per source length and remove the redundant per-bucket length-difference check.", "hypothesis_source": "agent", "mutation_diff_summary": "", "score": 95.02, "score_ci_lower": null, "score_ci_upper": null, "raw_scores": null, "baseline_score": 91.66, "outcome": "DISCARDED", "failure_mode": null, "duration_seconds": 28.218031500000507, "tags": ["performance", "conservative", "bucket-reuse"], "learnings": "{\"what_changed\":\"\",\"what_improved\":[],\"what_regressed\":[],\"transferable_insight\":\"Precomputing and reusing a filtered candidate set can simplify logic, but if the added bookkeeping does not eliminate meaningful work, it may not produce measurable gains.\",\"domain_tags\":[\"optimization\",\"software-engineering\",\"performance\"]}", "cost_usd": 0.08374240000000001, "bootstrap_seed": 0, "agent_model": "gpt-5.4", "held_out_score": null, "criterion_names": null, "per_criterion_scores": null, "failure_classification": {"category": "over_optimization", "description": "The attempted change likely removed or bypassed a length-difference check to improve performance/metric, but the resulting behavior appears to rely on assumptions about bucket validity that were not guaranteed across all cases. The high score but 'unknown' failure mode suggests the optimization may have gamed or shifted evaluation conditions rather than preserving the original correctness for all inputs.", "fix_direction": "Reintroduce or preserve correctness guards at the right level (e.g., validate bucket relevance when reused across lengths), and add targeted tests for edge cases where source length differs from cached bucket expectations to ensure the optimization doesn\u2019t alter semantics.", "confidence": 0.62}, "drafts_generated": 1, "drafts_survived": 1}
{"id": "61d65727-eb24-4445-8fd2-d20078ac4f30", "target_id": "B3-control", "git_sha": "25f52f667269f477f26fd8a53023d7d24d00d924", "pre_experiment_sha": "25f52f667269f477f26fd8a53023d7d24d00d924", "timestamp": "2026-04-18T23:36:22.089611+00:00", "hypothesis": "Precompute the non-empty source-length buckets once and reuse them directly in the main loop to avoid rebuilding per-length candidate mappings.", "hypothesis_source": "agent", "mutation_diff_summary": "", "score": 93.25, "score_ci_lower": null, "score_ci_upper": null, "raw_scores": null, "baseline_score": 91.66, "outcome": "DISCARDED", "failure_mode": null, "duration_seconds": 30.185685792006552, "tags": ["performance", "conservative-refactor", "bucket-reuse"], "learnings": "{\"what_changed\":\"\",\"what_improved\":[],\"what_regressed\":[],\"transferable_insight\":\"Precomputing reusable grouped structures can reduce repeated work, but only if the grouping itself is actually a bottleneck and the reuse path does not introduce offsetting overhead or complexity.\",\"domain_tags\":[\"optimization\",\"performance-engineering\",\"software-design\"]}", "cost_usd": 0.08449940000000002, "bootstrap_seed": 0, "agent_model": "gpt-5.4", "held_out_score": null, "criterion_names": null, "per_criterion_scores": null, "failure_classification": {"category": "over_optimization", "description": "The change appears aimed at precomputing and reusing candidate mappings to improve the metric, but the experiment is marked as failed with an unknown failure mode, suggesting the optimization likely caused evaluation-gaming or unintended behavioral mismatch rather than fixing a true logic/format issue.", "fix_direction": "Verify behavioral equivalence of the precomputed buckets versus the original per-length construction (especially ordering, filtering criteria, and any hidden assumptions), and add invariant checks/tests to ensure reused mappings match the baseline outputs for multiple seeds/cases.", "confidence": 0.46}, "drafts_generated": 1, "drafts_survived": 1}
{"id": "1ab2c8c1-23db-416d-980e-7091e2b65eb8", "target_id": "B3-control", "git_sha": "25f52f667269f477f26fd8a53023d7d24d00d924", "pre_experiment_sha": "25f52f667269f477f26fd8a53023d7d24d00d924", "timestamp": "2026-04-18T23:36:54.584797+00:00", "hypothesis": "Precompute and reuse the exact relevant non-empty B-length buckets once per source length to remove repeated bucket scans without changing comparison order.", "hypothesis_source": "agent", "mutation_diff_summary": "", "score": 94.04, "score_ci_lower": null, "score_ci_upper": null, "raw_scores": null, "baseline_score": 91.66, "outcome": "DISCARDED", "failure_mode": null, "duration_seconds": 30.011245292029344, "tags": ["performance", "deterministic", "conservative", "bucket-reuse"], "learnings": "{\"what_changed\":\"\",\"what_improved\":[],\"what_regressed\":[],\"transferable_insight\":\"Precomputing reusable lookup structures only helps when the avoided work is substantial enough to outweigh the overhead of building and storing them; otherwise, the optimization may be neutral even if it preserves behavior exactly.\",\"domain_tags\":[\"optimization\",\"performance-engineering\",\"algorithm-design\"]}", "cost_usd": 0.08500519999999999, "bootstrap_seed": 0, "agent_model": "gpt-5.4", "held_out_score": null, "criterion_names": null, "per_criterion_scores": null, "failure_classification": {"category": "incomplete_edit", "description": "The change intent is clear (precompute/reuse B-length buckets), but the experiment failed with an unknown failure mode, suggesting the implementation likely left an inconsistent/partial state (e.g., precompute only for some paths, missed updating all call sites, or reused buckets without ensuring exact same ordering/comparison semantics).", "fix_direction": "Verify full integration: ensure all bucket scans are replaced with the precomputed cache for every relevant code path, maintain identical bucket contents and ordering, and add tests/trace logs to confirm the comparison sequence is unchanged.", "confidence": 0.46}, "drafts_generated": 1, "drafts_survived": 1}
{"id": "0b05d045-0fa0-4293-b404-fd97abf833d7", "target_id": "B3-control", "git_sha": "36ba68b8e83a4911b4ca1257660a890595442bf4", "pre_experiment_sha": "25f52f667269f477f26fd8a53023d7d24d00d924", "timestamp": "2026-04-18T23:37:26.463036+00:00", "hypothesis": "Reuse the precomputed non-empty length buckets directly per source item and remove the redundant per-length bucket map.", "hypothesis_source": "agent", "mutation_diff_summary": "", "score": 91.55, "score_ci_lower": null, "score_ci_upper": null, "raw_scores": null, "baseline_score": 91.66, "outcome": "KEPT", "failure_mode": null, "duration_seconds": 29.22600012505427, "tags": ["performance", "conservative", "buckets"], "learnings": "{\"what_changed\":\"\",\"what_improved\":[],\"what_regressed\":[],\"transferable_insight\":\"When a precomputed grouping already captures the needed non-empty partitions, reusing it directly can simplify the implementation without changing behavior, though it may not yield measurable gains.\",\"domain_tags\":[\"software-engineering\",\"optimization\"]}", "cost_usd": 0.082825, "bootstrap_seed": 0, "agent_model": "gpt-5.4", "held_out_score": null, "criterion_names": null, "per_criterion_scores": null, "failure_classification": null, "drafts_generated": 1, "drafts_survived": 1}
