{"id": "863bc889-65ba-4e9b-b606-a391a7fd4696", "target_id": "B3-control", "git_sha": "a89bb15247d809d7c8cb33faae14a84e087806b4", "pre_experiment_sha": "76f83f9673389a90b202b22218530a872793f1ae", "timestamp": "2026-04-23T12:57:37.391841+00:00", "hypothesis": "Optimize the fast-path in `_levenshtein` by removing redundant `diff > threshold` checks, inlining `t_mid` to avoid unconditional string allocations, and maintaining exhaustive O(1) slice comparisons for threshold=2.", "hypothesis_source": "agent", "mutation_diff_summary": "", "score": 3.83, "score_ci_lower": null, "score_ci_upper": null, "raw_scores": null, "baseline_score": 3.77, "outcome": "KEPT", "failure_mode": null, "duration_seconds": 240.00252679199912, "tags": ["fast-path", "slice-comparison", "memory-allocation", "bounds-check"], "learnings": "{\"what_changed\":\"\",\"what_improved\":[],\"what_regressed\":[],\"transferable_insight\":\"Eliminating redundant conditional checks and avoiding unconditional memory allocations in fast-path execution improves overall performance.\",\"domain_tags\":[\"Performance Optimization\",\"Memory Management\",\"Algorithm Design\"]}", "cost_usd": 0.0466475, "bootstrap_seed": 0, "agent_model": "gemini-3.1-pro-preview", "held_out_score": null, "criterion_names": null, "per_criterion_scores": null, "failure_classification": null, "drafts_generated": 1, "drafts_survived": 1}
{"id": "f76bfb76-c31c-4df9-af2c-5798564ff0b2", "target_id": "B3-control", "git_sha": "6a80849133ccf5a4d0d90154c0d712885a5488a1", "pre_experiment_sha": "a89bb15247d809d7c8cb33faae14a84e087806b4", "timestamp": "2026-04-23T13:01:02.636686+00:00", "hypothesis": "Optimize suffix stripping by using fast negative indexing with `~suff`, streamline exact slice comparisons by reusing `end_s` for equal-length strings, and use localized `results.append` to reduce name lookups.", "hypothesis_source": "agent", "mutation_diff_summary": "", "score": 3.86, "score_ci_lower": null, "score_ci_upper": null, "raw_scores": null, "baseline_score": 3.83, "outcome": "KEPT", "failure_mode": null, "duration_seconds": 198.0982030420564, "tags": ["string-matching", "fast-path", "list-comprehension", "loop-optimization"], "learnings": "{\"what_changed\":\"\",\"what_improved\":[],\"what_regressed\":[],\"transferable_insight\":\"Reducing overhead in repetitive operations by caching method references locally, reusing length variables, and employing efficient indexing techniques improves overall execution speed.\",\"domain_tags\":[\"Performance Optimization\",\"Code Efficiency\",\"Micro-optimization\"]}", "cost_usd": 0.04667, "bootstrap_seed": 0, "agent_model": "gemini-3.1-pro-preview", "held_out_score": null, "criterion_names": null, "per_criterion_scores": null, "failure_classification": null, "drafts_generated": 1, "drafts_survived": 1}
{"id": "4147ed32-691a-4573-9aa8-4f7d5847c735", "target_id": "B3-control", "git_sha": "c434641b2bfbdf0fca44ba80f3f62685dafeaab7", "pre_experiment_sha": "6a80849133ccf5a4d0d90154c0d712885a5488a1", "timestamp": "2026-04-23T13:05:15.159919+00:00", "hypothesis": "Optimize suffix bound calculation by caching `max_suff = len_s - pref` to avoid repeated subtractions in the `while` loop condition, and reuse it for `rem_s`.", "hypothesis_source": "agent", "mutation_diff_summary": "", "score": 4.05, "score_ci_lower": null, "score_ci_upper": null, "raw_scores": null, "baseline_score": 3.86, "outcome": "KEPT", "failure_mode": null, "duration_seconds": 233.41037791711278, "tags": ["micro-optimization", "loop-optimization", "arithmetic-simplification"], "learnings": "{\"what_changed\":\"\",\"what_improved\":[],\"what_regressed\":[],\"transferable_insight\":\"Precomputing and caching invariant values outside of iterative conditions eliminates redundant calculations and enables efficient variable reuse.\",\"domain_tags\":[\"Performance Optimization\",\"Loop Optimization\",\"Code Refactoring\"]}", "cost_usd": 0.04675750000000001, "bootstrap_seed": 0, "agent_model": "gemini-3.1-pro-preview", "held_out_score": null, "criterion_names": null, "per_criterion_scores": null, "failure_classification": null, "drafts_generated": 1, "drafts_survived": 1}
{"id": "832b6e5f-92a3-4588-86b8-a03e64ffca96", "target_id": "B3-control", "git_sha": "079da7df86180a88ca1e4d518f0afd5432fc0687", "pre_experiment_sha": "c434641b2bfbdf0fca44ba80f3f62685dafeaab7", "timestamp": "2026-04-23T13:09:18.698044+00:00", "hypothesis": "Optimize the `_levenshtein` fast-path by delaying `end_t` allocation, inlining `t_mid` to prevent unconditional allocations, and reusing `end_s` for equal-length strings, while adding localized method references for `dels.update` in the SymSpell generation to minimize overhead.", "hypothesis_source": "agent", "mutation_diff_summary": "", "score": 4.25, "score_ci_lower": null, "score_ci_upper": null, "raw_scores": null, "baseline_score": 4.05, "outcome": "KEPT", "failure_mode": null, "duration_seconds": 236.73247437505051, "tags": ["symspell", "fast-path", "string-slicing", "list-comprehension", "localized-methods"], "learnings": "{\"what_changed\":\"\",\"what_improved\":[],\"what_regressed\":[],\"transferable_insight\":\"Deferring memory allocations until strictly necessary, reusing variables, and caching method references in tight loops minimizes execution overhead and improves overall performance.\",\"domain_tags\":[\"Performance Optimization\",\"Memory Management\",\"Code Optimization\"]}", "cost_usd": 0.04741625000000001, "bootstrap_seed": 0, "agent_model": "gemini-3.1-pro-preview", "held_out_score": null, "criterion_names": null, "per_criterion_scores": null, "failure_classification": null, "drafts_generated": 1, "drafts_survived": 1}
{"id": "e5d36d10-62b0-4663-859d-114af8d5d728", "target_id": "B3-control", "git_sha": "f8d0c3c96eff992a12d467a2a387cb3326a6b634", "pre_experiment_sha": "079da7df86180a88ca1e4d518f0afd5432fc0687", "timestamp": "2026-04-23T13:13:12.815925+00:00", "hypothesis": "Optimize SymSpell deletion generation using fast set comprehensions and `set.update()` with list comprehensions, while maintaining exhaustive O(1) slice comparisons for Levenshtein fast-paths.", "hypothesis_source": "agent", "mutation_diff_summary": "", "score": 3.78, "score_ci_lower": null, "score_ci_upper": null, "raw_scores": null, "baseline_score": 4.25, "outcome": "KEPT", "failure_mode": null, "duration_seconds": 224.02702008397318, "tags": ["symspell", "set-comprehension", "fast-path", "slice-comparison"], "learnings": "{\"what_changed\":\"\",\"what_improved\":[],\"what_regressed\":[],\"transferable_insight\":\"Replacing iterative collection building with native comprehensions and bulk update methods accelerates combinatorial data generation while maintaining algorithmic correctness.\",\"domain_tags\":[\"Performance Optimization\",\"Data Structures\",\"Algorithm Design\"]}", "cost_usd": 0.0469125, "bootstrap_seed": 0, "agent_model": "gemini-3.1-pro-preview", "held_out_score": null, "criterion_names": null, "per_criterion_scores": null, "failure_classification": null, "drafts_generated": 1, "drafts_survived": 1}
{"id": "807d2582-6413-491e-8ae5-4768a2259098", "target_id": "B3-control", "git_sha": "555907acbcfa5117f43285c976b3440e99fff988", "pre_experiment_sha": "f8d0c3c96eff992a12d467a2a387cb3326a6b634", "timestamp": "2026-04-23T13:18:04.536831+00:00", "hypothesis": "Implement SymSpell symmetric deletion with set comprehensions to reduce search space to O(N), use direct O(1) slice comparisons without caching variables, and keep the DP fallback for arbitrary thresholds.", "hypothesis_source": "agent", "mutation_diff_summary": "", "score": 3.78, "score_ci_lower": null, "score_ci_upper": null, "raw_scores": null, "baseline_score": 3.78, "outcome": "KEPT", "failure_mode": null, "duration_seconds": 237.95071725011803, "tags": ["symspell", "optimization", "strings"], "learnings": "{\"what_changed\":\"\",\"what_improved\":[],\"what_regressed\":[],\"transferable_insight\":\"Reducing search space complexity and minimizing variable caching overhead optimizes performance, while retaining a generalized fallback mechanism ensures robustness for arbitrary edge cases.\",\"domain_tags\":[\"Algorithm Optimization\",\"Search Algorithms\",\"Performance Tuning\"]}", "cost_usd": 0.046725, "bootstrap_seed": 0, "agent_model": "gemini-3.1-pro-preview", "held_out_score": null, "criterion_names": null, "per_criterion_scores": null, "failure_classification": null, "drafts_generated": 1, "drafts_survived": 1}
{"id": "224c4182-5965-459b-9e4c-dc0757c72fd6", "target_id": "B3-control", "git_sha": "790242bdb74521eff7dcb7ac90fa0f65714678ce", "pre_experiment_sha": "555907acbcfa5117f43285c976b3440e99fff988", "timestamp": "2026-04-23T13:19:51.975628+00:00", "hypothesis": "Optimize SymSpell deletion generation by creating the smaller 1-deletion set first via set comprehension, then applying `set.update()` with the larger 2-deletion list comprehension, allowing Python to pre-allocate the hash table efficiently.", "hypothesis_source": "agent", "mutation_diff_summary": "", "score": 3.85, "score_ci_lower": null, "score_ci_upper": null, "raw_scores": null, "baseline_score": 3.78, "outcome": "KEPT", "failure_mode": null, "duration_seconds": 98.67870004079305, "tags": ["symspell", "set-comprehension", "memory-allocation", "micro-optimization"], "learnings": "{\"what_changed\":\"\",\"what_improved\":[],\"what_regressed\":[],\"transferable_insight\":\"Initializing a set with a smaller collection and subsequently updating it with a larger pre-computed list optimizes performance by allowing the underlying hash table to efficiently pre-allocate memory.\",\"domain_tags\":[\"Performance Optimization\",\"Data Structures\",\"Python\"]}", "cost_usd": 0.049375, "bootstrap_seed": 0, "agent_model": "gemini-3.1-pro-preview", "held_out_score": null, "criterion_names": null, "per_criterion_scores": null, "failure_classification": null, "drafts_generated": 1, "drafts_survived": 1}
{"id": "1f4ee2e8-d2ac-4490-a15d-e3f05510c2bb", "target_id": "B3-control", "git_sha": "790c325a085645eb39f8bd962cc49891c20d6524", "pre_experiment_sha": "790242bdb74521eff7dcb7ac90fa0f65714678ce", "timestamp": "2026-04-23T13:23:30.951087+00:00", "hypothesis": "Optimize the `_levenshtein` fast-path by caching the remaining sequence length `rem_s = len_s - pref - suff` to eliminate redundant subtractions, and derive `rem_t` from `rem_s + diff` to further reduce arithmetic overhead in the fallback initialization.", "hypothesis_source": "agent", "mutation_diff_summary": "", "score": 3.72, "score_ci_lower": null, "score_ci_upper": null, "raw_scores": null, "baseline_score": 3.85, "outcome": "KEPT", "failure_mode": null, "duration_seconds": 210.80746754189022, "tags": ["micro-optimization", "arithmetic-simplification", "fast-path"], "learnings": "{\"what_changed\":\"\",\"what_improved\":[],\"what_regressed\":[],\"transferable_insight\":\"Caching intermediate derived values to compute related variables eliminates redundant arithmetic operations and reduces computational overhead in performance-critical paths.\",\"domain_tags\":[\"Performance Optimization\",\"Algorithm Design\",\"Code Refactoring\"]}", "cost_usd": 0.049502500000000005, "bootstrap_seed": 0, "agent_model": "gemini-3.1-pro-preview", "held_out_score": null, "criterion_names": null, "per_criterion_scores": null, "failure_classification": null, "drafts_generated": 1, "drafts_survived": 1}
{"id": "dfd16b15-5b09-448f-a8e5-8af17dcd178d", "target_id": "B3-control", "git_sha": "790c325a085645eb39f8bd962cc49891c20d6524", "pre_experiment_sha": "790c325a085645eb39f8bd962cc49891c20d6524", "timestamp": "2026-04-23T13:26:49.659458+00:00", "hypothesis": "Cache string lengths `lb = len(b)` and `la = len(a)` before generating SymSpell deletions and during fallback bucketing to eliminate redundant `len()` evaluations inside nested loops and list comprehensions.", "hypothesis_source": "agent", "mutation_diff_summary": "", "score": 4.16, "score_ci_lower": null, "score_ci_upper": null, "raw_scores": null, "baseline_score": 3.72, "outcome": "DISCARDED", "failure_mode": null, "duration_seconds": 174.4463579999283, "tags": ["micro-optimization", "symspell", "list-comprehension"], "learnings": "{\"what_changed\":\"\",\"what_improved\":[],\"what_regressed\":[],\"transferable_insight\":\"Micro-optimizing loops by manually caching constant-time built-in operations, such as length evaluations, rarely yields performance gains and often just adds unnecessary code complexity.\",\"domain_tags\":[\"Performance Optimization\",\"Micro-optimization\",\"Software Engineering\"]}", "cost_usd": 0.049712150000000004, "bootstrap_seed": 0, "agent_model": "gemini-3.1-pro-preview", "held_out_score": null, "criterion_names": null, "per_criterion_scores": null, "failure_classification": {"category": "logic_error", "description": "The experiment likely failed due to incorrect reasoning regarding the performance characteristics of `len()` on string objects, or an incorrect implementation of the caching mechanism. `len()` for Python strings is typically an O(1) operation and highly optimized, meaning its direct evaluation is often very fast. The overhead introduced by caching (e.g., additional variable assignments, memory access, or management within nested loops) might have outweighed any perceived benefit, leading to a performance degradation (a regression) or incorrect behavior if string objects could change after their length was cached. The score of 4.1600 suggests a negative outcome.", "fix_direction": "Thoroughly profile the application to identify actual performance bottlenecks before implementing micro-optimizations. Verify the true cost of `len()` calls for strings in the specific execution environment and language. If `len()` is confirmed not to be a significant bottleneck, this optimization approach should be abandoned. If redundant calls on *mutable* objects (though strings are immutable in Python, this principle applies more broadly) are a concern, ensure the caching logic correctly handles potential changes in object state or that objects are guaranteed to be immutable during the caching period.", "confidence": 0.9}, "drafts_generated": 1, "drafts_survived": 1}
{"id": "ae30e863-0f5b-4119-b024-0e472f15b100", "target_id": "B3-control", "git_sha": "1d85b644eb4b4ebd8125c3edb00fe3ff3642e26b", "pre_experiment_sha": "790c325a085645eb39f8bd962cc49891c20d6524", "timestamp": "2026-04-23T13:30:23.856102+00:00", "hypothesis": "Add an O(1) integer comparison fast-path `if rem_s == 1: return 2` to the `diff == 1` branch to safely bypass string slicing and equality checks, further reducing overhead for common distance-2 cases.", "hypothesis_source": "agent", "mutation_diff_summary": "", "score": 3.85, "score_ci_lower": null, "score_ci_upper": null, "raw_scores": null, "baseline_score": 3.72, "outcome": "KEPT", "failure_mode": null, "duration_seconds": 176.48007508390583, "tags": ["fast-path", "micro-optimization", "string-comparison"], "learnings": "{\"what_changed\":\"\",\"what_improved\":[],\"what_regressed\":[],\"transferable_insight\":\"Implementing cheap, constant-time fast-paths for common scenarios effectively bypasses expensive operations and reduces overall execution overhead.\",\"domain_tags\":[\"Performance Optimization\",\"Algorithm Design\"]}", "cost_usd": 0.049697500000000006, "bootstrap_seed": 0, "agent_model": "gemini-3.1-pro-preview", "held_out_score": null, "criterion_names": null, "per_criterion_scores": null, "failure_classification": null, "drafts_generated": 1, "drafts_survived": 1}
{"id": "4a149692-fa44-422e-a41f-d1bab7de9556", "target_id": "B3-control", "git_sha": "5d4a95bea8dcf78065d375b119904a2572d6f2d0", "pre_experiment_sha": "1d85b644eb4b4ebd8125c3edb00fe3ff3642e26b", "timestamp": "2026-04-23T13:35:21.484137+00:00", "hypothesis": "Reuse the `candidates` set across iterations using `.clear()` to eliminate redundant memory allocations, and replace the 2-deletion list comprehension with a standard set comprehension to comply with safety rules and prevent logic errors.", "hypothesis_source": "agent", "mutation_diff_summary": "", "score": 4.15, "score_ci_lower": null, "score_ci_upper": null, "raw_scores": null, "baseline_score": 3.85, "outcome": "KEPT", "failure_mode": null, "duration_seconds": 291.19288070802577, "tags": ["micro-optimization", "memory-allocation", "set-comprehension", "bug-fix"], "learnings": "{\"what_changed\":\"\",\"what_improved\":[],\"what_regressed\":[],\"transferable_insight\":\"Reusing existing data structures by clearing them across iterations reduces memory allocation overhead, while utilizing appropriate comprehensions prevents logic errors and improves overall efficiency.\",\"domain_tags\":[\"Memory Management\",\"Performance Optimization\",\"Software Engineering\"]}", "cost_usd": 0.049753750000000006, "bootstrap_seed": 0, "agent_model": "gemini-3.1-pro-preview", "held_out_score": null, "criterion_names": null, "per_criterion_scores": null, "failure_classification": null, "drafts_generated": 1, "drafts_survived": 1}
{"id": "8518d2aa-da76-4c38-993e-d926b9c8dc87", "target_id": "B3-control", "git_sha": "eb55ad5854c88be80cf0036a38647152a51a7798", "pre_experiment_sha": "5d4a95bea8dcf78065d375b119904a2572d6f2d0", "timestamp": "2026-04-23T13:38:56.766286+00:00", "hypothesis": "Replace `candidates.clear()` with a new `set()` instantiation inside the loop to avoid iterating over sparse, oversized hash tables, and remove the forbidden `rem_s == 1` fast-path to comply with safety rules.", "hypothesis_source": "agent", "mutation_diff_summary": "", "score": 4.26, "score_ci_lower": null, "score_ci_upper": null, "raw_scores": null, "baseline_score": 4.15, "outcome": "KEPT", "failure_mode": null, "duration_seconds": 192.2750267907977, "tags": ["micro-optimization", "memory-allocation", "bug-fix", "fast-path"], "learnings": "{\"what_changed\":\"\",\"what_improved\":[],\"what_regressed\":[],\"transferable_insight\":\"Instantiating a new hash-based collection rather than clearing an existing one inside a loop can improve performance by avoiding iteration over sparse, oversized memory allocations retained from previous iterations.\",\"domain_tags\":[\"Performance Optimization\",\"Memory Management\",\"Data Structures\"]}", "cost_usd": 0.04972125000000001, "bootstrap_seed": 0, "agent_model": "gemini-3.1-pro-preview", "held_out_score": null, "criterion_names": null, "per_criterion_scores": null, "failure_classification": null, "drafts_generated": 1, "drafts_survived": 1}
{"id": "0168759c-80d2-4908-bbcb-d9b7e3751177", "target_id": "B3-control", "git_sha": "a97fdd17be1b47f7c272b4314b6a5705a2560f09", "pre_experiment_sha": "eb55ad5854c88be80cf0036a38647152a51a7798", "timestamp": "2026-04-23T13:43:11.589728+00:00", "hypothesis": "Simplify O(1) slice comparisons by substituting `len_t` with `len_s` to eliminate redundant arithmetic, and use a fast set comprehension for `candidates` generation to avoid Python-level `update` loops.", "hypothesis_source": "agent", "mutation_diff_summary": "", "score": 4.24, "score_ci_lower": null, "score_ci_upper": null, "raw_scores": null, "baseline_score": 4.26, "outcome": "KEPT", "failure_mode": null, "duration_seconds": 247.54289774992503, "tags": ["micro-optimization", "slice-simplification", "set-comprehension"], "learnings": "{\"what_changed\":\"\",\"what_improved\":[],\"what_regressed\":[],\"transferable_insight\":\"Replacing iterative method calls with native comprehensions and eliminating redundant arithmetic operations streamlines execution and improves performance.\",\"domain_tags\":[\"Software Engineering\",\"Code Optimization\",\"Performance Tuning\"]}", "cost_usd": 0.0495275, "bootstrap_seed": 0, "agent_model": "gemini-3.1-pro-preview", "held_out_score": null, "criterion_names": null, "per_criterion_scores": null, "failure_classification": null, "drafts_generated": 1, "drafts_survived": 1}
{"id": "e65cab42-18ce-445c-9ef0-13f8506e7913", "target_id": "B3-control", "git_sha": "e481e7d6edb4dc055e54b161484a1c48100b0bbf", "pre_experiment_sha": "a97fdd17be1b47f7c272b4314b6a5705a2560f09", "timestamp": "2026-04-23T13:47:20.263299+00:00", "hypothesis": "Optimize SymSpell deletion generation by replacing set comprehensions with list comprehensions inside `set.update()` to reduce allocation overhead, and simplify the O(1) slice comparison for `diff == 2` by substituting `len_t` with `len_s`.", "hypothesis_source": "agent", "mutation_diff_summary": "", "score": 3.93, "score_ci_lower": null, "score_ci_upper": null, "raw_scores": null, "baseline_score": 4.24, "outcome": "KEPT", "failure_mode": null, "duration_seconds": 241.58816212508827, "tags": ["micro-optimization", "set-comprehension", "slice-simplification"], "learnings": "{\"what_changed\":\"\",\"what_improved\":[],\"what_regressed\":[],\"transferable_insight\":\"Replacing intermediate hash-based collections with sequential ones when feeding data into bulk update operations reduces redundant memory allocation and hashing overhead.\",\"domain_tags\":[\"Performance Optimization\",\"Data Structures\",\"Memory Management\"]}", "cost_usd": 0.049555, "bootstrap_seed": 0, "agent_model": "gemini-3.1-pro-preview", "held_out_score": null, "criterion_names": null, "per_criterion_scores": null, "failure_classification": null, "drafts_generated": 1, "drafts_survived": 1}
