{"id": "e9c55350-312a-4880-9d60-628bcbfee999", "target_id": "B3-control", "git_sha": "8a26f1f28b8ed1ac2902e1483854af2795da89a5", "pre_experiment_sha": "c22fba77e88fb3d7012ce62d8bf33b1c86699272", "timestamp": "2026-04-19T15:01:38.309306+00:00", "hypothesis": "Precompute reusable length and first-character metadata for list B and eliminate an unused sort to reduce hot-loop overhead without changing results.", "hypothesis_source": "agent", "mutation_diff_summary": "", "score": 107.71, "score_ci_lower": null, "score_ci_upper": null, "raw_scores": null, "baseline_score": 108.51, "outcome": "KEPT", "failure_mode": null, "duration_seconds": 31.54304654104635, "tags": ["performance", "precompute", "length-buckets", "redundant-work-removal"], "learnings": "{\"what_changed\":\"\",\"what_improved\":[],\"what_regressed\":[],\"transferable_insight\":\"Precomputing reusable metadata and removing dead work from a hot path can reduce overhead without affecting correctness when the eliminated computation is not used in the result.\",\"domain_tags\":[\"performance-optimization\",\"code-refactoring\",\"algorithm-efficiency\"]}", "cost_usd": 0.082005, "bootstrap_seed": 0, "agent_model": "gpt-5.4", "held_out_score": null, "criterion_names": null, "per_criterion_scores": null, "failure_classification": null, "drafts_generated": 1, "drafts_survived": 1}
{"id": "72cef9a2-21bd-40c9-8603-34560205232c", "target_id": "B3-control", "git_sha": "f0c70c4eb9a01455749776aae332a9b76152729e", "pre_experiment_sha": "8a26f1f28b8ed1ac2902e1483854af2795da89a5", "timestamp": "2026-04-19T15:02:13.171955+00:00", "hypothesis": "Precompute string lengths and first characters for list B and avoid redundant key/set construction for impossible duplicate additions.", "hypothesis_source": "agent", "mutation_diff_summary": "", "score": 106.79, "score_ci_lower": null, "score_ci_upper": null, "raw_scores": null, "baseline_score": 107.71, "outcome": "KEPT", "failure_mode": null, "duration_seconds": 33.59370012499858, "tags": ["length-bucketing", "precompute", "redundant-work-removal", "safe-pruning"], "learnings": "{\"what_changed\":\"\",\"what_improved\":[],\"what_regressed\":[],\"transferable_insight\":\"Precomputing cheap discriminative features and skipping redundant work for impossible cases can reduce overhead without changing results.\",\"domain_tags\":[\"optimization\",\"algorithm design\",\"performance\"]}", "cost_usd": 0.082175, "bootstrap_seed": 0, "agent_model": "gpt-5.4", "held_out_score": null, "criterion_names": null, "per_criterion_scores": null, "failure_classification": null, "drafts_generated": 1, "drafts_survived": 1}
{"id": "201f7e97-5e56-4aa0-9312-77c26fd1bce7", "target_id": "B3-control", "git_sha": "38e37b2a8364935f792ad30a18ba41819a534c85", "pre_experiment_sha": "f0c70c4eb9a01455749776aae332a9b76152729e", "timestamp": "2026-04-19T15:02:47.021335+00:00", "hypothesis": "Precompute immutable metadata and iterate only existing valid length buckets to avoid redundant scans and tuple allocations.", "hypothesis_source": "agent", "mutation_diff_summary": "", "score": 105.99, "score_ci_lower": null, "score_ci_upper": null, "raw_scores": null, "baseline_score": 106.79, "outcome": "KEPT", "failure_mode": null, "duration_seconds": 32.81787412497215, "tags": ["performance", "precompute", "length-bucketing", "local-safe"], "learnings": "{\"what_changed\":\"\",\"what_improved\":[],\"what_regressed\":[],\"transferable_insight\":\"Precomputing immutable metadata and restricting work to already-valid buckets can reduce redundant iteration and allocation overhead without changing results.\",\"domain_tags\":[\"performance-optimization\",\"algorithm-design\"]}", "cost_usd": 0.08186500000000001, "bootstrap_seed": 0, "agent_model": "gpt-5.4", "held_out_score": null, "criterion_names": null, "per_criterion_scores": null, "failure_classification": null, "drafts_generated": 1, "drafts_survived": 1}
{"id": "d2c531d7-5767-48af-811c-818ea022164d", "target_id": "B3-control", "git_sha": "ded43a1e648c6c4ba92951bc8e9ead6f968dbe1e", "pre_experiment_sha": "38e37b2a8364935f792ad30a18ba41819a534c85", "timestamp": "2026-04-19T15:03:23.366109+00:00", "hypothesis": "Precompute immutable metadata and iterate only exact valid length buckets to reduce hot-loop overhead without changing matches.", "hypothesis_source": "agent", "mutation_diff_summary": "", "score": 105.74, "score_ci_lower": null, "score_ci_upper": null, "raw_scores": null, "baseline_score": 105.99, "outcome": "KEPT", "failure_mode": null, "duration_seconds": 31.09389941697009, "tags": ["performance", "length-bucketing", "precompute", "safe-pruning"], "learnings": "{\"what_changed\":\"\",\"what_improved\":[],\"what_regressed\":[],\"transferable_insight\":\"Precomputing invariant information and restricting iteration to only valid candidates can reduce runtime overhead while preserving correctness.\",\"domain_tags\":[\"optimization\",\"algorithm-design\",\"performance\"]}", "cost_usd": 0.08245500000000001, "bootstrap_seed": 0, "agent_model": "gpt-5.4", "held_out_score": null, "criterion_names": null, "per_criterion_scores": null, "failure_classification": null, "drafts_generated": 1, "drafts_survived": 1}
{"id": "04e31b40-bed9-4fb9-8fb6-caba423760b3", "target_id": "B3-control", "git_sha": "ded43a1e648c6c4ba92951bc8e9ead6f968dbe1e", "pre_experiment_sha": "ded43a1e648c6c4ba92951bc8e9ead6f968dbe1e", "timestamp": "2026-04-19T15:03:54.388854+00:00", "hypothesis": "Precompute immutable candidate metadata and skip impossible first-letter mismatches before calling Levenshtein.", "hypothesis_source": "agent", "mutation_diff_summary": "", "score": 107.86, "score_ci_lower": null, "score_ci_upper": null, "raw_scores": null, "baseline_score": 105.74, "outcome": "DISCARDED", "failure_mode": null, "duration_seconds": 29.549745374941267, "tags": ["performance", "length-bucketing", "precompute", "hot-loop"], "learnings": "{\"what_changed\":\"\",\"what_improved\":[],\"what_regressed\":[],\"transferable_insight\":\"When a cheap, immutable precheck can rule out many impossible cases, it is often worth doing before invoking a more expensive exact computation.\",\"domain_tags\":[\"optimization\",\"filtering\",\"performance\"]}", "cost_usd": 0.0834402, "bootstrap_seed": 0, "agent_model": "gpt-5.4", "held_out_score": null, "criterion_names": null, "per_criterion_scores": null, "failure_classification": {"category": "logic_error", "description": "The experiment did not specify the observed failure mode or what aspect of the pipeline broke (e.g., output format, incorrect distance logic, regression, or parsing). With only the hypothesis and score, the underlying cause of the failure cannot be confidently identified.", "fix_direction": "Capture and inspect the concrete error signal (logs/stack trace), compare failing outputs against the expected schema/semantics, and add targeted tests around the precomputed metadata shortcut to verify it never incorrectly prunes valid candidates (especially edge cases with first-letter handling).", "confidence": 0.15}, "drafts_generated": 1, "drafts_survived": 1}
{"id": "eea50853-9ee2-40f0-8150-5d05930f5b64", "target_id": "B3-control", "git_sha": "ded43a1e648c6c4ba92951bc8e9ead6f968dbe1e", "pre_experiment_sha": "ded43a1e648c6c4ba92951bc8e9ead6f968dbe1e", "timestamp": "2026-04-19T15:04:25.047497+00:00", "hypothesis": "Precompute candidate lengths and bucket keys once to reduce repeated tuple unpacking and dict lookups without changing matching behavior.", "hypothesis_source": "agent", "mutation_diff_summary": "", "score": 106.55, "score_ci_lower": null, "score_ci_upper": null, "raw_scores": null, "baseline_score": 105.74, "outcome": "DISCARDED", "failure_mode": null, "duration_seconds": 28.10638224997092, "tags": ["length-bucketing", "precompute", "hot-loop"], "learnings": "{\"what_changed\":\"\",\"what_improved\":[],\"what_regressed\":[],\"transferable_insight\":\"Precomputing and reusing frequently accessed derived values can simplify repeated work, but it should only be kept if it measurably improves performance without adding unnecessary complexity.\",\"domain_tags\":[\"performance-optimization\",\"software-engineering\"]}", "cost_usd": 0.08313300000000001, "bootstrap_seed": 0, "agent_model": "gpt-5.4", "held_out_score": null, "criterion_names": null, "per_criterion_scores": null, "failure_classification": {"category": "logic_error", "description": "The change intended to optimize precomputation likely altered the effective matching behavior (e.g., using different keys/bucket lengths, mishandling tuple unpacking boundaries, or changing the order/conditions under which candidates are compared), causing incorrect results despite the goal of preserving semantics.", "fix_direction": "Verify semantic equivalence: add focused tests to compare precomputed candidate/bucket keys vs the original per-iteration computation, especially around edge cases (empty buckets, boundary lengths, duplicate keys) and ensure any caching does not change filtering/comparison conditions.", "confidence": 0.62}, "drafts_generated": 1, "drafts_survived": 1}
{"id": "bb88f268-9f7e-429f-a8b0-4bc601c8c998", "target_id": "B3-control", "git_sha": "1d09bcc54c3aa60c5bf4d5a3b42cf0cb7388b753", "pre_experiment_sha": "ded43a1e648c6c4ba92951bc8e9ead6f968dbe1e", "timestamp": "2026-04-19T15:05:04.457360+00:00", "hypothesis": "Precompute immutable candidate lengths in the length buckets to remove repeated len work while preserving exact matching behavior.", "hypothesis_source": "agent", "mutation_diff_summary": "", "score": 106.91, "score_ci_lower": null, "score_ci_upper": null, "raw_scores": null, "baseline_score": 105.74, "outcome": "KEPT", "failure_mode": null, "duration_seconds": 32.84632720903028, "tags": ["length-buckets", "metadata-reuse", "local-optimization"], "learnings": "{\"what_changed\":\"\",\"what_improved\":[],\"what_regressed\":[],\"transferable_insight\":\"Precomputing and reusing immutable metadata for repeated comparisons can reduce redundant work without changing correctness when the underlying values do not change.\",\"domain_tags\":[\"optimization\",\"performance\",\"correctness\"]}", "cost_usd": 0.08360000000000001, "bootstrap_seed": 0, "agent_model": "gpt-5.4", "held_out_score": null, "criterion_names": null, "per_criterion_scores": null, "failure_classification": null, "drafts_generated": 1, "drafts_survived": 1}
{"id": "7f24b643-2763-481d-b6f6-2575c198e817", "target_id": "B3-control", "git_sha": "baa4b13ed236e842fea45b7312ab617ba0e24922", "pre_experiment_sha": "1d09bcc54c3aa60c5bf4d5a3b42cf0cb7388b753", "timestamp": "2026-04-19T15:05:38.944074+00:00", "hypothesis": "Precompute immutable metadata and length buckets once at module load to remove repeated setup work while preserving exact matching behavior.", "hypothesis_source": "agent", "mutation_diff_summary": "", "score": 107.14, "score_ci_lower": null, "score_ci_upper": null, "raw_scores": null, "baseline_score": 106.91, "outcome": "KEPT", "failure_mode": null, "duration_seconds": 33.33254175004549, "tags": ["precompute", "length-buckets", "metadata-reuse", "redundant-work-removal"], "learnings": "{\"what_changed\":\"\",\"what_improved\":[],\"what_regressed\":[],\"transferable_insight\":\"Front-loading invariant setup into one-time initialization can reduce repeated runtime overhead without changing observable behavior, especially when the cached data is immutable.\",\"domain_tags\":[\"performance-optimization\",\"caching\",\"software-engineering\"]}", "cost_usd": 0.08572000000000002, "bootstrap_seed": 0, "agent_model": "gpt-5.4", "held_out_score": null, "criterion_names": null, "per_criterion_scores": null, "failure_classification": null, "drafts_generated": 1, "drafts_survived": 1}
{"id": "88c0a5de-2a5b-43e6-9184-8ae1fae73212", "target_id": "B3-control", "git_sha": "a0aefb9e4b30df2a696dd3d25d67dacdc73b4930", "pre_experiment_sha": "baa4b13ed236e842fea45b7312ab617ba0e24922", "timestamp": "2026-04-19T15:06:12.626922+00:00", "hypothesis": "Precompute immutable metadata and exact length buckets for both name lists to reduce repeated work in the hot matching loop.", "hypothesis_source": "agent", "mutation_diff_summary": "", "score": 106.67, "score_ci_lower": null, "score_ci_upper": null, "raw_scores": null, "baseline_score": 107.14, "outcome": "KEPT", "failure_mode": null, "duration_seconds": 32.469081000075676, "tags": ["length-bucketing", "metadata-reuse", "local-optimization"], "learnings": "{\"what_changed\":\"\",\"what_improved\":[],\"what_regressed\":[],\"transferable_insight\":\"Precomputing stable, reusable metadata outside a hot loop can reduce repeated work and improve performance without changing results.\",\"domain_tags\":[\"performance-optimization\",\"algorithm-design\",\"software-engineering\"]}", "cost_usd": 0.087475, "bootstrap_seed": 0, "agent_model": "gpt-5.4", "held_out_score": null, "criterion_names": null, "per_criterion_scores": null, "failure_classification": null, "drafts_generated": 1, "drafts_survived": 1}
{"id": "c5f297a5-7261-4e12-8d03-d9c219e3b262", "target_id": "B3-control", "git_sha": "fd92420541b05106a828072fd188afa7572d6971", "pre_experiment_sha": "a0aefb9e4b30df2a696dd3d25d67dacdc73b4930", "timestamp": "2026-04-19T15:06:50.841627+00:00", "hypothesis": "Precompute reusable metadata and lengths for dynamic inputs to remove repeated tuple unpacking and redundant bound checks.", "hypothesis_source": "agent", "mutation_diff_summary": "", "score": 106.14, "score_ci_lower": null, "score_ci_upper": null, "raw_scores": null, "baseline_score": 106.67, "outcome": "KEPT", "failure_mode": null, "duration_seconds": 33.14989937504288, "tags": ["length-buckets", "precompute-lengths", "redundant-work-removal"], "learnings": "{\"what_changed\":\"\",\"what_improved\":[],\"what_regressed\":[],\"transferable_insight\":\"Precomputing and reusing frequently accessed metadata can reduce repeated overhead in hot paths, even when the optimization is subtle enough that no clear metric change is immediately visible.\",\"domain_tags\":[\"performance-optimization\",\"caching\",\"runtime-efficiency\"]}", "cost_usd": 0.08790500000000001, "bootstrap_seed": 0, "agent_model": "gpt-5.4", "held_out_score": null, "criterion_names": null, "per_criterion_scores": null, "failure_classification": null, "drafts_generated": 1, "drafts_survived": 1}
{"id": "16fee11c-f314-4f64-acbb-6ab2a18d28fc", "target_id": "B3-control", "git_sha": "0df1cc4a71b000dd25522f0e2013300e00e09b3e", "pre_experiment_sha": "fd92420541b05106a828072fd188afa7572d6971", "timestamp": "2026-04-19T15:07:24.144183+00:00", "hypothesis": "Remove redundant first-character metadata and reuse precomputed length keys to reduce hot-loop overhead without changing matching behavior.", "hypothesis_source": "agent", "mutation_diff_summary": "", "score": 104.91, "score_ci_lower": null, "score_ci_upper": null, "raw_scores": null, "baseline_score": 106.14, "outcome": "KEPT", "failure_mode": null, "duration_seconds": 31.550538250012323, "tags": ["length-metadata", "redundant-work-removal", "local-optimization"], "learnings": "{\"what_changed\":\"\",\"what_improved\":[],\"what_regressed\":[],\"transferable_insight\":\"When an optimization removes bookkeeping but preserves behavior, the main value may come from simplifying the hot path even if the measured gain is small or noisy.\",\"domain_tags\":[\"performance-optimization\",\"software-engineering\"]}", "cost_usd": 0.08621500000000001, "bootstrap_seed": 0, "agent_model": "gpt-5.4", "held_out_score": null, "criterion_names": null, "per_criterion_scores": null, "failure_classification": null, "drafts_generated": 1, "drafts_survived": 1}
{"id": "f51d0cb8-00ad-415a-90d4-6c3d81dafcdb", "target_id": "B3-control", "git_sha": "0df1cc4a71b000dd25522f0e2013300e00e09b3e", "pre_experiment_sha": "0df1cc4a71b000dd25522f0e2013300e00e09b3e", "timestamp": "2026-04-19T15:07:55.334307+00:00", "hypothesis": "Precompute available length keys and iterate only existing candidate buckets while reusing local bindings to reduce hot-loop overhead.", "hypothesis_source": "agent", "mutation_diff_summary": "", "score": 105.49, "score_ci_lower": null, "score_ci_upper": null, "raw_scores": null, "baseline_score": 104.91, "outcome": "DISCARDED", "failure_mode": null, "duration_seconds": 29.91535058291629, "tags": ["length-bucketing", "local-bindings", "redundant-work-removal"], "learnings": "{\"what_changed\":\"\",\"what_improved\":[],\"what_regressed\":[],\"transferable_insight\":\"Optimizing a hot loop by precomputing valid options and minimizing repeated lookups can reduce overhead, but the change should be kept only if it produces a measurable benefit.\",\"domain_tags\":[\"performance-optimization\",\"software-engineering\"]}", "cost_usd": 0.08774360000000002, "bootstrap_seed": 0, "agent_model": "gpt-5.4", "held_out_score": null, "criterion_names": null, "per_criterion_scores": null, "failure_classification": {"category": "over_optimization", "description": "The change focuses on micro-optimizations (precomputing keys, iterating only existing buckets, reusing local bindings) but the experiment failed, suggesting the optimization introduced unintended behavior or caused incorrect results/performance tradeoffs relative to correctness criteria.", "fix_direction": "Validate semantic equivalence first (add targeted correctness tests/fixtures), then rework the optimization to preserve invariants; use profiling only after confirming outputs match exactly, and minimize behavioral assumptions about bucket existence/iteration order.", "confidence": 0.62}, "drafts_generated": 1, "drafts_survived": 1}
{"id": "67d30731-b4f7-4c71-879f-832edfbb9cf9", "target_id": "B3-control", "git_sha": "7a10d39da5b5a213bbe40a7b197311f36926f732", "pre_experiment_sha": "0df1cc4a71b000dd25522f0e2013300e00e09b3e", "timestamp": "2026-04-19T15:08:35.871300+00:00", "hypothesis": "Reuse grouped metadata directly for the hot-path baseline inputs and avoid redundant candidate tuple unpacking and key allocations.", "hypothesis_source": "agent", "mutation_diff_summary": "", "score": 104.8, "score_ci_lower": null, "score_ci_upper": null, "raw_scores": null, "baseline_score": 104.91, "outcome": "KEPT", "failure_mode": null, "duration_seconds": 32.705768333980814, "tags": ["length-buckets", "metadata-reuse", "redundant-work-removal"], "learnings": "{\"what_changed\":\"\",\"what_improved\":[],\"what_regressed\":[],\"transferable_insight\":\"When a fast path can reuse already-grouped data structures instead of re-unpacking and reallocating equivalent intermediates, it can reduce overhead without changing observable behavior.\",\"domain_tags\":[\"performance-optimization\",\"data-processing\",\"software-engineering\"]}", "cost_usd": 0.086825, "bootstrap_seed": 0, "agent_model": "gpt-5.4", "held_out_score": null, "criterion_names": null, "per_criterion_scores": null, "failure_classification": null, "drafts_generated": 1, "drafts_survived": 1}
{"id": "1da09479-b688-412d-8e22-3b69932d7de3", "target_id": "B3-control", "git_sha": "8fdcc4ad5f03dc6c5dde252dac9112d3da35cd8b", "pre_experiment_sha": "7a10d39da5b5a213bbe40a7b197311f36926f732", "timestamp": "2026-04-19T15:09:12.339298+00:00", "hypothesis": "Reduce hot-loop overhead by iterating prebuilt metadata directly and avoiding repeated tuple unpacking and bound recomputation.", "hypothesis_source": "agent", "mutation_diff_summary": "", "score": 105.5, "score_ci_lower": null, "score_ci_upper": null, "raw_scores": null, "baseline_score": 104.8, "outcome": "KEPT", "failure_mode": null, "duration_seconds": 35.2779534580186, "tags": ["length-buckets", "metadata-reuse", "loop-optimization"], "learnings": "{\"what_changed\":\"\",\"what_improved\":[],\"what_regressed\":[],\"transferable_insight\":\"When a tight loop repeatedly performs the same structural work, precomputing and iterating over ready-to-use metadata can reduce overhead and improve performance without changing behavior.\",\"domain_tags\":[\"performance-optimization\",\"loop-efficiency\",\"precomputation\"]}", "cost_usd": 0.08737, "bootstrap_seed": 0, "agent_model": "gpt-5.4", "held_out_score": null, "criterion_names": null, "per_criterion_scores": null, "failure_classification": null, "drafts_generated": 1, "drafts_survived": 1}
{"id": "abc78dde-0159-48d4-b39b-a58879a7f982", "target_id": "B3-control", "git_sha": "30bf399fddaa87274662589fef3a3642945687ed", "pre_experiment_sha": "8fdcc4ad5f03dc6c5dde252dac9112d3da35cd8b", "timestamp": "2026-04-19T15:09:47.605649+00:00", "hypothesis": "Reduce hot-loop overhead by iterating precomputed length buckets in sorted order and avoiding repeated dict lookups/range construction.", "hypothesis_source": "agent", "mutation_diff_summary": "", "score": 105.47, "score_ci_lower": null, "score_ci_upper": null, "raw_scores": null, "baseline_score": 105.5, "outcome": "KEPT", "failure_mode": null, "duration_seconds": 34.11215004208498, "tags": ["performance", "length-buckets", "local-safe"], "learnings": "{\"what_changed\":\"\",\"what_improved\":[],\"what_regressed\":[],\"transferable_insight\":\"Precomputing and reusing ordered groupings can reduce repeated per-iteration overhead in tight loops even when the functional outcome stays unchanged.\",\"domain_tags\":[\"performance-optimization\",\"algorithm-design\",\"runtime-efficiency\"]}", "cost_usd": 0.08998500000000001, "bootstrap_seed": 0, "agent_model": "gpt-5.4", "held_out_score": null, "criterion_names": null, "per_criterion_scores": null, "failure_classification": null, "drafts_generated": 1, "drafts_survived": 1}
