{"id": "992c04a1-d2e6-4432-a7de-2a3739856a63", "target_id": "B3-control", "git_sha": "e481e7d6edb4dc055e54b161484a1c48100b0bbf", "pre_experiment_sha": "e481e7d6edb4dc055e54b161484a1c48100b0bbf", "timestamp": "2026-04-23T13:50:11.080849+00:00", "hypothesis": "Optimize SymSpell deletion generation by replacing set comprehensions with `set()` and list comprehensions to further reduce memory allocation overhead and strictly adhere to the avoidance rules.", "hypothesis_source": "agent", "mutation_diff_summary": "", "score": 4.16, "score_ci_lower": null, "score_ci_upper": null, "raw_scores": null, "baseline_score": 3.93, "outcome": "DISCARDED", "failure_mode": null, "duration_seconds": 140.40052308281884, "tags": ["micro-optimization", "memory-allocation", "set-comprehension"], "learnings": "{\"what_changed\":\"\",\"what_improved\":[],\"what_regressed\":[],\"transferable_insight\":\"Replacing direct set comprehensions with intermediate list allocations wrapped in a set constructor degrades performance by increasing memory overhead.\",\"domain_tags\":[\"Performance Optimization\",\"Memory Management\",\"Code Refactoring\"]}", "cost_usd": 0.0495719, "bootstrap_seed": 0, "agent_model": "gemini-3.1-pro-preview", "held_out_score": null, "criterion_names": null, "per_criterion_scores": null, "failure_classification": {"category": "over_optimization", "description": "The experiment's strict focus on reducing memory allocation overhead by refactoring set comprehensions, and 'strictly adhering to avoidance rules,' likely led to a scenario where the targeted micro-optimization either did not yield sufficient gains, or inadvertently introduced performance regressions (e.g., increased CPU time) in other areas, resulting in an overall degraded score of 4.1600. This indicates an imbalance where the pursuit of one specific optimization negatively impacted the broader system performance.", "fix_direction": "Broaden the evaluation criteria beyond just memory allocation. Conduct comprehensive profiling that includes both memory usage and execution time (CPU cycles, latency) to understand the full impact of the proposed changes. Prioritize overall system performance over narrow adherence to specific micro-optimization rules. If memory reduction is still critical, explore alternative data structures or algorithms that offer a better trade-off without significantly compromising other performance metrics.", "confidence": 0.85}, "drafts_generated": 1, "drafts_survived": 1}
{"id": "a20a7227-2d2e-4ba7-8643-0368cb0c242d", "target_id": "B3-control", "git_sha": "e481e7d6edb4dc055e54b161484a1c48100b0bbf", "pre_experiment_sha": "e481e7d6edb4dc055e54b161484a1c48100b0bbf", "timestamp": "2026-04-23T13:53:40.485650+00:00", "hypothesis": "Optimize SymSpell deletion generation by using `set()` and `set.update()` with list comprehensions to reduce allocation overhead and avoid Python-level loops and set comprehensions.", "hypothesis_source": "agent", "mutation_diff_summary": "", "score": 4.2, "score_ci_lower": null, "score_ci_upper": null, "raw_scores": null, "baseline_score": 3.93, "outcome": "DISCARDED", "failure_mode": null, "duration_seconds": 169.220048249932, "tags": ["micro-optimization", "set-comprehension", "memory-allocation"], "learnings": "{\"what_changed\":\"\",\"what_improved\":[],\"what_regressed\":[],\"transferable_insight\":\"Replacing native set comprehensions with intermediate list comprehensions passed to bulk update methods can degrade performance due to the overhead of allocating temporary structures in memory.\",\"domain_tags\":[\"Performance Optimization\",\"Memory Management\",\"Python\"]}", "cost_usd": 0.049710500000000005, "bootstrap_seed": 0, "agent_model": "gemini-3.1-pro-preview", "held_out_score": null, "criterion_names": null, "per_criterion_scores": null, "failure_classification": {"category": "logic_error", "description": "The proposed optimization strategy, based on the assumption that `set.update()` with list comprehensions would reduce allocation overhead and improve performance for SymSpell deletion generation, was incorrect or misapplied for this specific context. The experiment failed to achieve its goal, indicated by the score of 4.2000, suggesting the performance characteristics of the chosen Python constructs did not behave as expected or introduced unforeseen overheads.", "fix_direction": "Conduct detailed profiling and benchmarking to understand the actual performance (CPU, memory allocation) of the different SymSpell deletion generation approaches (e.g., `set.update()`, set comprehensions, explicit loops) under realistic conditions. Identify the specific bottlenecks or unexpected behaviors that caused the proposed optimization to fail and use this data to inform a more effective optimization strategy, potentially by re-evaluating the underlying assumptions about Python's performance characteristics for set operations.", "confidence": 0.9}, "drafts_generated": 1, "drafts_survived": 1}
{"id": "2d59f680-25c3-4f83-8309-f737365bba32", "target_id": "B3-control", "git_sha": "e481e7d6edb4dc055e54b161484a1c48100b0bbf", "pre_experiment_sha": "e481e7d6edb4dc055e54b161484a1c48100b0bbf", "timestamp": "2026-04-23T14:00:06.432596+00:00", "hypothesis": "Optimize SymSpell deletion generation by initializing an empty `set()` and populating it using `set.update()` with list comprehensions for both 1-deletions and 2-deletions, completely avoiding Python-level set comprehensions to reduce allocation overhead.", "hypothesis_source": "agent", "mutation_diff_summary": "", "score": 4.24, "score_ci_lower": null, "score_ci_upper": null, "raw_scores": null, "baseline_score": 3.93, "outcome": "DISCARDED", "failure_mode": null, "duration_seconds": 298.43907058401965, "tags": ["micro-optimization", "memory-allocation", "set-comprehension"], "learnings": "{\"what_changed\":\"\",\"what_improved\":[],\"what_regressed\":[],\"transferable_insight\":\"Replacing native collection comprehensions with intermediate data structures and update methods typically degrades performance by introducing unnecessary memory allocation overhead.\",\"domain_tags\":[\"Performance Optimization\",\"Software Engineering\",\"Language Idioms\"]}", "cost_usd": 0.04992195, "bootstrap_seed": 0, "agent_model": "gemini-3.1-pro-preview", "held_out_score": null, "criterion_names": null, "per_criterion_scores": null, "failure_classification": {"category": "regression", "description": "The experiment aimed to optimize SymSpell deletion generation by reducing allocation overhead, but the proposed method (using `set.update()` with list comprehensions instead of set comprehensions) likely resulted in degraded performance or increased resource usage. This happens because Python's built-in set comprehensions are often highly optimized at the C level, and manual 'optimizations' can introduce new overheads (e.g., intermediate list creation, Python-level loop for `update`) that negate or worsen performance relative to the baseline. The 'failure' status and score of 4.2400 suggest the desired optimization was not achieved, and potentially led to a worse outcome.", "fix_direction": "Instead of pre-optimizing based on assumptions about allocation overhead, profile the original SymSpell deletion generation implementation to identify actual bottlenecks. If set comprehensions are identified as a bottleneck, investigate alternative C-level extensions or more fundamental algorithmic changes rather than reimplementing built-in behavior with less optimized Python constructs. Trust Python's highly optimized built-ins unless profiling data explicitly indicates otherwise.", "confidence": 0.9}, "drafts_generated": 1, "drafts_survived": 1}
{"id": "7adcdc9b-b406-46ec-ace3-2daf4db84fdd", "target_id": "B3-control", "git_sha": "13fecfaffe3e845c9a315c1418ff5efac1f2aeaf", "pre_experiment_sha": "e481e7d6edb4dc055e54b161484a1c48100b0bbf", "timestamp": "2026-04-23T14:03:17.860924+00:00", "hypothesis": "Optimize SymSpell deletion generation by unifying 1-deletions and 2-deletions into a single standard set comprehension, eliminating the need for list allocations and `update` calls while strictly adhering to the avoidance rules.", "hypothesis_source": "agent", "mutation_diff_summary": "", "score": 4.09, "score_ci_lower": null, "score_ci_upper": null, "raw_scores": null, "baseline_score": 3.93, "outcome": "KEPT", "failure_mode": null, "duration_seconds": 143.24636683403514, "tags": ["micro-optimization", "set-comprehension", "memory-allocation"], "learnings": "{\"what_changed\":\"\",\"what_improved\":[],\"what_regressed\":[],\"transferable_insight\":\"Consolidating multi-step collection updates into a single comprehension eliminates intermediate memory allocations and reduces overhead, improving overall execution efficiency.\",\"domain_tags\":[\"Performance Optimization\",\"Memory Management\",\"Code Refactoring\"]}", "cost_usd": 0.04889625000000001, "bootstrap_seed": 0, "agent_model": "gemini-3.1-pro-preview", "held_out_score": null, "criterion_names": null, "per_criterion_scores": null, "failure_classification": null, "drafts_generated": 1, "drafts_survived": 1}
{"id": "71d8bb55-9da4-4114-bd43-4df5cba80eb9", "target_id": "B3-control", "git_sha": "1e95b178bf30741af515db9bd590fe3d67957207", "pre_experiment_sha": "13fecfaffe3e845c9a315c1418ff5efac1f2aeaf", "timestamp": "2026-04-23T14:10:56.090420+00:00", "hypothesis": "Optimize candidate generation by replacing the set comprehension with a faster `for d in dels: if d in b_dels: candidates.update(b_dels[d])` loop to reduce Python-level iteration overhead.", "hypothesis_source": "agent", "mutation_diff_summary": "", "score": 4.02, "score_ci_lower": null, "score_ci_upper": null, "raw_scores": null, "baseline_score": 4.09, "outcome": "KEPT", "failure_mode": null, "duration_seconds": 148.23989758291282, "tags": ["micro-optimization", "loop-simplification", "set-update"], "learnings": "{\"what_changed\":\"\",\"what_improved\":[],\"what_regressed\":[],\"transferable_insight\":\"Replacing collection comprehensions with explicit loops that utilize optimized bulk-update methods can reduce iteration overhead and improve execution speed.\",\"domain_tags\":[\"Code Optimization\",\"Performance Tuning\",\"Software Engineering\"]}", "cost_usd": 0.048907500000000007, "bootstrap_seed": 0, "agent_model": "gemini-3.1-pro-preview", "held_out_score": null, "criterion_names": null, "per_criterion_scores": null, "failure_classification": null, "drafts_generated": 1, "drafts_survived": 1}
{"id": "a6ad7bbc-96eb-4f81-8181-9a015169fcfb", "target_id": "B3-control", "git_sha": "41a5e5b0bb0d522fed069cff9461b88847a289b5", "pre_experiment_sha": "1e95b178bf30741af515db9bd590fe3d67957207", "timestamp": "2026-04-23T14:15:32.725667+00:00", "hypothesis": "Optimize SymSpell deletion generation and candidate initialization by pre-populating `b_dels` with a dictionary comprehension and directly iterating over the deletion set comprehensions, eliminating redundant set modifications (`.add()`) and local variable assignments.", "hypothesis_source": "agent", "mutation_diff_summary": "", "score": 3.88, "score_ci_lower": null, "score_ci_upper": null, "raw_scores": null, "baseline_score": 4.02, "outcome": "KEPT", "failure_mode": null, "duration_seconds": 242.10578637500294, "tags": ["micro-optimization", "dictionary-comprehension", "set-comprehension", "memory-allocation"], "learnings": "{\"what_changed\":\"\",\"what_improved\":[],\"what_regressed\":[],\"transferable_insight\":\"Replacing iterative collection modifications and intermediate variable assignments with native comprehensions reduces execution overhead and improves performance.\",\"domain_tags\":[\"Performance Optimization\",\"Code Refactoring\",\"Language Features\"]}", "cost_usd": 0.048990000000000006, "bootstrap_seed": 0, "agent_model": "gemini-3.1-pro-preview", "held_out_score": null, "criterion_names": null, "per_criterion_scores": null, "failure_classification": null, "drafts_generated": 1, "drafts_survived": 1}
{"id": "ecf69ddb-cf9f-46d5-bff4-9e75167016dd", "target_id": "B3-control", "git_sha": "7dcec69c98a1dba770321ea4b783ddb05c47bd20", "pre_experiment_sha": "41a5e5b0bb0d522fed069cff9461b88847a289b5", "timestamp": "2026-04-23T14:20:38.504666+00:00", "hypothesis": "Optimize function call overhead by omitting the default `threshold=2` argument in tight loop `_levenshtein` calls and converting keyword arguments to positional in `run_benchmark`.", "hypothesis_source": "agent", "mutation_diff_summary": "", "score": 3.9, "score_ci_lower": null, "score_ci_upper": null, "raw_scores": null, "baseline_score": 3.88, "outcome": "KEPT", "failure_mode": null, "duration_seconds": 293.46957550011575, "tags": ["micro-optimization", "function-call-overhead", "argument-passing"], "learnings": "{\"what_changed\":\"\",\"what_improved\":[],\"what_regressed\":[],\"transferable_insight\":\"Minimizing function call overhead in tight loops by using positional arguments and omitting explicit default values can yield measurable performance improvements.\",\"domain_tags\":[\"Performance Optimization\",\"Code Optimization\"]}", "cost_usd": 0.04882625, "bootstrap_seed": 0, "agent_model": "gemini-3.1-pro-preview", "held_out_score": null, "criterion_names": null, "per_criterion_scores": null, "failure_classification": null, "drafts_generated": 1, "drafts_survived": 1}
{"id": "12e515e4-3463-4f96-9e3a-161fe3394b85", "target_id": "B3-control", "git_sha": "4ed045ece7e5ac1c888510090fe014538a7c82c6", "pre_experiment_sha": "7dcec69c98a1dba770321ea4b783ddb05c47bd20", "timestamp": "2026-04-23T14:25:43.945863+00:00", "hypothesis": "Optimize O(1) slice comparison branching in `_levenshtein` by evaluating the statistically more probable `diff == 1` case before `diff == 0` to reduce average branch evaluation overhead.", "hypothesis_source": "agent", "mutation_diff_summary": "", "score": 4.0, "score_ci_lower": null, "score_ci_upper": null, "raw_scores": null, "baseline_score": 3.9, "outcome": "KEPT", "failure_mode": null, "duration_seconds": 269.9714064169675, "tags": ["micro-optimization", "branch-prediction", "probability-tuning"], "learnings": "{\"what_changed\":\"\",\"what_improved\":[],\"what_regressed\":[],\"transferable_insight\":\"Ordering conditional checks to evaluate statistically more probable cases first reduces average branch evaluation overhead and improves overall performance.\",\"domain_tags\":[\"Performance Optimization\",\"Algorithm Design\",\"Control Flow\"]}", "cost_usd": 0.04883125000000001, "bootstrap_seed": 0, "agent_model": "gemini-3.1-pro-preview", "held_out_score": null, "criterion_names": null, "per_criterion_scores": null, "failure_classification": null, "drafts_generated": 1, "drafts_survived": 1}
{"id": "7ac2654a-4082-4f3e-94ac-c6aff0e4778f", "target_id": "B3-control", "git_sha": "0f0bd77edf0d7da06ad9c53b016c5bc195db4200", "pre_experiment_sha": "4ed045ece7e5ac1c888510090fe014538a7c82c6", "timestamp": "2026-04-23T14:29:18.884527+00:00", "hypothesis": "Optimize candidate generation by replacing the Python-level `for` loop and `update` calls with a single, fast set comprehension, incorporating the original string `a` directly into the deletion set to unify the lookup process.", "hypothesis_source": "agent", "mutation_diff_summary": "", "score": 3.89, "score_ci_lower": null, "score_ci_upper": null, "raw_scores": null, "baseline_score": 4.0, "outcome": "KEPT", "failure_mode": null, "duration_seconds": 171.2814751251135, "tags": ["micro-optimization", "set-comprehension", "loop-simplification"], "learnings": "{\"what_changed\":\"\",\"what_improved\":[],\"what_regressed\":[],\"transferable_insight\":\"Replacing iterative loops and repeated method calls with native comprehensions and unified data structures reduces execution overhead.\",\"domain_tags\":[\"Performance Optimization\",\"Code Refactoring\",\"Software Engineering\"]}", "cost_usd": 0.04884625000000001, "bootstrap_seed": 0, "agent_model": "gemini-3.1-pro-preview", "held_out_score": null, "criterion_names": null, "per_criterion_scores": null, "failure_classification": null, "drafts_generated": 1, "drafts_survived": 1}
{"id": "a4e4981b-138f-4acb-9be6-56461cc49e67", "target_id": "B3-control", "git_sha": "0f0bd77edf0d7da06ad9c53b016c5bc195db4200", "pre_experiment_sha": "0f0bd77edf0d7da06ad9c53b016c5bc195db4200", "timestamp": "2026-04-23T14:33:52.557717+00:00", "hypothesis": "Optimize candidate generation by utilizing C-level set intersection to filter deletions before iterating, and eliminate function call overhead by converting the `threshold` argument to positional in `_levenshtein`.", "hypothesis_source": "agent", "mutation_diff_summary": "", "score": 21.33, "score_ci_lower": null, "score_ci_upper": null, "raw_scores": null, "baseline_score": 3.89, "outcome": "DISCARDED", "failure_mode": null, "duration_seconds": 261.9886818751693, "tags": ["micro-optimization", "set-intersection", "function-call-overhead", "positional-arguments"], "learnings": "{\"what_changed\":\"\",\"what_improved\":[],\"what_regressed\":[],\"transferable_insight\":\"Micro-optimizations aimed at reducing execution overhead, such as altering parameter passing or pre-filtering with native structures, can be counterproductive if the setup costs outweigh the theoretical savings.\",\"domain_tags\":[\"Performance Optimization\",\"Micro-optimization\",\"Software Engineering\"]}", "cost_usd": 0.048953250000000004, "bootstrap_seed": 0, "agent_model": "gemini-3.1-pro-preview", "held_out_score": null, "criterion_names": null, "per_criterion_scores": null, "failure_classification": {"category": "logic_error", "description": "The attempts to optimize candidate generation via C-level set intersection or by converting the `threshold` argument to positional likely introduced subtle bugs in the filtering logic or the Levenshtein distance calculation. These errors led to incorrect candidate sets or inaccurate distance computations, resulting in the experiment's failure and a poor score. The 'unknown' failure mode suggests the error was not a simple crash but rather a propagation of incorrect logic leading to bad results.", "fix_direction": "Focus on thorough unit and integration testing of both the new C-level filtering logic and the modified `_levenshtein` function. Isolate and debug any calculation or filtering errors, ensuring correctness and reproducibility before optimizing for performance. Implement robust logging for intermediate states of candidate generation and Levenshtein computations to pinpoint the source of the incorrect logic.", "confidence": 0.9}, "drafts_generated": 1, "drafts_survived": 1}
{"id": "07055e98-bbe4-425f-a4ef-97bbb0f0ed72", "target_id": "B3-control", "git_sha": "0f0bd77edf0d7da06ad9c53b016c5bc195db4200", "pre_experiment_sha": "0f0bd77edf0d7da06ad9c53b016c5bc195db4200", "timestamp": "2026-04-23T14:39:12.330107+00:00", "hypothesis": "Combine sequential O(1) slice comparisons using `or` to reduce bytecode size and instruction overhead, and inline the `candidates` set comprehension directly into the iteration loop to eliminate a local variable assignment.", "hypothesis_source": "agent", "mutation_diff_summary": "", "score": 3.93, "score_ci_lower": null, "score_ci_upper": null, "raw_scores": null, "baseline_score": 3.89, "outcome": "DISCARDED", "failure_mode": null, "duration_seconds": 283.23543970799074, "tags": ["micro-optimization", "bytecode-reduction", "variable-elimination"], "learnings": "{\"what_changed\":\"\",\"what_improved\":[],\"what_regressed\":[],\"transferable_insight\":\"Condensing code to reduce bytecode size, such as by inlining variables or combining logical checks, can degrade performance by increasing runtime evaluation overhead.\",\"domain_tags\":[\"Code Optimization\",\"Performance Tuning\",\"Interpreter Dynamics\"]}", "cost_usd": 0.0488723, "bootstrap_seed": 0, "agent_model": "gemini-3.1-pro-preview", "held_out_score": null, "criterion_names": null, "per_criterion_scores": null, "failure_classification": {"category": "over_optimization", "description": "The experiment attempted micro-optimizations by combining sequential O(1) slice comparisons and inlining a set comprehension to reduce bytecode size, instruction overhead, and eliminate a local variable. These specific low-level tweaks likely did not yield the intended performance benefits, or possibly even introduced new overheads or made the code less efficient for the interpreter/JIT compiler, leading to the reported low score despite the optimization goals.", "fix_direction": "Avoid speculative micro-optimizations based on bytecode size or variable elimination without empirical profiling data. Focus on algorithmic improvements, efficient data structures, and identifying actual performance bottlenecks with profiling tools. Revert these specific changes and establish a new performance baseline.", "confidence": 0.95}, "drafts_generated": 1, "drafts_survived": 1}
