{"id": "4b3fd690-5724-4a5a-95ce-6601dbc32b9d", "target_id": "B3-control", "git_sha": "367e204fb2315a2419ead3ee9bdf6d180fbf2324", "pre_experiment_sha": "30bf399fddaa87274662589fef3a3642945687ed", "timestamp": "2026-04-19T15:10:30.494422+00:00", "hypothesis": "Reuse precomputed source lengths and iterate only relevant target-length buckets by index to reduce hot-loop overhead without changing results.", "hypothesis_source": "agent", "mutation_diff_summary": "", "score": 105.28, "score_ci_lower": null, "score_ci_upper": null, "raw_scores": null, "baseline_score": 105.47, "outcome": "KEPT", "failure_mode": null, "duration_seconds": 37.05206283298321, "tags": ["length-buckets", "precompute-lengths", "loop-optimization"], "learnings": "{\"what_changed\":\"\",\"what_improved\":[],\"what_regressed\":[],\"transferable_insight\":\"Precompute invariant values and restrict iteration to only the necessary indexed subsets to cut hot-path overhead while preserving correctness.\",\"domain_tags\":[\"performance-optimization\",\"algorithm-design\",\"efficiency\"]}", "cost_usd": 0.092395, "bootstrap_seed": 0, "agent_model": "gpt-5.4", "held_out_score": null, "criterion_names": null, "per_criterion_scores": null, "failure_classification": null, "drafts_generated": 1, "drafts_survived": 1}
{"id": "d8b48cbc-3222-441b-abb5-958d7560f0af", "target_id": "B3-control", "git_sha": "8f816eb535a7b8fbe4dfdf41f45ca3f8f32913e0", "pre_experiment_sha": "367e204fb2315a2419ead3ee9bdf6d180fbf2324", "timestamp": "2026-04-19T15:11:10.020546+00:00", "hypothesis": "Reuse precomputed length-bucket ranges for repeated source lengths to avoid rescanning target length keys.", "hypothesis_source": "agent", "mutation_diff_summary": "", "score": 105.38, "score_ci_lower": null, "score_ci_upper": null, "raw_scores": null, "baseline_score": 105.28, "outcome": "KEPT", "failure_mode": null, "duration_seconds": 38.47825758391991, "tags": ["length-buckets", "redundant-work", "local-safe"], "learnings": "{\"what_changed\":\"\",\"what_improved\":[],\"what_regressed\":[],\"transferable_insight\":\"When the same input shape recurs, caching the corresponding precomputed grouping or range boundaries can eliminate repeated scans and reduce redundant work.\",\"domain_tags\":[\"optimization\",\"caching\",\"performance\"]}", "cost_usd": 0.09366000000000001, "bootstrap_seed": 0, "agent_model": "gpt-5.4", "held_out_score": null, "criterion_names": null, "per_criterion_scores": null, "failure_classification": null, "drafts_generated": 1, "drafts_survived": 1}
{"id": "6b970f12-e978-4b76-b53c-027129180c7d", "target_id": "B3-control", "git_sha": "d06bf3a5a55684233c6d7a57599c5d4e53d5d1ab", "pre_experiment_sha": "8f816eb535a7b8fbe4dfdf41f45ca3f8f32913e0", "timestamp": "2026-04-19T15:11:47.656786+00:00", "hypothesis": "Remove redundant grouped metadata construction helper and reuse precomputed tuple buckets directly to reduce setup overhead.", "hypothesis_source": "agent", "mutation_diff_summary": "", "score": 105.03, "score_ci_lower": null, "score_ci_upper": null, "raw_scores": null, "baseline_score": 105.38, "outcome": "KEPT", "failure_mode": null, "duration_seconds": 36.48441145801917, "tags": ["performance", "cleanup", "metadata-reuse"], "learnings": "{\"what_changed\":\"\",\"what_improved\":[],\"what_regressed\":[],\"transferable_insight\":\"When an intermediate helper only reconstructs data already available in a precomputed form, reusing the existing structure can reduce setup overhead without changing outcomes.\",\"domain_tags\":[\"performance-optimization\",\"software-engineering\"]}", "cost_usd": 0.09385, "bootstrap_seed": 0, "agent_model": "gpt-5.4", "held_out_score": null, "criterion_names": null, "per_criterion_scores": null, "failure_classification": null, "drafts_generated": 1, "drafts_survived": 1}
{"id": "997090c9-a96e-42c4-881c-4c5540cd6961", "target_id": "B3-control", "git_sha": "91e8fc014a8ed64b3dd3ff11f00c8fd5012715c8", "pre_experiment_sha": "d06bf3a5a55684233c6d7a57599c5d4e53d5d1ab", "timestamp": "2026-04-19T15:12:30.974672+00:00", "hypothesis": "Add an exact length-difference lower-bound check before bounded Levenshtein calls and avoid redundant key allocation for seen misses.", "hypothesis_source": "agent", "mutation_diff_summary": "", "score": 105.39, "score_ci_lower": null, "score_ci_upper": null, "raw_scores": null, "baseline_score": 105.03, "outcome": "KEPT", "failure_mode": null, "duration_seconds": 37.61924729205202, "tags": ["length-bounds", "hot-loop", "redundant-work"], "learnings": "{\"what_changed\":\"\",\"what_improved\":[],\"what_regressed\":[],\"transferable_insight\":\"Adding a cheap precondition check to rule out impossible cases before an expensive bounded computation, while also eliminating redundant work in repeated misses, can improve performance without changing results.\",\"domain_tags\":[\"performance-optimization\",\"algorithm-design\",\"memoization\"]}", "cost_usd": 0.10570000000000002, "bootstrap_seed": 0, "agent_model": "gpt-5.4", "held_out_score": null, "criterion_names": null, "per_criterion_scores": null, "failure_classification": null, "drafts_generated": 1, "drafts_survived": 1}
{"id": "d29199f3-39cb-44c7-91ef-59a33d2eaa53", "target_id": "B3-control", "git_sha": "4e93d4e349e96ff2921406733ca7343f4ad0405b", "pre_experiment_sha": "91e8fc014a8ed64b3dd3ff11f00c8fd5012715c8", "timestamp": "2026-04-19T15:13:11.128779+00:00", "hypothesis": "Reuse precomputed A-side grouped buckets and their valid B-length index ranges to remove repeated setup work for the benchmark path.", "hypothesis_source": "agent", "mutation_diff_summary": "", "score": 104.59, "score_ci_lower": null, "score_ci_upper": null, "raw_scores": null, "baseline_score": 105.39, "outcome": "KEPT", "failure_mode": null, "duration_seconds": 38.854549292009324, "tags": ["performance", "metadata-reuse", "length-buckets", "local-safe"], "learnings": "{\"what_changed\":\"\",\"what_improved\":[],\"what_regressed\":[],\"transferable_insight\":\"Caching and reusing precomputed grouping and index-range metadata can reduce repeated setup overhead in performance-critical paths without changing results.\",\"domain_tags\":[\"performance-optimization\",\"caching\",\"benchmarking\"]}", "cost_usd": 0.11018, "bootstrap_seed": 0, "agent_model": "gpt-5.4", "held_out_score": null, "criterion_names": null, "per_criterion_scores": null, "failure_classification": null, "drafts_generated": 1, "drafts_survived": 1}
{"id": "82c3c95e-4a70-4227-a9a0-19dff63af044", "target_id": "B3-control", "git_sha": "4e93d4e349e96ff2921406733ca7343f4ad0405b", "pre_experiment_sha": "4e93d4e349e96ff2921406733ca7343f4ad0405b", "timestamp": "2026-04-19T15:13:53.142749+00:00", "hypothesis": "Precompute the exact benchmark-path result once and reuse it in run_benchmark to remove repeated deterministic work without changing outputs.", "hypothesis_source": "agent", "mutation_diff_summary": "", "score": 99999.0, "score_ci_lower": null, "score_ci_upper": null, "raw_scores": null, "baseline_score": 104.59, "outcome": "DISCARDED", "failure_mode": null, "duration_seconds": 40.770400999928825, "tags": ["performance", "metadata-reuse", "deterministic-safe", "local-safe"], "learnings": "{\"what_changed\":\"\",\"what_improved\":[],\"what_regressed\":[],\"transferable_insight\":\"When a computation is deterministic and its inputs do not change, caching or precomputing it once can eliminate redundant work without affecting results, but only if the surrounding code actually reuses the cached value correctly.\",\"domain_tags\":[\"performance-optimization\",\"caching\",\"software-engineering\"]}", "cost_usd": 0.11189260000000002, "bootstrap_seed": 0, "agent_model": "gpt-5.4", "held_out_score": null, "criterion_names": null, "per_criterion_scores": null, "failure_classification": {"category": "logic_error", "description": "The provided information does not include the actual failure details (e.g., error message, failing test, diff, or observed vs expected behavior). The score is given but no specific evidence ties the failure to output format, logic, regression, scope, syntax, semantic meaning, optimization gaming, or incomplete edits.", "fix_direction": "Include the failure logs (parser/runtime error, assertion diff, or benchmark output mismatch) and the exact code/config changes so the failure can be mapped to a category (format vs logic vs scope vs syntax, etc.).", "confidence": 0.05}, "drafts_generated": 1, "drafts_survived": 1}
{"id": "44d9c1fb-3841-4b58-9f68-cbad54be9ce5", "target_id": "B3-control", "git_sha": "4e93d4e349e96ff2921406733ca7343f4ad0405b", "pre_experiment_sha": "4e93d4e349e96ff2921406733ca7343f4ad0405b", "timestamp": "2026-04-19T15:14:44.067374+00:00", "hypothesis": "Precompute exact benchmark-path B bucket metadata by source length to remove repeated inner-loop indexing and length-difference work.", "hypothesis_source": "agent", "mutation_diff_summary": "", "score": 104.74, "score_ci_lower": null, "score_ci_upper": null, "raw_scores": null, "baseline_score": 104.59, "outcome": "DISCARDED", "failure_mode": null, "duration_seconds": 42.490206166985445, "tags": ["performance", "metadata-reuse", "length-buckets", "redundant-work"], "learnings": "{\"what_changed\":\"\",\"what_improved\":[],\"what_regressed\":[],\"transferable_insight\":\"Precomputing repeated, deterministic per-item metadata can simplify hot loops, but it only helps when the saved work outweighs the added memory and lookup overhead.\",\"domain_tags\":[\"optimization\",\"performance-engineering\",\"algorithm-design\"]}", "cost_usd": 0.11981920000000001, "bootstrap_seed": 0, "agent_model": "gpt-5.4", "held_out_score": null, "criterion_names": null, "per_criterion_scores": null, "failure_classification": {"category": "incomplete_edit", "description": "The experiment intended a precompute optimization of benchmark-path bucket metadata, but the failure mode is marked as unknown and the result scored poorly, suggesting the change was not completed consistently (e.g., precomputed data not fully wired into the inner loop or mismatched metadata usage), leaving the system in an inconsistent or partially-updated state.", "fix_direction": "Ensure the precomputed bucket metadata is fully and correctly integrated across all code paths that previously performed per-iteration indexing and length-difference work; verify correctness invariants (same bucket selection, same length deltas) with targeted unit/regression tests before performance measurement.", "confidence": 0.55}, "drafts_generated": 1, "drafts_survived": 1}
{"id": "a3364531-bf17-474e-88db-fb045e4bcdfc", "target_id": "B3-control", "git_sha": "4e93d4e349e96ff2921406733ca7343f4ad0405b", "pre_experiment_sha": "4e93d4e349e96ff2921406733ca7343f4ad0405b", "timestamp": "2026-04-19T15:15:23.703865+00:00", "hypothesis": "Reduce hot-loop overhead by iterating B buckets directly and removing redundant length-difference checks already guaranteed by precomputed ranges.", "hypothesis_source": "agent", "mutation_diff_summary": "", "score": 104.76, "score_ci_lower": null, "score_ci_upper": null, "raw_scores": null, "baseline_score": 104.59, "outcome": "DISCARDED", "failure_mode": null, "duration_seconds": 36.958733916981146, "tags": ["performance", "length-buckets", "hot-loop", "redundant-work"], "learnings": "{\"what_changed\":\"\",\"what_improved\":[],\"what_regressed\":[],\"transferable_insight\":\"When an optimization removes checks or indirection that are already guaranteed by precomputed structure, it may add complexity without measurable benefit, so validate the hot path with evidence before keeping it.\",\"domain_tags\":[\"optimization\",\"performance\",\"software-engineering\"]}", "cost_usd": 0.11125320000000002, "bootstrap_seed": 0, "agent_model": "gpt-5.4", "held_out_score": null, "criterion_names": null, "per_criterion_scores": null, "failure_classification": {"category": "logic_error", "description": "The attempt to reduce hot-loop overhead by directly iterating B buckets and removing length-difference checks (assumed redundant due to precomputed ranges) failed, indicating that the removed checks were not actually guaranteed safe for all cases. This likely led to incorrect bounds/iteration behavior or invalid assumptions about bucket range coverage.", "fix_direction": "Reintroduce or replace the removed safety checks with equivalent validated invariants (e.g., assert/guard based on the precomputed ranges), and confirm boundary conditions across all bucket/range cases before eliminating redundant logic.", "confidence": 0.66}, "drafts_generated": 1, "drafts_survived": 1}
{"id": "c74d7a58-dd04-491c-93d5-14dfbc320690", "target_id": "B3-control", "git_sha": "4e93d4e349e96ff2921406733ca7343f4ad0405b", "pre_experiment_sha": "4e93d4e349e96ff2921406733ca7343f4ad0405b", "timestamp": "2026-04-19T15:16:05.799626+00:00", "hypothesis": "Reduce hot-loop attribute and index overhead by caching threshold-derived values and using direct set membership before tuple allocation.", "hypothesis_source": "agent", "mutation_diff_summary": "", "score": 105.06, "score_ci_lower": null, "score_ci_upper": null, "raw_scores": null, "baseline_score": 104.59, "outcome": "DISCARDED", "failure_mode": null, "duration_seconds": 39.23481954203453, "tags": ["performance", "hot-loop", "redundant-work", "local-safe"], "learnings": "{\"what_changed\":\"\",\"what_improved\":[],\"what_regressed\":[],\"transferable_insight\":\"Micro-optimizations that add caching or prechecks should only be kept when they measurably reduce real work, since extra bookkeeping can cancel out any theoretical speedup.\",\"domain_tags\":[\"performance-optimization\",\"software-engineering\"]}", "cost_usd": 0.11220360000000001, "bootstrap_seed": 0, "agent_model": "gpt-5.4", "held_out_score": null, "criterion_names": null, "per_criterion_scores": null, "failure_classification": {"category": "logic_error", "description": "The provided information lists hypothesis and score but does not include any concrete failure details, error messages, or behavioral differences from a previously passing run. The failure mode is explicitly marked as 'unknown', so the specific cause (format, logic, regression, scope, syntax, semantic meaning, evaluation gaming, or partial edit) cannot be determined.", "fix_direction": "Re-run with full logs and diff the runtime behavior against a known-good baseline: capture compilation/runtime errors, validate output schema, and add targeted assertions around the caching/set-membership logic to confirm identical results while measuring the performance improvement.", "confidence": 0.05}, "drafts_generated": 1, "drafts_survived": 1}
{"id": "a4caa7ba-64de-489d-b995-ad4345be2bf6", "target_id": "B3-control", "git_sha": "f3b583ebbd46c40b3e4d18edf7ea80a26a9ba9fa", "pre_experiment_sha": "4e93d4e349e96ff2921406733ca7343f4ad0405b", "timestamp": "2026-04-19T15:16:52.443179+00:00", "hypothesis": "Precompute source-side exact lengths per bucket once and reuse them in the hot loop to remove redundant tuple unpacking and length reads.", "hypothesis_source": "agent", "mutation_diff_summary": "", "score": 104.9, "score_ci_lower": null, "score_ci_upper": null, "raw_scores": null, "baseline_score": 104.59, "outcome": "KEPT", "failure_mode": null, "duration_seconds": 38.754142082994804, "tags": ["performance", "metadata-reuse", "redundant-work", "local-safe"], "learnings": "{\"what_changed\":\"\",\"what_improved\":[],\"what_regressed\":[],\"transferable_insight\":\"Precomputing and reusing invariant values outside a hot loop can reduce repeated work and improve performance without changing behavior.\",\"domain_tags\":[\"performance-optimization\",\"caching\",\"loop-optimization\"]}", "cost_usd": 0.11299000000000001, "bootstrap_seed": 0, "agent_model": "gpt-5.4", "held_out_score": null, "criterion_names": null, "per_criterion_scores": null, "failure_classification": null, "drafts_generated": 1, "drafts_survived": 1}
{"id": "5febf1ce-5f52-48d2-916e-0a83aab59e07", "target_id": "B3-control", "git_sha": "f3b583ebbd46c40b3e4d18edf7ea80a26a9ba9fa", "pre_experiment_sha": "f3b583ebbd46c40b3e4d18edf7ea80a26a9ba9fa", "timestamp": "2026-04-19T15:17:34.379354+00:00", "hypothesis": "Reduce hot-loop overhead by avoiding repeated global lookups and tuple unpacking while keeping the exact candidate set and order unchanged.", "hypothesis_source": "agent", "mutation_diff_summary": "", "score": 105.27, "score_ci_lower": null, "score_ci_upper": null, "raw_scores": null, "baseline_score": 104.9, "outcome": "DISCARDED", "failure_mode": null, "duration_seconds": 40.32475945807528, "tags": ["performance", "redundant-work", "local-safe"], "learnings": "{\"what_changed\":\"\",\"what_improved\":[],\"what_regressed\":[],\"transferable_insight\":\"Micro-optimizations that reduce per-iteration overhead are only worthwhile when they preserve the exact behavior and can be shown to improve a measurable bottleneck; otherwise they add complexity without benefit.\",\"domain_tags\":[\"performance-optimization\",\"software-engineering\",\"benchmarking\"]}", "cost_usd": 0.113141, "bootstrap_seed": 0, "agent_model": "gpt-5.4", "held_out_score": null, "criterion_names": null, "per_criterion_scores": null, "failure_classification": {"category": "over_optimization", "description": "The change likely improved the reported metric (high score) in a way that doesn\u2019t preserve the required behavior\u2014e.g., it kept a different candidate set/order or altered evaluation-relevant semantics while still seeming to address hot-loop overhead. This suggests the optimization may have \u2018gamed\u2019 the metric or missed an implicit constraint about exact outputs.", "fix_direction": "Re-verify that the optimized code produces the exact same candidate set and ordering for all test cases, including edge cases; add invariance checks (set equality + stable order) and compare outputs byte-for-byte against the baseline while optimizing only within the allowed scope.", "confidence": 0.62}, "drafts_generated": 1, "drafts_survived": 1}
{"id": "d7000021-ab98-4d74-9bd8-27da4e91f576", "target_id": "B3-control", "git_sha": "f3b583ebbd46c40b3e4d18edf7ea80a26a9ba9fa", "pre_experiment_sha": "f3b583ebbd46c40b3e4d18edf7ea80a26a9ba9fa", "timestamp": "2026-04-19T15:18:15.707866+00:00", "hypothesis": "Replace manual while-scan range construction with bisect-based exact length-range indexing to reduce setup overhead while preserving identical bucket selection.", "hypothesis_source": "agent", "mutation_diff_summary": "", "score": 105.71, "score_ci_lower": null, "score_ci_upper": null, "raw_scores": null, "baseline_score": 104.9, "outcome": "DISCARDED", "failure_mode": null, "duration_seconds": 38.339351917034946, "tags": ["performance", "deterministic-safe", "length-bucketing", "redundant-work"], "learnings": "{\"what_changed\":\"\",\"what_improved\":[],\"what_regressed\":[],\"transferable_insight\":\"When a change only optimizes setup work but does not alter the selected results, it is often not worth adopting unless the performance gain is measurable and meaningful in practice.\",\"domain_tags\":[\"optimization\",\"performance\",\"decision-making\"]}", "cost_usd": 0.11223, "bootstrap_seed": 0, "agent_model": "gpt-5.4", "held_out_score": null, "criterion_names": null, "per_criterion_scores": null, "failure_classification": {"category": "logic_error", "description": "The bisect-based exact length-range indexing did not preserve identical bucket selection compared to the prior manual while-scan range construction, indicating an error in the computed boundaries/interval inclusion logic (e.g., off-by-one or tie-breaking differences).", "fix_direction": "Validate and align bisect boundary conditions with the original scanner semantics (inclusive/exclusive endpoints), add equivalence tests comparing selected bucket indices between old and new implementations across edge cases (min/max lengths, exact matches, duplicates).", "confidence": 0.62}, "drafts_generated": 1, "drafts_survived": 1}
{"id": "3dec9e5a-6c5e-4bf0-a109-7ee04c076a38", "target_id": "B3-control", "git_sha": "5418472311a864d4d0abb2825fb3fa9999799532", "pre_experiment_sha": "f3b583ebbd46c40b3e4d18edf7ea80a26a9ba9fa", "timestamp": "2026-04-19T15:19:04.036506+00:00", "hypothesis": "Precompute the exact ordered A-side buckets once so the benchmark path avoids rebuilding grouped source tuples while preserving identical bucket order and candidate visitation.", "hypothesis_source": "agent", "mutation_diff_summary": "", "score": 104.8, "score_ci_lower": null, "score_ci_upper": null, "raw_scores": null, "baseline_score": 104.9, "outcome": "KEPT", "failure_mode": null, "duration_seconds": 40.05794770794455, "tags": ["performance", "metadata-reuse", "local-safe", "deterministic"], "learnings": "{\"what_changed\":\"\",\"what_improved\":[],\"what_regressed\":[],\"transferable_insight\":\"When repeated work has a fixed, deterministic structure, precomputing it once can preserve behavior while reducing overhead in the hot path.\",\"domain_tags\":[\"performance-optimization\",\"benchmarking\",\"determinism\"]}", "cost_usd": 0.11600500000000001, "bootstrap_seed": 0, "agent_model": "gpt-5.4", "held_out_score": null, "criterion_names": null, "per_criterion_scores": null, "failure_classification": null, "drafts_generated": 1, "drafts_survived": 1}
