{"id": "dbc55da8-09b7-46cb-8ba0-504bcbd34bce", "target_id": "B3-control", "git_sha": "e043ab1da0dd5f5aa4df2f182d147d3f7e42b5cc", "pre_experiment_sha": "3b452d4d4a3bc0f302632065ef61cb2ba6a6552a", "timestamp": "2026-04-19T14:54:28.817373+00:00", "hypothesis": "Speed up the benchmark by adding bounded Levenshtein pruning and removing redundant work while preserving outputs.", "hypothesis_source": "agent", "mutation_diff_summary": "", "score": 139.74, "score_ci_lower": null, "score_ci_upper": null, "raw_scores": null, "baseline_score": 549.71, "outcome": "KEPT", "failure_mode": null, "duration_seconds": 29.143357041990384, "tags": ["optimization", "pruning", "dynamic-programming", "determinism"], "learnings": "{\"what_changed\":\"\",\"what_improved\":[],\"what_regressed\":[],\"transferable_insight\":\"Adding an early, bounded pruning check and eliminating duplicate computation can preserve results while substantially reducing runtime, even when no individual metric change is visible.\",\"domain_tags\":[\"optimization\",\"algorithm-design\",\"performance\"]}", "cost_usd": 0.07720500000000001, "bootstrap_seed": 0, "agent_model": "gpt-5.4", "held_out_score": null, "criterion_names": null, "per_criterion_scores": null, "failure_classification": null, "drafts_generated": 1, "drafts_survived": 1}
{"id": "4dd12af3-c5af-48bd-85bd-f63e1a111e96", "target_id": "B3-control", "git_sha": "e043ab1da0dd5f5aa4df2f182d147d3f7e42b5cc", "pre_experiment_sha": "e043ab1da0dd5f5aa4df2f182d147d3f7e42b5cc", "timestamp": "2026-04-19T14:55:03.251148+00:00", "hypothesis": "Pre-bucketing names by length and reusing DP buffers will reduce deterministic runtime without changing results.", "hypothesis_source": "agent", "mutation_diff_summary": "", "score": 139.74, "score_ci_lower": null, "score_ci_upper": null, "raw_scores": null, "baseline_score": 139.74, "outcome": "CRASHED", "failure_mode": "run_command exited with code 1: warning: `VIRTUAL_ENV=/Users/druk/WorkSpace/AetherForge/anneal/.venv` does not match the project environment path `.venv` and will be ignored; use `--active` to target the active environment instead\nTraceback (most recent call last):\n  File \"/Users/druk/WorkSpace/AetherForge/anneal/benchmarks/suite/harness/eval_b3.py\", line 124, in <module>\n    main()\n  File \"/Users/druk/WorkSpace/AetherForge/anneal/benchmarks/suite/harness/eval_b3.py\", line 116, in main\n    if not _verify_spot_checks(ARTIFACT):\n           ^^^^^^^^^^^^^^^^^^^^^^^^^^^^^\n  File \"/Users/druk/WorkSpace/AetherForge/anneal/benchmarks/suite/harness/eval_b3.py\", line 69, in _verify_spot_checks\n    pairs = find_fn(names_a, names_b, 2)\n            ^^^^^^^^^^^^^^^^^^^^^^^^^^^^\n  File \"/Users/druk/WorkSpace/AetherForge/anneal/.anneal/worktrees/B3-control/benchmarks/suite/artifacts/B3_utility_function.py\", line 192, in _find_close_pairs\n    group = buckets_b.get(candidate_len)\n            ^^^^^^^^^^^^^\nAttributeError: 'list' object has no attribute 'get'", "duration_seconds": 33.28083316597622, "tags": ["performance", "dynamic-programming", "pruning", "allocation-reduction"], "learnings": "{\"what_changed\":\"\",\"what_improved\":[],\"what_regressed\":[],\"transferable_insight\":\"An optimization that changes data grouping or buffer reuse can fail catastrophically if it introduces hidden assumptions about state management or edge-case handling, so validate correctness and memory safety before expecting performance gains.\",\"domain_tags\":[\"optimization\",\"reliability\",\"systems\"]}", "cost_usd": 0.079805, "bootstrap_seed": 0, "agent_model": "gpt-5.4", "held_out_score": null, "criterion_names": null, "per_criterion_scores": null, "failure_classification": null, "drafts_generated": 1, "drafts_survived": 1}
{"id": "89af20d4-a661-43f4-a495-b3d5a4e8cfe0", "target_id": "B3-control", "git_sha": "f7cd88d77ea48cd007aa7e305a91983d4d8d6d10", "pre_experiment_sha": "e043ab1da0dd5f5aa4df2f182d147d3f7e42b5cc", "timestamp": "2026-04-19T14:55:36.784358+00:00", "hypothesis": "Pre-indexing candidates by length and removing redundant deduplication will reduce deterministic runtime without changing results.", "hypothesis_source": "agent", "mutation_diff_summary": "", "score": 114.71, "score_ci_lower": null, "score_ci_upper": null, "raw_scores": null, "baseline_score": 139.74, "outcome": "KEPT", "failure_mode": null, "duration_seconds": 32.32793054205831, "tags": ["performance", "pruning", "indexing", "deterministic"], "learnings": "{\"what_changed\":\"\",\"what_improved\":[],\"what_regressed\":[],\"transferable_insight\":\"Precomputing simple lookup structures and eliminating unnecessary repeated work can improve deterministic performance without affecting correctness when the underlying results are unchanged.\",\"domain_tags\":[\"optimization\",\"algorithm design\",\"performance\"]}", "cost_usd": 0.077045, "bootstrap_seed": 0, "agent_model": "gpt-5.4", "held_out_score": null, "criterion_names": null, "per_criterion_scores": null, "failure_classification": null, "drafts_generated": 1, "drafts_survived": 1}
{"id": "149e805f-8e12-40ac-bbd5-5869747d3fc5", "target_id": "B3-control", "git_sha": "f7cd88d77ea48cd007aa7e305a91983d4d8d6d10", "pre_experiment_sha": "f7cd88d77ea48cd007aa7e305a91983d4d8d6d10", "timestamp": "2026-04-19T14:56:13.455279+00:00", "hypothesis": "Remove redundant dedup tracking and precompute grouped length bounds to reduce hot-path overhead without changing results.", "hypothesis_source": "agent", "mutation_diff_summary": "", "score": 99999.0, "score_ci_lower": null, "score_ci_upper": null, "raw_scores": null, "baseline_score": 114.71, "outcome": "DISCARDED", "failure_mode": null, "duration_seconds": 32.7990914999973, "tags": ["performance", "pruning", "dedup-removal", "precompute"], "learnings": "{\"what_changed\":\"\",\"what_improved\":[],\"what_regressed\":[],\"transferable_insight\":\"Optimizations that simplify bookkeeping and precompute invariant bounds can reduce overhead only if they preserve the exact behavior of the original hot path; otherwise, they should be discarded despite promising performance gains.\",\"domain_tags\":[\"optimization\",\"performance-engineering\",\"software-design\"]}", "cost_usd": 0.0784198, "bootstrap_seed": 0, "agent_model": "gpt-5.4", "held_out_score": null, "criterion_names": null, "per_criterion_scores": null, "failure_classification": {"category": "logic_error", "description": "Failure mode is unspecified (\u201cunknown\u201d) and no additional details are provided to determine what kind of break occurred (format, logic, regression, scope, syntax, semantic meaning, optimization gaming, or incomplete edit).", "fix_direction": "Re-run with instrumentation/logs to capture the exact failing symptom (diffs, failing tests, error messages, and behavioral deltas) and verify that the refactor preserves identical outputs; then narrow the failure category based on the observed mismatch.", "confidence": 0.05}, "drafts_generated": 1, "drafts_survived": 1}
{"id": "4d3dfd50-149b-4103-a7b4-73ad0629cfb6", "target_id": "B3-control", "git_sha": "f7cd88d77ea48cd007aa7e305a91983d4d8d6d10", "pre_experiment_sha": "f7cd88d77ea48cd007aa7e305a91983d4d8d6d10", "timestamp": "2026-04-19T14:56:48.548310+00:00", "hypothesis": "Precompute the grouped target lists and remove redundant deduplication in pair scanning.", "hypothesis_source": "agent", "mutation_diff_summary": "", "score": 99999.0, "score_ci_lower": null, "score_ci_upper": null, "raw_scores": null, "baseline_score": 114.71, "outcome": "DISCARDED", "failure_mode": null, "duration_seconds": 32.14093687501736, "tags": ["precompute", "length-bucketing", "remove-redundant-work", "hot-path"], "learnings": "{\"what_changed\":\"\",\"what_improved\":[],\"what_regressed\":[],\"transferable_insight\":\"Precomputing shared lookup structures can simplify repeated scans, but only if the added preprocessing and deduplication work does not outweigh the savings from avoiding redundant iteration.\",\"domain_tags\":[\"optimization\",\"algorithm-design\",\"performance\"]}", "cost_usd": 0.07846140000000001, "bootstrap_seed": 0, "agent_model": "gpt-5.4", "held_out_score": null, "criterion_names": null, "per_criterion_scores": null, "failure_classification": {"category": "incomplete_edit", "description": "The experiment failed with an unknown failure mode and an extremely high score value, suggesting the attempted change (precomputing grouped target lists / removing deduplication) likely left the code in an inconsistent or partially-applied state rather than producing a clear, parseable or logically-different result.", "fix_direction": "Ensure the refactor is end-to-end consistent: precompute groupings deterministically, keep deduplication semantics identical to the baseline (or prove equivalence), add tests for pair scanning correctness, and validate that all code paths use the new precomputed lists without leaving stale/unused logic.", "confidence": 0.58}, "drafts_generated": 1, "drafts_survived": 1}
{"id": "b6348605-ae79-4b6f-baa7-dc6f3bf22f71", "target_id": "B3-control", "git_sha": "f7cd88d77ea48cd007aa7e305a91983d4d8d6d10", "pre_experiment_sha": "f7cd88d77ea48cd007aa7e305a91983d4d8d6d10", "timestamp": "2026-04-19T14:57:24.086360+00:00", "hypothesis": "Precompute length buckets once and remove redundant deduplication in pair search.", "hypothesis_source": "agent", "mutation_diff_summary": "", "score": 99999.0, "score_ci_lower": null, "score_ci_upper": null, "raw_scores": null, "baseline_score": 114.71, "outcome": "DISCARDED", "failure_mode": null, "duration_seconds": 32.942612958024256, "tags": ["precompute", "length-bucketing", "remove-redundant-work", "hot-path"], "learnings": "{\"what_changed\":\"\",\"what_improved\":[],\"what_regressed\":[],\"transferable_insight\":\"When a proposed optimization only rearranges existing work without changing the underlying search space or eliminating a true bottleneck, it is unlikely to produce meaningful gains and should be discarded quickly.\",\"domain_tags\":[\"optimization\",\"performance-engineering\",\"algorithm-design\"]}", "cost_usd": 0.07819720000000001, "bootstrap_seed": 0, "agent_model": "gpt-5.4", "held_out_score": null, "criterion_names": null, "per_criterion_scores": null, "failure_classification": {"category": "logic_error", "description": "The experiment failed with an extremely high score (99999), indicating the change to precompute length buckets and remove redundant deduplication likely broke core search correctness or altered the matching semantics, even if the idea was performance-related. The failure mode is marked as unknown, but the symptom strongly suggests incorrect reasoning/behavior rather than formatting or parsing issues.", "fix_direction": "Reintroduce/validate deduplication correctness and confirm bucket precomputation preserves identical candidate sets and ordering; add targeted correctness tests comparing results before/after the change, including edge cases where deduplication matters.", "confidence": 0.62}, "drafts_generated": 1, "drafts_survived": 1}
{"id": "aae76736-411f-4228-a156-49cd9540681b", "target_id": "B3-control", "git_sha": "f7cd88d77ea48cd007aa7e305a91983d4d8d6d10", "pre_experiment_sha": "f7cd88d77ea48cd007aa7e305a91983d4d8d6d10", "timestamp": "2026-04-19T14:58:01.468915+00:00", "hypothesis": "Reduce hot-path overhead by precomputing candidate length buckets once and removing redundant dedup checks.", "hypothesis_source": "agent", "mutation_diff_summary": "", "score": 99999.0, "score_ci_lower": null, "score_ci_upper": null, "raw_scores": null, "baseline_score": 114.71, "outcome": "DISCARDED", "failure_mode": null, "duration_seconds": 32.059604708105326, "tags": ["performance", "length-bucketing", "dedup-removal", "local-optimization"], "learnings": "{\"what_changed\":\"\",\"what_improved\":[],\"what_regressed\":[],\"transferable_insight\":\"Optimizations that add upfront work or complexity should only be kept when they demonstrably reduce repeated cost on the critical path; otherwise, they can be discarded even if they seem theoretically cleaner.\",\"domain_tags\":[\"performance-optimization\",\"software-engineering\"]}", "cost_usd": 0.0791116, "bootstrap_seed": 0, "agent_model": "gpt-5.4", "held_out_score": null, "criterion_names": null, "per_criterion_scores": null, "failure_classification": {"category": "logic_error", "description": "Failure mode and details are not provided (only an unknown failure mode and an extremely high score), so it\u2019s not possible to determine whether the issue is format, logic, regression, scope, syntax, semantic meaning, optimization gaming, or an incomplete edit.", "fix_direction": "Collect failure logs/trace, the exact diff, and the specific observed mismatch (e.g., test output/schema difference, assertion failure, performance regression reason) to map the failure to a concrete category; then validate parsing/format first, followed by correctness/meaning checks.", "confidence": 0.05}, "drafts_generated": 1, "drafts_survived": 1}
{"id": "7556b58f-be72-45a9-9032-235b0dd6ec1b", "target_id": "B3-control", "git_sha": "b2e8416ba66061997aafd921f3440f4e87196816", "pre_experiment_sha": "f7cd88d77ea48cd007aa7e305a91983d4d8d6d10", "timestamp": "2026-04-19T14:58:37.664079+00:00", "hypothesis": "Precompute immutable string metadata and add safe prefix/length pruning to reduce bounded Levenshtein calls without changing results.", "hypothesis_source": "agent", "mutation_diff_summary": "", "score": 108.64, "score_ci_lower": null, "score_ci_upper": null, "raw_scores": null, "baseline_score": 114.71, "outcome": "KEPT", "failure_mode": null, "duration_seconds": 33.35746333305724, "tags": ["performance", "pruning", "indexing", "deterministic"], "learnings": "{\"what_changed\":\"\",\"what_improved\":[],\"what_regressed\":[],\"transferable_insight\":\"Precomputing invariant metadata and using conservative pruning bounds can reduce expensive repeated computations while preserving exact results.\",\"domain_tags\":[\"optimization\",\"algorithm-design\",\"performance\"]}", "cost_usd": 0.080275, "bootstrap_seed": 0, "agent_model": "gpt-5.4", "held_out_score": null, "criterion_names": null, "per_criterion_scores": null, "failure_classification": null, "drafts_generated": 1, "drafts_survived": 1}
{"id": "24505e5e-2542-4020-9643-5d9b02c42fa7", "target_id": "B3-control", "git_sha": "b2e8416ba66061997aafd921f3440f4e87196816", "pre_experiment_sha": "b2e8416ba66061997aafd921f3440f4e87196816", "timestamp": "2026-04-19T14:59:13.842394+00:00", "hypothesis": "Pre-index candidates by length and first-character to skip impossible comparisons while preserving output.", "hypothesis_source": "agent", "mutation_diff_summary": "", "score": 109.48, "score_ci_lower": null, "score_ci_upper": null, "raw_scores": null, "baseline_score": 108.64, "outcome": "DISCARDED", "failure_mode": null, "duration_seconds": 33.94369583297521, "tags": ["performance", "indexing", "pruning", "deterministic"], "learnings": "{\"what_changed\":\"\",\"what_improved\":[],\"what_regressed\":[],\"transferable_insight\":\"When a proposed optimization adds filtering logic, it only helps if the filter meaningfully reduces work without changing results; otherwise, it is likely to be discarded as unnecessary complexity.\",\"domain_tags\":[\"optimization\",\"filtering\",\"performance\"]}", "cost_usd": 0.0864848, "bootstrap_seed": 0, "agent_model": "gpt-5.4", "held_out_score": null, "criterion_names": null, "per_criterion_scores": null, "failure_classification": {"category": "logic_error", "description": "The attempted optimization (pre-indexing by length and first character) likely changed the comparison/search logic in a way that breaks correctness, producing a failed result rather than just speeding up or filtering candidates safely.", "fix_direction": "Preserve semantic equivalence: ensure the pre-filter cannot exclude valid matches; add tests that compare against the original baseline output for all edge cases (same length, different first char, empty/short strings, duplicates). Verify the filtered candidate set is a superset of true matches.", "confidence": 0.62}, "drafts_generated": 1, "drafts_survived": 1}
{"id": "0960710d-981b-4017-8006-96cf890ee366", "target_id": "B3-control", "git_sha": "432b91c7a705f291f2ceaaf28cbfeb2fc202bf8a", "pre_experiment_sha": "b2e8416ba66061997aafd921f3440f4e87196816", "timestamp": "2026-04-19T14:59:51.279857+00:00", "hypothesis": "Precompute immutable per-name metadata and iterate only relevant length buckets to reduce repeated work without changing matches.", "hypothesis_source": "agent", "mutation_diff_summary": "", "score": 107.64, "score_ci_lower": null, "score_ci_upper": null, "raw_scores": null, "baseline_score": 108.64, "outcome": "KEPT", "failure_mode": null, "duration_seconds": 30.976377542014234, "tags": ["performance", "precompute", "length-bucketing", "local-change"], "learnings": "{\"what_changed\":\"\",\"what_improved\":[],\"what_regressed\":[],\"transferable_insight\":\"When the set of possible matches is constrained by a stable key, precomputing immutable metadata and iterating only the relevant partitions can reduce repeated work without changing results.\",\"domain_tags\":[\"optimization\",\"algorithm design\",\"performance\"]}", "cost_usd": 0.08211500000000001, "bootstrap_seed": 0, "agent_model": "gpt-5.4", "held_out_score": null, "criterion_names": null, "per_criterion_scores": null, "failure_classification": null, "drafts_generated": 1, "drafts_survived": 1}
{"id": "d731d094-f262-46e1-bd64-873f310daa87", "target_id": "B3-control", "git_sha": "432b91c7a705f291f2ceaaf28cbfeb2fc202bf8a", "pre_experiment_sha": "432b91c7a705f291f2ceaaf28cbfeb2fc202bf8a", "timestamp": "2026-04-19T15:00:25.489044+00:00", "hypothesis": "Reduce repeated allocations and scans by grouping candidates by length once and reusing a bounded DP row buffer.", "hypothesis_source": "agent", "mutation_diff_summary": "", "score": 123.86, "score_ci_lower": null, "score_ci_upper": null, "raw_scores": null, "baseline_score": 107.64, "outcome": "DISCARDED", "failure_mode": null, "duration_seconds": 33.07719329104293, "tags": ["performance", "pruning", "precompute", "dp"], "learnings": "{\"what_changed\":\"\",\"what_improved\":[],\"what_regressed\":[],\"transferable_insight\":\"When an optimization adds complexity but yields no measurable improvement, it is often better to discard it and keep the simpler implementation.\",\"domain_tags\":[\"optimization\",\"software-engineering\",\"performance\"]}", "cost_usd": 0.08433860000000001, "bootstrap_seed": 0, "agent_model": "gpt-5.4", "held_out_score": null, "criterion_names": null, "per_criterion_scores": null, "failure_classification": {"category": "logic_error", "description": "The provided information does not include the specific failure symptoms (e.g., crash, incorrect output, performance regression definition, or parsing/runtime errors). Without details, the failure mode cannot be mapped to a concrete category among the listed options.", "fix_direction": "Capture the concrete failure evidence (error message/stack trace, diff of the change, before/after metrics, and a minimal failing input/output). Then verify parsing/structure first, followed by correctness checks against known-good outputs and regression baselines.", "confidence": 0.12}, "drafts_generated": 1, "drafts_survived": 1}
{"id": "6ad432d3-c4c4-431c-8d15-4fe9eff81292", "target_id": "B3-control", "git_sha": "c22fba77e88fb3d7012ce62d8bf33b1c86699272", "pre_experiment_sha": "432b91c7a705f291f2ceaaf28cbfeb2fc202bf8a", "timestamp": "2026-04-19T15:01:01.421801+00:00", "hypothesis": "Reduce hot-loop overhead by precomputing metadata and iterating only candidate length buckets within the valid threshold range.", "hypothesis_source": "agent", "mutation_diff_summary": "", "score": 108.51, "score_ci_lower": null, "score_ci_upper": null, "raw_scores": null, "baseline_score": 107.64, "outcome": "KEPT", "failure_mode": null, "duration_seconds": 33.57932341599371, "tags": ["performance", "precompute", "length-bucketing", "local-optimization"], "learnings": "{\"what_changed\":\"\",\"what_improved\":[],\"what_regressed\":[],\"transferable_insight\":\"Precomputing reusable metadata and narrowing iteration to only the candidates that can satisfy the current constraints can reduce hot-path overhead without changing results.\",\"domain_tags\":[\"performance-optimization\",\"algorithm-design\",\"efficiency\"]}", "cost_usd": 0.08175, "bootstrap_seed": 0, "agent_model": "gpt-5.4", "held_out_score": null, "criterion_names": null, "per_criterion_scores": null, "failure_classification": null, "drafts_generated": 1, "drafts_survived": 1}
