{"id": "a099f35e-44b1-404e-9157-251001f86e3c", "target_id": "B3-control", "git_sha": "2f4f94ccb76b4cdbc9c20512ff1a8d10db5012ca", "pre_experiment_sha": "2f4f94ccb76b4cdbc9c20512ff1a8d10db5012ca", "timestamp": "2026-04-18T23:25:00.066286+00:00", "hypothesis": "Precompute and reuse the relevant non-empty length buckets for list_b to avoid rescanning all bucket lengths for every source item.", "hypothesis_source": "agent", "mutation_diff_summary": "", "score": 95.8, "score_ci_lower": null, "score_ci_upper": null, "raw_scores": null, "baseline_score": 91.74, "outcome": "DISCARDED", "failure_mode": null, "duration_seconds": 30.453566457959823, "tags": ["length-bucketing", "local-refactor", "allocation-reduction", "deterministic-safe"], "learnings": "{\"what_changed\":\"\",\"what_improved\":[],\"what_regressed\":[],\"transferable_insight\":\"Precomputing and reusing a compact set of relevant candidates can reduce repeated full scans, but only when the added bookkeeping does not outweigh the saved work.\",\"domain_tags\":[\"optimization\",\"performance\",\"algorithm-design\"]}", "cost_usd": 0.08281840000000001, "bootstrap_seed": 0, "agent_model": "gpt-5.4", "held_out_score": null, "criterion_names": null, "per_criterion_scores": null, "failure_classification": {"category": "logic_error", "description": "The experiment likely did not correctly implement the intended behavior of precomputing and reusing non-empty length buckets for list_b. Despite a high score, the failure mode is listed as unknown, suggesting the optimization may have introduced incorrect selection/reuse of bucket lengths (e.g., missing or mismatched buckets, stale or improperly indexed precomputed data), leading to an incorrect result meaning rather than a pure formatting/syntax issue.", "fix_direction": "Ensure the precomputed non-empty buckets are computed over the correct source domain, reused with consistent indexing/keys, and remain immutable within the iteration over source items; add unit tests comparing bucket selection results against the baseline per-item scan.", "confidence": 0.62}, "drafts_generated": 1, "drafts_survived": 1}
{"id": "3c0aae42-4585-45f5-8fc5-09307ee11591", "target_id": "B3-control", "git_sha": "2f4f94ccb76b4cdbc9c20512ff1a8d10db5012ca", "pre_experiment_sha": "2f4f94ccb76b4cdbc9c20512ff1a8d10db5012ca", "timestamp": "2026-04-18T23:25:33.302172+00:00", "hypothesis": "Precompute and reuse sorted non-empty length buckets so each source string only visits relevant candidate buckets.", "hypothesis_source": "agent", "mutation_diff_summary": "", "score": 92.75, "score_ci_lower": null, "score_ci_upper": null, "raw_scores": null, "baseline_score": 91.74, "outcome": "DISCARDED", "failure_mode": null, "duration_seconds": 30.299076667055488, "tags": ["length-bucketing", "local-refactor", "deterministic-safe"], "learnings": "{\"what_changed\":\"\",\"what_improved\":[],\"what_regressed\":[],\"transferable_insight\":\"Precomputing and reusing grouped candidate sets can reduce repeated work, but only if the grouping meaningfully narrows the search space enough to outweigh the overhead.\",\"domain_tags\":[\"optimization\",\"algorithm design\",\"performance\"]}", "cost_usd": 0.08168760000000001, "bootstrap_seed": 0, "agent_model": "gpt-5.4", "held_out_score": null, "criterion_names": null, "per_criterion_scores": null, "failure_classification": {"category": "logic_error", "description": "The experiment\u2019s failure mode is unspecified (\u201cunknown\u201d), so the cause of the failure can\u2019t be determined from the provided information.", "fix_direction": "Identify and report the concrete failure signal (error message, failing assertion, or diff from expected output) and verify that the precomputed bucket reuse preserves correctness for all edge cases (empty strings, duplicates, boundary lengths).", "confidence": 0.2}, "drafts_generated": 1, "drafts_survived": 1}
{"id": "0118a6dc-106a-4a78-a764-3f1251fa83eb", "target_id": "B3-control", "git_sha": "3b6909d15fff21317ddd28c8a932ea182e1996fc", "pre_experiment_sha": "2f4f94ccb76b4cdbc9c20512ff1a8d10db5012ca", "timestamp": "2026-04-18T23:26:10.993453+00:00", "hypothesis": "Precompute and reuse the non-empty target length buckets so each source item only visits viable buckets without rescanning all lengths.", "hypothesis_source": "agent", "mutation_diff_summary": "", "score": 92.1, "score_ci_lower": null, "score_ci_upper": null, "raw_scores": null, "baseline_score": 91.74, "outcome": "KEPT", "failure_mode": null, "duration_seconds": 32.07507983292453, "tags": ["length-bucketing", "inner-loop", "conservative-refactor"], "learnings": "{\"what_changed\":\"\",\"what_improved\":[],\"what_regressed\":[],\"transferable_insight\":\"Precomputing and reusing only the relevant candidate groups can reduce repeated scanning and improve efficiency without changing results.\",\"domain_tags\":[\"optimization\",\"algorithm design\",\"performance\"]}", "cost_usd": 0.08305, "bootstrap_seed": 0, "agent_model": "gpt-5.4", "held_out_score": null, "criterion_names": null, "per_criterion_scores": null, "failure_classification": null, "drafts_generated": 1, "drafts_survived": 1}
{"id": "c196013b-0941-4e62-a1f8-e11d8d99dfdd", "target_id": "B3-control", "git_sha": "3b6909d15fff21317ddd28c8a932ea182e1996fc", "pre_experiment_sha": "3b6909d15fff21317ddd28c8a932ea182e1996fc", "timestamp": "2026-04-18T23:26:43.036161+00:00", "hypothesis": "Precompute and reuse the sorted non-empty length buckets for list_b, then filter candidate buckets by exact existing lengths with an early length-difference guard.", "hypothesis_source": "agent", "mutation_diff_summary": "", "score": 93.64, "score_ci_lower": null, "score_ci_upper": null, "raw_scores": null, "baseline_score": 92.1, "outcome": "DISCARDED", "failure_mode": null, "duration_seconds": 31.11815374996513, "tags": ["length-bucketing", "reuse", "conservative", "deterministic"], "learnings": "{\"what_changed\":\"\",\"what_improved\":[],\"what_regressed\":[],\"transferable_insight\":\"Precomputing reusable grouped structures and adding cheap early-exit checks can reduce repeated work, but only if the added bookkeeping actually matches the query pattern and yields measurable savings.\",\"domain_tags\":[\"optimization\",\"algorithm-design\",\"performance\"]}", "cost_usd": 0.0842398, "bootstrap_seed": 0, "agent_model": "gpt-5.4", "held_out_score": null, "criterion_names": null, "per_criterion_scores": null, "failure_classification": {"category": "logic_error", "description": "The experiment to precompute sorted non-empty length buckets and then filter by exact existing lengths with an early length-difference guard likely produced incorrect results due to flawed guard/filter logic (e.g., mismatched length handling, incorrect eligibility of buckets, or an overly strict/incorrect early-exit condition).", "fix_direction": "Re-verify the bucket eligibility logic against reference outputs: ensure exact-length matching is correct, the early length-difference guard cannot exclude valid candidates, and that any precomputed buckets preserve the same semantics as the original (including edge cases like duplicates/empty buckets). Add targeted unit tests covering boundary lengths and cases where early guards could wrongly prune.", "confidence": 0.62}, "drafts_generated": 1, "drafts_survived": 1}
{"id": "9b2bdd6f-4db8-4caa-af72-fed52c9966aa", "target_id": "B3-control", "git_sha": "ff44082fa2b5037f44b89e6f118f1d3917e82bce", "pre_experiment_sha": "3b6909d15fff21317ddd28c8a932ea182e1996fc", "timestamp": "2026-04-18T23:27:16.233519+00:00", "hypothesis": "Precompute and reuse sorted non-empty length buckets so each source string only visits candidate buckets that can match by length.", "hypothesis_source": "agent", "mutation_diff_summary": "", "score": 91.88, "score_ci_lower": null, "score_ci_upper": null, "raw_scores": null, "baseline_score": 92.1, "outcome": "KEPT", "failure_mode": null, "duration_seconds": 29.353342749993317, "tags": ["performance", "length-bucketing", "deterministic-safe", "conservative-refactor"], "learnings": "{\"what_changed\":\"\",\"what_improved\":[],\"what_regressed\":[],\"transferable_insight\":\"Precomputing and reusing a compact, sorted set of feasible candidates can reduce repeated work by ensuring each item only checks options that can actually match on a cheap filter criterion.\",\"domain_tags\":[\"optimization\",\"precomputation\",\"filtering\"]}", "cost_usd": 0.08355000000000001, "bootstrap_seed": 0, "agent_model": "gpt-5.4", "held_out_score": null, "criterion_names": null, "per_criterion_scores": null, "failure_classification": null, "drafts_generated": 1, "drafts_survived": 1}
{"id": "00eac040-4dc7-42a3-b71b-5c47a51ec3da", "target_id": "B3-control", "git_sha": "ff44082fa2b5037f44b89e6f118f1d3917e82bce", "pre_experiment_sha": "ff44082fa2b5037f44b89e6f118f1d3917e82bce", "timestamp": "2026-04-18T23:27:52.945242+00:00", "hypothesis": "Precompute and reuse the exact non-empty length buckets and source lengths to avoid repeated scans while preserving comparison order.", "hypothesis_source": "agent", "mutation_diff_summary": "", "score": 93.12, "score_ci_lower": null, "score_ci_upper": null, "raw_scores": null, "baseline_score": 91.88, "outcome": "DISCARDED", "failure_mode": null, "duration_seconds": 32.48595183296129, "tags": ["performance", "deterministic", "bucketing", "conservative-refactor"], "learnings": "{\"what_changed\":\"\",\"what_improved\":[],\"what_regressed\":[],\"transferable_insight\":\"Precomputing and reusing stable metadata can reduce repeated work, but only if the added bookkeeping preserves the original ordering and does not outweigh the cost of recomputation.\",\"domain_tags\":[\"optimization\",\"performance\",\"algorithm-design\"]}", "cost_usd": 0.08568060000000001, "bootstrap_seed": 0, "agent_model": "gpt-5.4", "held_out_score": null, "criterion_names": null, "per_criterion_scores": null, "failure_classification": {"category": "logic_error", "description": "The attempted optimization to precompute/reuse non-empty length buckets and source lengths appears to have preserved intended ordering/behavior incorrectly, indicating the algorithmic logic changed in a way that affects how comparisons or bucket contents are generated/used.", "fix_direction": "Verify that precomputed buckets and reused lengths preserve the exact comparison order and filtering semantics across all edge cases (e.g., empty buckets, duplicate lengths, stable ordering). Add tests that assert equivalence to the original scan-based behavior, not just performance.", "confidence": 0.66}, "drafts_generated": 1, "drafts_survived": 1}
{"id": "349f7efd-f9ef-45bc-8422-2c6bf5045125", "target_id": "B3-control", "git_sha": "ff44082fa2b5037f44b89e6f118f1d3917e82bce", "pre_experiment_sha": "ff44082fa2b5037f44b89e6f118f1d3917e82bce", "timestamp": "2026-04-18T23:28:25.744635+00:00", "hypothesis": "Reuse precomputed non-empty length buckets and cached string lengths to avoid repeated scans and len() calls without changing comparison order.", "hypothesis_source": "agent", "mutation_diff_summary": "", "score": 92.61, "score_ci_lower": null, "score_ci_upper": null, "raw_scores": null, "baseline_score": 91.88, "outcome": "DISCARDED", "failure_mode": null, "duration_seconds": 30.31246541708242, "tags": ["performance", "conservative", "bucketing"], "learnings": "{\"what_changed\":\"\",\"what_improved\":[],\"what_regressed\":[],\"transferable_insight\":\"An optimization that preserves behavior but adds bookkeeping or cache management can still be a net loss if the avoided work is too small or infrequent to offset the extra overhead.\",\"domain_tags\":[\"optimization\",\"performance\",\"tradeoff\"]}", "cost_usd": 0.08419380000000001, "bootstrap_seed": 0, "agent_model": "gpt-5.4", "held_out_score": null, "criterion_names": null, "per_criterion_scores": null, "failure_classification": {"category": "incomplete_edit", "description": "The experiment appears intended to optimize by reusing cached data, but the result is classified as a failed/unknown failure mode, suggesting the change was incomplete\u2014e.g., cached bucket/string length reuse was not applied consistently or left some paths still performing the original scans, causing inconsistent behavior relative to the expected evaluation order.", "fix_direction": "Ensure the optimization is applied uniformly across all relevant code paths: reuse the precomputed non-empty buckets and cached lengths consistently, verify that the comparison order is preserved exactly, and add targeted tests to confirm no path falls back to the old behavior.", "confidence": 0.44}, "drafts_generated": 1, "drafts_survived": 1}
{"id": "890161b7-235a-43e2-8543-295c22ee2dfe", "target_id": "B3-control", "git_sha": "ac2142a6b58b40dc0fb0291ab5a667030ba48998", "pre_experiment_sha": "ff44082fa2b5037f44b89e6f118f1d3917e82bce", "timestamp": "2026-04-18T23:29:01.853356+00:00", "hypothesis": "Reuse precomputed non-empty target length buckets directly and add a cheap exact length-difference skip before distance calculation.", "hypothesis_source": "agent", "mutation_diff_summary": "", "score": 91.68, "score_ci_lower": null, "score_ci_upper": null, "raw_scores": null, "baseline_score": 91.88, "outcome": "KEPT", "failure_mode": null, "duration_seconds": 33.38439983292483, "tags": ["precompute", "length-buckets", "early-filter", "conservative"], "learnings": "{\"what_changed\":\"\",\"what_improved\":[],\"what_regressed\":[],\"transferable_insight\":\"Reusing precomputed grouped candidates and applying a low-cost exact filter before an expensive comparison can reduce work without changing results.\",\"domain_tags\":[\"optimization\",\"filtering\",\"precomputation\"]}", "cost_usd": 0.08477000000000001, "bootstrap_seed": 0, "agent_model": "gpt-5.4", "held_out_score": null, "criterion_names": null, "per_criterion_scores": null, "failure_classification": null, "drafts_generated": 1, "drafts_survived": 1}
{"id": "a8acaf88-96b0-4b00-a0cd-d81c4b92ca28", "target_id": "B3-control", "git_sha": "ac2142a6b58b40dc0fb0291ab5a667030ba48998", "pre_experiment_sha": "ac2142a6b58b40dc0fb0291ab5a667030ba48998", "timestamp": "2026-04-18T23:29:38.219003+00:00", "hypothesis": "Reuse precomputed non-empty length buckets directly in the main loop and remove redundant per-comparison length checks.", "hypothesis_source": "agent", "mutation_diff_summary": "", "score": 93.67, "score_ci_lower": null, "score_ci_upper": null, "raw_scores": null, "baseline_score": 91.68, "outcome": "DISCARDED", "failure_mode": null, "duration_seconds": 31.451011165976524, "tags": ["performance", "deterministic", "bucketing", "conservative-refactor"], "learnings": "{\"what_changed\":\"\",\"what_improved\":[],\"what_regressed\":[],\"transferable_insight\":\"Precomputing and reusing invariant groupings can simplify a loop, but if the optimization does not reduce real work or add measurable benefit, it should be discarded rather than kept for its theoretical elegance.\",\"domain_tags\":[\"optimization\",\"performance\",\"software-engineering\"]}", "cost_usd": 0.08412120000000001, "bootstrap_seed": 0, "agent_model": "gpt-5.4", "held_out_score": null, "criterion_names": null, "per_criterion_scores": null, "failure_classification": {"category": "incomplete_edit", "description": "The change intended to reuse precomputed non-empty length buckets and remove redundant per-comparison length checks appears to have been applied incompletely or left inconsistent behavior in the main loop, resulting in a failure without a clearly identified semantic or formatting issue.", "fix_direction": "Ensure the main loop fully switches to bucket-based iteration (including all edge cases for empty buckets) and remove/guard any remaining per-comparison length checks so logic remains consistent end-to-end; add targeted tests covering boundary lengths and bucket transitions.", "confidence": 0.62}, "drafts_generated": 1, "drafts_survived": 1}
{"id": "ad1a9491-34f5-41b9-9230-e608f3fe6e41", "target_id": "B3-control", "git_sha": "ac2142a6b58b40dc0fb0291ab5a667030ba48998", "pre_experiment_sha": "ac2142a6b58b40dc0fb0291ab5a667030ba48998", "timestamp": "2026-04-18T23:30:13.068735+00:00", "hypothesis": "Reuse precomputed non-empty length buckets and source lengths directly to avoid rebuilding per-length metadata and redundant scans.", "hypothesis_source": "agent", "mutation_diff_summary": "", "score": 92.59, "score_ci_lower": null, "score_ci_upper": null, "raw_scores": null, "baseline_score": 91.68, "outcome": "DISCARDED", "failure_mode": null, "duration_seconds": 32.29948470799718, "tags": ["performance", "deterministic", "conservative", "bucket-reuse"], "learnings": "{\"what_changed\":\"\",\"what_improved\":[],\"what_regressed\":[],\"transferable_insight\":\"Reusing already-computed metadata can reduce redundant work, but only if the reuse path preserves enough value to outweigh the added complexity and any hidden overhead.\",\"domain_tags\":[\"optimization\",\"performance-engineering\",\"software-design\"]}", "cost_usd": 0.0850396, "bootstrap_seed": 0, "agent_model": "gpt-5.4", "held_out_score": null, "criterion_names": null, "per_criterion_scores": null, "failure_classification": {"category": "over_optimization", "description": "The attempt likely focused on reusing precomputed buckets/length metadata to avoid redundant scans; the high score suggests the change may have improved a proxy metric, but the experiment failed due to evaluation gaming or missing required recomputation/validation, leading to incorrect behavior under unanticipated conditions.", "fix_direction": "Verify correctness invariants for reused buckets (cache validity, matching assumptions, and edge cases like empty/changed sources), and ensure benchmarks measure end-to-end correctness rather than only the optimized component.", "confidence": 0.58}, "drafts_generated": 1, "drafts_survived": 1}
{"id": "48feaecb-feec-4010-8de7-ec0b84cb3d98", "target_id": "B3-control", "git_sha": "ac2142a6b58b40dc0fb0291ab5a667030ba48998", "pre_experiment_sha": "ac2142a6b58b40dc0fb0291ab5a667030ba48998", "timestamp": "2026-04-18T23:30:46.748711+00:00", "hypothesis": "Reuse precomputed non-empty source lengths to avoid rebuilding the unique-length set while preserving bucket order and comparison behavior.", "hypothesis_source": "agent", "mutation_diff_summary": "", "score": 94.31, "score_ci_lower": null, "score_ci_upper": null, "raw_scores": null, "baseline_score": 91.68, "outcome": "DISCARDED", "failure_mode": null, "duration_seconds": 30.955935750040226, "tags": ["precompute", "length-buckets", "conservative", "deterministic"], "learnings": "{\"what_changed\":\"\",\"what_improved\":[],\"what_regressed\":[],\"transferable_insight\":\"When an optimization only reuses precomputed data without changing results, it is still worth discarding if it adds complexity without measurable improvement or regression.\",\"domain_tags\":[\"optimization\",\"software-engineering\",\"performance\"]}", "cost_usd": 0.0851662, "bootstrap_seed": 0, "agent_model": "gpt-5.4", "held_out_score": null, "criterion_names": null, "per_criterion_scores": null, "failure_classification": {"category": "incomplete_edit", "description": "The experiment targeted reusing precomputed non-empty source lengths to avoid rebuilding the unique-length set, but the failure mode is listed as unknown, suggesting the change may have been partially applied or left inconsistent state (e.g., bucket ordering/comparison behavior not fully preserved or some lengths not accounted for).", "fix_direction": "Ensure the reused precomputed lengths exactly match the original unique-length set semantics (including ordering and any filtering), and add/verify invariants/tests around bucket order and comparison behavior for both empty and non-empty inputs.", "confidence": 0.62}, "drafts_generated": 1, "drafts_survived": 1}
{"id": "dddf33f4-edaa-45de-9b77-0299de9468d4", "target_id": "B3-control", "git_sha": "ac2142a6b58b40dc0fb0291ab5a667030ba48998", "pre_experiment_sha": "ac2142a6b58b40dc0fb0291ab5a667030ba48998", "timestamp": "2026-04-18T23:31:23.870362+00:00", "hypothesis": "Reuse precomputed non-empty length buckets directly and avoid rebuilding relevant bucket lists for each source length.", "hypothesis_source": "agent", "mutation_diff_summary": "", "score": 92.52, "score_ci_lower": null, "score_ci_upper": null, "raw_scores": null, "baseline_score": 91.68, "outcome": "DISCARDED", "failure_mode": null, "duration_seconds": 30.715816457988694, "tags": ["performance", "deterministic", "bucket-reuse", "conservative"], "learnings": "{\"what_changed\":\"\",\"what_improved\":[],\"what_regressed\":[],\"transferable_insight\":\"When an optimization adds complexity without measurable improvement, prefer the simpler implementation that avoids extra maintenance and reconstruction work.\",\"domain_tags\":[\"optimization\",\"software-engineering\"]}", "cost_usd": 0.08367000000000001, "bootstrap_seed": 0, "agent_model": "gpt-5.4", "held_out_score": null, "criterion_names": null, "per_criterion_scores": null, "failure_classification": {"category": "incomplete_edit", "description": "The change likely attempted to reuse precomputed non-empty length buckets, but the implementation appears to be only partially updated: some paths still rebuild bucket lists per source length or fail to consistently use the reused buckets across all relevant lengths, leaving inconsistent state/behavior.", "fix_direction": "Ensure all code paths that generate or consume length buckets use the shared precomputed non-empty bucket structures; add validation that bucket lists are built once and referenced consistently for every source length, with tests covering multiple source-length scenarios.", "confidence": 0.62}, "drafts_generated": 1, "drafts_survived": 1}
