{"id": "d98aa3cc-8cf4-4b8b-811b-df15440b81ee", "target_id": "B3-control", "git_sha": "ae034916c5b528700a24556635b66081c5fba75c", "pre_experiment_sha": "ae034916c5b528700a24556635b66081c5fba75c", "timestamp": "2026-04-21T05:05:27.180529+00:00", "hypothesis": "Inlining arithmetic slice boundaries in equal-length evaluations and removing redundant `if bs_*` list-empty checks eliminates unnecessary local variable assignments and branch overhead in the hot loops.", "hypothesis_source": "agent", "mutation_diff_summary": "", "score": 8.05, "score_ci_lower": null, "score_ci_upper": null, "raw_scores": null, "baseline_score": 7.88, "outcome": "DISCARDED", "failure_mode": null, "duration_seconds": 284.62664266698994, "tags": ["micro-optimization", "branch-elimination", "local-variables", "inline-arithmetic", "hot-loop"], "learnings": "{\"what_changed\":\"\",\"what_improved\":[],\"what_regressed\":[],\"transferable_insight\":\"Micro-optimizing hot loops by inlining intermediate calculations and removing explicit safety checks can be counterproductive, as modern execution environments often handle explicit variable assignments and branch predictions more efficiently.\",\"domain_tags\":[\"Performance Optimization\",\"Software Engineering\",\"Code Refactoring\"]}", "cost_usd": 0.09534215, "bootstrap_seed": 0, "agent_model": "gemini-3.1-pro-preview", "held_out_score": null, "criterion_names": null, "per_criterion_scores": null, "failure_classification": {"category": "regression", "description": "The hypothesis aimed to improve performance by reducing overhead in hot loops. A 'failed experiment' with a numerical score and an 'unknown' failure mode strongly suggests that the intended performance improvement was not achieved. The changes likely either had no beneficial effect or, more commonly in a 'failed experiment' context, degraded performance compared to the baseline. The 'unknown' failure mode indicates that the precise reason for the lack of improvement or performance degradation is not immediately apparent from error messages or logs.", "fix_direction": "1. Profile the modified code to precisely locate where time is being spent and identify any new bottlenecks. 2. Compare performance metrics against a robust baseline to quantify the regression. 3. Examine the generated assembly code to understand if the intended optimizations (e.g., inlining, branch elimination) were actually performed by the compiler and if they had the desired effect or introduced unforeseen costs (e.g., increased code size, cache misses). 4. Re-evaluate the initial assumptions about the cost of local variables and branch overhead in the specific context and architecture.", "confidence": 0.9}, "drafts_generated": 1, "drafts_survived": 1}
{"id": "08bcbc2d-28e5-45c1-abf4-7b272abf7411", "target_id": "B3-control", "git_sha": "8344331e143dcd9105b3bdd6367e573ef3b5f337", "pre_experiment_sha": "ae034916c5b528700a24556635b66081c5fba75c", "timestamp": "2026-04-21T05:15:20.703481+00:00", "hypothesis": "Removing the explicit `t_end <= i` and `t_end - i <= 2` branches from the innermost loops and relying on the mathematical properties of Python string slicing to implicitly handle these edge cases eliminates 5 conditional branches from the hot path, streamlining the bytecode evaluation for 99.9% of string pairs.", "hypothesis_source": "agent", "mutation_diff_summary": "", "score": 7.84, "score_ci_lower": null, "score_ci_upper": null, "raw_scores": null, "baseline_score": 7.88, "outcome": "KEPT", "failure_mode": null, "duration_seconds": 261.0347296670079, "tags": ["micro-optimization", "branch-elimination", "string-slicing", "hot-loop", "bytecode-reduction"], "learnings": "{\"what_changed\":\"\",\"what_improved\":[],\"what_regressed\":[],\"transferable_insight\":\"Replacing explicit conditional bounds checks with built-in language features that handle edge cases implicitly reduces branching and streamlines execution in performance-critical loops.\",\"domain_tags\":[\"Performance Optimization\",\"Code Optimization\",\"Software Engineering\"]}", "cost_usd": 0.09517125000000001, "bootstrap_seed": 0, "agent_model": "gemini-3.1-pro-preview", "held_out_score": null, "criterion_names": null, "per_criterion_scores": null, "failure_classification": null, "drafts_generated": 1, "drafts_survived": 1}
{"id": "9f855427-89d9-471a-9d5c-b69d073f040e", "target_id": "B3-control", "git_sha": "427291b6ea2ab2bcf60dd6298d0fc5243be40f6a", "pre_experiment_sha": "8344331e143dcd9105b3bdd6367e573ef3b5f337", "timestamp": "2026-04-21T05:20:15.989354+00:00", "hypothesis": "Eliminating redundant boundary checks in `_levenshtein` and leveraging negative list indexing for O(1) empty list retrieval safely removes multiple conditional branches per length bucket, streamlining execution.", "hypothesis_source": "agent", "mutation_diff_summary": "", "score": 7.7, "score_ci_lower": null, "score_ci_upper": null, "raw_scores": null, "baseline_score": 7.84, "outcome": "KEPT", "failure_mode": null, "duration_seconds": 252.22295524994843, "tags": ["branch-elimination", "micro-optimization", "dead-code-removal"], "learnings": "{\"what_changed\":\"\",\"what_improved\":[],\"what_regressed\":[],\"transferable_insight\":\"Replacing explicit boundary checks with native, constant-time data retrieval mechanisms reduces conditional branching and streamlines execution.\",\"domain_tags\":[\"Performance Optimization\",\"Algorithm Design\",\"Code Simplification\"]}", "cost_usd": 0.09444250000000001, "bootstrap_seed": 0, "agent_model": "gemini-3.1-pro-preview", "held_out_score": null, "criterion_names": null, "per_criterion_scores": null, "failure_classification": null, "drafts_generated": 1, "drafts_survived": 1}
{"id": "a06b11de-4d7f-4110-967c-d1207b55f33a", "target_id": "B3-control", "git_sha": "99f9a23e13a4a870dff21b09b5d0458d4a3630b7", "pre_experiment_sha": "427291b6ea2ab2bcf60dd6298d0fc5243be40f6a", "timestamp": "2026-04-21T05:23:54.233881+00:00", "hypothesis": "Replacing ternary conditional operators (`1 if condition else 2`) with branchless boolean arithmetic (`1 + (not condition)`) in the distance 1 vs 2 evaluations eliminates unpredictable branches from the hot loop, streamlining the bytecode and reducing execution time.", "hypothesis_source": "agent", "mutation_diff_summary": "", "score": 7.64, "score_ci_lower": null, "score_ci_upper": null, "raw_scores": null, "baseline_score": 7.7, "outcome": "KEPT", "failure_mode": null, "duration_seconds": 211.32460504188202, "tags": ["micro-optimization", "branch-elimination", "hot-loop", "bytecode-reduction", "branchless"], "learnings": "{\"what_changed\":\"\",\"what_improved\":[],\"what_regressed\":[],\"transferable_insight\":\"Replacing conditional branching with branchless boolean arithmetic in high-frequency execution paths improves performance by eliminating unpredictable branches.\",\"domain_tags\":[\"Performance Optimization\",\"Code Optimization\",\"Branchless Programming\"]}", "cost_usd": 0.09445500000000001, "bootstrap_seed": 0, "agent_model": "gemini-3.1-pro-preview", "held_out_score": null, "criterion_names": null, "per_criterion_scores": null, "failure_classification": null, "drafts_generated": 1, "drafts_survived": 1}
