{"id": "0a826420-700a-4c8d-aca6-2814f599f743", "target_id": "B3-control", "git_sha": "0a505212b74e7dbfaa858465bfef263b1908d60c", "pre_experiment_sha": "fc7e6765a90e3679f6cfa91b2a0d49fe35dc9947", "timestamp": "2026-04-21T04:02:19.268720+00:00", "hypothesis": "Padding pre-extracted character tuples with `None` for short strings allows completely eliminating the `la <= 3` fallback branches, unifying the unrolled logic for all string lengths, while reverting the `else: results_append(...)` short-circuits further reduces bytecode size and branch overhead in the hot loop.", "hypothesis_source": "agent", "mutation_diff_summary": "", "score": 8.5, "score_ci_lower": null, "score_ci_upper": null, "raw_scores": null, "baseline_score": 8.35, "outcome": "KEPT", "failure_mode": null, "duration_seconds": 297.55665620812215, "tags": ["micro-optimization", "branch-elimination", "bytecode-reduction", "loop-unrolling"], "learnings": "{\"what_changed\":\"\",\"what_improved\":[],\"what_regressed\":[],\"transferable_insight\":\"Normalizing variable-length inputs with padding enables unified processing logic, eliminating edge-case conditional branches and reducing overhead in performance-critical loops.\",\"domain_tags\":[\"Algorithm Optimization\",\"Control Flow\",\"Performance Engineering\"]}", "cost_usd": 0.09822625000000001, "bootstrap_seed": 0, "agent_model": "gemini-3.1-pro-preview", "held_out_score": null, "criterion_names": null, "per_criterion_scores": null, "failure_classification": null, "drafts_generated": 1, "drafts_survived": 1}
{"id": "b7e4352a-9ed9-44c2-a307-93fdf382403e", "target_id": "B3-control", "git_sha": "13d12a54cf319815b185468a7c7d245a5e2a2cc5", "pre_experiment_sha": "0a505212b74e7dbfaa858465bfef263b1908d60c", "timestamp": "2026-04-21T04:07:35.867735+00:00", "hypothesis": "Replacing `t_sub <= 1` with `t_end == i` in `bs_m1`/`bs_p1` and adding `t_end == i` short-circuits to `bs_m2`/`bs_p2` eliminates redundant distance calculations, while removing the unnecessary `t_len == 0` check in the fallback block further reduces branching overhead.", "hypothesis_source": "agent", "mutation_diff_summary": "", "score": 8.35, "score_ci_lower": null, "score_ci_upper": null, "raw_scores": null, "baseline_score": 8.5, "outcome": "KEPT", "failure_mode": null, "duration_seconds": 295.00616725021973, "tags": ["micro-optimization", "branch-elimination", "unroll"], "learnings": "{\"what_changed\":\"\",\"what_improved\":[],\"what_regressed\":[],\"transferable_insight\":\"Replacing loose boundary conditions with precise loop-termination checks to enable early short-circuiting, alongside removing redundant state validations, effectively reduces branching overhead and eliminates unnecessary computations.\",\"domain_tags\":[\"Algorithm Optimization\",\"Control Flow\",\"Performance Tuning\"]}", "cost_usd": 0.09635375000000002, "bootstrap_seed": 0, "agent_model": "gemini-3.1-pro-preview", "held_out_score": null, "criterion_names": null, "per_criterion_scores": null, "failure_classification": null, "drafts_generated": 1, "drafts_survived": 1}
{"id": "a03f568a-787a-4804-a79a-dfd587807848", "target_id": "B3-control", "git_sha": "23accb48cbfeebc2c8ec1f86af528fec25d78f7b", "pre_experiment_sha": "13d12a54cf319815b185468a7c7d245a5e2a2cc5", "timestamp": "2026-04-21T04:12:31.642800+00:00", "hypothesis": "Removing `max_j` bounds checking entirely and replacing it with `t_end <= i` short-circuits safely eliminates redundant variable assignments and conditional branches in the hot loop, as overlapping prefixes and suffixes mathematically guarantee the distance is exactly `len_diff`.", "hypothesis_source": "agent", "mutation_diff_summary": "", "score": 8.1, "score_ci_lower": null, "score_ci_upper": null, "raw_scores": null, "baseline_score": 8.35, "outcome": "KEPT", "failure_mode": null, "duration_seconds": 266.34336099983193, "tags": ["micro-optimization", "branch-elimination", "unroll"], "learnings": "{\"what_changed\":\"\",\"what_improved\":[],\"what_regressed\":[],\"transferable_insight\":\"Replacing explicit per-iteration bounds checking with early-exit conditions based on mathematical guarantees safely eliminates redundant operations and accelerates hot loops.\",\"domain_tags\":[\"Algorithm Optimization\",\"Loop Optimization\",\"Performance Tuning\"]}", "cost_usd": 0.09527125, "bootstrap_seed": 0, "agent_model": "gemini-3.1-pro-preview", "held_out_score": null, "criterion_names": null, "per_criterion_scores": null, "failure_classification": null, "drafts_generated": 1, "drafts_survived": 1}
{"id": "cd5d673c-9b78-4af4-8f3e-c6e29fb00b03", "target_id": "B3-control", "git_sha": "7e9330cfd5231532eddffc6d59ec39950b9b61fc", "pre_experiment_sha": "23accb48cbfeebc2c8ec1f86af528fec25d78f7b", "timestamp": "2026-04-21T04:16:12.948031+00:00", "hypothesis": "Caching local variables for arithmetic slice boundaries (`ip1`, `t_end_m1`, `t_end_p1`, `s_end`, `t_end`) and splitting `t_end <= i` checks into `if/else` blocks eliminates redundant bytecode execution for O(1) string slicing operations.", "hypothesis_source": "agent", "mutation_diff_summary": "", "score": 8.23, "score_ci_lower": null, "score_ci_upper": null, "raw_scores": null, "baseline_score": 8.1, "outcome": "KEPT", "failure_mode": null, "duration_seconds": 208.7295419590082, "tags": ["micro-optimization", "branch-elimination", "local-variables", "string-slicing"], "learnings": "{\"what_changed\":\"\",\"what_improved\":[],\"what_regressed\":[],\"transferable_insight\":\"Caching intermediate arithmetic results in local variables and restructuring conditional checks into mutually exclusive blocks reduces execution overhead for high-frequency, constant-time operations.\",\"domain_tags\":[\"Performance Optimization\",\"Code Refactoring\",\"Execution Efficiency\"]}", "cost_usd": 0.09770875000000001, "bootstrap_seed": 0, "agent_model": "gemini-3.1-pro-preview", "held_out_score": null, "criterion_names": null, "per_criterion_scores": null, "failure_classification": null, "drafts_generated": 1, "drafts_survived": 1}
{"id": "429c7c4f-26e0-41bb-93fe-d274ede06e07", "target_id": "B3-control", "git_sha": "bce60f8c902d063c29089d0df775d619ff0471c8", "pre_experiment_sha": "7e9330cfd5231532eddffc6d59ec39950b9b61fc", "timestamp": "2026-04-21T04:21:16.612445+00:00", "hypothesis": "Precomputing `t_len` variables outside the inner loops for unequal-length pairs completely eliminates redundant variable assignments per string pair, reducing bytecode execution overhead in the hot loops.", "hypothesis_source": "agent", "mutation_diff_summary": "", "score": 7.92, "score_ci_lower": null, "score_ci_upper": null, "raw_scores": null, "baseline_score": 8.23, "outcome": "KEPT", "failure_mode": null, "duration_seconds": 289.9098812909797, "tags": ["micro-optimization", "branch-elimination", "local-variables", "loop-unrolling"], "learnings": "{\"what_changed\":\"\",\"what_improved\":[],\"what_regressed\":[],\"transferable_insight\":\"Moving loop-invariant calculations outside of inner loops eliminates redundant assignments and significantly reduces execution overhead in performance-critical code.\",\"domain_tags\":[\"Code Optimization\",\"Performance Engineering\"]}", "cost_usd": 0.09768750000000001, "bootstrap_seed": 0, "agent_model": "gemini-3.1-pro-preview", "held_out_score": null, "criterion_names": null, "per_criterion_scores": null, "failure_classification": null, "drafts_generated": 1, "drafts_survived": 1}
{"id": "d3c43ce9-1218-4bf8-a4e3-763f4544b96e", "target_id": "B3-control", "git_sha": "57ce2b90b65ba7adc951d3a1c156ce5314009afd", "pre_experiment_sha": "bce60f8c902d063c29089d0df775d619ff0471c8", "timestamp": "2026-04-21T04:26:02.259276+00:00", "hypothesis": "Selectively inlining arithmetic slice boundaries (`i+1`, `t_end+1`, `t_end-1`) where they are used sparsely (in `bs_m1`, `bs_m2`, `bs_p1`, `bs_p2`) and eliminating the `t_sub` variable in `bs_eq` removes redundant `STORE_FAST` and `LOAD_FAST` bytecode overhead in the most common execution paths, while preserving optimal caching for dense usages.", "hypothesis_source": "agent", "mutation_diff_summary": "", "score": 7.77, "score_ci_lower": null, "score_ci_upper": null, "raw_scores": null, "baseline_score": 7.92, "outcome": "KEPT", "failure_mode": null, "duration_seconds": 246.8764163341839, "tags": ["micro-optimization", "branch-elimination", "local-variables", "string-slicing", "bytecode-reduction"], "learnings": "{\"what_changed\":\"\",\"what_improved\":[],\"what_regressed\":[],\"transferable_insight\":\"Selectively inlining sparsely used intermediate calculations rather than storing them in variables reduces memory access overhead while preserving the benefits of caching for frequently accessed values.\",\"domain_tags\":[\"Code Optimization\",\"Performance Tuning\",\"Execution Efficiency\"]}", "cost_usd": 0.09731250000000001, "bootstrap_seed": 0, "agent_model": "gemini-3.1-pro-preview", "held_out_score": null, "criterion_names": null, "per_criterion_scores": null, "failure_classification": null, "drafts_generated": 1, "drafts_survived": 1}
{"id": "74520b58-e493-43ad-9d60-44765258eaa1", "target_id": "B3-control", "git_sha": "291029bd95b89c08a234820f84da1f471a3d7dad", "pre_experiment_sha": "57ce2b90b65ba7adc951d3a1c156ce5314009afd", "timestamp": "2026-04-21T04:30:02.008819+00:00", "hypothesis": "Removing the mathematically unreachable `else: i = la` and `else: j = la` blocks from equal-length pair evaluations safely eliminates dead bytecode, while adding `elif t_end == i + 1:` to length-difference 1 evaluations safely short-circuits distance 2 checks to completely avoid expensive string slicing.", "hypothesis_source": "agent", "mutation_diff_summary": "", "score": 8.25, "score_ci_lower": null, "score_ci_upper": null, "raw_scores": null, "baseline_score": 7.77, "outcome": "KEPT", "failure_mode": null, "duration_seconds": 233.35821620887145, "tags": ["micro-optimization", "branch-elimination", "dead-code-removal", "string-slicing"], "learnings": "{\"what_changed\":\"\",\"what_improved\":[],\"what_regressed\":[],\"transferable_insight\":\"Execution efficiency is improved by eliminating mathematically unreachable code paths and introducing early-exit conditions to bypass computationally expensive operations.\",\"domain_tags\":[\"Code Optimization\",\"Performance Engineering\"]}", "cost_usd": 0.09672250000000002, "bootstrap_seed": 0, "agent_model": "gemini-3.1-pro-preview", "held_out_score": null, "criterion_names": null, "per_criterion_scores": null, "failure_classification": null, "drafts_generated": 1, "drafts_survived": 1}
{"id": "5e4cd091-7569-4701-91bf-cf013c9c49ae", "target_id": "B3-control", "git_sha": "c40e14c9a38afd903dafe2cf1ad72aa21531b451", "pre_experiment_sha": "291029bd95b89c08a234820f84da1f471a3d7dad", "timestamp": "2026-04-21T04:33:03.274602+00:00", "hypothesis": "Removing the redundant `elif t_end == i + 1:` checks from length-difference 1 evaluations eliminates unnecessary branch overhead, as the subsequent `else` block naturally and efficiently handles this case via fast empty string slicing (`\"\" == \"\"`).", "hypothesis_source": "agent", "mutation_diff_summary": "", "score": 7.91, "score_ci_lower": null, "score_ci_upper": null, "raw_scores": null, "baseline_score": 8.25, "outcome": "KEPT", "failure_mode": null, "duration_seconds": 175.22168154199608, "tags": ["micro-optimization", "branch-elimination", "string-slicing"], "learnings": "{\"what_changed\":\"\",\"what_improved\":[],\"what_regressed\":[],\"transferable_insight\":\"Eliminating explicit conditional checks for edge cases that are naturally and efficiently handled by the default fallback logic reduces branch overhead and improves overall execution efficiency.\",\"domain_tags\":[\"Code Optimization\",\"Performance Engineering\",\"Control Flow\"]}", "cost_usd": 0.0958775, "bootstrap_seed": 0, "agent_model": "gemini-3.1-pro-preview", "held_out_score": null, "criterion_names": null, "per_criterion_scores": null, "failure_classification": null, "drafts_generated": 1, "drafts_survived": 1}
{"id": "2f9459d5-6fa6-47bb-bbc1-1241359a19d0", "target_id": "B3-control", "git_sha": "f1879f6fab8e2180cae1bfcc91ad30dff5170642", "pre_experiment_sha": "c40e14c9a38afd903dafe2cf1ad72aa21531b451", "timestamp": "2026-04-21T04:35:47.390415+00:00", "hypothesis": "Restoring the mathematically unreachable `else: i = la` and `else: j = la` blocks to equal-length pair evaluations reverts a surprising bytecode performance regression caused by their removal.", "hypothesis_source": "agent", "mutation_diff_summary": "", "score": 8.14, "score_ci_lower": null, "score_ci_upper": null, "raw_scores": null, "baseline_score": 7.91, "outcome": "KEPT", "failure_mode": null, "duration_seconds": 103.04133104183711, "tags": ["micro-optimization", "bytecode-restoration", "regression-fix"], "learnings": "{\"what_changed\":\"\",\"what_improved\":[],\"what_regressed\":[],\"transferable_insight\":\"Retaining logically unreachable code can sometimes prevent unexpected performance regressions caused by underlying compiler or interpreter optimization quirks.\",\"domain_tags\":[\"Software Engineering\",\"Compiler Optimization\",\"Performance Tuning\"]}", "cost_usd": 0.09603375, "bootstrap_seed": 0, "agent_model": "gemini-3.1-pro-preview", "held_out_score": null, "criterion_names": null, "per_criterion_scores": null, "failure_classification": null, "drafts_generated": 1, "drafts_survived": 1}
{"id": "c4636b20-36b7-4f4f-93ec-bcd8dfedd625", "target_id": "B3-control", "git_sha": "69d46d479c5bba86dc079f7ed426a4bd8538ca2f", "pre_experiment_sha": "f1879f6fab8e2180cae1bfcc91ad30dff5170642", "timestamp": "2026-04-21T04:40:43.880061+00:00", "hypothesis": "Flattening the `a == b` exact match check into the `elif` chain for equal-length pairs removes an unnecessary level of indentation and conditional branching, further streamlining the bytecode in the hot loop.", "hypothesis_source": "agent", "mutation_diff_summary": "", "score": 7.88, "score_ci_lower": null, "score_ci_upper": null, "raw_scores": null, "baseline_score": 8.14, "outcome": "KEPT", "failure_mode": null, "duration_seconds": 290.22931579197757, "tags": ["micro-optimization", "branch-elimination", "bytecode-reduction", "flattening"], "learnings": "{\"what_changed\":\"\",\"what_improved\":[],\"what_regressed\":[],\"transferable_insight\":\"Flattening nested conditional checks into a single sequential evaluation chain reduces branching overhead and streamlines execution in performance-critical loops.\",\"domain_tags\":[\"Code Optimization\",\"Control Flow\",\"Performance Tuning\"]}", "cost_usd": 0.0959825, "bootstrap_seed": 0, "agent_model": "gemini-3.1-pro-preview", "held_out_score": null, "criterion_names": null, "per_criterion_scores": null, "failure_classification": null, "drafts_generated": 1, "drafts_survived": 1}
{"id": "2a92db4f-342e-4e2f-af9e-ee29be474aae", "target_id": "B3-control", "git_sha": "69d46d479c5bba86dc079f7ed426a4bd8538ca2f", "pre_experiment_sha": "69d46d479c5bba86dc079f7ed426a4bd8538ca2f", "timestamp": "2026-04-21T04:44:55.439364+00:00", "hypothesis": "Flattening the `else` blocks into `elif` chains for string slice evaluations and using the walrus operator (`:=`) to inline and cache `s_mid` removes redundant local variable assignments and streamlines bytecode dispatch in the hot loops.", "hypothesis_source": "agent", "mutation_diff_summary": "", "score": 8.32, "score_ci_lower": null, "score_ci_upper": null, "raw_scores": null, "baseline_score": 7.88, "outcome": "DISCARDED", "failure_mode": null, "duration_seconds": 244.1261813750025, "tags": ["micro-optimization", "branch-elimination", "local-variables", "string-slicing", "bytecode-reduction"], "learnings": "{\"what_changed\":\"\",\"what_improved\":[],\"what_regressed\":[],\"transferable_insight\":\"Attempting to streamline execution by flattening conditional branches and inlining variable assignments can introduce unexpected overhead rather than improving performance.\",\"domain_tags\":[\"Code Optimization\",\"Performance Tuning\",\"Micro-optimization\"]}", "cost_usd": 0.09513560000000001, "bootstrap_seed": 0, "agent_model": "gemini-3.1-pro-preview", "held_out_score": null, "criterion_names": null, "per_criterion_scores": null, "failure_classification": {"category": "over_optimization", "description": "The experiment's hypothesis focused on micro-optimizations (flattening `else` to `elif` chains, using the walrus operator for caching `s_mid`) to improve bytecode dispatch in hot loops. While these changes might have yielded a high score (8.3200) on a specific, narrow performance metric, the classification as a 'failed experiment' with an 'unknown' failure mode suggests that the observed gains were likely negligible in real-world performance, offset by increased code complexity/reduced readability, or introduced unforeseen negative impacts not captured by the primary score. The optimization was likely deemed unnecessary or detrimental when considering broader engineering principles.", "fix_direction": "Prioritize profiling to identify significant bottlenecks at a higher architectural level. Only pursue micro-optimizations when clear and substantial performance gains are demonstrated in real-world scenarios, and ensure they do not compromise code readability, maintainability, or introduce regressions in other areas. Evaluate optimizations against a comprehensive set of metrics, not just isolated benchmarks.", "confidence": 0.9}, "drafts_generated": 1, "drafts_survived": 1}
{"id": "b2fb65c4-cbe5-4b31-bc4c-759312209003", "target_id": "B3-control", "git_sha": "ae034916c5b528700a24556635b66081c5fba75c", "pre_experiment_sha": "69d46d479c5bba86dc079f7ed426a4bd8538ca2f", "timestamp": "2026-04-21T04:50:41.898648+00:00", "hypothesis": "Removing the unnecessary `t_len == 0` check in the fallback `_levenshtein` function eliminates a redundant conditional branch, as this edge case is naturally and efficiently handled by the subsequent `else` block and empty `range(0)` loop.", "hypothesis_source": "agent", "mutation_diff_summary": "", "score": 7.88, "score_ci_lower": null, "score_ci_upper": null, "raw_scores": null, "baseline_score": 7.88, "outcome": "KEPT", "failure_mode": null, "duration_seconds": 295.50887841708027, "tags": ["micro-optimization", "branch-elimination", "dead-code-removal"], "learnings": "{\"what_changed\":\"\",\"what_improved\":[],\"what_regressed\":[],\"transferable_insight\":\"Eliminating explicit edge-case checks that are naturally handled by the general logic simplifies code structure and reduces redundant conditional branching.\",\"domain_tags\":[\"Code Refactoring\",\"Control Flow\",\"Software Design\"]}", "cost_usd": 0.09581, "bootstrap_seed": 0, "agent_model": "gemini-3.1-pro-preview", "held_out_score": null, "criterion_names": null, "per_criterion_scores": null, "failure_classification": null, "drafts_generated": 1, "drafts_survived": 1}
{"id": "73953733-b81c-42df-9876-59da22194609", "target_id": "B3-control", "git_sha": "ae034916c5b528700a24556635b66081c5fba75c", "pre_experiment_sha": "ae034916c5b528700a24556635b66081c5fba75c", "timestamp": "2026-04-21T04:54:35.941474+00:00", "hypothesis": "Extracting `ip1 = i + 1` into a local variable in the length-difference 1 evaluations (`bs_m1` and `bs_p1`) eliminates redundant addition operations during string slicing, aligning with the successful caching strategy used in equal-length evaluations.", "hypothesis_source": "agent", "mutation_diff_summary": "", "score": 8.45, "score_ci_lower": null, "score_ci_upper": null, "raw_scores": null, "baseline_score": 7.88, "outcome": "DISCARDED", "failure_mode": null, "duration_seconds": 226.79877433297224, "tags": ["micro-optimization", "redundant-computation", "local-variables", "string-slicing"], "learnings": "{\"what_changed\":\"\",\"what_improved\":[],\"what_regressed\":[],\"transferable_insight\":\"Caching extremely simple arithmetic operations into local variables can be counterproductive, as the overhead of variable assignment often outweighs the cost of the operation itself.\",\"domain_tags\":[\"Performance Optimization\",\"Micro-optimization\",\"Code Refactoring\"]}", "cost_usd": 0.09609490000000001, "bootstrap_seed": 0, "agent_model": "gemini-3.1-pro-preview", "held_out_score": null, "criterion_names": null, "per_criterion_scores": null, "failure_classification": {"category": "logic_error", "description": "The experiment's hypothesis for performance optimization, which involved extracting 'i + 1' into a local variable to eliminate redundant additions during string slicing, proved to be incorrect or ineffective. This indicates a flaw in the reasoning about how compilers or the runtime environment handle such operations, or that the overhead of the local variable assignment outweighed any potential benefits. The 'unknown' failure mode suggests the code executed without explicit errors, but the desired performance improvement was not achieved, or performance degraded, implying a conceptual flaw in the optimization strategy itself.", "fix_direction": "Re-evaluate the fundamental assumptions regarding redundant operations and the efficiency of string slicing in the target environment. It's crucial to use detailed profiling tools to accurately measure the performance impact of such micro-optimizations, as modern compilers are often highly capable of optimizing simple arithmetic expressions. Focus on understanding the actual bottlenecks and the compiler's optimization strategies rather than making assumptions.", "confidence": 0.95}, "drafts_generated": 1, "drafts_survived": 1}
