{"id": "55d0f8b6-87fe-4a57-8d82-ffb142dd3ac0", "target_id": "B3-control", "git_sha": "81d8fa584458a1aca51648bd65700eb28c959de3", "pre_experiment_sha": "91bac10a584feb470b935f2b0f46018419699d86", "timestamp": "2026-04-23T11:50:04.424974+00:00", "hypothesis": "By inlining the Levenshtein distance logic into the search loop and replacing the dynamic programming matrix with O(1) string slice comparisons for the specific case of `threshold=2`, we can bypass almost all Python interpreter overhead and drastically reduce execution time.", "hypothesis_source": "agent", "mutation_diff_summary": "", "score": 17.65, "score_ci_lower": null, "score_ci_upper": null, "raw_scores": null, "baseline_score": 115.86, "outcome": "KEPT", "failure_mode": null, "duration_seconds": 284.5145985411946, "tags": ["algorithm", "inline", "python-optimization", "string-comparison"], "learnings": "{\"what_changed\":\"\",\"what_improved\":[],\"what_regressed\":[],\"transferable_insight\":\"Replacing general-purpose algorithms with specialized, constant-time operations for known, fixed constraints can drastically reduce execution overhead.\",\"domain_tags\":[\"Algorithm Optimization\",\"Performance Tuning\",\"Time Complexity\"]}", "cost_usd": 0.047357500000000004, "bootstrap_seed": 0, "agent_model": "gemini-3.1-pro-preview", "held_out_score": null, "criterion_names": null, "per_criterion_scores": null, "failure_classification": null, "drafts_generated": 1, "drafts_survived": 1}
{"id": "4066f8bc-81f4-4f60-b76d-152b308411c5", "target_id": "B3-control", "git_sha": "81d8fa584458a1aca51648bd65700eb28c959de3", "pre_experiment_sha": "81d8fa584458a1aca51648bd65700eb28c959de3", "timestamp": "2026-04-23T11:54:10.931171+00:00", "hypothesis": "Optimize the string comparison loops by separating them by length difference, using fast C-based `for` loops for prefix/suffix matching, and inlining a complete O(1) fast-path for all distance <= 2 cases.", "hypothesis_source": "agent", "mutation_diff_summary": "", "score": 18.24, "score_ci_lower": null, "score_ci_upper": null, "raw_scores": null, "baseline_score": 17.65, "outcome": "DISCARDED", "failure_mode": null, "duration_seconds": 238.6270495839417, "tags": ["performance", "string-matching", "loop-unrolling", "fast-path"], "learnings": "{\"what_changed\":\"\",\"what_improved\":[],\"what_regressed\":[],\"transferable_insight\":\"Manually inlining fast-paths for specific edge cases and separating loop logic can degrade overall performance by introducing branching overhead and instruction cache bloat that outweigh the benefits of the specialized optimizations.\",\"domain_tags\":[\"Performance Optimization\",\"Algorithm Design\",\"Software Engineering\"]}", "cost_usd": 0.05557725, "bootstrap_seed": 0, "agent_model": "gemini-3.1-pro-preview", "held_out_score": null, "criterion_names": null, "per_criterion_scores": null, "failure_classification": {"category": "logic_error", "description": "The proposed optimization strategy for string comparison loops, involving C-based fast loops and an O(1) fast-path, likely contained a logical flaw in its implementation or design. This could manifest as incorrect calculations, unexpected performance overhead (e.g., due to high constant factors, cache misses, or inefficient branching), or a failure to correctly identify and utilize the O(1) conditions, preventing the intended performance improvement or even degrading it.", "fix_direction": "Thoroughly review the implementation of the C-based loops and the O(1) fast-path for correctness and efficiency. Specifically, check for edge cases that might cause unexpected O(N) behavior, excessive branching, or increased memory access overhead. Use a profiler to pinpoint where the time is actually being spent in the modified code and identify any new bottlenecks. Verify the logic for separating by length difference to ensure it genuinely reduces work without adding undue overhead.", "confidence": 0.9}, "drafts_generated": 1, "drafts_survived": 1}
{"id": "032d2648-5e3e-4600-8c14-7f1f08c7ece2", "target_id": "B3-control", "git_sha": "e26a7d89bd18a4d022bef92bf3157c2bd627917d", "pre_experiment_sha": "81d8fa584458a1aca51648bd65700eb28c959de3", "timestamp": "2026-04-23T11:59:29.974688+00:00", "hypothesis": "Inline the distance calculation and replace string allocations with direct index-based slice comparisons to vastly accelerate the matching process.", "hypothesis_source": "agent", "mutation_diff_summary": "", "score": 11.46, "score_ci_lower": null, "score_ci_upper": null, "raw_scores": null, "baseline_score": 17.65, "outcome": "KEPT", "failure_mode": null, "duration_seconds": 293.51646095793694, "tags": ["performance", "string-matching", "inline", "zero-allocation"], "learnings": "{\"what_changed\":\"\",\"what_improved\":[],\"what_regressed\":[],\"transferable_insight\":\"Replacing intermediate memory allocations with direct index-based comparisons and inlining operations significantly accelerates computational performance.\",\"domain_tags\":[\"Performance Optimization\",\"Memory Management\",\"Algorithm Efficiency\"]}", "cost_usd": 0.05600000000000001, "bootstrap_seed": 0, "agent_model": "gemini-3.1-pro-preview", "held_out_score": null, "criterion_names": null, "per_criterion_scores": null, "failure_classification": null, "drafts_generated": 1, "drafts_survived": 1}
{"id": "51a7b1b9-f0e1-4f19-8a63-37d0c54e2e24", "target_id": "B3-control", "git_sha": "3c0f90011f7475ddd3d8744110bb8f3c09b5cf97", "pre_experiment_sha": "e26a7d89bd18a4d022bef92bf3157c2bd627917d", "timestamp": "2026-04-23T12:03:52.377706+00:00", "hypothesis": "Hoist length-based string grouping to the outer loop to avoid redundant list lookups, replace exception-based bounds checking with explicit index limits, and use tuples for faster iteration.", "hypothesis_source": "agent", "mutation_diff_summary": "", "score": 11.03, "score_ci_lower": null, "score_ci_upper": null, "raw_scores": null, "baseline_score": 11.46, "outcome": "KEPT", "failure_mode": null, "duration_seconds": 243.98840512498282, "tags": ["optimization", "loop-hoisting", "bounds-checking", "tuple-iteration"], "learnings": "{\"what_changed\":\"\",\"what_improved\":[],\"what_regressed\":[],\"transferable_insight\":\"Moving invariant operations outside of loops, replacing exception-based control flow with explicit boundary checks, and using lightweight, immutable data structures reduces overhead and improves iteration performance.\",\"domain_tags\":[\"Performance Optimization\",\"Loop Optimization\",\"Data Structures\"]}", "cost_usd": 0.05797125, "bootstrap_seed": 0, "agent_model": "gemini-3.1-pro-preview", "held_out_score": null, "criterion_names": null, "per_criterion_scores": null, "failure_classification": null, "drafts_generated": 1, "drafts_survived": 1}
{"id": "beb86a51-2ca6-4d61-8c47-d62c48042dcc", "target_id": "B3-control", "git_sha": "dde7faf67aa1c18d57ef221f6af55d87e08f1053", "pre_experiment_sha": "3c0f90011f7475ddd3d8744110bb8f3c09b5cf97", "timestamp": "2026-04-23T12:07:54.395191+00:00", "hypothesis": "Use SymSpell symmetric deletion algorithm to reduce the search space from O(N^2) comparisons to O(N) hash lookups, and fast-path the exact Levenshtein distance for threshold=2 using O(1) slice comparisons.", "hypothesis_source": "agent", "mutation_diff_summary": "", "score": 3.34, "score_ci_lower": null, "score_ci_upper": null, "raw_scores": null, "baseline_score": 11.03, "outcome": "KEPT", "failure_mode": null, "duration_seconds": 235.36128966603428, "tags": ["algorithm-change", "data-structures", "fast-path", "string-manipulation"], "learnings": "{\"what_changed\":\"\",\"what_improved\":[],\"what_regressed\":[],\"transferable_insight\":\"Replacing quadratic search spaces with linear hash lookups and implementing constant-time fast-paths for specific bounded cases significantly optimizes computational performance.\",\"domain_tags\":[\"Algorithm Optimization\",\"Performance Engineering\",\"Data Structures\"]}", "cost_usd": 0.04658875, "bootstrap_seed": 0, "agent_model": "gemini-3.1-pro-preview", "held_out_score": null, "criterion_names": null, "per_criterion_scores": null, "failure_classification": null, "drafts_generated": 1, "drafts_survived": 1}
{"id": "d037647d-abfb-423b-835c-cbc9c82bb5cb", "target_id": "B3-control", "git_sha": "dde7faf67aa1c18d57ef221f6af55d87e08f1053", "pre_experiment_sha": "dde7faf67aa1c18d57ef221f6af55d87e08f1053", "timestamp": "2026-04-23T12:11:24.708066+00:00", "hypothesis": "Inline distance calculations, group strings by length to prune search space, and replace dynamic programming with O(1) index-based slice comparisons for threshold=2 to eliminate function call overhead and allocations.", "hypothesis_source": "agent", "mutation_diff_summary": "", "score": 14.97, "score_ci_lower": null, "score_ci_upper": null, "raw_scores": null, "baseline_score": 3.34, "outcome": "DISCARDED", "failure_mode": null, "duration_seconds": 201.74262991710566, "tags": ["optimization", "inlining", "string-matching", "algorithm"], "learnings": "{\"what_changed\":\"\",\"what_improved\":[],\"what_regressed\":[],\"transferable_insight\":\"Aggressively inlining complex logic and adding specialized threshold-based pruning to avoid standard function overhead can degrade overall performance by introducing excessive branching and code complexity.\",\"domain_tags\":[\"Algorithm Optimization\",\"Micro-optimization\",\"Performance Tuning\"]}", "cost_usd": 0.04662125, "bootstrap_seed": 0, "agent_model": "gemini-3.1-pro-preview", "held_out_score": null, "criterion_names": null, "per_criterion_scores": null, "failure_classification": {"category": "logic_error", "description": "The experiment's hypothesis involves significant algorithmic changes: replacing dynamic programming with O(1) index-based slice comparisons for a specific threshold, and pruning the search space. A `logic_error` likely occurred in the implementation or design of these new algorithms. For example, the O(1) comparison might not correctly replicate the dynamic programming result for all relevant cases with `threshold=2`, or the pruning logic might be flawed, leading to incorrect distance calculations, missed candidates, or unintended side effects on performance that result in the observed score indicating a failed experiment.", "fix_direction": "Thoroughly review the correctness of the O(1) index-based slice comparisons to ensure they are mathematically equivalent to the original dynamic programming approach for `threshold=2`. Implement comprehensive unit tests, comparing outputs of the new and old methods for a wide range of inputs and edge cases. Additionally, carefully verify the pruning logic (grouping by length) to confirm it doesn't inadvertently discard valid matches or introduce incorrect behavior.", "confidence": 0.9}, "drafts_generated": 1, "drafts_survived": 1}
{"id": "bf87afc4-0263-4036-8192-d7616ef64f17", "target_id": "B3-control", "git_sha": "dde7faf67aa1c18d57ef221f6af55d87e08f1053", "pre_experiment_sha": "dde7faf67aa1c18d57ef221f6af55d87e08f1053", "timestamp": "2026-04-23T12:16:59.061063+00:00", "hypothesis": "Optimize SymSpell symmetric deletion by inlining O(1) direct index-based slice comparisons for exact Levenshtein distance, converting deletion lists to tuples for faster iteration, and avoiding `for...else` constructs during prefix/suffix stripping.", "hypothesis_source": "agent", "mutation_diff_summary": "", "score": 4.01, "score_ci_lower": null, "score_ci_upper": null, "raw_scores": null, "baseline_score": 3.34, "outcome": "DISCARDED", "failure_mode": null, "duration_seconds": 283.9627186669968, "tags": ["symspell", "inline-fast-path", "slice-comparisons"], "learnings": "{\"what_changed\":\"\",\"what_improved\":[],\"what_regressed\":[],\"transferable_insight\":\"Micro-optimizations such as data type conversions and loop restructuring often fail to yield measurable performance gains in high-level languages and can instead introduce execution overhead.\",\"domain_tags\":[\"Performance Engineering\",\"Code Optimization\",\"Software Architecture\"]}", "cost_usd": 0.048435750000000014, "bootstrap_seed": 0, "agent_model": "gemini-3.1-pro-preview", "held_out_score": null, "criterion_names": null, "per_criterion_scores": null, "failure_classification": {"category": "regression", "description": "The attempted optimizations, aimed at improving SymSpell's performance, resulted in a significantly lower score (4.0100). This indicates that the changes likely degraded the system's performance or introduced correctness issues, leading to a regression from its previous state.", "fix_direction": "Revert the changes and re-evaluate each proposed optimization in isolation. Thoroughly benchmark each modification to pinpoint the exact cause of the regression, whether it's an introduced performance overhead, a logical error in the 'optimization', or an incompatibility with other parts of the system. Profile the code to identify new bottlenecks or incorrect behavior.", "confidence": 0.9}, "drafts_generated": 1, "drafts_survived": 1}
{"id": "6db18312-4b11-4371-9fe6-31fd196aa535", "target_id": "B3-control", "git_sha": "dde7faf67aa1c18d57ef221f6af55d87e08f1053", "pre_experiment_sha": "dde7faf67aa1c18d57ef221f6af55d87e08f1053", "timestamp": "2026-04-23T12:21:17.903482+00:00", "hypothesis": "Optimize SymSpell by pre-calculating string lengths, grouping deletions into tuples to avoid list overhead, and replacing string allocations in the Levenshtein DP fallback with explicit index limits, while using O(1) slice comparisons for threshold=2 fast paths.", "hypothesis_source": "agent", "mutation_diff_summary": "", "score": 4.29, "score_ci_lower": null, "score_ci_upper": null, "raw_scores": null, "baseline_score": 3.34, "outcome": "DISCARDED", "failure_mode": null, "duration_seconds": 240.83125149994157, "tags": ["symspell", "optimization", "fast-path", "memory-allocation", "dynamic-programming"], "learnings": "{\"what_changed\":\"\",\"what_improved\":[],\"what_regressed\":[],\"transferable_insight\":\"Aggregating multiple low-level micro-optimizations, such as avoiding memory allocations and swapping data structures to reduce overhead, often fails to yield practical performance gains and introduces unnecessary complexity.\",\"domain_tags\":[\"Performance Tuning\",\"Micro-optimization\",\"Algorithm Design\"]}", "cost_usd": 0.048604400000000006, "bootstrap_seed": 0, "agent_model": "gemini-3.1-pro-preview", "held_out_score": null, "criterion_names": null, "per_criterion_scores": null, "failure_classification": {"category": "over_optimization", "description": "The experiment involved several low-level performance optimizations for SymSpell. Despite the specific strategies outlined (pre-calculating lengths, grouping deletions, explicit index limits, O(1) slice comparisons), the 'unknown' failure mode and the resulting score of 4.2900 suggest that these complex changes either did not yield the anticipated performance improvements, introduced unexpected overhead, or inadvertently created subtle issues that negatively impacted the overall metric, characteristic of an over-optimization attempt that did not succeed.", "fix_direction": "Conduct thorough profiling to accurately identify the actual performance bottlenecks in SymSpell. Prioritize simpler, higher-impact optimizations or algorithmic changes over micro-optimizations unless profiling unequivocally points to their necessity. Evaluate the cost-benefit ratio of introducing complexity for marginal gains. Revert changes that show no clear performance benefit or introduce regressions.", "confidence": 0.95}, "drafts_generated": 1, "drafts_survived": 1}
{"id": "456941c2-c87f-4405-850c-016a42f6e119", "target_id": "B3-control", "git_sha": "dde7faf67aa1c18d57ef221f6af55d87e08f1053", "pre_experiment_sha": "dde7faf67aa1c18d57ef221f6af55d87e08f1053", "timestamp": "2026-04-23T12:25:42.775080+00:00", "hypothesis": "Implement symmetric deletion for O(N) candidate generation and O(1) exact Levenshtein distance fast-paths via intelligent prefix/suffix stripping and direct slice comparisons.", "hypothesis_source": "agent", "mutation_diff_summary": "", "score": 3.75, "score_ci_lower": null, "score_ci_upper": null, "raw_scores": null, "baseline_score": 3.34, "outcome": "DISCARDED", "failure_mode": null, "duration_seconds": 234.99541049986146, "tags": ["algorithm", "string-matching", "fast-path", "symspell", "levenshtein"], "learnings": "{\"what_changed\":\"\",\"what_improved\":[],\"what_regressed\":[],\"transferable_insight\":\"Algorithmic optimizations that improve theoretical time complexity can be counterproductive in practice if the overhead of managing the fast-paths outweighs the benefits for typical workloads.\",\"domain_tags\":[\"Algorithm Design\",\"Performance Optimization\",\"Complexity Analysis\"]}", "cost_usd": 0.04563965000000001, "bootstrap_seed": 0, "agent_model": "gemini-3.1-pro-preview", "held_out_score": null, "criterion_names": null, "per_criterion_scores": null, "failure_classification": {"category": "logic_error", "description": "The core algorithmic implementation for either the O(N) symmetric deletion candidate generation, the O(1) exact Levenshtein fast-paths, or the underlying prefix/suffix stripping and direct slice comparison logic appears to have fundamental flaws. This could mean the candidate set is incorrect or incomplete, the fast-paths are not being triggered effectively or are producing incorrect distances, or the 'intelligent' stripping mechanism is failing to identify optimal subproblems or is miscalculating. The low score (3.75) suggests the code runs but fails to achieve the desired correctness or performance targets.", "fix_direction": "Implement rigorous unit and integration tests for each component of the proposed algorithm: the symmetric deletion candidate generation, the prefix/suffix stripping logic, and the direct slice comparison for O(1) Levenshtein fast-paths. Focus on edge cases and ensure the generated candidates are correct and the Levenshtein distances are accurate across all expected scenarios. Profile the performance to verify the O(N) and O(1) complexity claims. Add extensive logging to trace the execution flow through the stripping and comparison stages to identify where the logic deviates from the hypothesis.", "confidence": 0.9}, "drafts_generated": 1, "drafts_survived": 1}
{"id": "419418fa-5567-4e34-807e-99d734ea51e3", "target_id": "B3-control", "git_sha": "dde7faf67aa1c18d57ef221f6af55d87e08f1053", "pre_experiment_sha": "dde7faf67aa1c18d57ef221f6af55d87e08f1053", "timestamp": "2026-04-23T12:30:22.253897+00:00", "hypothesis": "Implement the SymSpell symmetric deletion algorithm to reduce O(N^2) comparisons to O(N) hash lookups, generating up to 2 deletions for both sides. Combine this with heavily optimized O(1) direct slice comparisons in `_levenshtein` to fast-path exact distances for threshold=2.", "hypothesis_source": "agent", "mutation_diff_summary": "", "score": 3.34, "score_ci_lower": null, "score_ci_upper": null, "raw_scores": null, "baseline_score": 3.34, "outcome": "DISCARDED", "failure_mode": null, "duration_seconds": 243.1114018340595, "tags": ["symspell", "fast-path", "slicing", "deduplication"], "learnings": "{\"what_changed\":\"\",\"what_improved\":[],\"what_regressed\":[],\"transferable_insight\":\"Introducing theoretically faster, complex algorithms can yield zero net performance gain if the setup overhead of generating intermediate states outweighs the benefits of reduced comparisons for constrained or small-scale inputs.\",\"domain_tags\":[\"Algorithm Optimization\",\"Performance Engineering\",\"Complexity Trade-offs\"]}", "cost_usd": 0.0455892, "bootstrap_seed": 0, "agent_model": "gemini-3.1-pro-preview", "held_out_score": null, "criterion_names": null, "per_criterion_scores": null, "failure_classification": {"category": "logic_error", "description": "The experiment's hypothesis involved two key algorithmic optimizations: reducing O(N^2) comparisons to O(N) hash lookups for candidate generation in SymSpell, and implementing O(1) direct slice comparisons for Levenshtein distance when threshold is 2. The low score (3.3400) and 'unknown' failure mode strongly suggest that the implemented logic for these optimizations was flawed. This could mean incorrect candidate sets were generated, the hash lookups did not perform as expected (e.g., due to poor hash function, collision issues, or overhead), or the 'fast-path' Levenshtein comparisons had bugs or didn't achieve O(1) in critical scenarios, leading to incorrect results or performance degradation rather than improvement.", "fix_direction": "Thoroughly debug and profile the implemented optimizations. Isolate the O(N) hash lookup mechanism and the O(1) direct slice comparison for `_levenshtein` to verify their correctness and performance independently. Ensure the generated deletions are accurate and complete. Use profiling tools to identify actual performance bottlenecks and confirm if the intended O(N) and O(1) complexities are being achieved in practice. Implement comprehensive unit tests for the core logic of candidate generation and distance calculation with the new optimizations.", "confidence": 0.9}, "drafts_generated": 1, "drafts_survived": 1}
