{"id": "a5a5c552-da73-40be-9d50-3382a96bc79c", "target_id": "B3-control", "git_sha": "02c2235934c50731d7236ae7cf20f04bbe8e6f1f", "pre_experiment_sha": "dde7faf67aa1c18d57ef221f6af55d87e08f1053", "timestamp": "2026-04-23T12:33:51.925753+00:00", "hypothesis": "Simplify the threshold=2 fast path using exhaustive O(1) index-based slice comparisons to avoid complex logic errors, and hoist length-based grouping to the outer loop for the arbitrary-threshold fallback to minimize redundant evaluations.", "hypothesis_source": "agent", "mutation_diff_summary": "", "score": 3.42, "score_ci_lower": null, "score_ci_upper": null, "raw_scores": null, "baseline_score": 3.34, "outcome": "KEPT", "failure_mode": null, "duration_seconds": 187.64591158297844, "tags": ["optimization", "fast-path", "symspell", "string-slicing"], "learnings": "{\"what_changed\":\"\",\"what_improved\":[],\"what_regressed\":[],\"transferable_insight\":\"Isolating common, low-complexity cases into simplified fast paths while moving invariant grouping logic to the outermost scope of general fallbacks minimizes redundant work and reduces overall system complexity.\",\"domain_tags\":[\"Algorithm Optimization\",\"Performance Tuning\",\"Software Engineering\"]}", "cost_usd": 0.04653500000000001, "bootstrap_seed": 0, "agent_model": "gemini-3.1-pro-preview", "held_out_score": null, "criterion_names": null, "per_criterion_scores": null, "failure_classification": null, "drafts_generated": 1, "drafts_survived": 1}
{"id": "24b8fdf9-0e6d-4c36-8aa5-74dd8a8285cc", "target_id": "B3-control", "git_sha": "f0141ca5d8d93c02bbbc5ebb98a1ba4079d8fb1c", "pre_experiment_sha": "02c2235934c50731d7236ae7cf20f04bbe8e6f1f", "timestamp": "2026-04-23T12:38:02.961585+00:00", "hypothesis": "Optimize SymSpell deletion generation using fast C-level list comprehensions, streamline the `_levenshtein` threshold=2 fast-paths by removing redundant checks, and use `dict.get()` to reduce dictionary lookup overhead.", "hypothesis_source": "agent", "mutation_diff_summary": "", "score": 3.74, "score_ci_lower": null, "score_ci_upper": null, "raw_scores": null, "baseline_score": 3.42, "outcome": "KEPT", "failure_mode": null, "duration_seconds": 243.66765645891428, "tags": ["algorithm", "performance", "fast-path", "list-comprehension", "dictionary-optimization"], "learnings": "{\"what_changed\":\"\",\"what_improved\":[],\"what_regressed\":[],\"transferable_insight\":\"Leveraging native language constructs for iteration and data access, combined with streamlining fast-path logic by removing redundant checks, effectively reduces execution overhead and improves performance.\",\"domain_tags\":[\"Performance Optimization\",\"Algorithm Efficiency\",\"Code Refactoring\"]}", "cost_usd": 0.046886250000000004, "bootstrap_seed": 0, "agent_model": "gemini-3.1-pro-preview", "held_out_score": null, "criterion_names": null, "per_criterion_scores": null, "failure_classification": null, "drafts_generated": 1, "drafts_survived": 1}
{"id": "fe3c09da-428f-4913-8e7c-62c3a4936b0a", "target_id": "B3-control", "git_sha": "cdfdf52ce1b10c44435774116fd78e2b45f82912", "pre_experiment_sha": "f0141ca5d8d93c02bbbc5ebb98a1ba4079d8fb1c", "timestamp": "2026-04-23T12:42:01.210232+00:00", "hypothesis": "Optimize SymSpell deduplication using C-level `set.update()` to avoid Python-level loops, and streamline the Levenshtein fast-path with direct index-based slice comparisons to eliminate redundant variable updates.", "hypothesis_source": "agent", "mutation_diff_summary": "", "score": 3.37, "score_ci_lower": null, "score_ci_upper": null, "raw_scores": null, "baseline_score": 3.74, "outcome": "KEPT", "failure_mode": null, "duration_seconds": 207.41971691697836, "tags": ["symspell", "optimization", "strings", "fast-path"], "learnings": "{\"what_changed\":\"\",\"what_improved\":[],\"what_regressed\":[],\"transferable_insight\":\"Offloading iterative operations to native, lower-level functions and minimizing state tracking through direct index comparisons significantly reduces execution overhead.\",\"domain_tags\":[\"Performance Optimization\",\"Algorithm Design\",\"Code Refactoring\"]}", "cost_usd": 0.04724375000000001, "bootstrap_seed": 0, "agent_model": "gemini-3.1-pro-preview", "held_out_score": null, "criterion_names": null, "per_criterion_scores": null, "failure_classification": null, "drafts_generated": 1, "drafts_survived": 1}
{"id": "1005aa89-b670-40be-b77a-3a12b22c750a", "target_id": "B3-control", "git_sha": "96952bfb19657e6eee3b5a94ff7d1c630fe057f3", "pre_experiment_sha": "cdfdf52ce1b10c44435774116fd78e2b45f82912", "timestamp": "2026-04-23T12:45:37.377349+00:00", "hypothesis": "Optimize SymSpell deletion generation with C-level list comprehensions, use `dict.get()` for faster lookups, and streamline the O(1) slice-based fast-path for threshold=2 by removing redundant checks.", "hypothesis_source": "agent", "mutation_diff_summary": "", "score": 3.45, "score_ci_lower": null, "score_ci_upper": null, "raw_scores": null, "baseline_score": 3.37, "outcome": "KEPT", "failure_mode": null, "duration_seconds": 208.0478426250629, "tags": ["fast-path", "dictionary-optimization", "list-comprehension\n\n```python\nfrom __future__ import annotations\n\nimport time\n\n\n# Embedded test data: two lists of ~260 strings each\n# sized to keep runtime in the 500-2000ms window on modern hardware\n_NAMES_A: list[str] = [\n    \"alice\"", "\"alexander\"", "\"alicia\"", "\"alison\"", "\"alicia\"", "\"benjamin\"", "\"bennett\"", "\"beatrice\"", "\"bernadette\"", "\"blake\"", "\"catherine\"", "\"carolina\"", "\"cassandra\"", "\"cecilia\"", "\"celeste\"", "\"daniel\"", "\"danielle\"", "\"darius\"", "\"darwin\"", "\"davina\"", "\"eleanor\"", "\"elizabeth\"", "\"elliot\"", "\"eloise\"", "\"elvira\"", "\"franklin\"", "\"francesca\"", "\"frederica\"", "\"felicity\"", "\"flora\"", "\"gabriel\"", "\"gabriella\"", "\"genevieve\"", "\"georgia\"", "\"geraldine\"", "\"harriet\"", "\"harrison\"", "\"hayden\"", "\"helena\"", "\"henrietta\"", "\"isabella\"", "\"isadora\"", "\"isidore\"", "\"isolde\"", "\"imelda\"", "\"jasper\"", "\"jacqueline\"", "\"janelle\"", "\"jarvis\"", "\"jessamine\"", "\"katherine\"", "\"katrina\"", "\"kendall\"", "\"kennedy\"", "\"kieran\"", "\"laurence\"", "\"lavinia\"", "\"lazarus\"", "\"leander\"", "\"leonora\"", "\"margaret\"", "\"marianne\"", "\"marlowe\"", "\"mathilda\"", "\"maximiliana\"", "\"nathaniel\"", "\"natasha\"", "\"neil\"", "\"nelson\"", "\"nerissa\"", "\"octavia\"", "\"oliver\"", "\"olympia\"", "\"ophelia\"", "\"orion\"", "\"penelope\"", "\"percival\"", "\"persephone\"", "\"petra\"", "\"philippa\"", "\"quinton\"", "\"quintessa\"", "\"quincey\"", "\"queenie\"", "\"quentin\"", "\"rosalind\"", "\"rosalinda\"", "\"rosamund\"", "\"rowena\"", "\"roxanne\"", "\"sebastian\"", "\"seraphina\"", "\"sigrid\"", "\"silvana\"", "\"solomon\"", "\"theodore\"", "\"theodosia\"", "\"thomas\"", "\"thomasina\"", "\"titania\"", "\"ulysses\"", "\"una\"", "\"uriah\"", "\"ursula\"", "\"umberto\"", "\"valentina\"", "\"valerian\"", "\"vera\"", "\"veronica\"", "\"victoria\"", "\"wilhelmina\"", "\"winifred\"", "\"winston\"", "\"wren\"", "\"wyatt\"", "\"xavier\"", "\"xena\"", "\"xerxes\"", "\"xiomara\"", "\"xochitl\"", "\"yolanda\"", "\"yolande\"", "\"yorick\"", "\"yvette\"", "\"yvonne\"", "\"zacharias\"", "\"zelda\"", "\"zenobia\"", "\"zephyr\"", "\"zinnia\"", "\"adriana\"", "\"adrienne\"", "\"agatha\"", "\"agnes\"", "\"aigerim\"", "\"barnabas\"", "\"bartholomew\"", "\"basil\"", "\"beckett\"", "\"belinda\"", "\"calista\"", "\"calliope\"", "\"camellia\"", "\"camille\"", "\"candida\"", "\"damaris\"", "\"damian\"", "\"daphne\"", "\"deidre\"", "\"delilah\"", "\"ebenezer\"", "\"edith\"", "\"edwina\"", "\"effie\"", "\"eglantine\"", "\"fabian\"", "\"faith\"", "\"fantine\"", "\"faye\"", "\"felicia\"", "\"galatea\"", "\"gareth\"", "\"gawain\"", "\"gemma\"", "\"gideon\"", "\"hector\"", "\"hedwig\"", "\"heloise\"", "\"hester\"", "\"hildegard\"", "\"ignatius\"", "\"ines\"", "\"ingrid\"", "\"irene\"", "\"iris\"", "\"jacob\"", "\"jocasta\"", "\"jocelyn\"", "\"joel\"", "\"johanna\"", "\"krista\"", "\"kristopher\"", "\"kyle\"", "\"kylie\"", "\"kyra\"", "\"lancelot\"", "\"lara\"", "\"lars\"", "\"latasha\"", "\"layla\"", "\"mackenzie\"", "\"madeline\"", "\"magnus\"", "\"malachi\"", "\"malone\"", "\"naomi\"", "\"narcissa\"", "\"nadia\"", "\"nigel\"", "\"niobe\"", "\"orlanda\"", "\"oswald\"", "\"ottilia\"", "\"owain\"", "\"ozymandias\"", "\"paloma\"", "\"pamela\"", "\"pandora\"", "\"pascal\"", "\"patience\"", "\"raffael\"", "\"ramona\"", "\"randolph\"", "\"raphaela\"", "\"reginald\"", "\"sabrina\"", "\"sacheverell\"", "\"salome\"", "\"samantha\"", "\"sapphire\"", "\"tabitha\"", "\"talitha\"", "\"tamsin\"", "\"tarquin\"", "\"tessa\"", "\"ulrika\"", "\"undine\"", "\"upton\"", "\"urbane\"", "\"urien\"", "\"violetta\"", "\"virginia\"", "\"vivian\"", "\"vivienne\"", "\"voss\"", "\"warwick\"", "\"wendell\"", "\"wendy\"", "\"wilbur\"", "\"wilfred\"", "]\n\n_NAMES_B: list[str] = [\n    \"alyce\"", "\"alexender\"", "\"alecia\"", "\"allison\"", "\"alisha\"", "\"benjamine\"", "\"bennet\"", "\"beatrix\"", "\"bernadett\"", "\"blaise\"", "\"catharine\"", "\"karoline\"", "\"kassandra\"", "\"cecilya\"", "\"celest\"", "\"danyal\"", "\"daniele\"", "\"daryus\"", "\"darwinn\"", "\"davena\"", "\"elenor\"", "\"elizebeth\"", "\"eliott\"", "\"elois\"", "\"elveera\"", "\"franklyn\"", "\"fransesca\"", "\"frederika\"", "\"felicite\"", "\"flora\"", "\"gabriell\"", "\"gabriela\"", "\"geneviv\"", "\"georgea\"", "\"geraldyne\"", "\"harriett\"", "\"harryson\"", "\"haydn\"", "\"heleena\"", "\"henryetta\"", "\"izabella\"", "\"isadore\"", "\"isidor\"", "\"isold\"", "\"imelda\"", "\"gasper\"", "\"jackline\"", "\"janell\"", "\"jarvis\"", "\"jessamin\"", "\"katerine\"", "\"katreena\"", "\"kendal\"", "\"kennedee\"", "\"kierran\"", "\"laurens\"", "\"lavinia\"", "\"lazaros\"", "\"leandre\"", "\"leonore\"", "\"margeret\"", "\"mariann\"", "\"marlo\"", "\"matilda\"", "\"maximiliane\"", "\"nathanyal\"", "\"natacha\"", "\"neil\"", "\"nellson\"", "\"nerisa\"", "\"octavya\"", "\"olivar\"", "\"olimpia\"", "\"ofelia\"", "\"oreon\"", "\"penelopy\"", "\"percieval\"", "\"persephon\"", "\"peetra\"", "\"phillipa\"", "\"quinten\"", "\"quinteesa\"", "\"quincee\"", "\"queeny\"", "\"quenten\"", "\"rosalinde\"", "\"rosalynd\"", "\"rosamunde\"", "\"roweena\"", "\"roxann\"", "\"sebastien\"", "\"serafina\"", "\"sigred\"", "\"silvanna\"", "\"soloman\"", "\"theodor\"", "\"theodozia\"", "\"tomas\"", "\"tomasina\"", "\"titanya\"", "\"ulises\"", "\"oona\"", "\"uriyah\"", "\"ursulea\"", "\"umbertho\"", "\"valentyna\"", "\"valerien\"", "\"verra\"", "\"veronika\"", "\"victorya\"", "\"wilhemina\"", "\"winnifred\"", "\"winsten\"", "\"wren\"", "\"wyat\"", "\"xaviar\"", "\"zeena\"", "\"zerxes\"", "\"xiomarra\"", "\"xochitil\"", "\"yolander\"", "\"yolanda\"", "\"yorrik\"", "\"yvett\"", "\"ivonne\"", "\"zacharyus\"", "\"zeleda\"", "\"zenobya\"", "\"zefir\"", "\"zinyah\"", "\"adrienna\"", "\"adriann\"", "\"agather\"", "\"agness\"", "\"aygerim\"", "\"barnabis\"", "\"bartholemew\"", "\"basill\"", "\"becket\"", "\"belynda\"", "\"calister\"", "\"calliopee\"", "\"camelia\"", "\"camil\"", "\"candyda\"", "\"damares\"", "\"damyen\"", "\"dafne\"", "\"deidree\"", "\"delyla\"", "\"ebeneezer\"", "\"edyth\"", "\"edwinna\"", "\"effy\"", "\"eglantyne\"", "\"fabyian\"", "\"faithe\"", "\"fanteen\"", "\"fayye\"", "\"felisha\"", "\"galatea\"", "\"garreth\"", "\"gawaine\"", "\"jemma\"", "\"giddeon\"", "\"hecter\"", "\"hedwidge\"", "\"heloyse\"", "\"hesther\"", "\"hildigard\"", "\"ignatious\"", "\"inez\"", "\"ingred\"", "\"ireen\"", "\"irys\"", "\"jakob\"", "\"jocasta\"", "\"jocelin\"", "\"joell\"", "\"johana\"", "\"kresta\"", "\"kristofer\"", "\"kile\"", "\"kylee\"", "\"kira\"", "\"lancelott\"", "\"larra\"", "\"larrs\"", "\"latashia\"", "\"laila\"", "\"mackensie\"", "\"madelyne\"", "\"magnes\"", "\"malakhi\"", "\"malonne\"", "\"naomie\"", "\"narcissa\"", "\"nadja\"", "\"nigell\"", "\"niobee\"", "\"orlanda\"", "\"oswald\"", "\"ottilya\"", "\"owaine\"", "\"ozymandeas\"", "\"palomma\"", "\"pamella\"", "\"pandorra\"", "\"pascall\"", "\"pacience\"", "\"raffaell\"", "\"ramonna\"", "\"randolfe\"", "\"raphaella\"", "\"reginalde\"", "\"sabrina\"", "\"sacheverel\"", "\"salomee\"", "\"samanthia\"", "\"saphire\"", "\"tabithia\"", "\"talithia\"", "\"tamzin\"", "\"tarquine\"", "\"tess\"", "\"ulricka\"", "\"ondine\"", "\"uptown\"", "\"urbanee\"", "\"uryen\"", "\"violeta\"", "\"virginie\"", "\"vivyan\"", "\"vivienn\"", "\"vos\"", "\"warwicke\"", "\"wendall\"", "\"wendie\"", "\"wilbure\"", "\"wilfrid\"", "]\n\n_V_INIT = list(range(256))\n\n\ndef _levenshtein(s: str", "t: str", "threshold: int = 2) -> int:\n    \"\"\"Optimized Levenshtein distance with early exit and fast paths.\"\"\"\n    if s == t:\n        return 0\n    len_s = len(s)\n    len_t = len(t)\n    if len_s > len_t:\n        s", "t = t", "s\n        len_s", "len_t = len_t", "len_s\n\n    diff = len_t - len_s\n    if diff > threshold:\n        return threshold + 1\n\n    pref = 0\n    while pref < len_s and s[pref] == t[pref]:\n        pref += 1\n    \n    if pref == len_s:\n        return diff\n\n    suff = 0\n    while suff < len_s - pref and s[-(suff + 1)] == t[-(suff + 1)]:\n        suff += 1\n    \n    rem_s = len_s - pref - suff\n    rem_t = len_t - pref - suff\n    \n    if rem_s == 0:\n        return rem_t\n\n    if threshold == 2:\n        end_s = len_s - suff\n        end_t = len_t - suff\n        if diff == 0:\n            if rem_s <= 2:\n                return rem_s\n            if s[pref + 1 : end_s - 1] == t[pref + 1 : end_t - 1] or \\\n               s[pref + 1 : end_s] == t[pref : end_t - 1] or \\\n               s[pref : end_s - 1] == t[pref + 1 : end_t]:\n                return 2\n            return 3\n\n        if diff == 1:\n            t_mid = t[pref + 1 : end_t - 1]\n            if s[pref : end_s - 1] == t_mid or s[pref + 1 : end_s] == t_mid:\n                return 2\n            return 3\n\n        if s[pref : end_s] == t[pref + 1 : end_t - 1]:\n            return 2\n        return 3\n\n    # Fallback for threshold != 2\n    v = _V_INIT[:rem_t + 1]\n    s_sub = s[pref : len_s - suff]\n    t_sub = t[pref : len_t - suff]\n    for char_s in s_sub:\n        prev = v[0]\n        v[0] += 1\n        min_v = v[0]\n        for j", "char_t in enumerate(t_sub):\n            temp = v[j + 1]\n            if char_s == char_t:\n                cost = prev\n            else:\n                cost = prev if prev < temp else temp\n                if v[j] < cost:\n                    cost = v[j]\n                cost += 1\n            v[j + 1] = cost\n            prev = temp\n            if cost < min_v:\n                min_v = cost\n        if min_v > threshold:\n            return threshold + 1\n\n    return v[-1]\n\n\ndef _find_close_pairs(list_a: list[str]", "list_b: list[str]", "threshold: int) -> list[tuple[str", "str", "int]]:\n    \"\"\"Return all (a", "b", "distance) pairs where distance <= threshold.\"\"\"\n    results = []\n    if not list_a or not list_b:\n        return results\n\n    unique_a = set(list_a)\n    unique_b = set(list_b)\n\n    if threshold != 2:\n        # Fallback for arbitrary threshold: hoist bucketing to the outer loop\n        b_by_len: dict[int", "list[str]] = {}\n        for b in unique_b:\n            L = len(b)\n            l = b_by_len.get(L)\n            if l is not None:\n                l.append(b)\n            else:\n                b_by_len[L] = [b]\n                \n        for a in unique_a:\n            La = len(a)\n            for Lb in range(La - threshold", "La + threshold + 1):\n                l_b = b_by_len.get(Lb)\n                if l_b is not None:\n                    for b in l_b:\n                        dist = _levenshtein(a", "b", "threshold)\n                        if dist <= threshold:\n                            results.append((a", "b", "dist))\n        return results\n\n    # SymSpell-like symmetric deletion strategy for threshold == 2\n    b_dels: dict[str", "list[str]] = {}\n    for b in unique_b:\n        Lb = len(b)\n        b_1 = [b[:i] + b[i+1:] for i in range(Lb)]\n        dels = set(b_1)\n        dels.add(b)\n        dels.update([b_i[:j] + b_i[j+1:] for i", "b_i in enumerate(b_1) for j in range(i", "Lb - 1)])\n        \n        for d in dels:\n            l = b_dels.get(d)\n            if l is not None:\n                l.append(b)\n            else:\n                b_dels[d] = [b]\n\n    results_append = results.append\n    for a in unique_a:\n        La = len(a)\n        a_1 = [a[:i] + a[i+1:] for i in range(La)]\n        dels = set(a_1)\n        dels.add(a)\n        dels.update([a_i[:j] + a_i[j+1:] for i", "a_i in enumerate(a_1) for j in range(i", "La - 1)])\n                \n        candidates = set()\n        candidates_update = candidates.update\n        for d in dels:\n            l = b_dels.get(d)\n            if l is not None:\n                candidates_update(l)\n                \n        for b in candidates:\n            dist = _levenshtein(a", "b", "2)\n            if dist <= 2:\n                results_append((a", "b", "dist))\n\n    return results\n\n\ndef _deduplicate_pairs(pairs: list[tuple[str", "str", "int]]) -> list[tuple[str", "str", "int]]:\n    \"\"\"Return pairs as they are already deduplicated by _find_close_pairs.\"\"\"\n    return pairs\n\n\ndef run_benchmark() -> tuple[int", "float]:\n    \"\"\"Execute the benchmark and return (match_count", "elapsed_ms).\"\"\"\n    start = time.perf_counter()\n\n    raw_pairs = _find_close_pairs(_NAMES_A", "_NAMES_B", "threshold=2)\n    unique_pairs = _deduplicate_pairs(raw_pairs)\n    match_count = len(unique_pairs)\n\n    elapsed_ms = (time.perf_counter() - start) * 1000.0\n    return match_count", "elapsed_ms\n\n\nif __name__ == \"__main__\":\n    count", "elapsed = run_benchmark()\n    print(f\"match_count: {count}\")\n    print(f\"execution_time_ms: {elapsed:.2f}\")\n```"], "learnings": "{\"what_changed\":\"\",\"what_improved\":[],\"what_regressed\":[],\"transferable_insight\":\"Algorithmic performance can be significantly enhanced by leveraging low-level language features for collection generation, optimizing hash map lookups, and removing redundant conditional checks in fast-paths.\",\"domain_tags\":[\"Performance Optimization\",\"Algorithm Design\",\"Data Structures\"]}", "cost_usd": 0.047102500000000005, "bootstrap_seed": 0, "agent_model": "gemini-3.1-pro-preview", "held_out_score": null, "criterion_names": null, "per_criterion_scores": null, "failure_classification": null, "drafts_generated": 1, "drafts_survived": 1}
{"id": "51772d4c-3f8d-4375-af6f-6259a3d15f5f", "target_id": "B3-control", "git_sha": "c81f973986de7d91b36342c8f59689280af7432b", "pre_experiment_sha": "96952bfb19657e6eee3b5a94ff7d1c630fe057f3", "timestamp": "2026-04-23T12:49:33.150878+00:00", "hypothesis": "Optimize the SymSpell symmetric deletion generation using fast dictionary lookups (`if in` instead of `dict.get`) and streamline the `_levenshtein` fast-path for threshold=2 by simplifying the O(1) slice comparisons to avoid redundant logic checks.", "hypothesis_source": "agent", "mutation_diff_summary": "", "score": 3.37, "score_ci_lower": null, "score_ci_upper": null, "raw_scores": null, "baseline_score": 3.45, "outcome": "KEPT", "failure_mode": null, "duration_seconds": 228.25618766690604, "tags": ["algorithm", "optimization", "symspell", "levenshtein", "fast-path"], "learnings": "{\"what_changed\":\"\",\"what_improved\":[],\"what_regressed\":[],\"transferable_insight\":\"Replacing method calls with native operators and simplifying conditional logic in algorithmic hot paths reduces execution overhead and improves performance.\",\"domain_tags\":[\"Performance Optimization\",\"Algorithm Design\",\"Code Optimization\"]}", "cost_usd": 0.0471375, "bootstrap_seed": 0, "agent_model": "gemini-3.1-pro-preview", "held_out_score": null, "criterion_names": null, "per_criterion_scores": null, "failure_classification": null, "drafts_generated": 1, "drafts_survived": 1}
{"id": "fecbd395-373b-43e3-89f9-3389c1e48c4f", "target_id": "B3-control", "git_sha": "76f83f9673389a90b202b22218530a872793f1ae", "pre_experiment_sha": "c81f973986de7d91b36342c8f59689280af7432b", "timestamp": "2026-04-23T12:53:30.464011+00:00", "hypothesis": "Optimize SymSpell deletion generation using fast C-level list comprehensions and streamline the Levenshtein fast-path by pre-calculating slice indices.", "hypothesis_source": "agent", "mutation_diff_summary": "", "score": 3.77, "score_ci_lower": null, "score_ci_upper": null, "raw_scores": null, "baseline_score": 3.37, "outcome": "KEPT", "failure_mode": null, "duration_seconds": 210.76791858300567, "tags": ["optimization", "algorithm", "list-comprehension", "slicing"], "learnings": "{\"what_changed\":\"\",\"what_improved\":[],\"what_regressed\":[],\"transferable_insight\":\"Shifting repetitive calculations outside of hot loops and leveraging native, lower-level language constructs for data generation significantly reduces computational overhead.\",\"domain_tags\":[\"Performance Optimization\",\"Algorithm Optimization\"]}", "cost_usd": 0.046585, "bootstrap_seed": 0, "agent_model": "gemini-3.1-pro-preview", "held_out_score": null, "criterion_names": null, "per_criterion_scores": null, "failure_classification": null, "drafts_generated": 1, "drafts_survived": 1}
