{"id": "988da612-391f-48b9-a018-4f256156e637", "target_id": "B3-control", "git_sha": "b17d42283052de5761d953cbd5c591411a4f8834", "pre_experiment_sha": "5579821b9d7df0b9dbdac6018f7af949bff6c5ff", "timestamp": "2026-04-21T02:35:27.711900+00:00", "hypothesis": "Cache the first and last 4 characters of the outer loop string `a` to eliminate repeated indexing operations inside the inner loops, and cache arithmetic results like `i + 1` and `t_len - j` to further reduce bytecode execution overhead for O(1) string slicing checks.", "hypothesis_source": "agent", "mutation_diff_summary": "", "score": 9.16, "score_ci_lower": null, "score_ci_upper": null, "raw_scores": null, "baseline_score": 10.01, "outcome": "KEPT", "failure_mode": null, "duration_seconds": 299.7168457501102, "tags": ["micro-optimization", "loop-unrolling", "caching"], "learnings": "{\"what_changed\":\"\",\"what_improved\":[],\"what_regressed\":[],\"transferable_insight\":\"Precomputing arithmetic operations and caching frequently accessed elements outside of inner loops minimizes redundant calculations and reduces execution overhead in high-frequency code paths.\",\"domain_tags\":[\"Performance Optimization\",\"Loop Optimization\",\"Caching\"]}", "cost_usd": 0.09418125000000001, "bootstrap_seed": 0, "agent_model": "gemini-3.1-pro-preview", "held_out_score": null, "criterion_names": null, "per_criterion_scores": null, "failure_classification": null, "drafts_generated": 1, "drafts_survived": 1}
{"id": "9d9344f0-16c1-4b7a-af1a-abcfe7127d85", "target_id": "B3-control", "git_sha": "cb82910579c441cdf12884507671d75cd78342e5", "pre_experiment_sha": "b17d42283052de5761d953cbd5c591411a4f8834", "timestamp": "2026-04-21T02:40:27.799331+00:00", "hypothesis": "Pre-extract the first and last 4 characters of strings into tuples during bucketing to completely eliminate string indexing overhead in the inner loops, and use fast local variable unpacking for O(1) prefix/suffix matching.", "hypothesis_source": "agent", "mutation_diff_summary": "", "score": 8.59, "score_ci_lower": null, "score_ci_upper": null, "raw_scores": null, "baseline_score": 9.16, "outcome": "KEPT", "failure_mode": null, "duration_seconds": 292.82255574990995, "tags": ["string-slicing", "tuple-unpacking", "loop-unrolling", "micro-optimization"], "learnings": "{\"what_changed\":\"\",\"what_improved\":[],\"what_regressed\":[],\"transferable_insight\":\"Pre-extracting frequently accessed data segments into lightweight, easily unpackable structures outside of inner loops eliminates repetitive indexing overhead and significantly improves processing speed.\",\"domain_tags\":[\"Performance Optimization\",\"Algorithm Design\",\"Data Structures\"]}", "cost_usd": 0.10607625000000001, "bootstrap_seed": 0, "agent_model": "gemini-3.1-pro-preview", "held_out_score": null, "criterion_names": null, "per_criterion_scores": null, "failure_classification": null, "drafts_generated": 1, "drafts_survived": 1}
{"id": "7363cd67-5b64-4d0d-86b0-b0d15f775aca", "target_id": "B3-control", "git_sha": "f659ce623be73d4bd7704ee1913b4ef14dc23f3d", "pre_experiment_sha": "cb82910579c441cdf12884507671d75cd78342e5", "timestamp": "2026-04-21T02:45:34.447921+00:00", "hypothesis": "Replace inner `while` loops with `for` loops to reduce bytecode overhead, use `for/else` to safely handle empty ranges, and pad length-bucketed arrays to completely eliminate bounds-checking branches.", "hypothesis_source": "agent", "mutation_diff_summary": "", "score": 8.72, "score_ci_lower": null, "score_ci_upper": null, "raw_scores": null, "baseline_score": 8.59, "outcome": "KEPT", "failure_mode": null, "duration_seconds": 283.304922292009, "tags": ["micro-optimization", "loop-unrolling", "string-slicing"], "learnings": "{\"what_changed\":\"\",\"what_improved\":[],\"what_regressed\":[],\"transferable_insight\":\"Execution overhead can be significantly reduced by utilizing native iteration constructs over manual loops and padding data structures to eliminate conditional bounds checks.\",\"domain_tags\":[\"Performance Optimization\",\"Code Refactoring\",\"Data Structures\"]}", "cost_usd": 0.1089175, "bootstrap_seed": 0, "agent_model": "gemini-3.1-pro-preview", "held_out_score": null, "criterion_names": null, "per_criterion_scores": null, "failure_classification": null, "drafts_generated": 1, "drafts_survived": 1}
{"id": "d2dc6810-b3fb-4260-943e-9baddf2e2f7c", "target_id": "B3-control", "git_sha": "ae8e722d55ae4b7a3f2ad5f23dbc595534561236", "pre_experiment_sha": "f659ce623be73d4bd7704ee1913b4ef14dc23f3d", "timestamp": "2026-04-21T02:50:27.181523+00:00", "hypothesis": "Eliminate redundant loop bounds checks in prefix and suffix matching by utilizing unbounded `while` loops for equal-length strings (where mismatches are guaranteed) and `try/except IndexError` for unequal-length strings, significantly reducing bytecode execution overhead in the inner loops.", "hypothesis_source": "agent", "mutation_diff_summary": "", "score": 8.8, "score_ci_lower": null, "score_ci_upper": null, "raw_scores": null, "baseline_score": 8.72, "outcome": "KEPT", "failure_mode": null, "duration_seconds": 286.39152720803395, "tags": ["micro-optimization", "loop-unrolling", "bounds-check-elimination"], "learnings": "{\"what_changed\":\"\",\"what_improved\":[],\"what_regressed\":[],\"transferable_insight\":\"Replacing explicit per-iteration boundary checks with exception handling or guaranteed termination conditions can significantly reduce execution overhead in performance-critical loops.\",\"domain_tags\":[\"Performance Optimization\",\"Code Optimization\",\"Algorithm Design\"]}", "cost_usd": 0.10851375000000002, "bootstrap_seed": 0, "agent_model": "gemini-3.1-pro-preview", "held_out_score": null, "criterion_names": null, "per_criterion_scores": null, "failure_classification": null, "drafts_generated": 1, "drafts_survived": 1}
{"id": "8c398bfb-6e13-4b59-a897-66e0fd433eb2", "target_id": "B3-control", "git_sha": "6db406ee17280f0bf11d557739c3115df02c5197", "pre_experiment_sha": "ae8e722d55ae4b7a3f2ad5f23dbc595534561236", "timestamp": "2026-04-21T02:54:47.627229+00:00", "hypothesis": "Replace `try...except IndexError` and `while` loops with `for ... in range(...)` loops to eliminate exception handling overhead and push loop bounds checking into C, further accelerating O(1) string slicing checks.", "hypothesis_source": "agent", "mutation_diff_summary": "", "score": 8.76, "score_ci_lower": null, "score_ci_upper": null, "raw_scores": null, "baseline_score": 8.8, "outcome": "KEPT", "failure_mode": null, "duration_seconds": 253.01222791709006, "tags": ["loop-unrolling", "micro-optimization", "fast-path"], "learnings": "{\"what_changed\":\"\",\"what_improved\":[],\"what_regressed\":[],\"transferable_insight\":\"Replacing manual loop control and exception-based bounds checking with built-in iterator constructs improves execution speed by leveraging lower-level optimizations and eliminating exception handling overhead.\",\"domain_tags\":[\"Performance Optimization\",\"Control Flow\",\"Code Refactoring\"]}", "cost_usd": 0.10848625, "bootstrap_seed": 0, "agent_model": "gemini-3.1-pro-preview", "held_out_score": null, "criterion_names": null, "per_criterion_scores": null, "failure_classification": null, "drafts_generated": 1, "drafts_survived": 1}
{"id": "bd3b2833-1f45-4e1b-a58b-77cbf7e66db6", "target_id": "B3-control", "git_sha": "8e434b23400bd7d77f45dd0616b7d5d432da4bb0", "pre_experiment_sha": "6db406ee17280f0bf11d557739c3115df02c5197", "timestamp": "2026-04-21T02:59:29.496521+00:00", "hypothesis": "Eliminate inner-loop tuple unpacking overhead by storing only strings in length-buckets and caching the outer string's first/last 4 characters as local variables, comparing them directly against indexed characters of the inner string.", "hypothesis_source": "agent", "mutation_diff_summary": "", "score": 9.0, "score_ci_lower": null, "score_ci_upper": null, "raw_scores": null, "baseline_score": 8.76, "outcome": "KEPT", "failure_mode": null, "duration_seconds": 252.31708229100332, "tags": ["micro-optimization", "memory-allocation", "loop-unrolling"], "learnings": "{\"what_changed\":\"\",\"what_improved\":[],\"what_regressed\":[],\"transferable_insight\":\"Flattening data structures to eliminate unpacking overhead and caching invariant values locally for direct comparison significantly improves performance in high-frequency nested loops.\",\"domain_tags\":[\"Performance Optimization\",\"Loop Optimization\",\"Data Structures\"]}", "cost_usd": 0.10980250000000001, "bootstrap_seed": 0, "agent_model": "gemini-3.1-pro-preview", "held_out_score": null, "criterion_names": null, "per_criterion_scores": null, "failure_classification": null, "drafts_generated": 1, "drafts_survived": 1}
{"id": "aa85be6b-21e3-46ed-b3fe-b562d8ffa573", "target_id": "B3-control", "git_sha": "d742bb403e4a0175977472045b3aba755eb65561", "pre_experiment_sha": "8e434b23400bd7d77f45dd0616b7d5d432da4bb0", "timestamp": "2026-04-21T03:03:50.163328+00:00", "hypothesis": "Pre-extract the first and last 4 characters of strings into tuples during bucketing to completely eliminate string indexing overhead in the inner loops via fast C-level tuple unpacking (`UNPACK_SEQUENCE`).", "hypothesis_source": "agent", "mutation_diff_summary": "", "score": 8.56, "score_ci_lower": null, "score_ci_upper": null, "raw_scores": null, "baseline_score": 9.0, "outcome": "KEPT", "failure_mode": null, "duration_seconds": 251.7264886670746, "tags": ["micro-optimization", "loop-unrolling", "string-slicing"], "learnings": "{\"what_changed\":\"\",\"what_improved\":[],\"what_regressed\":[],\"transferable_insight\":\"Moving repetitive data extraction operations out of inner loops by pre-computing them into highly optimized, fast-unpacking data structures significantly reduces execution overhead.\",\"domain_tags\":[\"Performance Optimization\",\"Loop Optimization\",\"Data Structures\"]}", "cost_usd": 0.118345, "bootstrap_seed": 0, "agent_model": "gemini-3.1-pro-preview", "held_out_score": null, "criterion_names": null, "per_criterion_scores": null, "failure_classification": null, "drafts_generated": 1, "drafts_survived": 1}
{"id": "e0dd9374-e22f-4090-928a-5b2a1057b40f", "target_id": "B3-control", "git_sha": "d742bb403e4a0175977472045b3aba755eb65561", "pre_experiment_sha": "d742bb403e4a0175977472045b3aba755eb65561", "timestamp": "2026-04-21T03:08:34.083876+00:00", "hypothesis": "Replacing the pre-extracted character tuples with flat lists of strings and caching character lookups inside the matching loops eliminates tuple allocation and unpacking overhead, while removing redundant `else` clauses in the `la == lb` loops further reduces bytecode execution.", "hypothesis_source": "agent", "mutation_diff_summary": "", "score": 9.01, "score_ci_lower": null, "score_ci_upper": null, "raw_scores": null, "baseline_score": 8.56, "outcome": "DISCARDED", "failure_mode": null, "duration_seconds": 276.6082247919403, "tags": ["micro-optimization", "memory-allocation", "loop-unrolling"], "learnings": "{\"what_changed\":\"\",\"what_improved\":[],\"what_regressed\":[],\"transferable_insight\":\"Replacing native, immutable data structures with flat lists and manual loop-level caching can degrade performance by bypassing highly optimized internal allocation and unpacking routines.\",\"domain_tags\":[\"Performance Optimization\",\"Data Structures\",\"Micro-optimization\"]}", "cost_usd": 0.11122035000000001, "bootstrap_seed": 0, "agent_model": "gemini-3.1-pro-preview", "held_out_score": null, "criterion_names": null, "per_criterion_scores": null, "failure_classification": {"category": "over_optimization", "description": "The experiment aimed to improve performance by reducing tuple allocation/unpacking overhead and bytecode execution. The failure indicates that these specific optimization attempts either did not yield the expected performance gains, introduced new overheads that counteracted the intended benefits, or led to unforeseen issues, making the optimization effort counterproductive or ineffective.", "fix_direction": "Re-evaluate the actual performance bottlenecks using profiling tools. Consider if the proposed changes are addressing the most significant inefficiencies or introducing unnecessary complexity. Explore alternative, simpler optimization strategies or focus on correctness and readability first before micro-optimizations.", "confidence": 0.95}, "drafts_generated": 1, "drafts_survived": 1}
{"id": "9e07effc-ef33-44c7-b9f8-063cfcdf46b6", "target_id": "B3-control", "git_sha": "ab466fabbef7229a35fd8de521d75eaee0edabbd", "pre_experiment_sha": "d742bb403e4a0175977472045b3aba755eb65561", "timestamp": "2026-04-21T03:23:47.400432+00:00", "hypothesis": "Optimize exact match processing by hoisting distance 0 pairs into an O(1) set intersection, completely eliminating duplicate appends and allowing the inner loops to bypass exact match logic more efficiently by deferring string equality checks until after fast character-level prefix comparisons.", "hypothesis_source": "agent", "mutation_diff_summary": "", "score": 8.61, "score_ci_lower": null, "score_ci_upper": null, "raw_scores": null, "baseline_score": 8.56, "outcome": "KEPT", "failure_mode": null, "duration_seconds": 275.4400987920817, "tags": ["set-intersection", "early-exit", "fast-path", "string-equality"], "learnings": "{\"what_changed\":\"\",\"what_improved\":[],\"what_regressed\":[],\"transferable_insight\":\"Handling exact matches upfront using O(1) lookups and deferring expensive evaluations behind cheaper, coarse-grained filters significantly improves algorithmic efficiency.\",\"domain_tags\":[\"Algorithm Optimization\",\"Performance Engineering\",\"Data Structures\"]}", "cost_usd": 0.11962625, "bootstrap_seed": 0, "agent_model": "gemini-3.1-pro-preview", "held_out_score": null, "criterion_names": null, "per_criterion_scores": null, "failure_classification": null, "drafts_generated": 1, "drafts_survived": 1}
{"id": "2afd7b08-d8d7-4abe-9be0-76df31840775", "target_id": "B3-control", "git_sha": "315342560ebd8290e824b8ec748e4835152e01ba", "pre_experiment_sha": "ab466fabbef7229a35fd8de521d75eaee0edabbd", "timestamp": "2026-04-21T03:38:48.548909+00:00", "hypothesis": "Remove the O(1) set intersection for exact matches and handle them inline to eliminate overhead, and remove redundant `max_j` bounds checks for equal-length strings while preserving them for unequal-length strings to prevent logic errors.", "hypothesis_source": "agent", "mutation_diff_summary": "", "score": 8.56, "score_ci_lower": null, "score_ci_upper": null, "raw_scores": null, "baseline_score": 8.61, "outcome": "KEPT", "failure_mode": null, "duration_seconds": 264.3214367090259, "tags": ["set-intersection-removal", "bounds-check-elimination", "inline-exact-matches"], "learnings": "{\"what_changed\":\"\",\"what_improved\":[],\"what_regressed\":[],\"transferable_insight\":\"Inlining fast-path evaluations and eliminating redundant bounds checks when input invariants guarantee safety reduces execution overhead without compromising correctness.\",\"domain_tags\":[\"Performance Optimization\",\"Algorithm Design\",\"Code Refactoring\"]}", "cost_usd": 0.12020250000000002, "bootstrap_seed": 0, "agent_model": "gemini-3.1-pro-preview", "held_out_score": null, "criterion_names": null, "per_criterion_scores": null, "failure_classification": null, "drafts_generated": 1, "drafts_survived": 1}
{"id": "2067ff74-8032-4e7c-902b-9cd19c315778", "target_id": "B3-control", "git_sha": "87d162da8ce171a4aada10b1bd31e058e1c747e5", "pre_experiment_sha": "315342560ebd8290e824b8ec748e4835152e01ba", "timestamp": "2026-04-21T03:43:40.718071+00:00", "hypothesis": "Inlining redundant local variables (`t_end_m1`, `s_end`) directly into O(1) string slices and safely eliminating the unnecessary empty string check (`t_end == i`) for `len_diff == 2` will further reduce bytecode execution overhead and improve the deterministic score without violating bounds check constraints.", "hypothesis_source": "agent", "mutation_diff_summary": "", "score": 9.22, "score_ci_lower": null, "score_ci_upper": null, "raw_scores": null, "baseline_score": 8.56, "outcome": "KEPT", "failure_mode": null, "duration_seconds": 264.19676075014286, "tags": ["unroll", "micro-optimization"], "learnings": "{\"what_changed\":\"\",\"what_improved\":[],\"what_regressed\":[],\"transferable_insight\":\"Inlining redundant intermediate variables directly into operations and removing provably unnecessary conditional checks reduces execution overhead and improves overall performance.\",\"domain_tags\":[\"Code Optimization\",\"Performance Tuning\",\"Refactoring\"]}", "cost_usd": 0.11898, "bootstrap_seed": 0, "agent_model": "gemini-3.1-pro-preview", "held_out_score": null, "criterion_names": null, "per_criterion_scores": null, "failure_classification": null, "drafts_generated": 1, "drafts_survived": 1}
{"id": "8ce68d5e-b0bf-4ead-8b72-4ce062e06077", "target_id": "B3-control", "git_sha": "caf27c61f90e85812bbecfd6228f62dd783fbc5d", "pre_experiment_sha": "87d162da8ce171a4aada10b1bd31e058e1c747e5", "timestamp": "2026-04-21T03:48:08.435517+00:00", "hypothesis": "Remove redundant `i == t_len` branch checks and combine `t_sub <= 1` distance appending logic to reduce dynamic branching, while strictly preserving `max_j` bounds checks for unequal-length strings and maintaining O(1) unrolled string slicing to minimize bytecode execution overhead.", "hypothesis_source": "agent", "mutation_diff_summary": "", "score": 8.26, "score_ci_lower": null, "score_ci_upper": null, "raw_scores": null, "baseline_score": 9.22, "outcome": "KEPT", "failure_mode": null, "duration_seconds": 261.7521422919817, "tags": ["micro-optimization", "branch-elimination", "string-slicing"], "learnings": "{\"what_changed\":\"\",\"what_improved\":[],\"what_regressed\":[],\"transferable_insight\":\"Eliminating redundant conditional branches and consolidating logic reduces execution overhead and improves performance, provided essential boundary validations are preserved.\",\"domain_tags\":[\"Performance Optimization\",\"Control Flow\",\"Algorithm Design\"]}", "cost_usd": 0.11460625, "bootstrap_seed": 0, "agent_model": "gemini-3.1-pro-preview", "held_out_score": null, "criterion_names": null, "per_criterion_scores": null, "failure_classification": null, "drafts_generated": 1, "drafts_survived": 1}
{"id": "a279e3ce-3f68-4fac-b56e-1e924070a82a", "target_id": "B3-control", "git_sha": "7338b8d05d9f1196fd70ad751bb8bb5070c08ecd", "pre_experiment_sha": "caf27c61f90e85812bbecfd6228f62dd783fbc5d", "timestamp": "2026-04-21T03:52:14.347800+00:00", "hypothesis": "Deferring the `a == b` exact match check until after the 4-character prefix check avoids redundant equality testing for strings that differ early, and replacing the inner `max_j > 3` branch with a simple `j > max_j` cap flattens the suffix matching logic, reducing branch overhead in the hot loop.", "hypothesis_source": "agent", "mutation_diff_summary": "", "score": 8.14, "score_ci_lower": null, "score_ci_upper": null, "raw_scores": null, "baseline_score": 8.26, "outcome": "KEPT", "failure_mode": null, "duration_seconds": 238.71206724992953, "tags": ["micro-optimization", "branch-prediction", "string-matching"], "learnings": "{\"what_changed\":\"\",\"what_improved\":[],\"what_regressed\":[],\"transferable_insight\":\"Deferring expensive full-evaluation checks until after quick partial checks and flattening nested conditional logic reduces redundant processing and branch prediction overhead in performance-critical loops.\",\"domain_tags\":[\"Performance Optimization\",\"Algorithm Design\",\"Control Flow\"]}", "cost_usd": 0.11266000000000001, "bootstrap_seed": 0, "agent_model": "gemini-3.1-pro-preview", "held_out_score": null, "criterion_names": null, "per_criterion_scores": null, "failure_classification": null, "drafts_generated": 1, "drafts_survived": 1}
{"id": "48c1e76a-0852-4695-b9bd-eaf813f515e7", "target_id": "B3-control", "git_sha": "fc7e6765a90e3679f6cfa91b2a0d49fe35dc9947", "pre_experiment_sha": "7338b8d05d9f1196fd70ad751bb8bb5070c08ecd", "timestamp": "2026-04-21T03:57:13.404288+00:00", "hypothesis": "Short-circuiting the prefix matching loop using its `else` block entirely eliminates the `i == t_len` branch and suffix matching overhead when one string is a prefix of the other, while inlining `ip1` and `s_m1` into O(1) string slices further reduces local variable overhead.", "hypothesis_source": "agent", "mutation_diff_summary": "", "score": 8.35, "score_ci_lower": null, "score_ci_upper": null, "raw_scores": null, "baseline_score": 8.14, "outcome": "KEPT", "failure_mode": null, "duration_seconds": 264.02658616681583, "tags": ["micro-optimization", "branch-elimination", "short-circuit", "string-slicing"], "learnings": "{\"what_changed\":\"\",\"what_improved\":[],\"what_regressed\":[],\"transferable_insight\":\"Leveraging loop control structures to bypass redundant post-loop checks and inlining intermediate variables into direct slice operations reduces branching and execution overhead.\",\"domain_tags\":[\"Performance Optimization\",\"Code Refactoring\",\"Algorithm Design\"]}", "cost_usd": 0.1112525, "bootstrap_seed": 0, "agent_model": "gemini-3.1-pro-preview", "held_out_score": null, "criterion_names": null, "per_criterion_scores": null, "failure_classification": null, "drafts_generated": 1, "drafts_survived": 1}
