{"id": "72b3f9ef-ea2a-4501-99c0-164e0064849d", "target_id": "B3-control", "git_sha": "36ba68b8e83a4911b4ca1257660a890595442bf4", "pre_experiment_sha": "36ba68b8e83a4911b4ca1257660a890595442bf4", "timestamp": "2026-04-18T23:38:01.039062+00:00", "hypothesis": "Precompute and reuse only the relevant non-empty length buckets so each source item avoids rescanning all bucket lengths.", "hypothesis_source": "agent", "mutation_diff_summary": "", "score": 94.56, "score_ci_lower": null, "score_ci_upper": null, "raw_scores": null, "baseline_score": 91.55, "outcome": "DISCARDED", "failure_mode": null, "duration_seconds": 31.184863374917768, "tags": ["performance", "deterministic", "conservative-refactor", "bucket-reuse"], "learnings": "{\"what_changed\":\"\",\"what_improved\":[],\"what_regressed\":[],\"transferable_insight\":\"Optimizations that precompute and reuse only the non-empty, relevant partitions of work can reduce repeated scanning overhead, but they should be validated against actual workload structure before adoption.\",\"domain_tags\":[\"optimization\",\"performance\",\"algorithm-design\"]}", "cost_usd": 0.08568300000000001, "bootstrap_seed": 0, "agent_model": "gpt-5.4", "held_out_score": null, "criterion_names": null, "per_criterion_scores": null, "failure_classification": {"category": "incomplete_edit", "description": "The experiment\u2019s failure mode is unspecified (\u201cunknown\u201d), which commonly indicates the change was only partially applied or left the system in an inconsistent state relative to the intended optimization (e.g., some buckets were not correctly precomputed/reused, or the reuse logic didn\u2019t fully replace the rescanning behavior).", "fix_direction": "Verify end-to-end that the implementation precomputes exactly the needed non-empty length buckets and that all call sites actually reuse those precomputed structures instead of falling back to rescanning; add checks/tests to ensure completeness and consistency of the cached bucket set.", "confidence": 0.46}, "drafts_generated": 1, "drafts_survived": 1}
{"id": "ec5638fe-3a5e-4aa0-a2a0-21b31963b754", "target_id": "B3-control", "git_sha": "36ba68b8e83a4911b4ca1257660a890595442bf4", "pre_experiment_sha": "36ba68b8e83a4911b4ca1257660a890595442bf4", "timestamp": "2026-04-18T23:38:34.253517+00:00", "hypothesis": "Reuse the precomputed non-empty length buckets by iterating only the relevant slice for each source length.", "hypothesis_source": "agent", "mutation_diff_summary": "", "score": 93.24, "score_ci_lower": null, "score_ci_upper": null, "raw_scores": null, "baseline_score": 91.55, "outcome": "DISCARDED", "failure_mode": null, "duration_seconds": 29.833238916937262, "tags": ["performance", "conservative", "buckets"], "learnings": "{\"what_changed\":\"\",\"what_improved\":[],\"what_regressed\":[],\"transferable_insight\":\"When an optimization only changes iteration structure without reducing the actual work performed, it is unlikely to produce measurable gains and may be safely discarded.\",\"domain_tags\":[\"optimization\",\"performance\",\"algorithm-design\"]}", "cost_usd": 0.0840706, "bootstrap_seed": 0, "agent_model": "gpt-5.4", "held_out_score": null, "criterion_names": null, "per_criterion_scores": null, "failure_classification": {"category": "logic_error", "description": "The attempt is intended to reuse precomputed length buckets by iterating only the relevant slice, but the result indicates the change likely computed or accessed the correct bucket boundaries incorrectly (wrong slice/indices), leading to incorrect behavior despite the optimization goal.", "fix_direction": "Verify bucket indexing/slicing logic (start/end offsets per source length), add targeted tests for boundary lengths, and confirm that the reused buckets match the original expected semantics for all lengths.", "confidence": 0.74}, "drafts_generated": 1, "drafts_survived": 1}
{"id": "39ae6970-2125-42ec-b8ed-b837ab519b0f", "target_id": "B3-control", "git_sha": "36ba68b8e83a4911b4ca1257660a890595442bf4", "pre_experiment_sha": "36ba68b8e83a4911b4ca1257660a890595442bf4", "timestamp": "2026-04-18T23:39:06.100890+00:00", "hypothesis": "Precompute and reuse the non-empty length buckets once, iterating them directly with only the existing length filter.", "hypothesis_source": "agent", "mutation_diff_summary": "", "score": 92.19, "score_ci_lower": null, "score_ci_upper": null, "raw_scores": null, "baseline_score": 91.55, "outcome": "DISCARDED", "failure_mode": null, "duration_seconds": 29.262031582999043, "tags": ["performance", "conservative-refactor", "bucket-reuse"], "learnings": "{\"what_changed\":\"\",\"what_improved\":[],\"what_regressed\":[],\"transferable_insight\":\"When an optimization adds precomputation but does not measurably improve outcomes or reveal clear tradeoffs, it is likely not worth adopting despite seeming structurally cleaner.\",\"domain_tags\":[\"optimization\",\"performance\",\"experimentation\"]}", "cost_usd": 0.0819782, "bootstrap_seed": 0, "agent_model": "gpt-5.4", "held_out_score": null, "criterion_names": null, "per_criterion_scores": null, "failure_classification": {"category": "incomplete_edit", "description": "The experiment aimed to precompute and reuse non-empty length buckets, but the failure mode is listed as unknown, suggesting the change may not have been completed or consistently applied, leaving an inconsistent or nonfunctional update relative to the intended iteration/filtering behavior.", "fix_direction": "Ensure the precomputed buckets are fully integrated with the existing length filter (no leftover assumptions), and add/verify unit tests that confirm correct bucket reuse and expected iteration results across both empty and non-empty bucket scenarios.", "confidence": 0.32}, "drafts_generated": 1, "drafts_survived": 1}
{"id": "1d75bd83-a3d9-4a98-82d7-1205fad03be6", "target_id": "B3-control", "git_sha": "36ba68b8e83a4911b4ca1257660a890595442bf4", "pre_experiment_sha": "36ba68b8e83a4911b4ca1257660a890595442bf4", "timestamp": "2026-04-18T23:39:45.627151+00:00", "hypothesis": "Precompute reusable non-empty candidate buckets by source length to avoid rescanning all bucket lengths for every source item.", "hypothesis_source": "agent", "mutation_diff_summary": "", "score": 92.47, "score_ci_lower": null, "score_ci_upper": null, "raw_scores": null, "baseline_score": 91.55, "outcome": "DISCARDED", "failure_mode": null, "duration_seconds": 34.72072504204698, "tags": ["performance", "deterministic", "conservative-refactor", "buckets"], "learnings": "{\"what_changed\":\"\",\"what_improved\":[],\"what_regressed\":[],\"transferable_insight\":\"Precomputing and reusing grouped candidates can reduce repeated search work, but only if the grouping actually eliminates enough redundant scanning to outweigh the added bookkeeping.\",\"domain_tags\":[\"optimization\",\"algorithm design\",\"performance engineering\"]}", "cost_usd": 0.0841622, "bootstrap_seed": 0, "agent_model": "gpt-5.4", "held_out_score": null, "criterion_names": null, "per_criterion_scores": null, "failure_classification": {"category": "incomplete_edit", "description": "The experiment did not achieve a well-defined success outcome (Failure Mode is listed as unknown), suggesting the change was incomplete or left inconsistent behavior despite the high score. This typically occurs when the intended precomputation/reuse logic was partially implemented (e.g., candidate bucket caching not fully wired through all call sites), resulting in unreliable or untracked failure conditions.", "fix_direction": "Ensure the precomputed non-empty candidate buckets are fully integrated across all relevant paths (no remaining rescans), add tests/telemetry to confirm the cache is populated and reused for every source item, and define/handle the failure mode explicitly with deterministic checks.", "confidence": 0.46}, "drafts_generated": 1, "drafts_survived": 1}
{"id": "8f38e973-24c8-49df-9ede-3f63a36f73bf", "target_id": "B3-control", "git_sha": "36ba68b8e83a4911b4ca1257660a890595442bf4", "pre_experiment_sha": "36ba68b8e83a4911b4ca1257660a890595442bf4", "timestamp": "2026-04-18T23:40:19.098367+00:00", "hypothesis": "Precompute and reuse the relevant non-empty length buckets once so the main loop avoids repeated bucket scans while preserving comparison order.", "hypothesis_source": "agent", "mutation_diff_summary": "", "score": 95.39, "score_ci_lower": null, "score_ci_upper": null, "raw_scores": null, "baseline_score": 91.55, "outcome": "DISCARDED", "failure_mode": null, "duration_seconds": 30.700973792001605, "tags": ["performance", "conservative", "bucketing", "deterministic"], "learnings": "{\"what_changed\":\"\",\"what_improved\":[],\"what_regressed\":[],\"transferable_insight\":\"When a repeated search over a fixed set is needed, precomputing the non-empty candidates once can reduce redundant work without changing the required processing order.\",\"domain_tags\":[\"performance-optimization\",\"algorithm-design\",\"caching\"]}", "cost_usd": 0.08347860000000001, "bootstrap_seed": 0, "agent_model": "gpt-5.4", "held_out_score": null, "criterion_names": null, "per_criterion_scores": null, "failure_classification": {"category": "logic_error", "description": "The failure is consistent with an incorrect implementation of the intended optimization: precomputing/reusing non-empty length buckets likely disrupted the required comparison order or mapping of bucket contents to elements, leading to incorrect results despite a high score signal.", "fix_direction": "Verify that bucket precomputation preserves the exact original iteration/comparison ordering; add targeted tests that compare against the baseline implementation for edge cases (empty buckets, boundary lengths, duplicates) and confirm the reused buckets are indexed/mapped correctly.", "confidence": 0.62}, "drafts_generated": 1, "drafts_survived": 1}
{"id": "87800f14-2ddd-40b2-a3de-d40528423b89", "target_id": "B3-control", "git_sha": "36ba68b8e83a4911b4ca1257660a890595442bf4", "pre_experiment_sha": "36ba68b8e83a4911b4ca1257660a890595442bf4", "timestamp": "2026-04-18T23:40:53.311274+00:00", "hypothesis": "Precompute and reuse only the non-empty relevant length buckets once to avoid per-item full bucket scans without changing comparison order.", "hypothesis_source": "agent", "mutation_diff_summary": "", "score": 92.96, "score_ci_lower": null, "score_ci_upper": null, "raw_scores": null, "baseline_score": 91.55, "outcome": "DISCARDED", "failure_mode": null, "duration_seconds": 31.779659209074453, "tags": ["performance", "deterministic", "conservative", "bucket-scan"], "learnings": "{\"what_changed\":\"\",\"what_improved\":[],\"what_regressed\":[],\"transferable_insight\":\"When optimizing repeated selection over grouped data, precomputing and reusing only the groups that can actually contribute can reduce unnecessary scanning while preserving the original ordering logic.\",\"domain_tags\":[\"optimization\",\"data-processing\",\"algorithm-design\"]}", "cost_usd": 0.08414340000000001, "bootstrap_seed": 0, "agent_model": "gpt-5.4", "held_out_score": null, "criterion_names": null, "per_criterion_scores": null, "failure_classification": {"category": "semantic_drift", "description": "The attempted optimization changes how bucket scanning is performed by precomputing/reusing only non-empty relevant length buckets. While this is intended to preserve comparison order, the failure indicates that the effective comparison set/order was not identical to the original full scan semantics, leading to different outcomes despite a high score.", "fix_direction": "Ensure precomputed bucket selection preserves the exact original iteration order and comparison inclusion criteria (including edge cases like empty buckets, boundary lengths, and ties). Add tests that compare full-scan vs precomputed-bucket results byte-for-byte or with strict ordering checks.", "confidence": 0.62}, "drafts_generated": 1, "drafts_survived": 1}
{"id": "8fc92486-e4fd-4b74-a58e-dcc856e5bfa3", "target_id": "B3-control", "git_sha": "c3b87c2b23815600bdc4dd82283b42275f0f5f8f", "pre_experiment_sha": "36ba68b8e83a4911b4ca1257660a890595442bf4", "timestamp": "2026-04-18T23:41:29.169639+00:00", "hypothesis": "Precompute and reuse the relevant non-empty length buckets so each source item avoids rescanning impossible bucket lengths.", "hypothesis_source": "agent", "mutation_diff_summary": "", "score": 92.47, "score_ci_lower": null, "score_ci_upper": null, "raw_scores": null, "baseline_score": 91.55, "outcome": "KEPT", "failure_mode": null, "duration_seconds": 30.781514500034973, "tags": ["performance", "deterministic", "conservative", "buckets"], "learnings": "{\"what_changed\":\"\",\"what_improved\":[],\"what_regressed\":[],\"transferable_insight\":\"Precomputing and reusing only the feasible options up front can eliminate repeated checks against impossible cases and improve efficiency without changing results.\",\"domain_tags\":[\"optimization\",\"precomputation\",\"efficiency\"]}", "cost_usd": 0.08395, "bootstrap_seed": 0, "agent_model": "gpt-5.4", "held_out_score": null, "criterion_names": null, "per_criterion_scores": null, "failure_classification": null, "drafts_generated": 1, "drafts_survived": 1}
{"id": "b7bfa410-916d-4540-91a8-b8dfc2586e6d", "target_id": "B3-control", "git_sha": "b8d8de85d5d42c13fa3b047e1461e893ca0aec65", "pre_experiment_sha": "c3b87c2b23815600bdc4dd82283b42275f0f5f8f", "timestamp": "2026-04-18T23:41:58.797504+00:00", "hypothesis": "Reuse the precomputed non-empty length buckets directly per source item and remove the redundant candidate-bucket cache build.", "hypothesis_source": "agent", "mutation_diff_summary": "", "score": 91.77, "score_ci_lower": null, "score_ci_upper": null, "raw_scores": null, "baseline_score": 92.47, "outcome": "KEPT", "failure_mode": null, "duration_seconds": 28.570791416917928, "tags": ["performance", "deterministic", "conservative-refactor"], "learnings": "{\"what_changed\":\"\",\"what_improved\":[],\"what_regressed\":[],\"transferable_insight\":\"When an existing precomputed grouping already provides the needed non-empty subsets, reusing it directly can simplify the pipeline without changing outcomes, but may not yield measurable gains if the removed step was not a bottleneck.\",\"domain_tags\":[\"optimization\",\"software-engineering\",\"performance\"]}", "cost_usd": 0.082875, "bootstrap_seed": 0, "agent_model": "gpt-5.4", "held_out_score": null, "criterion_names": null, "per_criterion_scores": null, "failure_classification": null, "drafts_generated": 1, "drafts_survived": 1}
{"id": "04c8f92d-4847-4f2e-8cd6-663b391cedf5", "target_id": "B3-control", "git_sha": "fe14b231e6e9fbfcd3e437d954e793641402c815", "pre_experiment_sha": "b8d8de85d5d42c13fa3b047e1461e893ca0aec65", "timestamp": "2026-04-18T23:42:29.034394+00:00", "hypothesis": "Reuse precomputed non-empty length buckets and their lengths in the main loop to avoid repeated per-item bucket scans while preserving comparison order.", "hypothesis_source": "agent", "mutation_diff_summary": "", "score": 91.15, "score_ci_lower": null, "score_ci_upper": null, "raw_scores": null, "baseline_score": 91.77, "outcome": "KEPT", "failure_mode": null, "duration_seconds": 29.153598250006326, "tags": ["performance", "conservative", "bucket-reuse", "deterministic"], "learnings": "{\"what_changed\":\"\",\"what_improved\":[],\"what_regressed\":[],\"transferable_insight\":\"Precompute and reuse invariant grouped metadata in the hot path to eliminate repeated scans without changing the original processing order.\",\"domain_tags\":[\"optimization\",\"performance\",\"algorithm-design\"]}", "cost_usd": 0.08203, "bootstrap_seed": 0, "agent_model": "gpt-5.4", "held_out_score": null, "criterion_names": null, "per_criterion_scores": null, "failure_classification": null, "drafts_generated": 1, "drafts_survived": 1}
{"id": "acf0570c-23d2-4e83-8595-7d98ed96cf8d", "target_id": "B3-control", "git_sha": "10b943070e1cc5d2aadee5707dd763495a0eb57b", "pre_experiment_sha": "fe14b231e6e9fbfcd3e437d954e793641402c815", "timestamp": "2026-04-18T23:43:02.527893+00:00", "hypothesis": "Precompute and reuse the relevant non-empty length buckets for list_b to avoid repeated full bucket scans per source item.", "hypothesis_source": "agent", "mutation_diff_summary": "", "score": 91.59, "score_ci_lower": null, "score_ci_upper": null, "raw_scores": null, "baseline_score": 91.15, "outcome": "KEPT", "failure_mode": null, "duration_seconds": 30.033992624958046, "tags": ["performance", "deterministic", "conservative-refactor"], "learnings": "{\"what_changed\":\"\",\"what_improved\":[],\"what_regressed\":[],\"transferable_insight\":\"Precomputing and reusing a compact set of relevant non-empty groups can reduce repeated full scans and improve efficiency when the same lookup pattern is applied many times.\",\"domain_tags\":[\"optimization\",\"precomputation\",\"data-structures\"]}", "cost_usd": 0.08326, "bootstrap_seed": 0, "agent_model": "gpt-5.4", "held_out_score": null, "criterion_names": null, "per_criterion_scores": null, "failure_classification": null, "drafts_generated": 1, "drafts_survived": 1}
{"id": "db0225da-6bce-4113-9a58-cb20a6c7386f", "target_id": "B3-control", "git_sha": "10b943070e1cc5d2aadee5707dd763495a0eb57b", "pre_experiment_sha": "10b943070e1cc5d2aadee5707dd763495a0eb57b", "timestamp": "2026-04-18T23:43:33.339980+00:00", "hypothesis": "Reuse the precomputed non-empty length buckets directly in the main loop and remove the redundant per-length bucket map construction.", "hypothesis_source": "agent", "mutation_diff_summary": "", "score": 93.17, "score_ci_lower": null, "score_ci_upper": null, "raw_scores": null, "baseline_score": 91.59, "outcome": "DISCARDED", "failure_mode": null, "duration_seconds": 29.91685937496368, "tags": ["performance", "conservative", "bucket-reuse", "deterministic"], "learnings": "{\"what_changed\":\"\",\"what_improved\":[],\"what_regressed\":[],\"transferable_insight\":\"When an existing precomputed grouping already captures the needed structure, reusing it directly can simplify the main path by eliminating redundant reconstruction work without changing behavior.\",\"domain_tags\":[\"optimization\",\"software-engineering\",\"performance\"]}", "cost_usd": 0.08262880000000002, "bootstrap_seed": 0, "agent_model": "gpt-5.4", "held_out_score": null, "criterion_names": null, "per_criterion_scores": null, "failure_classification": {"category": "incomplete_edit", "description": "The change appears to have been made conceptually (reuse precomputed length buckets), but the failure mode is unknown, suggesting the edit was only partially applied or left an inconsistent state\u2014e.g., missing updates to initialization/lookup logic in the main loop or mismatched assumptions about the precomputed bucket contents.", "fix_direction": "Verify the full control flow that builds and consumes the length buckets: ensure the precomputed bucket structure is used everywhere the per-length map was previously relied on, and that edge cases (empty buckets, missing lengths, off-by-one ranges) are handled identically to the prior implementation.", "confidence": 0.42}, "drafts_generated": 1, "drafts_survived": 1}
{"id": "3e4735d1-a3af-439e-b43b-d8a863a929ad", "target_id": "B3-control", "git_sha": "98850da8b0cc12dd08af8acb8543b52a382fd6f2", "pre_experiment_sha": "10b943070e1cc5d2aadee5707dd763495a0eb57b", "timestamp": "2026-04-18T23:44:07.479239+00:00", "hypothesis": "Remove the per-source precomputation of relevant buckets and reuse one precomputed ordered non-empty bucket list with the same length-based filtering.", "hypothesis_source": "agent", "mutation_diff_summary": "", "score": 92.96, "score_ci_lower": null, "score_ci_upper": null, "raw_scores": null, "baseline_score": 91.59, "outcome": "KEPT", "failure_mode": null, "duration_seconds": 31.034186167060398, "tags": ["performance", "conservative", "bucket-reuse", "deterministic"], "learnings": "{\"what_changed\":\"\",\"what_improved\":[],\"what_regressed\":[],\"transferable_insight\":\"When multiple inputs share the same structural constraints, precomputing a single reusable ordered candidate set and applying lightweight per-input filtering can preserve performance while reducing redundant work.\",\"domain_tags\":[\"optimization\",\"precomputation\",\"reuse\"]}", "cost_usd": 0.08255000000000001, "bootstrap_seed": 0, "agent_model": "gpt-5.4", "held_out_score": null, "criterion_names": null, "per_criterion_scores": null, "failure_classification": null, "drafts_generated": 1, "drafts_survived": 1}
{"id": "0635ee9b-d4e4-49be-a7f5-2aa9e27e36f2", "target_id": "B3-control", "git_sha": "67b258bba3b7fe834acbfd7691a0f132f618c4e1", "pre_experiment_sha": "98850da8b0cc12dd08af8acb8543b52a382fd6f2", "timestamp": "2026-04-18T23:44:42.696101+00:00", "hypothesis": "Precompute and reuse only the relevant non-empty length buckets so each source item avoids rescanning bucket lengths.", "hypothesis_source": "agent", "mutation_diff_summary": "", "score": 92.12, "score_ci_lower": null, "score_ci_upper": null, "raw_scores": null, "baseline_score": 92.96, "outcome": "KEPT", "failure_mode": null, "duration_seconds": 31.846752666984685, "tags": ["performance", "deterministic", "conservative-refactor", "bucket-reuse"], "learnings": "{\"what_changed\":\"\",\"what_improved\":[],\"what_regressed\":[],\"transferable_insight\":\"Precomputing and reusing only the non-empty partitions of work can eliminate repeated scans and reduce unnecessary iteration overhead.\",\"domain_tags\":[\"optimization\",\"algorithm-design\",\"performance\"]}", "cost_usd": 0.08311, "bootstrap_seed": 0, "agent_model": "gpt-5.4", "held_out_score": null, "criterion_names": null, "per_criterion_scores": null, "failure_classification": null, "drafts_generated": 1, "drafts_survived": 1}
