{"id": "1aab9a21-0f85-4a67-a90e-b5cdcb6494cf", "target_id": "B3-control", "git_sha": "b623d1c15ccb097dfecd91ca9f07b71c1a8b42ac", "pre_experiment_sha": "67b258bba3b7fe834acbfd7691a0f132f618c4e1", "timestamp": "2026-04-18T23:45:13.659010+00:00", "hypothesis": "Remove the per-source candidate-bucket cache and iterate directly over one precomputed non-empty bucket list with the same order and length filtering.", "hypothesis_source": "agent", "mutation_diff_summary": "", "score": 92.09, "score_ci_lower": null, "score_ci_upper": null, "raw_scores": null, "baseline_score": 92.12, "outcome": "KEPT", "failure_mode": null, "duration_seconds": 29.97642520791851, "tags": ["performance", "conservative", "buckets", "deterministic"], "learnings": "{\"what_changed\":\"\",\"what_improved\":[],\"what_regressed\":[],\"transferable_insight\":\"When a cache only mirrors a precomputed list and does not change ordering or filtering, removing it can simplify the implementation without materially affecting results.\",\"domain_tags\":[\"optimization\",\"software-engineering\"]}", "cost_usd": 0.081945, "bootstrap_seed": 0, "agent_model": "gpt-5.4", "held_out_score": null, "criterion_names": null, "per_criterion_scores": null, "failure_classification": null, "drafts_generated": 1, "drafts_survived": 1}
