{"id": "ac873e61-3a2c-4673-92e2-58bf9997a77c", "target_id": "B3-control", "git_sha": "ecb0760524cf287e1ae1f906fee3ef6c48ee7365", "pre_experiment_sha": "5fc6ff846095d42aced65fc3181e4192886dabbe", "timestamp": "2026-04-21T01:35:50.083846+00:00", "hypothesis": "To improve performance, I will optimize the Levenshtein distance calculation to avoid redundant list allocations, skip comparing strings with a length difference greater than the threshold by bucketing `list_b` by string length, and use an $O(1)$ `set` lookup instead of an $O(N)$ list scan for deduplication.", "hypothesis_source": "agent", "mutation_diff_summary": "", "score": 318.12, "score_ci_lower": null, "score_ci_upper": null, "raw_scores": null, "baseline_score": 464.0, "outcome": "KEPT", "failure_mode": null, "duration_seconds": 105.88120220904239, "tags": ["performance", "algorithms", "dynamic-programming", "optimization"], "learnings": "{\"what_changed\":\"\",\"what_improved\":[],\"what_regressed\":[],\"transferable_insight\":\"Computational efficiency can be significantly improved by replacing linear scans with constant-time lookups, eliminating redundant memory allocations, and pruning impossible comparisons based on known constraints.\",\"domain_tags\":[\"Algorithm Optimization\",\"Data Structures\",\"Performance Engineering\"]}", "cost_usd": 0.036251250000000006, "bootstrap_seed": 0, "agent_model": "gemini-3.1-pro-preview", "held_out_score": null, "criterion_names": null, "per_criterion_scores": null, "failure_classification": null, "drafts_generated": 1, "drafts_survived": 1}
{"id": "edaa4640-7f30-4d25-9d55-a7abb5830d7c", "target_id": "B3-control", "git_sha": "b31e99e5e0a0f36111a726eb0eae20b42d075a4b", "pre_experiment_sha": "ecb0760524cf287e1ae1f906fee3ef6c48ee7365", "timestamp": "2026-04-21T01:38:59.910760+00:00", "hypothesis": "Optimize `_levenshtein` by using a 1D array with in-place updates, unrolling the minimum cost calculation, and adding an early exit when the row minimum exceeds the threshold. Additionally, optimize `_find_close_pairs` by deduplicating input lists first to avoid redundant distance calculations.", "hypothesis_source": "agent", "mutation_diff_summary": "", "score": 93.96, "score_ci_lower": null, "score_ci_upper": null, "raw_scores": null, "baseline_score": 318.12, "outcome": "KEPT", "failure_mode": null, "duration_seconds": 182.45316695910878, "tags": ["performance", "algorithmic", "early-exit", "memory-optimization"], "learnings": "{\"what_changed\":\"\",\"what_improved\":[],\"what_regressed\":[],\"transferable_insight\":\"Combining high-level algorithmic pruning, such as input deduplication and early-exit thresholds, with low-level memory and execution optimizations like 1D arrays and loop unrolling, maximizes computational efficiency.\",\"domain_tags\":[\"Performance Optimization\",\"Algorithm Design\",\"Memory Management\"]}", "cost_usd": 0.03719625, "bootstrap_seed": 0, "agent_model": "gemini-3.1-pro-preview", "held_out_score": null, "criterion_names": null, "per_criterion_scores": null, "failure_classification": null, "drafts_generated": 1, "drafts_survived": 1}
{"id": "6b926392-2fcb-4fbd-b399-e163644ebbf6", "target_id": "B3-control", "git_sha": "76cfc6b7d53f57172023125c4d0a2ea60f24afdd", "pre_experiment_sha": "b31e99e5e0a0f36111a726eb0eae20b42d075a4b", "timestamp": "2026-04-21T01:42:37.574301+00:00", "hypothesis": "By stripping common prefixes and suffixes, optimizing the Levenshtein matrix calculation, and heavily inlining the distance logic to avoid function call overhead, we can dramatically reduce the instruction count and execution time.", "hypothesis_source": "agent", "mutation_diff_summary": "", "score": 91.07, "score_ci_lower": null, "score_ci_upper": null, "raw_scores": null, "baseline_score": 93.96, "outcome": "KEPT", "failure_mode": null, "duration_seconds": 209.45918187499046, "tags": ["algorithm-optimization", "inlining", "string-processing", "fast-path"], "learnings": "{\"what_changed\":\"\",\"what_improved\":[],\"what_regressed\":[],\"transferable_insight\":\"Reducing the computational search space by stripping common elements and minimizing function call overhead significantly improves algorithmic efficiency and execution speed.\",\"domain_tags\":[\"Algorithm Optimization\",\"Performance Engineering\",\"Computational Efficiency\"]}", "cost_usd": 0.0432825, "bootstrap_seed": 0, "agent_model": "gemini-3.1-pro-preview", "held_out_score": null, "criterion_names": null, "per_criterion_scores": null, "failure_classification": null, "drafts_generated": 1, "drafts_survived": 1}
{"id": "ed4c1054-5e3b-45bb-a4dc-49823321880d", "target_id": "B3-control", "git_sha": "76cfc6b7d53f57172023125c4d0a2ea60f24afdd", "pre_experiment_sha": "76cfc6b7d53f57172023125c4d0a2ea60f24afdd", "timestamp": "2026-04-21T01:46:19.268762+00:00", "hypothesis": "Optimize Levenshtein distance by pre-allocating the DP array, eliminating redundant pair deduplication, streamlining prefix/suffix stripping loops, and reducing array accesses during the minimum cost calculations.", "hypothesis_source": "agent", "mutation_diff_summary": "", "score": 93.4, "score_ci_lower": null, "score_ci_upper": null, "raw_scores": null, "baseline_score": 91.07, "outcome": "DISCARDED", "failure_mode": null, "duration_seconds": 201.07423437503166, "tags": ["performance", "algorithm", "dynamic-programming", "loops"], "learnings": "{\"what_changed\":\"\",\"what_improved\":[],\"what_regressed\":[],\"transferable_insight\":\"Simultaneously applying multiple micro-optimizations to a core process can introduce unexpected overhead and degrade overall performance rather than improving it.\",\"domain_tags\":[\"Performance Tuning\",\"Algorithm Optimization\",\"Micro-optimization\"]}", "cost_usd": 0.044727050000000004, "bootstrap_seed": 0, "agent_model": "gemini-3.1-pro-preview", "held_out_score": null, "criterion_names": null, "per_criterion_scores": null, "failure_classification": {"category": "regression", "description": "The experiment aimed to optimize Levenshtein distance calculation through several performance-focused modifications (DP array pre-allocation, deduplication, loop streamlining, reduced array accesses). However, the resulting score of 93.4 indicates a degradation in either correctness or performance compared to a baseline or previous state, rather than an improvement. The specific technical reason for this regression is unknown.", "fix_direction": "Investigate the implemented changes by debugging and profiling to identify which specific modification (or combination of modifications) led to the score degradation. Validate the correctness of the new implementation with a comprehensive test suite and compare its performance against the original un-optimized version to pinpoint the cause of the regression.", "confidence": 0.9}, "drafts_generated": 1, "drafts_survived": 1}
{"id": "97f2b772-e3a7-466f-983e-6d782425689d", "target_id": "B3-control", "git_sha": "d0d154b8e477b664e23add1065d0d1c100255a6a", "pre_experiment_sha": "76cfc6b7d53f57172023125c4d0a2ea60f24afdd", "timestamp": "2026-04-21T01:51:25.786591+00:00", "hypothesis": "Optimize `_find_close_pairs` and `_levenshtein` by mathematically unrolling Levenshtein distance calculations for `threshold=2` using $O(1)$ string slices after stripping common prefixes and suffixes, completely eliminating dynamic programming allocations and loops for the target threshold.", "hypothesis_source": "agent", "mutation_diff_summary": "", "score": 16.73, "score_ci_lower": null, "score_ci_upper": null, "raw_scores": null, "baseline_score": 91.07, "outcome": "KEPT", "failure_mode": null, "duration_seconds": 284.8590890420601, "tags": ["algorithm", "string-matching", "micro-optimization", "early-exit"], "learnings": "{\"what_changed\":\"\",\"what_improved\":[],\"what_regressed\":[],\"transferable_insight\":\"Replacing generalized dynamic programming algorithms with unrolled, constant-time conditional checks for small, fixed thresholds eliminates loop and memory allocation overhead, significantly improving performance.\",\"domain_tags\":[\"Algorithm Optimization\",\"Performance Engineering\",\"Dynamic Programming\"]}", "cost_usd": 0.05316250000000001, "bootstrap_seed": 0, "agent_model": "gemini-3.1-pro-preview", "held_out_score": null, "criterion_names": null, "per_criterion_scores": null, "failure_classification": null, "drafts_generated": 1, "drafts_survived": 1}
{"id": "9073456d-7ead-42bf-9b35-e59d081b5c7f", "target_id": "B3-control", "git_sha": "14e85281bb18f4850f7362cf2f221f4b0d941d9b", "pre_experiment_sha": "d0d154b8e477b664e23add1065d0d1c100255a6a", "timestamp": "2026-04-21T01:56:15.051015+00:00", "hypothesis": "By unrolling the first character comparisons for common prefix/suffix detection and rewriting the `threshold == 2` logic to use highly optimized string slicing and equality checks instead of dynamic programming, we can drastically reduce loop overhead and Python bytecode instructions in the hot path.", "hypothesis_source": "agent", "mutation_diff_summary": "", "score": 12.64, "score_ci_lower": null, "score_ci_upper": null, "raw_scores": null, "baseline_score": 16.73, "outcome": "KEPT", "failure_mode": null, "duration_seconds": 281.0525422920473, "tags": ["string-matching", "loop-unrolling", "algorithm-optimization", "inline-functions"], "learnings": "{\"what_changed\":\"\",\"what_improved\":[],\"what_regressed\":[],\"transferable_insight\":\"Replacing complex, generalized algorithms with native, optimized operations for specific edge cases significantly reduces execution overhead and improves performance.\",\"domain_tags\":[\"Performance Optimization\",\"Algorithm Design\",\"Code Optimization\"]}", "cost_usd": 0.053660000000000006, "bootstrap_seed": 0, "agent_model": "gemini-3.1-pro-preview", "held_out_score": null, "criterion_names": null, "per_criterion_scores": null, "failure_classification": null, "drafts_generated": 1, "drafts_survived": 1}
{"id": "92cfba36-865a-4b01-a871-d73ecfc9c225", "target_id": "B3-control", "git_sha": "14e85281bb18f4850f7362cf2f221f4b0d941d9b", "pre_experiment_sha": "14e85281bb18f4850f7362cf2f221f4b0d941d9b", "timestamp": "2026-04-21T02:00:02.405920+00:00", "hypothesis": "Replace dictionary lookups with O(1) list indexing by length, and unroll the `while` loops for prefix/suffix matching into highly efficient C-backed `for` loops, minimizing Python bytecode execution overhead.", "hypothesis_source": "agent", "mutation_diff_summary": "", "score": 13.53, "score_ci_lower": null, "score_ci_upper": null, "raw_scores": null, "baseline_score": 12.64, "outcome": "DISCARDED", "failure_mode": null, "duration_seconds": 205.2258461250458, "tags": ["performance", "loop-unrolling", "data-structures"], "learnings": "{\"what_changed\":\"\",\"what_improved\":[],\"what_regressed\":[],\"transferable_insight\":\"Attempting to bypass high-level language interpreter overhead through manual micro-optimizations, such as loop unrolling and strict index-based lookups, often fails to yield practical performance benefits.\",\"domain_tags\":[\"Performance Optimization\",\"Software Engineering\"]}", "cost_usd": 0.054781300000000005, "bootstrap_seed": 0, "agent_model": "gemini-3.1-pro-preview", "held_out_score": null, "criterion_names": null, "per_criterion_scores": null, "failure_classification": {"category": "logic_error", "description": "The fundamental premise or implementation details of the optimization likely contained flaws. For the 'O(1) list indexing by length,' while theoretically faster for group access, it might not provide end-to-end O(1) for individual string lookups if multiple strings share the same length, requiring a secondary search. This could introduce more overhead than a well-optimized dictionary, or lead to excessive memory consumption for sparse length distributions. For the 'C-backed loops,' the implementation might have introduced bugs, incurred significant Python-C marshalling overhead, or the C code itself might not have been as efficient as anticipated, ultimately degrading performance or producing incorrect results, which manifests as a poor score rather than a crash.", "fix_direction": "Re-evaluate the initial performance assumptions with concrete data and profiling of the existing system. Specifically, analyze string length distributions and access patterns to validate the 'O(1) list indexing' concept. Isolate and rigorously benchmark the C-backed components, ensuring correctness and actual performance gains before full integration. Consider the overhead of Python-C communication. An incremental approach with frequent testing for both correctness and performance would be beneficial.", "confidence": 0.9}, "drafts_generated": 1, "drafts_survived": 1}
{"id": "af80629d-9158-47c2-9cf4-7aac9f439222", "target_id": "B3-control", "git_sha": "bd118442af4e8659a1a2bc5410d01451ac14bcac", "pre_experiment_sha": "14e85281bb18f4850f7362cf2f221f4b0d941d9b", "timestamp": "2026-04-21T02:04:55.478103+00:00", "hypothesis": "Optimized pair finding by unrolling common prefix/suffix loops, bucketing by string length in a pre-allocated array, and completely replacing Levenshtein dynamic programming with O(1) mathematical string slicing for threshold=2.", "hypothesis_source": "agent", "mutation_diff_summary": "", "score": 11.39, "score_ci_lower": null, "score_ci_upper": null, "raw_scores": null, "baseline_score": 12.64, "outcome": "KEPT", "failure_mode": null, "duration_seconds": 268.80023333313875, "tags": ["string-matching", "loop-unrolling", "algorithmic-simplification", "dp-elimination"], "learnings": "{\"what_changed\":\"\",\"what_improved\":[],\"what_regressed\":[],\"transferable_insight\":\"Replacing general-purpose algorithms with specialized, constant-time operations for tightly constrained cases, combined with memory pre-allocation and loop unrolling, significantly improves computational efficiency.\",\"domain_tags\":[\"Algorithm Optimization\",\"Performance Engineering\",\"Memory Management\"]}", "cost_usd": 0.0646975, "bootstrap_seed": 0, "agent_model": "gemini-3.1-pro-preview", "held_out_score": null, "criterion_names": null, "per_criterion_scores": null, "failure_classification": null, "drafts_generated": 1, "drafts_survived": 1}
{"id": "1d256b81-6bc2-4035-9cf3-7636ad0c6e82", "target_id": "B3-control", "git_sha": "27bbc60f27896d1b529d9526a2eb50bd39057314", "pre_experiment_sha": "bd118442af4e8659a1a2bc5410d01451ac14bcac", "timestamp": "2026-04-21T02:09:35.157400+00:00", "hypothesis": "Flatten the inner loops by specializing for specific length differences (`len_diff` \u2208 {-2, -1, 0, 1, 2}) to completely eliminate dynamic branching and loop overhead during O(1) string slicing checks.", "hypothesis_source": "agent", "mutation_diff_summary": "", "score": 10.63, "score_ci_lower": null, "score_ci_upper": null, "raw_scores": null, "baseline_score": 11.39, "outcome": "KEPT", "failure_mode": null, "duration_seconds": 269.12812112481333, "tags": ["loop-unrolling", "string-slicing", "branch-elimination"], "learnings": "{\"what_changed\":\"\",\"what_improved\":[],\"what_regressed\":[],\"transferable_insight\":\"Replacing dynamic loops with specialized, hardcoded execution paths for a small set of known input variations eliminates branching overhead and improves performance.\",\"domain_tags\":[\"Performance Optimization\",\"Loop Unrolling\",\"Code Specialization\"]}", "cost_usd": 0.08808000000000002, "bootstrap_seed": 0, "agent_model": "gemini-3.1-pro-preview", "held_out_score": null, "criterion_names": null, "per_criterion_scores": null, "failure_classification": null, "drafts_generated": 1, "drafts_survived": 1}
{"id": "f40c93c6-d55b-4333-82b2-dfda2fba90b1", "target_id": "B3-control", "git_sha": "27bbc60f27896d1b529d9526a2eb50bd39057314", "pre_experiment_sha": "27bbc60f27896d1b529d9526a2eb50bd39057314", "timestamp": "2026-04-21T02:14:52.882312+00:00", "hypothesis": "No hypothesis provided", "hypothesis_source": "synthesized", "mutation_diff_summary": "", "score": 13.31, "score_ci_lower": null, "score_ci_upper": null, "raw_scores": null, "baseline_score": 10.63, "outcome": "DISCARDED", "failure_mode": null, "duration_seconds": 292.8676740829833, "tags": [], "learnings": "{\"what_changed\":\"\",\"what_improved\":[],\"what_regressed\":[],\"transferable_insight\":\"Executing changes without a defined hypothesis or clear success criteria prevents meaningful evaluation, often resulting in the discard of the experiment regardless of metric shifts.\",\"domain_tags\":[\"Experimentation\",\"Process Management\"]}", "cost_usd": 0.07734965, "bootstrap_seed": 0, "agent_model": "gemini-3.1-pro-preview", "held_out_score": null, "criterion_names": null, "per_criterion_scores": null, "failure_classification": {"category": "incomplete_edit", "description": "The absence of a clear hypothesis for the experiment suggests a lack of defined scope or success criteria. This often leads to an incomplete or inconsistent set of changes, leaving the system in an undefined state and resulting in a failure whose specific nature cannot be readily identified ('unknown failure mode').", "fix_direction": "Before starting any experiment, define a clear hypothesis, specific goals, and success criteria. Ensure all planned modifications are fully implemented and verified, establishing a clear definition of 'done' to prevent incomplete edits.", "confidence": 0.65}, "drafts_generated": 1, "drafts_survived": 1}
{"id": "88da5011-29f3-495f-84b6-2ca8307802c8", "target_id": "B3-control", "git_sha": "27bbc60f27896d1b529d9526a2eb50bd39057314", "pre_experiment_sha": "27bbc60f27896d1b529d9526a2eb50bd39057314", "timestamp": "2026-04-21T02:19:51.058467+00:00", "hypothesis": "Remove bounds checks in the inner prefix/suffix matching loops by leveraging prior length and exact-match checks, and hoist the `len > 3` check outside the inner loops to minimize dynamic branching overhead.", "hypothesis_source": "agent", "mutation_diff_summary": "", "score": 13.19, "score_ci_lower": null, "score_ci_upper": null, "raw_scores": null, "baseline_score": 10.63, "outcome": "DISCARDED", "failure_mode": null, "duration_seconds": 276.7465873749461, "tags": ["micro-optimization", "loop-unrolling", "string-slicing"], "learnings": "{\"what_changed\":\"\",\"what_improved\":[],\"what_regressed\":[],\"transferable_insight\":\"Manually micro-optimizing loop bounds and hoisting conditions to reduce branching overhead can degrade performance by interfering with the compiler's built-in optimization heuristics.\",\"domain_tags\":[\"Micro-optimization\",\"Compiler Optimization\",\"Performance Engineering\"]}", "cost_usd": 0.09709515, "bootstrap_seed": 0, "agent_model": "gemini-3.1-pro-preview", "held_out_score": null, "criterion_names": null, "per_criterion_scores": null, "failure_classification": {"category": "logic_error", "description": "The experiment's attempt to remove bounds checks by 'leveraging prior length and exact-match checks' likely introduced a flaw in the memory access logic. This could have led to out-of-bounds reads or writes under certain conditions (e.g., specific string lengths or edge cases not fully covered by the 'prior checks'). Such errors often manifest as crashes, incorrect results, or subtle data corruption, leading to an 'unknown' failure mode and a specific error score (13.1900) rather than a clear performance metric or syntax issue.", "fix_direction": "Thoroughly re-evaluate the logical conditions assumed to guarantee safety after bounds check removal. Implement extensive unit and integration tests specifically targeting edge cases related to string lengths (e.g., 0, 1, 2, 3, 4, max length) and various inputs. Utilize memory debugging tools (like Valgrind) to detect any out-of-bounds accesses and ensure the 'prior checks' are indeed sufficient for all scenarios. If the performance gain is critical, consider compile-time assertions or using `unsafe` blocks with extreme caution and verification.", "confidence": 0.9}, "drafts_generated": 1, "drafts_survived": 1}
{"id": "8ed321f1-755a-42f8-8ef6-762d4933d6d2", "target_id": "B3-control", "git_sha": "5579821b9d7df0b9dbdac6018f7af949bff6c5ff", "pre_experiment_sha": "27bbc60f27896d1b529d9526a2eb50bd39057314", "timestamp": "2026-04-21T02:30:19.724315+00:00", "hypothesis": "Bucket both `A` and `B` lists by string length to hoist bounds checks and list lookups, and safely remove redundant loop bounds checks in prefix/suffix matching for equal-length strings.", "hypothesis_source": "agent", "mutation_diff_summary": "", "score": 10.01, "score_ci_lower": null, "score_ci_upper": null, "raw_scores": null, "baseline_score": 10.63, "outcome": "KEPT", "failure_mode": null, "duration_seconds": 278.1422103338409, "tags": ["micro-optimization", "unrolling", "string-slicing", "array-allocation"], "learnings": "{\"what_changed\":\"\",\"what_improved\":[],\"what_regressed\":[],\"transferable_insight\":\"Grouping data by a common structural attribute, such as length or size, optimizes iterative processing by enabling the safe removal of redundant boundary checks and lookups.\",\"domain_tags\":[\"Algorithm Optimization\",\"Performance Tuning\",\"Data Processing\"]}", "cost_usd": 0.09336125, "bootstrap_seed": 0, "agent_model": "gemini-3.1-pro-preview", "held_out_score": null, "criterion_names": null, "per_criterion_scores": null, "failure_classification": null, "drafts_generated": 1, "drafts_survived": 1}
