{"id": "ef7fbc43-ea90-4f5b-97de-e05596863fdc", "target_id": "B3-greedy", "git_sha": "1b026d3e5808e1fd64156f24d1bdd246227c1c85", "pre_experiment_sha": "1b026d3e5808e1fd64156f24d1bdd246227c1c85", "timestamp": "2026-04-20T23:31:01.592346+00:00", "hypothesis": "Replace `defaultdict` with a standard dictionary for faster length-based grouping, and short-circuit identical strings in the pair-finding loop to avoid function call overhead.", "hypothesis_source": "agent", "mutation_diff_summary": "", "score": 83.79, "score_ci_lower": null, "score_ci_upper": null, "raw_scores": null, "baseline_score": 81.92, "outcome": "DISCARDED", "failure_mode": null, "duration_seconds": 145.22008862509392, "tags": ["dict-optimization", "short-circuit\n\n```python\nfrom __future__ import annotations\n\nimport time\n\n_NAMES_A: list[str] = [\n    \"alice\"", "\"alexander\"", "\"alicia\"", "\"alison\"", "\"alicia\"", "\"benjamin\"", "\"bennett\"", "\"beatrice\"", "\"bernadette\"", "\"blake\"", "\"catherine\"", "\"carolina\"", "\"cassandra\"", "\"cecilia\"", "\"celeste\"", "\"daniel\"", "\"danielle\"", "\"darius\"", "\"darwin\"", "\"davina\"", "\"eleanor\"", "\"elizabeth\"", "\"elliot\"", "\"eloise\"", "\"elvira\"", "\"franklin\"", "\"francesca\"", "\"frederica\"", "\"felicity\"", "\"flora\"", "\"gabriel\"", "\"gabriella\"", "\"genevieve\"", "\"georgia\"", "\"geraldine\"", "\"harriet\"", "\"harrison\"", "\"hayden\"", "\"helena\"", "\"henrietta\"", "\"isabella\"", "\"isadora\"", "\"isidore\"", "\"isolde\"", "\"imelda\"", "\"jasper\"", "\"jacqueline\"", "\"janelle\"", "\"jarvis\"", "\"jessamine\"", "\"katherine\"", "\"katrina\"", "\"kendall\"", "\"kennedy\"", "\"kieran\"", "\"laurence\"", "\"lavinia\"", "\"lazarus\"", "\"leander\"", "\"leonora\"", "\"margaret\"", "\"marianne\"", "\"marlowe\"", "\"mathilda\"", "\"maximiliana\"", "\"nathaniel\"", "\"natasha\"", "\"neil\"", "\"nelson\"", "\"nerissa\"", "\"octavia\"", "\"oliver\"", "\"olympia\"", "\"ophelia\"", "\"orion\"", "\"penelope\"", "\"percival\"", "\"persephone\"", "\"petra\"", "\"philippa\"", "\"quinton\"", "\"quintessa\"", "\"quincey\"", "\"queenie\"", "\"quentin\"", "\"rosalind\"", "\"rosalinda\"", "\"rosamund\"", "\"rowena\"", "\"roxanne\"", "\"sebastian\"", "\"seraphina\"", "\"sigrid\"", "\"silvana\"", "\"solomon\"", "\"theodore\"", "\"theodosia\"", "\"thomas\"", "\"thomasina\"", "\"titania\"", "\"ulysses\"", "\"una\"", "\"uriah\"", "\"ursula\"", "\"umberto\"", "\"valentina\"", "\"valerian\"", "\"vera\"", "\"veronica\"", "\"victoria\"", "\"wilhelmina\"", "\"winifred\"", "\"winston\"", "\"wren\"", "\"wyatt\"", "\"xavier\"", "\"xena\"", "\"xerxes\"", "\"xiomara\"", "\"xochitl\"", "\"yolanda\"", "\"yolande\"", "\"yorick\"", "\"yvette\"", "\"yvonne\"", "\"zacharias\"", "\"zelda\"", "\"zenobia\"", "\"zephyr\"", "\"zinnia\"", "\"adriana\"", "\"adrienne\"", "\"agatha\"", "\"agnes\"", "\"aigerim\"", "\"barnabas\"", "\"bartholomew\"", "\"basil\"", "\"beckett\"", "\"belinda\"", "\"calista\"", "\"calliope\"", "\"camellia\"", "\"camille\"", "\"candida\"", "\"damaris\"", "\"damian\"", "\"daphne\"", "\"deidre\"", "\"delilah\"", "\"ebenezer\"", "\"edith\"", "\"edwina\"", "\"effie\"", "\"eglantine\"", "\"fabian\"", "\"faith\"", "\"fantine\"", "\"faye\"", "\"felicia\"", "\"galatea\"", "\"gareth\"", "\"gawain\"", "\"gemma\"", "\"gideon\"", "\"hector\"", "\"hedwig\"", "\"heloise\"", "\"hester\"", "\"hildegard\"", "\"ignatius\"", "\"ines\"", "\"ingrid\"", "\"irene\"", "\"iris\"", "\"jacob\"", "\"jocasta\"", "\"jocelyn\"", "\"joel\"", "\"johanna\"", "\"krista\"", "\"kristopher\"", "\"kyle\"", "\"kylie\"", "\"kyra\"", "\"lancelot\"", "\"lara\"", "\"lars\"", "\"latasha\"", "\"layla\"", "\"mackenzie\"", "\"madeline\"", "\"magnus\"", "\"malachi\"", "\"malone\"", "\"naomi\"", "\"narcissa\"", "\"nadia\"", "\"nigel\"", "\"niobe\"", "\"orlanda\"", "\"oswald\"", "\"ottilia\"", "\"owain\"", "\"ozymandias\"", "\"paloma\"", "\"pamela\"", "\"pandora\"", "\"pascal\"", "\"patience\"", "\"raffael\"", "\"ramona\"", "\"randolph\"", "\"raphaela\"", "\"reginald\"", "\"sabrina\"", "\"sacheverell\"", "\"salome\"", "\"samantha\"", "\"sapphire\"", "\"tabitha\"", "\"talitha\"", "\"tamsin\"", "\"tarquin\"", "\"tessa\"", "\"ulrika\"", "\"undine\"", "\"upton\"", "\"urbane\"", "\"urien\"", "\"violetta\"", "\"virginia\"", "\"vivian\"", "\"vivienne\"", "\"voss\"", "\"warwick\"", "\"wendell\"", "\"wendy\"", "\"wilbur\"", "\"wilfred\"", "]\n\n_NAMES_B: list[str] = [\n    \"alyce\"", "\"alexender\"", "\"alecia\"", "\"allison\"", "\"alisha\"", "\"benjamine\"", "\"bennet\"", "\"beatrix\"", "\"bernadett\"", "\"blaise\"", "\"catharine\"", "\"karoline\"", "\"kassandra\"", "\"cecilya\"", "\"celest\"", "\"danyal\"", "\"daniele\"", "\"daryus\"", "\"darwinn\"", "\"davena\"", "\"elenor\"", "\"elizebeth\"", "\"eliott\"", "\"elois\"", "\"elveera\"", "\"franklyn\"", "\"fransesca\"", "\"frederika\"", "\"felicite\"", "\"flora\"", "\"gabriell\"", "\"gabriela\"", "\"geneviv\"", "\"georgea\"", "\"geraldyne\"", "\"harriett\"", "\"harryson\"", "\"haydn\"", "\"heleena\"", "\"henryetta\"", "\"izabella\"", "\"isadore\"", "\"isidor\"", "\"isold\"", "\"imelda\"", "\"gasper\"", "\"jackline\"", "\"janell\"", "\"jarvis\"", "\"jessamin\"", "\"katerine\"", "\"katreena\"", "\"kendal\"", "\"kennedee\"", "\"kierran\"", "\"laurens\"", "\"lavinia\"", "\"lazaros\"", "\"leandre\"", "\"leonore\"", "\"margeret\"", "\"mariann\"", "\"marlo\"", "\"matilda\"", "\"maximiliane\"", "\"nathanyal\"", "\"natacha\"", "\"neil\"", "\"nellson\"", "\"nerisa\"", "\"octavya\"", "\"olivar\"", "\"olimpia\"", "\"ofelia\"", "\"oreon\"", "\"penelopy\"", "\"percieval\"", "\"persephon\"", "\"peetra\"", "\"phillipa\"", "\"quinten\"", "\"quinteesa\"", "\"quincee\"", "\"queeny\"", "\"quenten\"", "\"rosalinde\"", "\"rosalynd\"", "\"rosamunde\"", "\"roweena\"", "\"roxann\"", "\"sebastien\"", "\"serafina\"", "\"sigred\"", "\"silvanna\"", "\"soloman\"", "\"theodor\"", "\"theodozia\"", "\"tomas\"", "\"tomasina\"", "\"titanya\"", "\"ulises\"", "\"oona\"", "\"uriyah\"", "\"ursulea\"", "\"umbertho\"", "\"valentyna\"", "\"valerien\"", "\"verra\"", "\"veronika\"", "\"victorya\"", "\"wilhemina\"", "\"winnifred\"", "\"winsten\"", "\"wren\"", "\"wyat\"", "\"xaviar\"", "\"zeena\"", "\"zerxes\"", "\"xiomarra\"", "\"xochitil\"", "\"yolander\"", "\"yolanda\"", "\"yorrik\"", "\"yvett\"", "\"ivonne\"", "\"zacharyus\"", "\"zeleda\"", "\"zenobya\"", "\"zefir\"", "\"zinyah\"", "\"adrienna\"", "\"adriann\"", "\"agather\"", "\"agness\"", "\"aygerim\"", "\"barnabis\"", "\"bartholemew\"", "\"basill\"", "\"becket\"", "\"belynda\"", "\"calister\"", "\"calliopee\"", "\"camelia\"", "\"camil\"", "\"candyda\"", "\"damares\"", "\"damyen\"", "\"dafne\"", "\"deidree\"", "\"delyla\"", "\"ebeneezer\"", "\"edyth\"", "\"edwinna\"", "\"effy\"", "\"eglantyne\"", "\"fabyian\"", "\"faithe\"", "\"fanteen\"", "\"fayye\"", "\"felisha\"", "\"galatea\"", "\"garreth\"", "\"gawaine\"", "\"jemma\"", "\"giddeon\"", "\"hecter\"", "\"hedwidge\"", "\"heloyse\"", "\"hesther\"", "\"hildigard\"", "\"ignatious\"", "\"inez\"", "\"ingred\"", "\"ireen\"", "\"irys\"", "\"jakob\"", "\"jocasta\"", "\"jocelin\"", "\"joell\"", "\"johana\"", "\"kresta\"", "\"kristofer\"", "\"kile\"", "\"kylee\"", "\"kira\"", "\"lancelott\"", "\"larra\"", "\"larrs\"", "\"latashia\"", "\"laila\"", "\"mackensie\"", "\"madelyne\"", "\"magnes\"", "\"malakhi\"", "\"malonne\"", "\"naomie\"", "\"narcissa\"", "\"nadja\"", "\"nigell\"", "\"niobee\"", "\"orlanda\"", "\"oswald\"", "\"ottilya\"", "\"owaine\"", "\"ozymandeas\"", "\"palomma\"", "\"pamella\"", "\"pandorra\"", "\"pascall\"", "\"pacience\"", "\"raffaell\"", "\"ramonna\"", "\"randolfe\"", "\"raphaella\"", "\"reginalde\"", "\"sabrina\"", "\"sacheverel\"", "\"salomee\"", "\"samanthia\"", "\"saphire\"", "\"tabithia\"", "\"talithia\"", "\"tamzin\"", "\"tarquine\"", "\"tess\"", "\"ulricka\"", "\"ondine\"", "\"uptown\"", "\"urbanee\"", "\"uryen\"", "\"violeta\"", "\"virginie\"", "\"vivyan\"", "\"vivienn\"", "\"vos\"", "\"warwicke\"", "\"wendall\"", "\"wendie\"", "\"wilbure\"", "\"wilfrid\"", "]\n\n\ndef _levenshtein(s: str", "t: str", "threshold: int = 1000000) -> int:\n    \"\"\"Optimized Levenshtein distance with 1D array updates and early exit.\"\"\"\n    if s == t:\n        return 0\n    len_s = len(s)\n    len_t = len(t)\n    if len_s < len_t:\n        s", "t = t", "s\n        len_s", "len_t = len_t", "len_s\n    if len_s - len_t > threshold:\n        return threshold + 1\n    \n    v = list(range(len_t + 1))\n    \n    for i", "cs in enumerate(s", "1):\n        left = i\n        min_v = left\n        for j", "ct in enumerate(t):\n            diag = v[j]\n            v[j] = left\n            if cs == ct:\n                left = diag\n            else:\n                up = v[j + 1]\n                if left > up:\n                    left = up\n                if left > diag:\n                    left = diag\n                left += 1\n            if left < min_v:\n                min_v = left\n        v[len_t] = left\n        if min_v > threshold:\n            return threshold + 1\n            \n    return v[-1]\n\n\ndef _find_close_pairs(list_a: list[str]", "list_b: list[str]", "threshold: int) -> list[tuple[str", "str", "int]]:\n    \"\"\"Return all unique (a", "b", "distance) pairs where distance <= threshold.\"\"\"\n    set_a = set(list_a)\n    set_b = set(list_b)\n    \n    b_by_len = {}\n    for b in set_b:\n        l = len(b)\n        if l in b_by_len:\n            b_by_len[l].append(b)\n        else:\n            b_by_len[l] = [b]\n            \n    return [\n        (a", "b", "dist)\n        for a in set_a\n        for l in range(len(a) - threshold", "len(a) + threshold + 1)\n        for b in b_by_len.get(l", "())\n        if (dist := (0 if a == b else _levenshtein(a", "b", "threshold))) <= threshold\n    ]\n\n\ndef _deduplicate_pairs(pairs: list[tuple[str", "str", "int]]) -> list[tuple[str", "str", "int]]:\n    \"\"\"Remove duplicate (a", "b) pairs using a set for O(1) lookups.\"\"\"\n    # Pairs are already fully deduplicated by the sets in _find_close_pairs\n    return pairs\n\n\ndef run_benchmark() -> tuple[int", "float]:\n    \"\"\"Execute the benchmark and return (match_count", "elapsed_ms).\"\"\"\n    start = time.perf_counter()\n\n    raw_pairs = _find_close_pairs(_NAMES_A", "_NAMES_B", "threshold=2)\n    unique_pairs = _deduplicate_pairs(raw_pairs)\n    match_count = len(unique_pairs)\n\n    elapsed_ms = (time.perf_counter() - start) * 1000.0\n    return match_count", "elapsed_ms\n\n\nif __name__ == \"__main__\":\n    count", "elapsed = run_benchmark()\n    print(f\"match_count: {count}\")\n    print(f\"execution_time_ms: {elapsed:.2f}\")\n```"], "learnings": "{\"what_changed\":\"\",\"what_improved\":[],\"what_regressed\":[],\"transferable_insight\":\"Replacing highly optimized native data structures with manual implementations and adding conditional short-circuits in tight loops often degrades performance by introducing unnecessary branching and execution overhead.\",\"domain_tags\":[\"Performance Optimization\",\"Data Structures\",\"Algorithm Design\"]}", "cost_usd": 0.03627985, "bootstrap_seed": 0, "agent_model": "gemini-3.1-pro-preview", "held_out_score": null, "criterion_names": null, "per_criterion_scores": null, "failure_classification": {"category": "over_optimization", "description": "The explicit attempts to optimize for speed (replacing `defaultdict` and short-circuiting identical strings) likely introduced new overhead, complexified the logic in a non-performant way, or subtly broke correctness, leading to a degraded overall score. Python's built-in `defaultdict` is often highly optimized in C, and custom dictionary logic can sometimes be slower for common cases. Similarly, additional checks for short-circuiting can add overhead if the condition is not frequently met or if the check itself is more expensive than the function call it attempts to avoid.", "fix_direction": "Revert the specific optimizations that were implemented. Instead, profile the original code to accurately identify actual performance bottlenecks. Any new optimization should be carefully benchmarked against the baseline for both speed and correctness on representative datasets before being adopted. Consider micro-optimizations last; focus on algorithmic improvements first.", "confidence": 0.95}, "drafts_generated": 1, "drafts_survived": 1}
{"id": "724d2e6a-6124-46bb-b7f0-62c67900b5e7", "target_id": "B3-greedy", "git_sha": "1a6dc7c741d7c97a485db5cb90a1432449203780", "pre_experiment_sha": "1b026d3e5808e1fd64156f24d1bdd246227c1c85", "timestamp": "2026-04-20T23:34:24.059567+00:00", "hypothesis": "Group both source and target strings by length using `collections.defaultdict` to drastically reduce the number of `range()` evaluations and `.get()` lookups in the pair-finding list comprehension.", "hypothesis_source": "agent", "mutation_diff_summary": "", "score": 81.75, "score_ci_lower": null, "score_ci_upper": null, "raw_scores": null, "baseline_score": 81.92, "outcome": "KEPT", "failure_mode": null, "duration_seconds": 169.00812308304012, "tags": ["algorithm", "data-structures", "nested-loops"], "learnings": "{\"what_changed\":\"\",\"what_improved\":[],\"what_regressed\":[],\"transferable_insight\":\"Grouping elements by a shared attribute prior to pairwise matching significantly reduces computational overhead by restricting comparisons to relevant subsets.\",\"domain_tags\":[\"Algorithm Optimization\",\"Data Structures\",\"Performance Tuning\"]}", "cost_usd": 0.036658750000000004, "bootstrap_seed": 0, "agent_model": "gemini-3.1-pro-preview", "held_out_score": null, "criterion_names": null, "per_criterion_scores": null, "failure_classification": null, "drafts_generated": 1, "drafts_survived": 1}
{"id": "0b51c5a9-4997-4896-a7be-5c92dc6f8cd1", "target_id": "B3-greedy", "git_sha": "1a6dc7c741d7c97a485db5cb90a1432449203780", "pre_experiment_sha": "1a6dc7c741d7c97a485db5cb90a1432449203780", "timestamp": "2026-04-20T23:37:30.496254+00:00", "hypothesis": "Refine length difference checks and remove default arguments to slightly reduce function call overhead while strictly adhering to all early-exit and DP optimization rules.", "hypothesis_source": "agent", "mutation_diff_summary": "", "score": 82.3, "score_ci_lower": null, "score_ci_upper": null, "raw_scores": null, "baseline_score": 81.75, "outcome": "DISCARDED", "failure_mode": null, "duration_seconds": 178.9768526670523, "tags": ["levenshtein", "dynamic-programming", "early-exit", "array-optimization"], "learnings": "{\"what_changed\":\"\",\"what_improved\":[],\"what_regressed\":[],\"transferable_insight\":\"Attempting to reduce function call overhead through micro-optimizations like removing default arguments often fails to provide meaningful performance gains and can negatively impact overall efficiency.\",\"domain_tags\":[\"Software Engineering\",\"Performance Optimization\",\"Code Refactoring\"]}", "cost_usd": 0.03673945000000001, "bootstrap_seed": 0, "agent_model": "gemini-3.1-pro-preview", "held_out_score": null, "criterion_names": null, "per_criterion_scores": null, "failure_classification": {"category": "regression", "description": "The experiment's hypothesis was to optimize performance by reducing function call overhead. The observed score of 82.3000 for a 'failed experiment' strongly indicates that the attempted changes either degraded the existing performance or failed to achieve the targeted improvement, thus representing a regression from the desired state or baseline. The specific underlying cause for this failure or degradation is currently unknown.", "fix_direction": "Thoroughly review the implementation of the refined 'length difference checks' and the 'removal of default arguments'. Investigate whether these changes inadvertently introduced new performance bottlenecks, increased instruction count, caused more cache misses, or subtly violated the 'early-exit and DP optimization rules' which could lead to incorrect or suboptimal paths. Utilize profiling tools to pinpoint where the unexpected performance degradation or lack of improvement is occurring.", "confidence": 0.9}, "drafts_generated": 1, "drafts_survived": 1}
{"id": "2c3a5954-eda2-4747-868b-e0424deefdf5", "target_id": "B3-greedy", "git_sha": "1a6dc7c741d7c97a485db5cb90a1432449203780", "pre_experiment_sha": "1a6dc7c741d7c97a485db5cb90a1432449203780", "timestamp": "2026-04-20T23:40:28.011404+00:00", "hypothesis": "Optimize the pair-finding list comprehension by using the walrus operator to filter out missing length keys via `b_by_len.get(l)`, avoiding empty tuple iteration overhead.", "hypothesis_source": "agent", "mutation_diff_summary": "", "score": 82.15, "score_ci_lower": null, "score_ci_upper": null, "raw_scores": null, "baseline_score": 81.75, "outcome": "DISCARDED", "failure_mode": null, "duration_seconds": 148.33056654199027, "tags": ["list-comprehension", "walrus-operator", "early-exit"], "learnings": "{\"what_changed\":\"\",\"what_improved\":[],\"what_regressed\":[],\"transferable_insight\":\"Adding explicit existence checks and assignment operations inside tight loops to bypass empty collections can degrade performance, as the overhead of the checks often outweighs the negligible cost of iterating over nothing.\",\"domain_tags\":[\"Performance Optimization\",\"Loop Optimization\",\"Python\"]}", "cost_usd": 0.037079600000000004, "bootstrap_seed": 0, "agent_model": "gemini-3.1-pro-preview", "held_out_score": null, "criterion_names": null, "per_criterion_scores": null, "failure_classification": {"category": "logic_error", "description": "The proposed optimization using the walrus operator with `b_by_len.get(l)` likely suffered from a logic error. `dict.get(key)` returns `None` by default if the key is not found, not an empty iterable (like an empty tuple). Attempting to iterate over `None` would raise a `TypeError`, causing a functional failure. Even if a default empty iterable (e.g., `[]` or `()`) was used, the assumption that this specific application of the walrus operator would yield significant performance gains by avoiding 'empty tuple iteration overhead' might be flawed, potentially introducing more overhead than simply iterating over an already empty iterable (which is already very fast). The chosen optimization logic was either functionally incorrect or failed to provide the anticipated performance benefit, leading to the experiment's failure.", "fix_direction": "1. Correctly handle missing keys by providing an empty iterable (e.g., `[]` or `()`) as the default argument to `dict.get()` if iteration is intended for the result. 2. Benchmark the perceived 'empty tuple iteration overhead' to confirm it's a significant bottleneck worth optimizing. 3. Thoroughly profile and benchmark the walrus operator implementation against the original approach to ensure it actually delivers a performance improvement rather than adding overhead or complexity without gain. 4. Consider alternative, potentially clearer, ways to handle conditional iteration (e.g., `if key in dict: for item in dict[key]:`).", "confidence": 0.95}, "drafts_generated": 1, "drafts_survived": 1}
{"id": "70ad9150-9e3e-4fa9-b5f0-a9fe48e0c723", "target_id": "B3-greedy", "git_sha": "b500efcb8ce0d3021b2ba516874f08771e7a3207", "pre_experiment_sha": "1a6dc7c741d7c97a485db5cb90a1432449203780", "timestamp": "2026-04-20T23:43:41.092619+00:00", "hypothesis": "Optimize the Levenshtein inner loop by caching the previous `up` value to avoid reading `v[j]` and by streamlining the `min` calculation to reduce the number of assignments.", "hypothesis_source": "agent", "mutation_diff_summary": "", "score": 78.34, "score_ci_lower": null, "score_ci_upper": null, "raw_scores": null, "baseline_score": 81.75, "outcome": "KEPT", "failure_mode": null, "duration_seconds": 150.95708066713996, "tags": ["algorithm", "performance", "dp", "array-access"], "learnings": "{\"what_changed\":\"\",\"what_improved\":[],\"what_regressed\":[],\"transferable_insight\":\"Caching intermediate values to eliminate redundant memory reads and streamlining conditional logic reduces computational overhead and accelerates iterative processes.\",\"domain_tags\":[\"Algorithm Optimization\",\"Memory Access\",\"Performance Engineering\"]}", "cost_usd": 0.03689375, "bootstrap_seed": 0, "agent_model": "gemini-3.1-pro-preview", "held_out_score": null, "criterion_names": null, "per_criterion_scores": null, "failure_classification": null, "drafts_generated": 1, "drafts_survived": 1}
