{"id": "23f21e57-96c1-4727-8345-002466747457", "target_id": "B3-greedy", "git_sha": "f0b666c3e9605b81d951db22d75e8e4b1f2efa97", "pre_experiment_sha": "f0b666c3e9605b81d951db22d75e8e4b1f2efa97", "timestamp": "2026-04-21T00:28:10.666782+00:00", "hypothesis": "Restore nested `else: if` blocks in the Levenshtein inner loops to resolve a known performance regression caused by flattening them into `elif`.", "hypothesis_source": "agent", "mutation_diff_summary": "", "score": 75.21, "score_ci_lower": null, "score_ci_upper": null, "raw_scores": null, "baseline_score": 73.25, "outcome": "DISCARDED", "failure_mode": null, "duration_seconds": 92.33455270784907, "tags": ["levenshtein", "performance", "unflatten-elif"], "learnings": "{\"what_changed\":\"\",\"what_improved\":[],\"what_regressed\":[],\"transferable_insight\":\"Reverting flattened conditional logic back into nested structures is an ineffective strategy for resolving performance regressions and may further degrade execution efficiency.\",\"domain_tags\":[\"Code Optimization\",\"Performance Tuning\",\"Control Flow\"]}", "cost_usd": 0.0390567, "bootstrap_seed": 0, "agent_model": "gemini-3.1-pro-preview", "held_out_score": null, "criterion_names": null, "per_criterion_scores": null, "failure_classification": {"category": "logic_error", "description": "The experiment's hypothesis proposed restoring nested `else: if` blocks to resolve a known performance regression, implying an expectation that this structural change would lead to performance improvement. The experiment failed (indicated by the score 75.2100 not meeting the resolution criteria), suggesting that the underlying reasoning or assumption about the performance characteristics of `else: if` versus `elif` in the specific context of the Levenshtein inner loops was incorrect or insufficient to resolve the identified regression. The \"unknown\" failure mode means the precise reason for the lack of improvement or potential further degradation isn't detailed, but the failure to validate the hypothesis points to an error in the proposed solution's logic.", "fix_direction": "Re-evaluate the true root cause of the performance regression by conducting detailed profiling and benchmarking. The performance difference between `else: if` and `elif` is often negligible or highly compiler/architecture-dependent. Focus on deeper optimization techniques such as algorithmic improvements, data structure choices, cache efficiency, or vectorization, rather than micro-syntax changes, to address the Levenshtein inner loop performance.", "confidence": 0.9}, "drafts_generated": 1, "drafts_survived": 1}
{"id": "4c48c216-5696-4c82-865a-f5d40c0cdaa9", "target_id": "B3-greedy", "git_sha": "f0b666c3e9605b81d951db22d75e8e4b1f2efa97", "pre_experiment_sha": "f0b666c3e9605b81d951db22d75e8e4b1f2efa97", "timestamp": "2026-04-21T00:31:07.042184+00:00", "hypothesis": "Inline the `set()` conversions in `_find_close_pairs` to eliminate local variable assignments and slightly reduce overhead.", "hypothesis_source": "agent", "mutation_diff_summary": "", "score": 75.23, "score_ci_lower": null, "score_ci_upper": null, "raw_scores": null, "baseline_score": 73.25, "outcome": "DISCARDED", "failure_mode": null, "duration_seconds": 140.38080625003204, "tags": ["micro-optimization", "memory-efficiency"], "learnings": "{\"what_changed\":\"\",\"what_improved\":[],\"what_regressed\":[],\"transferable_insight\":\"Micro-optimizations that inline operations to avoid local variable assignments rarely yield performance gains, as the cost of local assignment is typically negligible.\",\"domain_tags\":[\"Code Optimization\",\"Micro-optimization\",\"Performance Tuning\"]}", "cost_usd": 0.0386429, "bootstrap_seed": 0, "agent_model": "gemini-3.1-pro-preview", "held_out_score": null, "criterion_names": null, "per_criterion_scores": null, "failure_classification": {"category": "regression", "description": "The experiment aimed to optimize performance by inlining `set()` conversions to reduce overhead. The reported score of 75.2300 for a 'failed experiment' strongly indicates that this change did not lead to the intended performance improvement and likely resulted in a degradation of the metric, rather than an enhancement. The 'unknown' failure mode suggests the code ran without crashing but yielded an undesirable measurable outcome.", "fix_direction": "Revert the inlining change. Re-evaluate the performance assumptions regarding `set()` conversions and local variable assignments. Use profiling tools to identify the true bottlenecks and understand why inlining in this specific context led to a worse outcome, possibly due to increased register pressure, less effective compiler optimizations, or other runtime overheads that were not anticipated.", "confidence": 0.95}, "drafts_generated": 1, "drafts_survived": 1}
{"id": "3a0c33a3-213a-4539-ba6c-b7fc59996f51", "target_id": "B3-greedy", "git_sha": "f0b666c3e9605b81d951db22d75e8e4b1f2efa97", "pre_experiment_sha": "f0b666c3e9605b81d951db22d75e8e4b1f2efa97", "timestamp": "2026-04-21T00:34:37.134905+00:00", "hypothesis": "Optimize array access by replacing `v[len_t]` with `v[-1]` to avoid local variable lookups, cache `threshold + 1` in the pair-finding loop to reduce arithmetic operations, and inline set creations to slightly reduce memory overhead.", "hypothesis_source": "agent", "mutation_diff_summary": "", "score": 74.52, "score_ci_lower": null, "score_ci_upper": null, "raw_scores": null, "baseline_score": 73.25, "outcome": "DISCARDED", "failure_mode": null, "duration_seconds": 193.82564399996772, "tags": ["micro-optimization", "array-access", "loop-optimization"], "learnings": "{\"what_changed\":\"\",\"what_improved\":[],\"what_regressed\":[],\"transferable_insight\":\"Manual micro-optimizations of basic operations, such as caching simple arithmetic or altering array indexing, often degrade performance by introducing overhead or interfering with the system's built-in optimizations.\",\"domain_tags\":[\"Performance Optimization\",\"Micro-optimization\",\"Software Engineering\"]}", "cost_usd": 0.0390547, "bootstrap_seed": 0, "agent_model": "gemini-3.1-pro-preview", "held_out_score": null, "criterion_names": null, "per_criterion_scores": null, "failure_classification": {"category": "over_optimization", "description": "The experiment attempted micro-optimizations by replacing array access methods, caching arithmetic operations, and inlining set creations. These types of optimizations in Python often yield negligible improvements, or can even degrade performance or introduce subtle bugs by interfering with the CPython interpreter's own internal optimizations. The score of 74.5200 suggests that the code likely ran but failed to meet performance targets or produced partially incorrect results due to these changes.", "fix_direction": "Revert the micro-optimizations. Instead, profile the code to identify actual performance bottlenecks using tools like `cProfile`. Focus on algorithmic improvements or using more efficient data structures rather than low-level syntax changes, which are often counterproductive in high-level languages like Python.", "confidence": 0.9}, "drafts_generated": 1, "drafts_survived": 1}
{"id": "5d581aac-e338-4e9f-90f8-fe8d16120e2a", "target_id": "B3-greedy", "git_sha": "f0b666c3e9605b81d951db22d75e8e4b1f2efa97", "pre_experiment_sha": "f0b666c3e9605b81d951db22d75e8e4b1f2efa97", "timestamp": "2026-04-21T00:38:40.426733+00:00", "hypothesis": "Optimize function call overhead in `run_benchmark` by passing `threshold` as a positional argument instead of a keyword argument.", "hypothesis_source": "agent", "mutation_diff_summary": "", "score": 73.83, "score_ci_lower": null, "score_ci_upper": null, "raw_scores": null, "baseline_score": 73.25, "outcome": "DISCARDED", "failure_mode": null, "duration_seconds": 197.6657189161051, "tags": ["micro-optimization"], "learnings": "{\"what_changed\":\"\",\"what_improved\":[],\"what_regressed\":[],\"transferable_insight\":\"Attempting to micro-optimize execution speed by converting keyword arguments to positional arguments rarely yields measurable performance benefits.\",\"domain_tags\":[\"Software Engineering\",\"Performance Optimization\",\"Micro-optimization\"]}", "cost_usd": 0.038874650000000004, "bootstrap_seed": 0, "agent_model": "gemini-3.1-pro-preview", "held_out_score": null, "criterion_names": null, "per_criterion_scores": null, "failure_classification": {"category": "logic_error", "description": "The reasoning behind the optimization attempt was flawed or insufficient. Changing `threshold` from a keyword to a positional argument did not result in a measurable performance improvement for function call overhead, suggesting that either the overhead difference is negligible in this context, or other factors dominate the benchmark's execution time.", "fix_direction": "Profile `run_benchmark` to identify actual performance bottlenecks. Re-evaluate the assumptions about the impact of keyword vs. positional arguments on overhead for the specific interpreter/runtime environment. Consider other optimization strategies targeting more significant performance contributors.", "confidence": 0.9}, "drafts_generated": 1, "drafts_survived": 1}
{"id": "7ee103d7-79b5-433e-8752-251296f7da0c", "target_id": "B3-greedy", "git_sha": "f0b666c3e9605b81d951db22d75e8e4b1f2efa97", "pre_experiment_sha": "f0b666c3e9605b81d951db22d75e8e4b1f2efa97", "timestamp": "2026-04-21T00:44:23.975302+00:00", "hypothesis": "Simplify the `min` calculation in the Levenshtein inner loop by replacing the nested `if`/`elif` structure with two sequential `if` statements, reducing bytecode complexity and branch overhead.", "hypothesis_source": "agent", "mutation_diff_summary": "", "score": 73.61, "score_ci_lower": null, "score_ci_upper": null, "raw_scores": null, "baseline_score": 73.25, "outcome": "DISCARDED", "failure_mode": null, "duration_seconds": 139.01174925011583, "tags": ["b3-greedy", "levenshtein-optimization", "min-simplification"], "learnings": "{\"what_changed\":\"\",\"what_improved\":[],\"what_regressed\":[],\"transferable_insight\":\"Flattening nested conditional structures into sequential statements often degrades performance by forcing the evaluation of all conditions instead of allowing early exits.\",\"domain_tags\":[\"Control Flow\",\"Performance Optimization\",\"Code Complexity\"]}", "cost_usd": 0.039050150000000006, "bootstrap_seed": 0, "agent_model": "gemini-3.1-pro-preview", "held_out_score": null, "criterion_names": null, "per_criterion_scores": null, "failure_classification": {"category": "regression", "description": "The experiment aimed to optimize the `min` calculation by replacing nested `if`/`elif` with sequential `if` statements but resulted in a significantly lower evaluation score (73.6100). This indicates a degradation in performance or correctness, failing to achieve the hypothesized reduction in bytecode complexity or branch overhead, and potentially introducing additional overhead or subtle logical errors that negatively impacted the metric.", "fix_direction": "Thoroughly benchmark the performance impact of both the original and modified `min` calculation implementations. Investigate the generated bytecode and CPU branch prediction behavior to understand why the sequential `if` statements resulted in a performance degradation or correctness issue. Consider alternative optimization strategies for `min` (e.g., using built-in `min` functions, vectorization, or compiler hints) rather than manual branching manipulation, and ensure that any changes maintain strict logical equivalence to the original `min` functionality. Improve diagnostic logging to capture specific performance metrics and correctness checks for future optimization attempts.", "confidence": 0.95}, "drafts_generated": 1, "drafts_survived": 1}
{"id": "409dc84d-b265-4600-96bd-bb70acb9d389", "target_id": "B3-greedy", "git_sha": "f0b666c3e9605b81d951db22d75e8e4b1f2efa97", "pre_experiment_sha": "f0b666c3e9605b81d951db22d75e8e4b1f2efa97", "timestamp": "2026-04-21T00:48:08.550000+00:00", "hypothesis": "Replace `v[-1]` with `v[len_t]` in the final return statement of `_levenshtein` to ensure consistent explicit array indexing and fully adhere to the array access rules.", "hypothesis_source": "agent", "mutation_diff_summary": "", "score": 73.37, "score_ci_lower": null, "score_ci_upper": null, "raw_scores": null, "baseline_score": 73.25, "outcome": "DISCARDED", "failure_mode": null, "duration_seconds": 186.31667149998248, "tags": ["array-access", "micro-optimization"], "learnings": "{\"what_changed\":\"\",\"what_improved\":[],\"what_regressed\":[],\"transferable_insight\":\"Refactoring idiomatic, built-in language features into explicit, verbose alternatives for the sake of perceived consistency often yields no functional benefit and is generally counterproductive.\",\"domain_tags\":[\"Code Refactoring\",\"Language Idioms\",\"Software Engineering\"]}", "cost_usd": 0.03928315000000001, "bootstrap_seed": 0, "agent_model": "gemini-3.1-pro-preview", "held_out_score": null, "criterion_names": null, "per_criterion_scores": null, "failure_classification": {"category": "logic_error", "description": "The hypothesis assumes that `v[-1]` is functionally equivalent to `v[len_t]` for retrieving the final Levenshtein distance. This equivalence is only valid if the length of the array `v` is precisely `len_t + 1`. The observed score drop (from an implied higher score to 73.37) indicates that this assumption is incorrect within the `_levenshtein` implementation. It's highly probable that `len(v)` is not consistently `len_t + 1`, causing `v[len_t]` to either raise an `IndexError` for some test cases or, more likely, retrieve an incorrect intermediate value from the array `v`, leading to an erroneous Levenshtein distance calculation.", "fix_direction": "Investigate the actual length of the `v` array at the point of the return statement and its relationship to `len_t`. Confirm the correct index that consistently points to the final computed Levenshtein distance. If `len_t` does not directly correspond to `len(v) - 1`, identify the correct indexing variable or revert to `v[-1]` or `v[len(v) - 1]` for robustness in accessing the last element of the dynamically sized array `v`.", "confidence": 0.95}, "drafts_generated": 1, "drafts_survived": 1}
{"id": "c759138e-44d7-4b0e-9820-14e6ea2108f9", "target_id": "B3-greedy", "git_sha": "f0b666c3e9605b81d951db22d75e8e4b1f2efa97", "pre_experiment_sha": "f0b666c3e9605b81d951db22d75e8e4b1f2efa97", "timestamp": "2026-04-21T00:51:58.082194+00:00", "hypothesis": "Format the `min` calculation in the Levenshtein inner loop to use single-line `if` statements, reducing vertical space while maintaining the fully optimized baseline logic.", "hypothesis_source": "agent", "mutation_diff_summary": "", "score": 73.48, "score_ci_lower": null, "score_ci_upper": null, "raw_scores": null, "baseline_score": 73.25, "outcome": "DISCARDED", "failure_mode": null, "duration_seconds": 210.1824687081389, "tags": ["formatting", "micro-optimization"], "learnings": "{\"what_changed\":\"\",\"what_improved\":[],\"what_regressed\":[],\"transferable_insight\":\"Compressing conditional logic into single-line statements to reduce vertical space does not inherently improve performance and can sometimes degrade execution efficiency.\",\"domain_tags\":[\"Code Formatting\",\"Micro-optimization\",\"Performance Tuning\"]}", "cost_usd": 0.039044699999999995, "bootstrap_seed": 0, "agent_model": "gemini-3.1-pro-preview", "held_out_score": null, "criterion_names": null, "per_criterion_scores": null, "failure_classification": {"category": "logic_error", "description": "The refactoring of the `min` calculation into single-line `if` statements, intended solely to reduce vertical space, inadvertently altered the core logic of the Levenshtein distance calculation. The significantly reduced score (73.48) indicates a failure to maintain the 'fully optimized baseline logic' as stipulated in the hypothesis, leading to incorrect computational results.", "fix_direction": "Carefully re-examine the single-line `if` implementation of the `min` calculation against the original multi-line logic. Identify discrepancies in behavior, paying close attention to operator precedence, missing conditions, or incorrect assignments that could arise from compacting the expression. Ensure the single-line format precisely mirrors the original functional requirements for determining the minimum value, possibly by using ternary operators or a language's built-in `min` function if permitted by the formatting constraint. Rigorous testing against a known correct baseline is crucial.", "confidence": 0.95}, "drafts_generated": 1, "drafts_survived": 1}
{"id": "9db59f0a-8490-41b3-a4a4-4ac67dca2979", "target_id": "B3-greedy", "git_sha": "f0b666c3e9605b81d951db22d75e8e4b1f2efa97", "pre_experiment_sha": "f0b666c3e9605b81d951db22d75e8e4b1f2efa97", "timestamp": "2026-04-21T00:55:55.890188+00:00", "hypothesis": "Replace `v[-1]` with `v[len_t]` to avoid negative indexing overhead, and defer the final `v[len_t] = left` assignment until after the `min_v > threshold` early exit check to save an unnecessary array write.", "hypothesis_source": "agent", "mutation_diff_summary": "", "score": 73.43, "score_ci_lower": null, "score_ci_upper": null, "raw_scores": null, "baseline_score": 73.25, "outcome": "DISCARDED", "failure_mode": null, "duration_seconds": 219.97425545798615, "tags": ["micro-optimization", "array-access", "early-exit"], "learnings": "{\"what_changed\":\"\",\"what_improved\":[],\"what_regressed\":[],\"transferable_insight\":\"Attempting to manually optimize native features like negative indexing or deferring single array writes can degrade performance by introducing explicit calculation overhead or branching complexity.\",\"domain_tags\":[\"Performance Optimization\",\"Micro-optimization\",\"Code Execution\"]}", "cost_usd": 0.03951145000000001, "bootstrap_seed": 0, "agent_model": "gemini-3.1-pro-preview", "held_out_score": null, "criterion_names": null, "per_criterion_scores": null, "failure_classification": {"category": "logic_error", "description": "The core issue is a misunderstanding of array indexing. The hypothesis suggests replacing `v[-1]` (which typically refers to the last element of an array `v`) with `v[len_t]`. If `len_t` represents the current length of the array, then `v[len_t]` is an out-of-bounds index (it points one element past the end of the array). The correct positive index for the last element would be `v[len_t - 1]`. This fundamental indexing error would lead to incorrect data access or modification, resulting in a functional bug rather than an optimization. The subsequent deferral of the `v[len_t] = left` assignment, while an optimization attempt, also relies on this incorrect `v[len_t]` index, making the entire change flawed. The score of 73.4300 indicates that the code likely ran without a complete crash, but produced incorrect results or did not meet the desired criteria due to this logical flaw.", "fix_direction": "Correct the array indexing. Ensure that when trying to access the *last existing element*, the index used is `len_t - 1` (where `len_t` is the current length of the array). If the intent is to append a *new* element, then `v[len_t]` might be appropriate depending on the language/data structure (e.g., in Python, `v.append(left)` is used, and internally it might manage the index `len_t`). Once the indexing is correct, the optimization of deferring the write can be re-evaluated and applied.", "confidence": 0.95}, "drafts_generated": 1, "drafts_survived": 1}
