{"id": "fd11d85d-4161-4624-8d8d-f455ff1fc1ab", "target_id": "B3-greedy", "git_sha": "4ba9ccfd68f4e96b43325fec84c49c6c2ee45b28", "pre_experiment_sha": "4ba9ccfd68f4e96b43325fec84c49c6c2ee45b28", "timestamp": "2026-04-19T14:45:04.142639+00:00", "hypothesis": "Cache candidate string lengths in the existing entries and use them for an exact pre-Levenshtein length-gap skip.", "hypothesis_source": "agent", "mutation_diff_summary": "", "score": 107.0, "score_ci_lower": null, "score_ci_upper": null, "raw_scores": null, "baseline_score": 105.82, "outcome": "DISCARDED", "failure_mode": null, "duration_seconds": 35.595925416913815, "tags": ["cached-lengths", "hot-path", "exact-pruning"], "learnings": "{\"what_changed\":\"\",\"what_improved\":[],\"what_regressed\":[],\"transferable_insight\":\"Storing a cheap-to-compute proxy alongside existing records can enable exact early-exit checks that avoid expensive work without changing results.\",\"domain_tags\":[\"optimization\",\"data-structures\",\"performance-engineering\"]}", "cost_usd": 0.0921212, "bootstrap_seed": 0, "agent_model": "gpt-5.4", "held_out_score": null, "criterion_names": null, "per_criterion_scores": null, "failure_classification": {"category": "logic_error", "description": "The optimization based on caching string lengths and using a pre-Levenshtein length-gap skip likely computed or applied the skip condition incorrectly, leading to incorrect pruning/allowing of candidates even though the intended logic was valid in principle.", "fix_direction": "Validate the exact skip predicate against Levenshtein distance properties (e.g., ensure the condition is both necessary and correctly computed), add targeted unit tests around boundary cases, and confirm cached lengths align with the compared strings after any preprocessing/normalization.", "confidence": 0.62}, "drafts_generated": 1, "drafts_survived": 1}
{"id": "00792e7d-40c5-45e8-a160-6690cb038824", "target_id": "B3-greedy", "git_sha": "4ba9ccfd68f4e96b43325fec84c49c6c2ee45b28", "pre_experiment_sha": "4ba9ccfd68f4e96b43325fec84c49c6c2ee45b28", "timestamp": "2026-04-19T14:45:47.451063+00:00", "hypothesis": "Cache candidate lengths in the A-side tuple and use an exact length-gap skip immediately before Levenshtein.", "hypothesis_source": "agent", "mutation_diff_summary": "", "score": 106.87, "score_ci_lower": null, "score_ci_upper": null, "raw_scores": null, "baseline_score": 105.82, "outcome": "DISCARDED", "failure_mode": null, "duration_seconds": 35.347878583939746, "tags": ["length-cache", "hot-path", "exact-prune"], "learnings": "{\"what_changed\":\"\",\"what_improved\":[],\"what_regressed\":[],\"transferable_insight\":\"Adding a pre-check or cached estimate only helps when it reliably avoids expensive work; if it does not change outcomes or skip enough computation, it is likely unnecessary complexity.\",\"domain_tags\":[\"optimization\",\"software-engineering\",\"performance\"]}", "cost_usd": 0.09281980000000001, "bootstrap_seed": 0, "agent_model": "gpt-5.4", "held_out_score": null, "criterion_names": null, "per_criterion_scores": null, "failure_classification": {"category": "logic_error", "description": "The provided information does not indicate a clear failure category. The hypothesis and failure mode are unspecified (\u201cunknown\u201d), and the score alone (106.8700) does not reveal whether the issue is formatting, syntax, logic, regression, scope, semantic meaning, or an incomplete edit.", "fix_direction": "Re-run with full failure logs (error message/stack trace or diff), and capture whether the output schema changed, whether parsing failed, and whether edit-distance skipping logic matches expected behavior across test cases.", "confidence": 0.12}, "drafts_generated": 1, "drafts_survived": 1}
{"id": "30433134-7a88-43fa-a0fa-6ef4e79ec23c", "target_id": "B3-greedy", "git_sha": "4ba9ccfd68f4e96b43325fec84c49c6c2ee45b28", "pre_experiment_sha": "4ba9ccfd68f4e96b43325fec84c49c6c2ee45b28", "timestamp": "2026-04-19T14:46:24.727579+00:00", "hypothesis": "Cache candidate string lengths once and reuse them in the hot comparison path with an exact length-gap skip before Levenshtein.", "hypothesis_source": "agent", "mutation_diff_summary": "", "score": 108.89, "score_ci_lower": null, "score_ci_upper": null, "raw_scores": null, "baseline_score": 105.82, "outcome": "DISCARDED", "failure_mode": null, "duration_seconds": 34.89530904102139, "tags": ["length-cache", "hot-path", "exact-pruning"], "learnings": "{\"what_changed\":\"\",\"what_improved\":[],\"what_regressed\":[],\"transferable_insight\":\"Precomputing and reusing inexpensive metadata can simplify a hot path, but only if the added bookkeeping actually reduces work more than it adds overhead.\",\"domain_tags\":[\"optimization\",\"performance\",\"algorithm-design\"]}", "cost_usd": 0.0927892, "bootstrap_seed": 0, "agent_model": "gpt-5.4", "held_out_score": null, "criterion_names": null, "per_criterion_scores": null, "failure_classification": {"category": "logic_error", "description": "Failure mode is listed as 'unknown' and no additional evidence is provided to determine whether the issue is formatting, logic, regression, scope, syntax, semantic meaning, evaluation gaming, or an incomplete/partial change. Score alone (108.8900) is insufficient to map to a specific failure category.", "fix_direction": "Collect and compare the passing vs failing artifact details (logs, error messages, diff), then verify the change respects the exact intended hot-path logic (cache length + length-gap skip) without altering I/O/format or semantics; ensure code compiles and tests validate both correctness and expected performance.", "confidence": 0.05}, "drafts_generated": 1, "drafts_survived": 1}
{"id": "69720a10-fcab-4a61-bd89-371f976f57c9", "target_id": "B3-greedy", "git_sha": "4ba9ccfd68f4e96b43325fec84c49c6c2ee45b28", "pre_experiment_sha": "4ba9ccfd68f4e96b43325fec84c49c6c2ee45b28", "timestamp": "2026-04-19T14:47:02.342155+00:00", "hypothesis": "Cache candidate string lengths in the existing entries and use them for an exact length-gap skip immediately before Levenshtein.", "hypothesis_source": "agent", "mutation_diff_summary": "", "score": 107.16, "score_ci_lower": null, "score_ci_upper": null, "raw_scores": null, "baseline_score": 105.82, "outcome": "DISCARDED", "failure_mode": null, "duration_seconds": 34.919716833974235, "tags": ["length-cache", "hot-path", "exact-pruning"], "learnings": "{\"what_changed\":\"\",\"what_improved\":[],\"what_regressed\":[],\"transferable_insight\":\"When a proposed optimization adds bookkeeping but yields no measurable gains or regressions, it should be discarded rather than retained on speculation.\",\"domain_tags\":[\"optimization\",\"experimentation\",\"decision-making\"]}", "cost_usd": 0.09276340000000001, "bootstrap_seed": 0, "agent_model": "gpt-5.4", "held_out_score": null, "criterion_names": null, "per_criterion_scores": null, "failure_classification": {"category": "logic_error", "description": "The provided information does not include enough detail about what specifically failed (e.g., incorrect output format, parsing errors, regression of a criterion, or logical/semantic mismatch). The \u201cFailure Mode: unknown\u201d and lack of error logs make it impossible to determine the underlying cause from the hypothesis and score alone.", "fix_direction": "Obtain concrete failure evidence (error messages, diff of implementation, expected vs actual behavior) and then map the failure to one of the listed categories; next, validate that the length-gap skip preserves correctness for all edge cases (especially where cached lengths and actual candidate strings diverge) and add unit tests covering those cases.", "confidence": 0.05}, "drafts_generated": 1, "drafts_survived": 1}
{"id": "bcbbe033-7da8-49f4-b6c2-b4a2d2c7454a", "target_id": "B3-greedy", "git_sha": "4ba9ccfd68f4e96b43325fec84c49c6c2ee45b28", "pre_experiment_sha": "4ba9ccfd68f4e96b43325fec84c49c6c2ee45b28", "timestamp": "2026-04-19T14:47:45.233952+00:00", "hypothesis": "Cache candidate string lengths in the existing tuples and reuse them in the hot comparison path with an exact length-gap skip right before Levenshtein.", "hypothesis_source": "agent", "mutation_diff_summary": "", "score": 107.08, "score_ci_lower": null, "score_ci_upper": null, "raw_scores": null, "baseline_score": 105.82, "outcome": "DISCARDED", "failure_mode": null, "duration_seconds": 35.34226545796264, "tags": ["length-cache", "hot-path", "exact-pruning", "minimal-edit"], "learnings": "{\"what_changed\":\"\",\"what_improved\":[],\"what_regressed\":[],\"transferable_insight\":\"Adding cached metadata can simplify a hot path, but if the optimization does not measurably change the critical decision points or workload, it is unlikely to produce real gains.\",\"domain_tags\":[\"performance-optimization\",\"software-engineering\",\"algorithm-design\"]}", "cost_usd": 0.0934436, "bootstrap_seed": 0, "agent_model": "gpt-5.4", "held_out_score": null, "criterion_names": null, "per_criterion_scores": null, "failure_classification": {"category": "logic_error", "description": "The provided information lacks enough detail to map the failed experiment to a specific failure mode. Only the hypothesis and a numeric score (107.0800) are given, with no observed error, behavior, or outputs to determine whether the failure was format/schema, logic/calculation, regression, scope, syntax/parsing, semantic meaning, evaluation gaming, or an incomplete/inconsistent edit.", "fix_direction": "Provide the failure evidence (error logs/stack trace, diff of code changes, and a before/after example input-output or metrics breakdown) so the failure can be classified precisely; then iterate on that specific axis (e.g., verify the length-cache integration point, ensure the skip logic is correct, and confirm Levenshtein is called with correct lengths).", "confidence": 0.05}, "drafts_generated": 1, "drafts_survived": 1}
{"id": "b80feb68-ab04-4df3-8e51-629fd06011a1", "target_id": "B3-greedy", "git_sha": "4ba9ccfd68f4e96b43325fec84c49c6c2ee45b28", "pre_experiment_sha": "4ba9ccfd68f4e96b43325fec84c49c6c2ee45b28", "timestamp": "2026-04-19T14:48:23.417670+00:00", "hypothesis": "Cache candidate string lengths in the existing tuple entries and use them for an exact length-gap skip immediately before Levenshtein.", "hypothesis_source": "agent", "mutation_diff_summary": "", "score": 108.05, "score_ci_lower": null, "score_ci_upper": null, "raw_scores": null, "baseline_score": 105.82, "outcome": "DISCARDED", "failure_mode": null, "duration_seconds": 35.19219041697215, "tags": ["length-cache", "exact-prune", "hot-path"], "learnings": "{\"what_changed\":\"\",\"what_improved\":[],\"what_regressed\":[],\"transferable_insight\":\"Adding a pre-check that uses already-available metadata to avoid expensive exact computation can be worthwhile, but only if it reliably filters enough cases to offset the added bookkeeping and complexity.\",\"domain_tags\":[\"optimization\",\"algorithm-design\",\"performance\"]}", "cost_usd": 0.093294, "bootstrap_seed": 0, "agent_model": "gpt-5.4", "held_out_score": null, "criterion_names": null, "per_criterion_scores": null, "failure_classification": {"category": "logic_error", "description": "The optimization idea (caching tuple string lengths and using an exact length-gap skip before Levenshtein) likely misapplied the length-gap pruning or used cached lengths inconsistently, causing incorrect pruning/selection rather than preserving the original matching logic. This led to an overall metric failure without an indication of formatting, parsing, or scope issues.", "fix_direction": "Verify correctness of the length-gap condition (ensure skip only occurs when it is mathematically sound for the metric/threshold used), and add tests comparing the optimized path vs. the baseline Levenshtein results across edge cases (empty strings, equal lengths, threshold boundaries).", "confidence": 0.46}, "drafts_generated": 1, "drafts_survived": 1}
{"id": "006d4989-80de-40a2-a16b-e2d36e6a8dac", "target_id": "B3-greedy", "git_sha": "4ba9ccfd68f4e96b43325fec84c49c6c2ee45b28", "pre_experiment_sha": "4ba9ccfd68f4e96b43325fec84c49c6c2ee45b28", "timestamp": "2026-04-19T14:48:59.981650+00:00", "hypothesis": "Cache string lengths on candidate entries and reuse them in the hot comparison path.", "hypothesis_source": "agent", "mutation_diff_summary": "", "score": 106.76, "score_ci_lower": null, "score_ci_upper": null, "raw_scores": null, "baseline_score": 105.82, "outcome": "DISCARDED", "failure_mode": null, "duration_seconds": 33.77061991696246, "tags": ["length-cache", "hot-path", "exact-pruning"], "learnings": "{\"what_changed\":\"\",\"what_improved\":[],\"what_regressed\":[],\"transferable_insight\":\"Optimizations that add cached metadata should be validated against the full hot path, because extra bookkeeping can outweigh any savings when the underlying operation is already cheap.\",\"domain_tags\":[\"performance-optimization\",\"systems-design\",\"benchmarking\"]}", "cost_usd": 0.09306160000000001, "bootstrap_seed": 0, "agent_model": "gpt-5.4", "held_out_score": null, "criterion_names": null, "per_criterion_scores": null, "failure_classification": {"category": "logic_error", "description": "Failure mode is not specified (\u201cunknown\u201d), so it\u2019s unclear what specifically went wrong (e.g., logic/correctness, formatting, regression, or parsing). The high score provides no enough signal to map the failure to a specific category.", "fix_direction": "Instrument and capture the exact failing symptom (error type, stack trace, failing test/log diff, or performance/behavior mismatch). Then verify correctness of the cached length semantics in the hot comparison path and add targeted tests/benchmarks to confirm identical results vs baseline.", "confidence": 0.1}, "drafts_generated": 1, "drafts_survived": 1}
{"id": "d5040749-f0c7-44d2-b232-ae12ce2c9066", "target_id": "B3-greedy", "git_sha": "4ba9ccfd68f4e96b43325fec84c49c6c2ee45b28", "pre_experiment_sha": "4ba9ccfd68f4e96b43325fec84c49c6c2ee45b28", "timestamp": "2026-04-19T14:49:38.526370+00:00", "hypothesis": "Cache lengths in candidate records and add a redundant-safe exact length-gap guard immediately before Levenshtein.", "hypothesis_source": "agent", "mutation_diff_summary": "", "score": 106.72, "score_ci_lower": null, "score_ci_upper": null, "raw_scores": null, "baseline_score": 105.82, "outcome": "DISCARDED", "failure_mode": null, "duration_seconds": 32.46493149991147, "tags": ["length-cache", "hot-path", "minimal-edit"], "learnings": "{\"what_changed\":\"\",\"what_improved\":[],\"what_regressed\":[],\"transferable_insight\":\"Adding a redundant, low-cost guard right before an expensive operation can improve robustness without changing outcomes, but only if it meaningfully filters work or prevents edge-case failures.\",\"domain_tags\":[\"optimization\",\"defensive-programming\",\"software-engineering\"]}", "cost_usd": 0.09188640000000001, "bootstrap_seed": 0, "agent_model": "gpt-5.4", "held_out_score": null, "criterion_names": null, "per_criterion_scores": null, "failure_classification": {"category": "logic_error", "description": "The attempted length-gap guard was not correctly applied/validated, leading to an incorrect or insufficient guard before the Levenshtein step (i.e., the safeguard did not reliably enforce the intended constraints).", "fix_direction": "Re-verify the guard\u2019s preconditions and boundary conditions (min/max length, handling of missing/NULL cache fields, and exact gap logic) and add tests that exercise edge cases to ensure the guard deterministically prevents invalid Levenshtein calls.", "confidence": 0.62}, "drafts_generated": 1, "drafts_survived": 1}
{"id": "14c89daa-a40f-47bd-878a-3470796b2fef", "target_id": "B3-greedy", "git_sha": "4ba9ccfd68f4e96b43325fec84c49c6c2ee45b28", "pre_experiment_sha": "4ba9ccfd68f4e96b43325fec84c49c6c2ee45b28", "timestamp": "2026-04-19T14:50:13.765014+00:00", "hypothesis": "Cache candidate lengths in the existing records and add a redundant exact length-gap guard immediately before Levenshtein to avoid repeated work in the hot path.", "hypothesis_source": "agent", "mutation_diff_summary": "", "score": 108.52, "score_ci_lower": null, "score_ci_upper": null, "raw_scores": null, "baseline_score": 105.82, "outcome": "DISCARDED", "failure_mode": null, "duration_seconds": 32.88387525000144, "tags": ["length-cache", "hot-path", "minimal-edit"], "learnings": "{\"what_changed\":\"\",\"what_improved\":[],\"what_regressed\":[],\"transferable_insight\":\"Adding cached metadata and a final exact guard can reduce repeated computation in hot paths, but if the optimization does not change measurable outcomes it should be discarded to avoid unnecessary complexity.\",\"domain_tags\":[\"performance-optimization\",\"software-engineering\",\"systems-design\"]}", "cost_usd": 0.09209619999999999, "bootstrap_seed": 0, "agent_model": "gpt-5.4", "held_out_score": null, "criterion_names": null, "per_criterion_scores": null, "failure_classification": {"category": "logic_error", "description": "The optimization idea (caching candidate lengths and adding an exact length-gap guard before Levenshtein) did not achieve the intended behavior/performance and appears to have introduced incorrect control-flow or guard semantics, leading to an overall failed experiment (score 108.5200) rather than a safe optimization.", "fix_direction": "Re-check the guard condition correctness relative to the configured max edit distance/threshold, ensure the cached lengths are computed and updated consistently for every record/candidate, and add targeted tests that validate guard behavior against ground-truth Levenshtein results for edge cases.", "confidence": 0.62}, "drafts_generated": 1, "drafts_survived": 1}
{"id": "9e05b985-5115-4566-9183-dc49937e9cc0", "target_id": "B3-greedy", "git_sha": "4ba9ccfd68f4e96b43325fec84c49c6c2ee45b28", "pre_experiment_sha": "4ba9ccfd68f4e96b43325fec84c49c6c2ee45b28", "timestamp": "2026-04-19T14:50:45.467950+00:00", "hypothesis": "Cache candidate lengths in the existing records and add one exact length-gap guard immediately before Levenshtein.", "hypothesis_source": "agent", "mutation_diff_summary": "", "score": 107.15, "score_ci_lower": null, "score_ci_upper": null, "raw_scores": null, "baseline_score": 105.82, "outcome": "DISCARDED", "failure_mode": null, "duration_seconds": 29.130357583984733, "tags": ["length-cache", "hot-path", "minimal-edit"], "learnings": "{\"what_changed\":\"\",\"what_improved\":[],\"what_regressed\":[],\"transferable_insight\":\"Adding a cheap pre-check can improve efficiency, but if it does not change the decision boundary or reduce uncertainty, it may yield little practical benefit and be discarded.\",\"domain_tags\":[\"optimization\",\"heuristics\",\"performance\"]}", "cost_usd": 0.09190240000000001, "bootstrap_seed": 0, "agent_model": "gpt-5.4", "held_out_score": null, "criterion_names": null, "per_criterion_scores": null, "failure_classification": {"category": "logic_error", "description": "The provided details do not include enough information about what actually failed (e.g., code diff, error messages, or observed vs expected behavior). The hypothesis suggests a targeted optimization, but the failure mode is listed as 'unknown' and no concrete symptom is described beyond a score value.", "fix_direction": "Capture the specific failure symptom (exception/logs, failing test, or behavioral mismatch), then verify that the guard is applied immediately before the Levenshtein call and that the cached candidate length logic preserves correctness for all edge cases (e.g., empty strings, boundary gaps).", "confidence": 0.12}, "drafts_generated": 1, "drafts_survived": 1}
{"id": "5746f486-71ee-48b9-b712-ac35f9de8904", "target_id": "B3-greedy", "git_sha": "4ba9ccfd68f4e96b43325fec84c49c6c2ee45b28", "pre_experiment_sha": "4ba9ccfd68f4e96b43325fec84c49c6c2ee45b28", "timestamp": "2026-04-19T14:51:24.515533+00:00", "hypothesis": "Cache candidate lengths in the existing records and add one exact length-gap skip immediately before Levenshtein.", "hypothesis_source": "agent", "mutation_diff_summary": "", "score": 106.87, "score_ci_lower": null, "score_ci_upper": null, "raw_scores": null, "baseline_score": 105.82, "outcome": "DISCARDED", "failure_mode": null, "duration_seconds": 32.31237262499053, "tags": ["length-cache", "hot-path", "bounded-levenshtein"], "learnings": "{\"what_changed\":\"\",\"what_improved\":[],\"what_regressed\":[],\"transferable_insight\":\"Adding a lightweight pre-check can improve efficiency only when it reliably filters enough cases to offset its own overhead; otherwise, caching extra metadata may add complexity without measurable benefit.\",\"domain_tags\":[\"optimization\",\"performance\",\"engineering\"]}", "cost_usd": 0.09260260000000002, "bootstrap_seed": 0, "agent_model": "gpt-5.4", "held_out_score": null, "criterion_names": null, "per_criterion_scores": null, "failure_classification": {"category": "logic_error", "description": "The proposed change (caching candidate lengths and adding an exact length-gap skip before Levenshtein) likely produced incorrect filtering or skip logic\u2014skipping cases that should still be evaluated or miscomputing when to bypass Levenshtein\u2014so the intended optimization didn\u2019t preserve correctness.", "fix_direction": "Verify the length-gap skip condition against the true metric definition; add tests covering edge cases (equal lengths, minimal gaps, empty strings, multiple candidates) and confirm cached lengths are sourced consistently and match the compared items before deciding to skip.", "confidence": 0.62}, "drafts_generated": 1, "drafts_survived": 1}
