{"id": "66bcf912-e816-4dd5-ad9a-e44de4fe2c47", "target_id": "B3-greedy", "git_sha": "4ba9ccfd68f4e96b43325fec84c49c6c2ee45b28", "pre_experiment_sha": "4ba9ccfd68f4e96b43325fec84c49c6c2ee45b28", "timestamp": "2026-04-19T14:51:59.672531+00:00", "hypothesis": "Cache candidate lengths in the existing candidate records and add one exact length-gap skip immediately before Levenshtein.", "hypothesis_source": "agent", "mutation_diff_summary": "", "score": 107.36, "score_ci_lower": null, "score_ci_upper": null, "raw_scores": null, "baseline_score": 105.82, "outcome": "DISCARDED", "failure_mode": null, "duration_seconds": 32.6920500829583, "tags": ["length-cache", "hot-path", "minimal-edit"], "learnings": "{\"what_changed\":\"\",\"what_improved\":[],\"what_regressed\":[],\"transferable_insight\":\"Adding a cheap pre-check that rules out obviously non-competitive candidates before an expensive exact comparison can improve efficiency, but only when the pre-check is precise enough to avoid offsetting overhead or missed opportunities.\",\"domain_tags\":[\"optimization\",\"filtering\",\"performance\"]}", "cost_usd": 0.09253880000000002, "bootstrap_seed": 0, "agent_model": "gpt-5.4", "held_out_score": null, "criterion_names": null, "per_criterion_scores": null, "failure_classification": {"category": "logic_error", "description": "The experiment description and failure mode are insufficiently specified to determine how the change broke behavior. No details are provided about the nature of the failure (e.g., wrong outputs, parsing errors, degraded metric vs. inconsistent state).", "fix_direction": "Collect concrete failure evidence (error logs, diff of code, before/after test results, and which assertions/metrics changed) and verify the implementation matches the hypothesis: cache candidate lengths in existing records and insert the exact length-gap skip immediately before the Levenshtein call.", "confidence": 0.12}, "drafts_generated": 1, "drafts_survived": 1}
{"id": "1eab4f7f-dcd7-4c86-a31c-ecbbee953f7d", "target_id": "B3-greedy", "git_sha": "4ba9ccfd68f4e96b43325fec84c49c6c2ee45b28", "pre_experiment_sha": "4ba9ccfd68f4e96b43325fec84c49c6c2ee45b28", "timestamp": "2026-04-19T14:52:35.391062+00:00", "hypothesis": "Cache candidate lengths on both sides and add one exact length-gap guard immediately before Levenshtein.", "hypothesis_source": "agent", "mutation_diff_summary": "", "score": 107.87, "score_ci_lower": null, "score_ci_upper": null, "raw_scores": null, "baseline_score": 105.82, "outcome": "DISCARDED", "failure_mode": null, "duration_seconds": 32.92625404102728, "tags": ["length-cache", "hot-path", "minimal-edit"], "learnings": "{\"what_changed\":\"\",\"what_improved\":[],\"what_regressed\":[],\"transferable_insight\":\"Adding an extra exact-match guard right before an expensive comparison can improve efficiency only when the guard meaningfully filters cases that earlier caching or checks do not already eliminate.\",\"domain_tags\":[\"optimization\",\"filtering\",\"performance\"]}", "cost_usd": 0.092508, "bootstrap_seed": 0, "agent_model": "gpt-5.4", "held_out_score": null, "criterion_names": null, "per_criterion_scores": null, "failure_classification": {"category": "logic_error", "description": "The provided experiment details (hypothesis, failure mode=unknown, score=107.8700) do not include enough information about what actually failed (e.g., parsing error, logic mismatch, format violation, or partial/inconsistent edits). Without the observed failure behavior, the failure cannot be reliably mapped to any listed category.", "fix_direction": "Capture the concrete failure signal (error message/stack trace or diff of output vs expected), and verify whether the change caused format/schema issues, incorrect distance logic, missing guards, or unintended edits outside the intended Levenshtein call site.", "confidence": 0.12}, "drafts_generated": 1, "drafts_survived": 1}
{"id": "9a785f67-381b-4c4c-b208-3ed547da0871", "target_id": "B3-greedy", "git_sha": "4ba9ccfd68f4e96b43325fec84c49c6c2ee45b28", "pre_experiment_sha": "4ba9ccfd68f4e96b43325fec84c49c6c2ee45b28", "timestamp": "2026-04-19T14:53:15.340834+00:00", "hypothesis": "Add one exact pre-Levenshtein length-gap check while reusing cached candidate lengths already stored in bucket entries.", "hypothesis_source": "agent", "mutation_diff_summary": "", "score": 108.32, "score_ci_lower": null, "score_ci_upper": null, "raw_scores": null, "baseline_score": 105.82, "outcome": "DISCARDED", "failure_mode": null, "duration_seconds": 33.10447820893023, "tags": ["length-cache", "hot-path", "minimal-edit"], "learnings": "{\"what_changed\":\"\",\"what_improved\":[],\"what_regressed\":[],\"transferable_insight\":\"A lightweight early-exit check can be worthwhile only when it leverages already-available cached metadata, but if it adds no measurable benefit it should be discarded to avoid unnecessary complexity.\",\"domain_tags\":[\"optimization\",\"software-engineering\",\"performance\"]}", "cost_usd": 0.09284400000000001, "bootstrap_seed": 0, "agent_model": "gpt-5.4", "held_out_score": null, "criterion_names": null, "per_criterion_scores": null, "failure_classification": {"category": "logic_error", "description": "The attempted change to add an additional exact pre-Levenshtein length-gap check while reusing cached candidate lengths did not behave correctly, indicating an error in the interaction between the new check and the cached bucket candidate lengths (likely using stale/incorrect lengths or applying the gap condition inconsistently).", "fix_direction": "Verify the cached candidate length values correspond exactly to the candidates being checked, and ensure the new length-gap filter is applied with the correct threshold and in the correct place relative to other candidate-generation/scoring logic.", "confidence": 0.62}, "drafts_generated": 1, "drafts_survived": 1}
{"id": "253a44e0-ef2e-48da-adc0-cc4aa8086235", "target_id": "B3-greedy", "git_sha": "4ba9ccfd68f4e96b43325fec84c49c6c2ee45b28", "pre_experiment_sha": "4ba9ccfd68f4e96b43325fec84c49c6c2ee45b28", "timestamp": "2026-04-19T14:53:51.977394+00:00", "hypothesis": "Cache candidate lengths in the existing records and add an exact length-gap guard immediately before Levenshtein.", "hypothesis_source": "agent", "mutation_diff_summary": "", "score": 108.08, "score_ci_lower": null, "score_ci_upper": null, "raw_scores": null, "baseline_score": 105.82, "outcome": "DISCARDED", "failure_mode": null, "duration_seconds": 33.76905641693156, "tags": ["length-cache", "hot-path", "minimal-edit"], "learnings": "{\"what_changed\":\"\",\"what_improved\":[],\"what_regressed\":[],\"transferable_insight\":\"When an expensive exact check is unavoidable, adding a cheap pre-filter based on cached metadata can improve efficiency without changing outcomes, but only if the filter is tightly aligned with the exact criterion.\",\"domain_tags\":[\"optimization\",\"filtering\",\"performance\"]}", "cost_usd": 0.092834, "bootstrap_seed": 0, "agent_model": "gpt-5.4", "held_out_score": null, "criterion_names": null, "per_criterion_scores": null, "failure_classification": {"category": "logic_error", "description": "The experiment to add a length-gap guard and cache candidate lengths did not achieve the expected improvement and instead produced a failed result. This suggests the guard/caching logic was applied incorrectly (e.g., wrong gap computation, incorrect ordering/placement relative to Levenshtein, or guard conditions that accidentally exclude valid matches or fail to exclude invalid ones).", "fix_direction": "Re-derive the exact length-gap condition and validate it against representative cases (including edge cases). Then add targeted tests/telemetry to confirm the guard triggers only when it should and that the cached lengths correspond exactly to the records used in the subsequent Levenshtein call.", "confidence": 0.62}, "drafts_generated": 1, "drafts_survived": 1}
