{"id": "e611b123-d7bc-41cb-9eea-687e10891177", "target_id": "B3-greedy", "git_sha": "1fa1d5a114964ec92ec59df808f776e019e84774", "pre_experiment_sha": "3b452d4d4a3bc0f302632065ef61cb2ba6a6552a", "timestamp": "2026-04-19T14:22:43.446079+00:00", "hypothesis": "Use bounded Levenshtein with length-based pruning and set-based deduplication to reduce deterministic runtime.", "hypothesis_source": "agent", "mutation_diff_summary": "", "score": 140.91, "score_ci_lower": null, "score_ci_upper": null, "raw_scores": null, "baseline_score": 550.42, "outcome": "KEPT", "failure_mode": null, "duration_seconds": 32.01435075001791, "tags": ["performance", "dynamic-programming", "pruning", "deduplication"], "learnings": "{\"what_changed\":\"\",\"what_improved\":[],\"what_regressed\":[],\"transferable_insight\":\"Combining early pruning with deduplication can reduce deterministic runtime by avoiding unnecessary work on equivalent or impossible cases.\",\"domain_tags\":[\"algorithm optimization\",\"performance\",\"deduplication\"]}", "cost_usd": 0.078655, "bootstrap_seed": 0, "agent_model": "gpt-5.4", "held_out_score": null, "criterion_names": null, "per_criterion_scores": null, "failure_classification": null, "drafts_generated": 1, "drafts_survived": 1}
{"id": "edbb39d2-6044-423a-b471-24c55bf993ce", "target_id": "B3-greedy", "git_sha": "1fa1d5a114964ec92ec59df808f776e019e84774", "pre_experiment_sha": "1fa1d5a114964ec92ec59df808f776e019e84774", "timestamp": "2026-04-19T14:23:16.747633+00:00", "hypothesis": "Precompute compact candidate buckets and reuse DP buffers to reduce pair-search overhead deterministically.", "hypothesis_source": "agent", "mutation_diff_summary": "", "score": 99999.0, "score_ci_lower": null, "score_ci_upper": null, "raw_scores": null, "baseline_score": 140.91, "outcome": "DISCARDED", "failure_mode": null, "duration_seconds": 32.042759750038385, "tags": ["performance", "bucketing", "dynamic-programming", "deterministic"], "learnings": "{\"what_changed\":\"\",\"what_improved\":[],\"what_regressed\":[],\"transferable_insight\":\"Precomputing reusable candidate groups and reusing working memory can reduce repeated search overhead, but only if the added bookkeeping does not outweigh the savings.\",\"domain_tags\":[\"optimization\",\"algorithm-design\"]}", "cost_usd": 0.08241960000000001, "bootstrap_seed": 0, "agent_model": "gpt-5.4", "held_out_score": null, "criterion_names": null, "per_criterion_scores": null, "failure_classification": {"category": "logic_error", "description": "Failure mode is listed as 'unknown' and no concrete error details are provided (no indication of format/schema issues, logic mistakes, regressions, scope/syntax problems, semantic drift, optimization gaming, or incomplete edits).", "fix_direction": "Re-run with full logs and error traces; capture the failing assertion/stack trace, inputs, and expected outputs so the failure can be mapped to the correct category.", "confidence": 0.05}, "drafts_generated": 1, "drafts_survived": 1}
{"id": "20b1c92f-2204-4056-a283-8a917b5326f7", "target_id": "B3-greedy", "git_sha": "1fa1d5a114964ec92ec59df808f776e019e84774", "pre_experiment_sha": "1fa1d5a114964ec92ec59df808f776e019e84774", "timestamp": "2026-04-19T14:23:49.423268+00:00", "hypothesis": "Pre-bucketing candidates by length and first character will reduce needless distance computations while preserving deterministic output.", "hypothesis_source": "agent", "mutation_diff_summary": "", "score": 99999.0, "score_ci_lower": null, "score_ci_upper": null, "raw_scores": null, "baseline_score": 140.91, "outcome": "DISCARDED", "failure_mode": null, "duration_seconds": 30.146474416949786, "tags": ["performance", "pruning", "indexing"], "learnings": "{\"what_changed\":\"\",\"what_improved\":[],\"what_regressed\":[],\"transferable_insight\":\"A heuristic that reduces work without changing results can still be worthless if it adds overhead or fails to measurably improve the target metric, so validate both efficiency and end-to-end impact before adopting it.\",\"domain_tags\":[\"optimization\",\"experimentation\",\"performance\"]}", "cost_usd": 0.08124900000000002, "bootstrap_seed": 0, "agent_model": "gpt-5.4", "held_out_score": null, "criterion_names": null, "per_criterion_scores": null, "failure_classification": {"category": "incomplete_edit", "description": "The experiment failed with an unspecified ('unknown') failure mode and no clear indicator of output/schema, syntax, or semantic correctness issues. The very high score suggests the run likely left the system in an inconsistent or partially applied state rather than a specific logic/format error.", "fix_direction": "Verify the full integration of the pre-bucketing change end-to-end (data structures built correctly, buckets fully covered, deterministic iteration order preserved), and add assertions/tests that confirm identical outputs to the baseline while measuring distance computation reduction.", "confidence": 0.42}, "drafts_generated": 1, "drafts_survived": 1}
{"id": "c5f2292a-f10d-4e94-bdb1-dd0cecee8da5", "target_id": "B3-greedy", "git_sha": "b47ed617eb6ce4b34609c2e88d9602cf3f59c93e", "pre_experiment_sha": "1fa1d5a114964ec92ec59df808f776e019e84774", "timestamp": "2026-04-19T14:24:28.990105+00:00", "hypothesis": "Deduplicate repeated comparisons up front and bucket candidates by length to avoid redundant and impossible distance checks.", "hypothesis_source": "agent", "mutation_diff_summary": "", "score": 130.05, "score_ci_lower": null, "score_ci_upper": null, "raw_scores": null, "baseline_score": 140.91, "outcome": "KEPT", "failure_mode": null, "duration_seconds": 34.27887920802459, "tags": ["deduplication", "length-bucketing", "exact-pruning", "buffer-reduction"], "learnings": "{\"what_changed\":\"\",\"what_improved\":[],\"what_regressed\":[],\"transferable_insight\":\"Removing duplicate comparisons early and grouping items by a cheap feasibility criterion can eliminate wasted work without changing results.\",\"domain_tags\":[\"optimization\",\"deduplication\",\"filtering\"]}", "cost_usd": 0.082495, "bootstrap_seed": 0, "agent_model": "gpt-5.4", "held_out_score": null, "criterion_names": null, "per_criterion_scores": null, "failure_classification": null, "drafts_generated": 1, "drafts_survived": 1}
{"id": "3cbaa38e-9bf0-4a65-91a4-decd33a018c7", "target_id": "B3-greedy", "git_sha": "f1aab835800735c4beb1ea89c9d1ebea0391142f", "pre_experiment_sha": "b47ed617eb6ce4b34609c2e88d9602cf3f59c93e", "timestamp": "2026-04-19T14:25:02.310367+00:00", "hypothesis": "Reuse DP buffers and tighten candidate generation to reduce exact distance computation overhead without changing results.", "hypothesis_source": "agent", "mutation_diff_summary": "", "score": 108.35, "score_ci_lower": null, "score_ci_upper": null, "raw_scores": null, "baseline_score": 130.05, "outcome": "KEPT", "failure_mode": null, "duration_seconds": 32.21413283306174, "tags": ["levenshtein", "early-exit", "buffer-reuse", "length-pruning", "deduplication"], "learnings": "{\"what_changed\":\"\",\"what_improved\":[],\"what_regressed\":[],\"transferable_insight\":\"Reusing intermediate buffers and narrowing the candidate set can reduce computation overhead while preserving exact outcomes, but only if the optimization does not alter the underlying result set.\",\"domain_tags\":[\"optimization\",\"performance\",\"algorithm-design\"]}", "cost_usd": 0.084885, "bootstrap_seed": 0, "agent_model": "gpt-5.4", "held_out_score": null, "criterion_names": null, "per_criterion_scores": null, "failure_classification": null, "drafts_generated": 1, "drafts_survived": 1}
{"id": "a399ae5a-0ad7-45d7-9878-c1a83b745b09", "target_id": "B3-greedy", "git_sha": "f1aab835800735c4beb1ea89c9d1ebea0391142f", "pre_experiment_sha": "f1aab835800735c4beb1ea89c9d1ebea0391142f", "timestamp": "2026-04-19T14:25:45.858241+00:00", "hypothesis": "Add exact prefix/suffix trimming and a small lower-bound prune before DP to reduce work without changing results.", "hypothesis_source": "agent", "mutation_diff_summary": "", "score": 122.07, "score_ci_lower": null, "score_ci_upper": null, "raw_scores": null, "baseline_score": 108.35, "outcome": "DISCARDED", "failure_mode": null, "duration_seconds": 42.31338354200125, "tags": ["levenshtein", "early-exit", "pruning", "buffer-reuse-safe", "exact"], "learnings": "{\"what_changed\":\"\",\"what_improved\":[],\"what_regressed\":[],\"transferable_insight\":\"Before applying an expensive exact algorithm, remove provably irrelevant boundary work and add a cheap lower-bound check to prune hopeless cases, since this can reduce effort without changing the outcome.\",\"domain_tags\":[\"optimization\",\"algorithms\",\"pruning\"]}", "cost_usd": 0.0935228, "bootstrap_seed": 0, "agent_model": "gpt-5.4", "held_out_score": null, "criterion_names": null, "per_criterion_scores": null, "failure_classification": {"category": "logic_error", "description": "Failure mode is unspecified (\u201cunknown\u201d), so it\u2019s unclear whether the failure is due to logic/math errors, output formatting issues, syntax/config problems, scope violations, or an optimization/regression affecting correctness.", "fix_direction": "Run a differential check against the prior passing version (inputs/outputs), and separately validate (1) output schema/format, (2) DP invariants and pruning correctness, and (3) any edge-case handling for prefix/suffix trimming and lower-bound pruning to isolate which category of failure applies.", "confidence": 0.15}, "drafts_generated": 1, "drafts_survived": 1}
{"id": "23d87a02-aee6-4111-8017-6625eacd2488", "target_id": "B3-greedy", "git_sha": "f1aab835800735c4beb1ea89c9d1ebea0391142f", "pre_experiment_sha": "f1aab835800735c4beb1ea89c9d1ebea0391142f", "timestamp": "2026-04-19T14:26:27.830572+00:00", "hypothesis": "Reduce per-comparison overhead by reusing DP buffers, precomputing lengths, and pruning exact matches before Levenshtein.", "hypothesis_source": "agent", "mutation_diff_summary": "", "score": 109.22, "score_ci_lower": null, "score_ci_upper": null, "raw_scores": null, "baseline_score": 108.35, "outcome": "DISCARDED", "failure_mode": null, "duration_seconds": 36.20398633298464, "tags": ["reuse-buffers", "length-pruning", "exact-match-fastpath", "precompute-lengths"], "learnings": "{\"what_changed\":\"\",\"what_improved\":[],\"what_regressed\":[],\"transferable_insight\":\"When an optimization adds complexity without measurable gains, it should be discarded rather than retained on speculation.\",\"domain_tags\":[\"optimization\",\"experimentation\",\"decision-making\"]}", "cost_usd": 0.0901628, "bootstrap_seed": 0, "agent_model": "gpt-5.4", "held_out_score": null, "criterion_names": null, "per_criterion_scores": null, "failure_classification": {"category": "logic_error", "description": "The experiment intended to reduce per-comparison overhead via buffer reuse, length precomputation, and pruning exact matches before Levenshtein, but the result scored poorly (failure mode listed as unknown). This suggests the optimization introduced incorrect behavior\u2014likely in buffer reuse/size handling or pruning/early-exit logic that altered the computed distance or output semantics.", "fix_direction": "Verify correctness first: add unit tests comparing against a known-good Levenshtein implementation (including edge cases and repeated calls), ensure DP buffers are properly cleared/resized, and confirm early-exit pruning triggers only when distance is guaranteed to be zero (exact match) without affecting subsequent computations.", "confidence": 0.67}, "drafts_generated": 1, "drafts_survived": 1}
{"id": "1d699ae2-a28a-470b-83eb-6afcda0001c3", "target_id": "B3-greedy", "git_sha": "f1aab835800735c4beb1ea89c9d1ebea0391142f", "pre_experiment_sha": "f1aab835800735c4beb1ea89c9d1ebea0391142f", "timestamp": "2026-04-19T14:27:08.968177+00:00", "hypothesis": "Reduce repeated allocation and loop overhead by precomputing candidate buckets and reusing Levenshtein DP buffers.", "hypothesis_source": "agent", "mutation_diff_summary": "", "score": 114.97, "score_ci_lower": null, "score_ci_upper": null, "raw_scores": null, "baseline_score": 108.35, "outcome": "DISCARDED", "failure_mode": null, "duration_seconds": 38.298893208033405, "tags": ["buffer-reuse", "length-pruning", "deduplication", "micro-optimization"], "learnings": "{\"what_changed\":\"\",\"what_improved\":[],\"what_regressed\":[],\"transferable_insight\":\"Optimizations that add precomputation or reuse can still fail to help if the overhead they remove is not the dominant cost or if the added complexity offsets the gains.\",\"domain_tags\":[\"performance-optimization\",\"software-engineering\",\"systems-design\"]}", "cost_usd": 0.090446, "bootstrap_seed": 0, "agent_model": "gpt-5.4", "held_out_score": null, "criterion_names": null, "per_criterion_scores": null, "failure_classification": {"category": "logic_error", "description": "The experiment result (score 114.97) and provided metadata do not specify what failed (e.g., formatting mismatch, incorrect logic, regression, parse error, semantic change, optimization gaming, or incomplete edits). Without additional error logs or diff details, the failure mode cannot be reliably mapped to any listed category.", "fix_direction": "Provide the failing artifact details (error message/stack trace, input-output example, or code/config diff) so the failure can be attributed to output/logic/regression/scope/syntax/semantic/over-optimization/incomplete state.", "confidence": 0.05}, "drafts_generated": 1, "drafts_survived": 1}
{"id": "22c89c95-f8c6-4285-a9ba-9a09fc3c1082", "target_id": "B3-greedy", "git_sha": "ff744d7a93ad215e91536b4582486080e4577bac", "pre_experiment_sha": "f1aab835800735c4beb1ea89c9d1ebea0391142f", "timestamp": "2026-04-19T14:27:44.990507+00:00", "hypothesis": "Reuse Levenshtein DP buffers and avoid unnecessary post-processing by emitting already-unique pairs directly.", "hypothesis_source": "agent", "mutation_diff_summary": "", "score": 107.85, "score_ci_lower": null, "score_ci_upper": null, "raw_scores": null, "baseline_score": 108.35, "outcome": "KEPT", "failure_mode": null, "duration_seconds": 33.421951250056736, "tags": ["buffer-reuse", "exact-pruning", "deduplication"], "learnings": "{\"what_changed\":\"\",\"what_improved\":[],\"what_regressed\":[],\"transferable_insight\":\"Reducing repeated allocation and eliminating redundant cleanup steps can improve efficiency without changing results.\",\"domain_tags\":[\"optimization\",\"software-engineering\",\"performance\"]}", "cost_usd": 0.08790500000000001, "bootstrap_seed": 0, "agent_model": "gpt-5.4", "held_out_score": null, "criterion_names": null, "per_criterion_scores": null, "failure_classification": null, "drafts_generated": 1, "drafts_survived": 1}
{"id": "3fcd3465-260f-4538-9473-3cad3df54dd2", "target_id": "B3-greedy", "git_sha": "4d23e5640abe1263798aef4bd5120e6eb152988c", "pre_experiment_sha": "ff744d7a93ad215e91536b4582486080e4577bac", "timestamp": "2026-04-19T14:28:24.840216+00:00", "hypothesis": "Reduce repeated work by precomputing candidate lengths and using tighter exact length pruning before each distance call.", "hypothesis_source": "agent", "mutation_diff_summary": "", "score": 107.39, "score_ci_lower": null, "score_ci_upper": null, "raw_scores": null, "baseline_score": 107.85, "outcome": "KEPT", "failure_mode": null, "duration_seconds": 35.436301457928494, "tags": ["length-pruning", "precompute", "buffer-reuse", "conservative"], "learnings": "{\"what_changed\":\"\",\"what_improved\":[],\"what_regressed\":[],\"transferable_insight\":\"Precomputing reusable candidates and applying exact early pruning before expensive operations can reduce redundant work without changing results.\",\"domain_tags\":[\"optimization\",\"algorithm design\"]}", "cost_usd": 0.08955000000000002, "bootstrap_seed": 0, "agent_model": "gpt-5.4", "held_out_score": null, "criterion_names": null, "per_criterion_scores": null, "failure_classification": null, "drafts_generated": 1, "drafts_survived": 1}
{"id": "b993a0c5-1e73-4244-9372-1e4bb7db0817", "target_id": "B3-greedy", "git_sha": "87f0785909ac4835a118e9b197bef68d0e31ff1b", "pre_experiment_sha": "4d23e5640abe1263798aef4bd5120e6eb152988c", "timestamp": "2026-04-19T14:28:59.026802+00:00", "hypothesis": "Reduce loop overhead by iterating only exact candidate length ranges and removing redundant checks.", "hypothesis_source": "agent", "mutation_diff_summary": "", "score": 106.81, "score_ci_lower": null, "score_ci_upper": null, "raw_scores": null, "baseline_score": 107.39, "outcome": "KEPT", "failure_mode": null, "duration_seconds": 32.66541654197499, "tags": ["length-pruning", "loop-optimization", "exact-preserving"], "learnings": "{\"what_changed\":\"\",\"what_improved\":[],\"what_regressed\":[],\"transferable_insight\":\"Narrowing iteration to only the necessary candidate range can reduce overhead, but if the optimization adds complexity without eliminating meaningful work, it may not improve overall performance.\",\"domain_tags\":[\"optimization\",\"performance\",\"algorithm-design\"]}", "cost_usd": 0.08899, "bootstrap_seed": 0, "agent_model": "gpt-5.4", "held_out_score": null, "criterion_names": null, "per_criterion_scores": null, "failure_classification": null, "drafts_generated": 1, "drafts_survived": 1}
{"id": "dbb5f7db-2d20-406c-9ea8-369a8f691351", "target_id": "B3-greedy", "git_sha": "87f0785909ac4835a118e9b197bef68d0e31ff1b", "pre_experiment_sha": "87f0785909ac4835a118e9b197bef68d0e31ff1b", "timestamp": "2026-04-19T14:29:35.900744+00:00", "hypothesis": "Reduce repeated dictionary lookups and per-call overhead by precomputing bucket ranges and localizing hot-path values while preserving exact matching.", "hypothesis_source": "agent", "mutation_diff_summary": "", "score": 116.97, "score_ci_lower": null, "score_ci_upper": null, "raw_scores": null, "baseline_score": 106.81, "outcome": "DISCARDED", "failure_mode": null, "duration_seconds": 35.282768416102044, "tags": ["length-pruning", "buffer-reuse", "hot-path", "conservative"], "learnings": "{\"what_changed\":\"\",\"what_improved\":[],\"what_regressed\":[],\"transferable_insight\":\"Precomputing stable lookup boundaries and caching frequently used values can reduce repeated work, but only if the added setup and indirection do not outweigh the savings in the hot path.\",\"domain_tags\":[\"performance-optimization\",\"caching\",\"algorithm-design\"]}", "cost_usd": 0.091104, "bootstrap_seed": 0, "agent_model": "gpt-5.4", "held_out_score": null, "criterion_names": null, "per_criterion_scores": null, "failure_classification": {"category": "over_optimization", "description": "The change appears to have targeted performance by precomputing bucket ranges/localizing values, but the experiment failed despite a high score, suggesting the optimization altered behavior in a way that the evaluation detects (e.g., subtle edge-case mismatch while trying to preserve exact matching).", "fix_direction": "Re-validate exact-match semantics across boundary conditions (bucket edges, empty/degenerate buckets, duplicates, out-of-range keys) and compare results against a known-good baseline; add regression tests specifically for equality correctness while profiling only after correctness is confirmed.", "confidence": 0.62}, "drafts_generated": 1, "drafts_survived": 1}
{"id": "7baff1eb-faa0-489c-a5cb-9dad720d9efa", "target_id": "B3-greedy", "git_sha": "87f0785909ac4835a118e9b197bef68d0e31ff1b", "pre_experiment_sha": "87f0785909ac4835a118e9b197bef68d0e31ff1b", "timestamp": "2026-04-19T14:30:16.585117+00:00", "hypothesis": "Reduce overhead by avoiding sparse length-range scans and short-circuiting exact string matches before DP.", "hypothesis_source": "agent", "mutation_diff_summary": "", "score": 108.01, "score_ci_lower": null, "score_ci_upper": null, "raw_scores": null, "baseline_score": 106.81, "outcome": "DISCARDED", "failure_mode": null, "duration_seconds": 34.79630066594109, "tags": ["length-pruning", "exact-match-fastpath", "small-local-optimization"], "learnings": "{\"what_changed\":\"\",\"what_improved\":[],\"what_regressed\":[],\"transferable_insight\":\"When an optimization adds control-flow complexity without measurable gains, it is often better to discard it and keep the simpler, more predictable path.\",\"domain_tags\":[\"optimization\",\"software-engineering\",\"performance\"]}", "cost_usd": 0.09063500000000001, "bootstrap_seed": 0, "agent_model": "gpt-5.4", "held_out_score": null, "criterion_names": null, "per_criterion_scores": null, "failure_classification": {"category": "logic_error", "description": "Failure mode is unspecified. While the hypothesis suggests a performance optimization (avoiding sparse length-range scans and short-circuiting exact string matches), the failure reason is not provided, so the error cannot be reliably mapped to output/schema, logic, regression, scope, syntax, semantic meaning, or optimization gaming.", "fix_direction": "Capture the failing behavior (error logs, failing test case, or diff/trace), then verify (1) output format matches the expected schema, (2) DP correctness with and without the new short-circuit/scan behavior, and (3) that the change doesn\u2019t alter semantics or evaluation criteria.", "confidence": 0.15}, "drafts_generated": 1, "drafts_survived": 1}
