{"id": "9b1dfefc-5843-4680-b2d7-e27d0ffeaf67", "target_id": "B3-greedy", "git_sha": "81c898d91ab4a31cd0a0d39047c4e4a55568f9a5", "pre_experiment_sha": "81c898d91ab4a31cd0a0d39047c4e4a55568f9a5", "timestamp": "2026-04-19T14:37:54.454917+00:00", "hypothesis": "Cache candidate string lengths inside buckets to avoid repeated len calls in the hot comparison path while preserving exact behavior.", "hypothesis_source": "agent", "mutation_diff_summary": "", "score": 106.22, "score_ci_lower": null, "score_ci_upper": null, "raw_scores": null, "baseline_score": 106.15, "outcome": "DISCARDED", "failure_mode": null, "duration_seconds": 33.89093245798722, "tags": ["length-caching", "hot-path", "conservative"], "learnings": "{\"what_changed\":\"\",\"what_improved\":[],\"what_regressed\":[],\"transferable_insight\":\"Micro-optimizations that reduce repeated work in a hot path should only be kept if they measurably improve performance without adding complexity or changing behavior; otherwise they are not worth retaining.\",\"domain_tags\":[\"performance-optimization\",\"software-engineering\"]}", "cost_usd": 0.09219800000000002, "bootstrap_seed": 0, "agent_model": "gpt-5.4", "held_out_score": null, "criterion_names": null, "per_criterion_scores": null, "failure_classification": {"category": "incomplete_edit", "description": "The experiment failed under an undefined/unknown failure mode, with no clear indication that a specific criterion regressed or that semantics/format were preserved; this suggests the change was likely partially implemented (e.g., bucketization/caching not fully applied or not wired correctly across all relevant comparison paths), leaving the system in an inconsistent or incomplete state.", "fix_direction": "Ensure the cache/bucketing of candidate string lengths is implemented end-to-end for every hot-path comparison that depends on length, verify correctness by running exhaustive equivalence tests against the original behavior for all edge cases (empty strings, multibyte/Unicode handling, null/optional values), and add assertions/telemetry to confirm cache hits/misses align with intended logic.", "confidence": 0.42}, "drafts_generated": 1, "drafts_survived": 1}
{"id": "bcaf4b0e-3a4e-4934-9d45-dca13c3321af", "target_id": "B3-greedy", "git_sha": "4ba9ccfd68f4e96b43325fec84c49c6c2ee45b28", "pre_experiment_sha": "81c898d91ab4a31cd0a0d39047c4e4a55568f9a5", "timestamp": "2026-04-19T14:38:30.361149+00:00", "hypothesis": "Cache candidate lengths directly inside buckets to remove repeated len work in the hot comparison path.", "hypothesis_source": "agent", "mutation_diff_summary": "", "score": 105.82, "score_ci_lower": null, "score_ci_upper": null, "raw_scores": null, "baseline_score": 106.15, "outcome": "KEPT", "failure_mode": null, "duration_seconds": 32.85116049996577, "tags": ["length-caching", "hot-path", "conservative"], "learnings": "{\"what_changed\":\"\",\"what_improved\":[],\"what_regressed\":[],\"transferable_insight\":\"When optimizing a hot path, precomputing and storing frequently reused metadata alongside the primary data can reduce repeated work without changing behavior.\",\"domain_tags\":[\"performance-optimization\",\"data-structures\",\"systems-design\"]}", "cost_usd": 0.09143000000000001, "bootstrap_seed": 0, "agent_model": "gpt-5.4", "held_out_score": null, "criterion_names": null, "per_criterion_scores": null, "failure_classification": null, "drafts_generated": 1, "drafts_survived": 1}
{"id": "fb41efc2-cea8-414e-b0dd-849e67eb9fbc", "target_id": "B3-greedy", "git_sha": "4ba9ccfd68f4e96b43325fec84c49c6c2ee45b28", "pre_experiment_sha": "4ba9ccfd68f4e96b43325fec84c49c6c2ee45b28", "timestamp": "2026-04-19T14:39:05.242935+00:00", "hypothesis": "Avoid scanning impossible bucket lengths by iterating only the exact threshold-bounded length range.", "hypothesis_source": "agent", "mutation_diff_summary": "", "score": 106.36, "score_ci_lower": null, "score_ci_upper": null, "raw_scores": null, "baseline_score": 105.82, "outcome": "DISCARDED", "failure_mode": null, "duration_seconds": 33.78834441700019, "tags": ["length-caching", "exact-pruning", "hot-path"], "learnings": "{\"what_changed\":\"\",\"what_improved\":[],\"what_regressed\":[],\"transferable_insight\":\"When a search space is constrained by a threshold, restricting iteration to the exact feasible range can reduce wasted work, but only if the added filtering overhead does not outweigh the savings.\",\"domain_tags\":[\"optimization\",\"search-space\",\"performance\"]}", "cost_usd": 0.09152980000000001, "bootstrap_seed": 0, "agent_model": "gpt-5.4", "held_out_score": null, "criterion_names": null, "per_criterion_scores": null, "failure_classification": {"category": "logic_error", "description": "The failure indicates the implementation did not correctly enforce the intended exact threshold-bounded length range, likely resulting in scanning/considering impossible bucket lengths despite the hypothesis to iterate only within that bounded range.", "fix_direction": "Tighten the loop/range logic to strictly iterate over the exact valid length interval derived from the threshold bounds; add assertions/tests to confirm no out-of-range lengths are generated or processed.", "confidence": 0.62}, "drafts_generated": 1, "drafts_survived": 1}
{"id": "8f0cbba5-d962-4ca0-a3b0-d53f4b00bcb9", "target_id": "B3-greedy", "git_sha": "4ba9ccfd68f4e96b43325fec84c49c6c2ee45b28", "pre_experiment_sha": "4ba9ccfd68f4e96b43325fec84c49c6c2ee45b28", "timestamp": "2026-04-19T14:39:47.017965+00:00", "hypothesis": "Cache candidate lengths for list A once and use exact length-gap pruning before Levenshtein in the hot loop.", "hypothesis_source": "agent", "mutation_diff_summary": "", "score": 107.65, "score_ci_lower": null, "score_ci_upper": null, "raw_scores": null, "baseline_score": 105.82, "outcome": "DISCARDED", "failure_mode": null, "duration_seconds": 34.958898375043646, "tags": ["length-caching", "exact-pruning", "hot-path"], "learnings": "{\"what_changed\":\"\",\"what_improved\":[],\"what_regressed\":[],\"transferable_insight\":\"Precomputing cheap, reusable bounds and applying them before expensive exact checks can improve efficiency, but only if the added bookkeeping actually reduces work in the hot path.\",\"domain_tags\":[\"optimization\",\"algorithm-design\",\"performance\"]}", "cost_usd": 0.09267760000000001, "bootstrap_seed": 0, "agent_model": "gpt-5.4", "held_out_score": null, "criterion_names": null, "per_criterion_scores": null, "failure_classification": {"category": "incomplete_edit", "description": "The failure mode is listed as unknown, and the hypothesis suggests adding caching and pruning in the hot loop. This typically fails when the cache/pruning logic is only partially integrated (e.g., not consistently applied across all paths, stale/incorrect cached lengths used, or pruning conditions mismatched with the Levenshtein computation), leaving the system in an inconsistent or incomplete state.", "fix_direction": "Ensure end-to-end integration: cache candidate lengths for all relevant list-A candidates, apply length-gap pruning consistently before any Levenshtein call, and validate that cached values are correct (no stale reads) and that pruning thresholds match the exact similarity logic used downstream.", "confidence": 0.46}, "drafts_generated": 1, "drafts_survived": 1}
{"id": "8dab8fe7-0c6c-46bd-9135-753bf1403167", "target_id": "B3-greedy", "git_sha": "4ba9ccfd68f4e96b43325fec84c49c6c2ee45b28", "pre_experiment_sha": "4ba9ccfd68f4e96b43325fec84c49c6c2ee45b28", "timestamp": "2026-04-19T14:40:23.820001+00:00", "hypothesis": "Cache and reuse candidate lengths in the hot loop while adding an exact pre-Levenshtein length-gap skip.", "hypothesis_source": "agent", "mutation_diff_summary": "", "score": 108.14, "score_ci_lower": null, "score_ci_upper": null, "raw_scores": null, "baseline_score": 105.82, "outcome": "DISCARDED", "failure_mode": null, "duration_seconds": 33.92841454199515, "tags": ["length-caching", "exact-pruning", "hot-path"], "learnings": "{\"what_changed\":\"\",\"what_improved\":[],\"what_regressed\":[],\"transferable_insight\":\"Adding a cheap exact pre-check can improve performance only when its overhead is lower than the work it avoids; otherwise, caching and extra branching in a hot path may yield no measurable benefit.\",\"domain_tags\":[\"performance-optimization\",\"algorithm-design\",\"software-engineering\"]}", "cost_usd": 0.09264780000000002, "bootstrap_seed": 0, "agent_model": "gpt-5.4", "held_out_score": null, "criterion_names": null, "per_criterion_scores": null, "failure_classification": {"category": "logic_error", "description": "The modification intended to optimize the hot loop by caching candidate lengths and adding a pre-Levenshtein length-gap skip did not preserve correct behavior. The result indicates the skip/caching logic likely caused candidates to be incorrectly pruned or miscomputed, producing a wrong distance/selection despite the change being conceptually sound.", "fix_direction": "Validate the length-gap pruning condition against the exact distance metric used (including edge cases like substitutions/insertions), and add tests that compare optimized vs baseline outputs for a wide range of lengths and characters to ensure cached lengths are referenced correctly and the skip never excludes true matches.", "confidence": 0.62}, "drafts_generated": 1, "drafts_survived": 1}
{"id": "cab96037-85e2-40dd-8190-c0a7f63cf407", "target_id": "B3-greedy", "git_sha": "4ba9ccfd68f4e96b43325fec84c49c6c2ee45b28", "pre_experiment_sha": "4ba9ccfd68f4e96b43325fec84c49c6c2ee45b28", "timestamp": "2026-04-19T14:41:06.387780+00:00", "hypothesis": "Cache bucket length bounds and add an exact length-gap skip before Levenshtein to remove redundant hot-loop work.", "hypothesis_source": "agent", "mutation_diff_summary": "", "score": 106.71, "score_ci_lower": null, "score_ci_upper": null, "raw_scores": null, "baseline_score": 105.82, "outcome": "DISCARDED", "failure_mode": null, "duration_seconds": 39.7275374160381, "tags": ["length-caching", "exact-pruning", "hot-path"], "learnings": "{\"what_changed\":\"\",\"what_improved\":[],\"what_regressed\":[],\"transferable_insight\":\"Adding a cheap exact pre-check to rule out impossible candidates before an expensive inner-loop computation can reduce redundant work without changing results.\",\"domain_tags\":[\"optimization\",\"algorithm-design\",\"performance\"]}", "cost_usd": 0.0924736, "bootstrap_seed": 0, "agent_model": "gpt-5.4", "held_out_score": null, "criterion_names": null, "per_criterion_scores": null, "failure_classification": {"category": "logic_error", "description": "The change aimed to prune redundant work via cache bucket length bounds and a length-gap skip before Levenshtein, but the experiment failed\u2014implying the pruning/skip logic likely excluded valid candidates or miscomputed the length-gap condition, leading to incorrect results despite the intended performance optimization.", "fix_direction": "Validate the length-gap skip correctness across all edge cases (equal lengths, near-threshold gaps, empty/NULL strings, multibyte lengths). Add invariant tests comparing against a baseline Levenshtein pipeline and instrument skipped paths to ensure no true matches are filtered out.", "confidence": 0.62}, "drafts_generated": 1, "drafts_survived": 1}
{"id": "c2e319c6-2db0-4d50-b30e-6f66dde6c870", "target_id": "B3-greedy", "git_sha": "4ba9ccfd68f4e96b43325fec84c49c6c2ee45b28", "pre_experiment_sha": "4ba9ccfd68f4e96b43325fec84c49c6c2ee45b28", "timestamp": "2026-04-19T14:41:49.480114+00:00", "hypothesis": "Cache string lengths in candidate entries and add an exact length-gap skip before Levenshtein.", "hypothesis_source": "agent", "mutation_diff_summary": "", "score": 107.19, "score_ci_lower": null, "score_ci_upper": null, "raw_scores": null, "baseline_score": 105.82, "outcome": "DISCARDED", "failure_mode": null, "duration_seconds": 36.75977133307606, "tags": ["length-caching", "exact-pruning", "hot-path"], "learnings": "{\"what_changed\":\"\",\"what_improved\":[],\"what_regressed\":[],\"transferable_insight\":\"A micro-optimization that adds bookkeeping and an early filter should only be kept if it measurably reduces total work without introducing enough overhead to offset the savings.\",\"domain_tags\":[\"optimization\",\"performance-engineering\",\"algorithm-design\"]}", "cost_usd": 0.091865, "bootstrap_seed": 0, "agent_model": "gpt-5.4", "held_out_score": null, "criterion_names": null, "per_criterion_scores": null, "failure_classification": {"category": "logic_error", "description": "The provided details (hypothesis and failure mode set to 'unknown') don\u2019t indicate what specifically went wrong\u2014e.g., whether it was incorrect logic, degraded behavior, formatting, parsing, or an incomplete/invalid change. Without the actual failure symptom, code diff, or error message tied to the score, the failure category can\u2019t be determined.", "fix_direction": "Capture the concrete failure signal (error logs, exception stack trace, diff, and before/after behavior), and re-check whether the change affects correctness, output structure, or parsing; then rerun focused tests comparing candidates vs. baseline Levenshtein results.", "confidence": 0.12}, "drafts_generated": 1, "drafts_survived": 1}
{"id": "5e517340-b517-4d0b-964f-602c49f39d0f", "target_id": "B3-greedy", "git_sha": "4ba9ccfd68f4e96b43325fec84c49c6c2ee45b28", "pre_experiment_sha": "4ba9ccfd68f4e96b43325fec84c49c6c2ee45b28", "timestamp": "2026-04-19T14:42:26.160653+00:00", "hypothesis": "Cache candidate lengths for both sides and add an exact length-gap skip immediately before Levenshtein.", "hypothesis_source": "agent", "mutation_diff_summary": "", "score": 107.08, "score_ci_lower": null, "score_ci_upper": null, "raw_scores": null, "baseline_score": 105.82, "outcome": "DISCARDED", "failure_mode": null, "duration_seconds": 34.14042841689661, "tags": ["length-caching", "exact-pruning", "hot-path"], "learnings": "{\"what_changed\":\"\",\"what_improved\":[],\"what_regressed\":[],\"transferable_insight\":\"Adding an extra pre-check can simplify control flow, but if it does not eliminate enough expensive work to outweigh its own overhead, the optimization is not worthwhile.\",\"domain_tags\":[\"optimization\",\"performance\",\"algorithm-design\"]}", "cost_usd": 0.09212600000000001, "bootstrap_seed": 0, "agent_model": "gpt-5.4", "held_out_score": null, "criterion_names": null, "per_criterion_scores": null, "failure_classification": {"category": "logic_error", "description": "The attempted optimization (cache candidate lengths and apply an exact length-gap skip before Levenshtein) failed, indicating the skip condition or length-gap logic likely did not preserve the correct equivalence between edit distance and the early-exit rule. This means the change altered the intended meaning of the matching/filtering step rather than just performance.", "fix_direction": "Validate the mathematical condition for when a length-gap guarantees the edit distance exceeds the threshold; add unit tests covering boundary cases (equal lengths, off-by-one gaps, multi-byte/normalization effects) and confirm cached lengths correspond to the same normalization used by Levenshtein.", "confidence": 0.62}, "drafts_generated": 1, "drafts_survived": 1}
{"id": "e4351a60-4460-4e6a-a55e-9339bc8e00a6", "target_id": "B3-greedy", "git_sha": "4ba9ccfd68f4e96b43325fec84c49c6c2ee45b28", "pre_experiment_sha": "4ba9ccfd68f4e96b43325fec84c49c6c2ee45b28", "timestamp": "2026-04-19T14:43:04.043601+00:00", "hypothesis": "Cache candidate lengths in the B buckets and use an exact length-gap skip before Levenshtein without changing iteration order or tie behavior.", "hypothesis_source": "agent", "mutation_diff_summary": "", "score": 107.02, "score_ci_lower": null, "score_ci_upper": null, "raw_scores": null, "baseline_score": 105.82, "outcome": "DISCARDED", "failure_mode": null, "duration_seconds": 34.70107441698201, "tags": ["length-cache", "exact-pruning", "hot-path"], "learnings": "{\"what_changed\":\"\",\"what_improved\":[],\"what_regressed\":[],\"transferable_insight\":\"A performance optimization that preserves control flow and tie-breaking can still be discarded if it adds complexity without producing measurable gains.\",\"domain_tags\":[\"optimization\",\"evaluation\",\"tradeoff\"]}", "cost_usd": 0.09200660000000001, "bootstrap_seed": 0, "agent_model": "gpt-5.4", "held_out_score": null, "criterion_names": null, "per_criterion_scores": null, "failure_classification": {"category": "logic_error", "description": "The provided information does not include enough detail about what actually failed (error logs, behavioral diffs, or which criterion/tie logic changed). Only the hypothesis, an unspecified 'unknown' failure mode, and a numeric score are given, so the failure cause can\u2019t be reliably mapped to a specific category.", "fix_direction": "Reproduce with instrumentation to capture whether iteration order and tie behavior changed, verify the length-gap skip is applied without skipping valid candidates, and check for any partial/inconsistent updates to the B-bucket cache before comparing Levenshtein candidates.", "confidence": 0.05}, "drafts_generated": 1, "drafts_survived": 1}
{"id": "43f2f688-c26c-47b9-b42a-71a64419f33d", "target_id": "B3-greedy", "git_sha": "4ba9ccfd68f4e96b43325fec84c49c6c2ee45b28", "pre_experiment_sha": "4ba9ccfd68f4e96b43325fec84c49c6c2ee45b28", "timestamp": "2026-04-19T14:43:47.431685+00:00", "hypothesis": "Cache string lengths in candidate entries and use them for an exact pre-Levenshtein length-gap skip.", "hypothesis_source": "agent", "mutation_diff_summary": "", "score": 106.53, "score_ci_lower": null, "score_ci_upper": null, "raw_scores": null, "baseline_score": 105.82, "outcome": "DISCARDED", "failure_mode": null, "duration_seconds": 36.243121208040975, "tags": ["length-cache", "hot-path", "exact-pruning"], "learnings": "{\"what_changed\":\"\",\"what_improved\":[],\"what_regressed\":[],\"transferable_insight\":\"Precomputing cheap, exact filters can reduce unnecessary expensive work, but only if the added bookkeeping meaningfully improves overall efficiency.\",\"domain_tags\":[\"optimization\",\"performance-engineering\",\"algorithm-design\"]}", "cost_usd": 0.09205760000000002, "bootstrap_seed": 0, "agent_model": "gpt-5.4", "held_out_score": null, "criterion_names": null, "per_criterion_scores": null, "failure_classification": {"category": "logic_error", "description": "The provided information does not include enough detail about what failed (e.g., actual output differences, runtime/parse errors, or which criterion degraded). Only the hypothesis about caching string lengths and a score are given, but no observed failure behavior to map to a specific category.", "fix_direction": "Capture concrete failure evidence (error logs, diff of expected vs actual output, failing test/criterion name) and verify the length-gap skip logic against exact/edge cases to determine whether the issue is semantic (wrong skip), regression, or output/state inconsistency.", "confidence": 0.18}, "drafts_generated": 1, "drafts_survived": 1}
{"id": "582c4b2c-bbc8-40e1-9bc1-2ac548a98f11", "target_id": "B3-greedy", "git_sha": "4ba9ccfd68f4e96b43325fec84c49c6c2ee45b28", "pre_experiment_sha": "4ba9ccfd68f4e96b43325fec84c49c6c2ee45b28", "timestamp": "2026-04-19T14:44:25.653723+00:00", "hypothesis": "Cache candidate string lengths once and reuse them in the hot comparison loop with an exact length-gap skip.", "hypothesis_source": "agent", "mutation_diff_summary": "", "score": 107.67, "score_ci_lower": null, "score_ci_upper": null, "raw_scores": null, "baseline_score": 105.82, "outcome": "DISCARDED", "failure_mode": null, "duration_seconds": 35.74087887490168, "tags": ["length-cache", "hot-path", "exact-pruning"], "learnings": "{\"what_changed\":\"\",\"what_improved\":[],\"what_regressed\":[],\"transferable_insight\":\"Optimizations that add bookkeeping without changing the core decision path can fail to deliver gains, so validate that any cached metadata or shortcut actually reduces work in the hottest loop before adopting it.\",\"domain_tags\":[\"performance-optimization\",\"algorithm-design\",\"software-engineering\"]}", "cost_usd": 0.0918134, "bootstrap_seed": 0, "agent_model": "gpt-5.4", "held_out_score": null, "criterion_names": null, "per_criterion_scores": null, "failure_classification": {"category": "logic_error", "description": "The failed experiment score increased but the expected behavior from the hypothesis (caching candidate string lengths and using an exact length-gap skip in the hot comparison loop) appears not to have been applied correctly or did not produce correct comparisons. This suggests a mistake in the calculation/usage of length differences (e.g., off-by-one, mismatch with actual comparison logic, or using cached lengths incorrectly).", "fix_direction": "Verify the length-gap skip condition against the exact comparison semantics (including edge cases), ensure cached lengths correspond to the same strings/encodings used in comparison, and add targeted tests/assertions for boundary lengths and early-exit correctness.", "confidence": 0.62}, "drafts_generated": 1, "drafts_survived": 1}
