{"id": "653cff95-46fd-4647-8127-3db38eeac1e8", "target_id": "B3-greedy", "git_sha": "65e0e0a64c9904582da9ef0b556b61c0aa9f4c1c", "pre_experiment_sha": "65e0e0a64c9904582da9ef0b556b61c0aa9f4c1c", "timestamp": "2026-04-21T00:09:38.721879+00:00", "hypothesis": "Remove string swapping to avoid overhead, use `abs()` for length difference check, and split the DP row iteration into two distinct `for` loops using `range()` to completely eliminate the `i <= threshold` conditional check inside the outer loop.", "hypothesis_source": "agent", "mutation_diff_summary": "", "score": 80.28, "score_ci_lower": null, "score_ci_upper": null, "raw_scores": null, "baseline_score": 73.51, "outcome": "DISCARDED", "failure_mode": null, "duration_seconds": 87.45001062517986, "tags": ["levenshtein", "dp-optimization", "loop-splitting", "early-exit"], "learnings": "{\"what_changed\":\"\",\"what_improved\":[],\"what_regressed\":[],\"transferable_insight\":\"Eliminating conditional checks by splitting loops can degrade overall performance if it requires abandoning structural optimizations that minimize memory footprint or iteration space.\",\"domain_tags\":[\"Algorithm Optimization\",\"Memory Management\",\"Micro-optimization\"]}", "cost_usd": 0.03914465, "bootstrap_seed": 0, "agent_model": "gemini-3.1-pro-preview", "held_out_score": null, "criterion_names": null, "per_criterion_scores": null, "failure_classification": {"category": "logic_error", "description": "The experiment's micro-optimizations, such as using `abs()` for length differences or splitting DP row iterations to eliminate conditional checks, likely introduced a correctness bug. These types of changes are prone to subtle errors like incorrect boundary conditions, off-by-one mistakes, or altered computational paths. The score of 80.2800, which is not a perfect score (like 100) or an execution time (like ms), strongly suggests partial correctness, meaning the code runs but produces incorrect results in a significant number of cases.", "fix_direction": "Thoroughly review the modified code for logical correctness, paying close attention to loop bounds, array indexing, and how the `abs()` function impacts subsequent calculations. Implement comprehensive unit tests, especially for edge cases, to isolate the specific change that introduced the bug. Consider reverting changes one by one to identify the faulty optimization and then meticulously re-implement it with correctness as the primary goal, before re-evaluating for performance.", "confidence": 0.9}, "drafts_generated": 1, "drafts_survived": 1}
{"id": "6d7c6a5f-b50f-4537-81cf-4ab8a844c15d", "target_id": "B3-greedy", "git_sha": "65e0e0a64c9904582da9ef0b556b61c0aa9f4c1c", "pre_experiment_sha": "65e0e0a64c9904582da9ef0b556b61c0aa9f4c1c", "timestamp": "2026-04-21T00:12:09.675422+00:00", "hypothesis": "Split the DP row iteration into two standard loops to eliminate redundant `min_v` tracking in early rows and remove the string swap logic to strictly adhere to optimization boundaries.", "hypothesis_source": "agent", "mutation_diff_summary": "", "score": 79.7, "score_ci_lower": null, "score_ci_upper": null, "raw_scores": null, "baseline_score": 73.51, "outcome": "DISCARDED", "failure_mode": null, "duration_seconds": 120.58031437499449, "tags": ["loop-splitting", "dp-optimization", "early-exit"], "learnings": "{\"what_changed\":\"\",\"what_improved\":[],\"what_regressed\":[],\"transferable_insight\":\"Splitting iterative processes into multiple loops to eliminate minor redundant tracking can degrade performance by increasing loop overhead and disrupting established memory optimization patterns.\",\"domain_tags\":[\"Loop Optimization\",\"Algorithm Optimization\",\"Performance Tuning\"]}", "cost_usd": 0.0388104, "bootstrap_seed": 0, "agent_model": "gemini-3.1-pro-preview", "held_out_score": null, "criterion_names": null, "per_criterion_scores": null, "failure_classification": {"category": "logic_error", "description": "The attempt to optimize the DP solution by splitting loops and removing `min_v` tracking and string swap logic introduced an error in the core algorithm, causing it to produce incorrect results for some cases, leading to a score of 79.7.", "fix_direction": "Thoroughly debug the modified DP iteration logic. Focus on comparing the new two-loop structure and the absence of `min_v` tracking/string swap against the original, correct algorithm (if available) or known test cases. Identify specific inputs where the new logic deviates and produces an incorrect result, then re-evaluate the necessity and correctness of the removed components in those contexts.", "confidence": 0.9}, "drafts_generated": 1, "drafts_survived": 1}
{"id": "0ec5376a-6c11-4672-bb85-9318d5afec01", "target_id": "B3-greedy", "git_sha": "65e0e0a64c9904582da9ef0b556b61c0aa9f4c1c", "pre_experiment_sha": "65e0e0a64c9904582da9ef0b556b61c0aa9f4c1c", "timestamp": "2026-04-21T00:13:50.737624+00:00", "hypothesis": "Split the DP row iteration into two standard loops to eliminate redundant `min_v` tracking in early rows, remove string swapping, and restore nested `else: if` blocks to avoid `elif` overhead.", "hypothesis_source": "agent", "mutation_diff_summary": "", "score": 80.41, "score_ci_lower": null, "score_ci_upper": null, "raw_scores": null, "baseline_score": 73.51, "outcome": "DISCARDED", "failure_mode": null, "duration_seconds": 80.74104383285157, "tags": ["levenshtein", "loops", "early-exit", "fast-path"], "learnings": "{\"what_changed\":\"\",\"what_improved\":[],\"what_regressed\":[],\"transferable_insight\":\"Attempting to eliminate minor redundant operations through loop splitting and manual conditional restructuring can degrade performance by introducing greater execution overhead.\",\"domain_tags\":[\"Code Optimization\",\"Algorithm Design\",\"Micro-optimization\"]}", "cost_usd": 0.03914560000000001, "bootstrap_seed": 0, "agent_model": "gemini-3.1-pro-preview", "held_out_score": null, "criterion_names": null, "per_criterion_scores": null, "failure_classification": {"category": "logic_error", "description": "The attempted optimizations, such as splitting DP loops, altering `min_v` tracking, or refactoring `elif` blocks, likely introduced an error in the dynamic programming algorithm's core logic. The score of 80.4100 suggests that while the experiment ran and produced a result, the calculations are incorrect for some test cases or inputs, leading to a degraded overall correctness metric.", "fix_direction": "Carefully review the modified DP state transitions and update rules. Instead of focusing solely on performance optimizations, first ensure the absolute correctness of the new two-loop structure, `min_v` handling, and conditional logic. Test thoroughly with edge cases and known correct inputs to identify where the DP calculation deviates from the expected outcome. It might be beneficial to revert the changes partially and introduce them one by one, verifying correctness at each step.", "confidence": 0.9}, "drafts_generated": 1, "drafts_survived": 1}
{"id": "cd624fbf-0bb4-4591-9d12-609e24b5bbb3", "target_id": "B3-greedy", "git_sha": "65e0e0a64c9904582da9ef0b556b61c0aa9f4c1c", "pre_experiment_sha": "65e0e0a64c9904582da9ef0b556b61c0aa9f4c1c", "timestamp": "2026-04-21T00:15:34.975816+00:00", "hypothesis": "Remove string swapping in the Levenshtein function to avoid swap overhead, and replace it with a direct bidirectional length difference check.", "hypothesis_source": "agent", "mutation_diff_summary": "", "score": 78.55, "score_ci_lower": null, "score_ci_upper": null, "raw_scores": null, "baseline_score": 73.51, "outcome": "DISCARDED", "failure_mode": null, "duration_seconds": 58.80827216710895, "tags": ["levenshtein", "no-swap", "early-exit"], "learnings": "{\"what_changed\":\"\",\"what_improved\":[],\"what_regressed\":[],\"transferable_insight\":\"Replacing simple variable swapping with bidirectional conditional checks to avoid setup overhead often degrades overall performance by increasing branching complexity in the core logic.\",\"domain_tags\":[\"Algorithm Optimization\",\"Performance Tuning\",\"Code Refactoring\"]}", "cost_usd": 0.038334850000000004, "bootstrap_seed": 0, "agent_model": "gemini-3.1-pro-preview", "held_out_score": null, "criterion_names": null, "per_criterion_scores": null, "failure_classification": {"category": "over_optimization", "description": "The experiment aimed to optimize the Levenshtein function by removing perceived 'swap overhead' and replacing a part of its logic with a 'direct bidirectional length difference check'. This change, intended for performance, likely introduced incorrectness into the Levenshtein distance calculation or resulted in a more complex and slower process, leading to the observed low score. The core issue is an aggressive optimization attempt that degraded the function's accuracy or efficiency.", "fix_direction": "Prioritize the correctness of the Levenshtein distance calculation. If performance is a concern, conduct thorough profiling to accurately identify actual bottlenecks, rather than assuming 'swap overhead'. Explore well-established, proven Levenshtein optimizations (e.g., dynamic programming space optimizations) that are known to maintain correctness. Any proposed optimization must be rigorously tested against a comprehensive suite of test cases to ensure both accuracy and actual performance improvement.", "confidence": 0.95}, "drafts_generated": 1, "drafts_survived": 1}
{"id": "2e7e4b5f-0bf7-4477-966a-d0f46e38173a", "target_id": "B3-greedy", "git_sha": "65e0e0a64c9904582da9ef0b556b61c0aa9f4c1c", "pre_experiment_sha": "65e0e0a64c9904582da9ef0b556b61c0aa9f4c1c", "timestamp": "2026-04-21T00:17:15.669853+00:00", "hypothesis": "Remove string swapping to prevent DP state corruption and restore the unflattened `else: if` block in the inner loop to avoid performance regression.", "hypothesis_source": "agent", "mutation_diff_summary": "", "score": 76.66, "score_ci_lower": null, "score_ci_upper": null, "raw_scores": null, "baseline_score": 73.51, "outcome": "DISCARDED", "failure_mode": null, "duration_seconds": 74.34592262492515, "tags": ["levenshtein", "dynamic-programming", "control-flow"], "learnings": "{\"what_changed\":\"\",\"what_improved\":[],\"what_regressed\":[],\"transferable_insight\":\"Attempting to resolve state corruption by removing swapping optimizations and reverting to nested control flows can inadvertently degrade overall performance.\",\"domain_tags\":[\"Algorithm Optimization\",\"Control Flow\",\"State Management\"]}", "cost_usd": 0.038393250000000004, "bootstrap_seed": 0, "agent_model": "gemini-3.1-pro-preview", "held_out_score": null, "criterion_names": null, "per_criterion_scores": null, "failure_classification": {"category": "logic_error", "description": "The experiment aimed to resolve \"DP state corruption\" by removing string swapping. The failure indicates that the core dynamic programming logic remains flawed; either the state corruption was not fully addressed by the string swapping change, or the change introduced new logical inconsistencies that led to an incorrect score of 76.6600. The attempt to avoid performance regression by restoring the `else: if` block was also insufficient to prevent the overall failure, likely due to the underlying correctness issues.", "fix_direction": "Focus debugging on the dynamic programming state management. Verify step-by-step how the DP state is updated, especially in the areas where string swapping was removed. Use a debugger or print statements with controlled test cases to identify precisely where the DP state deviates from its expected correct values. Ensure that the interactions between string manipulation and DP state transitions are logically sound and that the restored `else: if` block behaves as intended without introducing new bugs.", "confidence": 0.9}, "drafts_generated": 1, "drafts_survived": 1}
{"id": "c677663d-5a54-4e4a-9899-8f55b6e9b61f", "target_id": "B3-greedy", "git_sha": "65e0e0a64c9904582da9ef0b556b61c0aa9f4c1c", "pre_experiment_sha": "65e0e0a64c9904582da9ef0b556b61c0aa9f4c1c", "timestamp": "2026-04-21T00:19:00.884320+00:00", "hypothesis": "Replace `elif` with nested `else: if` in the Levenshtein inner loops to eliminate regression, remove string swapping, and apply absolute length difference checks to skip unnecessary DP calculations.", "hypothesis_source": "agent", "mutation_diff_summary": "", "score": 76.9, "score_ci_lower": null, "score_ci_upper": null, "raw_scores": null, "baseline_score": 73.51, "outcome": "DISCARDED", "failure_mode": null, "duration_seconds": 80.19413287495263, "tags": ["levenshtein", "nested-if", "early-exit", "no-swap"], "learnings": "{\"what_changed\":\"\",\"what_improved\":[],\"what_regressed\":[],\"transferable_insight\":\"Micro-optimizing algorithms by replacing native conditional structures with nested branches and removing standard input normalization often degrades performance due to increased branching overhead.\",\"domain_tags\":[\"Algorithm Optimization\",\"Control Flow\",\"Performance Tuning\"]}", "cost_usd": 0.0382974, "bootstrap_seed": 0, "agent_model": "gemini-3.1-pro-preview", "held_out_score": null, "criterion_names": null, "per_criterion_scores": null, "failure_classification": {"category": "logic_error", "description": "The modifications to the Levenshtein inner loops, such as replacing `elif` with nested `else: if`, removing string swapping, or implementing absolute length difference checks, likely introduced a flaw in the core distance calculation logic. The resulting score of 76.9000 suggests that the algorithm is now producing incorrect Levenshtein distances, which failed to eliminate existing regression or potentially introduced new correctness issues.", "fix_direction": "Thoroughly review the altered control flow (especially the `elif` to `else: if` conversion) and the conditions for skipping dynamic programming calculations to ensure they correctly maintain the Levenshtein distance properties. Implement comprehensive unit tests with known inputs and expected outputs (including edge cases) to verify the correctness of the Levenshtein distance calculation. Debug the algorithm's behavior with specific failing inputs to pinpoint the exact location of the miscalculation.", "confidence": 0.9}, "drafts_generated": 1, "drafts_survived": 1}
{"id": "51ad4b8e-640e-480a-8b62-63876d0721d4", "target_id": "B3-greedy", "git_sha": "65e0e0a64c9904582da9ef0b556b61c0aa9f4c1c", "pre_experiment_sha": "65e0e0a64c9904582da9ef0b556b61c0aa9f4c1c", "timestamp": "2026-04-21T00:21:26.793701+00:00", "hypothesis": "Unflatten the `elif` into an `else: if` block in the Levenshtein inner loop to strictly adhere to negative constraints, and implement actual O(1) set-based deduplication in `_deduplicate_pairs` to ensure correctness during isolated testing.", "hypothesis_source": "agent", "mutation_diff_summary": "", "score": 73.69, "score_ci_lower": null, "score_ci_upper": null, "raw_scores": null, "baseline_score": 73.51, "outcome": "DISCARDED", "failure_mode": null, "duration_seconds": 102.95177012495697, "tags": ["algorithm", "performance", "correctness"], "learnings": "{\"what_changed\":\"\",\"what_improved\":[],\"what_regressed\":[],\"transferable_insight\":\"Artificially restructuring logic to strictly bypass negative constraints can satisfy automated checks but is often discarded if it degrades overall structural readability.\",\"domain_tags\":[\"Software Engineering\",\"Refactoring\",\"Constraint Satisfaction\"]}", "cost_usd": 0.0395003, "bootstrap_seed": 0, "agent_model": "gemini-3.1-pro-preview", "held_out_score": null, "criterion_names": null, "per_criterion_scores": null, "failure_classification": {"category": "logic_error", "description": "The refactoring of the `elif` block into an `else: if` within the Levenshtein inner loop, intended to adhere to specific \"negative constraints,\" likely introduced incorrect logic in the dynamic programming calculation, leading to inaccurate distance results for certain inputs. Additionally, the new O(1) set-based deduplication in `_deduplicate_pairs` might contain subtle logical flaws causing incorrect pair handling. The non-zero score indicates that while some test cases may pass, the core logic for specific scenarios is now flawed.", "fix_direction": "1. **Revert Levenshtein Change:** Start by reverting the unflattening of the `elif` block in the Levenshtein inner loop. Verify if this restores correctness to the Levenshtein calculation before addressing other parts. 2. **Isolate and Test Deduplication:** If the Levenshtein logic is stable, create dedicated unit tests for the `_deduplicate_pairs` function to thoroughly validate the O(1) set-based deduplication logic against various edge cases (e.g., empty lists, multiple duplicates, no duplicates). 3. **Step-by-Step Debugging:** For any remaining issues, use a debugger to trace the execution path of failing test cases, paying close attention to the state of the dynamic programming matrix in Levenshtein and the contents of the sets in `_deduplicate_pairs` to pinpoint deviations from expected behavior.", "confidence": 0.9}, "drafts_generated": 1, "drafts_survived": 1}
{"id": "6fc822b6-828c-4722-9345-dee1b0b114db", "target_id": "B3-greedy", "git_sha": "65e0e0a64c9904582da9ef0b556b61c0aa9f4c1c", "pre_experiment_sha": "65e0e0a64c9904582da9ef0b556b61c0aa9f4c1c", "timestamp": "2026-04-21T00:24:05.811877+00:00", "hypothesis": "Short-circuit the inner DP loop by duplicating the array updates inside the `if cs == ct:` branch, saving one assignment (`diag = up`) per iteration regardless of whether the characters match or not.", "hypothesis_source": "agent", "mutation_diff_summary": "", "score": 75.63, "score_ci_lower": null, "score_ci_upper": null, "raw_scores": null, "baseline_score": 73.51, "outcome": "DISCARDED", "failure_mode": null, "duration_seconds": 135.9374141660519, "tags": ["dp-optimization", "short-circuit", "array-updates"], "learnings": "{\"what_changed\":\"\",\"what_improved\":[],\"what_regressed\":[],\"transferable_insight\":\"Micro-optimizing loops by duplicating state updates inside conditional branches to save a single assignment is generally counterproductive and degrades performance due to increased branch complexity.\",\"domain_tags\":[\"Code Optimization\",\"Performance Tuning\",\"Micro-optimization\"]}", "cost_usd": 0.03916085, "bootstrap_seed": 0, "agent_model": "gemini-3.1-pro-preview", "held_out_score": null, "criterion_names": null, "per_criterion_scores": null, "failure_classification": {"category": "logic_error", "description": "The proposed optimization, intended to save an assignment by duplicating array updates and short-circuiting the DP loop, likely introduced a flaw in the dynamic programming recurrence relation. This alteration to the calculation logic resulted in an incorrect DP table, leading to a significantly lower score, indicating a loss of correctness or accuracy.", "fix_direction": "Re-evaluate the dynamic programming recurrence relation with the proposed changes. Verify that the 'saved' assignment was not critical for maintaining the correctness of the DP state. Trace the execution with a small, known input to pinpoint where the computed values diverge from the correct DP solution. Prioritize preserving algorithmic correctness over micro-optimizations.", "confidence": 0.95}, "drafts_generated": 1, "drafts_survived": 1}
{"id": "004e73f9-748b-40d1-bb50-15ed8fe682bc", "target_id": "B3-greedy", "git_sha": "f0b666c3e9605b81d951db22d75e8e4b1f2efa97", "pre_experiment_sha": "65e0e0a64c9904582da9ef0b556b61c0aa9f4c1c", "timestamp": "2026-04-21T00:26:15.056751+00:00", "hypothesis": "Cache `threshold + 1` to a local variable `thresh_plus_1` to avoid repeated addition operations in the early exit paths.", "hypothesis_source": "agent", "mutation_diff_summary": "", "score": 73.25, "score_ci_lower": null, "score_ci_upper": null, "raw_scores": null, "baseline_score": 73.51, "outcome": "KEPT", "failure_mode": null, "duration_seconds": 112.33770162495784, "tags": ["micro-optimization", "early-exit"], "learnings": "{\"what_changed\":\"\",\"what_improved\":[],\"what_regressed\":[],\"transferable_insight\":\"Pre-computing and caching frequently used arithmetic expressions in local variables eliminates redundant operations and improves performance, especially in code paths with multiple early exits.\",\"domain_tags\":[\"Performance Optimization\",\"Code Refactoring\",\"Micro-optimization\"]}", "cost_usd": 0.0386475, "bootstrap_seed": 0, "agent_model": "gemini-3.1-pro-preview", "held_out_score": null, "criterion_names": null, "per_criterion_scores": null, "failure_classification": null, "drafts_generated": 1, "drafts_survived": 1}
