{"id": "47588885-a54a-4d06-974e-02210697d5c0", "target_id": "B3-greedy", "git_sha": "f0b666c3e9605b81d951db22d75e8e4b1f2efa97", "pre_experiment_sha": "f0b666c3e9605b81d951db22d75e8e4b1f2efa97", "timestamp": "2026-04-21T01:25:36.761207+00:00", "hypothesis": "The current baseline is already highly optimized and adheres strictly to all positive and negative constraints; preserving this optimal structure maintains peak performance and avoids regressions.", "hypothesis_source": "agent", "mutation_diff_summary": "", "score": 73.56, "score_ci_lower": null, "score_ci_upper": null, "raw_scores": null, "baseline_score": 73.25, "outcome": "DISCARDED", "failure_mode": null, "duration_seconds": 262.0990000839811, "tags": ["micro-optimization", "dp-optimization"], "learnings": "{\"what_changed\":\"\",\"what_improved\":[],\"what_regressed\":[],\"transferable_insight\":\"Assuming a system is already perfectly optimized and resisting further modifications prevents the discovery of novel improvements.\",\"domain_tags\":[\"Optimization\",\"Continuous Improvement\",\"Experimentation\"]}", "cost_usd": 0.039269700000000005, "bootstrap_seed": 0, "agent_model": "gemini-3.1-pro-preview", "held_out_score": null, "criterion_names": null, "per_criterion_scores": null, "failure_classification": {"category": "regression", "description": "The experiment failed to maintain peak performance, resulting in a score of 73.5600. Given the hypothesis's explicit goal to 'avoid regressions' and 'preserve optimal structure,' this failure indicates a degradation from the expected baseline, classifying it as a regression, even though the specific underlying cause is unknown.", "fix_direction": "Investigate the differences between the current state that produced the score of 73.5600 and the previous 'optimal' baseline. Focus on identifying any subtle changes, even those intended to 'preserve optimal structure,' that might have inadvertently introduced performance degradation. A detailed diff analysis of code, configurations, data processing, or model parameters against the successful baseline is recommended to pinpoint the exact point of divergence.", "confidence": 0.9}, "drafts_generated": 1, "drafts_survived": 1}
{"id": "23e85d0a-91ac-4f18-9fd5-eb24cd16690b", "target_id": "B3-greedy", "git_sha": "57dab9aade16f9d240358d35169a859b8888ee7e", "pre_experiment_sha": "f0b666c3e9605b81d951db22d75e8e4b1f2efa97", "timestamp": "2026-04-21T01:30:27.158620+00:00", "hypothesis": "Flatten the inner loop's nested `if/elif` logic into a single `if/elif/else` chain to reduce bytecode nesting and jump instructions, and replace `list(range(...))` with list unpacking `[*range(...)]` to avoid function call overhead during array initialization.", "hypothesis_source": "agent", "mutation_diff_summary": "", "score": 72.81, "score_ci_lower": null, "score_ci_upper": null, "raw_scores": null, "baseline_score": 73.25, "outcome": "KEPT", "failure_mode": null, "duration_seconds": 247.2013530000113, "tags": ["optimization", "dp-inner-loop", "list-unpacking", "control-flow-flattening"], "learnings": "{\"what_changed\":\"\",\"what_improved\":[],\"what_regressed\":[],\"transferable_insight\":\"Simplifying nested control flow into flat structures and replacing function calls with native syntax constructs reduces execution overhead and improves performance.\",\"domain_tags\":[\"Code Optimization\",\"Performance Tuning\",\"Control Flow\"]}", "cost_usd": 0.03987, "bootstrap_seed": 0, "agent_model": "gemini-3.1-pro-preview", "held_out_score": null, "criterion_names": null, "per_criterion_scores": null, "failure_classification": null, "drafts_generated": 1, "drafts_survived": 1}
{"id": "0aa816bd-ec47-4ed7-a0c9-2379092ea58e", "target_id": "B3-greedy", "git_sha": "57dab9aade16f9d240358d35169a859b8888ee7e", "pre_experiment_sha": "57dab9aade16f9d240358d35169a859b8888ee7e", "timestamp": "2026-04-21T01:33:42.773557+00:00", "hypothesis": "Optimize the 1D array initialization in the Levenshtein distance function by using `list(range(len_t + 1))` instead of the unpacking operator `[*range(len_t + 1)]` to slightly reduce overhead and improve execution speed while strictly adhering to all constraints.", "hypothesis_source": "agent", "mutation_diff_summary": "", "score": 73.74, "score_ci_lower": null, "score_ci_upper": null, "raw_scores": null, "baseline_score": 72.81, "outcome": "DISCARDED", "failure_mode": null, "duration_seconds": 187.57289483305067, "tags": ["optimization", "array-initialization", "performance"], "learnings": "{\"what_changed\":\"\",\"what_improved\":[],\"what_regressed\":[],\"transferable_insight\":\"Replacing native syntax-level unpacking with explicit function calls for collection initialization often introduces overhead rather than reducing it.\",\"domain_tags\":[\"Performance Optimization\",\"Language Idioms\",\"Code Efficiency\"]}", "cost_usd": 0.03996455, "bootstrap_seed": 0, "agent_model": "gemini-3.1-pro-preview", "held_out_score": null, "criterion_names": null, "per_criterion_scores": null, "failure_classification": {"category": "regression", "description": "The attempted micro-optimization to improve execution speed by changing array initialization from `[*range(len_t + 1)]` to `list(range(len_t + 1))` did not yield the expected performance improvement. Instead, the resulting score of 73.7400 suggests a degradation in execution speed compared to the previous state or baseline, indicating a regression.", "fix_direction": "Revert the specific micro-optimization, as it had a negative impact on performance. For future optimizations, focus on profiling to identify actual bottlenecks in the Levenshtein distance calculation (e.g., loop structures, memory access patterns) rather than minor syntactic variations for list creation, which often have negligible or adverse effects in Python.", "confidence": 1.0}, "drafts_generated": 1, "drafts_survived": 1}
