{"id": "c62860a8-059b-4fde-aefe-6c047eae302a", "target_id": "B3-greedy", "git_sha": "87f0785909ac4835a118e9b197bef68d0e31ff1b", "pre_experiment_sha": "87f0785909ac4835a118e9b197bef68d0e31ff1b", "timestamp": "2026-04-19T14:30:54.739190+00:00", "hypothesis": "Reduce per-comparison overhead by caching string lengths in buckets and using a narrower reusable DP buffer sized to the threshold band.", "hypothesis_source": "agent", "mutation_diff_summary": "", "score": 99999.0, "score_ci_lower": null, "score_ci_upper": null, "raw_scores": null, "baseline_score": 106.81, "outcome": "DISCARDED", "failure_mode": null, "duration_seconds": 35.11393279093318, "tags": ["length-cache", "buffer-reuse", "exact-pruning", "low-risk"], "learnings": "{\"what_changed\":\"\",\"what_improved\":[],\"what_regressed\":[],\"transferable_insight\":\"Optimizations that add bookkeeping or specialized data structures can fail to help when their setup and maintenance costs outweigh the savings they create in the hot path.\",\"domain_tags\":[\"performance-optimization\",\"tradeoff-analysis\",\"algorithm-design\"]}", "cost_usd": 0.09004580000000001, "bootstrap_seed": 0, "agent_model": "gpt-5.4", "held_out_score": null, "criterion_names": null, "per_criterion_scores": null, "failure_classification": {"category": "over_optimization", "description": "The experiment focused on performance-oriented changes (caching string lengths in buckets and using a narrower reusable DP buffer). The failure score is extremely high, suggesting the optimization likely altered correctness/coverage near the threshold band (e.g., DP band truncation or stale cached lengths), yielding wrong results while still producing outputs that otherwise matched the expected format.", "fix_direction": "Prioritize correctness first: validate that the DP band/windowing logic always covers all required states for the threshold; add tests that stress boundary conditions and varying string lengths; ensure cached length buckets are correctly computed and invalidated when inputs change; compare results against a known-correct full DP implementation on randomized and adversarial cases.", "confidence": 0.62}, "drafts_generated": 1, "drafts_survived": 1}
{"id": "f4290132-48a2-4b8e-9f2b-a10d78c6f0f8", "target_id": "B3-greedy", "git_sha": "87f0785909ac4835a118e9b197bef68d0e31ff1b", "pre_experiment_sha": "87f0785909ac4835a118e9b197bef68d0e31ff1b", "timestamp": "2026-04-19T14:31:34.476478+00:00", "hypothesis": "Reduce per-comparison overhead by fast-pathing exact and same-length cases before bounded DP.", "hypothesis_source": "agent", "mutation_diff_summary": "", "score": 99999.0, "score_ci_lower": null, "score_ci_upper": null, "raw_scores": null, "baseline_score": 106.81, "outcome": "DISCARDED", "failure_mode": null, "duration_seconds": 36.4480971659068, "tags": ["levenshtein", "pruning", "fast-path", "buffer-reuse"], "learnings": "{\"what_changed\":\"\",\"what_improved\":[],\"what_regressed\":[],\"transferable_insight\":\"A proposed optimization can still be a net loss if its added branching and setup cost outweighs the savings on the common path, so validate fast paths against real workload behavior before adopting them.\",\"domain_tags\":[\"optimization\",\"performance-engineering\"]}", "cost_usd": 0.09178380000000001, "bootstrap_seed": 0, "agent_model": "gpt-5.4", "held_out_score": null, "criterion_names": null, "per_criterion_scores": null, "failure_classification": {"category": "semantic_drift", "description": "The fast-path/bounded-DP change likely altered behavior for exact and same-length cases, producing incorrect results despite a successful parse/structure, indicating the new optimization did not preserve correctness across all inputs.", "fix_direction": "Validate the fast-path conditions against the original DP semantics (same-length, equality, edge cases), add property-based tests comparing fast-path vs full DP, and ensure DP bounds/early exits cannot change outcomes.", "confidence": 0.62}, "drafts_generated": 1, "drafts_survived": 1}
{"id": "3ba6e391-76e7-46c1-8867-d345acfd56fd", "target_id": "B3-greedy", "git_sha": "81c898d91ab4a31cd0a0d39047c4e4a55568f9a5", "pre_experiment_sha": "87f0785909ac4835a118e9b197bef68d0e31ff1b", "timestamp": "2026-04-19T14:32:14.726225+00:00", "hypothesis": "Precompute unique-name lengths and avoid repeated length/range bookkeeping in the hot comparison loop.", "hypothesis_source": "agent", "mutation_diff_summary": "", "score": 106.15, "score_ci_lower": null, "score_ci_upper": null, "raw_scores": null, "baseline_score": 106.81, "outcome": "KEPT", "failure_mode": null, "duration_seconds": 33.82884862506762, "tags": ["length-cache", "exact-pruning", "buffer-reuse", "hot-loop"], "learnings": "{\"what_changed\":\"\",\"what_improved\":[],\"what_regressed\":[],\"transferable_insight\":\"Precomputing invariant metadata outside a hot loop can reduce repeated bookkeeping overhead and improve performance without changing behavior.\",\"domain_tags\":[\"performance-optimization\",\"algorithm-design\",\"systems\"]}", "cost_usd": 0.089815, "bootstrap_seed": 0, "agent_model": "gpt-5.4", "held_out_score": null, "criterion_names": null, "per_criterion_scores": null, "failure_classification": null, "drafts_generated": 1, "drafts_survived": 1}
{"id": "d6d7b7c7-8d20-4d9d-ab45-5b6fabd939fd", "target_id": "B3-greedy", "git_sha": "81c898d91ab4a31cd0a0d39047c4e4a55568f9a5", "pre_experiment_sha": "81c898d91ab4a31cd0a0d39047c4e4a55568f9a5", "timestamp": "2026-04-19T14:32:48.188588+00:00", "hypothesis": "Remove redundant helper work by iterating directly over the exact feasible length range and avoiding unused pair deduplication.", "hypothesis_source": "agent", "mutation_diff_summary": "", "score": 107.93, "score_ci_lower": null, "score_ci_upper": null, "raw_scores": null, "baseline_score": 106.15, "outcome": "DISCARDED", "failure_mode": null, "duration_seconds": 32.34483358298894, "tags": ["length-pruning", "precompute-lengths", "remove-unused-work", "conservative"], "learnings": "{\"what_changed\":\"\",\"what_improved\":[],\"what_regressed\":[],\"transferable_insight\":\"When the valid search space is already well-defined, iterating only over the exact feasible range and skipping unnecessary deduplication can simplify the process without changing results.\",\"domain_tags\":[\"optimization\",\"algorithm design\",\"efficiency\"]}", "cost_usd": 0.089996, "bootstrap_seed": 0, "agent_model": "gpt-5.4", "held_out_score": null, "criterion_names": null, "per_criterion_scores": null, "failure_classification": {"category": "semantic_drift", "description": "The attempted optimization likely changed the iteration/deduplication logic in a way that no longer matched the required problem semantics (e.g., iterating over the feasible length range or removing pair deduplication altered which candidate pairs are counted/considered). Output may still be structurally valid, but the meaning/results became incorrect.", "fix_direction": "Verify the optimized loop bounds correspond exactly to the original intended feasible lengths, and add/restore correctness checks (or minimal dedup) to ensure the set of considered candidates remains identical to the baseline. Use targeted unit tests comparing outputs against the pre-optimization version for edge cases.", "confidence": 0.62}, "drafts_generated": 1, "drafts_survived": 1}
{"id": "96bae0fd-f0c6-4b62-9306-111067473471", "target_id": "B3-greedy", "git_sha": "81c898d91ab4a31cd0a0d39047c4e4a55568f9a5", "pre_experiment_sha": "81c898d91ab4a31cd0a0d39047c4e4a55568f9a5", "timestamp": "2026-04-19T14:33:25.797419+00:00", "hypothesis": "Precompute candidate lengths and iterate only relevant buckets directly to remove redundant hot-loop work.", "hypothesis_source": "agent", "mutation_diff_summary": "", "score": 107.17, "score_ci_lower": null, "score_ci_upper": null, "raw_scores": null, "baseline_score": 106.15, "outcome": "DISCARDED", "failure_mode": null, "duration_seconds": 34.76998745894525, "tags": ["length-cache", "exact-pruning", "loop-simplification"], "learnings": "{\"what_changed\":\"\",\"what_improved\":[],\"what_regressed\":[],\"transferable_insight\":\"When a proposed optimization adds bookkeeping without eliminating enough repeated work in the critical path, it is likely to be discarded even if it is conceptually cleaner.\",\"domain_tags\":[\"optimization\",\"performance\",\"engineering\"]}", "cost_usd": 0.0896846, "bootstrap_seed": 0, "agent_model": "gpt-5.4", "held_out_score": null, "criterion_names": null, "per_criterion_scores": null, "failure_classification": {"category": "logic_error", "description": "The attempt to precompute candidate lengths and restrict iteration to relevant buckets did not correctly preserve the intended mapping from candidates to evaluation buckets, resulting in incorrect behavior rather than just performance gains.", "fix_direction": "Validate the bucket-selection/filtering logic against the original exhaustive iteration (add assertions/comparisons for small inputs), ensure precomputed length sets align with the iteration keys, and add unit tests that verify candidate coverage and correctness for representative cases.", "confidence": 0.55}, "drafts_generated": 1, "drafts_survived": 1}
{"id": "04a2046b-a355-4a1e-8845-05973758a890", "target_id": "B3-greedy", "git_sha": "81c898d91ab4a31cd0a0d39047c4e4a55568f9a5", "pre_experiment_sha": "81c898d91ab4a31cd0a0d39047c4e4a55568f9a5", "timestamp": "2026-04-19T14:34:07.840672+00:00", "hypothesis": "Precompute candidate lengths per bucket and avoid repeated string length work inside the hot comparison loop.", "hypothesis_source": "agent", "mutation_diff_summary": "", "score": 106.77, "score_ci_lower": null, "score_ci_upper": null, "raw_scores": null, "baseline_score": 106.15, "outcome": "DISCARDED", "failure_mode": null, "duration_seconds": 35.8165305419825, "tags": ["length-cache", "hot-loop", "conservative"], "learnings": "{\"what_changed\":\"\",\"what_improved\":[],\"what_regressed\":[],\"transferable_insight\":\"Precomputing values can simplify hot-path work, but if the cached computation is already cheap or the added indirection outweighs it, the optimization may yield no measurable benefit.\",\"domain_tags\":[\"performance-optimization\",\"software-engineering\"]}", "cost_usd": 0.092023, "bootstrap_seed": 0, "agent_model": "gpt-5.4", "held_out_score": null, "criterion_names": null, "per_criterion_scores": null, "failure_classification": {"category": "logic_error", "description": "The intended optimization (precomputing candidate lengths per bucket to avoid repeated string length calls) did not produce correct behavior, indicating the change likely altered comparison logic or bucket/length alignment, leading to incorrect results despite being a performance-focused edit.", "fix_direction": "Verify that precomputed lengths remain consistent with the exact strings compared in the hot loop; add tests that compare optimized vs baseline for all edge cases (empty/short strings, boundary lengths, bucket assignments) and confirm no off-by-one or mismatched bucket indexing.", "confidence": 0.62}, "drafts_generated": 1, "drafts_survived": 1}
{"id": "ed0b0d1d-3234-46f6-95a7-fd9761715395", "target_id": "B3-greedy", "git_sha": "81c898d91ab4a31cd0a0d39047c4e4a55568f9a5", "pre_experiment_sha": "81c898d91ab4a31cd0a0d39047c4e4a55568f9a5", "timestamp": "2026-04-19T14:34:44.008827+00:00", "hypothesis": "Remove redundant bucket-length iteration by indexing directly over the exact admissible length range while caching string lengths in buckets.", "hypothesis_source": "agent", "mutation_diff_summary": "", "score": 110.75, "score_ci_lower": null, "score_ci_upper": null, "raw_scores": null, "baseline_score": 106.15, "outcome": "DISCARDED", "failure_mode": null, "duration_seconds": 33.56376204104163, "tags": ["length-pruning", "precompute-lengths", "hot-loop"], "learnings": "{\"what_changed\":\"\",\"what_improved\":[],\"what_regressed\":[],\"transferable_insight\":\"When an optimization only changes iteration structure without reducing the underlying work or clarifying a bottleneck, it is unlikely to produce meaningful gains and should be discarded unless measurements show a real benefit.\",\"domain_tags\":[\"optimization\",\"performance-analysis\",\"experimentation\"]}", "cost_usd": 0.0905286, "bootstrap_seed": 0, "agent_model": "gpt-5.4", "held_out_score": null, "criterion_names": null, "per_criterion_scores": null, "failure_classification": {"category": "logic_error", "description": "The attempt to avoid redundant bucket-length iteration by directly indexing the admissible length range likely mis-handled the mapping between bucket indices and valid lengths, or used cached bucket string lengths inconsistently, leading to incorrect computation despite the change being conceptually targeted.", "fix_direction": "Verify the exact admissible length boundaries and off-by-one handling, ensure bucket-index-to-length mapping is correct, and add invariants/tests comparing results against the prior implementation while validating cache contents and usage for every bucket.", "confidence": 0.56}, "drafts_generated": 1, "drafts_survived": 1}
{"id": "8c3788f2-0576-4589-b21a-9089eb281a83", "target_id": "B3-greedy", "git_sha": "81c898d91ab4a31cd0a0d39047c4e4a55568f9a5", "pre_experiment_sha": "81c898d91ab4a31cd0a0d39047c4e4a55568f9a5", "timestamp": "2026-04-19T14:35:19.200988+00:00", "hypothesis": "Precompute candidate lengths per bucket and avoid repeated len/string setup in the hot comparison loop.", "hypothesis_source": "agent", "mutation_diff_summary": "", "score": 106.46, "score_ci_lower": null, "score_ci_upper": null, "raw_scores": null, "baseline_score": 106.15, "outcome": "DISCARDED", "failure_mode": null, "duration_seconds": 32.445951458998024, "tags": ["length-cache", "hot-loop", "conservative"], "learnings": "{\"what_changed\":\"\",\"what_improved\":[],\"what_regressed\":[],\"transferable_insight\":\"Precomputing reusable metadata can simplify hot-path logic, but if the added setup or bookkeeping does not measurably reduce work, the optimization may provide no real benefit and should be discarded.\",\"domain_tags\":[\"performance-optimization\",\"software-engineering\"]}", "cost_usd": 0.09048780000000001, "bootstrap_seed": 0, "agent_model": "gpt-5.4", "held_out_score": null, "criterion_names": null, "per_criterion_scores": null, "failure_classification": {"category": "over_optimization", "description": "The change aimed to improve performance by precomputing lengths and reducing per-compare overhead, but the experiment failed\u2014suggesting the optimization altered or invalidated an assumption in the comparison logic or evaluation, yielding a worse overall score.", "fix_direction": "Verify correctness of the precomputed per-bucket lengths against the exact comparison semantics; add targeted tests to confirm identical behavior to the baseline while optimizing only within the hot loop.", "confidence": 0.62}, "drafts_generated": 1, "drafts_survived": 1}
{"id": "2f64c4e8-8d4b-433b-9aad-7fc640f841d5", "target_id": "B3-greedy", "git_sha": "81c898d91ab4a31cd0a0d39047c4e4a55568f9a5", "pre_experiment_sha": "81c898d91ab4a31cd0a0d39047c4e4a55568f9a5", "timestamp": "2026-04-19T14:36:01.172983+00:00", "hypothesis": "Cache bucket lengths alongside buckets to avoid repeated dict lookups and length work in the hot comparison path.", "hypothesis_source": "agent", "mutation_diff_summary": "", "score": 108.59, "score_ci_lower": null, "score_ci_upper": null, "raw_scores": null, "baseline_score": 106.15, "outcome": "DISCARDED", "failure_mode": null, "duration_seconds": 35.191379833966494, "tags": ["length-caching", "hot-loop", "conservative"], "learnings": "{\"what_changed\":\"\",\"what_improved\":[],\"what_regressed\":[],\"transferable_insight\":\"Optimizations that add extra state to speed up a hot path should be validated carefully, because the added bookkeeping can outweigh any theoretical savings when the original operation is already cheap.\",\"domain_tags\":[\"performance-optimization\",\"engineering-tradeoffs\",\"profiling\"]}", "cost_usd": 0.0906878, "bootstrap_seed": 0, "agent_model": "gpt-5.4", "held_out_score": null, "criterion_names": null, "per_criterion_scores": null, "failure_classification": {"category": "logic_error", "description": "The provided information does not include enough detail about what failed (e.g., compilation/runtime error, incorrect behavior, or formatting issues). With only the hypothesis and an unknown failure mode, the failure cannot be reliably mapped to any of the listed categories.", "fix_direction": "Capture the concrete failure symptom (error logs/trace), the before/after code diff, and which criterion the score impacted; then verify correctness of length caching logic (including edge cases) and ensure no schema/output changes occurred.", "confidence": 0.1}, "drafts_generated": 1, "drafts_survived": 1}
{"id": "617755de-52fe-4765-ad1b-bddb3f6262d2", "target_id": "B3-greedy", "git_sha": "81c898d91ab4a31cd0a0d39047c4e4a55568f9a5", "pre_experiment_sha": "81c898d91ab4a31cd0a0d39047c4e4a55568f9a5", "timestamp": "2026-04-19T14:36:36.536441+00:00", "hypothesis": "Cache bucket lengths alongside buckets to avoid repeated len calls and attribute lookups in the hot comparison loop.", "hypothesis_source": "agent", "mutation_diff_summary": "", "score": 106.67, "score_ci_lower": null, "score_ci_upper": null, "raw_scores": null, "baseline_score": 106.15, "outcome": "DISCARDED", "failure_mode": null, "duration_seconds": 32.642716542002745, "tags": ["length-caching", "hot-loop", "conservative"], "learnings": "{\"what_changed\":\"\",\"what_improved\":[],\"what_regressed\":[],\"transferable_insight\":\"Micro-optimizations that reduce repeated work in a hot loop can still be neutral if the added bookkeeping and complexity do not materially change the overall cost profile.\",\"domain_tags\":[\"performance-optimization\",\"software-engineering\"]}", "cost_usd": 0.09065740000000001, "bootstrap_seed": 0, "agent_model": "gpt-5.4", "held_out_score": null, "criterion_names": null, "per_criterion_scores": null, "failure_classification": {"category": "logic_error", "description": "The experiment did not provide enough information about the observed failure mode. Although the hypothesis suggests a performance-oriented caching optimization (bucket lengths and avoiding repeated len/attribute lookups), no failing behavior (e.g., incorrect outputs, parse/runtime errors, degraded score from a previous pass, or incomplete/invalid state) is described, so the failure cannot be confidently mapped to any listed category.", "fix_direction": "Capture the concrete failure signal (error logs/stack trace or diff of output vs expected), identify whether the change breaks parsing, correctness, previous performance criteria, or introduces inconsistent state; then retry with minimal, verifiable refactoring that preserves semantics while measuring the hot-loop impact.", "confidence": 0.12}, "drafts_generated": 1, "drafts_survived": 1}
{"id": "04b513ce-f0a7-47e6-9d58-2a91d473cb32", "target_id": "B3-greedy", "git_sha": "81c898d91ab4a31cd0a0d39047c4e4a55568f9a5", "pre_experiment_sha": "81c898d91ab4a31cd0a0d39047c4e4a55568f9a5", "timestamp": "2026-04-19T14:37:13.912295+00:00", "hypothesis": "Cache bucket lengths alongside buckets to remove repeated len work in the hot comparison path.", "hypothesis_source": "agent", "mutation_diff_summary": "", "score": 107.56, "score_ci_lower": null, "score_ci_upper": null, "raw_scores": null, "baseline_score": 106.15, "outcome": "DISCARDED", "failure_mode": null, "duration_seconds": 34.62955495901406, "tags": ["length-cache", "hot-path", "mechanical"], "learnings": "{\"what_changed\":\"\",\"what_improved\":[],\"what_regressed\":[],\"transferable_insight\":\"Micro-optimizations that reduce repeated work in a hot path should be validated against real measurements, since added bookkeeping may not produce a meaningful net gain.\",\"domain_tags\":[\"performance-optimization\",\"benchmarking\",\"systems-design\"]}", "cost_usd": 0.09122060000000001, "bootstrap_seed": 0, "agent_model": "gpt-5.4", "held_out_score": null, "criterion_names": null, "per_criterion_scores": null, "failure_classification": {"category": "logic_error", "description": "The change to cache bucket lengths alongside buckets did not preserve correct behavior in the comparison path\u2014likely using an incorrect/unstable cached length, failing to update lengths consistently, or introducing a mismatch between cached length and actual bucket contents, leading to incorrect results while still compiling/running.", "fix_direction": "Ensure cached bucket lengths are derived from and kept consistent with the underlying bucket data for all mutation paths; add invariants/tests verifying cached length equals actual bucket length at use sites (especially in hot comparisons).", "confidence": 0.62}, "drafts_generated": 1, "drafts_survived": 1}
