{"id": "90bed3c7-1bd7-4b3c-9b9f-a826c047ba56", "target_id": "B3-greedy", "git_sha": "0f323aa4824821d251b4ada8dea61b36efb6541f", "pre_experiment_sha": "5fc6ff846095d42aced65fc3181e4192886dabbe", "timestamp": "2026-04-20T23:10:12.311109+00:00", "hypothesis": "Optimize the Levenshtein distance with 1D array reuse, early exit thresholds, and length-based pruning, while removing redundant loops and replacing the O(n) linear scan deduplication with an O(1) set.", "hypothesis_source": "agent", "mutation_diff_summary": "", "score": 139.76, "score_ci_lower": null, "score_ci_upper": null, "raw_scores": null, "baseline_score": 460.33, "outcome": "KEPT", "failure_mode": null, "duration_seconds": 110.70610133302398, "tags": ["performance", "algorithm", "string-matching"], "learnings": "{\"what_changed\":\"\",\"what_improved\":[],\"what_regressed\":[],\"transferable_insight\":\"Replacing linear lookups with constant-time data structures, combined with memory reuse and early-exit heuristics, drastically improves the efficiency of computationally intensive algorithms.\",\"domain_tags\":[\"Algorithm Optimization\",\"Performance Engineering\",\"Data Structures\"]}", "cost_usd": 0.036362500000000006, "bootstrap_seed": 0, "agent_model": "gemini-3.1-pro-preview", "held_out_score": null, "criterion_names": null, "per_criterion_scores": null, "failure_classification": null, "drafts_generated": 1, "drafts_survived": 1}
{"id": "b6d40e49-6beb-487a-8431-9fd591c87d7d", "target_id": "B3-greedy", "git_sha": "b1407006f8add3143c0056b66b26c67be803ca6d", "pre_experiment_sha": "0f323aa4824821d251b4ada8dea61b36efb6541f", "timestamp": "2026-04-20T23:12:18.509613+00:00", "hypothesis": "Optimize Levenshtein distance by inlining min operations, adding length difference checks, and grouping target strings by length to drastically reduce the number of comparisons.", "hypothesis_source": "agent", "mutation_diff_summary": "", "score": 93.3, "score_ci_lower": null, "score_ci_upper": null, "raw_scores": null, "baseline_score": 139.76, "outcome": "KEPT", "failure_mode": null, "duration_seconds": 120.20518479100429, "tags": ["performance", "algorithmic-optimization", "deduplication", "string-matching"], "learnings": "{\"what_changed\":\"\",\"what_improved\":[],\"what_regressed\":[],\"transferable_insight\":\"Processing efficiency can be significantly improved by reducing function call overhead, implementing early-exit heuristics, and grouping inputs by shared characteristics to minimize unnecessary comparisons.\",\"domain_tags\":[\"Algorithm Optimization\",\"Performance Engineering\",\"Data Processing\"]}", "cost_usd": 0.036680000000000004, "bootstrap_seed": 0, "agent_model": "gemini-3.1-pro-preview", "held_out_score": null, "criterion_names": null, "per_criterion_scores": null, "failure_classification": null, "drafts_generated": 1, "drafts_survived": 1}
{"id": "cf1ee812-3d58-442f-9af1-a0aa52bf2ba3", "target_id": "B3-greedy", "git_sha": "b1407006f8add3143c0056b66b26c67be803ca6d", "pre_experiment_sha": "b1407006f8add3143c0056b66b26c67be803ca6d", "timestamp": "2026-04-20T23:15:56.833377+00:00", "hypothesis": "Inline the Levenshtein DP logic into the pair-finding loop, strip common prefixes and suffixes before DP to drastically reduce matrix size, and use a fast `zip`-based inner loop with early exit to minimize Python overhead.", "hypothesis_source": "agent", "mutation_diff_summary": "", "score": 114.01, "score_ci_lower": null, "score_ci_upper": null, "raw_scores": null, "baseline_score": 93.3, "outcome": "DISCARDED", "failure_mode": null, "duration_seconds": 210.2721199998632, "tags": ["performance", "inline", "dynamic-programming", "algorithmic-optimization"], "learnings": "{\"what_changed\":\"\",\"what_improved\":[],\"what_regressed\":[],\"transferable_insight\":\"Manually inlining complex logic and adding custom early-exit conditions in interpreted languages often degrades performance because the interpreter overhead outweighs the theoretical algorithmic reductions.\",\"domain_tags\":[\"Performance Optimization\",\"Algorithm Design\",\"Interpreted Languages\"]}", "cost_usd": 0.044448600000000005, "bootstrap_seed": 0, "agent_model": "gemini-3.1-pro-preview", "held_out_score": null, "criterion_names": null, "per_criterion_scores": null, "failure_classification": {"category": "logic_error", "description": "The experiment's score of 114.0100 strongly suggests an incorrect numerical computation of the Levenshtein distance. The optimizations, such as stripping common prefixes/suffixes or inlining DP logic, likely introduced a bug in the core algorithm, leading to an inaccurate result instead of just a performance issue or format error. Common pitfalls in these optimizations include incorrect indexing after stripping, mishandling of base cases in the inlined DP, or errors in the early exit condition.", "fix_direction": "Prioritize correctness over raw speed initially. Introduce comprehensive unit tests with known Levenshtein distance pairs (including edge cases like identical strings, empty strings, one string being a prefix of another) to verify the algorithm's accuracy. Then, re-introduce optimizations one by one, carefully testing each step. Specifically, review the prefix/suffix stripping logic for correct length adjustments and start/end indices, and ensure the inlined DP logic correctly initializes the matrix and applies the recurrence relations.", "confidence": 0.95}, "drafts_generated": 1, "drafts_survived": 1}
{"id": "541793a3-91e0-489a-b127-46eaada7f669", "target_id": "B3-greedy", "git_sha": "0bce5f9ec709981f296c792e7531cbcdb00e83f2", "pre_experiment_sha": "b1407006f8add3143c0056b66b26c67be803ca6d", "timestamp": "2026-04-20T23:18:27.723476+00:00", "hypothesis": "Optimize the Levenshtein distance calculation by using a true 1D array to eliminate list allocation/swapping overhead, short-circuiting matrix cell updates on character matches, and streamlining the deduplication logic.", "hypothesis_source": "agent", "mutation_diff_summary": "", "score": 83.91, "score_ci_lower": null, "score_ci_upper": null, "raw_scores": null, "baseline_score": 93.3, "outcome": "KEPT", "failure_mode": null, "duration_seconds": 119.52744416682981, "tags": ["performance", "dynamic-programming", "array-optimization"], "learnings": "{\"what_changed\":\"\",\"what_improved\":[],\"what_regressed\":[],\"transferable_insight\":\"Replacing dynamic memory allocations with flattened 1D arrays and short-circuiting redundant state updates significantly improves the computational efficiency of iterative algorithms.\",\"domain_tags\":[\"Algorithm Optimization\",\"Memory Management\",\"Performance Engineering\"]}", "cost_usd": 0.0366975, "bootstrap_seed": 0, "agent_model": "gemini-3.1-pro-preview", "held_out_score": null, "criterion_names": null, "per_criterion_scores": null, "failure_classification": null, "drafts_generated": 1, "drafts_survived": 1}
{"id": "71f405e6-53c8-4211-87e7-9df7fa17da32", "target_id": "B3-greedy", "git_sha": "0bce5f9ec709981f296c792e7531cbcdb00e83f2", "pre_experiment_sha": "0bce5f9ec709981f296c792e7531cbcdb00e83f2", "timestamp": "2026-04-20T23:20:48.626042+00:00", "hypothesis": "Optimize the Levenshtein distance calculation by tracking the diagonal with a single variable to reduce array lookups, using `min(v)` for fast C-level early exits, and replacing the dictionary with a direct-indexed list for O(1) length-based string grouping.", "hypothesis_source": "agent", "mutation_diff_summary": "", "score": 90.65, "score_ci_lower": null, "score_ci_upper": null, "raw_scores": null, "baseline_score": 83.91, "outcome": "DISCARDED", "failure_mode": null, "duration_seconds": 132.907410542015, "tags": ["dp-optimization", "1d-array", "early-exit", "list-grouping"], "learnings": "{\"what_changed\":\"\",\"what_improved\":[],\"what_regressed\":[],\"transferable_insight\":\"Theoretical micro-optimizations, such as replacing hash maps with direct-indexed arrays or adding early-exit checks, can degrade performance if the hidden overhead of these mechanisms outweighs their algorithmic benefits.\",\"domain_tags\":[\"Algorithm Optimization\",\"Performance Tuning\",\"Data Structures\"]}", "cost_usd": 0.037112, "bootstrap_seed": 0, "agent_model": "gemini-3.1-pro-preview", "held_out_score": null, "criterion_names": null, "per_criterion_scores": null, "failure_classification": {"category": "logic_error", "description": "The proposed optimizations for Levenshtein distance calculation, such as tracking the diagonal with a single variable, implementing C-level early exits, or using a direct-indexed list for grouping, likely contained flaws in their implementation or underlying reasoning. These errors could have led to incorrect Levenshtein distance calculations, introduced unexpected performance overhead despite the intent to optimize, or resulted in other subtle bugs that caused the experiment to fail and produce the given score. The 'unknown' failure mode suggests the problem was not a superficial error but rather an issue within the algorithmic changes themselves.", "fix_direction": "Thoroughly review and verify the correctness of each optimization technique independently. Implement robust unit tests to ensure the Levenshtein distance calculation remains accurate after each change. Profile the performance impact of each optimization in isolation and in combination, carefully comparing against a known baseline to identify if specific changes introduce new bottlenecks or degrade performance rather than improving it. Debug the intermediate states of the calculation to pinpoint where the logic deviates from expected behavior.", "confidence": 0.9}, "drafts_generated": 1, "drafts_survived": 1}
{"id": "2a10d129-0dd1-4bbc-bf69-2775b078e48a", "target_id": "B3-greedy", "git_sha": "dd5ae4387854916e7fb11e8fd740e3368e6a7907", "pre_experiment_sha": "0bce5f9ec709981f296c792e7531cbcdb00e83f2", "timestamp": "2026-04-20T23:23:01.039163+00:00", "hypothesis": "Optimize the Levenshtein distance inner loop by replacing ternary operators with simple `if` statements for `min` calculations, and streamline the pair-finding list comprehension by using `dict.get()` to avoid unnecessary lookups.", "hypothesis_source": "agent", "mutation_diff_summary": "", "score": 83.2, "score_ci_lower": null, "score_ci_upper": null, "raw_scores": null, "baseline_score": 83.91, "outcome": "KEPT", "failure_mode": null, "duration_seconds": 114.18867941689678, "tags": ["performance", "optimization", "dynamic-programming", "levenshtein"], "learnings": "{\"what_changed\":\"\",\"what_improved\":[],\"what_regressed\":[],\"transferable_insight\":\"Simplifying inline conditional expressions into standard control flow statements and utilizing direct key-value retrieval methods reduces execution overhead in high-frequency operations.\",\"domain_tags\":[\"Code Optimization\",\"Performance Tuning\",\"Algorithm Efficiency\"]}", "cost_usd": 0.036435, "bootstrap_seed": 0, "agent_model": "gemini-3.1-pro-preview", "held_out_score": null, "criterion_names": null, "per_criterion_scores": null, "failure_classification": null, "drafts_generated": 1, "drafts_survived": 1}
{"id": "d6f5401d-b6b3-4f47-80b5-128f198d89b7", "target_id": "B3-greedy", "git_sha": "1b026d3e5808e1fd64156f24d1bdd246227c1c85", "pre_experiment_sha": "dd5ae4387854916e7fb11e8fd740e3368e6a7907", "timestamp": "2026-04-20T23:25:43.247113+00:00", "hypothesis": "Use `collections.defaultdict` to group strings by length more efficiently, reducing dictionary lookup and insertion overhead.", "hypothesis_source": "agent", "mutation_diff_summary": "", "score": 81.92, "score_ci_lower": null, "score_ci_upper": null, "raw_scores": null, "baseline_score": 83.2, "outcome": "KEPT", "failure_mode": null, "duration_seconds": 142.6723712501116, "tags": ["optimization", "dict-lookup", "defaultdict"], "learnings": "{\"what_changed\":\"\",\"what_improved\":[],\"what_regressed\":[],\"transferable_insight\":\"Utilizing data structures with automatic default value initialization reduces lookup and insertion overhead when grouping or categorizing elements.\",\"domain_tags\":[\"Data Structures\",\"Performance Optimization\",\"Software Engineering\"]}", "cost_usd": 0.035902500000000004, "bootstrap_seed": 0, "agent_model": "gemini-3.1-pro-preview", "held_out_score": null, "criterion_names": null, "per_criterion_scores": null, "failure_classification": null, "drafts_generated": 1, "drafts_survived": 1}
{"id": "7928a50e-1dad-41ae-acbf-037ecfeab920", "target_id": "B3-greedy", "git_sha": "1b026d3e5808e1fd64156f24d1bdd246227c1c85", "pre_experiment_sha": "1b026d3e5808e1fd64156f24d1bdd246227c1c85", "timestamp": "2026-04-20T23:28:15.347661+00:00", "hypothesis": "Optimize `_find_close_pairs` by using a standard dict (avoiding `defaultdict` overhead), converting length-grouped lists to tuples for faster iteration, and replacing the nested loop `.get()` with an inline `in` check inside a single list comprehension.", "hypothesis_source": "agent", "mutation_diff_summary": "", "score": 82.03, "score_ci_lower": null, "score_ci_upper": null, "raw_scores": null, "baseline_score": 81.92, "outcome": "DISCARDED", "failure_mode": null, "duration_seconds": 146.19323129206896, "tags": ["performance", "dictionary-optimization", "loop-unrolling", "list-comprehension"], "learnings": "{\"what_changed\":\"\",\"what_improved\":[],\"what_regressed\":[],\"transferable_insight\":\"Micro-optimizing code by replacing specialized, natively implemented data structures with standard alternatives and adding explicit type conversions often introduces overhead that negates expected performance gains.\",\"domain_tags\":[\"Performance Optimization\",\"Micro-optimization\",\"Data Structures\"]}", "cost_usd": 0.037116800000000005, "bootstrap_seed": 0, "agent_model": "gemini-3.1-pro-preview", "held_out_score": null, "criterion_names": null, "per_criterion_scores": null, "failure_classification": {"category": "logic_error", "description": "The attempted optimizations likely introduced incorrect behavior. Replacing `defaultdict` without proper key existence checks can lead to `KeyError` or incorrect initialization. Converting mutable lists to immutable tuples could cause `TypeError` if subsequent parts of the algorithm expected to modify those lists. Most critically, replacing dictionary `.get()` calls with an `in` check within a list comprehension fundamentally alters how values are retrieved, likely leading to missing or incorrectly processed pairs. These changes would cause the function to return incorrect results, manifesting as a degraded score even if the code runs without crashing.", "fix_direction": "Revert the changes that alter the core logic of pair finding. Focus on ensuring functional equivalence before measuring performance. Specifically, review how `defaultdict` was used and ensure the `dict` replacement correctly handles key initialization. Carefully verify that replacing `.get()` with an `in` check (and subsequent value access) preserves the original logic for retrieving and processing elements. Ensure that converting lists to tuples does not conflict with any mutation expectations.", "confidence": 0.9}, "drafts_generated": 1, "drafts_survived": 1}
