{"id": "ceebe37e-543e-4938-a402-ff0fdcd79598", "target_id": "B3-greedy", "git_sha": "f0b666c3e9605b81d951db22d75e8e4b1f2efa97", "pre_experiment_sha": "f0b666c3e9605b81d951db22d75e8e4b1f2efa97", "timestamp": "2026-04-21T01:00:17.264534+00:00", "hypothesis": "Restore deterministic ordering by removing non-deterministic `set()` conversions in `_find_close_pairs` and properly implementing order-preserving list deduplication in `_deduplicate_pairs` using an O(1) lookup set.", "hypothesis_source": "agent", "mutation_diff_summary": "", "score": 74.68, "score_ci_lower": null, "score_ci_upper": null, "raw_scores": null, "baseline_score": 73.25, "outcome": "DISCARDED", "failure_mode": null, "duration_seconds": 217.90202970802784, "tags": ["determinism", "bugfix", "order-preservation", "set-iteration\n\n```python\nfrom __future__ import annotations\n\nimport time\nfrom collections import defaultdict\n\n_NAMES_A: list[str] = [\n    \"alice\"", "\"alexander\"", "\"alicia\"", "\"alison\"", "\"alicia\"", "\"benjamin\"", "\"bennett\"", "\"beatrice\"", "\"bernadette\"", "\"blake\"", "\"catherine\"", "\"carolina\"", "\"cassandra\"", "\"cecilia\"", "\"celeste\"", "\"daniel\"", "\"danielle\"", "\"darius\"", "\"darwin\"", "\"davina\"", "\"eleanor\"", "\"elizabeth\"", "\"elliot\"", "\"eloise\"", "\"elvira\"", "\"franklin\"", "\"francesca\"", "\"frederica\"", "\"felicity\"", "\"flora\"", "\"gabriel\"", "\"gabriella\"", "\"genevieve\"", "\"georgia\"", "\"geraldine\"", "\"harriet\"", "\"harrison\"", "\"hayden\"", "\"helena\"", "\"henrietta\"", "\"isabella\"", "\"isadora\"", "\"isidore\"", "\"isolde\"", "\"imelda\"", "\"jasper\"", "\"jacqueline\"", "\"janelle\"", "\"jarvis\"", "\"jessamine\"", "\"katherine\"", "\"katrina\"", "\"kendall\"", "\"kennedy\"", "\"kieran\"", "\"laurence\"", "\"lavinia\"", "\"lazarus\"", "\"leander\"", "\"leonora\"", "\"margaret\"", "\"marianne\"", "\"marlowe\"", "\"mathilda\"", "\"maximiliana\"", "\"nathaniel\"", "\"natasha\"", "\"neil\"", "\"nelson\"", "\"nerissa\"", "\"octavia\"", "\"oliver\"", "\"olympia\"", "\"ophelia\"", "\"orion\"", "\"penelope\"", "\"percival\"", "\"persephone\"", "\"petra\"", "\"philippa\"", "\"quinton\"", "\"quintessa\"", "\"quincey\"", "\"queenie\"", "\"quentin\"", "\"rosalind\"", "\"rosalinda\"", "\"rosamund\"", "\"rowena\"", "\"roxanne\"", "\"sebastian\"", "\"seraphina\"", "\"sigrid\"", "\"silvana\"", "\"solomon\"", "\"theodore\"", "\"theodosia\"", "\"thomas\"", "\"thomasina\"", "\"titania\"", "\"ulysses\"", "\"una\"", "\"uriah\"", "\"ursula\"", "\"umberto\"", "\"valentina\"", "\"valerian\"", "\"vera\"", "\"veronica\"", "\"victoria\"", "\"wilhelmina\"", "\"winifred\"", "\"winston\"", "\"wren\"", "\"wyatt\"", "\"xavier\"", "\"xena\"", "\"xerxes\"", "\"xiomara\"", "\"xochitl\"", "\"yolanda\"", "\"yolande\"", "\"yorick\"", "\"yvette\"", "\"yvonne\"", "\"zacharias\"", "\"zelda\"", "\"zenobia\"", "\"zephyr\"", "\"zinnia\"", "\"adriana\"", "\"adrienne\"", "\"agatha\"", "\"agnes\"", "\"aigerim\"", "\"barnabas\"", "\"bartholomew\"", "\"basil\"", "\"beckett\"", "\"belinda\"", "\"calista\"", "\"calliope\"", "\"camellia\"", "\"camille\"", "\"candida\"", "\"damaris\"", "\"damian\"", "\"daphne\"", "\"deidre\"", "\"delilah\"", "\"ebenezer\"", "\"edith\"", "\"edwina\"", "\"effie\"", "\"eglantine\"", "\"fabian\"", "\"faith\"", "\"fantine\"", "\"faye\"", "\"felicia\"", "\"galatea\"", "\"gareth\"", "\"gawain\"", "\"gemma\"", "\"gideon\"", "\"hector\"", "\"hedwig\"", "\"heloise\"", "\"hester\"", "\"hildegard\"", "\"ignatius\"", "\"ines\"", "\"ingrid\"", "\"irene\"", "\"iris\"", "\"jacob\"", "\"jocasta\"", "\"jocelyn\"", "\"joel\"", "\"johanna\"", "\"krista\"", "\"kristopher\"", "\"kyle\"", "\"kylie\"", "\"kyra\"", "\"lancelot\"", "\"lara\"", "\"lars\"", "\"latasha\"", "\"layla\"", "\"mackenzie\"", "\"madeline\"", "\"magnus\"", "\"malachi\"", "\"malone\"", "\"naomi\"", "\"narcissa\"", "\"nadia\"", "\"nigel\"", "\"niobe\"", "\"orlanda\"", "\"oswald\"", "\"ottilia\"", "\"owain\"", "\"ozymandias\"", "\"paloma\"", "\"pamela\"", "\"pandora\"", "\"pascal\"", "\"patience\"", "\"raffael\"", "\"ramona\"", "\"randolph\"", "\"raphaela\"", "\"reginald\"", "\"sabrina\"", "\"sacheverell\"", "\"salome\"", "\"samantha\"", "\"sapphire\"", "\"tabitha\"", "\"talitha\"", "\"tamsin\"", "\"tarquin\"", "\"tessa\"", "\"ulrika\"", "\"undine\"", "\"upton\"", "\"urbane\"", "\"urien\"", "\"violetta\"", "\"virginia\"", "\"vivian\"", "\"vivienne\"", "\"voss\"", "\"warwick\"", "\"wendell\"", "\"wendy\"", "\"wilbur\"", "\"wilfred\"", "]\n\n_NAMES_B: list[str] = [\n    \"alyce\"", "\"alexender\"", "\"alecia\"", "\"allison\"", "\"alisha\"", "\"benjamine\"", "\"bennet\"", "\"beatrix\"", "\"bernadett\"", "\"blaise\"", "\"catharine\"", "\"karoline\"", "\"kassandra\"", "\"cecilya\"", "\"celest\"", "\"danyal\"", "\"daniele\"", "\"daryus\"", "\"darwinn\"", "\"davena\"", "\"elenor\"", "\"elizebeth\"", "\"eliott\"", "\"elois\"", "\"elveera\"", "\"franklyn\"", "\"fransesca\"", "\"frederika\"", "\"felicite\"", "\"flora\"", "\"gabriell\"", "\"gabriela\"", "\"geneviv\"", "\"georgea\"", "\"geraldyne\"", "\"harriett\"", "\"harryson\"", "\"haydn\"", "\"heleena\"", "\"henryetta\"", "\"izabella\"", "\"isadore\"", "\"isidor\"", "\"isold\"", "\"imelda\"", "\"gasper\"", "\"jackline\"", "\"janell\"", "\"jarvis\"", "\"jessamin\"", "\"katerine\"", "\"katreena\"", "\"kendal\"", "\"kennedee\"", "\"kierran\"", "\"laurens\"", "\"lavinia\"", "\"lazaros\"", "\"leandre\"", "\"leonore\"", "\"margeret\"", "\"mariann\"", "\"marlo\"", "\"matilda\"", "\"maximiliane\"", "\"nathanyal\"", "\"natacha\"", "\"neil\"", "\"nellson\"", "\"nerisa\"", "\"octavya\"", "\"olivar\"", "\"olimpia\"", "\"ofelia\"", "\"oreon\"", "\"penelopy\"", "\"percieval\"", "\"persephon\"", "\"peetra\"", "\"phillipa\"", "\"quinten\"", "\"quinteesa\"", "\"quincee\"", "\"queeny\"", "\"quenten\"", "\"rosalinde\"", "\"rosalynd\"", "\"rosamunde\"", "\"roweena\"", "\"roxann\"", "\"sebastien\"", "\"serafina\"", "\"sigred\"", "\"silvanna\"", "\"soloman\"", "\"theodor\"", "\"theodozia\"", "\"tomas\"", "\"tomasina\"", "\"titanya\"", "\"ulises\"", "\"oona\"", "\"uriyah\"", "\"ursulea\"", "\"umbertho\"", "\"valentyna\"", "\"valerien\"", "\"verra\"", "\"veronika\"", "\"victorya\"", "\"wilhemina\"", "\"winnifred\"", "\"winsten\"", "\"wren\"", "\"wyat\"", "\"xaviar\"", "\"zeena\"", "\"zerxes\"", "\"xiomarra\"", "\"xochitil\"", "\"yolander\"", "\"yolanda\"", "\"yorrik\"", "\"yvett\"", "\"ivonne\"", "\"zacharyus\"", "\"zeleda\"", "\"zenobya\"", "\"zefir\"", "\"zinyah\"", "\"adrienna\"", "\"adriann\"", "\"agather\"", "\"agness\"", "\"aygerim\"", "\"barnabis\"", "\"bartholemew\"", "\"basill\"", "\"becket\"", "\"belynda\"", "\"calister\"", "\"calliopee\"", "\"camelia\"", "\"camil\"", "\"candyda\"", "\"damares\"", "\"damyen\"", "\"dafne\"", "\"deidree\"", "\"delyla\"", "\"ebeneezer\"", "\"edyth\"", "\"edwinna\"", "\"effy\"", "\"eglantyne\"", "\"fabyian\"", "\"faithe\"", "\"fanteen\"", "\"fayye\"", "\"felisha\"", "\"galatea\"", "\"garreth\"", "\"gawaine\"", "\"jemma\"", "\"giddeon\"", "\"hecter\"", "\"hedwidge\"", "\"heloyse\"", "\"hesther\"", "\"hildigard\"", "\"ignatious\"", "\"inez\"", "\"ingred\"", "\"ireen\"", "\"irys\"", "\"jakob\"", "\"jocasta\"", "\"jocelin\"", "\"joell\"", "\"johana\"", "\"kresta\"", "\"kristofer\"", "\"kile\"", "\"kylee\"", "\"kira\"", "\"lancelott\"", "\"larra\"", "\"larrs\"", "\"latashia\"", "\"laila\"", "\"mackensie\"", "\"madelyne\"", "\"magnes\"", "\"malakhi\"", "\"malonne\"", "\"naomie\"", "\"narcissa\"", "\"nadja\"", "\"nigell\"", "\"niobee\"", "\"orlanda\"", "\"oswald\"", "\"ottilya\"", "\"owaine\"", "\"ozymandeas\"", "\"palomma\"", "\"pamella\"", "\"pandorra\"", "\"pascall\"", "\"pacience\"", "\"raffaell\"", "\"ramonna\"", "\"randolfe\"", "\"raphaella\"", "\"reginalde\"", "\"sabrina\"", "\"sacheverel\"", "\"salomee\"", "\"samanthia\"", "\"saphire\"", "\"tabithia\"", "\"talithia\"", "\"tamzin\"", "\"tarquine\"", "\"tess\"", "\"ulricka\"", "\"ondine\"", "\"uptown\"", "\"urbanee\"", "\"uryen\"", "\"violeta\"", "\"virginie\"", "\"vivyan\"", "\"vivienn\"", "\"vos\"", "\"warwicke\"", "\"wendall\"", "\"wendie\"", "\"wilbure\"", "\"wilfrid\"", "]\n\n\ndef _levenshtein(s: str", "t: str", "threshold: int = 1000000) -> int:\n    \"\"\"Optimized Levenshtein distance with 1D array updates and early exit.\"\"\"\n    if s == t:\n        return 0\n    len_s = len(s)\n    len_t = len(t)\n    if len_s < len_t:\n        s", "t = t", "s\n        len_s", "len_t = len_t", "len_s\n        \n    thresh_plus_1 = threshold + 1\n    if len_s - len_t > threshold:\n        return thresh_plus_1\n    \n    v = list(range(len_t + 1))\n    \n    for i", "cs in enumerate(s", "1):\n        left = i\n        up = v[0]\n        if i <= threshold:\n            for j", "ct in enumerate(t):\n                diag = up\n                up = v[j + 1]\n                v[j] = left\n                if cs == ct:\n                    left = diag\n                else:\n                    if up < diag:\n                        if left > up:\n                            left = up\n                    elif left > diag:\n                        left = diag\n                    left += 1\n            v[len_t] = left\n        else:\n            min_v = left\n            for j", "ct in enumerate(t):\n                diag = up\n                up = v[j + 1]\n                v[j] = left\n                if cs == ct:\n                    left = diag\n                else:\n                    if up < diag:\n                        if left > up:\n                            left = up\n                    elif left > diag:\n                        left = diag\n                    left += 1\n                if left < min_v:\n                    min_v = left\n            v[len_t] = left\n            if min_v > threshold:\n                return thresh_plus_1\n            \n    return v[-1]\n\n\ndef _find_close_pairs(list_a: list[str]", "list_b: list[str]", "threshold: int) -> list[tuple[str", "str", "int]]:\n    \"\"\"Return all unique (a", "b", "distance) pairs where distance <= threshold.\"\"\"\n    b_by_len = defaultdict(list)\n    for b in list_b:\n        b_by_len[len(b)].append(b)\n        \n    a_by_len = defaultdict(list)\n    for a in list_a:\n        a_by_len[len(a)].append(a)\n            \n    return [\n        (a", "b", "dist)\n        for la", "a_list in a_by_len.items()\n        for l in range(la - threshold", "la + threshold + 1)\n        for b in b_by_len.get(l", "())\n        for a in a_list\n        if (dist := _levenshtein(a", "b", "threshold)) <= threshold\n    ]\n\n\ndef _deduplicate_pairs(pairs: list[tuple[str", "str", "int]]) -> list[tuple[str", "str", "int]]:\n    \"\"\"Remove duplicate (a", "b) pairs using a set for O(1) lookups.\"\"\"\n    seen = set()\n    unique_pairs = []\n    for pair in pairs:\n        if pair not in seen:\n            seen.add(pair)\n            unique_pairs.append(pair)\n    return unique_pairs\n\n\ndef run_benchmark() -> tuple[int", "float]:\n    \"\"\"Execute the benchmark and return (match_count", "elapsed_ms).\"\"\"\n    start = time.perf_counter()\n\n    raw_pairs = _find_close_pairs(_NAMES_A", "_NAMES_B", "threshold=2)\n    unique_pairs = _deduplicate_pairs(raw_pairs)\n    match_count = len(unique_pairs)\n\n    elapsed_ms = (time.perf_counter() - start) * 1000.0\n    return match_count", "elapsed_ms\n\n\nif __name__ == \"__main__\":\n    count", "elapsed = run_benchmark()\n    print(f\"match_count: {count}\")\n    print(f\"execution_time_ms: {elapsed:.2f}\")\n```"], "learnings": "{\"what_changed\":\"\",\"what_improved\":[],\"what_regressed\":[],\"transferable_insight\":\"Enforcing deterministic ordering through custom order-preserving deduplication can degrade performance compared to native set operations, especially if downstream processes do not strictly require ordered data.\",\"domain_tags\":[\"Algorithm Optimization\",\"Data Structures\",\"Software Engineering\"]}", "cost_usd": 0.03927460000000001, "bootstrap_seed": 0, "agent_model": "gemini-3.1-pro-preview", "held_out_score": null, "criterion_names": null, "per_criterion_scores": null, "failure_classification": {"category": "semantic_drift", "description": "The experiment aimed to restore deterministic ordering in the output, which is a key semantic property. The failure, despite a non-zero score, indicates that the output either remained non-deterministic, or became deterministic but with an incorrect or unintended order, thus failing to convey the desired meaning of a consistently ordered result. The 'unknown' failure mode suggests that the issue is not structural or syntactical, but rather functional correctness at a deeper level related to the intended data properties.", "fix_direction": "Future attempts should focus on rigorously testing the determinism of the output. This includes verifying that the 'order-preserving list deduplication' is correctly implemented to ensure stability and that all sources of non-determinism (like previous set conversions) have been fully eliminated without introducing new ones. Detailed logging or differential testing against expected deterministic outputs could help pinpoint where the ordering deviates.", "confidence": 0.9}, "drafts_generated": 1, "drafts_survived": 1}
{"id": "dc0a242c-6097-4699-8af7-b53e516cfb37", "target_id": "B3-greedy", "git_sha": "f0b666c3e9605b81d951db22d75e8e4b1f2efa97", "pre_experiment_sha": "f0b666c3e9605b81d951db22d75e8e4b1f2efa97", "timestamp": "2026-04-21T01:02:44.882572+00:00", "hypothesis": "Replace `range()` evaluations and `dict.get()` lookups in the pair-finding list comprehension with a direct iteration over `b_by_len.items()` filtered by `abs(la - lb) <= threshold` to reduce iterator and method call overhead.", "hypothesis_source": "agent", "mutation_diff_summary": "", "score": 74.16, "score_ci_lower": null, "score_ci_upper": null, "raw_scores": null, "baseline_score": 73.25, "outcome": "DISCARDED", "failure_mode": null, "duration_seconds": 120.95436437497847, "tags": ["list-comprehension", "optimization"], "learnings": "{\"what_changed\":\"\",\"what_improved\":[],\"what_regressed\":[],\"transferable_insight\":\"Replacing targeted key lookups with a full collection iteration and conditional filtering degrades performance by evaluating unnecessary elements, outweighing any savings from reduced method call overhead.\",\"domain_tags\":[\"Performance Optimization\",\"Data Structures\",\"Algorithmic Complexity\"]}", "cost_usd": 0.03941730000000001, "bootstrap_seed": 0, "agent_model": "gemini-3.1-pro-preview", "held_out_score": null, "criterion_names": null, "per_criterion_scores": null, "failure_classification": {"category": "regression", "description": "The attempted optimization to reduce iterator and method call overhead by switching to direct iteration likely resulted in degraded performance compared to the original implementation. The new approach either introduced more overhead than it saved or failed to address the actual performance bottleneck, leading to a worse (or at least non-improved) score.", "fix_direction": "Thoroughly profile both the original and the optimized code to identify the actual performance hotspots. Analyze the overhead of the new direct iteration and filtering approach, considering Python's execution model and the efficiency of built-in functions versus custom iteration logic. Consider alternative optimization strategies or revert to the original implementation if it proved more efficient.", "confidence": 0.9}, "drafts_generated": 1, "drafts_survived": 1}
{"id": "8d3a3e64-2c8f-4322-b393-0972891c8912", "target_id": "B3-greedy", "git_sha": "f0b666c3e9605b81d951db22d75e8e4b1f2efa97", "pre_experiment_sha": "f0b666c3e9605b81d951db22d75e8e4b1f2efa97", "timestamp": "2026-04-21T01:17:37.184131+00:00", "hypothesis": "Optimize the Levenshtein inner loop by hoisting the `v[j] = left` array update to avoid duplication, and streamline the DP state transitions by reading `v[j + 1]` directly into `up` when characters match, eliminating the need for the intermediate `diag` variable.", "hypothesis_source": "agent", "mutation_diff_summary": "", "score": 76.05, "score_ci_lower": null, "score_ci_upper": null, "raw_scores": null, "baseline_score": 73.25, "outcome": "DISCARDED", "failure_mode": null, "duration_seconds": 132.50499579194002, "tags": ["performance", "loop-optimization", "dynamic-programming"], "learnings": "{\"what_changed\":\"\",\"what_improved\":[],\"what_regressed\":[],\"transferable_insight\":\"Manually micro-optimizing tight loops by eliminating intermediate variables and hoisting array updates often degrades performance by interfering with the compiler's native optimization heuristics.\",\"domain_tags\":[\"Performance Optimization\",\"Compiler Optimization\",\"Code Refactoring\"]}", "cost_usd": 0.04003810000000001, "bootstrap_seed": 0, "agent_model": "gemini-3.1-pro-preview", "held_out_score": null, "criterion_names": null, "per_criterion_scores": null, "failure_classification": {"category": "logic_error", "description": "The proposed micro-optimizations, involving hoisting array updates and streamlining DP state variables (`diag`), likely introduced a subtle flaw in the Levenshtein dynamic programming recurrence relations or state management. This resulted in incorrect calculation of the Levenshtein distance, even though the code executed (indicated by a non-zero score), failing to meet the experiment's goal due to logical inaccuracy.", "fix_direction": "Carefully re-verify the dynamic programming recurrence relations and state updates. Trace the execution with small, known inputs for both the original and modified logic to identify where the results diverge. Ensure that eliminating or simplifying variables (`diag`) or hoisting assignments (`v[j] = left`) does not break the core correctness of the Levenshtein algorithm before re-evaluating performance.", "confidence": 0.9}, "drafts_generated": 1, "drafts_survived": 1}
{"id": "825d7b18-ce91-449f-b872-847e6638feb5", "target_id": "B3-greedy", "git_sha": "f0b666c3e9605b81d951db22d75e8e4b1f2efa97", "pre_experiment_sha": "f0b666c3e9605b81d951db22d75e8e4b1f2efa97", "timestamp": "2026-04-21T01:20:52.820003+00:00", "hypothesis": "Swap the `if cs == ct` condition to `if cs != ct` in the inner Levenshtein loop to place the more common character mismatch case in the `if` branch, saving a jump instruction and slightly improving branch prediction.", "hypothesis_source": "agent", "mutation_diff_summary": "", "score": 75.06, "score_ci_lower": null, "score_ci_upper": null, "raw_scores": null, "baseline_score": 73.25, "outcome": "DISCARDED", "failure_mode": null, "duration_seconds": 176.81668366701342, "tags": ["micro-optimization", "branch-prediction"], "learnings": "{\"what_changed\":\"\",\"what_improved\":[],\"what_regressed\":[],\"transferable_insight\":\"Manually reordering conditional branches to prioritize the most frequent case often fails to improve performance, as modern compilers and hardware branch predictors already optimize these execution paths effectively.\",\"domain_tags\":[\"Micro-optimization\",\"Compiler Optimization\",\"Branch Prediction\"]}", "cost_usd": 0.039459100000000004, "bootstrap_seed": 0, "agent_model": "gemini-3.1-pro-preview", "held_out_score": null, "criterion_names": null, "per_criterion_scores": null, "failure_classification": {"category": "logic_error", "description": "The experiment's hypothesis for optimizing branch prediction was based on incorrect assumptions about character frequency or the actual impact of the code change on CPU branch prediction and pipeline. The observed score of 75.0600 (implying a negative outcome or regression from the baseline) indicates that the logic for improving performance was flawed.", "fix_direction": "Re-evaluate the assumptions about the commonality of character mismatches vs. matches in typical Levenshtein inputs. Profile the original and modified code thoroughly to understand actual branch prediction statistics, cache effects, and instruction pipeline stalls on the target architecture. Consider that compiler optimizations or specific CPU behaviors might negate or even reverse the intended benefit of such a micro-optimization.", "confidence": 0.9}, "drafts_generated": 1, "drafts_survived": 1}
