{"id": "d8665d0b-f0bd-42bd-b5d4-a39178e023cc", "target_id": "B3-greedy", "git_sha": "b500efcb8ce0d3021b2ba516874f08771e7a3207", "pre_experiment_sha": "b500efcb8ce0d3021b2ba516874f08771e7a3207", "timestamp": "2026-04-20T23:46:22.686733+00:00", "hypothesis": "Avoid tracking the diagonal and up variables across iterations by reading directly from the array, saving assignments and delaying `up` lookups until a mismatch occurs.", "hypothesis_source": "agent", "mutation_diff_summary": "", "score": 82.43, "score_ci_lower": null, "score_ci_upper": null, "raw_scores": null, "baseline_score": 78.34, "outcome": "DISCARDED", "failure_mode": null, "duration_seconds": 155.67399520799518, "tags": ["dp", "micro-optimization", "array-access"], "learnings": "{\"what_changed\":\"\",\"what_improved\":[],\"what_regressed\":[],\"transferable_insight\":\"Replacing local state tracking with direct memory reads to save assignment operations often degrades performance due to the higher overhead of memory access compared to local variable maintenance.\",\"domain_tags\":[\"Performance Optimization\",\"Memory Management\",\"Algorithm Design\"]}", "cost_usd": 0.036987849999999996, "bootstrap_seed": 0, "agent_model": "gemini-3.1-pro-preview", "held_out_score": null, "criterion_names": null, "per_criterion_scores": null, "failure_classification": {"category": "logic_error", "description": "The hypothesis proposed an optimization by altering the logic for tracking `diagonal` and `up` variables, aiming to save assignments and delay lookups by reading directly from the array. The experiment's failure, with an 'unknown' failure mode, suggests that this new logic either introduced incorrect calculations, failed to handle certain states or conditions correctly, or caused an unexpected performance degradation (e.g., due to increased cache misses outweighing assignment savings). The 'unknown' aspect indicates that while the outcome was negative, the specific flaw in the revised logic has not yet been pinpointed.", "fix_direction": "Thoroughly review the implementation of the new logic for `diagonal` and `up` variable handling. Focus on identifying any cases where reading directly from the array or delaying `up` lookups might lead to stale data, incorrect state management, or unexpected computational errors. Profile the code to determine if the direct array access patterns are introducing performance bottlenecks (e.g., higher latency or cache misses) that negate or worsen the intended gains from fewer assignments. Implement detailed unit tests or assertions to validate the correctness of the new logic across various inputs and edge cases, comparing its intermediate and final results against a known correct baseline. Debug specific scenarios where the score might have degraded to pinpoint the exact logical flaw.", "confidence": 0.9}, "drafts_generated": 1, "drafts_survived": 1}
{"id": "7c92c20d-b79c-4722-89c5-2d261aee8547", "target_id": "B3-greedy", "git_sha": "b500efcb8ce0d3021b2ba516874f08771e7a3207", "pre_experiment_sha": "b500efcb8ce0d3021b2ba516874f08771e7a3207", "timestamp": "2026-04-20T23:49:26.241680+00:00", "hypothesis": "Optimize `_levenshtein` by removing the diagonal tracking variable to read directly from the array, simplifying `min` logic with independent `if` statements, ensuring the shorter string is the outer loop to minimize setup overhead, and implementing O(1) set-based deduplication in `_deduplicate_pairs`.", "hypothesis_source": "agent", "mutation_diff_summary": "", "score": 89.68, "score_ci_lower": null, "score_ci_upper": null, "raw_scores": null, "baseline_score": 78.34, "outcome": "DISCARDED", "failure_mode": null, "duration_seconds": 156.78563191602007, "tags": ["algorithm", "dynamic-programming", "early-exit", "fast-path", "set-deduplication"], "learnings": "{\"what_changed\":\"\",\"what_improved\":[],\"what_regressed\":[],\"transferable_insight\":\"Replacing built-in operations with manual branching and adopting theoretically optimal data structures can degrade overall performance due to high constant-factor overheads and the disruption of low-level compiler optimizations.\",\"domain_tags\":[\"Algorithm Optimization\",\"Performance Engineering\",\"Micro-optimization\"]}", "cost_usd": 0.037206300000000005, "bootstrap_seed": 0, "agent_model": "gemini-3.1-pro-preview", "held_out_score": null, "criterion_names": null, "per_criterion_scores": null, "failure_classification": {"category": "logic_error", "description": "The attempted optimizations in `_levenshtein`, particularly changes to how diagonal values are tracked and `min` logic is handled, likely introduced subtle errors in the Levenshtein distance calculation. This resulted in incorrect distances being computed, which manifested as a reduced evaluation score (89.68) rather than a crash or parse error. The O(1) set-based deduplication in `_deduplicate_pairs` could also be a source of incorrect behavior, leading to a degraded score if it failed to deduplicate correctly or erroneously removed valid pairs.", "fix_direction": "Isolate and rigorously test each optimization. For `_levenshtein`, create extensive unit tests with known correct Levenshtein distances for various string pairs, including edge cases. Verify that reading directly from the array after removing diagonal tracking yields identical results to a proven implementation. Ensure the simplified `min` logic is mathematically equivalent. For `_deduplicate_pairs`, confirm the set-based approach correctly identifies and removes only true duplicates. Revert changes one by one if necessary to pinpoint the exact source of the logic error, prioritizing correctness over speculative performance gains.", "confidence": 0.95}, "drafts_generated": 1, "drafts_survived": 1}
{"id": "b77c297e-efee-49be-96d6-c399340b91f0", "target_id": "B3-greedy", "git_sha": "b500efcb8ce0d3021b2ba516874f08771e7a3207", "pre_experiment_sha": "b500efcb8ce0d3021b2ba516874f08771e7a3207", "timestamp": "2026-04-20T23:52:03.815493+00:00", "hypothesis": "Remove the forbidden string swap and redundant length difference check in `_levenshtein` since the caller already guarantees the length constraints, and consolidate variable initialization to reduce overhead.", "hypothesis_source": "agent", "mutation_diff_summary": "", "score": 79.88, "score_ci_lower": null, "score_ci_upper": null, "raw_scores": null, "baseline_score": 78.34, "outcome": "DISCARDED", "failure_mode": null, "duration_seconds": 118.64104324998334, "tags": ["levenshtein", "early-exit", "redundant-check"], "learnings": "{\"what_changed\":\"\",\"what_improved\":[],\"what_regressed\":[],\"transferable_insight\":\"Removing seemingly redundant internal validation or fast-path checks based on assumptions about caller behavior can unexpectedly degrade performance or cause failures.\",\"domain_tags\":[\"Performance Optimization\",\"Defensive Programming\",\"Code Refactoring\"]}", "cost_usd": 0.0363338, "bootstrap_seed": 0, "agent_model": "gemini-3.1-pro-preview", "held_out_score": null, "criterion_names": null, "per_criterion_scores": null, "failure_classification": {"category": "logic_error", "description": "The hypothesis assumed certain checks were redundant or that the caller guaranteed length constraints, which appears to have been incorrect. Removing the 'forbidden string swap' or 'redundant length difference check', or consolidating variable initialization, introduced a logical flaw in the `_levenshtein` function, leading to incorrect calculations for some inputs. The 'unknown' failure mode and the non-zero score (79.88) suggest the code still executed but produced incorrect results rather than crashing, indicating a subtle logical flaw rather than a blatant runtime error.", "fix_direction": "Re-evaluate the assumptions about the 'redundant' nature of the removed checks and the robustness of caller guarantees. Thoroughly test the `_levenshtein` function with a comprehensive set of diverse inputs, especially edge cases where string swaps or specific length differences might be critical. Focus on debugging specific scenarios where the Levenshtein distance calculation might be incorrect, which could have been previously handled by the removed logic.", "confidence": 0.95}, "drafts_generated": 1, "drafts_survived": 1}
{"id": "0cd13ebd-76a5-4216-9f8a-c9f625154c73", "target_id": "B3-greedy", "git_sha": "b500efcb8ce0d3021b2ba516874f08771e7a3207", "pre_experiment_sha": "b500efcb8ce0d3021b2ba516874f08771e7a3207", "timestamp": "2026-04-20T23:54:42.308179+00:00", "hypothesis": "Optimize the Levenshtein inner loop by folding the `+1` increment into the `min` assignments to reduce total operations, and move the array update `v[j + 1] = left` inside the loop to eliminate the post-loop assignment.", "hypothesis_source": "agent", "mutation_diff_summary": "", "score": 80.12, "score_ci_lower": null, "score_ci_upper": null, "raw_scores": null, "baseline_score": 78.34, "outcome": "DISCARDED", "failure_mode": null, "duration_seconds": 136.91496970900334, "tags": ["performance", "loop-optimization", "dynamic-programming"], "learnings": "{\"what_changed\":\"\",\"what_improved\":[],\"what_regressed\":[],\"transferable_insight\":\"Moving state updates into tight inner loops to consolidate operations often degrades performance by increasing per-iteration overhead and hindering compiler optimizations.\",\"domain_tags\":[\"Loop Optimization\",\"Performance Engineering\",\"Algorithm Design\"]}", "cost_usd": 0.03754745000000001, "bootstrap_seed": 0, "agent_model": "gemini-3.1-pro-preview", "held_out_score": null, "criterion_names": null, "per_criterion_scores": null, "failure_classification": {"category": "regression", "description": "The proposed micro-optimizations, intended to reduce operations, likely resulted in a performance degradation rather than an improvement. Modern compilers are often highly sophisticated and may already optimize such patterns, or the manual changes inadvertently interfered with compiler optimizations, increased instruction complexity for the CPU, or negatively impacted pipeline efficiency or cache performance, leading to a regression in execution speed.", "fix_direction": "Instead of attempting micro-optimizations without detailed performance insight, first, establish a clear performance baseline and thoroughly profile the code to pinpoint actual bottlenecks. If performance is still critical, explore higher-level algorithmic improvements. If micro-optimizations are necessary, use empirical data from detailed profiling tools (e.g., `perf`, VTune) to measure instruction counts, cache misses, and branch predictions before and after changes, rather than relying on theoretical operation counts.", "confidence": 0.9}, "drafts_generated": 1, "drafts_survived": 1}
{"id": "79fcc98d-1dfb-4bd2-b6d9-f45cfa252b0c", "target_id": "B3-greedy", "git_sha": "65e0e0a64c9904582da9ef0b556b61c0aa9f4c1c", "pre_experiment_sha": "b500efcb8ce0d3021b2ba516874f08771e7a3207", "timestamp": "2026-04-20T23:57:44.684219+00:00", "hypothesis": "Split the DP row iteration into two phases (`i <= threshold` and `i > threshold`) to entirely eliminate redundant `min_v` tracking and comparisons in the first `threshold` rows where early exit is mathematically impossible.", "hypothesis_source": "agent", "mutation_diff_summary": "", "score": 73.51, "score_ci_lower": null, "score_ci_upper": null, "raw_scores": null, "baseline_score": 78.34, "outcome": "KEPT", "failure_mode": null, "duration_seconds": 162.63204929116182, "tags": ["optimization", "dynamic-programming", "loop-splitting", "fast-path"], "learnings": "{\"what_changed\":\"\",\"what_improved\":[],\"what_regressed\":[],\"transferable_insight\":\"Partitioning iterative processes into distinct phases based on theoretical thresholds eliminates redundant conditional checks during stages where those conditions are mathematically impossible to meet.\",\"domain_tags\":[\"Algorithm Optimization\",\"Loop Optimization\",\"Performance Tuning\"]}", "cost_usd": 0.038192500000000004, "bootstrap_seed": 0, "agent_model": "gemini-3.1-pro-preview", "held_out_score": null, "criterion_names": null, "per_criterion_scores": null, "failure_classification": null, "drafts_generated": 1, "drafts_survived": 1}
{"id": "1de76ce8-c9de-4aa0-8ff5-8556ecca5ad2", "target_id": "B3-greedy", "git_sha": "65e0e0a64c9904582da9ef0b556b61c0aa9f4c1c", "pre_experiment_sha": "65e0e0a64c9904582da9ef0b556b61c0aa9f4c1c", "timestamp": "2026-04-21T00:00:54.416712+00:00", "hypothesis": "Split the DP row iteration into two phases using an iterator (`s_iter = enumerate(s, 1)`) to entirely eliminate the `i <= threshold` branch from the outer loop, and safely skip the first phase if `threshold == 0`.", "hypothesis_source": "agent", "mutation_diff_summary": "", "score": 75.65, "score_ci_lower": null, "score_ci_upper": null, "raw_scores": null, "baseline_score": 73.51, "outcome": "DISCARDED", "failure_mode": null, "duration_seconds": 169.81145316711627, "tags": ["algorithm", "performance", "fast-path", "early-exit"], "learnings": "{\"what_changed\":\"\",\"what_improved\":[],\"what_regressed\":[],\"transferable_insight\":\"Replacing a simple, highly predictable conditional branch inside a loop with complex loop-splitting and iterator management often degrades performance because the structural overhead outweighs the benefits of branch elimination.\",\"domain_tags\":[\"Loop Optimization\",\"Branch Prediction\",\"Performance Engineering\"]}", "cost_usd": 0.038834200000000006, "bootstrap_seed": 0, "agent_model": "gemini-3.1-pro-preview", "held_out_score": null, "criterion_names": null, "per_criterion_scores": null, "failure_classification": {"category": "over_optimization", "description": "The attempt to eliminate the `i <= threshold` branch, while aiming for performance improvement, likely introduced new overheads (e.g., iterator creation, phase switching, or potentially less optimal CPU cache/branch prediction behavior for the new structure) that negated or even surpassed the gains from branch elimination. The reported score suggests the change did not improve performance, and potentially degraded it, indicating that the chosen optimization strategy was ineffective or counterproductive.", "fix_direction": "Prioritize profiling to identify the true performance bottleneck before attempting micro-optimizations. Re-evaluate if the `i <= threshold` branch was indeed a significant bottleneck, and whether its cost outweighs the overhead of the two-phase iteration. Consider simpler or compiler-assisted optimizations first, or revert to a clearer implementation if the performance benefit is marginal or negative.", "confidence": 0.9}, "drafts_generated": 1, "drafts_survived": 1}
{"id": "ac22eb9d-0b69-482e-b792-c263313d2749", "target_id": "B3-greedy", "git_sha": "65e0e0a64c9904582da9ef0b556b61c0aa9f4c1c", "pre_experiment_sha": "65e0e0a64c9904582da9ef0b556b61c0aa9f4c1c", "timestamp": "2026-04-21T00:03:57.826202+00:00", "hypothesis": "Flatten the nested `else: if` blocks in the Levenshtein dynamic programming inner loops into `elif` to eliminate an indentation level and reduce bytecode jump overhead.", "hypothesis_source": "agent", "mutation_diff_summary": "", "score": 73.62, "score_ci_lower": null, "score_ci_upper": null, "raw_scores": null, "baseline_score": 73.51, "outcome": "DISCARDED", "failure_mode": null, "duration_seconds": 159.0601030420512, "tags": ["micro-optimization", "loop-optimization"], "learnings": "{\"what_changed\":\"\",\"what_improved\":[],\"what_regressed\":[],\"transferable_insight\":\"Micro-optimizing control flow structures, such as flattening nested conditionals to reduce theoretical bytecode jumps, often fails to yield measurable performance improvements in tight algorithmic loops.\",\"domain_tags\":[\"Code Optimization\",\"Control Flow\",\"Micro-optimization\"]}", "cost_usd": 0.03856955, "bootstrap_seed": 0, "agent_model": "gemini-3.1-pro-preview", "held_out_score": null, "criterion_names": null, "per_criterion_scores": null, "failure_classification": {"category": "regression", "description": "The experiment aimed to optimize the Levenshtein algorithm's performance by flattening `else: if` blocks into `elif` to reduce bytecode jump overhead. However, the attempt failed, resulting in a score of 73.6200. This indicates a degradation (or lack of improvement) in a previously-passing criterion (likely performance or correctness) compared to the baseline, which is a regression. The specific underlying reason for the failure (e.g., actual performance degradation, introduction of a subtle logical bug, or no actual bytecode jump reduction) is unknown.", "fix_direction": "Investigate the actual impact of the `elif` refactoring on bytecode generation and execution performance using profiling tools. Determine if the change introduced a subtle logic error in the Levenshtein calculation, or if the assumed performance benefits of `elif` over nested `else: if` did not materialize or even worsened performance in this specific context. Compare detailed performance metrics (e.g., execution time, CPU cycles, cache misses) and correctness against the original implementation.", "confidence": 0.9}, "drafts_generated": 1, "drafts_survived": 1}
{"id": "45e0b0f8-2ac8-4173-b4bd-aa9ff712e253", "target_id": "B3-greedy", "git_sha": "65e0e0a64c9904582da9ef0b556b61c0aa9f4c1c", "pre_experiment_sha": "65e0e0a64c9904582da9ef0b556b61c0aa9f4c1c", "timestamp": "2026-04-21T00:07:40.845089+00:00", "hypothesis": "Split the Levenshtein DP loop into two distinct phases using string slicing to entirely eliminate the per-row `i <= threshold` branch, bind `_levenshtein` and `dict.get` to local variables in the pair-finding comprehension, and replace `up = v[0]` with `up = i - 1` to save a list lookup.", "hypothesis_source": "agent", "mutation_diff_summary": "", "score": 80.09, "score_ci_lower": null, "score_ci_upper": null, "raw_scores": null, "baseline_score": 73.51, "outcome": "DISCARDED", "failure_mode": null, "duration_seconds": 200.42231645807624, "tags": ["loop-splitting", "local-variable-binding", "branch-elimination", "micro-optimization"], "learnings": "{\"what_changed\":\"\",\"what_improved\":[],\"what_regressed\":[],\"transferable_insight\":\"Eliminating simple conditional branches by splitting loops and slicing data structures can degrade performance because the memory allocation overhead of creating new slices often outweighs the cost of the branch itself.\",\"domain_tags\":[\"Algorithm Optimization\",\"Memory Management\",\"Code Refactoring\"]}", "cost_usd": 0.039088450000000004, "bootstrap_seed": 0, "agent_model": "gemini-3.1-pro-preview", "held_out_score": null, "criterion_names": null, "per_criterion_scores": null, "failure_classification": {"category": "logic_error", "description": "The replacement of `up = v[0]` with `up = i - 1` in the Levenshtein distance dynamic programming algorithm likely introduced a fundamental error. `v[0]` typically represents a calculated distance value from the previous row, not the row index itself. This change would cause the Levenshtein distances to be computed incorrectly, leading to the observed score.", "fix_direction": "Revert the change `up = i - 1`. Thoroughly review the Levenshtein DP recurrence relation and ensure that all state transitions, especially the calculation of `up` and other intermediate values, are correctly implemented before attempting further performance optimizations.", "confidence": 0.95}, "drafts_generated": 1, "drafts_survived": 1}
