{"id": "b8df0dee-879d-4362-b0b3-836908ed86ba", "target_id": "B3-treatment", "git_sha": "48babaaa2f272f618d3ca68a026620faaba1cba2", "pre_experiment_sha": "48babaaa2f272f618d3ca68a026620faaba1cba2", "timestamp": "2026-04-19T15:33:56.309397+00:00", "hypothesis": "Cache the shorter string length and character accesses inside bounded Levenshtein to reduce repeated work without changing results.", "hypothesis_source": "agent", "mutation_diff_summary": "", "score": 105.9, "score_ci_lower": null, "score_ci_upper": null, "raw_scores": null, "baseline_score": 100.13, "outcome": "DISCARDED", "failure_mode": null, "duration_seconds": 27.572168458020315, "tags": ["length-caching", "micro-optimization", "levenshtein"], "learnings": "{\"what_changed\":\"\",\"what_improved\":[],\"what_regressed\":[],\"transferable_insight\":\"Caching repeatedly used intermediate values can simplify computation, but if the optimization does not measurably reduce work or affect outcomes, it should be discarded rather than kept for its own sake.\",\"domain_tags\":[\"optimization\",\"performance-engineering\",\"algorithm-design\"]}", "cost_usd": 0.0829392, "bootstrap_seed": 0, "agent_model": "gpt-5.4", "held_out_score": null, "criterion_names": null, "per_criterion_scores": null, "failure_classification": {"category": "logic_error", "description": "The provided details do not include any concrete evidence of what specifically failed (e.g., wrong output, parse error, regression in a known criterion, or changes outside scope). With only the hypothesis and a generic 'unknown' failure mode, the cause cannot be classified into the given options.", "fix_direction": "Collect concrete failure signals (logs, diff of expected vs actual outputs, failing test/criterion name, and any error messages) and then verify whether the change affected correctness, schema/format, or introduced parsing/build issues.", "confidence": 0.05}, "drafts_generated": 1, "drafts_survived": 1}
{"id": "dbf934e7-5ce3-4ca7-b154-da17b3b1c638", "target_id": "B3-treatment", "git_sha": "ecb148a8da149c6fed4e6d2bdadf978ac99fd513", "pre_experiment_sha": "48babaaa2f272f618d3ca68a026620faaba1cba2", "timestamp": "2026-04-19T15:34:34.622892+00:00", "hypothesis": "Cache list lengths once in the benchmark entrypoint to avoid repeated global len computations while preserving all matching behavior.", "hypothesis_source": "agent", "mutation_diff_summary": "", "score": 101.14, "score_ci_lower": null, "score_ci_upper": null, "raw_scores": null, "baseline_score": 100.13, "outcome": "KEPT", "failure_mode": null, "duration_seconds": 35.757878458010964, "tags": ["micro-optimization", "length-caching", "safe"], "learnings": "{\"what_changed\":\"\",\"what_improved\":[],\"what_regressed\":[],\"transferable_insight\":\"When a value is reused repeatedly within a hot path, caching it once at the entry point can reduce redundant work without changing behavior.\",\"domain_tags\":[\"performance-optimization\",\"benchmarking\",\"code-efficiency\"]}", "cost_usd": 0.08275500000000001, "bootstrap_seed": 0, "agent_model": "gpt-5.4", "held_out_score": null, "criterion_names": null, "per_criterion_scores": null, "failure_classification": null, "drafts_generated": 1, "drafts_survived": 1}
{"id": "f8ff7d20-460b-47ea-bcfb-36065c9caba4", "target_id": "B3-treatment", "git_sha": "ecb148a8da149c6fed4e6d2bdadf978ac99fd513", "pre_experiment_sha": "ecb148a8da149c6fed4e6d2bdadf978ac99fd513", "timestamp": "2026-04-19T15:35:07.181593+00:00", "hypothesis": "Cache lengths inside bounded Levenshtein and avoid repeated indexing of the second string.", "hypothesis_source": "agent", "mutation_diff_summary": "", "score": 104.8, "score_ci_lower": null, "score_ci_upper": null, "raw_scores": null, "baseline_score": 101.14, "outcome": "DISCARDED", "failure_mode": null, "duration_seconds": 31.34073462500237, "tags": ["length-caching", "micro-optimization", "levenshtein"], "learnings": "{\"what_changed\":\"\",\"what_improved\":[],\"what_regressed\":[],\"transferable_insight\":\"Micro-optimizations that reduce repeated access to the same bounded data can help, but if they do not change the overall computation pattern they may yield no measurable benefit and should be discarded.\",\"domain_tags\":[\"performance-optimization\",\"algorithm-design\",\"software-engineering\"]}", "cost_usd": 0.0831938, "bootstrap_seed": 0, "agent_model": "gpt-5.4", "held_out_score": null, "criterion_names": null, "per_criterion_scores": null, "failure_classification": {"category": "incomplete_edit", "description": "The failure mode is listed as unknown, suggesting the attempted change likely did not fully implement the intended caching/bounded-Levenshtein optimization across the code path, leaving inconsistent or partially applied state rather than producing a clear parse/format or standalone logic error.", "fix_direction": "Verify that caching of computed Levenshtein subproblem lengths is consistently applied wherever repeated indexing of the second string occurs, and add correctness tests that compare against a known-good baseline for multiple string length/bound scenarios.", "confidence": 0.42}, "drafts_generated": 1, "drafts_survived": 1}
{"id": "48ae192a-d052-464c-9c92-7dcd9c02ba73", "target_id": "B3-treatment", "git_sha": "ecb148a8da149c6fed4e6d2bdadf978ac99fd513", "pre_experiment_sha": "ecb148a8da149c6fed4e6d2bdadf978ac99fd513", "timestamp": "2026-04-19T15:35:45.291247+00:00", "hypothesis": "Cache lengths inside the bounded Levenshtein hot path so repeated length lookups are avoided when available.", "hypothesis_source": "agent", "mutation_diff_summary": "", "score": 102.13, "score_ci_lower": null, "score_ci_upper": null, "raw_scores": null, "baseline_score": 101.14, "outcome": "DISCARDED", "failure_mode": null, "duration_seconds": 31.845090624992736, "tags": ["length-caching", "hot-path", "safe-local-change"], "learnings": "{\"what_changed\":\"\",\"what_improved\":[],\"what_regressed\":[],\"transferable_insight\":\"When a value is repeatedly needed in a tight loop, caching it locally can reduce redundant work, but only if the optimization is actually used and measurable in the critical path.\",\"domain_tags\":[\"performance-optimization\",\"software-engineering\",\"micro-optimization\"]}", "cost_usd": 0.08395200000000001, "bootstrap_seed": 0, "agent_model": "gpt-5.4", "held_out_score": null, "criterion_names": null, "per_criterion_scores": null, "failure_classification": {"category": "logic_error", "description": "The provided information (hypothesis, failure mode labeled 'unknown', and score) does not include any specific observable issue (e.g., output mismatch, logic discrepancy, syntax/parse failure, regression evidence, semantic meaning shift, or an incomplete/unsafe edit). Without concrete failure details, the correct classification can\u2019t be determined from the current data.", "fix_direction": "Reproduce the failed run and capture concrete signals: logs/stack traces, diff of expected vs actual outputs, and which criterion/metric changed versus a passing baseline; then narrow down whether the failure is parsing/format, logic, regression, semantics, or an incomplete edit.", "confidence": 0.12}, "drafts_generated": 1, "drafts_survived": 1}
{"id": "ce8dc47e-abe5-4f44-a301-41ad0de79591", "target_id": "B3-treatment", "git_sha": "b99ab0bb74c031a7c4d7270d26ec1c6aaa6f6d2a", "pre_experiment_sha": "ecb148a8da149c6fed4e6d2bdadf978ac99fd513", "timestamp": "2026-04-19T15:36:20.291138+00:00", "hypothesis": "Cache candidate lengths in a dictionary and reuse them in the bounded Levenshtein hot path.", "hypothesis_source": "agent", "mutation_diff_summary": "", "score": 101.05, "score_ci_lower": null, "score_ci_upper": null, "raw_scores": null, "baseline_score": 101.14, "outcome": "KEPT", "failure_mode": null, "duration_seconds": 32.19335375004448, "tags": ["length-caching", "hot-path", "safe-local-change"], "learnings": "{\"what_changed\":\"\",\"what_improved\":[],\"what_regressed\":[],\"transferable_insight\":\"Precomputing and caching repeated intermediate values can reduce work in tight loops, but the benefit may be too small to show measurable gains if the cached values are already cheap to compute or rarely reused.\",\"domain_tags\":[\"performance-optimization\",\"caching\",\"algorithm-design\"]}", "cost_usd": 0.08360000000000001, "bootstrap_seed": 0, "agent_model": "gpt-5.4", "held_out_score": null, "criterion_names": null, "per_criterion_scores": null, "failure_classification": null, "drafts_generated": 1, "drafts_survived": 1}
{"id": "305e67b6-84d0-40a5-a642-83f092d78b11", "target_id": "B3-treatment", "git_sha": "b99ab0bb74c031a7c4d7270d26ec1c6aaa6f6d2a", "pre_experiment_sha": "b99ab0bb74c031a7c4d7270d26ec1c6aaa6f6d2a", "timestamp": "2026-04-19T15:37:26.073909+00:00", "hypothesis": "Cache and thread string lengths directly into the bounded Levenshtein hot path to avoid repeated len() work.", "hypothesis_source": "agent", "mutation_diff_summary": "", "score": 103.96, "score_ci_lower": null, "score_ci_upper": null, "raw_scores": null, "baseline_score": 101.05, "outcome": "DISCARDED", "failure_mode": null, "duration_seconds": 30.061659625032917, "tags": ["length-cache", "hot-path", "bounded-levenshtein"], "learnings": "{\"what_changed\":\"\",\"what_improved\":[],\"what_regressed\":[],\"transferable_insight\":\"Micro-optimizations that reduce repeated work in a hot path should be validated against real measurements, because added caching or threading can fail to produce meaningful gains and may not change outcomes at all.\",\"domain_tags\":[\"performance-optimization\",\"benchmarking\",\"software-engineering\"]}", "cost_usd": 0.08518619999999999, "bootstrap_seed": 0, "agent_model": "gpt-5.4", "held_out_score": null, "criterion_names": null, "per_criterion_scores": null, "failure_classification": {"category": "logic_error", "description": "The attempted optimization (caching thread/string lengths in the bounded Levenshtein hot path) did not correctly preserve the bounded Levenshtein semantics, leading to a wrong result rather than just a performance change. The failure suggests the cached lengths were not kept consistent with the actual substrings/offsets used inside the algorithm.", "fix_direction": "Verify that any cached length values correspond exactly to the slices/offsets used in the hot path (especially when bounds change or indices shift). Add targeted tests for edge cases (empty strings, tight bounds, varying offsets) and ensure cached values are updated or derived from the same references as in the original code.", "confidence": 0.62}, "drafts_generated": 1, "drafts_survived": 1}
{"id": "f5397744-8c44-41bf-8c3c-b652e3bfb067", "target_id": "B3-treatment", "git_sha": "fb648d883c983f96f1814dffdf539fb5b2974580", "pre_experiment_sha": "b99ab0bb74c031a7c4d7270d26ec1c6aaa6f6d2a", "timestamp": "2026-04-19T15:38:00.970235+00:00", "hypothesis": "Cache candidate/query lengths directly in the bounded Levenshtein hot path to avoid repeated len() recomputation without changing results.", "hypothesis_source": "agent", "mutation_diff_summary": "", "score": 99.74, "score_ci_lower": null, "score_ci_upper": null, "raw_scores": null, "baseline_score": 101.05, "outcome": "KEPT", "failure_mode": null, "duration_seconds": 31.958953915978782, "tags": ["length-cache", "levenshtein", "hot-path"], "learnings": "{\"what_changed\":\"\",\"what_improved\":[],\"what_regressed\":[],\"transferable_insight\":\"When a computation repeatedly needs the same derived values, caching them in the hottest path can reduce overhead without affecting correctness if the cached values are immutable and consistently reused.\",\"domain_tags\":[\"performance-optimization\",\"caching\",\"algorithmic-efficiency\"]}", "cost_usd": 0.08503, "bootstrap_seed": 0, "agent_model": "gpt-5.4", "held_out_score": null, "criterion_names": null, "per_criterion_scores": null, "failure_classification": null, "drafts_generated": 1, "drafts_survived": 1}
{"id": "ac69afe0-4e28-4854-93db-ed4de1c2c2b6", "target_id": "B3-treatment", "git_sha": "6ba37c265cfe45c40daafa52876bb79d44e566c4", "pre_experiment_sha": "fb648d883c983f96f1814dffdf539fb5b2974580", "timestamp": "2026-04-19T15:38:34.908627+00:00", "hypothesis": "Cache lengths for unique strings once and reuse them directly in pair generation and bounded-distance calls.", "hypothesis_source": "agent", "mutation_diff_summary": "", "score": 99.74, "score_ci_lower": null, "score_ci_upper": null, "raw_scores": null, "baseline_score": 99.74, "outcome": "KEPT", "failure_mode": null, "duration_seconds": 32.80641000007745, "tags": ["length-cache", "hot-path", "semantics-preserving"], "learnings": "{\"what_changed\":\"\",\"what_improved\":[],\"what_regressed\":[],\"transferable_insight\":\"Precomputing and reusing invariant values can reduce repeated work without changing results, but it only helps when the cached value is actually reused enough to offset the added bookkeeping.\",\"domain_tags\":[\"optimization\",\"performance\",\"caching\"]}", "cost_usd": 0.08532000000000001, "bootstrap_seed": 0, "agent_model": "gpt-5.4", "held_out_score": null, "criterion_names": null, "per_criterion_scores": null, "failure_classification": null, "drafts_generated": 1, "drafts_survived": 1}
{"id": "ab716c1b-b120-4576-91cd-1be02ce73d9c", "target_id": "B3-treatment", "git_sha": "6ba37c265cfe45c40daafa52876bb79d44e566c4", "pre_experiment_sha": "6ba37c265cfe45c40daafa52876bb79d44e566c4", "timestamp": "2026-04-19T15:39:11.746701+00:00", "hypothesis": "Cache lengths in the bounded Levenshtein hot path and thread known lengths through the repeated comparison loop.", "hypothesis_source": "agent", "mutation_diff_summary": "", "score": 100.2, "score_ci_lower": null, "score_ci_upper": null, "raw_scores": null, "baseline_score": 99.74, "outcome": "DISCARDED", "failure_mode": null, "duration_seconds": 32.58113033301197, "tags": ["length-cache", "hot-path", "levenshtein"], "learnings": "{\"what_changed\":\"\",\"what_improved\":[],\"what_regressed\":[],\"transferable_insight\":\"When a computation repeatedly uses the same derived values, threading those values through the hot path can reduce redundant work, but only if the added complexity actually yields measurable benefit.\",\"domain_tags\":[\"performance-optimization\",\"software-engineering\",\"algorithm-design\"]}", "cost_usd": 0.08585960000000001, "bootstrap_seed": 0, "agent_model": "gpt-5.4", "held_out_score": null, "criterion_names": null, "per_criterion_scores": null, "failure_classification": {"category": "logic_error", "description": "The experiment details provide no concrete failure evidence. Although a hypothesis and a failure mode 'unknown' are given, there is no information about what actually broke (e.g., parsing/runtime error, incorrect output, regression symptoms, or incomplete changes).", "fix_direction": "Collect and report the actual failure signal (error message/stack trace, diff of expected vs actual outputs, and which criterion/regression check failed) so the failure can be mapped to a specific category; then isolate whether changes affected logic, format/schema, scope, or introduced partial/inconsistent state.", "confidence": 0.05}, "drafts_generated": 1, "drafts_survived": 1}
{"id": "00f849d0-c910-402c-8ed9-20f8ae8da552", "target_id": "B3-treatment", "git_sha": "6ba37c265cfe45c40daafa52876bb79d44e566c4", "pre_experiment_sha": "6ba37c265cfe45c40daafa52876bb79d44e566c4", "timestamp": "2026-04-19T15:39:45.721714+00:00", "hypothesis": "Cache string lengths directly on the bounded Levenshtein path and thread precomputed lengths through unchanged comparisons.", "hypothesis_source": "agent", "mutation_diff_summary": "", "score": 103.45, "score_ci_lower": null, "score_ci_upper": null, "raw_scores": null, "baseline_score": 99.74, "outcome": "DISCARDED", "failure_mode": null, "duration_seconds": 31.282564166933298, "tags": ["length-cache", "levenshtein", "hot-path"], "learnings": "{\"what_changed\":\"\",\"what_improved\":[],\"what_regressed\":[],\"transferable_insight\":\"When an optimization adds bookkeeping but does not change any observable comparisons or outcomes, it is likely unnecessary complexity rather than a meaningful improvement.\",\"domain_tags\":[\"optimization\",\"software-engineering\",\"performance\"]}", "cost_usd": 0.08687080000000001, "bootstrap_seed": 0, "agent_model": "gpt-5.4", "held_out_score": null, "criterion_names": null, "per_criterion_scores": null, "failure_classification": {"category": "logic_error", "description": "The change intended to cache string lengths along the bounded Levenshtein path and reuse precomputed lengths, but the experiment failed in an 'unknown' mode with a high score, suggesting the optimization logic did not preserve the correct behavior of the distance/path computation (e.g., lengths were cached or threaded inconsistently with the bounded-path transitions).", "fix_direction": "Verify correctness of the caching keys (indices/offsets) and that cached lengths are used only for comparisons that truly remain unchanged under the bounded Levenshtein updates; add invariants/tests that compare against a baseline implementation for random cases within the same bound.", "confidence": 0.62}, "drafts_generated": 1, "drafts_survived": 1}
{"id": "ea39fa0f-886a-43aa-b0c6-eec17d6819cb", "target_id": "B3-treatment", "git_sha": "6ba37c265cfe45c40daafa52876bb79d44e566c4", "pre_experiment_sha": "6ba37c265cfe45c40daafa52876bb79d44e566c4", "timestamp": "2026-04-19T15:41:35.642891+00:00", "hypothesis": "Cache and thread precomputed string lengths through the bounded Levenshtein hot path consistently, including the equality fast path.", "hypothesis_source": "agent", "mutation_diff_summary": "", "score": 102.06, "score_ci_lower": null, "score_ci_upper": null, "raw_scores": null, "baseline_score": 99.74, "outcome": "DISCARDED", "failure_mode": null, "duration_seconds": 34.71223699999973, "tags": ["length-caching", "levenshtein", "hot-path"], "learnings": "{\"what_changed\":\"\",\"what_improved\":[],\"what_regressed\":[],\"transferable_insight\":\"Optimizations should be applied consistently across all execution paths, including fast paths, or they risk adding complexity without measurable benefit.\",\"domain_tags\":[\"performance-optimization\",\"software-engineering\"]}", "cost_usd": 0.08640720000000002, "bootstrap_seed": 0, "agent_model": "gpt-5.4", "held_out_score": null, "criterion_names": null, "per_criterion_scores": null, "failure_classification": {"category": "semantic_drift", "description": "The intended optimization (caching and precomputing string lengths in the bounded Levenshtein hot path, including the equality fast path) did not reliably preserve the original semantics/behavior along that path. The result likely reflects an incorrect integration point or mismatch in how lengths are cached/used, causing the algorithm\u2019s effective distance/equality handling to diverge from the baseline.", "fix_direction": "Re-validate correctness of the hot path logic: ensure cached length values correspond exactly to the current inputs, cover the equality fast path with the same length source as the main path, and add targeted tests around edge cases (empty strings, equal strings, boundary lengths) to confirm semantic equivalence.", "confidence": 0.46}, "drafts_generated": 1, "drafts_survived": 1}
{"id": "ac6acc3f-1ee3-4567-a6e2-2683af69479c", "target_id": "B3-treatment", "git_sha": "6ba37c265cfe45c40daafa52876bb79d44e566c4", "pre_experiment_sha": "6ba37c265cfe45c40daafa52876bb79d44e566c4", "timestamp": "2026-04-19T15:42:16.648575+00:00", "hypothesis": "Cache and thread string lengths consistently through the bounded Levenshtein hot path to avoid repeated len lookups.", "hypothesis_source": "agent", "mutation_diff_summary": "", "score": 101.97, "score_ci_lower": null, "score_ci_upper": null, "raw_scores": null, "baseline_score": 99.74, "outcome": "DISCARDED", "failure_mode": null, "duration_seconds": 38.26423704193439, "tags": ["length-caching", "hot-path", "deterministic-safe"], "learnings": "{\"what_changed\":\"\",\"what_improved\":[],\"what_regressed\":[],\"transferable_insight\":\"When optimizing a hot path, caching repeatedly used metadata can reduce overhead, but only if the added complexity measurably improves performance.\",\"domain_tags\":[\"performance-optimization\",\"software-engineering\",\"micro-optimization\"]}", "cost_usd": 0.08724119999999999, "bootstrap_seed": 0, "agent_model": "gpt-5.4", "held_out_score": null, "criterion_names": null, "per_criterion_scores": null, "failure_classification": {"category": "incomplete_edit", "description": "The experiment intended to cache thread/string lengths through the bounded Levenshtein hot path, but the failure mode is listed as unknown and the high score suggests the change likely left the codebase in an inconsistent or partially-applied state (e.g., caching not used everywhere in the intended path, or missing updates/initialization for cached values).", "fix_direction": "Ensure the cached length values are computed once per relevant input, correctly propagated through all bounded Levenshtein call sites, and that cache lifetimes/invalidations match the original semantics; add tests/assertions to verify cached lengths match live len() results along the full hot path.", "confidence": 0.38}, "drafts_generated": 1, "drafts_survived": 1}
