{"id": "2615e150-65ff-42a4-a6f8-36ab9bc5a8fb", "target_id": "B3-treatment", "git_sha": "fb1cba86e07a519cafcdd04eb0a76ca54d1fb35d", "pre_experiment_sha": "6ba37c265cfe45c40daafa52876bb79d44e566c4", "timestamp": "2026-04-19T15:42:55.337864+00:00", "hypothesis": "Cache and thread precomputed string lengths through the bounded Levenshtein hot path consistently, including after internal string swapping.", "hypothesis_source": "agent", "mutation_diff_summary": "", "score": 100.41, "score_ci_lower": null, "score_ci_upper": null, "raw_scores": null, "baseline_score": 99.74, "outcome": "KEPT", "failure_mode": null, "duration_seconds": 32.86797162506264, "tags": ["length-caching", "levenshtein", "hot-path"], "learnings": "{\"what_changed\":\"\",\"what_improved\":[],\"what_regressed\":[],\"transferable_insight\":\"Precomputing and consistently propagating frequently reused values through all branches of a performance-critical path can reduce redundant work without changing behavior.\",\"domain_tags\":[\"performance-optimization\",\"software-engineering\",\"algorithm-design\"]}", "cost_usd": 0.08638000000000001, "bootstrap_seed": 0, "agent_model": "gpt-5.4", "held_out_score": null, "criterion_names": null, "per_criterion_scores": null, "failure_classification": null, "drafts_generated": 1, "drafts_survived": 1}
{"id": "eea37587-ec06-4776-b53a-21e35cdb3269", "target_id": "B3-treatment", "git_sha": "fb1cba86e07a519cafcdd04eb0a76ca54d1fb35d", "pre_experiment_sha": "fb1cba86e07a519cafcdd04eb0a76ca54d1fb35d", "timestamp": "2026-04-19T15:43:29.052585+00:00", "hypothesis": "Cache candidate lengths by reusing the existing per-string length cache directly in pair iteration to avoid rebuilding tuple lists and repeated length lookups.", "hypothesis_source": "agent", "mutation_diff_summary": "", "score": 101.01, "score_ci_lower": null, "score_ci_upper": null, "raw_scores": null, "baseline_score": 100.41, "outcome": "DISCARDED", "failure_mode": null, "duration_seconds": 32.63202012493275, "tags": ["length-caching", "hot-path", "bounded-levenshtein"], "learnings": "{\"what_changed\":\"\",\"what_improved\":[],\"what_regressed\":[],\"transferable_insight\":\"Reusing existing cached values in the hot path can reduce overhead, but only if it preserves the current data access pattern without introducing extra iteration or reconstruction costs.\",\"domain_tags\":[\"performance-optimization\",\"caching\",\"algorithm-design\"]}", "cost_usd": 0.08613740000000002, "bootstrap_seed": 0, "agent_model": "gpt-5.4", "held_out_score": null, "criterion_names": null, "per_criterion_scores": null, "failure_classification": {"category": "logic_error", "description": "The provided information does not include enough detail about what actually failed (no error message, behavioral difference, or code/output mismatch). The hypothesis concerns caching/per-string length reuse, but the failure mode is listed as 'unknown' and no evidence indicates which category applies.", "fix_direction": "Capture and analyze the concrete failure signal (stack trace, failing assertion, diff of expected vs actual output, or metric computation mismatch), then verify whether the change caused output/meaning/logic issues or incomplete integration of the cache reuse.", "confidence": 0.12}, "drafts_generated": 1, "drafts_survived": 1}
{"id": "faa8406d-2d56-4cc6-9e04-08e4fc161320", "target_id": "B3-treatment", "git_sha": "43269663d58476cf2e1efbba171d965a7c2a619e", "pre_experiment_sha": "fb1cba86e07a519cafcdd04eb0a76ca54d1fb35d", "timestamp": "2026-04-19T15:44:06.177409+00:00", "hypothesis": "Reuse cached string lengths in the bounded Levenshtein hot path and thread them consistently through repeated comparisons.", "hypothesis_source": "agent", "mutation_diff_summary": "", "score": 100.03, "score_ci_lower": null, "score_ci_upper": null, "raw_scores": null, "baseline_score": 100.41, "outcome": "KEPT", "failure_mode": null, "duration_seconds": 34.48659512505401, "tags": ["length-caching", "levenshtein", "hot-path"], "learnings": "{\"what_changed\":\"\",\"what_improved\":[],\"what_regressed\":[],\"transferable_insight\":\"When a computation repeatedly compares the same inputs, caching and consistently reusing invariant intermediate values can reduce overhead even if the benefit is subtle and not immediately visible in coarse metrics.\",\"domain_tags\":[\"performance-optimization\",\"caching\",\"software-engineering\"]}", "cost_usd": 0.08612500000000001, "bootstrap_seed": 0, "agent_model": "gpt-5.4", "held_out_score": null, "criterion_names": null, "per_criterion_scores": null, "failure_classification": null, "drafts_generated": 1, "drafts_survived": 1}
{"id": "99fb8e87-e9fb-45d0-ae5b-caf5e1143930", "target_id": "B3-treatment", "git_sha": "43269663d58476cf2e1efbba171d965a7c2a619e", "pre_experiment_sha": "43269663d58476cf2e1efbba171d965a7c2a619e", "timestamp": "2026-04-19T15:45:21.355281+00:00", "hypothesis": "Thread already-cached string lengths through the repeated comparison hot path and avoid rebuilding per-item length tuples.", "hypothesis_source": "agent", "mutation_diff_summary": "", "score": 100.86, "score_ci_lower": null, "score_ci_upper": null, "raw_scores": null, "baseline_score": 100.03, "outcome": "DISCARDED", "failure_mode": null, "duration_seconds": 35.19495408399962, "tags": ["length-cache", "levenshtein", "hot-path"], "learnings": "{\"what_changed\":\"\",\"what_improved\":[],\"what_regressed\":[],\"transferable_insight\":\"Optimizations that add bookkeeping to a hot path should be validated against their actual overhead, because avoiding one allocation or recomputation can still lose if the added complexity outweighs the savings.\",\"domain_tags\":[\"performance-optimization\",\"software-engineering\",\"benchmarking\"]}", "cost_usd": 0.0857976, "bootstrap_seed": 0, "agent_model": "gpt-5.4", "held_out_score": null, "criterion_names": null, "per_criterion_scores": null, "failure_classification": {"category": "logic_error", "description": "Failure mode is listed as 'unknown', so there\u2019s no evidence provided that the failure is due to formatting/schema, logic/calculation, regression of a prior criterion, scope/syntax/semantic issues, over-optimization, or an incomplete edit. The hypothesis suggests an optimization, but no actual failure behavior, diff, or failing assertion is given to map it to a specific category.", "fix_direction": "Collect concrete failure evidence (error message, failing test/criterion, diff of changes) and verify whether behavior/meaning or structure changed versus the previous passing baseline; then focus on ensuring cached-length changes preserve semantics without impacting output format or control flow.", "confidence": 0.05}, "drafts_generated": 1, "drafts_survived": 1}
{"id": "8f7401a0-6d79-4c8f-a095-65ba9e8dfda2", "target_id": "B3-treatment", "git_sha": "43269663d58476cf2e1efbba171d965a7c2a619e", "pre_experiment_sha": "43269663d58476cf2e1efbba171d965a7c2a619e", "timestamp": "2026-04-19T15:46:35.920185+00:00", "hypothesis": "Use the existing per-string length cache to thread cached lengths through the repeated bounded-distance path consistently.", "hypothesis_source": "agent", "mutation_diff_summary": "", "score": 101.78, "score_ci_lower": null, "score_ci_upper": null, "raw_scores": null, "baseline_score": 100.03, "outcome": "DISCARDED", "failure_mode": null, "duration_seconds": 34.23256008303724, "tags": ["length-cache", "levenshtein", "hot-path"], "learnings": "{\"what_changed\":\"\",\"what_improved\":[],\"what_regressed\":[],\"transferable_insight\":\"Reusing cached intermediate results only helps when the optimization is applied consistently across all repeated execution paths; partial threading of the cache often yields no measurable benefit.\",\"domain_tags\":[\"optimization\",\"caching\",\"performance\"]}", "cost_usd": 0.08584040000000001, "bootstrap_seed": 0, "agent_model": "gpt-5.4", "held_out_score": null, "criterion_names": null, "per_criterion_scores": null, "failure_classification": {"category": "logic_error", "description": "The provided information (Hypothesis, Failure Mode: unknown, Score: 101.7800) does not include any concrete indication of what failed (e.g., parsing/format issues, logic/calc mistakes, regressions, out-of-scope edits, semantic meaning errors, or partial edits). Without error logs or evidence, the failure mode cannot be mapped to one of the given categories.", "fix_direction": "Obtain the actual failure signal (error trace, diff, failing test/assertion, or reviewer feedback) and classify based on whether the change broke syntax/format, altered intended meaning, regressed a known pass, edited outside allowed files/areas, or left inconsistent partial state.", "confidence": 0.05}, "drafts_generated": 1, "drafts_survived": 1}
{"id": "87210c91-5113-4ca1-9586-a2f459b76a1a", "target_id": "B3-treatment", "git_sha": "43269663d58476cf2e1efbba171d965a7c2a619e", "pre_experiment_sha": "43269663d58476cf2e1efbba171d965a7c2a619e", "timestamp": "2026-04-19T15:47:15.445686+00:00", "hypothesis": "Cache and thread both string lengths through the bounded Levenshtein hot path using the existing per-string length cache.", "hypothesis_source": "agent", "mutation_diff_summary": "", "score": 105.48, "score_ci_lower": null, "score_ci_upper": null, "raw_scores": null, "baseline_score": 100.03, "outcome": "DISCARDED", "failure_mode": null, "duration_seconds": 36.69830620801076, "tags": ["length-caching", "levenshtein", "hot-path"], "learnings": "{\"what_changed\":\"\",\"what_improved\":[],\"what_regressed\":[],\"transferable_insight\":\"Reusing an existing cache can simplify a hot path, but if the added threading of cached values does not reduce work or improve measurable outcomes, the change should be discarded.\",\"domain_tags\":[\"performance-optimization\",\"software-engineering\",\"caching\"]}", "cost_usd": 0.08682200000000001, "bootstrap_seed": 0, "agent_model": "gpt-5.4", "held_out_score": null, "criterion_names": null, "per_criterion_scores": null, "failure_classification": {"category": "logic_error", "description": "The provided details do not include enough information about what specifically failed (e.g., incorrect output, regression, parsing error, or inconsistent state). Without logs, diff, or observed behavior tied to the hypothesis, the failure mode cannot be mapped to one of the given categories.", "fix_direction": "Provide the failing test output (expected vs actual), error logs/stack trace, and the code/config diff around the bounded Levenshtein hot path and per-string length cache usage so the failure can be categorized precisely.", "confidence": 0.05}, "drafts_generated": 1, "drafts_survived": 1}
{"id": "96fe69e6-27f8-4279-9a81-3c3a27eb2036", "target_id": "B3-treatment", "git_sha": "43269663d58476cf2e1efbba171d965a7c2a619e", "pre_experiment_sha": "43269663d58476cf2e1efbba171d965a7c2a619e", "timestamp": "2026-04-19T15:47:53.117093+00:00", "hypothesis": "Reuse cached string lengths directly in the bounded Levenshtein hot path by passing prebuilt (string, length) tuples through the immediate caller.", "hypothesis_source": "agent", "mutation_diff_summary": "", "score": 100.73, "score_ci_lower": null, "score_ci_upper": null, "raw_scores": null, "baseline_score": 100.03, "outcome": "DISCARDED", "failure_mode": null, "duration_seconds": 34.90025708300527, "tags": ["length-caching", "hot-path", "levenshtein"], "learnings": "{\"what_changed\":\"\",\"what_improved\":[],\"what_regressed\":[],\"transferable_insight\":\"An optimization that adds data-passing complexity without measurable gains should be discarded, since preserving simplicity can be more valuable than speculative micro-optimizations.\",\"domain_tags\":[\"optimization\",\"software-engineering\",\"performance\"]}", "cost_usd": 0.087216, "bootstrap_seed": 0, "agent_model": "gpt-5.4", "held_out_score": null, "criterion_names": null, "per_criterion_scores": null, "failure_classification": {"category": "incomplete_edit", "description": "The experiment intended to thread (string, length) tuples through the Levenshtein hot path, but the failure mode is unknown and the outcome suggests the change likely left inconsistent state or an incomplete wiring of the new tuple-based reuse (e.g., some call sites still pass only strings/lengths or downstream code expects a different shape).", "fix_direction": "Ensure end-to-end consistency: update all immediate caller/callee interfaces, validate tuple construction and unpacking at every boundary, and add targeted tests for the hot path to confirm lengths are reused correctly without mismatched expectations.", "confidence": 0.62}, "drafts_generated": 1, "drafts_survived": 1}
{"id": "ba0cebae-58be-479a-916e-e500234c6e7b", "target_id": "B3-treatment", "git_sha": "87e12269dc65c1ca017c1f644585d7950f31ad34", "pre_experiment_sha": "43269663d58476cf2e1efbba171d965a7c2a619e", "timestamp": "2026-04-19T15:48:32.900749+00:00", "hypothesis": "Cache both strings and their lengths together in the repeated pair-comparison hot path and thread those cached lengths through unchanged.", "hypothesis_source": "agent", "mutation_diff_summary": "", "score": 99.94, "score_ci_lower": null, "score_ci_upper": null, "raw_scores": null, "baseline_score": 100.03, "outcome": "KEPT", "failure_mode": null, "duration_seconds": 32.5016909170663, "tags": ["length-caching", "levenshtein", "hot-path"], "learnings": "{\"what_changed\":\"\",\"what_improved\":[],\"what_regressed\":[],\"transferable_insight\":\"When a hot path repeatedly compares paired values, caching invariant metadata alongside the values and reusing it unchanged can reduce redundant work without altering behavior.\",\"domain_tags\":[\"performance-optimization\",\"caching\",\"hot-path\"]}", "cost_usd": 0.08652000000000001, "bootstrap_seed": 0, "agent_model": "gpt-5.4", "held_out_score": null, "criterion_names": null, "per_criterion_scores": null, "failure_classification": null, "drafts_generated": 1, "drafts_survived": 1}
{"id": "568f86fc-0349-4edc-a42d-bf7180f2fa31", "target_id": "B3-treatment", "git_sha": "87e12269dc65c1ca017c1f644585d7950f31ad34", "pre_experiment_sha": "87e12269dc65c1ca017c1f644585d7950f31ad34", "timestamp": "2026-04-19T15:49:06.350889+00:00", "hypothesis": "Cache both string lengths together in the repeated comparison path and thread them through consistently to avoid redundant len lookups.", "hypothesis_source": "agent", "mutation_diff_summary": "", "score": 101.05, "score_ci_lower": null, "score_ci_upper": null, "raw_scores": null, "baseline_score": 99.94, "outcome": "DISCARDED", "failure_mode": null, "duration_seconds": 32.36162266694009, "tags": ["length-caching", "bounded-levenshtein", "hot-path"], "learnings": "{\"what_changed\":\"\",\"what_improved\":[],\"what_regressed\":[],\"transferable_insight\":\"When an optimization adds complexity without measurable gains, prefer the simpler implementation and avoid caching or threading derived values unless profiling shows a clear benefit.\",\"domain_tags\":[\"optimization\",\"software-engineering\"]}", "cost_usd": 0.08700980000000001, "bootstrap_seed": 0, "agent_model": "gpt-5.4", "held_out_score": null, "criterion_names": null, "per_criterion_scores": null, "failure_classification": {"category": "incomplete_edit", "description": "The change likely cached and threaded string lengths inconsistently, leaving parts of the code still using the previous length lookups or mixing cached vs. uncached values. This kind of partial, inconsistent propagation often produces correct-looking output format but fails correctness/consistency checks, leading to an unexpected metric failure.", "fix_direction": "Ensure the cached length values are computed once along the repeated comparison path and then used uniformly everywhere in that path (no leftover direct len calls or mismatched source variables). Add targeted tests to verify all comparisons use the same cached lengths.", "confidence": 0.63}, "drafts_generated": 1, "drafts_survived": 1}
{"id": "49e2f58d-db30-415f-b6c4-45822e38e295", "target_id": "B3-treatment", "git_sha": "87e12269dc65c1ca017c1f644585d7950f31ad34", "pre_experiment_sha": "87e12269dc65c1ca017c1f644585d7950f31ad34", "timestamp": "2026-04-19T15:49:43.511474+00:00", "hypothesis": "Cache both strings\u2019 lengths together in the repeated comparison path and reuse the cached pair consistently in the bounded Levenshtein call.", "hypothesis_source": "agent", "mutation_diff_summary": "", "score": 101.87, "score_ci_lower": null, "score_ci_upper": null, "raw_scores": null, "baseline_score": 99.94, "outcome": "DISCARDED", "failure_mode": null, "duration_seconds": 31.478495957911946, "tags": ["length-caching", "hot-path", "bounded-levenshtein"], "learnings": "{\"what_changed\":\"\",\"what_improved\":[],\"what_regressed\":[],\"transferable_insight\":\"When an optimization depends on repeated comparisons, caching and consistently reusing shared metadata can simplify the hot path, but it only helps if the cached values are actually used in the downstream computation.\",\"domain_tags\":[\"optimization\",\"caching\",\"software-engineering\"]}", "cost_usd": 0.08708500000000001, "bootstrap_seed": 0, "agent_model": "gpt-5.4", "held_out_score": null, "criterion_names": null, "per_criterion_scores": null, "failure_classification": {"category": "logic_error", "description": "The proposed optimization to cache both strings\u2019 lengths and reuse the cached pair in the bounded Levenshtein path did not work as intended, indicating an incorrect use of the cached length pair (e.g., caching mismatched values per iteration/call or reusing stale lengths in a different comparison context).", "fix_direction": "Ensure the cached length pair is scoped and indexed correctly to each specific comparison call (avoid reuse across different string pairs), and verify cache invalidation/update happens before each bounded Levenshtein invocation.", "confidence": 0.68}, "drafts_generated": 1, "drafts_survived": 1}
{"id": "e30ef4b3-48ab-4693-865f-7f6c2559f49e", "target_id": "B3-treatment", "git_sha": "87e12269dc65c1ca017c1f644585d7950f31ad34", "pre_experiment_sha": "87e12269dc65c1ca017c1f644585d7950f31ad34", "timestamp": "2026-04-19T15:50:51.839349+00:00", "hypothesis": "Reuse one shared per-string cache carrying both strings and their lengths so repeated bounded-distance comparisons never recompute either side's length in the hot path.", "hypothesis_source": "agent", "mutation_diff_summary": "", "score": 101.3, "score_ci_lower": null, "score_ci_upper": null, "raw_scores": null, "baseline_score": 99.94, "outcome": "DISCARDED", "failure_mode": null, "duration_seconds": 31.320973208057694, "tags": ["length-cache", "levenshtein", "hot-path"], "learnings": "{\"what_changed\":\"\",\"what_improved\":[],\"what_regressed\":[],\"transferable_insight\":\"Combining related metadata into a shared cache can reduce repeated work in hot paths, but the added complexity is only worthwhile if it measurably improves performance or eliminates a real bottleneck.\",\"domain_tags\":[\"performance-optimization\",\"caching\",\"software-engineering\"]}", "cost_usd": 0.08711440000000001, "bootstrap_seed": 0, "agent_model": "gpt-5.4", "held_out_score": null, "criterion_names": null, "per_criterion_scores": null, "failure_classification": {"category": "incomplete_edit", "description": "The experiment failed with an 'unknown' failure mode, which strongly suggests the change was not fully integrated or validated end-to-end (e.g., cache reuse not wired correctly in all call paths or some code paths still recompute lengths, leaving the implementation in an inconsistent/partial state).", "fix_direction": "Verify cache lifecycle and wiring across all bounded-distance comparison paths; add targeted tests/instrumentation to confirm both strings\u2019 lengths are fetched from the shared per-string cache in the hot path under all scenarios.", "confidence": 0.46}, "drafts_generated": 1, "drafts_survived": 1}
{"id": "c5e61a81-1096-409b-947c-c676979345c6", "target_id": "B3-treatment", "git_sha": "87e12269dc65c1ca017c1f644585d7950f31ad34", "pre_experiment_sha": "87e12269dc65c1ca017c1f644585d7950f31ad34", "timestamp": "2026-04-19T15:51:25.605607+00:00", "hypothesis": "Cache and thread both string lengths through the repeated bounded-distance comparison path using a single shared tuple cache.", "hypothesis_source": "agent", "mutation_diff_summary": "", "score": 101.77, "score_ci_lower": null, "score_ci_upper": null, "raw_scores": null, "baseline_score": 99.94, "outcome": "DISCARDED", "failure_mode": null, "duration_seconds": 30.968978957971558, "tags": ["length-caching", "levenshtein", "hot-path"], "learnings": "{\"what_changed\":\"\",\"what_improved\":[],\"what_regressed\":[],\"transferable_insight\":\"When an optimization adds shared state without producing measurable gains, prefer the simpler path and avoid extra caching or threading complexity.\",\"domain_tags\":[\"optimization\",\"software-engineering\",\"performance\"]}", "cost_usd": 0.086479, "bootstrap_seed": 0, "agent_model": "gpt-5.4", "held_out_score": null, "criterion_names": null, "per_criterion_scores": null, "failure_classification": {"category": "semantic_drift", "description": "The experiment attempted to reuse cached string-length information via a single shared tuple cache and threaded/bounded-distance comparison path, but the outcome did not match the intended meaning of the hypothesis (likely caching/aliasing caused incorrect length pairing or comparison flow rather than a mere format or syntax issue).", "fix_direction": "Verify cache keying and ownership semantics (ensure lengths are associated with the correct string instances/positions), add invariant checks along the bounded-distance path, and compare against a baseline run without the shared cache to confirm both correctness and intended reuse behavior.", "confidence": 0.62}, "drafts_generated": 1, "drafts_survived": 1}
