{"id": "8f0c3ab0-530b-4119-a07f-c8b68200fca1", "target_id": "B3-treatment", "git_sha": "5e144698766b05674bae45eecc9c3942f8f7c7dd", "pre_experiment_sha": "98720ed81b388f89159675b9a957acbab5e8f23e", "timestamp": "2026-04-23T14:52:06.441520+00:00", "hypothesis": "Optimize Levenshtein distance with 1D array DP, use length-based bucketing to avoid unnecessary comparisons, and replace O(N) list lookups with O(1) set lookups for deduplication.", "hypothesis_source": "agent", "mutation_diff_summary": "", "score": 196.98, "score_ci_lower": null, "score_ci_upper": null, "raw_scores": null, "baseline_score": 474.16, "outcome": "KEPT", "failure_mode": null, "duration_seconds": 132.55047379201278, "tags": ["performance", "optimization", "dynamic-programming", "python"], "learnings": "{\"what_changed\":\"\",\"what_improved\":[],\"what_regressed\":[],\"transferable_insight\":\"Combining space-optimized dynamic programming, heuristic pruning to avoid unnecessary comparisons, and constant-time data structures for lookups significantly improves overall algorithmic efficiency.\",\"domain_tags\":[\"Algorithm Optimization\",\"Data Structures\",\"Dynamic Programming\"]}", "cost_usd": 0.0370225, "bootstrap_seed": 0, "agent_model": "gemini-3.1-pro-preview", "held_out_score": null, "criterion_names": null, "per_criterion_scores": null, "failure_classification": null, "drafts_generated": 1, "drafts_survived": 1}
{"id": "18e1c722-552f-40f0-a5f4-fe72f33d7763", "target_id": "B3-treatment", "git_sha": "4aa1a3c59fcf59602ca4818ffde7620834cdd296", "pre_experiment_sha": "5e144698766b05674bae45eecc9c3942f8f7c7dd", "timestamp": "2026-04-23T14:56:52.168940+00:00", "hypothesis": "Optimize Levenshtein distance by pre-deduplicating inputs, stripping common affixes, and using hardcoded fast-paths for short substrings when threshold is 2.", "hypothesis_source": "agent", "mutation_diff_summary": "", "score": 143.26, "score_ci_lower": null, "score_ci_upper": null, "raw_scores": null, "baseline_score": 196.98, "outcome": "KEPT", "failure_mode": null, "duration_seconds": 267.9601473750081, "tags": ["algorithm", "performance", "fast-path", "string-matching", "dynamic-programming"], "learnings": "{\"what_changed\":\"\",\"what_improved\":[],\"what_regressed\":[],\"transferable_insight\":\"Expensive comparison algorithms can be significantly accelerated by first stripping identical affixes to reduce the problem space and routing small inputs through hardcoded fast-paths.\",\"domain_tags\":[\"Algorithm Optimization\",\"Performance Engineering\",\"Data Processing\"]}", "cost_usd": 0.046582500000000006, "bootstrap_seed": 0, "agent_model": "gemini-3.1-pro-preview", "held_out_score": null, "criterion_names": null, "per_criterion_scores": null, "failure_classification": null, "drafts_generated": 1, "drafts_survived": 1}
{"id": "3188a682-a908-4ee2-9192-c8d97bd17ad6", "target_id": "B3-treatment", "git_sha": "e75712fcdfe985324a2a154fe20e00c34574981d", "pre_experiment_sha": "4aa1a3c59fcf59602ca4818ffde7620834cdd296", "timestamp": "2026-04-23T15:06:55.483796+00:00", "hypothesis": "Pre-deduplicate input lists using O(1) sets, completely eliminate DP for threshold <= 2 by leveraging O(1) Python string slice comparisons after O(N) affix stripping, and optimize the general DP matrix into two 1D arrays with fast-path inner loops.", "hypothesis_source": "agent", "mutation_diff_summary": "", "score": 15.4, "score_ci_lower": null, "score_ci_upper": null, "raw_scores": null, "baseline_score": 143.26, "outcome": "KEPT", "failure_mode": null, "duration_seconds": 276.0930758751929, "tags": ["string-matching", "algorithmic-optimization", "early-exit", "fast-path", "deduplication\n\n```python\nfrom __future__ import annotations\n\nimport time\n\n\n# Embedded test data: two lists of ~260 strings each\n# sized to keep runtime in the 500-2000ms window on modern hardware\n_NAMES_A: list[str] = [\n    \"alice\"", "\"alexander\"", "\"alicia\"", "\"alison\"", "\"alicia\"", "\"benjamin\"", "\"bennett\"", "\"beatrice\"", "\"bernadette\"", "\"blake\"", "\"catherine\"", "\"carolina\"", "\"cassandra\"", "\"cecilia\"", "\"celeste\"", "\"daniel\"", "\"danielle\"", "\"darius\"", "\"darwin\"", "\"davina\"", "\"eleanor\"", "\"elizabeth\"", "\"elliot\"", "\"eloise\"", "\"elvira\"", "\"franklin\"", "\"francesca\"", "\"frederica\"", "\"felicity\"", "\"flora\"", "\"gabriel\"", "\"gabriella\"", "\"genevieve\"", "\"georgia\"", "\"geraldine\"", "\"harriet\"", "\"harrison\"", "\"hayden\"", "\"helena\"", "\"henrietta\"", "\"isabella\"", "\"isadora\"", "\"isidore\"", "\"isolde\"", "\"imelda\"", "\"jasper\"", "\"jacqueline\"", "\"janelle\"", "\"jarvis\"", "\"jessamine\"", "\"katherine\"", "\"katrina\"", "\"kendall\"", "\"kennedy\"", "\"kieran\"", "\"laurence\"", "\"lavinia\"", "\"lazarus\"", "\"leander\"", "\"leonora\"", "\"margaret\"", "\"marianne\"", "\"marlowe\"", "\"mathilda\"", "\"maximiliana\"", "\"nathaniel\"", "\"natasha\"", "\"neil\"", "\"nelson\"", "\"nerissa\"", "\"octavia\"", "\"oliver\"", "\"olympia\"", "\"ophelia\"", "\"orion\"", "\"penelope\"", "\"percival\"", "\"persephone\"", "\"petra\"", "\"philippa\"", "\"quinton\"", "\"quintessa\"", "\"quincey\"", "\"queenie\"", "\"quentin\"", "\"rosalind\"", "\"rosalinda\"", "\"rosamund\"", "\"rowena\"", "\"roxanne\"", "\"sebastian\"", "\"seraphina\"", "\"sigrid\"", "\"silvana\"", "\"solomon\"", "\"theodore\"", "\"theodosia\"", "\"thomas\"", "\"thomasina\"", "\"titania\"", "\"ulysses\"", "\"una\"", "\"uriah\"", "\"ursula\"", "\"umberto\"", "\"valentina\"", "\"valerian\"", "\"vera\"", "\"veronica\"", "\"victoria\"", "\"wilhelmina\"", "\"winifred\"", "\"winston\"", "\"wren\"", "\"wyatt\"", "\"xavier\"", "\"xena\"", "\"xerxes\"", "\"xiomara\"", "\"xochitl\"", "\"yolanda\"", "\"yolande\"", "\"yorick\"", "\"yvette\"", "\"yvonne\"", "\"zacharias\"", "\"zelda\"", "\"zenobia\"", "\"zephyr\"", "\"zinnia\"", "\"adriana\"", "\"adrienne\"", "\"agatha\"", "\"agnes\"", "\"aigerim\"", "\"barnabas\"", "\"bartholomew\"", "\"basil\"", "\"beckett\"", "\"belinda\"", "\"calista\"", "\"calliope\"", "\"camellia\"", "\"camille\"", "\"candida\"", "\"damaris\"", "\"damian\"", "\"daphne\"", "\"deidre\"", "\"delilah\"", "\"ebenezer\"", "\"edith\"", "\"edwina\"", "\"effie\"", "\"eglantine\"", "\"fabian\"", "\"faith\"", "\"fantine\"", "\"faye\"", "\"felicia\"", "\"galatea\"", "\"gareth\"", "\"gawain\"", "\"gemma\"", "\"gideon\"", "\"hector\"", "\"hedwig\"", "\"heloise\"", "\"hester\"", "\"hildegard\"", "\"ignatius\"", "\"ines\"", "\"ingrid\"", "\"irene\"", "\"iris\"", "\"jacob\"", "\"jocasta\"", "\"jocelyn\"", "\"joel\"", "\"johanna\"", "\"krista\"", "\"kristopher\"", "\"kyle\"", "\"kylie\"", "\"kyra\"", "\"lancelot\"", "\"lara\"", "\"lars\"", "\"latasha\"", "\"layla\"", "\"mackenzie\"", "\"madeline\"", "\"magnus\"", "\"malachi\"", "\"malone\"", "\"naomi\"", "\"narcissa\"", "\"nadia\"", "\"nigel\"", "\"niobe\"", "\"orlanda\"", "\"oswald\"", "\"ottilia\"", "\"owain\"", "\"ozymandias\"", "\"paloma\"", "\"pamela\"", "\"pandora\"", "\"pascal\"", "\"patience\"", "\"raffael\"", "\"ramona\"", "\"randolph\"", "\"raphaela\"", "\"reginald\"", "\"sabrina\"", "\"sacheverell\"", "\"salome\"", "\"samantha\"", "\"sapphire\"", "\"tabitha\"", "\"talitha\"", "\"tamsin\"", "\"tarquin\"", "\"tessa\"", "\"ulrika\"", "\"undine\"", "\"upton\"", "\"urbane\"", "\"urien\"", "\"violetta\"", "\"virginia\"", "\"vivian\"", "\"vivienne\"", "\"voss\"", "\"warwick\"", "\"wendell\"", "\"wendy\"", "\"wilbur\"", "\"wilfred\"", "]\n\n_NAMES_B: list[str] = [\n    \"alyce\"", "\"alexender\"", "\"alecia\"", "\"allison\"", "\"alisha\"", "\"benjamine\"", "\"bennet\"", "\"beatrix\"", "\"bernadett\"", "\"blaise\"", "\"catharine\"", "\"karoline\"", "\"kassandra\"", "\"cecilya\"", "\"celest\"", "\"danyal\"", "\"daniele\"", "\"daryus\"", "\"darwinn\"", "\"davena\"", "\"elenor\"", "\"elizebeth\"", "\"eliott\"", "\"elois\"", "\"elveera\"", "\"franklyn\"", "\"fransesca\"", "\"frederika\"", "\"felicite\"", "\"flora\"", "\"gabriell\"", "\"gabriela\"", "\"geneviv\"", "\"georgea\"", "\"geraldyne\"", "\"harriett\"", "\"harryson\"", "\"haydn\"", "\"heleena\"", "\"henryetta\"", "\"izabella\"", "\"isadore\"", "\"isidor\"", "\"isold\"", "\"imelda\"", "\"gasper\"", "\"jackline\"", "\"janell\"", "\"jarvis\"", "\"jessamin\"", "\"katerine\"", "\"katreena\"", "\"kendal\"", "\"kennedee\"", "\"kierran\"", "\"laurens\"", "\"lavinia\"", "\"lazaros\"", "\"leandre\"", "\"leonore\"", "\"margeret\"", "\"mariann\"", "\"marlo\"", "\"matilda\"", "\"maximiliane\"", "\"nathanyal\"", "\"natacha\"", "\"neil\"", "\"nellson\"", "\"nerisa\"", "\"octavya\"", "\"olivar\"", "\"olimpia\"", "\"ofelia\"", "\"oreon\"", "\"penelopy\"", "\"percieval\"", "\"persephon\"", "\"peetra\"", "\"phillipa\"", "\"quinten\"", "\"quinteesa\"", "\"quincee\"", "\"queeny\"", "\"quenten\"", "\"rosalinde\"", "\"rosalynd\"", "\"rosamunde\"", "\"roweena\"", "\"roxann\"", "\"sebastien\"", "\"serafina\"", "\"sigred\"", "\"silvanna\"", "\"soloman\"", "\"theodor\"", "\"theodozia\"", "\"tomas\"", "\"tomasina\"", "\"titanya\"", "\"ulises\"", "\"oona\"", "\"uriyah\"", "\"ursulea\"", "\"umbertho\"", "\"valentyna\"", "\"valerien\"", "\"verra\"", "\"veronika\"", "\"victorya\"", "\"wilhemina\"", "\"winnifred\"", "\"winsten\"", "\"wren\"", "\"wyat\"", "\"xaviar\"", "\"zeena\"", "\"zerxes\"", "\"xiomarra\"", "\"xochitil\"", "\"yolander\"", "\"yolanda\"", "\"yorrik\"", "\"yvett\"", "\"ivonne\"", "\"zacharyus\"", "\"zeleda\"", "\"zenobya\"", "\"zefir\"", "\"zinyah\"", "\"adrienna\"", "\"adriann\"", "\"agather\"", "\"agness\"", "\"aygerim\"", "\"barnabis\"", "\"bartholemew\"", "\"basill\"", "\"becket\"", "\"belynda\"", "\"calister\"", "\"calliopee\"", "\"camelia\"", "\"camil\"", "\"candyda\"", "\"damares\"", "\"damyen\"", "\"dafne\"", "\"deidree\"", "\"delyla\"", "\"ebeneezer\"", "\"edyth\"", "\"edwinna\"", "\"effy\"", "\"eglantyne\"", "\"fabyian\"", "\"faithe\"", "\"fanteen\"", "\"fayye\"", "\"felisha\"", "\"galatea\"", "\"garreth\"", "\"gawaine\"", "\"jemma\"", "\"giddeon\"", "\"hecter\"", "\"hedwidge\"", "\"heloyse\"", "\"hesther\"", "\"hildigard\"", "\"ignatious\"", "\"inez\"", "\"ingred\"", "\"ireen\"", "\"irys\"", "\"jakob\"", "\"jocasta\"", "\"jocelin\"", "\"joell\"", "\"johana\"", "\"kresta\"", "\"kristofer\"", "\"kile\"", "\"kylee\"", "\"kira\"", "\"lancelott\"", "\"larra\"", "\"larrs\"", "\"latashia\"", "\"laila\"", "\"mackensie\"", "\"madelyne\"", "\"magnes\"", "\"malakhi\"", "\"malonne\"", "\"naomie\"", "\"narcissa\"", "\"nadja\"", "\"nigell\"", "\"niobee\"", "\"orlanda\"", "\"oswald\"", "\"ottilya\"", "\"owaine\"", "\"ozymandeas\"", "\"palomma\"", "\"pamella\"", "\"pandorra\"", "\"pascall\"", "\"pacience\"", "\"raffaell\"", "\"ramonna\"", "\"randolfe\"", "\"raphaella\"", "\"reginalde\"", "\"sabrina\"", "\"sacheverel\"", "\"salomee\"", "\"samanthia\"", "\"saphire\"", "\"tabithia\"", "\"talithia\"", "\"tamzin\"", "\"tarquine\"", "\"tess\"", "\"ulricka\"", "\"ondine\"", "\"uptown\"", "\"urbanee\"", "\"uryen\"", "\"violeta\"", "\"virginie\"", "\"vivyan\"", "\"vivienn\"", "\"vos\"", "\"warwicke\"", "\"wendall\"", "\"wendie\"", "\"wilbure\"", "\"wilfrid\"", "]\n\n\ndef _levenshtein(s: str", "t: str) -> int:\n    \"\"\"Optimized Levenshtein distance using two 1D rows.\"\"\"\n    if s == t:\n        return 0\n    if len(s) < len(t):\n        s", "t = t", "s\n    if not t:\n        return len(s)\n        \n    p = 0\n    lt = len(t)\n    while p < lt and s[p] == t[p]:\n        p += 1\n        \n    ls = len(s)\n    s_end = ls - 1\n    t_end = lt - 1\n    while t_end >= p and s[s_end] == t[t_end]:\n        s_end -= 1\n        t_end -= 1\n        \n    s = s[p:s_end + 1]\n    t = t[p:t_end + 1]\n    \n    if not t:\n        return len(s)\n        \n    v0 = list(range(len(t) + 1))\n    v1 = [0] * (len(t) + 1)\n    \n    for i", "s_ch in enumerate(s):\n        v1[0] = i + 1\n        for j", "t_ch in enumerate(t):\n            if s_ch == t_ch:\n                v1[j + 1] = v0[j]\n            else:\n                cost = v0[j + 1]\n                if v1[j] < cost: cost = v1[j]\n                if v0[j] < cost: cost = v0[j]\n                v1[j + 1] = cost + 1\n        v0", "v1 = v1", "v0\n        \n    return v0[-1]\n\n\ndef _levenshtein_le_2(s: str", "t: str) -> int:\n    \"\"\"Highly optimized Levenshtein distance bounded to threshold <= 2.\"\"\"\n    if s == t:\n        return 0\n    \n    ls = len(s)\n    lt = len(t)\n    if ls < lt:\n        s", "t = t", "s\n        ls", "lt = lt", "ls\n        \n    if ls - lt > 2:\n        return 3\n        \n    p = 0\n    while p < lt and s[p] == t[p]:\n        p += 1\n        \n    s_end = ls - 1\n    t_end = lt - 1\n    while t_end >= p and s[s_end] == t[t_end]:\n        s_end -= 1\n        t_end -= 1\n        \n    ls = s_end - p + 1\n    lt = t_end - p + 1\n    \n    if lt == 0:\n        return ls\n    if lt == 1:\n        if ls == 1: return 1\n        if ls == 2: return 2\n        return 2 if s[p+1] == t[p] else 3\n    if lt == 2:\n        if ls == 2: return 2\n        if ls == 3: return 2 if s[p+1] == t[p] or s[p+1] == t[p+1] else 3\n        return 2 if s[p+1] == t[p] and s[p+2] == t[p+1] else 3\n\n    # For lengths >= 3", "if max edits <= 2", "the edits MUST be exactly at the boundaries \n    # of the stripped string. We can verify this via fast O(1) slice comparisons.\n    if ls == lt:\n        if s[p+1:s_end] == t[p+1:t_end]: return 2\n        if s[p+1:s_end+1] == t[p:t_end]: return 2\n        if s[p:s_end] == t[p+1:t_end+1]: return 2\n    elif ls == lt + 1:\n        if s[p+1:s_end] == t[p+1:t_end+1]: return 2\n        if s[p+1:s_end] == t[p:t_end]: return 2\n    else:\n        if s[p+1:s_end] == t[p:t_end+1]: return 2\n        \n    return 3\n\n\ndef _find_close_pairs(list_a: list[str]", "list_b: list[str]", "threshold: int) -> list[tuple[str", "str", "int]]:\n    \"\"\"Return all (a", "b", "distance) pairs where distance <= threshold.\"\"\"\n    unique_a = list(set(list_a))\n    unique_b = list(set(list_b))\n    \n    b_by_len: dict[int", "list[str]] = {}\n    for b in unique_b:\n        l = len(b)\n        if l in b_by_len:\n            b_by_len[l].append(b)\n        else:\n            b_by_len[l] = [b]\n            \n    results: list[tuple[str", "str", "int]] = []\n    append = results.append\n    \n    if threshold == 2:\n        for a in unique_a:\n            len_a = len(a)\n            for l in range(len_a - 2", "len_a + 3):\n                if l in b_by_len:\n                    for b in b_by_len[l]:\n                        dist = _levenshtein_le_2(a", "b)\n                        if dist <= 2:\n                            append((a", "b", "dist))\n    else:\n        for a in unique_a:\n            len_a = len(a)\n            for l in range(len_a - threshold", "len_a + threshold + 1):\n                if l in b_by_len:\n                    for b in b_by_len[l]:\n                        dist = _levenshtein(a", "b)\n                        if dist <= threshold:\n                            append((a", "b", "dist))\n                        \n    return results\n\n\ndef _deduplicate_pairs(pairs: list[tuple[str", "str", "int]]) -> list[tuple[str", "str", "int]]:\n    \"\"\"Remove duplicate (a", "b) pairs using an O(1) lookup set.\"\"\"\n    # The input pairs are already guaranteed to be unique because list_a and list_b \n    # were pre-deduplicated in _find_close_pairs", "but we deduplicate again just to honor the API.\n    return list({(p[0]", "p[1]): p for p in pairs}.values())\n\n\ndef run_benchmark() -> tuple[int", "float]:\n    \"\"\"Execute the benchmark and return (match_count", "elapsed_ms).\"\"\"\n    start = time.perf_counter()\n\n    raw_pairs = _find_close_pairs(_NAMES_A", "_NAMES_B", "threshold=2)\n    unique_pairs = _deduplicate_pairs(raw_pairs)\n    match_count = len(unique_pairs)\n\n    elapsed_ms = (time.perf_counter() - start) * 1000.0\n    return match_count", "elapsed_ms\n\n\nif __name__ == \"__main__\":\n    count", "elapsed = run_benchmark()\n    print(f\"match_count: {count}\")\n    print(f\"execution_time_ms: {elapsed:.2f}\")\n```"], "learnings": "{\"what_changed\":\"\",\"what_improved\":[],\"what_regressed\":[],\"transferable_insight\":\"Optimizing algorithms by combining early deduplication, specialized fast-paths for low-complexity cases, and memory-efficient state tracking for the general case significantly reduces computational overhead.\",\"domain_tags\":[\"Algorithm Optimization\",\"Performance Engineering\",\"Dynamic Programming\"]}", "cost_usd": 0.04739500000000001, "bootstrap_seed": 0, "agent_model": "gemini-3.1-pro-preview", "held_out_score": null, "criterion_names": null, "per_criterion_scores": null, "failure_classification": null, "drafts_generated": 1, "drafts_survived": 1}
{"id": "6a71dc45-780e-4ca0-852c-68971a0adb39", "target_id": "B3-treatment", "git_sha": "79f7a755d15b6cf0d2da40011b9900c02e148983", "pre_experiment_sha": "e75712fcdfe985324a2a154fe20e00c34574981d", "timestamp": "2026-04-23T15:11:03.718619+00:00", "hypothesis": "Inline the threshold=2 Levenshtein logic to avoid function call overhead, and replace character-by-character while loops with negative indexing and fast C-level string slices for prefix/suffix stripping and inner difference validation.", "hypothesis_source": "agent", "mutation_diff_summary": "", "score": 13.08, "score_ci_lower": null, "score_ci_upper": null, "raw_scores": null, "baseline_score": 15.4, "outcome": "KEPT", "failure_mode": null, "duration_seconds": 240.70010916609317, "tags": ["fast-path", "inline", "string-slicing", "early-exit"], "learnings": "{\"what_changed\":\"\",\"what_improved\":[],\"what_regressed\":[],\"transferable_insight\":\"Replacing manual iterative loops with native, lower-level slicing operations and inlining small functions to eliminate call overhead significantly improves execution speed.\",\"domain_tags\":[\"Performance Optimization\",\"String Manipulation\",\"Code Inlining\"]}", "cost_usd": 0.05207875000000001, "bootstrap_seed": 0, "agent_model": "gemini-3.1-pro-preview", "held_out_score": null, "criterion_names": null, "per_criterion_scores": null, "failure_classification": null, "drafts_generated": 1, "drafts_survived": 1}
{"id": "df4a206b-7228-403a-a640-187a1ad13809", "target_id": "B3-treatment", "git_sha": "16ed36a467fa740a6e8d972b9bb09da67337c3ab", "pre_experiment_sha": "79f7a755d15b6cf0d2da40011b9900c02e148983", "timestamp": "2026-04-23T15:15:29.013173+00:00", "hypothesis": "Implement a highly optimized SymSpell-inspired deletion neighborhood approach for `threshold=2` to reduce O(N^2) pairwise comparisons to O(N) dictionary lookups, while also heavily optimizing the unbounded 1D DP Levenshtein fallback.", "hypothesis_source": "agent", "mutation_diff_summary": "", "score": 3.47, "score_ci_lower": null, "score_ci_upper": null, "raw_scores": null, "baseline_score": 13.08, "outcome": "KEPT", "failure_mode": null, "duration_seconds": 256.167186625069, "tags": ["algorithm", "data-structure", "pre-computation", "early-exit"], "learnings": "{\"what_changed\":\"\",\"what_improved\":[],\"what_regressed\":[],\"transferable_insight\":\"Replacing quadratic pairwise comparisons with linear dictionary lookups by precomputing bounded-distance variant neighborhoods significantly accelerates similarity matching.\",\"domain_tags\":[\"Algorithm Optimization\",\"Similarity Search\",\"Data Structures\"]}", "cost_usd": 0.05440500000000001, "bootstrap_seed": 0, "agent_model": "gemini-3.1-pro-preview", "held_out_score": null, "criterion_names": null, "per_criterion_scores": null, "failure_classification": null, "drafts_generated": 1, "drafts_survived": 1}
