{"id": "cf7d308f-693e-472e-b6bd-8fa332e9cc91", "target_id": "B3-treatment", "git_sha": "f9725f7e3ee86cef951048ad5c6e8ad11d457695", "pre_experiment_sha": "1b6bc469a63e86dd12260e2145d6667ff000d8c7", "timestamp": "2026-04-22T20:49:17.578042+00:00", "hypothesis": "Optimize the fast-path prefix and suffix trimming by using `if/else` to initialize `start` and `k`, eliminating redundant variable assignments when the first or last characters match.", "hypothesis_source": "agent", "mutation_diff_summary": "", "score": 7.21, "score_ci_lower": null, "score_ci_upper": null, "raw_scores": null, "baseline_score": 7.17, "outcome": "KEPT", "failure_mode": null, "duration_seconds": 266.5253320001066, "tags": ["micro-optimization", "loop-unrolling", "fast-path"], "learnings": "{\"what_changed\":\"\",\"what_improved\":[],\"what_regressed\":[],\"transferable_insight\":\"Conditionally initializing variables based on fast-path checks eliminates redundant assignments and improves execution efficiency.\",\"domain_tags\":[\"Performance Optimization\",\"Control Flow\",\"Code Refactoring\"]}", "cost_usd": 0.11197375000000001, "bootstrap_seed": 0, "agent_model": "gemini-3.1-pro-preview", "held_out_score": null, "criterion_names": null, "per_criterion_scores": null, "failure_classification": null, "drafts_generated": 1, "drafts_survived": 1}
{"id": "fd91cd4a-fff3-459c-ba02-5d607b489a27", "target_id": "B3-treatment", "git_sha": "85517317305d2484075806be8d877eac4b242594", "pre_experiment_sha": "f9725f7e3ee86cef951048ad5c6e8ad11d457695", "timestamp": "2026-04-22T20:54:06.371301+00:00", "hypothesis": "Combine the `diff <= 0`, `diff == 1`, and `diff == 2` conditional checks in the threshold=2 fast-paths into single `diff <= 1` or `diff <= 2` branches to eliminate redundant conditional evaluations for the vast majority of string pairs where `diff >= 3`.", "hypothesis_source": "agent", "mutation_diff_summary": "", "score": 7.32, "score_ci_lower": null, "score_ci_upper": null, "raw_scores": null, "baseline_score": 7.21, "outcome": "KEPT", "failure_mode": null, "duration_seconds": 282.40234262496233, "tags": ["micro-optimization", "branch-elimination", "fast-path"], "learnings": "{\"what_changed\":\"\",\"what_improved\":[],\"what_regressed\":[],\"transferable_insight\":\"Consolidating multiple granular conditional checks into a single inclusive boundary condition improves performance by eliminating redundant evaluations for the most common execution paths.\",\"domain_tags\":[\"Performance Optimization\",\"Control Flow\",\"Software Engineering\"]}", "cost_usd": 0.11415750000000001, "bootstrap_seed": 0, "agent_model": "gemini-3.1-pro-preview", "held_out_score": null, "criterion_names": null, "per_criterion_scores": null, "failure_classification": null, "drafts_generated": 1, "drafts_survived": 1}
{"id": "b61ac8b3-5da6-4118-8d96-802afde4242e", "target_id": "B3-treatment", "git_sha": "bea56f9845aee65247ae4bd373ae33ab57cf2e8f", "pre_experiment_sha": "85517317305d2484075806be8d877eac4b242594", "timestamp": "2026-04-22T20:57:52.596766+00:00", "hypothesis": "Streamline the deduplication list comprehensions by removing the `not (...)` wrapper and using the `add(x) or x` pattern, and optimize dictionary lookups by removing `is not None` in favor of direct truthiness checks.", "hypothesis_source": "agent", "mutation_diff_summary": "", "score": 7.03, "score_ci_lower": null, "score_ci_upper": null, "raw_scores": null, "baseline_score": 7.32, "outcome": "KEPT", "failure_mode": null, "duration_seconds": 197.9222808338236, "tags": ["micro-optimization", "list-comprehension", "truthiness-check", "deduplication"], "learnings": "{\"what_changed\":\"\",\"what_improved\":[],\"what_regressed\":[],\"transferable_insight\":\"Simplifying conditional logic by leveraging implicit truthiness checks and concise evaluation patterns reduces computational overhead.\",\"domain_tags\":[\"Code Optimization\",\"Software Engineering\",\"Performance Tuning\"]}", "cost_usd": 0.11357375000000001, "bootstrap_seed": 0, "agent_model": "gemini-3.1-pro-preview", "held_out_score": null, "criterion_names": null, "per_criterion_scores": null, "failure_classification": null, "drafts_generated": 1, "drafts_survived": 1}
{"id": "6ec1078d-5988-4cf5-a308-981c639214dc", "target_id": "B3-treatment", "git_sha": "611a75700a53bfb018bb92f601916ba9ea13272a", "pre_experiment_sha": "bea56f9845aee65247ae4bd373ae33ab57cf2e8f", "timestamp": "2026-04-22T21:00:56.419739+00:00", "hypothesis": "Replace the input deduplication list comprehensions with `dict.fromkeys()` for faster C-level uniqueness and deterministic ordering, and completely eliminate the redundant O(N) work in `_deduplicate_pairs` since `_find_close_pairs` already guarantees strictly unique `(a, b)` pairs.", "hypothesis_source": "agent", "mutation_diff_summary": "", "score": 6.99, "score_ci_lower": null, "score_ci_upper": null, "raw_scores": null, "baseline_score": 7.03, "outcome": "KEPT", "failure_mode": null, "duration_seconds": 176.54752350016497, "tags": ["micro-optimization", "deduplication", "dict-fromkeys", "algorithmic-simplification"], "learnings": "{\"what_changed\":\"\",\"what_improved\":[],\"what_regressed\":[],\"transferable_insight\":\"Delegating operations like deduplication to native, lower-level data structures and eliminating redundant validation steps optimizes performance without sacrificing deterministic ordering.\",\"domain_tags\":[\"Performance Optimization\",\"Data Structures\",\"Algorithm Efficiency\"]}", "cost_usd": 0.11252625000000002, "bootstrap_seed": 0, "agent_model": "gemini-3.1-pro-preview", "held_out_score": null, "criterion_names": null, "per_criterion_scores": null, "failure_classification": null, "drafts_generated": 1, "drafts_survived": 1}
{"id": "97c2f638-e22e-4be5-9698-2df4df3689d8", "target_id": "B3-treatment", "git_sha": "05941aa906a0b3b12d7e31684904348408ab1caf", "pre_experiment_sha": "611a75700a53bfb018bb92f601916ba9ea13272a", "timestamp": "2026-04-22T21:04:00.743856+00:00", "hypothesis": "Combine the `diff <= 1` and `diff == 2` conditional checks in the threshold=2 fast-paths into a single `diff <= 2` branch to further eliminate redundant conditional evaluations for the vast majority of string pairs where `diff >= 3`.", "hypothesis_source": "agent", "mutation_diff_summary": "", "score": 6.85, "score_ci_lower": null, "score_ci_upper": null, "raw_scores": null, "baseline_score": 6.99, "outcome": "KEPT", "failure_mode": null, "duration_seconds": 178.05475995806046, "tags": ["micro-optimization", "branch-elimination", "fast-path"], "learnings": "{\"what_changed\":\"\",\"what_improved\":[],\"what_regressed\":[],\"transferable_insight\":\"Merging multiple narrow conditional checks into a single inclusive threshold evaluation reduces branching overhead and accelerates early exits for the majority of cases.\",\"domain_tags\":[\"Performance Optimization\",\"Control Flow\",\"Algorithm Design\"]}", "cost_usd": 0.11171125, "bootstrap_seed": 0, "agent_model": "gemini-3.1-pro-preview", "held_out_score": null, "criterion_names": null, "per_criterion_scores": null, "failure_classification": null, "drafts_generated": 1, "drafts_survived": 1}
{"id": "2b1005d1-3e89-48fe-8b8e-ba47bb8037f2", "target_id": "B3-treatment", "git_sha": "ac5ba31898b7fae0197b44fc180c868bd149ce6a", "pre_experiment_sha": "05941aa906a0b3b12d7e31684904348408ab1caf", "timestamp": "2026-04-22T21:08:09.776834+00:00", "hypothesis": "Hoist the invariant character comparisons (e.g., `b[start] == a[start+1]`) outside the unrolled `diff` branches in the threshold=2 fast-paths to act as a fast-fail guard, completely eliminating the multi-branch `elif diff == X` evaluations and loop overhead for the >90% of mismatched string pairs that fail these conditions.", "hypothesis_source": "agent", "mutation_diff_summary": "", "score": 6.07, "score_ci_lower": null, "score_ci_upper": null, "raw_scores": null, "baseline_score": 6.85, "outcome": "KEPT", "failure_mode": null, "duration_seconds": 216.17140466696583, "tags": ["micro-optimization", "branch-elimination", "fast-path", "loop-unrolling"], "learnings": "{\"what_changed\":\"\",\"what_improved\":[],\"what_regressed\":[],\"transferable_insight\":\"Extracting and evaluating high-probability failure conditions before complex branching logic acts as an efficient early-exit guard, eliminating unnecessary evaluations for the majority of cases.\",\"domain_tags\":[\"Performance Optimization\",\"Control Flow\",\"Early Exit\"]}", "cost_usd": 0.10766625000000002, "bootstrap_seed": 0, "agent_model": "gemini-3.1-pro-preview", "held_out_score": null, "criterion_names": null, "per_criterion_scores": null, "failure_classification": null, "drafts_generated": 1, "drafts_survived": 1}
{"id": "d30c5305-4b6b-4c18-a5a4-b5efddee67ae", "target_id": "B3-treatment", "git_sha": "2811be5f497bbaffd5eef9cbb00702edbe4ec8d9", "pre_experiment_sha": "ac5ba31898b7fae0197b44fc180c868bd149ce6a", "timestamp": "2026-04-22T21:12:36.964674+00:00", "hypothesis": "Hoist inner-loop character indexings into local variables (`astart1`, `bstart1`, `m1_ok`, etc.) and completely eliminate redundant `diff == X` multi-branch evaluations by precomputing the shared invariant character conditions for all remaining unrolled fast-paths.", "hypothesis_source": "agent", "mutation_diff_summary": "", "score": 6.13, "score_ci_lower": null, "score_ci_upper": null, "raw_scores": null, "baseline_score": 6.07, "outcome": "KEPT", "failure_mode": null, "duration_seconds": 259.0236528329551, "tags": ["micro-optimization", "branch-elimination", "variable-hoisting", "fast-path"], "learnings": "{\"what_changed\":\"\",\"what_improved\":[],\"what_regressed\":[],\"transferable_insight\":\"Caching frequently accessed elements in local variables and precomputing shared invariant conditions eliminates redundant evaluations and significantly accelerates repetitive operations.\",\"domain_tags\":[\"Performance Optimization\",\"Loop Optimization\",\"Algorithm Optimization\"]}", "cost_usd": 0.10375125, "bootstrap_seed": 0, "agent_model": "gemini-3.1-pro-preview", "held_out_score": null, "criterion_names": null, "per_criterion_scores": null, "failure_classification": null, "drafts_generated": 1, "drafts_survived": 1}
{"id": "a5dcea89-6e16-44df-924e-5d7ad6452268", "target_id": "B3-treatment", "git_sha": "308f3f2b4e3acbf0a350d85eb6f59f9d39d10923", "pre_experiment_sha": "2811be5f497bbaffd5eef9cbb00702edbe4ec8d9", "timestamp": "2026-04-22T21:16:25.198592+00:00", "hypothesis": "Revert the inner-loop variable hoisting that caused a regression, and streamline the length calculations by precomputing `end_base` outside the inner loops to eliminate redundant additions.", "hypothesis_source": "agent", "mutation_diff_summary": "", "score": 6.09, "score_ci_lower": null, "score_ci_upper": null, "raw_scores": null, "baseline_score": 6.13, "outcome": "KEPT", "failure_mode": null, "duration_seconds": 222.0260271669831, "tags": ["micro-optimization", "loop-optimization", "variable-hoisting"], "learnings": "{\"what_changed\":\"\",\"what_improved\":[],\"what_regressed\":[],\"transferable_insight\":\"Precomputing invariant values outside of repetitive loops eliminates redundant operations and improves overall execution efficiency.\",\"domain_tags\":[\"Performance Optimization\",\"Code Refactoring\",\"Algorithm Efficiency\"]}", "cost_usd": 0.10159750000000001, "bootstrap_seed": 0, "agent_model": "gemini-3.1-pro-preview", "held_out_score": null, "criterion_names": null, "per_criterion_scores": null, "failure_classification": null, "drafts_generated": 1, "drafts_survived": 1}
{"id": "c7bf4da4-9cbc-428b-a6df-f5c2d7006a45", "target_id": "B3-treatment", "git_sha": "308f3f2b4e3acbf0a350d85eb6f59f9d39d10923", "pre_experiment_sha": "308f3f2b4e3acbf0a350d85eb6f59f9d39d10923", "timestamp": "2026-04-22T21:20:30.519313+00:00", "hypothesis": "Eliminate redundant intermediate variable assignments (`m1`, `m2`, `m3`) and nested `if` blocks in the `threshold=2` fast-paths by directly computing the compound `_ok` conditions, which preserves short-circuiting while reducing Python bytecode overhead.", "hypothesis_source": "agent", "mutation_diff_summary": "", "score": 6.28, "score_ci_lower": null, "score_ci_upper": null, "raw_scores": null, "baseline_score": 6.09, "outcome": "DISCARDED", "failure_mode": null, "duration_seconds": 212.1024970409926, "tags": ["micro-optimization", "variable-elimination", "branch-elimination", "fast-path"], "learnings": "{\"what_changed\":\"\",\"what_improved\":[],\"what_regressed\":[],\"transferable_insight\":\"Replacing nested conditional blocks and intermediate variables with compound boolean expressions does not guarantee performance gains and can sometimes increase execution overhead.\",\"domain_tags\":[\"Code Optimization\",\"Performance Tuning\"]}", "cost_usd": 0.10100090000000002, "bootstrap_seed": 0, "agent_model": "gemini-3.1-pro-preview", "held_out_score": null, "criterion_names": null, "per_criterion_scores": null, "failure_classification": {"category": "regression", "description": "The experiment, intended to reduce Python bytecode overhead and improve performance, resulted in a regression. While the exact cause of failure is 'unknown', the failure mode indicates that the change either degraded existing performance metrics, increased bytecode overhead, or introduced a functional bug that caused the experiment to fail or score poorly (6.2800).", "fix_direction": "Investigate the specific metric represented by the score (6.2800) to understand how it degraded. Systematically analyze the implemented changes for correctness, ensuring that short-circuiting logic is accurately preserved and no new logical errors or performance bottlenecks were introduced. Thoroughly profile bytecode differences, execution paths, and runtime performance to pinpoint the exact source of the regression.", "confidence": 0.9}, "drafts_generated": 1, "drafts_survived": 1}
{"id": "2988019b-8399-4577-86cc-32e0e6466428", "target_id": "B3-treatment", "git_sha": "7fdc6266490f02567c8d10fff54f28440c4bf91e", "pre_experiment_sha": "308f3f2b4e3acbf0a350d85eb6f59f9d39d10923", "timestamp": "2026-04-22T21:25:35.904736+00:00", "hypothesis": "Flatten nested conditional blocks and eliminate intermediate variables (`m1`, `m2`, `m3`) in the threshold=2 fast-paths by directly computing compound conditions (`m1_ok`, etc.), reducing bytecode overhead and branch instructions without redundant re-evaluations.", "hypothesis_source": "agent", "mutation_diff_summary": "", "score": 6.25, "score_ci_lower": null, "score_ci_upper": null, "raw_scores": null, "baseline_score": 6.09, "outcome": "KEPT", "failure_mode": null, "duration_seconds": 284.27537337481044, "tags": ["micro-optimization", "branch-elimination", "variable-elimination", "fast-path"], "learnings": "{\"what_changed\":\"\",\"what_improved\":[],\"what_regressed\":[],\"transferable_insight\":\"Flattening nested conditionals and directly evaluating compound conditions instead of storing intermediate variables reduces branching overhead and improves execution speed.\",\"domain_tags\":[\"Code Optimization\",\"Control Flow\",\"Performance Engineering\"]}", "cost_usd": 0.10083, "bootstrap_seed": 0, "agent_model": "gemini-3.1-pro-preview", "held_out_score": null, "criterion_names": null, "per_criterion_scores": null, "failure_classification": null, "drafts_generated": 1, "drafts_survived": 1}
{"id": "d3927ee0-87f8-422d-949b-fa94972b0335", "target_id": "B3-treatment", "git_sha": "9229bf44b0926b5e011cde38b4b5712168768e75", "pre_experiment_sha": "7fdc6266490f02567c8d10fff54f28440c4bf91e", "timestamp": "2026-04-22T21:29:20.958607+00:00", "hypothesis": "Restore short-circuiting and eliminate variable assignment overhead for the >90% of mismatched strings by fully inlining invariant character comparisons into the `if` conditions, only computing local variables when a potential match is found.", "hypothesis_source": "agent", "mutation_diff_summary": "", "score": 5.8, "score_ci_lower": null, "score_ci_upper": null, "raw_scores": null, "baseline_score": 6.25, "outcome": "KEPT", "failure_mode": null, "duration_seconds": 218.93985291593708, "tags": ["micro-optimization", "branch-elimination", "variable-elimination", "fast-path"], "learnings": "{\"what_changed\":\"\",\"what_improved\":[],\"what_regressed\":[],\"transferable_insight\":\"Deferring variable assignments until after cheap, high-probability short-circuit checks significantly reduces execution overhead in scenarios where the majority of cases fail early.\",\"domain_tags\":[\"Performance Optimization\",\"Control Flow\",\"Code Refactoring\"]}", "cost_usd": 0.10205625, "bootstrap_seed": 0, "agent_model": "gemini-3.1-pro-preview", "held_out_score": null, "criterion_names": null, "per_criterion_scores": null, "failure_classification": null, "drafts_generated": 1, "drafts_survived": 1}
{"id": "780ea8bd-0e73-4d04-806f-3e957fa80946", "target_id": "B3-treatment", "git_sha": "4500e36e6a17b978006a35ffaf5614bc60c8a6a1", "pre_experiment_sha": "9229bf44b0926b5e011cde38b4b5712168768e75", "timestamp": "2026-04-22T21:34:01.370203+00:00", "hypothesis": "Flatten and simplify the `diff <= 2` compound conditions in the threshold=2 fast-paths into nested `if`/`elif` blocks to eliminate redundant boolean evaluations and reduce bytecode overhead for the most common edge cases.", "hypothesis_source": "agent", "mutation_diff_summary": "", "score": 5.89, "score_ci_lower": null, "score_ci_upper": null, "raw_scores": null, "baseline_score": 5.8, "outcome": "KEPT", "failure_mode": null, "duration_seconds": 252.3623256671708, "tags": ["micro-optimization", "branch-elimination", "fast-path"], "learnings": "{\"what_changed\":\"\",\"what_improved\":[],\"what_regressed\":[],\"transferable_insight\":\"Replacing complex compound boolean conditions with nested conditional blocks in high-frequency execution paths reduces evaluation overhead and improves overall performance.\",\"domain_tags\":[\"Performance Optimization\",\"Control Flow\",\"Code Refactoring\"]}", "cost_usd": 0.1026625, "bootstrap_seed": 0, "agent_model": "gemini-3.1-pro-preview", "held_out_score": null, "criterion_names": null, "per_criterion_scores": null, "failure_classification": null, "drafts_generated": 1, "drafts_survived": 1}
{"id": "25da11c6-ce97-4a5d-86c3-4bdcda21b96e", "target_id": "B3-treatment", "git_sha": "4500e36e6a17b978006a35ffaf5614bc60c8a6a1", "pre_experiment_sha": "4500e36e6a17b978006a35ffaf5614bc60c8a6a1", "timestamp": "2026-04-22T21:38:34.456254+00:00", "hypothesis": "Restore short-circuiting compound conditions for the `diff <= 2` fast-paths to reduce bytecode overhead, and implement a fast-fail nested cascade for `diff > 2` in the `threshold=2` exact deletion/insertion branches to eliminate redundant character comparisons and `diff == X` evaluations.", "hypothesis_source": "agent", "mutation_diff_summary": "", "score": 99999.0, "score_ci_lower": null, "score_ci_upper": null, "raw_scores": null, "baseline_score": 5.89, "outcome": "DISCARDED", "failure_mode": null, "duration_seconds": 266.75301608396694, "tags": ["micro-optimization", "branch-elimination", "fast-path", "short-circuiting"], "learnings": "{\"what_changed\":\"\",\"what_improved\":[],\"what_regressed\":[],\"transferable_insight\":\"Attempting to eliminate redundant operations through complex nested branching and short-circuiting often degrades performance by disrupting branch prediction and increasing execution overhead.\",\"domain_tags\":[\"Performance Engineering\",\"Branch Prediction\",\"Algorithm Optimization\"]}", "cost_usd": 0.10018230000000002, "bootstrap_seed": 0, "agent_model": "gemini-3.1-pro-preview", "held_out_score": null, "criterion_names": null, "per_criterion_scores": null, "failure_classification": {"category": "logic_error", "description": "The ambitious optimization attempt, involving complex changes to short-circuiting conditions and nested fast-fail cascades, likely introduced a critical flaw in the algorithm's control flow or comparison logic. This resulted in incorrect behavior, an infinite loop, or an extremely inefficient execution path, leading to the catastrophic score of 99999.0000, despite the intended performance gains. The 'unknown' failure mode suggests the issue was not easily diagnosed at the point of failure.", "fix_direction": "Thoroughly review and debug the conditions and branching logic for the new short-circuiting and fast-fail cascades. Prioritize correctness across all `diff` values and edge cases before re-introducing optimization. Implement robust unit tests specifically targeting the proposed fast-paths and nested cascades, and consider adding assertions to validate intermediate states to identify the exact logical flaw.", "confidence": 0.9}, "drafts_generated": 1, "drafts_survived": 1}
