{"id": "7c3f83b5-dc06-42c5-b621-b83b2be3075d", "target_id": "B3-treatment", "git_sha": "c36cba2c894cc50fb70469a763ae6bcf69874383", "pre_experiment_sha": "98720ed81b388f89159675b9a957acbab5e8f23e", "timestamp": "2026-04-22T18:25:38.213914+00:00", "hypothesis": "Remove intentional inefficiencies by using a set for deduplication, pruning strings based on length differences, eliminating redundant list scans/concatenations, and optimizing the Levenshtein distance implementation.", "hypothesis_source": "agent", "mutation_diff_summary": "", "score": 335.68, "score_ci_lower": null, "score_ci_upper": null, "raw_scores": null, "baseline_score": 558.38, "outcome": "KEPT", "failure_mode": null, "duration_seconds": 65.23479258292355, "tags": ["performance", "loop-optimization", "algorithmic-improvement"], "learnings": "{\"what_changed\":\"\",\"what_improved\":[],\"what_regressed\":[],\"transferable_insight\":\"Replacing redundant iterations with optimized data structures and applying early-exit heuristics significantly reduces computational overhead.\",\"domain_tags\":[\"Performance Optimization\",\"Algorithms\",\"Data Structures\"]}", "cost_usd": 0.034882500000000004, "bootstrap_seed": 0, "agent_model": "gemini-3.1-pro-preview", "held_out_score": null, "criterion_names": null, "per_criterion_scores": null, "failure_classification": null, "drafts_generated": 1, "drafts_survived": 1}
{"id": "dc0b9bad-6f6e-4c44-99d9-865d7c5e1007", "target_id": "B3-treatment", "git_sha": "a317d8f74030896f2d8be6dfa2f269ed832916ff", "pre_experiment_sha": "c36cba2c894cc50fb70469a763ae6bcf69874383", "timestamp": "2026-04-22T18:29:16.410390+00:00", "hypothesis": "Group the target list by string length to filter out impossible pairs in O(1) time, deduplicate inputs to avoid redundant calculations, and implement a 1D-array Levenshtein distance with prefix/suffix trimming and early exit bounds.", "hypothesis_source": "agent", "mutation_diff_summary": "", "score": 122.53, "score_ci_lower": null, "score_ci_upper": null, "raw_scores": null, "baseline_score": 335.68, "outcome": "KEPT", "failure_mode": null, "duration_seconds": 211.38182200002484, "tags": ["algorithm", "dynamic-programming", "fast-path", "memory-optimization"], "learnings": "{\"what_changed\":\"\",\"what_improved\":[],\"what_regressed\":[],\"transferable_insight\":\"Layering pre-filtering heuristics, input deduplication, and early-termination bounds significantly reduces the computational overhead of expensive comparison operations.\",\"domain_tags\":[\"Algorithm Optimization\",\"Performance Engineering\",\"Heuristics\"]}", "cost_usd": 0.038275, "bootstrap_seed": 0, "agent_model": "gemini-3.1-pro-preview", "held_out_score": null, "criterion_names": null, "per_criterion_scores": null, "failure_classification": null, "drafts_generated": 1, "drafts_survived": 1}
{"id": "08c4b3bb-37f9-4c19-8e21-b956e3714cf3", "target_id": "B3-treatment", "git_sha": "553ead389c6e220d0ffd84366e813f5ca323750f", "pre_experiment_sha": "a317d8f74030896f2d8be6dfa2f269ed832916ff", "timestamp": "2026-04-22T18:33:52.768247+00:00", "hypothesis": "Inline the Levenshtein distance calculation into `_find_close_pairs` to avoid function call overhead, and implement O(1) hardcoded fast-paths for remaining string lengths <= 3 when `threshold == 2`, falling back to an optimized single-array DP without string slicing.", "hypothesis_source": "agent", "mutation_diff_summary": "", "score": 115.04, "score_ci_lower": null, "score_ci_upper": null, "raw_scores": null, "baseline_score": 122.53, "outcome": "KEPT", "failure_mode": null, "duration_seconds": 270.2433987921104, "tags": ["performance", "algorithmic", "inlining", "string-matching"], "learnings": "{\"what_changed\":\"\",\"what_improved\":[],\"what_regressed\":[],\"transferable_insight\":\"Algorithmic performance can be substantially improved by eliminating function call overhead, hardcoding fast-paths for small base cases, and avoiding unnecessary memory allocations during execution.\",\"domain_tags\":[\"Performance Engineering\",\"Algorithm Optimization\",\"Dynamic Programming\"]}", "cost_usd": 0.051631250000000004, "bootstrap_seed": 0, "agent_model": "gemini-3.1-pro-preview", "held_out_score": null, "criterion_names": null, "per_criterion_scores": null, "failure_classification": null, "drafts_generated": 1, "drafts_survived": 1}
{"id": "60324300-d288-4346-aed2-3a896ecd2b29", "target_id": "B3-treatment", "git_sha": "553ead389c6e220d0ffd84366e813f5ca323750f", "pre_experiment_sha": "553ead389c6e220d0ffd84366e813f5ca323750f", "timestamp": "2026-04-22T18:37:34.828646+00:00", "hypothesis": "Optimize Levenshtein distance by removing redundant pair deduplication, using faster for-loops for prefix/suffix stripping, slicing strings to simplify and speed up the inner DP loop, utilizing fast slice assignment for DP initialization, and reducing dictionary lookups.", "hypothesis_source": "agent", "mutation_diff_summary": "", "score": 120.38, "score_ci_lower": null, "score_ci_upper": null, "raw_scores": null, "baseline_score": 115.04, "outcome": "DISCARDED", "failure_mode": null, "duration_seconds": 202.45029433304444, "tags": ["optimization", "dynamic-programming", "deduplication", "fast-path", "string-slicing"], "learnings": "{\"what_changed\":\"\",\"what_improved\":[],\"what_regressed\":[],\"transferable_insight\":\"Introducing memory-allocating operations, such as slicing, to simplify logic in tight algorithmic loops often degrades performance due to hidden allocation overhead.\",\"domain_tags\":[\"Algorithm Optimization\",\"Performance Tuning\",\"Memory Management\"]}", "cost_usd": 0.0448736, "bootstrap_seed": 0, "agent_model": "gemini-3.1-pro-preview", "held_out_score": null, "criterion_names": null, "per_criterion_scores": null, "failure_classification": {"category": "regression", "description": "The experiment aimed to optimize the Levenshtein distance calculation for speed and efficiency using various micro-optimizations. However, it resulted in a failed state with a score of 120.3800. This score, in the context of a failed optimization attempt, strongly suggests a degradation in performance (e.g., increased execution time or resource usage) compared to a previous baseline. The 'unknown' failure mode implies no explicit crashes or correctness errors were reported, but rather that the desired performance improvement was not achieved, or performance actually worsened.", "fix_direction": "Establish a clear performance baseline and robust benchmarking framework. Thoroughly profile the current Levenshtein distance implementation to identify the true performance bottlenecks before applying any optimizations. Implement and test each proposed optimization (e.g., redundant pair deduplication, faster loops, string slicing) incrementally, measuring its individual impact on both performance and correctness. Validate that the optimization changes do not introduce incorrect Levenshtein distance calculations. Reconsider if the chosen micro-optimizations are genuinely effective or if they introduce unforeseen overheads (e.g., memory allocations, cache misses).", "confidence": 0.9}, "drafts_generated": 1, "drafts_survived": 1}
{"id": "4790ba2f-f144-4b39-ad6a-66b689175727", "target_id": "B3-treatment", "git_sha": "8e91ca72d34ae3c5489d31ac8b5819466ef38360", "pre_experiment_sha": "553ead389c6e220d0ffd84366e813f5ca323750f", "timestamp": "2026-04-22T18:41:53.054740+00:00", "hypothesis": "By aggressively expanding hardcoded fast-paths for remaining string lengths up to 6, optimizing the dynamic programming inner loop to iterate directly over characters, and avoiding `while` loops for prefix/suffix trimming, we can significantly reduce the overhead of string similarity comparisons and lower the deterministic score.", "hypothesis_source": "agent", "mutation_diff_summary": "", "score": 51.47, "score_ci_lower": null, "score_ci_upper": null, "raw_scores": null, "baseline_score": 115.04, "outcome": "KEPT", "failure_mode": null, "duration_seconds": 226.26452666707337, "tags": ["optimization", "string-matching", "fast-path", "dynamic-programming", "loop-optimization"], "learnings": "{\"what_changed\":\"\",\"what_improved\":[],\"what_regressed\":[],\"transferable_insight\":\"Replacing general-purpose loops with hardcoded fast-paths for small, common input sizes significantly reduces computational overhead in performance-critical algorithms.\",\"domain_tags\":[\"Algorithm Optimization\",\"Performance Tuning\",\"Loop Unrolling\"]}", "cost_usd": 0.08063250000000001, "bootstrap_seed": 0, "agent_model": "gemini-3.1-pro-preview", "held_out_score": null, "criterion_names": null, "per_criterion_scores": null, "failure_classification": null, "drafts_generated": 1, "drafts_survived": 1}
{"id": "578eda4f-9071-4632-af3a-1e06e652b9b9", "target_id": "B3-treatment", "git_sha": "8e91ca72d34ae3c5489d31ac8b5819466ef38360", "pre_experiment_sha": "8e91ca72d34ae3c5489d31ac8b5819466ef38360", "timestamp": "2026-04-22T18:45:17.783349+00:00", "hypothesis": "Optimize string similarity by eliminating string slicing entirely (using direct indexing instead), replacing the dictionary-based length grouping with a faster list array, and removing unused helper functions to reduce overhead.", "hypothesis_source": "agent", "mutation_diff_summary": "", "score": 56.97, "score_ci_lower": null, "score_ci_upper": null, "raw_scores": null, "baseline_score": 51.47, "outcome": "DISCARDED", "failure_mode": null, "duration_seconds": 197.26517250016332, "tags": ["performance", "loop-optimization", "memory-allocation"], "learnings": "{\"what_changed\":\"\",\"what_improved\":[],\"what_regressed\":[],\"transferable_insight\":\"Replacing native, highly optimized system operations with manual, lower-level implementations often introduces overhead and degrades overall performance instead of improving it.\",\"domain_tags\":[\"Performance Optimization\",\"Software Engineering\"]}", "cost_usd": 0.06321255, "bootstrap_seed": 0, "agent_model": "gemini-3.1-pro-preview", "held_out_score": null, "criterion_names": null, "per_criterion_scores": null, "failure_classification": {"category": "regression", "description": "The optimization attempts, aimed at improving string similarity performance by eliminating slicing, replacing dictionary-based grouping with a list array, and removing unused functions, inadvertently degraded the accuracy or quality of the string similarity calculation. The reported score of 56.9700 is likely lower than a previous baseline, indicating a step backward in the primary metric despite the intentions to optimize.", "fix_direction": "Isolate each proposed optimization (slicing replacement, data structure change, function removal) and introduce them one at a time. For each change, run comprehensive correctness tests to ensure the string similarity algorithm's accuracy is preserved before re-evaluating the overall score. Focus on debugging potential logic errors introduced by direct indexing or the list array implementation that might cause incorrect similarity calculations, especially for edge cases.", "confidence": 0.9}, "drafts_generated": 1, "drafts_survived": 1}
{"id": "984dcf7b-afce-4d92-b470-4021c3fd60a9", "target_id": "B3-treatment", "git_sha": "8e91ca72d34ae3c5489d31ac8b5819466ef38360", "pre_experiment_sha": "8e91ca72d34ae3c5489d31ac8b5819466ef38360", "timestamp": "2026-04-22T18:49:23.896568+00:00", "hypothesis": "Optimize prefix and suffix trimming by using `zip` and string slicing to avoid Python-level indexing overhead, and update the hardcoded fast-paths to use the zero-indexed sliced strings.", "hypothesis_source": "agent", "mutation_diff_summary": "", "score": 63.09, "score_ci_lower": null, "score_ci_upper": null, "raw_scores": null, "baseline_score": 51.47, "outcome": "DISCARDED", "failure_mode": null, "duration_seconds": 199.56501537491567, "tags": ["string-slicing", "zip-iteration", "fast-path-optimization", "loop-optimization"], "learnings": "{\"what_changed\":\"\",\"what_improved\":[],\"what_regressed\":[],\"transferable_insight\":\"Replacing explicit index lookups with iterator-based functions and slicing can inadvertently increase execution overhead rather than reducing it.\",\"domain_tags\":[\"Performance Optimization\",\"Software Engineering\",\"Python\"]}", "cost_usd": 0.0857333, "bootstrap_seed": 0, "agent_model": "gemini-3.1-pro-preview", "held_out_score": null, "criterion_names": null, "per_criterion_scores": null, "failure_classification": {"category": "regression", "description": "The attempt to optimize prefix/suffix trimming using `zip` and string slicing, intended to avoid Python-level indexing overhead, likely failed to achieve its goal and instead degraded performance or introduced correctness issues. The score of 63.0900 suggests that the change either made the operation slower than the baseline, or introduced subtle logic errors in the trimming process itself or in how fast-paths were updated, leading to incorrect results or less efficient execution compared to a previous state.", "fix_direction": "Thoroughly profile the new `zip` and string slicing implementation to identify whether the performance goal was met or if new overheads were introduced. Debug the trimming logic carefully to ensure correctness across various edge cases for prefixes and suffixes. Verify that the update to hardcoded fast-paths correctly integrates with the zero-indexed sliced strings without introducing inconsistencies or bugs. Compare the behavior and performance against the original, unoptimized implementation to pinpoint the exact source of regression.", "confidence": 0.9}, "drafts_generated": 1, "drafts_survived": 1}
{"id": "a2224086-636e-4dc9-ac47-c5230d04919e", "target_id": "B3-treatment", "git_sha": "8e91ca72d34ae3c5489d31ac8b5819466ef38360", "pre_experiment_sha": "8e91ca72d34ae3c5489d31ac8b5819466ef38360", "timestamp": "2026-04-22T18:52:40.702894+00:00", "hypothesis": "Optimize prefix and suffix trimming by using `zip` with `reversed()` to avoid Python-level indexing overhead, replace index-based hardcoded fast-paths with direct slice access (`s_sub`, `t_sub`), and eliminate the unused `_levenshtein` function.", "hypothesis_source": "agent", "mutation_diff_summary": "", "score": 57.09, "score_ci_lower": null, "score_ci_upper": null, "raw_scores": null, "baseline_score": 51.47, "outcome": "DISCARDED", "failure_mode": null, "duration_seconds": 172.12204500008374, "tags": ["string-matching", "loop-optimization", "fast-path", "memory-allocation", "inlining"], "learnings": "{\"what_changed\":\"\",\"what_improved\":[],\"what_regressed\":[],\"transferable_insight\":\"Replacing simple index-based array or string operations with iterator-based abstractions or slice copies often degrades performance due to the overhead of object creation and memory allocation.\",\"domain_tags\":[\"Performance Optimization\",\"Code Refactoring\",\"Algorithm Design\"]}", "cost_usd": 0.06369415, "bootstrap_seed": 0, "agent_model": "gemini-3.1-pro-preview", "held_out_score": null, "criterion_names": null, "per_criterion_scores": null, "failure_classification": {"category": "over_optimization", "description": "The experiment attempted to optimize prefix and suffix trimming by employing low-level Python optimizations like `zip` with `reversed()` and direct slice access to avoid indexing overhead. These micro-optimizations likely introduced new overhead or complexities, or were less efficient than Python's existing optimized C implementations, leading to a degraded or non-improved performance score of 57.0900. This is a classic case of trying to optimize at a level that is counterproductive within the Python ecosystem.", "fix_direction": "Re-evaluate the actual performance bottlenecks through profiling rather than assuming 'indexing overhead'. Favor idiomatic Python code unless profiling rigorously proves a specific bottleneck warrants a non-idiomatic optimization. Consider if built-in functions or existing libraries already offer highly optimized solutions for the trimming task. Avoid premature or counterproductive low-level optimizations in Python.", "confidence": 0.9}, "drafts_generated": 1, "drafts_survived": 1}
{"id": "d69f70b0-4b3c-45a2-96b5-7a0849ac346b", "target_id": "B3-treatment", "git_sha": "8e91ca72d34ae3c5489d31ac8b5819466ef38360", "pre_experiment_sha": "8e91ca72d34ae3c5489d31ac8b5819466ef38360", "timestamp": "2026-04-22T18:55:11.269734+00:00", "hypothesis": "Use `enumerate(zip(...))` for prefix trimming, slice strings before the DP loop to avoid Python-level indexing overhead, use `enumerate(t_sub, 1)` in the DP loop to push the counter into C code, and remove unused functions.", "hypothesis_source": "agent", "mutation_diff_summary": "", "score": 59.12, "score_ci_lower": null, "score_ci_upper": null, "raw_scores": null, "baseline_score": 51.47, "outcome": "DISCARDED", "failure_mode": null, "duration_seconds": 124.67775679193437, "tags": ["string-matching", "dynamic-programming", "loop-optimization", "inlining"], "learnings": "{\"what_changed\":\"\",\"what_improved\":[],\"what_regressed\":[],\"transferable_insight\":\"Replacing direct indexing with iterator-based built-ins and pre-slicing in tight loops can degrade performance due to the hidden overhead of iterator creation, tuple unpacking, and memory copying.\",\"domain_tags\":[\"Performance Optimization\",\"Code Refactoring\",\"Algorithm Efficiency\"]}", "cost_usd": 0.06273995, "bootstrap_seed": 0, "agent_model": "gemini-3.1-pro-preview", "held_out_score": null, "criterion_names": null, "per_criterion_scores": null, "failure_classification": {"category": "logic_error", "description": "The proposed micro-optimizations, while aimed at efficiency, likely introduced a subtle bug or incorrect behavior in the program's logic. This led to an 'unknown' failure mode and a score indicating incorrect computation or handling of edge cases, rather than a successful performance improvement. The changes in data handling (e.g., prefix trimming with `enumerate(zip(...))`, string slicing) might not have preserved the original logic's integrity under all conditions.", "fix_direction": "Carefully review each optimization step (e.g., `enumerate(zip(...))`, string slicing, `enumerate(t_sub, 1)`) to ensure it strictly preserves the original program's correctness and logic. Validate the behavior with comprehensive test cases, especially focusing on boundary conditions and data consistency, before measuring performance.", "confidence": 0.85}, "drafts_generated": 1, "drafts_survived": 1}
{"id": "d44176ce-3800-4b49-8df6-b3d3683c30e1", "target_id": "B3-treatment", "git_sha": "c4d00fa6b3276a6f35fd99f112670d2708a7f7e5", "pre_experiment_sha": "8e91ca72d34ae3c5489d31ac8b5819466ef38360", "timestamp": "2026-04-22T18:59:57.899154+00:00", "hypothesis": "Optimize the suffix trimming loop to use negative indexing and eliminate inner-loop decrement operations, replace dictionary lookups with `get()` and `try/except` for length grouping, and iterate directly over a string slice in the DP loop to remove Python indexing overhead.", "hypothesis_source": "agent", "mutation_diff_summary": "", "score": 50.32, "score_ci_lower": null, "score_ci_upper": null, "raw_scores": null, "baseline_score": 51.47, "outcome": "KEPT", "failure_mode": null, "duration_seconds": 227.41633929219097, "tags": ["string-matching", "loop-optimization", "dictionary-lookup", "dynamic-programming", "inline-variables"], "learnings": "{\"what_changed\":\"\",\"what_improved\":[],\"what_regressed\":[],\"transferable_insight\":\"Replacing manual index tracking and conditional membership checks with native language constructs, such as direct collection iteration and exception-based access, reduces interpreter overhead and accelerates execution.\",\"domain_tags\":[\"Performance Optimization\",\"Code Refactoring\",\"Execution Efficiency\"]}", "cost_usd": 0.06242625, "bootstrap_seed": 0, "agent_model": "gemini-3.1-pro-preview", "held_out_score": null, "criterion_names": null, "per_criterion_scores": null, "failure_classification": null, "drafts_generated": 1, "drafts_survived": 1}
{"id": "8f13d055-d14c-4ae1-a569-236aff640bae", "target_id": "B3-treatment", "git_sha": "716cb3f1ba9119cacb42167961223f8229b1db63", "pre_experiment_sha": "c4d00fa6b3276a6f35fd99f112670d2708a7f7e5", "timestamp": "2026-04-22T19:03:23.092411+00:00", "hypothesis": "Optimize prefix/suffix trimming using fast `while` loops, unroll threshold length iterations, and streamline the DP loop to maximize string matching performance.", "hypothesis_source": "agent", "mutation_diff_summary": "", "score": 44.11, "score_ci_lower": null, "score_ci_upper": null, "raw_scores": null, "baseline_score": 50.32, "outcome": "KEPT", "failure_mode": null, "duration_seconds": 194.85503295902163, "tags": ["performance", "string-matching", "dynamic-programming", "fast-path"], "learnings": "{\"what_changed\":\"\",\"what_improved\":[],\"what_regressed\":[],\"transferable_insight\":\"Eliminating redundant boundary processing and unrolling critical inner loops reduces computational overhead and accelerates overall execution performance.\",\"domain_tags\":[\"Performance Optimization\",\"Algorithm Design\",\"Code Optimization\"]}", "cost_usd": 0.059806250000000005, "bootstrap_seed": 0, "agent_model": "gemini-3.1-pro-preview", "held_out_score": null, "criterion_names": null, "per_criterion_scores": null, "failure_classification": null, "drafts_generated": 1, "drafts_survived": 1}
