{"id": "f072f5e7-d2a5-465a-9651-10d956754f59", "target_id": "B3-treatment", "git_sha": "87e12269dc65c1ca017c1f644585d7950f31ad34", "pre_experiment_sha": "87e12269dc65c1ca017c1f644585d7950f31ad34", "timestamp": "2026-04-19T15:52:08.645712+00:00", "hypothesis": "Reuse the existing per-string length cache directly in the repeated comparison path and thread both cached lengths through every bounded-distance call there.", "hypothesis_source": "agent", "mutation_diff_summary": "", "score": 100.96, "score_ci_lower": null, "score_ci_upper": null, "raw_scores": null, "baseline_score": 99.94, "outcome": "DISCARDED", "failure_mode": null, "duration_seconds": 36.43571674998384, "tags": ["length-caching", "hot-path", "levenshtein"], "learnings": "{\"what_changed\":\"\",\"what_improved\":[],\"what_regressed\":[],\"transferable_insight\":\"When an optimization adds complexity without measurable gains or clear regressions, prefer the simpler existing path over propagating extra cached state through multiple call sites.\",\"domain_tags\":[\"optimization\",\"software-engineering\",\"performance\"]}", "cost_usd": 0.0865436, "bootstrap_seed": 0, "agent_model": "gpt-5.4", "held_out_score": null, "criterion_names": null, "per_criterion_scores": null, "failure_classification": {"category": "incomplete_edit", "description": "The attempted change to reuse the per-string length cache in the repeated comparison path appears to not have been consistently threaded through all bounded-distance call sites/paths, leaving some comparisons still using non-cached or inconsistent length data. This would produce incorrect or inconsistent behavior while still fitting the intended output shape and not constituting a pure logic miscalculation.", "fix_direction": "Audit all bounded-distance call paths to ensure cached lengths are passed through every relevant function boundary; add targeted tests/trace checks that confirm the cached-length values are used end-to-end in the repeated comparison flow.", "confidence": 0.74}, "drafts_generated": 1, "drafts_survived": 1}
{"id": "055890a9-6cdc-4488-87cf-4f35f10d69a4", "target_id": "B3-treatment", "git_sha": "87e12269dc65c1ca017c1f644585d7950f31ad34", "pre_experiment_sha": "87e12269dc65c1ca017c1f644585d7950f31ad34", "timestamp": "2026-04-19T15:52:45.006024+00:00", "hypothesis": "Cache and thread both string lengths through the repeated bounded-distance comparison path using the existing pair caches.", "hypothesis_source": "agent", "mutation_diff_summary": "", "score": 100.96, "score_ci_lower": null, "score_ci_upper": null, "raw_scores": null, "baseline_score": 99.94, "outcome": "DISCARDED", "failure_mode": null, "duration_seconds": 33.79589162499178, "tags": ["length-caching", "levenshtein", "hot-path"], "learnings": "{\"what_changed\":\"\",\"what_improved\":[],\"what_regressed\":[],\"transferable_insight\":\"Reusing existing cached intermediate results can simplify repeated computations, but if the added state does not reduce work or improve outcomes, the extra complexity is likely not worth keeping.\",\"domain_tags\":[\"optimization\",\"software-engineering\"]}", "cost_usd": 0.0871992, "bootstrap_seed": 0, "agent_model": "gpt-5.4", "held_out_score": null, "criterion_names": null, "per_criterion_scores": null, "failure_classification": {"category": "logic_error", "description": "The provided failure report lacks information about what actually went wrong (no parsing/build/runtime error, no evidence of logic/semantic issues, and no indication of format regressions). The \u201cunknown\u201d failure mode and absent diagnostics prevent mapping to a specific category.", "fix_direction": "Re-run with full logs/stack trace and diff against the last passing version to determine whether the issue is due to formatting, logic/calculation, regression, scope, syntax, semantic meaning, optimization gaming, or inconsistent partial edits.", "confidence": 0.12}, "drafts_generated": 1, "drafts_survived": 1}
{"id": "01d080d3-1fc1-4707-902f-32d7f9e06bbe", "target_id": "B3-treatment", "git_sha": "40237983a69e483980c221b6b4fd774f2c0351f5", "pre_experiment_sha": "87e12269dc65c1ca017c1f644585d7950f31ad34", "timestamp": "2026-04-19T15:53:58.922536+00:00", "hypothesis": "Reuse the existing per-item cache to carry both strings and lengths through the repeated comparison path without any leftover len lookups there.", "hypothesis_source": "agent", "mutation_diff_summary": "", "score": 99.59, "score_ci_lower": null, "score_ci_upper": null, "raw_scores": null, "baseline_score": 99.94, "outcome": "KEPT", "failure_mode": null, "duration_seconds": 31.821258875075728, "tags": ["length-cache", "hot-path", "minimal-edit"], "learnings": "{\"what_changed\":\"\",\"what_improved\":[],\"what_regressed\":[],\"transferable_insight\":\"When a repeated operation needs the same metadata multiple times, carrying it forward in the existing cache can reduce redundant lookups and simplify the hot path.\",\"domain_tags\":[\"performance-optimization\",\"caching\",\"software-engineering\"]}", "cost_usd": 0.08621500000000001, "bootstrap_seed": 0, "agent_model": "gpt-5.4", "held_out_score": null, "criterion_names": null, "per_criterion_scores": null, "failure_classification": null, "drafts_generated": 1, "drafts_survived": 1}
{"id": "ae962f85-6664-4d83-b5ea-16bebb6eb4e4", "target_id": "B3-treatment", "git_sha": "40237983a69e483980c221b6b4fd774f2c0351f5", "pre_experiment_sha": "40237983a69e483980c221b6b4fd774f2c0351f5", "timestamp": "2026-04-19T15:54:38.207297+00:00", "hypothesis": "Reuse the existing cached `(string, length)` tuples for every repeated bounded Levenshtein comparison path without any leftover `len(...)` recomputation.", "hypothesis_source": "agent", "mutation_diff_summary": "", "score": 99.87, "score_ci_lower": null, "score_ci_upper": null, "raw_scores": null, "baseline_score": 99.59, "outcome": "DISCARDED", "failure_mode": null, "duration_seconds": 37.49627708399203, "tags": ["length-cache", "hot-path", "bounded-levenshtein"], "learnings": "{\"what_changed\":\"\",\"what_improved\":[],\"what_regressed\":[],\"transferable_insight\":\"Caching repeated intermediate values only helps when the cached form is actually reused across the full execution path; otherwise, eliminating recomputation may add complexity without measurable benefit.\",\"domain_tags\":[\"optimization\",\"caching\",\"performance\"]}", "cost_usd": 0.08682640000000001, "bootstrap_seed": 0, "agent_model": "gpt-5.4", "held_out_score": null, "criterion_names": null, "per_criterion_scores": null, "failure_classification": {"category": "incomplete_edit", "description": "The hypothesis targets eliminating leftover `len(...)` recomputation for repeated bounded Levenshtein paths, but the failure mode is listed as unknown and the test result appears to indicate the change did not fully eliminate all recomputation or left parts of the state inconsistent with the intended caching reuse.", "fix_direction": "Audit the comparison path for any remaining `len(...)`/length calculations; ensure every repeated bounded Levenshtein call consistently uses the cached `(string, length)` tuple and that cache population/invalidation is complete and deterministic for all code branches.", "confidence": 0.63}, "drafts_generated": 1, "drafts_survived": 1}
{"id": "12787eed-6c9e-4d67-b21e-731517067dc8", "target_id": "B3-treatment", "git_sha": "40237983a69e483980c221b6b4fd774f2c0351f5", "pre_experiment_sha": "40237983a69e483980c221b6b4fd774f2c0351f5", "timestamp": "2026-04-19T15:55:14.622765+00:00", "hypothesis": "Thread the already-cached string lengths through the repeated bounded-distance comparison path to avoid any leftover len recomputation there.", "hypothesis_source": "agent", "mutation_diff_summary": "", "score": 99.74, "score_ci_lower": null, "score_ci_upper": null, "raw_scores": null, "baseline_score": 99.59, "outcome": "DISCARDED", "failure_mode": null, "duration_seconds": 33.52649912505876, "tags": ["length-caching", "hot-path", "bounded-levenshtein"], "learnings": "{\"what_changed\":\"\",\"what_improved\":[],\"what_regressed\":[],\"transferable_insight\":\"When an optimization only removes a small amount of repeated work in an already bounded hot path, it may add complexity without producing measurable benefit, so validate that the saved recomputation is actually material before keeping it.\",\"domain_tags\":[\"optimization\",\"performance-engineering\",\"software-design\"]}", "cost_usd": 0.08705380000000001, "bootstrap_seed": 0, "agent_model": "gpt-5.4", "held_out_score": null, "criterion_names": null, "per_criterion_scores": null, "failure_classification": {"category": "logic_error", "description": "The provided information lacks sufficient detail about what actually failed (no observed error, incorrect output, or diff/behavioral evidence). While the hypothesis suggests a performance/flow change related to cached length threading, the failure mode is listed as 'unknown', so the failure cannot be confidently mapped to one of the known categories.", "fix_direction": "Provide concrete failure evidence (error logs, failing test name, before/after behavior), and include the relevant code change/diff so the failure can be categorized (e.g., verify correctness of length values through all comparison paths, ensure no partial/early returns leave inconsistent state).", "confidence": 0.05}, "drafts_generated": 1, "drafts_survived": 1}
{"id": "c0ed5ca2-5a04-4f19-9c15-7d06abd35602", "target_id": "B3-treatment", "git_sha": "40237983a69e483980c221b6b4fd774f2c0351f5", "pre_experiment_sha": "40237983a69e483980c221b6b4fd774f2c0351f5", "timestamp": "2026-04-19T15:55:51.614279+00:00", "hypothesis": "Cache both strings and both lengths together in the repeated pair-comparison path and thread those cached lengths into every bounded Levenshtein call there.", "hypothesis_source": "agent", "mutation_diff_summary": "", "score": 101.36, "score_ci_lower": null, "score_ci_upper": null, "raw_scores": null, "baseline_score": 99.59, "outcome": "DISCARDED", "failure_mode": null, "duration_seconds": 30.868817999958992, "tags": ["length-caching", "hot-path", "bounded-levenshtein"], "learnings": "{\"what_changed\":\"\",\"what_improved\":[],\"what_regressed\":[],\"transferable_insight\":\"When an optimization adds bookkeeping without changing the underlying decision logic, it may be neutral overall because the extra caching and plumbing can offset any gains from reduced recomputation.\",\"domain_tags\":[\"performance-optimization\",\"software-engineering\",\"algorithm-design\"]}", "cost_usd": 0.0869596, "bootstrap_seed": 0, "agent_model": "gpt-5.4", "held_out_score": null, "criterion_names": null, "per_criterion_scores": null, "failure_classification": {"category": "logic_error", "description": "The attempted optimization/caching strategy likely mis-threaded or incorrectly applied cached string lengths/values into the bounded Levenshtein calls, leading to incorrect distances/decision logic along the repeated pair-comparison path.", "fix_direction": "Verify correctness invariants when caching (cache keys/values are identical to the original inputs), ensure the cached lengths correspond to the exact string pairs used in each bounded call, and add targeted regression tests comparing cached-vs-uncached behavior across edge cases.", "confidence": 0.63}, "drafts_generated": 1, "drafts_survived": 1}
{"id": "d081db17-7e0f-4cfc-8096-ebd88dc411a0", "target_id": "B3-treatment", "git_sha": "7b356ea213868a4ab095bce16b247aa319c9c0d3", "pre_experiment_sha": "40237983a69e483980c221b6b4fd774f2c0351f5", "timestamp": "2026-04-19T15:56:24.533951+00:00", "hypothesis": "Cache both string lengths alongside the repeated string pair records and thread them through all bounded Levenshtein calls on that hot path.", "hypothesis_source": "agent", "mutation_diff_summary": "", "score": 100.94, "score_ci_lower": null, "score_ci_upper": null, "raw_scores": null, "baseline_score": 99.59, "outcome": "KEPT", "failure_mode": null, "duration_seconds": 30.369076375034638, "tags": ["length-caching", "hot-path", "bounded-levenshtein"], "learnings": "{\"what_changed\":\"\",\"what_improved\":[],\"what_regressed\":[],\"transferable_insight\":\"When the same data is reused repeatedly in a performance-critical path, caching derived metadata and passing it through the call chain can reduce redundant work without changing behavior.\",\"domain_tags\":[\"performance-optimization\",\"caching\",\"software-engineering\"]}", "cost_usd": 0.08659, "bootstrap_seed": 0, "agent_model": "gpt-5.4", "held_out_score": null, "criterion_names": null, "per_criterion_scores": null, "failure_classification": null, "drafts_generated": 1, "drafts_survived": 1}
