{"id": "c05ba46a-44d1-40d9-96fc-c36cc23b3aa0", "target_id": "B3-treatment", "git_sha": "b46cec11fad5bd3abf312c5a522c6ab27934d3c2", "pre_experiment_sha": "b46cec11fad5bd3abf312c5a522c6ab27934d3c2", "timestamp": "2026-04-23T17:51:15.478051+00:00", "hypothesis": "Inline temporary slice variables and bounds calculations to eliminate local variable assignments, bypass explicit `dels` set creation using a direct comprehension, and utilize the walrus operator to streamline dictionary lookups.", "hypothesis_source": "agent", "mutation_diff_summary": "", "score": 4.23, "score_ci_lower": null, "score_ci_upper": null, "raw_scores": null, "baseline_score": 4.22, "outcome": "DISCARDED", "failure_mode": null, "duration_seconds": 165.34868558403105, "tags": ["symspell", "optimization", "unrolling", "string-slicing", "fast-path", "walrus-operator"], "learnings": "{\"what_changed\":\"\",\"what_improved\":[],\"what_regressed\":[],\"transferable_insight\":\"Micro-optimizations such as aggressively inlining variables and condensing operations into single expressions often fail to provide measurable performance gains and can unnecessarily increase code complexity.\",\"domain_tags\":[\"Code Optimization\",\"Micro-optimization\",\"Refactoring\"]}", "cost_usd": 0.0510919, "bootstrap_seed": 0, "agent_model": "gemini-3.1-pro-preview", "held_out_score": null, "criterion_names": null, "per_criterion_scores": null, "failure_classification": {"category": "logic_error", "description": "The aggressive optimization techniques, such as inlining slice variables, bypassing explicit set creation, and using the walrus operator, likely introduced subtle logical flaws or incorrect calculations. While the code might have been syntactically valid and run without explicit errors, these changes probably altered the intended behavior or output, leading to the low score and 'unknown' failure mode (i.e., incorrect results rather than a crash).", "fix_direction": "Prioritize correctness over micro-optimizations in initial development. Introduce optimizations incrementally, with robust testing (unit and integration) at each step to verify that the core logic and output remain correct. Use profiling tools to identify actual performance bottlenecks before attempting complex optimizations. If an optimization leads to a logic error, simplify the relevant code section and re-evaluate the need or approach for that specific optimization.", "confidence": 0.9}, "drafts_generated": 1, "drafts_survived": 1}
{"id": "7d61aff8-a525-4e25-b6e2-c2dd635efa6e", "target_id": "B3-treatment", "git_sha": "57f554a23935a88a0b847b041d20825ac8a30b68", "pre_experiment_sha": "b46cec11fad5bd3abf312c5a522c6ab27934d3c2", "timestamp": "2026-04-23T17:54:28.900095+00:00", "hypothesis": "Inline temporary slice variables (`p1`, `end_t1`) and bounds calculations (`end_t == p`) in the string verification fast-paths to eliminate local variable assignments and reduce bytecode instructions in the tightest loops.", "hypothesis_source": "agent", "mutation_diff_summary": "", "score": 4.12, "score_ci_lower": null, "score_ci_upper": null, "raw_scores": null, "baseline_score": 4.22, "outcome": "KEPT", "failure_mode": null, "duration_seconds": 169.31880870787427, "tags": ["symspell", "optimization", "unrolling", "string-slicing", "fast-path"], "learnings": "{\"what_changed\":\"\",\"what_improved\":[],\"what_regressed\":[],\"transferable_insight\":\"Inlining temporary variables and intermediate calculations directly into expressions within tight loops reduces instruction overhead and improves execution performance.\",\"domain_tags\":[\"Code Optimization\",\"Performance Tuning\",\"Loop Optimization\"]}", "cost_usd": 0.051152500000000004, "bootstrap_seed": 0, "agent_model": "gemini-3.1-pro-preview", "held_out_score": null, "criterion_names": null, "per_criterion_scores": null, "failure_classification": null, "drafts_generated": 1, "drafts_survived": 1}
{"id": "d755e2ef-126d-41b1-ba87-fecccdc2977f", "target_id": "B3-treatment", "git_sha": "3c7397b4581304c85f5397c01626bab2a738b4cb", "pre_experiment_sha": "57f554a23935a88a0b847b041d20825ac8a30b68", "timestamp": "2026-04-23T17:58:21.682882+00:00", "hypothesis": "Flatten nested `else: if` statements into `elif` and inline temporary slice variables in the length difference branches to reduce bytecode instructions and eliminate local variable assignment overhead in the hot path.", "hypothesis_source": "agent", "mutation_diff_summary": "", "score": 4.02, "score_ci_lower": null, "score_ci_upper": null, "raw_scores": null, "baseline_score": 4.12, "outcome": "KEPT", "failure_mode": null, "duration_seconds": 225.21729154186323, "tags": ["symspell", "optimization", "fast-path", "unrolling", "bytecode-reduction"], "learnings": "{\"what_changed\":\"\",\"what_improved\":[],\"what_regressed\":[],\"transferable_insight\":\"Flattening nested conditionals and inlining temporary variables reduces execution overhead and improves performance in frequently executed code paths.\",\"domain_tags\":[\"Code Optimization\",\"Control Flow\",\"Performance Tuning\"]}", "cost_usd": 0.0508325, "bootstrap_seed": 0, "agent_model": "gemini-3.1-pro-preview", "held_out_score": null, "criterion_names": null, "per_criterion_scores": null, "failure_classification": null, "drafts_generated": 1, "drafts_survived": 1}
{"id": "124046f2-6727-42f5-a6fe-55c9c1c3c30f", "target_id": "B3-treatment", "git_sha": "87176fc11877e83dd7a2bc5d3ef1ad514f0d6c0d", "pre_experiment_sha": "3c7397b4581304c85f5397c01626bab2a738b4cb", "timestamp": "2026-04-23T18:01:56.120363+00:00", "hypothesis": "Eliminate redundant slice index calculations by precomputing the remaining length (`rem`) and inline conditional branches to further streamline the O(1) string verification fast-paths, while removing the unnecessary empty `a_cands` check to save a branch instruction per word.", "hypothesis_source": "agent", "mutation_diff_summary": "", "score": 4.33, "score_ci_lower": null, "score_ci_upper": null, "raw_scores": null, "baseline_score": 4.02, "outcome": "KEPT", "failure_mode": null, "duration_seconds": 176.63434637500905, "tags": ["symspell", "optimization", "unrolling", "string-slicing", "fast-path"], "learnings": "{\"what_changed\":\"\",\"what_improved\":[],\"what_regressed\":[],\"transferable_insight\":\"Precomputing frequently accessed values and eliminating redundant conditional checks streamlines fast-path execution by reducing branching overhead.\",\"domain_tags\":[\"Performance Optimization\",\"Code Optimization\",\"Algorithm Efficiency\"]}", "cost_usd": 0.0509275, "bootstrap_seed": 0, "agent_model": "gemini-3.1-pro-preview", "held_out_score": null, "criterion_names": null, "per_criterion_scores": null, "failure_classification": null, "drafts_generated": 1, "drafts_survived": 1}
{"id": "a9d25da4-c417-436a-903a-ed8b75cac0fd", "target_id": "B3-treatment", "git_sha": "19ea206ceb2b5be40fc0bde94231dbf975ba7fd3", "pre_experiment_sha": "87176fc11877e83dd7a2bc5d3ef1ad514f0d6c0d", "timestamp": "2026-04-23T18:05:32.205439+00:00", "hypothesis": "Restore the `if not a_cands: continue` check to bypass expensive lookups for words without matches, revert redundant slice precomputations in the equal-length fast path, and completely flatten length difference branches to reduce bytecode complexity and conditional jump overhead.", "hypothesis_source": "agent", "mutation_diff_summary": "", "score": 4.18, "score_ci_lower": null, "score_ci_upper": null, "raw_scores": null, "baseline_score": 4.33, "outcome": "KEPT", "failure_mode": null, "duration_seconds": 209.89583495794795, "tags": ["symspell", "optimization", "fast-path", "unrolling", "bytecode-reduction"], "learnings": "{\"what_changed\":\"\",\"what_improved\":[],\"what_regressed\":[],\"transferable_insight\":\"Performance can be significantly improved by combining early exits for empty states, deferring expensive precomputations until strictly necessary, and flattening conditional branches to minimize jump overhead.\",\"domain_tags\":[\"Performance Optimization\",\"Control Flow\",\"Algorithm Design\"]}", "cost_usd": 0.05088625000000001, "bootstrap_seed": 0, "agent_model": "gemini-3.1-pro-preview", "held_out_score": null, "criterion_names": null, "per_criterion_scores": null, "failure_classification": null, "drafts_generated": 1, "drafts_survived": 1}
{"id": "a802028a-c8c4-4a8b-a232-494ee46f1aa1", "target_id": "B3-treatment", "git_sha": "96f098511e837212dde6cc32268bf5760229847a", "pre_experiment_sha": "19ea206ceb2b5be40fc0bde94231dbf975ba7fd3", "timestamp": "2026-04-23T18:09:40.110767+00:00", "hypothesis": "Optimize the O(1) string verification fast-paths by introducing `diff_len <= 2` and `q == rem - 1` short-circuits to mathematically guarantee distance without string slicing, while deferring bounds calculations (`end_t`, `end_b`, `end_a`) strictly to the slow paths.", "hypothesis_source": "agent", "mutation_diff_summary": "", "score": 4.01, "score_ci_lower": null, "score_ci_upper": null, "raw_scores": null, "baseline_score": 4.18, "outcome": "KEPT", "failure_mode": null, "duration_seconds": 238.0726661249064, "tags": ["symspell", "optimization", "unrolling", "string-slicing", "fast-path", "bytecode-reduction"], "learnings": "{\"what_changed\":\"\",\"what_improved\":[],\"what_regressed\":[],\"transferable_insight\":\"System performance improves when expensive data manipulations are replaced with cheap mathematical short-circuits and heavy setup calculations are strictly deferred to fallback execution paths.\",\"domain_tags\":[\"Performance Engineering\",\"Algorithm Optimization\",\"Lazy Evaluation\"]}", "cost_usd": 0.05164, "bootstrap_seed": 0, "agent_model": "gemini-3.1-pro-preview", "held_out_score": null, "criterion_names": null, "per_criterion_scores": null, "failure_classification": null, "drafts_generated": 1, "drafts_survived": 1}
{"id": "d032f33b-c2c5-4ae5-97cc-f31d9db0f8b6", "target_id": "B3-treatment", "git_sha": "cac434b8d8acb76eb8456aa3b11a79ee29b39e8e", "pre_experiment_sha": "96f098511e837212dde6cc32268bf5760229847a", "timestamp": "2026-04-23T18:14:09.466388+00:00", "hypothesis": "Replace explicit bounds calculations (`end_t - 1`, `end_b - 1`, `end_a - 1`) with Python's bitwise NOT operator (`~q`) in string slicing to leverage negative indexing, thereby eliminating multiple subtraction operations and local variable assignments in the O(1) string verification fast-paths.", "hypothesis_source": "agent", "mutation_diff_summary": "", "score": 4.27, "score_ci_lower": null, "score_ci_upper": null, "raw_scores": null, "baseline_score": 4.01, "outcome": "KEPT", "failure_mode": null, "duration_seconds": 244.36630424996838, "tags": ["symspell", "optimization", "unrolling", "string-slicing", "fast-path", "bytecode-reduction"], "learnings": "{\"what_changed\":\"\",\"what_improved\":[],\"what_regressed\":[],\"transferable_insight\":\"Replacing explicit arithmetic bounds calculations with native language features, such as bitwise operators for negative indexing, reduces computational overhead and optimizes performance-critical fast-paths.\",\"domain_tags\":[\"Performance Optimization\",\"Code Simplification\",\"Language Features\"]}", "cost_usd": 0.0519875, "bootstrap_seed": 0, "agent_model": "gemini-3.1-pro-preview", "held_out_score": null, "criterion_names": null, "per_criterion_scores": null, "failure_classification": null, "drafts_generated": 1, "drafts_survived": 1}
{"id": "ef82b756-abbf-4430-bb58-958a592ca5ef", "target_id": "B3-treatment", "git_sha": "8d12b45b4c1273cab886f5a5e3aff0af44fd9779", "pre_experiment_sha": "cac434b8d8acb76eb8456aa3b11a79ee29b39e8e", "timestamp": "2026-04-23T18:18:13.523991+00:00", "hypothesis": "Revert negative index slicing (`~q`) to explicit positive bounds (`end_t_1`, etc.) to eliminate Python's `UNARY_INVERT` and negative index adjustment overhead, unify `diff_len` short-circuits across all fast-paths, and streamline `b_dels` population.", "hypothesis_source": "agent", "mutation_diff_summary": "", "score": 4.27, "score_ci_lower": null, "score_ci_upper": null, "raw_scores": null, "baseline_score": 4.27, "outcome": "KEPT", "failure_mode": null, "duration_seconds": 235.82727770810015, "tags": ["symspell", "optimization", "string-slicing", "fast-path", "bytecode-reduction"], "learnings": "{\"what_changed\":\"\",\"what_improved\":[],\"what_regressed\":[],\"transferable_insight\":\"Replacing convenience language features with explicit boundary calculations can eliminate hidden runtime overhead and unify logic across execution paths.\",\"domain_tags\":[\"Performance Optimization\",\"Code Refactoring\",\"Micro-optimization\"]}", "cost_usd": 0.0529275, "bootstrap_seed": 0, "agent_model": "gemini-3.1-pro-preview", "held_out_score": null, "criterion_names": null, "per_criterion_scores": null, "failure_classification": null, "drafts_generated": 1, "drafts_survived": 1}
