{"id": "2486b254-1849-4a06-9e7f-f2b6d622beee", "target_id": "B3-treatment", "git_sha": "8514c78664c0208fd03492deba8551cb8fb182e8", "pre_experiment_sha": "8514c78664c0208fd03492deba8551cb8fb182e8", "timestamp": "2026-04-23T17:08:02.336204+00:00", "hypothesis": "Optimize SymSpell candidate generation by using a fast `for` loop over `filter` to deduplicate candidates in C without forbidden functions, and micro-optimize O(1) string slicing verification by caching index offsets and simplifying length difference checks.", "hypothesis_source": "agent", "mutation_diff_summary": "", "score": 4.57, "score_ci_lower": null, "score_ci_upper": null, "raw_scores": null, "baseline_score": 4.18, "outcome": "DISCARDED", "failure_mode": null, "duration_seconds": 262.0253572498914, "tags": ["symspell", "optimization", "string-slicing", "c-extensions", "fast-path"], "learnings": "{\"what_changed\":\"\",\"what_improved\":[],\"what_regressed\":[],\"transferable_insight\":\"Manual micro-optimizations, such as replacing native filtering functions with custom loops or caching simple index offsets, often degrade performance by interfering with highly optimized compiler or runtime internals.\",\"domain_tags\":[\"Performance Engineering\",\"Micro-optimization\",\"Software Architecture\"]}", "cost_usd": 0.04892515000000001, "bootstrap_seed": 0, "agent_model": "gemini-3.1-pro-preview", "held_out_score": null, "criterion_names": null, "per_criterion_scores": null, "failure_classification": {"category": "logic_error", "description": "The specific algorithmic changes proposed for optimization, such as the fast `for` loop for deduplication or the micro-optimizations for string slicing verification (caching index offsets, simplifying length checks), likely contained errors in their implementation logic. This could have led to incorrect behavior, faulty calculations, or subtle bugs that degraded performance or correctness, resulting in the observed score without a clear crash or explicit error message (consistent with 'unknown' failure mode). It's also possible that the 'without forbidden functions' constraint was violated, indicating a logical flaw in adhering to the specified environment.", "fix_direction": "Thoroughly review the C implementation of both the deduplication logic and the string slicing verification. Implement granular unit tests to verify the correctness of each optimization independently, ensuring accurate deduplication and robust string handling under various conditions. Verify strict adherence to the 'without forbidden functions' constraint. Profile the optimized code against the baseline to pinpoint the exact source of performance degradation or incorrect results.", "confidence": 0.9}, "drafts_generated": 1, "drafts_survived": 1}
{"id": "edb46be4-22f4-48b4-8a8e-7bc17015acbc", "target_id": "B3-treatment", "git_sha": "782c395c99ba6b12e8fb0c880d041ca415129057", "pre_experiment_sha": "8514c78664c0208fd03492deba8551cb8fb182e8", "timestamp": "2026-04-23T17:13:06.738724+00:00", "hypothesis": "Optimize SymSpell candidate merging by replacing forbidden bulk updates with a fast `for` loop over `filter`, and safely integrate O(1) string slicing verification for length differences of 2 to eliminate branching overhead and prevent logic errors.", "hypothesis_source": "agent", "mutation_diff_summary": "", "score": 4.17, "score_ci_lower": null, "score_ci_upper": null, "raw_scores": null, "baseline_score": 4.18, "outcome": "KEPT", "failure_mode": null, "duration_seconds": 279.487138583092, "tags": ["symspell", "optimization", "string-slicing", "c-level-loops", "bug-fix"], "learnings": "{\"what_changed\":\"\",\"what_improved\":[],\"what_regressed\":[],\"transferable_insight\":\"Replacing complex bulk operations with targeted, filtered iterations and constant-time verification for specific edge cases reduces branching overhead and improves execution safety.\",\"domain_tags\":[\"Algorithm Optimization\",\"Performance Tuning\",\"Software Engineering\"]}", "cost_usd": 0.0490425, "bootstrap_seed": 0, "agent_model": "gemini-3.1-pro-preview", "held_out_score": null, "criterion_names": null, "per_criterion_scores": null, "failure_classification": null, "drafts_generated": 1, "drafts_survived": 1}
{"id": "a9cc162e-cd68-4cbc-9f9f-655affbbfac9", "target_id": "B3-treatment", "git_sha": "782c395c99ba6b12e8fb0c880d041ca415129057", "pre_experiment_sha": "782c395c99ba6b12e8fb0c880d041ca415129057", "timestamp": "2026-04-23T17:17:00.268285+00:00", "hypothesis": "Optimize SymSpell candidate generation by avoiding tuple packing/unpacking during variable assignment and streamlining the length difference branching for faster bytecode execution.", "hypothesis_source": "agent", "mutation_diff_summary": "", "score": 4.22, "score_ci_lower": null, "score_ci_upper": null, "raw_scores": null, "baseline_score": 4.17, "outcome": "DISCARDED", "failure_mode": null, "duration_seconds": 207.20564583293162, "tags": ["symspell", "optimization", "micro-optimization", "fast-path"], "learnings": "{\"what_changed\":\"\",\"what_improved\":[],\"what_regressed\":[],\"transferable_insight\":\"Low-level micro-optimizations, such as avoiding tuple packing or tweaking branch structures, often fail to yield meaningful performance gains and can overcomplicate code without benefit.\",\"domain_tags\":[\"Performance Optimization\",\"Micro-optimization\",\"Software Engineering\"]}", "cost_usd": 0.0490941, "bootstrap_seed": 0, "agent_model": "gemini-3.1-pro-preview", "held_out_score": null, "criterion_names": null, "per_criterion_scores": null, "failure_classification": {"category": "logic_error", "description": "The micro-optimizations aimed at avoiding tuple packing/unpacking and streamlining branching for faster bytecode execution likely introduced a subtle flaw in the SymSpell candidate generation logic. This change inadvertently led to incorrect or incomplete candidate suggestions, resulting in the high failure score. The 'unknown' failure mode suggests the exact nature of the behavioral change was not immediately clear.", "fix_direction": "Revert the micro-optimization changes. If performance is still a concern, conduct deeper profiling to identify actual bottlenecks and consider alternative optimization strategies that don't compromise functional correctness. Ensure comprehensive unit and integration tests are in place to validate the correctness of candidate generation after any future changes.", "confidence": 0.9}, "drafts_generated": 1, "drafts_survived": 1}
{"id": "2be991c5-ea33-4922-8e85-44fb5152b95f", "target_id": "B3-treatment", "git_sha": "d9ba74650f6fef336cec3e07a25b80e357fa7663", "pre_experiment_sha": "782c395c99ba6b12e8fb0c880d041ca415129057", "timestamp": "2026-04-23T17:20:57.553181+00:00", "hypothesis": "Optimize SymSpell candidate verification by completely bypassing string slicing for length differences of 2 (since their distance is mathematically guaranteed to be exactly 2), and streamline the `diff == 1` branch to avoid redundant slice allocations.", "hypothesis_source": "agent", "mutation_diff_summary": "", "score": 4.05, "score_ci_lower": null, "score_ci_upper": null, "raw_scores": null, "baseline_score": 4.17, "outcome": "KEPT", "failure_mode": null, "duration_seconds": 216.70000004186295, "tags": ["symspell", "optimization", "string-slicing", "algorithmic-simplification", "fast-path"], "learnings": "{\"what_changed\":\"\",\"what_improved\":[],\"what_regressed\":[],\"transferable_insight\":\"Bypassing expensive computations and memory allocations when the outcome can be mathematically guaranteed by simple input properties significantly improves algorithmic performance.\",\"domain_tags\":[\"Algorithm Optimization\",\"Performance Tuning\",\"Memory Management\"]}", "cost_usd": 0.049113750000000005, "bootstrap_seed": 0, "agent_model": "gemini-3.1-pro-preview", "held_out_score": null, "criterion_names": null, "per_criterion_scores": null, "failure_classification": null, "drafts_generated": 1, "drafts_survived": 1}
{"id": "14bdd1e4-b7f7-4de7-9825-284da8849aef", "target_id": "B3-treatment", "git_sha": "104728fe12b1fbbc2b0e069a746e3dbf70f9e323", "pre_experiment_sha": "d9ba74650f6fef336cec3e07a25b80e357fa7663", "timestamp": "2026-04-23T17:24:29.611142+00:00", "hypothesis": "Simplify length difference branching by directly comparing string lengths to avoid arithmetic operations, and streamline the distance <= 2 verification logic to eliminate redundant calculations.", "hypothesis_source": "agent", "mutation_diff_summary": "", "score": 3.99, "score_ci_lower": null, "score_ci_upper": null, "raw_scores": null, "baseline_score": 4.05, "outcome": "KEPT", "failure_mode": null, "duration_seconds": 205.46467150002718, "tags": ["symspell", "optimization", "string-slicing", "algorithmic-simplification", "fast-path"], "learnings": "{\"what_changed\":\"\",\"what_improved\":[],\"what_regressed\":[],\"transferable_insight\":\"Replacing arithmetic operations with direct comparisons and streamlining verification logic reduces redundant calculations and improves execution efficiency.\",\"domain_tags\":[\"Algorithm Optimization\",\"Performance Tuning\",\"Code Simplification\"]}", "cost_usd": 0.04918625, "bootstrap_seed": 0, "agent_model": "gemini-3.1-pro-preview", "held_out_score": null, "criterion_names": null, "per_criterion_scores": null, "failure_classification": null, "drafts_generated": 1, "drafts_survived": 1}
{"id": "00ced9a7-ca6f-46a4-87fa-f500c1df2f1a", "target_id": "B3-treatment", "git_sha": "e33adbcac79f20c755ad1a289c392bcaad171d1f", "pre_experiment_sha": "104728fe12b1fbbc2b0e069a746e3dbf70f9e323", "timestamp": "2026-04-23T17:28:40.816774+00:00", "hypothesis": "Unroll the O(1) string slicing verification into separate branches for each length difference to eliminate tuple packing, temporary variable assignments, and redundant length checks in the hot path.", "hypothesis_source": "agent", "mutation_diff_summary": "", "score": 4.18, "score_ci_lower": null, "score_ci_upper": null, "raw_scores": null, "baseline_score": 3.99, "outcome": "KEPT", "failure_mode": null, "duration_seconds": 216.5413824999705, "tags": ["symspell", "optimization", "unrolling", "string-slicing", "fast-path"], "learnings": "{\"what_changed\":\"\",\"what_improved\":[],\"what_regressed\":[],\"transferable_insight\":\"Unrolling generalized logic into explicit, specialized branches for distinct cases can improve hot-path performance by eliminating temporary allocations and redundant condition checks.\",\"domain_tags\":[\"Performance Optimization\",\"Hot Path Optimization\",\"Code Unrolling\"]}", "cost_usd": 0.05074125, "bootstrap_seed": 0, "agent_model": "gemini-3.1-pro-preview", "held_out_score": null, "criterion_names": null, "per_criterion_scores": null, "failure_classification": null, "drafts_generated": 1, "drafts_survived": 1}
{"id": "101262d5-9821-4f58-b982-e9d965a352b3", "target_id": "B3-treatment", "git_sha": "e33adbcac79f20c755ad1a289c392bcaad171d1f", "pre_experiment_sha": "e33adbcac79f20c755ad1a289c392bcaad171d1f", "timestamp": "2026-04-23T17:33:06.386364+00:00", "hypothesis": "Flatten the length difference branching by using a single `diff = la - lb` calculation to reduce conditional overhead, and replace the `map`/`filter` overhead in candidate generation with a fast, direct `for` loop.", "hypothesis_source": "agent", "mutation_diff_summary": "", "score": 4.31, "score_ci_lower": null, "score_ci_upper": null, "raw_scores": null, "baseline_score": 4.18, "outcome": "DISCARDED", "failure_mode": null, "duration_seconds": 258.1506072920747, "tags": ["symspell", "optimization", "unrolling", "string-slicing", "fast-path"], "learnings": "{\"what_changed\":\"\",\"what_improved\":[],\"what_regressed\":[],\"transferable_insight\":\"Manual micro-optimizations, such as replacing declarative array methods with direct loops or flattening conditional branches, often fail to yield performance gains and can degrade execution speed by interfering with modern compiler optimizations.\",\"domain_tags\":[\"Performance Optimization\",\"Compiler Heuristics\",\"Code Refactoring\"]}", "cost_usd": 0.05091700000000001, "bootstrap_seed": 0, "agent_model": "gemini-3.1-pro-preview", "held_out_score": null, "criterion_names": null, "per_criterion_scores": null, "failure_classification": {"category": "regression", "description": "The experiment aimed to optimize performance by simplifying length difference calculations and replacing high-level functions with direct loops. However, it resulted in a failed score (4.3100), indicating a degradation in performance, correctness, or both, compared to the previously established baseline. The proposed optimizations likely either introduced a subtle bug or were counterproductive to the overall efficiency.", "fix_direction": "First, verify the correctness of the simplified calculations and direct loop logic by comparing their outputs against the original, unoptimized code using a comprehensive test suite. Second, use profiling tools to accurately measure the performance impact of each individual optimization to identify whether the changes indeed reduced overhead or inadvertently increased it. It may be beneficial to revert one change at a time to isolate the specific component causing the regression.", "confidence": 0.9}, "drafts_generated": 1, "drafts_survived": 1}
{"id": "019f7a21-173a-448f-a3c5-49d14fff0a22", "target_id": "B3-treatment", "git_sha": "e33adbcac79f20c755ad1a289c392bcaad171d1f", "pre_experiment_sha": "e33adbcac79f20c755ad1a289c392bcaad171d1f", "timestamp": "2026-04-23T17:36:39.609479+00:00", "hypothesis": "Optimize the SymSpell candidate merging by replacing `filter/map` with a direct loop to reduce generator overhead, and remove mathematically redundant `else` loop fallbacks in the equal-length fast-path to streamline execution.", "hypothesis_source": "agent", "mutation_diff_summary": "", "score": 4.54, "score_ci_lower": null, "score_ci_upper": null, "raw_scores": null, "baseline_score": 4.18, "outcome": "DISCARDED", "failure_mode": null, "duration_seconds": 194.27625554194674, "tags": ["symspell", "optimization", "unrolling", "string-slicing", "fast-path"], "learnings": "{\"what_changed\":\"\",\"what_improved\":[],\"what_regressed\":[],\"transferable_insight\":\"Manually replacing functional constructs with imperative loops to reduce perceived overhead can degrade performance, as modern compilers often optimize standard functional patterns more effectively than manual implementations.\",\"domain_tags\":[\"Performance Optimization\",\"Compiler Optimization\",\"Code Refactoring\"]}", "cost_usd": 0.05101915, "bootstrap_seed": 0, "agent_model": "gemini-3.1-pro-preview", "held_out_score": null, "criterion_names": null, "per_criterion_scores": null, "failure_classification": {"category": "logic_error", "description": "The attempted optimizations, specifically replacing `filter/map` or removing `else` fallbacks, introduced an error in the algorithm's correctness or unexpectedly degraded performance due to flawed assumptions. The reasoning about generator overhead reduction or the mathematical redundancy of the `else` branches was likely incorrect, leading to the observed failure (score 4.5400) without a clear error message (unknown failure mode). This suggests a subtle correctness bug or an incorrect performance assumption rather than a crash.", "fix_direction": "Carefully re-evaluate the mathematical redundancy of the `else` fallbacks, potentially with rigorous proof or additional test cases. Conduct detailed profiling to objectively measure the performance impact of replacing `filter/map` with a direct loop, verifying if generator overhead was indeed the bottleneck and if the new loop is more efficient without compromising correctness. Add comprehensive unit tests and assertions to validate the algorithm's behavior at each optimization step.", "confidence": 0.9}, "drafts_generated": 1, "drafts_survived": 1}
{"id": "6d9ea170-f5cf-4030-bd4e-3feb218bf922", "target_id": "B3-treatment", "git_sha": "e33adbcac79f20c755ad1a289c392bcaad171d1f", "pre_experiment_sha": "e33adbcac79f20c755ad1a289c392bcaad171d1f", "timestamp": "2026-04-23T17:40:56.607613+00:00", "hypothesis": "Flatten nested length difference branches to reduce conditional depth, and remove mathematically redundant `else` loop fallbacks in the equal-length fast-path since `a != b` guarantees early termination.", "hypothesis_source": "agent", "mutation_diff_summary": "", "score": 4.28, "score_ci_lower": null, "score_ci_upper": null, "raw_scores": null, "baseline_score": 4.18, "outcome": "DISCARDED", "failure_mode": null, "duration_seconds": 207.691133875167, "tags": ["symspell", "optimization", "algorithmic-simplification", "fast-path", "unrolling"], "learnings": "{\"what_changed\":\"\",\"what_improved\":[],\"what_regressed\":[],\"transferable_insight\":\"Removing seemingly redundant fallback paths and flattening conditionals based on theoretical early-termination guarantees can be counterproductive, as these structures often handle hidden edge cases or align better with underlying system optimizations.\",\"domain_tags\":[\"Control Flow\",\"Code Optimization\",\"Branching\"]}", "cost_usd": 0.050655200000000004, "bootstrap_seed": 0, "agent_model": "gemini-3.1-pro-preview", "held_out_score": null, "criterion_names": null, "per_criterion_scores": null, "failure_classification": {"category": "logic_error", "description": "The experiment failed likely because the logical assumptions or deductions made in the hypothesis were incorrect. Specifically, the 'mathematically redundant' else fallbacks might not have been truly redundant in all cases, or the 'flattening' of nested branches introduced incorrect control flow, leading to faulty behavior and a degraded score.", "fix_direction": "Re-evaluate the mathematical and control flow logic underlying the proposed changes. Thoroughly review the conditions under which 'a != b' guarantees early termination and ensure the flattened branches correctly handle all previous states and edge cases.", "confidence": 0.9}, "drafts_generated": 1, "drafts_survived": 1}
{"id": "ffb1aea1-f5bd-4626-b96a-3262fe7b1712", "target_id": "B3-treatment", "git_sha": "40be8d6c930d980208fa817ec9d6053294441e20", "pre_experiment_sha": "e33adbcac79f20c755ad1a289c392bcaad171d1f", "timestamp": "2026-04-23T17:43:51.973070+00:00", "hypothesis": "Replace `filter` and `map` in candidate generation with a strict `for` loop to comply with the rules and eliminate generator overhead, and inline temporary slice variables in the string verification fast-paths to reduce bytecode instructions and local assignments.", "hypothesis_source": "agent", "mutation_diff_summary": "", "score": 4.24, "score_ci_lower": null, "score_ci_upper": null, "raw_scores": null, "baseline_score": 4.18, "outcome": "KEPT", "failure_mode": null, "duration_seconds": 150.45520549989305, "tags": ["symspell", "optimization", "unrolling", "string-slicing", "fast-path"], "learnings": "{\"what_changed\":\"\",\"what_improved\":[],\"what_regressed\":[],\"transferable_insight\":\"Replacing higher-order functional iteration constructs with imperative loops and inlining temporary variables reduces execution overhead and improves performance in critical code paths.\",\"domain_tags\":[\"Performance Optimization\",\"Code Refactoring\",\"Execution Overhead\"]}", "cost_usd": 0.05101000000000001, "bootstrap_seed": 0, "agent_model": "gemini-3.1-pro-preview", "held_out_score": null, "criterion_names": null, "per_criterion_scores": null, "failure_classification": null, "drafts_generated": 1, "drafts_survived": 1}
{"id": "4629eb84-dd42-4d56-af1f-39c2fa4c50b2", "target_id": "B3-treatment", "git_sha": "b46cec11fad5bd3abf312c5a522c6ab27934d3c2", "pre_experiment_sha": "40be8d6c930d980208fa817ec9d6053294441e20", "timestamp": "2026-04-23T17:47:56.419400+00:00", "hypothesis": "Safely remove mathematically dead `else` blocks in the equal-length string verification fast-path to reduce bytecode overhead, and alias `a_cands.remove` to eliminate method lookup overhead in the candidate loop.", "hypothesis_source": "agent", "mutation_diff_summary": "", "score": 4.22, "score_ci_lower": null, "score_ci_upper": null, "raw_scores": null, "baseline_score": 4.24, "outcome": "KEPT", "failure_mode": null, "duration_seconds": 237.85958624980412, "tags": ["symspell", "optimization", "dead-code-elimination", "fast-path"], "learnings": "{\"what_changed\":\"\",\"what_improved\":[],\"what_regressed\":[],\"transferable_insight\":\"Eliminating unreachable code paths and caching frequently accessed method references within tight loops reduces execution overhead and improves overall performance.\",\"domain_tags\":[\"Performance Optimization\",\"Code Refactoring\",\"Execution Efficiency\"]}", "cost_usd": 0.05125375000000001, "bootstrap_seed": 0, "agent_model": "gemini-3.1-pro-preview", "held_out_score": null, "criterion_names": null, "per_criterion_scores": null, "failure_classification": null, "drafts_generated": 1, "drafts_survived": 1}
