{"id": "2289f192-bc97-4539-86be-130e1c730967", "target_id": "B3-treatment", "git_sha": "1f7db35c2cf681ce0b4aa2b8c62a3bb389edfc8f", "pre_experiment_sha": "716cb3f1ba9119cacb42167961223f8229b1db63", "timestamp": "2026-04-22T19:07:12.153090+00:00", "hypothesis": "Optimize the inner dynamic programming loop to eliminate variable assignments and extend hardcoded fast-paths for string lengths up to 8 to avoid DP overhead for almost all remaining string pairs.", "hypothesis_source": "agent", "mutation_diff_summary": "", "score": 14.73, "score_ci_lower": null, "score_ci_upper": null, "raw_scores": null, "baseline_score": 44.11, "outcome": "KEPT", "failure_mode": null, "duration_seconds": 220.4220113339834, "tags": ["algorithm", "dynamic programming", "fast-path", "string matching"], "learnings": "{\"what_changed\":\"\",\"what_improved\":[],\"what_regressed\":[],\"transferable_insight\":\"Implementing hardcoded fast-paths for small, frequent input sizes and eliminating redundant variable assignments in inner loops effectively bypasses heavy algorithmic overhead and improves overall performance.\",\"domain_tags\":[\"Performance Optimization\",\"Algorithm Design\",\"Code Refactoring\"]}", "cost_usd": 0.07262625, "bootstrap_seed": 0, "agent_model": "gemini-3.1-pro-preview", "held_out_score": null, "criterion_names": null, "per_criterion_scores": null, "failure_classification": null, "drafts_generated": 1, "drafts_survived": 1}
{"id": "4822aaf5-d16a-41f2-b367-d7df22c158fa", "target_id": "B3-treatment", "git_sha": "48426277446e4f5493101c8be95f082dab6d1795", "pre_experiment_sha": "1f7db35c2cf681ce0b4aa2b8c62a3bb389edfc8f", "timestamp": "2026-04-22T19:11:19.306748+00:00", "hypothesis": "Splitting the `threshold == 2` logic into its own dedicated loop avoids repeated conditional checks, while hoisting length comparisons and optimizing the deduplication step further reduces overhead.", "hypothesis_source": "agent", "mutation_diff_summary": "", "score": 14.53, "score_ci_lower": null, "score_ci_upper": null, "raw_scores": null, "baseline_score": 14.73, "outcome": "KEPT", "failure_mode": null, "duration_seconds": 218.7528658329975, "tags": ["fast-path", "loop-unrolling", "inlining"], "learnings": "{\"what_changed\":\"\",\"what_improved\":[],\"what_regressed\":[],\"transferable_insight\":\"Isolating specific conditional logic into dedicated execution paths and hoisting invariant checks outside of repetitive processes minimizes redundant evaluations and reduces overall overhead.\",\"domain_tags\":[\"Performance Optimization\",\"Loop Optimization\",\"Code Refactoring\"]}", "cost_usd": 0.08013875, "bootstrap_seed": 0, "agent_model": "gemini-3.1-pro-preview", "held_out_score": null, "criterion_names": null, "per_criterion_scores": null, "failure_classification": null, "drafts_generated": 1, "drafts_survived": 1}
{"id": "823241e0-8c17-4ba1-8315-527b8ea52150", "target_id": "B3-treatment", "git_sha": "3eded9e0e3a184f478158e7d66e92488d5c1a11d", "pre_experiment_sha": "48426277446e4f5493101c8be95f082dab6d1795", "timestamp": "2026-04-22T19:15:46.789085+00:00", "hypothesis": "Unroll the length difference loop, replace the suffix trimming with negative indexing to eliminate inner-loop decrement operations, and completely replace the dynamic programming and hardcoded fast-paths for `threshold == 2` with O(1) string slice comparisons based on exact insertion/substitution patterns.", "hypothesis_source": "agent", "mutation_diff_summary": "", "score": 13.37, "score_ci_lower": null, "score_ci_upper": null, "raw_scores": null, "baseline_score": 14.53, "outcome": "KEPT", "failure_mode": null, "duration_seconds": 254.89716770895757, "tags": ["unrolling", "negative-indexing", "string-slicing", "algorithmic-simplification", "fast-path"], "learnings": "{\"what_changed\":\"\",\"what_improved\":[],\"what_regressed\":[],\"transferable_insight\":\"Replacing generalized iterative algorithms with constant-time pattern matching and unrolled operations for bounded thresholds eliminates loop overhead and accelerates execution.\",\"domain_tags\":[\"Algorithm Optimization\",\"Performance Tuning\",\"String Processing\"]}", "cost_usd": 0.05679125, "bootstrap_seed": 0, "agent_model": "gemini-3.1-pro-preview", "held_out_score": null, "criterion_names": null, "per_criterion_scores": null, "failure_classification": null, "drafts_generated": 1, "drafts_survived": 1}
{"id": "3a04a0a4-cc30-4d4a-baac-82f75533cac5", "target_id": "B3-treatment", "git_sha": "373decdf0ca01836c16f7d1351c1392c978760de", "pre_experiment_sha": "3eded9e0e3a184f478158e7d66e92488d5c1a11d", "timestamp": "2026-04-22T19:20:28.578837+00:00", "hypothesis": "Implement O(1) unrolled fast-paths using index offsets for remaining string lengths up to 8 to eliminate slice copy overhead, and merge variable assignments in the inner DP loop.", "hypothesis_source": "agent", "mutation_diff_summary": "", "score": 10.95, "score_ci_lower": null, "score_ci_upper": null, "raw_scores": null, "baseline_score": 13.37, "outcome": "KEPT", "failure_mode": null, "duration_seconds": 274.4558032499626, "tags": ["unroll", "fast-path", "string-slicing", "dp-optimization"], "learnings": "{\"what_changed\":\"\",\"what_improved\":[],\"what_regressed\":[],\"transferable_insight\":\"Replacing memory-intensive operations with unrolled, index-based fast paths for small inputs and consolidating variable assignments in tight loops significantly reduces execution overhead.\",\"domain_tags\":[\"Performance Optimization\",\"Loop Optimization\",\"Memory Management\"]}", "cost_usd": 0.09734000000000001, "bootstrap_seed": 0, "agent_model": "gemini-3.1-pro-preview", "held_out_score": null, "criterion_names": null, "per_criterion_scores": null, "failure_classification": null, "drafts_generated": 1, "drafts_survived": 1}
{"id": "433aa7ed-cc6f-444b-ac8a-e328cf678bb7", "target_id": "B3-treatment", "git_sha": "373decdf0ca01836c16f7d1351c1392c978760de", "pre_experiment_sha": "373decdf0ca01836c16f7d1351c1392c978760de", "timestamp": "2026-04-22T19:25:41.068870+00:00", "hypothesis": "Replace the dynamic programming and hardcoded fast-paths for `threshold == 2` with O(1) string slice comparisons based on exact insertion/substitution patterns, and implement fully unrolled O(1) DP fast-paths without slice copies for remaining string lengths up to 8 for other thresholds.", "hypothesis_source": "agent", "mutation_diff_summary": "", "score": 13.39, "score_ci_lower": null, "score_ci_upper": null, "raw_scores": null, "baseline_score": 10.95, "outcome": "DISCARDED", "failure_mode": null, "duration_seconds": 287.4421018329449, "tags": ["string-matching", "loop-unrolling", "algorithmic-simplification", "dynamic-programming", "zero-copy"], "learnings": "{\"what_changed\":\"\",\"what_improved\":[],\"what_regressed\":[],\"transferable_insight\":\"Replacing algorithmic loops with fully unrolled, hardcoded exact pattern matches for small inputs can degrade performance, likely due to excessive branching and instruction cache overhead outweighing theoretical time complexity gains.\",\"domain_tags\":[\"Performance Engineering\",\"Algorithm Optimization\",\"Code Unrolling\"]}", "cost_usd": 0.08706550000000002, "bootstrap_seed": 0, "agent_model": "gemini-3.1-pro-preview", "held_out_score": null, "criterion_names": null, "per_criterion_scores": null, "failure_classification": {"category": "logic_error", "description": "The new O(1) string slice comparisons for `threshold == 2` or the fully unrolled O(1) DP fast-paths for string lengths up to 8 likely contained incorrect reasoning or calculations. This could have led to incorrect results for specific inputs, or introduced unforeseen overheads or incorrect branching that negated the intended O(1) performance gain, resulting in a failed experiment with the observed score.", "fix_direction": "Thoroughly review the logic and implementation of the O(1) string slice comparisons, ensuring they correctly identify all intended exact insertion/substitution patterns without false positives or negatives. For the unrolled DP fast-paths, meticulously verify the state transitions, boundary conditions, and hardcoded computations for all relevant string lengths and thresholds. Add comprehensive unit tests specifically for these new fast-paths, comparing their outputs against a known correct (e.g., original DP) implementation across a wide range of inputs and edge cases.", "confidence": 0.9}, "drafts_generated": 1, "drafts_survived": 1}
{"id": "dad308e2-8b6e-4c48-8b72-1a6346c82607", "target_id": "B3-treatment", "git_sha": "373decdf0ca01836c16f7d1351c1392c978760de", "pre_experiment_sha": "373decdf0ca01836c16f7d1351c1392c978760de", "timestamp": "2026-04-22T19:30:08.803902+00:00", "hypothesis": "Optimize the `threshold == 2` fast-paths by replacing the manual difference checks and unrolled character comparisons with O(1) string slice comparisons based on exact insertion/substitution patterns, and unroll the DP inner loop for remaining string lengths up to 8 in the fallback path to eliminate slice copy and DP overhead.", "hypothesis_source": "agent", "mutation_diff_summary": "", "score": 13.4, "score_ci_lower": null, "score_ci_upper": null, "raw_scores": null, "baseline_score": 10.95, "outcome": "DISCARDED", "failure_mode": null, "duration_seconds": 240.28493254096247, "tags": ["fast-path", "unrolling", "slicing", "DP-optimization"], "learnings": "{\"what_changed\":\"\",\"what_improved\":[],\"what_regressed\":[],\"transferable_insight\":\"Replacing simple, manual element comparisons with higher-level slice operations and aggressive loop unrolling for small inputs can degrade performance due to hidden abstraction and instruction overheads.\",\"domain_tags\":[\"Performance Tuning\",\"Algorithm Optimization\",\"Low-level Optimization\"]}", "cost_usd": 0.08976310000000001, "bootstrap_seed": 0, "agent_model": "gemini-3.1-pro-preview", "held_out_score": null, "criterion_names": null, "per_criterion_scores": null, "failure_classification": {"category": "logic_error", "description": "The proposed optimization strategy, involving O(1) string slice comparisons based on specific patterns and unrolling the DP inner loop, failed to improve performance (and likely degraded it, given the 'failed experiment' context and score). This suggests that the underlying assumptions about the efficiency of these new methods, or their specific implementation details, were incorrect or introduced unforeseen overhead for the target `threshold == 2` and string lengths. The 'O(1)' assumption might not hold true in practice for the given context, or the pattern matching logic might be flawed, leading to a slower or incorrect path that resulted in the given score.", "fix_direction": "Re-evaluate the performance characteristics and correctness of the O(1) string slice comparisons and the unrolled DP for the specific problem context (`threshold == 2` and short string lengths). Profile the new code paths to identify bottlenecks and quantify the actual overhead introduced. Verify the correctness of the 'exact insertion/substitution patterns' and DP logic. It might be that the original manual checks were more efficient or had lower constant factors for the target scenario, or the new approach has hidden costs that were not accounted for in the hypothesis.", "confidence": 0.9}, "drafts_generated": 1, "drafts_survived": 1}
{"id": "35721b15-e9e0-4550-b140-51260db71d6a", "target_id": "B3-treatment", "git_sha": "373decdf0ca01836c16f7d1351c1392c978760de", "pre_experiment_sha": "373decdf0ca01836c16f7d1351c1392c978760de", "timestamp": "2026-04-22T19:34:27.007662+00:00", "hypothesis": "Replace the unrolled fast-paths for `threshold == 2` with O(1) string slice comparisons based on exact insertion/substitution patterns, and implement O(1) unrolled fast-paths using index offsets for remaining string lengths up to 8 in the generic DP branch to eliminate slice copy overhead.", "hypothesis_source": "agent", "mutation_diff_summary": "", "score": 11.38, "score_ci_lower": null, "score_ci_upper": null, "raw_scores": null, "baseline_score": 10.95, "outcome": "DISCARDED", "failure_mode": null, "duration_seconds": 232.8715723331552, "tags": ["string-slicing", "unrolled-loop", "fast-path", "dynamic-programming"], "learnings": "{\"what_changed\":\"\",\"what_improved\":[],\"what_regressed\":[],\"transferable_insight\":\"Introducing highly specific, unrolled fast-paths for small input sizes can degrade overall performance by adding branch evaluation overhead that outweighs the savings from reduced memory operations.\",\"domain_tags\":[\"Performance Optimization\",\"Algorithm Design\",\"Code Complexity\"]}", "cost_usd": 0.069744, "bootstrap_seed": 0, "agent_model": "gemini-3.1-pro-preview", "held_out_score": null, "criterion_names": null, "per_criterion_scores": null, "failure_classification": {"category": "logic_error", "description": "The implementation of O(1) string slice comparisons for exact insertion/substitution patterns or the O(1) unrolled fast-paths using index offsets likely contained logical flaws. These flaws caused the edit distance calculation to be incorrect for some inputs, leading to the observed non-zero score (presumably indicating errors or reduced accuracy). The 'unknown' failure mode suggests that the specific problematic cases or the precise nature of the logical defect were not easily identified during the experiment run.", "fix_direction": "Conduct a thorough review of the O(1) logic, focusing on edge cases, boundary conditions, and the precise definitions of 'exact insertion/substitution patterns.' Implement comprehensive unit tests with known correct edit distance values, especially for string lengths up to 8 and cases where the threshold is 2, to pinpoint where the new O(1) paths deviate from expected behavior. Debug by logging intermediate states or the specific patterns/offsets being evaluated.", "confidence": 0.9}, "drafts_generated": 1, "drafts_survived": 1}
{"id": "30d48aa7-55ec-44be-b7ab-2dcd3e6ca1b2", "target_id": "B3-treatment", "git_sha": "b4dc80e9c36a774d645e40b18b78695556673939", "pre_experiment_sha": "373decdf0ca01836c16f7d1351c1392c978760de", "timestamp": "2026-04-22T19:38:49.576369+00:00", "hypothesis": "Replace the hardcoded unrolled fast-paths for `threshold == 2` with O(1) string slice comparisons that exactly match all valid insertion/substitution patterns, drastically reducing bytecode size and branch evaluation overhead.", "hypothesis_source": "agent", "mutation_diff_summary": "", "score": 11.67, "score_ci_lower": null, "score_ci_upper": null, "raw_scores": null, "baseline_score": 10.95, "outcome": "KEPT", "failure_mode": null, "duration_seconds": 216.29464333318174, "tags": ["string-matching", "fast-path", "dynamic-programming", "slicing", "exact-match"], "learnings": "{\"what_changed\":\"\",\"what_improved\":[],\"what_regressed\":[],\"transferable_insight\":\"Replacing complex, unrolled branching logic with constant-time exact pattern matching reduces evaluation overhead and code footprint, leading to better performance.\",\"domain_tags\":[\"Algorithm Optimization\",\"Performance Tuning\",\"Code Optimization\"]}", "cost_usd": 0.060783750000000004, "bootstrap_seed": 0, "agent_model": "gemini-3.1-pro-preview", "held_out_score": null, "criterion_names": null, "per_criterion_scores": null, "failure_classification": null, "drafts_generated": 1, "drafts_survived": 1}
{"id": "c93e627c-2694-4610-ab93-21c714e9b499", "target_id": "B3-treatment", "git_sha": "b4dc80e9c36a774d645e40b18b78695556673939", "pre_experiment_sha": "b4dc80e9c36a774d645e40b18b78695556673939", "timestamp": "2026-04-22T19:43:19.459220+00:00", "hypothesis": "Group strings from `list_a` by length to hoist dictionary lookups for `b_list` out of the inner loop, saving thousands of redundant lookups, and micro-optimize the threshold fast-paths by skipping unnecessary subtractions and reusing tuples during deduplication.", "hypothesis_source": "agent", "mutation_diff_summary": "", "score": 11.74, "score_ci_lower": null, "score_ci_upper": null, "raw_scores": null, "baseline_score": 11.67, "outcome": "DISCARDED", "failure_mode": null, "duration_seconds": 260.5376042500138, "tags": ["algorithm-optimization", "data-structures", "loop-hoisting", "micro-optimization"], "learnings": "{\"what_changed\":\"\",\"what_improved\":[],\"what_regressed\":[],\"transferable_insight\":\"Introducing pre-processing steps like grouping to hoist operations out of inner loops can create structural overhead that outweighs the intended performance gains.\",\"domain_tags\":[\"Performance Optimization\",\"Algorithm Design\",\"Code Refactoring\"]}", "cost_usd": 0.05722025, "bootstrap_seed": 0, "agent_model": "gemini-3.1-pro-preview", "held_out_score": null, "criterion_names": null, "per_criterion_scores": null, "failure_classification": {"category": "logic_error", "description": "The optimization strategy described in the hypothesis (grouping strings by length, hoisting dictionary lookups, and micro-optimizations) contained a logical flaw in its implementation or assumptions. This likely resulted in the changes failing to achieve the expected performance gains, or even introducing new overhead that led to a degradation in performance (a regression). The 'unknown' failure mode suggests the code ran but produced an unacceptable score, indicating the intended logical improvements did not materialize or were counterproductive.", "fix_direction": "Thoroughly profile the proposed changes to identify the exact parts that did not yield the expected benefits or introduced unexpected overhead. Evaluate the initial assumption that grouping by length saves more time than it costs. Verify that the 'thousands of redundant lookups' are indeed avoided and that the 'micro-optimizations' are effective and not detrimental to overall performance or cache utilization. Focus on identifying the specific logical flaw in the optimization strategy that led to the failed score.", "confidence": 0.9}, "drafts_generated": 1, "drafts_survived": 1}
{"id": "a115d262-e90b-4415-96d8-10f5cee1dee6", "target_id": "B3-treatment", "git_sha": "b4dc80e9c36a774d645e40b18b78695556673939", "pre_experiment_sha": "b4dc80e9c36a774d645e40b18b78695556673939", "timestamp": "2026-04-22T19:47:37.784587+00:00", "hypothesis": "Optimize variable hoisting in the threshold=2 loops to avoid redundant length calculations, and eliminate tuple reallocation overhead in _deduplicate_pairs by reusing the existing tuple objects.", "hypothesis_source": "agent", "mutation_diff_summary": "", "score": 12.2, "score_ci_lower": null, "score_ci_upper": null, "raw_scores": null, "baseline_score": 11.67, "outcome": "DISCARDED", "failure_mode": null, "duration_seconds": 226.8967644169461, "tags": ["dictionary-optimization", "unrolling", "deduplication-optimization"], "learnings": "{\"what_changed\":\"\",\"what_improved\":[],\"what_regressed\":[],\"transferable_insight\":\"Manual micro-optimizations, such as variable hoisting and object reuse, often fail to yield measurable performance benefits because modern compilers and interpreters already handle these operations highly efficiently.\",\"domain_tags\":[\"Performance Optimization\",\"Software Engineering\",\"Resource Management\"]}", "cost_usd": 0.05574830000000001, "bootstrap_seed": 0, "agent_model": "gemini-3.1-pro-preview", "held_out_score": null, "criterion_names": null, "per_criterion_scores": null, "failure_classification": {"category": "over_optimization", "description": "The experiment attempted micro-optimizations such as variable hoisting and tuple object reuse. While conceptually aimed at reducing overhead, such low-level changes can sometimes lead to unforeseen performance regressions (e.g., increased instruction count, cache misses, or interference with existing compiler/runtime optimizations) rather than improvements, effectively \"over-optimizing\" to the detriment of overall performance. The 'unknown' failure mode suggests no explicit crash or functional error, but rather a failure to improve, or degradation, measured by the score.", "fix_direction": "Re-evaluate the actual performance bottlenecks using robust profiling tools. Analyze the generated machine code (if applicable) to understand how the proposed changes affect instruction count and cache usage. Consider if the attempted optimizations are truly necessary or if the existing compiler/runtime is already handling these aspects efficiently, potentially making manual 'optimizations' counterproductive. Focus on high-level algorithmic improvements or structural changes if micro-optimizations prove detrimental.", "confidence": 0.9}, "drafts_generated": 1, "drafts_survived": 1}
