{"id": "0d437e64-ebfb-4aca-b81c-2b1bb0e49558", "target_id": "B3-treatment", "git_sha": "d8f35925f276de9c90b8aed1d716e0733acbf1b6", "pre_experiment_sha": "d8f35925f276de9c90b8aed1d716e0733acbf1b6", "timestamp": "2026-04-18T23:51:55.114241+00:00", "hypothesis": "Cache candidate lengths and remove redundant per-bucket tuple allocations while keeping exact matching behavior.", "hypothesis_source": "agent", "mutation_diff_summary": "", "score": 92.95, "score_ci_lower": null, "score_ci_upper": null, "raw_scores": null, "baseline_score": 90.66, "outcome": "DISCARDED", "failure_mode": null, "duration_seconds": 29.007959208916873, "tags": ["length-caching", "allocation-reduction", "hot-loop"], "learnings": "{\"what_changed\":\"\",\"what_improved\":[],\"what_regressed\":[],\"transferable_insight\":\"Optimizations that reduce allocation overhead without changing core logic can still be discarded if they add complexity without producing measurable gains.\",\"domain_tags\":[\"performance-optimization\",\"software-engineering\"]}", "cost_usd": 0.0853276, "bootstrap_seed": 0, "agent_model": "gpt-5.4", "held_out_score": null, "criterion_names": null, "per_criterion_scores": null, "failure_classification": {"category": "logic_error", "description": "The experiment failed with an unspecified failure mode (\u201cunknown\u201d), so the nature of the incorrect behavior or deviation (format, logic, regression, scope, syntax, semantic meaning, evaluation gaming, or partial edits) cannot be determined from the provided information.", "fix_direction": "Re-run with additional instrumentation to capture the specific failing assertion/error (e.g., diff of expected vs actual behavior, failing test names, and any stack traces). Then verify that changes still preserve exact matching semantics and that cache length logic doesn\u2019t affect bucket traversal or tuple identity/allocation behavior.", "confidence": 0.12}, "drafts_generated": 1, "drafts_survived": 1}
{"id": "b624e6e5-3c6d-44e5-8139-962692c44bb6", "target_id": "B3-treatment", "git_sha": "d8f35925f276de9c90b8aed1d716e0733acbf1b6", "pre_experiment_sha": "d8f35925f276de9c90b8aed1d716e0733acbf1b6", "timestamp": "2026-04-18T23:52:34.713056+00:00", "hypothesis": "Cache bucket strings without redundant length tuples and reuse local appends to reduce hot-path allocations and lookups.", "hypothesis_source": "agent", "mutation_diff_summary": "", "score": 92.29, "score_ci_lower": null, "score_ci_upper": null, "raw_scores": null, "baseline_score": 90.66, "outcome": "DISCARDED", "failure_mode": null, "duration_seconds": 30.314606167026795, "tags": ["runtime", "allocation", "caching", "safe-local"], "learnings": "{\"what_changed\":\"\",\"what_improved\":[],\"what_regressed\":[],\"transferable_insight\":\"Optimizations that simplify data handling and reduce repeated work should be validated against real workloads, because even plausible hot-path changes may yield no measurable improvement.\",\"domain_tags\":[\"performance-optimization\",\"benchmarking\",\"software-engineering\"]}", "cost_usd": 0.08651980000000001, "bootstrap_seed": 0, "agent_model": "gpt-5.4", "held_out_score": null, "criterion_names": null, "per_criterion_scores": null, "failure_classification": {"category": "semantic_drift", "description": "The attempted optimization to cache bucket strings and reuse local appends likely preserved output formatting but altered the meaning/behavior on some paths (e.g., incorrect bucket/string identity or lifetime, missing/extra allocations affecting expected lookup semantics), leading to an unexpected failure despite strong metric score.", "fix_direction": "Focus on validating functional equivalence: ensure cached string keys and reused append buffers preserve correctness across all lifetimes and concurrency paths; add targeted tests for bucket key construction, lookup correctness, and edge cases that exercise the hot path.", "confidence": 0.62}, "drafts_generated": 1, "drafts_survived": 1}
{"id": "a7b93a05-8022-40f7-a2d4-a615afdf0d71", "target_id": "B3-treatment", "git_sha": "20f453c43bf2559c091c0808897b46cee9652d8b", "pre_experiment_sha": "d8f35925f276de9c90b8aed1d716e0733acbf1b6", "timestamp": "2026-04-18T23:53:05.458582+00:00", "hypothesis": "Cache candidate lengths directly in grouped buckets and simplify the bounded Levenshtein setup to reduce hot-path allocations and indexing.", "hypothesis_source": "agent", "mutation_diff_summary": "", "score": 90.84, "score_ci_lower": null, "score_ci_upper": null, "raw_scores": null, "baseline_score": 90.66, "outcome": "KEPT", "failure_mode": null, "duration_seconds": 28.081246666028164, "tags": ["length-caching", "inner-loop", "allocation-reduction", "safe"], "learnings": "{\"what_changed\":\"\",\"what_improved\":[],\"what_regressed\":[],\"transferable_insight\":\"Precomputing and grouping frequently reused values can simplify critical-path logic and reduce overhead without changing outcomes.\",\"domain_tags\":[\"performance-optimization\",\"data-structures\",\"software-engineering\"]}", "cost_usd": 0.08497500000000001, "bootstrap_seed": 0, "agent_model": "gpt-5.4", "held_out_score": null, "criterion_names": null, "per_criterion_scores": null, "failure_classification": null, "drafts_generated": 1, "drafts_survived": 1}
{"id": "6771c669-d9ab-4a3a-b905-6bfb925f4b9f", "target_id": "B3-treatment", "git_sha": "20f453c43bf2559c091c0808897b46cee9652d8b", "pre_experiment_sha": "20f453c43bf2559c091c0808897b46cee9652d8b", "timestamp": "2026-04-18T23:53:33.418464+00:00", "hypothesis": "Cache string lengths alongside grouped candidates to avoid repeated len calls in the hot comparison loop.", "hypothesis_source": "agent", "mutation_diff_summary": "", "score": 91.31, "score_ci_lower": null, "score_ci_upper": null, "raw_scores": null, "baseline_score": 90.84, "outcome": "DISCARDED", "failure_mode": null, "duration_seconds": 27.06071970902849, "tags": ["length-caching", "hot-path", "safe-incremental"], "learnings": "{\"what_changed\":\"\",\"what_improved\":[],\"what_regressed\":[],\"transferable_insight\":\"Caching frequently reused derived values can reduce repeated work in tight loops, but only if the added bookkeeping does not outweigh the savings.\",\"domain_tags\":[\"optimization\",\"performance\",\"software-engineering\"]}", "cost_usd": 0.0850362, "bootstrap_seed": 0, "agent_model": "gpt-5.4", "held_out_score": null, "criterion_names": null, "per_criterion_scores": null, "failure_classification": {"category": "logic_error", "description": "The attempt to cache string lengths alongside grouped candidates did not achieve the intended correctness/performance behavior; the failure mode is unspecified (\u201cunknown\u201d), suggesting the change likely broke or invalidated the hot comparison logic rather than failing to parse or follow output requirements.", "fix_direction": "Verify the comparison logic end-to-end with cached lengths (ensure caches stay consistent with candidate strings, handle edge cases like empty strings and encoding/normalization, and add targeted tests/benchmarks to confirm correctness under all candidate-grouping paths).", "confidence": 0.52}, "drafts_generated": 1, "drafts_survived": 1}
{"id": "29ee51ea-d580-4515-968b-22df3eddfd71", "target_id": "B3-treatment", "git_sha": "20f453c43bf2559c091c0808897b46cee9652d8b", "pre_experiment_sha": "20f453c43bf2559c091c0808897b46cee9652d8b", "timestamp": "2026-04-18T23:54:10.263653+00:00", "hypothesis": "Cache candidate string lengths alongside existing buckets to avoid repeated len calls in the hot comparison loop.", "hypothesis_source": "agent", "mutation_diff_summary": "", "score": 91.94, "score_ci_lower": null, "score_ci_upper": null, "raw_scores": null, "baseline_score": 90.84, "outcome": "DISCARDED", "failure_mode": null, "duration_seconds": 30.87317191704642, "tags": ["length-caching", "hot-path", "safe-incremental"], "learnings": "{\"what_changed\":\"\",\"what_improved\":[],\"what_regressed\":[],\"transferable_insight\":\"Micro-optimizations that reduce repeated work in a hot path should be validated against actual overhead, because added bookkeeping can cancel out the intended gain.\",\"domain_tags\":[\"performance-optimization\",\"profiling\",\"software-engineering\"]}", "cost_usd": 0.085915, "bootstrap_seed": 0, "agent_model": "gpt-5.4", "held_out_score": null, "criterion_names": null, "per_criterion_scores": null, "failure_classification": {"category": "logic_error", "description": "The attempted change likely altered the comparison behavior or bucket selection indirectly (e.g., caching length tied to the wrong key, stale cache values, or using cached lengths with mismatched elements), so while avoiding repeated len calls, it produced incorrect results.", "fix_direction": "Validate that cached lengths are computed from the exact same string instances/keys used in comparisons, ensure cache lifecycle stays consistent with bucket updates, and add tests to confirm bucket assignment and comparison outcomes match the baseline.", "confidence": 0.62}, "drafts_generated": 1, "drafts_survived": 1}
{"id": "e6b0e9f3-007d-4b11-8398-20e786dcdb86", "target_id": "B3-treatment", "git_sha": "20f453c43bf2559c091c0808897b46cee9652d8b", "pre_experiment_sha": "20f453c43bf2559c091c0808897b46cee9652d8b", "timestamp": "2026-04-18T23:54:43.677674+00:00", "hypothesis": "Cache candidate lengths alongside existing buckets to avoid repeated len calls in the hot comparison loop.", "hypothesis_source": "agent", "mutation_diff_summary": "", "score": 92.17, "score_ci_lower": null, "score_ci_upper": null, "raw_scores": null, "baseline_score": 90.84, "outcome": "DISCARDED", "failure_mode": null, "duration_seconds": 30.33109954104293, "tags": ["performance", "caching", "local-change"], "learnings": "{\"what_changed\":\"\",\"what_improved\":[],\"what_regressed\":[],\"transferable_insight\":\"Optimizations that add bookkeeping to avoid a small repeated operation should be validated against the full hot path, because the extra overhead can cancel out the intended gain.\",\"domain_tags\":[\"performance-optimization\",\"benchmarking\",\"tradeoff-analysis\"]}", "cost_usd": 0.08571959999999999, "bootstrap_seed": 0, "agent_model": "gpt-5.4", "held_out_score": null, "criterion_names": null, "per_criterion_scores": null, "failure_classification": {"category": "logic_error", "description": "The experiment intended to improve performance by caching candidate lengths, but the failure indicates the change likely introduced incorrect behavior in the hot comparison loop (e.g., stale/incorrect cached lengths or misaligned bucket usage), leading to an incorrect outcome rather than a pure performance gain.", "fix_direction": "Verify cache correctness end-to-end: ensure cached lengths are computed from the exact same data used in comparisons, invalidate/update caches when candidates change, and add targeted tests/assertions around bucket selection and length-based comparison results.", "confidence": 0.62}, "drafts_generated": 1, "drafts_survived": 1}
{"id": "ebbbdefd-62ff-439b-946c-bfdfdae66f4d", "target_id": "B3-treatment", "git_sha": "f772b707508125e618cb504189b4fb56123298fa", "pre_experiment_sha": "20f453c43bf2559c091c0808897b46cee9652d8b", "timestamp": "2026-04-18T23:55:17.724514+00:00", "hypothesis": "Precompute string lengths alongside the existing length buckets to avoid repeated len calls in the hot comparison loop.", "hypothesis_source": "agent", "mutation_diff_summary": "", "score": 91.28, "score_ci_lower": null, "score_ci_upper": null, "raw_scores": null, "baseline_score": 90.84, "outcome": "KEPT", "failure_mode": null, "duration_seconds": 31.4249853749061, "tags": ["length-caching", "hot-path", "safe-incremental"], "learnings": "{\"what_changed\":\"\",\"what_improved\":[],\"what_regressed\":[],\"transferable_insight\":\"Caching frequently reused derived values alongside existing groupings can reduce repeated work in tight loops and improve performance without changing behavior.\",\"domain_tags\":[\"performance-optimization\",\"caching\",\"algorithm-design\"]}", "cost_usd": 0.08585000000000001, "bootstrap_seed": 0, "agent_model": "gpt-5.4", "held_out_score": null, "criterion_names": null, "per_criterion_scores": null, "failure_classification": null, "drafts_generated": 1, "drafts_survived": 1}
{"id": "a7cdd282-ce08-4b9f-b092-32d124d5df15", "target_id": "B3-treatment", "git_sha": "02d26e165cdefa100a455ba21414b7aa666b57ab", "pre_experiment_sha": "f772b707508125e618cb504189b4fb56123298fa", "timestamp": "2026-04-18T23:55:52.806734+00:00", "hypothesis": "Reduce hot-loop overhead by avoiding tuple-packed length storage and repeated global lookups while preserving exact comparison order and results.", "hypothesis_source": "agent", "mutation_diff_summary": "", "score": 90.66, "score_ci_lower": null, "score_ci_upper": null, "raw_scores": null, "baseline_score": 91.28, "outcome": "KEPT", "failure_mode": null, "duration_seconds": 31.18138079100754, "tags": ["hot-loop", "local-caching", "allocation-reduction"], "learnings": "{\"what_changed\":\"\",\"what_improved\":[],\"what_regressed\":[],\"transferable_insight\":\"Micro-optimizations that simplify repeated work and reduce lookup overhead can preserve behavior while still failing to produce measurable gains, so validate changes against real performance rather than intuition.\",\"domain_tags\":[\"performance-optimization\",\"benchmarking\",\"software-engineering\"]}", "cost_usd": 0.085875, "bootstrap_seed": 0, "agent_model": "gpt-5.4", "held_out_score": null, "criterion_names": null, "per_criterion_scores": null, "failure_classification": null, "drafts_generated": 1, "drafts_survived": 1}
{"id": "75425f0e-7f23-4f9b-a6ed-de67d5a888bd", "target_id": "B3-treatment", "git_sha": "02d26e165cdefa100a455ba21414b7aa666b57ab", "pre_experiment_sha": "02d26e165cdefa100a455ba21414b7aa666b57ab", "timestamp": "2026-04-18T23:56:25.168692+00:00", "hypothesis": "Reduce hot-loop overhead by caching frequently used locals and using a slightly tighter bounded Levenshtein inner loop.", "hypothesis_source": "agent", "mutation_diff_summary": "", "score": 93.99, "score_ci_lower": null, "score_ci_upper": null, "raw_scores": null, "baseline_score": 90.66, "outcome": "DISCARDED", "failure_mode": null, "duration_seconds": 31.33156208298169, "tags": ["runtime", "hot-loop", "local-caching", "bounded-levenshtein"], "learnings": "{\"what_changed\":\"\",\"what_improved\":[],\"what_regressed\":[],\"transferable_insight\":\"Micro-optimizations that only reduce local loop overhead or tighten an inner bound may not produce measurable gains unless they materially change the dominant cost in the workload.\",\"domain_tags\":[\"performance-optimization\",\"algorithmic-efficiency\",\"benchmarking\"]}", "cost_usd": 0.0873858, "bootstrap_seed": 0, "agent_model": "gpt-5.4", "held_out_score": null, "criterion_names": null, "per_criterion_scores": null, "failure_classification": {"category": "over_optimization", "description": "The experiment shows a high score but is classified as failed with an unspecified failure mode, suggesting the change likely improved the measured metric while deviating from the intended behavior/criteria (i.e., evaluation gaming or an unintended semantic tradeoff).", "fix_direction": "Validate semantic correctness against ground-truth/reference behavior, not just the score/metric; add targeted tests for edge cases in the Levenshtein inner loop and verify performance changes do not alter distance results.", "confidence": 0.62}, "drafts_generated": 1, "drafts_survived": 1}
{"id": "aafc143b-a660-4fad-993d-07160d94501b", "target_id": "B3-treatment", "git_sha": "14fce65b271efb0c6c70f7cadcbb6ea86bb1ad1e", "pre_experiment_sha": "02d26e165cdefa100a455ba21414b7aa666b57ab", "timestamp": "2026-04-18T23:56:59.143954+00:00", "hypothesis": "Reduce hot-loop overhead in bounded Levenshtein by using shorter local aliases and simpler min comparisons.", "hypothesis_source": "agent", "mutation_diff_summary": "", "score": 90.38, "score_ci_lower": null, "score_ci_upper": null, "raw_scores": null, "baseline_score": 90.66, "outcome": "KEPT", "failure_mode": null, "duration_seconds": 31.40587716596201, "tags": ["hot-loop", "levenshtein", "local-caching", "allocation-safe"], "learnings": "{\"what_changed\":\"\",\"what_improved\":[],\"what_regressed\":[],\"transferable_insight\":\"Small syntactic simplifications in tight loops can reduce overhead, but they should be validated empirically because apparent micro-optimizations may not produce measurable gains.\",\"domain_tags\":[\"performance-optimization\",\"microbenchmarking\",\"software-engineering\"]}", "cost_usd": 0.08656, "bootstrap_seed": 0, "agent_model": "gpt-5.4", "held_out_score": null, "criterion_names": null, "per_criterion_scores": null, "failure_classification": null, "drafts_generated": 1, "drafts_survived": 1}
{"id": "a622d308-5749-4ae2-8736-412a5bfe3eee", "target_id": "B3-treatment", "git_sha": "14fce65b271efb0c6c70f7cadcbb6ea86bb1ad1e", "pre_experiment_sha": "14fce65b271efb0c6c70f7cadcbb6ea86bb1ad1e", "timestamp": "2026-04-18T23:57:32.943122+00:00", "hypothesis": "Reuse a single DP buffer in bounded Levenshtein and cache local loop invariants to reduce allocation and lookup overhead without changing behavior.", "hypothesis_source": "agent", "mutation_diff_summary": "", "score": 91.39, "score_ci_lower": null, "score_ci_upper": null, "raw_scores": null, "baseline_score": 90.38, "outcome": "DISCARDED", "failure_mode": null, "duration_seconds": 29.8916697090026, "tags": ["runtime", "safe", "local-caching", "buffer-reuse"], "learnings": "{\"what_changed\":\"\",\"what_improved\":[],\"what_regressed\":[],\"transferable_insight\":\"Optimizing for lower allocation and repeated lookup overhead can be worthwhile, but only if the refactor preserves behavior and yields measurable gains rather than just structural simplification.\",\"domain_tags\":[\"performance-optimization\",\"software-engineering\"]}", "cost_usd": 0.08559, "bootstrap_seed": 0, "agent_model": "gpt-5.4", "held_out_score": null, "criterion_names": null, "per_criterion_scores": null, "failure_classification": {"category": "logic_error", "description": "The provided information does not specify what aspect of the experiment failed (e.g., formatting, logic, regression, scope, syntax, semantic meaning, or incomplete edits).", "fix_direction": "Provide the specific failure details (error logs, diffs, failing test/metric, and expected vs actual behavior) so the failure mode can be mapped to one of the categories.", "confidence": 0.12}, "drafts_generated": 1, "drafts_survived": 1}
{"id": "dbbc1872-1b29-48d8-b172-8c2ec172fd9f", "target_id": "B3-treatment", "git_sha": "2615ccb14fb6fcc7fe0a069d1617aa3c073bc781", "pre_experiment_sha": "14fce65b271efb0c6c70f7cadcbb6ea86bb1ad1e", "timestamp": "2026-04-18T23:58:05.144393+00:00", "hypothesis": "Reduce hot-loop overhead by caching local invariants and avoiding repeated indexing/range allocation without changing results.", "hypothesis_source": "agent", "mutation_diff_summary": "", "score": 90.03, "score_ci_lower": null, "score_ci_upper": null, "raw_scores": null, "baseline_score": 90.38, "outcome": "KEPT", "failure_mode": null, "duration_seconds": 29.823835792019963, "tags": ["performance", "local-caching", "hot-loop", "safe"], "learnings": "{\"what_changed\":\"\",\"what_improved\":[],\"what_regressed\":[],\"transferable_insight\":\"Caching values that do not change within a tight loop and avoiding repeated redundant lookups can reduce overhead without altering outcomes.\",\"domain_tags\":[\"performance\",\"optimization\",\"software-engineering\"]}", "cost_usd": 0.08646000000000001, "bootstrap_seed": 0, "agent_model": "gpt-5.4", "held_out_score": null, "criterion_names": null, "per_criterion_scores": null, "failure_classification": null, "drafts_generated": 1, "drafts_survived": 1}
{"id": "8f2655d9-1348-47d7-a83a-acd1a7feceb7", "target_id": "B3-treatment", "git_sha": "2615ccb14fb6fcc7fe0a069d1617aa3c073bc781", "pre_experiment_sha": "2615ccb14fb6fcc7fe0a069d1617aa3c073bc781", "timestamp": "2026-04-18T23:58:36.483063+00:00", "hypothesis": "Reuse bounded Levenshtein row buffers and cache local invariants in the hot loop to reduce allocations without changing behavior.", "hypothesis_source": "agent", "mutation_diff_summary": "", "score": 92.46, "score_ci_lower": null, "score_ci_upper": null, "raw_scores": null, "baseline_score": 90.03, "outcome": "DISCARDED", "failure_mode": null, "duration_seconds": 30.548207834013738, "tags": ["performance", "allocation-reduction", "local-caching", "safe-mutation"], "learnings": "{\"what_changed\":\"\",\"what_improved\":[],\"what_regressed\":[],\"transferable_insight\":\"When an optimization only reduces allocations by reusing temporary buffers and hoisting invariant work, it should be kept only if profiling shows a measurable benefit, since such changes can add complexity without improving outcomes.\",\"domain_tags\":[\"optimization\",\"performance-engineering\",\"software-design\"]}", "cost_usd": 0.08700680000000001, "bootstrap_seed": 0, "agent_model": "gpt-5.4", "held_out_score": null, "criterion_names": null, "per_criterion_scores": null, "failure_classification": {"category": "incomplete_edit", "description": "The attempt to optimize by reusing Levenshtein row buffers and caching local invariants likely left the hot-loop in an inconsistent intermediate state (e.g., incorrect buffer reuse/reset between iterations or stale cached values), causing behavior changes even if compilation/parsing succeeded.", "fix_direction": "Ensure every reused buffer row is fully reinitialized/reset at the correct boundaries, and invalidate/recompute any cached invariants whenever inputs change; add targeted tests comparing against a known-good implementation for multiple string length edge cases.", "confidence": 0.62}, "drafts_generated": 1, "drafts_survived": 1}
