{"id": "c75f8065-f704-4d4e-8dac-8e08318ccf1b", "target_id": "B3-treatment", "git_sha": "d23b85abc1133560813d2c43d5bbaee835a05252", "pre_experiment_sha": "1f625c6b65106353c218211df02e85c82104674d", "timestamp": "2026-04-19T00:07:38.541308+00:00", "hypothesis": "Cache repeated locals more completely inside the existing hot comparison paths to reduce lookup and indexing overhead without changing behavior.", "hypothesis_source": "agent", "mutation_diff_summary": "", "score": 87.75, "score_ci_lower": null, "score_ci_upper": null, "raw_scores": null, "baseline_score": 88.6, "outcome": "KEPT", "failure_mode": null, "duration_seconds": 38.6870463329833, "tags": ["local-caching", "hot-path", "mechanical", "safe"], "learnings": "{\"what_changed\":\"\",\"what_improved\":[],\"what_regressed\":[],\"transferable_insight\":\"When optimizing a hot path, caching repeatedly accessed local values can reduce overhead without altering behavior, but the benefit may be too small to register if the surrounding work is already minimal.\",\"domain_tags\":[\"performance-optimization\",\"hot-path\",\"caching\"]}", "cost_usd": 0.09138000000000002, "bootstrap_seed": 0, "agent_model": "gpt-5.4", "held_out_score": null, "criterion_names": null, "per_criterion_scores": null, "failure_classification": null, "drafts_generated": 1, "drafts_survived": 1}
{"id": "8202eb05-ac39-4dc9-bf2c-438272236a96", "target_id": "B3-treatment", "git_sha": "c012fa5af0c82114b06c685b27d22704fdb94fc5", "pre_experiment_sha": "d23b85abc1133560813d2c43d5bbaee835a05252", "timestamp": "2026-04-19T00:08:22.334665+00:00", "hypothesis": "Cache the candidate string locally in the hot comparison loop to remove repeated tuple indexing and global threshold lookups without changing behavior.", "hypothesis_source": "agent", "mutation_diff_summary": "", "score": 87.14, "score_ci_lower": null, "score_ci_upper": null, "raw_scores": null, "baseline_score": 87.75, "outcome": "KEPT", "failure_mode": null, "duration_seconds": 42.62365399999544, "tags": ["local-caching", "hot-path", "deterministic-safe"], "learnings": "{\"what_changed\":\"\",\"what_improved\":[],\"what_regressed\":[],\"transferable_insight\":\"When optimizing a hot loop, hoisting repeated lookups into a local variable can preserve behavior while reducing per-iteration overhead, but the benefit may be too small to show measurable gains.\",\"domain_tags\":[\"performance-optimization\",\"hot-path\",\"micro-optimization\"]}", "cost_usd": 0.09161000000000001, "bootstrap_seed": 0, "agent_model": "gpt-5.4", "held_out_score": null, "criterion_names": null, "per_criterion_scores": null, "failure_classification": null, "drafts_generated": 1, "drafts_survived": 1}
{"id": "4e5dc1de-23cc-4662-802e-80350cc7712a", "target_id": "B3-treatment", "git_sha": "c012fa5af0c82114b06c685b27d22704fdb94fc5", "pre_experiment_sha": "c012fa5af0c82114b06c685b27d22704fdb94fc5", "timestamp": "2026-04-19T00:09:00.308299+00:00", "hypothesis": "Cache repeated local lookups and indexes more completely inside the existing hot loops without changing control flow.", "hypothesis_source": "agent", "mutation_diff_summary": "", "score": 91.24, "score_ci_lower": null, "score_ci_upper": null, "raw_scores": null, "baseline_score": 87.14, "outcome": "DISCARDED", "failure_mode": null, "duration_seconds": 36.741108417045325, "tags": ["local-caching", "hot-path", "bounded-levenshtein"], "learnings": "{\"what_changed\":\"\",\"what_improved\":[],\"what_regressed\":[],\"transferable_insight\":\"Micro-optimizations that only cache repeated local lookups or indexes inside already-hot loops, without changing the underlying control flow or algorithm, often fail to produce measurable gains and should be validated before adoption.\",\"domain_tags\":[\"performance-optimization\",\"software-engineering\",\"profiling\"]}", "cost_usd": 0.0919824, "bootstrap_seed": 0, "agent_model": "gpt-5.4", "held_out_score": null, "criterion_names": null, "per_criterion_scores": null, "failure_classification": {"category": "logic_error", "description": "The provided fields do not include any concrete error details (only 'Failure Mode: unknown'), so the specific failure mechanism cannot be determined from the information given.", "fix_direction": "Capture and report the concrete failing symptom (diff vs baseline, failing assertion/metric, runtime error/log, or specific output mismatch) and verify changes remain strictly within hot-loop caching/indexing without altering control flow or semantics.", "confidence": 0.18}, "drafts_generated": 1, "drafts_survived": 1}
{"id": "92730411-035f-4962-a6f1-34b7132c17c2", "target_id": "B3-treatment", "git_sha": "c012fa5af0c82114b06c685b27d22704fdb94fc5", "pre_experiment_sha": "c012fa5af0c82114b06c685b27d22704fdb94fc5", "timestamp": "2026-04-19T00:09:48.569503+00:00", "hypothesis": "Cache repeated local values more completely inside the existing hot comparison and bounded Levenshtein loops.", "hypothesis_source": "agent", "mutation_diff_summary": "", "score": 89.03, "score_ci_lower": null, "score_ci_upper": null, "raw_scores": null, "baseline_score": 87.14, "outcome": "DISCARDED", "failure_mode": null, "duration_seconds": 41.91155462502502, "tags": ["local-caching", "hot-path", "safe-mechanical"], "learnings": "{\"what_changed\":\"\",\"what_improved\":[],\"what_regressed\":[],\"transferable_insight\":\"When an optimization only adds local caching inside already hot loops and produces no measurable improvement or regression, it is likely too small or redundant to matter and should be discarded.\",\"domain_tags\":[\"optimization\",\"performance-analysis\",\"software-engineering\"]}", "cost_usd": 0.09205300000000001, "bootstrap_seed": 0, "agent_model": "gpt-5.4", "held_out_score": null, "criterion_names": null, "per_criterion_scores": null, "failure_classification": {"category": "logic_error", "description": "The attempted optimization (caching repeated local values within the existing hot comparison and bounded Levenshtein loops) did not achieve the intended semantic behavior or correctness, leading to an overall failure despite producing a high score, indicating the caching logic likely altered or broke comparison/DP invariants rather than merely formatting or integration.", "fix_direction": "Rework the caching to ensure it preserves the exact inputs/outputs of the hot comparison and bounded Levenshtein loops (e.g., validate cache keying/lifetimes per iteration, avoid stale reads, and add targeted tests for boundary cases and repeated-value scenarios).", "confidence": 0.63}, "drafts_generated": 1, "drafts_survived": 1}
{"id": "710edca7-9138-404c-a351-8bd988f6fa7e", "target_id": "B3-treatment", "git_sha": "c012fa5af0c82114b06c685b27d22704fdb94fc5", "pre_experiment_sha": "c012fa5af0c82114b06c685b27d22704fdb94fc5", "timestamp": "2026-04-19T00:10:30.931108+00:00", "hypothesis": "Cache repeated local aliases and indices more completely inside the existing hot loops to reduce lookup overhead without changing behavior.", "hypothesis_source": "agent", "mutation_diff_summary": "", "score": 89.17, "score_ci_lower": null, "score_ci_upper": null, "raw_scores": null, "baseline_score": 87.14, "outcome": "DISCARDED", "failure_mode": null, "duration_seconds": 39.294916708022356, "tags": ["local-caching", "hot-loop", "bounded-levenshtein", "safe"], "learnings": "{\"what_changed\":\"\",\"what_improved\":[],\"what_regressed\":[],\"transferable_insight\":\"When an optimization changes only internal lookup patterns but produces no measurable gains or regressions, it is likely too small or already covered by existing execution paths to matter.\",\"domain_tags\":[\"optimization\",\"performance-analysis\",\"software-engineering\"]}", "cost_usd": 0.092723, "bootstrap_seed": 0, "agent_model": "gpt-5.4", "held_out_score": null, "criterion_names": null, "per_criterion_scores": null, "failure_classification": {"category": "logic_error", "description": "Failure mode is unspecified ('unknown'), so the exact nature of the experiment's failure cannot be inferred from the provided information.", "fix_direction": "Instrument the hot-loop changes to identify where lookup overhead reduction introduced a behavior/compatibility issue (e.g., verify alias/index caching invariants, add targeted correctness tests, and compare outputs/semantics against the baseline).", "confidence": 0.15}, "drafts_generated": 1, "drafts_survived": 1}
{"id": "4411b4ca-324d-4841-a7e0-1dc25795b996", "target_id": "B3-treatment", "git_sha": "3956ab8c21bd0576a89facc5cd9c28836a9739fe", "pre_experiment_sha": "c012fa5af0c82114b06c685b27d22704fdb94fc5", "timestamp": "2026-04-19T00:11:11.899311+00:00", "hypothesis": "Cache the threshold comparison bound once per loop path and reuse shorter local aliases in the bounded Levenshtein hot path.", "hypothesis_source": "agent", "mutation_diff_summary": "", "score": 87.49, "score_ci_lower": null, "score_ci_upper": null, "raw_scores": null, "baseline_score": 87.14, "outcome": "KEPT", "failure_mode": null, "duration_seconds": 38.48896316601895, "tags": ["local-caching", "hot-path", "bounded-levenshtein", "mechanical"], "learnings": "{\"what_changed\":\"\",\"what_improved\":[],\"what_regressed\":[],\"transferable_insight\":\"When a condition is evaluated repeatedly along the same execution path, hoisting the invariant value into a local alias can reduce redundant work and improve hot-path performance without changing behavior.\",\"domain_tags\":[\"performance-optimization\",\"code-optimization\",\"runtime-efficiency\"]}", "cost_usd": 0.091475, "bootstrap_seed": 0, "agent_model": "gpt-5.4", "held_out_score": null, "criterion_names": null, "per_criterion_scores": null, "failure_classification": null, "drafts_generated": 1, "drafts_survived": 1}
{"id": "5b32f100-b070-4667-b144-fac334cfa7eb", "target_id": "B3-treatment", "git_sha": "adb39c74255b0405d7feea735dfd74ac548fbbcb", "pre_experiment_sha": "3956ab8c21bd0576a89facc5cd9c28836a9739fe", "timestamp": "2026-04-19T00:11:59.613998+00:00", "hypothesis": "Cache repeated threshold-bound values as locals within the existing comparison loop to reduce hot-path lookups without changing behavior.", "hypothesis_source": "agent", "mutation_diff_summary": "", "score": 86.55, "score_ci_lower": null, "score_ci_upper": null, "raw_scores": null, "baseline_score": 87.49, "outcome": "KEPT", "failure_mode": null, "duration_seconds": 41.04412066692021, "tags": ["local-caching", "hot-path", "safe"], "learnings": "{\"what_changed\":\"\",\"what_improved\":[],\"what_regressed\":[],\"transferable_insight\":\"Micro-optimizations that only reduce repeated access to already-bound values can preserve behavior while still failing to produce measurable gains, so validate impact with profiling rather than intuition.\",\"domain_tags\":[\"performance-optimization\",\"profiling\",\"software-engineering\"]}", "cost_usd": 0.09240500000000001, "bootstrap_seed": 0, "agent_model": "gpt-5.4", "held_out_score": null, "criterion_names": null, "per_criterion_scores": null, "failure_classification": null, "drafts_generated": 1, "drafts_survived": 1}
{"id": "c1cd48da-e39c-4ce8-88ea-4537d89a2687", "target_id": "B3-treatment", "git_sha": "adb39c74255b0405d7feea735dfd74ac548fbbcb", "pre_experiment_sha": "adb39c74255b0405d7feea735dfd74ac548fbbcb", "timestamp": "2026-04-19T00:12:37.780434+00:00", "hypothesis": "Cache the target-string character access inside bounded Levenshtein's inner loop to reduce repeated indexing overhead without changing behavior.", "hypothesis_source": "agent", "mutation_diff_summary": "", "score": 88.09, "score_ci_lower": null, "score_ci_upper": null, "raw_scores": null, "baseline_score": 86.55, "outcome": "DISCARDED", "failure_mode": null, "duration_seconds": 37.033555041998625, "tags": ["local-caching", "levenshtein", "hot-path"], "learnings": "{\"what_changed\":\"\",\"what_improved\":[],\"what_regressed\":[],\"transferable_insight\":\"Micro-optimizations that only reduce repeated access overhead inside a tight loop may not produce measurable gains if the surrounding computation dominates or the runtime already optimizes such access patterns.\",\"domain_tags\":[\"performance-optimization\",\"algorithmic-efficiency\",\"software-engineering\"]}", "cost_usd": 0.09283700000000002, "bootstrap_seed": 0, "agent_model": "gpt-5.4", "held_out_score": null, "criterion_names": null, "per_criterion_scores": null, "failure_classification": {"category": "logic_error", "description": "Failure mode is unspecified (\u201cunknown\u201d), and no concrete discrepancy (format, logic, regression, scope, syntax, semantics, over-optimization, or incomplete edit) is described. With only the hypothesis, score, and \u201cunknown\u201d failure mode, the likely cause cannot be determined.", "fix_direction": "Collect more failure evidence: actual error/output diff vs expected, failing test/criterion name, stack trace or runtime symptom, and the specific code region changed (e.g., inner loop caching). Then identify whether behavior changed (semantic drift), a required output format broke, or edits were incomplete/out of scope.", "confidence": 0.15}, "drafts_generated": 1, "drafts_survived": 1}
{"id": "144472a8-accc-46da-9b32-56b6561568d9", "target_id": "B3-treatment", "git_sha": "b872635b42db5a1c423f69b33095ad6f5d55753b", "pre_experiment_sha": "adb39c74255b0405d7feea735dfd74ac548fbbcb", "timestamp": "2026-04-19T00:13:20.546795+00:00", "hypothesis": "Cache repeated target-string indexing and loop invariants inside bounded Levenshtein's inner loop.", "hypothesis_source": "agent", "mutation_diff_summary": "", "score": 86.12, "score_ci_lower": null, "score_ci_upper": null, "raw_scores": null, "baseline_score": 86.55, "outcome": "KEPT", "failure_mode": null, "duration_seconds": 39.78793350001797, "tags": ["local-caching", "hot-path", "levenshtein"], "learnings": "{\"what_changed\":\"\",\"what_improved\":[],\"what_regressed\":[],\"transferable_insight\":\"When optimizing a tight loop, precompute repeated lookups and invariant values outside the loop to reduce redundant work without changing behavior.\",\"domain_tags\":[\"performance-optimization\",\"loop-invariants\",\"caching\"]}", "cost_usd": 0.09289, "bootstrap_seed": 0, "agent_model": "gpt-5.4", "held_out_score": null, "criterion_names": null, "per_criterion_scores": null, "failure_classification": null, "drafts_generated": 1, "drafts_survived": 1}
{"id": "e7e99f33-1fe0-4b59-b03b-05c6757362c3", "target_id": "B3-treatment", "git_sha": "b872635b42db5a1c423f69b33095ad6f5d55753b", "pre_experiment_sha": "b872635b42db5a1c423f69b33095ad6f5d55753b", "timestamp": "2026-04-19T00:14:01.524806+00:00", "hypothesis": "Cache the thresholded length bounds and bucketed candidate tuple fields more completely inside the existing comparison loop.", "hypothesis_source": "agent", "mutation_diff_summary": "", "score": 87.56, "score_ci_lower": null, "score_ci_upper": null, "raw_scores": null, "baseline_score": 86.12, "outcome": "DISCARDED", "failure_mode": null, "duration_seconds": 35.63647437503096, "tags": ["local-caching", "hot-path", "deterministic-safe"], "learnings": "{\"what_changed\":\"\",\"what_improved\":[],\"what_regressed\":[],\"transferable_insight\":\"When an optimization only adds more caching or precomputation inside an already hot loop, it may increase complexity without measurable benefit unless it removes a clearly dominant cost.\",\"domain_tags\":[\"optimization\",\"performance-engineering\",\"software-design\"]}", "cost_usd": 0.09327200000000001, "bootstrap_seed": 0, "agent_model": "gpt-5.4", "held_out_score": null, "criterion_names": null, "per_criterion_scores": null, "failure_classification": {"category": "logic_error", "description": "The provided information does not include any concrete evidence of what failed (e.g., incorrect outputs, schema mismatch, regression in behavior, code/config parse error, or an incomplete/partial change). The hypothesis suggests a performance/loop refactor, but the failure mode is listed as 'unknown', so the failure cannot be reliably mapped to a specific category.", "fix_direction": "Capture and report the specific failure symptom (diff vs prior behavior, failing test name, error message/stack trace, or example mismatched output) to determine whether the issue is logic/semantic drift vs incomplete edit vs output/schema vs regression.", "confidence": 0.12}, "drafts_generated": 1, "drafts_survived": 1}
{"id": "3456ea50-da15-4062-babd-9066e6951eb9", "target_id": "B3-treatment", "git_sha": "f313e052a77aa55ced16278d15f6ade4a5ede58c", "pre_experiment_sha": "b872635b42db5a1c423f69b33095ad6f5d55753b", "timestamp": "2026-04-19T00:14:38.385626+00:00", "hypothesis": "Cache the row string lookup alias once per bounded-Levenshtein call to remove a repeated local assignment in the hot path.", "hypothesis_source": "agent", "mutation_diff_summary": "", "score": 86.08, "score_ci_lower": null, "score_ci_upper": null, "raw_scores": null, "baseline_score": 86.12, "outcome": "KEPT", "failure_mode": null, "duration_seconds": 34.43451837496832, "tags": ["micro-optimization", "local-caching", "levenshtein"], "learnings": "{\"what_changed\":\"\",\"what_improved\":[],\"what_regressed\":[],\"transferable_insight\":\"Small, repeated assignments in a hot path can be worth hoisting or caching once per call when they do not change semantics, but the benefit may be marginal and should be validated empirically.\",\"domain_tags\":[\"performance-optimization\",\"code-optimization\",\"microbenchmarking\"]}", "cost_usd": 0.09312500000000001, "bootstrap_seed": 0, "agent_model": "gpt-5.4", "held_out_score": null, "criterion_names": null, "per_criterion_scores": null, "failure_classification": null, "drafts_generated": 1, "drafts_survived": 1}
{"id": "b864d641-044a-4d9b-b69c-51385500ca84", "target_id": "B3-treatment", "git_sha": "f466ad4e646c0aa82fb99897693aee21940b03a4", "pre_experiment_sha": "f313e052a77aa55ced16278d15f6ade4a5ede58c", "timestamp": "2026-04-19T00:15:16.149928+00:00", "hypothesis": "Cache the per-iteration upper bound in bounded Levenshtein to remove repeated local lookups without changing behavior.", "hypothesis_source": "agent", "mutation_diff_summary": "", "score": 86.2, "score_ci_lower": null, "score_ci_upper": null, "raw_scores": null, "baseline_score": 86.08, "outcome": "KEPT", "failure_mode": null, "duration_seconds": 36.620921459048986, "tags": ["local-caching", "levenshtein", "hot-path"], "learnings": "{\"what_changed\":\"\",\"what_improved\":[],\"what_regressed\":[],\"transferable_insight\":\"When a value is reused repeatedly within a tight loop and does not change, caching it locally can reduce overhead without affecting correctness.\",\"domain_tags\":[\"performance-optimization\",\"loop-efficiency\",\"caching\"]}", "cost_usd": 0.093285, "bootstrap_seed": 0, "agent_model": "gpt-5.4", "held_out_score": null, "criterion_names": null, "per_criterion_scores": null, "failure_classification": null, "drafts_generated": 1, "drafts_survived": 1}
{"id": "801d899d-6222-47e9-a948-85cdf4c067a3", "target_id": "B3-treatment", "git_sha": "f466ad4e646c0aa82fb99897693aee21940b03a4", "pre_experiment_sha": "f466ad4e646c0aa82fb99897693aee21940b03a4", "timestamp": "2026-04-19T00:15:57.548309+00:00", "hypothesis": "Cache the previous row's final-slot lookup once in bounded Levenshtein's return path to remove one repeated indexed access without changing behavior.", "hypothesis_source": "agent", "mutation_diff_summary": "", "score": 87.91, "score_ci_lower": null, "score_ci_upper": null, "raw_scores": null, "baseline_score": 86.2, "outcome": "DISCARDED", "failure_mode": null, "duration_seconds": 36.33245966699906, "tags": ["micro-optimization", "local-caching", "levenshtein"], "learnings": "{\"what_changed\":\"\",\"what_improved\":[],\"what_regressed\":[],\"transferable_insight\":\"A micro-optimization that reduces a repeated lookup in a hot path can be behavior-preserving yet still fail to produce measurable improvement, so validate changes with profiling rather than assuming fewer operations means faster execution.\",\"domain_tags\":[\"performance-optimization\",\"profiling\",\"software-engineering\"]}", "cost_usd": 0.10194960000000002, "bootstrap_seed": 0, "agent_model": "gpt-5.4", "held_out_score": null, "criterion_names": null, "per_criterion_scores": null, "failure_classification": {"category": "incomplete_edit", "description": "The change appears to have been only partially applied: caching the previous row\u2019s final-slot lookup in the return path likely missed at least one required access/edge condition, leaving inconsistent behavior that didn\u2019t preserve the original lookup semantics.", "fix_direction": "Audit all control-flow paths (especially early returns and boundary rows) to ensure the cached value is set and reused consistently, and add targeted tests for edge cases to confirm identical behavior versus the uncached baseline.", "confidence": 0.62}, "drafts_generated": 1, "drafts_survived": 1}
