{"id": "9ca07cf9-7612-443b-ad93-5e6dfa8bbbe5", "target_id": "B3-treatment", "git_sha": "51009f6ac8ca1bb6414892db9f0d2e2143c49bca", "pre_experiment_sha": "b4dc80e9c36a774d645e40b18b78695556673939", "timestamp": "2026-04-22T19:52:47.179835+00:00", "hypothesis": "Optimize list deduplication using a fast list comprehension with a `seen` set, and micro-optimize length variable references in the threshold=2 fast paths.", "hypothesis_source": "agent", "mutation_diff_summary": "", "score": 11.56, "score_ci_lower": null, "score_ci_upper": null, "raw_scores": null, "baseline_score": 11.67, "outcome": "KEPT", "failure_mode": null, "duration_seconds": 274.3125067919027, "tags": ["fast-path", "deduplication", "micro-optimization"], "learnings": "{\"what_changed\":\"\",\"what_improved\":[],\"what_regressed\":[],\"transferable_insight\":\"Utilizing constant-time lookup structures for deduplication and caching frequently accessed variables in critical execution paths optimizes overall processing speed.\",\"domain_tags\":[\"Performance Optimization\",\"Algorithm Design\",\"Code Efficiency\"]}", "cost_usd": 0.055567500000000006, "bootstrap_seed": 0, "agent_model": "gemini-3.1-pro-preview", "held_out_score": null, "criterion_names": null, "per_criterion_scores": null, "failure_classification": null, "drafts_generated": 1, "drafts_survived": 1}
{"id": "e556bb24-7582-4244-9959-1084808506f3", "target_id": "B3-treatment", "git_sha": "51009f6ac8ca1bb6414892db9f0d2e2143c49bca", "pre_experiment_sha": "51009f6ac8ca1bb6414892db9f0d2e2143c49bca", "timestamp": "2026-04-22T19:56:52.363596+00:00", "hypothesis": "Replace `while` loops for prefix and suffix trimming with `for` loops using `range` to eliminate bounds checking and manual increment/decrement overhead.", "hypothesis_source": "agent", "mutation_diff_summary": "", "score": 17.41, "score_ci_lower": null, "score_ci_upper": null, "raw_scores": null, "baseline_score": 11.56, "outcome": "DISCARDED", "failure_mode": null, "duration_seconds": 237.4407950830646, "tags": ["loop-optimization", "fast-path"], "learnings": "{\"what_changed\":\"\",\"what_improved\":[],\"what_regressed\":[],\"transferable_insight\":\"Replacing manual condition-based loops with range-based iterators can degrade performance by introducing unnecessary setup overhead, particularly for operations that frequently exit early.\",\"domain_tags\":[\"Loop Optimization\",\"Performance Tuning\",\"Iterator Overhead\"]}", "cost_usd": 0.0561137, "bootstrap_seed": 0, "agent_model": "gemini-3.1-pro-preview", "held_out_score": null, "criterion_names": null, "per_criterion_scores": null, "failure_classification": {"category": "logic_error", "description": "The replacement of `while` loops with `for` loops using `range` for prefix and suffix trimming likely introduced incorrect boundary conditions or off-by-one errors. The `range` function's exclusive end can be tricky when directly porting logic from `while` loops, leading to either under-trimming, over-trimming, or incorrect character removal. This fundamental logical flaw resulted in the experiment's failure, indicated by the low score.", "fix_direction": "Carefully review the loop bounds and indexing logic for the `for`/`range` loops, especially when dealing with the start and end of strings. Ensure that the new implementation precisely mimics the character removal behavior of the original `while` loops, covering edge cases like empty strings, strings that are entirely prefix/suffix, and single-character strings. Introduce specific unit tests for these trimming scenarios.", "confidence": 0.9}, "drafts_generated": 1, "drafts_survived": 1}
{"id": "c9228fbb-278c-42ab-a095-8af287156613", "target_id": "B3-treatment", "git_sha": "51009f6ac8ca1bb6414892db9f0d2e2143c49bca", "pre_experiment_sha": "51009f6ac8ca1bb6414892db9f0d2e2143c49bca", "timestamp": "2026-04-22T20:00:49.164462+00:00", "hypothesis": "Replace `while` loops for prefix/suffix matching with faster `for` loops using `range()`, and optimize the length-grouping dictionary population with `try/except KeyError` to eliminate overhead.", "hypothesis_source": "agent", "mutation_diff_summary": "", "score": 17.13, "score_ci_lower": null, "score_ci_upper": null, "raw_scores": null, "baseline_score": 11.56, "outcome": "DISCARDED", "failure_mode": null, "duration_seconds": 211.21538066701032, "tags": ["loop-unrolling", "fast-path", "micro-optimization"], "learnings": "{\"what_changed\":\"\",\"what_improved\":[],\"what_regressed\":[],\"transferable_insight\":\"Micro-optimizations such as swapping loop constructs or using exception-handling for control flow can unexpectedly degrade performance due to hidden execution overheads.\",\"domain_tags\":[\"Performance Optimization\",\"Software Engineering\",\"Micro-optimization\"]}", "cost_usd": 0.057259950000000004, "bootstrap_seed": 0, "agent_model": "gemini-3.1-pro-preview", "held_out_score": null, "criterion_names": null, "per_criterion_scores": null, "failure_classification": {"category": "over_optimization", "description": "The attempts to optimize code, specifically by replacing `while` loops with `for` loops using `range()` and using `try/except KeyError` for dictionary population, either did not result in the expected performance gains or, more likely, introduced performance regressions or subtle correctness issues that led to a worse score (17.1300). Python's overhead for exception handling can be significant if `KeyError` is frequent, and `for` loop refactoring might not yield speedups if other operations dominate or if the original `while` loop was already efficient for the task, indicating that the 'optimization' was counterproductive or incorrectly applied.", "fix_direction": "Before applying micro-optimizations, use profiling tools (e.g., `cProfile`) to accurately identify actual performance bottlenecks. Benchmark proposed changes against the baseline to confirm genuine performance improvements. Consider idiomatic Python constructs like `collections.defaultdict` for grouping, which are often highly optimized and more readable. Prioritize correctness and readability, as premature optimization often leads to degraded performance or new bugs.", "confidence": 0.95}, "drafts_generated": 1, "drafts_survived": 1}
{"id": "66c50a9f-1d1e-4d3a-8437-3c32bfe041cb", "target_id": "B3-treatment", "git_sha": "4dda7f69031a2502933157fb7e25c8ec1b79cf1c", "pre_experiment_sha": "51009f6ac8ca1bb6414892db9f0d2e2143c49bca", "timestamp": "2026-04-22T20:10:37.358909+00:00", "hypothesis": "Unroll index offset comparisons for remaining string lengths up to 8 in the `threshold == 2` fast paths to eliminate string slice overhead and loop overhead entirely for the vast majority of string pairs.", "hypothesis_source": "agent", "mutation_diff_summary": "", "score": 9.21, "score_ci_lower": null, "score_ci_upper": null, "raw_scores": null, "baseline_score": 11.56, "outcome": "KEPT", "failure_mode": null, "duration_seconds": 233.97092916606925, "tags": ["fast-path", "unrolling", "index-offsets", "loop-elimination"], "learnings": "{\"what_changed\":\"\",\"what_improved\":[],\"what_regressed\":[],\"transferable_insight\":\"Unrolling iterative operations for small, bounded sizes within fast paths eliminates loop and indexing overhead, optimizing performance for the most frequent scenarios.\",\"domain_tags\":[\"Performance Optimization\",\"Loop Unrolling\",\"Micro-optimization\"]}", "cost_usd": 0.10206125, "bootstrap_seed": 0, "agent_model": "gemini-3.1-pro-preview", "held_out_score": null, "criterion_names": null, "per_criterion_scores": null, "failure_classification": null, "drafts_generated": 1, "drafts_survived": 1}
{"id": "5ac082c9-f444-4c6b-aa97-ba544fe302fd", "target_id": "B3-treatment", "git_sha": "cf534886c5dbbed69449c21bf5ad85d9240bc718", "pre_experiment_sha": "4dda7f69031a2502933157fb7e25c8ec1b79cf1c", "timestamp": "2026-04-22T20:15:12.637841+00:00", "hypothesis": "Optimize loop overhead by adding O(1) fast-paths for the first and last characters during prefix/suffix trimming, and eliminate redundant tuple allocations in `_deduplicate_pairs` using tuple slicing and the walrus operator.", "hypothesis_source": "agent", "mutation_diff_summary": "", "score": 8.81, "score_ci_lower": null, "score_ci_upper": null, "raw_scores": null, "baseline_score": 9.21, "outcome": "KEPT", "failure_mode": null, "duration_seconds": 267.17985574994236, "tags": ["loop-optimization", "fast-path", "memory-allocation", "walrus-operator"], "learnings": "{\"what_changed\":\"\",\"what_improved\":[],\"what_regressed\":[],\"transferable_insight\":\"Implementing fast-paths for boundary conditions and minimizing redundant memory allocations significantly reduces execution overhead.\",\"domain_tags\":[\"Performance Optimization\",\"Memory Management\",\"Algorithm Design\"]}", "cost_usd": 0.10994250000000001, "bootstrap_seed": 0, "agent_model": "gemini-3.1-pro-preview", "held_out_score": null, "criterion_names": null, "per_criterion_scores": null, "failure_classification": null, "drafts_generated": 1, "drafts_survived": 1}
{"id": "3d52e97c-d33a-4fc8-9dbf-7291fd752ad9", "target_id": "B3-treatment", "git_sha": "cf534886c5dbbed69449c21bf5ad85d9240bc718", "pre_experiment_sha": "cf534886c5dbbed69449c21bf5ad85d9240bc718", "timestamp": "2026-04-22T20:19:20.857001+00:00", "hypothesis": "Optimize input deduplication using a fast list comprehension with a `seen` set to ensure deterministic ordering, accelerate length grouping dictionary lookups with `try/except`, and micro-optimize the threshold=2 fast-paths by eliminating the redundant `end_s` variable to reduce local assignments.", "hypothesis_source": "agent", "mutation_diff_summary": "", "score": 9.54, "score_ci_lower": null, "score_ci_upper": null, "raw_scores": null, "baseline_score": 8.81, "outcome": "DISCARDED", "failure_mode": null, "duration_seconds": 218.34123962488957, "tags": ["deduplication", "dictionary-lookup", "micro-optimization", "loop-unrolling", "fast-path"], "learnings": "{\"what_changed\":\"\",\"what_improved\":[],\"what_regressed\":[],\"transferable_insight\":\"Aggregating multiple micro-optimizations, such as exception-based control flow and stateful filtering, can introduce hidden overheads that degrade overall performance rather than improving it.\",\"domain_tags\":[\"Performance Optimization\",\"Micro-optimization\",\"Software Engineering\"]}", "cost_usd": 0.11094865, "bootstrap_seed": 0, "agent_model": "gemini-3.1-pro-preview", "held_out_score": null, "criterion_names": null, "per_criterion_scores": null, "failure_classification": {"category": "logic_error", "description": "The experiment proposed several micro-optimizations, including using `try/except` for dictionary lookups and eliminating a variable to reduce assignments. These techniques, while seemingly beneficial, can introduce performance regressions or unintended side effects if the underlying assumptions about their efficiency or correctness in the specific context are flawed. It's probable that the 'logic' behind these optimizations (e.g., that `try/except` is always faster than a check, or that removing a variable would have a significant impact) was incorrect or misapplied, leading to a failure to improve performance, a degradation, or a subtle behavioral bug that caused the experiment to fail with an 'unknown' mode.", "fix_direction": "Re-evaluate the performance assumptions for each micro-optimization by profiling the code thoroughly. Instead of relying on general optimization heuristics, identify the true bottlenecks with concrete measurements. If `try/except` was used, measure its performance against explicit `if key in dict` checks for the expected hit/miss ratio. If variable elimination was attempted, confirm its actual impact on instruction count and execution time. Focus on optimizations with clear, measurable gains rather than speculative micro-optimizations that might introduce complexity or regressions.", "confidence": 0.9}, "drafts_generated": 1, "drafts_survived": 1}
{"id": "96374d77-b3f4-4d95-ac9b-11ebb8423468", "target_id": "B3-treatment", "git_sha": "cf534886c5dbbed69449c21bf5ad85d9240bc718", "pre_experiment_sha": "cf534886c5dbbed69449c21bf5ad85d9240bc718", "timestamp": "2026-04-22T20:23:17.945111+00:00", "hypothesis": "Unroll the first 4 iterations of the prefix and suffix matching `while` loops into O(1) `if/elif` chains to eliminate loop overhead for the vast majority of string pairs, and optimize dictionary grouping with `try/except`.", "hypothesis_source": "agent", "mutation_diff_summary": "", "score": 9.41, "score_ci_lower": null, "score_ci_upper": null, "raw_scores": null, "baseline_score": 8.81, "outcome": "DISCARDED", "failure_mode": null, "duration_seconds": 214.05769895901904, "tags": ["unrolling", "fast-path", "dictionary-optimization"], "learnings": "{\"what_changed\":\"\",\"what_improved\":[],\"what_regressed\":[],\"transferable_insight\":\"Manually unrolling loops into conditional chains to avoid loop overhead often degrades performance in high-level languages by increasing code complexity and interfering with built-in interpreter optimizations.\",\"domain_tags\":[\"Performance Optimization\",\"Micro-optimization\",\"Language Mechanics\"]}", "cost_usd": 0.12030205000000001, "bootstrap_seed": 0, "agent_model": "gemini-3.1-pro-preview", "held_out_score": null, "criterion_names": null, "per_criterion_scores": null, "failure_classification": {"category": "over_optimization", "description": "The attempted micro-optimizations (loop unrolling and `try/except` for dictionary grouping) likely introduced more overhead than they saved, increased code complexity, or had unforeseen performance costs (e.g., increased instruction cache misses, or the base cost of `try/except` blocks), leading to a degraded performance score despite the intent to optimize.", "fix_direction": "Revert the specific micro-optimizations. Instead, perform detailed profiling to identify actual performance bottlenecks before implementing targeted optimizations. Consider broader algorithmic improvements or data structure changes if necessary, rather than focusing solely on loop overhead or `try/except` usage without empirical evidence of their impact.", "confidence": 0.9}, "drafts_generated": 1, "drafts_survived": 1}
{"id": "a236a819-0bb7-4d0b-aa45-4f7f5f4a9f60", "target_id": "B3-treatment", "git_sha": "a4e317645f165c5d261f72e49dd256f630e718f7", "pre_experiment_sha": "cf534886c5dbbed69449c21bf5ad85d9240bc718", "timestamp": "2026-04-22T20:27:01.070755+00:00", "hypothesis": "Optimize prefix/suffix trimming by removing redundant bounds checks for equal-length strings, replace dictionary length grouping with a faster `try/except` block, and handle negative diffs gracefully to avoid empty loop overhead.", "hypothesis_source": "agent", "mutation_diff_summary": "", "score": 8.79, "score_ci_lower": null, "score_ci_upper": null, "raw_scores": null, "baseline_score": 8.81, "outcome": "KEPT", "failure_mode": null, "duration_seconds": 204.12230674992315, "tags": ["optimization", "bounds-check-elimination", "string-matching"], "learnings": "{\"what_changed\":\"\",\"what_improved\":[],\"what_regressed\":[],\"transferable_insight\":\"Replacing explicit bounds checks and conditional grouping with exception handling while gracefully managing edge cases reduces overhead and improves execution efficiency.\",\"domain_tags\":[\"Software Engineering\",\"Performance Optimization\",\"Algorithm Design\"]}", "cost_usd": 0.1099775, "bootstrap_seed": 0, "agent_model": "gemini-3.1-pro-preview", "held_out_score": null, "criterion_names": null, "per_criterion_scores": null, "failure_classification": null, "drafts_generated": 1, "drafts_survived": 1}
{"id": "e91a2c7b-5410-49c8-a99c-d88f89695402", "target_id": "B3-treatment", "git_sha": "2e751592425aa6c07bae2c0ef15876c87a8a2fe1", "pre_experiment_sha": "a4e317645f165c5d261f72e49dd256f630e718f7", "timestamp": "2026-04-22T20:31:20.330590+00:00", "hypothesis": "Hoist the first and last characters of the outer loop string `a` into local variables `a0` and `am1` to eliminate redundant string index lookups during the inner loops' fast-path prefix/suffix checks.", "hypothesis_source": "agent", "mutation_diff_summary": "", "score": 8.09, "score_ci_lower": null, "score_ci_upper": null, "raw_scores": null, "baseline_score": 8.79, "outcome": "KEPT", "failure_mode": null, "duration_seconds": 229.40237549995072, "tags": ["micro-optimization", "loop-hoisting", "string-indexing"], "learnings": "{\"what_changed\":\"\",\"what_improved\":[],\"what_regressed\":[],\"transferable_insight\":\"Caching frequently accessed boundary elements of a collection in local variables before entering a nested loop eliminates redundant lookups and improves execution speed.\",\"domain_tags\":[\"Performance Optimization\",\"Code Optimization\",\"Algorithm Design\"]}", "cost_usd": 0.1103375, "bootstrap_seed": 0, "agent_model": "gemini-3.1-pro-preview", "held_out_score": null, "criterion_names": null, "per_criterion_scores": null, "failure_classification": null, "drafts_generated": 1, "drafts_survived": 1}
{"id": "ee01826b-783c-40fa-b122-d15c53655f7d", "target_id": "B3-treatment", "git_sha": "66d0ed7ec7de044b0f59c410f07e7c7cb7d71581", "pre_experiment_sha": "2e751592425aa6c07bae2c0ef15876c87a8a2fe1", "timestamp": "2026-04-22T20:36:00.640721+00:00", "hypothesis": "Eliminate inner-loop bounds checking during prefix and suffix trimming by leveraging `try/except IndexError` for strings of unequal length, and completely removing bounds checks for strings of equal length (since they are guaranteed to mismatch before going out of bounds).", "hypothesis_source": "agent", "mutation_diff_summary": "", "score": 7.56, "score_ci_lower": null, "score_ci_upper": null, "raw_scores": null, "baseline_score": 8.09, "outcome": "KEPT", "failure_mode": null, "duration_seconds": 274.1559133748524, "tags": ["fast-path", "unrolling", "loop-optimization", "bounds-check-elimination"], "learnings": "{\"what_changed\":\"\",\"what_improved\":[],\"what_regressed\":[],\"transferable_insight\":\"Replacing explicit bounds checking in tight loops with exception handling or leveraging inherent logical constraints reduces overhead and improves execution speed.\",\"domain_tags\":[\"Performance Optimization\",\"Algorithm Design\",\"Exception Handling\"]}", "cost_usd": 0.11038375, "bootstrap_seed": 0, "agent_model": "gemini-3.1-pro-preview", "held_out_score": null, "criterion_names": null, "per_criterion_scores": null, "failure_classification": null, "drafts_generated": 1, "drafts_survived": 1}
{"id": "5f081f7a-1caf-4e6c-bb89-a1b5e7a4d309", "target_id": "B3-treatment", "git_sha": "4bc660a3704903721025ccf1864bdcf41a3bc732", "pre_experiment_sha": "66d0ed7ec7de044b0f59c410f07e7c7cb7d71581", "timestamp": "2026-04-22T20:40:11.225560+00:00", "hypothesis": "Deduplicate input lists using fast list comprehensions to preserve order while avoiding redundant work, and micro-optimize length calculations by hoisting `len_a` offsets and inner-loop `end_s` arithmetic.", "hypothesis_source": "agent", "mutation_diff_summary": "", "score": 7.17, "score_ci_lower": null, "score_ci_upper": null, "raw_scores": null, "baseline_score": 7.56, "outcome": "KEPT", "failure_mode": null, "duration_seconds": 244.19581570778973, "tags": ["list-comprehension", "deduplication", "loop-hoisting", "micro-optimization"], "learnings": "{\"what_changed\":\"\",\"what_improved\":[],\"what_regressed\":[],\"transferable_insight\":\"Eliminating redundant processing by deduplicating inputs and hoisting invariant calculations out of inner loops significantly improves overall execution efficiency.\",\"domain_tags\":[\"Performance Optimization\",\"Loop Optimization\",\"Data Deduplication\"]}", "cost_usd": 0.11163625000000002, "bootstrap_seed": 0, "agent_model": "gemini-3.1-pro-preview", "held_out_score": null, "criterion_names": null, "per_criterion_scores": null, "failure_classification": null, "drafts_generated": 1, "drafts_survived": 1}
{"id": "4071bd69-08d8-4463-b119-4e59c73d9da0", "target_id": "B3-treatment", "git_sha": "1b6bc469a63e86dd12260e2145d6667ff000d8c7", "pre_experiment_sha": "4bc660a3704903721025ccf1864bdcf41a3bc732", "timestamp": "2026-04-22T20:44:43.609614+00:00", "hypothesis": "Optimize dictionary lookups by using the walrus operator to assign and check `b_list` in a single step, and streamline the deduplication list comprehensions for `set_a` and `set_b` by removing the `not (...)` wrapper.", "hypothesis_source": "agent", "mutation_diff_summary": "", "score": 7.17, "score_ci_lower": null, "score_ci_upper": null, "raw_scores": null, "baseline_score": 7.17, "outcome": "KEPT", "failure_mode": null, "duration_seconds": 242.1846418341156, "tags": ["micro-optimization", "walrus-operator", "deduplication"], "learnings": "{\"what_changed\":\"\",\"what_improved\":[],\"what_regressed\":[],\"transferable_insight\":\"Consolidating assignment and conditional checks while simplifying boolean logic improves code conciseness and readability, even if it yields no measurable performance gains.\",\"domain_tags\":[\"Software Engineering\",\"Refactoring\",\"Code Readability\"]}", "cost_usd": 0.11175375000000001, "bootstrap_seed": 0, "agent_model": "gemini-3.1-pro-preview", "held_out_score": null, "criterion_names": null, "per_criterion_scores": null, "failure_classification": null, "drafts_generated": 1, "drafts_survived": 1}
