{"id": "05df6926-edad-4593-babe-d547585e37a2", "target_id": "B3-treatment", "git_sha": "f46250ef2f7fbc83a14cc70f70f2bbc31e6968d8", "pre_experiment_sha": "68d96c185fbe6e19a4b0d379f77244ff8b5e62d6", "timestamp": "2026-04-18T23:45:49.843231+00:00", "hypothesis": "Use a bounded Levenshtein implementation with pruning and set-based deduplication to reduce deterministic runtime.", "hypothesis_source": "agent", "mutation_diff_summary": "", "score": 110.76, "score_ci_lower": null, "score_ci_upper": null, "raw_scores": null, "baseline_score": 467.23, "outcome": "KEPT", "failure_mode": null, "duration_seconds": 31.125608458998613, "tags": ["performance", "dynamic-programming", "pruning", "deduplication"], "learnings": "{\"what_changed\":\"\",\"what_improved\":[],\"what_regressed\":[],\"transferable_insight\":\"Combining early-exit pruning with deduplication can reduce deterministic runtime by avoiding redundant work without changing results.\",\"domain_tags\":[\"algorithm-optimization\",\"performance\",\"deduplication\"]}", "cost_usd": 0.07794500000000001, "bootstrap_seed": 0, "agent_model": "gpt-5.4", "held_out_score": null, "criterion_names": null, "per_criterion_scores": null, "failure_classification": null, "drafts_generated": 1, "drafts_survived": 1}
{"id": "4500718d-be0d-43e3-bab3-d8ba9a784ad8", "target_id": "B3-treatment", "git_sha": "f46250ef2f7fbc83a14cc70f70f2bbc31e6968d8", "pre_experiment_sha": "f46250ef2f7fbc83a14cc70f70f2bbc31e6968d8", "timestamp": "2026-04-18T23:46:26.025582+00:00", "hypothesis": "Precomputing exact threshold-2 edit checks and avoiding dynamic-programming allocation will reduce deterministic runtime.", "hypothesis_source": "agent", "mutation_diff_summary": "", "score": 99999.0, "score_ci_lower": null, "score_ci_upper": null, "raw_scores": null, "baseline_score": 110.76, "outcome": "DISCARDED", "failure_mode": null, "duration_seconds": 35.24143920803908, "tags": ["performance", "levenshtein", "pruning", "precompute"], "learnings": "{\"what_changed\":\"\",\"what_improved\":[],\"what_regressed\":[],\"transferable_insight\":\"Replacing general-purpose dynamic computation with precomputed exact checks can improve deterministic runtime when the problem structure is fixed and reusable.\",\"domain_tags\":[\"performance-optimization\",\"algorithm-design\",\"precomputation\"]}", "cost_usd": 0.08920560000000002, "bootstrap_seed": 0, "agent_model": "gpt-5.4", "held_out_score": null, "criterion_names": null, "per_criterion_scores": null, "failure_classification": {"category": "logic_error", "description": "The experiment failed despite an optimization-focused hypothesis; the failure mode is unspecified (unknown) and the very high score suggests the expected improvement did not manifest due to an incorrect underlying reasoning/calculation or an overlooked constraint affecting runtime behavior.", "fix_direction": "Validate the runtime/algorithmic assumptions (correctness of threshold-2 edit check precomputation), ensure no hidden dynamic allocation or worst-case paths remain, and add profiling plus correctness tests to confirm semantics and performance gains simultaneously.", "confidence": 0.32}, "drafts_generated": 1, "drafts_survived": 1}
{"id": "9625f65c-1923-4806-9d26-3f9f40541e92", "target_id": "B3-treatment", "git_sha": "f46250ef2f7fbc83a14cc70f70f2bbc31e6968d8", "pre_experiment_sha": "f46250ef2f7fbc83a14cc70f70f2bbc31e6968d8", "timestamp": "2026-04-18T23:47:00.448454+00:00", "hypothesis": "Precompute compact candidate buckets and use a tighter bounded Levenshtein implementation to reduce benchmark runtime deterministically.", "hypothesis_source": "agent", "mutation_diff_summary": "", "score": 99999.0, "score_ci_lower": null, "score_ci_upper": null, "raw_scores": null, "baseline_score": 110.76, "outcome": "DISCARDED", "failure_mode": null, "duration_seconds": 32.05734100006521, "tags": ["performance", "levenshtein", "precompute", "bucketing"], "learnings": "{\"what_changed\":\"\",\"what_improved\":[],\"what_regressed\":[],\"transferable_insight\":\"When an optimization changes the algorithmic path but not the measured outcome, the safest conclusion is that the added complexity is not yet justified by evidence and should be discarded or simplified.\",\"domain_tags\":[\"optimization\",\"benchmarking\",\"algorithm-design\"]}", "cost_usd": 0.08292280000000002, "bootstrap_seed": 0, "agent_model": "gpt-5.4", "held_out_score": null, "criterion_names": null, "per_criterion_scores": null, "failure_classification": {"category": "logic_error", "description": "The experiment result indicates a failed run with an unspecified failure mode (\"unknown\"). No concrete information is provided about what broke (e.g., formatting, parsing, logic, regression, optimization gaming), nor any observed symptom to map to a specific category.", "fix_direction": "Capture and report the concrete error signal (stack trace/logs, failing assertion, diff of expected vs actual outputs, and where runtime/behavior diverged). Then verify whether changes stayed within scope and whether any benchmark harness or output contract was violated; also add deterministic performance checks rather than relying on runtime assumptions.", "confidence": 0.05}, "drafts_generated": 1, "drafts_survived": 1}
{"id": "58e9abf6-7efc-4781-9fd3-04f46cb8259f", "target_id": "B3-treatment", "git_sha": "399d9741698b4a00bff8e8983619212e87bcb119", "pre_experiment_sha": "f46250ef2f7fbc83a14cc70f70f2bbc31e6968d8", "timestamp": "2026-04-18T23:47:35.560034+00:00", "hypothesis": "Reduce allocations and duplicate distance checks by using a banded DP row and deduplicating candidate names before comparison.", "hypothesis_source": "agent", "mutation_diff_summary": "", "score": 107.48, "score_ci_lower": null, "score_ci_upper": null, "raw_scores": null, "baseline_score": 110.76, "outcome": "KEPT", "failure_mode": null, "duration_seconds": 30.57350974995643, "tags": ["levenshtein", "pruning", "deduplication", "allocation-reduction"], "learnings": "{\"what_changed\":\"\",\"what_improved\":[],\"what_regressed\":[],\"transferable_insight\":\"Limiting work to the relevant search band and removing duplicate candidates before comparison can reduce unnecessary computation without changing results.\",\"domain_tags\":[\"optimization\",\"deduplication\",\"dynamic-programming\"]}", "cost_usd": 0.08039, "bootstrap_seed": 0, "agent_model": "gpt-5.4", "held_out_score": null, "criterion_names": null, "per_criterion_scores": null, "failure_classification": null, "drafts_generated": 1, "drafts_survived": 1}
{"id": "6d9e0762-3668-4b87-853d-9bbfc7b3e0eb", "target_id": "B3-treatment", "git_sha": "9363f877502e495a73accc562750440e922ab38e", "pre_experiment_sha": "399d9741698b4a00bff8e8983619212e87bcb119", "timestamp": "2026-04-18T23:48:07.297799+00:00", "hypothesis": "Reduce repeated work by pre-deduplicating inputs and tightening the bounded Levenshtein inner loop.", "hypothesis_source": "agent", "mutation_diff_summary": "", "score": 91.04, "score_ci_lower": null, "score_ci_upper": null, "raw_scores": null, "baseline_score": 107.48, "outcome": "KEPT", "failure_mode": null, "duration_seconds": 30.773801125003956, "tags": ["performance", "deduplication", "levenshtein", "pruning"], "learnings": "{\"what_changed\":\"\",\"what_improved\":[],\"what_regressed\":[],\"transferable_insight\":\"When an optimization changes core logic, pre-filtering redundant inputs and simplifying the tightest inner loop can reduce repeated work, but the net effect must be validated because small structural changes may not produce measurable gains.\",\"domain_tags\":[\"optimization\",\"performance\",\"algorithm-design\"]}", "cost_usd": 0.083195, "bootstrap_seed": 0, "agent_model": "gpt-5.4", "held_out_score": null, "criterion_names": null, "per_criterion_scores": null, "failure_classification": null, "drafts_generated": 1, "drafts_survived": 1}
{"id": "4ff5d0a8-1862-43f7-a1f4-82e304cfe0b9", "target_id": "B3-treatment", "git_sha": "9363f877502e495a73accc562750440e922ab38e", "pre_experiment_sha": "9363f877502e495a73accc562750440e922ab38e", "timestamp": "2026-04-18T23:48:39.446895+00:00", "hypothesis": "Precompute length buckets once and remove redundant pair deduplication work to reduce runtime without changing results.", "hypothesis_source": "agent", "mutation_diff_summary": "", "score": 91.04, "score_ci_lower": null, "score_ci_upper": null, "raw_scores": null, "baseline_score": 91.04, "outcome": "CRASHED", "failure_mode": "run_command exited with code 1: warning: `VIRTUAL_ENV=/Users/druk/WorkSpace/AetherForge/anneal/.venv` does not match the project environment path `.venv` and will be ignored; use `--active` to target the active environment instead\nTraceback (most recent call last):\n  File \"/Users/druk/WorkSpace/AetherForge/anneal/benchmarks/suite/harness/eval_b3.py\", line 124, in <module>\n    main()\n  File \"/Users/druk/WorkSpace/AetherForge/anneal/benchmarks/suite/harness/eval_b3.py\", line 116, in main\n    if not _verify_spot_checks(ARTIFACT):\n           ^^^^^^^^^^^^^^^^^^^^^^^^^^^^^\n  File \"/Users/druk/WorkSpace/AetherForge/anneal/benchmarks/suite/harness/eval_b3.py\", line 69, in _verify_spot_checks\n    pairs = find_fn(names_a, names_b, 2)\n            ^^^^^^^^^^^^^^^^^^^^^^^^^^^^\n  File \"/Users/druk/WorkSpace/AetherForge/anneal/.anneal/worktrees/B3-treatment/benchmarks/suite/artifacts/B3_utility_function.py\", line 199, in _find_close_pairs\n    get_bucket = b_by_len.get\n                 ^^^^^^^^^^^^\nAttributeError: 'list' object has no attribute 'get'", "duration_seconds": 30.974737541982904, "tags": ["precompute", "bucketing", "deduplication", "local-refactor"], "learnings": "{\"what_changed\":\"\",\"what_improved\":[],\"what_regressed\":[],\"transferable_insight\":\"Optimizations that precompute shared structure and eliminate duplicate work must be validated for correctness and edge cases, because reducing computation can still introduce crashes without improving outcomes.\",\"domain_tags\":[\"optimization\",\"correctness\",\"performance\"]}", "cost_usd": 0.08440500000000001, "bootstrap_seed": 0, "agent_model": "gpt-5.4", "held_out_score": null, "criterion_names": null, "per_criterion_scores": null, "failure_classification": null, "drafts_generated": 1, "drafts_survived": 1}
{"id": "c5d230cb-d706-4b03-a195-97a0e0f2f644", "target_id": "B3-treatment", "git_sha": "9363f877502e495a73accc562750440e922ab38e", "pre_experiment_sha": "9363f877502e495a73accc562750440e922ab38e", "timestamp": "2026-04-18T23:49:12.847859+00:00", "hypothesis": "Reduce repeated work by caching string lengths and skipping redundant pair deduplication after already-unique inputs.", "hypothesis_source": "agent", "mutation_diff_summary": "", "score": 91.04, "score_ci_lower": null, "score_ci_upper": null, "raw_scores": null, "baseline_score": 91.04, "outcome": "CRASHED", "failure_mode": "run_command exited with code 1: warning: `VIRTUAL_ENV=/Users/druk/WorkSpace/AetherForge/anneal/.venv` does not match the project environment path `.venv` and will be ignored; use `--active` to target the active environment instead\nTraceback (most recent call last):\n  File \"/Users/druk/WorkSpace/AetherForge/anneal/benchmarks/suite/harness/eval_b3.py\", line 124, in <module>\n    main()\n  File \"/Users/druk/WorkSpace/AetherForge/anneal/benchmarks/suite/harness/eval_b3.py\", line 116, in main\n    if not _verify_spot_checks(ARTIFACT):\n           ^^^^^^^^^^^^^^^^^^^^^^^^^^^^^\n  File \"/Users/druk/WorkSpace/AetherForge/anneal/benchmarks/suite/harness/eval_b3.py\", line 69, in _verify_spot_checks\n    pairs = find_fn(names_a, names_b, 2)\n            ^^^^^^^^^^^^^^^^^^^^^^^^^^^^\n  File \"/Users/druk/WorkSpace/AetherForge/anneal/.anneal/worktrees/B3-treatment/benchmarks/suite/artifacts/B3_utility_function.py\", line 200, in _find_close_pairs\n    for a, la in list_a:\n        ^^^^^\nValueError: too many values to unpack (expected 2)", "duration_seconds": 29.893744083005004, "tags": ["cache-lengths", "remove-redundant-pass", "local-optimization"], "learnings": "{\"what_changed\":\"\",\"what_improved\":[],\"what_regressed\":[],\"transferable_insight\":\"Optimizations that assume inputs are already normalized or unique can silently break correctness if the assumption is not universally guaranteed, so validate invariants before skipping safety checks.\",\"domain_tags\":[\"optimization\",\"correctness\",\"invariants\"]}", "cost_usd": 0.08515, "bootstrap_seed": 0, "agent_model": "gpt-5.4", "held_out_score": null, "criterion_names": null, "per_criterion_scores": null, "failure_classification": null, "drafts_generated": 1, "drafts_survived": 1}
{"id": "301b0f61-7091-4c2f-9776-9efa66254638", "target_id": "B3-treatment", "git_sha": "9363f877502e495a73accc562750440e922ab38e", "pre_experiment_sha": "9363f877502e495a73accc562750440e922ab38e", "timestamp": "2026-04-18T23:49:46.518343+00:00", "hypothesis": "Reduce inner-loop overhead by caching lengths with buckets and adding exact prefix/suffix trimming before bounded Levenshtein.", "hypothesis_source": "agent", "mutation_diff_summary": "", "score": 95.85, "score_ci_lower": null, "score_ci_upper": null, "raw_scores": null, "baseline_score": 91.04, "outcome": "DISCARDED", "failure_mode": null, "duration_seconds": 32.404845708049834, "tags": ["performance", "levenshtein", "pruning", "caching", "low-risk"], "learnings": "{\"what_changed\":\"\",\"what_improved\":[],\"what_regressed\":[],\"transferable_insight\":\"An optimization that adds extra bookkeeping and preprocessing should only be kept if it measurably reduces total work in the common case, not just the cost of a narrow inner step.\",\"domain_tags\":[\"optimization\",\"performance-engineering\",\"algorithm-design\"]}", "cost_usd": 0.089632, "bootstrap_seed": 0, "agent_model": "gpt-5.4", "held_out_score": null, "criterion_names": null, "per_criterion_scores": null, "failure_classification": {"category": "logic_error", "description": "The experiment\u2019s intended optimization (caching lengths with buckets plus exact prefix/suffix trimming before bounded Levenshtein) did not realize the expected behavior\u2014likely due to an incorrect application of trimming/bounds or an alignment bug that changes the meaning of the computed distance/matching despite maintaining a high score.", "fix_direction": "Verify the correctness of the prefix/suffix trimming logic and how trimmed segments affect the bounded Levenshtein window; add unit tests comparing against an unoptimized baseline for all edge cases (empty strings, full matches, near-threshold distances).", "confidence": 0.62}, "drafts_generated": 1, "drafts_survived": 1}
{"id": "c6cbbecf-0164-4469-9891-f43ab594f9d7", "target_id": "B3-treatment", "git_sha": "9363f877502e495a73accc562750440e922ab38e", "pre_experiment_sha": "9363f877502e495a73accc562750440e922ab38e", "timestamp": "2026-04-18T23:50:19.701979+00:00", "hypothesis": "Reduce hot-loop overhead by specializing threshold-2 length buckets and tightening bounded Levenshtein setup without changing results.", "hypothesis_source": "agent", "mutation_diff_summary": "", "score": 91.53, "score_ci_lower": null, "score_ci_upper": null, "raw_scores": null, "baseline_score": 91.04, "outcome": "DISCARDED", "failure_mode": null, "duration_seconds": 30.570084249950014, "tags": ["runtime", "caching", "pruning", "local-specialization"], "learnings": "{\"what_changed\":\"\",\"what_improved\":[],\"what_regressed\":[],\"transferable_insight\":\"Targeted micro-optimizations that preserve behavior can still be discarded if they add complexity without producing measurable gains, so validate them against clear performance evidence before adopting them.\",\"domain_tags\":[\"performance-optimization\",\"software-engineering\",\"experimentation\"]}", "cost_usd": 0.0863952, "bootstrap_seed": 0, "agent_model": "gpt-5.4", "held_out_score": null, "criterion_names": null, "per_criterion_scores": null, "failure_classification": {"category": "logic_error", "description": "The provided report lacks details about the failure mode. Only a hypothesis and an overall score are given, but no indication of what specifically failed (e.g., output format, logic, regression, parse error).", "fix_direction": "Capture concrete failure signals (error logs, diff/patch boundaries, failing test name/assertion, and what output/behavior differed) to determine whether the issue is format/schema, logic, unintended behavioral change, or out-of-scope edits.", "confidence": 0.12}, "drafts_generated": 1, "drafts_survived": 1}
{"id": "ea6ad82f-4a78-4b62-9eb7-969d596c10a5", "target_id": "B3-treatment", "git_sha": "d8f35925f276de9c90b8aed1d716e0733acbf1b6", "pre_experiment_sha": "9363f877502e495a73accc562750440e922ab38e", "timestamp": "2026-04-18T23:50:53.981262+00:00", "hypothesis": "Cache candidate string lengths in the length buckets to reduce repeated len calls and tighten hot-loop work without changing behavior.", "hypothesis_source": "agent", "mutation_diff_summary": "", "score": 90.66, "score_ci_lower": null, "score_ci_upper": null, "raw_scores": null, "baseline_score": 91.04, "outcome": "KEPT", "failure_mode": null, "duration_seconds": 29.368682665983215, "tags": ["performance", "caching", "bounded-levenshtein", "local-change"], "learnings": "{\"what_changed\":\"\",\"what_improved\":[],\"what_regressed\":[],\"transferable_insight\":\"Caching frequently reused derived values can reduce repeated work in hot paths, but if the optimization does not meaningfully change the dominant cost it may yield no measurable improvement.\",\"domain_tags\":[\"performance-optimization\",\"caching\",\"hot-path\"]}", "cost_usd": 0.08546000000000001, "bootstrap_seed": 0, "agent_model": "gpt-5.4", "held_out_score": null, "criterion_names": null, "per_criterion_scores": null, "failure_classification": null, "drafts_generated": 1, "drafts_survived": 1}
{"id": "2be5f539-e3d7-4423-9ea0-edafbbcb6047", "target_id": "B3-treatment", "git_sha": "d8f35925f276de9c90b8aed1d716e0733acbf1b6", "pre_experiment_sha": "d8f35925f276de9c90b8aed1d716e0733acbf1b6", "timestamp": "2026-04-18T23:51:25.018336+00:00", "hypothesis": "Cache string lengths alongside bucketed names and avoid redundant tuple storage/lookups in the hot matching loop.", "hypothesis_source": "agent", "mutation_diff_summary": "", "score": 90.66, "score_ci_lower": null, "score_ci_upper": null, "raw_scores": null, "baseline_score": 90.66, "outcome": "CRASHED", "failure_mode": "run_command exited with code 1: warning: `VIRTUAL_ENV=/Users/druk/WorkSpace/AetherForge/anneal/.venv` does not match the project environment path `.venv` and will be ignored; use `--active` to target the active environment instead\nTraceback (most recent call last):\n  File \"/Users/druk/WorkSpace/AetherForge/anneal/benchmarks/suite/harness/eval_b3.py\", line 124, in <module>\n    main()\n  File \"/Users/druk/WorkSpace/AetherForge/anneal/benchmarks/suite/harness/eval_b3.py\", line 116, in main\n    if not _verify_spot_checks(ARTIFACT):\n           ^^^^^^^^^^^^^^^^^^^^^^^^^^^^^\n  File \"/Users/druk/WorkSpace/AetherForge/anneal/benchmarks/suite/harness/eval_b3.py\", line 69, in _verify_spot_checks\n    pairs = find_fn(names_a, names_b, 2)\n            ^^^^^^^^^^^^^^^^^^^^^^^^^^^^\n  File \"/Users/druk/WorkSpace/AetherForge/anneal/.anneal/worktrees/B3-treatment/benchmarks/suite/artifacts/B3_utility_function.py\", line 200, in _find_close_pairs\n    for a, la in list_a:\n        ^^^^^\nValueError: too many values to unpack (expected 2)", "duration_seconds": 30.122378916013986, "tags": ["caching", "lengths", "allocations", "hot-loop"], "learnings": "{\"what_changed\":\"\",\"what_improved\":[],\"what_regressed\":[],\"transferable_insight\":\"Optimizations that add caching or structural changes should be validated for correctness and end-to-end impact, because reducing apparent work in a hot path can still introduce crashes or no measurable gain if the new data flow is inconsistent.\",\"domain_tags\":[\"performance-optimization\",\"reliability\",\"systems-design\"]}", "cost_usd": 0.08579, "bootstrap_seed": 0, "agent_model": "gpt-5.4", "held_out_score": null, "criterion_names": null, "per_criterion_scores": null, "failure_classification": null, "drafts_generated": 1, "drafts_survived": 1}
