{"id": "657c1ea7-8a8e-42a1-bc4f-c780aeda3278", "target_id": "B3-treatment", "git_sha": "9b1d7dfeed163f002312d53bee0337a7fc6c19d9", "pre_experiment_sha": "4500e36e6a17b978006a35ffaf5614bc60c8a6a1", "timestamp": "2026-04-22T21:43:16.997739+00:00", "hypothesis": "Defer intermediate variable assignments (`m1_ok`, `m2_ok`, `m1`, `m3_ok`) in the threshold=2 fast-paths until `diff >= 4`, completely eliminating assignment overhead for `diff == 3`, which is the most common case that passes the exact-match fast-fail guards.", "hypothesis_source": "agent", "mutation_diff_summary": "", "score": 5.92, "score_ci_lower": null, "score_ci_upper": null, "raw_scores": null, "baseline_score": 5.89, "outcome": "KEPT", "failure_mode": null, "duration_seconds": 263.85649491706863, "tags": ["micro-optimization", "variable-elimination", "fast-path"], "learnings": "{\"what_changed\":\"\",\"what_improved\":[],\"what_regressed\":[],\"transferable_insight\":\"Delaying the initialization of intermediate variables until they are strictly needed eliminates overhead in the most frequent execution paths.\",\"domain_tags\":[\"Performance Optimization\",\"Lazy Evaluation\",\"Fast-path Optimization\"]}", "cost_usd": 0.10342125, "bootstrap_seed": 0, "agent_model": "gemini-3.1-pro-preview", "held_out_score": null, "criterion_names": null, "per_criterion_scores": null, "failure_classification": null, "drafts_generated": 1, "drafts_survived": 1}
{"id": "cecb2e54-89f2-46cc-b0aa-dd9f8cb71485", "target_id": "B3-treatment", "git_sha": "0a892448cf5391c3f5d507cf94d48a27ea429ebd", "pre_experiment_sha": "9b1d7dfeed163f002312d53bee0337a7fc6c19d9", "timestamp": "2026-04-22T21:47:14.204187+00:00", "hypothesis": "Restore short-circuiting compound conditions for the `diff <= 2` fast-paths and completely eliminate intermediate variable assignment overhead (`m1_ok`, `m2_ok`, etc.) by fully inlining invariant character comparisons into the exact-match branch conditions, maximizing short-circuiting for the >90% of mismatched strings.", "hypothesis_source": "agent", "mutation_diff_summary": "", "score": 5.72, "score_ci_lower": null, "score_ci_upper": null, "raw_scores": null, "baseline_score": 5.92, "outcome": "KEPT", "failure_mode": null, "duration_seconds": 207.77053837501444, "tags": ["micro-optimization", "branch-elimination", "variable-elimination", "fast-path", "short-circuiting"], "learnings": "{\"what_changed\":\"\",\"what_improved\":[],\"what_regressed\":[],\"transferable_insight\":\"Eliminating intermediate variable assignments by directly inlining conditional checks maximizes short-circuit evaluation efficiency, yielding significant performance gains when the majority of cases fail early.\",\"domain_tags\":[\"Performance Optimization\",\"Code Refactoring\",\"Execution Efficiency\"]}", "cost_usd": 0.10905875000000001, "bootstrap_seed": 0, "agent_model": "gemini-3.1-pro-preview", "held_out_score": null, "criterion_names": null, "per_criterion_scores": null, "failure_classification": null, "drafts_generated": 1, "drafts_survived": 1}
{"id": "253c1858-0fd8-4300-b448-66e1c116a1a9", "target_id": "B3-treatment", "git_sha": "84d3f96debedbf701d5bed083a37c769d0a7a648", "pre_experiment_sha": "0a892448cf5391c3f5d507cf94d48a27ea429ebd", "timestamp": "2026-04-22T21:52:17.369521+00:00", "hypothesis": "Eliminate redundant character evaluations in the unrolled `diff >= 4` fast-paths by nesting them inside the exact-match base conditions, drastically reducing bytecode size and execution overhead while preserving O(1) index offsets and short-circuiting.", "hypothesis_source": "agent", "mutation_diff_summary": "", "score": 5.7, "score_ci_lower": null, "score_ci_upper": null, "raw_scores": null, "baseline_score": 5.72, "outcome": "KEPT", "failure_mode": null, "duration_seconds": 296.5642106248997, "tags": ["micro-optimization", "branch-elimination", "variable-elimination", "fast-path"], "learnings": "{\"what_changed\":\"\",\"what_improved\":[],\"what_regressed\":[],\"transferable_insight\":\"Nesting secondary checks within prerequisite base conditions eliminates redundant evaluations, reducing execution overhead and compiled code size.\",\"domain_tags\":[\"Code Optimization\",\"Performance Engineering\",\"Algorithm Design\"]}", "cost_usd": 0.10151375000000001, "bootstrap_seed": 0, "agent_model": "gemini-3.1-pro-preview", "held_out_score": null, "criterion_names": null, "per_criterion_scores": null, "failure_classification": null, "drafts_generated": 1, "drafts_survived": 1}
