{"id": "b545ba35-0117-4c82-86ee-3be3bb5ac3f7", "target_id": "B3-treatment", "git_sha": "16ed36a467fa740a6e8d972b9bb09da67337c3ab", "pre_experiment_sha": "16ed36a467fa740a6e8d972b9bb09da67337c3ab", "timestamp": "2026-04-23T15:20:40.853106+00:00", "hypothesis": "By fully inlining the bounded Levenshtein distance check, optimizing deletion neighborhood generation with direct string slicing and list comprehensions, and removing redundant length checks (which are mathematically guaranteed by the deletion logic), we can eliminate function call overhead and significantly speed up candidate pair evaluation.", "hypothesis_source": "agent", "mutation_diff_summary": "", "score": 3.96, "score_ci_lower": null, "score_ci_upper": null, "raw_scores": null, "baseline_score": 3.47, "outcome": "DISCARDED", "failure_mode": null, "duration_seconds": 283.5219056659844, "tags": ["algorithm", "inlining", "string-manipulation", "math-optimization"], "learnings": "{\"what_changed\":\"\",\"what_improved\":[],\"what_regressed\":[],\"transferable_insight\":\"Aggressive micro-optimizations, such as manual function inlining and removing early-exit bounds checks, can paradoxically degrade overall performance by defeating interpreter optimizations or forcing the evaluation of invalid candidates.\",\"domain_tags\":[\"Software Engineering\",\"Performance Optimization\",\"Algorithm Design\"]}", "cost_usd": 0.04927555, "bootstrap_seed": 0, "agent_model": "gemini-3.1-pro-preview", "held_out_score": null, "criterion_names": null, "per_criterion_scores": null, "failure_classification": {"category": "logic_error", "description": "The experiment failed likely because the proposed optimizations introduced errors in the core logic of the bounded Levenshtein distance calculation or deletion neighborhood generation. Specifically, the assumption that certain length checks were 'mathematically guaranteed' to be redundant might have been incorrect, or the direct string slicing for neighborhood generation introduced an error in result calculation. This would lead to incorrect output for candidate pair evaluation, thus a low score, despite the intent to improve performance.", "fix_direction": "Thoroughly re-evaluate the logical correctness of the 'optimizations', particularly the removal of 'redundant' length checks and the string slicing logic. Prioritize correctness over raw performance in initial steps, ensuring that the Levenshtein distance is accurately computed under all conditions. Implement robust unit tests for the distance calculation and neighborhood generation to identify any deviations from expected behavior.", "confidence": 0.9}, "drafts_generated": 1, "drafts_survived": 1}
{"id": "fd06ad9b-c262-4afd-8043-47e6b0457995", "target_id": "B3-treatment", "git_sha": "a3fee0689f7caf36c6e40dc9447be99299e9c281", "pre_experiment_sha": "16ed36a467fa740a6e8d972b9bb09da67337c3ab", "timestamp": "2026-04-23T15:25:35.838289+00:00", "hypothesis": "Optimize SymSpell candidate generation by grouping lookups with `set.update()` to eliminate tuple allocation and Python loop overhead, and bypass `_deduplicate_pairs` since candidates are already unique.", "hypothesis_source": "agent", "mutation_diff_summary": "", "score": 3.26, "score_ci_lower": null, "score_ci_upper": null, "raw_scores": null, "baseline_score": 3.47, "outcome": "KEPT", "failure_mode": null, "duration_seconds": 255.04248054185882, "tags": ["symspell", "set-operations", "early-exit", "deduplication"], "learnings": "{\"what_changed\":\"\",\"what_improved\":[],\"what_regressed\":[],\"transferable_insight\":\"Replacing explicit application-level loops with native bulk operations and eliminating redundant data processing steps significantly reduces memory allocation and execution overhead.\",\"domain_tags\":[\"Performance Optimization\",\"Algorithm Optimization\",\"Memory Management\"]}", "cost_usd": 0.054310000000000004, "bootstrap_seed": 0, "agent_model": "gemini-3.1-pro-preview", "held_out_score": null, "criterion_names": null, "per_criterion_scores": null, "failure_classification": null, "drafts_generated": 1, "drafts_survived": 1}
{"id": "2249baf7-7f96-4402-a210-0a27ab6cbd8f", "target_id": "B3-treatment", "git_sha": "a3fee0689f7caf36c6e40dc9447be99299e9c281", "pre_experiment_sha": "a3fee0689f7caf36c6e40dc9447be99299e9c281", "timestamp": "2026-04-23T15:29:44.200204+00:00", "hypothesis": "Replace the SymSpell-inspired deletion dictionary approach with highly optimized inline pairwise comparisons bounded by string lengths, leveraging fast Python C-level slicing, prefix/suffix stripping, and `~q` negative indexing to eliminate function call and dictionary allocation overhead.", "hypothesis_source": "agent", "mutation_diff_summary": "", "score": 12.59, "score_ci_lower": null, "score_ci_upper": null, "raw_scores": null, "baseline_score": 3.26, "outcome": "DISCARDED", "failure_mode": null, "duration_seconds": 240.50995020801201, "tags": ["algorithm", "inlining", "string-matching", "fast-path"], "learnings": "{\"what_changed\":\"\",\"what_improved\":[],\"what_regressed\":[],\"transferable_insight\":\"Replacing pre-computed lookup structures with optimized on-the-fly calculations often degrades overall performance, as the algorithmic cost of repeated evaluation typically outweighs the overhead of memory allocation and retrieval.\",\"domain_tags\":[\"Algorithm Optimization\",\"Performance Tuning\",\"Data Structures\"]}", "cost_usd": 0.04971935, "bootstrap_seed": 0, "agent_model": "gemini-3.1-pro-preview", "held_out_score": null, "criterion_names": null, "per_criterion_scores": null, "failure_classification": {"category": "logic_error", "description": "The hypothesis proposed replacing a SymSpell-inspired deletion dictionary with highly optimized inline pairwise comparisons. The extremely low score (12.5900) indicates that the new comparison logic, despite its optimization goals, is fundamentally flawed in its reasoning or calculation of string similarity. This likely results in incorrect matching, failure to identify correct suggestions, or mishandling of various string comparison scenarios, leading to a severe degradation in performance or accuracy compared to the previous method. The 'unknown' failure mode suggests the system likely ran but produced consistently poor or invalid results.", "fix_direction": "Thoroughly re-evaluate and validate the core logic of the inline pairwise comparison algorithm. Focus on: 1) **Correctness:** Verify the accuracy of the comparison logic for different edit types (deletions, insertions, substitutions, transpositions) through isolated unit tests. 2) **Completeness:** Ensure the algorithm covers all necessary string similarity cases and correctly handles edge scenarios like varying string lengths, prefix/suffix differences, and negative indexing. 3) **Debugging:** Instrument the new comparison functions to trace intermediate results and identify where the logic diverges from expected behavior. 4) **Benchmarking:** Compare the outputs and performance of the new logic against a known correct implementation or the original SymSpell approach on a controlled dataset.", "confidence": 0.9}, "drafts_generated": 1, "drafts_survived": 1}
{"id": "17a5ceba-766a-462a-a572-87dea4a1d6c4", "target_id": "B3-treatment", "git_sha": "a3fee0689f7caf36c6e40dc9447be99299e9c281", "pre_experiment_sha": "a3fee0689f7caf36c6e40dc9447be99299e9c281", "timestamp": "2026-04-23T15:34:26.580394+00:00", "hypothesis": "Optimize SymSpell deletion neighborhood generation using list comprehensions and bulk `set.update()` to eliminate O(N^2) Python loop overhead, cache shared deletion sets between lists, and use a faster two-array 1D DP for the fallback unbounded Levenshtein distance.", "hypothesis_source": "agent", "mutation_diff_summary": "", "score": 3.84, "score_ci_lower": null, "score_ci_upper": null, "raw_scores": null, "baseline_score": 3.26, "outcome": "DISCARDED", "failure_mode": null, "duration_seconds": 241.6359833329916, "tags": ["symspell-optimization", "list-comprehensions", "bounds-checking", "dp-optimization"], "learnings": "{\"what_changed\":\"\",\"what_improved\":[],\"what_regressed\":[],\"transferable_insight\":\"Micro-optimizing loop overhead and caching intermediate states may not provide sufficient practical performance gains to justify the resulting increase in code complexity.\",\"domain_tags\":[\"Performance Optimization\",\"Algorithm Design\",\"Code Complexity\"]}", "cost_usd": 0.0566153, "bootstrap_seed": 0, "agent_model": "gemini-3.1-pro-preview", "held_out_score": null, "criterion_names": null, "per_criterion_scores": null, "failure_classification": {"category": "logic_error", "description": "The proposed optimizations for SymSpell, including the use of list comprehensions, bulk set updates, caching of deletion sets, and the two-array 1D DP for Levenshtein distance, were likely implemented with incorrect reasoning or calculation. This could have led to either: 1) The optimizations failing to provide the expected performance benefits (e.g., O(N^2) overhead not truly eliminated, or new constant factors making it slower), or 2) The generation of incorrect deletion neighborhoods or miscalculation of Levenshtein distances, leading to functional errors and a poor score. The 'unknown' failure mode suggests a subtle algorithmic flaw rather than an obvious crash or formatting issue.", "fix_direction": "Thoroughly review and debug the implementation of each optimization strategy. For the deletion neighborhood generation, verify the correctness of the list comprehensions and `set.update()` logic, ensuring it correctly generates all intended deletions without introducing new inefficiencies. For shared deletion set caching, validate the caching mechanism's keys, hit rates, and potential for stale data. For the two-array 1D DP, rigorously test its correctness against a known-good Levenshtein implementation, particularly with edge cases and varying string lengths. Implement granular unit tests for each optimized component to isolate and identify specific logical errors.", "confidence": 0.9}, "drafts_generated": 1, "drafts_survived": 1}
{"id": "6c971bc7-6217-4755-9f38-92f81e65b641", "target_id": "B3-treatment", "git_sha": "a3fee0689f7caf36c6e40dc9447be99299e9c281", "pre_experiment_sha": "a3fee0689f7caf36c6e40dc9447be99299e9c281", "timestamp": "2026-04-23T15:39:01.990929+00:00", "hypothesis": "Optimize SymSpell deletion generation by cascading 1-deletions to avoid redundant string allocations, and generalize the inline distance <= 2 check to use O(1) C-level string slicing instead of character-by-character iteration.", "hypothesis_source": "agent", "mutation_diff_summary": "", "score": 4.49, "score_ci_lower": null, "score_ci_upper": null, "raw_scores": null, "baseline_score": 3.26, "outcome": "DISCARDED", "failure_mode": null, "duration_seconds": 250.14455608301796, "tags": ["symspell", "string-manipulation", "algorithmic-optimization", "loop-unrolling"], "learnings": "{\"what_changed\":\"\",\"what_improved\":[],\"what_regressed\":[],\"transferable_insight\":\"Replacing native iterative processing with lower-level memory slicing and cascading allocations can introduce overhead that outweighs the expected performance benefits.\",\"domain_tags\":[\"Performance Optimization\",\"String Manipulation\",\"Memory Management\"]}", "cost_usd": 0.0530587, "bootstrap_seed": 0, "agent_model": "gemini-3.1-pro-preview", "held_out_score": null, "criterion_names": null, "per_criterion_scores": null, "failure_classification": {"category": "logic_error", "description": "The proposed optimization for SymSpell deletion generation, involving 'cascading 1-deletions' or 'C-level string slicing', likely contained a flaw in its implementation or underlying reasoning. This logic error could have led to incorrect deletions, unexpected performance issues (including regressions), or an inability to achieve the intended optimization, resulting in the experiment's failure, whose specific mode remained unknown.", "fix_direction": "Thoroughly review the algorithmic details and implementation of both the cascading deletion logic and the C-level string slicing. Implement comprehensive unit tests to verify the correctness of generated deletions at each stage. Add detailed profiling and logging to pinpoint where the performance bottleneck or incorrect behavior occurs, especially comparing against the baseline. Consider isolating and testing each optimization aspect independently.", "confidence": 0.9}, "drafts_generated": 1, "drafts_survived": 1}
{"id": "b4943fa7-11a4-49cb-91a2-4b5bb3055482", "target_id": "B3-treatment", "git_sha": "fb40545be0c7835ccc42861eda1c031b2d18f825", "pre_experiment_sha": "a3fee0689f7caf36c6e40dc9447be99299e9c281", "timestamp": "2026-04-23T15:42:52.040201+00:00", "hypothesis": "Optimize SymSpell candidate generation loops, replace slow Python `while` loops with C-level `range` and bitwise NOT indexing for prefix/suffix stripping, and remove dead code and redundant bounds checks.", "hypothesis_source": "agent", "mutation_diff_summary": "", "score": 3.31, "score_ci_lower": null, "score_ci_upper": null, "raw_scores": null, "baseline_score": 3.26, "outcome": "KEPT", "failure_mode": null, "duration_seconds": 210.90917054214515, "tags": ["symspell", "loop-optimization", "string-slicing"], "learnings": "{\"what_changed\":\"\",\"what_improved\":[],\"what_regressed\":[],\"transferable_insight\":\"Replacing interpreted loop constructs with native, lower-level equivalents and eliminating redundant bounds checks improves overall execution efficiency.\",\"domain_tags\":[\"Performance Optimization\",\"Code Refactoring\",\"Algorithm Efficiency\"]}", "cost_usd": 0.04850125, "bootstrap_seed": 0, "agent_model": "gemini-3.1-pro-preview", "held_out_score": null, "criterion_names": null, "per_criterion_scores": null, "failure_classification": null, "drafts_generated": 1, "drafts_survived": 1}
{"id": "319fdc41-16bf-4ab1-ad13-766b6f23a3c3", "target_id": "B3-treatment", "git_sha": "ab1916c69bc7e071f30d57f3d48dc0a6b16955db", "pre_experiment_sha": "fb40545be0c7835ccc42861eda1c031b2d18f825", "timestamp": "2026-04-23T15:47:16.994130+00:00", "hypothesis": "Optimize bounded Levenshtein distance by replacing redundant string slicing with direct slice concatenation for 2-deletions, utilizing `collections.defaultdict` for faster C-level list appends, and streamlining the inline distance verification logic.", "hypothesis_source": "agent", "mutation_diff_summary": "", "score": 3.93, "score_ci_lower": null, "score_ci_upper": null, "raw_scores": null, "baseline_score": 3.31, "outcome": "KEPT", "failure_mode": null, "duration_seconds": 244.75042641698383, "tags": ["symspell", "string-slicing", "defaultdict", "inline-optimization"], "learnings": "{\"what_changed\":\"\",\"what_improved\":[],\"what_regressed\":[],\"transferable_insight\":\"Algorithmic performance can be significantly improved by eliminating redundant intermediate object creations in favor of direct operations and leveraging optimized standard library data structures for underlying memory management.\",\"domain_tags\":[\"Algorithm Optimization\",\"Performance Tuning\",\"Data Structures\"]}", "cost_usd": 0.0474375, "bootstrap_seed": 0, "agent_model": "gemini-3.1-pro-preview", "held_out_score": null, "criterion_names": null, "per_criterion_scores": null, "failure_classification": null, "drafts_generated": 1, "drafts_survived": 1}
{"id": "19f3e09f-ce6f-4c7e-8cac-e121896ca722", "target_id": "B3-treatment", "git_sha": "3ba28d94b9ed01fe8b17478840c211809d8f3e1b", "pre_experiment_sha": "ab1916c69bc7e071f30d57f3d48dc0a6b16955db", "timestamp": "2026-04-23T15:51:29.082929+00:00", "hypothesis": "Optimize SymSpell deletion generation by replacing nested Python loops with fast C-level set comprehensions, eliminating Python loop overhead while preserving the highly optimized custom distance verification logic.", "hypothesis_source": "agent", "mutation_diff_summary": "", "score": 4.15, "score_ci_lower": null, "score_ci_upper": null, "raw_scores": null, "baseline_score": 3.93, "outcome": "KEPT", "failure_mode": null, "duration_seconds": 245.336518707918, "tags": ["set-comprehension", "symspell", "inline-optimizations"], "learnings": "{\"what_changed\":\"\",\"what_improved\":[],\"what_regressed\":[],\"transferable_insight\":\"Replacing nested loops in high-level interpreted languages with native, lower-level constructs significantly reduces execution overhead and improves performance.\",\"domain_tags\":[\"Performance Optimization\",\"Software Engineering\",\"Algorithm Implementation\"]}", "cost_usd": 0.0466475, "bootstrap_seed": 0, "agent_model": "gemini-3.1-pro-preview", "held_out_score": null, "criterion_names": null, "per_criterion_scores": null, "failure_classification": null, "drafts_generated": 1, "drafts_survived": 1}
{"id": "078568a6-b997-4a7e-a94c-b0dbe2c82c12", "target_id": "B3-treatment", "git_sha": "1e449f748cc39352377dcd2ce76ebbeeb6f07c43", "pre_experiment_sha": "3ba28d94b9ed01fe8b17478840c211809d8f3e1b", "timestamp": "2026-04-23T15:56:01.441249+00:00", "hypothesis": "Replace the character-by-character inner verification logic with O(1) string slicing checks that exhaustively cover all edit sequences for distance <= 2, strictly avoiding Python loop overhead.", "hypothesis_source": "agent", "mutation_diff_summary": "", "score": 4.32, "score_ci_lower": null, "score_ci_upper": null, "raw_scores": null, "baseline_score": 4.15, "outcome": "KEPT", "failure_mode": null, "duration_seconds": 264.4531485000625, "tags": ["symspell", "string-slicing", "algorithmic-simplification", "loop-elimination"], "learnings": "{\"what_changed\":\"\",\"what_improved\":[],\"what_regressed\":[],\"transferable_insight\":\"Replacing iterative element-by-element verification with exhaustive, constant-time slicing checks for bounded conditions eliminates loop overhead and improves execution speed.\",\"domain_tags\":[\"Algorithm Optimization\",\"Performance Tuning\",\"String Processing\"]}", "cost_usd": 0.047297500000000006, "bootstrap_seed": 0, "agent_model": "gemini-3.1-pro-preview", "held_out_score": null, "criterion_names": null, "per_criterion_scores": null, "failure_classification": null, "drafts_generated": 1, "drafts_survived": 1}
{"id": "b7717a3a-8234-4961-ab7a-ffcd7a33ebec", "target_id": "B3-treatment", "git_sha": "ebd0886a0c226e9718f891df7228a0857193fb34", "pre_experiment_sha": "1e449f748cc39352377dcd2ce76ebbeeb6f07c43", "timestamp": "2026-04-23T16:00:20.367592+00:00", "hypothesis": "Optimize string distance verification by eliminating redundant bounds calculations and pre-computing slice indices, while maintaining fast SymSpell-inspired C-level set comprehensions for candidate generation.", "hypothesis_source": "agent", "mutation_diff_summary": "", "score": 4.28, "score_ci_lower": null, "score_ci_upper": null, "raw_scores": null, "baseline_score": 4.32, "outcome": "KEPT", "failure_mode": null, "duration_seconds": 225.09358475008048, "tags": ["optimization", "string-matching", "symspell", "slicing"], "learnings": "{\"what_changed\":\"\",\"what_improved\":[],\"what_regressed\":[],\"transferable_insight\":\"Pre-computing boundary indices and eliminating redundant validation checks significantly optimizes the performance of search and verification algorithms.\",\"domain_tags\":[\"Performance Optimization\",\"Algorithm Design\",\"Search Algorithms\"]}", "cost_usd": 0.04675625, "bootstrap_seed": 0, "agent_model": "gemini-3.1-pro-preview", "held_out_score": null, "criterion_names": null, "per_criterion_scores": null, "failure_classification": null, "drafts_generated": 1, "drafts_survived": 1}
{"id": "a8200ddc-1207-48b9-8594-7e9b4ee943b8", "target_id": "B3-treatment", "git_sha": "c8aeb9fd7103b995188ae46a3a5ac51342cadf71", "pre_experiment_sha": "ebd0886a0c226e9718f891df7228a0857193fb34", "timestamp": "2026-04-23T16:09:13.839420+00:00", "hypothesis": "Optimize SymSpell candidate generation by handling 0-deletions separately to avoid unnecessary set hashing, inline the distance threshold bounds since SymSpell guarantees length differences <= 2, and use fast C-level string slicing for O(1) distance verification.", "hypothesis_source": "agent", "mutation_diff_summary": "", "score": 4.35, "score_ci_lower": null, "score_ci_upper": null, "raw_scores": null, "baseline_score": 4.28, "outcome": "KEPT", "failure_mode": null, "duration_seconds": 225.38785437494516, "tags": ["symspell", "set-comprehension", "string-slicing", "bounds-elimination", "micro-optimization"], "learnings": "{\"what_changed\":\"\",\"what_improved\":[],\"what_regressed\":[],\"transferable_insight\":\"Isolating base cases to bypass expensive operations, hardcoding known constraints, and leveraging low-level memory operations for constant-time checks significantly improves algorithmic efficiency.\",\"domain_tags\":[\"Algorithm Optimization\",\"Performance Engineering\",\"String Processing\"]}", "cost_usd": 0.047038750000000004, "bootstrap_seed": 0, "agent_model": "gemini-3.1-pro-preview", "held_out_score": null, "criterion_names": null, "per_criterion_scores": null, "failure_classification": null, "drafts_generated": 1, "drafts_survived": 1}
