{"id": "14e05d67-3a6f-41ad-afd1-defd986ab88b", "target_id": "B3-treatment", "git_sha": "44bc4c4d0d3efccdac9c1ea4551cca3206d067dc", "pre_experiment_sha": "c8aeb9fd7103b995188ae46a3a5ac51342cadf71", "timestamp": "2026-04-23T16:13:34.689539+00:00", "hypothesis": "Optimize SymSpell deletion generation using fast set comprehensions, eliminate redundant candidate deduplication, and inline an exhaustive O(1) string slicing verification for distance <= 2 to bypass character-by-character loops.", "hypothesis_source": "agent", "mutation_diff_summary": "", "score": 4.12, "score_ci_lower": null, "score_ci_upper": null, "raw_scores": null, "baseline_score": 4.35, "outcome": "KEPT", "failure_mode": null, "duration_seconds": 234.97506433399394, "tags": ["symspell", "set-comprehension", "string-slicing", "loop-elimination", "algorithm-optimization"], "learnings": "{\"what_changed\":\"\",\"what_improved\":[],\"what_regressed\":[],\"transferable_insight\":\"Replacing iterative element-by-element checks with native slicing operations for bounded cases and utilizing native set structures to eliminate redundant deduplication significantly optimizes algorithmic performance.\",\"domain_tags\":[\"Algorithm Optimization\",\"Performance Tuning\",\"String Processing\"]}", "cost_usd": 0.04669, "bootstrap_seed": 0, "agent_model": "gemini-3.1-pro-preview", "held_out_score": null, "criterion_names": null, "per_criterion_scores": null, "failure_classification": null, "drafts_generated": 1, "drafts_survived": 1}
{"id": "5aaedf7c-da6d-41a3-9931-404cbfdaf9a4", "target_id": "B3-treatment", "git_sha": "7803c9807c32799de533b0346e4ff08781778610", "pre_experiment_sha": "44bc4c4d0d3efccdac9c1ea4551cca3206d067dc", "timestamp": "2026-04-23T16:17:52.123312+00:00", "hypothesis": "Optimize candidate generation by avoiding redundant set unions (`dels.add(a)`), remove the mathematically redundant `diff > 2` check (SymSpell with 2 deletions guarantees `abs(la - lb) <= 2`), and extract the `a == b` identity check outside the verification loop for faster execution.", "hypothesis_source": "agent", "mutation_diff_summary": "", "score": 4.01, "score_ci_lower": null, "score_ci_upper": null, "raw_scores": null, "baseline_score": 4.12, "outcome": "KEPT", "failure_mode": null, "duration_seconds": 247.9182911249809, "tags": ["symspell", "set-operations", "loop-optimization", "bounds-elimination"], "learnings": "{\"what_changed\":\"\",\"what_improved\":[],\"what_regressed\":[],\"transferable_insight\":\"Execution performance can be optimized by eliminating mathematically redundant condition checks and hoisting invariant identity checks outside of iterative loops.\",\"domain_tags\":[\"Algorithm Optimization\",\"Performance Tuning\",\"Code Refactoring\"]}", "cost_usd": 0.0468825, "bootstrap_seed": 0, "agent_model": "gemini-3.1-pro-preview", "held_out_score": null, "criterion_names": null, "per_criterion_scores": null, "failure_classification": null, "drafts_generated": 1, "drafts_survived": 1}
{"id": "73bbfa42-3bae-4dac-9c7a-d7ec1bccd03a", "target_id": "B3-treatment", "git_sha": "40a0e20459baec53210860489f90ef9292b6998f", "pre_experiment_sha": "7803c9807c32799de533b0346e4ff08781778610", "timestamp": "2026-04-23T16:22:34.566913+00:00", "hypothesis": "Optimize the verification step by avoiding redundant string slices, simplify the length difference checks to avoid negation overhead, and use `filter(None, map(...))` to push the candidate lookup loop entirely into C for maximum performance.", "hypothesis_source": "agent", "mutation_diff_summary": "", "score": 3.99, "score_ci_lower": null, "score_ci_upper": null, "raw_scores": null, "baseline_score": 4.01, "outcome": "KEPT", "failure_mode": null, "duration_seconds": 273.5590979589615, "tags": ["optimization", "c-level-loop", "string-slicing"], "learnings": "{\"what_changed\":\"\",\"what_improved\":[],\"what_regressed\":[],\"transferable_insight\":\"Pushing iterative operations to native built-in functions and eliminating redundant memory allocations significantly enhances execution performance.\",\"domain_tags\":[\"Performance Optimization\",\"Code Refactoring\",\"Algorithm Efficiency\"]}", "cost_usd": 0.04666, "bootstrap_seed": 0, "agent_model": "gemini-3.1-pro-preview", "held_out_score": null, "criterion_names": null, "per_criterion_scores": null, "failure_classification": null, "drafts_generated": 1, "drafts_survived": 1}
{"id": "ed6fd0dc-4e7b-4322-abf7-3b2f4f2e3eca", "target_id": "B3-treatment", "git_sha": "9229ce4dd5f451626f65ccee64bfb2cdcca1bb5d", "pre_experiment_sha": "40a0e20459baec53210860489f90ef9292b6998f", "timestamp": "2026-04-23T16:26:53.369936+00:00", "hypothesis": "Optimize SymSpell candidate generation by handling 0-deletions separately to avoid unnecessary set hashing, using C-level variadic `set().union(*...)` for bulk candidate merging, and removing mathematically redundant length difference checks guaranteed by the deletion neighborhood logic.", "hypothesis_source": "agent", "mutation_diff_summary": "", "score": 4.29, "score_ci_lower": null, "score_ci_upper": null, "raw_scores": null, "baseline_score": 3.99, "outcome": "KEPT", "failure_mode": null, "duration_seconds": 235.89092354197055, "tags": ["symspell", "set-operations", "c-level-optimizations", "algorithmic-simplification"], "learnings": "{\"what_changed\":\"\",\"what_improved\":[],\"what_regressed\":[],\"transferable_insight\":\"Algorithm performance can be significantly improved by isolating base cases to bypass overhead, leveraging native bulk operations for data merging, and eliminating validation checks that are already mathematically guaranteed by the system's structural logic.\",\"domain_tags\":[\"Algorithm Optimization\",\"Performance Engineering\",\"Code Refactoring\"]}", "cost_usd": 0.04668125000000001, "bootstrap_seed": 0, "agent_model": "gemini-3.1-pro-preview", "held_out_score": null, "criterion_names": null, "per_criterion_scores": null, "failure_classification": null, "drafts_generated": 1, "drafts_survived": 1}
{"id": "72a4dabb-e0a2-44cb-adbc-348988331253", "target_id": "B3-treatment", "git_sha": "92bb7c3c8f6d4868eba7d42d101dae98c8bf52eb", "pre_experiment_sha": "9229ce4dd5f451626f65ccee64bfb2cdcca1bb5d", "timestamp": "2026-04-23T16:30:30.764322+00:00", "hypothesis": "Simplify and accelerate candidate generation by adding the original string `a` directly to the `dels` set, removing redundant `if limit > 0` checks in the prefix/suffix stripping loops, and streamlining the length difference logic to minimize Python branching overhead.", "hypothesis_source": "agent", "mutation_diff_summary": "", "score": 4.24, "score_ci_lower": null, "score_ci_upper": null, "raw_scores": null, "baseline_score": 4.29, "outcome": "KEPT", "failure_mode": null, "duration_seconds": 205.2770129169803, "tags": ["symspell", "optimization", "c-level-operations", "algorithmic-simplification"], "learnings": "{\"what_changed\":\"\",\"what_improved\":[],\"what_regressed\":[],\"transferable_insight\":\"Eliminating redundant conditional checks and streamlining base-case logic reduces branching overhead and accelerates execution.\",\"domain_tags\":[\"Software Engineering\",\"Performance Optimization\",\"Algorithm Design\"]}", "cost_usd": 0.04606875, "bootstrap_seed": 0, "agent_model": "gemini-3.1-pro-preview", "held_out_score": null, "criterion_names": null, "per_criterion_scores": null, "failure_classification": null, "drafts_generated": 1, "drafts_survived": 1}
{"id": "303ac7fc-dede-4911-a022-dcd05bc10ba8", "target_id": "B3-treatment", "git_sha": "b255f6751855b4aeba9bcf087a90d91df49e8f3f", "pre_experiment_sha": "92bb7c3c8f6d4868eba7d42d101dae98c8bf52eb", "timestamp": "2026-04-23T16:34:30.644253+00:00", "hypothesis": "Optimize bounded Levenshtein distance by pre-calculating string slice bounds, avoiding redundant index calculations (`end_t`), and ensuring all candidate generation loops are fully pushed to C-level set comprehensions and `filter(None, map(...))` constructs.", "hypothesis_source": "agent", "mutation_diff_summary": "", "score": 3.92, "score_ci_lower": null, "score_ci_upper": null, "raw_scores": null, "baseline_score": 4.24, "outcome": "KEPT", "failure_mode": null, "duration_seconds": 232.7686436669901, "tags": ["symspell", "string-slicing", "c-loop-optimization", "fast-path"], "learnings": "{\"what_changed\":\"\",\"what_improved\":[],\"what_regressed\":[],\"transferable_insight\":\"Pre-computing operational boundaries and delegating iterative loops to lower-level native constructs eliminates redundant calculations and significantly improves execution efficiency.\",\"domain_tags\":[\"Performance Optimization\",\"Algorithm Design\",\"Code Efficiency\"]}", "cost_usd": 0.046040000000000005, "bootstrap_seed": 0, "agent_model": "gemini-3.1-pro-preview", "held_out_score": null, "criterion_names": null, "per_criterion_scores": null, "failure_classification": null, "drafts_generated": 1, "drafts_survived": 1}
{"id": "d774bce4-b91c-42f3-8646-4e94942d88f7", "target_id": "B3-treatment", "git_sha": "b255f6751855b4aeba9bcf087a90d91df49e8f3f", "pre_experiment_sha": "b255f6751855b4aeba9bcf087a90d91df49e8f3f", "timestamp": "2026-04-23T16:39:11.769270+00:00", "hypothesis": "Optimize bounded Levenshtein distance by replacing character-by-character verification with O(1) string slicing checks, streamlining SymSpell deletion generation, and using fast C-level iterators for candidate merging.", "hypothesis_source": "agent", "mutation_diff_summary": "", "score": 4.38, "score_ci_lower": null, "score_ci_upper": null, "raw_scores": null, "baseline_score": 3.92, "outcome": "DISCARDED", "failure_mode": null, "duration_seconds": 250.5246767080389, "tags": ["symspell", "string-slicing", "algorithmic-optimization"], "learnings": "{\"what_changed\":\"\",\"what_improved\":[],\"what_regressed\":[],\"transferable_insight\":\"Replacing granular iterative checks with bulk operations and native iterators can fail to improve performance if the hidden overheads of memory allocation and boundary-crossing outweigh the theoretical algorithmic gains.\",\"domain_tags\":[\"Performance Optimization\",\"Algorithm Design\",\"String Processing\"]}", "cost_usd": 0.04603190000000001, "bootstrap_seed": 0, "agent_model": "gemini-3.1-pro-preview", "held_out_score": null, "criterion_names": null, "per_criterion_scores": null, "failure_classification": {"category": "logic_error", "description": "The attempt to optimize bounded Levenshtein distance, SymSpell deletion generation, and candidate merging likely introduced logical flaws. The new O(1) string slicing checks, streamlined SymSpell logic, or C-level iterators may be computing incorrect distances or generating invalid/incomplete deletion sets, leading to a severely degraded accuracy or effectiveness metric and the reported low score of 4.38.", "fix_direction": "Systematically review the implementation of each optimized component for correctness. Focus on unit testing the O(1) string slicing for accurate bounded Levenshtein distance calculation, validating the completeness and correctness of SymSpell deletion generation, and ensuring proper merging logic for C-level iterators. Compare results against a known correct (even if slower) baseline implementation to identify discrepancies in output or behavior.", "confidence": 0.9}, "drafts_generated": 1, "drafts_survived": 1}
{"id": "34b88afa-9e88-4f4c-9ead-3b9fd61202f7", "target_id": "B3-treatment", "git_sha": "2ece9998e33ca32397775afeba0e79999547d93b", "pre_experiment_sha": "b255f6751855b4aeba9bcf087a90d91df49e8f3f", "timestamp": "2026-04-23T16:42:46.215790+00:00", "hypothesis": "Optimize SymSpell candidate generation by using C-level `itertools.chain.from_iterable` with `set` deduplication, and strictly use O(1) string slicing for exhaustive distance <= 2 verification to eliminate character-by-character iteration overhead.", "hypothesis_source": "agent", "mutation_diff_summary": "", "score": 4.17, "score_ci_lower": null, "score_ci_upper": null, "raw_scores": null, "baseline_score": 3.92, "outcome": "KEPT", "failure_mode": null, "duration_seconds": 188.27672162489034, "tags": ["symspell", "optimization", "string-slicing", "c-extensions"], "learnings": "{\"what_changed\":\"\",\"what_improved\":[],\"what_regressed\":[],\"transferable_insight\":\"Replacing manual element-by-element iteration with optimized native built-ins and slicing operations significantly reduces execution overhead and improves performance.\",\"domain_tags\":[\"Performance Optimization\",\"Code Optimization\",\"Algorithm Design\"]}", "cost_usd": 0.04647250000000001, "bootstrap_seed": 0, "agent_model": "gemini-3.1-pro-preview", "held_out_score": null, "criterion_names": null, "per_criterion_scores": null, "failure_classification": null, "drafts_generated": 1, "drafts_survived": 1}
{"id": "23b223cf-ec79-458b-ac9d-220d29c45eb4", "target_id": "B3-treatment", "git_sha": "fa46361eb84a3cc9168d2d182fd71bb21afb4d36", "pre_experiment_sha": "2ece9998e33ca32397775afeba0e79999547d93b", "timestamp": "2026-04-23T16:46:25.387533+00:00", "hypothesis": "Optimize SymSpell candidate verification by replacing character-by-character iteration with O(1) string slicing checks that exhaustively cover all edit sequences, inlining length difference logic, and eliminating redundant bounds calculations.", "hypothesis_source": "agent", "mutation_diff_summary": "", "score": 4.16, "score_ci_lower": null, "score_ci_upper": null, "raw_scores": null, "baseline_score": 4.17, "outcome": "KEPT", "failure_mode": null, "duration_seconds": 211.96742370910943, "tags": ["symspell", "optimization", "string-slicing", "c-level-loops", "algorithmic-simplification"], "learnings": "{\"what_changed\":\"\",\"what_improved\":[],\"what_regressed\":[],\"transferable_insight\":\"Replacing iterative element-by-element comparisons with bulk slicing operations and eliminating redundant boundary checks reduces computational overhead and improves execution speed.\",\"domain_tags\":[\"Algorithm Optimization\",\"Performance Tuning\",\"String Processing\"]}", "cost_usd": 0.046035000000000006, "bootstrap_seed": 0, "agent_model": "gemini-3.1-pro-preview", "held_out_score": null, "criterion_names": null, "per_criterion_scores": null, "failure_classification": null, "drafts_generated": 1, "drafts_survived": 1}
{"id": "fb5c1d2d-d97a-4475-9757-154056aa7e5d", "target_id": "B3-treatment", "git_sha": "55ac86eace1e84e3c3cc86c1e9e720cce3b3bdc1", "pre_experiment_sha": "fa46361eb84a3cc9168d2d182fd71bb21afb4d36", "timestamp": "2026-04-23T16:49:58.779954+00:00", "hypothesis": "Optimize SymSpell candidate generation by using a fast `set().update()` loop to deduplicate candidates in C without forbidden functions, and inline `s_mid` assignments where used only once to reduce local variable overhead, preserving O(1) string slicing verification.", "hypothesis_source": "agent", "mutation_diff_summary": "", "score": 4.16, "score_ci_lower": null, "score_ci_upper": null, "raw_scores": null, "baseline_score": 4.16, "outcome": "KEPT", "failure_mode": null, "duration_seconds": 188.40035354113206, "tags": ["symspell", "optimization", "string-slicing", "c-extensions", "fast-path"], "learnings": "{\"what_changed\":\"\",\"what_improved\":[],\"what_regressed\":[],\"transferable_insight\":\"Delegating deduplication to native bulk operations and inlining single-use variables simplifies code structure while maintaining baseline performance.\",\"domain_tags\":[\"Code Optimization\",\"Refactoring\",\"Performance Tuning\"]}", "cost_usd": 0.048731250000000004, "bootstrap_seed": 0, "agent_model": "gemini-3.1-pro-preview", "held_out_score": null, "criterion_names": null, "per_criterion_scores": null, "failure_classification": null, "drafts_generated": 1, "drafts_survived": 1}
{"id": "b886859a-bc33-4d11-93a8-6c5bfff1bb00", "target_id": "B3-treatment", "git_sha": "8455eea74727c7bbfa1542a423e97e429eb87499", "pre_experiment_sha": "55ac86eace1e84e3c3cc86c1e9e720cce3b3bdc1", "timestamp": "2026-04-23T16:54:24.494338+00:00", "hypothesis": "Optimize SymSpell candidate generation by reusing a single candidate set with `clear()` to eliminate allocation overhead inside the hot loop, and micro-optimize O(1) string slicing verification by caching index offsets and inlining length calculations.", "hypothesis_source": "agent", "mutation_diff_summary": "", "score": 3.99, "score_ci_lower": null, "score_ci_upper": null, "raw_scores": null, "baseline_score": 4.16, "outcome": "KEPT", "failure_mode": null, "duration_seconds": 258.306339208968, "tags": ["symspell", "optimization", "string-slicing", "memory-reuse", "micro-optimization"], "learnings": "{\"what_changed\":\"\",\"what_improved\":[],\"what_regressed\":[],\"transferable_insight\":\"Reusing pre-allocated data structures and caching frequently accessed calculations within high-frequency loops eliminates memory allocation overhead and accelerates execution.\",\"domain_tags\":[\"Performance Optimization\",\"Memory Management\",\"Software Engineering\"]}", "cost_usd": 0.048816250000000005, "bootstrap_seed": 0, "agent_model": "gemini-3.1-pro-preview", "held_out_score": null, "criterion_names": null, "per_criterion_scores": null, "failure_classification": null, "drafts_generated": 1, "drafts_survived": 1}
{"id": "2f6d746a-bf42-4acf-9360-4387cca42dde", "target_id": "B3-treatment", "git_sha": "8514c78664c0208fd03492deba8551cb8fb182e8", "pre_experiment_sha": "8455eea74727c7bbfa1542a423e97e429eb87499", "timestamp": "2026-04-23T16:59:02.808923+00:00", "hypothesis": "Optimize SymSpell candidate merging by using a fast C-level `set().update(*filter(...))` to eliminate Python loop overhead, and completely bypass string verification for length differences of 2 since mathematically their distance must be exactly 2.", "hypothesis_source": "agent", "mutation_diff_summary": "", "score": 4.18, "score_ci_lower": null, "score_ci_upper": null, "raw_scores": null, "baseline_score": 3.99, "outcome": "KEPT", "failure_mode": null, "duration_seconds": 270.2874116669409, "tags": ["symspell", "optimization", "c-extensions", "algorithmic-simplification", "fast-path"], "learnings": "{\"what_changed\":\"\",\"what_improved\":[],\"what_regressed\":[],\"transferable_insight\":\"Leveraging native, low-level functions to eliminate loop overhead and using mathematical guarantees to bypass redundant verifications significantly improves computational efficiency.\",\"domain_tags\":[\"Performance Optimization\",\"Algorithm Design\",\"Computational Efficiency\"]}", "cost_usd": 0.04855500000000001, "bootstrap_seed": 0, "agent_model": "gemini-3.1-pro-preview", "held_out_score": null, "criterion_names": null, "per_criterion_scores": null, "failure_classification": null, "drafts_generated": 1, "drafts_survived": 1}
{"id": "c8dd7a19-436f-4ac4-8921-1fd8b896051f", "target_id": "B3-treatment", "git_sha": "8514c78664c0208fd03492deba8551cb8fb182e8", "pre_experiment_sha": "8514c78664c0208fd03492deba8551cb8fb182e8", "timestamp": "2026-04-23T17:03:21.092521+00:00", "hypothesis": "Optimize SymSpell candidate generation by using a fast `for` loop over `filter(None, map(...))` to eliminate overhead, and strictly use exhaustive O(1) string slicing for distance <= 2 verification, fixing a logic error for 2-substitutions and eliminating redundant bounds calculations.", "hypothesis_source": "agent", "mutation_diff_summary": "", "score": 4.52, "score_ci_lower": null, "score_ci_upper": null, "raw_scores": null, "baseline_score": 4.18, "outcome": "DISCARDED", "failure_mode": null, "duration_seconds": 231.38254075008444, "tags": ["symspell", "optimization", "string-slicing", "c-level-loops", "algorithmic-simplification"], "learnings": "{\"what_changed\":\"\",\"what_improved\":[],\"what_regressed\":[],\"transferable_insight\":\"Micro-optimizing loops with functional constructs and manually unrolling specific edge cases often fails to yield performance improvements over standard imperative implementations.\",\"domain_tags\":[\"Performance Optimization\",\"Micro-optimization\",\"Software Engineering\"]}", "cost_usd": 0.049288000000000005, "bootstrap_seed": 0, "agent_model": "gemini-3.1-pro-preview", "held_out_score": null, "criterion_names": null, "per_criterion_scores": null, "failure_classification": {"category": "logic_error", "description": "The experiment aimed to optimize SymSpell candidate generation and specifically 'fix a logic error for 2-substitutions'. The failure, despite 'unknown' mode, suggests that either the intended fix for the 2-substitution logic error was itself flawed, or the proposed optimization techniques (e.g., 'exhaustive O(1) string slicing') introduced new logical inconsistencies or incorrect calculations, leading to an unacceptable outcome as indicated by the 'failed experiment' status and the score.", "fix_direction": "Thoroughly review the implementation of the string slicing for distance verification and the specific fix for 2-substitutions. Focus on correctness first, by writing specific unit tests for all distance <= 2 cases, especially 2-substitutions, to ensure the new logic generates correct candidates and distances. Isolate the 'fix' from the 'optimization' to verify correctness before re-introducing performance concerns. Debug the candidate generation process step-by-step to pinpoint where the logic deviates from expected behavior.", "confidence": 0.9}, "drafts_generated": 1, "drafts_survived": 1}
