{"id": "3749e678-2354-4318-8004-f99f27368367", "target_id": "B3-treatment", "git_sha": "b589823973d1cbfa4258b92cc2671956e398b38c", "pre_experiment_sha": "2615ccb14fb6fcc7fe0a069d1617aa3c073bc781", "timestamp": "2026-04-18T23:59:16.430331+00:00", "hypothesis": "Cache per-string lengths locally in the existing comparison loop to avoid repeated len calls while preserving exact behavior.", "hypothesis_source": "agent", "mutation_diff_summary": "", "score": 89.58, "score_ci_lower": null, "score_ci_upper": null, "raw_scores": null, "baseline_score": 90.03, "outcome": "KEPT", "failure_mode": null, "duration_seconds": 34.473289165995084, "tags": ["runtime", "caching", "hot-loop", "safe"], "learnings": "{\"what_changed\":\"\",\"what_improved\":[],\"what_regressed\":[],\"transferable_insight\":\"Small local caching of repeatedly accessed values can preserve behavior while reducing redundant work, but it may not produce measurable gains if the original operation is already cheap or infrequent.\",\"domain_tags\":[\"optimization\",\"performance\",\"software-engineering\"]}", "cost_usd": 0.08716000000000002, "bootstrap_seed": 0, "agent_model": "gpt-5.4", "held_out_score": null, "criterion_names": null, "per_criterion_scores": null, "failure_classification": null, "drafts_generated": 1, "drafts_survived": 1}
{"id": "023bf155-9319-4f1c-b678-d7438b2f0dca", "target_id": "B3-treatment", "git_sha": "b589823973d1cbfa4258b92cc2671956e398b38c", "pre_experiment_sha": "b589823973d1cbfa4258b92cc2671956e398b38c", "timestamp": "2026-04-18T23:59:52.285870+00:00", "hypothesis": "Cache simple local invariants in the hot loops and remove an unnecessary stored length from buckets to reduce deterministic runtime without changing behavior.", "hypothesis_source": "agent", "mutation_diff_summary": "", "score": 90.43, "score_ci_lower": null, "score_ci_upper": null, "raw_scores": null, "baseline_score": 89.58, "outcome": "DISCARDED", "failure_mode": null, "duration_seconds": 34.55973754101433, "tags": ["performance", "local-caching", "allocation-reduction", "safe-mutation"], "learnings": "{\"what_changed\":\"\",\"what_improved\":[],\"what_regressed\":[],\"transferable_insight\":\"Small structural simplifications that eliminate repeated invariant checks or redundant stored state can improve deterministic performance without changing externally visible behavior.\",\"domain_tags\":[\"performance-optimization\",\"software-engineering\",\"systems-design\"]}", "cost_usd": 0.08804260000000001, "bootstrap_seed": 0, "agent_model": "gpt-5.4", "held_out_score": null, "criterion_names": null, "per_criterion_scores": null, "failure_classification": {"category": "over_optimization", "description": "The change aimed to reduce deterministic runtime by caching local invariants and removing a stored bucket length, but the experiment failed\u2014suggesting the optimization altered assumptions about bucket iteration/length handling or evaluation timing in a way that impacted correctness while still targeting performance.", "fix_direction": "Revert the length-related removal or guard it with invariant checks; limit optimizations to purely referentially transparent caching (e.g., compute-once values that provably cannot change during the hot loop), and add tests that stress bucket boundary conditions and determinism.", "confidence": 0.62}, "drafts_generated": 1, "drafts_survived": 1}
{"id": "5acb3255-1963-42f4-a5e6-c16df21b69a4", "target_id": "B3-treatment", "git_sha": "b589823973d1cbfa4258b92cc2671956e398b38c", "pre_experiment_sha": "b589823973d1cbfa4258b92cc2671956e398b38c", "timestamp": "2026-04-19T00:00:30.695961+00:00", "hypothesis": "Cache local string references and bucket iteration invariants to reduce repeated indexing and lookups without changing behavior.", "hypothesis_source": "agent", "mutation_diff_summary": "", "score": 91.26, "score_ci_lower": null, "score_ci_upper": null, "raw_scores": null, "baseline_score": 89.58, "outcome": "DISCARDED", "failure_mode": null, "duration_seconds": 35.85617329191882, "tags": ["local-caching", "hot-loop", "safe"], "learnings": "{\"what_changed\":\"\",\"what_improved\":[],\"what_regressed\":[],\"transferable_insight\":\"When an optimization only removes repeated lookups or indexing but does not change the underlying work, it may be neutral or discarded despite seeming efficient.\",\"domain_tags\":[\"optimization\",\"performance\",\"software-engineering\"]}", "cost_usd": 0.087832, "bootstrap_seed": 0, "agent_model": "gpt-5.4", "held_out_score": null, "criterion_names": null, "per_criterion_scores": null, "failure_classification": {"category": "logic_error", "description": "The failure mode was not provided (labeled 'unknown'), so the specific reason the experiment failed cannot be determined from the given information.", "fix_direction": "Re-run with added diagnostics around behavior equivalence (e.g., unit tests/bitwise output checks) and ensure the optimization only caches invariants without altering iteration order, indexing, or reference lifetimes.", "confidence": 0.15}, "drafts_generated": 1, "drafts_survived": 1}
{"id": "ce5af843-5d3d-42dd-8f94-7401488151b2", "target_id": "B3-treatment", "git_sha": "b589823973d1cbfa4258b92cc2671956e398b38c", "pre_experiment_sha": "b589823973d1cbfa4258b92cc2671956e398b38c", "timestamp": "2026-04-19T00:01:16.100750+00:00", "hypothesis": "Cache candidate lengths directly in the existing comparison loop and remove redundant tuple unpacking work.", "hypothesis_source": "agent", "mutation_diff_summary": "", "score": 90.22, "score_ci_lower": null, "score_ci_upper": null, "raw_scores": null, "baseline_score": 89.58, "outcome": "DISCARDED", "failure_mode": null, "duration_seconds": 39.46395670808852, "tags": ["local-cache", "hot-loop", "allocation-reduction"], "learnings": "{\"what_changed\":\"\",\"what_improved\":[],\"what_regressed\":[],\"transferable_insight\":\"When an optimization adds bookkeeping inside a hot loop without eliminating meaningful work, it can increase complexity without delivering measurable benefit.\",\"domain_tags\":[\"performance-optimization\",\"software-engineering\"]}", "cost_usd": 0.0875562, "bootstrap_seed": 0, "agent_model": "gpt-5.4", "held_out_score": null, "criterion_names": null, "per_criterion_scores": null, "failure_classification": {"category": "logic_error", "description": "The proposed optimization (caching candidate lengths inside the comparison loop and removing redundant tuple unpacking) likely changed when/how length values were computed or reused, leading to incorrect comparison behavior even though the code may still run. This manifests as a failed experiment with an unknown failure mode rather than a formatting/parsing issue.", "fix_direction": "Refactor to ensure cached lengths are derived from the correct source for each comparison iteration; add unit tests/guards around boundary cases (empty strings, ties, varying lengths) and verify equivalence with the prior implementation before removing tuple-unpacking.", "confidence": 0.42}, "drafts_generated": 1, "drafts_survived": 1}
{"id": "f8dd20e0-bd2a-4306-b383-c36fcc084222", "target_id": "B3-treatment", "git_sha": "b589823973d1cbfa4258b92cc2671956e398b38c", "pre_experiment_sha": "b589823973d1cbfa4258b92cc2671956e398b38c", "timestamp": "2026-04-19T00:02:00.902398+00:00", "hypothesis": "Cache local aliases and remove redundant stored lengths in the hot pair-comparison loop without changing behavior.", "hypothesis_source": "agent", "mutation_diff_summary": "", "score": 133.12, "score_ci_lower": null, "score_ci_upper": null, "raw_scores": null, "baseline_score": 89.58, "outcome": "DISCARDED", "failure_mode": null, "duration_seconds": 42.301444375072606, "tags": ["local-caching", "hot-loop", "allocation-reduction"], "learnings": "{\"what_changed\":\"\",\"what_improved\":[],\"what_regressed\":[],\"transferable_insight\":\"Micro-optimizations that only reduce local bookkeeping in a hot loop can fail to produce measurable gains when the real cost lies elsewhere, so validate the true bottleneck before changing code structure.\",\"domain_tags\":[\"performance-optimization\",\"profiling\",\"software-engineering\"]}", "cost_usd": 0.0887014, "bootstrap_seed": 0, "agent_model": "gpt-5.4", "held_out_score": null, "criterion_names": null, "per_criterion_scores": null, "failure_classification": {"category": "logic_error", "description": "The attempted optimization likely changed the effective behavior of the hot pair-comparison loop\u2014e.g., caching local aliases or removing stored lengths introduced subtle differences in iteration bounds or comparison semantics, causing incorrect results rather than only performance differences.", "fix_direction": "Keep behavioral equivalence: verify loop bounds and comparison logic with targeted tests (including edge cases), and ensure cached aliases/removed length computations cannot go stale or alter control flow; use assertions or differential testing against the unoptimized version.", "confidence": 0.62}, "drafts_generated": 1, "drafts_survived": 1}
{"id": "9eb42edc-558c-492d-9876-d0dfd553c758", "target_id": "B3-treatment", "git_sha": "b589823973d1cbfa4258b92cc2671956e398b38c", "pre_experiment_sha": "b589823973d1cbfa4258b92cc2671956e398b38c", "timestamp": "2026-04-19T00:02:43.705346+00:00", "hypothesis": "Cache simple local invariants and remove redundant per-candidate length storage in the hot comparison path.", "hypothesis_source": "agent", "mutation_diff_summary": "", "score": 90.35, "score_ci_lower": null, "score_ci_upper": null, "raw_scores": null, "baseline_score": 89.58, "outcome": "DISCARDED", "failure_mode": null, "duration_seconds": 40.34205979097169, "tags": ["local-caching", "hot-loop", "allocation-reduction"], "learnings": "{\"what_changed\":\"\",\"what_improved\":[],\"what_regressed\":[],\"transferable_insight\":\"Optimizing a hot path by caching local invariants and removing redundant state can simplify code, but it should only be kept if it produces measurable gains rather than just theoretical efficiency.\",\"domain_tags\":[\"performance-optimization\",\"software-engineering\"]}", "cost_usd": 0.0878702, "bootstrap_seed": 0, "agent_model": "gpt-5.4", "held_out_score": null, "criterion_names": null, "per_criterion_scores": null, "failure_classification": {"category": "incomplete_edit", "description": "The attempt to optimize the hot comparison path by caching invariants and removing redundant per-candidate length handling appears to have left the implementation in an inconsistent or partially updated state, leading to an 'unknown' failure mode rather than a clean, correct behavioral change.", "fix_direction": "Verify all invariants cached in the comparison path are recomputed/updated consistently for each candidate; ensure any removed per-candidate length storage is replaced with an equivalent correct source of truth (e.g., cached once per entity but used consistently), and add targeted tests covering boundary conditions where lengths/invariants differ between candidates.", "confidence": 0.62}, "drafts_generated": 1, "drafts_survived": 1}
{"id": "3ac64393-4e4f-442a-b18a-372c56a0d44c", "target_id": "B3-treatment", "git_sha": "b589823973d1cbfa4258b92cc2671956e398b38c", "pre_experiment_sha": "b589823973d1cbfa4258b92cc2671956e398b38c", "timestamp": "2026-04-19T00:03:28.995234+00:00", "hypothesis": "Cache repeated local lookups and lengths inside the existing hot loops to reduce deterministic runtime without changing behavior.", "hypothesis_source": "agent", "mutation_diff_summary": "", "score": 144.95, "score_ci_lower": null, "score_ci_upper": null, "raw_scores": null, "baseline_score": 89.58, "outcome": "DISCARDED", "failure_mode": null, "duration_seconds": 39.63698575005401, "tags": ["local-caching", "hot-path", "bounded-levenshtein"], "learnings": "{\"what_changed\":\"\",\"what_improved\":[],\"what_regressed\":[],\"transferable_insight\":\"Micro-optimizations that cache repeated values inside hot loops can be worth testing, but if they do not produce measurable gains or complicate the code, they should be discarded.\",\"domain_tags\":[\"performance-optimization\",\"software-engineering\"]}", "cost_usd": 0.08969400000000001, "bootstrap_seed": 0, "agent_model": "gpt-5.4", "held_out_score": null, "criterion_names": null, "per_criterion_scores": null, "failure_classification": {"category": "incomplete_edit", "description": "The attempted optimization (caching local lookups/lengths in hot loops) appears to have left behavior inconsistent with the original logic. The high score suggests the change partially applied but likely failed to preserve semantics in all cases (e.g., caches not updated when loop state changes), resulting in a runtime/behavior mismatch labeled as unknown failure mode.", "fix_direction": "Ensure cached values remain valid for the entire loop iteration/state; invalidate or recompute caches when dependent data changes, and add targeted tests covering edge cases where previously-recomputed values could differ.", "confidence": 0.62}, "drafts_generated": 1, "drafts_survived": 1}
{"id": "cf865154-c45f-49a4-be0c-13171fbf9766", "target_id": "B3-treatment", "git_sha": "b589823973d1cbfa4258b92cc2671956e398b38c", "pre_experiment_sha": "b589823973d1cbfa4258b92cc2671956e398b38c", "timestamp": "2026-04-19T00:04:08.877793+00:00", "hypothesis": "Cache repeated locals inside the bounded Levenshtein inner loop and avoid unused tuple data in candidate buckets.", "hypothesis_source": "agent", "mutation_diff_summary": "", "score": 132.0, "score_ci_lower": null, "score_ci_upper": null, "raw_scores": null, "baseline_score": 89.58, "outcome": "DISCARDED", "failure_mode": null, "duration_seconds": 37.34026454202831, "tags": ["local-caching", "hot-path", "mechanical"], "learnings": "{\"what_changed\":\"\",\"what_improved\":[],\"what_regressed\":[],\"transferable_insight\":\"Micro-optimizations that reduce repeated work and unnecessary data handling can improve performance, but they should be validated carefully because they may not produce measurable gains in practice.\",\"domain_tags\":[\"performance-optimization\",\"software-engineering\",\"experimentation\"]}", "cost_usd": 0.08848460000000001, "bootstrap_seed": 0, "agent_model": "gpt-5.4", "held_out_score": null, "criterion_names": null, "per_criterion_scores": null, "failure_classification": {"category": "incomplete_edit", "description": "The experiment appears to have been only partially realized: despite a stated optimization hypothesis about caching repeated locals and avoiding unused tuple data in candidate buckets, the reported failure mode is \u201cunknown\u201d and the score indicates the intended change likely left an inconsistent or incomplete implementation state rather than a clearly identifiable logic or format error.", "fix_direction": "Finish and validate the full optimization pipeline end-to-end: ensure cached locals are correctly scoped to the Levenshtein inner loop, remove tuple allocations only where safe, and add targeted correctness tests (including edge cases) plus performance/behavior instrumentation to confirm the intended behavior matches the original implementation.", "confidence": 0.46}, "drafts_generated": 1, "drafts_survived": 1}
{"id": "1bad51de-3f66-4920-9fe4-bdcefe5b6827", "target_id": "B3-treatment", "git_sha": "b589823973d1cbfa4258b92cc2671956e398b38c", "pre_experiment_sha": "b589823973d1cbfa4258b92cc2671956e398b38c", "timestamp": "2026-04-19T00:04:52.876125+00:00", "hypothesis": "Cache repeated locals in the inner comparison loop and bounded Levenshtein path to reduce lookup overhead without changing behavior.", "hypothesis_source": "agent", "mutation_diff_summary": "", "score": 90.74, "score_ci_lower": null, "score_ci_upper": null, "raw_scores": null, "baseline_score": 89.58, "outcome": "DISCARDED", "failure_mode": null, "duration_seconds": 36.29772641591262, "tags": ["local-caching", "hot-path", "safe-mechanical"], "learnings": "{\"what_changed\":\"\",\"what_improved\":[],\"what_regressed\":[],\"transferable_insight\":\"Micro-optimizations that only reduce repeated local lookups or path overhead can be neutral or noisy unless they materially affect the dominant cost in the hot path.\",\"domain_tags\":[\"performance-optimization\",\"benchmarking\",\"code-optimization\"]}", "cost_usd": 0.08860260000000002, "bootstrap_seed": 0, "agent_model": "gpt-5.4", "held_out_score": null, "criterion_names": null, "per_criterion_scores": null, "failure_classification": {"category": "logic_error", "description": "The provided information does not describe the specific failure behavior or error symptoms\u2014only that the experiment failed with an \u201cunknown\u201d failure mode. Without details of what changed incorrectly (format, logic, regression, etc.), the failure cannot be mapped to a specific category.", "fix_direction": "Capture concrete failure evidence (logs, diff, failing test name/output, and whether behavior/format changed) and then re-check for logic equivalence, regression impact, and any unintended optimization changes to semantics.", "confidence": 0.05}, "drafts_generated": 1, "drafts_survived": 1}
{"id": "e05ca161-7c52-4068-8f34-9e81406f9b40", "target_id": "B3-treatment", "git_sha": "268928a2f883e3b1ce448080d216498252041de9", "pre_experiment_sha": "b589823973d1cbfa4258b92cc2671956e398b38c", "timestamp": "2026-04-19T00:05:35.664497+00:00", "hypothesis": "Cache repeated locals inside the bounded Levenshtein and comparison loop to reduce indexing and lookup overhead without changing behavior.", "hypothesis_source": "agent", "mutation_diff_summary": "", "score": 90.04, "score_ci_lower": null, "score_ci_upper": null, "raw_scores": null, "baseline_score": 89.58, "outcome": "KEPT", "failure_mode": null, "duration_seconds": 37.24292500002775, "tags": ["local-caching", "hot-path", "mechanical"], "learnings": "{\"what_changed\":\"\",\"what_improved\":[],\"what_regressed\":[],\"transferable_insight\":\"When a hot loop repeatedly accesses the same values, caching them in local variables can reduce overhead and improve performance without changing behavior.\",\"domain_tags\":[\"performance-optimization\",\"loop-optimization\",\"code-efficiency\"]}", "cost_usd": 0.08861000000000001, "bootstrap_seed": 0, "agent_model": "gpt-5.4", "held_out_score": null, "criterion_names": null, "per_criterion_scores": null, "failure_classification": null, "drafts_generated": 1, "drafts_survived": 1}
{"id": "dfc166a1-0c14-497a-977b-8b4e7277ead0", "target_id": "B3-treatment", "git_sha": "fbd7d8eca0a17cb9aef738a60337cafc6e37b019", "pre_experiment_sha": "268928a2f883e3b1ce448080d216498252041de9", "timestamp": "2026-04-19T00:06:13.282768+00:00", "hypothesis": "Cache repeated threshold-derived bounds and string locals inside the existing hot loops to reduce repeated indexing and arithmetic without changing behavior.", "hypothesis_source": "agent", "mutation_diff_summary": "", "score": 91.15, "score_ci_lower": null, "score_ci_upper": null, "raw_scores": null, "baseline_score": 90.04, "outcome": "KEPT", "failure_mode": null, "duration_seconds": 36.41009616700467, "tags": ["local-caching", "hot-path", "bounded-levenshtein"], "learnings": "{\"what_changed\":\"\",\"what_improved\":[],\"what_regressed\":[],\"transferable_insight\":\"When a computation repeatedly uses the same derived values inside a hot loop, hoisting them into local variables can reduce redundant work and improve performance without changing behavior.\",\"domain_tags\":[\"performance-optimization\",\"loop-optimization\",\"code-maintenance\"]}", "cost_usd": 0.09007500000000002, "bootstrap_seed": 0, "agent_model": "gpt-5.4", "held_out_score": null, "criterion_names": null, "per_criterion_scores": null, "failure_classification": null, "drafts_generated": 1, "drafts_survived": 1}
{"id": "e522f2c1-c967-4484-bdd2-d7b9f614139f", "target_id": "B3-treatment", "git_sha": "1f625c6b65106353c218211df02e85c82104674d", "pre_experiment_sha": "fbd7d8eca0a17cb9aef738a60337cafc6e37b019", "timestamp": "2026-04-19T00:06:54.799341+00:00", "hypothesis": "Cache repeated row references and threshold comparisons inside the bounded Levenshtein hot loop.", "hypothesis_source": "agent", "mutation_diff_summary": "", "score": 88.6, "score_ci_lower": null, "score_ci_upper": null, "raw_scores": null, "baseline_score": 91.15, "outcome": "KEPT", "failure_mode": null, "duration_seconds": 40.35669754201081, "tags": ["performance", "local-caching", "hot-path"], "learnings": "{\"what_changed\":\"\",\"what_improved\":[],\"what_regressed\":[],\"transferable_insight\":\"When a tight loop repeatedly accesses the same data or evaluates the same condition, caching those repeated values can reduce overhead even if the overall functional behavior stays unchanged.\",\"domain_tags\":[\"performance-optimization\",\"algorithm-design\",\"micro-optimization\"]}", "cost_usd": 0.09061000000000001, "bootstrap_seed": 0, "agent_model": "gpt-5.4", "held_out_score": null, "criterion_names": null, "per_criterion_scores": null, "failure_classification": null, "drafts_generated": 1, "drafts_survived": 1}
