{"id": "9f1f403d-730f-4f46-b545-918259c11310", "target_id": "B3-treatment", "git_sha": "f466ad4e646c0aa82fb99897693aee21940b03a4", "pre_experiment_sha": "f466ad4e646c0aa82fb99897693aee21940b03a4", "timestamp": "2026-04-19T00:16:34.110637+00:00", "hypothesis": "Cache the indexed candidate character once per inner Levenshtein iteration to trim repeated sequence access in the hot path.", "hypothesis_source": "agent", "mutation_diff_summary": "", "score": 87.86, "score_ci_lower": null, "score_ci_upper": null, "raw_scores": null, "baseline_score": 86.2, "outcome": "DISCARDED", "failure_mode": null, "duration_seconds": 34.26884295907803, "tags": ["micro-optimization", "local-caching", "levenshtein"], "learnings": "{\"what_changed\":\"\",\"what_improved\":[],\"what_regressed\":[],\"transferable_insight\":\"Micro-optimizations that reduce repeated access in a tight inner loop can be worth testing, but if they do not measurably improve the hot path they should be discarded to avoid unnecessary complexity.\",\"domain_tags\":[\"performance-optimization\",\"software-engineering\"]}", "cost_usd": 0.1020106, "bootstrap_seed": 0, "agent_model": "gpt-5.4", "held_out_score": null, "criterion_names": null, "per_criterion_scores": null, "failure_classification": {"category": "logic_error", "description": "The provided information does not specify the actual failure mode or what aspect of the experiment failed (only that it failed and has a score). The hypothesis and failure mode are insufficient to determine whether the issue is format, logic, regression, scope, syntax, semantic meaning, over-optimization, or incomplete state.", "fix_direction": "Capture concrete failure signals (error message, failing test/criterion, diff of expected vs actual behavior) and identify whether the change breaks correctness, changes output structure, violates constraints, or only affects performance/metrics.", "confidence": 0.12}, "drafts_generated": 1, "drafts_survived": 1}
