{"id": "7b3af882-d572-4398-81df-3ce6365bc6cc", "target_id": "B3-treatment", "git_sha": "177c2ef415797bf077333d4e68566b2e2f12e1ea", "pre_experiment_sha": "3b452d4d4a3bc0f302632065ef61cb2ba6a6552a", "timestamp": "2026-04-19T15:27:13.621314+00:00", "hypothesis": "Optimize edit-distance matching with bounded Levenshtein, precomputed lengths, and set-based deduplication.", "hypothesis_source": "agent", "mutation_diff_summary": "", "score": 111.04, "score_ci_lower": null, "score_ci_upper": null, "raw_scores": null, "baseline_score": 460.31, "outcome": "KEPT", "failure_mode": null, "duration_seconds": 31.712899832986295, "tags": ["performance", "dynamic-programming", "pruning", "caching"], "learnings": "{\"what_changed\":\"\",\"what_improved\":[],\"what_regressed\":[],\"transferable_insight\":\"When an optimization changes implementation details but produces no measurable improvement or regression, it likely adds complexity without affecting the dominant bottleneck and should be validated against a simpler baseline before adoption.\",\"domain_tags\":[\"optimization\",\"benchmarking\",\"software-engineering\"]}", "cost_usd": 0.077105, "bootstrap_seed": 0, "agent_model": "gpt-5.4", "held_out_score": null, "criterion_names": null, "per_criterion_scores": null, "failure_classification": null, "drafts_generated": 1, "drafts_survived": 1}
{"id": "b32e01f6-d41e-4d18-957d-f6967781ae03", "target_id": "B3-treatment", "git_sha": "177c2ef415797bf077333d4e68566b2e2f12e1ea", "pre_experiment_sha": "177c2ef415797bf077333d4e68566b2e2f12e1ea", "timestamp": "2026-04-19T15:27:49.115122+00:00", "hypothesis": "Reduce allocation-heavy Levenshtein and dedup work by reusing buffers and skipping dedup when inputs are already unique.", "hypothesis_source": "agent", "mutation_diff_summary": "", "score": 111.04, "score_ci_lower": null, "score_ci_upper": null, "raw_scores": null, "baseline_score": 111.04, "outcome": "CRASHED", "failure_mode": "run_command exited with code 1: warning: `VIRTUAL_ENV=/Users/druk/WorkSpace/AetherForge/anneal/.venv` does not match the project environment path `.venv` and will be ignored; use `--active` to target the active environment instead\nTraceback (most recent call last):\n  File \"/Users/druk/WorkSpace/AetherForge/anneal/benchmarks/suite/harness/eval_b3.py\", line 124, in <module>\n    main()\n  File \"/Users/druk/WorkSpace/AetherForge/anneal/benchmarks/suite/harness/eval_b3.py\", line 116, in main\n    if not _verify_spot_checks(ARTIFACT):\n           ^^^^^^^^^^^^^^^^^^^^^^^^^^^^^\n  File \"/Users/druk/WorkSpace/AetherForge/anneal/benchmarks/suite/harness/eval_b3.py\", line 69, in _verify_spot_checks\n    pairs = find_fn(names_a, names_b, 2)\n            ^^^^^^^^^^^^^^^^^^^^^^^^^^^^\nTypeError: _find_close_pairs() takes 2 positional arguments but 3 were given", "duration_seconds": 34.330919082975015, "tags": ["performance", "levenshtein", "allocation", "deterministic"], "learnings": "{\"what_changed\":\"\",\"what_improved\":[],\"what_regressed\":[],\"transferable_insight\":\"Optimizations that reuse mutable state or skip validation can eliminate overhead, but they must preserve invariants and be guarded carefully to avoid introducing instability or crashes.\",\"domain_tags\":[\"optimization\",\"reliability\",\"software-engineering\"]}", "cost_usd": 0.079735, "bootstrap_seed": 0, "agent_model": "gpt-5.4", "held_out_score": null, "criterion_names": null, "per_criterion_scores": null, "failure_classification": null, "drafts_generated": 1, "drafts_survived": 1}
{"id": "e53a4c6c-4994-4921-b51c-78e6b3ca8559", "target_id": "B3-treatment", "git_sha": "177c2ef415797bf077333d4e68566b2e2f12e1ea", "pre_experiment_sha": "177c2ef415797bf077333d4e68566b2e2f12e1ea", "timestamp": "2026-04-19T15:28:23.551284+00:00", "hypothesis": "Speed up deterministic runtime by reducing Levenshtein allocations and deduplicating during pair generation.", "hypothesis_source": "agent", "mutation_diff_summary": "", "score": 141.5, "score_ci_lower": null, "score_ci_upper": null, "raw_scores": null, "baseline_score": 111.04, "outcome": "DISCARDED", "failure_mode": null, "duration_seconds": 33.289584291982464, "tags": ["performance", "algorithm", "memory", "deterministic"], "learnings": "{\"what_changed\":\"\",\"what_improved\":[],\"what_regressed\":[],\"transferable_insight\":\"Optimizing a process by reducing intermediate allocations and eliminating duplicate work can improve deterministic runtime without changing results.\",\"domain_tags\":[\"performance-optimization\",\"algorithm-design\",\"memory-management\"]}", "cost_usd": 0.07813220000000001, "bootstrap_seed": 0, "agent_model": "gpt-5.4", "held_out_score": null, "criterion_names": null, "per_criterion_scores": null, "failure_classification": {"category": "logic_error", "description": "The failure mode is not specified, and the provided information (Hypothesis, Failure Mode: unknown, Score: 141.5) is insufficient to determine whether the issue is output formatting, logic, regression, scope, syntax, semantic meaning, over-optimization, or incomplete edits.", "fix_direction": "Capture the concrete failure signal (error message/stack trace, diff from previous working version, and what evaluation step failed) and inspect for format/schema compliance, correctness of Levenshtein/pair-generation changes, and any partial or inconsistent edits.", "confidence": 0.05}, "drafts_generated": 1, "drafts_survived": 1}
{"id": "84b31cf2-a8b3-4237-a930-ce1fc81a947d", "target_id": "B3-treatment", "git_sha": "177c2ef415797bf077333d4e68566b2e2f12e1ea", "pre_experiment_sha": "177c2ef415797bf077333d4e68566b2e2f12e1ea", "timestamp": "2026-04-19T15:28:56.411553+00:00", "hypothesis": "Precompute lengths for both lists and deduplicate candidate strings before distance checks to reduce repeated bounded Levenshtein work without changing final deduped results.", "hypothesis_source": "agent", "mutation_diff_summary": "", "score": 112.99, "score_ci_lower": null, "score_ci_upper": null, "raw_scores": null, "baseline_score": 111.04, "outcome": "DISCARDED", "failure_mode": null, "duration_seconds": 27.67548904195428, "tags": ["performance", "levenshtein", "caching", "deduplication"], "learnings": "{\"what_changed\":\"\",\"what_improved\":[],\"what_regressed\":[],\"transferable_insight\":\"When many comparisons are repeated, cheaply filtering or deduplicating candidates before invoking an expensive exact check can reduce redundant work without affecting the final unique result set.\",\"domain_tags\":[\"optimization\",\"deduplication\",\"algorithm design\"]}", "cost_usd": 0.079748, "bootstrap_seed": 0, "agent_model": "gpt-5.4", "held_out_score": null, "criterion_names": null, "per_criterion_scores": null, "failure_classification": {"category": "logic_error", "description": "The provided information does not identify any concrete failure mode (e.g., incorrect output format, logic miscalculation, regression, syntax issues, semantic change, scope change, or partial/inconsistent edits). Only the hypothesis and a score are given, with the failure mode marked as unknown.", "fix_direction": "Capture and report the specific observed failure (diff of outputs vs expected, error messages, or where criteria/thresholds changed), then validate that deduplication and precomputed lengths preserve identical final deduped results across representative test cases.", "confidence": 0.08}, "drafts_generated": 1, "drafts_survived": 1}
{"id": "4f65e3ba-8b63-44cc-ba0f-09249b4e2570", "target_id": "B3-treatment", "git_sha": "177c2ef415797bf077333d4e68566b2e2f12e1ea", "pre_experiment_sha": "177c2ef415797bf077333d4e68566b2e2f12e1ea", "timestamp": "2026-04-19T15:29:27.345340+00:00", "hypothesis": "Reduce repeated work by deduplicating candidate strings before distance checks and precomputing lengths for both sides.", "hypothesis_source": "agent", "mutation_diff_summary": "", "score": 112.89, "score_ci_lower": null, "score_ci_upper": null, "raw_scores": null, "baseline_score": 111.04, "outcome": "DISCARDED", "failure_mode": null, "duration_seconds": 28.136054583010264, "tags": ["deduplication", "precompute-lengths", "bounded-levenshtein", "deterministic-safe"], "learnings": "{\"what_changed\":\"\",\"what_improved\":[],\"what_regressed\":[],\"transferable_insight\":\"When an optimization adds preprocessing but yields no measurable gains, it is often a sign that the overhead or the eliminated work is too small to matter in practice.\",\"domain_tags\":[\"optimization\",\"performance\",\"software-engineering\"]}", "cost_usd": 0.0801132, "bootstrap_seed": 0, "agent_model": "gpt-5.4", "held_out_score": null, "criterion_names": null, "per_criterion_scores": null, "failure_classification": {"category": "logic_error", "description": "The attempted optimization (deduplicating candidate strings and precomputing lengths) likely introduced incorrect handling of how distances are computed or compared, resulting in a wrong outcome rather than a safe performance improvement. The high failure score suggests the behavior changed meaningfully, not just runtime.", "fix_direction": "Verify that deduplication preserves the intended mapping from candidates to outputs (no lost duplicates where required), and ensure precomputed lengths are used consistently on the correct strings/indices. Add tests that compare results against the original implementation for identical inputs, including edge cases with repeated candidates and varying lengths.", "confidence": 0.62}, "drafts_generated": 1, "drafts_survived": 1}
{"id": "0c62d428-6e36-40f0-9eaa-8106a51c26b2", "target_id": "B3-treatment", "git_sha": "68ba6ba40b324818ff2b5911b85fd3cff9ff3b92", "pre_experiment_sha": "177c2ef415797bf077333d4e68566b2e2f12e1ea", "timestamp": "2026-04-19T15:29:56.929006+00:00", "hypothesis": "Reduce repeated work by deduplicating candidate strings before distance checks and reusing precomputed lengths.", "hypothesis_source": "agent", "mutation_diff_summary": "", "score": 106.92, "score_ci_lower": null, "score_ci_upper": null, "raw_scores": null, "baseline_score": 111.04, "outcome": "KEPT", "failure_mode": null, "duration_seconds": 26.51052091596648, "tags": ["deduplication", "caching", "bounded-levenshtein", "micro-optimization"], "learnings": "{\"what_changed\":\"\",\"what_improved\":[],\"what_regressed\":[],\"transferable_insight\":\"Eliminating duplicate candidates and reusing precomputed metadata can reduce redundant computation without changing results.\",\"domain_tags\":[\"optimization\",\"deduplication\",\"memoization\"]}", "cost_usd": 0.08007, "bootstrap_seed": 0, "agent_model": "gpt-5.4", "held_out_score": null, "criterion_names": null, "per_criterion_scores": null, "failure_classification": null, "drafts_generated": 1, "drafts_survived": 1}
{"id": "df6983af-5191-45fa-b42b-e423a019d04b", "target_id": "B3-treatment", "git_sha": "68ba6ba40b324818ff2b5911b85fd3cff9ff3b92", "pre_experiment_sha": "68ba6ba40b324818ff2b5911b85fd3cff9ff3b92", "timestamp": "2026-04-19T15:30:31.411872+00:00", "hypothesis": "Precompute lengths for both unique name lists to avoid repeated len calls during bounded-distance matching.", "hypothesis_source": "agent", "mutation_diff_summary": "", "score": 106.98, "score_ci_lower": null, "score_ci_upper": null, "raw_scores": null, "baseline_score": 106.92, "outcome": "DISCARDED", "failure_mode": null, "duration_seconds": 30.79287150001619, "tags": ["length-caching", "deterministic-safe", "micro-optimization"], "learnings": "{\"what_changed\":\"\",\"what_improved\":[],\"what_regressed\":[],\"transferable_insight\":\"Micro-optimizations that reduce repeated trivial work can be neutral or discarded unless they measurably affect the actual bottleneck in the workflow.\",\"domain_tags\":[\"performance-optimization\",\"experimental-evaluation\",\"software-engineering\"]}", "cost_usd": 0.081356, "bootstrap_seed": 0, "agent_model": "gpt-5.4", "held_out_score": null, "criterion_names": null, "per_criterion_scores": null, "failure_classification": {"category": "logic_error", "description": "The experiment was intended to be an optimization (precomputing lengths), but the result failed with a nonsensical/unknown failure mode and a high score, indicating the change likely affected matching logic or assumptions rather than merely reducing repeated len calls.", "fix_direction": "Verify that precomputed lengths are computed from the correct lists (no off-by-one or swapped sources), and add targeted tests to confirm bounded-distance matching behavior is unchanged versus the baseline.", "confidence": 0.62}, "drafts_generated": 1, "drafts_survived": 1}
{"id": "91fe10b8-ea26-4600-a3f5-2090aa80d44d", "target_id": "B3-treatment", "git_sha": "74e72e2def0ed2f26c9009b695b03e6314877944", "pre_experiment_sha": "68ba6ba40b324818ff2b5911b85fd3cff9ff3b92", "timestamp": "2026-04-19T15:31:05.111607+00:00", "hypothesis": "Precompute lengths for both unique input lists to avoid repeated len calls during bounded matching.", "hypothesis_source": "agent", "mutation_diff_summary": "", "score": 106.55, "score_ci_lower": null, "score_ci_upper": null, "raw_scores": null, "baseline_score": 106.92, "outcome": "KEPT", "failure_mode": null, "duration_seconds": 31.1475971249165, "tags": ["length-caching", "bounded-levenshtein", "low-risk"], "learnings": "{\"what_changed\":\"\",\"what_improved\":[],\"what_regressed\":[],\"transferable_insight\":\"Precomputing values that are reused in tight loops can reduce repeated overhead, but only if the added bookkeeping does not outweigh the savings.\",\"domain_tags\":[\"optimization\",\"performance\",\"algorithm-design\"]}", "cost_usd": 0.081275, "bootstrap_seed": 0, "agent_model": "gpt-5.4", "held_out_score": null, "criterion_names": null, "per_criterion_scores": null, "failure_classification": null, "drafts_generated": 1, "drafts_survived": 1}
{"id": "3b252406-1480-4e99-adfd-d9ad8a8bf26b", "target_id": "B3-treatment", "git_sha": "48babaaa2f272f618d3ca68a026620faaba1cba2", "pre_experiment_sha": "74e72e2def0ed2f26c9009b695b03e6314877944", "timestamp": "2026-04-19T15:31:35.931614+00:00", "hypothesis": "Reuse Levenshtein row buffers to reduce repeated allocations while preserving exact bounded-distance behavior.", "hypothesis_source": "agent", "mutation_diff_summary": "", "score": 100.13, "score_ci_lower": null, "score_ci_upper": null, "raw_scores": null, "baseline_score": 106.55, "outcome": "KEPT", "failure_mode": null, "duration_seconds": 29.641023457981646, "tags": ["buffer-reuse", "levenshtein", "caching", "deterministic-safe"], "learnings": "{\"what_changed\":\"\",\"what_improved\":[],\"what_regressed\":[],\"transferable_insight\":\"Reusing temporary working buffers can reduce allocation overhead without changing results, as long as the algorithm\u2019s boundary conditions and update order are preserved exactly.\",\"domain_tags\":[\"performance-optimization\",\"memory-management\",\"algorithm-design\"]}", "cost_usd": 0.081765, "bootstrap_seed": 0, "agent_model": "gpt-5.4", "held_out_score": null, "criterion_names": null, "per_criterion_scores": null, "failure_classification": null, "drafts_generated": 1, "drafts_survived": 1}
{"id": "e9d4998c-cc96-41f3-9f7a-4d18f05d8fad", "target_id": "B3-treatment", "git_sha": "48babaaa2f272f618d3ca68a026620faaba1cba2", "pre_experiment_sha": "48babaaa2f272f618d3ca68a026620faaba1cba2", "timestamp": "2026-04-19T15:32:13.486038+00:00", "hypothesis": "Reuse Levenshtein row buffers across comparisons while preserving exact matching behavior.", "hypothesis_source": "agent", "mutation_diff_summary": "", "score": 125.4, "score_ci_lower": null, "score_ci_upper": null, "raw_scores": null, "baseline_score": 100.13, "outcome": "DISCARDED", "failure_mode": null, "duration_seconds": 33.45769729197491, "tags": ["performance", "caching", "buffer-reuse", "deterministic"], "learnings": "{\"what_changed\":\"\",\"what_improved\":[],\"what_regressed\":[],\"transferable_insight\":\"When an optimization changes only internal resource reuse and leaves observable results unchanged, it may still be discarded if it adds complexity without measurable benefit.\",\"domain_tags\":[\"optimization\",\"software-engineering\"]}", "cost_usd": 0.0854792, "bootstrap_seed": 0, "agent_model": "gpt-5.4", "held_out_score": null, "criterion_names": null, "per_criterion_scores": null, "failure_classification": {"category": "semantic_drift", "description": "The change intended to reuse Levenshtein row buffers altered the exact matching behavior. Reusing buffers without fully resetting/isolating per-comparison state likely caused residual values from prior comparisons to affect subsequent results, producing incorrect similarity outputs despite apparently valid execution.", "fix_direction": "Ensure buffer reuse preserves correctness: fully reinitialize or overwrite all relevant cells per comparison, avoid cross-request/shared mutable state, and add targeted tests for exact-match and near-match cases to verify identical behavior to the baseline implementation.", "confidence": 0.62}, "drafts_generated": 1, "drafts_survived": 1}
{"id": "2b8c0a18-79af-42a6-b53e-811ff910caf4", "target_id": "B3-treatment", "git_sha": "48babaaa2f272f618d3ca68a026620faaba1cba2", "pre_experiment_sha": "48babaaa2f272f618d3ca68a026620faaba1cba2", "timestamp": "2026-04-19T15:32:48.224956+00:00", "hypothesis": "Reuse Levenshtein row buffers and cache character/length metadata to reduce repeated bounded-distance work without changing results.", "hypothesis_source": "agent", "mutation_diff_summary": "", "score": 105.53, "score_ci_lower": null, "score_ci_upper": null, "raw_scores": null, "baseline_score": 100.13, "outcome": "DISCARDED", "failure_mode": null, "duration_seconds": 32.25517620902974, "tags": ["performance", "levenshtein", "buffer-reuse", "length-caching"], "learnings": "{\"what_changed\":\"\",\"what_improved\":[],\"what_regressed\":[],\"transferable_insight\":\"When an optimization only reuses intermediate state and cached metadata, it can preserve correctness while still failing to produce measurable gains if the repeated work is not the true bottleneck.\",\"domain_tags\":[\"optimization\",\"performance-engineering\",\"algorithm-design\"]}", "cost_usd": 0.08581440000000001, "bootstrap_seed": 0, "agent_model": "gpt-5.4", "held_out_score": null, "criterion_names": null, "per_criterion_scores": null, "failure_classification": {"category": "over_optimization", "description": "The change likely reduced or altered bounded-distance computation by reusing cached Levenshtein row buffers and character/length metadata, but produced inconsistent evaluation outcomes (score increased abnormally relative to expectation), suggesting results were inadvertently affected despite the claim of no change. This points to gaming/assumptions around repeated distance work rather than a stable correctness-preserving optimization.", "fix_direction": "Validate correctness across varied inputs: add unit tests comparing optimized vs baseline Levenshtein outputs for many randomized cases, ensure buffer reuse properly resets all relevant state (row contents and sentinel boundaries), and confirm cache keys/invalidations are sound (per input pair / per max distance) so metadata cannot be reused across incompatible runs.", "confidence": 0.62}, "drafts_generated": 1, "drafts_survived": 1}
{"id": "bffcfcf3-8e4b-4cf4-82ad-ed022c137d37", "target_id": "B3-treatment", "git_sha": "48babaaa2f272f618d3ca68a026620faaba1cba2", "pre_experiment_sha": "48babaaa2f272f618d3ca68a026620faaba1cba2", "timestamp": "2026-04-19T15:33:22.936405+00:00", "hypothesis": "Reuse Levenshtein row buffers across comparisons while caching lengths to reduce repeated allocations without changing results.", "hypothesis_source": "agent", "mutation_diff_summary": "", "score": 134.94, "score_ci_lower": null, "score_ci_upper": null, "raw_scores": null, "baseline_score": 100.13, "outcome": "DISCARDED", "failure_mode": null, "duration_seconds": 31.959977417020127, "tags": ["performance", "levenshtein", "caching", "buffer-reuse", "deterministic"], "learnings": "{\"what_changed\":\"\",\"what_improved\":[],\"what_regressed\":[],\"transferable_insight\":\"Reusing intermediate buffers and caching invariant values can reduce overhead without affecting correctness when the underlying computation is repeated many times.\",\"domain_tags\":[\"performance-optimization\",\"memory-management\",\"algorithmic-efficiency\"]}", "cost_usd": 0.08579140000000002, "bootstrap_seed": 0, "agent_model": "gpt-5.4", "held_out_score": null, "criterion_names": null, "per_criterion_scores": null, "failure_classification": {"category": "incomplete_edit", "description": "The experiment was intended to reuse Levenshtein row buffers and cache lengths to avoid allocations, but it resulted in a failed run (failure mode reported as unknown) with a high score, suggesting the change did not fully preserve consistent buffer/length state across comparisons (e.g., stale length values or leftover buffer contents impacting later computations).", "fix_direction": "Validate that buffer reuse is correctly reset/initialized per comparison and that cached lengths correspond to the current input pairs; add targeted tests and assertions around buffer contents and length caching boundaries, especially for multiple sequential comparisons.", "confidence": 0.62}, "drafts_generated": 1, "drafts_survived": 1}
