{"id": "c19cb387-f109-4f6a-8db1-618d90f6602f", "target_id": "B4-control", "git_sha": "69951ad418eb2b1d05c0e632c9c14ee417f71fe6", "pre_experiment_sha": "f60275b4d741dfc1ae396c3562f1504170a4dee0", "timestamp": "2026-04-21T23:29:39.151902+00:00", "hypothesis": "Revert nested conditional logic in `validate_email` and inline dictionary membership checks in `list_users` to restore boolean evaluation efficiency and local variable caching, recovering from the recent performance regression.", "hypothesis_source": "agent", "mutation_diff_summary": "", "score": 0.48, "score_ci_lower": null, "score_ci_upper": null, "raw_scores": null, "baseline_score": 0.48, "outcome": "KEPT", "failure_mode": null, "duration_seconds": 56.048097874969244, "tags": ["micro-optimization", "revert", "control-flow"], "learnings": "{\"what_changed\":\"\",\"what_improved\":[],\"what_regressed\":[],\"transferable_insight\":\"Simplifying nested conditional logic and utilizing local variable caching can improve code maintainability and theoretical efficiency, even if it does not yield measurable performance gains.\",\"domain_tags\":[\"Software Engineering\",\"Performance Optimization\",\"Code Refactoring\"]}", "cost_usd": 0.01893375, "bootstrap_seed": 0, "agent_model": "gemini-3.1-pro-preview", "held_out_score": null, "criterion_names": null, "per_criterion_scores": null, "failure_classification": null, "drafts_generated": 1, "drafts_survived": 1}
{"id": "4496cc95-68f6-4db7-a489-0bfb7dc3015f", "target_id": "B4-control", "git_sha": "3b3e96658875e702776442b904288fb6bf1d8154", "pre_experiment_sha": "69951ad418eb2b1d05c0e632c9c14ee417f71fe6", "timestamp": "2026-04-21T23:30:58.540611+00:00", "hypothesis": "Defer `db.values()` resolution in `list_users` until after the empty filter fast-path, and cache attributes using chained assignments in `update_user` to eliminate redundant attribute lookups during dictionary construction.", "hypothesis_source": "agent", "mutation_diff_summary": "", "score": 0.48, "score_ci_lower": null, "score_ci_upper": null, "raw_scores": null, "baseline_score": 0.48, "outcome": "KEPT", "failure_mode": null, "duration_seconds": 53.8240542919375, "tags": ["micro-optimization", "dictionary-access", "local-caching", "fast-path"], "learnings": "{\"what_changed\":\"\",\"what_improved\":[],\"what_regressed\":[],\"transferable_insight\":\"Delaying expensive operations until after early-exit conditions are evaluated and caching frequently accessed attributes locally minimizes redundant processing overhead.\",\"domain_tags\":[\"Performance Optimization\",\"Lazy Evaluation\",\"Code Refactoring\"]}", "cost_usd": 0.01962625, "bootstrap_seed": 0, "agent_model": "gemini-3.1-pro-preview", "held_out_score": null, "criterion_names": null, "per_criterion_scores": null, "failure_classification": null, "drafts_generated": 1, "drafts_survived": 1}
{"id": "3c58a577-55a1-4b94-8834-5cfbbc90ac5b", "target_id": "B4-control", "git_sha": "b1d6c3a270d4fa01e416cbcc42b645d1193b6e25", "pre_experiment_sha": "3b3e96658875e702776442b904288fb6bf1d8154", "timestamp": "2026-04-21T23:32:25.486475+00:00", "hypothesis": "Split the compound `and` condition in `list_users` into nested `if` statements to reduce operator overhead and improve bytecode layout, while preserving boolean local variables.", "hypothesis_source": "agent", "mutation_diff_summary": "", "score": 0.48, "score_ci_lower": null, "score_ci_upper": null, "raw_scores": null, "baseline_score": 0.48, "outcome": "KEPT", "failure_mode": null, "duration_seconds": 81.24775520781986, "tags": ["micro-optimization", "control-flow", "nested-ifs"], "learnings": "{\"what_changed\":\"\",\"what_improved\":[],\"what_regressed\":[],\"transferable_insight\":\"Replacing compound logical conditions with nested statements for the sake of micro-optimization often yields negligible performance differences in modern execution environments.\",\"domain_tags\":[\"Code Optimization\",\"Micro-optimization\",\"Control Flow\"]}", "cost_usd": 0.019426250000000003, "bootstrap_seed": 0, "agent_model": "gemini-3.1-pro-preview", "held_out_score": null, "criterion_names": null, "per_criterion_scores": null, "failure_classification": null, "drafts_generated": 1, "drafts_survived": 1}
