{"id": "e6ff37b7-8f82-47c3-abc6-d8c4b9ebfc55", "target_id": "B4-control", "git_sha": "4aeedc22d2ed0bb7ecea1cbf86acf89d9ce8bedc", "pre_experiment_sha": "98720ed81b388f89159675b9a957acbab5e8f23e", "timestamp": "2026-04-23T19:29:40.053841+00:00", "hypothesis": "Optimizing the API by using `__slots__` for the `User` class, replacing manual loops with fast list comprehensions in `list_users`, and streamlining dictionary accesses and validation functions will significantly improve execution speed.", "hypothesis_source": "agent", "mutation_diff_summary": "", "score": 0.51, "score_ci_lower": null, "score_ci_upper": null, "raw_scores": null, "baseline_score": 0.435, "outcome": "KEPT", "failure_mode": null, "duration_seconds": 86.5267190830782, "tags": ["performance", "memory-optimization", "list-comprehension"], "learnings": "{\"what_changed\":\"\",\"what_improved\":[],\"what_regressed\":[],\"transferable_insight\":\"Utilizing built-in optimized iteration constructs and minimizing memory overhead in data structures significantly enhances overall execution speed.\",\"domain_tags\":[\"Performance Optimization\",\"Software Engineering\",\"Code Refactoring\"]}", "cost_usd": 0.014770000000000002, "bootstrap_seed": 0, "agent_model": "gemini-3.1-pro-preview", "held_out_score": null, "criterion_names": null, "per_criterion_scores": null, "failure_classification": null, "drafts_generated": 1, "drafts_survived": 1}
{"id": "a799497d-3457-4646-bf07-5ec491af34b2", "target_id": "B4-control", "git_sha": "4aeedc22d2ed0bb7ecea1cbf86acf89d9ce8bedc", "pre_experiment_sha": "4aeedc22d2ed0bb7ecea1cbf86acf89d9ce8bedc", "timestamp": "2026-04-23T19:31:24.081396+00:00", "hypothesis": "Cache the dictionary representation and lowercased name in the `User` object to avoid recreating dictionaries and calling `.lower()` repeatedly during `list_users` and other read operations.", "hypothesis_source": "agent", "mutation_diff_summary": "", "score": 0.51, "score_ci_lower": null, "score_ci_upper": null, "raw_scores": null, "baseline_score": 0.51, "outcome": "DISCARDED", "failure_mode": null, "duration_seconds": 97.62887491704896, "tags": ["performance", "caching", "loop-optimization"], "learnings": "{\"what_changed\":\"\",\"what_improved\":[],\"what_regressed\":[],\"transferable_insight\":\"Caching lightweight, natively optimized operations like string transformations or basic object serialization often yields negligible performance gains while unnecessarily increasing state complexity.\",\"domain_tags\":[\"Performance Optimization\",\"Caching\",\"Data Serialization\"]}", "cost_usd": 0.01418295, "bootstrap_seed": 0, "agent_model": "gemini-3.1-pro-preview", "held_out_score": null, "criterion_names": null, "per_criterion_scores": null, "failure_classification": {"category": "logic_error", "description": "The experiment failed likely due to a flaw in the underlying logic of the optimization strategy. This could mean that the overhead introduced by caching (e.g., memory consumption, CPU cycles for cache maintenance and invalidation) outweighed the benefits of avoiding repeated dictionary creation and lowercasing. Alternatively, the caching mechanism might have been implemented incorrectly, leading to stale data, increased complexity, or other bugs that degraded overall performance or correctness, resulting in the low score of 0.5100.", "fix_direction": "First, conduct thorough profiling to confirm if the `dict()` representation creation and `.lower()` calls are indeed significant bottlenecks. If so, re-evaluate the caching strategy by considering the full lifecycle cost of the cache (initial creation, storage, updates/invalidation). Explore alternative optimization approaches like lazy evaluation or ensuring immutability if possible. Implement with robust unit and integration tests, and performance benchmarks to prevent regressions.", "confidence": 0.9}, "drafts_generated": 1, "drafts_survived": 1}
{"id": "a3b636f8-125e-43fb-850e-f3717699049f", "target_id": "B4-control", "git_sha": "4aeedc22d2ed0bb7ecea1cbf86acf89d9ce8bedc", "pre_experiment_sha": "4aeedc22d2ed0bb7ecea1cbf86acf89d9ce8bedc", "timestamp": "2026-04-23T19:33:55.772459+00:00", "hypothesis": "Cache the serialized dictionary representations and the lowercased name directly within the `User` object to eliminate dictionary creation and string manipulation overhead during repeated reads and filtering in `list_users`.", "hypothesis_source": "agent", "mutation_diff_summary": "", "score": 0.51, "score_ci_lower": null, "score_ci_upper": null, "raw_scores": null, "baseline_score": 0.51, "outcome": "DISCARDED", "failure_mode": null, "duration_seconds": 121.3091799588874, "tags": ["performance", "caching", "memory-optimization"], "learnings": "{\"what_changed\":\"\",\"what_improved\":[],\"what_regressed\":[],\"transferable_insight\":\"Caching pre-computed or serialized representations directly on objects may fail to improve performance if the overhead of initialization and memory allocation outweighs the computational savings during read operations.\",\"domain_tags\":[\"Software Engineering\",\"Performance Optimization\",\"Caching\"]}", "cost_usd": 0.015002300000000001, "bootstrap_seed": 0, "agent_model": "gemini-3.1-pro-preview", "held_out_score": null, "criterion_names": null, "per_criterion_scores": null, "failure_classification": {"category": "logic_error", "description": "The experiment attempted a performance optimization based on the hypothesis that dictionary creation and string manipulation were significant bottlenecks. However, the score of 0.5100 suggests that this assumption was likely incorrect, or the overhead introduced by caching (e.g., increased memory usage, serialization/deserialization costs) negated any potential performance gains. This indicates a flaw in the reasoning or analysis of the system's actual performance bottlenecks and the effectiveness of the proposed optimization.", "fix_direction": "Before attempting further optimizations, use profiling tools to accurately identify the true performance bottlenecks in the `list_users` function. Focus on optimizing the most time-consuming operations rather than speculative ones. Carefully evaluate the trade-offs of any caching mechanism, considering its memory footprint, update costs, and the actual frequency and cost of the operations it aims to avoid.", "confidence": 0.9}, "drafts_generated": 1, "drafts_survived": 1}
{"id": "893e65fd-a9fc-46d2-81d4-192e26725877", "target_id": "B4-control", "git_sha": "4aeedc22d2ed0bb7ecea1cbf86acf89d9ce8bedc", "pre_experiment_sha": "4aeedc22d2ed0bb7ecea1cbf86acf89d9ce8bedc", "timestamp": "2026-04-23T19:35:44.660138+00:00", "hypothesis": "Optimize `validate_email` using direct unpacking to avoid list length checks, and streamline object instantiation in `create_user` by using positional arguments.", "hypothesis_source": "agent", "mutation_diff_summary": "", "score": 0.51, "score_ci_lower": null, "score_ci_upper": null, "raw_scores": null, "baseline_score": 0.51, "outcome": "DISCARDED", "failure_mode": null, "duration_seconds": 76.40216879197396, "tags": ["performance", "dictionary-access", "string-parsing"], "learnings": "{\"what_changed\":\"\",\"what_improved\":[],\"what_regressed\":[],\"transferable_insight\":\"Micro-optimizations such as direct variable unpacking and positional argument passing rarely yield measurable performance improvements over standard explicit checks and keyword assignments.\",\"domain_tags\":[\"Micro-optimization\",\"Performance Tuning\",\"Code Refactoring\"]}", "cost_usd": 0.0148498, "bootstrap_seed": 0, "agent_model": "gemini-3.1-pro-preview", "held_out_score": null, "criterion_names": null, "per_criterion_scores": null, "failure_classification": {"category": "semantic_drift", "description": "The experiment attempted to optimize code by changing argument passing and data handling methods, specifically using direct unpacking for `validate_email` and positional arguments for `create_user`. While these changes might be syntactically valid, they likely violated the implicit or explicit semantic contracts of the functions and constructors involved. For instance, direct unpacking would fail if `validate_email`'s input was not consistently the exact expected length, and using positional arguments for `create_user` would fail if the `User` constructor expected keyword arguments or a different order/number of positional arguments. The 'optimization' changed the meaning of how data was processed or objects were instantiated, leading to runtime errors or incorrect behavior, reflected in the partial score of 0.5100.", "fix_direction": "Verify the exact input structures and function/constructor signatures before attempting optimizations. Ensure that any changes maintain the original semantic contract and expected behavior of the code. Profile the existing code to identify actual bottlenecks instead of making assumptions about 'streamlining' or 'direct unpacking' benefits without concrete data. Add robust unit tests for function interfaces and argument handling.", "confidence": 0.9}, "drafts_generated": 1, "drafts_survived": 1}
{"id": "ee1ffed7-98da-4893-8d0d-a3fb700bbf87", "target_id": "B4-control", "git_sha": "c97d8ebc36ac9cbcb8b40fd66c47135768f00825", "pre_experiment_sha": "4aeedc22d2ed0bb7ecea1cbf86acf89d9ce8bedc", "timestamp": "2026-04-23T19:37:55.800529+00:00", "hypothesis": "Inline email validation in create and update functions to avoid function call overhead, and replace try/except in validate_email with type checking for better performance.", "hypothesis_source": "agent", "mutation_diff_summary": "", "score": 0.525, "score_ci_lower": null, "score_ci_upper": null, "raw_scores": null, "baseline_score": 0.51, "outcome": "KEPT", "failure_mode": null, "duration_seconds": 107.8618653328158, "tags": ["performance", "inline", "validation"], "learnings": "{\"what_changed\":\"\",\"what_improved\":[],\"what_regressed\":[],\"transferable_insight\":\"Replacing exception-based control flow with explicit condition checking and inlining frequently used validation logic reduces execution overhead and improves overall performance.\",\"domain_tags\":[\"Performance Optimization\",\"Code Refactoring\",\"Error Handling\"]}", "cost_usd": 0.01606125, "bootstrap_seed": 0, "agent_model": "gemini-3.1-pro-preview", "held_out_score": null, "criterion_names": null, "per_criterion_scores": null, "failure_classification": null, "drafts_generated": 1, "drafts_survived": 1}
{"id": "8afcfd8a-af5b-4482-821e-66d828f81a6f", "target_id": "B4-control", "git_sha": "c97d8ebc36ac9cbcb8b40fd66c47135768f00825", "pre_experiment_sha": "c97d8ebc36ac9cbcb8b40fd66c47135768f00825", "timestamp": "2026-04-23T19:39:14.598722+00:00", "hypothesis": "Optimize type checks using `type(x) is str`, streamline email validation checks, use positional arguments for `User` instantiation, and directly import `datetime` to reduce attribute access overhead.", "hypothesis_source": "agent", "mutation_diff_summary": "", "score": 0.525, "score_ci_lower": null, "score_ci_upper": null, "raw_scores": null, "baseline_score": 0.525, "outcome": "DISCARDED", "failure_mode": null, "duration_seconds": 70.13092995900661, "tags": ["performance", "micro-optimization", "type-check", "inline-validation"], "learnings": "{\"what_changed\":\"\",\"what_improved\":[],\"what_regressed\":[],\"transferable_insight\":\"Micro-optimizations targeting syntax-level overhead, such as altering import styles or argument passing methods, often yield negligible performance gains and do not meaningfully impact overall system efficiency.\",\"domain_tags\":[\"Performance Optimization\",\"Micro-optimization\",\"Code Refactoring\"]}", "cost_usd": 0.016284450000000002, "bootstrap_seed": 0, "agent_model": "gemini-3.1-pro-preview", "held_out_score": null, "criterion_names": null, "per_criterion_scores": null, "failure_classification": {"category": "over_optimization", "description": "The experiment focused heavily on micro-optimizations (e.g., `type(x) is str` for type checks, positional arguments, direct imports for attribute access). These types of optimizations often provide negligible real-world benefits and can sometimes introduce subtle bugs (like `semantic_drift` when replacing `isinstance` with `type() is`) or reduce code clarity and robustness, leading to a net negative outcome as indicated by the low score.", "fix_direction": "Prioritize correctness, readability, and broader architectural/algorithmic improvements over micro-optimizations. Only pursue micro-optimizations after thorough profiling has identified specific bottlenecks, and ensure such changes do not alter behavior or reduce code maintainability. For type checks, generally prefer `isinstance()` over `type() is` for robustness against inheritance.", "confidence": 0.95}, "drafts_generated": 1, "drafts_survived": 1}
{"id": "0370d61d-3eaa-4749-817a-6d05a7dfeff5", "target_id": "B4-control", "git_sha": "c97d8ebc36ac9cbcb8b40fd66c47135768f00825", "pre_experiment_sha": "c97d8ebc36ac9cbcb8b40fd66c47135768f00825", "timestamp": "2026-04-23T19:40:48.065765+00:00", "hypothesis": "Remove dead code (`validate_email`) and use implicit boolean evaluation for string emptiness in email validation to slightly improve execution speed.", "hypothesis_source": "agent", "mutation_diff_summary": "", "score": 0.525, "score_ci_lower": null, "score_ci_upper": null, "raw_scores": null, "baseline_score": 0.525, "outcome": "DISCARDED", "failure_mode": null, "duration_seconds": 65.57306500012055, "tags": ["cleanup", "micro-optimization"], "learnings": "{\"what_changed\":\"\",\"what_improved\":[],\"what_regressed\":[],\"transferable_insight\":\"Micro-optimizations like removing dead code or using implicit boolean evaluations for emptiness checks rarely yield measurable performance improvements.\",\"domain_tags\":[\"Code Optimization\",\"Performance Tuning\",\"Refactoring\"]}", "cost_usd": 0.01581675, "bootstrap_seed": 0, "agent_model": "gemini-3.1-pro-preview", "held_out_score": null, "criterion_names": null, "per_criterion_scores": null, "failure_classification": {"category": "regression", "description": "The experiment aimed to improve execution speed, but the low score (0.5250) indicates that the desired improvement was not achieved. This could mean execution speed either did not improve sufficiently or worsened, or that the changes (removing `validate_email` or using implicit boolean evaluation) introduced functional defects in the email validation logic, degrading a previously passing criterion for correctness or performance.", "fix_direction": "1. Verify whether `validate_email` was truly dead code; if it was used, restore it and address any dependencies. 2. Thoroughly test the new implicit boolean evaluation against the original explicit check, paying close attention to edge cases like `None` or various empty string representations, to ensure semantic equivalence. 3. Profile the application's performance to identify the exact cause of the lack of speed improvement or any slowdown.", "confidence": 0.9}, "drafts_generated": 1, "drafts_survived": 1}
{"id": "8f0f6948-9899-4d56-9644-2bea3450ace4", "target_id": "B4-control", "git_sha": "c97d8ebc36ac9cbcb8b40fd66c47135768f00825", "pre_experiment_sha": "c97d8ebc36ac9cbcb8b40fd66c47135768f00825", "timestamp": "2026-04-23T19:42:33.915435+00:00", "hypothesis": "Simplify string emptiness checks and remove intermediate dictionary key lookups in `list_users` to slightly reduce overhead without altering state management or instantiation signatures.", "hypothesis_source": "agent", "mutation_diff_summary": "", "score": 0.525, "score_ci_lower": null, "score_ci_upper": null, "raw_scores": null, "baseline_score": 0.525, "outcome": "DISCARDED", "failure_mode": null, "duration_seconds": 79.15140225016512, "tags": ["performance", "dictionary-lookup", "boolean-evaluation"], "learnings": "{\"what_changed\":\"\",\"what_improved\":[],\"what_regressed\":[],\"transferable_insight\":\"Micro-optimizations targeting basic syntax, such as string emptiness checks and intermediate dictionary lookups, typically yield negligible performance improvements in high-level application logic.\",\"domain_tags\":[\"Performance Optimization\",\"Micro-optimization\",\"Code Refactoring\"]}", "cost_usd": 0.016350750000000004, "bootstrap_seed": 0, "agent_model": "gemini-3.1-pro-preview", "held_out_score": null, "criterion_names": null, "per_criterion_scores": null, "failure_classification": {"category": "logic_error", "description": "The 'simplification' of string emptiness checks or the 'removal' of intermediate dictionary lookups likely introduced unintended changes to the behavior of the `list_users` function. This could manifest as incorrect filtering of users, misinterpretation of data, or other functional issues that directly impact the correctness of the output, outweighing any potential overhead reduction. The score indicates a significant functional degradation.", "fix_direction": "Revert the changes to the string emptiness checks and dictionary lookups, then re-evaluate the exact cause of the overhead. If optimization is still desired, implement changes incrementally with extensive unit and integration tests to ensure no logical regressions are introduced. Focus on maintaining strict semantic equivalence while optimizing. Profile the code before and after changes to accurately measure overhead reduction and ensure no new bottlenecks emerge.", "confidence": 0.9}, "drafts_generated": 1, "drafts_survived": 1}
{"id": "391e2fe2-4846-4f6f-9262-a43849e812b9", "target_id": "B4-control", "git_sha": "2b2171394f0a1062c8817564a5778bb6a394a04b", "pre_experiment_sha": "c97d8ebc36ac9cbcb8b40fd66c47135768f00825", "timestamp": "2026-04-23T19:45:23.126042+00:00", "hypothesis": "Replace costly `try/except` blocks with precise `isinstance` type checking and eliminate redundant string checks to reduce overhead in validation and API endpoints.", "hypothesis_source": "agent", "mutation_diff_summary": "", "score": 0.6, "score_ci_lower": null, "score_ci_upper": null, "raw_scores": null, "baseline_score": 0.525, "outcome": "KEPT", "failure_mode": null, "duration_seconds": 147.80169879179448, "tags": ["performance", "type-checking", "exception-handling", "string-validation"], "learnings": "{\"what_changed\":\"\",\"what_improved\":[],\"what_regressed\":[],\"transferable_insight\":\"Replacing exception-based control flow with direct type checking reduces performance overhead in high-throughput validation and processing pipelines.\",\"domain_tags\":[\"Performance Optimization\",\"Error Handling\",\"Validation\"]}", "cost_usd": 0.01743375, "bootstrap_seed": 0, "agent_model": "gemini-3.1-pro-preview", "held_out_score": null, "criterion_names": null, "per_criterion_scores": null, "failure_classification": null, "drafts_generated": 1, "drafts_survived": 1}
{"id": "94bdb08c-84b3-4f0b-ac05-a779b630c38f", "target_id": "B4-control", "git_sha": "2b2171394f0a1062c8817564a5778bb6a394a04b", "pre_experiment_sha": "2b2171394f0a1062c8817564a5778bb6a394a04b", "timestamp": "2026-04-23T19:47:22.428907+00:00", "hypothesis": "Replace costly `try/except TypeError` blocks in `get_user`, `update_user`, and `delete_user` with fast `isinstance` checks to avoid exception overhead when handling unhashable types like dicts or lists.", "hypothesis_source": "agent", "mutation_diff_summary": "", "score": 0.6, "score_ci_lower": null, "score_ci_upper": null, "raw_scores": null, "baseline_score": 0.6, "outcome": "DISCARDED", "failure_mode": null, "duration_seconds": 97.74229708383791, "tags": ["error-handling", "performance", "type-checking"], "learnings": "{\"what_changed\":\"\",\"what_improved\":[],\"what_regressed\":[],\"transferable_insight\":\"Replacing exception-based error handling with pre-emptive type validation yields no measurable performance benefit if the error conditions are rarely encountered.\",\"domain_tags\":[\"Performance Optimization\",\"Error Handling\",\"Code Refactoring\"]}", "cost_usd": 0.018194650000000003, "bootstrap_seed": 0, "agent_model": "gemini-3.1-pro-preview", "held_out_score": null, "criterion_names": null, "per_criterion_scores": null, "failure_classification": {"category": "over_optimization", "description": "The experiment attempted a micro-optimization by replacing robust `try/except TypeError` blocks with `isinstance` checks to reduce exception overhead. This likely resulted in a loss of functional correctness because `TypeError` can be raised for a variety of reasons beyond just unhashable types (dicts/lists). The simplified `isinstance` logic likely failed to catch other valid `TypeError` scenarios or unexpected inputs, leading to unhandled errors or incorrect behavior and thus degrading the overall score, demonstrating that the 'optimization' negatively impacted reliability or correctness.", "fix_direction": "Re-evaluate the actual performance bottleneck and ensure any proposed optimization fully replicates the robust error handling of the original mechanism. Instead of broad `isinstance` checks for a subset of `TypeError` causes, consider implementing comprehensive input validation or reverting to the more robust `try/except` if the performance gain is not significant enough to offset the loss in correctness. Focus on addressing specific performance hotspots rather than speculative global replacements.", "confidence": 0.95}, "drafts_generated": 1, "drafts_survived": 1}
