{"id": "9b587d2f-1ecb-4f25-9303-0beaa2aadabe", "target_id": "B4-control", "git_sha": "66eb6ed42e643f8c026020e9a90e3d2e06b4ef65", "pre_experiment_sha": "674dfddaf5703b71bb83d4457444aa7a1aedae6c", "timestamp": "2026-04-19T16:28:13.210297+00:00", "hypothesis": "Tighten the shared pre-check to validate action-specific part structure so every endpoint uses one explicit validated path with no malformed-part fallthrough.", "hypothesis_source": "agent", "mutation_diff_summary": "", "score": 0.7, "score_ci_lower": null, "score_ci_upper": null, "raw_scores": null, "baseline_score": 0.7, "outcome": "KEPT", "failure_mode": null, "duration_seconds": 22.45533499994781, "tags": ["deterministic", "validation", "control-flow", "precheck"], "learnings": "{\"what_changed\":\"\",\"what_improved\":[],\"what_regressed\":[],\"transferable_insight\":\"Making shared validation explicitly enforce each action\u2019s required structure prevents malformed inputs from slipping through alternate paths and keeps behavior consistent across endpoints.\",\"domain_tags\":[\"validation\",\"input-sanitization\",\"api-design\"]}", "cost_usd": 0.067135, "bootstrap_seed": 0, "agent_model": "gpt-5.4", "held_out_score": null, "criterion_names": null, "per_criterion_scores": null, "failure_classification": null, "drafts_generated": 1, "drafts_survived": 1}
{"id": "a0d5ee5d-3824-44ae-9edd-6c7e02a1123c", "target_id": "B4-control", "git_sha": "fd36eb52f2bf0a5d18a46ee7b78c0df12c05ac28", "pre_experiment_sha": "66eb6ed42e643f8c026020e9a90e3d2e06b4ef65", "timestamp": "2026-04-19T16:28:39.974271+00:00", "hypothesis": "Make the shared pre-check reject malformed part payloads with one fixed helper before any per-part canonicalization to further centralize invalid-input control flow.", "hypothesis_source": "agent", "mutation_diff_summary": "", "score": 0.7, "score_ci_lower": null, "score_ci_upper": null, "raw_scores": null, "baseline_score": 0.7, "outcome": "KEPT", "failure_mode": null, "duration_seconds": 21.830225082929246, "tags": ["deterministic", "validation", "control-flow", "precheck"], "learnings": "{\"what_changed\":\"\",\"what_improved\":[],\"what_regressed\":[],\"transferable_insight\":\"Centralizing validation in one early, shared check simplifies control flow by rejecting invalid inputs before specialized processing begins.\",\"domain_tags\":[\"software-engineering\",\"validation\",\"control-flow\"]}", "cost_usd": 0.06821, "bootstrap_seed": 0, "agent_model": "gpt-5.4", "held_out_score": null, "criterion_names": null, "per_criterion_scores": null, "failure_classification": null, "drafts_generated": 1, "drafts_survived": 1}
{"id": "74bb49eb-9fce-4100-9da4-af1351aa965c", "target_id": "B4-control", "git_sha": "f4daaa761989ee66b82b8692007d7be34ffbf28b", "pre_experiment_sha": "fd36eb52f2bf0a5d18a46ee7b78c0df12c05ac28", "timestamp": "2026-04-19T16:29:04.097322+00:00", "hypothesis": "Route all public endpoints through one explicit shared request builder so every call uses the same validated execution path and response helpers.", "hypothesis_source": "agent", "mutation_diff_summary": "", "score": 0.7, "score_ci_lower": null, "score_ci_upper": null, "raw_scores": null, "baseline_score": 0.7, "outcome": "KEPT", "failure_mode": null, "duration_seconds": 22.956751166959293, "tags": ["deterministic", "control-flow", "shared-entry"], "learnings": "{\"what_changed\":\"\",\"what_improved\":[],\"what_regressed\":[],\"transferable_insight\":\"Centralizing repeated operations behind one validated shared path improves consistency and makes behavior easier to reason about across all uses.\",\"domain_tags\":[\"software-engineering\",\"architecture\",\"reliability\"]}", "cost_usd": 0.06845000000000001, "bootstrap_seed": 0, "agent_model": "gpt-5.4", "held_out_score": null, "criterion_names": null, "per_criterion_scores": null, "failure_classification": null, "drafts_generated": 1, "drafts_survived": 1}
