{"id": "ddad2dda-17e8-432e-bcb9-0db750f718c0", "target_id": "B4-control", "git_sha": "8804cd65c48b7eb48f1fc8260afb82a05b064f79", "pre_experiment_sha": "f938b07edd1b8376aa16ebfd20a8109bf12cfc7c", "timestamp": "2026-04-21T22:52:33.944058+00:00", "hypothesis": "Optimize `list_users` by using nested `if` statements instead of `and` operators to slightly reduce branching overhead and improve bytecode layout.", "hypothesis_source": "agent", "mutation_diff_summary": "", "score": 0.525, "score_ci_lower": null, "score_ci_upper": null, "raw_scores": null, "baseline_score": 0.525, "outcome": "KEPT", "failure_mode": null, "duration_seconds": 54.10357325011864, "tags": ["optimization", "control-flow", "micro-optimization"], "learnings": "{\"what_changed\":\"\",\"what_improved\":[],\"what_regressed\":[],\"transferable_insight\":\"Replacing logical operators with nested conditionals to reduce branching overhead often yields negligible performance improvements.\",\"domain_tags\":[\"Code Optimization\",\"Micro-optimization\",\"Performance Tuning\"]}", "cost_usd": 0.01653375, "bootstrap_seed": 0, "agent_model": "gemini-3.1-pro-preview", "held_out_score": null, "criterion_names": null, "per_criterion_scores": null, "failure_classification": null, "drafts_generated": 1, "drafts_survived": 1}
{"id": "df5a9196-5c1f-4df3-b174-253f588f396a", "target_id": "B4-control", "git_sha": "b6721e9f7f986c18555000a2b6e543be02acfc08", "pre_experiment_sha": "8804cd65c48b7eb48f1fc8260afb82a05b064f79", "timestamp": "2026-04-21T22:54:34.851898+00:00", "hypothesis": "Replace `u.active` with the local variable `f_active` in the dictionary construction within the `has_active` branches of `list_users` to avoid redundant attribute lookups.", "hypothesis_source": "agent", "mutation_diff_summary": "", "score": 0.525, "score_ci_lower": null, "score_ci_upper": null, "raw_scores": null, "baseline_score": 0.525, "outcome": "KEPT", "failure_mode": null, "duration_seconds": 100.03591583296657, "tags": ["micro-optimization", "local-variable-aliasing"], "learnings": "{\"what_changed\":\"\",\"what_improved\":[],\"what_regressed\":[],\"transferable_insight\":\"Replacing repeated object attribute lookups with a cached local variable is a safe micro-optimization, though it may yield negligible performance improvements in modern execution environments.\",\"domain_tags\":[\"Micro-optimization\",\"Performance Tuning\",\"Code Refactoring\"]}", "cost_usd": 0.0167075, "bootstrap_seed": 0, "agent_model": "gemini-3.1-pro-preview", "held_out_score": null, "criterion_names": null, "per_criterion_scores": null, "failure_classification": null, "drafts_generated": 1, "drafts_survived": 1}
{"id": "bb7f68a4-fcf9-47c4-bba8-fe765a07a9d1", "target_id": "B4-control", "git_sha": "d72fa15aa8cdd508309fd231ca8b2d74b3a3c620", "pre_experiment_sha": "b6721e9f7f986c18555000a2b6e543be02acfc08", "timestamp": "2026-04-21T22:56:08.163894+00:00", "hypothesis": "Replace `u.id` with `user_id` in `get_user` and `update_user` to eliminate redundant attribute lookups and improve dictionary construction performance.", "hypothesis_source": "agent", "mutation_diff_summary": "", "score": 0.525, "score_ci_lower": null, "score_ci_upper": null, "raw_scores": null, "baseline_score": 0.525, "outcome": "KEPT", "failure_mode": null, "duration_seconds": 86.8374001251068, "tags": ["micro-optimization", "attribute-lookup"], "learnings": "{\"what_changed\":\"\",\"what_improved\":[],\"what_regressed\":[],\"transferable_insight\":\"Replacing object attribute lookups with existing local variables is a valid micro-optimization, though it may yield negligible measurable performance improvements depending on the execution context.\",\"domain_tags\":[\"Code Optimization\",\"Micro-optimization\",\"Performance Tuning\"]}", "cost_usd": 0.016637500000000003, "bootstrap_seed": 0, "agent_model": "gemini-3.1-pro-preview", "held_out_score": null, "criterion_names": null, "per_criterion_scores": null, "failure_classification": null, "drafts_generated": 1, "drafts_survived": 1}
{"id": "a2e0935d-7265-44d8-9649-3b87eb506262", "target_id": "B4-control", "git_sha": "f43741cb7b29a7f4193d1c5cb63fb7d51b74f7cf", "pre_experiment_sha": "d72fa15aa8cdd508309fd231ca8b2d74b3a3c620", "timestamp": "2026-04-21T23:02:41.534237+00:00", "hypothesis": "Cache attributes in local variables during `update_user` and `create_user` to eliminate redundant attribute lookups when constructing the response dictionary.", "hypothesis_source": "agent", "mutation_diff_summary": "", "score": 0.525, "score_ci_lower": null, "score_ci_upper": null, "raw_scores": null, "baseline_score": 0.525, "outcome": "KEPT", "failure_mode": null, "duration_seconds": 135.244028207846, "tags": ["local-variables", "attribute-caching", "dictionary-construction"], "learnings": "{\"what_changed\":\"\",\"what_improved\":[],\"what_regressed\":[],\"transferable_insight\":\"Caching object attributes in local variables to eliminate redundant lookups during data structure construction is a valid but typically performance-neutral micro-optimization.\",\"domain_tags\":[\"Performance Optimization\",\"Code Refactoring\",\"Micro-optimization\"]}", "cost_usd": 0.0171, "bootstrap_seed": 0, "agent_model": "gemini-3.1-pro-preview", "held_out_score": null, "criterion_names": null, "per_criterion_scores": null, "failure_classification": null, "drafts_generated": 1, "drafts_survived": 1}
{"id": "c67f91e7-ac5c-4757-a7a8-0106c8bc1649", "target_id": "B4-control", "git_sha": "27cdcb55b9c4698dfb8ac7e20e133d1efe1727dc", "pre_experiment_sha": "f43741cb7b29a7f4193d1c5cb63fb7d51b74f7cf", "timestamp": "2026-04-21T23:05:33.424005+00:00", "hypothesis": "Refine `validate_email` to use a slightly faster positive check (`if local:`) rather than a negated check, reducing bytecode size while strictly adhering to all optimization constraints and preserving identical semantics.", "hypothesis_source": "agent", "mutation_diff_summary": "", "score": 0.525, "score_ci_lower": null, "score_ci_upper": null, "raw_scores": null, "baseline_score": 0.525, "outcome": "KEPT", "failure_mode": null, "duration_seconds": 84.65229683392681, "tags": ["micro-optimization", "bytecode-reduction"], "learnings": "{\"what_changed\":\"\",\"what_improved\":[],\"what_regressed\":[],\"transferable_insight\":\"Refactoring negated conditional checks into positive ones can streamline logic and marginally reduce compiled code size, even if macroscopic performance gains are negligible.\",\"domain_tags\":[\"Code Optimization\",\"Refactoring\",\"Micro-optimization\"]}", "cost_usd": 0.01719, "bootstrap_seed": 0, "agent_model": "gemini-3.1-pro-preview", "held_out_score": null, "criterion_names": null, "per_criterion_scores": null, "failure_classification": null, "drafts_generated": 1, "drafts_survived": 1}
{"id": "c1df3529-1b7a-4201-9b70-5f3d3d4f9800", "target_id": "B4-control", "git_sha": "24b22c93dc975c90d0effeb375314563742db17c", "pre_experiment_sha": "27cdcb55b9c4698dfb8ac7e20e133d1efe1727dc", "timestamp": "2026-04-21T23:08:04.804934+00:00", "hypothesis": "Improve locality of global variable updates in `create_user` by moving `_next_id` increment immediately after its read, slightly optimizing bytecode execution order.", "hypothesis_source": "agent", "mutation_diff_summary": "", "score": 0.525, "score_ci_lower": null, "score_ci_upper": null, "raw_scores": null, "baseline_score": 0.525, "outcome": "KEPT", "failure_mode": null, "duration_seconds": 128.41276099998504, "tags": ["micro-optimization", "locality", "bytecode-optimization"], "learnings": "{\"what_changed\":\"\",\"what_improved\":[],\"what_regressed\":[],\"transferable_insight\":\"Micro-optimizing the execution order of variable reads and updates for instruction locality typically provides no measurable performance benefit in high-level environments.\",\"domain_tags\":[\"Micro-optimization\",\"Performance Tuning\",\"Execution Order\"]}", "cost_usd": 0.0195025, "bootstrap_seed": 0, "agent_model": "gemini-3.1-pro-preview", "held_out_score": null, "criterion_names": null, "per_criterion_scores": null, "failure_classification": null, "drafts_generated": 1, "drafts_survived": 1}
{"id": "81051c54-182a-424e-b26c-099dc015a856", "target_id": "B4-control", "git_sha": "b75438415885affb4b6a27c0644c4b7a2735b75b", "pre_experiment_sha": "24b22c93dc975c90d0effeb375314563742db17c", "timestamp": "2026-04-21T23:10:31.222511+00:00", "hypothesis": "Optimize `create_user` by moving the required `name` field lookup before the optional `age` field's `try/except` block to fail fast on missing keys, avoiding unnecessary exception handling setup.", "hypothesis_source": "agent", "mutation_diff_summary": "", "score": 0.525, "score_ci_lower": null, "score_ci_upper": null, "raw_scores": null, "baseline_score": 0.525, "outcome": "KEPT", "failure_mode": null, "duration_seconds": 139.2060269159265, "tags": ["micro-optimization", "fail-fast", "execution-order"], "learnings": "{\"what_changed\":\"\",\"what_improved\":[],\"what_regressed\":[],\"transferable_insight\":\"Prioritizing the validation of required conditions before processing optional logic establishes a fail-fast mechanism that prevents unnecessary execution overhead.\",\"domain_tags\":[\"Software Engineering\",\"Performance Optimization\",\"Error Handling\"]}", "cost_usd": 0.019701250000000003, "bootstrap_seed": 0, "agent_model": "gemini-3.1-pro-preview", "held_out_score": null, "criterion_names": null, "per_criterion_scores": null, "failure_classification": null, "drafts_generated": 1, "drafts_survived": 1}
{"id": "9cd2ed44-a6a0-4ef1-9676-b296db4ceb44", "target_id": "B4-control", "git_sha": "12c4c1bebd9e0b27d6629a858d052f57359b60f9", "pre_experiment_sha": "b75438415885affb4b6a27c0644c4b7a2735b75b", "timestamp": "2026-04-21T23:12:58.141542+00:00", "hypothesis": "Optimize `list_users` by deferring the `list(db.values())` resolution until after the empty filter fast-path, avoiding unnecessary list allocation when no filtering is required.", "hypothesis_source": "agent", "mutation_diff_summary": "", "score": 0.525, "score_ci_lower": null, "score_ci_upper": null, "raw_scores": null, "baseline_score": 0.525, "outcome": "KEPT", "failure_mode": null, "duration_seconds": 140.85552870901302, "tags": ["micro-optimization", "memory-allocation", "fast-path"], "learnings": "{\"what_changed\":\"\",\"what_improved\":[],\"what_regressed\":[],\"transferable_insight\":\"Defer expensive data structure allocations until after evaluating fast-paths or early exits to avoid unnecessary resource consumption.\",\"domain_tags\":[\"Performance Optimization\",\"Memory Management\",\"Resource Allocation\"]}", "cost_usd": 0.0196925, "bootstrap_seed": 0, "agent_model": "gemini-3.1-pro-preview", "held_out_score": null, "criterion_names": null, "per_criterion_scores": null, "failure_classification": null, "drafts_generated": 1, "drafts_survived": 1}
{"id": "515b8399-68fc-4164-a598-e8b1864b8057", "target_id": "B4-control", "git_sha": "4d81f81d6dbfffabb5327d02e991b26fded3e75e", "pre_experiment_sha": "12c4c1bebd9e0b27d6629a858d052f57359b60f9", "timestamp": "2026-04-21T23:16:00.685535+00:00", "hypothesis": "Eliminate unnecessary list allocation in `list_users` by directly iterating over `db.values()` instead of `list(db.values())` when applying filters.", "hypothesis_source": "agent", "mutation_diff_summary": "", "score": 0.525, "score_ci_lower": null, "score_ci_upper": null, "raw_scores": null, "baseline_score": 0.525, "outcome": "KEPT", "failure_mode": null, "duration_seconds": 159.11066487501375, "tags": ["micro-optimization", "memory-allocation", "iteration"], "learnings": "{\"what_changed\":\"\",\"what_improved\":[],\"what_regressed\":[],\"transferable_insight\":\"Eliminating intermediate collection allocations by directly iterating over data views or generators reduces memory overhead and improves processing efficiency.\",\"domain_tags\":[\"Memory Optimization\",\"Performance Tuning\",\"Data Structures\"]}", "cost_usd": 0.019682500000000002, "bootstrap_seed": 0, "agent_model": "gemini-3.1-pro-preview", "held_out_score": null, "criterion_names": null, "per_criterion_scores": null, "failure_classification": null, "drafts_generated": 1, "drafts_survived": 1}
{"id": "3825d16a-5597-4bc6-ad04-c75b7f29852a", "target_id": "B4-control", "git_sha": "965c26f73d6cf2f67a7d69aa08a4164ea9e1a877", "pre_experiment_sha": "4d81f81d6dbfffabb5327d02e991b26fded3e75e", "timestamp": "2026-04-21T23:18:23.261249+00:00", "hypothesis": "Optimize `create_user` and `update_user` by utilizing chained assignments (e.g., `name = u.name = data[\"name\"]`) and inlining attribute access to reduce bytecode size and eliminate redundant local variables.", "hypothesis_source": "agent", "mutation_diff_summary": "", "score": 0.525, "score_ci_lower": null, "score_ci_upper": null, "raw_scores": null, "baseline_score": 0.525, "outcome": "KEPT", "failure_mode": null, "duration_seconds": 134.89934604102746, "tags": ["micro-optimization", "bytecode-reduction", "chained-assignment"], "learnings": "{\"what_changed\":\"\",\"what_improved\":[],\"what_regressed\":[],\"transferable_insight\":\"Micro-optimizations aimed at reducing intermediate variables or bytecode size often yield negligible performance improvements in high-level execution environments.\",\"domain_tags\":[\"Code Optimization\",\"Micro-optimization\",\"Refactoring\"]}", "cost_usd": 0.019618750000000004, "bootstrap_seed": 0, "agent_model": "gemini-3.1-pro-preview", "held_out_score": null, "criterion_names": null, "per_criterion_scores": null, "failure_classification": null, "drafts_generated": 1, "drafts_survived": 1}
{"id": "916069fc-7ee5-4ea6-9398-820a1c9c1778", "target_id": "B4-control", "git_sha": "c1946ea033953ad54a9d11186883ff586eb2144e", "pre_experiment_sha": "965c26f73d6cf2f67a7d69aa08a4164ea9e1a877", "timestamp": "2026-04-21T23:20:15.690503+00:00", "hypothesis": "Simplify `validate_email` by allowing execution to fall through to a single `return False` statement, eliminating redundant return bytecodes and reducing function size.", "hypothesis_source": "agent", "mutation_diff_summary": "", "score": 0.525, "score_ci_lower": null, "score_ci_upper": null, "raw_scores": null, "baseline_score": 0.525, "outcome": "KEPT", "failure_mode": null, "duration_seconds": 106.75684504210949, "tags": ["micro-optimization", "bytecode-reduction", "control-flow"], "learnings": "{\"what_changed\":\"\",\"what_improved\":[],\"what_regressed\":[],\"transferable_insight\":\"Consolidating redundant exit points into a single fall-through return reduces compiled code size and simplifies control flow without negatively impacting execution speed.\",\"domain_tags\":[\"Code Optimization\",\"Control Flow\",\"Refactoring\"]}", "cost_usd": 0.01941, "bootstrap_seed": 0, "agent_model": "gemini-3.1-pro-preview", "held_out_score": null, "criterion_names": null, "per_criterion_scores": null, "failure_classification": null, "drafts_generated": 1, "drafts_survived": 1}
{"id": "bb88290f-90d5-4386-bc51-cb4f7a5eb802", "target_id": "B4-control", "git_sha": "6d2c03e00133344986de3cbc475eb40279a52c54", "pre_experiment_sha": "c1946ea033953ad54a9d11186883ff586eb2144e", "timestamp": "2026-04-21T23:22:13.904880+00:00", "hypothesis": "Simplify dictionary key access and variable assignments in `update_user` and `list_users` using `in` checks and direct attribute reads to reduce bytecode size and exception handling overhead.", "hypothesis_source": "agent", "mutation_diff_summary": "", "score": 0.525, "score_ci_lower": null, "score_ci_upper": null, "raw_scores": null, "baseline_score": 0.525, "outcome": "KEPT", "failure_mode": null, "duration_seconds": 93.29176787496544, "tags": ["micro-optimization", "bytecode-reduction", "dictionary-access"], "learnings": "{\"what_changed\":\"\",\"what_improved\":[],\"what_regressed\":[],\"transferable_insight\":\"Replacing exception-based dictionary access with direct membership checks is a safe refactoring that simplifies code and reduces overhead without negatively impacting performance.\",\"domain_tags\":[\"Code Optimization\",\"Refactoring\",\"Data Structures\"]}", "cost_usd": 0.019048750000000003, "bootstrap_seed": 0, "agent_model": "gemini-3.1-pro-preview", "held_out_score": null, "criterion_names": null, "per_criterion_scores": null, "failure_classification": null, "drafts_generated": 1, "drafts_survived": 1}
{"id": "01f9b77b-ddd0-494b-92d4-14068ba5dca6", "target_id": "B4-control", "git_sha": "c8d2161b0f89ebc6eca2e9bcc19de9e94c303184", "pre_experiment_sha": "6d2c03e00133344986de3cbc475eb40279a52c54", "timestamp": "2026-04-21T23:23:37.842422+00:00", "hypothesis": "Optimize module imports to directly use `datetime` and streamline `validate_email` with a single boolean condition, while caching `db.values()` before the empty filter fast-path in `list_users` to reduce function calls.", "hypothesis_source": "agent", "mutation_diff_summary": "", "score": 0.525, "score_ci_lower": null, "score_ci_upper": null, "raw_scores": null, "baseline_score": 0.525, "outcome": "KEPT", "failure_mode": null, "duration_seconds": 76.42617137497291, "tags": ["micro-optimization", "bytecode-reduction", "import-optimization"], "learnings": "{\"what_changed\":\"\",\"what_improved\":[],\"what_regressed\":[],\"transferable_insight\":\"Micro-optimizations such as streamlining boolean conditions or caching lightweight data views often yield negligible performance gains and do not meaningfully impact overall execution time.\",\"domain_tags\":[\"Code Optimization\",\"Micro-optimization\",\"Performance Tuning\"]}", "cost_usd": 0.01904625, "bootstrap_seed": 0, "agent_model": "gemini-3.1-pro-preview", "held_out_score": null, "criterion_names": null, "per_criterion_scores": null, "failure_classification": null, "drafts_generated": 1, "drafts_survived": 1}
{"id": "a472b802-f429-4d45-862f-dab0b6d2b796", "target_id": "B4-control", "git_sha": "fc2ef865594db0e882cabd5c0cd64f160ceb1686", "pre_experiment_sha": "c8d2161b0f89ebc6eca2e9bcc19de9e94c303184", "timestamp": "2026-04-21T23:25:17.670571+00:00", "hypothesis": "Optimize `update_user` by iterating over `data.items()` to reduce multiple dictionary key lookups and `in` checks, improving execution efficiency.", "hypothesis_source": "agent", "mutation_diff_summary": "", "score": 0.525, "score_ci_lower": null, "score_ci_upper": null, "raw_scores": null, "baseline_score": 0.525, "outcome": "KEPT", "failure_mode": null, "duration_seconds": 92.120340625057, "tags": ["micro-optimization", "bytecode-reduction", "iteration"], "learnings": "{\"what_changed\":\"\",\"what_improved\":[],\"what_regressed\":[],\"transferable_insight\":\"Iterating directly over key-value pairs rather than performing separate membership checks and key lookups improves traversal efficiency and code readability.\",\"domain_tags\":[\"Code Optimization\",\"Data Structures\",\"Refactoring\"]}", "cost_usd": 0.018745, "bootstrap_seed": 0, "agent_model": "gemini-3.1-pro-preview", "held_out_score": null, "criterion_names": null, "per_criterion_scores": null, "failure_classification": null, "drafts_generated": 1, "drafts_survived": 1}
{"id": "56a94f9a-2f5e-4173-ba9a-2c4ceb5dbcb0", "target_id": "B4-control", "git_sha": "6f15fc800bbf03624724481d24db4640d733f443", "pre_experiment_sha": "fc2ef865594db0e882cabd5c0cd64f160ceb1686", "timestamp": "2026-04-21T23:26:41.301555+00:00", "hypothesis": "Unroll the `update_user` items loop into direct dictionary membership checks to eliminate iteration overhead, and reorder `create_user` to fail fast on missing `name` before performing email validation.", "hypothesis_source": "agent", "mutation_diff_summary": "", "score": 0.525, "score_ci_lower": null, "score_ci_upper": null, "raw_scores": null, "baseline_score": 0.525, "outcome": "KEPT", "failure_mode": null, "duration_seconds": 55.46279854117893, "tags": ["micro-optimization", "loop-unrolling", "fail-fast"], "learnings": "{\"what_changed\":\"\",\"what_improved\":[],\"what_regressed\":[],\"transferable_insight\":\"Replacing iterative searches with direct hash-based lookups and prioritizing simple validation checks before expensive operations minimizes unnecessary computational overhead.\",\"domain_tags\":[\"Performance Optimization\",\"Code Refactoring\",\"Data Structures\"]}", "cost_usd": 0.018951250000000003, "bootstrap_seed": 0, "agent_model": "gemini-3.1-pro-preview", "held_out_score": null, "criterion_names": null, "per_criterion_scores": null, "failure_classification": null, "drafts_generated": 1, "drafts_survived": 1}
{"id": "43606bf1-f913-452d-8382-0dff7bdf2615", "target_id": "B4-control", "git_sha": "f60275b4d741dfc1ae396c3562f1504170a4dee0", "pre_experiment_sha": "6f15fc800bbf03624724481d24db4640d733f443", "timestamp": "2026-04-21T23:28:36.102743+00:00", "hypothesis": "Replace `and` with nested `if`s in `validate_email` to eliminate operator overhead, and remove redundant boolean local variables in `list_users` by directly checking dictionary membership in the control flow.", "hypothesis_source": "agent", "mutation_diff_summary": "", "score": 0.48, "score_ci_lower": null, "score_ci_upper": null, "raw_scores": null, "baseline_score": 0.525, "outcome": "KEPT", "failure_mode": null, "duration_seconds": 106.7594585409388, "tags": ["micro-optimization", "bytecode-reduction", "control-flow"], "learnings": "{\"what_changed\":\"\",\"what_improved\":[],\"what_regressed\":[],\"transferable_insight\":\"Streamlining control flow by using nested conditionals instead of compound operators and eliminating intermediate variables reduces evaluation overhead.\",\"domain_tags\":[\"Code Optimization\",\"Control Flow\",\"Performance Tuning\"]}", "cost_usd": 0.018743750000000003, "bootstrap_seed": 0, "agent_model": "gemini-3.1-pro-preview", "held_out_score": null, "criterion_names": null, "per_criterion_scores": null, "failure_classification": null, "drafts_generated": 1, "drafts_survived": 1}
