{"id": "81365b4b-106b-45dc-ad76-f7777308a4cd", "target_id": "B4-control", "git_sha": "61fd766fb2e8c286fcaf314f31acf36f951a8813", "pre_experiment_sha": "2b2171394f0a1062c8817564a5778bb6a394a04b", "timestamp": "2026-04-23T19:48:54.324039+00:00", "hypothesis": "Replace costly try/except TypeError blocks with fast, precise isinstance checks for user_id validation to reduce exception handling overhead while preserving semantic correctness.", "hypothesis_source": "agent", "mutation_diff_summary": "", "score": 0.6, "score_ci_lower": null, "score_ci_upper": null, "raw_scores": null, "baseline_score": 0.6, "outcome": "KEPT", "failure_mode": null, "duration_seconds": 70.504787000129, "tags": ["performance", "type-checking", "exception-handling"], "learnings": "{\"what_changed\":\"\",\"what_improved\":[],\"what_regressed\":[],\"transferable_insight\":\"Replacing exception-based control flow with explicit type validation preserves semantic correctness and can be safely adopted for cleaner code, even when measurable performance gains are neutral.\",\"domain_tags\":[\"Software Engineering\",\"Code Refactoring\",\"Performance Optimization\"]}", "cost_usd": 0.017781250000000002, "bootstrap_seed": 0, "agent_model": "gemini-3.1-pro-preview", "held_out_score": null, "criterion_names": null, "per_criterion_scores": null, "failure_classification": null, "drafts_generated": 1, "drafts_survived": 1}
{"id": "498a7de8-8c56-45d7-954a-b9a1df063243", "target_id": "B4-control", "git_sha": "04934d9e55e7dfca789f8ea6e8d9657320e1ae3a", "pre_experiment_sha": "61fd766fb2e8c286fcaf314f31acf36f951a8813", "timestamp": "2026-04-23T19:52:42.359388+00:00", "hypothesis": "Replace implicit boolean string emptiness checks with explicit equality checks to strictly adhere to explicit validation rules, and combine type checks in `update_user` to marginally improve performance.", "hypothesis_source": "agent", "mutation_diff_summary": "", "score": 0.6, "score_ci_lower": null, "score_ci_upper": null, "raw_scores": null, "baseline_score": 0.6, "outcome": "KEPT", "failure_mode": null, "duration_seconds": 103.89875487494282, "tags": ["explicit-validation", "type-check-optimization", "inline-logic"], "learnings": "{\"what_changed\":\"\",\"what_improved\":[],\"what_regressed\":[],\"transferable_insight\":\"Transitioning from implicit to explicit validation checks enhances code strictness and readability, even if it yields no measurable performance improvements.\",\"domain_tags\":[\"Code Quality\",\"Validation\",\"Micro-optimization\"]}", "cost_usd": 0.0178325, "bootstrap_seed": 0, "agent_model": "gemini-3.1-pro-preview", "held_out_score": null, "criterion_names": null, "per_criterion_scores": null, "failure_classification": null, "drafts_generated": 1, "drafts_survived": 1}
{"id": "2ee93031-1f2a-4906-8a86-b945bc6ba8ff", "target_id": "B4-control", "git_sha": "1fe19d5a07801141185ba194b2d806066f4278c4", "pre_experiment_sha": "04934d9e55e7dfca789f8ea6e8d9657320e1ae3a", "timestamp": "2026-04-23T19:54:57.225538+00:00", "hypothesis": "Hoist the extraction and validation of `f_name` and `f_active` in `list_users` to eliminate redundant string checks and lowercasing operations across the conditional branches.", "hypothesis_source": "agent", "mutation_diff_summary": "", "score": 0.6, "score_ci_lower": null, "score_ci_upper": null, "raw_scores": null, "baseline_score": 0.6, "outcome": "KEPT", "failure_mode": null, "duration_seconds": 128.24433183297515, "tags": ["performance", "refactor", "string-optimization"], "learnings": "{\"what_changed\":\"\",\"what_improved\":[],\"what_regressed\":[],\"transferable_insight\":\"Hoisting common data extraction and validation logic above conditional branches eliminates redundant operations and improves code maintainability.\",\"domain_tags\":[\"Code Refactoring\",\"Software Engineering\",\"Clean Code\"]}", "cost_usd": 0.017452500000000003, "bootstrap_seed": 0, "agent_model": "gemini-3.1-pro-preview", "held_out_score": null, "criterion_names": null, "per_criterion_scores": null, "failure_classification": null, "drafts_generated": 1, "drafts_survived": 1}
{"id": "22edec74-0b09-4b19-93a7-eaa559f4a22f", "target_id": "B4-control", "git_sha": "012b91cc0901a8c02f5d6d753943411e451f2c25", "pre_experiment_sha": "1fe19d5a07801141185ba194b2d806066f4278c4", "timestamp": "2026-04-23T19:58:21.438331+00:00", "hypothesis": "Eliminate the redundant string substring check in `list_users` by setting `has_name = False` when the filter name is an empty string, avoiding unnecessary `.lower()` evaluations per user.", "hypothesis_source": "agent", "mutation_diff_summary": "", "score": 0.6, "score_ci_lower": null, "score_ci_upper": null, "raw_scores": null, "baseline_score": 0.6, "outcome": "KEPT", "failure_mode": null, "duration_seconds": 196.6306296249386, "tags": ["optimization", "string-check", "list-comprehension"], "learnings": "{\"what_changed\":\"\",\"what_improved\":[],\"what_regressed\":[],\"transferable_insight\":\"Short-circuiting iterative operations by pre-validating empty or null filter conditions eliminates redundant processing overhead per item.\",\"domain_tags\":[\"Performance Optimization\",\"Code Efficiency\",\"Data Filtering\"]}", "cost_usd": 0.0176375, "bootstrap_seed": 0, "agent_model": "gemini-3.1-pro-preview", "held_out_score": null, "criterion_names": null, "per_criterion_scores": null, "failure_classification": null, "drafts_generated": 1, "drafts_survived": 1}
{"id": "9c54e0c0-937a-49ac-8ff8-19ffb3d6375d", "target_id": "B4-control", "git_sha": "334ed3011a6d8b8533886b5828e50162080116d1", "pre_experiment_sha": "012b91cc0901a8c02f5d6d753943411e451f2c25", "timestamp": "2026-04-23T20:11:09.282065+00:00", "hypothesis": "Refactor `list_users` to use nested conditionals for filter flags instead of an `elif` chain to slightly reduce branching overhead, maintaining all other optimized list comprehensions and explicit type checks.", "hypothesis_source": "agent", "mutation_diff_summary": "", "score": 0.6, "score_ci_lower": null, "score_ci_upper": null, "raw_scores": null, "baseline_score": 0.6, "outcome": "KEPT", "failure_mode": null, "duration_seconds": 104.3669846248813, "tags": ["performance", "control-flow", "list-comprehension"], "learnings": "{\"what_changed\":\"\",\"what_improved\":[],\"what_regressed\":[],\"transferable_insight\":\"Micro-optimizing control flow by converting flat conditional chains into nested conditionals generally yields negligible performance improvements.\",\"domain_tags\":[\"Control Flow\",\"Micro-optimization\",\"Performance Tuning\"]}", "cost_usd": 0.01769625, "bootstrap_seed": 0, "agent_model": "gemini-3.1-pro-preview", "held_out_score": null, "criterion_names": null, "per_criterion_scores": null, "failure_classification": null, "drafts_generated": 1, "drafts_survived": 1}
{"id": "dee42c1e-1b87-4b40-b202-e81baf2ff14c", "target_id": "B4-control", "git_sha": "553f4db417d209316668cbd82f96380926392c05", "pre_experiment_sha": "334ed3011a6d8b8533886b5828e50162080116d1", "timestamp": "2026-04-23T20:16:10.975866+00:00", "hypothesis": "Optimize `list_users` by avoiding local variable assignment for `db.values()` on the fast path, and clean up variable names in `update_user` to improve readability and micro-performance.", "hypothesis_source": "agent", "mutation_diff_summary": "", "score": 0.6, "score_ci_lower": null, "score_ci_upper": null, "raw_scores": null, "baseline_score": 0.6, "outcome": "KEPT", "failure_mode": null, "duration_seconds": 128.50731616606936, "tags": ["optimization", "memory-management", "fast-path"], "learnings": "{\"what_changed\":\"\",\"what_improved\":[],\"what_regressed\":[],\"transferable_insight\":\"Micro-optimizations like eliminating intermediate local variable assignments often yield negligible performance gains, serving primarily as stylistic choices rather than functional improvements.\",\"domain_tags\":[\"Micro-optimization\",\"Code Refactoring\",\"Performance\"]}", "cost_usd": 0.017750000000000002, "bootstrap_seed": 0, "agent_model": "gemini-3.1-pro-preview", "held_out_score": null, "criterion_names": null, "per_criterion_scores": null, "failure_classification": null, "drafts_generated": 1, "drafts_survived": 1}
{"id": "0cf9a4a0-f9f1-42e0-bce3-f9d919985f3b", "target_id": "B4-control", "git_sha": "7e212114dd8f394c2e1c2d05aee127305c0eefbd", "pre_experiment_sha": "553f4db417d209316668cbd82f96380926392c05", "timestamp": "2026-04-23T20:18:19.644106+00:00", "hypothesis": "Hoist `db.values()` extraction in `list_users` to slightly reduce overhead and ensure all optimization rules are strictly met.", "hypothesis_source": "agent", "mutation_diff_summary": "", "score": 0.6, "score_ci_lower": null, "score_ci_upper": null, "raw_scores": null, "baseline_score": 0.6, "outcome": "KEPT", "failure_mode": null, "duration_seconds": 121.84851387492381, "tags": ["performance", "refactor"], "learnings": "{\"what_changed\":\"\",\"what_improved\":[],\"what_regressed\":[],\"transferable_insight\":\"Extracting invariant operations from repeated execution paths ensures theoretical efficiency, even when measurable performance gains are negligible.\",\"domain_tags\":[\"Code Optimization\",\"Performance Tuning\",\"Refactoring\"]}", "cost_usd": 0.017552500000000002, "bootstrap_seed": 0, "agent_model": "gemini-3.1-pro-preview", "held_out_score": null, "criterion_names": null, "per_criterion_scores": null, "failure_classification": null, "drafts_generated": 1, "drafts_survived": 1}
{"id": "cdb76e01-1cef-4c1a-ac76-2910381571a5", "target_id": "B4-control", "git_sha": "a0d2021e41ecfb87106e30beeb33bf08144b7696", "pre_experiment_sha": "7e212114dd8f394c2e1c2d05aee127305c0eefbd", "timestamp": "2026-04-23T20:21:05.194315+00:00", "hypothesis": "Add explicit equality checks for string emptiness in email validation to strictly adhere to validation rules and avoid unnecessary split operations.", "hypothesis_source": "agent", "mutation_diff_summary": "", "score": 0.6, "score_ci_lower": null, "score_ci_upper": null, "raw_scores": null, "baseline_score": 0.6, "outcome": "KEPT", "failure_mode": null, "duration_seconds": 159.25441279099323, "tags": ["performance", "strict-validation", "explicit-checks"], "learnings": "{\"what_changed\":\"\",\"what_improved\":[],\"what_regressed\":[],\"transferable_insight\":\"Implementing explicit early-exit checks for empty inputs prevents unnecessary processing and enforces strict validation rules without altering overall system performance.\",\"domain_tags\":[\"Defensive Programming\",\"Input Validation\",\"Performance Optimization\"]}", "cost_usd": 0.0176825, "bootstrap_seed": 0, "agent_model": "gemini-3.1-pro-preview", "held_out_score": null, "criterion_names": null, "per_criterion_scores": null, "failure_classification": null, "drafts_generated": 1, "drafts_survived": 1}
{"id": "7e1e2fd9-291f-4848-b94e-80d0c5a43dfe", "target_id": "B4-control", "git_sha": "f90c48be70f4222ac876e50ef6c7e39ad91ae900", "pre_experiment_sha": "a0d2021e41ecfb87106e30beeb33bf08144b7696", "timestamp": "2026-04-23T20:22:13.217890+00:00", "hypothesis": "Optimize `list_users` by avoiding local variable assignment for `db.values()` on the fast path and refine `isinstance` checks for `user_id` to expect only integers.", "hypothesis_source": "agent", "mutation_diff_summary": "", "score": 0.6, "score_ci_lower": null, "score_ci_upper": null, "raw_scores": null, "baseline_score": 0.6, "outcome": "KEPT", "failure_mode": null, "duration_seconds": 43.314354417147115, "tags": ["fast-path", "type-checking", "hoist"], "learnings": "{\"what_changed\":\"\",\"what_improved\":[],\"what_regressed\":[],\"transferable_insight\":\"Eliminating intermediate variable assignments and narrowing type validations on execution fast paths may not produce measurable performance gains but can safely streamline code.\",\"domain_tags\":[\"Code Optimization\",\"Refactoring\",\"Performance Tuning\"]}", "cost_usd": 0.017906250000000002, "bootstrap_seed": 0, "agent_model": "gemini-3.1-pro-preview", "held_out_score": null, "criterion_names": null, "per_criterion_scores": null, "failure_classification": null, "drafts_generated": 1, "drafts_survived": 1}
{"id": "a42dfb25-407d-4a6f-8ffe-e999e1ad1f6f", "target_id": "B4-control", "git_sha": "6d189e22a2f06623df39ed5bb663c2c3ad3eb733", "pre_experiment_sha": "f90c48be70f4222ac876e50ef6c7e39ad91ae900", "timestamp": "2026-04-23T20:24:35.684337+00:00", "hypothesis": "Swap the order of type checks in `update_user` to validate `user_id` before `data` for slightly faster short-circuiting on invalid IDs, while retaining all other applied optimizations.", "hypothesis_source": "agent", "mutation_diff_summary": "", "score": 0.6, "score_ci_lower": null, "score_ci_upper": null, "raw_scores": null, "baseline_score": 0.6, "outcome": "KEPT", "failure_mode": null, "duration_seconds": 136.53096237499267, "tags": ["type-checking", "short-circuit"], "learnings": "{\"what_changed\":\"\",\"what_improved\":[],\"what_regressed\":[],\"transferable_insight\":\"Reordering validation checks to evaluate simpler or more frequently invalid conditions first enables early short-circuiting, though performance gains may be negligible if the checks are already low-overhead.\",\"domain_tags\":[\"Software Engineering\",\"Performance Optimization\",\"Code Refactoring\"]}", "cost_usd": 0.017897500000000004, "bootstrap_seed": 0, "agent_model": "gemini-3.1-pro-preview", "held_out_score": null, "criterion_names": null, "per_criterion_scores": null, "failure_classification": null, "drafts_generated": 1, "drafts_survived": 1}
{"id": "710a98da-d8dc-4be7-9c9e-bdd67474fc83", "target_id": "B4-control", "git_sha": "c753e8a632898cb3b903b20a2f97db0e77a17f6a", "pre_experiment_sha": "6d189e22a2f06623df39ed5bb663c2c3ad3eb733", "timestamp": "2026-04-23T20:28:20.691756+00:00", "hypothesis": "Add a `to_dict` method to the `User` class using literal dictionary syntax, and assign it to a local variable (`to_dict = User.to_dict`) in `list_users` to minimize attribute lookup overhead during list comprehensions.", "hypothesis_source": "agent", "mutation_diff_summary": "", "score": 0.6, "score_ci_lower": null, "score_ci_upper": null, "raw_scores": null, "baseline_score": 0.6, "outcome": "KEPT", "failure_mode": null, "duration_seconds": 51.360754374880344, "tags": ["performance", "memory-optimization", "local-variable-caching", "method-extraction"], "learnings": "{\"what_changed\":\"\",\"what_improved\":[],\"what_regressed\":[],\"transferable_insight\":\"Assigning frequently accessed object methods to local variables before executing loops or comprehensions minimizes attribute lookup overhead.\",\"domain_tags\":[\"Code Optimization\",\"Performance Tuning\",\"Software Engineering\"]}", "cost_usd": 0.01699875, "bootstrap_seed": 0, "agent_model": "gemini-3.1-pro-preview", "held_out_score": null, "criterion_names": null, "per_criterion_scores": null, "failure_classification": null, "drafts_generated": 1, "drafts_survived": 1}
{"id": "e3c370c6-3af0-4953-a015-e7499466d179", "target_id": "B4-control", "git_sha": "c08c5d104405bc3a734399709e75cbddb41ce098", "pre_experiment_sha": "c753e8a632898cb3b903b20a2f97db0e77a17f6a", "timestamp": "2026-04-23T20:29:26.656427+00:00", "hypothesis": "Inline the dictionary construction in `list_users` and `update_user` to avoid the method call overhead of `to_dict()`, significantly speeding up the list comprehensions.", "hypothesis_source": "agent", "mutation_diff_summary": "", "score": 0.6, "score_ci_lower": null, "score_ci_upper": null, "raw_scores": null, "baseline_score": 0.6, "outcome": "KEPT", "failure_mode": null, "duration_seconds": 58.99308449984528, "tags": ["performance", "inline", "comprehension"], "learnings": "{\"what_changed\":\"\",\"what_improved\":[],\"what_regressed\":[],\"transferable_insight\":\"Inlining data transformations within iterative constructs eliminates method call overhead, optimizing execution speed for repetitive operations.\",\"domain_tags\":[\"Performance Optimization\",\"Code Refactoring\"]}", "cost_usd": 0.01814125, "bootstrap_seed": 0, "agent_model": "gemini-3.1-pro-preview", "held_out_score": null, "criterion_names": null, "per_criterion_scores": null, "failure_classification": null, "drafts_generated": 1, "drafts_survived": 1}
{"id": "ea430abe-be65-48cb-adcd-c76ef12ed491", "target_id": "B4-control", "git_sha": "da61dd40584b4acc987f1e66f99f2eccc796667d", "pre_experiment_sha": "c08c5d104405bc3a734399709e75cbddb41ce098", "timestamp": "2026-04-23T20:30:44.599137+00:00", "hypothesis": "Assign frequently accessed methods `User.to_dict` and `str.lower` to local variables in `list_users` to reduce attribute lookup overhead during tight list comprehensions.", "hypothesis_source": "agent", "mutation_diff_summary": "", "score": 0.6, "score_ci_lower": null, "score_ci_upper": null, "raw_scores": null, "baseline_score": 0.6, "outcome": "KEPT", "failure_mode": null, "duration_seconds": 71.85589862498455, "tags": ["performance", "method-lookup-hoisting", "list-comprehension"], "learnings": "{\"what_changed\":\"\",\"what_improved\":[],\"what_regressed\":[],\"transferable_insight\":\"Caching frequently accessed properties or methods to local variables before tight loops is a standard micro-optimization to reduce lookup overhead, even if modern execution environments render the performance gains negligible.\",\"domain_tags\":[\"Micro-optimization\",\"Code Refactoring\",\"Performance\"]}", "cost_usd": 0.01699625, "bootstrap_seed": 0, "agent_model": "gemini-3.1-pro-preview", "held_out_score": null, "criterion_names": null, "per_criterion_scores": null, "failure_classification": null, "drafts_generated": 1, "drafts_survived": 1}
{"id": "f38dc201-aa7d-4ae8-b843-310d81faca5e", "target_id": "B4-control", "git_sha": "af8a8411f334a1985301f31ba726cce98d9ea17e", "pre_experiment_sha": "da61dd40584b4acc987f1e66f99f2eccc796667d", "timestamp": "2026-04-23T20:31:47.686429+00:00", "hypothesis": "Inline dictionary construction in `list_users` and `update_user` using literal dictionary syntax to eliminate the method call overhead of `to_dict()`.", "hypothesis_source": "agent", "mutation_diff_summary": "", "score": 0.6, "score_ci_lower": null, "score_ci_upper": null, "raw_scores": null, "baseline_score": 0.6, "outcome": "KEPT", "failure_mode": null, "duration_seconds": 38.53690850012936, "tags": ["inline", "list-comprehension", "dict-literal"], "learnings": "{\"what_changed\":\"\",\"what_improved\":[],\"what_regressed\":[],\"transferable_insight\":\"Replacing serialization method calls with inline literal construction to eliminate overhead often yields negligible performance improvements, indicating that the abstraction cost is minimal.\",\"domain_tags\":[\"Performance Optimization\",\"Code Refactoring\",\"Serialization\"]}", "cost_usd": 0.0183175, "bootstrap_seed": 0, "agent_model": "gemini-3.1-pro-preview", "held_out_score": null, "criterion_names": null, "per_criterion_scores": null, "failure_classification": null, "drafts_generated": 1, "drafts_survived": 1}
{"id": "43d3a05c-998f-408c-b85e-b0220101cf51", "target_id": "B4-control", "git_sha": "8d10699e8a55f4adee503580ab00237576fa656e", "pre_experiment_sha": "af8a8411f334a1985301f31ba726cce98d9ea17e", "timestamp": "2026-04-23T20:34:29.798565+00:00", "hypothesis": "Eliminate the local variable assignment for `db.values()` in `list_users` by directly invoking it within the comprehensions, taking advantage of the fact that each conditional branch returns immediately and evaluates `db.values()` exactly once.", "hypothesis_source": "agent", "mutation_diff_summary": "", "score": 0.6, "score_ci_lower": null, "score_ci_upper": null, "raw_scores": null, "baseline_score": 0.6, "outcome": "KEPT", "failure_mode": null, "duration_seconds": 156.844254540978, "tags": ["performance", "local-variables", "list-comprehension"], "learnings": "{\"what_changed\":\"\",\"what_improved\":[],\"what_regressed\":[],\"transferable_insight\":\"Inlining single-use expressions directly into mutually exclusive execution branches reduces local state and code verbosity without causing redundant evaluations.\",\"domain_tags\":[\"Code Refactoring\",\"Clean Code\",\"Execution Flow\"]}", "cost_usd": 0.0186825, "bootstrap_seed": 0, "agent_model": "gemini-3.1-pro-preview", "held_out_score": null, "criterion_names": null, "per_criterion_scores": null, "failure_classification": null, "drafts_generated": 1, "drafts_survived": 1}
{"id": "79e584a5-39d6-4479-96d4-017ea83d2bd1", "target_id": "B4-control", "git_sha": "14830d45a504e06644bfe76eec560b69c11d638e", "pre_experiment_sha": "8d10699e8a55f4adee503580ab00237576fa656e", "timestamp": "2026-04-23T20:35:45.819425+00:00", "hypothesis": "Assign `db.values()` to a local variable `vals` after the fast path in `list_users` to avoid redundant method calls across multiple filtered comprehension branches.", "hypothesis_source": "agent", "mutation_diff_summary": "", "score": 0.6, "score_ci_lower": null, "score_ci_upper": null, "raw_scores": null, "baseline_score": 0.6, "outcome": "KEPT", "failure_mode": null, "duration_seconds": 69.86323833302595, "tags": ["performance", "dictionary-lookup", "local-variable-caching"], "learnings": "{\"what_changed\":\"\",\"what_improved\":[],\"what_regressed\":[],\"transferable_insight\":\"Caching the result of a repeated operation in a local variable before evaluating multiple conditional branches avoids redundant computations.\",\"domain_tags\":[\"Code Optimization\",\"Refactoring\"]}", "cost_usd": 0.01853375, "bootstrap_seed": 0, "agent_model": "gemini-3.1-pro-preview", "held_out_score": null, "criterion_names": null, "per_criterion_scores": null, "failure_classification": null, "drafts_generated": 1, "drafts_survived": 1}
