{"id": "790aa734-fdf0-4980-8f18-c55bd4062d9c", "target_id": "B4-control", "git_sha": "39a0c77e257902e34e5a327937c5ecd6ace8876c", "pre_experiment_sha": "943019589e210316dbc0f724926751739df2b465", "timestamp": "2026-04-19T16:16:55.830730+00:00", "hypothesis": "Centralize request validation and use one deterministic bad-request path while preserving stable response shapes.", "hypothesis_source": "agent", "mutation_diff_summary": "", "score": 0.7, "score_ci_lower": null, "score_ci_upper": null, "raw_scores": null, "baseline_score": 0.7, "outcome": "KEPT", "failure_mode": null, "duration_seconds": 14.132163125090301, "tags": ["validation", "deterministic", "serialization", "error-handling"], "learnings": "{\"what_changed\":\"\",\"what_improved\":[],\"what_regressed\":[],\"transferable_insight\":\"Standardizing validation and routing all failures through a single deterministic error path helps preserve consistent output shapes without changing behavior.\",\"domain_tags\":[\"software-engineering\",\"reliability\",\"api-design\"]}", "cost_usd": 0.03258, "bootstrap_seed": 0, "agent_model": "gpt-5.4", "held_out_score": null, "criterion_names": null, "per_criterion_scores": null, "failure_classification": null, "drafts_generated": 1, "drafts_survived": 1}
{"id": "b0f9313b-f2cd-4882-beb9-2c7e85b9b106", "target_id": "B4-control", "git_sha": "4b1ac784269ae6202c8879f93ea6a1a7aa039d6b", "pre_experiment_sha": "39a0c77e257902e34e5a327937c5ecd6ace8876c", "timestamp": "2026-04-19T16:17:14.761548+00:00", "hypothesis": "Unify all invalid-input handling through one strict validator and make all endpoint outputs use explicit deterministic object shapes.", "hypothesis_source": "agent", "mutation_diff_summary": "", "score": 0.7, "score_ci_lower": null, "score_ci_upper": null, "raw_scores": null, "baseline_score": 0.7, "outcome": "KEPT", "failure_mode": null, "duration_seconds": 17.69973158405628, "tags": ["validation", "deterministic", "serialization", "error-handling"], "learnings": "{\"what_changed\":\"\",\"what_improved\":[],\"what_regressed\":[],\"transferable_insight\":\"Centralizing validation and standardizing output shapes reduces ambiguity and makes system behavior more predictable and easier to reason about.\",\"domain_tags\":[\"validation\",\"determinism\",\"interface-design\"]}", "cost_usd": 0.034005, "bootstrap_seed": 0, "agent_model": "gpt-5.4", "held_out_score": null, "criterion_names": null, "per_criterion_scores": null, "failure_classification": null, "drafts_generated": 1, "drafts_survived": 1}
{"id": "07252079-a929-4f81-aed1-be9e52d0d032", "target_id": "B4-control", "git_sha": "31feb11695c7650793f0f1c967fc00a207c001a3", "pre_experiment_sha": "4b1ac784269ae6202c8879f93ea6a1a7aa039d6b", "timestamp": "2026-04-19T16:17:31.187844+00:00", "hypothesis": "Centralize deterministic validation and response construction so every invalid payload is rejected identically and all outputs have fixed shapes.", "hypothesis_source": "agent", "mutation_diff_summary": "", "score": 0.7, "score_ci_lower": null, "score_ci_upper": null, "raw_scores": null, "baseline_score": 0.7, "outcome": "KEPT", "failure_mode": null, "duration_seconds": 12.749546458013356, "tags": ["validation", "serialization", "error-handling", "deterministic"], "learnings": "{\"what_changed\":\"\",\"what_improved\":[],\"what_regressed\":[],\"transferable_insight\":\"Centralizing validation and output formatting improves consistency by ensuring all invalid inputs are handled uniformly and all responses follow a predictable structure.\",\"domain_tags\":[\"software-engineering\",\"reliability\",\"api-design\"]}", "cost_usd": 0.035345, "bootstrap_seed": 0, "agent_model": "gpt-5.4", "held_out_score": null, "criterion_names": null, "per_criterion_scores": null, "failure_classification": null, "drafts_generated": 1, "drafts_survived": 1}
{"id": "7dedb3b5-3105-4dd4-9ff8-9cf0970a04cb", "target_id": "B4-control", "git_sha": "62cd3ded9455937b99deb6a5e63777c328aa176b", "pre_experiment_sha": "31feb11695c7650793f0f1c967fc00a207c001a3", "timestamp": "2026-04-19T16:18:00.361429+00:00", "hypothesis": "Make all outputs and invalid-input handling use centralized deterministic response builders and reject empty/invalid create payloads consistently.", "hypothesis_source": "agent", "mutation_diff_summary": "", "score": 0.7, "score_ci_lower": null, "score_ci_upper": null, "raw_scores": null, "baseline_score": 0.7, "outcome": "KEPT", "failure_mode": null, "duration_seconds": 14.711778500000946, "tags": ["validation", "serialization", "error-handling", "deterministic"], "learnings": "{\"what_changed\":\"\",\"what_improved\":[],\"what_regressed\":[],\"transferable_insight\":\"Centralizing response construction and validation logic improves consistency by making success and error handling deterministic across all input paths.\",\"domain_tags\":[\"software-engineering\",\"validation\",\"api-design\"]}", "cost_usd": 0.036750000000000005, "bootstrap_seed": 0, "agent_model": "gpt-5.4", "held_out_score": null, "criterion_names": null, "per_criterion_scores": null, "failure_classification": null, "drafts_generated": 1, "drafts_survived": 1}
{"id": "a132806c-dc81-4652-8fb6-217c24289908", "target_id": "B4-control", "git_sha": "8e9070ed37e0c7116f557ce175107fa43f845cef", "pre_experiment_sha": "62cd3ded9455937b99deb6a5e63777c328aa176b", "timestamp": "2026-04-19T16:18:18.676756+00:00", "hypothesis": "Centralize all validation and response serialization so every invalid payload is rejected identically and every response uses fixed key ordering.", "hypothesis_source": "agent", "mutation_diff_summary": "", "score": 0.7, "score_ci_lower": null, "score_ci_upper": null, "raw_scores": null, "baseline_score": 0.7, "outcome": "KEPT", "failure_mode": null, "duration_seconds": 15.05016850004904, "tags": ["validation", "serialization", "error-handling", "deterministic"], "learnings": "{\"what_changed\":\"\",\"what_improved\":[],\"what_regressed\":[],\"transferable_insight\":\"Standardizing validation and output formatting at a single point reduces variation and makes system behavior more predictable and consistent.\",\"domain_tags\":[\"software-engineering\",\"quality-assurance\",\"systems-design\"]}", "cost_usd": 0.038205, "bootstrap_seed": 0, "agent_model": "gpt-5.4", "held_out_score": null, "criterion_names": null, "per_criterion_scores": null, "failure_classification": null, "drafts_generated": 1, "drafts_survived": 1}
{"id": "91984a29-16f8-460c-8774-5c7df0a21c14", "target_id": "B4-control", "git_sha": "b50a855990ac84017235c4d1375f0b165cfd0604", "pre_experiment_sha": "8e9070ed37e0c7116f557ce175107fa43f845cef", "timestamp": "2026-04-19T16:18:39.197320+00:00", "hypothesis": "Centralize deterministic validation and serialization so every invalid payload is rejected identically across endpoints.", "hypothesis_source": "agent", "mutation_diff_summary": "", "score": 0.7, "score_ci_lower": null, "score_ci_upper": null, "raw_scores": null, "baseline_score": 0.7, "outcome": "KEPT", "failure_mode": null, "duration_seconds": 19.462936082971282, "tags": ["validation", "serialization", "error-handling", "deterministic"], "learnings": "{\"what_changed\":\"\",\"what_improved\":[],\"what_regressed\":[],\"transferable_insight\":\"Standardizing validation and serialization logic in one place helps ensure consistent rejection of invalid inputs across all interfaces.\",\"domain_tags\":[\"software-engineering\",\"data-validation\",\"system-design\"]}", "cost_usd": 0.038225, "bootstrap_seed": 0, "agent_model": "gpt-5.4", "held_out_score": null, "criterion_names": null, "per_criterion_scores": null, "failure_classification": null, "drafts_generated": 1, "drafts_survived": 1}
{"id": "bbedff93-787f-4262-9af5-86f6c5f8b3d3", "target_id": "B4-control", "git_sha": "6819f2802efb8fa28f4b2c7c37c6f6873c8e9fca", "pre_experiment_sha": "b50a855990ac84017235c4d1375f0b165cfd0604", "timestamp": "2026-04-19T16:18:55.902555+00:00", "hypothesis": "Centralizing deterministic validation and explicit response serialization across all endpoints will improve deterministic behavior.", "hypothesis_source": "agent", "mutation_diff_summary": "", "score": 0.7, "score_ci_lower": null, "score_ci_upper": null, "raw_scores": null, "baseline_score": 0.7, "outcome": "KEPT", "failure_mode": null, "duration_seconds": 15.555558750056662, "tags": ["validation", "serialization", "error-handling", "deterministic"], "learnings": "{\"what_changed\":\"\",\"what_improved\":[],\"what_regressed\":[],\"transferable_insight\":\"Standardizing validation and output formatting at a central layer can improve consistency and reduce variability across interfaces.\",\"domain_tags\":[\"software-engineering\",\"systems-design\",\"reliability\"]}", "cost_usd": 0.039115000000000004, "bootstrap_seed": 0, "agent_model": "gpt-5.4", "held_out_score": null, "criterion_names": null, "per_criterion_scores": null, "failure_classification": null, "drafts_generated": 1, "drafts_survived": 1}
{"id": "2585e322-44cf-4dbf-8505-2405287edc91", "target_id": "B4-control", "git_sha": "b020c0dba6024b29f0c463cdb26641dae8200467", "pre_experiment_sha": "6819f2802efb8fa28f4b2c7c37c6f6873c8e9fca", "timestamp": "2026-04-19T16:19:14.723254+00:00", "hypothesis": "Centralize all validation failures and response construction into fixed helpers for fully deterministic bad-request handling.", "hypothesis_source": "agent", "mutation_diff_summary": "", "score": 0.7, "score_ci_lower": null, "score_ci_upper": null, "raw_scores": null, "baseline_score": 0.7, "outcome": "KEPT", "failure_mode": null, "duration_seconds": 14.909162291907705, "tags": ["deterministic", "validation", "serialization", "minimal-refactor"], "learnings": "{\"what_changed\":\"\",\"what_improved\":[],\"what_regressed\":[],\"transferable_insight\":\"Centralizing error handling and response generation into fixed helpers can make failure behavior deterministic and easier to reason about.\",\"domain_tags\":[\"error-handling\",\"determinism\",\"software-design\"]}", "cost_usd": 0.039055000000000006, "bootstrap_seed": 0, "agent_model": "gpt-5.4", "held_out_score": null, "criterion_names": null, "per_criterion_scores": null, "failure_classification": null, "drafts_generated": 1, "drafts_survived": 1}
{"id": "e94426d4-3213-487b-b5df-eca39dee9b4d", "target_id": "B4-control", "git_sha": "ea93e256d1ff1bac8d7ccbff0a7d69c396dfe516", "pre_experiment_sha": "b020c0dba6024b29f0c463cdb26641dae8200467", "timestamp": "2026-04-19T16:19:33.707258+00:00", "hypothesis": "Centralizing all validation and response construction into fixed shared helpers will improve deterministic behavior with minimal behavioral change.", "hypothesis_source": "agent", "mutation_diff_summary": "", "score": 0.7, "score_ci_lower": null, "score_ci_upper": null, "raw_scores": null, "baseline_score": 0.7, "outcome": "KEPT", "failure_mode": null, "duration_seconds": 17.762615291052498, "tags": ["deterministic", "validation", "serialization", "minimal-refactor"], "learnings": "{\"what_changed\":\"\",\"what_improved\":[],\"what_regressed\":[],\"transferable_insight\":\"Consolidating repeated validation and output assembly into shared helpers can preserve behavior while making execution more deterministic and easier to reason about.\",\"domain_tags\":[\"software-engineering\",\"reliability\",\"code-maintenance\"]}", "cost_usd": 0.039695, "bootstrap_seed": 0, "agent_model": "gpt-5.4", "held_out_score": null, "criterion_names": null, "per_criterion_scores": null, "failure_classification": null, "drafts_generated": 1, "drafts_survived": 1}
{"id": "0defd82d-7149-4ee9-9784-aac98ba2cceb", "target_id": "B4-control", "git_sha": "ffffb7662b21285f15fb4d9bc747eee9a8ecda2b", "pre_experiment_sha": "ea93e256d1ff1bac8d7ccbff0a7d69c396dfe516", "timestamp": "2026-04-19T16:19:50.641139+00:00", "hypothesis": "Centralize deterministic validation and response building so every invalid payload returns the exact same bad-request shape and ordering.", "hypothesis_source": "agent", "mutation_diff_summary": "", "score": 0.7, "score_ci_lower": null, "score_ci_upper": null, "raw_scores": null, "baseline_score": 0.7, "outcome": "KEPT", "failure_mode": null, "duration_seconds": 14.955240958952345, "tags": ["validation", "deterministic", "serialization", "refactor"], "learnings": "{\"what_changed\":\"\",\"what_improved\":[],\"what_regressed\":[],\"transferable_insight\":\"Standardizing validation and error-response construction in one place improves consistency by ensuring all failures produce the same predictable shape and ordering.\",\"domain_tags\":[\"software-engineering\",\"api-design\",\"reliability\"]}", "cost_usd": 0.03917, "bootstrap_seed": 0, "agent_model": "gpt-5.4", "held_out_score": null, "criterion_names": null, "per_criterion_scores": null, "failure_classification": null, "drafts_generated": 1, "drafts_survived": 1}
{"id": "2bf2d3c9-1c37-4217-8606-ff28bae94d66", "target_id": "B4-control", "git_sha": "85dd60eba64b05f5709448502926037c7e60933a", "pre_experiment_sha": "ffffb7662b21285f15fb4d9bc747eee9a8ecda2b", "timestamp": "2026-04-19T16:20:11.680101+00:00", "hypothesis": "Centralizing validation and response construction will make all endpoints reject invalid inputs and serialize outputs identically and deterministically.", "hypothesis_source": "agent", "mutation_diff_summary": "", "score": 0.7, "score_ci_lower": null, "score_ci_upper": null, "raw_scores": null, "baseline_score": 0.7, "outcome": "KEPT", "failure_mode": null, "duration_seconds": 17.46070029202383, "tags": ["refactor", "deterministic", "validation", "responses"], "learnings": "{\"what_changed\":\"\",\"what_improved\":[],\"what_regressed\":[],\"transferable_insight\":\"Centralizing shared validation and output formatting logic increases consistency and determinism across interfaces by reducing endpoint-specific variation.\",\"domain_tags\":[\"software-engineering\",\"quality-assurance\",\"system-design\"]}", "cost_usd": 0.04123500000000001, "bootstrap_seed": 0, "agent_model": "gpt-5.4", "held_out_score": null, "criterion_names": null, "per_criterion_scores": null, "failure_classification": null, "drafts_generated": 1, "drafts_survived": 1}
{"id": "7a62cf29-d8b3-49ad-af80-204923bcf66c", "target_id": "B4-control", "git_sha": "b236c38c58c88fee2eb31869d3fcc5b7164ade89", "pre_experiment_sha": "85dd60eba64b05f5709448502926037c7e60933a", "timestamp": "2026-04-19T16:20:28.421711+00:00", "hypothesis": "Unify all request rejection and response construction through shared deterministic helpers while preserving successful behavior.", "hypothesis_source": "agent", "mutation_diff_summary": "", "score": 0.7, "score_ci_lower": null, "score_ci_upper": null, "raw_scores": null, "baseline_score": 0.7, "outcome": "KEPT", "failure_mode": null, "duration_seconds": 15.739951416966505, "tags": ["refactor", "validation", "deterministic", "responses"], "learnings": "{\"what_changed\":\"\",\"what_improved\":[],\"what_regressed\":[],\"transferable_insight\":\"Centralizing decision and output logic in shared deterministic helpers can reduce inconsistency while preserving existing successful behavior.\",\"domain_tags\":[\"software-engineering\",\"reliability\",\"refactoring\"]}", "cost_usd": 0.041460000000000004, "bootstrap_seed": 0, "agent_model": "gpt-5.4", "held_out_score": null, "criterion_names": null, "per_criterion_scores": null, "failure_classification": null, "drafts_generated": 1, "drafts_survived": 1}
{"id": "135139a0-e251-4574-b734-eeac50ffc934", "target_id": "B4-control", "git_sha": "7475af1c08d03a72bfb93ea79dbfb7368e4a6ecd", "pre_experiment_sha": "b236c38c58c88fee2eb31869d3fcc5b7164ade89", "timestamp": "2026-04-19T16:20:46.210642+00:00", "hypothesis": "Centralizing validation and response construction into stricter shared helpers will improve deterministic behavior without changing valid outputs.", "hypothesis_source": "agent", "mutation_diff_summary": "", "score": 0.7, "score_ci_lower": null, "score_ci_upper": null, "raw_scores": null, "baseline_score": 0.7, "outcome": "KEPT", "failure_mode": null, "duration_seconds": 16.533342292066664, "tags": ["refactor", "validation", "responses", "deterministic"], "learnings": "{\"what_changed\":\"\",\"what_improved\":[],\"what_regressed\":[],\"transferable_insight\":\"Consolidating repeated validation and output-building logic into shared, stricter helpers can improve consistency and determinism while preserving correct results.\",\"domain_tags\":[\"software-engineering\",\"reliability\",\"refactoring\"]}", "cost_usd": 0.04201, "bootstrap_seed": 0, "agent_model": "gpt-5.4", "held_out_score": null, "criterion_names": null, "per_criterion_scores": null, "failure_classification": null, "drafts_generated": 1, "drafts_survived": 1}
{"id": "6c8075e9-6182-4b4c-be7f-128fcd614bf9", "target_id": "B4-control", "git_sha": "bb4937326257e16159cb705beb8c27b1794fdc70", "pre_experiment_sha": "7475af1c08d03a72bfb93ea79dbfb7368e4a6ecd", "timestamp": "2026-04-19T16:21:07.410251+00:00", "hypothesis": "Unify validation and response construction through one shared validator and one shared response builder while preserving accepted behavior.", "hypothesis_source": "agent", "mutation_diff_summary": "", "score": 0.7, "score_ci_lower": null, "score_ci_upper": null, "raw_scores": null, "baseline_score": 0.7, "outcome": "KEPT", "failure_mode": null, "duration_seconds": 17.291744166985154, "tags": ["refactor", "validation", "responses", "deterministic"], "learnings": "{\"what_changed\":\"\",\"what_improved\":[],\"what_regressed\":[],\"transferable_insight\":\"When two workflows must stay behaviorally identical, consolidating them around shared validation and output construction can reduce duplication without changing outcomes if the shared components preserve existing rules exactly.\",\"domain_tags\":[\"software-engineering\",\"refactoring\",\"validation\"]}", "cost_usd": 0.04468, "bootstrap_seed": 0, "agent_model": "gpt-5.4", "held_out_score": null, "criterion_names": null, "per_criterion_scores": null, "failure_classification": null, "drafts_generated": 1, "drafts_survived": 1}
{"id": "89aa2890-eddb-42d6-a312-9ab30864c1d7", "target_id": "B4-control", "git_sha": "a5d70114c5ada80d9ce67c0744e69c42e217923c", "pre_experiment_sha": "bb4937326257e16159cb705beb8c27b1794fdc70", "timestamp": "2026-04-19T16:21:26.430965+00:00", "hypothesis": "Unify validation failures and response construction through one strict validator and one shared response helper without changing accepted behavior.", "hypothesis_source": "agent", "mutation_diff_summary": "", "score": 0.7, "score_ci_lower": null, "score_ci_upper": null, "raw_scores": null, "baseline_score": 0.7, "outcome": "KEPT", "failure_mode": null, "duration_seconds": 17.775143875041977, "tags": ["refactor", "validation", "responses", "deterministic"], "learnings": "{\"what_changed\":\"\",\"what_improved\":[],\"what_regressed\":[],\"transferable_insight\":\"When multiple code paths must preserve the same behavior, centralizing validation and output formatting into shared strict helpers reduces duplication without changing outcomes.\",\"domain_tags\":[\"software-engineering\",\"code-maintenance\",\"validation\"]}", "cost_usd": 0.04524, "bootstrap_seed": 0, "agent_model": "gpt-5.4", "held_out_score": null, "criterion_names": null, "per_criterion_scores": null, "failure_classification": null, "drafts_generated": 1, "drafts_survived": 1}
{"id": "587aa1a1-17f2-4b75-bb7d-b144f497c8c5", "target_id": "B4-control", "git_sha": "4741a6b2e3b5e2a9bfe71af6d486e13030ddcb2b", "pre_experiment_sha": "a5d70114c5ada80d9ce67c0744e69c42e217923c", "timestamp": "2026-04-19T16:21:43.759490+00:00", "hypothesis": "Make every endpoint use one shared dispatcher for validation and response construction while preserving current successful behavior.", "hypothesis_source": "agent", "mutation_diff_summary": "", "score": 0.7, "score_ci_lower": null, "score_ci_upper": null, "raw_scores": null, "baseline_score": 0.7, "outcome": "KEPT", "failure_mode": null, "duration_seconds": 16.135948999901302, "tags": ["refactor", "validation", "responses", "deterministic"], "learnings": "{\"what_changed\":\"\",\"what_improved\":[],\"what_regressed\":[],\"transferable_insight\":\"Centralizing repeated handling behind one shared dispatcher can preserve existing successful behavior while simplifying validation and output construction.\",\"domain_tags\":[\"software architecture\",\"refactoring\",\"reliability\"]}", "cost_usd": 0.050255, "bootstrap_seed": 0, "agent_model": "gpt-5.4", "held_out_score": null, "criterion_names": null, "per_criterion_scores": null, "failure_classification": null, "drafts_generated": 1, "drafts_survived": 1}
{"id": "7314e24b-a8cd-44db-bd24-893d2d23c810", "target_id": "B4-control", "git_sha": "4f4a259bbb8052004a76ad8b021c9e87b5c3288d", "pre_experiment_sha": "4741a6b2e3b5e2a9bfe71af6d486e13030ddcb2b", "timestamp": "2026-04-19T16:22:09.942705+00:00", "hypothesis": "Route all endpoints through one shared pre-check and one shared response builder to make invalid handling fully uniform and deterministic.", "hypothesis_source": "agent", "mutation_diff_summary": "", "score": 0.7, "score_ci_lower": null, "score_ci_upper": null, "raw_scores": null, "baseline_score": 0.7, "outcome": "KEPT", "failure_mode": null, "duration_seconds": 22.547121167066507, "tags": ["refactor", "validation", "responses", "deterministic"], "learnings": "{\"what_changed\":\"\",\"what_improved\":[],\"what_regressed\":[],\"transferable_insight\":\"Centralizing validation and output construction into shared steps can make failure handling more consistent and predictable across all entry points.\",\"domain_tags\":[\"software engineering\",\"system design\",\"reliability\"]}", "cost_usd": 0.051785000000000005, "bootstrap_seed": 0, "agent_model": "gpt-5.4", "held_out_score": null, "criterion_names": null, "per_criterion_scores": null, "failure_classification": null, "drafts_generated": 1, "drafts_survived": 1}
