{"id": "379ac2e1-d62a-4c3e-a42f-b4b943f142a9", "target_id": "B4-control", "git_sha": "5dfe45eb4ac0661a092592261f260a8e9a09be3f", "pre_experiment_sha": "5dfe45eb4ac0661a092592261f260a8e9a09be3f", "timestamp": "2026-04-21T22:13:29.667047+00:00", "hypothesis": "Optimize the API endpoint by using list comprehensions, pre-calculating lowercase strings for filtering, removing redundant dictionary lookups, and streamlining the email validation logic.", "hypothesis_source": "agent", "mutation_diff_summary": "", "score": 0.435, "score_ci_lower": null, "score_ci_upper": null, "raw_scores": null, "baseline_score": 0.435, "outcome": "DISCARDED", "failure_mode": null, "duration_seconds": 68.562580750091, "tags": ["performance", "refactoring", "string-operations"], "learnings": "{\"what_changed\":\"\",\"what_improved\":[],\"what_regressed\":[],\"transferable_insight\":\"Applying micro-level optimizations to processing logic often yields no measurable performance benefit if the targeted operations are not the system's primary bottleneck.\",\"domain_tags\":[\"Software Engineering\",\"Performance Optimization\",\"Backend Development\"]}", "cost_usd": 0.013730850000000001, "bootstrap_seed": 0, "agent_model": "gemini-3.1-pro-preview", "held_out_score": null, "criterion_names": null, "per_criterion_scores": null, "failure_classification": {"category": "semantic_drift", "description": "The optimization attempts, particularly in streamlining email validation and pre-calculating data for filtering, likely introduced subtle changes in how the API endpoint processes or validates data. This means the system's understanding or criteria for 'valid' data or operations has drifted from the original intent, leading to functionally incorrect results despite potentially improving speed. The low score suggests a significant deviation in output correctness or behavior.", "fix_direction": "Implement thorough integration tests and behavioral tests to compare the output and internal state of the optimized code against the original implementation. Focus on validating the exact criteria for email validation and data filtering across a wide range of inputs, especially edge cases. Ensure that performance gains do not compromise the integrity or meaning of the data being processed.", "confidence": 0.85}, "drafts_generated": 1, "drafts_survived": 1}
{"id": "6fb0178c-1bfb-4c9f-9427-abea80b450d6", "target_id": "B4-control", "git_sha": "5dfe45eb4ac0661a092592261f260a8e9a09be3f", "pre_experiment_sha": "5dfe45eb4ac0661a092592261f260a8e9a09be3f", "timestamp": "2026-04-21T22:15:43.211451+00:00", "hypothesis": "Optimize the API endpoint by utilizing `__slots__` for the `User` class to reduce memory overhead, replacing double dictionary lookups with `.get()` and `.pop()`, rewriting `list_users` to use a list comprehension with hoisted filter evaluations, and simplifying `validate_email` with fast tuple unpacking.", "hypothesis_source": "agent", "mutation_diff_summary": "", "score": 0.435, "score_ci_lower": null, "score_ci_upper": null, "raw_scores": null, "baseline_score": 0.435, "outcome": "DISCARDED", "failure_mode": null, "duration_seconds": 113.4836671249941, "tags": ["performance", "memory-optimization", "refactoring"], "learnings": "{\"what_changed\":\"\",\"what_improved\":[],\"what_regressed\":[],\"transferable_insight\":\"Micro-optimizations aimed at reducing memory overhead and CPU cycles rarely yield measurable improvements unless applied directly to the system's primary performance bottleneck.\",\"domain_tags\":[\"Performance Optimization\",\"Software Engineering\",\"Micro-optimization\"]}", "cost_usd": 0.01324065, "bootstrap_seed": 0, "agent_model": "gemini-3.1-pro-preview", "held_out_score": null, "criterion_names": null, "per_criterion_scores": null, "failure_classification": {"category": "regression", "description": "The attempted optimizations to reduce memory overhead and improve performance likely introduced correctness bugs or significantly degraded existing functionality, leading to a much lower score (0.4350) compared to a presumed baseline before optimization. The experiment failed to achieve its goal and instead worsened the system's state.", "fix_direction": "Revert the specific optimization changes. Analyze each proposed technique (e.g., `__slots__`, `.get()/.pop()`, list comprehension, tuple unpacking) individually for potential pitfalls or incorrect implementation. Implement changes incrementally with robust unit and integration tests to catch regressions early and verify actual performance gains.", "confidence": 0.9}, "drafts_generated": 1, "drafts_survived": 1}
{"id": "38603ed6-86c7-42c6-99b1-bdbb4e6b6d34", "target_id": "B4-control", "git_sha": "093c9d15653cbdd1e81ef58db9fea798326c785f", "pre_experiment_sha": "5dfe45eb4ac0661a092592261f260a8e9a09be3f", "timestamp": "2026-04-21T22:17:08.355588+00:00", "hypothesis": "Optimize the API endpoint by directly iterating over `db.values()`, pre-evaluating filter conditions, simplifying dictionary lookups, fast-pathing `validate_email` with tuple unpacking, and removing unused imports.", "hypothesis_source": "agent", "mutation_diff_summary": "", "score": 0.51, "score_ci_lower": null, "score_ci_upper": null, "raw_scores": null, "baseline_score": 0.435, "outcome": "KEPT", "failure_mode": null, "duration_seconds": 60.75921529205516, "tags": ["performance", "refactoring", "dict-access", "loop-optimization"], "learnings": "{\"what_changed\":\"\",\"what_improved\":[],\"what_regressed\":[],\"transferable_insight\":\"Streamlining data access patterns, pre-evaluating loop conditions, and fast-pathing frequent validations cumulatively reduces execution overhead and improves overall system performance.\",\"domain_tags\":[\"Performance Optimization\",\"Software Engineering\",\"Code Refactoring\"]}", "cost_usd": 0.0122, "bootstrap_seed": 0, "agent_model": "gemini-3.1-pro-preview", "held_out_score": null, "criterion_names": null, "per_criterion_scores": null, "failure_classification": null, "drafts_generated": 1, "drafts_survived": 1}
{"id": "a7682a06-b177-4c9f-b0de-18aecad0b312", "target_id": "B4-control", "git_sha": "b18f56e8ea033c0f698d03dc122fc0c7877e993f", "pre_experiment_sha": "093c9d15653cbdd1e81ef58db9fea798326c785f", "timestamp": "2026-04-21T22:18:20.899232+00:00", "hypothesis": "Optimize `list_users` by unrolling filter conditions to avoid per-iteration branch checks, and fast-path `validate_email` to eliminate `try/except` overhead for valid data while avoiding database mutation during lookups.", "hypothesis_source": "agent", "mutation_diff_summary": "", "score": 0.525, "score_ci_lower": null, "score_ci_upper": null, "raw_scores": null, "baseline_score": 0.51, "outcome": "KEPT", "failure_mode": null, "duration_seconds": 56.41845954093151, "tags": ["loop-unrolling", "fast-path", "dictionary-access"], "learnings": "{\"what_changed\":\"\",\"what_improved\":[],\"what_regressed\":[],\"transferable_insight\":\"Reducing per-iteration branching through loop unrolling and bypassing costly exception handling with fast-paths for expected data improves overall execution efficiency.\",\"domain_tags\":[\"Performance Optimization\",\"Control Flow\",\"Exception Handling\"]}", "cost_usd": 0.01466375, "bootstrap_seed": 0, "agent_model": "gemini-3.1-pro-preview", "held_out_score": null, "criterion_names": null, "per_criterion_scores": null, "failure_classification": null, "drafts_generated": 1, "drafts_survived": 1}
{"id": "6cba1b58-e5ec-4829-9e2c-d53358ad5b4f", "target_id": "B4-control", "git_sha": "b18f56e8ea033c0f698d03dc122fc0c7877e993f", "pre_experiment_sha": "b18f56e8ea033c0f698d03dc122fc0c7877e993f", "timestamp": "2026-04-21T22:19:16.735047+00:00", "hypothesis": "Fast-path email validation using tuple unpacking with try-except, and optimize datetime instantiation to reduce attribute lookup overhead.", "hypothesis_source": "agent", "mutation_diff_summary": "", "score": 0.525, "score_ci_lower": null, "score_ci_upper": null, "raw_scores": null, "baseline_score": 0.525, "outcome": "DISCARDED", "failure_mode": null, "duration_seconds": 49.73036174988374, "tags": ["fast-path", "string-manipulation", "error-handling"], "learnings": "{\"what_changed\":\"\",\"what_improved\":[],\"what_regressed\":[],\"transferable_insight\":\"Micro-optimizations such as exception-based fast paths and reducing attribute lookups often yield negligible performance gains if the targeted operations are not the primary bottleneck.\",\"domain_tags\":[\"Performance Optimization\",\"Micro-optimization\",\"Software Engineering\"]}", "cost_usd": 0.014813100000000001, "bootstrap_seed": 0, "agent_model": "gemini-3.1-pro-preview", "held_out_score": null, "criterion_names": null, "per_criterion_scores": null, "failure_classification": {"category": "over_optimization", "description": "The proposed 'fast-path' email validation using tuple unpacking with try-except, and the optimization of datetime instantiation to reduce attribute lookup overhead, likely either failed to deliver the intended performance improvements or introduced new overheads/issues. The complexity or specific implementation of these micro-optimizations might have outweighed any benefits, leading to the low score rather than an improvement.", "fix_direction": "Instead of speculative micro-optimizations, identify actual performance bottlenecks through profiling. Evaluate if the 'fast-path' for email validation truly reduces overall execution time, especially considering the cost of try-except blocks. For datetime, ensure that any optimization provides a measurable and significant improvement without sacrificing code clarity or introducing new edge cases. Prioritize robust and clear code over premature optimization.", "confidence": 0.9}, "drafts_generated": 1, "drafts_survived": 1}
{"id": "7dee6896-7ef5-49fb-8954-4588f3cd9646", "target_id": "B4-control", "git_sha": "b18f56e8ea033c0f698d03dc122fc0c7877e993f", "pre_experiment_sha": "b18f56e8ea033c0f698d03dc122fc0c7877e993f", "timestamp": "2026-04-21T22:20:16.058766+00:00", "hypothesis": "Fast-path email validation using tuple unpacking, cache global `_next_id` locally during user creation, and optimize filter condition pre-evaluation in `list_users` to reduce overhead.", "hypothesis_source": "agent", "mutation_diff_summary": "", "score": 0.525, "score_ci_lower": null, "score_ci_upper": null, "raw_scores": null, "baseline_score": 0.525, "outcome": "DISCARDED", "failure_mode": null, "duration_seconds": 42.72939749993384, "tags": ["fast-path", "dictionary-lookup", "tuple-unpacking"], "learnings": "{\"what_changed\":\"\",\"what_improved\":[],\"what_regressed\":[],\"transferable_insight\":\"Micro-optimizations targeting negligible overheads, such as local caching of globals or fast-path tuple unpacking, often fail to produce measurable performance improvements.\",\"domain_tags\":[\"Performance Optimization\",\"Micro-optimization\",\"Software Engineering\"]}", "cost_usd": 0.0151205, "bootstrap_seed": 0, "agent_model": "gemini-3.1-pro-preview", "held_out_score": null, "criterion_names": null, "per_criterion_scores": null, "failure_classification": {"category": "over_optimization", "description": "The experiment focused entirely on micro-optimizations (tuple unpacking for email validation, local caching of `_next_id`, and filter condition pre-evaluation). The low score (0.5250) suggests that these optimizations either did not provide the intended performance benefits, introduced new overhead, or caused unintended regressions/side effects that negatively impacted the overall system's performance or correctness, making the efforts counterproductive. The 'unknown' failure mode often points to subtle performance degradations or complex behavioral changes that are hard to diagnose.", "fix_direction": "Re-evaluate the actual performance bottlenecks through comprehensive profiling before attempting further micro-optimizations. Consider if the proposed 'fast-paths' truly address the slowest parts of the system. Prioritize code clarity and maintainability over speculative optimizations, and thoroughly benchmark any changes against a clear baseline to ensure actual improvements without introducing new issues.", "confidence": 0.9}, "drafts_generated": 1, "drafts_survived": 1}
{"id": "c479414f-e546-4590-8c68-b8283253bad9", "target_id": "B4-control", "git_sha": "b18f56e8ea033c0f698d03dc122fc0c7877e993f", "pre_experiment_sha": "b18f56e8ea033c0f698d03dc122fc0c7877e993f", "timestamp": "2026-04-21T22:22:03.310070+00:00", "hypothesis": "Fast-path email validation by checking for '@' before splitting, and rewrite `list_users` inner loops into list comprehensions to eliminate `append` overhead while strictly preserving exact semantics and filtering logic.", "hypothesis_source": "agent", "mutation_diff_summary": "", "score": 0.525, "score_ci_lower": null, "score_ci_upper": null, "raw_scores": null, "baseline_score": 0.525, "outcome": "DISCARDED", "failure_mode": null, "duration_seconds": 75.7704186248593, "tags": ["fast-path", "list-comprehension"], "learnings": "{\"what_changed\":\"\",\"what_improved\":[],\"what_regressed\":[],\"transferable_insight\":\"Micro-optimizations aimed at reducing basic operational overhead often yield negligible performance gains unless they target the system's primary execution bottleneck.\",\"domain_tags\":[\"Performance Optimization\",\"Micro-optimization\",\"Code Refactoring\"]}", "cost_usd": 0.014703850000000003, "bootstrap_seed": 0, "agent_model": "gemini-3.1-pro-preview", "held_out_score": null, "criterion_names": null, "per_criterion_scores": null, "failure_classification": {"category": "semantic_drift", "description": "The refactoring aimed at performance optimization, specifically the rewrite of inner loops into list comprehensions and the email validation fast-path, likely introduced subtle changes to the exact semantics or filtering logic. Despite potentially maintaining the output format, the meaning or correctness of the data produced (e.g., which users are listed, or which emails are validated) diverged from the original, resulting in a low score. The 'unknown' failure mode suggests the specific points of logical divergence were not immediately identified.", "fix_direction": "Implement or enhance comprehensive unit and integration tests that meticulously compare the output and behavior of the refactored code against the original implementation for a wide range of inputs, including edge cases. Focus on the `list_users` filtering logic and the email validation process. Use a debugger or detailed logging to trace execution paths and data transformations in both versions to pinpoint where the semantics diverged.", "confidence": 0.95}, "drafts_generated": 1, "drafts_survived": 1}
{"id": "0765c240-a087-489a-9516-dc637a27676a", "target_id": "B4-control", "git_sha": "b18f56e8ea033c0f698d03dc122fc0c7877e993f", "pre_experiment_sha": "b18f56e8ea033c0f698d03dc122fc0c7877e993f", "timestamp": "2026-04-21T22:23:33.161813+00:00", "hypothesis": "Remove `try/except` from the `list_users` fast-path loop to avoid per-iteration overhead, and add a fast-path check for `'@'` in `validate_email` before splitting to reduce string manipulation overhead.", "hypothesis_source": "agent", "mutation_diff_summary": "", "score": 0.525, "score_ci_lower": null, "score_ci_upper": null, "raw_scores": null, "baseline_score": 0.525, "outcome": "DISCARDED", "failure_mode": null, "duration_seconds": 68.47045237501152, "tags": ["fast-path", "try-except-removal", "string-splitting", "loop-optimization"], "learnings": "{\"what_changed\":\"\",\"what_improved\":[],\"what_regressed\":[],\"transferable_insight\":\"Micro-optimizations such as removing exception handlers or adding redundant string pre-checks often fail to provide measurable performance improvements because modern runtimes already execute these operations highly efficiently.\",\"domain_tags\":[\"Performance Optimization\",\"Micro-optimization\",\"Runtime Execution\"]}", "cost_usd": 0.015295650000000001, "bootstrap_seed": 0, "agent_model": "gemini-3.1-pro-preview", "held_out_score": null, "criterion_names": null, "per_criterion_scores": null, "failure_classification": {"category": "regression", "description": "The experiment aimed to optimize performance by reducing overhead, but the resulting score of 0.5250 indicates a significant degradation in performance or functionality compared to a presumed baseline. The intended improvements led to an unexpected negative outcome.", "fix_direction": "Thoroughly profile the application with the proposed changes to identify the specific bottleneck or introduced inefficiency. Evaluate why removing `try/except` led to a worse outcome (e.g., unhandled errors, slower default paths, or increased failure rates). Similarly, verify the actual performance impact of the `'@'` fast-path check under realistic data distributions, as it might have introduced overhead or edge-case inefficiencies.", "confidence": 0.9}, "drafts_generated": 1, "drafts_survived": 1}
{"id": "7da7fca8-c0c1-43bd-b346-bd0e656af326", "target_id": "B4-control", "git_sha": "b18f56e8ea033c0f698d03dc122fc0c7877e993f", "pre_experiment_sha": "b18f56e8ea033c0f698d03dc122fc0c7877e993f", "timestamp": "2026-04-21T22:24:55.047935+00:00", "hypothesis": "Fast-path email validation by verifying the presence of '@' before splitting, and remove unused `annotations` import to reduce overhead while strictly preserving exact semantics.", "hypothesis_source": "agent", "mutation_diff_summary": "", "score": 0.525, "score_ci_lower": null, "score_ci_upper": null, "raw_scores": null, "baseline_score": 0.525, "outcome": "DISCARDED", "failure_mode": null, "duration_seconds": 65.06612537498586, "tags": ["fast-path", "string-validation", "remove-import"], "learnings": "{\"what_changed\":\"\",\"what_improved\":[],\"what_regressed\":[],\"transferable_insight\":\"Micro-optimizations such as manual pre-condition checks before standard operations often yield no measurable performance benefits and can be safely avoided to maintain code simplicity.\",\"domain_tags\":[\"Micro-optimization\",\"Performance\",\"Code Simplicity\"]}", "cost_usd": 0.014983550000000002, "bootstrap_seed": 0, "agent_model": "gemini-3.1-pro-preview", "held_out_score": null, "criterion_names": null, "per_criterion_scores": null, "failure_classification": {"category": "semantic_drift", "description": "The experiment aimed to strictly preserve exact semantics, but the non-perfect score (0.5250) and 'unknown' failure mode suggest that the behavior of the email validation changed. The new fast-path logic for verifying '@' or splitting likely introduced subtle differences in how certain emails are deemed valid or invalid, thus violating the semantic preservation constraint.", "fix_direction": "Implement a comprehensive suite of regression tests for email validation, covering various edge cases and RFC compliance. Compare the validation outcomes of the modified code against the original implementation for all test cases to precisely identify where semantics have drifted. Prioritize semantic equivalence over performance improvements until exact correctness is verified.", "confidence": 0.9}, "drafts_generated": 1, "drafts_survived": 1}
