{"id": "72aca49e-14f9-4217-b1e1-7d3602d42a57", "target_id": "B4-control", "git_sha": "8bcca2d8bc52cc0169457244ebf9e051952c7474", "pre_experiment_sha": "14830d45a504e06644bfe76eec560b69c11d638e", "timestamp": "2026-04-23T20:38:44.801887+00:00", "hypothesis": "Hoist the extraction of `f_active` and the assignment of `lower = str.lower` to the top level of filter processing in `list_users` to avoid redundant assignments across execution branches.", "hypothesis_source": "agent", "mutation_diff_summary": "", "score": 0.6, "score_ci_lower": null, "score_ci_upper": null, "raw_scores": null, "baseline_score": 0.6, "outcome": "KEPT", "failure_mode": null, "duration_seconds": 157.2843565000221, "tags": ["optimization", "hoisting", "refactoring"], "learnings": "{\"what_changed\":\"\",\"what_improved\":[],\"what_regressed\":[],\"transferable_insight\":\"Hoisting shared variable assignments and method aliases outside of conditional execution branches prevents redundant operations and improves code structure, even when measurable performance gains are negligible.\",\"domain_tags\":[\"Code Optimization\",\"Refactoring\",\"Software Engineering\"]}", "cost_usd": 0.0186225, "bootstrap_seed": 0, "agent_model": "gemini-3.1-pro-preview", "held_out_score": null, "criterion_names": null, "per_criterion_scores": null, "failure_classification": null, "drafts_generated": 1, "drafts_survived": 1}
{"id": "ed0113ff-f6c7-4495-819c-6d8ab02f48ce", "target_id": "B4-control", "git_sha": "f348f8ac9bbffca63f1b2b9b201152aa8e62ffd8", "pre_experiment_sha": "8bcca2d8bc52cc0169457244ebf9e051952c7474", "timestamp": "2026-04-23T20:48:47.964187+00:00", "hypothesis": "Remove the `vals` local variable assignment in `list_users` and invoke `db.values()` directly within the list comprehensions, as each branch returns immediately and evaluates the view exactly once.", "hypothesis_source": "agent", "mutation_diff_summary": "", "score": 0.6, "score_ci_lower": null, "score_ci_upper": null, "raw_scores": null, "baseline_score": 0.6, "outcome": "KEPT", "failure_mode": null, "duration_seconds": 69.92335312487558, "tags": ["performance", "local-variables", "list-comprehension"], "learnings": "{\"what_changed\":\"\",\"what_improved\":[],\"what_regressed\":[],\"transferable_insight\":\"Eliminating intermediate variables for single-use evaluations directly within return statements streamlines logic without compromising performance.\",\"domain_tags\":[\"Code Refactoring\",\"Clean Code\"]}", "cost_usd": 0.021021250000000002, "bootstrap_seed": 0, "agent_model": "gemini-3.1-pro-preview", "held_out_score": null, "criterion_names": null, "per_criterion_scores": null, "failure_classification": null, "drafts_generated": 1, "drafts_survived": 1}
{"id": "dc68fd18-7b4d-4880-beeb-f1dfb2c3dbc3", "target_id": "B4-control", "git_sha": "a2020181bb320243ba3ef436efcf64d2c10e543d", "pre_experiment_sha": "f348f8ac9bbffca63f1b2b9b201152aa8e62ffd8", "timestamp": "2026-04-23T20:51:08.030210+00:00", "hypothesis": "Simplify the filter extraction logic in `list_users` by replacing intermediate boolean variable assignments with direct dictionary inclusion checks, reducing local state overhead while preserving fast execution paths.", "hypothesis_source": "agent", "mutation_diff_summary": "", "score": 0.6, "score_ci_lower": null, "score_ci_upper": null, "raw_scores": null, "baseline_score": 0.6, "outcome": "KEPT", "failure_mode": null, "duration_seconds": 134.0777087500319, "tags": ["refactoring", "performance", "conditionals", "clean-code"], "learnings": "{\"what_changed\":\"\",\"what_improved\":[],\"what_regressed\":[],\"transferable_insight\":\"Bypassing intermediate variable assignments in favor of direct conditional checks simplifies logic and reduces local state overhead while maintaining performance.\",\"domain_tags\":[\"Code Refactoring\",\"Micro-optimization\",\"Maintainability\"]}", "cost_usd": 0.020903750000000002, "bootstrap_seed": 0, "agent_model": "gemini-3.1-pro-preview", "held_out_score": null, "criterion_names": null, "per_criterion_scores": null, "failure_classification": null, "drafts_generated": 1, "drafts_survived": 1}
{"id": "dd800d04-b2cc-4037-ace6-5d43d3c24902", "target_id": "B4-control", "git_sha": "4ffe150d27bccd72071d230aa88c43886d46bf07", "pre_experiment_sha": "a2020181bb320243ba3ef436efcf64d2c10e543d", "timestamp": "2026-04-23T20:52:41.501191+00:00", "hypothesis": "Assign `User.to_dict` to a local variable `to_dict` at the start of `list_users` and use it within the list comprehensions to reduce dictionary construction overhead, while simplifying the `has_active` boolean assignment.", "hypothesis_source": "agent", "mutation_diff_summary": "", "score": 0.6, "score_ci_lower": null, "score_ci_upper": null, "raw_scores": null, "baseline_score": 0.6, "outcome": "KEPT", "failure_mode": null, "duration_seconds": 68.34590141708031, "tags": ["performance", "list-comprehension", "local-variable-caching", "refactoring"], "learnings": "{\"what_changed\":\"\",\"what_improved\":[],\"what_regressed\":[],\"transferable_insight\":\"Caching method references as local variables before executing loops or comprehensions is a standard micro-optimization to reduce attribute lookup overhead.\",\"domain_tags\":[\"Performance Optimization\",\"Code Refactoring\",\"Micro-optimization\"]}", "cost_usd": 0.0198925, "bootstrap_seed": 0, "agent_model": "gemini-3.1-pro-preview", "held_out_score": null, "criterion_names": null, "per_criterion_scores": null, "failure_classification": null, "drafts_generated": 1, "drafts_survived": 1}
{"id": "4df8fe81-c9ab-4baf-88d6-1dd3b134842f", "target_id": "B4-control", "git_sha": "45ff1cebbd0df49d5d179466446f12e40c057a74", "pre_experiment_sha": "4ffe150d27bccd72071d230aa88c43886d46bf07", "timestamp": "2026-04-23T20:56:29.370031+00:00", "hypothesis": "Refactor `list_users` to use nested conditionals for filter extraction, replacing intermediate boolean variables with direct dictionary inclusion checks to reduce local state overhead and simplify execution paths.", "hypothesis_source": "agent", "mutation_diff_summary": "", "score": 0.6, "score_ci_lower": null, "score_ci_upper": null, "raw_scores": null, "baseline_score": 0.6, "outcome": "KEPT", "failure_mode": null, "duration_seconds": 220.97681095800363, "tags": ["performance", "refactoring", "conditionals", "clean-code"], "learnings": "{\"what_changed\":\"\",\"what_improved\":[],\"what_regressed\":[],\"transferable_insight\":\"Replacing intermediate state variables with direct conditional checks simplifies execution paths and reduces local state overhead without measurably impacting performance.\",\"domain_tags\":[\"Code Refactoring\",\"State Management\",\"Software Engineering\"]}", "cost_usd": 0.019655000000000002, "bootstrap_seed": 0, "agent_model": "gemini-3.1-pro-preview", "held_out_score": null, "criterion_names": null, "per_criterion_scores": null, "failure_classification": null, "drafts_generated": 1, "drafts_survived": 1}
{"id": "1b140de3-5d59-4251-bbc5-4c331f465b04", "target_id": "B4-control", "git_sha": "73d51f3320afa66d387839113709c69ca0206eb7", "pre_experiment_sha": "45ff1cebbd0df49d5d179466446f12e40c057a74", "timestamp": "2026-04-23T20:58:14.891209+00:00", "hypothesis": "Inline dictionary construction directly within `list_users` comprehensions and remove `User.to_dict` to completely eliminate method call overhead in tight loops.", "hypothesis_source": "agent", "mutation_diff_summary": "", "score": 0.6, "score_ci_lower": null, "score_ci_upper": null, "raw_scores": null, "baseline_score": 0.6, "outcome": "KEPT", "failure_mode": null, "duration_seconds": 99.90887416596524, "tags": ["performance", "list-comprehension", "inline-code", "micro-optimization"], "learnings": "{\"what_changed\":\"\",\"what_improved\":[],\"what_regressed\":[],\"transferable_insight\":\"Micro-optimizations such as inlining method calls within tight loops often yield negligible performance gains, demonstrating that theoretical overhead reduction does not always translate to measurable improvements.\",\"domain_tags\":[\"Performance Optimization\",\"Micro-optimization\",\"Code Refactoring\"]}", "cost_usd": 0.02049375, "bootstrap_seed": 0, "agent_model": "gemini-3.1-pro-preview", "held_out_score": null, "criterion_names": null, "per_criterion_scores": null, "failure_classification": null, "drafts_generated": 1, "drafts_survived": 1}
{"id": "d365a9e0-17fb-4837-8176-916f12d0ffd9", "target_id": "B4-control", "git_sha": "a91eee21f641df23fe9ad290b611932a7df86388", "pre_experiment_sha": "73d51f3320afa66d387839113709c69ca0206eb7", "timestamp": "2026-04-23T21:00:55.541414+00:00", "hypothesis": "Integrate the walrus operator (`:=`) to combine dictionary lookups, type checks, and variable assignments in fast paths, and restructure the `list_users` filter validation to short-circuit on truthiness before evaluating `isinstance`, reducing bytecode overhead.", "hypothesis_source": "agent", "mutation_diff_summary": "", "score": 0.6, "score_ci_lower": null, "score_ci_upper": null, "raw_scores": null, "baseline_score": 0.6, "outcome": "KEPT", "failure_mode": null, "duration_seconds": 134.12716374988668, "tags": ["performance", "walrus-operator", "short-circuit", "micro-optimization"], "learnings": "{\"what_changed\":\"\",\"what_improved\":[],\"what_regressed\":[],\"transferable_insight\":\"Combining variable assignment with conditional evaluation and ordering logical checks to short-circuit on simpler conditions before complex validations can streamline code execution paths.\",\"domain_tags\":[\"Code Optimization\",\"Refactoring\",\"Micro-optimization\"]}", "cost_usd": 0.02060375, "bootstrap_seed": 0, "agent_model": "gemini-3.1-pro-preview", "held_out_score": null, "criterion_names": null, "per_criterion_scores": null, "failure_classification": null, "drafts_generated": 1, "drafts_survived": 1}
{"id": "05bb0c3b-c8f7-4603-8260-2b1fe039e63f", "target_id": "B4-control", "git_sha": "8c01ce7d41e651e7433eb4bd04229d18bb951347", "pre_experiment_sha": "a91eee21f641df23fe9ad290b611932a7df86388", "timestamp": "2026-04-23T21:02:57.200126+00:00", "hypothesis": "Consolidate the `filter` validation logic in `list_users` to eliminate redundant list comprehensions, reducing bytecode size and streamlining the control flow while preserving exact semantics.", "hypothesis_source": "agent", "mutation_diff_summary": "", "score": 0.6, "score_ci_lower": null, "score_ci_upper": null, "raw_scores": null, "baseline_score": 0.6, "outcome": "KEPT", "failure_mode": null, "duration_seconds": 113.41428916691802, "tags": ["performance", "refactoring", "conditionals", "clean-code"], "learnings": "{\"what_changed\":\"\",\"what_improved\":[],\"what_regressed\":[],\"transferable_insight\":\"Eliminating redundant data transformations by consolidating validation logic streamlines control flow and reduces code footprint, even when runtime performance remains unchanged.\",\"domain_tags\":[\"Code Optimization\",\"Refactoring\",\"Maintainability\"]}", "cost_usd": 0.020262500000000003, "bootstrap_seed": 0, "agent_model": "gemini-3.1-pro-preview", "held_out_score": null, "criterion_names": null, "per_criterion_scores": null, "failure_classification": null, "drafts_generated": 1, "drafts_survived": 1}
{"id": "66dd74ed-e616-4f97-aff6-cd118a4197bc", "target_id": "B4-control", "git_sha": "eacc2241c6c931a356b8840075b4a71002345f38", "pre_experiment_sha": "8c01ce7d41e651e7433eb4bd04229d18bb951347", "timestamp": "2026-04-23T21:04:45.774667+00:00", "hypothesis": "Hoist the extraction and validation of the \"name\" filter to the top level of `list_users` to eliminate redundant type checking, string lowercasing, and duplicated list comprehensions across execution branches.", "hypothesis_source": "agent", "mutation_diff_summary": "", "score": 0.6, "score_ci_lower": null, "score_ci_upper": null, "raw_scores": null, "baseline_score": 0.6, "outcome": "KEPT", "failure_mode": null, "duration_seconds": 103.10028620809317, "tags": ["performance", "refactoring", "clean-code", "micro-optimization"], "learnings": "{\"what_changed\":\"\",\"what_improved\":[],\"what_regressed\":[],\"transferable_insight\":\"Centralizing shared data extraction and validation logic before conditional branching eliminates redundant processing and improves maintainability.\",\"domain_tags\":[\"Code Refactoring\",\"Software Engineering\",\"Maintainability\"]}", "cost_usd": 0.020020000000000003, "bootstrap_seed": 0, "agent_model": "gemini-3.1-pro-preview", "held_out_score": null, "criterion_names": null, "per_criterion_scores": null, "failure_classification": null, "drafts_generated": 1, "drafts_survived": 1}
{"id": "0bb06256-4189-4ead-938d-43c7cb328fae", "target_id": "B4-control", "git_sha": "43ae18eb3c26f2650c0feac946fc15edc79fe295", "pre_experiment_sha": "eacc2241c6c931a356b8840075b4a71002345f38", "timestamp": "2026-04-23T21:07:37.291018+00:00", "hypothesis": "Restructure `list_users` filter validation to short-circuit on truthiness before evaluating `isinstance`, and consolidate the logic to eliminate a redundant list comprehension while perfectly preserving semantics.", "hypothesis_source": "agent", "mutation_diff_summary": "", "score": 0.6, "score_ci_lower": null, "score_ci_upper": null, "raw_scores": null, "baseline_score": 0.6, "outcome": "KEPT", "failure_mode": null, "duration_seconds": 147.16104495804757, "tags": ["performance", "short-circuit", "refactoring", "clean-code"], "learnings": "{\"what_changed\":\"\",\"what_improved\":[],\"what_regressed\":[],\"transferable_insight\":\"Refactoring conditional logic to short-circuit early and eliminating redundant iterations improves code structure and maintainability while preserving semantics, even if performance gains are negligible.\",\"domain_tags\":[\"Code Refactoring\",\"Logic Optimization\",\"Maintainability\"]}", "cost_usd": 0.0195525, "bootstrap_seed": 0, "agent_model": "gemini-3.1-pro-preview", "held_out_score": null, "criterion_names": null, "per_criterion_scores": null, "failure_classification": null, "drafts_generated": 1, "drafts_survived": 1}
{"id": "abcf5677-fdcd-48c8-979f-fd680793f180", "target_id": "B4-control", "git_sha": "021bbf6eb30d8057eef4c84dfe3350d3d491dfc1", "pre_experiment_sha": "43ae18eb3c26f2650c0feac946fc15edc79fe295", "timestamp": "2026-04-23T21:08:44.755820+00:00", "hypothesis": "Combine email validation checks into a single boolean expression in `create_user`, `update_user`, and `validate_email` to reduce branching and bytecode overhead.", "hypothesis_source": "agent", "mutation_diff_summary": "", "score": 0.6, "score_ci_lower": null, "score_ci_upper": null, "raw_scores": null, "baseline_score": 0.6, "outcome": "KEPT", "failure_mode": null, "duration_seconds": 59.21225258312188, "tags": ["performance", "short-circuit", "micro-optimization"], "learnings": "{\"what_changed\":\"\",\"what_improved\":[],\"what_regressed\":[],\"transferable_insight\":\"Consolidating multiple conditional checks into a single boolean expression simplifies control flow and reduces branching overhead without negatively impacting overall performance.\",\"domain_tags\":[\"Code Optimization\",\"Refactoring\",\"Software Engineering\"]}", "cost_usd": 0.019076250000000003, "bootstrap_seed": 0, "agent_model": "gemini-3.1-pro-preview", "held_out_score": null, "criterion_names": null, "per_criterion_scores": null, "failure_classification": null, "drafts_generated": 1, "drafts_survived": 1}
{"id": "0759ffa3-e5b5-4ecf-bc06-92035712649b", "target_id": "B4-control", "git_sha": "8f7f3004298c9b5a3fdfd4151a5d866c5ed01c6d", "pre_experiment_sha": "021bbf6eb30d8057eef4c84dfe3350d3d491dfc1", "timestamp": "2026-04-23T21:10:00.624418+00:00", "hypothesis": "Restructure `list_users` to combine `None` and `dict` type checks, eliminating a redundant list comprehension, and add a truthiness check for `data` in `update_user` to avoid unnecessary dictionary lookups when empty.", "hypothesis_source": "agent", "mutation_diff_summary": "", "score": 0.6, "score_ci_lower": null, "score_ci_upper": null, "raw_scores": null, "baseline_score": 0.6, "outcome": "KEPT", "failure_mode": null, "duration_seconds": 70.42829141695984, "tags": ["performance", "refactoring", "clean-code", "micro-optimization"], "learnings": "{\"what_changed\":\"\",\"what_improved\":[],\"what_regressed\":[],\"transferable_insight\":\"Consolidating validation checks and implementing early exits for empty inputs streamlines processing logic and eliminates redundant operations.\",\"domain_tags\":[\"Code Refactoring\",\"Logic Optimization\",\"Software Engineering\"]}", "cost_usd": 0.01918125, "bootstrap_seed": 0, "agent_model": "gemini-3.1-pro-preview", "held_out_score": null, "criterion_names": null, "per_criterion_scores": null, "failure_classification": null, "drafts_generated": 1, "drafts_survived": 1}
{"id": "f954061b-3304-4f70-9ba7-d7a8049af8a6", "target_id": "B4-control", "git_sha": "4813c2cc1ea44a46a70ff03a651a3009ce73a008", "pre_experiment_sha": "8f7f3004298c9b5a3fdfd4151a5d866c5ed01c6d", "timestamp": "2026-04-23T21:11:45.021042+00:00", "hypothesis": "Flatten the `list_users` filter logic by short-circuiting early on empty or `None` filters, reducing nesting and avoiding unnecessary boolean checks, while using the walrus operator in `create_user` to streamline object assignment.", "hypothesis_source": "agent", "mutation_diff_summary": "", "score": 0.6, "score_ci_lower": null, "score_ci_upper": null, "raw_scores": null, "baseline_score": 0.6, "outcome": "KEPT", "failure_mode": null, "duration_seconds": 79.49554487504065, "tags": ["performance", "refactoring", "short-circuit", "clean-code"], "learnings": "{\"what_changed\":\"\",\"what_improved\":[],\"what_regressed\":[],\"transferable_insight\":\"Flattening conditional logic through early returns and inline assignments improves code readability and reduces nesting without negatively impacting performance.\",\"domain_tags\":[\"Code Refactoring\",\"Clean Code\",\"Control Flow\"]}", "cost_usd": 0.0197025, "bootstrap_seed": 0, "agent_model": "gemini-3.1-pro-preview", "held_out_score": null, "criterion_names": null, "per_criterion_scores": null, "failure_classification": null, "drafts_generated": 1, "drafts_survived": 1}
{"id": "21975393-312f-4463-b820-0b1094d2b823", "target_id": "B4-control", "git_sha": "f6eb58daf13484dc7af766d63c1cad0209a2f7d4", "pre_experiment_sha": "4813c2cc1ea44a46a70ff03a651a3009ce73a008", "timestamp": "2026-04-23T21:13:47.221985+00:00", "hypothesis": "Refactor `list_users` to use nested conditionals instead of a separate `has_name` flag to reduce branching overhead, and remove redundant empty string checks in email validation since `split` length validation natively catches them.", "hypothesis_source": "agent", "mutation_diff_summary": "", "score": 0.6, "score_ci_lower": null, "score_ci_upper": null, "raw_scores": null, "baseline_score": 0.6, "outcome": "KEPT", "failure_mode": null, "duration_seconds": 116.9417729577981, "tags": ["performance", "refactoring", "clean-code", "micro-optimization"], "learnings": "{\"what_changed\":\"\",\"what_improved\":[],\"what_regressed\":[],\"transferable_insight\":\"Eliminating explicit validation checks that are inherently handled by the mechanics of subsequent operations simplifies logic without altering system behavior or performance.\",\"domain_tags\":[\"Code Refactoring\",\"Logic Simplification\",\"Validation\"]}", "cost_usd": 0.019540000000000002, "bootstrap_seed": 0, "agent_model": "gemini-3.1-pro-preview", "held_out_score": null, "criterion_names": null, "per_criterion_scores": null, "failure_classification": null, "drafts_generated": 1, "drafts_survived": 1}
