{"id": "3f95b46b-4f3a-4952-b3ca-defb3c39c26d", "target_id": "B4-control", "git_sha": "9f6c03bbd3f42fe410df6b12012982fd72476fed", "pre_experiment_sha": "4f4a259bbb8052004a76ad8b021c9e87b5c3288d", "timestamp": "2026-04-19T16:22:33.492728+00:00", "hypothesis": "Route all endpoint inputs, including identifier validation, through one stricter shared pre-check while preserving accepted responses.", "hypothesis_source": "agent", "mutation_diff_summary": "", "score": 0.7, "score_ci_lower": null, "score_ci_upper": null, "raw_scores": null, "baseline_score": 0.7, "outcome": "KEPT", "failure_mode": null, "duration_seconds": 22.254048291011713, "tags": ["refactor", "validation", "responses", "deterministic"], "learnings": "{\"what_changed\":\"\",\"what_improved\":[],\"what_regressed\":[],\"transferable_insight\":\"Consolidating input handling into a single stricter shared validation step can improve consistency without changing accepted outcomes when the existing behavior is already aligned.\",\"domain_tags\":[\"validation\",\"refactoring\",\"consistency\"]}", "cost_usd": 0.05278, "bootstrap_seed": 0, "agent_model": "gpt-5.4", "held_out_score": null, "criterion_names": null, "per_criterion_scores": null, "failure_classification": null, "drafts_generated": 1, "drafts_survived": 1}
{"id": "b510347f-7a3e-4464-8343-d834a332e80d", "target_id": "B4-control", "git_sha": "7e852630bdac44ac45d6c24a8c0f1cd2309d1f1a", "pre_experiment_sha": "9f6c03bbd3f42fe410df6b12012982fd72476fed", "timestamp": "2026-04-19T16:22:51.730789+00:00", "hypothesis": "Tighten determinism by making list_users use the shared response builder with an explicit status argument while preserving all accepted behavior.", "hypothesis_source": "agent", "mutation_diff_summary": "", "score": 0.7, "score_ci_lower": null, "score_ci_upper": null, "raw_scores": null, "baseline_score": 0.7, "outcome": "KEPT", "failure_mode": null, "duration_seconds": 16.90221079206094, "tags": ["deterministic", "refactor", "responses"], "learnings": "{\"what_changed\":\"\",\"what_improved\":[],\"what_regressed\":[],\"transferable_insight\":\"When refactoring for determinism, centralizing output construction behind a shared helper with explicit parameters can preserve behavior while reducing hidden variation.\",\"domain_tags\":[\"software-engineering\",\"refactoring\",\"determinism\"]}", "cost_usd": 0.05309, "bootstrap_seed": 0, "agent_model": "gpt-5.4", "held_out_score": null, "criterion_names": null, "per_criterion_scores": null, "failure_classification": null, "drafts_generated": 1, "drafts_survived": 1}
{"id": "02697253-a55b-420f-8252-0c315a8312c0", "target_id": "B4-control", "git_sha": "d9ef3826b25ef7016bc3b88ce4e0edccd42c75d7", "pre_experiment_sha": "7e852630bdac44ac45d6c24a8c0f1cd2309d1f1a", "timestamp": "2026-04-19T16:23:14.199757+00:00", "hypothesis": "Simplify response construction to one explicit shared serializer while keeping the single strict invalid-input path unchanged.", "hypothesis_source": "agent", "mutation_diff_summary": "", "score": 0.7, "score_ci_lower": null, "score_ci_upper": null, "raw_scores": null, "baseline_score": 0.7, "outcome": "KEPT", "failure_mode": null, "duration_seconds": 18.911651500035077, "tags": ["refactor", "deterministic", "responses"], "learnings": "{\"what_changed\":\"\",\"what_improved\":[],\"what_regressed\":[],\"transferable_insight\":\"When multiple code paths produce the same kind of output, consolidating them into one explicit shared formatter can reduce complexity without changing the behavior of the validated error path.\",\"domain_tags\":[\"software-engineering\",\"refactoring\",\"reliability\"]}", "cost_usd": 0.053360000000000005, "bootstrap_seed": 0, "agent_model": "gpt-5.4", "held_out_score": null, "criterion_names": null, "per_criterion_scores": null, "failure_classification": null, "drafts_generated": 1, "drafts_survived": 1}
{"id": "8130b319-6554-45b1-b07e-67b3eeb06f1c", "target_id": "B4-control", "git_sha": "d44b42b0eec7e69d1e72ba3b1d98817abaf82109", "pre_experiment_sha": "d9ef3826b25ef7016bc3b88ce4e0edccd42c75d7", "timestamp": "2026-04-19T16:23:32.936171+00:00", "hypothesis": "Replace the dynamic response-builder dispatch with one explicit shared builder path to reduce non-deterministic structure while preserving behavior.", "hypothesis_source": "agent", "mutation_diff_summary": "", "score": 0.7, "score_ci_lower": null, "score_ci_upper": null, "raw_scores": null, "baseline_score": 0.7, "outcome": "KEPT", "failure_mode": null, "duration_seconds": 17.395923499949276, "tags": ["deterministic", "refactor", "responses"], "learnings": "{\"what_changed\":\"\",\"what_improved\":[],\"what_regressed\":[],\"transferable_insight\":\"When multiple implementation paths produce equivalent results, consolidating them into one explicit shared path can improve determinism without changing behavior.\",\"domain_tags\":[\"software-engineering\",\"reliability\",\"refactoring\"]}", "cost_usd": 0.053045, "bootstrap_seed": 0, "agent_model": "gpt-5.4", "held_out_score": null, "criterion_names": null, "per_criterion_scores": null, "failure_classification": null, "drafts_generated": 1, "drafts_survived": 1}
{"id": "6af660d1-5a25-4c75-b3a2-cfeec237bf03", "target_id": "B4-control", "git_sha": "71fb8ab64338dfad29288d760d585ff7bd365f21", "pre_experiment_sha": "d44b42b0eec7e69d1e72ba3b1d98817abaf82109", "timestamp": "2026-04-19T16:23:51.092068+00:00", "hypothesis": "Replace dynamic response dispatch with one explicit shared response builder while keeping the single shared invalid-input path unchanged.", "hypothesis_source": "agent", "mutation_diff_summary": "", "score": 0.7, "score_ci_lower": null, "score_ci_upper": null, "raw_scores": null, "baseline_score": 0.7, "outcome": "KEPT", "failure_mode": null, "duration_seconds": 17.068870041985065, "tags": ["deterministic", "refactor", "responses"], "learnings": "{\"what_changed\":\"\",\"what_improved\":[],\"what_regressed\":[],\"transferable_insight\":\"Consolidating multiple response-generation paths into one explicit shared builder can preserve behavior while simplifying control flow, especially when the error-handling path remains unchanged.\",\"domain_tags\":[\"software-engineering\",\"refactoring\",\"control-flow\"]}", "cost_usd": 0.052735000000000004, "bootstrap_seed": 0, "agent_model": "gpt-5.4", "held_out_score": null, "criterion_names": null, "per_criterion_scores": null, "failure_classification": null, "drafts_generated": 1, "drafts_survived": 1}
{"id": "0cab9ede-45d7-44ce-abc7-4e31c3eff4aa", "target_id": "B4-control", "git_sha": "778263717fdd58a685390a4178a6da5a1083cbd4", "pre_experiment_sha": "71fb8ab64338dfad29288d760d585ff7bd365f21", "timestamp": "2026-04-19T16:24:12.543199+00:00", "hypothesis": "Make the shared response builder fully explicit and single-path while keeping all endpoints routed through the existing strict pre-check.", "hypothesis_source": "agent", "mutation_diff_summary": "", "score": 0.7, "score_ci_lower": null, "score_ci_upper": null, "raw_scores": null, "baseline_score": 0.7, "outcome": "KEPT", "failure_mode": null, "duration_seconds": 17.39328000007663, "tags": ["deterministic", "refactor", "responses", "validation"], "learnings": "{\"what_changed\":\"\",\"what_improved\":[],\"what_regressed\":[],\"transferable_insight\":\"When a system already has a strict gatekeeper, making the downstream construction path explicit and singular can preserve behavior while improving clarity and maintainability.\",\"domain_tags\":[\"software-engineering\",\"architecture\",\"reliability\"]}", "cost_usd": 0.05298, "bootstrap_seed": 0, "agent_model": "gpt-5.4", "held_out_score": null, "criterion_names": null, "per_criterion_scores": null, "failure_classification": null, "drafts_generated": 1, "drafts_survived": 1}
{"id": "f86e97d2-36fa-41f4-8121-2f76ae6685c6", "target_id": "B4-control", "git_sha": "49879fac7edd7338705332d7bb4f01a1d7947bb9", "pre_experiment_sha": "778263717fdd58a685390a4178a6da5a1083cbd4", "timestamp": "2026-04-19T16:24:31.498296+00:00", "hypothesis": "Route every endpoint through one multi-part shared pre-check so all invalid inputs are rejected identically before endpoint-specific logic.", "hypothesis_source": "agent", "mutation_diff_summary": "", "score": 0.7, "score_ci_lower": null, "score_ci_upper": null, "raw_scores": null, "baseline_score": 0.7, "outcome": "KEPT", "failure_mode": null, "duration_seconds": 17.644278875086457, "tags": ["deterministic", "validation", "refactor"], "learnings": "{\"what_changed\":\"\",\"what_improved\":[],\"what_regressed\":[],\"transferable_insight\":\"Standardizing a shared validation gate before specialized processing can make failure handling more consistent without changing outcomes.\",\"domain_tags\":[\"validation\",\"architecture\",\"reliability\"]}", "cost_usd": 0.054020000000000006, "bootstrap_seed": 0, "agent_model": "gpt-5.4", "held_out_score": null, "criterion_names": null, "per_criterion_scores": null, "failure_classification": null, "drafts_generated": 1, "drafts_survived": 1}
{"id": "8ca529a3-d692-4d46-9fee-b737a087735c", "target_id": "B4-control", "git_sha": "53e995de1235737704b311c4527c67fe1381648d", "pre_experiment_sha": "49879fac7edd7338705332d7bb4f01a1d7947bb9", "timestamp": "2026-04-19T16:24:51.321783+00:00", "hypothesis": "Make the shared validator and response builder fully explicit with fixed branch order while preserving all accepted behaviors.", "hypothesis_source": "agent", "mutation_diff_summary": "", "score": 0.7, "score_ci_lower": null, "score_ci_upper": null, "raw_scores": null, "baseline_score": 0.7, "outcome": "KEPT", "failure_mode": null, "duration_seconds": 18.204999499954283, "tags": ["deterministic", "validation", "responses", "refactor"], "learnings": "{\"what_changed\":\"\",\"what_improved\":[],\"what_regressed\":[],\"transferable_insight\":\"Making shared decision logic explicit and ordered can preserve existing behavior while improving clarity and maintainability without changing outcomes.\",\"domain_tags\":[\"software-engineering\",\"code-maintenance\",\"refactoring\"]}", "cost_usd": 0.055885000000000004, "bootstrap_seed": 0, "agent_model": "gpt-5.4", "held_out_score": null, "criterion_names": null, "per_criterion_scores": null, "failure_classification": null, "drafts_generated": 1, "drafts_survived": 1}
{"id": "fa5cce27-eff1-486e-ad6b-37435d3619c8", "target_id": "B4-control", "git_sha": "2a22db78833e608aa1dff061ef1bc9b929360fb9", "pre_experiment_sha": "53e995de1235737704b311c4527c67fe1381648d", "timestamp": "2026-04-19T16:25:14.788121+00:00", "hypothesis": "Replace the kind-switched response builder with explicit shared success and error helpers so every endpoint uses one fixed serialization path.", "hypothesis_source": "agent", "mutation_diff_summary": "", "score": 0.7, "score_ci_lower": null, "score_ci_upper": null, "raw_scores": null, "baseline_score": 0.7, "outcome": "KEPT", "failure_mode": null, "duration_seconds": 18.88177754089702, "tags": ["deterministic", "validation", "responses", "refactor"], "learnings": "{\"what_changed\":\"\",\"what_improved\":[],\"what_regressed\":[],\"transferable_insight\":\"Using a single shared serialization path for all outcomes reduces branching and makes behavior more consistent across endpoints.\",\"domain_tags\":[\"software engineering\",\"API design\",\"code maintainability\"]}", "cost_usd": 0.055035, "bootstrap_seed": 0, "agent_model": "gpt-5.4", "held_out_score": null, "criterion_names": null, "per_criterion_scores": null, "failure_classification": null, "drafts_generated": 1, "drafts_survived": 1}
{"id": "49d1d2ba-e061-4ef6-aec6-c5d4da317731", "target_id": "B4-control", "git_sha": "5f6bba50d8278d5df1810afb2bc21e73e97663a4", "pre_experiment_sha": "2a22db78833e608aa1dff061ef1bc9b929360fb9", "timestamp": "2026-04-19T16:25:33.775877+00:00", "hypothesis": "Unify all endpoint entry through one shared executor so strict precheck and shared response builders are the only paths used everywhere.", "hypothesis_source": "agent", "mutation_diff_summary": "", "score": 0.7, "score_ci_lower": null, "score_ci_upper": null, "raw_scores": null, "baseline_score": 0.7, "outcome": "KEPT", "failure_mode": null, "duration_seconds": 17.974876542109996, "tags": ["deterministic", "validation", "responses", "control-flow"], "learnings": "{\"what_changed\":\"\",\"what_improved\":[],\"what_regressed\":[],\"transferable_insight\":\"Centralizing entry points through a single shared execution path can improve consistency and enforce uniform validation and response handling across a system.\",\"domain_tags\":[\"software_architecture\",\"process_design\",\"reliability\"]}", "cost_usd": 0.05437, "bootstrap_seed": 0, "agent_model": "gpt-5.4", "held_out_score": null, "criterion_names": null, "per_criterion_scores": null, "failure_classification": null, "drafts_generated": 1, "drafts_survived": 1}
{"id": "665575a9-bb08-49f6-8ae7-4cdfa9350f15", "target_id": "B4-control", "git_sha": "6ab6b56c05ef1a68984fcb5ebfd42092fc52f41d", "pre_experiment_sha": "5f6bba50d8278d5df1810afb2bc21e73e97663a4", "timestamp": "2026-04-19T16:25:54.637618+00:00", "hypothesis": "Make the shared pre-check and response helpers the only explicit endpoint path by routing all endpoint logic through one fixed action executor.", "hypothesis_source": "agent", "mutation_diff_summary": "", "score": 0.7, "score_ci_lower": null, "score_ci_upper": null, "raw_scores": null, "baseline_score": 0.7, "outcome": "KEPT", "failure_mode": null, "duration_seconds": 19.671983125037514, "tags": ["deterministic", "validation", "responses", "control-flow"], "learnings": "{\"what_changed\":\"\",\"what_improved\":[],\"what_regressed\":[],\"transferable_insight\":\"Centralizing repeated validation and response handling behind a single execution path can simplify control flow without changing behavior, making the system easier to maintain and reason about.\",\"domain_tags\":[\"software_architecture\",\"code_organization\",\"maintainability\"]}", "cost_usd": 0.055130000000000005, "bootstrap_seed": 0, "agent_model": "gpt-5.4", "held_out_score": null, "criterion_names": null, "per_criterion_scores": null, "failure_classification": null, "drafts_generated": 1, "drafts_survived": 1}
{"id": "7d120c83-8511-43b1-9c7d-7dde7f9bd992", "target_id": "B4-control", "git_sha": "785d2c8fa26f43d4b17098770d76810e3a0c1353", "pre_experiment_sha": "6ab6b56c05ef1a68984fcb5ebfd42092fc52f41d", "timestamp": "2026-04-19T16:26:16.320242+00:00", "hypothesis": "Make success response construction fully explicit per shape so every endpoint returns through one deterministic shared response path with fixed ordering.", "hypothesis_source": "agent", "mutation_diff_summary": "", "score": 0.7, "score_ci_lower": null, "score_ci_upper": null, "raw_scores": null, "baseline_score": 0.7, "outcome": "KEPT", "failure_mode": null, "duration_seconds": 17.20835624996107, "tags": ["deterministic", "responses", "validation", "control-flow"], "learnings": "{\"what_changed\":\"\",\"what_improved\":[],\"what_regressed\":[],\"transferable_insight\":\"When multiple variants must behave consistently, making the construction path explicit and uniform for each variant reduces ambiguity and ensures deterministic outcomes.\",\"domain_tags\":[\"software-engineering\",\"system-design\",\"reliability\"]}", "cost_usd": 0.054720000000000005, "bootstrap_seed": 0, "agent_model": "gpt-5.4", "held_out_score": null, "criterion_names": null, "per_criterion_scores": null, "failure_classification": null, "drafts_generated": 1, "drafts_survived": 1}
{"id": "bfdaf812-1792-4264-b8a0-c7cca2614b79", "target_id": "B4-control", "git_sha": "fc67198122f88e8fad81de9d8d3dada87da4b2d9", "pre_experiment_sha": "785d2c8fa26f43d4b17098770d76810e3a0c1353", "timestamp": "2026-04-19T16:26:35.596155+00:00", "hypothesis": "Replace the remaining endpoint-specific success builders with one shared success-response helper while preserving valid outputs exactly.", "hypothesis_source": "agent", "mutation_diff_summary": "", "score": 0.7, "score_ci_lower": null, "score_ci_upper": null, "raw_scores": null, "baseline_score": 0.7, "outcome": "KEPT", "failure_mode": null, "duration_seconds": 17.523428290965967, "tags": ["deterministic", "validation", "responses", "control-flow"], "learnings": "{\"what_changed\":\"\",\"what_improved\":[],\"what_regressed\":[],\"transferable_insight\":\"Consolidating duplicated success-path logic into one shared helper can preserve behavior exactly while reducing maintenance surface, provided the helper reproduces each caller\u2019s output contract without alteration.\",\"domain_tags\":[\"software-engineering\",\"refactoring\",\"code-maintenance\"]}", "cost_usd": 0.055475000000000003, "bootstrap_seed": 0, "agent_model": "gpt-5.4", "held_out_score": null, "criterion_names": null, "per_criterion_scores": null, "failure_classification": null, "drafts_generated": 1, "drafts_survived": 1}
{"id": "35ef2171-679b-4f1a-93e6-3dcb8198d7bd", "target_id": "B4-control", "git_sha": "45cd48298dc01c2aeade62d183b164425006b7fb", "pre_experiment_sha": "fc67198122f88e8fad81de9d8d3dada87da4b2d9", "timestamp": "2026-04-19T16:27:00.560082+00:00", "hypothesis": "Make the shared pre-check return canonical validated payloads so all handlers consume one uniform validated shape and response path.", "hypothesis_source": "agent", "mutation_diff_summary": "", "score": 0.7, "score_ci_lower": null, "score_ci_upper": null, "raw_scores": null, "baseline_score": 0.7, "outcome": "KEPT", "failure_mode": null, "duration_seconds": 23.60339004197158, "tags": ["deterministic", "validation", "responses", "canonicalization"], "learnings": "{\"what_changed\":\"\",\"what_improved\":[],\"what_regressed\":[],\"transferable_insight\":\"Standardizing inputs into a single validated canonical shape before branching work reduces downstream complexity and keeps handling paths consistent.\",\"domain_tags\":[\"software-engineering\",\"validation\",\"architecture\"]}", "cost_usd": 0.060465000000000005, "bootstrap_seed": 0, "agent_model": "gpt-5.4", "held_out_score": null, "criterion_names": null, "per_criterion_scores": null, "failure_classification": null, "drafts_generated": 1, "drafts_survived": 1}
{"id": "cf5dcd83-99c0-4e1f-8ea0-71edae514fba", "target_id": "B4-control", "git_sha": "7ab0750d51ded3f1578f4b19e805c2326c172884", "pre_experiment_sha": "45cd48298dc01c2aeade62d183b164425006b7fb", "timestamp": "2026-04-19T16:27:27.422768+00:00", "hypothesis": "Make invalid-part handling explicit in the shared pre-check with a single sentinel so all payload variants deterministically use one rejection path.", "hypothesis_source": "agent", "mutation_diff_summary": "", "score": 0.7, "score_ci_lower": null, "score_ci_upper": null, "raw_scores": null, "baseline_score": 0.7, "outcome": "KEPT", "failure_mode": null, "duration_seconds": 22.30753720900975, "tags": ["deterministic", "validation", "control-flow", "canonicalization"], "learnings": "{\"what_changed\":\"\",\"what_improved\":[],\"what_regressed\":[],\"transferable_insight\":\"When multiple input variants share validation logic, using one explicit sentinel for invalid cases creates a single deterministic rejection path and reduces ambiguity in downstream handling.\",\"domain_tags\":[\"validation\",\"error-handling\",\"control-flow\"]}", "cost_usd": 0.06191500000000001, "bootstrap_seed": 0, "agent_model": "gpt-5.4", "held_out_score": null, "criterion_names": null, "per_criterion_scores": null, "failure_classification": null, "drafts_generated": 1, "drafts_survived": 1}
{"id": "1ed16146-2b0d-4981-ab8e-ab4f2fb1b0c8", "target_id": "B4-control", "git_sha": "674dfddaf5703b71bb83d4457444aa7a1aedae6c", "pre_experiment_sha": "7ab0750d51ded3f1578f4b19e805c2326c172884", "timestamp": "2026-04-19T16:27:49.601625+00:00", "hypothesis": "Tighten the shared pre-check to reject malformed action/part shapes through the single invalid-response path before any action logic.", "hypothesis_source": "agent", "mutation_diff_summary": "", "score": 0.7, "score_ci_lower": null, "score_ci_upper": null, "raw_scores": null, "baseline_score": 0.7, "outcome": "KEPT", "failure_mode": null, "duration_seconds": 21.168145459028892, "tags": ["deterministic", "validation", "control-flow", "precheck"], "learnings": "{\"what_changed\":\"\",\"what_improved\":[],\"what_regressed\":[],\"transferable_insight\":\"Validate shared input structure as early as possible and route all malformed cases through one consistent failure path before executing any downstream logic.\",\"domain_tags\":[\"validation\",\"error-handling\",\"input-sanitization\"]}", "cost_usd": 0.06346500000000001, "bootstrap_seed": 0, "agent_model": "gpt-5.4", "held_out_score": null, "criterion_names": null, "per_criterion_scores": null, "failure_classification": null, "drafts_generated": 1, "drafts_survived": 1}
