{"id": "c6bef7fb-70a6-43f6-84d6-57c70efff373", "target_id": "B4-control", "git_sha": "4f5c10d2464bb657f77e7c87096edb5cae9f01f4", "pre_experiment_sha": "3b452d4d4a3bc0f302632065ef61cb2ba6a6552a", "timestamp": "2026-04-19T16:13:21.946936+00:00", "hypothesis": "Improve determinism and endpoint robustness by using stable timestamps, explicit validation, and consistent serialization.", "hypothesis_source": "agent", "mutation_diff_summary": "", "score": 0.66, "score_ci_lower": null, "score_ci_upper": null, "raw_scores": null, "baseline_score": 0.435, "outcome": "KEPT", "failure_mode": null, "duration_seconds": 12.821513042086735, "tags": ["determinism", "validation", "error-handling", "consistency"], "learnings": "{\"what_changed\":\"\",\"what_improved\":[],\"what_regressed\":[],\"transferable_insight\":\"Systems become more reliable and reproducible when they use stable time references, validate inputs explicitly, and serialize data consistently.\",\"domain_tags\":[\"reliability\",\"determinism\",\"validation\"]}", "cost_usd": 0.028725, "bootstrap_seed": 0, "agent_model": "gpt-5.4", "held_out_score": null, "criterion_names": null, "per_criterion_scores": null, "failure_classification": null, "drafts_generated": 1, "drafts_survived": 1}
{"id": "e9cca826-e7b8-45e9-9619-6c37199438e1", "target_id": "B4-control", "git_sha": "70fdc7faad9657181a6e429b2b1780fe53696688", "pre_experiment_sha": "4f5c10d2464bb657f77e7c87096edb5cae9f01f4", "timestamp": "2026-04-19T16:13:36.131434+00:00", "hypothesis": "Tightening input validation and making error responses/status codes consistent will improve deterministic behavior.", "hypothesis_source": "agent", "mutation_diff_summary": "", "score": 0.7, "score_ci_lower": null, "score_ci_upper": null, "raw_scores": null, "baseline_score": 0.66, "outcome": "KEPT", "failure_mode": null, "duration_seconds": 13.017397208022885, "tags": ["validation", "determinism", "error-handling", "consistency"], "learnings": "{\"what_changed\":\"\",\"what_improved\":[],\"what_regressed\":[],\"transferable_insight\":\"Consistent validation and standardized error handling reduce ambiguity and make system behavior more predictable and reliable.\",\"domain_tags\":[\"software engineering\",\"reliability\",\"quality assurance\"]}", "cost_usd": 0.029185000000000003, "bootstrap_seed": 0, "agent_model": "gpt-5.4", "held_out_score": null, "criterion_names": null, "per_criterion_scores": null, "failure_classification": null, "drafts_generated": 1, "drafts_survived": 1}
{"id": "7953a4e4-4f3c-4b13-8e35-2ca37815be2a", "target_id": "B4-control", "git_sha": "70fdc7faad9657181a6e429b2b1780fe53696688", "pre_experiment_sha": "70fdc7faad9657181a6e429b2b1780fe53696688", "timestamp": "2026-04-19T16:13:49.873643+00:00", "hypothesis": "Make user IDs robustly deterministic by normalizing integer-like IDs and tightening input validation consistency.", "hypothesis_source": "agent", "mutation_diff_summary": "", "score": 0.7, "score_ci_lower": null, "score_ci_upper": null, "raw_scores": null, "baseline_score": 0.7, "outcome": "DISCARDED", "failure_mode": null, "duration_seconds": 12.436460333061405, "tags": ["determinism", "validation", "normalization"], "learnings": "{\"what_changed\":\"\",\"what_improved\":[],\"what_regressed\":[],\"transferable_insight\":\"When a change adds normalization or stricter validation, it should be paired with clear compatibility checks and measurable acceptance criteria, because consistency improvements can be neutralized if they do not alter outcomes in practice.\",\"domain_tags\":[\"validation\",\"normalization\",\"quality-assurance\"]}", "cost_usd": 0.031443200000000004, "bootstrap_seed": 0, "agent_model": "gpt-5.4", "held_out_score": null, "criterion_names": null, "per_criterion_scores": null, "failure_classification": {"category": "logic_error", "description": "Failure mode is unspecified/unknown, so the observed issue cannot be mapped to a specific failure category from the provided options.", "fix_direction": "Reproduce the failed experiment with logging to capture the exact failing behavior (format, schema, logic, parse errors, semantic mismatch, regression, or inconsistent state) and compare against the expected output/criteria to determine the correct category.", "confidence": 0.12}, "drafts_generated": 1, "drafts_survived": 1}
{"id": "56a9081d-a688-4ec2-bf7a-87b8c4993856", "target_id": "B4-control", "git_sha": "70fdc7faad9657181a6e429b2b1780fe53696688", "pre_experiment_sha": "70fdc7faad9657181a6e429b2b1780fe53696688", "timestamp": "2026-04-19T16:14:08.823462+00:00", "hypothesis": "Make validation and response formatting fully consistent while preserving stable ordering and fixed serialization across all endpoints.", "hypothesis_source": "agent", "mutation_diff_summary": "", "score": 0.7, "score_ci_lower": null, "score_ci_upper": null, "raw_scores": null, "baseline_score": 0.7, "outcome": "DISCARDED", "failure_mode": null, "duration_seconds": 14.084476292016916, "tags": ["deterministic", "validation", "serialization", "consistency"], "learnings": "{\"what_changed\":\"\",\"what_improved\":[],\"what_regressed\":[],\"transferable_insight\":\"Consistency in validation and output formatting only adds value when it measurably improves correctness or usability without disrupting established ordering or serialization guarantees.\",\"domain_tags\":[\"process-design\",\"quality-assurance\",\"systems-engineering\"]}", "cost_usd": 0.03209360000000001, "bootstrap_seed": 0, "agent_model": "gpt-5.4", "held_out_score": null, "criterion_names": null, "per_criterion_scores": null, "failure_classification": {"category": "output_format", "description": "The experiment did not achieve the intended 'fully consistent validation and response formatting' and failed due to an unspecified issue, most likely resulting in a response structure/schema inconsistency across endpoints.", "fix_direction": "Enforce a single shared response schema/validator across all endpoints, add contract tests to verify field presence/types/order, and ensure serialization is identical in all code paths.", "confidence": 0.62}, "drafts_generated": 1, "drafts_survived": 1}
{"id": "0ac7bb4b-bac8-40a4-bdc5-b3b5d7daf78d", "target_id": "B4-control", "git_sha": "70fdc7faad9657181a6e429b2b1780fe53696688", "pre_experiment_sha": "70fdc7faad9657181a6e429b2b1780fe53696688", "timestamp": "2026-04-19T16:14:26.782167+00:00", "hypothesis": "Make validation and response formatting fully consistent, including deterministic handling of unsupported fields and invalid user IDs.", "hypothesis_source": "agent", "mutation_diff_summary": "", "score": 0.7, "score_ci_lower": null, "score_ci_upper": null, "raw_scores": null, "baseline_score": 0.7, "outcome": "DISCARDED", "failure_mode": null, "duration_seconds": 15.242496749968268, "tags": ["determinism", "validation", "serialization", "error-handling"], "learnings": "{\"what_changed\":\"\",\"what_improved\":[],\"what_regressed\":[],\"transferable_insight\":\"Consistency in validation and output formatting only adds value when it changes behavior or reliability; otherwise, standardization efforts can be neutral and should be prioritized by impact.\",\"domain_tags\":[\"validation\",\"formatting\",\"reliability\"]}", "cost_usd": 0.03486820000000001, "bootstrap_seed": 0, "agent_model": "gpt-5.4", "held_out_score": null, "criterion_names": null, "per_criterion_scores": null, "failure_classification": {"category": "logic_error", "description": "The attempt did not achieve the intended consistent validation/response formatting for unsupported fields and invalid user IDs; the failure mode was not specific but indicates incorrect handling/behavior rather than a structural output issue.", "fix_direction": "Ensure validation and formatting logic is deterministic for all edge cases (unsupported fields, invalid user IDs), and add unit/integration tests that assert exact expected responses for each invalid input scenario.", "confidence": 0.62}, "drafts_generated": 1, "drafts_survived": 1}
{"id": "c128992f-0cd9-4819-9682-61853dcf259f", "target_id": "B4-control", "git_sha": "70fdc7faad9657181a6e429b2b1780fe53696688", "pre_experiment_sha": "70fdc7faad9657181a6e429b2b1780fe53696688", "timestamp": "2026-04-19T16:14:44.514055+00:00", "hypothesis": "Make validation and response formatting fully explicit and consistent while preserving deterministic ordering and serialization.", "hypothesis_source": "agent", "mutation_diff_summary": "", "score": 0.7, "score_ci_lower": null, "score_ci_upper": null, "raw_scores": null, "baseline_score": 0.7, "outcome": "DISCARDED", "failure_mode": null, "duration_seconds": 14.638294958975166, "tags": ["deterministic", "validation", "serialization", "consistency"], "learnings": "{\"what_changed\":\"\",\"what_improved\":[],\"what_regressed\":[],\"transferable_insight\":\"Making validation and output formatting explicit and consistent can improve reliability only when it changes behavior or reduces ambiguity; otherwise, it may have no measurable effect.\",\"domain_tags\":[\"process-design\",\"reliability\",\"serialization\"]}", "cost_usd": 0.0320604, "bootstrap_seed": 0, "agent_model": "gpt-5.4", "held_out_score": null, "criterion_names": null, "per_criterion_scores": null, "failure_classification": {"category": "incomplete_edit", "description": "The experiment appears to have partially implemented the requested explicit/consistent validation and formatting changes but did not fully resolve the expected behavior; the result is an unresolved/unknown failure mode with a moderate score, suggesting an inconsistent or partially applied update rather than a fully correct end-to-end implementation.", "fix_direction": "Ensure all validation rules and response formatting are implemented consistently across every code path, with deterministic ordering/serialization verified by tests (including edge cases) and no leftover partial logic.", "confidence": 0.62}, "drafts_generated": 1, "drafts_survived": 1}
{"id": "dee15072-6efe-4ddc-b4ab-71dd000bd266", "target_id": "B4-control", "git_sha": "70fdc7faad9657181a6e429b2b1780fe53696688", "pre_experiment_sha": "70fdc7faad9657181a6e429b2b1780fe53696688", "timestamp": "2026-04-19T16:15:02.574464+00:00", "hypothesis": "Make validation and error responses use one deterministic path with explicit key checks and stable filter handling.", "hypothesis_source": "agent", "mutation_diff_summary": "", "score": 0.7, "score_ci_lower": null, "score_ci_upper": null, "raw_scores": null, "baseline_score": 0.7, "outcome": "DISCARDED", "failure_mode": null, "duration_seconds": 13.123808040982112, "tags": ["validation", "deterministic", "serialization", "consistency"], "learnings": "{\"what_changed\":\"\",\"what_improved\":[],\"what_regressed\":[],\"transferable_insight\":\"When a change adds no measurable improvement, prefer the simplest deterministic implementation path with explicit checks and stable handling to reduce unnecessary complexity.\",\"domain_tags\":[\"software-engineering\",\"validation\",\"reliability\"]}", "cost_usd": 0.033576, "bootstrap_seed": 0, "agent_model": "gpt-5.4", "held_out_score": null, "criterion_names": null, "per_criterion_scores": null, "failure_classification": {"category": "incomplete_edit", "description": "The failed experiment does not clearly achieve the intended deterministic validation/error handling; it appears to be only partially applied, leaving inconsistent or unspecified behavior (indicated by the 'unknown' failure mode and moderate score).", "fix_direction": "Ensure a single deterministic validation path by adding explicit key existence/type checks and stabilizing filter handling (e.g., consistent defaults, explicit branch ordering, and complete error response coverage for all missing/invalid keys).", "confidence": 0.46}, "drafts_generated": 1, "drafts_survived": 1}
{"id": "512f68b8-43e7-4376-9247-79653537689c", "target_id": "B4-control", "git_sha": "70fdc7faad9657181a6e429b2b1780fe53696688", "pre_experiment_sha": "70fdc7faad9657181a6e429b2b1780fe53696688", "timestamp": "2026-04-19T16:15:17.742789+00:00", "hypothesis": "Unify validation and response construction so all endpoints reject invalid IDs and payloads consistently with stable shapes.", "hypothesis_source": "agent", "mutation_diff_summary": "", "score": 0.7, "score_ci_lower": null, "score_ci_upper": null, "raw_scores": null, "baseline_score": 0.7, "outcome": "DISCARDED", "failure_mode": null, "duration_seconds": 12.212822875007987, "tags": ["validation", "determinism", "serialization", "consistency"], "learnings": "{\"what_changed\":\"\",\"what_improved\":[],\"what_regressed\":[],\"transferable_insight\":\"Standardizing validation and output construction across interfaces reduces inconsistency risk, but only if the change is implemented in a way that preserves existing behavior and measurable value.\",\"domain_tags\":[\"software-engineering\",\"api-design\",\"quality-assurance\"]}", "cost_usd": 0.03237, "bootstrap_seed": 0, "agent_model": "gpt-5.4", "held_out_score": null, "criterion_names": null, "per_criterion_scores": null, "failure_classification": {"category": "logic_error", "description": "The provided report does not specify any concrete failure symptoms (e.g., schema/shape mismatch, logic error, regression, scope change, syntax failure, or semantic meaning drift). With only 'Failure Mode: unknown' and a score, the failure cannot be reliably mapped to the available categories.", "fix_direction": "Capture and compare expected vs actual responses (status codes, error payload shape, and validation behavior) across endpoints, then trace whether the issue is formatting/shape, semantics, regressions, or incomplete/cross-cutting edits.", "confidence": 0.12}, "drafts_generated": 1, "drafts_survived": 1}
{"id": "57f393d9-9e65-4a65-9b43-a5f26f8762f1", "target_id": "B4-control", "git_sha": "70fdc7faad9657181a6e429b2b1780fe53696688", "pre_experiment_sha": "70fdc7faad9657181a6e429b2b1780fe53696688", "timestamp": "2026-04-19T16:15:32.883004+00:00", "hypothesis": "Standardize validation and response construction with deterministic field/order handling across all endpoints.", "hypothesis_source": "agent", "mutation_diff_summary": "", "score": 0.7, "score_ci_lower": null, "score_ci_upper": null, "raw_scores": null, "baseline_score": 0.7, "outcome": "DISCARDED", "failure_mode": null, "duration_seconds": 12.48185849993024, "tags": ["validation", "deterministic-serialization", "error-consistency", "minimal-change"], "learnings": "{\"what_changed\":\"\",\"what_improved\":[],\"what_regressed\":[],\"transferable_insight\":\"When a change only standardizes internal formatting or ordering without altering behavior, it may add consistency but still produce no measurable outcome.\",\"domain_tags\":[\"process-improvement\",\"software-engineering\",\"quality-assurance\"]}", "cost_usd": 0.0322858, "bootstrap_seed": 0, "agent_model": "gpt-5.4", "held_out_score": null, "criterion_names": null, "per_criterion_scores": null, "failure_classification": {"category": "incomplete_edit", "description": "The experiment did not achieve the intended deterministic field/order handling across endpoints, leaving validation/response construction inconsistent and causing a failure without a clearly attributable single output-format or logic issue.", "fix_direction": "Ensure all endpoints consistently apply the same deterministic field ordering, schema validation rules, and response construction utilities; add end-to-end tests covering multiple endpoints/field permutations to verify identical serialized output.", "confidence": 0.42}, "drafts_generated": 1, "drafts_survived": 1}
{"id": "546d155e-3dc8-40ce-a829-91df73f662a0", "target_id": "B4-control", "git_sha": "70fdc7faad9657181a6e429b2b1780fe53696688", "pre_experiment_sha": "70fdc7faad9657181a6e429b2b1780fe53696688", "timestamp": "2026-04-19T16:15:50.910822+00:00", "hypothesis": "Unify validation and error responses with deterministic payload shapes and explicit unsupported-field rejection.", "hypothesis_source": "agent", "mutation_diff_summary": "", "score": 0.7, "score_ci_lower": null, "score_ci_upper": null, "raw_scores": null, "baseline_score": 0.7, "outcome": "DISCARDED", "failure_mode": null, "duration_seconds": 12.707059125066735, "tags": ["validation", "serialization", "error-handling", "deterministic"], "learnings": "{\"what_changed\":\"\",\"what_improved\":[],\"what_regressed\":[],\"transferable_insight\":\"Standardizing response shapes and explicitly rejecting unsupported inputs can improve predictability, but only if the change is aligned with real usage and measurable benefits.\",\"domain_tags\":[\"software-engineering\",\"api-design\",\"validation\"]}", "cost_usd": 0.031931400000000006, "bootstrap_seed": 0, "agent_model": "gpt-5.4", "held_out_score": null, "criterion_names": null, "per_criterion_scores": null, "failure_classification": {"category": "output_format", "description": "The experiment failed because the response did not follow the required deterministic/consistent payload shape for validation vs error cases, leading to an output structure or schema mismatch.", "fix_direction": "Ensure all success/validation/error responses use the exact same deterministic payload schema; explicitly reject unsupported fields and include all required keys in the correct types/order.", "confidence": 0.7}, "drafts_generated": 1, "drafts_survived": 1}
{"id": "3c84a0c5-4147-4949-969b-1448ccb1442d", "target_id": "B4-control", "git_sha": "74911ba9b67d2bde4ed520cf03087d78c79c5f2e", "pre_experiment_sha": "70fdc7faad9657181a6e429b2b1780fe53696688", "timestamp": "2026-04-19T16:16:06.811527+00:00", "hypothesis": "Standardize validation and error responses while rejecting unsupported fields to make all endpoint outputs deterministic and consistent.", "hypothesis_source": "agent", "mutation_diff_summary": "", "score": 0.7, "score_ci_lower": null, "score_ci_upper": null, "raw_scores": null, "baseline_score": 0.7, "outcome": "KEPT", "failure_mode": null, "duration_seconds": 13.568390291999094, "tags": ["validation", "error-handling", "deterministic", "serialization"], "learnings": "{\"what_changed\":\"\",\"what_improved\":[],\"what_regressed\":[],\"transferable_insight\":\"Making inputs and outputs strictly standardized by rejecting unsupported variations improves determinism and consistency across interfaces.\",\"domain_tags\":[\"standardization\",\"validation\",\"determinism\"]}", "cost_usd": 0.033350000000000005, "bootstrap_seed": 0, "agent_model": "gpt-5.4", "held_out_score": null, "criterion_names": null, "per_criterion_scores": null, "failure_classification": null, "drafts_generated": 1, "drafts_survived": 1}
{"id": "62b9b524-9014-4416-9fe0-b6bb1158141f", "target_id": "B4-control", "git_sha": "0fb9fc2220301fc4a8ce9eb29d751c9f899b1d3c", "pre_experiment_sha": "74911ba9b67d2bde4ed520cf03087d78c79c5f2e", "timestamp": "2026-04-19T16:16:23.274522+00:00", "hypothesis": "Make all validation failures use a single deterministic bad-request response while preserving stable serialization and ordering.", "hypothesis_source": "agent", "mutation_diff_summary": "", "score": 0.7, "score_ci_lower": null, "score_ci_upper": null, "raw_scores": null, "baseline_score": 0.7, "outcome": "KEPT", "failure_mode": null, "duration_seconds": 14.949587584007531, "tags": ["validation", "error-handling", "deterministic", "serialization"], "learnings": "{\"what_changed\":\"\",\"what_improved\":[],\"what_regressed\":[],\"transferable_insight\":\"When multiple failure paths exist, standardizing them into one deterministic response can improve consistency and predictability without changing behavior.\",\"domain_tags\":[\"consistency\",\"determinism\",\"error-handling\"]}", "cost_usd": 0.03275, "bootstrap_seed": 0, "agent_model": "gpt-5.4", "held_out_score": null, "criterion_names": null, "per_criterion_scores": null, "failure_classification": null, "drafts_generated": 1, "drafts_survived": 1}
{"id": "27c23282-2a28-454c-a8f7-60818fb9010c", "target_id": "B4-control", "git_sha": "943019589e210316dbc0f724926751739df2b465", "pre_experiment_sha": "0fb9fc2220301fc4a8ce9eb29d751c9f899b1d3c", "timestamp": "2026-04-19T16:16:40.537396+00:00", "hypothesis": "Make all invalid update payloads use the same explicit rejection path by rejecting empty update objects.", "hypothesis_source": "agent", "mutation_diff_summary": "", "score": 0.7, "score_ci_lower": null, "score_ci_upper": null, "raw_scores": null, "baseline_score": 0.7, "outcome": "KEPT", "failure_mode": null, "duration_seconds": 13.356364582898095, "tags": ["validation", "determinism", "error-handling"], "learnings": "{\"what_changed\":\"\",\"what_improved\":[],\"what_regressed\":[],\"transferable_insight\":\"Making invalid inputs fail through one explicit, consistent rejection path reduces ambiguity and standardizes error handling.\",\"domain_tags\":[\"error-handling\",\"input-validation\",\"software-design\"]}", "cost_usd": 0.032485, "bootstrap_seed": 0, "agent_model": "gpt-5.4", "held_out_score": null, "criterion_names": null, "per_criterion_scores": null, "failure_classification": null, "drafts_generated": 1, "drafts_survived": 1}
