{"id": "22d1ef5d-0164-4e5f-9abf-210962cefe72", "target_id": "B4-control", "git_sha": "01816fad8e6922cba59c884be07d938b80430521", "pre_experiment_sha": "c516200233216973426721c34a2eaf9e103ce76a", "timestamp": "2026-04-19T00:40:13.394026+00:00", "hypothesis": "Tighten shared email validation to reject domains with labels that start or end with dots/hyphens ambiguously after local/domain splitting.", "hypothesis_source": "agent", "mutation_diff_summary": "", "score": 0.725, "score_ci_lower": null, "score_ci_upper": null, "raw_scores": null, "baseline_score": 0.725, "outcome": "KEPT", "failure_mode": null, "duration_seconds": 20.885960833053105, "tags": ["validation", "email", "shared-helper", "minimal"], "learnings": "{\"what_changed\":\"\",\"what_improved\":[],\"what_regressed\":[],\"transferable_insight\":\"When validating structured input, enforce boundary and delimiter rules explicitly at each parsed segment to prevent ambiguous edge cases from slipping through.\",\"domain_tags\":[\"input-validation\",\"data-quality\",\"edge-cases\"]}", "cost_usd": 0.0723, "bootstrap_seed": 0, "agent_model": "gpt-5.4", "held_out_score": null, "criterion_names": null, "per_criterion_scores": null, "failure_classification": null, "drafts_generated": 1, "drafts_survived": 1}
{"id": "045cbac0-dd97-43bf-8aa5-93d1c7e8fd1e", "target_id": "B4-control", "git_sha": "080832873e451368e02d2b0699577985e702ccc9", "pre_experiment_sha": "01816fad8e6922cba59c884be07d938b80430521", "timestamp": "2026-04-19T00:40:42.419281+00:00", "hypothesis": "Reject blank-like string ages consistently in the shared age normalizer instead of silently coercing them to zero.", "hypothesis_source": "agent", "mutation_diff_summary": "", "score": 0.725, "score_ci_lower": null, "score_ci_upper": null, "raw_scores": null, "baseline_score": 0.725, "outcome": "KEPT", "failure_mode": null, "duration_seconds": 24.580147917033173, "tags": ["validation", "age", "shared-helper", "deterministic"], "learnings": "{\"what_changed\":\"\",\"what_improved\":[],\"what_regressed\":[],\"transferable_insight\":\"Treat blank or placeholder inputs as invalid rather than coercing them into a default value, so data quality issues are surfaced instead of hidden.\",\"domain_tags\":[\"data-validation\",\"input-processing\",\"error-handling\"]}", "cost_usd": 0.07295000000000001, "bootstrap_seed": 0, "agent_model": "gpt-5.4", "held_out_score": null, "criterion_names": null, "per_criterion_scores": null, "failure_classification": null, "drafts_generated": 1, "drafts_survived": 1}
{"id": "5b2bfb37-1b26-4d88-a2df-98deb90b2ba2", "target_id": "B4-control", "git_sha": "f8a9aedb8fe991af39857c4bb11b06e52d7d913f", "pre_experiment_sha": "080832873e451368e02d2b0699577985e702ccc9", "timestamp": "2026-04-19T00:41:07.170064+00:00", "hypothesis": "Reject placeholder-like string ages in the shared age normalizer to make create and update fail predictably on ambiguous numeric inputs.", "hypothesis_source": "agent", "mutation_diff_summary": "", "score": 0.725, "score_ci_lower": null, "score_ci_upper": null, "raw_scores": null, "baseline_score": 0.725, "outcome": "KEPT", "failure_mode": null, "duration_seconds": 23.682943041902035, "tags": ["validation", "age", "shared-helper", "deterministic"], "learnings": "{\"what_changed\":\"\",\"what_improved\":[],\"what_regressed\":[],\"transferable_insight\":\"When input values are ambiguous or placeholder-like, failing fast with explicit validation is better than silently normalizing them, because it makes behavior predictable across create and update paths.\",\"domain_tags\":[\"validation\",\"error-handling\",\"data-quality\"]}", "cost_usd": 0.07464000000000001, "bootstrap_seed": 0, "agent_model": "gpt-5.4", "held_out_score": null, "criterion_names": null, "per_criterion_scores": null, "failure_classification": null, "drafts_generated": 1, "drafts_survived": 1}
{"id": "068c103d-2dd3-43ef-bdb9-b15621f9e262", "target_id": "B4-control", "git_sha": "1735b4fba8c31f6102e4cad83a48807ab70bc3e1", "pre_experiment_sha": "f8a9aedb8fe991af39857c4bb11b06e52d7d913f", "timestamp": "2026-04-19T00:41:33.930656+00:00", "hypothesis": "Reject placeholder-like string ids in the shared id normalizer so ambiguous get/update/delete path inputs fail consistently.", "hypothesis_source": "agent", "mutation_diff_summary": "", "score": 0.725, "score_ci_lower": null, "score_ci_upper": null, "raw_scores": null, "baseline_score": 0.725, "outcome": "KEPT", "failure_mode": null, "duration_seconds": 25.66990162502043, "tags": ["validation", "ids", "shared-helper", "deterministic"], "learnings": "{\"what_changed\":\"\",\"what_improved\":[],\"what_regressed\":[],\"transferable_insight\":\"Rejecting placeholder-like identifiers at normalization time makes ambiguous inputs fail consistently across operations, reducing hidden edge cases and improving input validation reliability.\",\"domain_tags\":[\"input-validation\",\"error-handling\",\"data-normalization\"]}", "cost_usd": 0.07661500000000002, "bootstrap_seed": 0, "agent_model": "gpt-5.4", "held_out_score": null, "criterion_names": null, "per_criterion_scores": null, "failure_classification": null, "drafts_generated": 1, "drafts_survived": 1}
{"id": "842d9ab5-c12a-4525-a5a0-5e5e2e589256", "target_id": "B4-control", "git_sha": "412822ab39e9c5ac46cf589be2cc7ab6c269d509", "pre_experiment_sha": "1735b4fba8c31f6102e4cad83a48807ab70bc3e1", "timestamp": "2026-04-19T00:42:02.561718+00:00", "hypothesis": "Reject bracketed placeholder-like names in the shared name validator to make create, update, and list filtering fail consistently on ambiguous inputs.", "hypothesis_source": "agent", "mutation_diff_summary": "", "score": 0.725, "score_ci_lower": null, "score_ci_upper": null, "raw_scores": null, "baseline_score": 0.725, "outcome": "KEPT", "failure_mode": null, "duration_seconds": 24.650602624984458, "tags": ["validation", "names", "shared-helper", "deterministic"], "learnings": "{\"what_changed\":\"\",\"what_improved\":[],\"what_regressed\":[],\"transferable_insight\":\"When an input pattern is ambiguous, enforcing a single shared validation rule across all entry points prevents inconsistent behavior and makes failures predictable.\",\"domain_tags\":[\"validation\",\"consistency\",\"input-handling\"]}", "cost_usd": 0.07801000000000001, "bootstrap_seed": 0, "agent_model": "gpt-5.4", "held_out_score": null, "criterion_names": null, "per_criterion_scores": null, "failure_classification": null, "drafts_generated": 1, "drafts_survived": 1}
{"id": "9e92947c-8a5b-404d-a9ea-4b53b281329e", "target_id": "B4-control", "git_sha": "89f7960f1dbfd13422eb707ff2d0af85a8c4fea2", "pre_experiment_sha": "412822ab39e9c5ac46cf589be2cc7ab6c269d509", "timestamp": "2026-04-19T00:42:52.650813+00:00", "hypothesis": "Reject plus-signed numeric strings in shared age and id normalization so ambiguous signed values fail consistently across endpoints.", "hypothesis_source": "agent", "mutation_diff_summary": "", "score": 0.725, "score_ci_lower": null, "score_ci_upper": null, "raw_scores": null, "baseline_score": 0.725, "outcome": "KEPT", "failure_mode": null, "duration_seconds": 25.135808625025675, "tags": ["validation", "ids", "age", "shared-helper", "deterministic"], "learnings": "{\"what_changed\":\"\",\"what_improved\":[],\"what_regressed\":[],\"transferable_insight\":\"When normalizing inputs across multiple interfaces, rejecting ambiguous variants consistently is preferable to silently accepting them, because it preserves predictable behavior and reduces edge-case drift.\",\"domain_tags\":[\"input-validation\",\"consistency\",\"data-normalization\"]}", "cost_usd": 0.07902, "bootstrap_seed": 0, "agent_model": "gpt-5.4", "held_out_score": null, "criterion_names": null, "per_criterion_scores": null, "failure_classification": null, "drafts_generated": 1, "drafts_survived": 1}
{"id": "a54fbe53-bf5d-4150-9ee6-be2fa00307b7", "target_id": "B4-control", "git_sha": "61f4f06cb519818eb051bf789df54eaea0c990ae", "pre_experiment_sha": "89f7960f1dbfd13422eb707ff2d0af85a8c4fea2", "timestamp": "2026-04-19T00:43:22.418194+00:00", "hypothesis": "Reject placeholder-like angle-bracketed names in the shared name validator to make create, update, and list filtering fail consistently on another distinct ambiguous input family.", "hypothesis_source": "agent", "mutation_diff_summary": "", "score": 0.725, "score_ci_lower": null, "score_ci_upper": null, "raw_scores": null, "baseline_score": 0.725, "outcome": "KEPT", "failure_mode": null, "duration_seconds": 24.935206708032638, "tags": ["validation", "names", "shared-helper", "deterministic"], "learnings": "{\"what_changed\":\"\",\"what_improved\":[],\"what_regressed\":[],\"transferable_insight\":\"When a validation rule is broadened to consistently reject a whole class of ambiguous inputs, it reduces inconsistent behavior across related workflows by making edge cases fail in the same way everywhere.\",\"domain_tags\":[\"validation\",\"consistency\",\"input-sanitization\"]}", "cost_usd": 0.08017, "bootstrap_seed": 0, "agent_model": "gpt-5.4", "held_out_score": null, "criterion_names": null, "per_criterion_scores": null, "failure_classification": null, "drafts_generated": 1, "drafts_survived": 1}
{"id": "dffc64cb-60b2-4f60-be74-b1ca57f1fe3d", "target_id": "B4-control", "git_sha": "c8b49a04bb859f2ff2f6b79af2126c3d84f8faea", "pre_experiment_sha": "61f4f06cb519818eb051bf789df54eaea0c990ae", "timestamp": "2026-04-19T00:43:48.650248+00:00", "hypothesis": "Reject slash-separated placeholder-like names in the shared name validator to make create, update, and list filtering fail consistently on another distinct ambiguous input family.", "hypothesis_source": "agent", "mutation_diff_summary": "", "score": 0.725, "score_ci_lower": null, "score_ci_upper": null, "raw_scores": null, "baseline_score": 0.725, "outcome": "KEPT", "failure_mode": null, "duration_seconds": 25.156232749926858, "tags": ["validation", "names", "shared-helper", "deterministic"], "learnings": "{\"what_changed\":\"\",\"what_improved\":[],\"what_regressed\":[],\"transferable_insight\":\"When a validation rule is broadened to reject an entire ambiguous input pattern, related operations become consistently safer and easier to reason about because they fail in the same way across create, update, and filtering paths.\",\"domain_tags\":[\"validation\",\"consistency\",\"input-sanitization\"]}", "cost_usd": 0.081035, "bootstrap_seed": 0, "agent_model": "gpt-5.4", "held_out_score": null, "criterion_names": null, "per_criterion_scores": null, "failure_classification": null, "drafts_generated": 1, "drafts_survived": 1}
{"id": "3cd2cbb6-9df1-497f-b5ab-1f475dfbb750", "target_id": "B4-control", "git_sha": "a62e3a73c49521777577e07dbc8b4f90f661f789", "pre_experiment_sha": "c8b49a04bb859f2ff2f6b79af2126c3d84f8faea", "timestamp": "2026-04-19T00:44:19.107682+00:00", "hypothesis": "Reject placeholder-like quoted names in the shared name validator so create, update, and list name filtering fail consistently for another distinct ambiguous input family.", "hypothesis_source": "agent", "mutation_diff_summary": "", "score": 0.725, "score_ci_lower": null, "score_ci_upper": null, "raw_scores": null, "baseline_score": 0.725, "outcome": "KEPT", "failure_mode": null, "duration_seconds": 29.232530875015073, "tags": ["validation", "names", "shared-helper", "deterministic"], "learnings": "{\"what_changed\":\"\",\"what_improved\":[],\"what_regressed\":[],\"transferable_insight\":\"When a validation rule is broadened to catch a new ambiguous pattern, apply it consistently across all entry points so the system fails in the same way everywhere instead of only in some paths.\",\"domain_tags\":[\"validation\",\"consistency\",\"input-sanitization\"]}", "cost_usd": 0.082565, "bootstrap_seed": 0, "agent_model": "gpt-5.4", "held_out_score": null, "criterion_names": null, "per_criterion_scores": null, "failure_classification": null, "drafts_generated": 1, "drafts_survived": 1}
{"id": "9f2239d8-8b94-472c-910b-6dddc2cb0e6f", "target_id": "B4-control", "git_sha": "da67bed184718da522293343c50f77f4406d5d95", "pre_experiment_sha": "a62e3a73c49521777577e07dbc8b4f90f661f789", "timestamp": "2026-04-19T00:44:51.455330+00:00", "hypothesis": "Reject email domains with placeholder-like TLDs in the shared email validator so create, update, and email validation fail consistently.", "hypothesis_source": "agent", "mutation_diff_summary": "", "score": 0.725, "score_ci_lower": null, "score_ci_upper": null, "raw_scores": null, "baseline_score": 0.725, "outcome": "KEPT", "failure_mode": null, "duration_seconds": 27.032908833003603, "tags": ["validation", "email", "shared-helper", "deterministic"], "learnings": "{\"what_changed\":\"\",\"what_improved\":[],\"what_regressed\":[],\"transferable_insight\":\"When multiple workflows depend on the same validation rule, centralizing the rule ensures consistent behavior across create, update, and standalone validation paths.\",\"domain_tags\":[\"validation\",\"consistency\",\"shared-logic\"]}", "cost_usd": 0.084055, "bootstrap_seed": 0, "agent_model": "gpt-5.4", "held_out_score": null, "criterion_names": null, "per_criterion_scores": null, "failure_classification": null, "drafts_generated": 1, "drafts_survived": 1}
{"id": "b0a141aa-6eae-44e2-a814-286a1315a2a2", "target_id": "B4-control", "git_sha": "1e4a3cc0ab7c69c4329400dd3d36a0a0fb92813d", "pre_experiment_sha": "da67bed184718da522293343c50f77f4406d5d95", "timestamp": "2026-04-19T00:45:18.663984+00:00", "hypothesis": "Reject placeholder-like IDs wrapped in brackets in the shared user-id normalizer so get/update/delete fail consistently on another distinct ambiguous input family.", "hypothesis_source": "agent", "mutation_diff_summary": "", "score": 0.725, "score_ci_lower": null, "score_ci_upper": null, "raw_scores": null, "baseline_score": 0.725, "outcome": "KEPT", "failure_mode": null, "duration_seconds": 26.22950712509919, "tags": ["validation", "ids", "shared-helper", "deterministic"], "learnings": "{\"what_changed\":\"\",\"what_improved\":[],\"what_regressed\":[],\"transferable_insight\":\"When normalizing identifiers, consistently reject ambiguous placeholder-like formats at the shared validation layer so all downstream operations fail uniformly instead of handling edge cases inconsistently.\",\"domain_tags\":[\"validation\",\"input-normalization\",\"error-handling\"]}", "cost_usd": 0.08464, "bootstrap_seed": 0, "agent_model": "gpt-5.4", "held_out_score": null, "criterion_names": null, "per_criterion_scores": null, "failure_classification": null, "drafts_generated": 1, "drafts_survived": 1}
{"id": "aefd22dd-99ca-4ba6-83a0-6303ce99d4b5", "target_id": "B4-control", "git_sha": "860187e055c2cc118b09d8bfcada774bb1364d97", "pre_experiment_sha": "1e4a3cc0ab7c69c4329400dd3d36a0a0fb92813d", "timestamp": "2026-04-19T00:46:14.579551+00:00", "hypothesis": "Reject purely alphabetic placeholder-like age strings in the shared age normalizer to make create and update fail consistently on another distinct invalid-input family.", "hypothesis_source": "agent", "mutation_diff_summary": "", "score": 0.725, "score_ci_lower": null, "score_ci_upper": null, "raw_scores": null, "baseline_score": 0.725, "outcome": "KEPT", "failure_mode": null, "duration_seconds": 25.459096875041723, "tags": ["validation", "age", "shared-helper", "deterministic"], "learnings": "{\"what_changed\":\"\",\"what_improved\":[],\"what_regressed\":[],\"transferable_insight\":\"When validating shared input normalization, align rejection rules across create and update paths so the same invalid input family fails consistently everywhere.\",\"domain_tags\":[\"input-validation\",\"consistency\",\"shared-logic\"]}", "cost_usd": 0.08490500000000001, "bootstrap_seed": 0, "agent_model": "gpt-5.4", "held_out_score": null, "criterion_names": null, "per_criterion_scores": null, "failure_classification": null, "drafts_generated": 1, "drafts_survived": 1}
{"id": "e5910384-7fa8-40d6-9b08-d06b2e53ed33", "target_id": "B4-control", "git_sha": "c6ac6d635530f3e3d0a4f06fdbb3ad72310832a0", "pre_experiment_sha": "860187e055c2cc118b09d8bfcada774bb1364d97", "timestamp": "2026-04-19T00:47:17.048953+00:00", "hypothesis": "Reject placeholder-like parenthesized age strings in the shared age normalizer to make create and update fail consistently for one new deterministic invalid family.", "hypothesis_source": "agent", "mutation_diff_summary": "", "score": 0.725, "score_ci_lower": null, "score_ci_upper": null, "raw_scores": null, "baseline_score": 0.725, "outcome": "KEPT", "failure_mode": null, "duration_seconds": 26.094736250001006, "tags": ["validation", "age", "shared-helper", "deterministic"], "learnings": "{\"what_changed\":\"\",\"what_improved\":[],\"what_regressed\":[],\"transferable_insight\":\"When a validation rule is tightened to reject a previously ambiguous placeholder pattern, applying it consistently across create and update paths prevents inconsistent behavior for the same invalid input.\",\"domain_tags\":[\"validation\",\"consistency\",\"input-sanitization\"]}", "cost_usd": 0.08672, "bootstrap_seed": 0, "agent_model": "gpt-5.4", "held_out_score": null, "criterion_names": null, "per_criterion_scores": null, "failure_classification": null, "drafts_generated": 1, "drafts_survived": 1}
{"id": "e98eb9c7-09c1-4e52-9b7f-bff81be5734b", "target_id": "B4-control", "git_sha": "d6f40a466c16425ec975a51df25a15747492d50c", "pre_experiment_sha": "c6ac6d635530f3e3d0a4f06fdbb3ad72310832a0", "timestamp": "2026-04-19T00:47:47.694025+00:00", "hypothesis": "Reject placeholder-like slash-wrapped IDs in the shared user-id normalizer so get/update/delete fail consistently for one new ambiguous id family.", "hypothesis_source": "agent", "mutation_diff_summary": "", "score": 0.725, "score_ci_lower": null, "score_ci_upper": null, "raw_scores": null, "baseline_score": 0.725, "outcome": "KEPT", "failure_mode": null, "duration_seconds": 25.909007749985904, "tags": ["validation", "ids", "shared-helper", "deterministic"], "learnings": "{\"what_changed\":\"\",\"what_improved\":[],\"what_regressed\":[],\"transferable_insight\":\"When an identifier format is ambiguous, enforcing a strict normalization rule that rejects placeholder-like values can prevent inconsistent behavior across related operations.\",\"domain_tags\":[\"input-validation\",\"data-normalization\",\"consistency\"]}", "cost_usd": 0.08727000000000001, "bootstrap_seed": 0, "agent_model": "gpt-5.4", "held_out_score": null, "criterion_names": null, "per_criterion_scores": null, "failure_classification": null, "drafts_generated": 1, "drafts_survived": 1}
{"id": "75eafb3f-302e-4a66-be8e-e7d2c5398d3e", "target_id": "B4-control", "git_sha": "9d1cfd3bad888eb4c0a0435539956711e51b96fe", "pre_experiment_sha": "d6f40a466c16425ec975a51df25a15747492d50c", "timestamp": "2026-04-19T00:48:42.063961+00:00", "hypothesis": "Reject negative zero age strings in the shared age normalizer so create and update fail consistently on one distinct signed invalid-input case.", "hypothesis_source": "agent", "mutation_diff_summary": "", "score": 0.725, "score_ci_lower": null, "score_ci_upper": null, "raw_scores": null, "baseline_score": 0.725, "outcome": "KEPT", "failure_mode": null, "duration_seconds": 27.20399591710884, "tags": ["validation", "age", "shared-helper", "deterministic"], "learnings": "{\"what_changed\":\"\",\"what_improved\":[],\"what_regressed\":[],\"transferable_insight\":\"Treat distinct invalid input variants consistently across all entry points so the system fails predictably on the same malformed case.\",\"domain_tags\":[\"input-validation\",\"consistency\",\"error-handling\"]}", "cost_usd": 0.087525, "bootstrap_seed": 0, "agent_model": "gpt-5.4", "held_out_score": null, "criterion_names": null, "per_criterion_scores": null, "failure_classification": null, "drafts_generated": 1, "drafts_survived": 1}
{"id": "ac98a866-40a3-4bfd-8251-de990f8a4c17", "target_id": "B4-control", "git_sha": "f12078b8cd992727f9d64dd756ae022539276ebf", "pre_experiment_sha": "9d1cfd3bad888eb4c0a0435539956711e51b96fe", "timestamp": "2026-04-19T00:49:43.039308+00:00", "hypothesis": "Reject numeric-looking names in the shared name validator so create, update, and list name filtering handle this ambiguous input family consistently.", "hypothesis_source": "agent", "mutation_diff_summary": "", "score": 0.725, "score_ci_lower": null, "score_ci_upper": null, "raw_scores": null, "baseline_score": 0.725, "outcome": "KEPT", "failure_mode": null, "duration_seconds": 28.74422145797871, "tags": ["validation", "names", "shared-helper", "deterministic"], "learnings": "{\"what_changed\":\"\",\"what_improved\":[],\"what_regressed\":[],\"transferable_insight\":\"When input patterns are ambiguous, enforcing a single validation rule across all entry points prevents inconsistent behavior and makes system handling predictable.\",\"domain_tags\":[\"validation\",\"consistency\",\"input-handling\"]}", "cost_usd": 0.08852000000000002, "bootstrap_seed": 0, "agent_model": "gpt-5.4", "held_out_score": null, "criterion_names": null, "per_criterion_scores": null, "failure_classification": null, "drafts_generated": 1, "drafts_survived": 1}
