{"id": "a386c0d9-1059-4bc4-8cba-e93bcaa5bb56", "target_id": "B4-control", "git_sha": "1eda166320e1eb5046ae120e97f523221a9f96bf", "pre_experiment_sha": "68d96c185fbe6e19a4b0d379f77244ff8b5e62d6", "timestamp": "2026-04-19T00:31:05.728644+00:00", "hypothesis": "Make timestamps deterministic and harden input handling to reduce exception-driven nondeterminism.", "hypothesis_source": "agent", "mutation_diff_summary": "", "score": 0.65, "score_ci_lower": null, "score_ci_upper": null, "raw_scores": null, "baseline_score": 0.435, "outcome": "KEPT", "failure_mode": null, "duration_seconds": 10.378813332994469, "tags": ["determinism", "validation", "serialization", "robustness"], "learnings": "{\"what_changed\":\"\",\"what_improved\":[],\"what_regressed\":[],\"transferable_insight\":\"Reducing reliance on variable external state and strengthening input validation can make systems more deterministic and less prone to exception-driven variability.\",\"domain_tags\":[\"reliability\",\"input-validation\",\"determinism\"]}", "cost_usd": 0.027845, "bootstrap_seed": 0, "agent_model": "gpt-5.4", "held_out_score": null, "criterion_names": null, "per_criterion_scores": null, "failure_classification": null, "drafts_generated": 1, "drafts_survived": 1}
{"id": "6d2f7cf7-17db-4ab2-b823-8988eff238ef", "target_id": "B4-control", "git_sha": "f88a186018c4a6c1aeafba0c010b4de883502c5b", "pre_experiment_sha": "1eda166320e1eb5046ae120e97f523221a9f96bf", "timestamp": "2026-04-19T00:31:20.435922+00:00", "hypothesis": "Make input normalization and error handling stricter and fully deterministic across endpoints.", "hypothesis_source": "agent", "mutation_diff_summary": "", "score": 0.675, "score_ci_lower": null, "score_ci_upper": null, "raw_scores": null, "baseline_score": 0.65, "outcome": "KEPT", "failure_mode": null, "duration_seconds": 13.587283667060547, "tags": ["validation", "determinism", "consistency"], "learnings": "{\"what_changed\":\"\",\"what_improved\":[],\"what_regressed\":[],\"transferable_insight\":\"Tightening validation and making error handling deterministic can improve system reliability even when no immediate functional changes are visible.\",\"domain_tags\":[\"reliability\",\"validation\",\"error-handling\"]}", "cost_usd": 0.036055000000000004, "bootstrap_seed": 0, "agent_model": "gpt-5.4", "held_out_score": null, "criterion_names": null, "per_criterion_scores": null, "failure_classification": null, "drafts_generated": 1, "drafts_survived": 1}
{"id": "e5d4d8df-9fc6-4fac-9bb2-eaaa9e278665", "target_id": "B4-control", "git_sha": "bfdf97a26ab7245498e39c24fcf0a86e59eaaf7e", "pre_experiment_sha": "f88a186018c4a6c1aeafba0c010b4de883502c5b", "timestamp": "2026-04-19T00:31:34.123420+00:00", "hypothesis": "Make update and list responses include created_at consistently and tighten deterministic normalization/validation paths.", "hypothesis_source": "agent", "mutation_diff_summary": "", "score": 0.725, "score_ci_lower": null, "score_ci_upper": null, "raw_scores": null, "baseline_score": 0.675, "outcome": "KEPT", "failure_mode": null, "duration_seconds": 12.490165499970317, "tags": ["consistency", "validation", "determinism"], "learnings": "{\"what_changed\":\"\",\"what_improved\":[],\"what_regressed\":[],\"transferable_insight\":\"Keeping response fields consistent and making normalization/validation deterministic improves reliability without changing core behavior.\",\"domain_tags\":[\"software-engineering\",\"api-design\",\"data-validation\"]}", "cost_usd": 0.038015, "bootstrap_seed": 0, "agent_model": "gpt-5.4", "held_out_score": null, "criterion_names": null, "per_criterion_scores": null, "failure_classification": null, "drafts_generated": 1, "drafts_survived": 1}
{"id": "e7fbfa0a-19c4-4c65-9da7-b059d7be5fdb", "target_id": "B4-control", "git_sha": "bfdf97a26ab7245498e39c24fcf0a86e59eaaf7e", "pre_experiment_sha": "bfdf97a26ab7245498e39c24fcf0a86e59eaaf7e", "timestamp": "2026-04-19T00:31:50.692862+00:00", "hypothesis": "Tighten shared normalization and make create/update/list responses use the same deterministic validation and serialization rules.", "hypothesis_source": "agent", "mutation_diff_summary": "", "score": 0.725, "score_ci_lower": null, "score_ci_upper": null, "raw_scores": null, "baseline_score": 0.725, "outcome": "DISCARDED", "failure_mode": null, "duration_seconds": 13.562910625012591, "tags": ["determinism", "validation", "normalization", "serialization"], "learnings": "{\"what_changed\":\"\",\"what_improved\":[],\"what_regressed\":[],\"transferable_insight\":\"When a change does not produce measurable improvement, standardizing behavior alone is not enough to justify adoption without evidence of impact.\",\"domain_tags\":[\"evaluation\",\"standardization\",\"decision-making\"]}", "cost_usd": 0.0400488, "bootstrap_seed": 0, "agent_model": "gpt-5.4", "held_out_score": null, "criterion_names": null, "per_criterion_scores": null, "failure_classification": {"category": "output_format", "description": "The experiment likely produced responses that did not conform to the expected output structure/schema. Despite intent to unify deterministic validation/serialization, the result appears to violate the required formatting rules for create/update/list responses.", "fix_direction": "Ensure all response endpoints (create/update/list) use the exact same validation and serialization pipeline, with a single shared schema/serializer and consistent field ordering, types, and required/optional presence; add schema-based tests to catch structural mismatches.", "confidence": 0.62}, "drafts_generated": 1, "drafts_survived": 1}
{"id": "e3c1161a-6b72-4de0-853d-f80f5393fae3", "target_id": "B4-control", "git_sha": "bfdf97a26ab7245498e39c24fcf0a86e59eaaf7e", "pre_experiment_sha": "bfdf97a26ab7245498e39c24fcf0a86e59eaaf7e", "timestamp": "2026-04-19T00:32:06.520201+00:00", "hypothesis": "Unify deterministic validation and serialization by using shared normalizers for all user fields and standardizing delete/list response shapes.", "hypothesis_source": "agent", "mutation_diff_summary": "", "score": 0.675, "score_ci_lower": null, "score_ci_upper": null, "raw_scores": null, "baseline_score": 0.725, "outcome": "DISCARDED", "failure_mode": null, "duration_seconds": 12.890565374982543, "tags": ["determinism", "validation", "normalization", "serialization"], "learnings": "{\"what_changed\":\"\",\"what_improved\":[],\"what_regressed\":[],\"transferable_insight\":\"Standardizing shared transformation logic and response formats can reduce inconsistency, but only if it aligns with existing validation and data-flow expectations.\",\"domain_tags\":[\"software_design\",\"data_consistency\",\"api_design\"]}", "cost_usd": 0.0405734, "bootstrap_seed": 0, "agent_model": "gpt-5.4", "held_out_score": null, "criterion_names": null, "per_criterion_scores": null, "failure_classification": {"category": "output_format", "description": "The experiment failed due to an unknown issue, but the stated goal focuses on unifying validation and serialization shapes\u2014implying the likely failure was that one or more API response structures (delete/list) did not match the required standardized schema.", "fix_direction": "Audit and align all delete/list response payloads against the expected schema (keys, nesting, and null/empty handling), and ensure shared normalizers are applied consistently for every user field so output contracts remain identical across paths.", "confidence": 0.42}, "drafts_generated": 1, "drafts_survived": 1}
{"id": "8133cf43-22ff-4e2c-be27-60b05e50efdb", "target_id": "B4-control", "git_sha": "bfdf97a26ab7245498e39c24fcf0a86e59eaaf7e", "pre_experiment_sha": "bfdf97a26ab7245498e39c24fcf0a86e59eaaf7e", "timestamp": "2026-04-19T00:32:22.579943+00:00", "hypothesis": "Standardize validation and response serialization across endpoints with stricter, shared normalization.", "hypothesis_source": "agent", "mutation_diff_summary": "", "score": 0.725, "score_ci_lower": null, "score_ci_upper": null, "raw_scores": null, "baseline_score": 0.725, "outcome": "DISCARDED", "failure_mode": null, "duration_seconds": 13.658834583009593, "tags": ["determinism", "validation", "serialization", "normalization"], "learnings": "{\"what_changed\":\"\",\"what_improved\":[],\"what_regressed\":[],\"transferable_insight\":\"When a change shows no measurable improvement or regression, the safest takeaway is that standardization alone may not be sufficient to affect outcomes without addressing the underlying variability or bottleneck.\",\"domain_tags\":[\"process-improvement\",\"evaluation\",\"standardization\"]}", "cost_usd": 0.0397374, "bootstrap_seed": 0, "agent_model": "gpt-5.4", "held_out_score": null, "criterion_names": null, "per_criterion_scores": null, "failure_classification": {"category": "output_format", "description": "The experiment appears to have produced a response that did not conform to the expected shared output/serialization schema after applying stricter normalization, leading to an evaluation mismatch rather than a reasoning or logic failure.", "fix_direction": "Ensure all endpoints use the exact same response structure and field normalization rules (types, required/optional fields, casing, ordering/encoding) and add schema-validation tests for every endpoint.", "confidence": 0.72}, "drafts_generated": 1, "drafts_survived": 1}
{"id": "5a9905a8-3e95-4fed-ba79-f5d640aa119c", "target_id": "B4-control", "git_sha": "bfdf97a26ab7245498e39c24fcf0a86e59eaaf7e", "pre_experiment_sha": "bfdf97a26ab7245498e39c24fcf0a86e59eaaf7e", "timestamp": "2026-04-19T00:32:41.526090+00:00", "hypothesis": "Tighten shared normalization and error handling so create/update/list paths reject ambiguous inputs consistently and serialize stable normalized values.", "hypothesis_source": "agent", "mutation_diff_summary": "", "score": 0.725, "score_ci_lower": null, "score_ci_upper": null, "raw_scores": null, "baseline_score": 0.725, "outcome": "DISCARDED", "failure_mode": null, "duration_seconds": 13.8943210830912, "tags": ["validation", "normalization", "determinism", "serialization"], "learnings": "{\"what_changed\":\"\",\"what_improved\":[],\"what_regressed\":[],\"transferable_insight\":\"When a change adds stricter validation and normalization without a clear user-facing benefit, it may fail to produce measurable improvement despite making behavior more consistent.\",\"domain_tags\":[\"validation\",\"normalization\",\"error-handling\"]}", "cost_usd": 0.04102600000000001, "bootstrap_seed": 0, "agent_model": "gpt-5.4", "held_out_score": null, "criterion_names": null, "per_criterion_scores": null, "failure_classification": {"category": "logic_error", "description": "The provided information does not include enough detail about the actual failure symptom (e.g., which endpoint/path misbehaved, what error/stack trace or mismatch occurred). Without a concrete observed failure mode, the most appropriate category among the given options cannot be determined.", "fix_direction": "Capture specific failure evidence (error message/stack trace, failing request/response payloads, and which of create/update/list paths rejected/accepted inputs). Then verify whether the failure is due to schema/structure issues, incorrect normalization/meaning, regression in behavior, out-of-scope edits, or incomplete/inconsistent state.", "confidence": 0.1}, "drafts_generated": 1, "drafts_survived": 1}
{"id": "619a318f-8e1f-4b48-bd37-319c4e84f23d", "target_id": "B4-control", "git_sha": "bfdf97a26ab7245498e39c24fcf0a86e59eaaf7e", "pre_experiment_sha": "bfdf97a26ab7245498e39c24fcf0a86e59eaaf7e", "timestamp": "2026-04-19T00:32:57.645307+00:00", "hypothesis": "Tighten shared normalization and validation helpers so all endpoints reject ambiguous inputs consistently and serialize stable normalized values.", "hypothesis_source": "agent", "mutation_diff_summary": "", "score": 0.725, "score_ci_lower": null, "score_ci_upper": null, "raw_scores": null, "baseline_score": 0.725, "outcome": "DISCARDED", "failure_mode": null, "duration_seconds": 13.731877457932569, "tags": ["validation", "normalization", "determinism", "serialization"], "learnings": "{\"what_changed\":\"\",\"what_improved\":[],\"what_regressed\":[],\"transferable_insight\":\"When inputs are normalized and validated through a single shared path, systems behave more consistently and produce stable outputs across all entry points.\",\"domain_tags\":[\"software-engineering\",\"data-validation\",\"api-design\"]}", "cost_usd": 0.0409288, "bootstrap_seed": 0, "agent_model": "gpt-5.4", "held_out_score": null, "criterion_names": null, "per_criterion_scores": null, "failure_classification": {"category": "logic_error", "description": "The provided details do not include enough information to determine what specific failure occurred (the Failure Mode is marked as 'unknown' and there are no logs/errors or observed discrepancies to map to a category).", "fix_direction": "Reproduce the failure with failing test cases/log output, identify whether the issue is schema/serialization, normalization/validation semantics, regression, or incomplete/invalid edits, then adjust the shared helpers to match the expected contract and add targeted tests for ambiguous inputs and stable normalized serialization.", "confidence": 0.15}, "drafts_generated": 1, "drafts_survived": 1}
{"id": "3c869815-e469-47a6-b32c-b651ce228736", "target_id": "B4-control", "git_sha": "bfdf97a26ab7245498e39c24fcf0a86e59eaaf7e", "pre_experiment_sha": "bfdf97a26ab7245498e39c24fcf0a86e59eaaf7e", "timestamp": "2026-04-19T00:33:14.062887+00:00", "hypothesis": "Tighten shared normalization and validation so create/update/list paths reject ambiguous inputs consistently and serialize stable normalized values.", "hypothesis_source": "agent", "mutation_diff_summary": "", "score": 0.725, "score_ci_lower": null, "score_ci_upper": null, "raw_scores": null, "baseline_score": 0.725, "outcome": "DISCARDED", "failure_mode": null, "duration_seconds": 14.221730541903526, "tags": ["validation", "normalization", "determinism", "serialization"], "learnings": "{\"what_changed\":\"\",\"what_improved\":[],\"what_regressed\":[],\"transferable_insight\":\"When inputs can be interpreted in multiple ways, enforcing a single normalization and validation rule across all entry points prevents inconsistent behavior and makes outputs stable.\",\"domain_tags\":[\"data-validation\",\"api-design\",\"input-normalization\"]}", "cost_usd": 0.041781000000000006, "bootstrap_seed": 0, "agent_model": "gpt-5.4", "held_out_score": null, "criterion_names": null, "per_criterion_scores": null, "failure_classification": {"category": "logic_error", "description": "The provided experiment metadata does not include enough detail to determine how the hypothesis failed (e.g., whether there was a schema/output violation, logic/meaning error, regression, or incomplete edit).", "fix_direction": "Capture and compare expected vs actual behavior for create/update/list: include exact failing inputs, normalization/validation outputs, and the specific mismatch (format, meaning, or inconsistent state) so the failure can be mapped to a concrete category.", "confidence": 0.12}, "drafts_generated": 1, "drafts_survived": 1}
{"id": "f2ef02ae-a9c8-4697-b3cd-7982b4c1dfc0", "target_id": "B4-control", "git_sha": "bfdf97a26ab7245498e39c24fcf0a86e59eaaf7e", "pre_experiment_sha": "bfdf97a26ab7245498e39c24fcf0a86e59eaaf7e", "timestamp": "2026-04-19T00:33:33.399658+00:00", "hypothesis": "Tighten shared normalization and email validation so create/update/list paths return more deterministic, consistently normalized user data.", "hypothesis_source": "agent", "mutation_diff_summary": "", "score": 0.725, "score_ci_lower": null, "score_ci_upper": null, "raw_scores": null, "baseline_score": 0.725, "outcome": "DISCARDED", "failure_mode": null, "duration_seconds": 15.051959833945148, "tags": ["validation", "normalization", "determinism", "serialization"], "learnings": "{\"what_changed\":\"\",\"what_improved\":[],\"what_regressed\":[],\"transferable_insight\":\"When a change does not produce measurable improvement or regression, it is often best to discard it and preserve the simpler, more stable behavior rather than adding normalization or validation complexity without clear benefit.\",\"domain_tags\":[\"decision-making\",\"software-engineering\",\"quality-assurance\"]}", "cost_usd": 0.041210800000000006, "bootstrap_seed": 0, "agent_model": "gpt-5.4", "held_out_score": null, "criterion_names": null, "per_criterion_scores": null, "failure_classification": {"category": "semantic_drift", "description": "The experiment did not achieve the intended behavior of producing more deterministic, consistently normalized user data across create/update/list paths; results appear to have changed meaning or normalization/validation behavior in an unintended way rather than simply failing formatting or syntax.", "fix_direction": "Tighten and align normalization/email-validation rules across all endpoints (create/update/list), add explicit normalization/validation tests for edge cases, and verify that the same transformation is applied consistently before persistence and before response serialization.", "confidence": 0.62}, "drafts_generated": 1, "drafts_survived": 1}
{"id": "0b17024f-a981-489b-8d54-c1f596d3bb39", "target_id": "B4-control", "git_sha": "21c11ea6873557fa9634ed8469a9c59d4997d9fa", "pre_experiment_sha": "bfdf97a26ab7245498e39c24fcf0a86e59eaaf7e", "timestamp": "2026-04-19T00:33:49.458328+00:00", "hypothesis": "Tighten shared normalization for email and common validation paths to produce more deterministic create/update/list behavior.", "hypothesis_source": "agent", "mutation_diff_summary": "", "score": 0.725, "score_ci_lower": null, "score_ci_upper": null, "raw_scores": null, "baseline_score": 0.725, "outcome": "KEPT", "failure_mode": null, "duration_seconds": 13.869631833047606, "tags": ["validation", "normalization", "determinism"], "learnings": "{\"what_changed\":\"\",\"what_improved\":[],\"what_regressed\":[],\"transferable_insight\":\"Applying the same normalization and validation rules across all entry points improves determinism and consistency without necessarily changing outcomes.\",\"domain_tags\":[\"software-engineering\",\"data-validation\",\"system-design\"]}", "cost_usd": 0.041305, "bootstrap_seed": 0, "agent_model": "gpt-5.4", "held_out_score": null, "criterion_names": null, "per_criterion_scores": null, "failure_classification": null, "drafts_generated": 1, "drafts_survived": 1}
{"id": "1f2939e8-9543-4988-980b-b42732ad9ac1", "target_id": "B4-control", "git_sha": "e2ccb5fdd280411f47863e3352731e92a89ba131", "pre_experiment_sha": "21c11ea6873557fa9634ed8469a9c59d4997d9fa", "timestamp": "2026-04-19T00:34:04.871584+00:00", "hypothesis": "Tighten shared normalization so create/update/list use the same deterministic validation and normalization for booleans, emails, and names.", "hypothesis_source": "agent", "mutation_diff_summary": "", "score": 0.725, "score_ci_lower": null, "score_ci_upper": null, "raw_scores": null, "baseline_score": 0.725, "outcome": "KEPT", "failure_mode": null, "duration_seconds": 14.308859709068201, "tags": ["validation", "normalization", "determinism"], "learnings": "{\"what_changed\":\"\",\"what_improved\":[],\"what_regressed\":[],\"transferable_insight\":\"Using one shared, deterministic validation-and-normalization path across create, update, and list operations reduces inconsistency without changing behavior.\",\"domain_tags\":[\"data-validation\",\"api-design\",\"consistency\"]}", "cost_usd": 0.04288, "bootstrap_seed": 0, "agent_model": "gpt-5.4", "held_out_score": null, "criterion_names": null, "per_criterion_scores": null, "failure_classification": null, "drafts_generated": 1, "drafts_survived": 1}
{"id": "c5e8a1b4-0517-4070-b806-b9da6c9df1b2", "target_id": "B4-control", "git_sha": "aff8d2490498e5e6dd53a9163d2ee0cdffac3eea", "pre_experiment_sha": "e2ccb5fdd280411f47863e3352731e92a89ba131", "timestamp": "2026-04-19T00:34:22.176259+00:00", "hypothesis": "Tighten shared normalization helpers to reject ambiguous booleans and invalid negative ages while preserving stable serialization.", "hypothesis_source": "agent", "mutation_diff_summary": "", "score": 0.75, "score_ci_lower": null, "score_ci_upper": null, "raw_scores": null, "baseline_score": 0.725, "outcome": "KEPT", "failure_mode": null, "duration_seconds": 14.208482416928746, "tags": ["validation", "normalization", "determinism"], "learnings": "{\"what_changed\":\"\",\"what_improved\":[],\"what_regressed\":[],\"transferable_insight\":\"Tightening validation at shared normalization boundaries to reject ambiguous or invalid inputs can improve correctness without changing serialized output formats.\",\"domain_tags\":[\"validation\",\"data-normalization\",\"serialization\"]}", "cost_usd": 0.043575, "bootstrap_seed": 0, "agent_model": "gpt-5.4", "held_out_score": null, "criterion_names": null, "per_criterion_scores": null, "failure_classification": null, "drafts_generated": 1, "drafts_survived": 1}
