{"id": "a5f9161e-9a9b-44c9-b06c-5acf13073bd4", "target_id": "B4-control", "git_sha": "fcad781a2548b835298d3a1fe98a9c8a55914371", "pre_experiment_sha": "aff8d2490498e5e6dd53a9163d2ee0cdffac3eea", "timestamp": "2026-04-19T00:34:38.191129+00:00", "hypothesis": "Tighten shared normalization for ids and list name filters to reject ambiguous blank inputs and keep validation deterministic across paths.", "hypothesis_source": "agent", "mutation_diff_summary": "", "score": 0.75, "score_ci_lower": null, "score_ci_upper": null, "raw_scores": null, "baseline_score": 0.75, "outcome": "KEPT", "failure_mode": null, "duration_seconds": 14.840155332931317, "tags": ["validation", "normalization", "determinism"], "learnings": "{\"what_changed\":\"\",\"what_improved\":[],\"what_regressed\":[],\"transferable_insight\":\"Normalize shared inputs at a single boundary and reject ambiguous empty values early so all execution paths apply the same deterministic validation rules.\",\"domain_tags\":[\"validation\",\"input-normalization\",\"determinism\"]}", "cost_usd": 0.045215000000000005, "bootstrap_seed": 0, "agent_model": "gpt-5.4", "held_out_score": null, "criterion_names": null, "per_criterion_scores": null, "failure_classification": null, "drafts_generated": 1, "drafts_survived": 1}
{"id": "c5c3dc5b-9347-49cd-ab38-8cf70c4ba797", "target_id": "B4-control", "git_sha": "b0df3bc4e4a543744ffce1f6bef764fc448f0922", "pre_experiment_sha": "fcad781a2548b835298d3a1fe98a9c8a55914371", "timestamp": "2026-04-19T00:34:54.571719+00:00", "hypothesis": "Tighten shared normalization to reject non-finite-like and ambiguous string inputs while preserving stable serialized output.", "hypothesis_source": "agent", "mutation_diff_summary": "", "score": 0.75, "score_ci_lower": null, "score_ci_upper": null, "raw_scores": null, "baseline_score": 0.75, "outcome": "KEPT", "failure_mode": null, "duration_seconds": 15.097832583007403, "tags": ["validation", "normalization", "determinism"], "learnings": "{\"what_changed\":\"\",\"what_improved\":[],\"what_regressed\":[],\"transferable_insight\":\"When normalizing shared inputs, enforce strict validation to exclude ambiguous or invalid values while keeping the output format stable and predictable.\",\"domain_tags\":[\"data-validation\",\"input-normalization\",\"robustness\"]}", "cost_usd": 0.045970000000000004, "bootstrap_seed": 0, "agent_model": "gpt-5.4", "held_out_score": null, "criterion_names": null, "per_criterion_scores": null, "failure_classification": null, "drafts_generated": 1, "drafts_survived": 1}
{"id": "3f32c9e1-8ad2-4207-bc51-a3e58c975364", "target_id": "B4-control", "git_sha": "da80fcce01dffbb367dfdf82f2faf4d69e9f0794", "pre_experiment_sha": "b0df3bc4e4a543744ffce1f6bef764fc448f0922", "timestamp": "2026-04-19T00:35:15.022935+00:00", "hypothesis": "Tighten shared email normalization to reject ambiguous whitespace and malformed local/domain formats for more deterministic validation across create, update, and validate paths.", "hypothesis_source": "agent", "mutation_diff_summary": "", "score": 0.75, "score_ci_lower": null, "score_ci_upper": null, "raw_scores": null, "baseline_score": 0.75, "outcome": "KEPT", "failure_mode": null, "duration_seconds": 16.853611624916084, "tags": ["validation", "email", "normalization", "deterministic"], "learnings": "{\"what_changed\":\"\",\"what_improved\":[],\"what_regressed\":[],\"transferable_insight\":\"Validation becomes more reliable when shared normalization rules are made stricter and consistently applied across all entry points, reducing ambiguity before downstream processing.\",\"domain_tags\":[\"validation\",\"normalization\",\"data-quality\"]}", "cost_usd": 0.04846, "bootstrap_seed": 0, "agent_model": "gpt-5.4", "held_out_score": null, "criterion_names": null, "per_criterion_scores": null, "failure_classification": null, "drafts_generated": 1, "drafts_survived": 1}
{"id": "1029698d-fb9c-47a4-a42d-fa4b403e9912", "target_id": "B4-control", "git_sha": "1b0607718d1cda48c54e12fcd2c2d4c60b3dbc49", "pre_experiment_sha": "da80fcce01dffbb367dfdf82f2faf4d69e9f0794", "timestamp": "2026-04-19T00:35:33.722512+00:00", "hypothesis": "Tightening shared email normalization to reject malformed domain labels will improve deterministic validation across create, update, and validate_email.", "hypothesis_source": "agent", "mutation_diff_summary": "", "score": 0.75, "score_ci_lower": null, "score_ci_upper": null, "raw_scores": null, "baseline_score": 0.75, "outcome": "KEPT", "failure_mode": null, "duration_seconds": 17.41716837498825, "tags": ["validation", "email", "deterministic", "normalization"], "learnings": "{\"what_changed\":\"\",\"what_improved\":[],\"what_regressed\":[],\"transferable_insight\":\"Enforcing stricter input normalization at a shared validation boundary can improve consistency across multiple workflows without changing outcomes when the existing behavior is already aligned.\",\"domain_tags\":[\"validation\",\"input-normalization\",\"consistency\"]}", "cost_usd": 0.049960000000000004, "bootstrap_seed": 0, "agent_model": "gpt-5.4", "held_out_score": null, "criterion_names": null, "per_criterion_scores": null, "failure_classification": null, "drafts_generated": 1, "drafts_survived": 1}
{"id": "2d07cc55-45a3-4459-85e2-b75ee7d1a717", "target_id": "B4-control", "git_sha": "84a8c41e385ba08803b7654a7e29ca0676c2a415", "pre_experiment_sha": "1b0607718d1cda48c54e12fcd2c2d4c60b3dbc49", "timestamp": "2026-04-19T00:35:52.117965+00:00", "hypothesis": "Reject ambiguous bool-like active strings in filters to keep boolean handling deterministic across shared paths.", "hypothesis_source": "agent", "mutation_diff_summary": "", "score": 0.75, "score_ci_lower": null, "score_ci_upper": null, "raw_scores": null, "baseline_score": 0.75, "outcome": "KEPT", "failure_mode": null, "duration_seconds": 17.203714875038713, "tags": ["validation", "normalization", "booleans", "deterministic"], "learnings": "{\"what_changed\":\"\",\"what_improved\":[],\"what_regressed\":[],\"transferable_insight\":\"When inputs can be interpreted in multiple ways, rejecting ambiguous representations early preserves deterministic behavior across shared processing paths.\",\"domain_tags\":[\"data-validation\",\"reliability\",\"input-handling\"]}", "cost_usd": 0.050875000000000004, "bootstrap_seed": 0, "agent_model": "gpt-5.4", "held_out_score": null, "criterion_names": null, "per_criterion_scores": null, "failure_classification": null, "drafts_generated": 1, "drafts_survived": 1}
{"id": "bc10e57c-3269-4b3a-a035-80ce439c6261", "target_id": "B4-control", "git_sha": "f1c2fa08992ae4813dcf2936ea76b668d563193f", "pre_experiment_sha": "84a8c41e385ba08803b7654a7e29ca0676c2a415", "timestamp": "2026-04-19T00:36:17.887889+00:00", "hypothesis": "Tightening shared boolean and email normalization will make invalid ambiguous inputs fail consistently across create, update, and list.", "hypothesis_source": "agent", "mutation_diff_summary": "", "score": 0.75, "score_ci_lower": null, "score_ci_upper": null, "raw_scores": null, "baseline_score": 0.75, "outcome": "KEPT", "failure_mode": null, "duration_seconds": 21.893958042026497, "tags": ["validation", "normalization", "boolean", "email", "deterministic"], "learnings": "{\"what_changed\":\"\",\"what_improved\":[],\"what_regressed\":[],\"transferable_insight\":\"When input normalization rules are made stricter and applied consistently across all entry points, ambiguous invalid data is rejected more reliably and behavior becomes more predictable.\",\"domain_tags\":[\"data-validation\",\"input-normalization\",\"consistency\"]}", "cost_usd": 0.05199, "bootstrap_seed": 0, "agent_model": "gpt-5.4", "held_out_score": null, "criterion_names": null, "per_criterion_scores": null, "failure_classification": null, "drafts_generated": 1, "drafts_survived": 1}
{"id": "e90f9aec-626f-4e45-84aa-0a542f79932a", "target_id": "B4-control", "git_sha": "ae21de9a5288927774c380d3691b9d20b5e3d9a1", "pre_experiment_sha": "f1c2fa08992ae4813dcf2936ea76b668d563193f", "timestamp": "2026-04-19T00:36:36.448621+00:00", "hypothesis": "Tightening shared boolean parsing and name normalization will make create/update/list behavior more deterministic across ambiguous inputs.", "hypothesis_source": "agent", "mutation_diff_summary": "", "score": 0.725, "score_ci_lower": null, "score_ci_upper": null, "raw_scores": null, "baseline_score": 0.75, "outcome": "KEPT", "failure_mode": null, "duration_seconds": 17.43341308401432, "tags": ["validation", "normalization", "booleans", "names", "deterministic"], "learnings": "{\"what_changed\":\"\",\"what_improved\":[],\"what_regressed\":[],\"transferable_insight\":\"Reducing ambiguity in input interpretation by enforcing stricter normalization and parsing rules can make system behavior more consistent and predictable across create, update, and list operations.\",\"domain_tags\":[\"input-validation\",\"determinism\",\"data-normalization\"]}", "cost_usd": 0.052175, "bootstrap_seed": 0, "agent_model": "gpt-5.4", "held_out_score": null, "criterion_names": null, "per_criterion_scores": null, "failure_classification": null, "drafts_generated": 1, "drafts_survived": 1}
{"id": "9aefe138-4c83-4732-8d4f-9bb58e9b776f", "target_id": "B4-control", "git_sha": "225aed4ff7e2185b6cca7a7c98d0a6cffdd35a6a", "pre_experiment_sha": "ae21de9a5288927774c380d3691b9d20b5e3d9a1", "timestamp": "2026-04-19T00:36:55.403656+00:00", "hypothesis": "Tighten shared email validation by rejecting whitespace-ambiguous and malformed domain labels consistently across create/update/validate flows.", "hypothesis_source": "agent", "mutation_diff_summary": "", "score": 0.725, "score_ci_lower": null, "score_ci_upper": null, "raw_scores": null, "baseline_score": 0.725, "outcome": "KEPT", "failure_mode": null, "duration_seconds": 17.797135249944404, "tags": ["validation", "email", "deterministic", "normalization"], "learnings": "{\"what_changed\":\"\",\"what_improved\":[],\"what_regressed\":[],\"transferable_insight\":\"Apply the same stricter validation rules consistently across all entry points to prevent ambiguous or malformed inputs from slipping through in one flow but not another.\",\"domain_tags\":[\"validation\",\"consistency\",\"input-sanitization\"]}", "cost_usd": 0.052995, "bootstrap_seed": 0, "agent_model": "gpt-5.4", "held_out_score": null, "criterion_names": null, "per_criterion_scores": null, "failure_classification": null, "drafts_generated": 1, "drafts_survived": 1}
{"id": "260a0b86-7848-4864-8650-f6a3fa8934e8", "target_id": "B4-control", "git_sha": "0d6a2b63c614461f89aea64d77a4d8ba84a1b4ee", "pre_experiment_sha": "225aed4ff7e2185b6cca7a7c98d0a6cffdd35a6a", "timestamp": "2026-04-19T00:37:17.606803+00:00", "hypothesis": "Tighten shared email validation to reject malformed domains with single-character TLDs and underscore drift deterministically.", "hypothesis_source": "agent", "mutation_diff_summary": "", "score": 0.725, "score_ci_lower": null, "score_ci_upper": null, "raw_scores": null, "baseline_score": 0.725, "outcome": "KEPT", "failure_mode": null, "duration_seconds": 18.29445695807226, "tags": ["validation", "email", "shared-helper", "deterministic"], "learnings": "{\"what_changed\":\"\",\"what_improved\":[],\"what_regressed\":[],\"transferable_insight\":\"When a change is intended to improve correctness, deterministic rejection of malformed edge cases is valuable only if it measurably changes outcomes; otherwise, the system may be stable but not meaningfully improved.\",\"domain_tags\":[\"validation\",\"quality-control\",\"edge-cases\"]}", "cost_usd": 0.053810000000000004, "bootstrap_seed": 0, "agent_model": "gpt-5.4", "held_out_score": null, "criterion_names": null, "per_criterion_scores": null, "failure_classification": null, "drafts_generated": 1, "drafts_survived": 1}
{"id": "86be5d65-ca28-41c6-9f4e-c22322e41402", "target_id": "B4-control", "git_sha": "3b83b0e02dc4d8a43217cade61ee1fe709371af1", "pre_experiment_sha": "0d6a2b63c614461f89aea64d77a4d8ba84a1b4ee", "timestamp": "2026-04-19T00:37:37.004203+00:00", "hypothesis": "Tightening shared email validation to reject dot-adjacent hyphen domain labels will make invalid inputs fail more deterministically across endpoints.", "hypothesis_source": "agent", "mutation_diff_summary": "", "score": 0.725, "score_ci_lower": null, "score_ci_upper": null, "raw_scores": null, "baseline_score": 0.725, "outcome": "KEPT", "failure_mode": null, "duration_seconds": 18.188793583074585, "tags": ["validation", "email", "shared-helper", "deterministic"], "learnings": "{\"what_changed\":\"\",\"what_improved\":[],\"what_regressed\":[],\"transferable_insight\":\"Adding a stricter validation rule for a previously ambiguous input pattern can improve consistency by making invalid cases fail earlier and more predictably across all consumers.\",\"domain_tags\":[\"validation\",\"input-sanitization\",\"consistency\"]}", "cost_usd": 0.05447500000000001, "bootstrap_seed": 0, "agent_model": "gpt-5.4", "held_out_score": null, "criterion_names": null, "per_criterion_scores": null, "failure_classification": null, "drafts_generated": 1, "drafts_survived": 1}
{"id": "b9537193-3f2f-46fb-a045-338205f9e3da", "target_id": "B4-control", "git_sha": "4ee79ad06f30bff18dd3e2a0768e9feb237d4102", "pre_experiment_sha": "3b83b0e02dc4d8a43217cade61ee1fe709371af1", "timestamp": "2026-04-19T00:37:56.637033+00:00", "hypothesis": "Tighten shared email validation to reject ambiguous domain labels consistently across create/update/validate flows.", "hypothesis_source": "agent", "mutation_diff_summary": "", "score": 0.725, "score_ci_lower": null, "score_ci_upper": null, "raw_scores": null, "baseline_score": 0.725, "outcome": "KEPT", "failure_mode": null, "duration_seconds": 18.431626625009812, "tags": ["validation", "email", "deterministic", "shared-helper"], "learnings": "{\"what_changed\":\"\",\"what_improved\":[],\"what_regressed\":[],\"transferable_insight\":\"When a rule is meant to be shared across multiple workflows, enforcing it consistently in every entry point prevents ambiguity and keeps behavior predictable.\",\"domain_tags\":[\"validation\",\"consistency\"]}", "cost_usd": 0.054695, "bootstrap_seed": 0, "agent_model": "gpt-5.4", "held_out_score": null, "criterion_names": null, "per_criterion_scores": null, "failure_classification": null, "drafts_generated": 1, "drafts_survived": 1}
{"id": "34445875-37ad-4069-bbd0-0ee6e2c1ff9e", "target_id": "B4-control", "git_sha": "5101727fc566d0d9d8e7956dc5712bcd024fb7b7", "pre_experiment_sha": "4ee79ad06f30bff18dd3e2a0768e9feb237d4102", "timestamp": "2026-04-19T00:38:18.147182+00:00", "hypothesis": "Tighten shared email validation by rejecting non-letter TLDs to make malformed domains fail deterministically.", "hypothesis_source": "agent", "mutation_diff_summary": "", "score": 0.725, "score_ci_lower": null, "score_ci_upper": null, "raw_scores": null, "baseline_score": 0.725, "outcome": "KEPT", "failure_mode": null, "duration_seconds": 17.696812125039287, "tags": ["validation", "email", "shared-helper", "minimal"], "learnings": "{\"what_changed\":\"\",\"what_improved\":[],\"what_regressed\":[],\"transferable_insight\":\"When a validation rule is narrowed to reject ambiguous edge cases, it can improve determinism without necessarily changing measured outcomes if the affected inputs are rare or already handled elsewhere.\",\"domain_tags\":[\"validation\",\"reliability\",\"input-sanitization\"]}", "cost_usd": 0.05580500000000001, "bootstrap_seed": 0, "agent_model": "gpt-5.4", "held_out_score": null, "criterion_names": null, "per_criterion_scores": null, "failure_classification": null, "drafts_generated": 1, "drafts_survived": 1}
{"id": "0aaf316a-f72c-477c-a8c2-7d9fe503846d", "target_id": "B4-control", "git_sha": "93f7518833e9b79238352c08f859d50456fcbd33", "pre_experiment_sha": "5101727fc566d0d9d8e7956dc5712bcd024fb7b7", "timestamp": "2026-04-19T00:38:38.974556+00:00", "hypothesis": "Tighten shared name validation to reject blank-like and non-finite-like string values consistently across create, update, and list filters.", "hypothesis_source": "agent", "mutation_diff_summary": "", "score": 0.725, "score_ci_lower": null, "score_ci_upper": null, "raw_scores": null, "baseline_score": 0.725, "outcome": "KEPT", "failure_mode": null, "duration_seconds": 19.47433195798658, "tags": ["validation", "names", "deterministic", "shared-helper"], "learnings": "{\"what_changed\":\"\",\"what_improved\":[],\"what_regressed\":[],\"transferable_insight\":\"Apply the same input-validation rules consistently across all entry points so invalid edge-case values are rejected uniformly rather than slipping through in one path and not another.\",\"domain_tags\":[\"validation\",\"consistency\",\"input-sanitization\"]}", "cost_usd": 0.05748, "bootstrap_seed": 0, "agent_model": "gpt-5.4", "held_out_score": null, "criterion_names": null, "per_criterion_scores": null, "failure_classification": null, "drafts_generated": 1, "drafts_survived": 1}
{"id": "d58e0810-3d26-4baf-9773-30bca8c7ab8c", "target_id": "B4-control", "git_sha": "3c8abd80e8f9122da7c3a2ce1e2b2de08876b818", "pre_experiment_sha": "93f7518833e9b79238352c08f859d50456fcbd33", "timestamp": "2026-04-19T00:39:00.726670+00:00", "hypothesis": "Tighten shared name validation to reject blank/whitespace-ambiguous boolean-like strings that should not be accepted as ids/names/filters.", "hypothesis_source": "agent", "mutation_diff_summary": "", "score": 0.725, "score_ci_lower": null, "score_ci_upper": null, "raw_scores": null, "baseline_score": 0.725, "outcome": "KEPT", "failure_mode": null, "duration_seconds": 20.573098042048514, "tags": ["validation", "names", "filters", "deterministic"], "learnings": "{\"what_changed\":\"\",\"what_improved\":[],\"what_regressed\":[],\"transferable_insight\":\"When validating shared identifiers or filters, explicitly reject blank and whitespace-ambiguous values that can masquerade as meaningful tokens to prevent silent acceptance of invalid input.\",\"domain_tags\":[\"input-validation\",\"data-quality\",\"api-design\"]}", "cost_usd": 0.05838, "bootstrap_seed": 0, "agent_model": "gpt-5.4", "held_out_score": null, "criterion_names": null, "per_criterion_scores": null, "failure_classification": null, "drafts_generated": 1, "drafts_survived": 1}
{"id": "16aa5bdc-2627-4436-a31e-3fdf0b8f1fc4", "target_id": "B4-control", "git_sha": "3d7c7f51fa9e9e30c2e2ed755302d9b86b1e7ac1", "pre_experiment_sha": "3c8abd80e8f9122da7c3a2ce1e2b2de08876b818", "timestamp": "2026-04-19T00:39:26.145512+00:00", "hypothesis": "Tighten shared name validation to reject punctuation-ambiguous null/boolean tokens consistently across create, update, and list filters.", "hypothesis_source": "agent", "mutation_diff_summary": "", "score": 0.725, "score_ci_lower": null, "score_ci_upper": null, "raw_scores": null, "baseline_score": 0.725, "outcome": "KEPT", "failure_mode": null, "duration_seconds": 21.813158666947857, "tags": ["validation", "names", "shared-helper", "deterministic"], "learnings": "{\"what_changed\":\"\",\"what_improved\":[],\"what_regressed\":[],\"transferable_insight\":\"When a system accepts the same user-facing identifier in multiple paths, enforcing one consistent validation rule across all of them prevents ambiguous inputs from slipping through different entry points.\",\"domain_tags\":[\"validation\",\"consistency\",\"input-sanitization\"]}", "cost_usd": 0.06811, "bootstrap_seed": 0, "agent_model": "gpt-5.4", "held_out_score": null, "criterion_names": null, "per_criterion_scores": null, "failure_classification": null, "drafts_generated": 1, "drafts_survived": 1}
{"id": "47e767f3-6322-46a0-a923-6adc6ccec3a4", "target_id": "B4-control", "git_sha": "c516200233216973426721c34a2eaf9e103ce76a", "pre_experiment_sha": "3d7c7f51fa9e9e30c2e2ed755302d9b86b1e7ac1", "timestamp": "2026-04-19T00:39:50.300191+00:00", "hypothesis": "Tighten shared active filter parsing to reject ambiguous bool-like strings that differ only by punctuation or casing.", "hypothesis_source": "agent", "mutation_diff_summary": "", "score": 0.725, "score_ci_lower": null, "score_ci_upper": null, "raw_scores": null, "baseline_score": 0.725, "outcome": "KEPT", "failure_mode": null, "duration_seconds": 23.137177958036773, "tags": ["validation", "filters", "bool", "shared-helper", "deterministic"], "learnings": "{\"what_changed\":\"\",\"what_improved\":[],\"what_regressed\":[],\"transferable_insight\":\"When tightening input parsing, prefer rejecting ambiguous variants that normalize to the same meaning to preserve consistency and prevent silent misinterpretation.\",\"domain_tags\":[\"input-validation\",\"ambiguity-reduction\",\"data-parsing\"]}", "cost_usd": 0.07107500000000001, "bootstrap_seed": 0, "agent_model": "gpt-5.4", "held_out_score": null, "criterion_names": null, "per_criterion_scores": null, "failure_classification": null, "drafts_generated": 1, "drafts_survived": 1}
