{"id": "2a0c27a0-223d-4025-95d7-181677b98752", "target_id": "B4-control", "git_sha": "b18f56e8ea033c0f698d03dc122fc0c7877e993f", "pre_experiment_sha": "b18f56e8ea033c0f698d03dc122fc0c7877e993f", "timestamp": "2026-04-21T22:26:34.748970+00:00", "hypothesis": "Fast-path `validate_email` using tuple unpacking and a `try/except ValueError` block to reduce validation overhead for valid emails while preserving exact validation semantics.", "hypothesis_source": "agent", "mutation_diff_summary": "", "score": 0.525, "score_ci_lower": null, "score_ci_upper": null, "raw_scores": null, "baseline_score": 0.525, "outcome": "DISCARDED", "failure_mode": null, "duration_seconds": 66.34288245812058, "tags": ["fast-path", "tuple-unpacking", "overhead-reduction"], "learnings": "{\"what_changed\":\"\",\"what_improved\":[],\"what_regressed\":[],\"transferable_insight\":\"Introducing exception-based fast-paths for validation routines may fail to reduce overhead or improve performance, rendering the optimization ineffective.\",\"domain_tags\":[\"Performance Optimization\",\"Exception Handling\",\"Validation\"]}", "cost_usd": 0.015173800000000001, "bootstrap_seed": 0, "agent_model": "gemini-3.1-pro-preview", "held_out_score": null, "criterion_names": null, "per_criterion_scores": null, "failure_classification": {"category": "logic_error", "description": "The proposed 'fast-path' optimization strategy, which involved using tuple unpacking and a `try/except ValueError` block, likely failed due to incorrect assumptions about its performance characteristics or its ability to preserve exact validation semantics. The overhead of exception handling for `ValueError` may have proven more costly than the original validation logic, or the specific error conditions caught by the `try/except` block did not precisely align with the original semantics, leading to incorrect validation results or performance degradation, as indicated by the low score of 0.5250.", "fix_direction": "1. **Re-evaluate Assumptions:** Verify the fundamental assumption that `try/except ValueError` combined with tuple unpacking is an effective 'fast-path' for `validate_email`, especially considering the frequency and cost of exception handling in the target environment. 2. **Detailed Profiling:** Conduct thorough performance profiling on both the original and proposed implementations using a diverse dataset of valid and invalid emails to pinpoint the exact performance bottlenecks. 3. **Semantic Alignment:** Meticulously review and test how the `ValueError` is raised and handled to ensure it precisely mimics the original `validate_email`'s pass/fail criteria across all edge cases, preventing any `semantic_drift`. 4. **Alternative Optimizations:** If this approach proves unsuitable, explore alternative optimization techniques for email validation that may offer better performance and semantic fidelity.", "confidence": 0.95}, "drafts_generated": 1, "drafts_survived": 1}
{"id": "fe8b9e04-3088-45fe-b65a-45c72b805471", "target_id": "B4-control", "git_sha": "e39b467df743aa10b4879bc980c7467cd12605e1", "pre_experiment_sha": "b18f56e8ea033c0f698d03dc122fc0c7877e993f", "timestamp": "2026-04-21T22:28:03.089552+00:00", "hypothesis": "Optimize `validate_email` by replacing the list length check with a `try/except ValueError` block using tuple unpacking to fast-path valid emails, strictly preserving the exact validation logic.", "hypothesis_source": "agent", "mutation_diff_summary": "", "score": 0.525, "score_ci_lower": null, "score_ci_upper": null, "raw_scores": null, "baseline_score": 0.525, "outcome": "KEPT", "failure_mode": null, "duration_seconds": 64.16098616598174, "tags": ["fast-path", "tuple-unpacking", "exception-handling"], "learnings": "{\"what_changed\":\"\",\"what_improved\":[],\"what_regressed\":[],\"transferable_insight\":\"Replacing explicit length checks with exception handling for tuple unpacking optimizes the execution of expected valid inputs by avoiding redundant conditional evaluations.\",\"domain_tags\":[\"Code Optimization\",\"Exception Handling\",\"Software Engineering\"]}", "cost_usd": 0.015000000000000001, "bootstrap_seed": 0, "agent_model": "gemini-3.1-pro-preview", "held_out_score": null, "criterion_names": null, "per_criterion_scores": null, "failure_classification": null, "drafts_generated": 1, "drafts_survived": 1}
{"id": "221bf14c-971e-42a6-8010-79f12579202b", "target_id": "B4-control", "git_sha": "a1a10276ed5a71940dd9214eb268cf3a91f7d08e", "pre_experiment_sha": "e39b467df743aa10b4879bc980c7467cd12605e1", "timestamp": "2026-04-21T22:29:44.722385+00:00", "hypothesis": "Simplify dictionary lookups using `.get()` with a sentinel and direct deletion in `delete_user`, while fast-pathing `validate_email` by replacing the `bool()` call with a direct boolean return.", "hypothesis_source": "agent", "mutation_diff_summary": "", "score": 0.525, "score_ci_lower": null, "score_ci_upper": null, "raw_scores": null, "baseline_score": 0.525, "outcome": "KEPT", "failure_mode": null, "duration_seconds": 93.20770108303986, "tags": ["dict-get", "exception-handling", "fast-path", "unroll"], "learnings": "{\"what_changed\":\"\",\"what_improved\":[],\"what_regressed\":[],\"transferable_insight\":\"Streamlining data structure lookups and removing redundant type conversions simplifies code logic and improves readability without altering execution performance.\",\"domain_tags\":[\"Code Refactoring\",\"Data Structures\",\"Micro-optimization\"]}", "cost_usd": 0.01591, "bootstrap_seed": 0, "agent_model": "gemini-3.1-pro-preview", "held_out_score": null, "criterion_names": null, "per_criterion_scores": null, "failure_classification": null, "drafts_generated": 1, "drafts_survived": 1}
{"id": "f90cd711-8117-449c-bac6-7fd8a5d85fdc", "target_id": "B4-control", "git_sha": "cc562d58cddc488acbbbcd35104501fbd33c8bcd", "pre_experiment_sha": "a1a10276ed5a71940dd9214eb268cf3a91f7d08e", "timestamp": "2026-04-21T22:31:24.688004+00:00", "hypothesis": "Use direct dictionary item access with `KeyError` handling instead of `.get()` in `get_user` and `update_user` to reduce overhead, fast-path empty filters in `list_users`, and simplify truthiness checks in `validate_email`.", "hypothesis_source": "agent", "mutation_diff_summary": "", "score": 0.525, "score_ci_lower": null, "score_ci_upper": null, "raw_scores": null, "baseline_score": 0.525, "outcome": "KEPT", "failure_mode": null, "duration_seconds": 83.06812058296055, "tags": ["dictionary-access", "exception-handling", "filter-optimization"], "learnings": "{\"what_changed\":\"\",\"what_improved\":[],\"what_regressed\":[],\"transferable_insight\":\"Replacing safe-access methods with exception handling for missing keys and adding minor fast-paths often yields negligible performance differences, making the choice more about code style than optimization.\",\"domain_tags\":[\"Performance Optimization\",\"Exception Handling\",\"Code Style\"]}", "cost_usd": 0.01659625, "bootstrap_seed": 0, "agent_model": "gemini-3.1-pro-preview", "held_out_score": null, "criterion_names": null, "per_criterion_scores": null, "failure_classification": null, "drafts_generated": 1, "drafts_survived": 1}
{"id": "60e6b77f-2810-4758-9ca9-e8ba677f4b85", "target_id": "B4-control", "git_sha": "28b3b2c7e2c4ba498938854f9ba543b19dccef8c", "pre_experiment_sha": "cc562d58cddc488acbbbcd35104501fbd33c8bcd", "timestamp": "2026-04-21T22:32:51.576399+00:00", "hypothesis": "Optimize `validate_email` to use direct boolean returns instead of truthy evaluation checks, and pre-resolve `db.values()` in `list_users` to avoid repeated dictionary view creation.", "hypothesis_source": "agent", "mutation_diff_summary": "", "score": 0.525, "score_ci_lower": null, "score_ci_upper": null, "raw_scores": null, "baseline_score": 0.525, "outcome": "KEPT", "failure_mode": null, "duration_seconds": 79.43579070782289, "tags": ["fast-path", "boolean-return", "dictionary-view-caching"], "learnings": "{\"what_changed\":\"\",\"what_improved\":[],\"what_regressed\":[],\"transferable_insight\":\"Low-level micro-optimizations, such as simplifying boolean evaluations or caching collection views, often yield negligible performance gains unless applied within highly iterative critical paths.\",\"domain_tags\":[\"Performance Optimization\",\"Micro-optimization\",\"Code Refactoring\"]}", "cost_usd": 0.01646125, "bootstrap_seed": 0, "agent_model": "gemini-3.1-pro-preview", "held_out_score": null, "criterion_names": null, "per_criterion_scores": null, "failure_classification": null, "drafts_generated": 1, "drafts_survived": 1}
{"id": "640b029b-f911-4258-83db-c3696432bef1", "target_id": "B4-control", "git_sha": "47d85908cce8b559c975084509ff6ba733bd50e1", "pre_experiment_sha": "28b3b2c7e2c4ba498938854f9ba543b19dccef8c", "timestamp": "2026-04-21T22:34:37.061150+00:00", "hypothesis": "Optimize `create_user` to use faster positional arguments for `User` instantiation, return `False` directly in `validate_email`'s exception handler to avoid fall-through overhead, and inline dictionary definitions in `list_users` for more compact bytecode layout.", "hypothesis_source": "agent", "mutation_diff_summary": "", "score": 0.525, "score_ci_lower": null, "score_ci_upper": null, "raw_scores": null, "baseline_score": 0.525, "outcome": "KEPT", "failure_mode": null, "duration_seconds": 99.8088165000081, "tags": ["micro-optimization", "positional-args", "fast-path"], "learnings": "{\"what_changed\":\"\",\"what_improved\":[],\"what_regressed\":[],\"transferable_insight\":\"Low-level micro-optimizations, such as using positional arguments or inlining data structures, often yield negligible performance improvements and rarely justify the associated reduction in code readability.\",\"domain_tags\":[\"Code Optimization\",\"Micro-optimization\",\"Software Engineering\"]}", "cost_usd": 0.015711250000000003, "bootstrap_seed": 0, "agent_model": "gemini-3.1-pro-preview", "held_out_score": null, "criterion_names": null, "per_criterion_scores": null, "failure_classification": null, "drafts_generated": 1, "drafts_survived": 1}
{"id": "cc0f28ba-450c-4524-a109-505022667a6c", "target_id": "B4-control", "git_sha": "b79c42b8b2dea79eeb887d86520f9d0ace12e164", "pre_experiment_sha": "47d85908cce8b559c975084509ff6ba733bd50e1", "timestamp": "2026-04-21T22:35:59.147599+00:00", "hypothesis": "Replace `.get()` with direct dictionary item access and `KeyError` handling in `update_user` and `list_users` to reduce function call overhead, and remove the unused `_sentinel` object.", "hypothesis_source": "agent", "mutation_diff_summary": "", "score": 0.525, "score_ci_lower": null, "score_ci_upper": null, "raw_scores": null, "baseline_score": 0.525, "outcome": "KEPT", "failure_mode": null, "duration_seconds": 62.42525216587819, "tags": ["dictionary-access", "keyerror-handling", "remove-sentinel"], "learnings": "{\"what_changed\":\"\",\"what_improved\":[],\"what_regressed\":[],\"transferable_insight\":\"Replacing built-in dictionary retrieval methods with direct key access and exception handling yields negligible performance gains, indicating that the method call overhead is rarely a meaningful bottleneck.\",\"domain_tags\":[\"Performance Optimization\",\"Code Refactoring\",\"Software Engineering\"]}", "cost_usd": 0.015182500000000002, "bootstrap_seed": 0, "agent_model": "gemini-3.1-pro-preview", "held_out_score": null, "criterion_names": null, "per_criterion_scores": null, "failure_classification": null, "drafts_generated": 1, "drafts_survived": 1}
{"id": "2ec62996-d99b-4ce2-b082-64b60386d10d", "target_id": "B4-control", "git_sha": "99e88532b402203bde6a5f2934a687b20100b6d4", "pre_experiment_sha": "b79c42b8b2dea79eeb887d86520f9d0ace12e164", "timestamp": "2026-04-21T22:37:10.559081+00:00", "hypothesis": "Replace `data.get(\"age\", 0)` with a `try/except KeyError` block in `create_user` to avoid method call overhead, and add an early `return False` in `validate_email` when the local part is empty to prevent fall-through overhead.", "hypothesis_source": "agent", "mutation_diff_summary": "", "score": 0.525, "score_ci_lower": null, "score_ci_upper": null, "raw_scores": null, "baseline_score": 0.525, "outcome": "KEPT", "failure_mode": null, "duration_seconds": 62.27632583398372, "tags": ["dictionary-access", "micro-optimization", "exception-handling"], "learnings": "{\"what_changed\":\"\",\"what_improved\":[],\"what_regressed\":[],\"transferable_insight\":\"Micro-optimizing standard data access patterns and adding early returns for rare edge cases often yields no measurable performance benefits, indicating that such low-level overheads are usually negligible.\",\"domain_tags\":[\"Performance Optimization\",\"Micro-optimization\",\"Code Refactoring\"]}", "cost_usd": 0.01550375, "bootstrap_seed": 0, "agent_model": "gemini-3.1-pro-preview", "held_out_score": null, "criterion_names": null, "per_criterion_scores": null, "failure_classification": null, "drafts_generated": 1, "drafts_survived": 1}
{"id": "654950d1-b36f-4cc6-9fb8-07099f58e875", "target_id": "B4-control", "git_sha": "fa7927f8a64f3cf7efb6b670dda42ef588610de8", "pre_experiment_sha": "99e88532b402203bde6a5f2934a687b20100b6d4", "timestamp": "2026-04-21T22:38:29.165674+00:00", "hypothesis": "Pre-resolve `db.values()` into a list in `list_users` to avoid repeated dictionary view iteration overhead, improving iteration speed in CPython.", "hypothesis_source": "agent", "mutation_diff_summary": "", "score": 0.525, "score_ci_lower": null, "score_ci_upper": null, "raw_scores": null, "baseline_score": 0.525, "outcome": "KEPT", "failure_mode": null, "duration_seconds": 71.63083070795983, "tags": ["optimization", "dict-view", "pre-resolve", "fast-path"], "learnings": "{\"what_changed\":\"\",\"what_improved\":[],\"what_regressed\":[],\"transferable_insight\":\"Converting dynamic data views into static collections prior to repeated access eliminates redundant evaluation overhead.\",\"domain_tags\":[\"Performance Optimization\",\"Data Structures\",\"Iteration\"]}", "cost_usd": 0.015303750000000001, "bootstrap_seed": 0, "agent_model": "gemini-3.1-pro-preview", "held_out_score": null, "criterion_names": null, "per_criterion_scores": null, "failure_classification": null, "drafts_generated": 1, "drafts_survived": 1}
{"id": "f8988e02-0d38-4be6-a6a5-48f287a25636", "target_id": "B4-control", "git_sha": "db586f1602a1a2fdc6a133095b51e34ab56e271a", "pre_experiment_sha": "fa7927f8a64f3cf7efb6b670dda42ef588610de8", "timestamp": "2026-04-21T22:40:09.917893+00:00", "hypothesis": "Combine the dictionary access and `.lower()` method call in `list_users` to slightly reduce bytecode size and improve execution speed.", "hypothesis_source": "agent", "mutation_diff_summary": "", "score": 0.525, "score_ci_lower": null, "score_ci_upper": null, "raw_scores": null, "baseline_score": 0.525, "outcome": "KEPT", "failure_mode": null, "duration_seconds": 78.52663354203105, "tags": ["micro-optimization", "bytecode-reduction"], "learnings": "{\"what_changed\":\"\",\"what_improved\":[],\"what_regressed\":[],\"transferable_insight\":\"Consolidating sequential operations into a single expression for micro-optimization rarely provides measurable performance gains, though it may be retained for stylistic conciseness.\",\"domain_tags\":[\"Micro-optimization\",\"Code Refactoring\",\"Performance\"]}", "cost_usd": 0.015211250000000003, "bootstrap_seed": 0, "agent_model": "gemini-3.1-pro-preview", "held_out_score": null, "criterion_names": null, "per_criterion_scores": null, "failure_classification": null, "drafts_generated": 1, "drafts_survived": 1}
{"id": "532de4b0-39a7-45df-a794-9fe064c79296", "target_id": "B4-control", "git_sha": "14a6d61946d4b64625f762c1ec30a1e30c91be24", "pre_experiment_sha": "db586f1602a1a2fdc6a133095b51e34ab56e271a", "timestamp": "2026-04-21T22:42:01.146377+00:00", "hypothesis": "Refactor `validate_email` to use an early `return False` when the local part is empty, aligning perfectly with the optimization strategy to flatten the conditional logic while preserving strict validation behavior.", "hypothesis_source": "agent", "mutation_diff_summary": "", "score": 0.525, "score_ci_lower": null, "score_ci_upper": null, "raw_scores": null, "baseline_score": 0.525, "outcome": "KEPT", "failure_mode": null, "duration_seconds": 105.6085302089341, "tags": ["micro-optimization", "early-return", "validation"], "learnings": "{\"what_changed\":\"\",\"what_improved\":[],\"what_regressed\":[],\"transferable_insight\":\"Flattening conditional logic through early returns for invalid states improves code maintainability and readability, even when it yields no direct performance gains.\",\"domain_tags\":[\"Code Refactoring\",\"Software Engineering\",\"Clean Code\"]}", "cost_usd": 0.015358750000000003, "bootstrap_seed": 0, "agent_model": "gemini-3.1-pro-preview", "held_out_score": null, "criterion_names": null, "per_criterion_scores": null, "failure_classification": null, "drafts_generated": 1, "drafts_survived": 1}
{"id": "781a8bd1-3d50-4deb-8d6a-63594f2e6d1d", "target_id": "B4-control", "git_sha": "97acd25e305a3958304a5b441444168638a015b7", "pre_experiment_sha": "14a6d61946d4b64625f762c1ec30a1e30c91be24", "timestamp": "2026-04-21T22:43:42.578979+00:00", "hypothesis": "Cache constant error response tuples globally to reduce allocation overhead, and use local variables for dictionary values in `create_user` to avoid redundant attribute lookups.", "hypothesis_source": "agent", "mutation_diff_summary": "", "score": 0.525, "score_ci_lower": null, "score_ci_upper": null, "raw_scores": null, "baseline_score": 0.525, "outcome": "KEPT", "failure_mode": null, "duration_seconds": 95.98279033298604, "tags": ["caching", "local-variables", "dict-allocation"], "learnings": "{\"what_changed\":\"\",\"what_improved\":[],\"what_regressed\":[],\"transferable_insight\":\"Pre-allocating constant values globally and aliasing frequently accessed properties to local variables minimizes redundant memory allocations and lookup overhead.\",\"domain_tags\":[\"Performance Optimization\",\"Memory Management\",\"Micro-optimization\"]}", "cost_usd": 0.01607, "bootstrap_seed": 0, "agent_model": "gemini-3.1-pro-preview", "held_out_score": null, "criterion_names": null, "per_criterion_scores": null, "failure_classification": null, "drafts_generated": 1, "drafts_survived": 1}
{"id": "50ac1476-490e-4101-b521-701ea853a1b5", "target_id": "B4-control", "git_sha": "ea94ad33a669a865b8481586683ce8a894b240e1", "pre_experiment_sha": "97acd25e305a3958304a5b441444168638a015b7", "timestamp": "2026-04-21T22:47:12.825450+00:00", "hypothesis": "Assign `_next_id` to a local variable `uid` in `create_user` to avoid redundant attribute and global lookups during object instantiation, dictionary assignment, and response creation.", "hypothesis_source": "agent", "mutation_diff_summary": "", "score": 0.525, "score_ci_lower": null, "score_ci_upper": null, "raw_scores": null, "baseline_score": 0.525, "outcome": "KEPT", "failure_mode": null, "duration_seconds": 53.25438950001262, "tags": ["optimization", "local-variables", "attribute-lookup"], "learnings": "{\"what_changed\":\"\",\"what_improved\":[],\"what_regressed\":[],\"transferable_insight\":\"Assigning frequently accessed global or instance attributes to local variables can reduce lookup overhead, even if the measurable performance gain is negligible.\",\"domain_tags\":[\"Software Engineering\",\"Performance Optimization\",\"Code Refactoring\"]}", "cost_usd": 0.01634125, "bootstrap_seed": 0, "agent_model": "gemini-3.1-pro-preview", "held_out_score": null, "criterion_names": null, "per_criterion_scores": null, "failure_classification": null, "drafts_generated": 1, "drafts_survived": 1}
{"id": "7341d594-81f5-4647-97c6-94784d86b749", "target_id": "B4-control", "git_sha": "f938b07edd1b8376aa16ebfd20a8109bf12cfc7c", "pre_experiment_sha": "ea94ad33a669a865b8481586683ce8a894b240e1", "timestamp": "2026-04-21T22:51:31.936095+00:00", "hypothesis": "Optimize `list_users` by splitting compound `and` conditions into nested `if` statements to avoid operator overhead, and alias `u.name` to a local variable to eliminate redundant attribute lookups during filtering and dictionary construction.", "hypothesis_source": "agent", "mutation_diff_summary": "", "score": 0.525, "score_ci_lower": null, "score_ci_upper": null, "raw_scores": null, "baseline_score": 0.525, "outcome": "KEPT", "failure_mode": null, "duration_seconds": 170.93811687501147, "tags": ["micro-optimization", "attribute-caching", "loop-unrolling"], "learnings": "{\"what_changed\":\"\",\"what_improved\":[],\"what_regressed\":[],\"transferable_insight\":\"Micro-optimizations such as splitting compound boolean conditions into nested conditionals and aliasing object attributes to local variables often yield negligible performance benefits.\",\"domain_tags\":[\"Code Optimization\",\"Performance Tuning\",\"Micro-optimization\"]}", "cost_usd": 0.016727500000000003, "bootstrap_seed": 0, "agent_model": "gemini-3.1-pro-preview", "held_out_score": null, "criterion_names": null, "per_criterion_scores": null, "failure_classification": null, "drafts_generated": 1, "drafts_survived": 1}
