{"id": "19b40644-a1a0-4e41-b36f-8c791df20166", "target_id": "B4-greedy", "git_sha": "a2b78daef57b11bce4730837a2c2b2664ae55692", "pre_experiment_sha": "a2b78daef57b11bce4730837a2c2b2664ae55692", "timestamp": "2026-04-19T16:00:53.310009+00:00", "hypothesis": "Make partial updates deterministic by applying fields in a fixed order instead of depending on input dict iteration order.", "hypothesis_source": "agent", "mutation_diff_summary": "", "score": 0.725, "score_ci_lower": null, "score_ci_upper": null, "raw_scores": null, "baseline_score": 0.725, "outcome": "DISCARDED", "failure_mode": null, "duration_seconds": 16.721026250044815, "tags": ["determinism", "ordering", "update"], "learnings": "{\"what_changed\":\"\",\"what_improved\":[],\"what_regressed\":[],\"transferable_insight\":\"When behavior depends on unordered inputs, imposing a fixed processing order can improve determinism and reproducibility without changing outcomes.\",\"domain_tags\":[\"determinism\",\"data-processing\",\"software-engineering\"]}", "cost_usd": 0.0409086, "bootstrap_seed": 0, "agent_model": "gpt-5.4", "held_out_score": null, "criterion_names": null, "per_criterion_scores": null, "failure_classification": {"category": "incomplete_edit", "description": "The attempt to make partial updates deterministic via fixed field ordering did not fully achieve consistency across all update paths, leaving some cases dependent on non-deterministic input ordering and resulting in an inconsistent or incomplete deterministic update behavior.", "fix_direction": "Ensure a single, centralized deterministic field-application order is used for all partial update flows (including nested/optional fields), and add tests that shuffle input dict order to confirm stable outputs.", "confidence": 0.62}, "drafts_generated": 1, "drafts_survived": 1}
{"id": "6f69c54d-1190-4a80-b3f5-814cc1c473a2", "target_id": "B4-greedy", "git_sha": "a2b78daef57b11bce4730837a2c2b2664ae55692", "pre_experiment_sha": "a2b78daef57b11bce4730837a2c2b2664ae55692", "timestamp": "2026-04-19T16:01:11.656279+00:00", "hypothesis": "Make partial updates deterministic by applying fields in a fixed order instead of request dict iteration order.", "hypothesis_source": "agent", "mutation_diff_summary": "", "score": 0.725, "score_ci_lower": null, "score_ci_upper": null, "raw_scores": null, "baseline_score": 0.725, "outcome": "DISCARDED", "failure_mode": null, "duration_seconds": 15.58026283304207, "tags": ["determinism", "ordering", "partial-update"], "learnings": "{\"what_changed\":\"\",\"what_improved\":[],\"what_regressed\":[],\"transferable_insight\":\"When a process depends on combining multiple inputs, enforcing a fixed application order can eliminate nondeterminism introduced by arbitrary input ordering.\",\"domain_tags\":[\"determinism\",\"data-processing\",\"software-engineering\"]}", "cost_usd": 0.040897, "bootstrap_seed": 0, "agent_model": "gpt-5.4", "held_out_score": null, "criterion_names": null, "per_criterion_scores": null, "failure_classification": {"category": "semantic_drift", "description": "The attempted fix did not actually enforce deterministic partial-update behavior as intended; results remained inconsistent, suggesting the field-application order was not made fixed/reliable (or the applied order did not match the intended schema semantics), leading to correct-looking output with incorrect behavior/meaning.", "fix_direction": "Ensure a deterministic field-application order based on an explicit schema/list (not request/dict iteration), and verify with tests that repeated updates yield identical final objects across varying input key orders.", "confidence": 0.62}, "drafts_generated": 1, "drafts_survived": 1}
{"id": "aa79a96e-fc05-45a3-9b1a-4f6dd7b835a9", "target_id": "B4-greedy", "git_sha": "a2b78daef57b11bce4730837a2c2b2664ae55692", "pre_experiment_sha": "a2b78daef57b11bce4730837a2c2b2664ae55692", "timestamp": "2026-04-19T16:01:30.177898+00:00", "hypothesis": "Make update application order deterministic by processing allowed fields in a fixed sequence instead of caller-provided dict order.", "hypothesis_source": "agent", "mutation_diff_summary": "", "score": 0.725, "score_ci_lower": null, "score_ci_upper": null, "raw_scores": null, "baseline_score": 0.725, "outcome": "DISCARDED", "failure_mode": null, "duration_seconds": 16.040229250094853, "tags": ["determinism", "ordering", "update"], "learnings": "{\"what_changed\":\"\",\"what_improved\":[],\"what_regressed\":[],\"transferable_insight\":\"When behavior depends on iterating over a collection, replacing caller-controlled ordering with a fixed internal sequence can improve determinism and reduce ambiguity, but only if the ordering actually affects outcomes.\",\"domain_tags\":[\"determinism\",\"ordering\",\"software-design\"]}", "cost_usd": 0.040922400000000005, "bootstrap_seed": 0, "agent_model": "gpt-5.4", "held_out_score": null, "criterion_names": null, "per_criterion_scores": null, "failure_classification": {"category": "logic_error", "description": "The provided metadata does not indicate any specific failure mode (it is listed as 'unknown'), so it\u2019s unclear whether the issue is a format/schema problem, a logic error, a regression, scope/syntax/semantic mismatch, or an incomplete edit.", "fix_direction": "Add instrumentation or detailed error output to identify whether the update application order was made deterministic and whether the produced results still match expected semantics/format; then adjust field-processing sequencing and validation accordingly.", "confidence": 0.12}, "drafts_generated": 1, "drafts_survived": 1}
{"id": "24448661-f334-461d-ac08-c5271857884a", "target_id": "B4-greedy", "git_sha": "a2b78daef57b11bce4730837a2c2b2664ae55692", "pre_experiment_sha": "a2b78daef57b11bce4730837a2c2b2664ae55692", "timestamp": "2026-04-19T16:01:51.955959+00:00", "hypothesis": "Make user updates deterministic by applying field mutations in a fixed order instead of request dict iteration order.", "hypothesis_source": "agent", "mutation_diff_summary": "", "score": 0.725, "score_ci_lower": null, "score_ci_upper": null, "raw_scores": null, "baseline_score": 0.725, "outcome": "DISCARDED", "failure_mode": null, "duration_seconds": 16.40568420907948, "tags": ["determinism", "ordering", "update"], "learnings": "{\"what_changed\":\"\",\"what_improved\":[],\"what_regressed\":[],\"transferable_insight\":\"When applying multiple updates to the same object, use a fixed, explicit order rather than relying on input iteration order to ensure deterministic behavior.\",\"domain_tags\":[\"determinism\",\"state-management\",\"software-engineering\"]}", "cost_usd": 0.0412208, "bootstrap_seed": 0, "agent_model": "gpt-5.4", "held_out_score": null, "criterion_names": null, "per_criterion_scores": null, "failure_classification": {"category": "semantic_drift", "description": "Field mutations were intended to be applied in a deterministic fixed order, but the experiment failed in an unknown way, suggesting the update application order produced behavior that no longer matched the intended semantics (e.g., fields updated in an order that subtly changes final user state).", "fix_direction": "Verify semantic equivalence across all update permutations: add deterministic ordering while also ensuring dependent fields are updated in the correct dependency-aware sequence; include property-based tests comparing results against a reference implementation that defines the correct final state.", "confidence": 0.62}, "drafts_generated": 1, "drafts_survived": 1}
{"id": "ba0b4f27-c04b-4c3c-8c3b-dd80d6460a5a", "target_id": "B4-greedy", "git_sha": "a2b78daef57b11bce4730837a2c2b2664ae55692", "pre_experiment_sha": "a2b78daef57b11bce4730837a2c2b2664ae55692", "timestamp": "2026-04-19T16:02:13.946279+00:00", "hypothesis": "Make user updates deterministic by applying fields in a fixed order instead of request dict iteration order.", "hypothesis_source": "agent", "mutation_diff_summary": "", "score": 0.725, "score_ci_lower": null, "score_ci_upper": null, "raw_scores": null, "baseline_score": 0.725, "outcome": "DISCARDED", "failure_mode": null, "duration_seconds": 18.895531958900392, "tags": ["determinism", "ordering", "update"], "learnings": "{\"what_changed\":\"\",\"what_improved\":[],\"what_regressed\":[],\"transferable_insight\":\"When processing unordered inputs, enforcing a fixed application order can improve determinism and reproducibility, but only if the ordering actually affects observable behavior.\",\"domain_tags\":[\"determinism\",\"data-processing\",\"software-engineering\"]}", "cost_usd": 0.04119580000000001, "bootstrap_seed": 0, "agent_model": "gpt-5.4", "held_out_score": null, "criterion_names": null, "per_criterion_scores": null, "failure_classification": {"category": "semantic_drift", "description": "Applying fields in a fixed order did not actually produce the intended deterministic user update behavior; results likely changed in meaning despite the change being structurally similar (e.g., field application order affects merge semantics, overrides, or conflict resolution in an unintended way).", "fix_direction": "Validate and align the field-ordering logic with the true merge/override rules (including conflicts, defaults, and dependencies between fields); add deterministic test cases that assert both ordering and resulting merged state.", "confidence": 0.62}, "drafts_generated": 1, "drafts_survived": 1}
{"id": "320c4eb7-70f1-47af-b1bb-7fb260a213f6", "target_id": "B4-greedy", "git_sha": "a2b78daef57b11bce4730837a2c2b2664ae55692", "pre_experiment_sha": "a2b78daef57b11bce4730837a2c2b2664ae55692", "timestamp": "2026-04-19T16:02:34.949772+00:00", "hypothesis": "Make user updates deterministic by applying fields in a fixed order instead of request dict iteration order.", "hypothesis_source": "agent", "mutation_diff_summary": "", "score": 0.725, "score_ci_lower": null, "score_ci_upper": null, "raw_scores": null, "baseline_score": 0.725, "outcome": "DISCARDED", "failure_mode": null, "duration_seconds": 17.00583295803517, "tags": ["determinism", "ordering", "update"], "learnings": "{\"what_changed\":\"\",\"what_improved\":[],\"what_regressed\":[],\"transferable_insight\":\"When a process depends on unordered inputs, enforcing a fixed application order can improve determinism and reproducibility, but only if the ordering actually affects observable behavior.\",\"domain_tags\":[\"determinism\",\"reproducibility\",\"software-engineering\"]}", "cost_usd": 0.04121820000000001, "bootstrap_seed": 0, "agent_model": "gpt-5.4", "held_out_score": null, "criterion_names": null, "per_criterion_scores": null, "failure_classification": {"category": "semantic_drift", "description": "The implementation intended to make user updates deterministic by applying fields in a fixed order, but the result did not match the intended meaning/behavior of deterministic ordering. Although the output/flow may have been structurally valid, field application order (or its effect) likely diverged from the hypothesized deterministic rule, producing inconsistent update semantics.", "fix_direction": "Verify that the field-application order exactly matches the intended fixed ordering across all paths (including nested/conditional fields), and add tests that permute input dict iteration order to confirm identical resulting updates.", "confidence": 0.68}, "drafts_generated": 1, "drafts_survived": 1}
{"id": "6399f8d8-c8f3-49df-9623-b2d0229dbcf4", "target_id": "B4-greedy", "git_sha": "a2b78daef57b11bce4730837a2c2b2664ae55692", "pre_experiment_sha": "a2b78daef57b11bce4730837a2c2b2664ae55692", "timestamp": "2026-04-19T16:02:57.284000+00:00", "hypothesis": "Make update field application order deterministic by processing allowed keys in a fixed sequence.", "hypothesis_source": "agent", "mutation_diff_summary": "", "score": 0.725, "score_ci_lower": null, "score_ci_upper": null, "raw_scores": null, "baseline_score": 0.725, "outcome": "DISCARDED", "failure_mode": null, "duration_seconds": 16.263865834102035, "tags": ["determinism", "ordering", "minimal-change"], "learnings": "{\"what_changed\":\"\",\"what_improved\":[],\"what_regressed\":[],\"transferable_insight\":\"When a change only affects the order of operations without altering the underlying logic, it may improve determinism but still produce no measurable outcome if the system already behaves effectively the same.\",\"domain_tags\":[\"systems\",\"process-control\",\"determinism\"]}", "cost_usd": 0.0412616, "bootstrap_seed": 0, "agent_model": "gpt-5.4", "held_out_score": null, "criterion_names": null, "per_criterion_scores": null, "failure_classification": {"category": "semantic_drift", "description": "Although the goal is to make update-field application order deterministic, the experiment appears to have produced behavior that does not match the intended semantics (i.e., fields are applied in an order or manner that is still not reliably deterministic/consistent with the hypothesis). The failure mode is listed as unknown, but the score suggests the change is not correctly aligned with the required meaning of deterministic processing.", "fix_direction": "Focus on enforcing an explicit, fixed key-processing sequence for allowed keys (e.g., stable sorting by a predefined key list, preserving insertion order from a canonical source, and adding tests that verify exact field-application order across runs).", "confidence": 0.7}, "drafts_generated": 1, "drafts_survived": 1}
{"id": "f172da77-977f-4094-8ac0-e585e2e0a5f6", "target_id": "B4-greedy", "git_sha": "a2b78daef57b11bce4730837a2c2b2664ae55692", "pre_experiment_sha": "a2b78daef57b11bce4730837a2c2b2664ae55692", "timestamp": "2026-04-19T16:03:16.031403+00:00", "hypothesis": "Make age validation deterministic by rejecting non-integer-coercion string/float inputs and accepting only exact int values everywhere age is normalized.", "hypothesis_source": "agent", "mutation_diff_summary": "", "score": 0.725, "score_ci_lower": null, "score_ci_upper": null, "raw_scores": null, "baseline_score": 0.725, "outcome": "DISCARDED", "failure_mode": null, "duration_seconds": 15.892317999969237, "tags": ["validation", "determinism", "age"], "learnings": "{\"what_changed\":\"\",\"what_improved\":[],\"what_regressed\":[],\"transferable_insight\":\"When normalizing inputs, strict exact-type validation can improve determinism, but it should only be adopted if it aligns with the system\u2019s real data expectations and does not unnecessarily reject legitimate values.\",\"domain_tags\":[\"validation\",\"data-normalization\",\"reliability\"]}", "cost_usd": 0.0410736, "bootstrap_seed": 0, "agent_model": "gpt-5.4", "held_out_score": null, "criterion_names": null, "per_criterion_scores": null, "failure_classification": {"category": "logic_error", "description": "The experiment intended to make age validation deterministic by rejecting non-integer-coercion string/float inputs and only accepting exact int values, but the failure mode is unclear and the low-to-moderate score (0.7250) suggests the implementation likely still accepted/rejected values incorrectly in some normalization path, yielding wrong age-validation behavior rather than a pure formatting/parsing issue.", "fix_direction": "Ensure all age normalization/validation call sites consistently use the same strict rule: accept only true integer types (or strings that match an exact integer pattern with no decimals/whitespace variants if disallowed), and explicitly reject floats and non-integer-coercible strings; add targeted tests covering edge cases (e.g., '3.0', '03', '3 ', 3.0, NaN/Infinity).", "confidence": 0.42}, "drafts_generated": 1, "drafts_survived": 1}
{"id": "389b7a5a-3c1c-4be5-bf9f-aeb996be57f1", "target_id": "B4-greedy", "git_sha": "a2b78daef57b11bce4730837a2c2b2664ae55692", "pre_experiment_sha": "a2b78daef57b11bce4730837a2c2b2664ae55692", "timestamp": "2026-04-19T16:03:36.292607+00:00", "hypothesis": "Make age validation deterministic by rejecting non-integer/coercible string inputs instead of relying on broad int() coercion.", "hypothesis_source": "agent", "mutation_diff_summary": "", "score": 0.725, "score_ci_lower": null, "score_ci_upper": null, "raw_scores": null, "baseline_score": 0.725, "outcome": "DISCARDED", "failure_mode": null, "duration_seconds": 17.22795224993024, "tags": ["validation", "determinism", "age"], "learnings": "{\"what_changed\":\"\",\"what_improved\":[],\"what_regressed\":[],\"transferable_insight\":\"When validating inputs, prefer explicit acceptance rules over broad coercion so that invalid or ambiguous values are rejected consistently and predictably.\",\"domain_tags\":[\"validation\",\"input-processing\",\"reliability\"]}", "cost_usd": 0.04216980000000001, "bootstrap_seed": 0, "agent_model": "gpt-5.4", "held_out_score": null, "criterion_names": null, "per_criterion_scores": null, "failure_classification": {"category": "semantic_drift", "description": "Although the goal was to make age validation deterministic by rejecting non-integer/coercible string inputs, the experiment failed in a way that indicates the validation behavior likely diverged from the intended meaning (e.g., still accepting/coercing inputs that should be rejected, or rejecting inputs that should pass).", "fix_direction": "Tighten the input-type and parsing rules: explicitly check for integer type or perform strict string validation (e.g., regex for digits with optional leading sign), avoid broad int() coercion, and add targeted test cases for edge inputs like floats, whitespace, '12.0', '0012', empty strings, and non-numeric strings.", "confidence": 0.72}, "drafts_generated": 1, "drafts_survived": 1}
{"id": "6252e019-d3a8-4265-a0e5-6bda087b0e6a", "target_id": "B4-greedy", "git_sha": "a2b78daef57b11bce4730837a2c2b2664ae55692", "pre_experiment_sha": "a2b78daef57b11bce4730837a2c2b2664ae55692", "timestamp": "2026-04-19T16:03:57.035216+00:00", "hypothesis": "Tighten age validation to reject non-integer-coercible strings/floats consistently by accepting only exact ints and digit strings.", "hypothesis_source": "agent", "mutation_diff_summary": "", "score": 0.725, "score_ci_lower": null, "score_ci_upper": null, "raw_scores": null, "baseline_score": 0.725, "outcome": "DISCARDED", "failure_mode": null, "duration_seconds": 15.572559874970466, "tags": ["validation", "determinism"], "learnings": "{\"what_changed\":\"\",\"what_improved\":[],\"what_regressed\":[],\"transferable_insight\":\"When tightening validation rules, preserve consistency with existing accepted inputs and avoid changes that add strictness without a clear functional benefit.\",\"domain_tags\":[\"validation\",\"input-handling\",\"software-engineering\"]}", "cost_usd": 0.041759000000000004, "bootstrap_seed": 0, "agent_model": "gpt-5.4", "held_out_score": null, "criterion_names": null, "per_criterion_scores": null, "failure_classification": {"category": "logic_error", "description": "The provided information does not include the actual failed behavior, error message, or a before/after comparison to determine what criterion was violated. Only a score (0.7250) and hypothesis are given, so the failure mode cannot be confidently mapped to a specific category.", "fix_direction": "Collect concrete evidence of the failure (input cases that should be accepted/rejected, the observed output/exception, and the expected behavior) and verify whether the issue is in parsing/validation logic versus output formatting or unintended regressions.", "confidence": 0.1}, "drafts_generated": 1, "drafts_survived": 1}
{"id": "bdf82481-ce84-4cc0-97ae-f4deedcbe603", "target_id": "B4-greedy", "git_sha": "a2b78daef57b11bce4730837a2c2b2664ae55692", "pre_experiment_sha": "a2b78daef57b11bce4730837a2c2b2664ae55692", "timestamp": "2026-04-19T16:04:14.401473+00:00", "hypothesis": "Tighten age validation to reject non-exact/coercible inputs so ambiguous values are handled deterministically.", "hypothesis_source": "agent", "mutation_diff_summary": "", "score": 0.725, "score_ci_lower": null, "score_ci_upper": null, "raw_scores": null, "baseline_score": 0.725, "outcome": "DISCARDED", "failure_mode": null, "duration_seconds": 15.06712400005199, "tags": ["validation", "deterministic", "boundary"], "learnings": "{\"what_changed\":\"\",\"what_improved\":[],\"what_regressed\":[],\"transferable_insight\":\"When input validity is ambiguous, prefer strict, exact acceptance rules over coercive interpretation to ensure deterministic handling.\",\"domain_tags\":[\"validation\",\"determinism\",\"input-processing\"]}", "cost_usd": 0.0410748, "bootstrap_seed": 0, "agent_model": "gpt-5.4", "held_out_score": null, "criterion_names": null, "per_criterion_scores": null, "failure_classification": {"category": "semantic_drift", "description": "Despite the intent to tighten deterministic age validation, the experiment likely accepted ambiguous/coercible non-exact inputs or rejected valid exact ones in a way that changed the meaning of the validation behavior rather than producing a structural/output issue or a straightforward regression.", "fix_direction": "Focus on making age validation strictly exact (no coercion), add explicit type/format checks (e.g., integer-only, no strings/floats), and cover edge cases with tests to ensure deterministic accept/reject behavior.", "confidence": 0.46}, "drafts_generated": 1, "drafts_survived": 1}
