{"id": "49396368-b6cb-4d1c-a459-d901848df865", "target_id": "B4-greedy", "git_sha": "6fc757616d984d18306a1fd8476c2c4952e6f2ba", "pre_experiment_sha": "3b452d4d4a3bc0f302632065ef61cb2ba6a6552a", "timestamp": "2026-04-19T15:56:42.205849+00:00", "hypothesis": "Make responses and validation more deterministic by adding stable serialization, stricter input handling, and predictable timestamps.", "hypothesis_source": "agent", "mutation_diff_summary": "", "score": 0.71, "score_ci_lower": null, "score_ci_upper": null, "raw_scores": null, "baseline_score": 0.435, "outcome": "KEPT", "failure_mode": null, "duration_seconds": 13.375448291073553, "tags": ["determinism", "validation", "serialization", "error-handling"], "learnings": "{\"what_changed\":\"\",\"what_improved\":[],\"what_regressed\":[],\"transferable_insight\":\"Reducing variability by standardizing data representation, enforcing stricter input rules, and using predictable time values can make system behavior more consistent and easier to validate.\",\"domain_tags\":[\"reliability\",\"data-processing\",\"testing\"]}", "cost_usd": 0.030675, "bootstrap_seed": 0, "agent_model": "gpt-5.4", "held_out_score": null, "criterion_names": null, "per_criterion_scores": null, "failure_classification": null, "drafts_generated": 1, "drafts_survived": 1}
{"id": "0b893ea2-eaba-4c82-aebf-61e14439a242", "target_id": "B4-greedy", "git_sha": "a2b78daef57b11bce4730837a2c2b2664ae55692", "pre_experiment_sha": "6fc757616d984d18306a1fd8476c2c4952e6f2ba", "timestamp": "2026-04-19T15:57:00.105725+00:00", "hypothesis": "Tightening validation and making error handling/status codes more consistent will improve deterministic endpoint behavior.", "hypothesis_source": "agent", "mutation_diff_summary": "", "score": 0.725, "score_ci_lower": null, "score_ci_upper": null, "raw_scores": null, "baseline_score": 0.71, "outcome": "KEPT", "failure_mode": null, "duration_seconds": 16.66148237499874, "tags": ["validation", "determinism", "consistency", "error-handling"], "learnings": "{\"what_changed\":\"\",\"what_improved\":[],\"what_regressed\":[],\"transferable_insight\":\"Consistent validation and standardized error handling can improve determinism in system behavior even when no specific metric changes are immediately visible.\",\"domain_tags\":[\"reliability\",\"validation\",\"error-handling\"]}", "cost_usd": 0.037495, "bootstrap_seed": 0, "agent_model": "gpt-5.4", "held_out_score": null, "criterion_names": null, "per_criterion_scores": null, "failure_classification": null, "drafts_generated": 1, "drafts_survived": 1}
{"id": "ddb08805-2e14-4bf9-9516-5aaba9ec9b23", "target_id": "B4-greedy", "git_sha": "a2b78daef57b11bce4730837a2c2b2664ae55692", "pre_experiment_sha": "a2b78daef57b11bce4730837a2c2b2664ae55692", "timestamp": "2026-04-19T15:57:19.914159+00:00", "hypothesis": "Tighten input normalization and make update operations atomic to improve deterministic API behavior.", "hypothesis_source": "agent", "mutation_diff_summary": "", "score": 0.725, "score_ci_lower": null, "score_ci_upper": null, "raw_scores": null, "baseline_score": 0.725, "outcome": "DISCARDED", "failure_mode": null, "duration_seconds": 18.675473333103582, "tags": ["validation", "atomicity", "determinism"], "learnings": "{\"what_changed\":\"\",\"what_improved\":[],\"what_regressed\":[],\"transferable_insight\":\"When a change produces no measurable improvement, the safest conclusion is that the added complexity did not address the underlying source of variability or error.\",\"domain_tags\":[\"experimentation\",\"systems-design\",\"reliability\"]}", "cost_usd": 0.044287599999999996, "bootstrap_seed": 0, "agent_model": "gpt-5.4", "held_out_score": null, "criterion_names": null, "per_criterion_scores": null, "failure_classification": {"category": "incomplete_edit", "description": "The experiment intended to tighten normalization and make updates atomic, but the outcome is classified as an unknown failure mode, suggesting the changes were only partially applied or left the system in an inconsistent/non-deterministic state rather than fully enforcing the intended atomic update behavior and normalization guarantees.", "fix_direction": "Ensure end-to-end enforcement of normalized inputs at every entry point and wrap the full read-modify-write sequence in a single atomic operation/transaction; add tests to confirm deterministic behavior under concurrent requests and malformed/edge-case inputs.", "confidence": 0.42}, "drafts_generated": 1, "drafts_survived": 1}
{"id": "d6326494-69e8-4c2c-aa85-fb79b1888e41", "target_id": "B4-greedy", "git_sha": "a2b78daef57b11bce4730837a2c2b2664ae55692", "pre_experiment_sha": "a2b78daef57b11bce4730837a2c2b2664ae55692", "timestamp": "2026-04-19T15:57:41.657173+00:00", "hypothesis": "Tighten scalar validation to reject ambiguous coercions and make request handling more explicit and deterministic.", "hypothesis_source": "agent", "mutation_diff_summary": "", "score": 0.725, "score_ci_lower": null, "score_ci_upper": null, "raw_scores": null, "baseline_score": 0.725, "outcome": "DISCARDED", "failure_mode": null, "duration_seconds": 16.604455166961998, "tags": ["validation", "determinism", "explicit-errors", "stable-behavior"], "learnings": "{\"what_changed\":\"\",\"what_improved\":[],\"what_regressed\":[],\"transferable_insight\":\"When a change adds stricter validation without improving measurable outcomes, it is often better to discard it and preserve the simpler, existing behavior.\",\"domain_tags\":[\"validation\",\"decision-making\",\"software-engineering\"]}", "cost_usd": 0.04281820000000001, "bootstrap_seed": 0, "agent_model": "gpt-5.4", "held_out_score": null, "criterion_names": null, "per_criterion_scores": null, "failure_classification": {"category": "logic_error", "description": "Failure mode is unspecified as 'unknown' and no concrete evidence of a format, logic, regression, scope, syntax, semantic, optimization, or incomplete-state issue is provided.", "fix_direction": "Instrument and capture concrete failure signals (error logs, diff of expected vs actual outputs, failing test/criterion) to determine which category the failure aligns with, then tighten validation/handling in the relevant area.", "confidence": 0.12}, "drafts_generated": 1, "drafts_survived": 1}
{"id": "deb37e91-713e-4ffd-b0af-5da3ffd01eb7", "target_id": "B4-greedy", "git_sha": "a2b78daef57b11bce4730837a2c2b2664ae55692", "pre_experiment_sha": "a2b78daef57b11bce4730837a2c2b2664ae55692", "timestamp": "2026-04-19T15:58:00.852709+00:00", "hypothesis": "Tighten type validation for name/email inputs to reject ambiguous coercions and make request handling more deterministic.", "hypothesis_source": "agent", "mutation_diff_summary": "", "score": 0.725, "score_ci_lower": null, "score_ci_upper": null, "raw_scores": null, "baseline_score": 0.725, "outcome": "DISCARDED", "failure_mode": null, "duration_seconds": 16.745861208997667, "tags": ["validation", "determinism", "stable-errors"], "learnings": "{\"what_changed\":\"\",\"what_improved\":[],\"what_regressed\":[],\"transferable_insight\":\"When input validation is made stricter to eliminate ambiguous coercions, the system becomes more deterministic but may not yield measurable gains unless the rejected edge cases are actually causing errors or inconsistency.\",\"domain_tags\":[\"validation\",\"determinism\",\"input-handling\"]}", "cost_usd": 0.04226980000000001, "bootstrap_seed": 0, "agent_model": "gpt-5.4", "held_out_score": null, "criterion_names": null, "per_criterion_scores": null, "failure_classification": {"category": "incomplete_edit", "description": "The failure mode is marked as \"unknown\" and the score is relatively high (0.7250), suggesting the attempted change did not clearly complete or fully satisfy the intended tightening of name/email validation, leaving inconsistent or partially updated request handling behavior.", "fix_direction": "Make validation changes fully end-to-end: define explicit parsing/coercion rules for name/email, add deterministic normalization and rejection paths for ambiguous inputs, and ensure downstream handlers (parsing, routing, error responses) consistently apply the tightened constraints with targeted tests.", "confidence": 0.42}, "drafts_generated": 1, "drafts_survived": 1}
{"id": "a149f682-6555-467a-9b6f-9e25592e6fe0", "target_id": "B4-greedy", "git_sha": "a2b78daef57b11bce4730837a2c2b2664ae55692", "pre_experiment_sha": "a2b78daef57b11bce4730837a2c2b2664ae55692", "timestamp": "2026-04-19T15:58:20.826104+00:00", "hypothesis": "Make numeric parsing and field validation stricter and more deterministic to reject ambiguous inputs consistently.", "hypothesis_source": "agent", "mutation_diff_summary": "", "score": 0.725, "score_ci_lower": null, "score_ci_upper": null, "raw_scores": null, "baseline_score": 0.725, "outcome": "DISCARDED", "failure_mode": null, "duration_seconds": 17.439970375038683, "tags": ["validation", "determinism", "serialization"], "learnings": "{\"what_changed\":\"\",\"what_improved\":[],\"what_regressed\":[],\"transferable_insight\":\"When a change aims to reduce ambiguity, it should be evaluated for whether stricter rules actually improve consistency without introducing unnecessary rejection of valid inputs.\",\"domain_tags\":[\"validation\",\"determinism\",\"input-processing\"]}", "cost_usd": 0.042737800000000006, "bootstrap_seed": 0, "agent_model": "gpt-5.4", "held_out_score": null, "criterion_names": null, "per_criterion_scores": null, "failure_classification": {"category": "logic_error", "description": "The provided experiment details (failure mode: unknown) and score (0.7250) do not include enough information about what aspect failed (format, logic, parsing, validation, regression, etc.) to map it to a specific category.", "fix_direction": "Collect or inspect the concrete failure signal (diff/logs, failing test name, error message, and expected vs actual behavior) to determine whether the issue is output schema, numeric parsing/validation determinism, reasoning/calculation, or an incomplete/incorrect code change.", "confidence": 0.18}, "drafts_generated": 1, "drafts_survived": 1}
{"id": "5a2aa439-8e1a-4f84-9f52-7c22c2584942", "target_id": "B4-greedy", "git_sha": "a2b78daef57b11bce4730837a2c2b2664ae55692", "pre_experiment_sha": "a2b78daef57b11bce4730837a2c2b2664ae55692", "timestamp": "2026-04-19T15:58:44.961723+00:00", "hypothesis": "Make input validation stricter and atomic updates deterministic by rejecting ambiguous string/int coercions and validating all fields before mutation.", "hypothesis_source": "agent", "mutation_diff_summary": "", "score": 0.725, "score_ci_lower": null, "score_ci_upper": null, "raw_scores": null, "baseline_score": 0.725, "outcome": "DISCARDED", "failure_mode": null, "duration_seconds": 19.53000166709535, "tags": ["determinism", "validation", "atomicity"], "learnings": "{\"what_changed\":\"\",\"what_improved\":[],\"what_regressed\":[],\"transferable_insight\":\"When a change depends on multiple inputs, validate everything up front and reject ambiguous interpretations so the update is either fully accepted or fully rejected in a deterministic way.\",\"domain_tags\":[\"validation\",\"determinism\",\"data-integrity\"]}", "cost_usd": 0.044726600000000005, "bootstrap_seed": 0, "agent_model": "gpt-5.4", "held_out_score": null, "criterion_names": null, "per_criterion_scores": null, "failure_classification": {"category": "semantic_drift", "description": "The change intended to make updates deterministic via stricter validation appears not to have applied correctly; ambiguous string/int coercions and/or validation-before-mutation behavior likely deviated from the intended semantics, leading to incorrect results despite the update logic conceptually matching the hypothesis.", "fix_direction": "Tighten type handling explicitly (no implicit coercion), validate every field in a preflight pass before any mutation, and add deterministic test cases that cover ambiguous inputs to ensure the intended reject/accept behavior is consistent.", "confidence": 0.52}, "drafts_generated": 1, "drafts_survived": 1}
{"id": "69370f3e-b74e-4e26-b2d1-54040e9f0e24", "target_id": "B4-greedy", "git_sha": "a2b78daef57b11bce4730837a2c2b2664ae55692", "pre_experiment_sha": "a2b78daef57b11bce4730837a2c2b2664ae55692", "timestamp": "2026-04-19T15:59:04.384309+00:00", "hypothesis": "Make field validation explicit for string inputs to reject ambiguous coercions and stabilize error behavior.", "hypothesis_source": "agent", "mutation_diff_summary": "", "score": 0.725, "score_ci_lower": null, "score_ci_upper": null, "raw_scores": null, "baseline_score": 0.725, "outcome": "DISCARDED", "failure_mode": null, "duration_seconds": 16.235050749965012, "tags": ["validation", "determinism", "explicit-inputs"], "learnings": "{\"what_changed\":\"\",\"what_improved\":[],\"what_regressed\":[],\"transferable_insight\":\"When a change does not measurably improve outcomes, prefer preserving existing behavior over adding stricter validation that may introduce ambiguity or instability.\",\"domain_tags\":[\"validation\",\"error-handling\",\"stability\"]}", "cost_usd": 0.0425166, "bootstrap_seed": 0, "agent_model": "gpt-5.4", "held_out_score": null, "criterion_names": null, "per_criterion_scores": null, "failure_classification": {"category": "logic_error", "description": "The provided details do not include the actual error/behavior observed, expected vs. received outputs, or specific changes that caused the failure, so the failure mode cannot be reliably mapped to one of the given categories.", "fix_direction": "Capture the concrete failure evidence (error message/logs, diff of the change, and a representative failing input/output pair) and then re-run with targeted assertions for string-field validation and coercion handling to confirm stable error behavior.", "confidence": 0.12}, "drafts_generated": 1, "drafts_survived": 1}
{"id": "85180fe4-7633-4749-af7b-ae7274cdf994", "target_id": "B4-greedy", "git_sha": "a2b78daef57b11bce4730837a2c2b2664ae55692", "pre_experiment_sha": "a2b78daef57b11bce4730837a2c2b2664ae55692", "timestamp": "2026-04-19T15:59:28.179869+00:00", "hypothesis": "Make field normalization stricter and deterministic by rejecting implicit string/float coercions for ids and age.", "hypothesis_source": "agent", "mutation_diff_summary": "", "score": 0.725, "score_ci_lower": null, "score_ci_upper": null, "raw_scores": null, "baseline_score": 0.725, "outcome": "DISCARDED", "failure_mode": null, "duration_seconds": 20.67135008308105, "tags": ["validation", "determinism", "explicit-inputs"], "learnings": "{\"what_changed\":\"\",\"what_improved\":[],\"what_regressed\":[],\"transferable_insight\":\"When a stricter change yields no measurable improvement or regression, it likely addresses a non-binding issue and should not be prioritized over higher-impact sources of variation.\",\"domain_tags\":[\"experimentation\",\"decision-making\",\"data-quality\"]}", "cost_usd": 0.04249240000000001, "bootstrap_seed": 0, "agent_model": "gpt-5.4", "held_out_score": null, "criterion_names": null, "per_criterion_scores": null, "failure_classification": {"category": "semantic_drift", "description": "The experiment aimed to make normalization stricter by rejecting implicit string/float coercions, but the failure mode is unspecified and the low score suggests the change likely altered the intended meaning/behavior of ID/age handling (e.g., rejecting valid inputs or failing to reject invalid ones) rather than just violating output format or introducing a parse/regression/scope issue.", "fix_direction": "Clarify and lock the exact acceptance/rejection rules for id and age types (e.g., strict type checks, explicit parsing paths, and deterministic comparisons), then add targeted test cases covering string->int/float->int edge cases and boundary age values to ensure behavior matches the hypothesis.", "confidence": 0.62}, "drafts_generated": 1, "drafts_survived": 1}
{"id": "0718d82b-0a5d-4bb8-b07f-d401cadc1bb1", "target_id": "B4-greedy", "git_sha": "a2b78daef57b11bce4730837a2c2b2664ae55692", "pre_experiment_sha": "a2b78daef57b11bce4730837a2c2b2664ae55692", "timestamp": "2026-04-19T15:59:50.439938+00:00", "hypothesis": "Make update behavior deterministic by validating all fields before mutating the stored user.", "hypothesis_source": "agent", "mutation_diff_summary": "", "score": 0.725, "score_ci_lower": null, "score_ci_upper": null, "raw_scores": null, "baseline_score": 0.725, "outcome": "DISCARDED", "failure_mode": null, "duration_seconds": 16.95957449998241, "tags": ["determinism", "validation", "minimal"], "learnings": "{\"what_changed\":\"\",\"what_improved\":[],\"what_regressed\":[],\"transferable_insight\":\"Validate all inputs before applying any state changes to keep updates deterministic and avoid partial mutations.\",\"domain_tags\":[\"software-engineering\",\"data-integrity\",\"reliability\"]}", "cost_usd": 0.0415328, "bootstrap_seed": 0, "agent_model": "gpt-5.4", "held_out_score": null, "criterion_names": null, "per_criterion_scores": null, "failure_classification": {"category": "semantic_drift", "description": "The experiment aimed to make update behavior deterministic by validating all fields before mutating the stored user, but the resulting behavior did not match the intended semantics (some validation or update logic likely still mutated or applied partially/incorrectly), indicating the change may have affected meaning rather than just structure or syntax.", "fix_direction": "Ensure validation is comprehensive and side-effect-free (e.g., validate against a complete schema first, perform all checks, then apply a single atomic update only if all fields pass), and add tests that cover edge cases and confirm no state changes occur on any validation failure.", "confidence": 0.62}, "drafts_generated": 1, "drafts_survived": 1}
{"id": "93380f8f-d9df-4d4e-8a7a-481d998d9c2c", "target_id": "B4-greedy", "git_sha": "a2b78daef57b11bce4730837a2c2b2664ae55692", "pre_experiment_sha": "a2b78daef57b11bce4730837a2c2b2664ae55692", "timestamp": "2026-04-19T16:00:11.996756+00:00", "hypothesis": "Make user IDs deterministic across create/delete cycles by deriving the next ID from current stored keys instead of mutable global counter state.", "hypothesis_source": "agent", "mutation_diff_summary": "", "score": 0.725, "score_ci_lower": null, "score_ci_upper": null, "raw_scores": null, "baseline_score": 0.725, "outcome": "DISCARDED", "failure_mode": null, "duration_seconds": 18.730359458946623, "tags": ["determinism", "ids", "minimal"], "learnings": "{\"what_changed\":\"\",\"what_improved\":[],\"what_regressed\":[],\"transferable_insight\":\"Replacing mutable global state with a deterministic derivation from current persisted state can improve reproducibility, but only if the derived rule preserves the system\u2019s required uniqueness and lifecycle semantics.\",\"domain_tags\":[\"state-management\",\"determinism\",\"system-design\"]}", "cost_usd": 0.041517000000000005, "bootstrap_seed": 0, "agent_model": "gpt-5.4", "held_out_score": null, "criterion_names": null, "per_criterion_scores": null, "failure_classification": {"category": "semantic_drift", "description": "The proposed hypothesis about making user IDs deterministic is not reflected in the experiment\u2019s outcome; the result appears to follow the wrong semantics for ID derivation across create/delete cycles (likely continuing to rely on mutable global state or not correctly basing the next ID on stored keys).", "fix_direction": "Ensure the ID generation logic deterministically derives the next ID from the current persistent set of stored keys (e.g., compute next = max(existing)+1 or smallest missing key) during the create operation, and verify behavior across repeated create/delete cycles with the counter/state removed or made purely derived-from-storage.", "confidence": 0.62}, "drafts_generated": 1, "drafts_survived": 1}
{"id": "1dc75d52-f963-4983-8c51-7c062d9ae277", "target_id": "B4-greedy", "git_sha": "a2b78daef57b11bce4730837a2c2b2664ae55692", "pre_experiment_sha": "a2b78daef57b11bce4730837a2c2b2664ae55692", "timestamp": "2026-04-19T16:00:31.349685+00:00", "hypothesis": "Reject non-string name and email inputs explicitly to eliminate ambiguous coercion and make validation deterministic.", "hypothesis_source": "agent", "mutation_diff_summary": "", "score": 0.725, "score_ci_lower": null, "score_ci_upper": null, "raw_scores": null, "baseline_score": 0.725, "outcome": "DISCARDED", "failure_mode": null, "duration_seconds": 16.755325915990397, "tags": ["validation", "determinism", "input-types"], "learnings": "{\"what_changed\":\"\",\"what_improved\":[],\"what_regressed\":[],\"transferable_insight\":\"Explicitly rejecting ambiguous input types early makes validation behavior deterministic and reduces hidden coercion errors.\",\"domain_tags\":[\"validation\",\"data-quality\",\"input-handling\"]}", "cost_usd": 0.04129100000000001, "bootstrap_seed": 0, "agent_model": "gpt-5.4", "held_out_score": null, "criterion_names": null, "per_criterion_scores": null, "failure_classification": {"category": "logic_error", "description": "The experiment intended to add explicit rejection of non-string name/email inputs, but it failed in an unspecified way (Failure Mode: unknown), suggesting the change didn\u2019t correctly enforce the intended deterministic validation behavior or mismatched the expected logic/criteria used by the evaluator.", "fix_direction": "Re-check the validation logic and error handling paths: ensure type checks happen before any coercion/normalization, confirm that non-string inputs are rejected with the exact expected error shape/message, and add targeted tests for edge cases (numbers, null/undefined, objects, whitespace, etc.).", "confidence": 0.55}, "drafts_generated": 1, "drafts_survived": 1}
