{"id": "26ff1769-d437-447b-9daf-e58ff89f77e4", "target_id": "B4-greedy", "git_sha": "a2b78daef57b11bce4730837a2c2b2664ae55692", "pre_experiment_sha": "a2b78daef57b11bce4730837a2c2b2664ae55692", "timestamp": "2026-04-19T16:11:42.988833+00:00", "hypothesis": "Reject exactly one ambiguous age input form by disallowing float values while preserving existing integer behavior.", "hypothesis_source": "agent", "mutation_diff_summary": "", "score": 0.725, "score_ci_lower": null, "score_ci_upper": null, "raw_scores": null, "baseline_score": 0.725, "outcome": "DISCARDED", "failure_mode": null, "duration_seconds": 16.485698834061623, "tags": ["validation-boundary", "age", "deterministic"], "learnings": "{\"what_changed\":\"\",\"what_improved\":[],\"what_regressed\":[],\"transferable_insight\":\"When tightening input validation, make the rule precise enough to eliminate only the intended ambiguity while preserving all established valid cases.\",\"domain_tags\":[\"input-validation\",\"software-design\",\"backward-compatibility\"]}", "cost_usd": 0.042861, "bootstrap_seed": 0, "agent_model": "gpt-5.4", "held_out_score": null, "criterion_names": null, "per_criterion_scores": null, "failure_classification": {"category": "logic_error", "description": "The experiment aimed to reject one ambiguous age input form by disallowing float values, but it failed without indicating a parsing/format issue\u2014suggesting the change did not correctly implement the intended validation logic (e.g., float rejection not applied or still accepted in some paths).", "fix_direction": "Focus on the validation logic for age inputs: explicitly detect and reject float/non-integer representations across all relevant input paths (including strings), while ensuring existing integer behavior remains unchanged.", "confidence": 0.68}, "drafts_generated": 1, "drafts_survived": 1}
{"id": "5299a1a1-2e1e-43cb-927f-fcf4e81cf56f", "target_id": "B4-greedy", "git_sha": "a2b78daef57b11bce4730837a2c2b2664ae55692", "pre_experiment_sha": "a2b78daef57b11bce4730837a2c2b2664ae55692", "timestamp": "2026-04-19T16:12:04.517548+00:00", "hypothesis": "Tighten one ambiguous validation case by rejecting float user IDs while preserving exact integer behavior.", "hypothesis_source": "agent", "mutation_diff_summary": "", "score": 0.725, "score_ci_lower": null, "score_ci_upper": null, "raw_scores": null, "baseline_score": 0.725, "outcome": "DISCARDED", "failure_mode": null, "duration_seconds": 18.57038695900701, "tags": ["validation-boundary", "user-id", "deterministic"], "learnings": "{\"what_changed\":\"\",\"what_improved\":[],\"what_regressed\":[],\"transferable_insight\":\"When a validation rule is ambiguous, narrowing it to exclude borderline inputs can preserve intended exact cases but may yield no measurable benefit if the ambiguity was not causing real errors.\",\"domain_tags\":[\"validation\",\"input-sanitization\",\"decision-making\"]}", "cost_usd": 0.0427096, "bootstrap_seed": 0, "agent_model": "gpt-5.4", "held_out_score": null, "criterion_names": null, "per_criterion_scores": null, "failure_classification": {"category": "semantic_drift", "description": "The change intended to reject float user IDs likely altered the intended interpretation/behavior around validation beyond the single ambiguous case, resulting in a failure even though the output structure remained valid. Score suggests behavior is close but meaning/edge-case handling is off.", "fix_direction": "Focus on precise type/representation checks (e.g., accept only integers that are true ints, explicitly reject non-integer numeric forms like 1.0) and add targeted edge-case tests to ensure exact integer behavior is unchanged while float IDs are consistently rejected.", "confidence": 0.62}, "drafts_generated": 1, "drafts_survived": 1}
{"id": "897fa45b-9254-40cd-b4c2-11dfa78900e3", "target_id": "B4-greedy", "git_sha": "a2b78daef57b11bce4730837a2c2b2664ae55692", "pre_experiment_sha": "a2b78daef57b11bce4730837a2c2b2664ae55692", "timestamp": "2026-04-19T16:12:21.824240+00:00", "hypothesis": "Tighten one validation boundary by rejecting float user_id inputs that currently coerce via int().", "hypothesis_source": "agent", "mutation_diff_summary": "", "score": 0.725, "score_ci_lower": null, "score_ci_upper": null, "raw_scores": null, "baseline_score": 0.725, "outcome": "DISCARDED", "failure_mode": null, "duration_seconds": 14.813786625047214, "tags": ["validation-boundary", "user-id", "deterministic"], "learnings": "{\"what_changed\":\"\",\"what_improved\":[],\"what_regressed\":[],\"transferable_insight\":\"When a proposed stricter validation rule changes behavior without producing measurable gains or regressions, it is likely not worth adopting unless it addresses a clearly demonstrated risk or failure mode.\",\"domain_tags\":[\"validation\",\"decision-making\",\"experimentation\"]}", "cost_usd": 0.04277000000000001, "bootstrap_seed": 0, "agent_model": "gpt-5.4", "held_out_score": null, "criterion_names": null, "per_criterion_scores": null, "failure_classification": {"category": "logic_error", "description": "The change intended to tighten validation by rejecting float user_id inputs likely did not correctly implement or verify the boundary behavior; as a result, the experiment failed (score indicates partial/incorrect outcome rather than a structural or parsing issue).", "fix_direction": "Revisit the validation logic for user_id: explicitly detect float/decimal types (and float-like strings), ensure correct rejection vs acceptance rules, and add targeted tests for float inputs and edge cases (e.g., '1.0', '01.2', scientific notation).", "confidence": 0.63}, "drafts_generated": 1, "drafts_survived": 1}
{"id": "bb72cb1a-731c-45a6-a248-d3f353896b31", "target_id": "B4-greedy", "git_sha": "a2b78daef57b11bce4730837a2c2b2664ae55692", "pre_experiment_sha": "a2b78daef57b11bce4730837a2c2b2664ae55692", "timestamp": "2026-04-19T16:12:44.091161+00:00", "hypothesis": "Sort the returned user list by id immediately before returning to enforce deterministic response ordering.", "hypothesis_source": "agent", "mutation_diff_summary": "", "score": 0.725, "score_ci_lower": null, "score_ci_upper": null, "raw_scores": null, "baseline_score": 0.725, "outcome": "DISCARDED", "failure_mode": null, "duration_seconds": 15.336926833027974, "tags": ["determinism", "ordering", "list-response"], "learnings": "{\"what_changed\":\"\",\"what_improved\":[],\"what_regressed\":[],\"transferable_insight\":\"When a change only enforces determinism without altering behavior, it may add consistency but still fail to produce measurable improvement if the underlying issue is not order-dependent.\",\"domain_tags\":[\"determinism\",\"evaluation\",\"software-engineering\"]}", "cost_usd": 0.0419512, "bootstrap_seed": 0, "agent_model": "gpt-5.4", "held_out_score": null, "criterion_names": null, "per_criterion_scores": null, "failure_classification": {"category": "semantic_drift", "description": "The change did not reliably enforce deterministic ordering of the returned user list as intended. Despite sorting being specified in the hypothesis, the experiment still failed with an unknown failure mode, suggesting the implementation either sorted at the wrong stage, used a different field than intended, or the returned result was reordered elsewhere.", "fix_direction": "Ensure deterministic ordering by sorting the exact returned collection right before serialization/response using the correct key (id) and verifying no subsequent transformation reorders results; add an end-to-end test that asserts stable ordering for repeated calls.", "confidence": 0.62}, "drafts_generated": 1, "drafts_survived": 1}
{"id": "3a868baa-88cf-42bc-9da1-0afff2c08d81", "target_id": "B4-greedy", "git_sha": "a2b78daef57b11bce4730837a2c2b2664ae55692", "pre_experiment_sha": "a2b78daef57b11bce4730837a2c2b2664ae55692", "timestamp": "2026-04-19T16:13:03.564418+00:00", "hypothesis": "Tighten one precise validation boundary by rejecting float user_id values instead of coercing them with int().", "hypothesis_source": "agent", "mutation_diff_summary": "", "score": 0.725, "score_ci_lower": null, "score_ci_upper": null, "raw_scores": null, "baseline_score": 0.725, "outcome": "DISCARDED", "failure_mode": null, "duration_seconds": 16.153938084025867, "tags": ["validation-boundary", "user_id", "deterministic"], "learnings": "{\"what_changed\":\"\",\"what_improved\":[],\"what_regressed\":[],\"transferable_insight\":\"When a field represents an identifier or discrete category, validating it strictly instead of coercing nearby numeric types can prevent ambiguous inputs without changing behavior.\",\"domain_tags\":[\"validation\",\"data-integrity\",\"input-sanitization\"]}", "cost_usd": 0.042042, "bootstrap_seed": 0, "agent_model": "gpt-5.4", "held_out_score": null, "criterion_names": null, "per_criterion_scores": null, "failure_classification": {"category": "incomplete_edit", "description": "The experiment appears to have failed without a clearly identified mechanism (Failure Mode listed as 'unknown') and the score is relatively high but not perfect, suggesting the intended validation-boundary change was only partially applied or left the codebase in an inconsistent state (e.g., some paths still accept/coerce float user_id).", "fix_direction": "Ensure the float user_id rejection is applied consistently across all input/validation paths (and tests), removing any remaining int()-coercion fallbacks and updating schema/validation logic end-to-end.", "confidence": 0.42}, "drafts_generated": 1, "drafts_survived": 1}
