{"id": "3916c7ca-2622-41bc-9371-22b1390fe974", "target_id": "B4-greedy", "git_sha": "a2b78daef57b11bce4730837a2c2b2664ae55692", "pre_experiment_sha": "a2b78daef57b11bce4730837a2c2b2664ae55692", "timestamp": "2026-04-19T16:08:02.884668+00:00", "hypothesis": "Tighten the exact ambiguous age validation by rejecting non-integer age inputs instead of coercing them.", "hypothesis_source": "agent", "mutation_diff_summary": "", "score": 0.725, "score_ci_lower": null, "score_ci_upper": null, "raw_scores": null, "baseline_score": 0.725, "outcome": "DISCARDED", "failure_mode": null, "duration_seconds": 15.50947604200337, "tags": ["validation-boundary", "age", "deterministic"], "learnings": "{\"what_changed\":\"\",\"what_improved\":[],\"what_regressed\":[],\"transferable_insight\":\"When a proposed stricter validation rule changes behavior without measurable benefit or harm, it is often not worth adopting unless it clearly improves a meaningful outcome.\",\"domain_tags\":[\"validation\",\"decision-making\",\"experimentation\"]}", "cost_usd": 0.0424148, "bootstrap_seed": 0, "agent_model": "gpt-5.4", "held_out_score": null, "criterion_names": null, "per_criterion_scores": null, "failure_classification": {"category": "logic_error", "description": "The provided information does not specify the actual failure behavior (no error message, incorrect output, regression evidence, or code/config details). The score alone (0.7250) is insufficient to determine which category applies.", "fix_direction": "Reproduce the failure with logs/output differences against a passing baseline, and capture the exact mismatch (format vs semantics vs prior behavior) to map it to the correct category.", "confidence": 0.12}, "drafts_generated": 1, "drafts_survived": 1}
{"id": "452889c6-380a-4c6d-9fb3-4036c496cfb9", "target_id": "B4-greedy", "git_sha": "a2b78daef57b11bce4730837a2c2b2664ae55692", "pre_experiment_sha": "a2b78daef57b11bce4730837a2c2b2664ae55692", "timestamp": "2026-04-19T16:08:21.307129+00:00", "hypothesis": "Tighten the age validation boundary to reject non-integer coercible inputs that can produce ambiguous behavior.", "hypothesis_source": "agent", "mutation_diff_summary": "", "score": 0.725, "score_ci_lower": null, "score_ci_upper": null, "raw_scores": null, "baseline_score": 0.725, "outcome": "DISCARDED", "failure_mode": null, "duration_seconds": 15.899291208013892, "tags": ["validation", "deterministic", "age"], "learnings": "{\"what_changed\":\"\",\"what_improved\":[],\"what_regressed\":[],\"transferable_insight\":\"When validating inputs, prefer explicit type checks over coercion so ambiguous edge cases are rejected consistently rather than interpreted unpredictably.\",\"domain_tags\":[\"validation\",\"input-sanitization\",\"reliability\"]}", "cost_usd": 0.0426116, "bootstrap_seed": 0, "agent_model": "gpt-5.4", "held_out_score": null, "criterion_names": null, "per_criterion_scores": null, "failure_classification": {"category": "semantic_drift", "description": "The experiment intent was to tighten age validation so non-integer coercible inputs are rejected, but the run failed with an unspecified/unknown error, suggesting the change did not correctly enforce the intended boundary behavior (i.e., ambiguous coercible inputs were still accepted or handled incorrectly).", "fix_direction": "Revisit the age validation logic and input handling: explicitly require integer types (or parse-and-verify exact integer equivalence), reject floats/strings with decimals/whitespace variants, and add targeted tests for coercible edge cases to ensure the boundary behaves deterministically.", "confidence": 0.36}, "drafts_generated": 1, "drafts_survived": 1}
{"id": "0fff14e0-c3bc-4252-ab7a-67e95d8b285e", "target_id": "B4-greedy", "git_sha": "a2b78daef57b11bce4730837a2c2b2664ae55692", "pre_experiment_sha": "a2b78daef57b11bce4730837a2c2b2664ae55692", "timestamp": "2026-04-19T16:08:43.377739+00:00", "hypothesis": "Tighten age validation to reject non-exact coercible inputs that currently depend on Python int conversion behavior.", "hypothesis_source": "agent", "mutation_diff_summary": "", "score": 0.725, "score_ci_lower": null, "score_ci_upper": null, "raw_scores": null, "baseline_score": 0.725, "outcome": "DISCARDED", "failure_mode": null, "duration_seconds": 15.464283250039443, "tags": ["validation-boundary", "age", "deterministic"], "learnings": "{\"what_changed\":\"\",\"what_improved\":[],\"what_regressed\":[],\"transferable_insight\":\"When tightening validation rules, preserve existing accepted coercion paths unless you have evidence that rejecting them improves correctness without breaking expected behavior.\",\"domain_tags\":[\"validation\",\"backward-compatibility\",\"input-processing\"]}", "cost_usd": 0.0430714, "bootstrap_seed": 0, "agent_model": "gpt-5.4", "held_out_score": null, "criterion_names": null, "per_criterion_scores": null, "failure_classification": {"category": "logic_error", "description": "Failure mode is not specified (marked as 'unknown'), so the exact nature of what failed\u2014format, logic, regression, scope, syntax, semantics, optimization, or incompleteness\u2014cannot be determined from the provided information.", "fix_direction": "Instrument the failing test run (diff against expected output/contract, check parse/validation rules, and compare behavior for non-exact coercible inputs) to identify whether the issue is schema/contract, semantic validation logic, or unintended regression/incompleteness.", "confidence": 0.12}, "drafts_generated": 1, "drafts_survived": 1}
{"id": "c4b1eff0-d00d-443e-a1ad-24d0ec95c742", "target_id": "B4-greedy", "git_sha": "a2b78daef57b11bce4730837a2c2b2664ae55692", "pre_experiment_sha": "a2b78daef57b11bce4730837a2c2b2664ae55692", "timestamp": "2026-04-19T16:09:06.732300+00:00", "hypothesis": "Tighten the age validation boundary to reject coercible non-integer inputs that can parse inconsistently.", "hypothesis_source": "agent", "mutation_diff_summary": "", "score": 0.725, "score_ci_lower": null, "score_ci_upper": null, "raw_scores": null, "baseline_score": 0.725, "outcome": "DISCARDED", "failure_mode": null, "duration_seconds": 15.60909941594582, "tags": ["validation", "age", "deterministic"], "learnings": "{\"what_changed\":\"\",\"what_improved\":[],\"what_regressed\":[],\"transferable_insight\":\"When validating inputs, prefer strict type and boundary checks over permissive coercion to avoid inconsistent interpretation of ambiguous values.\",\"domain_tags\":[\"validation\",\"input-sanitization\",\"reliability\"]}", "cost_usd": 0.0429936, "bootstrap_seed": 0, "agent_model": "gpt-5.4", "held_out_score": null, "criterion_names": null, "per_criterion_scores": null, "failure_classification": {"category": "logic_error", "description": "The experiment\u2019s failure mode is not specified (marked as 'unknown'), so it\u2019s not possible to confidently map the failure to a concrete category such as syntax, logic, or regression.", "fix_direction": "Reproduce the failure with logs/outputs and identify whether the issue is a parsing/validation boundary mismatch, a schema/format violation, a logic/calculation error, or an incomplete regression change.", "confidence": 0.12}, "drafts_generated": 1, "drafts_survived": 1}
{"id": "a83977d5-ff46-4d2f-b2c7-6d42f7d7a873", "target_id": "B4-greedy", "git_sha": "a2b78daef57b11bce4730837a2c2b2664ae55692", "pre_experiment_sha": "a2b78daef57b11bce4730837a2c2b2664ae55692", "timestamp": "2026-04-19T16:09:24.736117+00:00", "hypothesis": "Tighten the age validation boundary to reject coercible non-integer inputs that currently depend on implicit int conversion.", "hypothesis_source": "agent", "mutation_diff_summary": "", "score": 0.725, "score_ci_lower": null, "score_ci_upper": null, "raw_scores": null, "baseline_score": 0.725, "outcome": "DISCARDED", "failure_mode": null, "duration_seconds": 15.712224999908358, "tags": ["validation", "deterministic", "boundary"], "learnings": "{\"what_changed\":\"\",\"what_improved\":[],\"what_regressed\":[],\"transferable_insight\":\"When tightening validation rules, prefer explicit type checks over implicit coercion so behavior is predictable and edge cases are rejected consistently.\",\"domain_tags\":[\"validation\",\"type-safety\",\"input-processing\"]}", "cost_usd": 0.0428876, "bootstrap_seed": 0, "agent_model": "gpt-5.4", "held_out_score": null, "criterion_names": null, "per_criterion_scores": null, "failure_classification": {"category": "logic_error", "description": "The experiment intended to tighten age validation against coercible non-integer inputs, but it appears to have failed in an unspecified way (Failure Mode marked 'unknown'), with the behavior likely still accepting invalid coercible inputs or rejecting valid edge cases due to incorrect boundary/validation logic.", "fix_direction": "Rework the age validation checks to explicitly enforce integer-only inputs (e.g., strict type/regex parsing before comparisons), then add targeted tests for coercible types (strings like '12.0', '12abc', whitespace, null/boolean) and boundary values to confirm the new acceptance/rejection behavior.", "confidence": 0.56}, "drafts_generated": 1, "drafts_survived": 1}
{"id": "d3e09204-eccc-4e14-a9c1-94c31a21f94c", "target_id": "B4-greedy", "git_sha": "a2b78daef57b11bce4730837a2c2b2664ae55692", "pre_experiment_sha": "a2b78daef57b11bce4730837a2c2b2664ae55692", "timestamp": "2026-04-19T16:09:45.967702+00:00", "hypothesis": "Sort the update payload keys before applying them so identical patch content yields deterministic validation and mutation behavior.", "hypothesis_source": "agent", "mutation_diff_summary": "", "score": 0.725, "score_ci_lower": null, "score_ci_upper": null, "raw_scores": null, "baseline_score": 0.725, "outcome": "DISCARDED", "failure_mode": null, "duration_seconds": 14.513765209005214, "tags": ["determinism", "ordering", "update"], "learnings": "{\"what_changed\":\"\",\"what_improved\":[],\"what_regressed\":[],\"transferable_insight\":\"When an operation\u2019s behavior depends on input ordering, normalizing the input first can improve determinism, but only if the ordering actually affects the underlying logic.\",\"domain_tags\":[\"determinism\",\"input-normalization\",\"software-engineering\"]}", "cost_usd": 0.042823400000000005, "bootstrap_seed": 0, "agent_model": "gpt-5.4", "held_out_score": null, "criterion_names": null, "per_criterion_scores": null, "failure_classification": {"category": "semantic_drift", "description": "The implementation appears to produce different validation/mutation behavior for identical patch content, implying the intended determinism from sorting payload keys was not achieved or not applied at the correct stage (e.g., sorting wasn\u2019t comprehensive or missed nested structures).", "fix_direction": "Ensure all relevant update payload keys (including nested objects) are deterministically ordered before any validation, diffing, or mutation logic; verify by adding tests that apply the same patch with different key insertion orders and assert identical outcomes.", "confidence": 0.68}, "drafts_generated": 1, "drafts_survived": 1}
{"id": "d4044238-3f3d-4316-bcd5-86d2d79947a1", "target_id": "B4-greedy", "git_sha": "a2b78daef57b11bce4730837a2c2b2664ae55692", "pre_experiment_sha": "a2b78daef57b11bce4730837a2c2b2664ae55692", "timestamp": "2026-04-19T16:10:02.729698+00:00", "hypothesis": "Tighten age validation to reject only non-exact float inputs that are currently coerced inconsistently.", "hypothesis_source": "agent", "mutation_diff_summary": "", "score": 0.725, "score_ci_lower": null, "score_ci_upper": null, "raw_scores": null, "baseline_score": 0.725, "outcome": "DISCARDED", "failure_mode": null, "duration_seconds": 14.217726624920033, "tags": ["validation", "age", "deterministic"], "learnings": "{\"what_changed\":\"\",\"what_improved\":[],\"what_regressed\":[],\"transferable_insight\":\"When tightening validation rules, preserve only the exactness constraints that eliminate inconsistent coercion while avoiding broader changes that do not improve outcomes.\",\"domain_tags\":[\"validation\",\"data-quality\",\"input-sanitization\"]}", "cost_usd": 0.0431718, "bootstrap_seed": 0, "agent_model": "gpt-5.4", "held_out_score": null, "criterion_names": null, "per_criterion_scores": null, "failure_classification": {"category": "semantic_drift", "description": "The attempted change to age validation did not reliably enforce the intended rule (reject only non-exact float inputs), leading to inconsistent or incorrect acceptance/rejection behavior rather than a pure schema/format or parsing issue.", "fix_direction": "Verify the precise input comparison semantics (e.g., exact float vs numeric coercion), add explicit parsing/validation paths, and test edge cases like 12.0, 12.00, 12.1, 12e0, and strings with whitespace/locale to ensure consistent rejection criteria.", "confidence": 0.64}, "drafts_generated": 1, "drafts_survived": 1}
{"id": "55d0bf75-329f-470f-948b-f2393b324d73", "target_id": "B4-greedy", "git_sha": "a2b78daef57b11bce4730837a2c2b2664ae55692", "pre_experiment_sha": "a2b78daef57b11bce4730837a2c2b2664ae55692", "timestamp": "2026-04-19T16:10:20.870090+00:00", "hypothesis": "Tighten the exact age validation boundary by rejecting non-integer numeric coercions.", "hypothesis_source": "agent", "mutation_diff_summary": "", "score": 0.725, "score_ci_lower": null, "score_ci_upper": null, "raw_scores": null, "baseline_score": 0.725, "outcome": "DISCARDED", "failure_mode": null, "duration_seconds": 15.245443749940023, "tags": ["validation", "age", "deterministic"], "learnings": "{\"what_changed\":\"\",\"what_improved\":[],\"what_regressed\":[],\"transferable_insight\":\"When a stricter validation rule changes behavior without improving outcomes, it is likely enforcing precision that the system does not currently need.\",\"domain_tags\":[\"validation\",\"experimentation\",\"decision-making\"]}", "cost_usd": 0.042999800000000005, "bootstrap_seed": 0, "agent_model": "gpt-5.4", "held_out_score": null, "criterion_names": null, "per_criterion_scores": null, "failure_classification": {"category": "semantic_drift", "description": "The attempt to tighten the age validation boundary appears to have changed behavior in an unintended way\u2014rejecting/accepting inputs that should have been handled correctly. The failure is consistent with logic that does not match the intended rule about non-integer numeric coercions at the exact boundary.", "fix_direction": "Clarify and explicitly implement the acceptance criteria for age values (e.g., only accept strict integers; define handling for strings, floats, and numeric coercions). Add targeted tests around boundary values and coercion cases (e.g., 18 vs 18.0, '18', '18.5', 17.999, etc.).", "confidence": 0.72}, "drafts_generated": 1, "drafts_survived": 1}
{"id": "b1b746c3-c2c2-4b9d-a470-7b2a1dd07d6f", "target_id": "B4-greedy", "git_sha": "a2b78daef57b11bce4730837a2c2b2664ae55692", "pre_experiment_sha": "a2b78daef57b11bce4730837a2c2b2664ae55692", "timestamp": "2026-04-19T16:10:44.245111+00:00", "hypothesis": "Tighten age validation to reject exactly boolean-like string inputs that are currently coerced by int() and can vary in ambiguous handling.", "hypothesis_source": "agent", "mutation_diff_summary": "", "score": 0.725, "score_ci_lower": null, "score_ci_upper": null, "raw_scores": null, "baseline_score": 0.725, "outcome": "DISCARDED", "failure_mode": null, "duration_seconds": 16.89926341699902, "tags": ["validation", "deterministic"], "learnings": "{\"what_changed\":\"\",\"what_improved\":[],\"what_regressed\":[],\"transferable_insight\":\"When validating inputs, explicitly reject ambiguous representations rather than relying on coercion rules that may silently accept unintended values.\",\"domain_tags\":[\"input-validation\",\"data-integrity\",\"error-handling\"]}", "cost_usd": 0.042766000000000005, "bootstrap_seed": 0, "agent_model": "gpt-5.4", "held_out_score": null, "criterion_names": null, "per_criterion_scores": null, "failure_classification": {"category": "logic_error", "description": "The change intended to tighten age validation for boolean-like strings appears to have failed due to ambiguous or inconsistent handling, likely reflecting incorrect reasoning about how inputs are parsed/coerced (e.g., relying on int() behavior). The result is a behavioral mismatch rather than a formatting/parsing or scoping issue.", "fix_direction": "Rework the input-validation logic to explicitly detect boolean-like strings (e.g., case-insensitive 'true'/'false', '0'/'1' if applicable) and define deterministic rejection rules before any int() conversion; add focused test cases for edge inputs.", "confidence": 0.67}, "drafts_generated": 1, "drafts_survived": 1}
{"id": "ea84ba0a-a1be-4030-a7e3-a77e35543b55", "target_id": "B4-greedy", "git_sha": "a2b78daef57b11bce4730837a2c2b2664ae55692", "pre_experiment_sha": "a2b78daef57b11bce4730837a2c2b2664ae55692", "timestamp": "2026-04-19T16:11:02.106841+00:00", "hypothesis": "Reject float user_id values that are currently coerced by int(), making user lookup deterministic for one exact ambiguous boundary.", "hypothesis_source": "agent", "mutation_diff_summary": "", "score": 0.725, "score_ci_lower": null, "score_ci_upper": null, "raw_scores": null, "baseline_score": 0.725, "outcome": "DISCARDED", "failure_mode": null, "duration_seconds": 15.203986625070684, "tags": ["validation", "user_id", "deterministic"], "learnings": "{\"what_changed\":\"\",\"what_improved\":[],\"what_regressed\":[],\"transferable_insight\":\"When a system silently coerces ambiguous input types, rejecting the ambiguous cases can improve determinism even if it changes little else.\",\"domain_tags\":[\"data-validation\",\"determinism\",\"input-sanitization\"]}", "cost_usd": 0.042502000000000005, "bootstrap_seed": 0, "agent_model": "gpt-5.4", "held_out_score": null, "criterion_names": null, "per_criterion_scores": null, "failure_classification": {"category": "logic_error", "description": "The experiment intended to make user_id lookup deterministic around a float-to-int coercion boundary, but it still failed in an unspecified way (Failure Mode: unknown) while achieving a moderate score (0.7250), indicating the change did not correctly address the ambiguous boundary or the resulting behavior differs from the intended deterministic mapping.", "fix_direction": "Precisely define the ambiguous float-to-int boundary and add targeted tests for values near that threshold; ensure the lookup logic uses the intended rounding/truncation rule (or explicit mapping) rather than relying on implicit int() coercion.", "confidence": 0.62}, "drafts_generated": 1, "drafts_survived": 1}
{"id": "be9f30d7-f458-4ee2-a7f0-d124287c4e56", "target_id": "B4-greedy", "git_sha": "a2b78daef57b11bce4730837a2c2b2664ae55692", "pre_experiment_sha": "a2b78daef57b11bce4730837a2c2b2664ae55692", "timestamp": "2026-04-19T16:11:18.965556+00:00", "hypothesis": "Rejecting float user_id values removes one ambiguous coercion path and improves deterministic behavior with a minimal validation-only change.", "hypothesis_source": "agent", "mutation_diff_summary": "", "score": 0.725, "score_ci_lower": null, "score_ci_upper": null, "raw_scores": null, "baseline_score": 0.725, "outcome": "DISCARDED", "failure_mode": null, "duration_seconds": 14.34663666691631, "tags": ["validation-boundary", "user-id", "deterministic"], "learnings": "{\"what_changed\":\"\",\"what_improved\":[],\"what_regressed\":[],\"transferable_insight\":\"When a proposed change only tightens validation without altering core logic, it may reduce ambiguity but still fail to produce measurable improvement if the affected path is not a meaningful source of variability.\",\"domain_tags\":[\"validation\",\"determinism\",\"change-evaluation\"]}", "cost_usd": 0.0423388, "bootstrap_seed": 0, "agent_model": "gpt-5.4", "held_out_score": null, "criterion_names": null, "per_criterion_scores": null, "failure_classification": {"category": "incomplete_edit", "description": "The experiment is marked as failed with Failure Mode set to 'unknown' and a moderate score, suggesting an incomplete or inconsistent change: likely only partially applied the intended validation-only adjustment, leaving some cases still hitting ambiguous coercion paths.", "fix_direction": "Apply the proposed minimal validation-only change consistently across all relevant inputs, then add targeted tests to cover float user_id coercion scenarios and confirm deterministic behavior without affecting other logic.", "confidence": 0.62}, "drafts_generated": 1, "drafts_survived": 1}
