{"id": "3e267384-635b-433b-b39f-5e2c40ecbcd9", "target_id": "B4-greedy", "git_sha": "a2b78daef57b11bce4730837a2c2b2664ae55692", "pre_experiment_sha": "a2b78daef57b11bce4730837a2c2b2664ae55692", "timestamp": "2026-04-19T16:04:32.814485+00:00", "hypothesis": "Tighten age validation to reject non-exact/coercible values so ambiguous inputs behave deterministically.", "hypothesis_source": "agent", "mutation_diff_summary": "", "score": 0.725, "score_ci_lower": null, "score_ci_upper": null, "raw_scores": null, "baseline_score": 0.725, "outcome": "DISCARDED", "failure_mode": null, "duration_seconds": 15.87407154100947, "tags": ["validation", "determinism", "age"], "learnings": "{\"what_changed\":\"\",\"what_improved\":[],\"what_regressed\":[],\"transferable_insight\":\"When a rule must be unambiguous, validate inputs strictly so only exact matches are accepted and coercible edge cases are rejected deterministically.\",\"domain_tags\":[\"validation\",\"determinism\",\"input-handling\"]}", "cost_usd": 0.041110600000000004, "bootstrap_seed": 0, "agent_model": "gpt-5.4", "held_out_score": null, "criterion_names": null, "per_criterion_scores": null, "failure_classification": {"category": "semantic_drift", "description": "Despite the intended hypothesis (tighten age validation for deterministic handling of coercible/ambiguous inputs), the experiment failed with an unknown failure mode, suggesting behavior may have changed in an unintended way rather than a clear format/parsing or structural issue.", "fix_direction": "Rework the age validation to explicitly enforce exact type/range semantics (e.g., strict integer-only parsing with no coercion), add tests for ambiguous inputs (strings like '01', '1.0', ' 1 ', null/undefined, booleans, floats), and ensure deterministic rejection/acceptance paths.", "confidence": 0.55}, "drafts_generated": 1, "drafts_survived": 1}
{"id": "6436ef26-375b-4095-bbdd-b10ba03c0a26", "target_id": "B4-greedy", "git_sha": "a2b78daef57b11bce4730837a2c2b2664ae55692", "pre_experiment_sha": "a2b78daef57b11bce4730837a2c2b2664ae55692", "timestamp": "2026-04-19T16:04:52.398764+00:00", "hypothesis": "Tighten age validation to reject non-exact coercible values so inputs behave deterministically.", "hypothesis_source": "agent", "mutation_diff_summary": "", "score": 0.725, "score_ci_lower": null, "score_ci_upper": null, "raw_scores": null, "baseline_score": 0.725, "outcome": "DISCARDED", "failure_mode": null, "duration_seconds": 14.161188832949847, "tags": ["validation-boundary", "deterministic"], "learnings": "{\"what_changed\":\"\",\"what_improved\":[],\"what_regressed\":[],\"transferable_insight\":\"When validation is made stricter, it should reject ambiguous or coercible inputs only if the resulting behavior is clearly beneficial and consistently improves determinism without introducing regressions.\",\"domain_tags\":[\"validation\",\"reliability\",\"input-processing\"]}", "cost_usd": 0.0413994, "bootstrap_seed": 0, "agent_model": "gpt-5.4", "held_out_score": null, "criterion_names": null, "per_criterion_scores": null, "failure_classification": {"category": "logic_error", "description": "The attempt to tighten age validation appears to have not enforced the intended deterministic rejection rules for non-exact coercible values, resulting in behavior that still deviates from the hypothesis. This indicates the validation logic likely still treats some coercible/edge inputs incorrectly (e.g., exactness/type handling or comparison semantics), rather than a formatting or syntax issue.", "fix_direction": "Refine the age validation to explicitly enforce type/exact matching (e.g., strict numeric parsing and rejection of coercible non-exact inputs), and add targeted tests for boundary and coercion cases to verify deterministic behavior.", "confidence": 0.62}, "drafts_generated": 1, "drafts_survived": 1}
{"id": "92a33d66-8d3b-4e42-b8c1-2f96abdcf74a", "target_id": "B4-greedy", "git_sha": "a2b78daef57b11bce4730837a2c2b2664ae55692", "pre_experiment_sha": "a2b78daef57b11bce4730837a2c2b2664ae55692", "timestamp": "2026-04-19T16:05:09.160093+00:00", "hypothesis": "Tighten the age validation to reject coercible non-integer inputs so responses are deterministic for ambiguous age values.", "hypothesis_source": "agent", "mutation_diff_summary": "", "score": 0.725, "score_ci_lower": null, "score_ci_upper": null, "raw_scores": null, "baseline_score": 0.725, "outcome": "DISCARDED", "failure_mode": null, "duration_seconds": 14.298566250014119, "tags": ["validation", "deterministic", "boundary"], "learnings": "{\"what_changed\":\"\",\"what_improved\":[],\"what_regressed\":[],\"transferable_insight\":\"When input validation is made stricter to reject ambiguous coercible values, system behavior becomes more deterministic and easier to reason about.\",\"domain_tags\":[\"validation\",\"determinism\",\"input-handling\"]}", "cost_usd": 0.0414722, "bootstrap_seed": 0, "agent_model": "gpt-5.4", "held_out_score": null, "criterion_names": null, "per_criterion_scores": null, "failure_classification": {"category": "logic_error", "description": "The provided fields do not indicate how the experiment failed (Failure Mode is set to 'unknown'), and the score alone (0.7250) is insufficient to infer whether the failure was formatting, logic, regression, scope, syntax, semantic meaning, over-optimization, or an incomplete change.", "fix_direction": "Collect the actual failure symptoms (error logs, diff of code/config changes, and example ambiguous age inputs/outputs) to identify whether the issue is schema/format, validation logic, unintended side effects, or partial/inconsistent edits.", "confidence": 0.05}, "drafts_generated": 1, "drafts_survived": 1}
{"id": "83c9a683-a910-4a28-b1a0-2f0e33408a76", "target_id": "B4-greedy", "git_sha": "a2b78daef57b11bce4730837a2c2b2664ae55692", "pre_experiment_sha": "a2b78daef57b11bce4730837a2c2b2664ae55692", "timestamp": "2026-04-19T16:05:25.734147+00:00", "hypothesis": "Tighten the ambiguous age validation to reject non-integer/coercible inputs while preserving existing valid integer behavior.", "hypothesis_source": "agent", "mutation_diff_summary": "", "score": 0.725, "score_ci_lower": null, "score_ci_upper": null, "raw_scores": null, "baseline_score": 0.725, "outcome": "DISCARDED", "failure_mode": null, "duration_seconds": 14.151029042084701, "tags": ["validation", "deterministic", "boundary"], "learnings": "{\"what_changed\":\"\",\"what_improved\":[],\"what_regressed\":[],\"transferable_insight\":\"When a proposed change only narrows acceptance criteria without improving measurable outcomes, it is often better discarded to avoid adding complexity and breaking implicit compatibility.\",\"domain_tags\":[\"validation\",\"software-design\",\"compatibility\"]}", "cost_usd": 0.041491400000000005, "bootstrap_seed": 0, "agent_model": "gpt-5.4", "held_out_score": null, "criterion_names": null, "per_criterion_scores": null, "failure_classification": {"category": "semantic_drift", "description": "The change intended to tighten age validation likely altered the meaning of the validation rules beyond the intended constraint (e.g., rejecting or accepting inputs that should remain valid integers, or mishandling coercible values in an unintended way), while the output structure remained acceptable.", "fix_direction": "Constrain the validation to strictly require integer types (or exact integer-string formats) and add targeted test cases for boundary/edge inputs (e.g., '18', 18, '18.0', ' 18 ', '18abc', null/undefined) to ensure existing valid integer behavior is preserved.", "confidence": 0.68}, "drafts_generated": 1, "drafts_survived": 1}
{"id": "df318c2a-bac6-4158-8214-5858290c9bd5", "target_id": "B4-greedy", "git_sha": "a2b78daef57b11bce4730837a2c2b2664ae55692", "pre_experiment_sha": "a2b78daef57b11bce4730837a2c2b2664ae55692", "timestamp": "2026-04-19T16:05:48.886596+00:00", "hypothesis": "Tighten age validation to reject ambiguous non-integer numeric inputs instead of coercing them with int().", "hypothesis_source": "agent", "mutation_diff_summary": "", "score": 0.725, "score_ci_lower": null, "score_ci_upper": null, "raw_scores": null, "baseline_score": 0.725, "outcome": "DISCARDED", "failure_mode": null, "duration_seconds": 17.457329624914564, "tags": ["validation-boundary", "deterministic"], "learnings": "{\"what_changed\":\"\",\"what_improved\":[],\"what_regressed\":[],\"transferable_insight\":\"When validating user input, prefer explicit rejection of ambiguous values over silent coercion to preserve correctness and predictability.\",\"domain_tags\":[\"validation\",\"data-quality\",\"input-processing\"]}", "cost_usd": 0.0418176, "bootstrap_seed": 0, "agent_model": "gpt-5.4", "held_out_score": null, "criterion_names": null, "per_criterion_scores": null, "failure_classification": {"category": "logic_error", "description": "The experiment failed, but no failure mode details were provided beyond the hypothesis about tightening age validation and an 'unknown' failure mode. With no error trace, mismatch, or behavioral description, it's not possible to determine which category best fits (e.g., parsing/format/logic/regression).", "fix_direction": "Provide the actual failing behavior (error message/stack trace), the expected vs observed outputs, and what inputs triggered the failure (especially non-integer numeric strings) so the failure can be mapped to output_format, logic_error, regression, or syntax/semantic issues.", "confidence": 0.05}, "drafts_generated": 1, "drafts_survived": 1}
{"id": "894d90cb-caf6-4113-93b5-3c9db79f41c5", "target_id": "B4-greedy", "git_sha": "a2b78daef57b11bce4730837a2c2b2664ae55692", "pre_experiment_sha": "a2b78daef57b11bce4730837a2c2b2664ae55692", "timestamp": "2026-04-19T16:06:06.612789+00:00", "hypothesis": "Tighten the ambiguous age validation to reject non-integer-coercible strings/floats by accepting only exact int values for age.", "hypothesis_source": "agent", "mutation_diff_summary": "", "score": 0.725, "score_ci_lower": null, "score_ci_upper": null, "raw_scores": null, "baseline_score": 0.725, "outcome": "DISCARDED", "failure_mode": null, "duration_seconds": 15.15400970808696, "tags": ["validation", "deterministic", "age"], "learnings": "{\"what_changed\":\"\",\"what_improved\":[],\"what_regressed\":[],\"transferable_insight\":\"When a validation rule is made stricter, it should preserve only the exact input forms the system truly needs, because over-tightening can add no value while reducing compatibility.\",\"domain_tags\":[\"validation\",\"input-handling\",\"software-design\"]}", "cost_usd": 0.041786, "bootstrap_seed": 0, "agent_model": "gpt-5.4", "held_out_score": null, "criterion_names": null, "per_criterion_scores": null, "failure_classification": {"category": "semantic_drift", "description": "The attempted change to age validation appears to have not matched the intended behavior precisely (score is high but the experiment is considered failed), suggesting the validation rules deviated from \u201caccept only exact int values\u201d in some cases (e.g., unintentionally allowing or rejecting certain inputs, or handling coercion/rounding differently than specified).", "fix_direction": "Tighten validation to require strict integer types/representations (no floats/strings with decimals/extraneous characters), add explicit test cases for boundary and tricky inputs (e.g., \"18\", \"18.0\", 18.0, \"18.5\", \" 18 \", null/empty), and ensure type-checking/parse logic is unambiguous.", "confidence": 0.72}, "drafts_generated": 1, "drafts_survived": 1}
{"id": "0f8989a2-1873-4031-9899-da54d2d8b7c5", "target_id": "B4-greedy", "git_sha": "a2b78daef57b11bce4730837a2c2b2664ae55692", "pre_experiment_sha": "a2b78daef57b11bce4730837a2c2b2664ae55692", "timestamp": "2026-04-19T16:06:25.616690+00:00", "hypothesis": "Tighten age validation to reject non-integer-coercible float inputs consistently.", "hypothesis_source": "agent", "mutation_diff_summary": "", "score": 0.725, "score_ci_lower": null, "score_ci_upper": null, "raw_scores": null, "baseline_score": 0.725, "outcome": "DISCARDED", "failure_mode": null, "duration_seconds": 16.041638083057478, "tags": ["validation-boundary", "deterministic"], "learnings": "{\"what_changed\":\"\",\"what_improved\":[],\"what_regressed\":[],\"transferable_insight\":\"When a proposed validation change does not alter outcomes or behavior, it likely adds complexity without measurable benefit and should be discarded.\",\"domain_tags\":[\"validation\",\"decision-making\",\"software-quality\"]}", "cost_usd": 0.041832600000000005, "bootstrap_seed": 0, "agent_model": "gpt-5.4", "held_out_score": null, "criterion_names": null, "per_criterion_scores": null, "failure_classification": {"category": "logic_error", "description": "The provided information does not include any concrete observed failure details (e.g., actual error output, incorrect acceptance/rejection behavior, or schema/logical breakdown). With only the hypothesis and an 'unknown' failure mode, the specific reason for failure cannot be determined among the listed categories.", "fix_direction": "Reproduce the failure with a concrete test case showing the non-integer-coercible float input and the expected vs. actual behavior, then identify whether the issue is output formatting, logic, regression, scope, syntax, semantic meaning, or incomplete edits.", "confidence": 0.18}, "drafts_generated": 1, "drafts_survived": 1}
{"id": "11d1f8fb-c226-469c-9e6c-f0239bfcfc61", "target_id": "B4-greedy", "git_sha": "a2b78daef57b11bce4730837a2c2b2664ae55692", "pre_experiment_sha": "a2b78daef57b11bce4730837a2c2b2664ae55692", "timestamp": "2026-04-19T16:06:47.098835+00:00", "hypothesis": "Make update field application deterministic by iterating over a sorted key order in update_user.", "hypothesis_source": "agent", "mutation_diff_summary": "", "score": 0.725, "score_ci_lower": null, "score_ci_upper": null, "raw_scores": null, "baseline_score": 0.725, "outcome": "DISCARDED", "failure_mode": null, "duration_seconds": 14.076273084036075, "tags": ["determinism", "ordering", "minimal-change"], "learnings": "{\"what_changed\":\"\",\"what_improved\":[],\"what_regressed\":[],\"transferable_insight\":\"When a change only enforces deterministic ordering without altering behavior, it may improve reproducibility but not necessarily produce measurable outcome gains.\",\"domain_tags\":[\"determinism\",\"software-engineering\"]}", "cost_usd": 0.041865000000000006, "bootstrap_seed": 0, "agent_model": "gpt-5.4", "held_out_score": null, "criterion_names": null, "per_criterion_scores": null, "failure_classification": {"category": "logic_error", "description": "The experiment intended to make update field application deterministic by sorting keys in update_user, but the reported failure mode is \u201cunknown\u201d and no concrete evidence of the exact type of failure (format, logic, regression, etc.) is provided. The score (0.7250) suggests incomplete or incorrect behavior, but the underlying issue can\u2019t be classified from the given information.", "fix_direction": "Instrument update_user to confirm the actual iteration order used, add deterministic test cases for update field application, and verify that the sorted key order covers all relevant fields without altering intended semantics.", "confidence": 0.18}, "drafts_generated": 1, "drafts_survived": 1}
{"id": "a0258e0b-1162-4ccb-9a45-79b4649d06bd", "target_id": "B4-greedy", "git_sha": "a2b78daef57b11bce4730837a2c2b2664ae55692", "pre_experiment_sha": "a2b78daef57b11bce4730837a2c2b2664ae55692", "timestamp": "2026-04-19T16:07:05.043052+00:00", "hypothesis": "Sort update fields before applying them so responses are deterministic for equivalent patch payloads with varying key order.", "hypothesis_source": "agent", "mutation_diff_summary": "", "score": 0.725, "score_ci_lower": null, "score_ci_upper": null, "raw_scores": null, "baseline_score": 0.725, "outcome": "DISCARDED", "failure_mode": null, "duration_seconds": 14.73026199999731, "tags": ["determinism", "ordering", "update"], "learnings": "{\"what_changed\":\"\",\"what_improved\":[],\"what_regressed\":[],\"transferable_insight\":\"When multiple input representations are semantically equivalent, normalizing their order before processing can improve determinism and consistency without changing behavior.\",\"domain_tags\":[\"determinism\",\"normalization\",\"data-processing\"]}", "cost_usd": 0.0418936, "bootstrap_seed": 0, "agent_model": "gpt-5.4", "held_out_score": null, "criterion_names": null, "per_criterion_scores": null, "failure_classification": {"category": "semantic_drift", "description": "The experiment appears to have partially addressed determinism (ordering fields) but the observed behavior still isn\u2019t correct for equivalent patch payloads; responses remain inconsistent in meaning rather than just formatting, indicating the change didn\u2019t faithfully preserve patch semantics while reordering.", "fix_direction": "Verify that sorting update fields does not change effective patch application order/merge semantics; add tests covering equivalent payloads with different key orders and ensure stable application logic (including nested objects/arrays) preserves the intended meaning.", "confidence": 0.62}, "drafts_generated": 1, "drafts_survived": 1}
{"id": "5ddd76f0-2213-4795-b51c-0b25097fc74e", "target_id": "B4-greedy", "git_sha": "a2b78daef57b11bce4730837a2c2b2664ae55692", "pre_experiment_sha": "a2b78daef57b11bce4730837a2c2b2664ae55692", "timestamp": "2026-04-19T16:07:22.388680+00:00", "hypothesis": "Sort update fields before applying them so the response is deterministic for the same payload regardless of input dict iteration order.", "hypothesis_source": "agent", "mutation_diff_summary": "", "score": 0.725, "score_ci_lower": null, "score_ci_upper": null, "raw_scores": null, "baseline_score": 0.725, "outcome": "DISCARDED", "failure_mode": null, "duration_seconds": 14.907036209013313, "tags": ["determinism", "ordering", "update"], "learnings": "{\"what_changed\":\"\",\"what_improved\":[],\"what_regressed\":[],\"transferable_insight\":\"When a system\u2019s output should be repeatable for identical inputs, normalize the input processing order before applying changes to eliminate nondeterminism from iteration order.\",\"domain_tags\":[\"determinism\",\"input-normalization\",\"software-engineering\"]}", "cost_usd": 0.0419516, "bootstrap_seed": 0, "agent_model": "gpt-5.4", "held_out_score": null, "criterion_names": null, "per_criterion_scores": null, "failure_classification": {"category": "semantic_drift", "description": "The experiment intended to make responses deterministic by sorting update fields, but the outcome (score 0.7250 with failure mode marked unknown) indicates the change did not achieve the intended behavior\u2014likely the update application order still affected the meaning/content of the response, producing inconsistent or incorrect results rather than a pure deterministic ordering fix.", "fix_direction": "Verify determinism end-to-end: ensure all sources of iteration order are eliminated (e.g., sort keys at the right nesting level, use stable ordering for all collections), add regression tests that assert identical outputs for payloads with different dict key orders.", "confidence": 0.62}, "drafts_generated": 1, "drafts_survived": 1}
{"id": "46643504-8bde-4e9f-8358-1fc83d93de3c", "target_id": "B4-greedy", "git_sha": "a2b78daef57b11bce4730837a2c2b2664ae55692", "pre_experiment_sha": "a2b78daef57b11bce4730837a2c2b2664ae55692", "timestamp": "2026-04-19T16:07:44.740442+00:00", "hypothesis": "Tighten the ambiguous age validation to reject non-integer/coercible inputs while preserving exact integer behavior.", "hypothesis_source": "agent", "mutation_diff_summary": "", "score": 0.725, "score_ci_lower": null, "score_ci_upper": null, "raw_scores": null, "baseline_score": 0.725, "outcome": "DISCARDED", "failure_mode": null, "duration_seconds": 15.2865230840398, "tags": ["validation", "deterministic", "narrow-fix"], "learnings": "{\"what_changed\":\"\",\"what_improved\":[],\"what_regressed\":[],\"transferable_insight\":\"When a change only narrows input acceptance without improving outcomes, it is often a no-op and should be discarded unless it clearly fixes a real failure mode.\",\"domain_tags\":[\"validation\",\"experimentation\",\"decision-making\"]}", "cost_usd": 0.0424366, "bootstrap_seed": 0, "agent_model": "gpt-5.4", "held_out_score": null, "criterion_names": null, "per_criterion_scores": null, "failure_classification": {"category": "logic_error", "description": "The provided fields do not contain enough information about the actual failure mechanism or observed behavior; the failure mode is explicitly listed as \"unknown\" and no test/output details are given to map to a specific category.", "fix_direction": "Re-run with instrumentation: capture the exact failing inputs/outputs and the expected vs actual behavior; then verify whether the failure is due to parsing/formatting, altered comparison logic (non-integers vs integers), range handling, or constraints/regression.", "confidence": 0.05}, "drafts_generated": 1, "drafts_survived": 1}
