{"id": "21806f1d-f1bf-48a3-88f4-4cc765694334", "target_id": "B4-treatment", "git_sha": "1ce0ef8ea16c431a863b6a24ce37c1d50db4f854", "pre_experiment_sha": "1e2fd2a149033eff10d815534b1124eca2800a4b", "timestamp": "2026-04-19T00:53:21.353551+00:00", "hypothesis": "Normalize filter handling through the same path as payload validation and make partial-update payload validation explicitly deterministic.", "hypothesis_source": "agent", "mutation_diff_summary": "", "score": 0.75, "score_ci_lower": null, "score_ci_upper": null, "raw_scores": null, "baseline_score": 0.75, "outcome": "KEPT", "failure_mode": null, "duration_seconds": 16.102374125039205, "tags": ["deterministic", "validation", "serialization", "filters"], "learnings": "{\"what_changed\":\"\",\"what_improved\":[],\"what_regressed\":[],\"transferable_insight\":\"Routing similar inputs through a single validation path and making partial-update rules explicit improves determinism and reduces ambiguity without changing outcomes.\",\"domain_tags\":[\"validation\",\"determinism\",\"software-design\"]}", "cost_usd": 0.041065000000000004, "bootstrap_seed": 0, "agent_model": "gpt-5.4", "held_out_score": null, "criterion_names": null, "per_criterion_scores": null, "failure_classification": null, "drafts_generated": 1, "drafts_survived": 1}
{"id": "9e09bbfc-41de-4deb-93a4-8d8f02fcf33b", "target_id": "B4-treatment", "git_sha": "010470ea1a8ac818345bbb5f298eb9703ac4a2b7", "pre_experiment_sha": "1ce0ef8ea16c431a863b6a24ce37c1d50db4f854", "timestamp": "2026-04-19T00:53:37.225845+00:00", "hypothesis": "Use one normalization path for payloads and filters and remove unused duplicate validators to make behavior stricter and more deterministic.", "hypothesis_source": "agent", "mutation_diff_summary": "", "score": 0.75, "score_ci_lower": null, "score_ci_upper": null, "raw_scores": null, "baseline_score": 0.75, "outcome": "KEPT", "failure_mode": null, "duration_seconds": 14.341999958036467, "tags": ["determinism", "validation", "serialization", "consistency"], "learnings": "{\"what_changed\":\"\",\"what_improved\":[],\"what_regressed\":[],\"transferable_insight\":\"Consolidating parallel processing paths into a single normalization flow and removing redundant checks can make behavior more predictable without changing outcomes.\",\"domain_tags\":[\"software-engineering\",\"refactoring\",\"reliability\"]}", "cost_usd": 0.040805, "bootstrap_seed": 0, "agent_model": "gpt-5.4", "held_out_score": null, "criterion_names": null, "per_criterion_scores": null, "failure_classification": null, "drafts_generated": 1, "drafts_survived": 1}
{"id": "cb3ad55f-8f53-47e0-b8e2-568cbb24d1d7", "target_id": "B4-treatment", "git_sha": "be5bf3625ad859d909d296475f41219719036ba1", "pre_experiment_sha": "010470ea1a8ac818345bbb5f298eb9703ac4a2b7", "timestamp": "2026-04-19T00:53:55.913105+00:00", "hypothesis": "Reuse one deterministic name-normalization helper across payload and filter handling so validation, filtering, storage, and serialization stay aligned.", "hypothesis_source": "agent", "mutation_diff_summary": "", "score": 0.75, "score_ci_lower": null, "score_ci_upper": null, "raw_scores": null, "baseline_score": 0.75, "outcome": "KEPT", "failure_mode": null, "duration_seconds": 14.744000874925405, "tags": ["determinism", "normalization", "validation"], "learnings": "{\"what_changed\":\"\",\"what_improved\":[],\"what_regressed\":[],\"transferable_insight\":\"Using one deterministic normalization routine across all input and output paths keeps validation, filtering, storage, and serialization consistent and reduces subtle mismatches.\",\"domain_tags\":[\"software-engineering\",\"data-processing\",\"validation\"]}", "cost_usd": 0.04089, "bootstrap_seed": 0, "agent_model": "gpt-5.4", "held_out_score": null, "criterion_names": null, "per_criterion_scores": null, "failure_classification": null, "drafts_generated": 1, "drafts_survived": 1}
{"id": "8e431047-0033-40f9-b06f-bf1d3c9f1e23", "target_id": "B4-treatment", "git_sha": "d178d7ffc30b0e50c425f50e32a0bb6a92179ee2", "pre_experiment_sha": "be5bf3625ad859d909d296475f41219719036ba1", "timestamp": "2026-04-19T00:54:11.104753+00:00", "hypothesis": "Reuse a single email normalization helper across validation, storage, and updates to make payload handling deterministic.", "hypothesis_source": "agent", "mutation_diff_summary": "", "score": 0.75, "score_ci_lower": null, "score_ci_upper": null, "raw_scores": null, "baseline_score": 0.75, "outcome": "KEPT", "failure_mode": null, "duration_seconds": 14.181460874970071, "tags": ["determinism", "normalization", "validation", "serialization"], "learnings": "{\"what_changed\":\"\",\"what_improved\":[],\"what_regressed\":[],\"transferable_insight\":\"Using one shared normalization step across all input paths keeps data handling consistent and makes system behavior deterministic.\",\"domain_tags\":[\"data-processing\",\"software-design\",\"validation\"]}", "cost_usd": 0.041385000000000005, "bootstrap_seed": 0, "agent_model": "gpt-5.4", "held_out_score": null, "criterion_names": null, "per_criterion_scores": null, "failure_classification": null, "drafts_generated": 1, "drafts_survived": 1}
{"id": "df344658-378c-4723-89dd-5670d638b984", "target_id": "B4-treatment", "git_sha": "07680b6c9e379a1b3fcf9bd043c658c195fea533", "pre_experiment_sha": "d178d7ffc30b0e50c425f50e32a0bb6a92179ee2", "timestamp": "2026-04-19T00:54:27.107089+00:00", "hypothesis": "Make serialization use the same normalized field shaping path as storage and filtering for more deterministic responses.", "hypothesis_source": "agent", "mutation_diff_summary": "", "score": 0.75, "score_ci_lower": null, "score_ci_upper": null, "raw_scores": null, "baseline_score": 0.75, "outcome": "KEPT", "failure_mode": null, "duration_seconds": 14.994268417009152, "tags": ["determinism", "normalization", "serialization"], "learnings": "{\"what_changed\":\"\",\"what_improved\":[],\"what_regressed\":[],\"transferable_insight\":\"Using a single normalized transformation path across related operations improves determinism and consistency, even when it does not immediately change measured outcomes.\",\"domain_tags\":[\"software-engineering\",\"data-processing\",\"system-design\"]}", "cost_usd": 0.042495000000000005, "bootstrap_seed": 0, "agent_model": "gpt-5.4", "held_out_score": null, "criterion_names": null, "per_criterion_scores": null, "failure_classification": null, "drafts_generated": 1, "drafts_survived": 1}
{"id": "fcc32ee1-7eb4-4e98-87ec-6e6114a110e0", "target_id": "B4-treatment", "git_sha": "5d45641fe4fd1c0fe2ea5504432b11f4ba1c6b2b", "pre_experiment_sha": "07680b6c9e379a1b3fcf9bd043c658c195fea533", "timestamp": "2026-04-19T00:54:44.966422+00:00", "hypothesis": "Apply the same lowercase email normalization everywhere the endpoint validates, stores, and serializes email values.", "hypothesis_source": "agent", "mutation_diff_summary": "", "score": 0.75, "score_ci_lower": null, "score_ci_upper": null, "raw_scores": null, "baseline_score": 0.75, "outcome": "KEPT", "failure_mode": null, "duration_seconds": 13.95549950003624, "tags": ["normalization", "determinism", "consistency"], "learnings": "{\"what_changed\":\"\",\"what_improved\":[],\"what_regressed\":[],\"transferable_insight\":\"Apply the same normalization rule consistently at every point where a value is validated, stored, and returned to avoid representation mismatches.\",\"domain_tags\":[\"data-consistency\",\"input-validation\",\"serialization\"]}", "cost_usd": 0.04327500000000001, "bootstrap_seed": 0, "agent_model": "gpt-5.4", "held_out_score": null, "criterion_names": null, "per_criterion_scores": null, "failure_classification": null, "drafts_generated": 1, "drafts_survived": 1}
{"id": "8eb34257-fbf7-420b-a278-20b61d62c1dc", "target_id": "B4-treatment", "git_sha": "55459a25c4f220a96cd2207f1fb9983c7b14909f", "pre_experiment_sha": "5d45641fe4fd1c0fe2ea5504432b11f4ba1c6b2b", "timestamp": "2026-04-19T00:55:00.707688+00:00", "hypothesis": "Use the same name normalization helper for storage and serialization so name handling is deterministic across create, update, list, and get.", "hypothesis_source": "agent", "mutation_diff_summary": "", "score": 0.75, "score_ci_lower": null, "score_ci_upper": null, "raw_scores": null, "baseline_score": 0.75, "outcome": "KEPT", "failure_mode": null, "duration_seconds": 14.706865499960259, "tags": ["determinism", "normalization", "consistency"], "learnings": "{\"what_changed\":\"\",\"what_improved\":[],\"what_regressed\":[],\"transferable_insight\":\"Using one shared normalization path for all data flows keeps behavior deterministic and prevents inconsistencies between creation, updates, retrieval, and listing.\",\"domain_tags\":[\"data-consistency\",\"deterministic-processing\",\"software-design\"]}", "cost_usd": 0.043750000000000004, "bootstrap_seed": 0, "agent_model": "gpt-5.4", "held_out_score": null, "criterion_names": null, "per_criterion_scores": null, "failure_classification": null, "drafts_generated": 1, "drafts_survived": 1}
{"id": "b88e83be-00c8-4393-b322-d3b9ca6927fd", "target_id": "B4-treatment", "git_sha": "793dd6e35993d77f3f14bbaaa1e95c36dfa7c210", "pre_experiment_sha": "55459a25c4f220a96cd2207f1fb9983c7b14909f", "timestamp": "2026-04-19T00:55:16.097265+00:00", "hypothesis": "Use the same name normalization value directly in filtering to avoid redundant re-normalization and ensure deterministic handling.", "hypothesis_source": "agent", "mutation_diff_summary": "", "score": 0.75, "score_ci_lower": null, "score_ci_upper": null, "raw_scores": null, "baseline_score": 0.75, "outcome": "KEPT", "failure_mode": null, "duration_seconds": 14.311253290972672, "tags": ["deterministic", "normalization", "filtering", "consistency"], "learnings": "{\"what_changed\":\"\",\"what_improved\":[],\"what_regressed\":[],\"transferable_insight\":\"Reusing a previously normalized value in downstream filtering can reduce redundant work and improve determinism by keeping the same canonical form throughout the pipeline.\",\"domain_tags\":[\"data-processing\",\"software-engineering\",\"determinism\"]}", "cost_usd": 0.043710000000000006, "bootstrap_seed": 0, "agent_model": "gpt-5.4", "held_out_score": null, "criterion_names": null, "per_criterion_scores": null, "failure_classification": null, "drafts_generated": 1, "drafts_survived": 1}
{"id": "ecf2cbad-d9d3-4ccc-8e5a-7623a60665bd", "target_id": "B4-treatment", "git_sha": "e1ebf6eb4b810a99830e0728aa08cc79e0c04d10", "pre_experiment_sha": "793dd6e35993d77f3f14bbaaa1e95c36dfa7c210", "timestamp": "2026-04-19T00:55:36.324029+00:00", "hypothesis": "Use the existing normalized name value directly in list filtering so validation, filtering, storage, and serialization all follow the same path.", "hypothesis_source": "agent", "mutation_diff_summary": "", "score": 0.75, "score_ci_lower": null, "score_ci_upper": null, "raw_scores": null, "baseline_score": 0.75, "outcome": "KEPT", "failure_mode": null, "duration_seconds": 16.32909999997355, "tags": ["deterministic", "normalization", "filtering", "consistency"], "learnings": "{\"what_changed\":\"\",\"what_improved\":[],\"what_regressed\":[],\"transferable_insight\":\"When a normalized representation already exists, reusing it consistently across validation, filtering, storage, and serialization reduces divergence and keeps behavior aligned end to end.\",\"domain_tags\":[\"data-processing\",\"software-engineering\",\"validation\"]}", "cost_usd": 0.044210000000000006, "bootstrap_seed": 0, "agent_model": "gpt-5.4", "held_out_score": null, "criterion_names": null, "per_criterion_scores": null, "failure_classification": null, "drafts_generated": 1, "drafts_survived": 1}
{"id": "c6cd7caa-03d2-410b-8fad-568b8930ede9", "target_id": "B4-treatment", "git_sha": "1c7430bedd6370a6ff992fc7d13afdb83ba02b04", "pre_experiment_sha": "e1ebf6eb4b810a99830e0728aa08cc79e0c04d10", "timestamp": "2026-04-19T00:56:05.600915+00:00", "hypothesis": "Reuse the same normalized name helper for filter matching and stored updates to keep name handling fully deterministic across payloads, filtering, storage, and serialization.", "hypothesis_source": "agent", "mutation_diff_summary": "", "score": 0.75, "score_ci_lower": null, "score_ci_upper": null, "raw_scores": null, "baseline_score": 0.75, "outcome": "KEPT", "failure_mode": null, "duration_seconds": 14.262766750063747, "tags": ["determinism", "normalization", "consistency"], "learnings": "{\"what_changed\":\"\",\"what_improved\":[],\"what_regressed\":[],\"transferable_insight\":\"Using one shared normalization routine for all read, write, filter, and serialization paths keeps behavior deterministic and prevents subtle inconsistencies across the system.\",\"domain_tags\":[\"software-engineering\",\"data-processing\",\"deterministic-behavior\"]}", "cost_usd": 0.044480000000000006, "bootstrap_seed": 0, "agent_model": "gpt-5.4", "held_out_score": null, "criterion_names": null, "per_criterion_scores": null, "failure_classification": null, "drafts_generated": 1, "drafts_survived": 1}
{"id": "24d1de70-db45-407e-9f75-2d3143be87e9", "target_id": "B4-treatment", "git_sha": "71a7d5795de27cdc44d73143356a0e1c3a9c1663", "pre_experiment_sha": "1c7430bedd6370a6ff992fc7d13afdb83ba02b04", "timestamp": "2026-04-19T00:56:25.041950+00:00", "hypothesis": "Reuse the canonical normalized name value directly across storage, filtering, and serialization so name handling is identical in every path.", "hypothesis_source": "agent", "mutation_diff_summary": "", "score": 0.75, "score_ci_lower": null, "score_ci_upper": null, "raw_scores": null, "baseline_score": 0.75, "outcome": "KEPT", "failure_mode": null, "duration_seconds": 15.178548624971882, "tags": ["determinism", "normalization", "consistency", "name-field"], "learnings": "{\"what_changed\":\"\",\"what_improved\":[],\"what_regressed\":[],\"transferable_insight\":\"Using one canonical normalized representation consistently across all processing stages reduces divergence and keeps behavior identical end to end.\",\"domain_tags\":[\"data-processing\",\"software-design\",\"normalization\"]}", "cost_usd": 0.043745000000000006, "bootstrap_seed": 0, "agent_model": "gpt-5.4", "held_out_score": null, "criterion_names": null, "per_criterion_scores": null, "failure_classification": null, "drafts_generated": 1, "drafts_survived": 1}
{"id": "ba5bebef-161f-4181-850e-f5f4ee5c2507", "target_id": "B4-treatment", "git_sha": "672b9cfe980452c544c33ca5af44551086fa1a85", "pre_experiment_sha": "71a7d5795de27cdc44d73143356a0e1c3a9c1663", "timestamp": "2026-04-19T00:56:40.890413+00:00", "hypothesis": "Make email use the same already-normalized stored value everywhere instead of re-normalizing during serialization and update handling.", "hypothesis_source": "agent", "mutation_diff_summary": "", "score": 0.75, "score_ci_lower": null, "score_ci_upper": null, "raw_scores": null, "baseline_score": 0.75, "outcome": "KEPT", "failure_mode": null, "duration_seconds": 14.826591667020693, "tags": ["determinism", "normalization", "email", "serialization", "update"], "learnings": "{\"what_changed\":\"\",\"what_improved\":[],\"what_regressed\":[],\"transferable_insight\":\"Using one canonical normalized representation consistently across all read and write paths reduces duplication and avoids subtle inconsistencies introduced by repeated transformation.\",\"domain_tags\":[\"data-normalization\",\"software-design\",\"state-management\"]}", "cost_usd": 0.043480000000000005, "bootstrap_seed": 0, "agent_model": "gpt-5.4", "held_out_score": null, "criterion_names": null, "per_criterion_scores": null, "failure_classification": null, "drafts_generated": 1, "drafts_survived": 1}
{"id": "316477c9-de15-401c-a9ee-f137a94944e2", "target_id": "B4-treatment", "git_sha": "c98be54fc9fcf082f8234e736615b2aa175c5dce", "pre_experiment_sha": "672b9cfe980452c544c33ca5af44551086fa1a85", "timestamp": "2026-04-19T00:56:57.346595+00:00", "hypothesis": "Use the existing normalized name value consistently for list filtering by comparing against the canonical serialized/stored name path.", "hypothesis_source": "agent", "mutation_diff_summary": "", "score": 0.75, "score_ci_lower": null, "score_ci_upper": null, "raw_scores": null, "baseline_score": 0.75, "outcome": "KEPT", "failure_mode": null, "duration_seconds": 15.258610917022452, "tags": ["determinism", "normalization", "filtering", "serialization"], "learnings": "{\"what_changed\":\"\",\"what_improved\":[],\"what_regressed\":[],\"transferable_insight\":\"When filtering or matching records, consistently compare against a single canonical representation of the value to avoid discrepancies and preserve stable behavior.\",\"domain_tags\":[\"data-processing\",\"software-engineering\",\"normalization\"]}", "cost_usd": 0.04367, "bootstrap_seed": 0, "agent_model": "gpt-5.4", "held_out_score": null, "criterion_names": null, "per_criterion_scores": null, "failure_classification": null, "drafts_generated": 1, "drafts_survived": 1}
{"id": "fc6edfae-078a-47d5-9eee-8ba0381b3a7b", "target_id": "B4-treatment", "git_sha": "1fee2ca637b98e1580b54957629dbd7b8aae3f92", "pre_experiment_sha": "c98be54fc9fcf082f8234e736615b2aa175c5dce", "timestamp": "2026-04-19T00:57:23.002529+00:00", "hypothesis": "Reuse the already-normalized name value consistently in storage, filtering, and serialization paths to remove branch-dependent renormalization.", "hypothesis_source": "agent", "mutation_diff_summary": "", "score": 0.75, "score_ci_lower": null, "score_ci_upper": null, "raw_scores": null, "baseline_score": 0.75, "outcome": "KEPT", "failure_mode": null, "duration_seconds": 22.176509833079763, "tags": ["determinism", "normalization", "name-field"], "learnings": "{\"what_changed\":\"\",\"what_improved\":[],\"what_regressed\":[],\"transferable_insight\":\"Normalize data once at the boundary and reuse the canonical form consistently across storage, filtering, and serialization to avoid redundant branching and subtle inconsistencies.\",\"domain_tags\":[\"data-processing\",\"software-engineering\",\"code-quality\"]}", "cost_usd": 0.042865, "bootstrap_seed": 0, "agent_model": "gpt-5.4", "held_out_score": null, "criterion_names": null, "per_criterion_scores": null, "failure_classification": null, "drafts_generated": 1, "drafts_survived": 1}
{"id": "589732db-c8ff-43ef-9bee-0f8699792482", "target_id": "B4-treatment", "git_sha": "351f42e91e4a537f5161cc6e47303408d8e18f2c", "pre_experiment_sha": "1fee2ca637b98e1580b54957629dbd7b8aae3f92", "timestamp": "2026-04-19T00:57:39.785882+00:00", "hypothesis": "Use the already-normalized email value directly everywhere so storage, serialization, and validation all agree on one canonical representation.", "hypothesis_source": "agent", "mutation_diff_summary": "", "score": 0.75, "score_ci_lower": null, "score_ci_upper": null, "raw_scores": null, "baseline_score": 0.75, "outcome": "KEPT", "failure_mode": null, "duration_seconds": 15.744106666999869, "tags": ["determinism", "email", "normalization", "serialization", "storage"], "learnings": "{\"what_changed\":\"\",\"what_improved\":[],\"what_regressed\":[],\"transferable_insight\":\"When a system consistently uses one canonical representation across storage, serialization, and validation, it reduces ambiguity and keeps behavior aligned end to end.\",\"domain_tags\":[\"data-consistency\",\"system-design\",\"validation\"]}", "cost_usd": 0.04274, "bootstrap_seed": 0, "agent_model": "gpt-5.4", "held_out_score": null, "criterion_names": null, "per_criterion_scores": null, "failure_classification": null, "drafts_generated": 1, "drafts_survived": 1}
{"id": "1b0f601a-bbb2-46f2-9e89-d2737f2cd658", "target_id": "B4-treatment", "git_sha": "54f12a4032438f422a68785f6f4d90eec74964fb", "pre_experiment_sha": "351f42e91e4a537f5161cc6e47303408d8e18f2c", "timestamp": "2026-04-19T00:57:55.621106+00:00", "hypothesis": "Route email filtering through the existing canonical email normalizer and compare against the stored canonical email value everywhere.", "hypothesis_source": "agent", "mutation_diff_summary": "", "score": 0.75, "score_ci_lower": null, "score_ci_upper": null, "raw_scores": null, "baseline_score": 0.75, "outcome": "KEPT", "failure_mode": null, "duration_seconds": 14.719713959028013, "tags": ["determinism", "normalization", "email", "filtering", "serialization"], "learnings": "{\"what_changed\":\"\",\"what_improved\":[],\"what_regressed\":[],\"transferable_insight\":\"Using a single canonical normalization path for comparisons can eliminate inconsistency without changing outcomes when the existing stored canonical form already matches the filter logic.\",\"domain_tags\":[\"data-normalization\",\"comparison-consistency\",\"software-engineering\"]}", "cost_usd": 0.052015000000000006, "bootstrap_seed": 0, "agent_model": "gpt-5.4", "held_out_score": null, "criterion_names": null, "per_criterion_scores": null, "failure_classification": null, "drafts_generated": 1, "drafts_survived": 1}
