{"id": "dfac08a1-b2b3-48ed-9e10-3c6bd217ea71", "target_id": "B4-treatment", "git_sha": "23b8727db85d8427d4f5d5e9ced19435df80c80f", "pre_experiment_sha": "3b452d4d4a3bc0f302632065ef61cb2ba6a6552a", "timestamp": "2026-04-19T16:29:19.716256+00:00", "hypothesis": "Make the endpoint deterministic and stricter by removing time-based nondeterminism and adding explicit input validation.", "hypothesis_source": "agent", "mutation_diff_summary": "", "score": 0.7, "score_ci_lower": null, "score_ci_upper": null, "raw_scores": null, "baseline_score": 0.435, "outcome": "KEPT", "failure_mode": null, "duration_seconds": 11.40858641709201, "tags": ["determinism", "validation", "error-handling", "serialization"], "learnings": "{\"what_changed\":\"\",\"what_improved\":[],\"what_regressed\":[],\"transferable_insight\":\"Reducing nondeterminism and enforcing explicit validation makes behavior more predictable and robust without changing the core outcome.\",\"domain_tags\":[\"reliability\",\"validation\",\"determinism\"]}", "cost_usd": 0.026745, "bootstrap_seed": 0, "agent_model": "gpt-5.4", "held_out_score": null, "criterion_names": null, "per_criterion_scores": null, "failure_classification": null, "drafts_generated": 1, "drafts_survived": 1}
{"id": "4ec6720f-9c5c-4053-aa8f-21fc4f1e3dd5", "target_id": "B4-treatment", "git_sha": "6cdebeb7e00bd4dc867db98cd33517aec95ce90d", "pre_experiment_sha": "23b8727db85d8427d4f5d5e9ced19435df80c80f", "timestamp": "2026-04-19T16:29:32.769101+00:00", "hypothesis": "Make update and list responses consistently include `created_at` and harden ID/filter validation for deterministic API behavior.", "hypothesis_source": "agent", "mutation_diff_summary": "", "score": 0.75, "score_ci_lower": null, "score_ci_upper": null, "raw_scores": null, "baseline_score": 0.7, "outcome": "KEPT", "failure_mode": null, "duration_seconds": 11.929438957944512, "tags": ["consistency", "validation", "determinism", "api"], "learnings": "{\"what_changed\":\"\",\"what_improved\":[],\"what_regressed\":[],\"transferable_insight\":\"Consistently returning the same core fields and strictly validating identifiers and filters makes APIs more deterministic and easier to rely on.\",\"domain_tags\":[\"api-design\",\"validation\",\"data-consistency\"]}", "cost_usd": 0.029185000000000003, "bootstrap_seed": 0, "agent_model": "gpt-5.4", "held_out_score": null, "criterion_names": null, "per_criterion_scores": null, "failure_classification": null, "drafts_generated": 1, "drafts_survived": 1}
{"id": "72b3ee22-64e7-49f6-8d0c-025fb8168580", "target_id": "B4-treatment", "git_sha": "6cdebeb7e00bd4dc867db98cd33517aec95ce90d", "pre_experiment_sha": "6cdebeb7e00bd4dc867db98cd33517aec95ce90d", "timestamp": "2026-04-19T16:29:45.871564+00:00", "hypothesis": "Improve determinism and API robustness by normalizing inputs consistently and avoiding ambiguous parameter naming.", "hypothesis_source": "agent", "mutation_diff_summary": "", "score": 0.75, "score_ci_lower": null, "score_ci_upper": null, "raw_scores": null, "baseline_score": 0.75, "outcome": "DISCARDED", "failure_mode": null, "duration_seconds": 11.527715708012693, "tags": ["validation", "determinism", "api-consistency", "edge-cases"], "learnings": "{\"what_changed\":\"\",\"what_improved\":[],\"what_regressed\":[],\"transferable_insight\":\"Use consistent input normalization and unambiguous naming to reduce ambiguity and improve reliability in interfaces.\",\"domain_tags\":[\"software_design\",\"api_design\",\"robustness\"]}", "cost_usd": 0.029759200000000003, "bootstrap_seed": 0, "agent_model": "gpt-5.4", "held_out_score": null, "criterion_names": null, "per_criterion_scores": null, "failure_classification": {"category": "semantic_drift", "description": "The experiment intended to improve determinism and API robustness via consistent input normalization and clearer parameter naming, but the result failed without a clear parsing/format issue\u2014suggesting the change likely altered behavior in an unintended way (inputs normalized differently than expected or semantics of parameters were not preserved).", "fix_direction": "Validate normalization rules against expected equivalence classes, add unit tests for representative edge cases, and ensure parameter renaming maps 1:1 to prior semantics (with backward-compatible aliases).", "confidence": 0.62}, "drafts_generated": 1, "drafts_survived": 1}
{"id": "df8490fe-b0ab-4802-9851-e3d2bc4dc3f7", "target_id": "B4-treatment", "git_sha": "6cdebeb7e00bd4dc867db98cd33517aec95ce90d", "pre_experiment_sha": "6cdebeb7e00bd4dc867db98cd33517aec95ce90d", "timestamp": "2026-04-19T16:30:02.726016+00:00", "hypothesis": "Tighten filter validation and keep all serialized user responses consistently deterministic with explicit created_at.", "hypothesis_source": "agent", "mutation_diff_summary": "", "score": 0.75, "score_ci_lower": null, "score_ci_upper": null, "raw_scores": null, "baseline_score": 0.75, "outcome": "DISCARDED", "failure_mode": null, "duration_seconds": 12.500180041999556, "tags": ["validation", "deterministic", "consistency"], "learnings": "{\"what_changed\":\"\",\"what_improved\":[],\"what_regressed\":[],\"transferable_insight\":\"When a change adds validation or determinism but produces no measurable improvement or regression, it likely addresses a non-impactful area and should be deprioritized unless tied to a clear user-facing outcome.\",\"domain_tags\":[\"evaluation\",\"decision-making\",\"process\"]}", "cost_usd": 0.0318388, "bootstrap_seed": 0, "agent_model": "gpt-5.4", "held_out_score": null, "criterion_names": null, "per_criterion_scores": null, "failure_classification": {"category": "semantic_drift", "description": "The attempt did not uphold the intended determinism and consistency of serialized user responses (e.g., created_at handling), indicating the output may have been structurally acceptable but did not match the required semantics for deterministic ordering/values.", "fix_direction": "Tighten validation around created_at and ordering/timestamps in serialization; ensure deterministic generation and round-trip stability across all code paths that emit user responses.", "confidence": 0.63}, "drafts_generated": 1, "drafts_survived": 1}
{"id": "5cc0cecc-b022-4d36-8cce-3cc4421044a9", "target_id": "B4-treatment", "git_sha": "6cdebeb7e00bd4dc867db98cd33517aec95ce90d", "pre_experiment_sha": "6cdebeb7e00bd4dc867db98cd33517aec95ce90d", "timestamp": "2026-04-19T16:30:18.130455+00:00", "hypothesis": "Tighten filter validation and keep serialization fully consistent with deterministic ordering and explicit rejection of ambiguous inputs.", "hypothesis_source": "agent", "mutation_diff_summary": "", "score": 0.75, "score_ci_lower": null, "score_ci_upper": null, "raw_scores": null, "baseline_score": 0.75, "outcome": "DISCARDED", "failure_mode": null, "duration_seconds": 12.887871709070168, "tags": ["validation", "determinism", "consistency"], "learnings": "{\"what_changed\":\"\",\"what_improved\":[],\"what_regressed\":[],\"transferable_insight\":\"When a change adds stricter validation and deterministic output but produces no measurable improvement, it is likely enforcing correctness without affecting the target outcome.\",\"domain_tags\":[\"validation\",\"determinism\",\"evaluation\"]}", "cost_usd": 0.032519200000000005, "bootstrap_seed": 0, "agent_model": "gpt-5.4", "held_out_score": null, "criterion_names": null, "per_criterion_scores": null, "failure_classification": {"category": "semantic_drift", "description": "The attempt did not clearly enforce or preserve the intended deterministic serialization and strict validation behavior; the failure mode is labeled as unknown, suggesting the output likely remained structurally valid while violating the intended ordering/ambiguity-rejection semantics.", "fix_direction": "Strengthen validation logic for ambiguous inputs, and enforce deterministic serialization ordering end-to-end (including stable sort rules and explicit rejections for conflicting/undefined cases). Add targeted tests that assert both ordering and rejection behavior.", "confidence": 0.6}, "drafts_generated": 1, "drafts_survived": 1}
{"id": "812631fc-94e4-4baa-8bfb-b02632c89ebc", "target_id": "B4-treatment", "git_sha": "6cdebeb7e00bd4dc867db98cd33517aec95ce90d", "pre_experiment_sha": "6cdebeb7e00bd4dc867db98cd33517aec95ce90d", "timestamp": "2026-04-19T16:30:34.052519+00:00", "hypothesis": "Tighten filter validation and make list/update serialization fully consistent without introducing runtime-dependent behavior.", "hypothesis_source": "agent", "mutation_diff_summary": "", "score": 0.75, "score_ci_lower": null, "score_ci_upper": null, "raw_scores": null, "baseline_score": 0.75, "outcome": "DISCARDED", "failure_mode": null, "duration_seconds": 13.395797708071768, "tags": ["validation", "determinism", "consistency"], "learnings": "{\"what_changed\":\"\",\"what_improved\":[],\"what_regressed\":[],\"transferable_insight\":\"When a change aims to improve consistency or validation but produces no measurable effect, the safest takeaway is that the added complexity likely did not address the underlying behavior.\",\"domain_tags\":[\"validation\",\"consistency\",\"software-design\"]}", "cost_usd": 0.0319084, "bootstrap_seed": 0, "agent_model": "gpt-5.4", "held_out_score": null, "criterion_names": null, "per_criterion_scores": null, "failure_classification": {"category": "logic_error", "description": "The failure mode is listed as unknown, and the provided details do not specify any concrete error such as output/schema mismatch, logic/calculation issue, regression, scope edits, syntax/parse failure, semantic mismatch, metric gaming, or partial/inconsistent changes.", "fix_direction": "Collect concrete failure evidence (error logs, diff of expected vs actual outputs, failing test names, and example inputs/outputs) to identify whether the issue is structural (schema/output), behavioral (logic/semantic), or state-consistency (incomplete edits). Then tighten validation/serialization contracts based on the observed mismatch.", "confidence": 0.1}, "drafts_generated": 1, "drafts_survived": 1}
{"id": "c7556c17-2998-4cf3-8b5f-20b48016be32", "target_id": "B4-treatment", "git_sha": "6cdebeb7e00bd4dc867db98cd33517aec95ce90d", "pre_experiment_sha": "6cdebeb7e00bd4dc867db98cd33517aec95ce90d", "timestamp": "2026-04-19T16:30:51.751991+00:00", "hypothesis": "Make invalid IDs reject consistently with 400 while preserving stable serialization including created_at across all read/write responses.", "hypothesis_source": "agent", "mutation_diff_summary": "", "score": 0.75, "score_ci_lower": null, "score_ci_upper": null, "raw_scores": null, "baseline_score": 0.75, "outcome": "DISCARDED", "failure_mode": null, "duration_seconds": 12.941135665983893, "tags": ["determinism", "validation", "serialization", "ids", "filters"], "learnings": "{\"what_changed\":\"\",\"what_improved\":[],\"what_regressed\":[],\"transferable_insight\":\"When changing validation behavior, keep error handling and response serialization consistent across all code paths to avoid introducing regressions or unstable outputs.\",\"domain_tags\":[\"software-engineering\",\"api-design\",\"testing\"]}", "cost_usd": 0.0326218, "bootstrap_seed": 0, "agent_model": "gpt-5.4", "held_out_score": null, "criterion_names": null, "per_criterion_scores": null, "failure_classification": {"category": "semantic_drift", "description": "The experiment was intended to make invalid IDs consistently rejected with HTTP 400 while preserving stable serialization (including created_at) across all read/write responses, but it failed in an unspecified/unknown way, suggesting the behavior deviated from the intended semantics rather than a simple formatting or syntax issue.", "fix_direction": "Re-check the validation and error-handling path for invalid IDs to ensure it consistently returns 400 for all relevant endpoints, and then verify serialization stability (especially created_at) across both read and write responses with end-to-end tests.", "confidence": 0.58}, "drafts_generated": 1, "drafts_survived": 1}
{"id": "685b4514-5e6a-449d-9053-fb903d36956a", "target_id": "B4-treatment", "git_sha": "6cdebeb7e00bd4dc867db98cd33517aec95ce90d", "pre_experiment_sha": "6cdebeb7e00bd4dc867db98cd33517aec95ce90d", "timestamp": "2026-04-19T16:31:06.451386+00:00", "hypothesis": "Reject ambiguous list filters deterministically and preserve created_at consistently across all serialized user responses.", "hypothesis_source": "agent", "mutation_diff_summary": "", "score": 0.75, "score_ci_lower": null, "score_ci_upper": null, "raw_scores": null, "baseline_score": 0.75, "outcome": "DISCARDED", "failure_mode": null, "duration_seconds": 12.174132040934637, "tags": ["deterministic", "validation", "serialization", "filters"], "learnings": "{\"what_changed\":\"\",\"what_improved\":[],\"what_regressed\":[],\"transferable_insight\":\"When a change cannot be applied consistently or unambiguously, it is better to reject it deterministically than to allow inconsistent behavior across outputs.\",\"domain_tags\":[\"decision-making\",\"data-consistency\",\"error-handling\"]}", "cost_usd": 0.031232200000000005, "bootstrap_seed": 0, "agent_model": "gpt-5.4", "held_out_score": null, "criterion_names": null, "per_criterion_scores": null, "failure_classification": {"category": "logic_error", "description": "The experiment claims to deterministically reject ambiguous list filters and preserve created_at consistently, but the reported failure mode is 'unknown' and the high score suggests the output was likely structurally acceptable while the underlying deterministic filtering or created_at preservation logic behaved incorrectly for some cases.", "fix_direction": "Add explicit, deterministic handling for ambiguous/unknown list filters and add consistent serialization rules (including stable timezone/format) for created_at across all user response paths; add targeted regression tests for edge cases.", "confidence": 0.62}, "drafts_generated": 1, "drafts_survived": 1}
{"id": "12626b84-518e-429c-9485-1168d6b56a1f", "target_id": "B4-treatment", "git_sha": "6cdebeb7e00bd4dc867db98cd33517aec95ce90d", "pre_experiment_sha": "6cdebeb7e00bd4dc867db98cd33517aec95ce90d", "timestamp": "2026-04-19T16:31:21.315613+00:00", "hypothesis": "Reject ambiguous filter keys and make invalid list filter responses deterministic and contract-consistent.", "hypothesis_source": "agent", "mutation_diff_summary": "", "score": 0.75, "score_ci_lower": null, "score_ci_upper": null, "raw_scores": null, "baseline_score": 0.75, "outcome": "DISCARDED", "failure_mode": null, "duration_seconds": 12.410290875006467, "tags": ["deterministic", "validation", "serialization", "filters"], "learnings": "{\"what_changed\":\"\",\"what_improved\":[],\"what_regressed\":[],\"transferable_insight\":\"When a system\u2019s inputs or outputs can be ambiguous, enforcing strict validation and deterministic error behavior improves contract consistency and reduces unpredictable outcomes.\",\"domain_tags\":[\"validation\",\"reliability\",\"api-design\"]}", "cost_usd": 0.0315984, "bootstrap_seed": 0, "agent_model": "gpt-5.4", "held_out_score": null, "criterion_names": null, "per_criterion_scores": null, "failure_classification": {"category": "semantic_drift", "description": "The system produced a result that appears logically inconsistent with the stated hypothesis about rejecting ambiguous filter keys and making invalid list filter responses deterministic/contract-consistent. Despite a relatively high score, the behavior likely still varied or did not enforce the intended contract for ambiguous/invalid filter keys, indicating meaning-level drift rather than a formatting or syntax issue.", "fix_direction": "Ensure the filter-key validation and error-handling path is deterministic: normalize/validate filter keys up-front, explicitly reject ambiguous keys with a stable error response, and ensure invalid list filter inputs always follow the same contract-defined output (including ordering, defaulting rules, and error payload/schema).", "confidence": 0.62}, "drafts_generated": 1, "drafts_survived": 1}
{"id": "7ae476cf-e2a4-4732-9deb-3a21d734b4d4", "target_id": "B4-treatment", "git_sha": "6cdebeb7e00bd4dc867db98cd33517aec95ce90d", "pre_experiment_sha": "6cdebeb7e00bd4dc867db98cd33517aec95ce90d", "timestamp": "2026-04-19T16:31:37.070920+00:00", "hypothesis": "Reject invalid and ambiguous list filters deterministically while preserving identical serialization including created_at.", "hypothesis_source": "agent", "mutation_diff_summary": "", "score": 0.75, "score_ci_lower": null, "score_ci_upper": null, "raw_scores": null, "baseline_score": 0.75, "outcome": "DISCARDED", "failure_mode": null, "duration_seconds": 11.27340816706419, "tags": ["determinism", "validation", "serialization", "filters"], "learnings": "{\"what_changed\":\"\",\"what_improved\":[],\"what_regressed\":[],\"transferable_insight\":\"When a change cannot be validated as both unambiguous and behavior-preserving, it should be rejected to avoid introducing nondeterministic or inconsistent outcomes.\",\"domain_tags\":[\"quality-control\",\"determinism\",\"validation\"]}", "cost_usd": 0.0317438, "bootstrap_seed": 0, "agent_model": "gpt-5.4", "held_out_score": null, "criterion_names": null, "per_criterion_scores": null, "failure_classification": {"category": "semantic_drift", "description": "The experiment failed despite the hypothesis expecting deterministic rejection of invalid/ambiguous list filters while preserving identical serialization (including created_at). The failure mode is marked as unknown, suggesting the output format likely remained structurally valid but the behavior/meaning deviated from the intended filter-validation or serialization-preservation requirements.", "fix_direction": "Focus on deterministic filter validation logic and add explicit checks/tests to ensure invalid/ambiguous filters are rejected exactly as specified, while serialization is byte-for-byte consistent for unchanged inputs (including created_at).", "confidence": 0.63}, "drafts_generated": 1, "drafts_survived": 1}
{"id": "f9123534-0ee8-4ce7-ae0e-55449a88a5e3", "target_id": "B4-treatment", "git_sha": "7fbd8bab6a38bcdd2bcf24a0e7d942f9c3192de6", "pre_experiment_sha": "6cdebeb7e00bd4dc867db98cd33517aec95ce90d", "timestamp": "2026-04-19T16:31:51.197447+00:00", "hypothesis": "Make list filter validation explicit and deterministic while preserving identical serialization including created_at.", "hypothesis_source": "agent", "mutation_diff_summary": "", "score": 0.75, "score_ci_lower": null, "score_ci_upper": null, "raw_scores": null, "baseline_score": 0.75, "outcome": "KEPT", "failure_mode": null, "duration_seconds": 11.345637583988719, "tags": ["determinism", "validation", "serialization", "filters"], "learnings": "{\"what_changed\":\"\",\"what_improved\":[],\"what_regressed\":[],\"transferable_insight\":\"When changing validation logic, make the rules explicit and deterministic while preserving existing output formats and timestamps to avoid unintended behavioral drift.\",\"domain_tags\":[\"software-engineering\",\"testing\",\"data-serialization\"]}", "cost_usd": 0.03144, "bootstrap_seed": 0, "agent_model": "gpt-5.4", "held_out_score": null, "criterion_names": null, "per_criterion_scores": null, "failure_classification": null, "drafts_generated": 1, "drafts_survived": 1}
{"id": "7622b285-69f0-44d9-bb42-c1f928c3af33", "target_id": "B4-treatment", "git_sha": "30a77b2063acce2ca04bcc1a382773fa3db383ef", "pre_experiment_sha": "7fbd8bab6a38bcdd2bcf24a0e7d942f9c3192de6", "timestamp": "2026-04-19T16:32:04.207634+00:00", "hypothesis": "Reject empty name list filters explicitly to remove ambiguous deterministic behavior while preserving consistent serialization including created_at.", "hypothesis_source": "agent", "mutation_diff_summary": "", "score": 0.75, "score_ci_lower": null, "score_ci_upper": null, "raw_scores": null, "baseline_score": 0.75, "outcome": "KEPT", "failure_mode": null, "duration_seconds": 11.812532917014323, "tags": ["determinism", "validation", "serialization"], "learnings": "{\"what_changed\":\"\",\"what_improved\":[],\"what_regressed\":[],\"transferable_insight\":\"Explicitly rejecting ambiguous empty inputs can improve determinism and clarity without changing stable serialization behavior.\",\"domain_tags\":[\"api-design\",\"data-validation\",\"serialization\"]}", "cost_usd": 0.03207, "bootstrap_seed": 0, "agent_model": "gpt-5.4", "held_out_score": null, "criterion_names": null, "per_criterion_scores": null, "failure_classification": null, "drafts_generated": 1, "drafts_survived": 1}
{"id": "f3262706-fc7a-44c2-a9db-d0aec9df369d", "target_id": "B4-treatment", "git_sha": "e7a69042ae0d1b5be16cc5e8592fdcb94f4d8f0c", "pre_experiment_sha": "30a77b2063acce2ca04bcc1a382773fa3db383ef", "timestamp": "2026-04-19T16:32:19.470006+00:00", "hypothesis": "Reject empty and ambiguous list filters deterministically while preserving consistent created_at-inclusive serialization.", "hypothesis_source": "agent", "mutation_diff_summary": "", "score": 0.7, "score_ci_lower": null, "score_ci_upper": null, "raw_scores": null, "baseline_score": 0.75, "outcome": "KEPT", "failure_mode": null, "duration_seconds": 12.701380375074223, "tags": ["determinism", "validation", "serialization", "filters"], "learnings": "{\"what_changed\":\"\",\"what_improved\":[],\"what_regressed\":[],\"transferable_insight\":\"Make validation rules deterministic and explicit for ambiguous inputs, while keeping serialization behavior consistent and predictable across outputs.\",\"domain_tags\":[\"validation\",\"serialization\",\"determinism\"]}", "cost_usd": 0.032905000000000004, "bootstrap_seed": 0, "agent_model": "gpt-5.4", "held_out_score": null, "criterion_names": null, "per_criterion_scores": null, "failure_classification": null, "drafts_generated": 1, "drafts_survived": 1}
