{"id": "1f91c8af-8ec7-4b37-881d-13f98ec6c408", "target_id": "B4-treatment", "git_sha": "a57a8de61a8f3bddf834112df536914c11337575", "pre_experiment_sha": "54f12a4032438f422a68785f6f4d90eec74964fb", "timestamp": "2026-04-19T00:58:14.149784+00:00", "hypothesis": "Use the canonical normalized name value from validation consistently for filtering, storage, and serialization by routing all user output through `to_dict`.", "hypothesis_source": "agent", "mutation_diff_summary": "", "score": 0.75, "score_ci_lower": null, "score_ci_upper": null, "raw_scores": null, "baseline_score": 0.75, "outcome": "KEPT", "failure_mode": null, "duration_seconds": 14.598640708019957, "tags": ["determinism", "normalization", "name", "serialization"], "learnings": "{\"what_changed\":\"\",\"what_improved\":[],\"what_regressed\":[],\"transferable_insight\":\"Using one canonical normalized representation consistently across validation, filtering, storage, and serialization reduces mismatches and keeps behavior stable.\",\"domain_tags\":[\"data-processing\",\"software-engineering\",\"validation\"]}", "cost_usd": 0.052070000000000005, "bootstrap_seed": 0, "agent_model": "gpt-5.4", "held_out_score": null, "criterion_names": null, "per_criterion_scores": null, "failure_classification": null, "drafts_generated": 1, "drafts_survived": 1}
{"id": "e222be22-930c-4634-8300-3a8da5297cc9", "target_id": "B4-treatment", "git_sha": "e0e5408177c09138b77d316467273f07f11f0f0b", "pre_experiment_sha": "a57a8de61a8f3bddf834112df536914c11337575", "timestamp": "2026-04-19T00:58:30.845181+00:00", "hypothesis": "Use the canonical normalized user id value from validation consistently in deletion responses, lookups, updates, and serialization.", "hypothesis_source": "agent", "mutation_diff_summary": "", "score": 0.75, "score_ci_lower": null, "score_ci_upper": null, "raw_scores": null, "baseline_score": 0.75, "outcome": "KEPT", "failure_mode": null, "duration_seconds": 15.64433350006584, "tags": ["determinism", "user-id", "normalization", "serialization"], "learnings": "{\"what_changed\":\"\",\"what_improved\":[],\"what_regressed\":[],\"transferable_insight\":\"Using one canonical normalized identifier consistently across validation, retrieval, mutation, and serialization reduces ambiguity and keeps system behavior aligned end to end.\",\"domain_tags\":[\"data-consistency\",\"api-design\",\"validation\"]}", "cost_usd": 0.05251, "bootstrap_seed": 0, "agent_model": "gpt-5.4", "held_out_score": null, "criterion_names": null, "per_criterion_scores": null, "failure_classification": null, "drafts_generated": 1, "drafts_survived": 1}
{"id": "bfbe6561-ec04-48bc-8a0c-ca53fd2bae14", "target_id": "B4-treatment", "git_sha": "253370bc097a51900bcf70d0d417ef32c8e7f115", "pre_experiment_sha": "e0e5408177c09138b77d316467273f07f11f0f0b", "timestamp": "2026-04-19T00:58:45.848187+00:00", "hypothesis": "Route email serialization through the existing canonical email normalizer so responses always emit the same validated email form used for filtering and storage.", "hypothesis_source": "agent", "mutation_diff_summary": "", "score": 0.75, "score_ci_lower": null, "score_ci_upper": null, "raw_scores": null, "baseline_score": 0.75, "outcome": "KEPT", "failure_mode": null, "duration_seconds": 13.99879216705449, "tags": ["determinism", "email", "normalization", "serialization"], "learnings": "{\"what_changed\":\"\",\"what_improved\":[],\"what_regressed\":[],\"transferable_insight\":\"Use one canonical validation/normalization path for both input handling and output serialization to keep behavior consistent across the system.\",\"domain_tags\":[\"data-processing\",\"software-engineering\",\"validation\"]}", "cost_usd": 0.05297500000000001, "bootstrap_seed": 0, "agent_model": "gpt-5.4", "held_out_score": null, "criterion_names": null, "per_criterion_scores": null, "failure_classification": null, "drafts_generated": 1, "drafts_survived": 1}
{"id": "408b8636-cc14-4751-846c-61b3eeb054a4", "target_id": "B4-treatment", "git_sha": "293f1db05c4d03ed2d6bd740cadd46f99e994f0a", "pre_experiment_sha": "253370bc097a51900bcf70d0d417ef32c8e7f115", "timestamp": "2026-04-19T00:59:03.435409+00:00", "hypothesis": "Use the validated canonical name value directly in serialization and list filtering so the same normalized name flows through storage, filtering, and responses.", "hypothesis_source": "agent", "mutation_diff_summary": "", "score": 0.75, "score_ci_lower": null, "score_ci_upper": null, "raw_scores": null, "baseline_score": 0.75, "outcome": "KEPT", "failure_mode": null, "duration_seconds": 14.017017959035002, "tags": ["determinism", "name", "normalization", "serialization", "filtering"], "learnings": "{\"what_changed\":\"\",\"what_improved\":[],\"what_regressed\":[],\"transferable_insight\":\"Using one validated canonical representation consistently across storage, filtering, and output reduces transformation drift and keeps system behavior aligned.\",\"domain_tags\":[\"data-normalization\",\"software-design\",\"consistency\"]}", "cost_usd": 0.05263, "bootstrap_seed": 0, "agent_model": "gpt-5.4", "held_out_score": null, "criterion_names": null, "per_criterion_scores": null, "failure_classification": null, "drafts_generated": 1, "drafts_survived": 1}
{"id": "e97a61b9-d235-4f50-9053-38a70a05850f", "target_id": "B4-treatment", "git_sha": "969d8099362509f98e97691cdf302a5699b2df6d", "pre_experiment_sha": "293f1db05c4d03ed2d6bd740cadd46f99e994f0a", "timestamp": "2026-04-19T00:59:19.336906+00:00", "hypothesis": "Route name serialization through the existing canonical name normalizer so the same normalized name value is used in storage, filtering, and responses.", "hypothesis_source": "agent", "mutation_diff_summary": "", "score": 0.75, "score_ci_lower": null, "score_ci_upper": null, "raw_scores": null, "baseline_score": 0.75, "outcome": "KEPT", "failure_mode": null, "duration_seconds": 14.799580874969251, "tags": ["determinism", "name", "normalization", "serialization"], "learnings": "{\"what_changed\":\"\",\"what_improved\":[],\"what_regressed\":[],\"transferable_insight\":\"Using one canonical normalization path for the same identifier across storage, filtering, and output reduces inconsistency and keeps system behavior aligned.\",\"domain_tags\":[\"software-engineering\",\"data-consistency\",\"api-design\"]}", "cost_usd": 0.052665000000000003, "bootstrap_seed": 0, "agent_model": "gpt-5.4", "held_out_score": null, "criterion_names": null, "per_criterion_scores": null, "failure_classification": null, "drafts_generated": 1, "drafts_survived": 1}
{"id": "cb2b4c23-3bae-4d68-9c6e-c441f2e440b3", "target_id": "B4-treatment", "git_sha": "d98d216831e130aceb10930ba33701bdbd3d7aa9", "pre_experiment_sha": "969d8099362509f98e97691cdf302a5699b2df6d", "timestamp": "2026-04-19T00:59:34.412325+00:00", "hypothesis": "Reuse the canonical normalized email value directly in serialization and list filtering so every email path uses the same stored value.", "hypothesis_source": "agent", "mutation_diff_summary": "", "score": 0.75, "score_ci_lower": null, "score_ci_upper": null, "raw_scores": null, "baseline_score": 0.75, "outcome": "KEPT", "failure_mode": null, "duration_seconds": 13.977452749968506, "tags": ["determinism", "email", "normalization", "serialization", "filtering"], "learnings": "{\"what_changed\":\"\",\"what_improved\":[],\"what_regressed\":[],\"transferable_insight\":\"Using one canonical normalized representation across storage, serialization, and filtering reduces inconsistency by ensuring every path operates on the same value.\",\"domain_tags\":[\"data-consistency\",\"normalization\",\"serialization\"]}", "cost_usd": 0.052500000000000005, "bootstrap_seed": 0, "agent_model": "gpt-5.4", "held_out_score": null, "criterion_names": null, "per_criterion_scores": null, "failure_classification": null, "drafts_generated": 1, "drafts_survived": 1}
{"id": "b057ad1b-64d9-4732-b5dc-e4c4c1f70ae5", "target_id": "B4-treatment", "git_sha": "c1b78fb319c587a0b36879570326b18904fdb8cc", "pre_experiment_sha": "d98d216831e130aceb10930ba33701bdbd3d7aa9", "timestamp": "2026-04-19T00:59:53.315849+00:00", "hypothesis": "Thread the canonical normalized email value through validation, storage, filtering, and serialization via one shared helper-backed path.", "hypothesis_source": "agent", "mutation_diff_summary": "", "score": 0.75, "score_ci_lower": null, "score_ci_upper": null, "raw_scores": null, "baseline_score": 0.75, "outcome": "KEPT", "failure_mode": null, "duration_seconds": 15.420038208016194, "tags": ["determinism", "email", "normalization", "serialization", "filtering"], "learnings": "{\"what_changed\":\"\",\"what_improved\":[],\"what_regressed\":[],\"transferable_insight\":\"Using one shared helper-backed path for a canonical normalized value across validation, storage, filtering, and serialization reduces inconsistency and keeps behavior aligned end to end.\",\"domain_tags\":[\"software-engineering\",\"data-consistency\",\"api-design\"]}", "cost_usd": 0.05376, "bootstrap_seed": 0, "agent_model": "gpt-5.4", "held_out_score": null, "criterion_names": null, "per_criterion_scores": null, "failure_classification": null, "drafts_generated": 1, "drafts_survived": 1}
{"id": "3c4a32e3-55b8-4a6d-b40d-e97ed92a3304", "target_id": "B4-treatment", "git_sha": "f93f7360735a1cbd69567c208c9533cc9bdabaf3", "pre_experiment_sha": "c1b78fb319c587a0b36879570326b18904fdb8cc", "timestamp": "2026-04-19T01:00:10.253222+00:00", "hypothesis": "Use the already-normalized name value directly everywhere so name handling never re-normalizes or mixes canonical and raw forms.", "hypothesis_source": "agent", "mutation_diff_summary": "", "score": 0.75, "score_ci_lower": null, "score_ci_upper": null, "raw_scores": null, "baseline_score": 0.75, "outcome": "KEPT", "failure_mode": null, "duration_seconds": 15.880163208930753, "tags": ["determinism", "name", "normalization", "serialization", "filtering"], "learnings": "{\"what_changed\":\"\",\"what_improved\":[],\"what_regressed\":[],\"transferable_insight\":\"When a value has already been normalized, reusing that canonical form consistently across the system avoids redundant processing and prevents subtle inconsistencies between raw and processed representations.\",\"domain_tags\":[\"data-processing\",\"software-design\",\"data-consistency\"]}", "cost_usd": 0.05437500000000001, "bootstrap_seed": 0, "agent_model": "gpt-5.4", "held_out_score": null, "criterion_names": null, "per_criterion_scores": null, "failure_classification": null, "drafts_generated": 1, "drafts_survived": 1}
{"id": "e628abf6-e8b0-4201-94c2-019281fb7c50", "target_id": "B4-treatment", "git_sha": "c39e4700508473abc22b06d064c1d46e0f16e7e8", "pre_experiment_sha": "f93f7360735a1cbd69567c208c9533cc9bdabaf3", "timestamp": "2026-04-19T01:00:27.016881+00:00", "hypothesis": "Reuse the already-validated canonical email value directly in all email handling paths, including validation and serialization.", "hypothesis_source": "agent", "mutation_diff_summary": "", "score": 0.75, "score_ci_lower": null, "score_ci_upper": null, "raw_scores": null, "baseline_score": 0.75, "outcome": "KEPT", "failure_mode": null, "duration_seconds": 15.477710125036538, "tags": ["determinism", "email", "normalization", "serialization", "validation"], "learnings": "{\"what_changed\":\"\",\"what_improved\":[],\"what_regressed\":[],\"transferable_insight\":\"When a value has already been validated and normalized, reusing that canonical form consistently across all downstream paths reduces redundant processing and preserves behavior stability.\",\"domain_tags\":[\"software-engineering\",\"data-processing\",\"validation\"]}", "cost_usd": 0.05458500000000001, "bootstrap_seed": 0, "agent_model": "gpt-5.4", "held_out_score": null, "criterion_names": null, "per_criterion_scores": null, "failure_classification": null, "drafts_generated": 1, "drafts_survived": 1}
{"id": "8cb87a2e-5a70-4120-bdf9-e0058c074521", "target_id": "B4-treatment", "git_sha": "648d2091e550e861f4a37f429b5ad7f9c0c89fbf", "pre_experiment_sha": "c39e4700508473abc22b06d064c1d46e0f16e7e8", "timestamp": "2026-04-19T01:01:02.593363+00:00", "hypothesis": "Capture the canonical name once via the existing normalizer and reuse that exact value in validation, storage, filtering, updates, and serialization.", "hypothesis_source": "agent", "mutation_diff_summary": "", "score": 0.75, "score_ci_lower": null, "score_ci_upper": null, "raw_scores": null, "baseline_score": 0.75, "outcome": "KEPT", "failure_mode": null, "duration_seconds": 15.499776000040583, "tags": ["determinism", "name", "normalization"], "learnings": "{\"what_changed\":\"\",\"what_improved\":[],\"what_regressed\":[],\"transferable_insight\":\"Normalize a value once at the boundary and reuse the same canonical form consistently across all downstream operations to prevent subtle mismatches and drift.\",\"domain_tags\":[\"data-consistency\",\"normalization\",\"software-design\"]}", "cost_usd": 0.055040000000000006, "bootstrap_seed": 0, "agent_model": "gpt-5.4", "held_out_score": null, "criterion_names": null, "per_criterion_scores": null, "failure_classification": null, "drafts_generated": 1, "drafts_survived": 1}
{"id": "0ecd2ef7-a212-4a44-bb64-3150d5a36930", "target_id": "B4-treatment", "git_sha": "67fbaa3134667b8a8b83e863c7cef637c44d64bd", "pre_experiment_sha": "648d2091e550e861f4a37f429b5ad7f9c0c89fbf", "timestamp": "2026-04-19T01:01:20.344429+00:00", "hypothesis": "Capture the canonical email once in the User model and reuse that exact stored value for serialization and all email comparisons.", "hypothesis_source": "agent", "mutation_diff_summary": "", "score": 0.75, "score_ci_lower": null, "score_ci_upper": null, "raw_scores": null, "baseline_score": 0.75, "outcome": "KEPT", "failure_mode": null, "duration_seconds": 16.786612750031054, "tags": ["determinism", "email", "normalization", "serialization", "filtering"], "learnings": "{\"what_changed\":\"\",\"what_improved\":[],\"what_regressed\":[],\"transferable_insight\":\"Storing and reusing one canonical source of truth for a value prevents inconsistency across comparisons and serialization.\",\"domain_tags\":[\"data-consistency\",\"state-management\",\"normalization\"]}", "cost_usd": 0.054965, "bootstrap_seed": 0, "agent_model": "gpt-5.4", "held_out_score": null, "criterion_names": null, "per_criterion_scores": null, "failure_classification": null, "drafts_generated": 1, "drafts_survived": 1}
{"id": "cf7f3a6e-1d37-425a-a74a-5b819b1c5f76", "target_id": "B4-treatment", "git_sha": "255ca2d4da62b64b1aac3d036f78b99cd612e678", "pre_experiment_sha": "67fbaa3134667b8a8b83e863c7cef637c44d64bd", "timestamp": "2026-04-19T01:01:42.214834+00:00", "hypothesis": "Capture the canonical user id once and reuse that exact normalized id consistently for storage, lookup, deletion, and serialization.", "hypothesis_source": "agent", "mutation_diff_summary": "", "score": 0.75, "score_ci_lower": null, "score_ci_upper": null, "raw_scores": null, "baseline_score": 0.75, "outcome": "KEPT", "failure_mode": null, "duration_seconds": 18.27358074998483, "tags": ["determinism", "user-id", "normalization", "storage", "lookup"], "learnings": "{\"what_changed\":\"\",\"what_improved\":[],\"what_regressed\":[],\"transferable_insight\":\"Normalize and persist a single canonical identifier at the point of entry, then use that exact value consistently across all operations to prevent subtle mismatches.\",\"domain_tags\":[\"data-integrity\",\"identity-management\",\"state-consistency\"]}", "cost_usd": 0.05510000000000001, "bootstrap_seed": 0, "agent_model": "gpt-5.4", "held_out_score": null, "criterion_names": null, "per_criterion_scores": null, "failure_classification": null, "drafts_generated": 1, "drafts_survived": 1}
{"id": "2f81ad03-92d9-492d-aefa-dd4a07287b01", "target_id": "B4-treatment", "git_sha": "a2eedb63151531f226e494e44ffa5029b266904b", "pre_experiment_sha": "255ca2d4da62b64b1aac3d036f78b99cd612e678", "timestamp": "2026-04-19T01:02:01.534078+00:00", "hypothesis": "Thread the canonical user id captured during lookup through list iteration and deletion responses so id handling uses one exact value everywhere.", "hypothesis_source": "agent", "mutation_diff_summary": "", "score": 0.75, "score_ci_lower": null, "score_ci_upper": null, "raw_scores": null, "baseline_score": 0.75, "outcome": "KEPT", "failure_mode": null, "duration_seconds": 18.201335667050444, "tags": ["determinism", "user-id", "normalization", "storage", "lookup", "serialization"], "learnings": "{\"what_changed\":\"\",\"what_improved\":[],\"what_regressed\":[],\"transferable_insight\":\"Use one canonical identifier consistently across all read, iterate, and delete paths to eliminate subtle mismatches and ensure uniform state handling.\",\"domain_tags\":[\"data-consistency\",\"identifier-management\",\"state-handling\"]}", "cost_usd": 0.05544, "bootstrap_seed": 0, "agent_model": "gpt-5.4", "held_out_score": null, "criterion_names": null, "per_criterion_scores": null, "failure_classification": null, "drafts_generated": 1, "drafts_survived": 1}
{"id": "9bccb1f5-5d5f-44e0-b806-5b9473ede431", "target_id": "B4-treatment", "git_sha": "04d478997cf97d98b46fbd59506e9573102eb758", "pre_experiment_sha": "a2eedb63151531f226e494e44ffa5029b266904b", "timestamp": "2026-04-19T01:02:19.329980+00:00", "hypothesis": "Thread the canonical email captured by payload/filter normalization through every downstream email branch, including model construction, updates, comparisons, and serialization helpers.", "hypothesis_source": "agent", "mutation_diff_summary": "", "score": 0.75, "score_ci_lower": null, "score_ci_upper": null, "raw_scores": null, "baseline_score": 0.75, "outcome": "KEPT", "failure_mode": null, "duration_seconds": 16.6536267909687, "tags": ["determinism", "email", "normalization", "serialization", "filtering"], "learnings": "{\"what_changed\":\"\",\"what_improved\":[],\"what_regressed\":[],\"transferable_insight\":\"Normalize a canonical representation at the point of capture and propagate it consistently through all downstream processing to prevent branch-specific drift in comparisons, updates, and serialization.\",\"domain_tags\":[\"data-processing\",\"software-engineering\",\"state-management\"]}", "cost_usd": 0.05607000000000001, "bootstrap_seed": 0, "agent_model": "gpt-5.4", "held_out_score": null, "criterion_names": null, "per_criterion_scores": null, "failure_classification": null, "drafts_generated": 1, "drafts_survived": 1}
{"id": "96754a52-eae0-4af6-81b0-18f39a2331e6", "target_id": "B4-treatment", "git_sha": "666c616707a00dafaa171e3cc54b9857e67fee4b", "pre_experiment_sha": "04d478997cf97d98b46fbd59506e9573102eb758", "timestamp": "2026-04-19T01:02:39.772162+00:00", "hypothesis": "Reuse the stored canonical user id directly during list iteration so the same accepted id value flows through filtering and serialization without re-normalization.", "hypothesis_source": "agent", "mutation_diff_summary": "", "score": 0.75, "score_ci_lower": null, "score_ci_upper": null, "raw_scores": null, "baseline_score": 0.75, "outcome": "KEPT", "failure_mode": null, "duration_seconds": 16.452717166976072, "tags": ["determinism", "user-id", "normalization", "list-iteration", "serialization"], "learnings": "{\"what_changed\":\"\",\"what_improved\":[],\"what_regressed\":[],\"transferable_insight\":\"Preserving a single canonical value throughout a processing pipeline reduces unnecessary transformation and helps maintain consistency without changing outcomes.\",\"domain_tags\":[\"data-processing\",\"software-engineering\",\"state-management\"]}", "cost_usd": 0.05743500000000001, "bootstrap_seed": 0, "agent_model": "gpt-5.4", "held_out_score": null, "criterion_names": null, "per_criterion_scores": null, "failure_classification": null, "drafts_generated": 1, "drafts_survived": 1}
{"id": "2ccefc63-b6c3-4d92-b2bf-8915146ec53a", "target_id": "B4-treatment", "git_sha": "e2d3a75a50f9c0c87f17871e66d0c406bf1f4e18", "pre_experiment_sha": "666c616707a00dafaa171e3cc54b9857e67fee4b", "timestamp": "2026-04-19T01:02:57.743121+00:00", "hypothesis": "Capture the canonical name once from existing normalization and thread that exact value through storage, filtering, updates, and serialization.", "hypothesis_source": "agent", "mutation_diff_summary": "", "score": 0.75, "score_ci_lower": null, "score_ci_upper": null, "raw_scores": null, "baseline_score": 0.75, "outcome": "KEPT", "failure_mode": null, "duration_seconds": 16.91019837500062, "tags": ["determinism", "name", "normalization", "serialization", "filtering"], "learnings": "{\"what_changed\":\"\",\"what_improved\":[],\"what_regressed\":[],\"transferable_insight\":\"When a normalized canonical value already exists, preserve and reuse that exact value consistently across all downstream operations to avoid drift and mismatches.\",\"domain_tags\":[\"data-consistency\",\"normalization\",\"state-management\"]}", "cost_usd": 0.05861, "bootstrap_seed": 0, "agent_model": "gpt-5.4", "held_out_score": null, "criterion_names": null, "per_criterion_scores": null, "failure_classification": null, "drafts_generated": 1, "drafts_survived": 1}
