{"id": "d5a5f2cf-40fc-45ce-9b33-04c7513b5efc", "target_id": "B4-treatment", "git_sha": "261609148ec832d917e73a3255aae3f257b869a4", "pre_experiment_sha": "e2d3a75a50f9c0c87f17871e66d0c406bf1f4e18", "timestamp": "2026-04-19T01:03:15.950057+00:00", "hypothesis": "Reuse the stored canonical user id during serialization so responses always emit the exact persisted identifier value.", "hypothesis_source": "agent", "mutation_diff_summary": "", "score": 0.75, "score_ci_lower": null, "score_ci_upper": null, "raw_scores": null, "baseline_score": 0.75, "outcome": "KEPT", "failure_mode": null, "duration_seconds": 17.142841666936874, "tags": ["determinism", "user-id", "serialization", "canonicalization"], "learnings": "{\"what_changed\":\"\",\"what_improved\":[],\"what_regressed\":[],\"transferable_insight\":\"Preserve and reuse the original stored canonical value during output generation to ensure consistency with the persisted source of truth.\",\"domain_tags\":[\"data-integrity\",\"serialization\",\"state-management\"]}", "cost_usd": 0.05900000000000001, "bootstrap_seed": 0, "agent_model": "gpt-5.4", "held_out_score": null, "criterion_names": null, "per_criterion_scores": null, "failure_classification": null, "drafts_generated": 1, "drafts_survived": 1}
{"id": "c21b9d09-a2e7-4f70-bae0-6eb62c37333f", "target_id": "B4-treatment", "git_sha": "292ca1b1c3d66864de0dd357a33c7c2b8d36a963", "pre_experiment_sha": "261609148ec832d917e73a3255aae3f257b869a4", "timestamp": "2026-04-19T01:03:40.203337+00:00", "hypothesis": "Reuse the already stored canonical active value during list filtering and serialization so the same accepted boolean flows through every downstream branch.", "hypothesis_source": "agent", "mutation_diff_summary": "", "score": 0.75, "score_ci_lower": null, "score_ci_upper": null, "raw_scores": null, "baseline_score": 0.75, "outcome": "KEPT", "failure_mode": null, "duration_seconds": 19.530244834022596, "tags": ["determinism", "active", "serialization", "filtering", "canonicalization"], "learnings": "{\"what_changed\":\"\",\"what_improved\":[],\"what_regressed\":[],\"transferable_insight\":\"When a value has already been validated as canonical, reusing that same accepted value throughout subsequent processing reduces redundant checks and keeps behavior consistent across branches.\",\"domain_tags\":[\"software-engineering\",\"data-processing\",\"validation\"]}", "cost_usd": 0.06024500000000001, "bootstrap_seed": 0, "agent_model": "gpt-5.4", "held_out_score": null, "criterion_names": null, "per_criterion_scores": null, "failure_classification": null, "drafts_generated": 1, "drafts_survived": 1}
{"id": "6e8e35f8-9538-4b5f-89b5-0d6458d35876", "target_id": "B4-treatment", "git_sha": "cd387cb31776ac1fd5aeec5b994e11c0bf544e3a", "pre_experiment_sha": "292ca1b1c3d66864de0dd357a33c7c2b8d36a963", "timestamp": "2026-04-19T01:03:58.601879+00:00", "hypothesis": "Capture the canonical user id once in list iteration and reuse that exact stored value for every downstream branch touching the id.", "hypothesis_source": "agent", "mutation_diff_summary": "", "score": 0.75, "score_ci_lower": null, "score_ci_upper": null, "raw_scores": null, "baseline_score": 0.75, "outcome": "KEPT", "failure_mode": null, "duration_seconds": 17.39116683404427, "tags": ["determinism", "user-id", "list", "serialization", "canonicalization"], "learnings": "{\"what_changed\":\"\",\"what_improved\":[],\"what_regressed\":[],\"transferable_insight\":\"When a value is needed across multiple decision points, capture it once and reuse the same stored reference to preserve consistency and avoid subtle divergence.\",\"domain_tags\":[\"software-engineering\",\"state-management\",\"reliability\"]}", "cost_usd": 0.06062500000000001, "bootstrap_seed": 0, "agent_model": "gpt-5.4", "held_out_score": null, "criterion_names": null, "per_criterion_scores": null, "failure_classification": null, "drafts_generated": 1, "drafts_survived": 1}
