{"id": "903b0b94-9d91-423f-9d51-ab28681bca3e", "target_id": "B4-treatment", "git_sha": "8cb9b5145a70b4e7872d634d6b3c1a57e53b65a4", "pre_experiment_sha": "e7a69042ae0d1b5be16cc5e8592fdcb94f4d8f0c", "timestamp": "2026-04-19T16:32:33.697149+00:00", "hypothesis": "Make list filter rejection deterministic and contract-preserving by returning a stable error object instead of an empty list on invalid filters.", "hypothesis_source": "agent", "mutation_diff_summary": "", "score": 0.7, "score_ci_lower": null, "score_ci_upper": null, "raw_scores": null, "baseline_score": 0.7, "outcome": "KEPT", "failure_mode": null, "duration_seconds": 13.137200791970827, "tags": ["deterministic", "validation", "serialization", "api-contract"], "learnings": "{\"what_changed\":\"\",\"what_improved\":[],\"what_regressed\":[],\"transferable_insight\":\"When a filter or validation step fails, returning a stable explicit error object instead of silently substituting a default empty result preserves contracts and makes behavior deterministic.\",\"domain_tags\":[\"error-handling\",\"api-design\",\"determinism\"]}", "cost_usd": 0.0334, "bootstrap_seed": 0, "agent_model": "gpt-5.4", "held_out_score": null, "criterion_names": null, "per_criterion_scores": null, "failure_classification": null, "drafts_generated": 1, "drafts_survived": 1}
{"id": "309388c5-d111-4145-98b6-003d261f4d30", "target_id": "B4-treatment", "git_sha": "57d93c19111f31bdf5c4806bcf17c29142d95d41", "pre_experiment_sha": "8cb9b5145a70b4e7872d634d6b3c1a57e53b65a4", "timestamp": "2026-04-19T16:32:49.348395+00:00", "hypothesis": "Make ID validation explicit and deterministic by rejecting invalid IDs with 400 while keeping serialization and list filtering behavior unchanged.", "hypothesis_source": "agent", "mutation_diff_summary": "", "score": 0.7, "score_ci_lower": null, "score_ci_upper": null, "raw_scores": null, "baseline_score": 0.7, "outcome": "KEPT", "failure_mode": null, "duration_seconds": 14.400169124943204, "tags": ["deterministic", "validation", "serialization"], "learnings": "{\"what_changed\":\"\",\"what_improved\":[],\"what_regressed\":[],\"transferable_insight\":\"Make input validation explicit and deterministic by failing fast on invalid values while preserving existing downstream behavior for valid cases.\",\"domain_tags\":[\"validation\",\"error-handling\",\"api-design\"]}", "cost_usd": 0.03411, "bootstrap_seed": 0, "agent_model": "gpt-5.4", "held_out_score": null, "criterion_names": null, "per_criterion_scores": null, "failure_classification": null, "drafts_generated": 1, "drafts_survived": 1}
{"id": "fa811f23-3748-45b3-8dc0-7deca85d4eaa", "target_id": "B4-treatment", "git_sha": "4a99f707dcedf801400dfc6b29e0a84e8f5b9138", "pre_experiment_sha": "57d93c19111f31bdf5c4806bcf17c29142d95d41", "timestamp": "2026-04-19T16:33:06.146337+00:00", "hypothesis": "Tighten list filter validation and preserve stable created_at-inclusive serialization everywhere without changing the API contract.", "hypothesis_source": "agent", "mutation_diff_summary": "", "score": 0.7, "score_ci_lower": null, "score_ci_upper": null, "raw_scores": null, "baseline_score": 0.7, "outcome": "KEPT", "failure_mode": null, "duration_seconds": 13.80555595899932, "tags": ["determinism", "validation", "serialization"], "learnings": "{\"what_changed\":\"\",\"what_improved\":[],\"what_regressed\":[],\"transferable_insight\":\"When tightening validation or serialization behavior, preserve existing externally visible contracts and ordering semantics to avoid unintended functional changes.\",\"domain_tags\":[\"software-engineering\",\"api-design\",\"backward-compatibility\"]}", "cost_usd": 0.03466, "bootstrap_seed": 0, "agent_model": "gpt-5.4", "held_out_score": null, "criterion_names": null, "per_criterion_scores": null, "failure_classification": null, "drafts_generated": 1, "drafts_survived": 1}
{"id": "01f97f1e-4dc2-4776-8f50-4c497cd83118", "target_id": "B4-treatment", "git_sha": "eb063f63e818a915dc75f648510add77d4369af5", "pre_experiment_sha": "4a99f707dcedf801400dfc6b29e0a84e8f5b9138", "timestamp": "2026-04-19T16:33:24.047805+00:00", "hypothesis": "Tighten list filter validation to reject bool-valued name filters deterministically while preserving all existing response shapes.", "hypothesis_source": "agent", "mutation_diff_summary": "", "score": 0.7, "score_ci_lower": null, "score_ci_upper": null, "raw_scores": null, "baseline_score": 0.7, "outcome": "KEPT", "failure_mode": null, "duration_seconds": 16.806809375062585, "tags": ["determinism", "validation", "serialization"], "learnings": "{\"what_changed\":\"\",\"what_improved\":[],\"what_regressed\":[],\"transferable_insight\":\"When tightening validation rules, preserve the existing output contract while making edge-case rejection deterministic to avoid unintended behavior changes.\",\"domain_tags\":[\"validation\",\"api-design\",\"reliability\"]}", "cost_usd": 0.035010000000000006, "bootstrap_seed": 0, "agent_model": "gpt-5.4", "held_out_score": null, "criterion_names": null, "per_criterion_scores": null, "failure_classification": null, "drafts_generated": 1, "drafts_survived": 1}
{"id": "77e733aa-e8b3-4bf6-b88b-07787f02fae2", "target_id": "B4-treatment", "git_sha": "eb2d0031093b010e4a42fee964d86dcd3ba90147", "pre_experiment_sha": "eb063f63e818a915dc75f648510add77d4369af5", "timestamp": "2026-04-19T16:35:31.473768+00:00", "hypothesis": "Add explicit deterministic fail-fast checks for invalid list filter cases while preserving valid behavior and response shapes.", "hypothesis_source": "agent", "mutation_diff_summary": "", "score": 0.7, "score_ci_lower": null, "score_ci_upper": null, "raw_scores": null, "baseline_score": 0.7, "outcome": "KEPT", "failure_mode": null, "duration_seconds": 13.788351625087671, "tags": ["validation", "deterministic", "fail-fast"], "learnings": "{\"what_changed\":\"\",\"what_improved\":[],\"what_regressed\":[],\"transferable_insight\":\"Adding explicit fail-fast validation for invalid inputs can improve robustness without changing the behavior or output shape for valid cases.\",\"domain_tags\":[\"software-engineering\",\"validation\",\"reliability\"]}", "cost_usd": 0.03572, "bootstrap_seed": 0, "agent_model": "gpt-5.4", "held_out_score": null, "criterion_names": null, "per_criterion_scores": null, "failure_classification": null, "drafts_generated": 1, "drafts_survived": 1}
{"id": "e8d2eae7-2012-4e32-bb51-b9436c44a57d", "target_id": "B4-treatment", "git_sha": "f21fff56dd843bfeaf2631ad34e89f072f1d799f", "pre_experiment_sha": "eb2d0031093b010e4a42fee964d86dcd3ba90147", "timestamp": "2026-04-19T16:35:47.498872+00:00", "hypothesis": "Add explicit fail-fast checks for the known invalid list filter cases while leaving valid behavior unchanged.", "hypothesis_source": "agent", "mutation_diff_summary": "", "score": 0.7, "score_ci_lower": null, "score_ci_upper": null, "raw_scores": null, "baseline_score": 0.7, "outcome": "KEPT", "failure_mode": null, "duration_seconds": 14.871481291949749, "tags": ["validation", "deterministic", "fail-fast"], "learnings": "{\"what_changed\":\"\",\"what_improved\":[],\"what_regressed\":[],\"transferable_insight\":\"When a system has known invalid input patterns, adding explicit fail-fast validation for those cases can improve robustness without changing correct behavior.\",\"domain_tags\":[\"validation\",\"error-handling\",\"robustness\"]}", "cost_usd": 0.038000000000000006, "bootstrap_seed": 0, "agent_model": "gpt-5.4", "held_out_score": null, "criterion_names": null, "per_criterion_scores": null, "failure_classification": null, "drafts_generated": 1, "drafts_survived": 1}
{"id": "df0e9095-021e-4c4d-b773-bbb500af8846", "target_id": "B4-treatment", "git_sha": "c3d48dac79eceff6aa1c4067b757aad98a94f9e8", "pre_experiment_sha": "f21fff56dd843bfeaf2631ad34e89f072f1d799f", "timestamp": "2026-04-19T16:36:05.344713+00:00", "hypothesis": "Add a shared deterministic bad-id helper and explicit fail-fast list filter checks for the known invalid cases only.", "hypothesis_source": "agent", "mutation_diff_summary": "", "score": 0.7, "score_ci_lower": null, "score_ci_upper": null, "raw_scores": null, "baseline_score": 0.7, "outcome": "KEPT", "failure_mode": null, "duration_seconds": 14.522647166973911, "tags": ["deterministic", "validation", "fail-fast", "minimal-change"], "learnings": "{\"what_changed\":\"\",\"what_improved\":[],\"what_regressed\":[],\"transferable_insight\":\"When handling known invalid inputs, a small shared deterministic helper plus explicit fail-fast checks can improve clarity and consistency without changing outcomes.\",\"domain_tags\":[\"software-engineering\",\"error-handling\",\"code-quality\"]}", "cost_usd": 0.038485000000000005, "bootstrap_seed": 0, "agent_model": "gpt-5.4", "held_out_score": null, "criterion_names": null, "per_criterion_scores": null, "failure_classification": null, "drafts_generated": 1, "drafts_survived": 1}
{"id": "ebc74f95-4155-4a1a-b62e-ecf64cbef427", "target_id": "B4-treatment", "git_sha": "6061be4729f961d1efce3448550d2f3303f08f84", "pre_experiment_sha": "c3d48dac79eceff6aa1c4067b757aad98a94f9e8", "timestamp": "2026-04-19T16:36:22.467887+00:00", "hypothesis": "Add a shared deterministic fail-fast validator for invalid IDs and known-bad list name filters before normal processing.", "hypothesis_source": "agent", "mutation_diff_summary": "", "score": 0.7, "score_ci_lower": null, "score_ci_upper": null, "raw_scores": null, "baseline_score": 0.7, "outcome": "KEPT", "failure_mode": null, "duration_seconds": 16.13139900006354, "tags": ["determinism", "validation", "fail-fast", "minimal-change"], "learnings": "{\"what_changed\":\"\",\"what_improved\":[],\"what_regressed\":[],\"transferable_insight\":\"Adding an early, deterministic validation step to reject known-invalid inputs before the main workflow can improve robustness without changing outcomes when the invalid cases are already handled elsewhere.\",\"domain_tags\":[\"validation\",\"reliability\",\"input-sanitization\"]}", "cost_usd": 0.039420000000000004, "bootstrap_seed": 0, "agent_model": "gpt-5.4", "held_out_score": null, "criterion_names": null, "per_criterion_scores": null, "failure_classification": null, "drafts_generated": 1, "drafts_survived": 1}
{"id": "b1a0a92b-7866-4336-bffb-974ef7ae3972", "target_id": "B4-treatment", "git_sha": "b8d708b42368efc64afa587897e3920bfaab7a85", "pre_experiment_sha": "6061be4729f961d1efce3448550d2f3303f08f84", "timestamp": "2026-04-19T16:36:39.216034+00:00", "hypothesis": "Tighten deterministic fail-fast validation for known-bad list filters while leaving valid behavior unchanged.", "hypothesis_source": "agent", "mutation_diff_summary": "", "score": 0.7, "score_ci_lower": null, "score_ci_upper": null, "raw_scores": null, "baseline_score": 0.7, "outcome": "KEPT", "failure_mode": null, "duration_seconds": 15.39891433401499, "tags": ["validation", "deterministic", "fail-fast", "minimal-change"], "learnings": "{\"what_changed\":\"\",\"what_improved\":[],\"what_regressed\":[],\"transferable_insight\":\"When a change preserves all valid behavior, the safest improvement is to make invalid inputs fail earlier and more deterministically without altering the successful path.\",\"domain_tags\":[\"validation\",\"error-handling\",\"reliability\"]}", "cost_usd": 0.039830000000000004, "bootstrap_seed": 0, "agent_model": "gpt-5.4", "held_out_score": null, "criterion_names": null, "per_criterion_scores": null, "failure_classification": null, "drafts_generated": 1, "drafts_survived": 1}
{"id": "112c2774-c44c-4966-92a0-872a03d3a806", "target_id": "B4-treatment", "git_sha": "498da97d407d2ad0609a2e42e317989ebeb8a407", "pre_experiment_sha": "b8d708b42368efc64afa587897e3920bfaab7a85", "timestamp": "2026-04-19T16:36:58.083446+00:00", "hypothesis": "Tighten deterministic fail-fast validation by making bad list-filter handling explicitly cover all already-invalid observed cases in one stable path.", "hypothesis_source": "agent", "mutation_diff_summary": "", "score": 0.7, "score_ci_lower": null, "score_ci_upper": null, "raw_scores": null, "baseline_score": 0.7, "outcome": "KEPT", "failure_mode": null, "duration_seconds": 15.22542233299464, "tags": ["validation", "deterministic", "fail-fast", "minimal-change"], "learnings": "{\"what_changed\":\"\",\"what_improved\":[],\"what_regressed\":[],\"transferable_insight\":\"When multiple invalid inputs already fail in different ways, consolidating them into one explicit, deterministic validation path improves consistency and makes failure behavior easier to reason about.\",\"domain_tags\":[\"validation\",\"error-handling\",\"determinism\"]}", "cost_usd": 0.04073, "bootstrap_seed": 0, "agent_model": "gpt-5.4", "held_out_score": null, "criterion_names": null, "per_criterion_scores": null, "failure_classification": null, "drafts_generated": 1, "drafts_survived": 1}
{"id": "aae63de1-dd96-43cc-b1d7-eddbeb026c96", "target_id": "B4-treatment", "git_sha": "1245a1f9b706be98426ea62e8e17993c3a4ca589", "pre_experiment_sha": "498da97d407d2ad0609a2e42e317989ebeb8a407", "timestamp": "2026-04-19T16:37:14.378694+00:00", "hypothesis": "Make invalid list filters fail fast deterministically with one local helper while preserving all valid behavior.", "hypothesis_source": "agent", "mutation_diff_summary": "", "score": 0.7, "score_ci_lower": null, "score_ci_upper": null, "raw_scores": null, "baseline_score": 0.7, "outcome": "KEPT", "failure_mode": null, "duration_seconds": 15.073477708967403, "tags": ["validation", "deterministic", "fail-fast", "minimal-change"], "learnings": "{\"what_changed\":\"\",\"what_improved\":[],\"what_regressed\":[],\"transferable_insight\":\"When a change is meant to preserve valid behavior, centralizing validation into one local helper can make invalid cases fail fast and deterministically without affecting the successful path.\",\"domain_tags\":[\"validation\",\"error-handling\",\"software-design\"]}", "cost_usd": 0.040530000000000004, "bootstrap_seed": 0, "agent_model": "gpt-5.4", "held_out_score": null, "criterion_names": null, "per_criterion_scores": null, "failure_classification": null, "drafts_generated": 1, "drafts_survived": 1}
{"id": "9ba14c7d-435e-4c28-a8ba-3a88be6a5c41", "target_id": "B4-treatment", "git_sha": "f7c5800a03c4ec57dbceee44ab069d9f61cf6b29", "pre_experiment_sha": "1245a1f9b706be98426ea62e8e17993c3a4ca589", "timestamp": "2026-04-19T16:37:30.525694+00:00", "hypothesis": "Tighten deterministic fail-fast validation by centralizing the known bad filter checks into one stable helper while leaving valid behavior unchanged.", "hypothesis_source": "agent", "mutation_diff_summary": "", "score": 0.7, "score_ci_lower": null, "score_ci_upper": null, "raw_scores": null, "baseline_score": 0.7, "outcome": "KEPT", "failure_mode": null, "duration_seconds": 15.025373292039149, "tags": ["deterministic-validation", "fail-fast", "minimal-change"], "learnings": "{\"what_changed\":\"\",\"what_improved\":[],\"what_regressed\":[],\"transferable_insight\":\"Consolidating repeated rejection checks into one stable helper can improve consistency and maintainability without changing successful-path behavior.\",\"domain_tags\":[\"software-engineering\",\"validation\",\"refactoring\"]}", "cost_usd": 0.040645, "bootstrap_seed": 0, "agent_model": "gpt-5.4", "held_out_score": null, "criterion_names": null, "per_criterion_scores": null, "failure_classification": null, "drafts_generated": 1, "drafts_survived": 1}
{"id": "3f6dc419-6b91-4b7a-ae09-7770f86fab9e", "target_id": "B4-treatment", "git_sha": "5056b91b8fd42c1989fd30f4015c759350c664e5", "pre_experiment_sha": "f7c5800a03c4ec57dbceee44ab069d9f61cf6b29", "timestamp": "2026-04-19T16:37:50.501531+00:00", "hypothesis": "Make invalid list-filter rejection deterministic by using a single explicit fail-fast guard for the known bad cases before normal validation.", "hypothesis_source": "agent", "mutation_diff_summary": "", "score": 0.7, "score_ci_lower": null, "score_ci_upper": null, "raw_scores": null, "baseline_score": 0.7, "outcome": "KEPT", "failure_mode": null, "duration_seconds": 16.867836833000183, "tags": ["deterministic", "validation", "fail-fast", "minimal-change"], "learnings": "{\"what_changed\":\"\",\"what_improved\":[],\"what_regressed\":[],\"transferable_insight\":\"When a small set of known invalid inputs can be identified upfront, adding one explicit fail-fast check makes rejection behavior predictable and easier to reason about than relying on later validation alone.\",\"domain_tags\":[\"validation\",\"error-handling\",\"control-flow\"]}", "cost_usd": 0.040725000000000004, "bootstrap_seed": 0, "agent_model": "gpt-5.4", "held_out_score": null, "criterion_names": null, "per_criterion_scores": null, "failure_classification": null, "drafts_generated": 1, "drafts_survived": 1}
{"id": "8b96080b-fb44-4cbd-9a7f-8d06c1b25a74", "target_id": "B4-treatment", "git_sha": "ab7d11a60b38cd24f4dd8ef82a7f44279ae97981", "pre_experiment_sha": "5056b91b8fd42c1989fd30f4015c759350c664e5", "timestamp": "2026-04-19T16:38:07.497866+00:00", "hypothesis": "Tighten deterministic fail-fast validation by using one narrow shared bad-filter response helper without changing valid behavior.", "hypothesis_source": "agent", "mutation_diff_summary": "", "score": 0.7, "score_ci_lower": null, "score_ci_upper": null, "raw_scores": null, "baseline_score": 0.7, "outcome": "KEPT", "failure_mode": null, "duration_seconds": 15.869402750045992, "tags": ["deterministic", "validation", "fail-fast", "minimal-change"], "learnings": "{\"what_changed\":\"\",\"what_improved\":[],\"what_regressed\":[],\"transferable_insight\":\"Consolidating repeated error-handling paths into one narrow shared helper can improve consistency and fail-fast behavior without affecting valid-case outcomes.\",\"domain_tags\":[\"software-engineering\",\"error-handling\",\"refactoring\"]}", "cost_usd": 0.040440000000000004, "bootstrap_seed": 0, "agent_model": "gpt-5.4", "held_out_score": null, "criterion_names": null, "per_criterion_scores": null, "failure_classification": null, "drafts_generated": 1, "drafts_survived": 1}
{"id": "8c1a7643-a094-4a82-9df5-a434765afc46", "target_id": "B4-treatment", "git_sha": "cc73725e62cab0e25f8947136aea9b1ebc245ab3", "pre_experiment_sha": "ab7d11a60b38cd24f4dd8ef82a7f44279ae97981", "timestamp": "2026-04-19T16:38:26.735324+00:00", "hypothesis": "Tighten deterministic fail-fast validation by using one explicit boundary guard for invalid ids and the known bad list filter cases only.", "hypothesis_source": "agent", "mutation_diff_summary": "", "score": 0.7, "score_ci_lower": null, "score_ci_upper": null, "raw_scores": null, "baseline_score": 0.7, "outcome": "KEPT", "failure_mode": null, "duration_seconds": 18.174380874959752, "tags": ["deterministic", "validation", "fail-fast", "minimal-change"], "learnings": "{\"what_changed\":\"\",\"what_improved\":[],\"what_regressed\":[],\"transferable_insight\":\"When tightening validation, keep the rule set minimal and explicit by guarding only clearly invalid inputs and known exception cases to preserve deterministic fail-fast behavior without adding unnecessary complexity.\",\"domain_tags\":[\"validation\",\"error-handling\",\"software-design\"]}", "cost_usd": 0.0413, "bootstrap_seed": 0, "agent_model": "gpt-5.4", "held_out_score": null, "criterion_names": null, "per_criterion_scores": null, "failure_classification": null, "drafts_generated": 1, "drafts_survived": 1}
{"id": "8d2ef851-2c69-4d7a-8569-f20c9fc06cdb", "target_id": "B4-treatment", "git_sha": "8d3b51e3a0879b4275714c661ae6ed462136c342", "pre_experiment_sha": "cc73725e62cab0e25f8947136aea9b1ebc245ab3", "timestamp": "2026-04-19T16:38:46.765094+00:00", "hypothesis": "Narrow the fail-fast guard to reject only the explicitly observed invalid ID and filter cases while leaving all other behavior unchanged.", "hypothesis_source": "agent", "mutation_diff_summary": "", "score": 0.7, "score_ci_lower": null, "score_ci_upper": null, "raw_scores": null, "baseline_score": 0.7, "outcome": "KEPT", "failure_mode": null, "duration_seconds": 16.18824712501373, "tags": ["deterministic", "validation", "fail-fast", "minimal-change"], "learnings": "{\"what_changed\":\"\",\"what_improved\":[],\"what_regressed\":[],\"transferable_insight\":\"When tightening a validation rule, limit the change to the specific confirmed failure cases so you preserve existing behavior everywhere else.\",\"domain_tags\":[\"validation\",\"change-management\",\"risk-reduction\"]}", "cost_usd": 0.04927000000000001, "bootstrap_seed": 0, "agent_model": "gpt-5.4", "held_out_score": null, "criterion_names": null, "per_criterion_scores": null, "failure_classification": null, "drafts_generated": 1, "drafts_survived": 1}
