{"id": "a8947c78-6a10-4cdc-9a42-fe80c8fe958c", "target_id": "B4-treatment", "git_sha": "4bc73932881700a9b41bfc8f65659a8be0f7d533", "pre_experiment_sha": "8d3b51e3a0879b4275714c661ae6ed462136c342", "timestamp": "2026-04-19T16:39:03.177063+00:00", "hypothesis": "Tighten the fail-fast guard to also reject tuple-based ambiguous name filters deterministically while preserving all valid behavior.", "hypothesis_source": "agent", "mutation_diff_summary": "", "score": 0.7, "score_ci_lower": null, "score_ci_upper": null, "raw_scores": null, "baseline_score": 0.7, "outcome": "KEPT", "failure_mode": null, "duration_seconds": 15.33973862498533, "tags": ["deterministic", "validation", "fail-fast", "minimal-change"], "learnings": "{\"what_changed\":\"\",\"what_improved\":[],\"what_regressed\":[],\"transferable_insight\":\"When a rule can be interpreted in more than one way, making the validation fail deterministically on ambiguous inputs preserves existing correct behavior while preventing inconsistent outcomes.\",\"domain_tags\":[\"validation\",\"reliability\",\"error-handling\"]}", "cost_usd": 0.04922000000000001, "bootstrap_seed": 0, "agent_model": "gpt-5.4", "held_out_score": null, "criterion_names": null, "per_criterion_scores": null, "failure_classification": null, "drafts_generated": 1, "drafts_survived": 1}
{"id": "ab6548c5-30aa-498b-b880-eec0b2d633ac", "target_id": "B4-treatment", "git_sha": "640643a2d3b5994e757258590c23d2f558d814db", "pre_experiment_sha": "4bc73932881700a9b41bfc8f65659a8be0f7d533", "timestamp": "2026-04-19T16:39:20.598277+00:00", "hypothesis": "Broaden the narrow fail-fast guard to reject a few more clearly ambiguous name-filter container types deterministically before list construction.", "hypothesis_source": "agent", "mutation_diff_summary": "", "score": 0.7, "score_ci_lower": null, "score_ci_upper": null, "raw_scores": null, "baseline_score": 0.7, "outcome": "KEPT", "failure_mode": null, "duration_seconds": 16.314408082980663, "tags": ["deterministic", "validation", "fail-fast", "minimal-change"], "learnings": "{\"what_changed\":\"\",\"what_improved\":[],\"what_regressed\":[],\"transferable_insight\":\"When a system must choose a single interpretation, adding deterministic early rejection for ambiguous inputs can preserve correctness without changing outcomes for valid cases.\",\"domain_tags\":[\"robustness\",\"input-validation\",\"deterministic-behavior\"]}", "cost_usd": 0.049420000000000006, "bootstrap_seed": 0, "agent_model": "gpt-5.4", "held_out_score": null, "criterion_names": null, "per_criterion_scores": null, "failure_classification": null, "drafts_generated": 1, "drafts_survived": 1}
{"id": "668f51f0-faeb-4614-8f06-ab2b7bf36d35", "target_id": "B4-treatment", "git_sha": "56fea7a39c9c7b6023932f07dba0ccf5945aaac1", "pre_experiment_sha": "640643a2d3b5994e757258590c23d2f558d814db", "timestamp": "2026-04-19T16:39:41.838734+00:00", "hypothesis": "Narrow the ambiguous name-filter guard to reject only list and tuple values while preserving all other existing behavior.", "hypothesis_source": "agent", "mutation_diff_summary": "", "score": 0.7, "score_ci_lower": null, "score_ci_upper": null, "raw_scores": null, "baseline_score": 0.7, "outcome": "KEPT", "failure_mode": null, "duration_seconds": 17.61410062504001, "tags": ["deterministic", "validation", "fail-fast", "minimal-change"], "learnings": "{\"what_changed\":\"\",\"what_improved\":[],\"what_regressed\":[],\"transferable_insight\":\"When refining a guard, make the smallest possible type-specific change so you preserve existing behavior for all unaffected inputs.\",\"domain_tags\":[\"software-engineering\",\"testing\",\"change-management\"]}", "cost_usd": 0.049370000000000004, "bootstrap_seed": 0, "agent_model": "gpt-5.4", "held_out_score": null, "criterion_names": null, "per_criterion_scores": null, "failure_classification": null, "drafts_generated": 1, "drafts_survived": 1}
{"id": "e1d0385b-2e79-4f2a-b32e-60b9fbf563c5", "target_id": "B4-treatment", "git_sha": "059f1d646de87affa2e1b20c9a53273c9d4add3b", "pre_experiment_sha": "56fea7a39c9c7b6023932f07dba0ccf5945aaac1", "timestamp": "2026-04-19T16:39:58.988103+00:00", "hypothesis": "Simplify the boundary guard to reject only invalid IDs and the specific observed bad name-filter cases deterministically before lookup or filtering.", "hypothesis_source": "agent", "mutation_diff_summary": "", "score": 0.7, "score_ci_lower": null, "score_ci_upper": null, "raw_scores": null, "baseline_score": 0.7, "outcome": "KEPT", "failure_mode": null, "duration_seconds": 16.114212916931137, "tags": ["deterministic", "validation", "fail-fast", "minimal-change"], "learnings": "{\"what_changed\":\"\",\"what_improved\":[],\"what_regressed\":[],\"transferable_insight\":\"When a broad guard is causing unnecessary rejection, narrow it to the smallest set of clearly invalid cases so valid inputs can proceed deterministically.\",\"domain_tags\":[\"validation\",\"error-handling\",\"control-flow\"]}", "cost_usd": 0.04922000000000001, "bootstrap_seed": 0, "agent_model": "gpt-5.4", "held_out_score": null, "criterion_names": null, "per_criterion_scores": null, "failure_classification": null, "drafts_generated": 1, "drafts_survived": 1}
{"id": "0e797a44-6124-4f13-8058-fbb90d432b7e", "target_id": "B4-treatment", "git_sha": "cb78b563b0fa970319ed85dc962873b2ec2baa0f", "pre_experiment_sha": "059f1d646de87affa2e1b20c9a53273c9d4add3b", "timestamp": "2026-04-19T16:40:16.146623+00:00", "hypothesis": "Make list filter validation deterministic by rejecting tuple-shaped name filters both at the boundary and in the main validator.", "hypothesis_source": "agent", "mutation_diff_summary": "", "score": 0.7, "score_ci_lower": null, "score_ci_upper": null, "raw_scores": null, "baseline_score": 0.7, "outcome": "KEPT", "failure_mode": null, "duration_seconds": 15.86343012494035, "tags": ["deterministic", "validation", "fail-fast", "minimal-change"], "learnings": "{\"what_changed\":\"\",\"what_improved\":[],\"what_regressed\":[],\"transferable_insight\":\"Enforce the same input-shape validation at every entry point to keep behavior deterministic and prevent ambiguous cases from slipping through.\",\"domain_tags\":[\"validation\",\"determinism\",\"input-sanitization\"]}", "cost_usd": 0.04914, "bootstrap_seed": 0, "agent_model": "gpt-5.4", "held_out_score": null, "criterion_names": null, "per_criterion_scores": null, "failure_classification": null, "drafts_generated": 1, "drafts_survived": 1}
{"id": "6c6eaf24-dfaa-4224-b407-8e42445ac8d7", "target_id": "B4-treatment", "git_sha": "25dbccf3f88c70054a870e6a91199203cbc68556", "pre_experiment_sha": "cb78b563b0fa970319ed85dc962873b2ec2baa0f", "timestamp": "2026-04-19T16:40:36.938344+00:00", "hypothesis": "Use one shared stable 400 error payload for invalid ids and invalid filters to make fail-fast outcomes fully deterministic with minimal changes.", "hypothesis_source": "agent", "mutation_diff_summary": "", "score": 0.7, "score_ci_lower": null, "score_ci_upper": null, "raw_scores": null, "baseline_score": 0.7, "outcome": "KEPT", "failure_mode": null, "duration_seconds": 16.353073959005997, "tags": ["deterministic", "validation", "fail-fast", "minimal-change"], "learnings": "{\"what_changed\":\"\",\"what_improved\":[],\"what_regressed\":[],\"transferable_insight\":\"When multiple invalid-input paths should behave the same, standardizing them on one stable error response can improve determinism and reduce implementation complexity with minimal change.\",\"domain_tags\":[\"error-handling\",\"api-design\",\"determinism\"]}", "cost_usd": 0.048920000000000005, "bootstrap_seed": 0, "agent_model": "gpt-5.4", "held_out_score": null, "criterion_names": null, "per_criterion_scores": null, "failure_classification": null, "drafts_generated": 1, "drafts_survived": 1}
{"id": "b7fe8adf-0760-4b16-9a46-837343df0295", "target_id": "B4-treatment", "git_sha": "ec43cdc8f9004d70cca3f849da6bc4c76acbfc17", "pre_experiment_sha": "25dbccf3f88c70054a870e6a91199203cbc68556", "timestamp": "2026-04-19T16:40:54.145639+00:00", "hypothesis": "Make list filtering fail fast at the boundary for all currently invalid filter shapes so invalid inputs never depend on downstream validation order.", "hypothesis_source": "agent", "mutation_diff_summary": "", "score": 0.7, "score_ci_lower": null, "score_ci_upper": null, "raw_scores": null, "baseline_score": 0.7, "outcome": "KEPT", "failure_mode": null, "duration_seconds": 16.05568004201632, "tags": ["deterministic", "validation", "fail-fast", "minimal-change"], "learnings": "{\"what_changed\":\"\",\"what_improved\":[],\"what_regressed\":[],\"transferable_insight\":\"Validate inputs as early as possible at the system boundary so invalid cases are rejected consistently before any downstream logic can influence behavior.\",\"domain_tags\":[\"validation\",\"error-handling\",\"software-design\"]}", "cost_usd": 0.05065, "bootstrap_seed": 0, "agent_model": "gpt-5.4", "held_out_score": null, "criterion_names": null, "per_criterion_scores": null, "failure_classification": null, "drafts_generated": 1, "drafts_survived": 1}
{"id": "a585c8f0-1489-490e-881f-fb3f88ac9fd5", "target_id": "B4-treatment", "git_sha": "56f00b4df1d5bb23ba50ef012367aa67339ab9fd", "pre_experiment_sha": "ec43cdc8f9004d70cca3f849da6bc4c76acbfc17", "timestamp": "2026-04-19T16:41:13.823987+00:00", "hypothesis": "Narrow the boundary guard to only the proven invalid ID and name-filter cases while leaving all other validation and valid behavior unchanged.", "hypothesis_source": "agent", "mutation_diff_summary": "", "score": 0.7, "score_ci_lower": null, "score_ci_upper": null, "raw_scores": null, "baseline_score": 0.7, "outcome": "KEPT", "failure_mode": null, "duration_seconds": 16.732643833034672, "tags": ["deterministic", "validation", "fail-fast", "minimal-change"], "learnings": "{\"what_changed\":\"\",\"what_improved\":[],\"what_regressed\":[],\"transferable_insight\":\"When tightening a guard, limit the change to the specific confirmed failure cases so existing valid paths and unrelated validations remain unaffected.\",\"domain_tags\":[\"validation\",\"change-management\",\"risk-control\"]}", "cost_usd": 0.0495, "bootstrap_seed": 0, "agent_model": "gpt-5.4", "held_out_score": null, "criterion_names": null, "per_criterion_scores": null, "failure_classification": null, "drafts_generated": 1, "drafts_survived": 1}
{"id": "180a76c4-caf1-450b-b13d-0df5e91808da", "target_id": "B4-treatment", "git_sha": "8504abdefe2cf92fba8039bc2814c21b1f7ad478", "pre_experiment_sha": "56f00b4df1d5bb23ba50ef012367aa67339ab9fd", "timestamp": "2026-04-19T16:41:34.836230+00:00", "hypothesis": "Narrow the fail-fast name-filter guard to reject only the specific observed ambiguous list shape while preserving all other existing validation paths.", "hypothesis_source": "agent", "mutation_diff_summary": "", "score": 0.7, "score_ci_lower": null, "score_ci_upper": null, "raw_scores": null, "baseline_score": 0.7, "outcome": "KEPT", "failure_mode": null, "duration_seconds": 16.773811416933313, "tags": ["deterministic", "validation", "fail-fast", "minimal-change"], "learnings": "{\"what_changed\":\"\",\"what_improved\":[],\"what_regressed\":[],\"transferable_insight\":\"When a validation rule is too broad, narrowing it to the exact problematic pattern can preserve existing safeguards while eliminating unnecessary false failures.\",\"domain_tags\":[\"validation\",\"error-handling\",\"software-engineering\"]}", "cost_usd": 0.049385000000000005, "bootstrap_seed": 0, "agent_model": "gpt-5.4", "held_out_score": null, "criterion_names": null, "per_criterion_scores": null, "failure_classification": null, "drafts_generated": 1, "drafts_survived": 1}
{"id": "608a9c2c-2875-4351-bd7a-4e46e17c00c0", "target_id": "B4-treatment", "git_sha": "f6d67d2ca15f3fb204842329562f90c3f003c9a2", "pre_experiment_sha": "8504abdefe2cf92fba8039bc2814c21b1f7ad478", "timestamp": "2026-04-19T16:41:50.960808+00:00", "hypothesis": "Tighten the boundary guard to reject the exact observed ambiguous tuple-shaped name filter deterministically while keeping all valid behavior unchanged.", "hypothesis_source": "agent", "mutation_diff_summary": "", "score": 0.7, "score_ci_lower": null, "score_ci_upper": null, "raw_scores": null, "baseline_score": 0.7, "outcome": "KEPT", "failure_mode": null, "duration_seconds": 15.04186729202047, "tags": ["deterministic", "validation", "fail-fast", "minimal-change"], "learnings": "{\"what_changed\":\"\",\"what_improved\":[],\"what_regressed\":[],\"transferable_insight\":\"When a specific ambiguous input pattern causes uncertainty, adding a precise guard to reject only that exact case can improve determinism without altering valid behavior.\",\"domain_tags\":[\"robustness\",\"input-validation\",\"edge-cases\"]}", "cost_usd": 0.04939, "bootstrap_seed": 0, "agent_model": "gpt-5.4", "held_out_score": null, "criterion_names": null, "per_criterion_scores": null, "failure_classification": null, "drafts_generated": 1, "drafts_survived": 1}
{"id": "e4d29f00-730e-4126-b680-2b8d8f3016b8", "target_id": "B4-treatment", "git_sha": "e960305ebb388de47148d63d59fac1b32da18b5c", "pre_experiment_sha": "f6d67d2ca15f3fb204842329562f90c3f003c9a2", "timestamp": "2026-04-19T16:42:06.536612+00:00", "hypothesis": "Narrow the fail-fast name-filter guard to reject only invalid ids, empty-string names, bool names, and the exact ambiguous tuple shape while leaving all other behavior unchanged.", "hypothesis_source": "agent", "mutation_diff_summary": "", "score": 0.7, "score_ci_lower": null, "score_ci_upper": null, "raw_scores": null, "baseline_score": 0.7, "outcome": "KEPT", "failure_mode": null, "duration_seconds": 14.532157042063773, "tags": ["deterministic", "validation", "fail-fast", "minimal-change"], "learnings": "{\"what_changed\":\"\",\"what_improved\":[],\"what_regressed\":[],\"transferable_insight\":\"When tightening a validation rule, preserve existing behavior by restricting the change to clearly invalid edge cases and the exact ambiguous pattern rather than broadening the filter.\",\"domain_tags\":[\"validation\",\"backward-compatibility\",\"edge-cases\"]}", "cost_usd": 0.049615000000000006, "bootstrap_seed": 0, "agent_model": "gpt-5.4", "held_out_score": null, "criterion_names": null, "per_criterion_scores": null, "failure_classification": null, "drafts_generated": 1, "drafts_survived": 1}
{"id": "fd0e638a-4b00-4cad-ace8-4fac4b19c01f", "target_id": "B4-treatment", "git_sha": "c5f5f849fe51a696b12dab3f89a72e5bf15c9f18", "pre_experiment_sha": "e960305ebb388de47148d63d59fac1b32da18b5c", "timestamp": "2026-04-19T16:42:27.006053+00:00", "hypothesis": "Make the request-boundary guard reject only invalid IDs, empty/bool name filters, and the exact ambiguous single-item list name-filter shape deterministically.", "hypothesis_source": "agent", "mutation_diff_summary": "", "score": 0.7, "score_ci_lower": null, "score_ci_upper": null, "raw_scores": null, "baseline_score": 0.7, "outcome": "KEPT", "failure_mode": null, "duration_seconds": 15.836203416925855, "tags": ["deterministic", "validation", "fail-fast", "minimal-change"], "learnings": "{\"what_changed\":\"\",\"what_improved\":[],\"what_regressed\":[],\"transferable_insight\":\"When tightening validation, preserve determinism by rejecting only clearly invalid inputs and explicitly handling ambiguous edge cases rather than broadening the guard\u2019s scope.\",\"domain_tags\":[\"validation\",\"determinism\",\"input-handling\"]}", "cost_usd": 0.049845, "bootstrap_seed": 0, "agent_model": "gpt-5.4", "held_out_score": null, "criterion_names": null, "per_criterion_scores": null, "failure_classification": null, "drafts_generated": 1, "drafts_survived": 1}
