{"id": "2b52b1dd-81cf-4a6a-8762-4d1a57ad365c", "target_id": "B4-treatment", "git_sha": "a1ddc1e5ea666caa94bf9cbf3d6787e6067aba69", "pre_experiment_sha": "68d96c185fbe6e19a4b0d379f77244ff8b5e62d6", "timestamp": "2026-04-19T00:49:58.162155+00:00", "hypothesis": "Make the endpoint deterministic and stricter by removing broad exception handling and normalizing validation/serialization.", "hypothesis_source": "agent", "mutation_diff_summary": "", "score": 0.7, "score_ci_lower": null, "score_ci_upper": null, "raw_scores": null, "baseline_score": 0.435, "outcome": "KEPT", "failure_mode": null, "duration_seconds": 11.337447416968644, "tags": ["determinism", "validation", "error-handling", "serialization"], "learnings": "{\"what_changed\":\"\",\"what_improved\":[],\"what_regressed\":[],\"transferable_insight\":\"Reducing broad exception handling and standardizing validation/serialization can make a system more deterministic and easier to reason about without necessarily changing observable outcomes.\",\"domain_tags\":[\"reliability\",\"validation\",\"error-handling\"]}", "cost_usd": 0.026265, "bootstrap_seed": 0, "agent_model": "gpt-5.4", "held_out_score": null, "criterion_names": null, "per_criterion_scores": null, "failure_classification": null, "drafts_generated": 1, "drafts_survived": 1}
{"id": "4b6fca6c-f78f-4f3f-a9f3-15c9541e35dc", "target_id": "B4-treatment", "git_sha": "a1ddc1e5ea666caa94bf9cbf3d6787e6067aba69", "pre_experiment_sha": "a1ddc1e5ea666caa94bf9cbf3d6787e6067aba69", "timestamp": "2026-04-19T00:50:10.586597+00:00", "hypothesis": "Improve determinism and API correctness by normalizing IDs, honoring payload fields consistently, and validating filters.", "hypothesis_source": "agent", "mutation_diff_summary": "", "score": 0.7, "score_ci_lower": null, "score_ci_upper": null, "raw_scores": null, "baseline_score": 0.7, "outcome": "DISCARDED", "failure_mode": null, "duration_seconds": 11.329184667090885, "tags": ["validation", "determinism", "api-consistency", "input-normalization"], "learnings": "{\"what_changed\":\"\",\"what_improved\":[],\"what_regressed\":[],\"transferable_insight\":\"Small inconsistencies in how identifiers, input fields, and filters are handled can undermine determinism and correctness, so standardizing these paths is essential for reliable behavior.\",\"domain_tags\":[\"software-engineering\",\"data-validation\",\"api-design\"]}", "cost_usd": 0.029707400000000002, "bootstrap_seed": 0, "agent_model": "gpt-5.4", "held_out_score": null, "criterion_names": null, "per_criterion_scores": null, "failure_classification": {"category": "logic_error", "description": "The experiment intended to improve determinism and API correctness via ID normalization, consistent payload handling, and filter validation, but it failed with an unknown failure mode, suggesting the changes did not correctly implement the intended logic or validations and instead produced behavior that diverged from the expected semantics.", "fix_direction": "Focus on validating the intended behavioral contract end-to-end: add explicit test cases for normalized IDs, ensure payload fields are consistently honored, and verify filter validation logic against edge cases (missing/extra fields, null/empty values, type mismatches).", "confidence": 0.52}, "drafts_generated": 1, "drafts_survived": 1}
{"id": "b55bbed0-f085-41d4-ae72-b3afb64b539b", "target_id": "B4-treatment", "git_sha": "a1ddc1e5ea666caa94bf9cbf3d6787e6067aba69", "pre_experiment_sha": "a1ddc1e5ea666caa94bf9cbf3d6787e6067aba69", "timestamp": "2026-04-19T00:50:24.158379+00:00", "hypothesis": "Improve determinism and API correctness by normalizing IDs, honoring provided active values, and making filtering validation stricter.", "hypothesis_source": "agent", "mutation_diff_summary": "", "score": 0.7, "score_ci_lower": null, "score_ci_upper": null, "raw_scores": null, "baseline_score": 0.7, "outcome": "DISCARDED", "failure_mode": null, "duration_seconds": 11.264836124959402, "tags": ["validation", "determinism", "api-correctness"], "learnings": "{\"what_changed\":\"\",\"what_improved\":[],\"what_regressed\":[],\"transferable_insight\":\"When refining a system, prioritize consistent identifier handling, respect explicit caller-provided state, and enforce stricter validation to improve predictability and correctness.\",\"domain_tags\":[\"software-engineering\",\"api-design\",\"data-validation\"]}", "cost_usd": 0.029945600000000003, "bootstrap_seed": 0, "agent_model": "gpt-5.4", "held_out_score": null, "criterion_names": null, "per_criterion_scores": null, "failure_classification": {"category": "incomplete_edit", "description": "The experiment likely implemented some of the intended changes (e.g., ID normalization, honoring provided active values, stricter filtering validation) but left the system in a partially updated or inconsistent state\u2014so determinism/API correctness was not fully achieved despite the expected improvements.", "fix_direction": "Review the full end-to-end flow for consistency: ensure all ID normalization paths are applied everywhere, verify that provided 'active' values are consistently respected through filtering and persistence, and confirm the new validation rules are enforced uniformly without gaps or contradictory defaults.", "confidence": 0.62}, "drafts_generated": 1, "drafts_survived": 1}
{"id": "12d4ea61-8e5d-4bdc-9aeb-e9b5d8a42672", "target_id": "B4-treatment", "git_sha": "a1ddc1e5ea666caa94bf9cbf3d6787e6067aba69", "pre_experiment_sha": "a1ddc1e5ea666caa94bf9cbf3d6787e6067aba69", "timestamp": "2026-04-19T00:50:40.147720+00:00", "hypothesis": "Tightening identifier and filter validation while making response shapes consistent will improve determinism.", "hypothesis_source": "agent", "mutation_diff_summary": "", "score": 0.7, "score_ci_lower": null, "score_ci_upper": null, "raw_scores": null, "baseline_score": 0.7, "outcome": "DISCARDED", "failure_mode": null, "duration_seconds": 11.597476250026375, "tags": ["validation", "deterministic", "serialization", "ids"], "learnings": "{\"what_changed\":\"\",\"what_improved\":[],\"what_regressed\":[],\"transferable_insight\":\"When a change produces no measurable improvement, the safest conclusion is to discard it rather than infer benefit from stricter rules or cleaner structure alone.\",\"domain_tags\":[\"evaluation\",\"decision-making\",\"process\"]}", "cost_usd": 0.032743600000000005, "bootstrap_seed": 0, "agent_model": "gpt-5.4", "held_out_score": null, "criterion_names": null, "per_criterion_scores": null, "failure_classification": {"category": "output_format", "description": "The experiment failed due to inconsistent or invalid response structure/schema\u2014tightening validation and making response shapes consistent did not prevent output-format compliance issues, indicating a schema/format violation rather than pure logic.", "fix_direction": "Enforce a single, rigid output schema end-to-end (including required fields, types, and ordering), add schema validation before scoring, and ensure all failure paths return the same shape.", "confidence": 0.63}, "drafts_generated": 1, "drafts_survived": 1}
{"id": "85b7db5f-55e2-427e-bfb5-b5b25adac9f1", "target_id": "B4-treatment", "git_sha": "e4f315978c9708291a907826d7b2a9a2134d7e30", "pre_experiment_sha": "a1ddc1e5ea666caa94bf9cbf3d6787e6067aba69", "timestamp": "2026-04-19T00:50:54.379915+00:00", "hypothesis": "Tightening identifier and filter validation while normalizing response shapes will make endpoint behavior more deterministic.", "hypothesis_source": "agent", "mutation_diff_summary": "", "score": 0.75, "score_ci_lower": null, "score_ci_upper": null, "raw_scores": null, "baseline_score": 0.7, "outcome": "KEPT", "failure_mode": null, "duration_seconds": 12.097447874955833, "tags": ["validation", "determinism", "serialization"], "learnings": "{\"what_changed\":\"\",\"what_improved\":[],\"what_regressed\":[],\"transferable_insight\":\"Stricter input validation combined with consistent output formatting tends to make system behavior more predictable and easier to reason about.\",\"domain_tags\":[\"validation\",\"interface-design\",\"reliability\"]}", "cost_usd": 0.033510000000000005, "bootstrap_seed": 0, "agent_model": "gpt-5.4", "held_out_score": null, "criterion_names": null, "per_criterion_scores": null, "failure_classification": null, "drafts_generated": 1, "drafts_survived": 1}
{"id": "db1da9b3-744d-4889-8f3d-927a13e6d8c1", "target_id": "B4-treatment", "git_sha": "e4f315978c9708291a907826d7b2a9a2134d7e30", "pre_experiment_sha": "e4f315978c9708291a907826d7b2a9a2134d7e30", "timestamp": "2026-04-19T00:51:08.960656+00:00", "hypothesis": "Tighten payload validation to reject unknown fields and require non-empty partial updates for more deterministic endpoint behavior.", "hypothesis_source": "agent", "mutation_diff_summary": "", "score": 0.75, "score_ci_lower": null, "score_ci_upper": null, "raw_scores": null, "baseline_score": 0.75, "outcome": "DISCARDED", "failure_mode": null, "duration_seconds": 13.365560916950926, "tags": ["validation", "determinism", "strictness"], "learnings": "{\"what_changed\":\"\",\"what_improved\":[],\"what_regressed\":[],\"transferable_insight\":\"When a change adds stricter validation but does not produce measurable gains, it is often better to preserve flexibility than to enforce determinism for its own sake.\",\"domain_tags\":[\"validation\",\"decision-making\",\"software-design\"]}", "cost_usd": 0.036101600000000005, "bootstrap_seed": 0, "agent_model": "gpt-5.4", "held_out_score": null, "criterion_names": null, "per_criterion_scores": null, "failure_classification": {"category": "semantic_drift", "description": "The experiment failed due to an 'unknown' failure mode, suggesting the change likely did not enforce the intended payload validation behavior (rejecting unknown fields / requiring non-empty partial updates) as expected, resulting in behavior that diverged from the hypothesis while still appearing structurally acceptable.", "fix_direction": "Clarify and instrument the validation logic to explicitly test: (1) rejection of unknown fields, (2) erroring on empty partial updates, and (3) ensuring consistent error responses for invalid payloads; add targeted test cases to pinpoint the exact mismatched behavior.", "confidence": 0.55}, "drafts_generated": 1, "drafts_survived": 1}
{"id": "23fa29bf-d107-4f50-b347-ee89da45f1de", "target_id": "B4-treatment", "git_sha": "e4f315978c9708291a907826d7b2a9a2134d7e30", "pre_experiment_sha": "e4f315978c9708291a907826d7b2a9a2134d7e30", "timestamp": "2026-04-19T00:51:26.131707+00:00", "hypothesis": "Tighten identifier validation to reject non-positive IDs consistently across all endpoint paths.", "hypothesis_source": "agent", "mutation_diff_summary": "", "score": 0.75, "score_ci_lower": null, "score_ci_upper": null, "raw_scores": null, "baseline_score": 0.75, "outcome": "DISCARDED", "failure_mode": null, "duration_seconds": 12.98296166700311, "tags": ["validation", "determinism", "ids"], "learnings": "{\"what_changed\":\"\",\"what_improved\":[],\"what_regressed\":[],\"transferable_insight\":\"A change that enforces stricter validation only adds value when it aligns with existing behavior across all execution paths; otherwise, it may have no measurable effect.\",\"domain_tags\":[\"validation\",\"consistency\",\"software-engineering\"]}", "cost_usd": 0.035499800000000005, "bootstrap_seed": 0, "agent_model": "gpt-5.4", "held_out_score": null, "criterion_names": null, "per_criterion_scores": null, "failure_classification": {"category": "logic_error", "description": "The failure mode was not specified (labeled as \"unknown\"), so the exact nature of the failure\u2014format, logic, regression, scope, syntax, semantics, optimization, or incompleteness\u2014cannot be determined from the provided information.", "fix_direction": "Reproduce the experiment and capture concrete failure signals (error logs, response payload diffs, status codes, validation traces) to map the observed behavior to one of the defined categories.", "confidence": 0.12}, "drafts_generated": 1, "drafts_survived": 1}
{"id": "64dbcca4-c2ff-43fd-bce8-d9793871848a", "target_id": "B4-treatment", "git_sha": "e4f315978c9708291a907826d7b2a9a2134d7e30", "pre_experiment_sha": "e4f315978c9708291a907826d7b2a9a2134d7e30", "timestamp": "2026-04-19T00:51:41.275206+00:00", "hypothesis": "Tighten partial-update validation so non-dict and empty patch payloads fail predictably without altering successful response shapes.", "hypothesis_source": "agent", "mutation_diff_summary": "", "score": 0.75, "score_ci_lower": null, "score_ci_upper": null, "raw_scores": null, "baseline_score": 0.75, "outcome": "DISCARDED", "failure_mode": null, "duration_seconds": 12.900072791962884, "tags": ["validation", "determinism", "strictness"], "learnings": "{\"what_changed\":\"\",\"what_improved\":[],\"what_regressed\":[],\"transferable_insight\":\"When tightening validation, make invalid inputs fail consistently while preserving the shape and behavior of successful outputs to avoid unintended side effects.\",\"domain_tags\":[\"validation\",\"api-design\",\"backward-compatibility\"]}", "cost_usd": 0.036451, "bootstrap_seed": 0, "agent_model": "gpt-5.4", "held_out_score": null, "criterion_names": null, "per_criterion_scores": null, "failure_classification": {"category": "semantic_drift", "description": "The attempt to tighten partial-update validation did not lead to the intended predictable failure behavior for non-dict or empty patch payloads, and instead resulted in an unclear/incorrect outcome (\u201cunknown\u201d), indicating the validation logic or failure conditions likely drifted from the specified meaning while still producing responses that weren\u2019t reliably failing as required.", "fix_direction": "Align validation semantics with the hypothesis: explicitly reject (a) non-dict patch payloads and (b) empty patch objects consistently, with deterministic error handling, while ensuring successful responses keep their exact prior shape/schema.", "confidence": 0.64}, "drafts_generated": 1, "drafts_survived": 1}
{"id": "903069a2-c578-4898-abb7-64a7b318c357", "target_id": "B4-treatment", "git_sha": "e4f315978c9708291a907826d7b2a9a2134d7e30", "pre_experiment_sha": "e4f315978c9708291a907826d7b2a9a2134d7e30", "timestamp": "2026-04-19T00:51:56.241914+00:00", "hypothesis": "Tighten ID validation to reject non-positive integers consistently across all endpoint paths.", "hypothesis_source": "agent", "mutation_diff_summary": "", "score": 0.75, "score_ci_lower": null, "score_ci_upper": null, "raw_scores": null, "baseline_score": 0.75, "outcome": "DISCARDED", "failure_mode": null, "duration_seconds": 12.658607249963097, "tags": ["validation", "determinism", "ids"], "learnings": "{\"what_changed\":\"\",\"what_improved\":[],\"what_regressed\":[],\"transferable_insight\":\"A change that enforces stricter validation should be adopted only if it aligns with existing behavior across all execution paths, otherwise it may add consistency without producing measurable benefit.\",\"domain_tags\":[\"validation\",\"consistency\",\"software-engineering\"]}", "cost_usd": 0.0355094, "bootstrap_seed": 0, "agent_model": "gpt-5.4", "held_out_score": null, "criterion_names": null, "per_criterion_scores": null, "failure_classification": {"category": "logic_error", "description": "The provided metadata does not specify what exactly failed (only 'Failure Mode: unknown'), so the failure cannot be reliably mapped to a concrete category such as output format, logic, regression, scope, syntax, semantic drift, over-optimization, or incomplete edit.", "fix_direction": "Re-run the experiment capturing the concrete failing endpoint(s), expected vs actual responses, and any validation/error codes; then determine whether the issue is structural, semantic, missing in certain paths, or an incomplete/incorrect code change.", "confidence": 0.12}, "drafts_generated": 1, "drafts_survived": 1}
{"id": "0ba36148-364a-4ef1-a28f-941eea0054ef", "target_id": "B4-treatment", "git_sha": "e4f315978c9708291a907826d7b2a9a2134d7e30", "pre_experiment_sha": "e4f315978c9708291a907826d7b2a9a2134d7e30", "timestamp": "2026-04-19T00:52:13.985198+00:00", "hypothesis": "Normalize validated string fields consistently before storage and filtering to make responses deterministic across endpoints.", "hypothesis_source": "agent", "mutation_diff_summary": "", "score": 0.75, "score_ci_lower": null, "score_ci_upper": null, "raw_scores": null, "baseline_score": 0.75, "outcome": "DISCARDED", "failure_mode": null, "duration_seconds": 13.112063708947971, "tags": ["determinism", "validation", "normalization"], "learnings": "{\"what_changed\":\"\",\"what_improved\":[],\"what_regressed\":[],\"transferable_insight\":\"Applying the same validation and normalization rules at every entry and query point helps keep outputs deterministic and reduces inconsistencies across interfaces.\",\"domain_tags\":[\"data-processing\",\"software-engineering\",\"quality-assurance\"]}", "cost_usd": 0.036357400000000005, "bootstrap_seed": 0, "agent_model": "gpt-5.4", "held_out_score": null, "criterion_names": null, "per_criterion_scores": null, "failure_classification": {"category": "semantic_drift", "description": "The experiment appears to have an unclear/unspecified failure mode but achieved a moderate score, suggesting the normalization behavior did not match the intended meaning consistently across endpoints (e.g., different effective normalization at storage vs filtering or mismatched handling of edge cases).", "fix_direction": "Ensure end-to-end consistent normalization rules are applied identically in both write/storage and read/filter paths, including canonicalization of whitespace, casing, Unicode normalization, and deterministic handling of null/empty values; add shared utility and comprehensive test cases for cross-endpoint equivalence.", "confidence": 0.62}, "drafts_generated": 1, "drafts_survived": 1}
{"id": "20c80779-1a7f-4363-8175-b1e73a88ef47", "target_id": "B4-treatment", "git_sha": "38e3994c295f6fe20d2f691b6936bd2f976cfe02", "pre_experiment_sha": "e4f315978c9708291a907826d7b2a9a2134d7e30", "timestamp": "2026-04-19T00:52:30.110876+00:00", "hypothesis": "Normalize and reuse stripped filter values during validation and listing to make filtering behavior stricter and deterministic.", "hypothesis_source": "agent", "mutation_diff_summary": "", "score": 0.75, "score_ci_lower": null, "score_ci_upper": null, "raw_scores": null, "baseline_score": 0.75, "outcome": "KEPT", "failure_mode": null, "duration_seconds": 13.894576833001338, "tags": ["determinism", "validation", "filtering", "normalization"], "learnings": "{\"what_changed\":\"\",\"what_improved\":[],\"what_regressed\":[],\"transferable_insight\":\"Reusing a single normalized representation of input across validation and downstream processing makes behavior more consistent, deterministic, and less prone to edge-case drift.\",\"domain_tags\":[\"data-processing\",\"validation\",\"determinism\"]}", "cost_usd": 0.03642000000000001, "bootstrap_seed": 0, "agent_model": "gpt-5.4", "held_out_score": null, "criterion_names": null, "per_criterion_scores": null, "failure_classification": null, "drafts_generated": 1, "drafts_survived": 1}
{"id": "ad6943fc-b4c8-4c42-8c2d-fafa3dc95ef2", "target_id": "B4-treatment", "git_sha": "14f46f01f21df09ae7c8e697539cae8850fc20f1", "pre_experiment_sha": "38e3994c295f6fe20d2f691b6936bd2f976cfe02", "timestamp": "2026-04-19T00:52:45.346178+00:00", "hypothesis": "Tighten payload validation to reject non-dict partial updates and normalize serialization through a single helper for more deterministic responses.", "hypothesis_source": "agent", "mutation_diff_summary": "", "score": 0.75, "score_ci_lower": null, "score_ci_upper": null, "raw_scores": null, "baseline_score": 0.75, "outcome": "KEPT", "failure_mode": null, "duration_seconds": 14.097006916999817, "tags": ["validation", "determinism", "serialization"], "learnings": "{\"what_changed\":\"\",\"what_improved\":[],\"what_regressed\":[],\"transferable_insight\":\"When handling updates, enforcing a single normalized input path and stricter validation reduces ambiguity and makes outputs more predictable.\",\"domain_tags\":[\"software-engineering\",\"data-validation\",\"api-design\"]}", "cost_usd": 0.036785000000000005, "bootstrap_seed": 0, "agent_model": "gpt-5.4", "held_out_score": null, "criterion_names": null, "per_criterion_scores": null, "failure_classification": null, "drafts_generated": 1, "drafts_survived": 1}
{"id": "b31b1e65-820c-4454-85f3-dcfafa1f16d5", "target_id": "B4-treatment", "git_sha": "1e2fd2a149033eff10d815534b1124eca2800a4b", "pre_experiment_sha": "14f46f01f21df09ae7c8e697539cae8850fc20f1", "timestamp": "2026-04-19T00:53:04.212433+00:00", "hypothesis": "Use one deterministic normalization path for validated user payload fields and reuse it for create/update responses.", "hypothesis_source": "agent", "mutation_diff_summary": "", "score": 0.75, "score_ci_lower": null, "score_ci_upper": null, "raw_scores": null, "baseline_score": 0.75, "outcome": "KEPT", "failure_mode": null, "duration_seconds": 15.363279957906343, "tags": ["determinism", "validation", "serialization", "normalization"], "learnings": "{\"what_changed\":\"\",\"what_improved\":[],\"what_regressed\":[],\"transferable_insight\":\"Reusing a single deterministic transformation path for both input validation and output generation reduces inconsistency without changing behavior.\",\"domain_tags\":[\"software-engineering\",\"data-processing\",\"api-design\"]}", "cost_usd": 0.039185000000000005, "bootstrap_seed": 0, "agent_model": "gpt-5.4", "held_out_score": null, "criterion_names": null, "per_criterion_scores": null, "failure_classification": null, "drafts_generated": 1, "drafts_survived": 1}
