{"id": "a2cc3091-57de-4a66-a4e6-94b6809b00ec", "target_id": "B5-control", "git_sha": "a639f0f7e615a726f12c839b0318b8a431aa4e17", "pre_experiment_sha": "5fc6ff846095d42aced65fc3181e4192886dabbe", "timestamp": "2026-04-20T21:27:00.012894+00:00", "hypothesis": "Add standard technical README sections and specify language identifiers for all code blocks to satisfy markdown and documentation requirements.", "hypothesis_source": "agent", "mutation_diff_summary": "", "score": 2.2, "score_ci_lower": 1.3, "score_ci_upper": 3.1, "raw_scores": [1.0, 2.5, 1.0, 4.0, 2.5], "baseline_score": 0.0, "outcome": "KEPT", "failure_mode": null, "duration_seconds": 78.59983254084364, "tags": ["documentation", "markdown", "formatting"], "learnings": "{\"what_changed\":\"\",\"what_improved\":[],\"what_regressed\":[],\"transferable_insight\":\"Structuring documents with standard sections and applying explicit formatting rules improves overall readability and compliance with quality standards.\",\"domain_tags\":[\"Documentation\",\"Formatting\",\"Technical Writing\"]}", "cost_usd": 0.036994149999999996, "bootstrap_seed": 0, "agent_model": "gemini-3.1-pro-preview", "held_out_score": null, "criterion_names": ["quick_start_present", "api_documented", "prerequisites_clear", "examples_runnable", "error_guidance", "contribution_path"], "per_criterion_scores": {"quick_start_present": 0.5, "api_documented": 0.4, "prerequisites_clear": 0.0, "examples_runnable": 0.7, "error_guidance": 0.2, "contribution_path": 0.4}, "failure_classification": null, "drafts_generated": 1, "drafts_survived": 1}
{"id": "f31fa336-c814-4a63-a057-bc83cd8a1f66", "target_id": "B5-control", "git_sha": "a639f0f7e615a726f12c839b0318b8a431aa4e17", "pre_experiment_sha": "a639f0f7e615a726f12c839b0318b8a431aa4e17", "timestamp": "2026-04-20T21:28:15.034408+00:00", "hypothesis": "Fill in all empty sections with comprehensive content, including code blocks, descriptions, and standard open-source guidelines, to satisfy typical README binary criteria.", "hypothesis_source": "agent", "mutation_diff_summary": "", "score": 0.9, "score_ci_lower": 0.3, "score_ci_upper": 1.5, "raw_scores": [2.0, 0.5, 1.0, 0.0, 1.0], "baseline_score": 2.2, "outcome": "DISCARDED", "failure_mode": null, "duration_seconds": 67.98377612489276, "tags": ["readme", "documentation", "content-expansion"], "learnings": "{\"what_changed\":\"\",\"what_improved\":[],\"what_regressed\":[],\"transferable_insight\":\"Forcing comprehensive content into every empty section to satisfy standard completeness criteria often degrades overall quality by introducing unnecessary bloat and noise.\",\"domain_tags\":[\"Documentation\",\"Content Strategy\",\"Information Design\"]}", "cost_usd": 0.0301411, "bootstrap_seed": 0, "agent_model": "gemini-3.1-pro-preview", "held_out_score": null, "criterion_names": ["quick_start_present", "api_documented", "prerequisites_clear", "examples_runnable", "error_guidance", "contribution_path"], "per_criterion_scores": {"quick_start_present": 0.2, "api_documented": 0.2, "prerequisites_clear": 0.0, "examples_runnable": 0.3, "error_guidance": 0.0, "contribution_path": 0.2}, "failure_classification": {"category": "incomplete_edit", "description": "The experiment aimed to fill all empty sections with comprehensive content, including specific elements like code blocks, descriptions, and open-source guidelines. A score of 0.9000 suggests that while a significant portion of the content was generated correctly and in the appropriate sections, it failed to fully meet the 'all empty sections' or 'comprehensive content' criteria. This indicates that some required sections might have been left partially empty, or the content provided, though relevant, lacked the necessary depth, detail, or specific elements (like a full code block or a specific guideline) to be considered 'comprehensive' and satisfy all 'typical README binary criteria'.", "fix_direction": "Focus on ensuring absolute completeness for all identified empty sections. Explicitly instruct the model to review and include all specified elements (code blocks, detailed descriptions, standard open-source guidelines) to meet the 'comprehensiveness' requirement for each section. Implement more granular evaluation criteria to pinpoint exactly which elements or sections are consistently missed or are insufficiently detailed to achieve a perfect score.", "confidence": 0.9}, "drafts_generated": 1, "drafts_survived": 1}
{"id": "87ba5a7d-8671-480d-bf3e-3bccbe878688", "target_id": "B5-control", "git_sha": "a639f0f7e615a726f12c839b0318b8a431aa4e17", "pre_experiment_sha": "a639f0f7e615a726f12c839b0318b8a431aa4e17", "timestamp": "2026-04-20T21:31:17.814242+00:00", "hypothesis": "Add missing standard README sections concisely and ensure all code blocks have language identifiers.", "hypothesis_source": "agent", "mutation_diff_summary": "", "score": 1.1, "score_ci_lower": 0.2, "score_ci_upper": 2.0, "raw_scores": [0.0, 1.0, 0.0, 2.5, 2.0], "baseline_score": 2.2, "outcome": "DISCARDED", "failure_mode": null, "duration_seconds": 70.54063579090871, "tags": ["readme", "markdown", "documentation"], "learnings": "{\"what_changed\":\"\",\"what_improved\":[],\"what_regressed\":[],\"transferable_insight\":\"Enforcing standard structural templates and formatting rules can degrade quality by introducing unnecessary boilerplate that dilutes the core message.\",\"domain_tags\":[\"Documentation\",\"Standardization\",\"Formatting\"]}", "cost_usd": 0.029153, "bootstrap_seed": 0, "agent_model": "gemini-3.1-pro-preview", "held_out_score": null, "criterion_names": ["quick_start_present", "api_documented", "prerequisites_clear", "examples_runnable", "error_guidance", "contribution_path"], "per_criterion_scores": {"quick_start_present": 0.2, "api_documented": 0.2, "prerequisites_clear": 0.0, "examples_runnable": 0.2, "error_guidance": 0.3, "contribution_path": 0.2}, "failure_classification": {"category": "incomplete_edit", "description": "The model failed to fully complete the task as specified in the hypothesis. This could mean it did not add *all* missing standard README sections, or it did not ensure *all* code blocks had language identifiers, leaving the document in a partially modified or inconsistent state. The score of 1.1000 suggests that some changes were made, but the overall objective of comprehensive adherence to the hypothesis was not met.", "fix_direction": "Improve the model's ability to systematically scan the document to identify *all* instances of required modifications (e.g., all code blocks lacking identifiers, all standard sections that are missing) and ensure that changes are applied comprehensively and exhaustively.", "confidence": 0.9}, "drafts_generated": 1, "drafts_survived": 1}
{"id": "c3e555bf-d282-4255-948d-631f0f6808c5", "target_id": "B5-control", "git_sha": "a639f0f7e615a726f12c839b0318b8a431aa4e17", "pre_experiment_sha": "a639f0f7e615a726f12c839b0318b8a431aa4e17", "timestamp": "2026-04-20T21:34:55.373486+00:00", "hypothesis": "Simplify the Table of Contents and add minimal Usage and License sections to fulfill standard README criteria without exceeding output limits.", "hypothesis_source": "agent", "mutation_diff_summary": "", "score": 2.1, "score_ci_lower": 1.5, "score_ci_upper": 2.6, "raw_scores": [2.0, 3.0, 2.0, 1.0, 2.5], "baseline_score": 2.2, "outcome": "DISCARDED", "failure_mode": null, "duration_seconds": 65.48065900010988, "tags": ["readme", "documentation", "formatting"], "learnings": "{\"what_changed\":\"\",\"what_improved\":[],\"what_regressed\":[],\"transferable_insight\":\"Sacrificing depth for brevity by providing overly minimal content to meet structural requirements can degrade overall quality and user experience.\",\"domain_tags\":[\"Documentation\",\"Content Strategy\",\"User Experience\"]}", "cost_usd": 0.027558749999999996, "bootstrap_seed": 0, "agent_model": "gemini-3.1-pro-preview", "held_out_score": null, "criterion_names": ["quick_start_present", "api_documented", "prerequisites_clear", "examples_runnable", "error_guidance", "contribution_path"], "per_criterion_scores": {"quick_start_present": 0.6, "api_documented": 0.1, "prerequisites_clear": 0.2, "examples_runnable": 0.4, "error_guidance": 0.0, "contribution_path": 0.8}, "failure_classification": {"category": "semantic_drift", "description": "The experiment likely produced an output README that, while potentially adhering to basic formatting (e.g., markdown structure), failed to convey the correct or useful meaning. This could mean the 'simplified' Table of Contents became too simplistic or inaccurate, or the 'minimal Usage and License sections' contained generic, irrelevant, or incorrect information that did not actually fulfill standard README criteria for the specific project. The content's meaning or utility was compromised, leading to a very low score.", "fix_direction": "Improve the model's contextual understanding of what constitutes a 'simplified' but still functional Table of Contents, and what 'minimal' but accurate and useful content for Usage and License sections entails for a given project. Focus on generating content that is semantically correct and genuinely informative, rather than just filling sections with boilerplate.", "confidence": 0.9}, "drafts_generated": 1, "drafts_survived": 1}
{"id": "e18917d0-445f-4786-8495-2d3ce456c4f2", "target_id": "B5-control", "git_sha": "a639f0f7e615a726f12c839b0318b8a431aa4e17", "pre_experiment_sha": "a639f0f7e615a726f12c839b0318b8a431aa4e17", "timestamp": "2026-04-20T21:39:29.322933+00:00", "hypothesis": "Add missing README sections defined in the Table of Contents with minimal text and ensure all code blocks have language identifiers.", "hypothesis_source": "agent", "mutation_diff_summary": "", "score": 1.4, "score_ci_lower": 0.2, "score_ci_upper": 2.6, "raw_scores": [0.0, 1.0, 0.0, 3.0, 3.0], "baseline_score": 2.2, "outcome": "DISCARDED", "failure_mode": null, "duration_seconds": 72.70635516685434, "tags": ["readme", "markdown", "documentation"], "learnings": "{\"what_changed\":\"\",\"what_improved\":[],\"what_regressed\":[],\"transferable_insight\":\"Fulfilling structural outlines with superficial or minimal content degrades overall quality more than leaving those sections absent.\",\"domain_tags\":[\"Documentation\",\"Content Strategy\",\"Quality Assurance\"]}", "cost_usd": 0.03228125, "bootstrap_seed": 0, "agent_model": "gemini-3.1-pro-preview", "held_out_score": null, "criterion_names": ["quick_start_present", "api_documented", "prerequisites_clear", "examples_runnable", "error_guidance", "contribution_path"], "per_criterion_scores": {"quick_start_present": 0.4, "api_documented": 0.4, "prerequisites_clear": 0.0, "examples_runnable": 0.2, "error_guidance": 0.2, "contribution_path": 0.2}, "failure_classification": {"category": "incomplete_edit", "description": "The experiment likely failed to fully address all requirements of the hypothesis. This could manifest as either not all missing README sections being added, or not all code blocks receiving language identifiers, or both, leaving the document in an partially completed state.", "fix_direction": "Improve the comprehensiveness of the agent's actions. Ensure it systematically identifies and applies all necessary changes across the entire document for each aspect of the hypothesis (e.g., iterating through all ToC entries for sections, and all code blocks for language identifiers). Implement a verification step to confirm all conditions are met.", "confidence": 0.8}, "drafts_generated": 1, "drafts_survived": 1}
{"id": "0bd60e6d-423a-4682-a67d-a6ea6445b0d0", "target_id": "B5-control", "git_sha": "a639f0f7e615a726f12c839b0318b8a431aa4e17", "pre_experiment_sha": "a639f0f7e615a726f12c839b0318b8a431aa4e17", "timestamp": "2026-04-20T21:41:43.139122+00:00", "hypothesis": "Append minimal Usage and License sections to the end of the document while preserving the existing structure to satisfy documentation requirements without causing incomplete edits.", "hypothesis_source": "agent", "mutation_diff_summary": "", "score": 1.3, "score_ci_lower": 0.3, "score_ci_upper": 2.3, "raw_scores": [0.0, 0.0, 1.5, 3.0, 2.0], "baseline_score": 2.2, "outcome": "DISCARDED", "failure_mode": null, "duration_seconds": 67.15558174997568, "tags": ["documentation", "formatting"], "learnings": "{\"what_changed\":\"\",\"what_improved\":[],\"what_regressed\":[],\"transferable_insight\":\"Appending minimal required content to the end of an existing structure, rather than properly integrating it, is an ineffective strategy for satisfying completeness requirements.\",\"domain_tags\":[\"Documentation\",\"Content Strategy\",\"Compliance\"]}", "cost_usd": 0.027769749999999996, "bootstrap_seed": 0, "agent_model": "gemini-3.1-pro-preview", "held_out_score": null, "criterion_names": ["quick_start_present", "api_documented", "prerequisites_clear", "examples_runnable", "error_guidance", "contribution_path"], "per_criterion_scores": {"quick_start_present": 0.2, "api_documented": 0.0, "prerequisites_clear": 0.3, "examples_runnable": 0.2, "error_guidance": 0.2, "contribution_path": 0.4}, "failure_classification": {"category": "incomplete_edit", "description": "The experiment failed to fully append both the 'Usage' and 'License' sections, or the appended sections were not populated with even 'minimal' content, leaving the document in a partially modified or inconsistent state. This directly violates the explicit constraint 'without causing incomplete edits' stated in the hypothesis.", "fix_direction": "Improve the robustness of the appending mechanism to ensure atomic additions of all required sections and their minimal content. Implement post-edit validation to confirm the completeness and structural integrity of the newly added sections, rolling back if not fully successful.", "confidence": 0.85}, "drafts_generated": 1, "drafts_survived": 1}
{"id": "3031fb4d-378a-4f5f-9570-304a1477b083", "target_id": "B5-control", "git_sha": "a639f0f7e615a726f12c839b0318b8a431aa4e17", "pre_experiment_sha": "a639f0f7e615a726f12c839b0318b8a431aa4e17", "timestamp": "2026-04-20T21:42:54.401528+00:00", "hypothesis": "Append minimal missing sections to satisfy the Table of Contents without exceeding context limits or altering existing structures.", "hypothesis_source": "agent", "mutation_diff_summary": "", "score": 2.0, "score_ci_lower": 0.8, "score_ci_upper": 3.2, "raw_scores": [2.0, 4.0, 2.0, 2.0, 0.0], "baseline_score": 2.2, "outcome": "DISCARDED", "failure_mode": null, "duration_seconds": 54.84757054201327, "tags": ["documentation", "markdown", "formatting"], "learnings": "{\"what_changed\":\"\",\"what_improved\":[],\"what_regressed\":[],\"transferable_insight\":\"Satisfying structural requirements through minimal, unintegrated additions rather than holistic restructuring degrades overall coherence and quality.\",\"domain_tags\":[\"Content Generation\",\"Document Structuring\",\"Context Management\"]}", "cost_usd": 0.030259499999999995, "bootstrap_seed": 0, "agent_model": "gemini-3.1-pro-preview", "held_out_score": null, "criterion_names": ["quick_start_present", "api_documented", "prerequisites_clear", "examples_runnable", "error_guidance", "contribution_path"], "per_criterion_scores": {"quick_start_present": 0.4, "api_documented": 0.0, "prerequisites_clear": 0.2, "examples_runnable": 0.4, "error_guidance": 0.4, "contribution_path": 0.6}, "failure_classification": {"category": "scope_violation", "description": "The experiment failed, possibly by exceeding explicit constraints stated in the hypothesis. The goal was to append *minimal* missing sections *without exceeding context limits* or *altering existing structures*. An 'unknown' failure mode suggests that one or more of these negative constraints, which define the operational scope, were likely violated, leading to an unacceptable output, even if the specific infraction wasn't logged.", "fix_direction": "Implement more robust validation and guardrails to strictly enforce context limits and prevent any alteration of existing document structures. Improve the mechanism for determining 'minimal' content to avoid over-generation, and ensure that only genuinely 'missing' sections are targeted for appending.", "confidence": 0.85}, "drafts_generated": 1, "drafts_survived": 1}
{"id": "ec436e62-15ca-4530-b4d5-4b923eb6beaf", "target_id": "B5-control", "git_sha": "a639f0f7e615a726f12c839b0318b8a431aa4e17", "pre_experiment_sha": "a639f0f7e615a726f12c839b0318b8a431aa4e17", "timestamp": "2026-04-20T21:44:04.442264+00:00", "hypothesis": "Append extremely minimal Usage and License sections to the end of the document to satisfy standard README criteria while avoiding incomplete edits.", "hypothesis_source": "agent", "mutation_diff_summary": "", "score": 1.7, "score_ci_lower": 1.1, "score_ci_upper": 2.4, "raw_scores": [1.0, 1.5, 3.0, 1.0, 2.0], "baseline_score": 2.2, "outcome": "DISCARDED", "failure_mode": null, "duration_seconds": 50.96623925003223, "tags": ["readme", "documentation", "minimal"], "learnings": "{\"what_changed\":\"\",\"what_improved\":[],\"what_regressed\":[],\"transferable_insight\":\"Adding superficial or minimal content solely to satisfy structural requirements degrades the overall quality of a document.\",\"domain_tags\":[\"Documentation\",\"Content Strategy\",\"Quality Assurance\"]}", "cost_usd": 0.030733600000000003, "bootstrap_seed": 0, "agent_model": "gemini-3.1-pro-preview", "held_out_score": null, "criterion_names": ["quick_start_present", "api_documented", "prerequisites_clear", "examples_runnable", "error_guidance", "contribution_path"], "per_criterion_scores": {"quick_start_present": 0.5, "api_documented": 0.0, "prerequisites_clear": 0.0, "examples_runnable": 0.4, "error_guidance": 0.0, "contribution_path": 0.8}, "failure_classification": {"category": "incomplete_edit", "description": "The experiment's attempt to generate 'extremely minimal' Usage and License sections likely resulted in content that was too sparse or placeholder-like to be considered functional or satisfactory according to standard README criteria, effectively making the edits incomplete despite the hypothesis's goal to avoid this failure mode. The brevity led to a lack of substance.", "fix_direction": "Future attempts should aim for 'concise and complete' rather than 'extremely minimal'. Establish a clearer definition of the minimum viable content required for a section to be considered complete and useful, ensuring that even brief sections still convey essential information and meet basic README expectations.", "confidence": 0.9}, "drafts_generated": 1, "drafts_survived": 1}
{"id": "b0a44ea3-e658-49d0-bcbb-d27181c7a365", "target_id": "B5-control", "git_sha": "a639f0f7e615a726f12c839b0318b8a431aa4e17", "pre_experiment_sha": "a639f0f7e615a726f12c839b0318b8a431aa4e17", "timestamp": "2026-04-20T21:45:58.275618+00:00", "hypothesis": "Add minimal Usage and License sections to satisfy the standard technical README criteria while preserving all existing content.", "hypothesis_source": "agent", "mutation_diff_summary": "", "score": 1.1, "score_ci_lower": 0.1, "score_ci_upper": 2.2, "raw_scores": [3.0, 0.0, 2.0, 0.5, 0.0], "baseline_score": 2.2, "outcome": "DISCARDED", "failure_mode": null, "duration_seconds": 52.91720983409323, "tags": ["documentation", "markdown", "formatting"], "learnings": "{\"what_changed\":\"\",\"what_improved\":[],\"what_regressed\":[],\"transferable_insight\":\"Inserting superficial content solely to satisfy structural checklists degrades overall quality rather than improving it.\",\"domain_tags\":[\"Documentation\",\"Content Strategy\",\"Quality Assurance\"]}", "cost_usd": 0.0257743, "bootstrap_seed": 0, "agent_model": "gemini-3.1-pro-preview", "held_out_score": null, "criterion_names": ["quick_start_present", "api_documented", "prerequisites_clear", "examples_runnable", "error_guidance", "contribution_path"], "per_criterion_scores": {"quick_start_present": 0.2, "api_documented": 0.0, "prerequisites_clear": 0.0, "examples_runnable": 0.4, "error_guidance": 0.0, "contribution_path": 0.5}, "failure_classification": {"category": "semantic_drift", "description": "The experiment likely added the 'Usage' and 'License' sections as requested, and possibly preserved existing content, but the actual content generated within these sections failed to satisfy the 'standard technical README criteria'. This implies the content was semantically incorrect, too generic, irrelevant to the project, or insufficient to be truly useful/standard, even if the structural format was present.", "fix_direction": "Improve the model's ability to generate contextually relevant, accurate, and sufficiently detailed content for new sections. Focus on grounding the model more deeply in project specifics to ensure the generated text meets specific quality or 'standard' criteria rather than just fulfilling a structural placeholder.", "confidence": 0.85}, "drafts_generated": 1, "drafts_survived": 1}
