{"id": "dc96fe1f-0281-4651-b013-5a2ea9dfdc45", "target_id": "B5-control", "git_sha": "cdd068996603775699882d45e97370df5184241d", "pre_experiment_sha": "6baf20d966937a1213a649675fc2a8446d96be47", "timestamp": "2026-04-07T18:59:16.203891+00:00", "hypothesis": "No hypothesis provided", "hypothesis_source": "synthesized", "mutation_diff_summary": "", "score": 1.0, "score_ci_lower": 0.0, "score_ci_upper": 2.2, "raw_scores": [3.0, 0.0, 0.0, 2.0, 0.0], "baseline_score": 2.7, "outcome": "KEPT", "failure_mode": null, "duration_seconds": 168.3109126670024, "tags": [], "learnings": "{\"what_changed\":\"\",\"what_improved\":[],\"what_regressed\":[],\"transferable_insight\":\"No hypothesis provided\",\"domain_tags\":[]}", "cost_usd": 0.47619465, "bootstrap_seed": 0, "agent_model": "claude-sonnet-4-6", "held_out_score": null, "criterion_names": ["quick_start_present", "api_documented", "prerequisites_clear", "examples_runnable", "error_guidance", "contribution_path"], "per_criterion_scores": {"quick_start_present": 0.2, "api_documented": 0.0, "prerequisites_clear": 0.2, "examples_runnable": 0.2, "error_guidance": 0.2, "contribution_path": 0.2}, "failure_classification": null, "drafts_generated": 1, "drafts_survived": 1}
{"id": "fca4e385-ffdb-42d9-a3d7-fe255185745e", "target_id": "B5-control", "git_sha": "39d02cf14d1262b26e9f2baa0755aa36d888a98e", "pre_experiment_sha": "cdd068996603775699882d45e97370df5184241d", "timestamp": "2026-04-07T19:02:48.902975+00:00", "hypothesis": "No hypothesis provided", "hypothesis_source": "synthesized", "mutation_diff_summary": "", "score": 2.2, "score_ci_lower": 0.4, "score_ci_upper": 4.0, "raw_scores": [4.0, 0.0, 0.0, 5.0, 2.0], "baseline_score": 1.0, "outcome": "KEPT", "failure_mode": null, "duration_seconds": 164.57131050000316, "tags": [], "learnings": "{\"what_changed\":\"\",\"what_improved\":[],\"what_regressed\":[],\"transferable_insight\":\"No hypothesis provided\",\"domain_tags\":[]}", "cost_usd": 0.5252178000000001, "bootstrap_seed": 0, "agent_model": "claude-sonnet-4-6", "held_out_score": null, "criterion_names": ["quick_start_present", "api_documented", "prerequisites_clear", "examples_runnable", "error_guidance", "contribution_path"], "per_criterion_scores": {"quick_start_present": 0.6, "api_documented": 0.2, "prerequisites_clear": 0.4, "examples_runnable": 0.4, "error_guidance": 0.2, "contribution_path": 0.4}, "failure_classification": null, "drafts_generated": 1, "drafts_survived": 1}
{"id": "b80cc3b8-7334-4a11-b596-7dba889705af", "target_id": "B5-control", "git_sha": "0a6223cb6c8aa35252a24bcccf6ba8f768c6816a", "pre_experiment_sha": "39d02cf14d1262b26e9f2baa0755aa36d888a98e", "timestamp": "2026-04-07T19:05:49.552068+00:00", "hypothesis": "No hypothesis provided", "hypothesis_source": "synthesized", "mutation_diff_summary": "", "score": 2.8, "score_ci_lower": 2.2, "score_ci_upper": 3.4, "raw_scores": [3.0, 4.0, 2.0, 2.0, 3.0], "baseline_score": 2.2, "outcome": "KEPT", "failure_mode": null, "duration_seconds": 180.1713054580032, "tags": [], "learnings": "{\"what_changed\":\"\",\"what_improved\":[],\"what_regressed\":[],\"transferable_insight\":\"No hypothesis provided\",\"domain_tags\":[]}", "cost_usd": 0.59603025, "bootstrap_seed": 0, "agent_model": "claude-sonnet-4-6", "held_out_score": null, "criterion_names": ["quick_start_present", "api_documented", "prerequisites_clear", "examples_runnable", "error_guidance", "contribution_path"], "per_criterion_scores": {"quick_start_present": 0.6, "api_documented": 0.2, "prerequisites_clear": 0.4, "examples_runnable": 0.4, "error_guidance": 0.4, "contribution_path": 0.8}, "failure_classification": null, "drafts_generated": 1, "drafts_survived": 1}
{"id": "450b4280-9428-4833-ab2a-167e6a35ab37", "target_id": "B5-control", "git_sha": "0a6223cb6c8aa35252a24bcccf6ba8f768c6816a", "pre_experiment_sha": "0a6223cb6c8aa35252a24bcccf6ba8f768c6816a", "timestamp": "2026-04-07T19:07:50.281807+00:00", "hypothesis": "No hypothesis provided", "hypothesis_source": "synthesized", "mutation_diff_summary": "", "score": 0.3, "score_ci_lower": 0.0, "score_ci_upper": 0.7, "raw_scores": [0.0, 0.0, 1.0, 0.0, 0.5], "baseline_score": 2.8, "outcome": "DISCARDED", "failure_mode": null, "duration_seconds": 120.31608029200288, "tags": [], "learnings": "{\"what_changed\":\"\",\"what_improved\":[],\"what_regressed\":[],\"transferable_insight\":\"No hypothesis provided\",\"domain_tags\":[]}", "cost_usd": 0.5395558500000001, "bootstrap_seed": 0, "agent_model": "claude-sonnet-4-6", "held_out_score": null, "criterion_names": ["quick_start_present", "api_documented", "prerequisites_clear", "examples_runnable", "error_guidance", "contribution_path"], "per_criterion_scores": {"quick_start_present": 0.0, "api_documented": 0.0, "prerequisites_clear": 0.0, "examples_runnable": 0.1, "error_guidance": 0.0, "contribution_path": 0.2}, "failure_classification": {"category": "output_format", "description": "The score of 0.3000 likely reflects a failure to produce output matching the expected structure or schema, as there is no hypothesis and the specific failure mode is unknown.", "fix_direction": "Ensure outputs strictly follow the required schema and include all required fields as specified.", "confidence": 0.85}, "drafts_generated": 1, "drafts_survived": 1}
{"id": "e4d6e37c-4bd4-406c-9fb6-5ece6d69efdf", "target_id": "B5-control", "git_sha": "925fd7932f12713c615142232c3993f11cee1005", "pre_experiment_sha": "0a6223cb6c8aa35252a24bcccf6ba8f768c6816a", "timestamp": "2026-04-07T19:11:10.527634+00:00", "hypothesis": "No hypothesis provided", "hypothesis_source": "synthesized", "mutation_diff_summary": "", "score": 2.7, "score_ci_lower": 1.8, "score_ci_upper": 3.9, "raw_scores": [2.0, 5.0, 1.5, 2.0, 3.0], "baseline_score": 2.8, "outcome": "KEPT", "failure_mode": null, "duration_seconds": 198.086586874997, "tags": [], "learnings": "{\"what_changed\":\"\",\"what_improved\":[],\"what_regressed\":[],\"transferable_insight\":\"No hypothesis provided\",\"domain_tags\":[]}", "cost_usd": 0.7805505, "bootstrap_seed": 0, "agent_model": "claude-sonnet-4-6", "held_out_score": null, "criterion_names": ["quick_start_present", "api_documented", "prerequisites_clear", "examples_runnable", "error_guidance", "contribution_path"], "per_criterion_scores": {"quick_start_present": 0.6, "api_documented": 0.2, "prerequisites_clear": 0.2, "examples_runnable": 0.5, "error_guidance": 0.4, "contribution_path": 0.8}, "failure_classification": null, "drafts_generated": 1, "drafts_survived": 1}
{"id": "00e17ef6-ba71-4cad-9cf1-da046bedd721", "target_id": "B5-control", "git_sha": "70a3bee81e7ceb4ed6ba6fac6d3e24d593fcaaac", "pre_experiment_sha": "925fd7932f12713c615142232c3993f11cee1005", "timestamp": "2026-04-07T19:14:17.518465+00:00", "hypothesis": "No hypothesis provided", "hypothesis_source": "synthesized", "mutation_diff_summary": "", "score": 1.9, "score_ci_lower": 1.2, "score_ci_upper": 2.6, "raw_scores": [2.5, 3.0, 1.0, 1.0, 2.0], "baseline_score": 2.7, "outcome": "KEPT", "failure_mode": null, "duration_seconds": 186.52454095899884, "tags": [], "learnings": "{\"what_changed\":\"\",\"what_improved\":[],\"what_regressed\":[],\"transferable_insight\":\"No hypothesis provided\",\"domain_tags\":[]}", "cost_usd": 0.6085011, "bootstrap_seed": 0, "agent_model": "claude-sonnet-4-6", "held_out_score": null, "criterion_names": ["quick_start_present", "api_documented", "prerequisites_clear", "examples_runnable", "error_guidance", "contribution_path"], "per_criterion_scores": {"quick_start_present": 0.6, "api_documented": 0.0, "prerequisites_clear": 0.0, "examples_runnable": 0.6, "error_guidance": 0.2, "contribution_path": 0.5}, "failure_classification": null, "drafts_generated": 1, "drafts_survived": 1}
{"id": "143f8986-2d29-41e2-9e4d-997d7b86f5cc", "target_id": "B5-control", "git_sha": "d6d975a44b51219227a55576b78ad26a45337fde", "pre_experiment_sha": "70a3bee81e7ceb4ed6ba6fac6d3e24d593fcaaac", "timestamp": "2026-04-07T19:18:54.395858+00:00", "hypothesis": "No hypothesis provided", "hypothesis_source": "synthesized", "mutation_diff_summary": "", "score": 2.3, "score_ci_lower": 1.6, "score_ci_upper": 3.0, "raw_scores": [1.0, 3.0, 2.0, 3.5, 2.0], "baseline_score": 1.9, "outcome": "KEPT", "failure_mode": null, "duration_seconds": 276.40952016599476, "tags": [], "learnings": "{\"what_changed\":\"\",\"what_improved\":[],\"what_regressed\":[],\"transferable_insight\":\"No hypothesis provided\",\"domain_tags\":[]}", "cost_usd": 0.8377216, "bootstrap_seed": 0, "agent_model": "claude-sonnet-4-6", "held_out_score": null, "criterion_names": ["quick_start_present", "api_documented", "prerequisites_clear", "examples_runnable", "error_guidance", "contribution_path"], "per_criterion_scores": {"quick_start_present": 0.4, "api_documented": 0.2, "prerequisites_clear": 0.7, "examples_runnable": 0.4, "error_guidance": 0.0, "contribution_path": 0.6}, "failure_classification": null, "drafts_generated": 1, "drafts_survived": 1}
{"id": "ffee8dce-9d3f-436e-afcb-5ac156618f90", "target_id": "B5-control", "git_sha": "d6d975a44b51219227a55576b78ad26a45337fde", "pre_experiment_sha": "d6d975a44b51219227a55576b78ad26a45337fde", "timestamp": "2026-04-07T19:23:35.045908+00:00", "hypothesis": "No hypothesis provided", "hypothesis_source": "synthesized", "mutation_diff_summary": "", "score": 0.4, "score_ci_lower": 0.0, "score_ci_upper": 0.8, "raw_scores": [1.0, 0.0, 1.0, 0.0, 0.0], "baseline_score": 2.3, "outcome": "DISCARDED", "failure_mode": null, "duration_seconds": 280.1780937079966, "tags": [], "learnings": "{\"what_changed\":\"\",\"what_improved\":[],\"what_regressed\":[],\"transferable_insight\":\"No hypothesis provided\",\"domain_tags\":[]}", "cost_usd": 0.8408059, "bootstrap_seed": 0, "agent_model": "claude-sonnet-4-6", "held_out_score": null, "criterion_names": ["quick_start_present", "api_documented", "prerequisites_clear", "examples_runnable", "error_guidance", "contribution_path"], "per_criterion_scores": {"quick_start_present": 0.2, "api_documented": 0.0, "prerequisites_clear": 0.0, "examples_runnable": 0.0, "error_guidance": 0.0, "contribution_path": 0.2}, "failure_classification": {"category": "output_format", "description": "The experiment failed due to a violation of the required output structure or schema.", "fix_direction": "Ensure the output strictly adheres to the expected format/schema in future attempts.", "confidence": 0.8}, "drafts_generated": 1, "drafts_survived": 1}
{"id": "15fa909b-2195-4a6e-9f11-3e36f8d6b7ca", "target_id": "B5-control", "git_sha": "901c575828b73aa68d2f20ae36a687e780841c05", "pre_experiment_sha": "d6d975a44b51219227a55576b78ad26a45337fde", "timestamp": "2026-04-07T19:27:25.038657+00:00", "hypothesis": "No hypothesis provided", "hypothesis_source": "synthesized", "mutation_diff_summary": "", "score": 2.5, "score_ci_lower": 1.4, "score_ci_upper": 3.6, "raw_scores": [4.0, 1.0, 1.5, 4.0, 2.0], "baseline_score": 2.3, "outcome": "KEPT", "failure_mode": null, "duration_seconds": 227.28061729099863, "tags": [], "learnings": "{\"what_changed\":\"\",\"what_improved\":[],\"what_regressed\":[],\"transferable_insight\":\"No hypothesis provided\",\"domain_tags\":[]}", "cost_usd": 0.86248265, "bootstrap_seed": 0, "agent_model": "claude-sonnet-4-6", "held_out_score": null, "criterion_names": ["quick_start_present", "api_documented", "prerequisites_clear", "examples_runnable", "error_guidance", "contribution_path"], "per_criterion_scores": {"quick_start_present": 0.6, "api_documented": 0.0, "prerequisites_clear": 0.4, "examples_runnable": 0.4, "error_guidance": 0.7, "contribution_path": 0.4}, "failure_classification": null, "drafts_generated": 1, "drafts_survived": 1}
{"id": "46d34c9f-91fe-4576-9ee4-d63dce9857c0", "target_id": "B5-control", "git_sha": "62e77b65a4268d5d297c8de08a5dddcd4f3285d2", "pre_experiment_sha": "901c575828b73aa68d2f20ae36a687e780841c05", "timestamp": "2026-04-07T19:32:12.597873+00:00", "hypothesis": "No hypothesis provided", "hypothesis_source": "synthesized", "mutation_diff_summary": "", "score": 1.5, "score_ci_lower": 0.3, "score_ci_upper": 2.7, "raw_scores": [3.0, 0.0, 0.0, 3.0, 1.5], "baseline_score": 2.5, "outcome": "KEPT", "failure_mode": null, "duration_seconds": 287.0426905419954, "tags": [], "learnings": "{\"what_changed\":\"\",\"what_improved\":[],\"what_regressed\":[],\"transferable_insight\":\"No hypothesis provided\",\"domain_tags\":[]}", "cost_usd": 0.84542595, "bootstrap_seed": 0, "agent_model": "claude-sonnet-4-6", "held_out_score": null, "criterion_names": ["quick_start_present", "api_documented", "prerequisites_clear", "examples_runnable", "error_guidance", "contribution_path"], "per_criterion_scores": {"quick_start_present": 0.5, "api_documented": 0.2, "prerequisites_clear": 0.0, "examples_runnable": 0.2, "error_guidance": 0.2, "contribution_path": 0.4}, "failure_classification": null, "drafts_generated": 1, "drafts_survived": 1}
{"id": "883082d3-b03b-4c1a-8911-fa3b5ca0f40b", "target_id": "B5-control", "git_sha": "538d89bc2b59df19ef2dea6905d3e94f4cdf4a10", "pre_experiment_sha": "62e77b65a4268d5d297c8de08a5dddcd4f3285d2", "timestamp": "2026-04-07T19:34:58.404846+00:00", "hypothesis": "No hypothesis provided", "hypothesis_source": "synthesized", "mutation_diff_summary": "", "score": 1.6, "score_ci_lower": 0.8, "score_ci_upper": 2.0, "raw_scores": [2.0, 0.0, 2.0, 2.0, 2.0], "baseline_score": 1.5, "outcome": "KEPT", "failure_mode": null, "duration_seconds": 165.32221979199676, "tags": [], "learnings": "{\"what_changed\":\"\",\"what_improved\":[],\"what_regressed\":[],\"transferable_insight\":\"No hypothesis provided\",\"domain_tags\":[]}", "cost_usd": 0.62106, "bootstrap_seed": 0, "agent_model": "claude-sonnet-4-6", "held_out_score": null, "criterion_names": ["quick_start_present", "api_documented", "prerequisites_clear", "examples_runnable", "error_guidance", "contribution_path"], "per_criterion_scores": {"quick_start_present": 0.4, "api_documented": 0.0, "prerequisites_clear": 0.2, "examples_runnable": 0.2, "error_guidance": 0.4, "contribution_path": 0.4}, "failure_classification": null, "drafts_generated": 1, "drafts_survived": 1}
{"id": "0a269d80-e522-4b7d-a520-dadb4884ec4c", "target_id": "B5-control", "git_sha": "29f14c304119a6b2aa4dcc621d370a43878d1074", "pre_experiment_sha": "538d89bc2b59df19ef2dea6905d3e94f4cdf4a10", "timestamp": "2026-04-07T19:38:29.860701+00:00", "hypothesis": "No hypothesis provided", "hypothesis_source": "synthesized", "mutation_diff_summary": "", "score": 2.3, "score_ci_lower": 1.0, "score_ci_upper": 3.6, "raw_scores": [4.0, 0.0, 1.5, 2.0, 4.0], "baseline_score": 1.6, "outcome": "KEPT", "failure_mode": null, "duration_seconds": 211.02691241700086, "tags": [], "learnings": "{\"what_changed\":\"\",\"what_improved\":[],\"what_regressed\":[],\"transferable_insight\":\"No hypothesis provided\",\"domain_tags\":[]}", "cost_usd": 0.80220405, "bootstrap_seed": 0, "agent_model": "claude-sonnet-4-6", "held_out_score": null, "criterion_names": ["quick_start_present", "api_documented", "prerequisites_clear", "examples_runnable", "error_guidance", "contribution_path"], "per_criterion_scores": {"quick_start_present": 0.5, "api_documented": 0.0, "prerequisites_clear": 0.2, "examples_runnable": 0.4, "error_guidance": 0.4, "contribution_path": 0.8}, "failure_classification": null, "drafts_generated": 1, "drafts_survived": 1}
{"id": "0f5f43bb-17e0-4ce0-9cc0-0dbe1ab397c3", "target_id": "B5-control", "git_sha": "29f14c304119a6b2aa4dcc621d370a43878d1074", "pre_experiment_sha": "29f14c304119a6b2aa4dcc621d370a43878d1074", "timestamp": "2026-04-07T19:47:53.997844+00:00", "hypothesis": "No hypothesis provided", "hypothesis_source": "synthesized", "mutation_diff_summary": "", "score": 0.4, "score_ci_lower": 0.0, "score_ci_upper": 0.8, "raw_scores": [1.0, 0.0, 1.0, 0.0, 0.0], "baseline_score": 2.3, "outcome": "DISCARDED", "failure_mode": null, "duration_seconds": 262.8313135000062, "tags": [], "learnings": "{\"what_changed\":\"\",\"what_improved\":[],\"what_regressed\":[],\"transferable_insight\":\"No hypothesis provided\",\"domain_tags\":[]}", "cost_usd": 0.77479115, "bootstrap_seed": 0, "agent_model": "claude-sonnet-4-6", "held_out_score": null, "criterion_names": ["quick_start_present", "api_documented", "prerequisites_clear", "examples_runnable", "error_guidance", "contribution_path"], "per_criterion_scores": {"quick_start_present": 0.2, "api_documented": 0.0, "prerequisites_clear": 0.0, "examples_runnable": 0.0, "error_guidance": 0.0, "contribution_path": 0.2}, "failure_classification": {"category": "output_format", "description": "The experiment failed due to an output structure or schema violation, as indicated by the scoring and absence of specific logical or syntactic errors.", "fix_direction": "Review and align outputs with the required format or schema specifications.", "confidence": 0.85}, "drafts_generated": 1, "drafts_survived": 1}
{"id": "4257a05b-9ba4-416d-bac5-b762248de715", "target_id": "B5-control", "git_sha": "48379f21725e926f1115e0fc453f106271dfdae0", "pre_experiment_sha": "29f14c304119a6b2aa4dcc621d370a43878d1074", "timestamp": "2026-04-07T19:51:18.704482+00:00", "hypothesis": "No hypothesis provided", "hypothesis_source": "synthesized", "mutation_diff_summary": "", "score": 1.7, "score_ci_lower": 0.6, "score_ci_upper": 2.8, "raw_scores": [3.0, 2.0, 0.0, 3.0, 0.5], "baseline_score": 2.3, "outcome": "KEPT", "failure_mode": null, "duration_seconds": 201.94071158400038, "tags": [], "learnings": "{\"what_changed\":\"\",\"what_improved\":[],\"what_regressed\":[],\"transferable_insight\":\"No hypothesis provided\",\"domain_tags\":[]}", "cost_usd": 0.658626, "bootstrap_seed": 0, "agent_model": "claude-sonnet-4-6", "held_out_score": null, "criterion_names": ["quick_start_present", "api_documented", "prerequisites_clear", "examples_runnable", "error_guidance", "contribution_path"], "per_criterion_scores": {"quick_start_present": 0.4, "api_documented": 0.2, "prerequisites_clear": 0.5, "examples_runnable": 0.2, "error_guidance": 0.2, "contribution_path": 0.2}, "failure_classification": null, "drafts_generated": 1, "drafts_survived": 1}
{"id": "01902905-e8cb-4a1e-aedc-fabe39dbbb5a", "target_id": "B5-control", "git_sha": "31bd23e406b732717706603f8fa38490994dae8a", "pre_experiment_sha": "48379f21725e926f1115e0fc453f106271dfdae0", "timestamp": "2026-04-07T19:55:56.448516+00:00", "hypothesis": "No hypothesis provided", "hypothesis_source": "synthesized", "mutation_diff_summary": "", "score": 2.2, "score_ci_lower": 1.2, "score_ci_upper": 3.2, "raw_scores": [3.0, 1.0, 1.0, 2.0, 4.0], "baseline_score": 1.7, "outcome": "KEPT", "failure_mode": null, "duration_seconds": 277.01877779200004, "tags": [], "learnings": "{\"what_changed\":\"\",\"what_improved\":[],\"what_regressed\":[],\"transferable_insight\":\"No hypothesis provided\",\"domain_tags\":[]}", "cost_usd": 0.9205529, "bootstrap_seed": 0, "agent_model": "claude-sonnet-4-6", "held_out_score": null, "criterion_names": ["quick_start_present", "api_documented", "prerequisites_clear", "examples_runnable", "error_guidance", "contribution_path"], "per_criterion_scores": {"quick_start_present": 0.4, "api_documented": 0.2, "prerequisites_clear": 0.2, "examples_runnable": 0.4, "error_guidance": 0.4, "contribution_path": 0.6}, "failure_classification": null, "drafts_generated": 1, "drafts_survived": 1}
{"id": "192ff144-f63b-4503-9096-a2c244f2384a", "target_id": "B5-control", "git_sha": "f8e7f6dc9edb93f80710f3594bcfb9088ec1086b", "pre_experiment_sha": "31bd23e406b732717706603f8fa38490994dae8a", "timestamp": "2026-04-07T20:09:05.766919+00:00", "hypothesis": "No hypothesis provided", "hypothesis_source": "synthesized", "mutation_diff_summary": "", "score": 1.7, "score_ci_lower": 0.6, "score_ci_upper": 2.8, "raw_scores": [3.0, 0.5, 3.0, 2.0, 0.0], "baseline_score": 2.2, "outcome": "KEPT", "failure_mode": null, "duration_seconds": 187.45701720900252, "tags": [], "learnings": "{\"what_changed\":\"\",\"what_improved\":[],\"what_regressed\":[],\"transferable_insight\":\"No hypothesis provided\",\"domain_tags\":[]}", "cost_usd": 0.7028770499999999, "bootstrap_seed": 0, "agent_model": "claude-sonnet-4-6", "held_out_score": null, "criterion_names": ["quick_start_present", "api_documented", "prerequisites_clear", "examples_runnable", "error_guidance", "contribution_path"], "per_criterion_scores": {"quick_start_present": 0.5, "api_documented": 0.0, "prerequisites_clear": 0.0, "examples_runnable": 0.4, "error_guidance": 0.2, "contribution_path": 0.6}, "failure_classification": null, "drafts_generated": 1, "drafts_survived": 1}
{"id": "47899394-d095-4c4c-818e-d841751fd83e", "target_id": "B5-control", "git_sha": "d70f053dd70f0513ac4baa32f6718ed3870c20e2", "pre_experiment_sha": "f8e7f6dc9edb93f80710f3594bcfb9088ec1086b", "timestamp": "2026-04-07T20:14:11.805841+00:00", "hypothesis": "No hypothesis provided", "hypothesis_source": "synthesized", "mutation_diff_summary": "", "score": 1.8, "score_ci_lower": 0.8, "score_ci_upper": 2.6, "raw_scores": [3.0, 2.0, 2.0, 2.0, 0.0], "baseline_score": 1.7, "outcome": "KEPT", "failure_mode": null, "duration_seconds": 305.6212981659992, "tags": [], "learnings": "{\"what_changed\":\"\",\"what_improved\":[],\"what_regressed\":[],\"transferable_insight\":\"No hypothesis provided\",\"domain_tags\":[]}", "cost_usd": 0.8911270499999999, "bootstrap_seed": 0, "agent_model": "claude-sonnet-4-6", "held_out_score": null, "criterion_names": ["quick_start_present", "api_documented", "prerequisites_clear", "examples_runnable", "error_guidance", "contribution_path"], "per_criterion_scores": {"quick_start_present": 0.2, "api_documented": 0.0, "prerequisites_clear": 0.6, "examples_runnable": 0.2, "error_guidance": 0.4, "contribution_path": 0.4}, "failure_classification": null, "drafts_generated": 1, "drafts_survived": 1}
