{"id": "6c72b053-cc09-43b1-ae5e-a23ef3b5deb0", "target_id": "B5-control", "git_sha": "8103fc03614e5c204967c5b85ca62873ebcbe182", "pre_experiment_sha": "8103fc03614e5c204967c5b85ca62873ebcbe182", "timestamp": "2026-04-19T11:43:19.986317+00:00", "hypothesis": "Replace the sparse README with a complete, operational technical reference covering the CLI workflow, pipeline schema, steps, examples, and troubleshooting.", "hypothesis_source": "agent", "mutation_diff_summary": "", "score": 0.7, "score_ci_lower": 0.1, "score_ci_upper": 1.4, "raw_scores": [1.0, 0.0, 2.0, 0.5, 0.0], "baseline_score": 1.2, "outcome": "DISCARDED", "failure_mode": null, "duration_seconds": 144.25525258400012, "tags": ["documentation", "readme", "technical-reference", "cli", "yaml", "csv"], "learnings": "{\"what_changed\":\"\",\"what_improved\":[],\"what_regressed\":[],\"transferable_insight\":\"Replacing a minimal reference with a comprehensive one only helps when it is tightly aligned to actual user workflows and maintained for accuracy; otherwise, added detail can fail to improve outcomes.\",\"domain_tags\":[\"documentation\",\"usability\",\"product-design\"]}", "cost_usd": 0.23507735000000002, "bootstrap_seed": 0, "agent_model": "gpt-5.4", "held_out_score": null, "criterion_names": ["quick_start_present", "api_documented", "prerequisites_clear", "examples_runnable", "error_guidance", "contribution_path"], "per_criterion_scores": {"quick_start_present": 0.0, "api_documented": 0.0, "prerequisites_clear": 0.2, "examples_runnable": 0.1, "error_guidance": 0.0, "contribution_path": 0.4}, "failure_classification": {"category": "incomplete_edit", "description": "The experiment to replace the sparse README with a complete operational technical reference did not fully succeed; the change appears partial or left the documentation in an inconsistent/incomplete state relative to the expected full coverage (CLI workflow, pipeline schema, steps, examples, troubleshooting).", "fix_direction": "Ensure the edit comprehensively covers every required README section end-to-end (CLI workflow, pipeline schema, step-by-step usage, concrete examples, and a troubleshooting guide) and verify internal consistency and completeness against the acceptance criteria.", "confidence": 0.72}, "drafts_generated": 1, "drafts_survived": 1}
{"id": "1b741331-301b-427e-9d4b-2e6388222d21", "target_id": "B5-control", "git_sha": "22e50448236e10124398d9abaa6638646cf6466c", "pre_experiment_sha": "8103fc03614e5c204967c5b85ca62873ebcbe182", "timestamp": "2026-04-19T11:47:56.463619+00:00", "hypothesis": "A full top-to-bottom rewrite with concrete sections, examples, schemas, and operational guidance will improve binary documentation completeness.", "hypothesis_source": "agent", "mutation_diff_summary": "", "score": 0.2, "score_ci_lower": 0.0, "score_ci_upper": 0.6, "raw_scores": [0.0, 0.0, 1.0, 0.0, 0.0], "baseline_score": 1.2, "outcome": "KEPT", "failure_mode": null, "duration_seconds": 152.86350774997845, "tags": ["readme", "documentation", "technical-reference", "cli", "yaml", "csv"], "learnings": "{\"what_changed\":\"\",\"what_improved\":[],\"what_regressed\":[],\"transferable_insight\":\"A comprehensive rewrite that adds explicit structure, concrete examples, and operational guidance can improve documentation completeness even when no specific subcomponents show measurable change.\",\"domain_tags\":[\"documentation\",\"process-improvement\",\"technical-writing\"]}", "cost_usd": 0.24183535000000003, "bootstrap_seed": 0, "agent_model": "gpt-5.4", "held_out_score": null, "criterion_names": ["quick_start_present", "api_documented", "prerequisites_clear", "examples_runnable", "error_guidance", "contribution_path"], "per_criterion_scores": {"quick_start_present": 0.0, "api_documented": 0.0, "prerequisites_clear": 0.0, "examples_runnable": 0.0, "error_guidance": 0.0, "contribution_path": 0.2}, "failure_classification": null, "drafts_generated": 1, "drafts_survived": 1}
{"id": "9f4c10f3-e2c0-4ff1-9578-e88158b3ccf1", "target_id": "B5-control", "git_sha": "40db4cfb39a006d86f0717875f1ab2194c72d536", "pre_experiment_sha": "22e50448236e10124398d9abaa6638646cf6466c", "timestamp": "2026-04-19T11:50:21.600915+00:00", "hypothesis": "Add a concise quick start, explicit CLI/API reference, runnable examples, prerequisites, troubleshooting, and contribution guidance to eliminate incomplete sections.", "hypothesis_source": "agent", "mutation_diff_summary": "", "score": 0.6, "score_ci_lower": 0.1, "score_ci_upper": 1.1, "raw_scores": [1.0, 0.0, 0.5, 0.0, 1.5], "baseline_score": 0.2, "outcome": "KEPT", "failure_mode": null, "duration_seconds": 144.0768978749402, "tags": ["readme", "documentation", "technical-reference", "cli", "yaml", "csv", "quickstart"], "learnings": "{\"what_changed\":\"\",\"what_improved\":[],\"what_regressed\":[],\"transferable_insight\":\"Documentation becomes more complete and useful when it explicitly covers the full user journey: getting started, how to use the interface, examples, prerequisites, troubleshooting, and how to contribute.\",\"domain_tags\":[\"documentation\",\"usability\",\"developer-experience\"]}", "cost_usd": 0.23577915000000002, "bootstrap_seed": 0, "agent_model": "gpt-5.4", "held_out_score": null, "criterion_names": ["quick_start_present", "api_documented", "prerequisites_clear", "examples_runnable", "error_guidance", "contribution_path"], "per_criterion_scores": {"quick_start_present": 0.2, "api_documented": 0.2, "prerequisites_clear": 0.0, "examples_runnable": 0.0, "error_guidance": 0.0, "contribution_path": 0.2}, "failure_classification": null, "drafts_generated": 1, "drafts_survived": 1}
{"id": "2a3a910b-82d4-4d7d-ac23-68398801329f", "target_id": "B5-control", "git_sha": "80533e37e47a7451213c869496434847ac15ab4e", "pre_experiment_sha": "40db4cfb39a006d86f0717875f1ab2194c72d536", "timestamp": "2026-04-19T11:51:37.106604+00:00", "hypothesis": "A compact but complete README with explicit quick start, prerequisites, CLI usage, runnable examples, troubleshooting, and contribution guidance will reduce incomplete-edit failures.", "hypothesis_source": "agent", "mutation_diff_summary": "", "score": 1.4, "score_ci_lower": 0.5, "score_ci_upper": 2.6, "raw_scores": [1.0, 0.0, 1.5, 1.0, 3.5], "baseline_score": 0.6, "outcome": "KEPT", "failure_mode": null, "duration_seconds": 74.51909387495834, "tags": ["readme", "documentation", "quickstart", "cli", "examples", "troubleshooting", "contributing"], "learnings": "{\"what_changed\":\"\",\"what_improved\":[],\"what_regressed\":[],\"transferable_insight\":\"Providing a concise but complete guide with clear setup, usage, examples, troubleshooting, and contribution steps reduces the chance of users making incomplete or incorrect changes.\",\"domain_tags\":[\"documentation\",\"usability\",\"process\"]}", "cost_usd": 0.12646175, "bootstrap_seed": 0, "agent_model": "gpt-5.4", "held_out_score": null, "criterion_names": ["quick_start_present", "api_documented", "prerequisites_clear", "examples_runnable", "error_guidance", "contribution_path"], "per_criterion_scores": {"quick_start_present": 0.4, "api_documented": 0.3, "prerequisites_clear": 0.1, "examples_runnable": 0.1, "error_guidance": 0.1, "contribution_path": 0.4}, "failure_classification": null, "drafts_generated": 1, "drafts_survived": 1}
{"id": "c90cbf1b-1190-4c2f-9173-3958f400fa74", "target_id": "B5-control", "git_sha": "57ecfbff5f0b732c15e48c656ec3b643bd2fb079", "pre_experiment_sha": "80533e37e47a7451213c869496434847ac15ab4e", "timestamp": "2026-04-19T11:52:44.323730+00:00", "hypothesis": "A shorter, fully finished README with explicit quick start, CLI usage, runnable examples, troubleshooting, and contribution steps will avoid incomplete-edit failures.", "hypothesis_source": "agent", "mutation_diff_summary": "", "score": 1.2, "score_ci_lower": 0.2, "score_ci_upper": 2.6, "raw_scores": [4.0, 0.0, 1.0, 1.0, 0.0], "baseline_score": 1.4, "outcome": "KEPT", "failure_mode": null, "duration_seconds": 62.48067295795772, "tags": ["readme", "documentation", "quickstart", "cli", "examples", "troubleshooting", "contributing"], "learnings": "{\"what_changed\":\"\",\"what_improved\":[\"contribution_path: PASS (was FAIL)\"],\"what_regressed\":[],\"transferable_insight\":\"A concise, fully completed guide that includes quick start, usage, examples, troubleshooting, and contribution steps reduces the risk of unfinished or broken edits.\",\"domain_tags\":[\"documentation\",\"workflow\",\"quality\"]}", "cost_usd": 0.08953495, "bootstrap_seed": 0, "agent_model": "gpt-5.4", "held_out_score": null, "criterion_names": ["quick_start_present", "api_documented", "prerequisites_clear", "examples_runnable", "error_guidance", "contribution_path"], "per_criterion_scores": {"quick_start_present": 0.2, "api_documented": 0.0, "prerequisites_clear": 0.1, "examples_runnable": 0.2, "error_guidance": 0.1, "contribution_path": 0.6}, "failure_classification": null, "drafts_generated": 1, "drafts_survived": 1}
{"id": "014cb1ef-90bc-4c50-88e3-949a117665a5", "target_id": "B5-control", "git_sha": "57ecfbff5f0b732c15e48c656ec3b643bd2fb079", "pre_experiment_sha": "57ecfbff5f0b732c15e48c656ec3b643bd2fb079", "timestamp": "2026-04-19T11:53:37.612531+00:00", "hypothesis": "A compact, fully completed README with explicit install steps, command syntax, runnable quick start, troubleshooting, and contribution guidance will improve binary completeness without introducing unsupported detail.", "hypothesis_source": "agent", "mutation_diff_summary": "", "score": 0.6, "score_ci_lower": 0.1, "score_ci_upper": 1.1, "raw_scores": [0.0, 1.0, 0.5, 1.5, 0.0], "baseline_score": 1.2, "outcome": "DISCARDED", "failure_mode": null, "duration_seconds": 52.25486970797647, "tags": ["readme", "documentation", "quickstart", "cli", "csv", "yaml", "troubleshooting", "contributing"], "learnings": "{\"what_changed\":\"\",\"what_improved\":[],\"what_regressed\":[\"contribution_path: FAIL (was PASS)\"],\"transferable_insight\":\"Adding more completeness to a guide can still reduce quality if it weakens a previously clear path for contributors, so preserve existing successful pathways while expanding documentation.\",\"domain_tags\":[\"documentation\",\"quality-assurance\",\"process-design\"]}", "cost_usd": 0.08551555000000001, "bootstrap_seed": 0, "agent_model": "gpt-5.4", "held_out_score": null, "criterion_names": ["quick_start_present", "api_documented", "prerequisites_clear", "examples_runnable", "error_guidance", "contribution_path"], "per_criterion_scores": {"quick_start_present": 0.0, "api_documented": 0.0, "prerequisites_clear": 0.0, "examples_runnable": 0.0, "error_guidance": 0.3, "contribution_path": 0.3}, "failure_classification": {"category": "logic_error", "description": "Failure mode is unspecified (\u201cunknown\u201d), and no concrete evidence is provided about what went wrong relative to the README-completeness hypothesis (e.g., formatting, syntax, scope, semantics, or incompleteness).", "fix_direction": "Provide the actual failed output (or diff) and the evaluation error/criterion that failed, then map the failure to a specific category (format/schema, parsing, scope, missing sections, or semantic mismatch).", "confidence": 0.1}, "drafts_generated": 1, "drafts_survived": 1}
{"id": "0c81f0d4-1410-4465-bd07-dcf6301aa5be", "target_id": "B5-control", "git_sha": "57ecfbff5f0b732c15e48c656ec3b643bd2fb079", "pre_experiment_sha": "57ecfbff5f0b732c15e48c656ec3b643bd2fb079", "timestamp": "2026-04-19T11:54:38.074345+00:00", "hypothesis": "A compact but fully self-contained README with explicit prerequisites, runnable quick start, CLI reference, troubleshooting, and contribution steps will improve binary completeness.", "hypothesis_source": "agent", "mutation_diff_summary": "", "score": 0.2, "score_ci_lower": 0.0, "score_ci_upper": 0.6, "raw_scores": [0.0, 0.0, 0.0, 1.0, 0.0], "baseline_score": 1.2, "outcome": "DISCARDED", "failure_mode": null, "duration_seconds": 57.350556250079535, "tags": ["readme", "documentation", "quickstart", "cli", "csv", "yaml", "troubleshooting", "contributing"], "learnings": "{\"what_changed\":\"\",\"what_improved\":[],\"what_regressed\":[],\"transferable_insight\":\"Adding more documentation does not improve outcomes unless it directly addresses the specific missing capability or user need that determines success.\",\"domain_tags\":[\"documentation\",\"product-design\",\"usability\"]}", "cost_usd": 0.09151555000000001, "bootstrap_seed": 0, "agent_model": "gpt-5.4", "held_out_score": null, "criterion_names": ["quick_start_present", "api_documented", "prerequisites_clear", "examples_runnable", "error_guidance", "contribution_path"], "per_criterion_scores": {"quick_start_present": 0.0, "api_documented": 0.0, "prerequisites_clear": 0.0, "examples_runnable": 0.0, "error_guidance": 0.0, "contribution_path": 0.2}, "failure_classification": {"category": "incomplete_edit", "description": "The experiment is classified as failing with an 'unknown' failure mode and a very low score (0.2000), suggesting the change was partial or left the README incompletely implemented (e.g., missing one or more required sections like prerequisites, quick start, CLI reference, troubleshooting, or contribution steps).", "fix_direction": "Ensure the README is fully self-contained and explicitly covers every required component end-to-end: prerequisites, runnable quick start, complete CLI reference, troubleshooting for common failures, and clear contribution/setup steps; validate by running the quick start and checking for internal consistency.", "confidence": 0.35}, "drafts_generated": 1, "drafts_survived": 1}
{"id": "7e918b0f-e4bc-4222-9b85-bf596e1a73fa", "target_id": "B5-control", "git_sha": "57ecfbff5f0b732c15e48c656ec3b643bd2fb079", "pre_experiment_sha": "57ecfbff5f0b732c15e48c656ec3b643bd2fb079", "timestamp": "2026-04-19T11:55:58.858396+00:00", "hypothesis": "A complete README with explicit prerequisites, runnable CSV/YAML examples, CLI contract, troubleshooting, and contribution steps will improve binary completeness.", "hypothesis_source": "agent", "mutation_diff_summary": "", "score": 0.2, "score_ci_lower": 0.0, "score_ci_upper": 0.6, "raw_scores": [1.0, 0.0, 0.0, 0.0, 0.0], "baseline_score": 1.2, "outcome": "DISCARDED", "failure_mode": null, "duration_seconds": 74.26364316698164, "tags": ["readme", "documentation", "quickstart", "cli", "csv", "yaml", "troubleshooting", "contributing"], "learnings": "{\"what_changed\":\"\",\"what_improved\":[],\"what_regressed\":[],\"transferable_insight\":\"Providing complete, explicit usage guidance and examples does not guarantee better end-to-end completeness if the underlying implementation or workflow is not already robust.\",\"domain_tags\":[\"documentation\",\"process-reliability\",\"usability\"]}", "cost_usd": 0.10059035000000001, "bootstrap_seed": 0, "agent_model": "gpt-5.4", "held_out_score": null, "criterion_names": ["quick_start_present", "api_documented", "prerequisites_clear", "examples_runnable", "error_guidance", "contribution_path"], "per_criterion_scores": {"quick_start_present": 0.2, "api_documented": 0.0, "prerequisites_clear": 0.0, "examples_runnable": 0.0, "error_guidance": 0.0, "contribution_path": 0.0}, "failure_classification": {"category": "incomplete_edit", "description": "The experiment is marked as failed with an 'unknown' failure mode and a low score (0.2000), suggesting the attempt did not fully implement the required README improvements (e.g., missing explicit prerequisites, runnable CSV/YAML examples, CLI contract, troubleshooting, or contribution steps), leaving an inconsistent or partial change.", "fix_direction": "Ensure the README update is complete end-to-end: add explicit prerequisites, include runnable CSV/YAML examples, document the exact CLI contract (arguments/options and expected outputs), provide troubleshooting steps, and add clear contribution instructions\u2014verifying internally that all referenced files/commands are consistent and valid.", "confidence": 0.42}, "drafts_generated": 1, "drafts_survived": 1}
{"id": "2dac7e8f-a8c2-4025-a8d5-e873eb75cab3", "target_id": "B5-control", "git_sha": "57ecfbff5f0b732c15e48c656ec3b643bd2fb079", "pre_experiment_sha": "57ecfbff5f0b732c15e48c656ec3b643bd2fb079", "timestamp": "2026-04-19T11:57:27.500027+00:00", "hypothesis": "A complete, self-contained README with explicit prerequisites, end-to-end examples, CLI contract, troubleshooting, and contributor workflow will improve binary documentation completeness.", "hypothesis_source": "agent", "mutation_diff_summary": "", "score": 0.3, "score_ci_lower": 0.0, "score_ci_upper": 0.7, "raw_scores": [1.0, 0.0, 0.5, 0.0, 0.0], "baseline_score": 1.2, "outcome": "DISCARDED", "failure_mode": null, "duration_seconds": 85.85962691705208, "tags": ["readme", "documentation", "quickstart", "cli", "examples", "troubleshooting", "contributing"], "learnings": "{\"what_changed\":\"\",\"what_improved\":[],\"what_regressed\":[],\"transferable_insight\":\"A comprehensive, self-contained guide only improves outcomes when it matches users\u2019 actual needs and usage patterns; otherwise, added detail may not translate into measurable value.\",\"domain_tags\":[\"documentation\",\"product-design\",\"usability\"]}", "cost_usd": 0.11439375, "bootstrap_seed": 0, "agent_model": "gpt-5.4", "held_out_score": null, "criterion_names": ["quick_start_present", "api_documented", "prerequisites_clear", "examples_runnable", "error_guidance", "contribution_path"], "per_criterion_scores": {"quick_start_present": 0.1, "api_documented": 0.0, "prerequisites_clear": 0.1, "examples_runnable": 0.0, "error_guidance": 0.0, "contribution_path": 0.1}, "failure_classification": {"category": "incomplete_edit", "description": "The experiment result appears to have failed without evidence of completing the intended README improvements (prerequisites, end-to-end examples, CLI contract, troubleshooting, and contributor workflow). The low score suggests the change likely produced a partial or inconsistent documentation update rather than a fully complete, self-contained README.", "fix_direction": "Ensure the README is fully self-contained: add explicit prerequisites, end-to-end usage examples, define the CLI contract clearly, include troubleshooting/FAQ, and document a contributor workflow; verify internal consistency and completeness against the hypothesis requirements.", "confidence": 0.62}, "drafts_generated": 1, "drafts_survived": 1}
