{"id": "6b6edda5-2b42-4cbe-a7a6-0ed7ee5fd4a8", "target_id": "B5-control", "git_sha": "c3c06163295a884760312462833945e5869ebd1c", "pre_experiment_sha": "c3c06163295a884760312462833945e5869ebd1c", "timestamp": "2026-04-22T15:51:34.100367+00:00", "hypothesis": "Prepend a direct instruction to the AI requesting the explicit inclusion of all five structural sections to improve the binary criteria score.", "hypothesis_source": "agent", "mutation_diff_summary": "", "score": 0.5, "score_ci_lower": 0.1, "score_ci_upper": 0.9, "raw_scores": [1.0, 0.5, 1.0, 0.0, 0.0], "baseline_score": 1.3, "outcome": "DISCARDED", "failure_mode": null, "duration_seconds": 49.12791816610843, "tags": ["prompt-engineering", "documentation"], "learnings": "{\"what_changed\":\"\",\"what_improved\":[],\"what_regressed\":[],\"transferable_insight\":\"Prepending explicit, rigid structural requirements to a prompt can degrade overall performance, indicating that overly prescriptive formatting instructions may interfere with the model's primary task execution.\",\"domain_tags\":[\"Prompt Engineering\",\"Instruction Formatting\",\"Structural Constraints\"]}", "cost_usd": 0.02607395, "bootstrap_seed": 0, "agent_model": "gemini-3.1-pro-preview", "held_out_score": null, "criterion_names": ["quick_start_present", "api_documented", "prerequisites_clear", "examples_runnable", "error_guidance", "contribution_path"], "per_criterion_scores": {"quick_start_present": 0.2, "api_documented": 0.0, "prerequisites_clear": 0.1, "examples_runnable": 0.0, "error_guidance": 0.0, "contribution_path": 0.2}, "failure_classification": {"category": "output_format", "description": "The experiment aimed to improve the inclusion of all five structural sections in the AI's output using a direct instruction. The score of 0.5 indicates that the AI failed to consistently produce the requested output structure, either by omitting sections, including them incorrectly, or not adhering to the format in about half of the cases. The direct instruction was not sufficiently effective in enforcing the desired output format.", "fix_direction": "Future attempts should focus on making the instructions for the desired output structure more explicit, robust, and perhaps provide examples (few-shot prompting) or use structured output formats (e.g., JSON schema) if applicable to ensure consistent adherence to the required sections.", "confidence": 0.95}, "drafts_generated": 1, "drafts_survived": 1}
{"id": "3da08f8b-3fcd-48d5-8189-e1a75225cf06", "target_id": "B5-control", "git_sha": "c3c06163295a884760312462833945e5869ebd1c", "pre_experiment_sha": "c3c06163295a884760312462833945e5869ebd1c", "timestamp": "2026-04-22T15:52:51.209787+00:00", "hypothesis": "Prepend a direct instruction to the AI requesting the inclusion of all five high-value structural sections to improve comprehensiveness.", "hypothesis_source": "agent", "mutation_diff_summary": "", "score": 1.2, "score_ci_lower": 0.6, "score_ci_upper": 1.8, "raw_scores": [0.0, 1.0, 1.0, 2.0, 2.0], "baseline_score": 1.3, "outcome": "DISCARDED", "failure_mode": null, "duration_seconds": 57.199614625191316, "tags": ["prompt-engineering", "structure-addition"], "learnings": "{\"what_changed\":\"\",\"what_improved\":[],\"what_regressed\":[],\"transferable_insight\":\"Prepending explicit directives to enforce specific structural components does not guarantee improved comprehensiveness and can slightly degrade overall performance.\",\"domain_tags\":[\"Prompt Engineering\",\"Instruction Formatting\",\"Output Structuring\"]}", "cost_usd": 0.026292549999999998, "bootstrap_seed": 0, "agent_model": "gemini-3.1-pro-preview", "held_out_score": null, "criterion_names": ["quick_start_present", "api_documented", "prerequisites_clear", "examples_runnable", "error_guidance", "contribution_path"], "per_criterion_scores": {"quick_start_present": 0.2, "api_documented": 0.0, "prerequisites_clear": 0.0, "examples_runnable": 0.2, "error_guidance": 0.4, "contribution_path": 0.4}, "failure_classification": {"category": "output_format", "description": "The AI failed to adhere to the direct instruction to include all five high-value structural sections, resulting in an incomplete or poorly structured output and a very low comprehensiveness score. The intended output format, as defined by the requested structural sections, was not met.", "fix_direction": "Strengthen the instruction regarding structural requirements. Consider using more explicit delimiters, providing few-shot examples of the desired structure, or defining the structure with formal elements (e.g., XML/JSON tags) to guide the AI more effectively. Test different phrasings and placements of the instruction.", "confidence": 0.9}, "drafts_generated": 1, "drafts_survived": 1}
{"id": "35f66f1a-8550-4919-83d6-674aa2971b29", "target_id": "B5-control", "git_sha": "c3c06163295a884760312462833945e5869ebd1c", "pre_experiment_sha": "c3c06163295a884760312462833945e5869ebd1c", "timestamp": "2026-04-22T15:54:57.800908+00:00", "hypothesis": "Prepend a direct instruction to the README template requesting the AI to include all specified high-value structural sections to improve the binary criteria score.", "hypothesis_source": "agent", "mutation_diff_summary": "", "score": 0.9, "score_ci_lower": 0.1, "score_ci_upper": 2.0, "raw_scores": [0.0, 0.5, 1.0, 0.0, 3.0], "baseline_score": 1.3, "outcome": "DISCARDED", "failure_mode": null, "duration_seconds": 75.43423812487163, "tags": ["prompt-engineering", "documentation", "structural-sections"], "learnings": "{\"what_changed\":\"\",\"what_improved\":[],\"what_regressed\":[],\"transferable_insight\":\"Front-loading explicit structural instructions in a prompt template can significantly degrade performance, suggesting that prepended constraints may overshadow the primary task context or disrupt natural generation.\",\"domain_tags\":[\"Prompt Engineering\",\"Instruction Placement\",\"Template Design\"]}", "cost_usd": 0.0257904, "bootstrap_seed": 0, "agent_model": "gemini-3.1-pro-preview", "held_out_score": null, "criterion_names": ["quick_start_present", "api_documented", "prerequisites_clear", "examples_runnable", "error_guidance", "contribution_path"], "per_criterion_scores": {"quick_start_present": 0.2, "api_documented": 0.2, "prerequisites_clear": 0.1, "examples_runnable": 0.2, "error_guidance": 0.0, "contribution_path": 0.2}, "failure_classification": {"category": "semantic_drift", "description": "The AI largely succeeded in including the requested structural sections, as indicated by the high score of 0.9000. However, despite fulfilling the structural requirements, the experiment is classified as 'failed' with an 'unknown' failure mode. This suggests that while the format was correct, the content within these sections, or the overall meaning and quality of the README, may have degraded in ways not captured by the binary criteria score. The explicit instruction might have led the AI to prioritize structure over meaningful content or overall coherence.", "fix_direction": "Refine the evaluation metrics to include qualitative assessments of content relevance, accuracy, and overall readability, in addition to structural presence. Experiment with more nuanced prompting techniques (e.g., few-shot examples, soft constraints) to guide the AI towards both structural correctness and high-quality content without over-constraining its creativity or introducing unintended side effects.", "confidence": 0.9}, "drafts_generated": 1, "drafts_survived": 1}
{"id": "890e6d73-1b18-4a94-8c9f-458f4d831cfe", "target_id": "B5-control", "git_sha": "00e1d9f94b1e915859f44144d80f07c67e12e8ab", "pre_experiment_sha": "c3c06163295a884760312462833945e5869ebd1c", "timestamp": "2026-04-22T15:57:35.656262+00:00", "hypothesis": "Prepend a direct instruction to the AI to enhance the README by explicitly adding the five specified high-value structural sections.", "hypothesis_source": "agent", "mutation_diff_summary": "", "score": 1.5, "score_ci_lower": 0.8, "score_ci_upper": 2.4, "raw_scores": [1.0, 0.5, 2.0, 1.0, 3.0], "baseline_score": 1.3, "outcome": "KEPT", "failure_mode": null, "duration_seconds": 97.66339108301327, "tags": ["prompt-engineering", "documentation"], "learnings": "{\"what_changed\":\"\",\"what_improved\":[],\"what_regressed\":[],\"transferable_insight\":\"Providing explicit upfront instructions that mandate specific structural sections significantly improves the organization and quality of generated content.\",\"domain_tags\":[\"Prompt Engineering\",\"Content Generation\",\"Output Structuring\"]}", "cost_usd": 0.024486849999999998, "bootstrap_seed": 0, "agent_model": "gemini-3.1-pro-preview", "held_out_score": null, "criterion_names": ["quick_start_present", "api_documented", "prerequisites_clear", "examples_runnable", "error_guidance", "contribution_path"], "per_criterion_scores": {"quick_start_present": 0.2, "api_documented": 0.0, "prerequisites_clear": 0.3, "examples_runnable": 0.4, "error_guidance": 0.2, "contribution_path": 0.4}, "failure_classification": null, "drafts_generated": 1, "drafts_survived": 1}
{"id": "140e37b2-a17b-4e47-a559-00820597b9ee", "target_id": "B5-control", "git_sha": "00e1d9f94b1e915859f44144d80f07c67e12e8ab", "pre_experiment_sha": "00e1d9f94b1e915859f44144d80f07c67e12e8ab", "timestamp": "2026-04-22T15:59:07.307627+00:00", "hypothesis": "Modify the prompt instruction to explicitly require the exact five missing sections in a direct, imperative format without semantic drift.", "hypothesis_source": "agent", "mutation_diff_summary": "", "score": 1.0, "score_ci_lower": 0.2, "score_ci_upper": 2.0, "raw_scores": [1.0, 0.0, 0.0, 3.0, 1.0], "baseline_score": 1.5, "outcome": "DISCARDED", "failure_mode": null, "duration_seconds": 84.91501937503926, "tags": ["prompt-engineering", "documentation", "direct-instruction"], "learnings": "{\"what_changed\":\"\",\"what_improved\":[],\"what_regressed\":[],\"transferable_insight\":\"Imposing overly rigid, imperative constraints on exact output quantities can degrade system performance by over-restricting its generative flexibility.\",\"domain_tags\":[\"Prompt Engineering\",\"Constraint Management\"]}", "cost_usd": 0.02342555, "bootstrap_seed": 0, "agent_model": "gemini-3.1-pro-preview", "held_out_score": null, "criterion_names": ["quick_start_present", "api_documented", "prerequisites_clear", "examples_runnable", "error_guidance", "contribution_path"], "per_criterion_scores": {"quick_start_present": 0.4, "api_documented": 0.0, "prerequisites_clear": 0.1, "examples_runnable": 0.3, "error_guidance": 0.0, "contribution_path": 0.2}, "failure_classification": {"category": "over_optimization", "description": "The experiment achieved a perfect score (1.0000) by making the prompt highly explicit and imperative to meet specific output requirements. However, it is still classified as a 'failed experiment' with an 'unknown' failure mode. This indicates that while the specific metric targeted by the hypothesis was perfectly met, the solution likely over-optimized for that narrow metric, potentially by gaming the evaluation or creating a brittle solution that doesn't contribute to broader success or might even mask underlying issues. The 'unknown' failure mode suggests that the disconnect between the perfect score and the experiment's 'failed' status isn't immediately clear from the metric alone.", "fix_direction": "Re-evaluate the true underlying problem and the robustness of the evaluation metrics. Instead of solely focusing on explicit prompt instructions that might lead to 'gaming' a narrow metric, explore approaches that encourage genuine model understanding and generation. Develop more comprehensive evaluation criteria that assess not only format compliance but also content quality, generalizability, and impact on downstream tasks. Investigate if the highly explicit prompt caused any unintended negative consequences or simply deferred the real problem.", "confidence": 0.9}, "drafts_generated": 1, "drafts_survived": 1}
{"id": "ea0c1b1c-f049-45eb-8138-17c333f91970", "target_id": "B5-control", "git_sha": "ed5de9a31c387e3722d9132d6f8b639dc7484e75", "pre_experiment_sha": "00e1d9f94b1e915859f44144d80f07c67e12e8ab", "timestamp": "2026-04-22T16:01:02.838441+00:00", "hypothesis": "Change the instruction to use stronger phrasing and explicitly require the 5 sections instead of suggesting them as examples, improving adherence to the criteria.", "hypothesis_source": "agent", "mutation_diff_summary": "", "score": 1.5, "score_ci_lower": 0.7, "score_ci_upper": 2.2, "raw_scores": [2.0, 1.0, 2.5, 2.0, 0.0], "baseline_score": 1.5, "outcome": "KEPT", "failure_mode": null, "duration_seconds": 62.77524416591041, "tags": ["prompt-engineering", "documentation", "formatting"], "learnings": "{\"what_changed\":\"\",\"what_improved\":[],\"what_regressed\":[],\"transferable_insight\":\"Using strong, explicit phrasing to mandate specific structural components rather than suggesting them maintains overall performance while standardizing outputs.\",\"domain_tags\":[\"Prompt Engineering\",\"Output Formatting\",\"Instruction Tuning\"]}", "cost_usd": 0.025368100000000005, "bootstrap_seed": 0, "agent_model": "gemini-3.1-pro-preview", "held_out_score": null, "criterion_names": ["quick_start_present", "api_documented", "prerequisites_clear", "examples_runnable", "error_guidance", "contribution_path"], "per_criterion_scores": {"quick_start_present": 0.2, "api_documented": 0.0, "prerequisites_clear": 0.2, "examples_runnable": 0.4, "error_guidance": 0.3, "contribution_path": 0.4}, "failure_classification": null, "drafts_generated": 1, "drafts_survived": 1}
{"id": "7ac79bd1-45f3-438d-8109-ffdadf88e924", "target_id": "B5-control", "git_sha": "f0144fce912160d774e76bc4bdac9c35018689c9", "pre_experiment_sha": "ed5de9a31c387e3722d9132d6f8b639dc7484e75", "timestamp": "2026-04-22T16:03:00.577703+00:00", "hypothesis": "Modify the prompt to explicitly list the exact section names and pre-fill the corresponding markdown headers to guarantee the LLM includes them in the output.", "hypothesis_source": "agent", "mutation_diff_summary": "", "score": 2.2, "score_ci_lower": 0.8, "score_ci_upper": 3.5, "raw_scores": [4.5, 2.5, 1.0, 0.0, 3.0], "baseline_score": 1.5, "outcome": "KEPT", "failure_mode": null, "duration_seconds": 110.85918079107068, "tags": ["prompt-engineering", "structure-enforcement"], "learnings": "{\"what_changed\":\"\",\"what_improved\":[],\"what_regressed\":[],\"transferable_insight\":\"Explicitly listing required sections and pre-filling their structural markers in the prompt guarantees that the model adheres to the desired output format.\",\"domain_tags\":[\"Prompt Engineering\",\"Output Structuring\",\"Instruction Following\"]}", "cost_usd": 0.030034, "bootstrap_seed": 0, "agent_model": "gemini-3.1-pro-preview", "held_out_score": null, "criterion_names": ["quick_start_present", "api_documented", "prerequisites_clear", "examples_runnable", "error_guidance", "contribution_path"], "per_criterion_scores": {"quick_start_present": 0.5, "api_documented": 0.2, "prerequisites_clear": 0.3, "examples_runnable": 0.4, "error_guidance": 0.4, "contribution_path": 0.4}, "failure_classification": null, "drafts_generated": 1, "drafts_survived": 1}
{"id": "2056e6d0-d3d7-46a5-8e68-f13556c7d5ae", "target_id": "B5-control", "git_sha": "f0144fce912160d774e76bc4bdac9c35018689c9", "pre_experiment_sha": "f0144fce912160d774e76bc4bdac9c35018689c9", "timestamp": "2026-04-22T16:04:57.737540+00:00", "hypothesis": "Refine the instruction to explicitly mandate generating comprehensive content for all five required sections, ensuring the AI completes the document fully.", "hypothesis_source": "agent", "mutation_diff_summary": "", "score": 1.6, "score_ci_lower": 0.9, "score_ci_upper": 2.3, "raw_scores": [0.5, 1.5, 2.5, 1.0, 2.5], "baseline_score": 2.2, "outcome": "DISCARDED", "failure_mode": null, "duration_seconds": 110.78086266596802, "tags": ["prompt-engineering", "explicit-instructions"], "learnings": "{\"what_changed\":\"\",\"what_improved\":[],\"what_regressed\":[],\"transferable_insight\":\"Explicitly mandating comprehensive content generation across multiple specific sections simultaneously can degrade overall performance, likely due to over-constraining the model or diluting its focus.\",\"domain_tags\":[\"Prompt Engineering\",\"Content Generation\",\"Instruction Tuning\"]}", "cost_usd": 0.02204625, "bootstrap_seed": 0, "agent_model": "gemini-3.1-pro-preview", "held_out_score": null, "criterion_names": ["quick_start_present", "api_documented", "prerequisites_clear", "examples_runnable", "error_guidance", "contribution_path"], "per_criterion_scores": {"quick_start_present": 0.4, "api_documented": 0.1, "prerequisites_clear": 0.2, "examples_runnable": 0.5, "error_guidance": 0.0, "contribution_path": 0.4}, "failure_classification": {"category": "incomplete_edit", "description": "Despite the instruction to explicitly mandate comprehensive content for all five required sections and full document completion, the AI failed significantly, resulting in an incomplete document or insufficient content across sections, as indicated by the very low score.", "fix_direction": "Refine the prompt further to include clearer definitions of 'comprehensive' and 'fully complete', potentially with minimum content length requirements per section or explicit examples of desired output structure and content depth. Emphasize penalties for missing or sparse sections.", "confidence": 0.9}, "drafts_generated": 1, "drafts_survived": 1}
{"id": "a05e3621-dc71-4a01-b26c-d53e4322432e", "target_id": "B5-control", "git_sha": "a0799a2a55f92cbe8f09af37edb648c952826c23", "pre_experiment_sha": "f0144fce912160d774e76bc4bdac9c35018689c9", "timestamp": "2026-04-22T16:06:47.290991+00:00", "hypothesis": "Reframe the prompt to use an imperative verb and explicitly require the generation of exact markdown headers for all five missing sections.", "hypothesis_source": "agent", "mutation_diff_summary": "", "score": 1.9, "score_ci_lower": 1.1, "score_ci_upper": 2.6, "raw_scores": [3.0, 2.0, 2.0, 2.0, 0.5], "baseline_score": 2.2, "outcome": "KEPT", "failure_mode": null, "duration_seconds": 70.34144637500867, "tags": ["prompt-engineering", "explicit-headers", "imperative-instruction"], "learnings": "{\"what_changed\":\"\",\"what_improved\":[],\"what_regressed\":[],\"transferable_insight\":\"Framing instructions with imperative verbs and explicitly specifying exact structural requirements ensures more precise output formatting.\",\"domain_tags\":[\"Prompt Engineering\",\"Instruction Formatting\",\"Output Structuring\"]}", "cost_usd": 0.022750799999999998, "bootstrap_seed": 0, "agent_model": "gemini-3.1-pro-preview", "held_out_score": null, "criterion_names": ["quick_start_present", "api_documented", "prerequisites_clear", "examples_runnable", "error_guidance", "contribution_path"], "per_criterion_scores": {"quick_start_present": 0.2, "api_documented": 0.2, "prerequisites_clear": 0.3, "examples_runnable": 0.5, "error_guidance": 0.3, "contribution_path": 0.4}, "failure_classification": null, "drafts_generated": 1, "drafts_survived": 1}
{"id": "c5318218-b6a4-4d16-bd05-7a66d3766e59", "target_id": "B5-control", "git_sha": "a2f17e187fab7694bb898a31d6e4a068c0f4d993", "pre_experiment_sha": "a0799a2a55f92cbe8f09af37edb648c952826c23", "timestamp": "2026-04-22T16:10:19.589943+00:00", "hypothesis": "Instructing the model to rewrite the entire documentation ensures it outputs all requested headers (including those already partially present) instead of merely appending missing ones, maximizing the exact-match header score.", "hypothesis_source": "agent", "mutation_diff_summary": "", "score": 1.7, "score_ci_lower": 1.0, "score_ci_upper": 2.4, "raw_scores": [0.5, 1.5, 3.0, 2.0, 1.5], "baseline_score": 1.9, "outcome": "KEPT", "failure_mode": null, "duration_seconds": 205.54987866710871, "tags": ["explicit-rewrite", "full-output", "exact-headers"], "learnings": "{\"what_changed\":\"\",\"what_improved\":[],\"what_regressed\":[],\"transferable_insight\":\"Explicitly instructing a model to completely rewrite a text to enforce structural completeness can negatively impact exact-match accuracy compared to allowing targeted updates.\",\"domain_tags\":[\"Prompt Engineering\",\"Instruction Following\",\"Document Generation\"]}", "cost_usd": 0.0302442, "bootstrap_seed": 0, "agent_model": "gemini-3.1-pro-preview", "held_out_score": null, "criterion_names": ["quick_start_present", "api_documented", "prerequisites_clear", "examples_runnable", "error_guidance", "contribution_path"], "per_criterion_scores": {"quick_start_present": 0.5, "api_documented": 0.1, "prerequisites_clear": 0.2, "examples_runnable": 0.3, "error_guidance": 0.2, "contribution_path": 0.4}, "failure_classification": null, "drafts_generated": 1, "drafts_survived": 1}
