{"id": "f6d481a3-2ded-48f3-b337-ba5bd6c1d63e", "target_id": "B5-control", "git_sha": "a639f0f7e615a726f12c839b0318b8a431aa4e17", "pre_experiment_sha": "a639f0f7e615a726f12c839b0318b8a431aa4e17", "timestamp": "2026-04-20T21:49:27.182656+00:00", "hypothesis": "Add minimal Usage and License sections while maintaining the existing file structure and code block formatting.", "hypothesis_source": "agent", "mutation_diff_summary": "", "score": 1.6, "score_ci_lower": 1.0, "score_ci_upper": 2.4, "raw_scores": [2.0, 1.0, 1.0, 3.0, 1.0], "baseline_score": 2.2, "outcome": "DISCARDED", "failure_mode": null, "duration_seconds": 60.76520312507637, "tags": ["documentation", "formatting", "sections"], "learnings": "{\"what_changed\":\"\",\"what_improved\":[],\"what_regressed\":[],\"transferable_insight\":\"Appending minimal, boilerplate sections to an existing document without providing substantial content degrades its overall value.\",\"domain_tags\":[\"Documentation\",\"Content Strategy\",\"Information Architecture\"]}", "cost_usd": 0.03482405, "bootstrap_seed": 0, "agent_model": "gemini-3.1-pro-preview", "held_out_score": null, "criterion_names": ["quick_start_present", "api_documented", "prerequisites_clear", "examples_runnable", "error_guidance", "contribution_path"], "per_criterion_scores": {"quick_start_present": 0.4, "api_documented": 0.0, "prerequisites_clear": 0.0, "examples_runnable": 0.2, "error_guidance": 0.4, "contribution_path": 0.6}, "failure_classification": {"category": "output_format", "description": "The experiment likely failed to correctly integrate the new Usage and License sections while maintaining the existing file structure and, specifically, the code block formatting. This could manifest as malformed new sections, incorrect placement, or unintended disruption of existing markdown elements and their formatting (e.g., breaking existing code blocks or rendering new ones incorrectly), leading to a violation of the expected output document structure or schema.", "fix_direction": "Focus on strict adherence to the existing document's formatting conventions, especially for markdown elements like headings, lists, and code blocks, when inserting new content. Ensure the generated content seamlessly integrates without introducing parsing errors, visual inconsistencies, or altering the formatting of unaffected parts of the document.", "confidence": 0.9}, "drafts_generated": 1, "drafts_survived": 1}
{"id": "925dad64-395c-4c4a-b93f-6bd28ed294f0", "target_id": "B5-control", "git_sha": "a639f0f7e615a726f12c839b0318b8a431aa4e17", "pre_experiment_sha": "a639f0f7e615a726f12c839b0318b8a431aa4e17", "timestamp": "2026-04-20T21:50:37.567570+00:00", "hypothesis": "Add minimal standard sections for Usage and License while preserving the existing content and code block formatting.", "hypothesis_source": "agent", "mutation_diff_summary": "", "score": 0.9, "score_ci_lower": 0.1, "score_ci_upper": 1.7, "raw_scores": [0.5, 0.0, 2.0, 2.0, 0.0], "baseline_score": 2.2, "outcome": "DISCARDED", "failure_mode": null, "duration_seconds": 50.044367499882355, "tags": ["documentation", "markdown", "formatting"], "learnings": "{\"what_changed\":\"\",\"what_improved\":[],\"what_regressed\":[],\"transferable_insight\":\"Appending generic boilerplate sections to a document degrades its quality by introducing unnecessary clutter without providing substantive value.\",\"domain_tags\":[\"Documentation\",\"Content Strategy\",\"Information Architecture\"]}", "cost_usd": 0.0250065, "bootstrap_seed": 0, "agent_model": "gemini-3.1-pro-preview", "held_out_score": null, "criterion_names": ["quick_start_present", "api_documented", "prerequisites_clear", "examples_runnable", "error_guidance", "contribution_path"], "per_criterion_scores": {"quick_start_present": 0.0, "api_documented": 0.0, "prerequisites_clear": 0.2, "examples_runnable": 0.1, "error_guidance": 0.2, "contribution_path": 0.4}, "failure_classification": {"category": "output_format", "description": "The experiment likely failed to perfectly preserve the existing code block formatting, as explicitly stated in the hypothesis, or the newly added Usage and License sections deviated subtly from the 'minimal standard' in their structural formatting (e.g., incorrect markdown headers, extra newlines, or inconsistent indentation). The high score suggests a minor, but detectable, formatting deviation rather than a complete structural failure.", "fix_direction": "Refine the generation logic to ensure exact character-level preservation of all existing content, especially code blocks. Implement stricter adherence to markdown and structural standards for the new Usage and License sections, possibly using templating or robust formatting validation checks.", "confidence": 0.85}, "drafts_generated": 1, "drafts_survived": 1}
{"id": "93f1575f-f13e-40a7-95bc-1bcfd5ba9b03", "target_id": "B5-control", "git_sha": "758d4de7a7af5f74998fa7de9562625dae6c29a8", "pre_experiment_sha": "a639f0f7e615a726f12c839b0318b8a431aa4e17", "timestamp": "2026-04-20T21:52:38.548461+00:00", "hypothesis": "Append minimal Usage and License sections to fulfill standard README criteria while preserving existing structure.", "hypothesis_source": "agent", "mutation_diff_summary": "", "score": 1.4, "score_ci_lower": 1.0, "score_ci_upper": 1.8, "raw_scores": [1.0, 2.0, 1.0, 2.0, 1.0], "baseline_score": 2.2, "outcome": "KEPT", "failure_mode": null, "duration_seconds": 59.492055292008445, "tags": ["readme", "documentation", "formatting"], "learnings": "{\"what_changed\":\"\",\"what_improved\":[],\"what_regressed\":[],\"transferable_insight\":\"Appending minimal required sections to fulfill standard structural criteria ensures completeness and compliance while preserving the existing core layout.\",\"domain_tags\":[\"Documentation\",\"Standardization\",\"Compliance\"]}", "cost_usd": 0.026420749999999996, "bootstrap_seed": 0, "agent_model": "gemini-3.1-pro-preview", "held_out_score": null, "criterion_names": ["quick_start_present", "api_documented", "prerequisites_clear", "examples_runnable", "error_guidance", "contribution_path"], "per_criterion_scores": {"quick_start_present": 0.3, "api_documented": 0.0, "prerequisites_clear": 0.2, "examples_runnable": 0.3, "error_guidance": 0.2, "contribution_path": 0.4}, "failure_classification": null, "drafts_generated": 1, "drafts_survived": 1}
{"id": "e74a4e85-2859-4144-9d9b-bdb0c6510b18", "target_id": "B5-control", "git_sha": "d2875812e207d9ad4e220592cc125b8eab3cc456", "pre_experiment_sha": "758d4de7a7af5f74998fa7de9562625dae6c29a8", "timestamp": "2026-04-20T21:53:53.577159+00:00", "hypothesis": "Fix the unclosed bash code block and append minimal Usage and License sections to improve the binary criteria score.", "hypothesis_source": "agent", "mutation_diff_summary": "", "score": 1.9, "score_ci_lower": 0.6, "score_ci_upper": 3.2, "raw_scores": [0.0, 3.5, 1.0, 4.0, 1.0], "baseline_score": 1.4, "outcome": "KEPT", "failure_mode": null, "duration_seconds": 67.78980641695671, "tags": ["markdown", "formatting", "sections"], "learnings": "{\"what_changed\":\"\",\"what_improved\":[],\"what_regressed\":[],\"transferable_insight\":\"Correcting structural formatting errors and appending standard, expected sections enhances the overall completeness and usability of a document.\",\"domain_tags\":[\"Documentation\",\"Formatting\",\"Quality Assurance\"]}", "cost_usd": 0.030765249999999997, "bootstrap_seed": 0, "agent_model": "gemini-3.1-pro-preview", "held_out_score": null, "criterion_names": ["quick_start_present", "api_documented", "prerequisites_clear", "examples_runnable", "error_guidance", "contribution_path"], "per_criterion_scores": {"quick_start_present": 0.6, "api_documented": 0.0, "prerequisites_clear": 0.2, "examples_runnable": 0.3, "error_guidance": 0.2, "contribution_path": 0.6}, "failure_classification": null, "drafts_generated": 1, "drafts_survived": 1}
