{"id": "a898fc78-dc66-4d04-84e4-dbb56b8efef7", "target_id": "B5-control", "git_sha": "2bf3e4aab7f8e9f270ae5fad71f9c8816eb91e6e", "pre_experiment_sha": "3ea4190702587fba3e4bcb706c515f4a21e11628", "timestamp": "2026-04-22T16:28:32.596428+00:00", "hypothesis": "Refine the system prompt to explicitly enforce closing all markdown code blocks and mandate meaningful content generation for the required sections to maximize evaluation criteria fulfillment.", "hypothesis_source": "agent", "mutation_diff_summary": "", "score": 1.6, "score_ci_lower": 1.0, "score_ci_upper": 2.4, "raw_scores": [3.0, 1.0, 2.0, 1.0, 1.0], "baseline_score": 1.5, "outcome": "KEPT", "failure_mode": null, "duration_seconds": 65.7368879581336, "tags": ["prompt-engineering", "technical-documentation", "markdown-formatting"], "learnings": "{\"what_changed\":\"\",\"what_improved\":[],\"what_regressed\":[],\"transferable_insight\":\"Explicitly enforcing structural completeness and mandating substantive content generation in system instructions improves output reliability and evaluation criteria fulfillment.\",\"domain_tags\":[\"Prompt Engineering\",\"Output Formatting\",\"Instruction Tuning\"]}", "cost_usd": 0.028261349999999998, "bootstrap_seed": 0, "agent_model": "gemini-3.1-pro-preview", "held_out_score": null, "criterion_names": ["quick_start_present", "api_documented", "prerequisites_clear", "examples_runnable", "error_guidance", "contribution_path"], "per_criterion_scores": {"quick_start_present": 0.4, "api_documented": 0.0, "prerequisites_clear": 0.0, "examples_runnable": 0.2, "error_guidance": 0.4, "contribution_path": 0.6}, "failure_classification": null, "drafts_generated": 1, "drafts_survived": 1}
{"id": "c9c1282b-5127-429e-aad1-e8ec4870f373", "target_id": "B5-control", "git_sha": "b9fa8ba62cb3f0d415773af205490f344c33c19a", "pre_experiment_sha": "2bf3e4aab7f8e9f270ae5fad71f9c8816eb91e6e", "timestamp": "2026-04-22T16:29:41.916138+00:00", "hypothesis": "Fixing the unclosed bash block in the provided source text and making the rewrite command more forceful and explicit will improve the binary criteria score.", "hypothesis_source": "agent", "mutation_diff_summary": "", "score": 1.6, "score_ci_lower": 0.2, "score_ci_upper": 3.0, "raw_scores": [4.0, 0.0, 1.0, 0.0, 3.0], "baseline_score": 1.6, "outcome": "KEPT", "failure_mode": null, "duration_seconds": 62.9437369578518, "tags": ["prompt-engineering", "strict-formatting", "forceful-instruction"], "learnings": "{\"what_changed\":\"\",\"what_improved\":[],\"what_regressed\":[],\"transferable_insight\":\"Correcting structural formatting errors and increasing the explicitness of instructions may yield neutral quantitative results while safely maintaining baseline performance.\",\"domain_tags\":[\"Prompt Engineering\",\"Formatting\",\"Instruction Tuning\"]}", "cost_usd": 0.02217865, "bootstrap_seed": 0, "agent_model": "gemini-3.1-pro-preview", "held_out_score": null, "criterion_names": ["quick_start_present", "api_documented", "prerequisites_clear", "examples_runnable", "error_guidance", "contribution_path"], "per_criterion_scores": {"quick_start_present": 0.4, "api_documented": 0.3, "prerequisites_clear": 0.0, "examples_runnable": 0.4, "error_guidance": 0.1, "contribution_path": 0.4}, "failure_classification": null, "drafts_generated": 1, "drafts_survived": 1}
{"id": "3d81c43f-ca3c-4ad5-9c7a-479a104f50e6", "target_id": "B5-control", "git_sha": "28567e3bda72abc4368cbf7ac1dbc71678eee5b8", "pre_experiment_sha": "b9fa8ba62cb3f0d415773af205490f344c33c19a", "timestamp": "2026-04-22T16:31:04.021150+00:00", "hypothesis": "Explicitly requesting the AI to include a Quick Start guide, API documentation, runnable examples, error guidance, and a contribution path will directly address the failing evaluation criteria while maintaining strict structural formatting.", "hypothesis_source": "agent", "mutation_diff_summary": "", "score": 1.8, "score_ci_lower": 0.8, "score_ci_upper": 2.8, "raw_scores": [2.0, 0.0, 2.0, 3.5, 1.5], "baseline_score": 1.6, "outcome": "KEPT", "failure_mode": null, "duration_seconds": 74.91491016699001, "tags": ["prompt-engineering", "documentation", "criteria-targeting", "formatting"], "learnings": "{\"what_changed\":\"\",\"what_improved\":[\"quick_start_present: PASS (was FAIL)\",\"examples_runnable: PASS (was FAIL)\"],\"what_regressed\":[],\"transferable_insight\":\"Explicitly enumerating required components in the prompt ensures the model includes them, directly satisfying completeness criteria without compromising the overall structure.\",\"domain_tags\":[\"prompt_engineering\",\"documentation\",\"technical_writing\"]}", "cost_usd": 0.03368295, "bootstrap_seed": 0, "agent_model": "gemini-3.1-pro-preview", "held_out_score": null, "criterion_names": ["quick_start_present", "api_documented", "prerequisites_clear", "examples_runnable", "error_guidance", "contribution_path"], "per_criterion_scores": {"quick_start_present": 0.7, "api_documented": 0.0, "prerequisites_clear": 0.0, "examples_runnable": 0.5, "error_guidance": 0.2, "contribution_path": 0.4}, "failure_classification": null, "drafts_generated": 1, "drafts_survived": 1}
{"id": "bb893b31-d981-45d8-8221-5a449eda288d", "target_id": "B5-control", "git_sha": "77b5ab87b6fda4010bd26d4c44ebbe56aba41997", "pre_experiment_sha": "28567e3bda72abc4368cbf7ac1dbc71678eee5b8", "timestamp": "2026-04-22T16:32:33.657948+00:00", "hypothesis": "Explicitly detailing the expected contents for API documentation, prerequisites, error guidance, and the contribution path will directly address failing evaluation criteria and boost the score.", "hypothesis_source": "agent", "mutation_diff_summary": "", "score": 1.5, "score_ci_lower": 0.6, "score_ci_upper": 2.2, "raw_scores": [1.0, 0.0, 2.5, 2.0, 2.0], "baseline_score": 1.8, "outcome": "KEPT", "failure_mode": null, "duration_seconds": 69.16816433309577, "tags": ["prompt-engineering", "documentation", "criteria-targeting", "formatting"], "learnings": "{\"what_changed\":\"\",\"what_improved\":[],\"what_regressed\":[\"quick_start_present: FAIL (was PASS)\",\"examples_runnable: FAIL (was PASS)\"],\"transferable_insight\":\"Introducing detailed requirements for new content areas can inadvertently displace existing functional components if the overall structure is not carefully balanced.\",\"domain_tags\":[\"Prompt Engineering\",\"Documentation\",\"Content Generation\"]}", "cost_usd": 0.0349947, "bootstrap_seed": 0, "agent_model": "gemini-3.1-pro-preview", "held_out_score": null, "criterion_names": ["quick_start_present", "api_documented", "prerequisites_clear", "examples_runnable", "error_guidance", "contribution_path"], "per_criterion_scores": {"quick_start_present": 0.4, "api_documented": 0.0, "prerequisites_clear": 0.0, "examples_runnable": 0.3, "error_guidance": 0.4, "contribution_path": 0.4}, "failure_classification": null, "drafts_generated": 1, "drafts_survived": 1}
{"id": "3136525b-8030-455b-8e69-eea12b4e68cf", "target_id": "B5-control", "git_sha": "77b5ab87b6fda4010bd26d4c44ebbe56aba41997", "pre_experiment_sha": "77b5ab87b6fda4010bd26d4c44ebbe56aba41997", "timestamp": "2026-04-22T16:34:07.478195+00:00", "hypothesis": "Streamline the content generation instructions into a single dense paragraph with parenthetical details to improve criteria fulfillment without distracting the model from the core structural requirements.", "hypothesis_source": "agent", "mutation_diff_summary": "", "score": 1.4, "score_ci_lower": 0.6, "score_ci_upper": 2.2, "raw_scores": [0.0, 1.0, 2.0, 1.0, 3.0], "baseline_score": 1.5, "outcome": "DISCARDED", "failure_mode": null, "duration_seconds": 86.0954881249927, "tags": ["prompt-engineering", "documentation", "formatting", "criteria-targeting"], "learnings": "{\"what_changed\":\"\",\"what_improved\":[],\"what_regressed\":[],\"transferable_insight\":\"Condensing complex instructions into a single dense paragraph with parenthetical details degrades performance, as models struggle to parse and prioritize densely packed constraints.\",\"domain_tags\":[\"Prompt Engineering\",\"Instruction Formatting\"]}", "cost_usd": 0.030006099999999997, "bootstrap_seed": 0, "agent_model": "gemini-3.1-pro-preview", "held_out_score": null, "criterion_names": ["quick_start_present", "api_documented", "prerequisites_clear", "examples_runnable", "error_guidance", "contribution_path"], "per_criterion_scores": {"quick_start_present": 0.2, "api_documented": 0.2, "prerequisites_clear": 0.0, "examples_runnable": 0.4, "error_guidance": 0.2, "contribution_path": 0.4}, "failure_classification": {"category": "output_format", "description": "The experiment's attempt to streamline content generation instructions into a single dense paragraph with parenthetical details likely overloaded the model's parsing capabilities. Critical instructions regarding the 'core structural requirements' of the output were probably obscured or entirely missed amidst the dense text and parenthetical notes. This led to a significant violation of the expected output structure or schema, which is often a primary cause for extremely low scores in content generation tasks.", "fix_direction": "Avoid dense, single-paragraph instructions. Instead, separate core structural requirements (e.g., output format, schema, sectioning) into distinct, clearly itemized instructions, preferably using bullet points or dedicated sections. Keep content generation criteria separate and clearly articulated, avoiding embedding them as parenthetical details within dense prose. Prioritize clarity and explicit instruction over conciseness when it comes to structural adherence.", "confidence": 0.9}, "drafts_generated": 1, "drafts_survived": 1}
{"id": "ed1a773e-7803-4d86-aefd-84c619fcb0ff", "target_id": "B5-control", "git_sha": "1659e0d2d0bd9cb4d31ca58a9c7ad5305ec77247", "pre_experiment_sha": "77b5ab87b6fda4010bd26d4c44ebbe56aba41997", "timestamp": "2026-04-22T16:35:48.250300+00:00", "hypothesis": "Explicitly instructing the model to create dedicated headers for the Quick Start, API Reference, and Contributing sections, while mapping the other requirements directly to the mandatory sections, will improve the fulfillment of all content criteria.", "hypothesis_source": "agent", "mutation_diff_summary": "", "score": 1.9, "score_ci_lower": 0.8, "score_ci_upper": 2.9, "raw_scores": [0.0, 3.5, 1.5, 2.0, 2.5], "baseline_score": 1.5, "outcome": "KEPT", "failure_mode": null, "duration_seconds": 64.02812220901251, "tags": ["prompt-engineering", "documentation", "criteria-targeting", "strict-formatting"], "learnings": "{\"what_changed\":\"\",\"what_improved\":[\"contribution_path: PASS (was FAIL)\"],\"what_regressed\":[],\"transferable_insight\":\"Explicitly instructing the model to use dedicated headers for required topics ensures those specific content criteria are reliably fulfilled and properly structured.\",\"domain_tags\":[\"Prompt Engineering\",\"Formatting\",\"Instruction Following\"]}", "cost_usd": 0.035468650000000004, "bootstrap_seed": 0, "agent_model": "gemini-3.1-pro-preview", "held_out_score": null, "criterion_names": ["quick_start_present", "api_documented", "prerequisites_clear", "examples_runnable", "error_guidance", "contribution_path"], "per_criterion_scores": {"quick_start_present": 0.3, "api_documented": 0.0, "prerequisites_clear": 0.2, "examples_runnable": 0.3, "error_guidance": 0.4, "contribution_path": 0.7}, "failure_classification": null, "drafts_generated": 1, "drafts_survived": 1}
{"id": "dd8fe816-1253-4889-ae5d-eb06a7a11d4c", "target_id": "B5-control", "git_sha": "1659e0d2d0bd9cb4d31ca58a9c7ad5305ec77247", "pre_experiment_sha": "1659e0d2d0bd9cb4d31ca58a9c7ad5305ec77247", "timestamp": "2026-04-22T16:37:28.451072+00:00", "hypothesis": "Restructuring the prompt to use clear bulleted lists that directly map the required content to specific headers will improve the model's ability to fulfill all criteria without missing any sections.", "hypothesis_source": "agent", "mutation_diff_summary": "", "score": 0.6, "score_ci_lower": 0.0, "score_ci_upper": 1.4, "raw_scores": [2.0, 0.0, 1.0, 0.0, 0.0], "baseline_score": 1.9, "outcome": "DISCARDED", "failure_mode": null, "duration_seconds": 71.12279150006361, "tags": ["prompt-engineering", "strict-formatting", "documentation", "criteria-targeting"], "learnings": "{\"what_changed\":\"\",\"what_improved\":[],\"what_regressed\":[\"contribution_path: FAIL (was PASS)\"],\"transferable_insight\":\"Imposing rigid formatting constraints, such as mapping bulleted lists directly to specific headers, can inadvertently cause AI models to omit required content sections.\",\"domain_tags\":[\"Prompt Engineering\",\"Formatting Constraints\",\"Instruction Following\"]}", "cost_usd": 0.0296335, "bootstrap_seed": 0, "agent_model": "gemini-3.1-pro-preview", "held_out_score": null, "criterion_names": ["quick_start_present", "api_documented", "prerequisites_clear", "examples_runnable", "error_guidance", "contribution_path"], "per_criterion_scores": {"quick_start_present": 0.2, "api_documented": 0.0, "prerequisites_clear": 0.0, "examples_runnable": 0.2, "error_guidance": 0.0, "contribution_path": 0.2}, "failure_classification": {"category": "output_format", "description": "The model failed to adhere to the specified output structure or fulfill all content criteria, despite the prompt restructuring aimed at improving these aspects. It likely still missed sections or provided incomplete content as per the hypothesis's objective.", "fix_direction": "Further refine prompt clarity regarding required sections and content, incorporate more specific examples, or consider fine-tuning/few-shot learning to reinforce the expected output structure and completeness.", "confidence": 0.9}, "drafts_generated": 1, "drafts_survived": 1}
{"id": "6894497d-5539-4dfe-98fb-72a4cc673010", "target_id": "B5-control", "git_sha": "1659e0d2d0bd9cb4d31ca58a9c7ad5305ec77247", "pre_experiment_sha": "1659e0d2d0bd9cb4d31ca58a9c7ad5305ec77247", "timestamp": "2026-04-22T16:38:58.525546+00:00", "hypothesis": "Restructuring the prompt into clear, separated lists for dedicated headers and mapped requirements will improve the model's comprehension and fulfillment of all content criteria.", "hypothesis_source": "agent", "mutation_diff_summary": "", "score": 1.5, "score_ci_lower": 0.9, "score_ci_upper": 2.1, "raw_scores": [2.0, 0.5, 1.5, 2.5, 1.0], "baseline_score": 1.9, "outcome": "DISCARDED", "failure_mode": null, "duration_seconds": 72.09040362481028, "tags": ["prompt-engineering", "formatting", "criteria-targeting", "documentation"], "learnings": "{\"what_changed\":\"\",\"what_improved\":[\"examples_runnable: PASS (was FAIL)\"],\"what_regressed\":[],\"transferable_insight\":\"Restructuring instructions into highly separated lists can improve adherence to specific constraints but may degrade overall performance by fragmenting context and disrupting holistic comprehension.\",\"domain_tags\":[\"Prompt Engineering\",\"Instruction Formatting\",\"Context Management\"]}", "cost_usd": 0.032903049999999996, "bootstrap_seed": 0, "agent_model": "gemini-3.1-pro-preview", "held_out_score": null, "criterion_names": ["quick_start_present", "api_documented", "prerequisites_clear", "examples_runnable", "error_guidance", "contribution_path"], "per_criterion_scores": {"quick_start_present": 0.2, "api_documented": 0.0, "prerequisites_clear": 0.1, "examples_runnable": 0.6, "error_guidance": 0.2, "contribution_path": 0.4}, "failure_classification": {"category": "semantic_drift", "description": "The restructured prompt, intended to improve the model's comprehension of content criteria, failed to prevent the output from semantically deviating from the requirements. The model likely misinterpreted the meaning, scope, or specific details of the mapped requirements, leading to content that did not correctly fulfill the prompt's intent, despite the prompt's structural clarity.", "fix_direction": "Focus on ensuring the intrinsic meaning and specific details of the content requirements are unequivocally clear, potentially by simplifying the language, providing concrete examples of desired output for each criterion, or breaking down complex requirements into smaller, more manageable parts. Consider if the model's capability to follow multi-faceted semantic instructions needs further fine-tuning or if the problem itself needs simplification for the model.", "confidence": 0.9}, "drafts_generated": 1, "drafts_survived": 1}
{"id": "243ffc66-8480-493f-a27d-f86adbc3e418", "target_id": "B5-control", "git_sha": "1659e0d2d0bd9cb4d31ca58a9c7ad5305ec77247", "pre_experiment_sha": "1659e0d2d0bd9cb4d31ca58a9c7ad5305ec77247", "timestamp": "2026-04-22T16:40:53.053129+00:00", "hypothesis": "Using a single, bold-prefixed bulleted list to map required content to specific headers will improve the model's ability to reliably generate all mandatory criteria without fragmenting its structural comprehension.", "hypothesis_source": "agent", "mutation_diff_summary": "", "score": 0.8, "score_ci_lower": 0.3, "score_ci_upper": 1.2, "raw_scores": [1.0, 1.0, 1.5, 0.5, 0.0], "baseline_score": 1.9, "outcome": "DISCARDED", "failure_mode": null, "duration_seconds": 78.46291212481447, "tags": ["prompt-engineering", "formatting", "criteria-targeting", "documentation"], "learnings": "{\"what_changed\":\"\",\"what_improved\":[],\"what_regressed\":[\"examples_runnable: FAIL (was PASS)\"],\"transferable_insight\":\"Over-consolidating complex structural and content requirements into a single list format can degrade a model's ability to maintain functional correctness in its outputs.\",\"domain_tags\":[\"Prompt Engineering\",\"Instruction Formatting\",\"Code Generation\"]}", "cost_usd": 0.0308689, "bootstrap_seed": 0, "agent_model": "gemini-3.1-pro-preview", "held_out_score": null, "criterion_names": ["quick_start_present", "api_documented", "prerequisites_clear", "examples_runnable", "error_guidance", "contribution_path"], "per_criterion_scores": {"quick_start_present": 0.2, "api_documented": 0.0, "prerequisites_clear": 0.3, "examples_runnable": 0.0, "error_guidance": 0.1, "contribution_path": 0.2}, "failure_classification": {"category": "output_format", "description": "The experiment tested a specific instruction format (bold-prefixed bulleted list for mapping content to headers) to improve output structure and completeness. The failure (score 0.8) indicates the model did not reliably adhere to this instruction format, resulting in fragmented structural comprehension. This could manifest as content not being correctly organized under the specified headers, inconsistent use of bolding or bullet points, or a general deviation from the intended output structure, thereby failing to generate all mandatory criteria in the expected format.", "fix_direction": "Clarify the instruction format with more precise definitions or explicit examples of the desired output structure. Consider simplifying the mapping syntax if it was overly complex. Emphasize strict adherence to content placement under specific headers and provide negative examples if misinterpretations were observed.", "confidence": 0.9}, "drafts_generated": 1, "drafts_survived": 1}
{"id": "3655d18d-caab-4f25-b13a-f3395d405c12", "target_id": "B5-control", "git_sha": "1659e0d2d0bd9cb4d31ca58a9c7ad5305ec77247", "pre_experiment_sha": "1659e0d2d0bd9cb4d31ca58a9c7ad5305ec77247", "timestamp": "2026-04-22T16:42:55.095996+00:00", "hypothesis": "Simplify the mapping of requirements to headers by using paragraph-based instructions instead of nested or fragmented lists, which previously degraded the model's structural comprehension and criteria fulfillment.", "hypothesis_source": "agent", "mutation_diff_summary": "", "score": 1.4, "score_ci_lower": 0.6, "score_ci_upper": 2.1, "raw_scores": [1.0, 2.0, 0.0, 2.5, 1.5], "baseline_score": 1.9, "outcome": "DISCARDED", "failure_mode": null, "duration_seconds": 64.04026487516239, "tags": ["prompt-engineering", "formatting", "criteria-targeting", "documentation"], "learnings": "{\"what_changed\":\"\",\"what_improved\":[\"contribution_path: PASS (was FAIL)\"],\"what_regressed\":[],\"transferable_insight\":\"Replacing structured lists with dense paragraph-based instructions degrades a model's ability to parse and fulfill complex mapping requirements.\",\"domain_tags\":[\"Prompt Engineering\",\"Instruction Formatting\",\"Information Architecture\"]}", "cost_usd": 0.034157150000000004, "bootstrap_seed": 0, "agent_model": "gemini-3.1-pro-preview", "held_out_score": null, "criterion_names": ["quick_start_present", "api_documented", "prerequisites_clear", "examples_runnable", "error_guidance", "contribution_path"], "per_criterion_scores": {"quick_start_present": 0.2, "api_documented": 0.0, "prerequisites_clear": 0.2, "examples_runnable": 0.4, "error_guidance": 0.0, "contribution_path": 0.6}, "failure_classification": {"category": "semantic_drift", "description": "The model failed to correctly interpret the intended structural relationships and mapping criteria from the new paragraph-based instructions. While the input (paragraph instructions) was syntactically valid, the implicit nature of the paragraph structure, compared to explicit lists, led to a degradation in the model's comprehension of how to fulfill the mapping task's meaning.", "fix_direction": "Experiment with clearer semantic cues within the paragraph instructions, such as explicit transition phrases, consistent terminology for requirements and headers, or using formatting (e.g., bolding, internal bullet points) to highlight key mapping rules. Focus on making the task's implicit structure more accessible to the model within a paragraph format.", "confidence": 0.9}, "drafts_generated": 1, "drafts_survived": 1}
