{"id": "c778520a-0d5d-4b72-8488-62bfcaed7b0c", "target_id": "B5-control", "git_sha": "a2f17e187fab7694bb898a31d6e4a068c0f4d993", "pre_experiment_sha": "a2f17e187fab7694bb898a31d6e4a068c0f4d993", "timestamp": "2026-04-22T16:11:29.269737+00:00", "hypothesis": "Modify the instruction at the top of the prompt to strictly require generating content for all five specified markdown headers to improve the binary criteria score.", "hypothesis_source": "agent", "mutation_diff_summary": "", "score": 0.9, "score_ci_lower": 0.4, "score_ci_upper": 1.3, "raw_scores": [1.0, 0.0, 1.0, 1.0, 1.5], "baseline_score": 1.7, "outcome": "DISCARDED", "failure_mode": null, "duration_seconds": 62.045251542003825, "tags": ["prompt-engineering", "documentation", "headers"], "learnings": "{\"what_changed\":\"\",\"what_improved\":[],\"what_regressed\":[],\"transferable_insight\":\"Strictly mandating the inclusion of all predefined structural elements can significantly degrade output quality, likely by forcing unnatural or irrelevant content generation.\",\"domain_tags\":[\"Prompt Engineering\",\"Structural Constraints\",\"Instruction Formatting\"]}", "cost_usd": 0.0182861, "bootstrap_seed": 0, "agent_model": "gemini-3.1-pro-preview", "held_out_score": null, "criterion_names": ["quick_start_present", "api_documented", "prerequisites_clear", "examples_runnable", "error_guidance", "contribution_path"], "per_criterion_scores": {"quick_start_present": 0.4, "api_documented": 0.0, "prerequisites_clear": 0.0, "examples_runnable": 0.1, "error_guidance": 0.0, "contribution_path": 0.4}, "failure_classification": {"category": "output_format", "description": "The experiment aimed to strictly enforce the generation of content for all five specified markdown headers. A score of 0.9000 indicates that 10% of the time, the model failed to adhere to this strict structural requirement, resulting in an output format violation where not all headers or their content were present as expected.", "fix_direction": "Strengthen the prompt's enforcement of the output structure. This could involve making the instruction even more explicit, providing few-shot examples of the desired output structure, or investigating specific input types that lead to the 10% failure rate to ensure consistent adherence to the five-header requirement.", "confidence": 0.95}, "drafts_generated": 1, "drafts_survived": 1}
{"id": "2b2d4414-6cbc-4ff1-9e37-a3f9b09c30ea", "target_id": "B5-control", "git_sha": "2d1986cdd143d27df5e3eb788e58723235637a4e", "pre_experiment_sha": "a2f17e187fab7694bb898a31d6e4a068c0f4d993", "timestamp": "2026-04-22T16:13:36.732326+00:00", "hypothesis": "Refine the prompt to explicitly instruct the AI to rewrite the documentation and fully populate the exact required markdown headers, removing previously hardcoded partial sections to force full generation.", "hypothesis_source": "agent", "mutation_diff_summary": "", "score": 1.4, "score_ci_lower": 0.2, "score_ci_upper": 3.0, "raw_scores": [0.0, 1.0, 4.5, 1.5, 0.0], "baseline_score": 1.7, "outcome": "KEPT", "failure_mode": null, "duration_seconds": 82.76335904095322, "tags": ["prompt-engineering", "explicit-headers", "documentation-rewrite"], "learnings": "{\"what_changed\":\"\",\"what_improved\":[],\"what_regressed\":[],\"transferable_insight\":\"Removing hardcoded partial templates and explicitly instructing the model to fully populate a required structure forces complete generation and prevents conflicts with boilerplate text.\",\"domain_tags\":[\"Prompt Engineering\",\"Template Optimization\",\"Content Generation\"]}", "cost_usd": 0.024337200000000003, "bootstrap_seed": 0, "agent_model": "gemini-3.1-pro-preview", "held_out_score": null, "criterion_names": ["quick_start_present", "api_documented", "prerequisites_clear", "examples_runnable", "error_guidance", "contribution_path"], "per_criterion_scores": {"quick_start_present": 0.2, "api_documented": 0.0, "prerequisites_clear": 0.4, "examples_runnable": 0.1, "error_guidance": 0.3, "contribution_path": 0.4}, "failure_classification": null, "drafts_generated": 1, "drafts_survived": 1}
{"id": "0f7806d5-3b63-4c6d-b571-01f360968960", "target_id": "B5-control", "git_sha": "1d73db9b9e5d2027e4532e7df202e71787a99d88", "pre_experiment_sha": "2d1986cdd143d27df5e3eb788e58723235637a4e", "timestamp": "2026-04-22T16:14:36.187588+00:00", "hypothesis": "Update the prompt instruction to explicitly demand rewriting the entire document with the required markdown headers for all missing sections.", "hypothesis_source": "agent", "mutation_diff_summary": "", "score": 1.1, "score_ci_lower": 0.4, "score_ci_upper": 1.7, "raw_scores": [0.0, 2.0, 1.5, 0.5, 1.5], "baseline_score": 1.4, "outcome": "KEPT", "failure_mode": null, "duration_seconds": 50.146624125074595, "tags": ["prompt-engineering", "documentation", "headers"], "learnings": "{\"what_changed\":\"\",\"what_improved\":[],\"what_regressed\":[],\"transferable_insight\":\"Explicitly instructing an AI to rewrite the entire output while enforcing specific structural formatting for missing sections ensures comprehensive and properly formatted responses.\",\"domain_tags\":[\"Prompt Engineering\",\"Output Formatting\",\"Document Generation\"]}", "cost_usd": 0.02545335, "bootstrap_seed": 0, "agent_model": "gemini-3.1-pro-preview", "held_out_score": null, "criterion_names": ["quick_start_present", "api_documented", "prerequisites_clear", "examples_runnable", "error_guidance", "contribution_path"], "per_criterion_scores": {"quick_start_present": 0.2, "api_documented": 0.0, "prerequisites_clear": 0.3, "examples_runnable": 0.1, "error_guidance": 0.2, "contribution_path": 0.3}, "failure_classification": null, "drafts_generated": 1, "drafts_survived": 1}
{"id": "fec17240-8651-4646-85b1-1cbad7381698", "target_id": "B5-control", "git_sha": "766323f6a83f4b4cc3b4c5092294302351849db5", "pre_experiment_sha": "1d73db9b9e5d2027e4532e7df202e71787a99d88", "timestamp": "2026-04-22T16:15:46.252236+00:00", "hypothesis": "Formatting the required markdown headers as a bulleted list will improve the AI's reliable generation of every requested section.", "hypothesis_source": "agent", "mutation_diff_summary": "", "score": 1.6, "score_ci_lower": 0.3, "score_ci_upper": 2.9, "raw_scores": [1.5, 0.0, 0.0, 3.5, 3.0], "baseline_score": 1.1, "outcome": "KEPT", "failure_mode": null, "duration_seconds": 62.98129391716793, "tags": ["formatting", "clarity", "bullet-points"], "learnings": "{\"what_changed\":\"\",\"what_improved\":[],\"what_regressed\":[],\"transferable_insight\":\"Structuring required output components as a bulleted list improves an AI's reliability in generating every requested section.\",\"domain_tags\":[\"Prompt Engineering\",\"Output Formatting\",\"Instruction Following\"]}", "cost_usd": 0.029247349999999995, "bootstrap_seed": 0, "agent_model": "gemini-3.1-pro-preview", "held_out_score": null, "criterion_names": ["quick_start_present", "api_documented", "prerequisites_clear", "examples_runnable", "error_guidance", "contribution_path"], "per_criterion_scores": {"quick_start_present": 0.4, "api_documented": 0.0, "prerequisites_clear": 0.0, "examples_runnable": 0.6, "error_guidance": 0.2, "contribution_path": 0.4}, "failure_classification": null, "drafts_generated": 1, "drafts_survived": 1}
{"id": "ba2dee44-56a3-4f0f-9de9-7b7b4f39d5cb", "target_id": "B5-control", "git_sha": "05e79ecb0bd09a78e4c3de566156af501ff4acd4", "pre_experiment_sha": "766323f6a83f4b4cc3b4c5092294302351849db5", "timestamp": "2026-04-22T16:17:00.155328+00:00", "hypothesis": "Update the prompt to explicitly define the exact markdown headers using backticks to ensure the model correctly generates all five required sections.", "hypothesis_source": "agent", "mutation_diff_summary": "", "score": 1.7, "score_ci_lower": 0.7, "score_ci_upper": 2.8, "raw_scores": [3.5, 0.0, 1.0, 1.5, 2.5], "baseline_score": 1.6, "outcome": "KEPT", "failure_mode": null, "duration_seconds": 52.93004279094748, "tags": ["prompt-engineering", "exact-headers"], "learnings": "{\"what_changed\":\"\",\"what_improved\":[],\"what_regressed\":[],\"transferable_insight\":\"Explicitly defining required structural elements using precise formatting markers, such as backticks, improves adherence to multi-section output constraints.\",\"domain_tags\":[\"Prompt Engineering\",\"Output Formatting\",\"Instruction Following\"]}", "cost_usd": 0.024584699999999998, "bootstrap_seed": 0, "agent_model": "gemini-3.1-pro-preview", "held_out_score": null, "criterion_names": ["quick_start_present", "api_documented", "prerequisites_clear", "examples_runnable", "error_guidance", "contribution_path"], "per_criterion_scores": {"quick_start_present": 0.4, "api_documented": 0.1, "prerequisites_clear": 0.1, "examples_runnable": 0.3, "error_guidance": 0.2, "contribution_path": 0.6}, "failure_classification": null, "drafts_generated": 1, "drafts_survived": 1}
{"id": "16c24c0d-427e-422b-8814-56f1b9161748", "target_id": "B5-control", "git_sha": "1d0c40f1e52e7ae3e3e2b1cbe854df316aba767e", "pre_experiment_sha": "05e79ecb0bd09a78e4c3de566156af501ff4acd4", "timestamp": "2026-04-22T16:18:23.615113+00:00", "hypothesis": "Make the instruction more forceful by using \"MUST explicitly include all 5 of the following sections\" and explicitly requesting to rewrite the entire document to seamlessly integrate the exact markdown headers.", "hypothesis_source": "agent", "mutation_diff_summary": "", "score": 2.1, "score_ci_lower": 1.5, "score_ci_upper": 2.6, "raw_scores": [3.0, 1.0, 2.0, 2.0, 2.5], "baseline_score": 1.7, "outcome": "KEPT", "failure_mode": null, "duration_seconds": 76.8288074999582, "tags": ["prompt-engineering", "strict-formatting"], "learnings": "{\"what_changed\":\"\",\"what_improved\":[],\"what_regressed\":[],\"transferable_insight\":\"Enforcing structural constraints using strong, capitalized imperatives and explicitly instructing a complete rewrite ensures strict adherence and seamless integration of required formatting elements.\",\"domain_tags\":[\"Prompt Engineering\",\"Constraint Satisfaction\",\"Formatting\"]}", "cost_usd": 0.027932550000000004, "bootstrap_seed": 0, "agent_model": "gemini-3.1-pro-preview", "held_out_score": null, "criterion_names": ["quick_start_present", "api_documented", "prerequisites_clear", "examples_runnable", "error_guidance", "contribution_path"], "per_criterion_scores": {"quick_start_present": 0.5, "api_documented": 0.1, "prerequisites_clear": 0.0, "examples_runnable": 0.5, "error_guidance": 0.4, "contribution_path": 0.6}, "failure_classification": null, "drafts_generated": 1, "drafts_survived": 1}
{"id": "a8f776a7-a328-4d3d-91f7-c22227222489", "target_id": "B5-control", "git_sha": "f874098ba49a32b1b52ef2246c7302fa5efe7be7", "pre_experiment_sha": "1d0c40f1e52e7ae3e3e2b1cbe854df316aba767e", "timestamp": "2026-04-22T16:19:22.368016+00:00", "hypothesis": "Remove vague instructions about populating content to strictly adhere to the negative constraints while enforcing the exact markdown headers for the five required sections.", "hypothesis_source": "agent", "mutation_diff_summary": "", "score": 1.3, "score_ci_lower": 0.6, "score_ci_upper": 2.0024999999999635, "raw_scores": [2.0, 1.0, 2.5, 1.0, 0.0], "baseline_score": 2.1, "outcome": "KEPT", "failure_mode": null, "duration_seconds": 51.54336095787585, "tags": ["prompt-engineering", "constraint-satisfaction"], "learnings": "{\"what_changed\":\"\",\"what_improved\":[],\"what_regressed\":[],\"transferable_insight\":\"Eliminating vague content instructions in favor of strict negative constraints and exact structural requirements ensures rigid adherence to formatting rules.\",\"domain_tags\":[\"Prompt Engineering\",\"Constraint Satisfaction\",\"Formatting\"]}", "cost_usd": 0.0203158, "bootstrap_seed": 0, "agent_model": "gemini-3.1-pro-preview", "held_out_score": null, "criterion_names": ["quick_start_present", "api_documented", "prerequisites_clear", "examples_runnable", "error_guidance", "contribution_path"], "per_criterion_scores": {"quick_start_present": 0.2, "api_documented": 0.0, "prerequisites_clear": 0.2, "examples_runnable": 0.3, "error_guidance": 0.2, "contribution_path": 0.4}, "failure_classification": null, "drafts_generated": 1, "drafts_survived": 1}
{"id": "91aed1c4-83df-4033-baa4-b6fe79af66b8", "target_id": "B5-control", "git_sha": "e6db708f388ceb4b1b27df7caf16afdc69dccd45", "pre_experiment_sha": "f874098ba49a32b1b52ef2246c7302fa5efe7be7", "timestamp": "2026-04-22T16:21:03.913223+00:00", "hypothesis": "Make the rewrite command more forceful and ensure exact markdown headers are requested without vague instructions.", "hypothesis_source": "agent", "mutation_diff_summary": "", "score": 1.6, "score_ci_lower": 0.8, "score_ci_upper": 2.5, "raw_scores": [3.0, 2.5, 1.0, 1.0, 0.5], "baseline_score": 1.3, "outcome": "KEPT", "failure_mode": null, "duration_seconds": 76.724924541777, "tags": ["prompt-engineering", "documentation", "strict-formatting"], "learnings": "{\"what_changed\":\"\",\"what_improved\":[],\"what_regressed\":[],\"transferable_insight\":\"Replacing vague guidelines with assertive directives and exact structural constraints significantly improves output compliance.\",\"domain_tags\":[\"Prompt Engineering\",\"Formatting\",\"Constraint Satisfaction\"]}", "cost_usd": 0.0273612, "bootstrap_seed": 0, "agent_model": "gemini-3.1-pro-preview", "held_out_score": null, "criterion_names": ["quick_start_present", "api_documented", "prerequisites_clear", "examples_runnable", "error_guidance", "contribution_path"], "per_criterion_scores": {"quick_start_present": 0.3, "api_documented": 0.1, "prerequisites_clear": 0.0, "examples_runnable": 0.4, "error_guidance": 0.0, "contribution_path": 0.8}, "failure_classification": null, "drafts_generated": 1, "drafts_survived": 1}
{"id": "5eeb1125-a36d-40cf-93fb-72af5a95ea0d", "target_id": "B5-control", "git_sha": "1be08a6c84d3e0d415eabd1a872bc578975d6384", "pre_experiment_sha": "e6db708f388ceb4b1b27df7caf16afdc69dccd45", "timestamp": "2026-04-22T16:22:18.033361+00:00", "hypothesis": "Fixing the missing closing backticks in the bash block and refining the imperative command will prevent parsing errors and ensure the model generates all required sections with the exact headers.", "hypothesis_source": "agent", "mutation_diff_summary": "", "score": 1.7, "score_ci_lower": 1.3, "score_ci_upper": 2.2, "raw_scores": [2.5, 1.5, 2.0, 1.0, 1.5], "baseline_score": 1.6, "outcome": "KEPT", "failure_mode": null, "duration_seconds": 67.95745199988596, "tags": ["prompt-engineering", "formatting-fix", "markdown"], "learnings": "{\"what_changed\":\"\",\"what_improved\":[],\"what_regressed\":[],\"transferable_insight\":\"Ensuring flawless syntax in prompts and using clear, imperative commands prevents parsing failures and enforces strict adherence to required output structures.\",\"domain_tags\":[\"Prompt Engineering\",\"Syntax Formatting\",\"Instruction Tuning\"]}", "cost_usd": 0.02351155, "bootstrap_seed": 0, "agent_model": "gemini-3.1-pro-preview", "held_out_score": null, "criterion_names": ["quick_start_present", "api_documented", "prerequisites_clear", "examples_runnable", "error_guidance", "contribution_path"], "per_criterion_scores": {"quick_start_present": 0.3, "api_documented": 0.1, "prerequisites_clear": 0.0, "examples_runnable": 0.1, "error_guidance": 0.6, "contribution_path": 0.6}, "failure_classification": null, "drafts_generated": 1, "drafts_survived": 1}
{"id": "9d0d392e-06ee-4a99-96db-4f05dff50193", "target_id": "B5-control", "git_sha": "695d7caef463adf3b59a85d3a3726ee63c98435b", "pre_experiment_sha": "1be08a6c84d3e0d415eabd1a872bc578975d6384", "timestamp": "2026-04-22T16:23:23.892963+00:00", "hypothesis": "Refine the instruction to be strictly forceful about rewriting the entire document with exact markdown headers while removing any vague content generation instructions.", "hypothesis_source": "agent", "mutation_diff_summary": "", "score": 1.5, "score_ci_lower": 0.6, "score_ci_upper": 2.4, "raw_scores": [3.0, 1.0, 2.0, 1.5, 0.0], "baseline_score": 1.7, "outcome": "KEPT", "failure_mode": null, "duration_seconds": 58.49989024992101, "tags": ["prompt-engineering", "strict-constraints", "header-matching"], "learnings": "{\"what_changed\":\"\",\"what_improved\":[],\"what_regressed\":[],\"transferable_insight\":\"Enforcing overly strict formatting constraints while removing flexible content generation instructions can negatively impact overall output quality.\",\"domain_tags\":[\"Prompt Engineering\",\"Instruction Tuning\",\"Formatting Constraints\"]}", "cost_usd": 0.0263106, "bootstrap_seed": 0, "agent_model": "gemini-3.1-pro-preview", "held_out_score": null, "criterion_names": ["quick_start_present", "api_documented", "prerequisites_clear", "examples_runnable", "error_guidance", "contribution_path"], "per_criterion_scores": {"quick_start_present": 0.3, "api_documented": 0.0, "prerequisites_clear": 0.1, "examples_runnable": 0.3, "error_guidance": 0.2, "contribution_path": 0.6}, "failure_classification": null, "drafts_generated": 1, "drafts_survived": 1}
{"id": "e963a2cf-4da1-4b06-b99f-68a86d06a092", "target_id": "B5-control", "git_sha": "8bbfe4f50420dd87e43bfbe6550723c234e55dd7", "pre_experiment_sha": "695d7caef463adf3b59a85d3a3726ee63c98435b", "timestamp": "2026-04-22T16:24:54.435224+00:00", "hypothesis": "Refine the instruction to enforce seamless integration of the required headers into a fully rewritten document without using vague completions.", "hypothesis_source": "agent", "mutation_diff_summary": "", "score": 1.2, "score_ci_lower": 0.5, "score_ci_upper": 1.9, "raw_scores": [0.0, 1.0, 1.0, 1.5, 2.5], "baseline_score": 1.5, "outcome": "KEPT", "failure_mode": null, "duration_seconds": 65.06912608398125, "tags": ["prompt-engineering", "documentation", "strict-formatting"], "learnings": "{\"what_changed\":\"\",\"what_improved\":[],\"what_regressed\":[],\"transferable_insight\":\"Explicitly mandating the seamless integration of required structural elements into a fully rewritten output prevents vague or partial completions.\",\"domain_tags\":[\"Prompt Engineering\",\"Output Formatting\",\"Instruction Refinement\"]}", "cost_usd": 0.01703985, "bootstrap_seed": 0, "agent_model": "gemini-3.1-pro-preview", "held_out_score": null, "criterion_names": ["quick_start_present", "api_documented", "prerequisites_clear", "examples_runnable", "error_guidance", "contribution_path"], "per_criterion_scores": {"quick_start_present": 0.2, "api_documented": 0.1, "prerequisites_clear": 0.0, "examples_runnable": 0.4, "error_guidance": 0.2, "contribution_path": 0.3}, "failure_classification": null, "drafts_generated": 1, "drafts_survived": 1}
{"id": "1f9f0ba6-8783-489d-bc4a-f3bbf8d3d1d1", "target_id": "B5-control", "git_sha": "3e195e5ffe30ff387454ed5d22d62b85177be15d", "pre_experiment_sha": "8bbfe4f50420dd87e43bfbe6550723c234e55dd7", "timestamp": "2026-04-22T16:26:02.061836+00:00", "hypothesis": "Strengthen the rewrite command and fix the unclosed markdown code block to ensure the model correctly outputs the exact headers and completes the documentation.", "hypothesis_source": "agent", "mutation_diff_summary": "", "score": 1.5, "score_ci_lower": 0.2, "score_ci_upper": 3.1, "raw_scores": [2.0, 0.0, 0.0, 4.5, 1.0], "baseline_score": 1.2, "outcome": "KEPT", "failure_mode": null, "duration_seconds": 61.63175708288327, "tags": ["prompt-engineering", "strict-formatting"], "learnings": "{\"what_changed\":\"\",\"what_improved\":[],\"what_regressed\":[],\"transferable_insight\":\"Ensuring well-formed syntax in prompts and using strong, explicit directives improves a model's adherence to structural requirements and output completeness.\",\"domain_tags\":[\"Prompt Engineering\",\"Instruction Following\",\"Formatting Constraints\"]}", "cost_usd": 0.02925365, "bootstrap_seed": 0, "agent_model": "gemini-3.1-pro-preview", "held_out_score": null, "criterion_names": ["quick_start_present", "api_documented", "prerequisites_clear", "examples_runnable", "error_guidance", "contribution_path"], "per_criterion_scores": {"quick_start_present": 0.5, "api_documented": 0.1, "prerequisites_clear": 0.1, "examples_runnable": 0.4, "error_guidance": 0.2, "contribution_path": 0.2}, "failure_classification": null, "drafts_generated": 1, "drafts_survived": 1}
{"id": "a8004626-8abe-4d49-af1b-883fe186f653", "target_id": "B5-control", "git_sha": "3ea4190702587fba3e4bcb706c515f4a21e11628", "pre_experiment_sha": "3e195e5ffe30ff387454ed5d22d62b85177be15d", "timestamp": "2026-04-22T16:27:04.261585+00:00", "hypothesis": "Refine the instruction to be slightly more direct and remove trailing whitespace in the code block.", "hypothesis_source": "agent", "mutation_diff_summary": "", "score": 1.5, "score_ci_lower": 0.6, "score_ci_upper": 2.4, "raw_scores": [3.0, 0.0, 1.5, 2.0, 1.0], "baseline_score": 1.5, "outcome": "KEPT", "failure_mode": null, "duration_seconds": 54.35221895808354, "tags": ["prompt-engineering", "strict-formatting"], "learnings": "{\"what_changed\":\"\",\"what_improved\":[],\"what_regressed\":[],\"transferable_insight\":\"Minor formatting cleanups and subtle adjustments to instruction directness often yield neutral results without significantly impacting overall performance.\",\"domain_tags\":[\"Prompt Engineering\",\"Formatting\"]}", "cost_usd": 0.0262377, "bootstrap_seed": 0, "agent_model": "gemini-3.1-pro-preview", "held_out_score": null, "criterion_names": ["quick_start_present", "api_documented", "prerequisites_clear", "examples_runnable", "error_guidance", "contribution_path"], "per_criterion_scores": {"quick_start_present": 0.4, "api_documented": 0.0, "prerequisites_clear": 0.0, "examples_runnable": 0.3, "error_guidance": 0.2, "contribution_path": 0.6}, "failure_classification": null, "drafts_generated": 1, "drafts_survived": 1}
