{"id": "0b77d693-39b9-4043-8b9b-bb8a26ab0a94", "target_id": "B5-control", "git_sha": "10b1c10a56686b0174d3b20b98dcfefeff64d918", "pre_experiment_sha": "10b1c10a56686b0174d3b20b98dcfefeff64d918", "timestamp": "2026-04-19T10:45:33.908233+00:00", "hypothesis": "A full technical rewrite with concrete CLI, pipeline, step, I/O, and troubleshooting details will improve binary documentation quality.", "hypothesis_source": "agent", "mutation_diff_summary": "", "score": 0.6, "score_ci_lower": 0.1, "score_ci_upper": 1.1, "raw_scores": [0.0, 1.0, 1.5, 0.0, 0.5], "baseline_score": 1.1, "outcome": "DISCARDED", "failure_mode": null, "duration_seconds": 85.67446091608144, "tags": ["readme", "technical-documentation", "cli", "yaml", "csv", "examples"], "learnings": "{\"what_changed\":\"\",\"what_improved\":[],\"what_regressed\":[],\"transferable_insight\":\"Adding more technical specificity does not guarantee better documentation quality if the rewrite fails to improve clarity, usefulness, or user outcomes.\",\"domain_tags\":[\"documentation\",\"technical-writing\",\"quality-assessment\"]}", "cost_usd": 0.10538495000000002, "bootstrap_seed": 0, "agent_model": "gpt-5.4", "held_out_score": null, "criterion_names": ["quick_start_present", "api_documented", "prerequisites_clear", "examples_runnable", "error_guidance", "contribution_path"], "per_criterion_scores": {"quick_start_present": 0.0, "api_documented": 0.1, "prerequisites_clear": 0.0, "examples_runnable": 0.0, "error_guidance": 0.3, "contribution_path": 0.2}, "failure_classification": {"category": "incomplete_edit", "description": "The experiment\u2019s outcome is not clearly described (Failure Mode is unknown) and the provided information is insufficient to identify a specific parsing/logic/format issue; the most likely situation is that the rewrite was partial or left an inconsistent state, preventing the expected documentation/CLI/pipeline improvements from being realized.", "fix_direction": "Ensure the rewrite is end-to-end and internally consistent: specify a concrete CLI interface, enumerate pipeline steps with exact inputs/outputs, add consistent error-handling/troubleshooting sections, and validate the result against acceptance criteria so there is no missing or mismatched component.", "confidence": 0.42}, "drafts_generated": 1, "drafts_survived": 1}
{"id": "940e5fb1-5660-4ea2-b369-0edd597b917e", "target_id": "B5-control", "git_sha": "c25d3a5363ccc11a51d0fa1f373aac1d56b071e0", "pre_experiment_sha": "10b1c10a56686b0174d3b20b98dcfefeff64d918", "timestamp": "2026-04-19T10:46:55.689881+00:00", "hypothesis": "A full technical rewrite with explicit workflow, CLI behavior, pipeline schema, examples, and operational notes will improve documentation completeness.", "hypothesis_source": "agent", "mutation_diff_summary": "", "score": 0.8, "score_ci_lower": 0.4, "score_ci_upper": 1.0, "raw_scores": [1.0, 1.0, 0.0, 1.0, 1.0], "baseline_score": 1.1, "outcome": "KEPT", "failure_mode": null, "duration_seconds": 75.82682887511328, "tags": ["readme", "technical-docs", "cli", "yaml", "csv"], "learnings": "{\"what_changed\":\"\",\"what_improved\":[],\"what_regressed\":[],\"transferable_insight\":\"Adding explicit structure and operational detail can improve documentation completeness even when no specific content changes are observed in the evaluation.\",\"domain_tags\":[\"documentation\",\"technical-writing\",\"process-design\"]}", "cost_usd": 0.08935035000000001, "bootstrap_seed": 0, "agent_model": "gpt-5.4", "held_out_score": null, "criterion_names": ["quick_start_present", "api_documented", "prerequisites_clear", "examples_runnable", "error_guidance", "contribution_path"], "per_criterion_scores": {"quick_start_present": 0.4, "api_documented": 0.0, "prerequisites_clear": 0.0, "examples_runnable": 0.0, "error_guidance": 0.3, "contribution_path": 0.1}, "failure_classification": null, "drafts_generated": 1, "drafts_survived": 1}
{"id": "76a131dc-30de-4c0b-8a6f-8d3ba76d9a97", "target_id": "B5-control", "git_sha": "6b97aa984067b8d6057a62c2eb7971082893995e", "pre_experiment_sha": "c25d3a5363ccc11a51d0fa1f373aac1d56b071e0", "timestamp": "2026-04-19T10:47:58.524595+00:00", "hypothesis": "A full technical rewrite with explicit workflow, pipeline semantics, operational notes, and faithful examples will improve documentation completeness.", "hypothesis_source": "agent", "mutation_diff_summary": "", "score": 1.5, "score_ci_lower": 0.4, "score_ci_upper": 2.8, "raw_scores": [0.0, 2.0, 1.0, 4.0, 0.5], "baseline_score": 0.8, "outcome": "KEPT", "failure_mode": null, "duration_seconds": 61.7353070829995, "tags": ["readme", "technical-documentation", "cli", "yaml", "csv"], "learnings": "{\"what_changed\":\"\",\"what_improved\":[],\"what_regressed\":[],\"transferable_insight\":\"Making a process explicit end-to-end, with clear steps, semantics, and concrete examples, tends to improve completeness without introducing regressions.\",\"domain_tags\":[\"documentation\",\"process-design\",\"technical-writing\"]}", "cost_usd": 0.09198375, "bootstrap_seed": 0, "agent_model": "gpt-5.4", "held_out_score": null, "criterion_names": ["quick_start_present", "api_documented", "prerequisites_clear", "examples_runnable", "error_guidance", "contribution_path"], "per_criterion_scores": {"quick_start_present": 0.2, "api_documented": 0.1, "prerequisites_clear": 0.4, "examples_runnable": 0.0, "error_guidance": 0.2, "contribution_path": 0.6}, "failure_classification": null, "drafts_generated": 1, "drafts_survived": 1}
{"id": "746fc5d1-3419-484a-bc9f-018407732dd2", "target_id": "B5-control", "git_sha": "b67325692a2bd124840abe77d0f314f23ff9c766", "pre_experiment_sha": "6b97aa984067b8d6057a62c2eb7971082893995e", "timestamp": "2026-04-19T10:49:18.871727+00:00", "hypothesis": "A full technical rewrite with explicit operational semantics, examples, constraints, and troubleshooting will improve documentation completeness and quality.", "hypothesis_source": "agent", "mutation_diff_summary": "", "score": 1.3, "score_ci_lower": 0.4, "score_ci_upper": 2.3, "raw_scores": [3.0, 2.0, 0.0, 1.0, 0.5], "baseline_score": 1.5, "outcome": "KEPT", "failure_mode": null, "duration_seconds": 79.3167024999857, "tags": ["readme", "technical-documentation", "cli", "yaml", "csv", "pipeline"], "learnings": "{\"what_changed\":\"\",\"what_improved\":[],\"what_regressed\":[],\"transferable_insight\":\"Making implicit behavior explicit through precise semantics, concrete examples, and troubleshooting guidance can improve documentation quality even when no specific content changes are individually measurable.\",\"domain_tags\":[\"documentation\",\"technical-writing\",\"knowledge-management\"]}", "cost_usd": 0.11593055000000001, "bootstrap_seed": 0, "agent_model": "gpt-5.4", "held_out_score": null, "criterion_names": ["quick_start_present", "api_documented", "prerequisites_clear", "examples_runnable", "error_guidance", "contribution_path"], "per_criterion_scores": {"quick_start_present": 0.5, "api_documented": 0.0, "prerequisites_clear": 0.2, "examples_runnable": 0.0, "error_guidance": 0.3, "contribution_path": 0.3}, "failure_classification": null, "drafts_generated": 1, "drafts_survived": 1}
{"id": "20363f5b-a205-43a7-ad7b-e8ee3eb254ce", "target_id": "B5-control", "git_sha": "3636b95534dc6ff5dd9960a7a69a3355eef5407f", "pre_experiment_sha": "b67325692a2bd124840abe77d0f314f23ff9c766", "timestamp": "2026-04-19T10:51:07.763678+00:00", "hypothesis": "Replace the sparse README with a complete technical reference that documents the CLI workflow, YAML pipeline model, I/O behavior, execution order, examples, and operational caveats.", "hypothesis_source": "agent", "mutation_diff_summary": "", "score": 0.7, "score_ci_lower": 0.3, "score_ci_upper": 1.0, "raw_scores": [0.0, 1.0, 0.5, 1.0, 1.0], "baseline_score": 1.3, "outcome": "KEPT", "failure_mode": null, "duration_seconds": 104.03749012493063, "tags": ["readme", "rewrite", "technical-docs", "cli", "yaml", "csv"], "learnings": "{\"what_changed\":\"\",\"what_improved\":[],\"what_regressed\":[],\"transferable_insight\":\"Replacing a sparse overview with a complete, behavior-focused reference can preserve utility by making system operation, constraints, and usage explicit without necessarily changing measured outcomes.\",\"domain_tags\":[\"documentation\",\"technical-writing\",\"usability\"]}", "cost_usd": 0.11981975, "bootstrap_seed": 0, "agent_model": "gpt-5.4", "held_out_score": null, "criterion_names": ["quick_start_present", "api_documented", "prerequisites_clear", "examples_runnable", "error_guidance", "contribution_path"], "per_criterion_scores": {"quick_start_present": 0.2, "api_documented": 0.0, "prerequisites_clear": 0.0, "examples_runnable": 0.0, "error_guidance": 0.4, "contribution_path": 0.1}, "failure_classification": null, "drafts_generated": 1, "drafts_survived": 1}
{"id": "69a87f39-ef80-4d0d-858e-8fb5ebde35f1", "target_id": "B5-control", "git_sha": "5a9ebb12417f671d5390e498fec75659df988b2d", "pre_experiment_sha": "3636b95534dc6ff5dd9960a7a69a3355eef5407f", "timestamp": "2026-04-19T10:52:42.923030+00:00", "hypothesis": "A complete end-to-end technical README with explicit workflow, interfaces, examples, and operational guidance will improve binary documentation quality.", "hypothesis_source": "agent", "mutation_diff_summary": "", "score": 0.9, "score_ci_lower": 0.2, "score_ci_upper": 1.7, "raw_scores": [0.0, 0.0, 1.0, 1.0, 2.5], "baseline_score": 0.7, "outcome": "KEPT", "failure_mode": null, "duration_seconds": 94.14738287508953, "tags": ["readme", "documentation", "technical-reference", "cli", "yaml", "csv"], "learnings": "{\"what_changed\":\"\",\"what_improved\":[],\"what_regressed\":[],\"transferable_insight\":\"Providing a complete end-to-end guide with explicit workflows, interfaces, examples, and operational guidance tends to improve documentation quality by making the system easier to understand and use correctly.\",\"domain_tags\":[\"documentation\",\"process-design\",\"usability\"]}", "cost_usd": 0.13135275000000002, "bootstrap_seed": 0, "agent_model": "gpt-5.4", "held_out_score": null, "criterion_names": ["quick_start_present", "api_documented", "prerequisites_clear", "examples_runnable", "error_guidance", "contribution_path"], "per_criterion_scores": {"quick_start_present": 0.2, "api_documented": 0.2, "prerequisites_clear": 0.1, "examples_runnable": 0.0, "error_guidance": 0.0, "contribution_path": 0.4}, "failure_classification": null, "drafts_generated": 1, "drafts_survived": 1}
{"id": "371556de-a692-43a1-b617-1e7aeb0de25a", "target_id": "B5-control", "git_sha": "971fb58b077568b0d121352855ff3e9e2b3a474e", "pre_experiment_sha": "5a9ebb12417f671d5390e498fec75659df988b2d", "timestamp": "2026-04-19T10:54:26.345255+00:00", "hypothesis": "A full rewrite with concrete CLI, pipeline, workflow, and troubleshooting details will improve completeness and binary documentation quality.", "hypothesis_source": "agent", "mutation_diff_summary": "", "score": 1.3, "score_ci_lower": 0.5, "score_ci_upper": 2.2, "raw_scores": [0.0, 3.0, 1.0, 1.5, 1.0], "baseline_score": 0.9, "outcome": "KEPT", "failure_mode": null, "duration_seconds": 102.32243008399382, "tags": ["readme", "technical-documentation", "cli", "yaml", "csv"], "learnings": "{\"what_changed\":\"\",\"what_improved\":[],\"what_regressed\":[],\"transferable_insight\":\"Providing concrete, end-to-end operational details rather than abstract guidance tends to improve the completeness and usefulness of documentation.\",\"domain_tags\":[\"documentation\",\"process-design\",\"communication\"]}", "cost_usd": 0.15826475, "bootstrap_seed": 0, "agent_model": "gpt-5.4", "held_out_score": null, "criterion_names": ["quick_start_present", "api_documented", "prerequisites_clear", "examples_runnable", "error_guidance", "contribution_path"], "per_criterion_scores": {"quick_start_present": 0.5, "api_documented": 0.0, "prerequisites_clear": 0.2, "examples_runnable": 0.0, "error_guidance": 0.2, "contribution_path": 0.4}, "failure_classification": null, "drafts_generated": 1, "drafts_survived": 1}
{"id": "7cc64afa-75ca-4f82-93d5-f6f9b66d27f2", "target_id": "B5-control", "git_sha": "971fb58b077568b0d121352855ff3e9e2b3a474e", "pre_experiment_sha": "971fb58b077568b0d121352855ff3e9e2b3a474e", "timestamp": "2026-04-19T10:56:19.137744+00:00", "hypothesis": "A complete, operationally specific README rewrite with concrete CLI conventions, pipeline schema, examples, and troubleshooting will improve binary documentation quality.", "hypothesis_source": "agent", "mutation_diff_summary": "", "score": 0.6, "score_ci_lower": 0.0, "score_ci_upper": 1.6, "raw_scores": [0.0, 0.0, 2.5, 0.0, 0.5], "baseline_score": 1.3, "outcome": "DISCARDED", "failure_mode": null, "duration_seconds": 107.97454833309166, "tags": ["readme", "rewrite", "technical-docs", "cli", "yaml", "csv"], "learnings": "{\"what_changed\":\"\",\"what_improved\":[],\"what_regressed\":[],\"transferable_insight\":\"Adding more operational detail and examples does not improve documentation if the rewrite lacks clear user value, alignment with actual needs, or measurable completeness.\",\"domain_tags\":[\"documentation\",\"usability\",\"technical-writing\"]}", "cost_usd": 0.16650655000000003, "bootstrap_seed": 0, "agent_model": "gpt-5.4", "held_out_score": null, "criterion_names": ["quick_start_present", "api_documented", "prerequisites_clear", "examples_runnable", "error_guidance", "contribution_path"], "per_criterion_scores": {"quick_start_present": 0.0, "api_documented": 0.1, "prerequisites_clear": 0.2, "examples_runnable": 0.1, "error_guidance": 0.0, "contribution_path": 0.2}, "failure_classification": {"category": "incomplete_edit", "description": "The experiment appears to have failed without producing a complete, operationally specific README rewrite\u2014likely leaving the documentation in a partial or inconsistent state relative to the required concrete CLI conventions, pipeline schema, examples, and troubleshooting.", "fix_direction": "Ensure the rewrite is end-to-end: provide fully specified CLI commands/flags, a coherent pipeline/schema section, working examples, and a dedicated troubleshooting section so the final README is complete and internally consistent.", "confidence": 0.62}, "drafts_generated": 1, "drafts_survived": 1}
{"id": "17a4a6cd-85e8-4d02-b65a-761851405d8c", "target_id": "B5-control", "git_sha": "356e84be382ea9db06a0051ec6f6159e875ed68c", "pre_experiment_sha": "971fb58b077568b0d121352855ff3e9e2b3a474e", "timestamp": "2026-04-19T10:58:25.854080+00:00", "hypothesis": "Rewrite the README into a complete, technically precise end-to-end reference with concrete workflow, schema, and operational guidance.", "hypothesis_source": "agent", "mutation_diff_summary": "", "score": 1.1, "score_ci_lower": 0.4, "score_ci_upper": 1.9, "raw_scores": [1.0, 0.0, 1.0, 1.0, 2.5], "baseline_score": 1.3, "outcome": "KEPT", "failure_mode": null, "duration_seconds": 124.31775216700044, "tags": ["readme", "technical-documentation", "cli", "yaml", "csv"], "learnings": "{\"what_changed\":\"\",\"what_improved\":[],\"what_regressed\":[],\"transferable_insight\":\"A rewrite is most effective when it converts high-level documentation into an end-to-end reference with explicit workflows, schemas, and operational guidance, but the added precision must be balanced against the risk of overcomplicating or diluting the original value.\",\"domain_tags\":[\"documentation\",\"technical-writing\",\"workflow-design\"]}", "cost_usd": 0.17036695000000002, "bootstrap_seed": 0, "agent_model": "gpt-5.4", "held_out_score": null, "criterion_names": ["quick_start_present", "api_documented", "prerequisites_clear", "examples_runnable", "error_guidance", "contribution_path"], "per_criterion_scores": {"quick_start_present": 0.3, "api_documented": 0.2, "prerequisites_clear": 0.0, "examples_runnable": 0.2, "error_guidance": 0.0, "contribution_path": 0.4}, "failure_classification": null, "drafts_generated": 1, "drafts_survived": 1}
{"id": "cc2fc7fd-a50e-4882-aad8-dd542a39fbe7", "target_id": "B5-control", "git_sha": "356e84be382ea9db06a0051ec6f6159e875ed68c", "pre_experiment_sha": "356e84be382ea9db06a0051ec6f6159e875ed68c", "timestamp": "2026-04-19T11:02:07.196995+00:00", "hypothesis": "A full end-to-end rewrite with concrete CLI, pipeline schema, workflow, and troubleshooting details will improve binary documentation completeness.", "hypothesis_source": "agent", "mutation_diff_summary": "", "score": 0.4, "score_ci_lower": 0.0, "score_ci_upper": 1.2, "raw_scores": [0.0, 0.0, 0.0, 2.0, 0.0], "baseline_score": 1.1, "outcome": "DISCARDED", "failure_mode": null, "duration_seconds": 121.62461575004272, "tags": ["readme", "documentation", "technical-reference", "cli", "yaml", "csv"], "learnings": "{\"what_changed\":\"\",\"what_improved\":[],\"what_regressed\":[],\"transferable_insight\":\"Adding concrete end-to-end implementation details can improve documentation completeness, but only if it is aligned with actual user needs and validated against real usage rather than assumed comprehensiveness.\",\"domain_tags\":[\"documentation\",\"process-design\",\"usability\"]}", "cost_usd": 0.16913495, "bootstrap_seed": 0, "agent_model": "gpt-5.4", "held_out_score": null, "criterion_names": ["quick_start_present", "api_documented", "prerequisites_clear", "examples_runnable", "error_guidance", "contribution_path"], "per_criterion_scores": {"quick_start_present": 0.0, "api_documented": 0.0, "prerequisites_clear": 0.0, "examples_runnable": 0.0, "error_guidance": 0.2, "contribution_path": 0.2}, "failure_classification": {"category": "incomplete_edit", "description": "The attempt appears to have an unfinished or partial end-to-end rewrite: key elements (e.g., CLI details, pipeline/schema, workflow, and troubleshooting specifics) did not fully carry through, leaving the deliverable in an inconsistent or incomplete state despite aiming for complete documentation.", "fix_direction": "Ensure every required end-to-end component is fully implemented and internally consistent (CLI -> pipeline schema -> workflow -> troubleshooting), with a completeness checklist and validation against the expected final structure/requirements.", "confidence": 0.42}, "drafts_generated": 1, "drafts_survived": 1}
{"id": "e4552e0c-7280-4120-9670-9c23e3b148cb", "target_id": "B5-control", "git_sha": "e893663bc1ad94a759f669f95866211f9abc9307", "pre_experiment_sha": "356e84be382ea9db06a0051ec6f6159e875ed68c", "timestamp": "2026-04-19T11:04:11.163737+00:00", "hypothesis": "A full, concrete technical rewrite with explicit workflow, schema examples, step semantics, and troubleshooting will improve binary documentation quality.", "hypothesis_source": "agent", "mutation_diff_summary": "", "score": 1.2, "score_ci_lower": 0.6, "score_ci_upper": 1.8, "raw_scores": [2.0, 0.5, 2.0, 0.5, 1.0], "baseline_score": 1.1, "outcome": "KEPT", "failure_mode": null, "duration_seconds": 121.09916004200932, "tags": ["readme", "documentation", "technical-reference", "cli", "yaml", "csv"], "learnings": "{\"what_changed\":\"\",\"what_improved\":[],\"what_regressed\":[],\"transferable_insight\":\"Concrete, step-by-step specifications with explicit examples and failure handling improve the clarity and usefulness of documentation.\",\"domain_tags\":[\"documentation\",\"technical-writing\",\"process-design\"]}", "cost_usd": 0.17844635000000003, "bootstrap_seed": 0, "agent_model": "gpt-5.4", "held_out_score": null, "criterion_names": ["quick_start_present", "api_documented", "prerequisites_clear", "examples_runnable", "error_guidance", "contribution_path"], "per_criterion_scores": {"quick_start_present": 0.2, "api_documented": 0.1, "prerequisites_clear": 0.3, "examples_runnable": 0.0, "error_guidance": 0.2, "contribution_path": 0.4}, "failure_classification": null, "drafts_generated": 1, "drafts_survived": 1}
{"id": "3fdfe0bb-e884-43de-b6de-0b4fe9c4b758", "target_id": "B5-control", "git_sha": "d2e777b80465966802dc3abd129e3c85ef383558", "pre_experiment_sha": "e893663bc1ad94a759f669f95866211f9abc9307", "timestamp": "2026-04-19T11:06:04.399229+00:00", "hypothesis": "A full, concrete technical rewrite with explicit CLI workflow, YAML schema, examples, and operational guidance will improve binary documentation quality.", "hypothesis_source": "agent", "mutation_diff_summary": "", "score": 0.4, "score_ci_lower": 0.0, "score_ci_upper": 1.2, "raw_scores": [0.0, 0.0, 0.0, 2.0, 0.0], "baseline_score": 1.2, "outcome": "KEPT", "failure_mode": null, "duration_seconds": 112.12164799997117, "tags": ["readme", "technical-docs", "cli", "yaml", "csv"], "learnings": "{\"what_changed\":\"\",\"what_improved\":[],\"what_regressed\":[],\"transferable_insight\":\"When a task requires precise execution, replacing vague guidance with a concrete, end-to-end workflow and explicit examples can improve clarity and reduce ambiguity even if no measurable content changes are observed.\",\"domain_tags\":[\"documentation\",\"technical-writing\",\"process-design\"]}", "cost_usd": 0.18171335, "bootstrap_seed": 0, "agent_model": "gpt-5.4", "held_out_score": null, "criterion_names": ["quick_start_present", "api_documented", "prerequisites_clear", "examples_runnable", "error_guidance", "contribution_path"], "per_criterion_scores": {"quick_start_present": 0.0, "api_documented": 0.0, "prerequisites_clear": 0.0, "examples_runnable": 0.0, "error_guidance": 0.2, "contribution_path": 0.2}, "failure_classification": null, "drafts_generated": 1, "drafts_survived": 1}
