{"id": "8bdbc3da-770f-4764-a779-2c4baa70cdee", "target_id": "B5-control", "git_sha": "7cd84199fcfee37315bfb7e45a870efc4d54551e", "pre_experiment_sha": "d2e777b80465966802dc3abd129e3c85ef383558", "timestamp": "2026-04-19T11:08:16.052450+00:00", "hypothesis": "A full, concrete rewrite with explicit CLI patterns, pipeline schema examples, execution semantics, and troubleshooting will improve documentation completeness.", "hypothesis_source": "agent", "mutation_diff_summary": "", "score": 0.4, "score_ci_lower": 0.0, "score_ci_upper": 1.0, "raw_scores": [0.0, 0.0, 0.5, 0.0, 1.5], "baseline_score": 0.4, "outcome": "KEPT", "failure_mode": null, "duration_seconds": 126.0139947499847, "tags": ["readme", "technical-docs", "cli", "yaml", "csv"], "learnings": "{\"what_changed\":\"\",\"what_improved\":[],\"what_regressed\":[],\"transferable_insight\":\"When a process is documented with concrete examples, explicit usage patterns, and clear execution rules, it becomes more complete and easier to apply consistently.\",\"domain_tags\":[\"documentation\",\"process-design\",\"usability\"]}", "cost_usd": 0.17565755000000002, "bootstrap_seed": 0, "agent_model": "gpt-5.4", "held_out_score": null, "criterion_names": ["quick_start_present", "api_documented", "prerequisites_clear", "examples_runnable", "error_guidance", "contribution_path"], "per_criterion_scores": {"quick_start_present": 0.2, "api_documented": 0.1, "prerequisites_clear": 0.0, "examples_runnable": 0.0, "error_guidance": 0.0, "contribution_path": 0.1}, "failure_classification": null, "drafts_generated": 1, "drafts_survived": 1}
{"id": "73d2eabd-ff1a-4949-b3a0-921d5a974024", "target_id": "B5-control", "git_sha": "04565eb21106699e330650261775298b340dd2c5", "pre_experiment_sha": "7cd84199fcfee37315bfb7e45a870efc4d54551e", "timestamp": "2026-04-19T11:13:31.237406+00:00", "hypothesis": "A full, concrete reference-style rewrite with explicit workflow, schema behavior, examples, and operational guidance will improve binary documentation completeness.", "hypothesis_source": "agent", "mutation_diff_summary": "", "score": 0.8, "score_ci_lower": 0.2, "score_ci_upper": 1.7, "raw_scores": [2.5, 0.5, 0.5, 0.5, 0.0], "baseline_score": 0.4, "outcome": "KEPT", "failure_mode": null, "duration_seconds": 118.16814370907377, "tags": ["readme", "documentation", "technical-reference", "cli", "yaml", "csv"], "learnings": "{\"what_changed\":\"\",\"what_improved\":[],\"what_regressed\":[],\"transferable_insight\":\"Making instructions fully concrete and reference-like, with explicit workflows, schema behavior, examples, and operational guidance, tends to improve documentation completeness.\",\"domain_tags\":[\"documentation\",\"process-design\",\"knowledge-management\"]}", "cost_usd": 0.17183635000000003, "bootstrap_seed": 0, "agent_model": "gpt-5.4", "held_out_score": null, "criterion_names": ["quick_start_present", "api_documented", "prerequisites_clear", "examples_runnable", "error_guidance", "contribution_path"], "per_criterion_scores": {"quick_start_present": 0.2, "api_documented": 0.0, "prerequisites_clear": 0.0, "examples_runnable": 0.1, "error_guidance": 0.1, "contribution_path": 0.4}, "failure_classification": null, "drafts_generated": 1, "drafts_survived": 1}
{"id": "68d566e3-c756-4115-8ff2-b55aed3e8031", "target_id": "B5-control", "git_sha": "1add4c06057c4162dbbdee336ce9bb9dd37bd994", "pre_experiment_sha": "04565eb21106699e330650261775298b340dd2c5", "timestamp": "2026-04-19T11:15:51.838979+00:00", "hypothesis": "A complete, operational README rewrite with explicit CLI contracts, pipeline schema examples, and troubleshooting will improve binary documentation quality.", "hypothesis_source": "agent", "mutation_diff_summary": "", "score": 1.3, "score_ci_lower": 0.4, "score_ci_upper": 2.3, "raw_scores": [2.0, 3.0, 1.0, 0.0, 0.5], "baseline_score": 0.8, "outcome": "KEPT", "failure_mode": null, "duration_seconds": 139.46084429207258, "tags": ["readme", "documentation", "technical-reference", "cli", "yaml", "csv"], "learnings": "{\"what_changed\":\"\",\"what_improved\":[],\"what_regressed\":[],\"transferable_insight\":\"Making an interface fully explicit\u2014by documenting exact inputs, outputs, and failure cases\u2014tends to improve the quality and usability of technical artifacts.\",\"domain_tags\":[\"documentation\",\"usability\",\"process-design\"]}", "cost_usd": 0.19777234999999999, "bootstrap_seed": 0, "agent_model": "gpt-5.4", "held_out_score": null, "criterion_names": ["quick_start_present", "api_documented", "prerequisites_clear", "examples_runnable", "error_guidance", "contribution_path"], "per_criterion_scores": {"quick_start_present": 0.4, "api_documented": 0.3, "prerequisites_clear": 0.0, "examples_runnable": 0.1, "error_guidance": 0.2, "contribution_path": 0.3}, "failure_classification": null, "drafts_generated": 1, "drafts_survived": 1}
{"id": "23cb5251-e117-453c-8800-d7b55514a81c", "target_id": "B5-control", "git_sha": "ad7ab5ada8734c12f504ce126d08ef11ca3153c3", "pre_experiment_sha": "1add4c06057c4162dbbdee336ce9bb9dd37bd994", "timestamp": "2026-04-19T11:20:08.538653+00:00", "hypothesis": "A full, concrete rewrite with explicit workflow, schema behavior, examples, and operational guidance will improve binary documentation quality.", "hypothesis_source": "agent", "mutation_diff_summary": "", "score": 1.4, "score_ci_lower": 0.6, "score_ci_upper": 2.4, "raw_scores": [2.0, 1.0, 3.0, 1.0, 0.0], "baseline_score": 1.3, "outcome": "KEPT", "failure_mode": null, "duration_seconds": 148.00677395891398, "tags": ["readme", "technical-reference", "cli", "yaml", "csv", "end-to-end"], "learnings": "{\"what_changed\":\"\",\"what_improved\":[],\"what_regressed\":[],\"transferable_insight\":\"A concrete, end-to-end rewrite that specifies workflow, structure, examples, and operational details can improve documentation quality by reducing ambiguity and making intended behavior easier to follow.\",\"domain_tags\":[\"documentation\",\"communication\",\"process-design\"]}", "cost_usd": 0.21046195, "bootstrap_seed": 0, "agent_model": "gpt-5.4", "held_out_score": null, "criterion_names": ["quick_start_present", "api_documented", "prerequisites_clear", "examples_runnable", "error_guidance", "contribution_path"], "per_criterion_scores": {"quick_start_present": 0.4, "api_documented": 0.0, "prerequisites_clear": 0.2, "examples_runnable": 0.0, "error_guidance": 0.4, "contribution_path": 0.4}, "failure_classification": null, "drafts_generated": 1, "drafts_survived": 1}
{"id": "bfcc9fee-29b4-40f4-aac1-fa6de7bf7e93", "target_id": "B5-control", "git_sha": "ad7ab5ada8734c12f504ce126d08ef11ca3153c3", "pre_experiment_sha": "ad7ab5ada8734c12f504ce126d08ef11ca3153c3", "timestamp": "2026-04-19T11:22:20.820321+00:00", "hypothesis": "A full end-to-end rewrite with concrete workflow, pipeline semantics, file behavior, and troubleshooting will improve technical completeness and binary documentation quality.", "hypothesis_source": "agent", "mutation_diff_summary": "", "score": 0.5, "score_ci_lower": 0.0, "score_ci_upper": 1.3, "raw_scores": [2.0, 0.0, 0.0, 0.0, 0.5], "baseline_score": 1.4, "outcome": "DISCARDED", "failure_mode": null, "duration_seconds": 131.32313075009733, "tags": ["readme", "technical-reference", "cli", "documentation", "rewrite"], "learnings": "{\"what_changed\":\"\",\"what_improved\":[],\"what_regressed\":[],\"transferable_insight\":\"Adding concrete end-to-end workflow details and explicit operational semantics can improve documentation quality, but only if the rewrite remains accurate and materially useful rather than merely more verbose.\",\"domain_tags\":[\"documentation\",\"technical-writing\",\"process-design\"]}", "cost_usd": 0.20082775, "bootstrap_seed": 0, "agent_model": "gpt-5.4", "held_out_score": null, "criterion_names": ["quick_start_present", "api_documented", "prerequisites_clear", "examples_runnable", "error_guidance", "contribution_path"], "per_criterion_scores": {"quick_start_present": 0.2, "api_documented": 0.0, "prerequisites_clear": 0.3, "examples_runnable": 0.0, "error_guidance": 0.0, "contribution_path": 0.0}, "failure_classification": {"category": "incomplete_edit", "description": "The experiment appears to have not reached a fully coherent end-to-end rewrite; despite the stated goal (workflow/pipeline/file semantics/troubleshooting), the outcome is labeled as failure with an 'unknown' failure mode and only a mid score (0.5000), suggesting partial or inconsistent changes rather than a clean, correct, fully integrated implementation.", "fix_direction": "Ensure the rewrite is end-to-end and internally consistent: define explicit pipeline semantics, verify file I/O behavior against the spec, include complete troubleshooting paths, and run a full suite of validation checks to confirm no partial/contradictory components remain.", "confidence": 0.42}, "drafts_generated": 1, "drafts_survived": 1}
{"id": "dbbd1867-36c9-4811-a5c6-83fed4118303", "target_id": "B5-control", "git_sha": "ad7ab5ada8734c12f504ce126d08ef11ca3153c3", "pre_experiment_sha": "ad7ab5ada8734c12f504ce126d08ef11ca3153c3", "timestamp": "2026-04-19T11:24:48.380457+00:00", "hypothesis": "A full, structured technical reference with concrete pipeline semantics, I/O behavior, examples, and troubleshooting will improve documentation completeness and binary quality.", "hypothesis_source": "agent", "mutation_diff_summary": "", "score": 0.3, "score_ci_lower": 0.0, "score_ci_upper": 0.7, "raw_scores": [0.0, 0.0, 1.0, 0.5, 0.0], "baseline_score": 1.4, "outcome": "DISCARDED", "failure_mode": null, "duration_seconds": 144.98227987496648, "tags": ["readme", "documentation", "technical-reference", "cli", "yaml", "csv"], "learnings": "{\"what_changed\":\"\",\"what_improved\":[],\"what_regressed\":[],\"transferable_insight\":\"Adding more structure and concrete operational details does not guarantee better outcomes if the added complexity is not clearly aligned with user needs or measurable quality gains.\",\"domain_tags\":[\"documentation\",\"quality-assurance\",\"product-design\"]}", "cost_usd": 0.22897475000000006, "bootstrap_seed": 0, "agent_model": "gpt-5.4", "held_out_score": null, "criterion_names": ["quick_start_present", "api_documented", "prerequisites_clear", "examples_runnable", "error_guidance", "contribution_path"], "per_criterion_scores": {"quick_start_present": 0.0, "api_documented": 0.0, "prerequisites_clear": 0.0, "examples_runnable": 0.0, "error_guidance": 0.1, "contribution_path": 0.2}, "failure_classification": {"category": "incomplete_edit", "description": "The experiment did not reach the expected level of completeness/structure for the proposed technical reference; the resulting output appears partial or insufficient to satisfy the documentation and quality criteria implied by the hypothesis.", "fix_direction": "Ensure the write-up includes the full required sections (pipeline semantics, explicit I/O behavior, concrete examples, and troubleshooting) with consistent cross-references and complete coverage before finalizing.", "confidence": 0.62}, "drafts_generated": 1, "drafts_survived": 1}
{"id": "8686b58b-3bef-4e91-acf4-0be49270ba1f", "target_id": "B5-control", "git_sha": "4e2080477eac53794e5f1a0c0a28305eb6274c68", "pre_experiment_sha": "ad7ab5ada8734c12f504ce126d08ef11ca3153c3", "timestamp": "2026-04-19T11:27:00.343938+00:00", "hypothesis": "A full technical rewrite with concrete workflow, pipeline schema, step semantics, and troubleshooting will improve documentation completeness and binary quality.", "hypothesis_source": "agent", "mutation_diff_summary": "", "score": 1.3, "score_ci_lower": 0.4, "score_ci_upper": 2.5, "raw_scores": [1.5, 0.0, 3.5, 1.0, 0.5], "baseline_score": 1.4, "outcome": "KEPT", "failure_mode": null, "duration_seconds": 125.40788287506439, "tags": ["readme", "technical-reference", "cli", "documentation", "rewrite"], "learnings": "{\"what_changed\":\"\",\"what_improved\":[],\"what_regressed\":[],\"transferable_insight\":\"Adding concrete process details, explicit step definitions, and troubleshooting guidance can improve the completeness and reliability of a technical artifact, even when no specific subcomponent changes are individually notable.\",\"domain_tags\":[\"documentation\",\"process-design\",\"quality-assurance\"]}", "cost_usd": 0.19900995000000002, "bootstrap_seed": 0, "agent_model": "gpt-5.4", "held_out_score": null, "criterion_names": ["quick_start_present", "api_documented", "prerequisites_clear", "examples_runnable", "error_guidance", "contribution_path"], "per_criterion_scores": {"quick_start_present": 0.4, "api_documented": 0.2, "prerequisites_clear": 0.2, "examples_runnable": 0.0, "error_guidance": 0.2, "contribution_path": 0.3}, "failure_classification": null, "drafts_generated": 1, "drafts_survived": 1}
{"id": "6eb44aca-cdf7-4753-be2b-e83c5086fc54", "target_id": "B5-control", "git_sha": "075074d45bfafca2d862daf497b9652446ab3bd5", "pre_experiment_sha": "4e2080477eac53794e5f1a0c0a28305eb6274c68", "timestamp": "2026-04-19T11:29:12.929495+00:00", "hypothesis": "A full, structured rewrite with concrete operational guidance, examples, and explicit caveats will improve documentation completeness and binary quality.", "hypothesis_source": "agent", "mutation_diff_summary": "", "score": 0.7, "score_ci_lower": 0.0, "score_ci_upper": 1.5, "raw_scores": [2.0, 0.0, 0.0, 1.5, 0.0], "baseline_score": 1.3, "outcome": "KEPT", "failure_mode": null, "duration_seconds": 131.257800207939, "tags": ["readme", "technical-reference", "cli", "csv", "yaml", "documentation"], "learnings": "{\"what_changed\":\"\",\"what_improved\":[],\"what_regressed\":[],\"transferable_insight\":\"A more complete and structured rewrite with concrete examples and clear caveats can preserve the original outcome while improving the clarity and usability of the result.\",\"domain_tags\":[\"documentation\",\"communication\",\"process-improvement\"]}", "cost_usd": 0.20379055000000001, "bootstrap_seed": 0, "agent_model": "gpt-5.4", "held_out_score": null, "criterion_names": ["quick_start_present", "api_documented", "prerequisites_clear", "examples_runnable", "error_guidance", "contribution_path"], "per_criterion_scores": {"quick_start_present": 0.2, "api_documented": 0.0, "prerequisites_clear": 0.0, "examples_runnable": 0.0, "error_guidance": 0.1, "contribution_path": 0.4}, "failure_classification": null, "drafts_generated": 1, "drafts_survived": 1}
{"id": "5910173b-bcd8-450e-a472-2af9da2ba323", "target_id": "B5-control", "git_sha": "a3d14f32abb5b454a944c2a9664cf19706d0445c", "pre_experiment_sha": "075074d45bfafca2d862daf497b9652446ab3bd5", "timestamp": "2026-04-19T11:31:21.034915+00:00", "hypothesis": "A full end-to-end rewrite with concrete schema, step, CLI, workflow, and troubleshooting guidance will improve binary documentation completeness.", "hypothesis_source": "agent", "mutation_diff_summary": "", "score": 0.8, "score_ci_lower": 0.2, "score_ci_upper": 1.4, "raw_scores": [1.0, 0.0, 0.0, 1.0, 2.0], "baseline_score": 0.7, "outcome": "KEPT", "failure_mode": null, "duration_seconds": 126.62800408306066, "tags": ["readme", "technical-docs", "cli", "yaml", "csv"], "learnings": "{\"what_changed\":\"\",\"what_improved\":[],\"what_regressed\":[],\"transferable_insight\":\"Providing a complete, concrete end-to-end implementation guide with explicit schemas, steps, interfaces, and troubleshooting reduces ambiguity and improves the completeness of the resulting documentation.\",\"domain_tags\":[\"documentation\",\"process-design\",\"technical-writing\"]}", "cost_usd": 0.20872715000000003, "bootstrap_seed": 0, "agent_model": "gpt-5.4", "held_out_score": null, "criterion_names": ["quick_start_present", "api_documented", "prerequisites_clear", "examples_runnable", "error_guidance", "contribution_path"], "per_criterion_scores": {"quick_start_present": 0.3, "api_documented": 0.1, "prerequisites_clear": 0.2, "examples_runnable": 0.0, "error_guidance": 0.0, "contribution_path": 0.2}, "failure_classification": null, "drafts_generated": 1, "drafts_survived": 1}
{"id": "8136fab4-4ff7-4cf1-9279-54eca844d721", "target_id": "B5-control", "git_sha": "8103fc03614e5c204967c5b85ca62873ebcbe182", "pre_experiment_sha": "a3d14f32abb5b454a944c2a9664cf19706d0445c", "timestamp": "2026-04-19T11:33:56.831239+00:00", "hypothesis": "A full end-to-end rewrite with concrete pipeline schema, CLI patterns, examples, and failure guidance will improve binary documentation completeness.", "hypothesis_source": "agent", "mutation_diff_summary": "", "score": 1.2, "score_ci_lower": 0.1, "score_ci_upper": 2.5, "raw_scores": [2.0, 0.0, 0.5, 3.5, 0.0], "baseline_score": 0.8, "outcome": "KEPT", "failure_mode": null, "duration_seconds": 151.1947593750665, "tags": ["readme", "documentation", "technical-reference", "cli", "yaml", "csv"], "learnings": "{\"what_changed\":\"\",\"what_improved\":[],\"what_regressed\":[],\"transferable_insight\":\"Providing a concrete end-to-end structure with explicit interfaces, usage patterns, examples, and failure handling improves documentation completeness by reducing ambiguity and leaving fewer gaps for the reader to infer.\",\"domain_tags\":[\"documentation\",\"process-design\",\"communication\"]}", "cost_usd": 0.22998575000000002, "bootstrap_seed": 0, "agent_model": "gpt-5.4", "held_out_score": null, "criterion_names": ["quick_start_present", "api_documented", "prerequisites_clear", "examples_runnable", "error_guidance", "contribution_path"], "per_criterion_scores": {"quick_start_present": 0.2, "api_documented": 0.0, "prerequisites_clear": 0.3, "examples_runnable": 0.0, "error_guidance": 0.2, "contribution_path": 0.5}, "failure_classification": null, "drafts_generated": 1, "drafts_survived": 1}
{"id": "c5478c4e-9474-48a8-a48a-8cb0edeb0de2", "target_id": "B5-control", "git_sha": "8103fc03614e5c204967c5b85ca62873ebcbe182", "pre_experiment_sha": "8103fc03614e5c204967c5b85ca62873ebcbe182", "timestamp": "2026-04-19T11:36:26.137714+00:00", "hypothesis": "A complete, structured technical rewrite with concrete CLI, schema, workflow, and troubleshooting details will improve documentation quality.", "hypothesis_source": "agent", "mutation_diff_summary": "", "score": 0.4, "score_ci_lower": 0.0, "score_ci_upper": 1.0, "raw_scores": [0.0, 0.0, 0.5, 1.5, 0.0], "baseline_score": 1.2, "outcome": "DISCARDED", "failure_mode": null, "duration_seconds": 148.21398870798294, "tags": ["readme", "rewrite", "technical-reference", "cli", "yaml", "csv"], "learnings": "{\"what_changed\":\"\",\"what_improved\":[],\"what_regressed\":[],\"transferable_insight\":\"A comprehensive rewrite does not improve quality unless it adds clear, actionable value that addresses specific user needs or gaps.\",\"domain_tags\":[\"documentation\",\"technical-writing\",\"quality-improvement\"]}", "cost_usd": 0.23428855, "bootstrap_seed": 0, "agent_model": "gpt-5.4", "held_out_score": null, "criterion_names": ["quick_start_present", "api_documented", "prerequisites_clear", "examples_runnable", "error_guidance", "contribution_path"], "per_criterion_scores": {"quick_start_present": 0.0, "api_documented": 0.0, "prerequisites_clear": 0.0, "examples_runnable": 0.0, "error_guidance": 0.2, "contribution_path": 0.2}, "failure_classification": {"category": "incomplete_edit", "description": "The experiment did not achieve the intended complete, structured technical rewrite; it appears to be only partially applied, leaving the documentation in an inconsistent or incomplete state relative to the required structure.", "fix_direction": "Focus on completing the full documented CLI/schema/workflow/troubleshooting rewrite end-to-end, ensuring every required section is present and internally consistent before evaluating quality.", "confidence": 0.42}, "drafts_generated": 1, "drafts_survived": 1}
{"id": "551ce560-8567-4061-8525-04140cd95222", "target_id": "B5-control", "git_sha": "8103fc03614e5c204967c5b85ca62873ebcbe182", "pre_experiment_sha": "8103fc03614e5c204967c5b85ca62873ebcbe182", "timestamp": "2026-04-19T11:38:47.158551+00:00", "hypothesis": "A full top-to-bottom rewrite with concrete CLI, schema, workflow, and troubleshooting detail will improve technical completeness.", "hypothesis_source": "agent", "mutation_diff_summary": "", "score": 0.5, "score_ci_lower": 0.0, "score_ci_upper": 1.3, "raw_scores": [0.0, 0.0, 0.5, 2.0, 0.0], "baseline_score": 1.2, "outcome": "DISCARDED", "failure_mode": null, "duration_seconds": 138.62844345800113, "tags": ["readme", "documentation", "technical-reference", "cli", "yaml", "csv"], "learnings": "{\"what_changed\":\"\",\"what_improved\":[],\"what_regressed\":[],\"transferable_insight\":\"Adding more concrete implementation detail does not guarantee better outcomes if it is not aligned with the underlying goal or evaluation criteria.\",\"domain_tags\":[\"evaluation\",\"communication\"]}", "cost_usd": 0.22341635, "bootstrap_seed": 0, "agent_model": "gpt-5.4", "held_out_score": null, "criterion_names": ["quick_start_present", "api_documented", "prerequisites_clear", "examples_runnable", "error_guidance", "contribution_path"], "per_criterion_scores": {"quick_start_present": 0.0, "api_documented": 0.0, "prerequisites_clear": 0.0, "examples_runnable": 0.0, "error_guidance": 0.2, "contribution_path": 0.3}, "failure_classification": {"category": "incomplete_edit", "description": "The attempt appears to be a partial/full rewrite that did not successfully meet the required completeness criteria; the failure mode is unknown and the provided score is only mid-range, suggesting the rewrite left the output or specification in an inconsistent or unfinished state rather than a clear logic/format/syntax issue.", "fix_direction": "Ensure the rewrite is end-to-end consistent: fully specify the CLI, schema, workflow, and troubleshooting sections without omissions, and validate the final output against the required structure/schema before submission.", "confidence": 0.55}, "drafts_generated": 1, "drafts_survived": 1}
