{"id": "bcbcd52f-53bb-4674-a087-96aeb03415a0", "target_id": "B5-control", "git_sha": "930ae829ac0e62fc7c2c5870305ef17bf53e51e5", "pre_experiment_sha": "3b452d4d4a3bc0f302632065ef61cb2ba6a6552a", "timestamp": "2026-04-19T10:32:15.553817+00:00", "hypothesis": "Adding explicit technical details, architecture, command reference, configuration semantics, error behavior, and examples will satisfy binary README quality criteria.", "hypothesis_source": "agent", "mutation_diff_summary": "", "score": 0.8, "score_ci_lower": 0.1, "score_ci_upper": 1.7, "raw_scores": [1.0, 0.0, 0.0, 2.5, 0.5], "baseline_score": 0.0, "outcome": "KEPT", "failure_mode": null, "duration_seconds": 61.792763708974235, "tags": ["readme", "technical-documentation", "cli", "architecture", "examples"], "learnings": "{\"what_changed\":\"\",\"what_improved\":[],\"what_regressed\":[],\"transferable_insight\":\"Making instructions more concrete by adding precise details, operational semantics, and examples can improve whether a document meets strict quality criteria.\",\"domain_tags\":[\"documentation\",\"quality-assurance\",\"technical-writing\"]}", "cost_usd": 0.07877515000000002, "bootstrap_seed": 0, "agent_model": "gpt-5.4", "held_out_score": null, "criterion_names": ["quick_start_present", "api_documented", "prerequisites_clear", "examples_runnable", "error_guidance", "contribution_path"], "per_criterion_scores": {"quick_start_present": 0.3, "api_documented": 0.2, "prerequisites_clear": 0.0, "examples_runnable": 0.0, "error_guidance": 0.2, "contribution_path": 0.1}, "failure_classification": null, "drafts_generated": 1, "drafts_survived": 1}
{"id": "69abc571-bad6-4628-b33d-1d7865265e11", "target_id": "B5-control", "git_sha": "930ae829ac0e62fc7c2c5870305ef17bf53e51e5", "pre_experiment_sha": "930ae829ac0e62fc7c2c5870305ef17bf53e51e5", "timestamp": "2026-04-19T10:33:25.211398+00:00", "hypothesis": "Adding concrete technical details, CLI examples, configuration schema, and operational notes will satisfy more binary documentation criteria.", "hypothesis_source": "agent", "mutation_diff_summary": "", "score": 0.3, "score_ci_lower": 0.0, "score_ci_upper": 0.7, "raw_scores": [0.5, 0.0, 1.0, 0.0, 0.0], "baseline_score": 0.8, "outcome": "DISCARDED", "failure_mode": null, "duration_seconds": 48.45605300005991, "tags": ["readme", "technical-docs", "cli", "yaml", "examples"], "learnings": "{\"what_changed\":\"\",\"what_improved\":[],\"what_regressed\":[],\"transferable_insight\":\"Adding more concrete detail does not necessarily improve evaluation outcomes unless it directly addresses the specific criteria being assessed.\",\"domain_tags\":[\"documentation\",\"evaluation\",\"communication\"]}", "cost_usd": 0.053986950000000006, "bootstrap_seed": 0, "agent_model": "gpt-5.4", "held_out_score": null, "criterion_names": ["quick_start_present", "api_documented", "prerequisites_clear", "examples_runnable", "error_guidance", "contribution_path"], "per_criterion_scores": {"quick_start_present": 0.1, "api_documented": 0.0, "prerequisites_clear": 0.0, "examples_runnable": 0.0, "error_guidance": 0.0, "contribution_path": 0.2}, "failure_classification": {"category": "incomplete_edit", "description": "The attempt appears to have added some details to satisfy binary documentation criteria, but the result still failed overall (low score), indicating the change was partial/inconsistent with what the evaluator required. The failure mode is marked as unknown, suggesting missing or inconsistent required elements rather than a clear syntax/logic issue.", "fix_direction": "Identify the exact unmet binary criteria from the evaluation feedback, then ensure every required documentation element is present and consistent (e.g., required sections, exact schema fields, required CLI/config formats, and any operational notes expected by the rubric).", "confidence": 0.38}, "drafts_generated": 1, "drafts_survived": 1}
{"id": "ac811895-e39b-4f8f-9308-df9308d01c38", "target_id": "B5-control", "git_sha": "930ae829ac0e62fc7c2c5870305ef17bf53e51e5", "pre_experiment_sha": "930ae829ac0e62fc7c2c5870305ef17bf53e51e5", "timestamp": "2026-04-19T10:35:00.080615+00:00", "hypothesis": "A full technical README with architecture, pipeline schema, commands, options, examples, and failure semantics will satisfy more binary documentation criteria.", "hypothesis_source": "agent", "mutation_diff_summary": "", "score": 0.8, "score_ci_lower": 0.3, "score_ci_upper": 1.2, "raw_scores": [0.0, 0.5, 1.0, 1.0, 1.5], "baseline_score": 0.8, "outcome": "DISCARDED", "failure_mode": null, "duration_seconds": 89.23006549989805, "tags": ["readme", "documentation", "cli", "yaml", "examples", "technical-specificity"], "learnings": "{\"what_changed\":\"\",\"what_improved\":[],\"what_regressed\":[],\"transferable_insight\":\"Comprehensive, structured documentation that covers system design, usage, configuration, examples, and error behavior is more likely to satisfy evaluation criteria than a minimal or partial description.\",\"domain_tags\":[\"documentation\",\"technical-writing\",\"evaluation\"]}", "cost_usd": 0.10388415000000001, "bootstrap_seed": 0, "agent_model": "gpt-5.4", "held_out_score": null, "criterion_names": ["quick_start_present", "api_documented", "prerequisites_clear", "examples_runnable", "error_guidance", "contribution_path"], "per_criterion_scores": {"quick_start_present": 0.2, "api_documented": 0.0, "prerequisites_clear": 0.0, "examples_runnable": 0.1, "error_guidance": 0.1, "contribution_path": 0.4}, "failure_classification": {"category": "semantic_drift", "description": "The experiment claimed to improve binary documentation criteria via a full technical README, but the result was a failure with no clear linkage to the specific required documentation elements; this suggests the produced README content likely matched the expected format superficially yet did not satisfy the intended meaning/acceptance semantics of the evaluation.", "fix_direction": "Align the README content explicitly to the evaluator\u2019s required criteria (e.g., required sections, exact schema/field names, required command/error semantics), and validate against the acceptance tests/expected parsing rules for failure semantics rather than assuming coverage alone will meet the rubric.", "confidence": 0.55}, "drafts_generated": 1, "drafts_survived": 1}
{"id": "10909c90-2304-4078-87f4-b5441d26df83", "target_id": "B5-control", "git_sha": "930ae829ac0e62fc7c2c5870305ef17bf53e51e5", "pre_experiment_sha": "930ae829ac0e62fc7c2c5870305ef17bf53e51e5", "timestamp": "2026-04-19T10:36:30.918616+00:00", "hypothesis": "A comprehensive technical README with concrete pipeline syntax, CLI options, config semantics, behavior rules, and examples will improve documentation completeness.", "hypothesis_source": "agent", "mutation_diff_summary": "", "score": 0.5, "score_ci_lower": 0.0, "score_ci_upper": 1.1, "raw_scores": [0.0, 0.0, 1.5, 0.0, 1.0], "baseline_score": 0.8, "outcome": "DISCARDED", "failure_mode": null, "duration_seconds": 88.20676991692744, "tags": ["readme", "documentation", "cli", "yaml", "examples", "error-handling"], "learnings": "{\"what_changed\":\"\",\"what_improved\":[],\"what_regressed\":[],\"transferable_insight\":\"Adding more technical detail and examples does not necessarily improve documentation quality if the added content is not aligned with user needs or measurable completeness criteria.\",\"domain_tags\":[\"documentation\",\"technical-writing\",\"product-quality\"]}", "cost_usd": 0.10542815000000001, "bootstrap_seed": 0, "agent_model": "gpt-5.4", "held_out_score": null, "criterion_names": ["quick_start_present", "api_documented", "prerequisites_clear", "examples_runnable", "error_guidance", "contribution_path"], "per_criterion_scores": {"quick_start_present": 0.0, "api_documented": 0.0, "prerequisites_clear": 0.0, "examples_runnable": 0.0, "error_guidance": 0.1, "contribution_path": 0.4}, "failure_classification": {"category": "incomplete_edit", "description": "The experiment did not yield a clearly improved, complete technical README as hypothesized; the failure is effectively an incomplete or non-converged documentation change, leaving insufficient concrete details (syntax/CLI/config semantics/behavior rules/examples) to meet the completeness criterion.", "fix_direction": "Ensure the README edit is comprehensive and verifiable: include explicit pipeline syntax, all relevant CLI options with defaults/flags, clear config schema/semantics, deterministic behavior rules, and at least one end-to-end working example (copy/paste-ready).", "confidence": 0.62}, "drafts_generated": 1, "drafts_survived": 1}
{"id": "fa74eadf-7ea6-41b4-a9e7-daa8d9844760", "target_id": "B5-control", "git_sha": "930ae829ac0e62fc7c2c5870305ef17bf53e51e5", "pre_experiment_sha": "930ae829ac0e62fc7c2c5870305ef17bf53e51e5", "timestamp": "2026-04-19T10:37:50.396101+00:00", "hypothesis": "A full technical rewrite with concrete CLI, pipeline schema, operational behavior, and failure semantics will satisfy more documentation quality criteria.", "hypothesis_source": "agent", "mutation_diff_summary": "", "score": 1.0, "score_ci_lower": 0.0, "score_ci_upper": 2.4, "raw_scores": [0.0, 3.5, 1.5, 0.0, 0.0], "baseline_score": 0.8, "outcome": "DISCARDED", "failure_mode": null, "duration_seconds": 76.85444787505548, "tags": ["readme", "technical-docs", "cli", "configuration", "examples"], "learnings": "{\"what_changed\":\"\",\"what_improved\":[],\"what_regressed\":[],\"transferable_insight\":\"A detailed, implementation-level specification can improve documentation quality by making behavior, interfaces, and failure handling explicit, even if it does not always change the outcome.\",\"domain_tags\":[\"documentation\",\"technical-specification\",\"software-engineering\"]}", "cost_usd": 0.09656355000000001, "bootstrap_seed": 0, "agent_model": "gpt-5.4", "held_out_score": null, "criterion_names": ["quick_start_present", "api_documented", "prerequisites_clear", "examples_runnable", "error_guidance", "contribution_path"], "per_criterion_scores": {"quick_start_present": 0.1, "api_documented": 0.0, "prerequisites_clear": 0.2, "examples_runnable": 0.1, "error_guidance": 0.2, "contribution_path": 0.4}, "failure_classification": {"category": "incomplete_edit", "description": "The provided report contains only a hypothesis, an undefined/unknown failure mode, and a high score, but lacks concrete evidence of what specifically failed (e.g., missing CLI/pipeline/schema details, unclear failure semantics, or any parse/format/logic issues). This suggests the experiment did not produce a complete, checkable rewrite matching the expected criteria, leaving an inconsistent or unverifiable state.", "fix_direction": "Produce a fully concrete rewrite: define exact CLI commands/flags, specify the full pipeline schema, document operational behavior and failure semantics unambiguously, and include outputs in the required structure so the evaluator can validate them deterministically.", "confidence": 0.46}, "drafts_generated": 1, "drafts_survived": 1}
{"id": "cdf02513-372c-4790-b5d1-5528443e8a64", "target_id": "B5-control", "git_sha": "930ae829ac0e62fc7c2c5870305ef17bf53e51e5", "pre_experiment_sha": "930ae829ac0e62fc7c2c5870305ef17bf53e51e5", "timestamp": "2026-04-19T10:39:04.493439+00:00", "hypothesis": "A complete technical README with command syntax, pipeline schema, examples, and operational notes will improve documentation quality.", "hypothesis_source": "agent", "mutation_diff_summary": "", "score": 0.9, "score_ci_lower": 0.4, "score_ci_upper": 1.5, "raw_scores": [1.0, 0.0, 1.0, 0.5, 2.0], "baseline_score": 0.8, "outcome": "DISCARDED", "failure_mode": null, "duration_seconds": 69.12913658400066, "tags": ["readme", "documentation", "cli", "yaml", "csv"], "learnings": "{\"what_changed\":\"\",\"what_improved\":[],\"what_regressed\":[],\"transferable_insight\":\"A comprehensive, structured specification can improve clarity and usability, but its value must be validated against actual user needs and adoption rather than assumed.\",\"domain_tags\":[\"documentation\",\"product-design\",\"evaluation\"]}", "cost_usd": 0.09078795000000002, "bootstrap_seed": 0, "agent_model": "gpt-5.4", "held_out_score": null, "criterion_names": ["quick_start_present", "api_documented", "prerequisites_clear", "examples_runnable", "error_guidance", "contribution_path"], "per_criterion_scores": {"quick_start_present": 0.4, "api_documented": 0.2, "prerequisites_clear": 0.0, "examples_runnable": 0.0, "error_guidance": 0.0, "contribution_path": 0.3}, "failure_classification": {"category": "incomplete_edit", "description": "The experiment appears to have failed to produce a complete, fully consistent documentation deliverable (e.g., missing required README sections, command syntax, pipeline schema, examples, or operational notes), resulting in an incomplete or inconsistent documentation output rather than a parse/syntax or purely logical issue.", "fix_direction": "Ensure the README includes all required components end-to-end (syntax, schema, examples, operational notes) with internal consistency and no missing/partial sections.", "confidence": 0.62}, "drafts_generated": 1, "drafts_survived": 1}
{"id": "4ffec939-f1ef-4317-82df-ee8055f248ec", "target_id": "B5-control", "git_sha": "930ae829ac0e62fc7c2c5870305ef17bf53e51e5", "pre_experiment_sha": "930ae829ac0e62fc7c2c5870305ef17bf53e51e5", "timestamp": "2026-04-19T10:40:31.030749+00:00", "hypothesis": "Expand the README into a complete technical reference with concrete CLI, pipeline, configuration, workflow, and troubleshooting details.", "hypothesis_source": "agent", "mutation_diff_summary": "", "score": 2.0, "score_ci_lower": 0.7, "score_ci_upper": 3.3, "raw_scores": [2.5, 4.5, 1.0, 0.0, 2.0], "baseline_score": 0.8, "outcome": "DISCARDED", "failure_mode": null, "duration_seconds": 84.24977766594384, "tags": ["readme", "documentation", "cli", "yaml", "csv", "technical-reference"], "learnings": "{\"what_changed\":\"\",\"what_improved\":[],\"what_regressed\":[],\"transferable_insight\":\"A broad documentation expansion is only valuable if it adds concrete, actionable details that users can directly apply, not just more text or structure.\",\"domain_tags\":[\"documentation\",\"usability\",\"technical-writing\"]}", "cost_usd": 0.10749035, "bootstrap_seed": 0, "agent_model": "gpt-5.4", "held_out_score": null, "criterion_names": ["quick_start_present", "api_documented", "prerequisites_clear", "examples_runnable", "error_guidance", "contribution_path"], "per_criterion_scores": {"quick_start_present": 0.6, "api_documented": 0.0, "prerequisites_clear": 0.3, "examples_runnable": 0.3, "error_guidance": 0.2, "contribution_path": 0.6}, "failure_classification": {"category": "incomplete_edit", "description": "The attempt to expand the README into a full technical reference appears unfinished or left inconsistent, indicating only partial coverage of the required CLI, pipeline, configuration, workflow, and troubleshooting details rather than a complete, coherent reference.", "fix_direction": "Ensure the README is fully expanded end-to-end: add complete CLI examples, pipeline/pseudocode and execution steps, full configuration schema/options, end-to-end workflow walkthroughs, and a comprehensive troubleshooting section that matches the actual behavior.", "confidence": 0.68}, "drafts_generated": 1, "drafts_survived": 1}
{"id": "4db7cbe6-dbd9-4e52-a5a1-ffe26b1021e0", "target_id": "B5-control", "git_sha": "930ae829ac0e62fc7c2c5870305ef17bf53e51e5", "pre_experiment_sha": "930ae829ac0e62fc7c2c5870305ef17bf53e51e5", "timestamp": "2026-04-19T10:41:51.591932+00:00", "hypothesis": "Expand the README into a complete technical reference with architecture, pipeline schema, commands, examples, and operational details.", "hypothesis_source": "agent", "mutation_diff_summary": "", "score": 1.0, "score_ci_lower": 0.0, "score_ci_upper": 2.4, "raw_scores": [0.0, 1.5, 3.5, 0.0, 0.0], "baseline_score": 0.8, "outcome": "DISCARDED", "failure_mode": null, "duration_seconds": 78.20036716596223, "tags": ["readme", "documentation", "cli", "yaml", "csv", "technical-reference"], "learnings": "{\"what_changed\":\"\",\"what_improved\":[],\"what_regressed\":[],\"transferable_insight\":\"When a documentation task is too broad, the most useful improvement is to structure it into clear sections that cover system design, workflows, usage examples, and operational behavior.\",\"domain_tags\":[\"documentation\",\"technical-writing\",\"information-architecture\"]}", "cost_usd": 0.10158835000000001, "bootstrap_seed": 0, "agent_model": "gpt-5.4", "held_out_score": null, "criterion_names": ["quick_start_present", "api_documented", "prerequisites_clear", "examples_runnable", "error_guidance", "contribution_path"], "per_criterion_scores": {"quick_start_present": 0.4, "api_documented": 0.1, "prerequisites_clear": 0.2, "examples_runnable": 0.0, "error_guidance": 0.0, "contribution_path": 0.3}, "failure_classification": {"category": "logic_error", "description": "The failure mode is not specified (marked as 'unknown'), so the specific reason this experiment failed cannot be determined from the provided information.", "fix_direction": "Identify and report the concrete failure signal (e.g., parser error, schema mismatch, semantic difference, or scope/permission violation) and compare the generated README structure/contents against the required reference specification to pinpoint the discrepancy.", "confidence": 0.05}, "drafts_generated": 1, "drafts_survived": 1}
{"id": "682820b1-2f32-45c8-bf9c-8656657e56ff", "target_id": "B5-control", "git_sha": "930ae829ac0e62fc7c2c5870305ef17bf53e51e5", "pre_experiment_sha": "930ae829ac0e62fc7c2c5870305ef17bf53e51e5", "timestamp": "2026-04-19T10:42:55.345390+00:00", "hypothesis": "A full technical rewrite with explicit CLI, pipeline, configuration, behavior, and troubleshooting details will improve documentation completeness.", "hypothesis_source": "agent", "mutation_diff_summary": "", "score": 0.1, "score_ci_lower": 0.0, "score_ci_upper": 0.3, "raw_scores": [0.0, 0.0, 0.5, 0.0, 0.0], "baseline_score": 0.8, "outcome": "DISCARDED", "failure_mode": null, "duration_seconds": 58.52117708395235, "tags": ["readme", "documentation", "cli", "csv", "yaml", "technical-reference"], "learnings": "{\"what_changed\":\"\",\"what_improved\":[],\"what_regressed\":[],\"transferable_insight\":\"Adding more explicit technical detail does not necessarily improve documentation if it does not address the actual information needs or usability of the audience.\",\"domain_tags\":[\"documentation\",\"usability\"]}", "cost_usd": 0.07780255000000001, "bootstrap_seed": 0, "agent_model": "gpt-5.4", "held_out_score": null, "criterion_names": ["quick_start_present", "api_documented", "prerequisites_clear", "examples_runnable", "error_guidance", "contribution_path"], "per_criterion_scores": {"quick_start_present": 0.0, "api_documented": 0.0, "prerequisites_clear": 0.0, "examples_runnable": 0.0, "error_guidance": 0.0, "contribution_path": 0.1}, "failure_classification": {"category": "incomplete_edit", "description": "The experiment scored very low (0.1000) and the failure mode is unspecified/unknown, suggesting the rewrite did not result in a coherent, complete set of documentation changes (e.g., missing required CLI/pipeline/config/behavior/troubleshooting details) or left the doc set in an inconsistent state rather than a clearly identifiable format or logic issue.", "fix_direction": "Ensure the rewrite is end-to-end complete and internally consistent: explicitly document the CLI, pipeline, configuration, expected behavior, and troubleshooting in a consistent structure, with no missing sections or conflicting details.", "confidence": 0.42}, "drafts_generated": 1, "drafts_survived": 1}
{"id": "a21f4a3c-f46e-462b-8c99-018f60c6bbcd", "target_id": "B5-control", "git_sha": "10b1c10a56686b0174d3b20b98dcfefeff64d918", "pre_experiment_sha": "930ae829ac0e62fc7c2c5870305ef17bf53e51e5", "timestamp": "2026-04-19T10:44:07.275181+00:00", "hypothesis": "A full technical rewrite with explicit CLI, pipeline semantics, configuration, examples, and operational notes will improve documentation completeness.", "hypothesis_source": "agent", "mutation_diff_summary": "", "score": 1.1, "score_ci_lower": 0.3, "score_ci_upper": 1.9, "raw_scores": [1.5, 0.0, 0.0, 2.5, 1.5], "baseline_score": 0.8, "outcome": "KEPT", "failure_mode": null, "duration_seconds": 69.23310445796233, "tags": ["readme", "documentation", "cli", "technical-reference"], "learnings": "{\"what_changed\":\"\",\"what_improved\":[],\"what_regressed\":[],\"transferable_insight\":\"Making a system explicit about how to use it, how it flows, and how it is operated tends to improve documentation completeness and reduce ambiguity.\",\"domain_tags\":[\"documentation\",\"technical-writing\",\"process-design\"]}", "cost_usd": 0.08918535000000001, "bootstrap_seed": 0, "agent_model": "gpt-5.4", "held_out_score": null, "criterion_names": ["quick_start_present", "api_documented", "prerequisites_clear", "examples_runnable", "error_guidance", "contribution_path"], "per_criterion_scores": {"quick_start_present": 0.3, "api_documented": 0.0, "prerequisites_clear": 0.3, "examples_runnable": 0.1, "error_guidance": 0.2, "contribution_path": 0.2}, "failure_classification": null, "drafts_generated": 1, "drafts_survived": 1}
