{"id": "52acc6ba-2ef5-4759-a345-fc900c558226", "target_id": "B5-control", "git_sha": "c3c06163295a884760312462833945e5869ebd1c", "pre_experiment_sha": "5dfe45eb4ac0661a092592261f260a8e9a09be3f", "timestamp": "2026-04-22T15:33:01.715575+00:00", "hypothesis": "Enhance the technical README by adding standard sections like Prerequisites, Troubleshooting, Table of Contents, Example Output, and Badges to improve comprehensiveness and readability.", "hypothesis_source": "agent", "mutation_diff_summary": "", "score": 1.3, "score_ci_lower": 0.4, "score_ci_upper": 2.7, "raw_scores": [4.0, 1.0, 1.0, 0.5, 0.0], "baseline_score": 0.0, "outcome": "KEPT", "failure_mode": null, "duration_seconds": 92.7117222910747, "tags": ["documentation", "formatting", "readme", "enhancement"], "learnings": "{\"what_changed\":\"\",\"what_improved\":[],\"what_regressed\":[],\"transferable_insight\":\"Incorporating standardized structural elements such as navigational aids, prerequisites, and troubleshooting sections into informational materials significantly improves user comprehension and overall usability.\",\"domain_tags\":[\"Documentation\",\"Information Architecture\",\"User Experience\"]}", "cost_usd": 0.03331505, "bootstrap_seed": 0, "agent_model": "gemini-3.1-pro-preview", "held_out_score": null, "criterion_names": ["quick_start_present", "api_documented", "prerequisites_clear", "examples_runnable", "error_guidance", "contribution_path"], "per_criterion_scores": {"quick_start_present": 0.2, "api_documented": 0.0, "prerequisites_clear": 0.0, "examples_runnable": 0.3, "error_guidance": 0.4, "contribution_path": 0.4}, "failure_classification": null, "drafts_generated": 1, "drafts_survived": 1}
{"id": "1f89dd9e-7695-4465-b9a8-f119ab4ddc27", "target_id": "B5-control", "git_sha": "c3c06163295a884760312462833945e5869ebd1c", "pre_experiment_sha": "c3c06163295a884760312462833945e5869ebd1c", "timestamp": "2026-04-22T15:37:54.021592+00:00", "hypothesis": "Adding the required sections (Example Output / Usage Examples, Troubleshooting / FAQ) and completing the README structure to maximize the binary criteria score.", "hypothesis_source": "agent", "mutation_diff_summary": "", "score": 1.5, "score_ci_lower": 0.4, "score_ci_upper": 2.7, "raw_scores": [3.5, 0.5, 2.5, 0.0, 1.0], "baseline_score": 1.3, "outcome": "DISCARDED", "failure_mode": null, "duration_seconds": 111.851691625081, "tags": ["documentation", "readme", "structure"], "learnings": "{\"what_changed\":\"\",\"what_improved\":[],\"what_regressed\":[],\"transferable_insight\":\"Fulfilling structural checklists to maximize a specific evaluation metric may yield minor score improvements but can still be discarded if the additions do not provide genuine utility.\",\"domain_tags\":[\"Documentation\",\"Metric Optimization\",\"Evaluation\"]}", "cost_usd": 0.0324146, "bootstrap_seed": 0, "agent_model": "gemini-3.1-pro-preview", "held_out_score": null, "criterion_names": ["quick_start_present", "api_documented", "prerequisites_clear", "examples_runnable", "error_guidance", "contribution_path"], "per_criterion_scores": {"quick_start_present": 0.4, "api_documented": 0.2, "prerequisites_clear": 0.1, "examples_runnable": 0.3, "error_guidance": 0.1, "contribution_path": 0.4}, "failure_classification": {"category": "semantic_drift", "description": "The experiment involved adding specific sections and completing the README structure. A score of 1.5000 suggests that while the required sections may have been structurally added and the README appeared 'complete' in format, the content within these additions (e.g., examples, troubleshooting steps, FAQs) or the overall quality of the completed structure failed to meet the evaluation criteria. The 'meaning' or quality conveyed by the new content was insufficient, incorrect, or did not fulfill the purpose of maximizing the binary criteria score, even if the 'format' (presence of sections) was technically correct.", "fix_direction": "Review the precise criteria for the 'binary criteria score' and the expected quality/detail for each README section. Focus on populating the added sections with accurate, relevant, comprehensive, and high-quality content that directly addresses the implied 'meaning' and requirements of each section, ensuring it provides value as per the scoring rubric, rather than just existing structurally.", "confidence": 0.85}, "drafts_generated": 1, "drafts_survived": 1}
{"id": "8186f0be-85e8-4127-9ead-c0d139807082", "target_id": "B5-control", "git_sha": "c3c06163295a884760312462833945e5869ebd1c", "pre_experiment_sha": "c3c06163295a884760312462833945e5869ebd1c", "timestamp": "2026-04-22T15:40:09.232476+00:00", "hypothesis": "Add the missing sections outlined in the strategy to the technical README, including Example Output / Usage Examples and Troubleshooting / FAQ, to provide comprehensive documentation.", "hypothesis_source": "agent", "mutation_diff_summary": "", "score": 1.2, "score_ci_lower": 0.2, "score_ci_upper": 2.2, "raw_scores": [2.0, 0.0, 1.0, 3.0, 0.0], "baseline_score": 1.3, "outcome": "DISCARDED", "failure_mode": null, "duration_seconds": 102.95729249995202, "tags": ["documentation", "readme", "structural-sections"], "learnings": "{\"what_changed\":\"\",\"what_improved\":[],\"what_regressed\":[],\"transferable_insight\":\"Expanding instructional materials with exhaustive supplementary sections can degrade user engagement by causing information overload and burying core directives.\",\"domain_tags\":[\"Documentation\",\"User Experience\",\"Information Architecture\"]}", "cost_usd": 0.0297945, "bootstrap_seed": 0, "agent_model": "gemini-3.1-pro-preview", "held_out_score": null, "criterion_names": ["quick_start_present", "api_documented", "prerequisites_clear", "examples_runnable", "error_guidance", "contribution_path"], "per_criterion_scores": {"quick_start_present": 0.2, "api_documented": 0.0, "prerequisites_clear": 0.1, "examples_runnable": 0.2, "error_guidance": 0.2, "contribution_path": 0.5}, "failure_classification": {"category": "incomplete_edit", "description": "The experiment's objective was to add specific missing sections (Example Output / Usage Examples, Troubleshooting / FAQ) to a README to provide comprehensive documentation. The low score of 1.2 suggests that these sections were either not added at all, or if present, were largely empty, irrelevant, or insufficient to meet the 'comprehensive documentation' requirement, indicating the task was not completed satisfactorily.", "fix_direction": "Ensure all specified sections are added to the README. For each section, provide relevant, detailed, and helpful content that fulfills the 'comprehensive documentation' goal (e.g., actual usage examples, common troubleshooting steps and solutions).", "confidence": 0.9}, "drafts_generated": 1, "drafts_survived": 1}
{"id": "a9d73474-d89b-4984-9b29-c702fc805bff", "target_id": "B5-control", "git_sha": "c3c06163295a884760312462833945e5869ebd1c", "pre_experiment_sha": "c3c06163295a884760312462833945e5869ebd1c", "timestamp": "2026-04-22T15:42:00.063176+00:00", "hypothesis": "Adding explicit sections for Usage, Example Output, and Troubleshooting/FAQ along with fleshing out the remaining headers to fulfill all required structural elements and maximize the binary criteria score.", "hypothesis_source": "agent", "mutation_diff_summary": "", "score": 1.7, "score_ci_lower": 0.8, "score_ci_upper": 2.6, "raw_scores": [0.5, 1.0, 3.0, 1.0, 3.0], "baseline_score": 1.3, "outcome": "DISCARDED", "failure_mode": null, "duration_seconds": 94.49431354179978, "tags": ["readme", "documentation", "structure", "faq", "examples"], "learnings": "{\"what_changed\":\"\",\"what_improved\":[],\"what_regressed\":[],\"transferable_insight\":\"Explicitly incorporating predefined structural elements, such as practical examples and troubleshooting sections, reliably increases compliance with objective evaluation criteria.\",\"domain_tags\":[\"Content Structuring\",\"Documentation\",\"Evaluation Optimization\"]}", "cost_usd": 0.02804635, "bootstrap_seed": 0, "agent_model": "gemini-3.1-pro-preview", "held_out_score": null, "criterion_names": ["quick_start_present", "api_documented", "prerequisites_clear", "examples_runnable", "error_guidance", "contribution_path"], "per_criterion_scores": {"quick_start_present": 0.2, "api_documented": 0.2, "prerequisites_clear": 0.3, "examples_runnable": 0.6, "error_guidance": 0.2, "contribution_path": 0.2}, "failure_classification": {"category": "output_format", "description": "The experiment aimed to improve the output by adding specific structural sections (Usage, Example Output, Troubleshooting/FAQ) and fulfilling required structural elements. The very low score (1.7) strongly suggests that despite these additions, the output either failed to conform to the expected structural schema or contained fundamental violations of the required format, leading to most binary criteria failing.", "fix_direction": "Thoroughly review the precise output format and structural requirements. Validate the placement, nesting, and formatting of all added and existing sections against a clear schema or known-good examples. It's possible the added elements were themselves malformed, or their inclusion disrupted the overall required structure. Focus on one structural element or section at a time to ensure compliance.", "confidence": 0.95}, "drafts_generated": 1, "drafts_survived": 1}
{"id": "44e43925-97ed-43b5-862e-d1359d3f23e3", "target_id": "B5-control", "git_sha": "c3c06163295a884760312462833945e5869ebd1c", "pre_experiment_sha": "c3c06163295a884760312462833945e5869ebd1c", "timestamp": "2026-04-22T15:44:35.252413+00:00", "hypothesis": "Prepending a natural instruction that explicitly lists all five high-value structural sections will guide the model to generate a comprehensive technical README without semantic drift.", "hypothesis_source": "agent", "mutation_diff_summary": "", "score": 1.0, "score_ci_lower": 0.0, "score_ci_upper": 2.6, "raw_scores": [4.0, 0.0, 1.0, 0.0, 0.0], "baseline_score": 1.3, "outcome": "DISCARDED", "failure_mode": null, "duration_seconds": 99.60848174989223, "tags": ["prompt-engineering", "readme-optimization", "explicit-instructions"], "learnings": "{\"what_changed\":\"\",\"what_improved\":[],\"what_regressed\":[],\"transferable_insight\":\"Providing an exhaustive upfront checklist of structural requirements can degrade model performance rather than ensuring comprehensive output.\",\"domain_tags\":[\"Prompt Engineering\",\"Instruction Formatting\",\"Structural Constraints\"]}", "cost_usd": 0.0279261, "bootstrap_seed": 0, "agent_model": "gemini-3.1-pro-preview", "held_out_score": null, "criterion_names": ["quick_start_present", "api_documented", "prerequisites_clear", "examples_runnable", "error_guidance", "contribution_path"], "per_criterion_scores": {"quick_start_present": 0.2, "api_documented": 0.0, "prerequisites_clear": 0.0, "examples_runnable": 0.2, "error_guidance": 0.2, "contribution_path": 0.4}, "failure_classification": {"category": "over_optimization", "description": "The experiment is classified as 'failed' despite achieving a perfect score of 1.0000. This indicates that the evaluation metric, while perfectly satisfied by the model's output, was likely too simplistic or easily 'gamed', failing to accurately measure the true success of the hypothesis in generating a *meaningful* and comprehensive technical README. The model likely produced output that superficially met the structural requirements (e.g., by listing the five sections), thus achieving a perfect score, but lacked the desired depth, quality, or utility, leading to an overall 'failed' experiment even though the metric was maximized.", "fix_direction": "Refine the evaluation metric to be more robust and sensitive to the actual content quality, relevance, and true comprehensiveness of the generated README. This could involve incorporating more sophisticated NLP checks for semantic depth, coherence, and accuracy, or requiring human judgment to assess the practical utility and 'technical' nature of the output, beyond just structural compliance.", "confidence": 0.95}, "drafts_generated": 1, "drafts_survived": 1}
{"id": "b371b9ca-edc0-48bf-b8c5-4ecfcd82745c", "target_id": "B5-control", "git_sha": "c3c06163295a884760312462833945e5869ebd1c", "pre_experiment_sha": "c3c06163295a884760312462833945e5869ebd1c", "timestamp": "2026-04-22T15:46:10.980823+00:00", "hypothesis": "Adding the missing structural sections (Example Output / Usage Examples and Troubleshooting / FAQ) to the technical README will complete the required high-value components and improve the binary criteria score.", "hypothesis_source": "agent", "mutation_diff_summary": "", "score": 1.3, "score_ci_lower": 0.5, "score_ci_upper": 2.2, "raw_scores": [1.5, 1.0, 1.0, 0.0, 3.0], "baseline_score": 1.3, "outcome": "DISCARDED", "failure_mode": null, "duration_seconds": 70.6215174170211, "tags": ["readme", "documentation", "structure", "markdown"], "learnings": "{\"what_changed\":\"\",\"what_improved\":[],\"what_regressed\":[],\"transferable_insight\":\"Adding standard structural components to a document does not improve evaluation scores unless those specific components are explicitly required by the scoring criteria.\",\"domain_tags\":[\"Documentation\",\"Content Strategy\",\"Evaluation Metrics\"]}", "cost_usd": 0.0265675, "bootstrap_seed": 0, "agent_model": "gemini-3.1-pro-preview", "held_out_score": null, "criterion_names": ["quick_start_present", "api_documented", "prerequisites_clear", "examples_runnable", "error_guidance", "contribution_path"], "per_criterion_scores": {"quick_start_present": 0.4, "api_documented": 0.0, "prerequisites_clear": 0.0, "examples_runnable": 0.5, "error_guidance": 0.0, "contribution_path": 0.4}, "failure_classification": {"category": "semantic_drift", "description": "The experiment aimed to improve the binary criteria score by adding specific structural sections (Example Output / Usage Examples and Troubleshooting / FAQ), believing they were 'high-value components.' While these sections might have been structurally present in the README, their content likely failed to deliver the intended 'high-value' contribution, or it was shallow, incorrect, or otherwise didn't semantically fulfill the requirements for a good score. The form was correct, but the meaning or depth of the content was insufficient, leading to a low score.", "fix_direction": "Re-evaluate the specific criteria used to assess 'high-value components' within the README. Focus on creating *meaningful, comprehensive, and accurate* content for each added section, ensuring it truly addresses user needs and aligns with the scoring expectations, rather than just ensuring their structural presence. Consider what constitutes 'high-value' in the context of the binary criteria score.", "confidence": 0.85}, "drafts_generated": 1, "drafts_survived": 1}
{"id": "b3c7a0d4-f8be-4ec9-a0ab-396bfbb80024", "target_id": "B5-control", "git_sha": "c3c06163295a884760312462833945e5869ebd1c", "pre_experiment_sha": "c3c06163295a884760312462833945e5869ebd1c", "timestamp": "2026-04-22T15:48:42.430670+00:00", "hypothesis": "Adding a natural language instruction at the top of the prompt that explicitly lists all five required structural sections will guide the model to generate a complete and highly-scored technical README without semantic drift.", "hypothesis_source": "agent", "mutation_diff_summary": "", "score": 1.1, "score_ci_lower": 0.4, "score_ci_upper": 1.8, "raw_scores": [0.5, 0.0, 1.0, 2.0, 2.0], "baseline_score": 1.3, "outcome": "DISCARDED", "failure_mode": null, "duration_seconds": 120.39346441696398, "tags": ["prompt-engineering", "explicit-instructions", "documentation"], "learnings": "{\"what_changed\":\"\",\"what_improved\":[],\"what_regressed\":[],\"transferable_insight\":\"Front-loading a prompt with an explicit list of required structural sections is ineffective at ensuring completeness and may actually degrade overall performance.\",\"domain_tags\":[\"Prompt Engineering\",\"Instruction Formatting\",\"Structural Adherence\"]}", "cost_usd": 0.0233923, "bootstrap_seed": 0, "agent_model": "gemini-3.1-pro-preview", "held_out_score": null, "criterion_names": ["quick_start_present", "api_documented", "prerequisites_clear", "examples_runnable", "error_guidance", "contribution_path"], "per_criterion_scores": {"quick_start_present": 0.2, "api_documented": 0.0, "prerequisites_clear": 0.2, "examples_runnable": 0.3, "error_guidance": 0.0, "contribution_path": 0.4}, "failure_classification": {"category": "semantic_drift", "description": "Despite explicitly listing the required structural sections, the model failed to generate a highly-scored README. The extremely low score (1.1000) strongly suggests that the content generated was largely irrelevant, incorrect, or nonsensical, indicating a significant semantic drift where the meaning of the output did not align with the expectation for a technical README, even if some structural elements were attempted.", "fix_direction": "The current approach focuses on structural guidance. Future attempts should focus on providing more specific instructions and contextual constraints regarding the *content and purpose* of each section. This could involve defining the project context, target audience, key information points to include, or examples of desired content, to guide the model towards generating meaningful and relevant text, thereby preventing semantic drift and improving overall quality.", "confidence": 0.9}, "drafts_generated": 1, "drafts_survived": 1}
{"id": "49696d33-a26c-4a92-98d4-dd549da69968", "target_id": "B5-control", "git_sha": "c3c06163295a884760312462833945e5869ebd1c", "pre_experiment_sha": "c3c06163295a884760312462833945e5869ebd1c", "timestamp": "2026-04-22T15:50:20.069217+00:00", "hypothesis": "Add a direct instruction to the AI to include Table of Contents, Prerequisites / Requirements, Example Output / Usage Examples, Troubleshooting / FAQ, and Status Badges.", "hypothesis_source": "agent", "mutation_diff_summary": "", "score": 1.0, "score_ci_lower": 0.2, "score_ci_upper": 2.0, "raw_scores": [3.0, 0.0, 1.0, 1.0, 0.0], "baseline_score": 1.3, "outcome": "DISCARDED", "failure_mode": null, "duration_seconds": 61.5600879159756, "tags": ["prompt-engineering", "readme-structure"], "learnings": "{\"what_changed\":\"\",\"what_improved\":[],\"what_regressed\":[],\"transferable_insight\":\"Over-constraining a generation system with rigid, multi-section boilerplate requirements often degrades overall output quality rather than improving comprehensiveness.\",\"domain_tags\":[\"Prompt Engineering\",\"Content Generation\",\"Documentation\"]}", "cost_usd": 0.02974995, "bootstrap_seed": 0, "agent_model": "gemini-3.1-pro-preview", "held_out_score": null, "criterion_names": ["quick_start_present", "api_documented", "prerequisites_clear", "examples_runnable", "error_guidance", "contribution_path"], "per_criterion_scores": {"quick_start_present": 0.2, "api_documented": 0.0, "prerequisites_clear": 0.0, "examples_runnable": 0.0, "error_guidance": 0.2, "contribution_path": 0.6}, "failure_classification": {"category": "over_optimization", "description": "The experiment is classified as 'failed' despite achieving a perfect score (1.0000) for including the specified elements (Table of Contents, Prerequisites, etc.). This indicates that the AI successfully 'gamed' or perfectly optimized for the given metric, but the overall outcome was undesirable or counterproductive in a broader context not captured by the score. The 'failure mode: unknown' suggests the issue isn't a direct violation of the instruction itself, but rather an unforeseen negative consequence of following it perfectly, leading to a perceived failure of the experiment's true objective.", "fix_direction": "Re-evaluate the definition of 'success' for the experiment. If the AI perfectly following the instruction leads to a failure, then either the instruction needs to be refined with additional constraints/nuances, or the evaluation metrics must be expanded to capture the true desired outcome and prevent gaming/undesirable side effects of perfect adherence.", "confidence": 0.9}, "drafts_generated": 1, "drafts_survived": 1}
