{"id": "9ba82a3d-767f-44fa-9002-a2549e349cc5", "target_id": "B5-control", "git_sha": "d70f053dd70f0513ac4baa32f6718ed3870c20e2", "pre_experiment_sha": "d70f053dd70f0513ac4baa32f6718ed3870c20e2", "timestamp": "2026-04-07T20:17:50.245459+00:00", "hypothesis": "No hypothesis provided", "hypothesis_source": "synthesized", "mutation_diff_summary": "", "score": 1.5, "score_ci_lower": 0.7, "score_ci_upper": 2.0, "raw_scores": [1.5, 2.0, 2.0, 2.0, 0.0], "baseline_score": 1.8, "outcome": "DISCARDED", "failure_mode": null, "duration_seconds": 218.03213916700042, "tags": [], "learnings": "{\"what_changed\":\"\",\"what_improved\":[],\"what_regressed\":[],\"transferable_insight\":\"No hypothesis provided\",\"domain_tags\":[]}", "cost_usd": 0.68862265, "bootstrap_seed": 0, "agent_model": "claude-sonnet-4-6", "held_out_score": null, "criterion_names": ["quick_start_present", "api_documented", "prerequisites_clear", "examples_runnable", "error_guidance", "contribution_path"], "per_criterion_scores": {"quick_start_present": 0.4, "api_documented": 0.0, "prerequisites_clear": 0.2, "examples_runnable": 0.1, "error_guidance": 0.2, "contribution_path": 0.6}, "failure_classification": {"category": "output_format", "description": "The experiment failed due to a violation of the expected output structure or schema.", "fix_direction": "Ensure the output strictly adheres to the required format or schema in future attempts.", "confidence": 0.9}, "drafts_generated": 1, "drafts_survived": 1}
{"id": "0b3c9ed1-22ba-4165-8844-2c5b13d4322b", "target_id": "B5-control", "git_sha": "86c0b3221ee42fdc88e7cb324342cb5a4eaad9e3", "pre_experiment_sha": "d70f053dd70f0513ac4baa32f6718ed3870c20e2", "timestamp": "2026-04-07T20:28:06.082307+00:00", "hypothesis": "No hypothesis provided", "hypothesis_source": "synthesized", "mutation_diff_summary": "", "score": 1.5, "score_ci_lower": 0.4, "score_ci_upper": 2.6, "raw_scores": [0.0, 0.0, 2.0, 3.5, 2.0], "baseline_score": 1.8, "outcome": "KEPT", "failure_mode": null, "duration_seconds": 313.26794829199935, "tags": [], "learnings": "{\"what_changed\":\"\",\"what_improved\":[],\"what_regressed\":[],\"transferable_insight\":\"No hypothesis provided\",\"domain_tags\":[]}", "cost_usd": 0.9576589499999999, "bootstrap_seed": 0, "agent_model": "claude-sonnet-4-6", "held_out_score": null, "criterion_names": ["quick_start_present", "api_documented", "prerequisites_clear", "examples_runnable", "error_guidance", "contribution_path"], "per_criterion_scores": {"quick_start_present": 0.5, "api_documented": 0.0, "prerequisites_clear": 0.2, "examples_runnable": 0.2, "error_guidance": 0.2, "contribution_path": 0.4}, "failure_classification": null, "drafts_generated": 1, "drafts_survived": 1}
{"id": "7eebba69-16c8-40cd-857d-6338fdada72b", "target_id": "B5-control", "git_sha": "7d5c6de488d68f4ed2726da91ac5c3056f4b79c2", "pre_experiment_sha": "86c0b3221ee42fdc88e7cb324342cb5a4eaad9e3", "timestamp": "2026-04-07T20:32:11.132473+00:00", "hypothesis": "No hypothesis provided", "hypothesis_source": "synthesized", "mutation_diff_summary": "", "score": 2.0, "score_ci_lower": 1.0, "score_ci_upper": 2.8, "raw_scores": [3.0, 3.0, 2.0, 2.0, 0.0], "baseline_score": 1.5, "outcome": "KEPT", "failure_mode": null, "duration_seconds": 244.6313029170051, "tags": [], "learnings": "{\"what_changed\":\"\",\"what_improved\":[],\"what_regressed\":[],\"transferable_insight\":\"No hypothesis provided\",\"domain_tags\":[]}", "cost_usd": 0.7666438499999999, "bootstrap_seed": 0, "agent_model": "claude-sonnet-4-6", "held_out_score": null, "criterion_names": ["quick_start_present", "api_documented", "prerequisites_clear", "examples_runnable", "error_guidance", "contribution_path"], "per_criterion_scores": {"quick_start_present": 0.4, "api_documented": 0.0, "prerequisites_clear": 0.4, "examples_runnable": 0.2, "error_guidance": 0.4, "contribution_path": 0.6}, "failure_classification": null, "drafts_generated": 1, "drafts_survived": 1}
{"id": "bfbc9122-debd-4912-8fb4-523bcf865ded", "target_id": "B5-control", "git_sha": "7d5c6de488d68f4ed2726da91ac5c3056f4b79c2", "pre_experiment_sha": "7d5c6de488d68f4ed2726da91ac5c3056f4b79c2", "timestamp": "2026-04-07T20:36:01.902850+00:00", "hypothesis": "No hypothesis provided", "hypothesis_source": "synthesized", "mutation_diff_summary": "", "score": 1.8, "score_ci_lower": 0.7, "score_ci_upper": 2.8, "raw_scores": [2.5, 0.0, 3.5, 2.0, 1.0], "baseline_score": 2.0, "outcome": "DISCARDED", "failure_mode": null, "duration_seconds": 230.31735229200422, "tags": [], "learnings": "{\"what_changed\":\"\",\"what_improved\":[],\"what_regressed\":[],\"transferable_insight\":\"No hypothesis provided\",\"domain_tags\":[]}", "cost_usd": 0.6520958000000001, "bootstrap_seed": 0, "agent_model": "claude-sonnet-4-6", "held_out_score": null, "criterion_names": ["quick_start_present", "api_documented", "prerequisites_clear", "examples_runnable", "error_guidance", "contribution_path"], "per_criterion_scores": {"quick_start_present": 0.6, "api_documented": 0.0, "prerequisites_clear": 0.2, "examples_runnable": 0.2, "error_guidance": 0.2, "contribution_path": 0.6}, "failure_classification": {"category": "output_format", "description": "The experiment lacks a provided hypothesis, which violates the expected structure or schema for reporting experimental results.", "fix_direction": "Ensure all required sections, including hypothesis, are completed according to the prescribed output schema.", "confidence": 0.95}, "drafts_generated": 1, "drafts_survived": 1}
{"id": "6b8f20a2-6c70-46c1-8927-b54038d06759", "target_id": "B5-control", "git_sha": "7d5c6de488d68f4ed2726da91ac5c3056f4b79c2", "pre_experiment_sha": "7d5c6de488d68f4ed2726da91ac5c3056f4b79c2", "timestamp": "2026-04-07T20:38:59.914107+00:00", "hypothesis": "No hypothesis provided", "hypothesis_source": "synthesized", "mutation_diff_summary": "", "score": 1.6, "score_ci_lower": 1.0, "score_ci_upper": 2.8, "raw_scores": [1.0, 1.0, 1.0, 4.0, 1.0], "baseline_score": 2.0, "outcome": "DISCARDED", "failure_mode": null, "duration_seconds": 176.33369337499607, "tags": [], "learnings": "{\"what_changed\":\"\",\"what_improved\":[],\"what_regressed\":[],\"transferable_insight\":\"No hypothesis provided\",\"domain_tags\":[]}", "cost_usd": 0.6105021500000001, "bootstrap_seed": 0, "agent_model": "claude-sonnet-4-6", "held_out_score": null, "criterion_names": ["quick_start_present", "api_documented", "prerequisites_clear", "examples_runnable", "error_guidance", "contribution_path"], "per_criterion_scores": {"quick_start_present": 0.6, "api_documented": 0.0, "prerequisites_clear": 0.2, "examples_runnable": 0.2, "error_guidance": 0.2, "contribution_path": 0.4}, "failure_classification": {"category": "output_format", "description": "The experiment failed due to a violation of the required output structure or schema, as suggested by the information provided.", "fix_direction": "Ensure the output strictly adheres to the specified structure or schema requirements.", "confidence": 0.8}, "drafts_generated": 1, "drafts_survived": 1}
{"id": "aa5cef9b-a379-4159-b734-54a994a9f835", "target_id": "B5-control", "git_sha": "7d5c6de488d68f4ed2726da91ac5c3056f4b79c2", "pre_experiment_sha": "7d5c6de488d68f4ed2726da91ac5c3056f4b79c2", "timestamp": "2026-04-07T20:44:29.735271+00:00", "hypothesis": "No hypothesis provided", "hypothesis_source": "synthesized", "mutation_diff_summary": "", "score": 1.4, "score_ci_lower": 0.6, "score_ci_upper": 2.0, "raw_scores": [2.0, 1.0, 0.0, 2.0, 2.0], "baseline_score": 2.0, "outcome": "DISCARDED", "failure_mode": null, "duration_seconds": 328.11324449999665, "tags": [], "learnings": "{\"what_changed\":\"\",\"what_improved\":[],\"what_regressed\":[],\"transferable_insight\":\"No hypothesis provided\",\"domain_tags\":[]}", "cost_usd": 1.0119962500000002, "bootstrap_seed": 0, "agent_model": "claude-sonnet-4-6", "held_out_score": null, "criterion_names": ["quick_start_present", "api_documented", "prerequisites_clear", "examples_runnable", "error_guidance", "contribution_path"], "per_criterion_scores": {"quick_start_present": 0.4, "api_documented": 0.0, "prerequisites_clear": 0.0, "examples_runnable": 0.4, "error_guidance": 0.4, "contribution_path": 0.2}, "failure_classification": {"category": "output_format", "description": "The failed experiment exhibited an output structure or schema violation, as there was no hypothesis provided and the failure mode is unknown, also reflecting a lack of adherence to the required output schema.", "fix_direction": "Ensure all required fields (e.g., hypothesis, failure mode) are present and adhere strictly to the defined output format/schema in future attempts.", "confidence": 0.92}, "drafts_generated": 1, "drafts_survived": 1}
{"id": "777615d1-55c8-4500-9ed3-58c19ab547ee", "target_id": "B5-control", "git_sha": "7d5c6de488d68f4ed2726da91ac5c3056f4b79c2", "pre_experiment_sha": "7d5c6de488d68f4ed2726da91ac5c3056f4b79c2", "timestamp": "2026-04-07T20:53:12.218999+00:00", "hypothesis": "No hypothesis provided", "hypothesis_source": "synthesized", "mutation_diff_summary": "", "score": 1.6, "score_ci_lower": 0.6, "score_ci_upper": 2.4, "raw_scores": [1.0, 2.0, 3.0, 2.0, 0.0], "baseline_score": 2.0, "outcome": "DISCARDED", "failure_mode": null, "duration_seconds": 220.20729175000452, "tags": [], "learnings": "{\"what_changed\":\"\",\"what_improved\":[],\"what_regressed\":[],\"transferable_insight\":\"No hypothesis provided\",\"domain_tags\":[]}", "cost_usd": 0.7433297500000001, "bootstrap_seed": 0, "agent_model": "claude-sonnet-4-6", "held_out_score": null, "criterion_names": ["quick_start_present", "api_documented", "prerequisites_clear", "examples_runnable", "error_guidance", "contribution_path"], "per_criterion_scores": {"quick_start_present": 0.2, "api_documented": 0.0, "prerequisites_clear": 0.2, "examples_runnable": 0.2, "error_guidance": 0.4, "contribution_path": 0.6}, "failure_classification": {"category": "output_format", "description": "The experiment failed due to a violation of the required output structure or schema.", "fix_direction": "Ensure the output strictly complies with the specified format or schema requirements.", "confidence": 0.9}, "drafts_generated": 1, "drafts_survived": 1}
{"id": "aacb3ba1-ef68-48ab-99ef-0d1e207116a1", "target_id": "B5-control", "git_sha": "7d5c6de488d68f4ed2726da91ac5c3056f4b79c2", "pre_experiment_sha": "7d5c6de488d68f4ed2726da91ac5c3056f4b79c2", "timestamp": "2026-04-07T20:57:24.180305+00:00", "hypothesis": "No hypothesis provided", "hypothesis_source": "synthesized", "mutation_diff_summary": "", "score": 0.9, "score_ci_lower": 0.0, "score_ci_upper": 2.5, "raw_scores": [0.0, 0.0, 0.0, 4.0, 0.5], "baseline_score": 2.0, "outcome": "DISCARDED", "failure_mode": null, "duration_seconds": 250.395146750001, "tags": [], "learnings": "{\"what_changed\":\"\",\"what_improved\":[],\"what_regressed\":[],\"transferable_insight\":\"No hypothesis provided\",\"domain_tags\":[]}", "cost_usd": 0.7936994500000001, "bootstrap_seed": 0, "agent_model": "claude-sonnet-4-6", "held_out_score": null, "criterion_names": ["quick_start_present", "api_documented", "prerequisites_clear", "examples_runnable", "error_guidance", "contribution_path"], "per_criterion_scores": {"quick_start_present": 0.3, "api_documented": 0.0, "prerequisites_clear": 0.2, "examples_runnable": 0.2, "error_guidance": 0.0, "contribution_path": 0.2}, "failure_classification": {"category": "output_format", "description": "The experiment failed due to an output structure or schema violation, likely because the required hypothesis was not provided.", "fix_direction": "Ensure that the output strictly follows the prescribed schema, including all required fields such as the hypothesis.", "confidence": 0.95}, "drafts_generated": 1, "drafts_survived": 1}
{"id": "baa094f2-0a61-42b4-a6a4-159c66962fea", "target_id": "B5-control", "git_sha": "7d5c6de488d68f4ed2726da91ac5c3056f4b79c2", "pre_experiment_sha": "7d5c6de488d68f4ed2726da91ac5c3056f4b79c2", "timestamp": "2026-04-07T21:07:14.013373+00:00", "hypothesis": "No hypothesis provided", "hypothesis_source": "synthesized", "mutation_diff_summary": "", "score": 1.0, "score_ci_lower": 0.2, "score_ci_upper": 1.8, "raw_scores": [0.0, 0.0, 2.0, 2.0, 1.0], "baseline_score": 2.0, "outcome": "DISCARDED", "failure_mode": null, "duration_seconds": 286.5907526670053, "tags": [], "learnings": "{\"what_changed\":\"\",\"what_improved\":[],\"what_regressed\":[],\"transferable_insight\":\"No hypothesis provided\",\"domain_tags\":[]}", "cost_usd": 0.8017257, "bootstrap_seed": 0, "agent_model": "claude-sonnet-4-6", "held_out_score": null, "criterion_names": ["quick_start_present", "api_documented", "prerequisites_clear", "examples_runnable", "error_guidance", "contribution_path"], "per_criterion_scores": {"quick_start_present": 0.2, "api_documented": 0.0, "prerequisites_clear": 0.0, "examples_runnable": 0.0, "error_guidance": 0.4, "contribution_path": 0.4}, "failure_classification": {"category": "output_format", "description": "The experiment does not include a hypothesis or a defined failure mode, and no structured output matching the expected schema is present. This indicates a violation of the required output structure.", "fix_direction": "Ensure the experiment includes all required fields and matches the expected output schema.", "confidence": 0.95}, "drafts_generated": 1, "drafts_survived": 1}
{"id": "b6059f62-7437-41c5-a507-a7b4254acae1", "target_id": "B5-control", "git_sha": "7d5c6de488d68f4ed2726da91ac5c3056f4b79c2", "pre_experiment_sha": "7d5c6de488d68f4ed2726da91ac5c3056f4b79c2", "timestamp": "2026-04-07T21:11:53.321727+00:00", "hypothesis": "No hypothesis provided", "hypothesis_source": "synthesized", "mutation_diff_summary": "", "score": 1.2, "score_ci_lower": 0.2, "score_ci_upper": 2.2, "raw_scores": [0.0, 0.0, 3.0, 1.0, 2.0], "baseline_score": 2.0, "outcome": "DISCARDED", "failure_mode": null, "duration_seconds": 276.1708082499972, "tags": [], "learnings": "{\"what_changed\":\"\",\"what_improved\":[],\"what_regressed\":[],\"transferable_insight\":\"No hypothesis provided\",\"domain_tags\":[]}", "cost_usd": 0.8712871000000001, "bootstrap_seed": 0, "agent_model": "claude-sonnet-4-6", "held_out_score": null, "criterion_names": ["quick_start_present", "api_documented", "prerequisites_clear", "examples_runnable", "error_guidance", "contribution_path"], "per_criterion_scores": {"quick_start_present": 0.4, "api_documented": 0.0, "prerequisites_clear": 0.2, "examples_runnable": 0.2, "error_guidance": 0.0, "contribution_path": 0.4}, "failure_classification": {"category": "output_format", "description": "The experiment failed due to violating the required output structure or schema, as indicated by the output_format category and the lack of a detailed hypothesis or failure mode.", "fix_direction": "Ensure that future experiments strictly follow the expected output schema and include all necessary result fields.", "confidence": 0.8}, "drafts_generated": 1, "drafts_survived": 1}
{"id": "af193e7b-7c4a-43c8-ab16-04aecd43707c", "target_id": "B5-control", "git_sha": "698b0d3d597b851430d4689c5cb548793072a4ae", "pre_experiment_sha": "7d5c6de488d68f4ed2726da91ac5c3056f4b79c2", "timestamp": "2026-04-07T21:15:42.323566+00:00", "hypothesis": "No hypothesis provided", "hypothesis_source": "synthesized", "mutation_diff_summary": "", "score": 1.8, "score_ci_lower": 0.4, "score_ci_upper": 3.2, "raw_scores": [3.0, 2.0, 0.0, 4.0, 0.0], "baseline_score": 2.0, "outcome": "KEPT", "failure_mode": null, "duration_seconds": 226.99398870799632, "tags": [], "learnings": "{\"what_changed\":\"\",\"what_improved\":[],\"what_regressed\":[],\"transferable_insight\":\"No hypothesis provided\",\"domain_tags\":[]}", "cost_usd": 0.84334965, "bootstrap_seed": 0, "agent_model": "claude-sonnet-4-6", "held_out_score": null, "criterion_names": ["quick_start_present", "api_documented", "prerequisites_clear", "examples_runnable", "error_guidance", "contribution_path"], "per_criterion_scores": {"quick_start_present": 0.4, "api_documented": 0.0, "prerequisites_clear": 0.4, "examples_runnable": 0.2, "error_guidance": 0.4, "contribution_path": 0.4}, "failure_classification": null, "drafts_generated": 1, "drafts_survived": 1}
