{"id": "5157a882-2f68-4229-a7b8-39bb7986e731", "target_id": "B5-control", "git_sha": "11b2796315027524cef990c2dbdd5a317710340c", "pre_experiment_sha": "1659e0d2d0bd9cb4d31ca58a9c7ad5305ec77247", "timestamp": "2026-04-22T16:44:45.572658+00:00", "hypothesis": "Providing stronger emphasis on generating extensive content and clearly mapping the required details into the mandatory sections will improve the generation of API documentation and runnable examples.", "hypothesis_source": "agent", "mutation_diff_summary": "", "score": 2.6, "score_ci_lower": 2.0, "score_ci_upper": 3.1, "raw_scores": [3.0, 2.5, 1.5, 3.5, 2.5], "baseline_score": 1.9, "outcome": "KEPT", "failure_mode": null, "duration_seconds": 77.48205237509683, "tags": ["prompt-engineering", "documentation", "criteria-targeting", "content-expansion"], "learnings": "{\"what_changed\":\"\",\"what_improved\":[\"quick_start_present: PASS (was FAIL)\",\"examples_runnable: PASS (was FAIL)\"],\"what_regressed\":[],\"transferable_insight\":\"Explicitly mapping required details into mandatory sections and emphasizing comprehensive content generation improves the completeness and practical utility of instructional outputs.\",\"domain_tags\":[\"Documentation\",\"Code Generation\",\"Instruction Following\"]}", "cost_usd": 0.036198999999999995, "bootstrap_seed": 0, "agent_model": "gemini-3.1-pro-preview", "held_out_score": null, "criterion_names": ["quick_start_present", "api_documented", "prerequisites_clear", "examples_runnable", "error_guidance", "contribution_path"], "per_criterion_scores": {"quick_start_present": 0.6, "api_documented": 0.1, "prerequisites_clear": 0.4, "examples_runnable": 0.5, "error_guidance": 0.2, "contribution_path": 0.8}, "failure_classification": null, "drafts_generated": 1, "drafts_survived": 1}
{"id": "4127ee2e-c9c6-4e26-b817-5f4f743a0c9e", "target_id": "B5-control", "git_sha": "11b2796315027524cef990c2dbdd5a317710340c", "pre_experiment_sha": "11b2796315027524cef990c2dbdd5a317710340c", "timestamp": "2026-04-22T16:46:00.430773+00:00", "hypothesis": "Provide more concrete examples and explicit formatting instructions for the API, prerequisites, and error guidance sections to improve their evaluation scores.", "hypothesis_source": "agent", "mutation_diff_summary": "", "score": 1.7, "score_ci_lower": 0.9, "score_ci_upper": 2.5, "raw_scores": [3.0, 0.5, 1.5, 1.0, 2.5], "baseline_score": 2.6, "outcome": "DISCARDED", "failure_mode": null, "duration_seconds": 68.58726508310065, "tags": ["prompt-engineering", "documentation", "criteria-targeting", "content-expansion"], "learnings": "{\"what_changed\":\"\",\"what_improved\":[],\"what_regressed\":[\"quick_start_present: FAIL (was PASS)\",\"contribution_path: FAIL (was PASS)\"],\"transferable_insight\":\"Over-specifying instructions for certain parts of an output can lead to the omission or degradation of other previously successful components due to attention shift.\",\"domain_tags\":[\"prompt_engineering\",\"attention_management\",\"regression_analysis\"]}", "cost_usd": 0.026184099999999995, "bootstrap_seed": 0, "agent_model": "gemini-3.1-pro-preview", "held_out_score": null, "criterion_names": ["quick_start_present", "api_documented", "prerequisites_clear", "examples_runnable", "error_guidance", "contribution_path"], "per_criterion_scores": {"quick_start_present": 0.4, "api_documented": 0.0, "prerequisites_clear": 0.2, "examples_runnable": 0.5, "error_guidance": 0.2, "contribution_path": 0.4}, "failure_classification": {"category": "semantic_drift", "description": "The attempt to provide more concrete examples and explicit formatting instructions likely resulted in content that, while explicit, conveyed incorrect, misleading, or irrelevant information, or was misinterpreted by the evaluation. The intended meaning or guidance for the API, prerequisites, or error handling sections drifted from the desired correct interpretation, leading to a significantly low score.", "fix_direction": "Thoroughly review the accuracy, relevance, and semantic correctness of all new examples and instructions. Validate that they lead to the intended understanding and behavior, rather than just being 'more' explicit or concrete. Focus on user comprehension and the exact output generated by following these instructions.", "confidence": 0.9}, "drafts_generated": 1, "drafts_survived": 1}
{"id": "03ee2b0b-da40-4dc3-8221-0a367621147d", "target_id": "B5-control", "git_sha": "11b2796315027524cef990c2dbdd5a317710340c", "pre_experiment_sha": "11b2796315027524cef990c2dbdd5a317710340c", "timestamp": "2026-04-22T16:47:40.257399+00:00", "hypothesis": "Enhance the API and prerequisites instructions with concrete examples (e.g., filter, rename, compute) and close the final bash block in the source text to improve criteria fulfillment and structural integrity.", "hypothesis_source": "agent", "mutation_diff_summary": "", "score": 1.7, "score_ci_lower": 1.0, "score_ci_upper": 2.4, "raw_scores": [2.5, 0.5, 1.0, 2.0, 2.5], "baseline_score": 2.6, "outcome": "DISCARDED", "failure_mode": null, "duration_seconds": 65.30715833301656, "tags": ["prompt-engineering", "documentation", "criteria-targeting", "content-expansion"], "learnings": "{\"what_changed\":\"\",\"what_improved\":[\"contribution_path: PASS (was FAIL)\"],\"what_regressed\":[\"examples_runnable: FAIL (was PASS)\"],\"transferable_insight\":\"Injecting concrete examples into instructional prompts can improve structural compliance but risks breaking the execution of generated code if the examples lack necessary context or dependencies.\",\"domain_tags\":[\"Prompt Engineering\",\"Code Generation\",\"Documentation\"]}", "cost_usd": 0.03647785, "bootstrap_seed": 0, "agent_model": "gemini-3.1-pro-preview", "held_out_score": null, "criterion_names": ["quick_start_present", "api_documented", "prerequisites_clear", "examples_runnable", "error_guidance", "contribution_path"], "per_criterion_scores": {"quick_start_present": 0.4, "api_documented": 0.1, "prerequisites_clear": 0.1, "examples_runnable": 0.3, "error_guidance": 0.2, "contribution_path": 0.6}, "failure_classification": {"category": "syntax_error", "description": "The explicit instruction to 'close the final bash block' suggests an existing or introduced syntax issue. The attempt to resolve this likely either failed to correctly terminate the block or introduced a new syntax error in the source text, leading to malformed content, parsing failures, or broken structural integrity. This type of error often results in a very low score because the content might not be renderable or processable correctly.", "fix_direction": "Thoroughly review the syntax of all code blocks and structural elements, especially the 'final bash block'. Ensure that all blocks are correctly opened and closed according to the expected markdown or code syntax. Implement robust validation checks to catch syntax errors early in the development pipeline.", "confidence": 0.8}, "drafts_generated": 1, "drafts_survived": 1}
{"id": "af0902fb-b0ff-4fca-8486-aa145130cbfd", "target_id": "B5-control", "git_sha": "11b2796315027524cef990c2dbdd5a317710340c", "pre_experiment_sha": "11b2796315027524cef990c2dbdd5a317710340c", "timestamp": "2026-04-22T16:49:22.176452+00:00", "hypothesis": "Enhance the detail requested for API, prerequisites, and troubleshooting by specifying quantities and scope (e.g., \"highly detailed\", \"supported operating systems\", \"at least three common errors\") and fix the unclosed bash block in the source text.", "hypothesis_source": "agent", "mutation_diff_summary": "", "score": 1.5, "score_ci_lower": 0.6, "score_ci_upper": 2.2, "raw_scores": [2.0, 1.0, 2.0, 0.0, 2.5], "baseline_score": 2.6, "outcome": "DISCARDED", "failure_mode": null, "duration_seconds": 71.65625524986535, "tags": ["prompt-engineering", "documentation", "criteria-targeting", "content-expansion"], "learnings": "{\"what_changed\":\"\",\"what_improved\":[],\"what_regressed\":[\"contribution_path: FAIL (was PASS)\"],\"transferable_insight\":\"Imposing overly specific quantitative constraints or scopes in instructions can distract from or negatively impact the fulfillment of core structural requirements.\",\"domain_tags\":[\"Prompt Engineering\",\"Constraint Management\",\"Instruction Design\"]}", "cost_usd": 0.03492884999999999, "bootstrap_seed": 0, "agent_model": "gemini-3.1-pro-preview", "held_out_score": null, "criterion_names": ["quick_start_present", "api_documented", "prerequisites_clear", "examples_runnable", "error_guidance", "contribution_path"], "per_criterion_scores": {"quick_start_present": 0.4, "api_documented": 0.1, "prerequisites_clear": 0.2, "examples_runnable": 0.3, "error_guidance": 0.1, "contribution_path": 0.4}, "failure_classification": {"category": "syntax_error", "description": "The experiment explicitly aimed to 'fix the unclosed bash block in the source text'. Given the low score of 1.5000 and an 'unknown' failure mode, it is highly probable that this specific syntax fix was either not performed correctly, or the attempt to fix it introduced new syntax errors or failed to resolve the original one. An unclosed block is a direct syntax error, and its persistence or re-introduction would lead to a severely degraded output quality.", "fix_direction": "Implement robust syntax validation and linting for any modified code blocks. Ensure that code-related edits are thoroughly tested for syntactical correctness before being finalized. For the detail enhancement part, refine instructions to ensure additions are relevant, accurate, and truly enhance clarity and quantity, possibly through a more structured generation approach.", "confidence": 0.9}, "drafts_generated": 1, "drafts_survived": 1}
{"id": "061e6447-7d0b-46e0-a08a-9caf01efcac0", "target_id": "B5-control", "git_sha": "11b2796315027524cef990c2dbdd5a317710340c", "pre_experiment_sha": "11b2796315027524cef990c2dbdd5a317710340c", "timestamp": "2026-04-22T16:50:54.854628+00:00", "hypothesis": "Fix the unclosed bash code block in the source text and slightly refine the instructions for API, Prerequisites, and Troubleshooting to boost criteria fulfillment without causing semantic drift.", "hypothesis_source": "agent", "mutation_diff_summary": "", "score": 0.8, "score_ci_lower": 0.0, "score_ci_upper": 1.6, "raw_scores": [0.0, 0.0, 0.0, 2.0, 2.0], "baseline_score": 2.6, "outcome": "DISCARDED", "failure_mode": null, "duration_seconds": 72.86299345782027, "tags": ["prompt-engineering", "syntax-fix", "documentation", "criteria-targeting"], "learnings": "{\"what_changed\":\"\",\"what_improved\":[],\"what_regressed\":[],\"transferable_insight\":\"Combining minor formatting corrections with subtle instruction refinements does not guarantee improved performance and may even lead to degradation.\",\"domain_tags\":[\"Prompt Engineering\",\"Formatting\",\"Instruction Refinement\"]}", "cost_usd": 0.02961925, "bootstrap_seed": 0, "agent_model": "gemini-3.1-pro-preview", "held_out_score": null, "criterion_names": ["quick_start_present", "api_documented", "prerequisites_clear", "examples_runnable", "error_guidance", "contribution_path"], "per_criterion_scores": {"quick_start_present": 0.2, "api_documented": 0.0, "prerequisites_clear": 0.0, "examples_runnable": 0.2, "error_guidance": 0.2, "contribution_path": 0.2}, "failure_classification": {"category": "semantic_drift", "description": "The experiment aimed to fix a syntax error (unclosed bash block) and refine instructions while explicitly avoiding semantic drift. The score of 0.8000 suggests that while some improvements were made (likely the syntax fix), the attempt to refine instructions either inadvertently introduced subtle changes in meaning or reduced the accuracy of the content, thereby causing semantic drift despite the hypothesis's constraint.", "fix_direction": "Implement stricter semantic validation processes for textual refinements. This could involve careful human review to ensure that clarity improvements do not alter the original meaning, or potentially using tools for semantic similarity checks to flag potential drifts.", "confidence": 0.85}, "drafts_generated": 1, "drafts_survived": 1}
{"id": "c6b4ba5a-37d7-48a8-ab22-b107fc5e707c", "target_id": "B5-control", "git_sha": "db0f073913e3886b10c7f61bbb5706269e962226", "pre_experiment_sha": "11b2796315027524cef990c2dbdd5a317710340c", "timestamp": "2026-04-22T16:53:05.868489+00:00", "hypothesis": "Removing concrete examples like specific Python versions and tightening the mapping of requirements directly into the dedicated and mandatory sections will reduce semantic drift while improving API documentation and prerequisite clarity.", "hypothesis_source": "agent", "mutation_diff_summary": "", "score": 2.8, "score_ci_lower": 2.4, "score_ci_upper": 3.0, "raw_scores": [3.0, 3.0, 3.0, 3.0, 2.0], "baseline_score": 2.6, "outcome": "KEPT", "failure_mode": null, "duration_seconds": 73.26184874982573, "tags": ["prompt-engineering", "documentation", "criteria-targeting", "semantic-drift-reduction"], "learnings": "{\"what_changed\":\"\",\"what_improved\":[\"quick_start_present: PASS (was FAIL)\",\"prerequisites_clear: PASS (was FAIL)\",\"examples_runnable: PASS (was FAIL)\",\"contribution_path: PASS (was FAIL)\"],\"what_regressed\":[],\"transferable_insight\":\"Replacing overly specific examples with generalized requirements consolidated into dedicated, mandatory sections improves overall clarity and reduces semantic drift in instructional content.\",\"domain_tags\":[\"Documentation\",\"Technical Writing\",\"Information Architecture\"]}", "cost_usd": 0.0323183, "bootstrap_seed": 0, "agent_model": "gemini-3.1-pro-preview", "held_out_score": null, "criterion_names": ["quick_start_present", "api_documented", "prerequisites_clear", "examples_runnable", "error_guidance", "contribution_path"], "per_criterion_scores": {"quick_start_present": 0.5, "api_documented": 0.0, "prerequisites_clear": 0.6, "examples_runnable": 0.8, "error_guidance": 0.1, "contribution_path": 0.8}, "failure_classification": null, "drafts_generated": 1, "drafts_survived": 1}
{"id": "732d1381-0c63-4faa-95aa-663647d6c8fa", "target_id": "B5-control", "git_sha": "db0f073913e3886b10c7f61bbb5706269e962226", "pre_experiment_sha": "db0f073913e3886b10c7f61bbb5706269e962226", "timestamp": "2026-04-22T16:54:10.149976+00:00", "hypothesis": "Enhance the descriptions for the API Reference and Troubleshooting sections by using more precise technical terminology (e.g., \"positional arguments\", \"root causes\") to encourage deeper, more comprehensive content generation without introducing concrete examples that cause semantic drift.", "hypothesis_source": "agent", "mutation_diff_summary": "", "score": 1.2, "score_ci_lower": 0.6, "score_ci_upper": 1.9, "raw_scores": [0.5, 1.0, 2.5, 0.5, 1.5], "baseline_score": 2.8, "outcome": "DISCARDED", "failure_mode": null, "duration_seconds": 58.3459887499921, "tags": ["prompt-engineering", "documentation", "criteria-targeting", "content-expansion"], "learnings": "{\"what_changed\":\"\",\"what_improved\":[],\"what_regressed\":[\"quick_start_present: FAIL (was PASS)\",\"prerequisites_clear: FAIL (was PASS)\",\"examples_runnable: FAIL (was PASS)\",\"contribution_path: FAIL (was PASS)\"],\"transferable_insight\":\"Over-indexing on abstract technical terminology while explicitly avoiding concrete examples degrades the model's ability to generate practical, foundational content.\",\"domain_tags\":[\"Prompt Engineering\",\"Content Generation\",\"LLM Behavior\"]}", "cost_usd": 0.028732249999999997, "bootstrap_seed": 0, "agent_model": "gemini-3.1-pro-preview", "held_out_score": null, "criterion_names": ["quick_start_present", "api_documented", "prerequisites_clear", "examples_runnable", "error_guidance", "contribution_path"], "per_criterion_scores": {"quick_start_present": 0.4, "api_documented": 0.0, "prerequisites_clear": 0.1, "examples_runnable": 0.3, "error_guidance": 0.0, "contribution_path": 0.4}, "failure_classification": {"category": "semantic_drift", "description": "The experiment aimed to use precise technical terminology to encourage deeper, more comprehensive content, while explicitly trying to avoid semantic drift from concrete examples. The low score (1.2000) suggests that the generated content, despite using the specified terminology, failed to convey the intended deeper and comprehensive meaning. This could be due to the model misinterpreting the precise terms, generating overly abstract or generic explanations that lack true depth, or subtly misapplying the terms in a way that deviates from the desired meaning for API Reference and Troubleshooting sections, even without introducing concrete examples.", "fix_direction": "Re-evaluate the strategy for prompting deeper and comprehensive content using precise terminology. Consider whether terminology alone is sufficient or if the model needs more explicit guidance on *how* to elaborate. This might involve providing structured templates for explanations, carefully designed meta-instructions for expanding on terms, or exploring methods to provide controlled, abstract examples or analogies that guide depth without causing semantic drift.", "confidence": 0.9}, "drafts_generated": 1, "drafts_survived": 1}
