{"id": "e0a506fa-3c34-4580-9262-980fd77462d6", "target_id": "B5-control", "git_sha": "6561d635aca93cd8e46d22ed25c02624793edb89", "pre_experiment_sha": "b9295e2c2cd90d8dba5ddf5be5a80c713266ee04", "timestamp": "2026-04-07T18:21:51.358338+00:00", "hypothesis": "No hypothesis provided", "hypothesis_source": "synthesized", "mutation_diff_summary": "", "score": 1.1, "score_ci_lower": 0.5, "score_ci_upper": 1.6, "raw_scores": [2.0, 0.0, 1.0, 1.5, 1.0], "baseline_score": 0.0, "outcome": "KEPT", "failure_mode": null, "duration_seconds": 115.94809237500158, "tags": [], "learnings": "{\"what_changed\":\"\",\"what_improved\":[],\"what_regressed\":[],\"transferable_insight\":\"No hypothesis provided\",\"domain_tags\":[]}", "cost_usd": 0.46753140000000004, "bootstrap_seed": 0, "agent_model": "claude-sonnet-4-6", "held_out_score": null, "criterion_names": ["quick_start_present", "api_documented", "prerequisites_clear", "examples_runnable", "error_guidance", "contribution_path"], "per_criterion_scores": {"quick_start_present": 0.4, "api_documented": 0.0, "prerequisites_clear": 0.0, "examples_runnable": 0.2, "error_guidance": 0.1, "contribution_path": 0.4}, "failure_classification": null, "drafts_generated": 1, "drafts_survived": 1}
{"id": "27486f01-7896-4c37-8f14-76ebfb6f1284", "target_id": "B5-control", "git_sha": "6561d635aca93cd8e46d22ed25c02624793edb89", "pre_experiment_sha": "6561d635aca93cd8e46d22ed25c02624793edb89", "timestamp": "2026-04-07T18:23:55.303628+00:00", "hypothesis": "No hypothesis provided", "hypothesis_source": "synthesized", "mutation_diff_summary": "", "score": 1.6, "score_ci_lower": 0.6, "score_ci_upper": 2.4, "raw_scores": [0.0, 2.0, 1.0, 2.0, 3.0], "baseline_score": 1.1, "outcome": "DISCARDED", "failure_mode": null, "duration_seconds": 123.44534741599637, "tags": [], "learnings": "{\"what_changed\":\"\",\"what_improved\":[],\"what_regressed\":[],\"transferable_insight\":\"No hypothesis provided\",\"domain_tags\":[]}", "cost_usd": 0.5277078, "bootstrap_seed": 0, "agent_model": "claude-sonnet-4-6", "held_out_score": null, "criterion_names": ["quick_start_present", "api_documented", "prerequisites_clear", "examples_runnable", "error_guidance", "contribution_path"], "per_criterion_scores": {"quick_start_present": 0.4, "api_documented": 0.0, "prerequisites_clear": 0.4, "examples_runnable": 0.2, "error_guidance": 0.4, "contribution_path": 0.2}, "failure_classification": {"category": "output_format", "description": "The experiment failed due to a violation of the required output structure or schema.", "fix_direction": "Ensure the output strictly adheres to the specified schema or format requirements.", "confidence": 0.9}, "drafts_generated": 1, "drafts_survived": 1}
{"id": "b5f42ae3-31f1-47dd-aa6d-8db28f9b3443", "target_id": "B5-control", "git_sha": "6561d635aca93cd8e46d22ed25c02624793edb89", "pre_experiment_sha": "6561d635aca93cd8e46d22ed25c02624793edb89", "timestamp": "2026-04-07T18:26:53.226185+00:00", "hypothesis": "No hypothesis provided", "hypothesis_source": "synthesized", "mutation_diff_summary": "", "score": 1.2, "score_ci_lower": 0.4, "score_ci_upper": 2.2, "raw_scores": [0.0, 1.0, 1.0, 3.0, 1.0], "baseline_score": 1.1, "outcome": "DISCARDED", "failure_mode": null, "duration_seconds": 175.7020939579961, "tags": [], "learnings": "{\"what_changed\":\"\",\"what_improved\":[],\"what_regressed\":[],\"transferable_insight\":\"No hypothesis provided\",\"domain_tags\":[]}", "cost_usd": 0.50422175, "bootstrap_seed": 0, "agent_model": "claude-sonnet-4-6", "held_out_score": null, "criterion_names": ["quick_start_present", "api_documented", "prerequisites_clear", "examples_runnable", "error_guidance", "contribution_path"], "per_criterion_scores": {"quick_start_present": 0.6, "api_documented": 0.0, "prerequisites_clear": 0.2, "examples_runnable": 0.0, "error_guidance": 0.0, "contribution_path": 0.4}, "failure_classification": {"category": "output_format", "description": "The experiment failed because there was no hypothesis provided, violating the expected output schema which likely requires a hypothesis field.", "fix_direction": "Ensure all required output fields are present and properly formatted.", "confidence": 0.95}, "drafts_generated": 1, "drafts_survived": 1}
{"id": "00dec3ce-76d8-48b9-9fde-76b6cba85663", "target_id": "B5-control", "git_sha": "ee495790c3254e4d09181b65412d62a6ef2f53d0", "pre_experiment_sha": "6561d635aca93cd8e46d22ed25c02624793edb89", "timestamp": "2026-04-07T18:29:36.766920+00:00", "hypothesis": "No hypothesis provided", "hypothesis_source": "synthesized", "mutation_diff_summary": "", "score": 1.6, "score_ci_lower": 0.8, "score_ci_upper": 2.2, "raw_scores": [1.5, 0.0, 2.5, 2.0, 2.0], "baseline_score": 1.1, "outcome": "KEPT", "failure_mode": null, "duration_seconds": 161.61816158299916, "tags": [], "learnings": "{\"what_changed\":\"\",\"what_improved\":[],\"what_regressed\":[],\"transferable_insight\":\"No hypothesis provided\",\"domain_tags\":[]}", "cost_usd": 0.5659122, "bootstrap_seed": 0, "agent_model": "claude-sonnet-4-6", "held_out_score": null, "criterion_names": ["quick_start_present", "api_documented", "prerequisites_clear", "examples_runnable", "error_guidance", "contribution_path"], "per_criterion_scores": {"quick_start_present": 0.4, "api_documented": 0.0, "prerequisites_clear": 0.1, "examples_runnable": 0.2, "error_guidance": 0.3, "contribution_path": 0.6}, "failure_classification": null, "drafts_generated": 1, "drafts_survived": 1}
{"id": "b8d8eafa-6dc4-44a1-9e6a-fe719602d5e2", "target_id": "B5-control", "git_sha": "ee495790c3254e4d09181b65412d62a6ef2f53d0", "pre_experiment_sha": "ee495790c3254e4d09181b65412d62a6ef2f53d0", "timestamp": "2026-04-07T18:32:51.378726+00:00", "hypothesis": "No hypothesis provided", "hypothesis_source": "synthesized", "mutation_diff_summary": "", "score": 2.5, "score_ci_lower": 0.8, "score_ci_upper": 4.2, "raw_scores": [4.5, 5.0, 2.0, 1.0, 0.0], "baseline_score": 1.6, "outcome": "DISCARDED", "failure_mode": null, "duration_seconds": 194.10091158299474, "tags": [], "learnings": "{\"what_changed\":\"\",\"what_improved\":[],\"what_regressed\":[],\"transferable_insight\":\"No hypothesis provided\",\"domain_tags\":[]}", "cost_usd": 0.5685319000000001, "bootstrap_seed": 0, "agent_model": "claude-sonnet-4-6", "held_out_score": null, "criterion_names": ["quick_start_present", "api_documented", "prerequisites_clear", "examples_runnable", "error_guidance", "contribution_path"], "per_criterion_scores": {"quick_start_present": 0.4, "api_documented": 0.0, "prerequisites_clear": 0.3, "examples_runnable": 0.4, "error_guidance": 0.6, "contribution_path": 0.8}, "failure_classification": {"category": "output_format", "description": "The experiment failed to provide a hypothesis, which violates the required output schema/structure.", "fix_direction": "Ensure all required sections, especially the hypothesis, are included in submissions.", "confidence": 0.95}, "drafts_generated": 1, "drafts_survived": 1}
{"id": "660177a8-10ad-4679-a55d-677a4fc51623", "target_id": "B5-control", "git_sha": "ee495790c3254e4d09181b65412d62a6ef2f53d0", "pre_experiment_sha": "ee495790c3254e4d09181b65412d62a6ef2f53d0", "timestamp": "2026-04-07T18:36:01.589138+00:00", "hypothesis": "No hypothesis provided", "hypothesis_source": "synthesized", "mutation_diff_summary": "", "score": 1.4, "score_ci_lower": 1.0, "score_ci_upper": 1.8, "raw_scores": [2.0, 2.0, 1.0, 1.0, 1.0], "baseline_score": 1.6, "outcome": "DISCARDED", "failure_mode": null, "duration_seconds": 188.6264154590026, "tags": [], "learnings": "{\"what_changed\":\"\",\"what_improved\":[],\"what_regressed\":[],\"transferable_insight\":\"No hypothesis provided\",\"domain_tags\":[]}", "cost_usd": 0.56064005, "bootstrap_seed": 0, "agent_model": "claude-sonnet-4-6", "held_out_score": null, "criterion_names": ["quick_start_present", "api_documented", "prerequisites_clear", "examples_runnable", "error_guidance", "contribution_path"], "per_criterion_scores": {"quick_start_present": 0.6, "api_documented": 0.0, "prerequisites_clear": 0.2, "examples_runnable": 0.0, "error_guidance": 0.0, "contribution_path": 0.6}, "failure_classification": {"category": "output_format", "description": "The experiment failed due to an output structure or schema violation. This is suggested by the absence of a hypothesis, the unknown failure mode, and the assignment of a low score, which often corresponds to fundamental errors such as breaking the required output format.", "fix_direction": "Ensure the output strictly adheres to the required structure or schema. Implement rigorous validation checks before submission.", "confidence": 0.8}, "drafts_generated": 1, "drafts_survived": 1}
{"id": "58416743-635b-426f-8be0-8001e4e85366", "target_id": "B5-control", "git_sha": "ee495790c3254e4d09181b65412d62a6ef2f53d0", "pre_experiment_sha": "ee495790c3254e4d09181b65412d62a6ef2f53d0", "timestamp": "2026-04-07T18:38:25.096987+00:00", "hypothesis": "No hypothesis provided", "hypothesis_source": "synthesized", "mutation_diff_summary": "", "score": 2.0, "score_ci_lower": 1.4, "score_ci_upper": 2.6, "raw_scores": [2.0, 2.0, 1.0, 3.0, 2.0], "baseline_score": 1.6, "outcome": "DISCARDED", "failure_mode": null, "duration_seconds": 141.31871658399905, "tags": [], "learnings": "{\"what_changed\":\"\",\"what_improved\":[],\"what_regressed\":[],\"transferable_insight\":\"No hypothesis provided\",\"domain_tags\":[]}", "cost_usd": 0.47682040000000003, "bootstrap_seed": 0, "agent_model": "claude-sonnet-4-6", "held_out_score": null, "criterion_names": ["quick_start_present", "api_documented", "prerequisites_clear", "examples_runnable", "error_guidance", "contribution_path"], "per_criterion_scores": {"quick_start_present": 0.8, "api_documented": 0.0, "prerequisites_clear": 0.4, "examples_runnable": 0.2, "error_guidance": 0.2, "contribution_path": 0.4}, "failure_classification": {"category": "output_format", "description": "The provided information lacks a hypothesis, which violates the expected output schema for experiment documentation.", "fix_direction": "Ensure all required fields (such as the hypothesis) are provided in the experiment output.", "confidence": 0.9}, "drafts_generated": 1, "drafts_survived": 1}
{"id": "8cc366eb-59fa-4de4-be4e-606e9b56a9f5", "target_id": "B5-control", "git_sha": "6baf20d966937a1213a649675fc2a8446d96be47", "pre_experiment_sha": "ee495790c3254e4d09181b65412d62a6ef2f53d0", "timestamp": "2026-04-07T18:42:13.929825+00:00", "hypothesis": "No hypothesis provided", "hypothesis_source": "synthesized", "mutation_diff_summary": "", "score": 2.7, "score_ci_lower": 1.7, "score_ci_upper": 3.6, "raw_scores": [3.0, 2.0, 1.0, 4.0, 3.5], "baseline_score": 1.6, "outcome": "KEPT", "failure_mode": null, "duration_seconds": 227.08584616699954, "tags": [], "learnings": "{\"what_changed\":\"\",\"what_improved\":[],\"what_regressed\":[],\"transferable_insight\":\"No hypothesis provided\",\"domain_tags\":[]}", "cost_usd": 0.6820443, "bootstrap_seed": 0, "agent_model": "claude-sonnet-4-6", "held_out_score": null, "criterion_names": ["quick_start_present", "api_documented", "prerequisites_clear", "examples_runnable", "error_guidance", "contribution_path"], "per_criterion_scores": {"quick_start_present": 0.8, "api_documented": 0.0, "prerequisites_clear": 0.6, "examples_runnable": 0.6, "error_guidance": 0.3, "contribution_path": 0.4}, "failure_classification": null, "drafts_generated": 1, "drafts_survived": 1}
{"id": "d824cd7a-9cd5-4ecb-9963-f4f94ec0b509", "target_id": "B5-control", "git_sha": "6baf20d966937a1213a649675fc2a8446d96be47", "pre_experiment_sha": "6baf20d966937a1213a649675fc2a8446d96be47", "timestamp": "2026-04-07T18:43:42.380427+00:00", "hypothesis": "No hypothesis provided", "hypothesis_source": "synthesized", "mutation_diff_summary": "", "score": 0.4, "score_ci_lower": 0.0, "score_ci_upper": 0.8, "raw_scores": [0.0, 1.0, 1.0, 0.0, 0.0], "baseline_score": 2.7, "outcome": "DISCARDED", "failure_mode": null, "duration_seconds": 88.00471012499474, "tags": [], "learnings": "{\"what_changed\":\"\",\"what_improved\":[],\"what_regressed\":[],\"transferable_insight\":\"No hypothesis provided\",\"domain_tags\":[]}", "cost_usd": 0.339554, "bootstrap_seed": 0, "agent_model": "claude-sonnet-4-6", "held_out_score": null, "criterion_names": ["quick_start_present", "api_documented", "prerequisites_clear", "examples_runnable", "error_guidance", "contribution_path"], "per_criterion_scores": {"quick_start_present": 0.2, "api_documented": 0.0, "prerequisites_clear": 0.0, "examples_runnable": 0.0, "error_guidance": 0.0, "contribution_path": 0.2}, "failure_classification": {"category": "output_format", "description": "The experiment likely failed due to violation of the required output structure or schema, as indicated by a moderate score and absence of identifiable hypothesis or logic error.", "fix_direction": "Ensure strict adherence to the prescribed output format or schema in future experiment outputs.", "confidence": 0.8}, "drafts_generated": 1, "drafts_survived": 1}
{"id": "65073153-c0e9-4369-9021-bbc001a91ff8", "target_id": "B5-control", "git_sha": "6baf20d966937a1213a649675fc2a8446d96be47", "pre_experiment_sha": "6baf20d966937a1213a649675fc2a8446d96be47", "timestamp": "2026-04-07T18:46:06.452223+00:00", "hypothesis": "No hypothesis provided", "hypothesis_source": "synthesized", "mutation_diff_summary": "", "score": 2.5, "score_ci_lower": 2.0, "score_ci_upper": 3.1, "raw_scores": [2.0, 2.0, 3.5, 2.0, 3.0], "baseline_score": 2.7, "outcome": "DISCARDED", "failure_mode": null, "duration_seconds": 142.23774587499793, "tags": [], "learnings": "{\"what_changed\":\"\",\"what_improved\":[],\"what_regressed\":[],\"transferable_insight\":\"No hypothesis provided\",\"domain_tags\":[]}", "cost_usd": 0.50966305, "bootstrap_seed": 0, "agent_model": "claude-sonnet-4-6", "held_out_score": null, "criterion_names": ["quick_start_present", "api_documented", "prerequisites_clear", "examples_runnable", "error_guidance", "contribution_path"], "per_criterion_scores": {"quick_start_present": 0.4, "api_documented": 0.2, "prerequisites_clear": 0.2, "examples_runnable": 0.5, "error_guidance": 0.6, "contribution_path": 0.6}, "failure_classification": {"category": "output_format", "description": "The provided score uses excessive decimal precision (2.5000) and there is reference to unknown/undefined fields (no hypothesis, unknown failure mode), which may violate the required output structure/schema.", "fix_direction": "Ensure all experiment reports strictly follow the required output structure, with all necessary fields populated and values formatted as specified.", "confidence": 0.8}, "drafts_generated": 1, "drafts_survived": 1}
{"id": "f85571f9-4583-4c2f-bcb5-5bc4ad3eb0b0", "target_id": "B5-control", "git_sha": "6baf20d966937a1213a649675fc2a8446d96be47", "pre_experiment_sha": "6baf20d966937a1213a649675fc2a8446d96be47", "timestamp": "2026-04-07T18:48:36.415457+00:00", "hypothesis": "No hypothesis provided", "hypothesis_source": "synthesized", "mutation_diff_summary": "", "score": 1.8, "score_ci_lower": 1.2, "score_ci_upper": 2.4, "raw_scores": [1.0, 2.0, 1.0, 2.0, 3.0], "baseline_score": 2.7, "outcome": "DISCARDED", "failure_mode": null, "duration_seconds": 147.65529179199802, "tags": [], "learnings": "{\"what_changed\":\"\",\"what_improved\":[],\"what_regressed\":[],\"transferable_insight\":\"No hypothesis provided\",\"domain_tags\":[]}", "cost_usd": 0.48191040000000007, "bootstrap_seed": 0, "agent_model": "claude-sonnet-4-6", "held_out_score": null, "criterion_names": ["quick_start_present", "api_documented", "prerequisites_clear", "examples_runnable", "error_guidance", "contribution_path"], "per_criterion_scores": {"quick_start_present": 0.4, "api_documented": 0.0, "prerequisites_clear": 0.4, "examples_runnable": 0.2, "error_guidance": 0.4, "contribution_path": 0.4}, "failure_classification": {"category": "output_format", "description": "The experiment failed due to an output structure or schema violation. This is indicated by the reference to output format in the provided categories and the typical score range for format failures.", "fix_direction": "Ensure output strictly matches the required schema and structure for future attempts.", "confidence": 0.85}, "drafts_generated": 1, "drafts_survived": 1}
{"id": "953684d0-4d22-4c77-b562-e8818336198f", "target_id": "B5-control", "git_sha": "6baf20d966937a1213a649675fc2a8446d96be47", "pre_experiment_sha": "6baf20d966937a1213a649675fc2a8446d96be47", "timestamp": "2026-04-07T18:50:57.125039+00:00", "hypothesis": "No hypothesis provided", "hypothesis_source": "synthesized", "mutation_diff_summary": "", "score": 1.2, "score_ci_lower": 0.0, "score_ci_upper": 2.8, "raw_scores": [0.0, 4.0, 2.0, 0.0, 0.0], "baseline_score": 2.7, "outcome": "DISCARDED", "failure_mode": null, "duration_seconds": 138.81292366699927, "tags": [], "learnings": "{\"what_changed\":\"\",\"what_improved\":[],\"what_regressed\":[],\"transferable_insight\":\"No hypothesis provided\",\"domain_tags\":[]}", "cost_usd": 0.4972802, "bootstrap_seed": 0, "agent_model": "claude-sonnet-4-6", "held_out_score": null, "criterion_names": ["quick_start_present", "api_documented", "prerequisites_clear", "examples_runnable", "error_guidance", "contribution_path"], "per_criterion_scores": {"quick_start_present": 0.4, "api_documented": 0.0, "prerequisites_clear": 0.2, "examples_runnable": 0.2, "error_guidance": 0.0, "contribution_path": 0.4}, "failure_classification": {"category": "output_format", "description": "The experiment failed due to a violation of the required output structure or schema. This is indicated by the absence of a provided hypothesis despite it being expected, and the overall rating is very low, suggesting an early or basic structural failure.", "fix_direction": "Ensure all required fields (such as hypothesis) are provided and the output strictly matches the expected schema.", "confidence": 0.9}, "drafts_generated": 1, "drafts_survived": 1}
{"id": "96dc6510-97d8-475c-ba4f-ccef29f42bc0", "target_id": "B5-control", "git_sha": "6baf20d966937a1213a649675fc2a8446d96be47", "pre_experiment_sha": "6baf20d966937a1213a649675fc2a8446d96be47", "timestamp": "2026-04-07T18:53:49.287919+00:00", "hypothesis": "No hypothesis provided", "hypothesis_source": "synthesized", "mutation_diff_summary": "", "score": 1.4, "score_ci_lower": 0.0, "score_ci_upper": 3.4, "raw_scores": [5.0, 0.0, 0.0, 2.0, 0.0], "baseline_score": 2.7, "outcome": "DISCARDED", "failure_mode": null, "duration_seconds": 169.80111270799534, "tags": [], "learnings": "{\"what_changed\":\"\",\"what_improved\":[],\"what_regressed\":[],\"transferable_insight\":\"No hypothesis provided\",\"domain_tags\":[]}", "cost_usd": 0.5041019, "bootstrap_seed": 0, "agent_model": "claude-sonnet-4-6", "held_out_score": null, "criterion_names": ["quick_start_present", "api_documented", "prerequisites_clear", "examples_runnable", "error_guidance", "contribution_path"], "per_criterion_scores": {"quick_start_present": 0.2, "api_documented": 0.0, "prerequisites_clear": 0.2, "examples_runnable": 0.2, "error_guidance": 0.4, "contribution_path": 0.4}, "failure_classification": {"category": "output_format", "description": "The experiment lacks a clear hypothesis and records 'unknown' as the failure mode, indicating a violation in the required output structure or schema.", "fix_direction": "Ensure all required fields are provided and adhere to the expected schema, including specifying the hypothesis and failure mode.", "confidence": 0.85}, "drafts_generated": 1, "drafts_survived": 1}
{"id": "d890c4a2-7fa2-4c40-9ce5-53acf7e4c3fc", "target_id": "B5-control", "git_sha": "6baf20d966937a1213a649675fc2a8446d96be47", "pre_experiment_sha": "6baf20d966937a1213a649675fc2a8446d96be47", "timestamp": "2026-04-07T18:56:25.673002+00:00", "hypothesis": "No hypothesis provided", "hypothesis_source": "synthesized", "mutation_diff_summary": "", "score": 1.4, "score_ci_lower": 0.6, "score_ci_upper": 2.0, "raw_scores": [2.0, 0.0, 2.0, 2.0, 1.0], "baseline_score": 2.7, "outcome": "DISCARDED", "failure_mode": null, "duration_seconds": 154.15757133299485, "tags": [], "learnings": "{\"what_changed\":\"\",\"what_improved\":[],\"what_regressed\":[],\"transferable_insight\":\"No hypothesis provided\",\"domain_tags\":[]}", "cost_usd": 0.47617639999999994, "bootstrap_seed": 0, "agent_model": "claude-sonnet-4-6", "held_out_score": null, "criterion_names": ["quick_start_present", "api_documented", "prerequisites_clear", "examples_runnable", "error_guidance", "contribution_path"], "per_criterion_scores": {"quick_start_present": 0.4, "api_documented": 0.0, "prerequisites_clear": 0.2, "examples_runnable": 0.2, "error_guidance": 0.2, "contribution_path": 0.4}, "failure_classification": {"category": "output_format", "description": "The experiment failed due to a violation of the required output structure or schema, as indicated by the output format not meeting specifications.", "fix_direction": "Ensure strict compliance with the expected output schema or structure.", "confidence": 0.95}, "drafts_generated": 1, "drafts_survived": 1}
