{"id": "88e3976c-e796-4c87-a972-81d227223496", "target_id": "B5-greedy", "git_sha": "b8c82b77394fc5f506cdc8d1da9f51f0200e5b94", "pre_experiment_sha": "b8c82b77394fc5f506cdc8d1da9f51f0200e5b94", "timestamp": "2026-04-19T18:29:52.229773+00:00", "hypothesis": "Expand the sparse README into a full operator-focused technical manual with concrete setup, configuration, CLI, I/O, workflows, and troubleshooting.", "hypothesis_source": "agent", "mutation_diff_summary": "", "score": 1.3, "score_ci_lower": 0.4, "score_ci_upper": 2.2, "raw_scores": [0.0, 2.0, 2.5, 2.0, 0.0], "baseline_score": 1.2, "outcome": "DISCARDED", "failure_mode": null, "duration_seconds": 122.59223425004166, "tags": ["readme", "technical-docs", "cli", "operations", "csv", "yaml"], "learnings": "{\"what_changed\":\"\",\"what_improved\":[],\"what_regressed\":[],\"transferable_insight\":\"When a brief artifact is meant for operators or users, expanding it into a concrete, task-oriented manual with setup, configuration, workflows, and troubleshooting can materially improve usability even if no other content changes.\",\"domain_tags\":[\"documentation\",\"usability\",\"technical-writing\"]}", "cost_usd": 0.16512875000000002, "bootstrap_seed": 0, "agent_model": "gpt-5.4", "held_out_score": null, "criterion_names": ["quick_start_present", "api_documented", "prerequisites_clear", "examples_runnable", "error_guidance", "contribution_path"], "per_criterion_scores": {"quick_start_present": 0.2, "api_documented": 0.3, "prerequisites_clear": 0.1, "examples_runnable": 0.1, "error_guidance": 0.0, "contribution_path": 0.6}, "failure_classification": {"category": "incomplete_edit", "description": "The attempt failed to produce a complete, consistent operator-focused technical manual from the sparse README\u2014leaving the deliverable partial/inconsistent rather than fully expanded with the required setup, configuration, CLI, I/O, workflows, and troubleshooting sections.", "fix_direction": "Expand the README into a fully consistent manual: ensure all required sections are present, verify end-to-end CLI/I/O examples and workflows, and add troubleshooting with concrete commands and expected outputs.", "confidence": 0.62}, "drafts_generated": 1, "drafts_survived": 1}
{"id": "4cec01d6-6e4f-4bd1-a277-37aaca743f55", "target_id": "B5-greedy", "git_sha": "b8c82b77394fc5f506cdc8d1da9f51f0200e5b94", "pre_experiment_sha": "b8c82b77394fc5f506cdc8d1da9f51f0200e5b94", "timestamp": "2026-04-19T18:31:44.489378+00:00", "hypothesis": "Expand the sparse README into a complete operator-focused manual with concrete setup, configuration, CLI, I/O, workflow, and troubleshooting details.", "hypothesis_source": "agent", "mutation_diff_summary": "", "score": 0.6, "score_ci_lower": 0.1, "score_ci_upper": 1.1, "raw_scores": [0.0, 0.0, 1.0, 1.5, 0.5], "baseline_score": 1.2, "outcome": "DISCARDED", "failure_mode": null, "duration_seconds": 109.67831900005694, "tags": ["readme", "technical-docs", "cli", "operations", "configuration"], "learnings": "{\"what_changed\":\"\",\"what_improved\":[],\"what_regressed\":[],\"transferable_insight\":\"When expanding minimal documentation, prioritize adding concrete, task-oriented guidance and operational details that help users actually use the system rather than merely describing it at a high level.\",\"domain_tags\":[\"documentation\",\"usability\",\"technical-writing\"]}", "cost_usd": 0.16058595000000003, "bootstrap_seed": 0, "agent_model": "gpt-5.4", "held_out_score": null, "criterion_names": ["quick_start_present", "api_documented", "prerequisites_clear", "examples_runnable", "error_guidance", "contribution_path"], "per_criterion_scores": {"quick_start_present": 0.0, "api_documented": 0.1, "prerequisites_clear": 0.0, "examples_runnable": 0.0, "error_guidance": 0.1, "contribution_path": 0.4}, "failure_classification": {"category": "incomplete_edit", "description": "The experiment aimed to expand the README into a complete operator manual, but the result appears to be only partially realized or left inconsistent/incomplete\u2014indicating missing setup/config/CLI/I/O/workflow or troubleshooting details rather than a parse/format or logic issue.", "fix_direction": "Ensure the README expansion is end-to-end: add concrete installation/setup steps, full configuration schema, CLI examples with expected inputs/outputs, a clear operator workflow, and a troubleshooting section; verify internal consistency across sections (commands match config keys, I/O examples match documented formats).", "confidence": 0.62}, "drafts_generated": 1, "drafts_survived": 1}
{"id": "038a58ab-dc62-4963-9904-817584a2b6d6", "target_id": "B5-greedy", "git_sha": "b8c82b77394fc5f506cdc8d1da9f51f0200e5b94", "pre_experiment_sha": "b8c82b77394fc5f506cdc8d1da9f51f0200e5b94", "timestamp": "2026-04-19T18:33:40.900334+00:00", "hypothesis": "Expand the sparse README into a complete operator-focused technical manual with setup, configuration, CLI, I/O contracts, workflows, examples, and troubleshooting.", "hypothesis_source": "agent", "mutation_diff_summary": "", "score": 0.1, "score_ci_lower": 0.0, "score_ci_upper": 0.3, "raw_scores": [0.0, 0.5, 0.0, 0.0, 0.0], "baseline_score": 1.2, "outcome": "DISCARDED", "failure_mode": null, "duration_seconds": 113.98059433302842, "tags": ["readme", "technical-docs", "cli", "operations", "csv", "yaml"], "learnings": "{\"what_changed\":\"\",\"what_improved\":[],\"what_regressed\":[],\"transferable_insight\":\"A broad expansion can fail if it adds general completeness without first anchoring the content to the specific needs, workflows, and constraints of the intended operator audience.\",\"domain_tags\":[\"documentation\",\"product-design\",\"user-experience\"]}", "cost_usd": 0.14525535000000003, "bootstrap_seed": 0, "agent_model": "gpt-5.4", "held_out_score": null, "criterion_names": ["quick_start_present", "api_documented", "prerequisites_clear", "examples_runnable", "error_guidance", "contribution_path"], "per_criterion_scores": {"quick_start_present": 0.0, "api_documented": 0.0, "prerequisites_clear": 0.0, "examples_runnable": 0.0, "error_guidance": 0.1, "contribution_path": 0.0}, "failure_classification": {"category": "incomplete_edit", "description": "The attempt did not produce a complete operator-focused technical manual; it appears to have left the README only partially expanded/inconsistently documented across required areas (setup, configuration, CLI, I/O contracts, workflows, examples, troubleshooting).", "fix_direction": "Ensure the edit fully covers all specified manual sections end-to-end with consistent structure, required interfaces/contracts, and runnable examples; verify no missing or placeholder content remains.", "confidence": 0.78}, "drafts_generated": 1, "drafts_survived": 1}
{"id": "10f719a8-2b62-4ba8-831f-367a88e305ef", "target_id": "B5-greedy", "git_sha": "b8c82b77394fc5f506cdc8d1da9f51f0200e5b94", "pre_experiment_sha": "b8c82b77394fc5f506cdc8d1da9f51f0200e5b94", "timestamp": "2026-04-19T18:35:58.218264+00:00", "hypothesis": "Expand the sparse overview into a complete operator-focused README with setup, configuration, CLI contracts, workflows, examples, and troubleshooting.", "hypothesis_source": "agent", "mutation_diff_summary": "", "score": 0.3, "score_ci_lower": 0.0, "score_ci_upper": 0.7, "raw_scores": [0.0, 0.0, 0.0, 0.5, 1.0], "baseline_score": 1.2, "outcome": "DISCARDED", "failure_mode": null, "duration_seconds": 129.46943874994759, "tags": ["readme", "technical-docs", "cli", "operations", "csv", "yaml"], "learnings": "{\"what_changed\":\"\",\"what_improved\":[],\"what_regressed\":[],\"transferable_insight\":\"When expanding a brief overview into a full guide, adding comprehensive structure and detail can still fail if it does not materially improve clarity, usability, or task completion for the intended audience.\",\"domain_tags\":[\"documentation\",\"usability\",\"content-design\"]}", "cost_usd": 0.18708775000000002, "bootstrap_seed": 0, "agent_model": "gpt-5.4", "held_out_score": null, "criterion_names": ["quick_start_present", "api_documented", "prerequisites_clear", "examples_runnable", "error_guidance", "contribution_path"], "per_criterion_scores": {"quick_start_present": 0.1, "api_documented": 0.1, "prerequisites_clear": 0.0, "examples_runnable": 0.0, "error_guidance": 0.0, "contribution_path": 0.1}, "failure_classification": {"category": "incomplete_edit", "description": "The experiment\u2019s output appears only as a partial attempt (sparse overview) rather than a complete operator-focused README covering setup, configuration, CLI contracts, workflows, examples, and troubleshooting, leaving an inconsistent/incomplete documentation state relative to the hypothesis requirements.", "fix_direction": "Ensure the README draft fully satisfies all required sections and operator-facing contracts (setup/config/CLI/workflows/examples/troubleshooting) with consistent structure and complete coverage.", "confidence": 0.78}, "drafts_generated": 1, "drafts_survived": 1}
{"id": "671ad20a-bf99-4590-92f6-f2e781805759", "target_id": "B5-greedy", "git_sha": "b8c82b77394fc5f506cdc8d1da9f51f0200e5b94", "pre_experiment_sha": "b8c82b77394fc5f506cdc8d1da9f51f0200e5b94", "timestamp": "2026-04-19T18:38:03.821134+00:00", "hypothesis": "Expand the sparse project note into a complete operator-facing technical README with setup, configuration, usage, I/O contracts, workflows, and troubleshooting.", "hypothesis_source": "agent", "mutation_diff_summary": "", "score": 0.2, "score_ci_lower": 0.0, "score_ci_upper": 0.6, "raw_scores": [0.0, 0.0, 0.0, 1.0, 0.0], "baseline_score": 1.2, "outcome": "DISCARDED", "failure_mode": null, "duration_seconds": 123.06647191697266, "tags": ["readme", "technical-documentation", "cli", "operations", "csv", "yaml"], "learnings": "{\"what_changed\":\"\",\"what_improved\":[],\"what_regressed\":[],\"transferable_insight\":\"A useful expansion must preserve the original artifact\u2019s intent and operational constraints while adding structure, examples, and guidance that directly support the intended user workflow.\",\"domain_tags\":[\"documentation\",\"technical-writing\",\"workflow-design\"]}", "cost_usd": 0.17269615000000005, "bootstrap_seed": 0, "agent_model": "gpt-5.4", "held_out_score": null, "criterion_names": ["quick_start_present", "api_documented", "prerequisites_clear", "examples_runnable", "error_guidance", "contribution_path"], "per_criterion_scores": {"quick_start_present": 0.0, "api_documented": 0.0, "prerequisites_clear": 0.0, "examples_runnable": 0.0, "error_guidance": 0.0, "contribution_path": 0.2}, "failure_classification": {"category": "incomplete_edit", "description": "The provided project note did not get expanded into a complete operator-facing technical README; the result appears to be a partial or inconsistent deliverable relative to the stated hypothesis requirements (setup, configuration, usage, I/O contracts, workflows, troubleshooting).", "fix_direction": "Ensure the edit covers every required README section end-to-end, with coherent, consistent content (including explicit I/O contracts and step-by-step workflows) rather than stopping at an incomplete outline.", "confidence": 0.72}, "drafts_generated": 1, "drafts_survived": 1}
{"id": "287617ee-5666-49f7-88fd-e6bebcfb37ca", "target_id": "B5-greedy", "git_sha": "b8c82b77394fc5f506cdc8d1da9f51f0200e5b94", "pre_experiment_sha": "b8c82b77394fc5f506cdc8d1da9f51f0200e5b94", "timestamp": "2026-04-19T18:39:53.885993+00:00", "hypothesis": "Expand the sparse README into a full operator manual with setup, configuration, CLI, I/O contracts, workflows, examples, and troubleshooting.", "hypothesis_source": "agent", "mutation_diff_summary": "", "score": 0.9, "score_ci_lower": 0.2, "score_ci_upper": 1.7, "raw_scores": [2.5, 0.0, 1.0, 1.0, 0.0], "baseline_score": 1.2, "outcome": "DISCARDED", "failure_mode": null, "duration_seconds": 107.22299449995626, "tags": ["readme", "technical-docs", "cli", "operations", "csv", "yaml"], "learnings": "{\"what_changed\":\"\",\"what_improved\":[],\"what_regressed\":[],\"transferable_insight\":\"Expanding a minimal reference into a comprehensive guide can fail if it adds breadth without improving clarity, usability, or evidence of user need.\",\"domain_tags\":[\"documentation\",\"product-design\",\"usability\"]}", "cost_usd": 0.16567355, "bootstrap_seed": 0, "agent_model": "gpt-5.4", "held_out_score": null, "criterion_names": ["quick_start_present", "api_documented", "prerequisites_clear", "examples_runnable", "error_guidance", "contribution_path"], "per_criterion_scores": {"quick_start_present": 0.2, "api_documented": 0.1, "prerequisites_clear": 0.2, "examples_runnable": 0.1, "error_guidance": 0.2, "contribution_path": 0.1}, "failure_classification": {"category": "incomplete_edit", "description": "The attempt to expand the README into a full operator manual was not fully completed, leaving missing or inconsistent sections required by the requested manual scope (e.g., setup, configuration, CLI/I/O contracts, workflows, examples, troubleshooting).", "fix_direction": "Ensure the edit comprehensively covers every required manual component end-to-end and that all sections are internally consistent (complete setup/config/CLI/I/O/workflows/examples/troubleshooting) rather than only partially expanding the README.", "confidence": 0.74}, "drafts_generated": 1, "drafts_survived": 1}
{"id": "93fc4321-64d1-4520-85d6-fd1a9326c796", "target_id": "B5-greedy", "git_sha": "b8c82b77394fc5f506cdc8d1da9f51f0200e5b94", "pre_experiment_sha": "b8c82b77394fc5f506cdc8d1da9f51f0200e5b94", "timestamp": "2026-04-19T18:41:59.029927+00:00", "hypothesis": "Expand the sparse README into a complete operator-focused manual with setup, configuration, commands, I/O contracts, workflows, examples, and troubleshooting.", "hypothesis_source": "agent", "mutation_diff_summary": "", "score": 1.0, "score_ci_lower": 0.1, "score_ci_upper": 1.9, "raw_scores": [0.0, 2.5, 0.5, 2.0, 0.0], "baseline_score": 1.2, "outcome": "DISCARDED", "failure_mode": null, "duration_seconds": 115.65037104196381, "tags": ["readme", "technical-documentation", "cli", "operations", "csv", "yaml"], "learnings": "{\"what_changed\":\"\",\"what_improved\":[],\"what_regressed\":[],\"transferable_insight\":\"When documentation is expanded, it should be driven by the actual needs and workflows of its intended users rather than by completeness alone, or it may add volume without improving usefulness.\",\"domain_tags\":[\"documentation\",\"user-centered-design\",\"productivity\"]}", "cost_usd": 0.16984975000000002, "bootstrap_seed": 0, "agent_model": "gpt-5.4", "held_out_score": null, "criterion_names": ["quick_start_present", "api_documented", "prerequisites_clear", "examples_runnable", "error_guidance", "contribution_path"], "per_criterion_scores": {"quick_start_present": 0.0, "api_documented": 0.1, "prerequisites_clear": 0.2, "examples_runnable": 0.0, "error_guidance": 0.4, "contribution_path": 0.3}, "failure_classification": {"category": "incomplete_edit", "description": "The attempt failed to produce the complete, coherent operator-focused manual described in the hypothesis; it remained sparse/incomplete, leaving gaps in required sections (setup, configuration, commands, I/O contracts, workflows, examples, troubleshooting) and likely inconsistent or missing details.", "fix_direction": "Fill in the missing manual sections end-to-end: add full setup/config/command reference, precisely defined I/O contracts, complete workflow steps, runnable examples, and a troubleshooting section aligned with the operator\u2019s expected usage.", "confidence": 0.72}, "drafts_generated": 1, "drafts_survived": 1}
{"id": "6b031902-247b-4d17-a258-c9112863e349", "target_id": "B5-greedy", "git_sha": "b8c82b77394fc5f506cdc8d1da9f51f0200e5b94", "pre_experiment_sha": "b8c82b77394fc5f506cdc8d1da9f51f0200e5b94", "timestamp": "2026-04-19T18:44:00.046691+00:00", "hypothesis": "Expand the sparse overview into a full operator-focused README with installation, configuration, commands, I/O contracts, workflow, examples, and troubleshooting.", "hypothesis_source": "agent", "mutation_diff_summary": "", "score": 0.6, "score_ci_lower": 0.0, "score_ci_upper": 1.6, "raw_scores": [2.5, 0.0, 0.5, 0.0, 0.0], "baseline_score": 1.2, "outcome": "DISCARDED", "failure_mode": null, "duration_seconds": 118.26136624999344, "tags": ["readme", "technical-docs", "cli", "operations", "csv", "yaml"], "learnings": "{\"what_changed\":\"\",\"what_improved\":[],\"what_regressed\":[],\"transferable_insight\":\"When a task asks for a concise overview, expanding it into a full operational manual can reduce usefulness by adding unnecessary detail and diluting the original intent.\",\"domain_tags\":[\"communication\",\"documentation\",\"requirements\"]}", "cost_usd": 0.17059895, "bootstrap_seed": 0, "agent_model": "gpt-5.4", "held_out_score": null, "criterion_names": ["quick_start_present", "api_documented", "prerequisites_clear", "examples_runnable", "error_guidance", "contribution_path"], "per_criterion_scores": {"quick_start_present": 0.2, "api_documented": 0.1, "prerequisites_clear": 0.0, "examples_runnable": 0.0, "error_guidance": 0.2, "contribution_path": 0.1}, "failure_classification": {"category": "incomplete_edit", "description": "The requested change appears to be a substantial README expansion, but the experiment failed with an unknown issue\u2014suggesting the edit was partial or left an inconsistent/unfinished structure rather than fully meeting the operator-focused documentation requirements.", "fix_direction": "Ensure the README expansion is complete end-to-end: include installation, configuration, command list, explicit I/O contracts, workflow, examples, and troubleshooting, and verify consistency and completeness before finalizing.", "confidence": 0.52}, "drafts_generated": 1, "drafts_survived": 1}
{"id": "2c13c05d-729e-4936-a11a-03f282453664", "target_id": "B5-greedy", "git_sha": "b8c82b77394fc5f506cdc8d1da9f51f0200e5b94", "pre_experiment_sha": "b8c82b77394fc5f506cdc8d1da9f51f0200e5b94", "timestamp": "2026-04-19T18:45:58.710956+00:00", "hypothesis": "Expand the sparse overview into a complete operator-focused technical README with setup, configuration, usage, I/O contracts, workflows, examples, and troubleshooting.", "hypothesis_source": "agent", "mutation_diff_summary": "", "score": 0.7, "score_ci_lower": 0.2, "score_ci_upper": 1.2, "raw_scores": [0.0, 1.5, 1.0, 1.0, 0.0], "baseline_score": 1.2, "outcome": "DISCARDED", "failure_mode": null, "duration_seconds": 116.31120862497482, "tags": ["readme", "technical-docs", "cli", "operations", "csv", "yaml"], "learnings": "{\"what_changed\":\"\",\"what_improved\":[],\"what_regressed\":[],\"transferable_insight\":\"When a task asks for a complete operational artifact, success depends on systematically filling in all practical usage details and interfaces rather than only expanding the high-level overview.\",\"domain_tags\":[\"documentation\",\"technical-writing\",\"workflow\"]}", "cost_usd": 0.16676795000000003, "bootstrap_seed": 0, "agent_model": "gpt-5.4", "held_out_score": null, "criterion_names": ["quick_start_present", "api_documented", "prerequisites_clear", "examples_runnable", "error_guidance", "contribution_path"], "per_criterion_scores": {"quick_start_present": 0.0, "api_documented": 0.0, "prerequisites_clear": 0.1, "examples_runnable": 0.0, "error_guidance": 0.4, "contribution_path": 0.2}, "failure_classification": {"category": "incomplete_edit", "description": "The attempt appears to have failed without a clear, complete implementation\u2014likely producing only a partial or inconsistent edit rather than a fully fleshed operator-focused README with the required sections (setup, configuration, usage, I/O contracts, workflows, examples, troubleshooting).", "fix_direction": "Ensure the output is end-to-end complete within the requested scope: add all mandated README sections, keep internal consistency (configuration/usage/options matching), and include concrete I/O contracts and example workflows.", "confidence": 0.62}, "drafts_generated": 1, "drafts_survived": 1}
