{"id": "c87eb12a-f3bf-4efa-b9e9-45ea441c5888", "target_id": "B5-greedy", "git_sha": "b8c82b77394fc5f506cdc8d1da9f51f0200e5b94", "pre_experiment_sha": "b8c82b77394fc5f506cdc8d1da9f51f0200e5b94", "timestamp": "2026-04-19T18:48:06.911918+00:00", "hypothesis": "Expand the sparse README into a complete operator manual with setup, configuration, CLI usage, I/O contracts, workflows, examples, and troubleshooting.", "hypothesis_source": "agent", "mutation_diff_summary": "", "score": 1.0, "score_ci_lower": 0.1, "score_ci_upper": 2.1, "raw_scores": [3.0, 0.0, 0.0, 0.5, 1.5], "baseline_score": 1.2, "outcome": "DISCARDED", "failure_mode": null, "duration_seconds": 119.16810183401685, "tags": ["readme", "technical-documentation", "cli", "operations", "csv", "yaml"], "learnings": "{\"what_changed\":\"\",\"what_improved\":[],\"what_regressed\":[],\"transferable_insight\":\"A broad, ambitious expansion can fail to add value if it is not grounded in the existing artifact\u2019s actual needs, structure, and constraints.\",\"domain_tags\":[\"documentation\",\"product-design\",\"requirements-analysis\"]}", "cost_usd": 0.18927915000000003, "bootstrap_seed": 0, "agent_model": "gpt-5.4", "held_out_score": null, "criterion_names": ["quick_start_present", "api_documented", "prerequisites_clear", "examples_runnable", "error_guidance", "contribution_path"], "per_criterion_scores": {"quick_start_present": 0.4, "api_documented": 0.1, "prerequisites_clear": 0.1, "examples_runnable": 0.1, "error_guidance": 0.2, "contribution_path": 0.1}, "failure_classification": {"category": "incomplete_edit", "description": "The attempt did not produce a complete operator manual; the README expansion appears incomplete, leaving inconsistent/underspecified sections such as setup, configuration, CLI usage, I/O contracts, workflows, examples, or troubleshooting.", "fix_direction": "Ensure the documentation expansion fully covers all required sections end-to-end, with consistent headings, complete CLI/I/O specifications, runnable examples, and a dedicated troubleshooting section; validate against a checklist for each manual component.", "confidence": 0.76}, "drafts_generated": 1, "drafts_survived": 1}
{"id": "daac990b-0e5d-4e5c-9608-2b7e25db7e94", "target_id": "B5-greedy", "git_sha": "b8c82b77394fc5f506cdc8d1da9f51f0200e5b94", "pre_experiment_sha": "b8c82b77394fc5f506cdc8d1da9f51f0200e5b94", "timestamp": "2026-04-19T18:50:12.429892+00:00", "hypothesis": "Expand the sparse README into a complete operator manual with setup, configuration, CLI, I/O contracts, workflows, examples, and troubleshooting.", "hypothesis_source": "agent", "mutation_diff_summary": "", "score": 0.4, "score_ci_lower": 0.0, "score_ci_upper": 1.0, "raw_scores": [1.5, 0.0, 0.0, 0.0, 0.5], "baseline_score": 1.2, "outcome": "DISCARDED", "failure_mode": null, "duration_seconds": 123.2420450829668, "tags": ["readme", "technical-docs", "cli", "operations", "yaml", "csv"], "learnings": "{\"what_changed\":\"\",\"what_improved\":[],\"what_regressed\":[],\"transferable_insight\":\"A broad expansion can fail if it adds completeness without improving the specific criteria that matter, so changes should be tightly aligned to measurable user value and evaluation goals.\",\"domain_tags\":[\"documentation\",\"product-quality\"]}", "cost_usd": 0.17963475000000004, "bootstrap_seed": 0, "agent_model": "gpt-5.4", "held_out_score": null, "criterion_names": ["quick_start_present", "api_documented", "prerequisites_clear", "examples_runnable", "error_guidance", "contribution_path"], "per_criterion_scores": {"quick_start_present": 0.2, "api_documented": 0.0, "prerequisites_clear": 0.1, "examples_runnable": 0.0, "error_guidance": 0.1, "contribution_path": 0.0}, "failure_classification": {"category": "incomplete_edit", "description": "The attempt did not fully implement the requested expansion into a complete operator manual; instead it remained partial/inconsistent with the expected complete structure (setup, configuration, CLI, I/O contracts, workflows, examples, troubleshooting).", "fix_direction": "Ensure the README expansion covers all required sections end-to-end and that each referenced workflow/CLI/I/O contract is consistent, complete, and internally referenced across the document.", "confidence": 0.52}, "drafts_generated": 1, "drafts_survived": 1}
{"id": "fc35c3ab-135b-4d9b-a6bc-2f79d4e4d97c", "target_id": "B5-greedy", "git_sha": "b8c82b77394fc5f506cdc8d1da9f51f0200e5b94", "pre_experiment_sha": "b8c82b77394fc5f506cdc8d1da9f51f0200e5b94", "timestamp": "2026-04-19T18:52:26.980526+00:00", "hypothesis": "Expand the sparse README into a complete operator manual with setup, configuration, CLI contracts, workflows, examples, and troubleshooting.", "hypothesis_source": "agent", "mutation_diff_summary": "", "score": 0.7, "score_ci_lower": 0.0, "score_ci_upper": 1.5, "raw_scores": [0.0, 0.0, 1.5, 0.0, 2.0], "baseline_score": 1.2, "outcome": "DISCARDED", "failure_mode": null, "duration_seconds": 132.19476174993906, "tags": ["readme", "technical-documentation", "operations", "cli", "yaml", "csv"], "learnings": "{\"what_changed\":\"\",\"what_improved\":[],\"what_regressed\":[],\"transferable_insight\":\"A broad expansion can fail if it adds volume without increasing actionable clarity, so documentation should be judged by whether it concretely improves user decisions and task completion.\",\"domain_tags\":[\"documentation\",\"usability\",\"evaluation\"]}", "cost_usd": 0.18871015000000002, "bootstrap_seed": 0, "agent_model": "gpt-5.4", "held_out_score": null, "criterion_names": ["quick_start_present", "api_documented", "prerequisites_clear", "examples_runnable", "error_guidance", "contribution_path"], "per_criterion_scores": {"quick_start_present": 0.2, "api_documented": 0.2, "prerequisites_clear": 0.1, "examples_runnable": 0.0, "error_guidance": 0.0, "contribution_path": 0.2}, "failure_classification": {"category": "incomplete_edit", "description": "The attempt to expand the README operator manual did not reach a complete, internally consistent state\u2014leaving missing or inconsistent sections such as setup/configuration, CLI contracts, workflows, examples, or troubleshooting expected by the hypothesis.", "fix_direction": "Ensure the documentation expansion is end-to-end: fully populate all required manual sections, verify CLI inputs/outputs match described contracts, add complete workflow and example coverage, and include a troubleshooting section consistent with the described configuration.", "confidence": 0.68}, "drafts_generated": 1, "drafts_survived": 1}
{"id": "89000644-6cfe-4f58-8ee8-f44472566186", "target_id": "B5-greedy", "git_sha": "b8c82b77394fc5f506cdc8d1da9f51f0200e5b94", "pre_experiment_sha": "b8c82b77394fc5f506cdc8d1da9f51f0200e5b94", "timestamp": "2026-04-19T18:54:43.805874+00:00", "hypothesis": "Expand the sparse README into a complete operator manual with concrete setup, configuration, CLI, I/O contracts, workflows, examples, and troubleshooting.", "hypothesis_source": "agent", "mutation_diff_summary": "", "score": 0.4, "score_ci_lower": 0.0, "score_ci_upper": 0.8, "raw_scores": [0.0, 0.0, 1.0, 1.0, 0.0], "baseline_score": 1.2, "outcome": "DISCARDED", "failure_mode": null, "duration_seconds": 126.04426800005604, "tags": ["readme", "technical-documentation", "cli", "operations", "csv", "yaml"], "learnings": "{\"what_changed\":\"\",\"what_improved\":[],\"what_regressed\":[],\"transferable_insight\":\"When expanding minimal documentation, prioritize preserving the original scope and intent while adding only the concrete details that directly support the existing use case, because overexpansion can reduce usefulness and alignment.\",\"domain_tags\":[\"documentation\",\"scope-management\",\"technical-writing\"]}", "cost_usd": 0.18223475000000003, "bootstrap_seed": 0, "agent_model": "gpt-5.4", "held_out_score": null, "criterion_names": ["quick_start_present", "api_documented", "prerequisites_clear", "examples_runnable", "error_guidance", "contribution_path"], "per_criterion_scores": {"quick_start_present": 0.0, "api_documented": 0.0, "prerequisites_clear": 0.0, "examples_runnable": 0.0, "error_guidance": 0.2, "contribution_path": 0.2}, "failure_classification": {"category": "incomplete_edit", "description": "The attempt did not fully realize the requested expansion into a complete operator manual (setup, configuration, CLI/I/O contracts, workflows, examples, and troubleshooting), leaving the documentation in a partial/inconsistent state relative to the hypothesis.", "fix_direction": "Ensure the manual is end-to-end and internally consistent: add concrete setup steps, explicit configuration options with defaults, formal CLI usage and argument/flag contracts, defined inputs/outputs and file/stream schemas, clear end-to-end workflows, runnable examples, and a troubleshooting section that matches the specified behaviors.", "confidence": 0.62}, "drafts_generated": 1, "drafts_survived": 1}
{"id": "4502e2fe-69ec-427e-8ea5-6e0a38889e7d", "target_id": "B5-greedy", "git_sha": "b8c82b77394fc5f506cdc8d1da9f51f0200e5b94", "pre_experiment_sha": "b8c82b77394fc5f506cdc8d1da9f51f0200e5b94", "timestamp": "2026-04-19T18:56:47.674775+00:00", "hypothesis": "Expand the sparse README into a complete operator manual with concrete setup, configuration, CLI, I/O, workflow, examples, and troubleshooting details.", "hypothesis_source": "agent", "mutation_diff_summary": "", "score": 0.9, "score_ci_lower": 0.0, "score_ci_upper": 2.5, "raw_scores": [0.0, 0.5, 0.0, 4.0, 0.0], "baseline_score": 1.2, "outcome": "DISCARDED", "failure_mode": null, "duration_seconds": 120.37153908400796, "tags": ["readme", "technical-docs", "operations", "cli", "data-pipeline", "csv", "yaml"], "learnings": "{\"what_changed\":\"\",\"what_improved\":[],\"what_regressed\":[],\"transferable_insight\":\"When expanding minimal documentation, adding concrete usage details and end-to-end workflow examples is more valuable than simply increasing length or breadth of coverage.\",\"domain_tags\":[\"documentation\",\"technical-writing\",\"usability\"]}", "cost_usd": 0.18558315000000003, "bootstrap_seed": 0, "agent_model": "gpt-5.4", "held_out_score": null, "criterion_names": ["quick_start_present", "api_documented", "prerequisites_clear", "examples_runnable", "error_guidance", "contribution_path"], "per_criterion_scores": {"quick_start_present": 0.2, "api_documented": 0.1, "prerequisites_clear": 0.2, "examples_runnable": 0.0, "error_guidance": 0.2, "contribution_path": 0.2}, "failure_classification": {"category": "incomplete_edit", "description": "The experiment appears to have partially addressed the goal of expanding the sparse README into a full operator manual, but the resulting output is not fully consistent/comprehensive (leaving gaps or an incomplete, inconsistent state rather than a fully specified manual).", "fix_direction": "Complete the missing sections of the manual: add concrete setup steps, configuration details, CLI reference, defined I/O formats, end-to-end workflow, runnable examples, and a troubleshooting section to ensure internal consistency across all parts.", "confidence": 0.74}, "drafts_generated": 1, "drafts_survived": 1}
{"id": "0238188d-7c15-46d5-af0e-eb8a060a6222", "target_id": "B5-greedy", "git_sha": "b8c82b77394fc5f506cdc8d1da9f51f0200e5b94", "pre_experiment_sha": "b8c82b77394fc5f506cdc8d1da9f51f0200e5b94", "timestamp": "2026-04-19T18:58:55.760111+00:00", "hypothesis": "Expand the sparse README into a complete operator manual with concrete setup, configuration, CLI, I/O, workflow, examples, and troubleshooting details.", "hypothesis_source": "agent", "mutation_diff_summary": "", "score": 0.7, "score_ci_lower": 0.0, "score_ci_upper": 1.7, "raw_scores": [0.0, 1.0, 0.0, 2.5, 0.0], "baseline_score": 1.2, "outcome": "DISCARDED", "failure_mode": null, "duration_seconds": 125.3619909590343, "tags": ["technical-readme", "cli", "operations", "csv", "yaml", "python"], "learnings": "{\"what_changed\":\"\",\"what_improved\":[],\"what_regressed\":[],\"transferable_insight\":\"When expanding minimal documentation, adding concrete usage details only helps if they are accurate and grounded in the actual system; otherwise, the extra specificity can reduce quality rather than improve it.\",\"domain_tags\":[\"documentation\",\"quality-control\",\"technical-writing\"]}", "cost_usd": 0.17542075000000001, "bootstrap_seed": 0, "agent_model": "gpt-5.4", "held_out_score": null, "criterion_names": ["quick_start_present", "api_documented", "prerequisites_clear", "examples_runnable", "error_guidance", "contribution_path"], "per_criterion_scores": {"quick_start_present": 0.1, "api_documented": 0.0, "prerequisites_clear": 0.1, "examples_runnable": 0.0, "error_guidance": 0.4, "contribution_path": 0.1}, "failure_classification": {"category": "incomplete_edit", "description": "The attempt did not fully realize the requested operator manual expansion (setup, configuration, CLI, I/O, workflow, examples, troubleshooting), leaving the README incomplete or inconsistent rather than fully specified end-to-end.", "fix_direction": "Ensure the edit fully covers all required manual sections with consistent command/config examples and complete workflow + troubleshooting guidance, validating that the final output is internally coherent and not partially implemented.", "confidence": 0.74}, "drafts_generated": 1, "drafts_survived": 1}
{"id": "ddafd946-e97a-4a49-9690-4ab427033215", "target_id": "B5-greedy", "git_sha": "b8c82b77394fc5f506cdc8d1da9f51f0200e5b94", "pre_experiment_sha": "b8c82b77394fc5f506cdc8d1da9f51f0200e5b94", "timestamp": "2026-04-19T19:01:11.477082+00:00", "hypothesis": "Expand the sparse README into a complete operator manual with setup, config, usage, I/O contracts, workflow, examples, and troubleshooting.", "hypothesis_source": "agent", "mutation_diff_summary": "", "score": 0.7, "score_ci_lower": 0.0, "score_ci_upper": 1.5, "raw_scores": [2.0, 0.0, 1.5, 0.0, 0.0], "baseline_score": 1.2, "outcome": "DISCARDED", "failure_mode": null, "duration_seconds": 126.72816279204562, "tags": ["readme", "technical-docs", "operator-manual", "cli", "csv", "yaml"], "learnings": "{\"what_changed\":\"\",\"what_improved\":[],\"what_regressed\":[],\"transferable_insight\":\"A broad expansion can fail if it adds completeness without improving the specific information users need to successfully apply the artifact, so documentation should be driven by concrete user tasks and pain points rather than coverage alone.\",\"domain_tags\":[\"documentation\",\"product-design\",\"usability\"]}", "cost_usd": 0.17326375000000002, "bootstrap_seed": 0, "agent_model": "gpt-5.4", "held_out_score": null, "criterion_names": ["quick_start_present", "api_documented", "prerequisites_clear", "examples_runnable", "error_guidance", "contribution_path"], "per_criterion_scores": {"quick_start_present": 0.2, "api_documented": 0.0, "prerequisites_clear": 0.0, "examples_runnable": 0.2, "error_guidance": 0.1, "contribution_path": 0.2}, "failure_classification": {"category": "incomplete_edit", "description": "The attempt appears to partially expand the README/operator manual but leaves the documentation in an inconsistent or unfinished state, preventing a complete specification (e.g., missing required sections like setup/config/workflow/examples/troubleshooting or leaving unresolved placeholders).", "fix_direction": "Ensure the manual expansion is end-to-end and internally consistent: fully add required sections, define I/O contracts and usage precisely, include complete examples, and verify the final README is coherent without missing dependencies or unresolved references.", "confidence": 0.62}, "drafts_generated": 1, "drafts_survived": 1}
{"id": "db8d86bf-714c-4641-a7d1-6ea277fb4073", "target_id": "B5-greedy", "git_sha": "b8c82b77394fc5f506cdc8d1da9f51f0200e5b94", "pre_experiment_sha": "b8c82b77394fc5f506cdc8d1da9f51f0200e5b94", "timestamp": "2026-04-19T19:03:31.795024+00:00", "hypothesis": "Expand the sparse README into a complete operator manual with concrete setup, configuration, CLI, I/O, workflow, examples, and troubleshooting details.", "hypothesis_source": "agent", "mutation_diff_summary": "", "score": 0.6, "score_ci_lower": 0.2, "score_ci_upper": 1.0, "raw_scores": [0.0, 1.0, 1.0, 1.0, 0.0], "baseline_score": 1.2, "outcome": "DISCARDED", "failure_mode": null, "duration_seconds": 137.45254716696218, "tags": ["readme", "technical-docs", "operator-manual", "cli", "yaml", "csv"], "learnings": "{\"what_changed\":\"\",\"what_improved\":[],\"what_regressed\":[],\"transferable_insight\":\"When expanding minimal documentation, adding concrete, end-to-end usage details and troubleshooting guidance is more likely to improve usefulness than simply increasing length or breadth of coverage.\",\"domain_tags\":[\"documentation\",\"usability\",\"technical-writing\"]}", "cost_usd": 0.19530155, "bootstrap_seed": 0, "agent_model": "gpt-5.4", "held_out_score": null, "criterion_names": ["quick_start_present", "api_documented", "prerequisites_clear", "examples_runnable", "error_guidance", "contribution_path"], "per_criterion_scores": {"quick_start_present": 0.0, "api_documented": 0.0, "prerequisites_clear": 0.0, "examples_runnable": 0.0, "error_guidance": 0.4, "contribution_path": 0.2}, "failure_classification": {"category": "incomplete_edit", "description": "The attempt to expand the sparse README did not fully deliver a complete, consistent operator manual. The resulting document/config/workflow appears incomplete or left inconsistent sections rather than providing end-to-end setup, configuration, CLI, I/O, examples, and troubleshooting details coherently.", "fix_direction": "Ensure the manual expansion is comprehensive and internally consistent: add full concrete sections (setup, configuration parameters, CLI reference, input/output formats, end-to-end workflow, examples, and troubleshooting), and verify cross-references and example commands match the described CLI and I/O.", "confidence": 0.62}, "drafts_generated": 1, "drafts_survived": 1}
{"id": "87800811-84f2-42c1-86d4-374016b4f52c", "target_id": "B5-greedy", "git_sha": "b8c82b77394fc5f506cdc8d1da9f51f0200e5b94", "pre_experiment_sha": "b8c82b77394fc5f506cdc8d1da9f51f0200e5b94", "timestamp": "2026-04-19T19:05:56.046668+00:00", "hypothesis": "Expand the sparse README into a complete operator manual with concrete setup, configuration, CLI, I/O contracts, workflow, examples, and troubleshooting.", "hypothesis_source": "agent", "mutation_diff_summary": "", "score": 0.4, "score_ci_lower": 0.0, "score_ci_upper": 0.8, "raw_scores": [1.0, 0.0, 1.0, 0.0, 0.0], "baseline_score": 1.2, "outcome": "DISCARDED", "failure_mode": null, "duration_seconds": 141.7570867500035, "tags": ["readme", "technical-docs", "cli", "operations", "csv", "yaml"], "learnings": "{\"what_changed\":\"\",\"what_improved\":[],\"what_regressed\":[],\"transferable_insight\":\"A broad expansion can fail if it adds completeness without first validating the core user needs and the most valuable missing details, so prioritize targeted usefulness over exhaustive coverage.\",\"domain_tags\":[\"product-design\",\"documentation\",\"evaluation\"]}", "cost_usd": 0.19870895, "bootstrap_seed": 0, "agent_model": "gpt-5.4", "held_out_score": null, "criterion_names": ["quick_start_present", "api_documented", "prerequisites_clear", "examples_runnable", "error_guidance", "contribution_path"], "per_criterion_scores": {"quick_start_present": 0.2, "api_documented": 0.0, "prerequisites_clear": 0.0, "examples_runnable": 0.0, "error_guidance": 0.0, "contribution_path": 0.2}, "failure_classification": {"category": "incomplete_edit", "description": "The update to the README appears to have been only partially completed: the manual-style expansion did not fully deliver consistent, complete operator documentation covering setup/config/CLI/I/O contracts/workflow/examples/troubleshooting, leaving an inconsistent or incomplete result.", "fix_direction": "Ensure the README expansion fully covers all required sections with consistent terminology, complete examples, explicit CLI/I/O contracts, and a coherent troubleshooting workflow; validate internal consistency and completeness against the intended operator-manual template.", "confidence": 0.62}, "drafts_generated": 1, "drafts_survived": 1}
