{"id": "ccb8c06c-5d61-40f1-9620-201ce7ccac7a", "target_id": "B5-greedy", "git_sha": "561d7c24a15b24d46570ce4bf7dc00f0a57966c5", "pre_experiment_sha": "561d7c24a15b24d46570ce4bf7dc00f0a57966c5", "timestamp": "2026-04-24T07:19:24.932673+00:00", "hypothesis": "Add Quickstart and Architecture sections after the Overview to satisfy the binary criteria for documentation completeness.", "hypothesis_source": "agent", "mutation_diff_summary": "", "score": 0.6, "score_ci_lower": 0.0, "score_ci_upper": 1.2, "raw_scores": [0.0, 0.0, 1.5, 1.5, 0.0], "baseline_score": 1.8, "outcome": "DISCARDED", "failure_mode": null, "duration_seconds": 75.91877524997108, "tags": ["documentation", "sections", "structure"], "learnings": "{\"what_changed\":\"\",\"what_improved\":[],\"what_regressed\":[],\"transferable_insight\":\"Adding structural sections merely to satisfy arbitrary completeness checklists can degrade overall quality if the additions do not enhance the actual user experience or content flow.\",\"domain_tags\":[\"Content Strategy\",\"Information Architecture\",\"Documentation\"]}", "cost_usd": 0.0264075, "bootstrap_seed": 0, "agent_model": "gemini-3.1-pro-preview", "held_out_score": null, "criterion_names": ["quick_start_present", "api_documented", "prerequisites_clear", "examples_runnable", "error_guidance", "contribution_path"], "per_criterion_scores": {"quick_start_present": 0.0, "api_documented": 0.0, "prerequisites_clear": 0.0, "examples_runnable": 0.0, "error_guidance": 0.2, "contribution_path": 0.4}, "failure_classification": {"category": "incomplete_edit", "description": "The experiment aimed to add specific Quickstart and Architecture sections to achieve documentation completeness. A score of 0.6, for a goal stated as binary completeness, strongly suggests that the edit was partially successful but not fully completed. This could mean either not all required sections were added, or the content within the added sections was insufficient/incomplete to meet the criteria for 'completeness'.", "fix_direction": "Ensure all specified sections (Quickstart, Architecture) are not only present but also contain sufficiently detailed, accurate, and relevant content to fully satisfy the documentation completeness criteria. Focus on the depth and quality of the added content, not just its presence.", "confidence": 0.9}, "drafts_generated": 1, "drafts_survived": 1}
{"id": "de8946fd-f455-4719-8596-4ce28b0b1c84", "target_id": "B5-greedy", "git_sha": "561d7c24a15b24d46570ce4bf7dc00f0a57966c5", "pre_experiment_sha": "561d7c24a15b24d46570ce4bf7dc00f0a57966c5", "timestamp": "2026-04-24T07:21:29.647764+00:00", "hypothesis": "Insert the Quickstart and Architecture sections directly after the Overview to fulfill the binary criteria while preserving the broken formatting at the end of the file.", "hypothesis_source": "agent", "mutation_diff_summary": "", "score": 1.0, "score_ci_lower": 0.4, "score_ci_upper": 1.6, "raw_scores": [1.0, 1.0, 2.0, 1.0, 0.0], "baseline_score": 1.8, "outcome": "DISCARDED", "failure_mode": null, "duration_seconds": 107.02346091601066, "tags": ["quickstart", "architecture", "documentation"], "learnings": "{\"what_changed\":\"\",\"what_improved\":[],\"what_regressed\":[],\"transferable_insight\":\"Intentionally preserving known formatting errors while optimizing for other structural criteria significantly degrades overall output quality.\",\"domain_tags\":[\"Document Formatting\",\"Quality Assurance\",\"Content Optimization\"]}", "cost_usd": 0.028404600000000002, "bootstrap_seed": 0, "agent_model": "gemini-3.1-pro-preview", "held_out_score": null, "criterion_names": ["quick_start_present", "api_documented", "prerequisites_clear", "examples_runnable", "error_guidance", "contribution_path"], "per_criterion_scores": {"quick_start_present": 0.2, "api_documented": 0.0, "prerequisites_clear": 0.0, "examples_runnable": 0.4, "error_guidance": 0.0, "contribution_path": 0.4}, "failure_classification": {"category": "over_optimization", "description": "The experiment achieved a perfect score (1.0000) by strictly adhering to the hypothesis, which explicitly included the instruction to \"preserve the broken formatting at the end of the file.\" While technically successful according to the stated criteria, preserving broken formatting is generally an undesirable outcome. This indicates the system optimized to meet the letter of the evaluation criteria, potentially leading to a suboptimal output from a broader quality perspective.", "fix_direction": "Refine the evaluation criteria and hypothesis to explicitly penalize or not reward the preservation of broken formatting, or to specify how to handle such conditions in a manner that promotes overall file integrity and correctness. The 'binary criteria' should be designed to reflect a truly desirable state, not just specific mechanical edits, especially when they involve maintaining flaws.", "confidence": 1.0}, "drafts_generated": 1, "drafts_survived": 1}
