{"id": "38324dbb-ed6f-4049-91ea-8cd74a0bad4a", "target_id": "B5-greedy", "git_sha": "561d7c24a15b24d46570ce4bf7dc00f0a57966c5", "pre_experiment_sha": "561d7c24a15b24d46570ce4bf7dc00f0a57966c5", "timestamp": "2026-04-24T06:40:39.494093+00:00", "hypothesis": "Add Quickstart, Architecture, and Troubleshooting sections while strictly preserving the existing text and unclosed code block to avoid syntax format failures.", "hypothesis_source": "agent", "mutation_diff_summary": "", "score": 1.5, "score_ci_lower": 0.9, "score_ci_upper": 2.1, "raw_scores": [0.5, 2.0, 1.0, 1.5, 2.5], "baseline_score": 1.8, "outcome": "DISCARDED", "failure_mode": null, "duration_seconds": 102.68030937504955, "tags": ["documentation", "sections", "quickstart", "architecture", "troubleshooting"], "learnings": "{\"what_changed\":\"\",\"what_improved\":[],\"what_regressed\":[],\"transferable_insight\":\"Retaining broken formatting structures when appending new content causes the new additions to be swallowed or corrupted by the existing errors.\",\"domain_tags\":[\"Documentation\",\"Formatting\",\"Syntax Management\"]}", "cost_usd": 0.027694649999999994, "bootstrap_seed": 0, "agent_model": "gemini-3.1-pro-preview", "held_out_score": null, "criterion_names": ["quick_start_present", "api_documented", "prerequisites_clear", "examples_runnable", "error_guidance", "contribution_path"], "per_criterion_scores": {"quick_start_present": 0.2, "api_documented": 0.2, "prerequisites_clear": 0.0, "examples_runnable": 0.3, "error_guidance": 0.2, "contribution_path": 0.6}, "failure_classification": {"category": "syntax_error", "description": "The experiment aimed to strictly preserve existing text, especially an unclosed code block, specifically to prevent syntax format failures. The failure indicates that, despite this instruction, a syntax error or format issue was introduced in the output, likely due to improper handling or modification of the existing structure (like the unclosed code block) or malformed new content.", "fix_direction": "Implement more robust parsing and preservation mechanisms for existing code blocks and syntax structures. Ensure that any added content also adheres to the target language's or markdown's syntax rules, and test parsing validity more thoroughly.", "confidence": 0.9}, "drafts_generated": 1, "drafts_survived": 1}
{"id": "39d9104c-5f1c-416f-a62c-fa25ecbf4a91", "target_id": "B5-greedy", "git_sha": "561d7c24a15b24d46570ce4bf7dc00f0a57966c5", "pre_experiment_sha": "561d7c24a15b24d46570ce4bf7dc00f0a57966c5", "timestamp": "2026-04-24T06:42:33.267334+00:00", "hypothesis": "Append the Quickstart, Architecture, and Troubleshooting sections while preserving the exact original text and closing the dangling code block to ensure proper markdown parsing.", "hypothesis_source": "agent", "mutation_diff_summary": "", "score": 1.1, "score_ci_lower": 0.1, "score_ci_upper": 2.2, "raw_scores": [0.0, 0.5, 0.0, 2.0, 3.0], "baseline_score": 1.8, "outcome": "DISCARDED", "failure_mode": null, "duration_seconds": 85.58456216705963, "tags": ["documentation", "markdown", "optimization"], "learnings": "{\"what_changed\":\"\",\"what_improved\":[],\"what_regressed\":[],\"transferable_insight\":\"Appending generic structural sections to existing content can dilute the primary focus and degrade overall performance, even when accompanied by formatting corrections.\",\"domain_tags\":[\"Documentation\",\"Content Structuring\",\"Formatting\"]}", "cost_usd": 0.02949445, "bootstrap_seed": 0, "agent_model": "gemini-3.1-pro-preview", "held_out_score": null, "criterion_names": ["quick_start_present", "api_documented", "prerequisites_clear", "examples_runnable", "error_guidance", "contribution_path"], "per_criterion_scores": {"quick_start_present": 0.2, "api_documented": 0.2, "prerequisites_clear": 0.0, "examples_runnable": 0.3, "error_guidance": 0.2, "contribution_path": 0.2}, "failure_classification": {"category": "syntax_error", "description": "The explicit goal was to ensure proper markdown parsing by closing a dangling code block. A failure indicates that either the code block was not correctly closed, or the appended sections introduced new markdown syntax errors, preventing the output from being parsed correctly.", "fix_direction": "Rigorously validate the markdown syntax of the entire document, especially focusing on the closure of the code block and the structure/syntax within the newly appended Quickstart, Architecture, and Troubleshooting sections. Use a markdown linter or parser to identify specific syntax issues.", "confidence": 0.9}, "drafts_generated": 1, "drafts_survived": 1}
{"id": "dfdfc80b-8cb2-40d7-a57e-9d7be88fb58a", "target_id": "B5-greedy", "git_sha": "561d7c24a15b24d46570ce4bf7dc00f0a57966c5", "pre_experiment_sha": "561d7c24a15b24d46570ce4bf7dc00f0a57966c5", "timestamp": "2026-04-24T06:44:12.282279+00:00", "hypothesis": "Insert the Quickstart, Architecture, and Troubleshooting sections after the Overview to safely increase the binary criteria score without interacting with the unclosed block at the end.", "hypothesis_source": "agent", "mutation_diff_summary": "", "score": 1.0, "score_ci_lower": 0.4, "score_ci_upper": 1.6, "raw_scores": [1.0, 1.0, 2.0, 1.0, 0.0], "baseline_score": 1.8, "outcome": "DISCARDED", "failure_mode": null, "duration_seconds": 59.6669232910499, "tags": ["documentation", "formatting", "missing-sections"], "learnings": "{\"what_changed\":\"\",\"what_improved\":[],\"what_regressed\":[],\"transferable_insight\":\"Reordering major structural components to bypass localized errors often disrupts the logical progression and degrades overall quality.\",\"domain_tags\":[\"Document Structure\",\"Content Organization\",\"Error Handling\"]}", "cost_usd": 0.029249749999999998, "bootstrap_seed": 0, "agent_model": "gemini-3.1-pro-preview", "held_out_score": null, "criterion_names": ["quick_start_present", "api_documented", "prerequisites_clear", "examples_runnable", "error_guidance", "contribution_path"], "per_criterion_scores": {"quick_start_present": 0.0, "api_documented": 0.2, "prerequisites_clear": 0.0, "examples_runnable": 0.2, "error_guidance": 0.2, "contribution_path": 0.4}, "failure_classification": {"category": "scope_violation", "description": "The experiment achieved the target score of 1.0, but it is classified as a 'failed experiment' because it likely violated the critical negative constraint stated in the hypothesis: 'without interacting with the unclosed block at the end'. Achieving the score by performing edits outside the permitted scope (interacting with the unclosed block) constitutes a scope violation, even if the primary metric was met.", "fix_direction": "Future attempts must strictly adhere to the defined scope, ensuring no interaction with the 'unclosed block at the end' while still striving to achieve or increase the binary criteria score. Investigate why interacting with the block leads to a perfect score and how to achieve the same result without violating this constraint.", "confidence": 0.9}, "drafts_generated": 1, "drafts_survived": 1}
{"id": "cf838fc4-1099-4e75-b42c-3076fb236f78", "target_id": "B5-greedy", "git_sha": "561d7c24a15b24d46570ce4bf7dc00f0a57966c5", "pre_experiment_sha": "561d7c24a15b24d46570ce4bf7dc00f0a57966c5", "timestamp": "2026-04-24T06:45:36.149919+00:00", "hypothesis": "Adding Quickstart, Architecture, and Troubleshooting sections before the problematic unclosed code block to improve the binary criteria score without causing output format failures.", "hypothesis_source": "agent", "mutation_diff_summary": "", "score": 2.0, "score_ci_lower": 1.2, "score_ci_upper": 2.6, "raw_scores": [3.0, 0.5, 2.5, 2.0, 2.0], "baseline_score": 1.8, "outcome": "DISCARDED", "failure_mode": null, "duration_seconds": 63.86987304198556, "tags": ["documentation", "markdown", "formatting"], "learnings": "{\"what_changed\":\"\",\"what_improved\":[],\"what_regressed\":[],\"transferable_insight\":\"Placing well-structured content ahead of known malformed elements can yield partial metric improvements but often fails to prevent overall structural invalidation.\",\"domain_tags\":[\"Document Structure\",\"Error Mitigation\",\"Content Formatting\"]}", "cost_usd": 0.0313299, "bootstrap_seed": 0, "agent_model": "gemini-3.1-pro-preview", "held_out_score": null, "criterion_names": ["quick_start_present", "api_documented", "prerequisites_clear", "examples_runnable", "error_guidance", "contribution_path"], "per_criterion_scores": {"quick_start_present": 0.6, "api_documented": 0.0, "prerequisites_clear": 0.4, "examples_runnable": 0.4, "error_guidance": 0.2, "contribution_path": 0.4}, "failure_classification": {"category": "incomplete_edit", "description": "The experiment introduced new sections but did not address or resolve the explicitly mentioned 'problematic unclosed code block'. This left the output in an inconsistent state where the fundamental structural issue (the unclosed block) likely prevented any improvement in the binary criteria score, or caused the output to remain invalid, leading to the low score despite other changes.", "fix_direction": "The next attempt should prioritize correctly resolving (closing, removing, or reformatting) the 'problematic unclosed code block' to ensure structural integrity and then re-evaluate the impact of adding the Quickstart, Architecture, and Troubleshooting sections.", "confidence": 0.9}, "drafts_generated": 1, "drafts_survived": 1}
{"id": "411be040-21a9-49aa-a3d8-25a230ff3176", "target_id": "B5-greedy", "git_sha": "561d7c24a15b24d46570ce4bf7dc00f0a57966c5", "pre_experiment_sha": "561d7c24a15b24d46570ce4bf7dc00f0a57966c5", "timestamp": "2026-04-24T06:47:25.922802+00:00", "hypothesis": "Insert `Quickstart` and `Troubleshooting` sections with concise, factual content before the unclosed code block to improve the documentation score without breaking the existing syntax.", "hypothesis_source": "agent", "mutation_diff_summary": "", "score": 0.9, "score_ci_lower": 0.3, "score_ci_upper": 1.6, "raw_scores": [1.5, 0.5, 0.5, 2.0, 0.0], "baseline_score": 1.8, "outcome": "DISCARDED", "failure_mode": null, "duration_seconds": 84.33555920817889, "tags": ["documentation", "markdown", "syntax-preservation"], "learnings": "{\"what_changed\":\"\",\"what_improved\":[],\"what_regressed\":[],\"transferable_insight\":\"Prepending valid, well-structured content to a document containing fundamental structural errors, such as unclosed syntax blocks, fails to improve overall quality because the underlying parsing failures remain unresolved.\",\"domain_tags\":[\"Documentation\",\"Syntax Validation\",\"Formatting\"]}", "cost_usd": 0.02611355, "bootstrap_seed": 0, "agent_model": "gemini-3.1-pro-preview", "held_out_score": null, "criterion_names": ["quick_start_present", "api_documented", "prerequisites_clear", "examples_runnable", "error_guidance", "contribution_path"], "per_criterion_scores": {"quick_start_present": 0.1, "api_documented": 0.0, "prerequisites_clear": 0.1, "examples_runnable": 0.2, "error_guidance": 0.2, "contribution_path": 0.3}, "failure_classification": {"category": "semantic_drift", "description": "The experiment successfully inserted the new sections without breaking syntax and in the correct location, achieving a high score of 0.9000. However, the hypothesis explicitly specified 'concise, factual content.' The 0.9000 score indicates that while the insertion was structurally correct, the content itself likely suffered from semantic issues. This could mean the generated text was verbose (not concise), contained minor inaccuracies (not factual), was unclear, or otherwise drifted from the intended high-quality meaning and utility expected for documentation. Such subtle quality deficiencies would lower the documentation score without triggering a hard syntax error or structural violation.", "fix_direction": "Future attempts should focus on enhancing the semantic quality of the generated content for the new sections. This involves refining the model's ability to produce highly concise, factually accurate, and relevant information for 'Quickstart' and 'Troubleshooting'. Implement more robust content validation mechanisms to check for clarity, conciseness, and factual correctness of the inserted text.", "confidence": 0.9}, "drafts_generated": 1, "drafts_survived": 1}
{"id": "30587402-fdf4-438a-aa01-c5d922587fdf", "target_id": "B5-greedy", "git_sha": "561d7c24a15b24d46570ce4bf7dc00f0a57966c5", "pre_experiment_sha": "561d7c24a15b24d46570ce4bf7dc00f0a57966c5", "timestamp": "2026-04-24T06:49:27.096442+00:00", "hypothesis": "Added Quickstart and Architecture sections between Overview and Prerequisites to improve documentation completeness while preserving the unclosed code block at the end.", "hypothesis_source": "agent", "mutation_diff_summary": "", "score": 0.6, "score_ci_lower": 0.3, "score_ci_upper": 0.9, "raw_scores": [0.5, 0.5, 1.0, 0.0, 1.0], "baseline_score": 1.8, "outcome": "DISCARDED", "failure_mode": null, "duration_seconds": 69.54082745802589, "tags": ["documentation", "readme", "sections"], "learnings": "{\"what_changed\":\"\",\"what_improved\":[],\"what_regressed\":[],\"transferable_insight\":\"Expanding a deliverable with new content while intentionally preserving underlying structural or formatting errors degrades its overall quality.\",\"domain_tags\":[\"Documentation\",\"Formatting\",\"Quality Assurance\"]}", "cost_usd": 0.029507449999999994, "bootstrap_seed": 0, "agent_model": "gemini-3.1-pro-preview", "held_out_score": null, "criterion_names": ["quick_start_present", "api_documented", "prerequisites_clear", "examples_runnable", "error_guidance", "contribution_path"], "per_criterion_scores": {"quick_start_present": 0.2, "api_documented": 0.0, "prerequisites_clear": 0.1, "examples_runnable": 0.0, "error_guidance": 0.0, "contribution_path": 0.3}, "failure_classification": {"category": "output_format", "description": "The experiment failed to preserve the unclosed code block at the end of the documentation as explicitly required. This resulted in a violation of the specified output structure, likely by closing, removing, or corrupting the block, despite potentially correctly adding the new sections.", "fix_direction": "Implement stricter adherence to negative constraints and specific structural requirements. Ensure the generation process can identify and maintain specific characteristics of existing elements (e.g., 'unclosed' states, specific formatting) rather than attempting to 'correct' or alter them.", "confidence": 0.85}, "drafts_generated": 1, "drafts_survived": 1}
{"id": "79603b34-a54e-434d-8ad1-105a48c47c72", "target_id": "B5-greedy", "git_sha": "561d7c24a15b24d46570ce4bf7dc00f0a57966c5", "pre_experiment_sha": "561d7c24a15b24d46570ce4bf7dc00f0a57966c5", "timestamp": "2026-04-24T06:50:54.821528+00:00", "hypothesis": "Insert Quickstart and Architecture sections between Overview and Prerequisites to improve binary criteria score while strictly preserving the unclosed code block at the end.", "hypothesis_source": "agent", "mutation_diff_summary": "", "score": 0.4, "score_ci_lower": 0.0, "score_ci_upper": 0.8, "raw_scores": [1.0, 0.0, 0.0, 1.0, 0.0], "baseline_score": 1.8, "outcome": "DISCARDED", "failure_mode": null, "duration_seconds": 58.95378708303906, "tags": ["documentation", "formatting"], "learnings": "{\"what_changed\":\"\",\"what_improved\":[],\"what_regressed\":[],\"transferable_insight\":\"Inserting actionable steps or complex conceptual overviews before foundational prerequisites disrupts the logical progression of instructional material and degrades comprehension.\",\"domain_tags\":[\"Information Architecture\",\"Technical Writing\",\"User Experience\"]}", "cost_usd": 0.02948785, "bootstrap_seed": 0, "agent_model": "gemini-3.1-pro-preview", "held_out_score": null, "criterion_names": ["quick_start_present", "api_documented", "prerequisites_clear", "examples_runnable", "error_guidance", "contribution_path"], "per_criterion_scores": {"quick_start_present": 0.0, "api_documented": 0.0, "prerequisites_clear": 0.0, "examples_runnable": 0.0, "error_guidance": 0.2, "contribution_path": 0.2}, "failure_classification": {"category": "output_format", "description": "The experiment failed to achieve the desired score, likely due to a violation of the expected output structure. The attempt to insert new sections (Quickstart and Architecture) either resulted in malformed or misplaced sections, or, more critically, failed to strictly preserve the unclosed code block at the end, leading to an invalid document format according to the evaluation criteria.", "fix_direction": "Future attempts should focus on robustly handling the document structure. Ensure that new sections are inserted with correct formatting and in the precise location specified. Implement strict checks to guarantee the exact preservation of critical elements like the 'unclosed code block', avoiding any modifications or contextual changes to it. Validate the output against a strict schema or structural rules before submission.", "confidence": 0.9}, "drafts_generated": 1, "drafts_survived": 1}
{"id": "f967fb63-120b-44c1-9465-18a1cb8d9f01", "target_id": "B5-greedy", "git_sha": "561d7c24a15b24d46570ce4bf7dc00f0a57966c5", "pre_experiment_sha": "561d7c24a15b24d46570ce4bf7dc00f0a57966c5", "timestamp": "2026-04-24T06:52:47.256851+00:00", "hypothesis": "Add concise Quickstart and Architecture sections after the Overview to improve binary criteria score while preserving the unclosed code block at the end.", "hypothesis_source": "agent", "mutation_diff_summary": "", "score": 1.9, "score_ci_lower": 0.5, "score_ci_upper": 3.3, "raw_scores": [0.5, 0.0, 4.0, 3.5, 1.5], "baseline_score": 1.8, "outcome": "DISCARDED", "failure_mode": null, "duration_seconds": 88.85511070792563, "tags": ["documentation", "formatting", "missing-sections"], "learnings": "{\"what_changed\":\"\",\"what_improved\":[],\"what_regressed\":[],\"transferable_insight\":\"Enhancing a document with new structural sections provides little value if underlying formatting errors are left unresolved.\",\"domain_tags\":[\"Document Structure\",\"Formatting\",\"Content Strategy\"]}", "cost_usd": 0.031047599999999998, "bootstrap_seed": 0, "agent_model": "gemini-3.1-pro-preview", "held_out_score": null, "criterion_names": ["quick_start_present", "api_documented", "prerequisites_clear", "examples_runnable", "error_guidance", "contribution_path"], "per_criterion_scores": {"quick_start_present": 0.6, "api_documented": 0.0, "prerequisites_clear": 0.2, "examples_runnable": 0.5, "error_guidance": 0.2, "contribution_path": 0.4}, "failure_classification": {"category": "syntax_error", "description": "The experiment likely failed to preserve the specific 'unclosed code block' at the end as explicitly instructed. Instead of maintaining its unclosed syntactic state, the model might have inadvertently 'fixed' it by closing the block or altering its structure, violating the specific instruction to preserve its existing (unclosed) syntax. This would result in a penalty on the binary criteria score if a check for this specific 'unclosed' state was included.", "fix_direction": "Reinforce the importance of literal adherence to specific, even unconventional, syntactic preservation constraints. Explicitly instruct the model to prioritize preserving exact syntax as given, rather than attempting to 'correct' or complete seemingly malformed elements. Potentially add examples illustrating the desired 'unclosed' state.", "confidence": 0.8}, "drafts_generated": 1, "drafts_survived": 1}
