{"id": "af02b653-91de-4530-a577-2879811f3b92", "target_id": "B5-greedy", "git_sha": "bdccf93406cb44987bed29cf971b5a6ce4c48e1a", "pre_experiment_sha": "bdccf93406cb44987bed29cf971b5a6ce4c48e1a", "timestamp": "2026-04-22T23:57:12.478808+00:00", "hypothesis": "Append 10 specific headings with placeholders at the end of the README as requested to fulfill the binary criteria.", "hypothesis_source": "agent", "mutation_diff_summary": "", "score": 2.2, "score_ci_lower": 1.4, "score_ci_upper": 3.2, "raw_scores": [4.0, 1.5, 1.0, 2.0, 2.5], "baseline_score": 2.4, "outcome": "DISCARDED", "failure_mode": null, "duration_seconds": 59.0304020838812, "tags": ["readme", "formatting", "placeholders"], "learnings": "{\"what_changed\":\"\",\"what_improved\":[],\"what_regressed\":[],\"transferable_insight\":\"Attempting to satisfy evaluation criteria by appending empty placeholders or boilerplate structure without meaningful content degrades overall quality.\",\"domain_tags\":[\"Documentation\",\"Quality Assurance\",\"Content Strategy\"]}", "cost_usd": 0.0331423, "bootstrap_seed": 0, "agent_model": "gemini-3.1-pro-preview", "held_out_score": null, "criterion_names": ["quick_start_present", "api_documented", "prerequisites_clear", "examples_runnable", "error_guidance", "contribution_path"], "per_criterion_scores": {"quick_start_present": 0.3, "api_documented": 0.4, "prerequisites_clear": 0.2, "examples_runnable": 0.5, "error_guidance": 0.2, "contribution_path": 0.6}, "failure_classification": {"category": "output_format", "description": "The experiment likely failed to adhere to the precise structural and content requirements specified in the hypothesis. This could include failing to append the exact number of headings (10), using incorrect or non-specific heading text, omitting or incorrectly formatting the placeholders, or failing to append the content at the designated location (end of the README). The low score of 2.2 suggests a significant deviation from the expected output format.", "fix_direction": "Improve the system's ability to meticulously parse and execute multi-faceted instructions regarding output structure, content details (specific text, placeholder format), and location of edits. Implement robust checks to ensure all components of the output specification are met, especially quantity, specific text, and formatting.", "confidence": 0.9}, "drafts_generated": 1, "drafts_survived": 1}
{"id": "a333b391-8b2b-45d1-9e6f-be8ca56d22db", "target_id": "B5-greedy", "git_sha": "bdccf93406cb44987bed29cf971b5a6ce4c48e1a", "pre_experiment_sha": "bdccf93406cb44987bed29cf971b5a6ce4c48e1a", "timestamp": "2026-04-22T23:59:26.909750+00:00", "hypothesis": "Transform the README into a strict prompt that instructs the target model to output the entire original text word-for-word without markdown wrappers or conversational filler, and to append exactly 10 specific headings with the sentence \"Content coming soon.\" preceded by two blank lines.", "hypothesis_source": "agent", "mutation_diff_summary": "", "score": 1.3, "score_ci_lower": 0.8, "score_ci_upper": 1.9, "raw_scores": [2.5, 1.0, 1.0, 0.5, 1.5], "baseline_score": 2.4, "outcome": "DISCARDED", "failure_mode": null, "duration_seconds": 94.2607961660251, "tags": ["prompt-engineering", "strict-formatting", "append-headings", "no-markdown-wrapper"], "learnings": "{\"what_changed\":\"\",\"what_improved\":[],\"what_regressed\":[],\"transferable_insight\":\"Combining strict verbatim text reproduction constraints with rigid structural additions often degrades model performance due to conflicting instruction-following demands.\",\"domain_tags\":[\"Prompt Engineering\",\"Instruction Following\",\"Constraint Satisfaction\"]}", "cost_usd": 0.027536949999999994, "bootstrap_seed": 0, "agent_model": "gemini-3.1-pro-preview", "held_out_score": null, "criterion_names": ["quick_start_present", "api_documented", "prerequisites_clear", "examples_runnable", "error_guidance", "contribution_path"], "per_criterion_scores": {"quick_start_present": 0.1, "api_documented": 0.2, "prerequisites_clear": 0.0, "examples_runnable": 0.2, "error_guidance": 0.4, "contribution_path": 0.4}, "failure_classification": {"category": "output_format", "description": "The experiment failed because the model did not adhere to the highly strict output format specified in the hypothesis. This includes potential issues such as not reproducing the original text word-for-word, including markdown wrappers or conversational filler, failing to append exactly 10 specific headings, not using the precise 'Content coming soon.' sentence, or incorrectly applying the two blank lines preceding the headings. The score of 1.3 indicates a significant deviation from the desired output structure and content fidelity.", "fix_direction": "Future attempts should focus on strengthening the prompt's instruction set for strict format adherence. This can be achieved by providing explicit negative constraints (e.g., 'DO NOT use markdown'), using few-shot examples that perfectly demonstrate the desired output structure, employing delimiters or other structural markers to guide the model, or breaking down the output generation into distinct, simpler sub-tasks (e.g., first output original text, then append structured content). Verification steps for each formatting rule should also be considered.", "confidence": 1.0}, "drafts_generated": 1, "drafts_survived": 1}
{"id": "cedcfc4c-8efb-4c8e-8526-44a65e2b67ee", "target_id": "B5-greedy", "git_sha": "bdccf93406cb44987bed29cf971b5a6ce4c48e1a", "pre_experiment_sha": "bdccf93406cb44987bed29cf971b5a6ce4c48e1a", "timestamp": "2026-04-23T00:01:18.527418+00:00", "hypothesis": "Convert the artifact into a strict instruction prompt that prepends clear, authoritative constraints for text manipulation, explicitly forbidding markdown wrapping and conversational filler while detailing the exact 10 headings and content to append.", "hypothesis_source": "agent", "mutation_diff_summary": "", "score": 1.1, "score_ci_lower": 0.8, "score_ci_upper": 1.4, "raw_scores": [1.5, 0.5, 1.0, 1.0, 1.5], "baseline_score": 2.4, "outcome": "DISCARDED", "failure_mode": null, "duration_seconds": 94.05130599997938, "tags": ["prompt-engineering", "strict-formatting", "instruction-following"], "learnings": "{\"what_changed\":\"\",\"what_improved\":[],\"what_regressed\":[],\"transferable_insight\":\"Overloading instructions with strict negative constraints and extensive structural requirements simultaneously degrades performance rather than improving compliance.\",\"domain_tags\":[\"Prompt Engineering\",\"Constraint Management\",\"Instruction Design\"]}", "cost_usd": 0.029673349999999998, "bootstrap_seed": 0, "agent_model": "gemini-3.1-pro-preview", "held_out_score": null, "criterion_names": ["quick_start_present", "api_documented", "prerequisites_clear", "examples_runnable", "error_guidance", "contribution_path"], "per_criterion_scores": {"quick_start_present": 0.1, "api_documented": 0.0, "prerequisites_clear": 0.3, "examples_runnable": 0.3, "error_guidance": 0.2, "contribution_path": 0.2}, "failure_classification": {"category": "output_format", "description": "The experiment failed because the model did not adhere to the strict output format and structural constraints specified in the prompt. This includes failure to avoid markdown wrapping, inclusion of conversational filler, or incorrect generation of the exact 10 headings and their content structure as detailed in the instructions. The score of 1.1000 indicates a significant deviation from the desired output schema.", "fix_direction": "Strengthen the negative constraints by providing clear examples of undesired output (e.g., 'DO NOT use markdown like **bold** or *italic*'). Consider using more explicit templating or a 'fill-in-the-blanks' approach for the 10 headings and their content. If the underlying model supports it, explore structured output formats like JSON with a defined schema for the artifact conversion to enforce the exact structure and content types more robustly.", "confidence": 0.95}, "drafts_generated": 1, "drafts_survived": 1}
{"id": "584f96e1-afd8-4c6f-9107-d383a1679088", "target_id": "B5-greedy", "git_sha": "bdccf93406cb44987bed29cf971b5a6ce4c48e1a", "pre_experiment_sha": "bdccf93406cb44987bed29cf971b5a6ce4c48e1a", "timestamp": "2026-04-23T00:03:30.946087+00:00", "hypothesis": "Update the prompt to strictly enforce exact text reproduction without markdown wrappers, and clearly list the 10 specific headings to append with the exact required sentence.", "hypothesis_source": "agent", "mutation_diff_summary": "", "score": 1.8, "score_ci_lower": 0.6, "score_ci_upper": 3.0024999999999635, "raw_scores": [0.5, 0.0, 4.0, 2.0, 2.5], "baseline_score": 2.4, "outcome": "DISCARDED", "failure_mode": null, "duration_seconds": 115.81317283399403, "tags": ["prompt-engineering", "constraint-enforcement"], "learnings": "{\"what_changed\":\"\",\"what_improved\":[],\"what_regressed\":[],\"transferable_insight\":\"Over-constraining instructions with rigid formatting rules and exhaustive lists often degrades overall performance rather than improving compliance.\",\"domain_tags\":[\"Prompt Engineering\",\"Constraint Management\",\"Instruction Design\"]}", "cost_usd": 0.025929899999999995, "bootstrap_seed": 0, "agent_model": "gemini-3.1-pro-preview", "held_out_score": null, "criterion_names": ["quick_start_present", "api_documented", "prerequisites_clear", "examples_runnable", "error_guidance", "contribution_path"], "per_criterion_scores": {"quick_start_present": 0.2, "api_documented": 0.2, "prerequisites_clear": 0.2, "examples_runnable": 0.4, "error_guidance": 0.4, "contribution_path": 0.4}, "failure_classification": {"category": "output_format", "description": "The experiment aimed to strictly enforce specific output formatting, including exact text reproduction without markdown wrappers and the precise listing of 10 headings followed by specific sentences. The low score indicates that the updated prompt failed to achieve these stringent formatting and reproduction requirements, suggesting the output likely still contained unwanted wrappers, did not reproduce text exactly, or deviated from the specified heading/sentence structure.", "fix_direction": "Refine prompt engineering to more explicitly and robustly prohibit markdown wrappers and enforce literal text reproduction. This could involve clearer negative constraints (e.g., 'DO NOT use markdown') and positive constraints specifying the exact output structure and content (e.g., using few-shot examples or direct string requirements). Test for robustness against variations in model output.", "confidence": 0.9}, "drafts_generated": 1, "drafts_survived": 1}
{"id": "c49cebf2-6eb8-4f61-9a8f-b96335abe7f5", "target_id": "B5-greedy", "git_sha": "bdccf93406cb44987bed29cf971b5a6ce4c48e1a", "pre_experiment_sha": "bdccf93406cb44987bed29cf971b5a6ce4c48e1a", "timestamp": "2026-04-23T00:05:45.211147+00:00", "hypothesis": "This mutation transforms the README into a strict system prompt that uses authoritative bullet points to force the target model to output the raw, verbatim text followed by exactly 10 appended headings and specific sentences, explicitly banning markdown wrappers and omissions without using forbidden meta-prompting terms.", "hypothesis_source": "agent", "mutation_diff_summary": "", "score": 0.5, "score_ci_lower": 0.0, "score_ci_upper": 1.3, "raw_scores": [0.5, 0.0, 0.0, 2.0, 0.0], "baseline_score": 2.4, "outcome": "DISCARDED", "failure_mode": null, "duration_seconds": 101.49312550015748, "tags": ["formatting", "strict-directives", "exact-reproduction", "heading-append"], "learnings": "{\"what_changed\":\"\",\"what_improved\":[],\"what_regressed\":[],\"transferable_insight\":\"Overloading instructions with strict, authoritative formatting and simultaneous complex positive and negative constraints degrades performance rather than improving compliance.\",\"domain_tags\":[\"Prompt Engineering\",\"Constraint Management\",\"Instruction Following\"]}", "cost_usd": 0.03113735, "bootstrap_seed": 0, "agent_model": "gemini-3.1-pro-preview", "held_out_score": null, "criterion_names": ["quick_start_present", "api_documented", "prerequisites_clear", "examples_runnable", "error_guidance", "contribution_path"], "per_criterion_scores": {"quick_start_present": 0.0, "api_documented": 0.0, "prerequisites_clear": 0.0, "examples_runnable": 0.0, "error_guidance": 0.2, "contribution_path": 0.3}, "failure_classification": {"category": "output_format", "description": "The experiment failed to enforce the strict output format constraints, such as ensuring raw verbatim text, producing exactly 10 appended headings and specific sentences, or explicitly banning markdown wrappers and omissions. The partial score of 0.5 indicates that while some elements might have been present, the precise structural and formatting requirements were not met.", "fix_direction": "Strengthen the system prompt's explicit instructions regarding output structure, element count, and forbidden formatting (e.g., markdown). Consider using more direct commands, negative examples, or a few-shot example that perfectly demonstrates the desired output structure, count, and lack of markdown wrappers to guide the model more effectively.", "confidence": 0.9}, "drafts_generated": 1, "drafts_survived": 1}
{"id": "b26d9736-279f-4af1-b0a0-d640e9971652", "target_id": "B5-greedy", "git_sha": "bdccf93406cb44987bed29cf971b5a6ce4c48e1a", "pre_experiment_sha": "bdccf93406cb44987bed29cf971b5a6ce4c48e1a", "timestamp": "2026-04-23T00:07:41.834275+00:00", "hypothesis": "Transform the artifact into a strict instruction prompt that ensures the target model outputs the raw, verbatim text with the exact 10 required headings appended, avoiding any markdown formatting errors or omissions.", "hypothesis_source": "agent", "mutation_diff_summary": "", "score": 1.8, "score_ci_lower": 1.0, "score_ci_upper": 2.5, "raw_scores": [2.5, 0.5, 2.5, 1.0, 2.5], "baseline_score": 2.4, "outcome": "DISCARDED", "failure_mode": null, "duration_seconds": 101.71427920809947, "tags": ["prompt-engineering", "strict-formatting", "completion-forcing"], "learnings": "{\"what_changed\":\"\",\"what_improved\":[],\"what_regressed\":[],\"transferable_insight\":\"Imposing overly strict constraints that simultaneously demand verbatim text reproduction and complex structural additions often degrades performance by creating conflicting generation objectives.\",\"domain_tags\":[\"Prompt Engineering\",\"Constraint Satisfaction\",\"Text Generation\"]}", "cost_usd": 0.0279371, "bootstrap_seed": 0, "agent_model": "gemini-3.1-pro-preview", "held_out_score": null, "criterion_names": ["quick_start_present", "api_documented", "prerequisites_clear", "examples_runnable", "error_guidance", "contribution_path"], "per_criterion_scores": {"quick_start_present": 0.2, "api_documented": 0.1, "prerequisites_clear": 0.2, "examples_runnable": 0.3, "error_guidance": 0.4, "contribution_path": 0.6}, "failure_classification": {"category": "output_format", "description": "The target model's output failed to adhere to the specified structural and formatting requirements. This likely includes incorrect appending or count of the 10 required headings, or the presence of markdown formatting errors or omissions, directly violating the strict output format stipulated by the prompt.", "fix_direction": "Refine the instruction prompt to be more explicit and unambiguous regarding the exact output structure, the precise number and placement of headings, and the strict avoidance of markdown formatting errors. Consider using advanced prompting techniques like few-shot examples or XML/JSON structures within the prompt to define the desired output schema rigidly.", "confidence": 0.95}, "drafts_generated": 1, "drafts_survived": 1}
{"id": "ccf1d7f8-c324-4b87-8e2d-e3e8b8fdc646", "target_id": "B5-greedy", "git_sha": "bdccf93406cb44987bed29cf971b5a6ce4c48e1a", "pre_experiment_sha": "bdccf93406cb44987bed29cf971b5a6ce4c48e1a", "timestamp": "2026-04-23T00:09:20.475293+00:00", "hypothesis": "Append the 10 missing and additional technical headings to the end of the README, each with the exact placeholder text \"Content coming soon.\" and preceded by exactly two blank lines, fulfilling the criteria for complete section stubs.", "hypothesis_source": "agent", "mutation_diff_summary": "", "score": 1.2, "score_ci_lower": 0.6, "score_ci_upper": 1.8, "raw_scores": [1.0, 0.0, 1.0, 2.0, 2.0], "baseline_score": 2.4, "outcome": "DISCARDED", "failure_mode": null, "duration_seconds": 81.00394187495112, "tags": ["formatting", "completeness", "technical-readme"], "learnings": "{\"what_changed\":\"\",\"what_improved\":[],\"what_regressed\":[],\"transferable_insight\":\"Populating a document with numerous empty placeholder sections degrades its overall quality by introducing uninformative clutter.\",\"domain_tags\":[\"Documentation\",\"Content Strategy\",\"Information Architecture\"]}", "cost_usd": 0.0256815, "bootstrap_seed": 0, "agent_model": "gemini-3.1-pro-preview", "held_out_score": null, "criterion_names": ["quick_start_present", "api_documented", "prerequisites_clear", "examples_runnable", "error_guidance", "contribution_path"], "per_criterion_scores": {"quick_start_present": 0.2, "api_documented": 0.0, "prerequisites_clear": 0.0, "examples_runnable": 0.4, "error_guidance": 0.2, "contribution_path": 0.4}, "failure_classification": {"category": "output_format", "description": "The experiment failed to adhere to the precise structural and formatting requirements specified in the hypothesis. This likely includes deviations such as an incorrect number of headings appended (not 10), placeholder text that did not exactly match 'Content coming soon.', an incorrect number of blank lines preceding each heading (not exactly two), or the headings themselves not being properly formatted as stubs. The very low score of 1.2000 suggests a significant violation of these explicit output structure criteria.", "fix_direction": "Implement strict validation checks for all specified output format criteria: verify the exact count of headings (10), the precise string content of the placeholder text, the exact number of blank lines (two) preceding each heading, and ensure the headings are correctly formatted as Markdown stubs. Confirm the content is only appended to the end of the README.", "confidence": 0.95}, "drafts_generated": 1, "drafts_survived": 1}
{"id": "ca0a4a13-bb5d-4181-816d-e8a12ace8921", "target_id": "B5-greedy", "git_sha": "bdccf93406cb44987bed29cf971b5a6ce4c48e1a", "pre_experiment_sha": "bdccf93406cb44987bed29cf971b5a6ce4c48e1a", "timestamp": "2026-04-23T00:11:37.075508+00:00", "hypothesis": "Restructure the artifact into a strict instruction set for the target model, explicitly banning markdown wrappers, conversational filler, and omissions, while detailing the exact 10 headings to append with the required sentence.", "hypothesis_source": "agent", "mutation_diff_summary": "", "score": 2.0, "score_ci_lower": 0.9, "score_ci_upper": 3.0, "raw_scores": [0.0, 2.0, 1.5, 3.5, 3.0], "baseline_score": 2.4, "outcome": "DISCARDED", "failure_mode": null, "duration_seconds": 92.39217783301137, "tags": ["prompt-engineering", "strict-formatting", "direct-output", "no-markdown-wrapper"], "learnings": "{\"what_changed\":\"\",\"what_improved\":[],\"what_regressed\":[],\"transferable_insight\":\"Imposing overly strict negative constraints and highly rigid structural formatting rules often degrades system performance rather than improving compliance.\",\"domain_tags\":[\"Prompt Engineering\",\"Constraint Management\",\"Instruction Design\"]}", "cost_usd": 0.0313187, "bootstrap_seed": 0, "agent_model": "gemini-3.1-pro-preview", "held_out_score": null, "criterion_names": ["quick_start_present", "api_documented", "prerequisites_clear", "examples_runnable", "error_guidance", "contribution_path"], "per_criterion_scores": {"quick_start_present": 0.5, "api_documented": 0.0, "prerequisites_clear": 0.5, "examples_runnable": 0.2, "error_guidance": 0.4, "contribution_path": 0.4}, "failure_classification": {"category": "output_format", "description": "The experiment aimed to enforce a strict output structure, explicitly banning certain elements (markdown, filler) and mandating others (10 headings with required sentences). Given the hypothesis's focus, the failure indicates the model's output likely violated these specified structural or formatting constraints.", "fix_direction": "Refine the prompt by providing concrete examples of the desired output format and undesired elements (few-shot), further emphasizing the strictness of the requirements, or by simplifying the number of concurrent formatting constraints to debug adherence incrementally.", "confidence": 0.95}, "drafts_generated": 1, "drafts_survived": 1}
