{"id": "262b47bf-d7b6-404d-8c07-de127a5137f1", "target_id": "B5-greedy", "git_sha": "bdccf93406cb44987bed29cf971b5a6ce4c48e1a", "pre_experiment_sha": "bdccf93406cb44987bed29cf971b5a6ce4c48e1a", "timestamp": "2026-04-22T23:12:42.849444+00:00", "hypothesis": "Expand the README with all standard open-source sections and generic boilerplate, avoiding triple backticks to prevent output formatting errors.", "hypothesis_source": "agent", "mutation_diff_summary": "", "score": 1.6, "score_ci_lower": 0.6, "score_ci_upper": 2.6, "raw_scores": [3.0, 0.0, 2.5, 0.5, 2.0], "baseline_score": 2.4, "outcome": "DISCARDED", "failure_mode": null, "duration_seconds": 51.71860745921731, "tags": ["documentation", "markdown", "formatting"], "learnings": "{\"what_changed\":\"\",\"what_improved\":[],\"what_regressed\":[],\"transferable_insight\":\"Bloating documentation with generic boilerplate while avoiding standard formatting conventions degrades its readability and overall utility.\",\"domain_tags\":[\"Documentation\",\"Technical Writing\",\"Formatting\"]}", "cost_usd": 0.02916175, "bootstrap_seed": 0, "agent_model": "gemini-3.1-pro-preview", "held_out_score": null, "criterion_names": ["quick_start_present", "api_documented", "prerequisites_clear", "examples_runnable", "error_guidance", "contribution_path"], "per_criterion_scores": {"quick_start_present": 0.3, "api_documented": 0.0, "prerequisites_clear": 0.3, "examples_runnable": 0.5, "error_guidance": 0.0, "contribution_path": 0.5}, "failure_classification": {"category": "output_format", "description": "The experiment aimed to expand the README with standard sections while specifically trying to prevent output formatting errors by avoiding triple backticks. Despite this explicit instruction, the experiment failed (score 1.6000). This suggests that some form of output formatting issue, structural violation, or rendering problem likely still occurred in the generated README, or the alternative formatting approach led to new formatting errors. The 'unknown' failure mode indicates the precise nature was not classified, but the hypothesis strongly points to a formatting-related problem.", "fix_direction": "Investigate the actual rendered output of the generated README to pinpoint the specific formatting issues. Analyze whether the alternative to triple backticks was correctly applied and rendered, or if other Markdown syntax elements were malformed. Refine the prompt to guide the model towards generating robust and correctly rendered Markdown, perhaps with explicit examples of desired formatting or by instructing it on alternative ways to represent code/text blocks without causing rendering issues.", "confidence": 0.85}, "drafts_generated": 1, "drafts_survived": 1}
{"id": "a374361a-e0c5-47ea-b601-fab885bcaa23", "target_id": "B5-greedy", "git_sha": "bdccf93406cb44987bed29cf971b5a6ce4c48e1a", "pre_experiment_sha": "bdccf93406cb44987bed29cf971b5a6ce4c48e1a", "timestamp": "2026-04-22T23:14:04.807095+00:00", "hypothesis": "Expand the README to include all requested standard open-source sections with brief, generic boilerplate to maximize the structural completeness score while avoiding markdown output format errors.", "hypothesis_source": "agent", "mutation_diff_summary": "", "score": 1.8, "score_ci_lower": 0.7, "score_ci_upper": 2.9, "raw_scores": [1.5, 3.5, 1.0, 3.0, 0.0], "baseline_score": 2.4, "outcome": "DISCARDED", "failure_mode": null, "duration_seconds": 62.84902562503703, "tags": ["readme", "documentation", "structure", "formatting"], "learnings": "{\"what_changed\":\"\",\"what_improved\":[],\"what_regressed\":[],\"transferable_insight\":\"Fulfilling structural requirements using generic boilerplate rather than meaningful content degrades overall quality and evaluation metrics.\",\"domain_tags\":[\"Documentation\",\"Content Strategy\",\"Quality Evaluation\"]}", "cost_usd": 0.03387405, "bootstrap_seed": 0, "agent_model": "gemini-3.1-pro-preview", "held_out_score": null, "criterion_names": ["quick_start_present", "api_documented", "prerequisites_clear", "examples_runnable", "error_guidance", "contribution_path"], "per_criterion_scores": {"quick_start_present": 0.3, "api_documented": 0.1, "prerequisites_clear": 0.2, "examples_runnable": 0.4, "error_guidance": 0.0, "contribution_path": 0.8}, "failure_classification": {"category": "syntax_error", "description": "The experiment likely produced a README file with invalid markdown syntax. This could include malformed headers, lists, links, or other elements, preventing the markdown from being correctly parsed or rendered. This directly violates the 'avoiding markdown output format errors' clause of the hypothesis and would severely hinder the evaluation of 'structural completeness score' as the structure itself would be broken or indiscernible. The very low score of 1.8 strongly suggests a fundamental output issue rather than a subtle semantic one.", "fix_direction": "Focus on robust markdown generation. Implement strict validation for markdown syntax to ensure all generated sections and boilerplate adhere to correct markdown formatting rules. Utilize a markdown linter or parser to pre-validate the output before evaluation to catch fundamental syntax issues.", "confidence": 0.9}, "drafts_generated": 1, "drafts_survived": 1}
{"id": "fd9cc2b8-18f0-4875-8efd-c7e488f20f6d", "target_id": "B5-greedy", "git_sha": "bdccf93406cb44987bed29cf971b5a6ce4c48e1a", "pre_experiment_sha": "bdccf93406cb44987bed29cf971b5a6ce4c48e1a", "timestamp": "2026-04-22T23:15:08.355365+00:00", "hypothesis": "Expand the README to include all standard open-source project sections using brief generic boilerplate without triple backticks.", "hypothesis_source": "agent", "mutation_diff_summary": "", "score": 0.8, "score_ci_lower": 0.5, "score_ci_upper": 1.4, "raw_scores": [0.5, 0.5, 0.5, 0.5, 2.0], "baseline_score": 2.4, "outcome": "DISCARDED", "failure_mode": null, "duration_seconds": 48.87901733419858, "tags": ["documentation", "readme", "boilerplate"], "learnings": "{\"what_changed\":\"\",\"what_improved\":[],\"what_regressed\":[],\"transferable_insight\":\"Populating documents with generic boilerplate merely to satisfy standard structural templates degrades overall quality by introducing low-value noise.\",\"domain_tags\":[\"Documentation\",\"Content Strategy\",\"Information Design\"]}", "cost_usd": 0.020932000000000003, "bootstrap_seed": 0, "agent_model": "gemini-3.1-pro-preview", "held_out_score": null, "criterion_names": ["quick_start_present", "api_documented", "prerequisites_clear", "examples_runnable", "error_guidance", "contribution_path"], "per_criterion_scores": {"quick_start_present": 0.2, "api_documented": 0.2, "prerequisites_clear": 0.0, "examples_runnable": 0.2, "error_guidance": 0.0, "contribution_path": 0.2}, "failure_classification": {"category": "incomplete_edit", "description": "The experiment likely failed to include *all* standard open-source project sections as required, or the boilerplate content within some sections was not fully generated, leading to a partial score of 0.8. While the instruction regarding 'without triple backticks' is a critical formatting constraint, the primary indicator for a 0.8 score on an 'expansion' task often points to a lack of completeness in fulfilling all parts of the content requirement.", "fix_direction": "Ensure a comprehensive understanding of what constitutes 'all standard open-source project sections' and verify that each required section is present and contains appropriate boilerplate. Additionally, specifically verify adherence to the negative constraint (no triple backticks) as a distinct quality check, as this could also contribute to a reduced score if violated.", "confidence": 0.8}, "drafts_generated": 1, "drafts_survived": 1}
{"id": "9c4827a5-ece7-4ed1-97dd-59d9b55489f4", "target_id": "B5-greedy", "git_sha": "bdccf93406cb44987bed29cf971b5a6ce4c48e1a", "pre_experiment_sha": "bdccf93406cb44987bed29cf971b5a6ce4c48e1a", "timestamp": "2026-04-22T23:17:11.609145+00:00", "hypothesis": "Expand the README to include all requested standard sections using 4-space indentation for code blocks to prevent parsing errors.", "hypothesis_source": "agent", "mutation_diff_summary": "", "score": 1.8, "score_ci_lower": 0.2, "score_ci_upper": 3.4, "raw_scores": [4.5, 0.0, 3.5, 1.0, 0.0], "baseline_score": 2.4, "outcome": "DISCARDED", "failure_mode": null, "duration_seconds": 87.54967949981801, "tags": ["documentation", "formatting", "complete"], "learnings": "{\"what_changed\":\"\",\"what_improved\":[],\"what_regressed\":[],\"transferable_insight\":\"Relying on spacing-based indentation rather than explicit delimiters for formatting can introduce parsing errors and degrade document quality.\",\"domain_tags\":[\"Documentation\",\"Formatting\",\"Data Parsing\"]}", "cost_usd": 0.02732935, "bootstrap_seed": 0, "agent_model": "gemini-3.1-pro-preview", "held_out_score": null, "criterion_names": ["quick_start_present", "api_documented", "prerequisites_clear", "examples_runnable", "error_guidance", "contribution_path"], "per_criterion_scores": {"quick_start_present": 0.3, "api_documented": 0.1, "prerequisites_clear": 0.3, "examples_runnable": 0.6, "error_guidance": 0.1, "contribution_path": 0.4}, "failure_classification": {"category": "syntax_error", "description": "The experiment likely failed because the README's content, particularly code blocks or other structured sections, contained syntax errors. The attempt to use 4-space indentation to prevent parsing errors, as stated in the hypothesis, was unsuccessful, leading to a malformed or unparseable output, evidenced by the very low score.", "fix_direction": "Implement strict validation for Markdown (or relevant markup language) syntax within the README. Focus on ensuring correct application of indentation rules for code blocks and other structural elements, and verify that the overall document structure is consistently parseable by standard renderers. Consider using a linter for README files.", "confidence": 0.9}, "drafts_generated": 1, "drafts_survived": 1}
{"id": "ad7784ca-1166-4463-a933-3c65edc0cd6d", "target_id": "B5-greedy", "git_sha": "bdccf93406cb44987bed29cf971b5a6ce4c48e1a", "pre_experiment_sha": "bdccf93406cb44987bed29cf971b5a6ce4c48e1a", "timestamp": "2026-04-22T23:18:51.757871+00:00", "hypothesis": "Expand the README to include all requested standard sections with concise content while replacing triple backticks with 4-space indentation to prevent parsing errors.", "hypothesis_source": "agent", "mutation_diff_summary": "", "score": 0.9, "score_ci_lower": 0.2, "score_ci_upper": 1.6, "raw_scores": [0.0, 0.0, 1.0, 1.5, 2.0], "baseline_score": 2.4, "outcome": "DISCARDED", "failure_mode": null, "duration_seconds": 81.91170950001106, "tags": ["documentation", "formatting", "completeness"], "learnings": "{\"what_changed\":\"\",\"what_improved\":[],\"what_regressed\":[],\"transferable_insight\":\"Modifying widely accepted formatting conventions to bypass specific parsing errors often introduces broader compatibility and readability regressions.\",\"domain_tags\":[\"Documentation\",\"Formatting\",\"Technical Writing\"]}", "cost_usd": 0.0214399, "bootstrap_seed": 0, "agent_model": "gemini-3.1-pro-preview", "held_out_score": null, "criterion_names": ["quick_start_present", "api_documented", "prerequisites_clear", "examples_runnable", "error_guidance", "contribution_path"], "per_criterion_scores": {"quick_start_present": 0.2, "api_documented": 0.0, "prerequisites_clear": 0.0, "examples_runnable": 0.4, "error_guidance": 0.1, "contribution_path": 0.2}, "failure_classification": {"category": "output_format", "description": "The experiment likely failed due to inconsistencies or inaccuracies in the output markdown format, specifically regarding the replacement of triple backticks with 4-space indentation. While the goal was to prevent parsing errors by this formatting change, the application was either not fully consistent, or introduced new formatting issues (e.g., incorrect indentation causing markdown rendering issues), leading to a violation of the desired output structure and a score of 0.9000.", "fix_direction": "Improve the model's precision in applying specific markdown formatting rules, particularly for code blocks and consistent indentation. Implement robust checks to ensure the transformed output strictly adheres to the desired format and renders correctly across common markdown parsers, thereby preventing any form of 'parsing errors' related to structure or indentation.", "confidence": 0.85}, "drafts_generated": 1, "drafts_survived": 1}
{"id": "ca784fc0-be58-42a1-97f2-c1c3150d2507", "target_id": "B5-greedy", "git_sha": "bdccf93406cb44987bed29cf971b5a6ce4c48e1a", "pre_experiment_sha": "bdccf93406cb44987bed29cf971b5a6ce4c48e1a", "timestamp": "2026-04-22T23:21:06.907485+00:00", "hypothesis": "Expand the README to include all requested standard sections with concise content, preserving existing context and replacing triple backticks with 4-space indentation to satisfy parser constraints.", "hypothesis_source": "agent", "mutation_diff_summary": "", "score": 1.2, "score_ci_lower": 0.2, "score_ci_upper": 2.2, "raw_scores": [0.0, 3.0, 2.0, 0.0, 1.0], "baseline_score": 2.4, "outcome": "DISCARDED", "failure_mode": null, "duration_seconds": 98.27066120901145, "tags": ["documentation", "formatting", "complete-sections"], "learnings": "{\"what_changed\":\"\",\"what_improved\":[],\"what_regressed\":[],\"transferable_insight\":\"Compromising widely accepted formatting standards to bypass specific technical constraints often degrades overall compatibility and quality.\",\"domain_tags\":[\"Documentation\",\"Formatting\",\"Compatibility\"]}", "cost_usd": 0.0318888, "bootstrap_seed": 0, "agent_model": "gemini-3.1-pro-preview", "held_out_score": null, "criterion_names": ["quick_start_present", "api_documented", "prerequisites_clear", "examples_runnable", "error_guidance", "contribution_path"], "per_criterion_scores": {"quick_start_present": 0.0, "api_documented": 0.0, "prerequisites_clear": 0.2, "examples_runnable": 0.4, "error_guidance": 0.2, "contribution_path": 0.4}, "failure_classification": {"category": "syntax_error", "description": "The experiment likely introduced markdown syntax errors, specifically failing to properly convert triple backticks to 4-space indentation for code blocks as required by parser constraints. This would cause the README to be incorrectly parsed or rendered, leading to a significant failure.", "fix_direction": "Implement robust markdown syntax generation, paying close attention to code block formatting (4-space indentation vs. backticks) and ensuring all new sections adhere to correct markdown grammar. Validate the generated output against the target markdown parser or linter.", "confidence": 0.9}, "drafts_generated": 1, "drafts_survived": 1}
{"id": "1fbcf4b7-f624-425d-b0e2-ef8c81d8da28", "target_id": "B5-greedy", "git_sha": "bdccf93406cb44987bed29cf971b5a6ce4c48e1a", "pre_experiment_sha": "bdccf93406cb44987bed29cf971b5a6ce4c48e1a", "timestamp": "2026-04-22T23:22:59.338543+00:00", "hypothesis": "Expand the README to include all requested sections while replacing triple backticks with 4-space indentation to prevent parser errors.", "hypothesis_source": "agent", "mutation_diff_summary": "", "score": 1.7, "score_ci_lower": 0.7, "score_ci_upper": 2.8, "raw_scores": [2.5, 1.5, 1.0, 3.5, 0.0], "baseline_score": 2.4, "outcome": "DISCARDED", "failure_mode": null, "duration_seconds": 79.2976757909637, "tags": ["documentation", "formatting"], "learnings": "{\"what_changed\":\"\",\"what_improved\":[],\"what_regressed\":[],\"transferable_insight\":\"Replacing explicit structural markers with implicit formatting to bypass parser errors can backfire and degrade system performance by violating expected standards.\",\"domain_tags\":[\"Documentation\",\"Formatting\",\"Parsing\"]}", "cost_usd": 0.029245300000000002, "bootstrap_seed": 0, "agent_model": "gemini-3.1-pro-preview", "held_out_score": null, "criterion_names": ["quick_start_present", "api_documented", "prerequisites_clear", "examples_runnable", "error_guidance", "contribution_path"], "per_criterion_scores": {"quick_start_present": 0.6, "api_documented": 0.1, "prerequisites_clear": 0.1, "examples_runnable": 0.3, "error_guidance": 0.2, "contribution_path": 0.4}, "failure_classification": {"category": "syntax_error", "description": "The experiment aimed to replace triple backticks with 4-space indentation to prevent parser errors. The failure likely indicates that this replacement was either not executed correctly, or it failed to prevent the targeted parser errors, resulting in malformed or unparseable content within the README file. This could also mean new syntax issues were introduced by the changes.", "fix_direction": "Ensure that the replacement of triple backticks with 4-space indentation is comprehensive and correctly applied to all relevant sections, strictly adhering to the parsing rules of the intended markdown processor or content renderer. Validate the output for any remaining parser errors or newly introduced syntax issues.", "confidence": 0.9}, "drafts_generated": 1, "drafts_survived": 1}
{"id": "6781a893-d4cd-4ab3-9506-713f2894607f", "target_id": "B5-greedy", "git_sha": "bdccf93406cb44987bed29cf971b5a6ce4c48e1a", "pre_experiment_sha": "bdccf93406cb44987bed29cf971b5a6ce4c48e1a", "timestamp": "2026-04-22T23:24:23.732199+00:00", "hypothesis": "Expand the README to include all required sections while replacing triple backticks with 4-space indentation to prevent parsing errors.", "hypothesis_source": "agent", "mutation_diff_summary": "", "score": 1.8, "score_ci_lower": 0.8, "score_ci_upper": 2.8, "raw_scores": [2.0, 2.0, 1.5, 3.5, 0.0], "baseline_score": 2.4, "outcome": "DISCARDED", "failure_mode": null, "duration_seconds": 66.83974770898931, "tags": ["readme", "documentation", "formatting"], "learnings": "{\"what_changed\":\"\",\"what_improved\":[],\"what_regressed\":[],\"transferable_insight\":\"Attempting to resolve parsing errors by replacing standard formatting conventions with alternative syntax often degrades system compatibility and overall performance.\",\"domain_tags\":[\"Documentation\",\"Formatting\",\"Software Engineering\"]}", "cost_usd": 0.027306800000000003, "bootstrap_seed": 0, "agent_model": "gemini-3.1-pro-preview", "held_out_score": null, "criterion_names": ["quick_start_present", "api_documented", "prerequisites_clear", "examples_runnable", "error_guidance", "contribution_path"], "per_criterion_scores": {"quick_start_present": 0.3, "api_documented": 0.1, "prerequisites_clear": 0.3, "examples_runnable": 0.3, "error_guidance": 0.2, "contribution_path": 0.6}, "failure_classification": {"category": "syntax_error", "description": "The hypothesis explicitly aimed to prevent parsing errors by replacing triple backticks with 4-space indentation. The failure suggests that either the intended fix for parsing issues was not correctly or completely applied, or new syntax errors were introduced during the README expansion, leading to the document failing to parse correctly.", "fix_direction": "Ensure that the replacement of triple backticks with 4-space indentation is consistently and correctly applied to all code blocks. Additionally, validate the entire README's Markdown syntax after expansion using a linter or parser to catch any new or overlooked syntax errors.", "confidence": 0.9}, "drafts_generated": 1, "drafts_survived": 1}
