{"id": "9801aaa2-7851-4a9c-8904-4cd63a7b11b1", "target_id": "B5-greedy", "git_sha": "50b8bd76b4e059483ccdf0fbee4ae011029180c3", "pre_experiment_sha": "50b8bd76b4e059483ccdf0fbee4ae011029180c3", "timestamp": "2026-04-24T06:24:54.436132+00:00", "hypothesis": "Add minimal but complete sections for Quickstart, Usage, Architecture, Operations, Configuration, Examples, Troubleshooting, FAQ, Contributing, and License, along with code blocks and a version badge, to fulfill binary criteria documentation requirements without truncation.", "hypothesis_source": "agent", "mutation_diff_summary": "", "score": 1.0, "score_ci_lower": 0.3, "score_ci_upper": 1.9, "raw_scores": [0.5, 0.0, 0.5, 1.5, 2.5], "baseline_score": 1.5, "outcome": "DISCARDED", "failure_mode": null, "duration_seconds": 59.928397624986246, "tags": ["documentation", "markdown", "enhancement"], "learnings": "{\"what_changed\":\"\",\"what_improved\":[],\"what_regressed\":[],\"transferable_insight\":\"Fulfilling comprehensive structural checklists with superficial or minimal content degrades overall quality rather than improving it.\",\"domain_tags\":[\"Documentation\",\"Content Strategy\",\"Quality Assurance\"]}", "cost_usd": 0.021934949999999998, "bootstrap_seed": 0, "agent_model": "gemini-3.1-pro-preview", "held_out_score": null, "criterion_names": ["quick_start_present", "api_documented", "prerequisites_clear", "examples_runnable", "error_guidance", "contribution_path"], "per_criterion_scores": {"quick_start_present": 0.2, "api_documented": 0.1, "prerequisites_clear": 0.0, "examples_runnable": 0.4, "error_guidance": 0.1, "contribution_path": 0.2}, "failure_classification": {"category": "incomplete_edit", "description": "The experiment failed to produce documentation that was 'minimal but complete' and 'without truncation' as hypothesized. A score of 1.0000 for a failed experiment suggests a complete lack of compliance, likely due to missing content, empty sections, or truncated text, which prevented the fulfillment of the binary documentation criteria.", "fix_direction": "Focus on ensuring that all specified sections (Quickstart, Usage, Architecture, etc.) are fully present and populated with content that is genuinely 'complete' and avoids any form of truncation. Implement mechanisms to verify content completeness and integrity before final output.", "confidence": 0.9}, "drafts_generated": 1, "drafts_survived": 1}
{"id": "4ab60f65-33a0-4869-95f8-19bf7301f436", "target_id": "B5-greedy", "git_sha": "50b8bd76b4e059483ccdf0fbee4ae011029180c3", "pre_experiment_sha": "50b8bd76b4e059483ccdf0fbee4ae011029180c3", "timestamp": "2026-04-24T06:26:53.941655+00:00", "hypothesis": "Complete the document with the required standard headings, keeping content extremely concise to prevent truncation, and remove unsupported extra sections from the TOC.", "hypothesis_source": "agent", "mutation_diff_summary": "", "score": 1.3, "score_ci_lower": 0.5, "score_ci_upper": 2.1, "raw_scores": [2.5, 0.0, 1.5, 2.0, 0.5], "baseline_score": 1.5, "outcome": "DISCARDED", "failure_mode": null, "duration_seconds": 68.12656775000505, "tags": ["documentation", "readme", "formatting"], "learnings": "{\"what_changed\":\"\",\"what_improved\":[],\"what_regressed\":[],\"transferable_insight\":\"Sacrificing content depth and structural flexibility solely to prevent length truncation degrades the overall quality of the output.\",\"domain_tags\":[\"Content Generation\",\"Length Management\",\"Document Structure\"]}", "cost_usd": 0.025628849999999998, "bootstrap_seed": 0, "agent_model": "gemini-3.1-pro-preview", "held_out_score": null, "criterion_names": ["quick_start_present", "api_documented", "prerequisites_clear", "examples_runnable", "error_guidance", "contribution_path"], "per_criterion_scores": {"quick_start_present": 0.3, "api_documented": 0.0, "prerequisites_clear": 0.1, "examples_runnable": 0.2, "error_guidance": 0.2, "contribution_path": 0.5}, "failure_classification": {"category": "output_format", "description": "The experiment likely failed due to a violation of the expected output structure. The hypothesis required completing the document with 'standard headings' and modifying the 'TOC'. A score of 1.3000 suggests a fundamental failure, possibly indicating that the headings were not correctly formatted (e.g., incorrect markdown or missing structural markers) or that the Table of Contents was either malformed, not edited correctly, or its structure was corrupted. The output likely did not adhere to the specified structural schema for a properly formatted document.", "fix_direction": "Improve the model's understanding and adherence to document formatting rules and structural syntax (e.g., markdown for headings, proper TOC generation/editing). Provide explicit examples of the desired output structure and syntax for 'standard headings' and a correctly formatted Table of Contents. Emphasize validation of the output's structural integrity.", "confidence": 0.85}, "drafts_generated": 1, "drafts_survived": 1}
{"id": "2e5d6693-473d-4a80-b6b3-59d51ecb6d5a", "target_id": "B5-greedy", "git_sha": "50b8bd76b4e059483ccdf0fbee4ae011029180c3", "pre_experiment_sha": "50b8bd76b4e059483ccdf0fbee4ae011029180c3", "timestamp": "2026-04-24T06:28:24.562495+00:00", "hypothesis": "Add missing standard sections with concise content to prevent truncation and remove unnecessary extra sections.", "hypothesis_source": "agent", "mutation_diff_summary": "", "score": 1.5, "score_ci_lower": 1.2, "score_ci_upper": 1.8, "raw_scores": [2.0, 1.0, 1.5, 1.5, 1.5], "baseline_score": 1.5, "outcome": "DISCARDED", "failure_mode": null, "duration_seconds": 57.274751000106335, "tags": ["readme", "documentation", "formatting"], "learnings": "{\"what_changed\":\"\",\"what_improved\":[],\"what_regressed\":[],\"transferable_insight\":\"Standardizing document structure by adding missing sections and removing extraneous ones may have no measurable impact on performance if the core information is already accessible.\",\"domain_tags\":[\"Document Formatting\",\"Information Architecture\",\"Content Optimization\"]}", "cost_usd": 0.026037150000000002, "bootstrap_seed": 0, "agent_model": "gemini-3.1-pro-preview", "held_out_score": null, "criterion_names": ["quick_start_present", "api_documented", "prerequisites_clear", "examples_runnable", "error_guidance", "contribution_path"], "per_criterion_scores": {"quick_start_present": 0.4, "api_documented": 0.0, "prerequisites_clear": 0.0, "examples_runnable": 0.2, "error_guidance": 0.5, "contribution_path": 0.4}, "failure_classification": {"category": "output_format", "description": "The experiment aimed to standardize the output structure by adding missing standard sections and removing extra ones, while also ensuring concise content to prevent truncation. A failure indicates that the output still violated the desired structural or length constraints, such as missing required sections, containing unnecessary sections, or having content truncated, thereby failing to adhere to the specified output format.", "fix_direction": "Refine the logic for identifying and generating required standard sections, and for accurately detecting and removing unnecessary sections. Implement robust content length control to ensure conciseness and prevent truncation within the output structure.", "confidence": 0.9}, "drafts_generated": 1, "drafts_survived": 1}
{"id": "d9f65c43-e81e-42ef-b18e-d1b3159ce343", "target_id": "B5-greedy", "git_sha": "50b8bd76b4e059483ccdf0fbee4ae011029180c3", "pre_experiment_sha": "50b8bd76b4e059483ccdf0fbee4ae011029180c3", "timestamp": "2026-04-24T06:29:34.883089+00:00", "hypothesis": "Complete the missing sections of the README with concise content, including Architecture, Examples, Troubleshooting, and FAQ, while fixing the markdown formatting and removing unnecessary sections to prevent truncation.", "hypothesis_source": "agent", "mutation_diff_summary": "", "score": 1.8, "score_ci_lower": 0.6, "score_ci_upper": 3.2, "raw_scores": [1.0, 3.0, 4.0, 1.0, 0.0], "baseline_score": 1.5, "outcome": "DISCARDED", "failure_mode": null, "duration_seconds": 55.24559395806864, "tags": ["readme", "documentation", "formatting"], "learnings": "{\"what_changed\":\"\",\"what_improved\":[],\"what_regressed\":[],\"transferable_insight\":\"Simultaneously expanding an output with multiple new sections while attempting to prune it to fit strict length limits often results in truncation and overall failure.\",\"domain_tags\":[\"Content Management\",\"Constraint Optimization\",\"Documentation\"]}", "cost_usd": 0.033206049999999994, "bootstrap_seed": 0, "agent_model": "gemini-3.1-pro-preview", "held_out_score": null, "criterion_names": ["quick_start_present", "api_documented", "prerequisites_clear", "examples_runnable", "error_guidance", "contribution_path"], "per_criterion_scores": {"quick_start_present": 0.6, "api_documented": 0.0, "prerequisites_clear": 0.2, "examples_runnable": 0.4, "error_guidance": 0.0, "contribution_path": 0.6}, "failure_classification": {"category": "semantic_drift", "description": "The model likely failed to provide content with the correct meaning, relevance, or conciseness for the specified missing sections (Architecture, Examples, Troubleshooting, FAQ). It might have generated generic boilerplate, factually incorrect information, or content that was not contextually appropriate, despite potentially adhering to some markdown formatting. This fundamental misinterpretation of the required content's meaning or relevance would lead to a very low score, as the primary goal of filling sections with useful information was not met. Failures in markdown fixing or section removal might also be present but are secondary to the core content quality issue.", "fix_direction": "Improve prompt context and provide clear examples for what constitutes relevant and concise content for each specific section (Architecture, Examples, Troubleshooting, FAQ) in the context of a README. Emphasize contextual understanding, factual accuracy, and brevity, potentially with explicit length guidelines or by providing a 'persona' for the generated content (e.g., 'as a developer explaining this project'). Ensure evaluation metrics heavily penalize irrelevant or verbose content.", "confidence": 0.85}, "drafts_generated": 1, "drafts_survived": 1}
{"id": "38aaa37a-7bad-4576-bf3d-cba750abaf62", "target_id": "B5-greedy", "git_sha": "50b8bd76b4e059483ccdf0fbee4ae011029180c3", "pre_experiment_sha": "50b8bd76b4e059483ccdf0fbee4ae011029180c3", "timestamp": "2026-04-24T06:32:05.129558+00:00", "hypothesis": "Adding Quickstart, Usage, Architecture, and Troubleshooting sections to meet documentation binary criteria while avoiding truncation.", "hypothesis_source": "agent", "mutation_diff_summary": "", "score": 1.2, "score_ci_lower": 0.6, "score_ci_upper": 1.7, "raw_scores": [2.0, 1.0, 1.5, 1.5, 0.0], "baseline_score": 1.5, "outcome": "DISCARDED", "failure_mode": null, "duration_seconds": 49.74480516696349, "tags": ["documentation", "readme", "concise"], "learnings": "{\"what_changed\":\"\",\"what_improved\":[],\"what_regressed\":[],\"transferable_insight\":\"Attempting to satisfy multiple comprehensive content criteria simultaneously within strict length constraints often degrades overall quality by causing truncation or information overload.\",\"domain_tags\":[\"Content Strategy\",\"Documentation\",\"Constraint Management\"]}", "cost_usd": 0.02896485, "bootstrap_seed": 0, "agent_model": "gemini-3.1-pro-preview", "held_out_score": null, "criterion_names": ["quick_start_present", "api_documented", "prerequisites_clear", "examples_runnable", "error_guidance", "contribution_path"], "per_criterion_scores": {"quick_start_present": 0.1, "api_documented": 0.0, "prerequisites_clear": 0.4, "examples_runnable": 0.0, "error_guidance": 0.1, "contribution_path": 0.6}, "failure_classification": {"category": "incomplete_edit", "description": "The experiment aimed to add multiple specific documentation sections (Quickstart, Usage, Architecture, Troubleshooting) and simultaneously avoid truncation. The failure suggests that either not all sections were successfully generated and included, or some sections were still truncated, thus failing to fully deliver on the complete scope of the intended edit.", "fix_direction": "Investigate which specific sections were missing or incomplete. Analyze the cause of truncation, such as token limits, content generation logic, or output formatting constraints, and adjust the generation process to ensure all required sections are fully present and untruncated.", "confidence": 0.8}, "drafts_generated": 1, "drafts_survived": 1}
{"id": "67991496-c1e1-472a-b461-6c4440c402b5", "target_id": "B5-greedy", "git_sha": "561d7c24a15b24d46570ce4bf7dc00f0a57966c5", "pre_experiment_sha": "50b8bd76b4e059483ccdf0fbee4ae011029180c3", "timestamp": "2026-04-24T06:33:31.229189+00:00", "hypothesis": "Add Quickstart, Architecture, and Troubleshooting sections with concise content to improve binary criteria score while avoiding length limit truncation.", "hypothesis_source": "agent", "mutation_diff_summary": "", "score": 1.8, "score_ci_lower": 1.2, "score_ci_upper": 2.4, "raw_scores": [3.0, 2.0, 1.0, 1.0, 2.0], "baseline_score": 1.5, "outcome": "KEPT", "failure_mode": null, "duration_seconds": 49.01149687496945, "tags": ["documentation", "sections", "missing"], "learnings": "{\"what_changed\":\"\",\"what_improved\":[],\"what_regressed\":[],\"transferable_insight\":\"Structuring content with essential, high-value sections using concise language improves overall comprehensiveness while adhering to strict length constraints.\",\"domain_tags\":[\"Documentation\",\"Content Strategy\",\"Technical Writing\"]}", "cost_usd": 0.0269789, "bootstrap_seed": 0, "agent_model": "gemini-3.1-pro-preview", "held_out_score": null, "criterion_names": ["quick_start_present", "api_documented", "prerequisites_clear", "examples_runnable", "error_guidance", "contribution_path"], "per_criterion_scores": {"quick_start_present": 0.4, "api_documented": 0.1, "prerequisites_clear": 0.2, "examples_runnable": 0.3, "error_guidance": 0.2, "contribution_path": 0.6}, "failure_classification": null, "drafts_generated": 1, "drafts_survived": 1}
{"id": "7915514d-a0d3-4168-a8c1-1e7ea91d4384", "target_id": "B5-greedy", "git_sha": "561d7c24a15b24d46570ce4bf7dc00f0a57966c5", "pre_experiment_sha": "561d7c24a15b24d46570ce4bf7dc00f0a57966c5", "timestamp": "2026-04-24T06:34:42.847413+00:00", "hypothesis": "Add Quickstart, Architecture, and Troubleshooting sections with concise content while properly closing the existing code block to improve the binary criteria score.", "hypothesis_source": "agent", "mutation_diff_summary": "", "score": 1.3, "score_ci_lower": 0.6, "score_ci_upper": 2.1, "raw_scores": [2.0, 0.0, 1.0, 2.5, 1.0], "baseline_score": 1.8, "outcome": "DISCARDED", "failure_mode": null, "duration_seconds": 64.94060091697611, "tags": ["documentation", "readme"], "learnings": "{\"what_changed\":\"\",\"what_improved\":[],\"what_regressed\":[],\"transferable_insight\":\"Introducing multiple complex sections with overly concise content can degrade overall quality, as the lack of depth fails to provide meaningful value while cluttering the structure.\",\"domain_tags\":[\"Documentation\",\"Content Strategy\",\"Information Architecture\"]}", "cost_usd": 0.03427765, "bootstrap_seed": 0, "agent_model": "gemini-3.1-pro-preview", "held_out_score": null, "criterion_names": ["quick_start_present", "api_documented", "prerequisites_clear", "examples_runnable", "error_guidance", "contribution_path"], "per_criterion_scores": {"quick_start_present": 0.2, "api_documented": 0.1, "prerequisites_clear": 0.3, "examples_runnable": 0.4, "error_guidance": 0.1, "contribution_path": 0.2}, "failure_classification": {"category": "output_format", "description": "The hypothesis included 'properly closing the existing code block'. A failure to correctly implement this, or an error introduced while attempting to close it, would result in a structural or formatting issue in the output (e.g., malformed markdown, incorrect rendering). This directly violates expected output structure, leading to a low score.", "fix_direction": "Focus on validating the structural integrity of the output, specifically ensuring code blocks are correctly delimited and all formatting conventions are strictly followed. Verify rendered output for correctness.", "confidence": 0.9}, "drafts_generated": 1, "drafts_survived": 1}
{"id": "d3acba4a-a849-4a89-a971-43f1fb40d6e9", "target_id": "B5-greedy", "git_sha": "561d7c24a15b24d46570ce4bf7dc00f0a57966c5", "pre_experiment_sha": "561d7c24a15b24d46570ce4bf7dc00f0a57966c5", "timestamp": "2026-04-24T06:36:06.558869+00:00", "hypothesis": "Fix the unclosed code block in Installation and add Quickstart, Architecture, and Troubleshooting sections to improve the criteria score without hitting length limits.", "hypothesis_source": "agent", "mutation_diff_summary": "", "score": 1.1, "score_ci_lower": 0.2, "score_ci_upper": 2.0, "raw_scores": [2.5, 0.0, 1.0, 0.0, 2.0], "baseline_score": 1.8, "outcome": "DISCARDED", "failure_mode": null, "duration_seconds": 60.46066362480633, "tags": ["readme", "documentation", "formatting"], "learnings": "{\"what_changed\":\"\",\"what_improved\":[],\"what_regressed\":[],\"transferable_insight\":\"Bundling minor formatting corrections with the simultaneous addition of multiple comprehensive sections can degrade overall quality by introducing excessive bloat and obscuring the impact of individual changes.\",\"domain_tags\":[\"Documentation\",\"Content Strategy\",\"Experiment Design\"]}", "cost_usd": 0.02926755, "bootstrap_seed": 0, "agent_model": "gemini-3.1-pro-preview", "held_out_score": null, "criterion_names": ["quick_start_present", "api_documented", "prerequisites_clear", "examples_runnable", "error_guidance", "contribution_path"], "per_criterion_scores": {"quick_start_present": 0.4, "api_documented": 0.0, "prerequisites_clear": 0.0, "examples_runnable": 0.4, "error_guidance": 0.0, "contribution_path": 0.3}, "failure_classification": {"category": "syntax_error", "description": "The experiment aimed to fix an \"unclosed code block\" in the Installation section. A very low score of 1.1000 suggests a fundamental failure, and it's highly probable that either the original syntax error was not successfully resolved, or the attempt to fix it introduced a new parsing issue. This would prevent the document from being correctly processed or displayed, significantly hindering any potential score improvement from the addition of new sections.", "fix_direction": "Prioritize and rigorously test the fix for the unclosed code block. Implement robust syntax validation to ensure all code blocks and structural elements are correctly formatted and closed. The stability and parseability of the document should be confirmed before focusing on content additions for new sections.", "confidence": 0.9}, "drafts_generated": 1, "drafts_survived": 1}
{"id": "20117ee0-90ee-4a7f-b27f-68a156861072", "target_id": "B5-greedy", "git_sha": "561d7c24a15b24d46570ce4bf7dc00f0a57966c5", "pre_experiment_sha": "561d7c24a15b24d46570ce4bf7dc00f0a57966c5", "timestamp": "2026-04-24T06:38:29.470538+00:00", "hypothesis": "Add Quickstart, Architecture, and Troubleshooting sections to improve the binary criteria score while strictly preserving the existing unclosed code block formatting.", "hypothesis_source": "agent", "mutation_diff_summary": "", "score": 1.6, "score_ci_lower": 0.5, "score_ci_upper": 2.9, "raw_scores": [4.0, 0.5, 0.0, 1.5, 2.0], "baseline_score": 1.8, "outcome": "DISCARDED", "failure_mode": null, "duration_seconds": 97.84310304210521, "tags": ["documentation", "markdown", "sections"], "learnings": "{\"what_changed\":\"\",\"what_improved\":[],\"what_regressed\":[],\"transferable_insight\":\"Adding valuable new content fails to improve overall quality if critical underlying structural or formatting errors are intentionally preserved.\",\"domain_tags\":[\"Documentation\",\"Formatting\",\"Content Strategy\"]}", "cost_usd": 0.03509275, "bootstrap_seed": 0, "agent_model": "gemini-3.1-pro-preview", "held_out_score": null, "criterion_names": ["quick_start_present", "api_documented", "prerequisites_clear", "examples_runnable", "error_guidance", "contribution_path"], "per_criterion_scores": {"quick_start_present": 0.3, "api_documented": 0.5, "prerequisites_clear": 0.1, "examples_runnable": 0.2, "error_guidance": 0.2, "contribution_path": 0.3}, "failure_classification": {"category": "syntax_error", "description": "The experiment failed because the model did not strictly preserve the existing unclosed code block formatting as required by the hypothesis. This likely led to malformed code or configuration blocks, causing them to fail parsing or linting, which in turn contributed to the low binary criteria score. The violation could have been incorrectly attempting to close an existing unclosed block, or introducing new syntax errors within or around the preserved elements.", "fix_direction": "Improve the model's understanding and adherence to explicit formatting constraints, particularly when dealing with code blocks and their closure status. This may involve providing more examples of preserving unusual or specific formatting, or implementing stricter parsing/linting feedback during training to penalize syntax violations.", "confidence": 0.9}, "drafts_generated": 1, "drafts_survived": 1}
