{"id": "d5dda15d-4a4f-41dc-bd0c-32ac48f00bd6", "target_id": "B5-greedy", "git_sha": "561d7c24a15b24d46570ce4bf7dc00f0a57966c5", "pre_experiment_sha": "561d7c24a15b24d46570ce4bf7dc00f0a57966c5", "timestamp": "2026-04-24T06:55:13.181249+00:00", "hypothesis": "Insert Quickstart and Architecture sections between Overview and Prerequisites to improve the binary criteria score while preserving the exact unclosed code block at the end of the file.", "hypothesis_source": "agent", "mutation_diff_summary": "", "score": 0.3, "score_ci_lower": 0.0, "score_ci_upper": 0.7, "raw_scores": [0.0, 1.0, 0.0, 0.5, 0.0], "baseline_score": 1.8, "outcome": "DISCARDED", "failure_mode": null, "duration_seconds": 87.84120404184796, "tags": ["documentation", "sections", "formatting"], "learnings": "{\"what_changed\":\"\",\"what_improved\":[],\"what_regressed\":[],\"transferable_insight\":\"Inserting action-oriented or complex structural sections before foundational prerequisites disrupts the logical progression of instructional content and degrades overall effectiveness.\",\"domain_tags\":[\"Information Architecture\",\"Technical Writing\",\"User Experience\"]}", "cost_usd": 0.0268916, "bootstrap_seed": 0, "agent_model": "gemini-3.1-pro-preview", "held_out_score": null, "criterion_names": ["quick_start_present", "api_documented", "prerequisites_clear", "examples_runnable", "error_guidance", "contribution_path"], "per_criterion_scores": {"quick_start_present": 0.0, "api_documented": 0.0, "prerequisites_clear": 0.0, "examples_runnable": 0.0, "error_guidance": 0.2, "contribution_path": 0.1}, "failure_classification": {"category": "scope_violation", "description": "The experiment explicitly required \"preserving the exact unclosed code block at the end of the file.\" The low binary criteria score (0.3000) strongly suggests a critical failure. It is highly probable that the attempt to insert new sections inadvertently modified, corrupted, or incorrectly interacted with this sensitive 'unclosed' element, thereby violating the strict preservation constraint. Modifying an element that was explicitly designated to be preserved 'exactly' constitutes a scope violation.", "fix_direction": "Implement stricter adherence to explicit preservation constraints. Ensure the modification pipeline specifically identifies and 'locks' designated regions (like the unclosed code block) from any unintended changes during content insertion or restructuring. Add robust pre- and post-edit checks to verify the integrity and exactness of preserved sections.", "confidence": 0.8}, "drafts_generated": 1, "drafts_survived": 1}
{"id": "28527fee-7e07-49af-ab08-cb524c03f47b", "target_id": "B5-greedy", "git_sha": "561d7c24a15b24d46570ce4bf7dc00f0a57966c5", "pre_experiment_sha": "561d7c24a15b24d46570ce4bf7dc00f0a57966c5", "timestamp": "2026-04-24T06:57:04.487586+00:00", "hypothesis": "Added Quickstart and Architecture sections after the Overview to improve documentation completeness while preserving the exact structure and unclosed code block at the end of the file.", "hypothesis_source": "agent", "mutation_diff_summary": "", "score": 0.8, "score_ci_lower": 0.1, "score_ci_upper": 1.5, "raw_scores": [0.0, 0.0, 0.5, 1.5, 2.0], "baseline_score": 1.8, "outcome": "DISCARDED", "failure_mode": null, "duration_seconds": 77.58913237508386, "tags": ["documentation", "enhancement"], "learnings": "{\"what_changed\":\"\",\"what_improved\":[],\"what_regressed\":[],\"transferable_insight\":\"Expanding content without addressing underlying structural or formatting errors degrades overall quality and negates the value of the additions.\",\"domain_tags\":[\"Documentation\",\"Formatting\",\"Quality Assurance\"]}", "cost_usd": 0.02673045, "bootstrap_seed": 0, "agent_model": "gemini-3.1-pro-preview", "held_out_score": null, "criterion_names": ["quick_start_present", "api_documented", "prerequisites_clear", "examples_runnable", "error_guidance", "contribution_path"], "per_criterion_scores": {"quick_start_present": 0.2, "api_documented": 0.0, "prerequisites_clear": 0.0, "examples_runnable": 0.3, "error_guidance": 0.1, "contribution_path": 0.2}, "failure_classification": {"category": "scope_violation", "description": "The model likely failed to preserve the 'unclosed code block at the end of the file' or other aspects of the 'exact structure' as specified. This is a common issue where models 'fix' perceived imperfections (like an unclosed block) even when explicitly instructed to preserve them, thereby editing outside the permitted modification scope.", "fix_direction": "Emphasize negative constraints and non-modification requirements. Explicitly instruct the model *not* to modify specified existing elements, especially those that might appear 'incomplete' or 'incorrect' from a standard formatting perspective. Provide strict examples of elements to preserve verbatim and potentially use diff-based evaluation for strict adherence to non-modification zones.", "confidence": 0.9}, "drafts_generated": 1, "drafts_survived": 1}
{"id": "a7d8b628-8dd9-467a-a284-8c4fe4588757", "target_id": "B5-greedy", "git_sha": "561d7c24a15b24d46570ce4bf7dc00f0a57966c5", "pre_experiment_sha": "561d7c24a15b24d46570ce4bf7dc00f0a57966c5", "timestamp": "2026-04-24T06:58:50.882444+00:00", "hypothesis": "Add Quickstart and Architecture sections between Overview and Prerequisites to improve documentation completeness while preserving the unclosed code block at the end.", "hypothesis_source": "agent", "mutation_diff_summary": "", "score": 1.5, "score_ci_lower": 0.7, "score_ci_upper": 2.2, "raw_scores": [2.5, 0.0, 1.0, 2.0, 2.0], "baseline_score": 1.8, "outcome": "DISCARDED", "failure_mode": null, "duration_seconds": 86.03496487508528, "tags": ["documentation", "quickstart", "architecture"], "learnings": "{\"what_changed\":\"\",\"what_improved\":[],\"what_regressed\":[],\"transferable_insight\":\"Adding new content or features fails to improve overall quality if fundamental structural or formatting errors are intentionally left unresolved.\",\"domain_tags\":[\"Documentation\",\"Content Strategy\",\"Formatting\"]}", "cost_usd": 0.028727299999999997, "bootstrap_seed": 0, "agent_model": "gemini-3.1-pro-preview", "held_out_score": null, "criterion_names": ["quick_start_present", "api_documented", "prerequisites_clear", "examples_runnable", "error_guidance", "contribution_path"], "per_criterion_scores": {"quick_start_present": 0.4, "api_documented": 0.1, "prerequisites_clear": 0.0, "examples_runnable": 0.2, "error_guidance": 0.2, "contribution_path": 0.6}, "failure_classification": {"category": "syntax_error", "description": "The experiment failed likely due to issues arising from the interaction of the new section additions and the constraint to preserve an existing unclosed code block. The modification process may have introduced new syntax errors, exacerbated the existing unclosed block issue, or incorrectly handled the document structure around it, leading to the document failing to parse or render correctly. The score of 1.5 suggests a partial failure, often consistent with structural or syntax corruption that makes parts of the output invalid.", "fix_direction": "Improve the robustness of the document generation and modification process, specifically its ability to handle and preserve known syntax anomalies (like unclosed code blocks) while integrating new content. Focus on maintaining overall document parseability and structural integrity, even when dealing with pre-existing imperfections.", "confidence": 0.85}, "drafts_generated": 1, "drafts_survived": 1}
{"id": "da35148b-baab-4e0f-982c-0b4a01d138fb", "target_id": "B5-greedy", "git_sha": "561d7c24a15b24d46570ce4bf7dc00f0a57966c5", "pre_experiment_sha": "561d7c24a15b24d46570ce4bf7dc00f0a57966c5", "timestamp": "2026-04-24T07:01:34.726504+00:00", "hypothesis": "Insert a concise Quickstart section after the Overview to improve documentation completeness while carefully preserving the exact unclosed formatting at the end of the file.", "hypothesis_source": "agent", "mutation_diff_summary": "", "score": 1.9, "score_ci_lower": 0.9, "score_ci_upper": 2.6, "raw_scores": [3.0, 2.0, 2.5, 2.0, 0.0], "baseline_score": 1.8, "outcome": "DISCARDED", "failure_mode": null, "duration_seconds": 61.11891404213384, "tags": ["documentation", "quickstart", "concise"], "learnings": "{\"what_changed\":\"\",\"what_improved\":[],\"what_regressed\":[],\"transferable_insight\":\"Introducing new content sections while strictly preserving existing malformed formatting can cause the overall output to be rejected despite the value of the additions.\",\"domain_tags\":[\"Documentation\",\"Formatting\",\"Content Strategy\"]}", "cost_usd": 0.0335032, "bootstrap_seed": 0, "agent_model": "gemini-3.1-pro-preview", "held_out_score": null, "criterion_names": ["quick_start_present", "api_documented", "prerequisites_clear", "examples_runnable", "error_guidance", "contribution_path"], "per_criterion_scores": {"quick_start_present": 0.2, "api_documented": 0.1, "prerequisites_clear": 0.4, "examples_runnable": 0.4, "error_guidance": 0.2, "contribution_path": 0.6}, "failure_classification": {"category": "scope_violation", "description": "The experiment likely failed because the model did not adhere to the explicit negative constraint of \"carefully preserving the exact unclosed formatting at the end of the file.\" Instead of maintaining the existing (unclosed) state, the model might have attempted to \"correct\" or modify this formatting, thus making an edit outside the permitted scope of preservation. This violates the precise instruction not to alter that specific aspect of the document.", "fix_direction": "Improve the model's ability to strictly adhere to negative constraints and specific preservation instructions, particularly when they involve maintaining a non-standard or 'imperfect' state in the input. Focus on techniques that prevent over-correction or 'helpful' edits in areas explicitly marked for preservation.", "confidence": 0.8}, "drafts_generated": 1, "drafts_survived": 1}
{"id": "d48af83e-b796-4891-b29a-08308589f29d", "target_id": "B5-greedy", "git_sha": "561d7c24a15b24d46570ce4bf7dc00f0a57966c5", "pre_experiment_sha": "561d7c24a15b24d46570ce4bf7dc00f0a57966c5", "timestamp": "2026-04-24T07:06:19.701435+00:00", "hypothesis": "Add a concise Architecture section after Overview to improve the binary criteria score while preserving existing formatting and unclosed blocks.", "hypothesis_source": "agent", "mutation_diff_summary": "", "score": 1.4, "score_ci_lower": 0.9, "score_ci_upper": 1.9, "raw_scores": [1.5, 1.0, 2.0, 0.5, 2.0], "baseline_score": 1.8, "outcome": "DISCARDED", "failure_mode": null, "duration_seconds": 86.98488283390179, "tags": ["documentation", "formatting"], "learnings": "{\"what_changed\":\"\",\"what_improved\":[],\"what_regressed\":[],\"transferable_insight\":\"Introducing new structural sections while attempting to preserve existing unclosed formatting blocks can cause structural conflicts that degrade overall document quality.\",\"domain_tags\":[\"Document Structure\",\"Formatting\",\"Content Organization\"]}", "cost_usd": 0.026322150000000002, "bootstrap_seed": 0, "agent_model": "gemini-3.1-pro-preview", "held_out_score": null, "criterion_names": ["quick_start_present", "api_documented", "prerequisites_clear", "examples_runnable", "error_guidance", "contribution_path"], "per_criterion_scores": {"quick_start_present": 0.4, "api_documented": 0.0, "prerequisites_clear": 0.0, "examples_runnable": 0.5, "error_guidance": 0.0, "contribution_path": 0.5}, "failure_classification": {"category": "output_format", "description": "The experiment failed to preserve existing formatting and/or properly close blocks as stipulated in the hypothesis, leading to a malformed output structure and a very low score (1.4000). This indicates a fundamental violation of the expected output format, rather than an issue with the content itself or a minor semantic error.", "fix_direction": "Implement stricter adherence to the output's structural rules, existing formatting, and block closure when inserting new content. Focus on ensuring the generated output is well-formed, parsable, and consistent with the document's established structure before addressing content nuances.", "confidence": 0.95}, "drafts_generated": 1, "drafts_survived": 1}
{"id": "87a9dc53-b389-43e3-8a96-00bc02a53681", "target_id": "B5-greedy", "git_sha": "561d7c24a15b24d46570ce4bf7dc00f0a57966c5", "pre_experiment_sha": "561d7c24a15b24d46570ce4bf7dc00f0a57966c5", "timestamp": "2026-04-24T07:09:27.279641+00:00", "hypothesis": "Added Quickstart, Architecture, and Troubleshooting sections to improve binary criteria score.", "hypothesis_source": "agent", "mutation_diff_summary": "", "score": 1.4, "score_ci_lower": 0.3, "score_ci_upper": 2.5, "raw_scores": [0.0, 2.0, 0.0, 3.5, 1.5], "baseline_score": 1.8, "outcome": "DISCARDED", "failure_mode": null, "duration_seconds": 78.08646937506273, "tags": ["documentation", "sections"], "learnings": "{\"what_changed\":\"\",\"what_improved\":[],\"what_regressed\":[],\"transferable_insight\":\"Introducing multiple dense informational sections simultaneously can overwhelm users and reduce the overall effectiveness of the content.\",\"domain_tags\":[\"Information Architecture\",\"Content Strategy\",\"Documentation\"]}", "cost_usd": 0.03344385, "bootstrap_seed": 0, "agent_model": "gemini-3.1-pro-preview", "held_out_score": null, "criterion_names": ["quick_start_present", "api_documented", "prerequisites_clear", "examples_runnable", "error_guidance", "contribution_path"], "per_criterion_scores": {"quick_start_present": 0.2, "api_documented": 0.2, "prerequisites_clear": 0.3, "examples_runnable": 0.1, "error_guidance": 0.4, "contribution_path": 0.2}, "failure_classification": {"category": "semantic_drift", "description": "The added Quickstart, Architecture, and Troubleshooting sections were likely present and structurally correct, but their content failed to effectively convey the intended meaning or provide the necessary information to positively impact the 'binary criteria score'. This could be due to the content being irrelevant, unclear, incomplete, or misaligned with the specific aspects evaluated by the score, rather than a format error or entirely missing content.", "fix_direction": "First, thoroughly analyze the definition and evaluation mechanism of the 'binary criteria score' to understand its precise requirements. Then, review the content of the added sections against these requirements, focusing on clarity, relevance, accuracy, and completeness. Gather specific feedback on what aspects of the documentation are failing to meet the criteria and iterate on the content to ensure it directly addresses and improves the score.", "confidence": 0.85}, "drafts_generated": 1, "drafts_survived": 1}
{"id": "f61d4031-3124-4cf8-8e83-478e2d505e2d", "target_id": "B5-greedy", "git_sha": "561d7c24a15b24d46570ce4bf7dc00f0a57966c5", "pre_experiment_sha": "561d7c24a15b24d46570ce4bf7dc00f0a57966c5", "timestamp": "2026-04-24T07:12:56.104093+00:00", "hypothesis": "Add Quickstart and Architecture sections with exactly one sentence each to satisfy the binary criteria score while preserving the broken formatting at the end.", "hypothesis_source": "agent", "mutation_diff_summary": "", "score": 1.5, "score_ci_lower": 0.6, "score_ci_upper": 2.4, "raw_scores": [2.0, 0.0, 2.5, 2.5, 0.5], "baseline_score": 1.8, "outcome": "DISCARDED", "failure_mode": null, "duration_seconds": 69.08211720804684, "tags": ["documentation", "formatting"], "learnings": "{\"what_changed\":\"\",\"what_improved\":[],\"what_regressed\":[],\"transferable_insight\":\"Superficially satisfying checklist criteria with minimal additions fails to compensate for the negative impact of intentionally preserving structural errors.\",\"domain_tags\":[\"Documentation\",\"Quality Assurance\",\"Formatting\"]}", "cost_usd": 0.025088950000000002, "bootstrap_seed": 0, "agent_model": "gemini-3.1-pro-preview", "held_out_score": null, "criterion_names": ["quick_start_present", "api_documented", "prerequisites_clear", "examples_runnable", "error_guidance", "contribution_path"], "per_criterion_scores": {"quick_start_present": 0.2, "api_documented": 0.0, "prerequisites_clear": 0.0, "examples_runnable": 0.5, "error_guidance": 0.4, "contribution_path": 0.4}, "failure_classification": {"category": "over_optimization", "description": "The hypothesis aimed to satisfy a 'binary criteria score', implying a pass/fail outcome with a maximum score of 1. However, the experiment achieved a score of 1.5. This indicates that the evaluation metric was exploited or gamed, leading to a score that exceeds the expected maximum for a binary criterion, rather than simply satisfying it.", "fix_direction": "Clarify the definition and limits of the 'binary criteria score' to ensure it strictly yields binary results (0 or 1). Investigate how the scoring system allowed for a score of 1.5 on a binary criterion and adjust the evaluation logic or the criteria definition to prevent over-optimization beyond the intended maximum.", "confidence": 0.9}, "drafts_generated": 1, "drafts_survived": 1}
{"id": "7e6efaa6-da72-4cec-ab91-2d8cba89f99c", "target_id": "B5-greedy", "git_sha": "561d7c24a15b24d46570ce4bf7dc00f0a57966c5", "pre_experiment_sha": "561d7c24a15b24d46570ce4bf7dc00f0a57966c5", "timestamp": "2026-04-24T07:14:21.206248+00:00", "hypothesis": "Add Quickstart and Architecture sections near the top to satisfy the binary criteria score requirements while preserving the broken formatting at the end.", "hypothesis_source": "agent", "mutation_diff_summary": "", "score": 1.1, "score_ci_lower": 0.5, "score_ci_upper": 1.7, "raw_scores": [1.0, 1.0, 0.0, 1.5, 2.0], "baseline_score": 1.8, "outcome": "DISCARDED", "failure_mode": null, "duration_seconds": 65.71814087522216, "tags": ["documentation", "sections"], "learnings": "{\"what_changed\":\"\",\"what_improved\":[],\"what_regressed\":[],\"transferable_insight\":\"Satisfying specific content criteria is insufficient to improve overall quality if structural or formatting errors are intentionally left unresolved.\",\"domain_tags\":[\"Document Formatting\",\"Content Strategy\",\"Quality Assurance\"]}", "cost_usd": 0.0321528, "bootstrap_seed": 0, "agent_model": "gemini-3.1-pro-preview", "held_out_score": null, "criterion_names": ["quick_start_present", "api_documented", "prerequisites_clear", "examples_runnable", "error_guidance", "contribution_path"], "per_criterion_scores": {"quick_start_present": 0.4, "api_documented": 0.0, "prerequisites_clear": 0.0, "examples_runnable": 0.4, "error_guidance": 0.1, "contribution_path": 0.2}, "failure_classification": {"category": "over_optimization", "description": "The model successfully added the Quickstart and Architecture sections, which likely contributed to the improved score (1.1). However, the experiment failed because the model presumably did not preserve the broken formatting at the end, violating a specific negative constraint in the hypothesis. The scoring mechanism may have inadvertently rewarded fixing this formatting, leading to a higher score despite the failure to adhere to the full intent of the experiment.", "fix_direction": "Refine the evaluation metric to explicitly penalize violations of negative constraints (e.g., not preserving specific broken elements). Ensure the prompt clearly communicates the selective nature of the edit, emphasizing what must be left untouched to align the model's optimization with the experiment's true objective.", "confidence": 0.95}, "drafts_generated": 1, "drafts_survived": 1}
{"id": "3681547f-14fb-4eb7-95a0-aba7517f9ff8", "target_id": "B5-greedy", "git_sha": "561d7c24a15b24d46570ce4bf7dc00f0a57966c5", "pre_experiment_sha": "561d7c24a15b24d46570ce4bf7dc00f0a57966c5", "timestamp": "2026-04-24T07:16:50.502195+00:00", "hypothesis": "Add Quickstart and Architecture sections right after the Overview to naturally expand the documentation while retaining the unclosed code block formatting at the end.", "hypothesis_source": "agent", "mutation_diff_summary": "", "score": 0.9, "score_ci_lower": 0.2, "score_ci_upper": 1.6, "raw_scores": [2.0, 1.0, 0.0, 1.5, 0.0], "baseline_score": 1.8, "outcome": "DISCARDED", "failure_mode": null, "duration_seconds": 55.26007075002417, "tags": ["documentation", "sections", "structure"], "learnings": "{\"what_changed\":\"\",\"what_improved\":[],\"what_regressed\":[],\"transferable_insight\":\"Expanding content with useful sections will fail to improve overall quality if fundamental formatting errors, such as unclosed syntax blocks, are intentionally preserved.\",\"domain_tags\":[\"Documentation\",\"Formatting\",\"Content Structure\"]}", "cost_usd": 0.02474555, "bootstrap_seed": 0, "agent_model": "gemini-3.1-pro-preview", "held_out_score": null, "criterion_names": ["quick_start_present", "api_documented", "prerequisites_clear", "examples_runnable", "error_guidance", "contribution_path"], "per_criterion_scores": {"quick_start_present": 0.2, "api_documented": 0.0, "prerequisites_clear": 0.0, "examples_runnable": 0.2, "error_guidance": 0.3, "contribution_path": 0.2}, "failure_classification": {"category": "output_format", "description": "The experiment successfully added the new sections, but failed to retain the specific 'unclosed code block formatting' at the end of the document as explicitly stated in the hypothesis. This resulted in a deviation from the required output structure/format.", "fix_direction": "Improve prompt engineering to explicitly instruct and constrain the model to preserve specific formatting elements, especially those involving unique or non-standard syntax like an 'unclosed' block. Reinforce the need to leave specific sections or markers exactly as they are without attempting to 'correct' or complete them.", "confidence": 0.95}, "drafts_generated": 1, "drafts_survived": 1}
