{"id": "f5cc3ccc-6766-4d6f-ae3c-9fd7cb4f123e", "target_id": "B5-greedy", "git_sha": "79fa8173555c68f1697eb29ed3adba41dad2252a", "pre_experiment_sha": "3b452d4d4a3bc0f302632065ef61cb2ba6a6552a", "timestamp": "2026-04-19T18:13:15.627358+00:00", "hypothesis": "Adding concrete technical sections, examples, error handling, and operational details will better satisfy binary technical-readme criteria.", "hypothesis_source": "agent", "mutation_diff_summary": "", "score": 0.1, "score_ci_lower": 0.0, "score_ci_upper": 0.3, "raw_scores": [0.0, 0.0, 0.0, 0.5, 0.0], "baseline_score": 0.0, "outcome": "KEPT", "failure_mode": null, "duration_seconds": 53.129147165920585, "tags": ["readme", "technical-docs", "cli", "examples", "configuration"], "learnings": "{\"what_changed\":\"\",\"what_improved\":[],\"what_regressed\":[],\"transferable_insight\":\"Including concrete examples, explicit edge-case handling, and operational details tends to make documentation or instructions more complete and easier to evaluate against strict criteria.\",\"domain_tags\":[\"documentation\",\"technical-writing\",\"quality-assurance\"]}", "cost_usd": 0.07507475000000001, "bootstrap_seed": 0, "agent_model": "gpt-5.4", "held_out_score": null, "criterion_names": ["quick_start_present", "api_documented", "prerequisites_clear", "examples_runnable", "error_guidance", "contribution_path"], "per_criterion_scores": {"quick_start_present": 0.0, "api_documented": 0.0, "prerequisites_clear": 0.0, "examples_runnable": 0.0, "error_guidance": 0.0, "contribution_path": 0.1}, "failure_classification": null, "drafts_generated": 1, "drafts_survived": 1}
{"id": "c345d87d-6494-4f00-9a61-6bcc38cc80e5", "target_id": "B5-greedy", "git_sha": "b8c82b77394fc5f506cdc8d1da9f51f0200e5b94", "pre_experiment_sha": "79fa8173555c68f1697eb29ed3adba41dad2252a", "timestamp": "2026-04-19T18:15:32.460971+00:00", "hypothesis": "Expand the README into a concrete engineering guide with installation, pipeline schema, commands, examples, config, and failure modes.", "hypothesis_source": "agent", "mutation_diff_summary": "", "score": 1.2, "score_ci_lower": 0.1, "score_ci_upper": 3.1, "raw_scores": [0.0, 0.0, 0.5, 5.0, 0.5], "baseline_score": 0.1, "outcome": "KEPT", "failure_mode": null, "duration_seconds": 76.54273712506983, "tags": ["readme", "technical-docs", "cli", "yaml", "csv", "usage", "config"], "learnings": "{\"what_changed\":\"\",\"what_improved\":[],\"what_regressed\":[],\"transferable_insight\":\"Turning a high-level overview into a concrete, executable guide with setup, workflow structure, commands, examples, configuration, and failure cases makes a project substantially more usable and robust.\",\"domain_tags\":[\"documentation\",\"engineering\",\"usability\"]}", "cost_usd": 0.09653755000000001, "bootstrap_seed": 0, "agent_model": "gpt-5.4", "held_out_score": null, "criterion_names": ["quick_start_present", "api_documented", "prerequisites_clear", "examples_runnable", "error_guidance", "contribution_path"], "per_criterion_scores": {"quick_start_present": 0.2, "api_documented": 0.2, "prerequisites_clear": 0.2, "examples_runnable": 0.1, "error_guidance": 0.2, "contribution_path": 0.3}, "failure_classification": null, "drafts_generated": 1, "drafts_survived": 1}
{"id": "94865d27-c97a-452d-a85f-896b91c28f3c", "target_id": "B5-greedy", "git_sha": "b8c82b77394fc5f506cdc8d1da9f51f0200e5b94", "pre_experiment_sha": "b8c82b77394fc5f506cdc8d1da9f51f0200e5b94", "timestamp": "2026-04-19T18:16:44.990310+00:00", "hypothesis": "Add concrete installation, pipeline syntax, commands, I/O contracts, and failure-mode details to make the README a practical binary technical reference.", "hypothesis_source": "agent", "mutation_diff_summary": "", "score": 0.9, "score_ci_lower": 0.0, "score_ci_upper": 2.3, "raw_scores": [0.0, 0.0, 1.0, 3.5, 0.0], "baseline_score": 1.2, "outcome": "DISCARDED", "failure_mode": null, "duration_seconds": 70.97604862495791, "tags": ["readme", "technical-docs", "cli", "yaml", "csv"], "learnings": "{\"what_changed\":\"\",\"what_improved\":[],\"what_regressed\":[],\"transferable_insight\":\"A reference becomes more actionable when it specifies exact usage, inputs/outputs, and failure behaviors rather than only describing concepts at a high level.\",\"domain_tags\":[\"documentation\",\"technical-writing\",\"usability\"]}", "cost_usd": 0.09565435000000001, "bootstrap_seed": 0, "agent_model": "gpt-5.4", "held_out_score": null, "criterion_names": ["quick_start_present", "api_documented", "prerequisites_clear", "examples_runnable", "error_guidance", "contribution_path"], "per_criterion_scores": {"quick_start_present": 0.1, "api_documented": 0.1, "prerequisites_clear": 0.1, "examples_runnable": 0.0, "error_guidance": 0.2, "contribution_path": 0.4}, "failure_classification": {"category": "logic_error", "description": "The provided information (Hypothesis, Failure Mode: unknown, Score) does not describe any concrete formatting, logic, regression, syntax, semantics, optimization gaming, or incomplete/inconsistent edit failure. There are no observable artifacts or error details to map to a specific category.", "fix_direction": "Provide the actual failed output (e.g., README snippet), the exact error/validation message, and what checks failed (format/schema/parser/logic/semantic expectations) so the failure can be classified accurately.", "confidence": 0.05}, "drafts_generated": 1, "drafts_survived": 1}
{"id": "0d55618b-e027-4343-9048-fd13af953c63", "target_id": "B5-greedy", "git_sha": "b8c82b77394fc5f506cdc8d1da9f51f0200e5b94", "pre_experiment_sha": "b8c82b77394fc5f506cdc8d1da9f51f0200e5b94", "timestamp": "2026-04-19T18:18:07.951818+00:00", "hypothesis": "Expand the README into a concrete operator-focused manual with install, config, command examples, step semantics, I/O contracts, and failure cases.", "hypothesis_source": "agent", "mutation_diff_summary": "", "score": 0.7, "score_ci_lower": 0.0, "score_ci_upper": 1.7, "raw_scores": [0.0, 0.0, 1.0, 0.0, 2.5], "baseline_score": 1.2, "outcome": "DISCARDED", "failure_mode": null, "duration_seconds": 80.07901662506629, "tags": ["readme", "technical-docs", "cli", "yaml", "csv", "operations"], "learnings": "{\"what_changed\":\"\",\"what_improved\":[],\"what_regressed\":[],\"transferable_insight\":\"Turning a high-level overview into an operator-focused manual only helps when it adds actionable, concrete usage details and failure handling that users can directly apply.\",\"domain_tags\":[\"documentation\",\"usability\",\"technical-writing\"]}", "cost_usd": 0.11527855000000001, "bootstrap_seed": 0, "agent_model": "gpt-5.4", "held_out_score": null, "criterion_names": ["quick_start_present", "api_documented", "prerequisites_clear", "examples_runnable", "error_guidance", "contribution_path"], "per_criterion_scores": {"quick_start_present": 0.2, "api_documented": 0.1, "prerequisites_clear": 0.0, "examples_runnable": 0.1, "error_guidance": 0.0, "contribution_path": 0.3}, "failure_classification": {"category": "incomplete_edit", "description": "The attempt to expand the README did not fully satisfy the requested \u201cconcrete operator-focused manual\u201d scope (install/config/command examples/step semantics/I/O contracts/failure cases). The result appears partial or inconsistent, leading to an incomplete implementation relative to the stated hypothesis.", "fix_direction": "Ensure the documentation change is complete and internally consistent: add all required sections (install, configuration, command examples), define step-by-step semantics, specify I/O contracts (inputs/outputs, formats, error behavior), and include explicit failure cases with expected outputs/handling.", "confidence": 0.72}, "drafts_generated": 1, "drafts_survived": 1}
{"id": "07ad3ce3-d045-41a3-bf83-2b1d5842c1ed", "target_id": "B5-greedy", "git_sha": "b8c82b77394fc5f506cdc8d1da9f51f0200e5b94", "pre_experiment_sha": "b8c82b77394fc5f506cdc8d1da9f51f0200e5b94", "timestamp": "2026-04-19T18:19:47.801599+00:00", "hypothesis": "Expand the sparse README into a complete operator-focused technical reference with concrete setup, pipeline schema, commands, examples, and failure modes.", "hypothesis_source": "agent", "mutation_diff_summary": "", "score": 0.1, "score_ci_lower": 0.0, "score_ci_upper": 0.3, "raw_scores": [0.0, 0.0, 0.0, 0.5, 0.0], "baseline_score": 1.2, "outcome": "DISCARDED", "failure_mode": null, "duration_seconds": 94.57847991609015, "tags": ["readme", "technical-docs", "cli", "yaml", "csv", "usage", "configuration"], "learnings": "{\"what_changed\":\"\",\"what_improved\":[],\"what_regressed\":[],\"transferable_insight\":\"A useful reference should be expanded from a vague overview into an operator-oriented guide that includes concrete procedures, schemas, examples, and failure modes so it can actually be used in practice.\",\"domain_tags\":[\"documentation\",\"technical-writing\",\"operational-guides\"]}", "cost_usd": 0.12716715, "bootstrap_seed": 0, "agent_model": "gpt-5.4", "held_out_score": null, "criterion_names": ["quick_start_present", "api_documented", "prerequisites_clear", "examples_runnable", "error_guidance", "contribution_path"], "per_criterion_scores": {"quick_start_present": 0.0, "api_documented": 0.0, "prerequisites_clear": 0.0, "examples_runnable": 0.0, "error_guidance": 0.0, "contribution_path": 0.1}, "failure_classification": {"category": "incomplete_edit", "description": "The experiment failed with an 'unknown' failure mode and an extremely low score (0.1000), which suggests the README expansion was likely incomplete or left the documentation/spec in an inconsistent or partial state rather than a fully formed, internally consistent operator-focused technical reference.", "fix_direction": "Ensure the edit is complete end-to-end: include full concrete setup, a complete pipeline/schema section, runnable commands and examples, and an explicit failure-modes section; verify internal consistency and that all referenced commands/schema elements are defined and coherent.", "confidence": 0.42}, "drafts_generated": 1, "drafts_survived": 1}
{"id": "08beab15-a5cc-4cf4-8001-ceb448b5f0c0", "target_id": "B5-greedy", "git_sha": "b8c82b77394fc5f506cdc8d1da9f51f0200e5b94", "pre_experiment_sha": "b8c82b77394fc5f506cdc8d1da9f51f0200e5b94", "timestamp": "2026-04-19T18:21:17.791154+00:00", "hypothesis": "Expand the sparse README into a complete operator-focused technical reference with concrete commands, schemas, workflows, and failure modes.", "hypothesis_source": "agent", "mutation_diff_summary": "", "score": 1.0, "score_ci_lower": 0.5, "score_ci_upper": 1.4, "raw_scores": [1.0, 1.0, 0.0, 1.5, 1.5], "baseline_score": 1.2, "outcome": "DISCARDED", "failure_mode": null, "duration_seconds": 87.37170312495437, "tags": ["readme", "technical-docs", "cli", "yaml", "csv", "usage", "config"], "learnings": "{\"what_changed\":\"\",\"what_improved\":[],\"what_regressed\":[],\"transferable_insight\":\"A vague high-level summary becomes far more useful when it is expanded into concrete, actionable details such as commands, data structures, workflows, and failure modes.\",\"domain_tags\":[\"documentation\",\"technical-writing\",\"process-design\"]}", "cost_usd": 0.11669835000000002, "bootstrap_seed": 0, "agent_model": "gpt-5.4", "held_out_score": null, "criterion_names": ["quick_start_present", "api_documented", "prerequisites_clear", "examples_runnable", "error_guidance", "contribution_path"], "per_criterion_scores": {"quick_start_present": 0.3, "api_documented": 0.2, "prerequisites_clear": 0.0, "examples_runnable": 0.0, "error_guidance": 0.3, "contribution_path": 0.2}, "failure_classification": {"category": "incomplete_edit", "description": "The experiment resulted in a failed change that did not fully complete the requested expansion into a complete operator-focused reference, leaving the README only partially updated or in an inconsistent, unfinished state.", "fix_direction": "Finish the full documentation expansion end-to-end: add concrete commands, schemas, workflows, and explicit failure modes so the output is coherent and complete.", "confidence": 0.78}, "drafts_generated": 1, "drafts_survived": 1}
{"id": "84de939e-4d12-45ed-97e7-e4d633a23006", "target_id": "B5-greedy", "git_sha": "b8c82b77394fc5f506cdc8d1da9f51f0200e5b94", "pre_experiment_sha": "b8c82b77394fc5f506cdc8d1da9f51f0200e5b94", "timestamp": "2026-04-19T18:22:51.095766+00:00", "hypothesis": "Expand the sparse README into a complete operator-focused technical reference with setup, config, commands, schemas, examples, and failure modes.", "hypothesis_source": "agent", "mutation_diff_summary": "", "score": 1.3, "score_ci_lower": 0.4, "score_ci_upper": 2.2, "raw_scores": [3.0, 0.0, 0.5, 2.0, 1.0], "baseline_score": 1.2, "outcome": "DISCARDED", "failure_mode": null, "duration_seconds": 90.92433299997356, "tags": ["readme", "technical-docs", "cli", "yaml", "csv", "usage", "examples", "error-handling"], "learnings": "{\"what_changed\":\"\",\"what_improved\":[],\"what_regressed\":[],\"transferable_insight\":\"When documentation is sparse, the most valuable improvement is to turn it into a task-oriented reference that covers setup, configuration, usage, data structures, examples, and common failure cases in one place.\",\"domain_tags\":[\"documentation\",\"technical-writing\",\"knowledge-management\"]}", "cost_usd": 0.13019455, "bootstrap_seed": 0, "agent_model": "gpt-5.4", "held_out_score": null, "criterion_names": ["quick_start_present", "api_documented", "prerequisites_clear", "examples_runnable", "error_guidance", "contribution_path"], "per_criterion_scores": {"quick_start_present": 0.2, "api_documented": 0.2, "prerequisites_clear": 0.2, "examples_runnable": 0.1, "error_guidance": 0.2, "contribution_path": 0.4}, "failure_classification": {"category": "output_format", "description": "The attempt failed to meet the expected output format/structure requirements for the expanded operator-focused README (e.g., missing or incorrectly structured sections such as setup, config, commands, schemas, examples, or failure modes).", "fix_direction": "Ensure the output strictly follows the required README/operator-reference template and schema: include all mandated headings/sections in the correct order and with the expected formatting for commands, configuration, and examples.", "confidence": 0.74}, "drafts_generated": 1, "drafts_survived": 1}
{"id": "dad0aa5d-fa54-47fc-8052-ec0fd2bb9d37", "target_id": "B5-greedy", "git_sha": "b8c82b77394fc5f506cdc8d1da9f51f0200e5b94", "pre_experiment_sha": "b8c82b77394fc5f506cdc8d1da9f51f0200e5b94", "timestamp": "2026-04-19T18:24:26.548526+00:00", "hypothesis": "Expand the sparse README into a full operator-oriented technical reference with setup, config, CLI, schemas, examples, and troubleshooting.", "hypothesis_source": "agent", "mutation_diff_summary": "", "score": 0.8, "score_ci_lower": 0.2, "score_ci_upper": 1.4, "raw_scores": [1.5, 1.0, 1.5, 0.0, 0.0], "baseline_score": 1.2, "outcome": "DISCARDED", "failure_mode": null, "duration_seconds": 88.82839829102159, "tags": ["readme", "technical-docs", "cli", "operations", "reference"], "learnings": "{\"what_changed\":\"\",\"what_improved\":[],\"what_regressed\":[],\"transferable_insight\":\"When a task asks for broad expansion, the best results come from anchoring the work to concrete operator needs and structured artifacts rather than simply adding more text.\",\"domain_tags\":[\"documentation\",\"technical-writing\",\"information-architecture\"]}", "cost_usd": 0.12796155, "bootstrap_seed": 0, "agent_model": "gpt-5.4", "held_out_score": null, "criterion_names": ["quick_start_present", "api_documented", "prerequisites_clear", "examples_runnable", "error_guidance", "contribution_path"], "per_criterion_scores": {"quick_start_present": 0.2, "api_documented": 0.0, "prerequisites_clear": 0.0, "examples_runnable": 0.0, "error_guidance": 0.3, "contribution_path": 0.3}, "failure_classification": {"category": "incomplete_edit", "description": "The experiment aimed to expand the README into a full operator-oriented technical reference (setup, config, CLI, schemas, examples, troubleshooting), but the result is classified as a failed experiment with insufficient evidence of completing all required sections\u2014leaving an inconsistent or partial documentation state.", "fix_direction": "Ensure the README expansion is comprehensive and internally consistent: add/complete each required section (setup, configuration, CLI usage, schemas, worked examples, troubleshooting) and validate that all references (flags, schema fields, example commands) match the described behavior.", "confidence": 0.72}, "drafts_generated": 1, "drafts_survived": 1}
{"id": "7676e1ed-275d-4760-ba7a-db2a7a058b74", "target_id": "B5-greedy", "git_sha": "b8c82b77394fc5f506cdc8d1da9f51f0200e5b94", "pre_experiment_sha": "b8c82b77394fc5f506cdc8d1da9f51f0200e5b94", "timestamp": "2026-04-19T18:26:09.516518+00:00", "hypothesis": "Expand the sparse README into a full operator-focused technical reference with setup, config, commands, schemas, workflows, and failure handling.", "hypothesis_source": "agent", "mutation_diff_summary": "", "score": 0.8, "score_ci_lower": 0.2, "score_ci_upper": 1.4, "raw_scores": [1.0, 0.0, 1.0, 2.0, 0.0], "baseline_score": 1.2, "outcome": "DISCARDED", "failure_mode": null, "duration_seconds": 100.0214979579905, "tags": ["readme", "technical-docs", "cli", "operations", "schemas", "troubleshooting"], "learnings": "{\"what_changed\":\"\",\"what_improved\":[],\"what_regressed\":[],\"transferable_insight\":\"Expanding a minimal reference into a comprehensive one only helps when it adds concrete, actionable value; otherwise, extra detail can dilute focus without improving usefulness.\",\"domain_tags\":[\"documentation\",\"technical-writing\",\"product-design\"]}", "cost_usd": 0.15887295, "bootstrap_seed": 0, "agent_model": "gpt-5.4", "held_out_score": null, "criterion_names": ["quick_start_present", "api_documented", "prerequisites_clear", "examples_runnable", "error_guidance", "contribution_path"], "per_criterion_scores": {"quick_start_present": 0.1, "api_documented": 0.0, "prerequisites_clear": 0.1, "examples_runnable": 0.0, "error_guidance": 0.0, "contribution_path": 0.6}, "failure_classification": {"category": "incomplete_edit", "description": "The attempted update did not fully deliver the expanded operator-focused technical reference (setup/config/commands/schemas/workflows/failure handling). The result appears partially implemented or left inconsistent, leading to an incomplete experiment outcome.", "fix_direction": "Ensure the README expansion covers every required section end-to-end, keeping internal references consistent (commands match schemas, schemas match workflows, and failure handling is documented for each workflow). Validate for completeness before finalizing.", "confidence": 0.74}, "drafts_generated": 1, "drafts_survived": 1}
{"id": "dda99ba7-6205-448b-a819-e83fc81c163f", "target_id": "B5-greedy", "git_sha": "b8c82b77394fc5f506cdc8d1da9f51f0200e5b94", "pre_experiment_sha": "b8c82b77394fc5f506cdc8d1da9f51f0200e5b94", "timestamp": "2026-04-19T18:27:41.771882+00:00", "hypothesis": "Expand the sparse project note into a full operator-focused README with setup, config, CLI, schemas, workflows, examples, and troubleshooting.", "hypothesis_source": "agent", "mutation_diff_summary": "", "score": 0.0, "score_ci_lower": 0.0, "score_ci_upper": 0.0, "raw_scores": [0.0, 0.0, 0.0, 0.0, 0.0], "baseline_score": 1.2, "outcome": "DISCARDED", "failure_mode": null, "duration_seconds": 89.9832364579197, "tags": ["readme", "technical-docs", "cli", "operations", "schemas"], "learnings": "{\"what_changed\":\"\",\"what_improved\":[],\"what_regressed\":[],\"transferable_insight\":\"When expanding a brief note into a full guide, adding breadth without clear user need or structure can dilute usefulness rather than improve it.\",\"domain_tags\":[\"documentation\",\"product-design\",\"information-architecture\"]}", "cost_usd": 0.13231874999999998, "bootstrap_seed": 0, "agent_model": "gpt-5.4", "held_out_score": null, "criterion_names": ["quick_start_present", "api_documented", "prerequisites_clear", "examples_runnable", "error_guidance", "contribution_path"], "per_criterion_scores": {"quick_start_present": 0.0, "api_documented": 0.0, "prerequisites_clear": 0.0, "examples_runnable": 0.0, "error_guidance": 0.0, "contribution_path": 0.0}, "failure_classification": {"category": "incomplete_edit", "description": "The attempt appears to have failed without completing the requested deliverable; based on the provided metadata (failure mode unknown and score 0), it likely produced only a partial or inconsistent README rather than a complete operator-focused README with the required sections (setup/config/CLI/schemas/workflows/examples/troubleshooting).", "fix_direction": "Ensure the edit fully expands the sparse note into the complete README structure, verify all required sections and cross-references are present and consistent, and validate that each referenced CLI/schema/workflow example matches the documented interfaces.", "confidence": 0.35}, "drafts_generated": 1, "drafts_survived": 1}
