{"id": "53e3ab76-66f2-4cf5-bc73-5420b46aacc5", "target_id": "B5-greedy", "git_sha": "b8c82b77394fc5f506cdc8d1da9f51f0200e5b94", "pre_experiment_sha": "b8c82b77394fc5f506cdc8d1da9f51f0200e5b94", "timestamp": "2026-04-19T19:55:48.395065+00:00", "hypothesis": "Expand the sparse README into a complete operator manual with concrete setup, config, CLI, I/O, workflow, examples, and troubleshooting.", "hypothesis_source": "agent", "mutation_diff_summary": "", "score": 0.3, "score_ci_lower": 0.0, "score_ci_upper": 0.9, "raw_scores": [1.5, 0.0, 0.0, 0.0, 0.0], "baseline_score": 1.2, "outcome": "DISCARDED", "failure_mode": null, "duration_seconds": 139.0145981250098, "tags": ["technical-readme", "operator-manual", "cli", "csv", "yaml"], "learnings": "{\"what_changed\":\"\",\"what_improved\":[],\"what_regressed\":[],\"transferable_insight\":\"A broad expansion can fail if it adds completeness without improving clarity, usability, or evidence of user value, so scope should be guided by concrete needs rather than documentation volume alone.\",\"domain_tags\":[\"documentation\",\"product-design\",\"usability\"]}", "cost_usd": 0.21112755, "bootstrap_seed": 0, "agent_model": "gpt-5.4", "held_out_score": null, "criterion_names": ["quick_start_present", "api_documented", "prerequisites_clear", "examples_runnable", "error_guidance", "contribution_path"], "per_criterion_scores": {"quick_start_present": 0.2, "api_documented": 0.0, "prerequisites_clear": 0.0, "examples_runnable": 0.1, "error_guidance": 0.0, "contribution_path": 0.0}, "failure_classification": {"category": "incomplete_edit", "description": "The attempt did not successfully expand the sparse README into a complete operator manual; the result appears partial/incomplete, leaving missing or inconsistent sections (setup, configuration, CLI/I/O, workflow, examples, troubleshooting).", "fix_direction": "Ensure the full manual is present end-to-end: add concrete setup steps, complete config schema/options, CLI commands with examples and expected inputs/outputs, a clear workflow, and a troubleshooting section aligned with the actual tool behavior.", "confidence": 0.62}, "drafts_generated": 1, "drafts_survived": 1}
{"id": "803c48ea-d986-4ebe-9804-fe1f261ad72e", "target_id": "B5-greedy", "git_sha": "b8c82b77394fc5f506cdc8d1da9f51f0200e5b94", "pre_experiment_sha": "b8c82b77394fc5f506cdc8d1da9f51f0200e5b94", "timestamp": "2026-04-19T19:58:21.484610+00:00", "hypothesis": "Expand the sparse README into a complete operator manual with concrete setup, config, CLI, I/O, workflow, examples, and troubleshooting to reduce incomplete-edit failures.", "hypothesis_source": "agent", "mutation_diff_summary": "", "score": 0.5, "score_ci_lower": 0.0, "score_ci_upper": 1.5, "raw_scores": [0.0, 0.0, 0.0, 2.5, 0.0], "baseline_score": 1.2, "outcome": "DISCARDED", "failure_mode": null, "duration_seconds": 150.22093612502795, "tags": ["readme", "operator-manual", "cli", "csv", "yaml", "documentation"], "learnings": "{\"what_changed\":\"\",\"what_improved\":[],\"what_regressed\":[],\"transferable_insight\":\"When documentation is too sparse, adding concrete end-to-end usage details can reduce failure from incomplete edits by making the intended workflow explicit and actionable.\",\"domain_tags\":[\"documentation\",\"workflow\",\"usability\"]}", "cost_usd": 0.23018255000000004, "bootstrap_seed": 0, "agent_model": "gpt-5.4", "held_out_score": null, "criterion_names": ["quick_start_present", "api_documented", "prerequisites_clear", "examples_runnable", "error_guidance", "contribution_path"], "per_criterion_scores": {"quick_start_present": 0.0, "api_documented": 0.0, "prerequisites_clear": 0.1, "examples_runnable": 0.0, "error_guidance": 0.2, "contribution_path": 0.2}, "failure_classification": {"category": "incomplete_edit", "description": "The experiment appears to partially expand a sparse README into an operator manual, but results in an incomplete or inconsistent edit\u2014leaving gaps in required sections like concrete setup, config, CLI/I/O, workflow, examples, or troubleshooting.", "fix_direction": "Ensure a complete, end-to-end operator manual is generated in one coherent pass: include all required sections (setup, configuration, CLI usage, I/O formats, workflow, examples, troubleshooting), verify internal consistency (commands match config fields, examples match declared I/O), and validate that nothing referenced in one section is missing from another.", "confidence": 0.62}, "drafts_generated": 1, "drafts_survived": 1}
