{"id": "513e667d-035c-43aa-a752-f2a070d08bd4", "target_id": "B5-greedy", "git_sha": "bdccf93406cb44987bed29cf971b5a6ce4c48e1a", "pre_experiment_sha": "bdccf93406cb44987bed29cf971b5a6ce4c48e1a", "timestamp": "2026-04-23T00:13:22.018794+00:00", "hypothesis": "Convert the README artifact into a strict text-processing prompt using authoritative bullet points, explicit bans on markdown wrapping and conversational filler, and a precise list of 10 headings to be appended with exact placeholder text.", "hypothesis_source": "agent", "mutation_diff_summary": "", "score": 1.7, "score_ci_lower": 0.9, "score_ci_upper": 2.6, "raw_scores": [3.5, 0.5, 2.0, 1.0, 1.5], "baseline_score": 2.4, "outcome": "DISCARDED", "failure_mode": null, "duration_seconds": 90.76550004212186, "tags": ["prompt-engineering", "strict-formatting", "direct-output", "prevent-truncation"], "learnings": "{\"what_changed\":\"\",\"what_improved\":[],\"what_regressed\":[],\"transferable_insight\":\"Enforcing overly rigid structural templates and authoritative negative constraints degrades performance by over-constraining the system's natural generation capabilities.\",\"domain_tags\":[\"Prompt Engineering\",\"Constraint Management\",\"Instruction Design\"]}", "cost_usd": 0.0319915, "bootstrap_seed": 0, "agent_model": "gemini-3.1-pro-preview", "held_out_score": null, "criterion_names": ["quick_start_present", "api_documented", "prerequisites_clear", "examples_runnable", "error_guidance", "contribution_path"], "per_criterion_scores": {"quick_start_present": 0.4, "api_documented": 0.0, "prerequisites_clear": 0.0, "examples_runnable": 0.8, "error_guidance": 0.1, "contribution_path": 0.4}, "failure_classification": {"category": "output_format", "description": "The experiment likely failed to adhere to the strict formatting and structural requirements outlined in the hypothesis. This could include the presence of banned markdown or conversational filler, incorrect bullet point usage, or, most critically, the failure to append the precise list of 10 headings with their exact placeholder text. The very low score of 1.7 strongly suggests a fundamental breakdown in producing the desired output structure.", "fix_direction": "Reinforce the instructions for output format by providing a clear, explicit example of the desired structure, including the 10 headings and placeholder text. Make the negative constraints (no markdown, no conversational filler) even more prominent. Consider breaking down the formatting task into smaller, sequential steps if possible.", "confidence": 0.95}, "drafts_generated": 1, "drafts_survived": 1}
{"id": "272e780a-6950-43b1-ae40-c3839e42ebcf", "target_id": "B5-greedy", "git_sha": "bdccf93406cb44987bed29cf971b5a6ce4c48e1a", "pre_experiment_sha": "bdccf93406cb44987bed29cf971b5a6ce4c48e1a", "timestamp": "2026-04-23T00:15:16.469812+00:00", "hypothesis": "Structure the prompt with strict, authoritative constraints at the beginning to enforce raw text output, complete verbatim reproduction, and exact formatting of the 10 appended headings without using forbidden terms.", "hypothesis_source": "agent", "mutation_diff_summary": "", "score": 1.7, "score_ci_lower": 0.7, "score_ci_upper": 2.5, "raw_scores": [2.5, 0.0, 2.5, 1.0, 2.5], "baseline_score": 2.4, "outcome": "DISCARDED", "failure_mode": null, "duration_seconds": 99.58256941707805, "tags": ["prompt-engineering", "strict-formatting", "verbatim-reproduction"], "learnings": "{\"what_changed\":\"\",\"what_improved\":[],\"what_regressed\":[],\"transferable_insight\":\"Front-loading instructions with overly strict, authoritative constraints and multiple complex formatting rules degrades performance and reduces overall compliance.\",\"domain_tags\":[\"Prompt Engineering\",\"Instruction Design\",\"Constraint Management\"]}", "cost_usd": 0.0308088, "bootstrap_seed": 0, "agent_model": "gemini-3.1-pro-preview", "held_out_score": null, "criterion_names": ["quick_start_present", "api_documented", "prerequisites_clear", "examples_runnable", "error_guidance", "contribution_path"], "per_criterion_scores": {"quick_start_present": 0.5, "api_documented": 0.2, "prerequisites_clear": 0.2, "examples_runnable": 0.4, "error_guidance": 0.0, "contribution_path": 0.4}, "failure_classification": {"category": "output_format", "description": "The experiment's hypothesis focused on enforcing strict output formatting requirements: raw text output, complete verbatim reproduction, and exact formatting of specific headings. The failure indicates that the model's output did not conform to these specified structural, presentational, or verbatim reproduction constraints, despite the prompt's authoritative instructions.", "fix_direction": "Strengthen and clarify prompt instructions regarding desired output structure, raw text output, and exact formatting. This could involve more explicit negative constraints (e.g., 'DO NOT use any markdown or special formatting'), concrete few-shot examples of the desired output, or segmenting the task to isolate the challenge of verbatim reproduction vs. raw text enforcement. Investigate if the 'without forbidden terms' constraint indirectly impacted the formatting adherence.", "confidence": 0.95}, "drafts_generated": 1, "drafts_survived": 1}
{"id": "2d21c567-a452-4d2b-9f42-2f592d135983", "target_id": "B5-greedy", "git_sha": "bdccf93406cb44987bed29cf971b5a6ce4c48e1a", "pre_experiment_sha": "bdccf93406cb44987bed29cf971b5a6ce4c48e1a", "timestamp": "2026-04-23T00:17:33.355677+00:00", "hypothesis": "Append 10 specific headings to the text with strict raw formatting instructions.", "hypothesis_source": "agent", "mutation_diff_summary": "", "score": 1.5, "score_ci_lower": 0.6, "score_ci_upper": 2.4, "raw_scores": [0.0, 3.0, 1.5, 2.0, 1.0], "baseline_score": 2.4, "outcome": "DISCARDED", "failure_mode": null, "duration_seconds": 97.6512416251935, "tags": ["formatting", "structural"], "learnings": "{\"what_changed\":\"\",\"what_improved\":[],\"what_regressed\":[],\"transferable_insight\":\"Forcing a high volume of specific structural elements alongside rigid formatting constraints significantly degrades output quality.\",\"domain_tags\":[\"Prompt Engineering\",\"Formatting Constraints\",\"Content Structuring\"]}", "cost_usd": 0.02587755, "bootstrap_seed": 0, "agent_model": "gemini-3.1-pro-preview", "held_out_score": null, "criterion_names": ["quick_start_present", "api_documented", "prerequisites_clear", "examples_runnable", "error_guidance", "contribution_path"], "per_criterion_scores": {"quick_start_present": 0.4, "api_documented": 0.0, "prerequisites_clear": 0.3, "examples_runnable": 0.0, "error_guidance": 0.4, "contribution_path": 0.4}, "failure_classification": {"category": "output_format", "description": "The experiment likely failed to adhere to the strict raw formatting instructions for the 10 specific headings, or failed to append all of them correctly. The hypothesis explicitly details output structure and formatting requirements.", "fix_direction": "Implement more rigorous parsing and validation of the generated output to ensure exact compliance with all specified formatting rules and the precise number and content of headings. Focus on character-level and structural-level correctness.", "confidence": 0.9}, "drafts_generated": 1, "drafts_survived": 1}
{"id": "089ba71a-69d5-408b-9ba5-d578c2bad866", "target_id": "B5-greedy", "git_sha": "bdccf93406cb44987bed29cf971b5a6ce4c48e1a", "pre_experiment_sha": "bdccf93406cb44987bed29cf971b5a6ce4c48e1a", "timestamp": "2026-04-23T00:19:38.018477+00:00", "hypothesis": "Append 10 specific headings to the text and enforce strict output formatting.", "hypothesis_source": "agent", "mutation_diff_summary": "", "score": 1.0, "score_ci_lower": 0.4, "score_ci_upper": 1.6, "raw_scores": [0.0, 1.0, 2.0, 1.0, 1.0], "baseline_score": 2.4, "outcome": "DISCARDED", "failure_mode": null, "duration_seconds": 112.49108179216273, "tags": ["formatting", "strict-instructions"], "learnings": "{\"what_changed\":\"\",\"what_improved\":[],\"what_regressed\":[],\"transferable_insight\":\"Imposing overly rigid structural constraints, such as requiring numerous specific headings, restricts flexibility and significantly degrades overall output quality.\",\"domain_tags\":[\"Prompt Engineering\",\"Output Formatting\",\"Constraint Management\"]}", "cost_usd": 0.027200150000000003, "bootstrap_seed": 0, "agent_model": "gemini-3.1-pro-preview", "held_out_score": null, "criterion_names": ["quick_start_present", "api_documented", "prerequisites_clear", "examples_runnable", "error_guidance", "contribution_path"], "per_criterion_scores": {"quick_start_present": 0.2, "api_documented": 0.0, "prerequisites_clear": 0.0, "examples_runnable": 0.2, "error_guidance": 0.4, "contribution_path": 0.2}, "failure_classification": {"category": "output_format", "description": "The experiment failed to adhere to the strict output formatting specified in the hypothesis, or failed to correctly append the 10 specific headings in the expected structural manner, resulting in a score indicative of complete failure.", "fix_direction": "Strengthen the prompt's instructions regarding output structure and formatting. Implement post-processing validation or provide more explicit examples of the desired output schema to ensure compliance.", "confidence": 0.9}, "drafts_generated": 1, "drafts_survived": 1}
