{"id": "78f1750e-fdc3-47bc-81dd-9e6f91d79704", "target_id": "B5-greedy", "git_sha": "4f5715479c393c537d9739d50a7f16d3aabd37ab", "pre_experiment_sha": "4f5715479c393c537d9739d50a7f16d3aabd37ab", "timestamp": "2026-04-07T00:07:05.586847+00:00", "hypothesis": "No hypothesis provided", "hypothesis_source": "synthesized", "mutation_diff_summary": "", "score": 1.9, "score_ci_lower": 1.3, "score_ci_upper": 2.6, "raw_scores": [1.0, 1.5, 1.5, 2.5, 3.0], "baseline_score": 2.4, "outcome": "DISCARDED", "failure_mode": null, "duration_seconds": 112.38543566712178, "tags": [], "learnings": "{\"what_changed\":\"\",\"what_improved\":[],\"what_regressed\":[],\"transferable_insight\":\"No hypothesis provided\",\"domain_tags\":[]}", "cost_usd": 0.45936235000000003, "bootstrap_seed": 0, "agent_model": "claude-sonnet-4-6", "held_out_score": null, "criterion_names": ["quick_start_present", "api_documented", "prerequisites_clear", "examples_runnable", "error_guidance", "contribution_path"], "per_criterion_scores": {"quick_start_present": 0.4, "api_documented": 0.0, "prerequisites_clear": 0.5, "examples_runnable": 0.2, "error_guidance": 0.2, "contribution_path": 0.6}, "failure_classification": {"category": "output_format", "description": "No hypothesis was provided, violating the required output structure/schema.", "fix_direction": "Ensure that all required sections, including the hypothesis, are present and formatted correctly.", "confidence": 0.95}, "drafts_generated": 1, "drafts_survived": 1}
{"id": "d3c7c4cd-4403-4ec5-83c2-cea076de26e3", "target_id": "B5-greedy", "git_sha": "4f5715479c393c537d9739d50a7f16d3aabd37ab", "pre_experiment_sha": "4f5715479c393c537d9739d50a7f16d3aabd37ab", "timestamp": "2026-04-07T00:10:18.641139+00:00", "hypothesis": "No hypothesis provided", "hypothesis_source": "synthesized", "mutation_diff_summary": "", "score": 1.8, "score_ci_lower": 1.2, "score_ci_upper": 2.4, "raw_scores": [2.0, 3.0, 1.0, 1.0, 2.0], "baseline_score": 2.4, "outcome": "DISCARDED", "failure_mode": null, "duration_seconds": 190.5159502089955, "tags": [], "learnings": "{\"what_changed\":\"\",\"what_improved\":[],\"what_regressed\":[],\"transferable_insight\":\"No hypothesis provided\",\"domain_tags\":[]}", "cost_usd": 0.5272043000000001, "bootstrap_seed": 0, "agent_model": "claude-sonnet-4-6", "held_out_score": null, "criterion_names": ["quick_start_present", "api_documented", "prerequisites_clear", "examples_runnable", "error_guidance", "contribution_path"], "per_criterion_scores": {"quick_start_present": 0.6, "api_documented": 0.0, "prerequisites_clear": 0.2, "examples_runnable": 0.2, "error_guidance": 0.2, "contribution_path": 0.6}, "failure_classification": {"category": "output_format", "description": "The experiment failed due to a violation of the expected output structure or schema.", "fix_direction": "Ensure that all outputs strictly conform to the required schema and output format specifications.", "confidence": 0.9}, "drafts_generated": 1, "drafts_survived": 1}
{"id": "ba2f059f-654b-4085-8972-4bca2f0ec8a7", "target_id": "B5-greedy", "git_sha": "4f5715479c393c537d9739d50a7f16d3aabd37ab", "pre_experiment_sha": "4f5715479c393c537d9739d50a7f16d3aabd37ab", "timestamp": "2026-04-07T00:12:25.580910+00:00", "hypothesis": "No hypothesis provided", "hypothesis_source": "synthesized", "mutation_diff_summary": "", "score": 1.8, "score_ci_lower": 0.6, "score_ci_upper": 3.4, "raw_scores": [0.0, 2.0, 1.0, 5.0, 1.0], "baseline_score": 2.4, "outcome": "DISCARDED", "failure_mode": null, "duration_seconds": 124.67437362484634, "tags": [], "learnings": "{\"what_changed\":\"\",\"what_improved\":[],\"what_regressed\":[],\"transferable_insight\":\"No hypothesis provided\",\"domain_tags\":[]}", "cost_usd": 0.5030706500000001, "bootstrap_seed": 0, "agent_model": "claude-sonnet-4-6", "held_out_score": null, "criterion_names": ["quick_start_present", "api_documented", "prerequisites_clear", "examples_runnable", "error_guidance", "contribution_path"], "per_criterion_scores": {"quick_start_present": 0.6, "api_documented": 0.0, "prerequisites_clear": 0.2, "examples_runnable": 0.2, "error_guidance": 0.2, "contribution_path": 0.6}, "failure_classification": {"category": "output_format", "description": "The experiment failed due to a violation of the required output structure or schema.", "fix_direction": "Review and strictly adhere to the specified output format/schema requirements.", "confidence": 0.9}, "drafts_generated": 1, "drafts_survived": 1}
{"id": "1a992f6f-9984-407d-8eb0-0db686f86005", "target_id": "B5-greedy", "git_sha": "4f5715479c393c537d9739d50a7f16d3aabd37ab", "pre_experiment_sha": "4f5715479c393c537d9739d50a7f16d3aabd37ab", "timestamp": "2026-04-07T00:15:20.736860+00:00", "hypothesis": "No hypothesis provided", "hypothesis_source": "synthesized", "mutation_diff_summary": "", "score": 1.1, "score_ci_lower": 0.5, "score_ci_upper": 1.6, "raw_scores": [1.0, 0.0, 1.5, 2.0, 1.0], "baseline_score": 2.4, "outcome": "DISCARDED", "failure_mode": null, "duration_seconds": 173.6184281250462, "tags": [], "learnings": "{\"what_changed\":\"\",\"what_improved\":[],\"what_regressed\":[],\"transferable_insight\":\"No hypothesis provided\",\"domain_tags\":[]}", "cost_usd": 0.5779491499999999, "bootstrap_seed": 0, "agent_model": "claude-sonnet-4-6", "held_out_score": null, "criterion_names": ["quick_start_present", "api_documented", "prerequisites_clear", "examples_runnable", "error_guidance", "contribution_path"], "per_criterion_scores": {"quick_start_present": 0.0, "api_documented": 0.2, "prerequisites_clear": 0.1, "examples_runnable": 0.0, "error_guidance": 0.2, "contribution_path": 0.6}, "failure_classification": {"category": "output_format", "description": "The experiment failed due to a violation of the required output structure or schema.", "fix_direction": "Ensure output strictly adheres to the expected format or schema in future attempts.", "confidence": 0.9}, "drafts_generated": 1, "drafts_survived": 1}
{"id": "a1052595-569d-4080-ad7f-1340ac4c5a59", "target_id": "B5-greedy", "git_sha": "4f5715479c393c537d9739d50a7f16d3aabd37ab", "pre_experiment_sha": "4f5715479c393c537d9739d50a7f16d3aabd37ab", "timestamp": "2026-04-07T00:17:37.537437+00:00", "hypothesis": "No hypothesis provided", "hypothesis_source": "synthesized", "mutation_diff_summary": "", "score": 1.8, "score_ci_lower": 1.2, "score_ci_upper": 2.4, "raw_scores": [3.0, 2.0, 1.0, 2.0, 1.0], "baseline_score": 2.4, "outcome": "DISCARDED", "failure_mode": null, "duration_seconds": 135.21866279211827, "tags": [], "learnings": "{\"what_changed\":\"\",\"what_improved\":[],\"what_regressed\":[],\"transferable_insight\":\"No hypothesis provided\",\"domain_tags\":[]}", "cost_usd": 0.5103744, "bootstrap_seed": 0, "agent_model": "claude-sonnet-4-6", "held_out_score": null, "criterion_names": ["quick_start_present", "api_documented", "prerequisites_clear", "examples_runnable", "error_guidance", "contribution_path"], "per_criterion_scores": {"quick_start_present": 0.6, "api_documented": 0.0, "prerequisites_clear": 0.0, "examples_runnable": 0.2, "error_guidance": 0.4, "contribution_path": 0.6}, "failure_classification": {"category": "output_format", "description": "The experiment failed due to an output structure or schema violation, as indicated by the absence of a provided hypothesis and unknown failure mode, suggesting required fields or sections were missing or not properly formatted.", "fix_direction": "Ensure all required sections (such as hypothesis, failure mode, etc.) are properly filled out and adhere to the expected schema or format.", "confidence": 0.85}, "drafts_generated": 1, "drafts_survived": 1}
{"id": "222171ad-0d77-4f10-9e7d-fc7001603251", "target_id": "B5-greedy", "git_sha": "4f5715479c393c537d9739d50a7f16d3aabd37ab", "pre_experiment_sha": "4f5715479c393c537d9739d50a7f16d3aabd37ab", "timestamp": "2026-04-07T00:19:49.113245+00:00", "hypothesis": "No hypothesis provided", "hypothesis_source": "synthesized", "mutation_diff_summary": "", "score": 1.5, "score_ci_lower": 0.1, "score_ci_upper": 3.0, "raw_scores": [0.0, 0.5, 3.0, 4.0, 0.0], "baseline_score": 2.4, "outcome": "DISCARDED", "failure_mode": null, "duration_seconds": 129.7263083748985, "tags": [], "learnings": "{\"what_changed\":\"\",\"what_improved\":[],\"what_regressed\":[],\"transferable_insight\":\"No hypothesis provided\",\"domain_tags\":[]}", "cost_usd": 0.5177218, "bootstrap_seed": 0, "agent_model": "claude-sonnet-4-6", "held_out_score": null, "criterion_names": ["quick_start_present", "api_documented", "prerequisites_clear", "examples_runnable", "error_guidance", "contribution_path"], "per_criterion_scores": {"quick_start_present": 0.5, "api_documented": 0.0, "prerequisites_clear": 0.4, "examples_runnable": 0.0, "error_guidance": 0.2, "contribution_path": 0.4}, "failure_classification": {"category": "output_format", "description": "The experiment failed due to a violation of the expected output structure or schema, as suggested by the score and context. The precise output format was not met.", "fix_direction": "Ensure that the output strictly adheres to the required schema or format specifications.", "confidence": 0.8}, "drafts_generated": 1, "drafts_survived": 1}
{"id": "f83f46fa-9947-47b4-9e88-8d4512506a07", "target_id": "B5-greedy", "git_sha": "4f5715479c393c537d9739d50a7f16d3aabd37ab", "pre_experiment_sha": "4f5715479c393c537d9739d50a7f16d3aabd37ab", "timestamp": "2026-04-07T00:21:58.012241+00:00", "hypothesis": "No hypothesis provided", "hypothesis_source": "synthesized", "mutation_diff_summary": "", "score": 0.9, "score_ci_lower": 0.1, "score_ci_upper": 1.7, "raw_scores": [0.0, 0.5, 0.0, 2.0, 2.0], "baseline_score": 2.4, "outcome": "DISCARDED", "failure_mode": null, "duration_seconds": 126.43284512520768, "tags": [], "learnings": "{\"what_changed\":\"\",\"what_improved\":[],\"what_regressed\":[],\"transferable_insight\":\"No hypothesis provided\",\"domain_tags\":[]}", "cost_usd": 0.4287629, "bootstrap_seed": 0, "agent_model": "claude-sonnet-4-6", "held_out_score": null, "criterion_names": ["quick_start_present", "api_documented", "prerequisites_clear", "examples_runnable", "error_guidance", "contribution_path"], "per_criterion_scores": {"quick_start_present": 0.3, "api_documented": 0.0, "prerequisites_clear": 0.0, "examples_runnable": 0.2, "error_guidance": 0.2, "contribution_path": 0.2}, "failure_classification": {"category": "output_format", "description": "The experiment lacks a provided hypothesis, which is likely a required component of the output structure, resulting in an output format/schema violation.", "fix_direction": "Ensure that the output includes all required fields, especially the hypothesis.", "confidence": 0.9}, "drafts_generated": 1, "drafts_survived": 1}
{"id": "5845065b-a682-4a54-91f7-17610ed00296", "target_id": "B5-greedy", "git_sha": "4f5715479c393c537d9739d50a7f16d3aabd37ab", "pre_experiment_sha": "4f5715479c393c537d9739d50a7f16d3aabd37ab", "timestamp": "2026-04-07T00:24:16.414690+00:00", "hypothesis": "No hypothesis provided", "hypothesis_source": "synthesized", "mutation_diff_summary": "", "score": 2.7, "score_ci_lower": 1.5, "score_ci_upper": 3.9, "raw_scores": [3.0, 5.0, 1.0, 3.0, 1.5], "baseline_score": 2.4, "outcome": "DISCARDED", "failure_mode": null, "duration_seconds": 136.46506616589613, "tags": [], "learnings": "{\"what_changed\":\"\",\"what_improved\":[],\"what_regressed\":[],\"transferable_insight\":\"No hypothesis provided\",\"domain_tags\":[]}", "cost_usd": 0.49384029999999995, "bootstrap_seed": 0, "agent_model": "claude-sonnet-4-6", "held_out_score": null, "criterion_names": ["quick_start_present", "api_documented", "prerequisites_clear", "examples_runnable", "error_guidance", "contribution_path"], "per_criterion_scores": {"quick_start_present": 0.8, "api_documented": 0.1, "prerequisites_clear": 0.2, "examples_runnable": 0.4, "error_guidance": 0.4, "contribution_path": 0.8}, "failure_classification": {"category": "output_format", "description": "The experiment failed due to a violation of the required output structure or schema, as indicated by the available data.", "fix_direction": "Ensure adherence to the specified output format/schema in future attempts.", "confidence": 0.7}, "drafts_generated": 1, "drafts_survived": 1}
{"id": "27460b0a-6787-42dd-98a2-babdcf713916", "target_id": "B5-greedy", "git_sha": "4f5715479c393c537d9739d50a7f16d3aabd37ab", "pre_experiment_sha": "4f5715479c393c537d9739d50a7f16d3aabd37ab", "timestamp": "2026-04-07T00:26:06.454897+00:00", "hypothesis": "No hypothesis provided", "hypothesis_source": "synthesized", "mutation_diff_summary": "", "score": 0.6, "score_ci_lower": 0.2, "score_ci_upper": 1.0, "raw_scores": [0.0, 0.0, 1.0, 1.0, 1.0], "baseline_score": 2.4, "outcome": "DISCARDED", "failure_mode": null, "duration_seconds": 107.44084549997933, "tags": [], "learnings": "{\"what_changed\":\"\",\"what_improved\":[],\"what_regressed\":[],\"transferable_insight\":\"No hypothesis provided\",\"domain_tags\":[]}", "cost_usd": 0.438866, "bootstrap_seed": 0, "agent_model": "claude-sonnet-4-6", "held_out_score": null, "criterion_names": ["quick_start_present", "api_documented", "prerequisites_clear", "examples_runnable", "error_guidance", "contribution_path"], "per_criterion_scores": {"quick_start_present": 0.2, "api_documented": 0.0, "prerequisites_clear": 0.0, "examples_runnable": 0.0, "error_guidance": 0.0, "contribution_path": 0.4}, "failure_classification": {"category": "output_format", "description": "The experiment failed due to a violation of the required output structure or schema.", "fix_direction": "Ensure all outputs strictly follow the specified format and schema requirements.", "confidence": 0.85}, "drafts_generated": 1, "drafts_survived": 1}
{"id": "10fc7907-2311-4e85-8d43-c8ec4fc9ff44", "target_id": "B5-greedy", "git_sha": "4f5715479c393c537d9739d50a7f16d3aabd37ab", "pre_experiment_sha": "4f5715479c393c537d9739d50a7f16d3aabd37ab", "timestamp": "2026-04-07T00:28:25.414495+00:00", "hypothesis": "No hypothesis provided", "hypothesis_source": "synthesized", "mutation_diff_summary": "", "score": 1.9, "score_ci_lower": 0.4, "score_ci_upper": 3.7, "raw_scores": [3.0, 0.0, 1.0, 5.0, 0.5], "baseline_score": 2.4, "outcome": "DISCARDED", "failure_mode": null, "duration_seconds": 137.45866112504154, "tags": [], "learnings": "{\"what_changed\":\"\",\"what_improved\":[],\"what_regressed\":[],\"transferable_insight\":\"No hypothesis provided\",\"domain_tags\":[]}", "cost_usd": 0.5409813000000001, "bootstrap_seed": 0, "agent_model": "claude-sonnet-4-6", "held_out_score": null, "criterion_names": ["quick_start_present", "api_documented", "prerequisites_clear", "examples_runnable", "error_guidance", "contribution_path"], "per_criterion_scores": {"quick_start_present": 0.5, "api_documented": 0.0, "prerequisites_clear": 0.2, "examples_runnable": 0.4, "error_guidance": 0.2, "contribution_path": 0.6}, "failure_classification": {"category": "output_format", "description": "The experiment failed due to a violation of the required output structure or schema, as indicated by the absence of relevant information such as a hypothesis and unknown failure mode.", "fix_direction": "Ensure the experiment produces outputs that fully conform to the expected schema, including all required fields.", "confidence": 0.85}, "drafts_generated": 1, "drafts_survived": 1}
{"id": "c3de4036-a813-4268-b18f-e6d5225b5480", "target_id": "B5-greedy", "git_sha": "4f5715479c393c537d9739d50a7f16d3aabd37ab", "pre_experiment_sha": "4f5715479c393c537d9739d50a7f16d3aabd37ab", "timestamp": "2026-04-07T00:30:44.360455+00:00", "hypothesis": "No hypothesis provided", "hypothesis_source": "synthesized", "mutation_diff_summary": "", "score": 0.9, "score_ci_lower": 0.2, "score_ci_upper": 1.6, "raw_scores": [0.0, 1.5, 0.0, 2.0, 1.0], "baseline_score": 2.4, "outcome": "DISCARDED", "failure_mode": null, "duration_seconds": 137.08911104197614, "tags": [], "learnings": "{\"what_changed\":\"\",\"what_improved\":[],\"what_regressed\":[],\"transferable_insight\":\"No hypothesis provided\",\"domain_tags\":[]}", "cost_usd": 0.46724475, "bootstrap_seed": 0, "agent_model": "claude-sonnet-4-6", "held_out_score": null, "criterion_names": ["quick_start_present", "api_documented", "prerequisites_clear", "examples_runnable", "error_guidance", "contribution_path"], "per_criterion_scores": {"quick_start_present": 0.4, "api_documented": 0.0, "prerequisites_clear": 0.0, "examples_runnable": 0.0, "error_guidance": 0.3, "contribution_path": 0.2}, "failure_classification": {"category": "output_format", "description": "The experiment failed due to an output structure/schema violation, as indicated by the score and absence of a hypothesis or clear failure mode.", "fix_direction": "Ensure that outputs strictly conform to the expected schema, including all required fields and correct formatting.", "confidence": 0.85}, "drafts_generated": 1, "drafts_survived": 1}
{"id": "1930fa8d-ce29-4259-bd61-9a580fbf907e", "target_id": "B5-greedy", "git_sha": "4f5715479c393c537d9739d50a7f16d3aabd37ab", "pre_experiment_sha": "4f5715479c393c537d9739d50a7f16d3aabd37ab", "timestamp": "2026-04-07T00:32:57.968221+00:00", "hypothesis": "No hypothesis provided", "hypothesis_source": "synthesized", "mutation_diff_summary": "", "score": 2.0, "score_ci_lower": 0.8, "score_ci_upper": 3.2, "raw_scores": [2.0, 1.0, 3.0, 4.0, 0.0], "baseline_score": 2.4, "outcome": "DISCARDED", "failure_mode": null, "duration_seconds": 131.85039370902814, "tags": [], "learnings": "{\"what_changed\":\"\",\"what_improved\":[],\"what_regressed\":[],\"transferable_insight\":\"No hypothesis provided\",\"domain_tags\":[]}", "cost_usd": 0.46732819999999997, "bootstrap_seed": 0, "agent_model": "claude-sonnet-4-6", "held_out_score": null, "criterion_names": ["quick_start_present", "api_documented", "prerequisites_clear", "examples_runnable", "error_guidance", "contribution_path"], "per_criterion_scores": {"quick_start_present": 0.6, "api_documented": 0.0, "prerequisites_clear": 0.4, "examples_runnable": 0.2, "error_guidance": 0.2, "contribution_path": 0.6}, "failure_classification": {"category": "output_format", "description": "The experiment did not provide a hypothesis, violating required output structure or schema.", "fix_direction": "Ensure a complete output schema is provided, including a hypothesis.", "confidence": 0.95}, "drafts_generated": 1, "drafts_survived": 1}
{"id": "2df27c94-e11f-45fd-bf09-405097dcb807", "target_id": "B5-greedy", "git_sha": "4f5715479c393c537d9739d50a7f16d3aabd37ab", "pre_experiment_sha": "4f5715479c393c537d9739d50a7f16d3aabd37ab", "timestamp": "2026-04-07T00:34:37.013363+00:00", "hypothesis": "No hypothesis provided", "hypothesis_source": "synthesized", "mutation_diff_summary": "", "score": 2.8, "score_ci_lower": 1.2, "score_ci_upper": 4.0, "raw_scores": [4.0, 0.0, 4.0, 4.0, 2.0], "baseline_score": 2.4, "outcome": "DISCARDED", "failure_mode": null, "duration_seconds": 97.28876574989408, "tags": [], "learnings": "{\"what_changed\":\"\",\"what_improved\":[],\"what_regressed\":[],\"transferable_insight\":\"No hypothesis provided\",\"domain_tags\":[]}", "cost_usd": 0.49700079999999996, "bootstrap_seed": 0, "agent_model": "claude-sonnet-4-6", "held_out_score": null, "criterion_names": ["quick_start_present", "api_documented", "prerequisites_clear", "examples_runnable", "error_guidance", "contribution_path"], "per_criterion_scores": {"quick_start_present": 0.8, "api_documented": 0.0, "prerequisites_clear": 0.6, "examples_runnable": 0.6, "error_guidance": 0.2, "contribution_path": 0.6}, "failure_classification": {"category": "output_format", "description": "The experiment failed due to violation of the required output structure or schema.", "fix_direction": "Review and adhere to the expected output format/schema; validate output against schema before submission.", "confidence": 0.8}, "drafts_generated": 1, "drafts_survived": 1}
{"id": "7d44ee1a-3b3d-4965-b6b0-a2e569c4d2ae", "target_id": "B5-greedy", "git_sha": "4f5715479c393c537d9739d50a7f16d3aabd37ab", "pre_experiment_sha": "4f5715479c393c537d9739d50a7f16d3aabd37ab", "timestamp": "2026-04-07T00:36:32.292123+00:00", "hypothesis": "No hypothesis provided", "hypothesis_source": "synthesized", "mutation_diff_summary": "", "score": 1.7, "score_ci_lower": 0.4, "score_ci_upper": 3.1, "raw_scores": [0.0, 4.5, 0.0, 2.0, 2.0], "baseline_score": 2.4, "outcome": "DISCARDED", "failure_mode": null, "duration_seconds": 113.5341166248545, "tags": [], "learnings": "{\"what_changed\":\"\",\"what_improved\":[],\"what_regressed\":[],\"transferable_insight\":\"No hypothesis provided\",\"domain_tags\":[]}", "cost_usd": 0.494347, "bootstrap_seed": 0, "agent_model": "claude-sonnet-4-6", "held_out_score": null, "criterion_names": ["quick_start_present", "api_documented", "prerequisites_clear", "examples_runnable", "error_guidance", "contribution_path"], "per_criterion_scores": {"quick_start_present": 0.4, "api_documented": 0.1, "prerequisites_clear": 0.2, "examples_runnable": 0.4, "error_guidance": 0.4, "contribution_path": 0.2}, "failure_classification": {"category": "output_format", "description": "The failure mode indicates a violation of the required output structure or schema, as per the available categories.", "fix_direction": "Ensure strict adherence to the expected output schema or structure.", "confidence": 0.8}, "drafts_generated": 1, "drafts_survived": 1}
