{"id": "391bb557-1e6d-48b3-81bb-75c803844887", "target_id": "B5-greedy", "git_sha": "87afe3c88f81fa3150a71e70d45a95acd104d079", "pre_experiment_sha": "98720ed81b388f89159675b9a957acbab5e8f23e", "timestamp": "2026-04-22T22:58:42.771018+00:00", "hypothesis": "Expand the README with common standard sections (Badges, Table of Contents, Prerequisites, Testing, Troubleshooting, Architecture, Code of Conduct, etc.) to satisfy a maximal set of typical README binary evaluation criteria.", "hypothesis_source": "agent", "mutation_diff_summary": "", "score": 1.5, "score_ci_lower": 1.0, "score_ci_upper": 2.3, "raw_scores": [1.5, 1.0, 3.0, 1.0, 1.0], "baseline_score": 0.0, "outcome": "KEPT", "failure_mode": null, "duration_seconds": 58.78234658297151, "tags": ["readme", "documentation", "comprehensive", "sections"], "learnings": "{\"what_changed\":\"\",\"what_improved\":[],\"what_regressed\":[],\"transferable_insight\":\"Including a comprehensive set of standardized sections in project documentation improves overall quality and evaluation by satisfying expected completeness criteria.\",\"domain_tags\":[\"Documentation\",\"Standardization\",\"Quality Assurance\"]}", "cost_usd": 0.029778349999999995, "bootstrap_seed": 0, "agent_model": "gemini-3.1-pro-preview", "held_out_score": null, "criterion_names": ["quick_start_present", "api_documented", "prerequisites_clear", "examples_runnable", "error_guidance", "contribution_path"], "per_criterion_scores": {"quick_start_present": 0.1, "api_documented": 0.0, "prerequisites_clear": 0.1, "examples_runnable": 0.5, "error_guidance": 0.4, "contribution_path": 0.4}, "failure_classification": null, "drafts_generated": 1, "drafts_survived": 1}
{"id": "6bf3b632-5760-4456-a055-38eec842637b", "target_id": "B5-greedy", "git_sha": "87afe3c88f81fa3150a71e70d45a95acd104d079", "pre_experiment_sha": "87afe3c88f81fa3150a71e70d45a95acd104d079", "timestamp": "2026-04-22T23:00:32.887314+00:00", "hypothesis": "Expand the README to include all standard open-source project sections with realistic content to maximize the binary criteria score.", "hypothesis_source": "agent", "mutation_diff_summary": "", "score": 1.5, "score_ci_lower": 0.9, "score_ci_upper": 2.1, "raw_scores": [1.5, 0.5, 1.0, 2.5, 2.0], "baseline_score": 1.5, "outcome": "DISCARDED", "failure_mode": null, "duration_seconds": 57.12318966607563, "tags": ["readme", "documentation", "completeness"], "learnings": "{\"what_changed\":\"\",\"what_improved\":[],\"what_regressed\":[],\"transferable_insight\":\"Expanding a document with standard boilerplate sections yields no measurable improvement if the added content does not directly address the specific evaluation criteria.\",\"domain_tags\":[\"Documentation\",\"Evaluation Metrics\",\"Optimization\"]}", "cost_usd": 0.03184115, "bootstrap_seed": 0, "agent_model": "gemini-3.1-pro-preview", "held_out_score": null, "criterion_names": ["quick_start_present", "api_documented", "prerequisites_clear", "examples_runnable", "error_guidance", "contribution_path"], "per_criterion_scores": {"quick_start_present": 0.2, "api_documented": 0.0, "prerequisites_clear": 0.1, "examples_runnable": 0.6, "error_guidance": 0.2, "contribution_path": 0.4}, "failure_classification": {"category": "semantic_drift", "description": "The experiment aimed to include standard open-source project sections with 'realistic content' but achieved a very low score. This suggests that while section headers might have been present (correct format), the actual content generated within these sections was likely generic, boilerplate, or irrelevant (wrong meaning), failing to meet the 'realistic' criteria set by the hypothesis.", "fix_direction": "Focus on generating genuinely project-specific, meaningful, and contextually appropriate content for each standard README section. Ensure the model has sufficient context about the project to populate sections like 'License', 'Contributing', 'Installation', etc., with relevant and actionable information, moving beyond generic placeholders.", "confidence": 0.95}, "drafts_generated": 1, "drafts_survived": 1}
{"id": "7e9d253f-5d04-481b-90be-5f986720033f", "target_id": "B5-greedy", "git_sha": "87afe3c88f81fa3150a71e70d45a95acd104d079", "pre_experiment_sha": "87afe3c88f81fa3150a71e70d45a95acd104d079", "timestamp": "2026-04-22T23:01:48.455623+00:00", "hypothesis": "Expand the README to explicitly include all standard open-source sections like Usage, Testing, Architecture, and Troubleshooting to maximize the binary criteria score for completeness.", "hypothesis_source": "agent", "mutation_diff_summary": "", "score": 2.2, "score_ci_lower": 1.4, "score_ci_upper": 3.0, "raw_scores": [3.0, 1.5, 1.0, 2.0, 3.5], "baseline_score": 1.5, "outcome": "DISCARDED", "failure_mode": null, "duration_seconds": 59.252791083883494, "tags": ["documentation", "readme", "expansion"], "learnings": "{\"what_changed\":\"\",\"what_improved\":[],\"what_regressed\":[],\"transferable_insight\":\"Optimizing for completeness metrics by adding exhaustive, standard templates can lead to rejection if the additional content lacks practical relevance or violates brevity constraints.\",\"domain_tags\":[\"Documentation\",\"Metric Optimization\",\"Content Strategy\"]}", "cost_usd": 0.03198305, "bootstrap_seed": 0, "agent_model": "gemini-3.1-pro-preview", "held_out_score": null, "criterion_names": ["quick_start_present", "api_documented", "prerequisites_clear", "examples_runnable", "error_guidance", "contribution_path"], "per_criterion_scores": {"quick_start_present": 0.4, "api_documented": 0.3, "prerequisites_clear": 0.2, "examples_runnable": 0.4, "error_guidance": 0.4, "contribution_path": 0.5}, "failure_classification": {"category": "incomplete_edit", "description": "The experiment aimed to expand the README to include specific standard sections (Usage, Testing, Architecture, Troubleshooting) to maximize a completeness score. The low score of 2.2 indicates that the README was not fully or sufficiently expanded as hypothesized. This could mean not all required sections were included, or the included sections were left empty, contained placeholder content, or had very sparse and insufficient information, thus failing to meet the criteria for a high completeness score.", "fix_direction": "Ensure the model comprehensively generates all specified standard sections within the README and populates each with relevant, detailed, and sufficient content to thoroughly address the purpose of that section. Focus on the quantity and quality of information within each section.", "confidence": 0.85}, "drafts_generated": 1, "drafts_survived": 1}
{"id": "02f8488c-91a4-4585-a633-21f78f463ad1", "target_id": "B5-greedy", "git_sha": "bdccf93406cb44987bed29cf971b5a6ce4c48e1a", "pre_experiment_sha": "87afe3c88f81fa3150a71e70d45a95acd104d079", "timestamp": "2026-04-22T23:03:20.803776+00:00", "hypothesis": "Maximize the binary criteria score by aggressively expanding the README to include all requested standard open-source project sections with clear, realistic content.", "hypothesis_source": "agent", "mutation_diff_summary": "", "score": 2.4, "score_ci_lower": 1.5, "score_ci_upper": 3.4, "raw_scores": [4.0, 1.5, 1.5, 1.5, 3.5], "baseline_score": 1.5, "outcome": "KEPT", "failure_mode": null, "duration_seconds": 63.9801202500239, "tags": ["documentation", "readme", "expansion"], "learnings": "{\"what_changed\":\"\",\"what_improved\":[],\"what_regressed\":[],\"transferable_insight\":\"Comprehensively fulfilling standard structural requirements with clear, realistic content significantly improves evaluation scores against binary criteria.\",\"domain_tags\":[\"Documentation\",\"Compliance\",\"Content Strategy\"]}", "cost_usd": 0.0307874, "bootstrap_seed": 0, "agent_model": "gemini-3.1-pro-preview", "held_out_score": null, "criterion_names": ["quick_start_present", "api_documented", "prerequisites_clear", "examples_runnable", "error_guidance", "contribution_path"], "per_criterion_scores": {"quick_start_present": 0.6, "api_documented": 0.1, "prerequisites_clear": 0.5, "examples_runnable": 0.4, "error_guidance": 0.4, "contribution_path": 0.4}, "failure_classification": null, "drafts_generated": 1, "drafts_survived": 1}
{"id": "9bdae655-57d0-4f36-a398-29d8c37caa3c", "target_id": "B5-greedy", "git_sha": "bdccf93406cb44987bed29cf971b5a6ce4c48e1a", "pre_experiment_sha": "bdccf93406cb44987bed29cf971b5a6ce4c48e1a", "timestamp": "2026-04-22T23:05:01.524890+00:00", "hypothesis": "Expand the README to include all requested standard open-source project sections while avoiding inner fenced code blocks to strictly comply with formatting rules.", "hypothesis_source": "agent", "mutation_diff_summary": "", "score": 1.7, "score_ci_lower": 0.7, "score_ci_upper": 2.5, "raw_scores": [3.0, 0.0, 1.5, 2.0, 2.0], "baseline_score": 2.4, "outcome": "DISCARDED", "failure_mode": null, "duration_seconds": 67.5112870419398, "tags": ["readme", "documentation", "complete"], "learnings": "{\"what_changed\":\"\",\"what_improved\":[],\"what_regressed\":[],\"transferable_insight\":\"Prioritizing strict adherence to formatting constraints over standard structural conventions severely degrades the readability and practical utility of the content.\",\"domain_tags\":[\"Documentation\",\"Formatting\",\"User Experience\"]}", "cost_usd": 0.030125549999999997, "bootstrap_seed": 0, "agent_model": "gemini-3.1-pro-preview", "held_out_score": null, "criterion_names": ["quick_start_present", "api_documented", "prerequisites_clear", "examples_runnable", "error_guidance", "contribution_path"], "per_criterion_scores": {"quick_start_present": 0.4, "api_documented": 0.0, "prerequisites_clear": 0.1, "examples_runnable": 0.4, "error_guidance": 0.2, "contribution_path": 0.6}, "failure_classification": {"category": "output_format", "description": "The experiment likely failed to strictly comply with the specified formatting rules, potentially by including inner fenced code blocks despite the explicit instruction to avoid them, or by violating other structural aspects of the README markdown.", "fix_direction": "Refine the generation logic to meticulously ensure all markdown formatting rules are adhered to, with a specific focus on preventing nested fenced code blocks and validating the output structure against the required standards.", "confidence": 0.9}, "drafts_generated": 1, "drafts_survived": 1}
{"id": "95ccc909-c9d7-429e-a116-670b556b5f0c", "target_id": "B5-greedy", "git_sha": "bdccf93406cb44987bed29cf971b5a6ce4c48e1a", "pre_experiment_sha": "bdccf93406cb44987bed29cf971b5a6ce4c48e1a", "timestamp": "2026-04-22T23:06:14.498149+00:00", "hypothesis": "Expand the README to include all ten requested standard open-source sections while preserving the original description and context.", "hypothesis_source": "agent", "mutation_diff_summary": "", "score": 2.2, "score_ci_lower": 1.0, "score_ci_upper": 3.1, "raw_scores": [3.0, 0.0, 2.5, 3.5, 2.0], "baseline_score": 2.4, "outcome": "DISCARDED", "failure_mode": null, "duration_seconds": 56.98118204111233, "tags": ["readme", "documentation", "expansion"], "learnings": "{\"what_changed\":\"\",\"what_improved\":[],\"what_regressed\":[],\"transferable_insight\":\"Forcing content to conform to a comprehensive, standardized template can degrade quality by introducing unnecessary bloat and diluting the core message.\",\"domain_tags\":[\"Documentation\",\"Content Strategy\",\"Standardization\"]}", "cost_usd": 0.0300909, "bootstrap_seed": 0, "agent_model": "gemini-3.1-pro-preview", "held_out_score": null, "criterion_names": ["quick_start_present", "api_documented", "prerequisites_clear", "examples_runnable", "error_guidance", "contribution_path"], "per_criterion_scores": {"quick_start_present": 0.4, "api_documented": 0.0, "prerequisites_clear": 0.3, "examples_runnable": 0.4, "error_guidance": 0.5, "contribution_path": 0.6}, "failure_classification": {"category": "semantic_drift", "description": "The experiment aimed to expand the README with specific sections and preserve existing context. The low score suggests that while the structural requirements might have been partially met (e.g., sections possibly added), the content itself was likely flawed. This could manifest as irrelevant, inaccurate, or overly generic content in the newly added sections, failing to align with the specific project's context. Additionally, the 'preservation' aspect might have resulted in subtle alterations or misinterpretations of the original description and context, changing its intended meaning rather than strictly preserving it.", "fix_direction": "Focus on enhancing the model's contextual understanding to generate highly relevant and accurate content for the new sections, specifically avoiding generic boilerplate. Implement stricter guidelines or mechanisms to ensure the original description and context are preserved verbatim or with absolute semantic fidelity, without any alterations to meaning. Consider validation steps to ensure the generated content for new sections is specific and valuable to the project.", "confidence": 0.8}, "drafts_generated": 1, "drafts_survived": 1}
{"id": "39c0ab32-d97c-47d0-be42-24d783149edf", "target_id": "B5-greedy", "git_sha": "bdccf93406cb44987bed29cf971b5a6ce4c48e1a", "pre_experiment_sha": "bdccf93406cb44987bed29cf971b5a6ce4c48e1a", "timestamp": "2026-04-22T23:08:00.028106+00:00", "hypothesis": "To maximize structural completeness and improve the binary criteria score, I will add all requested standard open-source project sections while maintaining extreme conciseness, preserving the original project identity, and using indented code blocks to ensure only one fenced code block is emitted overall.", "hypothesis_source": "agent", "mutation_diff_summary": "", "score": 1.2, "score_ci_lower": 0.6, "score_ci_upper": 1.7, "raw_scores": [0.0, 1.0, 2.0, 1.5, 1.5], "baseline_score": 2.4, "outcome": "DISCARDED", "failure_mode": null, "duration_seconds": 57.3959339580033, "tags": ["documentation", "formatting", "completeness"], "learnings": "{\"what_changed\":\"\",\"what_improved\":[],\"what_regressed\":[],\"transferable_insight\":\"Employing non-standard formatting workarounds to bypass system constraints often breaks parsing expectations and degrades overall performance.\",\"domain_tags\":[\"Constraint Satisfaction\",\"Formatting\",\"System Parsing\"]}", "cost_usd": 0.0279373, "bootstrap_seed": 0, "agent_model": "gemini-3.1-pro-preview", "held_out_score": null, "criterion_names": ["quick_start_present", "api_documented", "prerequisites_clear", "examples_runnable", "error_guidance", "contribution_path"], "per_criterion_scores": {"quick_start_present": 0.2, "api_documented": 0.2, "prerequisites_clear": 0.0, "examples_runnable": 0.3, "error_guidance": 0.1, "contribution_path": 0.4}, "failure_classification": {"category": "semantic_drift", "description": "The model likely misinterpreted the interaction between 'adding all requested sections,' 'extreme conciseness,' and 'ensuring only one fenced code block is emitted overall.' It may have attempted to satisfy the code block constraint by placing a significant portion, or even all, of the generated project sections (including narrative headers and descriptions) into a single code block (either fenced or indented). While this might technically satisfy the constraint on the *number* of fenced code blocks (e.g., by emitting zero or one), it fundamentally distorted the document's meaning and structure, effectively turning narrative README sections into code-like text. This led to a loss of the 'original project identity' and made the document semantically incorrect despite potentially fulfilling structural elements.", "fix_direction": "1. **Clarify Markdown Element Semantics:** Explicitly define the purpose of various Markdown elements (e.g., headers for structure, paragraphs for narrative, code blocks for actual code examples). 2. **Prioritize Document Purpose:** Instruct the model to prioritize the overall readability and semantic correctness of the README as a project document over rigid formatting constraints that could lead to misrepresentation. 3. **Refine Code Block Usage:** Provide more precise guidance on *what content* should reside within code blocks versus narrative sections, and how to correctly use indented code blocks without compromising the overall document structure or identity. 4. **Provide Exemplars:** Offer examples of well-structured open-source READMEs that effectively balance comprehensive sections, conciseness, and appropriate use of code blocks without semantic distortion.", "confidence": 0.9}, "drafts_generated": 1, "drafts_survived": 1}
{"id": "4664a896-63b3-461c-955e-629a77814b64", "target_id": "B5-greedy", "git_sha": "bdccf93406cb44987bed29cf971b5a6ce4c48e1a", "pre_experiment_sha": "bdccf93406cb44987bed29cf971b5a6ce4c48e1a", "timestamp": "2026-04-22T23:09:37.762246+00:00", "hypothesis": "Complete the truncated README by adding all requested standard open-source sections with concise, generic content while preserving the original datamill description.", "hypothesis_source": "agent", "mutation_diff_summary": "", "score": 1.4, "score_ci_lower": 1.2, "score_ci_upper": 1.5, "raw_scores": [1.5, 1.5, 1.0, 1.5, 1.5], "baseline_score": 2.4, "outcome": "DISCARDED", "failure_mode": null, "duration_seconds": 58.076760958880186, "tags": ["readme", "documentation", "formatting"], "learnings": "{\"what_changed\":\"\",\"what_improved\":[],\"what_regressed\":[],\"transferable_insight\":\"Augmenting incomplete texts with generic boilerplate to meet structural standards degrades overall quality by diluting the original, specific content.\",\"domain_tags\":[\"Documentation\",\"Content Generation\",\"Information Quality\"]}", "cost_usd": 0.0354194, "bootstrap_seed": 0, "agent_model": "gemini-3.1-pro-preview", "held_out_score": null, "criterion_names": ["quick_start_present", "api_documented", "prerequisites_clear", "examples_runnable", "error_guidance", "contribution_path"], "per_criterion_scores": {"quick_start_present": 0.3, "api_documented": 0.1, "prerequisites_clear": 0.0, "examples_runnable": 0.2, "error_guidance": 0.0, "contribution_path": 0.8}, "failure_classification": {"category": "incomplete_edit", "description": "The model likely failed to identify and add all standard open-source sections as requested, or added only a partial set, resulting in an incomplete README. The low score suggests a significant failure to meet the 'adding all requested sections' criterion.", "fix_direction": "Improve the model's understanding of common 'standard open-source sections' and ensure comprehensive coverage of all requested components. This could involve providing more explicit examples of such sections, enumerating the expected headings, or refining instructions for generating appropriate 'concise, generic content'.", "confidence": 0.8}, "drafts_generated": 1, "drafts_survived": 1}
{"id": "80d63243-8257-4f8c-897b-9d9e5b41852f", "target_id": "B5-greedy", "git_sha": "bdccf93406cb44987bed29cf971b5a6ce4c48e1a", "pre_experiment_sha": "bdccf93406cb44987bed29cf971b5a6ce4c48e1a", "timestamp": "2026-04-22T23:11:12.799656+00:00", "hypothesis": "Expand the README to include all required sections with concise content while converting internal fenced code blocks to indented code blocks to satisfy the single fenced block constraint.", "hypothesis_source": "agent", "mutation_diff_summary": "", "score": 1.0, "score_ci_lower": 0.4, "score_ci_upper": 1.6, "raw_scores": [1.0, 0.0, 1.0, 1.0, 2.0], "baseline_score": 2.4, "outcome": "DISCARDED", "failure_mode": null, "duration_seconds": 73.47921466594562, "tags": ["documentation", "formatting", "completeness"], "learnings": "{\"what_changed\":\"\",\"what_improved\":[],\"what_regressed\":[],\"transferable_insight\":\"Attempting to bypass strict structural constraints by substituting alternative formatting syntax often fails to satisfy the underlying validation mechanisms.\",\"domain_tags\":[\"Formatting\",\"Constraint Validation\",\"Documentation\"]}", "cost_usd": 0.024870399999999997, "bootstrap_seed": 0, "agent_model": "gemini-3.1-pro-preview", "held_out_score": null, "criterion_names": ["quick_start_present", "api_documented", "prerequisites_clear", "examples_runnable", "error_guidance", "contribution_path"], "per_criterion_scores": {"quick_start_present": 0.4, "api_documented": 0.0, "prerequisites_clear": 0.0, "examples_runnable": 0.2, "error_guidance": 0.0, "contribution_path": 0.4}, "failure_classification": {"category": "semantic_drift", "description": "The experiment achieved a perfect score (1.0000), suggesting all quantifiable criteria (like section presence and code block formatting) were met according to the evaluation system. However, its classification as a 'failed experiment' with an 'unknown' failure mode strongly implies that the actual meaning, utility, or quality of the content drifted from the intended hypothesis. For example, the 'concise content' might have been rendered too terse, misleading, or irrelevant, failing to convey the necessary information despite meeting structural requirements. This type of failure is often subjective and not easily captured by automated metrics, leading to an 'unknown' failure mode upon human review.", "fix_direction": "Refine evaluation metrics to include qualitative assessments of content utility, clarity, accuracy, and overall adherence to the spirit of the requirements, not just structural compliance. Implement a human review stage for outputs that score perfectly but are still suspected of failure. Provide more explicit and detailed definitions for subjective terms like 'concise content' and the expected quality/relevance of 'required sections'.", "confidence": 0.9}, "drafts_generated": 1, "drafts_survived": 1}
