{"id": "a3b6c2f7-db07-4b03-a8e5-c023106bab0d", "target_id": "B5-greedy", "git_sha": "4f5715479c393c537d9739d50a7f16d3aabd37ab", "pre_experiment_sha": "4f5715479c393c537d9739d50a7f16d3aabd37ab", "timestamp": "2026-04-07T00:38:33.095613+00:00", "hypothesis": "No hypothesis provided", "hypothesis_source": "synthesized", "mutation_diff_summary": "", "score": 1.4, "score_ci_lower": 0.6, "score_ci_upper": 2.2, "raw_scores": [2.0, 0.0, 1.0, 3.0, 1.0], "baseline_score": 2.4, "outcome": "DISCARDED", "failure_mode": null, "duration_seconds": 119.2142135410104, "tags": [], "learnings": "{\"what_changed\":\"\",\"what_improved\":[],\"what_regressed\":[],\"transferable_insight\":\"No hypothesis provided\",\"domain_tags\":[]}", "cost_usd": 0.50870375, "bootstrap_seed": 0, "agent_model": "claude-sonnet-4-6", "held_out_score": null, "criterion_names": ["quick_start_present", "api_documented", "prerequisites_clear", "examples_runnable", "error_guidance", "contribution_path"], "per_criterion_scores": {"quick_start_present": 0.4, "api_documented": 0.2, "prerequisites_clear": 0.2, "examples_runnable": 0.0, "error_guidance": 0.2, "contribution_path": 0.4}, "failure_classification": {"category": "output_format", "description": "The experiment lacked a hypothesis and failure mode, and the provided output seems to violate the required output structure/schema. The absence of mandatory fields or improper format suggests an output structure issue.", "fix_direction": "Ensure all required fields are present and match the intended output schema before submission.", "confidence": 0.9}, "drafts_generated": 1, "drafts_survived": 1}
{"id": "8c50c3fb-2705-427d-be0c-9bc484a4c920", "target_id": "B5-greedy", "git_sha": "4f5715479c393c537d9739d50a7f16d3aabd37ab", "pre_experiment_sha": "4f5715479c393c537d9739d50a7f16d3aabd37ab", "timestamp": "2026-04-07T00:41:02.710859+00:00", "hypothesis": "No hypothesis provided", "hypothesis_source": "synthesized", "mutation_diff_summary": "", "score": 0.8, "score_ci_lower": 0.2, "score_ci_upper": 1.4, "raw_scores": [1.0, 1.0, 0.0, 2.0, 0.0], "baseline_score": 2.4, "outcome": "DISCARDED", "failure_mode": null, "duration_seconds": 147.53869000007398, "tags": [], "learnings": "{\"what_changed\":\"\",\"what_improved\":[],\"what_regressed\":[],\"transferable_insight\":\"No hypothesis provided\",\"domain_tags\":[]}", "cost_usd": 0.49075975, "bootstrap_seed": 0, "agent_model": "claude-sonnet-4-6", "held_out_score": null, "criterion_names": ["quick_start_present", "api_documented", "prerequisites_clear", "examples_runnable", "error_guidance", "contribution_path"], "per_criterion_scores": {"quick_start_present": 0.2, "api_documented": 0.0, "prerequisites_clear": 0.2, "examples_runnable": 0.0, "error_guidance": 0.2, "contribution_path": 0.2}, "failure_classification": {"category": "output_format", "description": "The output failed because no hypothesis was provided, which is a required schema item. This violates the structure/schema expected.", "fix_direction": "Ensure all required output fields, especially 'hypothesis', are present and populated according to the schema.", "confidence": 0.95}, "drafts_generated": 1, "drafts_survived": 1}
{"id": "ea299504-9a93-4a06-a3c4-b4f457945de8", "target_id": "B5-greedy", "git_sha": "4f5715479c393c537d9739d50a7f16d3aabd37ab", "pre_experiment_sha": "4f5715479c393c537d9739d50a7f16d3aabd37ab", "timestamp": "2026-04-07T00:43:42.170896+00:00", "hypothesis": "No hypothesis provided", "hypothesis_source": "synthesized", "mutation_diff_summary": "", "score": 1.7, "score_ci_lower": 0.6, "score_ci_upper": 3.0, "raw_scores": [4.0, 2.0, 1.0, 1.5, 0.0], "baseline_score": 2.4, "outcome": "DISCARDED", "failure_mode": null, "duration_seconds": 157.69743283395655, "tags": [], "learnings": "{\"what_changed\":\"\",\"what_improved\":[],\"what_regressed\":[],\"transferable_insight\":\"No hypothesis provided\",\"domain_tags\":[]}", "cost_usd": 0.5026595, "bootstrap_seed": 0, "agent_model": "claude-sonnet-4-6", "held_out_score": null, "criterion_names": ["quick_start_present", "api_documented", "prerequisites_clear", "examples_runnable", "error_guidance", "contribution_path"], "per_criterion_scores": {"quick_start_present": 0.2, "api_documented": 0.0, "prerequisites_clear": 0.3, "examples_runnable": 0.2, "error_guidance": 0.4, "contribution_path": 0.6}, "failure_classification": {"category": "output_format", "description": "The experiment resulted in an output structure or schema violation, as there was no hypothesis provided and the failure mode is unknown, suggesting missing or malformed required output fields.", "fix_direction": "Ensure all required fields are present and conform to the expected output schema before submission.", "confidence": 0.9}, "drafts_generated": 1, "drafts_survived": 1}
{"id": "2ef7e1b8-8bad-4742-84d4-eae06fc49e70", "target_id": "B5-greedy", "git_sha": "4f5715479c393c537d9739d50a7f16d3aabd37ab", "pre_experiment_sha": "4f5715479c393c537d9739d50a7f16d3aabd37ab", "timestamp": "2026-04-07T00:45:19.839612+00:00", "hypothesis": "No hypothesis provided", "hypothesis_source": "synthesized", "mutation_diff_summary": "", "score": 2.2, "score_ci_lower": 0.8, "score_ci_upper": 3.8, "raw_scores": [3.0, 0.0, 1.0, 5.0, 2.0], "baseline_score": 2.4, "outcome": "DISCARDED", "failure_mode": null, "duration_seconds": 95.82490612496622, "tags": [], "learnings": "{\"what_changed\":\"\",\"what_improved\":[],\"what_regressed\":[],\"transferable_insight\":\"No hypothesis provided\",\"domain_tags\":[]}", "cost_usd": 0.47778180000000003, "bootstrap_seed": 0, "agent_model": "claude-sonnet-4-6", "held_out_score": null, "criterion_names": ["quick_start_present", "api_documented", "prerequisites_clear", "examples_runnable", "error_guidance", "contribution_path"], "per_criterion_scores": {"quick_start_present": 0.6, "api_documented": 0.0, "prerequisites_clear": 0.4, "examples_runnable": 0.6, "error_guidance": 0.2, "contribution_path": 0.4}, "failure_classification": {"category": "output_format", "description": "The experiment failed due to a violation of the required output structure or schema. The provided information suggests that the output did not conform to the expected format.", "fix_direction": "Ensure strict adherence to the specified output schema or structure in future attempts.", "confidence": 0.8}, "drafts_generated": 1, "drafts_survived": 1}
{"id": "eeaae783-85d8-4a80-b449-4ee8dafbbb20", "target_id": "B5-greedy", "git_sha": "4f5715479c393c537d9739d50a7f16d3aabd37ab", "pre_experiment_sha": "4f5715479c393c537d9739d50a7f16d3aabd37ab", "timestamp": "2026-04-07T00:47:58.816910+00:00", "hypothesis": "No hypothesis provided", "hypothesis_source": "synthesized", "mutation_diff_summary": "", "score": 2.4, "score_ci_lower": 1.2, "score_ci_upper": 3.6, "raw_scores": [4.0, 1.0, 1.0, 4.0, 2.0], "baseline_score": 2.4, "outcome": "DISCARDED", "failure_mode": null, "duration_seconds": 156.55062249978073, "tags": [], "learnings": "{\"what_changed\":\"\",\"what_improved\":[],\"what_regressed\":[],\"transferable_insight\":\"No hypothesis provided\",\"domain_tags\":[]}", "cost_usd": 0.489413, "bootstrap_seed": 0, "agent_model": "claude-sonnet-4-6", "held_out_score": null, "criterion_names": ["quick_start_present", "api_documented", "prerequisites_clear", "examples_runnable", "error_guidance", "contribution_path"], "per_criterion_scores": {"quick_start_present": 0.6, "api_documented": 0.2, "prerequisites_clear": 0.0, "examples_runnable": 0.4, "error_guidance": 0.6, "contribution_path": 0.6}, "failure_classification": {"category": "output_format", "description": "The experiment failed due to an output structure or schema violation, as indicated by the lack of a hypothesis and unknown failure mode. This suggests a problem with the required output format or missing required elements.", "fix_direction": "Ensure all required fields and schema elements are present in output, and provide baseline hypotheses and explicit failure modes.", "confidence": 0.8}, "drafts_generated": 1, "drafts_survived": 1}
{"id": "713d8352-da13-4965-8df9-3a717f2a0b42", "target_id": "B5-greedy", "git_sha": "4f5715479c393c537d9739d50a7f16d3aabd37ab", "pre_experiment_sha": "4f5715479c393c537d9739d50a7f16d3aabd37ab", "timestamp": "2026-04-07T00:50:01.246639+00:00", "hypothesis": "No hypothesis provided", "hypothesis_source": "synthesized", "mutation_diff_summary": "", "score": 2.2, "score_ci_lower": 1.2, "score_ci_upper": 3.2, "raw_scores": [3.0, 2.0, 1.0, 4.0, 1.0], "baseline_score": 2.4, "outcome": "DISCARDED", "failure_mode": null, "duration_seconds": 119.33144820900634, "tags": [], "learnings": "{\"what_changed\":\"\",\"what_improved\":[],\"what_regressed\":[],\"transferable_insight\":\"No hypothesis provided\",\"domain_tags\":[]}", "cost_usd": 0.48035390000000006, "bootstrap_seed": 0, "agent_model": "claude-sonnet-4-6", "held_out_score": null, "criterion_names": ["quick_start_present", "api_documented", "prerequisites_clear", "examples_runnable", "error_guidance", "contribution_path"], "per_criterion_scores": {"quick_start_present": 0.8, "api_documented": 0.0, "prerequisites_clear": 0.2, "examples_runnable": 0.2, "error_guidance": 0.2, "contribution_path": 0.8}, "failure_classification": {"category": "output_format", "description": "The experiment lacks a provided hypothesis and clear failure mode, but specifically, the score format (2.2000) and absence of required fields suggests a violation of the output structure/schema.", "fix_direction": "Ensure all required fields are present and strictly adhere to the specified output format and schema.", "confidence": 0.8}, "drafts_generated": 1, "drafts_survived": 1}
{"id": "4d066845-e153-4720-b30d-f4f0d929a198", "target_id": "B5-greedy", "git_sha": "4f5715479c393c537d9739d50a7f16d3aabd37ab", "pre_experiment_sha": "4f5715479c393c537d9739d50a7f16d3aabd37ab", "timestamp": "2026-04-07T00:52:17.900472+00:00", "hypothesis": "No hypothesis provided", "hypothesis_source": "synthesized", "mutation_diff_summary": "", "score": 2.1, "score_ci_lower": 1.4, "score_ci_upper": 3.1, "raw_scores": [2.0, 1.5, 4.0, 2.0, 1.0], "baseline_score": 2.4, "outcome": "DISCARDED", "failure_mode": null, "duration_seconds": 134.9063586248085, "tags": [], "learnings": "{\"what_changed\":\"\",\"what_improved\":[],\"what_regressed\":[],\"transferable_insight\":\"No hypothesis provided\",\"domain_tags\":[]}", "cost_usd": 0.5423908000000001, "bootstrap_seed": 0, "agent_model": "claude-sonnet-4-6", "held_out_score": null, "criterion_names": ["quick_start_present", "api_documented", "prerequisites_clear", "examples_runnable", "error_guidance", "contribution_path"], "per_criterion_scores": {"quick_start_present": 0.7, "api_documented": 0.0, "prerequisites_clear": 0.4, "examples_runnable": 0.2, "error_guidance": 0.4, "contribution_path": 0.4}, "failure_classification": {"category": "output_format", "description": "The experiment failed due to a violation of the required output structure or schema; output did not adhere to the expected format.", "fix_direction": "Carefully review and enforce the expected output schema for all responses.", "confidence": 0.85}, "drafts_generated": 1, "drafts_survived": 1}
{"id": "5cab096f-8568-470c-969d-f5a321638017", "target_id": "B5-greedy", "git_sha": "4f5715479c393c537d9739d50a7f16d3aabd37ab", "pre_experiment_sha": "4f5715479c393c537d9739d50a7f16d3aabd37ab", "timestamp": "2026-04-07T00:54:47.906987+00:00", "hypothesis": "No hypothesis provided", "hypothesis_source": "synthesized", "mutation_diff_summary": "", "score": 0.6, "score_ci_lower": 0.2, "score_ci_upper": 1.0, "raw_scores": [0.0, 1.0, 0.0, 1.0, 1.0], "baseline_score": 2.4, "outcome": "DISCARDED", "failure_mode": null, "duration_seconds": 148.14998133387417, "tags": [], "learnings": "{\"what_changed\":\"\",\"what_improved\":[],\"what_regressed\":[],\"transferable_insight\":\"No hypothesis provided\",\"domain_tags\":[]}", "cost_usd": 0.51311715, "bootstrap_seed": 0, "agent_model": "claude-sonnet-4-6", "held_out_score": null, "criterion_names": ["quick_start_present", "api_documented", "prerequisites_clear", "examples_runnable", "error_guidance", "contribution_path"], "per_criterion_scores": {"quick_start_present": 0.2, "api_documented": 0.0, "prerequisites_clear": 0.0, "examples_runnable": 0.0, "error_guidance": 0.0, "contribution_path": 0.4}, "failure_classification": {"category": "output_format", "description": "The experiment lacks a provided hypothesis and the failure mode is marked as unknown, indicating a likely violation of the expected output schema or required fields.", "fix_direction": "Ensure all required fields (e.g., hypothesis and failure mode) are present and correctly filled in the output.", "confidence": 0.85}, "drafts_generated": 1, "drafts_survived": 1}
