{"id": "988080c0-7e1f-46f7-9008-6fb11dfb7d04", "target_id": "B5-greedy", "git_sha": "b8c82b77394fc5f506cdc8d1da9f51f0200e5b94", "pre_experiment_sha": "b8c82b77394fc5f506cdc8d1da9f51f0200e5b94", "timestamp": "2026-04-19T19:08:33.594085+00:00", "hypothesis": "Expand the sparse README into a complete operator manual with concrete setup, configuration, CLI, I/O, workflow, and troubleshooting details.", "hypothesis_source": "agent", "mutation_diff_summary": "", "score": 0.7, "score_ci_lower": 0.0, "score_ci_upper": 1.9, "raw_scores": [3.0, 0.5, 0.0, 0.0, 0.0], "baseline_score": 1.2, "outcome": "DISCARDED", "failure_mode": null, "duration_seconds": 145.72786683402956, "tags": ["readme", "technical-docs", "operations", "cli", "csv", "yaml"], "learnings": "{\"what_changed\":\"\",\"what_improved\":[],\"what_regressed\":[],\"transferable_insight\":\"When expanding minimal documentation, adding concrete operational details can fail if it is not grounded in verified behavior and user needs, so completeness should be balanced with accuracy and relevance.\",\"domain_tags\":[\"documentation\",\"product-quality\",\"technical-writing\"]}", "cost_usd": 0.22311055000000005, "bootstrap_seed": 0, "agent_model": "gpt-5.4", "held_out_score": null, "criterion_names": ["quick_start_present", "api_documented", "prerequisites_clear", "examples_runnable", "error_guidance", "contribution_path"], "per_criterion_scores": {"quick_start_present": 0.2, "api_documented": 0.0, "prerequisites_clear": 0.2, "examples_runnable": 0.0, "error_guidance": 0.0, "contribution_path": 0.3}, "failure_classification": {"category": "incomplete_edit", "description": "The attempt appears to only partially expand the README into the requested complete operator manual. Key required elements like concrete setup, configuration details, CLI/I/O/workflow, and troubleshooting are likely missing or left in an inconsistent or incomplete state, preventing the manual from being fully usable as specified.", "fix_direction": "Ensure the README is fully expanded end-to-end: add explicit setup prerequisites and steps, complete configuration options with examples, fully specified CLI commands/flags and expected inputs/outputs, a clear end-to-end workflow, and a comprehensive troubleshooting section covering common failure modes and remediation steps.", "confidence": 0.74}, "drafts_generated": 1, "drafts_survived": 1}
{"id": "2eb5205b-5683-4b45-b9cf-726e90ec44e0", "target_id": "B5-greedy", "git_sha": "b8c82b77394fc5f506cdc8d1da9f51f0200e5b94", "pre_experiment_sha": "b8c82b77394fc5f506cdc8d1da9f51f0200e5b94", "timestamp": "2026-04-19T19:11:16.011083+00:00", "hypothesis": "Expand the sparse README into a complete operator manual with installation, configuration, CLI, I/O contracts, workflow, examples, and troubleshooting.", "hypothesis_source": "agent", "mutation_diff_summary": "", "score": 0.2, "score_ci_lower": 0.0, "score_ci_upper": 0.6, "raw_scores": [0.0, 0.0, 1.0, 0.0, 0.0], "baseline_score": 1.2, "outcome": "DISCARDED", "failure_mode": null, "duration_seconds": 159.368072125013, "tags": ["readme", "technical-docs", "operations", "cli", "csv", "yaml"], "learnings": "{\"what_changed\":\"\",\"what_improved\":[],\"what_regressed\":[],\"transferable_insight\":\"A broad expansion can fail if it adds completeness without increasing practical clarity, so documentation should be judged by whether it materially improves user understanding and task execution rather than by its length or coverage.\",\"domain_tags\":[\"documentation\",\"usability\",\"product-design\"]}", "cost_usd": 0.22852295, "bootstrap_seed": 0, "agent_model": "gpt-5.4", "held_out_score": null, "criterion_names": ["quick_start_present", "api_documented", "prerequisites_clear", "examples_runnable", "error_guidance", "contribution_path"], "per_criterion_scores": {"quick_start_present": 0.0, "api_documented": 0.0, "prerequisites_clear": 0.0, "examples_runnable": 0.0, "error_guidance": 0.0, "contribution_path": 0.2}, "failure_classification": {"category": "incomplete_edit", "description": "The attempt appears to have failed to fully realize the requested expansion of the sparse README into a complete operator manual; likely only part of the required sections (e.g., install/config/CLI/I/O contracts/workflow/examples/troubleshooting) were added or left in an inconsistent/unfinished state.", "fix_direction": "Systematically enumerate all required manual components from the hypothesis and ensure each section is implemented and internally consistent (including I/O contracts and CLI usage/examples), verifying completeness against the checklist before finalizing.", "confidence": 0.55}, "drafts_generated": 1, "drafts_survived": 1}
{"id": "cc05f1c9-8033-4a29-b5c6-45712a6378c0", "target_id": "B5-greedy", "git_sha": "b8c82b77394fc5f506cdc8d1da9f51f0200e5b94", "pre_experiment_sha": "b8c82b77394fc5f506cdc8d1da9f51f0200e5b94", "timestamp": "2026-04-19T19:13:44.975523+00:00", "hypothesis": "Expand the sparse README into a complete operator manual with concrete setup, configuration, CLI, I/O, workflow, examples, and troubleshooting details.", "hypothesis_source": "agent", "mutation_diff_summary": "", "score": 1.4, "score_ci_lower": 0.4, "score_ci_upper": 2.6, "raw_scores": [1.0, 0.0, 3.5, 2.0, 0.5], "baseline_score": 1.2, "outcome": "DISCARDED", "failure_mode": null, "duration_seconds": 146.49976891698316, "tags": ["technical-readme", "operations", "cli", "yaml", "csv", "python"], "learnings": "{\"what_changed\":\"\",\"what_improved\":[],\"what_regressed\":[],\"transferable_insight\":\"When documentation is sparse, expanding it into a complete, task-oriented manual with concrete examples and troubleshooting can substantially improve usability and adoption.\",\"domain_tags\":[\"documentation\",\"usability\",\"technical-writing\"]}", "cost_usd": 0.22508335000000002, "bootstrap_seed": 0, "agent_model": "gpt-5.4", "held_out_score": null, "criterion_names": ["quick_start_present", "api_documented", "prerequisites_clear", "examples_runnable", "error_guidance", "contribution_path"], "per_criterion_scores": {"quick_start_present": 0.3, "api_documented": 0.1, "prerequisites_clear": 0.2, "examples_runnable": 0.1, "error_guidance": 0.2, "contribution_path": 0.5}, "failure_classification": {"category": "incomplete_edit", "description": "The attempt did not successfully complete the requested expansion of the sparse README into a full operator manual; the resulting artifact appears partial/inconsistent rather than fully formed (e.g., missing or incomplete sections such as setup, configuration, CLI/I-O, workflow, examples, and troubleshooting), leading to a failed outcome despite no specific format/parsing issue being indicated.", "fix_direction": "Ensure the README expansion is end-to-end complete and internally consistent: cover all required manual sections (setup, config, CLI and inputs/outputs, workflow, examples, troubleshooting) and verify that cross-references, command examples, and expected I/O match the described behavior.", "confidence": 0.62}, "drafts_generated": 1, "drafts_survived": 1}
{"id": "3a299fee-eb98-415d-aa59-422b9998f3a0", "target_id": "B5-greedy", "git_sha": "b8c82b77394fc5f506cdc8d1da9f51f0200e5b94", "pre_experiment_sha": "b8c82b77394fc5f506cdc8d1da9f51f0200e5b94", "timestamp": "2026-04-19T19:16:25.590396+00:00", "hypothesis": "Expand the sparse README into a complete operator manual with concrete setup, configuration, CLI, I/O, workflow, examples, and troubleshooting details.", "hypothesis_source": "agent", "mutation_diff_summary": "", "score": 1.0, "score_ci_lower": 0.6, "score_ci_upper": 1.4, "raw_scores": [1.5, 1.0, 0.5, 1.5, 0.5], "baseline_score": 1.2, "outcome": "DISCARDED", "failure_mode": null, "duration_seconds": 150.33695591706783, "tags": ["readme", "operator-manual", "cli", "csv", "yaml", "setup", "configuration", "troubleshooting"], "learnings": "{\"what_changed\":\"\",\"what_improved\":[],\"what_regressed\":[],\"transferable_insight\":\"When expanding minimal documentation, prioritize adding concrete, actionable usage details and operational guidance rather than broad generalities, because completeness only helps if it directly supports execution and troubleshooting.\",\"domain_tags\":[\"documentation\",\"usability\",\"technical-writing\"]}", "cost_usd": 0.21234295000000003, "bootstrap_seed": 0, "agent_model": "gpt-5.4", "held_out_score": null, "criterion_names": ["quick_start_present", "api_documented", "prerequisites_clear", "examples_runnable", "error_guidance", "contribution_path"], "per_criterion_scores": {"quick_start_present": 0.2, "api_documented": 0.2, "prerequisites_clear": 0.1, "examples_runnable": 0.0, "error_guidance": 0.2, "contribution_path": 0.3}, "failure_classification": {"category": "incomplete_edit", "description": "The attempt failed to produce a complete operator manual; the README expansion remained sparse/incomplete, leaving inconsistent or missing sections such as setup, configuration, CLI details, I/O/workflow, examples, and troubleshooting.", "fix_direction": "Fill in all required manual sections end-to-end (setup\u2192config\u2192CLI\u2192I/O\u2192workflow\u2192examples\u2192troubleshooting), ensure internal consistency, and verify the final document is fully self-contained and coherent.", "confidence": 0.62}, "drafts_generated": 1, "drafts_survived": 1}
{"id": "e332a88f-81bd-4f33-9bc8-febcb8ea1b26", "target_id": "B5-greedy", "git_sha": "b8c82b77394fc5f506cdc8d1da9f51f0200e5b94", "pre_experiment_sha": "b8c82b77394fc5f506cdc8d1da9f51f0200e5b94", "timestamp": "2026-04-19T19:18:47.450137+00:00", "hypothesis": "Expand the sparse README into a complete operator manual with concrete setup, configuration, CLI, I/O, workflow, examples, and troubleshooting.", "hypothesis_source": "agent", "mutation_diff_summary": "", "score": 0.9, "score_ci_lower": 0.3, "score_ci_upper": 1.5, "raw_scores": [1.5, 0.0, 1.5, 0.0, 1.5], "baseline_score": 1.2, "outcome": "DISCARDED", "failure_mode": null, "duration_seconds": 139.19080487499014, "tags": ["readme", "operator-manual", "cli", "configuration", "examples", "troubleshooting"], "learnings": "{\"what_changed\":\"\",\"what_improved\":[],\"what_regressed\":[],\"transferable_insight\":\"A broad expansion attempt can fail if it adds completeness without enough concrete, task-specific value or validation, so prioritize the most actionable gaps first.\",\"domain_tags\":[\"documentation\",\"product-design\",\"iteration\"]}", "cost_usd": 0.20258535000000003, "bootstrap_seed": 0, "agent_model": "gpt-5.4", "held_out_score": null, "criterion_names": ["quick_start_present", "api_documented", "prerequisites_clear", "examples_runnable", "error_guidance", "contribution_path"], "per_criterion_scores": {"quick_start_present": 0.3, "api_documented": 0.1, "prerequisites_clear": 0.3, "examples_runnable": 0.0, "error_guidance": 0.1, "contribution_path": 0.1}, "failure_classification": {"category": "incomplete_edit", "description": "The attempt to expand the sparse README into a full operator manual did not complete consistently, leaving parts missing or not fully integrated with the required concrete setup/config/CLI/I/O/workflow/examples/troubleshooting structure.", "fix_direction": "Ensure the edit fully covers all manual sections end-to-end (setup \u2192 configuration \u2192 CLI \u2192 I/O \u2192 workflow \u2192 examples \u2192 troubleshooting) with consistent cross-references, complete command/paths, and no unfinished placeholders.", "confidence": 0.72}, "drafts_generated": 1, "drafts_survived": 1}
{"id": "b92d3601-b32b-4110-8fae-b6e94ab8d93d", "target_id": "B5-greedy", "git_sha": "b8c82b77394fc5f506cdc8d1da9f51f0200e5b94", "pre_experiment_sha": "b8c82b77394fc5f506cdc8d1da9f51f0200e5b94", "timestamp": "2026-04-19T19:21:13.470999+00:00", "hypothesis": "Expand the sparse README into a complete operator manual with concrete installation, configuration, CLI, I/O, workflows, examples, and troubleshooting.", "hypothesis_source": "agent", "mutation_diff_summary": "", "score": 0.9, "score_ci_lower": 0.3, "score_ci_upper": 1.5, "raw_scores": [2.0, 0.5, 1.0, 0.0, 1.0], "baseline_score": 1.2, "outcome": "DISCARDED", "failure_mode": null, "duration_seconds": 143.4940463330131, "tags": ["readme", "operator-manual", "cli", "csv", "yaml", "documentation"], "learnings": "{\"what_changed\":\"\",\"what_improved\":[],\"what_regressed\":[],\"transferable_insight\":\"When a source document is too sparse, adding comprehensive procedural detail can still fail if the added content is not grounded in verified behavior and user needs, so expansion should be paired with validation and prioritization of the most actionable gaps.\",\"domain_tags\":[\"documentation\",\"product-quality\",\"validation\"]}", "cost_usd": 0.21148755000000002, "bootstrap_seed": 0, "agent_model": "gpt-5.4", "held_out_score": null, "criterion_names": ["quick_start_present", "api_documented", "prerequisites_clear", "examples_runnable", "error_guidance", "contribution_path"], "per_criterion_scores": {"quick_start_present": 0.2, "api_documented": 0.2, "prerequisites_clear": 0.2, "examples_runnable": 0.0, "error_guidance": 0.1, "contribution_path": 0.2}, "failure_classification": {"category": "incomplete_edit", "description": "The attempt to expand a sparse README into a full operator manual appears to have left the document in an inconsistent or partial state\u2014missing required concrete sections (e.g., installation/config/CLI/I-O/workflows/examples/troubleshooting) rather than fully completing the manual.", "fix_direction": "Ensure the README expansion is comprehensive and internally consistent: add the full set of required sections with concrete commands, configuration options, input/output specifications, end-to-end workflows, examples, and a troubleshooting guide, validating that all referenced components/options exist.", "confidence": 0.72}, "drafts_generated": 1, "drafts_survived": 1}
{"id": "afd9c2dd-0fb9-4315-be7d-3b369ec6c053", "target_id": "B5-greedy", "git_sha": "b8c82b77394fc5f506cdc8d1da9f51f0200e5b94", "pre_experiment_sha": "b8c82b77394fc5f506cdc8d1da9f51f0200e5b94", "timestamp": "2026-04-19T19:24:03.065185+00:00", "hypothesis": "Expand the sparse README into a complete operator manual with concrete setup, configuration, CLI, I/O, workflow, examples, and troubleshooting details.", "hypothesis_source": "agent", "mutation_diff_summary": "", "score": 0.2, "score_ci_lower": 0.0, "score_ci_upper": 0.6, "raw_scores": [0.0, 0.0, 0.0, 0.0, 1.0], "baseline_score": 1.2, "outcome": "DISCARDED", "failure_mode": null, "duration_seconds": 158.46893362503033, "tags": ["readme", "operator-manual", "cli", "csv", "yaml"], "learnings": "{\"what_changed\":\"\",\"what_improved\":[],\"what_regressed\":[],\"transferable_insight\":\"When a source document is too sparse, adding detailed structure and examples can create the appearance of completeness without improving the underlying usefulness, so expansions should be grounded in verified facts and user needs.\",\"domain_tags\":[\"documentation\",\"quality-control\",\"content-design\"]}", "cost_usd": 0.23018275000000005, "bootstrap_seed": 0, "agent_model": "gpt-5.4", "held_out_score": null, "criterion_names": ["quick_start_present", "api_documented", "prerequisites_clear", "examples_runnable", "error_guidance", "contribution_path"], "per_criterion_scores": {"quick_start_present": 0.2, "api_documented": 0.0, "prerequisites_clear": 0.0, "examples_runnable": 0.0, "error_guidance": 0.0, "contribution_path": 0.0}, "failure_classification": {"category": "incomplete_edit", "description": "The attempt did not successfully deliver a complete, coherent operator manual as specified; instead it resulted in a sparse/incomplete README, suggesting parts of the required content (setup/configuration/CLI/I-O/workflow/examples/troubleshooting) were missing or left in an inconsistent state.", "fix_direction": "Ensure the README is fully expanded to include all mandated sections with concrete, runnable setup steps, exact configuration keys/values, CLI usage and examples, defined input/output formats, end-to-end workflow, and a troubleshooting section; validate internal consistency and completeness against the requested manual outline.", "confidence": 0.68}, "drafts_generated": 1, "drafts_survived": 1}
{"id": "ebefc4dc-ccec-4e1a-bc55-e28763483cf0", "target_id": "B5-greedy", "git_sha": "b8c82b77394fc5f506cdc8d1da9f51f0200e5b94", "pre_experiment_sha": "b8c82b77394fc5f506cdc8d1da9f51f0200e5b94", "timestamp": "2026-04-19T19:26:50.623503+00:00", "hypothesis": "Expand the sparse README into a complete operator manual with concrete setup, configuration, CLI, I/O, workflow, examples, and troubleshooting details.", "hypothesis_source": "agent", "mutation_diff_summary": "", "score": 1.6, "score_ci_lower": 0.3, "score_ci_upper": 2.9, "raw_scores": [1.5, 0.0, 0.0, 3.5, 3.0], "baseline_score": 1.2, "outcome": "DISCARDED", "failure_mode": null, "duration_seconds": 164.26087774999905, "tags": ["readme", "operator-manual", "cli", "csv", "yaml", "python"], "learnings": "{\"what_changed\":\"\",\"what_improved\":[],\"what_regressed\":[],\"transferable_insight\":\"When documentation is too sparse, expanding it into a complete, task-oriented manual with concrete examples, configuration details, and troubleshooting guidance can substantially improve usability and adoption.\",\"domain_tags\":[\"documentation\",\"usability\",\"technical-writing\"]}", "cost_usd": 0.25251295000000007, "bootstrap_seed": 0, "agent_model": "gpt-5.4", "held_out_score": null, "criterion_names": ["quick_start_present", "api_documented", "prerequisites_clear", "examples_runnable", "error_guidance", "contribution_path"], "per_criterion_scores": {"quick_start_present": 0.4, "api_documented": 0.1, "prerequisites_clear": 0.2, "examples_runnable": 0.2, "error_guidance": 0.2, "contribution_path": 0.5}, "failure_classification": {"category": "incomplete_edit", "description": "The attempt to expand the sparse README did not reach a complete, consistent operator-manual state (missing or incomplete sections such as setup/config/CLI/I/O/workflow/examples/troubleshooting), leaving the deliverable in an inconsistent or partial form.", "fix_direction": "Ensure the README expansion fully covers all required manual components end-to-end (installation/setup, configuration, CLI reference with flags, I/O formats, step-by-step workflow, worked examples, and troubleshooting), and validate internal consistency and completeness against the target manual outline.", "confidence": 0.62}, "drafts_generated": 1, "drafts_survived": 1}
{"id": "322e7fd4-654c-498e-aa1c-18779bc21748", "target_id": "B5-greedy", "git_sha": "b8c82b77394fc5f506cdc8d1da9f51f0200e5b94", "pre_experiment_sha": "b8c82b77394fc5f506cdc8d1da9f51f0200e5b94", "timestamp": "2026-04-19T19:29:25.869457+00:00", "hypothesis": "Expand the sparse README into a complete operator manual with setup, config, CLI, I/O contracts, workflows, examples, and troubleshooting.", "hypothesis_source": "agent", "mutation_diff_summary": "", "score": 0.4, "score_ci_lower": 0.1, "score_ci_upper": 0.7, "raw_scores": [0.5, 0.0, 1.0, 0.5, 0.0], "baseline_score": 1.2, "outcome": "DISCARDED", "failure_mode": null, "duration_seconds": 152.72419116692618, "tags": ["readme", "operator-manual", "cli", "csv", "yaml"], "learnings": "{\"what_changed\":\"\",\"what_improved\":[],\"what_regressed\":[],\"transferable_insight\":\"A broad expansion can fail if it adds completeness without addressing the specific information gaps or user tasks that would make the documentation practically useful.\",\"domain_tags\":[\"documentation\",\"product-design\",\"usability\"]}", "cost_usd": 0.22413895, "bootstrap_seed": 0, "agent_model": "gpt-5.4", "held_out_score": null, "criterion_names": ["quick_start_present", "api_documented", "prerequisites_clear", "examples_runnable", "error_guidance", "contribution_path"], "per_criterion_scores": {"quick_start_present": 0.0, "api_documented": 0.0, "prerequisites_clear": 0.0, "examples_runnable": 0.0, "error_guidance": 0.0, "contribution_path": 0.4}, "failure_classification": {"category": "incomplete_edit", "description": "The README/operator manual expansion did not successfully complete the expected set of documentation elements (e.g., setup/config/CLI/I-O contracts/workflows/examples/troubleshooting), leaving the document in an inconsistent or incomplete state relative to the requested output.", "fix_direction": "Iteratively expand the README into a fully consistent operator manual by verifying each required section exists and that CLI and I/O contracts are explicitly documented, then run a completeness checklist before finalizing.", "confidence": 0.62}, "drafts_generated": 1, "drafts_survived": 1}
