{"id": "d85b1746-7df7-4d78-8950-2cd82b4aa020", "target_id": "B5-greedy", "git_sha": "4f5715479c393c537d9739d50a7f16d3aabd37ab", "pre_experiment_sha": "4f5715479c393c537d9739d50a7f16d3aabd37ab", "timestamp": "2026-04-06T23:32:48.052946+00:00", "hypothesis": "No hypothesis provided", "hypothesis_source": "synthesized", "mutation_diff_summary": "", "score": 1.8, "score_ci_lower": 0.8, "score_ci_upper": 2.6, "raw_scores": [3.0, 2.0, 2.0, 0.0, 2.0], "baseline_score": 2.4, "outcome": "DISCARDED", "failure_mode": null, "duration_seconds": 177.19235641602427, "tags": [], "learnings": "{\"what_changed\":\"\",\"what_improved\":[],\"what_regressed\":[],\"transferable_insight\":\"No hypothesis provided\",\"domain_tags\":[]}", "cost_usd": 0.48637444999999996, "bootstrap_seed": 0, "agent_model": "claude-sonnet-4-6", "held_out_score": null, "criterion_names": ["quick_start_present", "api_documented", "prerequisites_clear", "examples_runnable", "error_guidance", "contribution_path"], "per_criterion_scores": {"quick_start_present": 0.6, "api_documented": 0.0, "prerequisites_clear": 0.4, "examples_runnable": 0.2, "error_guidance": 0.2, "contribution_path": 0.4}, "failure_classification": {"category": "output_format", "description": "The experiment failed due to an output structure or schema violation, possibly related to the absence of a required hypothesis or malformed output.", "fix_direction": "Ensure outputs conform to the expected schema, including all required fields such as the hypothesis.", "confidence": 0.8}, "drafts_generated": 1, "drafts_survived": 1}
{"id": "cb55a1a4-eeb2-457e-b352-9176bf6df440", "target_id": "B5-greedy", "git_sha": "4f5715479c393c537d9739d50a7f16d3aabd37ab", "pre_experiment_sha": "4f5715479c393c537d9739d50a7f16d3aabd37ab", "timestamp": "2026-04-06T23:34:22.916895+00:00", "hypothesis": "No hypothesis provided", "hypothesis_source": "synthesized", "mutation_diff_summary": "", "score": 1.8, "score_ci_lower": 0.6, "score_ci_upper": 3.4, "raw_scores": [5.0, 1.0, 1.0, 2.0, 0.0], "baseline_score": 2.4, "outcome": "DISCARDED", "failure_mode": null, "duration_seconds": 93.13487937510945, "tags": [], "learnings": "{\"what_changed\":\"\",\"what_improved\":[],\"what_regressed\":[],\"transferable_insight\":\"No hypothesis provided\",\"domain_tags\":[]}", "cost_usd": 0.51470125, "bootstrap_seed": 0, "agent_model": "claude-sonnet-4-6", "held_out_score": null, "criterion_names": ["quick_start_present", "api_documented", "prerequisites_clear", "examples_runnable", "error_guidance", "contribution_path"], "per_criterion_scores": {"quick_start_present": 0.4, "api_documented": 0.0, "prerequisites_clear": 0.2, "examples_runnable": 0.2, "error_guidance": 0.4, "contribution_path": 0.6}, "failure_classification": {"category": "output_format", "description": "The experiment failed due to a violation of the expected output structure or schema.", "fix_direction": "Review the output specification and ensure the result strictly matches the required schema or format.", "confidence": 0.8}, "drafts_generated": 1, "drafts_survived": 1}
{"id": "72f17227-c85e-4ad8-a364-2e321d93f6de", "target_id": "B5-greedy", "git_sha": "4f5715479c393c537d9739d50a7f16d3aabd37ab", "pre_experiment_sha": "4f5715479c393c537d9739d50a7f16d3aabd37ab", "timestamp": "2026-04-06T23:38:05.119617+00:00", "hypothesis": "No hypothesis provided", "hypothesis_source": "synthesized", "mutation_diff_summary": "", "score": 2.7, "score_ci_lower": 1.0, "score_ci_upper": 4.4, "raw_scores": [4.5, 3.0, 1.0, 5.0, 0.0], "baseline_score": 2.4, "outcome": "DISCARDED", "failure_mode": null, "duration_seconds": 220.35778170800768, "tags": [], "learnings": "{\"what_changed\":\"\",\"what_improved\":[],\"what_regressed\":[],\"transferable_insight\":\"No hypothesis provided\",\"domain_tags\":[]}", "cost_usd": 0.6155132500000001, "bootstrap_seed": 0, "agent_model": "claude-sonnet-4-6", "held_out_score": null, "criterion_names": ["quick_start_present", "api_documented", "prerequisites_clear", "examples_runnable", "error_guidance", "contribution_path"], "per_criterion_scores": {"quick_start_present": 0.6, "api_documented": 0.2, "prerequisites_clear": 0.5, "examples_runnable": 0.4, "error_guidance": 0.4, "contribution_path": 0.6}, "failure_classification": {"category": "output_format", "description": "The experiment failed due to a violation of the required output structure or schema, as indicated by the score and lack of a specified hypothesis or known failure mode.", "fix_direction": "Ensure output strictly adheres to the required format/schema and validate output structure prior to submission.", "confidence": 0.8}, "drafts_generated": 1, "drafts_survived": 1}
{"id": "4cdae3cb-9cf9-4926-b967-3ee2a67ef311", "target_id": "B5-greedy", "git_sha": "4f5715479c393c537d9739d50a7f16d3aabd37ab", "pre_experiment_sha": "4f5715479c393c537d9739d50a7f16d3aabd37ab", "timestamp": "2026-04-06T23:39:46.674168+00:00", "hypothesis": "No hypothesis provided", "hypothesis_source": "synthesized", "mutation_diff_summary": "", "score": 1.6, "score_ci_lower": 0.6, "score_ci_upper": 2.8, "raw_scores": [2.0, 0.0, 1.0, 4.0, 1.0], "baseline_score": 2.4, "outcome": "DISCARDED", "failure_mode": null, "duration_seconds": 99.8379128749948, "tags": [], "learnings": "{\"what_changed\":\"\",\"what_improved\":[],\"what_regressed\":[],\"transferable_insight\":\"No hypothesis provided\",\"domain_tags\":[]}", "cost_usd": 0.44407680000000005, "bootstrap_seed": 0, "agent_model": "claude-sonnet-4-6", "held_out_score": null, "criterion_names": ["quick_start_present", "api_documented", "prerequisites_clear", "examples_runnable", "error_guidance", "contribution_path"], "per_criterion_scores": {"quick_start_present": 0.4, "api_documented": 0.0, "prerequisites_clear": 0.4, "examples_runnable": 0.2, "error_guidance": 0.0, "contribution_path": 0.6}, "failure_classification": {"category": "output_format", "description": "The experiment failed due to a violation of the required output structure or schema.", "fix_direction": "Ensure that the output strictly adheres to the specified format or schema in future attempts.", "confidence": 0.9}, "drafts_generated": 1, "drafts_survived": 1}
{"id": "eef981c1-5701-45c9-a835-fd9230679bed", "target_id": "B5-greedy", "git_sha": "4f5715479c393c537d9739d50a7f16d3aabd37ab", "pre_experiment_sha": "4f5715479c393c537d9739d50a7f16d3aabd37ab", "timestamp": "2026-04-06T23:42:01.074454+00:00", "hypothesis": "No hypothesis provided", "hypothesis_source": "synthesized", "mutation_diff_summary": "", "score": 2.3, "score_ci_lower": 0.9, "score_ci_upper": 3.8, "raw_scores": [2.0, 1.5, 0.0, 5.0, 3.0], "baseline_score": 2.4, "outcome": "DISCARDED", "failure_mode": null, "duration_seconds": 132.52663400000893, "tags": [], "learnings": "{\"what_changed\":\"\",\"what_improved\":[],\"what_regressed\":[],\"transferable_insight\":\"No hypothesis provided\",\"domain_tags\":[]}", "cost_usd": 0.51941695, "bootstrap_seed": 0, "agent_model": "claude-sonnet-4-6", "held_out_score": null, "criterion_names": ["quick_start_present", "api_documented", "prerequisites_clear", "examples_runnable", "error_guidance", "contribution_path"], "per_criterion_scores": {"quick_start_present": 0.7, "api_documented": 0.2, "prerequisites_clear": 0.4, "examples_runnable": 0.6, "error_guidance": 0.2, "contribution_path": 0.2}, "failure_classification": {"category": "output_format", "description": "The experiment failed due to a violation in the required output structure or schema.", "fix_direction": "Ensure output strictly follows the expected format or schema.", "confidence": 0.8}, "drafts_generated": 1, "drafts_survived": 1}
{"id": "91faa1c7-8fd3-41f1-9d88-5f424ca201a4", "target_id": "B5-greedy", "git_sha": "4f5715479c393c537d9739d50a7f16d3aabd37ab", "pre_experiment_sha": "4f5715479c393c537d9739d50a7f16d3aabd37ab", "timestamp": "2026-04-06T23:44:55.778681+00:00", "hypothesis": "No hypothesis provided", "hypothesis_source": "synthesized", "mutation_diff_summary": "", "score": 2.3, "score_ci_lower": 0.8, "score_ci_upper": 3.6, "raw_scores": [3.0, 0.0, 1.0, 4.5, 3.0], "baseline_score": 2.4, "outcome": "DISCARDED", "failure_mode": null, "duration_seconds": 173.33483554096892, "tags": [], "learnings": "{\"what_changed\":\"\",\"what_improved\":[],\"what_regressed\":[],\"transferable_insight\":\"No hypothesis provided\",\"domain_tags\":[]}", "cost_usd": 0.5922252999999998, "bootstrap_seed": 0, "agent_model": "claude-sonnet-4-6", "held_out_score": null, "criterion_names": ["quick_start_present", "api_documented", "prerequisites_clear", "examples_runnable", "error_guidance", "contribution_path"], "per_criterion_scores": {"quick_start_present": 0.6, "api_documented": 0.2, "prerequisites_clear": 0.4, "examples_runnable": 0.3, "error_guidance": 0.2, "contribution_path": 0.6}, "failure_classification": {"category": "output_format", "description": "The experiment failed due to an output structure or schema violation, as the failure mode is unknown and no hypothesis was provided, suggesting issues in adhering to required input/output standards.", "fix_direction": "Ensure outputs conform exactly to the required structure and schema; implement validation checks pre-submission.", "confidence": 0.85}, "drafts_generated": 1, "drafts_survived": 1}
{"id": "c7fc9dbc-32b3-4f13-bc46-19f032c0a841", "target_id": "B5-greedy", "git_sha": "4f5715479c393c537d9739d50a7f16d3aabd37ab", "pre_experiment_sha": "4f5715479c393c537d9739d50a7f16d3aabd37ab", "timestamp": "2026-04-06T23:48:22.786302+00:00", "hypothesis": "No hypothesis provided", "hypothesis_source": "synthesized", "mutation_diff_summary": "", "score": 2.2, "score_ci_lower": 1.2, "score_ci_upper": 3.2, "raw_scores": [3.0, 1.0, 2.0, 4.0, 1.0], "baseline_score": 2.4, "outcome": "DISCARDED", "failure_mode": null, "duration_seconds": 205.11443091696128, "tags": [], "learnings": "{\"what_changed\":\"\",\"what_improved\":[],\"what_regressed\":[],\"transferable_insight\":\"No hypothesis provided\",\"domain_tags\":[]}", "cost_usd": 0.6273336, "bootstrap_seed": 0, "agent_model": "claude-sonnet-4-6", "held_out_score": null, "criterion_names": ["quick_start_present", "api_documented", "prerequisites_clear", "examples_runnable", "error_guidance", "contribution_path"], "per_criterion_scores": {"quick_start_present": 0.8, "api_documented": 0.0, "prerequisites_clear": 0.6, "examples_runnable": 0.2, "error_guidance": 0.2, "contribution_path": 0.4}, "failure_classification": {"category": "output_format", "description": "The score value contains four decimal places, which may violate an expected output format requiring fewer decimal places or a specific structure. Additionally, missing hypothesis and unknown failure mode suggest incomplete or incorrectly structured output.", "fix_direction": "Ensure the output strictly follows the expected format/schema, including required fields and data types, and adhere to formatting guidelines for values such as score precision.", "confidence": 0.8}, "drafts_generated": 1, "drafts_survived": 1}
{"id": "e3c94405-1686-4321-924b-00eedaeea26d", "target_id": "B5-greedy", "git_sha": "4f5715479c393c537d9739d50a7f16d3aabd37ab", "pre_experiment_sha": "4f5715479c393c537d9739d50a7f16d3aabd37ab", "timestamp": "2026-04-06T23:50:15.378519+00:00", "hypothesis": "No hypothesis provided", "hypothesis_source": "synthesized", "mutation_diff_summary": "", "score": 1.2, "score_ci_lower": 0.4, "score_ci_upper": 2.2, "raw_scores": [3.0, 1.0, 1.0, 1.0, 0.0], "baseline_score": 2.4, "outcome": "DISCARDED", "failure_mode": null, "duration_seconds": 110.55610116710886, "tags": [], "learnings": "{\"what_changed\":\"\",\"what_improved\":[],\"what_regressed\":[],\"transferable_insight\":\"No hypothesis provided\",\"domain_tags\":[]}", "cost_usd": 0.44838335000000007, "bootstrap_seed": 0, "agent_model": "claude-sonnet-4-6", "held_out_score": null, "criterion_names": ["quick_start_present", "api_documented", "prerequisites_clear", "examples_runnable", "error_guidance", "contribution_path"], "per_criterion_scores": {"quick_start_present": 0.2, "api_documented": 0.0, "prerequisites_clear": 0.0, "examples_runnable": 0.2, "error_guidance": 0.2, "contribution_path": 0.6}, "failure_classification": {"category": "output_format", "description": "The experiment failed due to violation of the required output structure or schema, as indicated by the lack of hypothesis and unknown failure mode despite a nonzero score.", "fix_direction": "Ensure all required fields are present and formatted according to the schema specification.", "confidence": 0.85}, "drafts_generated": 1, "drafts_survived": 1}
{"id": "afcdf6d9-57e2-4d05-8cec-287554a212cf", "target_id": "B5-greedy", "git_sha": "4f5715479c393c537d9739d50a7f16d3aabd37ab", "pre_experiment_sha": "4f5715479c393c537d9739d50a7f16d3aabd37ab", "timestamp": "2026-04-06T23:52:44.292051+00:00", "hypothesis": "No hypothesis provided", "hypothesis_source": "synthesized", "mutation_diff_summary": "", "score": 1.4, "score_ci_lower": 0.4, "score_ci_upper": 2.4, "raw_scores": [3.0, 2.0, 0.0, 0.0, 2.0], "baseline_score": 2.4, "outcome": "DISCARDED", "failure_mode": null, "duration_seconds": 147.0364230410196, "tags": [], "learnings": "{\"what_changed\":\"\",\"what_improved\":[],\"what_regressed\":[],\"transferable_insight\":\"No hypothesis provided\",\"domain_tags\":[]}", "cost_usd": 0.51543105, "bootstrap_seed": 0, "agent_model": "claude-sonnet-4-6", "held_out_score": null, "criterion_names": ["quick_start_present", "api_documented", "prerequisites_clear", "examples_runnable", "error_guidance", "contribution_path"], "per_criterion_scores": {"quick_start_present": 0.6, "api_documented": 0.0, "prerequisites_clear": 0.2, "examples_runnable": 0.4, "error_guidance": 0.0, "contribution_path": 0.2}, "failure_classification": {"category": "output_format", "description": "The experiment failed because the required hypothesis was not provided, violating the expected output structure or schema.", "fix_direction": "Ensure all required sections (e.g., hypothesis) are present and properly filled in the output.", "confidence": 0.9}, "drafts_generated": 1, "drafts_survived": 1}
{"id": "2282f007-8a8f-4602-b0d5-25d54da454b9", "target_id": "B5-greedy", "git_sha": "4f5715479c393c537d9739d50a7f16d3aabd37ab", "pre_experiment_sha": "4f5715479c393c537d9739d50a7f16d3aabd37ab", "timestamp": "2026-04-06T23:54:45.120124+00:00", "hypothesis": "No hypothesis provided", "hypothesis_source": "synthesized", "mutation_diff_summary": "", "score": 2.6, "score_ci_lower": 2.0, "score_ci_upper": 3.8, "raw_scores": [5.0, 2.0, 2.0, 2.0, 2.0], "baseline_score": 2.4, "outcome": "DISCARDED", "failure_mode": null, "duration_seconds": 118.5664096660912, "tags": [], "learnings": "{\"what_changed\":\"\",\"what_improved\":[],\"what_regressed\":[],\"transferable_insight\":\"No hypothesis provided\",\"domain_tags\":[]}", "cost_usd": 0.47861445, "bootstrap_seed": 0, "agent_model": "claude-sonnet-4-6", "held_out_score": null, "criterion_names": ["quick_start_present", "api_documented", "prerequisites_clear", "examples_runnable", "error_guidance", "contribution_path"], "per_criterion_scores": {"quick_start_present": 0.4, "api_documented": 0.2, "prerequisites_clear": 0.6, "examples_runnable": 0.2, "error_guidance": 0.6, "contribution_path": 0.6}, "failure_classification": {"category": "output_format", "description": "The experiment did not provide a hypothesis, and the failure mode is marked as unknown, suggesting missing required elements in the output structure or schema.", "fix_direction": "Ensure all required fields, such as the hypothesis and failure mode, are present and correctly populated in future experiments.", "confidence": 0.85}, "drafts_generated": 1, "drafts_survived": 1}
{"id": "afb007ce-dc7f-4e7b-8e87-4ec6ac1708c1", "target_id": "B5-greedy", "git_sha": "4f5715479c393c537d9739d50a7f16d3aabd37ab", "pre_experiment_sha": "4f5715479c393c537d9739d50a7f16d3aabd37ab", "timestamp": "2026-04-06T23:57:11.541412+00:00", "hypothesis": "No hypothesis provided", "hypothesis_source": "synthesized", "mutation_diff_summary": "", "score": 1.0, "score_ci_lower": 0.2, "score_ci_upper": 1.8, "raw_scores": [2.0, 0.0, 2.0, 0.0, 1.0], "baseline_score": 2.4, "outcome": "DISCARDED", "failure_mode": null, "duration_seconds": 144.09532604110427, "tags": [], "learnings": "{\"what_changed\":\"\",\"what_improved\":[],\"what_regressed\":[],\"transferable_insight\":\"No hypothesis provided\",\"domain_tags\":[]}", "cost_usd": 0.41058839999999996, "bootstrap_seed": 0, "agent_model": "claude-sonnet-4-6", "held_out_score": null, "criterion_names": ["quick_start_present", "api_documented", "prerequisites_clear", "examples_runnable", "error_guidance", "contribution_path"], "per_criterion_scores": {"quick_start_present": 0.2, "api_documented": 0.0, "prerequisites_clear": 0.2, "examples_runnable": 0.0, "error_guidance": 0.2, "contribution_path": 0.4}, "failure_classification": {"category": "output_format", "description": "The score is exactly 1.0000, which is typically used to indicate an output structure or schema violation when no other failure mode or hypothesis is provided.", "fix_direction": "Ensure outputs strictly adhere to the required structure or schema specifications.", "confidence": 0.95}, "drafts_generated": 1, "drafts_survived": 1}
{"id": "ec3fca0e-0073-43e4-881e-38bb158ba134", "target_id": "B5-greedy", "git_sha": "4f5715479c393c537d9739d50a7f16d3aabd37ab", "pre_experiment_sha": "4f5715479c393c537d9739d50a7f16d3aabd37ab", "timestamp": "2026-04-07T00:00:25.187115+00:00", "hypothesis": "No hypothesis provided", "hypothesis_source": "synthesized", "mutation_diff_summary": "", "score": 1.4, "score_ci_lower": 0.6, "score_ci_upper": 2.4, "raw_scores": [3.0, 1.0, 2.0, 0.0, 1.0], "baseline_score": 2.4, "outcome": "DISCARDED", "failure_mode": null, "duration_seconds": 190.95264579192735, "tags": [], "learnings": "{\"what_changed\":\"\",\"what_improved\":[],\"what_regressed\":[],\"transferable_insight\":\"No hypothesis provided\",\"domain_tags\":[]}", "cost_usd": 0.51738825, "bootstrap_seed": 0, "agent_model": "claude-sonnet-4-6", "held_out_score": null, "criterion_names": ["quick_start_present", "api_documented", "prerequisites_clear", "examples_runnable", "error_guidance", "contribution_path"], "per_criterion_scores": {"quick_start_present": 0.4, "api_documented": 0.0, "prerequisites_clear": 0.2, "examples_runnable": 0.2, "error_guidance": 0.2, "contribution_path": 0.4}, "failure_classification": {"category": "output_format", "description": "The score provided has excessive decimal precision (1.4000), which may violate required output schema or formatting constraints. Additionally, absence of a clear hypothesis or defined failure mode suggests insufficient or improperly structured experiment data.", "fix_direction": "Ensure outputs match the required schema and format, particularly with regard to numeric precision and the inclusion of all mandatory fields.", "confidence": 0.9}, "drafts_generated": 1, "drafts_survived": 1}
{"id": "443d3098-22ec-4042-afe1-1dc6c9cfa135", "target_id": "B5-greedy", "git_sha": "4f5715479c393c537d9739d50a7f16d3aabd37ab", "pre_experiment_sha": "4f5715479c393c537d9739d50a7f16d3aabd37ab", "timestamp": "2026-04-07T00:02:51.155657+00:00", "hypothesis": "No hypothesis provided", "hypothesis_source": "synthesized", "mutation_diff_summary": "", "score": 1.0, "score_ci_lower": 0.4, "score_ci_upper": 1.6, "raw_scores": [1.0, 1.0, 1.0, 2.0, 0.0], "baseline_score": 2.4, "outcome": "DISCARDED", "failure_mode": null, "duration_seconds": 143.89934466709383, "tags": [], "learnings": "{\"what_changed\":\"\",\"what_improved\":[],\"what_regressed\":[],\"transferable_insight\":\"No hypothesis provided\",\"domain_tags\":[]}", "cost_usd": 0.5056925, "bootstrap_seed": 0, "agent_model": "claude-sonnet-4-6", "held_out_score": null, "criterion_names": ["quick_start_present", "api_documented", "prerequisites_clear", "examples_runnable", "error_guidance", "contribution_path"], "per_criterion_scores": {"quick_start_present": 0.2, "api_documented": 0.0, "prerequisites_clear": 0.0, "examples_runnable": 0.0, "error_guidance": 0.4, "contribution_path": 0.4}, "failure_classification": {"category": "output_format", "description": "The experiment failed due to a violation of the required output structure or schema.", "fix_direction": "Ensure that the output strictly adheres to the expected format or schema requirements.", "confidence": 0.95}, "drafts_generated": 1, "drafts_survived": 1}
{"id": "f989b97c-e90c-4f7f-9d03-b90e989fa798", "target_id": "B5-greedy", "git_sha": "4f5715479c393c537d9739d50a7f16d3aabd37ab", "pre_experiment_sha": "4f5715479c393c537d9739d50a7f16d3aabd37ab", "timestamp": "2026-04-07T00:05:11.381833+00:00", "hypothesis": "No hypothesis provided", "hypothesis_source": "synthesized", "mutation_diff_summary": "", "score": 2.0, "score_ci_lower": 1.3, "score_ci_upper": 3.0, "raw_scores": [4.0, 1.5, 2.0, 1.0, 1.5], "baseline_score": 2.4, "outcome": "DISCARDED", "failure_mode": null, "duration_seconds": 137.94464412517846, "tags": [], "learnings": "{\"what_changed\":\"\",\"what_improved\":[],\"what_regressed\":[],\"transferable_insight\":\"No hypothesis provided\",\"domain_tags\":[]}", "cost_usd": 0.47834615, "bootstrap_seed": 0, "agent_model": "claude-sonnet-4-6", "held_out_score": null, "criterion_names": ["quick_start_present", "api_documented", "prerequisites_clear", "examples_runnable", "error_guidance", "contribution_path"], "per_criterion_scores": {"quick_start_present": 0.4, "api_documented": 0.0, "prerequisites_clear": 0.1, "examples_runnable": 0.5, "error_guidance": 0.4, "contribution_path": 0.6}, "failure_classification": {"category": "output_format", "description": "The experiment failed because no hypothesis was provided, which violates the required output structure or schema.", "fix_direction": "Ensure a valid hypothesis is included to satisfy the expected schema.", "confidence": 0.95}, "drafts_generated": 1, "drafts_survived": 1}
