{"id": "e4704fe4-ae5c-4839-b4c8-300f0efd4534", "target_id": "B5-greedy", "git_sha": "82385a7aff237fc27bf29824118067c2ebc5224a", "pre_experiment_sha": "b9295e2c2cd90d8dba5ddf5be5a80c713266ee04", "timestamp": "2026-04-06T22:54:57.544151+00:00", "hypothesis": "No hypothesis provided", "hypothesis_source": "synthesized", "mutation_diff_summary": "", "score": 1.4, "score_ci_lower": 0.6, "score_ci_upper": 2.2, "raw_scores": [0.0, 1.0, 3.0, 1.0, 2.0], "baseline_score": 0.0, "outcome": "KEPT", "failure_mode": null, "duration_seconds": 103.25086683407426, "tags": [], "learnings": "{\"what_changed\":\"\",\"what_improved\":[],\"what_regressed\":[],\"transferable_insight\":\"No hypothesis provided\",\"domain_tags\":[]}", "cost_usd": 0.38755680000000003, "bootstrap_seed": 0, "agent_model": "claude-sonnet-4-6", "held_out_score": null, "criterion_names": ["quick_start_present", "api_documented", "prerequisites_clear", "examples_runnable", "error_guidance", "contribution_path"], "per_criterion_scores": {"quick_start_present": 0.6, "api_documented": 0.2, "prerequisites_clear": 0.2, "examples_runnable": 0.0, "error_guidance": 0.0, "contribution_path": 0.4}, "failure_classification": null, "drafts_generated": 1, "drafts_survived": 1}
{"id": "d748a2b7-b511-4b62-a80a-499e02aebfa2", "target_id": "B5-greedy", "git_sha": "82385a7aff237fc27bf29824118067c2ebc5224a", "pre_experiment_sha": "82385a7aff237fc27bf29824118067c2ebc5224a", "timestamp": "2026-04-06T22:58:04.959713+00:00", "hypothesis": "No hypothesis provided", "hypothesis_source": "synthesized", "mutation_diff_summary": "", "score": 1.7, "score_ci_lower": 1.3, "score_ci_upper": 2.0, "raw_scores": [2.0, 1.0, 1.5, 2.0, 2.0], "baseline_score": 1.4, "outcome": "DISCARDED", "failure_mode": null, "duration_seconds": 186.90669833286665, "tags": [], "learnings": "{\"what_changed\":\"\",\"what_improved\":[],\"what_regressed\":[],\"transferable_insight\":\"No hypothesis provided\",\"domain_tags\":[]}", "cost_usd": 0.6064088999999999, "bootstrap_seed": 0, "agent_model": "claude-sonnet-4-6", "held_out_score": null, "criterion_names": ["quick_start_present", "api_documented", "prerequisites_clear", "examples_runnable", "error_guidance", "contribution_path"], "per_criterion_scores": {"quick_start_present": 0.7, "api_documented": 0.0, "prerequisites_clear": 0.0, "examples_runnable": 0.2, "error_guidance": 0.2, "contribution_path": 0.6}, "failure_classification": {"category": "output_format", "description": "The experiment lacks a provided hypothesis, which constitutes a schema or structure violation in the expected output format.", "fix_direction": "Ensure required fields such as 'hypothesis' are provided in future experiments to match the expected output structure.", "confidence": 0.92}, "drafts_generated": 1, "drafts_survived": 1}
{"id": "2897ca6e-2122-4a64-876c-5db59482adbf", "target_id": "B5-greedy", "git_sha": "82385a7aff237fc27bf29824118067c2ebc5224a", "pre_experiment_sha": "82385a7aff237fc27bf29824118067c2ebc5224a", "timestamp": "2026-04-06T23:01:59.155022+00:00", "hypothesis": "No hypothesis provided", "hypothesis_source": "synthesized", "mutation_diff_summary": "", "score": 1.6, "score_ci_lower": 0.6, "score_ci_upper": 2.4, "raw_scores": [2.0, 1.0, 3.0, 2.0, 0.0], "baseline_score": 1.4, "outcome": "DISCARDED", "failure_mode": null, "duration_seconds": 231.6217201249674, "tags": [], "learnings": "{\"what_changed\":\"\",\"what_improved\":[],\"what_regressed\":[],\"transferable_insight\":\"No hypothesis provided\",\"domain_tags\":[]}", "cost_usd": 0.67688245, "bootstrap_seed": 0, "agent_model": "claude-sonnet-4-6", "held_out_score": null, "criterion_names": ["quick_start_present", "api_documented", "prerequisites_clear", "examples_runnable", "error_guidance", "contribution_path"], "per_criterion_scores": {"quick_start_present": 0.4, "api_documented": 0.0, "prerequisites_clear": 0.0, "examples_runnable": 0.2, "error_guidance": 0.4, "contribution_path": 0.6}, "failure_classification": {"category": "output_format", "description": "The experiment appears to have failed due to a violation of the required output structure or schema, as indicated by a low score and lack of a clear hypothesis or documented failure mode.", "fix_direction": "Ensure the output strictly adheres to the expected schema or format specifications.", "confidence": 0.85}, "drafts_generated": 1, "drafts_survived": 1}
{"id": "b24cd9a8-b224-4902-97f2-9b88f2781374", "target_id": "B5-greedy", "git_sha": "82385a7aff237fc27bf29824118067c2ebc5224a", "pre_experiment_sha": "82385a7aff237fc27bf29824118067c2ebc5224a", "timestamp": "2026-04-06T23:04:32.893274+00:00", "hypothesis": "No hypothesis provided", "hypothesis_source": "synthesized", "mutation_diff_summary": "", "score": 1.6, "score_ci_lower": 0.6, "score_ci_upper": 2.4, "raw_scores": [2.0, 1.0, 3.0, 2.0, 0.0], "baseline_score": 1.4, "outcome": "DISCARDED", "failure_mode": null, "duration_seconds": 151.0239432498347, "tags": [], "learnings": "{\"what_changed\":\"\",\"what_improved\":[],\"what_regressed\":[],\"transferable_insight\":\"No hypothesis provided\",\"domain_tags\":[]}", "cost_usd": 0.4921072, "bootstrap_seed": 0, "agent_model": "claude-sonnet-4-6", "held_out_score": null, "criterion_names": ["quick_start_present", "api_documented", "prerequisites_clear", "examples_runnable", "error_guidance", "contribution_path"], "per_criterion_scores": {"quick_start_present": 0.4, "api_documented": 0.0, "prerequisites_clear": 0.0, "examples_runnable": 0.4, "error_guidance": 0.4, "contribution_path": 0.4}, "failure_classification": {"category": "output_format", "description": "The experiment did not provide a hypothesis as required by the schema, representing an output structure/schema violation.", "fix_direction": "Ensure all required fields (including hypothesis) are provided in the output.", "confidence": 0.92}, "drafts_generated": 1, "drafts_survived": 1}
{"id": "be6e67bf-f727-42c4-bf12-b076bc35ba68", "target_id": "B5-greedy", "git_sha": "82385a7aff237fc27bf29824118067c2ebc5224a", "pre_experiment_sha": "82385a7aff237fc27bf29824118067c2ebc5224a", "timestamp": "2026-04-06T23:07:17.060045+00:00", "hypothesis": "No hypothesis provided", "hypothesis_source": "synthesized", "mutation_diff_summary": "", "score": 1.8, "score_ci_lower": 0.8, "score_ci_upper": 2.8, "raw_scores": [3.0, 0.0, 3.0, 1.0, 2.0], "baseline_score": 1.4, "outcome": "DISCARDED", "failure_mode": null, "duration_seconds": 162.4006992499344, "tags": [], "learnings": "{\"what_changed\":\"\",\"what_improved\":[],\"what_regressed\":[],\"transferable_insight\":\"No hypothesis provided\",\"domain_tags\":[]}", "cost_usd": 0.5164249, "bootstrap_seed": 0, "agent_model": "claude-sonnet-4-6", "held_out_score": null, "criterion_names": ["quick_start_present", "api_documented", "prerequisites_clear", "examples_runnable", "error_guidance", "contribution_path"], "per_criterion_scores": {"quick_start_present": 0.6, "api_documented": 0.0, "prerequisites_clear": 0.2, "examples_runnable": 0.6, "error_guidance": 0.0, "contribution_path": 0.4}, "failure_classification": {"category": "output_format", "description": "The experiment failed due to output structure or schema violation, as there was no hypothesis provided and the failure mode was marked as unknown. This likely indicates missing or improperly structured required fields.", "fix_direction": "Ensure all required fields (such as hypothesis and failure mode) are provided and adhere to the expected output schema.", "confidence": 0.9}, "drafts_generated": 1, "drafts_survived": 1}
{"id": "7ec2c8c0-2501-432f-b55a-fa0e21f16f15", "target_id": "B5-greedy", "git_sha": "82385a7aff237fc27bf29824118067c2ebc5224a", "pre_experiment_sha": "82385a7aff237fc27bf29824118067c2ebc5224a", "timestamp": "2026-04-06T23:10:05.659411+00:00", "hypothesis": "No hypothesis provided", "hypothesis_source": "synthesized", "mutation_diff_summary": "", "score": 0.6, "score_ci_lower": 0.0, "score_ci_upper": 1.4, "raw_scores": [2.0, 1.0, 0.0, 0.0, 0.0], "baseline_score": 1.4, "outcome": "DISCARDED", "failure_mode": null, "duration_seconds": 165.05184129090048, "tags": [], "learnings": "{\"what_changed\":\"\",\"what_improved\":[],\"what_regressed\":[],\"transferable_insight\":\"No hypothesis provided\",\"domain_tags\":[]}", "cost_usd": 0.46043314999999996, "bootstrap_seed": 0, "agent_model": "claude-sonnet-4-6", "held_out_score": null, "criterion_names": ["quick_start_present", "api_documented", "prerequisites_clear", "examples_runnable", "error_guidance", "contribution_path"], "per_criterion_scores": {"quick_start_present": 0.4, "api_documented": 0.0, "prerequisites_clear": 0.0, "examples_runnable": 0.0, "error_guidance": 0.0, "contribution_path": 0.2}, "failure_classification": {"category": "output_format", "description": "The failure mode is 'unknown' and no hypothesis is provided, but the score is given. The main structured format requirements are not met, suggesting an output structure/schema violation.", "fix_direction": "Ensure all required fields (like hypothesis and failure mode) are explicitly provided and check output against the expected schema.", "confidence": 0.8}, "drafts_generated": 1, "drafts_survived": 1}
{"id": "f822171d-b909-4a9c-a40e-68e0d89db646", "target_id": "B5-greedy", "git_sha": "82385a7aff237fc27bf29824118067c2ebc5224a", "pre_experiment_sha": "82385a7aff237fc27bf29824118067c2ebc5224a", "timestamp": "2026-04-06T23:12:48.863072+00:00", "hypothesis": "No hypothesis provided", "hypothesis_source": "synthesized", "mutation_diff_summary": "", "score": 1.8, "score_ci_lower": 1.2, "score_ci_upper": 2.4, "raw_scores": [3.0, 2.0, 1.0, 2.0, 1.0], "baseline_score": 1.4, "outcome": "DISCARDED", "failure_mode": null, "duration_seconds": 161.0332285000477, "tags": [], "learnings": "{\"what_changed\":\"\",\"what_improved\":[],\"what_regressed\":[],\"transferable_insight\":\"No hypothesis provided\",\"domain_tags\":[]}", "cost_usd": 0.49518855000000006, "bootstrap_seed": 0, "agent_model": "claude-sonnet-4-6", "held_out_score": null, "criterion_names": ["quick_start_present", "api_documented", "prerequisites_clear", "examples_runnable", "error_guidance", "contribution_path"], "per_criterion_scores": {"quick_start_present": 0.6, "api_documented": 0.0, "prerequisites_clear": 0.2, "examples_runnable": 0.2, "error_guidance": 0.4, "contribution_path": 0.4}, "failure_classification": {"category": "output_format", "description": "The experiment's output does not conform to the required structure or schema, as evidenced by the absence of a hypothesis and undefined failure mode.", "fix_direction": "Ensure all required fields (such as 'Hypothesis' and 'Failure Mode') are provided and adhere to the expected output schema.", "confidence": 0.9}, "drafts_generated": 1, "drafts_survived": 1}
{"id": "b23c8dd4-fa30-4e2e-9f0e-2061e72a4d06", "target_id": "B5-greedy", "git_sha": "4f5715479c393c537d9739d50a7f16d3aabd37ab", "pre_experiment_sha": "82385a7aff237fc27bf29824118067c2ebc5224a", "timestamp": "2026-04-06T23:15:42.390561+00:00", "hypothesis": "No hypothesis provided", "hypothesis_source": "synthesized", "mutation_diff_summary": "", "score": 2.4, "score_ci_lower": 2.0, "score_ci_upper": 3.2, "raw_scores": [4.0, 2.0, 2.0, 2.0, 2.0], "baseline_score": 1.4, "outcome": "KEPT", "failure_mode": null, "duration_seconds": 171.18524920893833, "tags": [], "learnings": "{\"what_changed\":\"\",\"what_improved\":[],\"what_regressed\":[],\"transferable_insight\":\"No hypothesis provided\",\"domain_tags\":[]}", "cost_usd": 0.5691606, "bootstrap_seed": 0, "agent_model": "claude-sonnet-4-6", "held_out_score": null, "criterion_names": ["quick_start_present", "api_documented", "prerequisites_clear", "examples_runnable", "error_guidance", "contribution_path"], "per_criterion_scores": {"quick_start_present": 0.6, "api_documented": 0.0, "prerequisites_clear": 0.4, "examples_runnable": 0.4, "error_guidance": 0.4, "contribution_path": 0.6}, "failure_classification": null, "drafts_generated": 1, "drafts_survived": 1}
{"id": "27f2db71-a0fe-4f4b-a747-3ed7452d3b5a", "target_id": "B5-greedy", "git_sha": "4f5715479c393c537d9739d50a7f16d3aabd37ab", "pre_experiment_sha": "4f5715479c393c537d9739d50a7f16d3aabd37ab", "timestamp": "2026-04-06T23:19:01.867148+00:00", "hypothesis": "No hypothesis provided", "hypothesis_source": "synthesized", "mutation_diff_summary": "", "score": 2.0, "score_ci_lower": 0.8, "score_ci_upper": 3.2, "raw_scores": [0.0, 3.0, 1.0, 4.0, 2.0], "baseline_score": 2.4, "outcome": "DISCARDED", "failure_mode": null, "duration_seconds": 198.92606849991716, "tags": [], "learnings": "{\"what_changed\":\"\",\"what_improved\":[],\"what_regressed\":[],\"transferable_insight\":\"No hypothesis provided\",\"domain_tags\":[]}", "cost_usd": 0.52950145, "bootstrap_seed": 0, "agent_model": "claude-sonnet-4-6", "held_out_score": null, "criterion_names": ["quick_start_present", "api_documented", "prerequisites_clear", "examples_runnable", "error_guidance", "contribution_path"], "per_criterion_scores": {"quick_start_present": 0.6, "api_documented": 0.2, "prerequisites_clear": 0.4, "examples_runnable": 0.0, "error_guidance": 0.4, "contribution_path": 0.4}, "failure_classification": {"category": "output_format", "description": "The experiment failed due to a violation of the expected output structure or schema, as indicated by the provided score and ambiguous failure mode.", "fix_direction": "Focus on aligning the experiment outputs with the defined structure or schema requirements.", "confidence": 0.8}, "drafts_generated": 1, "drafts_survived": 1}
{"id": "df549b81-3da5-40c5-9fb0-9bbc678855fa", "target_id": "B5-greedy", "git_sha": "4f5715479c393c537d9739d50a7f16d3aabd37ab", "pre_experiment_sha": "4f5715479c393c537d9739d50a7f16d3aabd37ab", "timestamp": "2026-04-06T23:20:35.547788+00:00", "hypothesis": "No hypothesis provided", "hypothesis_source": "synthesized", "mutation_diff_summary": "", "score": 0.8, "score_ci_lower": 0.0, "score_ci_upper": 1.6, "raw_scores": [2.0, 0.0, 2.0, 0.0, 0.0], "baseline_score": 2.4, "outcome": "DISCARDED", "failure_mode": null, "duration_seconds": 91.87510758289136, "tags": [], "learnings": "{\"what_changed\":\"\",\"what_improved\":[],\"what_regressed\":[],\"transferable_insight\":\"No hypothesis provided\",\"domain_tags\":[]}", "cost_usd": 0.35262664999999993, "bootstrap_seed": 0, "agent_model": "claude-sonnet-4-6", "held_out_score": null, "criterion_names": ["quick_start_present", "api_documented", "prerequisites_clear", "examples_runnable", "error_guidance", "contribution_path"], "per_criterion_scores": {"quick_start_present": 0.2, "api_documented": 0.0, "prerequisites_clear": 0.2, "examples_runnable": 0.0, "error_guidance": 0.0, "contribution_path": 0.4}, "failure_classification": {"category": "output_format", "description": "The experiment lacks an explicit hypothesis and failure mode, which violates the expected output schema or structure.", "fix_direction": "Ensure all required fields (hypothesis, failure mode) are provided according to the output specification.", "confidence": 0.9}, "drafts_generated": 1, "drafts_survived": 1}
{"id": "2b32e095-3045-43a7-802b-471c8c03e8fe", "target_id": "B5-greedy", "git_sha": "4f5715479c393c537d9739d50a7f16d3aabd37ab", "pre_experiment_sha": "4f5715479c393c537d9739d50a7f16d3aabd37ab", "timestamp": "2026-04-06T23:22:49.006487+00:00", "hypothesis": "No hypothesis provided", "hypothesis_source": "synthesized", "mutation_diff_summary": "", "score": 1.4, "score_ci_lower": 0.2, "score_ci_upper": 2.6, "raw_scores": [3.0, 3.0, 0.0, 1.0, 0.0], "baseline_score": 2.4, "outcome": "DISCARDED", "failure_mode": null, "duration_seconds": 129.73441608413123, "tags": [], "learnings": "{\"what_changed\":\"\",\"what_improved\":[],\"what_regressed\":[],\"transferable_insight\":\"No hypothesis provided\",\"domain_tags\":[]}", "cost_usd": 0.5434475499999999, "bootstrap_seed": 0, "agent_model": "claude-sonnet-4-6", "held_out_score": null, "criterion_names": ["quick_start_present", "api_documented", "prerequisites_clear", "examples_runnable", "error_guidance", "contribution_path"], "per_criterion_scores": {"quick_start_present": 0.4, "api_documented": 0.0, "prerequisites_clear": 0.0, "examples_runnable": 0.4, "error_guidance": 0.0, "contribution_path": 0.6}, "failure_classification": {"category": "output_format", "description": "The experiment failed to provide a hypothesis, and the failure mode is listed as 'unknown', which suggests non-compliance with the required output structure or schema.", "fix_direction": "Ensure all required fields (like hypothesis and failure mode) are properly filled and conform to the expected schema.", "confidence": 0.85}, "drafts_generated": 1, "drafts_survived": 1}
{"id": "cf77572b-8447-44ce-914f-e300b6cfcbe1", "target_id": "B5-greedy", "git_sha": "4f5715479c393c537d9739d50a7f16d3aabd37ab", "pre_experiment_sha": "4f5715479c393c537d9739d50a7f16d3aabd37ab", "timestamp": "2026-04-06T23:24:44.839410+00:00", "hypothesis": "No hypothesis provided", "hypothesis_source": "synthesized", "mutation_diff_summary": "", "score": 2.0, "score_ci_lower": 2.0, "score_ci_upper": 2.0, "raw_scores": [2.0, 2.0, 2.0, 2.0, 2.0], "baseline_score": 2.4, "outcome": "DISCARDED", "failure_mode": null, "duration_seconds": 114.27506070886739, "tags": [], "learnings": "{\"what_changed\":\"\",\"what_improved\":[],\"what_regressed\":[],\"transferable_insight\":\"No hypothesis provided\",\"domain_tags\":[]}", "cost_usd": 0.4844964500000001, "bootstrap_seed": 0, "agent_model": "claude-sonnet-4-6", "held_out_score": null, "criterion_names": ["quick_start_present", "api_documented", "prerequisites_clear", "examples_runnable", "error_guidance", "contribution_path"], "per_criterion_scores": {"quick_start_present": 0.4, "api_documented": 0.0, "prerequisites_clear": 0.4, "examples_runnable": 0.4, "error_guidance": 0.4, "contribution_path": 0.4}, "failure_classification": {"category": "output_format", "description": "The experiment output did not include a hypothesis, which violates the required output schema.", "fix_direction": "Ensure the hypothesis field is always populated in the experiment output according to the expected schema.", "confidence": 0.95}, "drafts_generated": 1, "drafts_survived": 1}
{"id": "c79a07dd-e8d9-4688-866e-3a85c2092b1a", "target_id": "B5-greedy", "git_sha": "4f5715479c393c537d9739d50a7f16d3aabd37ab", "pre_experiment_sha": "4f5715479c393c537d9739d50a7f16d3aabd37ab", "timestamp": "2026-04-06T23:27:25.431159+00:00", "hypothesis": "No hypothesis provided", "hypothesis_source": "synthesized", "mutation_diff_summary": "", "score": 2.2, "score_ci_lower": 1.6, "score_ci_upper": 2.8, "raw_scores": [2.0, 1.0, 3.0, 3.0, 2.0], "baseline_score": 2.4, "outcome": "DISCARDED", "failure_mode": null, "duration_seconds": 159.01866391603835, "tags": [], "learnings": "{\"what_changed\":\"\",\"what_improved\":[],\"what_regressed\":[],\"transferable_insight\":\"No hypothesis provided\",\"domain_tags\":[]}", "cost_usd": 0.5725181500000001, "bootstrap_seed": 0, "agent_model": "claude-sonnet-4-6", "held_out_score": null, "criterion_names": ["quick_start_present", "api_documented", "prerequisites_clear", "examples_runnable", "error_guidance", "contribution_path"], "per_criterion_scores": {"quick_start_present": 1.0, "api_documented": 0.0, "prerequisites_clear": 0.0, "examples_runnable": 0.4, "error_guidance": 0.4, "contribution_path": 0.4}, "failure_classification": {"category": "output_format", "description": "The experiment failed due to a violation of the required output structure or schema, as indicated by the low score and lack of a hypothesis.", "fix_direction": "Ensure all outputs strictly adhere to the specified format/schema requirements, and provide required fields like hypothesis.", "confidence": 0.85}, "drafts_generated": 1, "drafts_survived": 1}
{"id": "237eb702-decb-47f1-98bc-c6666b2ef526", "target_id": "B5-greedy", "git_sha": "4f5715479c393c537d9739d50a7f16d3aabd37ab", "pre_experiment_sha": "4f5715479c393c537d9739d50a7f16d3aabd37ab", "timestamp": "2026-04-06T23:29:48.542296+00:00", "hypothesis": "No hypothesis provided", "hypothesis_source": "synthesized", "mutation_diff_summary": "", "score": 1.9, "score_ci_lower": 1.0, "score_ci_upper": 3.3, "raw_scores": [4.5, 1.0, 1.0, 1.0, 2.0], "baseline_score": 2.4, "outcome": "DISCARDED", "failure_mode": null, "duration_seconds": 141.0945212498773, "tags": [], "learnings": "{\"what_changed\":\"\",\"what_improved\":[],\"what_regressed\":[],\"transferable_insight\":\"No hypothesis provided\",\"domain_tags\":[]}", "cost_usd": 0.4870116, "bootstrap_seed": 0, "agent_model": "claude-sonnet-4-6", "held_out_score": null, "criterion_names": ["quick_start_present", "api_documented", "prerequisites_clear", "examples_runnable", "error_guidance", "contribution_path"], "per_criterion_scores": {"quick_start_present": 0.6, "api_documented": 0.0, "prerequisites_clear": 0.1, "examples_runnable": 0.4, "error_guidance": 0.4, "contribution_path": 0.4}, "failure_classification": {"category": "output_format", "description": "The experiment was flagged due to a violation of the required output structure or schema, as no hypothesis was provided and the failure mode is listed as unknown.", "fix_direction": "Ensure the output strictly adheres to the required schema, providing all mandatory fields such as the hypothesis and a clearly specified failure mode.", "confidence": 0.9}, "drafts_generated": 1, "drafts_survived": 1}
