{"id": "6d351ba1-75ff-418a-9249-8b8726d96ad4", "target_id": "B5-greedy", "git_sha": "b8c82b77394fc5f506cdc8d1da9f51f0200e5b94", "pre_experiment_sha": "b8c82b77394fc5f506cdc8d1da9f51f0200e5b94", "timestamp": "2026-04-19T19:32:25.619516+00:00", "hypothesis": "Expand the sparse README into a complete operator manual with concrete setup, configuration, CLI, I/O, workflow, examples, and troubleshooting.", "hypothesis_source": "agent", "mutation_diff_summary": "", "score": 1.2, "score_ci_lower": 0.0, "score_ci_upper": 3.0, "raw_scores": [0.0, 0.0, 4.5, 0.0, 1.5], "baseline_score": 1.2, "outcome": "DISCARDED", "failure_mode": null, "duration_seconds": 167.17060820793267, "tags": ["readme", "operator-manual", "cli", "configuration", "examples", "troubleshooting"], "learnings": "{\"what_changed\":\"\",\"what_improved\":[],\"what_regressed\":[],\"transferable_insight\":\"When a source artifact is sparse, adding concrete usage details, examples, and troubleshooting can turn it into a practical reference, but only if those additions are grounded in verified behavior rather than assumptions.\",\"domain_tags\":[\"documentation\",\"quality-assurance\",\"technical-writing\"]}", "cost_usd": 0.25072315, "bootstrap_seed": 0, "agent_model": "gpt-5.4", "held_out_score": null, "criterion_names": ["quick_start_present", "api_documented", "prerequisites_clear", "examples_runnable", "error_guidance", "contribution_path"], "per_criterion_scores": {"quick_start_present": 0.4, "api_documented": 0.2, "prerequisites_clear": 0.2, "examples_runnable": 0.1, "error_guidance": 0.1, "contribution_path": 0.2}, "failure_classification": {"category": "incomplete_edit", "description": "The attempt to expand the sparse README into a full operator manual did not reach a complete, consistent state (likely missing key sections like concrete setup/config/CLI/I-O/workflow/examples/troubleshooting), leaving the documentation incomplete or internally inconsistent rather than fully specified.", "fix_direction": "Fill in all required manual components end-to-end (setup, configuration, CLI reference, inputs/outputs, workflow, examples, troubleshooting) and ensure the document is coherent as a single complete operator manual.", "confidence": 0.62}, "drafts_generated": 1, "drafts_survived": 1}
{"id": "47c47b7a-dc19-492f-b28e-bd20d36ccfce", "target_id": "B5-greedy", "git_sha": "b8c82b77394fc5f506cdc8d1da9f51f0200e5b94", "pre_experiment_sha": "b8c82b77394fc5f506cdc8d1da9f51f0200e5b94", "timestamp": "2026-04-19T19:35:02.513028+00:00", "hypothesis": "Expand the sparse README into a complete operator manual with concrete setup, configuration, usage, I/O, workflow, examples, and troubleshooting.", "hypothesis_source": "agent", "mutation_diff_summary": "", "score": 0.6, "score_ci_lower": 0.2, "score_ci_upper": 1.0, "raw_scores": [0.0, 1.0, 1.0, 1.0, 0.0], "baseline_score": 1.2, "outcome": "DISCARDED", "failure_mode": null, "duration_seconds": 153.6761525410693, "tags": ["readme", "technical-docs", "operator-manual", "cli", "csv", "yaml"], "learnings": "{\"what_changed\":\"\",\"what_improved\":[],\"what_regressed\":[],\"transferable_insight\":\"When a task asks for a full operational guide, adding concrete, end-to-end details can still fail if the result does not align with the intended scope, audience, or evaluation criteria.\",\"domain_tags\":[\"documentation\",\"requirements_alignment\",\"evaluation\"]}", "cost_usd": 0.22846175000000002, "bootstrap_seed": 0, "agent_model": "gpt-5.4", "held_out_score": null, "criterion_names": ["quick_start_present", "api_documented", "prerequisites_clear", "examples_runnable", "error_guidance", "contribution_path"], "per_criterion_scores": {"quick_start_present": 0.0, "api_documented": 0.0, "prerequisites_clear": 0.0, "examples_runnable": 0.0, "error_guidance": 0.2, "contribution_path": 0.4}, "failure_classification": {"category": "incomplete_edit", "description": "The experiment appears to be an incomplete expansion of the sparse README into a full operator manual\u2014missing one or more required components such as setup, configuration, usage/workflow, concrete I/O examples, and/or troubleshooting\u2014leaving the documentation in an inconsistent or partial state relative to the hypothesis.", "fix_direction": "Ensure the edit fully covers all required manual sections end-to-end (setup \u2192 config \u2192 usage \u2192 I/O \u2192 workflow \u2192 examples \u2192 troubleshooting) and that every referenced command, parameter, and I/O contract is explicitly defined and consistent throughout.", "confidence": 0.68}, "drafts_generated": 1, "drafts_survived": 1}
{"id": "51c1dde8-d018-4cc7-8bf3-e82c2cae62b3", "target_id": "B5-greedy", "git_sha": "b8c82b77394fc5f506cdc8d1da9f51f0200e5b94", "pre_experiment_sha": "b8c82b77394fc5f506cdc8d1da9f51f0200e5b94", "timestamp": "2026-04-19T19:37:16.439208+00:00", "hypothesis": "Expanding the sparse README into a complete operator manual with concrete setup, config, CLI, I/O, workflow, and troubleshooting details will improve binary technical-readme quality.", "hypothesis_source": "agent", "mutation_diff_summary": "", "score": 0.0, "score_ci_lower": 0.0, "score_ci_upper": 0.0, "raw_scores": [0.0, 0.0, 0.0, 0.0, 0.0], "baseline_score": 1.2, "outcome": "DISCARDED", "failure_mode": null, "duration_seconds": 130.983463749988, "tags": ["readme", "operator-manual", "cli", "yaml", "csv", "installation", "configuration", "troubleshooting"], "learnings": "{\"what_changed\":\"\",\"what_improved\":[],\"what_regressed\":[],\"transferable_insight\":\"Adding more detail only improves documentation when the added content is accurate, actionable, and aligned with user needs; otherwise, expansion can fail to change quality or usefulness.\",\"domain_tags\":[\"documentation\",\"quality-assurance\",\"content-design\"]}", "cost_usd": 0.21254355000000003, "bootstrap_seed": 0, "agent_model": "gpt-5.4", "held_out_score": null, "criterion_names": ["quick_start_present", "api_documented", "prerequisites_clear", "examples_runnable", "error_guidance", "contribution_path"], "per_criterion_scores": {"quick_start_present": 0.0, "api_documented": 0.0, "prerequisites_clear": 0.0, "examples_runnable": 0.0, "error_guidance": 0.0, "contribution_path": 0.0}, "failure_classification": {"category": "incomplete_edit", "description": "The experiment produced no usable/parsable improvement (score 0.0000) and the failure mode is unknown, suggesting the README expansion did not reach a coherent complete operator-manual state or left an inconsistent/unfinished artifact rather than a clearly correct output-format or logic change.", "fix_direction": "Ensure the expanded README is fully end-to-end complete: include concrete sections for setup, configuration, CLI reference, expected I/O/workflow, and troubleshooting; validate the final document for internal consistency and completeness before evaluation.", "confidence": 0.42}, "drafts_generated": 1, "drafts_survived": 1}
{"id": "48593072-1def-4cb6-94df-aa62620273b2", "target_id": "B5-greedy", "git_sha": "b8c82b77394fc5f506cdc8d1da9f51f0200e5b94", "pre_experiment_sha": "b8c82b77394fc5f506cdc8d1da9f51f0200e5b94", "timestamp": "2026-04-19T19:39:58.798792+00:00", "hypothesis": "Expand the sparse README into a complete operator manual with concrete setup, configuration, CLI, I/O, workflow, examples, and troubleshooting details.", "hypothesis_source": "agent", "mutation_diff_summary": "", "score": 0.5, "score_ci_lower": 0.0, "score_ci_upper": 1.3, "raw_scores": [0.0, 0.0, 0.0, 2.0, 0.5], "baseline_score": 1.2, "outcome": "DISCARDED", "failure_mode": null, "duration_seconds": 148.74218208307866, "tags": ["readme", "operator-manual", "cli", "csv", "yaml"], "learnings": "{\"what_changed\":\"\",\"what_improved\":[],\"what_regressed\":[],\"transferable_insight\":\"When a source artifact is too sparse, adding comprehensive procedural detail can still fail if it does not align with the actual needs, constraints, or evaluation criteria of the task.\",\"domain_tags\":[\"documentation\",\"evaluation\",\"requirements\"]}", "cost_usd": 0.22311255000000002, "bootstrap_seed": 0, "agent_model": "gpt-5.4", "held_out_score": null, "criterion_names": ["quick_start_present", "api_documented", "prerequisites_clear", "examples_runnable", "error_guidance", "contribution_path"], "per_criterion_scores": {"quick_start_present": 0.0, "api_documented": 0.1, "prerequisites_clear": 0.0, "examples_runnable": 0.0, "error_guidance": 0.2, "contribution_path": 0.2}, "failure_classification": {"category": "incomplete_edit", "description": "The attempt to expand the sparse README into a full operator manual was only partially completed or left the documentation/instructions in an inconsistent or missing state (e.g., not fully covering setup, configuration, CLI, I/O, workflow, examples, and troubleshooting).", "fix_direction": "Ensure the expanded README is comprehensive and internally consistent: add complete sections for setup, configuration, CLI usage, input/output formats, end-to-end workflow, concrete examples, and a troubleshooting section with failure/edge cases. Validate that all referenced commands, flags, paths, and I/O schemas match the described behavior.", "confidence": 0.62}, "drafts_generated": 1, "drafts_survived": 1}
{"id": "2c8599a8-4f7f-4305-9df6-574ed43798c4", "target_id": "B5-greedy", "git_sha": "b8c82b77394fc5f506cdc8d1da9f51f0200e5b94", "pre_experiment_sha": "b8c82b77394fc5f506cdc8d1da9f51f0200e5b94", "timestamp": "2026-04-19T19:42:30.610183+00:00", "hypothesis": "Expand the sparse README into a complete operator manual with explicit setup, configuration, CLI, I/O, workflow, examples, and troubleshooting.", "hypothesis_source": "agent", "mutation_diff_summary": "", "score": 1.0, "score_ci_lower": 0.0, "score_ci_upper": 2.6, "raw_scores": [0.0, 0.0, 1.0, 4.0, 0.0], "baseline_score": 1.2, "outcome": "DISCARDED", "failure_mode": null, "duration_seconds": 149.26464908302296, "tags": ["readme", "operator-manual", "cli", "configuration", "troubleshooting"], "learnings": "{\"what_changed\":\"\",\"what_improved\":[],\"what_regressed\":[],\"transferable_insight\":\"A broad expansion can fail to add value if it increases surface area without introducing concrete, actionable details that help users successfully apply the system.\",\"domain_tags\":[\"documentation\",\"usability\",\"product-design\"]}", "cost_usd": 0.22613675, "bootstrap_seed": 0, "agent_model": "gpt-5.4", "held_out_score": null, "criterion_names": ["quick_start_present", "api_documented", "prerequisites_clear", "examples_runnable", "error_guidance", "contribution_path"], "per_criterion_scores": {"quick_start_present": 0.0, "api_documented": 0.2, "prerequisites_clear": 0.2, "examples_runnable": 0.0, "error_guidance": 0.2, "contribution_path": 0.4}, "failure_classification": {"category": "incomplete_edit", "description": "The attempt to expand the sparse README into a full operator manual did not successfully complete the required documentation components, leaving an incomplete or inconsistent state relative to the specified structure (setup, configuration, CLI, I/O, workflow, examples, troubleshooting).", "fix_direction": "Systematically fill in all required manual sections with consistent headings, complete command examples, explicit input/output descriptions, and a final troubleshooting section; validate the final document against a checklist to ensure no sections are missing or partially specified.", "confidence": 0.72}, "drafts_generated": 1, "drafts_survived": 1}
{"id": "8ea5aa43-86d1-43fd-a5ea-d3d35a920112", "target_id": "B5-greedy", "git_sha": "b8c82b77394fc5f506cdc8d1da9f51f0200e5b94", "pre_experiment_sha": "b8c82b77394fc5f506cdc8d1da9f51f0200e5b94", "timestamp": "2026-04-19T19:44:57.217059+00:00", "hypothesis": "Expand the sparse README into a complete operator manual with concrete setup, configuration, CLI, workflow, I/O, and troubleshooting details.", "hypothesis_source": "agent", "mutation_diff_summary": "", "score": 0.4, "score_ci_lower": 0.0, "score_ci_upper": 1.0, "raw_scores": [0.0, 0.0, 1.5, 0.5, 0.0], "baseline_score": 1.2, "outcome": "DISCARDED", "failure_mode": null, "duration_seconds": 144.09948974999133, "tags": ["readme", "operator-manual", "cli", "configuration", "installation", "troubleshooting"], "learnings": "{\"what_changed\":\"\",\"what_improved\":[],\"what_regressed\":[],\"transferable_insight\":\"When a source artifact is intentionally sparse, attempting to expand it into a fully detailed manual can add unsupported specifics without improving usefulness, so preserve the original level of certainty and avoid inventing details.\",\"domain_tags\":[\"documentation\",\"information-quality\",\"specification\"]}", "cost_usd": 0.21476995000000002, "bootstrap_seed": 0, "agent_model": "gpt-5.4", "held_out_score": null, "criterion_names": ["quick_start_present", "api_documented", "prerequisites_clear", "examples_runnable", "error_guidance", "contribution_path"], "per_criterion_scores": {"quick_start_present": 0.0, "api_documented": 0.0, "prerequisites_clear": 0.0, "examples_runnable": 0.0, "error_guidance": 0.1, "contribution_path": 0.3}, "failure_classification": {"category": "incomplete_edit", "description": "The attempt to expand the sparse README appears to be partial, leaving the operator manual inconsistent or missing required concrete details (e.g., setup/configuration/CLI/workflow/I/O/troubleshooting).", "fix_direction": "Ensure a complete, end-to-end operator manual update: add full installation/setup steps, complete configuration options, exact CLI commands and examples, documented workflow and I/O formats, and a troubleshooting section that matches expected behaviors.", "confidence": 0.62}, "drafts_generated": 1, "drafts_survived": 1}
{"id": "8de9a11e-6040-4e6c-b5b3-1c99a19cc348", "target_id": "B5-greedy", "git_sha": "b8c82b77394fc5f506cdc8d1da9f51f0200e5b94", "pre_experiment_sha": "b8c82b77394fc5f506cdc8d1da9f51f0200e5b94", "timestamp": "2026-04-19T19:47:59.458168+00:00", "hypothesis": "Expand the sparse README into a complete operator manual with concrete setup, configuration, CLI, I/O, workflow, examples, and troubleshooting details.", "hypothesis_source": "agent", "mutation_diff_summary": "", "score": 0.9, "score_ci_lower": 0.3, "score_ci_upper": 1.6, "raw_scores": [0.0, 0.5, 0.5, 1.5, 2.0], "baseline_score": 1.2, "outcome": "DISCARDED", "failure_mode": null, "duration_seconds": 170.54981670796406, "tags": ["readme", "operator-manual", "cli", "configuration", "troubleshooting"], "learnings": "{\"what_changed\":\"\",\"what_improved\":[],\"what_regressed\":[],\"transferable_insight\":\"When expanding minimal documentation, adding concrete usage details can help only if they are accurate and aligned with the existing scope; otherwise, the added specificity may reduce overall quality.\",\"domain_tags\":[\"documentation\",\"quality-control\",\"technical-writing\"]}", "cost_usd": 0.24090635000000002, "bootstrap_seed": 0, "agent_model": "gpt-5.4", "held_out_score": null, "criterion_names": ["quick_start_present", "api_documented", "prerequisites_clear", "examples_runnable", "error_guidance", "contribution_path"], "per_criterion_scores": {"quick_start_present": 0.2, "api_documented": 0.0, "prerequisites_clear": 0.2, "examples_runnable": 0.0, "error_guidance": 0.2, "contribution_path": 0.3}, "failure_classification": {"category": "incomplete_edit", "description": "The experiment appears to have failed to fully expand the sparse README into a complete, consistent operator manual; instead of delivering the required concrete setup, configuration, CLI, I/O, workflow, examples, and troubleshooting sections coherently, it likely left the documentation partially implemented or internally inconsistent.", "fix_direction": "Ensure the edit comprehensively covers every required manual component end-to-end (setup\u2192config\u2192CLI\u2192I/O\u2192workflow\u2192examples\u2192troubleshooting), maintaining internal consistency and completeness with no missing or mismatched sections.", "confidence": 0.74}, "drafts_generated": 1, "drafts_survived": 1}
{"id": "c978f68c-3f3a-49a0-aee7-b19d65ec5ef4", "target_id": "B5-greedy", "git_sha": "b8c82b77394fc5f506cdc8d1da9f51f0200e5b94", "pre_experiment_sha": "b8c82b77394fc5f506cdc8d1da9f51f0200e5b94", "timestamp": "2026-04-19T19:50:34.075429+00:00", "hypothesis": "Expand the sparse README into a complete operator manual with concrete setup, config, CLI, I/O, workflow, examples, and troubleshooting details.", "hypothesis_source": "agent", "mutation_diff_summary": "", "score": 0.4, "score_ci_lower": 0.1, "score_ci_upper": 0.7, "raw_scores": [0.5, 0.0, 1.0, 0.0, 0.5], "baseline_score": 1.2, "outcome": "DISCARDED", "failure_mode": null, "duration_seconds": 151.91573358303867, "tags": ["readme", "operator-manual", "cli", "configuration", "troubleshooting"], "learnings": "{\"what_changed\":\"\",\"what_improved\":[],\"what_regressed\":[],\"transferable_insight\":\"When expanding sparse documentation, adding concrete operational details can fail if it is not grounded in the actual system behavior and user needs, so prioritize verified essentials over exhaustive but speculative completeness.\",\"domain_tags\":[\"documentation\",\"product-design\",\"technical-writing\"]}", "cost_usd": 0.22946415, "bootstrap_seed": 0, "agent_model": "gpt-5.4", "held_out_score": null, "criterion_names": ["quick_start_present", "api_documented", "prerequisites_clear", "examples_runnable", "error_guidance", "contribution_path"], "per_criterion_scores": {"quick_start_present": 0.1, "api_documented": 0.1, "prerequisites_clear": 0.0, "examples_runnable": 0.0, "error_guidance": 0.0, "contribution_path": 0.2}, "failure_classification": {"category": "incomplete_edit", "description": "The attempt appears to have produced only a partial expansion of the README/operator manual rather than a complete, consistent manual with concrete setup, config, CLI, I/O, workflow, examples, and troubleshooting details, leaving the work in an inconsistent/unfinished state.", "fix_direction": "Ensure the edit fully covers all required manual sections end-to-end (setup \u2192 config \u2192 CLI \u2192 I/O \u2192 workflow \u2192 examples \u2192 troubleshooting), and validate internal consistency and completeness before finalizing.", "confidence": 0.62}, "drafts_generated": 1, "drafts_survived": 1}
{"id": "b8fcde28-e605-4d9a-978a-0de88514864f", "target_id": "B5-greedy", "git_sha": "b8c82b77394fc5f506cdc8d1da9f51f0200e5b94", "pre_experiment_sha": "b8c82b77394fc5f506cdc8d1da9f51f0200e5b94", "timestamp": "2026-04-19T19:53:17.103840+00:00", "hypothesis": "Expand the sparse README into a complete operator manual with explicit setup, configuration, CLI, I/O, workflow, examples, and troubleshooting.", "hypothesis_source": "agent", "mutation_diff_summary": "", "score": 0.5, "score_ci_lower": 0.0, "score_ci_upper": 1.1, "raw_scores": [1.0, 0.0, 0.0, 1.5, 0.0], "baseline_score": 1.2, "outcome": "DISCARDED", "failure_mode": null, "duration_seconds": 159.88347441598307, "tags": ["readme", "operator-manual", "cli", "configuration", "csv", "yaml"], "learnings": "{\"what_changed\":\"\",\"what_improved\":[],\"what_regressed\":[],\"transferable_insight\":\"When expanding minimal documentation, adding breadth without grounding it in the actual user workflow can fail to improve usefulness, so completeness should be balanced with relevance and clarity.\",\"domain_tags\":[\"documentation\",\"usability\",\"content-design\"]}", "cost_usd": 0.23554335000000004, "bootstrap_seed": 0, "agent_model": "gpt-5.4", "held_out_score": null, "criterion_names": ["quick_start_present", "api_documented", "prerequisites_clear", "examples_runnable", "error_guidance", "contribution_path"], "per_criterion_scores": {"quick_start_present": 0.0, "api_documented": 0.0, "prerequisites_clear": 0.0, "examples_runnable": 0.1, "error_guidance": 0.1, "contribution_path": 0.3}, "failure_classification": {"category": "incomplete_edit", "description": "The README/manual expansion appears to be only partially done, leaving the documentation in an inconsistent or incomplete state (e.g., missing explicit setup/config/CLI/I/O/workflow/examples/troubleshooting), so the experiment did not fully satisfy the target operator-manual completeness requirements.", "fix_direction": "Ensure the edit covers the full operator-manual checklist end-to-end: add explicit setup, configuration options, full CLI reference, I/O specifications, end-to-end workflow, concrete examples, and a troubleshooting section; verify internal consistency and completeness across all required sections.", "confidence": 0.62}, "drafts_generated": 1, "drafts_survived": 1}
