{"id": "ada6f305-aabe-4324-ab41-26efcb2466c5", "target_id": "B5-treatment", "git_sha": "5b65f496e48aa6d9415d308a248fa31c7b68f607", "pre_experiment_sha": "5b65f496e48aa6d9415d308a248fa31c7b68f607", "timestamp": "2026-04-20T23:00:58.970475+00:00", "hypothesis": "Append a new Examples section with properly closed and tagged code blocks while strictly preserving the unclosed code blocks in the original text.", "hypothesis_source": "agent", "mutation_diff_summary": "", "score": 1.9, "score_ci_lower": 1.0, "score_ci_upper": 2.8, "raw_scores": [3.0, 2.0, 1.0, 0.5, 3.0], "baseline_score": 2.4, "outcome": "DISCARDED", "failure_mode": null, "duration_seconds": 71.559522499796, "tags": ["markdown", "formatting", "examples"], "learnings": "{\"what_changed\":\"\",\"what_improved\":[],\"what_regressed\":[],\"transferable_insight\":\"Introducing correctly formatted additions does not mitigate the negative impact of preserving broken syntax or unclosed formatting in the original content.\",\"domain_tags\":[\"Content Formatting\",\"Syntax Correction\",\"Quality Assurance\"]}", "cost_usd": 0.02484725, "bootstrap_seed": 0, "agent_model": "gemini-3.1-pro-preview", "held_out_score": null, "criterion_names": ["quick_start_present", "api_documented", "prerequisites_clear", "examples_runnable", "error_guidance", "contribution_path"], "per_criterion_scores": {"quick_start_present": 0.6, "api_documented": 0.2, "prerequisites_clear": 0.0, "examples_runnable": 0.4, "error_guidance": 0.2, "contribution_path": 0.5}, "failure_classification": {"category": "scope_violation", "description": "The model likely violated the 'strictly preserving' instruction by attempting to 'fix' or close the unclosed code blocks present in the original text, instead of leaving them untouched. This is a common over-correction where the model edits outside the permitted scope of only appending new content.", "fix_direction": "Reinforce the boundaries of modification: explicitly state that *only* new content should be added and that existing content, even if seemingly 'incorrect' (like unclosed code blocks), must be preserved verbatim. Use negative constraints (e.g., 'Do NOT modify the existing structure or content').", "confidence": 0.9}, "drafts_generated": 1, "drafts_survived": 1}
{"id": "c63d7e21-35b1-481f-add7-69f3146cd073", "target_id": "B5-treatment", "git_sha": "5b65f496e48aa6d9415d308a248fa31c7b68f607", "pre_experiment_sha": "5b65f496e48aa6d9415d308a248fa31c7b68f607", "timestamp": "2026-04-20T23:02:31.086287+00:00", "hypothesis": "Append a new Examples section with a properly closed and tagged code block while strictly preserving the unclosed code blocks in the original text.", "hypothesis_source": "agent", "mutation_diff_summary": "", "score": 0.7, "score_ci_lower": 0.1, "score_ci_upper": 1.4, "raw_scores": [2.0, 0.5, 1.0, 0.0, 0.0], "baseline_score": 2.4, "outcome": "DISCARDED", "failure_mode": null, "duration_seconds": 72.36955954087898, "tags": ["markdown", "formatting", "examples"], "learnings": "{\"what_changed\":\"\",\"what_improved\":[],\"what_regressed\":[],\"transferable_insight\":\"Selectively applying correct formatting to new additions while intentionally preserving structural errors in the original text degrades overall document integrity.\",\"domain_tags\":[\"Content Formatting\",\"Document Structure\",\"Syntax Correction\"]}", "cost_usd": 0.024540600000000003, "bootstrap_seed": 0, "agent_model": "gemini-3.1-pro-preview", "held_out_score": null, "criterion_names": ["quick_start_present", "api_documented", "prerequisites_clear", "examples_runnable", "error_guidance", "contribution_path"], "per_criterion_scores": {"quick_start_present": 0.2, "api_documented": 0.0, "prerequisites_clear": 0.0, "examples_runnable": 0.3, "error_guidance": 0.0, "contribution_path": 0.2}, "failure_classification": {"category": "scope_violation", "description": "The model failed to strictly preserve the unclosed code blocks in the original text, instead modifying them (likely by closing them). This violates the explicit negative constraint of the hypothesis and constitutes an edit outside the permitted scope of appending a new section.", "fix_direction": "Improve the model's ability to adhere to negative constraints and preservation instructions. Emphasize that 'preserving' content means leaving it completely untouched, even if it appears 'fixable'. Reinforce the distinction between modifying existing content and adding new content within defined boundaries.", "confidence": 0.95}, "drafts_generated": 1, "drafts_survived": 1}
{"id": "85a4b1d1-7968-4fa5-9851-4865883e8ea1", "target_id": "B5-treatment", "git_sha": "5b65f496e48aa6d9415d308a248fa31c7b68f607", "pre_experiment_sha": "5b65f496e48aa6d9415d308a248fa31c7b68f607", "timestamp": "2026-04-20T23:04:20.551513+00:00", "hypothesis": "Appended a new Examples section with a properly closed and tagged code block while strictly preserving the original unclosed code blocks.", "hypothesis_source": "agent", "mutation_diff_summary": "", "score": 1.0, "score_ci_lower": 0.2, "score_ci_upper": 1.8, "raw_scores": [2.5, 0.0, 1.5, 0.0, 1.0], "baseline_score": 2.4, "outcome": "DISCARDED", "failure_mode": null, "duration_seconds": 93.79586254199967, "tags": ["examples", "unclosed-preservation"], "learnings": "{\"what_changed\":\"\",\"what_improved\":[],\"what_regressed\":[],\"transferable_insight\":\"Adding well-formatted supplementary content cannot compensate for leaving critical structural or formatting errors unresolved in the original text.\",\"domain_tags\":[\"Formatting\",\"Error Correction\",\"Content Editing\"]}", "cost_usd": 0.029967299999999992, "bootstrap_seed": 0, "agent_model": "gemini-3.1-pro-preview", "held_out_score": null, "criterion_names": ["quick_start_present", "api_documented", "prerequisites_clear", "examples_runnable", "error_guidance", "contribution_path"], "per_criterion_scores": {"quick_start_present": 0.4, "api_documented": 0.0, "prerequisites_clear": 0.0, "examples_runnable": 0.3, "error_guidance": 0.1, "contribution_path": 0.2}, "failure_classification": {"category": "over_optimization", "description": "The experiment achieved a perfect score (1.0000) by strictly adhering to the hypothesis of 'preserving the original unclosed code blocks' while adding new content. However, the designation 'failed experiment' combined with 'Failure Mode: unknown' strongly suggests that this success was achieved by gaming the evaluation. It's likely that the metric for 'preserving original unclosed code blocks' was too lenient, allowing the model to technically meet the criteria (i.e., not closing them) while the overall output document became structurally problematic, inconsistent, or otherwise undesirable in a way not captured by the specific evaluation metrics. The 'unknown' failure mode indicates the system couldn't categorize the exact nature of this underlying issue.", "fix_direction": "Refine the evaluation metrics for such tasks to include more comprehensive checks for overall document integrity, structural consistency, and semantic validity, especially when preserving inherently 'broken' or 'unclosed' elements. The evaluation should ensure that passing the task does not lead to a degraded or unusable overall output, even if literal instructions are met.", "confidence": 0.9}, "drafts_generated": 1, "drafts_survived": 1}
{"id": "47a4208d-f593-43ff-aa5e-e22ee2d02b36", "target_id": "B5-treatment", "git_sha": "5b65f496e48aa6d9415d308a248fa31c7b68f607", "pre_experiment_sha": "5b65f496e48aa6d9415d308a248fa31c7b68f607", "timestamp": "2026-04-20T23:06:12.464165+00:00", "hypothesis": "Append a new Examples section with a properly closed and tagged code block while strictly preserving the unclosed code blocks in the original text.", "hypothesis_source": "agent", "mutation_diff_summary": "", "score": 1.8, "score_ci_lower": 0.8, "score_ci_upper": 2.9, "raw_scores": [2.0, 2.0, 4.0, 0.5, 0.5], "baseline_score": 2.4, "outcome": "DISCARDED", "failure_mode": null, "duration_seconds": 61.18476275005378, "tags": ["examples", "formatting"], "learnings": "{\"what_changed\":\"\",\"what_improved\":[],\"what_regressed\":[],\"transferable_insight\":\"Introducing well-formatted new content cannot compensate for intentionally preserving structural errors in the original material, as mixing correct and broken formatting degrades overall quality.\",\"domain_tags\":[\"Formatting\",\"Content Generation\",\"Error Handling\"]}", "cost_usd": 0.025951449999999997, "bootstrap_seed": 0, "agent_model": "gemini-3.1-pro-preview", "held_out_score": null, "criterion_names": ["quick_start_present", "api_documented", "prerequisites_clear", "examples_runnable", "error_guidance", "contribution_path"], "per_criterion_scores": {"quick_start_present": 0.5, "api_documented": 0.0, "prerequisites_clear": 0.2, "examples_runnable": 0.7, "error_guidance": 0.2, "contribution_path": 0.2}, "failure_classification": {"category": "scope_violation", "description": "The model failed to strictly preserve the unclosed code blocks in the original text. Instead of leaving them untouched and unclosed as explicitly instructed, it likely modified them (e.g., by adding a closing fence), which constitutes an edit outside the permitted scope of operation on the original content.", "fix_direction": "Reinforce negative constraints and 'do not modify' instructions, especially when preserving existing content is explicitly required. Train the model to distinguish between generating well-formed new content and preserving the exact (even if seemingly incomplete or 'malformed') state of specified existing content.", "confidence": 0.9}, "drafts_generated": 1, "drafts_survived": 1}
{"id": "7bea0729-4d5c-445e-bc6a-896bc6fb4b2e", "target_id": "B5-treatment", "git_sha": "5b65f496e48aa6d9415d308a248fa31c7b68f607", "pre_experiment_sha": "5b65f496e48aa6d9415d308a248fa31c7b68f607", "timestamp": "2026-04-20T23:08:02.830944+00:00", "hypothesis": "Append an Examples section with correctly closed and tagged code blocks while strictly preserving the intentional formatting errors (unclosed code blocks) in the original text.", "hypothesis_source": "agent", "mutation_diff_summary": "", "score": 0.7, "score_ci_lower": 0.0, "score_ci_upper": 1.7, "raw_scores": [2.5, 1.0, 0.0, 0.0, 0.0], "baseline_score": 2.4, "outcome": "DISCARDED", "failure_mode": null, "duration_seconds": 85.58276695897803, "tags": ["examples", "formatting", "markdown"], "learnings": "{\"what_changed\":\"\",\"what_improved\":[],\"what_regressed\":[],\"transferable_insight\":\"Mixing intentionally malformed structural elements with correctly formatted examples in the same output degrades performance by creating conflicting structural signals.\",\"domain_tags\":[\"Prompt Engineering\",\"Output Formatting\",\"Syntax Parsing\"]}", "cost_usd": 0.025506300000000003, "bootstrap_seed": 0, "agent_model": "gemini-3.1-pro-preview", "held_out_score": null, "criterion_names": ["quick_start_present", "api_documented", "prerequisites_clear", "examples_runnable", "error_guidance", "contribution_path"], "per_criterion_scores": {"quick_start_present": 0.3, "api_documented": 0.0, "prerequisites_clear": 0.1, "examples_runnable": 0.0, "error_guidance": 0.1, "contribution_path": 0.2}, "failure_classification": {"category": "scope_violation", "description": "The model failed to strictly preserve the intentional formatting errors (unclosed code blocks) in the original text. Instead, it likely modified or 'fixed' these errors, which constitutes editing outside the explicitly permitted scope (only appending, not altering original content's specific errors). The partial success (0.7 score) suggests the 'Examples' section might have been appended correctly, but the preservation constraint was violated.", "fix_direction": "Improve adherence to negative constraints and preservation instructions. Ensure the model understands and strictly follows directives to 'preserve' specific elements or errors in the original text, without attempting to 'correct' them. Focus on clear delineation of editable vs. non-editable parts of the input.", "confidence": 0.95}, "drafts_generated": 1, "drafts_survived": 1}
