{"id": "eacda743-0616-48c8-bbee-95ce218c8e3d", "target_id": "B5-treatment", "git_sha": "5046407f6a9a6894299cf7a74c90afadea006dff", "pre_experiment_sha": "5046407f6a9a6894299cf7a74c90afadea006dff", "timestamp": "2026-04-07T22:36:07.020195+00:00", "hypothesis": "No hypothesis provided", "hypothesis_source": "synthesized", "mutation_diff_summary": "", "score": 1.4, "score_ci_lower": 0.6, "score_ci_upper": 2.4, "raw_scores": [2.0, 1.0, 0.0, 1.0, 3.0], "baseline_score": 2.0, "outcome": "DISCARDED", "failure_mode": null, "duration_seconds": 273.4175738339982, "tags": [], "learnings": "{\"what_changed\":\"\",\"what_improved\":[],\"what_regressed\":[],\"transferable_insight\":\"No hypothesis provided\",\"domain_tags\":[]}", "cost_usd": 0.8434359, "bootstrap_seed": 0, "agent_model": "claude-sonnet-4-6", "held_out_score": null, "criterion_names": ["quick_start_present", "api_documented", "prerequisites_clear", "examples_runnable", "error_guidance", "contribution_path"], "per_criterion_scores": {"quick_start_present": 0.4, "api_documented": 0.0, "prerequisites_clear": 0.4, "examples_runnable": 0.2, "error_guidance": 0.0, "contribution_path": 0.4}, "failure_classification": {"category": "output_format", "description": "The absence of a hypothesis and unspecified failure mode suggest the output did not adhere to the required structure or schema.", "fix_direction": "Ensure all required fields (such as hypothesis and failure mode) are provided and conform to the expected output format.", "confidence": 0.85}, "drafts_generated": 1, "drafts_survived": 1}
{"id": "a1d1996d-0002-4c00-bf78-d2c5d1f9b301", "target_id": "B5-treatment", "git_sha": "d8eff1a655587b9bee6eb66ba22aa86c2d176b29", "pre_experiment_sha": "5046407f6a9a6894299cf7a74c90afadea006dff", "timestamp": "2026-04-07T22:39:21.757724+00:00", "hypothesis": "No hypothesis provided", "hypothesis_source": "synthesized", "mutation_diff_summary": "", "score": 3.0, "score_ci_lower": 2.4, "score_ci_upper": 3.6, "raw_scores": [4.0, 3.0, 3.0, 2.0, 3.0], "baseline_score": 2.0, "outcome": "KEPT", "failure_mode": null, "duration_seconds": 193.07046916599938, "tags": [], "learnings": "{\"what_changed\":\"\",\"what_improved\":[],\"what_regressed\":[],\"transferable_insight\":\"No hypothesis provided\",\"domain_tags\":[]}", "cost_usd": 0.7733810999999999, "bootstrap_seed": 0, "agent_model": "claude-sonnet-4-6", "held_out_score": null, "criterion_names": ["quick_start_present", "api_documented", "prerequisites_clear", "examples_runnable", "error_guidance", "contribution_path"], "per_criterion_scores": {"quick_start_present": 0.8, "api_documented": 0.2, "prerequisites_clear": 0.6, "examples_runnable": 0.4, "error_guidance": 0.4, "contribution_path": 0.6}, "failure_classification": null, "drafts_generated": 1, "drafts_survived": 1}
{"id": "e7e74017-7123-42a1-9aac-107a90cd6397", "target_id": "B5-treatment", "git_sha": "d991e025ed828a54103dc79b061b051704634cb0", "pre_experiment_sha": "d8eff1a655587b9bee6eb66ba22aa86c2d176b29", "timestamp": "2026-04-07T22:42:08.607577+00:00", "hypothesis": "No hypothesis provided", "hypothesis_source": "synthesized", "mutation_diff_summary": "", "score": 2.0, "score_ci_lower": 1.2, "score_ci_upper": 2.8, "raw_scores": [3.0, 1.0, 2.0, 1.0, 3.0], "baseline_score": 3.0, "outcome": "KEPT", "failure_mode": null, "duration_seconds": 166.4914512079995, "tags": [], "learnings": "{\"what_changed\":\"\",\"what_improved\":[],\"what_regressed\":[],\"transferable_insight\":\"No hypothesis provided\",\"domain_tags\":[]}", "cost_usd": 0.5360532, "bootstrap_seed": 0, "agent_model": "claude-sonnet-4-6", "held_out_score": null, "criterion_names": ["quick_start_present", "api_documented", "prerequisites_clear", "examples_runnable", "error_guidance", "contribution_path"], "per_criterion_scores": {"quick_start_present": 0.6, "api_documented": 0.0, "prerequisites_clear": 0.2, "examples_runnable": 0.4, "error_guidance": 0.0, "contribution_path": 0.8}, "failure_classification": null, "drafts_generated": 1, "drafts_survived": 1}
{"id": "b3376d17-2c8d-424f-95fb-3173fa95bede", "target_id": "B5-treatment", "git_sha": "d991e025ed828a54103dc79b061b051704634cb0", "pre_experiment_sha": "d991e025ed828a54103dc79b061b051704634cb0", "timestamp": "2026-04-07T22:46:05.995255+00:00", "hypothesis": "No hypothesis provided", "hypothesis_source": "synthesized", "mutation_diff_summary": "", "score": 1.0, "score_ci_lower": 0.0, "score_ci_upper": 3.0, "raw_scores": [0.0, 5.0, 0.0, 0.0, 0.0], "baseline_score": 2.0, "outcome": "DISCARDED", "failure_mode": null, "duration_seconds": 237.03552391699486, "tags": [], "learnings": "{\"what_changed\":\"\",\"what_improved\":[],\"what_regressed\":[],\"transferable_insight\":\"No hypothesis provided\",\"domain_tags\":[]}", "cost_usd": 0.8282562500000001, "bootstrap_seed": 0, "agent_model": "claude-sonnet-4-6", "held_out_score": null, "criterion_names": ["quick_start_present", "api_documented", "prerequisites_clear", "examples_runnable", "error_guidance", "contribution_path"], "per_criterion_scores": {"quick_start_present": 0.2, "api_documented": 0.0, "prerequisites_clear": 0.2, "examples_runnable": 0.2, "error_guidance": 0.2, "contribution_path": 0.2}, "failure_classification": {"category": "output_format", "description": "The experiment failed due to a violation of the required output structure or schema.", "fix_direction": "Ensure outputs strictly adhere to the specified format or schema for the task.", "confidence": 0.95}, "drafts_generated": 1, "drafts_survived": 1}
{"id": "396910af-f89c-4560-b2b5-e397d1dcb3bf", "target_id": "B5-treatment", "git_sha": "ebca851bdb04056806a5f49203359430f16b8700", "pre_experiment_sha": "d991e025ed828a54103dc79b061b051704634cb0", "timestamp": "2026-04-07T22:49:07.675843+00:00", "hypothesis": "No hypothesis provided", "hypothesis_source": "synthesized", "mutation_diff_summary": "", "score": 1.9, "score_ci_lower": 0.4, "score_ci_upper": 3.4, "raw_scores": [4.5, 0.0, 0.0, 2.0, 3.0], "baseline_score": 2.0, "outcome": "KEPT", "failure_mode": null, "duration_seconds": 179.94282862499676, "tags": [], "learnings": "{\"what_changed\":\"\",\"what_improved\":[],\"what_regressed\":[],\"transferable_insight\":\"No hypothesis provided\",\"domain_tags\":[]}", "cost_usd": 0.689964, "bootstrap_seed": 0, "agent_model": "claude-sonnet-4-6", "held_out_score": null, "criterion_names": ["quick_start_present", "api_documented", "prerequisites_clear", "examples_runnable", "error_guidance", "contribution_path"], "per_criterion_scores": {"quick_start_present": 0.4, "api_documented": 0.2, "prerequisites_clear": 0.4, "examples_runnable": 0.2, "error_guidance": 0.3, "contribution_path": 0.4}, "failure_classification": null, "drafts_generated": 1, "drafts_survived": 1}
{"id": "5a15c3af-379b-47d5-8cc2-2d87b4c6f1d7", "target_id": "B5-treatment", "git_sha": "63826a260af6230ca1a6d30ddb7709553abfb67f", "pre_experiment_sha": "ebca851bdb04056806a5f49203359430f16b8700", "timestamp": "2026-04-07T22:53:04.702181+00:00", "hypothesis": "No hypothesis provided", "hypothesis_source": "synthesized", "mutation_diff_summary": "", "score": 1.2, "score_ci_lower": 0.4, "score_ci_upper": 2.0, "raw_scores": [0.0, 0.0, 2.0, 2.0, 2.0], "baseline_score": 1.9, "outcome": "KEPT", "failure_mode": null, "duration_seconds": 236.5134623329941, "tags": [], "learnings": "{\"what_changed\":\"\",\"what_improved\":[],\"what_regressed\":[],\"transferable_insight\":\"No hypothesis provided\",\"domain_tags\":[]}", "cost_usd": 0.8376408, "bootstrap_seed": 0, "agent_model": "claude-sonnet-4-6", "held_out_score": null, "criterion_names": ["quick_start_present", "api_documented", "prerequisites_clear", "examples_runnable", "error_guidance", "contribution_path"], "per_criterion_scores": {"quick_start_present": 0.4, "api_documented": 0.0, "prerequisites_clear": 0.2, "examples_runnable": 0.0, "error_guidance": 0.2, "contribution_path": 0.4}, "failure_classification": null, "drafts_generated": 1, "drafts_survived": 1}
{"id": "6fc9bcea-64f1-464e-977b-577d00ff44f1", "target_id": "B5-treatment", "git_sha": "785cdbe870a76bf684f18f0de637e42daef27476", "pre_experiment_sha": "63826a260af6230ca1a6d30ddb7709553abfb67f", "timestamp": "2026-04-07T22:55:27.179748+00:00", "hypothesis": "No hypothesis provided", "hypothesis_source": "synthesized", "mutation_diff_summary": "", "score": 1.3, "score_ci_lower": 0.4, "score_ci_upper": 2.2, "raw_scores": [3.0, 1.0, 0.5, 0.0, 2.0], "baseline_score": 1.2, "outcome": "KEPT", "failure_mode": null, "duration_seconds": 142.01581058400188, "tags": [], "learnings": "{\"what_changed\":\"\",\"what_improved\":[],\"what_regressed\":[],\"transferable_insight\":\"No hypothesis provided\",\"domain_tags\":[]}", "cost_usd": 0.5288823, "bootstrap_seed": 0, "agent_model": "claude-sonnet-4-6", "held_out_score": null, "criterion_names": ["quick_start_present", "api_documented", "prerequisites_clear", "examples_runnable", "error_guidance", "contribution_path"], "per_criterion_scores": {"quick_start_present": 0.6, "api_documented": 0.2, "prerequisites_clear": 0.0, "examples_runnable": 0.2, "error_guidance": 0.0, "contribution_path": 0.3}, "failure_classification": null, "drafts_generated": 1, "drafts_survived": 1}
{"id": "ebaf9d9c-7bf1-4adf-836a-1072ee7c4c69", "target_id": "B5-treatment", "git_sha": "66413e56831696bb7457b3316f1531a3b205eac1", "pre_experiment_sha": "785cdbe870a76bf684f18f0de637e42daef27476", "timestamp": "2026-04-07T22:58:32.382681+00:00", "hypothesis": "No hypothesis provided", "hypothesis_source": "synthesized", "mutation_diff_summary": "", "score": 1.4, "score_ci_lower": 0.4, "score_ci_upper": 2.4, "raw_scores": [3.0, 0.0, 2.0, 2.0, 0.0], "baseline_score": 1.3, "outcome": "KEPT", "failure_mode": null, "duration_seconds": 184.76987229099905, "tags": [], "learnings": "{\"what_changed\":\"\",\"what_improved\":[],\"what_regressed\":[],\"transferable_insight\":\"No hypothesis provided\",\"domain_tags\":[]}", "cost_usd": 0.66755805, "bootstrap_seed": 0, "agent_model": "claude-sonnet-4-6", "held_out_score": null, "criterion_names": ["quick_start_present", "api_documented", "prerequisites_clear", "examples_runnable", "error_guidance", "contribution_path"], "per_criterion_scores": {"quick_start_present": 0.2, "api_documented": 0.0, "prerequisites_clear": 0.4, "examples_runnable": 0.2, "error_guidance": 0.2, "contribution_path": 0.4}, "failure_classification": null, "drafts_generated": 1, "drafts_survived": 1}
{"id": "67b9e4a9-a64d-4a2a-bfb8-5db719711fa4", "target_id": "B5-treatment", "git_sha": "7281d2f06e872b3f6fce5690fa3166f16d1fb3fc", "pre_experiment_sha": "66413e56831696bb7457b3316f1531a3b205eac1", "timestamp": "2026-04-07T23:05:37.695584+00:00", "hypothesis": "No hypothesis provided", "hypothesis_source": "synthesized", "mutation_diff_summary": "", "score": 1.2, "score_ci_lower": 0.3, "score_ci_upper": 2.1, "raw_scores": [3.0, 0.0, 0.0, 1.5, 1.5], "baseline_score": 1.4, "outcome": "KEPT", "failure_mode": null, "duration_seconds": 124.00556516700453, "tags": [], "learnings": "{\"what_changed\":\"\",\"what_improved\":[],\"what_regressed\":[],\"transferable_insight\":\"No hypothesis provided\",\"domain_tags\":[]}", "cost_usd": 0.6147981, "bootstrap_seed": 0, "agent_model": "claude-sonnet-4-6", "held_out_score": null, "criterion_names": ["quick_start_present", "api_documented", "prerequisites_clear", "examples_runnable", "error_guidance", "contribution_path"], "per_criterion_scores": {"quick_start_present": 0.4, "api_documented": 0.0, "prerequisites_clear": 0.1, "examples_runnable": 0.2, "error_guidance": 0.1, "contribution_path": 0.4}, "failure_classification": null, "drafts_generated": 1, "drafts_survived": 1}
{"id": "519ff0b8-8be9-4a74-b76a-53c4f7d6b069", "target_id": "B5-treatment", "git_sha": "6dab7ddbf1c22fa095ae1e7222732ed1a2f82177", "pre_experiment_sha": "7281d2f06e872b3f6fce5690fa3166f16d1fb3fc", "timestamp": "2026-04-07T23:07:16.914496+00:00", "hypothesis": "No hypothesis provided", "hypothesis_source": "synthesized", "mutation_diff_summary": "", "score": 1.4, "score_ci_lower": 0.6, "score_ci_upper": 2.2, "raw_scores": [0.0, 2.5, 2.5, 1.0, 1.0], "baseline_score": 1.2, "outcome": "KEPT", "failure_mode": null, "duration_seconds": 98.81673679200321, "tags": [], "learnings": "{\"what_changed\":\"\",\"what_improved\":[],\"what_regressed\":[],\"transferable_insight\":\"No hypothesis provided\",\"domain_tags\":[]}", "cost_usd": 0.44307779999999997, "bootstrap_seed": 0, "agent_model": "claude-sonnet-4-6", "held_out_score": null, "criterion_names": ["quick_start_present", "api_documented", "prerequisites_clear", "examples_runnable", "error_guidance", "contribution_path"], "per_criterion_scores": {"quick_start_present": 0.6, "api_documented": 0.1, "prerequisites_clear": 0.1, "examples_runnable": 0.0, "error_guidance": 0.4, "contribution_path": 0.2}, "failure_classification": null, "drafts_generated": 1, "drafts_survived": 1}
{"id": "c478dad3-f6a6-4338-9898-8c02099d2709", "target_id": "B5-treatment", "git_sha": "0d1d6ab583c9a844fb10c1e5da370f53bdec8c60", "pre_experiment_sha": "6dab7ddbf1c22fa095ae1e7222732ed1a2f82177", "timestamp": "2026-04-07T23:10:29.439323+00:00", "hypothesis": "No hypothesis provided", "hypothesis_source": "synthesized", "mutation_diff_summary": "", "score": 0.8, "score_ci_lower": 0.3, "score_ci_upper": 1.2, "raw_scores": [0.0, 1.0, 1.5, 0.5, 1.0], "baseline_score": 1.4, "outcome": "KEPT", "failure_mode": null, "duration_seconds": 192.12094962500123, "tags": [], "learnings": "{\"what_changed\":\"\",\"what_improved\":[],\"what_regressed\":[],\"transferable_insight\":\"No hypothesis provided\",\"domain_tags\":[]}", "cost_usd": 0.7357441499999999, "bootstrap_seed": 0, "agent_model": "claude-sonnet-4-6", "held_out_score": null, "criterion_names": ["quick_start_present", "api_documented", "prerequisites_clear", "examples_runnable", "error_guidance", "contribution_path"], "per_criterion_scores": {"quick_start_present": 0.2, "api_documented": 0.0, "prerequisites_clear": 0.4, "examples_runnable": 0.0, "error_guidance": 0.1, "contribution_path": 0.1}, "failure_classification": null, "drafts_generated": 1, "drafts_survived": 1}
{"id": "a605ee74-7807-41e9-931b-a66d4efa6f3e", "target_id": "B5-treatment", "git_sha": "2a5b077d0b005f7706bd1d9369f65d8d22df851d", "pre_experiment_sha": "0d1d6ab583c9a844fb10c1e5da370f53bdec8c60", "timestamp": "2026-04-07T23:14:16.599664+00:00", "hypothesis": "No hypothesis provided", "hypothesis_source": "synthesized", "mutation_diff_summary": "", "score": 1.0, "score_ci_lower": 0.2, "score_ci_upper": 1.8, "raw_scores": [0.0, 2.0, 0.0, 2.0, 1.0], "baseline_score": 0.8, "outcome": "KEPT", "failure_mode": null, "duration_seconds": 226.75412629100174, "tags": [], "learnings": "{\"what_changed\":\"\",\"what_improved\":[],\"what_regressed\":[],\"transferable_insight\":\"No hypothesis provided\",\"domain_tags\":[]}", "cost_usd": 0.74662365, "bootstrap_seed": 0, "agent_model": "claude-sonnet-4-6", "held_out_score": null, "criterion_names": ["quick_start_present", "api_documented", "prerequisites_clear", "examples_runnable", "error_guidance", "contribution_path"], "per_criterion_scores": {"quick_start_present": 0.4, "api_documented": 0.0, "prerequisites_clear": 0.0, "examples_runnable": 0.0, "error_guidance": 0.4, "contribution_path": 0.2}, "failure_classification": null, "drafts_generated": 1, "drafts_survived": 1}
{"id": "674c41f1-cf30-4276-a0ac-179a5ea79ad8", "target_id": "B5-treatment", "git_sha": "35018910e678c841d675e3ca7e2904723a649d15", "pre_experiment_sha": "2a5b077d0b005f7706bd1d9369f65d8d22df851d", "timestamp": "2026-04-07T23:18:14.938378+00:00", "hypothesis": "No hypothesis provided", "hypothesis_source": "synthesized", "mutation_diff_summary": "", "score": 0.8, "score_ci_lower": 0.2, "score_ci_upper": 1.4, "raw_scores": [1.0, 0.0, 0.0, 2.0, 1.0], "baseline_score": 1.0, "outcome": "KEPT", "failure_mode": null, "duration_seconds": 207.59027679200517, "tags": [], "learnings": "{\"what_changed\":\"\",\"what_improved\":[],\"what_regressed\":[],\"transferable_insight\":\"No hypothesis provided\",\"domain_tags\":[]}", "cost_usd": 0.68760405, "bootstrap_seed": 0, "agent_model": "claude-sonnet-4-6", "held_out_score": null, "criterion_names": ["quick_start_present", "api_documented", "prerequisites_clear", "examples_runnable", "error_guidance", "contribution_path"], "per_criterion_scores": {"quick_start_present": 0.4, "api_documented": 0.0, "prerequisites_clear": 0.0, "examples_runnable": 0.0, "error_guidance": 0.2, "contribution_path": 0.2}, "failure_classification": null, "drafts_generated": 1, "drafts_survived": 1}
{"id": "9ee53dfd-25d6-41e9-80a6-c5afbf35c1ed", "target_id": "B5-treatment", "git_sha": "1a6b64a9e7823d3ff8caaa10ef20c70f03e8e03c", "pre_experiment_sha": "35018910e678c841d675e3ca7e2904723a649d15", "timestamp": "2026-04-07T23:21:10.317390+00:00", "hypothesis": "No hypothesis provided", "hypothesis_source": "synthesized", "mutation_diff_summary": "", "score": 2.1, "score_ci_lower": 0.8, "score_ci_upper": 3.4, "raw_scores": [2.0, 0.0, 3.5, 4.0, 1.0], "baseline_score": 0.8, "outcome": "KEPT", "failure_mode": null, "duration_seconds": 175.0180671670023, "tags": [], "learnings": "{\"what_changed\":\"\",\"what_improved\":[],\"what_regressed\":[],\"transferable_insight\":\"No hypothesis provided\",\"domain_tags\":[]}", "cost_usd": 0.5776348499999999, "bootstrap_seed": 0, "agent_model": "claude-sonnet-4-6", "held_out_score": null, "criterion_names": ["quick_start_present", "api_documented", "prerequisites_clear", "examples_runnable", "error_guidance", "contribution_path"], "per_criterion_scores": {"quick_start_present": 0.8, "api_documented": 0.0, "prerequisites_clear": 0.1, "examples_runnable": 0.6, "error_guidance": 0.2, "contribution_path": 0.4}, "failure_classification": null, "drafts_generated": 1, "drafts_survived": 1}
{"id": "ae33c939-3c24-4cd7-be40-b483a96e9e5a", "target_id": "B5-treatment", "git_sha": "1a6b64a9e7823d3ff8caaa10ef20c70f03e8e03c", "pre_experiment_sha": "1a6b64a9e7823d3ff8caaa10ef20c70f03e8e03c", "timestamp": "2026-04-07T23:30:51.808014+00:00", "hypothesis": "No hypothesis provided", "hypothesis_source": "synthesized", "mutation_diff_summary": "", "score": 0.8, "score_ci_lower": 0.2, "score_ci_upper": 1.4, "raw_scores": [0.0, 1.0, 1.0, 2.0, 0.0], "baseline_score": 2.1, "outcome": "DISCARDED", "failure_mode": null, "duration_seconds": 280.35493054100516, "tags": [], "learnings": "{\"what_changed\":\"\",\"what_improved\":[],\"what_regressed\":[],\"transferable_insight\":\"No hypothesis provided\",\"domain_tags\":[]}", "cost_usd": 0.9729655000000001, "bootstrap_seed": 0, "agent_model": "claude-sonnet-4-6", "held_out_score": null, "criterion_names": ["quick_start_present", "api_documented", "prerequisites_clear", "examples_runnable", "error_guidance", "contribution_path"], "per_criterion_scores": {"quick_start_present": 0.0, "api_documented": 0.0, "prerequisites_clear": 0.0, "examples_runnable": 0.0, "error_guidance": 0.4, "contribution_path": 0.4}, "failure_classification": {"category": "output_format", "description": "The experiment does not include a required hypothesis section, violating the prescribed output structure or schema.", "fix_direction": "Ensure all required sections (such as hypothesis) are present in the output to conform to the expected format.", "confidence": 0.95}, "drafts_generated": 1, "drafts_survived": 1}
{"id": "a930c84a-7a32-4eeb-a086-3488334a7ec3", "target_id": "B5-treatment", "git_sha": "1a6b64a9e7823d3ff8caaa10ef20c70f03e8e03c", "pre_experiment_sha": "1a6b64a9e7823d3ff8caaa10ef20c70f03e8e03c", "timestamp": "2026-04-07T23:34:44.795895+00:00", "hypothesis": "No hypothesis provided", "hypothesis_source": "synthesized", "mutation_diff_summary": "", "score": 1.4, "score_ci_lower": 0.2, "score_ci_upper": 2.6, "raw_scores": [3.0, 0.0, 1.0, 0.0, 3.0], "baseline_score": 2.1, "outcome": "DISCARDED", "failure_mode": null, "duration_seconds": 231.2367265829962, "tags": [], "learnings": "{\"what_changed\":\"\",\"what_improved\":[],\"what_regressed\":[],\"transferable_insight\":\"No hypothesis provided\",\"domain_tags\":[]}", "cost_usd": 0.9120173500000001, "bootstrap_seed": 0, "agent_model": "claude-sonnet-4-6", "held_out_score": null, "criterion_names": ["quick_start_present", "api_documented", "prerequisites_clear", "examples_runnable", "error_guidance", "contribution_path"], "per_criterion_scores": {"quick_start_present": 0.4, "api_documented": 0.0, "prerequisites_clear": 0.2, "examples_runnable": 0.4, "error_guidance": 0.0, "contribution_path": 0.4}, "failure_classification": {"category": "output_format", "description": "The experiment likely failed due to a violation of the required output structure or schema. This is suggested by the lack of a hypothesis and the unspecified failure mode, which are often mandatory fields in structured outputs.", "fix_direction": "Ensure that all outputs strictly adhere to the required schema and include all necessary structural elements (e.g., hypothesis and failure mode).", "confidence": 0.8}, "drafts_generated": 1, "drafts_survived": 1}
