{"id": "8e14d5e4-59b4-4ad6-a94f-0f20dbb38f59", "target_id": "B5-treatment", "git_sha": "4789a7db92dc8dd1c919dbcffd8b7837671a5e31", "pre_experiment_sha": "b9295e2c2cd90d8dba5ddf5be5a80c713266ee04", "timestamp": "2026-04-07T21:49:13.648601+00:00", "hypothesis": "No hypothesis provided", "hypothesis_source": "synthesized", "mutation_diff_summary": "", "score": 1.7, "score_ci_lower": 0.8, "score_ci_upper": 2.3, "raw_scores": [0.0, 2.5, 2.0, 2.0, 2.0], "baseline_score": 0.0, "outcome": "KEPT", "failure_mode": null, "duration_seconds": 110.2388814579972, "tags": [], "learnings": "{\"what_changed\":\"\",\"what_improved\":[],\"what_regressed\":[],\"transferable_insight\":\"No hypothesis provided\",\"domain_tags\":[]}", "cost_usd": 0.4470228, "bootstrap_seed": 0, "agent_model": "claude-sonnet-4-6", "held_out_score": null, "criterion_names": ["quick_start_present", "api_documented", "prerequisites_clear", "examples_runnable", "error_guidance", "contribution_path"], "per_criterion_scores": {"quick_start_present": 0.2, "api_documented": 0.1, "prerequisites_clear": 0.6, "examples_runnable": 0.0, "error_guidance": 0.4, "contribution_path": 0.4}, "failure_classification": null, "drafts_generated": 1, "drafts_survived": 1}
{"id": "c49f4900-07da-40d7-acb9-3c91f2c0a4bc", "target_id": "B5-treatment", "git_sha": "4789a7db92dc8dd1c919dbcffd8b7837671a5e31", "pre_experiment_sha": "4789a7db92dc8dd1c919dbcffd8b7837671a5e31", "timestamp": "2026-04-07T21:52:10.700026+00:00", "hypothesis": "No hypothesis provided", "hypothesis_source": "synthesized", "mutation_diff_summary": "", "score": 1.7, "score_ci_lower": null, "score_ci_upper": null, "raw_scores": null, "baseline_score": 1.7, "outcome": "CRASHED", "failure_mode": "Scoring API call failed for api_documented: Error code: 400 - {'error': {'message': \"We could not parse the JSON body of your request. (HINT: This likely means you aren't using your HTTP library correctly. The OpenAI API expects a JSON payload, but what was sent was not valid JSON. If you have trouble figuring out how to fix this, please contact us through our help center at help.openai.com.)\", 'type': 'invalid_request_error', 'param': None, 'code': None}}", "duration_seconds": 176.5818974579961, "tags": [], "learnings": "{\"what_changed\":\"\",\"what_improved\":[],\"what_regressed\":[],\"transferable_insight\":\"No hypothesis provided\",\"domain_tags\":[]}", "cost_usd": 0.36973484999999995, "bootstrap_seed": 0, "agent_model": "claude-sonnet-4-6", "held_out_score": null, "criterion_names": null, "per_criterion_scores": null, "failure_classification": null, "drafts_generated": 1, "drafts_survived": 1}
{"id": "07f4665b-ed3a-45fb-bd01-2e67168b891d", "target_id": "B5-treatment", "git_sha": "614c28230a1d74d810bc2f8b63f9ff26acbaa5ff", "pre_experiment_sha": "4789a7db92dc8dd1c919dbcffd8b7837671a5e31", "timestamp": "2026-04-07T21:54:42.544051+00:00", "hypothesis": "No hypothesis provided", "hypothesis_source": "synthesized", "mutation_diff_summary": "", "score": 2.5, "score_ci_lower": 1.4, "score_ci_upper": 3.6, "raw_scores": [2.0, 4.0, 1.5, 1.0, 4.0], "baseline_score": 1.7, "outcome": "KEPT", "failure_mode": null, "duration_seconds": 151.47478670800047, "tags": [], "learnings": "{\"what_changed\":\"\",\"what_improved\":[],\"what_regressed\":[],\"transferable_insight\":\"No hypothesis provided\",\"domain_tags\":[]}", "cost_usd": 0.51764955, "bootstrap_seed": 0, "agent_model": "claude-sonnet-4-6", "held_out_score": null, "criterion_names": ["quick_start_present", "api_documented", "prerequisites_clear", "examples_runnable", "error_guidance", "contribution_path"], "per_criterion_scores": {"quick_start_present": 0.6, "api_documented": 0.0, "prerequisites_clear": 0.6, "examples_runnable": 0.6, "error_guidance": 0.0, "contribution_path": 0.7}, "failure_classification": null, "drafts_generated": 1, "drafts_survived": 1}
{"id": "79b92790-358f-4e99-bdfd-685732e86bbd", "target_id": "B5-treatment", "git_sha": "614c28230a1d74d810bc2f8b63f9ff26acbaa5ff", "pre_experiment_sha": "614c28230a1d74d810bc2f8b63f9ff26acbaa5ff", "timestamp": "2026-04-07T21:58:05.952021+00:00", "hypothesis": "No hypothesis provided", "hypothesis_source": "synthesized", "mutation_diff_summary": "", "score": 0.9, "score_ci_lower": 0.2, "score_ci_upper": 1.7, "raw_scores": [2.5, 0.0, 0.0, 1.0, 1.0], "baseline_score": 2.5, "outcome": "DISCARDED", "failure_mode": null, "duration_seconds": 202.99429612499807, "tags": [], "learnings": "{\"what_changed\":\"\",\"what_improved\":[],\"what_regressed\":[],\"transferable_insight\":\"No hypothesis provided\",\"domain_tags\":[]}", "cost_usd": 0.7784848000000001, "bootstrap_seed": 0, "agent_model": "claude-sonnet-4-6", "held_out_score": null, "criterion_names": ["quick_start_present", "api_documented", "prerequisites_clear", "examples_runnable", "error_guidance", "contribution_path"], "per_criterion_scores": {"quick_start_present": 0.2, "api_documented": 0.0, "prerequisites_clear": 0.1, "examples_runnable": 0.0, "error_guidance": 0.2, "contribution_path": 0.4}, "failure_classification": {"category": "output_format", "description": "The experiment failed due to output structure/schema violation. No hypothesis was provided, and the failure mode is unknown, which may indicate the output did not conform to expected format requirements.", "fix_direction": "Ensure the output strictly adheres to the required schema, including mandatory fields such as hypothesis and failure mode.", "confidence": 0.9}, "drafts_generated": 1, "drafts_survived": 1}
{"id": "692719c3-5ed3-4228-89c6-50f2deec6f78", "target_id": "B5-treatment", "git_sha": "614c28230a1d74d810bc2f8b63f9ff26acbaa5ff", "pre_experiment_sha": "614c28230a1d74d810bc2f8b63f9ff26acbaa5ff", "timestamp": "2026-04-07T22:00:56.301552+00:00", "hypothesis": "No hypothesis provided", "hypothesis_source": "synthesized", "mutation_diff_summary": "", "score": 1.4, "score_ci_lower": 0.6, "score_ci_upper": 2.4, "raw_scores": [1.0, 1.0, 0.0, 2.0, 3.0], "baseline_score": 2.5, "outcome": "DISCARDED", "failure_mode": null, "duration_seconds": 168.72860487500293, "tags": [], "learnings": "{\"what_changed\":\"\",\"what_improved\":[],\"what_regressed\":[],\"transferable_insight\":\"No hypothesis provided\",\"domain_tags\":[]}", "cost_usd": 0.52210135, "bootstrap_seed": 0, "agent_model": "claude-sonnet-4-6", "held_out_score": null, "criterion_names": ["quick_start_present", "api_documented", "prerequisites_clear", "examples_runnable", "error_guidance", "contribution_path"], "per_criterion_scores": {"quick_start_present": 0.6, "api_documented": 0.0, "prerequisites_clear": 0.2, "examples_runnable": 0.2, "error_guidance": 0.2, "contribution_path": 0.2}, "failure_classification": {"category": "output_format", "description": "The experiment failed due to a violation of the required output structure or schema, as indicated by the low score and schema violation category. No hypothesis was provided and the failure mode is unknown, suggesting the output did not match the expected format.", "fix_direction": "Ensure strict adherence to the defined output schema and structure in future attempts.", "confidence": 0.9}, "drafts_generated": 1, "drafts_survived": 1}
{"id": "2ec1018e-0998-4864-bb59-f36891c61426", "target_id": "B5-treatment", "git_sha": "614c28230a1d74d810bc2f8b63f9ff26acbaa5ff", "pre_experiment_sha": "614c28230a1d74d810bc2f8b63f9ff26acbaa5ff", "timestamp": "2026-04-07T22:03:54.354526+00:00", "hypothesis": "No hypothesis provided", "hypothesis_source": "synthesized", "mutation_diff_summary": "", "score": 0.8, "score_ci_lower": 0.2, "score_ci_upper": 1.4, "raw_scores": [1.0, 1.0, 0.0, 2.0, 0.0], "baseline_score": 2.5, "outcome": "DISCARDED", "failure_mode": null, "duration_seconds": 175.25226479199773, "tags": [], "learnings": "{\"what_changed\":\"\",\"what_improved\":[],\"what_regressed\":[],\"transferable_insight\":\"No hypothesis provided\",\"domain_tags\":[]}", "cost_usd": 0.49359195000000006, "bootstrap_seed": 0, "agent_model": "claude-sonnet-4-6", "held_out_score": null, "criterion_names": ["quick_start_present", "api_documented", "prerequisites_clear", "examples_runnable", "error_guidance", "contribution_path"], "per_criterion_scores": {"quick_start_present": 0.4, "api_documented": 0.0, "prerequisites_clear": 0.0, "examples_runnable": 0.0, "error_guidance": 0.2, "contribution_path": 0.2}, "failure_classification": {"category": "output_format", "description": "The experiment failed due to a violation of the required output structure or schema.", "fix_direction": "Ensure the output strictly matches the required schema and structure; validate against specification before submission.", "confidence": 0.9}, "drafts_generated": 1, "drafts_survived": 1}
{"id": "794464b7-332e-4bd6-b1c0-0708032b71d8", "target_id": "B5-treatment", "git_sha": "614c28230a1d74d810bc2f8b63f9ff26acbaa5ff", "pre_experiment_sha": "614c28230a1d74d810bc2f8b63f9ff26acbaa5ff", "timestamp": "2026-04-07T22:06:28.673020+00:00", "hypothesis": "No hypothesis provided", "hypothesis_source": "synthesized", "mutation_diff_summary": "", "score": 2.9, "score_ci_lower": 1.9, "score_ci_upper": 3.8, "raw_scores": [3.0, 4.0, 1.0, 4.0, 2.5], "baseline_score": 2.5, "outcome": "DISCARDED", "failure_mode": null, "duration_seconds": 152.41008116600278, "tags": [], "learnings": "{\"what_changed\":\"\",\"what_improved\":[],\"what_regressed\":[],\"transferable_insight\":\"No hypothesis provided\",\"domain_tags\":[]}", "cost_usd": 0.65702695, "bootstrap_seed": 0, "agent_model": "claude-sonnet-4-6", "held_out_score": null, "criterion_names": ["quick_start_present", "api_documented", "prerequisites_clear", "examples_runnable", "error_guidance", "contribution_path"], "per_criterion_scores": {"quick_start_present": 0.8, "api_documented": 0.0, "prerequisites_clear": 0.5, "examples_runnable": 0.8, "error_guidance": 0.2, "contribution_path": 0.6}, "failure_classification": {"category": "output_format", "description": "The experiment's output structure or schema is violated, as there is no hypothesis provided and the failure mode is unknown, suggesting missing or improperly formatted required fields.", "fix_direction": "Ensure all required fields (such as hypothesis and failure mode) are present and formatted according to the schema.", "confidence": 0.85}, "drafts_generated": 1, "drafts_survived": 1}
{"id": "dc7c9314-552c-4f71-b887-233bfbcc5682", "target_id": "B5-treatment", "git_sha": "614c28230a1d74d810bc2f8b63f9ff26acbaa5ff", "pre_experiment_sha": "614c28230a1d74d810bc2f8b63f9ff26acbaa5ff", "timestamp": "2026-04-07T22:09:26.978349+00:00", "hypothesis": "No hypothesis provided", "hypothesis_source": "synthesized", "mutation_diff_summary": "", "score": 1.9, "score_ci_lower": 0.8, "score_ci_upper": 2.9, "raw_scores": [3.0, 1.0, 3.0, 0.0, 2.5], "baseline_score": 2.5, "outcome": "DISCARDED", "failure_mode": null, "duration_seconds": 176.0309449589986, "tags": [], "learnings": "{\"what_changed\":\"\",\"what_improved\":[],\"what_regressed\":[],\"transferable_insight\":\"No hypothesis provided\",\"domain_tags\":[]}", "cost_usd": 0.5934388, "bootstrap_seed": 0, "agent_model": "claude-sonnet-4-6", "held_out_score": null, "criterion_names": ["quick_start_present", "api_documented", "prerequisites_clear", "examples_runnable", "error_guidance", "contribution_path"], "per_criterion_scores": {"quick_start_present": 0.6, "api_documented": 0.0, "prerequisites_clear": 0.2, "examples_runnable": 0.5, "error_guidance": 0.2, "contribution_path": 0.4}, "failure_classification": {"category": "output_format", "description": "The experiment failed due to a violation of the required output structure or schema, as no hypothesis or failure mode was provided in the required output format.", "fix_direction": "Ensure the experiment output strictly adheres to the required schema with all mandatory fields populated", "confidence": 0.95}, "drafts_generated": 1, "drafts_survived": 1}
{"id": "5b69bf92-aba6-4272-aa28-d039592e80cf", "target_id": "B5-treatment", "git_sha": "614c28230a1d74d810bc2f8b63f9ff26acbaa5ff", "pre_experiment_sha": "614c28230a1d74d810bc2f8b63f9ff26acbaa5ff", "timestamp": "2026-04-07T22:12:07.251702+00:00", "hypothesis": "No hypothesis provided", "hypothesis_source": "synthesized", "mutation_diff_summary": "", "score": 1.0, "score_ci_lower": 0.2, "score_ci_upper": 1.8, "raw_scores": [0.0, 0.0, 1.0, 2.0, 2.0], "baseline_score": 2.5, "outcome": "DISCARDED", "failure_mode": null, "duration_seconds": 158.65496887499467, "tags": [], "learnings": "{\"what_changed\":\"\",\"what_improved\":[],\"what_regressed\":[],\"transferable_insight\":\"No hypothesis provided\",\"domain_tags\":[]}", "cost_usd": 0.646378, "bootstrap_seed": 0, "agent_model": "claude-sonnet-4-6", "held_out_score": null, "criterion_names": ["quick_start_present", "api_documented", "prerequisites_clear", "examples_runnable", "error_guidance", "contribution_path"], "per_criterion_scores": {"quick_start_present": 0.2, "api_documented": 0.0, "prerequisites_clear": 0.2, "examples_runnable": 0.0, "error_guidance": 0.2, "contribution_path": 0.4}, "failure_classification": {"category": "output_format", "description": "The experiment failed due to a violation of the required output structure or schema.", "fix_direction": "Ensure the output strictly adheres to the expected format or schema.", "confidence": 0.95}, "drafts_generated": 1, "drafts_survived": 1}
{"id": "fbae8694-4a75-404f-8503-7ec7ede96f4a", "target_id": "B5-treatment", "git_sha": "614c28230a1d74d810bc2f8b63f9ff26acbaa5ff", "pre_experiment_sha": "614c28230a1d74d810bc2f8b63f9ff26acbaa5ff", "timestamp": "2026-04-07T22:15:46.326692+00:00", "hypothesis": "No hypothesis provided", "hypothesis_source": "synthesized", "mutation_diff_summary": "", "score": 1.7, "score_ci_lower": 0.6, "score_ci_upper": 3.1, "raw_scores": [1.0, 4.5, 1.0, 2.0, 0.0], "baseline_score": 2.5, "outcome": "DISCARDED", "failure_mode": null, "duration_seconds": 217.04652854100277, "tags": [], "learnings": "{\"what_changed\":\"\",\"what_improved\":[],\"what_regressed\":[],\"transferable_insight\":\"No hypothesis provided\",\"domain_tags\":[]}", "cost_usd": 0.7096813999999998, "bootstrap_seed": 0, "agent_model": "claude-sonnet-4-6", "held_out_score": null, "criterion_names": ["quick_start_present", "api_documented", "prerequisites_clear", "examples_runnable", "error_guidance", "contribution_path"], "per_criterion_scores": {"quick_start_present": 0.4, "api_documented": 0.0, "prerequisites_clear": 0.1, "examples_runnable": 0.2, "error_guidance": 0.4, "contribution_path": 0.6}, "failure_classification": {"category": "output_format", "description": "The experiment lacks a hypothesis and failure mode, violating the required output structure or schema.", "fix_direction": "Ensure all required fields, such as hypothesis and failure mode, are provided and adhere strictly to the prescribed schema.", "confidence": 0.95}, "drafts_generated": 1, "drafts_survived": 1}
{"id": "79a70976-c283-470f-846c-6d362b9e5691", "target_id": "B5-treatment", "git_sha": "614c28230a1d74d810bc2f8b63f9ff26acbaa5ff", "pre_experiment_sha": "614c28230a1d74d810bc2f8b63f9ff26acbaa5ff", "timestamp": "2026-04-07T22:18:58.529070+00:00", "hypothesis": "No hypothesis provided", "hypothesis_source": "synthesized", "mutation_diff_summary": "", "score": 0.8, "score_ci_lower": 0.0, "score_ci_upper": 2.0, "raw_scores": [0.0, 1.0, 3.0, 0.0, 0.0], "baseline_score": 2.5, "outcome": "DISCARDED", "failure_mode": null, "duration_seconds": 190.12146770799882, "tags": [], "learnings": "{\"what_changed\":\"\",\"what_improved\":[],\"what_regressed\":[],\"transferable_insight\":\"No hypothesis provided\",\"domain_tags\":[]}", "cost_usd": 0.49909285000000003, "bootstrap_seed": 0, "agent_model": "claude-sonnet-4-6", "held_out_score": null, "criterion_names": ["quick_start_present", "api_documented", "prerequisites_clear", "examples_runnable", "error_guidance", "contribution_path"], "per_criterion_scores": {"quick_start_present": 0.2, "api_documented": 0.0, "prerequisites_clear": 0.2, "examples_runnable": 0.0, "error_guidance": 0.2, "contribution_path": 0.2}, "failure_classification": {"category": "output_format", "description": "The experiment failed due to an output structure or schema violation, as indicated by the 'unknown' failure mode and high score suggesting output issues rather than logical or semantic errors.", "fix_direction": "Ensure the output strictly follows the expected schema and formatting requirements.", "confidence": 0.85}, "drafts_generated": 1, "drafts_survived": 1}
{"id": "ff18997f-5c8c-4546-9945-673ac634f7e3", "target_id": "B5-treatment", "git_sha": "614c28230a1d74d810bc2f8b63f9ff26acbaa5ff", "pre_experiment_sha": "614c28230a1d74d810bc2f8b63f9ff26acbaa5ff", "timestamp": "2026-04-07T22:21:54.627504+00:00", "hypothesis": "No hypothesis provided", "hypothesis_source": "synthesized", "mutation_diff_summary": "", "score": 2.2, "score_ci_lower": 1.4, "score_ci_upper": 3.2, "raw_scores": [1.0, 2.0, 4.0, 2.0, 2.0], "baseline_score": 2.5, "outcome": "DISCARDED", "failure_mode": null, "duration_seconds": 173.82587583299755, "tags": [], "learnings": "{\"what_changed\":\"\",\"what_improved\":[],\"what_regressed\":[],\"transferable_insight\":\"No hypothesis provided\",\"domain_tags\":[]}", "cost_usd": 0.55589235, "bootstrap_seed": 0, "agent_model": "claude-sonnet-4-6", "held_out_score": null, "criterion_names": ["quick_start_present", "api_documented", "prerequisites_clear", "examples_runnable", "error_guidance", "contribution_path"], "per_criterion_scores": {"quick_start_present": 0.8, "api_documented": 0.0, "prerequisites_clear": 0.2, "examples_runnable": 0.4, "error_guidance": 0.4, "contribution_path": 0.4}, "failure_classification": {"category": "output_format", "description": "The experiment failed due to an output structure or schema violation, as indicated by the lack of any provided hypothesis and ambiguity in the failure mode. The score suggests an assessment was made, but without proper structure.", "fix_direction": "Ensure all required fields and hypothesis are correctly provided and adhere strictly to the expected output schema.", "confidence": 0.85}, "drafts_generated": 1, "drafts_survived": 1}
{"id": "2e9318e7-5245-479e-9157-cd28c233a6a1", "target_id": "B5-treatment", "git_sha": "5606554fa949757aa02deb054cc033fa34edce6c", "pre_experiment_sha": "614c28230a1d74d810bc2f8b63f9ff26acbaa5ff", "timestamp": "2026-04-07T22:24:39.074718+00:00", "hypothesis": "No hypothesis provided", "hypothesis_source": "synthesized", "mutation_diff_summary": "", "score": 0.8, "score_ci_lower": 0.0, "score_ci_upper": 2.0, "raw_scores": [0.0, 1.0, 3.0, 0.0, 0.0], "baseline_score": 2.5, "outcome": "KEPT", "failure_mode": null, "duration_seconds": 162.63840170799813, "tags": [], "learnings": "{\"what_changed\":\"\",\"what_improved\":[],\"what_regressed\":[],\"transferable_insight\":\"No hypothesis provided\",\"domain_tags\":[]}", "cost_usd": 0.59527035, "bootstrap_seed": 0, "agent_model": "claude-sonnet-4-6", "held_out_score": null, "criterion_names": ["quick_start_present", "api_documented", "prerequisites_clear", "examples_runnable", "error_guidance", "contribution_path"], "per_criterion_scores": {"quick_start_present": 0.2, "api_documented": 0.0, "prerequisites_clear": 0.4, "examples_runnable": 0.0, "error_guidance": 0.0, "contribution_path": 0.2}, "failure_classification": null, "drafts_generated": 1, "drafts_survived": 1}
{"id": "aeeda798-5156-4b97-9095-810a97c80b11", "target_id": "B5-treatment", "git_sha": "da2464a9c4fe56ed8d738def1c1147b7f0eabc65", "pre_experiment_sha": "5606554fa949757aa02deb054cc033fa34edce6c", "timestamp": "2026-04-07T22:26:50.476484+00:00", "hypothesis": "No hypothesis provided", "hypothesis_source": "synthesized", "mutation_diff_summary": "", "score": 1.8, "score_ci_lower": 1.2, "score_ci_upper": 2.4, "raw_scores": [3.0, 1.0, 2.0, 2.0, 1.0], "baseline_score": 0.8, "outcome": "KEPT", "failure_mode": null, "duration_seconds": 131.0636963750003, "tags": [], "learnings": "{\"what_changed\":\"\",\"what_improved\":[],\"what_regressed\":[],\"transferable_insight\":\"No hypothesis provided\",\"domain_tags\":[]}", "cost_usd": 0.5482357499999999, "bootstrap_seed": 0, "agent_model": "claude-sonnet-4-6", "held_out_score": null, "criterion_names": ["quick_start_present", "api_documented", "prerequisites_clear", "examples_runnable", "error_guidance", "contribution_path"], "per_criterion_scores": {"quick_start_present": 0.4, "api_documented": 0.0, "prerequisites_clear": 0.2, "examples_runnable": 0.2, "error_guidance": 0.4, "contribution_path": 0.6}, "failure_classification": null, "drafts_generated": 1, "drafts_survived": 1}
{"id": "01ad0a89-535e-4cbe-8de3-2f2b595ff4f3", "target_id": "B5-treatment", "git_sha": "5046407f6a9a6894299cf7a74c90afadea006dff", "pre_experiment_sha": "da2464a9c4fe56ed8d738def1c1147b7f0eabc65", "timestamp": "2026-04-07T22:31:33.213006+00:00", "hypothesis": "No hypothesis provided", "hypothesis_source": "synthesized", "mutation_diff_summary": "", "score": 2.0, "score_ci_lower": 1.4, "score_ci_upper": 2.6, "raw_scores": [3.0, 1.0, 2.0, 2.0, 2.0], "baseline_score": 1.8, "outcome": "KEPT", "failure_mode": null, "duration_seconds": 282.33720545800315, "tags": [], "learnings": "{\"what_changed\":\"\",\"what_improved\":[],\"what_regressed\":[],\"transferable_insight\":\"No hypothesis provided\",\"domain_tags\":[]}", "cost_usd": 0.89531295, "bootstrap_seed": 0, "agent_model": "claude-sonnet-4-6", "held_out_score": null, "criterion_names": ["quick_start_present", "api_documented", "prerequisites_clear", "examples_runnable", "error_guidance", "contribution_path"], "per_criterion_scores": {"quick_start_present": 0.4, "api_documented": 0.0, "prerequisites_clear": 0.6, "examples_runnable": 0.0, "error_guidance": 0.4, "contribution_path": 0.6}, "failure_classification": null, "drafts_generated": 1, "drafts_survived": 1}
