{"id": "d646925f-3369-431e-b978-2504908d813c", "target_id": "B5-treatment", "git_sha": "84e30a6c308333e65bbe99d08fb080f10168a42a", "pre_experiment_sha": "84e30a6c308333e65bbe99d08fb080f10168a42a", "timestamp": "2026-04-20T22:29:06.024584+00:00", "hypothesis": "Adding an \"Examples\" section with practical, syntax-highlighted code snippets will provide clear usage patterns without modifying the existing content.", "hypothesis_source": "agent", "mutation_diff_summary": "", "score": 0.6, "score_ci_lower": 0.1, "score_ci_upper": 1.3, "raw_scores": [0.5, 0.0, 0.0, 2.0, 0.5], "baseline_score": 1.2, "outcome": "DISCARDED", "failure_mode": null, "duration_seconds": 64.13902599993162, "tags": ["documentation", "examples", "syntax-highlighting"], "learnings": "{\"what_changed\":\"\",\"what_improved\":[],\"what_regressed\":[],\"transferable_insight\":\"Appending supplementary examples as an isolated section rather than integrating them contextually into the core content can disrupt the user experience and reduce overall engagement.\",\"domain_tags\":[\"Content Strategy\",\"User Experience\",\"Technical Writing\"]}", "cost_usd": 0.023246649999999997, "bootstrap_seed": 0, "agent_model": "gemini-3.1-pro-preview", "held_out_score": null, "criterion_names": ["quick_start_present", "api_documented", "prerequisites_clear", "examples_runnable", "error_guidance", "contribution_path"], "per_criterion_scores": {"quick_start_present": 0.0, "api_documented": 0.0, "prerequisites_clear": 0.0, "examples_runnable": 0.2, "error_guidance": 0.2, "contribution_path": 0.2}, "failure_classification": {"category": "scope_violation", "description": "The experiment likely failed because, despite the hypothesis stating 'without modifying the existing content,' existing content was inadvertently altered or deleted while attempting to add the 'Examples' section.", "fix_direction": "Implement stricter safeguards or review processes to ensure that new content additions are strictly isolated and do not interact with or modify existing content. Focus on precise insertion points and content boundaries.", "confidence": 0.9}, "drafts_generated": 1, "drafts_survived": 1}
{"id": "e97c92cf-7834-406a-a952-b8ae28e3a1e1", "target_id": "B5-treatment", "git_sha": "6d9b863bb044a35a70fe22e789c262eb227a1292", "pre_experiment_sha": "84e30a6c308333e65bbe99d08fb080f10168a42a", "timestamp": "2026-04-20T22:30:22.019308+00:00", "hypothesis": "Add an Examples section with practical usage snippets and explicit syntax highlighting to improve documentation usability.", "hypothesis_source": "agent", "mutation_diff_summary": "", "score": 1.1, "score_ci_lower": 0.4, "score_ci_upper": 1.8, "raw_scores": [1.0, 0.0, 2.0, 0.5, 2.0], "baseline_score": 1.2, "outcome": "KEPT", "failure_mode": null, "duration_seconds": 62.54267762508243, "tags": ["documentation", "examples", "syntax-highlighting"], "learnings": "{\"what_changed\":\"\",\"what_improved\":[],\"what_regressed\":[],\"transferable_insight\":\"Supplementing instructional content with practical, visually distinct examples improves overall usability and user comprehension.\",\"domain_tags\":[\"Documentation\",\"User Experience\",\"Content Strategy\"]}", "cost_usd": 0.0283076, "bootstrap_seed": 0, "agent_model": "gemini-3.1-pro-preview", "held_out_score": null, "criterion_names": ["quick_start_present", "api_documented", "prerequisites_clear", "examples_runnable", "error_guidance", "contribution_path"], "per_criterion_scores": {"quick_start_present": 0.4, "api_documented": 0.0, "prerequisites_clear": 0.0, "examples_runnable": 0.2, "error_guidance": 0.0, "contribution_path": 0.5}, "failure_classification": null, "drafts_generated": 1, "drafts_survived": 1}
{"id": "d3e979d9-986e-4060-9452-9eb567f51d79", "target_id": "B5-treatment", "git_sha": "304bf877e6033cfdf508679e41c0e985d807e278", "pre_experiment_sha": "6d9b863bb044a35a70fe22e789c262eb227a1292", "timestamp": "2026-04-20T22:31:49.209269+00:00", "hypothesis": "Adding an \"Examples\" section with practical usage examples and explicit syntax highlighting will improve the documentation's utility and satisfy the binary criteria score.", "hypothesis_source": "agent", "mutation_diff_summary": "", "score": 2.5, "score_ci_lower": 1.4, "score_ci_upper": 3.6, "raw_scores": [4.0, 4.0, 1.0, 1.5, 2.0], "baseline_score": 1.1, "outcome": "KEPT", "failure_mode": null, "duration_seconds": 66.35608999989927, "tags": ["documentation", "examples", "syntax-highlighting"], "learnings": "{\"what_changed\":\"\",\"what_improved\":[],\"what_regressed\":[],\"transferable_insight\":\"Supplementing instructional content with practical, visually formatted examples significantly enhances user comprehension and overall utility.\",\"domain_tags\":[\"Documentation\",\"Content Strategy\",\"User Experience\"]}", "cost_usd": 0.0318174, "bootstrap_seed": 0, "agent_model": "gemini-3.1-pro-preview", "held_out_score": null, "criterion_names": ["quick_start_present", "api_documented", "prerequisites_clear", "examples_runnable", "error_guidance", "contribution_path"], "per_criterion_scores": {"quick_start_present": 0.6, "api_documented": 0.2, "prerequisites_clear": 0.2, "examples_runnable": 0.6, "error_guidance": 0.3, "contribution_path": 0.6}, "failure_classification": null, "drafts_generated": 1, "drafts_survived": 1}
{"id": "5050de72-7181-4118-923c-bc08a169a81b", "target_id": "B5-treatment", "git_sha": "304bf877e6033cfdf508679e41c0e985d807e278", "pre_experiment_sha": "304bf877e6033cfdf508679e41c0e985d807e278", "timestamp": "2026-04-20T22:32:56.761852+00:00", "hypothesis": "Add an Examples section with practical usage scenarios and syntax-highlighted code blocks to improve documentation quality.", "hypothesis_source": "agent", "mutation_diff_summary": "", "score": 0.7, "score_ci_lower": 0.0, "score_ci_upper": 1.9, "raw_scores": [0.5, 3.0, 0.0, 0.0, 0.0], "baseline_score": 2.5, "outcome": "DISCARDED", "failure_mode": null, "duration_seconds": 62.5893520838581, "tags": ["documentation", "formatting", "markdown"], "learnings": "{\"what_changed\":\"\",\"what_improved\":[],\"what_regressed\":[],\"transferable_insight\":\"Augmenting informational content with detailed practical examples can degrade overall effectiveness, likely by cluttering the interface and distracting users from core reference material.\",\"domain_tags\":[\"Documentation\",\"Content Strategy\",\"User Experience\"]}", "cost_usd": 0.023054549999999997, "bootstrap_seed": 0, "agent_model": "gemini-3.1-pro-preview", "held_out_score": null, "criterion_names": ["quick_start_present", "api_documented", "prerequisites_clear", "examples_runnable", "error_guidance", "contribution_path"], "per_criterion_scores": {"quick_start_present": 0.2, "api_documented": 0.0, "prerequisites_clear": 0.2, "examples_runnable": 0.1, "error_guidance": 0.2, "contribution_path": 0.0}, "failure_classification": {"category": "semantic_drift", "description": "The experiment likely added an 'Examples' section and possibly even implemented syntax highlighting, but the 'practical usage scenarios' themselves were either incorrect, misleading, not truly practical, or otherwise failed to convey the intended meaning or provide useful context. This would explain a score of 0.7, where the structural components might be present, but the semantic quality of the examples did not meet the hypothesis's goal of improving documentation quality.", "fix_direction": "Focus on generating examples that are genuinely practical, accurate, and directly relevant to the specific documentation being enhanced. Implement content validation steps to ensure the examples are not only syntactically correct but also semantically meaningful and truly illustrate correct usage scenarios.", "confidence": 0.9}, "drafts_generated": 1, "drafts_survived": 1}
{"id": "3301abe0-1ab0-400d-85ec-161b09a172cb", "target_id": "B5-treatment", "git_sha": "304bf877e6033cfdf508679e41c0e985d807e278", "pre_experiment_sha": "304bf877e6033cfdf508679e41c0e985d807e278", "timestamp": "2026-04-20T22:34:41.565044+00:00", "hypothesis": "Add an Examples section with practical usage snippets and explicit syntax highlighting to improve documentation completeness.", "hypothesis_source": "agent", "mutation_diff_summary": "", "score": 1.3, "score_ci_lower": 0.1, "score_ci_upper": 2.5, "raw_scores": [0.0, 3.0, 0.0, 0.5, 3.0], "baseline_score": 2.5, "outcome": "DISCARDED", "failure_mode": null, "duration_seconds": 85.55135633307509, "tags": ["documentation", "examples", "markdown"], "learnings": "{\"what_changed\":\"\",\"what_improved\":[],\"what_regressed\":[],\"transferable_insight\":\"Supplementing informational content with detailed practical examples and explicit formatting can negatively impact user experience, suggesting that conciseness may be preferred over exhaustive illustration.\",\"domain_tags\":[\"Documentation\",\"Content Strategy\",\"User Experience\"]}", "cost_usd": 0.022117199999999997, "bootstrap_seed": 0, "agent_model": "gemini-3.1-pro-preview", "held_out_score": null, "criterion_names": ["quick_start_present", "api_documented", "prerequisites_clear", "examples_runnable", "error_guidance", "contribution_path"], "per_criterion_scores": {"quick_start_present": 0.3, "api_documented": 0.2, "prerequisites_clear": 0.1, "examples_runnable": 0.3, "error_guidance": 0.2, "contribution_path": 0.2}, "failure_classification": {"category": "semantic_drift", "description": "The experiment likely added an 'Examples section' as hypothesized, but the content of the 'practical usage snippets' or the 'explicit syntax highlighting' within it was incorrect, misleading, or not truly practical. This means the form was present, but the intended meaning, quality, or utility of the content was wrong, failing to genuinely improve documentation completeness.", "fix_direction": "Future attempts should focus on ensuring the accuracy, relevance, and practicality of the example snippets, as well as the correctness and clarity of the syntax highlighting. Validate the content's educational value and technical accuracy.", "confidence": 0.8}, "drafts_generated": 1, "drafts_survived": 1}
{"id": "7563f110-8f8d-4226-8b24-b0403a97c4e3", "target_id": "B5-treatment", "git_sha": "304bf877e6033cfdf508679e41c0e985d807e278", "pre_experiment_sha": "304bf877e6033cfdf508679e41c0e985d807e278", "timestamp": "2026-04-20T22:36:33.664019+00:00", "hypothesis": "Add an Examples section with practical usage examples and explicit syntax highlighting, preserving all existing content.", "hypothesis_source": "agent", "mutation_diff_summary": "", "score": 2.1, "score_ci_lower": 1.3, "score_ci_upper": 2.7, "raw_scores": [0.5, 2.5, 3.0, 2.5, 2.0], "baseline_score": 2.5, "outcome": "DISCARDED", "failure_mode": null, "duration_seconds": 76.92495204205625, "tags": ["documentation", "examples", "formatting"], "learnings": "{\"what_changed\":\"\",\"what_improved\":[],\"what_regressed\":[],\"transferable_insight\":\"Appending supplementary content without pruning existing material can degrade user experience by causing information overload and increasing cognitive load.\",\"domain_tags\":[\"Content Strategy\",\"User Experience\",\"Information Architecture\"]}", "cost_usd": 0.03413424999999999, "bootstrap_seed": 0, "agent_model": "gemini-3.1-pro-preview", "held_out_score": null, "criterion_names": ["quick_start_present", "api_documented", "prerequisites_clear", "examples_runnable", "error_guidance", "contribution_path"], "per_criterion_scores": {"quick_start_present": 0.7, "api_documented": 0.3, "prerequisites_clear": 0.0, "examples_runnable": 0.4, "error_guidance": 0.2, "contribution_path": 0.5}, "failure_classification": {"category": "output_format", "description": "The experiment failed to correctly add the requested 'Examples section' to the output, or if added, it failed to apply 'explicit syntax highlighting' to the code examples within that section. This represents a violation of the expected output structure or formatting as specified in the hypothesis.", "fix_direction": "Focus on ensuring the model can accurately identify and implement structural changes (like adding new sections) and correctly apply specific formatting requirements, particularly syntax highlighting for code blocks. Verify the complete presence and correct rendering of all new elements.", "confidence": 0.9}, "drafts_generated": 1, "drafts_survived": 1}
{"id": "a95c5689-c571-4188-821d-4c4787531206", "target_id": "B5-treatment", "git_sha": "304bf877e6033cfdf508679e41c0e985d807e278", "pre_experiment_sha": "304bf877e6033cfdf508679e41c0e985d807e278", "timestamp": "2026-04-20T22:38:03.798600+00:00", "hypothesis": "Append an Examples section with properly tagged code blocks while preserving all existing text and closing the previously unclosed bash block.", "hypothesis_source": "agent", "mutation_diff_summary": "", "score": 1.7, "score_ci_lower": 0.6, "score_ci_upper": 2.7, "raw_scores": [3.0, 0.0, 2.5, 0.5, 2.5], "baseline_score": 2.5, "outcome": "DISCARDED", "failure_mode": null, "duration_seconds": 66.63662949996069, "tags": ["documentation", "examples", "markdown"], "learnings": "{\"what_changed\":\"\",\"what_improved\":[],\"what_regressed\":[],\"transferable_insight\":\"Appending supplementary sections to an established set of instructions can degrade performance by altering the expected structure or diluting the primary focus, even if it corrects underlying formatting errors.\",\"domain_tags\":[\"Prompt Engineering\",\"Instruction Design\",\"Formatting\"]}", "cost_usd": 0.0239385, "bootstrap_seed": 0, "agent_model": "gemini-3.1-pro-preview", "held_out_score": null, "criterion_names": ["quick_start_present", "api_documented", "prerequisites_clear", "examples_runnable", "error_guidance", "contribution_path"], "per_criterion_scores": {"quick_start_present": 0.5, "api_documented": 0.1, "prerequisites_clear": 0.2, "examples_runnable": 0.5, "error_guidance": 0.0, "contribution_path": 0.4}, "failure_classification": {"category": "syntax_error", "description": "The experiment failed to correctly implement the markdown syntax for the new code blocks (e.g., incorrect fence characters, missing or malformed language tags) or failed to properly close the previously unclosed bash block, leading to parsing or rendering issues.", "fix_direction": "Focus on precise adherence to markdown syntax for code blocks. Ensure correct usage of fence characters (e.g., ````), proper placement of language tags immediately after the opening fence, and explicit closure of all code blocks, including fixing existing unclosed ones.", "confidence": 0.9}, "drafts_generated": 1, "drafts_survived": 1}
{"id": "7c277e99-4fd7-4a22-a6dd-6a7beaba470b", "target_id": "B5-treatment", "git_sha": "304bf877e6033cfdf508679e41c0e985d807e278", "pre_experiment_sha": "304bf877e6033cfdf508679e41c0e985d807e278", "timestamp": "2026-04-20T22:39:36.257589+00:00", "hypothesis": "Add an Examples section with practical usage examples and explicit syntax highlighting, preserving all existing text.", "hypothesis_source": "agent", "mutation_diff_summary": "", "score": 0.5, "score_ci_lower": 0.0, "score_ci_upper": 1.3, "raw_scores": [0.5, 0.0, 2.0, 0.0, 0.0], "baseline_score": 2.5, "outcome": "DISCARDED", "failure_mode": null, "duration_seconds": 72.54519370780326, "tags": ["documentation", "examples", "markdown"], "learnings": "{\"what_changed\":\"\",\"what_improved\":[],\"what_regressed\":[],\"transferable_insight\":\"Simply appending new instructional content without pruning existing text can degrade user experience by causing information overload.\",\"domain_tags\":[\"Content Strategy\",\"Information Architecture\",\"UX Design\"]}", "cost_usd": 0.023947750000000004, "bootstrap_seed": 0, "agent_model": "gemini-3.1-pro-preview", "held_out_score": null, "criterion_names": ["quick_start_present", "api_documented", "prerequisites_clear", "examples_runnable", "error_guidance", "contribution_path"], "per_criterion_scores": {"quick_start_present": 0.0, "api_documented": 0.0, "prerequisites_clear": 0.3, "examples_runnable": 0.0, "error_guidance": 0.0, "contribution_path": 0.2}, "failure_classification": {"category": "incomplete_edit", "description": "The experiment likely initiated the addition of the 'Examples section' but failed to fully deliver on all aspects of the hypothesis. This could manifest as providing an insufficient number of examples, examples that were not genuinely practical, or inconsistent/missing explicit syntax highlighting for the provided examples, leading to a partial fulfillment of the overall task.", "fix_direction": "Focus on generating a comprehensive set of genuinely practical usage examples, ensuring each is explicitly and consistently highlighted according to the specified syntax. Thoroughly verify the completeness and quality of the new section before considering the edit finalized.", "confidence": 0.85}, "drafts_generated": 1, "drafts_survived": 1}
{"id": "0157f811-44e1-419b-800c-974f0d027bbc", "target_id": "B5-treatment", "git_sha": "9fe24620b8fb42e391e98d30d2dedd61c5a6ba76", "pre_experiment_sha": "304bf877e6033cfdf508679e41c0e985d807e278", "timestamp": "2026-04-20T22:41:39.487380+00:00", "hypothesis": "Add an Examples section with practical usage examples and explicit syntax highlighting, preserving all original content including the unclosed code block.", "hypothesis_source": "agent", "mutation_diff_summary": "", "score": 2.1, "score_ci_lower": 0.5, "score_ci_upper": 3.7, "raw_scores": [4.0, 0.5, 1.5, 4.5, 0.0], "baseline_score": 2.5, "outcome": "KEPT", "failure_mode": null, "duration_seconds": 80.42909054108895, "tags": ["documentation", "examples"], "learnings": "{\"what_changed\":\"\",\"what_improved\":[],\"what_regressed\":[],\"transferable_insight\":\"Adding valuable new content cannot compensate for the negative impact of intentionally preserving structural or formatting errors from the original source.\",\"domain_tags\":[\"Content Formatting\",\"Documentation\",\"Quality Assurance\"]}", "cost_usd": 0.0273067, "bootstrap_seed": 0, "agent_model": "gemini-3.1-pro-preview", "held_out_score": null, "criterion_names": ["quick_start_present", "api_documented", "prerequisites_clear", "examples_runnable", "error_guidance", "contribution_path"], "per_criterion_scores": {"quick_start_present": 0.4, "api_documented": 0.0, "prerequisites_clear": 0.3, "examples_runnable": 0.6, "error_guidance": 0.2, "contribution_path": 0.6}, "failure_classification": null, "drafts_generated": 1, "drafts_survived": 1}
{"id": "4eae5635-110e-431c-959b-15bda71d091c", "target_id": "B5-treatment", "git_sha": "9fe24620b8fb42e391e98d30d2dedd61c5a6ba76", "pre_experiment_sha": "9fe24620b8fb42e391e98d30d2dedd61c5a6ba76", "timestamp": "2026-04-20T22:42:59.373214+00:00", "hypothesis": "Add a new Examples section with explicit syntax highlighting and clear organization while strictly preserving all existing content, including unclosed code blocks.", "hypothesis_source": "agent", "mutation_diff_summary": "", "score": 1.2, "score_ci_lower": 0.4, "score_ci_upper": 2.0, "raw_scores": [0.0, 2.5, 2.0, 1.0, 0.5], "baseline_score": 2.1, "outcome": "DISCARDED", "failure_mode": null, "duration_seconds": 73.55221779202111, "tags": ["documentation", "examples", "formatting"], "learnings": "{\"what_changed\":\"\",\"what_improved\":[],\"what_regressed\":[],\"transferable_insight\":\"Strictly preserving existing structural errors, such as unclosed formatting tags, can corrupt the overall presentation and completely negate the benefits of adding new, well-organized content.\",\"domain_tags\":[\"Formatting\",\"Documentation\",\"Content Strategy\"]}", "cost_usd": 0.02430735, "bootstrap_seed": 0, "agent_model": "gemini-3.1-pro-preview", "held_out_score": null, "criterion_names": ["quick_start_present", "api_documented", "prerequisites_clear", "examples_runnable", "error_guidance", "contribution_path"], "per_criterion_scores": {"quick_start_present": 0.2, "api_documented": 0.0, "prerequisites_clear": 0.3, "examples_runnable": 0.1, "error_guidance": 0.0, "contribution_path": 0.6}, "failure_classification": {"category": "scope_violation", "description": "The model likely failed to strictly preserve all existing content, including the unclosed code blocks, by inadvertently modifying, deleting, or attempting to 'fix' them while adding the new Examples section. This violates the explicit constraint against editing outside the permitted scope.", "fix_direction": "Reinforce the instruction to treat all existing content as immutable. Explicitly forbid any modification, deletion, or 'correction' of the original document, even malformed parts like unclosed code blocks. Guide the model to identify the exact insertion point for new content without affecting the surrounding text.", "confidence": 0.9}, "drafts_generated": 1, "drafts_survived": 1}
