{"id": "9dafa79c-b5f5-4d42-bb5e-0a5575d98892", "target_id": "B5-treatment", "git_sha": "b7fb002f8e5bdd2a5f9d7eba3a042e023e84e0aa", "pre_experiment_sha": "1a6b64a9e7823d3ff8caaa10ef20c70f03e8e03c", "timestamp": "2026-04-07T23:38:01.177555+00:00", "hypothesis": "No hypothesis provided", "hypothesis_source": "synthesized", "mutation_diff_summary": "", "score": 2.0, "score_ci_lower": 1.0, "score_ci_upper": 2.8, "raw_scores": [3.0, 2.0, 0.0, 2.0, 3.0], "baseline_score": 2.1, "outcome": "KEPT", "failure_mode": null, "duration_seconds": 191.10758045799594, "tags": [], "learnings": "{\"what_changed\":\"\",\"what_improved\":[],\"what_regressed\":[],\"transferable_insight\":\"No hypothesis provided\",\"domain_tags\":[]}", "cost_usd": 0.8935653500000001, "bootstrap_seed": 0, "agent_model": "claude-sonnet-4-6", "held_out_score": null, "criterion_names": ["quick_start_present", "api_documented", "prerequisites_clear", "examples_runnable", "error_guidance", "contribution_path"], "per_criterion_scores": {"quick_start_present": 0.4, "api_documented": 0.2, "prerequisites_clear": 0.2, "examples_runnable": 0.4, "error_guidance": 0.4, "contribution_path": 0.4}, "failure_classification": null, "drafts_generated": 1, "drafts_survived": 1}
{"id": "443df921-4686-4079-9a85-9b29cf8e0942", "target_id": "B5-treatment", "git_sha": "b4e25571b47fe9d54646b095443b4f4f04afcd81", "pre_experiment_sha": "b7fb002f8e5bdd2a5f9d7eba3a042e023e84e0aa", "timestamp": "2026-04-07T23:42:26.690906+00:00", "hypothesis": "No hypothesis provided", "hypothesis_source": "synthesized", "mutation_diff_summary": "", "score": 1.6, "score_ci_lower": 0.4, "score_ci_upper": 2.8, "raw_scores": [3.0, 0.0, 3.0, 2.0, 0.0], "baseline_score": 2.0, "outcome": "KEPT", "failure_mode": null, "duration_seconds": 265.08455858399975, "tags": [], "learnings": "{\"what_changed\":\"\",\"what_improved\":[],\"what_regressed\":[],\"transferable_insight\":\"No hypothesis provided\",\"domain_tags\":[]}", "cost_usd": 0.8358764500000001, "bootstrap_seed": 0, "agent_model": "claude-sonnet-4-6", "held_out_score": null, "criterion_names": ["quick_start_present", "api_documented", "prerequisites_clear", "examples_runnable", "error_guidance", "contribution_path"], "per_criterion_scores": {"quick_start_present": 0.4, "api_documented": 0.0, "prerequisites_clear": 0.2, "examples_runnable": 0.2, "error_guidance": 0.2, "contribution_path": 0.6}, "failure_classification": null, "drafts_generated": 1, "drafts_survived": 1}
{"id": "f177f68e-a08e-4e41-95be-a8e21b69d015", "target_id": "B5-treatment", "git_sha": "a7d2d8e545c8cb7f30fb5bd71c8db0d6bde2f23b", "pre_experiment_sha": "b4e25571b47fe9d54646b095443b4f4f04afcd81", "timestamp": "2026-04-07T23:45:39.957877+00:00", "hypothesis": "No hypothesis provided", "hypothesis_source": "synthesized", "mutation_diff_summary": "", "score": 1.9, "score_ci_lower": 1.2, "score_ci_upper": 2.6, "raw_scores": [1.0, 2.0, 2.5, 1.0, 3.0], "baseline_score": 1.6, "outcome": "KEPT", "failure_mode": null, "duration_seconds": 192.82900266700017, "tags": [], "learnings": "{\"what_changed\":\"\",\"what_improved\":[],\"what_regressed\":[],\"transferable_insight\":\"No hypothesis provided\",\"domain_tags\":[]}", "cost_usd": 0.7213056, "bootstrap_seed": 0, "agent_model": "claude-sonnet-4-6", "held_out_score": null, "criterion_names": ["quick_start_present", "api_documented", "prerequisites_clear", "examples_runnable", "error_guidance", "contribution_path"], "per_criterion_scores": {"quick_start_present": 0.8, "api_documented": 0.2, "prerequisites_clear": 0.3, "examples_runnable": 0.0, "error_guidance": 0.0, "contribution_path": 0.6}, "failure_classification": null, "drafts_generated": 1, "drafts_survived": 1}
{"id": "64e140e0-8239-4717-afdb-5e86b6922370", "target_id": "B5-treatment", "git_sha": "a7d2d8e545c8cb7f30fb5bd71c8db0d6bde2f23b", "pre_experiment_sha": "a7d2d8e545c8cb7f30fb5bd71c8db0d6bde2f23b", "timestamp": "2026-04-07T23:48:59.853074+00:00", "hypothesis": "No hypothesis provided", "hypothesis_source": "synthesized", "mutation_diff_summary": "", "score": 1.2, "score_ci_lower": 0.2, "score_ci_upper": 2.6, "raw_scores": [0.0, 1.0, 1.0, 4.0, 0.0], "baseline_score": 1.9, "outcome": "DISCARDED", "failure_mode": null, "duration_seconds": 199.47643062499992, "tags": [], "learnings": "{\"what_changed\":\"\",\"what_improved\":[],\"what_regressed\":[\"quick_start_present: FAIL (was PASS)\",\"contribution_path: FAIL (was PASS)\"],\"transferable_insight\":\"No hypothesis provided\",\"domain_tags\":[]}", "cost_usd": 0.7427216999999999, "bootstrap_seed": 0, "agent_model": "claude-sonnet-4-6", "held_out_score": null, "criterion_names": ["quick_start_present", "api_documented", "prerequisites_clear", "examples_runnable", "error_guidance", "contribution_path"], "per_criterion_scores": {"quick_start_present": 0.2, "api_documented": 0.0, "prerequisites_clear": 0.2, "examples_runnable": 0.0, "error_guidance": 0.4, "contribution_path": 0.4}, "failure_classification": {"category": "output_format", "description": "The experiment failed due to a structure or schema violation in the output, as implied by the low score and lack of hypothesis or clear failure mode.", "fix_direction": "Ensure the output strictly follows the required structure or schema specification.", "confidence": 0.8}, "drafts_generated": 1, "drafts_survived": 1}
{"id": "2c0b3762-dcdd-425c-83fc-37e1529e2869", "target_id": "B5-treatment", "git_sha": "09e73b46e48de20a333258c55512c8a5e095f2bf", "pre_experiment_sha": "a7d2d8e545c8cb7f30fb5bd71c8db0d6bde2f23b", "timestamp": "2026-04-07T23:51:57.988821+00:00", "hypothesis": "No hypothesis provided", "hypothesis_source": "synthesized", "mutation_diff_summary": "", "score": 1.8, "score_ci_lower": 0.8, "score_ci_upper": 2.8, "raw_scores": [3.0, 0.0, 3.0, 1.0, 2.0], "baseline_score": 1.9, "outcome": "KEPT", "failure_mode": null, "duration_seconds": 175.86958258399682, "tags": [], "learnings": "{\"what_changed\":\"\",\"what_improved\":[\"quick_start_present: PASS (was FAIL)\",\"examples_runnable: PASS (was FAIL)\",\"contribution_path: PASS (was FAIL)\"],\"what_regressed\":[],\"transferable_insight\":\"No hypothesis provided\",\"domain_tags\":[]}", "cost_usd": 0.6896209499999999, "bootstrap_seed": 0, "agent_model": "claude-sonnet-4-6", "held_out_score": null, "criterion_names": ["quick_start_present", "api_documented", "prerequisites_clear", "examples_runnable", "error_guidance", "contribution_path"], "per_criterion_scores": {"quick_start_present": 0.6, "api_documented": 0.0, "prerequisites_clear": 0.0, "examples_runnable": 0.6, "error_guidance": 0.0, "contribution_path": 0.6}, "failure_classification": null, "drafts_generated": 1, "drafts_survived": 1}
{"id": "34af42f5-d42d-4df9-a16f-bdc570a8cc32", "target_id": "B5-treatment", "git_sha": "09e73b46e48de20a333258c55512c8a5e095f2bf", "pre_experiment_sha": "09e73b46e48de20a333258c55512c8a5e095f2bf", "timestamp": "2026-04-07T23:55:57.229560+00:00", "hypothesis": "No hypothesis provided", "hypothesis_source": "synthesized", "mutation_diff_summary": "", "score": 1.4, "score_ci_lower": 0.6, "score_ci_upper": 2.4, "raw_scores": [3.0, 1.0, 1.0, 2.0, 0.0], "baseline_score": 1.8, "outcome": "DISCARDED", "failure_mode": null, "duration_seconds": 238.83945737499744, "tags": [], "learnings": "{\"what_changed\":\"\",\"what_improved\":[],\"what_regressed\":[\"quick_start_present: FAIL (was PASS)\",\"examples_runnable: FAIL (was PASS)\"],\"transferable_insight\":\"No hypothesis provided\",\"domain_tags\":[]}", "cost_usd": 0.76507055, "bootstrap_seed": 0, "agent_model": "claude-sonnet-4-6", "held_out_score": null, "criterion_names": ["quick_start_present", "api_documented", "prerequisites_clear", "examples_runnable", "error_guidance", "contribution_path"], "per_criterion_scores": {"quick_start_present": 0.4, "api_documented": 0.0, "prerequisites_clear": 0.0, "examples_runnable": 0.2, "error_guidance": 0.2, "contribution_path": 0.6}, "failure_classification": {"category": "output_format", "description": "The experiment appears to have violated the expected output structure or schema. The lack of a hypothesis and unknown failure mode suggest the response may not have followed the required format or included all necessary fields.", "fix_direction": "Ensure all required output fields (such as hypothesis and failure mode) are present and conform to the expected schema in future attempts.", "confidence": 0.85}, "drafts_generated": 1, "drafts_survived": 1}
{"id": "950cae9f-e4a3-4e76-a94c-c022a603e168", "target_id": "B5-treatment", "git_sha": "4491c760081faef5ad73e34aa7992360baf2e83a", "pre_experiment_sha": "09e73b46e48de20a333258c55512c8a5e095f2bf", "timestamp": "2026-04-07T23:59:00.157043+00:00", "hypothesis": "No hypothesis provided", "hypothesis_source": "synthesized", "mutation_diff_summary": "", "score": 2.4, "score_ci_lower": 1.6, "score_ci_upper": 3.4, "raw_scores": [3.0, 1.0, 4.0, 2.0, 2.0], "baseline_score": 1.8, "outcome": "KEPT", "failure_mode": null, "duration_seconds": 180.99755541700142, "tags": [], "learnings": "{\"what_changed\":\"\",\"what_improved\":[\"quick_start_present: PASS (was FAIL)\",\"examples_runnable: PASS (was FAIL)\"],\"what_regressed\":[],\"transferable_insight\":\"No hypothesis provided\",\"domain_tags\":[]}", "cost_usd": 0.86157015, "bootstrap_seed": 0, "agent_model": "claude-sonnet-4-6", "held_out_score": null, "criterion_names": ["quick_start_present", "api_documented", "prerequisites_clear", "examples_runnable", "error_guidance", "contribution_path"], "per_criterion_scores": {"quick_start_present": 0.6, "api_documented": 0.0, "prerequisites_clear": 0.2, "examples_runnable": 0.6, "error_guidance": 0.4, "contribution_path": 0.6}, "failure_classification": null, "drafts_generated": 1, "drafts_survived": 1}
{"id": "c1fe8a60-a374-4629-9e1b-e5d4f0b39d36", "target_id": "B5-treatment", "git_sha": "4491c760081faef5ad73e34aa7992360baf2e83a", "pre_experiment_sha": "4491c760081faef5ad73e34aa7992360baf2e83a", "timestamp": "2026-04-08T00:01:24.058769+00:00", "hypothesis": "No hypothesis provided", "hypothesis_source": "synthesized", "mutation_diff_summary": "", "score": 1.2, "score_ci_lower": 0.0, "score_ci_upper": 2.4, "raw_scores": [3.0, 0.0, 0.0, 3.0, 0.0], "baseline_score": 2.4, "outcome": "DISCARDED", "failure_mode": null, "duration_seconds": 143.43072612499964, "tags": [], "learnings": "{\"what_changed\":\"\",\"what_improved\":[],\"what_regressed\":[\"quick_start_present: FAIL (was PASS)\",\"examples_runnable: FAIL (was PASS)\",\"contribution_path: FAIL (was PASS)\"],\"transferable_insight\":\"No hypothesis provided\",\"domain_tags\":[]}", "cost_usd": 0.5383611, "bootstrap_seed": 0, "agent_model": "claude-sonnet-4-6", "held_out_score": null, "criterion_names": ["quick_start_present", "api_documented", "prerequisites_clear", "examples_runnable", "error_guidance", "contribution_path"], "per_criterion_scores": {"quick_start_present": 0.4, "api_documented": 0.0, "prerequisites_clear": 0.0, "examples_runnable": 0.2, "error_guidance": 0.2, "contribution_path": 0.4}, "failure_classification": {"category": "output_format", "description": "The experiment failed due to violation of the required output structure or schema, as indicated by the score and lack of further details.", "fix_direction": "Ensure output conforms exactly to the expected format or schema; validate structure before submission.", "confidence": 0.8}, "drafts_generated": 1, "drafts_survived": 1}
{"id": "b0117f99-6b3d-4ec3-8bfc-ae9d147a7009", "target_id": "B5-treatment", "git_sha": "4491c760081faef5ad73e34aa7992360baf2e83a", "pre_experiment_sha": "4491c760081faef5ad73e34aa7992360baf2e83a", "timestamp": "2026-04-08T00:03:35.359998+00:00", "hypothesis": "No hypothesis provided", "hypothesis_source": "synthesized", "mutation_diff_summary": "", "score": 1.4, "score_ci_lower": 0.6, "score_ci_upper": 2.0, "raw_scores": [0.0, 2.0, 1.0, 2.0, 2.0], "baseline_score": 2.4, "outcome": "DISCARDED", "failure_mode": null, "duration_seconds": 129.16380720899906, "tags": [], "learnings": "{\"what_changed\":\"\",\"what_improved\":[],\"what_regressed\":[],\"transferable_insight\":\"No hypothesis provided\",\"domain_tags\":[]}", "cost_usd": 0.7021332999999998, "bootstrap_seed": 0, "agent_model": "claude-sonnet-4-6", "held_out_score": null, "criterion_names": ["quick_start_present", "api_documented", "prerequisites_clear", "examples_runnable", "error_guidance", "contribution_path"], "per_criterion_scores": {"quick_start_present": 0.4, "api_documented": 0.0, "prerequisites_clear": 0.0, "examples_runnable": 0.2, "error_guidance": 0.4, "contribution_path": 0.4}, "failure_classification": {"category": "output_format", "description": "The experiment failed due to violation of the expected output structure or schema. No hypothesis was provided and both hypothesis and failure mode were missing, indicating improper or incomplete output formatting.", "fix_direction": "Ensure all required output sections and formats are strictly followed; validate output against schema before submission.", "confidence": 0.9}, "drafts_generated": 1, "drafts_survived": 1}
{"id": "2544df26-28f0-41f6-b224-f21f8d163669", "target_id": "B5-treatment", "git_sha": "8e0fe443b6542c3495c8a4a64f83a0ad54da9359", "pre_experiment_sha": "4491c760081faef5ad73e34aa7992360baf2e83a", "timestamp": "2026-04-08T00:06:11.049015+00:00", "hypothesis": "No hypothesis provided", "hypothesis_source": "synthesized", "mutation_diff_summary": "", "score": 2.4, "score_ci_lower": 0.8, "score_ci_upper": 4.0, "raw_scores": [5.0, 4.0, 0.0, 2.0, 1.0], "baseline_score": 2.4, "outcome": "KEPT", "failure_mode": null, "duration_seconds": 153.9133499170057, "tags": [], "learnings": "{\"what_changed\":\"\",\"what_improved\":[\"quick_start_present: PASS (was FAIL)\",\"contribution_path: PASS (was FAIL)\"],\"what_regressed\":[],\"transferable_insight\":\"No hypothesis provided\",\"domain_tags\":[]}", "cost_usd": 0.7183394999999999, "bootstrap_seed": 0, "agent_model": "claude-sonnet-4-6", "held_out_score": null, "criterion_names": ["quick_start_present", "api_documented", "prerequisites_clear", "examples_runnable", "error_guidance", "contribution_path"], "per_criterion_scores": {"quick_start_present": 0.6, "api_documented": 0.0, "prerequisites_clear": 0.4, "examples_runnable": 0.4, "error_guidance": 0.4, "contribution_path": 0.6}, "failure_classification": null, "drafts_generated": 1, "drafts_survived": 1}
{"id": "5f4dbecf-98eb-4fe8-a726-5042f17b9bdf", "target_id": "B5-treatment", "git_sha": "8e0fe443b6542c3495c8a4a64f83a0ad54da9359", "pre_experiment_sha": "8e0fe443b6542c3495c8a4a64f83a0ad54da9359", "timestamp": "2026-04-08T00:10:27.410589+00:00", "hypothesis": "No hypothesis provided", "hypothesis_source": "synthesized", "mutation_diff_summary": "", "score": 1.8, "score_ci_lower": 1.3, "score_ci_upper": 2.4, "raw_scores": [3.0, 1.5, 1.0, 2.0, 1.5], "baseline_score": 2.4, "outcome": "DISCARDED", "failure_mode": null, "duration_seconds": 255.95604216599895, "tags": [], "learnings": "{\"what_changed\":\"\",\"what_improved\":[],\"what_regressed\":[],\"transferable_insight\":\"No hypothesis provided\",\"domain_tags\":[]}", "cost_usd": 0.9169331499999999, "bootstrap_seed": 0, "agent_model": "claude-sonnet-4-6", "held_out_score": null, "criterion_names": ["quick_start_present", "api_documented", "prerequisites_clear", "examples_runnable", "error_guidance", "contribution_path"], "per_criterion_scores": {"quick_start_present": 0.6, "api_documented": 0.0, "prerequisites_clear": 0.2, "examples_runnable": 0.2, "error_guidance": 0.2, "contribution_path": 0.6}, "failure_classification": {"category": "output_format", "description": "The experiment failed due to a violation of the required output structure or schema, as indicated by 'Output structure/schema violation' being a relevant category and no hypothesis being provided (potentially required in output).", "fix_direction": "Ensure output strictly follows the prescribed structure/schema, including all required fields.", "confidence": 0.8}, "drafts_generated": 1, "drafts_survived": 1}
{"id": "b2ed04d6-c635-489c-aff1-9daaa8193499", "target_id": "B5-treatment", "git_sha": "03a814d1c609e32b290ff34bd48fcca42bc42ae4", "pre_experiment_sha": "8e0fe443b6542c3495c8a4a64f83a0ad54da9359", "timestamp": "2026-04-08T00:14:22.148075+00:00", "hypothesis": "No hypothesis provided", "hypothesis_source": "synthesized", "mutation_diff_summary": "", "score": 2.2, "score_ci_lower": 1.0, "score_ci_upper": 3.2, "raw_scores": [2.0, 0.0, 3.0, 4.0, 2.0], "baseline_score": 2.4, "outcome": "KEPT", "failure_mode": null, "duration_seconds": 232.73901666700112, "tags": [], "learnings": "{\"what_changed\":\"\",\"what_improved\":[\"prerequisites_clear: PASS (was FAIL)\"],\"what_regressed\":[\"quick_start_present: FAIL (was PASS)\",\"contribution_path: FAIL (was PASS)\"],\"transferable_insight\":\"No hypothesis provided\",\"domain_tags\":[]}", "cost_usd": 1.0237638000000002, "bootstrap_seed": 0, "agent_model": "claude-sonnet-4-6", "held_out_score": null, "criterion_names": ["quick_start_present", "api_documented", "prerequisites_clear", "examples_runnable", "error_guidance", "contribution_path"], "per_criterion_scores": {"quick_start_present": 0.4, "api_documented": 0.2, "prerequisites_clear": 0.6, "examples_runnable": 0.4, "error_guidance": 0.2, "contribution_path": 0.4}, "failure_classification": null, "drafts_generated": 1, "drafts_survived": 1}
{"id": "e5fd840a-1aee-4bbc-b1b1-6f26f1dda13f", "target_id": "B5-treatment", "git_sha": "fcc8e90275d405a6f01467dda08b1361d45c72b1", "pre_experiment_sha": "03a814d1c609e32b290ff34bd48fcca42bc42ae4", "timestamp": "2026-04-08T00:28:29.402061+00:00", "hypothesis": "No hypothesis provided", "hypothesis_source": "synthesized", "mutation_diff_summary": "", "score": 2.8, "score_ci_lower": 1.4, "score_ci_upper": 4.2, "raw_scores": [3.0, 4.0, 1.0, 5.0, 1.0], "baseline_score": 2.2, "outcome": "KEPT", "failure_mode": null, "duration_seconds": 245.28435504199297, "tags": [], "learnings": "{\"what_changed\":\"\",\"what_improved\":[\"quick_start_present: PASS (was FAIL)\",\"examples_runnable: PASS (was FAIL)\",\"contribution_path: PASS (was FAIL)\"],\"what_regressed\":[\"prerequisites_clear: FAIL (was PASS)\"],\"transferable_insight\":\"No hypothesis provided\",\"domain_tags\":[]}", "cost_usd": 0.6868772999999999, "bootstrap_seed": 0, "agent_model": "claude-sonnet-4-6", "held_out_score": null, "criterion_names": ["quick_start_present", "api_documented", "prerequisites_clear", "examples_runnable", "error_guidance", "contribution_path"], "per_criterion_scores": {"quick_start_present": 0.8, "api_documented": 0.0, "prerequisites_clear": 0.4, "examples_runnable": 0.6, "error_guidance": 0.2, "contribution_path": 0.8}, "failure_classification": null, "drafts_generated": 1, "drafts_survived": 1}
{"id": "38793331-b1ec-4e27-a30f-38effd60ad1f", "target_id": "B5-treatment", "git_sha": "fcc8e90275d405a6f01467dda08b1361d45c72b1", "pre_experiment_sha": "fcc8e90275d405a6f01467dda08b1361d45c72b1", "timestamp": "2026-04-08T00:30:30.975395+00:00", "hypothesis": "No hypothesis provided", "hypothesis_source": "synthesized", "mutation_diff_summary": "", "score": 2.6, "score_ci_lower": 1.6, "score_ci_upper": 3.6, "raw_scores": [4.0, 4.0, 1.0, 2.0, 2.0], "baseline_score": 2.8, "outcome": "DISCARDED", "failure_mode": null, "duration_seconds": 121.09933558400371, "tags": [], "learnings": "{\"what_changed\":\"\",\"what_improved\":[],\"what_regressed\":[],\"transferable_insight\":\"No hypothesis provided\",\"domain_tags\":[]}", "cost_usd": 0.66238155, "bootstrap_seed": 0, "agent_model": "claude-sonnet-4-6", "held_out_score": null, "criterion_names": ["quick_start_present", "api_documented", "prerequisites_clear", "examples_runnable", "error_guidance", "contribution_path"], "per_criterion_scores": {"quick_start_present": 0.6, "api_documented": 0.0, "prerequisites_clear": 0.4, "examples_runnable": 0.6, "error_guidance": 0.2, "contribution_path": 0.8}, "failure_classification": {"category": "output_format", "description": "The experiment lacks a provided hypothesis and failure mode, which likely indicates violation of the required output structure or schema.", "fix_direction": "Ensure all required fields (such as hypothesis and failure mode) are supplied in the output format.", "confidence": 0.85}, "drafts_generated": 1, "drafts_survived": 1}
