{"id": "140607ad-72af-438e-ae9a-aea56497fd74", "target_id": "B5-treatment", "git_sha": "7810d66d6d860525e3f0a19507c89dd91de5a2c8", "pre_experiment_sha": "7810d66d6d860525e3f0a19507c89dd91de5a2c8", "timestamp": "2026-04-20T22:15:36.306969+00:00", "hypothesis": "Add the missing Examples section with a tagged code block, avoiding any bold text or lists, while preserving the existing Table of Contents and Prerequisites to satisfy the exact section requirements.", "hypothesis_source": "agent", "mutation_diff_summary": "", "score": 1.3, "score_ci_lower": 0.3, "score_ci_upper": 2.3, "raw_scores": [2.5, 0.0, 0.0, 1.5, 2.5], "baseline_score": 1.3, "outcome": "DISCARDED", "failure_mode": null, "duration_seconds": 70.91992987506092, "tags": ["documentation", "formatting", "missing-section"], "learnings": "{\"what_changed\":\"\",\"what_improved\":[],\"what_regressed\":[],\"transferable_insight\":\"Fulfilling structural requirements by adding missing sections yields no measurable improvement if accompanied by arbitrary formatting constraints that do not align with the underlying evaluation criteria.\",\"domain_tags\":[\"Documentation\",\"Formatting\",\"Content Strategy\"]}", "cost_usd": 0.02296125, "bootstrap_seed": 0, "agent_model": "gemini-3.1-pro-preview", "held_out_score": null, "criterion_names": ["quick_start_present", "api_documented", "prerequisites_clear", "examples_runnable", "error_guidance", "contribution_path"], "per_criterion_scores": {"quick_start_present": 0.3, "api_documented": 0.2, "prerequisites_clear": 0.1, "examples_runnable": 0.4, "error_guidance": 0.1, "contribution_path": 0.2}, "failure_classification": {"category": "scope_violation", "description": "The model failed to adhere to the instruction of preserving the existing Table of Contents and/or Prerequisites sections, making edits or alterations outside the permitted scope of adding only the new 'Examples' section. This type of violation often leads to a very low score due to corruption of the original document structure.", "fix_direction": "Improve the model's ability to strictly identify and isolate modification zones. Emphasize explicit 'preserve' or 'do not modify' instructions as hard constraints, ensuring that edits are strictly confined to the specified areas for new content addition.", "confidence": 0.85}, "drafts_generated": 1, "drafts_survived": 1}
{"id": "f4c2450d-1ecc-4799-9e77-2d15de15d7b8", "target_id": "B5-treatment", "git_sha": "7810d66d6d860525e3f0a19507c89dd91de5a2c8", "pre_experiment_sha": "7810d66d6d860525e3f0a19507c89dd91de5a2c8", "timestamp": "2026-04-20T22:17:00.304494+00:00", "hypothesis": "Add the Examples section with a tagged code block while preserving the existing Table of Contents and Prerequisites, strictly avoiding new lists or bold text.", "hypothesis_source": "agent", "mutation_diff_summary": "", "score": 1.7, "score_ci_lower": 0.8, "score_ci_upper": 2.7, "raw_scores": [0.0, 1.0, 2.0, 3.5, 2.0], "baseline_score": 1.3, "outcome": "DISCARDED", "failure_mode": null, "duration_seconds": 58.51162108313292, "tags": ["documentation", "formatting", "markdown"], "learnings": "{\"what_changed\":\"\",\"what_improved\":[],\"what_regressed\":[],\"transferable_insight\":\"Restricting standard formatting elements like bold text and lists when introducing new instructional content can diminish its readability and prevent meaningful user experience improvements.\",\"domain_tags\":[\"Documentation\",\"Formatting\",\"Content Strategy\"]}", "cost_usd": 0.024466599999999998, "bootstrap_seed": 0, "agent_model": "gemini-3.1-pro-preview", "held_out_score": null, "criterion_names": ["quick_start_present", "api_documented", "prerequisites_clear", "examples_runnable", "error_guidance", "contribution_path"], "per_criterion_scores": {"quick_start_present": 0.5, "api_documented": 0.0, "prerequisites_clear": 0.2, "examples_runnable": 0.3, "error_guidance": 0.3, "contribution_path": 0.4}, "failure_classification": {"category": "output_format", "description": "The experiment failed to adhere to the strict output formatting and structural requirements. This likely included failing to correctly implement the 'tagged code block' for the new Examples section, introducing forbidden elements such as new lists or bold text, or failing to preserve the existing Table of Contents and Prerequisites sections as explicitly required. The low score of 1.7000 suggests multiple or critical violations of these output format constraints.", "fix_direction": "Improve the model's ability to strictly interpret and adhere to all constraints, especially negative constraints ('strictly avoiding new lists or bold text') and preservation instructions ('preserving existing Table of Contents and Prerequisites'). Focus on precise generation of specified structural elements (e.g., 'tagged code block') and ensuring the overall document structure remains compliant after modification.", "confidence": 0.9}, "drafts_generated": 1, "drafts_survived": 1}
{"id": "ea4eed50-73e0-4386-8882-5615164f11b9", "target_id": "B5-treatment", "git_sha": "2e055238211871f44ee6ed19d558e2982cbdc1da", "pre_experiment_sha": "7810d66d6d860525e3f0a19507c89dd91de5a2c8", "timestamp": "2026-04-20T22:18:55.467006+00:00", "hypothesis": "Add the Examples section with a properly tagged code block while retaining all existing content to satisfy the exact section requirements without triggering semantic drift.", "hypothesis_source": "agent", "mutation_diff_summary": "", "score": 1.4, "score_ci_lower": 0.5, "score_ci_upper": 2.5, "raw_scores": [3.5, 1.0, 1.0, 0.0, 1.5], "baseline_score": 1.3, "outcome": "KEPT", "failure_mode": null, "duration_seconds": 93.826955875149, "tags": ["documentation", "formatting", "markdown\n\n```markdown\n# datamill\n\nA command-line tool for transforming CSV data through composable pipelines."], "learnings": "{\"what_changed\":\"\",\"what_improved\":[],\"what_regressed\":[],\"transferable_insight\":\"Supplementing existing content with well-formatted examples, rather than replacing it, improves completeness and clarity without risking the loss of original context.\",\"domain_tags\":[\"Content Strategy\",\"Formatting\",\"Information Architecture\"]}", "cost_usd": 0.019740900000000002, "bootstrap_seed": 0, "agent_model": "gemini-3.1-pro-preview", "held_out_score": null, "criterion_names": ["quick_start_present", "api_documented", "prerequisites_clear", "examples_runnable", "error_guidance", "contribution_path"], "per_criterion_scores": {"quick_start_present": 0.4, "api_documented": 0.0, "prerequisites_clear": 0.0, "examples_runnable": 0.5, "error_guidance": 0.3, "contribution_path": 0.2}, "failure_classification": null, "drafts_generated": 1, "drafts_survived": 1}
{"id": "0620e649-5d97-426a-a8fe-02e8d9ba7845", "target_id": "B5-treatment", "git_sha": "56c2d9ba6dcf7c50716b76c14b305243bed2cfba", "pre_experiment_sha": "2e055238211871f44ee6ed19d558e2982cbdc1da", "timestamp": "2026-04-20T22:20:29.191544+00:00", "hypothesis": "Add an \"Examples\" section with practical usage examples and explicit syntax highlighting, while preserving all existing content.", "hypothesis_source": "agent", "mutation_diff_summary": "", "score": 2.0, "score_ci_lower": 1.2, "score_ci_upper": 2.8, "raw_scores": [3.0, 3.0, 1.0, 2.0, 1.0], "baseline_score": 1.4, "outcome": "KEPT", "failure_mode": null, "duration_seconds": 63.17476533399895, "tags": ["documentation", "examples", "markdown"], "learnings": "{\"what_changed\":\"\",\"what_improved\":[],\"what_regressed\":[],\"transferable_insight\":\"Supplementing instructional content with concrete, visually distinct practical examples significantly enhances comprehension and usability.\",\"domain_tags\":[\"Documentation\",\"Content Strategy\",\"User Experience\"]}", "cost_usd": 0.03270945, "bootstrap_seed": 0, "agent_model": "gemini-3.1-pro-preview", "held_out_score": null, "criterion_names": ["quick_start_present", "api_documented", "prerequisites_clear", "examples_runnable", "error_guidance", "contribution_path"], "per_criterion_scores": {"quick_start_present": 0.6, "api_documented": 0.0, "prerequisites_clear": 0.0, "examples_runnable": 0.4, "error_guidance": 0.2, "contribution_path": 0.8}, "failure_classification": null, "drafts_generated": 1, "drafts_survived": 1}
{"id": "b9067dd8-9f60-4cd0-b73b-ad67d925aa77", "target_id": "B5-treatment", "git_sha": "56c2d9ba6dcf7c50716b76c14b305243bed2cfba", "pre_experiment_sha": "56c2d9ba6dcf7c50716b76c14b305243bed2cfba", "timestamp": "2026-04-20T22:21:34.959842+00:00", "hypothesis": "Added an Examples section with practical usage commands and explicit bash syntax highlighting to satisfy the documentation criteria.", "hypothesis_source": "agent", "mutation_diff_summary": "", "score": 0.8, "score_ci_lower": 0.3, "score_ci_upper": 1.2, "raw_scores": [0.5, 1.5, 1.0, 1.0, 0.0], "baseline_score": 2.0, "outcome": "DISCARDED", "failure_mode": null, "duration_seconds": 60.249254582915455, "tags": ["documentation", "examples", "syntax-highlighting"], "learnings": "{\"what_changed\":\"\",\"what_improved\":[],\"what_regressed\":[],\"transferable_insight\":\"Introducing explicit, formatted examples to fulfill perceived completeness criteria can degrade performance, indicating that exhaustive illustrations may introduce unnecessary verbosity or distract from the core objective.\",\"domain_tags\":[\"Documentation\",\"Formatting\",\"Content Strategy\"]}", "cost_usd": 0.017811749999999998, "bootstrap_seed": 0, "agent_model": "gemini-3.1-pro-preview", "held_out_score": null, "criterion_names": ["quick_start_present", "api_documented", "prerequisites_clear", "examples_runnable", "error_guidance", "contribution_path"], "per_criterion_scores": {"quick_start_present": 0.1, "api_documented": 0.1, "prerequisites_clear": 0.1, "examples_runnable": 0.1, "error_guidance": 0.0, "contribution_path": 0.4}, "failure_classification": {"category": "incomplete_edit", "description": "The experiment aimed to add an \"Examples\" section with practical usage commands and explicit bash syntax highlighting to satisfy documentation criteria. A score of 0.8 indicates that while significant progress was made, the edit was incomplete. This means either not all required examples were provided, the examples were not sufficiently practical, or the bash syntax highlighting was not consistently or fully applied across all necessary instances, resulting in a partial fulfillment of the documentation requirements and leaving it in a state that is not fully compliant.", "fix_direction": "Thoroughly review the documentation criteria to identify specific gaps. Ensure all necessary examples are included, verify their practicality and clarity, and meticulously apply bash syntax highlighting consistently across all relevant code snippets. The goal should be 100% adherence to all sub-criteria related to the examples section.", "confidence": 0.9}, "drafts_generated": 1, "drafts_survived": 1}
{"id": "17abc494-b6b5-4ff5-9f74-c12edd7649e2", "target_id": "B5-treatment", "git_sha": "35ecb8ebd412e9be96162914d57c4e52d28d8d37", "pre_experiment_sha": "56c2d9ba6dcf7c50716b76c14b305243bed2cfba", "timestamp": "2026-04-20T22:22:56.398623+00:00", "hypothesis": "Added an Examples section with practical usage snippets in explicitly tagged bash code blocks, preserving existing content without expanding other missing sections.", "hypothesis_source": "agent", "mutation_diff_summary": "", "score": 1.8, "score_ci_lower": 0.6, "score_ci_upper": 3.2, "raw_scores": [3.0, 0.0, 4.0, 1.0, 1.0], "baseline_score": 2.0, "outcome": "KEPT", "failure_mode": null, "duration_seconds": 58.53814133396372, "tags": ["documentation", "examples", "formatting"], "learnings": "{\"what_changed\":\"\",\"what_improved\":[],\"what_regressed\":[],\"transferable_insight\":\"Supplementing instructional content with explicitly formatted, practical examples enhances user comprehension and usability.\",\"domain_tags\":[\"Documentation\",\"Technical Writing\",\"Formatting\"]}", "cost_usd": 0.02854585, "bootstrap_seed": 0, "agent_model": "gemini-3.1-pro-preview", "held_out_score": null, "criterion_names": ["quick_start_present", "api_documented", "prerequisites_clear", "examples_runnable", "error_guidance", "contribution_path"], "per_criterion_scores": {"quick_start_present": 0.6, "api_documented": 0.0, "prerequisites_clear": 0.4, "examples_runnable": 0.4, "error_guidance": 0.0, "contribution_path": 0.4}, "failure_classification": null, "drafts_generated": 1, "drafts_survived": 1}
{"id": "3fb908ae-86ff-4a5f-ab43-25d2138178ef", "target_id": "B5-treatment", "git_sha": "07c71a85a74af60e19a4c0dc743ba61709cd9bb5", "pre_experiment_sha": "35ecb8ebd412e9be96162914d57c4e52d28d8d37", "timestamp": "2026-04-20T22:24:03.641346+00:00", "hypothesis": "Add an Examples section with practical usage snippets and explicit syntax highlighting while preserving all existing content.", "hypothesis_source": "agent", "mutation_diff_summary": "", "score": 1.9, "score_ci_lower": 1.2, "score_ci_upper": 2.7, "raw_scores": [2.0, 1.0, 1.0, 3.5, 2.0], "baseline_score": 1.8, "outcome": "KEPT", "failure_mode": null, "duration_seconds": 47.03415729198605, "tags": ["documentation", "examples", "markdown"], "learnings": "{\"what_changed\":\"\",\"what_improved\":[],\"what_regressed\":[],\"transferable_insight\":\"Supplementing instructional material with practical, clearly formatted examples enhances user comprehension and engagement.\",\"domain_tags\":[\"Technical Writing\",\"Content Strategy\",\"User Experience\"]}", "cost_usd": 0.0264862, "bootstrap_seed": 0, "agent_model": "gemini-3.1-pro-preview", "held_out_score": null, "criterion_names": ["quick_start_present", "api_documented", "prerequisites_clear", "examples_runnable", "error_guidance", "contribution_path"], "per_criterion_scores": {"quick_start_present": 0.6, "api_documented": 0.0, "prerequisites_clear": 0.1, "examples_runnable": 0.2, "error_guidance": 0.4, "contribution_path": 0.6}, "failure_classification": null, "drafts_generated": 1, "drafts_survived": 1}
{"id": "43bf3615-5799-4f0f-b937-20c5a3c2deb1", "target_id": "B5-treatment", "git_sha": "07c71a85a74af60e19a4c0dc743ba61709cd9bb5", "pre_experiment_sha": "07c71a85a74af60e19a4c0dc743ba61709cd9bb5", "timestamp": "2026-04-20T22:24:59.451693+00:00", "hypothesis": "Added an Examples section with practical usage snippets and explicitly tagged bash code blocks to satisfy documentation criteria and improve the binary criteria score.", "hypothesis_source": "agent", "mutation_diff_summary": "", "score": 1.0, "score_ci_lower": 0.2, "score_ci_upper": 1.8, "raw_scores": [0.0, 2.0, 1.0, 2.0, 0.0], "baseline_score": 1.9, "outcome": "DISCARDED", "failure_mode": null, "duration_seconds": 49.47944029211067, "tags": ["documentation", "examples", "markdown"], "learnings": "{\"what_changed\":\"\",\"what_improved\":[],\"what_regressed\":[],\"transferable_insight\":\"Adding unprompted supplementary sections, such as examples or usage snippets, to artificially satisfy evaluation criteria can significantly degrade performance by deviating from the core task requirements.\",\"domain_tags\":[\"Instruction Following\",\"Documentation\",\"Formatting\"]}", "cost_usd": 0.0269944, "bootstrap_seed": 0, "agent_model": "gemini-3.1-pro-preview", "held_out_score": null, "criterion_names": ["quick_start_present", "api_documented", "prerequisites_clear", "examples_runnable", "error_guidance", "contribution_path"], "per_criterion_scores": {"quick_start_present": 0.2, "api_documented": 0.0, "prerequisites_clear": 0.0, "examples_runnable": 0.0, "error_guidance": 0.4, "contribution_path": 0.4}, "failure_classification": {"category": "over_optimization", "description": "The experiment achieved a perfect score (1.0000) by implementing the proposed changes (adding an Examples section and tagging code blocks), which directly satisfied the stated hypothesis to improve the binary criteria score. However, its classification as a 'failed experiment' with an 'unknown' failure mode, despite a perfect score, strongly implies that the evaluation criteria for documentation were too easily satisfied. The 'failure' might be that the criteria are superficial or easily gamed, leading to a maximal score without necessarily achieving deep, robust documentation or uncovering anticipated challenges. The experiment optimized the output for the current (potentially insufficient) metric.", "fix_direction": "Re-evaluate and enhance the robustness and comprehensiveness of the documentation criteria. Implement more stringent or multi-faceted evaluation methods to ensure that a perfect score genuinely reflects high-quality, thorough documentation and prevents easy 'gaming' of the metric. The goal should be to make achieving a perfect score a true testament to comprehensive improvement, not just basic compliance.", "confidence": 0.85}, "drafts_generated": 1, "drafts_survived": 1}
{"id": "3107bab3-179a-49b6-9540-28f1c9134d6e", "target_id": "B5-treatment", "git_sha": "07c71a85a74af60e19a4c0dc743ba61709cd9bb5", "pre_experiment_sha": "07c71a85a74af60e19a4c0dc743ba61709cd9bb5", "timestamp": "2026-04-20T22:26:21.596206+00:00", "hypothesis": "Add an Examples section with practical usage snippets and explicit syntax highlighting to fulfill the documentation criteria and improve the score.", "hypothesis_source": "agent", "mutation_diff_summary": "", "score": 1.1, "score_ci_lower": 0.4, "score_ci_upper": 1.8, "raw_scores": [2.0, 0.0, 1.0, 0.5, 2.0], "baseline_score": 1.9, "outcome": "DISCARDED", "failure_mode": null, "duration_seconds": 58.383109875023365, "tags": ["documentation", "examples", "markdown"], "learnings": "{\"what_changed\":\"\",\"what_improved\":[],\"what_regressed\":[],\"transferable_insight\":\"Appending explicit example sections with complex formatting like syntax highlighting can degrade performance, suggesting that adding unrequested structural elements may violate implicit constraints or introduce unnecessary bloat.\",\"domain_tags\":[\"Documentation\",\"Formatting\",\"Content Strategy\"]}", "cost_usd": 0.020060949999999998, "bootstrap_seed": 0, "agent_model": "gemini-3.1-pro-preview", "held_out_score": null, "criterion_names": ["quick_start_present", "api_documented", "prerequisites_clear", "examples_runnable", "error_guidance", "contribution_path"], "per_criterion_scores": {"quick_start_present": 0.4, "api_documented": 0.0, "prerequisites_clear": 0.0, "examples_runnable": 0.4, "error_guidance": 0.1, "contribution_path": 0.2}, "failure_classification": {"category": "over_optimization", "description": "The experiment likely added an 'Examples' section with syntax highlighting, resulting in a slight score increase (1.1000). However, the generated examples were probably superficial, boilerplate, or not genuinely 'practical usage snippets' as intended by the hypothesis. This indicates the model may have successfully 'gamed' an evaluation metric that rewards the *presence* of examples and highlighting, without truly improving the documentation's quality or usefulness, thus failing to meet the full intent of the experiment.", "fix_direction": "Focus on generating high-quality, relevant, and diverse practical usage snippets that demonstrate real-world scenarios. The model needs to be guided towards fulfilling the *spirit* of the documentation criteria, not just the superficial elements. Additionally, refine the evaluation metric to assess the *quality*, *relevance*, and *utility* of the examples, rather than just their presence or basic formatting, to prevent future over-optimization.", "confidence": 0.9}, "drafts_generated": 1, "drafts_survived": 1}
{"id": "82b189d7-aff4-40ac-8b0d-d1f672d89c63", "target_id": "B5-treatment", "git_sha": "84e30a6c308333e65bbe99d08fb080f10168a42a", "pre_experiment_sha": "07c71a85a74af60e19a4c0dc743ba61709cd9bb5", "timestamp": "2026-04-20T22:27:55.675190+00:00", "hypothesis": "Add an Examples section with practical usage snippets and explicit syntax highlighting to improve documentation completeness and user guidance.", "hypothesis_source": "agent", "mutation_diff_summary": "", "score": 1.2, "score_ci_lower": 0.4, "score_ci_upper": 2.2, "raw_scores": [1.0, 0.0, 1.0, 1.0, 3.0], "baseline_score": 1.9, "outcome": "KEPT", "failure_mode": null, "duration_seconds": 53.645412041805685, "tags": ["documentation", "examples", "markdown"], "learnings": "{\"what_changed\":\"\",\"what_improved\":[],\"what_regressed\":[],\"transferable_insight\":\"Supplementing instructional content with practical, visually distinct examples improves user comprehension and task execution.\",\"domain_tags\":[\"Documentation\",\"User Experience\",\"Content Strategy\"]}", "cost_usd": 0.0237059, "bootstrap_seed": 0, "agent_model": "gemini-3.1-pro-preview", "held_out_score": null, "criterion_names": ["quick_start_present", "api_documented", "prerequisites_clear", "examples_runnable", "error_guidance", "contribution_path"], "per_criterion_scores": {"quick_start_present": 0.2, "api_documented": 0.2, "prerequisites_clear": 0.0, "examples_runnable": 0.4, "error_guidance": 0.0, "contribution_path": 0.4}, "failure_classification": null, "drafts_generated": 1, "drafts_survived": 1}
