{"id": "5c308ff9-c5b1-48a6-b7b5-030dd7ff5928", "target_id": "B5-treatment", "git_sha": "779c6e0c6eae902a15b98262acf1045dcc109eef", "pre_experiment_sha": "9fe24620b8fb42e391e98d30d2dedd61c5a6ba76", "timestamp": "2026-04-20T22:44:29.419673+00:00", "hypothesis": "Append a new Examples section with syntax-highlighted code blocks at the end of the file, preserving all original content exactly as provided.", "hypothesis_source": "agent", "mutation_diff_summary": "", "score": 1.9, "score_ci_lower": 0.5, "score_ci_upper": 3.3, "raw_scores": [2.5, 3.0, 0.0, 4.0, 0.0], "baseline_score": 2.1, "outcome": "KEPT", "failure_mode": null, "duration_seconds": 71.34283137507737, "tags": ["examples", "documentation"], "learnings": "{\"what_changed\":\"\",\"what_improved\":[],\"what_regressed\":[],\"transferable_insight\":\"Supplementing existing material with well-formatted, practical examples at the end provides additional value without disrupting the original content flow.\",\"domain_tags\":[\"Documentation\",\"Formatting\",\"Content Strategy\"]}", "cost_usd": 0.030565049999999996, "bootstrap_seed": 0, "agent_model": "gemini-3.1-pro-preview", "held_out_score": null, "criterion_names": ["quick_start_present", "api_documented", "prerequisites_clear", "examples_runnable", "error_guidance", "contribution_path"], "per_criterion_scores": {"quick_start_present": 0.4, "api_documented": 0.0, "prerequisites_clear": 0.3, "examples_runnable": 0.4, "error_guidance": 0.4, "contribution_path": 0.4}, "failure_classification": null, "drafts_generated": 1, "drafts_survived": 1}
{"id": "77165c9b-8079-4790-a65f-9ccfb40b4573", "target_id": "B5-treatment", "git_sha": "779c6e0c6eae902a15b98262acf1045dcc109eef", "pre_experiment_sha": "779c6e0c6eae902a15b98262acf1045dcc109eef", "timestamp": "2026-04-20T22:46:13.653100+00:00", "hypothesis": "Append a new Examples section with properly closed and tagged code blocks at the end of the document, strictly preserving the original formatting and existing unclosed blocks.", "hypothesis_source": "agent", "mutation_diff_summary": "", "score": 1.3, "score_ci_lower": 0.6, "score_ci_upper": 2.1, "raw_scores": [2.5, 1.0, 1.0, 2.0, 0.0], "baseline_score": 1.9, "outcome": "DISCARDED", "failure_mode": null, "duration_seconds": 84.26884191692807, "tags": ["documentation", "examples", "syntax-highlighting"], "learnings": "{\"what_changed\":\"\",\"what_improved\":[],\"what_regressed\":[],\"transferable_insight\":\"Appending properly formatted content to a document while intentionally preserving existing structural errors degrades overall quality, likely because the malformed elements disrupt the parsing of the new additions.\",\"domain_tags\":[\"Document Formatting\",\"Syntax Parsing\",\"Data Integrity\"]}", "cost_usd": 0.0256476, "bootstrap_seed": 0, "agent_model": "gemini-3.1-pro-preview", "held_out_score": null, "criterion_names": ["quick_start_present", "api_documented", "prerequisites_clear", "examples_runnable", "error_guidance", "contribution_path"], "per_criterion_scores": {"quick_start_present": 0.2, "api_documented": 0.0, "prerequisites_clear": 0.2, "examples_runnable": 0.2, "error_guidance": 0.3, "contribution_path": 0.4}, "failure_classification": {"category": "scope_violation", "description": "The hypothesis explicitly required \"strictly preserving the original formatting and existing unclosed blocks.\" A likely failure mode is that the model modified or \"fixed\" existing unclosed blocks, or altered the original formatting, which constitutes an edit outside the permitted scope of appending new content.", "fix_direction": "Reinforce instructions regarding strict adherence to content preservation and the boundaries of permitted edits. Emphasize that \"preserving\" means not altering, even if an alteration might seem to \"correct\" or \"improve\" existing content. Improve contextual understanding of when to *only* append versus when to modify existing content.", "confidence": 0.9}, "drafts_generated": 1, "drafts_survived": 1}
{"id": "2e92482f-ef28-4494-be99-817381793512", "target_id": "B5-treatment", "git_sha": "779c6e0c6eae902a15b98262acf1045dcc109eef", "pre_experiment_sha": "779c6e0c6eae902a15b98262acf1045dcc109eef", "timestamp": "2026-04-20T22:47:51.662403+00:00", "hypothesis": "Appended an Examples section with properly tagged and closed code blocks while preserving the original content exactly.", "hypothesis_source": "agent", "mutation_diff_summary": "", "score": 0.7, "score_ci_lower": 0.3, "score_ci_upper": 1.1, "raw_scores": [0.0, 0.5, 1.0, 0.5, 1.5], "baseline_score": 1.9, "outcome": "DISCARDED", "failure_mode": null, "duration_seconds": 77.38898824993521, "tags": ["examples", "formatting"], "learnings": "{\"what_changed\":\"\",\"what_improved\":[],\"what_regressed\":[],\"transferable_insight\":\"Appending supplementary sections to the end of existing content without integrating them into the core structure can significantly degrade overall performance.\",\"domain_tags\":[\"Prompt Engineering\",\"Content Structuring\",\"Formatting\"]}", "cost_usd": 0.018885350000000002, "bootstrap_seed": 0, "agent_model": "gemini-3.1-pro-preview", "held_out_score": null, "criterion_names": ["quick_start_present", "api_documented", "prerequisites_clear", "examples_runnable", "error_guidance", "contribution_path"], "per_criterion_scores": {"quick_start_present": 0.3, "api_documented": 0.0, "prerequisites_clear": 0.0, "examples_runnable": 0.2, "error_guidance": 0.0, "contribution_path": 0.2}, "failure_classification": {"category": "scope_violation", "description": "The model failed to preserve the original content exactly as instructed. While it may have successfully appended some form of an 'Examples' section, it introduced unintended modifications, alterations, or reformatting to the pre-existing content. This violates the explicit scope constraint of only adding new content without altering the original document.", "fix_direction": "Improve the model's adherence to content preservation instructions. This often requires more robust methods for diff-based generation, explicit token-by-token original content validation, or fine-tuning that heavily penalizes any deviation from existing text when a 'preserve exactly' constraint is in place.", "confidence": 0.85}, "drafts_generated": 1, "drafts_survived": 1}
{"id": "2675dd0f-e015-4813-839c-337cb854d786", "target_id": "B5-treatment", "git_sha": "779c6e0c6eae902a15b98262acf1045dcc109eef", "pre_experiment_sha": "779c6e0c6eae902a15b98262acf1045dcc109eef", "timestamp": "2026-04-20T22:49:30.228217+00:00", "hypothesis": "Append a new Examples section with explicit syntax highlighting while strictly preserving the original content, including unclosed code blocks.", "hypothesis_source": "agent", "mutation_diff_summary": "", "score": 1.5, "score_ci_lower": 0.4, "score_ci_upper": 2.6, "raw_scores": [2.0, 3.0, 0.0, 2.5, 0.0], "baseline_score": 1.9, "outcome": "DISCARDED", "failure_mode": null, "duration_seconds": 64.03198891715147, "tags": ["documentation", "examples"], "learnings": "{\"what_changed\":\"\",\"what_improved\":[],\"what_regressed\":[],\"transferable_insight\":\"Strictly preserving existing structural errors, such as unclosed formatting tags, can corrupt the rendering of newly appended content and degrade overall quality.\",\"domain_tags\":[\"formatting\",\"structural_integrity\",\"document_generation\"]}", "cost_usd": 0.027601699999999996, "bootstrap_seed": 0, "agent_model": "gemini-3.1-pro-preview", "held_out_score": null, "criterion_names": ["quick_start_present", "api_documented", "prerequisites_clear", "examples_runnable", "error_guidance", "contribution_path"], "per_criterion_scores": {"quick_start_present": 0.0, "api_documented": 0.0, "prerequisites_clear": 0.2, "examples_runnable": 0.5, "error_guidance": 0.4, "contribution_path": 0.4}, "failure_classification": {"category": "scope_violation", "description": "The experiment likely failed by modifying the original content of the document, rather than strictly preserving it as instructed. This could manifest as attempts to reformat, correct, or close unclosed code blocks within the existing content, directly violating the 'strictly preserving the original content' clause, which defines the permitted scope of edits.", "fix_direction": "Reinforce training on strict content preservation and immutable sections. Implement clearer boundaries for editable vs. non-editable parts of the input. Emphasize that 'preserve' means absolutely no changes, even if the model perceives an 'improvement' or 'fix' to the original content.", "confidence": 0.9}, "drafts_generated": 1, "drafts_survived": 1}
{"id": "f05c8b70-d23e-47e8-b1c1-e01b51f6547d", "target_id": "B5-treatment", "git_sha": "2beb6a045e003add2e137f6eedb069ca3985cc6a", "pre_experiment_sha": "779c6e0c6eae902a15b98262acf1045dcc109eef", "timestamp": "2026-04-20T22:51:12.134656+00:00", "hypothesis": "Appended an Examples section with properly tagged and closed code blocks to improve documentation utility without altering the original text's broken formatting.", "hypothesis_source": "agent", "mutation_diff_summary": "", "score": 1.8, "score_ci_lower": 0.9, "score_ci_upper": 3.2, "raw_scores": [1.0, 0.5, 4.5, 1.5, 1.5], "baseline_score": 1.9, "outcome": "KEPT", "failure_mode": null, "duration_seconds": 66.36643399996683, "tags": ["documentation", "examples", "formatting"], "learnings": "{\"what_changed\":\"\",\"what_improved\":[],\"what_regressed\":[],\"transferable_insight\":\"Supplementing flawed legacy content with well-structured, accurate examples improves overall usability without requiring risky modifications to the original material.\",\"domain_tags\":[\"Documentation\",\"Formatting\",\"Content Strategy\"]}", "cost_usd": 0.02877065, "bootstrap_seed": 0, "agent_model": "gemini-3.1-pro-preview", "held_out_score": null, "criterion_names": ["quick_start_present", "api_documented", "prerequisites_clear", "examples_runnable", "error_guidance", "contribution_path"], "per_criterion_scores": {"quick_start_present": 0.3, "api_documented": 0.2, "prerequisites_clear": 0.3, "examples_runnable": 0.2, "error_guidance": 0.4, "contribution_path": 0.4}, "failure_classification": null, "drafts_generated": 1, "drafts_survived": 1}
{"id": "39156d49-1d52-4bb9-aa2b-187ea517ed1a", "target_id": "B5-treatment", "git_sha": "5b65f496e48aa6d9415d308a248fa31c7b68f607", "pre_experiment_sha": "2beb6a045e003add2e137f6eedb069ca3985cc6a", "timestamp": "2026-04-20T22:52:48.729001+00:00", "hypothesis": "Append a new Examples section with properly closed and tagged code blocks while strictly preserving the unclosed code blocks in the original text.", "hypothesis_source": "agent", "mutation_diff_summary": "", "score": 2.4, "score_ci_lower": 1.1, "score_ci_upper": 3.7, "raw_scores": [2.5, 0.5, 4.5, 1.0, 3.5], "baseline_score": 1.8, "outcome": "KEPT", "failure_mode": null, "duration_seconds": 89.68947566696443, "tags": ["documentation", "examples", "formatting"], "learnings": "{\"what_changed\":\"\",\"what_improved\":[],\"what_regressed\":[],\"transferable_insight\":\"When augmenting content that contains formatting errors, appending well-formatted examples while strictly preserving the original text yields better results than attempting to fix the original errors.\",\"domain_tags\":[\"Formatting\",\"Content Augmentation\",\"Text Processing\"]}", "cost_usd": 0.0279041, "bootstrap_seed": 0, "agent_model": "gemini-3.1-pro-preview", "held_out_score": null, "criterion_names": ["quick_start_present", "api_documented", "prerequisites_clear", "examples_runnable", "error_guidance", "contribution_path"], "per_criterion_scores": {"quick_start_present": 0.5, "api_documented": 0.2, "prerequisites_clear": 0.3, "examples_runnable": 0.5, "error_guidance": 0.3, "contribution_path": 0.6}, "failure_classification": null, "drafts_generated": 1, "drafts_survived": 1}
{"id": "b8403f35-5322-4d46-af6f-e40cfc7bf2d0", "target_id": "B5-treatment", "git_sha": "5b65f496e48aa6d9415d308a248fa31c7b68f607", "pre_experiment_sha": "5b65f496e48aa6d9415d308a248fa31c7b68f607", "timestamp": "2026-04-20T22:53:59.993658+00:00", "hypothesis": "Appending an Examples section with properly tagged and closed code blocks while preserving the unclosed blocks in the original text to satisfy strict content preservation rules.", "hypothesis_source": "agent", "mutation_diff_summary": "", "score": 1.0, "score_ci_lower": 0.4, "score_ci_upper": 1.6, "raw_scores": [1.0, 2.0, 1.0, 1.0, 0.0], "baseline_score": 2.4, "outcome": "DISCARDED", "failure_mode": null, "duration_seconds": 63.70321104116738, "tags": ["documentation", "formatting", "markdown"], "learnings": "{\"what_changed\":\"\",\"what_improved\":[],\"what_regressed\":[],\"transferable_insight\":\"Preserving fundamental structural errors in the original content to satisfy strict preservation constraints, even when appending corrected examples, degrades overall quality.\",\"domain_tags\":[\"Content Formatting\",\"Constraint Satisfaction\",\"Quality Assurance\"]}", "cost_usd": 0.028261650000000003, "bootstrap_seed": 0, "agent_model": "gemini-3.1-pro-preview", "held_out_score": null, "criterion_names": ["quick_start_present", "api_documented", "prerequisites_clear", "examples_runnable", "error_guidance", "contribution_path"], "per_criterion_scores": {"quick_start_present": 0.0, "api_documented": 0.0, "prerequisites_clear": 0.4, "examples_runnable": 0.0, "error_guidance": 0.2, "contribution_path": 0.4}, "failure_classification": {"category": "scope_violation", "description": "The experiment failed because the model edited the original text by closing previously unclosed code blocks. This directly violated the explicit constraint in the hypothesis to 'preserve the unclosed blocks in the original text' and exceeded the permitted scope of editing, which was limited to appending new content.", "fix_direction": "Implement stricter adherence to content preservation rules. Ensure the model recognizes that 'preserving unclosed blocks' means leaving them exactly as they are, rather than attempting to 'correct' or complete them. Focus on strictly limiting edits to the specified append operation and preventing any modification to existing content under preservation rules.", "confidence": 0.95}, "drafts_generated": 1, "drafts_survived": 1}
{"id": "529aba41-ba93-491c-8ea2-744e47641039", "target_id": "B5-treatment", "git_sha": "5b65f496e48aa6d9415d308a248fa31c7b68f607", "pre_experiment_sha": "5b65f496e48aa6d9415d308a248fa31c7b68f607", "timestamp": "2026-04-20T22:56:12.149905+00:00", "hypothesis": "Append a new Examples section with a properly closed and tagged bash code block while strictly preserving the unclosed code blocks in the original text.", "hypothesis_source": "agent", "mutation_diff_summary": "", "score": 0.8, "score_ci_lower": 0.2, "score_ci_upper": 1.4, "raw_scores": [0.0, 0.0, 1.0, 2.0, 1.0], "baseline_score": 2.4, "outcome": "DISCARDED", "failure_mode": null, "duration_seconds": 95.7985623748973, "tags": ["documentation", "formatting", "markdown"], "learnings": "{\"what_changed\":\"\",\"what_improved\":[],\"what_regressed\":[],\"transferable_insight\":\"Intentionally preserving structural errors in existing content degrades overall quality, even when appending new, correctly formatted additions.\",\"domain_tags\":[\"Content Formatting\",\"Error Correction\",\"Quality Assurance\"]}", "cost_usd": 0.02546295, "bootstrap_seed": 0, "agent_model": "gemini-3.1-pro-preview", "held_out_score": null, "criterion_names": ["quick_start_present", "api_documented", "prerequisites_clear", "examples_runnable", "error_guidance", "contribution_path"], "per_criterion_scores": {"quick_start_present": 0.0, "api_documented": 0.0, "prerequisites_clear": 0.0, "examples_runnable": 0.2, "error_guidance": 0.2, "contribution_path": 0.4}, "failure_classification": {"category": "scope_violation", "description": "The model likely successfully appended the new 'Examples' section with a properly closed and tagged bash code block. However, it failed to 'strictly preserve the unclosed code blocks in the original text,' meaning it probably modified, closed, or otherwise altered the existing unclosed code blocks that should have been left untouched. This indicates an edit outside the permitted scope, which was to append new content while preserving specific existing elements.", "fix_direction": "Improve the model's ability to strictly adhere to negative constraints, particularly 'preserve' or 'do not modify' instructions regarding specific existing elements. The model needs to better identify and protect parts of the input text that are explicitly marked as off-limits for modification.", "confidence": 0.9}, "drafts_generated": 1, "drafts_survived": 1}
{"id": "cb59378b-276a-4f67-a26d-9d89e1347b4d", "target_id": "B5-treatment", "git_sha": "5b65f496e48aa6d9415d308a248fa31c7b68f607", "pre_experiment_sha": "5b65f496e48aa6d9415d308a248fa31c7b68f607", "timestamp": "2026-04-20T22:57:36.844159+00:00", "hypothesis": "Append a new Examples section with a properly closed and tagged code block while preserving the unclosed code blocks in the original text.", "hypothesis_source": "agent", "mutation_diff_summary": "", "score": 1.2, "score_ci_lower": 0.4, "score_ci_upper": 2.1, "raw_scores": [3.0, 0.0, 0.5, 1.0, 1.5], "baseline_score": 2.4, "outcome": "DISCARDED", "failure_mode": null, "duration_seconds": 70.09214612515643, "tags": ["examples", "markdown", "code-blocks"], "learnings": "{\"what_changed\":\"\",\"what_improved\":[],\"what_regressed\":[],\"transferable_insight\":\"Attempting to improve a document by appending well-formatted content is ineffective if existing structural or formatting errors in the original text are left unresolved.\",\"domain_tags\":[\"Content Editing\",\"Formatting\",\"Quality Assurance\"]}", "cost_usd": 0.02587505, "bootstrap_seed": 0, "agent_model": "gemini-3.1-pro-preview", "held_out_score": null, "criterion_names": ["quick_start_present", "api_documented", "prerequisites_clear", "examples_runnable", "error_guidance", "contribution_path"], "per_criterion_scores": {"quick_start_present": 0.3, "api_documented": 0.0, "prerequisites_clear": 0.0, "examples_runnable": 0.4, "error_guidance": 0.0, "contribution_path": 0.5}, "failure_classification": {"category": "scope_violation", "description": "The experiment likely failed because the model edited content that was explicitly instructed to be preserved. Specifically, it probably attempted to \"fix\" or close the existing unclosed code blocks in the original text, thereby violating the instruction to leave them untouched. The permitted scope of edits was strictly limited to appending a new section with a properly closed code block.", "fix_direction": "Improve instruction clarity on negative constraints and non-editable regions. Clearly define the boundaries for editing, emphasizing parts of the input that must remain untouched. Consider using specific markers or explicit directives (e.g., 'DO NOT MODIFY') for content that must be preserved verbatim, especially when dealing with intentionally malformed input.", "confidence": 0.9}, "drafts_generated": 1, "drafts_survived": 1}
{"id": "98fb24d1-3ba1-44d1-98ac-9571b06a6841", "target_id": "B5-treatment", "git_sha": "5b65f496e48aa6d9415d308a248fa31c7b68f607", "pre_experiment_sha": "5b65f496e48aa6d9415d308a248fa31c7b68f607", "timestamp": "2026-04-20T22:59:07.589149+00:00", "hypothesis": "Append a new Examples section with a properly tagged and closed code block while perfectly preserving the unclosed code blocks in the original text.", "hypothesis_source": "agent", "mutation_diff_summary": "", "score": 2.2, "score_ci_lower": 1.2, "score_ci_upper": 3.4, "raw_scores": [4.5, 1.0, 2.5, 2.0, 1.0], "baseline_score": 2.4, "outcome": "DISCARDED", "failure_mode": null, "duration_seconds": 71.27372783306055, "tags": ["formatting", "examples"], "learnings": "{\"what_changed\":\"\",\"what_improved\":[],\"what_regressed\":[],\"transferable_insight\":\"Attempting to preserve existing structural errors while appending correctly formatted new content degrades overall output quality.\",\"domain_tags\":[\"Formatting\",\"Error Correction\",\"Content Generation\"]}", "cost_usd": 0.0268217, "bootstrap_seed": 0, "agent_model": "gemini-3.1-pro-preview", "held_out_score": null, "criterion_names": ["quick_start_present", "api_documented", "prerequisites_clear", "examples_runnable", "error_guidance", "contribution_path"], "per_criterion_scores": {"quick_start_present": 0.4, "api_documented": 0.0, "prerequisites_clear": 0.5, "examples_runnable": 0.3, "error_guidance": 0.4, "contribution_path": 0.6}, "failure_classification": {"category": "scope_violation", "description": "The model failed to adhere to the instruction to 'perfectly preserve the unclosed code blocks in the original text'. Instead of leaving them as-is, the model likely modified or 'fixed' these existing unclosed blocks (e.g., by closing them or altering their structure). This action constitutes an edit outside the permitted scope, which was strictly limited to appending a new section and preserving all existing content without modification.", "fix_direction": "Enhance the prompt to explicitly forbid modifications to existing content, especially malformed or incomplete elements. Use strong negative constraints such as 'DO NOT close, complete, or alter any existing unclosed code blocks in the original text; leave them exactly as they are.' Provide specific examples demonstrating how to preserve malformed structures.", "confidence": 0.9}, "drafts_generated": 1, "drafts_survived": 1}
