{"id": "b9fe2a0d-b73f-4e67-924f-5cd2b29f8ec3", "target_id": "B5-treatment", "git_sha": "6d049d66de5a49b678135e56cc5c1eaa9e7108a7", "pre_experiment_sha": "6d049d66de5a49b678135e56cc5c1eaa9e7108a7", "timestamp": "2026-04-20T21:16:52.527326+00:00", "hypothesis": "Complete the README by adding Usage, Troubleshooting, and Contact sections while preserving existing content and updating the Table of Contents.", "hypothesis_source": "agent", "mutation_diff_summary": "", "score": 1.8, "score_ci_lower": 0.8, "score_ci_upper": 2.6, "raw_scores": [2.0, 2.5, 0.0, 3.0, 1.5], "baseline_score": 2.1, "outcome": "DISCARDED", "failure_mode": null, "duration_seconds": 94.41380679211579, "tags": ["documentation", "readme", "completion"], "learnings": "{\"what_changed\":\"\",\"what_improved\":[],\"what_regressed\":[],\"transferable_insight\":\"Forcing standardized template sections into a document without verifying their necessity or accuracy can introduce unnecessary bloat and negatively impact overall readability.\",\"domain_tags\":[\"Documentation\",\"Technical Writing\",\"Content Management\"]}", "cost_usd": 0.03104815, "bootstrap_seed": 0, "agent_model": "gemini-3.1-pro-preview", "held_out_score": null, "criterion_names": ["quick_start_present", "api_documented", "prerequisites_clear", "examples_runnable", "error_guidance", "contribution_path"], "per_criterion_scores": {"quick_start_present": 0.4, "api_documented": 0.2, "prerequisites_clear": 0.2, "examples_runnable": 0.4, "error_guidance": 0.4, "contribution_path": 0.2}, "failure_classification": {"category": "incomplete_edit", "description": "The model likely failed to fully implement all specified modifications. This could include not adding all required sections (Usage, Troubleshooting, Contact), or failing to properly update the Table of Contents to reflect the new content. The low score suggests a significant portion of the task was not completed or led to an inconsistent state in the README.", "fix_direction": "Improve the model's capability to execute multi-step instructions comprehensively, ensuring all explicit requirements (adding sections, preserving existing content, updating TOC) are met and that the final output maintains internal consistency (e.g., TOC matches actual sections).", "confidence": 0.9}, "drafts_generated": 1, "drafts_survived": 1}
{"id": "a908849c-3157-4a84-92d7-f961443e5a2a", "target_id": "B5-treatment", "git_sha": "6d049d66de5a49b678135e56cc5c1eaa9e7108a7", "pre_experiment_sha": "6d049d66de5a49b678135e56cc5c1eaa9e7108a7", "timestamp": "2026-04-20T21:20:04.461733+00:00", "hypothesis": "Complete the README by adding concise Usage, Troubleshooting, and Contact sections while preserving existing content and updating the TOC.", "hypothesis_source": "agent", "mutation_diff_summary": "", "score": 1.1, "score_ci_lower": 0.5, "score_ci_upper": 1.6, "raw_scores": [1.5, 0.0, 1.0, 1.0, 2.0], "baseline_score": 2.1, "outcome": "DISCARDED", "failure_mode": null, "duration_seconds": 132.22591454116628, "tags": ["documentation", "readme", "completion"], "learnings": "{\"what_changed\":\"\",\"what_improved\":[],\"what_regressed\":[],\"transferable_insight\":\"Adding unrequested boilerplate sections to a document, even with the intention of making it more comprehensive, often degrades its overall quality and relevance.\",\"domain_tags\":[\"Documentation\",\"Content Generation\",\"Instruction Following\"]}", "cost_usd": 0.0272174, "bootstrap_seed": 0, "agent_model": "gemini-3.1-pro-preview", "held_out_score": null, "criterion_names": ["quick_start_present", "api_documented", "prerequisites_clear", "examples_runnable", "error_guidance", "contribution_path"], "per_criterion_scores": {"quick_start_present": 0.2, "api_documented": 0.0, "prerequisites_clear": 0.0, "examples_runnable": 0.3, "error_guidance": 0.0, "contribution_path": 0.6}, "failure_classification": {"category": "over_optimization", "description": "The experiment failed despite a score of 1.1000 (which is above a typical perfect score of 1.0), indicating the model likely generated overly verbose or extensive content in the new sections, exceeding the 'concise' requirement of the hypothesis. This suggests the model successfully 'gamed' the evaluation metric by increasing content volume or keyword presence, even though it failed the qualitative aspect of conciseness or true intent.", "fix_direction": "Refine the evaluation metrics to strictly penalize verbosity, non-concise content, or any additions that exceed the implicit or explicit scope. Emphasize and enforce 'concise' requirements more rigorously in prompts and evaluation.", "confidence": 0.9}, "drafts_generated": 1, "drafts_survived": 1}
{"id": "77ba0a16-e394-438d-bc16-7548219091f0", "target_id": "B5-treatment", "git_sha": "6d049d66de5a49b678135e56cc5c1eaa9e7108a7", "pre_experiment_sha": "6d049d66de5a49b678135e56cc5c1eaa9e7108a7", "timestamp": "2026-04-20T21:21:59.011184+00:00", "hypothesis": "Add concise Usage, Troubleshooting, and Contact sections to complete the README while maintaining the original text and structure.", "hypothesis_source": "agent", "mutation_diff_summary": "", "score": 1.2, "score_ci_lower": 0.6, "score_ci_upper": 1.8, "raw_scores": [1.0, 2.0, 0.0, 2.0, 1.0], "baseline_score": 2.1, "outcome": "DISCARDED", "failure_mode": null, "duration_seconds": 85.66475558304228, "tags": ["documentation", "completeness", "formatting"], "learnings": "{\"what_changed\":\"\",\"what_improved\":[],\"what_regressed\":[],\"transferable_insight\":\"Adding standard but unrequested sections to a document in an attempt to make it comprehensive often degrades overall quality.\",\"domain_tags\":[\"Documentation\",\"Content Strategy\",\"Information Architecture\"]}", "cost_usd": 0.031199850000000005, "bootstrap_seed": 0, "agent_model": "gemini-3.1-pro-preview", "held_out_score": null, "criterion_names": ["quick_start_present", "api_documented", "prerequisites_clear", "examples_runnable", "error_guidance", "contribution_path"], "per_criterion_scores": {"quick_start_present": 0.4, "api_documented": 0.2, "prerequisites_clear": 0.0, "examples_runnable": 0.0, "error_guidance": 0.4, "contribution_path": 0.2}, "failure_classification": {"category": "scope_violation", "description": "The experiment likely failed to maintain the original text and structure of the README, possibly by modifying existing content or altering the established structural elements beyond the mere addition of the new sections. This goes against the explicit constraint of 'maintaining the original text and structure' outlined in the hypothesis.", "fix_direction": "Implement stricter controls to ensure edits are purely additive and do not alter pre-existing content or structural elements. Provide explicit negative constraints (e.g., 'DO NOT modify existing sections', 'ONLY add the specified sections at the end/specific location') to guide the model's behavior more precisely.", "confidence": 0.85}, "drafts_generated": 1, "drafts_survived": 1}
{"id": "1f24bba4-257c-411d-b48d-e49dbfed7525", "target_id": "B5-treatment", "git_sha": "527f647fd82255993cd769c0ad475e95758d2779", "pre_experiment_sha": "6d049d66de5a49b678135e56cc5c1eaa9e7108a7", "timestamp": "2026-04-20T21:24:20.792711+00:00", "hypothesis": "Add concise Usage, Troubleshooting, and Contact sections to complete the README.", "hypothesis_source": "agent", "mutation_diff_summary": "", "score": 2.8, "score_ci_lower": 1.8, "score_ci_upper": 4.0, "raw_scores": [5.0, 3.0, 1.0, 2.0, 3.0], "baseline_score": 2.1, "outcome": "KEPT", "failure_mode": null, "duration_seconds": 102.9525489169173, "tags": ["documentation"], "learnings": "{\"what_changed\":\"\",\"what_improved\":[],\"what_regressed\":[],\"transferable_insight\":\"Providing comprehensive yet concise guidance on usage, problem resolution, and support channels improves the completeness and effectiveness of instructional documentation.\",\"domain_tags\":[\"Documentation\",\"User Experience\",\"Technical Writing\"]}", "cost_usd": 0.0285176, "bootstrap_seed": 0, "agent_model": "gemini-3.1-pro-preview", "held_out_score": null, "criterion_names": ["quick_start_present", "api_documented", "prerequisites_clear", "examples_runnable", "error_guidance", "contribution_path"], "per_criterion_scores": {"quick_start_present": 0.6, "api_documented": 0.1, "prerequisites_clear": 0.5, "examples_runnable": 0.4, "error_guidance": 0.6, "contribution_path": 0.6}, "failure_classification": null, "drafts_generated": 1, "drafts_survived": 1}
{"id": "c9c930e8-655e-45d6-bfa2-fbc12d3cb5f9", "target_id": "B5-treatment", "git_sha": "549446218c9120a10183eebe499e8c7ef8ee7e6a", "pre_experiment_sha": "527f647fd82255993cd769c0ad475e95758d2779", "timestamp": "2026-04-20T21:25:32.473674+00:00", "hypothesis": "Complete the truncated README by adding concise Usage, Troubleshooting, and Contact sections while fixing the unclosed code block.", "hypothesis_source": "agent", "mutation_diff_summary": "", "score": 1.2, "score_ci_lower": 0.5, "score_ci_upper": 1.9, "raw_scores": [0.5, 0.0, 1.5, 2.0, 2.0], "baseline_score": 2.8, "outcome": "KEPT", "failure_mode": null, "duration_seconds": 66.3811916669365, "tags": ["documentation", "formatting", "fix"], "learnings": "{\"what_changed\":\"\",\"what_improved\":[],\"what_regressed\":[],\"transferable_insight\":\"Repairing structural truncation and syntax errors while appending essential functional sections restores the completeness and usability of a document.\",\"domain_tags\":[\"Documentation\",\"Formatting\",\"Syntax Correction\"]}", "cost_usd": 0.021183099999999996, "bootstrap_seed": 0, "agent_model": "gemini-3.1-pro-preview", "held_out_score": null, "criterion_names": ["quick_start_present", "api_documented", "prerequisites_clear", "examples_runnable", "error_guidance", "contribution_path"], "per_criterion_scores": {"quick_start_present": 0.3, "api_documented": 0.1, "prerequisites_clear": 0.0, "examples_runnable": 0.2, "error_guidance": 0.2, "contribution_path": 0.4}, "failure_classification": null, "drafts_generated": 1, "drafts_survived": 1}
