{"id": "d9bd45d2-7bc7-40d9-a888-9e986d9f0178", "target_id": "B5-treatment", "git_sha": "dde84358166272fc70dad0ca562a6b071a370d8a", "pre_experiment_sha": "5fc6ff846095d42aced65fc3181e4192886dabbe", "timestamp": "2026-04-20T20:47:06.276216+00:00", "hypothesis": "Enhance the README by adding standard high-quality documentation sections (Badges, Table of Contents, Prerequisites, Troubleshooting, Contact) and adding syntax highlighting to code blocks to satisfy comprehensive documentation criteria.", "hypothesis_source": "agent", "mutation_diff_summary": "", "score": 1.2, "score_ci_lower": 0.4, "score_ci_upper": 2.2, "raw_scores": [0.0, 1.0, 1.0, 1.0, 3.0], "baseline_score": 0.0, "outcome": "KEPT", "failure_mode": null, "duration_seconds": 61.6123126251623, "tags": ["readme", "documentation", "formatting", "enhancements"], "learnings": "{\"what_changed\":\"\",\"what_improved\":[],\"what_regressed\":[],\"transferable_insight\":\"Enhancing informational materials with standardized structural elements\u2014such as navigation aids, prerequisites, and troubleshooting sections\u2014alongside clear visual formatting significantly improves usability and perceived quality.\",\"domain_tags\":[\"Documentation\",\"User Experience\",\"Information Architecture\"]}", "cost_usd": 0.02926985, "bootstrap_seed": 0, "agent_model": "gemini-3.1-pro-preview", "held_out_score": null, "criterion_names": ["quick_start_present", "api_documented", "prerequisites_clear", "examples_runnable", "error_guidance", "contribution_path"], "per_criterion_scores": {"quick_start_present": 0.2, "api_documented": 0.2, "prerequisites_clear": 0.2, "examples_runnable": 0.2, "error_guidance": 0.1, "contribution_path": 0.3}, "failure_classification": null, "drafts_generated": 1, "drafts_survived": 1}
{"id": "c0e51872-ce80-4d43-b8d3-0b0fb0a9bca7", "target_id": "B5-treatment", "git_sha": "dde84358166272fc70dad0ca562a6b071a370d8a", "pre_experiment_sha": "dde84358166272fc70dad0ca562a6b071a370d8a", "timestamp": "2026-04-20T20:48:30.023148+00:00", "hypothesis": "Complete the technical README by adding the missing sections (Usage, Operations, Configuration, Troubleshooting, Contributing, License, Contact) referenced in the Table of Contents.", "hypothesis_source": "agent", "mutation_diff_summary": "", "score": 1.7, "score_ci_lower": 0.5, "score_ci_upper": 2.9, "raw_scores": [2.0, 0.0, 4.0, 2.0, 0.5], "baseline_score": 1.2, "outcome": "DISCARDED", "failure_mode": null, "duration_seconds": 76.67570925015025, "tags": ["readme", "documentation", "fix-truncation"], "learnings": "{\"what_changed\":\"\",\"what_improved\":[],\"what_regressed\":[],\"transferable_insight\":\"Expanding informational artifacts merely to satisfy a structural template often introduces bloat without delivering commensurate practical value.\",\"domain_tags\":[\"Documentation\",\"Technical Writing\"]}", "cost_usd": 0.033656, "bootstrap_seed": 0, "agent_model": "gemini-3.1-pro-preview", "held_out_score": null, "criterion_names": ["quick_start_present", "api_documented", "prerequisites_clear", "examples_runnable", "error_guidance", "contribution_path"], "per_criterion_scores": {"quick_start_present": 0.5, "api_documented": 0.0, "prerequisites_clear": 0.2, "examples_runnable": 0.2, "error_guidance": 0.4, "contribution_path": 0.4}, "failure_classification": {"category": "incomplete_edit", "description": "The model failed to fully complete the README by either not adding all the specified missing sections (Usage, Operations, Configuration, Troubleshooting, Contributing, License, Contact), or by adding them with insufficient, placeholder, or empty content. This left the README in a partially updated or inconsistent state, not meeting the hypothesis's goal of 'completing' the document.", "fix_direction": "Improve the model's capability to ensure all required sections are generated and populated with relevant, descriptive content. Focus on task completeness, verifying the existence and richness of content for each specified section, rather than just adding headings.", "confidence": 0.85}, "drafts_generated": 1, "drafts_survived": 1}
{"id": "2376f75c-e2f0-4a13-93fe-4cd036b17b22", "target_id": "B5-treatment", "git_sha": "dde84358166272fc70dad0ca562a6b071a370d8a", "pre_experiment_sha": "dde84358166272fc70dad0ca562a6b071a370d8a", "timestamp": "2026-04-20T20:51:16.367257+00:00", "hypothesis": "Simplify the README by removing exhaustive sections from the TOC and adding concise Troubleshooting and Contact sections to prevent truncation, while ensuring syntax highlighting is applied.", "hypothesis_source": "agent", "mutation_diff_summary": "", "score": 0.9, "score_ci_lower": 0.3, "score_ci_upper": 1.6, "raw_scores": [2.0, 1.5, 0.5, 0.0, 0.5], "baseline_score": 1.2, "outcome": "DISCARDED", "failure_mode": null, "duration_seconds": 65.42758458293974, "tags": ["readme", "documentation", "fix-truncation"], "learnings": "{\"what_changed\":\"\",\"what_improved\":[],\"what_regressed\":[],\"transferable_insight\":\"Sacrificing comprehensive navigation structures for the sake of brevity can degrade usability, as users rely on exhaustive overviews to navigate complex information.\",\"domain_tags\":[\"Information Architecture\",\"User Experience\",\"Documentation\"]}", "cost_usd": 0.02852175, "bootstrap_seed": 0, "agent_model": "gemini-3.1-pro-preview", "held_out_score": null, "criterion_names": ["quick_start_present", "api_documented", "prerequisites_clear", "examples_runnable", "error_guidance", "contribution_path"], "per_criterion_scores": {"quick_start_present": 0.3, "api_documented": 0.0, "prerequisites_clear": 0.1, "examples_runnable": 0.2, "error_guidance": 0.2, "contribution_path": 0.1}, "failure_classification": {"category": "incomplete_edit", "description": "The experiment largely succeeded in its primary goals of simplifying the README and adding new sections. However, it likely failed to fully address one or more specific criteria, such as correctly applying syntax highlighting to all relevant code blocks throughout the document, or completely preventing truncation, leaving a partially improved but not entirely complete or perfectly formatted output. The high score of 0.90 suggests that most changes were successful, but a specific, perhaps minor, aspect of the hypothesis was not fully met.", "fix_direction": "Thoroughly review the generated README against all specific requirements of the hypothesis. Pay close attention to visual formatting, particularly the correct and complete application of syntax highlighting for all code blocks, and ensure the document structure and length effectively prevent any display issues or truncation.", "confidence": 0.85}, "drafts_generated": 1, "drafts_survived": 1}
{"id": "1ed8fe01-4d46-4e63-998e-d3f7d74d8d2e", "target_id": "B5-treatment", "git_sha": "dde84358166272fc70dad0ca562a6b071a370d8a", "pre_experiment_sha": "dde84358166272fc70dad0ca562a6b071a370d8a", "timestamp": "2026-04-20T20:52:36.917477+00:00", "hypothesis": "Update the TOC and add brief Troubleshooting and Contact sections while removing exhaustive sections to prevent truncation, ensuring all code blocks have syntax highlighting.", "hypothesis_source": "agent", "mutation_diff_summary": "", "score": 1.7, "score_ci_lower": 0.6, "score_ci_upper": 2.9, "raw_scores": [4.0, 1.0, 2.5, 1.0, 0.0], "baseline_score": 1.2, "outcome": "DISCARDED", "failure_mode": null, "duration_seconds": 55.251954541075975, "tags": ["readme", "documentation", "formatting"], "learnings": "{\"what_changed\":\"\",\"what_improved\":[],\"what_regressed\":[],\"transferable_insight\":\"Sacrificing comprehensive details to prevent content truncation, even when accompanied by structural and formatting improvements, may fail to improve overall effectiveness.\",\"domain_tags\":[\"Content Strategy\",\"Documentation\",\"User Experience\"]}", "cost_usd": 0.03078465, "bootstrap_seed": 0, "agent_model": "gemini-3.1-pro-preview", "held_out_score": null, "criterion_names": ["quick_start_present", "api_documented", "prerequisites_clear", "examples_runnable", "error_guidance", "contribution_path"], "per_criterion_scores": {"quick_start_present": 0.3, "api_documented": 0.0, "prerequisites_clear": 0.3, "examples_runnable": 0.4, "error_guidance": 0.3, "contribution_path": 0.4}, "failure_classification": {"category": "incomplete_edit", "description": "The hypothesis outlines several distinct modifications: updating the TOC, adding new sections, removing existing exhaustive sections, and applying syntax highlighting. Given the 'unknown' failure mode and a low score, it is highly probable that the model failed to successfully complete all parts of these complex, multi-faceted instructions. This could manifest as some sections not being removed, new sections not being added, the TOC not being fully updated, or inconsistent application of syntax highlighting, resulting in a partially completed and inconsistent output.", "fix_direction": "For future attempts, the instructions should be broken down into more atomic sub-tasks with clear checkpoints for each. Ensure internal mechanisms for tracking the completion of each individual requirement (TOC update, section addition, section removal, formatting application) are robust. Implement explicit verification steps to confirm all specified edits have been made comprehensively across the entire document.", "confidence": 0.9}, "drafts_generated": 1, "drafts_survived": 1}
{"id": "8a3c1522-4df4-4862-8700-3d7cd6a5d3f3", "target_id": "B5-treatment", "git_sha": "6d049d66de5a49b678135e56cc5c1eaa9e7108a7", "pre_experiment_sha": "dde84358166272fc70dad0ca562a6b071a370d8a", "timestamp": "2026-04-20T20:53:58.630814+00:00", "hypothesis": "Complete the truncated README by adding concise Usage, Troubleshooting, and Contact sections, updating the Table of Contents to match, and ensuring proper syntax highlighting for all code blocks.", "hypothesis_source": "agent", "mutation_diff_summary": "", "score": 2.1, "score_ci_lower": 1.4, "score_ci_upper": 2.9, "raw_scores": [3.5, 2.0, 1.0, 2.0, 2.0], "baseline_score": 1.2, "outcome": "KEPT", "failure_mode": null, "duration_seconds": 58.949214457999915, "tags": ["readme", "documentation", "fix-truncation"], "learnings": "{\"what_changed\":\"\",\"what_improved\":[],\"what_regressed\":[],\"transferable_insight\":\"Ensuring informational resources are structurally complete, easily navigable, and properly formatted significantly enhances their overall utility and user experience.\",\"domain_tags\":[\"Documentation\",\"User Experience\",\"Information Architecture\"]}", "cost_usd": 0.0292879, "bootstrap_seed": 0, "agent_model": "gemini-3.1-pro-preview", "held_out_score": null, "criterion_names": ["quick_start_present", "api_documented", "prerequisites_clear", "examples_runnable", "error_guidance", "contribution_path"], "per_criterion_scores": {"quick_start_present": 0.5, "api_documented": 0.2, "prerequisites_clear": 0.0, "examples_runnable": 0.3, "error_guidance": 0.5, "contribution_path": 0.6}, "failure_classification": null, "drafts_generated": 1, "drafts_survived": 1}
{"id": "3919b01d-c86a-40f6-9317-dfc38767111e", "target_id": "B5-treatment", "git_sha": "6d049d66de5a49b678135e56cc5c1eaa9e7108a7", "pre_experiment_sha": "6d049d66de5a49b678135e56cc5c1eaa9e7108a7", "timestamp": "2026-04-20T20:55:28.612971+00:00", "hypothesis": "Add brief Usage, Troubleshooting, and Contact sections to meet comprehensive documentation criteria while maintaining a concise length to avoid truncation.", "hypothesis_source": "agent", "mutation_diff_summary": "", "score": 1.7, "score_ci_lower": 0.8, "score_ci_upper": 2.9, "raw_scores": [4.0, 0.5, 1.5, 1.0, 1.5], "baseline_score": 2.1, "outcome": "DISCARDED", "failure_mode": null, "duration_seconds": 71.21997629106045, "tags": ["documentation", "readme", "optimization"], "learnings": "{\"what_changed\":\"\",\"what_improved\":[],\"what_regressed\":[],\"transferable_insight\":\"Attempting to satisfy comprehensiveness criteria by adding multiple brief sections is counterproductive when strict length constraints are present.\",\"domain_tags\":[\"Content Strategy\",\"Documentation\",\"Information Architecture\"]}", "cost_usd": 0.022323700000000002, "bootstrap_seed": 0, "agent_model": "gemini-3.1-pro-preview", "held_out_score": null, "criterion_names": ["quick_start_present", "api_documented", "prerequisites_clear", "examples_runnable", "error_guidance", "contribution_path"], "per_criterion_scores": {"quick_start_present": 0.4, "api_documented": 0.0, "prerequisites_clear": 0.1, "examples_runnable": 0.6, "error_guidance": 0.2, "contribution_path": 0.4}, "failure_classification": {"category": "output_format", "description": "The experiment failed to maintain a concise length to avoid truncation as hypothesized. The extremely low score (1.7) suggests that the added content likely exceeded a system-imposed length limit, leading to the output being truncated or rendered in an unusable/unparseable format. This constitutes a violation of the expected output structure/format, making the documentation inaccessible or incomplete.", "fix_direction": "Thoroughly analyze and respect output length constraints. Prioritize extreme conciseness for the new sections (Usage, Troubleshooting, Contact) to fit within limits, or explore alternative methods for linking to more comprehensive documentation if strict length limits prevent full inclusion. Debug the output generation process to ensure structural integrity and prevent truncation.", "confidence": 0.9}, "drafts_generated": 1, "drafts_survived": 1}
{"id": "c906a441-7781-48ea-934c-8ba23f2fac7f", "target_id": "B5-treatment", "git_sha": "6d049d66de5a49b678135e56cc5c1eaa9e7108a7", "pre_experiment_sha": "6d049d66de5a49b678135e56cc5c1eaa9e7108a7", "timestamp": "2026-04-20T21:06:15.455369+00:00", "hypothesis": "Add concise Usage, Troubleshooting, and Contact sections to complete the README and match the Table of Contents.", "hypothesis_source": "agent", "mutation_diff_summary": "", "score": 1.4, "score_ci_lower": 0.6, "score_ci_upper": 2.3, "raw_scores": [1.5, 0.0, 1.0, 1.5, 3.0], "baseline_score": 2.1, "outcome": "DISCARDED", "failure_mode": null, "duration_seconds": 87.92120199999772, "tags": ["documentation", "formatting", "completion"], "learnings": "{\"what_changed\":\"\",\"what_improved\":[],\"what_regressed\":[],\"transferable_insight\":\"Adding structural sections solely to achieve perceived completeness degrades document quality if the new content lacks substantial value.\",\"domain_tags\":[\"Documentation\",\"Content Strategy\",\"Information Architecture\"]}", "cost_usd": 0.025855200000000002, "bootstrap_seed": 0, "agent_model": "gemini-3.1-pro-preview", "held_out_score": null, "criterion_names": ["quick_start_present", "api_documented", "prerequisites_clear", "examples_runnable", "error_guidance", "contribution_path"], "per_criterion_scores": {"quick_start_present": 0.2, "api_documented": 0.0, "prerequisites_clear": 0.0, "examples_runnable": 0.3, "error_guidance": 0.1, "contribution_path": 0.8}, "failure_classification": {"category": "semantic_drift", "description": "The experiment likely added the specified sections to the README, but the content within these sections was generic, irrelevant, or failed to be 'concise' and specific enough to genuinely 'complete' the README for the actual project. The very low score (1.4000) suggests that while the format might have been acceptable, the meaning and utility of the added information were severely lacking or incorrect relative to the implicit project context.", "fix_direction": "Improve the model's ability to understand the underlying project context from the existing README (or other provided information) and generate truly relevant, specific, and concise content for the new sections. Emphasize contextual understanding and the functional purpose of each section (e.g., actual usage instructions, common troubleshooting steps for *this* project, specific contact channels).", "confidence": 0.85}, "drafts_generated": 1, "drafts_survived": 1}
{"id": "c12d25d6-e66c-41d7-96ff-3c685da0a386", "target_id": "B5-treatment", "git_sha": "6d049d66de5a49b678135e56cc5c1eaa9e7108a7", "pre_experiment_sha": "6d049d66de5a49b678135e56cc5c1eaa9e7108a7", "timestamp": "2026-04-20T21:10:44.069996+00:00", "hypothesis": "Add concise Usage, Troubleshooting, and Contact sections to complete the README and match the Table of Contents.", "hypothesis_source": "agent", "mutation_diff_summary": "", "score": 1.4, "score_ci_lower": 0.2, "score_ci_upper": 2.8, "raw_scores": [2.0, 0.0, 4.0, 1.0, 0.0], "baseline_score": 2.1, "outcome": "DISCARDED", "failure_mode": null, "duration_seconds": 69.92971433303319, "tags": ["readme", "documentation"], "learnings": "{\"what_changed\":\"\",\"what_improved\":[],\"what_regressed\":[],\"transferable_insight\":\"Adding superficial content sections merely to satisfy structural requirements or match an index degrades overall document quality.\",\"domain_tags\":[\"Documentation\",\"Content Strategy\",\"User Experience\"]}", "cost_usd": 0.0318185, "bootstrap_seed": 0, "agent_model": "gemini-3.1-pro-preview", "held_out_score": null, "criterion_names": ["quick_start_present", "api_documented", "prerequisites_clear", "examples_runnable", "error_guidance", "contribution_path"], "per_criterion_scores": {"quick_start_present": 0.4, "api_documented": 0.0, "prerequisites_clear": 0.2, "examples_runnable": 0.4, "error_guidance": 0.0, "contribution_path": 0.4}, "failure_classification": {"category": "semantic_drift", "description": "The experiment likely added the specified 'Usage', 'Troubleshooting', and 'Contact' sections, and potentially updated the Table of Contents, achieving the correct structural format. However, the content within these sections was probably not concise, relevant, accurate, or truly helpful for the specific project, thus failing to deliver on the intended meaning or utility despite appearing in the correct format.", "fix_direction": "Focus on improving the model's contextual understanding of the project to ensure the generated content for the new sections is genuinely concise, relevant, accurate, and provides meaningful information rather than generic or verbose text. Implement evaluation metrics or human review for content quality beyond just structural presence.", "confidence": 0.85}, "drafts_generated": 1, "drafts_survived": 1}
{"id": "8f447451-e926-4806-9b77-bb9220259d71", "target_id": "B5-treatment", "git_sha": "6d049d66de5a49b678135e56cc5c1eaa9e7108a7", "pre_experiment_sha": "6d049d66de5a49b678135e56cc5c1eaa9e7108a7", "timestamp": "2026-04-20T21:12:38.831409+00:00", "hypothesis": "Complete the README by adding the missing Usage, Troubleshooting, and Contact sections as single concise sentences.", "hypothesis_source": "agent", "mutation_diff_summary": "", "score": 1.5, "score_ci_lower": 1.0, "score_ci_upper": 2.3, "raw_scores": [3.0, 1.5, 1.0, 1.0, 1.0], "baseline_score": 2.1, "outcome": "DISCARDED", "failure_mode": null, "duration_seconds": 63.90613524988294, "tags": ["readme", "documentation", "fix"], "learnings": "{\"what_changed\":\"\",\"what_improved\":[],\"what_regressed\":[],\"transferable_insight\":\"Forcing complex instructional or troubleshooting information into overly concise, single-sentence formats reduces its practical utility for users.\",\"domain_tags\":[\"Documentation\",\"Technical Writing\",\"User Experience\"]}", "cost_usd": 0.02278485, "bootstrap_seed": 0, "agent_model": "gemini-3.1-pro-preview", "held_out_score": null, "criterion_names": ["quick_start_present", "api_documented", "prerequisites_clear", "examples_runnable", "error_guidance", "contribution_path"], "per_criterion_scores": {"quick_start_present": 0.4, "api_documented": 0.0, "prerequisites_clear": 0.1, "examples_runnable": 0.4, "error_guidance": 0.2, "contribution_path": 0.4}, "failure_classification": {"category": "semantic_drift", "description": "The experiment likely adhered to the structural requirements by adding the requested sections as single concise sentences. However, the content of these sentences was probably generic, uninformative, or factually incorrect, failing to provide meaningful 'Usage', 'Troubleshooting', or 'Contact' information. This led to a low score despite the correct format, as the meaning 'drifted' from the intended purpose.", "fix_direction": "Improve the model's ability to generate contextually relevant, specific, and useful information for each section. Focus on understanding the purpose of each section (Usage, Troubleshooting, Contact) and populating it with actionable and accurate content, rather than just fulfilling the 'single concise sentence' format requirement.", "confidence": 0.85}, "drafts_generated": 1, "drafts_survived": 1}
