{"id": "5d6a9d29-f1e4-48d9-ac51-e8e16b265a46", "target_id": "B5-treatment", "git_sha": "7810d66d6d860525e3f0a19507c89dd91de5a2c8", "pre_experiment_sha": "5fc6ff846095d42aced65fc3181e4192886dabbe", "timestamp": "2026-04-20T22:00:30.457406+00:00", "hypothesis": "Add standard README sections (Table of Contents, Prerequisites, Examples) and syntax highlighting tags to code blocks to satisfy comprehensive documentation criteria.", "hypothesis_source": "agent", "mutation_diff_summary": "", "score": 1.3, "score_ci_lower": 0.4, "score_ci_upper": 2.5, "raw_scores": [1.5, 0.5, 0.0, 1.0, 3.5], "baseline_score": 0.0, "outcome": "KEPT", "failure_mode": null, "duration_seconds": 91.68229350005277, "tags": ["documentation", "formatting", "readability"], "learnings": "{\"what_changed\":\"\",\"what_improved\":[],\"what_regressed\":[],\"transferable_insight\":\"Enhancing informational content with standardized structural elements, clear prerequisites, practical examples, and proper formatting significantly improves its overall comprehensiveness and usability.\",\"domain_tags\":[\"Documentation\",\"Information Architecture\",\"User Experience\"]}", "cost_usd": 0.03295794999999999, "bootstrap_seed": 0, "agent_model": "gemini-3.1-pro-preview", "held_out_score": null, "criterion_names": ["quick_start_present", "api_documented", "prerequisites_clear", "examples_runnable", "error_guidance", "contribution_path"], "per_criterion_scores": {"quick_start_present": 0.2, "api_documented": 0.2, "prerequisites_clear": 0.2, "examples_runnable": 0.3, "error_guidance": 0.0, "contribution_path": 0.4}, "failure_classification": null, "drafts_generated": 1, "drafts_survived": 1}
{"id": "93269fe6-a151-499c-9f6b-1fc71b78f9f2", "target_id": "B5-treatment", "git_sha": "7810d66d6d860525e3f0a19507c89dd91de5a2c8", "pre_experiment_sha": "7810d66d6d860525e3f0a19507c89dd91de5a2c8", "timestamp": "2026-04-20T22:02:33.009121+00:00", "hypothesis": "Expand the README to include all missing sections from the Table of Contents, using bullet points, numbered lists, bold text, and explicitly tagged code blocks to maximize the binary criteria score.", "hypothesis_source": "agent", "mutation_diff_summary": "", "score": 1.9, "score_ci_lower": 0.7, "score_ci_upper": 3.1, "raw_scores": [4.0, 0.0, 2.5, 1.0, 2.0], "baseline_score": 1.3, "outcome": "DISCARDED", "failure_mode": null, "duration_seconds": 66.30492095812224, "tags": ["documentation", "formatting", "markdown"], "learnings": "{\"what_changed\":\"\",\"what_improved\":[],\"what_regressed\":[],\"transferable_insight\":\"Over-optimizing content to satisfy automated structural metrics can artificially inflate scores while rendering the final output practically unusable.\",\"domain_tags\":[\"Metric Optimization\",\"Content Formatting\",\"Quality Assurance\"]}", "cost_usd": 0.0343323, "bootstrap_seed": 0, "agent_model": "gemini-3.1-pro-preview", "held_out_score": null, "criterion_names": ["quick_start_present", "api_documented", "prerequisites_clear", "examples_runnable", "error_guidance", "contribution_path"], "per_criterion_scores": {"quick_start_present": 0.4, "api_documented": 0.0, "prerequisites_clear": 0.0, "examples_runnable": 0.6, "error_guidance": 0.3, "contribution_path": 0.6}, "failure_classification": {"category": "over_optimization", "description": "The experiment attempted to 'maximize the binary criteria score' by explicitly leveraging specific formatting elements (bullet points, numbered lists, bold text, and code blocks). The low score of 1.9000 indicates that this strategy to game or exploit the evaluation criteria was unsuccessful or even counterproductive, failing to achieve the intended maximization.", "fix_direction": "Re-evaluate the actual scoring mechanism and binary criteria to understand what genuinely contributes to a higher score, rather than assuming superficial formatting will lead to maximization. Focus on the core content, completeness, and accuracy of the 'missing sections' first, and then apply formatting judiciously to enhance readability and structure, not merely to 'game' the evaluation.", "confidence": 0.9}, "drafts_generated": 1, "drafts_survived": 1}
{"id": "434fe3ae-6110-4e5b-8c80-e9124bc9b242", "target_id": "B5-treatment", "git_sha": "7810d66d6d860525e3f0a19507c89dd91de5a2c8", "pre_experiment_sha": "7810d66d6d860525e3f0a19507c89dd91de5a2c8", "timestamp": "2026-04-20T22:03:53.740544+00:00", "hypothesis": "Fleshing out the README with all promised sections, using proper Markdown hierarchies, explicit syntax highlighting for all code blocks, and structured content (bullet points, numbered lists, bold text) to maximize the binary criteria score.", "hypothesis_source": "agent", "mutation_diff_summary": "", "score": 2.2, "score_ci_lower": 1.3, "score_ci_upper": 3.1, "raw_scores": [3.5, 3.0, 2.5, 1.0, 1.0], "baseline_score": 1.3, "outcome": "DISCARDED", "failure_mode": null, "duration_seconds": 57.012411332922056, "tags": ["documentation", "formatting", "markdown"], "learnings": "{\"what_changed\":\"\",\"what_improved\":[],\"what_regressed\":[],\"transferable_insight\":\"Structuring content with clear hierarchies, explicit formatting, and categorized lists significantly improves its performance against strict criteria-based evaluations.\",\"domain_tags\":[\"Documentation\",\"Formatting\",\"Evaluation Metrics\"]}", "cost_usd": 0.0309573, "bootstrap_seed": 0, "agent_model": "gemini-3.1-pro-preview", "held_out_score": null, "criterion_names": ["quick_start_present", "api_documented", "prerequisites_clear", "examples_runnable", "error_guidance", "contribution_path"], "per_criterion_scores": {"quick_start_present": 0.6, "api_documented": 0.2, "prerequisites_clear": 0.3, "examples_runnable": 0.3, "error_guidance": 0.0, "contribution_path": 0.8}, "failure_classification": {"category": "logic_error", "description": "The experiment's underlying assumption that extensive formatting, explicit syntax highlighting, and detailed structuring of the README would maximize the binary criteria score proved incorrect. The strategy for achieving a high score was flawed, as these changes resulted in a low score (2.2) instead of maximizing it.", "fix_direction": "Re-evaluate the actual criteria and scoring mechanism for the 'binary criteria score.' Focus on understanding what specific elements, content, or perhaps even simplicity the scoring system truly values, rather than broadly enhancing presentation based on general best practices. Experiment with minimal, targeted changes informed by a clearer understanding of the evaluation logic.", "confidence": 0.9}, "drafts_generated": 1, "drafts_survived": 1}
{"id": "6d8ff5da-bd53-4d9d-9011-45bcb5aaccfa", "target_id": "B5-treatment", "git_sha": "7810d66d6d860525e3f0a19507c89dd91de5a2c8", "pre_experiment_sha": "7810d66d6d860525e3f0a19507c89dd91de5a2c8", "timestamp": "2026-04-20T22:05:34.825627+00:00", "hypothesis": "Add comprehensive sections, usage examples, and formatting including bold text, lists, and syntax-highlighted code blocks to maximize the binary criteria score.", "hypothesis_source": "agent", "mutation_diff_summary": "", "score": 1.5, "score_ci_lower": 0.3, "score_ci_upper": 2.7, "raw_scores": [3.5, 1.5, 0.0, 2.5, 0.0], "baseline_score": 1.3, "outcome": "DISCARDED", "failure_mode": null, "duration_seconds": 75.05320879188366, "tags": ["documentation", "formatting", "structure"], "learnings": "{\"what_changed\":\"\",\"what_improved\":[],\"what_regressed\":[],\"transferable_insight\":\"Incorporating rich formatting, structural elements, and concrete examples can positively impact performance metrics, even if the overall approach is ultimately discarded.\",\"domain_tags\":[\"Content Structuring\",\"Formatting\",\"Prompt Engineering\"]}", "cost_usd": 0.03274875, "bootstrap_seed": 0, "agent_model": "gemini-3.1-pro-preview", "held_out_score": null, "criterion_names": ["quick_start_present", "api_documented", "prerequisites_clear", "examples_runnable", "error_guidance", "contribution_path"], "per_criterion_scores": {"quick_start_present": 0.3, "api_documented": 0.1, "prerequisites_clear": 0.2, "examples_runnable": 0.4, "error_guidance": 0.3, "contribution_path": 0.2}, "failure_classification": {"category": "semantic_drift", "description": "The experiment aimed to add comprehensive and well-formatted content. The low score (1.5000) suggests that even if the formatting was applied correctly, the *content itself* (e.g., the added sections or usage examples) was not relevant, accurate, or helpful enough to improve the score. This indicates a drift from the intended semantic quality or a misunderstanding of what 'comprehensive' and 'useful' meant in the context of the binary criteria score.", "fix_direction": "Focus on improving the *quality, relevance, and accuracy* of the added content (sections, examples) rather than just their presence or formatting. Ensure the generated information genuinely contributes to the task's objectives and aligns with the criteria for maximizing the score.", "confidence": 0.8}, "drafts_generated": 1, "drafts_survived": 1}
{"id": "3a648226-7a88-4296-ad59-aa9dea438071", "target_id": "B5-treatment", "git_sha": "7810d66d6d860525e3f0a19507c89dd91de5a2c8", "pre_experiment_sha": "7810d66d6d860525e3f0a19507c89dd91de5a2c8", "timestamp": "2026-04-20T22:07:14.594774+00:00", "hypothesis": "Add an Examples section with tagged code blocks and trim the Table of Contents to avoid promising missing sections, matching the documentation criteria.", "hypothesis_source": "agent", "mutation_diff_summary": "", "score": 1.4, "score_ci_lower": 0.2, "score_ci_upper": 2.6, "raw_scores": [3.0, 0.0, 0.0, 1.0, 3.0], "baseline_score": 1.3, "outcome": "DISCARDED", "failure_mode": null, "duration_seconds": 48.12727562501095, "tags": ["documentation", "formatting", "structure"], "learnings": "{\"what_changed\":\"\",\"what_improved\":[],\"what_regressed\":[],\"transferable_insight\":\"Removing unfulfilled promises from navigational elements and adding isolated examples is insufficient to drive meaningful performance improvements.\",\"domain_tags\":[\"Content Strategy\",\"User Experience\",\"Documentation\"]}", "cost_usd": 0.02726145, "bootstrap_seed": 0, "agent_model": "gemini-3.1-pro-preview", "held_out_score": null, "criterion_names": ["quick_start_present", "api_documented", "prerequisites_clear", "examples_runnable", "error_guidance", "contribution_path"], "per_criterion_scores": {"quick_start_present": 0.4, "api_documented": 0.2, "prerequisites_clear": 0.0, "examples_runnable": 0.4, "error_guidance": 0.1, "contribution_path": 0.3}, "failure_classification": {"category": "incomplete_edit", "description": "The experiment likely failed because it did not fully implement all aspects of the hypothesis, or executed them partially. This could mean the 'Examples section with tagged code blocks' was either not fully created, or the code blocks were not correctly tagged. Alternatively, the 'Table of Contents' might not have been sufficiently trimmed to avoid promising all missing sections, or both tasks were completed partially or incorrectly, leading to the documentation not meeting the specified criteria.", "fix_direction": "Systematically verify each part of the hypothesis. First, confirm the presence and correct formatting (including tags) of the 'Examples section' according to the documentation criteria. Second, meticulously check the 'Table of Contents' to ensure all entries correspond to existing content and no missing sections are promised. Address any remaining discrepancies to fully align with the documentation criteria.", "confidence": 0.8}, "drafts_generated": 1, "drafts_survived": 1}
{"id": "9ecfbabc-87e4-423a-81b5-3b50bbbbfc52", "target_id": "B5-treatment", "git_sha": "7810d66d6d860525e3f0a19507c89dd91de5a2c8", "pre_experiment_sha": "7810d66d6d860525e3f0a19507c89dd91de5a2c8", "timestamp": "2026-04-20T22:08:43.640183+00:00", "hypothesis": "Simplify the Table of Contents to remove missing promised sections and add a concise Examples section with a properly tagged code block.", "hypothesis_source": "agent", "mutation_diff_summary": "", "score": 1.1, "score_ci_lower": 0.2, "score_ci_upper": 2.3, "raw_scores": [3.5, 1.0, 0.0, 1.0, 0.0], "baseline_score": 1.3, "outcome": "DISCARDED", "failure_mode": null, "duration_seconds": 66.95291054085828, "tags": ["documentation", "markdown", "structure", "formatting"], "learnings": "{\"what_changed\":\"\",\"what_improved\":[],\"what_regressed\":[],\"transferable_insight\":\"Removing structural placeholders from navigation elements while simultaneously introducing condensed examples can negatively impact user experience by violating navigational expectations.\",\"domain_tags\":[\"Documentation\",\"User Experience\",\"Content Strategy\"]}", "cost_usd": 0.019063149999999997, "bootstrap_seed": 0, "agent_model": "gemini-3.1-pro-preview", "held_out_score": null, "criterion_names": ["quick_start_present", "api_documented", "prerequisites_clear", "examples_runnable", "error_guidance", "contribution_path"], "per_criterion_scores": {"quick_start_present": 0.2, "api_documented": 0.0, "prerequisites_clear": 0.0, "examples_runnable": 0.3, "error_guidance": 0.2, "contribution_path": 0.4}, "failure_classification": {"category": "semantic_drift", "description": "The hypothesis contains subjective terms such as 'remove missing promised sections' and 'add a concise Examples section'. The model likely misinterpreted what constituted 'missing promised' or 'concise', leading to an output that structurally met some criteria but failed to capture the intended meaning or quality. For instance, it might have removed incorrect sections, or the 'Examples' section might not have been concise or relevant enough, resulting in a low score.", "fix_direction": "Refine the hypothesis by providing more objective and measurable criteria for 'missing promised sections' (e.g., specify how to determine if a section is missing) and 'concise' (e.g., define a maximum length or specific content requirements for examples). Include clear examples of desired output for both the Table of Contents structure and the 'Examples' section, including the properly tagged code block.", "confidence": 0.85}, "drafts_generated": 1, "drafts_survived": 1}
{"id": "4860544d-0851-4ab6-8e5a-181be371b52b", "target_id": "B5-treatment", "git_sha": "7810d66d6d860525e3f0a19507c89dd91de5a2c8", "pre_experiment_sha": "7810d66d6d860525e3f0a19507c89dd91de5a2c8", "timestamp": "2026-04-20T22:11:06.381972+00:00", "hypothesis": "Add the missing Examples section with a tagged bash code block, adhering to the restriction against new lists or bold text.", "hypothesis_source": "agent", "mutation_diff_summary": "", "score": 0.1, "score_ci_lower": 0.0, "score_ci_upper": 0.3, "raw_scores": [0.0, 0.0, 0.0, 0.5, 0.0], "baseline_score": 1.3, "outcome": "DISCARDED", "failure_mode": null, "duration_seconds": 59.39529583300464, "tags": ["documentation", "examples", "formatting"], "learnings": "{\"what_changed\":\"\",\"what_improved\":[],\"what_regressed\":[],\"transferable_insight\":\"Introducing new structural sections that require formatting workarounds to comply with strict negative constraints often degrades overall output quality.\",\"domain_tags\":[\"Formatting Constraints\",\"Content Structuring\",\"Instruction Following\"]}", "cost_usd": 0.0172927, "bootstrap_seed": 0, "agent_model": "gemini-3.1-pro-preview", "held_out_score": null, "criterion_names": ["quick_start_present", "api_documented", "prerequisites_clear", "examples_runnable", "error_guidance", "contribution_path"], "per_criterion_scores": {"quick_start_present": 0.0, "api_documented": 0.0, "prerequisites_clear": 0.0, "examples_runnable": 0.0, "error_guidance": 0.0, "contribution_path": 0.1}, "failure_classification": {"category": "output_format", "description": "The experiment failed to correctly implement the requested structural changes and formatting constraints. This could include failing to add the 'Examples' section entirely, omitting the required tagged bash code block, using incorrect tagging (e.g., not `bash`), or violating the restriction against adding new lists or bold text. The extremely low score (0.1) indicates a significant deviation from the expected output format and structure.", "fix_direction": "Focus on ensuring precise adherence to the specified output structure, including the correct placement and content of new sections, accurate code block syntax with the specified language tag (`bash`), and strict enforcement of all negative formatting constraints (e.g., no new lists or bold text). Implement checks to validate the presence and correctness of all required elements in the output.", "confidence": 0.95}, "drafts_generated": 1, "drafts_survived": 1}
{"id": "21c3c2b0-6ec6-4d86-87ec-aaf11ec61646", "target_id": "B5-treatment", "git_sha": "7810d66d6d860525e3f0a19507c89dd91de5a2c8", "pre_experiment_sha": "7810d66d6d860525e3f0a19507c89dd91de5a2c8", "timestamp": "2026-04-20T22:12:35.773725+00:00", "hypothesis": "Add the Examples section with a properly tagged bash code block, avoiding any new bullet points or bold text to prevent semantic drift.", "hypothesis_source": "agent", "mutation_diff_summary": "", "score": 1.1, "score_ci_lower": 0.6, "score_ci_upper": 1.6, "raw_scores": [0.5, 1.5, 1.0, 0.5, 2.0], "baseline_score": 1.3, "outcome": "DISCARDED", "failure_mode": null, "duration_seconds": 69.00528950011358, "tags": ["documentation", "formatting", "examples"], "learnings": "{\"what_changed\":\"\",\"what_improved\":[],\"what_regressed\":[],\"transferable_insight\":\"Artificially restricting standard formatting elements, such as bullet points or bold text, when introducing new content sections can degrade overall effectiveness and readability.\",\"domain_tags\":[\"Content Formatting\",\"Documentation\",\"Information Architecture\"]}", "cost_usd": 0.0217932, "bootstrap_seed": 0, "agent_model": "gemini-3.1-pro-preview", "held_out_score": null, "criterion_names": ["quick_start_present", "api_documented", "prerequisites_clear", "examples_runnable", "error_guidance", "contribution_path"], "per_criterion_scores": {"quick_start_present": 0.4, "api_documented": 0.0, "prerequisites_clear": 0.3, "examples_runnable": 0.1, "error_guidance": 0.0, "contribution_path": 0.3}, "failure_classification": {"category": "semantic_drift", "description": "The experiment likely failed because the output included new bullet points or bold text within the 'Examples section' or related content, which was explicitly instructed to be avoided 'to prevent semantic drift'. This indicates a failure to adhere to the specified constraints on formatting and content presentation.", "fix_direction": "Improve the model's ability to interpret and strictly adhere to negative constraints and specific formatting rules, especially when these rules are tied to preventing semantic changes or misinterpretations.", "confidence": 0.95}, "drafts_generated": 1, "drafts_survived": 1}
{"id": "52a5570d-08d0-4aed-ac38-3a4c2352bcd2", "target_id": "B5-treatment", "git_sha": "7810d66d6d860525e3f0a19507c89dd91de5a2c8", "pre_experiment_sha": "7810d66d6d860525e3f0a19507c89dd91de5a2c8", "timestamp": "2026-04-20T22:13:50.340236+00:00", "hypothesis": "Add the Examples section with a tagged code block, avoiding any new bullet points or bold text, while retaining existing sections.", "hypothesis_source": "agent", "mutation_diff_summary": "", "score": 1.2, "score_ci_lower": 0.6, "score_ci_upper": 1.8, "raw_scores": [2.0, 0.5, 1.0, 2.0, 0.5], "baseline_score": 1.3, "outcome": "DISCARDED", "failure_mode": null, "duration_seconds": 56.212847125018016, "tags": ["documentation", "formatting", "addition"], "learnings": "{\"what_changed\":\"\",\"what_improved\":[],\"what_regressed\":[],\"transferable_insight\":\"Introducing new supplementary content while strictly avoiding standard formatting elements like bullet points or bold text can degrade readability and negatively impact user experience.\",\"domain_tags\":[\"Content Strategy\",\"Readability\",\"Formatting\"]}", "cost_usd": 0.024582549999999998, "bootstrap_seed": 0, "agent_model": "gemini-3.1-pro-preview", "held_out_score": null, "criterion_names": ["quick_start_present", "api_documented", "prerequisites_clear", "examples_runnable", "error_guidance", "contribution_path"], "per_criterion_scores": {"quick_start_present": 0.3, "api_documented": 0.0, "prerequisites_clear": 0.1, "examples_runnable": 0.0, "error_guidance": 0.2, "contribution_path": 0.6}, "failure_classification": {"category": "output_format", "description": "The model likely failed to correctly generate the 'Examples' section, or the 'tagged code block' within it was missing, malformed, or not properly tagged. Additionally, it might have introduced new bullet points or bold text despite the negative constraint, violating the specified output format for the new content.", "fix_direction": "Improve the model's ability to consistently generate new sections as specified, adhere to precise content formatting requirements (e.g., tagged code blocks), and respect negative formatting constraints (e.g., 'no new bullet points or bold text') for newly introduced content.", "confidence": 0.9}, "drafts_generated": 1, "drafts_survived": 1}
