{"id":"9d553f53-3b1c-489f-a4fa-fb2566a41eb7","target_id":"B3-greedy","git_sha":"2451d34d3f5b3b0878a2b4d4116f3edacddba8c4","pre_experiment_sha":"dad61e82862291b0d976c032fc66a97ba6f84319","timestamp":"2026-04-02T20:26:39.318703+00:00","hypothesis":"No hypothesis provided","hypothesis_source":"synthesized","mutation_diff_summary":"","score":185.08,"score_ci_lower":null,"score_ci_upper":null,"raw_scores":null,"baseline_score":483.86,"outcome":"KEPT","failure_mode":null,"duration_seconds":67.28634849993978,"tags":[],"learnings":"{\"what_changed\":\"\",\"what_improved\":[],\"what_regressed\":[],\"transferable_insight\":\"No hypothesis provided\",\"domain_tags\":[]}","cost_usd":0.19570965,"bootstrap_seed":0,"agent_model":"claude-sonnet-4-6","held_out_score":null,"criterion_names":null,"per_criterion_scores":null,"failure_classification":null,"drafts_generated":1,"drafts_survived":1}
{"id":"2302ab75-ad1b-497c-aafb-633a69e9d7df","target_id":"B3-greedy","git_sha":"0170620bd848fcc9d0ecb0de0d0be19e8a98ca83","pre_experiment_sha":"2451d34d3f5b3b0878a2b4d4116f3edacddba8c4","timestamp":"2026-04-02T20:41:37.225598+00:00","hypothesis":"No hypothesis provided","hypothesis_source":"synthesized","mutation_diff_summary":"","score":108.9,"score_ci_lower":null,"score_ci_upper":null,"raw_scores":null,"baseline_score":185.08,"outcome":"KEPT","failure_mode":null,"duration_seconds":296.39328245900106,"tags":[],"learnings":"{\"what_changed\":\"\",\"what_improved\":[],\"what_regressed\":[],\"transferable_insight\":\"No hypothesis provided\",\"domain_tags\":[]}","cost_usd":0.6020371499999998,"bootstrap_seed":0,"agent_model":"claude-sonnet-4-6","held_out_score":null,"criterion_names":null,"per_criterion_scores":null,"failure_classification":null,"drafts_generated":1,"drafts_survived":1}
{"id":"57d0ac4e-0eea-4160-845c-56077e130af9","target_id":"B3-greedy","git_sha":"e9979130c7229cfb8af3287c21e56dbcdf447124","pre_experiment_sha":"0170620bd848fcc9d0ecb0de0d0be19e8a98ca83","timestamp":"2026-04-02T20:45:21.263611+00:00","hypothesis":"No hypothesis provided","hypothesis_source":"synthesized","mutation_diff_summary":"","score":100.35,"score_ci_lower":null,"score_ci_upper":null,"raw_scores":null,"baseline_score":108.9,"outcome":"KEPT","failure_mode":null,"duration_seconds":223.59740829200018,"tags":[],"learnings":"{\"what_changed\":\"\",\"what_improved\":[],\"what_regressed\":[],\"transferable_insight\":\"No hypothesis provided\",\"domain_tags\":[]}","cost_usd":0.45017909999999994,"bootstrap_seed":0,"agent_model":"claude-sonnet-4-6","held_out_score":null,"criterion_names":null,"per_criterion_scores":null,"failure_classification":null,"drafts_generated":1,"drafts_survived":1}
{"id":"4f9e2717-79cc-4cd0-95fd-ac02944cad62","target_id":"B3-greedy","git_sha":"bb1c5870620efd0036f3a7e4de1858d7fd51d058","pre_experiment_sha":"e9979130c7229cfb8af3287c21e56dbcdf447124","timestamp":"2026-04-02T20:49:45.748869+00:00","hypothesis":"No hypothesis provided","hypothesis_source":"synthesized","mutation_diff_summary":"","score":98.16,"score_ci_lower":null,"score_ci_upper":null,"raw_scores":null,"baseline_score":100.35,"outcome":"KEPT","failure_mode":null,"duration_seconds":264.02011083299294,"tags":[],"learnings":"{\"what_changed\":\"\",\"what_improved\":[],\"what_regressed\":[],\"transferable_insight\":\"No hypothesis provided\",\"domain_tags\":[]}","cost_usd":0.49385295000000007,"bootstrap_seed":0,"agent_model":"claude-sonnet-4-6","held_out_score":null,"criterion_names":null,"per_criterion_scores":null,"failure_classification":null,"drafts_generated":1,"drafts_survived":1}
{"id":"4ebee22f-dda0-4c62-9161-481dd599825a","target_id":"B3-greedy","git_sha":"bb1c5870620efd0036f3a7e4de1858d7fd51d058","pre_experiment_sha":"bb1c5870620efd0036f3a7e4de1858d7fd51d058","timestamp":"2026-04-02T21:08:11.674623+00:00","hypothesis":"No hypothesis provided","hypothesis_source":"synthesized","mutation_diff_summary":"","score":99999.0,"score_ci_lower":null,"score_ci_upper":null,"raw_scores":null,"baseline_score":98.16,"outcome":"DISCARDED","failure_mode":null,"duration_seconds":352.71736000000965,"tags":[],"learnings":"{\"what_changed\":\"\",\"what_improved\":[],\"what_regressed\":[],\"transferable_insight\":\"No hypothesis provided\",\"domain_tags\":[]}","cost_usd":0.5684444999999999,"bootstrap_seed":0,"agent_model":"claude-sonnet-4-6","held_out_score":null,"criterion_names":null,"per_criterion_scores":null,"failure_classification":{"category":"output_format","description":"The score value '99999.0000' is implausible and suggests a violation of output structure or schema, likely not conforming to expected result ranges.","fix_direction":"Ensure output values fall within allowed or expected ranges per schema specification.","confidence":0.9},"drafts_generated":1,"drafts_survived":1}
{"id":"c60fdbcb-c404-4617-96b0-701b072086be","target_id":"B3-greedy","git_sha":"bb1c5870620efd0036f3a7e4de1858d7fd51d058","pre_experiment_sha":"bb1c5870620efd0036f3a7e4de1858d7fd51d058","timestamp":"2026-04-02T21:28:06.306999+00:00","hypothesis":"No hypothesis provided","hypothesis_source":"synthesized","mutation_diff_summary":"","score":99999.0,"score_ci_lower":null,"score_ci_upper":null,"raw_scores":null,"baseline_score":98.16,"outcome":"DISCARDED","failure_mode":null,"duration_seconds":591.196668208926,"tags":[],"learnings":"{\"what_changed\":\"\",\"what_improved\":[],\"what_regressed\":[],\"transferable_insight\":\"No hypothesis provided\",\"domain_tags\":[]}","cost_usd":0.9465039499999999,"bootstrap_seed":0,"agent_model":"claude-sonnet-4-6","held_out_score":null,"criterion_names":null,"per_criterion_scores":null,"failure_classification":{"category":"output_format","description":"The score field contains an invalid value ('99999.0000') that likely violates expected limits or type constraints of the output schema.","fix_direction":"Enforce valid value ranges and correct data types for all fields, especially numeric scores.","confidence":0.85},"drafts_generated":1,"drafts_survived":1}
{"id":"3793437c-3e80-479e-8747-6a00c46e042c","target_id":"B3-greedy","git_sha":"6252e691858aa8562a8094fa4408604c7f388f0e","pre_experiment_sha":"bb1c5870620efd0036f3a7e4de1858d7fd51d058","timestamp":"2026-04-02T21:34:42.512992+00:00","hypothesis":"No hypothesis provided","hypothesis_source":"synthesized","mutation_diff_summary":"","score":12.56,"score_ci_lower":null,"score_ci_upper":null,"raw_scores":null,"baseline_score":98.16,"outcome":"KEPT","failure_mode":null,"duration_seconds":394.0614731250098,"tags":[],"learnings":"{\"what_changed\":\"\",\"what_improved\":[],\"what_regressed\":[],\"transferable_insight\":\"No hypothesis provided\",\"domain_tags\":[]}","cost_usd":0.5785152,"bootstrap_seed":0,"agent_model":"claude-sonnet-4-6","held_out_score":null,"criterion_names":null,"per_criterion_scores":null,"failure_classification":null,"drafts_generated":1,"drafts_survived":1}
{"id":"880a1d7a-755a-47d3-83c3-25d58f861221","target_id":"B3-greedy","git_sha":"6252e691858aa8562a8094fa4408604c7f388f0e","pre_experiment_sha":"6252e691858aa8562a8094fa4408604c7f388f0e","timestamp":"2026-04-02T21:44:26.860424+00:00","hypothesis":"No hypothesis provided","hypothesis_source":"synthesized","mutation_diff_summary":"","score":99999.0,"score_ci_lower":null,"score_ci_upper":null,"raw_scores":null,"baseline_score":12.56,"outcome":"DISCARDED","failure_mode":null,"duration_seconds":583.9245009169681,"tags":[],"learnings":"{\"what_changed\":\"\",\"what_improved\":[],\"what_regressed\":[],\"transferable_insight\":\"No hypothesis provided\",\"domain_tags\":[]}","cost_usd":0.9597389,"bootstrap_seed":0,"agent_model":"claude-sonnet-4-6","held_out_score":null,"criterion_names":null,"per_criterion_scores":null,"failure_classification":{"category":"output_format","description":"The score field contains an invalid value (99999.0000), which likely violates the expected output structure or allowable range.","fix_direction":"Ensure the output adheres to all schema and value constraints, particularly for numeric fields like score.","confidence":0.9},"drafts_generated":1,"drafts_survived":1}
{"id":"f5390a06-9020-4e95-873c-68438feb926f","target_id":"B3-greedy","git_sha":"6252e691858aa8562a8094fa4408604c7f388f0e","pre_experiment_sha":"6252e691858aa8562a8094fa4408604c7f388f0e","timestamp":"2026-04-02T21:48:33.428848+00:00","hypothesis":"No hypothesis provided","hypothesis_source":"synthesized","mutation_diff_summary":"","score":12.98,"score_ci_lower":null,"score_ci_upper":null,"raw_scores":null,"baseline_score":12.56,"outcome":"DISCARDED","failure_mode":null,"duration_seconds":244.19019308302086,"tags":[],"learnings":"{\"what_changed\":\"\",\"what_improved\":[],\"what_regressed\":[],\"transferable_insight\":\"No hypothesis provided\",\"domain_tags\":[]}","cost_usd":0.4788853,"bootstrap_seed":0,"agent_model":"claude-sonnet-4-6","held_out_score":null,"criterion_names":null,"per_criterion_scores":null,"failure_classification":{"category":"output_format","description":"The experiment failed due to an output structure or schema violation, as indicated by the lack of a provided hypothesis and an unknown failure mode, which suggests missing or malformed expected fields.","fix_direction":"Ensure the experiment generates outputs that strictly follow the required schema, including all mandatory fields.","confidence":0.85},"drafts_generated":1,"drafts_survived":1}
{"id":"cc57c4e5-599b-4075-b3a0-f99a500b2d52","target_id":"B3-greedy","git_sha":"6252e691858aa8562a8094fa4408604c7f388f0e","pre_experiment_sha":"6252e691858aa8562a8094fa4408604c7f388f0e","timestamp":"2026-04-02T21:52:34.432514+00:00","hypothesis":"No hypothesis provided","hypothesis_source":"synthesized","mutation_diff_summary":"","score":99999.0,"score_ci_lower":null,"score_ci_upper":null,"raw_scores":null,"baseline_score":12.56,"outcome":"DISCARDED","failure_mode":null,"duration_seconds":237.08990162494592,"tags":[],"learnings":"{\"what_changed\":\"\",\"what_improved\":[],\"what_regressed\":[],\"transferable_insight\":\"No hypothesis provided\",\"domain_tags\":[]}","cost_usd":0.43920149999999997,"bootstrap_seed":0,"agent_model":"claude-sonnet-4-6","held_out_score":null,"criterion_names":null,"per_criterion_scores":null,"failure_classification":{"category":"output_format","description":"The provided score value 99999.0000 appears to violate expected output structure or range, and no hypothesis was given. This suggests a schema or format error.","fix_direction":"Verify output structure and ensure all required fields are properly populated and within valid ranges.","confidence":0.95},"drafts_generated":1,"drafts_survived":1}
{"id":"fac24d53-ff84-4ce2-bd1b-79222ece6e4e","target_id":"B3-greedy","git_sha":"6252e691858aa8562a8094fa4408604c7f388f0e","pre_experiment_sha":"6252e691858aa8562a8094fa4408604c7f388f0e","timestamp":"2026-04-02T22:10:42.187016+00:00","hypothesis":"No hypothesis provided","hypothesis_source":"synthesized","mutation_diff_summary":"","score":99999.0,"score_ci_lower":null,"score_ci_upper":null,"raw_scores":null,"baseline_score":12.56,"outcome":"DISCARDED","failure_mode":null,"duration_seconds":484.42925191600807,"tags":[],"learnings":"{\"what_changed\":\"\",\"what_improved\":[],\"what_regressed\":[],\"transferable_insight\":\"No hypothesis provided\",\"domain_tags\":[]}","cost_usd":0.8614781999999997,"bootstrap_seed":0,"agent_model":"claude-sonnet-4-6","held_out_score":null,"criterion_names":null,"per_criterion_scores":null,"failure_classification":{"category":"output_format","description":"The provided score of 99999.0000 indicates a likely violation of the expected output schema or format. Additionally, the absence of a hypothesis and the 'unknown' failure mode suggest missing required fields or an improper output structure.","fix_direction":"Ensure all required fields are filled with valid and expected values, and that numeric fields (such as 'Score') are within plausible ranges.","confidence":0.9},"drafts_generated":1,"drafts_survived":1}
{"id":"d3debba3-635c-4529-ae8b-ebb04dcace44","target_id":"B3-greedy","git_sha":"c000697ca0558ea9d6bf5f3cd0695677ab109d34","pre_experiment_sha":"6252e691858aa8562a8094fa4408604c7f388f0e","timestamp":"2026-04-02T22:39:44.964338+00:00","hypothesis":"No hypothesis provided","hypothesis_source":"synthesized","mutation_diff_summary":"","score":12.46,"score_ci_lower":null,"score_ci_upper":null,"raw_scores":null,"baseline_score":12.56,"outcome":"KEPT","failure_mode":null,"duration_seconds":538.1291462919908,"tags":[],"learnings":"{\"what_changed\":\"\",\"what_improved\":[],\"what_regressed\":[],\"transferable_insight\":\"No hypothesis provided\",\"domain_tags\":[]}","cost_usd":0.8250137999999999,"bootstrap_seed":0,"agent_model":"claude-sonnet-4-6","held_out_score":null,"criterion_names":null,"per_criterion_scores":null,"failure_classification":null,"drafts_generated":1,"drafts_survived":1}
{"id":"73552b0b-0ec9-4fe7-b150-16fbf95ff808","target_id":"B3-greedy","git_sha":"c000697ca0558ea9d6bf5f3cd0695677ab109d34","pre_experiment_sha":"c000697ca0558ea9d6bf5f3cd0695677ab109d34","timestamp":"2026-04-02T22:43:44.780253+00:00","hypothesis":"No hypothesis provided","hypothesis_source":"synthesized","mutation_diff_summary":"","score":99999.0,"score_ci_lower":null,"score_ci_upper":null,"raw_scores":null,"baseline_score":12.46,"outcome":"DISCARDED","failure_mode":null,"duration_seconds":239.13628341595177,"tags":[],"learnings":"{\"what_changed\":\"\",\"what_improved\":[],\"what_regressed\":[],\"transferable_insight\":\"No hypothesis provided\",\"domain_tags\":[]}","cost_usd":0.39390870000000006,"bootstrap_seed":0,"agent_model":"claude-sonnet-4-6","held_out_score":null,"criterion_names":null,"per_criterion_scores":null,"failure_classification":{"category":"output_format","description":"The provided score is an extremely large value (99999.0000) which is atypical and potentially violates expected scoring schema; additionally, the absence of hypothesis and unclear failure mode suggest a possible output structure or schema violation.","fix_direction":"Ensure outputs strictly follow the expected schema, validate score ranges, and check all required fields are present and plausible.","confidence":0.85},"drafts_generated":1,"drafts_survived":1}
