{"id":"5d7b56ae-b584-44b4-be94-4a9c2de1bc93","target_id":"code-minify","git_sha":"bcbb8dd6b2e0639fd488725782a84ea9bd98575c","pre_experiment_sha":"bcbb8dd6b2e0639fd488725782a84ea9bd98575c","timestamp":"2026-03-17T17:36:30.093564+00:00","hypothesis":"No hypothesis provided","hypothesis_source":"synthesized","mutation_diff_summary":"","score":796.0,"score_ci_lower":null,"score_ci_upper":null,"raw_scores":null,"baseline_score":0.0,"outcome":"DISCARDED","failure_mode":null,"duration_seconds":52.66510595893487,"tags":[],"learnings":"","cost_usd":0.16943819999999998,"bootstrap_seed":0}
{"id":"0e0065b9-be9a-4039-8f8e-13543b72ea59","target_id":"code-minify","git_sha":"bcbb8dd6b2e0639fd488725782a84ea9bd98575c","pre_experiment_sha":"bcbb8dd6b2e0639fd488725782a84ea9bd98575c","timestamp":"2026-03-17T18:34:25.434759+00:00","hypothesis":"No hypothesis provided","hypothesis_source":"synthesized","mutation_diff_summary":"","score":432.0,"score_ci_lower":null,"score_ci_upper":null,"raw_scores":null,"baseline_score":0.0,"outcome":"DISCARDED","failure_mode":null,"duration_seconds":259.735342583037,"tags":[],"learnings":"","cost_usd":0.44549325000000006,"bootstrap_seed":0}
{"id":"c8426367-f81b-4b69-937d-b41103b7bd4a","target_id":"code-minify","git_sha":"bcbb8dd6b2e0639fd488725782a84ea9bd98575c","pre_experiment_sha":"bcbb8dd6b2e0639fd488725782a84ea9bd98575c","timestamp":"2026-03-17T18:35:43.428713+00:00","hypothesis":"No hypothesis provided","hypothesis_source":"synthesized","mutation_diff_summary":"","score":458.0,"score_ci_lower":null,"score_ci_upper":null,"raw_scores":null,"baseline_score":0.0,"outcome":"DISCARDED","failure_mode":null,"duration_seconds":77.9917091249954,"tags":[],"learnings":"","cost_usd":0.22315094999999996,"bootstrap_seed":0}
{"id":"1255c17a-27a7-4b04-9d2a-f9b85b774346","target_id":"code-minify","git_sha":"bcbb8dd6b2e0639fd488725782a84ea9bd98575c","pre_experiment_sha":"bcbb8dd6b2e0639fd488725782a84ea9bd98575c","timestamp":"2026-03-17T18:38:46.022302+00:00","hypothesis":"No hypothesis provided","hypothesis_source":"synthesized","mutation_diff_summary":"","score":272.0,"score_ci_lower":null,"score_ci_upper":null,"raw_scores":null,"baseline_score":0.0,"outcome":"DISCARDED","failure_mode":null,"duration_seconds":182.5901187909767,"tags":[],"learnings":"","cost_usd":0.4100346,"bootstrap_seed":0}
{"id":"e825cb7f-6966-4f58-9400-963ef2d56c91","target_id":"code-minify","git_sha":"67343381985e2b05790c29f1cace8511b1100935","pre_experiment_sha":"bcbb8dd6b2e0639fd488725782a84ea9bd98575c","timestamp":"2026-03-17T18:44:26.347373+00:00","hypothesis":"No hypothesis provided","hypothesis_source":"synthesized","mutation_diff_summary":"","score":641.0,"score_ci_lower":null,"score_ci_upper":null,"raw_scores":null,"baseline_score":641.0,"outcome":"KEPT","failure_mode":null,"duration_seconds":85.37835479108617,"tags":[],"learnings":"","cost_usd":0.17339145,"bootstrap_seed":0}
{"id":"f85b29a8-074e-4ef8-953f-0f4c9fb666ef","target_id":"code-minify","git_sha":"2cbdbd3bccdb15a1033d1c2869e6f902199fdeef","pre_experiment_sha":"67343381985e2b05790c29f1cace8511b1100935","timestamp":"2026-03-17T18:53:51.908309+00:00","hypothesis":"No hypothesis provided","hypothesis_source":"synthesized","mutation_diff_summary":"","score":267.0,"score_ci_lower":null,"score_ci_upper":null,"raw_scores":null,"baseline_score":267.0,"outcome":"KEPT","failure_mode":null,"duration_seconds":265.4842767090304,"tags":[],"learnings":"","cost_usd":0.48914489999999994,"bootstrap_seed":0}
{"id":"7e49869d-4a22-4e0f-9fc5-ee0345b677cd","target_id":"code-minify","git_sha":"20babfb6639e3e6e70d95c161f0a23048f89e1fa","pre_experiment_sha":"2cbdbd3bccdb15a1033d1c2869e6f902199fdeef","timestamp":"2026-03-17T18:58:34.835529+00:00","hypothesis":"No hypothesis provided","hypothesis_source":"synthesized","mutation_diff_summary":"","score":245.0,"score_ci_lower":null,"score_ci_upper":null,"raw_scores":null,"baseline_score":245.0,"outcome":"KEPT","failure_mode":null,"duration_seconds":282.9250765419565,"tags":[],"learnings":"","cost_usd":0.5419030499999999,"bootstrap_seed":0}
{"id":"5808ccd4-5fee-4ec6-a87d-002195c43ddc","target_id":"code-minify","git_sha":"cb27cc2d77ed64e6eef43c3fd9b34bde083ece71","pre_experiment_sha":"20babfb6639e3e6e70d95c161f0a23048f89e1fa","timestamp":"2026-03-17T19:01:02.346248+00:00","hypothesis":"No hypothesis provided","hypothesis_source":"synthesized","mutation_diff_summary":"","score":229.0,"score_ci_lower":null,"score_ci_upper":null,"raw_scores":null,"baseline_score":229.0,"outcome":"KEPT","failure_mode":null,"duration_seconds":147.50867437501438,"tags":[],"learnings":"","cost_usd":0.32739389999999996,"bootstrap_seed":0}
{"id":"a696a5bd-b18d-46c9-ac99-a1b38d943fa7","target_id":"code-minify","git_sha":"123593489519b0015dbf09c48c5778b06dbd27db","pre_experiment_sha":"cb27cc2d77ed64e6eef43c3fd9b34bde083ece71","timestamp":"2026-03-17T19:20:58.639633+00:00","hypothesis":"No hypothesis provided","hypothesis_source":"synthesized","mutation_diff_summary":"","score":228.0,"score_ci_lower":null,"score_ci_upper":null,"raw_scores":null,"baseline_score":228.0,"outcome":"KEPT","failure_mode":null,"duration_seconds":458.9196792499861,"tags":[],"learnings":"","cost_usd":0.8156964,"bootstrap_seed":0}
{"id":"6b37b9da-50d5-490a-b189-022449eb0a96","target_id":"code-minify","git_sha":"a3c3fa2dfb05f9426e052b7d079350240833cf38","pre_experiment_sha":"123593489519b0015dbf09c48c5778b06dbd27db","timestamp":"2026-03-18T12:09:40.717306+00:00","hypothesis":"No hypothesis provided","hypothesis_source":"synthesized","mutation_diff_summary":"","score":226.0,"score_ci_lower":null,"score_ci_upper":null,"raw_scores":null,"baseline_score":226.0,"outcome":"KEPT","failure_mode":null,"duration_seconds":257.62186845904216,"tags":["split-print-args","remove-fstring-interpolation"],"learnings":"","cost_usd":0.41829884999999994,"bootstrap_seed":0,"held_out_score":null}
